{"id":"nysun-2003","publication":"nysun","year":"2003","count":251,"puzzles":[{"title":"Themeless Thursday, 1/2/03 (Thursday)","author":"by Patrick Berry / Edited by Peter Gordon (puzzleeditor@nysun.com)","date":"2003-01-02","grid":"RFJFU1NDT0FUI0xBTVBTCk9JTENIQU5HRSNFQkVSVApPUEVSQVRFT04jTUVESUEKREVWSUxTI05FUE9USVNNCkFMRVZFI0ZJVElOI0NPUApEWU5FI1JFRVNFI1BBTkUKIyMjTkVFRFMjUE9PUkVSCkFUVEVORFMjSEFXU0VSUwpTT1JST1cjTUFORVQjIyMKU09VUyNPUEFMUyNNQVJDCk9LUyNaT1JSTyNMT0NBTApPTlRIRURPVCNHT0RJVkEKTk9TRVMjTUlOT1JFRElOCkFUSUxUI09OSU9OUklORwpTRU5EUyNTSVhQRU5DRVM="},{"title":"Round and Round She Goes, 1/3/03 (Friday)","author":"by Jerry E. Rosman / Edited by Peter Gordon (puzzleeditor@nysun.com)","date":"2003-01-03","grid":"SEVBRCNUQUJMRSNMQU1QCkFTSEUjRVRBSUwjT1JFTwpSVEVTI1RBQ1RJQ0lBTlMKREFNUCNPUksjI0FUQkFUCiMjI0lHTklUQUJMRSMjIwojQklURVMjT0xFI1JFU1QKT1JERVIjSVNCTiNTQUtJClZBTCNNQVJRVUVFI1ZJTQpFVkVSI0JBVU0jVEhFUkUKUk9TQSNFVEEjVFJVU1QjCiMjI1dBVEVSU0hFRCMjIwpGUkVTSCMjRUFSI0RSQVcKTEVXSVNTVE9ORSNMRU5PCk9QRUwjUEFOREEjRURFUgpXT1JLI0ZJRUxEI0RPV04="},{"title":"Cardholders, 1/6/03 (Monday)","author":"by Ogden Porter / Edited by Peter Gordon (puzzleeditor@nysun.com)","date":"2003-01-06","grid":"Qk9BI1NQQSNFUlIjU0FUCkFSQyNXT0sjVklBI0FXRQpMRUUjQUJJREVCWSNMQVgKTE9WRURPTkUjI0tNQVJUCiMjRUREWSNVUEdSQURFUwpDQU5BTFMjQ09MT04jIyMKSElUTUUjI0VMSUNJVEVECkVNVSNEQVlCRUQjQVJMTwpXQVJQI1JFSVNFUiNFT04KU1RBUkxJTkcjI0VHWVBUCiMjI01JQVRBI1NDT1BFUwpNWUdBTFNBTCNIRVJBIyMKTE9PTlkjI09OQVNQUkVFCklETyNQUk9XRVNTI0tJWApGRUQjQUlEI0FURSNFUkEKRUxTI0RERSNMQUQjUkVN"},{"title":"An Orderly Affair, 1/7/03 (Tuesday)","author":"by Alan Olschwang / Edited by Peter Gordon (puzzleeditor@nysun.com)","date":"2003-01-07","grid":"QUJDRCNFRkdISSNKS0xNCkJPTEEjQ0FNRU8jRVdBTgpDWkFSI09DRUFOI1RBUk8KRE9XRUwjQU5USSNTTkFQCkVTUyNJVEQjUkFSRSMjIwojIyNBTU9FQkEjRVRTRVEKRkFMTElOI1VTREEjSEVSCkdSRUFUUyNUSEVET09SUwpIT01JTElTVCNBRFJPSVQKSVNNI0VMT0kjRFJBS0VVCkpFQU5TI1VOU0VFTiMjIwojIyNBU1NOI1VOUyNDTFYKS09QUyNBREVOI1NDUkVXCkxPVUQjRkVNVVIjSE9BWApNT01BI0VSSU5TI0FJUlkKTk9QUSNSU1RVViNXWFla"},{"title":"Season Openers, 1/8/03 (Wednesday)","author":"by Sarah Keller / Edited by Peter Gordon (puzzleeditor@nysun.com)","date":"2003-01-08","grid":"UFNTVCNOT0RTI0JBVEhTCk9BSFUjRU5ZQSNBVVJBTApFTEVNI0dJTEwjTkdBSU8KTUFSQkxFQ0FLRSNSSUxFCiMjRUxFVkVOI1BSQVRFUwpURUhFRSMjI0NIQVQjIyMKVVJJI0pVTklPUkhJR0gjCkJBVFMjTkFSQ08jTkFJTAojU0VQVElDVEFOSyNTRUUKIyMjSU5UTCMjI0lERVNUClNWRUxURSNEUkVXSU4jIwpQSUxMI0RFQ0lESU5HT04KSUxJQUQjTENEUyNOSUxFCkNMT05FI1NBR0UjRU5EUwpFQVRFTiNBQkVMI1JFU1Q="},{"title":"\"Are You Coming In?\", 1/9/03 (Thursday)","author":"by Randall J. Hartman / Edited by Peter Gordon (puzzleeditor@nysun.com)","date":"2003-01-09","grid":"U0xBVEUjSEVNSSNIQUxPClRVUklOI0FWSVMjVVNFRApBTEFSTSNWRVRPI01JTkQKUlVCRUFUQVJFVFJFQVQjCiMjIyNTVU4jI09BUiMjIwojI1JVU1RBVEVQUklTT04KR0VFU0UjI0lTRUUjQUdFCkVDSE8jSEFERVMjRUxMRQpBUkEjU0VMQSMjUkFURUQKUlVCQUxMUExBWUVSUyMjCiMjI0JPUCMjUkVDIyMjIwojUlVERUxJVkVSWUJPWVMKUEVSVSNFREVOI0NBTk9FCkVQSUMjU0VSQSNMQVVSQQpQT1NUI1NBWVMjRVNTRU4="},{"title":"Weekend Warrior, 1/10/03 (Friday)","author":"by Brendan Emmett Quigley / Edited by Peter Gordon (puzzleeditor@nysun.com)","date":"2003-01-10","grid":"WUVBSEJVVCMjSE9PSEFTCkFMVE9PTkEjVE9XUk9QRQpXRUlHSElOI0hBTkRGRUQKTkFOI1JPVFRFUlMjRkxBCklOR0UjTklLRVMjRU1JVApOT0xBTiNWT04jQlJBS0UKR1JFR09SWSNERUJPTkVTCiMjI0xPTyMjI0xPVCMjIwpFWFRFTkRTI0ZMWUlOVE8KTkVSVFMjT1VJI1NDT1dMClBSRVMjUk9SRU0jQVhFRApMT0wjS0lOSVNPTiNaRU4KQVhMUk9TRSNUUkFQRVpFCk5FSVRIRVIjQVNTVU1FUwpFRFNFTFMjI1NFQUJBU1M="},{"title":"Gem Settings, 1/13/03 (Monday)","author":"by Jay Leatherman / Edited by Peter Gordon (puzzleeditor@nysun.com)","date":"2003-01-13","grid":"TUFDUyNTTFVNUCNTV0FNCk9QRU4jSEFOT0kjTklMRQpERU1PI1VOVElMI09MR0EKRU1FUkFMRElTTEUjRElOCkxFTlRPIyNFVEFMI0JFRQpUTlQjUkVQIyNSSUdPUlMKIyMjU1RSRUFNIyNMQVNUCiMjUEVBUkxIQVJCT1IjIwpUUkVYIyNFU1RFRU0jIyMKUkVUWVBFIyNFVkEjU0xPCkFMRSNBTktBIyNST1BFUgpQQVIjRElBTU9OREhFQUQKRVhJVCNHUkFERSNHRU5FClpFTk8jTUFaREEjT0RPUgpFREdZI0FURVNUI0RPTlM="},{"title":"Drawing a Blank, 1/14/03 (Tuesday)","author":"by Joe Bower / Edited by Peter Gordon (puzzleeditor@nysun.com)","date":"2003-01-14","grid":"VU1BU1MjQkVBUiNDTFVCCk1BQ0hPI0xVTFUjUklTRQpBREhPQyNBUk9OI09NRU4KIyMjV0lUSE9VVEFXT1JECiNDSEVFUlMjI09ERSMjIwpTSE9SVFkjS0VZUyNQUk8KQVJPTUEjS0lMTyNCRUVOClRPVEFMTFlDTFVFTEVTUwpBTUFUI0FSS1MjU0FESUUKTkVUI0VUQVMjQUNDRU5UCiMjI0FQRSMjU0hBS0VTIwpOT1RISU5HQVRBTEwjIyMKQUxFRSNFQVZFI0FBSEVECkJFTEEjU0xPRSNUQklSRApTT0xEI1NFTkQjRVNTRVM="},{"title":"Three-Star Movies, 1/15/03 (Wednesday)","author":"by Randolph Ross / Edited by Peter Gordon (puzzleeditor@nysun.com)","date":"2003-01-15","grid":"TlVUI0hPUlNFI0FDVE9SCkVUTyNVTklURSNTSE9WRQpXQUdUSEVET0cjQ0FSRUQKVEhPVSNIRVIjREVOSVJPCiMjI1JZRSNFTUVORCMjIwpIT0ZGTUFOI0VORExFU1MKRVNUI0NST0ZUIyNFWFBPCkdPREZBVEhFUlBBUlRJSQpFTElBIyNFTUlSUyNSRUwKTEVYSUNBTCNDT1NUQVJTCiMjI0xBTVBTI05ORSMjIwpQQUNJTk8jVEFVI0FKQVIKQVJFTlQjRElDS1RSQUNZClJJTkdPI0FMTEVOI0lSQQpSQVRTTyNCTFVSVCNMRU4="},{"title":"Themeless Thursday, 1/16/03 (Thursday)","author":"by Bob Peoples / Edited by Peter Gordon (puzzleeditor@nysun.com)","date":"2003-01-16","grid":"VEFLRVNBUklTSyNQT1NFCk9OVEhFQkVOQ0gjVVBPTgpGQU9TQ0hXQVJaI01FTFQKRlRTI1RPUlNJI01BTk9SCkxPTEwjUkFQUEVSI0JJTwpFTElPVCNQT1RUUyNBU1AKUkVOT0lSI1RFQVBBUlRZCiMjI1NFQUwjRElBTiMjIwpCTFVFQ0hJUCNMVVRIRVIKQklOI0xBVkFMI0xFQVZFClFCUyNJTEVORVMjRFJJUApQRVBVUCNXQUdFRCNETEkKSVJFUyNESUNFRE9OSU9OClRJTkUjSVJFTkVEVU5ORQpTQVRTI0RFQURSSU5HRVI="},{"title":"Coined Phrases, 1/17/03 (Friday)","author":"by Ogden Porter / Edited by Peter Gordon (puzzleeditor@nysun.com)","date":"2003-01-17","grid":"V0FTUCNTTElQUyNDUklCCkVYUE8jVEVORVQjQUVSTwpCRUVQI1JBREFSI1JTVlAKIyNFVVJPRk9SRVVSTyMjCk1BRExJQlMjTEFQQUxNQQpTTEVBWkUjIyNNQURFSVQKR0VSVFojQUJDI1RJREFMCiMjI0VVUk9ZRVVSTyMjIwpBRFMjVEFLRU9ORSNTSEUKR09PR09MIyMjUEVQUEVSCkVMU0UjTEVBVkUjRUxMQQojRVVST0lTQ09FVVJPTyMKTU9FI1JFU0VMTFMjVElOCkJVTSNDUkVTVEVEI0NTSQpBVEUjQVNTI0FEQSNIRVg="},{"title":"\"Ch-Ching!\", 1/20/03 (Monday)","author":"by A.J. Santora / Edited by Peter Gordon (puzzleeditor@nysun.com)","date":"2003-01-20","grid":"Q0FQUkkjQVNBUCNEQVNICk9SSU9OI1BFTEUjVUxFRQpXQVRDSENIQUlOI1RJREUKU0xZI09ESU4jTkVDS0VECiMjI0NVRUQjRElUSEVSUwpCTEFIUyMjTElMQUMjIyMKUkVWVUVTI0lSRSNIQVJUCkFWRVIjSElMVFMjRUxJRQpESVNDI09DVCNTSEVJTEEKIyMjSElWRVMjI0FTVEVSClBMQUNLRVQjTUFSRSMjIwpSQUNIRUwjQkFSUyNDU0kKT1JFTyNGUkVOQ0hDSEVGClVHTEkjVU5UTyNFUElDUwpERUFSI0xBSFIjUkFOVE8="},{"title":"Capitalists, 1/21/03 (Tuesday)","author":"by Ogden Porter / Edited by Peter Gordon (puzzleeditor@nysun.com)","date":"2003-01-21","grid":"WkFQI0ZFWiNBTEFNRURBCkVSQSNMRU8jUkVTT0xFRApBSVJCQUxMI0NBUFJJQ0UKTEFURVgjQUpBUiNFVE9OCiMjI05FQSNBTk5PWUVSIwpJUlZJTkcjQ0VTVEEjIyMKU09PVCNBVUsjI1NNT1JFCkFVVE8jSVNMQU0jU05PQgpBR0VTI05PT05TI1RFU1MKQ0VEQVIjI05BTiNFQVNFCiMjI05PU0VEI0JFUkxJTgojU0FUQ0hNTyNDVUQjIyMKV1dJSSNST05TI1JBRElJCkhBREFGSVQjSVNPTUVSUwpJTUFHSU5FI1pJUCNMQU0KTUlOT1JFRCNFUkUjSVFT"},{"title":"Spy Games, 1/22/03 (Wednesday)","author":"by David J. Kahn / Edited by Peter Gordon (puzzleeditor@nysun.com)","date":"2003-01-22","grid":"U0lOUyMjTUVDQ0EjV0lUCkFST08jQ0FSSE9QI0FNQQpGT1JZT1VSUklDRU9OTFkKRU5UI0ZCSSNDT1JESUFMClNISCNUSU5BIyMjSU5UTwpUQUJTI0NPTERGSU5HRVIKI05BSUwjI0xPT04jIyMjCiNEWUVBTk9USEVSREFZIwojIyMjSEVUSCMjSURMRSMKVFVORFJBQkFMTCNTUEFTCk9ORUEjIyNUQU9TI0FSRQpQRVRUSUVSI0RPTiNDTk4KSkFNRVNCT05ETU9WSUVTCk9TRSNUQk9ORVMjSU5SRQpCRU4jT1NURVIjI01PU1M="},{"title":"Under Cover, 1/23/03 (Thursday)","author":"by Dave Tuller / Edited by Peter Gordon (puzzleeditor@nysun.com)","date":"2003-01-23","grid":"UEVEQUwjU0NPVCNDQUxDCkZSRURBI09ISU8jT0JPRQpDUkFaWVFVSUxUI0xPVUQKU1NOI1NUUCMjI1NPVVNBCiMjSk9CU0NPTUZPUlRFUgpQUk9YWSNBRElFVVMjIyMKTEFORSNLTkVMTFMjS0lOCkFHRU5EQSMjI0xFR0FDWQpZRVMjRVJFQ1RTI09SRVMKIyMjU1RFUFBFI1RSQURFClNPVVZFTklSU0hFRVQjIwpJTlRFUiMjI1RBWCNFV0UKR0FJTCNXRVRCTEFOS0VUCkhJTFQjQVJJQSNDQUlSTwpUUkVFI0RBTU4jT0dERU4="},{"title":"Weekend Warrior, 1/24/03 (Friday)","author":"by Byron Walden / Edited by Peter Gordon (puzzleeditor@nysun.com)","date":"2003-01-24","grid":"WUFCSUdMVUcjQ0FUU0lUCk9QRU5MSU5FI0FUSE9NRQpXSU5DRURBVCNCUk9MSU4KWkVCUkFTI0FIT1lNQVRFCkFDT0lOI0xHRSMjQVJBTQpIRVdTI0dPVVJEI1NJVEUKIyMjSVNMQU5ERVIjWkVOCkdIT1NURUQjU0xPV0VTVApMQVYjUkVEU01JVEgjIyMKSVZFUyNNT1RFUyNBR0VSCk1FUkMjI1dPTiNTVEFURQpNQUNBUk9OSSNCSURTT04KRU5BTUVMI0NMQVJJVElOClJBTU9ORSNBSVJFREFMRQpTUEVORFMjTEVOTk9YRVM="},{"title":"Rapid Succession, 1/27/03 (Monday)","author":"by Ed Early / Edited by Peter Gordon (puzzleeditor@nysun.com)","date":"2003-01-27","grid":"VFJZRk9SIyNIQVkjU0FHClJJQUxUTyNQT1JFI0FHTwpJU0xFVFMjVU5JVCNWSUEKTUVMRUVTI0xFRCNKT0xUCiMjI1RSSUxMUyNCT1JFUwpNQU1BUyNFQVRTSU4jIyMKQVhFRCNPRkYjT1pBUktTCkxJQU0jU1RBUlIjVFVOQQpUT05JI0FTU0VUI0hNT1MKQU1UUkFLI1RJUyNBQkNTCiMjI0FNQVpPTiNTTkFLWQpTQ0FMUCNJTlNFVFMjIyMKSFVNUyNBR0UjUk9XRVJTCkVSQSNQVVpPI09MSVZJQQpMSVojSVJBTiNERUZFQ1QKRkVFI1RBRyMjRU5UUkVF"},{"title":"\"T 4 2\", 1/28/03 (Tuesday)","author":"by Lee Glickstein and Nancy Salomon / Edited by Peter Gordon (puzzleeditor@nysun.com)","date":"2003-01-28","grid":"U1VJVCNDTEFXI0hBTFRTClRIT1IjQUlEQSNBTEVSVApQT1dFUlRFQUwjVklERU8KI0hBVk9DI01FUkUjR0VMCiMjI09BSFUjU0lBTUVTRQpUSUVSREVGUkFOQ0UjIyMKQUJBIyNST0UjR09UTUFEClNFUlRBI1NBUCNXRUFWRQpTVE5JQ0sjQ0lBIyNUSUUKIyMjS0lOR1RVVFNURUFNClRIRUlERUEjU1BDQSMjIwpIRVIjVEVSTSNFQVZFUyMKRUxPUEUjVElOQU1FTFRTClJJREVTI0VSSUMjUklPVApFWEVSVCNST1BFI05BUEE="},{"title":"Rainbow Coalition, 1/29/03 (Wednesday)","author":"by Ogden Porter / Edited by Peter Gordon (puzzleeditor@nysun.com)","date":"2003-01-29","grid":"IyNCUkFHI0RFQkkjQklaCiNFUklDVEhFUkVEI1JCSQpBR0VOVE9SQU5HRSNBTVAKTUFXS0lTSCMjTEFQUyMjCk9ERVMjIyNDVUUjQUlMUwpTU1IjTEVNT05ZRUxMT1cKIyMjTEFSQU1TI0RMSUlJCkpPTExZR1JFRU5HSUFOVApJUkFCVSNMT0FORUQjIyMKQkxVRVBSSU5URUQjQk9CClNFUkEjRU5TIyMjUEFQQQojI0VORFMjI0FOVEFSRVMKRkFOI0lORElHT0dJUkxTCkVUQyNWSU9MRVRJUklTIwpaRUUjRUtFUyNJRlNPIyM="},{"title":"Themeless Thursday, 1/30/03 (Thursday)","author":"by David J. Kahn / Edited by Peter Gordon (puzzleeditor@nysun.com)","date":"2003-01-30","grid":"Sk9SSkFGT1gjUEFUVE9OCkFMT0VWRVJBI0VST0lDQQpQQVNURURPTiNSRU5URVIKRVlFUyNFTkRSVU4jTEFDCiMjI0FSUk9ZTyNPVkVOUwpDUklNRUEjI09DVEFEUyMKSE9OI0ZMSUNLQSNNRVRFCkVMU0EjSVFVSVQjUEVBTApGTEFOI1NUUEVURSNEVFMKI0lOTkFURSMjTEVTU0VFCkFOREVTI1NIRUVTSCMjIwpJR08jV0FURVJTI0FSVFMKT1BVU0VTI01BSElNQUhJCkxJVFRMRSNFU09URVJJQwpJTlNVTFQjTkVXU0RFU0s="},{"title":"\"Yeah, Right!\", 1/31/03 (Friday)","author":"by Randolph Ross / Edited by Peter Gordon (puzzleeditor@nysun.com)","date":"2003-01-31","grid":"TUVXRUQjT0hTI0NBUkRTCkFUT05FI1RIRSNCUlVJTgpORVJEUyNUSEVSRUlTTk8KSFJTI0lQTyNTVVIjVEVDCk9ORUFMTCNEQVMjRElETwpMQU5HVUFHRVdIRVJFSU4KRUxTRSNJT04jI1ZFUk5FCiMjIyNBRE9VQkxFIyMjIwpTQ0VOVCMjRFVFI0FMT0UKUE9TSVRJVkVDQU5GT1JNCklDT04jQkFEI1ZJVEFMRQpST0IjR0VOI1pFTiNGQVIKQU5FR0FUSVZFI0VXSU5HCkxVU1RTI1NJTiNBQU5ERQpTVE9PUCNITU8jTVlHT0Q="},{"title":"Garden of Evens, 2/3/03 (Monday)","author":"by Ogden Porter / Edited by Peter Gordon (puzzleeditor@nysun.com)","date":"2003-02-03","grid":"RkxVQiNHT09OI1JVUkFMClJPU0UjVVJHRSNVTklURQpFUEVFI01BUlgjREVNTUUKVEVSUklCTEVUV09TIyMjCiMjI05BWSMjI0FMQ0FQUApBQlpVRyNQTFVTRk9VUlMKUExBVE8jSE9MVCMjUkVBCkhJUFMjQUxJTkUjRk9XTApJTVAjI0NPUkEjQUJSQU0KREVFUFNJWEVTI0xJQVJTClNZUklBTiMjI0ZBQSMjIwojIyNGSUdVUkVFSUdIVFMKQUZPRkwjUk9BRCNFVVJPCkdBTExPI05PU0UjTkVBUgpPUkRFUiNTVFlYI1RZUEU="},{"title":"Y's and Wherefores, 2/4/03 (Tuesday)","author":"by Nancy Salomon / Edited by Peter Gordon (puzzleeditor@nysun.com)","date":"2003-02-04","grid":"TUVBTCNDSUNBREEjS09TClBMRUEjQURPUkVEI0VMTApIQVJEWUxJTkVSUyNORUUKI0xPWUFMI0NBTiNTTk9XCiMjI0JSSU5FIyNBVEUjIwojQ09VTlRZRFJBQ1VMQSMKQ0hVRyMjUEVFVkUjQ0JTClBFSSNBR08jR0FEI0xFSQpSQUojU1VTSEkjI05VVFMKI1BBUlRZVElNRUpPQlMjCiMjQk9PIyNCRUxPVyMjIwpBVE9aI1NLQSNBRVROQSMKQk9BI1NUSUNLWVNISUZUCkVSUiNDQVNISU4jSU5SRQpMRUQjSU5TSURFI1NPT04="},{"title":"As Easy As ABC, 2/5/03 (Wednesday)","author":"by John R. Minarcik / Edited by Peter Gordon (puzzleeditor@nysun.com)","date":"2003-02-05","grid":"UEVSTVMjSVJBTkkjTUlECklTQUFDI01BUkVTI1VOSQpDQ0dHQUFHRkZFRUREREQKVEFJI0JPTCMjUkVPUEVOCiNSTkEjTkFTQSMjUElFVApDR0dGRUVER0dHRkVFRCMKRE9MTFkjI1RPSUxTIyMjClNUWSNJUkEjR05VI0dSRQojIyNBTkRSRSMjVFJBSVQKI0NDR0dBQUdGRkVFRERDCkRBTEkjI0JPTEEjRkFEIwpBQ1VURVMjI1VNQSNCQUEKVEhFQUxQSEFCRVRTT05HCkVFUiNLRUFOVSNUUlVDRQpEVFMjU1dJTkcjTk9URVM="},{"title":"Vis-\u00e0-Vis, 2/6/03 (Thursday)","author":"by Norma Johnson / Edited by Peter Gordon (puzzleeditor@nysun.com)","date":"2003-02-06","grid":"VVJTQSNBQ0VEIyMjUkFNClNPVUwjTE9TRUYjRk9GRgpTVFJBSUdIVEZEI1RCQVIKUkVGI1RPQUQjVVNIRVJTCiMjI0VBUk4jRVBFRSMjIwojQU5HTEUjI1NURU5DSUwKU0hPR0kjUEVTTyNBTERBCkFTU09DI1JZRSNJVEFMWQpSSUVOI0JFRVMjTElNRVMKSU5ZT1VSRiMjU0xPUFMjCiMjI05BWVMjQkVJTiMjIwpFTUNFRVMjVEVOTiNHRU0KRlVSUyNPRlJUQUlOQUdFCkZUT0YjTlRFU1QjQUxPVApTRVcjIyNTS1lFI0JBU1M="},{"title":"Weekend Warrior, 2/7/03 (Friday)","author":"by Rich Norris / Edited by Peter Gordon (puzzleeditor@nysun.com)","date":"2003-02-07","grid":"QUZSQUlEU08jU0NBTEFSCkNSQUNLVVBTI1BPTUVMTwpDQUNIRVBPVCNBUk9NQVMKRVBFRSNFUlJPUlBST05FCk5QUiMjI1RJUkVTI05BQgpURVNUI1NBQ0tTI1NBTEEKIyMjUk9VR0gjI01JRERZCiNCT09LSUUjRENBUkVBIwpGTFVJRCMjQkFJWkUjIyMKTE9UUyNTVE9JQyNET05FCk9XUyNCQVJCUSMjI05PTgpUSEVKSUdJU1VQI0ZFU1QKU09MT05HI0xJQVJMSUFSCkFMTEVHRSNFUklDSURMRQpNRVNTRUQjRElMQVRBVEU="},{"title":"The Solution Is at Hand, 2/10/03 (Monday)","author":"by Robert Ward / Edited by Peter Gordon (puzzleeditor@nysun.com)","date":"2003-02-10","grid":"U1RBUksjRUxTQVMjUEVOCk9SUklOI0JFVFRFI0FSRQpGSU5HRVJCT0FSRCNMQVgKQVBPR0VFUyNMSVUjTVNUCiMjI0VQQSNHTFVDT1NFIwpFTkdSQVZFUiNNRU5VIyMKQUlSI0RPTk9SI1JFTlRTCkNMRU8jV09XRUQjQURFUwpIRUVEUyNTVFBBVCNBUlQKIyNOT0VTI0hPTU9OWU1TCiNTVFJFQU1TI0lSQSMjIwpTQ0gjQUxFI1NFVFNBSUwKVEFVI0JBUkVLTlVDS0xFCkFSTSNMQUNFWSNSQUlMUwpSRUIjRU1JUlMjRVJOU1Q="},{"title":"The Fix Is In, 2/11/03 (Tuesday)","author":"by Elizabeth C. Gorski / Edited by Peter Gordon (puzzleeditor@nysun.com)","date":"2003-02-11","grid":"U0VDUyMjQklDUyNPR1JFCktOQVBQI0VUQUwjRFJBVApJTlRFUiNBQ1JFI09BVFMKTk9UV09SVEhBREFSTiMjCk5CQSNQT0UjTFNEI0RERQpFTEkjTUFOTkEjWklQVVAKREVMVEFTI0lSUiNOQURBCiMjI09OVEhFTUVORCMjIwpBSE9ZI1NPQyNTT09ORVIKTEFQU0UjTUVSSVQjQVJJCkFMSSNUUkUjQURFI1BJQwojI05JQ09USU5FUEFUQ0gKTEVJRiNNRUxUI0FOSVNFCkFTT0YjRUFTRSNERU1PUwpERU5ZI09NQVIjI1dFTlQ="},{"title":"Lincoln Center, 2/12/03 (Wednesday)","author":"by Lynn Lempel / Edited by Peter Gordon (puzzleeditor@nysun.com)","date":"2003-02-12","grid":"TE9CRVMjU0hFTCNTQVNTClRSQVJUI01BWEkjQ0xJUApERUxBWSNPUkVNI0FMRUUKIyMjI01BS0VTQUVMSU5FCkJPTkZJUkVTI0FQUEVORApPTUVMRVRTI09ORSNEQVkKUEFST0RZI0JBU0VMIyMjClNOT1cjI1NBUiMjVU5JVAojIyNTSVJFUyNTQ1JJQkUKQVRNI1JFWCNQSE9FTklYClRSSUJBTCNTT1VOREVTVApUQUtFU0FBVElORyMjIyMKSVZBTiNMSUVOI0VMTU9TCkNFREUjRURJVCNTRUFEUwpBTE9UI0RFTlMjVE9MRVQ="},{"title":"And the Nominees Are ..., 2/13/03 (Thursday)","author":"by Roger DePont / Edited by Peter Gordon (puzzleeditor@nysun.com)","date":"2003-02-13","grid":"VEhJUyNSUE0jIyNDQVBQClRPT0tDQVJFI0hPT1BMQQpPUFRJT05FRCNBU1dPT04KUElBTklTVCNJRENBUkRTCiMjIyNOT1RTTyNBUlRTWQpBQ0FERU1ZQVdBUkQjIyMKTE9ORVIjI0xBVyMjUkJJCkdBTkdTT0YjTkVXWU9SSwpBVEUjI1JBVyMjWU9VUkUKIyMjVEhFVFdPVE9XRVJTCkFVRElPI0hJUkFNIyMjIwpDSEFMVVBBI0NISUNBR08KVFVORFJBI0NISU5BU0VBCkVSTkVTVCNUSU5HTElFUgpEQVlTIyMjU0RJI1NBS1M="},{"title":"Valentine's Day Gift, 2/14/03 (Friday)","author":"by Ogden Porter / Edited by Peter Gordon (puzzleeditor@nysun.com)","date":"2003-02-14","grid":"TUVMUiNPS0FZUyMjQklQCkFDT1cjUkVQRUwjUklTUgpKVU5JUEVSUlJBI09SQUwKIyMjTkVPTiMjUERJRERZClVUVEVSI0VBVCNFTElPVApHRUUjIyMjTUlSViNFUkUKSEFSRU0jTUlORU9TIyMjCiNSSVNBUklTQVJJU0FSIwojIyNDUlVTVFMjREVYVFIKUEVTI0lQU0EjIyMjRVRBClJUVEVTI01EUyNQQUxBVQpDSElOQVIjI1VCRVIjIyMKVU5MViNPTkVET1pFTlJTClRPVFMjTEFQQVojTkVUUwpFU1MjI0FNSU5PI0FIT1Q="},{"title":"One Over Par, 2/18/03 (Tuesday)","author":"by Harvey Estes / Edited by Peter Gordon (puzzleeditor@nysun.com)","date":"2003-02-18","grid":"RVNURVIjQUJCQSNTUEVEClBIT1RPI0xBSUQjSElWRQpJT1RBUyNFTk9TI0FMRVMKVEVFU0hJUlQjI0ZSRVJFCk9CUyMjUk9VR0hSSURFUgpNT1VTU0VTI09VSSNPVFQKRVhQT1MjI0VHRyNBTlRTCiMjI1RSQVBET09SUyMjIwpCQUlPI1JPVCMjQ0FSVEUKQUJDI01DTCNHSEFOSUFOCkdSRUVOSE9VU0UjI1BLRwpQQUJMTyMjQ1VQT0ZURUEKSURFQSNFTE9JI1NMSU5HClBFUlQjTEVOVCNTQURJRQpFREdFI0ZJTlMjT05FTkQ="},{"title":"Five'll Getcha Ten, 2/19/03 (Wednesday)","author":"by Richard Silvestri / Edited by Peter Gordon (puzzleeditor@nysun.com)","date":"2003-02-19","grid":"Q0RTI1BBTlRTI1NBUFBZCkxFSSNBQk9VVCNQVVJMUwpBRkMjUkVUUk8jQVJJRUwKUklLS0lUSUtLSVRBWEkjCkVMTElTIyMjRVJFI0ZBTgpURUVNI0hFRERBI0ZJRE8KIyMjT1BFUkEjI0JPWEVSCiNET05UTUFLRVdBWEVTIwpHRU5PQSMjQUNFUkIjIyMKQUNFUyNDQVJPQiNPQklUClBJVCNDQVQjIyNHUkFDRQojUE9QSU5UT1RIRU9YRU4KU0hPT1QjRUxJT1QjVEFEClNFTlNFI1NFTE1BI0VHTwpUUkVFRCNUT0xFVCNSRU4="},{"title":"Rock Pile, 2/20/03 (Thursday)","author":"by William I. Johnston / Edited by Peter Gordon (puzzleeditor@nysun.com)","date":"2003-02-20","grid":"U0VSSUYjTU9TUyNGTFVCCkFEQU5PI09NSVQjTElORQpORVJEUyNST01QI0FMVEEKR05FSVNTVE9NRUVUWU9VCiMjI0dJTEEjU1RBQiMjIwpIT05PTFVMVSNFVFVERVMKRUNPIyNTU05TI1VTVUFMCklUU1NDSElTVEFQSEFTRQpSRUlOQSNORVJPIyNORUUKU1RSQU5EI1dJTERXRVNUCiMjI0tPT0wjTkVISSMjIwpUQUtFTkZPUkdSQU5JVEUKT1JFTyNGT0lFI1JPQklOClBFUkkjRVNQTiNNVU1NWQpFQVJMI0RFRVQjQVRTRUE="},{"title":"Weekend Warrior, 2/21/03 (Friday)","author":"by Bob Peoples / Edited by Peter Gordon (puzzleeditor@nysun.com)","date":"2003-02-21","grid":"QlJFQVNUT0ZDSElDS0VOClJVU1NJQU5ST1VMRVRURQpJTlNFQ1RSRVBFTExFTlQKRVRBIyNBWUUjI0FUTEFTCkZPWUxFI0VBVEFUIyMjIwojIyNFU0wjU1lOI0FNSUUKUExBTlRFUlNQRUFOVVRTCkhPUlNFU0hPRU1BR05FVApET01FU1RJQ0FJUkxJTkUKU1BZUyNBTkkjQUdFIyMjCiMjIyNTVEVBTSNIRUFSUwpDRUxMTyMjVEVFIyNQT0UKQVJUSUZJQ0lBTEJMT05EClJBRElBVElPTlNPVVJDRQpBU1NJU1RBTlRFRElUT1I="},{"title":"B&B's, 2/24/03 (Monday)","author":"by Ogden Porter / Edited by Peter Gordon (puzzleeditor@nysun.com)","date":"2003-02-24","grid":"QUZCIyNFUlJPTCNGUkFOCkJMT0IjQk9PTEFCT09MQQpDT1JBI0JVRERZQlVERFkKU0VBTU9TUyNERVNSRUUjCiMjQk1XI1RCQVIjVE9OUwpQUk9CRSNFTFkjQ0hVVEUKQVVSQSNFUkFTRVMjVEVYClJFQU0jQVNII1JJQiMjIwojIyNNUlMjQlJBI0FCRVQKUFRBI0NZQ0xFUyNORVJPCkdBTU1BI0hBRCNBR1JFRQpBR1JBI0hPSE8jUkJJIyMKI1NBVklPUiNMSUtBQkxFCkJBREVOQkFERU4jTkVFRApCTElOR0JMSU5HI0dSRUcKQ0VPUyNZRU5UQSMjSVJF"},{"title":"Heard of the Class, 2/25/03 (Tuesday)","author":"by Rich Norris / Edited by Peter Gordon (puzzleeditor@nysun.com)","date":"2003-02-25","grid":"Q0FMRiNIQVJFTSNCQVJCCk9SRU8jQU1JTk8jQUxPRQpERUFSVEhPTlRIRU5JTEUKQUFSRFZBUksjU0lHTk9OCiMjTkVTUyMjIyNSRUVTRQpFUk9ERSNTUEVXRUQjIyMKTEVOI1RFQ0hJRSNVSE9ICk1BTUEjVFJJRUQjUEVSVQpPUEVDI1JFU0lTVCNBU1MKIyMjVEhFV0hPI0hVUk9LClRBU1RFIyMjI0hJTlQjIwpBVFRIQVQjSVJPTkNMQUQKQkVBUkRFRE5FQ0tMQUNFCkxVS0UjTUlOU0sjRU1NRQpFUEVFI1BFU1RTI1NQRUQ="},{"title":"Five 2002 \"8\" Titles, 2/26/03 (Wednesday)","author":"by Byron Walden / Edited by Peter Gordon (puzzleeditor@nysun.com)","date":"2003-02-26","grid":"UElDQUJPIyNTVEVXQVJUClVOUk9MTCMjUkFOT1ZFUgpGTEFLRUQjTEFORE1JTkUKRkVaI1dFUkUjIyNFRERZClNUWUUjUkVHUk9XTiMjIwojI05TRiNBR0FQRSNTQVQKU0tJQ0FQI0VWRVMjSVZZCkxPRyNUUklERU5UI01BUApBQUgjRk9SRlJFRSNQSUUKQkxUI0FQRVIjRFJJTExTClNBUyNSVU5FUyNOTkUjIwojIyNJTVBFQUNII0tST0MKTU9NUyMjI0tJRUwjVU1BCkFWSUFUT1JTI01BUExFUwpMQUxBTk5FIyNBTExFR0UKRUxFQ1RFRCMjTkFZU0FZ"},{"title":"Themeless Thursday, 2/27/03 (Thursday)","author":"by Jim Page / Edited by Peter Gordon (puzzleeditor@nysun.com)","date":"2003-02-27","grid":"QUlMI1dFQlMjREVTQURFCkZSRURFUklDI1JBTVJPRApCQVNFTElORSNBVE9ORUQKIyNTUExFRU4jTUlLRVMjCkVDTyNFU1RJTUFURSMjIwpSQU5UUyMjQ0FNI1NQQ0EKSU1QQUxBUyNOSVQjRVJOCkNBTFRFQ0gjSU5WSVRFRApBUkEjWUVBI0FFUkFUT1IKU09OUyNTUk8jI0FOSUxFCiMjI0hFQURSRVNUI05FQQojRUJPQVQjRFVQSU5HIyMKQ1JFQVNFI0VCRU5FWkVSCkJBTExZUyNSSU5HRE9WRQpTVEFZQVQjU0VUUyNPQUY="},{"title":"Bottoms Up!, 2/28/03 (Friday)","author":"by Elizabeth C. Gorski / Edited by Peter Gordon (puzzleeditor@nysun.com)","date":"2003-02-28","grid":"Tk9SI1dBUiMjSEFMVEVSCkVWRSNBTEFSI09NRVJUQQpXQVMjU09EQSNNT1RJT04KTUxJR0hUSU5WRVJNT05UCiMjU0VNI09LSUUjRVNTTwpUT1RIRU1BTElDRSMjIyMKRU1JUiNJREUjI1RBQkxBClJBVklORSMjI01BVFJJWApQUkVHTyMjU1NSI1RBTEwKIyMjI0hPTkVZTVNVSVRFCkFTSEUjQk9OTiNBTk4jIwpTSElORU9OSEFSVkVTVE0KU0FGQVJJI09QSUUjQ0FQCkVWSUNUUyNSU1RVI0FMSQpTRVNURVQjI0VFUyNORUU="},{"title":"Downsizing, 3/3/03 (Monday)","author":"by Sarah Keller / Edited by Peter Gordon (puzzleeditor@nysun.com)","date":"2003-03-03","grid":"UkFNUCNERkxBVCNFU1BZCk9ET1IjT0xJVkUjRElSRQpUT1JPI0xBU0VSI0VOT1MKR0xPQkFMV0FSTUlORyMjClVQU0VUIyMjVEVEI1VGTwpUSEUjQUJVVCNET0xMQVIKIyMjQVJJU0UjIyNFQVJMCkNPTlRJTkVOVEFMQVJNWQpPUkVPIyMjUEVQWVMjIyMKU0NBTVBJI01BVUkjR1VTClRBVCNFRFMjIyNOT09ORQojI05BVElPTkFMR1VBUkQKT1ZFUiNEUk9ORSNJREVBCldJU0UjSVJFTkUjSkVBTgpOQVNBI1RZTEVSI0FERFM="},{"title":"As Easy As Pi, 3/4/03 (Tuesday)","author":"by Ogden Porter / Edited by Peter Gordon (puzzleeditor@nysun.com)","date":"2003-03-04","grid":"QVRCQVkjVEVBI1RBTVBBCkxPT0ZBI0VFQyNTTUVMTApGQVRBTEJFUlQjRU1BSUwKI1RIUkVFUE9JTlRPTkUjCiMjIyNMRUUjVk9TIyMjIwpGT1VST05FRklWRU5JTkUKRU5USUNFI0VUQSNFQ09MCkFMRUNLI0ZSWSNHQUlUUwpTT1JFI0FJTSNQRVRFUkkKVFdPU0lYRklWRVRIUkVFCiMjIyNCTFQjQ1NBIyMjIwojRklWRUVJR0hUTklORSMKVElNRVgjRUxJT1RORVNTCklOQU5FI1RPUCNTQ0FNUwpURVhUUyNITVMjWUFURVM="},{"title":"A Matter of Degrees, 3/5/03 (Wednesday)","author":"by Ed Early / Edited by Peter Gordon (puzzleeditor@nysun.com)","date":"2003-03-05","grid":"UFVQUyNEQUxFIyNUVUJBCklOUkUjT1BFTiNPQVNFUwpUV09XUk9OR1MjU0tJRVMKSEVNI09SRSMjU1BFTkNFCiNET05UTUFLRUFSSUdIVAojIyNBSEEjQVNIRU4jIyMKUVRJUCNUQVJUTFkjRkVaCkVBVEFUI01BRSNTTU9LRQpESlMjRU1CT1NTI09YRU4KIyMjU1RBTEsjUEFUIyMjCkJVVFRIUkVFUklHSFRTIwpBR1JFRVMjI0FDSCNIQVMKU0xJRVIjTUFLRUFMRUZUClNJTExTI0VWRVIjQVJFQQpJU0xFIyNURURTI0JFUkc="},{"title":"Mood Indigo, 3/6/03 (Thursday)","author":"by Manny Nosowsky / Edited by Peter Gordon (puzzleeditor@nysun.com)","date":"2003-03-06","grid":"RklCUyNSQUJBVCNNQVNICklNQUMjQUxPTkUjQUxQTwpMT0JPI1BPV0RFUlJPT00KU0tZV1JJVEVSI0VYVURFCiMjQ0xBRCNERUpBI0RFUgpDTEFTSCMjIyNFTEsjIyMKQVVLI0FTSURFUyNJTkNBClNURUVMUFJPRFVDVElPTgpURVNTI0lTQVlTTyNMSVQKIyMjUEVSIyMjI09QRU5TCkZBUiNHRU9NI1NMQUIjIwpBTE9ORyNOQVZZU0VBTFMKQkxVRVNDTFVFUyNMU0FUCkxBU1QjUk9ERU8jTElORQpFWUVTI1RXRVJQI0FORVc="},{"title":"Weekend Warrior, 3/7/03 (Friday)","author":"by Randolph Ross / Edited by Peter Gordon (puzzleeditor@nysun.com)","date":"2003-03-07","grid":"U1BPUlRTQ0FSI1RSQUNUCkhJUkVBTElNTyNPQVRFUgpVTkRBTUFHRUQjTUlMTEkKVEhFI0lOQUxMI0JMRUVQClRPUkUjVFJJQUxTI0FTUwpFTElBUyNTQVZFI0FTVE8KUkVOVEFMI1NFVkVOVEVOCiMjI1NXQVAjUkFWSSMjIwpTQU1BTlRIQSNSRU1JU1MKQUJJVCNIQUxGI05BQ0hUClRBTiNERVNJTFUjTEVJQQpBTElWRSNFTUlMRSNDTlMKTk9WRUwjRE9OVExBVUdICklOQU5FI0lOVFJPVUJMRQpDRU5UUyNOWVlBTktFRVM="},{"title":"Paper Mates, 3/10/03 (Monday)","author":"by Randall J. Hartman / Edited by Peter Gordon (puzzleeditor@nysun.com)","date":"2003-03-10","grid":"U1RBTiNQSVRDSCNTUEFNCk9ITk8jRVZFUlkjSE9CTwpTVU5HTEFTU0VTI09TTE8KT1NBR0UjI0hBUyNSVEVTCiMjI0lHT1IjTU9UVE8jIwpDQU5OSUJBTCNQUkVGQUIKQVJFI1RJQkVUI0lORkVSClBFV1MjRUFWRUQjU0lSRQpSQVNUQSNURU5FVCNDSUEKQVNXRUxMI0xPQ09XRUVECiMjRUFTRUwjUk9BUiMjIwpBQ0VEI0NPTyMjU0VFUFMKTE9LSSNUSU1FU1RBQkxFCkVMTEUjRVJBVE8jVFJPVApTQVlTI1JFUkFOI0hPUFM="},{"title":"\"Ouch!\", 3/11/03 (Tuesday)","author":"by Ed Early / Edited by Peter Gordon (puzzleeditor@nysun.com)","date":"2003-03-11","grid":"QUNIRSNDSEFPUyNMUEdBCkNPSUwjTEFQVVAjQVJBQgpFR0dTI09TU0lFI0NPTEEKIyNISVRUSEVKQUNLUE9UCk9UVEVSIyMjQVJDI0VSRQpBUkUjT1dMUyMjSVNMRVMKS0lDS1RIRUhBQklUIyMjClNPSE8jT0ZVU0UjWU9HQQojIyNCRUFUVEhFREVWSUwKU0xFRVQjI0VZUkUjRUxJCkVBUiNDT1QjIyNDQVJBVApQVU5DSFRIRUNMT0NLIyMKQVJFQSNIRUxMTyNSSVNFCkxJU1QjRVNTRVMjRUxLUwpTRVRTI1JFRUZTI1NMSVA="},{"title":"Name's Sake, 3/12/03 (Wednesday)","author":"by Norma Johnson / Edited by Peter Gordon (puzzleeditor@nysun.com)","date":"2003-03-12","grid":"T0RJU1QjQkFORkYjTUFTClJVTlRPI1VUSUNBI0FEQQpST0JFUlRTVEFDSyNTSFkKIyNBV0FTSCMjI0VTVEVTCkhBUyNIT1dBUkRTVEVSTgpPTktQIyNBR0VFI09SRU8KRU5FUk8jI09GRkFMIyMjCiNTVEVQSEVOU1RJTExTIwojIyNTVE9MSSMjTUVFVFMKQU1QUyNPTEVTIyNOQVlTCkxPUkVUVEFTV0lUI0RFVwpMT09TRSMjI09OQUlSIyMKUExPI1NIQVJPTlNUT05FClJBRiNUT0tFTiNUQUxFUwpPSFMjU1RBQlMjRUxFQ1Q="},{"title":"Themeless Thursday, 3/13/03 (Thursday)","author":"by Louis Hildebrand / Edited by Peter Gordon (puzzleeditor@nysun.com)","date":"2003-03-13","grid":"SU5CUkVEI1NIQVBFRFVQCk5FUlVEQSNLQVRBS0FOQQpUV09CSVQjQUJPVkVQQVIKRURXI1RFQVRJTUUjUEJTClJFTlQjU01JVFMjUEVMRQpBTEJFRSNJTlMjQ09SRVMKQ0hBUlRJTkcjT0hPIyMjClRJR0hUUk9QRVdBTEtFUgojIyNVQVIjQUxMT0NBVEUKU0NBTlMjQVJNI1NVVFJBClRPVEUjRE9URVMjRU1VUwpPT0gjQ09STlJPVyNBU1MKQ0xFTUVOVEUjRklBTkNFCktJTkdMRUFSI0FESURBUwpTVEFSTEVTUyNSRVJVTlM="},{"title":"Deer Heart, 3/14/03 (Friday)","author":"by Harvey Estes / Edited by Peter Gordon (puzzleeditor@nysun.com)","date":"2003-03-14","grid":"Q0FTQ0FERSNBSVIjSEJPCk9NSUNST04jTE9VU0VVUApSRURDRU5UI0FVU1RSSUEKRU5EI1NPUlQjU1RST0xMCiMjSE9PUkFIIyNCT05EUwpBU0FOI1NQRUVEVVAjIyMKU1RSSVAjI0JMT0MjRVRDClNFVFRPUyNBTU9LI0FIQQpBQUgjU0xBTSNSRVVTRVMKWU1BI1RPTUIjI1RIWU1FCiMjI1JBR1RJTUUjT0RFUwpERUZPRyMjTkFWQUhPIyMKUkFJREVSI09ET1IjRUNPClVSR0VET04jQ0xJUFNPTgpJTkhPVVNFI0FWQVJJQ0UKRFNUI0VZRSNQRVNFVEFT"},{"title":"Green Stuff, 3/17/03 (Monday)","author":"by Ogden Porter / Edited by Peter Gordon (puzzleeditor@nysun.com)","date":"2003-03-17","grid":"S0FITiNNQkEjREVGSUVTCkZSQVUjT1VUI0VYQUNUQQpDQVJEUk9PTSNDRUxFUlkKI1BESUREWSNCQUNLQkFZCkZBQ0VTI1VSQUwjI09ERQpBSEEjI1NQQU0jSEVYRVMKRE9TSURPI0lCRUFNIyMjCiMjSE9VU0VMSUdIVFMjIwojIyNXRUFOUyNHQVNUQVgKU1RQQVQjSkFSUyMjQVBFCk9VUiMjRE9URSNTQ1JPRApGTEFHREFZI1NUQVJUUyMKVEFJTE9SI1RFQVBBUlRZCk9OU0FMRSNFTkQjUEVMRQpORUVERUQjRVRBI1NLRVc="},{"title":"Animal Puns \"R\" Us, 3/18/03 (Tuesday)","author":"by Louis Hildebrand / Edited by Peter Gordon (puzzleeditor@nysun.com)","date":"2003-03-18","grid":"SU5GTyNTRUxFUyNDSFVCCkxFQUsjQU1PQ08jQUVSTwpTQUNSRURDUk9XI1NBR0EKQVRFQU0jRUVMI09BVEVSCiMjIyNPUEVOSU5HQklSRApFU1RBVEUjIyNVTEFOIyMKR0FSREVOSE9SU0UjR0FHCkFUT1ojI1NPQiMjTFBHQQpERUwjQkFUSElOR0NBUlAKIyNMQUlSIyMjQkFERElFCkNIRUNLRVJDUkFCIyMjIwpST1lDRSNIT0UjT1VJSkEKT05DRSNMT05ET05GUk9HClBFQVMjT05BSVIjT01JVApTU1JTI0JFTkRTI1NBTlM="},{"title":"Sports Figures, 3/19/03 (Wednesday)","author":"by Ed Early / Edited by Peter Gordon (puzzleeditor@nysun.com)","date":"2003-03-19","grid":"T1ZBTCNQRVNPUyNCTUVSCkRFTEUjQVJVQkEjUklERQpEUkFXI1JFQ09OI09ORVMKQkFORFNPQ0tFVEpPSU5UCiMjIyNDRFQjI0lBTSMjIwpERUZSQVkjUkVBTSNBVEUKT0xTT04jQkVSRyNBUklECkdFVFNUSEVCUk9MTElORwpFTk9TI09UT1MjQURBR0UKU0FQI0dVU1QjUEhBU0VSCiMjI0ZJTiMjQ1JUIyMjIwpCRUhJTkRUSEVFSUdIVEIKSUJBUiNET0VSUyNJT1dBCkRBWkUjT05TRVQjU0tJUwpFWUVCI0dFU1NPI1RFTlQ="},{"title":"Logic With Holes, 3/20/03 (Thursday)","author":"by Byron Walden / Edited by Peter Gordon (puzzleeditor@nysun.com)","date":"2003-03-20","grid":"QU5TT05JQSMjQUxBU0tBCk5PVEhJTkdJU0JFVFRFUgpUSEFOQkVJTkdJTkxPVkUKU0lOTyMjTE9UVCMjVklBCllURCNPUEVOIyNPTUVOUwojIyNRVUEjI0RVREUjIyMKRE9OVVRTQVJFQkVUVEVSCkRPUkEjVFJBTEEjSUFHTwpUSEFOTk9USElOR0VSR08KIyMjVE9SWSMjR0VSIyMjCk1BQ0FXIyNGT0lMI1RTUApBTEEjI0lURU0jI1NVTlkKRE9OVVRTQVJFQkVUVEVSClRIQU5CRUlOR0lOTE9WRQpWQUxJU0UjI0FOR09SQVM="},{"title":"Weekend Warrior, 3/21/03 (Friday)","author":"by Manny Nosowsky / Edited by Peter Gordon (puzzleeditor@nysun.com)","date":"2003-03-21","grid":"UEFTVE1BU1RFUiNBQkNTCk9OVEhFV0hPTEUjU09BUApTV0VFVFdJTkVTI0FOTk8KU0FBQlMjUkVDVCNQQU5UCkVSTEUjV0VTVCMjI1BPVwojIyNBSEgjVVJFI01BTkUKU0NPVElBI1BJQ0tFUkVMCkNBQkxFVFYjQ0hBVFRFRApBTU5FU0lBQyNPVEhFUlMKUkVPUyNGTFUjSU9VIyMjCkZPWCMjI1VTTUMjU0lCUwpBUklFI0ZFVEUjVkVOQUwKQ09PTCNJRE9ERUNMQVJFCkVMVUwjUkFEQVJSQU5HRQpERVNFI1NUWUxFU0hFRVQ="},{"title":"Humble Homes, 3/24/03 (Monday)","author":"by Norma Johnson / Edited by Peter Gordon (puzzleeditor@nysun.com)","date":"2003-03-24","grid":"TE9HQU4jT1NDQVIjREFNCkFTT05FI1NDQUxFI09ERQpIVVRUV09USFJFRUZPVVIKIyNFU1RFRU0jI0xBRExFCkFMQSMjUk9PVFMjUkFUUwpNQU1JRSMjI1JVTiNEU1QKU0lHTkFMI0hBU09OIyMjCiNDT1RUQUdFQ0hFRVNFIwojIyNPVVRSRSNJTk1BVEUKQkFEI1BISSMjI0RPTk9SCklDT04jU1BBU00jI0ROQQpCUk9BRCMjUkVWQU1QIyMKTE9ER0VBQ09NUExBSU5UCkVTTCNOQU9NSSNJTlRFUgpTU0UjU0FHQVMjVEVTVFk="},{"title":"Queued Up, 3/25/03 (Tuesday)","author":"by Rich Norris / Edited by Peter Gordon (puzzleeditor@nysun.com)","date":"2003-03-25","grid":"RVJNQSNZT0dBUyNRVElQClNIQUcjRVJBVE8jVVJJUwpRVUlMTFBPV0VSI0lPTlMKI0JMRVUjI0tJRFNSVVMjCk1BSVRSRUQjTklORVBJTgpVUk4jRUxJUyNERVRFU1QKR0JTIyNPVkVSI0VBUlRICiMjI1FVSUVURUFSUCMjIwpBTE9VRCNSVU1QIyNXV1cKTUFOSUFDI1BJRUQjQVJBClBSRVBMQU4jVFJJUExFWAojQ0FMTFNPTiMjU0FLUyMKREVDQSNRVUFTSENMT1RICkFOQVMjVU5HRVIjTVVMRQpNWVRII0VTU0VTI1NURVc="},{"title":"Going Dutch, 3/26/03 (Wednesday)","author":"by David J. Kahn / Edited by Peter Gordon (puzzleeditor@nysun.com)","date":"2003-03-26","grid":"TEFTVCNTQUJFUiNWRVRPCkFMUE8jT0xJVkUjT1ZFUgpET09SUFJJWkVTI1RJTkEKWUVSI0lUUyMjI1BFVEFMCiMjVFJFQVRXSUxMSUFNUwpBSFNPIyNTSU1JQU4jIyMKUk9NTUVMI1NJR04jRkxBCkNIRUVTRUlUVEhFQ09QUwpIT04jUE9PRiNUUk9VR0gKIyMjQkFOVFVTIyNQUkFZCkNPTE9OSUFMUElORVMjIwpPTUVHQSMjI0lETyNPTkUKUkFORyNVTkNMRVJFTVVTCkFOSUwjVE9PTFMjR0VMUwpMSU5FI0VMTVNUI09TTE8="},{"title":"Themeless Thursday, 3/27/03 (Thursday)","author":"by Patrick Berry / Edited by Peter Gordon (puzzleeditor@nysun.com)","date":"2003-03-27","grid":"TE9XQlJFRCMjUEFXU0FUCklTUkFFTEkjU1VNQVRSQQpBQklHQUlMI0NSQVRFUlMKUk9HRVIjQUZBUiNUV0lUCkxVTEwjU1RFTSNSRUVWRQpJUkUjU0hFRVBIRVJERVIKQU5ZUVVFU1RJT05TIyMjClJFU1VNRSMjI0FOT1JBSwojIyNBTk5BS0FSRU5JTkEKU0hBS0VTSEFORFMjRkVZClBBVkVSI09MRFMjREVDSwpBVkVSI0VSSUUjRE9XRFkKUkVORUdFUyNBREFHSU9TClRBR1NBTEUjTkFORVRURQpBVEVTVFMjI1NNQVNIRVI="},{"title":"A Portrait of the Artist as a Young Man, 3/28/03 (Friday)","author":"by Ogden Porter / Edited by Peter Gordon (puzzleeditor@nysun.com)","date":"2003-03-28","grid":"SE9CQlMjSE9IVU0jQ0RTCkFMRVJPI0FNQVpFI1JFTQpMRURJTiNSRUxJVCNPUkEKUE9GREFSS05FU1MjV0FSCiMjUkFSRSMjIyMjS05JVApPUkFMI1BBUEEjVU5QTFkKUEFNIyNBU0lOSU5FIyMjClRIRVBTU0FORFRIRVBFQQojIyNESVRIRVJTIyNSQU4KSU5GT1IjSVNFRSNQT1JUCk1BQU0jIyMjI0xBUkQjIwpQU0kjVEhFUE9GVElERVMKQVNUI1dJRFRII1NNRUxUCkxBSCNBUkdPTiNFRVJJRQpBVVAjU1RFTk8jQVNTRVQ="},{"title":"Tight Ballgame, 3/31/03 (Monday)","author":"by Ed Early / Edited by Peter Gordon (puzzleeditor@nysun.com)","date":"2003-03-31","grid":"TUVDQ0EjU0xPU0gjQVNTCkFSRUFTI0hFQ0hFI1NFVwpQSU5DSEhJVFRFUiNURUUKU0VUSCNBUFNFI0FDUklECiMjI0VMTFMjVEFMTE9ORQpNQVMjT09IUyNJRE9MIyMKVVNIRVIjQUtJTiNTQUZFCkNIT0tFVVBPTlRIRUJBVApIRVJFI0xFQVAjRVJFQ1QKIyNUT1RFI0xBS0UjU0VBClNFQ1VSRVMjVEFEQSMjIwpNSUFUQSNBTElUI01BTEwKRUVLI1NRVUVFWkVQTEFZCkxJRSNIVU5BTiNHTE9PTQpMT1MjWUVBU1QjR0VFU0U="},{"title":"Fashion Plates, 4/2/03 (Wednesday)","author":"by Kurt Mengel and Jan-Michele Gianette / Edited by Peter Gordon (puzzleeditor@nysun.com)","date":"2003-04-02","grid":"U05VQlMjSElOVCNEVUVMCktPUkVBI09WRVIjSVNMRQpFQVNFTCNNRU1PI1NBTUUKV0hBVEFSRVlPVVVQRk9SCiMjI1NNRUUjI0JTQSMjIwpDRFMjSUFDQ0VMRVJBVEUKSEFOR1MjI09XRSNBVklTCkFGQVIjQUNNRVMjR0VUUwpQT0tFI1NBTSMjQkVSTEUKU0VFWU9VTEFURVIjVEVYCiMjI0hPTiMjRUxJRSMjIwpJTVRPT0NVVEVGT1JZT1UKT0FIVSNJTk9OI0NSQU5LCldSRU4jT0RFUyNIRU5DRQpBWEVEI05PU1kjRURHRVM="},{"title":"What's Yours?, 4/3/03 (Thursday)","author":"by Ogden Porter / Edited by Peter Gordon (puzzleeditor@nysun.com)","date":"2003-04-03","grid":"Vk9OI0dBUEUjI0FSSUVTCklTQSNFQkFZI0FNQU5EQQpSTVMjTUVSRSNDQU5DRVIKR09UTUlMSyNUQVRJQU5BCk9OSU9OI0FOQUNJTiMjIwojREVMSUEjT1VJIyNTRUEKI1NTRSNMSUJSQSNJQU1TCiMjI0NDRUQjVVNJTkdVUAojQVFVQVJJVVMjS1JJU1MKU0NVTFBUT1IjU05JVCMjClBSSUVSIyNOT05PI1RPUApGRVojSUxFI1BPVyNBTUkKIyMjU0NPUlBJTyNBUkVTClNJR05PRlRIRVpPRElBQwpJTVBPUlRFRCNFTkRVUkUKTEVPI05ZUyMjU0FMU0FT"},{"title":"Weekend Warrior, 4/4/03 (Friday)","author":"by Patrick Berry / Edited by Peter Gordon (puzzleeditor@nysun.com)","date":"2003-04-04","grid":"VFJJRkZJRFMjI1RPTUJTCkhBTkRJQ0FQI1JPTUVSTwpJTkZJTklUSSNFTkFNRUwKU0xJQ0tFU1QjVkVST05BCldBRCMjUlVUR0VSI0lOQwpBVEVVUCNORU9OI1RSRUUKWUVMTEFUI0RSVVRIRVJTCiMjI0NVUkIjWUVBUiMjIwpGT1JFTElNQiNTVE9PR0UKT1BFUiNET1JNI0FCTEVSClJFRiNERUNPQ1QjI0ROQQpTTk9XSU4jQU5FTU9ORVMKQVNMQU5UI0RBVEFCQVNFCkxFREdFUyNBSVJDT1ZFUgpFQVNFRCMjWFJBWUVZRVM="},{"title":"Hat Trick, 4/7/03 (Monday)","author":"by Harvey Estes / Edited by Peter Gordon (puzzleeditor@nysun.com)","date":"2003-04-07","grid":"T0REUyNET1VHI05BQUNQCkxJRU4jQU5OTyNBTElBUwpERU1PTElUSU9OREVSQlkKQ0hFUklTSCNCRUEjUEZDCkhBUkVTI0VMRVYjTk9BSApBUklEI0FKQVIjQkFSUkUKUERUI0NNT04jRUxJVEVTCiMjI1BST0JPV0xFUiMjIwpTVFJFQUsjTEFJRCNCQkMKQ0hBUk0jQ0lURSNQRUFSClJPQ0sjRE9ORSNFTEFURQpJUksjQVVHI1JFR0FUVEEKQkVFSU5PTkVTQk9OTkVUCkVBVElOI0FOS0EjVElSRQpTVVNJRSNDT0lOI1NLWVM="},{"title":"Double List, 4/8/03 (Tuesday)","author":"by Alan Olschwang / Edited by Peter Gordon (puzzleeditor@nysun.com)","date":"2003-04-08","grid":"UkFCQkkjQ0FTVCNEWUVSCkVNQUlMI0FMUE8jSU9UQQpCRVNUU0VUVEVSI1JVVFMKSU5URUFSUyNDT1ZFUlVQCkRERSMjQUlNIyNBQ0gjIwojIyNQVVRUQUZBU1RPTkUKI1JBSU4jI1NBTiMjTklMCkZJVFRJTkdTVEFUSU9OUwpBQ1QjI01FQSMjRVRSRSMKU0hPUFBJTkdNQVRUIyMjCiMjUlVSIyNFT1MjI0VOUwpTRU5UT1VUI1BIQVJBT0gKT1JFUyNHUkFQRUpFVFRZCkRBWU8jTElNRSNBTklTRQpBU1NOI0lCSUQjUk9UT1I="},{"title":"Pointing in the Right Direction, 4/9/03 (Wednesday)","author":"by Rich Norris / Edited by Peter Gordon (puzzleeditor@nysun.com)","date":"2003-04-09","grid":"TkFFU0NBUEUjI0FST09UCk9ITU1FVEVSUyNTRU5PUgpSRVBFTExFTlQjTU9USFkKTUFMRVMjIyNJV0lTSCMjCkFETyMjI0RBVklUI0VERApOU1lOQyNFUklDSCNERUkKIyMjU0FEU0FDSyNIT1NTCkdJU0VMRSMjI0VST1RJQwpVU09DI1BMQU5URVIjIyMKTEVOI0JMQVNUI0NBQ1RJClBFQSNPT01QSCMjI0xJQgojI1RPTllBIyMjTUlBTUkKV0hJTEUjUkVDVE9SSUVTClBBTkFNI1JBQ0VIT1JTRQpNSUFGQSMjUElFUkNFQVM="},{"title":"Themeless Thursday, 4/10/03 (Thursday)","author":"by Ogden Porter / Edited by Peter Gordon (puzzleeditor@nysun.com)","date":"2003-04-10","grid":"QkFDS0xBU0gjTEVIUkVSCkVUSElPUElBI0lOT1VZRQpTVEFSV0FSUyNNT09ORUQKVElOS0VSI1RJUCNQQVBBCk9MRSMjVEVFTlMjRUxBTApXQUxFUyNNTUMjV1JPVEUKIyMjVElBTUFSSUEjTkNSCk1JR0hUTUFLRVNSSUdIVApBQ0UjQVBQRUFMVE8jIyMKTUVURVIjRVNTI1NOT0JTCkFTU1QjSkVXRUwjI1BBVApDSElDI0FMQSNESVZJREUKQUVORUlEI1NUT05FQUdFClNFVFRMRSNUT1BSQVRFRApTVE9DS1MjRVRBSUxFUlM="},{"title":"Jack Nicholson Food Film Festival, 4/11/03 (Friday)","author":"by Randall J. Hartman / Edited by Peter Gordon (puzzleeditor@nysun.com)","date":"2003-04-11","grid":"Q0FTVCNSQVBTI0FHQVRFCkhVTEEjRU1JVCNNT0xBUgpFREFNI0xVVEUjQU5EUkUKRklWRUVBU1lQSVpaQVMjCiMjIyNMWUUjI1JPTyMjIwpDUklTSVMjU1RBTiNUUkkKUkFOQ0gjU0hBUSNBSEFCCkFTR09VREFBU0lUR0VUUwpTUE9UI1JJTksjSEVTU0UKSFNUI1BPTEsjR0lERU9OCiMjI1BPUCMjU09OIyMjIwojQ1JPSVNTQU5UR1VBUkQKTU9PTlMjRVJJQyNUUkVFCkJPTlpPI01BVEgjQUlERQpBTEFJTiNJTFNBI0hBU1A="},{"title":"Right Under Your Nose, 4/14/03 (Monday)","author":"by Ed Early / Edited by Peter Gordon (puzzleeditor@nysun.com)","date":"2003-04-14","grid":"Q0FQUkkjTEFUSCNEQVdHCkFJUkVEI0VDUlUjQUxPVQpTTElQT0ZUSEVUT05HVUUKQU1NTyNVU0VTI1BFRUxTCkJFQVRMRSMjU1RFI1JEUwpBTlQjQUxNUyNBTFBJTkUKU1RFQU0jRUFSTCNPQVRTCiMjI0xFT1RIRUxJUCMjIwpBTFNPI0FTSUEjQVNTRVMKUkFURURSI0JSQUcjQU1PCkFTQSNFU1EjI0NPT0xJTwpNT01NQSNVUE9OI01JVFQKQVJNRURUT1RIRVRFRVRICklERUEjU1RBTiNBR1JFRQpDQVJMI1BFU08jTUFJRFM="},{"title":"Love the Worm You're With, 4/15/03 (Tuesday)","author":"by Randall J. Hartman / Edited by Peter Gordon (puzzleeditor@nysun.com)","date":"2003-04-15","grid":"U0xBQiNSRUNVUiNCQVJTCkxVQ0UjTk9PU0UjT1JBTApFQVJUSEFOR0VMI09MR0EKRFVFVE8jIyNTQUNLT1VUCiMjI09TQUdFI1lBTSMjIwpIRUFSVExBTkQjTUFNQVMKQVJDIyNTUEFSI1BSSU5UCkRJRVRTI0lNQSNTS0FURQpFQ0xBVCNORVdUIyNNSUEKU0hBUEUjR0xPV1NUSUNLCiMjI0VWQSNTTklQRSMjIwpHQVJERU5TIyMjRUFSUFMKT0JJRSNTSUxLU0NSRUVOCkRJU0MjRUxJT1QjRUJSTwpTRUVLI0xPVVNZI0RBVUI="},{"title":"Changing Course, 4/16/03 (Wednesday)","author":"by John Underwood / Edited by Peter Gordon (puzzleeditor@nysun.com)","date":"2003-04-16","grid":"QUJFTCNTQU5LI0NPUk5FClJBR0UjVFJVRSNQTElFUgpPUkFOR0VBREUjQURETEUKVU5EVEhFQkVORCNXRUxECiMjI1RFTCMjU09TTyMjIwojTElPTkVTUyNUVVJOU0QKRUVOI1RST0xMI1BMVVRPCkxQR0EjU1BPT0YjRFJBVwpCRUVSWSNTUE9JTCNTSU4KT1dST09NI1NQTElDRVIjCiMjI01PQlMjI0lUTyMjIwpMQVZBI0FUUklHSFRBTkcKRUxJVEUjUkVHUkVURlVMCkZJVElOI0FMT0UjRVJURQpURkFDRSNQWVJFI1JPU1M="},{"title":"Plus Fours, 4/17/03 (Thursday)","author":"by Peter Abide / Edited by Peter Gordon (puzzleeditor@nysun.com)","date":"2003-04-17","grid":"UkFTUCNZU0wjI0ZBVVNUCklMSUUjQUNJRCNSVU5UTwpESU5TI01BS0VNWUREQVkKT0JFU0UjTEVJQSNJT05TCkZJWElOR0FERkxBVCMjIwojIyNNRU9XI1lFUiNCT0EKQUxBSSNPQUYjI09JTktTCk1JU1NJTkdUSEVETUFSSwpQTEFUVCMjRE9aI01JQVMKU09QI0VSQSNUUlVFIyMjCiMjI0FNRVJJQ0FTRENVUApPUEVOI0FVVE8jQUlPTEkKRkxBU0hEQkFDSyNBUEVTCkZJUkVSI0FMT0UjVEVFTQpTRUxMUyMjWUFXI0VTU08="},{"title":"Weekend Warrior, 4/18/03 (Friday)","author":"by Bob Peoples / Edited by Peter Gordon (puzzleeditor@nysun.com)","date":"2003-04-18","grid":"UFVUQVNUT1BUTyNSQ01QClVTRURDQVJMT1QjRUxJQQpUSFJFQURCQVJFI01BUlMKVEVSI01BSU5FI1NBUkFTCkVSQVMjI1RPT1RIUElDSwpSSUNFRCNTVVBSQSNPTEUKU05FRVJTI1RFQU1PTkVZCiMjI01PQVMjTkNBQSMjIwpDT01FT05JTiNJTlNJU1QKT05PI0xBR09TI1NFVFRPClVQVEhFQU5URSMjU0VFUApSQVRFRCNFREVNQSNSRUwKQVBPUyNJRE9ERUNMQVJFCkdFRVMjTElORVJOT1RFUwpFUlNFI09ORVJFRUxFUlM="},{"title":"It's a Guy Thing, 4/21/03 (Monday)","author":"by Allan E. Parrish / Edited by Peter Gordon (puzzleeditor@nysun.com)","date":"2003-04-21","grid":"TklOSkEjQUNFUyNURUVTCkFCT1VUI0RVQ1QjT1hFTgpQRVJUSEFNQk9ZI1NJUkUKRVRBI0VMSVMjTEFTU0lFCiMjI01JTFQjUklWRVRFUgpHT0VBU1kjSEFaRUQjIyMKQVZBTlQjTEFLRSNTQUdBClBBVFMjQ0FTRVMjQUpBWApFTFNBI09VVFMjU0xBVkUKIyMjUk9ORE8jU0NBUkVTClNBRERFTlMjQ09SRCMjIwpQSUVSUkUjTU9SRSNTT1cKRVNUTyNDSEFQVEVSVFdPCkNMRU8jVFVOQSNDSEFMSwpTRVJGI1NFWFkjSE9SU0U="},{"title":"At First Blush, 4/22/03 (Tuesday)","author":"by Sarah Keller / Edited by Peter Gordon (puzzleeditor@nysun.com)","date":"2003-04-22","grid":"U0NSQVAjQURPUFQjQUNFCkFST01BI1JVTEVSI09ITQpSVUJZVFVFU0RBWSNOQU0KQVhFI1NQQVQjI09QRVJBCiMjI0FEUyMjU1BVUiMjIwpDSEVSUllUT01BVE9FUyMKUlVOVFkjQVdPTCNWSU9MCkVSSUMjQklMS1MjRUVSTwpFTEFMI0FMRUUjQVJJRVMKI1NDQVJMRVRSSUJCT05TCiMjI1NBSUQjI0FTUyMjIwpQUkVTUyMjU0FHRSNMSUIKUk9EI0NSSU1TT05USURFCkVWRSNBRERVUCNDT1JFUgpaRU4jTEFTVFMjRU5ST04="},{"title":"Tech VIPs, 4/23/03 (Wednesday)","author":"by Norma Johnson / Edited by Peter Gordon (puzzleeditor@nysun.com)","date":"2003-04-23","grid":"QVZJUyNPQ0hFUiNCRVRBCk1JTEsjRFVNQk8jSVJPQwpJTlNJREVKT0JTI0dMVUUKU0VBI0lET1MjRUxNRVJTCiMjI0FOTyMjI0JBQSMjIwpPUEVOQU5EU0hVVENBU0UKVVJJQUgjT1BFRFMjV0lUClRBRFMjQU5BSVMjTEFTSApPREUjTUlESVMjU1RSQVkKRkFSTUVSSU5USEVERUxMCiMjI0VFTCMjI0VMUyMjIwpQQVRBS0kjVEhBSSNVWkkKSVJPTiNGTE9PREdBVEVTCktJV0kjVEVBU0UjSEFSUApFQVNFI1NFREVSI0FIT1k="},{"title":"Themeless Thursday, 4/24/03 (Thursday)","author":"by Randolph Ross / Edited by Peter Gordon (puzzleeditor@nysun.com)","date":"2003-04-24","grid":"TFNBVCMjU0NVTSNUQUJTCkFQUEFMQUNISUEjVklFVwpOQVBLSU5SSU5HI0FSVEUKRElMRVRUQU5URVMjTEVFCiNOWVNFI1BFQSNBR0VOVAojIyMjI1RFU1MjUkFUT04KT1JSI1RPUkUjV0VTVElFCkpFRVBFUlNDUkVFUEVSUwpTSUxFTlQjQVlFUyNSRVMKSVRBTE8jUExFRCMjIyMjCk1FVEVSI0xFUyNUUk9EIwpQUkUjU1dBTkVFUklWRVIKU0FERCNJTkRFTElDQVRFCk9UVE8jTEVBREZPT1RFRApORU9OI0VSUlMjI0hFUk8="},{"title":"Period Piece, 4/25/03 (Friday)","author":"by Elizabeth C. Gorski / Edited by Peter Gordon (puzzleeditor@nysun.com)","date":"2003-04-25","grid":"TElTUCNSQUhBTCMjVEJBCkFOS0EjRUxFVkUjU0hBTQpNRkFTI0FBUk9OI1RFUkkKQlVUU0VSSU9VU0xZREREClNORUVaRSNEQ0NJWCMjIwojIyNSSU5HI0hBTSNMU0QKQU5EU09ET0kjUE9TRVVSCkJPT0IjI0RERCMjQU5OQQpCVU5ZQU4jT0VOT0xPR1kKQU5UI0RVQyNEQU5BIyMjCiMjI0RPRE9TI1BFUlNJQQpERERBU0lXQVNTQVlJTkcKSVRFTSNTUFJBVCNDRURFCk1JTEUjVEVBU0UjQUdJTgpFRUwjI1NBTkVSI1BFQVQ="},{"title":"Honey Bunch, 5/5/03 (Monday)","author":"by Sarah Keller / Edited by Peter Gordon (puzzleeditor@nysun.com)","date":"2003-05-05","grid":"SkFCUyNTUElHT1QjQUxBCk9CT0UjQ0lDRVJPI05FVApCRUFVVFlRVUVFTiNHQUIKIyMjU0lUVSMjU0VDRURFCkdFVFNBSEVBRCNST0xFUwpFTE8jI0VERElFI01BUlQKTUVESUEjI0VSTklFIyMjCiNDT05TVEFOVERST05FIwojIyNDSElOTyMjU05PV1kKTUFUSCNTTklQUyMjREVFCkFMSUVOI0FERVBUTkVTUwpLQU5TQVMjI0xBS0UjIyMKRVNTI01FVEFMV09SS0VSClVLRSNFTEVWRU4jVklMQQpQQUwjU0xFRVRTI0VNSVQ="},{"title":"\"Oh, My!\", 5/6/03 (Tuesday)","author":"by Peter Abide / Edited by Peter Gordon (puzzleeditor@nysun.com)","date":"2003-05-06","grid":"QUNEQyNEVVNUI0lET0xTClBPVVIjQVNJQSNURUhFRQpSRUJFTFlFTEwjQVZJQU4KIyMjREVUUk9JVExJT05TClJBQ0lFUiNTQU8jTFVURQpBU0hUUkFZIyNXRUQjIyMKU1RBIyNERVZPI0xPREdFClBSSU5DRVRPTlRJR0VSUwpTT05JQSNJU0VFIyNUSVMKIyMjQ0JTIyNTQVRIT01FCkFNT0sjRVBBI0NPQVhFUwpCQURORVdTQkVBUlMjIyMKQUxJQVMjSEFSRFlCT1lTClNMVU1QI0FDSUQjUkhFQQpIRU1FTiNXSU5ZI09NQU4="},{"title":"Obstacle Course, 5/7/03 (Wednesday)","author":"by David J. Kahn / Edited by Peter Gordon (puzzleeditor@nysun.com)","date":"2003-05-07","grid":"SEFaQVJEI1dISVIjQlJBCkFNRUxJRSNBVVRPTE9BTgpMT1JFQUwjVEhPVVNBTkQKTEVPI0xJTkUjI0dVVFRZCk9CRVkjQUZSRVNIIyMjIwpXQVNBVCNMT1ZFRCNXT0sKIyNJTlJJI1ZFRVIjSFVFCkJVTktFUk1FTlRBTElUWQpVU08jRVZFUiNPRklUIyMKVEVOI0hJTlRTI1RFRU1TCiMjIyNVTlNIT0QjU0hPVApET0lORyMjRURBTSNPQVIKSU5SRUdBUkQjUkVUVU5FCkFDQURFTUlBI1RFQVNFUwpaRU4jUk9PTSNTS0lFUlM="},{"title":"Themeless Thursday, 5/8/03 (Thursday)","author":"by Robert Ward / Edited by Peter Gordon (puzzleeditor@nysun.com)","date":"2003-05-08","grid":"R0FTTUFTSyMjQUxDQVBQCkVDTElQVElDI0xPQU5FUgpORUFSQkVFUiNPQkxBVEUKVE9LRVMjTFVBVVMjQ0VFClJVRVMjVEJJUkQjTU9STgpZVEQjQlJBU1MjUklOU0UKIyMjVEVBU0UjREFOREVSCiNFQVJMWUFNRVJJQ0FOIwpDQVJPTFMjSU5VU0UjIyMKTFNBVFMjQVNUUkEjUE9QCkVUQ0gjUFVTSFkjTU9STwpBU0gjTkFESVIjR0FMQVMKUklOR0VEI0xBQk9SSVRFCkVESVRPUiNFTEVWQVRPUgpSRURPTkUjI0xFVFRFUlM="},{"title":"Menu Musing, 5/9/03 (Friday)","author":"by Louis Hildebrand / Edited by Peter Gordon (puzzleeditor@nysun.com)","date":"2003-05-09","grid":"Q0hSSVNUTUFTI0JVU1RTCkxJRVNBV0FLRSNVU1VSWQpBTE1BTUFURVIjUkFOSU4KUExPVFMjI0VSSU4jREVDCkZBUiNPTkVNQU5TRklTSApPUlMjTk9XIyNESUxBVEUKUllFUyNSSVRBI0RPTEVECiMjI0lTQU5PVEhFUiMjIwpTV0FOSyNHT1JFI0FTU1QKQUVORUlEIyNBUkkjVFVFCk1BTlNQT0lTU09OI0FUTQpVS0UjUEVOQSMjSEVUVVAKUkVUSUUjRU5DTE9TVVJFCkFTVEFSI1JFTE9DQVRFUwpJVEVNUyNUUklDS0lFU1Q="},{"title":"Cattle Call, 5/12/03 (Monday)","author":"by Ed Early / Edited by Peter Gordon (puzzleeditor@nysun.com)","date":"2003-05-12","grid":"RVRBVCNQQVNTI0JFQk9QCkJBUkUjQUxPVSNBUlVCQQpPWFlNT1JPTlMjU0FMT04KTEVBUFNBVCNJTEsjTEVHCkFSTkVTUyNERVBFTkQjIwojIyNST09NWSNTVFJPTkcKQ09DQSNMQU5FI1JBWk9SCkFETyNVU1VBTExZI0VWQQpST1dBTiNJU0xFI0RSQUIKQlJBSURTI1RFQVNFIyMjCiMjQkxFQVJZI1RFQUNVUApTVFUjUkNBI1RIRVJPU0UKQ09OR0EjU1RFRVJTTUFOCkFOR0VSI1RJRVIjSU1JTgpSRUFMTSNBTkRZI1JBUkU="},{"title":"Silent E's, 5/13/03 (Tuesday)","author":"by Paula Gamache / Edited by Peter Gordon (puzzleeditor@nysun.com)","date":"2003-05-13","grid":"QVRPTSNDTE9EIyNMSVNUCkJSSUMjWUlQRVMjQUxUTwpCRUxMRUNVUlZFI1pPT00KUkVTRUFMI1lPTiNJTlJFCiMjI0FTSUEjVFNVTkFNSQpNQUlORVNRVUVFWkUjIyMKT1JSI1NUVU4jI0lTTElQCkFOT04jU0FJTFMjU09BUgpUT05FUyMjVFVUVSNBR08KIyMjV0lMREVLSU5HRE9NCkFMVU1OQUUjRUNITyMjIwpSRVBPI05CQSNLSURERVIKRURFTiNDQVNURVBBUlRZCk5JTkUjRVRIRVIjUkFSRQpBTkRZIyNFRUxTI0RZRVM="},{"title":"Lined Up, 5/14/03 (Wednesday)","author":"by Rich Norris / Edited by Peter Gordon (puzzleeditor@nysun.com)","date":"2003-05-14","grid":"UEJTI0tJV0kjU1RQQVVMCkVFTiNFVkFOI1BFRVJBVApXSE9TTkVYVCNSRVRBUkQKVEFSVFMjI09NSVRTIyMjCkVWRVIjSE9XU1RISU5HUwpSRVNJREVEI1NFRVRPSVQKIyMjS09SRUEjIyMjSVZZCiNXSEVSRVNUSEVGSVJFIwpSSU8jIyMjTVVTSUMjIyMKQVRQRUFDRSNBVFRBQ0tTCldIRU5TTFVOQ0gjUkFOSwojIyNDSE9SRSMjUFVSRUUKU0hPT0lOI1dIQVRTTkVXCkdPRlJFRSNFTU1BI0FMRQpUT1RFUlMjTE9JUyNMU0Q="},{"title":"A River Runs Through It, 5/15/03 (Thursday)","author":"by Jerry E. Rosman / Edited by Peter Gordon (puzzleeditor@nysun.com)","date":"2003-05-15","grid":"QUZMQUMjTU1EQ0wjTEFNCkFSSUVMI0VORVJPI0VSQQpIT1VTRUJST0tFTiNOSVAKIyMjT0FSIyNFVEVSTkFMCk1JU1BSSU5UI0VMT0lTRQpBUlQjI01PSFMjSUxMIyMKU0VFUFMjTEVUI0VMRUNUClNORVJUI0VSRSNTRU5TRQpFRUxFUiNTSVIjVFJBUFMKIyNCRUUjU1RFUCMjUEFUCk9QRU5FRCNaT09NTEVOUwpIT0xTVEVSIyNVQUUjIyMKR1VUI0NMT1ZFUkhPTkVZCkVORSNBVEJBVCNBTklTRQpFREQjUkFTVEEjTEVBU1Q="},{"title":"Weekend Warrior, 5/16/03 (Friday)","author":"by Michael Shteyman / Edited by Peter Gordon (puzzleeditor@nysun.com)","date":"2003-05-16","grid":"QURPQkVTIyNUWkFSSU5BCkxPUkVMRUkjRUFTRURVUApUVVRFTEFSI0VYSUdFTlQKVUdIUyNNQUNISU5BIyMjClNIT1dTI05PRVMjTERTIwojI0RBSCNJTEUjR0lKT0UKUFJPWElNQUwjSU5BSkFNCk9PWCNNSU5PTFRBI0FSVApQQUpBTUEjUVVBUlRaRVMKRUxFR1kjRlVOI0xJWiMjCiNEV0kjRUxJQSNTVFlMRQojIyNUSFJFQVRTI0FKQVgKQVNUQUlSRSNJTkFORVNUClJPT1RST1QjQ09OSUZFUgpNVURFRUxTIyNCSUFGUkE="},{"title":"Touch 'Em, 5/19/03 (Monday)","author":"by Ogden Porter / Edited by Peter Gordon (puzzleeditor@nysun.com)","date":"2003-05-19","grid":"U09GQSNKRUFOUyNBU0FQCldISVojT1BDSVQjQU5URQpBSU5UI0hBTU1FUkhFQUQKTU9ERVJOI0VSSUUjRVJSCiMjI0NBRFMjT05UQVJJTwpSVUJTSE9VTERFUlMjIyMKQVBFIyNFUkUjTU9TTEVNCkNPUkdJI0VWQSNTVE9MRQpFTlRPTUIjRUdPIyNCTFQKIyMjVEhFQkVFU0tORUVTCkFJUkhPTEUjRU1JTCMjIwpEWEkjTVVTVCNPTUVMRVQKT05PTkVTVE9FUyNBVVJBClJBVEUjSEVOUkkjU0FJTApOWVNFI0lERUFTI1RVQ0s="},{"title":"The Real Deal, 5/20/03 (Tuesday)","author":"by Norma Johnson / Edited by Peter Gordon (puzzleeditor@nysun.com)","date":"2003-05-20","grid":"QVNQIyNOT1JUSCNDUkFNClBMRUEjQUxBUk0jQVVUTwpQVVJSI1BBVEVTI01CQVMKVFJJQ0tLTkVFI0NBQkxFCiMjI0xBSUQjI1JBUkVMWQojU1RBSU4jRUxJTk9SIyMKV09STSNTQU1PU0EjRFVFCkVSVVBUI0xBVEVSI1VTQQpTRU0jQVVESVQjRElDRVMKVFNQI0xJRUxPVyNTS0FUCiMjUE9LRVJTI0FIT1lTIwpEUkFQRVMjI0NSSUIjIyMKUlVMRUQjU0xBTURBTkNFCklSQU4jSEVJREkjUk9BTgpQQUNFI0FHRUVTI1NQUlkKU0xFRCNTT1VUSCMjRVRB"},{"title":"Out of Order, 5/21/03 (Wednesday)","author":"by Randolph Ross / Edited by Peter Gordon (puzzleeditor@nysun.com)","date":"2003-05-21","grid":"SVNMRSNBU1BDQSNEQUhTClNUQVIjU1RFQUwjQVJFQQpUT05HI1RPUlNPI0ZPQUwKI09ET1JJTlRIRUNPVVJUCkVMRiNBUkUjIyNIRVNTRQpESUFORSNIRUNUTyNFRVIKVEVMRSNDRUxMQVJTIyMjCiMjTEFXQU5EQVJET1IjIwojIyNMQVJHRVNUI0FVTEQKQUNUI1ZFRVJTI0FSQk9SCkdMT0JFIyMjSUNFI0JPWQpIT0FSREVST0ZGUklFUyMKQVNUTyNSRU9JTCNPREVTClNFRU4jQVBORUEjV0lTSApUUkVYI1RPQVNUI0FOVEU="},{"title":"Themeless Thursday, 5/22/03 (Thursday)","author":"by Byron Walden / Edited by Peter Gordon (puzzleeditor@nysun.com)","date":"2003-05-22","grid":"Q09NUEFOWUIjRUxBVEVECk9WRVJTRUVSI0tPTU9ETwpOSU5FSE9MRSNHT0JBTkcKREVOU0UjTEFII05JTU9ZCk9ERVMjTE9ERVIjVE9SRQpST04jVE9XRVJFRCNVVEEKIyMjTUlUUFJPRkVTU09SCk1JTk9HVUUjU0FURUVOUwpUUkFERVNQTEFDRVMjIyMKQVJJI1JFUElORVIjVEFEClJJTEwjU0VORFMjQ09SRQpBVEVBVCNSRVcjS0FSTUEKUkFESUFMI1NJREVST0FECkFUT05DRSNVQ0lSVklORQpURU5FVFMjUEhPTkVESU4="},{"title":"Out on a Limb, 5/23/03 (Friday)","author":"by Brendan Emmett Quigley / Edited by Peter Gordon (puzzleeditor@nysun.com)","date":"2003-05-23","grid":"TUFDI1lFTFAjI1RCT05FCk9OTyNPTElWRSNSVURFUgpOVEgjRE9OVFNRVUVFWkUKVEhFQ0hJTiNURUxMIyMjCkhFUlIjIyNMQURZTFVDSwojTUVBTklFUyMjI0VST08KIyMjR0VOVERJU1RSSUNUCkFOSSNBQ1QjQk9BI1NPTwpXSU5HVEhFQkVOQ0gjIyMKT0tSQSMjI0FUU1RBS0UjCkxFRUdSQU5UIyMjTkVUUwojIyNST0lMI0ZBTFNFQUwKVkVOVVNERU1JTE8jUExPCkFHSUxFI1JJVkVUI0FJTQpUT01FUyMjVEVYVCNUQU8="},{"title":"Sports Lexicon, 5/27/03 (Tuesday)","author":"by Craig Kasper / Edited by Peter Gordon (puzzleeditor@nysun.com)","date":"2003-05-27","grid":"Qk9USCNDSE9VI0JMSVBTCkFSRUEjTEVBSCNJT05JQQpCQUxMUEFSS0ZJR1VSRVMKQUxMRk9VUlMjUEFWRVJTCiMjI01SUyMjRE9QRSMjIwpDQVBPTiNMSVUjUFJFRU4KQUZSTyNQRU5QQUwjTEVPClBPSU5UT0ZOT1JFVFVSTgpUT00jRVhURU5UI09ESUUKU1RPUk0jSVJUI1RXRUVUCiMjI0VCQU4jI05PVCMjIwpTVEVFTEUjUFJFVFJJQUwKUEFSRk9SVEhFQ09VUlNFCkVMTUVSI1dFRUsjQ09UUwpXRUFSUyNPV0xTI0tOT1Q="},{"title":"All in the Family, 5/28/03 (Wednesday)","author":"by Jay Sullivan / Edited by Peter Gordon (puzzleeditor@nysun.com)","date":"2003-05-28","grid":"REVMSSNTVEVBRCNUQkFSCkVSSU4jWUFMSUUjSElMTwpGT0RERVJUSU1FI0FHVFMKWU9TRU1JVEUjUElOQk9ZCiMjI01FQUwjT1JERVIjIwpBU1dBTiNFUFBJRSNPUFQKVVBFTkRTI1JFVlMjT1JZCkRFQUQjT1BJTkUjU0RBSwpJTksjU0NBTiNSRUNFREUKT0RTI0FDVVRFI1RPUk9TCiMjSU5URUwjQUNIVCMjIwpWRVRPRVIjQVJSRVNURUQKQVJUUyNNVVRURVJNQVlJClNNRUUjT01BSEEjQVBFUgpFQVJTI01BREFNI05FU1Q="},{"title":"Umbrella Policy, 5/29/03 (Thursday)","author":"by Paula Gamache / Edited by Peter Gordon (puzzleeditor@nysun.com)","date":"2003-05-29","grid":"TUlEQVMjUEVBUyNQQVNTClNDRU5UI0lBR08jSUJFVApUSEVUSU1FVE9SRVBBSVIKIyNQRVJPVCMjVFNFVFNFClJFRCMjQklCSSNDUkVNRQpFWElTVCNOSU5USCNTU1QKUElTVElMI0dSRUVUIyMjCiNUSEVST09GSVNXSEVOIwojIyNXQUNLTyNTRUVHRVIKTVNTI01PUk9OI0RPR01BClRJUFBJI0FUT00jI1dPTgpFR1JFU1MjI09QUkFIIyMKVEhFU1VOSVNTSElOSU5HCk5FQVQjT0JPRSNQRVRFUgpBRERTI0JNV1MjU1dFREU="},{"title":"Wacky Weekend Warrior (See Notepad), 5/30/03 (Friday)","author":"by Trip Payne / Edited by Peter Gordon (puzzleeditor@nysun.com)","date":"2003-05-30","grid":"Q0VEQVJPQ1JBVCNXSU1QClNQQU1FTUFJTEVESVRPUgpQSVRBU0lOR0xFT0xJVkUKQVJFVEhFVEhJTkdTU0VUCk5BTUVPUiNUUkVFREVNTwpJVE9VVCNBQk9WRU9WRU4KREVFUiNTQ0VORVNDRU5FCiMjIyNBQ0VOSU5FIyMjIwpPR09EUEFSRU5UI1dBWVMKTk9OQUlSQkFHI01JTUVFClRIRVJFU0lUI01BREFNRQpSRVNFQVJDSEJPREVSRUsKSU5ESUdPRkFTVEVOSU5HClBST1JPTUFOSUFNQU5JQQpTSU5TI0VYWFhYRVhFQ1M="},{"title":"Coverups, 6/2/03 (Monday)","author":"by Alan Olschwang / Edited by Peter Gordon (puzzleeditor@nysun.com)","date":"2003-06-02","grid":"UkVDQVAjUk9ESU4jRklHCklSQU5JI0lOQU5FI0lETwpDT0FUT0ZQQUlOVCNCRUEKRU9OI05FT05TI1RSRUFUCiMjIyNFTEYjI0xFQVIjIwojQ0FQRU9GR09PREhPUEUKTU9ERVJOI1JVQiMjUEVOCkRSSVBTI09BVCNTSVRFRApDQVIjI0JBRCNBV0FJVFMKQ0xPQUtPRlNJTEVOQ0UjCiMjTkNBQSMjTU9FIyMjIwpPTERFTiNERVBPVCNPRlQKQkFBI1NMSVBPRlBBUEVSCklOQyNBSVJFUyNFTEFURQpFRUsjU0xFRVQjQUxMQVk="},{"title":"Butterfingers, 6/3/03 (Tuesday)","author":"by Randall J. Hartman / Edited by Peter Gordon (puzzleeditor@nysun.com)","date":"2003-06-03","grid":"TUFTUyNTVEFCI0ZPT0RTCk9BSFUjUEFHTyNPUElORQpDUk9QI0VYQU0jTEFMQVcKSE9PUFNBSVJCQUxMIyMjCkFOVExFUiMjU05PI01BUAojIyNFQUdFUiNTV0VFVFMKUEFUIyNVU0VTI1VMVFJBCk9SRUdPTlRST09QU0FJTApTRU5PUiNBQVJQIyNMQU0KU05PT1RTI05FUEFMIyMjCkVBUiNIQVMjI09SQVRPUgojIyNDT09QU09OQ1JFVEUKVFJJRUQjUk9ERSNTQVRFClJPTkRPI0lNSU4jRVJPUwpBTk5FWCNHRU5UI05ZU0U="},{"title":"Storied Beginnings, 6/4/03 (Wednesday)","author":"by Rich Norris / Edited by Peter Gordon (puzzleeditor@nysun.com)","date":"2003-06-04","grid":"QVNUTyNEVUZGI1dIQVJGClZBSU4jRVNBSSNIQUxFWQpBUk5FI0JFRFMjQUxJQkkKU0FHQU1PUkVISUxMIyMjClRIRUNBTiMjI0RFUE9SVAojIyNUUkFDSEVBI0FNT1IKVEFUI0FJUkVSI0JTSURFCkVQSUNVUkVBTlRBU1RFUwpUUkVBRCNUUklBRCNTT1MKUk9JTCNSRVNFTExTIyMjCkFOTkxFRSMjI0tJVEJBRwojIyNUQUxFTlRTRUFSQ0gKWU9HSVMjTEVBSCNUWVJPCk1VTU1ZI0FNTU8jSUNFUwpBVFNFQSNMT0VXI0NFU1Q="},{"title":"Prefixer-Upper, 6/5/03 (Thursday)","author":"by Lee Glickstein and Myles Callum / Edited by Peter Gordon (puzzleeditor@nysun.com)","date":"2003-06-05","grid":"UFNBTE0jQUJVVCNDQVBQClRBTElBI05FSEkjT05FQQpBWElORyNLUk9DI0xBUFMKIyMjRUlHSFRIVEhFSVNUCktBSFVOQSMjI0FVU1NJRQpBUEVQT0xJVElDQUwjIyMKUkFFI1RBUElOI0NBUkJTCkFDREMjU0FUQlkjV0VSRQpURVNMQSNTSE9PVCNMRUUKIyMjQUNFU0VYVUFMSVRZCk1PUlBIUyMjI0xJT1RUQQpBVEVUWVBJQ0FMTFkjIyMKU1RBUiNBREFNI0lPVEFTCktPTEEjTk9OTyNOTEVSUwpTSU1QI0FMRVMjR0FURVM="},{"title":"Weekend Warrior, 6/6/03 (Friday)","author":"by Bill Weber / Edited by Peter Gordon (puzzleeditor@nysun.com)","date":"2003-06-06","grid":"UEVQVEFMSyNMQUJBTUJBCkFMT0hBT0UjRUxFR0lFUwpSRUxFQVJOI1RBR0VORFMKT1ZFUkFDVCNNRUFTVVJFCkxBQ0UjQU9ORSNUQVRFUgpFVEFUUyNOT1NFI0dJU1QKU0VUT1VUI1hFRCNPQVRTCiMjIyNNSVpaRU5TIyMjIwpBTElJI1BPRSNBT1JUSUMKWklORyNTT01FI0JFUlJBCkFNRU5TI01BUlMjR09PUApMRVhJQ0FMI1JFQVJJTkcKRVBJVE9NRSNBTkdFTE9VCkFJTEVST04jTk9VVFVSTgpTRUVSRVNTI0RSRVNTRVM="},{"title":"H-P, H-P, Hooray!, 6/9/03 (Monday)","author":"by Ogden Porter / Edited by Peter Gordon (puzzleeditor@nysun.com)","date":"2003-06-09","grid":"QUNFIyNBQUhTI1RSQVAjCkRBRCMjRElJSSNXSU5FIwpBTUkjSE9ER0VQT0RHRSMKTUVUT08jRUdHUyNFTExBCiNST05DTyNMRUFII0VFTApMQVJPVUNIRSNUQVBFUlMKT0JJI1NUVUQjU05MIyMjCk5BQUNQI0dZTiNLRUFUUwpJR0xPTyNPUEUjWUFMSUUKIyMjUkNBI0lIT1AjTVRBClNUUEFVTCNHSVJBU09MUwpQRUEjU0xBRyNTTklERSMKQVRNUyNPU0xPI0tOT1BGCiNIRU5OWVBFTk5ZI1ZBTAojRUxJRSNFREVOIyNBR0UKI1JBVEUjTllTRSMjUkVY"},{"title":"Making Sense, 6/10/03 (Tuesday)","author":"by Byron Walden / Edited by Peter Gordon (puzzleeditor@nysun.com)","date":"2003-06-10","grid":"TUlGRiNISUZJI0JVR0xFClVDTEEjT0RPTiNJU0FBQwpMRUFLI0xJR0hUVE9VQ0gKTFVLRSNZT0dVUlQjTEVPClNQWUlORyMjTUFFIyMjIwojIyNERVJJREUjUkVWRUwKQVBPI1dBUkUjU1RST0RFCkpVRElDSUFMSEVBUklORwpBTU9SQUwjVEFQUyNEQVMKUkFSRVIjTkFNQVRIIyMjCiMjIyNTTE8jI1JFQVNPTgpFTVUjTUVEVVNBI1NJWkUKUklGTEVTSUdIVCNCUk9XCklOT0lMI0NMVUUjUkVOVApFRFNFTCNFWUVTI09ERVM="},{"title":"Scheme Team, 6/11/03 (Wednesday)","author":"by William I. Johnston / Edited by Peter Gordon (puzzleeditor@nysun.com)","date":"2003-06-11","grid":"RklTVFMjUVRJUCNJUk9OCkxBTEFXI1VPTU8jUEVOVApFTU9URSNFR0FOI0VBQ0gKQUJCQUFCQkFDREVDREUjCiMjIyNST0UjI1NUQSMjIwojQUJBQkJDQkNDRENERUUKRUJPTlkjI09QVVMjT1dOCk1PT04jTUFEQU0jQVJJRApNTUwjU0FNRSMjUExBTlMKQUJBQkNEQ0RFRkVGR0cjCiMjI1JBUyMjTk9SIyMjIwojQUJBQkNDRERFRkZFR0cKU0xBVyNFVVJPI0VBU1lBCk9QRU4jTkVBUiNDUkFNUApDT1pZI0VTVEEjVFJVU1M="},{"title":"Themeless Thursday, 6/12/03 (Thursday)","author":"by Craig Kasper / Edited by Peter Gordon (puzzleeditor@nysun.com)","date":"2003-06-12","grid":"TUFSQ0VMIyNOSUNPTEUjCkNSRU9MRSNGQVJBUEFSVApBQ1RPVVQjT1BFUkFUT1IKI0hPTERTQUNBTkRMRVRPClBBVVNFI0lTTEUjI1JJUApNSUMjI0hPTE0jVEVBQ0gKU0NIRURVTEUjUkVQTEFZCiMjI01JTUkjQ09SRSMjIwpBR0dJRVMjTEFVUkVBVEUKQlJBVFMjQ0FSVCMjSVJTClNPRCMjTE9CRSNTQ1JJUApVUFNJREVET1dOQ0FLRSMKUkVEUk9WRVIjT0FGSVNICkRSRUFNRVJTI0VSRVNUVQojU05FRVJTIyNMRVNTRU4="},{"title":"Small Change, 6/13/03 (Friday)","author":"by Ed Early / Edited by Peter Gordon (puzzleeditor@nysun.com)","date":"2003-06-13","grid":"QkFMRVMjUEFTUyNJVENICkVNSUxFI09ORUEjU0hPTwpIVElNRSNFVEFMI0FSTVMKIyMjRVJPVElDQSNCRUVUClNBQ1JFRCNDT01QRUVSUwpVTlUjU09CI1dJTExQIyMKSVNQI1NSQVMjI09MT1JEClRFUk0jU1RBRkYjQVBFUgpTTE9FUyMjQ0VSRiNFTEkKIyNOQU5ERCNaT08jUklQClBMQVRPT05TI0RVQ0FUUwpZRUxMI0lTQURPUkEjIyMKUk9MRSNOSUNFI1RSQURFCkVOT1MjR09SRSNIT1ZFTApTQVlTI1NOQVAjUUJBQ0s="},{"title":"City Presidents, 6/16/03 (Monday)","author":"by Ogden Porter / Edited by Peter Gordon (puzzleeditor@nysun.com)","date":"2003-06-16","grid":"VklTQSNTUEFTTSNBTE9UCklSQVEjUE9MS0EjTEVOQQpNRU5VI0hJVElUI0xBUksKIyNNQURJU09OQVZFTlVFClNFQSNPTkUjI0hPTkVTVApPVVRGT1gjSEVBTCNSSE8KQVJFQSMjSEVBUlRTIyMjClJPT1NFVkVMVElTTEFORAojIyNUUkFNUFMjI0VTQVUKSEFUI0FTUFMjQk9XVElFCk9QSUFURSMjVEVBI0VMUwpMSU5DT0xOQ0VOVEVSIyMKREVNSSNJQ09OUyNSSVBTCklDRUQjTk9UU08jQVNJQQpURU5TI0VTU0VOI1NLRVc="},{"title":"Head Chef's Specials, 6/17/03 (Tuesday)","author":"by Kent Lorentzen / Edited by Peter Gordon (puzzleeditor@nysun.com)","date":"2003-06-17","grid":"QUNMVSNMQU1FI0NMQU1TClJPT0YjQVJJQSNIQVNBVApDT0NPTlVUQ1JFQU1QSUUKQUxBI09ESUUjTVJCSUxMCkRFTCNURUUjUElUI1JJTQpFU1BJRUQjSlVMI0xFTk8KU1RVTVAjTUFSSVNBIyMjCiMjQkVBTlNQUk9VVFMjIwojIyNBRElEQVMjQklLRVIKSUNPTiNDT04jRUxOSU5PClJBUCNTT1MjRlJJI1BBUwpBUFBFQUwjUk9BTSNSQkkKTk9PRExFQ0FTU0VST0xFCklOU0VUI0FQU0UjQVBFUwpTRUVSUyNSVEVTI1RFU1Q="},{"title":"Note-able, 6/18/03 (Wednesday)","author":"by Jerry E. Rosman / Edited by Peter Gordon (puzzleeditor@nysun.com)","date":"2003-06-18","grid":"UEFDRUNBUiNDT1RUT05ZCkVNVUxBVEUjUExFQVRFRApET1NBR0VTI1JFQUNIRVMKIyNTTEVVVEgjQVJURSMjCkFMSSNTUEFSSU5HI0xZRQpSSU5HIyNSRU4jQUlMRVkKTUlHUkFOVCNGQVNUT05FCiMjI0FQVSMjI0RFQyMjIwpTT0xWRU5UI0xBU0hPVVQKU0xJRVIjQUFBIyNZVUdPCkVFRyNJQUNPQ0NBI1RIWQojI0hUVFAjS0VOTkVMIyMKVElUSElORyNET0dSQUNFCk9WRVJGRUQjVVRFTlNJTApNRURVU0FTI1BFTE9UQVM="},{"title":"Fish Hooks, 6/19/03 (Thursday)","author":"by Bob Peoples / Edited by Peter Gordon (puzzleeditor@nysun.com)","date":"2003-06-19","grid":"VEJTUCNUT0FEI0JMQVpFClJJQUwjQUxGQSNSSURFUgpVU1RBI01PUk4jT1pPTkUKU1FVSURQUk9RVU8jIyMjClRVUk5SRUQjVVBEQVRFRApTRU5TT1IjS0FOU0FTU1QKIyMjI1dFRU5ZIyNSQVBTCiNHUkFORFNPTEVPUFJZIwpIT09GIyNQTEVBVCMjIyMKQVRUQUdJUkwjR09SSU5HClRIRVJPU0UjRUxFQU5PUgojIyMjS0lTU01FU0tBVEUKUUFOREEjU0hPRSNFVE5BClRSSUVSI09BVFkjUklPVApTVFBBVCNTTUVFI1NFV1M="},{"title":"Weekend Warrior, 6/20/03 (Friday)","author":"by Patrick D. Berry / Edited by Peter Gordon (puzzleeditor@nysun.com)","date":"2003-06-20","grid":"TkVBUkJFRVJTI0FMSVNUCkFMRkFST01FTyNWSVJUVQpUV09NSU5VVEUjQURPUk4KQ0FSRVRTI0lWRVMjTkVBCkhZRU5BI0JMRUFUI0hBTQojIyMjTkZMRVJTI0NPS0UKSEFJUk5FVFMjRU1FUklMCkFVTlRJRVMjTU9PTlNFVApVTkRFQUQjU0FVTlRFUlMKTEFPUyNTQ09UVE8jIyMjCkVUQyNCT0FSUyNDQVRFUwpEVUgjT05UViNDVUJJU1QKT1JJT04jUklHT0xFVFRPCkZFTkNFI0lOQUxBVEhFUgpGTEFUUyNHT0JFUlNFUks="},{"title":"Body Double, 6/23/03 (Monday)","author":"by Ed Early / Edited by Peter Gordon (puzzleeditor@nysun.com)","date":"2003-06-23","grid":"Q1JJQiNVU0VSI0NBVklMClpPTEEjWklUSSNVVElDQQpBTExTS0lOQU5EQk9ORVMKUkVTSU4jIyNTSUFNRVNFCiMjI0NPTkdBRUQjIyMjIwpTUEEjQkFSUiNPUkFDTEUKVE9ETyNUT1RPI0VMTElTCk9MREJMT09EQU5ER1VUUwpNRUxFRSNNRVRFI0FDSEUKUFJFWU9OI0NIQVAjS0VOCiMjIyMjQVBPU1RMRSMjIwpBR1JJUFBBIyMjVVJHRVMKRlJPTUhBTkRUT01PVVRIClJBQklEI0RFQU4jREFURQpPTUVOUyNBTk5FI0VNVVM="},{"title":"National League, 6/24/03 (Tuesday)","author":"by Jon Delfin / Edited by Peter Gordon (puzzleeditor@nysun.com)","date":"2003-06-24","grid":"QVRPWiNDT0xBI0FTSEVTCk5FUk8jUklBTCNUSUFSQQpPUkVPI0VMSVMjT05UQVAKSVJJU0hNQ0NBTExBIyMjCk5PRCNFRUwjQ0FMSVNUQQpUUkFJTCNPVkVOIyNUQUcKIyMjQ0VTVEEjQ0FMSUNPCiNGUkVOQ0hTVEVXQVJUIwpHVUlUQVIjQ1VSRUQjIyMKRUdPIyNJUk9OI0lETEVECkVVVEVSUEUjR0FHI09OTwojIyNEVVRDSFNDSFVMVFoKREVWSUwjQVVUTyNTSVJFCkVMSVRFI0xFRVIjU1RBTgpCTEFTUyNMWU5OI1JBUFM="},{"title":"Magnum PI, 6/25/03 (Wednesday)","author":"by Paula Gamache / Edited by Peter Gordon (puzzleeditor@nysun.com)","date":"2003-06-25","grid":"UFRBUyNDRVNUI1BMRkVSCkdJTEEjQUxJSSNOQUlWRQpTUEVDI1JJR0cjSElSRUQKI1BDS1VQVEhFUEVDRVMjCiMjIyNURUUjUkNBUyMjIwpFUFRIRVQjQUNBRCNQQ0EKTUVZRVIjQVJBQiNBTE9VClBQUExPTkdTVE9DS0lORwpSQU5EI0VST1MjSElORFUKRU5HI0RJT04jUkFOR0VSCiMjI1NJR04jU0VaIyMjIwojUFBOR0hPVFBaWkFQRSMKUE5LSUUjTU9OTyNTRVBBClNFRURTI0lSQU4jUFRDSApBU1NFVCNDT0xFI0NBU0E="},{"title":"Themeless Thursday, 6/26/03 (Thursday)","author":"by Bill Weber / Edited by Peter Gordon (puzzleeditor@nysun.com)","date":"2003-06-26","grid":"U01BQ0tEQUIjU0NBUkNFCkxJQ09SSUNFI1RBUEVSUwpJTkNMT1ZFUiNJUEVDQUMKQ0FSRENBU0UjQ09ST05BCkVSRSMjIyNUU0sjI0xJUApSRVRPT0xTI0hJUEJPTkUKU1RFV1BPVCNBVExBUkdFCiMjI0xBVkEjUk9BRCMjIwpBREhFUkVSI1BVTkdFTlQKUFJBVFRMRSNTVEVFUkVSClBBUiMjRURTIyMjI01BRQpPQ1RBTlQjQ09SU0FJUlMKU1VNTUlUI0FCQUxPTkVTCkVMQUlORSNQRUtJTkVTRQpEQU5ORVIjRVlFVEVTVFM="},{"title":"Moving In, 6/27/03 (Friday)","author":"by Randall J. Hartman / Edited by Peter Gordon (puzzleeditor@nysun.com)","date":"2003-06-27","grid":"QVZJTEEjVEVSSSNFUklOCkxFVkVMI0VMSVMjUkVOTwpESUFOQUlOSE9PU0lFUlMKQU5OI01NREkjTEFDS0VZCiMjI1NPSE8jRkFMQSMjIwpGSUVMRElOSElUUyNHQUIKQVNMRUVQI0lERUEjVU5PClVTRUQjI0VNTyMjQ0FHRQpTVU4jU09MTyNTSEFWRVIKVEVBI1RSQU1JTlVSQUxTCiMjI1NPSUwjTk9ORSMjIwpTVEFQTEUjU01PRyNQSUUKQ09NRUlOU1RBVEVNRU5UCkFNRU4jVEhBVCNST0FTVApORVhUI1NZTkUjU09SVEE="},{"title":"NYC Triples, 6/30/03 (Monday)","author":"by Joy M. Andrews / Edited by Peter Gordon (puzzleeditor@nysun.com)","date":"2003-06-30","grid":"U0VBUyNBTE9IQSNST0JFCk9TTE8jQ09SRUQjQ0hPUApGQU9TQ0hXQVJaI0FOTkUKVFVUI0FJU0xFI1RCT05FCiMjI1VSTiMjI1lPVSMjIwpNQVNTQUdFI01BR0lMTEEKQUxJU1QjQU5PTUFMT1VTCk1JTkkjT1JFT1MjRElOUwpBVlVOQ1VMQVIjRElSR0UKU0VTVEVUUyNFQVJORVNUCiMjI1JOUyMjI1JJRyMjIwpVUFNFVCNJVFNNRSNNQkEKTkVBUCNKRktBSVJQT1JUCkRFTEkjQVNPTkUjQURBTQpPUEVEI1JPU0VTI01FVFM="},{"title":"Unknown Conclusion, 7/1/03 (Tuesday)","author":"by Alan Arbesfeld / Edited by Peter Gordon (puzzleeditor@nysun.com)","date":"2003-07-01","grid":"QklERUQjQUREUyNTUEFZCkJPSVNFI1dPUkUjWUFMRQpRVUVFTkFOTkVYI05DQUEKU1NUI0FMSSNTWVNURU1TCiMjIyNMQU5FUyNUQVJPVApSVU5OSU5HTEFURVgjIyMKT0xBWSMjI09HUkUjVERTCkxFRFVQVE8jRUFSU0hPVApMRUEjTEVWSSMjI09PWlkKIyMjRlVORVJBTFBZUkVYCkFMQVJNI1JFTkVFIyMjIwpTSURFQkVUI0ROQSNBUkUKUExPRCNDQU1FT1JPTEVYCkNBUkQjT0tMQSNMQURMRQpBQ0VZI05FSU4jU1RBWVM="},{"title":"Direction Finder, 7/2/03 (Wednesday)","author":"by Bill Weber / Edited by Peter Gordon (puzzleeditor@nysun.com)","date":"2003-07-02","grid":"U0lSIyNTVEFHI0JMSVNTClBPRSNBUEFDRSNSQU5UTwpBV0VTVFJVQ0sjSU5UUkEKU0FGQVJJIyNLRVRDSFVQCiMjI0RBR1dPT0QjRUVHUwpTUFVEI1NPTiNHSVJMIyMKVFVORVMjUkFWRU4jRUNPCk9aT05FI1NURSNTUEFJTgpQT1IjTElURVIjVEFTVFkKIyNURUFNI0FEUyNTVFlYCkhBSFMjQUVSSUFMUyMjIwpPUk9UVU5EIyNMT0FUSEUKU09EQVMjV0FTT1VUSElUCkVNT1RFI0lDT05TI0VSQQpTQVhFUyNORVdTIyNNRUw="},{"title":"Patriots, 7/3/03 (Thursday)","author":"by Brendan Emmett Quigley / Edited by Peter Gordon (puzzleeditor@nysun.com)","date":"2003-07-03","grid":"RVZPS0UjU0NSRVcjTUFCCk5BU0FMI0lSSVNII0FWSQpTVE9STSNTVU5TT05UQUcKIyNMRU9OSURTI01PUk5TCk9IRU5SWSNFRUwjU0lUVQpGQU0jRUNPIyNFTElYSVIKRkRJQyMjU1RFVklFIyMjCiNKT0hOUEhJTElQU09VIwojIyNSRUhBU0gjI1RVQkEKU09MT0VEIyNJQ0UjVExDCkVSSU4jU1BGI0FEV0VFSwpBTlRJQyNPTElWSUVSIyMKTUFSQ1VMTEVOI0NMRUFOCkVURSNDQUtFUyNUQkFSUwpERVMjS01BUlQjU1lSSUE="},{"title":"Everybody Knows Their Names, 7/7/03 (Monday)","author":"by Allan E. Parrish / Edited by Peter Gordon (puzzleeditor@nysun.com)","date":"2003-07-07","grid":"QUJTI1NXQVRII0ZFQVNUCkxFVCNQQVJSWSNFTElURQpFTE8jUkhFQVBFUkxNQU4KQ0FDVEkjU01FQVIjRUdPCiMjS0lOSyMjI1JJRERFUgpLSVJTVElFQUxMRVkjIyMKT05PI1NUUkFZI0RFTlNFCkNST1cjRUFSTlMjRE9OVApIRU1FTiNTT0RBUyNUSUMKIyMjQkVCRU5FVVdJUlRIClBBU1NFUiMjI0xJQ0UjIwpBQ0UjRElORVMjTlVER0UKU0hFTExFWUxPTkcjQU5ZClRFUEVFI1BMQU5FI01BUgpFU1NFUyNEQVJFUiNFV0U="},{"title":"A Few Choice Words, 7/8/03 (Tuesday)","author":"by Nancy Salomon / Edited by Peter Gordon (puzzleeditor@nysun.com)","date":"2003-07-08","grid":"SUNFQkFHI0FTVEkjT0ZGCk1BTEFHQSNSQUhTI0JSQQpQUklNRU5VTUJFUiNTSU4KRUFUI0lHTk9SRSMjQ0FOCklURU1TI0dSQU5ESlVSWQojIyNPVFRPIyNESU9SIyMKRkVFTCNFREFNI09VSUpBCkNBUElUQUxHQUlOU1RBWApDUklFUiNZT0hPI1RZTkUKIyNDUkFHIyNBTk5FIyMjCkZJTkVQUklOVCNBREFQVApPTk8jI0FST01BUyNMRVYKU1VWI0FDRUJBTkRBR0VTClNTRSNTSU5FI1RBTUFMRQpFRUwjSEVFTCNJUVRFU1Q="},{"title":"Lovestruck, 7/9/03 (Wednesday)","author":"by Byron Walden / Edited by Peter Gordon (puzzleeditor@nysun.com)","date":"2003-07-09","grid":"QkxPQiNERUJUUyMjR0lOCkVZUkUjU1dPT1AjQk9OTwpHTkFXI0xPVFRBI0VUQUwKQURMSUIjS0hBTiNXQUxUCk5FU1RMRSNFTElHSUJMRQojIyNDT0xPUiNFTEwjIyMKV0lUSENBUkUjTEFEWURJCkFSSUUjTEVEQSNERVZPTgpSQU5EUiNPVElTI1JFUFMKTUVUUk9TI09OVEhFU0VUCiMjI0VPTiNTVEFJRCMjIwpTT1VSTUFTSCNUVlNUQVIKVEFCVSNQTE9EI0VUVURFCklST04jU09XRVIjQUxPVQpQRUFTI0FNVVNFI1JJQlMKRURUIyNUT1BJQyNFUEVF"},{"title":"Themeless Thursday, 7/10/03 (Thursday)","author":"by Jim Page / Edited by Peter Gordon (puzzleeditor@nysun.com)","date":"2003-07-10","grid":"QVJUSU5FU1MjQ09TVEFTCkRFQURTUE9UI0FURUFNUwpNRVhJQ0FMSSNCRUFLRVIKRVNFIyMjRU5MQVJHRVJTCk5FU1RTI01HTUxJT04jIwojIyNBTEFOT04jI0RPUkEKUFVCTElDI1BPU0UjVEVUCklOU0VDVFJFUEVMTEVOVApLSUQjRVZFUiNFRElTT04KRVZFTCMjVEFCU0VUIyMjCiMjR0VTVEFURSNSRVRSTwpTVFJBVEVHSUMjIyNCT0IKVElFUElOI09LRVlET0tFCk9ORUFMUyNORVdNT05FWQpQRVNUTEUjU1RFQU1FUlM="},{"title":"A Thought for Modern Times, 7/11/03 (Friday)","author":"by Ed Early / Edited by Peter Gordon (puzzleeditor@nysun.com)","date":"2003-07-11","grid":"QkFCQkxFUyNEQU1TRUxTCklTUkFFTEkjT0NFQU5JQQpUSEVTQURERVNUVEhJTkcKVEVBUyNFTEtFI1JJREUjCkVORCNUUkVFI0JJQiMjIwojI0JSQVNTI0FSQyNEQUQKU0lPVVgjI0FMQSNXSU5PCklDQU5JTUFHSU5FSVNUTwpQRVJUI0VZRSMjQUZURVIKU1REI01BRSNDT1ZFUiMjCiMjI0dBTCNCT0RFI0lORgojQk9PUiNBVUxEI0FCRUwKR0VUVVNFRFRPTFVYVVJZCk5FSUdIRUQjUk9TRVRUQQpVTlNFQUxTI1NUQUxFU1Q="},{"title":"Chick Flicks, 7/14/03 (Monday)","author":"by Randall J. Hartman / Edited by Peter Gordon (puzzleeditor@nysun.com)","date":"2003-07-14","grid":"RkFUQUwjUEFQQSNBUk9OCk9QRVJBI1VSQUwjTEVOQQpSRUFMTSNUSVJFI1NMSU0KIyNTT1BISUVTQ0hPSUNFCiMjIyNSSU5TRSNBUkNFRApBTVVTRVMjIyNJUkEjIyMKQkVUU1lTV0VERElORyMjCkJBVEVTI0FMRVMjI1JFRApBVEUjI0JSSUUjQUNFTEEKIyNST1NFTUFSWVNCQUJZCiMjI05FVCMjI1ZJU1RBUwpTVEVBTCNBU1NFVCMjIyMKQ0hBUkxPVFRFU1dFQiMjCk9SU08jUkVFTCNFWElTVApGRUVMI0NBTkUjUkFUSU8KRkVMTCNBTU9TI0VNRVJZ"},{"title":"Buy Time, 7/15/03 (Tuesday)","author":"by Brendan Emmett Quigley / Edited by Peter Gordon (puzzleeditor@nysun.com)","date":"2003-07-15","grid":"UkFKQUgjTEFWI0VOQUNUCkVDT0xJI0VSQSNST1RPUgpEUkFJTiNHQUwjSVNTVUUKU0VOI0RPVUJMRUNIRUNLCiMjT1BJVU0jRVRBI0FIUwpJTkZPI1RFRVRIIyMjIyMKQkVBUkQjI0FUSVQjSVJTCkVBUk5FWFRSQUNSRURJVApUTEMjQkVSVCMjRUxPUEUKIyMjIyNOQUhVTSNBTkVXCkNQQSNHT0QjU0FJTlQjIwpST1NBTk5FQ0FTSCNDQUwKVUxUUkEjR0FCI09aQVdBClNLSUVTI0FUTCNQRVJFWgpIQVJTSCNQT0UjU0VFRFk="},{"title":"Get It to Go, 7/16/03 (Wednesday)","author":"by Lee Glickstein and Peter Abide / Edited by Peter Gordon (puzzleeditor@nysun.com)","date":"2003-07-16","grid":"UklGRlMjRURHRSNBUk1TCklORVJUI01PVUUjVUhPSApPQ0hFUiNNRVRST0RPTUUKVEhSRUVNQVJUSU5JIyMjCiMjI1dFRSMjRUVLI0JBSApNWVdJVEhBTkRSRSNPWE8KQ09BTCNUT0UjI1lQUkVTCkNVTEwjQUxJU1QjT05NRQpPQkVZUyMjR0VFI0xFQVIKWUVTI09GQ0hBTVBJT05TClNUQSNGQVIjI1BBQyMjIwojIyNUQUtFT1VUTUVBTFMKTkFWWVNFQUxTI0VDTEFUCkJBQ0sjSVNFRSNMQUlUWQpDQVJFI1RFU1MjQVJJU0U="},{"title":"Fairway Supermarket Shopping List, 7/17/03 (Thursday)","author":"by Harvey Estes / Edited by Peter Gordon (puzzleeditor@nysun.com)","date":"2003-07-17","grid":"TVlUSCNBTEVQSCNGTEFYCk5FSEkjVE9SUkUjTE9SRQpPTkVHI0hPTk9SI0FWSUQKIyNDSEVFU0VXRURHRSMjClNOT0NPTkUjTElFU0xPVwpUQU4jU0FOVElOSSNPUkEKVVJHRSMjRUVOIyNUUkVYCiNDT0xMQVJER1JFRU5TIwojIyNBRVIjIyNBTEwjIyMKRElFVE9SQU5HRVNMSUNFCkFDUkVTI0JFQSNBU05FUgpOWVUjI0JVUlNUIyNBTEEKIyNQT1RBVE9DSElQUyMjCkdFVExPU1QjQVJTRU5BTApQUkVMQVRFI1BPRVRJQ1MKU0VEQVRFRCNTV0VBVEVE"},{"title":"Weekend Warrior, 7/18/03 (Friday)","author":"by Byron Walden / Edited by Peter Gordon (puzzleeditor@nysun.com)","date":"2003-07-18","grid":"Q0hBQ0hJTkcjQkFETE9UClJFRFJPVkVSI0FMTklDTwpVTkRFUkFHRSNZRUFHRVIKU0hFRE9OI1dIT1NUSEFUClRPRE9TI1dGQU4jRVROQQpBVVMjQ0hJQVBFVFMjIyMKQ1NBI09PUlQjVE9URVJTCkVFTCNQTFkjUklPI05FVwpBU1RMRVkjQ0FOVCNUU0UKIyMjQVNUSE9VR0gjV09FClNQQVIjT0VJTCNQT0lOVApUSU1BTExFTiNLQU5TQU4KQU5PTUlFI0FOSVNFVFRFCkJVUklFRCNHRU5USUxFUwpTUEVFRE8jRURHRUxFU1M="},{"title":"Wrecking Crew, 7/21/03 (Monday)","author":"by Richard Chisholm / Edited by Peter Gordon (puzzleeditor@nysun.com)","date":"2003-07-21","grid":"TVNHI01NQ0kjQUxBU0tBCkVDTyNBRU9OI1FBTlRBUwpNSVQjR0FOR0JVU1RFUlMKT0ZURU4jVEVSSSNTUE9UClNJQU1FU0UjT05FIyMjIwojIyNBVE9NU01BU0hFUlMKQkFSTiNTUEEjU1RBVFVFClVTVUFMI1RJQyNBTk5JRQpSRVNURUQjTE9HI0RBTksKR0FURUNSQVNIRVJTIyMjCiMjIyNIQVMjRUxBSU5FUwpFTE1PI1BJRVIjSU5BUFQKVElFQlJFQUtFUlMjRElFCkFSVElFUiNFTk5FI0lDRQpMQVNUTFkjU1RBUiNBU1A="},{"title":"Tom Swifties, 7/22/03 (Tuesday)","author":"by Mel Taub / Edited by Peter Gordon (puzzleeditor@nysun.com)","date":"2003-07-22","grid":"RUxLUyNTQ0hNTyNHSVZFCk5JTkEjQ1JPT04jQVJFQQpEUk9QWU9VUldFQVBPTlMKU0FYI0FSSUFTI0xJTkRZCiMjI0VYRVMjI1NJTiMjIwpDT05TSURFUklUQUdJRlQKQUhFTVMjI0VSQVMjUk9FCkRJVkUjU0hBS1kjRUFSTgpFT0UjRElTQyMjUkVCVVMKVFVSTlVQVEhFVk9MVU1FCiMjI0lSUyMjU0lCUyMjIwpBU1BDQSNUSVRMRSNKQUcKWU9VS05PV1RIRURSSUxMCkVMTEUjS0lURVMjVU5ETwpTRUxMI1NOT1JUI0VYQU0="},{"title":"Insurance Contracts, 7/23/03 (Wednesday)","author":"by Lynn Lempel / Edited by Peter Gordon (puzzleeditor@nysun.com)","date":"2003-07-23","grid":"VEhFRlQjQlJFVCNBQ01FCkVFUklFI01JTUkjUkhFQQpBTklTRSNPVlVNI0NVRFMKUklDSE5EVkEjRU5UUkVFClNFQU4jQUlMI0xBSUNBTAojIyNHRU5FI1NBVENIIyMKTEFCRUwjI1lPR0kjVVNFClNISVJFI1lBUCNPUlNPTgpEQVIjR0VFSyMjTk9FTFMKIyNUUklNUyNTT1NBIyMjClNDSE9aRSNTUEEjQ09TVApIQVRURVIjRUFSVEhWRVIKQUdIQSNBTUlEI1VUSUNBCk1FRVQjTEFaRSNSRU5UUwpFWVJFI0RZRVMjRkxFU0g="},{"title":"It's All Greek to Me, 7/24/03 (Thursday)","author":"by Craig Kasper / Edited by Peter Gordon (puzzleeditor@nysun.com)","date":"2003-07-24","grid":"RlNUT1AjQVNQUyMjQUJTCkFNQU5BI1RIVUcjRFJBVwpUQUtFU0lUT05USEVDSEkKRVJFIyNNRVJDI1VCT0FUClNUSUNLSU5USEVNVSMjIwojIyNISU5EI09SRUdBTk8KQVNQRU4jI1RVRyMjR0lOCldPUk5ET1dOVE9USEVOVQpFTEkjI1BPVCMjRUFTRVMKREVNRVRFUiNST05TIyMjCiMjI1BJQ0tTVVBUSEVUQQpBUkdPTiNBQ05FIyNNRUwKUFVOWFNVVEFXTkVZUEhJCkVCQVkjTklOQSNQRVRFUwpTRVcjI0FUVFkjQVNZRVQ="},{"title":"Last Turn, 7/25/03 (Friday)","author":"by Sarah Keller / Edited by Peter Gordon (puzzleeditor@nysun.com)","date":"2003-07-25","grid":"U0FHI0xFRSMjQ0NMQU1QCkVSUiNPVlVNI0hPT1RJRQpJUkEjTkVSTyNBU0tJTkcKTklORUlST04jU01JVEVTCkVEVFYjI1NUTEVPIyMjIwojI1JBR1UjR0FSUklTT04KUkFFI0VTVE9TI0VSQVNFCklDSyNPQ09NRSNNRU5TQQpET05PUiNZRVJCQSNESVIKR1JJRUcjT1JTRVIjWUVTCkVOVFJFQVRZI1RLVFMjIwojIyMjVFJBREUjI1dJU0MKU0lUQ09NI1JBVEZJTktTCkVUQUxJSSNBVkVSI05BUApDQVJPTEUjV0VSRSNFVEEKU0xPUEVTIyNEUkUjREVO"},{"title":"Twin Bills, 7/28/03 (Monday)","author":"by Byron Walden / Edited by Peter Gordon (puzzleeditor@nysun.com)","date":"2003-07-28","grid":"QVJOQVojREVTSSNXQUlUClBFQUJPI0VMQUwjSU5SRQpQQVVMT05FSUxMI0VHT1MKRURHWSNQUk8jIyNTRU5UCk5USCNCUkVUVEJVVExFUgpET1RIRSMjI0lBTiNFRFUKIyMjQVRUI1BWVFMjTk9OCiNIT1dBUkRKT0hOU09OIwpSRVAjUlVFUyNFQVUjIyMKQVJFI0FFQyMjI1BFQVJTCktFTk5ZUk9HRVJTI1lFVApFVVJPIyMjVU5FI0RFTU8KU05PQiNKT0VKQUNLU09OCklUQUwjQUhTTyNVTklURQpOT0RFI1JPU1kjUFlSRVM="},{"title":"Bicycle Safety, 7/29/03 (Tuesday)","author":"by Joe Bower / Edited by Peter Gordon (puzzleeditor@nysun.com)","date":"2003-07-29","grid":"QU5UUyNDQUNUSSNNSVNTCk5FSEkjTUVPV1MjQU5LQQpHUklUI0FSTU9SI1NUWVgKRVZFUyNKSUIjI0FTSCMjCkxFRlRUT0VJR0hURUVOIwojIyNJRVIjTk9FTCNBT0sKRkxBR1MjTkFUTCNTUlRBClJJR0hUVE9USElSVEVFTgpBQkVUI09USVMjSVBBU1MKVEVMI1NPU08jVVNBIyMjCiNMRUZUVE9OSU5FVEVFTgojI1NBWSMjTFNEI1JBQ0UKSkVTVCNHT09TWSNJR09SCk9HTEUjT05DVUUjQ0VMVApUT1lTI1BPS0VEI0tSSVM="},{"title":"Artistic License, 7/30/03 (Wednesday)","author":"by Ed Early / Edited by Peter Gordon (puzzleeditor@nysun.com)","date":"2003-07-30","grid":"QkFVTSNMQVVSQSNXQVNQCkxJTkUjRUFURU4jT1JFTwpJRElETlRIQVZFTU9ORVQKUEFUSU8jI0hVTUlET1JTCiMjI0FSQUIjUElOUyMjIwpBU1MjQUxBUyNBQ0NFUFQKQ0hFRiNFVFRVI0VSTklFClRPUFVSQ0hBU0VERUdBUwpVVElMRSNTTFVNI1dFTlQKUFNBTE1TI0VSSUMjTE9TCiMjI1NBTkcjUFJBTSMjIwpJQ0VDUkVBTSMjSElSRVMKVE9NQUtFTVlWQU5HT0dICkVWSUwjUlVSQUwjSFVHRQpNRVRFI1NUQVRFI1RFU1M="},{"title":"Themeless Thursday, 7/31/03 (Thursday)","author":"by Patrick Berry / Edited by Peter Gordon (puzzleeditor@nysun.com)","date":"2003-07-31","grid":"QUJSQUhBTSNTTU9PVEhTCk5BSVJPQkkjT0FUQlJBTgpHUk9TU0VTI1VUSUxJWkUKVU5SRUVMUyNSSVNJQkxFCkxPSU5TI09NRU4jUVVJWgpBTlRJI0NVRUQjQlVUVEUKUkVBQ1RPUlMjRkxFRVRTCiMjIyNBVElTU1VFIyMjIwpTSVRJTlMjSUNFV0FURVIKUFJBTksjREVBTCNESU5PClJPTEYjQlVSUiNEUkVHUwpVTkNPVkVSI0ZJUkVMSVQKQ09VUkFHRSNBU0lOSU5FCkVSTUlORVMjQ0xFQU5FUgpTRVNURVRTI0VBUkxFU1M="},{"title":"College of Musical Knowledge, 8/1/03 (Friday)","author":"by Raymond Hamel / Edited by Peter Gordon (puzzleeditor@nysun.com)","date":"2003-08-01","grid":"TEFNQSNLQUJVTCNBSkFYCk9MRU8jSVJFTkUjTUFJTQpPVkVSI0RPR0lUI0VNTUEKUEFUVElTTUlUSCNORVNTCiMjI0FETUFOI0FTSVMjIwpQT1BFWUUjI0ZMQVRCRUQKQUFII0xBVFRFI01ZUk5BClNLSSMjTEFTRUQjI09ERApTRUxNQSNSRUxJVCNXRUQKRU5WRUxPUCMjU0hBTkRZCiMjQU5JTCNBU1RPUiMjIwpDQVNUI0RPTkNPUk5FTEwKQUxTTyNJTk5FUiNPQk9FClNPQVIjU0NFTlQjTEFWQQpIRVJTI0hFWEVTI0RZRUQ="},{"title":"In the Groove, 8/4/03 (Monday)","author":"by Ed Early / Edited by Peter Gordon (puzzleeditor@nysun.com)","date":"2003-08-04","grid":"QkFMU0EjR1JFRVQjR0FMCkFTSUFOI0FPUlRBI1VTRQpDSEFOTkVMQkFDSyNUSEUKSEVSQ1VMRVMjI0VTVEVSCiMjI1RBQlMjUkVPUEVOUwpBVFRJTEEjSkFHVUFSIyMKVFVSRlMjVEFST1QjQlRVCk9CRVkjREFNRVMjRUFSUwpaRU4jQk9YRVIjQ1BMVVMKIyNDTE9ORVMjQk9JTEVSClJFSEVBVFMjSk9XTCMjIwpPU0NBUiMjTU9OR09PU0UKVVNPI0RJVENIRElHR0VSClNFQSNFVklBTiNSVUxFUgpFWFQjREVOVFMjTEVFS1M="},{"title":"Muscle Group, 8/5/03 (Tuesday)","author":"by Joy M. Andrews / Edited by Peter Gordon (puzzleeditor@nysun.com)","date":"2003-08-05","grid":"SElHSEMjR0FSQiNTSEFNCklERUFMI0FSSUEjQUJMRQpERUxUSU9MT0dZI01PVEgKRVNTI1BST00jI0NPTUVUCiMjIyNBQlJBQ0FEQUJSQQpSRU1PUlNFI1lVTCMjIyMKQVBBUlQjI0xBVElUVURFCk1FUkUjUElBTk8jRUxJUwpQRUNPUklOTyMjVEVORVQKIyMjI0FMQSNHUkFOQURBClFVQURSRU5OSUFMIyMjIwpVTlRJRSMjT09aRSNJUlMKT0RFUyNHTFVURU5GUkVFClRFQUsjQUlOVCNUSU1FWApBUk1TI1BFU08jU05BS1k="},{"title":"Putting On a Little Weight, 8/6/03 (Wednesday)","author":"by Rich Norris / Edited by Peter Gordon (puzzleeditor@nysun.com)","date":"2003-08-06","grid":"VVJHRSNFUENPVCNCT0dTClNFRU0jR1VMUFMjT0RJRQpNSU5JTU9aQVJUI1pPTkUKSU5UUk8jT01BUiNPTVNLCk5FTFNPTiMjSEFOREVMIwpUUlkjTEVBRiNQT0VUSUMKIyMjQkFBQkFBI1RSRU5ECk9TU08jUkVVTkUjRVJHUwpSRVBPUyNUU0tUU0sjIyMKR1JBWkVTI1RBQ1QjRkFUCiNBQ0VUSUMjI0hFQVJTRQpBUEVSI1RVQkEjQVZBU1QKVEhBVyNPWk9ORUxJTkVSClJJR0EjVUNPTk4jQUNUSQpBTUVSI1RPS0VEI05FU1M="},{"title":"Tic-Tac-Toe, 8/7/03 (Thursday)","author":"by Bill Zais / Edited by Peter Gordon (puzzleeditor@nysun.com)","date":"2003-08-07","grid":"QkFTUyNYWVojI0VTU0VTCkVYSVQjRkFJUiNMQVlMQQpFTU1BI0lOR0UjTEFNQVMKUEVQVEFMSyNEUklCQkxFClNOTCNMRVMjRElQU08jIwojI0VMTVMjRUZUUyNMUFMKQkFTSVMjT1hPI0VMRklOCkVSSUUjI1hYWCMjSU9UQQpMRUdVUCNPT1gjU0NSQVAKVEFOI0xZTk4jT0xFTyMjCiMjQU1BVEkjQVJBI1hMUwpST1RVTkRBI0RJVlZZVVAKSU5VU0UjTk9PTiNBR1JBCkJFUkVUI1NMVUcjU0VFTgpTTEVEUyMjRVRTI0VORFM="},{"title":"Weekend Warrior, 8/8/03 (Friday)","author":"by Bob Peoples / Edited by Peter Gordon (puzzleeditor@nysun.com)","date":"2003-08-08","grid":"RFVNTUtPUEZTI1dBU1BTCklOQ09OQ0VSVCNFWFBBVApQRVRTSVRURVIjQUxFUk8KU0FFI1RBUlMjU0tFV0VSCklTQVkjRE9II0VTU0VORQpOSUdFUiNMRU9OSSNSVFMKVEVVVE9OI1RSSVNIIyMjCk9SRUlMTFkjRE9UQVJEUwojIyNTRVdFUiNSRVZFUkUKU1NOI1BFUkVTI1JFVlVFClFVRUxMUyNETkEjU0lNSQpVTlNFQVQjSEFSUCNTU1QKQVRCQVkjREVQTEVUSU9OClJBSVNFI1dBVEVSUE9MTwpFTlRFUiNJRE9OVEtOT1c="},{"title":"A Puzzle About Nothing, 8/11/03 (Monday)","author":"by Brendan Emmett Quigley / Edited by Peter Gordon (puzzleeditor@nysun.com)","date":"2003-08-11","grid":"QUJVVCNBQk9VVCMjSEVXCkdVU0gjVE9OS0EjVEFMRQpFTFNFI0hPVEVMI0VNTUEKI0tSQU1FUlZTS1JBTUVSCiMjI1RBTiMjIyNVU0VSUwpKRVJSWVNQUklOR0VSIyMKT0JPRVMjTElWRVMjU0FNCkdBTFMjTUFOSUEjQ09MQQpTTkwjUE9JU0UjQ1JVRVQKIyNFTEFJTkVTVFJJVENICkFERE9OIyMjI1JVVCMjIwpHRU9SR0VNQUdBWklORSMKUkVBRCNUSU1JRCNRVUFECkVNVFMjQVJJU0UjVU5UTwpFU1MjI1RFTlRTI0VTU08="},{"title":"Breadboxes, 8/12/03 (Tuesday)","author":"by Ed Early / Edited by Peter Gordon (puzzleeditor@nysun.com)","date":"2003-08-12","grid":"UEFMI0FTU0lTSSNUT05JCkFNQSNGUkFOQ08jRU5JRApMT1AjUk9DS0FORFJPTEwKTEVEVE8jIyNUSUVSTkVZCk9CT0UjWU9VI0FDSUQjIwpSQUdBTVVGRklOI0ZBTlMKIyMjI09STE9OI0JJR09UClBST1JBVEEjREFZQ0FSRQpBU1BFTiNUSEVNRSMjIyMKU1RFTSNTRUFCSVNDVUlUCiMjTkFTQSNMVEQjQU5ORQpBUFBST1ZFIyMjU1RFQUwKTUlMUVVFVE9BU1QjQVdMCkVTQVUjVVRPUElBI1NBTQpTQU5FI1BBUEVSWSNFWUU="},{"title":"Chinese Takeout, 8/13/03 (Wednesday)","author":"by James P. Sharp / Edited by Peter Gordon (puzzleeditor@nysun.com)","date":"2003-08-13","grid":"T1NXRUdPI0VXQU4jU1RZCkNIQUlSUyNHSUxBI1RFQQpUVVJSRVQjR05BVCNFTEsKI1RIRUdFT1JHSUFQRUEjCkFURSNHT0RPVCNMQVJWQQpORVJPIyNFTElBI05FSU4KVFJPUElDQUxQVU4jRFZECiMjI0VSQSMjI1RVQiMjIwpBQkUjVEhSRUVPTkFNQVQKSE9QRSNORUVEIyNOQVNBClNOT1JUI1VMVFJBI1lJTgojRVhFQ1VUSVZFQlJBTiMKSURJI0VQRUUjTUFJTElOCkNVRSNMVFJTI0FMUElORQpVUFMjTE9TVCNQTEFORVQ="},{"title":"Dixie Land, 8/14/03 (Thursday)","author":"by Joe Bower and Nancy Salomon / Edited by Peter Gordon (puzzleeditor@nysun.com)","date":"2003-08-14","grid":"RUVFRUVFRUVFRUVFRUVFCkJSQU4jREFTI1NPTUJFUgpCQVJEI0lUUyNBU0NFTlQKIyMjVU5USUVTIyNFUlNFCkJPVVJCT05TVFJFRVQjIwpBUFBFQVIjI1JFRUQjIyMKQkVTUyMjQVJFRUwjSEFUCkVSRSNCSUdFQVNZI0FXRQpTQVQjQVRFQU0jI0FTQU4KIyMjR0xFTiMjU1RJTktPCiMjRlJFTkNIUVVBUlRFUgpDQVJFIyNZT1VCRVQjIyMKQUxFQVNUI1JPVCNJRE9MClZFUlNVUyNTVEwjTUlOSQpFRUVFRUVFRUVFRUVFRUU="},{"title":"Diacritical Condition, 8/15/03 (Friday)","author":"by Byron Walden / Edited by Peter Gordon (puzzleeditor@nysun.com)","date":"2003-08-15","grid":"Q0hJIyMjTlRII1NET1VUCkxBRCNTV09SRSNTQVdUTwpBUkkjVElNT1IjVFJFTlQKU1RPTEVOI1BSQUxJTkVTClBFVEVST1NFI0xJTiMjIwojIyNBT05FI0xFTiNTSFkKIyNMU0xBTkRJQ0VEVEVBCkxBTkEjI0FPSyMjV0FYWQpUSEVMTkRUSEVTRklUIyMKREFTI0VFRSNTTlVHIyMjCiMjI0FXTCNQT1RTSE9UUwpDSEFJU0VMRSNJU1RSSUEKUk9TU0kjRUFUTUUjQVBUCkVNSUxFI1VMRUVTI1RJRQpERUZFUiNSRVgjIyNFTkQ="},{"title":"Body Language, 8/18/03 (Monday)","author":"by Kent Lorentzen / Edited by Peter Gordon (puzzleeditor@nysun.com)","date":"2003-08-18","grid":"QUxNQSNQQU5EQSNIQVJNCk1FQU4jRUxCT1cjQUxPRQpCQUNLVE9CQUNLI05BQlMKSU5TSEFQRSNTV0VESVNICiMjIyNPTEUjI0FNVCMjIwpBUkNISUUjRUFSVE9FQVIKTklMRVMjU0xJRCNIRVJBCkdMT0FUI1RPTSNIQVJFTQpMRU5EI1pBUFMjQU5JU0UKRVlFVE9FWUUjR0lERU9OCiMjI09OUyMjRk9SIyMjIwpSRURIT1RTI1JBRElDQUwKQUxFRSNGQUNFVE9GQUNFCk1BTUEjVU5JVEUjU0lSUwpQTE9EI0xFQVNFI09ORVM="},{"title":"Animal Writes, 8/19/03 (Tuesday)","author":"by Jay Sullivan / Edited by Peter Gordon (puzzleeditor@nysun.com)","date":"2003-08-19","grid":"QVJDUyNQQU5BTSNTT1JFCkhPT1AjQUxPTkUjQ1JPVwpBTU1PI1NJTU9OI1JBVEUKQkVBUkVTU0VOVElBTFMjCiMjI1RBRlQjI0hNTSMjIwpBRERTVE8jQVRPUCNTUkkKQkVFQ0FSRUZVTCNIRUFECkFUQkFUI1RPTiNQQVJETwpUT1VSI0dOVUFSUklWQUwKRVhUI1BFQUwjT0lMRVJTCiMjI1RPVCMjVFNPUyMjIwojR09SSUxMQVdBUkZBUkUKUk9ERSNPQVRFTiNSVUVSCkFZRVMjU0lSRU4jT1JTTwpNQVNTI1RSQURFI01BVFM="},{"title":"Tight End, 8/20/03 (Wednesday)","author":"by Bill Zais and Nancy Salomon / Edited by Peter Gordon (puzzleeditor@nysun.com)","date":"2003-08-20","grid":"T05DRSNHQVRPUiNVRk9TCkNPQVgjQURPUkUjU0lORQpIQVNURU1BS0VTV0FTVEUKU0hBUlAjUEVTVE8jSE9QCiMjI0FDQ1QjIyNFQVQjIwpTVFAjT1JTT0lUU1NBSUQKUEFSSVRZI1BPVyNISVJFCklCRVQjUExBTkUjRUxBTgpDT05FI1RBUiNBU1NFVFMKWU9VTVVTVFRBS0UjREVFCiMjUFNTIyMjU1NUUyMjIwpBTlQjRUFSTFkjT1BBTFMKUEFJTlNUT1BMQU5BSEVBCkVTQVUjTU9HVUwjV09PTApTQUxUI1NUQU1QI05ZTlk="},{"title":"Themeless Thursday, 8/21/03 (Thursday)","author":"by Craig Kasper / Edited by Peter Gordon (puzzleeditor@nysun.com)","date":"2003-08-21","grid":"Q0hBU00jI1NQQUNFQUdFCkhFUk1FUyNIQU5TQkxJWApBTU9VTlQjUlVUQUJBR0EKU0lOR0xFRklMRSNTSUxMCiMjIyNPUElOSU5HI05JVApCSVRTI1BGRU5OSUcjIyMKRVZJQ1RFRSNHQVZPVFRFClNBVk9ZIyMjIyNFUlJPUgpTTk9XUEVBI1pPTktJTkcKIyMjTEVBTlNJTiNZT1lPCkNCUyNBVFRVTkVTIyMjIwpMQUlDI0NJUkNVTEFURUQKSU5DSEFSR0UjUE9UQVRPCk1BS0VTT1VUI1NQSVJBTApCTE9XQVdBWSMjU1RBTEw="},{"title":"Whodunit, 8/22/03 (Friday)","author":"by Eric Berlin / Edited by Peter Gordon (puzzleeditor@nysun.com)","date":"2003-08-22","grid":"UVVBUlRTIyNDREMjUEFTClRTSElSVCMjT1JPI0FOVApJU09CQVIjSkVPUEFSRFkKUFJZI1NVUkUjV0FMREVOCiMjI1NIVEVUTFMjTE9TRQpNRVNIIyNTUEVFQ0gjIyMKRVhUT0xMRVJTI0xBTkEjCkdFUFBFVFRPI1BPTEFORApTQ0FMQVIjUExPVExJTkUKI1NUVVMjQkVFVEhPVkVOCiMjI01FVFRMRSMjV0VTVApTVEFCI1NVTEtJRVMjIyMKVEFMRVNFI0VTUE4jUEVDCk9QRVJBVEVEI0FOTkVBTApQRVIjTVNHIyNTVUJBUlUKU1NUI0VFRyMjU0lDS0xF"},{"title":"Taradiddle, 8/25/03 (Monday)","author":"by Charles E. Gersch / Edited by Peter Gordon (puzzleeditor@nysun.com)","date":"2003-08-25","grid":"R05QI1BFT04jI0hPU0VBCkFDRSNUQVJPI1RFVEhFUgpNQVJHQVJFVCNIQVRBUkkKU0FNRSNUT01PUlJPV0lTCiMjQVJDSCNFUk9TI0xFRQpUSU4jSEFNI0JVVFMjIyMKT1BFUkEjQVBJRyNBTVNPCkdPTkVXSVRIVEhFV0lORApBU1RBI05VREUjQU5OSUUKIyMjUEFBUiNERFQjQ1RTClJJRCNTSEVBI0FTSEUjIwpBTk9USEVSREFZI1VNUFMKTU9OSUNBI01JVENIRUxMCkJJVE1BUCNBRE9TI0FBQQpPTFNFTiMjTkFOQSNUTlQ="},{"title":"Would-Be Italians, 8/26/03 (Tuesday)","author":"by Mel Taub / Edited by Peter Gordon (puzzleeditor@nysun.com)","date":"2003-08-26","grid":"R0FJTlMjTUVNTyNCQVNLCkFTQ09UI0FWT1cjRU1JTApHSU9WQU5OSU9ORU5PVEUKU0FOI0tFRUxTI05VUlNFCiMjI1RFWFQjI0hBTSMjIwpTQUZFU1QjU0xBTUJBTkcKSVJBTiMjU1RBTEUjTEVFCkdJVVNFUFBFQ09MTEVHRQpNRU4jU0hBTUUjI0FWRVMKQUxBU0tBTlMjVEhJRVZFCiMjI1BJVCMjSEVJUiMjIwpBVEVBTSNHSE9TVCNPREUKR0lBQ09NT0lOVEhFQk9YCkVMU0UjVU5ETyNFTElURQpTRUVTI0RFRVIjUklURVM="},{"title":"Looky Here!, 8/27/03 (Wednesday)","author":"by Nancy Salomon / Edited by Peter Gordon (puzzleeditor@nysun.com)","date":"2003-08-27","grid":"Q09NQVMjQUtBI1RPWVMjCk9SQVRFI1BBTCNJUkFURQpCTElUWiNFWUVPUEVORVIKQllMQVdTI0FSUCNJTlJJCiMjI0NIRUNLT1VUTElORQpCT0JIT1BFIyNTT0wjIyMKT0JPRSNJUklTI1BZTE9OCldJWiNDQVRDSFRUI0VSQQpTRU9VTCNTS0lQI0JFQVIKIyMjU0lTIyNFQUdFUkxZClRBS0VJTlNUUklERSMjIwpPVklEI09XRSNSQUZURUQKV0FUQ0hCQU5EI05BT01JClNJVEFSI01PTyNTTEFNUwojTFlSRSNJUlMjS09EQUs="},{"title":"Double Plays, 8/28/03 (Thursday)","author":"by Randolph Ross / Edited by Peter Gordon (puzzleeditor@nysun.com)","date":"2003-08-28","grid":"Q0JTIyNBU1RPI1JFU09EClBST09GQ0hBUFRFUlRXTwpSRU5UQUNIT1JVU0xJTkUKI0FOSU1VUyNBTFRFUlMjCiNLWVNFUiNOSEwjIyMjIwojIyMjREFUQSNFQVNUTEEKQU1JRCNUQVRFI1NFUlVNCkNBQkFSRVRBUFBMQVVTRQpUUkFERSNBU0VBI0xFVFMKU1RSRUFLI0hFUkIjIyMjCiMjIyMjQUJBI1NBTUJBIwojRlJBUFBFI0hJTEFSWSMKU09VVEhQQUNJRklDQVJUCk5JTkVEQU1OWUFOS0VFUwpMRUFOUyNFTk9MIyNTU0U="},{"title":"Weekend Warrior, 8/29/03 (Friday)","author":"by Bob Peoples / Edited by Peter Gordon (puzzleeditor@nysun.com)","date":"2003-08-29","grid":"QkxBQ0tFWUVTI0FDVE9SCkFMTEZPUk9ORSNCT1JORQpUQUJMT0lEVFYjQlJFQU0KSU5FI1BFRVdFRVJFRVNFCk5PSVIjU0xJTkcjU0ZQRAojU1RFVCNFTlNPUiNBUkkKIyMjQVdBUkUjSUFHUkVFCkJBUlJFTFMjQVNTVU1FUwpBUEVNQU4jTUlURVIjIyMKU0FUI0tJVEVSI0RVRkYjCkVSSUMjQ1VMRVQjU0xBVApQSU5BQ09MQURBUyNBQ0UKQUNVUkEjSU5BTUlOVVRFClRJRVJTI1BJTEVESVRPTgpIT1NFUyNTRUVTU1RBUlM="},{"title":"Tennis Match, 9/2/03 (Tuesday)","author":"by Craig Kasper / Edited by Peter Gordon (puzzleeditor@nysun.com)","date":"2003-09-02","grid":"UkFQI0NBRkUjQkFORElUCkVMTCNBSkFYI09SRUlEQQpBTEEjUEFOVCNCSUdSRUQKR1VOVEVSR1JBU1MjVEFQCkFSRUEjIyNBQlVUI1BMTwpORVRUTEVTI0VQQSNPSUwKIyMjRUFUSU4jIyNST1NFCiNNQVJHQVJFVENPVVJUIwpTQU5TIyMjVEVYQU4jIyMKTklBI0VORCNBSVJEUk9QCklOQyNORVJPIyMjTUVSRQpGTE8jQ0FTU0lVU0NMQVkKVElOUE9UI0NPU0kjT05PCkVORFVSRSNBV0VEI0FHVApSRUFQRVIjUkFSRSNERUU="},{"title":"\"Drop 'Em!\", 9/3/03 (Wednesday)","author":"by Diane Epperson / Edited by Peter Gordon (puzzleeditor@nysun.com)","date":"2003-09-03","grid":"QU1JRSNPTkVTRUMjUEpTClJPU0EjVEFLRVRPI0hBTApCT0FSRElOR1JBUCNFVkEKT1JBVEVTI1NBTFRBV0FZClJFQ0FQIyMjUElFVCMjIwojIyNHT09EWUVBUkJMSVAKUkFNI1RSSU8jI1NBVU5BCkFGRVcjRVRVREUjVEFPUwpQQVNIQSMjTkVUUyNVTk8KVFJBSU5JTkdDQVBTIyMjCiMjI1JJVEEjIyNZRU1FTgpTT1VMTUFURSNTT05PUkEKTlVOI0FMQURESU5TTEFQClVaSSNMSU5HRVIjRUxTRQpCT1gjU0FUWVJTI0RZRVM="},{"title":"Digital Manipulation, 9/4/03 (Thursday)","author":"by Steve Jones / Edited by Peter Gordon (puzzleeditor@nysun.com)","date":"2003-09-04","grid":"UkFDRSMjQ0FSVCNIT0VTCkFMT1QjUkFMUEgjVVJHRQpHQVJSI0FMTElFI01FR0EKVU5ERVJNWVQjVE9CT09UCiMjIyNCT1hTQ09SRSMjIwpTSE9PSU4jI0hZQlJJRFMKVEFNUCNFREdFIyNUU1VQCkFTQVAjU0lORVcjRU5ORQpOT05PIyNEVUtFI1JPTkEKS05JU0hFUyMjTEVUVEVSCiMjI0FFUk9TT0xTIyMjIwpSRUJCRVMjRUFUTEVQSUUKT1JBTCNBR0FURSNCT05HCk9HTEUjVE9URUQjQVJDTwpUT01UI1pPT1MjI1lFQVM="},{"title":"In Junctions, 9/5/03 (Friday)","author":"by Bill Zais / Edited by Peter Gordon (puzzleeditor@nysun.com)","date":"2003-09-05","grid":"U1RFTSNBU0xJUCNUSEFXCllBTSNBTlRPTklBI1VGTwpOT00jU05PQ0FUUyNNVFYKQyNBREVBRCNTSElQUyNFCiMjI1JBTkcjTVlUSCMjIwpUT0ZVIyNZT1UjV0lUQ0gKSURPSURPI0FDTUUjQVJFCkJFTkRJTkdUSEVSVUxFUwpJVFQjUkFSRSNTRVJJRVMKQVNTRVQjQVJSIyNCQUtFCiMjI0NSQU0jT0tSQSMjIwpBI0JPT05FI1BFT05TI0UKUkRBI0FHUkVFUlMjQURBCkFESiNERUNMSU5FI0lOUwpCRUFVI0xZT05TI1NMQVk="},{"title":"Tailor-Made, 9/8/03 (Monday)","author":"by Jack McInturff / Edited by Peter Gordon (puzzleeditor@nysun.com)","date":"2003-09-08","grid":"RVNQWSNWSVNBI0ZMT1JBCkxJUkEjSU5PTiNSQVZFTApTUE9LRU9GRlRIRUNVRkYKRVNQI0FMSVQjQU5FTUlBCiMjI1NUQVIjT1paWSMjIwpQT0NLRVRNT05FWSNNRFMKRU1QSVJFI1BDUyNOT0FIClJJTEVZI0xJRSNCT1JORQpTVFVEI1JBTiNTTEVBWkUKRVNTI01BREVBQ09MTEFSCiMjI0JBQlkjUEFUUyMjIwpBVEhFTkEjRk9SVCNBU0sKU0hJUlRUQUlMQ09VU0lOClBBRFJFI0lETEUjU0FORQpTVEVBTCNET09SI0FQU0U="},{"title":"There Is No \"I\" in Team, 9/9/03 (Tuesday)","author":"by Steven Kahn / Edited by Peter Gordon (puzzleeditor@nysun.com)","date":"2003-09-09","grid":"TkVDSyNISVBQTyMjTUFUCkVMSUEjQURJRVUjTk9JUgpTSUdOI0dFVEFUI0VDUlUKVE9BU1QjRVRDSCNXSEVFClNUUkFJVCNTSElQWUFSRAojIyNTQ1JVQiNUQU8jIyMKQUxFQyNBQlVUI1RSQUNFCk1JREkjRE9SSVMjS05PQgpPTUlUI0VBR0xFI1NUVUIKU0FUWVIjVEhFTSNMSVBTCiMjI0NBQiNQUklNQSMjIwpSVVNISE9VUiNTT05BVEEKQVNIRSNXSEFUI09EREVSCkJFRUYjVFVUT1IjRURBTQpBUkVTI0lSRU5FI1JVU0UKVFNQIyNFQVNFRCNTUEVE"},{"title":"Five of a Kind, 9/10/03 (Wednesday)","author":"by Randall J. Hartman / Edited by Peter Gordon (puzzleeditor@nysun.com)","date":"2003-09-10","grid":"TUNNI0FCUkFNI0dBVVpFCkNISSNGTE9SQSNSSVNFTgpCQURMQURIQURNQUREQUQKRU5HT1JHRSNFSU4jQUxTCkFHRUUjIyNMSU5EQSMjIwpMRVRXRVRWRVRHRVRTRVQKIyMjI01PT0cjIyNUSUxFCk5JTktJTldJTlRJTlBJTgpFRElFIyMjUkFOVCMjIyMKVE9UR09UQ09UTk9UU09UCiMjI1NDT1JOIyMjUk9CRQpBVEUjQ1JPI0VTQ09SVFMKVFVUTlVUQ1VUSFVUUlVUCk9OVEFQI1VUVEVSI09TRQpNRUFOWSNTRVVTUyNXRUQ="},{"title":"Themeless Thursday, 9/11/03 (Thursday)","author":"by Byron Walden / Edited by Peter Gordon (puzzleeditor@nysun.com)","date":"2003-09-11","grid":"U0xJUFVQUyNTV0VESVNIClRJTkFGRVkjTElUSU5UTwpVTktOT1dOU09MRElFUlMKUkVTVFMjQ0xPRFMjUkFUCkdBUFMjU0hBUEUjU1RZRQpFR08jQUtJTlMjRkxJRVMKU0VUVExJTkcjQlJJQVJTCiMjI09MRUcjUEVFTiMjIwpFQVJORUQjQkVFUktFR1MKWFJBWVMjQkVUVEUjTlJBCk1JR1MjQllSRFMjRkxBWQpBWk8jT1VUVE8jRFJBTVMKWU9VQU5EV0hPU0VBUk1ZCk9OVEhFR08jUkVGVUdFRQpSQVNTTEVTI1NQWURFUlM="},{"title":"Drain Man, 9/12/03 (Friday)","author":"by Cathy Millhauser / Edited by Peter Gordon (puzzleeditor@nysun.com)","date":"2003-09-12","grid":"Q09NUCNTVFJFVyNCQUJBCkFNT1IjSEFJTEUjSURJRwpMQU1FRFVDVFNFU1NJT04KSU5BQklUI1RBS0VIT01FCiMjI0FEVUUjIyNQT1NFUwpQSUNLVVBUSEVUQVAjIyMKU1dFRVAjUkFWRUwjQUxQClNPTEQjUEFWRUQjQVJFQQpUTlQjSEFET04jT1NDQVIKIyMjTElLRUNMT0dXT1JLCkVTU0VOIyMjWUFMRSMjIwpUSFVOREVSUyNURUxMTUUKSEVTT1VUT0ZISVNMRUFLCklCQVIjRFVQUkUjQUlSRQpDQU5FI1NFREVSI1NBS1M="},{"title":"Monday Is Washday, 9/15/03 (Monday)","author":"by Harvey Estes / Edited by Peter Gordon (puzzleeditor@nysun.com)","date":"2003-09-15","grid":"QVVUTyNTTElNI0NQTFVTCkNISU4jTE9MQSNBTElTVApEVUVMI09OSU4jUkVQQVkKQ0hSSVNUSUFORVJBIyMjCiMjI05ZQyNEQUxZI09EUwpBUlNFTkFMIyNNT05ST0UKVklQI0NSSU1TT05USURFCk9CSUUjI09JTCMjSE9PRgpXQVJUU0FOREFMTCNMRUkKRUxJQ0lUIyNNQUVXRVNUCkREVCNUT1JUI1VOQSMjIwojIyNOT1BBSU5OT0dBSU4KSEVNRU4jQkxFRCNOSU5FCkFUQVJJI0JFQVIjRUROQQpUQVJPVCNJU1BZI1JFU1Q="},{"title":"Madison Avenue, 9/16/03 (Tuesday)","author":"by Lynn Lempel / Edited by Peter Gordon (puzzleeditor@nysun.com)","date":"2003-09-16","grid":"U1RPV1MjQlVOI0NOT1RFClRPTkFMI1JOQSNSSVZFUgpBRE9SQVRJT04jQUdFTlQKUkFOI0xFRCNBRFZFUlNFCkVZRVNPUkVTI0VBUiMjIwojI1NBTUUjVEVOVCNTQUQKQURNSVNTSU9OI1NQT1JFCk1FSU4jQVZPSUQjRUxMQQpNQU5UQSNBRERJQ1RJT04KT0xEI01FTlUjTEFJQyMjCiMjI0FOVCNQTEFZVElNRQpBRERSRVNTI0FURSNUQVAKUk9BRFMjQURWRU5UVVJFCkFMTE9UI0lSQSNOVURJRQpCRUVSWSNMRVMjRVZFTlM="},{"title":"Slight Alteration, 9/17/03 (Wednesday)","author":"by Patrick Berry / Edited by Peter Gordon (puzzleeditor@nysun.com)","date":"2003-09-17","grid":"QVJDSCNSSVNFI0FRQUJBCkxBQkFOSU1BTCNDVVJFUwpGRVNUSVZBTE9GTElURVMKIyMjRUxFQ1QjTFVDSVRFCktJU01FVCNJUkEjSEVTUwpBUkVBIyNCRUFUTEUjIyMKUkFESUNBTFJJVEUjUkNBCkFOQUxPR1kjTEVBU0VSUwpUSU4jTUlURUFORE1BSU4KIyMjUkVUT1JUIyNBQ01FCkVTUE8jQU5OI0JFVFRFUgpTVE9QSVQjRVJVUFQjIyMKU0lURUZPUlNPUkVFWUVTCkFOVElTI0lUSU5FUkFSWQpZRVNOTyNCT0xUI1NQRUQ="},{"title":"First Wives Club, 9/18/03 (Thursday)","author":"by Gary Steinmehl / Edited by Peter Gordon (puzzleeditor@nysun.com)","date":"2003-09-18","grid":"IyNJTVAjQVRUTiNCQVNLCkFHTlVTI0JPV0UjQUxUTwpDT0NLQU1BTUlFI0NMQVAKVE9PTCNVU0VSIyNLRVlTCkVETVVOREhJTExBUlkjIwojRUVLUyMjIyNFUlVDVFMKIyMjU0FOVEFCQVJCQVJBCkxJUCMjRU5ESVMjI1RVWApQT1JHWUFOREJFU1MjIyMKU0NPUkVSIyMjI09VU1QjCiMjR0VUU0lURE9XTlBBVApGT1JNIyNQUk9XI0JPTk8KRVRBTCNCUk9XTkJFVFRZCk1JTUkjRUFUUyNSQVRFUwpBU1NOI05ZU0UjQU1ZIyM="},{"title":"Weekend Warrior, 9/19/03 (Friday)","author":"by Matt Jones / Edited by Peter Gordon (puzzleeditor@nysun.com)","date":"2003-09-19","grid":"SlVTVFBFQUNIWSMjQ1VCCkFMUEhBTUFMRVMjTE9ORQpTVEVBS1NBVUNFI09MREUKT1JBTiMjI0NIUllTTEVSCk5BUktTI0lLRSNTVElSIwojIyNTVElORSNGTElOVFMKRUxTQUxWQURPUiNORUFMCk5FV01PT04jTUlTVEFLRQpPTkVJI1JFR0lTVEVSRUQKU1RBTEtZI09UVEVSIyMjCiNBUkxPI1JOUyNQRVNPUwpBTk9JTlRFRCMjI1NUQU4KTEVOTyNBTE9IQVNUQVRFCkdBSU4jUElMRURSSVZFUgpBUlQjI1NUQU5ET05FTkQ="},{"title":"Fantastic Finishes, 9/22/03 (Monday)","author":"by Jim Hyres / Edited by Peter Gordon (puzzleeditor@nysun.com)","date":"2003-09-22","grid":"SEFSREMjR0xPQiNQRVJNCkFDVVJBI1JPTUEjQVJFQQpURUVVUCNBREFNI1BPU1QKIyMjQlVaWkVSQkVBVEVSClNIRSNMSUUjI0lMTElOSQpNSURHRVQjTVROUyNDRFgKT1ZFUlRJTUVHT0FMIyMjCkdFTkUjI0FMSSMjT09aRQojIyNXQUxLT0ZGSE9NRVIKQUJFI1RFRU4jTE9QSU5HClRFTVBPUyMjU0VUI1RPTwpIQUlMTUFSWVBBU1MjIyMKRVJOTyNCRUVSI1BPV0VSCk5FRUQjUkVORSNPSEFSQQpBUk1TI0VMU0UjVE9EQVk="},{"title":"Action Figures, 9/23/03 (Tuesday)","author":"by Craig Kasper / Edited by Peter Gordon (puzzleeditor@nysun.com)","date":"2003-09-23","grid":"UkFURSNORVJGI1RBQ0lUCkVST1MjT0RPUiNBTEFNTwpQQVJUT05HT09EVEVSTVMKQUdFI1dPRSNUVUUjTklQCkNPUkFMUyNXSE8jR0VOQQpLTk9CIyNQQVkjU0VHRVIKIyMjQUVHSVMjQ0FOSU5FCiNMQU5ET05ISVNGRUVUIwpXT1JERUQjT0JJRVMjIyMKSElUT04jTVVNIyNJVENICkFTSU4jSkVUI09OU0FMRQpUTEMjUEFUI0FETyNMRUkKRkFMTE9OSEFSRFRJTUVTCk9ORUFMI09HTEUjRFVTVApSRVNUUyNET09SI09ERVM="},{"title":"I Caramba!, 9/24/03 (Wednesday)","author":"by Mark Diehl  / Edited by Peter Gordon (puzzleeditor@nysun.com)","date":"2003-09-24","grid":"RE9QRSNLUkFGVCNBTVBTCkVSSU4jSEFMTEUjQkFSVApCSUdMRUFHVUVSI0FMT0UKUk9NQU5OVU1FUkFMT05FCkFMRVJUIyMjIyNOT0RBTAojRU5HRUxTI0VORE5PVEUKI1NURVJFTyNMQVlFUkVECiMjIyNTQVcjSU5UIyMjIwpDT0NISVNFI1NDQVJBQiMKVU5MSU5FRCNFRVlPUkUjClNMRVBUIyMjIyNMQVJBTQpTWU1CT0xGT1JJT0RJTkUKSVRTTyNPTE1BTlJJVkVSCk5PT04jUkVJR04jRUFSTApHT05FI0RBVEVTI1NMWUU="},{"title":"3x5, 9/25/03 (Thursday)","author":"by Byron Walden / Edited by Peter Gordon (puzzleeditor@nysun.com)","date":"2003-09-25","grid":"R1VBVkFTI0VOViNFVkFTCkxBWEVTVCNET0EjTEVWSQpPUkVMU0UjVVBDI0tORUUKIyMjVklQI0NSVUlTSU5HCiNJVkVTI01FT1VUI1ZVRQpVTklUSVZFI0JNT1ZJRVMKU0VWRSNBUk0jVk9JRCMjCk1FQUwjQ0xBUkEjVklMQQpDRExWI0xFVkVMI0lWQU4KIyNBSURBI1NVViNBSU5UClBBU1NJVkUjU0VBTkNFUwpBVFYjQ0hBU0UjQVZJUyMKVEhFQkVBU1QjRlJBIyMjClRPR0EjVklBI0xPTkdFRApPTUFSI0VMTCNJTkNBU0UKTkVTVCNMWUUjVFNFVFNF"},{"title":"APB, 9/26/03 (Friday)","author":"by Joy M. Andrews / Edited by Peter Gordon (puzzleeditor@nysun.com)","date":"2003-09-26","grid":"I0hVVCNORVJUUyNNTUVQCk1PTkEjQVRBUkkjREFMRQpST0NLI1VOSU9OI1ZJRVIKUFBMRUFTQU5UI0ZJTE0jCkVMQUlORSMjU0tJI0NFTApEQVMjREFEQSNJTlNBTkUKI1NQQVIjT1BBTCNBUlRTCiMjI0xFRUpQQ09CQiMjIwpBUFNFI0JPRVIjTFVTVCMKUkVJU0VSI0RFU0kjQ0lECkVSTiNXT08jI0VUQ0hFUgojREFWRSNGUkVFWklOR1AKTElURSNTVElSUyNST0FOClRFUkkjSEVOTkEjQ09NTwpQTUFOI0VORE9XI0VLRSM="},{"title":"Peter Pan Complex, 9/29/03 (Monday)","author":"by Edgar Fontaine / Edited by Peter Gordon (puzzleeditor@nysun.com)","date":"2003-09-29","grid":"U09CSUcjQURBTSNBUEVTClVIVVJBI0dBTEUjR0FaRQpCSVNPTiNFUklOI0VUUkUKSk9ITkdJRUxHVUQjQkFECiMjI1lFVCNJTlNPTEUjIwpUT1kjU0NBTlMjUklORFMKRVJBUyNIT0cjRklHQVJPCk1JQ0hBRUxDUklDSFRPTgpQT0tFUlMjSFVOI1RBTkcKU05FRVIjRElHSVQjUkVTCiMjVFJPV0VMI1NIRSMjIwpQTFkjV0VORFlISUxMRVIKSE9ZQSNESVJFI0VMVURFCkVHQUQjR1JFVyNWRU5BTApXT0tTI0VPTlMjRU5FTVk="},{"title":"Addendum, 9/30/03 (Tuesday)","author":"by Mel Taub / Edited by Peter Gordon (puzzleeditor@nysun.com)","date":"2003-09-30","grid":"R0VSRSNCQVNFI0FDVFVQCkFNRVgjQUxFWCNTT1VTQQpTRUNUI1JPTUEjU01FQVIKQlJPT01TVElDS1VNIyMjCkFHSUxFIyMjVE9SRU9GRgpHRUwjQUlSUyNTRU5PUkEKIyMjRU5DSU5PIyNDWkFSCkxPTkdUSU1FTk9TRUVVTQpBVkVSIyNTQUNSRUQjIyMKTUVSRUxZI0tFUk4jR0VSCkVOREdBTUUjIyNTVE9MRQojIyNJU0FBQ1NURVJOVU0KTE9HT1MjR09USCNBVURJCkVOTlVJI0VTQVUjSURFUwpET1VTRSNSSU5HI0xFU1M="},{"title":"It Figures, 10/1/03 (Wednesday)","author":"by Bruce Venzke and Stella Daily / Edited by Peter Gordon (puzzleeditor@nysun.com)","date":"2003-10-01","grid":"VEVFUyNTTkFHI1NPTEFSCkhBTFQjTE9HTyNRVUFTSQpPVkVSRklWRUZPVVJUSFMKUkVDT1VQI0RJUkUjRUVLCiMjI0xFU1MjU0VMQSMjIwpPRkFMTEhJR0hTQ0hPT0wKV0FSI1NPTEUjI0hFREdFCklWRVMjRE9OTkUjTUlMRApOT05PUyMjUkVORSNTRVQKR1JBRFVBVEVTQ0FOVERPCiMjI0FSQ0gjU0lUVSMjIwpUV0EjUFJFUCNSQUJCSVMKU0lNUExFRlJBQ1RJT05TCkFESUVVI1RPTEwjTE9GVApSRVNUUyNTTUVFI0VOT1M="},{"title":"Themeless Thursday, 10/2/03 (Thursday)","author":"by Patrick Berry / Edited by Peter Gordon (puzzleeditor@nysun.com)","date":"2003-10-02","grid":"SUhPUEVOT1QjRUxERVNUCk1BTkdST1ZFI1NBSU5URQpQUkVTSURFUyNPUlBIQU4KQVNII0NPUlNFVFMjQVlFClNIT08jWkFJUkUjR0xVVApTRVJCUyNURUFSRFJPUFMKRVNTRU5DRSNTSVJFIyMjClNURVJFTyMjI0NBU0JBSAojIyNMQU1BI1RBUEhPTEUKSlVESURFTkNII0VBUkxTCklSQU4jU1RFRVIjTUFTUwpUU1AjVFVFU0RBWSNCT08KVElQVE9QI1NFTkFUT1JTCkVOTElTVCNORVRXT1JUSApSRUVDSE8jQVBPU1RBU1k="},{"title":"Wrong Turns, 10/3/03 (Friday)","author":"by Seth A. Abel / Edited by Peter Gordon (puzzleeditor@nysun.com)","date":"2003-10-03","grid":"R09FUyNCQVJCUyNDTkJDCk9QQUwjT0hBUkUjUlVFRApMQVNFI05BR0FUI0lSQVMKRlJZSU5HQlVUVExFU1MjClNUQUdFIyMjVEVBU0UjIwojIyNIQU1BUyMjWk9SQkEKREpTI1JJR0hUTVlGSUxFCklPVEEjTk9JUkUjRkVBUgpSRUFESU5HTE9SRSNTSE8KVFlST1MjI0xJRU5TIyMjCiMjRlJBSUwjIyNDSElSUAojUFJBWUJZVEhFTFVSRVMKRkxVQiNTQ1JBRyNMQVZBClJBSUwjRVJBVE8jVE5VVApBTlRFI05BTUVTI1pJUFM="},{"title":"Roughing It, 10/6/03 (Monday)","author":"by Joe Bower / Edited by Peter Gordon (puzzleeditor@nysun.com)","date":"2003-10-06","grid":"S0VBTlUjTEFNI1NDT1dMCklCU0VOI0FNQSNIT09IQQpOT1RBSEFQUFlDQU1QRVIKRUxPUEVSUyNBUlJFU1RTClJBTiNBR0VEI09QVCMjIwojIyNCUk8jRU1VI09JTFMKQUNSSUQjU1BFQ1MjTklQCkNST0NPRElMRUhVTlRFUgpSVU0jRklMRVQjUEVPTlkKRVhBTSNHT1QjV0VUIyMjCiMjI0FETyNFTUlSI0dPRApTQ0FSRVVQI0FUU1RBS0UKUE9DS0VURklTSEVSTUFOCkFOVEVEI0NPTyNERUVQUwpURVNUUyNTVU4jRUVSSUU="},{"title":"Formal Females, 10/7/03 (Tuesday)","author":"by Diane Epperson / Edited by Peter Gordon (puzzleeditor@nysun.com)","date":"2003-10-07","grid":"TU9TUyNSQU5JI0VER0VSCkVNSVQjQVRBRCNNQVVWRQpMQVJBI05FUk8jT1BURUQKVEhFUkVTQUNMT1RIIyMjClNBTkRMT1QjI01JTlRFUgojIyNBSU0jU1BBQ0VBR0UKU1BJVCMjU1RFTk8jQ1JUClBFTkVMT1BFUElOQ0hFUgpBTlQjSVJBVEUjI0FTVE8KU1RFV1BPVFMjQVBUIyMjCk1BTElCVSMjSURFQU1BTgojIyNQQVRSSUNJQUNBS0UKTElCRUwjT05FRCNPR1JFCkFMQVJNI0FHVUEjTU9PRApHTEFTUyNNQVBTI0JPTlk="},{"title":"Horsing Around, 10/8/03 (Wednesday)","author":"by Jerry E. Rosman / Edited by Peter Gordon (puzzleeditor@nysun.com)","date":"2003-10-08","grid":"V09SSyNIT0JCWSNST0FOCkFORFkjQVdBUkUjQVVSQQpST0FSI1VOQVNTVU1JTkcKIyMjQUNMVSMjSVJTIyMjCkNETCNSRVBBQ0tTI0xBQwpMRUlURVIjTklOQUZPQ0gKT05FQU0jQVROTyNGT1JBClRFTk5FU1NFRVdBTEtFUgpIVUVZI0lOTlMjQkFTQUwKRVZFQVJERU4jUE9UQUdFClNFUyNBRVJBVE9SI0RFWQojIyNLSUQjI0hVVFMjIyMKU1BJTkRPQ1RPUiNPREVTCkVFUk8jT1NPTEUjVE9HQQpBUkFCI1JJVkVSI1NIT1c="},{"title":"Squeeze Play Result, 10/9/03 (Thursday)","author":"by Alan Olschwang / Edited by Peter Gordon (puzzleeditor@nysun.com)","date":"2003-10-09","grid":"UkFIQUwjTUFDQVcjU09T"},{"title":"Weekend Warrior, 10/10/03 (Friday)","author":"by Byron Walden / Edited by Peter Gordon (puzzleeditor@nysun.com)","date":"2003-10-10","grid":"VEhBVFNBTU9SRSNNQVpFCkhJR0hIRUFWRU4jT1hFTgpBUkdVRVNXSVRII09MRU8KUkVJTVMjI0RSQUJORVNTClBSRVAjU1FVQUxPUiMjIwojIyMjU1RVQ0NPV0FMTFMKRklSU1REQVRFI1NLT0FMClJPVVRFUyMjI1BJRVJDRQpJTlNFVCNMSU5FRFJJRUQKREFUQVNUT1JBR0UjIyMjCiMjI01PUlRPTlMjTUFSRQpNQVNTTk9VTiMjUEVLRVMKVUhPSCNVU0VBTkFMSUFTClRBVEkjUEVSTUFORU5DRQpUQlNQI0VTU0FZVEVTVFM="},{"title":"Columbus Day, 10/13/03 (Monday)","author":"by Ed Early / Edited by Peter Gordon (puzzleeditor@nysun.com)","date":"2003-10-13","grid":"RUxBTiNFWElTVCNNRU1PClNPRkEjRElOQUgjQVNFQQpDSVJDTEVJTk5FV1lPUksKVVRBSEFOIyNDUklTUCMjCkRFTU9TI0FTSEVOI0hPSQpPUkVTI1NVTU8jRFdBUkYKIyMjI0ZPUkUjVVNBR0VTCiNDQVBJVEFMT0ZPSElPIwpFUlJPUlMjVEhPUiMjIyMKUFVSRUUjR0VNUyNQUk9TCkFYRSNNRVJSWSNIQVVOVAojI1NIQVZFIyNFQVJORVIKQ0lUWU5FQVJBVExBTlRBCkFXRUQjTlNZTkMjREVXWQpST0RFI1RFRVRII0VST1M="},{"title":"Only the Good Diet Young, 10/14/03 (Tuesday)","author":"by Patrick Jordan / Edited by Peter Gordon (puzzleeditor@nysun.com)","date":"2003-10-14","grid":"QUNPUk5TI0JPQVIjUk9EClRPTElGRSNFTExBI0VWQQpNSURETEVBR0VJUyNMSVoKU0xFRCNTTE9HI0NBSU5FCiMjI0FDVE9SI0RBTkNFUwpXSEVOWU9VUldJTEQjIyMKSU1BQ1MjI0FIQSMjU1BBCkxPUkVUVEEjT05BV0hJTQpUU1AjI09CSSMjUkFJTlMKIyMjT0FUU1RVUk5JTlRPCkNBU1RSTyNTTk9PVCMjIwpBUlVCQSNET1VHI1NIT1AKQklaI0JSQU5NVUZGSU5TCkxBWSNJQ0JNI0VST0RFUwpFU1EjQ0FTRSNTT1JFU1Q="},{"title":"They're All Wrong!, 10/15/03 (Wednesday)","author":"by Barbara Olson / Edited by Peter Gordon (puzzleeditor@nysun.com)","date":"2003-10-15","grid":"U0NSQVAjR1JBRiNTQVBTClBFQUNFI0xPUkUjVFJJTwpVTFRSQSNPVkVSI0FJTFMKUklURVRPQkVBUkFSTVMjCk5BWSNCQVMjI0FCU0VOVAojIyNTT1QjT0dSRSNZRUEKIyNSSUdIVEJST1RIRVJTCiNURU4jI0lJSSMjSVJTIwpXUklHSFRMRVRURVJTIyMKS0lUI1VSTFMjQVJUIyMjClNQRUNJRSMjRVRPI1JBWQojV1JJVEVPRlBBU1NBR0UKRklBVCNUQUxDI0lORlJBCkVSVEUjT0hJTyNWT1RFUgpaRUVTI1BVVFQjRUJTRU4="},{"title":"A Great Deal, 10/16/03 (Thursday)","author":"by Praveen Goday / Edited by Peter Gordon (puzzleeditor@nysun.com)","date":"2003-10-16","grid":"RVdFI0JFQVNUI1NUQVNICkpBUiNBRERUTyNBTFRITwpFTEkjU1RBUlBJVENIRVIKQ0xFQVQjI0FBUkUjTEVNClRPUEJFRFNJWkUjUkVQTwpTUEFTI1JBRyMjR09USU4KIyMjI0hVR0gjUFJBSVNFCiNISVZFTUFUUklBUkNIIwpTT05JQ1MjSU9OUyMjIyMKQ1JBQ0sjI05VVCNBRE9TCkFSTkUjVFlQRU9GTElGVApSSUQjQkFJTyMjQUlTTEUKQUJPREVSRUtISVQjTUFSCkJMVUVTI0xFTU1FI0FURQpTRVRBVCNEUk9QUyNMRU8="},{"title":"Shifty Business, 10/17/03 (Friday)","author":"by Randall J. Hartman / Edited by Peter Gordon (puzzleeditor@nysun.com)","date":"2003-10-17","grid":"UkFHI0tOT1dTI0NSQVNICkFMSSNFRVJJRSNMRU5UTwpQT1JLWUJFTEwjT0FLRU4KVFVMSVAjU0xJTVlTSEFECiMjU0NBTiNBR0UjT1NMTwpKQUNLREFXIyNUQU4jIyMKRUxPIyNQT0VNI05FSUxTCkZPVVJQQVJUWUhBUk1PTgpGRVRBTCNOQVRPIyNNSUEKIyMjUk9EIyNIT1BTSU5HCkFCQkUjUk5BI0ZMT0cjIwpCRUVGWUpFUksjQVVSQVMKQVRSSUEjU1RBR1lQQVJUClNUUkVQI1RPUk1FI05FTwpIRUFEUyNTT0xBUiNUQVA="},{"title":"The Eyes Have It, 10/20/03 (Monday)","author":"by Lynn Lempel / Edited by Peter Gordon (puzzleeditor@nysun.com)","date":"2003-10-20","grid":"QkxVRSNTT0xPI0NBUk9CCkxPTkcjVVJBTCNBTE9IQQpFQ0hPI0JBTkQjTUlEQVMKV0hJVEVQTEFJTlMjTVJJCiNTUElSTyMjRVRISUNBTAojIyNTRUVUTyNIQVJLIyMKQUNDVCNORVRTI0ZBVVNUClJITyNMQVNIT1VUI0VSQQpNSU5FTyNURVJOI1NOT0IKIyNFVE9OI1JFSUNIIyMjCkVOSEFOQ0UjI1FVQVJUIwpORUUjSVJJU01VUkRPQ0gKQUdBVEUjR0xVRSNJREVBCkNFREVTI0hVTEwjTkVMTApUVlNFVCNUUkVZI0dPTEY="},{"title":"The Re-Producers, 10/21/03 (Tuesday)","author":"by Peter Abide / Edited by Peter Gordon (puzzleeditor@nysun.com)","date":"2003-10-21","grid":"TUVUUyNDT1ZFI1JBQ0VECkVSSUMjQVJJQSNPUkFURQpTSUxPI05FQVIjQUxMQU4KSEVMTE9ET0xMWURPTExZCiMjI0RSWSMjWUFLIyMjIwpMU0QjQk1PQyNXSUdXQU0KQUhFTSNBTk9OI0xMQU1BClNFTkRJTlRIRUNMT05FUwpTQVRJTiNPQUhVI0JFTlQKT1JFSURBI05JVEUjRERTCiMjIyNJTkMjI0lMRSMjIwpCQUFCQUFTVFJFSVNBTkQKQVRBUkkjUE9PUCNTSEVBClNUQUlOI0FOVEkjRU1JVApLTkFDSyNOSUNFI1hFTkE="},{"title":"\"Oh, Dry Up!\", 10/22/03 (Wednesday)","author":"by Patrick Jordan / Edited by Peter Gordon (puzzleeditor@nysun.com)","date":"2003-10-22","grid":"U1RVQiNUQUxMI0NVVFVQClVSU0EjQVNJQSNBU09ORQpCRUVSI1NUQVIjU0FVVEUKSkVSS1lNQVJLRVQjUk9OCiMjI1NFQSMjU0VEQU4jIwpBQ1MjU05PQiNST1RBVEUKTUFPIyNJUklTI1dPTUVOClBSVU5FQVNTSUdOTUVOVApMRVRPTiNPT1pFIyNOT1IKRVRIRUxTI05FVFMjVFJZCiMjQkxJTkQjI1NSTyMjIwpNT08jU09VUlJBSVNJTlMKRVhVTFQjTUVPVyNBVk9OClJFTkVFI0JBTUEjS0VSSQpFTkRFRCNPTEFZI0FTQVA="},{"title":"Themeless Thursday, 10/23/03 (Thursday)","author":"by Craig Kasper / Edited by Peter Gordon (puzzleeditor@nysun.com)","date":"2003-10-23","grid":"SUxTQSNTVEFSVE9WRVIjCk5FSUwjSEFWRUFOSURFQQpET05FI0lST05NT05HRVIKSU5DI0hJVElUI1JFSUtJCkNBTExJVEFEQVkjI0VFRQpUUkFJTkVSI0NFTCNSRFMKRURJQ1RTI1ZBUklHIyMjCkRPUktTI0JBUiNHUkFQRQojIyNTQUdBTiNTSEFWRU4KQVJTI1RBRCNQT1RURVJTClNBVCMjU1RBUlNFQVJDSApTTkFDSyNBTE9VRCNTSVIKQUNUVUFMU0laRSNMRVZJCkRPVUJMRVRFQU0jRUxBTgojUkVTSURFTkNFI1dZTEU="},{"title":"Bringing to Fruition, 10/24/03 (Friday)","author":"by John Underwood / Edited by Peter Gordon (puzzleeditor@nysun.com)","date":"2003-10-24","grid":"UEFSI0FUT01TI1NUUkFQCkxJRSNQT1NFUyNDSE9JUgpFU0NBUFRJU1QjUkVBREUKQUxVTlNFUiMjREFHUkFZClRFUkkjTUlTU1VTQSMjIwojIyNNQVNTRVVSI1BFUFMKSU1QRUQjI0FMRVIjQU1QClNPSSNESVNGVVJFI1RFQQpQVU4jU09QSCMjRFVTVFMKWUVHRyNUQVRUT09TIyMjCiMjI0FEQU1TT04jVVBTQQpTT01FUlMjI1JFR0FMRUQKVVZVTEEjQ09OU09MSURECkJFTklOI0NMVUVEI0VMTApMUklDSyNTRVBUUyNEWUU="},{"title":"Something's Fishy Here, 10/27/03 (Monday)","author":"by Joe Bower / Edited by Peter Gordon (puzzleeditor@nysun.com)","date":"2003-10-27","grid":"REFNUyNXRURTI1RVVE9SCkVWSUwjQUxPVCNTUE9LRQpTT0xFUFJPUFJJRVRPUlMKS05FRUwjI0VBUiNFVEFUCiMjI1BPU0gjV0FSTSMjIwojV0hJUFBFUlNOQVBQRVIKV1JFTiNBUkkjI0tPQUxBCkVFTiNQUk9WT0tFI05BRwpCQU5BTCMjRU9OI05JVEUKU0tBVEVPTlRISU5JQ0UjCiMjI0hBUkkjU1RBTiMjIwpBQkVMI0VUQSMjTUVTU1kKQ09NRURPV05USEVQSUtFCkhBSVRJI0lURU0jSURFQQpFUlJFRCNURUFNI05FV1M="},{"title":"Claim to Famous, 10/28/03 (Tuesday)","author":"by Patrick Berry / Edited by Peter Gordon (puzzleeditor@nysun.com)","date":"2003-10-28","grid":"R0lCQiNQSEFTRSNHT1JZCkFDUkUjTElCRUwjQVJFQQpTS0lEI0FMQkVFI1JJQ0sKIyNHQVJZTEFSQ0VOT1VTCkNMQVVERSMjI1RBSU5UIwpSRURCQVJCQVJPVVMjIyMKQVZJUyNTQUJFUiNIT1NTClRFRSMjI0hBTCMjI05FQQpFUlJTI09BU0lTI1JJR1MKIyMjTUFSSUVDVVJJT1VTCiNUUkFDSSMjI1BJVE5FWQpCUlVDRUdFTkVST1VTIyMKTElOSyNBUk9TRSNBS0lOCk9QSUUjTUFEQU0jTElSQQpCRU5EI0lTU1VFI1NOQVA="},{"title":"[Yawn], 10/29/03 (Wednesday)","author":"by Holden Baker / Edited by Peter Gordon (puzzleeditor@nysun.com)","date":"2003-10-29","grid":"Qk9SRSNTVFJBUCNHTElCCk5PVU4jQ09BQ0gjTElORQpBUEVSU09OV0hPVEFMS1MKSVNSQUVMSSMjTlVESVNUCiMjI0dFRCNUUkVORCMjIwpNT1NFUyNQUlUjRUVSSUUKQ1BBI0FTTEFOVCNOVU5TCkpFVCNXSEVOWU9VI01UUwpPUkJTI0FCU09SQiNPUkUKQkFZT1UjRU9OI0FLUk9OCiMjI0NIQVNNI0ROQSMjIwpTSEFLT1MjI01BR05BVEUKV0lTSEhJTVRPTElTVEVOCkFMVE8jQUJVU0UjQVJOTwpLT09QI05BVFRZI1NBU1M="},{"title":"Quarter Turns, 10/30/03 (Thursday)","author":"by Gary Steinmehl / Edited by Peter Gordon (puzzleeditor@nysun.com)","date":"2003-10-30","grid":"SEFQIyNSQU1QI1BFVEVSCk9CSUUjQURJT1NBTUlHTwpKT05BVEhBTlNQUklOR1MKT1VUR08jTUVTQSNURUVTClNUT0xFIyMjVVJJI1NESQojI0JFRFNVTU1FUlMjIyMKQVdFIyNVU0MjI01BQ0VTCkNIQU5HRU9GU0VBU09OUwpUT05BTCMjTFBTIyNORVQKIyMjQlVGRllGQUxMUyMjCkxJQyNUQUkjIyNPT09MQQpFUkFTI0lOQ0EjQVRMQVMKVklDVE9SSUFXSU5URVJTCklTQUFDU1RFUk4jT1JDQQpTSE9SVCNFTllBIyNTSFk="},{"title":"Weekend Warrior, 10/31/03 (Friday)","author":"by Bill Weber / Edited by Peter Gordon (puzzleeditor@nysun.com)","date":"2003-10-31","grid":"U0FVTkEjSlVER0VKVURZClRFTk9OI0FLUk9OT0hJTwpSU1ZQRCNEUklWRVRIUlUKQVRFI0lERUFMIyNTVUVSCldISVRFUiNJTFNBI0hSUwpIRUxJI0pBTiNDUlQjIyMKQVNJVFdFUkUjQUxJU1RTClRJTkxJS0UjUFJFUFBJRQpTQUdFTFkjQ0FMU1RBVEUKIyMjRENMI09ERSNPVElTClNQQSNPTEVTI1RIRVRBUwpUVVJOIyNWSVNUQSNFTlQKQVJHRU5USU5BI1NFUlJBCkxFT1JPU1RFTiNBTUVFUgpMRU5ETEVBU0UjVE9ERFM="},{"title":"Trading Spaces, 11/03/03 (Monday)","author":"by Byron Walden / Edited by Peter Gordon (puzzleeditor@nysun.com)","date":"2003-11-03","grid":"QVNQUyNGSURFTCNJTkZPClpFUk8jQUNFTEEjTkVPTgpUSUVEI0JBTExPRkZJUkUKRUtFI0xFTlQjI1JVTEVTCkNPTlZFUlNBVElPTiMjIwojIyNFR0dPI0hPTiNCTVQKU1BBUlNFI1dFTlRTTE9XCkFSVFMjI0xJTUVTVE9ORQpNSUxFU1RPTkUjI1JPVEUKTUVBU1VSRUQjV0VFREVECllEUyNOT1cjREFWRSMjIwojIyNDT05TRVJWQVRJT04KSVNBQUMjI0xZSU4jUkRBCkJJTExPRkZBUkUjTUFJTgpFVEFMI0FVVE9TI0FRVUEKVEVOUyNCUkVUVCNSSU1T"},{"title":"Tidy Sum, 11/04/03 (Tuesday)","author":"by Brendan Emmett Quigley / Edited by Peter Gordon (puzzleeditor@nysun.com)","date":"2003-11-04","grid":"QkJRI1JFREZJUiNDQU1QCkVBVSNFTFBBU08jQUxPRQpBUkUjRklMVEhZTFVDUkUKU0hFQSNKVVMjU09TT09OClRBTlMjQVNPRiNERUFOUwojUkFMUEgjI0xJRSMjIyMKQUJORVIjQ09JTiNQTElFCk1PTkVZTEFVTkRFUklORwpQUkVQI0FMSVQjTE9UVE8KIyMjI1dXSSMjVE9PVEgjCkFST01BI0ZXSVcjRkxFVwpTVVBFUkIjSE9FI1NFTEEKUFJFVFRZUEVOTlkjRUVMCkNBUkUjVE9OSVRFI1ZBVApBTEFTI0VTU0FZUyNBRFo="},{"title":"What You Z Is What You Get, 11/05/03 (Wednesday)","author":"by Randall J. Hartman / Edited by Peter Gordon (puzzleeditor@nysun.com)","date":"2003-11-05","grid":"SE9UI0JJR1NVUiNMSUFSCkFHRSNFUk9JQ0EjSU5DQQpHUkFaRUtFTExZI1ZFTlQKU0VNSSMjU1RBRyNFUEVFCiMjI01PQiMjI1VOSVQjIwojI0ZBWkVUSEVOQVRJT04KQ0hJI1NURUFNI0JVVFRFCkhFUlMjQU5OQVMjUFVUVApFUklFUyNUT0lMUyNET1MKWk9ORU9GU0lMRU5DRSMjCiMjR0FMTCMjI1dPTyMjIwpHT0xGI0lUQ0gjI0lOR0UKT0JJVCNSQVpJTkdGT1JNCkxPTkUjVFJBTEVFI1JBTQpERUVSI1NUUk9ERSNBREE="},{"title":"Anagrammed Edge, 11/06/