{"id":"newsday-2006","publication":"newsday","year":"2006","count":365,"puzzles":[{"title":"1/01/06 HAPPY NEW YEAR: What happened on January 1sts","author":"by Sally R. Stein, edited by Stanley Newman","date":"2006-01-01","grid":"UE9QRSNTQ1JBR1MjRUNSVSNBSkFYCkVCQVkjVEhFU1VOI01BTk4jQkRSTQpST1VFI1BBTkFNQUNBTkFMI0FTVEEKVEVMU1RBUiMjRFJPTkUjQVNTQVlTCiMjUk9PVCNHQVJMSUMjRVRIRUwjIwpTVEVSTiNBUkxPI0ZJRVJDRSNJUkEKTE9WRSNTVEVFUFMjUEFUSCNTTk9CCk9XRSNERVRFUiNBQkFURSNCQUdHWQpPRVIjQVZJRCNTTEFURSNQQVlFRVMKUFJFVFpFTCNQRUVSSU4jQUxFUlRTCiMjI0VaUkEjUkFNQk8jU1BBUiMjIwpUQU1BTEUjTE9HU0lOI0xFTlNDQVAKUkFJU0VEI0VDT0xFI05BUkMjT1JPCkFSTEVTI1dBTERPI0xFVkVFI1RJUwpDT0xUI0NBU0EjVEhBV0VEI1BUQVMKRU5FI01BS0VNRSNPS0VEI0FST1NFCiMjTk9CTEUjQU5HTEVSI09ESU4jIwpOT05GQVQjU1RPUlkjI0lST05CQVIKQVNJQSNFTExJU0lTTEFORCNDT1JFClBMVUcjQ0lBTyNFRVlPUkUjRVdFUwpTT01FI0hFV04jRkVFTEVSI1NMQVQ="},{"title":"1/02/06 WELL-BUILT","author":"by Gail Grabowski, edited by Stanley Newman","date":"2006-01-02","grid":"U1BJVCNOQVBFUyNTVEFSCkxFTkEjSURFQUwjT0lMWQpVU0VSI0FPUlRBI1VSU0EKU1RST05HU1VJVCNORU9OCkhPVFRFQSMjTkVFRCMjIwojIyMjVFJPVCMjRUJCRUQKU0FTSCNBVVJBI0xJRVRPCk9TQ0FSI0NPQiNTVEVBTQpBVEFSSSNIT0VTI0VSTEUKUklORFMjI1BMVVMjIyMjCiMjI1lFQVIjI05PU0hPVwpTTEFCI1NPTElEU1RBVEUKUE9MTyNTT1VTQSNBU0hFCkFORFkjRU1DRUUjU1RFUApTRUFTI1RZS0VTI0hFUlM="},{"title":"1/03/06 IN THE CAR","author":"by Sally R. Stein, edited by Stanley Newman","date":"2006-01-03","grid":"TEFTSCMjQVBFRCNPTEVPCkFTSEVTI1dJUkUjU09VUApTUEFSS1BMVUdTI0NBUlQKU0VSQklBI1NPUFJBTk9TCk9ORSNFR08jI0FJUiMjIwojIyNUUkFOU01JU1NJT04KR0xPVyNORVdBUksjRFVPCkxJTEFDI0RPTiNTQ09STgpBTEEjWkFHUkVCI0FMU08KRElGRkVSRU5USUFMIyMjCiMjI0FDVCMjU05MI1VTUwpXQVJTSElQUyNHT0lOVE8KQUxPVCNTVVNQRU5TSU9OCkRBTUUjQU5USSNFTFRPTgpFU1BOI05ZU0UjI0VTUFk="},{"title":"1/04/06 DISCOGRAPHY","author":"by Fred Piscop, edited by Stanley Newman","date":"2006-01-04","grid":"U0tJTVMjT1JBTFMjVEFQCkFOTklFI1ZJU0lUI1JJTwpGQUNUQ0hFQ0tFUiNFTE0KRVZBI1RVTkUjI0lQQVNTClJFTk9JUiMjQk9OVVMjIwojIyNXT0xGR0FOR1BVQ0sKUklTRU4jUlVMRSNBUkVBCkFOVCMjTUlUVFMjI0VMTApQVEFTI0FMVEkjRk9TU0UKVE9SVElMTEFDSElQIyMjCiMjQk9HRVkjI0FUVElMQQpTVE9XRSMjQVRJVCNEQUQKUElBI1RSQUNLUkVDT1JECkVSUiNJTlRSTyNTSU5HRQpXRUQjVEFMRVMjVEFURVI="},{"title":"1/05/06 SAY CHEESE","author":"by Patrick Jordan, edited by Stanley Newman","date":"2006-01-05","grid":"V09WRSNMSEFTQSNTQ1RWCkFMQU4jVElOVFMjVEhFRQpHSU5HRVJTTkFQI1lFQVIKRVZFUlkjU0FLRSNMQU1CClJFU09SVCNTRU5EVVAjIwojIyNTRVJGIyMjQVNTRVQKT0FGUyNFQVJUSFkjSEVSCkxYSSNDQU1FUkFTI09ORQpERU4jQVRFT1VUI1NUWVgKRURFTlMjIyNFQ1RPIyMjCiMjUEVUUkVMI0hBTkRFRApKQVJTI0VST1MjTEFSR0UKQUxJVCNCSUdQSUNUVVJFClpPTkUjSUNJRVIjQUdFRApaRVRBI0RBTkNFI1NTVFM="},{"title":"1/06/06 COMPLIMENTARY","author":"by Shirley Soloway, edited by Stanley Newman","date":"2006-01-06","grid":"UEFTVEEjU0xBUCNTTEFUCkJMT09QI1RJTEUjSEFWRQpTRU5PUiNBTUVOI0FUT00KIyMjVE9LTk9DS0FDSElQCkFMSSNQSUMjI05VS0VEIwpURUQjT1BFTkFJUiMjIyMKTEVBTlMjI09GRkFNQU5TCkFDSFkjQUdJTEUjSURPTApTSE9VTERFUiMjTUlBTUkKIyMjI0lNTUVSU0UjUEFUCiNIQU5PSSMjVVBOI1REUwpISU1PTlRIRUJBQ0sjIyMKQVJFUyNPT1pFI0tBUFBBClJFTkUjTkVJTiNFVEhJQwpFRERZI0VST1MjTkVJR0g="},{"title":"1/07/06 SATURDAY STUMPER","author":"by Daniel R. Stark, edited by Stanley Newman","date":"2006-01-07","grid":"TUFSQUNBUyMjR0VUT0ZGCkVSQVNVUkUjUEFSQUJMRQpBU1BJUkVEI0xJQUlTT04KTkVUI1NBSUdPTiNMRUFECklOVVNFI01PREVNI1JURQpOQVJDI0JFTiNERU5WRVIKR0xFQU5JTkdTI1dFRURTCiMjI1JBTlQjVFJFUyMjIwpSQUdFRCNTUEVFRFRSQVAKQUJJREVEI0VFTCNFQVZFClZJTSNSSVZBTCNBRERFRApFTExBI1ZBUklFRCNJUkEKTEVFQ0hFUyNFVEhJQ0FMCkVOVFJVU1QjU1RPUkFHRQpERVNFUlQjI1RBQ0tMRUQ="},{"title":"1/08/06 THE BIG FOUR-O: Ten answers have it","author":"by Fred Piscop, edited by Stanley Newman","date":"2006-01-08","grid":"QUxHRVIjRVJJTiNFU1RFUiNVVElMCkxPVFRBI1hFTkEjTk9PTkUjTkFEQQpGT09URE9DVE9SI0NPUkRPRldPT0QKQVNTQUlMRUQjUkFJTlkjI0FJU0xFCiMjI0tBRUwjQ09OTiMjRk9CUyMjIwpTT1dFVE8jSE9XVE9CT09LI0VUQVMKQ05PVEUjU0FNIyMjSURZTCMjT1NFCkhJUlQjRlRMRUUjI1BFVEEjVFBLRQpNT0QjRlJPT1RMT09QUyMjSEFURUQKT05PI0xPTkUjRlVSWSNTVEFUT1JTCiMjRlJBTUVEI0lUQSNTQ0FSQUIjIwpBU0hBTUVEI1NTR1QjVE9SRSNPT0gKU0hPVkUjI1NDSE9PTFJPT00jVEhFClBBTkUjQ0FQTyMjUkVBUFMjRVRBTApJTU8jI0VWSUwjIyNNVFMjU05PUkUKQ1VSUyNMT05ET05aT08jUkFHTUVOCiMjI0FUVE4jI1BBSU4jSkVESSMjIwpBU1RSTyMjUk9VRU4jTUFORFJJTEwKU0hPT1RIT09QUyNHT09ET0xEQk9ZClNFV04jQUxMSUUjRUxMRSNFTElURQpUQU5HI1dBTEVTI1JFRFMjUkVTVFM="},{"title":"1/09/06 NEWSPAPER NAMES","author":"by Gail Grabowski, edited by Stanley Newman","date":"2006-01-09","grid":"Q1JBQiNSRVRBUiNHTkFUCkhFUkUjQUxJQ0UjTEFDRQpFVkVSI05JQ0hFI09QRU4KU1VOR0xBU1NFUyNCQVNTClRFQVNFVCMjREVMRSMjIwojIyMjR0FSQiMjQVRTRUEKQ0xBUCNCVVJOI0NST1dECkxJTU9TI0JJTyNLT1JFQQpBUkVTTyNTRUVEI1RFUk0KV0FOVFMjI0ZMRUEjIyMjCiMjI0hBU1AjI1NUUkFQUwpQQVBBI1RJTUVTVEFCTEUKT1JFUyNBTElWRSNHT0FMCk5FU1QjVE9ORVIjRVZJTApEQVRFI1NUSUxUI0RFTlM="},{"title":"1/10/06 GO FISH","author":"by Sally R. Stein, edited by Stanley Newman","date":"2006-01-10","grid":"Qk9OQSNDSEVXI0RSQVdTCkFCRUwjSE9NRSNST1NFUwpST0FEI0FUSVQjT0RJU1QKTkVUQVNTRVRTI1BTQVRTCiMjIyNFRUwjI1BJRSMjIwpBTUJMRUQjRk9PVFJBQ0UKV0FSRVMjVFJBUCNMQVJBCkFTT0YjSVJBVEUjSVJBUwpJU05UI0RJTlMjQ05PVEUKVEVYVEJPT0sjU0lHTkVECiMjI0FMTCMjQUNUIyMjIwpBU1BDQSNPTlRIRUhPT0sKTE9PS1MjTE9CRSNFTFNFCkFEVUxUI0dVQU0jUkVMWQpTQVRFUyNBTlRFI0JPT1M="},{"title":"1/11/06 HOLD EVERYTHING","author":"by Shirley Soloway, edited by Stanley Newman","date":"2006-01-11","grid":"QUxUQSNUSEVUQSNDQ0NMCkNPSU4jSEFWRU4jQUhPWQpISVRUSEVTQUNLI05FTU8KRVJBU0VSIyNIQU5EU09OCkRFTiNXSVNQI1JJT1QjIwojIyNJTlRIRUJBRyNOSU4KQUJCUiNaRVRBI0VMVURFCk5BT01JI0lOTiNST1RPUgpURVhBTiNMQU5EI09TTE8KSVJTI0ZSQU1FVVBTIyMjCiMjQ0xVRSNFUk5PI0pPRwpHUk9VTkRTIyNBTENPVkUKV09STSNDQVNFV09SS0VSCkVQRUUjQVZJTEEjVEVSTQpORVNUI1BFUktZI1NTVFM="},{"title":"1/12/06 GAME PLANET","author":"by Patrick Jordan, edited by Stanley Newman","date":"2006-01-12","grid":"T0FGI0VMQUlORSNBUklEClVTQSNMT0NLRVIjV0lTRQpUSElOS1RIRVdPUkxET0YKRk9MSU8jIyNBRE8jSVRFCk9SRUwjQkFSVEVSI0NPTgpYRUQjTElORSNTWVJVUFMKIyMjVE9OR1VFIyNFTEVFCiMjR09MREVOR0xPQkUjIwpTQ09XIyNSSUdPUlMjIyMKVE9TU1VQI1RPVVIjQ0FCCk9SUyNTSVJFTlMjVE9HTwpJREEjRVZFIyMjU1dFQVQKQ09NRURPV05UT0VBUlRICkFCRUwjVElSQURFI0NIRQpMQVJLI1NOQVJFRCNFQVI="},{"title":"1/13/06 LET'S DEAL","author":"by Merle Baker, edited by Stanley Newman","date":"2006-01-13","grid":"RURFTlMjQU1PUyNQQUNFCkxJTU9TI1BBVkUjQVRBRApTVE9WRVBPS0VSI1dBTkcKQUNURSNBR0VSI0RFTlNFClNIRUxUSUUjSEFSRFkjIwojIyNMT05FTFlIRUFSVFMKTUNDT1kjI0FQT1NUQVRFCkNJTyNTTU9LRVlTI1RPTgpDQVJPVEVORSMjQURFUFQKTE9ORE9OQlJJREdFIyMjCiMjRk9SVEUjRElFQ0FTVApEQUlSWSNIT0FSI0lOVE8KT1JFTyNCQVRIVFVCR0lOCkxVTFUjT0xJTyNSRUxFRQpFTkRTI1BGQ1MjQkxFU1M="},{"title":"1/14/06 SATURDAY STUMPER","author":"by Doug Peterson, edited by Stanley Newman","date":"2006-01-14","grid":"Qk9BUkRFUlMjT05GSVJFCkFOVEVSSU9SI0hFQU5FWQpTTE9WRU5JQSNET0NJTEUKSElORVMjI1NFRSNFVEFMCkVOQ0FTRVMjQkFHI0lUSQpSRUVMRUNUI0JSSVRBSU4KIyMjI1NISVAjI1ZBTFZFClRIRU9ET1JFRFJFSVNFUgpST05ETyMjR09ZQSMjIyMKT1VUU1dBTSNSQU5TT01TCk9TSCNOU0EjQU5EVEhFTgpQRVJLI0xFQSMjVEFTVEUKRVRPSUxFI0NSRUFUVVJFClJPTk5JRSNUSU5LRVJFUgpTUEVEVVAjSURMRU5FU1M="},{"title":"1/15/06 GOTCHA!: There's no getting away from it","author":"by Roger Coburn, edited by Stanley Newman","date":"2006-01-15","grid":"RkFMSyNMRUFOI0RPSk9TI1NPTElECklXT04jRVNQWSNPTUFOSSNBUklTRQpGQVJFI01BSU0jTkFWRVMjTUVMRUUKVFJFRUhPVVNFI1RSQVBTSE9PVEVSCkhFTlNPTiNIVE1MIyNNWU1ZIyMjIwojIyMjTUFSI1NBSUxTIyNTRUNPTkQKTUVSQ0VERVMjREVQSUNUI0RPUEVZCk9MRU8jRVROQSMjU1BBUkUjUkFWRQpTTUVMVCNBQUhFRCNTVFVEI05MRVIKSEVMTE8jR1JPV09OI0NFQVNFIyMjCkVSU0FUWiNFWUVMQVNII01BUlNIQQojIyNST1VORCNTVFJBV1MjTkJBRVIKU1RBQiNOT1JNI1NDSU9OI0RBVklEClBPTE8jSU5VSVQjI0RSRVcjQ0VERQpBTU9ORyNFTUNFRVMjRFJJTktTSU4KTUVURVJTIyNFQVJUSCNEUlUjIyMjCiMjIyNBRU9OIyNBREFNI0VNQkFSSwpCQUdPRlRSSUNLUyNOQUlMQklURVIKQUdFTlQjU1RPTEUjU0lSRSNMT0JPClJVTlRPI09SREVSI0VOT1MjR0xFTgpTQVhPTiNOT1lFUyNMRU5TI0VMTEE="},{"title":"1/16/06 AT THE TAVERN","author":"by Sally R. Stein, edited by Stanley Newman","date":"2006-01-16","grid":"T0JFU0UjQVNBUCNTT01FClJFTVVTI1NIT0UjV0hFVApBR0VOVCNTT1JUI0FOTkEKTEFSR0UjTlVUU0FCT1VUClNUWUxFUyNUQUlMIyMjIwojIyNBTUlEIyNUVVRPUlMKT1VUUyNQT1NUI01PR1VMCkJSQVNTI1NBTyNTQUxTQQpFR1JFVCNFR09TI0RFRVAKWUVTU0lSIyNMT1NTIyMjCiMjIyNMRUFGI1dFVEJBUgpCT1RUTEVTVVAjVE9SVEUKQUhPWSNMSU1FI1RPQVNUClNJTEsjSURFQSNFTERFUgpTT0xFI05FU1MjRVNTQVk="},{"title":"1/17/06 SEEING DOUBLES","author":"by Gail Grabowski, edited by Stanley Newman","date":"2006-01-17","grid":"TUVURUQjU1RSSVAjUE9QClRBQkxFI01PT1JFI0VDTwpHUkFTU0NVVFRFUiNQQ1MKI1BSRVBBUkUjI0lOUFVUCiMjIyNPRkYjI1RPTkVSUwojQ1JBVEUjU1BJREVSIyMKTElBUlMjVElSRVMjTU9QCkJBQkUjU0FMQUQjQUlERQpKT0IjRklMTFkjT0lMRVIKIyNJTUFHRVMjQlVMTFMjCk9CVEFJTiMjU0FUIyMjIwpSRUZFUiMjU1BSRUFEUyMKQVRPI1dIRUVMQkFSUk9XClRPTyNBT1JUQSNUSUFSQQpFTkQjWUVBU1QjU0FXRUQ="},{"title":"1/18/06 BY GEORGE","author":"by Fred Piscop, edited by Stanley Newman","date":"2006-01-18","grid":"U0xBVEUjU0NBTiNPUlNPCkxBVEVYI09ISU8jRkVBUgpBTklNQUxGQVJNI1RFTEwKUEFMI01VVFQjQVNITEVZClNJVFNJTiMjI1RFRSMjIwojIyNJTkFQVCNURUVURVIKU0NBTEUjVVJHRSNJT1RBClRPR0EjU1RFRVIjU09BUgpBUEVTI1VTRVIjVElUTEUKWUVTTUFOI1NFVkVOIyMjCiMjI0FSQiMjI0FOR0VMQQpTUEFSVEEjSEFORCNMRVMKSE9STiNUSEVNRVNTSUFICk9QSUUjSEFMTyNURUFTRQpXRUFSI0VMTVMjT0FTRVM="},{"title":"1/19/06 LET'S EAT","author":"by Doug Peterson, edited by Stanley Newman","date":"2006-01-19","grid":"VFNLI1NXRUFSI0JBU1RFClJJTyNFRVJJRSNVTlBJTgpBTlMjR0xJREUjU05BS1kKU0NIT09MQ0FGRVRFUklBCkhFRUwjTUFOI1RVWCMjIwojI1JFQkEjI0NBUEVDT0QKQkFEI0VER0FSIyNTSE9FCklWRSNURUFST09NI1VQUwpST0xFIyNaRVBQTyNDU0kKRFdJTkRMRSMjUE9MSyMjCiMjI0FSUCNUSE8jT1dJRQpDT05DRVNTSU9OU1RBTkQKQUJFVFMjTkFWRUwjR0FHClNJUkVTI0FSRU5BI09XRQpURUREWSNQQVJUWSNORUQ="},{"title":"1/20/06 GRAMMAR LESSON","author":"by Richard Silvestri, edited by Stanley Newman","date":"2006-01-20","grid":"QVJSQVkjVEFEQSNKT1NICk1PT1NFI0FHRVMjT1JDQQpQQVNUQSNST01QI0laT0QKI01BUlJJQUdFSVNOT1QjCiMjI0lOTiMjQUNFIyMjIwpUUkFERVNNQU4jUEFDVFMKSEVTI0RFQUwjQVRUQUlOCkVWSUwjQVdPUkQjRVJEQQpSRURFRU0jTkVSTyNPQUsKRUxFR1kjREVTSVJBQkxFCiMjIyNFV0UjI0ZJTiMjIwojSVRJU0FTRU5URU5DRSMKQUJVVCNJT1dBI05FQVRIClJFTkUjU1RFTSNUQVNURQpFWEFNI1RPUkUjU0xFRVA="},{"title":"1/21/06 SATURDAY STUMPER","author":"by Daniel R. Stark, edited by Stanley Newman","date":"2006-01-21","grid":"QVRURU1QVCNMQU5TSU5HCk5PVVZFQVUjQVZJQVRPUgpBQlJFQVNUI0NBTlRBVEEKSEFNUyNIT0FSU0UjTEFTCkVDTyNDQVJST1QjU0lCUwpJQ0lFUiNTSVMjQ1lDTEUKTU9MREVEI0FTU0VTU0VTCiMjI0RFQVIjRVRBVCMjIwpUUkFJUFNFRCNVU0VTVVAKSE9QRVMjRkFSI0VNSUxFClVNUFMjVFVORVJTI0xZUwpOQUUjQ0lORU1BI1RFU1QKRElBTU9ORCNJTkNFTlNFCkVOTEFSR0UjU0NBUkNFUgpSRVNJREVEI1NIWU5FU1M="},{"title":"1/22/06 FASTEN-ATION: Various ways to keep things together","author":"by Merle Baker, edited by Stanley Newman","date":"2006-01-22","grid":"TUVJUiNNVVJBTCNERU5ZI1NIQUhTClVUTkUjQlJBVkEjQU1JQSNURUhFRQpTVEFQTEVJVEVNI0JVQ0tMRURPV04KU0FSQUkjU1RSQURTI0VPRSNHWU5UCiMjUk5BUyNBU0lGI0lOVkFERSMjIwpRVUVFTkFOTkVTTEFDRSNQVVJEVUUKVFJBTEFMQSMjTUFDRSNBU1RPVU5ECklTUiNTVEVSTiNUVUVTREFZV0VMRApQQVNTI0lTQUFDIyMjRUFUIyNOT0EKIyMjSVFTI0lOUkUjVVBTI0FOTkFTCiNISVRUSEVOQUlMT05USEVIRUFEIwpTQU5FUiNMQlMjRE9IQSNQQU0jIyMKQU1DIyNBTU8jIyNNSVRaSSNPS0xBCkNMQU1QRE9XTk9OI1BFRVRFI0lFUwpSRVNFRURTI09UT1MjI0JBTkFOQVMKQVRFQVNFI1NBVEJPTFRVUFJJR0hUCiMjI05PTkNPTSNFTllBI0hBUk0jIwpFVEFUI0RPQyNDTEFSS0UjR1JBQ0UKR0VUSU5BQklORCNUSUVCUkVBS0VSCkdOT01FI1JBWUUjQVNUUk8jQ0VMTApPT1pFRCNBTEVGI1NUT09EI0VSVEU="},{"title":"1/23/06 HOLD TIGHT","author":"by Gail Grabowski, edited by Stanley Newman","date":"2006-01-23","grid":"Tk9UU08jVEFQUyNTVEVXCkFCSE9SI0FCSVQjSEFMTwpHT1VEQSNNRVNBI0FCQlIKU0VNI0NBUFRBSU5IT09LCiMjQkFMU0EjI1JFU09XUwpQT05JRVMjTUVTUyMjIyMKSVJBUyNFUkFTI1RFQ0hTClRBSUwjU0lYUE0jTk9BSApBTExFWSNOSU5FI0FSTE8KIyMjI0FTS1MjVEFDS0xFCkVTQ09SVCMjUEFDVFMjIwpUSFVOREVSQk9MVCNDQlMKSEFUUyNST0FOI09QUkFICkVSSUUjRU5JRCNSRUVTRQpMRU5UI09BVFMjU0FXRUQ="},{"title":"1/24/06 SEE YOU IN COURT","author":"by Sally R. Stein, edited by Stanley Newman","date":"2006-01-24","grid":"UEFXUyNSUE1TI0NSSUVSClJJT1QjQUxPRSNIRURHRQpPRE9SI05FQVQjSURFQUwKREVGRU5EQU5UI1JFQURZCiMjI0VBUiMjTEFQUyMjIwpBREFQVCNBUEVEI0lTQVkKUlJTI1VDTEEjTUFHUElFCk1BVEVSSUFMV0lUTkVTUwpPTUVMRVQjTUlUVCNBTEUKUkFSRSNFQVNUI0FDUkVTCiMjI0dBU1AjI1ZJQSMjIwpQQUdBTiNQTEFJTlRJRkYKQU1FTkQjTE9JTiNUUkVFClBFTkNFI0VERFkjTE9VRApBTlRFUyNTRUFMI0VORFM="},{"title":"1/25/06 FREQUENT FLYERS","author":"by Daniel R. Stark, edited by Stanley Newman","date":"2006-01-25","grid":"QVNJRiNHQVBTI1VSQkFOClNMT0UjT1ZFTiNOT0lTRQpLQVRFI0ZPUkEjUFVOVFMKU1dBTExPV1VQI0lOR09UCiMjIyNPUkVTI0FMREVSUwpBTExPVyNERU5WRVIjIyMKSEVJRkVSI1NBTyNPRElFClNBRkZST04jVElEQklUUwpPTlRPI1NJUiNEUklWRVMKIyMjTkFJTEVEI0FOQU1FClRBTUFMRSNHUkFNIyMjIwpBREVMRSNKQVlXQUxLRVIKUE9MQVIjRUxJQSNFSU5FCkVCRVJUI0RFQ0sjR0xJQgpSRUVLUyNJU0VFI1NPREE="},{"title":"1/26/06 GOING UNDERCOVER","author":"by Doug Peterson, edited by Stanley Newman","date":"2006-01-26","grid":"U1BPUlQjQkVEUyNTTk9XCldBVkVSI0lWQU4jQ09EQQpBREVMRSNTRVJFI1JJSVMKQlVSSUVEVFJFQVNVUkUjClNBRkUjSVJFI0tFTiMjIwojI0lWRUdPVEFTRUNSRVQKQUxMRVkjI1RSSSNIRU1JCk5JTCNFQ08jRU5EI0ZJRQpLTEVFI0FMSSMjQVdBUkQKSElEREVOQUdFTkRBUyMjCiMjI1VOTyNOSUEjU0hBRwojTEFDT05GSURFTlRJQUwKSU9UQSNMQVRFI09ST05PClNMT1QjQVZFUiNURU5EUwpNQVpFI1dFRFMjRUxTRVM="},{"title":"1/27/06 PATERNALISM","author":"by Merle Baker, edited by Stanley Newman","date":"2006-01-27","grid":"TUFXUyNPU01JQyNGQUNUCkVMQUwjREVBTkEjQUNIRQpTVUdBUkRBRERZI1RSRUUKQU1FQkFTI0RSVVRIRVJTClNTUiNaQUcjQVNIRSMjIwojIyNQRVJPVCNFUlJBVEEKT0hOTyNFVVJPI09UVEVSCldFRVBTI0RBTSNCSU5FVApOQVJDTyNBUEVTI01PTVMKU1BPT0ZTI1NOQVJFIyMjCiMjI05BVFMjU1VFI1NQWQpFR0dDUkFURSNSRVNDVUUKR0FMRSNWSVZBSUxQQVBBCk9WRVIjRUxFTkEjQUxBUwpTRU5UI0RFTE9OI05FU1Q="},{"title":"1/28/06 SATURDAY STUMPER","author":"by Anna Stiga, edited by Stanley Newman","date":"2006-01-28","grid":"U01JTEVZRkFDRSNQSVVTCk5PU0lSRUVCT0IjQU5OQQpBTlNFTEFEQU1TI1dISU0KUFJVTkUjI1RJRSNORVRTClRPRVMjV0hJTk5ZI1JJUApPRUQjRE9JTkcjRUxJWkEKIyMjWU9VTkcjTUFTVEVEClBDV09STEQjTEFHQVNTRQpMQVJERUQjQkVORVQjIyMKT05FQU0jTElWRVIjTUdNCkRPUyNJR09USVQjVEFSQQpET1RFI1JVVCMjQUlERVMKSURMWSNFVkVSR0xBREVTCk5MRVIjRVJST1JQUk9ORQpHRVJFI1RFTk9SU0FYRVM="},{"title":"1/29/06 18 DOWN COMPANY: Six answers with more than one thing in common","author":"by Ann W. Masten, edited by Stanley Newman","date":"2006-01-29","grid":"QUxJQVMjU0hBU1RBI1BBUlRXSVRIClJBTlVQI1RJTExFUiNBTUVTSU9XQQpMVUNLQU5EUExVQ0sjTUVNRU5UT1MKRVJFU1RVI0JPR1MjTUVOVSNFQVNUClNBTiMjVFJPVFMjU0FMI1NQQSMjIwojI1RBWCNJTlMjU0FSQUgjSU5DQVMKQU1JQ0FCTEUjU1VNUyNCQU5EQUdFClJFVkVOVUUjU0VSQiNDT01FRElBTgpDQUVTQVIjREVXRkFMTCNJU0lOVE8KT1NTI0RSQUlOI0FFSU9VIyNORUVSCiMjI0hVU1RMRUFOREJVU1RMRSMjIwpBQk9VIyNFTENJRCNFRFNFTCNEQUIKTVVGRkxFI0VBUlRITFkjTkFUSVZFCkFTQUZBVk9SI0ZVUlMjQkVNVVNFRApORUdBVEVEI1RBUlMjREFUQUJBU0UKQURFTlQjRFdBUkYjUlVSI1NBUCMjCiMjI0RFTCNPUkUjRk9ORFUjI1BJRQpDSElQI0FCVVQjQ0xPRyNSRU1FTkQKUkVTVUxUSU4jU0hBS0VBTkRCQUtFCk9JTEZJRUxEI1JBVElPTiNEQVJJTgpQUkVGSVhFUyNBU1NFTlQjQVNTTlM="},{"title":"1/30/06 PUBLISHING 101","author":"by Gail Grabowski, edited by Stanley Newman","date":"2006-01-30","grid":"QUJDUyMjU0lUVVAjUFRTClRSQUNUI0FSVUJBI1JPVApNQU5VQUxMQUJPUiNJREEKI0RFTEhJI05FQSNTTU9HCiMjI1BJTkcjU1RBVEUjIwpTUEFUVEVSIyNTTFVSUFMKVVJOI0lESU9NI0VNQ0VFCkdJTkEjI01OTyMjUE9SRQpBRFVMVCNNRVRBTCNBSU0KUkVBSVJTIyNUUkVTVExFCiMjTEFZRVIjT01OSSMjIwpORVdTI1RVRyNPTlRPUCMKQVZBI0FUTEFTUk9DS0VUClBFRyNBTEVSVCNOT1JTRQpFUkUjSEVSQlMjI01BVEU="},{"title":"1/31/06 KEEP WARM","author":"by Sally R. Stein, edited by Stanley Newman","date":"2006-01-31","grid":"U0hFRCMjQkFBUyNDQUxGClRBTEVTI0FSTE8jVVNFUgpJTkVQVCNLRUVQI0xJTkUKQ09DT0FCRUFDSCNEQVRFCktJVFQjUkRTI0lURSMjIwojIyNTTVUjI01BU1NBR0UKQUZMI0FUU0VBI0VBU0VMCkJMQU5LRVRTVElUQ0hFUwpDQU5PRSNPUEVOUyNFS0UKU1RBTkRVUCMjVEVMIyMjCiMjI1NPTiNTSVIjRUFTRQpET1NFI0NPQVRPRkFSTVMKQU1FTiNPS0xBI0lERUFTClRFTlMjT1JBTCNHRU5SRQpBTlRFI0xBRFkjI1JBVFM="},{"title":"2/01/06 DOMAIN NAMES","author":"by Fred Piscop, edited by Stanley Newman","date":"2006-02-01","grid":"QkFSQlMjT01BUiNXRUFSCkFGT1VMI1dJUkUjSURMRQpMT1dDT1VOVFJZI0xJTUUKRVJFI1BTU1QjTk9ERUFMClNFUkFQRSMjI09SSyMjIwojIyNMRURJTiNMT0lURVIKU1RBSUQjTUlORCNOT0xPCkhJUkUjUEFORVMjR0xBRApBTUVOI0FYRUwjQURETEUKTUVBTkVSI1NMT01PIyMjCiMjI0FORCMjI0RBTUFHRQpHUk9UVE8jQVZJUyNQRUkKTVVOSSNOT01BTlNMQU5ECkFMVE8jRVZJTCNFRVJJRQpORU9OI0RBREUjREVURVI="},{"title":"2/02/06 ON YOUR FEET","author":"by Doug Peterson, edited by Stanley Newman","date":"2006-02-02","grid":"Q0FCSU4jSkVTVCNNQVNICkFMQU1PI1VMTkEjRUxLTwpTVEVQU09OU09NRVRPRVMKSEFaRSNTS0VXI1JBVEVTCiMjI0RBVUIjRUFSTCMjIwpNQVRFUyNPRERTI0xPR08KVVNII0NBTkUjV0FJVEVSClRIRUdPTERFTkFSQ0hFUwpUT01BVE8jUlVOVCNFTk8KU1RFTSNGUkVUI1NBUkFOCiMjI0VUVEUjU0FZUyMjIwpTTE9QRSNaQUhOI1NIRUEKQ09PTEVET05FU0hFRUxTCkFOTkEjSU5UTCNJUklTSApNRUFOI1BFRUwjU1RSQVk="},{"title":"2/03/06 INNER TUBES","author":"by Ann W. Masten, edited by Stanley Newman","date":"2006-02-03","grid":"U0VBTFMjRkFOUyNaRVNUCkFOTklFI0lSQU4jT0xFTwpQT0NLRVRWRVRPI09NQU4KU1dFRVRJRSNIT1JNT05FCiMjI05PVEkjQVBFIyMjIwpTSUJTIyNSQU4jQ1JPV0UKQVRFI1NPT04jREVOTklTCk1FUkNIQU5UVkVTU0VMUwpPTUVMRVQjU0FXUyNBTUEKQVNUSVIjU1lOIyNTTEFZCiMjIyNQUFAjSUFHTyMjIwpQSEFSQU9II1NDQUxQRUwKRVVSTyNMSUdIVFZFUlNFCkdSSU0jS05FRSNFTE9QRQpTTEFQI0FYRUQjTFlOTlM="},{"title":"2/04/06 SATURDAY STUMPER","author":"by Daniel R. Stark, edited by Stanley Newman","date":"2006-02-04","grid":"Q1JZU1RBTCNBUFJJQ09UClJFVU5JVEUjVEhFUkFQWQpFU0NBUEVTI0hPTEVTVVAKU1RBR1MjU0FMVFkjQUxJClRPVFMjUk9ERU8jQUJFUwpFUkEjQlVORFQjU0NBTlQKREVOSUFMUyNFR09JU1RTCiMjI0RZRSMjI1JPTiMjIwpSQVBJRVJTI09VVEdSRVcKRVJST1IjUEVOTlkjQU5BCkdSSU0jQ09NRVQjTUlDSwpSSU0jTUlOVVMjTEFETEUKRVZBRElORyNFTEFUSU9OClNBUkFMRUUjTElDRU5TRQpTTFlORVNTI0ZMRURHRUQ="},{"title":"2/05/06 THE HOLE THING: Or, things with holes","author":"by Merle Baker, edited by Stanley Newman","date":"2006-02-05","grid":"QkFMU0FNUyNTQUxBQU0jRUdHU09OCk9OQVRSSVAjRUxBUFNFI0xPT0tVUApQRVRST0xFVU1GSUVMRCNNT0xBUlMKU1RFQU0jRU5JQUMjI0lTT0ZGIyMjCiMjI1BBVENIIyNBTkFDRSNTQ09XUwpTTEEjI1dISUZGTEVCQUxMI09CRVkKTElUQ0hJI1BMTyNBQkxFUiNVTEFOCkFUVEFJTlMjQVJFVEUjU09QUkFOTwpCUkFTU0tOVUNLTEVTIyNORVNURUQKU0VSRSNMQU5LI0VTU0FZI0xFRURTCiMjIyNURVJJI1BDVCNCVUZGIyMjIwpDQU1QWSNFWEVSVCNKRUxMI0FSQUwKQU1PVU5UIyNMT09TRUxFQUZQQUdFCkJVUk5FUlMjT1RSQVMjU1RBUlRJTgpBTEVDI0VFUklFI1NTVCNCQVNFTFkKTEVBSCNTV0lTU0NIRUVTRSMjU0VBClNUVUJTI09ERVRPIyNMQURMRSMjIwojIyNPV0lORyMjRFdFTEwjT0FTSVMKVU5QQUlEI1dJTkRJTlNUUlVNRU5UClRIT1JQRSNBUE9MTE8jRVNTRU5DRQpFTElERVMjWU9ERUxTI0RBWVNUQVI="},{"title":"2/06/06 AT THE AIRPORT","author":"by Gail Grabowski, edited by Stanley Newman","date":"2006-02-06","grid":"UkFQUyNMT0ZUUyNUQVJQCkFCRVQjQUxMT1QjT1JFTwpOT1JBI05FQVRPI1BFRUwKSVZPUllUT1dFUiNGQUtFClNFVFRFRSMjTUVXTCMjIwojIyMjQVJNUyNTSElSVCMKQVZPVyNOSUxFI0FHQUlOClJFU09EI0NBUiNUSFJFRQpUQUhPRSNFUElDI1RFU1QKI0xBRExFI1NFQU0jIyMjCiMjI1BMQU4jI1JFQURVUApTRUFMI0dPTERFTkdBVEUKQVVSQSNMT1VJRSNSSVRBCklSQU4jRU5URVIjRUxFQwpMT0JFI1NFRURTI0VZUkU="},{"title":"2/07/06 IT'S OK","author":"by Sally R. Stein, edited by Stanley Newman","date":"2006-02-07","grid":"TE9HUyNTV0FQUyNCTEVECkFCRVQjSEFMTEUjRUFTRQpNRVRBI0FETUFOI01WUFMKQllBTExNRUFOUyNZQU5LCiNTVEVFUiMjQkVSRyMjIwojIyMjR09MRCNTQVVDRVMKQ0hJQyNDT09QI1dFQVZFCkxBVEUjS0FaT08jU0tFVwpBTEFSTSNGRUVEI1RFTlMKREVMVEFTI1NUT1AjIyMjCiMjI0FQRVMjI01FUkdFIwpaSVRJI1NVUkVFTk9VR0gKT1BFTiNBRFVMVCNEQVJFCk5PRUwjTUFTU0UjRVZFUgpFRERZI0VOVEVSI09BVFM="},{"title":"2/08/06 DOUBLE ECHOES","author":"by Robert H. Wolfe, edited by Stanley Newman","date":"2006-02-08","grid":"QkFSQiNDRURFI1NLQVRFCkFSRUEjSEFSRSNUSUxFRApTS0lEI09SQUwjRU5ERUQKU0lOR1NPTkcjQklHQU1ZCk9OU0VUUyMjRlVOSyMjIwojIyNSRUVOVEVSI09LUkEKQVRBI1BST0FNI1NORUVSCkNPTkRPI0lNQSNFR1lQVApSQU5JTiNTRUxNQSNTT1kKRURFTiNSRVJFQURTIyMjCiMjI0dSQVMjI0dPQUxJRQpDQU5ESUQjUElOR1BPTkcKQUxPT0YjQVVSQSNQTFVHClNUVU5UI1NQQVQjRUxTRQpUT05HUyNQQU5FI0RZRUQ="},{"title":"2/09/06 APPLE CORPS","author":"by Patrick Jordan, edited by Stanley Newman","date":"2006-02-09","grid":"QVBBQ0UjSElUVVAjRkVEClJFTEFYI0FST01BI0VSQQpGUklUVEVSQVdBWSNST1oKIyMjU0VWRU5TI1NIQURFCkNCUyNSRU0jI0ZVRUxFRApSRVBBSVIjSEFSUFkjIyMKQUxBTU8jREFMRSNKQUtFCkNJREVSSE9VU0VSVUxFUwpLRUVOI09TTE8jSURJT1QKIyMjSVNMRVMjSUNFQUdFClNQT1RUWSMjSEJPI1NIRQpLRU5ZQSNTUEVFQ0gjIyMKQVRFI1BJRUlOVEhFU0tZClRBUCNMT05FUiNFUk5JRQpFTE0jRU5UUlkjVE9PVFM="},{"title":"2/10/06 POLITE COMPANY","author":"by Doug Peterson, edited by Stanley Newman","date":"2006-02-10","grid":"VU5QRUcjT1JERVIjQ09UClNBTFNBI1BBVUxPI0FSRQpFVElRVUVUVEVJUyNTSVgKREVFI0dBSSNUU0VMSU9UCiMjI1RVUk5TIyNUT09OUwpLTk9XSU5HSE9XVE8jIyMKQUFST04jI0FMSEFNQlJBClJURSMjS0lERE8jI09BRgpUT09ETEVPTyMjVE9OR0EKIyMjWUFXTldJVEhZT1VSCkNJR0FSIyNTTkFSTCMjIwpTUElOQUNII0NMSSNPSk8KUE9MI01PVVRIQ0xPU0VECkFERCNJTk5JRSNMQVNFRApOU0EjRVNURVMjU1RBUlM="},{"title":"2/11/06 SATURDAY STUMPER","author":"by Daniel R. Stark, edited by Stanley Newman","date":"2006-02-11","grid":"VklTQ09VUyNMVU5DSEVECkVOVEhVU0UjSVRFUkFURQpTSE9VVEVSI0ZFREVSQUwKUEVSTVMjVkVUI1NFREdFCkVSQVMjUklWRVQjRElFVApSSUcjU0VDRURFRCNFUkUKU1RFRVBMRVMjUk9BUkVECiMjI0xFQUQjVVJOUyMjIwpMQVJJQVQjU1BBTklBUkQKT1JBI1JFUExJQ0EjREVFCkFNVFMjRFJPTkUjTUVHQQpET1JJUyNBR0EjUEFMRVIKSVJBVEVMWSNST1VUSU5FCk5FQ0tUSUUjTU9NRU5UUwpHUkVBU0VEI1NQQVJFU1Q="},{"title":"2/12/06 PASTA SALAD: The Italian meaning of pasta names","author":"by Fred Piscop, edited by Stanley Newman","date":"2006-02-12","grid":"Q0FCTEUjI0FQVCNUSEVXQiNORVRTCkFWQUlMI1BJRVIjQUlNRVIjSVdPTgpWRVJNSUNFTExJI0ZFVFRVQ0NJTkUKQVJUSVNBTiNMT0FGUyNTVFJBTkdFCiMjI1RFTkQjRUREWSMjIyNFREdBUgpVTUEjI0RBUlRFRCNUSU1JRCMjIyMKUklHQVRPTkkjIyNNQU5JQ09UVEkjCkFNSVRZI1RJREUjU1VEU1kjSEFORwpMSU5JTkcjU0VMQVNTSUUjI0FQRVIKIyMjVEVBTCNGSVIjI0dSUiNXRVJFCkJFVCMjTU9TVEFDQ0lPTEkjI1NUWQpMVVJFI1NBUCMjRUVSI1lPS0UjIyMKT1JBTCMjVFJBUERPT1IjVE9TU0VECkJPTUIjU0hJTkUjU05PQiNOQVRUWQojU1BBR0hFVFRJIyMjTElOR1VJTkUKIyMjI1JPU0VTI0FMTEVHRSMjUkFECkFDSE9PIyMjI1RIQUkjQlJPUyMjIwpTTFVSUEVFI0JSQUlOI0FWSUFUT1IKVE9SVEVMTElOSSNDQU5ORUxMT05JClJVU0gjU0FEQVQjQUdPRyNFVklDVApPVFRPI0VMU0lFI0xFRyMjUkVMRUU="},{"title":"2/13/06 BODY LANGUAGE","author":"by Gail Grabowski, edited by Stanley Newman","date":"2006-02-13","grid":"Uk9QRSMjUkFNI1BBU1RBCkFDSUQjV0FHRSNBU0hFTgpMQVRFI0FOT04jUEFJTlQKUExBTkVGSUdVUkUjUFRTCkhBU1NMRSMjI09SQlMjIwojIyMjQVJPTUFTI1VIT0gKU0NPT1QjTkFHUyNUQVJBCkhPUlNFI0VSQSNTVFBBVApBTERBI0RBSVMjSEVFTFMKV0VFSyNFTEFQU0UjIyMjCiMjUkFUUyMjI0VBR0xFUwpPQUYjV0lORE9XRlJBTUUKUFJPVkUjQUlERSNBQkJBCkVFUklFI1BBSUQjUE9FTQpOQU1FRCNBTEUjI0VSUlM="},{"title":"2/14/06 CAPITAL B","author":"by Sally R. Stein, edited by Stanley Newman","date":"2006-02-14","grid":"SE9QSSNNQVNII0VCQlMjCk9WRU4jT1JFTyNMVU5BUgpCQU5HS09LVEhBSUxBTkQKT0xERU4jI1NVTSNMSUVTCiMjI1NPTE8jTUlGRiMjIwpTT0ZUV0FSRSNTT1JURUQKQUdPIyNOQVNBI0FPUlRBCkJSVVNTRUxTQkVMR0lVTQpSRU5FRSNTRUVQIyNBREUKRVNURUVNI1NURUVQTEVTCiMjI1NLSVAjU0VBTCMjIwpBVElUI0xBUyMjUlVMRVIKQlVEQVBFU1RIVU5HQVJZClNOT1JFI1RFQVMjVUNMQQojQVNTVCNBTU1PI1BFRU4="},{"title":"2/15/06 GO THE DISTANCE","author":"by Fred Piscop, edited by Stanley Newman","date":"2006-02-15","grid":"TUFEQVQjR0lMTCNBQkJBCkFQQUNFI09SRU8jR1VMUApURU5ERVJGT09UI0FTRUEKVFJBQ1RJT04jVEVUSEVSCiMjIyNIQVIjIyNWRUxEVApNT1NURUwjQ0hFRVNFIyMKQVJDRUQjVEhPUk4jQUlSCkNBSE4jWkFJUkUjT0dMRQpTTE8jQU9SVEEjQ0FVU0UKIyNPQlNFU1MjVEhSRUFECkFSTEVTIyMjU0hBIyMjIwpNQVlBTlMjU1BBUlNFU1QKSVZBTiNXQVRFUk1FVEVSCk5FUkkjRVZJTCNFTU9URQpPTERFI0VBUkwjUklOU0U="},{"title":"2/16/06 JAM SESSION","author":"by Doug Peterson, edited by Stanley Newman","date":"2006-02-16","grid":"QVJDRUQjU1RBVCNHRU1TCkxPVVBFI0FSVFkjT1ZBTApPVVRPTkFMSU1CI0xFR08KRVhFQyNURU4jQU5EUkVXCiMjI0hNTyNLQUxFTCMjIwpMQVMjVU5ERVJUSEVHVU4KQUNFI1NDT1RUIyNBVVJBClNUSUNLRVIjSE9PRlNJVApTSVpFIyNTQ1VEUyNUQVQKT1ZFUkFCQVJSRUwjU0hZCiMjI0JJTExZI1RPTSMjIwpCT0xFUk8jU09UI09OVE8KQVZFUiNVUFRIRUNSRUVLCk1FTlUjU0lBTSNCQUhBSQpBTlRTI0VFTFkjU0xJTUU="},{"title":"2/17/06 LOTS WILL BE LOST","author":"by Donna Levin, edited by Stanley Newman","date":"2006-02-17","grid":"UkVNSVQjI0NQT1MjU0VXCkFMQU5BI0FPUlRBI0NBWQpLSVNTTVlHUklTVCNVU0EKRUFTVCNFTkRTIyNBQkVUCiMjTUlOTkVTT1RBRkFTVApJQ0VMRVNTI05PTUUjIyMKTEFETEUjI01FR0FXQVRUClNSSSMjQlVSUk8jI0xPTwpBQkFORE9OUyMjVVBCT1cKIyMjT0lOSyNBRVJJQUxTCkhFREdFT05FU0JFU1QjIwpPUkVPIyNPVVRBI1RSSU0KSEFUI0NPV0JPWUJPT1NUClVTRSNSVU5JTiNPTFNFTgpNRVIjT0lTRSMjQVNTRVM="},{"title":"2/18/06 SATURDAY STUMPER","author":"by Merle Baker, edited by Stanley Newman","date":"2006-02-18","grid":"TUlTU09VUklBTiNDQVNBCkVOVEVSU0lOVE8jVU1QUwpDSEFMTEVOR0VSI1JCSVMKQ0FMVkUjR1JBTkREVUtFCkFMSUUjQ0xFTSNFTExFUwpTRU5TRUxFU1MjUEVBTFMKIyMjI1JVVFMjQk9STkVPCk1BTE9ORVMjUFVOU1RFUgpBQklERUQjQ09MRSMjIyMKTE9CT1MjVE9PS1NURVBTCkFWRVJUI0FMTFkjQUFSRQpZRUxMT1dTRUEjQVVSQUUKU0FMRSNBVFRSQUNUSU5HCklMRVMjREVURVJSRU5DRQpBTEVTI0lERUFNT05HRVI="},{"title":"2/19/06 EXTRA CHARGE: With appropriately altered endings","author":"by Patrick Jordan, edited by Stanley Newman","date":"2006-02-19","grid":"I1BST01TI0RFQkFURSMjI0ZBVk9SCkNSRURJVCNPTkFEQVJFI1NJTUlMRQpIT05EQUFDQ09SRElPTiNBUklTRU4KQU5URSNST1NTIyNQT0UjVkVOSSMjCklURVJBVEUjI0NVRSMjRElBVE9NUwpST0QjSlVOSU9STUlTU0lPTiNOT1QKIyMjQ0FQI1NOSVAjQVBBUlQjUVVFCkFUV0FSI0FMTVMjRUxBTCMjRlVTRQpCRUVUI0ZSRUVQT1JUSU9OI1JFRUQKRVJFI0FMSVQjI0FNRU4jWUVBUyMjCkxJS0VORUQjU1RSQUQjRkxBVFRPUAojI0VER0UjQUNSRSMjU0xPVCNJSUkKU0FORCNUQVhBVURJVElPTiNKT05HClRJRFkjI0RJTUUjSE9NRSNaT05LUwpFU1AjQ0hFQVAjTU9OTyNUQUIjIyMKQUxBI1JPTExJTkdQSU5JT04jSE9UCk1FU1NJTkEjI09SRSMjQU5ZTU9SRQojI1NVTksjQ09OIyNBUk1TI0VMSUUKVFJJQUdFI0JVRkZBTE9CSUxMSU9OCkhPT1ZFUiNTVEFSRE9NI0xBQkVMUwpPV05FRCMjI1NUT09HRSNTUEFSRSM="},{"title":"2/20/06 PRESIDENTS' DAY","author":"by Sally R. Stein, edited by Stanley Newman","date":"2006-02-20","grid":"TUFSUyNGSUdTI1NUQVNICk9CT0UjSU5JVCNUQUJPTwpNSUxMQVJERklMTE1PUkUKU1RFRUwjRVRSRSNFVkVSCiMjI0NPQVgjI0FJREUjIwpNQVNURUQjVkNSUyNJVkUKQUNUSSNERUFMI0VBVEVOCkdST1ZFUkNMRVZFTEFORApNSVJFRCNISUZJI0JMVUUKQURFI0lQT0QjU0VBTEVECiMjUlVUSCMjTkFSQyMjIwpJV09OI0lBR08jTE9BRFMKVEhPTUFTSkVGRkVSU09OCkNPTUVSI0FSRUEjRVNTTwpIQVNURSNSRUVEI1NURVc="},{"title":"2/21/06 WRAPAROUNDS","author":"by Gail Grabowski, edited by Stanley Newman","date":"2006-02-21","grid":"T01BUiNMT0NBTCNTQ0FNCkRBTEUjUFJPU0UjQ09MQQpPTkVNQU5CQU5EI1JURVMKUkVTSVQjU1RFVCNFVENICiMjI1NPQiMjUk9ERU8jIwpORVdTTUVOIyMjSU5ORVIKQUxJIyNURU1QTEUjQkVFClJJTiNTVEFSTElUI0VSRQpDT0QjUEVSU09OIyNMSUQKU1RPTkUjIyNQRVRJVEVTCiMjV0VER0UjI1JFQyMjIwpQRVNUI0FMUFMjUkVBU0sKTEVBUCNCTFVFUklCQk9OCkVMU0EjTElCUkEjQUxPRQpBU0hZI0VTU0FZI0dFTkU="},{"title":"2/22/06 DISAPPEARING ACT","author":"by Norma Steinberg, edited by Stanley Newman","date":"2006-02-22","grid":"V0FDTyMjQUxFQyNQTE9ECklET1MjQlJBVkUjTE9HRQpOT1dIRVJFTUFOI0lTTEUKQ1JFQVRFI0FOVEVBVEVSCkhFUiNUV09TI0FSTk8jIwojIyNQRUVOI05VUlRVUkUKU1dBUCNERVNJUkUjVEFECkhPV1NPI0RVTiNEUk9JRApPUkEjU0hBVkVEI0lORFkKT0RZU1NFWSNUQUNPIyMjCiMjR0FJTCNHWVJPI1BBUwpJU0FCRUxMQSNXUkVBVEgKREFNRSNNSVNTSU5HWU9VCk9WRVIjQVNQRU4jR0VOVApMRVNTI05BU0EjI1NFRVM="},{"title":"2/23/06 VOWEL SHIFT","author":"by Fred Piscop, edited by Stanley Newman","date":"2006-02-23","grid":"U1BSSUcjQlNNVCMjRU1TCkFMRU5FI0VUQUlMI01BRQpIQVZFTiNCQUxMUE9JTlQKSVRPIyNET00jI1NQUkFUCkJFTExQRVBQRVIjU0FHRQpTQVRJUkUjI0xFQSNURUUKI1VTTUEjI01JU0RFRUQjCiMjI0JJTExHQVRFUyMjIwojTEFTU09FUyMjU1RPVyMKVEFQI0VFTiMjU1RFUkVPCkFET1MjQk9MTFdFRVZJTApCT0xUUyMjQUlNIyNJUkUKQlVMTE1PT1NFI0dPTERBCkVDTyNVTkxFVCNJRExFUgpERVMjI1RBUk8jTEVFUlk="},{"title":"2/24/06 NO MONKEYING AROUND","author":"by Merle Baker, edited by Stanley Newman","date":"2006-02-24","grid":"VFJPRCNTQ1JBTVMjU1VNCllPREEjQVJBRkFUI1RaVQpQUklNQVRPTE9HWSNBQlMKRVlFT1BFTkVSI01DR0VFCiMjI1VQU1kjI0tJT1NLUwpOQUNSRSMjSVNMRVMjIyMKRVhPI0FQT0dFRSNNVURECkJFTEFMVUdPU0lNT1ZJRQpTTEFUI01PUkVOTyNFVEMKIyMjRUdBRFMjI1BMQVpBClBBR0FOUyMjQVBJQSMjIwpFUkFUTyNPVVRBTkRPVVQKVE9XI01JU1NJTkdMSU5LClRTSyNFQVNFTFMjRVNUTwpZRVMjU01BUlRZI1JFT1M="},{"title":"2/25/06 SATURDAY STUMPER","author":"by Daniel R. Stark, edited by Stanley Newman","date":"2006-02-25","grid":"VkVURVJBTiNTTElQUEVSCkFWQVJJQ0UjSEVST0lORQpTQUxVVEVTI0VHT0lTVFMKU0NPUEUjVFdBSU4jVElQCkFVTlQjQUxFUlQjRk9DSQpMRUUjQU1JU1MjTUFORVQKU0VESU1FTlQjTU9VU1NFCiMjI1JBTkcjUElMTCMjIwpBQ0NFU1MjUEFSVFRJTUUKUk9BTlMjQ09ORVMjVEVNClJVQkUjVE9ST1MjUEFMRQpBR0EjUE9XRVIjU09MQVIKTkFSUkFURSNBUklTSU5HCkdSRUFURVIjTUlMRUFHRQpFU1RFRU1TI0FET1JORUQ="},{"title":"2/26/06 BROWNSVILLE: Various shades of meaning","author":"by Gail Grabowski, edited by Stanley Newman","date":"2006-02-26","grid":"UkVOVEVEI1RPTEVETyMjQ09TVEFSCklDRUFHRSNPUklTT04jQ0FQVElWRQpDSE9DT0xBVEVNQUxUI0RSRUFNRUQKSE9OSyMjSEVTT1VUI1NDQU5ORVIjCiMjI1NDUkFNIyMjU1RFQU1FRCMjIwpBTkdPUkEjI1BBUiNFQVNFRCNDT1QKSk9JTkVSI0lPVEEjUkVFTCNCT0xPCkFOTiNXQUxOVVRUUkVFI1NVUkZFUgpST0dVRSNPQVRZI0VTTCNBUkFGQVQKIyNFTkRSVU5TI0JBQSNTVU4jRVJFClNBUkkjVVRFI09BUiNUTEMjS0VZUwpBUkIjRVNTI1BPVCNBV0VFQklUIyMKVkVSU0VTI1BBUCNPRElFI1VOQVBUCk9ORU9ORSNSVVNUQlVDS0VUI0JPTwpST0FOI1RSSVAjUk9MRSNTVEVMTU8KWVREI1NQVU1FI1lFVCMjU09SRVNUCiMjI0NPT0xFUlMjIyNUQk9ORSMjIwojTEFFUlRFUyNNQUlUQUkjI0NQQVMKUk9MTEJBUiNDSU5OQU1PTlNUSUNLCkFSTUxFVFMjQVRUSVJFI09IRU5SWQpERVNPVE8jI1BFU1RPUyNXRURHRVM="},{"title":"2/27/06 BE QUICK","author":"by Gail Grabowski, edited by Stanley Newman","date":"2006-02-27","grid":"UlVTVCNSQURBUiNTRUVSCkFOVEkjRUxVREUjSEFMTwpTVEFHI1RBTExTI0FSSUQKSElHSFRBSUxJVCNLTkVFCiNMRVRVUCMjQklURSMjIwojIyMjQkVMTCNST0FNRUQKVEFORyNERUFMI0FMQU1PCkFMT09GI0FETyNERU5JTQpQT1NTRSNTTE9XI0dFUkUKU1RFV0VEI0VQRUUjIyMjCiMjI0lURU0jI0FSRVNPIwpXT0xGI01BS0VUUkFDS1MKQUxJVCNVUklBSCNTQVJBClJFRUwjUklOU0UjRVJBUwpQT1NZI0VBR0VSI0xFU1M="},{"title":"2/28/06 CHOPHOUSE","author":"by Norma Steinberg, edited by Stanley Newman","date":"2006-02-28","grid":"U0FNRSNXQUlTVCNTS0lNCkFMSUUjQUxUQVIjUElMRQpHRU5FI0xFT05BI09XTFMKQVJDI1BSVU5FREFOSVNIClNURVBPVVQjI0VORyMjIwojI1dJTlMjUFJPVEVDVFMKU1RPTlkjV09PRlMjUklQCkhJUkUjU0hFTEYjU09NRQpPREQjU1RBVEUjQ09QRUQKREVTU0VSVFMjVE9MRCMjCiMjI1BFQSMjVEhST1VHSApDVVRBTkREUklFRCNTRUEKQVBFRCNEUkFHUyNBVFROCkdPTkUjTEVWRUUjTEVBRApFTkRTI0VXRVJTI0FSVFM="},{"title":"3/01/06 AT THE SALON","author":"by Daniel R. Stark, edited by Stanley Newman","date":"2006-03-01","grid":"QkFTSCNVUk5TI1JBRlRTCk9OVE8jVE9VVCNPUFJBSApTTk9XI0VUTkEjTU9PUkUKQ1VSTE9ORVNMSVAjU1BBClNMRUVUUyMjRVJFQ1QjIwojIyNSSElORSNBRE9CRVMKQUJDI0VMRVZFTiNMSU1BCkJMVUVSI0FJUiNTQVRJTgpFQVRTI1NQTElOVCNFUkUKU0hBU1RBI1NDT1JOIyMjCiMjTkVIUlUjI1RBSUNISQpDQUQjUklOU0VDWUNMRVMKQVNUUk8jQ09TSCNIVU5TClBFUk9OI0xVVEUjRUNSVQpQQVlFRSNFUkFTI1NLWUU="},{"title":"3/02/06 SPLIT PEA","author":"by Fred Piscop, edited by Stanley Newman","date":"2006-03-02","grid":"U05JUEUjRkFJTCNQT1NUClRPTkVEI1JJQ0UjVVBUTwpQSUNOSUNBUkVBI1RFQVIKQVNBI0ZBVEUjVEhPUk5ZClRFTlBJTlMjVEhPVSMjIwojIyNFQ1QjUFJFVFRJRVIKU0hJUkUjUEFBUiNUT1JFCkhPU0UjVEFXTlkjT05JTgpVUk5TI0FDRVMjQVNTRVQKVEFUVEVSRUQjUElFIyMjCiMjI1JBUFMjVEFNQUxFUwpBTkdPUkEjVVJJUyNJTlQKVEVSSSNQRVRFUkZPTkRBCklNT0sjRVBFRSNPTERFUgpUT0dBI1JJUFMjUkVBRFM="},{"title":"3/03/06 WIFE'S TALE","author":"by Doug Peterson, edited by Stanley Newman","date":"2006-03-03","grid":"TkFJTFMjUFJJU00jV0FECk9QUkFII0hBUlRFI0hJRQpIVVNCQU5EU0FSRSNJUlYKIyMjRVJPUyMjSVRVUkJJCkdBU0xJVCNQSUMjU0xBVApMSUtFRklSRVNUSEVZR08KSURFRCNPT1pFI09SQiMjCkJFTCNBTlQjVVJOI0lMTAojI0VMTCNJU0xFI09SRU8KT1VUSUZVTkFUVEVOREVECk9OT1IjTklYI0lORVNTRQpNRU5BQ0UjI1NOSVAjIyMKUEFLI1pTQVpTQUdBQk9SCkFTRSNBQ1RPUiNNSUxORQpIRVkjUk9MT1MjQVJUU1k="},{"title":"3/04/06 SATURDAY STUMPER","author":"by Anna Stiga, edited by Stanley Newman","date":"2006-03-04","grid":"V0hBVFRIRSNTVFJBRkVSCkhPTUVSVU4jVEVBUk9TRQpBVEFORU5EI0VYUEVSVFMKQ0FORFkjRURJVCNTS0lUCktJRFMjTUFJTlNUI0VWRQpTUkEjRUFWRVMjQlJFQUQKIyMjQVNDT1QjR09VUFRPCkNMVUJDQVIjRElORVNFTgpZRUxMT1cjU0laRVMjIyMKTEFURVIjU0VBTVMjVFZTCklORSNUVVBFTE8jQlJJVApOT1JNI1NBTUUjQ0xFQVIKRE5JRVBFUiNDT0xVTUJPCkVNT1RFUlMjVFdPRk9MRApSRVJBSVNFI1NFVEZSRUU="},{"title":"3/05/06 LOSING IT: Giving the remaining words a whole new meaning","author":"by Merle Baker, edited by Stanley Newman","date":"2006-03-05","grid":"UEVSVEgjQVNJQSNFQVNFUiNDT01CCkFRQUJBI0NPUkQjUExBTkUjQVZFUgpTVVBBTkRUQUtFTk9USUNFI0xJUkUKVElTI0RFU0sjI0VOT0wjTEFJTklFCkVOVEFJTCMjU1BBWVMjSEVJRkVUWgpMRUFSTkVSU1BFUk0jTEFDUk9TU0UKU1NSUyNUQVBJTlMjV0FJVEVSIyMjCiMjIyNURU5BTlQjQVVOVCNTTkFQUwpTSEFWRSNHUkVBVEJSQUlOI0lMSUEKSEFSQU5HVUUjI0hFU1MjQUJBVEVTCk9VVExFQVAjU1RBRFQjQUJVU0VSUwpBTElTVFMjQUNBUiMjUkVTT1VSQ0UKTEVTVCNISUdIU1BJUkVEI1lFU0VTClNSVEFTI1BFV1MjQ09QSUVTIyMjIwojIyNUSVJBTkEjTkFQQUxNI1JBTkkKRlVNSUdBTlQjTElNRURFRElUSU9OCkFOT1NNSUEjVElNRVIjI0FMRVJUUwpCUlVUQUwjTk9WTyMjTkFTTCNNT0kKTElMSSNTTU9LRVlBTkRUSEVCQU5ECkVQSUMjQVJNRVIjQkVBTSNTTElDRQpERU5TI1RFRU5ZI1NBS1MjVFlMRVI="},{"title":"3/06/06 MARCHING ALONG","author":"by Sally R. Stein, edited by Stanley Newman","date":"2006-03-06","grid":"QU1NTyNPT1pFI0FCTEVSClBBSU4jVU5JVCNQUklERQpBVU5UI1RFTlQjUE9TRUQKUklHSFRGQUNFI0xPQU5TCiMjI0VESVQjI09BSyMjIwpBTUlEU1QjQUNMVSNBR1QKQ09NTyMjU0NBRFMjTEFZCkhVUFRXT1RIUkVFRk9VUgpFTkUjRUxJT1QjI09ITk8KU1RMI0FFUk8jQ0FSQVRTCiMjI1BSTyMjU09SVCMjIwpMQVVSQSNUT1RIRVJFQVIKQVJST1cjT1JFTyNFTExBCldJTE1BI1BBTlMjU0xPUApTQVNTWSNTTE9UI1NFRVM="},{"title":"3/07/06 WASHDAY WOES","author":"by Gail Grabowski, edited by Stanley Newman","date":"2006-03-07","grid":"TEFNUyNTQUxUIyNNQVJUCkVSSUUjQVNFQSNMQVNFUgpBT05FI1RBTlMjQVJJU0UKU01VREdFUE9UI1NLQVRFCkhBU1NMRSMjRUFTVCMjIwojIyMjRU5EUyNQT1dERVIKRVJPREUjUkFURSNBVURJCk1BWEkjU0FMQUQjSU5OUwpFVkVSI0FXT0wjU05FQUsKUkVOVEFMI05DQUEjIyMjCiMjI0NMRU8jI0xJTEFDUwpMSVRIRSNTUE9UTElHSFQKVVNIRVIjQ1VCRSNBUklBCkNMRUFUI0FNRVIjUkVMWQpLRUVQIyNSQVlTI1NFRVM="},{"title":"3/08/06 DOGGING IT","author":"by Fred Piscop, edited by Stanley Newman","date":"2006-03-08","grid":"UE9MUyNTQVBTI09GVEVOCkFUSVQjT1JFTyNCTEFERQpTVEFZVFVORUQjUklOR1MKVE9NI0FUT1AjVElDS0VUCiMjI0FCRSMjI0VFSyMjIwpCRUdGT1JHSVZFTkVTUyMKQkxVVE8jT01FTiNSQVBTClFWQyMjQVBFUlkjI1RFQQpTRUNTI0dSQU4jU1dJTkcKI1NJVE9OT05FU0hBTkRTCiMjI0FSRSMjI1BBWSMjIwpTQ0FSRVMjQ0xPRCNFR08KSE9WRUwjU0hBS0VBTEVHCk9ET1JTI1JPVkUjTElBUgpURU5TRSNTUEFOI1BBUkU="},{"title":"3/09/06 SPOOKED","author":"by Doug Peterson, edited by Stanley Newman","date":"2006-03-09","grid":"R1JBWSNIQVpFI1BTQUxNClJVTEUjVVNFUiNBTENPQQpFVFRBI01JVEUjUlVERFkKR0hPU1RPRkFDSEFOQ0UjCiMjI1RBUiNTVEFMSyMjIwpQSlMjSklGI09ZTCNKVVQKT0FUUyNTQUFSI0VCT05ZClNQSVJJVE9GU1RMT1VJUwpTQUxPTiNTVEVTI0FTVE8KRU5UI1NBQyNUVUcjVEVOCiMjI0hJR0hTI05PTSMjIwojU0hBRE9XT0ZBRE9VQlQKUVVJUkUjQURBTSNTQ0FSCkJJS0VSI1JPTkkjRUxMRQpTVEVNUyNaSUdTI1lBTEU="},{"title":"3/10/06 TAKE A GOOD LOOK","author":"by Merle Baker, edited by Stanley Newman","date":"2006-03-10","grid":"UkVCQSNXSUxMUyNTV0FNCkFMT1UjQU5JU0UjSElSRQpTT1JUI1NURUFNI0VESVQKSElHSEZBTFVUSU4jRVNFCiMjI09MRCMjU1RBQkJFRApJTkZSQVJFRCNFUk9PIyMKTE9BI1RBTFVTI1lPREVMClNFUkIjR0xBSVIjTklDRQpBU0ZPUiNBTExPVCNFUkEKIyNFUklDI1NUT1JFRFVQCklOVEVBUlMjI01JUiMjIwpUQUMjTE9XUFJJT1JJVFkKU09ITyNXSUxFRSNBTUlFCk9NRU4jRVBFRVMjVEFSQQpLSURTI0RFQUxUI0FYRVM="},{"title":"3/11/06 SATURDAY STUMPER","author":"by Daniel R. Stark, edited by Stanley Newman","date":"2006-03-11","grid":"UEVUVU5JQSNDT1VHSEVECklST05PUkUjVU5MT09TRQpDUlVJU0VSI0NBTkFTVEEKQ0FSVEUjQVNLI0FMVEFSCk9USVMjU1RPT0QjU0lURQpMSVMjT01JTk9VUyNMRVMKT0NUQUdPTlMjUkFXRVNUCiMjI1NMT0cjUEFSRSMjIwpDQUNIRVQjT1JCSVRFUlMKQU5BI1NIRUtFTFMjREVFClRJUFMjU0xBVEUjQ1VMTApFTUlUUyNBWUUjRk9DQUwKUkFUQVRBVCNOQVJSQVRFCkVUQUdFUkUjU1dFQVRFUgpERUxFVEVEI0VORExFU1M="},{"title":"3/12/06 FAMILIAR FOURSOMES: With a certain repetition","author":"by Frances Burton, edited by Stanley Newman","date":"2006-03-12","grid":"UEFTI1NJQiNBRkxBVCNGREEjTU9BCkFMVCNBREEjUkFJTUkjUkFOREFMTApQSUUjTU9OS0VZU0VFTU9OS0VZRE8KQUNBUFVMQ08jI1RSSVRUI0FCQVNFCkxFTVVSI09OVVMjSU5TSE9SVCMjIwojI0JSQVMjI1NBTkcjIyNXQVNIRUQKVE9PTElUVExFVE9PTEFURSMjT0FSCkFMQVMjUkVBREVSI0lDRUQjU09TTwpMRVQjUEVUSVQjI0hFUkEjRVRIRUwKQ09TU0VUI0NPTUVPTkVDT01FQUxMCiMjI1RBVEEjI0VMTCMjSFVNRSMjIwpFQVNZQ09NRUVBU1lHTyNUQVJSRUQKQUdJTEUjSVNOVCMjTE9OR1MjQUdPClRBVEUjRUdBRCNCTEFaRVIjU0NPVApFUEkjI1lPVVNOT09aRVlPVUxPU0UKUkVORUdFIyMjT0dSRSMjV1JFTiMjCiMjI0xBUlJVUFMjRFJBQiNCRVRBUwpTSEVMRiNBR0lUQSMjUEFSQUtFRVQKTElLRUZBVEhFUkxJS0VTT04jVVNBCkVMR1JFQ08jVElBUkEjU1VFI1JPQwpXVFMjU1ROI0FMSUVOI09FUiNTUFk="},{"title":"3/13/06 WATER CARRIERS","author":"by Gail Grabowski, edited by Stanley Newman","date":"2006-03-13","grid":"U0lURSNNT09TRSNFR0dTCldPT0wjQU5JVEEjTFVMVQpBVE9NI1RJTEVSI0lURU0KUEFOVFlIT1NFI1ZPVEVTCiMjI1JVSU4jUExBVEUjIwpMQUJFTFMjI0xFUyNSTVMKQUdSRUUjI0dFTkUjQkFICkNJQSMjQU1BU1MjI0FQRQpFTEkjSVJJUyMjSEFMTEUKREVOI1NJUyMjUEVMTEVUCiMjREVFRFMjU0VBTCMjIwpURVJTRSNQSVBFRFJFQU0KSVJBUyNNRURBTCNJU0xFCkVMSUEjT0xMSUUjU1BPVApERU5ZI0JMRU5EI0VZRVM="},{"title":"3/14/06 EASY AS PIE","author":"by Sally R. Stein, edited by Stanley Newman","date":"2006-03-14","grid":"RU5EIyMjTFBTI01FT1dTClJPVVNFI0VFRSNPTERJRQpJTlRSTyNUQUMjQUxPTkUKQ09DT05VVENVU1RBUkQjCkFTSCMjU1VFUlMjIyMjIwojI0FaVEVDI0VUUyNCUkEKQVBQRUFTRUQjU1RPTEVOCk5FUEFMI1NJUiNBVkFTVApURUxMT04jTkVHTEVDVFMKRVJFI05FVCNDTEVSSyMjCiMjIyMjTUFSSUUjI0JSTwojQ0hPQ09MQVRFQ1JFQU0KQVJVQkEjRVBBI0RJUkdFClJVTU9SI05JTCNMT1JFTgpFWFBFTCNURFMjIyNZRFM="},{"title":"3/15/06 747 SEATING","author":"by Fred Piscop, edited by Stanley Newman","date":"2006-03-15","grid":"TEFQUFMjU1BFRCNBSEFCCkVHUkVUI09MR0EjUEFSRQpGUk9aRU5GT09EQUlTTEUKVE9NI1BVVFQjU0xBVEVSCiMjI0NPRFkjIyNQUkVTUwpJTkxPVkUjTUlTU1kjIyMKVE9JTEUjS0FURSMjU1BGCkNMRUFSQU5DRUNFTlRFUgpIT04jI1RFRU0jTUVBUkEKIyMjRElWRVMjU1BBUktZCkFTU0VTIyMjU1BPVCMjIwpOQVBMRVMjT1BFUiNPTEUKRFJJVkVUSFJVV0lORE9XClJBS0UjRUJBTiNVU0FHRQpPTkVTI1dPTksjTUFZT1I="},{"title":"3/16/06 DEW LINES","author":"by Randall J. Hartman, edited by Stanley Newman","date":"2006-03-16","grid":"QURBR0UjUEFSVCNXSEFUCk5PTUFEI0lOVE8jSElWRQpEVVBMSUNBVEVCUklER0UKWVJTI1RVTkUjT09aRVMjCiMjI1NJTE8jQUdFIyMjIwpET09XT1BTT05HI1JBU0gKQUxMRU4jI1JFQSNFTElFClRJTEwjUFJBV04jTE9SRQpFVklMI0VBVCMjRElORUQKU0VFUyNEVUVQUk9DRVNTCiMjIyNPSUwjWUVOUyMjIwojWU9VTkcjSVRTQSNMSUUKRE9USEVSSUdIVFRISU5HCklESU8jRVJPTyNFSUVJTwpNQVNII0VBUk4jREVOVFM="},{"title":"3/17/06 TERSE COMMENT","author":"by Ann W. Masten, edited by Stanley Newman","date":"2006-03-17","grid":"U0FGQVJJUyNUUkFCRVJUCk9ORUlOQ0gjSE9OT1JFRQpZT1VTQVlBTE9UQUJPVVQKQURETCMjS1lSQSNET1BFCiMjI0VNQ0VFI1RIWSMjIwpQQVQjRU9TI05FR0xFQ1QKU0xSI1NOQVJFI1dBR09OCllPVVJTRUxGV0hFTllPVQpDSEVFSyNFRFNFTCNQRVQKSEFSUElORyNDTUwjVERTCiMjI0FURSNUQVNTRSMjIwpPTUFSI0dBUFMjI0xFQVAKRE9OVFRBTEtUT09NVUNICkVOVEVOVEUjRU5URVJFRApTS0VFVEVSI1JPQlJPWVM="},{"title":"3/18/06 SATURDAY STUMPER","author":"by Doug Peterson, edited by Stanley Newman","date":"2006-03-18","grid":"U1VJVFNNRSNBUE9TVExFCklOTk9DRU5UU0FCUk9BRApDQUxMQVRURU5USU9OVE8KI1dJTFQjUkVFTFMjU0lNCkpBTVMjUkVUUlkjRklOSQpPUkIjTk9BSCMjQUxMT1QKTkVPUEhZVEUjTU9VU1NFCiMjI09MQVkjUEFSSyMjIwpDSEFQRUwjUEFSVFlIQVQKSEFMRVIjI0FTSUEjQVJFCkFSRVMjUEVDQU4jRENJWApTUFIjVEVQSUQjUElLQSMKU0lUU09OT05FU0hBTkRTCklTTEFORENPTlRJTkVOVApTVFlMSVNII0FMTEFZRUQ="},{"title":"3/19/06 CIRCULAR REASONING: Try not to think straight","author":"by Fred Piscop, edited by Stanley Newman","date":"2006-03-19","grid":"QU1QI1VTRVMjT0NUQSNPQkkjV0FTClNBTyNSVURFI0hPQVIjTUFUQ0hVUApUVVJOSU5HUkFESVVTI0FTVEFJUkUKSURFQSNTRUFMQU5UI1NIRSNHUkFEClJFREhBVCMjVFJBI1NDQUxQRUwjIwojIyMjUk9MTElOR1NUT05FUyNJTVAKQ0FSRUZSRUUjI0VSQVQjU0lHTkFMCk9XRUQjTUFORVMjU0lURVMjT0dSRQpNQVZFTiNGQVRFUyNESVMjTEFERUQKSVJPTk9OUyNBUkVBI1NUUEVURSMjCkNFTCNST1RBVElOR1NISUZUI1JSUwojI1ZJU1RBUyNPTkVMI01DR0FWSU4KU1BJQ0UjTFNUI0FST01BI09QSU5FCkFSTkUjU0tJRVMjU1dBVEgjT1NTQQpET0dTSVQjR05VUyMjV09PRFNIRUQKRVNDI1JPVU5ESU5HRVJST1IjIyMjCiMjUkFWSU5FUyNPUkEjI1NVTUFDUwpBQkVUI0NQUiNBV0FSREVFI0FHUkEKRklERUxJTyNTUElOTklOR1dIRUVMCkFOSU1JU1QjUkVOVCNPVE9FI05FVgpSR1QjRU1TI09SR1MjUk9XUyNUS08="},{"title":"3/20/06 GO WEST","author":"by Sally R. Stein, edited by Stanley Newman","date":"2006-03-20","grid":"I01FU1MjRURBTSNDTEFECiNFQ09OI05JQ0UjUklMRQojU0hPTyNTQUxUI09SQUwKI0hPTk9MVUxVSEFXQUlJCiMjIyNQT0UjI09ERCMjIwpTVFJBWVMjV0FERSNQQlMKQ09PUyNFQkFZI0FHQUlOCkFOQ0hPUkFHRUFMQVNLQQpUQUtFTiNMRVNTI1NURVAKU0xZI0VFTFMjVEFQRVJTCiMjI1NBTSMjUElHIyMjIwpQT1JUTEFORE9SRUdPTiMKT0JPRSNJT1VTI05PUEUjClBFVEUjTEFLRSNUUkVFIwpFWUVEI1NIRUQjU0VORCM="},{"title":"3/21/06 STUNNING","author":"by Gail Grabowski, edited by Stanley Newman","date":"2006-03-21","grid":"RVJSUyNDTElNQiNNSU5JClJFQVAjTEFURVIjSVJJUwpNRUlSI0FTVFJPI0xPTEwKQUZURVJTSE9DSyNLTkVFCiNTVEVFUCMjWUVBUyMjIwojIyMjREVOVCMjU0hBUkUKQVNTVCNEVUVUI1BBUklTClNUQUlSI1RFRSNTS0lNUApIRUxMTyNTTkFHI0VBU1kKRVBFRVMjI1NNT0cjIyMjCiMjI0ZFQVIjI0JFVFRFIwpFVEFMI0xJVFRMRVJPQ0sKQVJMTyNBRE9SRSNFWVJFClJFRE8jTUVSSVQjTk9VTgpQRUFSI09SRU9TI0RVU1Q="},{"title":"3/22/06 WORKING IT OUT","author":"by Shirley Soloway, edited by Stanley Newman","date":"2006-03-22","grid":"U09MRSNJSE9QI1NBUElECkFLSU4jTUFORSNFTE9QRQpNQVNUI0xJRU4jUkVVU0UKQllUUklBTEFOREVSUk9SCkFTU0VOVCNNRUFOIyMjIwojIyMjVEVUIyNERVNUUlkKQUxURVIjSE9PRCNBUklBCkJZSE9PS09SQllDUk9PSwpFUklOI0VSR08jUkFOVFMKVEVOU09SIyNFV0UjIyMjCiMjIyNDUkFCI09ERVNTQQpPTkVXQVlPUkFOT1RIRVIKUEFSSVMjUk9VVCNIQUxMClVTQUdFI1RJTkcjRUxMRQpTQVNTWSNBTFRPI0xFU1M="},{"title":"3/23/06 NOISEMAKERS","author":"by Doug Peterson, edited by Stanley Newman","date":"2006-03-23","grid":"Q1JFUFQjU09XUyNFREdZCkhFTlJJI1FVSVQjVklMRQpVUFRPUCNVU1NSI0lTVVAKR09PVVRXSVRIQUJBTkcjCiMjI0RPT1JTI1RPTkUjIwpNRVIjRU1UI0hBUiNZTUEKT0JPRSNBR1JPI0lTTEVTClRPVUdITlVUVE9DUkFDSwpUT05HQSNORU1PI09OQ0UKT0tEI0xQUyNVTVMjREFECiMjUkFWSSNBU1BDQSMjIwojTE9XRVJFRFRIRUJPT00KTE9CTyNBTERBI05PUk1BCkVSSUsjQ0JFUiNFVkVOVApHRU5FI1lBUkQjU0VNSVM="},{"title":"3/24/06 IT'S ONLY A MOVIE","author":"by Merle Baker, edited by Stanley Newman","date":"2006-03-24","grid":"QUpBUiNPTUVHQSNFWlJBClNVUkUjUE9MTFMjWE9VVApGSUNUSVRJT1VTI1BPRU0KT0NFQU5TIyNJVEFMIyMjClJFRElEI1NTTiNDT01NQQojIyNMSVZJTkdPUkRFQUQKQ1NBI0FJREUjTkVFRExFClVQVVAjTkVFRFMjU0lURQpaT0RJQUMjWkVFUyNDQVIKQ09JTkNJREVOVEFMIyMjCk9ORUFMI0VEUyNORVBBTAojIyNGVVNTIyNTVEVSRU8KQk9OTyNTSU1JTEFSSVRZCkFWRVIjR1JBQ0UjRUROQQpHQVRFI1RFUElEI0RFQUw="},{"title":"3/25/06 SATURDAY STUMPER","author":"by Daniel R. Stark, edited by Stanley Newman","date":"2006-03-25","grid":"V0hJVFRMRSNSRVNQRUNUClJVTkFXQVkjQVRUQUNIRQpFTkNMT1NFI01BVURMSU4KQUNIRVMjR1JSI0JSSU1TClRISVMjU0xPT1AjRVBFRQpIRU4jQUxBRERJTiNTSVMKRURHRVdJU0UjQ09WRU4jCiMjI0dBRFMjVEFSTyMjIwojTUFPUkkjRUFTVFdBUkQKQkFNI0VOR0xJU0gjU0VFCkVST1MjR0FMTE8jU0lHTgpBQ1VURSNSQVAjQkFORVMKRE9OQVRFRCNJTUFHSU5FCkVOVElUTEUjUEFSRU5UUwpESVNEQUlOI0VWRVJFU1Q="},{"title":"3/26/06 UPWARD NOBILITY: A well-bred construction","author":"by Shirley Soloway, edited by Stanley Newman","date":"2006-03-26","grid":"U1BBUyMjUEFZUyNTQUJFUiNLQUxCCkxBTVAjQUxMT1QjQUxMT1kjSVRBTApBTE9FI0dPVURBI0xBSU5FI05PREUKTUVSQ1VSWU1BUlFVSVMjI0FHTkVTCiMjI1RSRVNTI1RVVCNTRURJTUVOVApBTExFR0UjIyNUSUVSI0RBREEjIyMKVEhFUkVEQkFST04jT01JVCNDQVJECk9BRlMjI0FNQSMjI0dBVEUjS0xFRQpNU1QjTEFEWUZJTkdFUiNTVEVQSU4KU0FTU0lORyMjTk9SUklTI0lST05ZCiMjI1VOU0VUI0RPRSNBUFBMRSMjIwpTVEFMRSNTT0ZJTkUjI1JFRUxFUlMKQ09OVFJBI1FVRUVOU0xBTkQjUkFXCkFSRUEjVE9VUiMjI1NJTiMjQkFSRQpNT1dOI0FWRVIjRUFSTEdSRVlURUEKIyMjT0dSRSNZQVJEIyMjSU1QT1JUCkNBRkZFSU5FI1NJRCNNRURJQSMjIwpBTVVTRSMjRFVLRVVOSVZFUlNJVFkKU1BFVyNBQklURSNDQVRFUiNTT1NPCkVMTEEjVklDQVIjRURFTlMjRVRBTApTWVNUI0dPVEhTI0RBUlQjI0RBUks="},{"title":"3/27/06 ALL EYES","author":"by Gail Grabowski, edited by Stanley Newman","date":"2006-03-27","grid":"U0FTUyNBREFNI1JBVkVOCkhVTVAjREVMSSNFTElURQpBUklBI0FNRU4jU1BFTlQKV0FUQ0hQT0NLRVQjV0FTCiNTSEVFVCMjU0xVUlAjIwojIyNTQVRFRCNTUE9PTiMKQUxMI1ZPV0VMIyNCSU9TCkxPT1NFI0VQQSNERU5TRQpTVE9QIyNST1ZFUiNURUEKI1NLQVRFI1RBWEVTIyMjCiMjQU1BU1MjI1BBTkVTIwpQQUwjU1BPVFJFTU9WRVIKT0JJVFMjTE9BTiNSQVJFClBFS09FI0lOTlMjRURHRQpTVEVFTCNESUtFI1NFRUQ="},{"title":"3/28/06 HERE, KITTY","author":"by Sally R. Stein, edited by Stanley Newman","date":"2006-03-28","grid":"QU1FQkEjTkFTSCNFQkFZCkNBTUVMI0lERUEjTk9ORQpUUklMTCNHSUxMI0dBR0EKU0NSQVRDSE9GRiNJUklTCiMjIyNPVVRTIyNPTlNFVApCQUJCTEUjI1BFS0UjIyMKTExPWUQjVEFJTFNQSU5TClRBUkEjQk9ORVMjVUhPSApTTk9XQklSRFMjUFJPU0UKIyMjSEFaRSMjSEFSUEVEClJPQklOIyNTVEFSIyMjIwpFWEVTI0NMQVdIQU1NRVIKQklMSyNaSVRJI0RFQUxUCklETEUjQVZJUyNFTUlMRQpERUVSI1JFTlQjU09MRVM="},{"title":"3/29/06 PRECIOUS FEW","author":"by Fred Piscop, edited by Stanley Newman","date":"2006-03-29","grid":"U0xJTksjUEVQUyNBQkFCClRFVE9OI0VDT0wjQ0FTRQpTQUxWTyNPUkVPI1RSSUcKI1BMQVRJTlVNQkxPTkRFCiMjIyNUUlkjIyNJTlNFVApSRURFWUUjQ0hJTEUjIyMKSUNPTiMjRVJJU0EjVEFECkdPTERFTlBBUkFDSFVURQpBTlQjRk9JU1QjI0VCT04KIyMjRElUQ0gjU1RFQU1ZCkFWQUlMIyMjUEVBIyMjIwpTSUxWRVJTTkVBS0VSUyMKQ09MRSNFVE9OI0VESVRTCkFMRVMjTU9PTiNVTkRFUgpQQU5UI09QUlkjUEFTVEE="},{"title":"3/30/06 FANCY FOOTWORK","author":"by Shirley Soloway, edited by Stanley Newman","date":"2006-03-30","grid":"U0hBUEUjQlJJTSNBU1BTClBVVE9OI1JBUkUjU0hFQQpBTE9ORyNBVklTI1NPT04KVEFQREFOQ0VTQVJPVU5ECiMjIyNHT0VTIyNBUlRTWQpGRVJSRVRTI0dSSVQjIyMKRUJBWSMjI1NPT1QjT0FUClRBS0VTVFdPVE9UQU5HTwpFTkUjT1ZBTCMjI0lDRVMKIyMjUllBTiNBSU1MRVNTCkFESUVVIyNBTFNPIyMjIwpXQUxUWklOR1RIUk9VR0gKQUxJSSNEQVJFI0FQUExFClNFQVIjT1ZFUiNTQVRPTgpIWURFI0xZRVMjU0xPV1M="},{"title":"3/31/06 ARK-ANA","author":"by Richard Silvestri, edited by Stanley Newman","date":"2006-03-31","grid":"QUdFUyNDT0NPI1JBWk9SCkxVUkUjT1BFTiNBV0FSRQpFUklFI1BFTEUjTkVHRVYKQ1VDS09PQ0xBUksjIyMjCiMjI1NNVSMjTU9MQVJTIwpSQVQjQVRPTSNERVRFQ1QKQU1BSU4jTE9WRSNBSE9ZCkNPTUJJTkFUSU9OTEFSSwpFUkFTI0VWRU4jRUxTSUUKREFMRVRII1RPUFMjSEFTCiNMRU5PUkUjI0lUUyMjIwojIyMjRlVUVVJFU0hBUksKQUxPT0YjVVNFUiNJVkFOCkdBQkxFI0RJT1IjTklORQpPWElERSNFQVNFI0VER0U="},{"title":"4/01/06 SATURDAY STUMPER","author":"by Anna Stiga, edited by Stanley Newman","date":"2006-04-01","grid":"UElDQSNKRktBSVJQT1JUCkFOT04jQVJBQkxFQUdVRQpTVEFUI01JWlpFTk1BU1QKVE9YSUMjR09VUkQjVVNPCiMjI1FVQUhPRyMjQUdJTgpBREpVTkNUUyNTQVZFQVMKVk9MQU5URSNUT0RPIyMjCkVNT1RJT04jSE9PVEVSUwojIyNJTk5TI0lOUFJJTlQKR1JBTkdFI1BSRVRFTlNFCkhBTkcjI01BRFJFUyMjIwpPTlQjRkVFTFMjREFaRUQKU0NIT09MTUFURSNORVJPClRIRURBS09UQVMjVEFSUApTT1JFTE9TRVJTI0VMU0U="},{"title":"4/02/06 TWEET TWEET: These tunes are for the birds","author":"by Merle Baker, edited by Stanley Newman","date":"2006-04-02","grid":"QkFZT1UjU0xPUFMjU01FRSNPTkVTCkFETUFOI1BPUkVTI1dJTkQjUEVOVApST0NLSU5ST0JJTiNJTkNVU1RPRFkKTlNBI1FVSVBTIyNBTklMI0NFQ0lMCiMjI1BVVFRZI1dJTkdTT0ZBRE9WRQpSRURSRVNTI0FSTVkjVFNBUiNORUQKRU5ST0wjI0NMRU8jTEVFUkVEIyMjCkJZRUJZRUJMQUNLQklSRCMjSVdBUwpTQVcjI0RSQU5LI0FMUyNNT1RJTEUKIyNGTE9XRVIjI01UQSNQQVJUTkVSCiNXT09EWVdPT0RQRUNLRVJTT05HIwpUVVJOT05TI0xVRyMjQVJJT1NFIyMKQVNURVJOI0ZPRSNHRU5PQSMjQk9XCkxBSFIjI0VBR0xFQU5EVEhFSEFXSwojIyNTUFJZTFkjUExPWSMjTkFHRUwKQUJBI0xFRVMjU0VFUyNCQUxDT05ZCkZVTktZQ0hJQ0tFTiNLT0RBSyMjIwpSRUlORSNPVFJBIyNSVURFUiNBVEUKSU5URVJBTElBI01PQ0tJTkdCSVJECkNPQUwjUEVFTiNTSEFMRSNFRVJJRQpBU1NUI0VTU0UjU09GQVMjUkFZT04="},{"title":"4/03/06 SKY-HIGH","author":"by Gail Grabowski, edited by Stanley Newman","date":"2006-04-03","grid":"U0NBTiNDSElQUyNDTEVPClBPTE8jQUFST04jTE9JTgpBQ0xVI1RSQUxBI09HUkUKTU9PTlNISU5FUiNVU0VTCiNBVFNFQSMjU0VORCMjIwojIyMjV0lMRCNESU5FUlMKRUdHUyNSRUFQI1BJTE9UClZBTFVFI0VSUiNTTklERQpFTUVORCNLRUVQI0VBU1QKU0VFRklUI1NQT1QjIyMjCiMjI0xFQVMjI1NPQVJTIwpPU0xPI1NUQVJTVFJVQ0sKQU5FVyNURUhFRSNJUk9OCkZJTkUjRVZFTlMjU0FORQpTUEFSI0RFTU9TI0VMRUU="},{"title":"4/04/06 ON THE KEYBOARD","author":"by Sally R. Stein, edited by Stanley Newman","date":"2006-04-04","grid":"R0xFTlMjQUNUUyNNQVRIClJFQlVUI1NPT1QjT0JFWQpJTkFORSNTQUdBI0JPTkUKUEFZU1RIRVRBQiNJUk9OCiMjIyNTQVQjIyNVTFRSQQpTSEFET1cjTEFQU0UjIyMKSElUT04jR0FNRVNIT1dTCkFWT04jVEFNUEEjT01JVApNRU1PUklaRVMjQU1BTkEKIyMjVE9ORVIjQ0xFUkdZCk1PV0VEIyMjQUFBIyMjIwpJUkFOI05JR0hUU0hJRlQKTUFTVCNBTExZI0tPUkVBCkVUVEUjQkxVRSNBU0lBTgpTRUVSI1NTVFMjTkVTVFM="},{"title":"4/05/06 BUILD-UPS","author":"by Fred Piscop, edited by Stanley Newman","date":"2006-04-05","grid":"REFSTlMjTUlTVCMjQ0FQCkVMSU9UI0FSRUEjUEFJTApDQUREWVNIQUNLI0VORE8KQVNTRU5UI1NURUlOV0FZCiMjIyNFUkEjU09GVEVOUwpTVEVXI0FSUyNVU0gjIyMKQVVSQSNQRVRJVCNPVVNUClVOSVQjI05BTSMjVVNUQQpMQU5FI01BUkFUI1NFQU0KIyMjUkhPI0VHTyNFREdFClNFQVNPTlMjRU5HIyMjIwpXSVNIQk9ORSNJTkFTRUMKT0RJRSNDT1BBQ0FCQU5BClJFREQjTE9JUyNSSUdPUgpFUkUjI0VUQ0gjTEVBU1Q="},{"title":"4/06/06 LEARNING EXPERIENCE","author":"by Randall J. Hartman, edited by Stanley Newman","date":"2006-04-06","grid":"TUFJI0FWRVJTI0FOSU1FCkFSQyNMSUxBQyNMSU1PUwpOQUUjQURBTk8jSU5QVVQKVFJBSU5JTkdXSEVFTFMjCklBR08jIyNFU0UjI0lTTwpTVEVVQkVOIyNOQVNDQVIKIyMjI0VUQVRTI1RSSUtFCiNFRFVDQVRJTkdSSVRBIwpTTElOSyNPTUFOSSMjIyMKREVDT1lTIyNHVUFSREVECklDSyMjQ0hJIyMjRUVSTwojVEVBQ0hJTkdGRUxMT1cKQ0lSQ0EjTUFOT1IjVklOClBPRVRTI09OQUlSI0VDTwpBTkRJRSNNRVRFUyNEQU4="},{"title":"4/07/06 MIXED MEDIA","author":"by Ed Stein, edited by Stanley Newman","date":"2006-04-07","grid":"SkFaWiNTTUVXI0dBU1BTCkFHRUUjQ0FSRSNJT1dBTgpHUkFOVEFOREJFTExFQVUKU0FMI0FNSUFCTEUjRVJHCiMjI1BVUEEjI0FBQSMjIwpWRVJPTklDQUFORFNXQU4KQUJPUlQjI0lORCNTQUdPCkxCUyNTVEFMRVNUI0xBQgpMRVNTI09ORSMjUkFESUkKRURJVEhBTkRESUFNT05ECiMjI1BBVCMjRU5WWSMjIwpTQVcjREVMVUlTRSNBSEEKUEVPUExFQU5EUExBQ0VTCkFST1NFI0tJUkEjWUVBSApUT0RBWSNFVkVOI0VERFk="},{"title":"4/08/06 SATURDAY STUMPER","author":"by Doug Peterson, edited by Stanley Newman","date":"2006-04-08","grid":"Q1JPU1NXQVlTI0JBU0lMCkhFUkVUSUNBTCNBREFOTwpBQ0VUWUxFTkUjVEFMQ1MKRkVMT05ZI0tFRyNNRUFUCkVOU1VFI1JFUE9TI1NNQQpTVEVUI1NFRVlBTEFURVIKIyMjI1NFTUkjQk9HQVJUClNBTkFOVE9OSU9URVhBUwpBUkFSQVQjR05VUyMjIyMKUkVUSVJFTUVOVCNEUkFXCkRBVCNMRU9OUyNTQVVESQpJQ0VEI1NNVSNKQU1NRUQKTk9SQUgjTUlTRVJBQkxFCkVERU5TI0FUSVRBR0FJTgpTRURBTiNTWU5USEVTRVM="},{"title":"4/09/06 FAMILY REUNION: And don't forget 80 Down","author":"by Sally R. Stein, edited by Stanley Newman","date":"2006-04-09","grid":"QVRMQVMjTUFBTSNCQVNJUyNTSEFNCkNSQU5FI0FMVkEjRVBPQ0gjTEFURQpNSVNURVJLRUVOI1NBU0hBQ09IRU4KRVhURVJJT1IjQ0FQUkEjWkFHIyMjCiMjIyNFT1MjQklORVQjTEFSQU1JRQpJTkdFU1QjR09OTkEjUkFNI05JQ0UKRFlFUlMjQk9XSUVLVUhOIyMjQ09ZCkFMT0UjQlJPUyMjI1NJQU0jT0hOTwpIT1IjUEFJTiNNQUNPTiNBVVBBSVIKT05HVUFSRCNTRVJBUEUjR1JFRUNFCiMjRU5UUkUjQ0xPU0UjU05BUkwjIwpTRU1JVEUjQ0hPU0VOI1BBTEFDRVMKVU5DT0lMI1NJTkVTI09VVFMjQU5UCkVDT04jU0FQUyMjI0NPUkUjUklUQQpET0gjIyNTQU1NWUNBSE4jS0lORVIKRVJBUyNXSU4jQVVSQVMjV09PRVJTClNFTkFURVMjUFJNQU4jSEFOIyMjIwojIyNGSVQjQlJJQU4jQ09XVE9XTlMKSkFNRVNNQ0FJTiNLVUJMQUlLSEFOCkFMT1QjT1VOQ0UjVVNFUyNLRUFOVQpCQUJZI1BSRVlTI1BPUlQjSURUQUc="},{"title":"4/10/06 SOMEWHAT SASSY","author":"by Gail Grabowski, edited by Stanley Newman","date":"2006-04-10","grid":"UEFOUyNTSElQI01BUlNICkFUT1AjVEFSQSNBQkFURQpTT0ZBI0FMQU4jUE9LRVIKU01BUlRNT05FWSNMRU5PCiNTVFJBUCMjI0VESVNPTgojIyNPTlMjQ1BMVVMjIyMKU1BFVyMjRkxJUENIQVJUCk9SRSNBR0FJTlNUI0JBQQpCT0xEUFJJTlQjI0xFTkQKIyMjQVRJTFQjU0VFIyMjClBSQUlTRSMjI0NMQVNQIwpMT0JTI0ZSRVNIRlJVSVQKQVZPSUQjSURMRSNOQVBBCk5FVkVSI1RFQU0jRVZFTgpUUkVTUyNBTlRFI0RFU0s="},{"title":"4/11/06 SWEET TALK","author":"by Sally R. Stein, edited by Stanley Newman","date":"2006-04-11","grid":"QUxMT1QjI1RXT1MjQkFSCkdPQVBFI05PT05FI0FETwpFQVZFUyNFR1JFVCNUSVAKU01BUlRDT09LSUUjSE9FCiMjI0FZRSMjU0xZTkVTUwpMQVBTI0RJTSNMRU8jIyMKQVZFI1dBTkVEI1NPTEVTCkRPTExBUlNUT0RPTlVUUwpTV0VBVCNUQVBJTiNBUlQKIyMjVEVNI0xFVCNEVUVTClNFVkVSQUwjI1RPTyMjIwpPTEUjUElFQ0VPRkNBS0UKRklYI09MRElFI1RJTUVYCkFURSNMRUdBTCNFTE9QRQpSRUQjT1JFTyMjTkVTVFM="},{"title":"4/12/06 UNCLE","author":"by Shirley Soloway, edited by Stanley Newman","date":"2006-04-12","grid":"UEFMRSNNRURTI1RSQVlTCkFMRVgjQUxBSSNWRU5VRQpDT0FUI0dBTkcjU1BFTEwKVEhSRVdJTlRIRVRPV0VMCiNBTk5PIyNFVE5BIyMjIwojIyNUT01TIyNEUkVOQ0gKU0hFI0VCT09LIyNMVUxVCldBVkVEQVdISVRFRkxBRwpBSEVNIyNTTUVBUiNMUFMKUEFSU0VDIyNMT0lOIyMjCiMjIyNRVUlUIyNDVUtFIwpIRUxEVVBPTkVTSEFORFMKQVRBUkkjV09SRSNOT1NIClNUUk9QI0FUVE4jQ0xFTwpIRUFQUyNORUVEI0VMTEU="},{"title":"4/13/06 BURNING ISSUE","author":"by Alison Donald, edited by Stanley Newman","date":"2006-04-13","grid":"RFZEI0pFQiNBRkZBSVJTClJJTyNVTkkjTE9PU0VOUwpJRE8jVEFSI0ZPUlRSQU4KUEVSRkVDVE1BVENIIyMjClNPU0EjVEhVI1JFRVNFUwojIyNVUFMjTEVFIyNBR0UKRUFHTEUjQ0VBU0VGSVJFClRST1RURVIjU1RBTExFRApIT0xZU01PS0UjUlVTVFkKWU1BIyNFUEEjQUxGIyMjCkxBTkNFUiNSRUIjRkFNRQojIyNBTkdFTEFTQVNIRVMKUEVFUlNJTiNUVVgjRU5TCkFTVE9VTkQjQVJFI0FTRQpTRUFMRUdTI1REUyNEQU4="},{"title":"4/14/06 SAY CHEESE!","author":"by Doug Peterson, edited by Stanley Newman","date":"2006-04-14","grid":"QVJHT1MjQUNEQyNNU0dUCkRBVU5UI1NIRUEjQVBFRApBRElFVSNURUVTSElSVFMKUEFTU1BPUlRQSE9UTyMjClRSRSNFVkEjIyNXQUNTIwojIyNJRklMT09LTElLRSMKTUlTVFkjI1BST1MjRUFUCk9SRVMjVEhJU0kjU1RMTwpCQVIjQ09FTiMjRlVTU1kKI05FRURUSEVUUklQIyMjCiNJTkNSIyMjVkFOI1VTQQojI0dMT1JJQVNXQU5TT04KU1RFQU1FRFVQI0dPVUxECkFOVEkjRE9ETyNMRUFWRQpTVElSI1NMSVQjRUxMRVM="},{"title":"4/15/06 SATURDAY STUMPER","author":"by Daniel R. Stark, edited by Stanley Newman","date":"2006-04-15","grid":"Q1JVU09FI1NQQU5JQVJEClJFTk9JUiNDT0xBTkRFUgpJTVBBTEEjQU5USURPVEUKVEVSUkVTVFJJQUwjUklBCklETyNERUFMRVIjUEVSTQpDSVYjIyNXRVMjSElERVMKU0VFI0xVTlQjUFVUIyMjCiNTTkVBS1kjTUFOVElTIwojIyNBREUjVklOUyNSRVMKQ0FTVFMjQUFBIyMjT1BUCkhFV1MjUExVTVBTI05BRQpPTkUjQklMTElPTkFJUkUKTEVBVkVPVVQjUkFTQ0FMCkxBVElUVURFI0NSRUFURQpBU1NFU1NFRCNIRUFMRVI="},{"title":"4/16/06 BIBLE CLASS: Phrases originally from the Good Book","author":"by Fred Piscop, edited by Stanley Newman","date":"2006-04-16","grid":"Q0FNQVJPIyNET05ITyMjTEFCUkFUClVOSUNFRiNUSURCSVRTI0VSUkFUQQpTQUxUT0ZUSEVFQVJUSCNTVEFUT1IKU1RMTyNTVUlUIyNTT1VSI0lURU1TCiMjI05BSUxTI0FCVSNMRVBFVyMjIwpTRUxFQ1RTI1NQSVRaI1BFUlVTRUQKQVZBI0hFQVJUU0RFU0lSRSNSRURPClRBQkJZIyNIT08jI0FXT0wjU0VBVApPRE9SI0FQT1AjQk9aT1MjU1RFTVMKUkVST1VURUQjQUxBUyMjTk9TWSMjCklETyNTVFJBSU5BVEFHTkFUI0VCQgojI0ZSQVkjI1JPU1MjUkVQT1JURVIKUElMQUYjQ0xPTkUjREFaRSNJT1RBCkFNT0sjQUhBQiMjU1JJIyNBQkVUUwpTQVZFI0ZBVE9GVEhFTEFORCNZRVMKT01FTEVUUyNUVVJPVyNCT09URVJZCiMjI0VBU0VTI1NVUCNQQVJTRSMjIwpEVUNBVCNEQUxJIyNUQVNNI0VBUkwKT0xJVkVUI0hPTElFUlRIQU5USE9VCkVOVEVSUyNMT0xMSUVTI05FRVNPTgpTQVlTU08jI01JTEtZIyNTVFJPS0U="},{"title":"4/17/06 THAT'S EASY","author":"by Gail Grabowski, edited by Stanley Newman","date":"2006-04-17","grid":"UkVFRCNBTEFTI1BBU1RBCkVBVkUjUk9MTCNBR05FVwpCUkVFWkVXQVkjQ1JBTkUKQUxMRE9ORSMjQkVFUFMjCiMjIyNSQVNQI1VTRUQjIwpQQVBFUiNUSEVNI0RSSVAKRURJVE9SI0FMUCMjQURBClJJQ0UjRUVSSUUjQUdFUwpLRU4jI0lSQSNSRUNPQVQKU1VJVCNHUk9XI0RFTlNFCiMjQ09STiNISUZJIyMjIwojTkFNRVMjI05BVElWRVMKRk9SQ0UjQ0lOQ0hCRUxUCk9ORUFMI1VOSVQjRVJMRQpHT0FUUyNFS0VTI1RCU1A="},{"title":"4/18/06 SCATTERED SHOWERS","author":"by Sally R. Stein, edited by Stanley Newman","date":"2006-04-18","grid":"REVDT1kjWU9SRSNBUFRTCkFUT05FI0VXRVMjSVRSWQpTVFJFU1NBTkRTVFJBSU4KSEVFRCNPUlNPI0lUU01FCiMjI0dFTFMjQUxTTyMjIwpJTktFRCNBTktBI0FDSEUKRE9OI0lBR08jTkFJTEVSCkVMRUNUUk9OSUNCUkFJTgpBVEVBU0UjT05FQSNTUkkKU0VMTCNORVNTI0xBUFNFCiMjI0FBQUEjSUxMUyMjIwpTRUFNWSNSQUdFI1RPVEUKQUdBSU5TVFRIRUdSQUlOCkZPUlQjU0hPVCNBQUhFRApFU1BZI1RBUFMjQkxVUlM="},{"title":"4/19/06 3 ON 66","author":"by Fred Piscop, edited by Stanley Newman","date":"2006-04-19","grid":"Q0FXUyNSRVBPVCNQQUlECkRSQVcjQU1VU0UjUlVCRQpTSVJFI1JJTExFI0VSSU4KI0FNQVJJTExPVEVYQVMjCiMjI1JBVEUjI0hBWSMjIwpQSUdTVFkjQUNFUyNHUFMKQU5BVCMjQURPUkUjU0FQClNUTE9VSVNNSVNTT1VSSQpURUwjU05BSUwjI1JJU0UKQVJTI0VTUE4jQ09BVEVECiMjI1BSRSMjQUxPVCMjIwojVFVMU0FPS0xBSE9NQSMKRklSRSNTSEFHUyNST01BCk9MR0EjT05UT1AjSUNPTgpCTEVEI05PRUxTI09LUkE="},{"title":"4/20/06 CLOCK WORK","author":"by Silvestri and Martin, edited by Stanley Newman","date":"2006-04-20","grid":"REFURVMjRkFTVCNMQVNTCkFCT0RFI0lTVE8jQVRPUApXSVJFRCNFVEFMI1BFTEUKTkVJTkFUTklORSNEQVZFCiMjIyNUQUQjI1JPT1RFRApQRVNURVIjQ0hBUkdFIyMKSUxJQUQjQ1JBVEUjSUFOClBBQ1QjU0hBUkUjT0dMRQpFTEsjQVRPTkUjV0FIT08KIyNTQ1JBUEUjQkFUVEVOClNFQUxFUiMjR09UIyMjIwpBTFRJI0ZPUkVBVEZPVVIKUlVTRSNJUk9OI0FST1NFCkFESU4jU0VNSSNHQVpFRApORVhUI0hPUEUjRVlFUlM="},{"title":"4/21/06 ARF! ARF!","author":"by Randall J. Hartman, edited by Stanley Newman","date":"2006-04-21","grid":"TUFQTEVTI01TRUMjRUxNCklNUEFDVCNZRUFII1BBTwpESURZT1VIRUFSQUJPVVQKIyMjQU5OT1kjI05BQ1JFClNMT1cjVEhFRE9HVEhBVApQSUNBU1NPI0FMRVMjIyMKT0JFWVMjI0FSRSMjU1BBClRSQSNXRU5UVE9BI0NBQgpTQU4jI1RPRSMjSVRBTFkKIyMjTUFVSSNTRVJBUEVTCkZMRUFDSVJDVVMjS0VZUwpMQU5DRSMjUklDSEUjIyMKQU5EU1RPTEVUSEVTSE9XClRBVSNJTklUI0VMT0lTRQpUSVAjQ09ERSNXSU5ERUQ="},{"title":"4/22/06 SATURDAY STUMPER","author":"by Merle Baker, edited by Stanley Newman","date":"2006-04-22","grid":"VFJBUCNBQ0NPUkRBTkNFCkhFUkEjQ1JBRExFU09ORwpSREFTI0NBTklTTUFKT1IKVU1QUyNSSUNFIyNNT1RFClNFQVBMQU5FI1NMQUtFUwpUQUhPRSMjTEFURU5FU1MKU1RPUkFHRVNQT1QjIyMjCiNTRVRGT1IjQlVTVExFIwojIyMjTEVBTlNUT1dBUkQKQU5TV0VSVE8jI0ZPWUVSCk5PSElUUyNTRUxGU0FNRQpDSElQIyNQRVJJI0lTSVMKSE9ORVNUTE9PSyNESVRTCk9QRVJBSE9VU0UjRURJRQpSRURTUE9UVEVEI0RFQ1M="},{"title":"4/23/06 AU CONTRAIRE: Opposites we'd like to see","author":"by Shirley Soloway, edited by Stanley Newman","date":"2006-04-23","grid":"QVRUSUMjUFBQIyNSUE1TI0NPUkRTCk1BVU5BI0VBUkwjQUxJVCNPUEFSVApPTERFTiNSWUVTI0RBREEjTUVUT08KS0VFUFlPVVJTVU5OWVNJREVET1dOCiMjI1RPUlNPUyNCRUVUUkVEI05ORQpGVEQjTk9FTCNDQVJSIyNMSUkjIyMKTE9PUyMjI0xFTyMjI1JFSEFORExFCk9OVEhFSU5TSURFTE9PS0lOR09VVApTVEVFUExFI1NBVElBVEUjI09OVE8KU09EI1NPT1QjI0NBU1QjTUFUVEUjCiMjI0dPViNSSE8jUlRFI0FMUyMjIwojRlJPTUUjRUFDSCMjTkFJTCNBQ0UKUklPVCMjTUFSVElOQSNTTk9SS0VMCk9OVEhFQk9UVE9NT0ZUSEVXT1JMRApERUNJTUFMUyMjI0dURSMjI0NPTEUKIyMjQ1VUIyNDTEVPI01BREUjTk9SCk9BVCNMRUdST09NI0FQUk9OUyMjIwpNVUNIQURPQUJPVVRTT01FVEhJTkcKQVRFQVQjR05VUyNPS1JBI1JBRElPCk5PTFRFI09HUkUjTUVBTiNFTUVORApJU0xFUyNMWU5OIyNETEkjRVNTRVM="},{"title":"4/24/06 SIGN HERE","author":"by Gail Grabowski, edited by Stanley Newman","date":"2006-04-24","grid":"RE9PUiNGQUxMIyNDTEFQCkFTSEUjRVJJRSNDSEFTRQpOQ0FBI0RFQU4jUkVUSUUKQ0FSREJPQVJEI09DRUFOCkVSQVNFUiMjU0FDSyMjIwojIyMjTEFTSCNJU1JBRUwKU0hBV0wjTkVBUiNPUkVPCkVFUklFI09SQiNUT0lMUwpXQUxMI0FXT0wjQU1BU1MKU1RPTEVOI05FV1MjIyMjCiMjI1BBVFMjI0FUVEFDSwpBQkhPUiNMRVRURVJNQU4KQ0xPV04jQUxBUyNFVVJPClRVTkVTI05FTU8jU0xBQgpTRUVSIyNURUVOI1NFVFM="},{"title":"4/25/06 ENJOY YOUR FLIGHT","author":"by Sally R. Stein, edited by Stanley Newman","date":"2006-04-25","grid":"QlJBTiMjU1VNTyNTVEFCClJPTEUjSE9URUwjQVJMTwpBVE9NI0lSQVRFI1ZJQUwKR0VUT0ZGVEhFR1JPVU5ECiMjIyNMSUUjIyNBUk0jIwpCVVJSTyNST01BTiNQUFMKVU5FQVNZI01BUiNUSFJVClNUQVlTVVBJTlRIRUFJUgpISVRTI0xFVCNTRUFOQ0UKWUVUI0RFTlNFI0FTVEVSCiMjRU1VIyMjWExWIyMjIwpDT01FRE9XTlRPRUFSVEgKQUxQUyNMQUNFUyNMRUlBCk1FVFMjRElBTkUjREFSVApQT1NZI1NUQVQjI0FQRVM="},{"title":"4/26/06 CONTAIN YOURSELF","author":"by Rose Baum, edited by Stanley Newman","date":"2006-04-26","grid":"TEFNQiNVUkdFI0hFQVJTCkFSSUEjUE9FVCNPTExJRQpQQU5HI0JPVFRMRU5PU0UKU1RFUFBFUyNBVURJVEVECiMjI0lSQVRFI05PTiMjIwpURUFQT1QjRE9HV09PRCMKV0FSRVMjUklQRU4jSEVQCklHT1IjTU9URVMjQkFMRQpHRU0jU0lNT04jUE9SVFMKI1JBVFRMRVIjTEFYRVNUCiMjI0hJRCNTUEVMTCMjIwpTUEFSUkVEI1VOTFVDS1kKQ0FOT0ZXT1JNUyNOT1JBCkFMVEFSI0NPUEUjQ01PTgpURVNUWSNLSVNTI0hPQ0s="},{"title":"4/27/06 SOUND OFF","author":"by Fred Piscop, edited by Stanley Newman","date":"2006-04-27","grid":"QkFTI1NUQUdHI0FUT05FCkVTQyNQT1dFUiNUQVBJTgpBUEUjQVJFTkEjVFJFTkQKUklOR1NJREVTRUFUIyMjCkVSVEUjIyMjUExJQUJMRQpSRVNUQVJFQSNJTlJPQUQKIyMjT1JBTkdFIyMjSVRTCiNQSU5HUE9OR1RBQkxFIwpURU4jIyNTVUdBUlkjIyMKSEVJU1RTI1NPVVBDQU5TCk9OVEFSSU8jIyMjQVNFQQojIyNCSU5HQ0hFUlJJRVMKRFdBUkYjUkVFVkUjQURTCkVBU0VMI0VMTEVOI05ORQpFUkFTRSNTVElOVCNTVEQ="},{"title":"4/28/06 CHARLES IN CHARGE","author":"by Charles E. Gersch, edited by Stanley Newman","date":"2006-04-28","grid":"VFJBTVAjIyNBS0lOR0lOClJFVE9PTCNTQ0VORU9ORQpBQ0FESUEjVEhFR1JFQVQKUFVSRSNTVEVFUCMjUk5TClNUSVJSRVJTI1NFVCMjIwojIyNOT1JBI0xJR0hUUyMKU0FOVEFTI0xJTkdFUklFCkFSRUlOI0pFQiNBR0lSTApPVVRNT0RFRCNTTk9QRVMKI1RIRUtJRCNNQ0RMIyMjCiMjI1NFTCNTVFJJRElORwpFRFMjI0FXSVNFI1JBSUwKRElDVEFUT1IjQUxVTU5JCkVOT1JNT1VTI01BU1NFRApORVdZT1JLIyMjQ0hPU0U="},{"title":"4/29/06 SATURDAY STUMPER","author":"by Daniel R. Stark, edited by Stanley Newman","date":"2006-04-29","grid":"QkxPU1NPTSNBQllTU0VTCkxFQ1RVUkUjVFJBSVBTRQpVTkFSTUVEI1RFUlNFU1QKU0lOVVMjSUxJQUQjV0VUCkhFQVQjU1RPUksjVklORQpFTkQjQVBBQ0UjTEFOQ0UKU1RBQ0NBVE8jUklER0UjCiMjI1JJQ0UjQklLRSMjIwojUFJVREUjR0VORVJBVEUKU0xFRFMjRFJBR1MjU0FYClRBUEUjUk9BUlMjQlVSUApFVEEjU0FVTkEjUElOVE8KUE9JU09OUyNCTEFOREVSClBPUlRBR0UjTE9OR0VTVApFTlNVUkVEI0VYVE9SVFM="},{"title":"4/30/06 UP IN THE AIR: Have a pleasant trip","author":"by Randolph Ross, edited by Stanley Newman","date":"2006-04-30","grid":"QVJMTyNEUFMjI1JBVFMjREFSVEVECkJFRUYjQVJBTSNFQVJOI0FHT1JBRQpCVUZGI1RFTEVWSVNJT05QSUxPVFMKQVBUUyNBVkFMT04jI0NBUExFVFMjCiMjV0VFI0VSTUEjRE9PRExFUyMjIwpCUklUQU5OSUEjTU9PTklFIyNXT0UKSU9OI0dBVEVDUkFTSEVSI0FLSVJBCkJPRyNFVkVTI0VUQSMjI1JFSU5BUwojI1JBUkVSI0ZMSUdIVE9GRkFOQ1kKI1NIQUxMI1BJT05FRVJFRCMjSUxBCkFQRVJZI0JSTyMjI05FRCNCT05FUwpURVQjI1JBSU5EQU5DRSNTTFVHUyMKVFdPT05USEVBSVNMRSNBVEVTVCMjCkFFUkFURSMjI1NURSNPVElTI09DVApJUklTSCNORVdBUlJJVkFMUyNVUEEKTlNDIyNOT05QUk8jQ0VOVEVSQ1VUCiMjI0ZMT1RTQU0jTUVOQSNET0gjIwojR0xVRVNPTiMjU1BBV05TI0FESVAKRU1PVElPTkFMQkFHR0FHRSNET1BFCkNBTk9MQSNSRUFQI0VSTEUjSVdPTgpVTlNOQVAjRUFSUyMjRUVLI0VORFM="},{"title":"5/01/06 IN THE PARK","author":"by Gail Grabowski, edited by Stanley Newman","date":"2006-05-01","grid":"Uk9EUyNISVJFUyNHRU1TCkFSSUEjQVRBUkkjT01JVApOQVZZI01BTk9SI0xJTFkKR0xBU1NTTElERSNGUkVFCiNTTk9VVCMjRU5EUyMjIwojIyMjQkVTVCMjQVdBUkUKQU5FVyNSRUFNI1JJU0VSCkhBRE9OI0FCQSNLTkVFTApPUEVSQSNNT1RII0dBTEUKWUFOS1MjI09ISU8jIyMjCiMjI0JBU0UjI0dSQVNTIwpJTElFI1RBWFNIRUxURVIKVE9STiNBR1JFRSNPUkVPCkVSSUMjUkVBUlMjSEFNUwpNRVNII1RSWVNUI0FXRVM="},{"title":"5/02/06 LENGTHWISE","author":"by Shirley Soloway, edited by Stanley Newman","date":"2006-05-02","grid":"Uk9CRSNCUklORyNNSU5ECklWQU4jUkVORUUjSU5DQQpURU5ERVJGT09UI1NDQVIKRU5KT1kjSU5OUyNUSEFOCiNTT1JFU1QjI1RIQVcjIwojIyNTUk8jI1RPT0tPRkYKUk9NRSNBTFRPI0JFUlJBCkFNSSNQUklPUlRPI01FVApTQUxTQSNOT05PI0lTRUUKUFJFTUlTRSMjVVBOIyMjCiMjU0FMVCMjQVJJU0VTIwpDT1RTI0FDRUQjTUlYVVAKVUhPSCNZQVJETUFTVEVSCkZJTkUjVVJHRUQjVE9ETwpGT0VTI1BMT0RTI1NMRUQ="},{"title":"5/03/06 SCHOOL ZOO","author":"by Frances Burton, edited by Stanley Newman","date":"2006-05-03","grid":"QUJCQSNDT0lGUyNNQVJTCkxJT04jQVVESVQjQVJFQQpGT09UI1NUT0xFI1JBTlQKQVNLI1NQRUxMSU5HQkVFCiMjV0lQRVIjI05PSVNFUwpDTE9WRVIjUk9XQU4jIyMKSElSRUQjVE9SQUgjU1JPCkFSTVMjUklMRVkjVEhBVwpQQVMjUEVSRVMjU0lFR0UKIyMjTE9CRVMjU0FURUVOClNUT09HRSMjQUVTT1AjIwpDT1dDT0xMRUdFUyNTSEUKQU5OQSNMSVZJRCNPS0FZClJFRUwjRU1JTEUjRElORQpFUlJTI0RPTEVEI0VORFM="},{"title":"5/04/06 FASHION STATEMENTS","author":"by Doug Peterson, edited by Stanley Newman","date":"2006-05-04","grid":"QlVCQkEjUEFSVCNCRUFNCkFIRUFEI0FWT1cjQUNIRQpIT0xET05UT1lPVVJIQVQKU0hBRyNPSElPI1NOT0JTCiMjI0VDTyNEUk9TUyMjIwpTT1MjSU5TI0JBUlRBQlMKSURFU1QjUVVJVCNPTExBCktFRVBZT1VSU0hJUlRPTgpIT1lBI1BBTE8jU01PQ0sKU05BQ0tFUiNOUkEjU0tBCiMjI0VJREVSI0FLQSMjIwpBVkFTVCNLT05HI1RXQVMKVElHSFRFTllPVVJCRUxUCk1BVUkjTU9BTiNIQU5PSQpTTEFQI1NUTE8jT1RURVI="},{"title":"5/05/06 HORSING AROUND","author":"by Sheldon Benardo, edited by Stanley Newman","date":"2006-05-05","grid":"Tk9STSMjT0RPUiNGT0lMClVWRUFTI1BPTEUjSVJNQQpURVRSQSNFTkRTI0RJUFMKI1JVTkZPUlRIRVJPU0VTClNUUkVFUCMjQVRFI09ERQpFT04jU1RQQVQjQUJORVIKV09FIyNPQVMjQURBIyMjCiNLRU5UVUNLWURFUkJZIwojIyNSVVQjRVREIyNBT0wKU0FUQU4jVURERVIjU1VFClVTTyNJT04jI05PVEVSUwpDSFVSQ0hJTExET1dOUyMKQ0FSRSNBU0lBI0RJSk9OCk9NRU4jUk9PTSNTVElORQpSRURPI0FOTkUjI1NTR1Q="},{"title":"5/06/06 SATURDAY STUMPER","author":"by Anna Stiga, edited by Stanley Newman","date":"2006-05-06","grid":"U1RSQUlHSFRVUCNST01BCk9ST05PTUFJTkUjQVBFUwpMSU9OVEFNRVJTI0dFTFMKQVRTRUEjI1BJQyNBTlRFCkNPVFMjRlJJR0lEI05PUgpFTlMjR0xFTiMjRVZFUlQKIyMjRVJJRSNXT0VJU01FCkJBU1RFUlMjT1BQT1NFRApJTUlUQVRFI01JTEwjIyMKUkFURVMjI0RFTlkjVEJTCkRSUyNFVEhBTkUjTFlSRQpTSVRFI0hFTSMjUkVQT1QKRUxJQSNFWFBFUklNRU5UCkVMTFMjUkVFVkFMVUFURQpET0xUI0VETkFGRVJCRVI="},{"title":"5/07/06 DON'T GIVE UP: Wherein persistence is key","author":"by Roger Coburn, edited by Stanley Newman","date":"2006-05-07","grid":"QVNBUCNDQURFVCNHQVNQI0FCQVRFClBPTEUjQUxJVkUjT05DRSNOSU5FUgpCT0FSI05PVkVMI09OQU4jQVRUQVIKU1RJQ0tUT09ORVNHVU5TI0xFRVJTCiMjI0FMT0ZUIyNBTE1TI1JPVCMjIwpTVEFMSU4jI1BFVEUjI0xJR0hURVIKTUVMRUUjQ1JBVkUjSk9JTiNFUkxFCklURSNHQVJBR0UjTUFMTFMjQklBUwpMT05HI05FVkVSU0FZRElFI1VQVE8KRU5FUlZBVEUjI0NJTkUjI0JMRUVECiMjI0lBVEUjQVNJREUjS0lFTCMjIwpTTEFOVCMjQUxQTyMjUkVTRUVERUQKVEFUQSNIQU5HSU5USEVSRSNUSVJFCkFWT04jT0NFQU4jUk9CQkVEI01PTApNRU5EI1JJVEUjTUVTQVMjUkVBREUKUFJFQkVORCMjTElLRSMjUklOR0VECiMjI0VMUyNTUEFOIyNTVEVFUiMjIwpTQUxBRCNTVEFORE9ORVNHUk9VTkQKQURPUkUjTE9SRCNESU5BUiNPTk9SCkZBS0lSI0FSTE8jRU5UUkUjVElNRQpFTUlUUyNURUVOI1JPQVNUI1NURVc="},{"title":"5/08/06 WELL-BEHAVED","author":"by Gail Grabowski, edited by Stanley Newman","date":"2006-05-08","grid":"U0lSUyNTQ0FSI1BPUEVTCkFSSUEjUE9TRSNFUlJPUgpHT09EQ1JPV0QjTkVPTlMKQU5UI0xJS0VTI0NPUFMjCiMjI1BJTlMjQVJJU0UjIwpST0RFTlQjRlVFTCNSQVQKRVJFQ1QjI0FDRSMjTkJBClNBQ0sjVElSRUQjQk9PTQpBVEUjI09ORSMjQ1JVREUKWUVOI1dFVFMjUkFJTkVECiMjVEVBU0UjTFVSRSMjIwojRVdFUiNSSElOTyNFTFMKQVRBUkkjQ0lWSUxTVUlUCkRPR0lFI09WRU4jQVJFQQpTTkVFUiNNRVNTI1BPU1Q="},{"title":"5/09/06 HANDLE WITH CARE","author":"by Beth A. Zadman, edited by Stanley Newman","date":"2006-05-09","grid":"QkxBU1QjQUhBI0JSQVQjCk9VU1RTI05VTiNMT1RVUwpCUkVBS0lOR1RIRUJBTksKU0VBVCNOT1MjT05FREFZCiMjI0VERFkjQ0FEUyMjIwpKRVJTRVkjTUFSUyNGR0gKQVZBSUwjI0VTUyNTQVJBCkJFTkRJTkdUSEVSVUxFUwpCUklFI1VSRSMjT05TRVQKQVlOI1NDQVIjU0FGRVRZCiMjI0NBTE0jR0lSTCMjIwpBSVJBQ0UjVEFHI09TTE8KQ1JBQ0tJTkdUSEVXSElQClRJVEhFI1JJTyNNRUFOVAojU0VFRCNBRlIjVVJHRVM="},{"title":"5/10/06 ANNUAL REPORT","author":"by Daniel R. Stark, edited by Stanley Newman","date":"2006-05-10","grid":"SElLRVIjU05JVCNDTEFNCkFOT0RFI05PVkEjTEFORQpUQUlOVCNPUkFMI0VSR1MKIyMjQVVUVU1OTEVBVkVTClBPRCNSQVQjI05PVEFSWQpTUFJJTkdTVEVFTiMjIyMKSEVJUlMjI09LUyNMQUJTCkFSRUEjRkFURVMjQUxJVApXQVJOI0xJRSMjQVNUUk8KIyMjI1NVTU1FUlNUT0NLCkVSQVNFUiMjQ0VPI1NIRQpXSU5URVJQQUxBQ0UjIyMKRVZFUiNJU0xBI0lETEVTClJBWUUjRVNBSSNBRE9SRQpTTEVXI1NUSVIjTFlDUkE="},{"title":"5/11/06 EYES FOR YOU","author":"by Fred Piscop, edited by Stanley Newman","date":"2006-05-11","grid":"QklURVMjQ0FQUkkjSEVNCkFQQVJUI09DRUFOI0FYRQpIT1BJSU5ESUFOUyNXQVMKIyMjS05FRUQjVE9UQUxTCkpBVyNLRVIjIyNMQUlUWQpBQkFTRUQjRE9SRU1JIyMKTUlURVIjTk9WQSNBRkFSCkVERU4jTUFSSU4jTElWRQpTRVJBI0FNSUQjREVWT04KIyNTVEFHRVMjTE9TRUlUClJBS0VSIyMjTk9HI09EUwpFWElTVFMjTU9JU1QjIyMKQUxJI0ZJSklJU0xBTkRTCkxFTiNVTklUUyNFWEVSVApNU0cjTEVGVFkjRElHVVA="},{"title":"5/12/06 LABOR OF LOVE?","author":"by Doug Peterson, edited by Stanley Newman","date":"2006-05-12","grid":"U1FVSUIjTUFHSSNMQVJLCk9VVERPI0FWT04jSVNFRQpTRVJJTyNET1RTI0dBTVkKI1BFT1BMRVdIT1RIUk9XCkZBQ1QjWUVTI01BVFVSRQpBU0gjUkVZI0VORCNMQVMKUkFUSU8jRVNBSSNMRVNUCiMjI0tJU1NFU0FSRSMjIwpPR0xFI1dBVFQjUElBTk8KTkVPI1BJVCNFTE0jUkVCClNUT0xBViNBUkEjS0lXSQpIT1BFTEVTU0xZTEFaWSMKT1ZJRCNMT0tJI0FMT09GClJFTlQjRU1JTCNHRU5SRQpFUkdPI0RFTlkjU0xBS0U="},{"title":"5/13/06 SATURDAY STUMPER","author":"by Merle Baker, edited by Stanley Newman","date":"2006-05-13","grid":"U0FWRVNVUCNCTE9PREVECk9OQUxJTkUjT09ITEFMQQpGQU5TVEhFRkxBTUVTT0YKQUxJQVMjS0FUVCNBSElUClNPTCNPQVNUI0hPTkUjIwojR0xBTkQjRVZFUiNTUEEKU0lBTSNWSURFI1NUT0lDCkFaSU1VVEgjU1dPUk5BVApERUNPUiNPQVRII0VFTlMKQURFI0dBUFMjQVJFU08jCiMjQ0hFVCNTQU1FI0hTVApPVFJPI01FQUwjQU1PQ08KRE9FU0FGTElQRkxPUE9OCkVNQU5VRUwjSElUSEVSRQpSRU1JWEVTI0FCWVNTRVM="},{"title":"5/14/06 CALL COLLECT: Terms for certain collectors","author":"by Fred Piscop, edited by Stanley Newman","date":"2006-05-14","grid":"SElTUyNLSU5FUiNNT0xFIyNUVE9QCk9OVVAjQURPUkUjT1VJSkEjRVJMRQpBTEdBI0JFRVJCT1RUTEVTI0RBTEUKUkVBUiNVU1MjU0tJTSNDSEVEREFSClNUUkVBSyMjIyNST09TVCNOWUUjIwpFU1AjQ0lHQVJCQU5EUyMjQUJJREUKIyNBUEUjT0RJRSMjRVNTI0JFTkVUClJFQ1VUI0RFTUFORCMjQVRMQVNFUwpJTktQQURTIyNORUVEI1JVRVIjIyMKQ1JFQVRFI1BPU1RDQVJEUyNTQ0FSCkhPVCNFQkJFRCMjI1dFSVNTI0hPRQpFTFNBI0JJUkRTRUdHUyNMT1NFUlMKIyMjVU5JVCNTUEFOIyNSRVBMRVRFClRJUFRPRVMjI0FSQUJMRSNIQVNBVApCUk9PRCNZQU0jI1NPT04jSVRFIyMKU0VSR0UjI01BVENIQk9PS1MjTFNUCiMjT1JBI1NBUkFIIyMjI0FUVEFDSApBQlNBTE9NI0lLRUEjTU9OI09CT0UKQ0xJUCNCVVRURVJGTElFUyNTRU5ECkxVVEgjSVNIQU0jQUVUTkEjQ0xFTwpVRVlTIyNIT0xFI1JBVE9OI0FTU1Q="},{"title":"5/15/06 HEIR APPARENT","author":"by Sally R. Stein, edited by Stanley Newman","date":"2006-05-15","grid":"U0FNRSNJREVBI1BBQ0VSCkVSSU4jREVNSSNSRUxBWQpMRU5UI0FDSUQjRVJBU0UKRkFJUlNIQVJFI1BJUEVTCiMjI0FTT0YjI0JBQSMjIwpTVElOVFMjQkVBUkxBSVIKVEFSVFMjRkxBUkUjTU5PCkFMQVMjVEVBUlMjVFVUVQpTSU4jU0VBTVMjUkVTRVQKSEFJUkNBUkUjRElORVJTCiMjI0FJTSMjU0FQUyMjIwpQT1NUUyNTUEFSRVBBSVIKQUJFVFMjT0lOSyNFTFNFCkNFTExPI0FOVEUjRUxMQQpUWUxFUiNQRUFSI0RZRUQ="},{"title":"5/16/06 FAKE FRUIT","author":"by Gail Grabowski, edited by Stanley Newman","date":"2006-05-16","grid":"U0FCRVIjQ0FMTSNIT09QClNUQUxFI09TTE8jT0hNWQpUT05JQyNBVEFEI1RJRVIKU1BBVEUjTElNRVNUT05FCiMjTkVTUyMjQUxPRSMjIwpFUEEjU0VSRSNTUEFDRSMKTEVTIyNFQVRTI1VTSEVSCkxFRSNBU0hIRUFQI0VSRQpTUEFTTSNTSUxMIyNSSUQKI1NUQUlSI0NMVUIjUkVTCiMjI1VTRVIjI01BUlkjIwpQRUFDSEZVWlojQ0FCT1QKT0dSRSNJTElFI0FET0JFCkxBSVIjTkVUUyNMSU1PUwpPRERTI0VESVQjTE9CRVM="},{"title":"5/17/06 AS IT SHOULD BE","author":"by Norma Steinberg, edited by Stanley Newman","date":"2006-05-17","grid":"RkFLRSNNT1ZFUiNTUEFTCk9ET1IjQU1PUkUjUE9NUApST1NBI1JJTEVZI0FMTUEKTVBII0ZJVFRJTkdST09NClNURVZFTlMjI09BVCMjIwojI1JBVEUjQ09MTEFQU0UKQUxGSUUjQlJJREUjUkFXCkdPT04jTUVBTFMjRE9WRQpFR08jU0VBVFMjQ0FQRVIKREVESUNBVEUjR09ORSMjCiMjI05PVCMjQVJFQVJVRwpSSUdIVEhBTkRFRCNOQkEKQU5OQSNFWFVERSNQT09MCkdPQUwjQUxERU4jRFVBTApBTlRFI0RFRURTI0FOVFM="},{"title":"5/18/06 FORECASTS","author":"by Robert H. Wolfe, edited by Stanley Newman","date":"2006-05-18","grid":"Q0xBUCNCTEFCI1BBQ1RTCkFJREUjQUVSTyNBQk9JTApTTk9XV0hJVEUjU0VMTUEKVEVQRUUjI1NJVFMjREVCCkVTVEVMTEEjTk9FTkQjIwojIyMjRk9SRUdPI0FSRVMKUkVIRUFURUQjTEFESURBCkFST0FSI0FJTCNSSU5HUwpNSVRURU4jRk9SU0FLRVMKUEVQRSNBTllPTkUjIyMjCiMjT1JBTkkjTUFOVUFMUwpSQVQjU0FURSMjSU5ESUEKSVNBQUMjUkFJTkNIRUNLClBBVElPI0lTTEUjSUxJRQpTUE9SVCNDRUxUI1BFVFM="},{"title":"5/19/06 DEGREE ADDITIONS","author":"by Donna Levin, edited by Stanley Newman","date":"2006-05-19","grid":"U09GVCNET05VVCNVR0xZClRSSU8jRVBPREUjU09PVApBR0FSI1NFUEFMI1NPTEQKQkFTQUxUQ0VMTEFSUyMjCkFOQ0hPUiMjTElUI0VCQgpUU08jRk9OVCNOVU1FUk8KIyMjU1RZTElOR0JBR0VMCkFTU04jI0VORSMjSUdFVApCQUNPTkFSVElTVFMjIyMKSVNPQkFSI1NMVVIjR0lGCkVFUiNJVE8jI05JS0lUQQojI0NBUkRJTkFMQkFTSU4KSElITyNFTEFURSNMRVNUCk9WRU4jQ0VSVFMjRUxTQQpFWVJFI09SQ0FTI0xFT04="},{"title":"5/20/06 SATURDAY STUMPER","author":"by Doug Peterson, edited by Stanley Newman","date":"2006-05-20","grid":"QU5HUklFU1QjUEFKQU1BCk1PTUFORFBPUFNUT1JFUwpBTEVVVElBTklTTEFORFMKVE9OIyNUUllTVCNOT0xBCiMjI0ZHSCMjIyNJU0xFWQpBVFBBUiNTQUJJTiNEWVMKTUVUUk9QT0xJU0VTIyMjClNUQU1QT0ZBUFBST1ZBTAojIyNTRVNBTUVTVFJFRVQKQVBCI1JFU09EI0lURVJTCkJMT0dTIyMjI01BQSMjIwpMVUdFI0FTUENBIyNNRFQKQVNBTkFMVEVSTkFUSVZFClpFUk9DT1VQT05CT05EUwpFU1RBVEUjU0NBTVBJU0g="},{"title":"5/21/06 RAW MATERIAL: Which you will skillfully process","author":"by Doug Peterson, edited by Stanley Newman","date":"2006-05-21","grid":"TUFDSE8jQ0hFRVRBSCNCQUcjRElTCkFBSEVEI1JFU1BJVEUjVU1BI0FORQpHUk9TU1JFQ0VJUFRTI1JPWiNZU0wKTU9PVCNBU0sjI1BVU0FOI0FWT0lECkFOQ0lFTlQjV0hFTiNURUQjVU5UTwojI0hBTCMjQ1JVREVQRVRST0xFVU0KTU9PI01FUkxJTiMjRUFUSU5HIyMjClBST01PVElPTiNPV0VTI0VUQUxJQQpIT1NFI1JPVUdIUklERVJTI1JBVFMKIyMjQUxFUlQjT0dMRSNJVEFMSUNTCkFNQU5BI0lTT04jU0VFUCNZQUNIVApCSUdTSE9UI1BPR08jTUVBTlQjIyMKQkxPVCNCQVNFUlVOTklORyNJS0VBClJFR1JFVCNJTlNUI0lORVJUTkVTUwojIyNFTEFJTkUjI0FOT1JBSyNQVEEKVU5SRUZJTkVEU1VHQVIjI09QVCMjClBFQVQjTkFXI1RTT1MjSU5TSUdIVApTV0lTUyNXWUxJRSMjRUNPI0xPRVcKSVRTI1VGTyNPRkZFTlNJVkVMSU5FClpPRSNNQVIjVUxVTEFURSNEQU5DRQpFTkQjT0REI1RFTFNUQVIjVVJHRUQ="},{"title":"5/22/06 FLORA FOURSOME","author":"by Gail Grabowski, edited by Stanley Newman","date":"2006-05-22","grid":"UkVQUyNTTk9SVCNFV0VSCkFQT1AjTUFOSUEjUEFMRQpHRU9SR0VCVVNII0FMREEKU0VSSUFMI1NLSVQjTEVECiMjI1RJTEUjU1RJUkZSWQojT1BFTkVEIyNJRE9MIyMKQURPIyNESUJTI0VMT1BFClJPV0VSI0NBVCNTRVdFUgpDUkVURSNUSElOIyNFV0UKIyNSQU1QIyNMRVZFUlMjClBPUExBUlMjVEVBTCMjIwpFTEwjUEVURSNEUkFGVFkKRURBTSNGQU1JTFlUUkVFCktJTkQjRUxVREUjRUFSTApTRVRTI1JFU09EI0RVTVA="},{"title":"5/23/06 TOOL TIME","author":"by Sally R. Stein, edited by Stanley Newman","date":"2006-05-23","grid":"QUhBQiNWT1RFUiNJVENICk1BTEUjRU5FTVkjU0hPRQpGSUxFQU5FWFRFTlNJT04KTUxJI0JVTlQjI09VU1RTCiMjR0xVRUQjQ09SRSMjIwpBV0FJVFMjRlJPTSNQRUEKRE9URSMjUExBWkEjUkFOCkRPT05FU0xFVkVMQkVTVApFRVIjTk9PU0UjI0lTRUUKRERTI1NPUEgjSE9URUxTCiMjI0JJVFMjVE9XRVIjIwpNUkJJRyMjU0FMRSNWQUMKWU9VS05PV1RIRURSSUxMCk5PTUUjQUVJT1UjVU5ETwpBTVBTI1NUUkVQI0VHQUQ="},{"title":"5/24/06 SNAIL MAIL","author":"by Fred Piscop, edited by Stanley Newman","date":"2006-05-24","grid":"QkVSVCNTSEVBUiNBQ0VECkVXRVMjSEFMTEUjTk9ERQpCRU5FRklUU1BBQ0tBR0UKT0xFI0FSRUEjRE9MTEVEClBMRUFTRUQjTUlURSMjIwojIyNJVFMjVEVOI1RBQlMKUEFJTkUjU09SVEEjTE9VCklOU1RSVUNUSU9OQ0FSRApDRUwjU1BSQVQjVE9OR1MKQVdFUyNQQUwjQ09XIyMjCiMjI0FIRU0jQ09JTFNVUApHUk9WRVIjSVJPTiNBUEUKTE9XRVJDQVNFTEVUVEVSCklURU0jVU5JVEUjV0lOSwpCT05FI1RBU0VSI0lORFk="},{"title":"5/25/06 PLAYING THE FIELD","author":"by Doug Peterson, edited by Stanley Newman","date":"2006-05-25","grid":"RFJPU1MjQ0xVQiMjU1BBCllBTFRBI0xBTkFJI0hPTgpFTkRPRkRJU0NVU1NJT04KIyMjUkVJTVMjTUFLRURPClRBQ0tMRUJPWCNESUxMWQpBTEwjWURTI0lQTyNERVMKTE9BTiMjI0lORVJUIyMjCkNFTlRFUk9GR1JBVklUWQojIyNIQUlMUyMjI0FTSEUKQ0JTI1JPRSNDREUjVFVOClJFTkFMI0dVQVJERE9HUwpBTE9UT0YjR1JFRVIjIyMKRk9PVEJBTExMSU5FTUVOClRJUCNFSUVJTyNJR09UQQpTVFkjI0xBU1QjQ1NQQU4="},{"title":"5/26/06 SIMPSONS SPIN-OFFS","author":"by Merle Baker, edited by Stanley Newman","date":"2006-05-26","grid":"UE9TVEUjT1NDQVIjSUxFClJPV0VSI1JIT05FI0ZPWApPUEVSQSNEQVJORURFU1QKIyNMSVNBQU5ET0xJVkVSClZJTCNFTEkjIyMjU0VUQQpIT01FUkFOREpFVEhSTyMKU0NPVCMjI09VUlMjIyMjCiMjQkFSVEFOREJSRVQjIwojIyMjRUFSTiMjI01JTEwKI01BR0dJRUFOREpJR0dTCk9PT08jIyMjVVNFI0VTVApNQVJHRUFOREdPV0VSIyMKQU5USVFVSU5HI0VSUkVECk5FQSNVTE5BRSNMT0FNWQpJRFMjSURFU1QjU1NHVFM="},{"title":"5/27/06 SATURDAY STUMPER","author":"by Daniel R. Stark, edited by Stanley Newman","date":"2006-05-27","grid":"QUNISUVWRSMjV0FMUlVTClJFSU5WRVNUI09SSUVOVApDQU5UQVRBUyNSSVBQTEUKQVNUSSMjI0hBUkQjSE9FCkRFRU1TI0FJUlkjVVJBTApFRERJRSNJUkUjU1BBREUKIyMjREVBTFQjUEhBU0VSClNBRkFSSVMjQlVSR0VSUwpFTEFURUQjVElCSUEjIyMKQUNURUQjSEFUI05JVkVOClBBVFMjVklMRSNLTkFWRQpPUEUjWUlQRSMjI1NMRVcKV09OVE9OI05JQ09USU5FCkVORVJHWSNUT1VSSVNUUwpSRURJQUwjI05FQVRFU1Q="},{"title":"5/28/06 FIRST-RATE: A high-quality puzzle","author":"by Gail Grabowski, edited by Stanley Newman","date":"2006-05-28","grid":"T1BBTFMjRU1JUlMjV0VUUyNPR1JFClBBVElPI1lFTlRBI0FWSUEjUEVFTApTV0VMTEhFQURFRCNURU5TUEVFRFMKIyMjI09NSVQjIyNGVVJUSEVSIyMjCkNBUFRJT04jRElDRVMjI0FQQUNIRQpBQ1JFUyNHT09ERlJJREFZI1NBVUwKU1RJTFRTI09OSU9OI0FCRUQjUEJBClRJTUUjS0FaT08jI0VMVURFI0lDSQpFVkUjU1VQRVJNQVJLRVQjU0FUQU4KREVNSUxMRSMjI1NVRVMjU0NSQVBFCiMjSURPTFMjQkFLRUQjU1RFRUwjIwpBUk5FU1MjQ0FORSMjI1BFTkFMVFkKVVJJQUgjR1JBTkRQQVJFTlQjRUVFClJBUyNFUEVFUyMjQU1PQ08jRVROQQpPVFQjRElFVCNTRVRUTyNTVEFUVVMKUkVFRiNHUkVBVFNDT1RUI09WRVJUCkFEUklGVCMjTkFDSE8jQU1QRVJFUwojIyNUUkFDVE9SIyMjR1JBTSMjIyMKT0xEU0FJTE9SI0ZJTkVHUkFJTkVEClJBTkkjTFVOQSNBTE9ORSNTQ0FSRQpTUEFOI1NFRUsjQkVTRVQjVEVQRUU="},{"title":"5/29/06 QUALITY IMPROVEMENT","author":"by Sally R. Stein, edited by Stanley Newman","date":"2006-05-29","grid":"RkFNRSNUT05BTCNBU0FQCkFGQVIjRVJBU0UjTU9URQpOT05PI0xBVFRFI0FMT1QKR09PREZFTExPVyNaSVBTClNUUkVFUCMjI0FCRVQjIwojIyMjV0FTI0FZRSNBSVIKQURBTSNURU5EI0FGSVJFCkdFVFNUSEVCRVRURVJPRgpFTU9URSNQQVBBI0RFTlMKU09OI0FCUyNUTlQjIyMjCiMjRU1NQSMjI0tPQUxBUwpTSVRFI1NVTkRBWUJFU1QKQVNJUyNTVEFJUiNIQUhBCk1BTUEjRUFTRUQjT1ZFUgpFWUVTI1NIQU1TI1JFU1Q="},{"title":"5/30/06 IN THE KNOW","author":"by Gail Grabowski, edited by Stanley Newman","date":"2006-05-30","grid":"UE9PUiNTQ09QRSMjQkFSCklTTEUjRUxJT1QjRVJJRQpDSEVGI0NPTFRTI1RJREUKU0FHRUJSVVNII0FOR0VMCiMjI1JVRUQjT1BSQUgjIwpERVNFUlRTI0xFSSNUQUMKRUxNRVIjI0hFQUQjRVJBCkFBQSMjUFJFU1MjI1lFTgpMVFIjUkVBTSMjQU1FTkQKU0VUI09BUiNIT0xJREFZCiMjTUFQTEUjRVZFUiMjIwpTVE9ORSNXSVNFQ1JBQ0sKVEFVVCNNSU5PUiNPQk9FCkFSVFMjQU5OVUwjUlVERQpSQUgjI1RFU1RZI1NURVA="},{"title":"5/31/06 THROWAWAYS","author":"by Fred Piscop, edited by Stanley Newman","date":"2006-05-31","grid":"QUZUUyNHQVJCIyNKVVNUCk1FT1cjT1BFUiNUVVJPVwpJTlJFI09TU08jQU5HTE8KU0NSQVBCT09LI1NLRURTClNFRVRIRSNERU5FQiMjIwojIyMjT1JHIyNBUk9NQVMKU1BBV04jQVJNWSNOQVBBCkFSUkFZI0dPTyNFREdFRApGT0dTI1BBTlQjQVNJREUKRU1PVEVTIyNFQVIjIyMjCiMjI0VYSVNUI1NUT1dJVApTTUVMVCNUUkFTSEZJU0gKTEVWQVIjUkFWRSNBUkxPCkFSRU5BI09ET1IjR0VBUgpNRU5EIyNQRU5UI0VSTUE="},{"title":"6/01/06 OPPOSITE ATTRACTION","author":"by Richard Silvestri, edited by Stanley Newman","date":"2006-06-01","grid":"TUVTSCNSRVBFQVQjQU1QCk9OQ0UjT1JBTkdFI1dPTwpXT1JTRUJFVFRFUiNGQVIKRUxBSU5FI0VFTCNHVU5LClJBUFRPUlMjUkVQRUwjIwojIyNBQ1RBUyNTTE9HQU4KQ0xPVEgjQkFTU08jT1dFClJPVUUjI09YWSMjTU9PTgpBTlQjT1RURVIjTEFETEUKV0VBVkVSI1NVR0FSIyMjCiMjVElST1MjUEFOWkVSUwpBQ0hFI0xFUyNUQUlQRUkKUVVPI0JMVUVDSElQUEVSClVMTSNSRVNDVUUjQUlERQpBTEUjT1lTVEVSI05FU1M="},{"title":"6/02/06 LOOK IN THE MIRROR","author":"by Randall J. Hartman, edited by Stanley Newman","date":"2006-06-02","grid":"SE9NRSNERUFSI1BFREFMCkFCVVQjT0dSRSNBR0lMRQpOT1RISU5HSU1QUk9WRVMKREVURVNUI0RJRVMjRVNTCiMjI0xBRFkjTkFOQSMjIwpQQVMjWU9VUkRSSVZJTkcKRUxMRSNJUkUjI1BFVEVSClRJRVMjVElHRVIjUkFWSQpBQkVUUyMjQVBFI1NMRUQKTElLRUFQT0xJQ0UjWVJTCiMjI1NJQU0jQ0xBTSMjIwpTSEUjTElFRCNBUkFCSUMKQ0FSRk9MTE9XSU5HWU9VCkFMVEFSI0VEQU0jSU9OUwpNRUVUUyNUT1lTI0NMQVA="},{"title":"6/03/06 SATURDAY STUMPER","author":"by S.N., edited by Stanley Newman","date":"2006-06-03","grid":"U1VORElBTCNTSEFSRVJTCldIRUVETEUjUEFST0xFRQpJSEFURUlUI0FNSUFCTEUKTVVURVMjVElUTEVERUVEClNIT1JUUyNTRUVTI1JBTQojIyMjI1RXSVNUI01JU08KRU5EUExBWVMjI05JVkVOClNPUlZJTk8jUEhPTkVNRQpDTk9URSMjSk9FTEdSRVkKQVBQUyNNQVVERSMjIyMjClJSUyNCSVJEI1BBRFJFUwpHT09EQVNORVcjR0VFTkEKT0ZWQUxVRSNBTklNSVNUClRJRUxFU1MjR09UT0dVWQpTVFJJREVTI0VEQVNORVI="},{"title":"6/04/06 THE WRITE STUFF: Some prose for you to peruse","author":"by by Shirley Soloway, edited by Stanley Newman","date":"2006-06-04","grid":"Q0FSVFMjU1RBWSNUQUJTIyNKQU1TCk9NQUhBI0xBTEEjT05FUE0jT0JPRQpET1pFTiNFVEFMI1JBVElPI0FMTUEKI1JFQURCRVRXRUVOVEhFTElORVMjCiMjI1NMT1BFI1VUQUgjRERTIyMjIwpHVVMjI1ZFUkIjQURFTiMjQVJUSUUKSU5BU1RJUiNJTlNPTUFOWVdPUkRTClRJVElBTiNBQ0UjI0FFUk8jQklPUwpHT1VOREVSQ09WRVIjI0FVRElCTEUKT05QT1AjWVVMI1NBR0EjREFORVMjCiMjIyNPTkVGT1JUSEVCT09LIyMjIwojSEFJTEUjRlJFRSNMT1cjT1pBV0EKQ09JTkVSUyMjVEVMTElOR1RBTEVTCkNPTUUjVklORyMjR0lMI1JBUElEUwpDSEFQVEVSRUxFVkVOI1BBU1NBR0UKUEFUVEkjI1RBTUUjR1VMRiMjU0VUCiMjIyNSSE8jRElUUyNQQVRDSCMjIwojTUFLRUFMT05HU1RPUllTSE9SVCMKVEFYSSNJRExFUiNBTE9FI0FQQVJUCktJTE4jUkVFU0UjSUdPUiNTSVRBUgpPTEVHIyNST1NTI1JBVFMjRU5FTVk="},{"title":"6/05/06 BUBBLE RAP","author":"by Sally R. Stein, edited by Stanley Newman","date":"2006-06-05","grid":"TU9USFMjQUxPVCNSQVRTCkVMSU9UI1NJUkUjT09IUwpURU5PUiNTQUdBI1VOSVQKU09BUE9QRVJBUyNORVNTCiMjIyNQT00jTkVFRCMjIwpMSVNQI1BCUyNTVFJBUFMKT05UTyNQTFVHI0NPUkFMClNURVAjQUVTT1AjQk9ORQpFUkVDVCNTSE9PI0lTRUUKU09MT0VEI0lEUyNORVNUCiMjI05BSUwjREVOIyMjIwpDSElDI0dVTUVSQVNFUlMKTE9SRSNFUklFI01PVklFCk9NQVIjU0VORCNFTEVDVApQRVNUI1RTS1MjREVTS1M="},{"title":"6/06/06 BIG ENDINGS","author":"by Gail Grabowski, edited by Stanley Newman","date":"2006-06-06","grid":"U0VDVCNHQVJUSCNTVEVXClBBTEUjT05BSVIjSElSRQpBQ0VTI0FOVEVTI0FNSUQKU0hPVEdMQVNTI0ZMRUVTCiMjI0JBSUwjQ1JFRUsjIwpUQU1BTEVTI09VVCNFR0cKQUxPTkUjI0FSRUEjRVJBClBMVVMjQUZURVIjU1BBVApFQVQjQUxJVCMjU0VFVE8KU0hII0ZPUiNTV0VBUkVSCiMjT1JBVEUjTkVBVCMjIwpFUlJPUiNXSEVFTEJBU0UKR09HTyNNT09FRCNFTEFMCkFMQVMjQk9PWkUjTE9MTApERU5UI0FEREVEI1RFRVM="},{"title":"6/07/06 CASHING IN","author":"by Fred Piscop, edited by Stanley Newman","date":"2006-06-07","grid":"U0hJTEwjV0lTSCNQU1NUCkFVRElFI0VSSUUjSUNFUgpHUkVFTlBFQUNFI0VSVEUKU1RBTkRVUFMjUEhSQVNFCiMjIyNFVFMjIyNPQ1QjIwpST0JFUlQjSE9VU0VDQVQKQVVSQVMjREVOU0UjSEJPClNURVQjTUFJTVMjU1BPVApQSUEjSE9SU0UjSEVBVkUKU0VESU1FTlQjR09BREVECiMjRlJPIyMjTElUIyMjIwpNQVJJU0EjQUlSUkFJRFMKRU1VUyNKQUNLTE9ORE9OCkFCSUUjQUlSRSNERUxUQQpESVRTI1hNRU4jU1dFRVA="},{"title":"6/08/06 CELEBRATED STRIPS","author":"by Doug Peterson, edited by Stanley Newman","date":"2006-06-08","grid":"TEVOTyNBTElLRSNDQVNTCkVDT04jUk9MRVgjT0NITwpUSEVGQU1JTFlDSVJDVVMKU09MT01PTiNQT0lOVFRPCiMjI09SUiNQQU5JQyMjIwpNQU5UQSNURUQjI1JFQkEKQUdPI0RJVkEjRFJJTExTCkNBTFZJTkFOREhPQkJFUwpPUFRJT04jVVJTQSNPQVQKTkVFUiMjU1RZI05FV1RTCiMjI0dBTEVTI0dPViMjIwpQUkFJUklFI01BS0VTSVQKREVOTklTVEhFTUVOQUNFCkFOVEkjVEhFTUUjVEtPUwpTT1NBI1NFTk9SI1NFTlQ="},{"title":"6/09/06 TAVERN TALK","author":"by Randall J. Hartman, edited by Stanley Newman","date":"2006-06-09","grid":"TUVHQSNJTlNFVCNCT0FUCkFYRUwjQ09UVEEjRUxCQQpDQU5JR0VUWU9VQUJFRVIKRU1VI0FCRUUjI01PT0xBCiMjRkFWQSMjQVNBUCMjIwpBTExSSUdIVEJVVCNORUUKVElFSU4jRVJMRSNST0FSCk9OQ0UjQkxPT0QjT1RUTwpORVRTI0VMTU8jTVVURUQKRVNTI1NUT1BNRUFUT05FCiMjI0NBU1MjI0RSRVcjIwpTVEFSUiMjQU1JUyNPT0gKTUFLRUlUT05FVEhJUlRZCk9NSVQjSU5UUk8jQVJJRApHRU5FI1BPU0VSI05ZU0U="},{"title":"6/10/06 SATURDAY STUMPER","author":"by Daniel R. Stark, edited by Stanley Newman","date":"2006-06-10","grid":"TE9XVElERSNKVVBJVEVSCkFSRUFSVUcjT05FVElNRQpCRUFNSU5HI0xBVEVSQUwKT0dSRVMjSFVUI0FNQU5BClJBSUQjQ0VSRUFMI0RBWQpFTkUjRUxBTkRTI0pFVEUKUk9TRUJVRFMjUEFVU0VECiMjI1RPTlMjUklDQSMjIwpTSFJBTksjU1VSRU5FU1MKUE9FVCNFTElERUQjTEFPCkVURSNHUkFUSVMjUEVSVQpFTExFTiNNVU0jU0FHQU4KRElTUk9CRSNFTUVSQUxECkVOSUdNQVMjTk9NSU5FRQpERU5TRVNUI1RXSVNURUQ="},{"title":"6/11/06 IT'S ELEMENTARY: A puzzle to test your metal","author":"by by Merle Baker, edited by Stanley Newman","date":"2006-06-11","grid":"TUlEV0VTVCNDQVJDQVNTI1NDQURTCk9DRUFOSUEjQVRFQVdBWSNBTExPVApMT05ET05QQUxMQURJVU0jVE9QU1kKVE5UUyNDRU4jI0RFU0MjU1VTU0VYCiMjIyNNRVJDVVJZVEhFQVRSRSMjIwpGQUNUT1JTI1NPVFMjI0xFTlNDQVAKRVFVQVRFI1NIT08jU01FRSNUT0xMCkxVUktTI1RIRU4jSUNJQ0xFI1BTQQpUQUxFI1dPT0RFTk5JQ0tFTCNQQU4KIyNJTkNPREUjI09UT0UjI0VKRUNUCklHTk9SRUQjU0FMT04jVEVOVVJFUwpNQUdOQSMjQUxNQSMjU1VTQU5CIyMKT1VJI1pJTkNPSU5UTUVOVCNLRUVQCk5DUiNFTU9URVMjUklMRSNQRUVSUwpJSE9QI01NRVMjVEVBTCNNQVJDT1MKVEVOVU9VUyMjU0VFTSNFQVJTSE9UCiMjI0xPTkdKT0hOU0lMVkVSIyMjIwpJU09MREUjRU1VUyMjTEVXI1JFT1MKVE9QT0wjUExBVElOVU1SRUNPUkRTCkFMSUZFI0VMTklOT1MjVFNFTElPVApSRUVGUyNHT0lOR1RPI1NUWUxFUlM="},{"title":"6/12/06 PARKA PARTS","author":"by Gail Grabowski, edited by Stanley Newman","date":"2006-06-12","grid":"UkFURSNWQUlMI0RBV05TCk9SRVMjQU5URSNFTElPVApBSVJQT0NLRVQjUEVOTkUKUkFNI0NBTE1TI0FSRE9SCiMjI0dFTkUjREFSVFMjIwpERUZFQVQjRE9MVCNMRUcKQUxMQU4jI09XRSMjRU1VClRJRVJTI1NVTiNQTEVCRQpFVEEjI1RBQiMjTE9WRVMKU0VDI1NBTFQjU0FCRVJTCiMjT1JBVEUjU09OUyMjIwpJTkxFVCNTSE9ORSNBREUKTUVMRUUjTU9VTlRIT09EClBIQVNFI0VMU0UjQU5USQpTSVJFTiNORUFUI01FRVQ="},{"title":"6/13/06 WHAT'S YOUR SIGN?","author":"by Sally R. Stein, edited by Stanley Newman","date":"2006-06-13","grid":"VEFIT0UjQVNIRSNBQ1RJCkFYSU5HI0ZFQVIjQ0hFRgpLRUVQT0ZGVEhFR1JBU1MKRUxTQSNMSVNBI0xPVFRPCiMjI1RSRVgjI0JVUyMjIwpNT09SRUQjU0FMRVNSRVAKQVBST04jV0FDTyMjRVJBCllJRUxEUklHSFRPRldBWQpPTk8jI0lTRUUjR0VFU0UKUkVTVEFURVMjVFJBREVSCiMjI1JVRSMjUE9FVCMjIwpSQVpPUiNNT0FUI0hPRUQKUFJJVkFURVBST1BFUlRZCk1JTkUjQU5BVCNPUkFURQpTQUdTI0pVTFkjSVNMRVM="},{"title":"6/14/06 SURFIN' SAFARI","author":"by Daniel R. Stark, edited by Stanley Newman","date":"2006-06-14","grid":"V0lTUCNFTEFORCNGTEFXCkFDSEUjTU9WSUUjQVVSQQpSRUFEI01PT0xBI0lDT04KIyNIQURBU1dFTExUSU1FCiMjI05ZU0UjIyNBSEVBRApGT1JURSMjTE9UVVMjIyMKQUxBSSNCRUFLRVIjRkJJCkNJUkNVSVRCUkVBS0VSUwpUT0UjU1RSRUFNI0lURU0KIyMjRUFTRUwjI1NQQVRTCkdSSUVHIyMjQkVFUCMjIwpST0xMRVJDT0FTVEVSIyMKQU1JRSNBVURJVCNST0JTClBFQVIjUFJJWkUjRURJVApIT0RTI1NURUVSI0RFTlk="},{"title":"6/15/06 LONG DIVISION","author":"by Robert H. Wolfe, edited by Stanley Newman","date":"2006-06-15","grid":"U0NBTSNGT09MI05FU1RTCkxPTEEjT01OSSNFVkVSWQpBVUxEI1JBVEUjUkFWRU4KQlJFQUtHUk9VTkQjRVlFClNUWU1JRSMjI1VTU1IjIwojIyMjRFJBUEVEI0VUVEUKQ0FTRUQjTEFORSNMSUFNCkFQUExZI0xJVCNTTUVMVApUT0xEI0FPTkUjVEFTS1MKT1BJRSNTV0VSVkUjIyMjCiMjVFJPVCMjI1JBU0hFUwpCSUwjUEFSVENPTVBBTlkKQURPUkUjT1JFTyNBVkVSCkJFR1VOI1RFUk0jREVNSQpFQVNFUyNTRVRTI0VOWUE="},{"title":"6/16/06 PENCIL PLAY","author":"by Patrick Jordan, edited by Stanley Newman","date":"2006-06-16","grid":"V0FGVCNHTFVUI0hJUkVECkFCTEUjT09OQSNBTklUQQpET09ETEVCVUcjSVNMQU0KRVZBI0FUT01TI1JFRUxTCkRFVEFDSCMjI0lEQSMjIwojIyNTS0VUQ0hDT01FRFkKTU9DS1MjQkVBS1MjTU9FCkVNVVMjRElBUlkjR0laQQpMQUIjUFVMU0UjU1VSRVIKVFJBQ0VFTEVNRU5UIyMjCiMjI0FSVCMjI1ZBU1NBTApTQ0FNUCNBVFdBUiNPUkUKVE9XRUwjU0hBREVUUkVFCkFET1JFI0hBUkUjQVRBRApSRUxBWCNZSVBTI0JBU1M="},{"title":"6/17/06 SATURDAY STUMPER","author":"by Doug Peterson, edited by Stanley Newman","date":"2006-06-17","grid":"Uk9DS0JBTkRTI05JQ0VSCkFUTEVJU1VSRSNBREFOTwpQUklOQ0VUT04jQkVUVEUKU0FOVEUjI1dEUyNBQ0lEClROVCNQU0lTI0lTTEFURQpBVE8jU0laRSNUVUlMTEUKUk9OUyNHQVNHVVpaTEVSCiMjI09PTkEjUkFZRSMjIwpET1VCTEVLTklUI0RPTlMKUklOU0VEI09QRUMjUk9UCkVMTklOTyNVU0RBI0lUTwpTSEVTI05QUiMjTUFHT08KU09SVEEjTElTVEVOSU5HCkVMVkVSI0FTU1VSQU5DRQpERUVSRSNUSEVNQVNTRVM="},{"title":"6/18/06 COMMENCEMENT DAY: With appropriate wordplay","author":"by by Randolph Ross, edited by Stanley Newman","date":"2006-06-18","grid":"QUNNRVMjU1VCSiNFVFRBI01BU1RTCkdFU1RFI0VMRUUjU0hBRCNBVkVSWQpFREdBUkxFRU1BU1RFUlMjR0VUT04KREVSSVZFUyNBTktBUkEjSU5OQVRFCiMjI0xFVklTI0FJREEjU05BRyMjIwpBQkUjU0VOSU9STU9NRU5UI0VDSE8KREVWT1VSI0dOUCMjI0FPTCNTTEFCCkFIRUFQI1VORSNISVBUTyMjI0FMSQpSQU5LI1RIRUdSQURVQVRFI0lTTEUKI1JJTVNIT1QjV1JFU1QjUkFNU0VTCiMjTk9SQUgjU0FSQUgjVE9NQkEjIwpMT0dTSU4jRE9OT1QjRFJTUE9DSyMKRVJHUyNUSElSRERFR1JFRSNSVEVTCk1JTyMjI0FSRUFTI0FZRSNSRUlORQpNT1dTI0lMSyMjI0NJSSNTRURPTkEKQU5OQSNCQVNFQkFMTENBUFMjTllTCiMjI0RZRVMjTUVNTyNFTElURSMjIwpMRVRTQVQjTUlNT1NBI0xFQVBUQVQKSU1FQU4jRklHVVJFU09GU1BFRUNIClNNQUNLI0JBUlMjVVRXTyNMRU5UTwpUQUxLUyNJU0VFI1BJRVIjRVNTRU4="},{"title":"6/19/06 WALKS OF LIFE","author":"by Gail Grabowski, edited by Stanley Newman","date":"2006-06-19","grid":"Qk9MRCNIRU1TI1NMT1BFCkVMSUUjT01JVCNXSVBFUgpFRE5BI1RJTkUjRU5URVIKRklFTERUUklQI0RFU0tTCiNFTlNVRSMjU1BFRCMjIwojIyMjTUFNQSNJTkFCSVQKQ1JJU1AjQUxBTiNORVJPCkxJU1QjVFJJQkUjQ0FJTgpBQ0xVI1JFRUwjVEVSU0UKTkVFRExFI05FTU8jIyMjCiMjI1lPS0UjI0FHQVBFIwpQQVRIUyNXT1JLT0ZBUlQKQVVSQVMjRUxFRSNPQk9FClNUSUxFI1JFQUQjT0xERQpUT09MUyNTT0xPI1RPRVM="},{"title":"6/20/06 DOUBLE TALK","author":"by Sally R. Stein, edited by Stanley Newman","date":"2006-06-20","grid":"QU1FQkEjU0FSQSNUUkFQCkRPWkVEI0NMQVAjUk9CRQpNQVJTSCNPTU5JI0FCRVQKU1RBVEVTVEFURSNJU0xFCiMjIyNSVVQjI0NOTiMjIwpTTE9QRVMjQ1JFQVRPUlMKRUxBTCNBUkFCI0dSVUVMCkxBUkEjTk9TSVIjQVNFQQpFTUVORCNNRVNBI0lUU1kKU0FEVE9TQVkjTEVOU0VTCiMjI1BFQSMjQVBSIyMjIwpGRUxMI01BUkNITUFSQ0gKQVJFQSNTTklUI0lEQUhPClNJR04jT05UTyNOQVNBTApURVNUI05FRVIjRU1QVFk="},{"title":"6/21/06 BED CHECK","author":"by Fred Piscop, edited by Stanley Newman","date":"2006-06-21","grid":"RVRISUMjQUJFVCMjUVVBCklST05ZI1NBR0UjU1VOUwpLSU5HQ09UVE9OI1RFQ0gKIyMjT0xMSUUjU1RFRUxFCkNBRERJRSMjIyNJTk5FUgpBUE8jU09BUiNHTE9NIyMKU1BVUlQjREFURSNQT1NUCkVMQkUjQ0FERVQjQVRUQQpZRUxQI0VNSVIjQURIT0MKIyNFUklFI0lNQUMjRUxLClNFRUlOIyMjI0NBUlJFWQpBTEFTS0EjSEVEREEjIyMKUklHQSNUV0lOQ0lUSUVTCkdBTEwjTUlMRCNBU1RSTwpFU0UjI1NFVFMjTk9TRUQ="},{"title":"6/22/06 PUCKER UP","author":"by Doug Peterson, edited by Stanley Newman","date":"2006-06-22","grid":"Q09CUkEjSEFaRUwjQkVHCk9STE9OI1VCT0FUI0FETwpCTFVOREVSQlVTUyNLRU4KQllFTk9XI0FOWSNaSU5HCiMjI0lSRVMjREFNT04jIwpIQUxFUiNLSVNTSU5HRVIKRUxJI0FDSUQjUFJFU1RPCkFCQlIjQVRBUkkjRE9IQQpEVVJFU1MjSE9FUiNERUwKU01BQ0tFUk9PI0FXQVJECiMjUkFJU0UjTVVURSMjIwpRVElQI1RJRSNTRUVTQVcKVVNBI0hVTlRBTkRQRUNLCklBTiNFRElUUyNQRVRFUgpEUlMjTVlOQUgjR1JBU1A="},{"title":"6/23/06 IT'S ACADEMIC","author":"by Merle Baker, edited by Stanley Newman","date":"2006-06-23","grid":"VklTQSNKUEVHI1NBV0VECklDVVMjT0xFTyNRVUlURQpCQUNIRUxPUlNCVVRUT04KSU5IRVJJVCNIRUlSIyMjClNTQSNSRVpBI0NSWUlORwpUT1NDQSMjU0FLRSNNT0UKIyMjRU5ST1VURSNGQURFCiNNQVNURVJTQVRBUk1TIwpURVhUI1NDVVRUTEUjIyMKQUdFI05DQUEjI0NFU1RBCk5BU1NBVSNMQVZBI0NXVAojIyNBQkVUI0hJUEJPT1QKRE9DVE9SU0hPU1BJVEFMClNBSElCI0tBTEUjUklDRQpUUkVFUyNTVERTI0RBVEU="},{"title":"6/24/06 SATURDAY 26 DOWN","author":"by Daniel R. Stark, edited by Stanley Newman","date":"2006-06-24","grid":"UFJFUEFJRCNLSU5HUElOClJFTUFSUlkjSVNPTEFURQpJVEFMSUFOI0JBUk9ORVQKQ0lORVMjQUdPI1NNQVJUCkVSQSNFTk1BU1NFI01BTApTRVRTI0VJR0hUI1BBVEUKI0RFQ0VJVFMjVU5VU0VECiMjI1JPVEUjU01VVCMjIwpTUExBU0gjQ0FQVFVSRSMKQ1JBTSNFQ09MRSNQRVRTCkhBTSNBUlJFQVJTI0ZBQQpFTEVDVCNFTkQjUExVR1MKTUlOVVRJQSNCUlVJU0VTCkVOVFJBTlQjQUlSRkFSRQpSRVNFUlZFI1JBVFRMRUQ="},{"title":"6/25/06 HOME MOVIES: Stars of films with something in common","author":"by by Fred Piscop, edited by Stanley Newman","date":"2006-06-25","grid":"TUFDSE8jU0VQSUEjTE9DSCNPVkVSCkFST0FSI0FNSVNTI0FTSEUjUklERQpKT0hOQkVMVVNISSNUSEFXI0lOR0UKQURPUyNWSVNBI05PVEVSI05PQ0FMCiMjI09MSU4jI0xJTkVBTCNBTEVSUwpUT01NWUxFRUpPTkVTI0lCU0VOIyMKQUxJQ0VTI1dJUkVTI0VaUkEjVFJJCkdBTEFTI01FTEQjI0lERUEjU1BBTgojIyNCT0dBUlQjQURNSVQjI1RSSUcKQVJCI0FSUlMjQlJFQVRIRSNBSURFCkNPT0tQT1QjR0FMRU4jRVZJTkNFUwpDT1JFI1dJWkVORUQjQ1JBTSNFRFQKRU1JVCMjTklORVMjUEhPTklDIyMjCkRJU1QjU0xPVCMjQkVFTiNUQVJPVApFRUsjQUxBTiNNSUxMRSNCQU5BTkEKIyNBTExPVyNXQUxURVJNQVRUSEFVClNQUkFUI1JVUkFMUyMjT0xFTyMjIwpXRUxUUyNFUElTQyNPQVRTI05BREEKQUxPRSNBTlRTI0xPTkNIQU5FWUpSClJFRlMjU0NPVCNBRklSRSNVU0VJVApERUZUI0hFTlMjREFURVIjTUVTQVM="},{"title":"6/26/06 NOSTALGIC","author":"by Sally R. Stein, edited by Stanley Newman","date":"2006-06-26","grid":"REVGT0cjV0FHRSNHT0FUCklWQU5BI0lURU0jT0dSRQpNRU1PUllMQU5FI09MRVMKRVJFI0xBRERFUiNERU5UCiMjI1dJTkUjI0dIT1NUUwpVTlBBQ0sjU1RFQUwjIyMKUkVMWSNFQkFZI0lERUFMCkdSVUIjRFJJUFMjRFVLRQpFREdBUiNBTEVDI0FSSUEKIyMjQ09BVFMjUkFZT05TCkJBTktFUiMjU0VXUyMjIwpGTE9XI0FaQUxFQSNBTVAKTEFTSCNSRU1JTklTQ0VTCkFNSUUjQVRPTSNUQVJUUwpUT1JOI1RBS0UjU1dFRVQ="},{"title":"6/27/06 HIDDEN ONES","author":"by Gail Grabowski, edited by Stanley Newman","date":"2006-06-27","grid":"U0NBTSNTTkFJTCNTSE9XCkVMTEEjTElCUkEjVElERQpMRUVSI0VMSUFTI09WRU4KTUFSSU9ORVRURSNORVNUCkFUVEVORCMjRVJMRSMjIwojIyMjU0VFUCMjQVdBUkQKVEFDSCNSWUFOI1JBVElPCkJST09NI0VSQSNEUklQUwpTRUlORSNESU1FI0VQRUUKUEFORVMjI1NFQ1QjIyMjCiMjI1lBTEUjI0xPQURFRApTTElNI0FVQ1RJT05FRVIKVE9ETyNEUk9PUCNEQVJFCkFSTE8jTE9BTlMjRUxJQQpURUVOI0VTVEVFI1NURU0="},{"title":"6/28/06 TAKE A BREAK","author":"by Fred Piscop, edited by Stanley Newman","date":"2006-06-28","grid":"SE9QSVMjQVNUSU4jUkFQCk9QQVJUI0RFUk1PI09MQQpSQUNLQU5EUlVJTiNERU4KQUxFI0JVTEIjVEFCQVJECiMjI05JS0UjTUFHRU5UQQpQQVJPTEUjUkVUT0xEIyMKQUJPREUjQkFUT04jUk1TClJJQ0UjTEFURVIjUEVFTApFRUsjV0lSRVIjR0VFU0UKIyNBQkFURUQjUFJFTEFXClNFTkFURVMjQ0FJTiMjIwpMQURERVIjU0xJRCNCT0IKT1JSI1JBTlRBTkRSQVZFClBMWSNFVEhFUiNFVUJJRQpFWUUjREVMVEEjUkVBRFM="},{"title":"6/29/06 QUESTIONABLE","author":"by Donna Levin, edited by Stanley Newman","date":"2006-06-29","grid":"UE9PSCMjRUFTRUQjT0hNCkVBVkUjSU1NVU5FI05FRQpXSEVOU0RJTk5FUiNFUkEKU1VSI0hFTEkjI0lGTk9UCiMjV0hPU1lPVVJEQUREWQpDQVJST1RTI05PRUwjIyMKQUxJU1QjI09VVERBVEVECkxFVCMjV0hZTUUjI0lMTwpGUkVFQklFUyMjR0FNSU4KIyMjWU9HQSNNQUVXRVNUCldIRVJFU1RIRUJFRUYjIwpST1ZFUiMjQVNPSyNMSVAKT1VJI1dIQVRTTVlMSU5FCk5TQyNBRFZFUkIjQkVUUwpHRVQjUkxFU1MjI09TTE8="},{"title":"6/30/06 MATERIAL MOVIES","author":"by Patrick Jordan, edited by Stanley Newman","date":"2006-06-30","grid":"QVNBUCNTQUJMRSNGTE9QClZBTEUjQUxMRU4jSU9XQQpBUklEI0JMVUVWRUxWRVQKU0FLSSNPQVQjI0ZMRVNIClRIRUNPVFRPTkNMVUIjIwojIyNVUFMjI1NPQVBJTkcKU1BVUlQjVFJZU1QjUklPCkFPTkUjRkVJTlQjRUROQQpHT0QjQkxBTkMjQVNTRVQKU0hFQkVBUiMjU09UIyMjCiMjU0lMS1NUT0NLSU5HUwpBUklBTCMjT1JBI01PUkUKSkVSU0VZR0lSTCNBUEVYCkFERUUjT0xMSUUjVEFURQpST0RTI05PRU5EI0VSQVM="},{"title":"7/01/06 SATURDAY STUMPER","author":"by S.N., edited by Stanley Newman","date":"2006-07-01","grid":"VEVBUlNUQUlOI0lNQUNTCkFOVElQQVNUTyNSRUxJVApQSVBTUVVFQUsjQUVUTkEKSURMRVIjI0xJT05LSU5HClJPQVIjQVNJQU4jI1RBTgpTS1kjSFVMQSNUUkFVTUEKIyMjQ1VUSU4jSE9MRE9OClNDQUxMT1AjREVTQ0VOVApLT1BFS1MjQ0FTRVMjIyMKSU1QT1NFI05JTFMjVEJBClRFTCMjQVJUU1kjQklPUwpUU0lOR1RBTyMjU0xFRFMKSURFQUwjSVdBTk5BU0VFClNVUkdFI01FRElBS0lUUwpIRVNTRSNJUlNBR0VOVFM="},{"title":"7/02/06 TRAVEL PLANS: In appropriate order, by the way","author":"by Sally R. Stein, edited by Stanley Newman","date":"2006-07-02","grid":"QkFET0ZGI1BSSVNTWSNBTElTT04jCk9SSU9MRSNMVUNJVEUjQkFST05FVApXSVRIT1VUQU5ZUkVTRVJWQVRJT04KTEVUIyNERU4jI1NUT0xFUyMjT05UClNMT01PI05FQVIjU1JUQSNPV04jIwojIyNBQlVUI0JFRCNOT1MjUE9TU0UKVEFLRVNUSEVTSE9XT05USEVST0FEClJOQSNFQVNUI0FTSCMjI0VORFVSRQpPTlJVU0gjSFVCI0FDQ1JBI1NQQU4KTVVNUFMjRklOI0FDQ09TVFMjIyMjClBMQUNFREFDSEVDS0lOVEhFTUFJTAojIyMjREFEQUlTVCNJQ1UjTEFVUkEKVFJPVCNZRUxQUyNGSUUjVUxUUkFTClNPTk9NQSMjI0FNQSNSRVBPI0FUVApQQUNLSU5HVVBZT1VSVFJPVUJMRVMKU05FRVIjSU5BI09ORSNBTlRFIyMjCiMjQU5BI0JDQ1MjQVhJUyNTQVBJRApQUlkjI0ZMVUVOVCMjREVFIyNVTkkKQ0hFQ0tPVVRDT1VOVEVSQ0xFUktTClNFQUZJUkUjQVJCT1JTI0hPTUVFQwojQVJPTUFTI1JFRURJVCNPVFRFUlM="},{"title":"7/03/06 OFF-WHITE","author":"by Gail Grabowski, edited by Stanley Newman","date":"2006-07-03","grid":"U1dBUFMjU05BUCNDUkFCCkhBREFUI0hFUk8jUkFDRQpJVk9SWVRPV0VSI0VJUkUKUEVSI0xFT1MjVFJBREVSCiNSRVBFTlQjU0lBTSMjIwojIyNFU0UjU0xPVENBUiMKU09EQSNUQUxPTiNIQVVMCkNIRVIjI0xJUCMjRVJMRQpISUxMI1RPTkVSI0VQRUUKI09MRFNPTkcjQURTIyMjCiMjI0lTTEUjU05FRVJTIwpTSE9WRUwjU0VDVCNBUEUKVEFQRSNCT05FSEVBREVECk9WRVIjQUxVTSNTTEFORwpQRU5TI1JFQlMjVEFSRFk="},{"title":"7/04/06 SIGN HERE","author":"by Sally R. Stein, edited by Stanley Newman","date":"2006-07-04","grid":"R1JJTU0jTEFORCNQQVNUCkhFTkNFI0FMQUkjSE9QRQpJTkNBUyNXRVRTI0RST1AKSk9ITkhBTkNPQ0sjVE9FCiMjIyNFVFMjI1VOU0FGRQpIQUlSRE8jVklTSVQjIyMKQUNSRSNNQUlOI0ZPVUxTClRIT01BU0pFRkZFUlNPTgpTRU5PUiNBV09MI0VTU08KIyMjVkVFUlMjQU5EUkVXCkFQUEVBUiMjRElFIyMjIwpWSUUjU0FNVUVMQURBTVMKT0FSUyNTQUtFI1JPQk9UCklOSVQjRVlFRCNFVklUQQpET0xMI1JPU1MjREVURVI="},{"title":"7/05/06 SPEEDING","author":"by Fred Piscop, edited by Stanley Newman","date":"2006-07-05","grid":"TEFGRiNHUklUI0FXQVNICkFSSUEjUkVMTyNERUxUQQpUU0VUU0VGTFkjT0FURVIKVE9OI0FURSNTRVJSQVRFCkVORFVTRVJTI01FQSMjIwojIyNOSEwjRVRFUk5JVFkKI0FTRUEjQkFFUiNEUkVEClBMRUEjQUxMRVkjVEFOUwpPUEVSI0xFQU4jUEVOVCMKV09STkRPV04jU1JBIyMjCiMjI0VSTiNUSEVPUklaRQpIT1RET0dTI09MQSNORVQKQURPUk4jVFdPRU1EQVNIClNFR1VFI0VWRU4jQU5USQpUUkFOUyNNQVlBI0RFU0M="},{"title":"7/06/06 EXIT LINES","author":"by Robert H. Wolfe, edited by Stanley Newman","date":"2006-07-06","grid":"UE9QRSNBRE9TI0JBTFNBClVSQUwjVkFOUyNBVEVBTQpQQVJUVElNRVIjU0xBS0UKQUxTT1JBTlMjSEVBVkVOCiMjI05FVCMjUEFTU0UjIwpUQUcjU0VBUE9SVCNBSU0KQUxPRVMjTUlTVCNBTU1PClNPRkEjVElOVFMjQkFBUwpUSE9VI0FOVEkjU0VSR0UKRUFSI1NIT09UQVQjS0VZCiMjQUNUT1IjI1RFTCMjIwpNQVNISUUjQ1VUTk9JQ0UKQVRPTEwjVEFLRU9GRk9OCkNBTk9FI0lERVMjQVNUTwpFREdFUyNQU1NUI1RPU1M="},{"title":"7/07/06 TRIFECTA","author":"by Merle Baker, edited by Stanley Newman","date":"2006-07-07","grid":"U1RBQiNFQkJTI0JFS0FBClBVUlIjR0xVVCNFWElUUwpFTEVFI0dFUkUjUkFOVE8KV0lOQUNDRVBUQU5DRU9GClNQT0tFVVAjI0JJVCMjIwojIyNOQVAjRkxPRSNPUkEKQVNIRVMjVFJPSSNJUk9OClBMQUNFVEhFQkxBTUVPTgpTVU5LI0hFUk8jSVBPRFMKT1JLI0ZSRUUjU1NSIyMjCiMjI1RBVSMjQ0FMT1JJRQpTSE9XSU1QUk9WRU1FTlQKSFlQRVIjVE9ETyNQUkFUCklERUFMI0FWRVIjVFVOQQpQRVNLWSNIRURZI1VORVM="},{"title":"7/08/06 SATURDAY STUMPER","author":"by Daniel R. Stark, edited by Stanley Newman","date":"2006-07-08","grid":"QkxPU1NPTSNKQVZFTElOClJFQ0xJTkUjT1JFR0FOTwpBVFRJUkVEI0xFTkdUSFMKU1RBVEUjSUxJQUQjVEFJCkhVR1MjU1RJRVMjUklMRQpFQ08jQVBBUlQjTEFDRVMKUkVOT1ZBVEUjV0lERVNUCiMjI0dPUkUjVEFDTyMjIwpDSEVSSUUjQkFOS05PVEUKTElORUQjQkFLRVMjVk9OCklMRVMjVFJJRUQjR0VOVApFTE0jUE9FVFMjVkVSTkUKTkFJVkVURSNPTkFURUFSClRSRUFURUQjRk9MSUFHRQpTWVNURU1TI0ZSRVRURUQ="},{"title":"7/09/06 FLAVOR-FULL: Just the right recipe","author":"by Gail Grabowski, edited by Stanley Newman","date":"2006-07-09","grid":"U0NST0QjUkFORyNPRERTIyNQQVNUCkFMSUNFI0VMQkUjUkVVUCNQTFVUTwpTQUdFQURWSUNFI0VMQUwjUkFEQVIKU01BTExFU1QjU0FMVExBS0VDSVRZCiMjI09UQiMjI0VMU0EjVFlQRSMjIwpDT1NUI1NDQVIjTEVTUyNPTERQUk8KT1BVUyMjQU5JTUUjI0FMVEEjRUVLCkxBRyNNSU5UQ09ORElUSU9OI1BUQQpUUkFERVIjRUVSI09ERVMjI1NQQVkKU1RSQVRBI0RSRUFNUyNUUkFDRVJTCiMjQ1JBVEUjI09CSSMjU09MQVIjIwpTUE9JTEVSI0VWRU5FRCNET05VVFMKQ0FBTiMjQUdFRSNBVEUjSU5TUE9UClJVVCNCQVNJTFJBVEhCT05FI1BJRQpVU0UjT1JFTCMjU0VFUlMjI0ZFTFQKQkVETEFNI0FCRVQjTEFTUyNBUkVTCiMjI0FUT1AjT0xJTyMjI09XTiMjIwpHSU5HRVJST0dFUlMjUElOQUZPUkUKVUxDRVIjSU1BQyNDVVJSWUZBVk9SCkxJQVJTI01PUlQjQVNFQSNUUkFMQQpQRUFTIyNQT1RTI1JPWVMjU0VMTFM="},{"title":"7/10/06 WOODWORK","author":"by Gail Grabowski, edited by Stanley Newman","date":"2006-07-10","grid":"UkFEQVIjQk9PTSNBUkVBCkVST0RFI0FMTUEjVEVNUApBTE9PRiNURUFSI0xBQ0UKUE9SI0ZMT09SVFJBREVSCiMjUFJFRU4jI1lFU1lFUwpTVFJJREUjUEFSRSMjIyMKQVJJRCNLTk9CI0RJVFRPCkdBWkUjU0FMRVMjU0FJTApFTUVSWSNNT1RFI0FCTEUKIyMjI09SRVMjV0hBTEVTCkFMQVNLQSMjUEVBQ0UjIwpERUNLT0ZDQVJEUyNMT1UKTUFSRSNUT05FI1NQQU5TCklTRUUjRUFUUyNMQU5DRQpURVNUI1JURVMjRUxERVI="},{"title":"7/11/06 CELEBRITIES OF THE MONTH","author":"by Sally R. Stein, edited by Stanley Newman","date":"2006-07-11","grid":"U1VNUyNTTFVNI1NBSkFLClRSRUUjQ0FORSNFWFVERQpJU05UI09ERFMjQUxMQVkKUkFVTEpVTElBI1NFRU1TCiMjI09BUkVEI0hJU1MjIwpNQUpPUiMjI1NPRCNWRUcKT05VUyNFTEFQU0UjRVZFCk9HTEUjSlVMSUUjRlJFRQpFTEkjTEVHRU5EI0lOTlMKRE9PI0FDRSMjI0NSRVRFCiMjR1VTVCNDQVJEUyMjIwpTV0FOUyNKVUxFU1RZTkUKSEVMTE8jVVJHRSNBTUVSCk9MTElFI0xJRVMjSUNFUgpQTE9UUyNZT1JFI0RBRFM="},{"title":"7/12/06 ON THE CIRCUIT","author":"by Kevin Donovan, edited by Stanley Newman","date":"2006-07-12","grid":"T0ZGI0FERFRPI0FWQUlMCkFMSSNMQVVSQSNWRVJESQpTT04jSU5ORVJDSVJDTEUKSVJBI01BS0UjSEFTSEVEClNBTE1PTlMjQklURSMjIwojI1JBTkcjUEVTTyNWQUwKRU1PUlkjRElWRVJTSUZZCkxBVUQjSE9URUwjQUNSRQpNVU5JQ0lQQUwjQUxUT1MKT0xEI0FMRVMjQUxTTyMjCiMjI0FSVFMjQVRMQVJHRQpPVkVSRE8jQUxPRSNZRU4KV0VERElOR1JJTkcjTFRECkxJTkVOI1BJRUNFI0FURQpTTEFORyNTQU5FUiNQT0Q="},{"title":"7/13/06 BEST REGARDS","author":"by Daniel R. Stark, edited by Stanley Newman","date":"2006-07-13","grid":"RE9MVCNSSU5HI09QVFMjCkFSSUEjSURPTCNDUlVFTApIRU1TI0ZMVUUjVElCSUEKTE9PS0FMSVZFI09WRU5TCiMjIyNCRU5FIyNQQVJFUwpTTk9XWSNHQU1CSVQjIyMKQ09BUlNFI1VNQSNFUEVFCkFSVElTVFMjSU5TRUFNUwpCQVNTI0FBQSNTVFlMVVMKIyMjVE9TU1VQI1JFRVNFCkNSQVdMIyNERVNJIyMjIwpIT0RBRCNWSUVXUE9JTlQKQU1BVEkjQUJMRSNTQ0FSClBFTkNFI1NMRUQjTEVJQQojT09IUyNFWVJFI09STFk="},{"title":"7/14/06 FOR BASTILLE DAY","author":"by Donna Levin, edited by Stanley Newman","date":"2006-07-14","grid":"U0FTRSNQUkFEQSNURUFLCklCQVIjT0lMRUQjU0FOQQpDUkFETEVPRkxJQkVSVFkKS0FCT09NIyNUT09UU0lFCiMjI0NPU1RTI1NSUyMjIwojTUFUVCNIQUwjR0VUSVQKVElUTyNHRU1JTkkjUk5BCkFTT1JUT0ZFUVVBTElUWQpMRU4jUkFUT1VUI0FDSEUKQ1JFUEUjU0xPI0RJS0UjCiMjI0VCVyNEUk9JRCMjIwpIT1RTRUFUIyNDT0lMRUQKR1JFRUtGUkFURVJOSVRZCldFTlQjVEVUUkEjVE9SRQpZT0RBI1NFRUlOI09ORVM="},{"title":"7/15/06 SATURDAY STUMPER","author":"by Merle Baker, edited by Stanley Newman","date":"2006-07-15","grid":"QlJBTkFHSCNTQ0hFTUFTCkxPUkVMRUkjUEFUUklDRQpFU0NBUEVSI0VOU0lMRVMKQVNUUk8jT0hOTyNLSVRUClJJSVMjUkhPREVTI0VPRQpFTkMjVFJJTVMjSEFVTlQKRElTVEFTVEUjSklOWEVTCiMjI0FYVE9HUklORCMjIwpVUkFOSUEjUkVNTkFOVFMKTklTQU4jRk9BTVkjQU9MCkNQTyNHT0FXUlkjUElOQQpMSUZUI0FSTkUjVkFMRVMKQU5ORVRURSNORU9MSVRIClNUT05JRVIjREVURU5URQpQT1dERVJTI1NMRURHRVM="},{"title":"7/16/06 BUSTED!: With the theme revealed at 103 Across","author":"by Fred Piscop, edited by Stanley Newman","date":"2006-07-16","grid":"QVNTRVQjRVRBUyNST01QI1NBU0hBCkNBUFJBI0pVTkUjSURPTCNUUkVBVApDTEVBUiNFUlRFI0JPTkEjTEFDVE8KVFNFI0JVQ0tJTkdCUk9OQ08jUkVNClNBRERFU1QjIyNSRVNUI09VVEVSIwojI0xPTEEjQ0FTRUQjT0JPSVNUIyMKU1BJRUwjUkFTUFkjS05BUFNBQ0tTClBPTVMjTUVTVEEjREVJQ0UjUk9XRQpFTEkjQkFUVElOR1JFQ09SRCNEQU4KQ09USUxMSU9OI1JBTiMjI1VQRU5ECiMjI1JVTEVSI1RJTSNHQU1NQSMjIwpSQURBUiMjI1dFRSNBUlJFQVJBR0UKQlJPI0JJTExJQVJEQkFMTFMjREVNCklMTFMjTk9FTFMjUk9WRUQjU0NBTQpTT0xFUFJJTlQjTkFWRVMjVElBUkEKIyNBUk9VTkQjREVURVIjRklMTSMjCiNCUkFUUyNBTkVXIyMjSkFDS1BPVApCVUIjVEhJTkdTVE9CUkVBSyNBUkUKT0xJVkUjU0VBVCNQRU9OI0VNSUxFCkFCTEVSI05BSVIjRVRPTiNUQUdPTgpTQUxUWSNUUk9ZI0NBS1kjU09OTlk="},{"title":"7/17/06 PAIRS OF FIVES","author":"by Gail Grabowski, edited by Stanley Newman","date":"2006-07-17","grid":"Q09WRSNTVEFUI0FTU0VUCk9WQUwjQVVSQSNTSUxMUwpNRU5VI0dSSU4jQ0xBTVAKQlJJREVBTkRHUk9PTSMjCkVEU0VMIyMjTE9UI0JPTwpET0gjUEVSTUVEI0xBS0UKIyMjV0FZTkUjI1NPTkFSCiNIT1JTRUFOREJVR0dZIwpNSU5FTyMjU0FZTk8jIyMKRVZFTiNUUkFERUQjR0FCCkxFUyNMRUUjIyNBQkFURQojI1RSSUFMQU5ERVJST1IKT0xFT1MjSVNFRSNBTk5FCkRFUE9UI0NJVEUjU0VDVApESVNLUyNTQVNTI1NURVM="},{"title":"7/18/06 SOON ENOUGH","author":"by Sally R. Stein, edited by Stanley Newman","date":"2006-07-18","grid":"Q0xVRSNDVUZGI1NQT1RTCkhJTFQjT1NMTyNURVBFRQpJTlRIRU5FQVJGVVRVUkUKTUVSSVRTIyNHRU5FU0lTCkVOQUNUI0VERU4jIyMjIwojIyMjVVBTRVQjRkFLRVMKRVJBUyNSUE0jU0FUSVJFCkJFRk9SRVlPVUtOT1dJVApCQVJMRVkjVFJJI1BJTlMKU1BPT0YjU0VORFMjIyMjCiMjIyMjRVREUyNPUEFMUwpBVFBFQUNFIyNUUkVCTEUKSlVTVERPV05USEVST0FECkFCQVRFI0VSSUUjUFVNQQpSQVRFUyNEQU5FI1NUQU4="},{"title":"7/19/06 CROSSING WORDS","author":"by Fred Piscop, edited by Stanley Newman","date":"2006-07-19","grid":"QVRMQVMjR0FCRSNCUkVECldPT0RZI0FTRUEjQk9MTwpMT0dPTiNNQUFTI1FVSVQKU1RPUFRIRVBSRVNTRVMjCiMjI1RITyMjRFVIIyMjIwpKQUdTI09QVCNQT1RBU0gKVVRFI1NDT1JFI1ZBTk5BCkxPT0tUSEVPVEhFUldBWQpFTkRFUiNUT1RBTCNBUkUKUEVFV0VFI1BFWiNQUkVTCiMjIyNFTFMjI0VSRSMjIwojTElTVEVOVE9SRUFTT04KRk9OVCNWT0lEI1NIT1ZFCk9OQ0UjRVJHTyNURUxFWApSRUFNI05FRVIjU05PUlQ="},{"title":"7/20/06 HUGS & KISSES","author":"by Shirley Soloway, edited by Stanley Newman","date":"2006-07-20","grid":"V0FTUCNDVUJBI1BBU1MjCkVQRUUjT1JBTCNBVEFMTApCT1hTUFJJTkcjUk9YSUUKU1BZS0lEUyNBTEFNT0RFCiMjI1lFQSNSRUFEI1BFUgpESU4jVFlORSNHT1NIIyMKQU1JVFkjT0JOT1hJT1VTClRBWEkjT1ZBTFMjQU5USQpFWE9ORVJBVEUjU01FQVIKIyNORVhUI0VSTEUjU0hFCkZJVCNPSE9TI0FUVCMjIwpBREFQVE9SI0FTVFJJREUKQ0FQUkkjRk9YSE9VTkRTClRIRU9DI0VMTEUjQ09BVAojT1NTQSNPREVTI0VOWUE="},{"title":"7/21/06 RISK MANAGEMENT","author":"by Patrick Jordan, edited by Stanley Newman","date":"2006-07-21","grid":"QkFMTVMjRkVTUyNQSVRICkFTSUFOI0xBTEEjRVpSQQpMT1JOQSNBVE9OI1RPSUwKSUZBVEZJUlNUWU9VRE8jCiMjI0xVQ0UjSE9XTCMjIwpKQU5FI0FTUyNTTEFJTiMKVVpJI1RSSUFMI0VORFVQClNVQ0NFRURET05UVEFLRQpUUkVBRCNFTFZFUyNIRVAKI0VSTklFI1lFQSNET1NFCiMjI0RVTUIjU1RBWSMjIwojQU5ZTU9SRUNIQU5DRVMKR0xPQiNUQUxFI0hBTExFCkFTVEEjRVZBTiNFTUFJTApCT0VSI0RPTkUjRE9XRUw="},{"title":"7/22/06 SATURDAY STUMPER","author":"by Daniel R. Stark, edited by Stanley Newman","date":"2006-07-22","grid":"QU1JQUJMRSNSRUNPVkVSCkJBTkRJRVMjRVhBTUlORQpBUlNFTklDI1JJUFNPRkYKU1RPUFMjQU1VU0UjTE9VCkhJTFQjQkxVTlQjQkVSVApFTkUjRFVBTCNTQ09OQ0UKRElTU0VDVEVEI1JBVEVECiMjI0VBU0UjUk9VVCMjIwpVVFRFUiNTVEFORFNQQVQKUFJJREVTI1JJQ0UjUlVFCkRJQlMjSU5BTkUjTU9STgpBUEUjU0xVTVAjTElNT1MKVE9UQUxFRCNJUk9OT1JFCkVMQVRJTkcjUEVTRVRBUwpESU5FVFRFI0VWRVJFU1Q="},{"title":"7/23/06 IN OTHER WORDS: Two clues for two different meanings","author":"by Merle Baker, edited by Stanley Newman","date":"2006-07-23","grid":"QkRSTSNTRU5UI0ZMT1BQWSNNTUVTCkFSRUFDT0RFUyNSRUNPUkQjQ09SQQpCRVNUT0ZUSEVCRUFUTEVTI0dSSU4KSVNUSE1JIyMjRVNTQVlTI1RSRU5ECkVTTyNCQVRTTUFOIyNHQVNSQU5HRQpTWU5TIyNIRUFET0ZIT0xMWVdPT0QKIyMjRUxNSVJBIyNBRU5FQVMjIyMjCkJSSVRBSU5TTUlMTFMjIyNUQUxDIwpSRVRBSU4jIyNTQUwjUEFTU0JPT0sKSUxFI05PVEFPTkUjTFVMVSNVR0xJCkJBUktFUk9GSE9SUk9SRklDVElPTgpFQkFOI0NVRVMjVEFYUkFURSNDR1MKREVUT05BVEUjR0VOIyMjU0xPQU5FCiNMRVRPIyMjTVVTSUNBTE1FRExFWQojIyMjR0FSQ0lBIyNBTU9FQkEjIyMKUkFGVE9GT0xETU9WSUVTIyNZQVBTCk9ORUhPUlNFIyNQQU5ORVJTI0dBUApBRERFRCNTQUxWRVMjIyNFVFJBREUKU0hPVCNMQU5FSU5USEVUSEVBVFJFClRPUk8jSU5FU1NFI1VORUFSVEhFRApTV0FZI05PREVBUiNCTEFCI1NBU1M="},{"title":"7/24/06 OUT OF SHAPE","author":"by Sally R. Stein, edited by Stanley Newman","date":"2006-07-24","grid":"Q1BBUyNTUEFUUyNFR09TClJBU0gjQ09VUlQjTUFNQQpBTFNPI0VOVEVSI0NMQVAKQkVORElOR09ORVNFQVIjCiMjI0RPRSMjRElDRSMjIwpBVEVJTiNMQVNTTyNBV0wKTk9NRSNERU4jQVJBQklBClRXSVNUSU5HT05FU0FSTQpTRVRUT1MjTEFEI1NURVAKWURTI1RVQkVTI1NFRURTCiMjI1NBTkUjI0FIUyMjIwojUFVMTElOR09ORVNMRUcKUk9TRSNUSElSRCNPSUxZCklTRUUjRVVCSUUjUkVBTQpCRVNUI0RSRUdTI1NVTlM="},{"title":"7/25/06 BUSINESS READING","author":"by Gail Grabowski, edited by Stanley Newman","date":"2006-07-25","grid":"I0FTUCNBU0FQI1NDUkFQClBMSUUjQ0FTRSNFTEFURQpFR0dTI0lSSVMjQ1VURVIKRE9OT1RESVNUVVJCIyMjCkFSRVNPIyMjT05FU1RFUApMRUQjV0FMVCNTVE9PTFMKIyMjREVOSUVTIyNET0xUCiNEQUlMWVNQR