{"id":"newsday-2011","publication":"newsday","year":"2011","count":455,"puzzles":[{"title":"01/01/11 SATURDAY STUMPER","author":"Anna Stiga, edited by Stanley Newman","date":"2011-01-01","grid":"R09UT0JBVEZPUiNST01QCk9ST05PTUFJTkUjSURFQQpBR1JFQVRERUFMI1BPU1QKVEFUQVJTI0xJTFQjTUFUClNORVJEI0ZEUiNSRUVWRQojIyNNSU5PUyNISVRURVIKR0lHI05PUyNESUVURVJTCkVOUkFHRVMjVU5ERVJETwpUUkFNUExFI1JEQSNTRU4KU0VQSUFTI0hBVU5UIyMjCk9WRU5TI01FTiNET0JCUwpMRU4jU0hBVyNTVEFMSU4KRFJVTSNUUklQQVJUSVRFCkVTVE8jVElUT1BVRU5URQpSRVNUI1BFVEVTRUVHRVI="},{"title":"01/01/11 SATURDAY STUMPER","author":"Anna Stiga, edited by Stanley Newman","date":"2011-01-01","grid":"R09UT0JBVEZPUiNST01QCk9ST05PTUFJTkUjSURFQQpBR1JFQVRERUFMI1BPU1QKVEFUQVJTI0xJTFQjTUFUClNORVJEI0ZEUiNSRUVWRQojIyNNSU5PUyNISVRURVIKR0lHI05PUyNESUVURVJTCkVOUkFHRVMjVU5ERVJETwpUUkFNUExFI1JEQSNTRU4KU0VQSUFTI0hBVU5UIyMjCk9WRU5TI01FTiNET0JCUwpMRU4jU0hBVyNTVEFMSU4KRFJVTSNUUklQQVJUSVRFCkVTVE8jVElUT1BVRU5URQpSRVNUI1BFVEVTRUVHRVI="},{"title":"01/02/11 MONEY MENU: With various costs involved","author":"S.N., edited by Stanley Newman","date":"2011-01-02","grid":"I0FWQVNUI0FORE9SUkEjRlVMTEVSCiNMVUxVUyNOT1hJT1VTI1VQU0laRQojU0lMVkVSRE9MTEFSUEFOQ0FLRVMKVE9URVMjRU9OIyNNQUNTIyNUQUtFCkFSVFkjR0FWRUxTI0xBVEVSI0JJTgpMQU9TI09SRSNFUEEjI0VMSSNMRVQKQ05OI1NPVVJET1VHSFBSRVRaRUxTCiMjI1dBU1AjRU5ERUFSI0NFTyMjIwpCRU1JTkUjRUNVIyNET0xUI09WRU4KRU1FTkQjI0tBUkFUIyNQUlMjQVZBCkdPTERFTkRFTElDSU9VU0FQUExFUwpBUkUjUk9ZIyNTRU5EUyMjQUxFUlQKTllFVCNURVNUIyNQSUUjR1JJVFRZCiMjI0FQVCNDQVNBTFMjRkxFRSMjIwpQRVBQRVJNSU5UUEFUVElFUyNMQkoKQUxFI0FVUyMjWUVUI0FOQSNSSUxFCkxFTiNURU5QTSNTRUFMSU4jRU1JVApBTUFTIyNCTEVVIyNCTFQjRVZFTlMKQ0VOVEVSQ1VUUklCRVlFU1RFQUsjCkVOQ09ERSNHT1NPVVRII0hPUkRFIwpTVEVQVVAjU09BTkRTTyNFTlRFUiM="},{"title":"01/02/11 MONEY MENU: With various costs involved","author":"S.N., edited by Stanley Newman","date":"2011-01-02","grid":"I0FWQVNUI0FORE9SUkEjRlVMTEVSCiNMVUxVUyNOT1hJT1VTI1VQU0laRQojU0lMVkVSRE9MTEFSUEFOQ0FLRVMKVE9URVMjRU9OIyNNQUNTIyNUQUtFCkFSVFkjR0FWRUxTI0xBVEVSI0JJTgpMQU9TI09SRSNFUEEjI0VMSSNMRVQKQ05OI1NPVVJET1VHSFBSRVRaRUxTCiMjI1dBU1AjRU5ERUFSI0NFTyMjIwpCRU1JTkUjRUNVIyNET0xUI09WRU4KRU1FTkQjI0tBUkFUIyNQUlMjQVZBCkdPTERFTkRFTElDSU9VU0FQUExFUwpBUkUjUk9ZIyNTRU5EUyMjQUxFUlQKTllFVCNURVNUIyNQSUUjR1JJVFRZCiMjI0FQVCNDQVNBTFMjRkxFRSMjIwpQRVBQRVJNSU5UUEFUVElFUyNMQkoKQUxFI0FVUyMjWUVUI0FOQSNSSUxFCkxFTiNURU5QTSNTRUFMSU4jRU1JVApBTUFTIyNCTEVVIyNCTFQjRVZFTlMKQ0VOVEVSQ1VUUklCRVlFU1RFQUsjCkVOQ09ERSNHT1NPVVRII0hPUkRFIwpTVEVQVVAjU09BTkRTTyNFTlRFUiM="},{"title":"01/03/11 JUST A BIT","author":"Gail Grabowski, edited by Stanley Newman","date":"2011-01-03","grid":"RkxBVyNDQVJBVCNTUEFSCkxBTEEjQUxJQkkjVElMRQpFVkVTI0ZJRkVTI09OTUUKREFTSElUQUxMI0xPQ0FMCiMjI0VSQVNFI1NJR0gjIwpNQURERU4jI0NBS0VQQU4KQVBSIyMjTk9PTkUjTElFCkNQTyNCUklETEVTI0VTUwpBTFAjTElORUQjIyNBTFQKV0VCU0lURSMjQUJBVEVTCiMjRUxTRSNERUxJUyMjIwpBU0hFUyNHUkFJTlNJTE8KTEFJRCNTTEFURSNJREVBClNJTkcjUk9NQU4jU0xBVApPTERFI1NXQVRTI1RFTlM="},{"title":"01/03/11 JUST A BIT","author":"Gail Grabowski, edited by Stanley Newman","date":"2011-01-03","grid":"RkxBVyNDQVJBVCNTUEFSCkxBTEEjQUxJQkkjVElMRQpFVkVTI0ZJRkVTI09OTUUKREFTSElUQUxMI0xPQ0FMCiMjI0VSQVNFI1NJR0gjIwpNQURERU4jI0NBS0VQQU4KQVBSIyMjTk9PTkUjTElFCkNQTyNCUklETEVTI0VTUwpBTFAjTElORUQjIyNBTFQKV0VCU0lURSMjQUJBVEVTCiMjRUxTRSNERUxJUyMjIwpBU0hFUyNHUkFJTlNJTE8KTEFJRCNTTEFURSNJREVBClNJTkcjUk9NQU4jU0xBVApPTERFI1NXQVRTI1RFTlM="},{"title":"01/04/11 NEW YEAR'S REVOLUTIONS","author":"Sally R. Stein, edited by Stanley Newman","date":"2011-01-04","grid":"QVRNUyNBQk9WRSNBUkVBCkJSSUUjVFVSSU4jU0VBTApDQU5FI1RSSUVTI0hFUkUKU1BJTk5JTkdXSEVFTFMjCiMjIyNBUlQjI1JNUyMjIwpBVEVBU0UjU05JVCNJUkEKVEFNUEEjU09PTiMjQ09CCldISVJMSU5HREVSVklTSApBT0wjI05BR1MjRUlFSU8KUkVZI0lTUFkjU0NBUkVSCiMjI0FOVCMjQlRVIyMjIwojVFVSTklOR0FQUk9GSVQKQ0FTRSNOT09TRSNIT1BFCk9YRU4jQ0FSRVQjTk9PTgpQSVNBI1RIRVNFI09ERFM="},{"title":"01/04/11 NEW YEAR'S REVOLUTIONS","author":"Sally R. Stein, edited by Stanley Newman","date":"2011-01-04","grid":"QVRNUyNBQk9WRSNBUkVBCkJSSUUjVFVSSU4jU0VBTApDQU5FI1RSSUVTI0hFUkUKU1BJTk5JTkdXSEVFTFMjCiMjIyNBUlQjI1JNUyMjIwpBVEVBU0UjU05JVCNJUkEKVEFNUEEjU09PTiMjQ09CCldISVJMSU5HREVSVklTSApBT0wjI05BR1MjRUlFSU8KUkVZI0lTUFkjU0NBUkVSCiMjI0FOVCMjQlRVIyMjIwojVFVSTklOR0FQUk9GSVQKQ0FTRSNOT09TRSNIT1BFCk9YRU4jQ0FSRVQjTk9PTgpQSVNBI1RIRVNFI09ERFM="},{"title":"01/05/11 CEREAL SOUNDS","author":"Fred Piscop, edited by Stanley Newman","date":"2011-01-05","grid":"Q0hBUiNSVUJTI1NIRUJBCkhPTEUjRVBJQyNDQVZJTApBUklBI1NPTE8jQUxJS0UKU05BUFBJTkdUVVJUTEUjCk1FU1NFRCNFU1AjIyMjIwojIyMjQ1VSIyNTRUFSRUQKQUNUUyNBRVJPI0VST0RFCkNSQUNLTElOR0ZMQU1FUwpDQUNBTyNEQUxJI0JBTksKVEJPTkRTIyNFTFMjIyMjCiMjIyMjS0lBI0NISVJQUwojUE9QUElOR1RIRUNPUksKUEFORUwjRVJJRSNPQk9FCkFTVFJPI1BFRVIjTk9ORQpTVE9VVCNURVNTI1NURVQ="},{"title":"01/05/11 CEREAL SOUNDS","author":"Fred Piscop, edited by Stanley Newman","date":"2011-01-05","grid":"Q0hBUiNSVUJTI1NIRUJBCkhPTEUjRVBJQyNDQVZJTApBUklBI1NPTE8jQUxJS0UKU05BUFBJTkdUVVJUTEUjCk1FU1NFRCNFU1AjIyMjIwojIyMjQ1VSIyNTRUFSRUQKQUNUUyNBRVJPI0VST0RFCkNSQUNLTElOR0ZMQU1FUwpDQUNBTyNEQUxJI0JBTksKVEJPTkRTIyNFTFMjIyMjCiMjIyMjS0lBI0NISVJQUwojUE9QUElOR1RIRUNPUksKUEFORUwjRVJJRSNPQk9FCkFTVFJPI1BFRVIjTk9ORQpTVE9VVCNURVNTI1NURVQ="},{"title":"01/06/11 DRIVING FORCE","author":"David W. Cromer, edited by Stanley Newman","date":"2011-01-06","grid":"Q0hBTlQjRVNUQSNVVEFIClJFQkFSI0RJRU0jSEFMRQpBUk9TRSNHUkFCI09JTFkKTUVSQ0VERVNSVUVITCMjCiNTVEFURSMjQVNLI1dBUgojIyNST0xMU1RIRURJQ0UKU0FHI1BMQU4jI0RFTlRTClBST0YjQVdBSVQjRURJVApBRExJQiMjRkxJUCNTSVMKRE9ER0VBQlVMTEVUIyMjCkVSQSNFVEEjI0VSQVRPIwojI01FUkNVUllSSVNJTkcKRElFVCNPQk9FI0dFTklFClVOSVQjU0xBVyNFUkVDVApFQ1JVI1RFTlMjRVNTRVM="},{"title":"01/06/11 DRIVING FORCE","author":"David W. Cromer, edited by Stanley Newman","date":"2011-01-06","grid":"Q0hBTlQjRVNUQSNVVEFIClJFQkFSI0RJRU0jSEFMRQpBUk9TRSNHUkFCI09JTFkKTUVSQ0VERVNSVUVITCMjCiNTVEFURSMjQVNLI1dBUgojIyNST0xMU1RIRURJQ0UKU0FHI1BMQU4jI0RFTlRTClBST0YjQVdBSVQjRURJVApBRExJQiMjRkxJUCNTSVMKRE9ER0VBQlVMTEVUIyMjCkVSQSNFVEEjI0VSQVRPIwojI01FUkNVUllSSVNJTkcKRElFVCNPQk9FI0dFTklFClVOSVQjU0xBVyNFUkVDVApFQ1JVI1RFTlMjRVNTRVM="},{"title":"01/07/11 WORDS OF WISDOM","author":"Richard Silvestri, edited by Stanley Newman","date":"2011-01-07","grid":"QUxPSEEjV0VCRVIjTEVNCkNBVklMI0FET1JFI0FYRQpUSEVZT1VOR1NPVyNOVVQKRVJSQU5UI1lPREEjQURFCiMjIyNTSEUjTkVSRElFUgpXSUxET0FUUyNEREUjIyMKRVNBVSNOQVRMI1NQT09LClNUSVIjVElSRVMjT01BTgpUT05FUyNMQVRII1NJVEUKIyMjU1RZI1dISUxFVEhFClRJU1NVRVMjRU5FIyMjIwpJTVAjUExFQSNURUFQT1QKR1BBI09MREdST1dTQUdFCkhFVyNST0dFVCNBSVNMRQpUSU4jU1dFREUjWUFURVM="},{"title":"01/07/11 WORDS OF WISDOM","author":"Richard Silvestri, edited by Stanley Newman","date":"2011-01-07","grid":"QUxPSEEjV0VCRVIjTEVNCkNBVklMI0FET1JFI0FYRQpUSEVZT1VOR1NPVyNOVVQKRVJSQU5UI1lPREEjQURFCiMjIyNTSEUjTkVSRElFUgpXSUxET0FUUyNEREUjIyMKRVNBVSNOQVRMI1NQT09LClNUSVIjVElSRVMjT01BTgpUT05FUyNMQVRII1NJVEUKIyMjU1RZI1dISUxFVEhFClRJU1NVRVMjRU5FIyMjIwpJTVAjUExFQSNURUFQT1QKR1BBI09MREdST1dTQUdFCkhFVyNST0dFVCNBSVNMRQpUSU4jU1dFREUjWUFURVM="},{"title":"01/08/11 SATURDAY STUMPER","author":"Doug Peterson, edited by Stanley Newman","date":"2011-01-08","grid":"TkFCT0IjSU1JTiNDVFJMCkFSRU5BI01PVE8jT0hJTwpTVEVFUiNQSVRUI1JFUE8KQUlSSE9TRVMjQUxPVE9GCiNDSElRVUlUQUJBTkFOQQpDSEFUVVAjVEFMSUEjIyMKTE9MI0VFWU9SRSNEQUhMCk9LTEEjI0lXTyMjT0xFTwpQRVNUI1NQRU5DRSNJQU4KIyMjS05FRUwjQU1QRVJFClBPTElDRVNFUkdFQU5UIwpSSElOT1MjVEhFUk1BTFMKT1dOUyNGQVRFI0dFVEFUCkRPRE8jSUJFVCNFTEVOQQpTV0FOI1RFU1QjREFERFk="},{"title":"01/08/11 SATURDAY STUMPER","author":"Doug Peterson, edited by Stanley Newman","date":"2011-01-08","grid":"TkFCT0IjSU1JTiNDVFJMCkFSRU5BI01PVE8jT0hJTwpTVEVFUiNQSVRUI1JFUE8KQUlSSE9TRVMjQUxPVE9GCiNDSElRVUlUQUJBTkFOQQpDSEFUVVAjVEFMSUEjIyMKTE9MI0VFWU9SRSNEQUhMCk9LTEEjI0lXTyMjT0xFTwpQRVNUI1NQRU5DRSNJQU4KIyMjS05FRUwjQU1QRVJFClBPTElDRVNFUkdFQU5UIwpSSElOT1MjVEhFUk1BTFMKT1dOUyNGQVRFI0dFVEFUCkRPRE8jSUJFVCNFTEVOQQpTV0FOI1RFU1QjREFERFk="},{"title":"01/09/11 OCEANGOING: Wherein you'll see the sea","author":"Gail Grabowski, edited by Stanley Newman","date":"2011-01-09","grid":"TkFCT0IjREFNUCNBTUFTUyNFUElDClNIQVJFI0FOVEkjVE9YSUMjTUVUQQpGSU5HRVJXQVZFI1RJRUJSRUFLRVIKIyMjI1JFTlQjUFJFU1MjQVhJT01TCkFMU0FDRSMjSkFVTlQjU1RJTEVTIwpHT1RNQUQjTEFORSMjVEVDUyMjIyMKQUdBSU4jSE9QUyNXRUlHSFQjR0VNClRPWVMjU09GQSNXQVNURSNTT1JSWQpFU0MjI0NIQU5ORUxTVVJGI0ZPQUwKIyNVUFJPT1QjQkFMRVMjVVNBVVNBClBBUkxPUiMjU0FMRVMjI1NJR05FUgpTQ1JFRU4jTUlTVFkjTElTVEVEIyMKQVJFQSNTVEVNVEhFVElERSMjU0lNCkxFTkRTI0FUQkFZI0VFTFMjQVdSWQpNU1QjTElORUFSI1NBR0UjQ0hFQVQKIyMjI0lOS1MjI0NBU0UjSEVBTFRICiNTTEFDS1MjQUJPVkUjI0FNQkxFUwpDSE9TRU4jUFJVTkUjR0FMRSMjIyMKSElHSFJPTExFUiNORUxTT05FRERZCkVSSUUjVE9PTlMjT0tPSyNUV0lORQpGRU5TI1NBREFUI1dFQlMjU0VEQU4="},{"title":"01/09/11 OCEANGOING: Wherein you'll see the sea","author":"Gail Grabowski, edited by Stanley Newman","date":"2011-01-09","grid":"TkFCT0IjREFNUCNBTUFTUyNFUElDClNIQVJFI0FOVEkjVE9YSUMjTUVUQQpGSU5HRVJXQVZFI1RJRUJSRUFLRVIKIyMjI1JFTlQjUFJFU1MjQVhJT01TCkFMU0FDRSMjSkFVTlQjU1RJTEVTIwpHT1RNQUQjTEFORSMjVEVDUyMjIyMKQUdBSU4jSE9QUyNXRUlHSFQjR0VNClRPWVMjU09GQSNXQVNURSNTT1JSWQpFU0MjI0NIQU5ORUxTVVJGI0ZPQUwKIyNVUFJPT1QjQkFMRVMjVVNBVVNBClBBUkxPUiMjU0FMRVMjI1NJR05FUgpTQ1JFRU4jTUlTVFkjTElTVEVEIyMKQVJFQSNTVEVNVEhFVElERSMjU0lNCkxFTkRTI0FUQkFZI0VFTFMjQVdSWQpNU1QjTElORUFSI1NBR0UjQ0hFQVQKIyMjI0lOS1MjI0NBU0UjSEVBTFRICiNTTEFDS1MjQUJPVkUjI0FNQkxFUwpDSE9TRU4jUFJVTkUjR0FMRSMjIyMKSElHSFJPTExFUiNORUxTT05FRERZCkVSSUUjVE9PTlMjT0tPSyNUV0lORQpGRU5TI1NBREFUI1dFQlMjU0VEQU4="},{"title":"01/10/11 TIME GONE","author":", edited by Stanley Newman","date":"2011-01-10","grid":"S0lORCNDQUxMI0FHTE9XCk9CT0UjQUxPRSNEUkFQRQpTRUFMI1BMQU4jSEFMVFMKI1RISU5HT0ZUSEVQQVNUCiMjIyNPVVQjI0FSRSMjIwpTQUxNT04jQ0xVRSNTUEEKVFJJRVMjT1JBTCNTTEFCCllFU1RFUkRBWVNTVE9SWQpMQVRFI0VPTlMjVEFQRVMKRVNTI1RJUkUjQ0FSRVNTCiMjI1BFRyMjTUFSIyMjIwpBTkNJRU5USElTVE9SWSMKVE9MRVQjSE9TVCNTRUVECk9OSUNFI0FCRUwjTEVBTgpNT1BFUiNXT1JFI09LUkE="},{"title":"01/10/11 TIME GONE","author":", edited by Stanley Newman","date":"2011-01-10","grid":"S0lORCNDQUxMI0FHTE9XCk9CT0UjQUxPRSNEUkFQRQpTRUFMI1BMQU4jSEFMVFMKI1RISU5HT0ZUSEVQQVNUCiMjIyNPVVQjI0FSRSMjIwpTQUxNT04jQ0xVRSNTUEEKVFJJRVMjT1JBTCNTTEFCCllFU1RFUkRBWVNTVE9SWQpMQVRFI0VPTlMjVEFQRVMKRVNTI1RJUkUjQ0FSRVNTCiMjI1BFRyMjTUFSIyMjIwpBTkNJRU5USElTVE9SWSMKVE9MRVQjSE9TVCNTRUVECk9OSUNFI0FCRUwjTEVBTgpNT1BFUiNXT1JFI09LUkE="},{"title":"01/11/11 ENDLESS","author":"Billie Truitt, edited by Stanley Newman","date":"2011-01-11","grid":"T1BUUyMjU1dBQiNSQU1TCkhVUkxTI01FTU8jRU1JVApBVEVVUCNPUkVPI01FU0EKUklOR09GQ0VSVEFJTlRZCkFORCNPQUsjI0NOTiMjIwojIyNUTlQjR1JBTkRQQVMKQU5URSMjQVJPTUEjT0xFClJPVU5ET0ZBUFBMQVVTRQpBTlQjRVZBREUjI1RST0QKQk9VTkNFUlMjUEFMIyMjCiMjI0VBUiMjT0FSI0FBQQpDSVJDTEVPRkZSSUVORFMKT01JVCNBUkVBI1NMQU1TCkRBVEEjU1RBRyNFTUNFRQpFWUVSI1lPUkUjI1NFTlQ="},{"title":"01/11/11 ENDLESS","author":"Billie Truitt, edited by Stanley Newman","date":"2011-01-11","grid":"T1BUUyMjU1dBQiNSQU1TCkhVUkxTI01FTU8jRU1JVApBVEVVUCNPUkVPI01FU0EKUklOR09GQ0VSVEFJTlRZCkFORCNPQUsjI0NOTiMjIwojIyNUTlQjR1JBTkRQQVMKQU5URSMjQVJPTUEjT0xFClJPVU5ET0ZBUFBMQVVTRQpBTlQjRVZBREUjI1RST0QKQk9VTkNFUlMjUEFMIyMjCiMjI0VBUiMjT0FSI0FBQQpDSVJDTEVPRkZSSUVORFMKT01JVCNBUkVBI1NMQU1TCkRBVEEjU1RBRyNFTUNFRQpFWUVSI1lPUkUjI1NFTlQ="},{"title":"01/12/11 SLIM PICKINGS","author":"Norma Steinberg, edited by Stanley Newman","date":"2011-01-12","grid":"Q0FQVCNBTUFTUyNSU1ZQCkFDUkUjTEFOS0EjRVBFRQpUSElOTUFSR0lOI0NBUlQKQ09ORE8jS0lMVCNFUkFTCkhPVEVMUyNFTEFQU0UjIwojIyNSRUlOIyMjQVNUSVIKVE9TUyNEQVJXSU4jSURPCklOSyNCRUdVSU5FI1JFRApFTEkjQVNTRVNTI1NFQVMKU1lOQ1MjIyNQRVJQIyMjCiMjTk9TSE9XI1RFUkVTQQpNQVlBI09ORUsjTkFNRUQKRU5EUyNMRUFOVE9XQVJEClNOSVQjRUFWRVMjTElWRQpTQVBTI1NMRUVLI1NMRUQ="},{"title":"01/12/11 SLIM PICKINGS","author":"Norma Steinberg, edited by Stanley Newman","date":"2011-01-12","grid":"Q0FQVCNBTUFTUyNSU1ZQCkFDUkUjTEFOS0EjRVBFRQpUSElOTUFSR0lOI0NBUlQKQ09ORE8jS0lMVCNFUkFTCkhPVEVMUyNFTEFQU0UjIwojIyNSRUlOIyMjQVNUSVIKVE9TUyNEQVJXSU4jSURPCklOSyNCRUdVSU5FI1JFRApFTEkjQVNTRVNTI1NFQVMKU1lOQ1MjIyNQRVJQIyMjCiMjTk9TSE9XI1RFUkVTQQpNQVlBI09ORUsjTkFNRUQKRU5EUyNMRUFOVE9XQVJEClNOSVQjRUFWRVMjTElWRQpTQVBTI1NMRUVLI1NMRUQ="},{"title":"01/13/11 COP SHOW CLICHEacute;S","author":"S.N., edited by Stanley Newman","date":"2011-01-13","grid":"TUFTUyNLSUxUI0FUQkFUCkVYUE8jSUNFRCNHT09TRQpSRUFERU1ISVNSSUdIVFMKRUxUT1JPIyMjQVRBUklTCiMjI01JTkkjUEdBIyMjIwpBTlkjQ09NRU9VVFdJVEgKUkVBUCNTUEFTI0VSTklFClRBTElBI1VTUyNEQVRFRApTVEVFUCNHRUVLI1BSSUcKWU9VUkhBTkRTVVAjT05FCiMjIyNPQlMjU1RPVyMjIwpDTEFJUkUjIyNDTElQT04KTk9KQUlMQ0FOSE9MRE1FCkJSQUdTI0FDUkUjTUFOUwpDRFJPTSNCRUFSI0FTSVM="},{"title":"01/13/11 COP SHOW CLICHEacute;S","author":"S.N., edited by Stanley Newman","date":"2011-01-13","grid":"TUFTUyNLSUxUI0FUQkFUCkVYUE8jSUNFRCNHT09TRQpSRUFERU1ISVNSSUdIVFMKRUxUT1JPIyMjQVRBUklTCiMjI01JTkkjUEdBIyMjIwpBTlkjQ09NRU9VVFdJVEgKUkVBUCNTUEFTI0VSTklFClRBTElBI1VTUyNEQVRFRApTVEVFUCNHRUVLI1BSSUcKWU9VUkhBTkRTVVAjT05FCiMjIyNPQlMjU1RPVyMjIwpDTEFJUkUjIyNDTElQT04KTk9KQUlMQ0FOSE9MRE1FCkJSQUdTI0FDUkUjTUFOUwpDRFJPTSNCRUFSI0FTSVM="},{"title":"01/14/11 11 SQUARES","author":"Betty Keller, edited by Stanley Newman","date":"2011-01-14","grid":"Q0hBVFMjRElBTCMjREFSCk1PUFVQI1VTREEjREVNTwpPTkVEQU5DRUFXQVlQRUcKTkVSTyNJVEVNI0xFVEJFCiMjSVJPTiMjI09MREhBVApCSVQjUkVHUkVTUyMjIyMKT05JQ0UjRUFSTCNBTktBCk9GRlJPT1RLTk9UREVBTApOT1NZI0RPRVMjWUFXTFMKIyMjI01PTlNURVIjQ0VPClJBV0JBUiMjI0xBTE8jIwpBVEhPUyNCSUFTI0FNUFMKRkVFVFNIT09URVJNRUFMCkZJVFMjSU5UTyNDQVJHTwpJTlMjI1RFQU0jQVNTRVQ="},{"title":"01/14/11 11 SQUARES","author":"Betty Keller, edited by Stanley Newman","date":"2011-01-14","grid":"Q0hBVFMjRElBTCMjREFSCk1PUFVQI1VTREEjREVNTwpPTkVEQU5DRUFXQVlQRUcKTkVSTyNJVEVNI0xFVEJFCiMjSVJPTiMjI09MREhBVApCSVQjUkVHUkVTUyMjIyMKT05JQ0UjRUFSTCNBTktBCk9GRlJPT1RLTk9UREVBTApOT1NZI0RPRVMjWUFXTFMKIyMjI01PTlNURVIjQ0VPClJBV0JBUiMjI0xBTE8jIwpBVEhPUyNCSUFTI0FNUFMKRkVFVFNIT09URVJNRUFMCkZJVFMjSU5UTyNDQVJHTwpJTlMjI1RFQU0jQVNTRVQ="},{"title":"01/15/11 SATURDAY STUMPER","author":"Merle Baker, edited by Stanley Newman","date":"2011-01-15","grid":"Q0hFQ0tJTk9OI05BTVVSCkhFQVJUUkFURSNPVklORQpFQVNFU0lOVE8jQk9TQ1MKRVZFUyNTRUFOI0lOR09UClBFTFRTI1RXQU5HI09WTwojIyMjTVVUQVRFI0FWRVIKQ0FTQ0FERSNFVEFHRVJFCkFDQ09SRCMjI1BPVVJFUgpTVElMVEVEI0tBTEVORFMKSFVOVCNSSUJFWUUjIyMjCkNBVCNFU1NBWSNSVU1QUwpBUklFTCNBVFJBI05FQUwKUklMTEUjUkVJTlNUQVRFCkRBTEVTI01BTllTSURFRApTTEFNUyNTVUdBUkxFU1M="},{"title":"01/15/11 SATURDAY STUMPER","author":"Merle Baker, edited by Stanley Newman","date":"2011-01-15","grid":"Q0hFQ0tJTk9OI05BTVVSCkhFQVJUUkFURSNPVklORQpFQVNFU0lOVE8jQk9TQ1MKRVZFUyNTRUFOI0lOR09UClBFTFRTI1RXQU5HI09WTwojIyMjTVVUQVRFI0FWRVIKQ0FTQ0FERSNFVEFHRVJFCkFDQ09SRCMjI1BPVVJFUgpTVElMVEVEI0tBTEVORFMKSFVOVCNSSUJFWUUjIyMjCkNBVCNFU1NBWSNSVU1QUwpBUklFTCNBVFJBI05FQUwKUklMTEUjUkVJTlNUQVRFCkRBTEVTI01BTllTSURFRApTTEFNUyNTVUdBUkxFU1M="},{"title":"01/16/11 WHAT'S COOKING: Featuring an appropriate pair","author":"Clive Probert, edited by Stanley Newman","date":"2011-01-16","grid":"RElMQVRFIyMjRElFRCMjUEFNUEFTCkVSSVRSRUEjSE9NTUUjSEVMUE9VVApQT1RCRUxMSUVEUElHI09MRVNUUkEKQU5URSMjUEFORE9SQVNCT1gjTE9ZClJPRVMjRE9OTkVSI1NMQVQjQVVSQQpUVVJUTEUjI0FSVFMjSVJBI1NDQVQKU1RTI0VCQlMjIyNLRVBUI0lOSyMjCiMjI1BPVEFUT1NLSU5TIyNORVNTIwpUQVBFIyNIQVNUQSNDVVQjR1JVTlQKU01BUk1ZI1JIRVRUI1BBVkUjUEVJCktFTk1PUkUjQVBST04jQ0hBTVBFRApFTEkjVVNFRCNTSVRFUyNGUkVFWkUKRElDRVMjS0VHI05FVkVSIyNBUkVTCiNBU1BTIyNQQU5BTUFDQU5BTCMjIwojI1RJRSNUT0dPIyMjU0hPUCNDU0kKTkFSQyNTQVMjU1dBVCMjVVJDSElOCklSSVMjVFJJQiNBU0hDQU4jUkVBUApNQ0MjUE9UVElOR1NPSUwjI0FNTU8KQkFLTEFWQSNQQU5PUkFNSUNWSUVXClVORUFURU4jT0RFT04jU1RSQVNTRQpTRU5TRVMjI0RBUk4jIyNTSVRURVI="},{"title":"01/16/11 WHAT'S COOKING: Featuring an appropriate pair","author":"Clive Probert, edited by Stanley Newman","date":"2011-01-16","grid":"RElMQVRFIyMjRElFRCMjUEFNUEFTCkVSSVRSRUEjSE9NTUUjSEVMUE9VVApQT1RCRUxMSUVEUElHI09MRVNUUkEKQU5URSMjUEFORE9SQVNCT1gjTE9ZClJPRVMjRE9OTkVSI1NMQVQjQVVSQQpUVVJUTEUjI0FSVFMjSVJBI1NDQVQKU1RTI0VCQlMjIyNLRVBUI0lOSyMjCiMjI1BPVEFUT1NLSU5TIyNORVNTIwpUQVBFIyNIQVNUQSNDVVQjR1JVTlQKU01BUk1ZI1JIRVRUI1BBVkUjUEVJCktFTk1PUkUjQVBST04jQ0hBTVBFRApFTEkjVVNFRCNTSVRFUyNGUkVFWkUKRElDRVMjS0VHI05FVkVSIyNBUkVTCiNBU1BTIyNQQU5BTUFDQU5BTCMjIwojI1RJRSNUT0dPIyMjU0hPUCNDU0kKTkFSQyNTQVMjU1dBVCMjVVJDSElOCklSSVMjVFJJQiNBU0hDQU4jUkVBUApNQ0MjUE9UVElOR1NPSUwjI0FNTU8KQkFLTEFWQSNQQU5PUkFNSUNWSUVXClVORUFURU4jT0RFT04jU1RSQVNTRQpTRU5TRVMjI0RBUk4jIyNTSVRURVI="},{"title":"01/17/11 HAPPY ENDINGS","author":"Billie Truitt, edited by Stanley Newman","date":"2011-01-17","grid":"U01JVEgjT1NMTyNTQVRFCkhJUkVFI1NXQUIjSVNPTgpJUk9OWSNDQU5FI0xFU1QKUEVOTllDQU5EWSNMRUVSCiMjIyNPQVIjI01BWURBWQpBUlRGVUwjQ0hFQVAjIyMKU09ZQSNNQUxFI0FVUkFTClBVUElMI0NVRSNTVE9MRQpTVE9SRSNIRUxQI1RPTUUKIyMjWUVTRVMjTEFZTUFOClNBWVNTTyMjQ09OIyMjIwpBTE9UI0JMT09EWU1BUlkKRklETyNCSU5TI0hBTk9JCkVWRVIjRU1JVCNPTlRBUApSRUxZI0RPVFMjV0VFRFM="},{"title":"01/17/11 HAPPY ENDINGS","author":"Billie Truitt, edited by Stanley Newman","date":"2011-01-17","grid":"U01JVEgjT1NMTyNTQVRFCkhJUkVFI1NXQUIjSVNPTgpJUk9OWSNDQU5FI0xFU1QKUEVOTllDQU5EWSNMRUVSCiMjIyNPQVIjI01BWURBWQpBUlRGVUwjQ0hFQVAjIyMKU09ZQSNNQUxFI0FVUkFTClBVUElMI0NVRSNTVE9MRQpTVE9SRSNIRUxQI1RPTUUKIyMjWUVTRVMjTEFZTUFOClNBWVNTTyMjQ09OIyMjIwpBTE9UI0JMT09EWU1BUlkKRklETyNCSU5TI0hBTk9JCkVWRVIjRU1JVCNPTlRBUApSRUxZI0RPVFMjV0VFRFM="},{"title":"01/18/11 PERHAPS","author":"Gail Grabowski, edited by Stanley Newman","date":"2011-01-18","grid":"RE9UUyNDQUxNI0FTSUFOCkVWSUwjQUxPRSNURU5TRQpMQUxBI0JPT1MjV1JJVFMKSUxMVEhJTktBQk9VVElUCiMjIyNPTkUjI0FSTSMjIwojU1RBUlMjVEFDSyNDQVAKR1VBUkQjT1JTTyNNQUxFCkFTS01FQUdBSU5MQVRFUgpXSEVZI0RSSVAjSU5FUlQKS0lOI0dMRU4jT1ZFUlQjCiMjI0xFSSMjUllFIyMjIwpJVE1BWUJFUE9TU0lCTEUKUE9FVFMjVE9VVCNUT0lMCk9SQVRFI0FOVEUjRVJBUwpERVRFUiNMRUVSI01FUkU="},{"title":"01/18/11 PERHAPS","author":"Gail Grabowski, edited by Stanley Newman","date":"2011-01-18","grid":"RE9UUyNDQUxNI0FTSUFOCkVWSUwjQUxPRSNURU5TRQpMQUxBI0JPT1MjV1JJVFMKSUxMVEhJTktBQk9VVElUCiMjIyNPTkUjI0FSTSMjIwojU1RBUlMjVEFDSyNDQVAKR1VBUkQjT1JTTyNNQUxFCkFTS01FQUdBSU5MQVRFUgpXSEVZI0RSSVAjSU5FUlQKS0lOI0dMRU4jT1ZFUlQjCiMjI0xFSSMjUllFIyMjIwpJVE1BWUJFUE9TU0lCTEUKUE9FVFMjVE9VVCNUT0lMCk9SQVRFI0FOVEUjRVJBUwpERVRFUiNMRUVSI01FUkU="},{"title":"01/19/11 POWER TRIP","author":"Norma Steinberg, edited by Stanley Newman","date":"2011-01-19","grid":"U1RBRyNNQUdJQyNDUEFTCk9STk8jRVJPREUjQUxNQQpPVVRMRVRNQUxMI1JVTVMKTkVFRExFI0RFTCNFR09TCiMjIyNNT08jU0lSRU4jIwpIQUNLRVJTIyNTVFJJUFMKT1RIRVIjQ0FTVEUjQ0VPCklSQU4jUEFJTFMjU0tFVwpTSVIjQ0FSTE8jU0lFVkUKVEFHU1VQIyNUUklQTEVECiMjRUxERVIjSEFUIyMjIwpCT0NBI1JPRCNST1NURVIKSU1BQyNDVVJSRU5URVJBCkRBUksjVVNVQUwjRVJJTgpFTkRTI1BFR0dZI1BJQ0s="},{"title":"01/19/11 POWER TRIP","author":"Norma Steinberg, edited by Stanley Newman","date":"2011-01-19","grid":"U1RBRyNNQUdJQyNDUEFTCk9STk8jRVJPREUjQUxNQQpPVVRMRVRNQUxMI1JVTVMKTkVFRExFI0RFTCNFR09TCiMjIyNNT08jU0lSRU4jIwpIQUNLRVJTIyNTVFJJUFMKT1RIRVIjQ0FTVEUjQ0VPCklSQU4jUEFJTFMjU0tFVwpTSVIjQ0FSTE8jU0lFVkUKVEFHU1VQIyNUUklQTEVECiMjRUxERVIjSEFUIyMjIwpCT0NBI1JPRCNST1NURVIKSU1BQyNDVVJSRU5URVJBCkRBUksjVVNVQUwjRVJJTgpFTkRTI1BFR0dZI1BJQ0s="},{"title":"01/20/11 SUPPORT GROUP","author":"Doug Peterson, edited by Stanley Newman","date":"2011-01-20","grid":"Q0xBSU0jU0hJUCNUT0dTCkhBTFZFI1RPTkkjWVVMRQpFTE1FUiNJT1RBI0NSVVoKV0FTSElOR1RPTlBPU1QjCiMjI0FUT00jI09SQiMjIwpTUFVEI01BUFMjT0JBTUEKQ0FTSU5PI0xPU1QjTUFHCkVESVRPUklBTENPTFVNTgpOVU4jUkVOVCNPTkVTSUUKRUFHRVIjTkVBVCNGRUVTCiMjI1hJUyMjU0NBVCMjIwojRkxBU0hMSUdIVEJFQU0KQkxPQyNST1NBI0xBUkdFCkFVTlQjRVZFUiNBTkdFTApNRUdBI1dFRUQjU0tPUlQ="},{"title":"01/20/11 SUPPORT GROUP","author":"Doug Peterson, edited by Stanley Newman","date":"2011-01-20","grid":"Q0xBSU0jU0hJUCNUT0dTCkhBTFZFI1RPTkkjWVVMRQpFTE1FUiNJT1RBI0NSVVoKV0FTSElOR1RPTlBPU1QjCiMjI0FUT00jI09SQiMjIwpTUFVEI01BUFMjT0JBTUEKQ0FTSU5PI0xPU1QjTUFHCkVESVRPUklBTENPTFVNTgpOVU4jUkVOVCNPTkVTSUUKRUFHRVIjTkVBVCNGRUVTCiMjI1hJUyMjU0NBVCMjIwojRkxBU0hMSUdIVEJFQU0KQkxPQyNST1NBI0xBUkdFCkFVTlQjRVZFUiNBTkdFTApNRUdBI1dFRUQjU0tPUlQ="},{"title":"01/21/11 WAY TO GO","author":"Bruce Venzke, edited by Stanley Newman","date":"2011-01-21","grid":"V09MRiNTSUdNQSNDUEFTCkFNSUUjS05PUEYjUkFaRQpTQUtTRklGVEhBVkVOVUUKUFJFU1VNRSMjUklERVJTCiMjIyNTUFJBVCNCSUxFIwpPTkVBU1lTVFJFRVQjIyMKSE9MTFkjI0hFUlMjUkRBCk5PU0UjQUJMRVIjVEVFUwpPTkUjREFWRSMjU1dBTUkKIyMjUk9BRFRPVVRPUElBCiNDQUVOI1NFVFRPIyMjIwpDQU5ET1IjI09BS1BBUksKSElHSFdBWVRPSEVBVkVOCkFSRUEjUEFVTEEjUkVOTwpQT1JUI1RXRUVOI1RSRVg="},{"title":"01/21/11 WAY TO GO","author":"Bruce Venzke, edited by Stanley Newman","date":"2011-01-21","grid":"V09MRiNTSUdNQSNDUEFTCkFNSUUjS05PUEYjUkFaRQpTQUtTRklGVEhBVkVOVUUKUFJFU1VNRSMjUklERVJTCiMjIyNTUFJBVCNCSUxFIwpPTkVBU1lTVFJFRVQjIyMKSE9MTFkjI0hFUlMjUkRBCk5PU0UjQUJMRVIjVEVFUwpPTkUjREFWRSMjU1dBTUkKIyMjUk9BRFRPVVRPUElBCiNDQUVOI1NFVFRPIyMjIwpDQU5ET1IjI09BS1BBUksKSElHSFdBWVRPSEVBVkVOCkFSRUEjUEFVTEEjUkVOTwpQT1JUI1RXRUVOI1RSRVg="},{"title":"01/22/11 SATURDAY STUMPER","author":"Brad Wilber, edited by Stanley Newman","date":"2011-01-22","grid":"VE9NQVRPRVMjTUFTSElFCklOVFJJR1VFI0VTVEVSUwpNT1ZJRURPTSNBUEVYRVMKRU5WI0RFTklBTCNSRU5FClNFRVAjTllQRCNJTkRFWApTS0VFVCNNUk1PVE8jIyMKSU5KQUlMI09BVEgjUEZDCkdFQVJTVVAjTklBR0FSQQpORVkjU0xJRCNTQ09SRVMKIyMjTU9MVEVOI0FOVEVTClNXRUVUI0FNT1IjR1lSRQpXSEVUI1VTRVNPTiNGQVQKQUlSSU5HI1JPU0VNT05UClBSSU1BTCNHQVNHQVVHRQpTTEVFUFkjRVBJU1RMRVM="},{"title":"01/22/11 SATURDAY STUMPER","author":"Brad Wilber, edited by Stanley Newman","date":"2011-01-22","grid":"VE9NQVRPRVMjTUFTSElFCklOVFJJR1VFI0VTVEVSUwpNT1ZJRURPTSNBUEVYRVMKRU5WI0RFTklBTCNSRU5FClNFRVAjTllQRCNJTkRFWApTS0VFVCNNUk1PVE8jIyMKSU5KQUlMI09BVEgjUEZDCkdFQVJTVVAjTklBR0FSQQpORVkjU0xJRCNTQ09SRVMKIyMjTU9MVEVOI0FOVEVTClNXRUVUI0FNT1IjR1lSRQpXSEVUI1VTRVNPTiNGQVQKQUlSSU5HI1JPU0VNT05UClBSSU1BTCNHQVNHQVVHRQpTTEVFUFkjRVBJU1RMRVM="},{"title":"01/23/11 POOLSIDE: But not at all wet","author":"David W. Cromer, edited by Stanley Newman","date":"2011-01-23","grid":"TVVTRVVNI1VSQUwjTVVDSCNTQU1TCkFTSUFHTyNUSU1FI0lOUkUjT1BBTApDVUVUSEVNVVNJQyNSQklTI1ZJTkUKU0FHUyMjT1JFI0FURUFNI1RJTkdFCiNMRUFQU09OI0JSSURHRVRIRUdBUAojIyNUT1cjI1RBUlAjI1dSSVQjIyMKQUJTI1JBQ0tPTkVTQlJBSU4jQ0JTClBJVEEjSE9FUlMjI1JBVkVTI0xBSApQTE9UI0lNQVkjQVRPTkVEI1BJU0EKIyNXT09MRU4jRVZFTiMjI1RJRUlOCkNIQUxLSVRVUFRPRVhQRVJJRU5DRQpSQVdMUyMjI0FSSUQjT05FQUNUIyMKQUxBUyNBQkFTRUQjR0lMRCNFRU5ZClRPWSNTQ0FSUyMjQVJOQVojU0xPVApFU1MjUE9DS0VURURJVElPTiNFTkQKIyMjUEVSSyMjT1BFTiMjTk9SIyMjCkJBTExBTkRDSEFJTiNQUkVTRU5UIwpPTkFJUiNST0FEUyNFQVUjI1BPT0gKUklURSNMQUJTI1RBQkxFRk9SVFdPCkVNSVIjQUZSTyNMVVJFI0FET1JFUwpERU5TI1NUQU4jRUdPUyNERVNFUlQ="},{"title":"01/23/11 POOLSIDE: But not at all wet","author":"David W. Cromer, edited by Stanley Newman","date":"2011-01-23","grid":"TVVTRVVNI1VSQUwjTVVDSCNTQU1TCkFTSUFHTyNUSU1FI0lOUkUjT1BBTApDVUVUSEVNVVNJQyNSQklTI1ZJTkUKU0FHUyMjT1JFI0FURUFNI1RJTkdFCiNMRUFQU09OI0JSSURHRVRIRUdBUAojIyNUT1cjI1RBUlAjI1dSSVQjIyMKQUJTI1JBQ0tPTkVTQlJBSU4jQ0JTClBJVEEjSE9FUlMjI1JBVkVTI0xBSApQTE9UI0lNQVkjQVRPTkVEI1BJU0EKIyNXT09MRU4jRVZFTiMjI1RJRUlOCkNIQUxLSVRVUFRPRVhQRVJJRU5DRQpSQVdMUyMjI0FSSUQjT05FQUNUIyMKQUxBUyNBQkFTRUQjR0lMRCNFRU5ZClRPWSNTQ0FSUyMjQVJOQVojU0xPVApFU1MjUE9DS0VURURJVElPTiNFTkQKIyMjUEVSSyMjT1BFTiMjTk9SIyMjCkJBTExBTkRDSEFJTiNQUkVTRU5UIwpPTkFJUiNST0FEUyNFQVUjI1BPT0gKUklURSNMQUJTI1RBQkxFRk9SVFdPCkVNSVIjQUZSTyNMVVJFI0FET1JFUwpERU5TI1NUQU4jRUdPUyNERVNFUlQ="},{"title":"01/24/11 I SPY","author":"Gail Grabowski, edited by Stanley Newman","date":"2011-01-24","grid":"Q0FSRCNTQVNTWSNTUEVECkxJQVIjQUJBVEUjSEFWRQpVUkdFI0xPVkVTI09QRU4KRVlFU0hBRE9XI1RSRVNTCiMjI1NVUkVSI0RPRVIjIwpNSVNFUlkjI1BJVFNUT1AKT0RPUiMjU0FVQ0UjUlVFCklPVSNTQVRJUkVTI0FOVApTU04jQUdJTEUjI0ZJQ1QKVE9ERExFUiMjU01JTEVZCiMjVFJPRCNTVEVBTCMjIwpBUFJPTiNTSElSVFRBSUwKQkVBTiNTSEFSRSNFTFNFCkxBQ0UjVE9LRU4jUk9MRQpFTEtTI1NXRURFI1NFRVI="},{"title":"01/24/11 I SPY","author":"Gail Grabowski, edited by Stanley Newman","date":"2011-01-24","grid":"Q0FSRCNTQVNTWSNTUEVECkxJQVIjQUJBVEUjSEFWRQpVUkdFI0xPVkVTI09QRU4KRVlFU0hBRE9XI1RSRVNTCiMjI1NVUkVSI0RPRVIjIwpNSVNFUlkjI1BJVFNUT1AKT0RPUiMjU0FVQ0UjUlVFCklPVSNTQVRJUkVTI0FOVApTU04jQUdJTEUjI0ZJQ1QKVE9ERExFUiMjU01JTEVZCiMjVFJPRCNTVEVBTCMjIwpBUFJPTiNTSElSVFRBSUwKQkVBTiNTSEFSRSNFTFNFCkxBQ0UjVE9LRU4jUk9MRQpFTEtTI1NXRURFI1NFRVI="},{"title":"01/25/11 ALL WET","author":"Sally R. Stein, edited by Stanley Newman","date":"2011-01-25","grid":"UE9TVCNQQVVMI0FUTEFTCklOQ0gjQUNIRSNOT09ORQpOQ0FBI1NUVU4jU1RPTkUKR0VUSU5UT0hPVFdBVEVSCiMjIyNPQVIjI0VFTCMjIwpMQVNTT1MjQkVFUiNBQkMKQU5URVMjQk9BVCNTTFVSClNLQVRFU09OVEhJTklDRQpFTE1TI0NBRFMjVElDS1MKUkVQI01PU1MjREVURVNUCiMjI1RBUiMjR0VNIyMjIwpCTE9XSU5HT0ZGU1RFQU0KUklQRU4jSURMRSNFUklFCklOVEVMI0dFQVIjTUFMTApURVNUWSNTU1RTI1BTU1Q="},{"title":"01/25/11 ALL WET","author":"Sally R. Stein, edited by Stanley Newman","date":"2011-01-25","grid":"UE9TVCNQQVVMI0FUTEFTCklOQ0gjQUNIRSNOT09ORQpOQ0FBI1NUVU4jU1RPTkUKR0VUSU5UT0hPVFdBVEVSCiMjIyNPQVIjI0VFTCMjIwpMQVNTT1MjQkVFUiNBQkMKQU5URVMjQk9BVCNTTFVSClNLQVRFU09OVEhJTklDRQpFTE1TI0NBRFMjVElDS1MKUkVQI01PU1MjREVURVNUCiMjI1RBUiMjR0VNIyMjIwpCTE9XSU5HT0ZGU1RFQU0KUklQRU4jSURMRSNFUklFCklOVEVMI0dFQVIjTUFMTApURVNUWSNTU1RTI1BTU1Q="},{"title":"01/26/11 ROOM SERVICE","author":"Fred Piscop, edited by Stanley Newman","date":"2011-01-26","grid":"QU1BU1MjQkVFVFMjQU1BClNBVElFI1JFUFJPI0NBTApIWUVOQSNBTElFTiNUUkkKIyMjR0xBU1NDRUlMSU5HCkJVRyNJTlMjIyNOSVZFTgpJU0xBTkQjVFJPTExFUlMKQkVFUiMjT0hBUkEjIyMjCiNSRVRBSU5JTkdXQUxMIwojIyMjR1JJTkQjI0xPT04KUkVEQkVBTlMjU1BBUlNFCk9ORUFMIyMjUEFMI0RFVwpUUkFESU5HRkxPT1IjIyMKVEFDI01BUklBI1dFQk1ECkVHTyNJVEFMWSNFTlRSWQpERU4jVE9NRVMjRE9VU0U="},{"title":"01/26/11 ROOM SERVICE","author":"Fred Piscop, edited by Stanley Newman","date":"2011-01-26","grid":"QU1BU1MjQkVFVFMjQU1BClNBVElFI1JFUFJPI0NBTApIWUVOQSNBTElFTiNUUkkKIyMjR0xBU1NDRUlMSU5HCkJVRyNJTlMjIyNOSVZFTgpJU0xBTkQjVFJPTExFUlMKQkVFUiMjT0hBUkEjIyMjCiNSRVRBSU5JTkdXQUxMIwojIyMjR1JJTkQjI0xPT04KUkVEQkVBTlMjU1BBUlNFCk9ORUFMIyMjUEFMI0RFVwpUUkFESU5HRkxPT1IjIyMKVEFDI01BUklBI1dFQk1ECkVHTyNJVEFMWSNFTlRSWQpERU4jVE9NRVMjRE9VU0U="},{"title":"01/27/11 EDIBLE ENDEARMENTS","author":"Billie Truitt, edited by Stanley Newman","date":"2011-01-27","grid":"U05BRyNDQVNII0dOQVdTClBPTEUjT1NMTyNSQU5BVApBVFROI1BST1AjRVBPWFkKU1dFRVRJRVBJRSNPTllYCk1PUlBIRUQjI0FJTCMjIwojIyNPVVIjQ09SRElBTFMKQUxTTyMjU0xBVEUjU0VBClNFQUxFRFdJVEhBS0lTUwpFQVIjUk9BQ0gjI0VBVFMKQ0hJUE1VTksjU1NOIyMjCiMjI1JBRyMjRUxJVElTVApUT0RPI0hPTkVZQlVOQ0gKRU1JTFkjTU9SRSNDQVJBCk1BTklBI0FTSVMjS05FVwpQUk9YWSNOWUVUI1lFV1M="},{"title":"01/27/11 EDIBLE ENDEARMENTS","author":"Billie Truitt, edited by Stanley Newman","date":"2011-01-27","grid":"U05BRyNDQVNII0dOQVdTClBPTEUjT1NMTyNSQU5BVApBVFROI1BST1AjRVBPWFkKU1dFRVRJRVBJRSNPTllYCk1PUlBIRUQjI0FJTCMjIwojIyNPVVIjQ09SRElBTFMKQUxTTyMjU0xBVEUjU0VBClNFQUxFRFdJVEhBS0lTUwpFQVIjUk9BQ0gjI0VBVFMKQ0hJUE1VTksjU1NOIyMjCiMjI1JBRyMjRUxJVElTVApUT0RPI0hPTkVZQlVOQ0gKRU1JTFkjTU9SRSNDQVJBCk1BTklBI0FTSVMjS05FVwpQUk9YWSNOWUVUI1lFV1M="},{"title":"01/28/11 ISRAEL, EGYPT, ETC.","author":"Randall J. Hartman, edited by Stanley Newman","date":"2011-01-28","grid":"Sk9FTCNBVklTI1RIT1JOCklOVE8jUklDTyNST0dVRQpNRUFUI0tFRU4jRUxMSVMKSVNTVUVBU1RBVEVNRU5UCiMjI1NBTiMjUkFGIyMjIwpTU04jVVNFRCNCUk9USFMKQU5PTiNBREFNI09SSU9OCk1BS0VBU1RST05HQ0FTRQpCUklBUiNWSVRPI0FSRUEKQUxBUk1TI05FUkQjQVNLCiMjIyNZVU0jI01JQSMjIwpZT1VHQVZFTUVBU1RBUlQKVVBUT04jREVBUiNCUklPCk1FQU5UI0FHUkEjQUlOVApBQ0hFUyNMQU5FI1lBS1M="},{"title":"01/28/11 ISRAEL, EGYPT, ETC.","author":"Randall J. Hartman, edited by Stanley Newman","date":"2011-01-28","grid":"Sk9FTCNBVklTI1RIT1JOCklOVE8jUklDTyNST0dVRQpNRUFUI0tFRU4jRUxMSVMKSVNTVUVBU1RBVEVNRU5UCiMjI1NBTiMjUkFGIyMjIwpTU04jVVNFRCNCUk9USFMKQU5PTiNBREFNI09SSU9OCk1BS0VBU1RST05HQ0FTRQpCUklBUiNWSVRPI0FSRUEKQUxBUk1TI05FUkQjQVNLCiMjIyNZVU0jI01JQSMjIwpZT1VHQVZFTUVBU1RBUlQKVVBUT04jREVBUiNCUklPCk1FQU5UI0FHUkEjQUlOVApBQ0hFUyNMQU5FI1lBS1M="},{"title":"01/29/11 SATURDAY STUMPER","author":"Barry C. Silk, edited by Stanley Newman","date":"2011-01-29","grid":"QVpJTVVUSCNBRlJJQ0FOCk1FTUVOVE8jR09PRE9ORQpBQkFORE9OI1JFTEVOVFMKU1VMVSNQT0xFI0VBVElUClNMT1NII1JFRUsjTE9HRQpFT04jQVdFU09NRSNSVUcKU05FRVpFRCNOQU1FVEFHCiMjI1JNTiMjI1JFViMjIwpSRVBFQVRTI1NUUkVFVFMKSUNJI1RCSUxJU0kjTkVXCkZPR0cjWUdPUiNMT1JORQpGTElFUyNOQ09TI0xPU0UKTE9SRUxFSSNDT0hBQklUCkVHT1NVUkYjQ0xBVkVMTApTWU5FUkdZI09EWVNTRVk="},{"title":"01/29/11 SATURDAY STUMPER","author":"Barry C. Silk, edited by Stanley Newman","date":"2011-01-29","grid":"QVpJTVVUSCNBRlJJQ0FOCk1FTUVOVE8jR09PRE9ORQpBQkFORE9OI1JFTEVOVFMKU1VMVSNQT0xFI0VBVElUClNMT1NII1JFRUsjTE9HRQpFT04jQVdFU09NRSNSVUcKU05FRVpFRCNOQU1FVEFHCiMjI1JNTiMjI1JFViMjIwpSRVBFQVRTI1NUUkVFVFMKSUNJI1RCSUxJU0kjTkVXCkZPR0cjWUdPUiNMT1JORQpGTElFUyNOQ09TI0xPU0UKTE9SRUxFSSNDT0hBQklUCkVHT1NVUkYjQ0xBVkVMTApTWU5FUkdZI09EWVNTRVk="},{"title":"01/30/11 FRUCTIFEROUS: A basketful of goodies","author":"Fred Piscop, edited by Stanley Newman","date":"2011-01-30","grid":"Q0FUUyNBUE9QI1NUUk9QI01BSURTCk9HUkUjTE9SRSNJUk9OUyNJTk5JRQpQRUFDSEZVWlojREFURUFORFRJTUUKRU5EI0FSTk8jI0VHT1MjRURJVEVEClNURUVSRUQjQU1CRVIjTEFJQyMjIwojIyNDT0QjVFJJQUQjI0FSRSNQSlMKQ09CT0wjQ0hFUlJZQk9NQiNHTE9QClNUQU5EI0lPTiMjI1JVQlkjUlVMRQpUSU4jIyNHUkFQRU5VVFMjQ09NSUMKI1NBSEFSQU4jQVhPTlMjQ0hVVEVTCiMjTk9TSVIjR1JBTlQjUElBTk8jIwpQTEFDSUQjU1VFTUUjR1JBTkRNQSMKUklTS1MjTElNRVNUT05FIyMjQUxQCklTRUUjQkVBTSMjI1JBWSNET1RFUgpTVEFZI0xFTU9OR1JBU1MjRVBPWFkKTVNUI1NPRCMjQVJJVEgjVEJBIyMjCiMjI01FTlMjU1RBR0UjQ09BTEJJTgpCQUJJRUQjTEFDWSMjU0FMVCNST08KT1JBTkdFUEVLT0UjQVBQTEVHQVRFClNJTkNFI0dBRUxTI1JBUkUjT1ZBTApDQUdFUiNBU1NFVCNCUkFEI0JPU1M="},{"title":"01/30/11 FRUCTIFEROUS: A basketful of goodies","author":"Fred Piscop, edited by Stanley Newman","date":"2011-01-30","grid":"Q0FUUyNBUE9QI1NUUk9QI01BSURTCk9HUkUjTE9SRSNJUk9OUyNJTk5JRQpQRUFDSEZVWlojREFURUFORFRJTUUKRU5EI0FSTk8jI0VHT1MjRURJVEVEClNURUVSRUQjQU1CRVIjTEFJQyMjIwojIyNDT0QjVFJJQUQjI0FSRSNQSlMKQ09CT0wjQ0hFUlJZQk9NQiNHTE9QClNUQU5EI0lPTiMjI1JVQlkjUlVMRQpUSU4jIyNHUkFQRU5VVFMjQ09NSUMKI1NBSEFSQU4jQVhPTlMjQ0hVVEVTCiMjTk9TSVIjR1JBTlQjUElBTk8jIwpQTEFDSUQjU1VFTUUjR1JBTkRNQSMKUklTS1MjTElNRVNUT05FIyMjQUxQCklTRUUjQkVBTSMjI1JBWSNET1RFUgpTVEFZI0xFTU9OR1JBU1MjRVBPWFkKTVNUI1NPRCMjQVJJVEgjVEJBIyMjCiMjI01FTlMjU1RBR0UjQ09BTEJJTgpCQUJJRUQjTEFDWSMjU0FMVCNST08KT1JBTkdFUEVLT0UjQVBQTEVHQVRFClNJTkNFI0dBRUxTI1JBUkUjT1ZBTApDQUdFUiNBU1NFVCNCUkFEI0JPU1M="},{"title":"01/31/11 END OF JANUARY","author":"Gail Grabowski, edited by Stanley Newman","date":"2011-01-31","grid":"QU1JRCNDTU9OI0FQVEVSCkhFUk8jUklQRSNCUkFWTwpTTklUI0VYRVMjUklURVMKI1VTRUFESUNUSU9OQVJZCiMjIyNTSU4jI1JBVCMjIwpEQUJTQVQjR0xBRCNUQUMKT05FQU0jQVJVVCMjRUdPCk9OTFlJRk5FQ0VTU0FSWQpSSU8jI1JFRUsjVEhSRUUKU0VXI0dPV04jR0VZU0VSCiMjI0NBVyMjRk9FIyMjIwpMRU5ESU5HTElCUkFSWSMKQURPUkUjUk9MTCNCRUVGCkRFUE9UI0lTRUUjTEFORQpFTkVNWSNQU1NUI0VMU0U="},{"title":"01/31/11 END OF JANUARY","author":"Gail Grabowski, edited by Stanley Newman","date":"2011-01-31","grid":"QU1JRCNDTU9OI0FQVEVSCkhFUk8jUklQRSNCUkFWTwpTTklUI0VYRVMjUklURVMKI1VTRUFESUNUSU9OQVJZCiMjIyNTSU4jI1JBVCMjIwpEQUJTQVQjR0xBRCNUQUMKT05FQU0jQVJVVCMjRUdPCk9OTFlJRk5FQ0VTU0FSWQpSSU8jI1JFRUsjVEhSRUUKU0VXI0dPV04jR0VZU0VSCiMjI0NBVyMjRk9FIyMjIwpMRU5ESU5HTElCUkFSWSMKQURPUkUjUk9MTCNCRUVGCkRFUE9UI0lTRUUjTEFORQpFTkVNWSNQU1NUI0VMU0U="},{"title":"02/01/11 RING THINGS","author":"Billie Truitt, edited by Stanley Newman","date":"2011-02-01","grid":"UEFUSCNBTEFTI1NQQVJFCkFXQVkjQ1VSVCNPSEJPWQpSQVNQI1JBVEUjTk9JU0UKVFJFRUhPVVNFI0FOVEVEClZFUlNVUyMjUk9URSMjIwojIyMjRVNQTiNLQUJPQlMKU1BFQ1MjSU9XQSNPS1JBClRBWEkjU1RPUlkjT0xBRgpJQ0VSI0xBTkUjU0tBVEUKUkVTQ1VFI0VOVlkjIyMjCiMjI1VTREEjI0FOU1dFUgpBUklTRSNCRUxMQ1VSVkUKR09CQUQjVVRJTCNBWUVTCkVMRUNUI1RBTUUjVkVOVApTRVRUTyNTTEFZI0VSQVM="},{"title":"02/01/11 RING THINGS","author":"Billie Truitt, edited by Stanley Newman","date":"2011-02-01","grid":"UEFUSCNBTEFTI1NQQVJFCkFXQVkjQ1VSVCNPSEJPWQpSQVNQI1JBVEUjTk9JU0UKVFJFRUhPVVNFI0FOVEVEClZFUlNVUyMjUk9URSMjIwojIyMjRVNQTiNLQUJPQlMKU1BFQ1MjSU9XQSNPS1JBClRBWEkjU1RPUlkjT0xBRgpJQ0VSI0xBTkUjU0tBVEUKUkVTQ1VFI0VOVlkjIyMjCiMjI1VTREEjI0FOU1dFUgpBUklTRSNCRUxMQ1VSVkUKR09CQUQjVVRJTCNBWUVTCkVMRUNUI1RBTUUjVkVOVApTRVRUTyNTTEFZI0VSQVM="},{"title":"02/02/11 HEADED DOWN","author":"Fred Piscop, edited by Stanley Newman","date":"2011-02-02","grid":"VEFLRSNCQUxMI1ZJU0lUClJVSU4jT1JFTyNBRklSRQpBUlRTI1dJU0MjTkVQQUwKUElDIyNMQVNBR05BIyMjClNDSEVNRVMjTE9VUkRFUwojI0VWRVIjT0RBWSNSVVQKQU5ORVgjRFJJUFMjQUxBClRPU1MjU09BVkUjSUdFVApBTEkjQ0hVVEUjU0NBUkUKUkFOI1JBQkUjREVBTiMjCklOS1dFTEwjU09BTkRTTwojIyNSQVRFRFBHIyNERUYKQkFUSUsjREFSRSNHUklUClVOSVRFI0lERUEjT09aRQpUQVhFRCNQRUVSI09QRU4="},{"title":"02/02/11 HEADED DOWN","author":"Fred Piscop, edited by Stanley Newman","date":"2011-02-02","grid":"VEFLRSNCQUxMI1ZJU0lUClJVSU4jT1JFTyNBRklSRQpBUlRTI1dJU0MjTkVQQUwKUElDIyNMQVNBR05BIyMjClNDSEVNRVMjTE9VUkRFUwojI0VWRVIjT0RBWSNSVVQKQU5ORVgjRFJJUFMjQUxBClRPU1MjU09BVkUjSUdFVApBTEkjQ0hVVEUjU0NBUkUKUkFOI1JBQkUjREVBTiMjCklOS1dFTEwjU09BTkRTTwojIyNSQVRFRFBHIyNERUYKQkFUSUsjREFSRSNHUklUClVOSVRFI0lERUEjT09aRQpUQVhFRCNQRUVSI09QRU4="},{"title":"02/03/11 WELL-FURNISHED","author":"David W. Cromer, edited by Stanley Newman","date":"2011-02-03","grid":"TElNQiNBQlMjU1BPUktTCkVDT0wjVFJJI1JJQ0hJRQpHRVRPRkZPTkVTQ0hFU1QKU0lUQVIjR0VSI0NPQVRTCiNOT1RZT1UjQUFIIyMjIwojIyMjUFJFU1NCVVJFQVUKQkFSVEFCI1RFRSNBVFROCkFMSUVOI0JFRCNUUkFJVApST1BFI1NMUiNHSEVUVE8KQkVBTkNPVU5URVIjIyMjCiMjIyNFWUUjUk9BU1RTIwpBU1NUUyNTUEEjU0hPT1QKU1RBUlNLWUFOREhVVENICklPRElORSNJTkUjTEFLRQpBUEVNQU4jUllFI0FMU08="},{"title":"02/03/11 WELL-FURNISHED","author":"David W. Cromer, edited by Stanley Newman","date":"2011-02-03","grid":"TElNQiNBQlMjU1BPUktTCkVDT0wjVFJJI1JJQ0hJRQpHRVRPRkZPTkVTQ0hFU1QKU0lUQVIjR0VSI0NPQVRTCiNOT1RZT1UjQUFIIyMjIwojIyMjUFJFU1NCVVJFQVUKQkFSVEFCI1RFRSNBVFROCkFMSUVOI0JFRCNUUkFJVApST1BFI1NMUiNHSEVUVE8KQkVBTkNPVU5URVIjIyMjCiMjIyNFWUUjUk9BU1RTIwpBU1NUUyNTUEEjU0hPT1QKU1RBUlNLWUFOREhVVENICklPRElORSNJTkUjTEFLRQpBUEVNQU4jUllFI0FMU08="},{"title":"02/04/11 WHAT, NO CARROTS?","author":"Merle Baker, edited by Stanley Newman","date":"2011-02-04","grid":"QVBQSUEjUEFTQSNQRVBBClBSSU5UI1RQS1MjUFJJRwpCT05BUFBFVElUI1BVUEEKIyMjUEFBUiNQT08jUFBTClRBUEVSUyMjI09OQVRJUApBUEFUI1RSQVBQRVIjIyMKUkVQI0xPVVBFI1VQU0VUClBFUFBFUk1JTlRQQVRUWQpTUFlPTiNQQU5FUyNFQVAKIyMjUEFSU05JUCNQRVBFCkRBWVNQQSMjI0VMT1BFRApVUEkjRU1QI1BFRUwjIyMKRVBQUyNQT0xFU0FQQVJUClVURVAjRVBJQyNQT1BQQQpQU1NUI0RFUFMjU1RVTVA="},{"title":"02/04/11 WHAT, NO CARROTS?","author":"Merle Baker, edited by Stanley Newman","date":"2011-02-04","grid":"QVBQSUEjUEFTQSNQRVBBClBSSU5UI1RQS1MjUFJJRwpCT05BUFBFVElUI1BVUEEKIyMjUEFBUiNQT08jUFBTClRBUEVSUyMjI09OQVRJUApBUEFUI1RSQVBQRVIjIyMKUkVQI0xPVVBFI1VQU0VUClBFUFBFUk1JTlRQQVRUWQpTUFlPTiNQQU5FUyNFQVAKIyMjUEFSU05JUCNQRVBFCkRBWVNQQSMjI0VMT1BFRApVUEkjRU1QI1BFRUwjIyMKRVBQUyNQT0xFU0FQQVJUClVURVAjRVBJQyNQT1BQQQpQU1NUI0RFUFMjU1RVTVA="},{"title":"02/05/11 SATURDAY STUMPER","author":"S.N., edited by Stanley Newman","date":"2011-02-05","grid":"TUFBTkRQQSNGQUJSSUNTCkFMTEVBUlMjSVNFRU5PVwpMRVRTTElQI0xBU0NBTEEKRVhPVElDSVNNI1RPRERZCiMjIyMjRVJPREUjTklDRQpTQUFCUyNJUk9OUyNMRUQKSVRET0VTTlRNQVRURVIjCk1PVkFETyMjI0NBUk1FTgojTUFSR0FSRVRUUlVNQU4KVElOI0VQRUVTI1NFQUxFCkFDVFYjU0NPVVIjIyMjIwpTUEFJTiNBQ05JRUxTRU4KVElHUkVTUyNBUFJJT1JJCkVMRUdBTlQjTUVSUklMTApERVNPVE9TI0lOU0FMRVM="},{"title":"02/05/11 SATURDAY STUMPER","author":"S.N., edited by Stanley Newman","date":"2011-02-05","grid":"TUFBTkRQQSNGQUJSSUNTCkFMTEVBUlMjSVNFRU5PVwpMRVRTTElQI0xBU0NBTEEKRVhPVElDSVNNI1RPRERZCiMjIyMjRVJPREUjTklDRQpTQUFCUyNJUk9OUyNMRUQKSVRET0VTTlRNQVRURVIjCk1PVkFETyMjI0NBUk1FTgojTUFSR0FSRVRUUlVNQU4KVElOI0VQRUVTI1NFQUxFCkFDVFYjU0NPVVIjIyMjIwpTUEFJTiNBQ05JRUxTRU4KVElHUkVTUyNBUFJJT1JJCkVMRUdBTlQjTUVSUklMTApERVNPVE9TI0lOU0FMRVM="},{"title":"02/06/11 THREE OF A KIND: A sextet of triplets","author":"S.N., edited by Stanley Newman","date":"2011-02-06","grid":"REFURUQjSlVMWSNTV0FLI1NUSU5UCkFTT05FI0lGU08jUEFORyNPUkRFUgpZSVBFUyNCT1VOQ0lOR0JBQllCT1kKSkFNIyNZRVMjI1VOVE8jTEVNQU5TCk9HQVVHRSMjQVdFIyNST0FSRURBVApCT1NUT05CQUtFREJFQU5TIyNHVEUKIyNUQU4jSUhBRCNPU1NPI1RXRUVECiMjI0hFTEdBI0lET1MjI01BUiMjIwpBUkMjQklCQklESUJPQkJJRElCT08KREVBREFJUiNOSVMjI1JPVCNUT0xMCkxVUklEI0FERFRPQ0FSVCNTSEFERQpJU0xFI1RXTyMjQkFNI0FNTkVTSUEKQkVBQ0hCTEFOS0VUQklOR08jVEVOCiMjI1VNQSMjRU5ZQSNTSU1PTiMjIwpXU0ZUUyNSSVNFI1dJTlMjWkFQIyMKSUNVIyNCVVRURVJCQVRUTEVCT09LCk5PUlRIRVJTIyNPQVMjI0FTU1VSRQpFTExJT1QjQUxTTyMjQ09HIyNSQVkKQllFQllFQkxBQ0tCSVJEI1VDT05OCkFUU0VBI0xJTUEjSVBPRCNST1VHRQpSRVNUUyNURUVOI1RPV1MjTk9URVM="},{"title":"02/06/11 THREE OF A KIND: A sextet of triplets","author":"S.N., edited by Stanley Newman","date":"2011-02-06","grid":"REFURUQjSlVMWSNTV0FLI1NUSU5UCkFTT05FI0lGU08jUEFORyNPUkRFUgpZSVBFUyNCT1VOQ0lOR0JBQllCT1kKSkFNIyNZRVMjI1VOVE8jTEVNQU5TCk9HQVVHRSMjQVdFIyNST0FSRURBVApCT1NUT05CQUtFREJFQU5TIyNHVEUKIyNUQU4jSUhBRCNPU1NPI1RXRUVECiMjI0hFTEdBI0lET1MjI01BUiMjIwpBUkMjQklCQklESUJPQkJJRElCT08KREVBREFJUiNOSVMjI1JPVCNUT0xMCkxVUklEI0FERFRPQ0FSVCNTSEFERQpJU0xFI1RXTyMjQkFNI0FNTkVTSUEKQkVBQ0hCTEFOS0VUQklOR08jVEVOCiMjI1VNQSMjRU5ZQSNTSU1PTiMjIwpXU0ZUUyNSSVNFI1dJTlMjWkFQIyMKSUNVIyNCVVRURVJCQVRUTEVCT09LCk5PUlRIRVJTIyNPQVMjI0FTU1VSRQpFTExJT1QjQUxTTyMjQ09HIyNSQVkKQllFQllFQkxBQ0tCSVJEI1VDT05OCkFUU0VBI0xJTUEjSVBPRCNST1VHRQpSRVNUUyNURUVOI1RPV1MjTk9URVM="},{"title":"02/07/11 HAVE A BELT","author":"Gail Grabowski, edited by Stanley Newman","date":"2011-02-07","grid":"TlVUUyNTV0FNI1NBTFRZCkFCRVQjVElSRSNBTE9IQQpST0FSI0FTSUEjU0VWRU4KQ0FTVUFMUEFOVFMjRUVLCiNURU1QRSMjU0VFUiMjIwojIyMjVFJPVCNFRElUT1IKU1BPT0wjSUJFVCNHVVJVClRFUlJZQ0xPVEhST0JFUwpBVEFEI1VTTkEjRVJBU0UKUkVMRU5UI0VMQUwjIyMjCiMjI1JFRUQjI0RJTkVTIwpBR1QjVFJFTkNIQ09BVFMKUkVBTE0jTU9MRSNJU0VFCkVNQ0VFI09WRVIjU0VBVApBU0tJTiNTQUZFI0VMTVM="},{"title":"02/07/11 HAVE A BELT","author":"Gail Grabowski, edited by Stanley Newman","date":"2011-02-07","grid":"TlVUUyNTV0FNI1NBTFRZCkFCRVQjVElSRSNBTE9IQQpST0FSI0FTSUEjU0VWRU4KQ0FTVUFMUEFOVFMjRUVLCiNURU1QRSMjU0VFUiMjIwojIyMjVFJPVCNFRElUT1IKU1BPT0wjSUJFVCNHVVJVClRFUlJZQ0xPVEhST0JFUwpBVEFEI1VTTkEjRVJBU0UKUkVMRU5UI0VMQUwjIyMjCiMjI1JFRUQjI0RJTkVTIwpBR1QjVFJFTkNIQ09BVFMKUkVBTE0jTU9MRSNJU0VFCkVNQ0VFI09WRVIjU0VBVApBU0tJTiNTQUZFI0VMTVM="},{"title":"02/08/11 JURY DUTY","author":"Billie Truitt, edited by Stanley Newman","date":"2011-02-08","grid":"QUZBUiNTVFJVTSNCTFVFCkNBS0UjQ0hJTkEjUkFTUApUUklNI09BU0lTI09OQ0UKSU1OT1RPTkVUT0pVREdFCiMjI1ZFVCMjI05BSCMjIwpUSFJFRSNTR1QjUkFaRVMKUllFI05BUExFUyNIRUFMCkFETUlTU0lPTkNIQVJHRQpDUk9DI1BFUlNJQSNPTEQKVE9XRUwjRFlFI1ZJU0VTCiMjI1NFQSMjI0ZPRyMjIwpCQVNLRVRCQUxMQ09VUlQKQVJFQSNUT1RPRSNUUklPCkxJTlQjSU5BTkUjSU5OUwpEQVRFI0NFREVTI1RTS1M="},{"title":"02/08/11 JURY DUTY","author":"Billie Truitt, edited by Stanley Newman","date":"2011-02-08","grid":"QUZBUiNTVFJVTSNCTFVFCkNBS0UjQ0hJTkEjUkFTUApUUklNI09BU0lTI09OQ0UKSU1OT1RPTkVUT0pVREdFCiMjI1ZFVCMjI05BSCMjIwpUSFJFRSNTR1QjUkFaRVMKUllFI05BUExFUyNIRUFMCkFETUlTU0lPTkNIQVJHRQpDUk9DI1BFUlNJQSNPTEQKVE9XRUwjRFlFI1ZJU0VTCiMjI1NFQSMjI0ZPRyMjIwpCQVNLRVRCQUxMQ09VUlQKQVJFQSNUT1RPRSNUUklPCkxJTlQjSU5BTkUjSU5OUwpEQVRFI0NFREVTI1RTS1M="},{"title":"02/09/11 OUTTA HERE","author":"Fred Piscop, edited by Stanley Newman","date":"2011-02-09","grid":"U1BBREUjU0FBQlMjTklQCkFVSlVTI0VYSUxFI1VTTwpQUkFDVElDRVJVTiNUQU8KU0VYVEFOVCNTRVRTQUlMCiMjIyNUT1NTIyNGVU5EUwpBUklTRU4jQUxNT05EIyMKQk9ORVMjU1RFRVIjQklHCkxJRkUjQVRCQVQjUk9ERQpFTEkjQVJFQVMjQ0FMTEEKIyNFVENFVEMjTEFUVEVSCk1JTEVSIyNLSEFOIyMjIwpPRERMT1RTI0VWQVNJVkUKT0FGI0JBTkFOQVNQTElUCk5ITCNBRE9STiNUVUxTQQpTT1kjVEFCQlkjQU5TRUw="},{"title":"02/09/11 OUTTA HERE","author":"Fred Piscop, edited by Stanley Newman","date":"2011-02-09","grid":"U1BBREUjU0FBQlMjTklQCkFVSlVTI0VYSUxFI1VTTwpQUkFDVElDRVJVTiNUQU8KU0VYVEFOVCNTRVRTQUlMCiMjIyNUT1NTIyNGVU5EUwpBUklTRU4jQUxNT05EIyMKQk9ORVMjU1RFRVIjQklHCkxJRkUjQVRCQVQjUk9ERQpFTEkjQVJFQVMjQ0FMTEEKIyNFVENFVEMjTEFUVEVSCk1JTEVSIyNLSEFOIyMjIwpPRERMT1RTI0VWQVNJVkUKT0FGI0JBTkFOQVNQTElUCk5ITCNBRE9STiNUVUxTQQpTT1kjVEFCQlkjQU5TRUw="},{"title":"02/10/11 UPS AND DOWNS","author":"David W. Cromer, edited by Stanley Newman","date":"2011-02-10","grid":"SEFSTSMjQ0xJTUIjTkVUCkFURUFNI0hBTk9JI1VNQQpMSUZUQUZJTkdFUiNNSUcKT0xFI1JFTkVFI0RFQlRTClNUUkFJVCMjU09TQSMjIwojIyNSQUlTRVRIRVJPT0YKU0FMVCNESU0jTUVERExFCkhST1NTI05DTyNEUk9JRApFTEVDVFMjRVJSI1VSTlMKTE9XRVJUSEVCT09NIyMjCiMjI05BU0EjI0JVU1RFUgpBQkJFWSNST0dFVCNJUkUKUVVBI0RST1BBRElNRU9OClVSTCNPSUxFUiNFVFVERQpBUEUjR09ETFkjI1NQRVc="},{"title":"02/10/11 UPS AND DOWNS","author":"David W. Cromer, edited by Stanley Newman","date":"2011-02-10","grid":"SEFSTSMjQ0xJTUIjTkVUCkFURUFNI0hBTk9JI1VNQQpMSUZUQUZJTkdFUiNNSUcKT0xFI1JFTkVFI0RFQlRTClNUUkFJVCMjU09TQSMjIwojIyNSQUlTRVRIRVJPT0YKU0FMVCNESU0jTUVERExFCkhST1NTI05DTyNEUk9JRApFTEVDVFMjRVJSI1VSTlMKTE9XRVJUSEVCT09NIyMjCiMjI05BU0EjI0JVU1RFUgpBQkJFWSNST0dFVCNJUkUKUVVBI0RST1BBRElNRU9OClVSTCNPSUxFUiNFVFVERQpBUEUjR09ETFkjI1NQRVc="},{"title":"02/11/11 CRYSTAL UNCLEAR","author":"Bruce Venzke, edited by Stanley Newman","date":"2011-02-11","grid":"Q0hBRkUjQk9BVCNPTUFSCkhPU0VBI0VVUk8jTkVNTwpVTklUUyNFVFRVI01SU0MKVE9EQVlTUFNZQ0hJQyMjCkVSRSNNQUUjI0FJS0lETwojIyNGQUlSQ0FOQ0VMRUQKTEFTRVJTI09QUyMjRU5EClNMRUVLI0NVRSNQQVNURQpBTEEjI05BUCNURU5TRVIKVE9VTkZPUkVTRUVOIyMjClNUUkFEUyMjQVNLI1NIRQojI0NJUkNVTVNUQU5DRVMKREFITCNPTlVTI0JFQU5TCkVSSUUjUklMRSNPVU5DRQpGRU5EI0VWRVMjT0ZURU4="},{"title":"02/11/11 CRYSTAL UNCLEAR","author":"Bruce Venzke, edited by Stanley Newman","date":"2011-02-11","grid":"Q0hBRkUjQk9BVCNPTUFSCkhPU0VBI0VVUk8jTkVNTwpVTklUUyNFVFRVI01SU0MKVE9EQVlTUFNZQ0hJQyMjCkVSRSNNQUUjI0FJS0lETwojIyNGQUlSQ0FOQ0VMRUQKTEFTRVJTI09QUyMjRU5EClNMRUVLI0NVRSNQQVNURQpBTEEjI05BUCNURU5TRVIKVE9VTkZPUkVTRUVOIyMjClNUUkFEUyMjQVNLI1NIRQojI0NJUkNVTVNUQU5DRVMKREFITCNPTlVTI0JFQU5TCkVSSUUjUklMRSNPVU5DRQpGRU5EI0VWRVMjT0ZURU4="},{"title":"02/12/11 SATURDAY STUMPER","author":"Lester Ruff, edited by Stanley Newman","date":"2011-02-12","grid":"TUFNQUJFQVIjQVNJQU5TCklCRUZPUkVFI0RFU1BPVApNSUxBTkVTRSNERU5JUk8KT0RPUiMjT0REUyNUQU1QClNFTiNBU1BJUklOI1JBUApBU1NJU0kjTk9OTyNJUkUKIyMjTEVUU0dPI1NNRUFSCkJVTExQRU4jUExFQVNFUwpBTElTVCNBU1NJR04jIyMKQlVDI0lTUFkjTUFOQ0hFCkFMRSNDTE9TRUJZI1JVTQpXQU5HI0FOVEUjI0JBUkIKQVRTSUdOI0VSQVNBQkxFCldFRUJJVCNNSUNBV0JFUgpBU1NFVFMjU0VUVExFUlM="},{"title":"02/12/11 SATURDAY STUMPER","author":"Lester Ruff, edited by Stanley Newman","date":"2011-02-12","grid":"TUFNQUJFQVIjQVNJQU5TCklCRUZPUkVFI0RFU1BPVApNSUxBTkVTRSNERU5JUk8KT0RPUiMjT0REUyNUQU1QClNFTiNBU1BJUklOI1JBUApBU1NJU0kjTk9OTyNJUkUKIyMjTEVUU0dPI1NNRUFSCkJVTExQRU4jUExFQVNFUwpBTElTVCNBU1NJR04jIyMKQlVDI0lTUFkjTUFOQ0hFCkFMRSNDTE9TRUJZI1JVTQpXQU5HI0FOVEUjI0JBUkIKQVRTSUdOI0VSQVNBQkxFCldFRUJJVCNNSUNBV0JFUgpBU1NFVFMjU0VUVExFUlM="},{"title":"02/13/11 BEFORE AND AFTER: Inspired by #147;Wheel of Fortune#148;","author":"David W. Cromer, edited by Stanley Newman","date":"2011-02-13","grid":"V0hPQ0FSRVMjVFJBTSNQUkFUVExFCkhBTkRJRVNUI0hVTUUjSE9OT1JFRApPVVRFUlNQQUNFQkFSI0VOR1JBVkUKQVRWI1NFSSNST0UjTEFXIyMjREVOCiMjI0RFTEVURSMjVE9OI1NIT0VSUwpTT0NJQUxTRUNVUklUWUdVQVJEIyMKVEhBTiMjI1RIUkVFIyNMSU1BIyMjCkFNUCNTQ1JFRU5DUkVESVRTTElQUwpCWUUjRUxJUyMjIyNMT0IjIyNNQVAKIyMjQklPRyMjSk9VTEUjU0lDSUxZCiMjTEFaWVNVU0FOU0FSQU5ET04jIwpBQklERVMjU0FNT0EjI01BU1QjIyMKQk9BIyMjRUVSIyMjI0RPUkEjTURTCkNPTVBBQ1RESVNDSk9DS0VZI0FBSAojIyNTTEFUIyNUT0VBVCMjI0FVUkEKIyNGQVRIRVJGSUdVUkVTS0FUSU5HClNQT1RPTiNPVVIjI0VOTElTVCMjIwpIQVMjIyNHWU0jRVJSI0VMSyNFQVIKRU5URUJCRSNCT0RZU0xBTURBTkNFCkVaRUtJRUwjTEFORSNFVkVBUkRFTgpQQVJFTlRTI0VUQVMjTkVSRElFU1Q="},{"title":"02/13/11 BEFORE AND AFTER: Inspired by #147;Wheel of Fortune#148;","author":"David W. Cromer, edited by Stanley Newman","date":"2011-02-13","grid":"V0hPQ0FSRVMjVFJBTSNQUkFUVExFCkhBTkRJRVNUI0hVTUUjSE9OT1JFRApPVVRFUlNQQUNFQkFSI0VOR1JBVkUKQVRWI1NFSSNST0UjTEFXIyMjREVOCiMjI0RFTEVURSMjVE9OI1NIT0VSUwpTT0NJQUxTRUNVUklUWUdVQVJEIyMKVEhBTiMjI1RIUkVFIyNMSU1BIyMjCkFNUCNTQ1JFRU5DUkVESVRTTElQUwpCWUUjRUxJUyMjIyNMT0IjIyNNQVAKIyMjQklPRyMjSk9VTEUjU0lDSUxZCiMjTEFaWVNVU0FOU0FSQU5ET04jIwpBQklERVMjU0FNT0EjI01BU1QjIyMKQk9BIyMjRUVSIyMjI0RPUkEjTURTCkNPTVBBQ1RESVNDSk9DS0VZI0FBSAojIyNTTEFUIyNUT0VBVCMjI0FVUkEKIyNGQVRIRVJGSUdVUkVTS0FUSU5HClNQT1RPTiNPVVIjI0VOTElTVCMjIwpIQVMjIyNHWU0jRVJSI0VMSyNFQVIKRU5URUJCRSNCT0RZU0xBTURBTkNFCkVaRUtJRUwjTEFORSNFVkVBUkRFTgpQQVJFTlRTI0VUQVMjTkVSRElFU1Q="},{"title":"02/14/11 VALENTINE'S DAY","author":"Billie Truitt, edited by Stanley Newman","date":"2011-02-14","grid":"Q1BBUyMjTUFTVCNCQlMjCkxPRlQjQ0FDVEkjQVJBQgpFVVJPI1JBVE9OI1NPVVIKRlJPTU1FTU9SWSNJT1RBCiMjI1BFQSNSRVRBQ0tFRApJUkUjQVNII1NPWUEjIyMKQkVEU1RFQUQjVEVMTE9GCk1BR0kjI1NJUyMjTEFLRQpTUEVORFMjUFVTU1lDQVQKIyMjQ0FOSSNNUEgjRVlFClJFQ0VESU5HI09JTCMjIwpPRE9SI0ZBTExJTkxPVkUKTUlMRSNGUkFJTCNBUkVBCkVDT0wjTE9ERVMjTUFUUwojVFJZI0VXRVMjI0FMT1Q="},{"title":"02/14/11 VALENTINE'S DAY","author":"Billie Truitt, edited by Stanley Newman","date":"2011-02-14","grid":"Q1BBUyMjTUFTVCNCQlMjCkxPRlQjQ0FDVEkjQVJBQgpFVVJPI1JBVE9OI1NPVVIKRlJPTU1FTU9SWSNJT1RBCiMjI1BFQSNSRVRBQ0tFRApJUkUjQVNII1NPWUEjIyMKQkVEU1RFQUQjVEVMTE9GCk1BR0kjI1NJUyMjTEFLRQpTUEVORFMjUFVTU1lDQVQKIyMjQ0FOSSNNUEgjRVlFClJFQ0VESU5HI09JTCMjIwpPRE9SI0ZBTExJTkxPVkUKTUlMRSNGUkFJTCNBUkVBCkVDT0wjTE9ERVMjTUFUUwojVFJZI0VXRVMjI0FMT1Q="},{"title":"02/15/11 ALL AGLOW","author":"Gail Grabowski, edited by Stanley Newman","date":"2011-02-15","grid":"Qk9PVCNTSVRTI1BBUEVSCkxBTUUjVFJVRSNBQk9WRQpUSEVOI1JPQkUjUlVMRUQKU1VOU0hJTkVTVEFURSMjCiMjIyNBUEUjI0lEUyMjIwpJU0JBRCNEQU5DRSNBUFIKU0tJQ0FQI1dPSyNBQkxFCkxJR0hUT05PTkVTRkVFVApBVE9FI09BSyNUQVJUQVIKTVNUI0VER0VEI0JPU1NZCiMjI1BBTCMjRVdFIyMjIwojI0ZJUkVPRkZBUkVQTFkKQUxJRU4jU0FJRCNBUkVBCkxBTkNFI0xJTkUjU09BUgpBRERFRCNPTEVTI0VTUE4="},{"title":"02/15/11 ALL AGLOW","author":"Gail Grabowski, edited by Stanley Newman","date":"2011-02-15","grid":"Qk9PVCNTSVRTI1BBUEVSCkxBTUUjVFJVRSNBQk9WRQpUSEVOI1JPQkUjUlVMRUQKU1VOU0hJTkVTVEFURSMjCiMjIyNBUEUjI0lEUyMjIwpJU0JBRCNEQU5DRSNBUFIKU0tJQ0FQI1dPSyNBQkxFCkxJR0hUT05PTkVTRkVFVApBVE9FI09BSyNUQVJUQVIKTVNUI0VER0VEI0JPU1NZCiMjI1BBTCMjRVdFIyMjIwojI0ZJUkVPRkZBUkVQTFkKQUxJRU4jU0FJRCNBUkVBCkxBTkNFI0xJTkUjU09BUgpBRERFRCNPTEVTI0VTUE4="},{"title":"02/16/11 DO TELL","author":"Fred Jackson III, edited by Stanley Newman","date":"2011-02-16","grid":"SlVMWSNTUEVDSyNVUFRPCkZSRUUjVEVYQU4jUExPVwpLSUFTI0FSSVNFI05FT04KI1NQSUxMU1RIRUJFQU5TCiMjI0tJTE8jI0xBWCMjIwpTSUdOUyNORkwjU1RBTVAKQUxMT1RTI0xBUyMjQ0FSCkJMT1dTVEhFV0hJU1RMRQpFQkIjI1VBRSNFTlRJVFkKUkVFRlMjVFNQI0FSSUFTCiMjI0FJUiMjUk9QRSMjIwpUQUxLU09VVE9GVFVSTiMKSVNFRSNBR0VOVCNTRUFUCk1JTkkjU0xBVEUjRURHRQpFQVNUI1RZU09OI0xPU0U="},{"title":"02/16/11 DO TELL","author":"Fred Jackson III, edited by Stanley Newman","date":"2011-02-16","grid":"SlVMWSNTUEVDSyNVUFRPCkZSRUUjVEVYQU4jUExPVwpLSUFTI0FSSVNFI05FT04KI1NQSUxMU1RIRUJFQU5TCiMjI0tJTE8jI0xBWCMjIwpTSUdOUyNORkwjU1RBTVAKQUxMT1RTI0xBUyMjQ0FSCkJMT1dTVEhFV0hJU1RMRQpFQkIjI1VBRSNFTlRJVFkKUkVFRlMjVFNQI0FSSUFTCiMjI0FJUiMjUk9QRSMjIwpUQUxLU09VVE9GVFVSTiMKSVNFRSNBR0VOVCNTRUFUCk1JTkkjU0xBVEUjRURHRQpFQVNUI1RZU09OI0xPU0U="},{"title":"02/17/11 BAKE SHOP","author":"Robert A. Doll, edited by Stanley Newman","date":"2011-02-17","grid":"QUNUT1IjQkxBQiNTT0xFCkNVUklFI0xPVkUjSVZFUwpESklORyNJR09SI05FQVQKQ09PS0lFTU9OU1RFUiMjCiMjIyNNQVBTI0VSQVNFUwpBR0dJRVMjIyNST0RFTlQKUElFSU5USEVTS1kjRVRFClBBVFMjI0lSQSMjRElSRQpFTlQjQlJFQURXSU5ORVIKQU5ZSE9PIyMjSU1BR0VTClJJU0VSUyNITU1NIyMjIwojI0JST1dOSUVQT0lOVFMKU0xVTSNFT05TI1JPTEVTCkhFUkUjTFBHQSNBVEVBVApFR0dTI0xFRVMjTEFSS1M="},{"title":"02/17/11 BAKE SHOP","author":"Robert A. Doll, edited by Stanley Newman","date":"2011-02-17","grid":"QUNUT1IjQkxBQiNTT0xFCkNVUklFI0xPVkUjSVZFUwpESklORyNJR09SI05FQVQKQ09PS0lFTU9OU1RFUiMjCiMjIyNNQVBTI0VSQVNFUwpBR0dJRVMjIyNST0RFTlQKUElFSU5USEVTS1kjRVRFClBBVFMjI0lSQSMjRElSRQpFTlQjQlJFQURXSU5ORVIKQU5ZSE9PIyMjSU1BR0VTClJJU0VSUyNITU1NIyMjIwojI0JST1dOSUVQT0lOVFMKU0xVTSNFT05TI1JPTEVTCkhFUkUjTFBHQSNBVEVBVApFR0dTI0xFRVMjTEFSS1M="},{"title":"02/18/11 QUITE CORRECT","author":"Doug Peterson, edited by Stanley Newman","date":"2011-02-18","grid":"Q09LRSNBUk1TI0dBSUxZCkFIQUIjTkVBUCNPRERFUgpTTk9XI0RPTEUjQVZPV1MKS09TSEVSUElDS0xFIyMjCiMjI0lTRUUjI0FJUkFDRQojRklUVElOR1RIRUJJTEwKUkVORUUjI0FJTCNTS0lNCkFERCNTSEFNUE9PI0lQTwpMT09TI0FSRSMjVVBET1MKUFJPUEVSRlJBQ1RJT04jCkhBUk9MRCMjRk9JTCMjIwojIyNSSUdIVEZJRUxERVIKSFlBVFQjVEhJTiNCT1pPCkFJTUVFI1RPUk8jT1VSUwpJUE9EUyNQVU1QI1hSQVk="},{"title":"02/18/11 QUITE CORRECT","author":"Doug Peterson, edited by Stanley Newman","date":"2011-02-18","grid":"Q09LRSNBUk1TI0dBSUxZCkFIQUIjTkVBUCNPRERFUgpTTk9XI0RPTEUjQVZPV1MKS09TSEVSUElDS0xFIyMjCiMjI0lTRUUjI0FJUkFDRQojRklUVElOR1RIRUJJTEwKUkVORUUjI0FJTCNTS0lNCkFERCNTSEFNUE9PI0lQTwpMT09TI0FSRSMjVVBET1MKUFJPUEVSRlJBQ1RJT04jCkhBUk9MRCMjRk9JTCMjIwojIyNSSUdIVEZJRUxERVIKSFlBVFQjVEhJTiNCT1pPCkFJTUVFI1RPUk8jT1VSUwpJUE9EUyNQVU1QI1hSQVk="},{"title":"02/19/11 SATURDAY STUMPER","author":"Brad Wilber, edited by Stanley Newman","date":"2011-02-19","grid":"I0hFTERPRkYjRVRDSEVTCk1FTU9SSUFMI1BBUEFZQQpBTEFOQUxEQSNIVVJMRUQKU0xJTkcjI1RBUlQjRk9FClNPTE8jT1NURU8jQ0FQTgojIyNMQU5URVJOSkFXRUQKREVQI0JFQU5PI09NQU5JCklNUkVBRFkjQkVUT0tFTgpTUElMVCNIRUFSVCNFUkcKTU9DS0VMRUNUSU9OIyMjCkFXRVMjQVJPU0UjQUNEQwpORVQjT1BFQyMjT1NIRUEKVFJBTVBTI0lMTFVTQUdFCkxFR1JFRSNESU9DRVNBTgpFRFNFTFMjRVVDSFJFUyM="},{"title":"02/19/11 SATURDAY STUMPER","author":"Brad Wilber, edited by Stanley Newman","date":"2011-02-19","grid":"I0hFTERPRkYjRVRDSEVTCk1FTU9SSUFMI1BBUEFZQQpBTEFOQUxEQSNIVVJMRUQKU0xJTkcjI1RBUlQjRk9FClNPTE8jT1NURU8jQ0FQTgojIyNMQU5URVJOSkFXRUQKREVQI0JFQU5PI09NQU5JCklNUkVBRFkjQkVUT0tFTgpTUElMVCNIRUFSVCNFUkcKTU9DS0VMRUNUSU9OIyMjCkFXRVMjQVJPU0UjQUNEQwpORVQjT1BFQyMjT1NIRUEKVFJBTVBTI0lMTFVTQUdFCkxFR1JFRSNESU9DRVNBTgpFRFNFTFMjRVVDSFJFUyM="},{"title":"02/20/11 PERIOD PIECE: We've got something to hide","author":"Fred Jackson III, edited by Stanley Newman","date":"2011-02-20","grid":"QlVMQiNQTEFOQiNUT1QjS0VWSU4jCk9ISU8jT1VUSUUjRVJFI0lDRUNBUApBVVRPTU9CSUxFUkFDRSNUSFJPTkUKU0hFI0FMRUMjTEFNQVMjQ09JTk9QCiMjI0VYRVMjTElOVVMjUEhJTCMjIwpCQVdMRUQjU0VORFMjI1JFQ1lDTEUKQVBISUQjTkVWRVJBR0FJTiMjQUFTCklSSVMjR0VSRSMjI0FSQ1MjSFRUUApMSVQjI1JJRkxFUkFOR0UjQkFUVFkKU0xFRERPR1MjRkFSR08jQkVMTEVTCiMjUkFKQUgjVFJJTVMjQlJBVkUjIwpHUkFWRU4jR0VFU0UjVFJBVkVSU0UKUkVCSUQjSEFNTUVSQVdBWSMjQVRNCk9UQlMjU09VUCMjI0RBSVMjS05FRQpXSUkjI1BPTElDRVJBSUQjTklDRVIKTEVUU05PVCMjQUxJR04jUkFTSExZCiMjI0VBVFMjSVJFTkUjRkFEUyMjIwpFTlRBSUwjQ1JPQ1MjU0FSSSNFTEsKUk9ZQUxFI0JBTFRJTU9SRVJBVkVOCkFFUklFUyNFTkUjTkFSQ1MjRElORQojTE9SRFMjUklEI0dSRUVUI1NMT1c="},{"title":"02/20/11 PERIOD PIECE: We've got something to hide","author":"Fred Jackson III, edited by Stanley Newman","date":"2011-02-20","grid":"QlVMQiNQTEFOQiNUT1QjS0VWSU4jCk9ISU8jT1VUSUUjRVJFI0lDRUNBUApBVVRPTU9CSUxFUkFDRSNUSFJPTkUKU0hFI0FMRUMjTEFNQVMjQ09JTk9QCiMjI0VYRVMjTElOVVMjUEhJTCMjIwpCQVdMRUQjU0VORFMjI1JFQ1lDTEUKQVBISUQjTkVWRVJBR0FJTiMjQUFTCklSSVMjR0VSRSMjI0FSQ1MjSFRUUApMSVQjI1JJRkxFUkFOR0UjQkFUVFkKU0xFRERPR1MjRkFSR08jQkVMTEVTCiMjUkFKQUgjVFJJTVMjQlJBVkUjIwpHUkFWRU4jR0VFU0UjVFJBVkVSU0UKUkVCSUQjSEFNTUVSQVdBWSMjQVRNCk9UQlMjU09VUCMjI0RBSVMjS05FRQpXSUkjI1BPTElDRVJBSUQjTklDRVIKTEVUU05PVCMjQUxJR04jUkFTSExZCiMjI0VBVFMjSVJFTkUjRkFEUyMjIwpFTlRBSUwjQ1JPQ1MjU0FSSSNFTEsKUk9ZQUxFI0JBTFRJTU9SRVJBVkVOCkFFUklFUyNFTkUjTkFSQ1MjRElORQojTE9SRFMjUklEI0dSRUVUI1NMT1c="},{"title":"02/21/11 PAINT IT","author":"Gail Grabowski, edited by Stanley Newman","date":"2011-02-21","grid":"REFURUQjWUFQUyNTV0FUCk9MSVZFI0VMSVMjTklDRQpaT0RJQUNTSUdOI09HUkUKI1RFTExPTiMjU0VSR0VTCiMjIyNFUk9ERSNHRUwjIwpBVUJVUk4jQVJDQURFUyMKR1JJTlMjRlJBVUQjUkVECkVHR1MjQ1JFU1QjVE9ORQpTRVAjR0VFU0UjTE9PU0UKI1NJR05PVVQjQkVBTUVECiMjQ0lBI0RPT1JTIyMjIwpQT1RBVE8jI1RJU1NVRSMKQVJVTiNPTlRIRUZFTkNFClBBUlQjUFVSRSNBUkRPUgpBTEVTI1NUQVIjVEJPTkU="},{"title":"02/21/11 PAINT IT","author":"Gail Grabowski, edited by Stanley Newman","date":"2011-02-21","grid":"REFURUQjWUFQUyNTV0FUCk9MSVZFI0VMSVMjTklDRQpaT0RJQUNTSUdOI09HUkUKI1RFTExPTiMjU0VSR0VTCiMjIyNFUk9ERSNHRUwjIwpBVUJVUk4jQVJDQURFUyMKR1JJTlMjRlJBVUQjUkVECkVHR1MjQ1JFU1QjVE9ORQpTRVAjR0VFU0UjTE9PU0UKI1NJR05PVVQjQkVBTUVECiMjQ0lBI0RPT1JTIyMjIwpQT1RBVE8jI1RJU1NVRSMKQVJVTiNPTlRIRUZFTkNFClBBUlQjUFVSRSNBUkRPUgpBTEVTI1NUQVIjVEJPTkU="},{"title":"02/22/11 BY GEORGE? NOPE","author":"S.N., edited by Stanley Newman","date":"2011-02-22","grid":"QkxPVCNGRUVTI0FDTUVTClJBUkUjTEFNRSNUSEVSRQpJQ0FOTk9UVEVMTEFMSUUKR0VMI0lSSVMjRUFTVEVSCiMjI1JBSU4jQ0FTRSMjIwpNSU1JQ1MjRkFTVCNHQVkKSURJRElUV0lUSCNMVUdFClJJU0VOI0FYRSNURUFSUwpUT1RTI0NIRVJSWVRSRUUKSE1TI0NPT1MjRVJPREVTCiMjI1NVTU8jQUxBTiMjIwpBTVBFUkUjRUNPTiNTUEEKTVlMSVRUTEVIQVRDSEVUCklOQU5FI1RFRUQjUE9FTQpTQU5FUiNSRURTI1JFUFM="},{"title":"02/22/11 BY GEORGE? NOPE","author":"S.N., edited by Stanley Newman","date":"2011-02-22","grid":"QkxPVCNGRUVTI0FDTUVTClJBUkUjTEFNRSNUSEVSRQpJQ0FOTk9UVEVMTEFMSUUKR0VMI0lSSVMjRUFTVEVSCiMjI1JBSU4jQ0FTRSMjIwpNSU1JQ1MjRkFTVCNHQVkKSURJRElUV0lUSCNMVUdFClJJU0VOI0FYRSNURUFSUwpUT1RTI0NIRVJSWVRSRUUKSE1TI0NPT1MjRVJPREVTCiMjI1NVTU8jQUxBTiMjIwpBTVBFUkUjRUNPTiNTUEEKTVlMSVRUTEVIQVRDSEVUCklOQU5FI1RFRUQjUE9FTQpTQU5FUiNSRURTI1JFUFM="},{"title":"02/23/11 RURALLY SPEAKING","author":"Fred Piscop, edited by Stanley Newman","date":"2011-02-23","grid":"QVJDRUQjUFJFUFMjUEZDClNPTFZFI1JFTElDI0xFTwpQTEFJTkRFQUxFUiNBTVAKU0VXTiNFU1AjI0lYTkFZCiMjI0NIRVQjVU5NRVQjIwojI01FQURPV1NPUFJBTk8KR1JBRFMjI0hFTiNTVE9XClJFUyNIT05PUkVFI1JFTApBRlRTI0RFTSMjUkVFTFMKRklFTERFWEVSQ0lTRSMjCiMjUk9PU1QjQUxFQyMjIwpMQVBFTCMjQVNJI0FVREkKVVJMI0xFQVRIT01QU09OCk1FQSNBUFJJTCNCRVRPTgpQQU4jUkFUVFkjQURBTVM="},{"title":"02/23/11 RURALLY SPEAKING","author":"Fred Piscop, edited by Stanley Newman","date":"2011-02-23","grid":"QVJDRUQjUFJFUFMjUEZDClNPTFZFI1JFTElDI0xFTwpQTEFJTkRFQUxFUiNBTVAKU0VXTiNFU1AjI0lYTkFZCiMjI0NIRVQjVU5NRVQjIwojI01FQURPV1NPUFJBTk8KR1JBRFMjI0hFTiNTVE9XClJFUyNIT05PUkVFI1JFTApBRlRTI0RFTSMjUkVFTFMKRklFTERFWEVSQ0lTRSMjCiMjUk9PU1QjQUxFQyMjIwpMQVBFTCMjQVNJI0FVREkKVVJMI0xFQVRIT01QU09OCk1FQSNBUFJJTCNCRVRPTgpQQU4jUkFUVFkjQURBTVM="},{"title":"02/24/11 FAKING IT","author":"Billie Truitt, edited by Stanley Newman","date":"2011-02-24","grid":"Q0FSUCNTVFJVTSNCT0dTCkFSRUEjQVJPU0UjSU1PSwpMSUVTI1RJTUVEI0FOVEkKRkFMU0VJTVBSRVNTSU9OCiMjI0lOTiMjI0FURSMjIwpGQUNUUyNBTVMjSVNMRVQKQUZSTyNCUlVUQUwjT0xFCkNPVU5URVJGRUlUQ09JTgpFUkUjSEVBVEVEI0FTVE8KREVMSEkjWUlQI1NORUVSCiMjI0VFTCMjI0ZBQSMjIwpBUlRJRklDSUFMR1JBU1MKUk9PRiNNT09MQSNJQ09OClRPUkUjQkFURVMjRU1NQQpTVElSI1NUQVNII1NFRVA="},{"title":"02/24/11 FAKING IT","author":"Billie Truitt, edited by Stanley Newman","date":"2011-02-24","grid":"Q0FSUCNTVFJVTSNCT0dTCkFSRUEjQVJPU0UjSU1PSwpMSUVTI1RJTUVEI0FOVEkKRkFMU0VJTVBSRVNTSU9OCiMjI0lOTiMjI0FURSMjIwpGQUNUUyNBTVMjSVNMRVQKQUZSTyNCUlVUQUwjT0xFCkNPVU5URVJGRUlUQ09JTgpFUkUjSEVBVEVEI0FTVE8KREVMSEkjWUlQI1NORUVSCiMjI0VFTCMjI0ZBQSMjIwpBUlRJRklDSUFMR1JBU1MKUk9PRiNNT09MQSNJQ09OClRPUkUjQkFURVMjRU1NQQpTVElSI1NUQVNII1NFRVA="},{"title":"02/25/11 ADVANCE","author":"Richard Silvestri, edited by Stanley Newman","date":"2011-02-25","grid":"RFVDVCNTTE9QI01BUkdFCkFDUkUjQ0VDRSNBVEhPUwpCTFVFSE9ORVIjUkVJTlMKU0FYI0VUVEEjQlJPTlpFCiMjI1NFQ09ORFRPTkVPTgpSSVlBREgjI1BFVyMjIyMKQVJBQlMjRkFMQSNTRU1JCkNBTEwjQUxCVU0jVFZBRApLTkVFI0xPU1MjTUFJWkUKIyMjI0ZJUiMjRUFHTEVTCklDRUNSRUFNT05DRSMjIwpNT1ZFT04jT0lMWSNGT0UKQlJBRFMjTE9OSVNDTFVCCkVOREFUI0lSS1MjUElTQQpEWUVSUyNaRVNUI0FUVFk="},{"title":"02/25/11 ADVANCE","author":"Richard Silvestri, edited by Stanley Newman","date":"2011-02-25","grid":"RFVDVCNTTE9QI01BUkdFCkFDUkUjQ0VDRSNBVEhPUwpCTFVFSE9ORVIjUkVJTlMKU0FYI0VUVEEjQlJPTlpFCiMjI1NFQ09ORFRPTkVPTgpSSVlBREgjI1BFVyMjIyMKQVJBQlMjRkFMQSNTRU1JCkNBTEwjQUxCVU0jVFZBRApLTkVFI0xPU1MjTUFJWkUKIyMjI0ZJUiMjRUFHTEVTCklDRUNSRUFNT05DRSMjIwpNT1ZFT04jT0lMWSNGT0UKQlJBRFMjTE9OSVNDTFVCCkVOREFUI0lSS1MjUElTQQpEWUVSUyNaRVNUI0FUVFk="},{"title":"02/26/11 SATURDAY STUMPER","author":"Doug Peterson, edited by Stanley Newman","date":"2011-02-26","grid":"SVRTVE9PTEFURSNDSEFUCk5PV09STkVWRVIjTE9DSApUV0lOQ0lUSUVTI0FSQ08KT05UI0hPT0QjS0lTU0VSCiMjI0ZFTk4jRElTUEVMIwpDVVRFU1kjTUlOQSNDRUUKQVRJTFQjR0FWRUFEQVJOCk1JTk9SI1JZRSNDVVJBRApQTEFOQUhFQUQjTUFUVEUKU0lUI1BPR1MjUklOU0VECiNUVUJJTkcjTUFaRSMjIwpHWVJBVEUjTVVJUiNSQUoKT01OSSNTVEFOREFMT05FCkJBRVojVEVSUkVIQVVURQpJTlJFI1lPWU9ESUVURVI="},{"title":"02/26/11 SATURDAY STUMPER","author":"Doug Peterson, edited by Stanley Newman","date":"2011-02-26","grid":"SVRTVE9PTEFURSNDSEFUCk5PV09STkVWRVIjTE9DSApUV0lOQ0lUSUVTI0FSQ08KT05UI0hPT0QjS0lTU0VSCiMjI0ZFTk4jRElTUEVMIwpDVVRFU1kjTUlOQSNDRUUKQVRJTFQjR0FWRUFEQVJOCk1JTk9SI1JZRSNDVVJBRApQTEFOQUhFQUQjTUFUVEUKU0lUI1BPR1MjUklOU0VECiNUVUJJTkcjTUFaRSMjIwpHWVJBVEUjTVVJUiNSQUoKT01OSSNTVEFOREFMT05FCkJBRVojVEVSUkVIQVVURQpJTlJFI1lPWU9ESUVURVI="},{"title":"02/27/11 MEET THE BEETLES: Not the crawly kind","author":"Fred Piscop, edited by Stanley Newman","date":"2011-02-27","grid":"SEVST0QjRVBJQyNSSUZUI1JBTkFUCklSRU5FI0xBUkEjRVJJRSNFQ09OTwpWSUVUTkFNV0FSI1ZBTk5BV0hJVEUKRU5EQVNIRVMjI05JVEUjVElFUkVECiMjI1BFQVIjI1JPVkVSI0VORCMjIwpHQVZFIyMjQklPVEEjI1BBRCNWT1cKT0JJI1ZFTlVTV0lMTElBTVMjQU5BCldPTiNBVkVSVFMjI0lOTlMjUExBTgpOVVQjTEVHR08jQ0hFRlMjI0FWSUQKU1RBVFVSRSMjUFJBVEUjI01ZRVJTCiMjR0VFI1ZPR1VFV09SRCNZRVcjIwpTUEVORCMjUkFDRVMjI0lOU0VSVFMKTE9XRSMjUEFSRUQjRE9ORUUjRVJBCkFUSVQjVEVOTiMjQkVOR0FMI05BVwpUT04jVklSR0lOSUFXT09MRiNDSVQKRUtFI0lOSyMjQVNTWVIjIyNPSE5PCiMjI1RPTSNHQVNQUyMjVVNNQyMjIwpBVFRJTEEjT0xBWSMjU0hPT1RPRkYKVklSR0lOV09PTCNWSUNIWVdBVEVSCkdSRUVOI0lET0wjRVNBVSNFVklURQpTRUVSUyNTWUZZI0dPVEgjUkVTRVQ="},{"title":"02/27/11 MEET THE BEETLES: Not the crawly kind","author":"Fred Piscop, edited by Stanley Newman","date":"2011-02-27","grid":"SEVST0QjRVBJQyNSSUZUI1JBTkFUCklSRU5FI0xBUkEjRVJJRSNFQ09OTwpWSUVUTkFNV0FSI1ZBTk5BV0hJVEUKRU5EQVNIRVMjI05JVEUjVElFUkVECiMjI1BFQVIjI1JPVkVSI0VORCMjIwpHQVZFIyMjQklPVEEjI1BBRCNWT1cKT0JJI1ZFTlVTV0lMTElBTVMjQU5BCldPTiNBVkVSVFMjI0lOTlMjUExBTgpOVVQjTEVHR08jQ0hFRlMjI0FWSUQKU1RBVFVSRSMjUFJBVEUjI01ZRVJTCiMjR0VFI1ZPR1VFV09SRCNZRVcjIwpTUEVORCMjUkFDRVMjI0lOU0VSVFMKTE9XRSMjUEFSRUQjRE9ORUUjRVJBCkFUSVQjVEVOTiMjQkVOR0FMI05BVwpUT04jVklSR0lOSUFXT09MRiNDSVQKRUtFI0lOSyMjQVNTWVIjIyNPSE5PCiMjI1RPTSNHQVNQUyMjVVNNQyMjIwpBVFRJTEEjT0xBWSMjU0hPT1RPRkYKVklSR0lOV09PTCNWSUNIWVdBVEVSCkdSRUVOI0lET0wjRVNBVSNFVklURQpTRUVSUyNTWUZZI0dPVEgjUkVTRVQ="},{"title":"02/28/11 IT'S EASY","author":"Billie Truitt, edited by Stanley Newman","date":"2011-02-28","grid":"U0FLRSMjQU1NTyNBQ1RTCkNMRUFSI0xPT1AjU0hPUApBU1BDQSNJU05UI1BJVEEKTk9USElOR1RPSVQjTEFECiMjIyNET04jI01JRERMRQpBU0VWRVIjU0hJTkVTIyMKUlVMRVIjQklPUyNBUFBTClRSRVgjQ1JFU1QjRkxFRQpTRU1JI0hBVkUjTEVBU0UKIyNFTlJBR0UjQ0FOWU9OCkhBTkdBUiMjU09XIyMjIwpPQ1QjUElFQ0VPRkNBS0UKVEhBTiNTUEFOI1VQT05BCkxPUkUjTUlTUyNMT05FUgpZT1lPI0FDSEUjI1NFV04="},{"title":"02/28/11 IT'S EASY","author":"Billie Truitt, edited by Stanley Newman","date":"2011-02-28","grid":"U0FLRSMjQU1NTyNBQ1RTCkNMRUFSI0xPT1AjU0hPUApBU1BDQSNJU05UI1BJVEEKTk9USElOR1RPSVQjTEFECiMjIyNET04jI01JRERMRQpBU0VWRVIjU0hJTkVTIyMKUlVMRVIjQklPUyNBUFBTClRSRVgjQ1JFU1QjRkxFRQpTRU1JI0hBVkUjTEVBU0UKIyNFTlJBR0UjQ0FOWU9OCkhBTkdBUiMjU09XIyMjIwpPQ1QjUElFQ0VPRkNBS0UKVEhBTiNTUEFOI1VQT05BCkxPUkUjTUlTUyNMT05FUgpZT1lPI0FDSEUjI1NFV04="},{"title":"03/01/11 DOUBLE NEGATIVES","author":"Gail Grabowski, edited by Stanley Newman","date":"2011-03-01","grid":"U0FQUyNDTEFEI1NDUkFQCkNVUkwjUklDRSNFTEFURQpBUkVBI0FOVEUjRVVST1MKTUFZQkVZRVNNQVlCRU5PCiMjIyNDT04jI01BUyMjIwojQVJTT04jU1BBIyNBR08KQVNJQU4jSE9FUyNBVEFECldJTlNPTUVMT1NFU09NRQpFREdFI0lST04jVklORVMKREVTIyNBQlMjUklTRVMjCiMjI0FSTSMjT0FUIyMjIwpPTkFHQUlOT0ZGQUdBSU4KTklQQVQjQUJVVCNFTFNFCkVMT1BFI1BPU0UjTU9MRQpTRURFUiNTRUVSI1NFRUQ="},{"title":"03/01/11 DOUBLE NEGATIVES","author":"Gail Grabowski, edited by Stanley Newman","date":"2011-03-01","grid":"U0FQUyNDTEFEI1NDUkFQCkNVUkwjUklDRSNFTEFURQpBUkVBI0FOVEUjRVVST1MKTUFZQkVZRVNNQVlCRU5PCiMjIyNDT04jI01BUyMjIwojQVJTT04jU1BBIyNBR08KQVNJQU4jSE9FUyNBVEFECldJTlNPTUVMT1NFU09NRQpFREdFI0lST04jVklORVMKREVTIyNBQlMjUklTRVMjCiMjI0FSTSMjT0FUIyMjIwpPTkFHQUlOT0ZGQUdBSU4KTklQQVQjQUJVVCNFTFNFCkVMT1BFI1BPU0UjTU9MRQpTRURFUiNTRUVSI1NFRUQ="},{"title":"03/02/11 WHAT'S YOUR BEEF","author":"Fred Piscop, edited by Stanley Newman","date":"2011-03-02","grid":"TUlTVCNBUklBI0xVTVBTClVOVE8jTkVUUyNBU0lBTgpTQ0FNI1RBQ1QjUE9MTE8KS0FSQVRFQ0hPUFMjS0VXCiMjI1RIQVQjI0JFRVQjIwpSSVBPVVQjQlJBI0xPSU4KRVJBI01FRElBI1BJQU5PCkNFTEVCUklUWVJPQVNUUwpVTklUUyNCRVNFVCNUUkkKUkVOVCNBU1MjVkFTU0FSCiMjREVBTCMjU0VUSCMjIwpET1IjRklOQUxST1VORFMKRU5PS0kjRVJJRSNUT09MCkVMTUVSI1NFRU4jVVBUTwpNWUVZRSNUQVJUI1BFRVA="},{"title":"03/02/11 WHAT'S YOUR BEEF","author":"Fred Piscop, edited by Stanley Newman","date":"2011-03-02","grid":"TUlTVCNBUklBI0xVTVBTClVOVE8jTkVUUyNBU0lBTgpTQ0FNI1RBQ1QjUE9MTE8KS0FSQVRFQ0hPUFMjS0VXCiMjI1RIQVQjI0JFRVQjIwpSSVBPVVQjQlJBI0xPSU4KRVJBI01FRElBI1BJQU5PCkNFTEVCUklUWVJPQVNUUwpVTklUUyNCRVNFVCNUUkkKUkVOVCNBU1MjVkFTU0FSCiMjREVBTCMjU0VUSCMjIwpET1IjRklOQUxST1VORFMKRU5PS0kjRVJJRSNUT09MCkVMTUVSI1NFRU4jVVBUTwpNWUVZRSNUQVJUI1BFRVA="},{"title":"03/03/11 GRADE-SCHOOL BASICS","author":"Norma Steinberg, edited by Stanley Newman","date":"2011-03-03","grid":"RlJJTEwjV09XUyNST0FNClJPR1VFI0lNQU0jT0hOTwpFUE9DSCNGQVJFI0JJVFMKVEVSUkFGSVJNQSNST1NTCiMjI0VWRSMjRVJJRSMjIwpNU0cjUkFURUQjUklGRlMKU0tFV0VSRUQjTUFOSUxBCk5PTk8jRVhJTEUjRUxJUwpCQVJSRUQjQ0FURVJFUlMKQ0xFUksjVVRURVIjU1RZCiMjI1lFQVMjI09BVCMjIwpTSEFXI1JBWk9SU0hBUlAKTEFNQSNHUklNI0VSTklFCk9WRVIjT01OSSNSRU5UUwpXRU5UI05ZRVQjU1dFRVQ="},{"title":"03/03/11 GRADE-SCHOOL BASICS","author":"Norma Steinberg, edited by Stanley Newman","date":"2011-03-03","grid":"RlJJTEwjV09XUyNST0FNClJPR1VFI0lNQU0jT0hOTwpFUE9DSCNGQVJFI0JJVFMKVEVSUkFGSVJNQSNST1NTCiMjI0VWRSMjRVJJRSMjIwpNU0cjUkFURUQjUklGRlMKU0tFV0VSRUQjTUFOSUxBCk5PTk8jRVhJTEUjRUxJUwpCQVJSRUQjQ0FURVJFUlMKQ0xFUksjVVRURVIjU1RZCiMjI1lFQVMjI09BVCMjIwpTSEFXI1JBWk9SU0hBUlAKTEFNQSNHUklNI0VSTklFCk9WRVIjT01OSSNSRU5UUwpXRU5UI05ZRVQjU1dFRVQ="},{"title":"03/04/11 FUNNY BUSINESS","author":"David W. Cromer, edited by Stanley Newman","date":"2011-03-04","grid":"QkFORCNTSE9QI1NUQUxMCkFMT0UjVE9CRSNDQU5PRQpURVJQI1JFRUsjQVJFQVMKSFVNT1JJU1lPVVJPV04jClNUQVRFTiMjRVRDIyMjIwojIyMjRUdBRCNURUFCQUcKQUNSRVMjTE9TRSNMQU5BClNNSUxFU1VSUFJJU0lORwpUT05TI0FNTU8jTU9MRVMKSU5HRVNUI1NUT1AjIyMjCiMjIyNLSUEjI1NFRVRIRQojWU9VSU5USEVNSVJST1IKU0VOU0UjVElSRSNSSVBFCkFMVEVSI0lST04jT1BFQwpHTE9TUyNDRVNUI1JFU1Q="},{"title":"03/04/11 FUNNY BUSINESS","author":"David W. Cromer, edited by Stanley Newman","date":"2011-03-04","grid":"QkFORCNTSE9QI1NUQUxMCkFMT0UjVE9CRSNDQU5PRQpURVJQI1JFRUsjQVJFQVMKSFVNT1JJU1lPVVJPV04jClNUQVRFTiMjRVRDIyMjIwojIyMjRUdBRCNURUFCQUcKQUNSRVMjTE9TRSNMQU5BClNNSUxFU1VSUFJJU0lORwpUT05TI0FNTU8jTU9MRVMKSU5HRVNUI1NUT1AjIyMjCiMjIyNLSUEjI1NFRVRIRQojWU9VSU5USEVNSVJST1IKU0VOU0UjVElSRSNSSVBFCkFMVEVSI0lST04jT1BFQwpHTE9TUyNDRVNUI1JFU1Q="},{"title":"03/05/11 SATURDAY STUMPER","author":"S.N., edited by Stanley Newman","date":"2011-03-05","grid":"Q0hFRiNTQ0FUI0RVTUFTCkFJREEjVEFMRSNFTkFDVApNWUFOVE9OSUEjU1VQUkEKU0FNTUVOREVTI0lTTEVUCiMjI0FOWU9ORVNHVUVTUwpBUEhJRCMjI1JFTkFMIyMKRFVBTCNGRU1BTEVMRUFECkFOTiNQQVJBREVSI0FCRQpNWUdPT0RORVNTI0FGRVcKIyNTQUxFUyMjI01VU1RZClNQQVJFU1RIRVJPRCMjIwpURUxMUyNNQVhJTUlaRUQKQUNFSVQjQU5BU1NUT1JZCktBRktBI0NPTUUjT0xJTgpFTlRFUiNISVNTI1JBQ0U="},{"title":"03/05/11 SATURDAY STUMPER","author":"S.N., edited by Stanley Newman","date":"2011-03-05","grid":"Q0hFRiNTQ0FUI0RVTUFTCkFJREEjVEFMRSNFTkFDVApNWUFOVE9OSUEjU1VQUkEKU0FNTUVOREVTI0lTTEVUCiMjI0FOWU9ORVNHVUVTUwpBUEhJRCMjI1JFTkFMIyMKRFVBTCNGRU1BTEVMRUFECkFOTiNQQVJBREVSI0FCRQpNWUdPT0RORVNTI0FGRVcKIyNTQUxFUyMjI01VU1RZClNQQVJFU1RIRVJPRCMjIwpURUxMUyNNQVhJTUlaRUQKQUNFSVQjQU5BU1NUT1JZCktBRktBI0NPTUUjT0xJTgpFTlRFUiNISVNTI1JBQ0U="},{"title":"03/06/11 URBAN NAMESAKES: All over here","author":"David W. Cromer, edited by Stanley Newman","date":"2011-03-06","grid":"QlJBU1MjI0RBUlQjU09CUyNPU1MjClJPU0lUQSNESU9SI0FSRUEjVEhBUgpBTVNURVJEQU1ORVdZT1JLI0hBVEUKR0VUI1BSRVkjQU1JUyNUSU1FU1VQClNPREFQT1AjIyNPVFMjIyNVTFRSQQojIyNORVdQT1JUUkhPREVJU0xBTkQKSEFaWSMjI0tZRCMjI0FNTklPIyMjCkVHTyNOQVBMRVNGTE9SSURBI0FLQwpNT08jRUxJQVMjQU9ORSNPTElWSUEKIyMjUExPVCMjI0JPQVJTIyNUT1dTCkJFVEhMRUhFTVBFTk5TWUxWQU5JQQpBVVJBIyNTTkVFUiMjI1JFQUwjIyMKQ1JJVElDI0RJTkcjU1RJRVMjVEtPCkhPUCNET1ZFUkRFTEFXQVJFI09JTAojIyNBVFJJQSMjI09VSSMjI1JPVEUKQUxFWEFORFJJQVZJUkdJTklBIyMjClNFTElHIyMjTlJBIyMjQ09ORkVTUwpDQUxMU0lOI0FDTFUjTE9VRCNTRVQKT1BFTCNNRU1QSElTVEVOTkVTU0VFClRFUkEjUE9SRSNTRVJGI1NFUkVORQojRFlFI1NOSVQjRURJVCMjRE9OT1I="},{"title":"03/06/11 URBAN NAMESAKES: All over here","author":"David W. Cromer, edited by Stanley Newman","date":"2011-03-06","grid":"QlJBU1MjI0RBUlQjU09CUyNPU1MjClJPU0lUQSNESU9SI0FSRUEjVEhBUgpBTVNURVJEQU1ORVdZT1JLI0hBVEUKR0VUI1BSRVkjQU1JUyNUSU1FU1VQClNPREFQT1AjIyNPVFMjIyNVTFRSQQojIyNORVdQT1JUUkhPREVJU0xBTkQKSEFaWSMjI0tZRCMjI0FNTklPIyMjCkVHTyNOQVBMRVNGTE9SSURBI0FLQwpNT08jRUxJQVMjQU9ORSNPTElWSUEKIyMjUExPVCMjI0JPQVJTIyNUT1dTCkJFVEhMRUhFTVBFTk5TWUxWQU5JQQpBVVJBIyNTTkVFUiMjI1JFQUwjIyMKQ1JJVElDI0RJTkcjU1RJRVMjVEtPCkhPUCNET1ZFUkRFTEFXQVJFI09JTAojIyNBVFJJQSMjI09VSSMjI1JPVEUKQUxFWEFORFJJQVZJUkdJTklBIyMjClNFTElHIyMjTlJBIyMjQ09ORkVTUwpDQUxMU0lOI0FDTFUjTE9VRCNTRVQKT1BFTCNNRU1QSElTVEVOTkVTU0VFClRFUkEjUE9SRSNTRVJGI1NFUkVORQojRFlFI1NOSVQjRURJVCMjRE9OT1I="},{"title":"03/07/11 SHIRT STUFF","author":"Gail Grabowski, edited by Stanley Newman","date":"2011-03-07","grid":"QVNJUyNTSEFNI01BUlNIClJVREUjSE9MRSNBQkFURQpDTU9OI1JPT00jQVJET1IKSE9MREJVVFRPTiNPQVJTCiMjIyNBQlMjI0FXQVJFIwpTUE9JTFMjQ1JJRUQjIyMKQ0FST0wjU0hJTEwjTU9NCkFDRVVQT05FU1NMRUVWRQpNVFMjQU5JU0UjVFVORVMKIyMjRlJFVFMjTk9SVU5TCiNIQUlLVSMjQ0FEIyMjIwpMQVdOI1BJVEFQT0NLRVQKQURBR0UjUkFDSyNSSUxFCkJBS0VSI0FOVEkjQVRNUwpTVEVSTiNTS0lOI0JFU1Q="},{"title":"03/07/11 SHIRT STUFF","author":"Gail Grabowski, edited by Stanley Newman","date":"2011-03-07","grid":"QVNJUyNTSEFNI01BUlNIClJVREUjSE9MRSNBQkFURQpDTU9OI1JPT00jQVJET1IKSE9MREJVVFRPTiNPQVJTCiMjIyNBQlMjI0FXQVJFIwpTUE9JTFMjQ1JJRUQjIyMKQ0FST0wjU0hJTEwjTU9NCkFDRVVQT05FU1NMRUVWRQpNVFMjQU5JU0UjVFVORVMKIyMjRlJFVFMjTk9SVU5TCiNIQUlLVSMjQ0FEIyMjIwpMQVdOI1BJVEFQT0NLRVQKQURBR0UjUkFDSyNSSUxFCkJBS0VSI0FOVEkjQVRNUwpTVEVSTiNTS0lOI0JFU1Q="},{"title":"03/08/11 ON THE PLANE","author":"Billie Truitt, edited by Stanley Newman","date":"2011-03-08","grid":"U1BSQVkjVEFQUyNNRUVUCk9MSVZFI1JVTEUjQUxMWQpMQUNFUyNPUkFMI1JBTVAKT05PTkVTVEFJTCNBTFNPCiMjI1VTQSMjREVCVCMjIwpQQVJFI1RCQSNSRUhBQlMKQUxJI1NBTFNBI1JPTUFOCk5PU0tJTk9GRk1ZTk9TRQpJSEVBUiNDT1JBTCNSVEUKQ0FOTkVEI1JPWSNCRUVSCiMjI0dFRUsjI0JBUiMjIwpXSE9BI0lOVEhFV0lOR1MKSE9VUiNDQVJFI09ET1JTCklOVE8jRVZFUiNMQVRJTgpQRVNPI1JFRUQjU0xFRFM="},{"title":"03/08/11 ON THE PLANE","author":"Billie Truitt, edited by Stanley Newman","date":"2011-03-08","grid":"U1BSQVkjVEFQUyNNRUVUCk9MSVZFI1JVTEUjQUxMWQpMQUNFUyNPUkFMI1JBTVAKT05PTkVTVEFJTCNBTFNPCiMjI1VTQSMjREVCVCMjIwpQQVJFI1RCQSNSRUhBQlMKQUxJI1NBTFNBI1JPTUFOCk5PU0tJTk9GRk1ZTk9TRQpJSEVBUiNDT1JBTCNSVEUKQ0FOTkVEI1JPWSNCRUVSCiMjI0dFRUsjI0JBUiMjIwpXSE9BI0lOVEhFV0lOR1MKSE9VUiNDQVJFI09ET1JTCklOVE8jRVZFUiNMQVRJTgpQRVNPI1JFRUQjU0xFRFM="},{"title":"03/09/11 LET'S PLAY CATCH","author":"Norma Steinberg, edited by Stanley Newman","date":"2011-03-09","grid":"QVNQUyNBTEVDSyNBTU9TCkNISVAjTklDSEUjTkVTVApUQVRBI1RBSE9FI0dBTEUKQVJDI1RIUk9XUElMTE9XClNQSEVSRVMjI1NTRSMjIwojI0JFQU0jRElBTEVDVFMKVEFMTFkjQlJPS0UjSFVUCkVSQVMjTUFJTkUjSlVORQpSRUMjWk9ORVMjUkVDQVAKTUFLRU9WRVIjU0VFSyMjCiMjI0FMSSMjVEhJUlNUWQpUT1NTQU5EVFVSTiNURUUKQUJVVCNHVUlMRSNGRVJOCkxPUkUjVU5ESUQjQkFSVApMRUVSI1BFRVBTI0lLRUE="},{"title":"03/09/11 LET'S PLAY CATCH","author":"Norma Steinberg, edited by Stanley Newman","date":"2011-03-09","grid":"QVNQUyNBTEVDSyNBTU9TCkNISVAjTklDSEUjTkVTVApUQVRBI1RBSE9FI0dBTEUKQVJDI1RIUk9XUElMTE9XClNQSEVSRVMjI1NTRSMjIwojI0JFQU0jRElBTEVDVFMKVEFMTFkjQlJPS0UjSFVUCkVSQVMjTUFJTkUjSlVORQpSRUMjWk9ORVMjUkVDQVAKTUFLRU9WRVIjU0VFSyMjCiMjI0FMSSMjVEhJUlNUWQpUT1NTQU5EVFVSTiNURUUKQUJVVCNHVUlMRSNGRVJOCkxPUkUjVU5ESUQjQkFSVApMRUVSI1BFRVBTI0lLRUE="},{"title":"03/10/11 DRILL TEAM","author":"David W. Cromer, edited by Stanley Newman","date":"2011-03-10","grid":"TU9TVCNQUk9NI0ZBQkxFCklLRUEjUk9WRSNBVExBUwpGTEVYI0FNRVMjQ1JPQ1MKRkFNSUxZUFJBQ1RJQ0UjCiMjIyNPVFMjI0xTVSMjIwpMRVRTR08jQUxBI01BQ0UKRVFVVVMjUFJJTVAjTUFUCkZVUk5JVFVSRVBPTElTSApUQUIjTk9NQUQjUEFTVEUKU0xPVCNSQVkjQkFUSEVSCiMjI1ZBVCMjVEFSIyMjIwojUEFTU0VOR0VSVFJBSU4KSEFSRVMjRUFTVCNJRlNPCkVMSVRFI1RJTEUjRlJFRApZRUFTVCNTVEFSI1RPRVM="},{"title":"03/10/11 DRILL TEAM","author":"David W. Cromer, edited by Stanley Newman","date":"2011-03-10","grid":"TU9TVCNQUk9NI0ZBQkxFCklLRUEjUk9WRSNBVExBUwpGTEVYI0FNRVMjQ1JPQ1MKRkFNSUxZUFJBQ1RJQ0UjCiMjIyNPVFMjI0xTVSMjIwpMRVRTR08jQUxBI01BQ0UKRVFVVVMjUFJJTVAjTUFUCkZVUk5JVFVSRVBPTElTSApUQUIjTk9NQUQjUEFTVEUKU0xPVCNSQVkjQkFUSEVSCiMjI1ZBVCMjVEFSIyMjIwojUEFTU0VOR0VSVFJBSU4KSEFSRVMjRUFTVCNJRlNPCkVMSVRFI1RJTEUjRlJFRApZRUFTVCNTVEFSI1RPRVM="},{"title":"03/11/11 RIVER CROSSINGS","author":"Fred Jackson III, edited by Stanley Newman","date":"2011-03-11","grid":"U0FDSyNDQVVTRSNTQ0FOCkFMT0UjQVRCQVkjQ09ITwpSSUxFI0dSQVRFI0VMQU4KQVZPTlNFSU5FREFOVUJFCkhFUiNDUkFHIyNTRU0jIwojI0FMQVMjSUJNUyNCTFQKTU9ERU0jU0FSQU4jSU9VCkFST0QjUEhMT1gjSkFERQpURU4jU0VBTFMjRFVQRVMKSE9JI0VER0UjUEVTTyMjCiMjQVRNIyNHRVJFI1RJUApUSUdSSVNPSElPUkhPTkUKQVdBWSNXSEVFTCNJTUFDClhPUk8jQU5OSUUjWUFOSwpJTkFOI1lPWU9TI0FDRVM="},{"title":"03/11/11 RIVER CROSSINGS","author":"Fred Jackson III, edited by Stanley Newman","date":"2011-03-11","grid":"U0FDSyNDQVVTRSNTQ0FOCkFMT0UjQVRCQVkjQ09ITwpSSUxFI0dSQVRFI0VMQU4KQVZPTlNFSU5FREFOVUJFCkhFUiNDUkFHIyNTRU0jIwojI0FMQVMjSUJNUyNCTFQKTU9ERU0jU0FSQU4jSU9VCkFST0QjUEhMT1gjSkFERQpURU4jU0VBTFMjRFVQRVMKSE9JI0VER0UjUEVTTyMjCiMjQVRNIyNHRVJFI1RJUApUSUdSSVNPSElPUkhPTkUKQVdBWSNXSEVFTCNJTUFDClhPUk8jQU5OSUUjWUFOSwpJTkFOI1lPWU9TI0FDRVM="},{"title":"03/12/11 SATURDAY STUMPER","author":"Doug Peterson, edited by Stanley Newman","date":"2011-03-12","grid":"U01BU0hFRCMjVFJVU1RZCkhJR0hFUlVQI0tBUlBPVgpPTkVPTk9ORSNPTlNJVEUKV0lERSNJTk5TI0RVS0VTCiMjI1JJQ0VOT09ETEUjIwpDSUNBREEjQUZUI0FKQVIKQU1PQ08jVU5USUUjT0xFCkZBTEtMQU5ESVNMQU5EUwpFR08jU1BJVEUjQklaRVQKU0VSRiNTVEUjQk9SRVJTCiMjQ0VSRUFMQk9XTCMjIwpPWk9ORSNTTEFXI0lDQk0KUlVEREVSI0VMU0lOT1JFCkNMRUVTRSNSRUVMRURJTgpBVURSRVkjI0RSRVNTRUQ="},{"title":"03/12/11 SATURDAY STUMPER","author":"Doug Peterson, edited by Stanley Newman","date":"2011-03-12","grid":"U01BU0hFRCMjVFJVU1RZCkhJR0hFUlVQI0tBUlBPVgpPTkVPTk9ORSNPTlNJVEUKV0lERSNJTk5TI0RVS0VTCiMjI1JJQ0VOT09ETEUjIwpDSUNBREEjQUZUI0FKQVIKQU1PQ08jVU5USUUjT0xFCkZBTEtMQU5ESVNMQU5EUwpFR08jU1BJVEUjQklaRVQKU0VSRiNTVEUjQk9SRVJTCiMjQ0VSRUFMQk9XTCMjIwpPWk9ORSNTTEFXI0lDQk0KUlVEREVSI0VMU0lOT1JFCkNMRUVTRSNSRUVMRURJTgpBVURSRVkjI0RSRVNTRUQ="},{"title":"03/13/11 GLAD ALL OVER: Have a happy day","author":"Gail Grabowski, edited by Stanley Newman","date":"2011-03-13","grid":"UEVUQUxTI1BVTlQjUExPUCNDUkFXCk9QRU5JVCNPTlVTI1JBVkUjTEFWQQpUSUNLTEVEUElOSyNPVkVSSk9ZRUQKIyMjQUlST1VUIyNTVElSI0FTT05FCkdFTlJFI09MRSNHVUVTVCNHRU5VUwpQTEVBU0VEQVNQVU5DSCNQVVJTRSMKQUZUIyNQQVIjSU5TVCNTRUFTIyMjCiMjIyNQRUQjREVHIyNCT0FSI0NSVApBVE1GRUUjU1VTSEkjQVJDI0VMSUUKUE9VUlMjT1RCI09WRVJUSEVNT09OClBPU0lUI0xJQVIjWUFMRSNMT1RUTwpPTkNMT1VETklORSNSRUQjT1RIRVIKU0lMTCNIRVQjU1VSTFkjU1BFRURTCkVFRSNQQVNTIyNDT1kjQllFIyMjIwojIyNCUlVUI1RBTEwjUEFTIyNQRUEKI0RST09MI1RIUklMTEVEVE9CSVRTClRSRU5UI1BSSUVEI0FSRSNSQU5DSApST0dVRSNBVVJBIyNUSUdSSVMjIyMKQUxMU01JTEVTI0lOSE9HSEVBVkVOCkNMVUUjUkVTVCNERUVEI0VOTElTVApFWUVTI0FSVFkjT0FSUyNBVFRBQ0g="},{"title":"03/13/11 GLAD ALL OVER: Have a happy day","author":"Gail Grabowski, edited by Stanley Newman","date":"2011-03-13","grid":"UEVUQUxTI1BVTlQjUExPUCNDUkFXCk9QRU5JVCNPTlVTI1JBVkUjTEFWQQpUSUNLTEVEUElOSyNPVkVSSk9ZRUQKIyMjQUlST1VUIyNTVElSI0FTT05FCkdFTlJFI09MRSNHVUVTVCNHRU5VUwpQTEVBU0VEQVNQVU5DSCNQVVJTRSMKQUZUIyNQQVIjSU5TVCNTRUFTIyMjCiMjIyNQRUQjREVHIyNCT0FSI0NSVApBVE1GRUUjU1VTSEkjQVJDI0VMSUUKUE9VUlMjT1RCI09WRVJUSEVNT09OClBPU0lUI0xJQVIjWUFMRSNMT1RUTwpPTkNMT1VETklORSNSRUQjT1RIRVIKU0lMTCNIRVQjU1VSTFkjU1BFRURTCkVFRSNQQVNTIyNDT1kjQllFIyMjIwojIyNCUlVUI1RBTEwjUEFTIyNQRUEKI0RST09MI1RIUklMTEVEVE9CSVRTClRSRU5UI1BSSUVEI0FSRSNSQU5DSApST0dVRSNBVVJBIyNUSUdSSVMjIyMKQUxMU01JTEVTI0lOSE9HSEVBVkVOCkNMVUUjUkVTVCNERUVEI0VOTElTVApFWUVTI0FSVFkjT0FSUyNBVFRBQ0g="},{"title":"03/14/11 GOTCHA","author":"Gail Grabowski, edited by Stanley Newman","date":"2011-03-14","grid":"Q0hBUiNBQkJBI0pFQU5TCkhPU0UjRE9MVCNBUlJPVwpJUkFOI01PQU4jQ0FDVEkKQ0FQVEFJTkhPT0sjSElNCiMjI0FMVCNTT0xFUyMjIwojUE9MSVRFI05FVENPU1QKQ1VCI0dFTVMjIyNBVVRPCkFST1VORFRIRUNPUk5FUgpSRUVLIyMjRUFSTiNDRUUKREVTRVJUUyNST1NURVIjCiMjI1NBV1RPI1NFQSMjIwpBQlMjVE9VUklTVFRSQVAKUlVOQVQjTUFORSNUT05FCkVNQUlMI1BUQVMjT0FUUwpBUFBMRSNTRU5UI09SRU8="},{"title":"03/14/11 GOTCHA","author":"Gail Grabowski, edited by Stanley Newman","date":"2011-03-14","grid":"Q0hBUiNBQkJBI0pFQU5TCkhPU0UjRE9MVCNBUlJPVwpJUkFOI01PQU4jQ0FDVEkKQ0FQVEFJTkhPT0sjSElNCiMjI0FMVCNTT0xFUyMjIwojUE9MSVRFI05FVENPU1QKQ1VCI0dFTVMjIyNBVVRPCkFST1VORFRIRUNPUk5FUgpSRUVLIyMjRUFSTiNDRUUKREVTRVJUUyNST1NURVIjCiMjI1NBV1RPI1NFQSMjIwpBQlMjVE9VUklTVFRSQVAKUlVOQVQjTUFORSNUT05FCkVNQUlMI1BUQVMjT0FUUwpBUFBMRSNTRU5UI09SRU8="},{"title":"03/15/11 HOWEVERS","author":"Sally R. Stein, edited by Stanley Newman","date":"2011-03-15","grid":"T0RPUlMjVEJBUiNBQ1RTClBJTlRBI0hJS0UjR0xVRQpFQVRFTiNFUklDI0FPTkUKQ0xPU0VCVVROT0NJR0FSCiMjIyNTQVNII1VSTiMjIwpEQUlOVFkjI1NQQSNQQU4KRVRURSNPQVRII1dSSVRFCkxBU1RCVVROT1RMRUFTVApBTE9IQSNBVEVFI0FORVcKWUVOI0dPRCMjQUZMT0FUCiMjI1RFWCNUT1JPIyMjIwpTTE9XTFlCVVRTVVJFTFkKSE9TRSNHSUxUI1JBVElPCk9HTEUjRUxTRSNQUkFOSwpUT09UI05FQVIjTUVMRUU="},{"title":"03/15/11 HOWEVERS","author":"Sally R. Stein, edited by Stanley Newman","date":"2011-03-15","grid":"T0RPUlMjVEJBUiNBQ1RTClBJTlRBI0hJS0UjR0xVRQpFQVRFTiNFUklDI0FPTkUKQ0xPU0VCVVROT0NJR0FSCiMjIyNTQVNII1VSTiMjIwpEQUlOVFkjI1NQQSNQQU4KRVRURSNPQVRII1dSSVRFCkxBU1RCVVROT1RMRUFTVApBTE9IQSNBVEVFI0FORVcKWUVOI0dPRCMjQUZMT0FUCiMjI1RFWCNUT1JPIyMjIwpTTE9XTFlCVVRTVVJFTFkKSE9TRSNHSUxUI1JBVElPCk9HTEUjRUxTRSNQUkFOSwpUT09UI05FQVIjTUVMRUU="},{"title":"03/16/11 COUNTDOWN","author":"Fred Piscop, edited by Stanley Newman","date":"2011-03-16","grid":"QkxFVyNSQVNUQSNSQVBUCkFVUkEjRVRIQU4jT0JPRQpOQUlMI0ZPVVJUSERPV04KRFVDS0hVTlQjI0FJREVECiMjIyNJTkMjR0FSTkVSUwpUSElSRERFR1JFRSMjIyMKUkVWVUUjI1JJTyNQTEVECkFNRU4jVVBFTk4jRVVSTwpNSVNUI1NFQyMjT1JHQU4KIyMjI1NFQ09OREdVRVNTCldBU0hFUlMjRUFSIyMjIwpBU0lBTiMjQVNTRU5UVE8KRklSU1RCTFVTSCNBUklECkVERU4jQkVMSUUjUElORQpSRU5UI0NJREVSI0FQRVM="},{"title":"03/16/11 COUNTDOWN","author":"Fred Piscop, edited by Stanley Newman","date":"2011-03-16","grid":"QkxFVyNSQVNUQSNSQVBUCkFVUkEjRVRIQU4jT0JPRQpOQUlMI0ZPVVJUSERPV04KRFVDS0hVTlQjI0FJREVECiMjIyNJTkMjR0FSTkVSUwpUSElSRERFR1JFRSMjIyMKUkVWVUUjI1JJTyNQTEVECkFNRU4jVVBFTk4jRVVSTwpNSVNUI1NFQyMjT1JHQU4KIyMjI1NFQ09OREdVRVNTCldBU0hFUlMjRUFSIyMjIwpBU0lBTiMjQVNTRU5UVE8KRklSU1RCTFVTSCNBUklECkVERU4jQkVMSUUjUElORQpSRU5UI0NJREVSI0FQRVM="},{"title":"03/17/11 COVER STORY","author":"Billie Truitt, edited by Stanley Newman","date":"2011-03-17","grid":"QUJPVkUjU1BBUyNBQ0lECkxBVEVYI0hBWlkjUEFSRQpFVEhOTyNBVFROI0FLSU4KQ0hFQVRTSEVFVCNSRVNUCiMjI0xJVCMjQ0hBVCMjIwpQQlMjQ09BTFMjU01BU0gKQVJBUCNQUk8jU0lFU1RBClNFQ1VSSVRZQkxBTktFVApUQVJQSVQjQVlFI1RJTkUKQURFUFQjRkxFRVMjTk9ECiMjI0VBU0UjI1BFUCMjIwpHUklUI0NSQVpZUVVJTFQKTE9ERSNBQkxFI1VOVElFCkVQRUUjTkVUUyNFTk9URQpORUFSI1RST1QjTFlSRVM="},{"title":"03/17/11 COVER STORY","author":"Billie Truitt, edited by Stanley Newman","date":"2011-03-17","grid":"QUJPVkUjU1BBUyNBQ0lECkxBVEVYI0hBWlkjUEFSRQpFVEhOTyNBVFROI0FLSU4KQ0hFQVRTSEVFVCNSRVNUCiMjI0xJVCMjQ0hBVCMjIwpQQlMjQ09BTFMjU01BU0gKQVJBUCNQUk8jU0lFU1RBClNFQ1VSSVRZQkxBTktFVApUQVJQSVQjQVlFI1RJTkUKQURFUFQjRkxFRVMjTk9ECiMjI0VBU0UjI1BFUCMjIwpHUklUI0NSQVpZUVVJTFQKTE9ERSNBQkxFI1VOVElFCkVQRUUjTkVUUyNFTk9URQpORUFSI1RST1QjTFlSRVM="},{"title":"03/18/11 TODAY'S PUZZLE","author":"Richard Silvestri, edited by Stanley Newman","date":"2011-03-18","grid":"Q1pBUiNFQ0hPI0JJR09UClBJU0EjU0xBViNBREFHRQpBTlRJI1NPTEUjRFRJTEUKI0dPTERFTkZSSUdBVEUjCiMjIyNFU0UjU01VRyMjIwpJU0FBQyNTQVBQWSNBUkMKTVVTQ0FUI1RJRSNJREVBCk1BS0VGUklFTkRTTUVFVApBVklTI0VOQSNFTEFQU0UKREVOI09CQU1BI0VOVEVSCiMjI0dMRU4jV0FEIyMjIwojRlJJU0tZTUFSU0hBTCMKQ0xPVkUjV0lLSSNFWEVTCldPVkVOI0FSRUEjQUxPVApURUVOUyNZRU5TI0RFTlk="},{"title":"03/18/11 TODAY'S PUZZLE","author":"Richard Silvestri, edited by Stanley Newman","date":"2011-03-18","grid":"Q1pBUiNFQ0hPI0JJR09UClBJU0EjU0xBViNBREFHRQpBTlRJI1NPTEUjRFRJTEUKI0dPTERFTkZSSUdBVEUjCiMjIyNFU0UjU01VRyMjIwpJU0FBQyNTQVBQWSNBUkMKTVVTQ0FUI1RJRSNJREVBCk1BS0VGUklFTkRTTUVFVApBVklTI0VOQSNFTEFQU0UKREVOI09CQU1BI0VOVEVSCiMjI0dMRU4jV0FEIyMjIwojRlJJU0tZTUFSU0hBTCMKQ0xPVkUjV0lLSSNFWEVTCldPVkVOI0FSRUEjQUxPVApURUVOUyNZRU5TI0RFTlk="},{"title":"03/19/11 SATURDAY STUMPER","author":"Brad Wilber, edited by Stanley Newman","date":"2011-03-19","grid":"V0VCQ0FNI1VOSEFORE1FCkVRVUlORSNOT1JNQVJBRQpTVVJHRUQjTE9TVFNPVUwKVEFOI1dJUkVEI1NBTkRMCkVCT04jQ09BTFMjTElMSQpHTFVPTiNVU0VVUCNOSUsKR0VUVE9VR0gjU09JR05FCiMjI0VSVEUjU0hVTiMjIwpOQVNTQVUjUkFJTkdFQVIKRVBII0RSSUVSI0RPWUxFClNISUEjTk9NQUQjVEVMTApDQVZJTCNET05VVCNCUkEKQUdFTElNSVQjTUFERUlUCkZJUkVMQU5FI1BMRUFTRQpFQVNZQUNFUyNTRUVNRUQ="},{"title":"03/19/11 SATURDAY STUMPER","author":"Brad Wilber, edited by Stanley Newman","date":"2011-03-19","grid":"V0VCQ0FNI1VOSEFORE1FCkVRVUlORSNOT1JNQVJBRQpTVVJHRUQjTE9TVFNPVUwKVEFOI1dJUkVEI1NBTkRMCkVCT04jQ09BTFMjTElMSQpHTFVPTiNVU0VVUCNOSUsKR0VUVE9VR0gjU09JR05FCiMjI0VSVEUjU0hVTiMjIwpOQVNTQVUjUkFJTkdFQVIKRVBII0RSSUVSI0RPWUxFClNISUEjTk9NQUQjVEVMTApDQVZJTCNET05VVCNCUkEKQUdFTElNSVQjTUFERUlUCkZJUkVMQU5FI1BMRUFTRQpFQVNZQUNFUyNTRUVNRUQ="},{"title":"03/20/11 WHAT'S WHAT?: We're gonna tell you","author":"Fred Piscop, edited by Stanley Newman","date":"2011-03-20","grid":"U0hPVyNDQVBQI1RBUEFTI0JBU0lOClBJU0EjT0xBWSNBR0lUQSNJTlRSQQpBTExJU1dFTEwjR1JFRURJU0dPT0QKUk9PS0lFI01FU1NFUyNFTVQjUk5BCiMjI0lSUiMjI0hVRSMjI1BSRVkjIwpUQUxLSVNDSEVBUCNTQUMjT0xMSUUKQUdBSU4jUkVBUiNDQVNISVNLSU5HCk1BUCNHUkVBU0UjRVRIQU4jU05BRwpTVEVQI0VBVkUjRlJJRU5EUyNFTkUKI0VMRVZBVEUjUkFJTiMjI1BPU0VECiMjI1NJTEVOQ0VJU0dPTERFTiMjIwpCSVBPRCMjI0FOTkUjRFVFV0VTVCMKRVZBI0lUU0FCRVQjU0VHQSNTQUJFCkxJU0EjREVSRUcjVEVOT05TI0JPRApMRVNTSVNNT1JFI0hFU1MjVVNJTkcKSURFU1QjSURTI1RJTUVJU01PTkVZCiMjU1RBRyMjI0RPTiMjI1RBTyMjIwpCUk8jTElFI0dJREVPTiNBQ1RTQVMKTE9WRUlTQkxJTkQjV0FSSVNIRUxMCk9NRUdBI0JBR0VMI0VTUE4jRUxTRQpCQVJPTiNTUE9ERSNEQU1TI1NMT1c="},{"title":"03/20/11 WHAT'S WHAT?: We're gonna tell you","author":"Fred Piscop, edited by Stanley Newman","date":"2011-03-20","grid":"U0hPVyNDQVBQI1RBUEFTI0JBU0lOClBJU0EjT0xBWSNBR0lUQSNJTlRSQQpBTExJU1dFTEwjR1JFRURJU0dPT0QKUk9PS0lFI01FU1NFUyNFTVQjUk5BCiMjI0lSUiMjI0hVRSMjI1BSRVkjIwpUQUxLSVNDSEVBUCNTQUMjT0xMSUUKQUdBSU4jUkVBUiNDQVNISVNLSU5HCk1BUCNHUkVBU0UjRVRIQU4jU05BRwpTVEVQI0VBVkUjRlJJRU5EUyNFTkUKI0VMRVZBVEUjUkFJTiMjI1BPU0VECiMjI1NJTEVOQ0VJU0dPTERFTiMjIwpCSVBPRCMjI0FOTkUjRFVFV0VTVCMKRVZBI0lUU0FCRVQjU0VHQSNTQUJFCkxJU0EjREVSRUcjVEVOT05TI0JPRApMRVNTSVNNT1JFI0hFU1MjVVNJTkcKSURFU1QjSURTI1RJTUVJU01PTkVZCiMjU1RBRyMjI0RPTiMjI1RBTyMjIwpCUk8jTElFI0dJREVPTiNBQ1RTQVMKTE9WRUlTQkxJTkQjV0FSSVNIRUxMCk9NRUdBI0JBR0VMI0VTUE4jRUxTRQpCQVJPTiNTUE9ERSNEQU1TI1NMT1c="},{"title":"03/21/11 EYE ACTION","author":"Gail Grabowski, edited by Stanley Newman","date":"2011-03-21","grid":"U0lQUyNTSEFNI1BBUkVECkxPT1QjSEFSRSNPQ0FMQQpBV0VFI0VSQVMjU09OQVIKVkFNUElSRUJBVCNSQVRFCiMjI0RPUk0jI1dBTlRFRAojU1RPTlkjR09FUlMjIyMKQ0xBVyMjR0VOUkUjVElTCkRJRE5UU0xFRVBBV0lOSwpTUEEjV0VFS1MjI0lDS1kKIyMjQklURVMjVEFOS1MjCkFTU0VOVCMjV0lQRSMjIwpEQVRBI09OVEhFQkxJTksKQUJBU0UjT1JFUyNJU0VFClBFTFRTI0RJRVQjU0xPRwpUUkVTUyNTT0xPI1RFTlM="},{"title":"03/21/11 EYE ACTION","author":"Gail Grabowski, edited by Stanley Newman","date":"2011-03-21","grid":"U0lQUyNTSEFNI1BBUkVECkxPT1QjSEFSRSNPQ0FMQQpBV0VFI0VSQVMjU09OQVIKVkFNUElSRUJBVCNSQVRFCiMjI0RPUk0jI1dBTlRFRAojU1RPTlkjR09FUlMjIyMKQ0xBVyMjR0VOUkUjVElTCkRJRE5UU0xFRVBBV0lOSwpTUEEjV0VFS1MjI0lDS1kKIyMjQklURVMjVEFOS1MjCkFTU0VOVCMjV0lQRSMjIwpEQVRBI09OVEhFQkxJTksKQUJBU0UjT1JFUyNJU0VFClBFTFRTI0RJRVQjU0xPRwpUUkVTUyNTT0xPI1RFTlM="},{"title":"03/22/11 TOY BOX","author":"Billie Truitt, edited by Stanley Newman","date":"2011-03-22","grid":"U1BBVFMjQVJUUyNDVVBTCkhVTUFOI1JFRUsjSVNFRQpBTVBMRSNVR0xZI1RVTkUKTUFTS0VEQkFMTCNZQU5LCiMjIyNaRUFMI0FNQkxFUwpHQURHRVQjI0FCRUwjIyMKQUNBUiNFU1BOI1RPV0VSClNSVEEjUk9PVFMjQ0FQRQpIRUFWWSNGTEVBI0tORUUKIyMjWU9HQSMjVEVTVEVEClNUQVRVRSNBTUlEIyMjIwpIT1VSI0xJVklOR0RPTEwKQU5EQSNDT0FUI0VFUklFCkRJSUkjQVRJVCNSRUVGUwpFQ09OI1BBTFMjU1BPVFM="},{"title":"03/22/11 TOY BOX","author":"Billie Truitt, edited by Stanley Newman","date":"2011-03-22","grid":"U1BBVFMjQVJUUyNDVVBTCkhVTUFOI1JFRUsjSVNFRQpBTVBMRSNVR0xZI1RVTkUKTUFTS0VEQkFMTCNZQU5LCiMjIyNaRUFMI0FNQkxFUwpHQURHRVQjI0FCRUwjIyMKQUNBUiNFU1BOI1RPV0VSClNSVEEjUk9PVFMjQ0FQRQpIRUFWWSNGTEVBI0tORUUKIyMjWU9HQSMjVEVTVEVEClNUQVRVRSNBTUlEIyMjIwpIT1VSI0xJVklOR0RPTEwKQU5EQSNDT0FUI0VFUklFCkRJSUkjQVRJVCNSRUVGUwpFQ09OI1BBTFMjU1BPVFM="},{"title":"03/23/11 FREEBIE","author":"Fred Piscop, edited by Stanley Newman","date":"2011-03-23","grid":"UExBTkUjQkFUUyNBQkxFCkxFVE9OI09CT0UjQ0xBUApPTlRIRUhPVVNFI0NPUkUKVE9OSSNBUlRTI1NUT0tFCiMjI1RJTCMjI1NFTkQjIwojI0FUTk9DT1NUVE9ZT1UKU0FMRVMjQUxJQVMjTU9TClBFQVIjR1JJTVkjSEFaRQpFUlIjUFJPVk8jUEVSRVMKQ09NUExJTUVOVEFSWSMjCiMjQ0xBTSMjI09XRSMjIwpBTExBWSNMT09UI1NQQVMKU09PTiNGT1JOT1RISU5HClRJQ0sjUkFaRSNET05PVApJTktTI0FNT1MjU1dBTlM="},{"title":"03/23/11 FREEBIE","author":"Fred Piscop, edited by Stanley Newman","date":"2011-03-23","grid":"UExBTkUjQkFUUyNBQkxFCkxFVE9OI09CT0UjQ0xBUApPTlRIRUhPVVNFI0NPUkUKVE9OSSNBUlRTI1NUT0tFCiMjI1RJTCMjI1NFTkQjIwojI0FUTk9DT1NUVE9ZT1UKU0FMRVMjQUxJQVMjTU9TClBFQVIjR1JJTVkjSEFaRQpFUlIjUFJPVk8jUEVSRVMKQ09NUExJTUVOVEFSWSMjCiMjQ0xBTSMjI09XRSMjIwpBTExBWSNMT09UI1NQQVMKU09PTiNGT1JOT1RISU5HClRJQ0sjUkFaRSNET05PVApJTktTI0FNT1MjU1dBTlM="},{"title":"03/24/11 HIGHS AND LOWS","author":"Bruce Venzke, edited by Stanley Newman","date":"2011-03-24","grid":"Q0hVTVMjU0lHSCNDUk9QCkFFUklFI1BPRU0jT09QUwpSQUlTRVNPTkVTSE9QRVMKT0RFUyNUVVNLI0FMRVJUCkJZTElORVMjI1NJUyMjIwojIyNMT1dFUlNQUklDRVMKUEFSRU4jI0FQRSNUQUxFCkhVRSNPQ0FOQURBI0ZBQQpJREVBI09MRCMjQ0NFTEwKTElGVFNBRklOR0VSIyMjCiMjI1JVVCMjWU9ERUxFRApJRElPTSNTRUxMI1ZPVEUKRFJPUFNPVVRPRlNJR0hUCkxBVEgjQ01PTiNTQ09ORQpFQkFZI1NPTlMjVEVOT1I="},{"title":"03/24/11 HIGHS AND LOWS","author":"Bruce Venzke, edited by Stanley Newman","date":"2011-03-24","grid":"Q0hVTVMjU0lHSCNDUk9QCkFFUklFI1BPRU0jT09QUwpSQUlTRVNPTkVTSE9QRVMKT0RFUyNUVVNLI0FMRVJUCkJZTElORVMjI1NJUyMjIwojIyNMT1dFUlNQUklDRVMKUEFSRU4jI0FQRSNUQUxFCkhVRSNPQ0FOQURBI0ZBQQpJREVBI09MRCMjQ0NFTEwKTElGVFNBRklOR0VSIyMjCiMjI1JVVCMjWU9ERUxFRApJRElPTSNTRUxMI1ZPVEUKRFJPUFNPVVRPRlNJR0hUCkxBVEgjQ01PTiNTQ09ORQpFQkFZI1NPTlMjVEVOT1I="},{"title":"03/25/11 WAIST TIME","author":"David W. Cromer, edited by Stanley Newman","date":"2011-03-25","grid":"RUpFQ1QjQ0FCQUwjVEVUClNBVk9SI0FNQU5BI0VVUgpQUkFEQSNNSURETEVBR0UKIyMjI0RBUk4jI0FUU0VBCklTV0hFTllPVVIjVEVOVApDT0hPUlQjI1NBTFVURVMKSVdPTiMjU0NFTkUjIyMjCiMjQUdFU1RBUlRTVE8jIwojIyMjTEVBTlMjI0hBTE8KQVRUSU1FUyMjV0FSSE9MClBFQVQjU0hPV0FST1VORApBQ01FUyMjR0VSRSMjIyMKVEhFTUlERExFI05BU0FMCkhJUyNGSU5FRCNBTE9IQQpZRVQjVEVBUlkjU0lYQU0="},{"title":"03/25/11 WAIST TIME","author":"David W. Cromer, edited by Stanley Newman","date":"2011-03-25","grid":"RUpFQ1QjQ0FCQUwjVEVUClNBVk9SI0FNQU5BI0VVUgpQUkFEQSNNSURETEVBR0UKIyMjI0RBUk4jI0FUU0VBCklTV0hFTllPVVIjVEVOVApDT0hPUlQjI1NBTFVURVMKSVdPTiMjU0NFTkUjIyMjCiMjQUdFU1RBUlRTVE8jIwojIyMjTEVBTlMjI0hBTE8KQVRUSU1FUyMjV0FSSE9MClBFQVQjU0hPV0FST1VORApBQ01FUyMjR0VSRSMjIyMKVEhFTUlERExFI05BU0FMCkhJUyNGSU5FRCNBTE9IQQpZRVQjVEVBUlkjU0lYQU0="},{"title":"03/26/11 SATURDAY STUMPER","author":"Barry C. Silk, edited by Stanley Newman","date":"2011-03-26","grid":"R0FTS0VUUyNLQVJMT0ZGCkVUSElDQUwjRU1BSUxFUgpUSEVST0JFI1NQSU5ETEUKU0xBQiNTRUNUI0RFTklNCk1FUllMI1ZFUkIjREVDTwpBVEUjT01FTEVUUyNXSU4KREVEVUNFUyNMRUVSU0FUCiMjI1NVTSMjI0FHTyMjIwpQSU5FU09MI1NNVURHRVMKT05FI1RSQUlQU0UjQVhFClBBU1MjWU1DQSNTUElFUgpVUFRPUCNCRVRTI0lOQ0EKUElFQkFMRCNUSU1FU1VQCkFMR0VSSUEjRURVQ0FURQpERUdSRUVTI1JFREVZRVM="},{"title":"03/26/11 SATURDAY STUMPER","author":"Barry C. Silk, edited by Stanley Newman","date":"2011-03-26","grid":"R0FTS0VUUyNLQVJMT0ZGCkVUSElDQUwjRU1BSUxFUgpUSEVST0JFI1NQSU5ETEUKU0xBQiNTRUNUI0RFTklNCk1FUllMI1ZFUkIjREVDTwpBVEUjT01FTEVUUyNXSU4KREVEVUNFUyNMRUVSU0FUCiMjI1NVTSMjI0FHTyMjIwpQSU5FU09MI1NNVURHRVMKT05FI1RSQUlQU0UjQVhFClBBU1MjWU1DQSNTUElFUgpVUFRPUCNCRVRTI0lOQ0EKUElFQkFMRCNUSU1FU1VQCkFMR0VSSUEjRURVQ0FURQpERUdSRUVTI1JFREVZRVM="},{"title":"03/27/11 PHONE MESSAGES: In more ways than one","author":"Charles Deber, edited by Stanley Newman","date":"2011-03-27","grid":"QkFNQkkjQUhBUyMjVElQUEkjU1BBCk9MRUFOI0xVUkVTI1NBUkFOI0hJUApQTEFZUVVFRU5ST0NLU09ORyNBWEUKI1NUUyNQUFYjUExPIyNVUFJJVkVSClNFUyNHT0hPTUVJTU1FRElBVEVMWQpDQU5DQU4jU0FOREJPWCNQSUUjIyMKQVNPQ0lBTCNDVFMjRE9SRU4jSk9TCkJPV0lFI1lFQSMjQ0VERSNTS1VOSwpTTk8jVFVSTlVQVk9MVU1FI0FTVEkKIyNSQUlTRUQjTEFNRVMjU0NZVEhFClNJR05FVFMjU0FORVIjU1RST0tFRApQUkFJU0UjU09OWUEjQ0hFRVNFIyMKUkVOVCNET05URUFURlJJRVMjRU1QCkVOSUFDI0ZPT1QjI1JZRSNTRVBJQQpFRUMjT01BUlMjVEJBI1NISUVMRFMKIyMjSU1BI0VBUlJJTkcjQURST0lUCldFWFJBWUVEWU9VUlpFQlJBI09ERQpFTEVBTk9SIyNUQUQjVE9QI1dLUiMKRE9OI0FSUklWSU5HQllDT1VSSUVSCkdQTyNHRUlDTyNUT1NFQSNNRU5TQQpFRU4jRVNTRVgjI0RPUlMjQU5HU1Q="},{"title":"03/27/11 PHONE MESSAGES: In more ways than one","author":"Charles Deber, edited by Stanley Newman","date":"2011-03-27","grid":"QkFNQkkjQUhBUyMjVElQUEkjU1BBCk9MRUFOI0xVUkVTI1NBUkFOI0hJUApQTEFZUVVFRU5ST0NLU09ORyNBWEUKI1NUUyNQUFYjUExPIyNVUFJJVkVSClNFUyNHT0hPTUVJTU1FRElBVEVMWQpDQU5DQU4jU0FOREJPWCNQSUUjIyMKQVNPQ0lBTCNDVFMjRE9SRU4jSk9TCkJPV0lFI1lFQSMjQ0VERSNTS1VOSwpTTk8jVFVSTlVQVk9MVU1FI0FTVEkKIyNSQUlTRUQjTEFNRVMjU0NZVEhFClNJR05FVFMjU0FORVIjU1RST0tFRApQUkFJU0UjU09OWUEjQ0hFRVNFIyMKUkVOVCNET05URUFURlJJRVMjRU1QCkVOSUFDI0ZPT1QjI1JZRSNTRVBJQQpFRUMjT01BUlMjVEJBI1NISUVMRFMKIyMjSU1BI0VBUlJJTkcjQURST0lUCldFWFJBWUVEWU9VUlpFQlJBI09ERQpFTEVBTk9SIyNUQUQjVE9QI1dLUiMKRE9OI0FSUklWSU5HQllDT1VSSUVSCkdQTyNHRUlDTyNUT1NFQSNNRU5TQQpFRU4jRVNTRVgjI0RPUlMjQU5HU1Q="},{"title":"03/28/11 MAKING PERFECT","author":"Gail Grabowski, edited by Stanley Newman","date":"2011-03-28","grid":"QUxUTyNQRUdTI1NMQU5HClNFQVIjQVhMRSNIQU5PSQpQQUxFI0RJRVQjT1VURVIKIyNDT1JETEVTU0RSSUxMCiMjIyNFRUUjI0FEQSMjIwpBUFBFTkQjTUFOWSNNQVQKTUVBTlQjR0FJVCNTQVNFClBSSVZBVEVQUkFDVElDRQpMSUxZI09OTFkjSEFET04KRUxTI0ZMRUUjUElHU1RZCiMjI0FMRSMjU09OIyMjIwpDT01NVVRFUlRSQUlOIyMKQUJPVVQjR09BVCNNT1JFClNFTlNFI0FCTEUjUFJFWQpUWUtFUyNERUVSI1NJREU="},{"title":"03/28/11 MAKING PERFECT","author":"Gail Grabowski, edited by Stanley Newman","date":"2011-03-28","grid":"QUxUTyNQRUdTI1NMQU5HClNFQVIjQVhMRSNIQU5PSQpQQUxFI0RJRVQjT1VURVIKIyNDT1JETEVTU0RSSUxMCiMjIyNFRUUjI0FEQSMjIwpBUFBFTkQjTUFOWSNNQVQKTUVBTlQjR0FJVCNTQVNFClBSSVZBVEVQUkFDVElDRQpMSUxZI09OTFkjSEFET04KRUxTI0ZMRUUjUElHU1RZCiMjI0FMRSMjU09OIyMjIwpDT01NVVRFUlRSQUlOIyMKQUJPVVQjR09BVCNNT1JFClNFTlNFI0FCTEUjUFJFWQpUWUtFUyNERUVSI1NJREU="},{"title":"03/29/11 SHOE BUSINESS","author":"Billie Truitt, edited by Stanley Newman","date":"2011-03-29","grid":"QU1FTlMjQVJNUyNTQ0FNClNJVEFUI1JPT1QjTElTQQpPTkFJUiNTT1NPI0VBU1QKRklMTEVUT0ZTT0xFIyMjCiMjIyNTT04jI0RBS09UQQpXSElNU1kjVE9QUyNNRUQKSU9UQSMjU0FXQVMjRU5WClNMSVBPRlRIRVRPTkdVRQpFRFMjUFJJT1IjI0VBUk4KU1RTI1RJUkUjT1VUU0VUClRPT0JJRyMjVVJOIyMjIwojIyNBQ0hJTExFU0hFRUwKQUJDUyNUT0lUI05FUlZFCk1PQVQjRVdFUiNBUklFUwpQQU5FI05BU0EjUEVFUlM="},{"title":"03/29/11 SHOE BUSINESS","author":"Billie Truitt, edited by Stanley Newman","date":"2011-03-29","grid":"QU1FTlMjQVJNUyNTQ0FNClNJVEFUI1JPT1QjTElTQQpPTkFJUiNTT1NPI0VBU1QKRklMTEVUT0ZTT0xFIyMjCiMjIyNTT04jI0RBS09UQQpXSElNU1kjVE9QUyNNRUQKSU9UQSMjU0FXQVMjRU5WClNMSVBPRlRIRVRPTkdVRQpFRFMjUFJJT1IjI0VBUk4KU1RTI1RJUkUjT1VUU0VUClRPT0JJRyMjVVJOIyMjIwojIyNBQ0hJTExFU0hFRUwKQUJDUyNUT0lUI05FUlZFCk1PQVQjRVdFUiNBUklFUwpQQU5FI05BU0EjUEVFUlM="},{"title":"03/30/11 EASY DOES IT","author":"Fred Jackson III, edited by Stanley Newman","date":"2011-03-30","grid":"QVBJTkcjRkxBVyNVWklTClNPTkFSI0VBQ0gjU0lGVApTT1JUQSNNSVRFI0FQU08KVFJFQURXQVJJTFkjWUFQCiMjI0xFTyMjI1BPQk9ZUwpQQVQjQU1FUyNTVUxVIyMKQVdFUyNBTEFJI1RFUlNFCldBTEtPTkVHR1NIRUxMUwpOWUxPTiNNRU9XI1BJVVMKIyNNQUNII1NUQVIjUFJPCklNRUxEQSMjI01BVCMjIwpTVU0jU1RFUExJR0hUTFkKQU5PTiNQQUxFI1RFSEVFCkFDUkUjSVNFRSNBUkVOQQpDSEVXI05FQVIjR0VOVFM="},{"title":"03/30/11 EASY DOES IT","author":"Fred Jackson III, edited by Stanley Newman","date":"2011-03-30","grid":"QVBJTkcjRkxBVyNVWklTClNPTkFSI0VBQ0gjU0lGVApTT1JUQSNNSVRFI0FQU08KVFJFQURXQVJJTFkjWUFQCiMjI0xFTyMjI1BPQk9ZUwpQQVQjQU1FUyNTVUxVIyMKQVdFUyNBTEFJI1RFUlNFCldBTEtPTkVHR1NIRUxMUwpOWUxPTiNNRU9XI1BJVVMKIyNNQUNII1NUQVIjUFJPCklNRUxEQSMjI01BVCMjIwpTVU0jU1RFUExJR0hUTFkKQU5PTiNQQUxFI1RFSEVFCkFDUkUjSVNFRSNBUkVOQQpDSEVXI05FQVIjR0VOVFM="},{"title":"03/31/11 CROSS-WORD PUZZLE","author":"Fred Piscop, edited by Stanley Newman","date":"2011-03-31","grid":"T05TRVQjUEVSVSNTQ0FNCkpFTExPI0lSQVMjRUxTRQpTVEFNUCNUSU1FI05BWVMKI1NUT1BUSEVQUkVTU0VTCiMjIyNMQVkjIyNaRVNUWQpTUExFRU4jQVBISUQjIyMKT1JBTCMjQ0xFQU4jQUxFCkxPT0tUSEVPVEhFUldBWQpPUFMjQkFSTlMjI09PWkUKIyMjV09MRkUjVE9PTEVECkFTSUFOIyMjRElSIyMjIwpMSVNURU5UT1JFQVNPTiMKSURMRSNPSE5PI0NPVkVUClZFRVIjU0VNSSNMT0lSRQpFQVNZI0hFRUQjRU5ET04="},{"title":"03/31/11 CROSS-WORD PUZZLE","author":"Fred Piscop, edited by Stanley Newman","date":"2011-03-31","grid":"T05TRVQjUEVSVSNTQ0FNCkpFTExPI0lSQVMjRUxTRQpTVEFNUCNUSU1FI05BWVMKI1NUT1BUSEVQUkVTU0VTCiMjIyNMQVkjIyNaRVNUWQpTUExFRU4jQVBISUQjIyMKT1JBTCMjQ0xFQU4jQUxFCkxPT0tUSEVPVEhFUldBWQpPUFMjQkFSTlMjI09PWkUKIyMjV09MRkUjVE9PTEVECkFTSUFOIyMjRElSIyMjIwpMSVNURU5UT1JFQVNPTiMKSURMRSNPSE5PI0NPVkVUClZFRVIjU0VNSSNMT0lSRQpFQVNZI0hFRUQjRU5ET04="},{"title":"04/01/11 MOUSE IN THE HOUSE","author":"Clive Probert, edited by Stanley Newman","date":"2011-04-01","grid":"TkFEQSNVU09GQSNHTUFUCk9MRVMjUFVSTFMjUk9CRQpVUFRIRUNSRUVLI0VMQkEKU0hFRVIjRk9FI0NFREFSCkVBUiNORUEjVEVBSyMjIwojIyNDSVJDQSNSRVNVTUUKTU9USEVSRUQjSU5BQk9YCkJQT0UjQURBUFQjTEVWSQpBRUdFQU4jTUFSR0FSRVQKU05BS0VEI1NORUFEIyMjCiMjI0JPU1MjQ0FNI0lLRQpTUE9PTiNVTUEjTUlYRVIKSVJPTiNMRUVLUkFTTkVSCkRPWkUjQURJRVUjTEFORQpFV0VTI1NFTlNFI0VZRUQ="},{"title":"04/02/11 SATURDAY STUMPER","author":"Lester Ruff, edited by Stanley Newman","date":"2011-04-02","grid":"VEhBVFNJVCNERVNFUlZFCkFBTUlMTkUjRVhDTEFJTQpNWVNQQUNFI0VYQU1QTEUKQVJDI1BVVFVQT04jU0xSCkxBUkEjUklTRU4jQk9BUwpFQ0FTSCNNRU4jQklOR08KU0tZQ09WRVIjQkVSR0VOCiMjI1JPV1MjTEVBRCMjIwpFU1BJRVMjQ0FUU0VZRVMKR09SQlkjQ09CI1RSRUFUCkdMRUUjRkxBVFMjU0FURQpUT00jUFJPVEVBTiNSSVAKT01JQ1JPTiNTVEVWRU5TClNPU1VFTUUjVE9ST05UTwpTTkVFWkVTI1NOT1dET04="},{"title":"04/03/11 MUMBO-JUMBO: A huge undertaking","author":"David W. Cromer, edited by Stanley Newman","date":"2011-04-03","grid":"RkFMQ08jQ0FEUkUjQUNFI0FDTUUjCkFMT0hBI0FVUkFMI0JPRyNCTEFORApUT1dFUklOR0lORkVSTk8jQ0lSQ0EKU1RFVyNDT1VQIyNXRUIjI1NQWU9OCiMjI09DSEVSI0FSRUFSVUcjQUlERQpTQ0VORSMjU1VQRVJTSVpFRlJJRVMKSUxMI05JSCNOU0YjVE9JTEFUIyMjCkdJQU5UU0VRVU9JQSMjU0lDI0JFTgpIT0xZI0FMVU1TI1JFUCNESUdFU1QKIyMjTUVBREUjI1JFTUFQI05BVENICiMjSEVSQ1VMRUFOU1RSRU5HVEgjIwpQTFVUTyNQTE9UUyMjS05JU0gjIyMKT0RFU1NBI1NOTyNTQUlOVCNFUklFCkVTUyNJREkjI01PTlNURVJUUlVDSwojIyNBVkVOR0UjUk9UI0RPTyNMRUUKTEFSR0VQUklOVEJPT0sjI1BSRVNTCklERUEjVEVSU0VTVCNFUkFTRSMjIwpNT1RJRiMjRElOIyNGTEVBI1NQQVMKQlJJTkUjQklHVFdFTFZFU0NIT09MClNFTlNFI0lOTiNBVk9JRCNCT1JORQojU0FUUyNMR1MjREFXTlMjU1RFRUQ="},{"title":"04/04/11 SIGNS OF SPRING","author":"Gail Grabowski, edited by Stanley Newman","date":"2011-04-04","grid":"U09MSUQjQ1JBTSNOQVlTCkFSSVNFI0xPR08jSU1VUApXQUxMRkxPV0VSI1BJTEUKU0xZI0VBVFMjQUJJREVECiMjI1NBU0gjRkxBTiMjIwpBREFQVFMjQ1JFQVRFUyMKTElWRSNJU0VFI1NIVVRTCk9WQUwjRUlERVIjRVJBUwpUQUlMUyNDQVNFI0JPUk4KI1NMSVBQRVIjUEFVU0VTCiMjI05PUk0jQkVORCMjIwpTSU5HVE8jTE9BRCNET0UKQVJBQiNXSElSTFlCSVJECkNPUEUjTE9ORSNFUkFTRQpLTkVFI1NFRUQjVEFMT04="},{"title":"04/05/11 FOR KEEPS","author":"Billie Truitt, edited by Stanley Newman","date":"2011-04-05","grid":"UkFTUCNTVEFHUyNEQUlTCkFMVE8jVE9TRUUjVU5UTwpNT0FUI0FGSU5FI1NUT1cKUEVSUEVUVUFMTU9USU9OCiMjI0lRUyMjI1NVQiMjIwpBRElFVSNTUEEjVE9XTlMKUk9UI0FCT0FSRCNXSEVXCkVWRVJMQVNUSU5HTE9WRQpORU1PI05BU1NBVSNMRUUKQVNTT0MjRFlFI0FWRVJUCiMjI01JSSMjI0FWRSMjIwpQRVJNQU5FTlRNQVJLRVIKSURFQSNTQVlISSNCQVNFClRFTlQjRVNTRVMjQUxQUwpBTlRFI1RFRU5TI0xFTlQ="},{"title":"04/06/11 PLAY BALL","author":"Fred Piscop, edited by Stanley Newman","date":"2011-04-06","grid":"U0VBUyNTTEFLRSMjTU9ECkFYTEUjQ0FCSU4jSElERQpQSVRDSEFURU5UI0lDT04KUExBVEVMRVQjUk9UQVJZCllFUiNMRVgjTVlOQSMjIwojIyNSRUQjTElGRU5FVFMKQkJHVU4jU0lORSNFTEFMCkxPT04jU0lOQ0UjUklHQQpFTEJBI1RSRUUjQVZBU1QKV0FZRkFSRVIjTU9FIyMjCiMjI0VXQU4jTUFSI1RBUgpIQVJWRVkjRUFTVFNJREUKSVNFRSNDQVRDSEFXQVZFCkxJQVIjQURPUkUjQVJJRApMQUQjI1RFTk9SI0dBTFM="},{"title":"04/07/11 OUT ON A LIMB","author":"David W. Cromer, edited by Stanley Newman","date":"2011-04-07","grid":"QVJFQVMjUEVSU0UjSEVOClNFVFRPI0lDQUhOI09ERQpTVFJPTkdBUk1FRCNORVcKTElBTSNPRlVTRSNDRU5UCk9MRFNPRCMjRVNTQVkjIwpXRUUjSEVBVllIQU5ERUQKIyMjRU1FUlkjI1NORUVSCldIT0EjUFJJTlQjT1dMUwpCQVNURSMjTk9ISVQjIyMKQ1JPU1NMRUdHRUQjU1NFCiMjTEFURVgjI1JPU1RFUgpBQkVUI1NQUkVFI0hBTE8KU1VNI0ZMRUVURk9PVEVECkFMSSNBSUxFRCNQUklDRQpQTE8jREVTS1MjU0VDVFM="},{"title":"04/08/11 DOUBLE TROUBLE","author":"Robert A. Doll, edited by Stanley Newman","date":"2011-04-08","grid":"QUdGQSNEQUZPRSNXUklUClJPSUwjRVZJQU4jSEFWRQpJQkVUI01JTlRTI09OWVgKU09TT0hVTEFIVUxBIyMjClRPVCNBUkFMU0VBI0NPUApBTUFTUyMjIyMjTUFJTkUKIyMjQ0hPUENIT1BUQVRBClBFU08jQVJMRVMjUk9PSwpGUk9VRlJPVVRVVFUjIyMKQ0lSUkkjIyMjI0hFREdFClNFVCNDQVRBV0JBI0FORAojIyNHQUdBQ0hPV0NIT1cKU09NRSNBWElPTSNBTE1BCklST04jVEVOTEIjRElPUgpYQk9YI0VER0VTI1NBTkQ="},{"title":"04/09/11 SATURDAY STUMPER","author":"Brad Wilber, edited by Stanley Newman","date":"2011-04-09","grid":"VEhFRUFSVEgjQlVSUUFTCkhBTkdGSVJFI0FWQVVOVApFTkZPUkNFUiNTQVZBR0UKSURFI09IWUVBSCNJS0VBClRNRU4jRVNURSNTTkVSRApHT0JPVFMjSU5BTkUjIyMKSURMRVIjQUNFTEEjRkxPClJFRUxFQ1QjQUlSVFJBUApMTEQjQk9PVFMjTE9FV0UKIyMjWUVTTk8jT1NURU5ECk1VWkFLI0FUVFUjU0FERQpFVklMI0JMRUFUUyNHQVMKU1VQSU5FI0JSRUVERVJTCkFMUEVSVCNBVEFMQU5UQQpTQVlTQUgjR0VUQU5UU1k="},{"title":"04/10/11 THE GANG'S ALL HERE: Gangs, actually","author":"Gail Grabowski, edited by Stanley Newman","date":"2011-04-10","grid":"TEVHT1MjUEVBTCNQRVNDSSNUT0ZVCkFEQVBUI0FTVE8jQUxPVUQjRVJBUwpDQVNUQVNQRUxMI0NMVUJTVEVBS1MKRU1QRVJPUiNBSURFUyNTQVVOVEVSCiMjI0RFTEkjU1RBUiMjI1lFU0VTIwpQQUQjI0FLSVRBUyNTQVBTIyMjIyMKU1FVQURDQVIjIyMjVFJPT1BJTlRPCkFVU1NJRSNSSUcjREFNTiNBRE9STgpUQUtFUyMjI1JBVEFUQVQjVE9NRVMKIyMjQUNEQyNBR0lOI05PRCNMQU5FCkJSQSMjQ0xBU1NBQ1RJT04jI0REVApSQUdTI0NBTCNUUkVFI05BTkEjIyMKT1JBTFMjUkVMRUFSTiMjI0FTUEVOCk5FVkVSI0lDRVIjU1RQI0FWSUFURQpDUkVXU09DS1MjIyMjQVJNWUFOVFMKIyMjIyNVRVlTI0JSVU5FSSMjR0VUCiNXSElTVCMjI01PQU4jU0VSQSMjIwpTSE9PVEFUI01BWUJFI0lORVhBQ1QKUEFSVFlHQU1FUyNCQU5EU0hFTExTCkFMREEjRVhFUlQjSVNFRSNJVFNPSwpURUVTI1NJVEVTI1NFV1MjVE9PVFM="},{"title":"04/11/11 JUST RELAX","author":"Gail Grabowski, edited by Stanley Newman","date":"2011-04-11","grid":"U0FHQSNNSVNUWSNBU1BTCktOT1QjRU1DRUUjU0VFUApJVEFMI01PQU5TI1NUQVIKU0lUQVJPVU5EI1JBVFRZCiMjI1NVSVRTI0ZPSUwjIwpCQVRURVIjI0dPQkxFVFMKRVRBIyMjQVdBUkUjQkVFCkFTSyNTVFJPQkVTI0FQVApTRUUjVE9URVMjIyNDRU8KVEFJTE9SUyMjREFSS0VOCiMjVEFQRSNST1VHRSMjIwpQT0VUUyNNRUxMT1dPVVQKQUhBVCNCQVNJTCNST1NFClJJU0UjU0lFVkUjQVBFWApUT1lTI0FOVEVEI1BTU1Q="},{"title":"04/12/11 KITCHEN STAPLES","author":"Billie Truitt, edited by Stanley Newman","date":"2011-04-12","grid":"TUFTUyNCTEFERSNFTEtTCkFDTUUjUkVWRUwjTk9OTwpQTE9EI0lET0xTI0dSRVcKU1VHQVJCT1dMI1RJREVTCiMjI1RFRU4jI1NPTiMjIwpBVFNJWCMjQVdBS0VORUQKTk9UViNHQVJBR0UjT1JPCkdSRUVORUdHU0FOREhBTQpTU0UjT05FVVBTI1JPU0UKVE9SVE9JU0UjI1NFV0VECiMjI1VTRSMjQVNJQSMjIwpQT1NTRSNTUElMVE1JTEsKQU1QUyNDSE9SRSNFUklFClBFQUwjQk9SRUQjUk9NRQpBTlRFI1NFRURTI1NOQVA="},{"title":"04/13/11 ACROSS THE BOARD","author":"Doug Peterson, edited by Stanley Newman","date":"2011-04-13","grid":"V0lTUCNXSE9NI1NLRUVUCklPVEEjSE9MWSNQTFVNRQpTV0VFUElOR1JFRk9STVMKSEFNTEVUI0FJRCNOT0FICiMjI0xPQU0jQUdFRCMjIwojQkxBTktFVERFTklBTCMKSEVYI1NFR08jI1NLSUVSCkFMVkEjUkFOS1MjRVJHTwpET0lORyMjSU5UTyNFR08KI1dJREVSRUNFSVZFUlMjCiMjI1lFQVMjRUNPTCMjIwpBQ0RDI1BDUyNLSU1DSEkKQlJPQURTSE9VTERFUkVECkJVTVBTI0VMU0UjUk9JTApBREVQVCNXRUFSI1NQUlk="},{"title":"04/14/11 HERE TODAY","author":"S.N., edited by Stanley Newman","date":"2011-04-14","grid":"UlVMRVMjQ0xFRiNTQUZFClVUSUNBI1lVUkkjVUZPUwpSQVpPUiNCQVNTI05BR1MKI0hBTkdTT1VUVE9EUlkjCiMjIyNFQVIjI0ZEQSMjIwpET0VTTlRHT1FVSUVUTFkKSU5QVVQjI1BFTEUjV0VFClZJU0UjSEVBRFMjRElWQQpFQ08jTEFJUiMjTklORVIKUkVNQUlOU1RPQkVTRUVOCiMjI0RWRCMjQ0FUIyMjIwojU1RBWVNBV0FZRlJPTSMKSkVFUCNPTkVTI0xJTU9TCkVBU1QjQU5URSNJVkFOQQpCTFRTI1BPU1kjWEVST1g="},{"title":"04/15/11 LIVE AND LEARN","author":"Nina Rulon-Miller, edited by Stanley Newman","date":"2011-04-15","grid":"R1VMUCNQU1lDSCNBREFNClJURVMjT01BSEEjTElURQpBTUFTI0xJTUlUI09QRU4KRE9OVExFVFNDSE9PTCMjCkVTVCNBU0gjIyNBRk9PVApTVE9PRCMjU0hPVCNNQU8KIyMjUExFQVRFRCNSQVRFCiNJTlRFUkZFUkVXSVRIIwpBQ0VTI05FTUVTSVMjIyMKTE9YI0JPV1MjI0xFQVNICkVOVFJZIyMjQ0FNI1BMTwojI1lPVVJFRFVDQVRJT04KQVJFQSNFRElUSCNXQUdFCkRJQVMjRUVSSUUjSVJBUwpTT1JUI0tORUVTI0dZTlQ="},{"title":"04/16/11 SATURDAY STUMPER","author":"Lester Ruff, edited by Stanley Newman","date":"2011-04-16","grid":"V1JFU1RMRSNTQVVOVEVSCkhFTkNPT1AjT0JTRVJWRQpBRERPTlRPI1JBQ0hBRUwKVFdJVCNVTlNFVCNJTlJFCkZJTiNQU1lDSEVEI1NFQQpVTkdFUiNNQUUjQU1JU1MKTkVTVEVSI0JBR1VFVFRFCiMjI0hFSVIjRElQUyMjIwpTQ1JJTVBFRCNTSE9KSVMKTkFBQ1AjRklYI0lOVVNFCkFSQyNUUklTVEFOI0dPVgpQSUVTI0lOS0VSI1BVTEUKUE9TVEFHRSNSRUdVTEFSCkVDVUFET1IjUkFOTEFURQpSQVBUT1JTI0FTUElSRUQ="},{"title":"04/17/11 GENRE-LY SPEAKING: Something to sing about","author":"Norma Steinberg, edited by Stanley Newman","date":"2011-04-17","grid":"UEFSVCNTRVdFRCNBU0NBUCNMT0FOCkFSSUEjT1ZJTkUjTk9STUEjT05UTwpST0NLT0ZBR0VTI0RSRVNTQkxVRVMKS05FRVBBRFMjQ0FSVFMjU09JU0VFCiMjI0hFUkUjTUVSRVNUI0tJVCMjIwpBREhPQyMjU0lORVcjI1JFTEFQU0UKUFJPTSNTQ09MRCNTUFJBWVMjT1BTClJPU0UjSEFVTCMjI1JPU1MjQ1BBUwpJTlQjR09TUEVMVFJVVEgjU0hJUkUKTEVDVFVSRVMjSVJPTlMjU0hBTktTCiMjT0lMRUQjSU1BR0UjSEVBUlQjIwpTVFVNUFMjU05JUEUjQkVEUk9PTVMKVElORVMjQkVBVFNUSEVSQVAjVklFClJBVFMjQ09OTiMjI0FMT1QjUklMRQpFUlIjTE9BREVEI0JMQURFI0hFQUQKUEFZTUVOVCMjUkFMTFkjI1RPV05TCiMjI0VBVCNUSEVCRVMjR09PRCMjIwpTUEFSU0UjSElERVMjTkVBUkVBU1QKUE9SQ0hTV0lORyNTT1VMU0lTVEVSCklTTEUjU0FSR0UjRURESUUjSU9MQQpUSE9SI0FEREVEI0RFRURTI0FNRk0="},{"title":"04/18/11 GYMNASTICS CLASS","author":"Gail Grabowski, edited by Stanley Newman","date":"2011-04-18","grid":"I0dFRSNNSVNUI1NIQVBFCkNPUk4jSURMRSNUQUxPTgpMVVJFI0xFQVAjQVJNRUQKT0RPUiNMQVNFUkJFQU1TCkdBUkdMRSNIRUVMIyMjIwojIyNZQVJEIyNNRURBTFMKU05PQlMjQUNUSSNBUkVBClBBUkEjU0xFRVQjUklOSwpVU0VSI1BJRVIjU0tBVEUKUkFTU0xFIyNNQUNIIyMjCiMjIyNPQVJTI1NIT1JFUwpDTEFTU1JJTkdTI1JJTEUKSE9MRVMjUEFORSNTTk9XCklOQU5FI0VSQVMjRVNQTgpQRVNUUyNORVdTI1NFRSM="},{"title":"04/19/11 ALL IN YOUR HEAD","author":"Sally R. Stein, edited by Stanley Newman","date":"2011-04-19","grid":"SVBBRCNDSEFPUyNTUEFUCkRFTEkjTEVNTUUjTUlORQpMQU9TI0FSRU5BI0FOVEUKRUxFQ1RST05JQ0JSQUlOCiMjIyNZRU4jI09VVCMjIwpBQlJVUFQjSk9BTiNCQlMKU1VFTUUjU09XUyNBQVJQClNMSVBPRlRIRVRPTkdVRQpFR0dTI1JJTkQjVk9JQ0UKVEVOI0hFUlMjREVOVEVECiMjI1BJRSMjR1JSIyMjIwpBUk1FRFRPVEhFVEVFVEgKTEVJUyNJREVBUyNBUklBClNJTEsjTUVBTlMjU0lMTApPTkxZI0VTU0FZI1RFTEw="},{"title":"04/20/11 KEYS TO SUCCESS","author":"Fred Piscop, edited by Stanley Newman","date":"2011-04-20","grid":"VEJTUCNPVklEI0hBU1RPCklPV0EjTk9OTyNPQ0VBTgpET0lOI0ZJUkVFU0NBUEUKQU5ORVJJQ0UjVkVUVEVTCkxFRyNPTEUjUEVSIyMjIwojI1NMT0UjQ09SU0FHRVMKSE9IVU0jQlJVVCNHVVJVCklCSVMjQlJBVFMjQU5URQpTT0ZUI1JPV1MjRElDRUQKU0VUU1NBSUwjVklOTyMjCiMjIyNUSUwjUElFI05CQQpBTVVTRVMjVEVBTVNURVIKUFVOVFJFVFVSTiNPUlNPCk9MREVOI0lCSUQjTE9UUwpQTE9XUyNQQUxTI0VMU0U="},{"title":"04/21/11 EASTER EGGS","author":"Billie Truitt, edited by Stanley Newman","date":"2011-04-21","grid":"QU1TIyNDQUxWRSNTTElECk1BVEgjT05FSU4jQVVUTwpBTE9FI1JPQVNUI0lORVoKU1RPUEJPVEhFUklOR01FClNBTFRJTkUjI0VNVCMjIwojIyNBVEUjQkVFUCNTRUMKSkFZR0FUU0JZIyNJT1dBCkFGT09UI0FHRSNGQ0xFRgpEQVJOIyNUVVJRVU9JU0UKRVJFI0dXRU4jVVJOIyMjCiMjI1VNQSMjQklPQ0hFTQpGUkVOQ0hJQ0VDUkVBTVMKTE9BRCNXQVVHSCNESUVECkVMU0UjQUdSRUUjRVJOTwpERUVSI0hPU1RTIyNZRFM="},{"title":"04/22/11 RETURN OF THE JETTY","author":"E.C. Williams, edited by Stanley Newman","date":"2011-04-22","grid":"TEVBUFQjTlVNQiNMQUdTCk9NTklBI09LSUUjQVJJQQpQSU5FUyNCRVJUSE1BUksKU1RBUlRMRVMjV09CQkxFCiMjI0dJTEwjRkVOUyMjIwpTQUNSRUQjVFJFRSNQRUcKQUJIT1IjQ0hJTiNXSUZFCkxVQVUjI0hJRSMjSEFSRQpTVE9QI0JJTlMjV0FORVMKQVNTI0JBTEsjQ0hST01FCiMjI0hVTEwjUkVFRiMjIwpBUFBBTEwjRk9PVEZBTEwKUVVBWUJPQVJEI0hBR1VFClVSR0UjT0JPRSNFUkVDVApBUkVTI05FTU8jUkVTRVQ="},{"title":"04/23/11 SATURDAY STUMPER","author":"Doug Peterson, edited by Stanley Newman","date":"2011-04-23","grid":"SU1QQUNUIyNGTFVCQkVSClRPUkNIRVMjTEFORU9ORQpDUklUSUNBTEFDQ0xBSU0KSEVNRU4jQkFLRVIjVERTCiMjI0RFQ0lERVNPTiMjIwpDT04jU0FOWU8jU09GQVMKQURPUkVTI01VRFNUT05FCkNPS0UjRUxBVEUjRVJJRQpUUklOSURBRCNLUERVVFkKSVNBQUMjQk9SRVIjTUFBCiMjI0xFQVJORURPRiMjIwpQQlMjQlJBTlMjRFJBTUEKRlJPWkVOREFJUVVJUklTCkNFU0FSSU8jTk9DQVRDSApTV0FHR0VSIyNNRVJTRVk="},{"title":"04/24/11 DIAMOND GEMS: Of the wordplay variety","author":"Fred Piscop, edited by Stanley Newman","date":"2011-04-24","grid":"VFVMU0EjQVJDSCNJUk1BI1RSQUxBCkFSRUFTI01PTk8jTkFJTCNIQVZPQwpQSVRDSENPVU5UI1NUUklLRVpPTkUKRVNTI1RFTlQjU1BJVEUjSVJPTkVECiMjI0ZST0cjTU9PRFkjRE9FUiMjIwpBR0dJRVMjSE9VU0UjQklTI1NDQUIKVE9SVEUjI1VQUEVSREVDSyMjSVZFCkxBT1MjQVRNRSMjI0VWRVMjQlJBVApBUFUjI0ZPVVJCQUdHRVIjTElDSVQKU0VOQVRPUlMjUlVSQUwjTU9EVUxFCiMjRElBUlkjTk9ERVMjQklURVMjIwpSQVNTTEUjR0VUSVQjUFJFU1NDQVIKVU5DTEUjR09BSEVBRFJVTiMjQUxBClRJUkUjU0xBVCMjI1JPVFMjU1RJUgpUU0UjI0NVVE9GRk1BTiMjQk9DQ0UKWUVXUyNPVFMjTElFR0UjV0FTSEVSCiMjI1RPUkUjU09GQVMjUE9DTyMjIwpDTEVBVkUjU0FXSU4jSE9PSyNTSEUKUlVCQkVSR0FNRSNET1VCTEVQTEFZClVSQkFOI0lHT1IjRVJHTyNSRUFJUgpaRVNUUyNTRUFTI1JPU1kjU0FCTEU="},{"title":"04/25/11 EXPENSIVE TASTES","author":"Gail Grabowski, edited by Stanley Newman","date":"2011-04-25","grid":"Qk9BUyNQTE9UI1BFREFMCkxBTEEjUk9QRSNBUkVTTwpBU0lTI0FTRUMjRFJBSU4KSElHSFBJVENIRUQjUkFHCiNTTkVFUiMjU1RFRUQjIwojIyNTTklUUyNBRExJQlMKRVNTI05FQVRPIyNNQUlOCkdFVEJZI05PUiNBT1JUQQpHTEVFIyNHUkVFTiNZRVAKU0xFRVZFI01PTktTIyMjCiMjUFJJU00jI1NMVVNIIwpDUFIjU1RJRkZORUNLRUQKUk9PU1QjTElSQSNIQVJFCk9NQUhBI0VWRVIjQVRPUApDRURFUyNSRUVMI1NFTlQ="},{"title":"04/26/11 UP IN THE AIR","author":"Billie Truitt, edited by Stanley Newman","date":"2011-04-26","grid":"SEFOR1MjQUFIUyMjS0lECkFGT09UI1RIQVRTI09ERQpMQVRURSNUQUJPTyNBVEUKRlJFRUFTQUJJUkQjTEFECiMjI0FNUCMjVEVBQkFHUwpTUEFNI1lFVyNTUEEjIyMKRVJBI1JPTUVPI09XTlVQCkNBUlBFTlRFUlNQTEFORQpUWVBPUyNTUEVDUyNHSVMKIyMjTU9NI1lPVSNBU1RPClRSSVBMRUEjI0JBUyMjIwpIRU4jVU5ERVJBQ0xPVUQKRVNTI1RJQVJBI0NFQVNFClJPRSNFQVRJTiNURUhFRQpFRFQjI0xFRUsjU1BVRFM="},{"title":"04/27/11 WINDOW DRESSING","author":"Doug Peterson, edited by Stanley Newman","date":"2011-04-27","grid":"Qk9PTSNTUEFOTyNTQ0FNCkVTUFkjRUVMRVIjSUFHTwpTSFVUVEVSQlVHI09SRU8KU0FTSEFZI0FUQUdVRVNTCiMjI1NMT0UjI05FWFQjIwpTT0QjQ1VSVEFJTkNBTEwKUExFQVMjUk9EUyNJS0VBCkFNUFMjTUFORVQjVEVEUwpNRUFUI0FUSVAjR1lST1MKU0NSRUVOQUNUT1IjU05PCiMjVFJPRCMjU05JVCMjIwpGRU1JTklTVCNFRVJJRVIKRVdFUyNCTElOREZBSVRIClRBTksjTElWSUEjQ0lBTwpBTlRTI0VQT1hZI0tJVFM="},{"title":"04/28/11 GOING DEEP","author":"David W. Cromer, edited by Stanley Newman","date":"2011-04-28","grid":"QUhBI0xBTkQjSUJBUlMjClRBTiNCTkFJI1N