{"id":"newsday-2002","publication":"newsday","year":"2002","count":365,"puzzles":[{"title":"1/01/02 CHOOSE YOUR WEAPONS","author":"by Daniel R. Stark, edited by Stanley Newman","date":"2002-01-01","grid":"TU9QUyNJTktTI1NPTFZFCkFWRUMjU09JTCNVTUJFUgpTQVJBI1JFTkUjQ0FTRVMKQ0xVQlNBTkRXSUNIIyMjCiMjIyNMRUQjI0JFQUdMRQpTQ0hPT0wjU01FRSNSRVgKVEhPTEUjU1dPUkRGSVNIClJBUkUjR0hPU1QjQUxTTwpBUlJPV1JPT1QjSURMRVIKUFJPI0hPT1AjQVNTRU5UClNPUlRPRiMjT05PIyMjIwojIyNTUEVBUk1JTlRHVU0KQ0hFQVAjUE9FTSNXRU5ECkhFQVZFI1NBR0EjSVJJUwpFUlJPUiNPUkFMI1RFVEU="},{"title":"1/02/02 WHAT'S THE FREQUENCY?","author":"by Sally R. Stein, edited by Stanley Newman","date":"2002-01-02","grid":"QUJFTCNBRE1JTiNSQVNICkxFVkkjTUlBTUkjRUNITwpGTElUI0JSWUFOI1BUQVMKQUxMVEhFVElNRSNBSVJFCiMjI0VBUiMjI1RSSVZJQQpCSk9STiNPSERFQVIjIyMKUkFWRUQjRE9SRU4jQ1BPCkVWRVJZTk9XQU5EVEhFTgpXQU4jTUVSSVQjT1JBVEUKIyMjUkFJU0VTI01JTkVTClNPTE9ORyMjI09MRCMjIwpDSEFUI0hBUkRMWUVWRVIKT0FUSCNCUk9JTCNOSUxFClRSRUsjT01BTkkjVEFMRQpUQVJPI1JBTkVFI1NMRUQ="},{"title":"1/03/02 HARVEST TIME","author":"by Bob Frank, edited by Stanley Newman","date":"2002-01-03","grid":"VVJTQSNTT0ZUQyNBVEFECktJTE4jQUxMRVkjV09SRQpFTUlUI0NMQVJBI0dVRkYKIyNQSUNLQVdJTk5FUiMjCkJBU1FVRSMjI0JZRSMjIwpPVFQjVFJFQUNMRSNBSEEKR09SS0kjVEhPVSNFREVOCkdMRUFOVEhFTUVBTklORwpFTEFOI1JBTUkjTE9SUkUKRFNNI0xFTlNDQVAjT1lMCiMjI05PUyMjI1NIQU5JQQojI1JFQVBBUkVXQVJEIyMKQkVUQSNBTEFURSNFQUNICkFHRVIjU0VHQUwjQUNIRQpUT1NTI1NDVUxMI1NLSU0="},{"title":"1/04/02 SNOOZE ALERT","author":"by Lee Weaver, edited by Stanley Newman","date":"2002-01-04","grid":"QVNUSSMjR1JBQiNHTE9QCkxPQU5TI09PTkEjTEFWQQpEQU5EWSNCT0RZI09ORVMKQVJHT04jSUZZT1VXQU5UCiMjI09PUCMjI1VOV0lTRQpZT1VSRFJFQU1TVE8jIyMKQU1TIyNFTFNBI09SREVSCktJRVYjUEVTVFMjTU9WRQpTVFJJUCNWRUVQIyNERU4KIyMjQ09NRVRSVUVET05UClBJUkFURSMjI1JCSSMjIwpPVkVSU0xFRVAjQkVMT1cKTk9SQSNPUEFMI0VUVURFCkRSQUcjTkVSTyNERUxJUwpTWU5FI1NFTlQjI0RVRVQ="},{"title":"1/05/02 SATURDAY STUMPER","author":"by S.N., edited by Stanley Newman","date":"2002-01-05","grid":"QlJFUiNMRVdJUyNOVUtFClJJVEEjRVJJQ0EjT1BSWQpBQ1RJI1RJTEVEI01PT1IKR09FU1RIRURJU1RBTkNFCiMjI0VSQSNHTkFXTiMjIwpDT1NURUxMTyNDT0lMVVAKT01BSEEjWU9MSyNTT0xFClNBTEVTUkVTSVNUQU5DRQpUUklUI1VTRVIjQU5HRUwKQVNTSUdOI0NBUlJJRVJTCiMjI1RFTlRII0FTUyMjIwpHUkVBVEVSQU5USUxMRVMKUk9BTiNST1NJRSNBSURFCkFOVEkjVVBFTkQjTkxFUgpNQVNDI1BPU0VSI0RZTkU="},{"title":"1/06/02 OPPOSITE ATTRACTION: Try it on for size","author":"by Andrew Waters, edited by Stanley Newman","date":"2002-01-06","grid":"R05BVCMjU1RFVCNSQUlOI0JMQVpFCkhPVkUjU0hPUkUjRUNUTyNBSUxFRApBVkVSI0FJUkVTI0RFQU4jU1RFQUQKTkFSUk9XVklDVE9SWSNTVEFURUxZCkFTVElSIyMjVElMRSNBVE9MTCMjIwojIyNFQVRJTiNORVdTQk9ZI0VEQU0KU0hPUlRFTklORyMjQVNQUyNCRUxBCk9BSyNPRERMWSMjQUdFUyMjT1BFTgpGSVIjUlNJI1NVTFRBTiNWQVBPUlMKQVJBQiMjQ0FFU0FSI1RPSUxFVFRFCiMjI0lGRUVMI0VORSNFTkFURSMjIwpTVEFHSUVTVCNEQVNIRVMjI1BBVEgKTElUSEVSI0VOVElUWSNUSUMjUlVFCkFFUk8jI1RSSU8jI1BJQU5PI0lSRQpNVUlSI0JJRU4jI0xPTkdJU0xBTkQKU1BBTiNVUkdFTkNZI1NFVFRPIyMjCiMjI1JPTUVPI09VQ0gjIyNBTEdBRQpTSFJJTVBTI1dJREVBTkdMRUxFTlMKV0FJVkUjT05FUyNVVlVMQSNJTk5TCkFMTEVOI01BUkUjTUVOVVMjRVJJRQpQRUVSUyNFWUVTI1NBU0UjI1NFRU4="},{"title":"1/07/02 ALLEY OOP","author":"by Lee Weaver, edited by Stanley Newman","date":"2002-01-07","grid":"R1JBTVMjQVBTRSMjU0FQCkFFU09QI1NFTExTI1BUQQpHVVRURVJTTklQRSNMRU4KQVBJRUNFIyNEQVdOSU5HCiMjI0xJRFMjI1NOSVQjIwojQVNTRVJUI01PVVRIRUQKUElQI1NBVURJI1BFQUxFClNUQVMjV1JFTlMjUklBTApTQ1JFVyNEWU5FUyNSVEUKVEhFUkFQWSNJTkNBU0UjCiMjVFVCQSMjRUFSTiMjIwpDTElNQVRFIyNUVUdHRUQKT0FSI1NUUklLRUZPUkNFCkxJRSNIRU5SSSNGUkVPTgpEUlMjI1JFRUQjWUFXTlM="},{"title":"1/08/02 THREE LITTLE WORDS","author":"by S.N., edited by Stanley Newman","date":"2002-01-08","grid":"RVJTVCNCUkFUI1RBUkFTCkxFQUgjUkVCQSNTTkFLRQpNRU5VI09ET1IjSFlEUkEKT0RETUFOT1VUI0lESU9NCiMjI0JJWkVUI0RSQUlOUwpGTEEjUkVTI0NJVFkjIyMKUlVTVFkjI1NBTVNORUFECkVBU0UjTUFIUkUjT0dSRQpUVU5BRklTSCMjVFdJTEwKIyMjRkFMSyNTU1cjU09MCkFDQ09SRCNBTk5JRSMjIwpTSE9SRSNIVUVBTkRDUlkKUEFTVEEjT0RFUiNTT1lBCkNSRVdTI1NJWkUjRUxBTApBU0NPVCNUT1lTI0xBTkU="},{"title":"1/09/02 FRUIT-FILLED","author":"by Daniel R. Stark, edited by Stanley Newman","date":"2002-01-09","grid":"U1VMSyNXT1JNI0FTQU4jCldSRU4jSUNFRCNQT0xPIwpJU0VFI05FRFMjT1VUUkUKTUFLRUFEQVRFI0dSQVNTCiMjIyNNWU5BIyNFR1JFVApCRU5KSSNTUEFDRVIjIyMKQVJPVU5EI0VSUiNBQkVUCkJBU1NPT04jTUFZUE9MRQpTVEVUI1ZPVyNCRUVUTEUKIyMjUE9FVElDI0FTSEVOClBBR0VSIyNQQVJSIyMjIwpPUkVBRCNMRU1PTkxBV1MKREFOQ0UjSURFQSNBUklBCiNCT0hSI1BVVFMjS0VHUwojU0FZUyNTUE9UI0VBU0U="},{"title":"1/10/02 SPLIT P'S","author":"by Fred Piscop, edited by Stanley Newman","date":"2002-01-10","grid":"TFREI0FSQUIjI0lNQU4jCkFSSSNTRVRVUCNTQUJPVApNVVNIWUZBUkUjSE9STkUKI0FESUVVI05BU1QjSUFOCkdOQVQjR0VUVVBBTkRHTwpNQ0kjUkVCIyNPUkVHT04KU1lOR0UjT1dFRCNFRU5TCiMjI0FQUExFU0VFRCMjIwpUU09TI0FJRFMjTVlPUEUKSU5TRUFNIyNFUkkjVUFSCk1PTVNTUE9VU0UjTFRSUwpFQ08jUEFSUiNUU0FSUyMKUk9TU0kjQkFCWUhPVU5EClNORUVSI1NMT1BFI05JQQojRURHRSMjU1BFRCNTUFk="},{"title":"1/11/02 LEAP DAY","author":"by Patrick Jordan, edited by Stanley Newman","date":"2002-01-11","grid":"SURBSE8jV0FZI1NRVUFEClJFTEFYI09ERSNDVVJMWQpJRkFURklSU1QjUkVTRUUKU1RTI09BSyNJQ0VCQUdTCiMjI0FSR08jI0hFRSMjIwojWU9VRE9OVFNVQ0NFRUQKREVBUlMjI0hJR0gjS0lBClJBVEEjUEVPTlMjS0lFVgpFU0UjQk9BUiMjSU5OSUUKSVRTQkVTVE5PVFRPR08jCiMjI1JBRSMjQkVBVCMjIwpQSUNBU1NPI0VFTCNMRUEKRVJFQ1QjU0tZRElWSU5HClBBTkVMI0xJRSNDQVJWRQpFTlRSWSNPREQjU1RBWVM="},{"title":"1/12/02 SATURDAY STUMPER","author":"by Bob Peoples, edited by Stanley Newman","date":"2002-01-12","grid":"R09PREZPUk5PVEhJTkdTCkVOVFJFUFJFTkVVUklBTApNRVRPTkVTV0FURVJMT08KIyMjU1NOI0ZJRVMjRUxNCk1VR1MjI0NBUiMjSVNTTwpNQ0kjQkFSTiNTRVEjIyMKQ09MTEVHRUdSQURVQVRFCklOVEVSTkFMQVVESVRPUgpJTlNUUlVNRU5UQVRJT04KIyMjR0FTI0RVRVMjTVRTCkxBTE8jI1ZJUCMjVEVTVApPUkEjUEFJRCNFTVUjIyMKUE9JU09OUEVOTEVUVEVSCkFTTE9PU0VBU0FHT09TRQpURUFDSEVSU0FMQVJJRVM="},{"title":"1/13/02 ANIMAL ANATOMY: A course found in the dictionary","author":"by Frances Burton, edited by Stanley Newman","date":"2002-01-13","grid":"U1RBTiMjQ1JBRyNFVEFTI1JBREFSCkxPR0lDI0hFUlIjVEFNQSNFUklDQQpPUk9OTyNBTlRBI0NSSUIjQ0FSRVQKUElHRU9OVE9FRCNFQUdMRUVZRUQjCiMjIyNFRUUjI0VTVCNBRVJJIyMjIwpBTEJFUlRBI1dBVEVSI1NBVkFMQVMKU0FVTCNIVUxBI09SQUwjU0VOSUxFClRJQ0sjRVhFUyNXQVZFUiNTVE9MRQpJTktJRVIjT1BUIyNFTk9TI1NOSVAKI0VUTkEjQVNXQU4jTkFNRVMjSEVTCiMjT1NDQVIjQU1JU0gjUFJJQ0UjIwpBUE8jSEFJVEkjTEVBUFMjQUxBUyMKVkVUUyNBU0lTIyNUSUUjU01BUlRTCkFTSEVTI0VMVE9OI1JBTVAjU1RPUApTVEVFTFMjTEVWSSNFVEFMI1BFUkkKVE9ERElFUyNERUxFRCNHQURTREVOCiMjIyNDQU5FI1JFTSMjRVNFIyMjIwojSEFXS05PU0VEI0JVTExIRUFERUQKTE9SUkUjT1RUTyNFTk9MI0RSQVBFCkFNRUVSI1BFVEUjRElWQSNTSVJFTgpCRUFOUyNTRUVTI1NURU4jI0RFRVM="},{"title":"1/14/02 WE ARE FAMILY","author":"by Norma Steinberg, edited by Stanley Newman","date":"2002-01-14","grid":"TEFNQiNTSEFHI1NBR0FTCk9ET1IjQ09ERSNBTUlHTwpOT1JBI0FSQU4jRFVORVMKR1JBTkRNQU1PU0VTIyMjClNFTkRVUCNTQVQjRUFDSAojIyNJTklUIyNSSURETEUKQU1PUyMjU1VQRVIjTE9BCkZBVEhFUktOT1dTQkVTVApPTlQjTk9TRVMjI0FSRVMKRklFTERTIyNFUElDIyMjCkxBUkEjRVNUI1VOS0lORAojIyNTSVNURVJDQVJSSUUKQU1BU1MjRVJJSyNFQVZFCkNPTElOI0VSTEUjU1RFTQpUV0VFVCNQRUVSI1RFTlM="},{"title":"1/15/02 IN A RUSH","author":"by Lee Weaver, edited by Stanley Newman","date":"2002-01-15","grid":"Q1JFQU0jIyNIQUxJQlVUCkhFTE1FVCNDT0dJVEFURQpFQVNJRVIjT1BFUkFURUQKRkxFRVRBRE1JUkFMIyMjCiMjIyMjQ0FCIyMjT0FGUwpQUk9NUFRCT09LIyNMSVAKUkVMQVkjIyNUT0RETEVSCkVORFVSRVMjQ0FST1VTRQpTVEFMRVNUIyMjQU9SVEEKRUVHIyNRVUlDS0JSRUFEClRSRVQjIyNEQU4jIyMjIwojIyNIQVNUWVBVRERJTkcKUEVERVNUQUwjVEVFVEVSCk9WRVJTRUxMI0VSTUlORQpQQUxFVFRFIyMjTU9TRVk="},{"title":"1/16/02 THE BIG 4-O","author":"by Fred Piscop, edited by Stanley Newman","date":"2002-01-16","grid":"UEFURVMjT1JBTCNBUEVTCkFWQU5UI0xJTEkjQk9TSApWT09ET09ET0xMI1NPVE8KRU5TSUxFIyMjTEFUSEVSCiMjI1ZFUlQjUkVMQVBTRQpBTEJFTiNPTEUjQklPIyMKTEVPUyNNT0xEUyNOT1RFCkVHTyMjR0xBREUjI0hPRQpDT0JCI1JBTU9OI0xFQU4KIyNPQVMjVEFHI0xJRERZClBST0JBVEUjU0NBQiMjIwpIVUJCTEUjIyNPREVTU0EKQVNFQSNTQ0hPT0xST09NClNUQUcjVEhBVyNFVFVERQpFWVJFI1lFTEwjRFlMQU4="},{"title":"1/17/02 DON'T KNOW THE WORDS","author":"by Bob Lubbers, edited by Stanley Newman","date":"2002-01-17","grid":"QkFUSCMjT0ZJVCNTTU9HCk9NT08jI0RBU0gjVEVOTwpOT1JUSCNFUklFI1VTRUQKRFVNQkFSVE9OT0FLUyMjCiNSRVJJTlNFI0RSQUlOIwojIyNPUlMjI0hPUiNBSU0KQVNTVCMjT1BFUkEjTkNPCkRBUEhORURVTUFVUklFUgpBVEEjQURJVFMjI0FDUkUKUlVUI0FHRSMjTURUIyMjCiNQSUVDRSNOQU1FVEFHIwojI0FQUExFRFVNUExJTkcKTUFMSSNFVE9OI1RJTU9SClRBTEMjU0FMVCMjTkVNTwpTQVlTI1NUQVMjI0dFRVM="},{"title":"1/18/02 ROS\u00c9 OUTLOOK","author":"by Bob Frank, edited by Stanley Newman","date":"2002-01-18","grid":"UEVMVCNTVEVUI0VCQkVECk9ORUEjS0VNTyNNQUxUQQpXUkFQI0lNSVQjTVVURUQKV0lORUlNUFJPVkVTIyMjCk9DVCNNTUVTI0lUQ0hFRApXSE9PUEkjI1dJVEhBR0UKIyMjQkVMTE9DIyMjUk9OCiMjSUxJS0VJVE1PUkUjIwpOVU4jIyNTTFVJQ0UjIyMKQU5ETU9SRSMjQ0NMQU1QCkdVWUFOQSNPQUhVI0xFSQojIyNUSEVPTERFUklHRVQKUkVQUk8jQUxBTiNOT1RJCkVSUk9MI0ZJUkUjQ1JVRQpGUk9ORCNTRUVSI1JFUFM="},{"title":"1/19/02 SATURDAY STUMPER","author":"by S.N., edited by Stanley Newman","date":"2002-01-19","grid":"U0NPRkZMQVcjU0lOTkVSClRPVkFSSUNII0FOWU9ORQpBTU9SRVRUSSNVVFVSTlMKVVBJI1RISU5JQ0UjRUVFCk5FRCNTRVZFUkVSI0xBTgpDUkFZIyMjI0VQQSNDRFQKSEVMRU4jUkFOQUNST1NTCiMjI0xBQllSSU5USCMjIwpSSEFQU09ESUMjU0VPVUwKRU9TI0hVRSMjIyNBUk5FClVNUCNWSUxOSVVTI0VFTgpCRUkjSUxMSUNJVCNHQUQKRVJST0xMI1RJTlBMQVRFCk5JRUxMTyNSRVRBSU5FUgpTQ1JFRU4jT1JBVElPTlM="},{"title":"1/20/02 SEEN BUT NOT HEARD: Giving you the silent treatment","author":"by Fred Piscop, edited by Stanley Newman","date":"2002-01-20","grid":"Tk9STVMjQVNQUyNFTVQjU0NPV0xTCkFURUFUI1NIT09UUEFSI0xBUlJVUApXUkFZT0ZTVU5TSElORSNBUklBTkEKI0FMT05FI1RFQVIjRUFTVCNTUEVDCkVOVFJFRVMjIyNPVkFURSNQT1NTRQpHVE8jI0xFQVAjTkFUI05TWU5DIyMKR09SRUQjV1JJTkdMRUFERVIjQUNTCiMjI05PVFNVUkUjRVJSI0RFQ0xBVwojU1dJTVMjTUFXUiNTT0RBI0VMU0UKQ0FSR09FUyNURUFNI1NJTiNOSUNFCkVMRU0jI1dSRVNUQVJFQSMjU09BUApST05BI1NFRSNUSU5BI0dST1VORFMKSU1BVCNQRUxUI09VU1QjUFVSU0UjClNPTkFUQSNJQU4jQVRPTUlaRSMjIwpFTkQjV1JBQ0tPRkxBTUIjT1NUSUEKIyNTUElFTCNFR08jU0VBUyMjRU1VCkxBVEVOI0FTVE9SIyMjU0xPVFRFRApBRElOI0VTQVUjQVRJVCNBTE9IQSMKRFVNUEVSI1dSSUdIVFJFVkVSRU5ECkVMUEFTTyNJTk5FUkVBUiNBVFJJQQpTVFlMRVMjTlNDI1VNUFMjTkVTVFM="},{"title":"1/21/02 BIG STUFF","author":"by Lee Weaver, edited by Stanley Newman","date":"2002-01-21","grid":"UEVBQ0UjQ0xFTyMjTElECkVMTEVOI0hFTlJJI0FEQQpHSUFOVFBBTkRBUyNSRU0KU0VTU0lPTiNTVE9QR0FQCiMjI09DUyMjI09CT0UjIwojQUdSRUVTI0ZSQVBQRVMKU1VSI0RST09MI1JVUkFMCk9ERUEjU0FMRVMjUElTQQpMRUFSTiNLRUVQUyNORUIKRU5UUkFQUyNUUllTVFMjCiMjTE9WRSMjI0VOTyMjIwpVTkFXQVJFI0RFQ0lERVMKUk9LI0pVTUJPU0hSSU1QClNFRSNPU0lFUiNFRVJJRQpBU1MjI0VUTkEjREVFUkU="},{"title":"1/22/02 FACTORY OUTLET","author":"by Patrick Jordan, edited by Stanley Newman","date":"2002-01-22","grid":"RlVSUyNWQVBPUiNIQUlMCkFUSVQjQURPUkUjT0pBSQpUQUNPI05VTExTI1dBR1MKU0hPUFRJTExZT1VEUk9QCiMjI1NBTFQjI0xBWSMjIwpBVFdJTEwjVkVFUiNQQlMKRk9SR0VBSEVBRCNXSVJFClJBSU5TI0FJUiNUT1FVRQpPREVTI01JTExBUk9VTkQKU1NSI0JFR1MjQ0FERVRTCiMjI1NJRCMjQVJNUyMjIwpQTEFOVElOT05FU01JTkQKUklUQSNDT01FQSNPUkVPCkFNT0sjT1JBTkcjS0FSVApNQVpFI1NBTlRFI0VORFM="},{"title":"1/23/02 JUMBLED","author":"by Fred Piscop, edited by Stanley Newman","date":"2002-01-23","grid":"SEFMQVMjQVNQUyMjRkxBCkFMSUJJI0lLRUEjQk9PUApSVU1CTEVTRUFUI1VSU0EKRU1CQVRUTEUjU09NTUVSCiMjIyMjVEVUIyNJQkVSVApNT1RIUkEjRVdFTEwjIyMKSU5PVVQjRFJFRyNFTElBCkNBUk1FTEEjQk9NQkVSUwpLTk9CI0FSQUIjR0VORVMKIyMjTEVWRUwjR1JFQVNZClNJTEVYIyNBTkEjIyMjIwpBREFQVFMjUk9PTUVUVEUKTElTSSNUVU1CTEVXRUVEClZPVEUjT1BFTCNSRVJBTgpPTVMjI1dJREUjRVJJU0E="},{"title":"1/24/02 CHEESE IT","author":"by S.N., edited by Stanley Newman","date":"2002-01-24","grid":"RE9SQSNHVUFNI1NDSFdBCklDRVMjSVNMRSNBSEVBRApGRU1BI1ZPTFQjTEVUR08KRkFOTklFRkFSTUVSIyMjClVOQSNMQUEjT1NTI1BBQwpTVU5CT1cjRk5VTUJFUlMKRVNURSNBRlJPI0FPUlRBCiMjI1JBWVJPTUFOTyMjIwpJU1NFSSNVU0VSI1RIRU0KUE9SVFJBSVQjR1VZQU5BCk9VSSNUT1QjUFVQI1BBUgojIyNXSUxMSUFNQ09MQlkKQ1JBSUcjRURHRSNMT0xBCk9PTVBII1NFRU4jTElFTgpCRVNFVCNTT1JUI0FERE4="},{"title":"1/25/02 APPOSITE OPPOSITES","author":"by Richard Silvestri, edited by Stanley Newman","date":"2002-01-25","grid":"RE9MVCNNRVRBTCNNQVpFCklTSVMjRUxBVEUjRVhJVApQTEVBI01JQ1JPI1NFR0EKU09VUk5PVEhJTkdTIyMjCiMjIyNPUkUjIyNQRUNBTgpMSVRBTlkjRFJFU1NBR0UKRU5BVEUjQVJJQSMjTlJBCkdVSUxUWUJZU1RBTkRFUgpBUlAjI0VMRUUjQ0VMRUIKVEVBTVNURVIjU0hFRURZCkVETkFTIyMjU0hFIyMjIwojIyNSRVFVSVRFRExPVkUKSkFDSyNVTlNFUiNPVkFMCkFHRUUjSURMRVIjRkVTUwpCRUVSI1RPQURZI1RSRUU="},{"title":"1/26/02 SATURDAY STUMPER","author":"by Daniel R. Stark, edited by Stanley Newman","date":"2002-01-26","grid":"U1BBREVTI1JPU0VCT1dMCkNBQkFMQSNBVkVNQVJJQQpBUkFSQVQjR0VOSUFMTFkKUkVTRVQjQkFST04jWUVTClBSRVNJREUjVFJFUyMjIwojIyNTT1VUSCNBTlRIRVIKI0VNQU5BVEVTI1RSSVBFCk9WQUwjTE9STkEjRUxFVgpSRVRBRyNST09NTUFURSMKQUxUQVJTI0RSRUFNIyMjCiMjI01JRU4jRU5DTE9TRQpFS0UjUExPV1MjSElSRVMKUEVUUEVFVkUjVEVORU5TCklOVEVSTkFMI0FURUFTRQpDT0FSU0VTVCNSRURERU4="},{"title":"1/27/02 PLEASE TAKE YOUR SEAT: A number of ways to do so","author":"by Lee Weaver, edited by Stanley Newman","date":"2002-01-27","grid":"Rk9MSyNTS0lUI1RBTUVEIyNMT1NFCk9ESUUjVEFSTyNBVE9ORSNQT1JUUwpQRVBFTEVQRVcjU1RPT0xQSUdFT04KIyMjUEVSVSNTQVRJTlMjUkVHQUxFCiNBQlNFTlQjI0ZJUlMjU0VDRURFIwpDUkVBS1MjUFVSRUUjU1BFRUQjIyMKT0lOS1MjQk9ORVIjI1RJTlMjQ0RTCkxBQ0UjU0FSSVMjU1dPUkUjQ09BVApBU0gjVEFLRVRIRUNIQUlSI1JVTkUKIyNXQVJQRUQjI1JBSVRUI01FQ0NBClNIQVZFIyMjQ1JBTVAjIyNSRUhFTQpFRVJJRSNSSEVBUyMjT0ZIRUxQIyMKTElNQSNMT1VOR0VMSVpBUkQjT1JCCkVERU4jQVVOVFMjSUNPTlMjU1RJUgpTSVIjUlVTVCMjUExBTlMjU0NBTEUKIyMjTUFORVMjUEFJTkUjQ0FSVEVSCiNTVEFORFMjR09SRSMjUEVSSU9EIwpTT0FSRVIjVkFMSVNFI0lNQU0jIyMKVFVSS0VZRElWQU4jREFWRU5QT1JUCkVTVEVTI0FDSU5HI0FWT04jRUxJQQpQQVNUIyNNRU5EUyNNQVRUI0RFQVI="},{"title":"1/28/02 ALL THE BEST","author":"by Sally R. Stein, edited by Stanley Newman","date":"2002-01-28","grid":"U0xBUCNSQVZFUiNPRE9SCkhBSVIjRUxFVkUjU0lSRQpBSURFI1RVTklDI0NBUkwKR1JBREVBTUlMSyNBUklBCiMjI0FMSSMjI0xBUllOWApSRVBUSUxFI1BFUFMjIyMKQUxPRSMjTEVBU0UjVEFQCkZJUlNUQ0xBU1NTRUFUUwpURUUjQlJFVFQjI0NSVFMKIyMjQ0FJTiNBU0tTT1VUCk1PWkFSVCMjI0NPVCMjIwpPTk9SI1RPUEJBTkFOQVMKVEVSSSNFTUFJTCNUT1VUCkVBUk4jUk9VVEUjSU5UTwpTTU9HI1NPTEVTI0NPT1A="},{"title":"1/29/02 FURRY FRIENDS","author":"by Daniel R. Stark, edited by Stanley Newman","date":"2002-01-29","grid":"QkFBRUQjQ0JFUiNPR0xFCkFNQkxFI0xJRU4jUkVFTApSQUJCSVRFQVJTI0lURU0KVEhFQVRFUlMjI0RFU0tTCiMjIyNJTksjUFJBTksjIwpIQVBQRU4jUVVBTlRVTSMKQVhMRVMjWVVSVFMjTlVUCkxFQVAjTk9JU0UjT0tSQQpGTFkjQUNVVEUjU1dFQVIKI1NQSVJBTFMjSEFORExFCiMjT05FQUwjUEVUIyMjIwpIQVNUQSMjRFJBSU5BR0UKQUxTTyNTUVVJUlJFTExZCkZBVU4jQVVLUyNFQVRFUgpUSU1FI1BPRU0jU1RPTkU="},{"title":"1/30/02 DUDS","author":"by Fred Piscop, edited by Stanley Newman","date":"2002-01-30","grid":"VE9BRFMjQUdFRCMjQ0FUCkFOVElDI0xPTEEjQ09MRQpDT1RUT05CRUxUI0lST04KVFJVU1RFRVMjQURWRU5UCiMjIyNUT04jIyNBSURFUwpSQUlTSU4jQkVSWUwjIyMKQUxHQUUjREVOWSNTQUtTCklET0wjQ1VSSUUjVU5JVApMQVJBI0lDRUQjUElOVEEKIyMjUkhFVFQjTEFURUVOClRBTllBIyMjQkFSIyMjIwpPUkFDTEUjR0FNRVNURVIKRElWQSNHQVJERU5IT1NFCkRFRVAjR0xFRSNURU5TRQpZU0wjI1lBV04jU1BPT0s="},{"title":"1/31/02 THE CYCLE","author":"by Merle Baker, edited by Stanley Newman","date":"2002-01-31","grid":"RVZJQ1QjUE9MUyNKQU1TClZFREFZI09QSUUjRUNPTApFWEFTUEVSQVRFI05BTUUKIyMjU0lOR0xFTUlOREVECk9SVCNDT1kjIyNEWUlORwpET1JJQSMjSFlQRSNBVEUKRE9VQkxFREVBTEVSIyMjClNNRUUjUklMTEUjSVNUTwojIyNUUklQTEVERUNLRVIKUkNBI0VTU08jI0xPWUFMCkVMSVpBIyMjRkFZI0VMWQpIT01FUlBBUlJJU0gjIyMKSVNJUyNTUVVBUkVBV0FZClJFTlQjU1VJVCNFTElTRQpFREdZI1RBTlMjU0VUVVA="},{"title":"2/01/02 MOSS-HAPPY FELLA","author":"by Bob Lubbers, edited by Stanley Newman","date":"2002-02-01","grid":"UFJFI0hPUlNUI1BBQ0VTCkVFUiNFTUVFUiNBREFNRQpFVkUjTUVERUEjU09MRUQKTElDSEVOT1JOT1QjRVJBCkVMVE9OIyMjQ1VFI05BVApSRVNUI1RBTUVSI0lETEUKIyMjI1JBTUEjI1NDQURTCiMjRlVOR0lKVU1QRVIjIwpUSEFUUyMjT0tSQSMjIyMKUkFSRSNBUFJFUyNBUlRTCkFOQyNFTEkjIyNCTEVFUApNREkjVElOUEFOQUxHQUUKUElDVE8jTkFNRVMjQVJFCkxFQVJOI0VSQVNFI0xFRApFUkxFUyNERU5UUyNFRFM="},{"title":"2/02/02 SATURDAY STUMPER","author":"by S.N., edited by Stanley Newman","date":"2002-02-02","grid":"IyMjU1VQRVJFR09TIyMjCiMjTU9ORVlNQVJLRVQjIwojSEFJUlJFU1RPUkVSUyMKQ0FSTElOIyMjREFSSVVTCkhTVCNQT0xBUklTI0NQSQpPVElTI0RBTU9OI0hFRUQKQ0FOT0UjTU1FI0JBUlJFCk9NQVJSI0JPRCNBTUFTUwpMQUhUSSNFTkUjUkVUT1cKQU5JUyNCUklFUyNMT05JClRBTiNFQVRDUk9XI1BJVApFTkdFTFMjIyNCQVVTQ0gKI0FJUk1BVFRSRVNTRVMjCiMjU1RBTEFDVElURVMjIwojIyNFTlRSVVNURUQjIyM="},{"title":"2/03/02 SEESAW: Exploring various highs and lows","author":"by Robert H. Wolfe, edited by Stanley Newman","date":"2002-02-03","grid":"Qk9TQyNQRUVSI1NLQVRFUyNHRVJFCk9NTkkjTFVCRSNDQUJBTEEjQU1JRApOT09OI0FST04jVVBBTkRDT01JTkcKRE9XTk9OT05FU0xVQ0sjI1BVTFNFCiMjUEFURVMjR0VMVCMjRkFUVElFUgpDQUxNRVIjREFJUyNTQUxUI1NPRFMKQVBPT1IjUEFEUyNSRUJBVEUjIyMjCkRPV05JTlRIRU1PVVRII0lOU0VDVApFRFMjI0lMTFMjVVBUT1NDUkFUQ0gKIyMjSVJBIyMjU1RFRVJTI0FCT1ZFClNOQVJFI1NDQVQjUkVTVCNHRU5JRQpQT1JFUyNMQUJSQVQjIyNBRVIjIyMKVVBPTkVTQUxMRVkjSVNQWSMjU09VClJFREVFTSNET1dOSU5USEVEVU1QUwojIyMjREVMRU9OI09KQUkjRU5BVEUKQkVUUyNXQVJNI1NOVUIjU0FOVE9TCkVMSVRJU00jI09VSVMjT0NURVQjIwpNT1JBTiMjRE9XTkFUVEhFSEVFTFMKVVBBTkRBUk9VTkQjSVJBTiNEUklQClNFTkQjTEVTU0VSI0NBUlQjRUVSTwpFUkVTI1BPRVRSWSNFWUVTI0RSQVQ="},{"title":"2/04/02 SQUARE DEAL","author":"by Shirley Soloway, edited by Stanley Newman","date":"2002-02-04","grid":"U1RBTVAjUEFMUyNBQkNTClRBTElBI09SRUwjRkxBVApBUkVOVCNPTEVPI1RPTkUKQk9YRVJTSE9SVFMjQ09FCiMjI1JPRSMjU0hPQ0tFUgojU0NBTkRBTCNTTEFQIyMKRk9VTCNFREFNI0VOQUNUCk9SQiNGUkFNRVJTI1JFQQpHRUVTRSNNQU5BI1NUT1AKIyNTRVRTI1NVTkRBWVMjClNBVEVFTlMjI1VSTiMjIwpBREUjRElDRURQT1RBVE8KVkVBTCNET0xFI1BBR0FOCkVMS0UjRVBJQyNJTkFORQpSRVNUI1JFRUsjTkFSS1M="},{"title":"2/05/02 OH BOY","author":"by Sally R. Stein, edited by Stanley Newman","date":"2002-02-05","grid":"TU9BVCNBVkVSI1JBSkFICkVSR08jRElNRSNXSE9TRQpDTE9HI0pBSUwjQVNIRVIKQ09OQU5PQlJJRU4jTkFCCkFOWSNBSUwjQVVESU8jIwojIyNESU5FI0JSQVNIRVIKRVJST0wjI1BMTyNSQVZFCktBWU8jQ0FTRVMjQVJFQQpFR0FEI0hJVCMjUEVBUkwKU0VOQVRPUiNWSU9MIyMjCiMjT0RPUlMjSVJFI0NBVApFT04jUEVURVJPVE9PTEUKQkxFRVAjUkFJTiNMVUdFCkJMQVJFI0lTTEUjRUxBTgpTQUxBRCNQRUVSI09ERVM="},{"title":"2/06/02 YOU'RE THE ONE","author":"by Fred Piscop, edited by Stanley Newman","date":"2002-02-06","grid":"RFVNUFMjU0xBUCMjQ09NCklOVUlUI1RPUkkjU09ITwpBVE9ORSNBTk5FI0lCQVIKTE9ORVJBTkdFUiNOT1JBCiMjIyNJTksjI1JBR0xBTgpCRUhPTEQjUVVFTEwjIyMKT1ZJTkUjUFVOI1RFU0xBClBJTEwjI0xBSSMjVEVBUgpQTE9ZUyNBQ1QjQ09ORE8KIyMjQ0hVTksjUkVOVEVECkFOQ0hPUiMjTUVMIyMjIwpEQUxJI1NPTE9GTElHSFQKT1BFTCNVUklTI0FETEFJClJFQUQjTEFNRSNSRUVWRQpFU1QjI0FMQVMjU0FORVI="},{"title":"2/07/02 WING IT","author":"by Daniel R. Stark, edited by Stanley Newman","date":"2002-02-07","grid":"U0FMU0EjVFJBTSNXRUxMCk9SSU9OI1dPUkUjQVJJQQpCRUVGWSNJQUdPI0lOTlMKI0FTVEhFQ1JPV0ZMSUVTCiMjI0JPREUjIyNMRUVSIwpTVFJBV1MjQlJPT0QjIyMKUEhJTCMjUFJJT1IjU0hFCkVBVExJS0VBU1BBUlJPVwpETkEjQ0FSTkUjI0VUUkUKIyMjTUlORUQjUEVDQU5TCiNSQUlOIyMjQkFDSCMjIwpXSUxER09PU0VDSEFTRSMKQVZPVyNLRUVMI09SQVRFCkxFTkEjUklMTCNFR0dPTgpUUkVZI0FMTFkjREVBTlM="},{"title":"2/08/02 SEE 39 ACROSS","author":"by Robert H. Wolfe, edited by Stanley Newman","date":"2002-02-08","grid":"QVZPV0VEIyNBUkQjTEVUClJJVklFUkEjUEVFVklTSApTUEFSUk9XI0VMTElQU0UKIyMjWU9XTCNSQUhTIyMjClNUVSMjTkFII1BJRVRBUwpDQU5BTCNUQVBTI1NBQ0sKRENMWEkjT0dMRSNRVUFZCiNUT09MSU5HQVJPVU5EIwpESUFOI1NDQU4jV0FURVIKT0xERSNDRVJFI0VERU1BCkNFU1NOQSNEVFMjI1JFTQojIyNBRVJPI0FQRUcjIyMKU0FOR1JJQSNMSUdBVEVTClBSQUVUT1IjS05PV0FMTApBUFQjU1RTIyNFU0tJTU8="},{"title":"2/09/02 SATURDAY STUMPER","author":"by S.N., edited by Stanley Newman","date":"2002-02-09","grid":"TEVDQVJSRSNUQVRUTEVSCkFJUkhFQUQjQVZFUkFHRQpQUk9TSU5HI0tBTkFLQVMKU0VDT05EQU1FTkRNRU5UCiMjIyNBUlJFU1RTIyMjIwpXSElSIyNMU1QjI0FBUkUKRUFSQUNIRSNIVU5UTEVZCklWQU5IT0UjRU1BSUxFRApSRVFVSUVNI1BBSExBVkkKRFJJUCMjQUlMIyNUSEVFCiMjIyNHQVNDQVBTIyMjIwpTRUNVUklUWUNPVU5DSUwKVUxBTFVNRSNFTlBMQU5FClBMQU5ORVIjT0NUQUdPTgpTRU5BVEVTI0ZBU1RFTlM="},{"title":"2/10/02 LETTERS FROM HOMER: Alphabetic wordplay","author":"by Bob Lubbers, edited by Stanley Newman","date":"2002-02-10","grid":"UkVEQ0FQI0JFQU5TIyNQU1QjV1dJCk9UT09MRSNJU1NFSSMjRVRPI0hPQwpUSE9NQVNBTFBIQUVESVNPTiNBUkUKSEVOI05PRUwjI1RST04jUkVTVEVEClNMRUQjI1JPSyNFUlJTI0FERVMjIwojIyNBU1hJV0FTU0FZSU5HI1NOQVAKTUFZUE9MRSNQRVQjI0RFRSNTVU1PCkFMT0hBUyNTUEEjT0dFRSNXSVBFUwpOT1VOUyMjSEFORENBUiNHUk9VU0UKT05aRSNCT0FDI0lBTSNDT0lOUyMjClJFRSNUSUEjQ0hBU00jRUFUI1NTUgojI1RBSU5UI0lPTiNBQkVUI0JZVEUKU0NBTERTI0FOU0VMTU8jI0ZBQ0lBCkNPTUZZI0RVT1MjRU9OI0RPTkFMRApBUk9PI1NJRyMjU0FTI1NFQVRUTEUKTkVVTiNUQVVPTlRIRUFJU0xFIyMjCiMjVFNBUiNTUFVSI1NVRCMjUkVQUwpBVEhPTUUjVEFNQSMjVFJJTyNMRUEKUkVGI0JFVEFMQVRFVEhBTk5FVkVSCkVBVSNFVEEjI05VRVZPI0dFTkVWQQpBTEwjUlNUIyNTTUVBUiNFUkFTRVM="},{"title":"2/11/02 FORE AND AFT","author":"by Norma Steinberg, edited by Stanley Newman","date":"2002-02-11","grid":"U0NBTEUjTE9PVCMjQURBCkVMR0lOI0lOQ0gjS05PVwpUSU5UUyNOT1RFI1JPVkUKSU1FVCNNRVIjTU9BTkVECk5FV0xFQUYjRE9STSMjIwojIyNFUkdPI0FOR0VMSUMKQURPQkUjUkFZRSNSRURPClZBUlkjQUxMQVkjVkFMRQpFVklMI01JRkYjQVNLRUQKUkVHSU1FTiNUSUNLIyMjCiMjI1RJTkUjRVZFUkVTVApDT05UUkEjV1JZI0FMVE8KT1BBTCNCUkFEI0FNTUFOCkxJTUUjTEVOQSNQRUVWRQpURUUjI0VERFkjRVJSRUQ="},{"title":"2/12/02 AS YOU LIKE IT","author":"by S.N., edited by Stanley Newman","date":"2002-02-12","grid":"VEFQUyNBTU1PI0FMT1QjClJVU0gjUEFJTCNMT0dFIwpJVFNPVVJQTEVBU1VSRSMKTU9UT1IjTEVPTiNERU4jCiMjI1RBUEUjU1RZIyMjIwpBTVQjTEFMQSNTQUhBUkEKVkFSWSNMRU5PI0xBTkVTCk9OSU9OU0FORFJFTElTSApJTkFXRSNGSURPI0VUVEUKREFMTEFTI0VDT04jQVNTCiMjIyNUT1AjT01JVCMjIwojV0hZI09BSFUjTE9TRVMKI0hFQVJUWUFQUEVUSVRFCiNJUk1BI1VSTFMjRUxBTAojWkVTVCNQSUVTI1NPU0E="},{"title":"2/13/02 LAST OF ALL","author":"by Fred Piscop, edited by Stanley Newman","date":"2002-02-13","grid":"UEFDRVIjRUJCUyNTQUtFCkFMT05FI1ZFUlQjTFVOQQpQRUFDRSNFUklFI0VESVQKI0NMT1NJTkdDUkVESVRTCiMjI0RFTiMjS0VBIyMjIwpNQUxFI0RBRyNPUkRFQUwKT0lMI0JFR0FUI0xPUkRZCk9SQUxFWEFNSU5BVElPTgpMRU1PTiNSRVRJUCNDVUQKQVJBTUlTI1NPWCNTQVRFCiMjIyNURU0jI09PUCMjIwpOQVRJT05BTEFOVEhFTSMKSVZBTiNUUk9OI1RFTk9SCk5JQ0sjSUNPTiNFUk9ERQpBU0hZI05PTk8jUkVTRVQ="},{"title":"2/14/02 WORDS FOR TODAY","author":"by Lee Weaver, edited by Stanley Newman","date":"2002-02-14","grid":"RkFDVCMjUExVUyMjTlJBCkVST1MjQlJBU0gjVUZPUwpMSU1FI0xPVkVBUFBMRVMKVEVFVEhFI0FSUkFTIyMjCiNTVVNJRSMjU1BSVUNFIwojI1BFUFBFUiNTVFJBVEEKVEFSI1NFREVSIyNHTlVTClNMT1cjRElWRVIjRUREQQpQT1NIIyNUVU5FUiNZRU4KU0hFSUxBI0VER0VSUyMjCiNBU1NFU1MjI0FCQVRFIwojIyNLSVRUWSNUQVJSRUQKSEFWRUFIRUFSVCNFSVJFClNUQVIjTUFMVEEjU1BJTgpURU4jI0FNRVMjI1RFRVM="},{"title":"2/15/02 SPREAD IT AROUND","author":"by Randolph Ross, edited by Stanley Newman","date":"2002-02-15","grid":"U0NBTExPUCNBQkFORE9OCk5PUklFR0EjUkVDRUlWRQpBTklNQUxQUkVTRVJWRVMKUElFI0RFUE9ORSNESVJUCk9DVE8jIyNUQVRBI0RERQpOQVRMI0VHTyMjRlJFVUQKI0xBRFlNQVJNQUxBREUjCiMjI0hBSUcjSU1BTSMjIwojSU5BVFJBRkZJQ0pBTSMKRU1PVEUjI0lGUyNFVkVTCk1PRCNTSEFEIyMjVElMVApBR1VFI09MRUZJTiNBUkkKSkVMTFlST0xMTU9SVE9OCk9ORUxFU1MjSU5BTkVTVApSRVNFTlRTI1BPTUFERVM="},{"title":"2/16/02 SATURDAY STUMPER","author":"by Daniel R. Stark, edited by Stanley Newman","date":"2002-02-16","grid":"I1BFU1RFUiNDQUJCQUdFCkNFTlRBVk8jQVJSSVZBTApSRVRZUEVTI1JFQVJFTkQKRVZFI0VMSSNMQVZFUk5FCk1JTkVSI0VNUyNPVFRFUgpFU1RBI0FSQUJTI1RFVFMKU0hFUkRTI1dBTlRBRFMjCiMjIyNBSEEjRE9OIyMjIwojTEFDVE9TRSNPVEVMTE8KR0FUTyNUU0tFRCNNSUVOCkFUTEFTI0VFTCNUVU5BUwpMRUFTSEVTI1VURSNFUkUKTEVOVElMUyNET1JNQU5UCk9OVEFSSU8jRU5SQUdFUwpQU0FMVEVSI0RJQUxFRCM="},{"title":"2/17/02 PENN. NAMES: Penn. Ave., to be specific","author":"by Patrick Jordan, edited by Stanley Newman","date":"2002-02-17","grid":"SU5DQSNCQUxLSSNNQURBTSNBSkFYClJPT1QjQVJJRVMjSVJBVEUjTEFDRQpBUlRIVVJDT05BTkRPWUxFI0lDRUQKIyMjTFRHRU4jRE9ET1MjVFJFSyMjCldBS0VORUQjQ09XTCMjVFdJTlNFVApFTElURSMjTUFSSUUjU05JUCNPTkUKREVNSSNUUlVNQU5DQVBPVEUjTllFCiMjI0NBUk9MRSMjI1NFVEgjTUJBUwpBU1AjVEFZTE9SREFZTkUjQkFSIyMKTU9JI0VWQVMjT1dORUQjUk9UT1JTClBSRVZBSUwjI01FRyMjQkVMVFdBWQpTVFJFU1MjRElBTFMjT0lTRSNOSU4KIyNDRUUjR1JBTlRUSU5LRVIjRU5DClNURVAjQkFVTSMjI1NURU5PUyMjIwpMT0IjSEFSUklTT05GT1JEI0hBUkUKT1VSI0FDUlkjQUxPT1AjI0xFR0FMClRST1RTS1kjI0JFT1IjTUVBRE9XUwojI1NFVEEjQUNSSUQjTUFNSUUjIyMKWk9ORSNXQVNISU5HVE9OSVJWSU5HCkFEQU0jQUdBSU4jRUFURVIjSURFQQpQRU5TI1lFTlRBI1NQT1RTI0xPV1M="},{"title":"2/18/02 RIVER CITIES","author":"by Sally R. Stein, edited by Stanley Newman","date":"2002-02-18","grid":"Q0FMTVMjQkVFI09HTEVECkNMT0NLI0VMTCNDTE9WRQpMQU5TSU5HTUlDSElHQU4KSU5HI01PT1MjQVJORVNTCiMjSkFQQU4jQlJFRCMjIwpCTFVSI0hFQVJEI0FCQ1MKQUlNRUQjI0JBSUwjUlVFClNUUEFVTE1JTk5FU09UQQpURUUjREVFRCMjU0NPVVQKRVJSUyNTRUVEUyNBTVBTCiMjI1RBU0sjUkVTVFMjIwpTQVZBR0UjUEFDVCNUSUUKQ0hFWUVOTkVXWU9NSU5HCkFTVEVSI0FURSNNQUNSTwpNT09EUyNQRVIjUE9LRVM="},{"title":"2/19/02 AT THE BUTCHER","author":"by Shirley Soloway, edited by Stanley Newman","date":"2002-02-19","grid":"TE9TRVIjI0hJUkUjTElMCkFOSVNFI1NPV0VSI0lWRQpNVVRUT05DSE9QUyNWQU4KQVNFQSNPT08jQVRURU5ECiMjI0JFRUZTVVAjVVJBTApQRVAjQUxGI1BFUlJZIyMKU05PT1RTI1NUUkVUQ0gjClRPUlRFI01JTyNDTEFJTQojU0tJUlJFRCNGRUVCTEUKIyNQT1NFUyNBTEQjU1RBCkFTSVMjSEFNTUlFUiMjIwpDSEVFU0UjQUlSI09ERVMKUkFII0xBTUJFVEhXQUxLCkVSQSNBUklFTCNTRU5TRQpTSVQjTURYTCMjVFJFQUQ="},{"title":"2/20/02 COME ON DOWN","author":"by Patrick Jordan, edited by Stanley Newman","date":"2002-02-20","grid":"UlVTRSNNQUpPUiNTTEVXCk9LQVkjQUJBVEUjVEFYSQpCRU5FQVRIQ09OVEVNUFQKRVNRI1NUT0tFI09SRU9TCiMjVVNIRVIjI0dVTiMjIwpTS0VXRVIjVFJBUCNPUkIKQU5OQSMjTk9JU0UjVklFCkhJVEJFTE9XVEhFQkVMVApJRkkjTE9QRVojI09SRVMKQkVOI0RPRVIjQ0xBU1NZCiMjI1NFVCMjRkFJVEgjIwpFUElDUyNBREFHRSNBQkUKTElHSFRBRklSRVVOREVSCktOT1cjU0FORVIjSU9UQQpPS1JBI1BST0RTI1RXQVM="},{"title":"2/21/02 TIEBREAKERS","author":"by Merle Baker, edited by Stanley Newman","date":"2002-02-21","grid":"SUFNQiNUQVNTRUwjT1RCClNFTUlNT05USExZI1BFQQpPUkVHT05UUkFJTCNFTkQKIyMjT1RPRSNTVEVSTlVNCkVNT1RFI05PVEUjSElSRQpSRUZTI0FOTkEjTElORU4KR1JGI0FDQVQjUklORyMjCk9WRU5USEVSTU9NRVRFUgojI1JJVEUjSU9UQSNJU1UKSkVUVFkjTUFUUyNJTVBTCkFTSEUjUE9MSSNBTkVZRQpTVEFSS0VSI09BRlMjIyMKUEVOI09DRUFOVFJBVkVMCkVFSyNQQU5ERU1PTklVTQpSTVMjU05PT0RTI0VBUk4="},{"title":"2/22/02 CRITIC'S CHOICE","author":"by Lee Weaver, edited by Stanley Newman","date":"2002-02-22","grid":"TkFCT0IjRUxMQSNBQ0VECkFHSUxFI05FQVAjUE9MQQpHT09EQURWSUNFI09NRU4KIyMjI05PSVNFI0VMQkEjCiNBRE1JUkUjI09OTElORQojVE9SRUFERVJTRE9OT1QKI1ZFVCMjI1lBTEUjRVJBCiMjIyNERU1JR09EIyMjIwpQQVIjSU1BTiMjI0JSTyMKRVZFUkpVREdFQUJPT0sjClJPTUVPUyMjTElMQUNTIwojQ09STiNQUklNQSMjIyMKSEFWRSNCWUlUU01PVklFCk9ERUEjRUxMRSNFRElUUwpXT1JEI0VFTFMjREVOVFM="},{"title":"2/23/02 SATURDAY STUMPER","author":"by S.N., edited by Stanley Newman","date":"2002-02-23","grid":"QUNUUkVTUyNKT0lOREVSCkJVUlVOREkjRU5ET1JTRQpFUklTVElDI0FUT01JU1QKTEFORVMjS0VOI0xFVkVSCkFDSVMjVEVTTEEjTkVORQpSQVQjSk9OUVVJTCNSQ0EKRE9SU0VZUyNDUkVBU0VECiMjT1VUUyMjI0NBUkwjIwpDQVRCRVJUI1dPUktJTkcKUklPI1NVQVNJT04jQ0VFCklMTFMjU0tJTEwjRkVBUgpTTVVUUyNFREQjR0VOUkUKUEVFUlNBVCNDT0FSU0VOClVOTkVSVkUjQVJNUkVTVApTVEVQU0lOI1RZUElTVFM="},{"title":"2/24/02 LITERALLY SPEAKING: A second look at familiar phrases","author":"by Daniel R. Stark, edited by Stanley Newman","date":"2002-02-24","grid":"RkFDVCNTTEFXI0NBTVBFRCNCTEFCCkFMTEEjSE9TRSNBWkFMRUEjUkFSRQpDT09LQk9PS1MjQk9YRVJTSE9SVFMKRU5WSVJPTlMjTUFSSUEjI09LQVlTCiNHRU5JRVMjQk9ORVMjQUxUQSMjIwojIyNHQUQjQ09MQVMjRlJFRVdJTEwKU1RBSVIjUExPVFMjVFJJQUwjTkVFCktBSE4jR0xFTlMjQ1JJRVMjU0FWRQpJUkUjV0FJRlMjR1JBU1NIT1BQRVIKUEFNUEhMRVQjU0hFSUsjI0xJVEVTCiMjI0xBU1MjRkxPV04jU0VMTCMjIwpORVBBTCMjU0VVU1MjTUVEQUxJU1QKQUNVVEVBQ0NFTlQjVEVFTlMjUkFZCk1PS08jQ0hBTEsjUE9MS0EjUklOSwpJTEsjU1RVTlMjVklORVMjUE9TU0UKQkVBUkhVR1MjSElOR0UjRU9TIyMjCiMjI0hJUFMjRkFSRVMjQVJSRVNUIwpJQlNFTiMjQk9OVVMjVFJVRUJMVUUKQ1JPU1NTV09SRFMjSlVNUFNVSVRTCkJBQlUjVEFDS0xFI0FCRVQjU0NPVApNRVNTI0VSQVNFUyNCRURTI0hFUkE="},{"title":"2/25/02 WEARABLES","author":"by Daniel R. Stark, edited by Stanley Newman","date":"2002-02-25","grid":"QU5ORSNNQVBTI0FIQUIjClJFQUwjQUxBTiNMT0JFIwpBSURFI01JREkjQ1JBVkUKQkxBQ0tCRUxUI0FTVEVSCiMjIyNOT05PIyNQRUVMUwpBUklTRSNTQ1JBUFMjIyMKQ0FST0xTI0tBWSNISUxUCkVOQUNURUQjR0VUT1ZFUgpTSU5LI01BUiNTSEVFTkEKIyMjSVJJU0VTI0FTU0FZCkZPUlRFIyNQRU9OIyMjIwpFTUlUUyNTTEFDS1NPRkYKRElWT1QjUElTQSNFTExFCiNUQU1FI0VDT0wjTkVBUgojU0xFRCNEQU5BI0RPV04="},{"title":"2/26/02 GOOD BREEDING","author":"by Sally R. Stein, edited by Stanley Newman","date":"2002-02-26","grid":"U0lOQ0UjQ0FSQVQjTE9BCkNMRUFOI0FMRVBII0FMSQpBSVJFREFMRVRFUlJJRVIKVEVEUyNGTEVBI0VVUk9TCiMjI0FDVFMjSUNFUyMjIwpTUEFSRSNGQUxBI1RST1QKRVJSI0RPT1IjSU5MT1ZFCkdPTERFTlJFVFJJRVZFUgpBVkVSU0UjTk9PTiNFTlMKTEVOQSNBU0FQI0pFU1NFCiMjI01JTUkjQkVBTiMjIwpDU1BBTiNHT1JFI0FCRUwKQUxBU0tBTk1BTEFNVVRFCkxFSSNFVkFOUyNNRVJDSQpGRFIjREVMSVMjQUxQSEE="},{"title":"2/27/02 WATCH IT","author":"by Fred Piscop, edited by Stanley Newman","date":"2002-02-27","grid":"R0FFTFMjR1JVTVAjQk9PCkFMTElFI0xPUEVSI0xBQgpTVEVNVEhFVElERSNBVEUKSEFNUFRPTlMjU01PS0VTCiMjIyNFT04jIyNJUkVORQpTQ0FSRUQjTUFIRVIjIyMKT0hOTyMjT1VURVIjTUVBCkhBTkRTT0ZGVEhFQkFMTApPUkUjSEFJRkEjI0VNSUwKIyMjQ0FSVFMjR1JFQVNZCkVQU09NIyMjUE9FIyMjIwpCQVRURVIjQ0FSTUFLRVIKRUdPI0ZBQ0VSRUFMSVRZClJFTiNVVElMRSNQSUVUQQpUUlkjTEFETEUjU0VWRU4="},{"title":"2/28/02 PRECIPITOUS","author":"by Merle Baker, edited by Stanley Newman","date":"2002-02-28","grid":"T1pNQSNQQVJTSSNBSFVNCk1PQVQjQVJPQVIjREFOQQpBTExJI1JFVFJPI0pJQlMKUkFJTk9SU0hJTkUjTElUCiMjI0dSSVQjI0JSRUVEUwpBRERMRVMjQk9BVEVEIyMKQ0FSRVMjQkFSUkVMRlVMClRSSSMjU09SVFMjI1JOQQpJTlZFU1RPUlMjSE9PVFMKIyNFU1RBVEUjTUFSTU9UCllBTlFVSSMjU0VUSSMjIwpFTFMjQlJFQUtUSEVJQ0UKTUlORSNXSUxFRSNOTUVYCkVOT1MjQU5HRVIjVFVORQpORVdUI1lFQVRTI1NTVFM="},{"title":"3/01/02 BIRDPLAY","author":"by Patrick Jordan, edited by Stanley Newman","date":"2002-03-01","grid":"U0xFRCNJQ0VSI0FUTEFTClRBWEkjVEhFTyNOQU9NSQpFVkVOI0FJTlQjR0xVRUQKTUFDQVdMQVlDVUxLSU4jCiMjI1JBSU4jI05FU1MjIwpMT0EjTEFHQVNTRSNWSVAKQVJDRUQjI0NIRSNKSVZFClBBUlJPVFBIRVJOQUxJQQpTTE9HI0hPRSMjQUJMRVIKRVNQI01FRERMRVMjRVNTCiMjSEVBVCMjT0xBViMjIwojQ09DS0FUT09ETEVET08KQ0FCTEUjRUFTRSNMRU9OCkJSSUFSI0NIRVIjREFaRQpTRUFUUyNIVU5TI1RSRVM="},{"title":"3/02/02 SATURDAY STUMPER","author":"by S.N., edited by Stanley Newman","date":"2002-03-02","grid":"QkVFRkFMTyNTUEFSUk9XCkFMVE9TQVgjSEVST0lORQpMQU5HVFJZI1JFTEFURVMKSU1BR0lTTSNFVkVSRVNUCiMjIyMjI09HREVOIyMjIwpTQVNTQUZSQVMjRUNMQVQKTUFJTERST1AjQURIRVJFCkFMQlVNRU4jTUNBUkRMRQpTVFlNSUUjUEFUSE9HRU4KSE9MU1QjQ0lWSUxORVNTCiMjIyNUT1JURSMjIyMjIwpNQUdOQVRFI1JBVENIRVQKQVRMQU5UQSNJU1JBRUxJCkNPRVJDRVMjQ0hJTkVTRQpTSU5DRVJFI0tFU1NMRVI="},{"title":"3/03/02 BEAUTY SPOTS: Apt names for salons","author":"by Peter Dart, edited by Stanley Newman","date":"2002-03-03","grid":"REVWSUwjQVJQQSNBU0lBI1VUVEVSCkFSRU5BI0JVUlIjUkhPUyNSSFlNRQpUUkVTU01BTkFHRU1FTlQjU0VSSU4KQVNTSVNJIyNMT1VTRSNFRFVDQVRFCiMjI0RPUyNTSU5HI1RIUklMTCMjIwpBQ1JFI1NPT04jRUxTRSNTQUlMT1IKSEFJUkZPUkNFT05FI0FTSyNQRVJVCkVSQVNVUkUjI0RFU0FERSMjSkFCUwpBVFQjU1RBUExFI1NJRlRTI09SRVMKUEVBQ0UjRFJJTEwjUklTRSNJTkRPCiMjI1VTQSNJTkxBQk9SI0VSTiMjIwpFV0VSI1NBTUUjU0xVU0gjRVRIRVIKVElMTCNQTEVBVCNBVFRBSU4jRUdPClVSRFUjI1NDUkFNUyMjU05BUkxFRApERUVQI0xPVSNDVVRUSU5HTE9PU0UKRVJSQVRBI1RBT1MjQU5URSNPVFRPCiMjI05JQ0VTVCNISVNTI05VTSMjIwpGT05ETEVTI1RFRU5TIyNVTkVTQ08KRVZBREUjU0hFQVJQRVJGRUNUSU9OClNBVFlSI0VPTlMjVUxOQSNBVFRJQwpTTE9FUyNTSURFI1RTQVIjUEVBTEU="},{"title":"3/04/02 SCENIC ROUTE","author":"by Lee Weaver, edited by Stanley Newman","date":"2002-03-04","grid":"TkFQQSMjQVJBQiMjTUlMCk9WQUxTI1JPUEVEI09SRQpWQUxMRVlGT1JHRSNVS0UKIyMjSUxFI0RFRVBFTlMjCiNTTUVMTFMjU1RJTlQjIwpTVEUjU0xVRyNTQ1JBUEUKSVJBUyNPU0xPI1RBSUxTClRPRE8jV0hFTE0jR05BVApBRE9STiNJTkRZI0VESUUKUkVXUkFQI05FU1MjRURTCiMjTEVWRVIjUkVORVdTIwojTUFMQVJJQSNMT1AjIyMKSFVSI0hJTExPRkJFQU5TCkVMSyNPTExJRSNTRURBTgpZRVMjI1NFRVIjI1NFR08="},{"title":"3/05/02 BODY LANGUAGE","author":"by S.N., edited by Stanley Newman","date":"2002-03-05","grid":"VU1QUyNCQVJUI1BBR0VSCkhPTEUjT1JFTyNJWE5BWQpPVkVOI1RJRVIjVEVBU0UKSEVBRFRIRUxJU1QjV0VTCiMjIyNFRUwjI1NBTCMjIwpXRUJCRVIjV0FOTkFCRVMKQVRPUiNFUElDI0NETFhJClNIT1VMREVSVEhFTE9BRApQSUVDRSNMRUlBI0VSTEUKU0NSRUFNRUQjVFZTRVRTCiMjI1NQQSMjQUNFIyMjIwpJWkUjRk9PVFRIRUJJTEwKUkFSRVIjTUlURSNBUklBCkFTVFJPI0VSSUMjSk9ORwpRVUVFRyNORUNLI0FOVFM="},{"title":"3/06/02 STAY CALM","author":"by Fred Piscop, edited by Stanley Newman","date":"2002-03-06","grid":"U0hFQVIjU1RVTiNQRUNTCkhBVlJFI1RPTkkjQVJBVApBTEFSTUNMT0NLI05JUk8KUkVEI09ITyNMT0dJQ0FMClBSRVNUTyNERUxJQ0FURQojIyNIRVJWRSNBTEIjIyMKSE9CTyNESUJTI0xVTkNICkVQSUMjU1RPT0wjVEFSQQpZQU5LUyNBUklFI1RIT1IKIyMjVEVEI0FMQU1PIyMjCk9WRVJBUkNII05PTkZBVApCQUxPTkVZI0hFUyNPTkUKRU5UTyNEUkVBRExPQ0tTCkFDT1AjR0lMVCNFWEFMVApIRU5TI0VMU0UjTVlMRVM="},{"title":"3/07/02 STAYING PUT","author":"by Daniel R. Stark, edited by Stanley Newman","date":"2002-03-07","grid":"TE9BRCNDT0JSQSNEQURBCkFTSUEjQUZPVUwjRVJBUwpDVVJMI1NUQUJMRUJPWVMKIyNGSUNBI1RFU1RUVUJFClBSTyNJQk0jIyNFU1NFUwpPQVIjTkFJQURTIyNFRFMKRU1DRUUjR1JFQVNFIyMjCiNQRVJNQU5FTlRXQVZFIwojIyNTQUxPTlMjSVJBVEUKTEVYIyNJTlRFUk4jTkFZCkFMRVRBIyMjUlVHI0lMRQpXT1JSSUVSUyNTU05TIyMKRklYRURMVU5DSCNVSFVIClVTRVMjU0hJUkUjREVNSQpMRVNTI0FSVElTI0VEQU0="},{"title":"3/08/02 WEATHER OR NOT","author":"by Bob Lubbers, edited by Stanley Newman","date":"2002-03-08","grid":"UEVFUiNJUkFOI0FDVEFTCkVSTEUjTk9MTyNMQVVSQQpSRUlHTkNPQVQjQVJORUwKIyMjVU5JRklFRCNFRE5BCkNBUExFVCMjUk9CRVJUUwpBU0VBI0VBUiNOT1JBIyMKU1RBVFMjUElOVE8jU0FQCkVBU0VMI1NBTyNNQVRURQpTUk8jQU1FTkQjU05PUkUKIyNVTlRPI1RFVCNEUklQCkRFUE9TRUQjI0FST01BUwpJTkZPI1RPUFBMRVIjIyMKQ0xPRFMjQ09BTEZST05UCkVBR0xFI0tFTk8jQUJJRQpSSUdFTCNTVEVXI05JTEU="},{"title":"3/09/02 SATURDAY STUMPER","author":"by Anna Stiga, edited by Stanley Newman","date":"2002-03-09","grid":"QVJSSVZFQVQjRFJFQURTClRPSUxFVFJZI09VVExBWQpUQUJMRUhPUCNXRUFLRU4KSVJBI1JBTUVTRVMjQURPCkNFTEwjTkFTQUwjRUxBTgpBRERFRCNTVU4jREFJTFkKIyMjU0VXI1BUQkFSTlVNClJBU1BJRVIjQUlNTEVTUwpPTkVBQ1RFUiNaT08jIyMKT05DVUUjSEVNI05CQ1RWCkZVTEwjSEFWT0MjRVJJRQpUQVUjTVVCQVJBSyNFTEwKT0xESUVTI01BTklGT0xEClBMRUFUUyNQTEFURUxFVApTWURORVkjU0VMVFpFUlM="},{"title":"3/10/02 UP A TREE: Concerning the world of wood","author":"by Lee Weaver, edited by Stanley Newman","date":"2002-03-10","grid":"U1BBUlMjQ09PTCNTQ1VCQSNBV0VTCkFSUk9XI09ISU8jS0FQVVQjTkFQRQpUSU1CRVJXT0xGI0lSRU5FI0dMRUUKRU5DI0FJTCMjVEFMRU5UI0pPS0VECiNDSEFSTVMjQklMTEVEI0NVUlRTWQpURUFMIyMjREVFUEVOI0pPTkFIIyMKT0xJT1MjQ0FSUk9UU1RJQ0sjRVNTClRZUk9MI0xJRSMjIyNFR08jU1BFQwojIyNGT1JFU1RHUkVFTiMjTU9MQVIKQVBSIyNIQVkjUkVMRVQjSFVNQU5FCkRPT0RMRVIjVElEQUwjQ0FERU5DRQpBTU9FQkEjR0FNVVQjQ09MIyNLRU4KR0FNRVMjI0xVTUJFUkFMT05HIyMjCkVEQU0jVVRFIyMjI0FOTyNBUktJTgpTRU4jQlJBTkNIV0FURVIjQlVFTk8KIyNET0lORyNMT0FORVIjIyNFUklTClJPQk9UUyNQSVNDRVMjQkFMTE9UIwpFUk9ERSNUT01UT00jI1VTTyNTSVQKRElBTCNCUklCRSNPRkZUSEVCRUFNCllPUkUjTVVTRVMjTkVBVCNTQU5UQQpFTkRTI1dFRURTI0VZUkUjU0hFRU4="},{"title":"3/11/02 KID STUFF","author":"by Shirley Soloway, edited by Stanley Newman","date":"2002-03-11","grid":"TUVNTyMjUEFTTyNBTVBTCklSQU4jTUFSVFMjR09SRQpSQVRUTEVUUkFQI09CT0UKI1NISUVSI09LUkEjSU5LCiMjI01JTEtXRUVEI0xFUwpST0JFU09OIyNZQUxFIyMKT0JJIyNUT0dBI01FSFRBClRJQkVUI1RFRCNTV09PTgpIRUxJTyNTT0xEIyNNT0QKIyNJTlNUIyNJUkFURUxZCkVUQyNDUklCQkFHRSMjIwpGQkkjQUlSRSNXRUVQUyMKTE9TUyNCT1RUTEVORUNLCkFOVEUjQU5USVMjU1RBVApURVNUI0xZRVMjI1lFTlM="},{"title":"3/12/02 COMPLETE COLLECTIONS","author":"by Bob Frank, edited by Stanley Newman","date":"2002-03-12","grid":"U1RBTEwjUE9FTSNQSUVSCkNBTk9FI0FTRUEjSU5UTwpBTFRPR0VUSEVSI1BTQVQKUkVTVEFSRUEjU0xFVVRICiMjI0VUQVMjUEhBUk0jIwpMSUJSRSMjUk9BRFNURVIKQU1ZUyMjQklCTEUjT1JPCkdNQSNBTExUT0xEI1RFQwpFSU4jRkVERVgjI0JBQ0sKUkVERkxBR1MjI1NBTFRTCiMjTE9BRFMjQUFIUyMjIwpBV0FJVFMjSVNSQUVMSVMKR0lSTCNPTlRIRVdIT0xFClVSR0UjRkVURSNMSUNJVApFWUVEI0ZPWVMjU1RJRVM="},{"title":"3/13/02 FOLLOW UP","author":"by Fred Piscop, edited by Stanley Newman","date":"2002-03-13","grid":"UkFCQVQjUkFTSCMjUklPCkFMT05FI0FMVEEjRklOSQpUT09ORVNFQVJTI09WQUwKU1RSQVRBI1NBVCNSRU5FCiMjIyNFVkUjREVCQVRFUgpBUkJPUkVBTCNOT1IjIyMKTkVPTiNVU0VSI1BBSUxTCktBTlQjUEVURVMjSVZBTgpBTE9IQSNMVVNUI1NFTUkKIyMjRVNQI1NUQVJFU0FUClNQQVJLTEUjU1RFIyMjIwpBUkNPI0FUQSNJQ0VNQU4KTUlSTyNUSEVBQ0FERU1ZCkJFRUYjVEVSTiNTSVRFUwpBU1MjI0VST1MjVEVBU0U="},{"title":"3/14/02 FAMILIAR FELLOWS","author":"by Daniel R. Stark, edited by Stanley Newman","date":"2002-03-14","grid":"UExBSVQjQ0FSTCNBV0FZClJPVE9SI09CSUUjTElNQQpBUlROT1VWRUFVI1BMT1AKTUlOU1RSRUwjI1NJTEtTCiMjIyNUTlQjTE9PTlkjIwpGQUJMRVMjVkVSQkVOQSMKSVZJRUQjRUFWRVMjSUtFCkRBTEUjTUFMRVMjU0xJRApPSUwjT1VURVIjTk9MVEUKI0xPQ0FMRVMjQlVOWUFOCiMjRkFLRVIjUkFNIyMjIwpXQUZUUyMjQ0FMRU5EQVIKSVJBTiNDSFVDS1JPQVNUClRBUkEjRElSRSNBTk5JRQpTVEVQI1NFRUQjTEVBTlM="},{"title":"3/15/02 FRY DAY","author":"by S.N., edited by Stanley Newman","date":"2002-03-15","grid":"Q09CI1RSSUJFI0FUTEFTCkhNTyNIVU1JRCNMSEFTQQpBQUEjQU1QRUQjQUlNQVQKU0hSSU1QT05JT05TIyMjCk1BU1NFVVIjRU5BQkxFUwojIyNBU1NUUyNTTEVJR0gKTUFNQSMjQUFIRUQjTVJJCkNISUNLRU5QT1RBVE9FUwpHRU0jRUFUSU4jI0VTVEgKRU1JTEVTI0RPUkVOIyMjCkVTQ0FQRUUjUkVWT0xWRQojIyNDQUxBTUFSSVJJQ0UKQkVSRVQjU0lSRU4jTkhMCkVOTlVJI0VOSUFDI0RJRQpBREFQVCNTSEFERSNBUFI="},{"title":"3/16/02 SATURDAY STUMPER","author":"by Randolph Ross, edited by Stanley Newman","date":"2002-03-16","grid":"Q1JJTUVTQ0VORSNBUlRFCkFVRElUSU9ORUQjTEVIUgpTVEFOREFORERFTElWRVIKQVNTVCNNQU8jTklORVJTCiMjIyNERU5DSCNERUxJIwpTQ09QRVMjUkFXI1NBVkUKTE9WRU1FI0lCQVIjVElBCkFNRVJJQ0FOU1RVRElFUwpOUFIjVEFSRSNFTkNPUkUKVEFDSCNUQUcjUkVJTkFTCiNDSElBI0JMT0NTIyMjIwpTVEFOQ0gjQVBPI0lOU1QKTk9SVEhFUk5DTElNQVRFClVSR0UjQVVESU9UQVBFUwpCU0VEI0RFU1RST1lFUlM="},{"title":"3/17/02 CLOTHES TO YOU: What certain people should be wearing","author":"by Fred Piscop, edited by Stanley Newman","date":"2002-03-17","grid":"UkVTT0QjU1BJQ0VTI1NFTU9MSU5BCkVSSVNBI1BBTkFNQSNBUk9NQVRJQwpGUkVVRElBTlNMSVAjTElOSU1FTlQKSU9OI0FTU0VUIyNQTEFDQVRFIyMjClRSQVZJUyNMSU5TRUVEIyMjUkVOVAojIyNBU0VBI05FRURJI0NQVSNBQUEKQkxBU1RJTkdDQVAjRlVFTFBVTVBTClJBWkVTI0dFVFJJRCNST09GVE9QUwpBUlRTI0FMRSMjQVJBQlMjTElOWSMKRFVFI0FMSSNNQVNBTEEjUE9MIyMjClNFQ09ORENPQVQjV0lORE9XU0FTSAojIyNUQU8jTVVUQU5UI0lOUyNUQUUKI1dIRVQjUEFMSU4jI1VORCNTSVJTClNFQVJPQklOI0NPSEVSRSNDT0xEUwpDSVZJTFNVSVQjUkFJTFJPQURUSUUKQUdSI0VTUyNBREFSTiNPS0xBIyMjClRIRU8jIyNZT1JLSVNUI0FMU0FDRQojIyNBUFBFQVNFIyNURU1QRSNUQVMKU0VOVElFTlQjQVNURVJPSURCRUxUCkFMSUVOQVRFI01BT0lTVCNPTElWRQpMTEFORVJPUyNTT05ORVQjTk9ORVM="},{"title":"3/18/02 IN THE MAIL","author":"by Lee Weaver, edited by Stanley Newman","date":"2002-03-18","grid":"U0NPT1QjQUxBUyMjQ0FUCkFMSUJJI1RBTVBBI0hVTQpGSUxMVEhFQklMTCNFVEEKRVBTSUxPTiNTSUxJQ09OCiMjI0dJTiMjU1RPUksjIwojSVJFTklDIyNTVEFQTEUKQVRFI0dOT01FI1NUT09QClJBUFQjR1JJUFMjRUlSRQpGTE9PRCNQUklDRSNOTkUKU09SVEVEIyNDSEFTVEUjCiMjVEFQRUQjI09SRSMjIwpDWUNMT05FI0NPTlRPUlQKQk9BI1RPVEhFTEVUVEVSCkVSUiNTVEVBRCNTRUlORQpSRUQjI0VSTEUjVEVTVFk="},{"title":"3/19/02 WHAT'S A NOUN?","author":"by Merle Baker, edited by Stanley Newman","date":"2002-03-19","grid":"QlVTWSNFRE9NI0ZFUkFMCkFMVE8jTEFSQSNMQVVSQQpCRUFVVElGVUxQRVJTT04KWUVOI1dPTyNUVVgjU0FECiMjRElFVEVEI1JPR0VSUwpPUFVTRVMjV0hFUkUjIyMKTEFQQVojTEFPUyNURUFSCklOVEhFRklSU1RQTEFDRQpPVE9FI09GRlMjTE9SUkUKIyMjQUdSRUUjVEFTVEVEClRPUERPRyNET1dJVEgjIwpPVkEjQkVFI1RFTiNSRUEKV0FTSlVTVFRIRVRISU5HCkVUSE9TI0NVRUQjQVNZRQpMRUFTVCNIRVJTI01FQUQ="},{"title":"3/20/02 FOUR-LEGGED FRIENDS","author":"by Daniel R. Stark, edited by Stanley Newman","date":"2002-03-20","grid":"U0FTSCNBUkNII0FDQ1QjCklOQ0EjTkVSTyNUQUxPTgpHTkFUI0lET0wjRVRBR0UKSE9SU0VTSE9FI0FTSUFOCiMjIyNORU9OIyNTQ1JFRQpCTEFTVCNURU5TRVIjIyMKUklDSEVSI1JJUCNBTEVFCkFMVEVSRUQjQklERElFUwpOWVNFI0VFTCNUSUxBS1MKIyMjUElMTEFSI1RFUlNFClJBVFNPIyNORUFUIyMjIwpQTElFRCNET0dHT05FSVQKTUlUWUEjRUxBTiNJU0xFClNLRUVUI01JTEUjR0FMQQojRVJTRSNPTkVTI0hVU0s="},{"title":"3/21/02 FOOTSIE","author":"by Fred Piscop, edited by Stanley Newman","date":"2002-03-21","grid":"TUFSQVQjUElUVCNSRU1PCkVSSVNBI09ET1IjT1JBTApTT0NLSVRUT01FI1NJTUkKQVNIRSNIQUwjQVNIQ0FOClNFRURMRVQjQUNFIyMjIwojIyMjQk9PVFRIRUJBTEwKRUxWRVMjI0lURU1JWkVTCkJFRVIjQ0xFQVIjTFVOVApCQVJURVJFUiMjTkVSRFMKU0hPRUxFU1NKT0UjIyMjCiMjIyNJVlMjT05BVEVBUgpCQUFCQUEjSVJFI09SRE8KQUJCRSNTQU5EQUxXT09ECkJBQkUjU1BDQSNBTkRSRQpBQkFUI0VCQU4jU0VFTk8="},{"title":"3/22/02 JERRY-BUILT","author":"by Sally R. Stein, edited by Stanley Newman","date":"2002-03-22","grid":"TE9BRCNJTUFNI0NFQVNFCkFMU08jREFERSNBTk5JVgpTRUlORkVMREFORFZBTEUKU09GQUJFRCNHRVJJVE9MCiMjI0xJRkUjUkhFQSMjIwpHT0FEI0lNUEVJI0JST00KSU5LI0FYRVMjI0VMT1BFClNUSUxMRVJBTkRMRVdJUwpUT1RBTCMjTEFPUyNETkEKU1BBVCNSRU1JWCNEWUVTCiMjI1RIQVIjTE9DSSMjIwpBTEdJRVJTI0VMQVNUSUMKR0FSQ0lBQU5ET1JCQUNIClRSSUVSI1RSSUcjQUxPRQpTQU5EUyNaQU5ZI1JFTlQ="},{"title":"3/23/02 SATURDAY STUMPER","author":"by S.N., edited by Stanley Newman","date":"2002-03-23","grid":"U0FNUFJBUyNNRUFTTEVTClRTQVJJU1QjUFZDUElQRQpBVFJPUE9TI1NBUkFOQUMKUkFJRFMjIyMjI09OQ1VFCkxJRVMjQ0FTVEUjU09MRApFUkEjRk9SVFVOQSNMRUUKVEVOQ09NTUFORE1FTlRTCiMjVE9STUUjR1JPQU4jIwpDTE9TRUVOQ09VTlRFUlMKT1VJI1NOSVBJTkcjQk9ZClVTTkEjVEFJTFMjRVJPUwpSSEVUVCMjIyMjQVZBU1QKU0VUU09VVCNDT01FU1RPCkVTVEVMTEUjU05PUktFTApTVEVBREVEI1RBUlRBUkU="},{"title":"3/24/02 DOUBLE FEATURES: With twice as much fun as usual","author":"by Randolph Ross, edited by Stanley Newman","date":"2002-03-24","grid":"QUJCQSNQQUdBTiNBUkNII0NPQlJBCkZPUk0jQUxPTkUjUk9IRSNPTkFJUgpCT09NI1NMQVRTI0FMQU4jTUVSR0UKI1RXRU5UWUxJVFRMRUlORElBTlMjCiMjI1RFRSMjI0xBUyNSRUFDVCMjIwpURU5FQVNZUElFQ0VTI1JOQSNWSU0KRVZFUlQjRU9OI09BVEgjRUxBSU5FClhJViMjRkFOVEEjI09CSSMjTk9TRQpBQ0VEI1RISVJUWVRXT0NBTkRMRVMKU1RSRUFLI0VBVEVSUyNFTUlSQVRFCiMjI1RVTklTI1VURSNCUlVDRSMjIwpBQ1RFRE9OI0FOSU1BTCNTRUFMRVIKVEhFU0lYRkFDRVNPRkVWRSNTSUxPCldFUFQjI09FUiMjUlVORVMjI05JQQpBUklTVEEjUkVCQSNTRFIjSElHSFMKUklEI09GRiNTSVhURUVOTUVOT1VUCiMjI1NQUkFUI1NMTyMjI0FMUyMjIwojVEhFRk9VUlRFRU5ZRUFSSVRDSCMKVEhFR08jTEFJQyNTQVZPUiNPUkVPCkJBUkVSI1RJTlQjSUxFTkUjUlVNUApTVE9STSNTVEVTI0xVUkVEI0VYSVQ="},{"title":"3/25/02 LANGUAGE CLASS","author":"by Lee Weaver, edited by Stanley Newman","date":"2002-03-25","grid":"Q0FTVCMjVVNBI1NQSU5FCkFUVFUjSVRBTCNQQU5FTApUT0lMI05BU1QjSVNTRUkKRU5HTElTSEhPUk5TIyMjClJFTUVMVCMjU09BUEVEIwpTUkEjS0VZUyNTQ09SRUQKIyMjI1NQQU5JU0hSSUNFCkpJTUEjI1JPRCMjVEVBTApGUkVOQ0hET09SUyMjIyMKS0VUVExFI1BMRUEjRURPCiNTRUVPRkYjI0FOR0xFUgojIyNMQVRJTkFNRVJJQ0EKU0hPT0sjUkFURSNFWElUCkxPVVBFI1NQRUQjVElERQpPUFRFRCNUQU4jI0FSRVM="},{"title":"3/26/02 HAVE A BALL","author":"by S.N., edited by Stanley Newman","date":"2002-03-26","grid":"UEVUI1BBTkcjTUFUVEVMCkVWRSNSVUVSI01SSFlERQpOSVgjRURJRSNDQVJSSUUKQ0FUQ0hJTkcjQ1JPQVRTCkVOU1VFIyMjRkxBVyMjIwojIyNCQVJSRUwjVElBUkEKQUREI1RFRU1FRCNOT09OCkxPT1AjU1RPV0UjR05BVApPTU5JI1RPVEFMUyNFUkUKVEVFVEgjUkVUSUVTIyMjCiMjI0NPU1QjIyNMQVNTTwpUT1BIQVQjRklFTERJTkcKT0JMSUdFI1JPVkUjRUFSCldJRU5JRSNFV0VSI1ZJRQpTVEFHRUQjVEFSUyNFTFM="},{"title":"3/27/02 REPAIR KIT","author":"by Fred Piscop, edited by Stanley Newman","date":"2002-03-27","grid":"Q09OSUMjT01FTiNFUEVFCkFSQUJZI0dBTEUjR0FNQQpOQUlMUE9MSVNII09USVMKSU5GRVJSRUQjSUNJQ0xFCiMjIyNFTkQjIyNBU0hFUwpERVBPU0UjTElPVFRBIyMKRUxMSVMjTkFDUkUjREFTClNBVUQjREVDT1IjR0FMTApJTkcjR0lWRU4jU0FNT0EKIyNVTklURUQjTklQU0VZCkRPR0VTIyMjQUlEIyMjIwpJTkxFVFMjQU5URU5OQUUKUkVJRCNQQVNURUJPQVJECkdBRUwjSVJJUyNBTk5JRQpFTFNFI1RJTlkjUkVHQU4="},{"title":"3/28/02 ON THE TRAIL","author":"by Daniel R. Stark, edited by Stanley Newman","date":"2002-03-28","grid":"UE9LRSNUQUNII0xBU0VSCkxVTkEjQUdIQSNPR0lWRQpVU0VTI0lSSVMjT0xMQVMKU1RFRVBMRUNIQVNFIyMjCiMjIyNST0UjI0JFVFRFUgpDT1NUQVIjVElFUyNFTkEKQUtFRU0jRkFTVFRSQUNLCk1BUkUjI0FCQSMjT0JPRQpFWUVTSEFET1cjU1RBUlIKVEVOI09MRU8jTElFR0VTCk9ERVNTQSMjQklHIyMjIwojIyNIQUlST0ZUSEVET0cKTElORU4jQVhMRSNWRUlMCk9DRUFOI1JFQVIjRUxMRQpUSUFSQSNBTlRTI1JJU0U="},{"title":"3/29/02 IN ADDITION","author":"by Merle Baker, edited by Stanley Newman","date":"2002-03-29","grid":"SVZFUyNTUFVEUyNSQVNQCk5FWFQjVEVORVQjQVJJQQpSSVBTTk9SVEVSI05PRUwKRUxMI0lOQ09NRU9GQUdFCiMjRU1DRUUjI0FaT1JFUwpBVVRPRUQjQVJNT1IjIyMKQlJJVCMjUFJFRU4jQVRPCklOVk9JQ0VPRlJFQVNPTgpUU0UjQ0hFU1MjI1ZUT0wKIyMjU0VJTkUjUVVJUktZClNLSVBJVCMjT1VURE8jIwpJTkZBTkNZRlJFRSNOQUgKTkVBUiNIT1VTRVBMQU5UCkdFTFMjQVJTT04jUFVUVApFTExFI1RFRU5TI1NURVA="},{"title":"3/30/02 SATURDAY STUMPER","author":"by Anna Stiga, edited by Stanley Newman","date":"2002-03-30","grid":"U1dFUFQjRE9GRiNBQUhTCldBVkVSI0lUQUwjSURFQQpBVEFSSSNTVFJJUExJTkcKVEVOU0UjQ0FDVEkjRVJFCiNSRUVEI09XRSNHU1VJVApBTFMjI0NMQVNTSUMjIyMKUElDQ09MT1MjVFJPSkFOCkVMRUFOT1IjWk9PTE9HWQpTWURORVkjUk9VTkRFUlMKIyMjREFTQk9PVCMjRUVFClJBWk9SI0FUTSNTQUxFIwpPTEUjVE9OQUwjQ1JFTUUKQklSVEhSQVRFI1JPV0VSCklDT04jQU5PTiNVU0lORwpORVNUI0xBUlMjQkVTVFM="},{"title":"3/31/02 TEAMWORK: Opening Day's almost here","author":"by Shirley Soloway, edited by Stanley Newman","date":"2002-03-31","grid":"R0xVTSNBR0VTI1NSVEFTI0JZQVRUCkxJTkEjWVVMRSNOSUVDRSNMQVVSQQpBTkNJRU5UTUFSSU5FUlMjQU5ET1IKREVMVEEjSE9TRUQjTUVBI1NLSVRTCiNORUFSRVIjT0RFUyMjTUVURSMjIwojIyNJTkRJQU5TU1VNTUVSI0VWQU4KR09CI0VERU4jI1RSRUUjQUxTQUNFCkFXQVJEIyNURUEjI1JBRSNFRERJRQpaRVJPI1RXSU5TR0lSTFMjSE9JU1QKQVNTWVJJQSNTSEFEWSNDRFJPTSMjCiMjI0FFT04jI0lMTCMjSEVFRCMjIwojI0JMRVNUI1NFTEVTI0VBUkxPQkUKQlJBU1MjQVNUUk9TVFVSRiNFTEFMClJPTEZFI0RMSSMjVERTIyNUU0FSUwpBVEVBU0UjQVJFUyMjU0VMQSNGRUUKRE9STSNDVUJTUkVQT1JURVJTIyMjCiMjI0lST04jI1NMT0UjQ0FURVJTIwpNQVBMRSNDUk8jTFVSQ0gjQU5JVEEKRU1BSUwjSE9NRU9GVEhFQlJBVkVTCklNUEVJI0lTQU1VI0VJUkUjVEFQRQpST0FTVCNDQU5TVCNSQVNBI0VMU0E="},{"title":"4/01/02 SOUND-ALIKE PAIRS","author":"by Shirley Soloway, edited by Stanley Newman","date":"2002-04-01","grid":"T0NBTEEjTEFQUyNBU1BTClJPU0VTI0FCRUwjU1RMTwpHUkVBVEdSQVRFI1RFQUwKU1BBUlJFRCNTRVJSQVRFCiMjI05PVEVTI1BFQUxFRApBQkJFIyNSSU0jTFlTIyMKSk9SREFOI05PVEkjVEVOCkFSRSNET0NLRE9DI0VSQQpSRUEjT0dMRSNBU1NFVFMKIyNLSU4jSVJTIyNQTEVBCkZBQlJJQyNTQU1CQSMjIwpVUFJJU0VTI0ZFQVRIRVIKU1BBUyNTV0VFVFNVSVRFCkVMS0UjVEFOUyNFTEVOQQpEWUVTI0FCRVQjUkFEQVI="},{"title":"4/02/02 CIRCULAR REASONING","author":"by Daniel R. Stark, edited by Stanley Newman","date":"2002-04-02","grid":"VEhBTiNDUEFTI0VHR1MjCkhBUkUjUklDRSNEQVJUUwpPTkNFI09YRU4jSURFQUwKVUdII1RXSVNUT0ZGQVRFCiMjUkhPREUjI1dJTFRFRApTS0lFUlMjRkFOQ1kjIyMKSEFWRU4jVEVQRUUjQ0FCCk9SQUwjSEFURUQjSlVMWQpFTEwjRklMRUQjVEVSU0UKIyMjTU9OS1MjU0FMVk9TCkFCT0FSRCMjQVBQTEUjIwpUVVJOQlVDS0xFUyNCQUcKVklTVEEjUklURSNQQVZFClNDT0xEI0FXRUQjT0xJTgojS05FRSNNSVJZI0VMU0U="},{"title":"4/03/02 TOP-RATED CELEBS","author":"by Fred Piscop, edited by Stanley Newman","date":"2002-04-03","grid":"Uk9WRVIjRE9DUyNNT1JPCkVNSUxFI0VaUkEjQVBFWApCRUxMQUFCWlVHI1lBTEUKQUdFI1BJVFkjQVZBTE9OCkdBUkRFTlMjRU1NQSMjIwojIyNBUlQjQU5PSU5URUQKU0hJTlMjRElPUiNHQUxFClBVTUEjVE9SUkUjRVJJRQpFTElBI0lURU0jQUxURVIKQ0FOTk9ORUQjVUZPIyMjCiMjI0RPVFMjQU5HVUxBUgpST0JST1kjQVJDSCNBQ0UKSVNFRSNQQVVMQUFCRFVMCkJMRVcjRVRURSNOT0xURQpTT1RTI1NPT04jU1dFRVQ="},{"title":"4/04/02 SONG GUYS","author":"by Bob Frank, edited by Stanley Newman","date":"2002-04-04","grid":"VElGRiNGRVNTIyNDQUdFCk9CT0UjT05UQVAjSEFVTApOT1JNI0NZQU5PI0lBTlMKIyMjTVJTQU5ETUFOIyMjCiNXSEVFTCMjI1BST1BFUgpSSE8jSEVNU0xFWSNSTkEKRUFHTEUjRUxPSSNIRU1JCk1SVEFNQk9VUklORU1BTgpBVElUI09XRU4jQU5JU0UKRE9FI1RVU1NBVUQjVVNTCkVOREVBUiMjI1RJRU1FIwojIyNNUkJBU1NNQU4jIyMKU0FBQiNPUk9OTyNBSURBCk9HTEUjTk9SQVMjQ1JBQgpORUVEIyNXRVBUI1RBREE="},{"title":"4/05/02 HOT STUFF","author":"by Sally R. Stein, edited by Stanley Newman","date":"2002-04-05","grid":"QlJPWiNBQlJJUyNUQUZUCkVJTkUjTEVPTkUjSFVMQQpOT1RBI0FMQ09BI0lSQU4KU1RPTEVOQ0FSUyNSQU5HCiMjIyNET0gjR09BRCMjIwpBQUNIRU4jVkFORFJPU1MKRFJBSU4jQ0lORU1BVElDCk9PUlQjREFWSUQjSVRFUgpQQVRSSU9USUMjR0xPVkUKVFJFRVRPQUQjTEVTU0VFCiMjI0NBUkwjU0VOIyMjIwpFUkdPI01PTFRFTkxBVkEKTEVBUiNBTkVBUiNTSVNJClNBSUQjVElOR0UjQU1JTgpBUlRTI1NBVEVEI1RFWFQ="},{"title":"4/06/02 SATURDAY STUMPER","author":"by S.N., edited by Stanley Newman","date":"2002-04-06","grid":"REFDQ0EjTEFORFNMSURFClVUQUhOI09WRVJUT05FUwpLT0xBUyNQRUFKQUNLRVQKRU5GUkFNRSMjI0xIQVNBCiMjI0FSSVpPTklBTiMjIwpBU0hDQU4jQ09OR0VTVFMKVE5VVCNJU1RJQyNTVE9QCkJBTkUjU1RBU0gjU0FSSQpBRkFSI1RBTllBI01JTUUKVFVOQU1FTFQjUkhPREVTCiMjI0NBUkxTQUdBTiMjIwpVTklUUyMjI0tFU1NMRVIKWk9ST0FTVEVSI1NUT1JFCklOT1JERVJUTyNMRUFSTgpTRU5TQVRJT04jRVJOU1Q="},{"title":"4/07/02 THE DOCTOR IS IN: And making a few changes en route","author":"by Randolph Ross, edited by Stanley Newman","date":"2002-04-07","grid":"VFdPUEFJUiNUUkFJUFNFRCNFUFBTCk5BTkVUVEUjSElST0hJVE8jUExBWQpUSEVEUkVER0VPRk5JR0hUI0VBUk4KIyMjREVNRVJJVCMjI05BU0NFTkNFCklTVExFI1BBUyMjV0hFTiNISUUjIwpST0hFI09MRE1BRFJJRCNDRVNUQVMKT0xFI05DT1MjRElFVCNMQUNUT1NFCk5PTSNJVFkjSU1BTiNIQVJLI0ZPUgpBTU9VU0UjT05JTiNNQU5FUyNUVUIKR09SUCNUVU5EUkFTQU5EV0lDSCMjCkVOTklPI1BMRUEjSVRHTyNOT0VORAojI0lOVklTSUJMRURSSU5LI09ERVIKQ05OI0VWRU5UI05FT04jUkVQUk9TCkhPRyNSSVRFI0JFQU4jU0FEI0FDRQpJTkRJQ0VTI1BVUlIjRkVVRCNQRVUKVE9SU09TI0NEUk9NUEFDVCNNRU5TCiMjQVNBI0VBU1QjI0xJRSNFQVNFUwpSRUZVVEVSUyMjI1NBTkRBTFMjIyMKQU5URSNEUklMTEdPVFRFTkdBSU5TCk5ZRVIjREVOSUFCTEUjUkVBRE9VVApUQVJTI0FET05JU0VTI1NUUkFVU1M="},{"title":"4/08/02 DIET PLAN","author":"by Lee Weaver, edited by Stanley Newman","date":"2002-04-08","grid":"TVVURSMjQVRFTiMjU1RTCkFUT0xMI0dVUlVTI0tFTgpMQU5BSSNHUklNRSNJUkUKVEhJTlNLSU5ORUQjTlJBCiMjIyNQSUUjI1JFSU5FRApCQVNTRVQjTkVBUkJZIyMKT0lMRUQjTUFMTCNFREdZCk9ESU4jRE9SSVMjUklMRQpORU1PI0lOQ0EjUklQRU4KIyNDUkFGVFMjTEVBU0VTCkJFSEFMRiMjT09IIyMjIwpMRUEjTEVBTkNVSVNJTkUKQVJOI0FSR09UI1JPQklOClNJQyNIRUFWRSNFTUVORApURUUjI0RSQVQjI0VUQVM="},{"title":"4/09/02 HOLD ON","author":"by S.N., edited by Stanley Newman","date":"2002-04-09","grid":"QUxQUyNNVUdTI0FSRU5BCkJPT1QjQVJJQSNET1pFUwpDT01FVE9HUklQU1dJVEgKU1BFQVIjRUxMRSNET1NFCiMjI0RJRUQjQkFCWSMjIwpPUFRGT1IjUE9TRSNUS1QKSEVSQSNMSVNBI1JPU0lFCkdSQVNQRURBVFNUUkFXUwpPTUlUUyNFTFNBI0dSSVQKRFNUI1NQQU0jR1JBU1NZCiMjI0VUQUwjVEVFTiMjIwpBUEVYI0xJQVIjTklUUk8KUFVUVEhFU1FVRUVaRU9OClNQQVJFI1RVTkUjRVJORQpFU1NBWSNTQUtFI0RJQVM="},{"title":"4/10/02 COMMON SENSE","author":"by Daniel R. Stark, edited by Stanley Newman","date":"2002-04-10","grid":"Qk9PTSNPVkVSI1RIQVQjCkVSTEUjTkFNRSNIRUlSUwpSRUlOI0VTUE4jUkFEQVIKR09PRFRBU1RFI0VSRUNUCiMjIyNBTEFJIyNBVFNFQQpQUklTTSNMRU5HVEgjIyMKTE9PTUVEI1NJUiNJTkNBClVUVEVSRUQjQlVSTk9VVApNRUFMI0ZJUiNCT0dBUlQKIyMjTEFUVEVSI0FTSEVOCkFCWVNTIyNNRVNTIyMjIwpQTEVBUyNTT0ZUVE9VQ0gKVElBUkEjRVJJRSNBVE9NClNQUkFZI0VTVEEjSEVSTwojU1NUUyNERVNLI1VTRVM="},{"title":"4/11/02 GO THE DISTANCE","author":"by Fred Piscop, edited by Stanley Newman","date":"2002-04-11","grid":"TUFNTUEjREFaUyNBUVVBCklMSUFEI0FSRUEjR1VSVQpDQVJORSNESU5UI0FJTFMKI1JBSUxST0FEWUFSRFMjCiMjI0xBSCMjQVJUIyMjIwpNQUpBI0lORCNTRUVQRUQKQUxJI1NOQVJLI0FMSVZFCkxJR0hUT05PTkVTRkVFVApBTkdFUiNBTklTRSNUUkEKWUVTU0lSI0VUUyNGQVNUCiMjIyNLRUEjI0VFUiMjIwojTUlMRVNTVEFORElTSCMKTFVDWSNUSUVSI0dFVFVQCkFOT04jRURFTiNBWlVSRQpNSU5YI0RFTU8jUkVOVEE="},{"title":"4/12/02 STUFF","author":"by Salomon & Frank, edited by Stanley Newman","date":"2002-04-12","grid":"U0FGRSNBQ0hFI09CRVlTCkNQQVMjUEFVTCNWQUxFVApFTlZFTE9QRVMjQUxJQVMKTkVPI0FMUFMjQUxMIyMjCkVBUkZVTCMjQUxTT1JBTgojIyNFR09USVNNI1RPUk8KU0FZQUgjSUxMUyNCVVJSCkFCRVRTI1RJQSNUT0dBUwpOT1NII0NMQU4jT1hFWUUKRFVORSNSRURUQVBFIyMjClNUT1JNRUQjI1VQU0lERQojIyNCT1cjRkFURSNEQVMKQVNQRVIjTVVTSFJPT01TCkJBUkRTI09OVE8jU0xVRQpDTE9TRSNPRE9SI1VTUFM="},{"title":"4/13/02 SATURDAY STUMPER","author":"by Charles E. Gersch, edited by Stanley Newman","date":"2002-04-13","grid":"SkFaWlkjU1FVQVdLQk9YCkFSSUFTI0NVTkVJRk9STQpQRU5ORSNNT1RPUkNBREUKRU5HSVJUI1RJTlkjUkVOClNUWUUjQU1JRVMjRkRSIwojIyNSQVZFTlMjUkFXRVIKREFTI1RFTkcjTUlMQURZCkVMT1BFUlMjREVWQUxVRQpDTFVFSU4jUk9URSNLUFMKT0ZURU4jQ0VMSU5FIyMjCiNPSFIjUk9MTEUjVFJBUApBUkUjRE9MRSNSRUhBU0gKS09BTEFCRUFSI0FOSVRBCklOU0lERVVTQSNSSVNFUwpORVRMT1NTRVMjU0NBUkU="},{"title":"4/14/02 WHERE IT'S AT: How to solve a common problem","author":"by Lee Weaver, edited by Stanley Newman","date":"2002-04-14","grid":"TUFTSCMjVUJPQVQjQVJHTyNFTEtPCkFDVE9OI05PUk1BI1NPQVAjTEVBRApUSEVTSU1QTEVTVCNXQVlUT0ZJTkQKQ09BVFRBSUwjI1RCQVIjI0dJRlRTCkhPTUVSVU4jQUxJRU4jS0lMTiMjIwojIyNET04jQU1FTlMjQkFCRSNDQU4KUEVUIyNBVEhJTkdUSEFUSVMjRVRFClJFRUYjI1VTRUQjT0FTRVMjRkxPVwpBUlJJVkFMIyNTQVdTIyMjRkVFTFMKTU9OR09MSUEjI0xFVFMjRE9VQkxZCiMjI01JU1BMQUNFREFST1VORCMjIwpMQVJFRE8jTFVMVSMjSU5FRElCTEUKT1BFTlMjIyNET1RTIyNTVEFOTEVZCldIRVQjQ0hSSVMjQ1JFRSMjR0VORQpMSUwjVEhFSE9VU0VJU1RPIyNET1MKWURTI1JFTk8jUkVOVFMjUFJZIyMjCiMjI0ZJUlMjTEVWRUUjU1RFRVBMRQpBVFJJQSMjRE9TRSMjRU1JU1NJT04KR09BTkRCVVlBI1JFUExBQ0VNRU5UClJFTkQjSVRFTSNBUkVBUiNUQVRFUgpBU0lTI0JFU1MjTEVBTlQjI05BUlk="},{"title":"4/15/02 AFTER MEALTIME","author":"by Shirley Soloway, edited by Stanley Newman","date":"2002-04-15","grid":"QkxPVCNFQkJFRCNMSU1BClJBVkkjTUFSSUEjQUxBRApBTEFOI1VSQUxTI0NPUkUKQ0FMQ1VMQVRFI1BFTkFMCiMjI0FUQSNTRVBBUkFURQpFTUFOQVRFI05PTEEjIyMKTE9VI0hFQVQjUEVUQUxTClNBTkcjI1RPUCMjRUxJQQpFTlRFUlMjTk9SQSNJU00KIyMjTkFUTyNNQU5EQVRFCk1PREVSQVRFI0RPTyMjIwpBTU9SRSNJTlNJTlVBVEUKTUVTQSNNT09MQSNCTE9XCklHRVQjSVNMRVQjVElORQpFQVNFI1JFQURFI1NFRVI="},{"title":"4/16/02 COMPLETELY","author":"by S.N., edited by Stanley Newman","date":"2002-04-16","grid":"SVJBUyNTT0RTI1NURUFMCkRFTEkjRU5JRCNIRUxMTwpPTkVMI1BJU0EjQVhMRVMKTE9DS1NUT0NLI1BBU1NFCiMjI1dIRU4jI0RFTiMjIwpBRkxPQVQjV0VFI1NDQVQKTEVFUlMjRkFSQ0UjQU1ZCkZST01USEVHUk9VTkRVUApJTk4jQVVUT1MjUkVFU0UKRVNBVSNSQU4jUEVXVEVSCiMjI01BVCMjT0FLUyMjIwpFR1lQVCNBTkRCQVJSRUwKVFJBSUwjQ09JTCNPT05BClRFUlJBI0VTU08jT0REUwpBR05FUyNTRVRTI01FU1M="},{"title":"4/17/02 YOU BET","author":"by Fred Piscop, edited by Stanley Newman","date":"2002-04-17","grid":"U1BFQ1MjRk9HRyNFUEVFCkFMTEFII0FMT0UjU0xBVgpNVVNUQSNYRU5BI1RPVEUKI0dFT1JHRUdFUlNIV0lOCiMjIyNPSUQjIyNURVNUUwpTQVZBTlQjQlJJRVIjIyMKT1JFUyMjTU9PU0UjQ0FCCklOVEhFRklSU1RQTEFDRQpMT08jV0lHR1kjI0FTSEUKIyMjREVOU0UjUEVTVEVSCk1BQkVMIyMjVklBIyMjIwpBUkVBTExZQklHU0hPVyMKU1RBUiNBVVJBI1RPUEFaCktJU1QjT01BTiNFTElURQpTRVRII1NBTkQjUkVFU0U="},{"title":"4/18/02 ON YOUR TOES","author":"by Merle Baker, edited by Stanley Newman","date":"2002-04-18","grid":"Wk9MQSNKQVVOVCNPR0xFCkFOVVQjVVBQRVIjUkVBUgpQRVNUI01JQU1JI0xPSU4KQUNIVU1QQVRPWEZPUkQjClRBRSNVU04jIyNJTkdPVApBUlJFU1QjQ0FTVCNFUEEKIyMjTUVBU1VSRSNBVkVSCiNXQVRFUk1PQ0NBU0lOIwpZQU1TI1RJTUhPTFQjIyMKRVJFI0FTVE8jTkVBUkVSCkFDUkVTIyMjQURWI0VWRQojUklHSFRUT1RIRUNMT0cKUElDQSNBT1JUQSNISUtFCkJFQUQjUFJNQU4jRVZFTgpTU05TI1NORVJEI1pFU1Q="},{"title":"4/19/02 CHRONOLOGICAL","author":"by A.J. Santora, edited by Stanley Newman","date":"2002-04-19","grid":"QVJDIyNTQURBIyNST1NTClBPTE8jUFNBTE0jRVRURQpUV09XRUVLVkFDQVRJT04KIyNTRVZFTllFQVJJVENICkRPRSNBRE8jIyNTRUlLTwpVU0RBIyNUSEFXIyNTU1IKRUxJWElSI09DSEVSIyMjCiNPTkVEQVlBVEFUSU1FIwojIyNET1pFUiNUQUJBUkQKQVNJIyNFTkRTIyNTSUxPClJFR0FOIyMjQUNDI05FVApDRU5UVVJZUExBTlRTIyMKQU1PTlRIT0ZTVU5EQVlTCk5FUk8jT1JDQVMjU0lNUApBREVTIyNFU1NFIyNMQVk="},{"title":"4/20/02 SATURDAY STUMPER","author":"by Daniel R. Stark, edited by Stanley Newman","date":"2002-04-20","grid":"I0NMVU1TWSNERU1BTkQjClJPQU5PS0UjQU1BVEVVUgpBUkNBRElBI05PV0hFUkUKU1RJUEUjUk9DI1NPREFTClRFTlQjQ0xVRUQjU0lORQpFR0cjQ1JPU1NFRCNFVEUKUkVTT05BTlQjU0VBUkVECiMjI0JPTkcjVElFUiMjIwpUQUhJVEkjQk9SREVSRUQKVVNBI0VOQ09SRVMjRVJSCkNISUMjR09PTlMjVVZFQQpLQVJBVCNNQkEjU1BFQ0sKRU1JUkFURSNERVRFTlRFClJFRU5URVIjT1JBTkdFUwojRFJFQURTI1NBTkRFRCM="},{"title":"4/21/02 ON THE ROCKS: Mineralogical wordplay","author":"by Fred Piscop, edited by Stanley Newman","date":"2002-04-21","grid":"UEFMTSNCT1NDUyNPUkNBI0dBU1BTCkFTSUEjSU5UUkEjRk9BTCNJTk5JRQpTSEFMRVNURUFLI0ZPUkdSQU5JVEUKVEVORVQjQVRUSUNTI0FBQSNPUFRTCkVTRSNURVJTRSNIRUFWRU5MWSMjIwojIyNSQVRJTyNCRUFNRSMjT1NBR0UKVEhBSSNDT05OSUVTSUxJQ0EjTEFYCldBQkFTSCMjQVNUT04jUkFNUEFHRQpBVklMQSNXQVRTT04jQkVOI0VSQVMKTkVEI0xBSVRJRVMjTU9MQVJTIyMjCkdORUlTU1NIT1QjQklHQVBBVElURQojIyNDQU1FT04jU0FMSU5FUyNSSUIKU1dFRSNBTVMjUk9MTEVEI1RJRU1FCkNBUlJFUkUjVE9ESUUjI0VBUk5FUgpVTE0jTUFOVE9NQU5UQUxDI1JFU1QKUExBU00jI0FOQUNFI01JVFRTIyMjCiMjI1RBT1JNSU5BI0dFTk9BI0hBUApBUFNFI1NFQSNJTlNVUkUjUkVFVkUKRk9VUlFVQVJUWiNNSUNBSk9SREFOCkFMRU5FI0RBUkUjT0RFVE8jT0RJTgpSQVRFRCNTQ1VEI0dPUkVOI1NBTEU="},{"title":"4/22/02 WHERE YOU LIVE","author":"by S.N., edited by Stanley Newman","date":"2002-04-22","grid":"QUJDUyNSQUhTI0JFRUYjCkNPT0wjSVJPTiNFREdFIwpIT01FT05USEVSQU5HRSMKRUJCRUQjRVVSRUtBIyMjClNZU1RFTSNNRFMjI0FSQwojIyNTU1RTIyNUQVJaQU4KQkJDIyNHT1JFI1JBVElPCkZFQVRIRVJPTkVTTkVTVApMSU5EQSNUT0REIyNDRUUKQUdBU1NJIyNTSUxMIyMjClRFTCMjQ09CI1RFQUJBRwojIyNBWk9SRVMjQVRSSUEKI1JVTElOR1RIRVJPT1NUCiNPTUFOI0FUT04jWUFMRQojQkFORyNORVRTI0FERVM="},{"title":"4/23/02 MATCHING MONOGRAMS","author":"by Randall J. Hartman, edited by Stanley Newman","date":"2002-04-23","grid":"Q0FMTSNTVFJBVyNEQU5HCk9NQVIjQVJFTkEjRVRBTApESUJTI0ZVU0VTI0xPREUKRUdPI1dBTFRXSElUTUFOClNPUkNFUlkjI0VUQSMjIwojI0FMQUkjUEFEUyNUQUoKQUNUT1IjTUVOVSNTQUdBCldPT0RZV09PRFBFQ0tFUgpFUlJTI0FOTlMjVkVFUlMKREVZI1NUQVkjUElOVCMjCiMjI0NIRSMjU0xBVEhFUgpXT05ERVJXT01BTiNFVkUKQUZPUiNTQVJBTiNDUklCCkRJTk8jS05FTFQjUkFURQpTVEVNI0lET0xTI09QQUw="},{"title":"4/24/02 BIG BLOWS","author":"by Patrick Jordan, edited by Stanley Newman","date":"2002-04-24","grid":"U0VSUkEjVkFMI01FQVJBClBMRUFUI0VWQSNBTExBTgpBTUlOVCNST1QjTklGVFkKVE9OR1VFVFdJU1RFUiMjCkVSSUUjTEVTU0VSI0VPTgpTRU4jRUJCI0hFQVJTQVkKIyMjQ09PUlMjIyNBQ0hFClVQVEhFV0FURVJTUE9VVApTVVJFIyMjU1RPVVQjIyMKRU1JVFRFRCNDVUIjU1BBClNBUCNXUklUSEUjU1RBUgojI1dISVJMV0lORFRPVVIKR1JJRVIjTEVOI0FST1NFCkFVUkFMI0VFRyNMVUdFUwpTVEVQUyNSTlMjRUdFU1Q="},{"title":"4/25/02 IN VIEW","author":"by Daniel R. Stark, edited by Stanley Newman","date":"2002-04-25","grid":"UEVBUiNZT0dBIyNFVENICkFSTE8jT1ZFUlQjTE9MQQpXUklTVFdBVENII0RPVVIKIyMjVEVMTFMjUkVFS0VECiNBR1JFRVMjVEVSUkEjIwpHUk9VTkQjT1JBTCNTRUEKQVRPTVMjUExBVEUjVU1QClJJRFMjVk9JRFMjRFJBVApCRUwjVkVSVkUjQ0lWSUwKT1JPI0VSVEUjQkFTRUxZCiMjT01JVFMjQVJSQVlTIwpBTEtBTEkjU0hBR1MjIyMKSEFJTCNHQVZFTk9USUNFCkFSTkUjT1JFQUQjRVJBUwpCQUdTIyNBTkRZI1JBVEE="},{"title":"4/26/02 INSIDE FOOTBALL","author":"by Fred Piscop, edited by Stanley Newman","date":"2002-04-26","grid":"QkFTU0kjU0FVRCNBQ1RTClVSQkFOI0FSVEUjU09PTgpCUkFORkxBS0VTI1NJUkUKIyMjRFJBQiNQSUNBTlRFCk9MRERPRyMjIyNMSUZFUgpSRVJVTiNQSVRGQUxMIyMKQVZBTlQjT1JJT04jSURTClRJR0UjQVNJREUjU1BFRQpFU08jQU5JU0UjU0VQSUEKIyNORUdBVEVEI0VSRUNUClJJRkxFIyMjI1NUQVJFUwpVTkxBREVTI01PT0cjIyMKU05JUCNPQ0VBTkZMT09SClNFRVMjTk9USSNGSU9OQQpFUlNFI1NUQU4jU09PRVk="},{"title":"4/27/02 SATURDAY STUMPER","author":"by Randolph Ross, edited by Stanley Newman","date":"2002-04-27","grid":"VEhFV0VTVFdJTkcjQ0VFCldBVEVSSEVBVEVSI0FSUwpJTlRFUlJFTEFURSNNRVMKTkRBSyNFTUsjU0VORUNBCiMjI0VORFNVUCNOVVRUWQpTQ0VORVMjUExPI0JPT1QKSE9OREEjVFNBUlMjUFJFCk9MRFNURVIjTk9DTEFTUwpVTEEjT0xJT1MjUkVTRVQKVEVOVCNGQ0MjRkVBU1RTCkVHR0VEI0tFRUxFRCMjIwpESUVTRUwjQU5PI1BFVEUKT0FSI0xJT05UUkFJTkVSClVURSNBU1BJUklOUElMTApURUQjU1BBQ0VORUVETEU="},{"title":"4/28/02 HALF-CENTURY MARK: Celebrities who reach it this year","author":"by Sally R. Stein, edited by Stanley Newman","date":"2002-04-28","grid":"U1BBUksjQ0xBUCNHQUxTI0lUU01FCkFHUkVFI0hPUFMjQVJFQSNDSEFPUwpDQVRIWVJJR0JZI0xJQU1ORUVTT04KIyMjRUxPUEUjQ0hJRUYjRVNTRU5FClJFTUFJTlMjU0hFTEwjQUNIRSMjIwpBTEFSTVMjRkFJUkUjQVNUTyNHT0IKSE9SU0UjQkVOQ1JFTlNIQVcjRU5MClJJVkUjRkxFRSMjI1lTRVIjQk9DQQpBU0kjUEFVTFJFVUJFTlMjUkVSVU4KSEVOUEFSVFkjTFNBVFMjRE9HR0VECiMjSEFUQ0gjT0xJTlMjQVVESUUjIwpTUEFSU0UjU0NFTkQjQVJLQU5TQVMKQ0FHRVkjSk9ITkdPT0RNQU4jVFZBCkFJTFMjQk9BUiMjI0hNT1MjQlJFVwpMR0UjQ0xJVkVCQVJLRVIjREVBUlkKUEVSI1JBU0UjT0NFQU4jRlJBSVNFCiMjI1FVSVQjQkVUU1kjUVVBUlRFUgpTVFJVTVMjVE9SU0kjQlVSTlQjIyMKUEhPRUJFU05PVyNEQU5BWUtST1lECkVBU0VMI1JVTEEjRUdBTiNUQUxJQQpESUFSWSNTVEFSI0RPSVQjT1BFTlM="},{"title":"4/29/02 MALE CALL","author":"by Lee Weaver, edited by Stanley Newman","date":"2002-04-29","grid":"I0FNVVNFI0NBQiNBUkZTCkZMQVRMWSNBUEUjU1VMVQpMSU5FQVIjU1BSQUlORUQKQU5OI0dFTlRFRUxORVNTCktFRUwjI0VMQVRFI1NIWQojI1FVRVJJRVMjIyMjIyMKTkVVVFJBTCNFRkZBQ0VTCk9SSUVOVCMjI09VVEhJVApURU5TRVNUI1NVTFRBTkEKIyMjIyMjT1ZFUkxBUCMjCkFQQiNCT1dJRSMjUkVQTwpCT1lTRU5CRVJSWSNSVU4KQUVSQVRJT04jQ09ZT1RFClNNT0cjQ0FOI0FHRU5UUwpFU05FI0VUQSNGSU5FUyM="},{"title":"4/30/02 HIDDEN BUGS","author":"by Shirley Soloway, edited by Stanley Newman","date":"2002-04-30","grid":"RVJBUyNUT05FUiMjQ0FCCkxPUkUjQU5PU0UjQ0FMTApTVUdBUkJFRVRTI0FOVEUKQVRPTkUjU0xPVCNTVEFOCiMjI0NJQSMjUEVQUEFSRApSRVNFTlRFRCNERUFMIyMKRUxJUyNBR0VTI0VST0RFCkFMRyNTVElDS0VSI1VFWQpEQU5DRSNTS0lNI0VQRUUKIyNBTEFTI1NQSU5ORVJTClNBVElSRVMjI1RPVCMjIwpBTFVNI0xFQUYjTElTTEUKU09SRSNFTkNST0FDSEVEClNVRVMjQ09IQU4jRUFWRQpZRFMjI1RSRU5UI1NISU4="},{"title":"5/01/02 PLEASANT DREAMS","author":"by Bob Frank, edited by Stanley Newman","date":"2002-05-01","grid":"QkFTSUMjUkFWSSNTQ0FSCkFOSVRBI0FMQU4jV0FORQpISVRUSEVTQUNLI0VUTkEKIyMjI09PUFMjQlJBQ0VECkpFVFNPTlMjQ0xPVEgjIwpFWEFMVFMjQk9PVCNTRUMKV0FLRVMjTUlSVEgjT05PCklDRUQjI0lOTiMjSU1BTQpTVEEjTUFOR1kjQ1JFTUUKSEFTI0FMVE8jQ1JBWkVECiMjTklMTFkjQ1JBU1NMWQpCUk9OVEUjQkxPQyMjIyMKUk9PVCNHT1JPQ0tBQllFCk9VWk8jRVJJQyNFTUFJTApTVEVXI0RFQ0sjUkFNUFM="},{"title":"5/02/02 AT THE HOP","author":"by Daniel R. Stark, edited by Stanley Newman","date":"2002-05-02","grid":"TE9DTyNZRUFSUyNTQ0FCCklET0wjT05DVUUjUEFORQpJREVFI0hPVFNQUklOR1MKIyMjR1RPIyNTVEVSSUxFCk9BUiNBSFMjIyNCRU5FVApBUkUjSE9VRE9OIyNFUlMKS0FOSkkjTElORUFSIyMjCiNCT1VORFRPSEFQUEVOIwojIyNHSU9STk8jQU1CRVIKUEFDIyNFWUVMRVQjQlJPClVSQUxTIyMjREFII1NPQgpOT0xPQURTIyNSWUUjIyMKSlVNUFRIRUdVTiNFVkVTCkFTRUEjT1JBVEUjS0FUTwpCRVJUI1dBREVEI1NOQVA="},{"title":"5/03/02 SLIP SHTICK","author":"by Richard Silvestri, edited by Stanley Newman","date":"2002-05-03","grid":"U1RFUCNMT0JTI01PQ0hBClRBVEEjQU1BVCNBQk9VVApBQ1RTI05PTkUjQ0xJTkUKWU9VU0FZT05FVEhJTkcjCiMjI09SQSNTUFJJRyMjIwojUkVWRVJCIyNPTkVJTEwKQUFSRSNERVJJREUjRFVFClNDQVJQI0FORCNTV0lORwpBRVMjQUJVU0VSI0hPR1MKUFJFU1RPIyNTRU1JVEUjCiMjI0hFTk5BI0FOVCMjIwojTUVBTllPVVJNT1RIRVIKSEVBUlQjT0dFRSNMSU1PCkVOUk9MI1NFQVIjRVZJTApQVU5OWSNFUlJTI0RFTEw="},{"title":"5/04/02 SATURDAY STUMPER","author":"by Anna Stiga, edited by Stanley Newman","date":"2002-05-04","grid":"UFJFQ0VQVCNQRFFCQUNIClJBQ0VDQVIjQU5USUdVQQpJUk9OT1JFI1dBSVRFUlMKR0VOVExFTUFOI1BFUlRIClNSTyMjU09OSUNTIyMjIwojI01BRCNMWU5OI1FVT0QKUFJJTUVSTyNHT1RVUFRPClJPQ09DTyMjI1RPT1RPTwpJTkFSQUdFI0ZFQVRIRVIKTUFMRSNVU1NSI0RFRSMjCiMjIyNSRUlORVIjI0NMSQpBTVVTRSNBTERFQkFSQU4KWEVST1hFUyNFVkFERVJTCkVMR1JFQ08jQkVMSUVWRQpTVEVUU09OI0JMSU5LQVQ="},{"title":"5/05/02 BURY THE HATCHET: Ready for you to unearth","author":"by Greg Staples, edited by Stanley Newman","date":"2002-05-05","grid":"U0VXTiNCQVRBVklBI0NPVCNKQVdTCk9MQU4jT05FQ0VOVCNBTEEjRUNITwpGQVhFUVVJUE1FTlQjRklYQVRJT04KQUxFI1VOVElFUyMjU0VWRU4jREFZCiMjRE9PREFEUyNSQUUjRVhJVCMjIwpDQVBFUiMjIyNTQVhFTlNFTUJMRVMKTEVBRFVQVE8jVFJJTkkjTVVTRVVNCkFSUCNNRUFTVVJFUyNQRVBTI09SSQpNSUVOI1RJQVJBUyNHQVRUI0tOT1QKUEVSVVNFI0dBSVRFUiNVU0VMRVNTCiMjI1RPUlJFTlQjUkVUSVRMRSMjIwpCRURUSU1FI0lTT01FUiNBU0lERVMKT0JFWSNBTk5BI0hJVEVTVCNOT1NIClJPSSNFWEVDI1RFTlNFRFVQI1VURQpFTkdJTkUjQVRPTkUjRElTUk9CRUQKU1lOVEFYRVJST1JTIyMjI0VSTEVTCiMjI0FDSEUjRUxZI0FVUkFMRUUjIwpPTEUjVElSRVMjI0lMTElOSSNBSEEKVEFMS1NCSUcjQU5USUNMSU1BWEVTCklTTEUjSUxPI0RJRVNFTFMjUEVDSwpTVEFHI1RZUyNFTE1UUkVFI0VMS1M="},{"title":"5/06/02 GO WITH THE FLOW","author":"by Lee Weaver, edited by Stanley Newman","date":"2002-05-06","grid":"VFJVRSNQQUFSIyNDTEVGCktFUFQjVU5UTyNTSEFMRQpPQVRII1JJVkVSSE9SU0UKU1BIRVJFUyMjSE9PS0VECiMjRVJBU0UjRElBUyMjIwpBU0NFTlQjV0lOTEVTUyMKU1BSQVQjVEFDT1MjVFdPCkhFRUwjUklERVMjQ1JFVwpFV0UjU0lERUQjQ0xFQU4KI1NLSVBQRUQjQ0xFQVRTCiMjI05PRVMjQUxBUk0jIwpDQVJHT1MjI0NPUElMT1QKQlJPT0tUUk9VVCNDSUFPCkVNUFRZI0JFVEgjQU5UUwpSWUVTIyNJUkVTI0xFU1M="},{"title":"5/07/02 SPENDING SPREE","author":"by Sally R. Stein, edited by Stanley Newman","date":"2002-05-07","grid":"RUxST1kjTUFSQyNDTEFXCk1PT1JFI09MSU8jTE9CRQpNT01BTkRQT1BTVE9SRVMKQU1FTiNFRUUjTU9ERUxUCiMjI0dMQUQjU0VUUyMjIwpGQURFSU4jUEVUUyNUU1AKQVJFQVMjQVVESSNUT05FClZFTkRJTkdNQUNISU5FUwpPTkNFI0VHQU4jT0NURVQKUkFII1NBSVMjTU9UT1JTCiMjI1dPUkUjREFUQSMjIwpBVFJJVU0jRkVaI0NMQVAKU0hPUFBJTkdDRU5URVJTClBBTkUjU09ITyNIT05LUwpTVEFSI1NUSVIjTEVBU1Q="},{"title":"5/08/02 HAVE A BEER","author":"by Fred Piscop, edited by Stanley Newman","date":"2002-05-08","grid":"Q0FTUyNGQUxBI0FDVE9OClVQVE8jT1ZFUiNQSE9ORQpQUkFJUklFU0NIT09ORVIKUk9MTElFI1NURSNSRUFECk9ORUFMIyMjSVJNQSMjIwojIyNHTEFTU0NFSUxJTkcKTEFURSNTQU8jI1JFQ09OCkFHTyNBU1RSSURFI0VUQQpGQUdJTiMjVFNFI0VESVQKRlJBTktFTlNURUlOIyMjCiMjI1NBVkUjIyNPRE9SUwpBQk9PI0VTQyNTVEVQVVAKTVVHRk9SVEhFQ0FNRVJBCklOTEFXI0xBVkEjSVJBUwpTVEVSTiNFREVOI0NBTE0="},{"title":"5/09/02 WHAT'S NEW?","author":"by Merle Baker, edited by Stanley Newman","date":"2002-05-09","grid":"T0JPRSNDTEFTUCNIQU1TCkNSVVgjSFlEUkEjT0dFRQpUSVRPI1VOSVRTI1JBUkUKI01PREVSTk1BVFVSSVRZCiMjRlVSTCMjIyNQSU5aQQpCQUxTQSNVU0VSSUQjIyMKVVJJI1NFTlRSWSNMRVRTCkNPTlRFTVBPUkFSWUFSVApLTkVFI01PUk9TRSNHRUUKIyMjTkVBVEVSI0JJTEtTCkFUQkFZIyMjI0RVTkUjIwpDVVJSRU5UV0VBVEhFUiMKQ1JBTSNDSEFaWiNBWUVTClJPVkUjQUVSSUUjTEVBUApBV0VEI1JFUE9TI0VERFk="},{"title":"5/10/02 HIDDEN CAPITALS","author":"by S.N., edited by Stanley Newman","date":"2002-05-10","grid":"SEFSU0gjV0FTUFMjVEJTCkFMT05FI0VOVFJZI0lMTApISUJFUk5BVElPTiNNQU8KQVNFQSNPVkVOI0VVQklFCiMjI0tMRUUjR0FSTkVSUwpCSUNFUFMjR1JFR09SIyMKT0RPUlMjUEVBUlkjTEVJCkdFTVMjU0FOWU8jSklMVApTQVAjU0FSSVMjQk9OVVMKIyNBVklBVEUjRlJFRUxZCkFQUklPUkkjQUFSUCMjIwpDTElNQiNTQUNLI0VSUlMKTUFTI0hFQVRIRU5TSElQCkVUTyNBTk5JRSNBQ1VURQpTT04jTkVTVFMjVElNRUQ="},{"title":"5/11/02 SATURDAY STUMPER","author":"by Daniel R. Stark, edited by Stanley Newman","date":"2002-05-11","grid":"I0JBTFNBTSNTSU1JTEUjCkJFTElFVkUjRVJBU0VSUwpBTExTVEFSI0NBTExPVVQKU1RFUFMjUk9PI0xBTkRPClNBTlMjSFlNTlMjTUFJTApFTkQjTk9NQURJQyNSVEUKVEVFTkFHRVIjTUFEREVOCiMjI0VWQU4jU0lSRSMjIwpEUkFXRVIjTUVBVExFU1MKUkVOI1NURUFSTlMjTEFQCkVBVFMjSEFSRVMjREFURQpBREVQVCNTSU4jUkVUSUUKTUlOQVJFVCNBTElCSUVEClNFTlNBVEUjREVDQU5UUwojREFNUEVSI0VORVJHWSM="},{"title":"5/12/02 A LITTLE SHORTENING: Featuring some space-saving devices","author":"by Fred Piscop, edited by Stanley Newman","date":"2002-05-12","grid":"RE9II0JSQURTI0FTVEkjRUdHTUFOClVOTyNSRUdJQSNZVUFOI1ZJUlRVRQpORU9ORUZPUlRFTk5JUyNPUkFOR0UKRElWSU5FI0tJTiNCTEFDS1RJRSMjCkVMRUNUUkEjRUxJQSNOQUUjTlNFQwpFTFNFI1JEQSNBTlRFRUQjUkVUUk8KIyMjUlVBTExSSUdIVCMjTU9SU0VMCkFLQyNTTElNRSMjRU5ETUFOI1lTTApST0RJTiNCQUNLUyNBRU9MSUFOIyMKQkFOVEFNIyNUSUVTI1NBSU5URE9NCk9MRVMjRVpMSVNURU5JTkcjT1JDQQpSQUlOVFJFRSNTQVRPIyNOQU5PT0sKIyNHT1VMQVNII1RIUk9FI0xFTU1FCkFTSCNUSUxTSVQjI0dSQVNTI0VFUgpSSUJCT04jI1NBUVVFU1RJT04jIyMKQVJPQVIjTUlOR1VTI09BSyNBQ09QCkJFUlQjTUFHI1NBQ1MjVE9SVE9OSQojI0hJQkVSTklBI0dJRyNSQUNIRUwKQ0xPU0VUI0lWTEVBR1VFU0NIT09MClJJT1RFUiNURUVTI0hBV0tFI1JOQQpVUERBVEUjRVNTTyNUUkVZUyNURVI="},{"title":"5/13/02 GEOGRAPHICALLY CORRECT","author":"by Marjorie Berg, edited by Stanley Newman","date":"2002-05-13","grid":"UEFQQSNBQ01FI1NURUlOCkFNRU4jU0hJUCNPUkFURQpOT1JUSFNJREUjU0FTU1kKSUNFI01FQURFI09VVCMjCkNPU01PUyNMU1UjTUlTUwojIyNPU1NJRSNTRUFOQ0UKT0hJTyMjQ09BU1QjRE9FCkNFTlRFUk9GR1JBVklUWQpFRFQjRE9OTkUjI0VBVEEKQUdIQVNUI09TVEVSIyMjCk5FRUQjSEFXI0VYQUNUQQojI1dPVyNSSFlNRSNIT0MKQVJFTkEjREVFUFNPVVRICk5PU0lSI0VSTk8jVFJFRQpBTlRTWSNORVNTI09MRFM="},{"title":"5/14/02 GET MOVING","author":"by Richard Silvestri, edited by Stanley Newman","date":"2002-05-14","grid":"U01BTEwjVEVTUyNCQUNLClRBTElBI0FSSUEjVUxBTgpFRElUUyNUSU5ZI1pFUk8KTUFLRVRSQUNLUyNaRVNUClNURVJFTyMjSU9UQSMjIwojIyMjRE9aRU4jQUxUQVIKTUFSQyNURVgjU1RPT0dFCkFMT1UjRU5BQ1QjTk9SQQpTSVRURVIjQ09ZI0dMQUQKU1RFQUsjU1RPTEUjIyMjCiMjI05FQ0sjI0VOVEVSUwpTT0xEI0hJR0hUQUlMSVQKRVZFUiNBTU1PI01BSU5FCk1FTlUjU1BBUiNFUk9TRQpJUk9OI01ZTkEjTEFURVI="},{"title":"5/15/02 GEE WHIZ","author":"by S.N., edited by Stanley Newman","date":"2002-05-15","grid":"T0tSQSNBUkNTI0hBTk9JCkxFQVIjQ09QRSNZSUVMRApFUlRFI0hVTEEjRFJJTEwKR1JFQVNFR1VOI1JFTEFZCiMjI0NBU0VTI0NPRCMjIwpDQVJPTSMjI0hPRyNTU1QKQVJJRCNBU1NVTUUjQ0NJCkdPVkVSTk9SR0VORVJBTApFU0UjRU5MSVNUI1NBTFQKWUVUI0RJRCMjI0FDTUVTCiMjI0FCRSNUSUFSQSMjIwpQTEFaQSNHRU5ERVJHQVAKUkVDVVIjT0hOTyNHQVZFCklOVFJPI1NFRVIjT1JFUwpNQVZFTiNIRVJFI1RZUk8="},{"title":"5/16/02 CANINE FAVORITES","author":"by Patrick Jordan, edited by Stanley Newman","date":"2002-05-16","grid":"SkFERSNDQVNII0FCTEVSCkFCRUwjTElLRSNMQVVSQQpSVUZGTkFERVIjTVJCSUcKU1RZI0FORVcjVE9LRU5TCiMjI1dJRyMjQkVOUyMjIwpTQVBPUiNTV0FORElWRVMKRVpJTyNGRUFSUyNNQVhJCkdVTEYjQU1JR08jUExFRApBUkFCI1JJVkVSI1NVUkUKUkVGTEVDVEVEI1BPRVRTCiMjI0lOUkUjI0RJTiMjIwpDSEFUVFkjQkFJVCNBU0gKTUFJWkUjQVJGQ0FSTkVZCk9SREVSI1RJUkUjRUtFRApORUFSUyNNT09EI0ZBTUU="},{"title":"5/17/02 TAKE A LOAD OFF","author":"by A.J. Santora, edited by Stanley Newman","date":"2002-05-17","grid":"UkFJRCNUQVVQRSNBR0hBCkVTTUUjT1dOVVAjR1JJRApUSEVMQVBPRlRIRUdPRFMKT0lMI0NPS0VTI1JJU0UjClJFREFDVEVEI0NBRVNBUgpUUkFDRSMjI1BBVCNFV0UKIyMjVU5QSUxFRCNVU0FGCiNTSVRUSU5HUFJFVFRZIwpBQ05FI1BSRVNFTlQjIyMKTVJTI0xJRSMjI1RFUlJBCk9VVFNBVCNSRVRJUkVFUwojUFJBTSNDT1JPVCNJTFMKQ0xJTUJVUE9OTVlLTkVFClJFRE8jS0FUSUUjV0VOVApVU0VTI0VTU0VTI0FSVFM="},{"title":"5/18/02 SATURDAY STUMPER","author":"by Anna Stiga, edited by Stanley Newman","date":"2002-05-18","grid":"UFJPVEVHRVMjU1BBU01TClJFREFMRVJUI0xBTkNFVApPTERHTE9SWSNBQ1RPTkUKVEFCUyNERUxFVEUjTE9XCkVQQSNTRURFUiNTSEFSUApJU0xFVCMjU09QI09SQ0EKTkVMU09OUyNJUkFOSUFOCiMjI0NST1AjQ09NRSMjIwpTUFJBWUVSI0FNSVNUQUQKVFJJUCNMSUQjI1NUT1ZFClJBVkVTI1RFU1RTI1NJUwpBTEkjQ09aSUxZI1NUQVQKVElFRFVQI0NBUFJJQVRJClVOUk9CRSNFVkVBUkRFTgpTRUFNQU4jUkVTVEVBU1k="},{"title":"5/19/02 GIVE AND TAKE: Phrases that start one of two ways","author":"by Robert H. Wolfe, edited by Stanley Newman","date":"2002-05-19","grid":"SUJJUyNBTUFOQSNDUklNRSNUUklPCldBTEsjTUFMRVMjUkVNSVQjT1VTVApBU1NFQ1VSSVRZI0FQT1RTSE9UQVQKU0VBV0FMTFMjTEVWQU5UI0VUSE5PCiMjI0VSRSMjU0FMRVMjI0FOTyMjIwpBSEFSRFRJTUUjSU5UT0FDQ09VTlQKQkVTUyMjRFVMTFMjI1RJUkUjRE9FCkFDSCNQTEFTTUEjU1BPREUjSURMRQpUSEVHT0FIRUFEI1BMRUFTVVJFSU4KI0VOUklDTyMjI1RBVVMjI1NPUkVTCiMjI0FTSyMjQU1JU1MjI1BVTiMjIwpMQVRIRSMjQVJPTiMjI1NVUkVUTyMKQVJFQVNPTkZPUiNCWVNVUlBSSVNFClNFQU0jUkFUT04jTEFUVEVTI0dBUgpTSVMjUEFJUiMjQVRQQVIjI0FSS1MKT05FU0VMRkFJUlMjQUJBQ0tTRUFUCiMjI0lUUyMjTk9ISVQjI0hPQyMjIwpBSVNMRSNMSVNURU4jQ09BTEVTQ0UKRlJFRVJFSU5UTyNGT1JHUkFOVEVECkFNRU4jQU5HRVIjRVhBTFQjVE9ORwpSQVBUI1JFQVBTI1JPQkVTI1NBVEU="},{"title":"5/20/02 PATTERNS","author":"by Lee Weaver, edited by Stanley Newman","date":"2002-05-20","grid":"I09DRUFOI1RCUyNHQUJTCkFTSE9SRSNSQUgjQUxFRQpTQ0VORVMjQUdSQVJJQU4KVEFDI1NUUklQRURCQVNTCklSS1MjI0VMSURFI1NURQojI1VOQ0xBU1AjIyMjIyMKVEFQRVJFRCNFTkNPREVSClNOT1JFUyMjI0VVUk9QRQpLSU5ERVNUI0VSUkFUSUMKIyMjIyMjSE9MRFNUTyMjCk9FRCNGQUlUSCMjRU5EUwpGTE9XRVJDSElMRCNFUkEKTUlOSUJJS0UjRVJBU0VTCkFURU4jU0VSI0dBUklTSApORUVEI0VOUyNTV0lTUyM="},{"title":"5/21/02 STREET TALK","author":"by Bob Frank, edited by Stanley Newman","date":"2002-05-21","grid":"UkVMQVkjTUFDI1lBQ0hUCk9NRUdBI0VSQSNPUFJBSApFU1NFTiNESVNLRFJJVkUKIyMjRUtFRCNURUFTRVJTCkFTQSNFTExFUlkjI0RFRQpTVVBSRU1FQ09VUlQjIyMKTkVISSNPUk8jUExPVkVSCkVESVRIIyMjIyNTTklERQpSRURFQUwjTURTI0FERVMKIyMjU0hJUFBJTkdMQU5FClNIRSMjQklHVE9FI0xTVApPQVJTTUVOI0hXWVMjIyMKRklSRVBMQUNFI1NVR0FSCkFST01BI1RBUiNFTElURQpTWVJJQSNBRFMjUlVORVM="},{"title":"5/22/02 FOOTSIE","author":"by Fred Piscop, edited by Stanley Newman","date":"2002-05-22","grid":"RU1CQVIjRkxPRyNTQUNTCkxPSVJFI1JBUkUjS05PVApTSE9PRkxZUElFI0lETEUKQVNTVVJFI1BPU0lUUk9OCiMjI1NFQUwjTEVUVEVSUwpBUFNFUyNBQkUjU0VXIyMKTEFII0hBTkEjUEFSU0VTCkFUT1AjUkFUU08jU0hNTwpTSEVFTlMjT1BJRSNVTUEKIyNTUkkjRFJVI1NIRUVQCkFSVElDTEUjTkFQQSMjIwpTRVJHRUFOVCNBT1JUQVMKSURJRSNNT09TSFVQT1JLCkRZTkUjQVRNTyNTRU5OQQpFRUdTI1JFRUQjRVJHT1Q="},{"title":"5/23/02 MUSICAL QUESTIONS","author":"by Sally R. Stein, edited by Stanley Newman","date":"2002-05-23","grid":"U0hBVyNUSUJCUyNTUEFOCk9BVEgjQVRCQVQjSVJNQQpBTE1BI0lDT05PI1RJQVMKUE9TVCNXSFlET0ZPT0xTCiMjI1NIQVlTI0xBVVJJRQpLRUVORU4jI0RJUlRJRVIKR0FWRUwjT1NJRVIjIyMjCkJSRVdTI1dITyNBUEFDRQojIyMjSUxMRVIjR1VSVVMKUkFQSU5FUyMjUlVTU0VUCkFMQVNLQSNQT0VUUyMjIwpGQUxMSU5MT1ZFI1lPWU8KRlJFRSNTSUxBUyNDSEVUCkxVU1QjT1JBVEUjQU5BVApFTVRTI05BUkVTI1RPUk8="},{"title":"5/24/02 NEW YORK STORIES","author":"by S.N., edited by Stanley Newman","date":"2002-05-24","grid":"T1BQT1NFI0FTVE9OSVNIClBIQVNFRCNSRUFTT05FUgpUSUxMRUQjTUFMTFJBVFMKU0xFRVBZSE9MTE9XIyMjCkZMT1IjI0lSQUUjI1RTSwpPSUwjU09UI0JST01JREUKUlBJI1RXSUcjI1NFRUlOCiMjVFdFTlRZWUVBUlMjIwpCQUhJQSMjTUVFSyNUTEMKQ0xJTktFUiNBS0EjSE9FCkRFQyMjU0VFUiMjU0VMTAojIyNSSVBWQU5XSU5LTEUKQlJBSU5JRVIjQUxJTkVTCk1PTlRSRUFMI1JFUE9SVApXT05URURMWSNUU0VUU0U="},{"title":"5/25/02 SATURDAY STUMPER","author":"by Daniel R. Stark, edited by Stanley Newman","date":"2002-05-25","grid":"Qk9BVFNXQUlOI1NVRURFCkFMTEFUT05DRSNBTlRBTApCRUFORVJJRVMjQkxBTksKWU9OI0VNUyNTVFJJUEVTCiMjI0tMRUUjI0hJS0VTIwojQ1JFRUQjQk9PTkUjIyMKV09PRUQjRE9SU0FMRklOCkFUT1AjUEVXRUUjSU9MQQpHRU1TVE9ORVMjTUVMRUUKIyMjVEVTVFMjVFVTS1MjCiNDT0FMUyMjQlVTVCMjIwpNQVJCTEVTI09UVCNGRUQKRVJBU0UjSE9ST1NDT1BFCk1PVE9SI09WRVJFQUdFUgpPTUVOUyNQQVNTRU5HRVI="},{"title":"5/26/02 PUZZLE PEOPLE: More familiarly on a first-name basis","author":"by Sally R. Stein, edited by Stanley Newman","date":"2002-05-26","grid":"QVdBSVQjQ0RFRiNFRUtTI1RSQURFCkNJTkNPI09FTk8jWUlOUyNSRVBFTApFTEtFU09NTUVSI0VMSUVXSUVTRUwKU1RBQ0NBVE8jRUZMQVQjQVNTRVNTCiMjI0hBVEUjR1NVSVQjRVJURSMjIwpTUElFTFMjQlJFRUQjTUVHQSNPUkcKQ0VOU0UjQVJJRUxTSEFST04jTUFFClJFR1QjQUxPRSMjI0FSSUQjQ0FWRQpVVkEjQVJMT0dVVEhSSUUjTFVSRVMKQkVTRUFURUQjUkhPREEjUEVCQkxFCiMjV0lSRVMjRUtJTkcjQ0FORVIjIwpDUkVET1MjRUxFTkEjWUFSRFNBTEUKTElORU4jRVZFTEtOSUVWRUwjRE9NClVTU1IjS0lFViMjI09MQU4jUExJRQpFRU8jSVJFTkVDQVNUTEUjREVFUkUKU1NOI1NBSVMjQVJFQVMjU0FXWUVSCiMjI0NPTU8jQUJFVFMjQ1VSVCMjIwpSRUdBTEUjQkxBU1QjRk9SS0VFUFMKQVZBR0FSRE5FUiNFRE5BRkVSQkVSCk1BTUVUI0FBUkUjUklNUyNTRVJSQQpTTkFSRSNNSVRUI1NQQVQjVFJPVFM="},{"title":"5/27/02 SWEET TALK","author":"by Lee Weaver, edited by Stanley Newman","date":"2002-05-27","grid":"Q0FKVU4jI1JJTSNPVVJTCkFCQVRFUyNFTkEjS05FRQpUQU1FU1QjU1VSUFJJU0UKVFNQI1NVR0FSQ09BVEVECllFQVMjI0VMSU9UI1NUWQojI0NIQVNURU4jIyMjIyMKRVNLSU1PUyNHVU0jSk9UCkRFRVBFUiMjI1NFQ0VERQpTQUQjTkVEI1BFQVJMRUQKIyMjIyMjRVRFUk5BTCMjCldZRSNHQUJPTiMjQllURQpIT05FWU1PT05FUiNGRUQKT1VUU01BUlQjR0lWSU5HCk9SRVMjU0FMI09ERVNTQQpQRVJFI1NIRSMjRVRIRVI="},{"title":"5/28/02 QUALITY CONTROL","author":"by Patrick Jordan, edited by Stanley Newman","date":"2002-05-28","grid":"Q0hJVEEjVE9URU0jQU1JCkFVREVOI0FCT1ZFI0pBTgpHUkVBVFdISVRFU0hBUksKRVRBI0hPT1QjI1NJWFRZCiMjI1BFS0UjU1VJVCMjIwpDUkVBTSMjUkVORSNBQ0gKSEVMUCNHT09ERlJJREFZCkFQU0UjSU1BR0UjTk9STQpGQUlSSEFJUkVEI0ZSQU4KRVlFI0FOVFMjI1RFTlRTCiMjI0JMVFMjQkxVUiMjIwpTSU5BSSMjSVJPTiNSQVcKUE9PUkJPWVNBTkRXSUNICkVXRSNVUEVORCNSRVRSTwpDQUwjVEFTVFkjQURaRVM="},{"title":"5/29/02 HOUSEHOLD HELP","author":"by Fred Piscop, edited by Stanley Newman","date":"2002-05-29","grid":"TkFWRUwjSE9MRSNTQ0FSCkFST01BI09NRU4jV0FTSApNSU5VVEVNQUlEI0FQU08KIyMjU0VWRU4jUk9UVEVOCkJVQiNSQVkjRlVSQ0FURQpVTlJFQUQjR0FOREhJIyMKU1RFRUxFI09SU08jTklLCkNJVEUjI1RPRSMjRUNPTgpIRVQjU1RBTiNBQ1RPTkUKIyNCQVRPTlMjUkVDT0lMCkZPVUxVUFMjUk1OI0tBVApMQVRJTlMjQkVFVFMjIyMKSVNMRSNQSUxFRFJJVkVSClBFRU4jSVJJUyNBREFHRQpTU1JTI05BUEUjTEVOT1g="},{"title":"5/30/02 STORMY WEATHER","author":"by Daniel R. Stark, edited by Stanley Newman","date":"2002-05-30","grid":"UklQRSMjQkVMVCNTUEVECkFSQVQjUFVSRUUjQ0FSRQpNQVJDI0lETEVEI09ERVMKIyNUSFVOREVSU1RSVUNLCkRBSCNQQVkjIyNIRUFUUwpBUkVBUyMjRUlHRVIjIyMKRlVORCNQT1RURUQjU1JBCkZMT09EU1RIRU1BUktFVApZRU4jRVNURVJTI1RZUE8KIyMjQUNUT1IjI0hFTEVOCk9NRUdBIyMjU0VBI0lMRQpMSUtFTElHSFROSU5HIyMKSVRJTiNXRUlSRCNPSE1TClZFTlQjQU5ERVMjU1RBVApFUkdTI1NURVcjI0VTUFk="},{"title":"5/31/02 OPTICAL ALLUSIONS","author":"by Shirley Soloway, edited by Stanley Newman","date":"2002-05-31","grid":"I01BWSNESU5BUiNFS0VTClNPU08jRU5BVEUjUkVBTApFQVNZT05USEVJI05FVkUKQU5UT05JTyMjR0FTUEVECiMjI1NTUiMjVU5JVFMjIwpFU1MjSU9QRU5FUiNBQ0UKU1RFRUQjQVZJRCNFTk9TClNJRVZFI05JVCNQT0lOVApBTElBI0FDVEUjQU5PREUKWUVOI0lTSEFET1cjTk9SCiMjR0VTU08jI0ROQSMjIwpBTklUUkEjI1NFRVJFU1MKTUFUSCNJV0lUTkVTU0VTCk9UT0UjTE9ERVMjT0FSUwpTT0lMI1NLQVRFI05VQiM="},{"title":"6/01/02 SATURDAY STUMPER","author":"by S.N., edited by Stanley Newman","date":"2002-06-01","grid":"QkFTUyNTS0lUUyNJVENICklTVE8jRU5ORUEjTkFSQQpTVFVOI1JFVUVMI0dMT1AKTU9STiNWRVJORSNFTEFMClVSR0UjSURFQVMjTklLRQpUSUVUQUMjIyNQUlVORVMKSEFTU0xFRCNGUklFTkRTCiMjIyNHRUUjSE9HIyMjIwpQUk9HRU5ZI0FNSEVSU1QKUkVQT1JUIyMjT1RUQVdBCkVDSE8jUklBTlQjRVZBTgpFWUVTI0FTU0FJI1JJR0cKTUNMSSNOT1RTTyNOT01FClBMSUUjQ0xFQU4jQUxBTgpURUFSI0VBUkxTI0xJTlQ="},{"title":"6/02/02 FOOD FAVORITES: What certain people should like best","author":"by Frances Burton, edited by Stanley Newman","date":"2002-06-02","grid":"SElQIyNPUFRJQyNEQURBIyNQRVRTCkVHQUQjU0xJR08jQU1BU1MjQVJFQQpST1NFI01JQU9XI1JFREhFUlJJTkcKQlJPV05JRVMjUEFOTkUjVklFTk5BCiMjI0lPVVMjI09XRUQjVElORSMjIwpTQ1JFQU0jQVNLRUQjT1dMUyNTQU0KTEVBU0gjQk9XRUQjI1JJTEUjQ0RFCkVBU1QjQk9OTyMjU0NFTkUjVFJPVApFU1AjQ1JJRVIjVEFIT0UjVEhFUkUKUEVCQkxFUyNEUkFLRSMjVEhBV0VECiMjRUxBVEUjRklYRVMjTU9VTkQjIwpBUlJFU1QjI0lERVNUI09SREVSRUQKSEVSRVMjTEFTRVIjTkVTVFMjSUxPCkVOSUQjSElHSFMjI1VTRVMjRVZFUwpBVEUjTEFORSMjQkFUVFkjQlJFVkUKREVTI0xZRVMjTEFQU0UjTUFSUkVECiMjI0RBV04jUkVOTyMjTE9MQSMjIwpET1JFTUkjU0FWRVMjRElWSU5JVFkKUkhVQkFSQlBJRSNUUk9WRSNET1JBCkFJTlQjRVJBU0UjTEVWRVIjU05JUApUT1RTIyNBUkVTI0VWRU5TIyNTT1M="},{"title":"6/03/02 THE DESCENT OF ANIMALS","author":"by Sally R. Stein, edited by Stanley Newman","date":"2002-06-03","grid":"U1BDQSNBU0FQI0FERUxFCkhFQUwjQ09ORSNSVUxFRApBUkxPI0lTRUUjSUNJTkcKV09MRlNET1dOI1NLQVRFClNUQVRFIyMjI0RFUyMjIwojIyMjV0FERExFI0RPT1IKQ0FMRiNUUkFJVCNPR0xFCk9SQUwjTUFZQkUjV1JFTgpURVJJI09LQVlTI05FU1QKU0FLRSNTRU5BVEUjIyMjCiMjI1NTVCMjIyNESVRUTwpSSE9ERSNCRUFSU0RPV04KQUFST04jQUxUTyNFUkFTClNURVdTI0NMT0QjQU1JRQpQSE9ORSNIQVpFI1NFTlQ="},{"title":"6/04/02 ON THE HOUSE","author":"by Lee Weaver, edited by Stanley Newman","date":"2002-06-04","grid":"QlVTSU5HI0dSQU0jQVJFCk9SQVRPUiNSRUZFUlJBTApFU0tJTU8jRUFSTVVGRlMKUkFJU0VUSEVST09GIyMjCiMjIyMjVE9UIyMjRkVXIwojV0lORE9XU0hPUCNORU8KTEFOQUkjIyNVTlNDUkVXCk9MRFNURVIjQkVIT09WRQpTS0lUVExFIyMjQUxMSU4KVElBI09GRlRIRVdBTEwjCiNOTkUjIyNBUk0jIyMjIwojIyNUQUtFVEhFRkxPT1IKUFJFQ0lOQ1QjTk9PRExFClJVU0hNT1JFI0RPTkVJTgpZRVMjU1RVRCNTVEVSTk8="},{"title":"6/05/02 A GUY THING","author":"by Fred Piscop, edited by Stanley Newman","date":"2002-06-05","grid":"QUJSQU0jTU9UTyMjV0hPCkxPSVJFI0FNRU4jQkVBSwpNQUNBREFNSUFTI0VMTEEKU1RBTkRQQVQjI1BFVFRZCiMjIyNMRVMjT1BBTCMjIwpHQVJCRVIjRlJJWlpJRVIKT0RPVVIjSElERSNFTU1FCkxPVUQjUEFSRUQjQkFCUwpEUkVXI09WRVIjQ1VHQVQKQU5ORUFMRUQjU09CRVJTCiMjI0lST04jR0VOIyMjIwpKT1VTVCMjUFVSU1VBTlQKQVhMRSNGSUxJQlVTVEVSCkRFQVIjT1BVUyNNRUFSQQpBTk4jI1BPU0UjRVNUT1A="},{"title":"6/06/02 ROAD WORK","author":"by Daniel R. Stark, edited by Stanley Newman","date":"2002-06-06","grid":"QUZSTyNGTElQI0NMSVBTCkNMQUQjUk9UQSNPSEFSQQpSVVNFI0VFTFMjVkFORVMKRVhQUkVTU0xBTkVTIyMjCiMjIyNBSFMjI0VSQVNFUwpFU0NBUEUjTU1FUyNVTVAKTE9PTiNST0FEUlVOTkVSCkFNT0NPI1RMQyNQQURSRQpQQVBFUlRSQUlMI1NBR0EKU1RFI1RIT1IjT0tBWUVECkVBUlRIQSMjQURFIyMjIwojIyNCT1dMSU5HQUxMRVkKQklQT0QjRURHRSNBSURBCkFNSU5PI1NMVVIjTkVJTApMQVRFWCNURVNTI0tORUU="},{"title":"6/07/02 PLUMB JOB","author":"by Richard Silvestri, edited by Stanley Newman","date":"2002-06-07","grid":"QUNEQyNBVEFEI0hFTUVOClNIRUEjQk9ERSNPTElWRQpQRUFSTEpBTUIjUkFOSU4KQ0VMI0FVREkjQlJJRExFCkFSVEhVUiNUUkFJTiMjIwojIyNFREVOI0VOREVBUlMKQURPUkUjQUJVVCMjTU9BCkRVTUJEVU1CQlVMTEVUUwpETkEjI05JQ0UjT1VOQ0UKU0VORFNJTiNOVUJTIyMjCiMjI09VVEdPI1RBVFRMRQpTSElOTlkjTUVBVCNSRUIKTk9NQUQjT05USEVMQU1CCk9SQVRFI1RJTkEjQUxPRQpCQVNFUiNDQUFOI0JBTkQ="},{"title":"6/08/02 SATURDAY STUMPER","author":"by S.N., edited by Stanley Newman","date":"2002-06-08","grid":"QVRBTEFOVEEjRkpPUkRTClNPTElUQVJZI1JVUEVSVApDT1JQT1JBTCNBTFRBSVIKRVRFI01ZTUFNTVkjQ1ZJCk5TQSMjIyMjQUVGI1RFRApESURFUk9UI1JITyNUSUUKU0VZTU9VUiNDT1VQT05TCiMjI0VUVEUjSFVSTCMjIwpGT1NTSUxTI0VTVEVFTVMKRVNUI1NFVCNERUhBVkVOClJDQSNTVEwjIyMjI0FMSQpSSU0jRU1FUkFMRCNESUQKQU5JVFJBI1BMSU9DRU5FClJFTkFJTCNNQU5TQVJEUwpJU0FCRUwjU05FRVJTQVQ="},{"title":"6/09/02 FABULOUS FORTIES: Having nothing to do with the decade","author":"by A.J. Santora, edited by Stanley Newman","date":"2002-06-09","grid":"U0FSQUgjTUFTU0UjU0VBRE9HUyMjCklOVVJFI0lET0xTI09SRElOQUxTIwpOSVRFUiNTQURBVCNUUkVOVExPVFQKQVNII01FU1NBR0VTI09MRU8jR09PClRFQyNFRFQjIyNMQVVSQVMjRkFMTApSRUhBU0hFRCNTTEFNIyMjUEFORUwKQURBUiMjUElUVEVSUEFUVEVSIyMjCiMjVElFQSNNQUUjIyNCRUFSQ0FUIwpQQVRFTlMjI0xQUyNQVU5ZI0VST1MKT0NFTE9UI1NMT0UjRVNFIyNTVFVOClNVUiNTSVRUSU5HUFJFVFRZI0lDRQpTQVRFIyNJUkUjQVJJRCNNQVJTSEEKRVRPTiNPUEVEI1JFRCMjRUxBVEVECiNFTkRPUlNFIyMjQ09FI05FVFMjIwojIyNBTkRZUEVUVElUVEUjI0VQRUUKU1RFTEEjIyNUQVJTI0RSRVNTQUdFCkVBUkwjTk9TQUxFIyMjTU9OI0xBUgpOQ08jUEFUSCNDQVRBTElOQSNFTEkKVElURk9SVEFUI1RBTE9OI1JFVElFCiNUSUVTQ09SRSNFUkFTRSNMRVRUUwojI0NSRVNTRVQjREFSVFMjU0xFRVQ="},{"title":"6/10/02 FAIRY TALE FRIENDS","author":"by Sally R. Stein, edited by Stanley Newman","date":"2002-06-10","grid":"UEVURVIjQkVHUyNNRU1PCklST05ZI0VSSUMjT0xFRwpDSU5ERVJFTExBI1pFQUwKS0VZIyNPTkVBTCNBQ1JFCiMjI0xJTUUjI0FPUlRBUwpIRUxFTkEjVE9XSVQjIyMKQUxPT0YjTUVEQUwjQURPCkhBTlNFTEFOREdSRVRFTApBTEUjUkFaRVMjSURUQUcKIyMjSU5TRVQjQUdFTkRBCkFTSU1PViMjQVNTTiMjIwpDQU1QI0VWRU5UIyNJT1UKVFlQTyNHT0xESUxPQ0tTClVTRVMjQUxTTyNQT09MUwpQT0xFI1NUQVIjU09OQVI="},{"title":"6/11/02 ON TV","author":"by Lee Weaver, edited by Stanley Newman","date":"2002-06-11","grid":"Q0hBUCMjRFVOS1MjUEFUClJPTEVTI0FUT05FI1VGTwpPUEVSQSNUQUxPTiNHSU4KUElDVFVSRUhBVFMjRVJFCiMjIyNDT0QjI0hPVFRFUgpSQVNQRUQjU0hPUkVTIyMKRVJJRVMjTkVJTCNTT09OCkVFTFMjQ0VBU0UjVFVORQpMQUtFI09XTFMjSEVOQ0UKIyNTVFVOVFMjSEVSREVSClBFQ0FOUyMjQUlSIyMjIwpPUlIjRklSRVNUQVRJT04KUE9FI09ET1JTI0xJVEhFClVTRSNMRURHRSNERUxJUwpQRU4jRFJFU1MjI1NMT1Q="},{"title":"6/12/02 MAKING CONTACT","author":"by Fred Piscop, edited by Stanley Newman","date":"2002-06-12","grid":"VElMVFMjQk9BUiNCVUxLClVCT0FUI09ITk8jQVNFQQpSQVBTRVNTSU9OI0JFQVQKUFJFU0VBU09OI0NPUk5ZCiMjI0VMTSMjI1NPTyMjIwpTQ0FMRSNISVRTSU5HTEUKQ1JFRVMjQUNPUk4jUlVNClJFSUQjU05JVFMjR0lHSQpBRE8jTk9PTkUjQVJORUwKUE9VTkRTSUdOI0RBRERZCiMjI0FBQSMjI0FNWSMjIwpTTUlSSyNERVRSSU1FTlQKVEVBUiNTT0NLRFJBV0VSCkFSR08jVE9UTyNFUkFTRQpHTE9XI0VST1MjREVOU0U="},{"title":"6/13/02 SOUNDALIKE CELEBS","author":"by S.N., edited by Stanley Newman","date":"2002-06-13","grid":"U1BMQVQjTUVNT1MjT1VSCkNSQUlHI0FNUExFI0NQSQpIRU5SSUtJQlNFTiNPUFMKTFNEI0ZFVEEjR0RBTlNLCkVBU0UjUkFSQSNTSU5BSQpQTEFZV1JJR0hUI01PTEwKUEVURVIjI09BSFUjUkFZCiMjI1NJUFMjQlVDUyMjIwpTRU0jVElNUyMjTEVBUFQKS05VVCNDT01JQ0FDVE9SCklMR1dVI0dFTkwjU0lUVQpKQVdPSEwjQVNPRiNTSEEKVVJVI0hFTlJZR0lCU09OCk1HTSNVTlBFTiNTQVVMVApQRVAjSEFSREMjVFJFRVM="},{"title":"6/14/02 BEING THERE","author":"by Patrick Jordan, edited by Stanley Newman","date":"2002-06-14","grid":"WkFQUyNDQVJPTSNBUVVBCklWQU4jQURFTEEjQ1VSTApUT05JI1NFREFOI0hPTkUKSU5TUElURU9GVEhFIyMjCiMjI0VOUyMjI0VBU1RPTgpCRUQjQ09NUEVMUyNPREUKQUdVQSNGVVJMI09BVEVTCkNPU1RPRkxJVklOR0lUUwpLSVRFUiNBQ0VTI0FOVEkKVVNFI0JBTktTT04jR0VFClNUUkFJTiMjI1RBVCMjIwojIyNTVElMTFBPUFVMQVIKVEFDSyNURUVVUCNGVUpJCk9CT0UjQUdBUEUjVFJBTQpNRU9XI1NPRkFTI1NFWFk="},{"title":"6/15/02 SATURDAY STUMPER","author":"by Daniel R. Stark, edited by Stanley Newman","date":"2002-06-15","grid":"U1dJR0dFRCNSQVRSQUNFCkNBTUlMTEUjRVhIQUxFUwpBUFBST1ZFI1dFQUtFTlMKUElFRFBJUEVSI1RFUlNFClVUQSMjU0VNSVMjU1RVTgpMSUNLUyNOSVRFUiNFUkUKQVNIRU4jU1RFTEUjREVTCiMjI1dPSyMjI0ZBQiMjIwpET0MjUkVTRVQjTUFSU0gKSVZBI1RFUEVFI1NUT1dFClNFUkIjTElSQVMjI1NFQQpQUklBTSNOT0JJR0RFQUwKRVJPU0lPTiNBTk5FVFRFCkxVQ0lMTEUjR0FVTlRFUgpTTkFDS0VSI1NJU1RFUlM="},{"title":"6/16/02 FOR MY NEXT NUMBER: Specially suited for digital recording","author":"by Sally R. Stein, edited by Stanley Newman","date":"2002-06-16","grid":"VEhFQkxPQiNFTUlHUkVTI0JBTkRTCk5BVElPTlMjTEVOSUVOVCNJTkVSVApUSFJFRVRJTUVTQUxBRFkjT1RIRVIKU0FFTlMjRE9DIyNUUlVMWSMjUkFFCiMjIyNTS0VMVE9OI1NQRUVEQlVNUApCUlVORUkjSVJSRUcjIyNORU8jIyMKTU9aQVJUI0VJR0hUREFZU0FXRUVLCldXSUkjI0FSQyMjQkVMQUlSI0RZRQojIyNGTFVURSNXQVJMT1JEI1BFRUwKQU1BI0lOTiNNT0IjQU5EI1NVUkZTCkZJVkVGT09UVFdPRVlFU09GQkxVRQpGTEFLRSNDT0UjRERTI0FSUCNFTFkKRUxMRSNNT1RUT0VTI0JMQURFIyMjCkNJTyNSRVNFTkQjI1NFRSMjQUxJVApURU5DRU5UU0FEQU5DRSNMQVJFRE8KIyMjT0VEIyMjU1BPT0YjRUxQQVNPClNBRERMRUJBRyNFUlJBVElDIyMjIwpISVAjI0xVR0VTIyNFTEkjT05DVUUKSVNMRVMjT05FSEFORE9ORUhFQVJUCkZMVVNII1lFU09STk8jQ1JPQVRJQQpURVNUWSNTV0VFVEVOI1RBTExFU1Q="},{"title":"6/17/02 A MATTER OF TIME","author":"by Sally R. Stein, edited by Stanley Newman","date":"2002-06-17","grid":"V0FSUCNMT1NFUyNNT0JZCkFWRVIjQVJPU0UjSURFQQpTRUNPTkRCQVNFI05PUk0KUFJVTkUjI0tFTkJVUk5TClNUUkVUQ0gjU1RBVCMjIwojIyMjU0hFUyNPUkVMU0UKTk9TSCNBTE1TI1NNQUxMCk9MRU8jUExBTlQjQVZJUwpWRU5VUyNPUkVPI05BREEKQVNUUk9TI1RBUkEjIyMjCiMjI0dVVFMjS0lOR0RPTQpTVEFMTE9ORSMjVFJJQ0UKSU9UQSNEQVlEUkVBTUVSClpPT1MjR1JFRU4jU0xBRwpFTE1TI1lFU0VTI1NZTkU="},{"title":"6/18/02 CLOSE-UPS","author":"by Lee Weaver, edited by Stanley Newman","date":"2002-06-18","grid":"U0FNRSMjQkFNQSMjU0hFClRPVVRTI1RSQU1TI05BRwpPTlRIRUJVVFRPTiNBTEEKUEVUSVRFI1NUUkFQUEVECiMjI0NVUkQjI0FSSUQjIwpQUk9TUEVSIyNMRUVSUyMKVUhGI1NUSVJTI1NDQU5UClJFRlMjI1BBVyMjRUdJUwpMQVRIUyNTVElGRiNPUEEKI1NIQVBFIyNQSUxTTkVSCiMjRUxJUyMjRUNPTCMjIwpBVEhMRVRJQyNIT09QTEEKUk9PI0xBQ0VDVVJUQUlOCkVHTyNTVEVSTiNTSElORQpBU0sjI0VERU4jI1NMRVc="},{"title":"6/19/02 BY DEGREES","author":"by Daniel R. Stark, edited by Stanley Newman","date":"2002-06-19","grid":"T05DRSNST01QI1NMQVRFClBFQUsjQUxFRSNFQVJMUwpFUkxFI1RJTkUjVklOQ0UKQ09MRFNIT1VMREVSIyMjCiMjIyNIRVMjI09OU0FMRQojRURHQVIjQkFSVCNNQU4KQVhJT00jV0FSTUhFQVJUCkNIRVQjI0FMSSMjSUxJRQpIT1RIRUFERUQjRlJJQVIKRVJFI1NQRUQjU0xFRVQjClNUUkFQUyMjUkFFIyMjIwojIyNDT09MSEFORExVS0UKQkFZT1UjT09aRSNJUklTClVTRVJTI09MRVMjRkFDVApESUFORSNURVNUI0VMS0U="},{"title":"6/20/02 BUILT-IN RADIOS","author":"by Fred Piscop, edited by Stanley Newman","date":"2002-06-20","grid":"RVRBTCNTTE9CI0JJTkdPClRJTEUjQ09EQSNJVklFRApIQUxGTUlMRVIjR0FSTkkKSVJBVEUjI1NOVUJOT1NFCkNBTllPTlMjVVNFIyMjIwojIyMjV09MRk1BTkpBQ0sKUEFORyNERUwjI0RPUkVOCk9MRU8jU1dBVFMjV0lORQpUT0xMUyMjS09II0xBVEUKU0VMRk1BREVNQU4jIyMjCiMjIyNJUkEjVFdPU1RBUgpDTEFUVEVSUyMjU09BVkUKTElNSVQjUkVMSUVGTUFQCkFMSU5FI09NRU4jQVBTTwpXSURFTiNXSU5EI1JBVFM="},{"title":"6/21/02 ON BROADWAY","author":"by Robert H. Wolfe, edited by Stanley Newman","date":"2002-06-21","grid":"TUlNSUMjS0lEUyNMRUZUCkFSVUJBI0VESUUjSUdPUgpTQUxFTSNSRVNUI05PUkEKU1RBR0VDT0FDSCNFTU1ZCkVFTiNUQVNTTyNDU0EjIwojIyNTT1JFI1NQQVdORUQKI0JJQyNPTkUjRUxPSVNFCkFSTk8jTEVUTUUjTUFBTQpIRUFSWUUjQU9MI0FDVSMKQUxMRUFSUyNTSUdOIyMjCiMjQUJNI0FSRU5BI1JBRQpOQVRPI1BMQVlHUk9VTkQKT1NIQSNSQU5JI0FSSU5HClNFRVIjT0RJTiNHRU5JRQpZQVJEI1BBTkcjRVNTRVM="},{"title":"6/22/02 SATURDAY STUMPER","author":"by Anna Stiga, edited by Stanley Newman","date":"2002-06-22","grid":"U1RBVCNBRE1JVCNMRU5TCkFPTkUjQlJBTkQjT1BBTApWSVRBI0JPVVRTI1ZJU0UKRUxFQ1RST0RFI0ZBTFNFCiNTTEFNI1BFUiNVQk9BVApIT09LQUgjI0ZBTExHVVkKSU1QRU5FVFJBQkxFIyMjClNFRSMjU0FVQ1kjI1BHQQojIyNCVVNJTkVTU0NBUkQKQ0FSQU1FTCMjU0NBTElBCkFURVVQI0dBTCNBUklEIwpTVEFCUyNBTkFTVEFTSUEKSElMTCNTVElOVCNDQVJTCkVMTEUjUEVTQ0kjQURPUwpXQVlTI0ZSRUVSI1NFTlQ="},{"title":"6/23/02 HOUSE CALLS: Residential wordplay","author":"by Fred Piscop, edited by Stanley Newman","date":"2002-06-23","grid":"U1BPVCNTQ09GRiNQTEVEI0RFTklTCkNBUE8jUEFQQUwjUk9MRSNFVkVOVApVU1RSRUFTVVJZI0VMTEEjVElBUkEKUE9TVFVSRVMjQk9XTElOR0FMTEVZCiMjI0lCRSMjTVlSQSNTTkFJTCMjIwpNSUxMSSNMRUkjRVNTI0FMTEVXSVMKT1NPTEUjT1dOUyNIT1AjIyNTSU1JClBJQ0EjQ1JFRUwjRUxJQSNTVEVBTQpFVEEjUkFJTFJPQURERVBPVCNOR08KRElMTEVSI0xBTVAjI1NUVVJHRU9OCiMjVEFCT1IjTE9TRVIjU1RFRVIjIwpTUEFUVUxBUyMjT05FQSNQQVJTT04KTElWI1RFTk5JU1NUQURJVU0jVFZBCklURU1TI0RPTlQjRURJQ1QjUkFJRApNT1JPIyMjQlJBI1JFRUsjRFVOTkUKRU5OT0JMRSNJVFMjUlVZI0VOREVSCiMjI1JFRURTI0lSRVMjI0JBVCMjIwpLQVJBVEVTQ0hPT0wjRUFSTE9CRVMKSU1BR0UjRVJJTiNDQUREWVNIQUNLCk5PVkVMI0xBVkUjSU5ESUMjSVRUWQpLUklTUyNTUEVEI0RBWU5FI01IT1M="},{"title":"6/24/02 PAY YOUR DUES","author":"by Sally R. Stein, edited by Stanley Newman","date":"2002-06-24","grid":"TUFNQSNQUk9EI0ZTVE9QCkNCRVIjTEVOQSNSSE9ORQpYRU5BI09QRVIjQU9SVEEKQ0xVQlNURUFLI05PTk9TCiMjIyNVU0EjUklDSyMjIwpWQUxVRSNUQk9ORSNSVEUKT1ZFUkRPI0pPRSNQQUlOCkxPREdFQUNPTVBMQUlOVApUSUdFI1RBUiNURU5ERVIKQURFI0ZFUk5TI01FU1NZCiMjI1pFUk8jUFJPIyMjIwpTRVdPTiNVTklPTkpBQ0sKQVdBUkQjU0VSQiNBTE9FCkdFTlJFI0VSSUUjTUFMRQpBU1RPUiNMT1RTI1NOQVA="},{"title":"6/25/02 COLORFUL CLOTHING","author":"by Lee Weaver, edited by Stanley Newman","date":"2002-06-25","grid":"I1RVTkVEIyNDSEFPVElDCkNBTklORSMjT0FLTEFORApBQlNDT05EI09SSUVOVFMKQkxVRVNUT0NLSU5HIyMjCkxFTlQjI09VSSMjI0FERQpFREdZI0dSRUVOQkVSRVQKIyMjI0hSUyMjT1VUTEVUClRBSVBFSSMjI0lOQ09NRQpBU1NVUkUjI0FTSyMjIyMKV0hJVEVHTE9WRSNDQVNUClNFTiMjI0lUTyMjSU5UTwojIyNZRUxMT1dKQUNLRVQKU0FNVVJBSSNTQVJBTEVFClBSQUxJTkUjI1JJREVSUwpBUFBFTkRTIyNTTEFUUyM="},{"title":"6/26/02 HIGH SCHOOL SCHEDULE","author":"by Fred Piscop, edited by Stanley Newman","date":"2002-06-26","grid":"QkFSQlMjREFNUCNSRUVMClVCT0FUI0VMSUUjRUxTQQpERUxMQSNGVVpaWU1BVEgKU0VMRU5JVU0jI09JTEVSCiMjIyNET1MjQVVHUyMjIwpQSURHSU5FTkdMSVNIIyMKT0NFQU4jI0VSQVMjQUFICkNPVFkjUk9XQU4jT0dMRQpPTkUjU0FSQSMjRkxFRVIKIyNST0NLRVRTQ0lFTkNFCiMjI1JVRVMjSEFSIyMjIwpBUklFTCMjVEFQRURFQ0sKSlVOR0xFR1lNI01BTExFCk9TTE8jTEFOQSNBTExBWQpCRUFOI0xJRU4jTkVFRFM="},{"title":"6/27/02 SOUNDS GREAT","author":"by Bob Frank, edited by Stanley Newman","date":"2002-06-27","grid":"QUxBI0NJQU8jI1NUUEFUCkxJRCNBVk9OIyNXRUxDSApGTEFUVElSRSNTRU5FQ0EKIyNQRU5FVFJBVEUjQVJSCkVTVFJBREEjSFlQRURVUApCTElNUCNMQUUjRUxTRSMKUkVWSVNFI0JBSEFJIyMjCk9XRU4jU1BBREUjTVRHRQojIyNBVExBUyNGQUlSRVIKI1BFVEEjTkVTI1VOSU9OCk5JR0VSSUEjSU1QQVNTRQpBTEcjSFVNSUxJQVRFIyMKVEFOREVNI0RJWElFQ1VQCkFUT05FIyNBQ0VSI1RLTwpMRUdBTCMjU0FTUyNTRUU="},{"title":"6/28/02 SOLID CITIZEN?","author":"by S.N., edited by Stanley Newman","date":"2002-06-28","grid":"V0FMUlVTI1NIRUwjU0FTCkFCQk9UVCNBRVJPI1VSTgpHQVNDQVAjR0FJTiNOQ08KIyMjI0hFU0FSRUdVTEFSCkVZUkUjVE9OIyNMQUlORQpCRUFUTEVTI1RXRUVURVIKQkFZT1UjI0hBSUcjIyMjCiNIRU5OWVlPVU5HTUFOIwojIyMjQ09BVCMjRUVMRUQKQkVMTEhPUCNBRERJU09OCkVNRUVSIyNXT0UjUk9OQQpST0NLT0ZKRUxMTyMjIyMKSVRUI09SQUwjUFJJTUFMCk5FRSNNRU5EI0hFTEVOQQpHUlIjU0VFUyNJU0xBTkQ="},{"title":"6/29/02 SATURDAY STUMPER","author":"by Daniel R. Stark, edited by Stanley Newman","date":"2002-06-29","grid":"QkVIRU1PVEhTI1BSVU5FCkVHT01BTklBQyNMRU1VUgpTQVBPRElMTEEjQU1QTEUKT0RFI0RPRSNEQU5JRUxTCiMjI1BFTkQjI0xFTkRTIwpUT09UU1kjU09MVEkjIyMKQUdMRVQjSEFSQVNTSU5HCldFQVIjUlVHQlkjQ09PTApTRU5PUklUQVMjSElORFUKIyMjREVOVFMjU0FORVNUCiNGSUFUUyMjREFXRyMjIwpBSVJDUkVXI1JEUyNQSEkKU0xBVEUjQUNBREVNSUVTCktFTllBI05VTUVSSUNBTApTVElMVCNUUkFOU0xBVEU="},{"title":"6/30/02 WHAT'S FOR LUNCH?: Offering you a serving suggestion","author":"by Lee Weaver, edited by Stanley Newman","date":"2002-06-30","grid":"UkFGI1RBQ1QjVEFUVE9PI0FXQVJECkVSRSNBTE9FI1VQSElMTCNQRVRFUgpDQUxBTUlORSNDT1VMRElUQkVUSEUKRVJJTiNCSVRFUyNSRVNPRCNERUVTClNBTkRXSUNIR09FUyMjI1NDRU5FUwpTVEVFUCMjRU9OUyNNU1QjT0RETFkKIyMjQUFBUyMjI0NJUEhFUlMjIyMjClNUQU4jQkFDS1RPVEhFVElNRU1BTgpUSVAjRkFSUklFUlMjIyNET1JBRE8KQU1QTEUjVEVORVQjQVJURSNBTE9UClNQQUlOI1JBRCMjI1RITyNBVEFSSQpIQUxMI0xFTVMjUFVSRVIjRE9SSUMKRU5MQUNFIyMjQ09HSVRBVEUjSU5FCkRJU0NPVkVSRURUSEFUSEUjUkFHUwojIyMjU0lHTk9SQSMjI1NMT0UjIyMKQk9BU1QjR0FTI1RIRUUjI1JFU0VXCkFCUk9BRCMjI0NPVUxETk9UTElWRQpSRUFSI05FVkVSI0dMVUVTI0lDRUQKQllCUkVBREFMT05FI0NIQUlOSU5HClJFTEVUI0FTU0FJTCNFUkdTI0xFRQpBREVMRSNNRUVLTFkjRFVFVCNZRFM="},{"title":"7/01/02 DECISIONS, DECISIONS","author":"by Sally R. Stein, edited by Stanley Newman","date":"2002-07-01","grid":"U0hPRSNCT1dMI0JQTFVTCkVBUkwjSURFQSNFTE9QRQpBSVJFI0xPTkkjSEFCSVQKVFJJQ0tPUlRSRUFUIyMjClNZTlRBWCMjI0FWT0lEUwojIyMjWklQI0VSRSNHRU0KQUxBTU8jSEFMTCNFTE1PCkJZSE9PS09SQllDUk9PSwpBUklEI09UVE8jQVJPU0UKQklOI1NSTyNXQVIjIyMjCkFDVE9ORSMjI1JFRFNFQQojIyNIRUFEU09SVEFJTFMKQUxMWUUjUk9QRSNSVEVTCkxPUEVaI09ERVMjVFVORQpGVVNTWSNQQUNUI1NQQVQ="},{"title":"7/02/02 DOWN YOU GO","author":"by Merle Baker, edited by Stanley Newman","date":"2002-07-02","grid":"UFJPRCNFQkJFRCNGRElDClJBVkUjUVVBU0kjQVJOTwpPTlVQI1VTTFRBI0NPUkEKRkFMTEJBQ0tPTiNBUEVYClNURUFMVEhZI05BREEjIwojIyNOWUUjI0pFV0VMRVIKR0FURSNTUExBU0gjSUxFCkVUVURFI0xJWiNPSU5LUwpBVE0jS1dBTlpBI05FU1QKUlVCQkVSWSMjTEFWIyMjCiMjTEVEQSNRVUlYT1RJQwpBQkVMI1BMVU5HRUlOVE8KSkFEQSNQT0FDSCNDT1dMCkFJUlkjRUNMQVQjRVRBVApST1lTI1JPTVBTI1NFU1M="},{"title":"7/03/02 FLOATERS","author":"by Fred Piscop, edited by Stanley Newman","date":"2002-07-03","grid":"R0FNRSNMT1BFUyMjSE9UCkVHT1MjRU1PVEUjRFVORQpUSVBQRUNBTk9FI0lOQ0EKT0xFI0xUUlMjU0VDS0VMCk5FUkRJRVIjTEFDRVkjIwojIyNPQVIjUkVXT1JERUQKQVNTRVMjUkFWRU4jT1dFClJJUFMjRkVURUQjUFJPTQpJTkEjVElMRVIjUk9ZS08KRE9DVE9SRUQjQklPIyMjCiMjRVJOSUUjQ09GRkVSUwpSRUpPSU4jTVVMTCNERUUKQUJVVCNHRU9SR0VSQUZUClZBTlMjVU5USUUjRU1JVApJTksjI1BFVEVSI0FTVE8="},{"title":"7/04/02 PATRIOTIC ENDINGS","author":"by Anna Stiga, edited by Stanley Newman","date":"2002-07-04","grid":"Sk9MVFMjUEVURSNGQVZFClVCT0FUI0VBUkwjT01JVApHT0RCTEVTU0FNRVJJQ0EKU0VFUiNKT1kjSVJBTklTCiMjI0lWRVMjUFJFUyMjIwpCQUxaQUMjUkVBI09CSVQKQVBFI0xUR0VOI0lOQU5FClNFQVRPU0hJTklOR1NFQQpTQVZPUiNPTUVOUyNSUlMKT0tFWSNCVVMjU0VEQVRFCiMjI1NBSUwjVFVUVSMjIwpBUkNUSUMjT0VSI1JPQU0KTVlIT01FU1dFRVRIT01FCkJFQVIjUE9FTSNIQVpFTApJU1BZI1NVRFMjRU1FTkQ="},{"title":"7/05/02 COLD CACHE","author":"by Verna Suit, edited by Stanley Newman","date":"2002-07-05","grid":"TU9OQSNTUE9JTCNTS0FUCklST04jUFJPTkUjUElNQQpGRUVURlJPTlRTSE9XRVIKRk9MSU8jQkFMTEVSSU5BCiMjIyNST0UjI0lDRSMjIwpQVU5KQUIjQkVFVCNGQ0MKQVNFQSNFQVJOI0lHTE9PClRVUktFWUNVVFNDUkVBTQpIQVZFTiNNSVNUI0VBU0UKU0xZI09QRU4jQU5HU1RTCiMjI0hVSCMjRVJFIyMjIwpPQ1RBR09OQUwjQVNQSUMKV0FSU0hPVUxERVJDQVNICkVSSU4jRURHRVMjQVJFQQpTUE9UI1lFQVJTI1JFRUQ="},{"title":"7/06/02 SATURDAY STUMPER","author":"by S.N., edited by Stanley Newman","date":"2002-07-06","grid":"U0NBVFRFUkVEI1NQQVNNCkhPTUVBTE9ORSNUUklURQpBTEVVVElBTlMjUk9EQU4KUE9FVEVTU0VTI0FWQUlMCkVSUiMjI1RBRUtXT05ETwojIyNOQU1FRFJPUCMjIyMKTU9EVUxBUiNUT09LT1VUCkdSSU1NUyMjI0tMSUJBTgpNT01CQVNBI0RJTExJRVMKIyMjI01FU1NJRVNUIyMjCkNBUldBU0hFUyMjI1NURQpVQk9BVCNUUk9UTElORVMKR0FVR0UjUkVXUklURVJTCkFTVE9SI0FOTkVNRUFSQQpURUVOUyNZRVNURVJEQVk="},{"title":"7/07/02 COUNTRY CUISINE: Items from the national menu","author":"by Shirley Soloway, edited by Stanley Newman","date":"2002-07-07","grid":"RkVFTCMjR0VUIyNTVEVQI0FGTEFUCkVMU0EjQVVESU8jVEVBUiNTTElNRQpXSVNDT05TSU5DSEVFU0UjQ09NTUEKRVNFI1BBVEUjQ09STkVEI09SRU9TClJFTk5FVFMjUFVSRUUjQU5USSMjIwojIyNPTk8jI0FMUyNST1RPI0ROQVMKTUFJTkVMT0JTVEVSI1JFVFJBSU5TCk9MRCNSRUNFU1MjQUJFI0FCT1JUUwpWSUxBIyNUUkUjU1RFTSNUSVJPUyMKRVZFTCNCQVIjUlVJTiMjSVNBIyMjClNFUkEjSURBSE9QT1RBVE8jTkFTQQojIyNTU1IjI0VWRU4jUEFOI0dPQUwKI0NPS0lFI0hBSVIjRklSIyNFUkxFClBPUEFSVCNVUk4jVEVOU0VTI1RJUApDUkFOU1RPTiNHRU9SR0lBUEVBQ0gKU0FMUyNBVUtTI0JSUiMjU0FQIyMjCiMjI0FTU1QjRU1PUlkjU1RSSU5HUwpBR0lMRSNTVEVFTEUjU1RFVCNFQVQKVE9STUUjV0FTSElOR1RPTkFQUExFCk1STU9NI0lNSVQjVFJFTkQjUEFMRQpTUEFOUyNNT05BIyNFV0UjI1NMT1A="},{"title":"7/08/02 LET'S EAT","author":"by Shirley Soloway, edited by Stanley Newman","date":"2002-07-08","grid":"QUdBUiNBQ1JJRCNTQ09UCkxPR0UjTEhBU0EjSFVNRQpHT0xEUExBVEVEI09QQUwKQURPQkUjTEVFI1NBQlJFCiMjV0FSUEVEI01JTE8jIwojIyNST09UI1BVTFNBVEUKRFVQT05UI1RPR08jUk9UCkFMQU4jTE9PUFMjRUROQQpWQU4jRVVSTyNIT1JTRVMKRU5IQU5DRSNJT05BIyMjCiMjQU1PSyNBUlRJU1QjIwpMSU5VUyNBTU8jQ0FST0IKQUREUyNPUkFOR0VCT1dMClBPTEUjUkFORUUjTElFVQpTTEVEI1NUQVJUI0VTU0U="},{"title":"7/09/02 C THE U.S.A.","author":"by Sally R. Stein, edited by Stanley Newman","date":"2002-07-09","grid":"RFVTVFMjQUxEQSNDSEFUCklOVFJPI1ZBSU4jSEFSRQpTSE9BTCNPVkVOI0FMQU4KQ0lOQ0lOTkFUSSNST0JTClNQRUVEWSMjI0VFTCMjIwojIyMjI0NBUEUjU09MVkUKU1BFQ1MjVElOI1NURUFLCkxBRExFI09BUiNBVE9ORQpBTk5FWCNNTk8jWUVTRVMKV0VBVkUjU09MRSMjIyMjCiMjI0VTUyMjI1JBUkVTVApJRE9MI0NIRVNBUEVBS0UKQ09NQSNST01FI09OVEFQCkVWRU4jQVNJQSNTVEFURQpTRU5EI01FVFMjRVNURUU="},{"title":"7/10/02 PIECEWORK","author":"by Fred Piscop, edited by Stanley Newman","date":"2002-07-10","grid":"UEVURVIjQUJBU0gjRkFCCkFMSVZFI05BU1RZI0FMTApTSUxJQ09OQ0hJUCNUT0UKVEVFTiNQQUgjUkhFU1VTCiMjI0NUQSMjI1JFQUREUwpERVRFUlJFRCNFTlRPIyMKT1JPI0FUVEVORCNFTUlUCkdPT0RZI1RBTyNBTklUQQpTT0xFI1BBTkRBUyNOT00KIyNBTFBPI1NFTUlUT05FCk1DTkVJTCMjI0lTSCMjIwpDT0RETEUjU0FTI0lPTkEKR09EI0ZBQ1RDSEVDS0VSCkVMSSNFWFVMVCNTS0lSVApFU0UjUkVQT1MjU0VFRFk="},{"title":"7/11/02 CALL OF THE WILD","author":"by Merle Baker, edited by Stanley Newman","date":"2002-07-11","grid":"U0FORyNDVVNQI1NIQVZFCkVNSVIjVVRJTCNFUlJPTApJQUdPI1BVVFVQQUhPV0wKU1RFVyNGUlVHQUwjTlNBCk1JTExSVU4jR1JVQiMjIwojIyNPSUwjREVTUEFJUlMKQUxBUk0jRklETyNST09LCkRPREQjRUxHSU4jS1dBSQpET1pFI1BBSU4jSkVBTlMKU0tFUlJJVFQjRkFYIyMjCiMjI1NBTFQjQlVZVElNRQpBTFQjTk9JU0VTI1JEQVMKUVVBQ0tHUkFTUyNBSUxTClVOVElMI0VQRUUjQ09URQpBR0FURSNTU1RTI1RNQU4="},{"title":"7/12/02 SWEET TOOTH","author":"by Lee Weaver, edited by Stanley Newman","date":"2002-07-12","grid":"VkFTU0FSI1NPQVAjU0lDCkFOR09MQSNJTkNBI0FOQQpOT1RISU5HR09FUyNVVEUKIyMjT0JJRSMjUkhJTk9TCklNUCNJTlRPQUJBTkFOQQpGT0FMIyNBUlIjI1VTRVIKU09DSUFMI0FDVE9SIyMjCiMjU1BMSVRUSEFUSVMjIwojIyNSQURJSSNCT05ORVQKQlBPRSMjRE9TIyNHQUdBCkFTRkFUVEVOSU5HI0dPVApTQU5EUkEjI1RPRVMjIyMKU0xPI0FTWU9VUlNQT09OCkVNVCNTVEFOI0FUT05DRQpUU0UjSEVNUyNERVRFU1Q="},{"title":"7/13/02 SATURDAY STUMPER","author":"by Daniel R. Stark, edited by Stanley Newman","date":"2002-07-13","grid":"VklUQUwjI0ZMQVAjQUxFCkVST0RFI1ZJT0xBI1BJRwpIT1JERSNDUkFHUyNQT0UKSU5URVJQUkVUQVRJT05TCkNPVVJTRSMjSEVBRFNFVApMVUdTI0tBTEUjI0xFU1MKRVRBI0xPUkUjU0hFRFMjCiMjI1NQRUNUQVRPUiMjIwojUFJFU1MjR0lSRCNSQU0KQ09PTiMjR09SRSNMRVZZCkFNTU9OSUEjI0FEQUdFUwpTUFVST0ZUSEVNT01FTlQKSEFMI1VOU0VSI1NJTkdFCkVOQSNTT0JJRyNFTlRFUgpTT04jI1RZUk8jU0FTU1k="},{"title":"7/14/02 LESS IS MORE: . . . and so forth","author":"by Fred Piscop, edited by Stanley Newman","date":"2002-07-14","grid":"UEFTVEEjU0FIQVJBI0FHQSNGTEFNCkFDVE9SI0VMSURFUyNTQU5ESUVHTwpDSFVSQ0hJTExVUFMjTElORVNNRU4KRU9OI1NFTkFURSNUSEFOI1NIT05FClJPU0gjTEVOTyMjI0VOTFMjSU5UTAojIyNPUEUjI05FV1RTI0VBR0VSIyMKQVRBTEFOVEEjQUFIIyNBTUVSSUNBCkJPT1NUQU5ERFJJRUQjREVOI1NPWApCVU5UUyNUQVIjVFJVI0VETyNFTEkKQVRFRSMjI0dBU1NFUiNSQU0jU0FTCiMjI1JFRkxFQ1QjU0FZU1lFUyMjIwpBTUMjUk9FI1VSQkFORSMjI0FET0cKSE9PI0FSTiNMSVUjR0FUI0lNQUdFCkFMTCNTRUcjQUREVE9USEVTQUlMUwpCRURSRVNUIyNFR08jU09NRVJTRVQKIyNFQVJUSCNDUkVFUCMjREVJIyMjCk1JWFQjU0VSQSMjI0xJTUEjQUNNRQpBU1BJRSNOQVRPI0RVUkVTUyNMT0wKU1RBTkRTSU4jUkFJU0VUSEVCT09NClRPTkdVSU5HI0dSRUVORSNSSU5TRQpTT0RTI0xHRSNTQVNTRUQjRkxFRVI="},{"title":"7/15/02 CARPENTRY CORNER","author":"by Lee Weaver, edited by Stanley Newman","date":"2002-07-15","grid":"QUJORVIjI0FETyNPTEVTClNFQVNPTiNSVU0jU0FHRQpUUklQTEUjUkVBU1NVUkUKRUxMI0xFVkVMSEVBREVEClJFQkEjI0FTSUFOI1NUWQojI1JPREVOVFMjIyMjIyMKUkVVTklURSNURUEjUEVBCkFTU0VOVCMjI01VU0xJTgpOVEgjT0FSI01JRExBTkQKIyMjIyMjRURJVElPTiMjCkFURSNUQUNPUyMjVEVSTQpIQU1NRVJMT0NLUyNDT0UKRU1CT0RJRUQjSUNBUlVTCkFQRVMjU0FMI0RVUkVTUwpQQVJUI0VORSMjREVXRVk="},{"title":"7/16/02 ABOUT FACE","author":"by Mark Moldowsky, edited by Stanley Newman","date":"2002-07-16","grid":"QU9SVEEjU1RBUlQjSk9CClBSSUFNI0xFUk9JI0FXRQpCUk9XQkVBVElORyNXSVQKIyMjI0xPVkUjI0hBRE5UClNBTFRJTkUjTElUVVJHWQpPTklPTlMjRk9SRUdPIyMKVU5QRUcjVEVOT04jUFZDClBVU1MjR0FMRU4jU1BBUgpTTFkjRlVST1IjVEhJTkUKIyNORVVST04jUFJBTkNFCkxPQ0tOVVQjRkxBR0dFRApBU0hFTiMjQUxBTiMjIyMKQ0hJI0VZRUNBVENISU5HCktFTiNMQVlFUiNFRVJJRQpTQUcjU1dFREUjU01FTFQ="},{"title":"7/17/02 AT THE ARCADE","author":"by Fred Piscop, edited by Stanley Newman","date":"2002-07-17","grid":"QUNIRVMjQ0FOUyNDQVBUClRIRVNFI09NT08jT0xFTwpUSUxUQVdISVJMI0lPVEEKSU5FI0JFQUQjREVOVEVECkNPTkNFUk4jUkVFRiMjIwojIyNIRUUjQ0FSRUxFU1MKU0lMQVMjQkFLRSNJREVBCk9ERVIjQlVTRUQjUElMTApBTEFJI0lSRUQjU1BFTFQKUEVQVEFMS1MjQVBFIyMjCiMjI1lBTEUjUElFUkNFRApCQUFCQUEjQUlEQSNBUE8KQUJCQSNCVU1QRVJDUk9QClJJTEwjTEFNRSNFUk9ERQpLRUVMI0VST1MjRE9NRUQ="},{"title":"7/18/02 WHERE'S THE FIRE?","author":"by Daniel R. Stark, edited by Stanley Newman","date":"2002-07-18","grid":"Q0hBUiNTQ0FSI0FUQkFZClJBTkkjQVJHTyNOSUVDRQpBVU5UI01PT1QjT0RFVFMKQkxBWkVPRkdMT1JZIyMjCiMjIyNTQVQjI0dBVUNIRQpBU1NFVCNTUEFSS1BMVUcKTE9UVE8jI0VORSMjRVJHCk1JUkVTI09BVCNTTEFUUwpPUkUjI0FSSyMjSEFUTE8KTkVXU0ZMQVNII0lCU0VOCkRFTklSTyMjT0lMIyMjIwojIyNHT1VQSU5GTEFNRVMKREVBTlMjRVRPTiNXRVJFClJPQk9UI05FUk8jTEFNQQpVU1VSWSNUUkVUI1NMQU0="},{"title":"7/19/02 YOU'RE NO FUN","author":"by Bob Frank, edited by Stanley Newman","date":"2002-07-19","grid":"UkFHRSNTSVNBTCNZT1dMCkVDT0wjQU1PUkUjRU5ZQQpBUVVBI0RBUkxBI1NFRUQKQ1VSTVVER0VPTkxZIyMjClRJTSNOTEVSI09DRUxPVApPUkVMU0UjI0FORFNVQ0gKUkVUSUUjUk9BTSMjR1RFCiMjI0NST1RDSEVUWSMjIwpBV0wjI05FU1MjTkVFRFMKQ0hBTU9JUyMjQk9OTkVUCktPU09WTyNHT0FUI1JEQQojIyNDQU5UQU5LRVJPVVMKRVJJSyNET1VTRSNPVUNICk1FTlUjSU5ORVIjQVRFRQpTTkFQI1BFVFRZI1JFREQ="},{"title":"7/20/02 SATURDAY STUMPER","author":"by Anna Stiga, edited by Stanley Newman","date":"2002-07-20","grid":"T0JMSUdFI0NSVVNUSU5HCkFMSU5FUyNSQU5DSE1FTgpSQVZFTlMjVU5DT1VQTEUKI0NFUkVBTFMjTFVHT1NJClNLSVQjWUVBR0VSI1NPUwpBQ1QjQlNJREVTI0hFTlMKR0FVWkUjI0VSQVRPIyMjCkFUUEVBQ0UjRU1FUkFMRAojIyNTVE9STSMjQU5OT1kKU0VOVCNVTkNPT0wjVElFCkFWQSNDUk9DVVMjRklUUwpERVNQT1QjQVJDU0lORSMKSU5ERU5JQUwjQUxMVVJFClNUQVJHRUxMI1JPQ0tFUgpUU1FVQVJFUyNTUEhFUkU="},{"title":"7/21/02 FREQUENT FLIERS: They earn their wings every day","author":"by Daniel R. Stark, edited by Stanley Newman","date":"2002-07-21","grid":"TkVDSyNIQU1TI0FNQVNTI0JFR0FOCkFNT0kjQVZPVyNST1lLTyNBR09SQQpQSUNUI1JFQkEjQ0xBWVBJR0VPTlMKU0xBVEhFUiNMT0FUSEUjREVTUE9UCiMjI1lBTVMjTEFERVMjU0lMVCMjIwpDVVNIWSMjTk9TRUQjT1BPU1NVTVMKQU5OQVMjQk9XRVMjI1JFQyMjTklMCkNSQVcjRk9DVVMjR09GTFlBS0lURQpIVUNLI1JFQVAjR1JVRUwjTUFURUQKRUxLI0VBUkwjQ0FJUk8jRkVOIyMjClNZU1RFTVMjQVJJRVMjQ0FOVEFUQQojIyNJTEUjRkxVTkcjUEFUUyNNQU4KU0VJTkUjR1VFU1MjSk9MVCNOQVJZClBFVEVSRklOQ0gjV0FMTFkjSU5UTwpBUkUjI0lSSyMjUEhZTEEjT0dERU4KTk9STUFORFkjUExPV1MjI1NIQVJFCiMjI09USVMjU0hVTEEjQk9MVCMjIwpQUk9NT1MjTElPTkVMI0JMT09QRUQKUkFWRU5IQUlSRUQjS09PTCNXQUxFCklSRU5FI1BMRUJFI0VOWUEjTElNQgpHRU5UUyNFSURFUiNST1NTI1NMT1Q="},{"title":"7/22/02 HOME SWEET HOME","author":"by Anna Stiga, edited by Stanley Newman","date":"2002-07-22","grid":"VEFSUyNTUlRBI0FMT05FCkdMVVQjSEVSQiNTRUdBTApJREVBI0VMSUEjU0FMU0EKRkFSTVRFQU1TI0lERUFMCiMjI1BVTlQjSEFTIyMjIwpSQUgjTEFJUiNVVEhBTlQKQVJJRVMjVkVJTCNPTEVPCkNPVFRBR0VJTkRVU1RSWQpFTUlUI0lTTlQjTEVBVkUKUkFURURHI1NFQ1QjUkVECiMjIyNSSU8jTEFSSyMjIwpJTkRJQSNWSUxMQU5PVkEKQUxPTkcjRUxFViNBTUlTCkdFVFRPI05JQ0UjQ0FTSApPUlNPTiNTRVRTI0tORUU="},{"title":"7/23/02 ON FOOT","author":"by Shirley Soloway, edited by Stanley Newman","date":"2002-07-23","grid":"QkVUIyMjUkFDRSNBQkxFCkFMT09QI0VERU4jVE9PSwpTQU5EQUxXT09EI0JPREUKU1RFRVJFUiNTRURBVEVECk9FUiNPTkEjI0FSVEUjIwojIyNTTElQUEVSWSNETkEKREFNSUVOI0xBUyNQT09MCkFCVVRTI0NVVCNDUlVTVApNRUxTI0JBTSNBUkVUSEEKU1RFI1BVTVBFRFVQIyMjCiMjVFdJVCMjU0RTI0dJQQpTRVJSQVRFI1RFQVBPVFMKQUxBSSNPWEZPUkRHUkFZCkdBSVQjTkVBUCNFQUdMRQpBTk5FI1NTVFMjIyNFU1Q="},{"title":"7/24/02 ARTY PLACES","author":"by Merle Baker, edited by Stanley Newman","date":"2002-07-24","grid":"SlVOVEEjTUlMRCNQRUVSCkFTSUFOI09OT1IjSElWRQpNRVRSTyNVTkRFQ0lERUQKIyMjUFJFU1NHQUxMRVJZCk9ERFNBUkUjRU1JI1JZRQpCRUUjS0FUVCNTRVQjIyMKRUxCQSNUUklQI05BUEVTClNUVURJT0FQQVJUTUVOVApFQVRFTiNQVVJFI1NBREEKIyMjU0FEI1BBTE8jUlVHCkFNSSNSRVMjS0lCQkxFUwpNVVNFVU1QSUVDRVMjIyMKSUxMQVRFQVNFI1JJRkxFCk5DQVIjQVRJVCNPRElTVApPSE1TI05FU1MjTkVYVVM="},{"title":"7/25/02 THE BEE GEES","author":"by Sally R. Stein, edited by Stanley Newman","date":"2002-07-25","grid":"U0FCRVIjQUlNI0hPSFVNCkVMVURFI0RERSNBTVVTRQpBQlJJTCNWSUEjV0FHT04KQkVOTllHT09ETUFOIyMjCkFSSUEjT0NUT1BJI1VNQQpTVE4jQUdBI1dISVRORVkKU0FHI0xPQ0sjIyNXSVJFCiMjQklMTFlHUkFIQU0jIwpBQlVUIyMjQkVMQSNQQUMKUlVTU0VMTCNET1QjT0xBCkFTSCNNT0xURU4jQVJBTAojIyNCT0JCSUVHRU5UUlkKQURNSVQjRUxNI1NUQU1QClNVSVRFI0FERSNUSU5FUwpQT0xFRCNORUQjQVNUUk8="},{"title":"7/26/02 DECEPTIVE PRACTICES","author":"by Bob Frank, edited by Stanley Newman","date":"2002-07-26","grid":"RUROQVMjUlVMRSNIQVRTClNVRURFI0lURU0jT1JFTApDT1dFUiNHQVNQI09NTkkKIyNTTEVJR0hUT0ZIQU5ECk1PUkVOTyMjI1JPQURJRQpJUkUjQU5UT05JTiNBU1MKR1JFVyMjQUxMVURFIyMjCiMjTEVHRVJERU1BSU4jIwojIyNUUkFERVIjI05PTkUKUlRTI1VURU5TSUwjTEFNCldIQVJGUyMjI1JPQk9UUwpBUlRPRklMTFVTSU9OIyMKTkVJTCNOT09LI1RPR0FTCkRBUkUjVElERSNFTkVNWQpBREVTI09ORVMjUkVSQU4="},{"title":"7/27/02 SATURDAY STUMP