{"id":"usatoday-1998","publication":"usatoday","year":"1998","count":256,"puzzles":[{"title":"USA Today 01/02/98 \"GETTING THERE\"","author":"By Charles Preston","date":"1998-01-02","grid":"RVJTVCNJU0xFIyNPTUFSCkxPQ08jTkVBUFMjUkVMWQpNQVVSRVRBTklBI1NUT0EKT1JEI1NSVEEjREFJUkVOCiMjI01BRVMjQ0hJTk8jIwpDQU1FVVAjTkFVVElMVVMKVVBPTiNJUkFOIyMjSU5BClJPRFMjRFVST0MjU05JVApJUkUjIyNOSU5PI1BFVEUKQVRMQU5USVMjTkVBUkVECiMjVFJBSU4jQUNUUyMjIwpTQUZFU1QjRUxPTiNBU0UKVFJPVCNMT05HUkFOR0VSCklOUkUjRUFWRUQjWUVBUgpSRURTIyNUWVJFI0VFTFM="},{"title":"USA Today 01/05/98 \"ICED PRIZE\"","author":"By Charles Preston","date":"1998-01-05","grid":"I09ET1IjI01BVyNQUk9GCk9MSVZFUiNBTEkjWUVMTApDQU5BUEUjQ09MT1JBRE8KQVZBTEFOQ0hFI1RFUlNFCiMjI1NJTkFJI1NBWCMjIwpBUkEjUkVCI0NVUiNBTUEKTE9SRFNUQU5MRVlTQ1VQCk9MR0EjI0xJRSMjQ0hJQQpGTE9SSURBUEFOVEhFUlMKVE9OI1ZBUyNOQVIjU1NTCiMjI1pBUCNPU1RJQSMjIwpBTExFTiNJQ0VIT0NLRVkKSk9FU0FLSUMjQUxUQVJTCkFCRVQjSU9VI05FVVJBTApST1JZI1RPUiMjU1BBVCM="},{"title":"USA Today 01/06/98 \"DUAL OCCUPATIONS\"","author":"By Charles Preston","date":"1998-01-06","grid":"SEFJRyNBTEVSVCNBQkJBCkFMREEjTE9QRVIjU0VFRApUTUVOI0xBSU5FI0hBTkQKI1NBR0VPRkNPTkNPUkQjCiMjI0xBVEUjI1RBUiMjIwpFTElBUyNSQ0EjUkVMQVkKVEVOTkVSI0FEQSMjQUxFCkhFUkRTTUFOT0ZURUtPQQpFUkUjI05CQSNUQUxFTlQKUllERVIjRUxGI0hFUkVTCiMjI0RPUyMjQUdPRyMjIwojTUFJRE9GT1JMRUFOUyMKQk9MVCNOT1JNQSNORUhJCkVSR08jR09ORVIjQ09PVApHRUFSI1NUT1JFI0VOT1M="},{"title":"USA Today 01/07/98 \"CHOW DOWN\"","author":"By Charles Preston","date":"1998-01-07","grid":"Q0JTIyNTQVJBTiNFR0dTClJFRUYjSVJBVEUjU09BUApBTEVFI1BJTlRTI1NPREEKQkFLRURQT1RBVE9FUyMjCiMjI0RJRVQjIyNVU0UjIwpMRVNTRVIjQ0FSVCNCTFQKQUxUTyMjQVJNRUQjRUFSCkNPUk5FREJFRUZPTlJZRQpFUEkjTk9MQU4jI0FSRVMKREVOI1RFRU0jU0FUWVJTCiMjR0VFIyMjRklTSCMjIwojI0JBUkJFQ1VFU0FVQ0UKUEVFUiNBTU9ORyNOQ0FBCk9SQUwjTUlMTkUjU0xJVApERU5ZI1NUQVlTIyNBTlM="},{"title":"USA Today 01/08/98 \"ALL PLAY\"","author":"By Charles Preston","date":"1998-01-08","grid":"Wk9ORSMjTUFJTiNBVkVSCkVWRU4jU0VJTkUjU0lWQQpSSU5HU1RBUkRFTVBTRVkKT0RFI0NPRyMjI09IQVJFCiMjI01PVkVTI0lOQSMjIwojR09MRkVSTklDS0xBVVMKU0VSSUYjI1VETyNUSVJFCkxFSSMjUEFHQU4jI1NBVwpBTk9OI1JJRyMjU0VMTFMKTUFOT0ZBTExUUkFERVMjCiMjI0RJTSNFUkVDVCMjIwpBUE9EUyMjI1lBUiNTUFkKQ09NSUNBQ1RPUk9BS0lFCkVMQU4jSE9SVVMjRElOQQpET05HI0FESVQjI09QRU4="},{"title":"USA Today 01/09/98 \"REMEMBERING JANE AUSTEN\"","author":"By Charles Preston","date":"1998-01-09","grid":"U0FURSNQTFVNUCNBVVJBCkxBSFIjTEFTQUwjSVJPTgpBUkVTI0FOTkVFTExJT1QKV0VCI1JZRSMjREVJU1RTCiMjRVNBVSNTQUdBTiMjIwpGQU5OWVBSSUNFI0dOQVQKQVJOSUUjT0dFRSMjT0RFClZFRVAjRE9OVFMjRVJMRQpPTlQjI09LQVkjU0VUSU4KUkFTSCNXSUxMT1VHSEJZCiMjI0VTTkVTI1ZJU0EjIwpJUkVOSUMjI0xFVCNOQ08KTUlTU1RBWUxPUiNBR0VTCkFMVE8jU0VQQUwjU0VMTApNRUFOI1RBTkRZI0FSTE8="},{"title":"USA Today 01/12/98 \"GIVE THEM\"","author":"By Charles Preston","date":"1998-01-12","grid":"TkVYVCNERU5FQiNBQ0FUCkFNRU4jRUxJVEUjVE9HQQpQRU5OWVBJTkNII0hVUkwKQVJJI09MREUjQU5PUkFLCiNZQU5LRUUjI1ZBU1QjIwojIyNPVVRTSURFUiNZQVAKQkVDT01FI0NPU1kjQUdPCkxBSFIjI1RIRSMjRFJPUApVU0EjQUNSTyNQTEVER0UKUkVNI0NIQVJDT0FMIyMjCiMjT0tSQSMjQVJNSU5HIwpJTU1JRVMjQU5LQSNPUk8KQ0xJTyNURU5ERVJGT09UCkVMTFMjRU5ET1IjQVNTVApSRUVLI05FQVJTI1BFU08="},{"title":"USA Today 01/13/98 \"IG TEST\"","author":"By Charles Preston","date":"1998-01-13","grid":"UklQU0FXI1JJRFMjTk9UCk9SQUNMRSNBUklFI0VORQpDQUNIRVQjRElORVRURVMKIyNJT05TI0lTT1RPUEVTCkRFRk9FI01BSCNPTUFOSQpBUklMI0JFTkRTI0hZREUKTUlTU09VVCNBTkRBIyMjClBFVFVOSUEjTk9PTkRBWQojIyNCT0xMI0NPQ0tFWUUKTEVFSiNUSUJFVCNTTEVXCkVSTkVTI05PUyNBTUVTUwpBUlRDTEFTUyNGUk9HIyMKUEFSVEFLRVMjUkVWQU1QCkFUQSNUSVJFI0FOSVRBUwpUQVAjRU5UUyNTVEVFRFM="},{"title":"USA Today 01/14/98 \"LET'S BOGIE\"","author":"By Charles Preston","date":"1998-01-14","grid":"QU1BVCNTQ1JBUCNBREFNClBBTkUjUEFJTkUjREFMRQpBU09SI0FMR0FFI09NRU4KQ0hJTkFDTElQUEVSIyMjCkVFTiNXRUVEIyNSRUJFTAojU1RMTyMjI0JJTkRFUlkKIyMjRUxPUEVSUyMjVElOClRIRUFGUklDQU5RVUVFTgpSSUEjI1JBVUNPVVMjIyMKT1RUQVdBUyMjI09ORVIjClRFU1RZIyNBTlRJI0xFSQojIyNXRVJFTk9BTkdFTFMKUEVTTyNBVkVSVCNFVkVMCk9MSU8jVEVOU0UjTkVORQpXSU5EI0VOVEVSI0FOVFM="},{"title":"USA Today 01/15/98 \"DETECTIVES\"","author":"By Charles Preston","date":"1998-01-15","grid":"I1BBTE1TI0JWRFMjSkFNCk5PU09BUCNMSUFSI09XRQpFTFRPUk8jT0NDQVNJT04KU0tJUFRSQUNFUiNIRUxEClRBUiNIQVJLI09QQSMjIwojIyNGQURFI1VORU1QVFkKU0VSQiNJT05TI0xVSVNFClBMQUlOQ0xPVEhFU01BTgpDT01BRSNBUklFI0VBUlMKQU5BR09HRSNOQUJTIyMjCiMjI0VOQSNDT0RBI1BBUgpPUEVOI1BSSVZBVEVFWUUKQlVUVEhFQUQjQ0hPS0VECkVSQSNBUlRFI0hPTk9SUwpZRVQjWVNFUiNFU1NFUyM="},{"title":"USA Today 01/16/98 \"HOCKEY HUMOR\"","author":"By Charles Preston","date":"1998-01-16","grid":"RkVEVVAjQUpBUiNCT1NICklWQU5BI0dBVEUjUlVMRQpERVZJTFNBRFZPQ0FURVMKT05FI1BPU0UjI0hFUkVTCiMjI1RBVVMjT05PI1VLRQpMSUdIVE5JTkdCVUdTIyMKQURPUkVEI0lSQSNBSEFCCkNMQVVTI0FYRSNCUklCRQpFRUxTI1BSTyNCRUFOSUUKIyNUSEVMT05FUkFOR0VSClNJRSNNT1cjR0lSRCMjIwpQT05aSSMjQVJFQSNRVFMKVU5ERVJDT1ZFUkJMVUVTClJJRU4jQUxPVCNMRUFOVApUQVJPI1lFV1MjRURJVFM="},{"title":"USA Today 01/19/98 \"ZOO STORY\"","author":"By Charles Preston","date":"1998-01-19","grid":"TE9EWiNDT1JQUyNTSEVBCk9MRU8jQUNPUk4jUE9ORApBR1JPI0JBWk9PS0FKT0UKTUFOVFJBUyMjI0FST1NFCiMjI1NPTEVEI01SVCMjIwpTVE9VVCNLQUxBTUFaT08KUEFOSUNTI0RBTkEjQVJNCklCRVQjTEVBUFQjR0lHSQpUT1QjQ09MSSNBUkFSQVQKWk9PTE9HSVNUI0VERU5TCiMjI0VNUyNUT1BBWiMjIwpUSFVNQiMjI1BBUE9PU0UKWUFaT09SSVZFUiNPUEVOClBOSU4jRVZPS0UjS0lXSQpFQVNZI1BPTEFSI1NFTkQ="},{"title":"USA Today 01/20/98 \"ISLAND PARADISE\"","author":"By Charles Preston","date":"1998-01-20","grid":"TEFNQSMjUExFRCNIVUxBClVTRVIjQ0FVU0UjSVJPTgpTVEFSI09SQVRFI0JJTkQKSE9OT0xVTFUjREFJU0VTCiMjI1lPUkUjR0VNUyMjIwpBUkJPUlMjQkVERUNLUyMKQkVFI0RFQVJTI1NVTlVQCkVDUlUjU0xBVFMjU0VBUwpMQVJLUyNPREVUUyNMVkkKI1BBVU5DSFkjQVBQTEVTCiMjI0xJUkEjU1RJUiMjIwpERUxFVEUjTUFVTkFMT0EKSURPTCNBREFMRSNUT1dOCkxJTkUjU09VTFMjRVZFTgpMRUlTI0VSSUUjI1NFUkE="},{"title":"USA Today 01/21/98 \"ANIMALS\"","author":"By Charles Preston","date":"1998-01-21","grid":"UEVBUiNDT1JHSSNFQkJTCklOUkUjT05JT04jU1VJVApUSUdFUldPT0RTI09MTEEKQURPQkUjIyNTVEFUTEVSCiMjI09VU1QjI0VZRUQjIwpIVUNLU1RFUiNQRVJVU0UKQUJBI0VBVElOI1NJUkVOClJPVFMjVE9URVMjQ0hBRApQQVNIQSNOQVNBTCNBTEUKT1RUQVdBI1NUUlVNTUVECiMjRVZFUiMjU0FHQSMjIwpSRVZJU0FMIyMjQUdORVMKQURFTiNCRUFSQlJZQU5UClBJTkcjTEVST1kjQUhPWQpURVNTI0VTVEVFI1JBTEU="},{"title":"USA Today 01/22/98 \"IT'S A HORSERACE\"","author":"By Charles Preston","date":"1998-01-22","grid":"U0VBUyNTSEVCQSNCQU5TCkhBUkUjSEFSRU0jQVRPUApFUklDI0VSSVNBI1NUT0EKQVBMQUNFSU5USEVTVU4jCiMjI05PVCMjI1NLSSMjIwpQQVNUQSNCQVIjRU5BQ1QKT1JBI1RFQU1FRCNFVFJFCldJTldJTlNJVFVBVElPTgpFU1RFI0RBTklFTCNMQ0QKUkVBTFMjTEVFI0FOVEVTCiMjI0NPRyMjI0FNWSMjIwojU0hPV09ORVNDT0xPUlMKQVRPTSNMSU1JVCNPTUlUCk1PTEUjRUxJVEUjTkFURQpBUEVEI01FVEVEI1NOQVA="},{"title":"USA Today 01/23/98 \"ANIMALS FIRST\"","author":"By Charles Preston","date":"1998-01-23","grid":"I1NJTUkjU1dBRyNUU1AjCkFMREVOI1BBUkUjVVBPTgpQVUVSVE9SSUNPI1JJTVkKQ1JPQ09ESUxFRFVOREVFCiMjI0VUT04jREVOU0UjIwpPUkIjT1VUUyMjQ0lSQ0EKWE9VVCNSSVRBI0FOV0FSCklTTElQI05PTCNTVEVSTgpERUxUQSNHQUJTI09CSUUKRVRISUMjI1NBSEwjQkJMCiMjQUxFTkUjVFJJTyMjIwpCVUxMRE9HRFJVTU1PTkQKT1NTQSNDUllPR0VOSUNTCkJFRVQjS0VOUyNOSUxPVAojRFlFI1NURVMjU0FTUyM="},{"title":"USA Today 01/26/98 \"1996 EMMY WINNERS\"","author":"By Charles Preston","date":"1998-01-26","grid":"VE9SQUgjQUlEQU4jREVZCkFEQU5PI1NURU5PI0VNUwpKT0hOTElUSEdPVyNOSUEKIyMjRUxMSUUjVEhJTkxZClNIQSNBSVIjQ0hFTUlTRQpUVUxBTkUjVEhFUkVTIyMKRUxBTkQjI1JBUkUjRkhBCkFDTkUjU09BUlMjQlJBRApNRVIjQUVSWSMjRlJBVUQKIyNJTkRJRVMjUFJPTlRPCkxVQ0lBTk8jTEVBI1pFTgpBU0tTT0YjUFVSU0UjIyMKWUFNI0hFTEVOTUlSUkVOCkFHQSNJTEVUQSNFTU9URQpURU4jT0RERVIjUkFaRUQ="},{"title":"USA Today 01/27/98 \"HIDDEN FRUITS\"","author":"By Charles Preston","date":"1998-01-27","grid":"TEVTI0FEREVEI1NFRVIjCk9BVCNQRVdFRSNVUkdFRApHUkFQUExFUlMjQlJBSUQKRU5UUkFJTCNJU0xBTkRTCiMjI0VMQVRFI0tJVCMjIwpJU0xFIyMjUExVTUFHRUQKU1RJTkdTI0lPTEUjVVRFCk9SRSNPTkVTQUxMI0FIQQpMT1UjUk9UTyNTWUxWQU4KQVBQRUFSRUQjIyNJQU5TCiMjI0lORSNFQVNFTCMjIwpBTExFR1JPI1BJVEFQQVQKTUFYSUUjSU1QRUFDSEVTClBSSU9SI1NDRU5UI0VSQQojS0lTUyNFTExBUyNXT1I="},{"title":"USA Today 01/28/98 \"WINGDING\"","author":"By Charles Preston","date":"1998-01-28","grid":"RklMTSNEUk9QI0NBU1RTCkFSSUUjRUFWRSNBTk9VSwpNRUxBTkNIT0xZQk9PQlkKRURJVE9SIyNGRUxJTkVTCiMjI0JFRUYjI01FTiMjIwpNWU5BTEVBR1VFI1RPV04KT1BFTFMjQ09STiMjTklBCk9SQUwjQkFNQkkjR0VMUwpMRVQjI0lERUEjVk9JTEEKQVNPRiNURVJOU0lHTkFMCiMjI09TTyMjQU5ORSMjIwpBTEZBTEZBIyNBQ1RPTkUKVEVBTE9GVFdPQ0lUSUVTCk9OU0VUI0tJUksjRUxPTgpNT09EUyNBR0VTI1JZTkU="},{"title":"USA Today 01/29/98 \"EGOIST'S LAMENT\"","author":"By Charles Preston","date":"1998-01-29","grid":"VE9NIyNHUkVHI0VUSE9TCk9QVVMjTk9TSCNJUkVORQpESVNLI0FTVE8jR09SRU4KT05DRUlUSE9VR0hUIyMjClNFQUxTIyNQTEFUI0JSQQojU1RFTEFJI1NMWSNFQVIKIyMjVEVUUkEjIyNNQVJFCiNJTUFERUFNSVNUQUtFIwpDT0FMIyMjQU1BSFMjIyMKQUxMI0xFUyNQT1JURUQjCkRFRSNBTlRTIyNFRVJJRQojIyNCVVRJV0FTV1JPTkcKQkFSRVIjR0VOVCNFRE5BCkVDT0xFI01BTkUjREVFRApBVE9MTCNBVE9OIyNEUlM="},{"title":"USA Today 01/30/98 \"TOURIST ATTRACTION\"","author":"By Charles Preston","date":"1998-01-30","grid":"TEFTVCNBVE9NUyNFQkJTCk9MUEUjREFOQUUjQVVSQQpGT1JUU1VNVEVSI1NOSVQKVEVZI0FMVE9TIyNJS0VTCiMjI0VTVEEjVEVSTkUjIwojQ0RSUyNNQVJESUdSQVMKQ0hJTiMjI1RPSVQjSE1PClJPU0VCT1dMU1RBRElVTQpFSU4jQVJFQSMjI0VMU0EKV1JFTlNORVNUI1JBTEUjCiMjWU9LRUQjQURFTiMjIwpTSUxPIyNMT01BTiNURUUKT0NBUyNERU5BTElQQVJLCkxFTkUjSVNFUkUjQVBTRQpPRERTI0VTU0FZI1JFRUQ="},{"title":"USA Today 02/02/98 \"POTENTATES\"","author":"By Charles Preston","date":"1998-02-02","grid":"TUlTUyNJTkJBRCNPV0VTCkVSSUsjQ09VUEUjQ0FTVApNQVJJRUFOVE9JTkVUVEUKT05FI0JSRVRTI0VBVEVSClNJTkdPVVQjI0JVTlNFTgojIyNPTlMjU1dBVFMjIyMKVE9VVCMjU1BPUkUjVU1BCkFSVEhVUlBFTkRSQUdPTgpNQUUjUE9JTlQjI0NIQU4KIyMjVEJPTkQjQkxUIyMjClNIT1dFRCMjR1VFVkFSQQpNQVJJQSNCQVJSRSNUVUcKSVZBTlRIRVRFUlJJQkxFClRFVEUjTUFNQk8jQ0FFTgpTTEVEI09SU0VTI0lUU0E="},{"title":"USA Today 02/03/98 \"CALLING A.A.\"","author":"By Charles Preston","date":"1998-02-03","grid":"RURFTCNMRVRBVCNPTUVOCk1JU0UjQUxPTkUjWU9SRQpCQVRIVFVCR0lOI1NPTUUKQU5FQVIjRUFTRSNUU0FSClJFRVZFUyNTRVRURUUjIwojIyNSRUFEIyMjQVJNT1IKSE9NRSNMQVRIRVIjSURPClVOTyNEQU5JRUxTI0xFTwpOQ08jT0RFU1NBI1NLQVQKVEVOT04jIyNTVEFOIyMjCiMjU1BFQVJTI0VESUJMRQpBU0hFI1NPTlMjQVBSSUwKU1RJUiNTTkVBS1lQRVRFCklPTkEjRUVSSUUjRURFTgpBUEVTI1RFRERZI1RBUkE="},{"title":"USA Today 02/04/98 \"TURN OFF\"","author":"By Charles Preston","date":"1998-02-04","grid":"QkVMQSNURVNUI01BTEVTCkFSQUwjQVhFUyNBTU9SRQpTSURFI05JTkEjU0lOR0UKS0VZQ09OU1RSVUNUSU9OCiMjIyNQRVQjI05BWSMjIwpSRUFNRVIjU1RJUiNFTkUKRUxMRU4jVEhFVEFCTEVTCkJPQVMjQ1JPTlkjQUlSUwpVUFRIRUhFQVQjVFJPVkUKVEVFI0RJRVQjV0hJVEVTCiMjI01JTCMjUFJPIyMjIwpBQk9VVElTRkFJUlBMQVkKQkFTU08jT0FTVCNFSVJFCkVUSEVSI0JJVEUjUkVFTApTSEFEUyNTVEFSI0tOQVA="},{"title":"USA Today 02/05/98 \"HOMEY\"","author":"By Charles Preston","date":"1998-02-05","grid":"VE9CRSNFUkdPI0lCRUFNCklET0wjTk9OTyNNRVJHRQpST0NLR1JPVVAjQUxJRU4KRVJBI1JPUyNTUFJVQ0VECiMjI0RFTFRBI1JFUyMjIwpEQU5JRUwjQlJPVEhFUlMKRVZJQ1QjS0FPUyNJTEVUCkxPT0sjU0FTU1kjRklETwpWSUJFI0hBSEEjVElUQU4KRURFTlRBVEUjQVJMRU5FCiMjI1NVTiNEQVRVTSMjIwpTVEFCTEVTI1NIRSNIT0UKQ09DT0EjUE9LRVJIQU5ECkFMVE9OI0VERU4jQUxVRwpCTEFLRSNXRURTI0RPU0U="},{"title":"USA Today 02/06/98 \"NUMBERS GAME\"","author":"By Charles Preston","date":"1998-02-06","grid":"QkFTRSNQQUwjI0FUVEFSCkFMRUMjQU5FVCNUSEFORQpSSUNIQVJEVEhFRklSU1QKUkVUT1JUI1RPWSNSRUFECkVOUyNJTk8jUk9PRCMjIwojIyNFTEVWRU5USEhPVVIKSE9QSSNSRUwjI01PUlNFCkFNSUdPI1JJRyNTVURBTgpMRUFIUyMjSEFNI1NPRlQKRklGVEhDUlVTQURFIyMjCiMjI0hBTEEjUFJPI0NQQQpPUEFII0FEQSNJREFIT1MKU0VDT05EQU1FTkRNRU5UClNURUxFI1JJTEUjVEFURQpBU1NFVCMjU0lSI1NUSVI="},{"title":"USA Today 02/09/98 \"ROYALTY\"","author":"By Charles Preston","date":"1998-02-09","grid":"U1RBTVAjU1BBTSNEQUxFCkVBR0VSI0hBTE8jVVNFRApBUkVOQSNFTExBI0tJTkQKTE9SRE5FTFNPTiNFQVNZCiMjIyNDQVQjVEVSTSMjIwpNQUNLRVJFTCNSRUFMTVMKQUxMSSNUUklNI09ORUFMCkxPT04jSEVST0QjVEFOQQpUT05HUyNEQURPI0VSSUsKU1BFQ0tTI1NFTlRFTkNFCiMjI1JJT1QjUlVFIyMjIwpTVFlFI0NPVU5URkxFRVQKT1JFTyNLSVJJI0xBVENICkxVTEwjRUxJUyNPTUFIQQpERUxFI1RFU1QjTllMT04="},{"title":"USA Today 02/10/98 \"GORY\"","author":"By Charles Preston","date":"1998-02-10","grid":"UkFDWSNTQ1JPRCMjSURTCkVCUk8jUFJJREUjQUxFRQpGRVVESE9VTkRNT0JJTEUKI1NFQVNJREUjI0ZMQUlSCiMjIyNJTEUjQ0FGRSMjIwpTUE9PTlMjQ0FNRVJPTiMKTElSUiMjREFSSU4jVklTCk9MREJMT09EQU5ER1VUUwpQT0UjQUxFUlQjI0lMRVQKI1RSQUlQU0UjUEVURVJTCiMjI0JSRVQjQUlSIyMjIwpTVEFJRCMjT1JFR0FOTyMKTElORVNIT1RCUk9USEVSCkFNT1MjQURIT0MjTUVOVQpWRVgjI0lTRVJFI09CT0U="},{"title":"USA Today 02/11/98 \"FICTION FRACTIONS\"","author":"By Charles Preston","date":"1998-02-11","grid":"Q0FTQSNDUEFTI1RTS0VECkFQSVMjQUVSTyNSSEFNTgpSSUdTI05BSUYjQU9SVEEKUEVOTllEUkVBREZVTFMjCkVDTyNPSUxTI0VGVFMjIwpSRU5FR0UjI1NDSSNURUQKIyMjRElEQUNUSUNUQUxFClRIQUkjI0lUQSMjT0RJTgpXRVNURVJOU1RPUlkjIyMKQVNQI01BVCMjTUVTTUVSCiMjSE9PSyNQQUlOI0FWRQojTVlTVEVSWVNUT1JJRVMKRElYSUUjQUxJVCNFVE5BCkNSSUVSI1JPREUjTkFUUwpMRUFSUyNPTkVEI0RJU0g="},{"title":"USA Today 02/12/98 \"LOSS OF FACE\"","author":"By Charles Preston","date":"1998-02-12","grid":"Q0hFRiNDQUNUSSNCQUJFCkhBSUwjQUxBSU4jRVpSQQpFVE5BI0lETEVEI0dPQVQKVEhFVEhSRUVTT0ZFVkUjCiMjI0JPT04jI05FVCMjIwpCRUJPUCMjU0hFQSNRT00KQVFVQSNGUkVFU1QjVVJJClNVUlRPQUlSTUlTU0lMRQpSQU4jTUlNT1NBI0VMT04KQUxUI0FORVcjI1BBTFBTCiMjI0VOVCMjU0hBUSMjIwojU0FWSU5HTUVBU1VSRVMKRUVSTyNFUlVQVCNBSURFCk5JQ0sjU0FUSUUjS05JVApBU0hFI1NNRUFSI0VLRVM="},{"title":"USA Today 02/13/98 \"MIXED EMOTIONS\"","author":"By Charles Preston","date":"1998-02-13","grid":"U0FSQUgjSEFTUCNSQU1QCkFNT1JFI09HRUUjRUxJRQpMT1ZFTUVPUkxFQVZFTUUKVFNFI0FSUEEjS0lFRkVSCiMjI0FOSUwjVEFSQSMjIwpIRUZUI0NBTEVCI0xFR1MKQURJRVUjI0FMT0UjTU9PClNXRUVUQU5ETE9XRE9XTgpUSU4jRURJRSMjRUFURU4KRU5EUyNPTlNFVCNWRVJZCiMjI09HUkUjVE9MRSMjIwpBTkRSRUEjU0hPRSNBUkYKSEVBUlRCUkVBS0hPVEVMCkFFUk8jTElFTiNBUk9NQQpCUkVXI0VBU0UjUkVNSVQ="},{"title":"USA Today 02/16/98 \"PRESIDENTS' DAY\"","author":"By Charles Preston","date":"1998-02-16","grid":"U0tJTVAjQk9BQyNUUkFQCklOVEVMI0FSQ0gjV0FDTwpORUJSQVNLQUNBUElUQUwKRVdFI05FRSNUVVJOU1RPCiMjI1NURSMjI0ZPRyMjIwpXUklURVJTVEVGRkVOUyMKSEVST0QjRUFWRVMjQUNUCkFORVcjUEFMRVIjT0RFUgpNRU4jU0lUSU4jT1BJTkUKI1dFU1RDT0FTVFNUQVRFCiMjI0FSSyMjI0FIUyMjIwpQRU5OSUVTI0lSSyNCRUUKRURVQ0FUT1JCT09LRVJUClRJTFQjRVJJRSNTRU5UQQpTRUxBI0RFTlQjSEFaRVM="},{"title":"USA Today 02/17/98 \"CHEW THE FAT\"","author":"By Charles Preston","date":"1998-02-17","grid":"U0VSQk8jSElFRCNFTUlUCkxFSEFSI0VBU1kjU0lERQpBUkVOQSNYTUFTI1RTQVIKQklURVRIRUJVTExFVCMjClNFVCNPQVJTI0VZRUxJRAojIyNNUlMjI0FYRSNFTE8KTUFTQUkjVEFYSSNBVEVOCkVBVFlPVVJIRUFSVE9VVApBUkFTI05FU1MjSVRFTVMKUk9UI0FTSyMjRkRBIyMjCkFORU1JQSNMSUVEI0FEUwojI0hBUkRUT1NXQUxMT1cKSUdPUiNET0dTI05BSVZFClJJT1QjTElFVSNDSEVFUApBTkRZI0VMU0UjRVJOU1Q="},{"title":"USA Today 02/18/98 \"NATIONALITIES\"","author":"By Charles Preston","date":"1998-02-18","grid":"RElFTSNESUVUUyNNSVNUCkVSU0UjSVNMQU0jVU5UTwpTQUFEI0NMQVJPI1NDVU0KI1FVSUVUQU1FUklDQU4jCiMjI0VMQU4jI0VMTCMjIwpXQUlWRSNEQUIjTEVBU1QKQUZSQU1FI0xFRyMjU1RFCklUQUxJQU5TVEFMTElPTgpTRVQjI1JJTyNQT09ETEUKVFJFRUQjTlBSI1NMRUVUCiMjI0FBQSMjQUJFTCMjIwojRklHSFRJTkdJUklTSCMKSElMTCNBVE9MTCNQQUlECkVMTEUjUkVOQUwjT0dSRQpNRVNTI0lST05ZI1BFRUw="},{"title":"USA Today 02/19/98 \"LOOKING EAST\"","author":"By Charles Preston","date":"1998-02-19","grid":"R0FHQSNQQVJJUyNTRVJBCkFOTkUjQUdFTkEjQVZJRApTVEFSI0NBTk5ZI01JTUUKSElST0hJVE8jT1ZVTEVTCiMjI1NBTkUjT05FUiMjIwpLSU1PTk9TI01BU0FEQSMKSURPTCMjI0RJUlRJRVNUCkRMSSMjVEhFVEEjI1RTVQpERVNQSVNFUyMjI1JBTlQKI1NUQVRVUyNKVUpJVFNVCiMjI0dJTkEjT1NBUyMjIwpNSU1PU0EjS0FNSUtBWkUKQUNJRCNNQU5OQSNJUklTCkNPTEEjSVJBTkkjRUdHUwpFTkRTI1NFUEFMI1JPU0U="},{"title":"USA Today 02/20/98 \"CLEAN UP YOUR ACT\"","author":"By Charles Preston","date":"1998-02-20","grid":"U0FMQUQjQkxPS0UjREVSCkFSSVNFI0FBUk9OI0lGQQpHUkVBU1lTUE9PTiNSRkQKIyMjI1BBSUQjI09TVElBCkJFRFJPTEwjQ09CVVlFUgpFUVVBVEUjU1VCTEVUIyMKQlVTVFMjQkVMSUUjUkFHCk9BVFMjT1JBVEUjUklUQQpQTFkjU1BPVFMjVEFDSVQKIyNNT1RFVFMjQlVDS0xFClNQSU5BQ0gjQVJSRVNUUwpQSUxBRiMjRVRBVCMjIyMKRUVMI0ZJTFRIWUxVQ1JFCkVURSNFUkFUTyNFU1NBWQpEQVIjUkVCRUwjU0NBUEU="},{"title":"USA Today 02/23/98 \"TOAST TOPPERS\"","author":"By Charles Preston","date":"1998-02-23","grid":"QUhBQiNBRFpFI1FVQVNJClZBU0UjTEFPUyNVTkNVVApPQk9FI1RJT1MjSUxFREUKV0FGRkxFU1RPTVBFUlMjCiMjI0VFUlkjI0FTUyMjIwpTUEFERVMjUFNJI1NPUkEKQVVHVVIjU09VTkQjVklNCkNSRVBFUlVCQkVSU09MRQpLRU4jRFVST1MjQUxMRU4KU0VUQSNNQVgjRUdPSVNUCiMjI0dBQiMjRkxPVyMjIwojUEFOQ0FLRUxBTkRJTkcKSk9OQUgjQVRPUCNPTElPCkVMQVRFI0xBUFMjV0lMTApUQVhFRCNFTFNFI05FRUQ="},{"title":"USA Today 02/24/98 \"FICTIONAL\"","author":"By Charles Preston","date":"1998-02-24","grid":"TUFEQU0jQkFMTSNCSVRTCkFHT1JBI0xVQVUjVVRBSApSQVJFUiNFTkRTI0lTTEUKTVJNQUpFU1RZSyNDQUxNCiMjIyNPQVMjU0lOSyMjIwpTVVBSRU1FUyNFUlJBTkQKQ0xFTyNFRFRBI0FFUklFCkFUVFkjU0xFRUsjR0VUQQpEUkVBTSNZQVJOI0FOT04KU0FSTEFUI0xPSVNMQU5FCiMjI0ZMVUIjUEZDIyMjIwpPUEFMI05PQkxFSE9VU0UKTUVOVSNOT1JBI09JTEVSCkFSVFMjRUxBTiNPU0FHRQpSVVNII0xBVEUjTEVOQVM="},{"title":"USA Today 02/25/98 \"INITIAL IDENTITY\"","author":"By Charles Preston","date":"1998-02-25","grid":"SEFOUyNHUklTVCNKQUJTCkFMSUUjUkFOQ0gjQ0xBUApKRFNBTElOR0VSI1BJS0UKSk9JTkVEI0VORSNFVkVOCiMjI0NBRFMjVEFOTkVTVApHQU1FUExBTiNET04jIyMKQUxBI1RFVEVTI1NFTE1BCkVNQUojU0VWRVIjWUFSTgpMQU1QUyNERU1PUyNIRU4KIyMjTUlCI1JJQ0hBUkRTCkRFQk9SQUgjU0tFVyMjIwpBREFSI05BQiNQTEFOVFMKUklORyNKUlJUT0xLSUVOCkVUVEEjT1NJRVIjRUxMQQpTSFVOI1NIRUVUI1NFRVA="},{"title":"USA Today 02/26/98 \"TRANQUIL\"","author":"By Charles Preston","date":"1998-02-26","grid":"U0FORCNEQU5DRSNMRU1TCk9CT0UjUkVBTE0jQVJFQQpGRUxMI0FSSUFTI0tBTlQKQUxMSVNDQUxNI0FFVE5BCiMjIyNIT1QjTEFNUE9PTgpURUFTRSNFUElDQUwjIyMKQkFOVEFNI0FLQyNBVE9NCkFTVEkjQVRMRUUjQ09WRQpSRUVMI0lSRSNMT0lURVIKIyMjTElaQVJEI0FET1JFClBMT1dNRU4jUlJTIyMjIwpSRUNBUCNRVUlFVFJJT1QKQU1BVCNDVVJMUyNVU1NSCllBTEUjQUlTTEUjR0lMQQpTVEFSI0JMQVNUI1NUT1A="},{"title":"USA Today 02/27/98 \"LIQUIDITY\"","author":"By Charles Preston","date":"1998-02-27","grid":"U0VNSSNUQVJPVCNHRUVSCktMQU4jU1BBREUjQVhMRQpFTExBI0VTU0VTI0xJU0EKR0VUSU5UT0hPVFdBVEVSClNOQVJFUyMjTklQIyMjIwojIyMjV0VEIyNFQVNUT04KU1BPS0UjSVJBUyNUT1JPCldBVEVST1ZFUlRIRURBTQpBSVJFI05BUEUjQU1PTEUKVFJBTkNFIyNTT0QjIyMjCiMjIyNDSEUjI0hBVEVSUwpQT1VSQ09MRFdBVEVST04KQU5ORSNSQVJFUiNOQU1FCkFUSVAjU05FVkEjVFNBUgpST1RPI0VESUVTI1NFTkQ="},{"title":"USA Today 03/02/98 \"CAN'T SINK THESE SHIPS\"","author":"By Charles Preston","date":"1998-03-02","grid":"Q0FQRVIjSFVMQSNTUEFECkFHQVZFI0FOSUwjUEVSSQpGUklFTkRTSElQI0FOWUEKRUFSI1RPVE8jSEVSTUFOCiMjI1JFVkVSVCNBR0FOQQpERUNBREUjU09GVEVOIyMKSVRFUyMjQkVSTEUjU1RHCkNBTkFTVEEjTUFSU0hBTApFTFMjV09SU0UjI0VJUkUKIyNPUklFTlQjVEFQUEFOClNDUklQI1NFQ0FOVCMjIwpUQVNTRUwjTk9SRCNTUlMKQUNIRSNBVVRIT1JTSElQClNUSVIjU1RPQSNFUkFUTwpISVBTI1RFUk4jQUlNQVQ="},{"title":"USA Today 03/03/98 \"TOM, DICK AND HARRY\"","author":"By Charles Preston","date":"1998-03-03","grid":"UkFNUCNQRVJJI1RFQU0jCk9ET1IjSVJBTiNIT0xZIwpDUlVJU0VBTkRIQU5LUyMKS0lOREVSIyNJQU4jQVRPCk9GVEVOI09BVEgjU0xJRApGVFMjI0VMQkUjU0xJQ0UKIyMjVE9OR0EjQVRPTkFMCkNBVkVUVEFORFBPV0VMTApPUElORVMjRFJPUFMjIyMKUkVTVEEjQ09FRCMjQ1BBCkFSQ0gjUE9ORCNNQUxBUgpMSUUjU0lSIyNTQUxBTUkKI1RSVU1BTkFOREpBTUVTCiNJQUdPI0VMRUEjTU9MRQojRkxPRyNUT09LI09SQU4="},{"title":"USA Today 03/04/98 \"NINETIES NEWCOMERS\"","author":"By Charles Preston","date":"1998-03-04","grid":"U0hBTkEjQU1BU1MjWkFQClRVRE9SI0NBTlRPI09MRQpBUk9TRSNISURFT05PTU8KQk9CSEFNRUxJTiNPTUFOClNORUUjRVNTI0NQUiMjIwojIyNTT0wjI0NIT1dERVIKQUREI1NFTk5BI0tBUkxBClJPT0tJRU9GVEhFWUVBUgpFTEdBUiNTQ09VUiNETkEKU1RFUklMRSMjUlNUIyMjCiMjI0FTQSNQVE8jUkFNUApTTEFUI0RFUkVLSkVURVIKVElNU0FMTU9OI0FNQVRJCkFWRSNTRUlORSNNT1JFUwpURVgjSVNMRVQjQlJJREU="},{"title":"USA Today 03/05/98 \"AIRBORNE\"","author":"By Charles Preston","date":"1998-03-05","grid":"Q0hJQyNTUEVMVCNCT0FUClJFRE8jUEFUSU8jQUJCQQpPTUVOI0VMVE9OI01PTEQKI1NBQ1JBTUVOVE9CRUUjCiMjI0hFUkUjI09STyMjIwpIQUJJVCNSUE0jRE9CQlMKRUxBVEVEI0xFRSMjRUVMCk1BREFNRUJVVFRFUkZMWQpBVEUjI05VVCNDUkVPTEUKTkVSVkUjU09TI0FMR0VSCiMjI0FTUyMjQ09URSMjIwojTU9TUVVJVE9DT0FTVCMKV0FSUyNHT0VUSCNTT0hPCklOQ0EjQU5OSUUjRVNBVQpHRUFSI1JBREFSI0RPTlQ="},{"title":"USA Today 03/06/98 \"SOUL MATES\"","author":"By Charles Preston","date":"1998-03-06","grid":"VEFMVVMjRkFEUyNPQ0FTCk9ESVNUI0VERU4jUkFSRQpPWlpJRUFOREhBUlJJRVQKIyMjQVJDI1NPUkUjTk9UClJFTSNPVE8jUkVWI0FMRQpFTVUjTFVNQU5EQUJORVIKQklUUyNQRVQjI01BRCMjCkFUVEFSI05PVyNQUkFETwojI0FEQSMjTkFHI1RCQVIKQkVOQU5ESkVSUlkjRVRBClJVRCNTRUEjTU9BI0xFRApJQ0ojT1JDQSNXSE8jIyMKVEhFTE1BQU5ETE9VSVNFCk9SRkYjSU5FRSNPU0NBUgpORUZTI0xBV04jU1RFTEE="},{"title":"USA Today 03/09/98 \"IN THE RED\"","author":"By Charles Preston","date":"1998-03-09","grid":"QUdPRyMjT1JBTCNSQUdTClBBTklDI0xPUkUjRURFTgpFTEVWRSNJQklTI0RPTkUKREFSRURFVklMUyNFUklFCiMjIyNFVkVOI0VNQ0VFIwpBVkVSU0UjI05FUk8jIyMKTUlSRSNTQVJBI0VSQVRPCkFTSURFI0hBUyNEQUtBUgpURU5PUiNPTUFSI1RJUkUKIyMjQ0lUWSMjQVJFTkFTCiNNQVRDSCNTQUtJIyMjIwpTRUdPI0lOQ1JFRElCTEUKQVJBQiNFREFNI0VSUk9SClJJVEUjVkFMRSNTS0lOUwpJVEVSI0VLRUQjI1NNRUU="},{"title":"USA Today 03/10/98 \"SHAPELY\"","author":"By Charles Preston","date":"1998-03-10","grid":"TUFLRSNTSUJTI1FBTkRBCkFMRVgjQ1JBTSNVTkNBUApDSVJDTEVUSEVXQUdPTlMKSEVSRU9OI1NMQVYjU0VFCiMjI0xPQUYjTElFRiMjIwpSQUojVFJJUCNUUklBTFMKQURPUyNJUklTI0VYUEVMCkJBQ0tUT1NRVUFSRU9ORQpJTktFUiNUVUVTI0RSSVAKTk9TSUVSI0VUVEUjVE5UCiMjI05BSUwjU0VMRiMjIwpKQUIjU05FRSNSSU9URVIKQkVSTVVEQVRSSUFOR0xFCkFSRUFSI1JURVMjRElBTApST1dEWSNZQU5LI0FGTFk="},{"title":"USA Today 03/11/98 \"GEOGRAPHICAL WONDERS\"","author":"By Charles Preston","date":"1998-03-11","grid":"QkVFUyNXRVBUI0JJWkVUCk9NTkkjQVJFQSNSRUlORQpSSU5HI1RPUkkjRVJPU0UKR1JBTkRDT1VMRUUjTlVOCiMjI09PSCMjU0VEVUNFUwpDT1JSSURPUiNHRVRBIyMKQVBPI1RPUkFII1JFTkFMCkxBWVMjR0FUT1IjU1lORQpGTEFUUyNMRVBVUyNPTkEKIyNMQVRFI1JFTUFJTkVECkpBR0dFUlMjI0lOTiMjIwpJVE8jV0FUS0lOU0dMRU4KQkVSRUEjSU5DQSNST1ZFCkVBR0VSI0xFT04jSUJJUwpTTUVMVCNURU5UI0RPTFQ="},{"title":"USA Today 03/12/98 \"TALK RADIO, CB-STYLE\"","author":"By Charles Preston","date":"1998-03-12","grid":"UkVET1MjI0ZJU1QjU0lMCkxFRUNII0FVRElPI0FNSQpTS0FUSU5HUklOSyNKQUIKIyNERVZJTCMjR0FSQUdFCkNBUFQjTE9DQUxZT0tFTApPREVUUyNXQUxFU0EjIyMKTUFERVVQI05FVCNSQklTCklOQSNCRUFUU09OI0VNVQpDT0xEI0FMSSNOQVRBTlQKIyMjQVNDRU5UI0VSUk9SCktJRERJRUNBUlMjRVRUQQpBTENPVFQjI0VBVEVSIyMKUkVDI1RJSlVBTkFUQVhJCkFEQSNFTUVORCNQT1BJTgpORUIjUkVNTyMjQVBTSVM="},{"title":"USA Today 03/13/98 \"THE COMMON MAN\"","author":"By Charles Preston","date":"1998-03-13","grid":"QkFTSUUjU0lORSNUUkFQCkFMQVJNI01ESVgjUkVETwpKQUNLT0ZBTExUUkFERVMKQVNLI1RPUlkjUklERExFCiMjQ1JFUFQjQlVHRVlFRApDT0xPUlMjRkFERVIjIyMKQVRPTVMjQklLRUwjQk9XClJJVEUjQ0FSRUQjU0lNSQpBU0gjQ09SRVIjTk9MQU4KIyMjQk9SRUQjTkVXQVJLCkNFTExBUlMjRkVJTlQjIwpPUElBVEUjVEFSVCNFQVIKVE9NRElDS0FOREhBUlJZCkVESUUjVElSTyNFTEFURQpTRVRTI1NQQU4jUklMRVM="},{"title":"USA Today 03/16/98 \"GO-TOGETHERS\"","author":"By Charles Preston","date":"1998-03-16","grid":"RkFCI0JBU0lTI0xBU1NPCkRVTyNPUkFURSNBTFRPTgpBUlQjV0lORUFORERJTkUKI0VTVEUjIyNMQVNBR05BCk5PV0FORFRIRU4jI01FTApBTEFOI1JPQUQjU1RBVFMKQkVOI1NFV04jWUVBIyMjCiNTQUxUQU5EUEVQUEVSIwojIyNJQU0jU0VOVCNTSVAKUFJJVlkjQ0FOVCNJVFRPCkxFUyMjRE9XTkFORE9VVApVU0hFUkVEIyMjSU9OQSMKTVVUVEFOREpFRkYjSUxMClBMQU5TI0xJTUlUI0FMSQpTVFJBUCNFQk9OWSNOWUU="},{"title":"USA Today 03/17/98 \"EMERALD ISLE\"","author":"By Charles Preston","date":"1998-03-17","grid":"U0hBUlAjU0xBVyMjQVBFClRBTElBI1RPR0EjV0VBUgpBU1RBUiNJR09SI09SQ0EKU0hJTExFTEFHSCNMSUVTCiMjIyNPUEVOI09GRkVSIwpTQVJUUkUjI0JMQUgjIyMKRVJFSSNFSVJFI0NPU1RBClRBTVBTI05FRSNUVVRPUgpTTE9QRSNUQVJBI05BTUUKIyMjRUNITyMjQkFER0VTCiNGT1JURSNTSUxMIyMjIwpQQVBBI0xFUFJFQ0hBVU4KT1ZFUiNNQVJFI0FJU0xFClRPUlkjRVZBTiNQTEVBVApTUkEjI1RFVEUjUExBTlM="},{"title":"USA Today 03/18/98 \"OSCAR-WINNING MOVIES\"","author":"By Charles Preston","date":"1998-03-18","grid":"R0lHSSNCRVJUSCNFTUlUCkxPVUQjRUxJSFUjTllSTwpVTkZPUkdJVkVOI0FGQVIKR0FGI0hPU0VTI1NDQU5UCiMjI0JFVEgjVFVUVEkjIwojU0NBVCNBTklNQSNSQUcKU0hBU1RBI0lOQUJBTElOClBPU0UjVEFOR1MjTEFNQQpFVkFEQUJMRSNTUElERVIKREVCI0JBTFNBI1JBWUUjCiMjTElCWUEjREFJUyMjIwpBVEFOWSNCRUFOUyNFVkUKTEFORCNHT0lOR01ZV0FZCkVDQ0UjRFVOQ0UjRE9MRQpDT0FYI1NURUVMI1NLRUQ="},{"title":"USA Today 03/19/98 \"HIGH PLACES\"","author":"By Charles Preston","date":"1998-03-19","grid":"UkhPREEjQUxBUyNTTk9CCkVFTEVSI0dJU1QjQ0FWRQpTQUxWRSNFTENBUElUQU4KVFJBSU5FUiNPSUwjT0xECiMjI0xBWCNTVFJBTSMjIwpQUkVTU1VSRSNTVEFCTEUKTEVOVCNEQVJUI1RSSUVEClVOVE8jRU5WT1kjT0xFRwpTVEVXUyNUQUtFI09HUkUKSEFSRU1TI05FQVJORVNTCiMjI1JPQVNUI1JPQiMjIwpBTEwjT0NUI0VTU0VOQ0UKTU9VTlRIT09EI0NMRUFOCklOQ0EjRUxMQSNPTEFORApERUVQI1RFRU0jRVNURVM="},{"title":"USA Today 03/20/98 \"ALPHABET SOUP CONTENTS\"","author":"By Charles Preston","date":"1998-03-20","grid":"TFNUI1NIQUJBI1BFVEFMCkFUQSNIT0xFUyNBQkFURQpTRVBUVVBMRVQjTE9CRVMKU0xFRVQjIyNVUE9MVSMjCk9BU1QjUEFTVEEjQUxTTwojIyMjT1VUU0VMTCNBSEEKQVNQSEFMVFMjI0FMVE9TClBBTEFURVMjUEFQRUVURQpQTEFUSCMjU1VQUE9TRVMKTEVUI1NUQVBMRVMjIyMjCkVQRUUjU0xBUFMjQUxCQQojI0xBUEVMIyMjUExFQVMKT0JFU0UjT1NURU9QQVRIClRPVEVTI1RFQUxTI1NIRQpUQVNTTyNTVE9MRSNFU1M="},{"title":"USA Today 03/23/98 \"POLES\"","author":"By Charles Preston","date":"1998-03-23","grid":"UkFQVCNFRE5BIyNBUElOCk9NQVIjQkVFUyMjREVWTwpCWVJPTkJMQUNLI0VST1MKRUxBSU8jI1RFTkFOVFJZCiMjI0tPRUwjTk9HTyMjIwojU1RBTkZPUkRXSElURSMKTE9ZI0VUUkUjI0FESU1FClBVUEEjU0VUVE8jU0FMSwpTVEVOTyMjUkFSQSNSWUUKI0hFTk5ZWU9VTkdNQU4jCiMjI09EQVMjU09JRSMjIwpDT05URU5UUyMjUkFJU0UKQVJJQSNHQVJZT0xETUFOClJFTlQjI0RPRVMjT05UTwpBTEVFIyNTU1RTI1dPRVM="},{"title":"USA Today 03/24/98 \"BEHIND THE NUMBERS\"","author":"By Charles Preston","date":"1998-03-24","grid":"QVJBQiNTQVNFI0FCTkVSClNBQkUjQU5PTiNDTEFSTwpBTU9SI1VOSVQjVEFTU08KRk9VUlNDT1JFI09DVEVUCkVTVEFURSMjUkFOSyMjIwojIyMjQVJURSNSRUpFQ1QKQU1BVEkjQU1BUyNBUVVJClNPTE9OI1BBUiNBQ1VURQpTQUJVI01FSU4jU0tJRVMKRU5BQ1RTI0xPQk8jIyMjCiMjI0hFU0EjI0lOTUFURQpMT0FEUyNTTkFLRUVZRVMKT1JOT1QjQ09MRSNBUkFUCkNBTldFI09ET1IjREVMRQpPTkVORCNURUVTI0VTU0U="},{"title":"USA Today 03/25/98 \"GET A MOVE ON\"","author":"By Charles Preston","date":"1998-03-25","grid":"VkVTVFMjU1RJTEwjT1JSCklOVFJPI0hBTk9JI0NFRQpTUEVFRERFTU9OUyNFU1MKQ0xFRVNFIyNOSVRSQVRFCk9BUlMjU1NXIyMjQU5PTgpVTkUjIyNIQVIjRVZJQ1QKU0VSVCNNQUtFVFJBQ0tTCiMjI1NIQUtFQUxFRyMjIwpTVVBFUlNPTklDI0VBU1QKVU5JVFMjU0VSIyMjVVRFCk5BUFMjIyNEU1QjRURFTgpTV0VFVElFIyNBTExJRUQKUEFUI09OVEhFRE9VQkxFCk9SVCNTQ09VUiNJRExFUgpURUUjU0FORVIjU0VFUlM="},{"title":"USA Today 03/26/98 \"GET A GRIP\"","author":"By Charles Preston","date":"1998-03-26","grid":"Uk9UQyNDQVJQUyNDQVNICkFNQUgjQVZJTEEjQVJMTwpOQVRFI1ZJVEFMI1JFQUQKR1JBU1BFREFUU1RSQVdTCiMjI1NBRCMjI0FSRSMjIwpGUklNTCNTSUIjRUxBVEUKQUlERSNTVE9MRU4jTElUCkNMRU5DSE9ORVNURUVUSApFTEEjTEVWSUVTI1JVTEUKVEVTVEEjRUFQI0xBVEVSCiMjI0VOUyMjI1NJUyMjIwpFTkdBR0VUSEVDTFVUQ0gKUk9BTSNBUk9NQSNSSUxFCklETEUjTUFSSU4jRUxVTApTRUVEI1NNQVJUI1NFRVA="},{"title":"USA Today 03/27/98 \"BOTTOMS UP\"","author":"By Charles Preston","date":"1998-03-27","grid":"VEVDUyMjQkVFUiNCVVRTCk9CT0UjQ0FSVkUjVU5JVApHQVpBI0FIRUFEI1NNRUUKQU5ZUE9SVElOQVNUT1JNCiMjI09DVCMjI0NPT1JTIwpTSE9SVEFORFNUT1VUIyMKREFOVEUjQVJPRSNUR0lGCkFSQyNUQUJBUkRTI0FMRQpLRUVQI0lPTkUjQUdHSUUKIyNCT1VSQk9OU1RSRUVUCiNTSU5HSCMjI0FDRSMjIwpDQVRDSEVSSU5USEVSWUUKUlVUSCNBRVJJRSNMRUFECklERU8jREVBTFMjRUxMRQpCSU5TI1NLRUUjI1lTRVI="},{"title":"USA Today 03/30/98 \"WOW!\"","author":"By Charles Preston","date":"1998-03-30","grid":"T1BFQyNVU0VSI0FCQVNFClBPTE8jTk9SQSNMSVRIRQpUT0xMI0JVUlAjSUNJRVIKI0hFQVZFTlNUT0JFVFNZCiMjIyNFTkQjI0hJUCMjIwpTVEFSRUQjTVRBI1NBTkEKRUFURVIjU0FBUiMjTE9HClRIQVRTSU5DUkVESUJMRQpIT0kjI0RBUlQjT0xFQU4KU0VMQSNFR08jVEFMRU5UCiMjI1NQQSMjUEFMIyMjIwpHT1NIQUxMSEVNTE9DSyMKQUNUT1IjQUlEQSNOT09SClNUT1JFI1RFQUwjRUNITwpIT1BFRCNJRExFI0xBTE8="},{"title":"USA Today 03/31/98 \"ICE-CREAM HOLDERS\"","author":"By Charles Preston","date":"1998-03-31","grid":"TEFHUyNBUFJPTiNTUEFUCkFNRVMjVFJBREUjVVJHRQpDT05FU1RPR0FXQUdPTlMKRVJFI0FJTCMjU1RBQkFUCkRBVklEQ09ORSNPUkFURQojTEFORCNHT1JFI1NURVIKIyMjREVCI01BUkMjRVNTCiMjQ09ORVlJU0xBTkQjIwpHUEEjU0VBTiNFTk8jIyMKUkFOSyNGUkVEI05PUkEjCklOVEVMI0RFQUNPTkVTUwpTVEVSRU8jI01BTiNNS1QKVEhFU1RPTkVPRlNDT05FCkxFTkUjUEVOTkUjQVRPTQpFUlNFI1NBVEVTI1BFVFM="},{"title":"USA Today 04/01/98 \"REAL KIDDERS\"","author":"By Charles Preston","date":"1998-04-01","grid":"UkVCQUlUI0tBTEkjRU1TCkFSTEVORSNBTk9OI0xBVwpUUklDS05FTFNPTiNFQ08KU1NOIyNTTEVFSyNFQ0hPCiMjRFVQRUVMTElOR1RPTgpUT1NUQURBIyNOQUcjIyMKVVBQRUQjTkFUVFkjVE9XCkJJT1MjRk9MSU8jVEVTSApTRVQjR09SRU4jTU9DSEEKIyMjRlJPIyNGT1JESEFNClJPQkVSVEZPT0xUT04jIwpJWk9EI1JBUElEIyNJUkEKQ09YI01BREVMSU5FQ09OCkVORSNJQ0VSI0VOUkFQVApSRUQjTEVEQSNTV0FMRVM="},{"title":"USA Today 04/02/98 \"BLUER THAN BLUE\"","author":"By Charles Preston","date":"1998-04-02","grid":"UEFORyNFUk9ERSNTTEFUCkFMT0UjUklWQUwjT0lTRQpDQU5OT05CQUxMQkxBSFMKU0VPVUwjU0xZI0xVUkVTCiMjI0lFUiMjI0dBQiMjIwojU0lOR0lOVEhFQkxBSFMKU0FWRSNNT1JBTCNFTEFOCkNVSSMjI1JVVCMjI0xJRQpPTkVSI0FNRUVSI0JBTEUKV0FTSEJPQVJEQkxBSFMjCiMjI1lBSyMjI0lPTiMjIwpPQVNUUyNLRVcjT0RPUlMKQkxBSFNJTlRIRU5JR0hUCklNQU0jREVOSVMjVFJFRQpUQVJTI1NXQU1QI1NFRU0="},{"title":"USA Today 04/03/98 \"A CERTAIN SUNDAY\"","author":"By Charles Preston","date":"1998-04-03","grid":"QUNIUyNBU1BJQyNPTk9TCkNSQVQjU0VFU0EjUklURQpUWVBPI01FVEFMI0FDSEUKIyNQQVJBREVXQVRDSEVSCkFOSSNPUllTI0JBTEVSUwpTT05BVEEjI01BUkUjIyMKU1RFUCMjSEVJU1QjU0VUCkVBU1RFUkVHR0hVTlRFUgpTVFMjTkVST1MjI0FFUk8KIyMjUEVTTyMjRU5UQUlMClNFU0FNRSNTSUxPI01FTApDQU5EWUNPTlNVTUVSIyMKQUdBUiNUUklFRCNWT0lEClBMSUUjRU5UUkUjRUxMQQpFRUxTI0RPU0VTI1NMRVc="},{"title":"USA Today 04/06/98 \"NAME DROPPING\"","author":"By Charles Preston","date":"1998-04-06","grid":"QVRPTSNTVEFCIyNCQVRTCkhBUkkjTEVUTyNOT1RJVApBWEVMI0lTVE8jRUJPTEkKQklMTFlDTFVCI0FCTkVSCiMjI0FTRUEjI0ZMWUVSUwpPWEVZRSMjSlVMRVAjIyMKTUVUI1JBUElORSNJREVTCkFOQVQjTUFNSUUjTkFUTwpOT0xPI0FJTVNUTyNXT04KIyMjTUlORFkjI05BTk5ZCkFMVU1OQSMjQ0FMTCMjIwpNQU5ZUyNURUREWUJFQVIKSU1BR0UjQVVSQSNJTlJFCkdBTVVUI0ZST0cjTklOQQpBU0lOIyNUT01FI09ET1I="},{"title":"USA Today 04/07/98 \"TWIN CITIES\"","author":"By Charles Preston","date":"1998-04-07","grid":"U1RBRyNTTk9PVCNPQVRICkhPRVIjVE9STUUjWExJSQpFU1NFTkVTU0VOVElBTFMKRUNPTk9NWSNHT09ESUVTClBBUEFMIyNUQU5ZQSMjIwojIyNEQU5DRSMjT05TRVQKI09SQU5PUkFOR1VUQU5TCkFMQSMjVEFCT08jI0lDRQpSSUdBUklHQU1BUk9MRSMKQ09VVEgjI0dFVFVQIyMjCiMjI1JPT0tTIyNMRUFTRQpBUkdPTk5FI1NURVJOVU0KVEVNUEVURU1QRVJBTkNFCk9QQUgjQU5FQVIjVE9STgpQT05ZI1BFVFJJI0VZRUQ="},{"title":"USA Today 04/08/98 \"DUOS\"","author":"By Charles Preston","date":"1998-04-08","grid":"QUxTTyNCQVNII0NVTFBBCkdJTEwjQVJFQSNPTkFJUgpBTUlEI1RFTkQjVVRURVIKUk9NRU9BTkRKVUxJRVQjCiMjI05DQUEjI05FRSMjIwpVU0EjT05TSE9SRSNMQkoKU1RSVU0jI0FMSSNCQVJFCkhBTlNFTEFOREdSRVRFTApFUklFI1VORSMjRVRIRUwKUlRFI0xJTlNFRUQjRURZCiMjI0ZJRyMjQ1JJUyMjIwojV0lMTElBTUFORE1BUlkKSEFOT0kjTU9SRSNPTEVPCkFSR1VFI0VBVFMjUk9BUgpTVEFSUyNTVEVUI0VUUkU="},{"title":"USA Today 04/09/98 \"PANNED\"","author":"By Charles Preston","date":"1998-04-09","grid":"QVNPUlMjU0NBQiMjU1BZClRFUkFJI1BBSVIjUEFMTwpPUkFURSNVR0xJI0FVRUwKUEFORUdZUklTVCNOREFLCiMjIyNFSU5FI09WT0lEUwpFTEFQU0UjU0FORVIjIyMKREFEQSNMU1RTI1RBUk9UCkdSRU5BREEjSVNPTUVSUwpFU1NBWSNOQVNBI0FOTkEKIyMjVEVORFMjTFVTVEVSCkdFTkVSQSNJVkVTIyMjIwpFVkVMI1BBTkFNQU5JQU4KTEFWQSNFVklMI0dFT0RFCklERVMjUkVOTyNFU1RFRQpERVIjI1lTRVIjU1RBTkQ="},{"title":"USA Today 04/10/98 \"GET THE POINT?\"","author":"By Charles Preston","date":"1998-04-10","grid":"U0NBUiNTQUpBSyNPUEVOCkxBUkEjRVRVREUjRk9SRQpBREVOI0xBRExFI0ZJR1MKUEVOQ0lMUE9JTlQjTk9UClNUQUlSIyMjQkVSRVQjIwojIyNERUFMUyNST0RFTlQKT09QIyNET1VSI1ZJREVPClBPSU5UT0ZOT1JFVFVSTgpBTk5FRSNUVU5BIyNQT0UKTEFQU0VTI1BBTkVMIyMjCiMjT1NVTkEjIyNMQVZFUwpDSEkjUE9JTlRPRlZJRVcKTE9ORyNPU0NBUiNJU0xFCkFMVE8jUExBQ0UjU1RFUApQRVNUI1lFQVRTI0hBUlQ="},{"title":"USA Today 04/13/98 \"O-ZONE\"","author":"By Charles Preston","date":"1998-04-13","grid":"T0NIUyMjUFRPIyMjR09CClNIT08jUFJPVk8jTk9OTwpNT09HI0hPTk9SI09SVEgKT0NUT1BPRFMjVE9SUE9SCiMjI09SVFMjTE9GVCMjIwpIT09ET08jQ09ORk9STSMKT1RUI1NOT1JUI1NOT09EClRST0QjU0xPVFMjU1RMTwpTT05PRiNNT09DSCNPVE8KI1NPTE9NT04jSE9SUk9SCiMjI0xPT1MjQk9OTyMjIwpTQ0hPVFQjQ09PS0JPT0sKQ09PUCNUT1BPTCNPVEhPCk9ITVMjT0RPUlMjTU9OTwpXT08jIyNPU1MjI0JPT1A="},{"title":"USA Today 04/14/98 \"PERFECT PITCH\"","author":"By Charles Preston","date":"1998-04-14","grid":"U0xBUFMjQUxHQSNNVVNFClBBVElPI0xFTlMjVU5BTgpBS0lORE9GR09MRlNIT1QKUkVQRUFMUyNNQVJJQU5BCiMjI1RTRSNERVRFQ1RFRApUU0FSI0FQRSNFT00jIyMKSEFWRSNURUFNI05PQkVMCkFMRUUjRUxMSVMjRE9MRQpURVJSRSNURVNUI1VOU08KIyMjRUxNI1JDQSNMRUFOClJFQVNTRVNTI1RPQSMjIwpFTExJT1RUI0NPUFRFUlMKUEVERExFUlNQUkFJU0VTCkVNRVUjUkFSQSNST0FTVApMSU5FI1NQQVMjVE5VVFM="},{"title":"USA Today 04/15/98 \"LIMBO\"","author":"By Charles Preston","date":"1998-04-15","grid":"R0FSQiNUT0FEI0JMRUFSCkFSSUEjRVJJRSNFQUdMRQpFTVBUWUFSTVMjQURBTEUKTFlFI1BTSSNLQVRZRElECiMjI1RSRU5UI1JFRiMjIwpHTE9XRVIjSEFSUklTT04KTEVWSVMjTElNTyNORUJPCkFHSU4jU0lORVcjR1JFWQpTSU5LI0VMS1MjTUVVU0UKU1RFTExBVEUjVE9STUVTCiMjI0VBUiNSWUFOUyMjIwpNQUxUT1NFI0VSRSNTSUUKQUZPT1QjQ1JBWllMRUdTClRBTEVTI0NBUkEjRUdHUwpFUkFTRSNMWU5OI01BWU8="},{"title":"USA Today 04/16/98 \"VICISSITUDES\"","author":"By Charles Preston","date":"1998-04-16","grid":"QVJDQSNQUklPUiNXQURJCkNPT0wjUk9TU0kjSUNPTgpUVU1CTEVET1dOI1NFRUsKU1RFRVBTI0xFVEhFIyMjCiMjVVJOUyNBR0lPI0RFSQojT1BUI1VQVE9OT0dPT0QKQVBQI0JQT0UjI0RPV1NFCkRFQVJFU1QjU1RFTk5JUwpPUk5PVCMjUk9PRCNUTlQKQkFDS0VERE9XTiNQUlMjCkVTRSNMRUFOI0VCUk8jIwojIyNBU0FNQSNET09ETEUKVE9MTCNGT0xMT1dFRFVQCkVEQU0jRU5ET1cjTUVSRQpBRERTI1JFU0lOI1NORUU="},{"title":"USA Today 04/17/98 \"OCK-OCK\"","author":"By Charles Preston","date":"1998-04-17","grid":"Q0FTU0lBIyNLRUcjR0FPCkFUVEVORCNOVVRTI09JTApTSE9DS0pPQ0tIT1dBUkQKVEVOU0UjQ09MRSNJTEwjCk9ORSNERUwjQUxBU0tBTgpSQVJBI1JPTyMjUkVJTkEKIyMjVEhJQ0sjU1RBQ0VZCiMjQ0hPQ0tBQkxPQ0sjIwpTSEVMTFMjUEFZT1IjIyMKR09SRUQjI0lMRSNFR0dTClRTRVRTRVMjVFJTI0FSQQojQU1JI0xPQ0kjQVBTSVMKS05PQ0tLTk9DS0pPS0VTCklOTiNBSURFI1RBTEVTRQpNQVkjSU5FIyNTS0FURUQ="},{"title":"USA Today 04/20/98 \"GIMME AN ``A\"\"","author":"By Charles Preston","date":"1998-04-20","grid":"QVNTQVlTI1BFQ1MjU0FDClRFQVNFVCNEQUxZI0FWSQpNQUxUQUxJUVVPUiNJQU4KIyNFUlJPUiMjR0lHR0xFCkFSU09OI01FTlNBUk9PTQpDQVQjI05BUEEjI0FOTkEKVUdBTkRBI0lSQU5JIyMjCiNFWEFDVEFTQ0lFTkNFIwojIyNTTE9NTyNNQVlIRU0KQVNJUyMjSURPUyMjRUxJCkdBR0FPUkRFUiNTQVlTTwpBTExVUkUjI0NMRVZFIyMKVE9PI1BBUktBQVZFTlVFCkhPTyNBREVFI1ZFUk5BTApBTlMjSFlNTiNBUlRFUlk="},{"title":"USA Today 04/21/98 \"FRUITIER\"","author":"By Charles Preston","date":"1998-04-21","grid":"QUZJUkUjT01BUiNUQVVUClJJR0VMI1BPU0gjRUlSRQpDTE9DS1dPUktPUkFOR0UKI0VUQSNIUkUjI0FSVEVTCiMjI0xBSVQjRVRUVSMjIwpUSEVMRU1PTkRST1BLSUQKUkFMRVMjI1VOQU4jQU1FClVTRUQjU1RSQU0jVFJJUApNVE4jU0VBUyMjUk9MTE8KUEVBQ0hUUkVFU1RSRUVUCiMjI1JBU1AjSU5TVCMjIwpDT0JPTCMjQVRFI1VSTiMKQUJPV0xPRkNIRVJSSUVTCkxPUkUjQ09ORSNFRUxFUgpNRU5EI0FQRVIjQ1JFRE8="},{"title":"USA Today 04/22/98 \"STATES-MEN\"","author":"By Charles Preston","date":"1998-04-22","grid":"QkFNQSNDU1BBTiNNT1RICkFCRVQjQ0FSTE8jQVJFQQpLRU5UVUNLSUFOI1JFQUwKRUxTQVMjRU5ORSNPR0xFClJFQUNUUyNUQVRUT08jIwojIyNIQUlMIyMjQU5OSUUKU0FWRSNMRUFERVIjSURBCkFMSSNFVkVSRVNUI0FFUwpOT1IjTEFSSUFUI0dOQVQKREVHQVMjIyNORUlMIyMjCiMjSUNFTUFOI1NUQUdFUwpET05UI0VSSUUjSVNFUkUKT0xJTyNURU5ORVNTRUFOCkxFQVIjQU5OT1kjRVNTTwpUT05TI0xBWU5FI1NFRVI="},{"title":"USA Today 04/23/98 \"SENTRY SPEAK\"","author":"By Charles Preston","date":"1998-04-23","grid":"V0VFRFkjSU5BI0VMQVRFCkFOVFJBI0NPQiNMT0JBUgpTVEFZV0hFUkVZT1VBUkUKIyMjU0xBTSNSRU5UIyMjCkFERCMjTUFJRFMjI1BUQQpMT0VTUyNOTkUjQk9MQVMKQk9OSUVSI0dFTkVSQUxTCiNET05URVZFTkJMSU5LIwpXQVRDSE1BTiNBVE9ORUQKSURFRVMjR1VTI1NORVJEClBTUyMjRlJFVUQjI0RTVAojIyNBUkVBI0JSRVQjIyMKTEFZRE9XTllPVVJBUk1TCk9MRUlOI1RPUiNTVEVFUApXQVRUUyNTVU4jVEVMTFk="},{"title":"USA Today 04/24/98 \"CHAMPIONS\"","author":"By Charles Preston","date":"1998-04-24","grid":"QkFUSCNHTE9TUyNIQUxUCk9MSU8jTEFETEUjT0RPUgpSQU5UI0lOQUlSI09ESUUKR1JFRU5CQVlQQUNLRVJTCiMjI0xJTEkjIyNBRURFUwpGQU1JTFkjQkVSUlkjIyMKQVBJRSMjU0FESUUjS0FUCkRFVFJPSVRSRURXSU5HUwpFWEUjUFJFRU4jI0xFRUsKIyMjREVFTVMjT0dMRVJTClVTSEVSIyMjVFJFSyMjIwpDSElDQUdPV0hJVEVTT1gKTEFLRSNBUklFUyNNSU1JCkFNRU4jTUFMTU8jUExBTgpORVNUI0VMTEVOI1RPTkc="},{"title":"USA Today 04/27/98 \"ASSONANCE\"","author":"By Charles Preston","date":"1998-04-27","grid":"SU5DQSNSRU5PI1NUUk9QCk5FUkkjQUxPUCNBUk9MTApGT1VSU0NPUkUjVEFVUEUKT05FU1RFUCNDTEFOR0VECiMjIyNBUkVTI0lOQ0gjIwpTQUxVVCNESVZWSUVTVVAKQU5PU0UjI0xBSUMjVFJJClJJQ08jU1BFTkQjTVVTRQpBVEEjU1RVTiMjU09GQVIKSEFMRlBJTlRTI0NBRkVTCiMjWUFMRSNTT1NPIyMjIwpQUk9NSVNFI0JFUkFURVMKVEFLSU4jR1JFRU5CRUFOCkFHRU5UI0FLSU0jQUxUTwpTQUxFUyNET1RTI0JMQUI="},{"title":"USA Today 04/28/98 \"TINSELTOWN ORBITERS\"","author":"By Charles Preston","date":"1998-04-28","grid":"UkVQQVkjUEFSSyNNQVRFCkFNSU5FI0FMT0UjQU1PUgpKVVBJVEVSU0RBUkxJTkcKI1NFTSNFQ08jI0VBU0VTCiMjI0lETEUjU0lORyMjIwpUSElTSVNMQU5ERUFSVEgKUkVOVFMjI0RJRVMjSEFFCklOQVMjV0VFUFMjUk9QRQpQUk4jVElMTCMjUkVESUQKRVlFU09GTEFVUkFNQVJTCiMjI0FSRUEjTkVNTyMjIwpCVUxMUyMjU1RFI0RPVCMKT05FVE9VQ0hPRlZFTlVTCkFUTk8jUE9PTCNJTE9OQQpTT09OI1NQRUQjRVNTQVk="},{"title":"USA Today 04/29/98 \"GRAINY\"","author":"By Charles Preston","date":"1998-04-29","grid":"REVBRiNDQVNDTyNBQkJBCkFUTUUjT0NURVQjUFJJTQpXSE9MRVdIRUFUI1BPTE8KRUFSTFkjRUFTRSNFV0VSClNORUVSUyNNRVJNQU4jIwojIyNSRUFMIyMjQVJST1cKQkVTUyNSRVBBU1QjSU5FClJBVyNNQUdFTlRBI0NDUwpJUkUjQU5TV0VSI0JFRVQKQ0xFT04jIyNXQVJFIyMjCiMjVEFTVEVTI1BFRERMRQpTSUNLI09SRVMjQVJJQVMKRU5PTCNST0xMRURPQVRTCkFDUkUjQURNQU4jT05FQQpNQU5ZI0hFQVBTI01BUlk="},{"title":"USA Today 04/30/98 \"CELEBRITY COOK BOOK\"","author":"By Charles Preston","date":"1998-04-30","grid":"T1BBTCMjTFVOQSMjU1BBCkZBTUUjRE9TRVMjU0hJTgpGUk9HTEVHU0RJQU1PTkQKU1RSRUFNRVIjI01FREVBCiMjI05ORSMjTU9PVCMjIwojU0lEQ0FFU0FSU0FMQUQKQVBSI0VOU1VSRSNOT01PCkxFQURTI1BUTCNTQVZFUgpBTlRJI0FSUklWRSNFTkUKU1RFQUtESUFORUxBREQjCiMjI0xJU1QjI1JEQSMjIwpBR0xFVCMjQVJCT1JEQVkKUEVBQ0hNRUxCQU1PT1JFClNBTFQjQVZBSUwjTkVJTgpFUkEjI1RFTlMjI1NSQVM="},{"title":"USA Today 05/01/98 \"THEY MAKE HOUSE CALLS\"","author":"By Charles Preston","date":"1998-05-01","grid":"U0xBTkcjQ1JFRSNWRVRPCkNBTUVPI1JPT00jSVJBTgpVU1BPU1RBTFNFUlZJQ0UKTVRTI1NBVkUjUkVJQ0hTCiMjI1BJTUEjI1NQQSMjIwpWT1RFUEVUSVRJT05FUlMKQVJJTFMjI0JPT1QjUlVUCkxPVFQjUE9TRU4jQ09NQQpJTkEjU09SRSMjVFVET1IKRE9OQVRJT05TRUVLRVJTCiMjI0xFTiMjSEFSRSMjIwpMQU1FTlQjTE9TRSNUT08KR1NBQ09PS1lWRU5ET1JTClRJTFQjVUVMRSNDQVBFVApIQUxPI1RZRVMjRU1JTEU="},{"title":"USA Today 05/04/98 \"READY TO WEAR\"","author":"By Charles Preston","date":"1998-05-04","grid":"QUxPVCNBQkJFUyMjRE9OCkxJRkUjRE9VU0UjU09NRQpBTEZBI0hPUlNFU0hPRVMKUkFUU05FU1QjVEhPUk5TCiMjSEVBUlQjVEhBVyMjIwojUEVSU0UjUFJFRElDVFMKTUFDI0FORFJFI1NOT1JFCkFSVU4jVFJFTkQjR0FJTgpSRUZJVCNBTlRJUyNUQVQKTEVGVEhBTkQjU09UT0wjCiMjI1JJTksjQ0FMSUYjIwpBSURJTkcjQUxTT1JBTlMKQlJJREdFU1VJVCNBUkVBCkxPVkUjTEFLTUUjRE1VUwpFTkUjI0FOU0VSI0VTTUU="},{"title":"USA Today 05/05/98 \"EASY DOES IT\"","author":"By Charles Preston","date":"1998-05-05","grid":"V0FMVCNFQkFOUyNBTU9LCk9SRU8jUkVMRVQjU0FWRQpORUFMI0lUQUxZI1BMQVkKVEFLRUFDSElMTFBJTEwjCiMjI0RCQSMjI0VBUiMjIwpXQUhPTyNPUkIjV0lMREUKQUJFI01BWk9MQSNOQUlMCkRPTlRCTE9XQUdBU0tFVApFUk5FI0VOQU1FTCNFR08KU1RBTVAjRU5FI0FQUk9OCiMjI1BPVyMjI1NNQSMjIwojSE9MRFlPVVJIT1JTRVMKVEFSQSNBTExJRSNEQU1FClNMQVQjVEVBU0UjT0RJTgpQT0xFI1RPTkVSI05FUkQ="},{"title":"USA Today 05/06/98 \"SWEETS\"","author":"By Charles Preston","date":"1998-05-06","grid":"QVJFUyNERUpBI1NPRkFSClZFTkkjT1BVUyNQUklNRQpJR09SI01JTksjT0FTSVMKTElDT1JJQ0VTVElDSyMjCkFTSENBTiMjI0VMTCMjIwojIyNDSE9DT0xBVEVMQUIKUkVOTyNTQUxFTSNTT0hPCklDRSMjI1JFVCMjI0xFTgpGUkVFI0FMSUFTI0VMTU8KRlVER0VGQUNUT1JTIyMjCiMjI0dSRSMjI1BJUEVVUAojI0JST1dOSUVQT0lOVFMKRkxPT0QjQU5USSNBU0lBClJJTExFI0lST04jTFVMTApPUEFMUyNMSU5HI1NFRU0="},{"title":"USA Today 05/07/98 \"CAPITALISM\"","author":"By Charles Preston","date":"1998-05-07","grid":"SkFWQSNBR1JBI0NIQUtBCkFMQVIjQ1JVWCNSRUxJQwpDT1JQT1JBVEVXRUFMVEgKS0VZI1BPTlMjRVNUQVRFCiMjI1JFU1QjTEFUSCMjIwpTVEFJTlMjUEFTUyNBU1AKVEVNUEUjRkFaRSNBUklBClVQUEVSQ0FTRUxFVFRFUgpLSUxOI0hJVFMjTkFJVkUKQURFI09STkUjU0NSRUVECiMjI1FVSVQjVEhBSSMjIwpTTk9VVFMjQk9PTSNWSUEKUElMQVNURVJUT1BQSU5HCkFMSUtFI1BFQVQjT05DRQpURU5FVCNBV0xTI1BFQVM="},{"title":"USA Today 05/08/98 \"``M\" IS FOR . . .\"","author":"By Charles Preston","date":"1998-05-08","grid":"R09ORSNBV0FTSCNJRExFCkFNRVgjTUFSSUUjU0VBTgpTTkFQI0lSQU5JI0xFTkQKI0lSRU1FTUJFUk1BTUEjCiMjI1JPTlMjI0xBWSMjIwpCQU5UVVMjU09PTiNIQUQKQUdBSU4jRkFSTyNTT1JBCldISVNUTEVSU01PVEhFUgpMQVZFI0lOVE8jUk9VVEUKU1NFI1VORE8jRkFSTUVECiMjI0VHRyMjUkFDRSMjIwojTU9USEVSTUFDSFJFRSMKU0lHSCNST09ORSNPTEdBCklOUkUjSU5TRVQjT0xBTgpQRUVMI0VBU0VTI01BTFQ="},{"title":"USA Today 05/11/98 \"GENTLE WORDS\"","author":"By Charles Preston","date":"1998-05-11","grid":"UEFQQSNSSURPRiMjUEZDCkFMQVMjQU5PREVTI0xFSQpXSVNISU5HV0VMTCNFTkQKTkVUI05DUiMjVEVOQUNFCiMjUlVTSElOR0xFQURFUgpGUk9OVCNEUk9JVFMjIyMKUkVMSUVGI0NPTiNIQVJECk9ORSNQQVMjREVDI05FQQpHT1NII1NUTCNET0NLRUQKIyMjRVNDVURPI1BPTExTCkJMVVNISU5HQlJJREUjIwpMRVNTRU4jI0xFTiNEQUIKRVRII0RBU0hJTkdIRVJPClNVRSNTVE9PR0UjTUVJTgpTUFIjI0VTVEVFI1NQQU4="},{"title":"USA Today 05/12/98 \"NADA\"","author":"By Charles Preston","date":"1998-05-12","grid":"R1VTVCNCQVJFRCNHQUxBCkFTVE8jT0JFU0UjQVhPTgpaRVJPTU9TVEVMI1pJT04KQVJBI09UT0UjI1RFQVNFCiMjV0FMRVIjRU5BQkxFUwpESVZJREVCWVpFUk8jIyMKSVZPUlkjI09SQU4jSEVSCkNPVFMjQ0VEQVIjRE9WRQpFUkUjQU9ORSMjV09NRU4KIyMjQUJTT0xVVEVaRVJPCkFaQUxFQVMjUFJJRVMjIwpCQUdFTCMjU1RJUiNUQUIKQVBBUiNHUk9VTkRaRVJPClNQSVQjWU9VUkUjT0FUUwpIQU5TI01PUk5TI09ERVM="},{"title":"USA Today 05/13/98 \"SPORTY\"","author":"By Charles Preston","date":"1998-05-13","grid":"RVJJQyNNT0FOIyMjVlBTClJBU0EjQVRSSUEjQ09PTApHWU1OQVNUSUNTI09MTEEKU0VTVEVUI0xFVEhBTExZCiMjI0FERU4jUkVFU0UjIwpKQUJCRVJFRCNSRVRZUEUKQVJBI1NFVkVOI0xBQkVMCk5PU0UjRElWRVIjTEFMQQpFU0tFUiNOSU5FUiNMRU4KU0VFUkVEI0xFVkVMTEVECiMjVElNT1IjU0VMQSMjIwpBU0JFU1RPUyNSRVVTRVMKSU5BUyNFUVVFU1RSSUFOCkRPTFQjRFVOTkUjQUxWQQpBV0wjIyNFS0VEI1NURVA="},{"title":"USA Today 05/14/98 \"GHOSTS OF ANOTHER COLOR\"","author":"By Charles Preston","date":"1998-05-14","grid":"UklDQSNGQVJPI1NQSVRaCklSQVEjQUJFUyNBUk5JRQpQRVJVI1pJTkMjU0lURUQKVU5OQU1FREFVVEhPUiMjClBFRVBTI0VMTEUjUlVCUwojIyNMVEQjI0FNUCNTUkEKQUxHQSNBQkVUI1NDSU9OCkZBSU5UTElLRUxJSE9PRApMSVZFRCNURVNUI0VORFMKQU5FI1NJVCMjU0FDIyMjClRFU1MjU0VXUyNTS0VFVAojI0JMVVJSWVRWSU1BR0UKVEhBSVMjRUxFRSNBR1JBCkJPQ0NFI05FRVIjVEVFUwpBU0tFRCNEUk5PI0VSVEU="},{"title":"USA Today 05/15/98 \"NO-SHOW EXCUSES\"","author":"By Charles Preston","date":"1998-05-15","grid":"U1RBR0cjQVBTRSNQQUxTClBJTEFVI0xPT04jT01FSQpBTEFSTURJRE5UR09PRkYKREVOI1NVRVMjQVVESVQjCiMjI1RIRU4jI05JTCMjIwpSUkNST1NTSU5HREVMQVkKRUVSSUUjI01PTEUjSVJFCkFURVMjVVNBR0UjTUFFUwpDSUUjU05BRyMjU0lOQ0UKSEFEVE9TVE9QRk9SR0FTCiMjI0hSSCMjTElETyMjIwojQkVSRUEjREFUQSNBRE8KTk9QQVJLSU5HU1BBQ0VTClVSSVMjRVNBVSNPVkVOUwpCQUNII05PU0UjUEFTVEE="},{"title":"USA Today 05/18/98 \"JAMBALAYA\"","author":"By Charles Preston","date":"1998-05-18","grid":"TUFOVEEjTUVTQVMjSk9OCkFTSUFOI0FMQUlOI0lDRQpKVU5LSkVXRUxSWSNNVEEKIyMjRU9FI1ZBUyNBSkFSClNPSk9VUk5FRCNSRUVWRQpFVFVOIyNBTlNXRVJGT1IKVElNRU9VVFMjQVNPRiMjCkFTUCNVUkUjSURJI1JTVAojI0lPVEEjU1RFTkNJTFMKTU9OT0dMT1RTIyNMRUFQCkFOR0xPI1JFQVRURVNUUwpERUpBI1BBUiNBUkEjIyMKUklBI0pBQ09CSkFWSVRTCklOQyNBTExJRSNERU5FUwpEQUsjV0VFRFkjRVJORVM="},{"title":"USA Today 05/19/98 \"TAKE A TURN\"","author":"By Charles Preston","date":"1998-05-19","grid":"VEFDVCMjQ0xBUCNTUEFTCkFST09NI0hFTEwjV0FSVApCVUxCQSNSQVRBI0lURE8KVU5ERVJHT1JPVEFUSU9OCiMjI0NMQU0jI0VOQ09SRQpBRlJPI0xBQiNOVEgjIyMKTE9BTSNBVE9NI0VMQk9XCkJSSUUjU0lMQVMjT1JHWQpTQU5UQSNDQU5FI1lPUkUKIyMjQUxQI1NESSNBV0VTCkFTSElFUiMjQU5JTCMjIwpDSEFOR0VESVJFQ1RJT04KUlVTVCNQQVJJI0FJU0xFCkVUVEUjQU5PTiNORUxMWQpTRUVEI1lFTlMjI1NFQVM="},{"title":"USA Today 05/20/98 \"STATE DEPARTMENT\"","author":"By Charles Preston","date":"1998-05-20","grid":"SVNUTEUjTEVOUyNMT0ZUClNMQUlOI0FMQUkjRU1JUgpNQVRSSSNXT1ZFI05BTkEKI1ZJUkdJTklBR1JBSEFNCiMjIyNNT1MjSElFI0FMUApJTkRJQU5BSk9ORVMjIyMKVE9FUyNFTEkjR0xPV0VECkVMVklTI0VBVCNTUElORQpNT09ORUQjTkFXI09OT1IKIyMjR0VPUkdJQUJST1dOCkFDVCNUV0EjTFhJIyMjIwpWRVJNT05UUk9ZU1RFUiMKRURJRSNBVE9SI1FBVEFSClJBS0UjTkVWRSNVU0FHRQpUUkVLI0RSRUQjRVNTRU4="},{"title":"USA Today 05/21/98 \"BANK JOB\"","author":"By Charles Preston","date":"1998-05-21","grid":"VEFJTCNGTEFQI0FMSUJJCkFMVEEjQUlSRSNDRURBUgpCQUNLR1JPVU5EQ0hFQ0sKVVNIRVJJTiNIVVJSQUhTCiMjIyNBTkVXI1NVRSMjIwpTUEVDSUFMSU5URVJFU1QKVEVYQU4jI1pFVVMjVk9XClJBQ1kjU1dFRVAjTUlOSQpBQ0UjU1BJTiMjU1RBSU4KREVMSUNBVEVCQUxBTkNFCiMjI05PUiNESURPIyMjIwpTVEFUVVRFI1NBTVVSQUkKTUlORVJBTERFUE9TSVRTCk9SSU5HI0xBQ1QjU0NPVApHRVNURSNBTlRTI1JFUE8="},{"title":"USA Today 05/22/98 \"SENSE-ATIONS\"","author":"By Charles Preston","date":"1998-05-22","grid":"QVNTQUQjTklDRSNEQUZUCk1BTUJPI0VOT0wjRUxJQQpJRkVFTEFXRlVMI0ZBUk0KU0VMI0VMVE9OI1JJTlNFCiMjTEFTU08jVFdJTiMjIwpDQVNBI09OREVBRkVBUlMKT01BUiMjI1dSSVQjU09QCkhJUkUjQkxBU1QjU09MQQpBTkEjU0VFUiMjI09GRlMKTk9UQVNURUZPUiNTVEVNCiMjI1NUQVIjUk9CT1QjIwpDTEFTUyNJUkFURSNPQVQKUklQRSNTRUVUSFJPVUdICk9NRU4jT1NURSNMVUNJRApQRVNUI1VURVMjRVRIT1M="},{"title":"USA Today 05/26/98 \"CENTERPIECES\"","author":"By Charles Preston","date":"1998-05-26","grid":"TElNUCNHUklQI0FEQVRFCkFHQVIjUkVCQSNNQUNPTgpET1pFI0FIQVMjSUdMT08KU1RFVkVNQVJUSU5NVUxMCiMjI0lBTUIjI0JPQSMjIwojR0xPUlkjTUFFI1JBRlQKU0VPVUwjTElMQUMjUEVBCkdPT1NFVEFUVU1PTkVBTApURFMjVE9URU0jUEVBUkwKU0VFSyNYRVIjSE9DS1MjCiMjI0lDSSMjV09VSyMjIwpHT1JET05TQ09UVEJBSU8KSVZBTkEjSEVSQiNBQk9XCk1BTkVUI0VMU0UjTklORQpQTEFZUyNCTEVEI0RFQU4="},{"title":"USA Today 05/27/98 \"IT TAKES TWO\"","author":"By Charles Preston","date":"1998-05-27","grid":"S0VQVCNMQVRIRSNMT1NTCk5DQUEjRUJPQVQjTEFLRQpBUklMI1ZFTERUI09LSUUKUFVOQ0hBTkRKVURZIyMjCiMjIyNFTkQjIyNJRExFUwpBUlJFU1QjRUFTVFNJREUKREVBTFMjSU5DSCMjTVNUCk9aWklFQU5ESEFSUklFVApST1ojI1RSRUUjQURFTEUKRU5MSVNURUQjU1BBUlNFClNFRU1FIyMjS0FJIyMjIwojIyNKQUNLQU5ERElBTkUKUkFHVSNBSVJFRCNTV0lHCkFMQVMjU1RFRUwjTEFOQQpQRVNUI1RFQVNFI0VZRUQ="},{"title":"USA Today 05/28/98 \"SIGNS OF THE TIMES\"","author":"By Charles Preston","date":"1998-05-28","grid":"VEVSTiNCQUVaI01DQ09ZCk9MRU8jT0dMRSNBUk9NQQpQSVRTI0JBTEwjS0FSRU4KU0hBSCNCUklER0VXT1JLCkxVR09TSSNQQUlEIyMjIwojIyNVTE5BUyNaT0RJQUMKQVBQTEUjVEVBTSNPRElFCkNIRUREQVIjTE9BTkVSUwpUT05FI1NZQ0UjVE9BU1QKU1RBUkNII0FTQ09UIyMjCiMjIyNIRUFMI09QRU5FRApOT1NUQU5ESU5HI05FVkUKRUFURU4jRVBFRSNUSEVOClNUT0xFI1BFT04jRVJSUwpTSEFMTCNURU5UI1JVU0U="},{"title":"USA Today 05/29/98 \"HELLO DOLLY\"","author":"By Charles Preston","date":"1998-05-29","grid":"UEFMI1VQUyNQUk8jREFNCkFMQSNOSVAjTE9YI0VQSQpUT00jSVRFUkFURSNNT1QKQ0hBVFRZQ0FUSFkjVUxFCkhBWkVTI0lHTyNFQlJPIwojU0VFI1NFR05JI0FSR08KIyMjTkVUI0VJTlNURUlOCk9GRiNHT0xEQ1VQI1JBVApXUk9OR1dBWSNSWUUjIyMKTk9NRSNTUEFURSNBRFMjCiNMRURBI0lOQSNMVUFVUwpESU4jVEVERFlSVVhQSU4KQUNUI1BMQVlMRVQjUFNJCklLRSNBSVIjT0RFI0VTUApTWVIjUkFZI1JPRCNERUU="},{"title":"USA Today 06/01/98 \"BELIEVERS\"","author":"By Charles Preston","date":"1998-06-01","grid":"QUdPUkEjQkVUQSMjUElUClJBTU9TI0FSQUIjTE9SSQpBTUlTSCNTQVJBI1VMQU4KTUVUSE9ESVNUUyNUSURFCiMjIyNSQUNFI0VDSE9FUwpFTEFURVIjUkFTQUUjIyMKUkVBUiNFQVNFI1BST1NFCk1BUkFVRFMjT0NFQU5JQwpBREVQVCNUVU5BI05FUk8KIyMjUEVDQU4jTEVTU0VOCkxPVUlTQSNUQUxDIyMjIwpVUk5TI0NBUk1FTElURVMKTUFTVCNBTElBI0FMT05FCkVURVMjT1BFTiNJTEVUQQpORVQjI1NPREEjUkVTRVQ="},{"title":"USA Today 06/02/98 \"AQUEOUS\"","author":"By Charles Preston","date":"1998-06-02","grid":"Q0xBVyMjQ0FSQSNBU09QCkxBTkEjRk9MSUMjTUVNTwpFV0VTI0VQSVNDI09HRUUKT05USEVXQVRFUkZST05UCiMjI0FYRUwjI0VMQSMjIwpUQU1CT1IjU09EQUxJVFkKT0JPTCMjRVRVSVMjTklFCldBVEVST1ZFUlRIRURBTQpJU1QjQVJJRVMjI0NJUkUKVEhPUk5JRVIjVFVTQ0FOCiMjI0VHRyMjQ0hBVCMjIwpLTklGRUlOVEhFV0FURVIKTEVOSSNOQU1FUyNUVU5BCkVBUk4jQVBBQ0UjSUJJUwpFUEVFI0xBTksjI0NFREU="},{"title":"USA Today 06/03/98 \"HIGHWAY\"","author":"By Charles Preston","date":"1998-06-03","grid":"QVJDIyNQTFVNUyNWRUdBCkhVTEEjUkVTRVQjQ0xVQgpFREVOU0VYUFJFU1NXQVkKTUVGRUVMI1NFTEEjQVJTCiMjI01ESUMjI0xMT1lEUwpUQU1JQU1JVFJBSUwjIyMKT0xFQU4jQ09PVCNEQVJUCldJVCNTUEVMTEVEI05FTwpTVEVXI09SRUwjQVNURVIKIyMjT0hJT1RVUk5QSUtFCkFXQUtFTiMjUE9HTyMjIwpTRU4jU0NPVyNBTEtBTkUKU0FOVEFBTkFGUkVFV0FZCkVWRU4jUkFSRUUjTk9ERQpURVhUI0VOREVEIyNMQUQ="},{"title":"USA Today 06/04/98 \"THIS AND THAT\"","author":"By Charles Preston","date":"1998-06-04","grid":"VEVTUyNTQUdTI1NBVVRFCkFMRUMjQUJPVSNJR0xPTwpMSUFSI1ZFUkIjR1JFRU4KQ0FMQU1JVFlKQU5FIyMjCiMjI05BT1MjI1dJRUxEUwpCRVNUSVIjUk9PRiNBVkUKQU5UT04jUklDS0kjTU9OCkNISU5FU0VDSEVDS0VSUwpLQU4jQ0FNRU8jQU5TQUUKRUxLI09UT1MjU05FQUtTClJPU0NPRSMjVk9DRSMjIwojIyNVTkRFUk9ORVNIQVQKRFVST0MjTE9JTiNJT1dBCkFST01BI01PTEUjRVJPUwpNSU5PVCNTS0FUI1NBTEs="},{"title":"USA Today 06/05/98 \"PREPOSITIONAL STARTERS\"","author":"By Charles Preston","date":"1998-06-05","grid":"VFJPQUQjI0FDRSNPQVRIClJJRkxFI0JSQU4jVVJFQQpVUEZPUkdSQUJTI1RJTlQKRVNUSCNMQUIjSVNPTERFCiMjSEFHRU4jQ0xFRiMjIwpBUkUjVU5ERVJBQ0xPVUQKUkVXSU4jI0xBRyNJTlJFCkVMQU4jQURBR0UjTkFJTApDRUxUI1JFVCMjU0VSQUkKQVRMT09TRUVORFMjQUxTCiMjI1BMRUQjQVVSVU0jIwpERUFGRU4jR0lOI0JQT0UKQVJMTyNBQk9WRUJPQVJECkRJT1IjTE9ORSNQQUdBTgpTRUVNI1NBRyMjU1RFTEE="},{"title":"USA Today 06/08/98 \"WATERWAYS\"","author":"By Charles Preston","date":"1998-06-08","grid":"QVNTIyNDT1BTRSNEQVBTCkxJTUIjQU1FRVIjRU1JVApBTEVFI0pPQU5SSVZFUlMKTUVMQlJPT0tTI0RPUkEjCk9TVEVBTCNTRVNFI0lUTwpESUUjTkVXIyNDQVJORVMKRUFSRUQjRUxTQSNBRERTCiMjI1dJTExPV0JBWSMjIwpBUFNFI0VUVEEjTUVFVFMKTUlDUk9OIyNCQUEjTklQCkFTSCNST09UI1NUT1JDSAojTU9PRyNSSUNLSUxBS0UKQklMTFlPQ0VBTiNBR0VSCkFSQUwjQ0FSR08jRkVURQpIRVJBI0FTU0VUIyNTU1M="},{"title":"USA Today 06/09/98 \"MULTIPLE MEANINGS\"","author":"By Charles Preston","date":"1998-06-09","grid":"U0FTUyNBTUlSI0FMQVJTCkFSQ0gjU0FWRSNSRU1JVApIRVJFRElUWVZBUklFVFkKSVRFI0VERSNJU0EjTEVFCkJFRVRMRSNQTEFZVE8jIwojI05FVCNQSUUjQUlERVMKQVJPTUFUSUMjRUxBSU5FClBFUlAjQVRBTEwjUk9JTApFQVNFTFMjREVGUkFVRFMKU1BJUkUjTk9EI0VFUyMjCiMjRkFDVE9SI1JFRFNFQQpBTVQjVElTI0dFTCNPRVIKVE9PTVVDSFBSRVNTVVJFClRSVUVSI0VSQVMjQU5JTgpOT1RSRSNET01FI09ERUE="},{"title":"USA Today 06/10/98 \"PUNS RULE\"","author":"By Charles Preston","date":"1998-06-10","grid":"Q0FQUCNIRUxNI1RPTkdBCkFCTFkjT0JJRSNVTlRFUgpUU0FST0ZCRVRITEVIRU0KTk9ORU9GI1NBWVNPIyMjCklSS1NPTUUjI1BBUlNPTgpQQlMjI0FVUkFFIyNUQU8KIyMjR0lOR0VSUkFKQUhTClVSQkFOI0VOQSNST0dVRQpTSEVJS0FOREJBS0UjIyMKTUVMIyNSRVNJTiMjR0lTCkNBTElDTyMjQURBTUFOVAojIyNOT0NBTCNPREVTU0EKU0lMTFlLSEFOVkFMTEVZCk9ORUFMI0FLRUUjQklSTwpTTk9XWSNCRUVSI0FUVE4="},{"title":"USA Today 06/11/98 \"YUM-YUM!\"","author":"By Charles Preston","date":"1998-06-11","grid":"QkFSQiNJU1RMRVMjVFNLCk9CRVkjT1RPT0xFI09MRQpCVU5HQUxPV0JBUiNPVVIKIyMjT0JBTiNCTE9UVEVSCiNPV05TI0VZRSNUSVMjIwpDVVJFI0NIRVJSWVBJRVMKT1RJUyNSQVAjQVBJRUNFCkVMRyNIVU0jQUNFI1JURQpEQUxMQVMjQVRFI0xPT1QKU1dFRVRUQVJUUyNFTE1PCiMjWUFSI1RFQSNEQUxZIwpJTlNIQVBFI0NIQVIjIyMKQklHI0NSQUNLRVJKQUNLCklDVSNLT1NIRVIjRVBFRQpERU0jU1dFQVJTI1RFRU4="},{"title":"USA Today 06/12/98 \"ALL-INCLUSIVE\"","author":"By Charles Preston","date":"1998-06-12","grid":"TUFTUyNDQVJFUyNMSVNQCkFMRUMjQURBTk8jQVJJQQpNT1RIRVJPRkFMTFdBUlMKQUVTSVIjIyNNRUFORVNUCiMjI1pBUCNWRUlOIyMjIwojUk9PVE9GQUxMRVZJTCMKU0VDI09QRU4jI1NFT1VMClNOQUcjRU5ERVIjRVROQQpSRUxBUCMjQUxJRSNBQ1QKI1dBWU9GQUxMRkxFU0gjCiMjIyNMQVlTI0VHUyMjIwpBUk1PSVJFIyMjQVRJTUUKSkFDS09GQUxMVFJBREVTCkFMQUkjRVlFT04jVEVOUwpSRVRFI0xFQVNUI0VBU0U="},{"title":"USA Today 06/15/98 \"RIGHT YOU ARE\"","author":"By Charles Preston","date":"1998-06-15","grid":"QlJBUyNTQ0FOVCNDVUZGClJFU1QjSFVNT1IjQVhFRApBVFRBI09ST05PI1JPU0EKV1JJR0hUQlJPVEhFUlMjCk5PUkdFIyMjI0hPVyMjIwojIyMjQU1BU1MjQk9HR1MKUEZDI1JJR0hUQVNSQUlOCkFJTFMjTkVBUlMjTk9MQQpXUklURUlOVk9URSNMQUcKTkVQQUwjVEVQSUQjIyMjCiMjI1JFTCMjIyNEQVZJRAojUklURVNPRlBBU1NBR0UKVkVBTCNNSUxPUyNJTExFCklOR0UjRkxJUlQjRE9PTQpNT09EI1RZUEVBI0VST1M="},{"title":"USA Today 06/16/98 \"DRESSED TO KILL\"","author":"By Charles Preston","date":"1998-06-16","grid":"RkFaRSNFQkVSVCNTSEVNCkFMRVgjRlJJRUQjSE9MRQpDT0FUT0ZBUk1TI0VBU1QKVEVMRVZJU0UjI1NJWEVTCiMjI1JBR1MjUk9DSyMjIwpLRUVOTFkjWk9MQSNTSEEKRUxMQSMjU09CRVIjVEVOCkJVTExFVFBST09GVkVTVApBREUjUVVBUlQjI0VBU0UKQkVOI1VOVE8jRk9STUVECiMjI0RVRVMjRkFTVCMjIwpNQVJJUyMjTUFOU0lPTlMKSUJFWCNGTEFLSkFDS0VUCkxFTk8jRUVSSUUjQVJFQQpFVE9OI0VYRVJUI0xBRFk="},{"title":"USA Today 06/17/98 \"FAMOUS LAST WORDS\"","author":"By Charles Preston","date":"1998-06-17","grid":"RkxBRyNBUkNII09TS0FSClJJTEUjQ0hBTyNDSElNRQpPTUFOI1RFU1MjVE9LRU4KR09ORVdJVEhUSEVXSU5ECiMjIyNIT1QjI0FURSMjIwpNQVJMT04jQk9aI1JBR1MKQVJFRUwjQU9ORSMjUE9FClNVTlNFVEJPVUxFVkFSRApPQkkjI0FMRVMjTEFSR0UKTkFOQSNMRUQjQklUVEVSCiMjI0JJTyMjU0VUIyMjIwpSRVRVUk5PRlRIRUpFREkKRVJBU0UjUkFSRSNPTEVPCkFMTEVOI0VNVVMjS0FOVApSRUVTRSNMRVRUI0VOWUE="},{"title":"USA Today 06/18/98 \"JOB REQUIREMENTS\"","author":"By Charles Preston","date":"1998-06-18","grid":"Q09QWSMjQkFZI1JJQVRBCkFHVUUjQU9ORSNFR0dBUgpGRUxUI0RSQVdBQkxBTksKRUVMI0JFTlQjTE9PIyMjCiMjU0xPUEUjQVBQT1NFIwpHRVRJTlRPVUNIIyNUSUwKQVVSRVVTI01JQSNPUkxPCkJSSUdTI1JJRCNCUklFUgpMRU5FI1NFQSNTT0FLRVIKRUtHIyNNQUtFQVNDRU5FCiNBU1NBSUwjTVVLSEEjIwojIyNBQ1QjQUJMWSNQVU4KVElFVEhFS05PVCNTT01BCk9MTElFI0VORFMjRVNQWQpQRUtFUyNXQVkjI1RFU1M="},{"title":"USA Today 06/19/98 \"FOR FATHER\"","author":"By Charles Preston","date":"1998-06-19","grid":"QVNQRVIjQkVOWiNTUEFSClNUT01BI0FMRUUjVE9ORQpQT1BVTEFUSU9OI09QRUMKSU5GI0VYSVQjI0FMSUNFClJFTFMjRUtFUyNNRU5EUwpFRFlTIyMjI0xPQiNKT1MKIyMjRVNDQVBBREUjQVRFClRJUCNQT1BPVkVSI1lFUwpBTU8jRVNQUkVTU08jIyMKSU1QI0FUTCMjIyNTUEVXCkxPU0VSI1lBUk4jU09EQQpPQklUUyMjUEFDRSNQRU4KUklDSCNQT1BDT05DRVJUCkVMTEUjUklMRSNET1lMRQpERUVSI09MRVMjU1BFRUQ="},{"title":"USA Today 06/22/98 \"UNRUFFLED\"","author":"By Charles Preston","date":"1998-06-22","grid":"QURaIyNTQ1JJUCNHQVBFCkRFRUQjT0hBUkUjQUJFTApBQ05FI0RJTkFSI0lTUFkKUEVBQ0VBTkRRVUlFVCMjClRJTiNBU0FZIyNTVFJBUApTVEFHRyMjI1BMQVlBQ1QKIyMjQVJNT0lSRSMjQ0hBCiNMT1NFSU5URU5TSVRZIwpTT0IjI0NPQVNUQUwjIyMKQ0xFQU5FUiMjI1VMUklDCkhBSVRJIyNMT1VUI09SQQojI1NFTEZQT1NTRVNTRUQKTkNBQSNPTERJRSNQSU5HCkVPTlMjUk9HRVIjQVRFRQpET1RFI0RZRVJTIyNBU1M="},{"title":"USA Today 06/23/98 \"TIME CAPSULE\"","author":"By Charles Preston","date":"1998-06-23","grid":"U0FHQSNUQVBFRCNTQVJBCk9OTFkjRUxVREUjUExVUwpGT1VOVEFJTk9GWU9VVEgKVE5UI0FQRVMjTE9PTVMjCiMjIyNTT04jUEFSSyMjIwpSRUNBU1QjUk9URSNCQVMKRVZBREUjSk9LRSNPUkRPCk1JRERMRUFHRVNQUkVBRApVVEVTI1NQRUQjT0NBTEEKU0FUI1NDQVQjQkxBREVTCiMjI0RFQU4jQ0lJIyMjIwojQVJJRUwjT09QUyNQRUEKQVNPTERBU1RIRUhJTExTCk1JTEwjVE9URUQjUkVBUApQQUxTI0VUT05TI1NBTlM="},{"title":"USA Today 06/24/98 \"WRITER'S LAMENT\"","author":"By Charles Preston","date":"1998-06-24","grid":"U0FMVFMjUEFSUiNNT09UCkFQT1JUI0VSSUEjQVVSQQpNQUNBTyNHSUdJI1NUQUIKI1JIWU1FU0RPTlRTRUxMCiMjI1NBTCMjUkJJI1JFRQpTVUUjQ0xVQiNPUkQjIyMKQU5EV0hBVElTV09SU0UjCkRVREUjI0VETyMjQUNJRAojTVlQUk9TRUhBU0dPTkUKIyMjVE9QI0RPWkUjVEVOCkFEUyNCSU8jI09ORSMjIwpGUk9NQkFEVE9WRVJTRSMKVE9SQSNUSUVTI0NPTERTCk9WQUwjRVNUQSNBU0lERQpORVNUI1NURVIjU0VEQU4="},{"title":"USA Today 06/25/98 \"THE WHOLE ENCHILADA\"","author":"By Charles Preston","date":"1998-06-25","grid":"U0VNSVMjSEVBUCNTQ0FNCkFQQVJUI0VSTUEjVEFNRQpMT0NLRVJST09NSFVNT1IKQUNII1BBVFMjUE9UUElFClNIT1dCSVojQ0hFWiMjIwojIyNIQU4jUEFMUyNGSUcKSVNBQUMjU0FORSNBSURFClNUT0NLSU5HU1RVRkZFUgpMQU5LI01FRVQjTk9JU0UKRVlFI1NQRUQjQklPIyMjCiMjI0JBRVIjSEVGVElORwpPTkNBTEwjTUFHSSNOSUEKQkFSUkVMSE9VU0VKQVpaCklOT04jRUFSTiNST05FRQpUQVBTI0RJTlQjU05FUkQ="},{"title":"USA Today 06/26/98 \"ALL TRESSED UP\"","author":"By Charles Preston","date":"1998-06-26","grid":"Q09HUyNESE9MRSMjQUdFCk9CT0UjSU9XQVMjUkJJUwpNSUxMI1NQTElUSEFJUlMKQkVETEFNIyNSSU9URUQjCiMjSU9UQVMjU01VVCMjIwpTT0xVQkxFUyNBUkFXQUsKUVVPVEEjRElFVCNOSVRFClVOQyNUUkVTU0VTI0dSUgpJQ0tZI0VSSVMjRUFHRVIKREVTSVNUI1NFTlRSSUVTCiMjI0VBUk4jTk9USU4jIwojVkFMTEVFIyNPU0FHRVMKQkFMREVBR0xFUyNET0xFCkVST1MjRFJJVkUjTlVLRQpEWUUjI1NJTEFTI0VUT04="},{"title":"USA Today 06/29/98 \"RACETRACK TRIO\"","author":"By Charles Preston","date":"1998-06-29","grid":"UFNBVCNQRU5TI0FTUEVOCkVMTEEjSVJBRSNERUxMQQpDRU9TI0VJUkUjT1JBTFMKS0VOVFVDS1lERVJCWSMjClNQRUVDSCMjU0tJI0hPQgojIyMjTEFTUyNFTkNPUkUKU0lSQkFSVE9OI0dBVU5UCkFNRVIjVE9QT1QjQVNJQQpHQU1FUyNQUkVBS05FU1MKQUdFTlRTI0FMTEEjIyMjCkxFTSNJQU4jI0lOU09MRQojI0JFTE1PTlRTVEFLRVMKQVZFUlQjTE9BTSNCQU5TCk1BUklPI0FHUkEjT1BJRQpPTFNFTiNOT09OI1RJTlM="},{"title":"USA Today 06/30/98 \"PLAYGROUNDS\"","author":"By Charles Preston","date":"1998-06-30","grid":"SkFNRVMjU0NVVCNORVNUCk9YRVlFI0VVUk8jQVJPTwpWRVRFUkFOU1NUQURJVU0KSURFUyNMSVBBI1JJTlNFCiMjIyNBTU9JI1NUQVNFUwpST1NFR0FSREVOIyMjIyMKSUxPTkEjI1NESSNCQVJFCkNBTE9SSUUjU1BPUlRFRApFTkRTI0xQUyMjUEFJTkUKIyMjIyNLSUVMQ0VOVEVSCkhBVkFOQSNDQUhOIyMjIwpBUkVOQSNNVVNFI0lSTUEKU1VOREVWSUxTVEFESVVNCkFMQVMjQUxBSSNCRVRURQpURUxPI1RPUkUjQ0FURVM="},{"title":"USA Today 07/01/98 \"SOUNDOFF\"","author":"By Charles Preston","date":"1998-07-01","grid":"QkFTUyNERVNLI0xBQk9SClJFRUsjRUNDRSNFTFVERQpBUk5PI0JSQUUjRklSRUQKSElUQVNPVVJOT1RFIyMjCk1BUkxJTiMjI01PTlRIUwpTTFkjVkVOVCNPRkFIQVQKIyMjV0FTT1VUT0ZUVU5FCkFTSUEjI05CQSMjRUdHUwpTQU5HVEhFQkxVRVMjIyMKSUdOT1JFI1lBTkcjU0FHClNPT05FUiMjI1JBVFRMRQojIyNCRUFUVEhFRFJVTVMKSURJT1QjQVJFQSNBRE9TCk5PVFNPI0xPQUQjTUlTTwpHUkFTUCNFRERZI1BPVFM="},{"title":"USA Today 07/02/98 \"BIRDS\"","author":"By Charles Preston","date":"1998-07-02","grid":"V0FUVCNXRUJFUiNDUkFNCkFTSUEjQU1JR08jQU9ORQpTSEVSWUxDUk9XI1JVTlQKUEVTVEVSRUQjQkVSTklFCiMjIyNTVUUjU09MSURFUgpVTkNMRVMjSEVBTEVSIyMKTVVMRVMjRk9SVEUjT0RFClBMQU4jQ0FOSVMjQUJFUwpTTFkjQUFST04jTkFJTFMKIyNQSU5EQVIjTUVBTklFCkZSSVNLRUQjQkFIIyMjIwpSQUdMQU4jRlVSUklFUlMKQVJFQSNDT0xEVFVSS0VZCk5FT04jRUxFR1kjTUVOUwpTRU5EI1NFREVSI0FESVQ="},{"title":"USA Today 07/03/98 \"PATRIOTIC\"","author":"By Charles Preston","date":"1998-07-03","grid":"Q1JBRlQjTUFJRCNBU0FQClJPREVPI0FOVEUjUkFUQQpJTkRFUEVOREVOQ0VEQVkKIyMjI0VOVEVSI1VUSUxFClBBTkNSRUFTI1NURUVMRQpFTEFMIyMjI0VDTyMjIyMKU09NRSNTRUFUT0YjU0VUClRIRUZPVVJUSE9GSlVMWQpTQUQjRElHRVNUI0FHQUwKIyMjI0RUUyMjIyNLQVRFCk9QUE9TRSNCQVRURVJFUgpQT1JOTyNTRVBJQSMjIyMKQUxJRU5BVFRBQ0tEQVRFCkxJTlQjVElFUiNFSURFUgpTT1RPI01FTFQjU1RFRVI="},{"title":"USA Today 07/06/98 \"TIGHT SPOTS\"","author":"By Charles Preston","date":"1998-07-06","grid":"RUxFQ1QjQ0xPVUQjSkFSClRZUk9MI1JPVVRFI0FCRQpDUkFNQ09VUlNFUyNNRUwKSEFURSNNRUVUI1RFU1RZCiMjI1NPSUwjI0ZSRUUjIwpBU1NPUlQjU1BPT0xTIyMKUElRVUUjREFJTFkjU0hBCkJSVVQjRklYRUQjR0lBTgpTRUUjRFVORVMjRlJPTlQKIyNFVkVSVFMjT1JBTkdFCiMjWkVBTCMjRUxBTiMjIwpHUkVFRCNTQVRFI0RFRVMKUklCI1BJTkNIT0ZTQUxUCkFHTyNBRE9SRSNST1NJRQpNQVgjTk9CRUwjT05UQVA="},{"title":"USA Today 07/07/98 \"COURTLY TRAVEL\"","author":"By Charles Preston","date":"1998-07-07","grid":"T0FLI0NVQkFOI1NQT1JFCkFMSSNBUlJBVSNQVVJFRQpIQU4jUEVBUkxIQVJCT1IKVU5HSVJUI0VMTyNQRVNPCiMjU1BBSE4jU09OTyMjIwpaQVBTI0FFUyNUT1JRVUUKT0JPRSNOQVRTI1NUVU5UClJCSSNHRVRBV0FZI0VDVQpCT05HTyNPUkFOI01FQUQKQVRUTEVFI0VSTiNFTlNFCiMjI0VSTEUjRE9FUlMjIwpTQVJBI1NBTSNVTkNMQUQKUFJJTkNFVE9OTkojQVNBCklOTkVSI0FNT0NPI05FVgpURUREWSNUQU5FWSNEQVk="},{"title":"USA Today 07/08/98 \"NO CLASS\"","author":"By Charles Preston","date":"1998-07-08","grid":"R1JBU1AjSkFWQSNSQU1QCkxBTUFSI0FCRUwjSVNFRQpJTUlORSNOSU5FI09UVE8KTUlERExFRURVQ0FUSU9OCiMjI1dBU1RFUyNaRVJPUwpTRVJPV1MjIyNFVEQjIyMKT0RPUiMjU09NTUUjVFJFClJPT01JTlNUUlVDVElPTgpFTVMjQklUVFMjI0lOVE8KIyMjQVNQIyMjQUdSRUVTClNQSVJFI0FDQ1JVRSMjIwpIRVNJTkFCWUhJTVNFTEYKQUxFUyNWT0NFI01PVE9SCldFUkUjRVJMRSNFTU9URQpMRUVTI1NURVAjREVOU0U="},{"title":"USA Today 07/09/98 \"SHAPE UP\"","author":"By Charles Preston","date":"1998-07-09","grid":"UkFCQkkjUk9JTCNSVVNUCkFEUkFHI0lOU08jRVJJRQpCRVJNVURBVFJJQU5HTEUKRVNTI0FSTE8jU0xFRVRTCiMjI0FOVVQjI0xPRyMjIwpQRU5UQUdPTlBBUEVSUyMKVU5JVCMjI0lPTiMjRVdFCkZJVFMjRE9HSUUjUExFQQpGQVIjI0VTRSMjI0FJTFMKI0NPTUVGVUxMQ0lSQ0xFCiMjI0FSSSMjT0FSUyMjIwpFTklHTUEjTkFOQSNMVEQKVElBTkFOTUVOU1FVQVJFCkFDTUUjQ0FWRSNJU1NVRQpTRUFUI0VXRVIjU0FURUQ="},{"title":"USA Today 07/10/98 \"HOMETOWNS, U.S.A.\"","author":"By Charles Preston","date":"1998-07-10","grid":"VEVTVCNQT0lTRSNTUElUCkFMT0UjTFVOQVIjQ0FSRQpQQVJBRElTRUNBI0FOT04KRVRFI1JBVEVTI0VMQU5EClNFUk1PTiMjI0VYRUMjIwojIyNFTlRFUlBSSVNFVVQKU0FESUUjVE9BU1QjQVJBCkVWRU4jQ09VUlQjQUZBUgpSRUwjR09OR1MjU1VMTEEKRlJJRU5EU0hJUFROIyMjCiMjR1JBWSMjI1JFVElMRQpMRUhBUiNBTkdFUiNTSU4KT1JUUyNFTUlORU5DRU1PCkFMQUUjTk9MQU4jQVJJTApORVJEI1NLRVdTI0JFVFM="},{"title":"USA Today 07/13/98 \"DIET DRESSING\"","author":"By Charles Preston","date":"1998-07-13","grid":"U1RPUCNTQUhJQiNBRFpFCkFSSUEjQURPUkUjUEVPTgpGRUxUI1ZJTkVHQVJKT0UKRVNDQUxBVEUjR1JFQVRTCiMjQUtJTlMjQ0FNUyMjIwpGQU5JT04jSlVSQVNTSUMKQUxCI05BV0FCUyNLQVJPCkJPT1IjI0FOSSMjSUxFUwpFTllBI1dSRVRDSCNUTlQKUkVER0lBTlQjSE9UVEVBCiMjI1BPVFMjQk9ORVIjIwpPQ1RBTkUjUEVLSU5FU0UKUEVQUEVSRElORSNQQUlMCkVMS0UjRVVMRVIjSVRCRQpTVEVSI0RFTFRTI05ZU0U="},{"title":"USA Today 07/14/98 \"THEZE IZE\"","author":"By Charles Preston","date":"1998-07-14","grid":"U0hPTyNDRURFI0RJQ0VZClRPUFMjQVZPTiNBTkVSQQpBVVRIT1JJWkUjU0NBTFAKVFJJQU5HTEUjUEhBU0VTCkVTQyNFT1MjQ0FJTkUjIwojIyNIQVMjUkFOSyNGVU4KTEFCRUwjVklDVElNSVpFCk9OT1IjR09USFMjQVJJQQpTWU1CT0xJWkUjUVVFU1QKVEFCI1JFTFkjWVVMIyMjCiMjQVJFTkEjRFVPI0lLRQpDT1NJR04jVEFDVElDQUwKTE9UU0EjVlVMQ0FOSVpFCkFMSUVOI09ORUEjU0xBVgpNQUNSTyNXQVlTI1RZTkU="},{"title":"USA Today 07/15/98 \"SEQUELS\"","author":"By Charles Preston","date":"1998-07-15","grid":"Q0FMRiNPQ0FMQSNBTVBTCk9MRU8jQ09SRVIjUk9MRQpMSUFSI0NSRUFLI0lST04KI1RIRVNVTkFMU09TRVRTCiMjI1NQUlkjIyNMRUFTRQojRVRUQSMjVFJFU1MjIyMKQUNSRSNDUkVBVEUjQVNTClRISVJURUVOVEhOSUdIVApIT1AjQUVORUFTI05FRUQKIyMjSU5TRVQjI0FTRUEjClNPTk5ZIyMjUEFSVCMjIwpUSEVIQUlSTEVTU0FQRSMKUkFNQSNESVZBTiNORUFSCkFSQUwjQUxJQ0UjQ0FTQQpQRVRFI1NMSUVSI0VMRUU="},{"title":"USA Today 07/16/98 \"FLOWERY PROSE\"","author":"By Charles Preston","date":"1998-07-16","grid":"U1RBTVAjT1BUI0NBQkFMCkxVTkFSI01PTyNBTUFOQQpFTlRSRSNBU1RFUklTS1MKREFJU1lXSEVFTCNTSUxUCiMjIyNFUkEjI0xBU1NFUwpERVJJREUjSk9BRCMjIyMKRVJPUyNTUEFUI0FCQUZUClZJT0xFVEFDSEFNT1JSTwpPQ1RFVCNMT09TI0NBQU4KIyMjI1RPTUIjQ1JBTk5ZCkNBU1RFUiMjS0FJIyMjIwpPUkVPI1RVTElQQ0hBSVIKSVJJU0hTVEVXI0hFTEdBCk5PTkNFI0FOSSNFTElPVApTV0VBUiNIQVMjU1BBUkU="},{"title":"USA Today 07/17/98 \"HAPPY TRAILS\"","author":"By Charles Preston","date":"1998-07-17","grid":"SklNSSNFTEdJTiNMRVRTCkFDSUQjRE9JTFkjT0NITwpZRUxMT1dCUklDS1JPQUQKU1RFRVJBQkxFI1VHTElTCiMjI0RJUkUjI1VSTiMjIwpPQVMjT0REU0FOREVORFMKU0NPV0xTI0FVSyNUT1JFClRFUEVFI0JVTSNBVEJBVApJUk9OI0ZFTiNCUkVFQ0gKQUJSQUNBREFCUkEjTE9TCiMjI1RSWSMjUk9CUyMjIwpQUklDRSNGT09UTE9PU0UKSElHSFdBWVRPSEVBVkVOCkRBTEUjVFJJS0UjUkFWSQpTTFVFI0VEU0VMI1NMRUQ="},{"title":"USA Today 07/20/98 \"ISLAND HOPPING\"","author":"By Charles Preston","date":"1998-07-20","grid":"R0FSQkFHRSNBR0VOREFTCkJBSEFNQVMjQ1VSQUNBTwpTSEVSQkVUI0hBSVRJQU4KIyMjQkVMIyMjREVUIyMjCkVMR0FSI01BREUjWUFNIwpMT1JEI1BBTUVMQSNORVQKT1JFTyNVTklTT04jVEFXClBFTlNFRSMjI1VORElORQpFTEEjVFJJUFVQI09HRUUKUkVEI0FUVFVORSNNVVNUCiNJQU0jT0FUUyNGSUFUUwojIyNPQVIjIyNXSU4jIyMKU1RMVUNJQSNSQURJQ0xFCk9WRVJBQ1QjUFJFQ0FTVApTQUlOVE9GI0lTTEFORFM="},{"title":"USA Today 07/21/98 \"ALL ABOARD!\"","author":"By Charles Preston","date":"1998-07-21","grid":"UkFTUCNQRVdTI0FTU0hFCklERUUjRVJBVCNERVdBUgpDTEFQQklMTElST05JTkcKSEFTVEUjRUxMSU9UVCMjCiNJQ0lFUiNTRUwjI0NSWQojI09DVE9QSSNMSUNIRUUKQUlSIyNUT0dPI1JBQ0VTCkJSRUFEQ0VOVEVSQkFTRQpMQUNFWSNTUE9UIyNSRVMKRU5VUkVEI0xFQVNFRCMjClJJUCMjRURBI0xVUkNIIwojI1dBUk1FU1QjTk9IT1cKU0tBVEVPVVRLRVlEQVNIClBFU1RPI0NFT1MjRUxFRQpBR0hBUyNFUlNUI1NLQVQ="},{"title":"USA Today 07/22/98 \"DIAMOND MEN\"","author":"By Charles Preston","date":"1998-07-22","grid":"QUNFUkIjQkxVUkIjQUhBClNPUkVSI1JFUEVMI0ZBWApLRU5DQU1JTklUSSNBTEUKRURTI05BVE8jQU5EUk9TCkRTVCNDUk8jUklURSMjIwojIyNKVUFOR09OWkFMRVoKQVNTSVNUI09TUyNEQVRFClBVVFRJI1dSWSNWRVNUQQpBTUFUI0FFUyNNQU5URUwKUk9HRVJDTEVNRU5TIyMjCiMjI1JPT0QjSURJI1NBTQpQUklTT04jUFNJUyNMSUUKVUFSI01JS0VTQ0hNSURUCk1JQSNFVEFQRSNFQUdFUgpQRFEjREVMT1MjU1BPREU="},{"title":"USA Today 07/23/98 \"SEEING DOUBLE\"","author":"By Charles Preston","date":"1998-07-23","grid":"Q0hFIyNTVEFSI1NJWkVTClJFWCNWSU9MQSNBREVMRQpVTVAjRUxGSU4jQ09OSUMKSU1BR0VPRkFHSVJMIyMjClNFTk9SIyMjRVJFI0dFTwpFRERBI1NVTiNFRFNFTFMKIyMjSEFOS0lFI0NBTE1TCiMjUkVGTEVDVElPTlMjIwpTSEVBRiNTSFJFV0QjIyMKSEFORElOI0VFUiNCQVNICkVZRSNMT1gjIyNGQVJDRQojIyNNSVJST1JNSVJST1IKTUFSSUEjQU5FQVIjRU5FCkFUSUxUI1lFQVJTI1NDSQpDT09LRSNTQUxLIyNURU4="},{"title":"USA Today 07/24/98 \"NATIVE AMERICAN LEADERS\"","author":"By Charles Preston","date":"1998-07-24","grid":"RkVWRVIjQVJJRCMjR1BTCkFUT05FI1JFTElDI0VSQQpDSElFRkpPU0VQSCNSSVAKVEFEI1NBTSNTTEFMT01TCk9ORUEjTkFII09QSU5FIwpSRURTI0lUTyMjI0xJVkUKIyMjSElUSVQjQU5JTUFTClBPVCNDT0NISVNFI09MRQpFWEVURVIjRU1QVFkjIyMKUklDTyMjI0FNSSNFQVRTCiNEVU1QUyNEVVIjV1JBUApEQU1TRUxTI05JQSNPQkkKRU5TI1NJVFRJTkdCVUxMClNURSNPUEFSVCNFQVNFTApJU0gjI1NUQVkjRFJFU1M="},{"title":"USA Today 07/27/98 \"TRAVEL\"","author":"By Charles Preston","date":"1998-07-27","grid":"RkxFRSNCQVRPTiNHQVNQCkVBUkwjQUdFTlQjT0RFQQpTS0lJTkdJTlRIRUFMUFMKVEVFI0VFTFMjI0FMSUFTCiMjI01JTEUjRlVTSUJMRQpBTlZJTFMjSEFSVEUjIyMKUk9BTiMjR0VOSUUjQlVNCkNBUklCQkVBTkNSVUlTRQpTSFkjQVVOVFkjI0xFRVMKIyMjQklSVEgjUldBTkRBClJFU1VMVFMjR09PTiMjIwpPVkFURSMjRkVMTCNDSVQKU0FGQVJJU0lOQUZSSUNBCkVERU4jQUFST04jT0FLUwpTRVJFI05PTUFEI0JPWVM="},{"title":"USA Today 07/28/98 \"SPOTS FOR SPORTS\"","author":"By Charles Preston","date":"1998-07-28","grid":"QkFTRVMjTEFJUiNSQUJJCkFMSVNUI0VVUk8jRUdBTgpCSUdTVVJTVEFURVBBUksKRVNORSNBU0gjI05FUkRZCiMjI05FTkUjQU5PQSMjIwojSU5DTElORVZJTExBR0UKQ1JVRUwjI0xFTkEjTE9CCkFJUlMjQUJBU0UjVEFMRQpTU1MjT0xBTiMjUk9NQU4KVEhFR1JBTkRDQU5ZT04jCiMjI0FZRVMjQVJBQiMjIwpBU1RSTyMjVFJVI09QQUgKVEhFR1VMRk9GTUVYSUNPClRPTEwjQUxPVSNURUFSUwpTT0xFI1BPTEwjQVNTRVQ="},{"title":"USA Today 07/29/98 \"DIURNAL CYCLE\"","author":"By Charles Preston","date":"1998-07-29","grid":"U01BUlQjT1VSUyNNQVRFClNBTU9BI1NUQVRJT05FUgpUT1BPRlRIRU1PUk5JTkcKIyMjU1RFIyNFUkFUIyMjCkFOQVQjTEFSRUUjUkFORApESVNTT0xWRSNTRUVNRUQKT0JJI1JPT0QjI1NBTlRFCiMjTk9PTldISVNUTEUjIwpDQUlSTiMjRVNURSNTUEEKUkFORE9NI0FMQVJNSVNNClRSRUUjQURERVIjQUNUSQojIyNSSUNFIyNWSU4jIyMKTVVTSUNPRlRIRU5JR0hUCkFOT05ZTU9VUyNDQU5PRQpMT05HI0JFTlQjQUNVVEU="},{"title":"USA Today 07/30/98 \"TRAVELERS' CONVEYANCES\"","author":"By Charles Preston","date":"1998-07-30","grid":"UEFDQSNGRUxUIyNNQVVJCkFMQVIjVFJJQUwjRUFUUwpNT1BFRENBTVBFUlRSQU0KU1RJTkUjVE9JVFkjRUhTCiMjVEFCUyNVTkhBVCMjIwpMT1UjQUxBUyNFTklTTEUKQVdMI1NBRElFIyNORUlOClBMQU5FVkFOQklDWUNMRQpQRVRFIyNCRVJUSCNPQVIKU1RFQUxBI0NPU0EjTkNPCiMjI1BBUk1BI0FMQUQjIwpPS1MjSEVBUkEjRVRITk8KTU9UT1JDWUNMRVRSQUlOCkFORVcjQUJBVEUjRU5DRQpSQVRFIyNFQkFOI0VERVI="},{"title":"USA Today 07/31/98 \"ROUND AND ROUND\"","author":"By Charles Preston","date":"1998-07-31","grid":"U09OSU5MQVcjU0hBTUFOCkhJRVJBUkNII0tJR0FMSQpBTEJJTk9OSSNJUEVDQUMKU1BVTiNORVJEI1BFQUNFClRBTEFLIyNMSVBPI1JBTgpBTkEjRVNLSU1PI0ZPUkUKIyMjR0FNSU4jUEFJTlRTClNQSU5OSU5HSkVOTklFUwpNQVJBVUQjRE9ZRU4jIyMKT0xPUiNHUkVURUwjRUJCCktPTiNGRUFSIyNFTk5VSQpFTUlMRSNFVkFTI09SU0sKUElDT1RTI0lOQ0hPQVRFCk9OQUdFUiNTVFJBTkdFUgpUT0xFRE8jSEFZU0VFRFM="},{"title":"USA Today 08/03/98 \"POSTAL USA\"","author":"By Charles Preston","date":"1998-08-03","grid":"T0NIUyNTRUFMUyNHQVpBClJPT0sjVEVORVQjT01BUgpDQUxJRk9STklBTUFJTkUKQVhFI0VSSUUjUkVEU0VBCiMjI0dMRUUjQUdFUyMjIwpTVEFMTFMjQU1BVCNBTlQKQVJUT08jV0hJWiNQUkVZCkRFTEFXQVJFTkVXWU9SSwpBTkFUI0NJQU8jSUxPVkUKVERTI1NFTkQjR05PTUVTCiMjI0JPUkcjTE9PTiMjIwpTQ0FSQUIjTUVBTiNMRUUKQ09MT1JBRE9BTEFCQU1BCkFMRE8jVE9SU0kjT0hNUwpURUFLI0VTVEVFI1hSQVk="},{"title":"USA Today 08/04/98 \"SEASONAL\"","author":"By Charles Preston","date":"1998-08-04","grid":"Rk9BTCNTS0lGRiNSQVJFCkVSR08jTElWRVIjRUxJQQpFQVJOI0FCQVRFI1NQT1QKI0xJR0hUSU5BVUdVU1QjCiMjI1RFU1QjI0RBTSMjIwpTVEVFTCNaQVAjUEVEQUwKQ0VEUklDI0xBTSMjQU1BCk9ORU1PUk5JTkdJTk1BWQpST00jI1lFQSNTTk9PWkUKRVJBU0UjRVNTI0FTTkVSCiMjI0FMSSMjQUNSRSMjIwojTk9XSU5OT1ZFTUJFUiMKSE9MWSNOT01BTiNBU0lTCkVER0UjRVZFTlQjTkFTQQpZRUFSI1JBTlRTI0RVRVQ="},{"title":"USA Today 08/05/98 \"MONETARY\"","author":"By Charles Preston","date":"1998-08-05","grid":"UFJFUCNQTEFUUyMjU0hZClNBQVIjQ0FOT0UjRVRVSQpJTlZFU1RNRU5UI0FSTkUKI1RFU1QjRVRUVSNSRUFMCiMjI1RJTyMjT1BFTkVORApJTVBPUlRFRCNTVEVUIyMKVEFSTiNIRUVQI0VETkFTCkVUTyNET0xMQVJTI0FSRQpSRVNURSNTSE9PI1RNRU4KIyNQQUxNI0lOVEVSRVNUClBSRU1JVU0jI1NUVSMjIwpMQUNFI1JPU0UjQUZSTyMKT1RUUyNNVVRVQUxGVU5EClRFVVQjVVNFUlMjTEVEQQpTU1MjI1JFTkVFI0VERU4="},{"title":"USA Today 08/06/98 \"WATCH THY STEP\"","author":"By Charles Preston","date":"1998-08-06","grid":"RE9MRSNNQUxUQSNEQU1BCkFXT0wjQVJJRUwjRVJBUwpZRU9GTElUVExFRkFJVEgKT1JTI0FMSUUjI0lSQVRFCiMjI1RSRVMjUE9TVCMjIwpIT0xJRVJUSEFOVEhPVSMKT1BFTlMjI09MRVMjT05TCk9SVCMjVFVUT1IjI01UQQpUQUcjQVJORSMjUkFQSUQKI0hPV0RPSUxPVkVUSEVFCiMjI1JPVFMjTUFSRSMjIwpBU1RJUiMjU0FSSSNUQUIKVEhJTkVJU1RIRUdMT1JZClRBTkcjQVJFQVMjRVJHTwpBTUFTI01PUlNFI0JPT0I="},{"title":"USA Today 08/07/98 \"MANLY\"","author":"By Charles Preston","date":"1998-08-07","grid":"WUVBU1QjU0VUVVAjSkFNCkFMSUNFI1RSSVRFI0FNSQpNQVJBVEhPTk1BTiNDT04KIyMjVEhFUkUjI0FOS0xFCkJBVFRFUlkjVU5MSUtFRApPVEhFUiMjQlJVVEFMIyMKU0VFUlMjQ0FCQlkjVVNFClNBTVMjSE9SQVMjSUdPUgpZTUEjUkFZT04jTU1NTEkKIyNORUFURU4jI0FQQUlOClNLSURERVIjU1RSQU5EUwpUVUxTQSMjT1BBTFMjIyMKQURPI01BTkJJVEVTRE9HCkdPViNFTElPVCNORUFMRQpTU0UjU0VMRVMjRVNTRU4="},{"title":"USA Today 08/10/98 \"TIMELY FOLKS\"","author":"By Charles Preston","date":"1998-08-10","grid":"SUxMUyNNQUFNIyNUUkFNCkRPSVQjSU5UT1AjSEFMTwpFR0VSI0RFTExFI0FQU0UKQVVHVVNUV0lMU09OIyMjClNFRVRIRSMjU0FOI0JCTAojIyMjQVJHTyNDQU1FUkEKUEVHR1lNQVJDSCNFUklOCkFDUkVTI01BVSNTTkVBSwpJTElFI0RPTkpBTlVBUlkKTEFOREVSI0dPQkkjIyMjClNURCNNT1AjI1NDQU1QUwojIyNKVU5FTE9DS0hBUlQKUEFQQSNFTElERSNFTElBCkVXT0sjREVNT1MjQUxFQwpORVZFIyNFQVJTI0RFU0s="},{"title":"USA Today 08/11/98 \"GEOGRAPHIC\"","author":"By Charles Preston","date":"1998-08-11","grid":"U0NBVCNIRUxEI0JBQ0tTCkhPTkUjT0RJRSNVTkhBVApJVEVNI0xBTUIjU1RBVEUKTkVXUExZTU9VVEgjRElFCiMjI0xJTCMjVFJFQURFUgpGQUNFQ0FSRCNJTExTIyMKSVNII0tORUVMI1NPRkFTClNURVAjREVGQVQjVE9PVApISVZFUyNERU5JTSNSTkEKIyNZRVRJI1JFTUlOREVSClNFQ1JFVEUjI0VORSMjIwpQQUgjTElOQ09MTlBBUksKRU1BSUwjVE9NRSNIVUVZCkNPU1RBI0VMSVMjRVRBTApTTkVFUiNSQVRTI1dPUkU="},{"title":"USA Today 08/12/98 \"TIMELY\"","author":"By Charles Preston","date":"1998-08-12","grid":"QU5ESSMjQ09QWSNQRUFMCkhPVVJTI0FCTEUjQU5OQQpBTEJFRSNTRUVOI1NURU0KIyNPTkVEQVlBVEFUSU1FCkJFTklUTyMjU0FOI1JJTgpMVU5DSFRJTUUjVFJFQVQKVVJFI0VUTkEjU0VBIyMjClJPVEUjTEFSR0UjR01BTgojIyNMSUUjTlVOUyNBUkkKU0FUSU4jVElNRUxJTUlUCkVWQSNUQU8jI0NBTkFEQQpUSU1FT05NWUhBTkRTIyMKVEFQQSNHTEVFI1RJQkVSCkVURVMjTElURSNTQ09SRQpFRVJZI0VOSUQjI1RZUk8="},{"title":"USA Today 08/13/98 \"ISLAND HOPPING\"","author":"By Charles Preston","date":"1998-08-13","grid":"U1RBUkUjREFEQSMjQ0RTCk1BTkVTI0VSUlMjTUFJTgpPQk9FUyNQT09MI0FJUkUKR1VBREVMT1VQRSNVUkdFCiMjIyNORVRTI0VBUk5FUgpBTElORUQjQU1QSEkjIyMKUklUQSNHT0xEI0FUSU1FCkFNRU5ERUQjSU5TSURFUgpCQVNURSNPUElFI1VMTkEKIyMjVUxUUkEjVU5TRUFUCkFDQUNJQSNMQVJBIyMjIwpCQVNLI0NBTVBPQkVMTE8KQU1JRSNPVElTI0JMRUFSClNFQVQjTUlTRSNFTEFURQpFT04jI0FQVFMjREFSRVM="},{"title":"USA Today 08/14/98 \"GOING TO EXTREMES\"","author":"By Charles Preston","date":"1998-08-14","grid":"QU1PUyNBRlRFUiNTQVNIClNJUkUjUElBTk8jRUxJQQpJTkRJR0VOQ0VXRUFMVEgKU0lFTkEjU0lSRU4jWUVBCiMjUkVTVCNUT05HQSMjIwpBVkMjUEVXIyNBVVNURU4KUkFIIyNBSEFCI0xPUk5FClNMQVZFUllTRUxGUlVMRQpPVk9JRCNTQVZFIyNUQUQKTkVTVEVSIyNZQU0jSElTCiMjI0FTQU5BI1JPVkUjIwpBREEjU1RVQlMjVElSRUQKREVTUEFJUkVVUEhPUklBCkRBVEEjT1NMRVIjTE9OSQpTTElUI1NFRURZI0FSRVM="},{"title":"USA Today 08/17/98 \"LYRICAL METAPHORS\"","author":"By Charles Preston","date":"1998-08-17","grid":"UEFQI0hBU0gjI01BTUJPCkFSSSNPUkVTIyNBU0lBTgpDQ0MjWUVUSSNHUk9TU08KS0FOU0FTSU5BVUdVU1QjCkVESVRTIyMjSVRFI09JTApURUNBI0JMQVQjI1JVTEUKIyMjVFVSSU4jRURFUkxFCiNBQklHQVBJWlpBUElFIwpBTUVDSEUjU0VSR0UjIyMKUklHUyMjR0VOQSNBUFBUCk5DTyNCUk8jIyNBTExBSAojQU5FTEVQSEFOVFNFWUUKSUJJU0VTI0FURUUjQk9CCkNMQU5TIyNLSVNTI0VMQQpZRVNFUyMjRUFTVCNTQU4="},{"title":"USA Today 08/18/98 \"FEATHERED FRIENDS\"","author":"By Charles Preston","date":"1998-08-18","grid":"U0xBQiNCUkVBVSNFU1BZCkNPTUUjUk9BTlMjVEhPVQpBTElFI0VBUk5TI0hPV0wKTkFSUk9XU1BBUlJPVyMjCiMjI0hPU1QjIyNBU0VMRgojQ0hBUCMjTVVTSyNSRU8KQVJBTCNTQUlOVEUjVEFSCkRBUkxJTkdTVEFSTElORwpPVFQjTk9SVE9OI0VMRUUKUkVUI1RXQVMjI0FWRVIjCkVST0RFIyMjRVRSRSMjIwojI0hPTExPV1NXQUxMT1cKUEVBTCNJUkFURSNFQVNFCk9HUkUjUEFHRVIjUklMTApUT1RTI1NMRUVQI1NDT1Q="},{"title":"USA Today 08/19/98 \"DOLCE NAMES\"","author":"By Charles Preston","date":"1998-08-19","grid":"V0FUVCMjQklERSNFQ0hPCklHT1IjRUxERVIjVEhBRApTVUdBUlJBWUxFT05BUkQKUEVBQ0VBQkxFI0RBTkVTCiMjI0VEUyMjI0dFU1QjIwpIVUIjREVFI0VSQSNFU0MKSVNFUkUjTk9ORSNBVVRPClBVREROSEVBRFdJTFNPTgpQQVJTI0VSVEUjTklFQ0UKT0xBI1NSTyNEQUQjU0tZCiMjR1JVQiMjI1RJRSMjIwpBUkdVRSNCRUZPR0dJTkcKSkVMTFlST0xMTU9SVE9OCkFCRUUjQVJMRVMjRUNSVQpSQURTI1dFRUQjI1RISVM="},{"title":"USA Today 08/20/98 \"PERFECTION\"","author":"By Charles Preston","date":"1998-08-20","grid":"U0FMU0EjRkxBVCNTTkFQCk9OSU9OI0xVQkUjV0lOTwpJTlBVVCNBTk9OI0FTT1UKIyMjU09VTkRBU0FCRUxMCkdST0FOUyNJUk9OU0lERQpSQU4jWUVQI0RSSiMjIyMKQVRFRSNSRUEjI09WQVRFCkNPT0xBU0FDVUNVTUJFUgpFTk5JUyMjVEFSI0lBVEUKIyMjI0hBTCNST1kjU09DCkFDQURFTUlBI1dFUkVOVApGSVRBU0FGSURETEUjIyMKQUxBTiNORVJPI0xBQ0VEClNJTFQjRFJFVyNBQ1VURQpUQUxFI0FTU04jVEhFU0U="},{"title":"USA Today 08/21/98 \"TIME FOR A LITTLE CHANGE\"","author":"By Charles Preston","date":"1998-08-21","grid":"U0FMRVMjQVZJUyMjVFNQClVTVVJQI0JBUkkjU09BUgpQQVRJTyNBTEFOI1BPTE8KI1BFTk5ZU0lOR0xFVE9OCiMjIyNERUVEI1NPTE9ORwpTQU1VRUwjI0FUQUxPU1MKTklDS0VMT0RFT04jIyMjCk9ESUUjI0RBUiMjSVRFUgojIyMjU1RPUE9OQURJTUUKU1RBR0lFUiMjQUJBQ1VTCkVSUkFUQSNTQ0lTIyMjIwpXSU5URVJRVUFSVEVSUyMKRVBFRSNHVVJVI0FMSUFTClJPU1MjQUlMUyNJTUFHTwpTRFMjI1NUWUUjTk9MQU4="},{"title":"USA Today 08/24/98 \"PERIODIC\"","author":"By Charles Preston","date":"1998-08-24","grid":"U0NPVyNFREdBUiNTQUdBCkhJS0UjQVJPU0UjRUdBRApFVFJFI1JPQklOI0NPUEUKREVBRE9GV0lOVEVSIyMjCiMjIyNQVU4jIyNSRUdBTApNQVJDRUwjQUxUSVRVREUKQURBSVIjQVJJRCMjVEhFCkRPR0RBWVNPRlNVTU1FUgpBUlQjI1NBTUUjU0NBUkUKTUVBQ1VMUEEjUlVJTkVECkVER0VSIyMjQUVSIyMjIwojIyNSSVRFT0ZTUFJJTkcKTFVHRSNXQVNURSNPUEVOCkFTRUEjQVJMRU4jT1NTQQpCQUxMI1NQT1JUI01PVFQ="},{"title":"USA Today 08/25/98 \"QUOTES\"","author":"By Charles Preston","date":"1998-08-25","grid":"RE9MRVMjUE9UUyNXRVBUCkFNT0xFI0VNSVQjSVZBTgpURVJTRSNSSUxFI1JFTlQKQU5ESU1PVVRUQUhFUkUjCiMjI0VMTSMjU0xJRCMjIwpBRkMjWUFMRSNTUFJBR1MKRVJPUyNIRU1QI1BBRFVBCkRPTlRIQVZFQUNPV01BTgpFTkRVRSNJTkNBI05JTkUKU1RPREdZI0RBTVMjVE9SCiMjI0hFRUQjI1BFQSMjIwojV0hPTE9WRVNZQUJBQlkKVEhPUiNNSU5JI1NBRElFCklPVVMjQUlEUyNPQ0FMQQpQQVJFI05JU0kjTkFNRVI="},{"title":"USA Today 08/26/98 \"TWINS\"","author":"By Charles Preston","date":"1998-08-26","grid":"RElWQSNQRUxFRSNUQVBBCk9MQUYjQVRPTEwjRVRPTgpURVNMQVNBTExFI0FXUlkKI1NUT0lDI0xBTVAjT0tBCiMjI0FEQSMjI0lBR08jIwpNT1NURUxHQVIjQ09EQSMKSVJBI0RJQU5FI1RPV05TCkNBTlQjQVNJQU4jREFaRQpBTERFUiNFU1RFUyNSSUEKI0VCUk8jU0VBVkVSRE9OCiMjVU5ETyMjI0lURSMjIwpFUlIjRUREQSNOQVNBTCMKRE9HRSNFSU5TVEVJTkVNCklURUEjVEFTU08jR09ORQpUQVJUI1NMQUlOI05BU1Q="},{"title":"USA Today 08/27/98 \"TABLEWARE\"","author":"By Charles Preston","date":"1998-08-27","grid":"QU1BWkUjTEFIUiNTQ0FSCk1BSk9SI09HRUUjSEFMRQpPUkFOR0VCT1dMI0FSSUEKUkFSRSNEQVIjQVJNQU5ECiMjI0RFTlRBTFBMQVRFUwpBUEUjTUFFI0FTU04jIyMKUEFUVEkjI0FWRSNJRExZClNBVEVMTElURURJU0hFUwpFUkFTI0FSTSMjU1RPTkUKIyMjVFVSSyNHRUwjV0FSCkZMWUlOR1NBVUNFUiMjIwpST09NSUUjTU5PI0FJREEKSU5ETyNTVEFOTEVZQ1VQClRFRU4jU0FURSNET09ORQpPUkxZI0VNSVIjQU5ORVg="},{"title":"USA Today 08/28/98 \"TEMPERED\"","author":"By Charles Preston","date":"1998-08-28","grid":"Q09NQSNQTEFJVCNBSEFCCk9NQU4jU0FDUkUjVEFSTwpIQVJEQklUVEVOI1RSSU8KT0hBUkEjSE9ORSNBREFNCkVBVEVSWSNSRVRBSUwjIwojIyNXRUFSIyMjSU5BTkUKTUFTUyNDT09MRUQjQk9YCkFQTyNDSE9SQUxFI09ORQpSRUYjQVRURU5EI1NST1MKRVhUUkEjIyNERVJOIyMjCiMjU0lOTkVSI1JPT0ZFRApIT0hPI0FSRVMjUFJPTU8KQUJFVCNTT0ZUQk9JTEVEClNPTEUjQURFTEUjTklOTwpIRUxEI0xFUk9ZI0dPRFM="},{"title":"USA Today 08/31/98 \"OH, MY!\"","author":"By Charles Preston","date":"1998-08-31","grid":"RE9MUEgjUE9SSyNTVE9QCkFOSVRBI09QSUUjVE9HQQpNWUZBSVJMQURZI1JFTFkKRVhUI1JPSUwjTk9JU0VTCiMjI0FET1MjQk9DSyMjIwojTVlNT1RIRVJUSEVDQVIKSE9PUFMjI0xJRVMjSEJPCkVORFMjRU1JVFMjUklPVApMRUUjQVhFRCMjVElMREUKTVlMSVRUTEVNQVJHSUUjCiMjI0NPUlQjVVNFUyMjIwpTQ0hFTUUjRVRPTiNHTlUKQUhBQiNNWUxFRlRGT09UCkdBVE8jRUVMUyNPUkFURQpBUEVYI1NUQVQjTk9ERVM="},{"title":"USA Today 09/01/98 \"TOUCH ALL BASES\"","author":"By Charles Preston","date":"1998-09-01","grid":"Q1VSQUQjU0hBVyNCUkVUCkFGSVJFI1RBWEkjT0hOTwpNT0RFTSNBTExTI05PVEEKIyMjU0lOR0xFSEFOREVECkdQQSNMRUcjI0ZSSUFSWQpMT0NBTEUjU0FVVEUjIyMKT05USEVET1VCTEUjQk1XCkFHVUEjI01NRSMjQUxPRQpUT1AjVFJJUExFQ1JPV04KIyMjTE9VVFMjREFNTkVECkFHRU9MRCMjTUFSI0REVApXSU5TTE9XSE9NRVIjIyMKQUJMRSNMSU9OI0ZPR1VQClJFQVIjUExPVCNPTElWQQpFUklTI0hZREUjUkVHQUw="},{"title":"USA Today 09/02/98 \"SUPREME DECISIONS\"","author":"By Charles Preston","date":"1998-09-02","grid":"UkFUIyNEQU5HUyNTTEFQCklSQSNCT05FVVAjSE9NRQpNQVJCVVJZVk1BRElTT04KI0JBUlJFIyMjI09ORVJTCiMjI0FCRUUjTUVFVCMjIwpDUlVaQU5WTUlTU09VUkkKUk9TSU4jQU9ORSMjU0VCCklXQUxLI1NUVSNBQkVUUwpNRUcjI1JJSVMjTE9SUkUKUExFU1NZVkZFUkdVU09OCiMjI0VQRUUjU0VFTCMjIwpBTUFOQSMjIyNBUkVOQSMKTUlSQU5EQVZBUklaT05BClBMQVQjREhBUk1BI1RPTgpTT0xFI1NBTFRTIyNFTkQ="},{"title":"USA Today 09/03/98 \"ON LOSING, BY JOHN McENROE\"","author":"By Charles Preston","date":"1998-09-03","grid":"Q0xFRiNPU0NBUiNBUkFMCkFPTkUjSEFMTEUjTkFURQpSQU5UI1NDQUxQI1RJVE8KRVRVSVMjI05BVVRJTFVTClRISVNUQVVHSFRNRSMjIwojIyNIRUVQIyNFU1RBVEUKUEVQI1BSRVNTIyNBUklBCkFMRVNTT05CVVRJTU5PVApDVVJFIyNEQVJJTiNFU1MKRUxQQVNPIyNBTklMIyMjCiMjI1NVUkVXSEFUSVRJUwpESVNPUkRFUiMjU1RBUlQKT01BTiNFUklDSCNUU0FSClRBUkEjQUlTTEUjRVRUQQpFTUlMI0xFVFVQI1JFRUQ="},{"title":"USA Today 09/04/98 \"A DAY OFF\"","author":"By Charles Preston","date":"1998-09-04","grid":"UEFXQVQjQkVOUyNQT1NICk9OSUNFI0FMQUkjSU5DQQpPTlRIRUZSSVRaI0VWQU4KTE9TRVNJVCNMRU9UQVJECiMjIyMjTkFQIyNSQUNZIwpSSE8jT05CUkVBSyNBU1MKSE9VTUEjI0VMTCNFVFRFCk9VVE9GQ09NTUlTU0lPTgpEUk9QI1dXSSMjQ09PUlMKRUxGI0FUTFVOQ0gjTllFCiNZT0dBIyNNRUEjIyMjIwpBUlJFQVJTI1dST1RFVE8KRkFERSNVTkVNUExPWUVECkVURVMjTk9SQSNHUkVFRApXRVJFI1NXQU4jQVNTTlM="},{"title":"USA Today 09/08/98 \"POST-POLLED\"","author":"By Charles Preston","date":"1998-09-08","grid":"VEFDVFMjQVZJRCNDUkFCCkFMQVJZI01JTkkjSEVSQQpHQU1BTCNBQ1RFI0FDSVMKIyNQSVBFVFRFUyNQT0xMCkFHQVRIQSNPUkVMI1VTRQpQRUlTI1NJUiNMSU1OIyMKRU5HI0JFUllMI1ZPVEUjClNJTkdFI0FTRSNFQVJOUwojRVdFUiNTUEVBUiNFU1AKIyNPVElTI0VSTiNBUVVBCkFSUiNBTUlFI0lTU1VFUgpDQUtFI0VTQ0FMQVRFIyMKT1ZFUiNMRUhSI0dVU1RZCk1FUkwjVFJFVCNBVFRBUgpBTlNFI1NFU0UjTkVTVFM="},{"title":"USA Today 09/09/98 \"ON TOUR\"","author":"By Charles Preston","date":"1998-09-09","grid":"IyNTRVRII09CSSNSRUJTCiNTSU5BSSNXRUQjRURJVApIVU5UU1ZJTExFI1ZJTkUKRU5HI1NFTiNMQUJFTEVSCkFEQUdFI0FDRSNBUkVURQpSRVBFTCNQT1NFUlMjIyMKVFJPVCNBSUwjUkVFTFMjCkhFUiNJQ0VMQU5EI0lUQQojREVBTFQjRVRFI09WRVIKIyMjUExBTkVUI1NIRUFSClNDQVBBI09ORSNUT1JNRQpUUkVBVEVSI05FRSNQRVMKRUFSTCNCUklER0VQT1JUCkFOSUwjUklEI09MSU9TIwpMRUVTI09TQSNTRUFMIyM="},{"title":"USA Today 09/10/98 \"DOWN DRAFT\"","author":"By Charles Preston","date":"1998-09-10","grid":"SkVFUCNQRUFSI1NIQURTCkFMRE8jUklMRSNMSVRVUApNSUVOI0FHRUQjQVJPTUEKQkVORUFUSENPTlRFTVBUCiMjIyNMRVQjI09FUiMjIwpQSU5FRCNIQVNJRCNBQ0gKTE9BVkVTI0xBUyNFQ1JVClVOREVSVEhFV0VBVEhFUgpUSUVSI0FJUiNTVVJFU1QKT0FSI1NURVRTI1JFU1RTCiMjI1NIRSMjRVJBIyMjIwpTSU5LSU5HRkVFTElOR1MKT0NFQU4jUkFNUCNWRVJBCkNPTlRFI0FSTE8jQVJJTApLTkVFRCNERVlTI05PTkU="},{"title":"USA Today 09/11/98 \"NAUTICAL NONSENSE\"","author":"By Charles Preston","date":"1998-09-11","grid":"QUtJTUJPI01FVyNDTE9QCkdJREVPTiNBTEkjQUFSRQpPREVOU0UjTEFQI1NQSU4KIyMjU0NVTExTRVNTSU9OCk1FU0EjUEFSVCNLRU5OWQpBUlQjIyNLQUlTRVIjIyMKR1JBTiNLRVRDSFdPUkRTCkRPUkVNSSMjI0FTTEVFUApBUktXRUxESU5HI0VMTU8KIyMjU0VOT1JBIyMjQU1JClJFRUZTI1NLSU0jQVhFTApFTkRMRVNTU0xPT1AjIyMKQVNJQSNUSU8jT1NQUkVZCkNVVFMjTEVNI0NMQVVTRQpURVNII09SRSNIT0xNRVM="},{"title":"USA Today 09/14/98 \"CREATURE FEATURES\"","author":"By Charles Preston","date":"1998-09-14","grid":"TUFSTkUjTkVBUiNMSVNBCkFMQUlOI0lBR08jRURFTgpUSU5FUyNDUk9XU0ZFRVQKI0FDQ1VTRSMjQVNURVJTCiNTSEVFUFNLSU5TIyMjIwojIyMjI0VUT04jI09HTEUKR0FMTE9OI1BPTllUQUlMCkFCT1VORFMjTkVTVExFUwpQVUdOT1NFUyNHTE9TU0EKU1RFVCMjUk9NQSMjIyMjCiMjIyNSQUJCSVRFQVJTIwpFREdJRVIjI05FQVRFTiMKQklSREJSQUlOI1NBRElFCk9WQUwjT01OSSNFTElERQpOQU1FI1dPS0UjU0VERVI="},{"title":"USA Today 09/15/98 \"H2O\"","author":"By Charles Preston","date":"1998-09-15","grid":"Q0FTVFMjTUFUSCNFWUVECkFDTFVFI09MRU8jTkVNTwpTSE9SRUdSRUVOT1RURVIKS0VFTiNBU1MjI1JBSVNFCiMjI09PWkUjQUxBSSMjIwojQlVGRkFMT0ZBTExCRUQKQ0xJRlQjI0RPTEUjRU5FCkhBTlMjQ0FJUk8jTUFERQpJU1QjR1VSVSMjVEVOT1IKU1RBVEVSVU1XSU5ET1cjCiMjI0lURU0jQU5USSMjIwpBREFOTyMjU0lUI0FTSUYKVFlQSU5HTU9UT1JUSURFCk9LSUUjRUFTRSNCRVRFTApQRUVSI0RPT1IjSURFU1Q="},{"title":"USA Today 09/16/98 \"PISCATORIAL\"","author":"By Charles Preston","date":"1998-09-16","grid":"TU9USUYjUk9UQyNBR09HCkFST01BI09MSU8jVE9NRQpDQVJQRVRXRUVEI0FOQVQKRU5TVVJFIyNTRUxMRVJTCiMjI1RJRVJTI1dPTEYjIwpUT0dBRSNFTkRPVyNJU00KQUhBQiNTVEFSUiNBU1RJCkNBUkwjSElLRUQjQ0hJTgpPUkdZI0FNSVNTI0NJTkUKU0VBI0VERU5TI0RJTkdTCiMjTkVSTyNHWUJFRCMjIwpPVVRMQVdTIyNPUEVSQVMKQUdVRSNCQVNTT09OSVNUClNMQVYjT0RPUiNTVE9XRQpUWU5FI1hFTk8jRVNURVI="},{"title":"USA Today 09/17/98 \"BISTROS\"","author":"By Charles Preston","date":"1998-09-17","grid":"QkFOSk8jUk9BTSNTTElQCk9DRUFOI0FSTE8jS0lURQpCUkFDRSNNRUxTRElORVIKU0VSS0lOUyNBTEEjRU1VCiMjI1NMTyNTSEVMRiMjIwpEVU1CTFVDSyNNRVJDRVIKRVRVSSNOT0FII1lBTElFCkZJUlMjU0FUWVIjTk9EUwpBTEFURSNMRURBI0tORUUKVEVUUkFEI1JFSU5TRVJUCiMjI09WQUxTI1NJUCMjIwpPUEEjRU5FI1NFQUxBTlQKTU9OS1NDQUZFI0NBTUVPCklPVEEjRVZFTiNJQ0lFUgpUUkVZI1JFTlQjTkVSRFk="},{"title":"USA Today 09/18/98 \"ROADRUNNERS\"","author":"By Charles Preston","date":"1998-09-18","grid":"VENIQUQjQUxBUyNERUJUCkFMT05FI0NPTlkjVVJFQQpQT05USUFDRklSRUJJUkQKQUREI1NQT1QjSU5MRVRTCiMjQVNUT1IjQU5USSMjIwpTQUNIUyNET0RHRU5FT04KQ0xJTyMjI1NFRVIjQUNFClJBVkVTI1dJTiNTQUdFUwpBUkkjUExJRSMjI1NMQVQKR01DU0lFUlJBI0xJRU5TCiMjI0VOVlkjQkxBU1QjIwpTSEVSRUUjQVVFUiNBRlQKQ0FESUxMQUNTRVZJTExFCkFMRUUjRUxJRSNBTE9FUwpUT05TI0RBRFMjTEVORFM="},{"title":"USA Today 09/21/98 \"MONEY TALKS\"","author":"By Charles Preston","date":"1998-09-21","grid":"VkVJTFMjQ0xJUCNJRE9MCkVBVFVQI0RFTEwjTk9WQQpUUkFTSCNSQVJBI1RSRUsKT05USEVNT05FWSNISVJFCiMjIyNST01FI0VKRUNUUwpCVUZGRVIjU0NSQU0jIyMKT0hJTyNFVFRBI05PT05FClNVTlJJU0UjUkFJTklFUgpTSElNUyNTUEFTI0VMQU4KIyMjWUVOVEwjVFJZU1RTCkNSSU1FQSNBQVJFIyMjIwpMT0JPI1BVVE1PTkVZT04KQVlJTiNLTEVFI0VYSUxFCk1BWkUjSU5BTiNXSVBFUgpTTEFZI05BVVQjU1RFQUQ="},{"title":"USA Today 09/22/98 \"DROLL DESCRIPTIONS\"","author":"By Charles Preston","date":"1998-09-22","grid":"U1dBSU4jVEFQUyNDTElQCkxBTkNFI09WQUwjTEVUTwpBR05FVyNHRVJFI09NSVQKV09PRFlIQVJSRUxTT04jClNOWSNPQVNUI1BFRU5FRAojIyNBUlIjI0JFTiNUUkUKRlJBTktERUZPUkQjUkFQClJFTFkjI1JBTSMjUkVOTwpPVEIjVE9OWUJFTk5FVFQKTlJBI0VMTyMjUEFTIyMjClRBVFRFRCNCQUVSI1NCQQojQ1JZU1RBTEJFUk5BUkQKU1RPUCNJUkFOI09DVEFECkhPU0UjTU9SRSNXQUlWRQpFUlNFI0VXRVIjU0FORVI="},{"title":"USA Today 09/23/98 \"VEGETABLE SOUP\"","author":"By Charles Preston","date":"1998-09-23","grid":"R09BVFMjV0VCQiNHT1NICkFMREVSI0FMT1UjSU5UTwpTSVpFT0ZDT0FMI0dMVUUKUE9FVCNJT04jTExPWURTCiMjI0VEUyMjI1BBTCMjIwpBVFRSQUNUSVZFV09NQU4KQlJBRVMjRVZBTlMjQUdPCkJJUkQjUEFJTFMjU1RBTgpFTFMjUkVTRUUjRUxTSUUKU0xJR0hURVNUQU1PVU5UCiMjI0xFRSMjI01PVyMjIwpDQVZJQVIjQVBPI0JBUkUKQUNJRCNQQVBFUk1PTkVZCkFSVEUjQVJFQSNSQURBUgpORUFSI05FWFQjU1RZTEU="},{"title":"USA Today 09/24/98 \"HERE'S JOHNNY!\"","author":"By Charles Preston","date":"1998-09-24","grid":"TUFSSU4jU0FHQSNLQVZBCk9NQU5JI1RSRVMjQU1JUwpKT0hOTllPTlRIRVNQT1QKT1NTI0VFUk8jI0RFTExBCiMjI1NUQVkjU1dBTUkjIwpSQU1JRVMjVEhFTSNGSUIKQURBR0UjV0FJTCNBSURBCkpPSE5OWUFQUExFU0VFRApBUkFTI0FHRVMjVklSQUwKSEVSI0ZMRUQjTUVBU0xZCiMjSUNJRVIjUEVOTiMjIwpBUlNPTiMjQ0FTVCNBRE8KSk9ITk5ZR09USElTR1VOCkFNSUQjRUFTVCNET09ORQpSQVNFI1NMQVkjRURHRVM="},{"title":"USA Today 09/25/98 \"EXCUSE MY Q's\"","author":"By Charles Preston","date":"1998-09-25","grid":"QklDQVJCI0lNQU4jR0FHCkJPSUxFUiNOQURBI0VFRQpRVUlQUElOR0JPWSNXUlkKIyMjQUxHT1JFI1NBR0FTClNBVUNZI1RBTEMjTUFURQpQVVJBI1FVSUxMUE9XRVIKQVRFI0JVUk4jQVJOIyMjClNPWUJFQU4jRlJPR01BTgojIyNBQUgjQ09FRCNPTEUKUVVJUktPRkFSVCNQT0dPCkFOTkUjR0FSQiNPUkdBTgpUVUxTQSNDUkVBU0UjIyMKQVNBI1FVQVlTVEFUSU9OClJFWSNVTkRPI0FHQVNTSQpJRFMjQURFTiNURVhNRVg="},{"title":"USA Today 09/28/98 \"GIVE IT A GO\"","author":"By Charles Preston","date":"1998-09-28","grid":"T1NIQSNSQUJBVCNCRUFEClJFRUwjVVJJQ0gjRUxNTwpBR0FJTlNUVEhFR1JBSU4KTk9EI09IUyNFUlJBTkQjCiMjVE9URSMjI09BVCMjIwojVE9TRUVEI01VU0VVTSMKSEFIQVMjUklPVFMjUE9FClVTRVIjRk9SVEUjQVRSSQpFVEEjUk9TU0kjU1BIRU4KI0VER0VSUyNGTE9PRVkjCiMjI0FMQiMjI0FORFMjIwojU0lTRVJBI1RWQSNQQVIKQkFDS1RPU1FVQVJFT05FCkFMT0UjS0lBTkcjTFVOQQpSRU5UI0VTVEVFI1NURVA="},{"title":"USA Today 09/29/98 \"SLICE OF LIFE\"","author":"By Charles Preston","date":"1998-09-29","grid":"SEVJUiNJU0xBTSNFV0VTCkFDUkUjTkVBTEUjUEVMRQpTSEFWRVRBSUxTI0lQU0UKVE9RVUUjVFJJTUVTVEVSCiMjI0VMRiMjRUVSTyMjIwpPUkcjU0VBTSNSSURETEUKUk9PIyNBR0VTI0VBUkVECkNVVFRIUk9BVElTTEFORApBU1RSTyNHUkFEIyNNREkKU1RBSVJTI0FSRVMjU1NFCiMjI1BFTFQjI0FMUCMjIwpDTElQQk9BUkQjQUxJS0UKUkFWSSNTSEVBUldBVEVSCk9NQU4jSE9NTUUjWkVOTwpQQU5HI1lFU0VTI0FNT1M="},{"title":"USA Today 09/30/98 \"TITLE CHAIN\"","author":"By Charles Preston","date":"1998-09-30","grid":"QlVMR1kjQ0hBRCMjTUFUCkFUQVJJI0hFUk8jREVWTwpSRU5BTiNJQVRFI0FMSUEKRVBJQyNBQ1JFI0JSRUFECiMjI0VMSU9UI1RPS0VOUwpBQlJPQUQjT0NFQU4jIyMKQUxPRlQjQUZBUiNFUkFTClJFQU0jRU5ERVIjU09MRQpFRERZI0RZQU4jQVNQRU4KIyMjSEFHQVIjUExBWUVEClNQSEVSRSNLTkVMVCMjIwpUUkVBVCNLTk9XI05EQUsKUEFSUiNPTkVMI1NPT1RICkFIT1QjV0VTVCNMT1JOQQpUVU4jI0xFU0UjQU5TT04="},{"title":"USA Today 10/01/98 \"CLASSY COLLEGES\"","author":"By Charles Preston","date":"1998-10-01","grid":"T1JBTCNHQUIjUEhBU0VEClRBWEkjSU5BI1NBUlRSRQpUSEVTRVZFTlNJU1RFUlMKIyMjUExFQURTIyMjRUVLCiNWQVNTQVJCQVJOQVJEIwpDT1QjIyMjIyNPSUwjIyMKUklPVFMjUkFEQ0xJRkZFCkVDTEFUI0VUQSNFVklMUwpXRUxMRVNMRVkjU0VSVU0KIyMjTElFIyMjIyMjU1NFCiNCUllOTUFXUlNNSVRIIwpKQUkjIyNSRUVMRUQjIyMKQU5ETU9VTlRIT0xZT0tFCldBR0VSUyNMSVQjTFVJUwpTTEVER0UjWURTI0xJRFM="},{"title":"USA Today 10/02/98 \"WHAT'S THE MATTER\"","author":"By Charles Preston","date":"1998-10-02","grid":"U0FSQU4jQ0FQUyNST0FSCkFMT05FI09MTEEjRUxCQQpNQVRURVJPRk9QSU5JT04KRU5TI0RFTEFZI1NOT1JUCiMjI0FMQUkjI0hPSVNUUwpNQVRURVJPRlRJTUUjIyMKQUNSRSMjI0xJUkUjQVRNClRJRSNHUk9VUEVSI1JBRQpBRFMjUkFQVCMjI05JTEUKIyMjTUFUVEVST0ZGQUNUClNFREFOUyMjQU5JTCMjIwpFTEFORCNIQVNUQSNIQk8KTUFUVEVST0ZDT05DRVJOCklURVIjQVNFQSNDT1JBTApTRVJBI01FV0wjRUJPTlk="},{"title":"USA Today 10/05/98 \"TERMINATIONS\"","author":"By Charles Preston","date":"1998-10-05","grid":"QkFSTiMjVkFMT1IjQVJNCkVNRUVSI0lSQU5JI01JQQpSVU5PVVRPRkdBUyNBTEkKR1JFTkRFTCNTTk9PWkVECiMjIyNPUkUjIyNUUkVTUwojQ0FMTElUUVVJVFMjIyMKQ0hJRUYjI1VORE8jREFCCkhJREUjQkxJU1MjR0FMQQpJQ0UjVkVJTCMjT05JT04KIyMjQklURVRIRURVU1QjCkJJU09OIyMjT0xFIyMjIwpJTktXRUxMI01BU09OSUMKRFVFI0dPVVBJTlNNT0tFCkVSRSNBTkdFTCNBQVJPTgpTRVQjUkVFRFkjI1JBTlQ="},{"title":"USA Today 10/06/98 \"ANY PORT\"","author":"By Charles Preston","date":"1998-10-06","grid":"Q0FQUCNQSU5LUyNQT0xFCk9CT0UjQVNUUk8jT05BTgpQT1JUQVJUSFVSI1JFVEQKQVJURUwjIyNQRVNUTEUjCklUQSNFUVVJUCNMT0lSRQpCRUcjR1VOUyNNT0ZGT1MKQURFUyNBSVQjQU1JRU5TCiMjI1BPUlRIVVJPTiMjIwpSRVRPUlQjTVJUI09QQUwKT1BPUlRPI1VHSFMjT01FClRFTlRII0FTRUFUI1JOUwojRU5TT1VMIyMjQVJURVMKRElBTSNQT1JUVUdVRVNFClVTR0EjVEhBSVMjQlJJRQpCVEVOI09BVEVTI0VTQ1M="},{"title":"USA Today 10/07/98 \"BORN ABROAD\"","author":"By Charles Preston","date":"1998-10-07","grid":"QkFOQ1MjQkFURSNCQVdMCk9OSU9OI0FWRVIjQUxPRQpMRU9SQSNTT1JBI0JBUkUKQUxCRVJURUlOU1RFSU4jClNFRURFUiNERUVSIyMjIwojIyMjREVFIyNTQVNTRUQKU0VBVCNBQ0hFI1NBT05FCkFMRlJFREhJVENIQ09DSwpDTEFJTSNPUEFII0tORUUKU0VSR0VTIyNMQVMjIyMjCiMjIyNFQVNUI1JFU0FMRQojSEVOUllLSVNTSU5HRVIKU09EQSNFSU5FI05PTEFOCkFMRVMjUkVURSNFUk9TRQpURU5UI1NTU1MjREVCVFM="},{"title":"USA Today 10/08/98 \"IN PIECES\"","author":"By Charles Preston","date":"1998-10-08","grid":"QUJBVEUjQUxBTU8jV0FECkJFVEFTI1NFTkFUI0FHTwpCUk9LRU5IRUFSVCNTTE8KQU5ORSNDRVJUI0FMVEVSCiMjI1RPT04jI1NXRUVUUwpFUFNPTSMjRFVDQVRTIyMKUklBI0lOU0FORSNBVE9QClNQTElUSU5GSU5JVElWRQpURUVOI0dJRlRFRCNNRU4KIyNTQUZFVFkjI0VNRU5EClJBUFBFUiMjSUZTTyMjIwpFTElURSNBSVJFI09QRUMKUkVUI0JVU1RFREZMVVNICkFSQyNMQVRJTiNDQVJURQpOVEgjRVJBU0UjQ0hFRVI="},{"title":"USA Today 10/09/98 \"MELANGE\"","author":"By Charles Preston","date":"1998-10-09","grid":"QUxURSNDSEVBUCNBSVJTCk1VT04jRUFHTEUjRFJJUApPWFlHRU5NQVNLI1JPTkEKUkVTRU5URUQjSUNJTkdTCiMjI05PUiMjT05PRkYjIwpDQU5ETEUjQUxFUlRJTkcKT0dFRVMjRkxBU0sjU0FPCk1PT1IjU09MVkUjU1RJUgpFUk4jT1RPRVMjU1RFVkUKU0FMSVZBVEUjQ0FSREVECiMjSVJBVEUjI0FCRSMjIwpBTkdFTEkjQ0FSRVNTRUQKSk9ITiNTSUxWRVJTVEFSCkFOVEUjVFJBSVQjRUFSTgpST1NTI1NBTkRTI1NUTE8="},{"title":"USA Today 10/12/98 \"THE DOCTOR IS IN\"","author":"By Charles Preston","date":"1998-10-12","grid":"VFJJUCNTRVRTI1NBVFVQClJBQ0UjUExFQSNDTEFSQQpPVkVOI0VBU1QjT0ZGQUwKWUVSVExFVEhFVFVSVExFCiMjIyNPREUjI09SRSMjIwojU09BUlMjRUxTI0RBVEEKQVBQTEUjQUxFQyMjU0VDCkdSRUVORUdHU0FOREhBTQpFQVIjI0xFSVMjT0JFU0UKRFlBTiNMRU4jQ1JBTkUjCiMjI0FQRSMjUEFNIyMjIwpIT1JUT05IRUFSU0FXSE8KRU1JVFMjVU5JVCNJUk9OClNBR0VTI1RPTkUjREVMTApTTkFSRSNVU0VSI0FORFk="},{"title":"USA Today 10/13/98 \"RELATIVELY\"","author":"By Charles Preston","date":"1998-10-13","grid":"U0hVVCNNRVNTI0JST1RICkhVU0gjSU5UTyNST0RFTwpPTEVPI1JBSUwjQVNPTkUKV0FSTkVSQlJPVEhFUlMjCiMjI0dBT0wjI0hNUyMjIwpMUE4jVFJFTExJUyNBTVMKQVJPU0UjI0VZRSNBTE9UClBBUlRSSURHRUZBTUlMWQpTV0FZI05FQSMjUklWQUwKRU5EI1JFRkxFQ1QjRVJFCiMjI1BBUiMjQVJJQSMjIwojUE9JTlRFUlNJU1RFUlMKRUFSTlMjR1VUUyNUUkFQCkdVU1RPI0FMT1AjSU1TTwpHTE9PTSNERU5ZI0NBUFQ="},{"title":"USA Today 10/14/98 \"HOOP DREAMS\"","author":"By Charles Preston","date":"1998-10-14","grid":"TUlEQVMjTEVDSCNCQVJLCkFCT1VUI09SRU8jRUxJRQpCQVNLRVRCQUxMI1RJTEUKIyMjU1dFRVRTSVhURUVOClNQWSNBTkQjI0VNRU5EUwpDSEVFUlMjT0tSQSMjIyMKUk9BRFRPVEhFI1NJTU9OCkFOVEkjUk9BUlMjTk9WQQpQRVNUUyNGSU5BTEZPVVIKIyMjI0hPVVIjTk9PRExFCkVOREVBUiMjRVRPI1lFUwpNQVJDSE1BRE5FU1MjIyMKSVRBTCNFTElURUVJR0hUClJBTUEjUkVORSNOQVdBQgpTTEFUI1NFQVIjU01VVFM="},{"title":"USA Today 10/15/98 \"BASEBALL BUNGLES\"","author":"By Charles Preston","date":"1998-10-15","grid":"QlVTWSNTVEVQUyMjQkFICkFSRUEjTEFOQUkjQU9ORQpLSUNLQk9YSU5HI0NPU0kKRVNUI09XRUQjSEFUVEVSCiMjI09OVVMjU1RST0xMUwpBRERTVVAjREVTSVJFIyMKQ0FSVFMjUElORUQjR0FMCkFMT0UjQ09OREUjQUdSQQpERVAjSE9MRVMjUExFQUQKIyNMRUFORUQjRkFJUkxZCkNSRURJVFMjTUFSVCMjIwpSRVRJUkUjUE9SSyNTU1QKQU5URSNNSVNTTUFSUExFClpFRVMjUE9TU0UjQk9PUgpZRVIjI1RVVE9SI0lURU0="},{"title":"USA Today 10/16/98 \"BOX OFFICE BONANZAS\"","author":"By Charles Preston","date":"1998-10-16","grid":"UkFMUEgjQURFIyNNRVRFCkFXQVJFI0NBTlQjT1ZJRApHT05FV0lUSFRIRVdJTkQKI0xBVEVSI0xJUkEjTEFZCiMjI1RSRVMjVFVSRiMjIwpDT0RZUyNUT1lTVE9SWSMKQU5FVyNET1cjVEhST0VTCk5FQk8jUkFOR0UjUlVOVApDUklNRUEjRUFSI0VUVEEKI1NUQVJXQVJTI0VTU0FZCiMjI05FU1QjUEVMVCMjIwpTT04jTU9PUyNMRUdBTCMKVEhFU09VTkRPRk1VU0lDCk9JU0UjVEVBUiNJTUlOTwpQT1NUIyNTS1QjU1BBVFM="},{"title":"USA Today 10/19/98 \"TAKE THE EL\"","author":"By Charles Preston","date":"1998-10-19","grid":"QUxGQSNERUxJUyNFTklECkNBQU4jRVZJVEEjTEFORQpFTFNBTFZBRE9SI05JTkEKRE9UI0FJRFMjRFJJVkVMCiMjVEVOU0UjU09PTkVSUwpBQlJBREUjQ09ORE8jIyMKUkVBUiMjRUVSSUUjVEFCCkVTQyNFTEdSRUNPI09MRQpBU0sjUk9HRVIjI0FNRU4KIyMjRUFWRVMjRk9SQ0VEClNNRUxURUQjUEFMRVIjIwpURU1QT1MjVk9URSNVU0EKQUxJQSNFTEVTQ09SSUFMCk1FVFMjQU9SVEEjT1NMTwpQRVNPI1RPQVNUI01FRVQ="},{"title":"USA Today 10/20/98 \"TIME LINES\"","author":"By Charles Preston","date":"1998-10-20","grid":"Q0FBTiNBQ1JJRCMjVk9MCkFGUk8jQlJJTkUjQklERQpNQVRURVJPRlNFQ09ORFMKUFJZI1RBUEUjI0hPWUxFCiMjI1JPRFMjU1RFRUxZIwpNQVJJTkUjU1dPUkQjIyMKQU1PUyMjUkFJTlkjU0FQCk1PTUVOVE9GU0lMRU5DRQpFS0UjVVJHRVMjI1JJTUUKIyMjU1RFRVIjQ0FSVEVSCiNTSU1NRVIjVE9OUyMjIwpDQU5PRSMjVEFGVCNEQVcKSE9VUkdMQVNTRklHVVJFCklOUkUjRUxBVEUjQVBFRApURUUjI1NQUkVFI1BFQVM="},{"title":"USA Today 10/21/98 \"PAGING WILLIAM\"","author":"By Charles Preston","date":"1998-10-21","grid":"QkxBSCNBUkMjIyNTQ09UClJPVE8jTUlMTkUjTEFURQpBRkVXI0FHT09EI0FOVEUKU1RVQVJUU1lNSU5HVE9OCiNTUFJZIyNJREVBIyMjIwojIyNERVZBTkUjT0hBUkEKTU9BVCNFUkcjRU1FVElDCkFOVEFSRVMjQ0xJTlRPTgpSRUVGRVIjUkVBI1JBVEUKU0FOVEEjSEVOTEVZIyMjCiMjIyNMQVlTIyNUQkFSIwpURUNVTVNFSFNIRVJNQU4KRUxVTCNTTkFLRSNBQlJJCkVMQkEjVEFQSVIjR0xFTgpNRUFOIyMjRU1FI0dFUkU="},{"title":"USA Today 10/22/98 \"HOMOPHONES\"","author":"By Charles Preston","date":"1998-10-22","grid":"QVNJREUjQkVUQSNCQVRTCkRBVklUI0VNSUwjQURJVApBUkFWRSNHQVRFI05JREUKTUlORVJNSU5PUiNERUFMCiMjIyNOQU5BI1RBQlVMQQpJTUFHRVIjVEVTVEEjIyMKREFSRSNJU0VTI0VOU1VFCkVNSU5FTlQjUEFOTklFUgpBRURFUyNBUE9EI0VMTEEKIyMjU1RBVEUjRE9ET0VTClRST0pBTiNFVkVSIyMjIwpSQUNFI0dPUkVER09VUkQKQVJFQSNFTUlSI0lHTE9PCk1FQU4jTEVOUyNFUk5JRQpQRU5TI0FOR0UjU0VBTFM="},{"title":"USA Today 10/23/98 \"RELATIVELY\"","author":"By Charles Preston","date":"1998-10-23","grid":"QVJDSCNMQVJBUyNCQU5FCkJFQVUjRVhBTFQjQU5PTgpFRUxTI0dPTkVSI1NUVUQKI0tJU1NJTkdDT1VTSU4jCiMjI0FDVCMjI1BSTyMjIwpTQUJSRSNBQVIjTk9NQUQKT0RFI05BU1NBVSNOQU1FCkZBVEhFUkNPTkZFU1NPUgpBTFRPI0NPTkRPUiNTVU4KUkVFTFMjVEVZI0lDRVJTCiMjI0RFVyMjI1VLRSMjIwojQlJPVEhFUklOQVJNUyMKU0xBViNPTEFORCNFQUNICkhVR0UjTEFOR0UjQUxPVQpZRUFSI0VOVEVSI0xJVEU="},{"title":"USA Today 10/26/98 \"PLACE YOUR BETS\"","author":"By Charles Preston","date":"1998-10-26","grid":"QVBFUiNBQ1JFI1RBQ0tTCkRBREEjQ0hFVyNBTE9ORQpPVElDI0NBU0UjTElORU4KUklDRSNFTkUjUExBTkVECk5PVEhJTkdUT0xPU0UjIwojIyNPTlQjI1JPVyNDQVQKQUxFUlQjSEFMVCNJVENICldJTlNPTUVMT1NFU09NRQpMQURFI09ESU4jUk9SRU0KU1JPI1NBRyMjSklNIyMjCiMjV0lOTkVSVEFLRUFMTApDT01NQVMjQVJNI1RSRUUKQVBFQUsjQURBTSNST05BCkxVTkdFI1JJREUjSVNJUwpFU1RFUyNDT0VEI0NFTlQ="},{"title":"USA Today 10/27/98 \"OCCUPATIONAL\"","author":"By Charles Preston","date":"1998-10-27","grid":"SE9TUyNTVEFJUiNTQ09UCkVSTEUjSEFSVEUjUE9ORQpSRUFSI0FOTkVYI0FMRVgKQk9CQkFSS0VSI0JMRVNUCiMjI0lCT1MjI0tFTFAjIwojQUdBSU4jTE9ORVNPTUUKUExBTkUjUkFEQVIjUk9OCkFJUlMjU0FMRVAjU1RMTwpTS1kjVkVJTFMjU0hFTEwKU0VDUkVUTFkjUEFSUlkjCiMjT0FUSCMjU0lORSMjIwpQUk9UTyNKQU1FU0RFQU4KUkFQVCNSVURFUiNEQU5FCkFSRUEjQU5aQUMjRVNORQpZQVJOI0RFRVJFI0RZRVI="},{"title":"USA Today 10/28/98 \"HOME SWEET HOME\"","author":"By Charles Preston","date":"1998-10-28","grid":"TUFTSCNXRUZUI0pPTkVTCkFSTE8jSUxJQSNVQk9BVApSRUFQI05BUksjTU9PRFkKQ0FCSU5FVE1FTUJFUlMjCiMjIyNPUkUjI0VMUyMjIwpOQVBFUlkjTUFURSNBU0sKQUxBUk0jWkFORSNUUkVFCkNPVFRBR0VJTkRVU1RSWQpSSEVFI1JBWkUjTkFJVkUKRUFSI1ZBTEUjU0NSRUVECiMjI1FFRCMjVklBIyMjIwojSE9VU0VEUkVTU0lOR1MKTEFNQVMjRUFSTCNORUFUCkFMSUtFI1ZJU0UjQ0FHWQpNT1RFTCNPRE9SI0FMRVg="},{"title":"USA Today 10/29/98 \"TV BY THE NUMBERS\"","author":"By Charles Preston","date":"1998-10-29","grid":"TUlTUyNMQU1QI1NBRkVSCkFSQUwjT1JFTyNUUkFXTApMT05JI0dFTFQjUkFDRVMKT05FREFZQVRBVElNRSMjCk5PU0VEIyMjVE9QI0RPVApFTlQjT0NFTE9UI0xPQkUKIyMjR1JFVEEjI1NFV0VECiNUSFJFRVNDT01QQU5ZIwpCUkFJRCMjRUxUT04jIyMKT1VTVCNTSFJBTksjQ1JPCkRFQiNFQ08jIyNFR1JFVAojI0VJR0hUSVNFTk9VR0gKU0hFQkEjRE9VUiNUSVJFClBJTkVEI09USVMjVVNFUgpSRVNUUyNHQVRFI1BFVFM="},{"title":"USA Today 10/30/98 \"INCANTATIONS AND SORCERY\"","author":"By Charles Preston","date":"1998-10-30","grid":"REFXTiNSRUFDVCNUV0lUCk9NT08jQU1NQU4jUklTRQpNVU1CT0pVTUJPI0FUVE4KQVJCT1IjI09BVCNOQ08jCiMjI0RBSVMjTEVBU0gjIwpCQUJZTE9OUyNTTElDS1MKTElMI1NOSVBTI0FUUklBClVTQSMjU1BSSUcjI0FERApFTENIRSNFQVRFUiNGREEKREVLQUxCI1RBVEVSVE9UCiMjTUlMRVMjUkFURSMjIwojSkFSI1RIRSMjSU5EUkEKU0lHTiNIT0NVU1BPQ1VTCk9CSUUjRVRPTlMjSVZFUwpTRUNUI0xFTk9TI1JJREU="},{"title":"USA Today 11/02/98 \"FOOTAGES\"","author":"By Charles Preston","date":"1998-11-02","grid":"TElNUCNTQ1JBTSNUQUZUCkVTQVUjTU9JUkEjQVBSQQpTRVRUSEVQQUNFI0tPT1AKU0VTVEVUIyMjU05FRVpFCiMjI1NUQUIjU1RFQU1FUgpJTEEjVU5JI0NSRVcjIyMKRElTSFBBTiNIT0RBRERZCk9MSU8jIyMjIyMjTElSQQpMSUZUT0ZGI0JVQ0tSQU0KIyMjRlJPRSNBU0gjRU1TCk9OQk9BUkQjUlVFRCMjIwpQQVJPTEUjIyNBUklTRU4KRVRBVCNTVEVQTElWRUxZClJBVkkjVE9UQUwjT01BTgpBTE9UI1NUT1JZI1RJTlk="},{"title":"USA Today 11/03/98 \"TAKE A VOTE\"","author":"By Charles Preston","date":"1998-11-03","grid":"QVFVQSNCTEFERSNEQU1QClJVTkcjUkFSRVIjSVRBTApNQUlBI09SR0FOI05BUlkKQVNUUkFXVk9URU9OTFkjCkRBRSNHTkFTSCNSRUFNUwpBUlNPTiMjIyNWRVJOQUwKIyMjUkVBRFNUTyMjVFJZCiNTSE9XU1dISUNIV0FZIwpBV0UjI0hJQUxFQUgjIyMKQkVBTklFIyMjI0JZUk9OCkNFUkVTI0FETEFJI09ORQojVEhFSE9UQUlSQkxPV1MKQVBFRCNLTElFRyNBTUFUClBFQVQjTEFSR08jSElSRQpUQVJPI0FTWUVUI1JFREQ="},{"title":"USA Today 11/04/98 \"BEFORE FITZGERALD\"","author":"By Charles Preston","date":"1998-11-04","grid":"QVNJRE8jI0xJTCNKQVBFClJFQ0FQI1NPUkUjT1hFTgpDUkVURSNBTE9UI1dFTkQKI0ZSQU5LTEFOR0VMTEEjCiMjIyNNT00jV09XIyMjIwojUVVFRU5JU0FCRUxMQSMKUEFTU0UjI1RSWSNBSU5UCkFURVNUI0ZFRSNFQkJFRApEQU5BI1RBRSMjQkVFUlMKI1JPWUNBTVBBTkVMTEEjCiMjIyNDUk8jTU9OIyMjIwojQkVBQ0hVTUJSRUxMQSMKTUFOWCNFU0VMI1pBSVJFCkVNSUwjRUxCRSNFTlRFUgpMQURFI0xZRSMjUkVFU0U="},{"title":"USA Today 11/05/98 \"MANUAL DEXTERITY\"","author":"By Charles Preston","date":"1998-11-05","grid":"UkFXRVIjU0hBTkUjUkNBCkFERUxFI1RBTklBI0VIUwpQQUxNU1BSSU5HUyNHQVMKIyNMT0NJI1JFSEVBUlNFCkFQVCNBTEwjIyMjQkVUUwpNT08jTkVBUiNTUElURVMKWU9EQSMjREVGSUVEIyMjCiNST0xMSUVGSU5HRVJTIwojIyNMRVJORVIjI1NFQVMKSkFHVUFSI1JTVlAjRElQCk9WSUQjIyMjVElBI0ZMWQpTQVZFRkFDRSNWSU9MIyMKRVRFI0xFQVJORURIQU5EClBBTiNBUlRJRSNVTkdFUgpIUlMjUE9TRUQjUE9TVFM="},{"title":"USA Today 11/06/98 \"HISTORIC\"","author":"By Charles Preston","date":"1998-11-06","grid":"U0VSQUMjQkFORyNORVdTCkFNSVNII0VUQUwjQUxPVApESUNUQSNMSU1BI1RJUkUKRVRIQU5BTExFTiNIT1NFCiMjIyNHTkFUI0NSQVRFUgpTTkFSRUQjI01FQU4jIyMKVEFYSSNZQUxFI0dIT1NUCkVESUNUI1BJRSNFQUdMRQpQQVNIQSNFTEtTI0xFQU4KIyMjQVJJRCMjQ1JFRVBTCkFTSFJBTSNZRUFIIyMjIwpTSEVEI1BBVUxSRVZFUkUKVEFMTCNBTktBI1NBTE9OCkVQRUUjTE9PVCNVTklPTgpSRU5FI0FOTkUjU0VBVFM="},{"title":"USA Today 11/09/98 \"PROPER BEASTIES\"","author":"By Charles Preston","date":"1998-11-09","grid":"TE9VUEUjVU1BIyMjTEFECkVEU0VMI1BBTE0jREFSRQpCRUFSRCNFTEVDI09VVEEKIyMjSkVOTklGRVJXUkVOCkFTU1VSRUQjI05PU0FMRQpDSEFSTEVTSE9SU0UjIyMKUklMRVkjI0FET1MjRERTCklOVCMjQlJJREUjI1lFVwpERVkjTEVBRiMjSU5BTkUKIyMjS0FUSEFSSU5FRElEClNBVk9VUiMjRU5NQVNTRQpUSEVPRE9SRUJFQVIjIyMKUkFOSyNUQUNPI1RFU0xBCk9OVVMjSElITyNFU1NBWQpNRFMjIyNMT1QjU1RFUk4="},{"title":"USA Today 11/10/98 \"ON THE RISE\"","author":"By Charles Preston","date":"1998-11-10","grid":"UElUQSNBQkJFI1JBWkVTCk9ERVMjTEVPViNFTUlMWQpQTEFUI0dFTkUjQ1VURVIKI0VMRVZBVE9STVVTSUMjCiMjI1JFRUwjI0FSRSMjIwpERUNPUiNFR0FEUyNQQUwKQU5PSU5UI0FCRSNTSVNJCkxBRERFUk9GU1VDQ0VTUwpBQ0VTI09BRiNQQVJDRUwKSVRTI01VVEVEI1BFRVRFCiMjI0JVRyMjRUlSRSMjIwojRkxJR0hUT0ZGQU5DWSMKQUxPTkcjQUxBTiNJUkFTCkRJUkdFI01FTU8jTk9MTwpTVEVFUiNQT0VUI0dXRU4="},{"title":"USA Today 11/11/98 \"MOVIE NIGHTS\"","author":"By Charles Preston","date":"1998-11-11","grid":"UElQQUwjQ0hBUCNNQVNDCk9OSUNFI0hPU0UjQUxMQQpPRlRIRUxJVklOR0RFQUQKUk9TRSNBTEVGI1JBTkdFCiMjIyNTSUxMI1RBTUVTVApORUVTT04jI1VIRiMjIyMKQU5EVEhFQ0lUWSNDT01CCk1JTkVPI0FSQSNDT0xPUgpFREFNI0FUVEhFT1BFUkEKIyMjI1NSTyMjRFJBR09OCkxBUERPRyNNQUlOIyMjIwpFTUFJTCNEQVJUI0dFTVMKTUFSRU9ORUxNU1RSRUVUCkFESVQjQVJMTyNXSUxNQQpUT1NTI0JSRVIjQU5TT04="},{"title":"USA Today 11/12/98 \"B-HIVE\"","author":"By Charles Preston","date":"1998-11-12","grid":"TEVBSyNTV0FQI01PRkZPCkFYTEUjUE9SRSNBTUVFUgpNRVRFI0VSQVQjUkFaRUQKQlJFTkRBTkJFSEFOIyMjClNUUkVBSyMjUkVCI0FHRQojIyNEVUVUUyNST09URVIKQVRNI0JSRVRUQlVUTEVSCk1FQUwjI0xBUiMjQ0FORQpCUllBTkJFUkFSRCNTQUQKRVJBU0VSI1NQT1JUIyMjClJFTiNHRVQjI0JBUkVTVAojIyNCQVJCQVJBQk9YRVIKUVVJRVQjQUdBUiNKSVZFCkVTVEVFI1JFTkQjQUxFRQpET09SUyNTRVRTI05FUkQ="},{"title":"USA Today 11/13/98 \"COMICAL\"","author":"By Charles Preston","date":"1998-11-13","grid":"T1JFUyNCUkVXUyNFVEFTCkZBTEEjTEFWSUUjVE9STwpGSUxNI0FORU5UI0NSSUIKI0xBVUdISU5HSFlFTkEjCiMjI0VOUyMjI1NFVCMjIwpTQ0FMQSNGRUIjU0VQQUwKQVJDI1NQSVJJVCNST1VFCkxBVUdIQ0xPV05MQVVHSApFVFRVI1NFREFURSNOSUEKTUVFVFMjREVZI0FMREVSCiMjI1RBVyMjI1VTTyMjIwojTEFVR0hJTkdTVE9DSyMKVE9VUiNBRE9SRSNNUkVECkFHUkEjUk9HRVIjRVVSTwpNRUFMI0ZMT1dTI0RFTlQ="},{"title":"USA Today 11/16/98 \"HEAD START\"","author":"By Charles Preston","date":"1998-11-16","grid":"QUNUI1NMVUlORyNBTUVOClNSSSNDT1JORUEjUklERQpIRUFESFVOVEVSI0tOSVQKRUVSSUUjU09SVFMjSVRTClNQQVNNUyMjI0VLRVMjIwojIyNIRUFEU0hSSU5LRVIKUkFNI1NUUklBI1NOSURFCkFMT1UjRUFUVVAjQVJFUwpTRU5OQSNNQU5JQyNUTlQKSEVBRFFVQVJURVJTIyMjCiMjU09VUCMjI1JBVFRMRQpCQVQjQVNUSEUjRklSRUQKT1JFTCNIRUFEU1RST05HCk5FUk8jT1RJT1NFI1ZJRQpEQVlTI1RFUk1FRCNFTkQ="},{"title":"USA Today 11/17/98 \"ULTIMATELY\"","author":"By Charles Preston","date":"1998-11-17","grid":"U1RPV1MjU1RBQiNPTkVTCkxJVEhFI1BVUlIjUEFDVApBVFRJQyNJUk1BI0VUUkUKVEhFTEFTVEJPWVNDT1VUClNFUkVORSNPUkVMIyMjIwojIyMjVEVEIyNERUZBTUUKU1RZRSNEQU1QI0VBR0VSClRIRUxBU1RCRVNUWUVBUgpFUkFTRSNFQVNUI1NFVFMKUFVSRVNUIyNURUUjIyMjCiMjIyNPUkVTI0VMSUNJVApMQVNUUElDVFVSRVNIT1cKQUJMRSNQTE9UI0NMT05FCk5FVVQjTEFLRSNUQUxJQQpFVFRFI0VURVMjU01PQ0s="},{"title":"USA Today 11/18/98 \"NAME GAME\"","author":"By Charles Preston","date":"1998-11-18","grid":"U0FORCNBTFRBIyNTVEVSClRSRUUjU09PTiNDSEFSTwpBTE1BI1BPUkUjSEFMTFMKR09PRFRJTUVDSEFSTEVZCiMjI0JBUlMjRE9TRSMjIwpTRVJFTkUjRk9PVFNURVAKRUxJQVMjI0FURUUjSURBCkxJTlQjUEFMRVkjREFXTgpMT1MjU09JTCMjTUVSSVQKU1RFRUxFUlMjVElUQU5TCiMjI0xBU0gjU0VSRSMjIwpKT0hOTllPTlRIRVNQT1QKQUhPT1QjTE9SRSNUQUxFCkJJRVJTI0VSSUUjRUxMQQpTT0RBIyNTQVBTI0RFQVI="},{"title":"USA Today 11/19/98 \"BIRDS ON ICE\"","author":"By Charles Preston","date":"1998-11-19","grid":"VU1QUyNFTFNFI0FTUElDClJJT1QjUEFBUiNTSEFOQQpERVRST0lUUkVEV0lOR1MKVU5TQUxURUQjUkFOR0VTCiMjI0lET0wjVElOVCMjIwpDT05OU01ZVEhFI09TTE8KQVZJQVRFI0hJU1MjV0FOCkpVU1RFI1JBTiNPTUFOSQpVTEUjUkFJTiNPQkFORE8KTkVJTCNNSUtFVkVSTk9OCiMjI0FNRVMjTUVSQyMjIwpGTE9SSU4jQUlSTE9DS1MKTE9SRFNUQU5MRVlTQ1VQCkFHTkVTI1NPWUEjRUlSRQpXRUVEWSNJTlNUI1NJVEU="},{"title":"USA Today 11/20/98 \"ODD DUETS\"","author":"By Charles Preston","date":"1998-11-20","grid":"QUJIT1IjTUJBUyNFUk1BCkNMSVZFI1lBTEUjTUhPUwpBQUhFRCNCUklUI0JJTEsKVEhPUk5FQU5ESE9STkUjCiMjI0NPQkIjIyNSWUUjIwojQ1JPU0JZQU5EQ09TQlkKSkFJTUUjI0FVUkEjVE9FCk9STkUjQ09STlkjQ09PTgpTVEcjQk9OTyMjQ0FOVFMKSEFMTEVZQU5ESEFMRVkjCiMjRUFSIyMjRUFSTCMjIwojSEFZTUVTQU5ESEFZRVMKVE9ETyNORVhUI09CRUxJCkFMRUYjREFMRSNQTEFJVApDRVJGI1NMRUQjU0VOU0U="},{"title":"USA Today 11/23/98 \"UN-LIKELY\"","author":"By Charles Preston","date":"1998-11-23","grid":"U0VUUyNTT1JFI0hPVU5ECkFMT1QjUExFQSNBUk5JRQpCQVJSI1JJQlMjRE9XTlMKVU5NSVRJR0FURUQjUk9JCiNERVZPVE8jI0xJSUkjIwojIyNFVEUjRElWRVJURUQKTUVVU0UjR0lWRSNFVE5BCkVSTiNNQVJORVJTI0VJTgpBTEZBI1JBR1MjV0FOREEKTEVPTkFSRE8jTUFXIyMjCiMjVVNNQSMjVEFNRVNUIwpIQU4jVU5WQVJOSVNIRUQKQU5ERVMjRUxJQSNPT05BClNURVJFI0RJTkcjTUFTVApIQURFUyNBVEVFI0VMRUU="},{"title":"USA Today 11/24/98 \"RISKY BUSINESS\"","author":"By Charles Preston","date":"1998-11-24","grid":"VFVCQSNNT0xBUiNQUklNCk9SQUwjQVdBUkUjRUFWRQpUQUtJTkdOT0NIQU5DRVMKT0xFI1VORVMjRVhDRVNTCiMjI1NDVUQjQkFMRSMjIwpSRUZJTE0jU09SRSNDUFQKQUxJTkUjQVBPUyNBTEVFCkhFREdJTkdPTkVTQkVUUwpBVkVTI09HUkUjUExBSVQKQkVMI1NOSVQjUExFTlRZCiMjI0NBU0UjU09BUiMjIwpBU0hPUkUjQU5UUyNESUcKUExBWUlOR1dJVEhGSVJFClNJUkUjU1VFREUjSUNPTgpFTUlSI0VOREVEI0JFTlQ="},{"title":"USA Today 11/25/98 \"FEAST\"","author":"By Charles Preston","date":"1998-11-25","grid":"I0FDRVMjQUdFTkEjU0FQClNDQUxQI05PRFVTI1RCQQpDQU5ESUVEWUFNUyNVTEEKQVJJI0RSRUFNI0lORkVSCkxJTkdFUlMjI0FTSUYjIwpFREdBUiMjTVVTSUNJQU4KIyMjT1lTVEVSUyMjTk5FCkxJTU4jRVlESUUjRUdBRApVTkkjI0NSRVNURUQjIyMKTUFOREFURVMjI1JFQ0FQCiMjQ09HUyMjRU1BTkFURQpQSUVUQSNGQVRFUyNUSFAKRVNQI1JPQVNUVFVSS0VZCkFMSSNJTlVTRSNSVUlOUwpTRUUjQ0VOVFMjRVROQSM="},{"title":"USA Today 11/27/98 \"NEXT TO NOTHING\"","author":"By Charles Preston","date":"1998-11-27","grid":"VVNJTkcjQkFMRSNGQUxBClNFTk9SI09CT0wjQU1PUwpQQVJUSUNMRU9GVFJVVEgKT1JFI01FRVQjI0hPUlNZCiMjI0FTT1IjQUxFRiMjIwpDUlVNQlNPRkNPTUZPUlQKSEFSUFkjI1JJUEUjWk9FCkFSRVMjU1BPREUjRkFVTgpSRUQjV0FJVCMjQkFSR0UKRFJPUElOVEhFQlVDS0VUCiMjI0FORFkjTEFJVCMjIwpPU0FHRSMjVEVMTCNJQU4KU0hSRURPRkVWSURFTkNFClNPQVIjTE9SRSNVUkdFUwpBV05TI0RFTlMjUFJFU1M="},{"title":"USA Today 11/30/98 \"FRANKLY SPEAKING\"","author":"By Charles Preston","date":"1998-11-30","grid":"V0FTUCNNQUNBVyNBUk5PCk9WRVIjSU5BTkUjUVVBWQpMRU5PI1NUQU5MQVVSR