{"id":"newsday-2000","publication":"newsday","year":"2000","count":365,"puzzles":[{"title":"1/2/00 THE AMERICAN RESOLUTION: One of them may be yours","author":"by Lee Weaver, edited by Stanley Newman","date":"2000-01-02","grid":"QklCQiNERU1JI1NUQUIjT1JBQ0xFCkFDUk8jSVJBTiNBUkVBI1BJTExBUgpKT0lOQU5BUlRDTEFTUyNJTlRFUk4KQU5PREUjU1RPUFNNT0tJTkcjQUdFCiMjI1NTQSMjI0xBUFAjRkVMSU5FUwpURFMjI0xPT1RTIyMjTEFSRURPIyMKSVJBI0JMVVNII1JFUE8jI1RPVVRTCkJPWSNFQVRNT1JFRlJVSVQjI1RPRQpFVklMTFkjT1JOQVRFI0RSQVNUSUMKUkVMRUFTRVMjQVBTRSNFQVJUSExZCiMjT05UI1JFRCMjI05CQSNSVUUjIwpSSVZJRVJBI0VSUlMjQUxNQU5BQ1MKQUdFTkRBUyNMRUFOT04jSU5TVEVQCkhFWSMjQkVHSU5KT0dHSU5HI1RBSQpTVE9JQyMjVVNEQSNMRURHRSNJU1QKIyNVTkhVUlQjIyNNRURBTCMjQ0VFClBST1RFR0UjQ0VSRSMjI0VTUCMjIwpBRUYjV0FUQ0hMRVNTVFYjU0xBVEUKUkVUQUlOI0xPU0VTT01FV0VJR0hUCkVWRU5FRCNBUklEI0JBVEUjRVJBVApTRU5PUkEjREVFUyNTTk9CI0RBTkE="},{"title":"1/3/00 GLACIAL LITTER","author":"by Bob Lubbers, edited by Stanley Newman","date":"2000-01-03","grid":"TUFSI1BFVEFMI0RBVklECklUTyNBUkVOQSNFQ09MRQpMT0MjU0FORENBU1RMRVMKQU5LQVMjI1NFUkUjIyMjCk5FQVJFU1QjU1RST0JFIwojI05FUkVJRCNTVFJFQU0KTFREI1NBTUFSI1NFVFRPCkVBUlMjVE9ZRUQjU1RFTQpTUE9PUiNST0JFRCNZUlMKVEVMTEVSI0ZPTElBUiMjCiNTTE9XRVIjUElDS1VQUwojIyMjQUxBUyMjS0FCVUwKQ0hFUlJZU1RPTkUjQlJBClJBVEVEI1BFUk9OI0xFVApPUEVEUyNTVEFUUyNFRUU="},{"title":"1/4/00 SHADES OF MEANING","author":"by Fred Piscop, edited by Stanley Newman","date":"2000-01-04","grid":"U1RBTEtTI0FQU08jQ0hBCkFSQ0FORSNMT0VXI1JFTgpDQVJESU5BTFNJTiNJTlQKIyMjREVTSVNUUyNJTVNPCkZPUkVWRVIjRU1FUlNPTgpBRE9SRSNPQVIjUk9PTkUKU0lTI0xBVUQjTUFOTiMjClRFRUQjU1RBVEUjU1RPUAojI0tJUksjR09HTyNJREEKSVJFTkUjU0VOI05BREVSCkRJTkdCQVQjU0VFUkVTUwpDT05ZI01BR0lMTEEjIyMKQVRFI0NPUkFMR0FCTEVTClJFRCNPUkVTI0FOSU9OUwpEUlkjUEVSUCNSRUFDVFM="},{"title":"1/5/00 SHE-DUNIT!","author":"by William A. Hendricks, edited by Stanley Newman","date":"2000-01-05","grid":"VEFVVCNCRUFMTCNTUElUCklUQ0gjQVRSSUEjVEVOTwpNSUxFI1NISUVSI01BTUUKI0NBR05FWUFORExBQ0VZCiMjI0hVUkwjIyNJUkVORQpST0JPVCMjRUFSTFkjIyMKSVJBUyNSRURTRUEjWkFQClBBUlRORVJTSU5DUklNRQpFTEsjSVNMRUZUI0VHT04KIyMjQkVURUwjI0NBU0tTCkFUVElDIyMjTEFVRCMjIwpNVVJERVJTSEVXUk9URSMKQU5BUyNBTEFNTyNWSVZBClNJTE8jR0FUT1IjRURFTgpTQ0FOI0VNRU5EI1JFTFk="},{"title":"1/6/00 GIFTS OF LOVE","author":"by Rich Norris, edited by Stanley Newman","date":"2000-01-06","grid":"Q09CQiNWQUxPUiNSQUZUCk9UT0UjQU5JVEEjVVBPTgpCT1dMSU5HUElOI0JSVVQKUk9NQU5DRSNTVE9MRU4jCkFMRSNURVJNIyNQRVNUUwpTRU5TRSNTSVpFUyNTQU8KIyMjTlJBI05FQSNTS0lOCiNNT1VOVEFJTkNIQUlOIwpGQU5HI0FSQyNIT0cjIyMKQUdFI0lERUFMI1RFU1RTCkRBVEVEIyNNSUxEI0hFRQojWk9ESUFDI0JPT0tFTkQKUklPUyNCT1hJTkdSSU5HCkFOTkUjRUxJREUjSUxJRQpIRUVMI1NBVk9SI1NBU1M="},{"title":"1/7/00 CLEAN HUMOR","author":"by Patrick Jordan, edited by Stanley Newman","date":"2000-01-07","grid":"REFLQVIjSEFMRSNFTU1BCkVMSVRFI09CRVkjR09BTApCQUVSUyNPQk9FI0FOVEUKI0lWRUlOVkVOVEVEVEhFCiMjI0VTVEUjI0VMU0UjIwpCRVQjVEhSSVZFUyNHQU0KVVNBR0UjI01BVCNST05BClNRVUFSRUJBVEhUVUJJVApCVU5TI1NBRyMjQUJBVEUKWUVUI0FUSEVJU00jWUFZCiMjSVNMRSMjUkVBTCMjIwpXT05UTEVBVkVBUklORyMKRURHRSNNSUVOI0lOQU5FCkxJTFQjRURJRSNORVBBTApLRVlTI0RBTlMjRFJBV0w="},{"title":"1/8/00 SATURDAY STUMPER","author":"by Ed Julius, edited by Stanley Newman","date":"2000-01-08","grid":"TUFUQSNBUEVBUiNIQVJJCk9QQUwjTk9UTUUjT1RUTwpWRVJCI1RSVU1QI0JJRU4KRVhQRURJVElPVVNORVNTCiMjI1JFRyMjI0xFTyMjIwpSRVNUU1VQI0FTQUJFQVIKRVhISUxBUkFURSNTQUxBCkJFQSMjI09SUiMjI1RJQwpVUk5TI0VYQ0lUQVRJVkUKU1RFRVBMWSNBUkxFTkVTCiMjI1ZBTCMjI0lEQSMjIwpFWFBFUklNRU5UQVRJT04KQU1BTiNQQVJFRSNJU0xFClNBTFQjU0lTQUwjTUFJUwpFU1BZI0VOVFJZI0VOT1M="},{"title":"1/9/00 LOST IN THE WOODS: Can you find them?","author":"by Roger Coburn, edited by Stanley Newman","date":"2000-01-09","grid":"SU5ESUEjU1BBUlMjU0lUUyNGTEFQCkZPVU5UI1RBTElBI0FERU4jTElMSQpGTEFTSEdPUkRPTiNTRU1JI0FNSUUKWU9EI1dBTExFVFMjSEFQUElORVNTCiMjI0RBTUlFTiMjUEFMRVNUIyMjIwpTUEVBUkVEIyNPQkVZIyMjQVRMQVMKVEhBTlQjI01PREVMI1BPT0xIQUxMClJPVEMjQUNDUkVURSNFTUYjRU5UTwpJTkVFI1JPQVNUUyNBVElUI0xBT1MKUEVORElORyNJVFkjVkVUI0FNSVNICiMjI0FETyNTTkFQUEVSI0NJQSMjIwpUU0FSUyNVTk8jQVJSI0NBUlJPVFMKT1RSTyNBU0lTI0xPVFRPUyNJUk9OCk5BTlUjTEVUI0FNUEVSRVMjVElSRQpHUklOREVSUyNWRVJESSMjU1RPTUEKU0VFRFkjIyNUT1JFIyNQUkVFTkVECiMjIyNFQVNUT04jI0NBUkVFUiMjIwpJTkZJUk1BUlkjQ09VU0lOUyNBTEwKQkFSTiNBTEFEI0FOTklFT0FLTEVZCklOT04jU09MTyNBVEVBUiNXSURFUgpTQUdTI1NOQUcjTk9PTlMjU1RPUkU="},{"title":"1/10/00 GIRL TALK","author":"by Bob Lubbers, edited by Stanley Newman","date":"2000-01-10","grid":"Qk9ORyNSQVJBI0lDS0VTCkFST08jRU5JRCNBTElTVApIT0xMWVdPT0QjTU9UVE8KIyMjREVBRFNFQSNTVEVQCkdBTU1BUyMjUkVERVlFUwpBTU9JI0hBTSNST1RDIyMKTUlMTkUjQkFST04jT0FUCkVMTEVSI0JSTyNOVVJTRQpSRVkjQVZBSUwjQU5OQVMKIyNDQVNFI05FRCNERU5UClNOT1JFUlMjI09QRVJBUwpXQURJI0JFTkFUQVIjIyMKQURERUQjUEFUVFlDQUtFCk1JTExFI0FOVEUjVVNFUwpQUkVTUyNMQVVEI1RBR1M="},{"title":"1/11/00 OXYMORONS","author":"by Norma Steinberg, edited by Stanley Newman","date":"2000-01-11","grid":"SkFORSNBQlVHI1BBU1NFCklST04jWk9ORSNBTElDRQpCRUVGI1RPVE8jVE9UQUwKI0FMT05FVE9HRVRIRVIjCiMjI1JJQ0gjI1RJQSMjIwojU0VDVFMjRFVIIyNQQUMKQkVSRVQjQ09NRSNIT0JPClRFUlJJQkxZUExFQVNFRApVVEVTI09JTFMjTUlTVFkKU09EIyNBUEUjRkFSRVMjCiMjI0FGUiMjU0xJUCMjIwojUkVTSURFTlRBTElFTiMKREVWSUwjTE9PSyNFWEFNCk9ORUFMI01PUkUjQ0lURQpET05OWSNTS1lTI0VUT04="},{"title":"1/12/00 FOR CRYING OUT LOUD","author":"by Fred Piscop, edited by Stanley Newman","date":"2000-01-12","grid":"QlJBR0EjR1JPVyNNQVNTCk9JTEVSI1JJUEUjRVJJSwpPQ09NRSNBTEVTI1dJTkUKVEhFU05JVkVMUyNMQUNFCiMjIyNBTlkjI09VVFNFVApCUk9XU0UjQVNORVIjIyMKTEFUSCNQT05FI1lBTFRBCkFTVEkjVElOTlkjSU9VUwpTSE9ORSNOSVRBI05VTlMKIyMjRVZPS0UjSEFTVEVOCkdBQkxFUiMjR09UIyMjIwpMSUxJI0lORE9PUlBVTEUKQURFUyNHT09GI0VBU0VECkNBTlQjSU5SRSNTTkVBRApFTkRTI05FQVIjVEVSUlk="},{"title":"1/13/00 POP COUNTDOWN","author":"by Patrick Jordan, edited by Stanley Newman","date":"2000-01-13","grid":"U1BBUiNQUkFNI1NPRkFSCkhBTEUjTE9TRSNJUkFURQpBTE9UI0FUVEEjQ0FMRUIKTklORUlOQ0hOQUlMUyMjCkFOR0xPUyNFVEFMI0VHTwojIyNMT1RUIyNSSUNIRVIKQ09EI0ZPVVJTRUFTT05TCkFNSVMjI1JFTiMjVE9STwpKQUNLU09ORklWRSNERU4KVU5USUVEIyNQRUFLIyMjCk5JQSNSSVRBI0dSRUVUUwojI1RIUkVFRE9HTklHSFQKQVJPTUEjTk9XSSNUUkVFClBFUk9UI0FCTEUjSEVSRQpUQVNTRSNNRVNTI1NURVA="},{"title":"1/14/00 LONG SHOTS","author":"by Thomas W. Schier, edited by Stanley Newman","date":"2000-01-14","grid":"IyNERU1PIyNTRUNVUkUjCiNUUlVFVVAjUExBVEVOIwpTQU9SU1RBVEVJUkVBTk4KTElQI0hPVEhFQUQjTE9PCkFQSU4jRkVFRFMjREVCVApWRU5PTSNEUlMjVEVTTEEKU0lUVEVFI01VU0VUVEUjCiMjSEVURVJPUFRFUkEjIwojU0VWRU5BTSNPUkFUT1IKRkFCRVIjR0VUI1NDRU5FCklSVU4jRlNUT1AjVEFDUwpBU0MjSEVIRUFSRCNHRUUKVEFLRUlUT1JMRUFWRUlUCiNSRVdSQVAjTEVNT05TIwojU1RFRUxTIyNORVhUIyM="},{"title":"1/15/00 SATURDAY STUMPER","author":"by Daniel R. Stark, edited by Stanley Newman","date":"2000-01-15","grid":"Q0FNRVJBIyMjQVVCVVJOCkFNVVNJTkcjUEVUVU5JQQpMQVNBR05BI0FOQUxZU1QKTFBTI0dFTlRMRSNMT1NUClNPSUxTI0dBTEFTI0tPSQpVTE5BI0VTUCNTRU1FTEUKUEFHSU5BVEVTI1JJREVSCiMjI0NPUkUjVVJJUyMjIwpOSVBBUyNSRVNFTlRGVUwKRUNPTEVTI1ZBTiNFUk5FClBFVSNTQUdBTiNBREVMQQpUQVJFI0xJTk5FVCNESU4KVVhPUklBTCNBUklBRE5FCk5FVVRSQUwjSElMTElFUgpFU1RFRU0jIyNTVEVFRFM="},{"title":"1/16/00 BOND VOYAGE: With 008 appropriate answers","author":"by Bob Lubbers, edited by Stanley Newman","date":"2000-01-16","grid":"R0FTU0VSI1NUQVJJTiNST0FOT0tFCk9ORUlEQSNURU5BQ0UjSUdOT1JFRApMSVZFQU5ETEVURElFI0ZMRU1JTkcKQU1FTiMjUk9TRVMjREFMRSMjRU5FClNBUkFMRUUjIyMjRElSRSNEQUxZUwpUU0UjRVJBVE8jRFVFUyNCVUIjIyMKIyMjRElBTU9ORFNBUkVGT1JFVkVSCkxPUEUjI1NURVJPTCNORUdBVElWRQpFWEFDVEEjRVNTI0lUQUwjIyNWRUUKTU9OQVJDSCMjI1NUSUxMI1NUQU5ECiMjI0ZPUllPVVJFWUVTT05MWSMjIwpBVEVTVCNBTVZFVCMjI1dFQVJJRVMKU09OIyMjRElBUyNEQU4jRVZPTFZFCk9VVFNJREVTI1RPRUNBUCMjTkVBUgpGUk9NUlVTU0lBV0lUSExPVkUjIyMKIyMjRU9OI0lMSUUjU0FVREkjQlNBCkVNREVOI0pPSU4jIyMjUkVQT1JUUwpMT08jI0JBTkUjVE9TQ0EjI1JJQVMKQ09OTkVSWSNTUFlXSE9MT1ZFRE1FCklSQU5JQU4jQ0VSRUFMI0RJTExFUgpERVRFTlRFI1VQRU5EUyNBU1NFTlQ="},{"title":"1/17/00 BEACH PARTY","author":"by Lee Weaver, edited by Stanley Newman","date":"2000-01-17","grid":"UEFTVEEjSEVSIyNTRUFTCkFDSEVEI0VSSU4jRUxTRQpDUkVBTSNBTkRJI0RJS0UKVEVMI0lOREVFUFdBVEVSCiMjTFVSRVMjI1BJTkVEIwpSVVNTRVQjR0xFTlMjIyMKQUxPRSNTVFJJREUjU09CCklOVVJFI1JBTiNTVEFHRQpOQVQjRE9VQlRTI0tORUUKIyMjRElORVMjRVJPREVTCiNTS0FURSMjR1JBU1AjIwpTVU5TSElORUxBVyNBQUgKQU1BSCNEQUxJI0VNUFRZClJBVkUjQVNBTiNTUEVFRApBQ0VTIyNBTFQjVEhSRUU="},{"title":"1/18/00 MEN AND BEASTS","author":"by Bob Lubbers, edited by Stanley Newman","date":"2000-01-18","grid":"QkFTSCNCRVRURSNQRkZUCk9CT0UjQUxJRU4jTElSRQpCRUFSQlJZQU5UI0VMRUUKU1RSQUlOUyNEUkVBTUVECiMjI0xBUyNQRUVSUyMjIwpMRU5EUyNUQVIjUlVCRVMKSVZFIyNBRVIjU09SRUxZCk1FQURPV0xBUktMRU1PTgpFTlRJUkUjREFZIyNBUE8KU1RPT0QjTUVHI1BPU0VECiMjI1JFR0lTI0FMUCMjIwpTSEVBUkVSI1BFT1BMRVMKVEVBTSNUSUdFUldPT0RTClVSU0EjTUFPUkkjU0xJVApCT1lTI0VNT1RFI0VBVFM="},{"title":"1/19/00 SHTICK FIGURES","author":"by Patrick Jordan, edited by Stanley Newman","date":"2000-01-19","grid":"VEhVTVAjWUFSRCNHVVNIClJBVElPI0lTRUUjSUdPUgpFTElPVCNQSUVGSUdIVFMKRUVMI0FTUCNMRU5PIyMjCkRSRVNTSUVSI0FSTEVORQojIyNUSFJFRVNUT09HRVMKI0xBWSMjI1ZJU0EjR0VUClNBQkVSI1RBWCNESU9ERQpPUEEjSUNCTSMjI0FOWSMKRkFDRVNMQVBQSU5HIyMjCkFaQUxFQSNTQVZJT1VSUwojIyNBVE5PI05ZRSNORVQKRVlFUE9LSU5HI0NFREFSCkxVR1MjRUxJRSNFTFVERQpGTE9FI0RZQUQjU0xFRVA="},{"title":"1/20/00 THE INSIDE DOPE","author":"by Fred Piscop, edited by Stanley Newman","date":"2000-01-20","grid":"RlJBQ0FTI1RPQUQjQVJQCklOTE9WRSNPRElFI1ZFRQpCQUxMQURPUEVSQSNPUEUKIyMjI0xBTkUjI1JJQ0VSClJFV1JPVEUjUkFTQ0FMUwpFTEFJTkUjQ09QSUVEIyMKRUxMQSNEQVVCRVIjT0REClNJRExFI1VURSNTVVBFUgpFU08jQ0FSRVNTI1JFTk8KIyNQSUxMQVIjTEVHQVRPClNQRUNJRVMjSE9WRVJFRApQT1BVUCMjV0FXQSMjIyMKQUxQI1NURUFNRURPUEVOClJBRSNFQVJMI1NFTEVOQQpFUlIjREVBTCNUUkVORFk="},{"title":"1/21/00 OVER YOUR HEAD","author":"by A.J. Santora, edited by Stanley Newman","date":"2000-01-21","grid":"QU1QUyNDUEFTI0FGTE9XClNPTEUjU0FMRSNUUk9USApBTkFMRVBUSUMjVEVTVFkKUEFOQU1BSEFUVElFIyMjCklDRSNFTkUjT1JDSEFSRApOT1NJUiNUQVJFIyNST1kKIyMjTklQSU4jQVRFQVNFCiNLRU5UVUNLWURFUkJZIwpNRU1PSVIjTEFTU08jIyMKQVJJIyNJREVNI1RPUkNICklOVEVSTkUjTU9CI0FSQQojIyNCRUFOSUVCQUJJRVMKQUJBQkEjVE9ST05BRE9TCkNFREVEI0FURUUjRkVMTApURUREWSNMQURTI0ZSRUU="},{"title":"1/22/00 SATURDAY STUMPER","author":"by Arthur Schulman, edited by Stanley Newman","date":"2000-01-22","grid":"U1BSQVlFRCNTVEpBTUVTClpISVZBR08jQ0hPUkFMRQpFSURPTE9OI1JFV0lSRUQKQ0xPTkUjT1BBI0xBUlZBCkhJVCNTRVJBUEgjU0VFSwpVUFRPI0pBU1BFUiNETkEKQVBPR0VFI0hFTE9UIyMjCk5JU1JPQ0gjRElTQVJNUwojIyNFTlRFUiNDQVJIT1AKQkdTI1NFUkFQRSNQRURFClJVVFMjREVWSVNFI1RFQwpBUkVOQSNTSU4jU1RPUksKTktSVU1BSCNOQVRVUkFMCkNISUNBR08jRUJPTklURQpIQUNLU0FXI1JFUEFDRUQ="},{"title":"1/23/00 SCORE BOARD: Not exactly a sports theme","author":"by Fred Piscop, edited by Stanley Newman","date":"2000-01-23","grid":"V0FMVCNTTkVBRCNTQ0FOVCNESUdTCk9ISU8jTklFQ0UjQVJST1cjT1JBTApST01BTkFDTEVGI1JBTlNPTU5PVEUKRVlFU09SRSMjQVJUSUUjVEFOTkVECiMjI1RFTCNSRVRVUk4jU0lORSMjIwpIT1RFTCNTQU5URUUjSlBNT1JHQU4KT01BUiNDSElERUQjQkFSRVIjSVJBCllFUCNQT09MRUQjQVJDRUQjQVZJVgpBR0UjSE9BUkQjU05BS0UjTUVFU0UKU0FNI0FMVE8jU1RBR0UjTUFSSUVMCiMjRVNTRSNBVEhFSVNUI0FMT1QjIwpTVEFURVIjRE9SSVMjQVJJRCNBTUkKTEFTRVIjT0ZURU4jU05JREUjUkFECkFCVVQjUEFMRUQjTUFEREVOI0VUQQpOT1IjQ0VTQVIjTUFSVEVOI0FTQ0gKR09FU0FUSVQjQ09OQUlSI09SVEhPCiMjI0FQRVMjVFVMQU5FI01SVCMjIwpUSEFMRVIjTE9QRVMjI1NBR0lOQVcKUkFaT1JTSEFSUCNTTUFMTFNDQUxFCkFMVU0jT0JPVEUjQUlNRUUjTElBUgpQT1JFI05PU0VEI1NMQVdTI0VMU0U="},{"title":"1/24/00 UP, UP AND AWAY","author":"by Lee Weaver, edited by Stanley Newman","date":"2000-01-24","grid":"QVRNI0JFWSMjUkFDSU5HCkRJT0NFU0UjI0FNRUxJQQpPUkRJTkFMIyNHQUxBWFkKQk9VTkRVUFdJVEgjIyMjCkVTU0UjIyNBTkEjUk9NUAojIyMjU1BSSU5HRkVWRVIKQkFHI1RBVVQjI0FCQVRFCkFMSU1FTlQjU0VEQVRFUwpOT01BTiMjU0VSRSNFRFMKSlVNUE9OQk9BUkQjIyMjCk9ERVMjRUFVIyMjU1RBUgojIyMjTEVBUE9GRkFJVEgKR05BV0VEIyNGTEFHREFZCkFFUklBTCMjRklSRUFSTQpTRUVUSEUjI1NURSNMSUU="},{"title":"1/25/00 THE WRITING LIFE","author":"by Rich Norris, edited by Stanley Newman","date":"2000-01-25","grid":"Qk9USCNVU0VEI1RSSVBFCkFUT00jTkFURSNIT0xFUwpUSFJPV1NUSEVCT09LQVQKSEVSU0hFWSNQQVJUQUtFCkVSRSNZQVJEI1JOUyMjIwojIyNBTlQjRUJCUyNURUUKU0NITU8jRkxVRSNKVUxZCkNIQVBURVJBTkRWRVJTRQpBSU1TI0RBWVMjSVJLRUQKTVBTI0NJVEUjQVNLIyMjCiMjI0JPUyNEQVRBI1NNQQpTTEVFUE9OI0NIRUFQRU4KUFVUU0lOQUdPT0RXT1JECkFHUkVFI1BFUk0jT0tJRQpNRUVUUyNTT05FI0xFVFM="},{"title":"1/26/00 IN DEW TIME","author":"by Bob Lubbers, edited by Stanley Newman","date":"2000-01-26","grid":"Rk9PRCMjR1JBQiNTT0ZBCkxBTkVTI0xFU0UjVFNBUgpJVFNBVCNFQVRTI09VUlMKVEhFREFXTlBBVFJPTCMjCiNTVEVWRU5TIyNJTExTIwojIyNORVQjI0NFTFNJVVMKQUdVRSMjU1RFQUwjVkVFClNVTlJJU0VTRVJFTkFERQpJTVAjQ0FURVMjI09ORVIKVFVSRUVOUyMjTkFWIyMjCiNQRVJVIyNDT05URU5EIwojI1NFUFRFTUJFUk1PUk4KQk9TQyNBTERPI0FCQklFCkFCRVQjTElSRSNTRUxFUwpMSURTI0xFU1MjI1JFRFM="},{"title":"1/27/00 RISKY BUSINESS","author":"by Patrick Jordan, edited by Stanley Newman","date":"2000-01-27","grid":"SEVSQiNTS0lEI1NUVURTCk9MRU8jV09SRSNPVU5DRQpSQVBUI0VSSUUjT0xESUUKU1RPQ0tSRVNQT05TRSMjCllFU0hJVkEjI1JFQVJNUwojIyNFVEUjU1RJUiNUQVAKI0xBREUjU0xVRSNTQUtJClNFQ1VSSVRZQkxBTktFVApIVFRQI1ZBTEUjTUFFUyMKQUdPI1dJUlkjT0FLIyMjCk1PTlJPRSMjQUJTRU5DRQojI0JPTkRKQU1FU0JPTkQKRlJFVUQjRVNQWSNJV09OCkJJTEdFI1RBTEUjVEFUQQpJRExFUiNTUEVEI0VZRVM="},{"title":"1/28/00 SPEAKING LITERALLY","author":"by David A. Rosen, edited by Stanley Newman","date":"2000-01-28","grid":"SEFIQVMjVk9MVCNTSUxPCkFHRU5UI0VWRVIjUFJBVApMRVJPSSNSSVRBI0xPTkkKRlJPTUNUT1NISU5JTkdDCiMjI0lLT04jQUxPVCMjIwpDRURFI1JJTEwjV09FQkUKUlBPI01BQ0UjTElGVEVSCklPTkxZSEFWRUlTRk9SVQpTQ0hVU1MjRVNURSNOSVAKUEhPTk8jQVJDSCNJU0FUCiMjI0NSQU4jQUVPTiMjIwpPTlRIRVdHT0xEQlJJQ0sKUE9SRSNBTElBI0VPU0lOCkFHSU8jS0lMVCNBTUlORQpMT09OI0VBU0UjSEVOQ0U="},{"title":"1/29/00 SATURDAY STUMPER","author":"by Manny Nosowsky, edited by Stanley Newman","date":"2000-01-29","grid":"Qk9BUkRHQU1FUyNTT0FQCkVOREVBUk1FTlQjT05UTwpSRUFDVElWQVRFI1NUSVIKQUxQI0FERUxFI0NPT1BUClRBVFUjU1RJTktPI0FURQpFTk9STSNTRVRFWUVTT04KU0VSQklBI1JFVk9MVEVECiMjI0FORFMjU0lUUyMjIwpUT1dOU0lURSNORUlTU0UKU1BFQUtFQVNZI1NFRUVNClVUQSNZVUNDQVMjU05BUApOSUtFUyNDT01FUyNFU0wKQUNFRCNDQVJBVkFHR0lPCk1BTk4jQVRUSEVSRUFEWQpJTFNBI0xPU0FOR0VMRVM="},{"title":"1/30/00 GRAND CENTRAL: A chance to demonstrate your central intelligence","author":"by Merl Reagle, edited by Stanley Newman","date":"2000-01-30","grid":"U0FMRSNBRERTI0FTVEEjU0VRVUlOCkFNQVMjTElFVSNVSE9II1BPVU5DRQpMSVRUTEVEQUIjVFlORSNBTklUQVMKVU5FQVRFTiNUT08jSU1QIyNWRU5UClRFTkRTI09MWU1QSUMjRUdCRVJUIwpPUlNPI0NISVBTSU4jQkFSRVIjIyMKIyMjU1RSQUZFI0FESEVSRVMjTUFDClJFQSNIQVJUUyMjT1VUU0VUI09EQQpFWENMQUlNUyNXQUxTVE9OI1NUQVIKREFUSU5HIyNCSURFU09ORVNUSU1FCkFNSU5PI1BSSVNPTkVSUyNNRU9XUwpHSVZFTUVMSUJFUlRZIyNTRUlORVMKRU5JRCNSQUdMQU5TI0pBUEFORVNFCk5FVCNHT1RISUMjI1NVTUVSI0RUUwpUUlkjRURJVE9SUyNPUkVMU0UjIyMKIyMjT05FTk8jRUNLSEFSVCNVUklTCiNYQU5BRFUjSVNSQUVMSSNBUkVDQQpDQVJUIyNNRUQjT1lMI0NBVkVTSU4KT1hMSUtFI1pFQUwjUExBQ0VLSUNLClBJRU1FTiNSQUlMI01JTkUjQUxMSQpBU1NFTlQjQUxNUyNFVkFTI1NFRU4="},{"title":"1/31/00 MATERIALISM","author":"by Lee Weaver, edited by Stanley Newman","date":"2000-01-31","grid":"Q0FURVIjVE9OUyMjSE9XCkFCT1ZFI09SQUxTI0lSRQpMSU5FTkNMT1NFVCNURUEKRkVJTlRFRCNBRVJBVE9SCiMjI0VBUiMjI1RFQ0gjIwpEQVdETEVTI09ZU1RFUlMKRUdPI1NBTEVNI1NVU0FOCkJJT1MjTElWRUQjUElORQpBTExBSCNNQU5PRiNMRUEKUkVHUkFERSNTTUlSS0VECiMjQUdVQSMjI0FBQSMjIwpJTlRFTkRTI1dJTkRJRVIKT09II0NPVFRPTkNBTkRZClVURSNIRUFWRSNFUk5JRQpTRVIjI1NSQVMjRVNTRVM="},{"title":"2/1/00 YOUR HIT PARADE","author":"by Bob Lubbers, edited by Stanley Newman","date":"2000-02-01","grid":"QVRPUCNTTkFGVSNJUklTClBBUlIjUEFHRVMjTVVTRQpPTElPI0FOSU1BTFBFTFQKU0NPVFNNQU4jI0FJREVTCiMjTkVXIyNHUkFJTiMjIwojQVNNQVJBI0VOREdBTUUKUlVCI1JJQkFMRCNFUk9PCkFERSNNQURFSVJBI0dVTgpNSUxMI1RVUkVFTiNZRVMKUE9UT01BQyNGSU5BTFMjCiMjI0NBU1RFIyNBUkUjIwpTVE9BVCMjUEFSTUVTQU4KVE9PVEhQQVNURSNOT0xBCkFEWkUjQURPUkUjQUNUUwpHT0VTI05PTUFEI1NLQVQ="},{"title":"2/2/00 GUY TALK","author":"by Thomas Fuller, edited by Stanley Newman","date":"2000-02-02","grid":"TUFNQk8jTEFNUCNCT01CCkFMSUVOI09SVEgjT0hJTwpNRUNDQSNEQVZZSk9ORVMKQVNLQSNURVQjU0lNT05TCiMjRUxUT04jS0lMTCMjIwpFVFlNT04jVU5DTEVTQU0KQUVGI01JTE5FI1NUQURFClNUSVIjQ0lERVIjU0xBVApFUk5FUyNDSUxJQSNMR0UKREFOQ1VQSUQjVFJPWUVSCiMjI09OSVQjREVDQUwjIwpTSEFST04jQVVTI0hVTVMKSkFDS0ZST1NUI1JVTlVQCkRJUkUjT0tBWSNIQU5TQQpTTEVEI1RBUFMjT05TRVQ="},{"title":"2/3/00 VERBAL CAUTIONS","author":"by Rich Norris, edited by Stanley Newman","date":"2000-02-03","grid":"U01BUlRTI0dBR1NURVIjCkFGTE9BVCNBQkFMT05FIwpXQVRDSFlPVVJNT1VUSCMKIyMjU09MSUQjI1NUUkVQCkRBTSNFRUwjQVNII0VBVQpPUkVMIyNTQUxUI0tFVFQKWkFOSUVSI1NQUkVFIyMjCiNCVVRUT05ZT1VSTElQIwojIyNIQU1FTCNUQUxNVUQKT0dSRSNBU0FQIyNZQUxFClJVRSNBTlQjVVBTI1NMWQpBU1dBTiMjRFJJTksjIyMKI0hPTERZT1VSVE9OR1VFCiNFVkVSRVRUI0NST09OUwojREVDRU5DWSNIRVhPU0U="},{"title":"2/4/00 PARTING WORDS","author":"by Robert Land, edited by Stanley Newman","date":"2000-02-04","grid":"UkNBI1NURUVMRVIjQUZDCkVBVSNNQU5NQURFI0ZBUgpFUlIjQVJSSVZFREVSQ0kKRERFIyNQT0wjI1NUQVRFCiNPVkFMI0xFV1MjQU1PUgpHT09EQUxMI0VMQVRFUlMKRVJJTkdPI01FQVRTIyMjClRTUiNHT09EQllFI1NBTAojIyNORVBBTCNFUlJBTlQKTEVWRVJFVCNBUlJBWUVECk9MRUcjREhPVyNFRE9NIwpTVFJFVyMjV0FDIyNOT00KRE9TVklEQU5JWUEjQU5BCk9ORSNMT1JFVFRBI1JFQwpTU1MjREVBRFNFQSNBU0g="},{"title":"2/5/00 SATURDAY STUMPER","author":"by Fred Piscop, edited by Stanley Newman","date":"2000-02-05","grid":"SE9ST1dJVFojSEVQQ0FUCklST05XQVJFI09OU0FMRQpNSVNUSU1FRCNTVEFCTEUKTU9BI0lCRSNGRVNUT09OCkVMTFMjU0xPRSMjI09XRQpMRVlURSNJUk1BI1VTRVIKI1NOT1JJTkcjVE9ORUQjCiMjI1JJQ0VBUk9OSSMjIwojQUxFTkUjTkVNRVNJUyMKQUNJRCNTT0RBI1JPTUVTCkVUUyMjI1BZTEUjTkFDTApSVVRHRVJTI1ROVCNHT0kKT1BJQVRFI1ZJVEFNSU5FCkJPTklUQSNBTUVSSU5EUwpFTkdMRVIjU0VSRU5FU1Q="},{"title":"2/6/00 BIASED OPINION: Solving with a novel direction (or two)","author":"by Cathy Millhauser, edited by Stanley Newman","date":"2000-02-06","grid":"V09SRSNBU1BJQyNERU5PRiNPTUlUCkFIT1AjU09VU0EjRU5PTEEjUkVORQpJSU9JI0hZUE9URU5VU0VTI0VBUk4KRk9TU0lMUyNNQUxPUlkjVElMVEVECiMjI1RBRSMjRUxBVEUjUFBTUyMjIwojTU9MTFkjU1RZTEUjUkVBTEVSVFMKRElORSMjU0hSUyNTQ09OQ0UjSU9JCkFOVFMjUExBSVQjI0FPTkUjTUdUUwpJU0gjRlJBTkMjUEFTVFkjQkFISUEKU0tFV0xJTkUjUkVOVFMjTElOVEVMCiMjU0hFRVQjQk9PTkUjRElOR0EjIwpTSUxPRUQjUkVJTlMjRElBR09OQUwKQ1JPU1MjSE9UTFkjU09BUlMjR0xPClJBUEUjVEFVVCMjTUVXTFMjQkxPVwpPTkUjTU9MVEVSI0lQU08jI0xFTlMKRElTUFJPVkUjVUxOQUUjUkVFU0UjCiMjI0lTVEUjU05FRVIjI0FEQSMjIwpTUEVFQ0gjU0VOT1JBI0RJVENIRVMKQUxWQSNJTkNMSU5BVElPTiNIQUlMClNBSUwjRUNPTEUjTEVOVE8jRVROQQpIWUxBI1JPV0VSI0VTU0VOI1JIRVQ="},{"title":"2/7/00 A LITTLE SEASONING","author":"by Trip Payne, edited by Stanley Newman","date":"2000-02-07","grid":"Q0xBTVMjQkFIIyNWQVNFCkxJQ0lUI0FYRSNCSVNPTgpBTUFOQSNURVJNQUdBTlQKU1BSSU5HQ0xFQU5JTkcjClNTRSNOT0gjI0dBTCMjIwojIyNFVVIjRVJJTiNTUEEKI1NVTU1FUlZBQ0FUSU9OCk1BR0kjI09BUiMjRVpSQQpGQUxMT05PTkVTRkVFVCMKRFJZI05PTVMjVFVOIyMjCiMjI1JFUyMjSkFOI0ZBWQojVEhFV0lOVEVSU1RBTEUKUFJFUEFSRVJTI1RBSUxTClJFTEFZI01FVCNFUk5JRQpFRUxZIyNPS1MjUkFURVM="},{"title":"2/8/00 FOUR-IN-HAND","author":"by Fred Piscop, edited by Stanley Newman","date":"2000-02-08","grid":"QkxVUkIjUEFQQSNWSVBTCkVFUklFI0VMSVMjQUxFQwpET0dQQURETEVTI01JUkUKRU5FI1RSSVNURSNQQUlOCiMjI1BFQSMjQVJUSUNMRQpTUFJJTkdFUiNUQVIjIyMKRUxBTCNPVkVSI1BFQ0FOCldJUkUjTkFNRVMjQkVCRQpTRUVEWSNOQVBBI0FMTEEKIyMjUkVQI05PSElUVEVSCkhBQklUQVQjI0FDUyMjIwpBVklWI1NBRkFSSSNTRUEKU0FLRSNUSEVSQUNLRVRTClRJRVIjUk9UQyNMSU1BUwpPTERTI1lFQUgjRVhJU1Q="},{"title":"2/9/00 FOR THE TAKING","author":"by Rich Norris, edited by Stanley Newman","date":"2000-02-09","grid":"REFSVCNFVklMI0ZFTU1FCk9WRVIjUklDRSNBUElBTgpERUxJI0FWT04jVElHSFQKR1JBQkFTQU5EV0lDSCMjCkVTVEVTIyMjTEVNI1RTRQpERUUjQ0hPVyNTQU5JVFkKIyMjUElBTklTVCNDTFVFCiMjU0VJWkVUSEVEQVkjIwpBQ0hFI0FTVE9SSUEjIyMKREVBTEVSI1lPTkQjUkRTCkRFTiNNRFMjIyNTUFJBWQojI0dSQVNQQVRTVFJBV1MKQkFIQUkjQVRPUCNBVE5PCkFWQUlMI1JPTkEjREVFUApSRUlOUyNFTUlUI09ERFM="},{"title":"2/10/00 COUNT ON THEM","author":"by Bob Lubbers, edited by Stanley Newman","date":"2000-02-10","grid":"UFRBI1NUT1JNUyMjU1RFClJVUiNQVVRURUVTI1RPTgpPUkIjQU5URU5OQSNBUlQKT05FSURBUyNMT04jVE9SCkZJTEwjIyNCT1JHTklORQojUEFMT09LQSMjI0lPVEEKIyMjI1NXQVRBVCNLTk9UCiMjVFdFTFZFVFJFRVMjIwpTUFVSI1NBTU9BTiMjIyMKRVJORSMjI0FNUEVSRVMjClRFTk5ZU09OIyMjQUxUTwpUU0UjSUxTI0JBTEZPVVIKRUVMI1BJU1RPTEUjSURBCkVURSNFTUlSQVRFI1NJTApTU1IjI1NFQVRFUiNFT1M="},{"title":"2/11/00 SINGLED OUT","author":"by A.J. Santora, edited by Stanley Newman","date":"2000-02-11","grid":"SkFORSMjUkVEUyNUQUxDCkFQSVNII09MSU8jQURBUgpJT05DRVdBU1NPI05FQk8KI1BPT1JJRElETlRLTk9XCiMjI1JFRFNFQSNBQ09STgpUU0VUU0UjI0lBTkEjIyMKT1dOIyMjUkVOREVSSU5HCkZBRCNXSEVSRU1ZI0RFTApVTlNOQVJMRUQjIyNPTkUKIyMjRUxFQSMjRkFMTEVOClNURVBTI1NBTElOQSMjIwpORVhUSFVTQkFORFdBUyMKRVRUVSNDT01JTkdGUk9NCkFST04jTEVIUiNPVVRETwpLQUxFI0FET1MjI0xFQUQ="},{"title":"2/12/00 SATURDAY STUMPER","author":"by Ed Julius, edited by Stanley Newman","date":"2000-02-12","grid":"IyNGQURFUyNWQVNFUyMjCiNNSU5VRVQjQU5JTVVTIwpIRUNUQVJFI1NBVElSRVMKQVJURUwjUEJTI0VMRklOClJJSVMjU1BFQVIjRUFTRQpVTk8jU1BJTExFRCNDRUUKTU9OT1RPTkUjR0FURVMjCiMjI0ZSVUdBTElUWSMjIwojQkVGSVQjR0FNRVBMQU4KSUVSI1BFUlVTRVMjRU5FCkNMSVAjRFVFVFMjQ0FHRQpFTFNBUyNQUlkjV0FERUQKUkVUUkFDRSNFTkFNRUxTCiNTSU1JTEUjQU5HRVJTIwojI0NBTklTI1JFRUxTIyM="},{"title":"2/13/00 AUTOMATICALLY: Make (or model) it a great day","author":"by Lee Weaver, edited by Stanley Newman","date":"2000-02-13","grid":"QkFMRCMjQUJDRCNCTEFCI0JBQ0gjCkFLRUVNI1JBUkUjUk9TRSNPQ0hFUgpMSU5DT0xOTkVCUkFTS0EjVFVSSU4KRU5USVRZI1NQUlVDRVMjU0FUWVJTCiMjI0RJUlQjVElORVMjTEFORVMjIwpQQUNJRklTTSNFVVIjU0FSSSNMQUMKRUxBTiNDSElFRlBPTlRJQUMjRVJBClJJREdFI0lERSMjI0VBUk4jQlJSUgpPQkkjR0VSQUxEUkZPUkQjTU9CSUwKVElMI09SVFMjUkVJTlMjQ0FSVVNPCiMjTE9JTlMjI0lBTiMjRlVOR0kjIwpFTEFQU0UjTU9OVEUjQUxMSSNMQ0QKTElDSVQjUEFDS0FSREJFTEwjRE9JCk9OTUUjRkFJVCMjI1RIRSNBR0lMRQpQRUkjUExZTU9VVEhST0NLI1VOSVQKRU5DI0FZRVMjU0hFI1JFQUxJR05TCiMjSE9QRVIjVklPTEEjRFlBRCMjIwpUT0lMRVIjUEVOU0lWRSNBVkFJTFMKRUFHTEUjRE9ER0VDSVRZS0FOU0FTClRSQUlUI0VTQVUjQUxPRSNTQ0FOVAojU05FRSNSRVNQI0xBTkEjI0VORFM="},{"title":"2/14/00 WORDS FOR TODAY","author":"by Lee Weaver, edited by Stanley Newman","date":"2000-02-14","grid":"QVNDT1QjR01DIyNTRUxGCkJMVUVSI1JJTEwjSURFQQpDT1BSQSNBTEFJI0VEQU0KREVJI0NBTkRZU1RSSVBFCiMjRFdFTFQjI0JBUkVTIwpPQlNFU1MjRkxPUkEjIyMKUklCUyNPTklPTlMjTElFCkJMT1RTI09MRCNJQ09OUwpTRVcjQ1VUTEVUI0FWT04KIyMjUEFORVMjRVNTRU5FCiNBVkVSVCMjUkFJU0EjIwpGTE9XRVJDSElMRCNQQlMKTEFJVCNVUkFMI0xPUEVTCkVSTEUjRUFTRSNFQ0xBVApBTUVSIyNXSFkjU1RFTVM="},{"title":"2/15/00 LOW-IMPACT EXERCISE","author":"by Norma Steinberg, edited by Stanley Newman","date":"2000-02-15","grid":"QVNDT1RTI01DQSNLSU0jClNDT1RJQSNBUlJBTkdFIwpTT0NJQUxDTElNQklORyMKQVJLUyNURUVTI0VUTyMjCkRFWSNCRUQjUEVUI1JFTwojIyNCRU5FRklUI01BSUQKI0lTTEUjI0lOQSNJTkdFCiNTS0lQUElOR0xVTkNIIwpQQVlTI09ORSMjU1VFVCMKSEFMUyNTQ1JBUEVTIyMjCklDSSNQRUkjTElEI0FNVAojI0dFRSNERUFOI09MRU8KI0NIQU5ORUxTVVJGSU5HCiNBVFRBSU5TI1BBTUVMQQojTVNTI1BUQSNTVEVOT1M="},{"title":"2/16/00 AMERICAN NOBELISTS","author":"by Rich Norris, edited by Stanley Newman","date":"2000-02-16","grid":"S0VNUCNTQ0FMUCNJVENICklMSUEjUlVMRVIjTEFMQQpXSUxMSUFNRkFVTEtORVIKSURMRUQjI0FOTkUjR09UClNFU1NJT04jVEVFRCMjIwojIyNUT05JTU9SUklTT04KQVBUI01PVE8jI1lFTlRBCk5FUk8jUkVSVU4jTU9STgpUUklQUyMjQUxFRyNCT08KRVVHRU5FT05FSUxMIyMjCiMjI05VTEwjRUxFQVpBUgpQRUkjQklEUyMjQVJPTUEKRVJORVNUSEVNSU5HV0FZClJJTkcjRUFSRUQjRUlORQpQRVNPI1NUQUdTI1JFQUQ="},{"title":"2/17/00 T PARTY","author":"by S.E. Booker, edited by Stanley Newman","date":"2000-02-17","grid":"UkFTQSNSQUlMUyNXSVNICkFXT0wjVVBTRVQjQUxPRQpDTFVCI1RFQVNFI0xJTkUKRVNQQU5BIyMjV0lMRVMjCiMjI0NBQlMjUkVOTyMjIwpBQ1JPQkFUI0FEQVBUUyMKQ0hBUiNHT0FEIyMjUkFHCkhPTUUjQVVESVQjR0FMTApFU1AjIyNUU0FSI0FEVUUKI0VTQ0FQRSNOQUlWRVRFCiMjI0xJQVIjVElSRSMjIwojU0NBUlkjIyNQRUFMRUQKU0lBTSNTT0RBUyNXT1ZFCkFMU08jVU5JVEUjQVJJQQpET0VSI1BBR0VTI1lFTEw="},{"title":"2/18/00 A DAY AT THE RACES","author":"by Fred Piscop, edited by Stanley Newman","date":"2000-02-18","grid":"U0FDQ08jQ1JBRyNTQVNICkFMQUlOI0FJREUjQUxUQQpIQVJORVNTRk9PVFJPQUQKTElCRVJBQ0UjI0lHSVZFCiMjI1JVTEEjUkFNRVNFUwpWQUNBTlQjU0VMRVMjIyMKQURBTSMjQVRBTEwjTUFTClNFTkFURVJFTEFZU0FDSwpFTlQjSEFSRU0jI0hJUkUKIyMjTEVWQVIjRFJPTkVECkRBSE9NRVkjVEVFUyMjIwpBUkVOTyMjVFJBU0hCQUcKRFJBR0JBUlJFTEhPUlNFCkRBVkUjUk9VRSNPTklPTgpZU0VSI1RPRUQjVEVFTlM="},{"title":"2/19/00 SATURDAY STUMPER","author":"by Daniel R. Stark, edited by Stanley Newman","date":"2000-02-19","grid":"V0VJUkRPI1pFUFBFTElOCkFTTEVFUCNBTlRJR09ORQpWT0xBUkUjRFJBR09PTlMKRVRVREUjUE9PSCNTS0FUClJFUyNLTlVSTCMjI0VURQpFUklTI0lOQUxMI0JSRUQKUklWVUxFVCNTSURFIyMjClNDRU5JQyMjI1pJTk5JQQojIyNVVEVTI1BBVFRFUk4KR0FTUCNTS0lFUiNTQVJJClJVRSMjI0VHQURTI1JJTQpBUkFCI0NFTlQjTE9OR0EKTU9ERVJBVE8jSEFWRUFUClBST01PVEVSI0FERVNURQpTQUdBTU9SRSNURU5TRUQ="},{"title":"2/20/00 GRAMMY WINNERS: Wherein you must \"name\" that tune","author":"by Fred Piscop, edited by Stanley Newman","date":"2000-02-20","grid":"Q0FSQlMjT1RIRSNTVEFHI1NDQUxBCkNMQVJBI0FHT0cjQ09DQSNBQVJPTgpDQVJPTEVLSU5HI0hFUkJBTFBFUlQKI1NBTlRBI0ZFUkFMI0VMUyNTQUlTCiMjI0tJVFQjU09SRU4jRUNPTCMjIwpERUJPTkVSUyNMSVBJTiNIT09QTEEKUkFFI0VSSUNDTEFQVE9OI09DSEVSCkFTVFIjWU9VUiMjI1RST0kjS0lORApNRVRFRCMjUEFVTFNJTU9OIyNMWUUKI1JFRklMTCNTVEFUI0FOR0xJQ0FOCiMjTUlORU8jSElWRVMjQUxBTU8jIwpGUklUVEFUQSNDRVJUI05FV0VMTCMKTEVEIyNLSU1DQVJORVMjI1NBTEFECkFVTEQjU09NQSMjI1JBSFMjTklURQpTTkVFUiNOQVRBTElFQ09MRSNOSEwKSEVSTUVTI05PTEFOI1NXSU5HU0VUCiMjI0FERU4jTklDS1MjTUVSRSMjIwpTUEFSI1JFTCNHRVNURSNTT05FUyMKUEVSQ1lGQUlUSCNUSU5BVFVSTkVSCkFMVEhPI1RST1QjRU5EUyNURVRSQQpTVEVFTiNTQVlTI1JFT1MjRVNTQVk="},{"title":"2/21/00 LET'S RIDE","author":"by Rich Norris, edited by Stanley Newman","date":"2000-02-21","grid":"QVNIRSNET0xUI0pBREVEClBBVUwjT1JFTyNFQk9OWQpSVU5TQUxPTkcjVEhJTkUKT05DQUxMI1NBWVNPTkVTCk5BSCNMRVQjI09FUiMjIwojIyNGQURFU09VVCNHQVkKU1BSQVkjTkFVVCNPTExBCkhFQURTRk9SVEhFRE9PUgpBTE1TI0FSQUIjWUVNRU4KSEVQI01JU1NJTEVTIyMjCiMjI09BUiMjREVJI0FQVQpHT09EQllFUyNTTklERVIKRU5ST0wjR0VUU0dPSU5HCk1FVFJFI0dBVkUjVE9ORQpTQVNTWSNTVEFOI0FTRVM="},{"title":"2/22/00 LET'S RIDE","author":"by Lee Weaver, edited by Stanley Newman","date":"2000-02-22","grid":"U09MQVIjQUxEQSMjVEFXCkFUT05FI1dJRUxEI0FTSApESUNLVkFORFlLRSNYSUkKQVNITEFSUyNTQVBMSU5HCiMjI0VMTSMjI0xPQUQjIwpSRVNUVUZGI0FJUk1BU1MKT0xFI0VVTEVSI1RFTkVUCkFJREEjTE9QRUQjU0NBUgpTVEFUUyNTSVRBUiNFVEUKVEVOQU5UUyNFWUVCUk9XCiMjQ1JPVyMjI1NMTyMjIwpSRUhJUkVEI01PT1JBR0UKRVJBI1RSVUNLRkFSTUVSCkFNSSNTUExJVCNOT01BTgpNQVIjI1NMQUcjU1dPUkU="},{"title":"2/23/00 THE WILD BUNCH","author":"by Bob Lubbers, edited by Stanley Newman","date":"2000-02-23","grid":"U1VNQUMjTEVJUyNTTEVECkFNT0NPI0FORFkjSU9UQQpSQU5DSCNXRUFTRUxPVVQKIyNLRUVQUyMjVEFMS0lFCkFDRURJQSNBQkVTIyMjIwpNT1lFUlMjUkVNRU1CRVIKRVJCI1NURUVMI0xBVVJBClJOQVMjQURBSVIjQUxBTgpDRVJBTSNEV0VFQiNMU1QKRUFTVEFTSUEjTUFVTUVFCiMjIyNUSEVZI0FTR0FSRApBREVTVEUjI0FUVEFSIyMKSE9HSEVBVkVOI0lOS0VECkFMT0UjUkVTVCNPREVUTwpCRVNTI1NFVFMjTkFURVM="},{"title":"2/24/00 DOGGONE IT","author":"by Fred Piscop, edited by Stanley Newman","date":"2000-02-24","grid":"SE9HI0hPTEVEI1NPVFRPCkVWRSNBTUlDRSNQT1JFRApNVVRUREFNT04jQVpVUkUKQUxTTyNSRU5URlJFRSMjCkxFQVJZIyMjRUFUI0JSTwojU1RSRUFNUyNUQUlMT1IKIyMjQUdSRUVTIyNOVURFCiNNT05HUkVMSE9SREVTIwpNQVJDIyNURUVQRUUjIyMKQUxCRVJUI1NQQU5ORVIjClBFSSNFQVIjIyNESU1FRAojI1RVUkNPVFRFI0FJREUKU1BJUkUjQ1VSRFVMTEVBClRPTkdBI0tORUVTI0lBTgpFREdFRCNTQUVOUyNPTEU="},{"title":"2/25/00 NATIVE INTELLIGENCE","author":"by A.J. Santora, edited by Stanley Newman","date":"2000-02-25","grid":"UkFWRVMjUkVOTyNJQ0VTCkFERUxBI0VMQUwjTkFOQQpOT0xBTiNERVNFUlRGT1gKR1JBTkRDSEVST0tFRSMjCkVFUiNQUk8jIyNPTlRBUAojIyNSSU9URVJTI0RFTUkKI0FQT1AjI1ZPTFMjUkVOCkNIRVlFTk5FV1lPTUlORwpPQVIjUkVJTiMjVE9BRCMKTUlTUyNMQVRDSE9OIyMjCkVSSUtTIyMjTEFTI1RJRQojI01JQU1JRE9MUEhJTlMKU0VNSU5PTEVTI0VVUk9TCklST04jUEVMRSNBR0VOQQpUQU5HI0VYSVQjS0VTRVk="},{"title":"2/26/00 SATURDAY STUMPER","author":"by Mike Shenk, edited by Stanley Newman","date":"2000-02-26","grid":"Q0FMQUJPT1NFUyNMRUFQCk9WRVJBTkRPVVQjSU1OTwpOT1RPTkFEQVJFI01FVFMKRElNUyNJTVAjRUJFUlRTCk9ERSNHUkFOT0xBI0lSRQpMRUdBTCNOVU5DSUFURVMKRVJPREVEI1RFTExMSUVTCiMjI1JBSUQjU0FTRSMjIwpTSUxFTkNFUiNET1JTRVkKSVNPTUVUUklDI1VUSUNBCkVSRyNSQU1QQVJUI0RVTgpSQVJFU1QjT1JBI01FRUsKUkVPUyNJTlNBVElBQkxFCkFMTFMjTk9URk9SU0FMRQpTSUxPI0dSRUVOQUNSRVM="},{"title":"2/27/00 GEE WHIZ: Adding things usually left out","author":"by Randolph Ross, edited by Stanley Newman","date":"2000-02-27","grid":"I0ZMQVAjRU5BQ1RFRCMjUEFTQ0FMCkNMSVZFI0RFUE9SVEVFI0FTUkFSRQpST0JJTkdXSUxMSUFNUyNDT09MRVIKVVJCQU5BI0xPT1AjI1BSSU4jVk9OCkRJRVRFUlMjTU5PI1BSVU5FI0lMRQpTT1JFI0JPQkJZREFSSU5HI0dOQVIKIyMjI0lMTEUjI1NNSVRTI0dBVEVTCkFGQiNORVZFUkEjUEVTTyNPUlIjIwpCUkFTSCNFVFlNQSMjI1VUT1BJQSMKUkFDS0FORFJVSU5HI1NUVUQjTFNVCkFOS0FSQSNFTkRHQU1FI0JPSUxFUgpNQ0kjTU9MRCNFTExFTkJBUktJTkcKI0VOUk9TRSMjI0VMR0FSI0RFTlNFCiMjR09OI0FCTVMjU0FUSVJFI0dFRApDQVRUWSNGUk9ETyMjT0RFUiMjIyMKRUNITyNSQUlTSU5HQlJBTiNXRUJCClNFRSNMRUdHUyNXQUwjTEFTQUxMRQpTVFUjQVNFQSMjQU1PSSNUT0ZGRUUKUE9TVElUI0RVU1RJTkdIT0ZGTUFOCklOU0FORSNFTkdFTkRFUiNBTEFURQpURVJNRUQjI1NUUkVFVFMjU1lOUyM="},{"title":"2/28/00 GO ON AHEAD","author":"by Norma Steinberg, edited by Stanley Newman","date":"2000-02-28","grid":"U0FQUyNQQVNUQSNCT1pPCk9QUlkjQUxMSU4jQVZJRApBUk9OI1JPQURTI1JFTk8KUklCI0RFUkJZV0lOTkVSClNMT0dBTlMjI0VNVSMjIwojI1dBTlQjTUFSSU1CQVMKQkVMTEUjQkVHRVQjRVJBCkFSRUEjQ09PRUQjRkFJUgpTSVIjQkxPV1MjR0lOWkEKSEVTU0lBTlMjU0FSSSMjCiMjI0lSViMjU0NSRUVOUwpTUEVORElOR0NBUCNCSVQKSEVSQiNDT1JBTCNXQVZZCkFSSUEjTE9JUkUjQUJFTApNRU5EI0VOREVEI1NZTkU="},{"title":"2/29/00 $$$$","author":"by Rich Norris, edited by Stanley Newman","date":"2000-02-29","grid":"UkVQQVkjRkFUUyNCSUFTCkFMT05FI09DSE8jSU5SRQpSQUtJTkdJVElOI1NUSVIKRUxFTSNMRUFOTiNDSEVGCiMjI0FHTyMjU0VRVUVMUwpMT1dMRVZFTCNUUklNIyMKQUJFI01FVEVEI1NUT1dFCk1JTFMjU0FWRUQjU05BRwpFRUxFRCNTSU5BSSNFUkcKIyNITU9TI1NZTk9OWU1TClNMRUlHSFMjI0lOQSMjIwpQRUVOI0lQQVNTI1JFQVIKTE9MQSNGSUxUSFlSSUNICkFWRVIjVEVURSNST05FRQpUSURZI1NMT1AjU1dFREU="},{"title":"3/1/00 WOODY","author":"by Bob Lubbers, edited by Stanley Newman","date":"2000-03-01","grid":"SEVFTFMjREJMI1NUQUJTCkFUVEFSI0VSQSNFQVRBVApXQVJQU1BFRUQjRVJBU0UKU1RFVCNFUEEjS0lUVEVOCiMjI09HUkVTI09OQSMjIwojI1NQTElOVEVSR1JPVVAKQ0VBU0UjI1NBRCNFTFNFCk9XTiNOSUIjUkFFI0RFTgpORVRTI0RFQSMjU0hFRFMKR1JBSU5FTEVWQVRPUiMjCiMjI05FQSNERU5FQiMjIwpEQU5DRVMjSU5OI09BVFMKUklDRUQjQkxPT0RLTk9UCkFET1JFI1JFTSNSRU5UQQpCQVNFRCNBU1MjU05FRVI="},{"title":"3/2/00 PARTY LINES","author":"by Robert Land, edited by Stanley Newman","date":"2000-03-02","grid":"UElFUiNCQUxFIyNDQVNLCkVETkEjRUxBVEUjQU5PTgpXRVZFTUVUSEFWRU5UV0UKU0FZI0FGQVIjRUxPSVNFCiMjI0JJRVIjSU5BTiMjIwpET05BTEQjQU5JUCNCU0EKQU1PUyMjU0lHTlMjRVRDCkxFVFNHRVRUT0dFVEhFUgpFR08jRU5BQ1QjI1JBVkUKU0FOI0FSQ0gjUFJVTkVTCiMjI0RSQVkjQlJJRSMjIwpJTkFSVUcjR1JJVCNBT0sKRE9IT1BFWU9VQ0FMTE1FCk9MQVYjREFOVEUjQUxBTgpMT0JFIyNXRUVEI0dZUk8="},{"title":"3/3/00 EASY DOES IT","author":"by A.J. Santora, edited by Stanley Newman","date":"2000-03-03","grid":"QVNQSUMjU0lQI0NBUlBTCkxBUlZBI1BSTyNPTU9SRQpTV0VFVFBFQVMjUk9NQU4KIyMjU0tFTEVUT05LRVlTCkFERCNJU1QjU1VCI1JFRQpGUkVTTk8jIyNUQUJPUlMKVFVOQSMjT1RPT0xFIyMjCiNNWURPR0hBU0ZMRUFTIwojIyNBTkVNSUEjI0ZMQVAKVEVTVEVSIyMjQlJZQU5UCk9SVCNTUkEjTE9BI0lEQQpQUkVUVFlQTEVBU0UjIyMKQ0FSUkUjU0FZQ0hFRVNFCkFURVVQI0VNVCNFUkFTRQpUQVNLUyNTRUUjU09SRVI="},{"title":"3/4/00 SATURDAY STUMPER","author":"by Fred Piscop, edited by Stanley Newman","date":"2000-03-04","grid":"SkVXSVNPTiNQQUxBVEVTCkFNQVRJVkUjQURFTElORQpTRVRUTEVTI01PTlRBR0UKUFJFI09SUyNQUk8jUlJTCkVJUkUjVElUTEUjUEFBUgpSVEVTI0hFUk8jUkVFVkUKU0FSVFJFI0VOR0lSREVECiMjIyNBUkFNQUlDIyMjIwpMT1ZFTUVETyNORUdBVEUKT1BFTFMjT0xFRyNBVE9OCkNFUkYjQ05PVEUjVEFXUwpVTkQjQ1JJI0NSTyNUSFUKU1RBVFVFUyNIQUlSSUVSClRPTkVUVEUjRUxMQU1BRQpTRVRURUVTI1JFU0VFRFM="},{"title":"3/5/00 PLAYING THE FIELD: A number of things you may find there","author":"by Lee Weaver, edited by Stanley Newman","date":"2000-03-05","grid":"Q09JUiNWSVBTI1NBTUJBI0FCQVRFCkFMTUEjSUxMUyNFTUFJTCNXQUxFRApQRUFKQUNLRVQjQ09STkZMT1dFUlMKUE9NQURFI0FTU1VSRUQjQUxMVVJFCiMjI0hFUk9EI1BSRVNTRVIjRVRBTApBTFAjI09OU0FMRSMjI0FHRVIjIyMKR09PREJZRSNDQVJST1RUT1AjQk9HCkVOVEVSIyNQRVQjSElSRSNPU0FHRQpESUFNRVRFUiMjRFlMQU4jQ0FSRFMKIyNUT1JFUk8jU09NRSMjREhPTEVTCkJJTyMjQ0FCQkFHRVJPU0UjI0VOTwpFTlJJQ0gjI1JJR1MjU1RFQU1ZIyMKQUxBTU8jU0hJTlkjI0hBUlBJU1RTCkRFQ0FMI01PQVQjTEVBIyNTTkFSRQpTVEUjT05JT05TS0lOI1dPT0RDVVQKIyMjV1JJVCMjI05BU1NBVSMjS0VBClNBTkUjU0hBVFRFUiNFU1RFRSMjIwpFUVVBVEUjQ1JFQVNFUiNWSUFCTEUKUFVNUEtJTkhFQUQjTUVMT05TRUVEClRBQk9PI1JFRVNFI0lOSVQjRUFWRQpBU1NOUyNBRERFRCNURUxFI1JVSU4="},{"title":"3/6/00 ALL YEAR LONG","author":"by Lee Weaver, edited by Stanley Newman","date":"2000-03-06","grid":"UEFTUyMjQVNJRiNBQkJFCkFCVVQjQUxJQ0UjTUFJTApST01BI1NQUklOR0JBQ0sKUlVNQkFTI1NFTk9SIyMjCiNURUxMQSMjUkVOT1dOIwojI1JFTUlUUyNMRVNJT04KVERTI1NMT1BFIyNJTlRPCldFVFMjU1RPTEUjQVRFRQpPTU9PIyNFVEhJQyNFRFMKU09DQ0VSI1NJR0hFUiMjCiNTS0FURUQjI0hFREdFIwojIyNMVUdFUyNUV0lSTFMKRkFMTElOV0lUSCNCRUFSCkFCRUUjQUVHSVMjTEVOTwpURU5EI0xZTk4jI0VORFM="},{"title":"3/7/00 ORDER IN THE COURT","author":"by Rich Norris, edited by Stanley Newman","date":"2000-03-07","grid":"QUJJVCNMQVJJQVQjRkRSClNFTUkjRVJPREVSI1JFQQpDQVNFSElTVE9SWSNFRU4KQU1VU0UjT1NMTyNQRVAjClBFUiNNRU4jIyNZQVdFRAojREVOSU0jUEFMT01JTk8KIyMjRU5DI0VWRVMjTEVUCiNKVURHRVJFSU5IT0xEIwpCVU4jV0VFSyNUSU4jIyMKQVZPQ0FET1MjSUhFQVIjClJFUEFZIyMjQUxJI1dFUwojTkVXI0JJQVMjVE9BU1QKUElOI0JFTkNISk9DS0VZCkFMRSNBUkNIRVIjVEVBTApXRUQjU1RSRVNTI0FOVEU="},{"title":"3/8/00 GO, TEAM, GO","author":"by Fred Piscop, edited by Stanley Newman","date":"2000-03-08","grid":"REFURSNTRVJGUyNFTEFMCklUQUwjQUdJTEUjSklCRQpDRUlMSU5HRkFOI0VCT04KVEFMRU5UI0VOVElDRSMjClVTTyNUQUMjIyNTVFJFVwpNRVJFUiNBQlJBTSNBWEUKIyMjUk9FREVFUiNBQ0VECiNCT09TVEVSQ0FCTEVTIwpDQU5TI0FOTkFCRUwjIyMKQVRFI0VTVEVTI05BQ1JFCkRFTEFZIyMjVFJJI0xFWAojI0lDRUFHRSNBVEhPTUUKSkFORSNST1RPUk9PVEVSCk9WRVIjVElUTEUjV0hFVApCQVJCI1NORUVSI0xFVFM="},{"title":"3/9/00 ALL KEYED UP","author":"by Bob Lubbers, edited by Stanley Newman","date":"2000-03-09","grid":"RFVDQVQjTkFTSCNMQUdTCkFOT1NFI09SRU8jQVJFQQpTQU5UQSNBQ0NPUkRJT04KIyNDT05DSCMjUEVERExFClNURVJFTyNMT0xBIyMjIwpISVJTQ0gjQU5BUkNISUMKT1BUI0tBUk1BI1NPVVNBCkFUSVQjTk9CSVMjV1JBUApUT05ZUyNQQVJJUyNESUUKU0VBU09ORUQjTUFHWUFSCiMjIyNCQVJBI0JPVUdIUwpBTFRBSVIjI0JBTlRVIyMKQkFCWUdSQU5EI0FUUklBCklSQUUjT0RPUiNSRUREWQpFQVJTI1dPUk0jQVJZQU4="},{"title":"3/10/00 CENTRAL INTELLIGENCE","author":"by A.J. Santora, edited by Stanley Newman","date":"2000-03-10","grid":"TEFNQVMjQUxCVU0jQ0JTCklEQUhPI1RJQVJBI0xFRQpCQU5BTkFTUExJVCNJQU4KUllFIyNMRVNTIyMjTVVECkFTVE9SSUEjQVdMI0FHRQojIyNIRUIjIyNIT0FYRVIKI0lNQUdJTkFUSU9OSVMjCiNNT1JFSU1QT1JUQU5UIwojVEhBTktOT1dMRURHRSMKQ0hBU1RFIyMjUFJFIyMjCkxFVyNTU1QjQ09TTUlTTQpBTEsjIyNBRVJPIyNOT1UKTUFDI0NBTkNFTEVET1VUCk1TVSNBTkRSRSNTRU5TRQpBVFQjTEFZVVAjUExFQUQ="},{"title":"3/11/00 SATURDAY STUMPER","author":"by Ed Julius, edited by Stanley Newman","date":"2000-03-11","grid":"TUlERElFIyNST1NBUklPCk9OSU9OUyMjRVdFTkVDSwpBU1NFU1MjU0NPUkNIRVIKVE9QI0VFUklFU1QjRVJBCiNMRVNUI09ERFMjQU1TIwpCRUxUI0hPTEVPVVQjIyMKVU5MSU1JVEVEI1NIUkVXClNDRU5JQyMjI0hFTEVORQpIRURHRSNDTEFVREVUVEUKIyMjRU5DUlVTVCNUQVJQCiNUQVIjSEFSRSNERUxBIwpNQU4jU0FUSUFURSNJTksKQU5ORUFMRUQjQUxQQUNBClNURUFNRVIjI1NUQVRFTgpTRVhURVRTIyNTQU5FU1Q="},{"title":"3/12/00 POSTSCRIPTS: The kind that come first","author":"by Fred Piscop, edited by Stanley Newman","date":"2000-03-12","grid":"R0VFRCNQQUlOUyNMSVNBIyNTVEFSCk9HTEUjQVNTRVQjSU5JVFMjQ0FORQpQUkVQU0NIT09MI1BVR0VUU09VTkQKUkVDUkFURSNOT0NBU0gjUkFUVEVECk9UVEVSI1NFTCNPUkUjTUFZUyMjIwojIyNTVFUjTUFHTkkjQ0FUUyNEQVMKUE9JU09OU1VNQUMjUE9HT1NUSUNLCkVORE9SU0UjUFJFREFURSNPUkFURQpQSUVSI0NFTCNCQVJJVEVTI1VMRUUKVU5TI0FSTUVSI0xPUkUjSVJFIyMjClBFVEVTRUVHRVIjUFVSUExFU0FHRQojIyNUQVcjR09PRCNQRVRUWSNEVUUKSEFTSCNTSElQV0FZI0RFSSNORUFMCk9QQ0lUI09ORVNQT1QjUkVTT0xWRQpQRUFDRVNJR04jUEhPVE9TUFJFQUQKSVNNI05JVFMjRkxPVVIjVElFIyMjCiMjI0ZPWFkjUFJFI1JVTSNDQVBFRApFS0JFUkcjU0VBU09OI0FXRVNPTUUKUEFMTVNVTkRBWSNQRU5OWVNUT0NLCklURU0jTkVBTEUjQVlSRVMjRUxFRQpDRURFIyNFS0VEI0xTQVRTI1JFRUQ="},{"title":"3/13/00 COSMIC COLORS","author":"by Randy Sowell, edited by Stanley Newman","date":"2000-03-13","grid":"TEFNUFMjVEFHI09PTVBICk9SREVSI0JMQUNLSE9MRQpPTkNFSU5BQkxVRU1PT04KVElMTCNPUkFMTFkjU1lOCiNFVkVSVCNOT0wjTUVTQQojIyNST0NLIyNFVEUjIyMKRU1TI1dISVRFRFdBUkZTCkdBVUdFI1RPWSNFTElPVApHUkVFTkNIRUVTRSNQUlkKIyMjTUFPIyNET1RTIyMjClRBUlMjV0JBI1VTSU5HIwpFU0UjT1BFUkFTI0VFTFMKVEhFR1JFQVRSRURTUE9UClJFRFBMQU5FVCNTVEFWRQpBU1NBWSNPTEUjVEFMRVM="},{"title":"3/14/00 NIGHTY-NIGHT","author":"by Norma Steinberg, edited by Stanley Newman","date":"2000-03-14","grid":"Q0hBUCMjQkVFUCNDUkVXCkhFUk8jU09MVkUjSEFSRQpVTkRFUkNPVkVSI09QSUUKR1JPVFRPI0VOQ0xPU0VEClNJUiNFUkFTI0hBU0gjIwojIyNVU0VSI1JFREVFTVMKQ09TVCNERUNPREUjRUFVClVQUEVSI05PVyNOT1RSRQpUQVIjT1JBVEVTI0FTS1MKU0xFRVZFUyNORVNUIyMjCiMjQVhFTCNCQVJOI1NBVApPQkRVUkFURSNNT1NUTFkKVE9PTCNQSUxMT1dUQUxLClRPVVQjU0VWRU4jT0tJRQpPUFRTI0VEQU0jI1BFTlM="},{"title":"3/15/00 WHATEVER","author":"by Fred Piscop, edited by Stanley Newman","date":"2000-03-15","grid":"Q09NUCNNRUFOUyNXQVdBCk9ET1IjQVRCQVQjSU5PTgpUSU5ZI1NUSU5FI1NURVQKI0NBTllPVVRPUFRISVMjCiMjI05BTiMjI1NPTCMjIwpFRFNFTCNBUlMjV0lOQ0UKTU9QI0lOVEFLRSNTRUxMCklMSUtFSVRMSUtFVEhBVApMT1JJI1RJTExFUiNSSU8KRVJFQ1QjQ1lMI1VUVVJOCiMjI0tPQSMjI1NQQSMjIwojT05FT1JUSEVPVEhFUiMKQVdFRCNBUklFTCNJUk9OCkRFTUkjQk9ZTEUjVElNRQpBTk9OI1NUQVlTI0lDRUQ="},{"title":"3/16/00 BOOKS AND AUTHORS","author":"by Rich Norris, edited by Stanley Newman","date":"2000-03-16","grid":"Q0FCSU4jSEFIQSNJRExFCk9QSU5FI0VUT04jU0hFUwpMRU9UT0xTVE9ZI0FMQVMKRURHRSNBSU5UI1RJQVJBCiMjI1JFU1QjU0NSQVdOWQpUQUpNQUhBTCNCT0hSIyMKQVdBSVQjVEFQRUQjRVNUCk1BTlgjQ0VEQVIjRU5UTwpFWUUjT1JERVIjTFVDSUUKIyNBVVJBI1NDUkFQRVJTClRTVU5BTUkjSFVHSCMjIwpCQVNJTiNTRU1JI09BVFMKSVRUTyNBTExFTkRSVVJZCkxJRU4jUkVJTiNBSURFUwpMRU5TI1NUQVQjV0FJU1Q="},{"title":"3/17/00 PRAISE PHRASE","author":"by Patrick Jordan, edited by Stanley Newman","date":"2000-03-17","grid":"VE9HTyNBTU9TI0NBU1RFCkVNSVIjTUVOVSNBTFRPUwpOQVZFI0VSSUMjUklBVEEKVEhFT05MWVRISU5HWU9VCkhBUyNPSUwjI1JFTiMjIwojI0FMVkEjRFJFU1NBR0UKI1NIT0UjSVJPTiMjTk9SClNIT1VMRERPQkVISU5EQQpNT08jI0FMSVMjSVZFUyMKVVBUVVJORUQjU1RZWCMjCiMjI0xJWiMjVEFVI0FNQQpNQU5TQkFDS0lTUEFUSVQKQU5JVEEjQU5UUyNHSU5TCllPS0VMI1NPTEUjUk9TRQpTTkVSRCNBV0VEI0FOS0E="},{"title":"3/18/00 SATURDAY STUMPER","author":"by Daniel R. Stark, edited by Stanley Newman","date":"2000-03-18","grid":"RkxPVU5ERVIjVEFDVElDCkxFT05BUkRPI0FMTFVSRQpBREhFU0lWRSNEVUVMRUQKUEFTI1RFQVNFI01BSU5FCiMjI0JJUlIjQ0hJUlBFRApTTkFSRSNEVVJBTlQjIyMKSE9WRVJTI0hVTEFIT09QCklERUEjVFJVU1QjRUxMQQpORUNLV0VBUiNTQ0FMQVIKIyMjREVSTUFMI1JJQU5UCk1PUkFJTkUjQURBUiMjIwpBTU9ORyNORUdFViNTT0wKR0FVQ0hFI1JVTUlOQVRFClVOU0VFTiNJTlVOSVNPTgpTSUVSUkEjU0FSR0FTU08="},{"title":"3/19/00 HIT LIST: This won't hurt a bit","author":"by Bob Lubbers, edited by Stanley Newman","date":"2000-03-19","grid":"I0VUSEVSI0hFTE0jUEFURSNTT0lSCkFVUk9SQSNBUklBI0FXRUQjTUFSRQpDUk9XTkpFV0VMUyNOQU1FU0FLRVMKSE9UTEVBRFMjI09ORVIjUkFDSU5FCiNTU1MjI1NFTUlOT0xFUyNTS0VFVAojIyNBRVMjI0FESU9TI0lGU08jIyMKQkVBVFRIRUNMT0NLI0dSRVlORVNTCkFORSNET05BVFMjI0ZFRVQjRVNURQpCVVJQI0VETkEjQlJBVCNFQVNURVIKQVJPTyNTT1QjQkFBTCMjREFMSSMjClJFQlVTI1dJU0VDUkFDSyNBSU1BVAojI0FOS0EjI09UT0UjQU5NI1BBUkUKT1VURElEI1BMQU4jQVJFQSNTVElSCkFTSVMjT1JFTyMjQU1WRVRTI0VFUgpGQUNUT1JFRCNQT01NRUxTQURETEUKIyMjRUxFRSNNRURFQSMjVU5JIyMjCkNIQVJTI0ZSQVRFUk5BTCMjUkFTIwpPT0RMRVMjT1JFUyMjUkVNSU5ERVIKUlVNSU5BVE9SI1NUQUNLRURERUNLCkFSQU4jV0lORSNBSURFI1NFTExUTwpMSU5HI1NQRUQjTkVFRCNBU1NFUyM="},{"title":"3/20/00 LOOKING UP","author":"by Lee Weaver, edited by Stanley Newman","date":"2000-03-20","grid":"QUxJQkkjVU5UTyNQSUxFClJFQkFSI05FRVIjQVNFQQpNQU1CTyNWQVNUI1RTQVIKIyMjVU5ERVJUSEVTVU4jCiNBU1NJU0kjIyNBWUVTIwpJTlRIRUNMT1VEUyMjIyMKQ09SS1MjI1VOSVQjVElOCk9ERUEjS0lURVMjTUFORQpORVcjQUlERSMjUFVSU0UKIyMjI1NUQVJDUk9TU0VECiNTUENBIyMjT1VUSElUIwojTU9PTkxJR0hURVIjIyMKTU9MTCNPTEVPI05PVENICkVLRUQjVVNFUiNDT0FUSQpMRVNTI1BBU1QjRU1JUlM="},{"title":"3/21/00 TREE DIMENSIONAL","author":"by Bob Lubbers, edited by Stanley Newman","date":"2000-03-21","grid":"TUFURVMjQkFMI1NIT0FMCkFEQU5PI09OTyNURVJSQQpOQVBPTEVPTlMjRURBTVMKQVBQTEVDSEVFS0VEIyMjCkdURSNEVU8jI0VMQVRFRApFU1RBIyNPU1NBIyNJVkUKIyMjU0FNI1dBVFRBR0VTCiMjU1BSVUNFR09PU0UjIwpPTkVTSURFRCNOT1MjIyMKREVFIyNERUVNIyNUSEFUCkRPUlNBTCMjQUFBI0lETwojIyNDSEVSUllQSUNLRVIKQ0FOT0UjSEVBUlRJRVNUCkFSRU5BI0VFTiNDQVJURQpNRVdFRCNBRFMjSE9TRVM="},{"title":"3/22/00 HEMMERS AND HAWERS","author":"by Fred Piscop, edited by Stanley Newman","date":"2000-03-22","grid":"UEFDI0RJR0lUI1NFQU1TClJFTyNBTU9DTyNUVU5FUgpFUk5PUlVCSUsjUFJBRE8KI0FDTUVTI0VFUiNPTEQjClNUQU4jI0VSTklFUFlMRQpOT1ZJU0FEIyNPTkVTRUMKT1JFI1RSRUFEI0ZBVFNPCiMjI0VSSU5NT1JBTiMjIwpJUEFOQSNTQ0lPTiNPVk8KVE9NQVRPIyNOT1RFUEFECkVSSUNBSk9ORyMjTElSRQojU1NUI1NMTyNTVVNBTiMKQUNUSUkjRVJJS1NBVElFClNIQU5LI0FHUkVFI0VTUApTRURHRSNORUVEUyNTSEE="},{"title":"3/23/00 YAKKETY-YAK","author":"by Rich Norris, edited by Stanley Newman","date":"2000-03-23","grid":"U1RJUiNTVEVBTSNBTE1BClRPTkkjU0VMTUEjU0VBTApSQVBTRVNTSU9OI0hBTEwKSURMRVMjSE9SI1NFVFRPCkZJQVNDTyNUQUxLU0hPVwpFU0MjRVRBI0xBSSNFU0UKU0hFQSNITU8jUkVBUkVECiMjI1NQRUFLRUFTWSMjIwpWRVNTRUwjU0FNI0VTU0UKSU5UI0FMUCNSSU0jTE9YCkNIQVRST09NI0VBU0VVUApUQU1FUyNUT0UjREVFUkUKVU5JVCNKQVdCUkVBS0VSCkFDTkUjQVRFQU0jVEVTVApMRUFTI01PUk5TI09SVFM="},{"title":"3/24/00 CAR THEFT","author":"by Bob Sefick, edited by Stanley Newman","date":"2000-03-24","grid":"TEVWSSNBTE1TI0VBUlAjCklSQU4jVE9JTCNTTkVSRApQQUxMI1RVTkEjUE9MQVIKIyNIQU1VTklWRVJTSVRZCkNMQVdJTkcjI1BJRUNFUwpMSUwjTkVFRE5PVCMjIyMKQVRMQVMjI0lPQyNBU09GClNIQUNLQU5EU0hBQ0tJSQpQRVNUI0xFTiMjU0VBTFMKIyMjI0xJRVRFU1QjVEVUCkJBUlRBQiMjREFSVEVSUwpBQkVJTklMTElOT0lTIyMKQkxBTkMjRUFTRSNCT09TClNFREdFI0FNT1MjSUZGWQojUllFUyNERU5UI0FGQVI="},{"title":"3/25/00 SATURDAY STUMPER","author":"by Manny Nosowsky, edited by Stanley Newman","date":"2000-03-25","grid":"Q0FQTyNMVU1CRVJKQUNLCkFTT1AjQU5PVUtBSU1FRQpNT1JFI1NUT0xFTkJBU0UKSU5UUiNUQU5LUyNJVEFMClNFTEEjTFVTSCNTTk9SRQpPTUFOI0FURUUjT0dMRUQKTEFOREFVI1RBR1MjIyMjCkVORElOR1MjRFJBUElORwojIyMjVEhPTiNFRElUT1IKQVRPTVMjTEFERSNBU1RPCkRPUEVZI09WRU4jTkFIQQpJTEVEI0FOQUNFI09MSU4KRE9SSUFOR1JBWSNCVU5TCkFWQU5UR0FSREUjQUxHQQpTRVNBTUVTRUVEI1JVU1Q="},{"title":"3/26/00 FIND FEATHERED FRIENDS: They're there somewhere","author":"by Shirley Soloway, edited by Stanley Newman","date":"2000-03-26","grid":"UkVFTCMjTkJBI1BBVFMjI0VCU0VOCkFMREEjVEVBTCNPQ0hPI0VOUkFHRQpHTEFTR09XTEFTU0lFUyNHUkFUSVMKU0FNI1JFVFMjVElERSNQUk9WT1NUCiMjI01BUyNBTUFUSSNNRUVTRSMjIwpTVE9QVEhFTVVTSUMjSU5URU5ERUQKSElOR0VPTiNUSE8jI0NEUyNFUlNFCkVMSSNSRUVTRSNORUFSUyNUV0lUUwpBRE9HIyNTVERTI0lETyMjQVdFRUsKUkVOTyNSQ0EjRU5ET1cjU1RPUkVTCiMjI0VOVk9ZI1JZRSNBTEdFUiMjIwpTRU5TRVMjRUxWRVIjVkVUI0xMRFMKQ1JPV1MjI0RFRSNTSEVBIyNERVJFClJJVEFTI0hPT0RTI0FEREVSI05PRwpJQ09OI0xJViMjVEFJI0lTRUVZT1UKTUFORFJBS0UjSEFMRklOQ0hUQVBFCiMjI0VBVEVSI0FUTEFTI0hFRSMjIwpTUElSSVRTI0FCVVQjQVNFQSNBTEkKRUxPSVNFI05BSVJPQklOQVRJVkVTClRBTk5FUiNBUlRFI1RBUlQjREVBTApTTkFHUyMjQkVTUyNVSFMjI0FSTkU="},{"title":"3/27/00 COVER STORY","author":"by Norma Steinberg, edited by Stanley Newman","date":"2000-03-27","grid":"Q0FMTVMjQ0hVTSNUV0FTCk9ORUFMI0xFTk8jUkFJTApDT0FUT0ZBUk1TI0FSTE8KQU5OI0dJTiNFQ0xJUFNFCiMjI0NBTiNTVE9PTCMjIwpNQVJJTkFERSNXT0JCTEUKQUxJVCNMVVJLI1BMSUVECkRBVlkjU0FWRUQjQURPRwpBTUFTUyNMSU5FI1pPTkUKVE9MTEVEI0NPTlZFTkVECiMjI0lSQVRFI1RBUiMjIwpPQlNDRU5FI1NFQyNFTEYKTk9PSyNDUk9QRFVTVEVSCkVMU0UjRVJMRSNVUE9OQQpTT0FSI0RZRUQjTUFORFk="},{"title":"3/28/00 AT THE TRACK","author":"by Rich Norris, edited by Stanley Newman","date":"2000-03-28","grid":"QkFTSCNTVElOSyNQTE9ZCk9SRU8jUFVUT04jUk9OQQpSRUFNI09CRVNFI0VYQU0KR0FURUNSQVNIRVJTIyMjCiMjI1JPVCMjI0xBVEVTVApTVEFVQiNBVUcjSE9TRUEKVFVSTlNJR05BTFMjUFNJCkFQRVMjU09GSUEjQVJBTApHRU4jU1RSRVRDSExJTU8KRUxBVEUjQURTI0FMVEVSCkRPU0FHRSMjI1RSVSMjIwojIyNQT1NUTUVSSURJRU0KSk9LRSNUQVVQRSNJREVBCk9WRVIjRUxMRU4jTk9SQQpCQVlTI1JFTEVUI0dMT00="},{"title":"3/29/00 FEATHER OR NOT","author":"by Bob Lubbers, edited by Stanley Newman","date":"2000-03-29","grid":"U0NBTlMjU1RFTlMjU0lDClNMRUVLI1RPUkFII0lTUgpUT1JSRSNBTklUQSNMQU8KU1RPT0xQSUdFT04jTEJTCiMjIyNUQURTIyNLQVlFUwpGQUNUT1IjI1NQQU5HTEUKQURPUk4jUFJJT1JUTyMjClNPTE8jUEFJR0UjTE9ERQojI0RPVEVTT04jUEVTT1MKT1VUUE9TVCMjQVJSRVNUClRSVVNTIyNTT05FIyMjIwpUQVIjU0lUVElOR0RVQ0sKQUNLI0VEU0VMI0FVUkFMClZJRSNSRUFWRSNNQVNTRQpBTFkjU09SRVIjRUxBVEU="},{"title":"3/30/00 CARDINAL ANATOMY","author":"by A.J. Santora, edited by Stanley Newman","date":"2000-03-30","grid":"RlJPQ0sjRUxFTkEjRkxZClJPREVPI1lFTUVOI1JPRQpPTkVBUk1FREJBTkRJVFMKIyMjU0VBVCNPTElPIyMjCkFQUEVBTEVSUyNFTEFURQpFQVIjI0xFRVMjI0VERU4KRlJFU0hFVFMjQUxGSU5FCiMjVFdPVEhVTUJTVVAjIwpCUkVBRFMjTUVBVExPQUYKTEVORCMjWkVTVCMjU1BBClRPRERTI0FTU0VTU0VFUwojIyNMRUFQI0lSTUEjIyMKVEhSRUVGQUNFU09GRVZFCkVBVSNUQVRBUyNDRURBUgpEWUUjT1JBTlQjS1JPTkE="},{"title":"3/31/00 ON THE BLINK","author":"by Patrick Jordan, edited by Stanley Newman","date":"2000-03-31","grid":"UkFNUCNBQ0hFI0VUSElDCkFHQVIjTE9PSyNOT09TRQpIRVlJU01ZTEVGVFRVUk4KIyMjVlJPT00jQVJFTkFTClJBRElBTlQjU0xZI0RFRQpBWEVMI0RFQklUIyNTTFIKUElMRUQjI0FMRVJUIyMjCiNTSUdOQUxXT1JLSU5HIwojIyNFQVJFRCMjT1JFT1MKU1NTIyNUV1lMQSNFUklFClRFRSNMRVMjT1VURE9ORQpBUlRJRVIjQUFST04jIyMKWUVTTk9ZRVNOT1lFU05PClVOSU9OI0xFRVIjU1BVRApQQU5ORSNTQVJBI1NBTkQ="},{"title":"4/1/00 SATURDAY STUMPER","author":"by S.N., edited by Stanley Newman","date":"2000-04-01","grid":"U01BWkUjQUxETyNOT0FICktJTkVSI0RPT1JISU5HRQpBRERFUiNST1lST0dFUlMKVFdBUyNCRU5FQVRIIyMjCkVFTiNUUkFZIyNTVFJVTQpSRVRSRUFEI1NUWUxJU1QKU0tFRVQjI0FQQVRJVEVTCiMjI1NIQUdHWURPRyMjIwpXSVNURVJJQSMjVEhJQ0sKQU5UQVJFUyNNSVNUT09LClNDUlVCIyNKT0RZI09BSwojIyNSQVNDQUxTI0ZPTEsKU1RFQUxIT01FI0JJT1RBClRXSU5MQUtFUyNGTE9BVApMT1NUI1dFU1QjQU1PUlk="},{"title":"4/2/00 PLAY BALL!: Celebrating the start of the season","author":"by Lee Weaver, edited by Stanley Newman","date":"2000-04-02","grid":"TEFWQSNTUE9SVCNIQVdFRCNXSElNCkFQQVIjQ0FNRU8jRUxJREUjSU9OQQpTVFJJS0VDQU1QI1JFR0FMI0VNVVMKIyNNRUFORVIjU09TI1NNVUdORVNTClNUSUxURUQjUE9MRUQjI1NPSVJFRQpPV04jIyMjRkFJTExFI0ZJTEVTIyMKVElUTEUjRkFMTEFGT1VMT0YjSVJTCk9OU0VUI09XRSMjIyNHRU4jVE1FTgojIyNTRUNPTkRGSURETEUjSElQUE8KQVNJIyNBTFMjRU5FTVkjU0VFU0FXClJFTkRFUlMjREVMTFMjUkVQUk9WRQpSRVRFTEwjQ0FERVQjQUVSIyNORUQKRVRIRUwjRklSU1RBTkRMQVNUIyMjClNIRUQjUEVBIyMjI1VaSSNBU1NFUwpURUwjT1VUT0ZQT0NLRVQjT0tBUEkKIyNPSEFSRSNEQURPRVMjIyMjR0lMCk9STkFURSMjQVJJQVMjU0FXQlVDSwpDT0dXSEVFTCNSRVMjU0VOT1JBIyMKVFVSSyNJVEFMTyNUSElSRFdPUkxECkFHVUUjTk9ORVQjRUVSSUUjV09PRApMRU5EI0dOQVRTI1JFRUZTI1NTVFM="},{"title":"4/3/00 BOO HOO","author":"by Rich Norris, edited by Stanley Newman","date":"2000-04-03","grid":"RVNDI0ZBTExTI0xBTUFSClNQQSNPTlNFVCNPUkFMRQpTQURFWENVU0UjQVRUSUMKI1JFTFkjI1NQRUQjSU1BCkFSTk8jU1RPVVQjRU5PUwpCT1ojRE9XTlBBWU1FTlQKU1dBSElMSSMjI09CRVlTCiMjI0VWRU4jU0xVRSMjIwpBRERMRSMjI0hBUkRIQVQKTE9XUFJFU1NVUkUjQVBFCkFHRVMjUkFURUQjQVVMRApEQkwjRkFNRSMjQVhMRSMKREFMQUkjQkxVRUpFQU5TCklORVBUI0FNQU5BI0dURQpORVJUUyNTT1JFUiNFWUU="},{"title":"4/4/00 CHOICE WORDS","author":"by Fred Piscop, edited by Stanley Newman","date":"2000-04-04","grid":"SElZQSNSQURJSSNST0NLCkFHT0cjRU1JVFMjQVNIRQpUQUtFSVRPTlRIRUNISU4KRVZFI05FVVQjI0xFQVNUClJFRFNUQVIjQUNJRCMjIwojIyNUQVJTSUVSUyNWSUMKU1BFQUsjI09SQSNQSVRBCkxFQVZFSVRUT0JFQVZFUgpFVFRFI0xFQSMjTExBTUEKREVTI09JTFNUT1ZFIyMjCiMjI1NNRUUjQVJJU0lORwpFU1NFTiMjU1RJUiNST0UKVEFLRUlUT1JMRUFWRUlUCkFSSUQjT0FURU4jSU5TTwpMQURZI09GQVJUI1NFRU4="},{"title":"4/5/00 DIGITAL READOUT","author":"by Bob Lubbers, edited by Stanley Newman","date":"2000-04-05","grid":"VEFTSyNBTU9SI0lNUEVMCkFCTEUjTEFNQSNCUkFWRQpFUklOI0FHRVIjSVNMQU0KTEFEWUZJTkdFUlMjIyMjClNNRUFSI09BU1QjRVdFUwojIyNORUFMI1RFTlNJTEUKQUNII0VOSUQjI0lTTEVUClRIVU1CTkFJTFNLRVRDSApTSU5BSSMjTkFUTyNTVFMKRU5UUkVBVCNNRUxEIyMjCkFTU1QjQ1JBQiNBSVNMRQojIyMjUVVJQ0tXSVRURUQKU05BRlUjQkFJTyNIQU5HClBPRElBI0VSTk8jRVJJRQpBUkFCWSNTRVNTI1JFTkQ="},{"title":"4/6/00 LOOK OUT","author":"by Brendan Quigley, edited by Stanley Newman","date":"2000-04-06","grid":"QVJSQVMjRkxPU1MjUkFQCkxFRUNII0xFUk9JI0VHTwpJRlRIRVJFV0VSRSNQSVAKR0FURUFVWCMjRVZFUlQjCk5DTyMjTk9WRU5FVElBTgpTRU5EUyNSQVQjI0VTVE8KIyMjT09PI05BVEwjQUVSCiNCTElORFNJVFdPVUxEIwpGTEEjR0VPTCNBU0EjIyMKQVVOVCMjUkxTI1RST0xMCkJFQ1VSVEFJTlMjI1JFTwojSkVURVIjI0lUQUxJQU4KQkFMI0ZPUkVWRVJZT05FCldZTyNFVk9LRSNBTExFUgpJU1QjUkVCRUwjQkVFUlM="},{"title":"4/7/00 URBAN SPRAWL","author":"by Eric J. LeVasseur, edited by Stanley Newman","date":"2000-04-07","grid":"U0VWRSNBVFJJQSNQQVJTCk9QQUxPQ0tBRkxPUklEQQpTQU5BTlRPTklPVEVYQVMKIyMjUElSIyMjTlRIIyMjCk9SRVNURVMjUEVTRVRBUwpMT1JFI1NUQUxMI0FSQ1MKRFNPUyNTUFJBWSNUSUFTCk1BVCMjI0VTVCMjI0REUwpBTklNI1NUT09EI0NVRVMKSU5DQSNURU5PUiNIVU1TCkRFQVJTSVIjTllUSU1FUwojIyNTTFIjIyNXQUMjIyMKQU5DSE9SQUdFQUxBU0tBCkRFQ0FUVVJJTExJTk9JUwpET0xMI1BFTkFMI0VUTkE="},{"title":"4/8/00 SATURDAY STUMPER","author":"by Daniel R. Stark, edited by Stanley Newman","date":"2000-04-08","grid":"U1BBTkdMRSNEUk9QTEVUCk1JTkFSRVQjUkVMRUFTRQpBWklNVVRII0VNRVJJVEEKUkFNRU4jRVNBI1NFREVSClRSSVMjRFJBTVMjU09MSQpFUlMjUkVFTlRFUiNVTEUKTk9UU09CQUQjTkFUVEVSCiMjI0hBSUxTVE9ORSMjIwpTQUZFU1QjSEFSRERJU0sKQ05PI1RFTkFDRVMjQkFOCkhPUkEjREFSVFMjQkVURQpFREVOUyNTS0kjTUFSSUEKTVlTVElDUyNDSElMSUFECkVOVElUTEUjQVVSRUFURQpSRVNDVUVSI0xFQVJORUQ="},{"title":"4/9/00 FLAME THROWERS: A number of burnt offerings","author":"by Bob Lubbers, edited by Stanley Newman","date":"2000-04-09","grid":"U0VUUyNSQU5HRSNUUkFQI1BBU1RBCkVMSUEjQU1FUkUjUk9NQSNBTENBTgpDQU5ORUxDT0FMI0FWRVIjRUxFQ1QKVElUVExFI0xCUyNERU4jU0xBTlQjCk9ORUFMI0VJUyNMRVMjRkVMVFRJUApSRUQjI09OVEFSSU8jTUFOQSNFQ1UKIyMjI0xJR0hURVJGTFVJRCNBREFSCkVDSE9FRCMjI1NBRkVTVCNPTkNMRQpNT09SRSNQRVBFI1NJQyNFVFRBIyMKSU5NRSNSRVZFQUwjI1VORE9JTkdTClRJRSNGSVJFUExBQ0VMT0dTI0RJTwpTQ0hPT05FUiMjRE9OQVRFI0FMQVMKIyNFTklEI1lVUCNIQVJFI0VMRU5BClNIQUxMI0JPUk5FTyMjI0FURVNUUwpQSVRZI0NBTk5FRFNURVJOTyMjIyMKSURJI0NBTkUjVU5UQVhFRCMjRkFCClRFTlRJTkcjVU1BI1JBTSNBQk9WRQojQUdFTlQjQlNBI0VUQyNJQkVSSUEKQVdPUkQjVE9VVCNOQVRVUkFMR0FTCkZBSVJFI0FMQUkjRFJFQU0jTEVUVApUWUxFUiNUQUxDI1NFUlJBI1NURVM="},{"title":"4/10/00 JEWELRY BOX","author":"by Lee Weaver, edited by Stanley Newman","date":"2000-04-10","grid":"VVNTUiNGQUlMUyNCT0xUCk1FVEUjSVNTRUkjRU1JUgpQUk9QI0NIQUlOU1RPUkUKI0JSQUNLRU5TI0NST0FLCiMjTUlMTFMjI01BQSMjIwpQQVdORUUjUExBVFlQVVMKRVJBVE8jR1JBRCNTSUxUClRFVCMjQUxPVUQjI05ORQpFVENII0JFTkQjQVNDQVAKUkVISVJJTkcjU0NIVVNTCiMjI0dFRSMjRElDRVMjIwpVVEFITiNDSEVFVEFIUyMKUElTVE9OUklORyNUSUVSCk9LSUUjU0VOU0UjSE9NRQpOSU5BI0ZFVEVTI1NOSVQ="},{"title":"4/11/00 IT'S A GUY THING","author":"by Norma Steinberg, edited by Stanley Newman","date":"2000-04-11","grid":"Uk9BTSNHQUZGI0JBVENICk9OTFkjQVJMTyNBRE9SRQpPVElTI05FQVIjUk9NQU4KVEFLRUFHQU5ERVIjQ0JTClNQRUxMUyMjU1RFRVIjIwojIyNGQVRFUyNBTExVREUKU0hII01BUkNFTCNMSVJBClBJQU5PI0dBRCNDQVNFUwpFUkxFI01PTklDQSNFV0UKREVGQUNFI1NUQVJSIyMjCiMjQVRPTkUjI1JFQURUTwpBTUIjQlVMTFNFU1NJT04KTEFVRVIjTUVURSNDQVJTCkxZQ1JBI0VWRU4jQU5URQpTQUtFUyNSSVBTI0xFU1Q="},{"title":"4/12/00 VAGUE VISTAS","author":"by Rich Norris, edited by Stanley Newman","date":"2000-04-12","grid":"UkVBQ1QjSURJT00jQUNICkFMTElFI0RFTFZFI0NPTwpQTEFDRUtJQ0tFUiNISVMKSUlOI1RPT0sjUkVQRU5UCkRFU0NFTlQjQ0FTRSMjIwojIyNPUkcjQkVMVExJTkUKQUxFQ1MjRkVMTCNMU0FUCkJJTEsjQlVMTFMjTUVSQwpCQUlUI09MSU8jQkVFQ0gKQVJFQUNPREUjREVMIyMjCiMjI0lSTUEjU1VOTEFNUApZRUxMQVQjSlVORSNOT1IKQVhFI1pPTkVERUZFTlNFClBBTiNFV0VSUyNJTlVTRQpTTUEjU05BS1kjVEFMT04="},{"title":"4/13/00 EXECUTIVE SEARCH","author":"by Bob Lubbers, edited by Stanley Newman","date":"2000-04-13","grid":"QVNUUk9TI0NMRU8jQ09QClNQUklOVCNZRUxQI1JDQQpQSUVDRU9GQ0FLRSNFTEkKU05FRSNQSUxGRVIjVE9HCiMjIyNGSVJFUyNBUEFDRQpSRVZFUlQjIyNTVE9DS1MKSVZPUlkjTUFMVEVTRSMjClBBSVIjTU9ORVkjVE9JTAojI0NBRlRBTlMjREVVQ0UKU0NFTkVTIyMjUEFSU0VECkVST0RFI1RBVEFSIyMjIwpMSVYjRE9SU0VZI0JMQUgKREVFI1NMSUNFT0ZMSUZFCk9SUiNPTEVPI0xPVURFUgpNU1MjTkFTVCNBUlJPV1M="},{"title":"4/14/00 SWING TIME","author":"by Patrick Jordan, edited by Stanley Newman","date":"2000-04-14","grid":"TUFDSCNDVUJJVCNCTElQCk9CT0UjQVBBQ0UjUkFHRQpQVVBQWVNUQUlMI0FWT04KU1RZI0FTSVMjTElaQVJECiMjI1NXSU0jVE9SRSMjIwojU0NPTERFUlNGSU5HRVIKQ0hPT1NZI09BRlMjSVNPClJBTlQjI0pBUiMjT05UTwpFUkEjQUxVTSNDVVJTRVMKV0lOREJBR1NUT05HVUUjCiMjI0hFWVMjSFVUUyMjIwpFU1RBVEUjTUFHSSNBVkEKVkVFUiNUSEVZQUxMV0FHCkVYQU0jVEFURVIjRUFTRQpMWVJBI0VXRVJTI0RZRUQ="},{"title":"4/15/00 SATURDAY STUMPER","author":"by Arthur Schulman, edited by Stanley Newman","date":"2000-04-15","grid":"TUFTU0VTIyNDSEFGRVIjCkVOQ0lOQSNUSEFOQVRPUwpTVFVQSUQjSEVCRVRVREUKU0lUI0RBTkVMQVcjREVFCklMRVMjVEVUT04jU0VORApBTExBSCNXSU5FTElTVFMKSEVMTEFTI1NJUlVQIyMjCiNTQVRSQVAjQUFDSEVOIwojIyNCRU5FUyNTQ09QRVMKUEFMT01JTk9TI0FOSU1BCkFQRVgjVElMRVMjU1RBUgpST04jVklUSUFURSNBVEEKSURPTElaRUQjT0REU09OClNBUkFDRU5TI09ORUlEQQojTEVHSVNUIyNQQVJTRUM="},{"title":"4/16/00 TWO FOR DINNER: . . . or breakfast, or whatever","author":"by Shirley Soloway, edited by Stanley Newman","date":"2000-04-16","grid":"I1NBRCMjRkFEIyNPQklTI0RBUklOClNFTEEjI1JVRVMjUEFOVCNBQk9ERQpFUklLI0RBUkNZI0VUVEUjTEFETEUKTUFDQVJPTklBTkRDSEVFU0UjRUVSCklDRVJJTksjUEVJI0VOTElTVCMjIwojIyMjTEFTU08jTkVTVEVEI1JBTUEKQkFHRUxTQU5ETE9YIyMjU1BJREVSCkFMT05FI05BU0EjQUxFQyNBVEFSSQpTTE9UI0NEUiNCQUNPTkFOREVHR1MKU0FORSNBQkUjI1NURUVSRUQjRUVFCiMjI1JPTEUjTUFDQVcjUk9ZUyMjIwpBVEwjQUxBQkFNQSMjTU9OI1RSQVAKQ0hJUFNBTkRESVBTI0lUUyNPT05BClJJVkVUI1NMRUQjQUJDUyNBUFNJUwpFTlJPU0UjIyNTVUdBUkFORFNBTFQKU0VFTiNSRUJBVEUjU09OQVIjIyMjCiMjI1NVTVRFUiNMSUUjRFJPU1NFUwpBTFMjU0FVU0FHRUFORFBFUFBFUlMKVElUTEUjRElSRSNNRVJFUyNPTklUCkFETEVSI0VEQU0jQVNFQSMjRE9DUwpUT09UUyNTRVRTIyNTRFMjI0VSQSM="},{"title":"4/17/00 SHH!","author":"by Lee Weaver, edited by Stanley Newman","date":"2000-04-17","grid":"QkxBSCMjVE9QUyMjSE9UCkJPUkVTI0FMT09GI1VLRQpTVElMTEFOREFMTCNTSVMKIyMjR0FHIyNDT1VDSEVTCiNVU0FCTEUjSEVUVVAjIwpTUkkjU0VBUyNERUJVR1MKUEFMUyNBU1RJI0RJUExPCkFORVcjTUVBTlMjU1BJVApUVU5FUiNSSUNII01JVFQKRVNURUVNI0RVRVMjRUNPCiMjQVBTRVMjUkFLSVNIIwpGQUxTRVNUIyNWSU4jIyMKUklBI1RIRVFVRUVOTVVNCk9SUiNTRUFUUyNSRUFQUwpHWU0jI1NLWUUjI1JFU1Q="},{"title":"4/18/00 SUPPORT GROUP","author":"by Bob Lubbers, edited by Stanley Newman","date":"2000-04-18","grid":"RklERSNBUkFCI1NIQU1TCkFERVMjUkVCQSNDVVJJTwpORVdTUEFQRVJDT0xVTU4KU0FZI1VSQUwjT1JBVEVTCiMjI0dSQVkjQUNFUyMjIwpSQVJFU1QjRUdPUyNEQU0KT0JFU0UjUEFMTyNTVVJFClBPU1RTRUFTT05HQU1FUwpFRElFI0RSRVcjQUxBTlMKREVOI1BJRVMjSUxMU0FZCiMjI0VBVFMjT05MWSMjIwpPVEVMTE8jQU5USSNEQUIKUElMTEFST0ZTT0NJRVRZCkFSTUVUI1RSRVQjQUxPVApMRU9ORSNTT1RPI05BUEU="},{"title":"4/19/00 CORNY","author":"by Fred Piscop, edited by Stanley Newman","date":"2000-04-19","grid":"RkxJTlQjQkFUT04jUkFHCklPTklBI0FST01BI0FHTwpGUklUVEVSQVdBWSNHQVIKRU5UUkFOVCNJTlNIQVBFCiMjI0FSREVOVCMjQU1FTgpUQUZUI09ORSNQRVJVIyMKUklMRUQjREVBTFQjRlJPCkVSQVNVUkUjUk9USUZFUgpFRUsjTUFSQVQjQU5JU0UKIyNFU1BZI1RJUCNJTlRPClNBQlUjI1JFRk9STSMjIwpQUk9QQU5FI0FHRUlTVFMKSVRBI1NJTElDT05DSElQCkZJUiNTQ0FOVCNUQVVSTwpGRUQjVEVYQVMjU0xFRVQ="},{"title":"4/20/00 SPOONFUL OF SUGAR","author":"by Patrick Jordan, edited by Stanley Newman","date":"2000-04-20","grid":"Qk9NQiNIQUxTI0NIVUdTCkFQRVIjT01BTiNIQVpFTApOSVJPI1JFTk8jRU1JTFkKSlVMSUVBTkRSRVdTIyMjCk9NRUxFVCMjRVJHI0JPWQojIyNTS0lFUiNFVVJPUEUKTENEI1NPTUVUSU1FU0lNCkFMSVQjI0lGQSMjQk9ORQpTT1NXRUVURVZFTiNNRU4KRVNDT1JUI1JJR09SIyMjClJFTyNFVEEjI09SSU9MRQojIyNJQ0FOVFNUQU5ESVQKV0VORFQjREFMSSNTRVRICkVYSUxFI0VNVVMjRVRSRQpCT1hFRCNTRUVNI0RPRVI="},{"title":"4/21/00 FOWL FARE","author":"by A.J. Santora, edited by Stanley Newman","date":"2000-04-21","grid":"I0JPUkEjTUVMI1NUUkFQCkdBTUVDT0NLUyNQSE9ORQpIRU5QRUNLRUQjUkVMSVQKSVJJUyNUQUQjUlVGRkxFCiMjIyNURVkjU0lDQSMjIwojRUNMQVQjRE9WRVRBSUwKQVRIT0wjR1VMQUcjUk5BCkNISUNLRU5DT0xPTkVMUwpBTk4jU1dBVFMjT0FURVMKUk9PU1RFUlMjQVNZRVQjCiMjI1BVUkwjQkxFIyMjIwpTQUxBUlkjQVJFI0FTVEEKQ1JBQ0sjU1FVQUJCTEVTCkFHUkVFI0RVQ0tTQkFDSwpUT0FEWSNSQUUjT0FUSCM="},{"title":"4/22/00 SATURDAY STUMPER","author":"by Ed Julius, edited by Stanley Newman","date":"2000-04-22","grid":"I0NIQVJNIyMjQ1JVRVQjCkNSQU5JVU0jQ0hBTk5FTApSQURJQVRFI0xPR0lDQUwKQUREI0xFTkRFUlMjT0NBClNMT0UjU1RPVkUjRURBTQpIRUNUTyNPTkUjT1BFUkEKI1NLRVdFUiNSRVNJU1RTCiMjI1JFViMjI0RUUyMjIwpTUEFOTkVSI0lESU9UUyMKTU9SQVMjRVJSI0FEQVBUCkVNSUwjU1RPT0QjRUJSTwpMUFMjQUxVTU5BRSNCSU4KVE9UQUxFUiNFVENISU5HClNNQVJURU4jUkVIQU5HUwojU0VOQVQjIyNTT05HUyM="},{"title":"4/23/00 IT'S SUNDAY: And we've got something extra for you","author":"by Randolph Ross, edited by Stanley Newman","date":"2000-04-23","grid":"UklCIyNPRk1FI0FCT01CI0FEQU1FCk9ET1IjUkVBUCNTRVZFUiNOT05FUwpUQVhJI0lMU0EjS0VBTlUjSk9ORVMKQ0hJQ0FHT0NVQklUIyNTV09SRVRPCiNPTkVNQU4jTEVOI0VBU0VVUCMjIwojI0dSSU0jUkVPI0FVREVOI09QQUwKV0FSI0RJR0lURk9SR09MRCNTT01FCklCRUcjI0FQVCNVU0VSUyNUVE9QUwpNVUZUSSNHUkVBVE9ORSNUSElSU1QKUFNJT01FR0EjVE9OSSNCUkVUIyMjClNFVCNQVUxQSVRGSUNUSU9OI0VNVAojIyNQRVJFI1JFRlMjSEFUQk9YRVMKTEFSRURPI1JPTkVUVEVTI0FLSVRBCk9SQVRFI1NFTkRBI0hPRSMjU1RFUgpERU1JI1JVQkJFUkJBTkRJVCNDRFMKRUFTVCNVTkJBUiNBVEUjQ0FQTyMjCiMjI1BBTkRFUiNBTFMjTUVMT05TIwpTV0VFVEVSIyNFRElUU1VMTElWQU4KTEVWRUwjRVdFTEwjSE9SQSNTSU5FCk9MSVZBI1NFTlNFI0FMQU4jRUNUTwpFTExFUyNTVEVFUiNUT0xEIyNUQU4="},{"title":"4/24/00 DESK SET","author":"by Norma Steinberg, edited by Stanley Newman","date":"2000-04-24","grid":"REFLQVIjSkVTVCNCQVNICkVSTklFI1VTRVIjQUxUTwpGT09EU1RBUExFI0NMQVAKVE5UI1RPTiNNQUNISU5FCiMjI1JFRCNCQVRIRSMjIwpTVFJBRERMRSNTVUxUQU4KTEVBTiNMT05HI01PUlNFCkVSSUsjRUxERVIjUkFZRQpFU1NBWSNMRU5BI1BJRUQKS0VFTk9OI1JFTU5BTlRTCiMjI0RST1NTI1BPRCMjIwpHQUJGRVNUI0dVUyNJREEKTElMSSNIT01PUEhPTkVTCklET0wjT1ZFTiNFQVJMUwpCQUJFI1dFUkUjU1RFSU4="},{"title":"4/25/00 THE DATING GAME","author":"by Rich Norris, edited by Stanley Newman","date":"2000-04-25","grid":"QUJFUyNNT05LUyNBQ0RDCkNBU1QjRUxJRUwjR0hJQQpBUlRFI01BVEVPI1JFU1QKQ09VUlRPRkFQUEVBTFMjCklOQU5FUiMjU0VYI1NFVwpBRVIjQUlMUyNTUEVFQ0gKU1RZIyNaRUFMI0VSQVRPCiMjI1NFRURPVUJMRSMjIwpTVE9PTCNBTktBIyNBU0UKTEFTU0lFI0VFTlkjTklMCkFSTSNIQVMjI1NNVURHRQojR09PVVRXSVRIQUJBTkcKSEVTQSNTQVRJRSNPTkVBCk9USVMjSU1BR0UjQVRUTgpQU1NUI05JTEVTI1RFU1Q="},{"title":"4/26/00 METALLIC MENAGERIE","author":"by Greg Staples, edited by Stanley Newman","date":"2000-04-26","grid":"U1RJUlMjSEFESVQjSU5LCkFSTklFI1VQT05FI1JFTgpHT0xERU5HT09TRSNPV0UKQUxBU0tBI1BSRVRFTlNFClNMWSNFVFMjI1RFQ0gjIwojIyNHUlVOR0UjUkhPREEKUEFTTyNST09NWSNPUkFMCkVSSU4jQVJVQkEjSVNUTwpXSUxEI0xFR0VSI05FQVQKU0FWT1IjUkVERE9HIyMjCiMjRUxBTCMjU0FUI1BTVApQQVJBQk9MQSNST1NJRVIKQVJGI0JSQVNTTU9OS0VZCkNFTyNJTkRJQSNMSUVUTwpUQVgjVEVFTlMjRVBTT04="},{"title":"4/27/00 DINNER CIRCLES","author":"by Patrick Jordan, edited by Stanley Newman","date":"2000-04-27","grid":"QUpBUiMjU0FSQSNIRVdTCkxPR08jQk9ST04jRVhJVApQSUVCT0xPR05BI1lBTEUKT05FI0tBVE8jTEFZTUVOCiMjI0FSQ0gjR1lSTyMjIwpQQU5DQUtFQklTQ1VJVCMKRVRBVFMjI0FMRVMjQ0lBCkVST1MjQ0FMTFMjQklORwpLSU0jRVJBUyMjUkFOR0UKI1BJWlpBSEFNQlVSR0VSCiMjI09SQlMjT0lOSyMjIwpGT1JNQVQjRkFSTyNQRUEKQVJBQiNST1VOREZPT0RTCk1BR0kjRUFTRVMjRkxBSwpFTFNFI0VLRUQjI1RPTVM="},{"title":"4/28/00 CONTINUING EDUCATION","author":"by Salomon & Frank, edited by Stanley Newman","date":"2000-04-28","grid":"SFVHUyNHRVRTI0JPUkdFCkVUQVMjSU5PTiNVTENFUgpJVFNXSEFUWU9VTEVBUk4KUkVUI0FOSSNPU0xPIyMjCkVSUiNTVFJFVENII0NQQQpTTE9USCNFTlMjT0dSRVMKU1lORSNUTEMjQVJST1dTCiMjT05DRVlPVUtOT1cjIwpCRU1PQU4jUk5BI09ORUQKQUxFUlQjQkVEI0FNUExFCkdJUyNDSEFTRVJTI1JFUwojIyNHQUlUI1JPVCNJQ0kKSVRBTExUSEFUQ09VTlRTClJFUEVMI0VXT0sjU0NPVApTQVRFUyNERVdZI1NFUlM="},{"title":"4/29/00 SATURDAY STUMPER","author":"by Henry Hook, edited by Stanley Newman","date":"2000-04-29","grid":"TExDT09MSiNTTFVSUEVECkFVUkFMRUUjUEFORUlUWQpJTk9SREVSI0FOREFOVEUKUkFOU0FDSyMjVEVQRUVTCkRSWSNTSFlTVEVSIyMjIwojIyNPTUUjUE9SUE9JU0UKU0NFTkVTI0xBTkFXT09ECkNPTUVUI1BPRCNSRUxPRwpPTElQSEFOVCNOSU5FVFkKVEFMTVVESUMjQVNTIyMjCiMjIyNTVU5IQVRTI01FVwpEQU1TRUwjI0JBS0xBVkEKQURPTExBUiNFU0lBU09OCkRFVklBVEUjVEhFUkFLRQpTRUVUSEVEI1NBU1NJRVI="},{"title":"4/30/00 MAKE UP YOUR MIND: A pretty puzzle","author":"by Frances Burton, edited by Stanley Newman","date":"2000-04-30","grid":"UExBTiNBQ1JFIyNTQURBI1BSSURFCkFJREUjU0FJTCNTQURJRSNTRURBTgpDUkVBTVBVRkYjQVRPTVMjQVZBU1QKVEFOI09JU0UjI0ZJUlNUQkxVU0gjCiMjI1RJUkUjU1RFUk4jSE9NRSMjIwpBRE1JUkUjU1dPUkUjU0VOUyNHQVMKRFJPTkUjU0xPVCNTUElURSNBTE1BCkxPVVQjU1RBUiMjI09ORSNHUk9JTgpJTEwjI1BPV0RFUktFR1MjTElTVFMKQkxJU1RFUlMjUkVOVEUjTU9TU1kjCiMjTk9PTkUjU0FTRVMjTEVWRUUjIwojR1JJTkQjUkVUSUUjQ0FMRU5EQVIKTU9PUkUjU0VDT05EQkFTRSMjT05BClJPVUVTI0hBVCMjI0FOVEUjQVZPTgpFREdFI01PUlNFI1BST1MjQ1JFU1QKU1NFI0hFV1MjU0hPUk4jU0hBUkVTCiMjI0xFQVAjT1RBUlkjU0xJVCMjIwojT0NFQU5MSU5FUiMjU0hJTiNBREUKQVJFQUwjQURFTEUjU0hBRE9XQk9YCk1BTlNFI0NPQUxTI1BJS0UjRUxMQQpBTFRFUiNFTExFIyNBUEVTI0RFRU0="},{"title":"5/1/00 POTABLES","author":"by Lee Weaver, edited by Stanley Newman","date":"2000-05-01","grid":"Tk9USUNFI0FMRiNBVE1FCkVNT1RFUiNMRUkjU0VBVApXQVRFUk1FTE9OI1RBTEUKVEhFUkVJTiNTQUxVVEVTClNBRCNBTkRTI05BVE8jIwojIyNBTEVVVCNDSEVXRVIKSkFNQlMjUkFXRVIjRVRBCkVSSUMjTU9USFMjU0xVRwpFTEwjQkFTSUUjU1VTSUUKUE9LSUVTI09SU09OIyMjCiMjR1JBUyNORUVSI0RCTApIT0xJREFZI09OVEFSSU8KQUxBUyNDT0ZGRUVDQUtFClJJU0UjUlVFI0NSRVBFUwpNT1NTI0VSRSNBU1NFU1M="},{"title":"5/2/00 THIRD ROCK","author":"by Fred Piscop, edited by Stanley Newman","date":"2000-05-02","grid":"SVJSI0xBVkEjVEVNUFRTCkNFRSNJUkVTI09KSUJXQQpJTUEjR0lMVCNXRVNTT04KRUFSVEhTQ0lFTkNFIyMjClNLRUVURVIjUkVUUkVBRApURVJNIyNPUEEjI1lBTEUKIyMjUFVQI0VTU08jUkVXCiMjV09STERTRVJJRVMjIwpSTkEjTllFVCNBTEwjIyMKUEVSUCMjTllFIyNJQUdPCk1BVElTU0UjTlVaWkxFRAojIyNHTE9CRVRIRUFUUkUKTUVNT0lSI0JSVVQjSEFTCkNMQVVERSNSQVJBI0VMUwpTSVRURVIjT1BVUyNBREE="},{"title":"5/3/00 LEGWORK","author":"by Bob Lubbers, edited by Stanley Newman","date":"2000-05-03","grid":"WUVUSSNGTEFNRVIjTUdTCkFNQU4jUkVMQVRFI0FSVApQVUJDUkFXTElORyNHQVIKIyMjQVlOIyNOQVRBTElFCkFDQ1JBI0xHRSMjQ0lORQpHUkVFTlRFQSNMQVRFU1QKVE9SIyNSQURJQVRFIyMjCiNXQUxLSU5HVEhFRE9HIwojIyNMT09TRVNUIyNWQVQKQU5OQUxTI1RBSUxQSVBFCkJFQU0jI1NTVCNPTERFTgpBU1RBSVJFIyNPTk8jIyMKU1RVI1JVTk5JTkdXSUxECkVFUiNBU1RVVEUjRVJJRQpEREUjU1RBVEVTI0RFTEU="},{"title":"5/4/00 LITERARY SANDWICH","author":"by Rich Norris, edited by Stanley Newman","date":"2000-05-04","grid":"U0hPVyNDUEFTI1VNQVNTCkNBVkUjQUxTTyNQQVJUWQpPUkFMI0xVSVMjVFJJRUQKV0lMTElBTVNBUk9ZQU4jCiMjI1RSSVAjI09EUyMjIwpDQU5PRVMjQVRUQSNQT0QKQUNFRCMjRUxJT1QjQUJBClRIRU9ET1JFRFJFSVNFUgpDT0QjSlVJQ1kjI05FU1QKSE9ZI0lURVMjUEVLT0VTCiMjI0FCRSMjU0VSQiMjIwojSE9OT1JFREVCQUxaQUMKUEVSRFUjVkVSQiNPRUlMCkFMRVJUI0VWSUwjVEFEQQpOSVNFSSNTQUZFI1NMRUQ="},{"title":"5/5/00 YOU BET","author":"by A.J. Santora, edited by Stanley Newman","date":"2000-05-05","grid":"I0JSQVRTIyNTQ0kjTFNUCldSSVRFUiNBTU9SI0lURQpISUdIUk9MTEVSUyNURUEKQU5JTEUjT0xMQSNJVEVNCk1FREVTI0JJTExGT0xEUwojIyNUQUkjI0FTT05FIyMKQkFCRSNERUVSI1NBSkFLCk9JTCNCT1hDQVJTI09OTwpLUkFBTCNUT1RFI0ZFRUwKIyNDUlVPUiMjUEFSIyMjClBPS0VSRkFDRSNMRUFTVApSQUpBI05DQUEjSVNTVUUKQVRBI1BPVEFUT0NISVBTCkRFQyNBVEVOI1dJTERFUwpPUksjV0VEIyNMQVlFUiM="},{"title":"5/6/00 SATURDAY STUMPER","author":"by Trip Payne, edited by Stanley Newman","date":"2000-05-06","grid":"UkFOQVRFTVBFUkFUVVJFCkFNQU5BUExBTkFDQU5BTApST01BTkhBVE1ZU1RFUlkKSVJFU1QjI1RBRSNBREUjCk5BVCNFQVZFUyNBUkkjIwpHTE9CI0RPUlNBTCNUVUUKIyMjQUlEQSNFWUVMRVNTCkNPU01PUyMjI0VST0RFUwpQSVRTVE9QI05BVEwjIyMKQUxFI09ORURBWSNBU1RPCiMjUFNJI05JTkVCI1RPUgojR09JI1NUUiMjT1BFUkEKTklORVRXRU5UWVNFVkVOCkFMSVZFQU5ES0lDS0lORwpXQVRFUk1FTE9OU0VFRFM="},{"title":"5/7/00 WHEE!: Wherein something new has been added","author":"by Randolph Ross, edited by Stanley Newman","date":"2000-05-07","grid":"SElTU0VTIyNQTFVTSCNQSFJBU0VTCk9ET1VMUyNDUklNRUEjSE9JU1RVUApERU5OSVNXSE9QUEVSI0lOU1BJUkUKR0FPTFMjSElGSVMjRFJBS0UjTEFOCkVUUkUjQ0VERUQjTkVBTFMjSEVTUwpTRUFTSE9SRVMjQkFTRVMjQ1VUSUUKIyMjU0FNRSNTQ09UVFMjVEFSVEFSCkhBVyNST1NTI0FTSCMjUE9SVE8jIwpBU0hPVCNKT0FOTkEjQUFSUCNXUE0KU05JUEUjT1VTVCNOQVJDTyNUSEVPClNFUFQjVEhSRVcjV0VFS1MjWUVBUgpMQVdTI0VOT0NII0hPTkkjT1BFUkEKRVRII1RFTk4jQUxBTk9OI0ZFTExTCiMjSVJPTlkjI0NBTCNUR0lGI1NZUwpURVBFRVMjSU5LSUVSI1dIQU0jIyMKQUNIRVMjRFJBSU4jSU5IQUxBVE9SClBPT0wjUk9BU1QjSVZJRUQjUkFSQQpFVE8jSEFVTlQjUExFTkEjSUNLRVMKU1lSSUFOUyNJTUhFUkVUT1dIRUxQClVQQVRSRUUjTElBTkFTI0NIT09TRQpQRVlPVEVTI1lBVEVTIyNDT05ORUQ="},{"title":"5/8/00 IN THE DOUGH","author":"by Norma Steinberg, edited by Stanley Newman","date":"2000-05-08","grid":"RkVBVCMjI01BU0gjVEFQCk9HTEVEI0JBVEhFI09BUgpST0xMT1ZFUkJBUiNBUkUKIyMjI1JBRElBTCNBU1BTCiNTVEFJTiNTVE9QSVQjIwpDSEFTU0lTIyNNSURNQVkKQVJLUyNUT0FEI1BFQUxFClRJRSNDWUNMT1BTI1NQQQpFTlRSRSNLSVJJI09USVMKUkVIQVNIIyNQUkVWRU5UCiMjRVNUQVRFI0FXQVJFIwpCQUNII1JFTU9URSMjIyMKRVJBI0NSQUNLRVJKQUNLCkVMSyNSSVNFUyNTQURJRQpGT0UjSVNFRSMjI0JPRFk="},{"title":"5/9/00 MARKSMANSHIP","author":"by Fred Piscop, edited by Stanley Newman","date":"2000-05-09","grid":"TUFQUyNDQVBTI1NMVVJQCkFMT0UjSEVFUCNUT1RFUgpDQU1FUkFSRUFEWUNPUFkKQU5PREUjI1BISUxJUCMjCldJTkVTQVAjTkVFI0lUUwojU0FEI0RJUyMjI1BBVUwKIyMjI1BBTlRTI1ZJTk5ZCiNXRUFJTVRPUExFQVNFIwpSQU5HRSNBUlJBWSMjIyMKSU5ETyMjI1lFUyNCT0cjClBFWiNBU0kjRVRIQU5FUwojI09VR0hUQSMjQVJFTkEKUE9OVElBQ0ZJUkVCSVJECk9ORUFMI0hBTE8jSURFQQpNT1NIRSNZUkxZI0VBU1Q="},{"title":"5/10/00 FOOD FOR THOUGHT","author":"by Bob Lubbers, edited by Stanley Newman","date":"2000-05-10","grid":"TUFTVFMjREFJUyNNRVNBClNQWVJJI0VDUlUjQU1FTgpTVFJJTkdCRUFOI1RFTlMKIyMjQ0VSSVNFI0FUUklBCkJBQllTSVQjI0lWRUdPVApUQUxDI1RTRVRTRSNFUkUKVVJBTFMjI01BTk5BIyMjCiMjSEVBRExFVFRVQ0UjIwojIyNTQ1JFRSMjRVFVSVAKTElMI0hFQVJTVCNVUk5TCkFCQVRFRCMjVEFQSU9DQQpCRVJFVCNDTEFJUkUjIyMKRVJJRSNOT09ETEVTT1VQCkxJQU0jQU1PSSNTQ1JBUApTQVRTI0JFVEEjU0VFUlM="},{"title":"5/11/00 THAT'S ENTERTAINMENT","author":"by Rich Norris, edited by Stanley Newman","date":"2000-05-11","grid":"QVRSSVAjU1BBI1NJVE9OClBSQURPI1RSVSNUUk9VVApQSUNUVVJFT0ZIRUFMVEgKQVZJQVRPUiMjU1dFTEwjCkxJTkcjT05TSVRFI0ZJVApMQUcjQUZPVUwjREFSTlMKIyMjUFVUI01JQSNTRUVLCiNCT09LT0ZNQVRDSEVTIwpFTEtTI1BMTyNIQVkjIyMKUlVMRVIjRU5ESVQjSU5BClJFQSNFUkFTRVIjT05FUwojQ0hBRkUjI1RTRVRTRVMKU0hPV09GR1JBVElUVURFClRJTUVSI09CSSNST0xMUwpTUEFTTSNESU4jRVNURVM="},{"title":"5/12/00 SEE 44 ACROSS","author":"by A.J. Santora, edited by Stanley Newman","date":"2000-05-12","grid":"Q0hBVCNBTEUjQVJBQklDCklPTkUjQ09NI0RFTEFOTwpUQUtFU1RXT1RPVEFOR08KRVJBU0UjRVRPTiNORUFUCiMjI1VUQSNJUklTSCMjIwojUEFQQUxPVkVTTUFNQk8KTkFIIyNBUEUjI0lMSUFECkFHT1VUSVMjSU5URU5TRQpUQU1QQSMjUFJPIyNJVFMKT05FU1RFUEFUQVRJTUUjCiMjI1RBTUVSI0hPRyMjIwpUSEVBI0FOQVQjT05TRVQKV0FMVFpJTkdNQVRJTERBCkFUSEVFTCNPQVQjVE9JTApTSElSRVMjTk5FI0VQRUU="},{"title":"5/13/00 SATURDAY STUMPER","author":"by Manny Nosowsky, edited by Stanley Newman","date":"2000-05-13","grid":"T0RETE9UUyNBQ1RFREFTCkJSRUFDSE9GUFJPTUlTRQpUT01USEVQSVBFUlNTT04KQVBPI09BUkxFU1MjSUNICklOQ0wjU0FMQVMjQ0xJTwpORVJPUyNOSUwjTU9MQVIKU1RBWUVET04jVkVOVUxBCiMjVEFMRVMjSkVBTlMjIwpTV0lMTFMjQ1VUTk9JQ0UKUEFDVFMjTEFWI1RST0xMCklTUFkjTElWRUQjU05FRQpOU0EjTEFUSU5PUyNNQUMKRUFSTFlSRVRJUkVNRU5UCkxJVEVSQVJZTElDRU5TRQpTTFlORVNTI0VTVEFURUQ="},{"title":"5/14/00 WATER, WATER EVERYWHERE: But not a drop to drink","author":"by Lee Weaver, edited by Stanley Newman","date":"2000-05-14","grid":"UkFNUCMjS0VQSVMjTEVBSCNBRkFSCkFMQVIjQUlSSUxZI0FOREEjTUlMRQpTVFJFQU1MSU5FRCNQT09MVEFCTEUKUE9TVFBPTkUjI05JUFMjRk9TU0lMCiNTSEVFTlMjQkVFRlMjU1RFUyMjIwojIyNFUkcjRlJBWVMjQ0xPU0VVUFMKU1RVTlMjUEFBUiMjTU9BTiNTUEFUCkNVUFMjUFVERExFSlVNUEVSI1RXQQpBTlQjI0FSRVMjQkFMRVMjVVNIRVIKUkVIRUFURUQjTU9QRVMjQ1JFRURTCiMjRUxERVIjUElORVMjRlJBTkMjIwpDQVJMT1MjTFVDSUQjQ0FVTERST04KQVJJRUwjR0VUQVQjQlJJRSMjRUdPClJFViNGQVJFVEhFRVdFTEwjQkVSRwpPTkVTI1ZBUlkjI1JBVFMjSEFLRVMKQkFST05FU1MjQ0FSTkUjSEFUIyMjCiMjI0xVTVAjQkFMU0EjQ1VSVFNZIwpPTkVJREEjQUxUSSMjQ0FSUEVURUQKUE9OREVST1NBI0JST09LTFlORVNFCkFSSUwjSUhBRCNJTlVSRVMjRVZFTApMQURZI0FPTkUjU0FURUQjI0RFU0k="},{"title":"5/15/00 EASY AS PIE","author":"by Bob Lubbers, edited by Stanley Newman","date":"2000-05-15","grid":"RVJBUyNSRVBBU1QjSURBCkxBU0gjQU5JU0xFI05JWApVUlNBI0JPVFRPTSNURUUKREVFUERJU0hBUFBMRSMjCkVTVEVFIyMjUkVUSVJFRApTVFMjTEFTVCMjU0FDUkUKIyMjSEVMTEVORSNOT0VMCiMjQk9TVE9OQ1JFQU0jIwpGQUlSI0FCU09SQlMjIyMKQVJSQVMjI0VTU08jUlRFClJFRENBUFMjIyNMRUVSWQojI0xFTU9OTUVSSU5HVUUKVEVBI09SSU9MRSNPTkVMCkFOTiNBVFRFU1QjTEFURQpKRUQjTkVTVEVEI0FMT1Q="},{"title":"5/16/00 IT HAD TO BE HUE","author":"by Richard Silvestri, edited by Stanley Newman","date":"2000-05-16","grid":"QUdBUiNFTEJBI1dBREVECk1BTEkjUk9BRCNBUk9NQQpCSUxMWVJPU0UjTEVOSU4KSVRBTElBTlMjT1JBQ0xFCiNTSEVFTiNPTlJVU0gjIwojIyMjTFREI0FSUyNFUkcKQUNSSUQjUkVNSSNDUkFNClNISU4jVEFQSU4jT1JDQQpUQUNLI0VHQU4jRE9ZRU4KQVJLI0FQTyNHU0EjIyMjCiMjSU5URU5EI0NJR0FSIwpESUxBVEUjUkVBTElaRUQKRVZBREUjSEFSUllSVUJZClNBS0VTI0FQU0UjVFJFRQpJTkVSVCNXRUVEI0hFTEQ="},{"title":"5/17/00 ON THE BEACH","author":"by Rich Norris, edited by Stanley Newman","date":"2000-05-17","grid":"SFVNSUQjTUVTQSNPQkFECkFUT05FI0FHRVIjV09SRQpTQU5EQkFHR0VSI0VSSUMKVEhBSSNUQVNURVMjTlNBCiMjTEFQQVojSEFZU0VFRApVUkkjT0xJVkVSU1RPTkUKUEFTQURFTkEjU1RVIyMjClNOQUcjI0VTUyMjTUVSRQojIyNFQVIjRVFVSVBQRUQKQ0hBTk5FTFNVUkYjSE1TClJFRFRBUEUjQUlTTEUjIwpBUkUjVEFUVExFI0FNRVMKWUVMTCNTSEVMTFNURUFLCk9CSUUjVEFSRSNURVJSQQpOWUVUI1NMSUQjRVhBTFQ="},{"title":"5/18/00 SNOOZE BREAK","author":"by Patrick Jordan, edited by Stanley Newman","date":"2000-05-18","grid":"U1RFVCNTRUxMUyNTQ0FUCkxPUEUjVFJFQVQjRUFWRQpBTklOVkVOVElPTlVTRUQKVklDVElNI0dST1VTRVJTCiMjI0hPV1NPI0dBU1NZIwpET00jTEFQI0dFTiMjIyMKT0JFWSNSSUZFI0NIQVNFClRPV0FLRVRIT1NFT0ZVUwpTRUxNQSNFQVJMI1RBTVAKIyMjI0hPRCNHVVMjUk9ZCiNUT0FMTCNWRUdBUyMjIwpTQU5HVUlORSNBR0FUSEEKV0hPSEFWRU5PQkFCSUVTCklPTkEjRVhVREUjTEVBSwpURUVTI1NURUVEI0VSUlM="},{"title":"5/19/00 SEE YOU LATER","author":"by A.J. Santora, edited by Stanley Newman","date":"2000-05-19","grid":"QU5EWSMjRkxJQyMjQ1VECkxZUklDI0FTQ1VTI1VOTwpBQ1VQVU5DVFVSRSNSVEUKTVRNI0NPRVMjUkFQVE9SCkJJU0NVSVQjUElMRUEjIwojIyNVTUEjQUxFI0NJTkUKI1NPUkIjI0NVUkNVTElPCkJPQ0NFI0dVTSNVTEVORQpDVUNVUkJJVCMjUklERSMKU0xVTSNFUkUjQUxBIyMjCiMjUEFQQUwjQ1VJUkFTUwpFUkFTRVIjTlVOQyNCQUgKVE9OI0FDQ1VMVFVSQVRFCkNVVCNTVUVERSNFQVNFRApIRVMjI0JFRVQjI01FU1M="},{"title":"5/20/00 SATURDAY STUMPER","author":"by Brendan Quigley, edited by Stanley Newman","date":"2000-05-20","grid":"R09UTUlMSyNCQVRHSVJMCklSRUNLT04jQUxJRU5FRQpSRUxJRVZPI1RBTk5FU1QKQUdFI0FFVEhFUiMjUkVTClNBWEUjU1RFIyNKRVRFUwpPTkVORCNTRVRTQVNJREUKTE9ER0VEIyNMQUNUQVNFCiMjI0FORVcjQ0FLRSMjIwpTVEFSVFRPIyNCQUxTQU0KVFJBREVTT0ZGI0xMQU1BClJJTUVEIyNBT0sjRUxBTgpFTEkjI01JTlVJVCNJU0EKQUxMT0ZVUyNHUkFZRVNUCktJTkRFU1QjSE9OT1JFRQpTTkVFWkVTI1RWR1VJREU="},{"title":"5/21/00 SHORTHAND: A different kind of double-letter theme","author":"by Frances Burton, edited by Stanley Newman","date":"2000-05-21","grid":"U0FQUyNBQkFURSNTQUxUI1BPU1NFCkFMSVQjTEVWRVIjUExJRSNFUElDUwpSRUFSI0lSRU5FI0VPTlMjVElOQVMKSUNGSU5HRVJTIyNSVUFTS0lOR01FCiMjI0RJTlRZI0JZUkRTI0FURSMjIwpBTkdFTEVTI0RFV1kjI1RSRVNTRVMKREFSTkVEI1ZJTk8jRVRBTCMjSEFMCkRJRVRTI0hJTkRVI1JBTiNNRUVTRQpFVkUjI1NPUkUjTFNBVCNCT1NTRUQKUkVOVCNDUlVTQURFUyNNT1JUQUwjCiMjV0FHT05TI1JJTSNTT09ORVIjIwojTUlORVJTI0hJQklTQ1VTI1NFRVMKQkFUVEVOI05BREEjTEFTVCMjQU5UCkVUSEVSI1NPVCNOT09ORSNGQUxTRQpMRU4jI0pBREUjR1JBUyNCQVNRVUUKTE9WRUJVRyMjV1JFTiNKT1VTVEVECiMjI1JJRCNTVEFZUyNQRU5ORSMjIwpPR0lNUE9PUEVEIyNGUkVFQU5ERVoKTU9WSUUjV0FORSNGQUlSUyNUT0xFCkFORU5EI0VERVIjQUlNRUUjRVRBUwpST1NFUyNTRVRTI0FMRVJUI0RFTlQ="},{"title":"5/22/00 CAN WE TALK?","author":"by Norma Steinberg, edited by Stanley Newman","date":"2000-05-22","grid":"QUxUTyMjI0JBV0wjR0lOCkJPT0VEI0FFUklFI0FETwpFWFBSRVNTTElORSNSRU8KIyMjI0JBSUxFRCNTREFLCiNCSk9STiNTTFVJQ0UjIwpHUkFOQURBIyNQUkFOQ0UKUkVCQSNSVURFI0FOU0VMCkFNQiNXQU5OQUJFI1RBRApQRUVWRSNUQVRBI0VBU0UKRU5ST0xMIyNTVEFSVEVSCiMjV0lERU5TI1RSRUVTIwpTSE9EI0dPQVRFRSMjIyMKSE9DI0hBU0ZJTkFMU0FZCklSSyNTVEVFUCNTQVVDRQpQQVkjVE9TUyMjI0JFVFM="},{"title":"5/23/00 BOOKMAKING","author":"by Rich Norris, edited by Stanley Newman","date":"2000-05-23","grid":"Q09VQ0gjU0VSQUMjQkJTCkFMUEhBI0FSRU5BI09MRQpQQVBFUlBST0ZJVCNSQVcKRVZFI0JFR1MjI0FNQVpFCiMjUkhPTkUjUkVMQVhFRApUU0hJUlQjUkVEWUUjIyMKVUxBTiMjT0FTRVMjU0FTCkJJTkRJTkdDT05UUkFDVApBREQjQ0FSRVcjI0FOTkUKIyMjRkVURUQjUkFJU0VSCkFQUk9QT1MjQk9ORFMjIwpBUlVCQSMjUFVUVCNFT04KUklQI0NPVkVSQ0hBUkdFCk9ERSNLTkFDSyNFWElMRQpORUUjU0VOU0UjUkVGRVI="},{"title":"5/24/00 ON THE GRIDIRON","author":"by Bob Lubbers, edited by Stanley Newman","date":"2000-05-24","grid":"U0NBRFMjU1BBI1NUUkVXClRPTkVSI1RBQiNUUlVMWQpFTkRQQVBFUlMjUklOU0UKUEVTTyNBUkMjRE9ER0VTCiMjI1NJUkVFI0lWRSMjIwojI0xJTkNPTE5DRU5URVIKQkxVVE8jI1NPVCNUT1JFCkVFUiNOT0cjUkFFI1JJQQpFVkVTI1dBUyMjTEFURVIKRklTSElOR1RBQ0tMRSMjCiMjI0FERSNSRUJFTCMjIwpCQU5URVIjQVJFI0VMTU8KRVZJVEEjR1VBUkRSQUlMCk5PTkVUI0VTVCNBR0lMRQpTTk9SRSNUU0UjR1lST1M="},{"title":"5/25/00 FREEZE FRAME","author":"by Ray Hamel, edited by Stanley Newman","date":"2000-05-25","grid":"UEFOREEjUEFORyNHTUVOCkFMSUVOI0lTRUUjUk9MRQpTUExBVCNBVElUI1VSU0EKVEhFTElPTklOV0lOVEVSCiMjIyNPTk8jI09BVCMjIwpUSEVJQ0VTVE9STSNEQUIKRUFSVEgjI0hSUyNMVUdFCk5JTkUjU1BSRUUjT0JJVApTTElNI0NPTyMjU0NBUkUKRVNFI1RIRUJJR0NISUxMCiMjI0FJTSMjUkFIIyMjIwpDT0xEQ09NRk9SVEZBUk0KQVJFQSNPUkFOI0lPTklBClNDQU0jWkVSTyNDUk9OWQpIQU5TI0VERU4jS0FOR0E="},{"title":"5/26/00 CORNBALL","author":"by Fred Piscop, edited by Stanley Newman","date":"2000-05-26","grid":"QVRJVCNGQVJBRCNJTVVTCkZBUlIjQUxBTU8jTkFOTwpUWVJVU1JBWU1PTkRDT0IKRUxFQ1QjUkVBREUjTElCClJPR0VSIyMjTkFNI0FMRQpTUlMjT01JVCNIT0xJRVIKIyMjRUxJU0hBIyNBTkQjCiMjV0lMTElFTUFJWkUjIwojUEFSIyNTVEVSTkUjIyMKQVJMRU5FI0FOVFMjR0JTClBVVCNFTEkjIyNJRElPVApBRFojSEFOR1MjRE9OSE8KVEhFTElUVExFS0VSTkVMCkhPUkEjRVJFQ1QjTUlNSQpZRVNNI0RPTlRTI1NFRUQ="},{"title":"5/27/00 SATURDAY STUMPER","author":"by Lee Weaver, edited by Stanley Newman","date":"2000-05-27","grid":"I0ZFTUFMRSNTV0VBUlMjClJPTUFOT1YjUEhBUkFPSApBUFBSSVNFI1JFVElUTEUKQ1BBI0xFTlRJTFMjTElMCktJVFMjU1RBTksjRElETwpVU0hFUiNVTFQjQkVORVQKUEhZU0lDQUwjQlJJRVJTCiMjI1NPVUwjU1VFVCMjIwpPTlNJVEUjVEVSVElBUlkKUkVFTFMjVVJFI1RFUEVFCk5BVkUjRVRVREUjU1BDQQpBVEUjU1FVRUxDSCNMQVMKVEVORk9VUiNFTElUSVNUCkVOVFJBSU4jU0FUSUVUWQojU0hBUlBTI1NUQU5EUyM="},{"title":"5/28/00 SEW WHAT: Things you'll need to put it all together","author":"by Bob Lubbers, edited by Stanley Newman","date":"2000-05-28","grid":"UEFTVEFTI0FMQVcjS1BTI0RFVEVSCkVMTUlSQSNSSUdBI1JPRSNPQ0hSRQpTVElSSU4jTU9VU1NBS0EjTk9JU0UKVEhSRUFEU09ORVNXQVkjUEFMTUVECkVFS1MjTEFSUyNBSUwjQ0FMRUIjIwpSQVkjQk9XIyNESU4jUEFSRCNMQU8KIyMjTUFURVJJQUxHSVJMIyNCRUxBCkFTUElDI0RPTEwjI0RPTUlOQVRPUgpTTElOSyMjU0tJTU1FRCNNVVNIRVMKSE9ORVNUQVMjI0FSUyNTUFJFRSMjCkVUUyNXQVNJTlNUSVRDSEVTI0FQRQojI0FCRVRTI0FJUiMjUkVMRU5URUQKQ0FOQVBFI0ZPTElBR0UjI01FRVNFCk1JRFNUUkVBTSMjTkFTQSNBQVJPTgpERU5TIyNTQ0lTU09SU0dSSVAjIyMKUkFFI0tFUFQjS0lOIyNPSUQjRU1UCiMjRUJPTlkjRUVOI0VVUk8jQlJJRQpBRERFUlMjRkxJR0hUUEFUVEVSTlMKSEFMTEUjRE9XTkxPQUQjRVJSQU5UCkFERUxBI0VSQSNFU1BPI1JFTk5JRQpCQVNJTiNSRVkjU0VFUyNTRUVERUQ="},{"title":"5/29/00 FAST TRACK","author":"by Salomon & Blackard, edited by Stanley Newman","date":"2000-05-29","grid":"UEVTQ0kjQVNBUCNUVkFECkVWSUxTI0JFUlQjSE9NRQpaRVRBUyNCTEFCI0VHT1MKIyMjUlVOT0ZCQURMVUNLCk9JTElFU1QjI1JPTUVPUwpBVk9OI0FUTEFOVEEjIyMKVElNRUQjI0FHVUUjU0FTCkhFQVRPRlRIRU1PTUVOVApTU04jTU9PVCMjTklOTlkKIyMjQklPTklDUyNTT0lMCkNMSUVOVCMjT0FLVFJFRQpEQVNIT0ZQRVBQRVIjIyMKUlVMRSNBTFRPI0FJREVTCk9SRVMjTElFVSNUQUlOVApNQVNUI0xFU1QjU0xFRFM="},{"title":"5/30/00 DESCRIPTIVE LETTERS","author":"by Bob Lubbers, edited by Stanley Newman","date":"2000-05-30","grid":"U1RPQVMjSEFSTSNHUkFECkFFUklFI09ORUEjUk9WRQpHUkFERUFNSUxLI0FNRU4KRVJOI0RVRVQjRUFURVJZClJBR0dFRCNBRk9SRSMjIwojIyNFUklDI1RSSURFTlQKRE9JTiNTQ0FSI0VNQ0VFCk9TSEVBI0xCTyNMT0NVUwpXSEFSRiNBVE9QI1ZFTlQKREFEQUlTTSNQRVJJIyMjCiMjI1RSQVBQI0RFRVBFTgpEQU5JRUwjQUxBTiNSRU8KT0xFTyNNT0RFTFRGT1JECk9NQU4jT0REUyNBUk5JRQpNQVJYI05BWVMjTE9HRVM="},{"title":"5/31/00 BIRD CALLS","author":"by Norma Steinberg, edited by Stanley Newman","date":"2000-05-31","grid":"SURMRSNCQVRIIyMjQkFECk5PT04jRVJST1IjVElMRQpDT09ERUdSQUNFI1dBVkUKQU1QI1JFQVAjQ0FFU0FSCiMjI0NJVFkjQkVURSMjIwpTQVNIRVMjU0lERVRSSVAKT0JPRVMjTUFERSNISURFCkZBREUjQ0FWRUQjRURFTgpBU0FQI09NRU4jU0FHQU4KUkVTVE9SRUQjUFVSRUxZCiMjI1JVU1QjTEFTVCMjIwpUQUhJVEkjQVVSQSNXT08KRVJJQyNDT01NT05DQVdTCkxJTksjQVJJRUwjUElMTApMQUQjIyNHRU5FI0FMU08="},{"title":"6/1/00 PHOTOG'S NEEDS","author":"by Rich Norris, edited by Stanley Newman","date":"2000-06-01","grid":"U1RBQiNDRUFTRVMjSkVECkFSR08jQVJERU5UI09YWQpMSUdIVEJSRUVaRSNWSU4KU1BJUkFMI1NLWVdSSVRFCkFTRSNYRUQjU01FRSMjIwojIyMjSUNFRCNFREFNRVMKQU5BI05BTUVTIyNDT0NBCkJBQ0tHUk9VTkRDSEVDSwpCSUVOIyNTQ09SRSNURUUKQUZSSUNBI0VCQU4jIyMjCiMjI1NPRFMjU0dUI0JBRwpTRU5IT1JBUyNTRUNVUkUKUFJPI01PREVMVFJBSU5TCkFMRSNCSUxMSUUjU0xBVApNRUwjU1RZTEVSI0FEWkU="},{"title":"6/2/00 LOW VISIBILITY","author":"by A.J. Santora, edited by Stanley Newman","date":"2000-06-02","grid":"QVJST1cjQ0FTSCMjU0VBClNFRU5PI0FSSUFTI05BUApBU1RJUiNMSUdIVFNPVVQKTUVBTkRNWVNIQURPVyMjCkFBUiMjQVhFUyMjU1BBUgpOVURJU00jIyMjV09MRkUKIyMjTkFNRVNBS0UjT1JFClRBS0VTQURJTVZJRVdPRgpBUkkjU0xPQkJFUlMjIyMKQ0FORFkjIyMjVFNFVFNFCk9HR0kjI0RJU0MjI09QUwojI0tFRVBJTlRIRURBUksKQ0xPVURFRFVQI0tBVElFCkhBTiNBR09SQSNFTUVFUgpFR0cjI1NURVQjU0VFUlM="},{"title":"6/3/00 SATURDAY STUMPER","author":"by Fred Piscop, edited by Stanley Newman","date":"2000-06-03","grid":"IyNUUklCQUwjQUNUU0FTCiNQUkVDSVNFI1NIT0FMWQpNRUFDVUxQQSNDQVJOQUMKSVJWIyNLSURET1MjVEJBCkFNRU5TI1JJT1QjU0lBTQpTQUxBQU1JTkcjVEVBTU8KIyMjUFJPTkcjSEFOR0FSCkJBQ0tUT1NRVUFSRU9ORQpBTEhJUlQjVU5JVFMjIyMKU1BJTkUjREVUUkFDVEVECkVBVFMjTUVTSCNSRUFWRQpOQ0MjQVVTVFJPIyNLRU4KSklIQURTI0lPTklaRVJTCklOQVBJRSNPTkVGT09UIwpTT1RURUQjTkVMU09OIyM="},{"title":"6/4/00 TRAINING SESSION: Enjoy the ride","author":"by Fred Piscop, edited by Stanley Newman","date":"2000-06-04","grid":"U1RBUkUjRkxFQSNTQUxUI0VKRUNUCkFSTEVOI09FTk8jQVJJRSNSQVNUQQpTT1VORFRSQUNLI0xVTUJFUllBUkQKRU5NRVNIRUQjU1dBQkJFUiNMSVNBCiMjIyMjRVJTRSNJTUEjVElHRSMjIwpBTFVNSU5VTVNJRElORyNUT05JVEUKQk9ORVMjTkFDUkUjI1JFUk9PVEVECkFSQU1JUyNOQU0jRVhJTEVEI1NSQQpCQVJPTkVUI1BBUlRZUExBVEZPUk0KQU5ZIyNST0JFI09PWkUjI1JBS0VTCiMjI0dBQkxFI0JPTiNST0JZTiMjIwpTTEFNUyMjTkFQUyNUU0FSIyNTTkwKUElUQ0hJTkdDT0FDSCNST1NFVEVBCklUVCNCT1JBVEUjQVJTI01JUklBTQpUUklCVU5BTCMjRlJBTksjVElMVEEKU0VDVVJFI1NVUEVSQ09ORFVDVE9SCiMjI05ZU0UjTkVFI0VXRVIjIyMjIwpTTEFHI0NSVVNBREUjQkxBTktFU1QKQ09MRVBPUlRFUiNHT0FMVEVOREVSCkFMREVSI09ORUwjSURMRSNTRUlORQpCTEFTRSNMRU5TI1NPTEQjU0VFRFk="},{"title":"6/5/00 OOPS!","author":"by Norma Steinberg, edited by Stanley Newman","date":"2000-06-05","grid":"UkVMWSNBSkFSIyMjVElQCklCSVMjUklMRVkjVE9ORQpGQUxMSU5MT1ZFI1VSTlMKRllJI1RFVEUjQUxNT1NUCiMjI1RFU1MjRFJBQiMjIwpTV0FSTVMjSEFORExFUlMKV0FSSVMjU09SRSNFTElBCkFUT1AjVVBQRUQjV0lORwpNRVNII05FRUQjQ0VBU0UKUFJFQUNIRUQjVEhFU0VTCiMjI01PT0QjR1JJUCMjIwpUUkVNT1IjQ0FBTiNNSUEKSE9MRSNTTElQQ09WRVJTClVTU1IjRVNURUUjSU5LUwpEWUUjIyNURURTI01VU1Q="},{"title":"6/6/00 FEET FIRST","author":"by Lee Weaver, edited by Stanley Newman","date":"2000-06-06","grid":"QUJBU0gjU0NBTSMjQkFBClBFV0VFI0FMVkEjQk9ORwpTQU5EQUxXT09EI0FPTkUKT05TQUxFI0RJUkVDVE9SCiMjI1RFVEUjREFSS0xZIwpDQVBFUklORyNTT0xFIyMKVVJVIyNOT1JBI0RPR01BCkJVTVBTI0xBQyNFR0dFRApBTVBMRSNBUEVTIyNFVEUKIyNBQUFTI0VSQVNVUkVTCiNTQ1lUSEUjQlJBTiMjIwpDQVRCT0FUUyNBRkxBTUUKT0xJTyNNVUxFSEVBREVECkNMT1kjRURBTSNTQ09MRApBWU4jI0RFQlMjVEVTVFk="},{"title":"6/7/00 UNSTEADY","author":"by Bob Lubbers, edited by Stanley Newman","date":"2000-06-07","grid":"VU5JUyNIQU0jI1lPVVRICk5JTkUjRURBUyNBTFRFUgpJU1RTI0FVTlQjUkVBRFMKVEVFVEVSQk9BUkQjIyMjClNJTEVOVCNSSU8jU1NUUwojIyNUR0lGI1JFRENPQVQKQUNDI0FFT04jI0lPTklBClBMQVlHUk9VTkRTV0lORwpTSVJFRSMjTkFSQyNBVEUKRVZBTkRFUiNQQUFSIyMjClNFVFMjVElTI0dSQVBFUwojIyMjUk9DS0FORFJPTEwKUEFJR0UjRUlSRSNFTEVFCkFTSUFOI1NFTlQjU0FORQpDSElMRCMjU09TI1RSQVA="},{"title":"6/8/00 LEADING MEN","author":"by Rich Norris, edited by Stanley Newman","date":"2000-06-08","grid":"U1RBWSNOQkMjU1BST1VUCkhPVkUjT1JCI1BMRUFTRQpPUEVOI1ZJRSNSQVRUQU4KR0VOVExFQlJFRVpFIyMjClVLVUxFTEUjTEVBTlRPUwpOQUUjVElEQUwjU1RPVkUKIyMjQlVTI0JJQiNJQkVYCiNDSEFQVEVSRUxFVkVOIwpFUklDI1NMQSNJUkUjIyMKUkVFS1MjQU1PTkcjQURBClJFRFNLSU4jQURPUFRFRAojIyNMQURERVJTVElUQ0gKQk9OSVRPI05JUCNDQVJFClNXRURFTiNPTk8jQUNFUgpBTEJFUlQjU0dUI1NLRUU="},{"title":"6/9/00 ALCHEMY","author":"by Eugene W. Sard, edited by Stanley Newman","date":"2000-06-09","grid":"U0xBVyNOQUJTI0NSQVRFCk1FUkUjRVRSRSNPSUxFUgpFVklMI01FQU4jQ1NQQU4KTEVBRExFQUtURUFLIyMjCkxFUyNBU1NFUlQjWUFXTAojIyNCUklFI0lURSNDSEkKT1NJUklTI1RFQU1URUVNClNJREVBI1RBUyNQQVRUSQpURUVEVE9FRCNBVE1PU1QKRU5TI1NMQSNTTElQIyMjCk9BVFMjR1JBQ0lFI1RTRQojIyNUT0FER09BREdPTEQKQkVSRVQjVVJMUyNBR09HCk1BT1JJI0NFREUjVEFQRQpXUkVOUyNURVNTI1NFRVI="},{"title":"6/10/00 SATURDAY STUMPER","author":"by Brendan Emmett Quigley, edited by Stanley Newman","date":"2000-06-10","grid":"V0hJWktJRCNSRU5BTUVTCkhJTEFJUkUjQUxJTUVOVApBRE9OQUlTI1RBUElOVE8KTEVWWSNTUEFTTVMjT0hPCkVPRSNDSE9XIyMjRFJVRwpSVUxFUiNURUUjTEVBU0UKU1RBTEFHI1NQTEFTSEVTCiMjI0FGT1JUSU9SSSMjIwpBR0xJVFRFUiNCSUdNQUMKQ1JPTlkjR1VUI0FORU1PClJJTEUjIyNDSEFUI0RFUgpFTEwjV0lDS0VSI0VVUk8KQUxJREFERSNIRUFEU0lOCkdFTkVSQUwjQVRQRUFDRQpFREdJRVNUI0pFRVJTQVQ="},{"title":"6/11/00 SHOW YOUR METTLE: Here's your chance to shine","author":"by Shirley Soloway, edited by Stanley Newman","date":"2000-06-11","grid":"R0FMQSMjTE9ERSNRVUlUUyNHQVNQCkFOT04jU0FMT04jVU5EVUUjT0RPUgpQSU5UI0FNRU5EI0FCQVRFI0ZPUkUKU1RFRUxNQUdOT0xJQVMjI0ZPUlRTCiNBUkxFUyNTQVJPTkcjUEVFUkVTUwojIyNPTk8jIyNTR1QjUklWRVQjIyMKVElOUEFOQUxMRVkjQkFORSNIQUZUCkFMT0UjI1NPWSMjRkxJRVIjRVJMRQpNSVIjQ09QUEVSSEVBRCNUQUdHRUQKU0VBU0lERSNTRUVUSEUjI1dPT0RTCiMjI0lERU5UI0FMSSNSSVZBTCMjIwpBRERMRSMjUlVERVNUI05FUkRJRVIKTE9VVlJFI0lST05IQU5ERUQjTEFPCkFOTkUjTEFWSU4jI0xFSSMjUElUUwpORUVSI0lERVMjQk9MREFTQlJBU1MKIyMjU0VUQVQjT1JSIyMjT1JPIyMjClRSQVBQRVIjQVJBQklDI1JFVElFIwpBVVRPUyMjUExBVElOVU1CTE9OREUKSU5UTyNQRVRJVCNTQVJFRSNDT0lOCkxPQU4jRVJBU0UjT05FQVQjT05UTwpTTlJTI1BBU1RTI05FU1QjI0xFU1M="},{"title":"6/12/00 GROUP THINK","author":"by Norma Steinberg, edited by Stanley Newman","date":"2000-06-12","grid":"SEVBUCNNRUFMIyMjSlJTCkFSTE8jQUxCRUUjQkVBVQpMSVRURVJCVUdTI09ESU4KTEVPI1JPT1QjVEFYSU5HCiMjI0JST1cjVkVOSSMjIwpTSEFST04jQkxBRE5FU1MKVElNT1IjU0VMTCNHUkFNCkVMTU8jU1BSRUUjUkVORQpBTEFEI0hJTFQjRElDVEEKRFlOQU1JVEUjV0lOVEVSCiMjI0JFTlojQklORyMjIwpTVE9PR0UjVElERSNNQU8KVFVUVSNSVUJCRVJCQU5EClVOSVQjU01BTEwjVU5UTwpCQVMjIyNQUkVZI1NFRVI="},{"title":"6/13/00 TITLE SEARCH","author":"by Randolph Ross, edited by Stanley Newman","date":"2000-06-13","grid":"VEVNUFMjQ0hFU1MjTVJJCkFSSUVMI1BFQUNFI1JBRApNUlNST0JJTlNPTiNCSUwKQVNUVVRFI1NFUEFSQVRFCiMjI1NDQVIjREVURVNUUwpERU1FQU5FRCNET01FIyMKT1JTI1JFTEVUI1JVQklOCkNPTUIjRElNRVMjU0FMRQpLT0FMQSNDT05DSCNMSUUKIyNHSVJEI1NUUk9MTEVEClNXQVRURVIjSEVSRSMjIwpQSVpaRVJJQSNBTkdMRUQKQUxJI01JU1NBTUVSSUNBCkRFTiNJREVTVCNURU5PTgpFWUUjU0VSVEEjU0VBTFM="},{"title":"6/14/00 CANE KIN","author":"by Bob Lubbers, edited by Stanley Newman","date":"2000-06-14","grid":"I0xBU1MjUEFMUFMjS09QCkNBREVUI0FESUVVI0lSQQpBVE9ORSNTRUFQTEFORVMKSEVSREVSU1NUQUZGIyMjCk5ORSNQRUcjIyNBRkFDRQpTVEVNI0xPU0VSI0lWQU4KIyMjSUNFI1BPT1JORVNTCiNDSU5OQU1PTlNUSUNLIwpMSUNFTlNFRCNTRVQjIyMKU0FBUiNFTEVNSSNZQVdTClRPTkFMIyMjQU5JI1JPSQojIyNMSUdIVE5JTkdST0QKQ09OU1RSQUlOI1RPQUxMCkRVRSNISUxEQSNSQU5FRQpTVEUjRVNURVMjQVRUTiM="},{"title":"6/15/00 IN THE BAG","author":"by Rich Norris, edited by Stanley Newman","date":"2000-06-15","grid":"R05BVyNDTElQI0pVTUJPCkxBTEEjUkFDRSNVTklPTgpPTkVMI0VWRU4jUkFLRVMKQkFDS1NFQVREUklWRVIjCiMjI09BSyMjI0lTTyMjIwpTSElOUyNHUkFOVFdPT0QKV0FII0hBUkFTUyNFUk5PCkFWRUMjREVOVEUjRElFVApOT0FII1JFVE9SVCNFQVQKU0NSQVBJUk9OI0hPTExZCiMjI1JFRiMjI0JBUiMjIwojUk9BU1RCRUVGV0VER0UKQlVORFQjQVhFTCNHQUxBCkVMSUVMI0JFTEEjT0RPUgpERU5TRSNBU1NUI05FV1M="},{"title":"6/16/00 MUSKETEERS' MOTTO","author":"by Randall J. Hartman, edited by Stanley Newman","date":"2000-06-16","grid":"QUxBTiNHQUIjU0VDRURFCkxPV0UjUk5BI1RSQURFUgpGT09UQk9ORSNSQU5HRVIKSU5LI09WRVIjQVNURVJTCkVZRSNMRUEjSU5FIyMjIwojIyNST0xMSU5HU1RBTEwKQ0VERVMjI1NURSNPTElPCkFSQUwjVkFMT1IjVEVOVApMSUxJI0lSQSMjRkFYRVMKSUNFQ1JFQU1DQUxMIyMjCiMjIyNBTk4jQUxBI1NMWQpNQVJHSU4jQUpBUiNUT08KQVRFQVNFI0hPTkVNQVJLCkxPQVZFUyNFTEkjQUdFRQpJTVBFREUjTUVTI0RFTlM="},{"title":"6/17/00 SATURDAY STUMPER","author":"by Fred Piscop, edited by Stanley Newman","date":"2000-06-17","grid":"TVVHV1VNUCMjQ0FTU0lTCkFMTEVOREUjU09NRU9ORQpTVEFUSVNUI1BBVUxJU1QKQ0lSI1RFQVNFVFMjTElUCkFNRU5TI0xFQSNUUkFERQpSQVJBI0hFQVJUI0FHRVIKQVNTVVJFRCNTQUxURVJTCiMjI1RBUyMjI0NJVCMjIwpET1BJRVNUI1BJTExCT1gKRU5PTCNFQVRJVCNFQVZFCkZFTElEI05PTCNBU05FUgpBTUUjQUxLQUxJUyNHUk8KTk9NSU5FRSNBTFRPU0FYCkdSQU5URUQjUkVST1VURQpTRU5ERVIjI1NUT1BQRUQ="},{"title":"6/18/00 WEAR HOUSES: A well-designed puzzle","author":"by Bob Lubbers, edited by Stanley Newman","date":"2000-06-18","grid":"U1RBRkYjTkJDI0NBTEVCIyNTTElUCk5BU0FMI09STyNPTUFOSSNKVUlDRQpBVFRSQUNUT1IjTUVEQUwjT1paSUUKR0lPUkdJT0FSTUFOSSNMQVRJQ0VTCiMjIyNTQU5ESUEjU0VSQlMjI0xTVQpBVkFTVCNBRUdJUiNTSUxUUyNBVFAKVEVNUE8jI05BTkEjI0NBUk9OSSMjCkVYUEFOU0UjTkVMTFMjU09MVUJMRQojIyNERUxMQSNTUEVBS1MjRU1PVEUKI1VQUyNBTFNPI0hJTE8jI05BUkNPCkRMSSNZVkVTU1RMQVVSRU5UI05PQwpPTkVUTyMjQVNJQSNURVRFI0dFTCMKUkFSRVIjQURJRVVTI0FST1NFIyMjCk1FUlJJTEwjRVJST0wjRU5URVJFRAojI0VOQ09ERSMjRU1JTCMjSVNFUkUKUkVDI0tST05FI05BVkVTI0ZFVkVSCkFMQSMjRUdFU1QjTEVUT0ZGIyMjIwpQQVJWRU5VI0NIUklTVElBTkRJT1IKVElERVMjQ0hPUkUjUEVSTUVBQkxFCk9OSU5FI0NPUkVBI09SRSNTVEVFRApSRU5UIyNJTlRFUiNUU0UjU0FHT1M="},{"title":"6/19/00 GO WITH THE FLOW","author":"by Fred Piscop, edited by Stanley Newman","date":"2000-06-19","grid":"TE9CT1MjVEhPUiNPVkVSCk9OQUxMI0hPUkEjTElGRQpBVFJJQSNBTUVOI01PTEUKRE9OTllCUk9PSyNBTEFTCiMjIyNUQVAjI0lOTkFURQpTTEFNT04jTUlORVIjIyMKSFVOQU4jQkFSR0FJTkVSCk9NTkkjWU9HSVMjVkFMRQpFUE9OWU1PVVMjU0VUSU4KIyMjU0VBUlMjSU5ST0FECkRFTFRBUyMjU1JJIyMjIwpPTUFSI1VQVEhFQ1JFRUsKRElSRSNNT1JFI0tPUkFOCk9MR0EjQVNFQSNFTElTRQpTRUVNI0NIRUYjUkVORUU="},{"title":"6/20/00 BREAD BOXES","author":"by Rich Norris, edited by Stanley Newman","date":"2000-06-20","grid":"U01VRyNTSEVBI1NDQVJFCldBQ08jUE9ORyNVUkJBTgpJUk9OI0FVVE8jUklDSEUKR0lOR0VSUk9HRVJTIyMjClNFTlNPUiMjI1RPUERPRwojIyMjTk9XI1NUVSNFQVUKUEVTVCNXSElURU5PSVNFCkVUSE9TI0lORSNESUNFUwpTSE9SVE9SREVSI0xFU1QKVEVFI0FCUyNQSVAjIyMjCk9MRFBSTyMjI0dFVEhPVAojIyNTV0VFVENIQVJJVFkKTU9DSEEjTU9PVCNBTlRTClNQRUFSI01FTU8jSURFTwpTVEVXUyNBREVOI1RVUk4="},{"title":"6/21/00 CLOTHES CALLS","author":"by Bob Lubbers, edited by Stanley Newman","date":"2000-06-21","grid":"RUNPTiNNQVRBI01BUk5FCkxPR08jTUVJTiNFWElUUwpBTExTI0RSRVNTUklHSFQKUExJRUQjT1NXRUdPIyMjClNBTlNFSSMjRU5FTUlFUwpFUkcjQk9HQVJUI0FORVQKIyMjT0FURU4jI1NUSUxFCiMjUFVUQUxJRE9OSVQjIwpPUkFURSMjVE9OSUMjIyMKUkVBUiNMRUFEVVAjU1NUCkFCUkFERUQjI1NFRVRIRQojIyNOQVRJVkUjU1RPT1AKU09DS0lUVE9NRSNPR1JFCkFSSUVMI0VMTU8jTklURQpURUREWSNERUFOI1NFU1M="},{"title":"6/22/00 WHEN IN ROME . . .","author":"by Norma Steinberg, edited by Stanley Newman","date":"2000-06-22","grid":"Q0hJUCNTUElFUyNOQUdTCkhPV0kjSEFTVEUjQVZPVwpBTEFOI0VSSUNBI01JUkEKS0VZI1ZJSVRISEVBVkVOCkFTU0FJTFMjI09BVCMjIwojI1RVTkEjTUFSQ0hJTkcKTUFSTE8jTUFSU0gjSU9VCkFHRUQjQ0FSVEUjUExBWQpBUkUjRFJJRVMjUE9FTVMKTUFUVFJFU1MjQ0FMRiMjCiMjI1dFRCMjUEFMRVRURQpYTFZJSUlIT1VSUyNGVU0KUkFJTiNCRVJMRSNSRU5PCkFSQUcjTEVBU0UjQkVFUgpZQUxFI0VMTEVOI0lUU1k="},{"title":"6/23/00 THE OLD SWITCHEROO","author":"by Manny Nosowsky, edited by Stanley Newman","date":"2000-06-23","grid":"Q1JBTVMjT1JHWSNNSVNUCk5PRkFUI0hFUkEjRVZBSApOT0xURSNPVkFMI0xZTEUKI0ZBWkVUSEVQSURETEVSCiNTVE9MSSNSSEVFI0VTQQojIyMjWUVTRVMjUkVBUk0KI0lGQSNCVU4jV0VER0VTCiNNSVNTQU5EQ0FLRVVQIwpTSVRURVIjU0hZI0xFUyMKQU5UT04jU1BJTlMjIyMjClVGTyNTT1RPI0VVQklFIwpDT0FMRVJST0FTVEVSUyMKRVJURSNCSU5EI1VOSVRZClJJRU4jSURFQSNSRVNFRQpTVEVUI1RFUk0jRVRIRVI="},{"title":"6/24/00 SATURDAY STUMPER","author":"by Lee Weaver, edited by Stanley Newman","date":"2000-06-24","grid":"U0VFU0FXUyMjI0JBR0VMCklOU1VMQVRFUyNBRExBSQpNRVRST05PTUUjSEVBUlQKSVJFI0VESUJMRVMjRERUCkFHRVMjU0NBTEEjR0lSTApOWU1QSCNTUk9TI1JPVUUKIyMjSU9OI1JVRSNBTE1TCkVNQU5DSVBBVElPTklTVApOT05FI01SUyNOT1QjIyMKRE9OVCNCQVNTI1BPRElBCkVOT1MjTElNTlMjUkVOVApBUlQjUkVTRUFMUyNBRE8KUklBVEEjRU5GRUVCTEVECkVTVEVSI1NUVVBFRklFRApERUVSRSMjI1NUUkFORFM="},{"title":"6/25/00 BOWLED OVER: Wherein a \"10\" is perfect","author":"by Lee Weaver, edited by Stanley Newman","date":"2000-06-25","grid":"QVBUUyNFU1RFUiNWQVBPUiNBQ0RDCkxJUkEjVEhST0UjSU1BR0UjTEFJUgpGUkFNRUhPVVNFI05BSUxTI0JSQUUKI0FDT0xZVEUjTEVFI0xFQ1RFUk5TCkVOVEFJTFMjTUVSR0VTI1JFRFlFUwpSSE8jIyMjU09DSUFMI1BJTE9UIyMKR0FSVEgjR1VUVEVSU05JUEUjSEFNCk9TU0lFI09QRSMjIyNPVFQjUkVQTwojIyNTUEFSRVRIRVJPRCMjQkVCT1AKQUJTIyNHRVIjRVZPS0UjTUFOQUdFCk1PVEhFUlMjRUxJU0UjUEFST0xFRApFVVJFS0EjQURMQUkjTUlMIyNMRVMKQlJJTkcjI1VQT05FU0FMTEVZIyMjCkFTS1MjU0FEIyMjI0hJRSNIRVJCUwpTRUUjU1BMSVRTRUNPTkQjU1RFTEUKIyNJRFlMTCNBVFRMRUUjIyMjQ09XCkFUVFVORSNBQkFUSVMjQkFTU09PTgpHQVJERU5FRCNOQVAjU0FOQ1RVTSMKQVhJTCNEUlVJRCNQVUxMVEhFUElOCk5JQ0UjT0xMSUUjRVJBU0UjUkVORQpBU0hZI1JFVElFI0RFR0FTI0VER0U="},{"title":"6/26/00 READING MATERIAL","author":"by Rich Norris, edited by Stanley Newman","date":"2000-06-26","grid":"QUNIRSNHUkFGI01BTUJPCkZSWUUjUkVCQSNBU0lBTgpURUFMRUFWRVMjTUlORFMKI1NDWVRIRVMjVElOR0xFCklDSSNDQVIjQ1VFI0xJVApWRU5EI01FREFMI0NFRVMKRU5UUkUjI0VSSUNBIyMjCiNUSEVTTUFMTFBSSU5UIwojIyNTT1VUSCMjT1JFT1MKUklQUyNSRUlHTiNPV0xTCkFOQSNJS0UjUk9UI0ZMQQpTSEVFTlkjU1VOUk9PRiMKUEFMTVMjVEhFRlVUVVJFCkVMTElFI0xPTEEjT05FQQpERUFMVCNDT1NUI0VERVI="},{"title":"6/27/00 PLAY ME","author":"by Bob Lubbers, edited by Stanley Newman","date":"2000-06-27","grid":"RE9NUyNSRU9TI0JFQ0tTClVOSVQjVUxOQSNBR09SQQpBQ0NPUkRJT04jUk9OQVMKTEVBUEVEIyNET1JJQyMjCiMjIyNHRUFSI1JJU0VSUwpSRUhFQVJTRSNTT1RSVUUKVVRVUk4jVEFDT1MjVE5UCkJPUk4jU0VEQU4jTUlTVApCSUQjUFVSRVIjQ0FOQUwKRUxZU0VFI1JFQ1JFQVRFClJFR0FSRCNTVE9BIyMjIwojI1VQU0VUIyNaSUdHRUQKSEFSUE8jQkFCWUdSQU5ECk9HREVOI0FMT1UjT0xHQQpCT1lEUyNSQVNQI1dBUlk="},{"title":"6/28/00 BARNYARD LANGUAGE","author":"by Norma Steinberg, edited by Stanley Newman","date":"2000-06-28","grid":"U0xBQiNIRUxNI0FNQU5BClRBVEEjT0xFTyNMSUxBQwpBTk9OI0xFQUQjTEFJTkUKVEFMS0lTQ0hFRVAjQkFZClNJTEVOVCMjTUFSSUEjIwojIyNSRUVMUyNUT0RBVEUKUkVDI1BSSU5UUyNPQkVZCkFMTE9UI1RPQSNHTEFSRQpHTFVNI1RFUlJPUiNBSUQKU0VDRURFI1RPTkVTIyMjCiMjS05JVFMjI0FUVExFRQpBUksjTkVJR0hTQVlFUlMKU1VFREUjTE9JUyNMRU5TCkFCTkVSI0FOREkjRVJJRQpQRVRFUyNTRUVTI0RZRVM="},{"title":"6/29/00 T CROSSINGS","author":"by Fred Piscop, edited by Stanley Newman","date":"2000-06-29","grid":"U0xPVyNBU1NUIyNXQVNQCkxBTUEjVklUQVMjRVJJRQpBTUlTI0FOQUNFI0FDUkUKR0VUVElOR1RPR0VUSEVSCiMjI0VTVEVFI0FTSCMjIwojQkFORSNST1cjUEVSTEUKU09MT05HI0ZFRCNSSUFMClRPT1RUT09UVE9PVFNJRQpBTkVXI0RPSCNTUEhFUkUKUkVTQVQjSEVTI0VFTlMjCiMjI05BUCNTUEFSUyMjIwpQT1NUUkVTVE9SQVRJT04KSVJPTiNTVEFSRSNPU0xPClBBU08jT0FURU4jUkVETwpTTE9UIyNCRVNUI01FRUs="},{"title":"6/30/00 STRAIGHT ADVICE","author":"by Lee Weaver, edited by Stanley Newman","date":"2000-06-30","grid":"R1JFVyNST0QjTU9OQUQjClJFTkUjSU9VI0FNVUxFVApPRlRFTlRIRSNSRUxJU0gKVEVBI0JFU1RBTkdMRVRPClRSSU9TIyMjTEVBI05JTApPU0xPI0VDT0wjI1NBTkUKIyMjTUFOSUMjRUxBVEVTCiNBUFBST0FDSExJRkVTIwpUUkVBVFMjVVRJTEUjIyMKRVRDSCMjVVJTQSNMT0NJCk1FVCNBRkwjIyNCWVJPTgpQUk9CTEVNU0lTQSNFTEYKVElSQURFI1RSWUFOR0xFClNFQVRFRCNFRU4jQ09JUgojU0xVUlMjTURDI09ORVM="},{"title":"7/1/00 SATURDAY STUMPER","author":"by Manny Nosowsky, edited by Stanley Newman","date":"2000-07-01","grid":"R09BRElORyNVU0VMRVNTCklOTEFCT1IjTk9SRUxDTwpHRVJNQU5FI0RPQURFQUwKT1RFI1JFQUdFTlQjQ1JVCkxFQUZTI1NVUiNPQ1RFVApPUkRPI0hFTkxFI0VSREUKI01ZUk5BI01JU1BMQVlTCiMjI0JSSVFVRVRURSMjIwpWRVJBQ1JVWiNFQVNFUyMKQVBFRCNTSVpFUyNUUkFQCkxJVkVTI0JMVCNURVNMQQpJQ0UjVVBCRUFUUyNLT1MKU0VORUdBTCNMRUFESU5TCkVOR1JBVkUjSU5SQU5HRQpTRUVTUkVEI0lOU1RFQUQ="},{"title":"7/2/00 YOU FIRST: Vowel play","author":"by Randolph Ross, edited by Stanley Newman","date":"2000-07-02","grid":"I0xPT1RFUiNMSUVUTyMjI0JVTktPCkFSTUJPTkUjQU5USFJPI1RBS0VJVApET0VTQUdPT0RVVFVSTiNBUlJBTlQKQU5ORVMjI1BZUkVTI1NBTk1BVEVPCiMjI1NUQVJUSU4jIyNJQ1kjVE9SUwpFTVVTI1JPSVMjQUJVREhBQkkjIyMKR0lOI1VSSUNIVU5DTEUjI0xPVVNFCkFST1VTQUwjI05PREUjR1JJTk5FRApET1dORVkjSkVUIyMjQklBU1NJTkcKIyNBSUQjU0VSSUYjVE9OR1MjVFNFCkhBWVMjVVBTSUxPVkVZT1UjU1BFRApPQkojQVJJU0UjUk9MTFMjTUFJIyMKUk9PTU1BVEUjIyNMRUUjRElTQ09TCkFVU0FCTEUjRU1JVCMjRUVMU0tJTgpTVEVHTyMjVU1BU1NNRURJQSNFTEkKIyMjTllZQU5LRUUjQUxFUyNFUlNUCkJFQVUjQVJCIyMjRVhFUlRFRCMjIwpBTk5NQVJJRSNST05JTiMjVFdFRU4KUkVUVVJOI0xPT0tVTUFOT0hBTkRTClRST1BFUyNUQU1BUkEjT1ZFUlNFQQpTT05JQSMjI0tFWUVTI0dBUkRFTiM="},{"title":"7/3/00 TOP TO BOTTOM","author":"by Nelson Hardy, edited by Stanley Newman","date":"2000-07-03","grid":"UFNTI01BUkxBI0FCRFVMCkFDQyNPQ0VBTiNNT09TRQpTUk8jVFJBQ1QjT1JHQU4KSElUVEhFQ0VJTElORyMjCkFNSUUjI0hZREUjI0VXRQpTUEFSVEEjI09WRVJSQU4KIyMjUkVQQVNUI0xFRVJTCiNDTElNQlRIRVdBTExTIwpTTEVFUCNQRVNFVEEjIyMKUVVBUlRFUiMjREVCQVRFClJFVCMjTkVBVCMjRUJPTgojI0hPTERTVEhFRkxPT1IKQ09FTlMjRUxFVkUjQUJBClNUUlVUI05BVEVTI1JBRwpBQllTUyNUU0FSUyNEREU="},{"title":"7/4/00 ROUGH STUFF","author":"by Fred Piscop, edited by Stanley Newman","date":"2000-07-04","grid":"T0JJRVMjRURJQ1QjQ0FWClJFTkFMI0xPUkNBI0FXRQpDQVJST1RTVElDSyNUQVgKQURFTFBISSNTUEVDVFJFCiMjIyNQRUVMIyNPSUxFRApIQVBQRU4jRVZJTkNFIyMKSVZJRUQjQUZJUkUjUFRBClNFR0EjTE9UU0EjRlJPRwpTUkkjU09OSkEjU0FPTkUKIyNOQVVTRUEjUE9OREVSCkZSQU5aIyNCSVJSIyMjIwpMQVBTRVJTI0NPUlNBR0UKQUJPI1RFTk5JU0VMQk9XCllBSyNURUFTRSNMQUlORQpTVEUjRURHQVIjU1BFRVI="},{"title":"7/5/00 AT THE BAKERY","author":"by Lee Weaver, edited by Stanley Newman","date":"2000-07-05","grid":"I0FWQVNUIyNST1NFVFRFClNOSVRDSCMjSUJFUklBTgpFR09UUklQI1ZFUkFOREEKUk9MTE9ORVNFWUVTIyMjCkZSSUVEI1dFVFMjI1BVUApTQU5FI0ZFVEUjTEVBU0UKIyMjI0JSRUFEV0lOTkVSCkNPTExJRSMjI09MREVTVApQSUVJTlRIRVNLWSMjIyMKQVNIRVMjT1BJRSNQT1BTClNFUiMjU05JVCNBRVJJRQojIyNBUElFQ0VPRkNBS0UKTEFSQ0VOWSNTTE9UVEVEClBMVU1BR0UjI0RSSUVSUwpTVEVFTEVEIyNTRU5EUyM="},{"title":"7/6/00 FOUNDERS' DAY","author":"by Bob Frank, edited by Stanley Newman","date":"2000-07-06","grid":"QkFEIyNDQVNFI0lIT1AjCklTRUUjT05FUiNOQU1FUwpCSUxMR0FURVMjU05BUkUKQkFMQU5DRUQjTUlHTk9OCiMjI1RBVCNCRUFUQSMjIwpUQVBJUiNURURUVVJORVIKRVJST0wjRURJVCMjT0RFCkFHT05ZT0YjVEVNUFRFRApMT0IjI0JMQUgjSVJPTlkKU1RFVkVKT0JTI01BTlNFCiMjI0FNRU5TI0hPVCMjIwpUT0lMRVQjVE9BU1RFUlMKT0FLRU4jU0FNV0FMVE9OClRSRU5EI1BJRVMjRUNUTwojU0FTUyNBTk5FIyNIRVc="},{"title":"7/7/00 ONLY 15 AWAY","author":"by A.J. Santora, edited by Stanley Newman","date":"2000-07-07","grid":"U01BQ0sjTUFWI1NDQVJFCkNBTExBI09SRSNUQUxPTgpPU0NBUiNORUNUQVJJTkUKV0hPV0FOVFNUT0JFIyMjCkxJViNUT1IjT05TVEFHRQpTRUVQI1JFVFJZIyNNRVQKIyMjU0FNQVIjI0FST01BCiMjRklOQUxBTlNXRVIjIwpHSE9TVCMjTElBTkEjIyMKQkFSIyNBUkFCWSNMQUJTClNJQU1FU0UjTFNVI1JVVAojIyNBTUlMTElPTkFJUkUKSU5TT01OSUFDI0NMT05FCkxFRVJZI0VMSyNMT1NFUgpMRVdJUyNTT1MjRVdFUlM="},{"title":"7/8/00 SATURDAY STUMPER","author":"by Richard Silvestri, edited by Stanley Newman","date":"2000-07-08","grid":"UEFMSU5EUk9NRSNPSE0jCkFESUdFUklWRVIjTE9FVwpERU5PVUVNRU5UI0VSTUEKU05PUlRTI1JVRSNJU09TCiMjIyNFU1RBIyNPTkVSUwpBU1RFUiNBTEdFUiNSWUEKVU5JVCNBTExFR0UjQUxJClNBTUhJTEwjTUFHSUNBTApUSUUjU1RFUElOI05FTkUKUkxTI0xPUkVOI01JU0VSCkFTSURFIyNSSU1BIyMjIwpMUEdBI1NTUyNBTkFMT0cKSUFORCNJTk9SRElOQVRFCkFDQUQjQ0lORVJBVElPTgojRUxZI1NQQUNFQ0FERVQ="},{"title":"7/9/00 LOCAL COLORING: Gerundial wordplay","author":"by Fred Piscop, edited by Stanley Newman","date":"2000-07-09","grid":"UElTR0FII0hBUkQjSE9OSyNSSVNFCkFQT0xMTyNBTEFJI09MRU8jQU5USQpST1NFQk9XTElORyNERVJSSU5HRVIKI1NPTkFUQVMjR0lTIyNERU5UQVRFCiMjI1NOSVQjUEVUUk9MI0FDRSMjIwpCSUIjU05FRVIjQVRXQVIjT1JHQU4KQVJMTyNHUkVFTkxBTkRJTkcjT1JPClNPVVAjI0VSVEUjU0VMTUEjU0xFVwpLTkVFUyNESVJFIyNSRUlUI0VETkEKIyNCUkFUI0xJTkVTIyNOQU1FREFZCkFHTyNHUkFZTUFUVEVSSU5HI1VTUwpQUk9WRUlUIyNIT1JTRSNUQkxTIyMKTEFLRSNUSEFUIyNBQ0FUI1NBVFVQCk9ESUUjRVJOSUUjVEFMRSMjVklOTwpNRU4jQlJPV05CRUFSSU5HI0VORE8KQkFHRUwjV0FHRUQjUEFZRUUjR09QCiMjI0xBVCNSRVJVTlMjRVROQSMjIwpDUk9BS0VSIyNUQUkjU0FMSUVSSSMKSEFQUEVOSU5HI1JFRENST1NTSU5HCkFHRVMjT1BJRSNEVVJBI1NMSUNLUwpQQUNFI05FTEwjT1dFTiNURVJFU0E="},{"title":"7/10/00 WHITEWASH","author":"by Fred Piscop, edited by Stanley Newman","date":"2000-07-10","grid":"Q1JBU1MjU0FHQSNQT0xFCkhBVEhBI0hBVVQjQUJFTApJVk9SWUNPQVNUI1JJQUwKU0VNSU5BTCNIQUNLRVJTCiMjI05PVkVMI0NFRSMjIwojU0hFIyNNSUxLVFJBSU4KU1BJUkFMI0xBTUUjUkRBCk9PUCNSRUIjV0FSI09FUgpQT1AjQU1PUyNOQVlTQVkKU05PV0dPT1NFIyNFRUwjCiMjI0hPTiNTQUxTQSMjIwpCT1JPTklDI0dFT1JHSUUKQVJBTCNDSEFMS0JPQVJECk1BSUwjRUFWRSNFTkxBSQpBTExZI1NURVQjUkVFU0U="},{"title":"7/11/00 PEACE OFFERINGS","author":"by Rich Norris, edited by Stanley Newman","date":"2000-07-11","grid":"R09BTCNUQUJTI0VWT0tFCkFOTkEjRUxMQSNKQURFUwpSRUVEI0NPQUwjRUxJVEUKQlVSWVRIRUhBVENIRVQjClNQQURFIyMjREFUQSMjIwojIyNJTVBFTCNJU0xBTkQKU1JBI1BPVE9LIyNMSUVVCkxBWURPV05PTkVTQVJNUwpBR0VSIyNBTUlTSCNTT1QKTVVTRVVNI1NUUEFUIyMjCiMjI0FTT0YjIyNSSUZMRQojRU5ESE9TVElMSVRJRVMKS05JRkUjVFlSTyNBTEFTCklOQ1VSI09QRUMjTkVWRQpSRUVMUyNQT1NII1NURVM="},{"title":"7/12/00 \"GIRL\" SINGERS","author":"by Bob Frank, edited by Stanley Newman","date":"2000-07-12","grid":"U0NSQVAjSEFMTyNTQ0FUCkFMT0hBI0VUVFUjT0hOTwpST0RTVEVXQVJUI0xVTkcKQUdFI1RFQVIjRlJBQ0FTCiMjI09JTFMjQ0xPQ0sjIwpTQUJMRVMjUExBQ0VCT1MKVFJVRVMjT1JJTiMjRVNUClJFRE8jQlJJTksjQlJJRQpBTkQjI0FDQ1QjV0lSRVIKREFZVE9EQVkjVEhFWVJFCiMjSE9PRFMjTUlFTiMjIwpUUk9VUEUjRVJORSNBVkEKSEVMUCNCT0JCWURBUklOCklTTEUjVEhBSSNMSUNJVApTVFlFI1NPTkcjRUxTSUU="},{"title":"7/13/00 THEY'RE ALL WET","author":"by A.J. Santora, edited by Stanley Newman","date":"2000-07-13","grid":"T1NTTyNTVE9XUyNGUkVUCkxJVFMjT1JGRU8jQVVSQQpJRE9MI0JJTExZT0NFQU4KVkVST05JQ0FMQUtFIyMjCkVXRSNFR08jI1NMVVJQUwpUQUtFTiNUQVAjQVBFQUsKI1lFTUVOI1NFQSMjQUxZCiMjRVRIRUxXQVRFUlMjIwpGT1AjI1RFQSNBTElTVCMKQ1JFV1MjRU5FI0dPVVJECkNBUkFUUyMjQ1JJI1JBRQojIyNQRVRFRk9VTlRBSU4KSk9BTlJJVkVSUyNBTlRJCkVSTkUjTEVBU0UjTkNPUwpURUFSI0VTVEVTI0dFUkU="},{"title":"7/14/00 IN-FIGHTING","author":"by Merle Baker, edited by Stanley Newman","date":"2000-07-14","grid":"Tk9USVAjRUxMSVMjRkVNCkFEQUdFI1JFQUNUI0VYTwpIRVJPV09SU0hJUCNVUEEKIyMjUkVQQUlSI0FERE9OCkZBTFNFVFRPIyNURUFTRQpFQ08jIyNBTkFUI0lMRUQKQUxBTklTI1NOT09EIyMjClJVTklOVE8jQ1lQUklPVAojIyNDQUlSTiNTRUVTVE8KU0FURSNSRUlOIyMjTE9VClBSSU5UIyNDQU1FTEVFUgpPUkZFTyNQT1NBREEjIyMKT09GI1NLWVNDUkFQRVJTCkZZSSNDSUxJQSNNRUFUWQpTT04jQU5FQVIjU0xVRUQ="},{"title":"7/15/00 SATURDAY STUMPER","author":"by Brendan Quigley, edited by Stanley Newman","date":"2000-07-15","grid":"TU9PSlVJQ0UjUFNZQ0hFCkFQUEVORElYI0FMT0hBUwpUUlVOQ0FURSNDRURBUlMKVFlTI0FMQVJNRUQjSVJFCiMjI1NQVVRURVJTI05JWApCQVNFI1BJU0EjI0FTUyMKT05UQVJJTyMjREFSVCMjCkRBWVNJTk4jQkFSQ09ERQojI0xPR08jI0FSRUFSVUcKI1RFTiMjTUVSRSNERU1PCkFSQiNDT09MSURHRSMjIwpSSU8jQVJCSVRFUiNMT1MKQUNPUk5TI0NPVkFMRU5UCk1JS0FETyNJTklUSUFURQpFQVNUT04jVEVMRVRIT04="},{"title":"7/16/00 NUMEROLOGY: The old-fashioned way","author":"by Frances Burton, edited by Stanley Newman","date":"2000-07-16","grid":"REFCUyNMQUJFTCNTQ0FNUCNTSEVECkFWT1cjQU5PREUjTEFNRVIjTkFWRQpMSU1FI0dOQVNII0lJSVdJU0VNRU4KSVZCQUdHRVIjQU1FTkQjTUVBU0xZCiMjI1RFRVMjI1ZBU0UjR1JJRCMjIwpMRVZJRUQjRklSU1QjUEVPTiNWQVQKSUNJRVIjQVJJRVMjI0xPU0UjRVJFCk5PSVIjQVJFTyMjRVZBREUjTUFJTgpFTFkjQlJJRUYjVFJJVEUjQkFTRUQKREVFUEVOUyNBUlJBUyMjQkVSWUxTCiMjQVJUSUUjS0VJVEgjU0xFRVAjIwpTUFJJVEUjI0lHTE9PI1BFUlNJU1QKQUxJQ0UjUEFORUwjT01FTlMjRVBBCkxBVEUjTUVMRFMjI1RPTEQjU0NBUgpWSUMjQkFLRSMjU0hFTEwjQUxFUlQKRVRII09ORVMjQk9BUkQjUExVU0VTCiMjI0JSQVMjRlJBWSMjQ0xBTSMjIwpTVFJBSVQjU0VBUlMjVklJSUJBTEwKSUhPUlNFVE9XTiNFTElURSNFUklFClBPU0UjRUFTRUQjRUlERVIjUklDRQpTVUVSI1NUT1JZI0RFQVJTI1NBS1M="},{"title":"7/17/00 LENGTHWISE","author":"by Richard Silvestri, edited by Stanley Newman","date":"2000-07-17","grid":"QUxEQSNTVEFHI1JPV0FOCkNPQUwjVEFMTCNPUkFURQpJVllMRUFHVUUjTUVUT08KREVTRVJUI01BTUEjRVJOCiMjI0dSVUIjTUFOT1IjIwpBTlRFQVRFUiNUT0FNQU4KTU9FI05FR0FURSNIRVJPCk1PTkVUI0FHTyNQVVRPTgpBTkRBI1VORVNDTyNFU0MKTkVFU09OI1NDT1RGUkVFCiMjUkVNSVQjQVZFUiMjIwpSRUYjRVRBTCNFTkFCTEUKQVRPTEwjQ09VUlRZQVJEClNUT1ZFI0lOUkUjRUxPSQpQRVRJVCNURU5EI0RFTlQ="},{"title":"7/18/00 DAIRY CASE","author":"by Fred Piscop, edited by Stanley Newman","date":"2000-07-18","grid":"VEVTVCNHQVJCI1BFREFMClJBVEEjT0RPUiNPUEVSQQpJVE9OI0xBTkEjTUlNSUMKTUlMS09GTUFHTkVTSUEjClNURUVQIyMjSEFMTyMjIwojIyNSRVBSTyNNT0RFTEEKQVNTI0RPT05FIyNJUkFTCkNIRUVTRUlUVEhFQ09QUwpNQVJYIyNMQVRFWCNTU1QKRU5BQ1RTI1BBWVVQIyMjCiMjI0VSSUMjIyNEVUNUUwojQ1JFQU1PRlRIRUNST1AKU0FVREkjREFSRSNLT0tPCkFMREVOI0FWSUQjRVdFUgpTTEVEUyNTRVhZI1JFTkU="},{"title":"7/19/00 CAR TUNES","author":"by Bob Frank, edited by Stanley Newman","date":"2000-07-19","grid":"T0FSUyNWRVNQQSNNQUFNClBST00jT1ZPSUQjVUdMSQpVUkdFI0xFTlRPI0ZFQVQKU09VTEZVTFNUUlVUIyMjCkVZRUxFVCMjI0VQSUxPRwpTT1MjTElGVEVSUyNPUk8KIyMjVE9PTEVEIyNTTkFQCiNTUElOTklOR1dIRUVMIwpNQVJDIyNQRUFIRU4jIyMKQUdPI05PU1RSSUwjQ1BBClJPU1RFUiMjI0ZMT1JFUwojIyNTVEFURU9GU0hPQ0sKUEFQQSNURVJSRSNBQ0FOCk9ET1IjT1RURVIjUkVOTwpET1RTI1JFRUxTI0FTU1Q="},{"title":"7/20/00 ON THE MAP","author":"by Norma Steinberg, edited by Stanley Newman","date":"2000-07-20","grid":"Tk9CRUwjQkFTSCNUSEFUCklMT1ZFI0VMSUUjSE9TRQpOSU5FUyNBTExZI0VSVEUKQU5OI1NJQ0lMWVRZU09OCiMjRkxFU0gjI09SREVSUwpBU0lBTlMjTUFVSSMjIyMKSEVSUyNVVEFII1NBTUJBCkFNRVMjRVJJRVMjR0VBUgpCSVNPTiNBTE1BI0FDUkUKIyMjI0FUTVMjVk9JQ0VTCkpFVEhSTyMjRE9OTkEjIwpBR1JBQ1VMVFVSRSNXT0UKQlJFUiNDT09LI1dBSUxTCkJFQVIjSEFMRSNBU1NFUwpBVFRZI0VORFMjWUFIT08="},{"title":"7/21/00 FAUX VACATIONS","author":"by A.J. Santora, edited by Stanley Newman","date":"2000-07-21","grid":"T1NDQVIjSFVNUCNDT01QClJPTExFI0FGQVIjQVBBUgpDUlVJU0VUT05PV0hFUkUKSEFOI1RBUiMjU0VOTklUCklSSyMjUkVMQVlTI0VORQpERVNDRU5ERVIjI09ERVMKIyMjQVJJI0FMUyNSVVNUCiMjT05BTkVHT1RSSVAjIwpTUFVOI0dOVSNFTk8jIyMKQVJUWSMjREVNRUFOT1JTClRPTSNKRVNTRUwjI0JFQQpBUE9EQUwjI1RJQSNMQVMKTk9EQVlBVFRIRUJFQUNICklORVojVFJJTyNDRVRURQpDRURFI0VZRUQjRFJFU1M="},{"title":"7/22/00 SATURDAY STUMPER","author":"by Manny Nosowsky, edited by Stanley Newman","date":"2000-07-22","grid":"QUlSU0hBRlQjR09DQVJUCk1BVU5BTE9BI0FWQVRBUgpJR05BVElVUyNSRURPTkUKTk9FUlJPUlMjQlJFTkRBCiMjI0xFTlMjIyNTTkVSVApXQU5FRCNRVUFSVFojIyMKQU1JRCNSVU5UT0VBUlRICktFRyNQRUFTT1VQI09STwpFWEhJTEFSQU5UI0pBSUwKIyMjUkVERVlFI0xVTVBZClNBTEFEIyMjU1BBUyMjIwpDTEFOR1MjQURBUFRJVkUKQURSSUVOI0NPTlNJREVSCkxFR0FUTyNDT1pFTklORwpFUkVOT1cjVFJBREVEVE8="},{"title":"7/23/00 MUSICAL MEDLEY: What some styles may mean","author":"by Patrick Jordan, edited by Stanley Newman","date":"2000-07-23","grid":"QVFVQSNBQ01FI0FGUk9TI0JMQUJTCk5VTlMjVEhFTSNCUk9OQyNFQVJMWQpHT0RTI1RBUlAjQ09BQ0hXQVJORVIKU1RFRUxPUkxFQUQjUkVXT1JLRUQjClRFUlJPUiNFUlIjIyMjQU5JIyMjIwojIyNUQU4jI09SQVRPUiMjU1BPT0YKQ0hBU1RFI0NSSU1JTkFMQ0hBUkdFCkxBUCNIWURFI1ZJQ0VST1kjV0VSRQpBWUVTI1NBTCNFU1QjRU9OI05PRUwKTkVSVFMjUklNI0hBSiMjSURTIyMjClNLWUFORE5BVlkjQ09NSUNDSFJJUwojIyNOT1IjI1BJQSNCQUQjTE9PU0UKQUJFRCNZRVQjRVRBI0RPTiNQSUxFClNFUkIjRVhIQUxFUyNBTEVHI0xFRApQTEFZR1JPVU5ESVRFTSNXUklTVFMKU0FTU1kjI1NZU1RFTSMjQ0FOIyMjCiMjIyNSQUgjIyMjUklEI0FTU0VUUwojUEFHQU5JU00jSU5ORVJTUElSSVQKVEFDT1RPUFBJTkcjRU1JVCNQT1JFCk9QSU5FI1BBU0VPI05VTEwjSURFQQpXQURFRCNPVFRFUiNUUkVFI0RFU0s="},{"title":"7/24/00 HEAD DOWN","author":"by Fred Piscop, edited by Stanley Newman","date":"2000-07-24","grid":"QUxBUyNGQVJPI1JBREFSCk5PTkUjQUxFQyNFTUVSWQpHQVRFQ1JBU0gjUEVOQ0UKRURJVE9SI0FSR09OIyMjClJFQ09OIyNURUFSRFJPUApTUlMjRk9QIyNTVEFJUlMKIyMjQ0FSVVNPIyNCQUdTCiMjQUxCRVJUQkZBTEwjIwpBQ01FIyNFTE9JU0UjIyMKU0FNT0FOIyNFWFQjQUhBClNMT1BTSU5LIyNSQUNFUwojIyNBU1RPUiNNQU5UQVMKUEFTVEEjTE9DQUxESVZFCkFUQVJJI0FOT04jRVZFTgpQRU5BTCNORU1PI1NFTlQ="},{"title":"7/25/00 WELL IN HAND","author":"by Merle Baker, edited by Stanley Newman","date":"2000-07-25","grid":"Qk9CQkVEI1JFQ09WRVIjCk9SSU9MRSNQSUFQRVJBIwpQVVRUSEVGSU5HRVJPTiMKIyMjQUlSRSMjRVJOSUVTCklUT04jRU1VUyMjSUNFUwpMRVZJUyMjTkVBUkVBU1QKS05VQ0tMRVVOREVSIyMjCkFETSNPSUwjT1VSI01JQQojIyNQQUxNR1JFQVNJTkcKTkFUQUxJRVMjI05BQ1JFClBFQVMjI1JBTVAjTEFJRApST09TVFMjI0FMRUMjIyMKI0xJS0VBU09SRVRIVU1CCiNVU0VSSURTI0FOT01JRQojU1RZUFNJUyNEQVdTT04="},{"title":"7/26/00 TO A PULP","author":"by Nelson Hardy, edited by Stanley Newman","date":"2000-07-26","grid":"TUFNQk8jU05BUkUjQU1QCkFWSUFOI1RFT