{"id":"newsday-2013","publication":"newsday","year":"2013","count":365,"puzzles":[{"title":"01/01/13 UNDERFOOT","author":"Billie Truitt, edited by Stanley Newman","date":"2013-01-01","grid":"QUNUViNNT1RUTyNUSEFXCkxPUkUjRUdHT1MjSU9UQQpPUEVOI1RSSUxMI0FQRVgKVEFLRVRIRUZMT09SIyMjCiMjI1pPT1MjIyNSQVNQUwpBQlNVUkQjTkFNRSNUSVAKUk9QRVMjUE9HTyNQQVBBCkNBTExPTlRIRUNBUlBFVApBUklBI1JBSUQjQkVMSUUKRERUI0VBU1QjUkFWRU5TCkVTU0FZIyMjV0FTSSMjIwojIyNXRU5UVE9USEVNQVQKTUFNQSNBQk9WRSNXQU5FCkFNT0sjU0FURUQjRVRURQpSSVBFI0FSRU5BI0RFRUQ="},{"title":"01/02/13 KNOBBY","author":"Fred Piscop, edited by Stanley Newman","date":"2013-01-02","grid":"QVRNUyNBUFBTI1NIT05FClNIQUgjQkxFVSNUT0RBWQpQVVNIVEhFRU5WRUxPUEUKU0dUI1JPQVIjTUFEUkFTCiMjRUNBUkQjSElLRSMjIwpQRVJPTiNTSEUjI01FU0EKRUxQQVNPI09BSFUjWEVTClBVTExPTkVTUFVOQ0hFUwpQREEjTUVSRSNUSVJBREUKWUVOUyMjQVNTI0ZBVVNUCiMjI0VCQlMjUFJJR1MjIwpTQUZBUkkjU0hPRSNUVlMKVFVSTkFOSUNFUFJPRklUCkVSRUNUI1dPUkUjUEFORQpNQVRFUyNPV0VEI1NOT1c="},{"title":"01/03/13 PROACTIVITY","author":"Charles Slack, edited by Stanley Newman","date":"2013-01-03","grid":"R0VUI09SQlMjU1RFQU1TCk9MRSNWQUlOI0hFQUxUSApQRUFDRUlOSVRJQVRJVkUKQUNDT1JEI1BBUlNFIyMjClNUVU5UIyMjUkVFTkFDVApUU1AjVVNFUlMjIyNGT0UKIyMjRlJJVE8jTUFUUklYCiNCTElOREFNQklUSU9OIwpIT0FSU0UjUElOVFMjIyMKTU9NIyMjQVNDSUkjUlVFCk9OUEFQRVIjIyNUV0FORwojIyNNRUFUUyNTVUFWRVIKTUVNQkVSU0hJUERSSVZFCkFSUklWRSNFUklFI05FVApUQVNURUQjREVOUyNFTlM="},{"title":"01/04/13 EXTRAS","author":"Ki Lee, edited by Stanley Newman","date":"2013-01-04","grid":"Tk9NQUQjUFJBWSNTQU5HCkNIQUlSI0xVQ0UjQ0xBTgpSSFlNRSNBQkFBI0FMVE8KIyNCRUFVVFlQUkVNSVVNClBSRUVNUFQjVVNOI0VSRQpJQU4jI0hFQUwjUklERVMKQVJPVVNFI1NDSU9OIyMjCkZBVEhFUkhPT0RCT05VUwojIyNVU0VPTiNDRVRFUkEKSE9PSEEjTUVTQSMjV0dOCklSSyNNQUUjUFJBSVNFRApQRUFDRURJVklERU5EIyMKSElZQSNBTk9OI1NVRU1FCk9ERUQjUE9MRSNPUlNPTgpQQURTI1ROVFMjUEVLT0U="},{"title":"01/05/13 SATURDAY STUMPER","author":"S.N., edited by Stanley Newman","date":"2013-01-05","grid":"U1RPUkFHRURFVklDRVMjCkhBTkFNQU5ETElLT1ZBIwpPTkFQT1NJVElWRU5PVEUKT0tTI1JFRCNDSUEjS0lNCktJU1QjU09MSUQjU0lBTQpVTklPTiNLSVQjQVVOVFkKUElTVE9MI0JFU0lFR0VTCiMjIyNCSU8jRElNIyMjIwpBTkdFTEVOTyNQQVlQQUwKTE9PU0UjRUxNI1RPUlRFCklNVVMjUExFQUQjV09FUwpURUEjUE9JI1JJUCNNQ1MKT1JDSEVTVFJBTFNDT1JFCiNDSEVMU0VBQ0xJTlRPTgojWUVTVEVSREFZU05FV1M="},{"title":"01/06/13 GOOD LUCK!: In other words, break a leg.","author":"Gail Grabowski, edited by Stanley Newman","date":"2013-01-06","grid":"Qk9HUyNFTkFDVCNMT0ZUI1NNSUxFCkFMT1QjQ0FUSFkjQlJJTyNOQVZBTApJRExFR09TU0lQI0pVTkdMRUdZTVMKVElEQUwjSEVMSUMjI1NBVEFOIyMjClNFQUxVUCNBTENBUFAjI1NLVUxMUwojIyNURVJNI0VBU0lFU1QjRU1JTEUKRUFDSCNNSURETEVHUk9VTkQjVEFJCk1SSSNUQVhJIyMjU0lNQkEjQVRNUwpNRVIjT05FR1JBTSNMRUFTI0NMQU0KWUFDSFQjUklOU0VEIyMjQUNSRVMjCiMjTE9BI1NUQVBMRUdVTiNSSUcjIwojQkVMTEUjIyNTRUVNU08jRURJQ1QKUEVHUyNDT0FUI0VOU1VJVEUjUk9XCkNBUlQjUkFQSUQjIyNSU1ZQI0xFSQpMR0EjUFVSUExFR1JBUEVTI0lTTlQKQUxQSEEjU1RFTExBUiNTRUxMIyMjCkJFSEVMRCMjU1RBUlRTI1RVTFNBTgojIyNGTEFNRSMjTUVTQVMjQkVJR0UKU1RZTEVHVUlERSNCQVRUTEVHRUFSCkFXQUlUI1RSRUUjSUxJQUQjQVZJRApET1dOUyNURU5LI1RFTlRTI0xFTlM="},{"title":"01/07/13 WATERWORKS","author":"Gail Grabowski, edited by Stanley Newman","date":"2013-01-07","grid":"U1RFUCNBUExVUyNUUkVLClBBR0UjSVJBTkkjV09SRQpPRE9SI01PTlRFR09CQVkKVEFTU0VMI0RJVkEjRVNTCiMjI0lURU0jTEVORCMjIwpIQVJBU1NFUyMjREFUQSMKQVRPTiNTQU5FI0VOQUNUClNMVUdTI1RBWCNSVU1NWQpIQVNVUCNTS0lTI0JFRVAKI1NFTEwjI0VTUFJFU1NPCiMjI0ZJTkQjVElFUiMjIwpTTE8jTk9STSNFRElCTEUKUFVHRVRTT1VORCNWRUFMCkFCTEUjSU5UUk8jRUFSUwpSRUVMI1JFVEFOI1JVREU="},{"title":"01/08/13 NOT SO HOT","author":"Billie Truitt, edited by Stanley Newman","date":"2013-01-08","grid":"VEJTUCNJRE9MI1NQQURFClJBQ0UjTk9WQSNDT0NPQQpBQ1JFI0ZMQVQjQURJT1MKQ09PTE1JTExJT04jRFJZCkVORFNPTiMjTlVUUyMjIwojIyMjUklQRSNUWVBFQVMKU1NUI0FUT01TIyNBWExFCkNISUxMWVJFQ0VQVElPTgpBT05FIyNUUkFOUyNURUQKTkVTVExFI1lNQ0EjIyMjCiMjI1NBR0UjI0xMQU1BUwpTVFMjQ09MRENPTUZPUlQKS0lPU0sjQklBUyNJREVBCklORElFI09OTUUjUkVBTApNRUFUWSNXRUVEI0VMU0U="},{"title":"01/09/13 OUT ON A LIMB","author":"Bruce R. Sutphin, edited by Stanley Newman","date":"2013-01-09","grid":"RFJVTSNTSEVTI01BTUFTCldBTkUjVEVOVCNBTEFNTwpBV0lOR0FOREFQUkFZRVIKUkVGVUVMI1NSTyNDT05FCkZSWSNSRVAjWk9MQSMjIwojIyMjTUFSUyNGQVJDRVMKQUhBIyNJT1RBI1NUQVJFCkxPTkdBUk1PRlRIRUxBVwpBTFRBUiNTT0xFIyNNU04KU0VJWkVEI1BBTlMjIyMjCiMjI1BBUlQjQ0RDI01FSApNQVlBI0FSRSNTQUxBTUkKRVhFQ1VUSVZFQlJBTkNIClRFQ0hTI1BJTUEjSURFQQpBREhPQyNTTFVSI05ZRVQ="},{"title":"01/10/13 SOUND TRIO","author":"Steve Salitan, edited by Stanley Newman","date":"2013-01-10","grid":"Q09MQSNDUk9TUyNVVEFICklSQVMjSEFWT0MjU0FMRQpOSVRTI0FCQVNII1NLRVcKRE9WRVJERUxBV0FSRSMjCkVMSVRFIyMjREFNI0hPRwpSRUEjR0FMQSNCWUpPVkUKIyMjUEFHT0RBIyNPTUVOCk1JRERMRU9GTk9XSEVSRQpPS1JBIyNURU5QSU4jIyMKVEVBU0VSI0VBVFMjQUhBCkhBVyNPT1AjIyNFQUdFUgojI0xPTkdVTkRFUldFQVIKSURPTCNFUENPVCNBTlRFCk5PVEUjVElBUkEjSURFUwpORVNTI1NMQU1TI1RBUlQ="},{"title":"01/11/13 SELF-DESCRIPTIVE","author":"Lonnie Burton, edited by Stanley Newman","date":"2013-01-11","grid":"QkxBTUUjSkVURVIjR0FQClJFTEFYI0FST01BI05CQQpSRUFDSEFDUk9TUyNJQ1kKIyMjSEFDS1MjI0NBTSMjCk1PREVMVFMjU0VBTE9GRgpDTk9URVMjQ1VSTElDVUUKU0FXRUQjVE9HQVMjREVXCiNSTlMjRElWQVMjQU5OIwpDT1QjQklLRVIjTUlBVEEKQ0xPU0VTSU4jSEFSUEVSClNMRVVUSFMjTU9MTFVTSwojI0FOVCMjVkFMTEkjIyMKR1JSI0VTUkVWRVJOSU9HCkVBVCNST1VURSNBRUlPVQpNUEgjU0lNT04jVFJJT1M="},{"title":"01/12/13 SATURDAY STUMPER","author":"Lars G. Doubleday, edited by Stanley Newman","date":"2013-01-12","grid":"V0hJVFRMRSNQQUNLUkFUCkhPTk9SRUUjQVZBUklDRQpFTUJST0lMI1JFU0lTVFMKWUVBUk4jUElWT1RTSE9UCkZBREUjSE9MRSMjI0lSUwpBTEYjQ1VURU5FU1MjIyMKQ09PTEVSUyNVTkxPQ0tTCkVOUk9MTCMjI1JBTU9OQQpERU1PVEVTI1RJVEFOSUMKIyMjUFNZQ0hJQ1MjSkZLClNUUyMjI09BVEgjUlVFRApLSVdJRlJVSVQjUkFSRVIKSU1BREVJVCNMRUVUSURFClJFTEVBU0UjRU5ESU5HUwpUUkVBVEVEI1NUT09HRVM="},{"title":"01/13/13 IN FOR A POUND: With seven possibilities","author":"Bruce Venzke, edited by Stanley Newman","date":"2013-01-13","grid":"VEFMQyNDTE9QI1NMQVYjSU1QUk9WCkFHRVIjQUVSTyNNRVJFI05PT0RMRQpCT1hFUlJFQkVMTElPTiNDTE9TRVQKIyMjV0hFUkVUTyMjTU9TSEVEIyMjCk1BU0NPVFMjI0NDTEFNUCMjTEFaWQpBTE9VRCMjQU1BRE8jU0lNTUVSRUQKTUFMVEVTRUZBTENPTiNMT09TRU5TCkVORFMjRVZBQyMjTU9STE9DSyMjIwojIyMjQkVBUkhVRyNUT0FEI0lWRVMKSkFSR09OIyMjWk9OSU5HI0RST1ZFCkVNRVJZI0VTS0lNT1BJRSNVVFRFUgpET1pFUyNOT09TRVMjIyNERVNFUlQKSVNBWSNDQVJSI1pFQUxPVVMjIyMjCiMjI0hFUkJURUEjI1NBUkEjQVNQUwpJTU1PUkFMI0FGR0hBTkJMQU5LRVQKUkVTVVJHRUQjUkVBUFMjI0xPSVJFCkFUVE4jI1JFQ09SRCMjSE9USVRFTQojIyNEQU1TRUwjI0FEREVET04jIyMKQlVCQkxFI1BPSU5URVJTSVNURVJTCk9ORVVQUyNBU0NII0xBU1MjRVJJRQpCSUFTRVMjS0VFTCNJQkVUI0RFQlQ="},{"title":"01/14/13 NOISY BUNCH","author":"Gail Grabowski, edited by Stanley Newman","date":"2013-01-14","grid":"TE9BTiNNQVJTI1NBRkVTCkVVUk8jSURFQSNUUklURQpHUklUI0RPTEwjUlVSQUwKI1NBVkVEQllUSEVCRUxMCiMjIyNBTEUjI1VTQSMjIwpESUxBVEUjQU5UUyNESUcKVU5JVEUjQUxFQyNBSURFCkNMRUFOQVNBV0hJU1RMRQpURU5EI1JBTVMjTUFURVMKU1RTI01BWU8jT1BQT1NFCiMjI1NPQiMjUFJFIyMjIwpTT1VORFNUSEVBTEFSTSMKRU1DRUUjRUFTVCNCRUFVClRJTEVTI05JVEUjTEFQUwpTVEFSVCNUUk9EI0VMU0U="},{"title":"01/15/13 EASY AS . . .","author":"Sally R. Stein, edited by Stanley Newman","date":"2013-01-15","grid":"U1BPVCNHTE9BVCNBVE1TClBPU0gjT1VURVIjVUhVSApBTExZI0FTVFJPI1RPR08KUk9PTVNDSE9PTEhPVVNFCiMjI0VBUiMjI0xBUCMjIwpOT1QjR09BTFMjU0FORFMKRkxPUCNTTEVXI1RST09QCkxJVEVSU09EQUJPVFRMRQpFVkFERSNOT05PI1NFRU4KUkVMSUMjRU5TVUUjRERUCiMjI0dVTiMjI1FVTyMjIwpTVEFSUkVTVEFVUkFOVFMKTVVMRSNTUElURSNUT09MCk9CT0UjVEFST1QjSEFSRQpHRVRTI1NURVBTI1NIRUQ="},{"title":"01/16/13 WHERE TO READ","author":"Fred Piscop, edited by Stanley Newman","date":"2013-01-16","grid":"T1ZBTCNUT01FI1NUT01QCk1JS0UjVU5JVCNBVURJTwpFRElUI1BFU1QjVEJPTkUKTkFUVVJFU1RVRFkjUklNCiNMQVBFTCMjI09SRyMjIwojIyMjTk9NT09OI0xJRFMKQU5JU0UjQUJJVCNBUklBClNPRlRXQVJFTElCUkFSWQpBTFNPI1JJU0UjSkVTVFMKUE9PUiNVU0VEVE8jIyMjCiMjI01PQiMjI0FSRUFTIwpBUkYjR0FNQkxJTkdERU4KU09MSUQjT1JBTCNZT0RBCklNQUdFI0pFVEUjUFJBWQpTQVhPTiNPV0VEI1RFTlM="},{"title":"01/17/13 FOUR-PARTER","author":"Billie Truitt, edited by Stanley Newman","date":"2013-01-17","grid":"QVJDUyNCT1dTI0RFTFRBClRFUkkjRVhBTSNJVklFUwpBUkFUI0FFUk8jUkVFRFMKUlVCQkVSTkVDS0VSIyMjCklOU1lOQyNTS0lOI0FTSAojIyMjRFVCIyNMRUFOVE8KTUFNQSNCT09UTEVHR0VSCkFTQU1JI1NBTyNERUxJUwpMSU5FQkFDS0VSI0RFTlkKQURFWEVDIyNTQUQjIyMjCllFUyNGTEFCI0NVQklTVAojIyNET1VCTEVIRUFERVIKUEFQRVIjSE9SQSNTSVRVCkFMT05FI09LSUUjUk9UQwpMQVRURSNSRUVMI0FNT0s="},{"title":"01/18/13 NEO-PHYSICISTS","author":"S.N., edited by Stanley Newman","date":"2013-01-18","grid":"VkNISVAjU0xBVCNDSVRJCkFaVVJFI0NVQkUjQU1FTgpTQUxTQSNIQUxMI1NQQU4KRVJBI1NBTVVFTEFUT01TCiMjI01BWU8jI1RJRVMjIwpJTkxJTkUjU1BBUiNURFMKTUVBTlQjQk9JTCNTVVJFClNJUklTQUFDTkVVVFJPTgpFR0dTI0NVS0UjTk9FTkQKVEhFI0FUTVMjQU1VU0VTCiMjU0lOUyMjU1BBVCMjIwpKQUNLTlVDTEVVUyNVUkwKQUxBTiNQTEVBI0tBWk9PCkJPTE8jT1VTVCNFUElDUwpTVEVXI05FU1MjREVTS1M="},{"title":"01/19/13 SATURDAY STUMPER","author":"Charles Slack and Nancy Salomon, edited by Stanley Newman","date":"2013-01-19","grid":"VEFNQUxFIyMjI01BUkNICklST05BR0UjUElBTk9MQQpQUk9HTk9TVElDQVRJT04KUEFSRUQjUE9MRU1JU1RTCkxJQVIjQk9ORUQjI1RIRQpFR0cjU0xVR1MjQ1JFRUwKI05FV05FU1MjQ0hBUkQjCiMjI1JPU0UjTE9JTiMjIwojQVJBQlMjU0VBTUlFUiMKU0xPUFMjUEhBU0UjTE9QCkNEVCMjREFVTlQjTUFVSQpIRUFERklSU1QjQkFTVEUKSU5URVJTQ0hPTEFTVElDClNUT01BQ0gjU0FMVElORQpNRVJJVCMjIyNQSVNDRVM="},{"title":"01/20/13 SEEING THINGS: With the theme in the clues","author":"Fred Piscop, edited by Stanley Newman","date":"2013-01-20","grid":"QVNDSCNXSURFUiNBTUVOI0pPRElFCkxJUkEjT05JQ0UjTk9HTyNBUlVCQQpGUk9aRU5GT09EI0RPT1JPUEVORVIKQVNDRU5ERVIjV0FJTFMjVkFMRVRTCiMjIyNERVIjU0lEUkEjSEVOUyMjIwpTVVBQRVIjUk9ORE8jQUlSI0VTUE4KVFJJQUQjI09WRVJOSUdIVCMjVEhPClJJU0sjI01PSSMjI05FTyNDTEVBVApFQVQjI0pBTUVTQk9ORCMjTEFQU0UKV0hPI0hBUyNUT1JPUyNUUkFTSEVECiMjTEFVRFMjI0RPWiMjUk9VVEUjIwpGSVJUUkVFI0NPTUVTI0lWUyNORVQKRU1BSUwjI09ISU9TVEFURSMjS0VSCldBTlRTI1BSRSMjI1VTRSMjV0lSRQpFR0cjI0JFRUZTVEVBSyMjTUFOSUEKUkVFTCNFVFMjQ0hBUlMjUkFHR0VECiMjI0lTTEUjV0hJU1QjUFVOIyMjIwpQUk9OVE8jU0FJTlQjQkVTVENBU0UKRk9SVFlXSU5LUyNNSUtFSEFNTUVSCkNPWkVOI1BPRU0jQU1QTEUjT01BUgpTVE9MRSNPV05TI05PUlNFI05PTVM="},{"title":"01/21/13 BEDTIME","author":"Gail Grabowski, edited by Stanley Newman","date":"2013-01-21","grid":"UlVTSCMjQUJCQSNTV0FOClNUT09QI0RPT1IjUkVETwpWQUxPUiNBT05FI0FUT00KUEhPVE9TUFJFQUQjQlJBCiMjIyNQT1QjI01JU0xFRApQSVNDRVMjR1JBTVBBIyMKTE9DQUwjRFJPUCNPTlRPCk9VUlMjUE9FVFMjT0tSQQpQU0FUI0xJRVMjU0xFRVQKIyNUUlVBTlQjVEFTVEVTClJFQ09QWSMjVE9ZIyMjIwpIQUgjQ09PS0lFU0hFRVQKSVNQWSNGUkVUI1NBUkFICk5FQVIjRkVFTCNPTElWRQpPRERTI1NPTEUjI1RFRU4="},{"title":"01/22/13 HIT THE TRACK","author":"Billie Truitt, edited by Stanley Newman","date":"2013-01-22","grid":"TUFOWSNDUEFTI0pPSU5UCkFSRUEjUk9JTCNPRERFUgpESVNDI0FNTU8jU09PVFkKREFTSE9GUEVQUEVSIyMjCiMjI1RVVCNSRUFQI0JBWQpQTEFTVElDIyNDSEVFU0UKSEFTI0RFUFRIIyNHQVBTClJVTkZPUk9ORVNNT05FWQpBREVFIyNTVEFMRSNJQ0UKU0VBTUFOIyNQQUxMRVRTCkVEVCNUT1NTI01FQSMjIwojIyNKT0dUSEVNRU1PUlkKR0xFQU4jUk9WRSNFUklFClJFTElDI09WRVIjTkVPTgpSSUZMRSNQRU5TI1RPVFM="},{"title":"01/23/13 FINISH LINES","author":"Fred Piscop, edited by Stanley Newman","date":"2013-01-23","grid":"RkFSI0JBU0lDI0FSVUJBCk9XRSNBUkVOQSNMVU5BUgpMQVNURElUQ0hFRkZPUlQKRElDSUVTVCNOQUlGIyMjClNUVU4jRUxMI1JFTElWRQojU0VNSSNFQVJMI0VQRUUKIyMjQU1BI1RIQU4jT1JHCiNGSU5BTEpFT1BBUkRZIwpET0gjQ0xFRiNTUEEjIyMKU1RPUCNPREVTI0VORFMjClRPUFJPVyNFUEEjRElQUwojIyNFUklFI0FOVE9OSUEKQ0xPU0lOR0FSR1VNRU5UClBJTlRPI09GVEVOI1JFQgpVUFRPTiNTVEFSRSNTVFk="},{"title":"01/24/13 ANGER MANAGEMENT","author":"David W. Cromer, edited by Stanley Newman","date":"2013-01-24","grid":"Q0FTQVMjU1RBQlMjVkFUClNUVU5UI1BPTExZI0VZRQpBT1JUQSNPTkFJUiNSRUMKIyNGSUdIVElOR0lSSVNICkJPQSNFQVQjI0hBVUxJTgpBUkNTI0dZTVMjI0dZUk8KU0VFSU5HI0lQT0QjIyMjCkhPU1RJTEVUQUtFT1ZFUgojIyMjUEVURSNCRUxJWkUKUkFTSCMjQVJUWSNET1JBCkVNQ0VFUyMjVU1QI0xBUApNRUFOSk9FR1JFRU5FIyMKSUxMI0VGUk9OI1RFTlRIClRJRSNDQUlORSNDT0NPQQpTQUQjVFJFRUQjT05FUE0="},{"title":"01/25/13 GRAMMAR LESSON","author":"Clive Probert, edited by Stanley Newman","date":"2013-01-25","grid":"I0JUVSNTUElMVCNIQUhBCkRBV04jSEFHQVIjVUZPUwpBU0lTI0FST01BI01PTksKTUlYRURNRVRBUEhPUiMjClBFVEFMIyMjU1BBUkVNRQojIyNMSU1CIyMjU0lTQUwKTUFCI1NFRU1UTyNTQVVMClNQTElUSU5GSU5JVElWRQpOT1VOI1JFQUNUUyNERU4KQkxFU1MjIyNLT0xBIyMjCkNPUFBFUlMjIyNFTEdBUgojI1JVTk9OU0VOVEVOQ0UKTk9JUiNMRUFWRSNQQVJBCkJVTlQjTEFLRVMjUFJJTQpBUlRTI1NLSVJUI09MRCM="},{"title":"01/26/13 SATURDAY STUMPER","author":"Barry C. Silk, edited by Stanley Newman","date":"2013-01-26","grid":"UkFDRSNCVVJSI1NTR1RTCkVMSEkjT1RPRSNDTEFSQQpJTEVTI1dJVENISEFaRUwKTk9TRSNTQ0hPT0xXRUVLCktXQU5aQUEjUlRFIyMjIwojI1BIRVcjQURBUFRTVE8KVVNFT04jTUFISSNJQ0VECkNMQVcjRlVST1IjVEhFRQpMQUtFI0FUT1AjQUxVTVMKQU1FUklDQU4jVEhFWSMjCiMjIyNOSVQjUkVBUkxJVApNSVNTU0FJR09OI09LQVkKT05USEVMT09TRSNMSU1QClNUT1VUI05ZRVQjRUxTRQpUT1dOUyNTQVNTI1NMT0I="},{"title":"01/27/13 MR. 5-BY-5: Actors cast from the same mold","author":"S.N., edited by Stanley Newman","date":"2013-01-27","grid":"QVJUU1kjU1BFQyNBU1NFVCNPREVTClNFSUtPI0hVR08jQ0FQRVMjQ0VMVApLRVZJTkJBQ09OI0NMQVJLR0FCTEUKU0xPUCNBUksjQ09MVFMjI0lOVUlUCiMjI09HUkUjVkVEQVkjU0FWQUdFUwpTTUVMTFMjU09ET0kjQkFSRUQjIyMKSElSRUUjUk9HRVJNT09SRSNBV0VTCkVBUiNORUhSVSMjI0lTQUFDI09VSQpBTU9TI1BFVEVSRklOQ0gjQVBPUlQKRklMTVNFVFMjWUFOS1MjQ1JFRE9TCiMjRkFDRVQjRURJVFMjQ0hBUlkjIwpDQUxMVVMjREVFUkUjVEhBVFNBSUQKSURZTEwjSkVSUllMRVdJUyNFTExFClRFTiNMRU9JSSMjI1RJTUVYI0xJRQpJTk5TI05JR0VMQlJVQ0UjQlJFQUQKIyMjVUNPTk4jRVJPREUjWk9VTkRTCkFGVE1PU1QjUkFJU0UjVEFYSSMjIwpCTEFNRSMjV0FTVEUjS0VOI05FT04KQ09MSU5GSVJUSCNIRU5SWUZPTkRBClRST1QjT1JBVEUjSVJJUyNBVURJVApWQU5TI1BFUFlTI1BBVEUjQVNTRVM="},{"title":"01/28/13 SMALL PARTS","author":"Gail Grabowski, edited by Stanley Newman","date":"2013-01-28","grid":"U0hPUFMjVEFQUyNDSEFQClRJVEhFI09QRUMjUElTQQpBTFRFUiNERUFSI0FDVEkKQkxPV0FHQVNLRVQjS0lOCiMjIyNQUlkjI0FTU09SVApET0RHRVIjQ0FNUEVSIyMKQUxJQVMjVFVCQSNBWUUjCk1FU1MjT1JCSVQjU05BUAojU0hII0ZFRVQjSE9VU0UKIyNXT0xGRUQjSFVOVEVSClNUQUdFUyMjSU9SIyMjIwpUSVMjVEhVTkRFUkJPTFQKT0FIVSNPUEFMI1lBSE9PCk9SRVMjT0RJRSNVTklPTgpEQVJFI1RPTEQjUEVPTlM="},{"title":"01/29/13 LIVING LARGE","author":"Billie Truitt, edited by Stanley Newman","date":"2013-01-29","grid":"TUVSSVQjU0xBVCNNQVNTCk9SQVRFI0FDSFkjQUhNRQpCSUdTUEVOREVSI01FQU4KU0VFI0VORCNNQU1NQUxTCiMjI0pFVCMjI05PT0RMRQpMSUVVI1JBVEFUQVQjIyMKQURBTSNBVE9NI1RIUk9XClNFUkIjUEFUSU8jQ0FQRQpIQU5PSSNMVUxMI0FDRVMKIyMjU0NBTFBFRCNWRU5UCkVUQ0hFRCMjI0hPRSMjIwpURUFSU0FUI0tBTiNNT0kKSEVNSSNHSUFOVFNURVBTCklURU0jRUxTRSNFQVNFTApDSE9QI1NMQVcjVFJBREU="},{"title":"01/30/13 CHILLIN'","author":"Fred Piscop, edited by Stanley Newman","date":"2013-01-30","grid":"RFJBRyNBTEVDI1NDSUZJClJFRkkjTUFYSSNQT1NFRApBVE9OI0VWRVIjUklORFMKRlJPWkVOQUNDT1VOVFMjClRPVEFMIyMjQVJDIyMjIwojIyMjRkxPVyNCRUFNRUQKI0FMSSNBQUhTI1VOQUdJCkZST1NUWVJFQ0VQVElPTgpBSVNMRSNTVE9QI0VMUyMKQkFTRVNUI1NXQVQjIyMjCiMjIyNUUlkjIyNIRUFSVAojR0xBQ0lBTEJPVUxERVIKS09BTEEjUk9PSyNDT1JFCkdBTUVTI0RPTkUjSVJBTgpCTEFTRSNTUEVEI0RFTlQ="},{"title":"01/31/13 DELICIOUS!","author":"Ki Lee, edited by Stanley Newman","date":"2013-01-31","grid":"U0lOR1MjV05CQSNBQ1RTCkFHSUxFI0RFRVIjUEhJTApMSVZFUiNTSEFOR1JJTEEKRVZFTlVQI1JVRVIjTEVUCk1FQU5NUk1VU1RBUkQjIwojIyMjU0VFIyNUSEVDSUEKT0xBRiNHQVVMI0FNQU5BCk1JTExJT05NQU5NQVJDSApOT01PTSNUQVRBI1BFQVMKSU5BUk9XIyNFVkEjIyMjCiMjTUFLRU1PUkVNT05FWQpCQUEjQUJFTCNMQUJJTEUKRU5UUllDT0RFI1pBWElTClNURVAjQVdFUyNFTU9URQpURVJNI01TUlAjREFORVM="},{"title":"02/01/13 ALL WET","author":"Lonnie Burton, edited by Stanley Newman","date":"2013-02-01","grid":"Q05CQyNHUlVFTCNQQU5FClJBSUwjSEVOUkkjT05DRQpPU0xPI0FGSVJFI1dFQU4KQ0hFU1ROVVRTSURFV0FZCiMjI0VSQVMjI05PUiMjIwpQQVRUSSNFV1cjRU1PVEUKQVNITUFOI0lPVSNBQkVMCldIRUVMQ09MT1JGUk9OVApORVNUI09ITSNMSUtFU08KU05FRVIjSEFEI0VTU0VOCiMjI1JVRSMjRUxMUyMjIwpGQUxMU0tJU0JFRFBPTE8KQUxBSSNJRFRBRyNPRE9SCklTQk4jTkVBVE8jUklERQpMT1NFI0dBVEVTI1RFRVM="},{"title":"02/02/13 SATURDAY STUMPER","author":"Anna Stiga, edited by Stanley Newman","date":"2013-02-02","grid":"QUNUU09OI0JMT1RDSEVEClRIRVdITyNZT0tPSEFNQQpUUlVBTlQjUE9TRUlET04KSE9UVE9UUk9UI1NDQVRTCkFNT1MjUlVQRUUjT0JJRQpURU4jU1VCVVJCUyNJQ1UKIyMjRFdFTEwjQkVUVE9SCllPV0lFI0VBUiNMSUVOUwpFUkFTRUQjUklTRU4jIyMKU05MI1RPT0RMRVMjU09QCkhBTEwjR1JFRU4jQU5URQpJTUVBTiNBTVNUQVRJT04KVkVOREVUVEEjRlVMVE9OCkFOREVSU09OI09SQUNMRQpTVEFOREFSRCNSQVNIRVI="},{"title":"02/03/13 WILD KINGDOM: Featuring beastly wordplay","author":"Gail Grabowski, edited by Stanley Newman","date":"2013-02-03","grid":"TEFXUyNESEVEI1RBTUVTI1RSQUNFCkFMT0UjRVVSTyNBTU9SRSNSVU1PUgpERU5TRUZST0cjQ09CUkFDQUJBTkEKRVNUQVRFI1NFTk9SUyNST0RTIyMjCiMjI01BUlMjQUxNQSNKQURFI0JBSApDQUZFI1RIRVJFQUxNQUNBVyNBQkEKTERSI0JPT00jIyNMQUNFI0FDVE9SCkFET1JFI1BJVFQjWVVLI0FSQVJBVApST01FUk8jVEVFUyNMRVdEI0xPUkUKQU5UTEVSUyNBTkNFU1RPUiNDT0QjCiMjSE9URUxTI0xPWCNTS0lCVU0jIwojUkVDI0xPTkdCT0FUI1NFRVRIRVMKU0FHQSNTVElSI1BMT0QjTkFUVVJFCk9ERVRURSNQQVQjVEVFTiNEQU1PTgpOSUNFUiNIRUlSIyMjTUFTUyNPREQKQVNLI0lHVUFOQUdPSE9NRSNBUkVTClJITyNQQU5UI1ZPQ0UjRU1BRyMjIwojIyNTTElUI0JFQVRFUiNJU0FZU08KQ0FJTUFORklSU1QjTElPTlNUSUxMCk9SSU9OI09SQVRFI0VETkEjRVBFRQpCRUlHRSNSRURZRSNERUVSI1NFV1M="},{"title":"02/04/13 PUT ON THE DOG","author":"Billie Truitt, edited by Stanley Newman","date":"2013-02-04","grid":"RkFNRSNTUE9SVCNTUEVXCklST04jVEFQRVIjWU9HQQpSRU5UI0FSRU5BI0NPR1MKTUFLSU5HQUNPTExBUiMjCiMjI1JPRSMjI0FJTSMjIwpHQVRFUyNDVUIjVE9QSUMKRUdPI0VBUk5FRCNSVVNICkFSVElTVElDTElDRU5TRQpSRUFEI1RFTExFUiNDVUUKU0VMTFMjREVFI1VTSEVSCiMjI0VSQSMjI1NFRSMjIwojI09OQVNIT1JUTEVBU0gKRlVNRSNTT05BUiNQTEVBCkFTSVMjRUxFTkEjSVNOVApORVRTI1RFU1RZI05PRFM="},{"title":"02/05/13 WAY UP THERE","author":"Gail Grabowski, edited by Stanley Newman","date":"2013-02-05","grid":"WUVTRVMjRVNQTiNJQkVUCkVMSVRFI0dBTEUjTEFWQQpUSUdIVFJPUEVXQUxLRVIKI1NOSVBFI1NBU1MjRVNQCiMjI0NPQVQjVFJBUCMjIwpUQUcjSVJJUyNFTkxJU1QKQUxMSU4jRUFTRSNVTlRPCk1PVU5UQUlOQ0xJTUJFUgpQRUVMI1VORE8jVEVFTlMKQVNTRVJUI0xPU1MjRE9PCiMjI1RPT0wjUFVOUyMjIwpTUEEjVFNPUyNCT0FTVCMKUEFSQUNIVVRFSlVNUEVSCkFDRUQjT1BBTCNTT1VORApSRUFEI1dFQlMjRUFSTlM="},{"title":"02/06/13 SHOWTIME","author":"Bruce R. Sutphin, edited by Stanley Newman","date":"2013-02-06","grid":"U1BBUiNBUk9QRSNNT09UCkxPTkUjUkVWVVAjT1VDSApJT1RBI09NQU5JI09OQ0UKVEhFRkFNSUxZQ0lSQ1VTCiMjI0ZJQVRTIyNERUVSRQpSQVBJRFMjI1NMRUQjIyMKSUNFUiMjTUFMSUEjU0hFClRIRU1JQ0VXSUxMUExBWQpFRUwjT0lMRUQjI1JBUkUKIyMjU1dBVCMjU1BJVEVTClBBU1RBIyNBU1BFTiMjIwpBQ1RJTkdJTkNPTkNFUlQKRFVFTCNJTk5FUiNFVkVSCkRSQVQjU0NFTlQjU0lMTwpZQUtTI1RBWEVTI1NMT1Q="},{"title":"02/07/13 DOUBLE DUTY","author":"Ki Lee, edited by Stanley Newman","date":"2013-02-07","grid":"RkFDRVQjSUNVUyNBQkNTCkVDT05PI1RPRlUjQkxPVApEQU5EWSNHT09QI0pVTkUKU0lUI09XSUUjRU1FUkdFCiMjQUNUT1JESVJFQ1RPUgpNSUNIQUVMI1NQQVQjIyMKVVNUQSMjI1BMQU4jRkxBClNUVURFTlRMRUNUVVJFUgpTT1MjQUlSWSMjI1JFQU0KIyMjU1JUQSNUUkFHRURZClBMQVlFUk1BTkFHRVIjIwpIQUlSRE8jTE9ORSNJUlMKQUNMVSNHQUlUI05PRFVIClNFRVAjRUxTRSNUSEVTRQpFRERZI05FVFMjU09SVFM="},{"title":"02/08/13 VOWEL FOURSOMES","author":"Lonnie Burton, edited by Stanley Newman","date":"2013-02-08","grid":"T0tEI09ESVNUUyNBQkxFCldJSSNNQVJDSUEjTllFVApFTkdFTkRFUkVEI0pBREEKIyNETEkjI0FERFNPTiMjCkdSRUcjVFVNVUxUVU9VUwpJT0VSUk9SI1BFUiNTTkwKVFlQRUNBU0UjI0VJRUlPCiMjI0NBVEFNQVJBTiMjIwpTQ1JPRCMjU0xVTVBJTkcKVEVBI09NUyNTSVNFTk9SCkxPQ09NT1RJT04jUlVERQojI0VWRU5FUiMjQ0lSIyMKRkFDRSNJTklUSUFMSVpFCkNIQVIjQ09TSU5FI05PTQpDQVJUI0FTSENBTiNHT1Q="},{"title":"02/09/13 SATURDAY STUMPER","author":"Lars G. Doubleday, edited by Stanley Newman","date":"2013-02-09","grid":"TUFERU1BTiNTTElQT05TCkVNT1RJVkUjQ09DT05VVApMT1lBTEVSI1VTRUxFU1MKVFJBSU5ST0JCRVJZIyMjCiMjI0xFUyNOQVQjTUFMSQpBQ1JFI0VQQSNPQkVST04KU0hJUlRUQUlMI09SQ0FTCkhBWSNIT0JCSVRTI0FWSQpDUkFORSNBUkVBQ09ERVMKQVJERU5UI0lOSyNGRVNUCk5PSE8jT1NUI0VMRiMjIwojIyNOT1dXSEVSRVdBU0kKQ09MT0dORSNOT1RFUEFEClBSQUlSSUUjRE9HR09ORQpBRENSRUVQI1NUT09QRUQ="},{"title":"02/10/13 CLOSING BELL: A familiar sound","author":"Fred Piscop, edited by Stanley Newman","date":"2013-02-10","grid":"SkVESSNQRVJNI1RJUElOI1BBU1RFCklSQU4jRVZFUyNJV0lTSCNJRFRBRwpCQVJDT0RJTkcjTU9PTkxBTkRJTkcKRVNDQUxBVEUjIyNKVVQjU1RPUktTCiMjIyNTTEVXI0xFSVMjI1NPTiMjIwpQVVJTRVMjI0JFQU0jUFNJI1NIQUcKQVNJQU4jREFZVFJBRElORyMjQVZFClNFQ1QjTU9OTyMjI1JPQU4jSU5JVApUVUUjTUlOREJFTkRJTkcjQU5HTE8KQVBQRUFTRSMjUEFSRVMjU0xPR0FOCiMjVU5JVEUjQ0VEQVIjU1BPSUwjIwpESURETFkjU0hFSUsjI1RBTkxJTkUKQU5ERVMjT1RJU1JFRERJTkcjRE9NClJBSUQjRVZFTiMjI09JTksjVElWTwpJTk4jI0xBV0FCSURJTkcjTU9ORVQKTkVHUyNFTFMjT1BFTiMjVEFOR0xFCiMjI0FNQyMjU05PVyNTV0FUIyMjIwpCTEVXSVQjRVBBIyMjTEFLRUVSSUUKVklOWUxTSURJTkcjTk9LSURESU5HCkRPWUVOI0RJVFpZI0FNRU4jQUxTTwpTTkFSRSNTVEVBTSNHT05HI01FVFM="},{"title":"02/11/13 LEGWORK","author":"Gail Grabowski, edited by Stanley Newman","date":"2013-02-11","grid":"U0FDSyNBQ0hFUyNCQVJTCklST04jVFJFQVQjRURJVApGSVJFI01PUlNFI0FJREUKVEFLRSNGT09UV0FSTUVSCiMjI1NFRUsjI01PREVSTgpTVFJPVkUjTUVFSyMjIyMKVFJBQ0UjVE9HQSNBUk1TCk9JTksjUElMT1QjTk9PSwpQT1RTI1JFRFMjU0tBVEUKIyMjI0JPU1MjTUlMREVXClVQTE9BRCMjQU9ORSMjIwpTSElOR1VBUkRTI0JPTkQKSE9FUyNDTEFVUyNPSElPCkVUVEUjRUFHTEUjT05DRQpST09UI0RJRVRTI1RPRVM="},{"title":"02/12/13 CONSTRUCTION SITE","author":"Billie Truitt, edited by Stanley Newman","date":"2013-02-12","grid":"TFVTSCNTVE9QI0FIRUFECk9OQ0UjVEFQRSNDT1VQRQpESU9SI0VYRUMjVFVSSU4KR09MREJSSUNLI0lST05ZCkVORFNPTiMjU0xPRyMjIwojIyMjQVNQUyNJTkxBSUQKU0lHSFQjUk9PTSNBU1RPCkFSRUEjQk9OR08jU0lMTwpDQU5JI0FGQVIjUFNBTE0KS05FTExTI1JFRkkjIyMjCiMjI1NVRVMjI0lUQUxJQQpDSEFUUyNIT0xMWVdPT0QKUElMT1QjQUJJVCNST1RFCkFMT05FI1JPVkUjQVNBUApTVEVFUiNQRUVSI1BFU1Q="},{"title":"02/13/13 HURRY UP","author":"Fred Piscop, edited by Stanley Newman","date":"2013-02-13","grid":"T1dFUyNQQVNUQSMjSE9XClJFTE8jQU5USUMjWVVNQQpCQUxERVJEQVNII0FNRU4KSVZFI0xFRVIjSVNMQU5EClRFTlBJTlMjTEVUSU4jIwojIyNMT1QjUklWSUVSQVMKUk9CT1QjTEVWRVIjQVdFCkFCVVQjU0lSRUQjU0NPVwpOT1QjVkVOVVMjS0VFTFMKR0VUU0VWRU4jQ09OIyMjCiMjRUFURU4jRkxBVEJFRApDQVJTT04jVEVBTCNFVkEKUkVGUyNUUklWSUFXSElaCk9STFkjSE9WRVIjSEFURQpDT1kjI1NXT1JFI09ORVM="},{"title":"02/14/13 BREAK TIME","author":"Bruce R. Sutphin, edited by Stanley Newman","date":"2013-02-14","grid":"T1dFI0JJQlMjU09TUEFEClJBTiNJRExFI0FSTk9MRApBUlQjTEVFUiNESU9ERVMKQ1JBQ0tBV0lORE9XIyMjCkxFSVMjIyNGRUVMI0ZCSQpFTkxJU1RTI1NORUVSRVIKIyMjI1RBQ0VUIyNHRUVLClNOQVBZT1VSRklOR0VSUwpIT1BFIyNMQVVERSMjIyMKT1ZFUkxBUCNMT1dURUNICldBWCNPUFRTIyMjQVhMRQojIyNCVVJTVE9GU1BFRUQKRUxQQVNPI0FSRUEjVEFHClNFQU1FTiNSRUFMI0VWRQpTQUxBRFMjU09SRSNSRUQ="},{"title":"02/15/13 HEAL THYSELF?","author":"Bruce Venzke, edited by Stanley Newman","date":"2013-02-15","grid":"U0hJTSNDT09QVCNPVkVSCkhBTkEjUEFEUkUjQkVMQQpBU0tZT1VSRE9DVE9SSUYKRE9KT1MjI1NUQVJFRCMjCkVORSNBR0UjRVRBI0lEQQojI1RBS0lOR01FRElDQUwKIyMjTEFSVkEjI0VOVFJFClBPTEkjTFlNUEgjU1NUUwpTTE9CUyMjRUxPUEUjIyMKQURWSUNFRlJPTUFUViMjClRFRSNPVUkjUEVSI0lTUwojI0JPVU5EUyMjRFVOTk8KQURJU1JJR0hURk9SWU9VClBVUkwjQ0VBU0UjR0xPUApUT0RPI0VUSEFOI0VTUFk="},{"title":"02/16/13 SATURDAY STUMPER","author":"Anna Stiga, edited by Stanley Newman","date":"2013-02-16","grid":"UFJFRElDVCNBTEFCQU1BClJFVkVOVUUjUkVQT01BTgpPUEVOU0VBI1JBUFBPUlQKTU9OVEgjI01BS0VTVVJFCk9SRSNBUk1FTklBI05ZQwpTVFJBUEhBTkdFUiNUSUUKIyMjUkVPUkRFUlMjRU5ECk1BQ0sjIyMjIyMjRURHRQpBTEEjU1BBQ0VCQVIjIyMKUkVQI0FVVE9ESURBQ1RTCklJSSNVTlRSVVRII0xPVApBQ1RJTkdVUCMjRVJBU0UKQ0hBU1RFTiNDQVJPVVNFCkhFTExFTkUjUExFQVNFRApJTVBBUlRTI1JFRFJFU1M="},{"title":"02/17/13 LOOKING OUT FOR #1'S: Seven are hidden here","author":"Steve Salitan, edited by Stanley Newman","date":"2013-02-17","grid":"QUhBIyNJREVBTFMjUkFJTCNRVFJTClNFTlQjTlVDTEVJI0VJUkUjVUlFUwpPTlRIRVNMT1BFUyNQUkVTQ0lFTlQKRlJFRVNUWUxFUkVMQVkjI0NFUlRTCiNJU0FUIyMjIyNOT0kjVkFTVCMjIwojIyNQSE9FTklYT05SQU1QI0FQUCMKQVJLIyNPUEVORVIjI1RJRSNGTEVBCkJFQUNISEVBRFMjQkxVIyNTVEVFRApBUFBSSVNFUiMjI1JBQkJJVEVBUlMKVE9QSUMjI1RBUFRBUCNCTFVSIyMjCkVUQVMjQk9PSE9PVkVSU0UjTkFNRQojIyNQQUlSI09SSU9MRSMjTk9SQUQKVElNSU5HQkVMVCMjI01BTUJPSU5HClNQRUVEIyNURFMjSVRBTElBTkFURQpQQVJSI1RXQSMjSVJPTkVSIyNTQUQKI0RFQyNHRVRSVU1BTkRDT0tFIyMjCiMjI0VNSVQjSEFQIyMjIyNXQURFIwpGQVVMVCMjQ09MVU1CVVNIT1RFTFMKTElGRVNJWkVEI1RPT1RIRU5BTUVMCk9ET1IjTE9ORSNFTkRFQVIjVE9OSQpFQVNZI0xPVFMjU0FZU01FIyNOQVA="},{"title":"02/18/13 MUSEUM PIECE","author":"Gail Grabowski, edited by Stanley Newman","date":"2013-02-18","grid":"UEVTVCNIT1dMIyNTVEFSCkxBQ0UjQVJFQSNSRUhPRQpBVE9OI0xFVFMjQVRPTkUKWUFSRCNGT1NTSUxGVUVMClNURUVSIyMjT1NMTyMjIwojIyNSRUlOUyNUWVJBTlQKQU1BI05PRUFSIyNUUklPCkJVU1RPVVRMQVVHSElORwpCTEFIIyNTRU5TRSNERUEKUkVQRUFUI1NUQU1QIyMjCiMjI1RSRUUjIyNTSVRBVApEUkFXSU5HT0ZGI1JPTUUKT0FTSVMjWUFMRSNBWEVTCk9aT05FI1BST0QjVElOVApSRUZTIyNUU1BTI0VORFM="},{"title":"02/19/13 WHY 2K","author":"Sally R. Stein, edited by Stanley Newman","date":"2013-02-19","grid":"REFSRVMjSVRFTSNTSEFECklORVBUI01BWEkjSFlQRQpNQU5JQSNBTEVDI1JFSU4KU1RPQ0tDTEVSSyNJTk5TCiMjIyNFRUwjVEVFTkFHRQpTUEVDI0xFRSNZQUsjIyMKTEVDSCNMQUxBI1RCT05FCk9BSFUjT1JBTFMjQUJJVApCTE9DUyNTVEVQI0NPTEEKIyMjS0VHI0VSQSNLRUVMCk5PTlNUT1AjVFJBIyMjIwpFTUlUI0JMQU5LQ0hFQ0sKVEFLRSNMQUNFI01BUklFCldIT0EjSUNFUyNFTElURQpUQU5LI05FU1MjU1RFRVA="},{"title":"02/20/13 OLD MONEY","author":"Fred Piscop, edited by Stanley Newman","date":"2013-02-20","grid":"U0VER0UjU0lMQVMjR0FTClFVRUVOI0lSRU5FI0VEVApGUkVOQ0hGUkFOQyNSSU8KVE9QVEhBVCNQT0tFTU9OCiMjIyNBTFNPIyNFUkFTRQpPUklFTlQjUkFHTEFOIyMKQlVSU1QjV0FSRVMjTVVECkVESVQjQklOR0UjUEFSRQpZRVMjQ0FSR08jTUVSR0UKIyNIRUFSWUUjVEFOS0VECkNBUEVSIyNTTlVHIyMjIwpJUk9OTUFOI09ORVNIT1QKTFNVI0lUQUxJQU5MSVJBCklPTiNOT05PUyNUSURBTApBTkQjRU1PVEUjQURFTEU="},{"title":"02/21/13 ROCKY INLETS","author":"Billie Truitt, edited by Stanley Newman","date":"2013-02-21","grid":"R09UQVQjVFlQRSNBTlRJCkFNT1VSI09BSFUjSEVFRApaRUxEQSNXUkFQI0VBUkwKRU5MSVNUSU5USEVBUk1ZCiMjIyNISVQjI09MRCMjIwpQQUxBQ0UjUE9SSyNHUlIKQVJVQkEjU0FSSSNBUklBClNJTEVOVFRSRUFUTUVOVApTRUxMI09BVFMjUkVFU0UKRVNTI09OVFYjRkVOREVSCiMjI1VOSSMjQkVFIyMjIwpMSVNURU5DQVJFRlVMTFkKQUNMVSNHQU1FI09IWU9VClRFQVIjVU5JVCNSVVJBTApFU1BOI1BFU1QjVEhFTUU="},{"title":"02/22/13 ROCK STARS","author":"S.N., edited by Stanley Newman","date":"2013-02-22","grid":"TEVBRlMjRkxPI0NVU1BTCklOUFVUI09PTVBBSFBBSApNRUhUQSNJRkVFTEZJTkUKRVJST0xGTElOVCMjUkVECiNHT05FUiMjI0NBTUVMUwpTWUQjUk9EI1NPTE8jIyMKQUJJVCNaRVNUI0FDSEVECktBVEVCRUNLSU5TSEFMRQpFUkVDVCNLSUxPI0FSRUEKIyMjSFVCUyNURUUjRFZSCkJSQVNTWSMjI0FNSUNBIwpMQUQjI0FNWUdSQU5JVEUKQURVTEFUSU9OI0lORElBClNJTEVOVEVSQSNMSUVOUwpUT1RFRCNORVQjU0VSR0U="},{"title":"02/23/13 SATURDAY STUMPER","author":"Bruce R. Sutphin, edited by Stanley Newman","date":"2013-02-23","grid":"Q0xVQk1FRCNXUk9OR0VECkhBTlNPTE8jSElNT1JNRQpJTkhJQklUI09QSU5JT04KQUNJRFMjRUxTI1RPTlRPClBFVEUjUk9VTkQjU05JVApFVEMjQ0FOVEVFTiNFVkUKVFNISVJUI0VYUEFOREVECiMjI0NPSUwjVE9ORSMjIwpGSVJFV09PRCNTT1VHSFQKSU5FI0VOQ0FHRVMjTEFBCkFQUFQjU0hSRUQjU09EUwpTTE9BTiNORVQjTElBUlMKQ0FSUkFDRSNTV0VFVElFCk9DVE9QVVMjQVBPR0VBTApTRVNURVRTI1RBVkVSTlM="},{"title":"02/24/13 MUSICAL MISCELLANY: Tied together at 79 & 98 Across","author":"S.N., edited by Stanley Newman","date":"2013-02-24","grid":"UFJPQkUjV0VEUyNBTEVWRSNNTUVTClVIQVVMI0hFQ0sjUkVMQVgjUk9ERQpCT1RUSUNFTExJI0NFTExPUEhBTkUKIyMjI1hFUlMjTUFIUkUjUkFZQkFOCkFTVFJJREUjREFMRVkjU0NVRCMjIwpTUVVJUkUjVklTT1IjUkFJU0VTVVAKVFVSRlMjTUlDS0VZTU9VU0UjVFNBClJBS0UjTU9QRSMjI0FVTlQjV1JBUApPV0UjVE9XRVJPRlBJU0EjUEhBR0UKU0tZRElWRVIjR0xBWkUjUVVPVEVSCiMjRE9WRVIjR0xPVkUjQ1VSSU8jIwpCTUlOT1IjREVFUkUjQ0hFU1NTRVQKUkVOVFMjRlJFREFTVEFJUkUjUFJPCklOTlMjUk9EUyMjI09QUlkjVEhBTgpFU0UjWU9VUkVUSEVUT1AjVEhFU0UKRkFSRkFMTEUjSE9ORVMjQkVBUkVSCiMjI09MRVMjQ0VSVFMjQ0VOVEVSUwpVTkNMSVAjSVJBTkkjQ0hFRiMjIyMKR09PU0VMSVZFUiNDT0xFUE9SVEVSCkdBVE8jQURFUFQjRVJBUyNVQk9BVApTSEVNI1lFU0VTI0RFTlQjUklPVFM="},{"title":"02/25/13 YEARS BEFORE","author":"Gail Grabowski, edited by Stanley Newman","date":"2013-02-25","grid":"TUFSUyMjU1BBUyNXSVNICkFUT1AjSE9SREUjQU5URQpHT0FMI0FMT0hBI1NUQVIKSU5EQVlTT0ZPTEQjSEJPCiNFU1NFUyMjQ0VBU0UjIwojIyNIQUxPUyNESVBQRUQKQU1BI1JFQUNII1NDQUxFCkxBV04jI1RSSSMjQVNLUwpFVEhJQyNIQVJTSCNUU0sKU0hJTExTI01FVEFMIyMjCiMjTEVBUFMjI0FXQVJEIwpBUEUjV0FZQkFDS1dIRU4KQkVBRCNXUkVDSyNNSUxPCkNBR0UjTklURVMjQU5UUwpTTE9XI1NBU1MjI05PQUg="},{"title":"02/26/13 MULTITASKING","author":"Billie Truitt, edited by Stanley Newman","date":"2013-02-26","grid":"U0FHUyNUQUJTI0pBREVECkFEQU0jT01FTiNFTFVERQpMSU1PI01PTk8jS0lOR1MKVE9VUlNPRkRVVFkjRUVLCiNTVEVFUiMjVEFMQyMjIwojIyNTVFJJUCNHTE9CQUwKR0FCI1RPT0xTIyNEQVRBCkxJRURPV05PTlRIRUpPQgpBREFZIyNTVE9SWSNBTVMKREVURVNUI1NXQVBTIyMjCiMjI1NPT04jI1BFUFNJIwpCQUQjRk9PTFNFUlJBTkQKVUJPQVQjUklUWiNBVVRPCkdFTklFI1RSRUUjSUNPTgpTVEVSTiNIQU1TI05FV1Q="},{"title":"02/27/13 RE-COMMENCEMENT","author":"Charles Slack, edited by Stanley Newman","date":"2013-02-27","grid":"U0hPQUwjVEVFTiNFWlJBClBVUlNFI09HTEUjVklPTApBR0FJTkZST01USEVUT1AKUkVMQVRFUyMjI1VOSVRTCiMjIyMjV09PTEVOUyMjIwpBTEFNTyNTQUlMUyNTRUUKUkVMT0FEI1RFRSNORVhUCk9WRVJGUk9NU0NSQVRDSApNRVJFI0FSRSNUQVRUT08KQVJUI1NXRUFUI0dPT05TCiMjI0hBU1NMRVMjIyMjIwpFTUFJTCMjI05FVVRST04KQkFDS1RPU1FVQVJFT05FCkJZVEUjRk9VUiNHUkFDRQpTQVNTI0ZMT0UjRU5ERUQ="},{"title":"02/28/13 NOT QUITE RIGHT","author":"Fred Piscop, edited by Stanley Newman","date":"2013-02-28","grid":"SEFSUE8jREVTQyNMQVdOCkFESUVVI0VMTU8jQVJJQQpIQVRUSUVTQlVSR01JU1MKQU1FUyNESUUjTk9JREVBCiMjI0hFV1MjQ09BVCMjIwpERVBPU0lUU0xJUCNCUlIKUkVPUEVOI0hBTEUjTE9VCklSS1MjI1lJUCMjVFVNUwpMSUUjVEhBTiNBRE9SRVMKTEVEI0hPTkVZQk9PQk9PCiMjI0ZPTEsjQVlFUyMjIwpBTEdPUkUjSE1TI01BU1MKU0FOQU5EUkVBU0ZBVUxUCk9WQUwjVVRBSCNPTERJRQpGQVRTI1BFVEEjQkxJTVA="},{"title":"03/01/13 FIND THE WEATHER","author":"Lonnie Burton, edited by Stanley Newman","date":"2013-03-01","grid":"QVJDUyNBRE9OSVMjQlJBCkRFQU4jV0FOVElOI1JVQgpVTkNMRUFSQ0hJRSNBRkwKTEVBI1NJVEUjI0VESUZZClRXT0FDVCMjTFVaT04jIwojIyNQT1NIRUFURVJJRVMKTEFNRVIjQUxEQSNNRU1PCklQTyNUQUxMWUhPI1NJUwpORVJEI1ZJRUQjU0VUVE8KRVhUUkFJTk5JTkdTIyMjCiMjR1VMQUcjI0FPTEVSUwpTV0FNSSMjQUZSTyNNRUEKTEFHI0dST1dJTkRPT1JTCk9SRSNOQVBPTEkjRVRBUwpURFMjU1RFTExBI0RFTlk="},{"title":"03/02/13 SATURDAY STUMPER","author":"S.N., edited by Stanley Newman","date":"2013-03-02","grid":"QVNJUyNDTkJDI0NSRVBUCkdBUlAjQUVSTyNIRU5SSQpOT1NFI1NXSU0jQUFST04KVVBBTkRBVEVNI1RSSUJFClNBVVRFIyMjSUxFI0NJQQpEVUQjTUFUSFRFQUNIRVIKRUxJI1NURUFNU1VQIyMjCklPVEEjT0FURVMjUkFTUAojIyNQSU5DRU5FWiNNQVIKRklERUxDQVNUUk8jQUxFCkFHRSNMRUQjIyNPR1JFUwpVTkNBUCNERUFOU0xJU1QKTE9SQ0EjSU5GTyNFTE1PClRSRUVTI0VZRUQjQUxBTgpTRUVEUyNTQVdTI05PTkU="},{"title":"03/03/13 AROUND TOWN: Various places to go","author":"Gail Grabowski, edited by Stanley Newman","date":"2013-03-03","grid":"U1BBTSNVQ0xBI1NXQU1JI09BVEhTCkhVR0UjUExPVCNPSUxFRCNVSEhVSApPTEVTI1NJR0gjQ05PVEUjVEVBUlkKT0xEU0NIT09MI0NBRkVBVUxBSVQjCiMjI1RBT1MjRVZFTlQjI0xBRCMjIwpJTlRFTlQjU1RBUlMjI0JUVyNTVFkKQ09STlMjU0xJUCMjU1BBUiMjVEhFCkJSQVQjQ0hPQ09MQVRFQkFSI09SUwpNTUkjV0hFVCNSRUxBVEUjRU1DRUUKU0FMQVJJRVMjI0FTSVMjU0hBS0VTCiMjRVZJQ1QjQUNUT1IjUkVBTE0jIwpTSFJJRUsjQkxBSCMjTE9XQkVBTVMKVEFQQVMjUE9JU0VEI0VZRVMjUkFUCklSQSNUSEVBVEVST0ZXQVIjT0tSQQpOUFIjI09SU08jI1RPSUwjRFVFSU4KVFNLI01WUCMjVElFUlMjUElUVEVECiMjI1NFRSMjUklOU0UjTUlTUyMjIwojTUVNT1JZQkFOSyNDSFVSQ0hLRVkKVE9SQUgjRVJOSUUjQVVSQSNPTlRWCkFMQVJNI0xJVEVSI1NMQVQjTk9ORQpaRVNUWSNQT09SUyNUQUxFI0VUQVM="},{"title":"03/04/13 PAIRINGS","author":"Gail Grabowski, edited by Stanley Newman","date":"2013-03-04","grid":"U0FTSCNISVNTI0xBUEVMClBMRUEjQU5FVyNBQklERQpBTUVOI0xBTUEjUkFOR0UKU0FORCNUV0lOU0lTVEVSCiMjI1RSRUUjI0FBSCMjIwpCRUdPT0QjUE9VVCNFVEMKQUxMT1QjU09PVCMjVFdPCkRVQUxDSVRJWkVOU0hJUApBREQjI05PU0UjT1BFUkEKVEVFI0RVUEUjR05BUkxZCiMjI0FBUyMjU09PTiMjIwpET1VCTEVEQVRFI0lPV0EKQVBSSUwjQUxFUyNBS0lOCk1BR05BI1NUQUIjUkFOVApTTEVEUyNIT0xZI0RZRVM="},{"title":"03/05/13 DO THE TWIST","author":"Sally R. Stein, edited by Stanley Newman","date":"2013-03-05","grid":"U0lMT1MjUFJPTSNBSEVNCkFET1BUI0xBVkEjTUFYSQpNT1RUTyNBTUVSI0FSSUQKIyMjU09GVFBSRVRaRUxTCk1BRyNHVUVTVCNSRVNFVApFTE9QRVJTI0lDRUQjIyMKTk9QRSMjI0NNT04jRUVFClNVUlBSSVNFRU5ESU5HUwpBRE8jT1JFTyMjI05BR1MKIyMjQU1FTiNGSUFOQ0VFCkFJU0xFI1RBTExZI1REUwpETkFNT0xFQ1VMRVMjIyMKSEFMTyNBTlRFI0FMVEFSCk9ORVMjSUNPTiNZRUFSTgpDRVNUI1JFTlQjRURHRVM="},{"title":"03/06/13 WAYS TO GO","author":"Lonnie Burton, edited by Stanley Newman","date":"2013-03-06","grid":"QVNBTUkjU0VUI0FST01BCkxPTkVSI1dBUiNaSVBJVApEVU5OTyNBQ0UjQURFTEUKQVJPVU5EVEhFQ0xPQ0sjCiMjIyNFU0MjI1JFRiMjIwpVTkRFUlRIRVNFQSNBUlQKSE9STlMjI1JBVFMjSFVFCkhPRUQjTEFSR0UjVkVJTgpVU0EjSEVSTyMjREVBTlMKSEVNI09WRVJUSEVFREdFCiMjI0FHRSMjT0FUIyMjIwojQkVUV0VFTlRIRUFDVFMKQ09DT0EjWUVBI1NDT1JFCkRPUk1TI0VFTCNUSFJFRQpTTVVTSCNERFMjU0VFS1M="},{"title":"03/07/13 ADD A LETTER","author":"Billie Truitt, edited by Stanley Newman","date":"2013-03-07","grid":"R09PRkYjRFVDVCNUSVBTCklORElFI0FTSUEjVUdMSQpTVUlURURUT0FUI1hPVVQKSFNOI0xFRSMjRU1FUkdFCiMjI0VCQiNISVJFRCMjIwojUEFZQVRURU5USU9OVE8KRkFDRUQjRVJST1IjT1JHCkFSVFMjREVCVVQjU1RBUgpTQ0kjVFVOQVMjQkFTSUUKVEhJU1dFSUdIU0FUT04jCiMjI1dJTEVFI1VORSMjIwpCSUxPWEkjI0lDSyNESVAKRUtDTyNTRVRUSEVUT05FCkdFRFMjVFJFRSNSQVpPUgpTQVNII1NFQU0jU1BFTlQ="},{"title":"03/08/13 LAW AND ORDER","author":"Ki Lee, edited by Stanley Newman","date":"2013-03-08","grid":"Sk9VU1QjU0tJUCNESVZBCkVBU1lBI0xPTkcjRVRPTgpCUk9OWCNBUklBI0VTVEQKIyMjQ0lUWUFUVE9STkVZCkFSSSMjSFNOI09ORU9ORQpCSUdHSUUjI1NVViNUT1QKQ09VTlRZU0hFUklGRiMjClNURUFNI1RVRyNEQVVOVAojI1NUQVRFR09WRVJOT1IKQkFTI0pFVCMjTE9PTklFCkVESVNPTiNGREEjI1lSUwpGRURFUkFMSlVER0UjIyMKQUxPRSNCT09OI0FSSUVTCkxJTksjTEFSSyNaT1JSTwpMRVRTI0VORFMjRVNTQVk="},{"title":"03/09/13 SATURDAY STUMPER","author":"Lester Ruff, edited by Stanley Newman","date":"2013-03-09","grid":"I0NBU0hFUyNDQU5BREEjClJPVEhJUkEjSE9BWElORwpBUlRJU0FOI0FMQkVSVEEKQlJBTiMjRllJIyNTVElSCkJJQiNTQ1JBVENII0JPTgpJRE8jQ0hBUEVBVSNBQ0UKU0FZV0hFTiNBVE5JR0hUCiMjI1dFRSMjI0VHTyMjIwpTUVVJUlRTI0ZSQVVHSFQKUFVOI1pBUFBJRVIjRUFVCkFJTCNPSEhFTlJZI1JVQgpDWkFSIyNFV0UjI01JTEUKRU5USUNFUiNTVFBFVEVSClNPQ0xPU0UjU1VJVE9SUwojU0hFRVRTI0VYUEVMUyM="},{"title":"03/10/13 NET LOSSES: A court-ly quip","author":"David W. Cromer, edited by Stanley Newman","date":"2013-03-10","grid":"QU5BR1JBTSNHRU5MIyMjU0xFRVZFClBPVEFCTEUjQVRFQU1TI1dFTExFRApPTlRSSUFMI1RIRURFUFJFU1NJTkcKUE9ORCMjRElFI0RFTU9FRCNFVFRFCiMjI0VFTCNEQUlTIyNPTUlUI0VTUwpUSElOR0FCT1VUVEVOTklTSVMjIyMKUkVNI0dPQVQjQk9ORCMjSE9IT0hPCklNUFMjU1RPVkUjQ0FSUyNTQVZFRApQSUVUQSNIT0UjVEFLRVRPI1JFQUQKRU5MQUNFIyNUSUVSI05BU0NFTlQjCiMjI1RIQVROT01BVFRFUkhPVyMjIwojQ0hFRVJJTyNQUkFZIyNBUkFSQVQKVEhJUyNMRVRGTFkjUE9TI1BST0JFCkJFRk9HI1NJTE8jQU9SVEEjRVRPTgpBTUlOT1IjI0FEQU0jQVVOVCNPTVMKIyMjR09PRElHRVRJTExORVZFUkJFClBGQyNGTEFQIyNQRUFMI1dBTiMjIwpMSUFNI09EQU1BRSNEWUUjI1RSSVAKQVNHT09EQVNBV0FMTCNUQVBJT0NBClRIRU9ORSNTUEVDSUUjQUxBUk1FRApIWURST1gjIyNERUVEI1NUUkVFVFM="},{"title":"03/11/13 CITY NICKNAMES","author":"Gail Grabowski, edited by Stanley Newman","date":"2013-03-11","grid":"Q1JBTSNGQUNFI1NQT1JFCkxBVkEjQUxNQSNUT0RBWQpBVE9OI0JJT1MjQUxPTkUKTkVXWU9SS05FV1lPUksjCiMjIyNQSUUjI0hBUyMjIwpPTlNQRUMjQUJFVCNTT04KU09MQVIjVFJFRSNPSE5PCkNISUNBR09JTExJTk9JUwpBSURFI1JVU1QjREVVQ0UKUlRFI1JBUkUjUEFTVEVTCiMjI1NBUCMjTkFIIyMjIwojREVOVkVSQ09MT1JBRE8KTUVMRUUjRUFWRSNBUklECkFMTEFOI0FQRVMjVElNRQpESVNLUyNNRUxUI1NBU1M="},{"title":"03/12/13 EURO-TREATS","author":"Billie Truitt, edited by Stanley Newman","date":"2013-03-12","grid":"Q09NSUMjQkVSVCNBSVJTClVQT05BI0FSSUEjU09PVApGRUxPTiNTSVNJI1NUQVkKRlJFTkNISUNFQ1JFQU0jCiMjIyNFRUwjI0hBVCMjIwpSRUNBTEwjVU5JVCNBTVQKQUxPVCNFQVNFI0lTU1VFCkdFUk1BTkNIT0NPTEFURQpFTkRPTiNNRU5VI09NRU4KREFTI1ZFRVIjUkFQSURTCiMjI1NJWCMjQUlNIyMjIwojSVRBTElBTkNPT0tJRVMKSVJPTiNTVElSI1JJREdFClJBRlQjVE9ORSNBVEVBVApBUVVBI1NQQVMjTEVBRFM="},{"title":"03/13/13 I'M A FAN","author":"Sally R. Stein, edited by Stanley Newman","date":"2013-03-13","grid":"UFVUT04jU0hBRCNQQUlSCkFST01BI1RBWEkjQUNNRQpTTEFORyNPV0VTI1BJUEUKIyNESUFNT05EQkxBREVTCkFIUyNOSVAjI0FVU1NJRQpOT1RJT04jVE9STiMjIyMKR09PRCNURUFNI0FSQk9SClNIT09UU1RIRUJSRUVaRQpUQUxMWSNBT05FI0VHT1MKIyMjI0xPU0UjRkVMSU5FCkZVU1NFUyMjRElEI05FVApJTkNJUkNVTEFUSU9OIyMKU1RBUiNBVE9aI0NSSUJTClRJUkUjUkFWRSNURU5FVApTRUVOI1NIRUQjU09HR1k="},{"title":"03/14/13 SYNTHETICS","author":"Fred Piscop, edited by Stanley Newman","date":"2013-03-14","grid":"QVNURVIjUE9LRSNQRVRBClNUT1ZFI0FNRVgjQVZPTgpLVU5JUyNUSU5FI1JFTlQKI05ZTE9OU1RPQ0tJTkdTCiMjIyNSQVkjIyNFU1NBWQpHUklUVFkjQU1JU0gjIyMKQUlSRSMjRU1PVEUjT0tTClNQQU5ERVhCT0RZU1VJVApIRU4jT1ZBTFMjI0FTVEkKIyMjU1VFTUUjVEVYVEVSClNUQVRTIyMjRE9OIyMjIwpQT0xZRVNURVJQQU5UUyMKSURPTCNMQVZBI01PUkFMCkNBTkUjT01FTiNFVk9LRQpFWUVEI1BFUksjTEFURVg="},{"title":"03/15/13 UNUSUAL CLUB","author":"S.N., edited by Stanley Newman","date":"2013-03-15","grid":"TEVWSVMjU0FGRSNTQ0FNCkFMT05FI0FCVVQjQ09QRQpOT0lTRSNNT1NUI09NRU4KRVBMVVJJQlVTVU5VTSMjClNFQUwjTUFUIyNCUk9JTAojIyNBSU1TI0ZDQyNETkEKU0NPTkNFI0pMTyNGT0JTCkNVTFRVUkVWVUxUVVJFUwpPVElTI1NFQyNMQVJFRE8KV0lHI1BFRyNGSUpJIyMjClNUT0tFIyNNT0UjT09QUwojI1BVVFVQT1JTSFVUVVAKQ0xPRCNIRURZI0FTVFJPCk9TTE8jT1JFTyNTTEVFVApCVVlTI0hVTFUjUFlSRVM="},{"title":"03/16/13 SATURDAY STUMPER","author":"Lars G. Doubleday, edited by Stanley Newman","date":"2013-03-16","grid":"U05PV0dMT0JFI1JJRkZTCk1BTklMQUJBWSNJTkRJQQpBQk9SSUdJTkUjQ09BU1QKIyMjRVRTRVEjQk9OQUNJClNUQVJaIyNVVEFII1BBTgpUVU5TI1NPT0VZI0NQTFMKRU5FI05PSCNKT01BUkNICkdBU0NBTlMjQU5BVE9MRQpPVFRPTUFOI05FTyNWSUUKU0FITCNUQVJPVCNSQUZUCkFSRSNDQVBFIyNHT0xGUwpVVFRFUlMjTUVNT1MjIyMKUkFJU0UjUE9MSVRJQ09TClVSU0FFI1RSQVNIVEFMSwpTRVRVUCNTQUxUU0FXQVk="},{"title":"03/17/13 NUMERICAL ORDER: Arithmetically correct","author":"Lonnie Burton, edited by Stanley Newman","date":"2013-03-17","grid":"U0xFRCNTUFJVQ0UjUkFOREQjREpTClRBTEUjQVJFTkFTI0VJRUlPI1JVTgpQUklWQVRFRklSU1RDTEFTUyNBTEEKQVZPSUQjU1NUIyNXT0UjQklHV0lHClRBVFRPT1MjU0VDT05EQkFOQU5BUwojIyNPU0FLQSNBTFMjI0lOR0UjIyMKRVNMIyNGSUdBUk8jUE9ORCNMQUNLClRISVJEU1RSSU5HRVJTIyNESVhPTgpBVURJTyMjQURTI1NBQyNERUNJREUKU1RPUEdBUCMjI0hBREFGSVQjU0VFCiMjIyNGT1VSVEhRVUFSVEVSIyMjIwpKT0cjQU5HT1JBUyMjI1NUQVJNQVAKQVBJRUNFI09ZTCNDRFMjI0lSQVRFCkJFTExFIyNGSUZUSERJTUVOU0lPTgpTTkFQI01BU1QjT1VUQUNUIyNMUFMKIyMjQUZBUiMjTU9NI01FQ0NBIyMjClRIRVNJWFRIU0VOU0UjU0hBTExPVApCSUxPWEkjT0FSIyNSRUMjU1BJTkUKQVJDI0lNSU5TRVZFTlRISEVBVkVOCkxFSSNOQVBFUyNXQUlURVIjQ0VOVApMRUQjR0xPUlkjU1RFRVJTI0FERFM="},{"title":"03/18/13 PUT A LID ON IT","author":"Gail Grabowski, edited by Stanley Newman","date":"2013-03-18","grid":"R1JBRCNQSUFOTyNTQ0FNCk5PU0UjQVJET1IjUEFMRQpBU0lTI1NBVVRFI09ORVMKVEVBS0VUVExFI0xVTkNICiMjI1NMRUVUI1NJU0kjIwpBU1NFU1MjI0RFRkVOU0UKU1BPVCMjRkxFRVQjR09ECktJRCNBTExFQVJTI0pVRwpFUkEjV09PRVIjI0JBTkUKV0VCUEFHRSMjR1VBUkRTCiMjT1VSUyNDT09LUyMjIwpMQVRURSNDT0ZGRUVQT1QKQUNUUyNNT0xBUiNIT0JPCktJTE8jQURBR0UjSVJPTgpFREVOI1JFU0VFI1RFRVM="},{"title":"03/19/13 ESSAY TEST","author":"Sally R. Stein, edited by Stanley Newman","date":"2013-03-19","grid":"T0NURVQjQU1NTyNQQVRTCk9MSVZFI0RFQU4jQUxPRQpIQVZFTiNNQUlMI1dFUkUKU1BPUlRTQU5OT1VOQ0VSCiMjIyNIRU4jI0FCUyMjIwpIT0FSU0UjUkVOTyNBTUEKT05DRSNURUFSI0FBUk9OClNUVURJT0FQQVJUTUVOVApUT1JTTyNSSVNFI1BBVEUKU1BBI1dBTkQjTE9TU0VTCiMjI1BBTiMjU0lCIyMjIwpTQVZJTkdTQUNDT1VOVFMKVEhJTiNMSU1FI0lOT0lMCkFPTkUjRURFTiNTVE9SRQpSWUVTI1NFTlQjVE9ORUQ="},{"title":"03/20/13 MUSIC QUARTET","author":"Charles Slack, edited by Stanley Newman","date":"2013-03-20","grid":"RlVFTCNTUE9UUyMjRkxVCkFOVEkjQ0FSSE9QI09BUgpST0NLR0FSREVOUyNMUE4KIyNIRUFSS0VOI0FTSyMjCiMjIyNCRUFSI0NMQVdTIwpBUFBBTFMjI0pVTVBJRVIKU0hPVkUjRkxVQlMjU1JJClRBUEUjWkFJUkUjT0RFUwpFU1EjRklaWlkjQUxPTkUKUkVVTklURSMjQlJFTUVOCiNTSU5BSSNET0xUIyMjIwojI1pFTiNMT1RVU0VTIyMKQklaI0NPVU5UUllDTFVCCkFDRSNFQVJORVIjSE9TRQpZRVMjI1RFQVJZI09QRU4="},{"title":"03/21/13 WORKING WRITERS","author":"S.N., edited by Stanley Newman","date":"2013-03-21","grid":"RE9MVFMjUFJFUyNTSURFCk9IQVJBI09JTksjSVJJUwpVU1VBTCNPTkxZI1NPTlMKUlVEWUFSREtJUExJTkcjCkVSRSNERUwjU0VBI0VEVQpSRUQjQkxFQVQjQklET04KIyMjQUFBI0xFRSNNT05PCiNIRU5SWUZJRUxESU5HIwpNT0FUI1NJVCNUQU4jIyMKR09USVQjUk9CT1QjVFJBCk1EUyNJTEUjQVJFI0hVTgojV0lMTElBTUdPTERJTkcKRElOTyNUV0lHI0lSRU5FClVOVE8jSEFSRSNOQVZFTApPS09LI0VZRUQjRVdFUlM="},{"title":"03/22/13 NEGATIVE ENDINGS","author":"Bruce R. Sutphin, edited by Stanley Newman","date":"2013-03-22","grid":"U0hFRCNOVUJTI0VCQkVEClRPUkUjQ1JPVyNRQVRBUgpFVEFMI0FOVEUjVVNVUlkKUk9TSEhBU0hBTkFIIyMjCkVJRUlPIyMjVE9URUJBRwpPTEQjTUlDRSNERVNPVE8KIyMjI0VMT1BFIyNJTlRPCiNDSEFSTEVTREFSTkFZIwpTSE9EIyNET0dNQSMjIyMKVEFMRVNFI01FQU4jU0FDClBSRVFVRUwjIyNVU0hFUgojIyNVUFJJR0hUUElBTk8KU1RSQVAjRlJFRSNHUkVXCklSQVRFI1RJUkUjTUVJTgpUWUdFUiNTVEVNI0FERFM="},{"title":"03/23/13 SATURDAY STUMPER","author":"Brad Wilber, edited by Stanley Newman","date":"2013-03-23","grid":"I1BBV05FRSMjQ0FST01TCkFMVE9PTkEjUEhMRVZFTApQQVJLU0lUI0FMQU1FREEKQUdFI0hBTENZT04jUklNClJVU1QjQ1VSSUUjQUhFTQpURVRPTiNOVU4jU1VBVkUKIyMjV0FBQ1MjSkFHVUFSCiNHTEFTU0hBTEZGVUxMIwpBTk9SQUsjRFVLRVMjIyMKU0FOREwjTEVNI1NUQUlSCkFXRVMjVkVSQlMjQUxEQQpMRVMjVEVBU0VUUyNUSU4KQURPTkFJUyNST0FESE9HClJPTUFJTkUjRUxHUkVDTwpLTkVFTFMjI0RFRUpBWSM="},{"title":"03/24/13 '88 IN REVIEW: What happened 25 years ago","author":"S.N., edited by Stanley Newman","date":"2013-03-24","grid":"QVRBUkkjSUJJUyNTVEVWRSNGUk9NCldBR09OI1NBR0EjVElCRVIjUkVOTwpFVVJPVklTSU9OI1VNQkVSVE9FQ08KU1RBS0VPVVQjSkVESVMjI1VOREVSCiMjIyNTVUUjQk9SRUQjQ09MRCMjIwpCRUFTVFMjU1VTQU4jTUFOUyNNU1QKQUJVVFMjUEVSRVNUUk9JS0EjVU5BClRPTlkjSEFMUyMjI0VBUlAjRFJJUApIT1QjTE9SRVRUQUxZTk4jVElQUEkKU0tJUE9MRVMjSVZJRVMjRUlUSEVSCiMjRUFWRVMjQkFSTlMjUkFUVFkjIwpBQkFURVMjQ1VSSUUjRUFSTE9CRVMKWk9ORUQjUk9ZQUxSVU1CTEUjUllFClRPTlMjUk9ERSMjI1NFQVMjTE9JTgpFRUUjUlVQRVJUR1JJTlQjR09XTlMKQ0RTI0hFRUQjUk9VTkQjR1JVTkdFCiMjI0xJRFMjQ1VJTkcjQUxBIyMjIwpPQ0VBTiMjQ0hJTkEjRVBJQ1BPRVQKRE9ER0VBUklFUyNNQVRUQklPTkRJCkVSR08jQ0hBU00jT1ZBTCNBQ1RJTgpTRUVTI0hPT1RTI0tBVFkjU09PVFk="},{"title":"03/25/13 THAT'S WONDERFUL","author":"Billie Truitt, edited by Stanley Newman","date":"2013-03-25","grid":"Q1JPUCNURU5PUiNNQVNTCkhPTkUjQURPUkUjQVJFQQpBTUVTI1BJTEFGI1JJTksKRkFOVEFTVElDI0VWQURFCkVORE9XIyNFTFVERSMjIwojIyMjT0xFI0VOR0xJU0gKSU5BRkxBU0gjQkVPTlRPClRJS0kjU0NVQkEjVVNFUwpBTEFSTVMjVElSRVNPTUUKTEVTU0VFUyNUU0EjIyMjCiMjI1RBU1RFIyNST0xFUwpTVEFSVCNFWENFTExFTlQKTEFWQSNVTlRJTCNEQVRBCkVYSVQjU0NSQU0jRVZFTgpXSURFI0NIQU9TI05FUkQ="},{"title":"03/26/13 LAST LIGHT","author":"Gail Grabowski, edited by Stanley Newman","date":"2013-03-26","grid":"UElUUyNCQUdTI1JBQ0VECkVDSE8jQUxPRSNBUk9NQQpTT0FSI1JPQVIjTUVMT04KT05JT05CVUxCIyNOT1RFCiMjI1JFRUQjI0FET1JFUwpDQVZJQVIjSEFCSVQjIyMKQUJFVCMjT0FTSVMjREFTClBMQVlJTkdXSVRIRklSRQpFRUwjUEFSS0EjI0VSSUUKIyMjSE9NRVMjU1VMVEFOCkFCUkFERSMjRUFTVCMjIwpDTEFOIyNNT1ZJRVNUQVIKTUVORFMjRVZFTiNBSURFCkVBR0xFI1NFTlQjRkxBUApTS0VFVCNBTlRTI0VMTVM="},{"title":"03/27/13 DAY AT THE RACES","author":"Charles Slack, edited by Stanley Newman","date":"2013-03-27","grid":"UFRBUyMjRUxTRSNDSEFUCkxBQ1kjR0xFQU0jUk9ERQpPWEVOI1JFQUxNI0FWT04KRElTQ0pPQ0tFWSNaRVJPCiMjIyNPVVRTIyNUWUxFUgpCT1VHSFQjI01FU0gjIyMKQVJTT04jI1NVUFBPUlRTClJFRUwjUFJJTUEjUkVBUApCT1JERUFVWCMjT1NBS0EKIyMjRUFTRSMjT01FTEVUCkZMSU5UIyNGT0NJIyMjIwpMVU5HI0xBVUdIVFJBQ0sKVUNMQSNFQUdMRSNBTE9FCkZSRVQjVFJVRVIjU1RPUApGRVRFI1NQRUQjI0hPU1Q="},{"title":"03/28/13 COUNTRY BAND","author":"Fred Piscop, edited by Stanley Newman","date":"2013-03-28","grid":"QVdGVUwjREVGVCNDSEFUClNPVVNBI0VWRVIjSE9ORQpIT01FWSNMSVRFI0FTSUEKI0ZFREVSQUxFWFBSRVNTCiMjIyNST1kjIyNBR1JFRQpQVVJFU1QjQVBQTEUjIyMKQUhPWSMjV1JJVEUjQVBUCkRPTUVTVElDUEFSVE5FUgpTSEUjT0FTRVMjI0lPVEEKIyMjQUNURUQjRElTTkVZClNQQVJLIyMjU09EIyMjIwpOQVRJT05BTExFQUdVRSMKT05FUyNPQk9FI0hBTkRZCk9ESUUjRUxTRSNPTERJRQpQQU5TI0xFRUsjU0xPVFM="},{"title":"03/29/13 FEATHERED FELLOWS","author":"S.N., edited by Stanley Newman","date":"2013-03-29","grid":"UFJFUCNERVBQI1NBTU1ZCkhFUkUjQVFVQSNBQkFTRQpEQU5LI0JVTEIjTk9PTkUKU1BPT05CSUxMI0NBUkJTCiMjUkVBTCMjT1NUUklDSApGTFUjQkVUUyNBSUQjIyMKUlVCIyMjSEVBUlQjVE5UCkFMSSNCTFVFSkFZI0FJUgpZVUsjQU9SVEEjIyNTS0kKIyMjQVNTI09SQUwjS0VHCkNISUNLRU4jI01JRkYjIwpMQU5DRSNBTEJBVFJPU1MKQVNDT1QjU1VFWiNPUkVPClNUQVJSI0FCTEUjU0NBTgpIQU5EWSNMRVRTI1RFTlM="},{"title":"03/30/13 SATURDAY STUMPER","author":"Bruce R. Sutphin, edited by Stanley Newman","date":"2013-03-30","grid":"U1RBTkRBVCNQT1RIRVJCClRBUk5JU0gjQkxPT1BFUgpFRE1FRVNFI1NPUlZJTk8KSVBPI01BU09OUlkjVEFHCk5PUk0jWUFXRUQjQ09NQQpFTEVDVCNNRVcjUFJNRU4KTUVSQ1lNRSNTQ1JFRURTCiMjI0FQVCMjI1NPUyMjIwpQQ0NMT05FI0pBTVRBUlQKVVJBTFMjWU9VI1NFVkVSClJBTVMjVEVOUE0jREFMSQpJTVAjTUVTU0lBSCNSSVAKU1BBTklTSCNUUkVWSU5PClRPUk9OVE8jRU5MQUNFRApTTklERVNUI1JFRE5FU1M="},{"title":"03/31/13 GRAY MATTER: Just peruse the clues","author":"Fred Piscop, edited by Stanley Newman","date":"2013-03-31","grid":"TUFaREEjREFMSSNTS0lTI1BJTlVQCk9IQVJFI0FSQUIjQU5URSNBV0FLRQpPU0NBUldJTERFI1dFSU1BUkFORVIKIyMjTk9JU0UjRklSRVNJUkVOIyMjCiNUU0sjRFlTI09XRUQjI01FTlVTIwpTRUVUSEUjI1RST0QjV0JBI0FORVcKSEFOT0kjS0FZRSMjU0hJTlMjRElSClVQSSNLSU5EUkVEU1BJUklUI0VLRQpUT09ORVNJREUjRUNBUkQjQUtST04KI1RSSSNMVFMjR05BVFMjVFJPVFMjCiMjQ09WRVMjU0hJUkUjU0FSQUgjIwojVklCRVMjU01BWkUjQVlSI0xFRyMKREVURVIjQk9PTkUjQUNST0JBVElDClVOSSNCTEFDS0FORFdISVRFI0FETwpET1ojU0lMS1kjI0FSRUEjVFVCRVIKU1VFRCNUS08jTEVWWSMjQkFOTE9OCiNTTk9SVCMjU09MSSNTQUUjRUVOIwojIyNDT0xJU0VVTVMjT01FR0EjIyMKQkFUVExFU0hJUCNDQUxJRk9STklBCkFMT09GI05PTkUjVVJJUyNBVEJBWQpHRU5SRSNURUVTI1BFRFMjVEhBTkU="},{"title":"04/01/13 COME FRY WITH ME","author":"Gail Grabowski, edited by Stanley Newman","date":"2013-04-01","grid":"Q0FUUyNET0xMUyNDT01CCkFSRUEjRU1BSUwjSElZQQpMSVNUI1BFTk5ZI0VMTVMKRkFUQ0hBTkNFI1JFRFlFCiMjI0hPUlNFI0NPUkUjIwpBVEJFU1QjI1BMQVlQRU4KRkFVTFQjU0FMQUQjT1hPClJVVCMjS0FQT1cjI1NJVApPTlQjUklWRVQjQUdJTEUKU1RFUE9ORSMjUklPVEVECiMjUk9PSyNBTEVSVCMjIwpERUJVVCNHUkVBU0VHVU4KT1BFTiNSQURBUiNWQVNFCkxFQUQjSUxPU0UjRUxTRQpURU5TI1BBUkVEI05FUkQ="},{"title":"04/02/13 FAIRY TALE FOLKS","author":"Billie Truitt, edited by Stanley Newman","date":"2013-04-02","grid":"VE9QUyNDQVNII0dSQVNTCldIT0EjT0FIVSNBRVNPUApJTk9OI09SQUwjU05BUkUKR09MRElMT0NLUyNPUEVECiMjI0JSSU5LI0xBVyMjIwpBR0hBU1QjI0JBRE5FV1MKQkxPRyMjQk9VTkQjTlJBCkhBTlNFTEFOREdSRVRFTApPREQjVklCRVMjI1ZFU1QKUkVBRElMWSMjVEhJUlRZCiMjI0FMQSNTQVdFRCMjIwpFREVOI0NJTkRFUkVMTEEKTEFSR0UjUk9NRSNOT09OClNUQUxFI0FSSUQjQ0FOVApFQVNFTCNORVRTI0VER0U="},{"title":"04/03/13 FARM TEAM","author":"Fred Piscop, edited by Stanley Newman","date":"2013-04-03","grid":"UkFJU0UjV0hJVCNBU1BTCkFDUkVTI0FJREEjU0hPTwpDSElDS0VOUE9YI0hFSVIKWUVTU0lSRSNMSUVURVNUCiMjIyNNQVNTIyNST1BFUwpOQUNIT1MjVEFQSU5TIyMKT0JPRVMjSFVST04jSEFNClNFV1MjSk9ESUUjTUFYSQpFVEMjVE9ZRUQjUEFORUwKIyNBTVlUQU4jUElDS0xFCkFDVFVQIyNUSEFUIyMjIwpMQUNUT1NFI0FUQUNPU1QKT1NIQSNIT1JTRVBPV0VSCkZFRVQjSU5BTiNBUkVOQQpUWVJFI1BTU1QjVEVERFk="},{"title":"04/04/13 SEESAW","author":"S.N., edited by Stanley Newman","date":"2013-04-04","grid":"UEVSUCNTTElEI1NQT0tFCk9QQUwjUElTQSNFQVNFTApXSVNFI0FCRVQjWFlMRU0KI0NIQUlOUkVBQ1RJT04jCiMjIyNNSUEjI01FTiMjIwpBUk9VU0UjVE9PVCNQUk8KQlVaWkFMRFJJTiNGTElQCkFSQUlEI1JVTiNDQVVTRQpUQVJTI0hBQ0tXUklURVIKRUxLI0ZFVEUjQVVST1JBCiMjI0VSQSMjVVNFIyMjIwojU0FCRVJSQVRUTElORyMKU0lMT1MjRVFVSSNST09UCkFURU9OI0JVUk4jS05FVwpHRUNLTyNTQU5HI1NPU08="},{"title":"04/05/13 FLUID MOTION","author":"Bruce R. Sutphin, edited by Stanley Newman","date":"2013-04-05","grid":"IyNCQU1BI09OUyNST0FSCiNDSUdBUiNJS0UjVU5ETwpXQVRFUk1FTE9OU0VFRFMKQU1BVEkjUkVUSUUjQUxFCkhPVFdBVEVSQk9UVExFUwojIyNPSEgjIyNSVEUjIyMKT1RCIyNBTUlEI0VSVVBUCldISVRFV0FURVJSQUZUUwpMRU9JViNOT05FIyNPQUsKIyMjVkVSIyMjTkZDIyMjCk1FVE9ORVNXQVRFUkxPTwpJQ0UjSURBSE8jTkVBTEUKRE9FU05USE9MRFdBVEVSCkFOTkEjRUlTI09BVEVTIwpTT1NPI0FCRSNFWUVSIyM="},{"title":"04/06/13 SATURDAY STUMPER","author":"Anna Stiga, edited by Stanley Newman","date":"2013-04-06","grid":"TUFNQUJFQVIjUExBTkFSCklOQ0hBUkdFI0xFVklORQpNQUhPR0FOWSNBRkdIQU4KT0xBWSMjRU5BQ1QjSUNFClNPTCNWSVNBVklTI0xPRwpBR0VHQVAjUklEI1NJTkUKIyMjVUdBTkRBI01JU0RPCkVYQ0xVREUjUkVJVE1BTgpHUk9QRSNHVVlBTkEjIyMKR0FMUyNSQVQjU09SVElFCkNZRCNQRVRJVEVTI0FERApSRUYjQURFTEUjI1NIT1cKQVlFQVlFI0lOU0FOSVRZClRFRVBFRSNaT09NSU5PTgpFU1RFRU0jRVJVUFRJT04="},{"title":"04/07/13 THAT SINKING FEELING: On various plumbing matters","author":"Gail Grabowski, edited by Stanley Newman","date":"2013-04-07","grid":"QUREUyNaRUVTI1dBRlRTI0dFTlJFCkJVUlQjQUJVVCNFTUVSWSNBRElPUwpMRUFSI0dPUkUjTk9USU4jRklMTVMKRUxCT1dST09NI0RSSVBDT0ZGRUUjCiMjI0xFRUsjI1JFRURTI0ZFWSMjIwpBUlRMQUIjV0VFRCMjI0FVUyNCU0EKU1VSRVIjV0lOUyNBTUFTUyMjTEFQCklCQVIjV0lORE9XV0FTSEVSI09MRQpBTFAjQkFOSyNET0dUT1kjQVRXQVIKTkVTVEVHR1MjI1JFRUYjU1RFQURZCiMjSElSRVMjUkFLRVMjRVdJTkcjIwpBVE9ORVMjVE9FUyMjUExBTlRBSU4KQk9PU1QjQVJBUkFUI1JJTkcjU1JJCkFOVCNTRUNVUklUWUxFQUsjU0tJVApTRUUjI1RIRVNFI1BBU1MjR0VFU0UKRVJSI1NIWSMjI01FV1MjTU9OVEhTCiMjI1NQQSNBQ1RFRCMjU0VBVCMjIwojQlJBSU5EUkFJTiNQSVBFRFJFQU0KQUxJR04jRU1CRUQjQUJJVCNJRExFClJVUEVFI05PTElFI1BFUlUjRUdPUwpDUkVTVCNUUkVORCNBVE9QI1NFVFM="},{"title":"04/08/13 PARTS OF SPEECH","author":"Gail Grabowski, edited by Stanley Newman","date":"2013-04-08","grid":"U0VFUCNBTFRPI0NCU1RWClBBQ0UjU0VBTCNBTE9IQQpBQ0hFI0NBS0UjUkFOT04KI0hPTERPTkVTVE9OR1VFCiMjIyNBVEUjI0VMSyMjIwpTSEFGVCNEQU5FUyNBTEUKTEFETEVTI0NBVCNEUkFUCkFSTUVEVE9USEVURUVUSApCRUFEI0lSQSNSRUxBVEUKU1NOI1BSRVNTI01JU0VSCiMjI0VMSSMjVEFQIyMjIwpET1dOSU5USEVNT1VUSCMKQUJPREUjV0FSTiNST09UClJPVkVSI09SRU8jR0xFRQpORUVEUyNTUE9UI0VMU0U="},{"title":"04/09/13 ON THE MARCH","author":"Sally R. Stein, edited by Stanley Newman","date":"2013-04-09","grid":"UExBTiNDQVJCI1ZJUlVTClJJU0UjT0JPRSNJTlVTRQpPTUlUI05FQVQjRURJQ1QKI0JBU0lDVFJBSU5JTkcjCiMjIyNERVMjI0FOQSMjIwpIQVJCT1IjQUJMRSNQQ1QKQVJJQSNUQUNPI1NQSVJFCkhVUFRXT1RIUkVFRk9VUgpBQlVTRSNUT0dBI0NVRVMKU0FQI1JFTk8jUkFTU0xFCiMjI0RFRSMjUExZIyMjIwojRFJJTExTRVJHRUFOVCMKUElBTk8jUEFJUiNST09NCkVMVkVTI0FDTUUjQ0FHRQpBTEVSVCNUSEVZI1NIT1Q="},{"title":"04/10/13 TRAVEL TRIO","author":"Billie Truitt, edited by Stanley Newman","date":"2013-04-10","grid":"VENCWSNPTUFOI05BVkVMCldPUkUjSEVMSSNFWElMRQpJQ0VTI0lNQUMjQUxJS0UKUk9XRURUT1NIT1JFIyMjCkxBU1NPUyMjRUxNI1RTUAojIyMjVFlQTyNESUxBVEUKQ0hBVCNPQVRTI1NBQkVSClJPREVPVVRUSEVTVE9STQpBQkFDSyNTRUVNI0VPTlMKVE9QSEFUI1JBUFMjIyMjCkVTVCNZRUEjI0VJRkZFTAojIyNST0FEV0FSUklPUlMKTEFTSUsjSEFMTyNOQU5BCkFHSVRBI09ET1IjRU1JVApNT05FWSNDRUVTI0RZRVM="},{"title":"04/11/13 CALLING CLINT","author":"Fred Piscop, edited by Stanley Newman","date":"2013-04-11","grid":"RkFXTiNTT0RBI1BBU1RFCkVDSE8jUExVUyNJQ0VJTgpUSEVHT09EU0hFUEhFUkQKQ09FI1RSRUsjUkVFU0VTCkhPTFNURVIjQ1JVRCMjIwojIyNMQVMjU0xPUCNDQU4KU1RSQVcjU1RBUiNCUklPClRIRUJBRE5FV1NCRUFSUwpJT05TI1JBUFMjQUJCRVkKUlVUI0ZJUlMjQlJPIyMjCiMjI1JPVkUjQklUUEFSVApBU0hPUkUjT1JTTyNMQVkKVEhFVUdMWURVQ0tMSU5HClRPUlRFI0lPVEEjU0FHRQpZRVNFUyNQUkVZI1VTRVI="},{"title":"04/12/13 WHAT'S THE HOLDUP?","author":"Steve Salitan, edited by Stanley Newman","date":"2013-04-12","grid":"UEVTVFMjRURHRVMjU1BBCkNBTUVPI1NJRU5BI0FSVApUUkFGRklDSkFNUyNOT1QKIyNDTEFOI09SRVMjRkJJCk1BS08jSFVOVFMjQ1JPQwpPUEVOQkFSI09ISU9BTlMKV0VEI09MR0EjI05PTk8jCiMjI0xJRkVWRVNUUyMjIwojRFVFTCMjRVZFUiNWUFMKVFVOSVNJQSNJTE9WRUlUCkFCQ1MjU01BTEwjSVNQWQpOSUwjSVJBUyNURUFTIyMKR09PI0JBTktST0JCRVJTCkxVRyNNRURJQSNBTExPVApFU1MjU0xBTlQjWUVTRVM="},{"title":"04/13/13 SATURDAY STUMPER","author":"Brad Wilber, edited by Stanley Newman","date":"2013-04-13","grid":"TU9KSVRPUyMjSkFHR0VSCkFOQUxPR1kjI1VWVUxBRQpUQUNLTEVSUyNSRVRPUlQKRVNRI0xFQU5UTyMjUkJJCiNQVVNTI0NPUlJPU0lPTgpEUkFUI0JVUlkjQVFBQkEKVkVST05FU0UjU1RVIyMjClJFRFJPU0UjU0VFQUxTTwojIyNBQlMjTElBUkxJQVIKT1NBR0UjWkVEUyNPS0lFClVOV0VMQ09NRSNCUkVMIwpURUMjI0hPT1BFUiNOSVAKU0VNSVRFI05PVEFCRU5FCkFaT1JFUyMjVEFLRVNUTwpURU5BTlQjI1NURVRTT04="},{"title":"04/14/13 DOUBLE DUTY: Taxes taken two at a time","author":"Bruce Venzke, edited by Stanley Newman","date":"2013-04-14","grid":"R0FSUCNTUEFSI0hBQklUI0NIQU1QCkFMT0UjVE9ETyNBV0FSRSNMSU1PUwpTVE9QI0FHRUQjTEFURVgjQURJT1MKQ0lUWVBST1BFUlRZIyNUUklERU5UCkFNVVNFIyNUT08jI0VOU1VSRSMjIwpOQVAjUEFSIyNCUkVWRSNERU5URUQKIyMjQVVUT01PQklMRVVTRSNST0xFClNPRlRQRURBTCNHRVNURSNHT09TRQpBTkVXIyMjQ0RST00jI1BJTE9URUQKU1RBVEVCT1JERVIjSkVUU0FNIyMjCkhPVCNCQUJPT04jTUVMRUVTI0NGTwojIyNMT1NJTkcjRVNUQVRFU0FMRVMKQVRUVU5FUyMjQU5UU1kjIyNDQUxMClBSRVhZI1BFUlNFI0VOVEVSSU5UTwpQRVJVI0NPUlBPUkFURUhFQUQjIyMKU0VBUkNII0lNTk9UIyNZRU4jQk1XCiMjI1lFQVJOUyMjSU1QIyNDTEVBUgpQUk9GQU5FIyNIT1RFTFZFSElDTEUKRFVMTFMjQUREVVAjRFVFTCNWQVRTCkFMR0FFI0NPVU5UI0lURU0jRU1JVApTRUFUUyNURU5UUyNDT1BTI0RFTlM="},{"title":"04/15/13 TAX TERMS","author":"Gail Grabowski, edited by Stanley Newman","date":"2013-04-15","grid":"Q0xBRCNNQVNUI0hBREFUClJJU0UjT0hJTyNPQ0FMQQpPUkFMI0hBTkcjQkVUT04KQ0FQSVRBTEdBSU4jRUVLCiMjIyNXSVQjI0NPUyMjIwpDQU5URVIjI0RFQkFURSMKQURPUkUjQVJFQSNURUFNCkJVU0lORVNTRVhQRU5TRQpTTElQI05JVFMjUkVTRVcKI1RSVVNUUyMjUEFORUxTCiMjI1BJRSMjVk9XIyMjIwpTSFkjR1JPU1NJTkNPTUUKVE9PVEgjTE9JUyNBUklECklOR09UI0VER0UjTUVORApSRUFQUyNTQU5EI1BPS1k="},{"title":"04/16/13 TENNIS TIME","author":"Billie Truitt, edited by Stanley Newman","date":"2013-04-16","grid":"QklHRCMjQkVSRyNBU0FQCkFETElCI0VWSUwjSFVMTApMRUFWRSNXSU5FI0FSSUEKTUFERUFSQUNLRVQjRkJJCiMjI1NQVVJUIyNFQVRJTgpCQ0QjQUxFI1JBTkNIIyMKT1JBQ0xFI0ZBUlRIRVNUCllPWU8jT1JBVEUjT05PUgpTV0lNU1VJVCNBTU9FQkEKIyNORUFUTyNQUk8jVFNQClBBQ1RTIyNUQVVOVCMjIwpBR08jSEFWSU5HQUJBTEwKVFJVRSNMQVRFI0NPQ09BCkhFUlMjU0lMTCNPTkVORApTRVRTI09ORVMjI0VER1k="},{"title":"04/17/13 MAXIMUM RISK","author":"Charles Slack, edited by Stanley Newman","date":"2013-04-17","grid":"U1RPUFMjQUNFRCNVU0VTCkFXQVJFI1BSRVkjSEVFUApHT0ZPUkJST0tFI0hFUk8KIyMjI01FT1cjU1RVRElPCiNTQU1PQU4jIyNXSEVFTApERUNBTlQjVFJVRSNEUlMKVUdMWSMjU0hJTkVTIyMjCkRPVUJMRU9STk9USElORwojIyNFQVJORUQjI0lERUEKRElEI1BBR0UjQlVSTEFQCkFDVVRFIyMjUFVOVEVSIwpORUJVTEEjU0FTUyMjIyMKQ0FMRiNCRVRUSEVGQVJNCkVYSVQjVVRBSCNBUkJPUgpERU5TI1RBR1MjTElTVFM="},{"title":"04/18/13 ON YOUR OWN","author":"David W. Cromer, edited by Stanley Newman","date":"2013-04-18","grid":"Q0xBRCNDUEFTI0FHUkVFCkhZUE8jSE9QRSNQUkVZUwpFU1BOI0FMT0UjUE9QRVMKU09MRVBST1BSSUVUT1IjClNMWURPRyMjU1dBVCMjIwojIyNFTEVDVCNJUk9ORUQKU0FKQUsjUklQUyMjRUFVCklTT0xBVEVEU0hPV0VSUwpUSUwjI0FXRVMjTUlEU1QKRVNURUVNI1NUQUlOIyMjCiMjI0FYRVMjI1NURVJFTwojREVTRVJURURJU0xBTkQKUlVMRVIjQVJJRCNJTkRPCkFETUlUI0ZJVkUjU1RJUgpQRU9OUyNGRUVTI1RPVFM="},{"title":"04/19/13 HIGH POINTS","author":"Clive Probert, edited by Stanley Newman","date":"2013-04-19","grid":"TUVOU0EjQklCUyNJTVBTClVOSVRFI09NQU4jUk9MTApGTEVBUyNEQVRBI09MQVkKRkFDVE9SWUNISU1ORVkjCklDRSNQRVcjRUxJI0hNTQpORVNTI0xBUkQjVFJJQUQKIyMjUE9JU0UjU1RJTFRTCiNDSFVSQ0hTVEVFUExFIwpDSE9SRFMjSVJFTkUjIyMKUEFVU0UjS05JVCNOQVBFCklSUyNBQUEjQUhBI0RJRwojQ0VMTFBIT05FVE9XRVIKQk9TRSNIVU5HI1RIRVJFCkJBSVQjSU5UTCNJTkVSVApCTFRTI0RBVkUjQ09LRVM="},{"title":"04/20/13 SATURDAY STUMPER","author":"Lester Ruff, edited by Stanley Newman","date":"2013-04-20","grid":"UEhSQVNFUyNPVEhFTExPClJPQURNQVAjRkhBTE9BTgpPRk5PVVNFI0ZFUk1BVEEKVkZXI0dFQVJTVVAjRkVECklNSU4jU0tFSU4jTElSQQpTQUxFUyNTQUQjU09OQVIKT05EVVRZI1JFREVBR0xFCiMjI1JPQVIjU09SVCMjIwpTUFJPQ0tFVCNUVkhPU1QKVFJVTksjRkFSI0VFUklFCkVBVFMjUElYRUwjRE9HUwpXSUcjR0FMSUxFTyNUTlQKUFJFQk9JTCNJTkFIVUZGCkFJUkxBTkUjRVRIQU5PTApORVNUTEVEI0ZPVU5EUlk="},{"title":"04/21/13 A WALK IN THE PARK: What you'll see along the way","author":"Bruce R. Sutphin, edited by Stanley Newman","date":"2013-04-21","grid":"TklQUyNMUE5TI0NPU1QjRFJPTkVECk9OVVAjSVJPTiNBTk5BI0lPRElORQpNQVRFI1BPR08jU0NBTSNTVFlMRVMKU1dJTkdTRk9SVEhFRkVOQ0VTIyMjCkdFTlRMWSMjVEFCI1VTTyMjU0VXUwojIyMjQU5USSNMQVAjI0RFTUVSSVQKUE9ORFNDT0xEQ1JFQU0jR1VZQU5BCkVQRUVTI1JJTyNTQVVTQUdFI1NLSQpERUlGWSNTQVVMIyNUUlkjU1RFSU4KI1NMUiNNSUNST1NDT1BFU0xJREVTCiMjI0FETyMjI0xFQSMjI0FJTSMjIwpTRUNVUklUWUJMQU5LRVRTI0VSRSMKUFJBREEjT0FSIyNTT0xJI1RJQVJBCklOTiNLRVlMSU1FI1BJVCNVTlpJUApORUFURVIjTEVBVkVTVEhFU0NFTkUKRVNQT1NBUyMjUEVUI0VFTFMjIyMjClNURVAjI09BRiNOQVAjI0VMVURFUwojIyNHUkFTU1JPT1RTTU9WRU1FTlQKT0hERUFSI1NPTEQjWU9EQSNBTERBClJFREFOVCNFWUVEI0NMT1QjU0hVVApFWEVSVFMjVE9TUyNIRVJFI1NJUFM="},{"title":"04/22/13 ON A ROLL","author":"Gail Grabowski, edited by Stanley Newman","date":"2013-04-22","grid":"U0xVU0gjVEFMQyNQRVNPCkhBU1RFI09SRU8jQVJJQQpJTlNVTEFUSU9OI1BBU1QKUEVSI1BMRUQjVEhFU0lTCiMjI01FTEQjU09VUiMjIwpOT1RBUlkjU1RSRVRDSCMKQU1BU1MjQkFJVCNPSE9LCkRFU0sjV0VMTFMjV0lTRQpBTlRJI0FMT1QjQ0VERUQKI1NFTkRTSU4jTk9MRVNTCiMjI0dBVEUjRU9OUyMjIwpJU0lUTUUjQUJFVCNCQlMKTklOQSNCVUJCTEVXUkFQCkNMT1AjSVNMRSNTSE9SRQpIT05FI05FRUQjVE9XRUQ="},{"title":"04/23/13 TAKING MEASURES","author":"Billie Truitt, edited by Stanley Newman","date":"2013-04-23","grid":"VFJBUFMjQlJPI1NDVUZGCkFFSU9VI0lPVSNBTEdBRQpVTkRFUkZPT1QjWU9MS1MKVE9FI1BPU1NFI0lTWUVUCiMjI0FMTCNUUkFERSMjIwpCRVJNVURBIyNHT1NTSVAKQUxPRVMjVElNRSNFVFRFCkJFQVIjRE9NRVMjQ0FXUwpBTkRJI1VNUFMjR09UQVQKUkFTQ0FMIyNIQVJORVNTCiMjI0FMTE9UI05PRCMjIwpGUk9TVCNUSUVUTyNBUkYKTEFOQ0UjVEFYSU1FVEVSCk9DQ1VSI0VSQSNFUk9ERQpQRUVQUyNSQU0jREVQT1Q="},{"title":"04/24/13 NOT FOR EVERYONE","author":"David W. Cromer, edited by Stanley Newman","date":"2013-04-24","grid":"SEVGVCNHVUxQI1RXSVNUCkFFUk8jQVNJQSNPV05FRApJUkFOI1BFTk4jUElUQVMKTElNSVRFREVESVRJT04jClNFRVRPIyNSQUNFIyMjIwojIyNFTUFHIyNFTkRPV1MKUkVQI0VMSU9UIyNNUEFBClNQRUNJQUxERUxJVkVSWQpWRVRPIyNBRE1FTiNDRFMKUEVTVExFIyNQRVJVIyMjCiMjIyNFUkFTIyNFTkpPWQojUkVTVFJJQ1RFRFpPTkUKTEVHSVQjTUFSWCNJREVBCkFET1JFI0FSRUEjUElVUwpQT1NFUiNURUVNI1NFUFQ="},{"title":"04/25/13 WHERE YOU LIVE","author":"Fred  Piscop, edited by Stanley Newman","date":"2013-04-25","grid":"R0FCUyNHTE9QI0lOVEVMCkxJUkEjUkVQTyNOT0lTRQpBTEFOI0lWRVMjVE9QUFMKTkVXS0lESU5UT1dOIyMjCkRZTEFOIyMjI0NPU0lHTgojIyMjSUFNI0xUUyNYT08KR0FTRU5HSU5FIyNPTlVTCklUVEFLRVNBVklMTEFHRQpTRUFSIyNTTkFLRUVZRVMKVEFHI1NQWSNSRUMjIyMjClNURUFMUyMjIyNIQVZFTgojIyNLRVlUT1RIRUNJVFkKUEFEUkUjT0tSQSNST0FNCkVMSU9UI1JBSUwjRUxJRQpQRU5OWSNUWVBPI1NBTFQ="},{"title":"04/26/13 NOT SO GREAT","author":"S.N., edited by Stanley Newman","date":"2013-04-26","grid":"U1RFQU1FRCNJQ0VMQU5EClRFWFRJTEUjVFVOSVNJQQpFUklFU09MVkFCSUxJVFkKRVNTI1NQSUVMI0dBU0VTClBFVFMjRVNUI0dNQyMjIwojIyNISUQjI0NSQVNIRVIKU0VUT04jR0FMQSMjQUxBCkhVUk9OTVlUT0RPTElTVApBUkUjI0FSTVkjUlVMRVMKR09FU1BSTyMjTUJBIyMjCiMjI0FVSyNCTFUjVVNNQwpHUkFTUCNOT0lTRSNQT0wKTUlDSElHQU5PTERMT1ZFCkVDSEVMT04jTklHRVJJQQpORUVEU1RPI1NORUFLRVI="},{"title":"04/27/13 SATURDAY STUMPER","author":"Bruce R. Sutphin, edited by Stanley Newman","date":"2013-04-27","grid":"RVhRVUlTSVRFI09MQUZWClNFVVNTSUNBTCNUQUJMRQpUUklCVU5BTFMjQk9TVU4KQVhFI1BFTkNJTCNTSUZUClRFVEUjI1RFTk9SI05GTApFU1NBWVMjRE9DRSNUSUUKIyMjR0FNIyNSQU5DSEVTClBPTEVNSUMjRUxPUEVSUwpPUEVSQVRFIyNBSUwjIyMKU1RQI0hFTFAjRFJVREdFClRJTyNBUkxFUyMjU0VORApQT1JLI1NDUkFQRSNGT0cKT05JT04jQVNQQVJUQU1FCk5BTk5ZI0xJT05UQU1FUgpFTEVHWSNMQVJHRU5FU1M="},{"title":"04/28/13 ASPIRATIONAL: With a little something extra","author":"Fred Piscop, edited by Stanley Newman","date":"2013-04-28","grid":"QUxFQyNDTElPIyMjVEhPUiNBVE1TCkNPTU8jSEFOTkEjQ1JPV0UjVEhBSQpIQUlSUE9DS0VUI0hBTExBUk9VTkQKRU5URVJLRVkjVEJPTkUjRFVOREVFCiMjIyNPRUQjSEVST1MjUklMRSMjIwojU0hJTlMjREFNRVMjU0FORSNIQU4KU0lFR0UjSEFUUFJFU0VOVCNTQVZFCkVUQUwjQkVSRVQjI1RSSU8jRVJJRQpaRVJPI1JBTkQjUExBSU4jTUFNQVMKIyNTT1dFRCMjV0FJVkUjQ0FNRVRPCkFNTyNIQVNIV0VETkVTREFZI0RFTgpHSUZURUQjT0hBUkUjI0FNT05HIyMKRU1DRUUjU01PS0UjTUFaRSNFVVJPCk5FT04jU0FJTCMjUElYRUwjUEFJTApUT1JUI0hJTExTVUlURUQjQ0FSVEUKU1NOI1RPTlkjQUNSRVMjR09MREEjCiMjI0JFUlQjQVRMQVMjT1lMIyMjIwpBU1NPUlQjQlJZQU4jTUFSSUVUVEEKSE9MRE1BU1RFUiNIRUFUQU5EUlVOCkFMT0UjR09PTlMjQVNZRVQjR0VOVApCT1dTI0VMQkEjIyNUSVJFI1lFQVM="},{"title":"04/29/13 HEAD PIECE","author":"Gail Grabowski, edited by Stanley Newman","date":"2013-04-29","grid":"RUxLUyNTTUFTSCNBQkVUCkdBSU4jTUVUT08jQkFSRQpPU0xPI09DRUFOI09CT0UKU0hPV0VSQ0FQI1JBWU9OCiMjI1BMRUFUI0dBUkIjIwpMQUJFTFMjI1BBUkRPTlMKQVJJQVMjV0hJVEUjTlVUClRTSyMjU0hPTkUjI05SQQpUT0UjS0VFUFMjQ0hFU1QKRU5IQU5DRSMjQk9PVEVFCiMjRVhJVCNTVElMTCMjIwpTUExJVCNDT1dCT1lIQVQKTElNTyNDT1JBTCNNSUNFCklURU0jVU5USUUjRVZFTgpNQVRTI0JFQU5TI05FU1Q="},{"title":"04/30/13 LINE ITEMS","author":"Billie Truitt, edited by Stanley Newman","date":"2013-04-30","grid":"Q1JBU1MjQ09UI01PVFRPClJFVkVMI1NMWSNPQ0VBTgpBRklSRSNQSVAjU0NBTEUKTUlTQkVIQVZFI0NVUkxTCiMjIyNWSU5FI1RPUCMjIwpDTEFXRUQjI1RIV0FDS1MKTEVHT1MjQk9SRSNUUkFQCk9WRVIjRFJBSU4jSU9UQQpHRU5MI0FBUlAjVE9XSVQKU0VURE9XTiMjU0VOU0VTCiMjI0NBTiNTUElOIyMjIwpTVEFMSyNNQUlOUE9JTlQKVE9UQUwjQUxMI0FTVElSCkFSSVNFI01PTyNTTElDRQpCRVRTWSNBTlQjVE9TRUU="},{"title":"05/01/13 HARD TO SEE","author":"Bruce R. Sutphin, edited by Stanley Newman","date":"2013-05-01","grid":"Qk9PTSNQQUNUI1NPRkFSCkFDUkUjQVJFQSNXSE9MRQpTSEFET1dCT1gjQU5HTEUKSE9MSURBWVMjUFJPTU9TCiMjI0NPVFMjSFVNI0FXRQpOT1NJUiMjUEFSU0VDIyMKQ0FNI1NBRkFSSSNTSEFNCkFUT00jU0xJUFMjUElMRQpBU0tTI1BJTE9UUyNORVcKIyNFTlZJRVMjI1BSRVNTClVNQSNPUlMjU1RFVyMjIwpQQUxBVEUjU1RSRUFLRUQKU0NBTEUjQ0xPVUROSU5FCkVSUk9SI1BBUlMjREFEQQpUT01FUyNBQkVUI0FTU04="},{"title":"05/02/13 THE WOW FACTOR","author":"Fred Piscop, edited by Stanley Newman","date":"2013-05-02","grid":"Q0xBUCNNSUxLI0FERFVQClJBSUwjSVJPTiNQUk9TRQpBVVJBI05BTk8jUEFDRUQKV1JFQ0tJTkdDUkVXIyMjCkxBREVOIyMjS0lBI09ERAojIyMjRUFSUCNHUkFERVIKI1NURUFESUVSIyNDT01FCldPUkxET0ZUT01PUlJPVwpBREFNIyNUSU1FTEVTUyMKV0FZT0ZGI1RBWEkjIyMjCkFTUyNMSVUjIyNWQUxFVAojIyNXT1JNU0VZRVZJRVcKVEVCT1cjUEFSRSNPR1JFCkFMSUtFI0VWSUwjV0hJUgpSSURFUiNERUVQI1NURVA="},{"title":"05/03/13 TRAINSPOTTING","author":"Clive Probert, edited by Stanley Newman","date":"2013-05-03","grid":"R1JBQ0UjI1NLWSNFUkdPClJFQ0FMTCNQT0UjTEVBTgpFVkVOU08jRVJBI0VWSUwKV0VERElOR0NFUkVNT05ZCiMjI0xFRVIjQU5TRUwjIwpGQUNFI1NFQyMjU05VRyMKQVZBIyNURUUjU0VUVEVFCkNBUlRSQU5TTUlTU0lPTgpUSU5JRVIjVEFOIyNPREQKI0xBTUIjI0FNSSNPTkVTCiMjVEVBQ0gjQVNTVCMjIwpSQUlMUk9BRFNUQVRJT04KQUxPRSNWSUEjRU5BQkxFClNJTlMjRVJSI1JFV0VEUwpQQVNTI1JZRSMjUkFURVM="},{"title":"05/04/13 SATURDAY STUMPER","author":"Anna Stiga, edited by Stanley Newman","date":"2013-05-04","grid":"Qk9TUyNJQ0VDQVBBREVTCklOVE8jUEFVTFJFVkVSRQpTUEFTI1NQTEFUVEVSRUQKTUFUI0JPUkVSUyNSSU5HCkFSRU5BI0lSQVRFI0RPRQpST0JPVFMjIyNVU05FV1MKQ0xBUCNNQUFORFBBIyMjCktFUlIjQUxHQUUjU09BUAojIyNPVVJUT1dOI1NJTEwKUFJPQlNUIyMjVEhBTElBCkhFUiNPUFRFRCNPVVNUUwpFVEFTI0hPTElORyNQQU0KTE9DT01PVElWRSNHSUxBClBPTExJTkFURVMjQUxJVApTTEVFVkVMRVNTI1NMQVY="},{"title":"05/05/13 MORNING MENU: May we take your order?","author":"Bruce R. Sutphin, edited by Stanley Newman","date":"2013-05-05","grid":"TU9CUyNTSE9QUEUjQU5USSNTVVJGCkVSSUUjUEVBSEVOI1JPT1QjVFJVRQpSQUdBTVVGRklOUyNHT09TRUVHR1MKRUxLI0FSVFMjVEVUT04jRklORVNUCiMjQU5UU1kjQkVBVCMjSlVETyMjIwpJQ0hBVCMjSkVMTFlTVE9ORVBBUksKU0hVVCNBQ09XIyNMQU9TI1JBVkVOCk5BTkEjVEhFSVJTI0dXVFcjREFWRQpUT0FTVE1BU1RFUlMjQUxFQyNMT0EKIyMjSEFTUCNDTE9UI1JFRE8jT0xECk9SR0FOIyNTSE8jQVJEIyNDRU5UUwpORVUjS09CRSNBQ1RJI0NMT0QjIyMKRVdFI1NQRUQjRE9VQkxFQkFHRUxTClNFUkYjU0hBRCNQU0VVRE8jRU5ZQQpFQVJMUyNBVE9CIyNZVkVTI09ERVMKQ1JFQVRJVkVKVUlDRVMjI05VUlNFCiMjI0dFTkUjI1JDQVMjQUJBVEUjIwpBSU1TQVQjT0FURVIjS05JVCNTQU8KSEFTSE1BUktTI0RPSU5HRE9OVVRTCkFHUkkjQ0FSUCNBTExFTEUjRUxBTApCT1BQI1RXQVMjTUVMRUVTI09UVE8="},{"title":"05/06/13 TAKE A GANDER","author":"Gail Grabowski, edited by Stanley Newman","date":"2013-05-06","grid":"TUFLRSNFQ0hPIyNUUkFQClVTRVIjQVJFQSNDSElMRQpUSUVSI1NFQVQjT1JOT1QKRVNQI1NFRVRIRUxJR0hUCiMjV09VTEQjI0lMTFNBWQpTSEFSRVMjUEVEQUwjIyMKSEFURVMjQ0lERVIjTFBTCkFSQ1MjQ0hPSVIjV09PUwpNUEgjU0hPVVQjVEhPUk4KIyMjU0tJUFMjU0hBS0VTCklORElBTiMjTExBTUEjIwpQT0lOVE9GVklFVyNITU8KT0ZBR0UjTElORSNCRUFNCkRBTkVTI0FCRVQjWUFMRQpTVEFSIyNQRU5TI0VERU4="},{"title":"05/07/13 WE'RE NO GOOD","author":"Sally R. Stein, edited by Stanley Newman","date":"2013-05-07","grid":"I0NPTlMjUkVTVCNNQVRFCk1PVklFI0FVVE8jQVRPTQpBREFHRSNJUkFOI05PUk0KREVMSEkjTk9UR1VJTFRZCiMjI1ROVCMjI1VOQ0xFUwpGTEFHI0FHUkVFRCMjIyMKTElTQSNQTEVBI0VOU1VFCkFMQU1PI0FCUyNSRVRSWQpUWVBFRCNSVUVEI1dJU0UKIyMjI0RSRVNTWSNHUkFECk9SSU9MRSMjI0VBVSMjIwpOQU5OWUdPQVQjRElBUlkKRVRBUyNBQkxFI1VORFVFClBJTEUjUk9PTSNMRUFTVApNT0xUI0RFRVAjVEFNRSM="},{"title":"05/08/13 WORLD FIGURES","author":"David W. Cromer, edited by Stanley Newman","date":"2013-05-08","grid":"Q1JFQUsjUEVQI1NFUkZTCkxFQVZFI0VQQSNUUkVBVApBTlRBUkNUSUNDSVJDTEUKTUVFVCNMRUNURVIjVVNFClNFTkFUT1IjI0RVU1RFRAojIyNST04jQURFUFQjIyMKTU9NI0ZFTkNFIyNVS0VTCkJFUk1VREFUUklBTkdMRQpBUklBIyNQT05EUyNCTVcKIyMjTElWRVIjRUFSIyMjCk1BS0VNRSMjQ0FQRUNPRApFS0UjUEFUUk9MI0ZSQVUKVFJBRkFMR0FSU1FVQVJFClJPVE9SI0lDRSNURU5FVApPTlNFVCNGRUQjU0xFRFM="},{"title":"05/09/13 FOR MAMA'S DAY","author":"Billie Truitt, edited by Stanley Newman","date":"2013-05-09","grid":"U0NBTFAjQlRVUyNJRkZZCldBREVSI1JPQ0sjQ0lBTwpBQk9WRSNBTExZI0lSQU4KTUFSWU1BR0RBTEVORSMjCklMRSNJUlMjI0lNR0FNRQojIyNDVUUjTk9USSNMQUcKTUFUSE1BSk9SI1RXQU5HCkVVUk8jU0FWRVMjRVJHTwpBREVQVCNNQVNLRURNQU4KREVBI0hJU1MjVVNTIyMjCkVORFJVTiMjQU5UI0RVTwojI01BU1NNQVJLRVRJTkcKRVZJTCNJT1dBI1ZJR0lMCkdBTEwjU1RBQiNFVklURQpPTkxZI1RPWVMjWk9ORVM="},{"title":"05/10/13 BYLINES","author":"Richard Silvestri, edited by Stanley Newman","date":"2013-05-10","grid":"SVRDSCNDSEFEI01JTklTClJBWkUjSEFSRSNBTVVTRQpTQ0FNI0FTSUEjVEFNUEEKI09SSUVOVEFMUlVHQlkjCiMjIyNBQ0UjI0lSRSMjIwpQQU5GUlkjV0FORSNUU0EKSURFQUwjTUFDUyNTQUFCClBJQ0tTVVBUSEVUQUJCWQpQT0tFI05BVEUjT0dMRVMKQVNTI0JBQVMjU05FRVJTCiMjI0dBRyMjQlVUIyMjIwojWUVTU0lSRUVCT0JCWSMKSkFOVVMjSVJBUyNBTE9UCk9MRElFI1RJTUUjSk9LRQpCRVNUUyNaRVNUI0FXRUQ="},{"title":"05/11/13 SATURDAY STUMPER","author":"Lars G. Doubleday, edited by Stanley Newman","date":"2013-05-11","grid":"VE9VR0hDUk9XRCNQTEFOCklNUFJFU0FSSU8jRUFTRQpSSVRBTU9SRU5PI05ZU0UKRVRPTiNORU8jUk9VU0VECiMjI09BSyMjQU1VTEVUUwpUQUlMR0FURVBBUlRZIyMKUlVOQVQjRVhJVCNTRU5ECkFEUyNTT0ZURVNUI1NBWQpQSVRBI0JMT0MjQUNPUk4KIyNBTkFUT0xFRlJBTkNFCk1BTlhNQU4jI0xQUyMjIwpBQ1RJSUkjU01VI0VMQkEKQ1VURSNOQVRBVE9SSVVNCkVUQVQjRUxFTUVOVEFSWQpERU5ZI0RBVEVTVEFNUFM="},{"title":"05/12/13 BY GEORGE: A one-liner from Mr. Carlin","author":"David W. Cromer, edited by Stanley Newman","date":"2013-05-12","grid":"RElLRSNBRFMjSU1QRUkjSEVTVEVSCklSSVMjV09FI0tPUkFOI09SSU9MRQpNT1NUUEVPUExFV09SSyNTRVRUTEUKRU5TI0VERElFIyNTTEVQVCMjQUlECiMjSVRUI0xBVENIIyNEUklCQkxFUwpJTU1FUlNFI1RPQVNUI09MQVkjIyMKU1VNTUlUI0pVU1RIQVJERU5PVUdIClBSRVAjRUpFQ1QjQU1BU1MjTlNGVwpTS0VFI1JPU0UjT0tBWSMjU0VBTFkKIyMjU0VFUlMjT1BFTCNMRU8jR0FTCiNOT1RUT0dFVEZJUkVEQU5ER0VUIwpISU0jQVNFI0hBTlMjT1NDQVIjIyMKRVZBTlMjI1BFS0UjUkVFTCNJU0xBCkxFTkEjU0FVREkjUkVUUk8jTEFJTgpQQUlESlVTVEVOT1VHSCNTUExJTlQKIyMjRUFSTiNBRERFUiNSRUxFTlRTCkRFUFJJVkVTIyNEUk9ORSNBUlQjIwpFQVIjI0lSQVRFIyNXT05BVCNMQVMKQVNJTU9WI01PTkVZTk9UVE9RVUlUClJFTUFERSNCVURHRSNTQU8jT0tSQQpTTEFURUQjQVJTT04jRUxNI01FRVQ="},{"title":"05/13/13 LOOK SHARP","author":"Gail Grabowski, edited by Stanley Newman","date":"2013-05-13","grid":"V0FTUCMjV0FSUyNQU1NUCkFMTE9XI0lCRVQjQVRUQQpZT1VUSCNURUFSI1JFQU0KU1RSQUlHSFRQSU4jQUdFCiMjI1RSQSMjU05FQUtFUgpFTlJPTExTIyNHQVdLIyMKQk9BIyNBTEFTI1RBTkdZCkJVWlojU0lMT1MjWUlQRQpTTk9PVCNUQU5LIyNGQU4KIyNST0FEIyNTVUNDRVNTCkJPQlNMRUQjI0xFQSMjIwpBTEwjQ0lSQ1VMQVJTQVcKRERBWSNDT09TI1NQT0tFCkFJREUjRU5EUyNFRVJJRQpURUVTI0RFRVIjI1RFTkQ="},{"title":"05/14/13 THREE-FACED","author":"Billie Truitt, edited by Stanley Newman","date":"2013-05-14","grid":"I0FUTSNTV0FNI0NFREFSCiNUUkEjTklMRSNBUkVOQQojRUFSI0FTSVMjU0FORFkKSkFDS09GSEVBUlRTIyMjCkFTSyNDVUUjI0FMRVJUUwpHRUVTRSNTSEFERSNFRUUKIyNWRUFMI0VMSSNESUVUClFVRUVOT0ZESUFNT05EUwpVUk5TI09SRyNMSU5UIyMKQUdUI0FTWUVUI1hFUk9YCkRFU0lSRSMjRUFVI09SRQojIyNLSU5HT0ZTUEFERVMKTU9PTlMjQVdMUyNIVUcjCkNBTk9FI1BMT1QjRUNPIwpTVEVXUyNTU05TI01FTiM="},{"title":"05/15/13 LUNCH PLATE","author":"Fred Piscop, edited by Stanley Newman","date":"2013-05-15","grid":"Q1BMVVMjQUNSRSMjQ0NTCkFMSVNUI1NISUEjU0hVTgpQT0tFUkNISVBTI1RJUkUKU1RFUklMRSNTVE9PTElFCiMjIyNQT1NIIyNVTkRFUgpBTExJRUQjQUJBVEUjIyMKTU9BTlMjQU1FWCNTVEVXCk9SQ0EjTUlMTkUjT09aRQpLRUVQI0lERUQjUFVSUlMKIyMjSVNMRVQjUkVQRUFUCkNISUNLIyNTSEVEIyMjIwpST0NLWUlJI0VMQVNUSUMKQVdPTCNBQ1RJT05IRVJPClpJTkUjR0VBUiNUT0VJTgpZRVMjI09ERFMjU0VOU0U="},{"title":"05/16/13 QUITTING TIME","author":"Bruce Venzke, edited by Stanley Newman","date":"2013-05-16","grid":"Q0hBSSNQREFTI0RJVFRPClJPVVQjT1JBTCNSQUhFRApUT1RBTExZSE9QRUxFU1MKU1RPTEkjI1NQRVgjU0xPCiMjI0lHRVIjI0FFR0VBTgpVTkFDSElFVkFCTEUjIyMKTkFCI1RPTEVETyNBUFBTCklERUFTI0lSUiNBUkVBUwpUQUxDI1RFRElVTSNSVUcKIyMjVE9PRElGRklDVUxUClRIUklGVCMjVE9ETyMjIwpSVUUjRkVTVCMjU1BPT0sKSU1QT1NTSUJMWVRPVUdIClBBUkVFI05BQkUjVUNMQQpTTk9SVCNHUk9XI1RIRU4="},{"title":"05/17/13 GO AGAIN","author":"Bruce R. Sutphin, edited by Stanley Newman","date":"2013-05-17","grid":"VUNTQiNUUkFMQSNNQVRTClNPQVIjQVVSSUMjQVJFQQpBQ0FJI1BFVEVSI1NDQVQKR09CQkxFRFlHT09LIyMjCkVBU0VJTiMjRVNQI0hFTQojIyNSRUFDVCNTVFJPREUKTEFUI09ET1JTIyNVQkVSCkVWT05ORUdPT0xBR09ORwpUSU5BIyNTVFJFVyNTU0UKTUFZSEVNI1NUT09MIyMjCkVOUyNNT1AjI1BMRURHRQojIyNBU0dPT0RBU0dPTEQKQVBQUyNVU0hFUiNTTkFHClNFRUsjTElORUQjSU5SRQpIQVRTI1NUT1BTI1RFRVM="},{"title":"05/18/13 SATURDAY STUMPER","author":"Lester Ruff, edited by Stanley Newman","date":"2013-05-18","grid":"UkxTVElORSNFQk9PS1MjCkVBVEVOVVAjVFJVQU5UUwpEUkFOS1RPI0hPVFNFQVQKRkFURVMjTkJBI1NFRVRPCk9NSVQjSFlFTkEjU1BVUgpSSU8jVElNRU9GRiNBUk0KREVOSUFMUyNMT1VSREVTCiMjI0FOVCMjI1VTQSMjIwpCUklOR09OI0ZMRU1JU0gKWUVOI09ORVdPT0QjQ0VPClBBU1QjU0NBUkYjQkVFTgpBQ1RFRCNURFMjRFJEUkUKU0hBTkFOQSNBVklBVEVTClNFTkFUT1IjTEFCVEVTVAojU1RNQVJZI0VDU1RBU1k="},{"title":"05/19/13 SO LONG: Famous last words","author":"Fred Piscop, edited by Stanley Newman","date":"2013-05-19","grid":"VFJBU0gjQlJBVCMjSU1TTyNDQVNIClNZUklBI1JPTUVPI05BVE8jVU5UTwpLRUVQU01JTElORyNCWUVGT1JOT1cKIyMjI0ZBTUUjU0xBTE9NI1BST1dMCk5PRkFJUiMjVEVBTU8jU0FURSMjIwpFTkFDVCNUT09ETEVPTyNUSU5IQVQKVElSRVMjT1VSI0FORFMjT0NUQVZFCldPRVMjQ0FUUyMjIyNBUFAjI1ZFRQpUTlQjI0FESU9TQU1JR08jU1RFUk4KIyNIT0FSU0UjTElPTkVMI1BFQVNFClNDRU5UUyMjUElPTlMjI0hBTkdFUgpFUkVDVCNPUkFDTEUjSEFJUkRPIyMKREVXRVkjVEFLRUlURUFTWSMjT0RECkFXRSMjUFNTIyMjI1JJVEEjSURFQQpURUxMTUUjVFJBTSNSVEUjU0NPVVIKRUxMSU9UI0FVUkVWT0lSI0xBTkNFCiMjI0VQRUUjRElORVIjI1ZFTkVFUgpTTU9URSNUT0RBVEUjUkVJRCMjIyMKTEFURVJEVURFI0FSUklWRURFUkNJCkFYSVMjT0RFUiNMRUFTRSNPUklPTgpNSVNUI01FU1MjI0RZRVMjR0FCT04="},{"title":"05/20/13 OFF YOUR FEET","author":"Gail Grabowski, edited by Stanley Newman","date":"2013-05-20","grid":"U0xPVCNQT0xFUyNTUEFTCkxBVkEjQVdBSVQjVElOVApPTUVOI1JJTkdTI1JBVEUKUEFSS0JFTkNII1NJTkVXCiMjI1RBUkdFVCNBRE8jIwpMQUJPUlMjIyNHVUVTVFMKSU1VUCMjQk9PQVQjVFdPCk5CQyNTUEFSS0xFI09JTApFTEsjQ09ERVMjI1BPTE8KTkVFREVEIyMjU1BFTExTCiMjVE9OI1NFQUFJUiMjIwpXQVNOVCNMQVdOQ0hBSVIKT1JFTyNIQVNBVCNBU1RPClJFQVIjT1BFUkEjUElFUwpFQVRTI0VTU0VTI1NBTUU="},{"title":"05/21/13 NOT TOO HARD","author":"Billie Truitt, edited by Stanley Newman","date":"2013-05-21","grid":"U1dBQiNCRUFOUyNNQVlPCk9ISU8jUkVMSUMjQUdFRApMT1JEI0FMT05FI05PU0UKRUFTWUxJU1RFTklORyMjCiMjI1NBRCMjI0VSRSMjIwpQSVRIWSNDQUIjT1JCSVQKT1JFTyNHQUxMT04jRVJBClNJTVBMRVBMRUFTVVJFUwpUU1AjRUVSSUVSI05FU1QKU0hPT1QjSU5EI1dJVFRZCiMjI1JVTSMjI1RXTyMjIwojI0JBU0lDVFJBSU5JTkcKQU1FTiNTSE9PUyNJREVBClNBTkcjVElUTEUjU0xPQgpIWURFI1NORUVSI1RFTlM="},{"title":"05/22/13 DOWN THE LANE","author":"Charles Slack, edited by Stanley Newman","date":"2013-05-22","grid":"UEFJRCNDSEFUI1RBU1RZClJPVkUjQU9ORSNJTkFORQpJUk9OI0ZFVEUjTkVTVFMKU1RSSUtFU0lUUklDSCMjCk1BWUFOIyMjSEVFRCMjIwojIyNMQVNUUyNQUk9QRVIKUk9XI1ZJRVdTIyNUSUxFClNQQVJFU05PRVhQRU5TRQpWQU5FIyNUUkFJTCNURUQKUExFQVRTI0RSSUVEIyMjCiMjI1BPS0UjIyNCRVRBUwojI1NQTElUU1RIRVZPVEUKQ0xVRUQjSE9ITyNJRE9MCkZPUkFZI0lSSVMjU0FORQpPUEVSQSNDRU5UI0VZRVM="},{"title":"05/23/13 PUZZLE DU JOUR","author":"Fred Piscop, edited by Stanley Newman","date":"2013-05-23","grid":"TE9UU0EjQ09aWSMjSEFECklESU9NI0lERUEjU0FORQpNT1JOSU5HREVXI0NJVEUKUFJFU1NPTiNTTk9PS0VSCiMjIyNURUFTIyNIT1VTRQpBRElEQVMjUExVTUIjIyMKUE9LRUQjREFJUyNZTUNBClBJRVIjUFVSRUUjRElBTApTVEFSI0lOS1MjVE9OR0EKIyMjSU5URUwjQVdPS0VOClNQSU5FIyNFVVJPIyMjIwpIQU5HRE9HI1RFRVRFUlMKQUNFRCNQT1NUQUdFRFVFClJFUE8jVEFLRSNHUklTVApERFQjI1NUSVIjU0FURVM="},{"title":"05/24/13 CROP WORK","author":"Clive Probert, edited by Stanley Newman","date":"2013-05-24","grid":"QVdBU0gjQUNNRSNUQVNLCkNPU1RBI0NISVAjRVJJRQpUT1BBWiNDQUdFI0xJTUUKI0RJR1lPVVJIRUVMU0lOCkFDUkUjQlNNVCNTVEVBTApEVUVEQVRFIyMjVElOTlkKQVRUI0RBUk4jSUFNIyMjCiNTT1dESVNDT05URU5UIwojIyNSRU4jT05NRSNPT0gKVFVSSU4jIyNMT1NFT1VUCk9ORU5EI05BWVMjTFVHUwpQSUNLQUZJR0hUV0lUSCMKRVZJTCNBR1JPI0FTTElQCktBVEUjU0VFUCNTSEVFUgpBQ0VTI1RSRUUjUEFUU1k="},{"title":"05/25/13 SATURDAY STUMPER","author":"Bruce R. Sutphin, edited by Stanley Newman","date":"2013-05-25","grid":"U1RVRERFRCNTUExJTlRTClRPUFJBVEUjUFJPVEVJTgpBVVRPTUFUI1JPU0VURUEKUFJFT1AjUkFJTlMjWklHCkxJTVAjQklMR0UjREVORwpFU1AjQUxUT1MjRk9SVEUKU1RPUk1PVVQjQkVHT09ECiMjI0FCQ1MjU0VBTSMjIwpDTE9WRVMjUEhBUkFPSFMKTElWRVIjU0VFRFMjTE9UCk9NRU4jU1RBQlMjTElTQQpTSVIjUEFSU0UjUklWQUwKSVRTRE9ORSNBU0lOSU5FCk5FRURMRVMjUkVEREVOUwpHUkFURVJTI1NXRUFSQVQ="},{"title":"05/26/13 OH-OH, NOT AGAIN: Not so bad, actually","author":"Gail Grabowski, edited by Stanley Newman","date":"2013-05-26","grid":"TFNBVCNBTFRPI1NDQUxEI0JBTFNBCk9ITk8jTU9OTyNBTExPWSNVUEVOTgpGT09EQk9PVEgjV09PREVOU1BPT04KVEVORE9OUyNTUFJVTkcjQUlMIyMjCiMjIyNBR0VTI0hFREdFI1JFQUNUIwpPRkZFUiMjSE9PRFMjI0FSRFVPVVMKUk9PTSNPUEFSVCMjU1BDQSNET05BCkFMT1QjQkFNQk9PU0hPT1RTI0tFWQpMSVQjQ09SRVMjU0NBUkxFVCNUSU4KQk9CU0xFRCMjTUVPV0VEI0VUSE5PCiMjQUxBUyNTTFkjTExEI1BMSUUjIwpDT0xPUiNNT09SRUQjI0dBTUVCQUcKQUxMI0VDT0NBUlMjQ1JFRE8jT1JFClJFUCNUT09LVEhFRkxPT1IjTE9HRQpCT09TI01FU0gjI1JPVUdFI09LT0sKU0xPUFBFRCMjRlJPR1MjI0RVU1RTCiNFTElBUyNBU0lBTiNFV0VSIyMjIwojIyNORVQjU1RBTkRTI09SQVRPUlMKR09PRExPT0tJTkcjU0NPT0JZRE9PCkVOUk9MI1BFTkNFI05FRUQjS0lMTgpUT1NDQSNUV0VFRCNTT1JFI0VFTFM="},{"title":"05/27/13 CONNECT FOUR","author":"Gail Grabowski, edited by Stanley Newman","date":"2013-05-27","grid":"U0VQVCMjU0FMVCNESUFMCk9CT0UjQ09MT1IjQU5URQpMQVdOI01PT0xBI01PT1QKRFlFI0hPVEVMQ0hBSU5TCiMjUkFJTiMjI0VBR0xFIwpBU1RJUiNDUkFETEUjIyMKU1BJUkUjSEFTVEUjSk9FCkhVRVMjQ0FOU08jUFVOWQpZUlMjQkFSR0UjRkVOQ0UKIyMjQUxMU0VUI0FTS0VECiNMT0NBTCMjI1NOT0IjIwpISVRUSEVMSU5LUyNPVFMKT05UTyNEQU5DRSNTTk9XCkVERU4jSUtOT1cjSURFQQpEQVJFI05FU1MjI1BTU1Q="},{"title":"05/28/13 THE OLD ONE-TWO","author":"Billie Truitt, edited by Stanley Newman","date":"2013-05-28","grid":"I01BU0gjQk9BUyNISVNTClRBQk9PI0xJTlQjSU9UQQpBTEVSVCNPTktQI1RXSUcKQkVMVEJVQ0tMRSNTQU5FCiMjI1NBTiNTRVRUSU5HUwpBQ1QjVElTI1NFRU4jIyMKTE9PUEhPTEUjI0FHTE9XClRVVFUjTllMT04jTElGRQpPUEVOUyMjTE9PU0VFTkQKIyMjQ0FUUyNPVEMjU09TCldBU0hPVVRTI0lSUyMjIwpBUkFCI1NPQ0tQVVBQRVQKU1VNTyNTUEFOI1BPTEFSClBMT1cjTElORSNMT1VTWQpTRUFMI0VUVEUjRUxTRSM="},{"title":"05/29/13 PLAY THE SLOTS","author":"Fred Piscop, edited by Stanley Newman","date":"2013-05-29","grid":"SEVNUCNCQVNLIyNMT0ZUCkFMT0UjRVJJRSNDQUlSTwpUVVJOU1RJTEUjSE9OT1IKRURBVEUjRE9OVEFTS01FCkRFTFVERSMjT0FSIyMjIwojIyNQQVJLSU5HTUVURVIKRUNPI05FV1MjI1NUQVJFClBPTVAjI0hBTiMjQ1VSRQpJREFITyMjQVRNRSNUU0sKQ0FORFlNQUNISU5FIyMjCiMjIyNTQUQjI0RFTklNUwpGQUlSVFJBREUjTUFOSUEKSVNTVUUjUElHR1lCQU5LCkxJTkVSI1RPR08jTElLRQpNQVRTIyNTTk9CI0VSQVM="},{"title":"05/30/13 AT THE POKER BANK","author":"Bruce Venzke, edited by Stanley Newman","date":"2013-05-30","grid":"U1RBTiNWU09QI0FaVVJFClRFVEUjRUxMRSNCQVNFUwpBTlRFI1JPQVIjT1BFRFMKUkFJU0lOR0ZVTkRTIyMjCkVOUk9CRSMjU1VFI0hPUApTVEVOTyNGTEVBI0dVTVMKIyMjI09ESUUjTkFQTEVTCkNIRUNLSU5HQUNDT1VOVApIQVJBU1MjSURFQSMjIyMKQUpBUiNQT1RTI0NBUFJBCkRKUyNGRVcjI0VJVEhFUgojIyNDQUxMSU5HQUxPQU4KR09NRVojSVNBWSNBQkxFCkFCSURFI1NMSVAjU0lNUwpCT1hFRCNIRUZUI1RBU1M="},{"title":"05/31/13 FOURCAST","author":"Steve Salitan, edited by Stanley Newman","date":"2013-05-31","grid":"QVJNUyNSQVRTI0NISUxECk1FQVQjRVJJRSNST0RFTwpNQVJFI0dSRVcjQVNTRVQKT0xZTVBJQVNOT1dFIyMjCiMjIyNBTVkjI0tMQVRDSApCRUZPUkUjU0FSSSNIRVkKQVhPTiNOQVRIQU5IQUxFClNQT0NLI0pBTSNHQU1JTgpIRUxFTkhBWUVTI0xFTkEKRVJFI0VBUlMjQ0xPU0VTClNUUkVFVCMjTU9FIyMjIwojIyNXSEVUSEVST1JOT1QKUkFESUkjWUFMRSNJT1dBCkFMT05HI1BJRVIjUE9FVApXRUlHSCNPUkVTI0VORFM="},{"title":"06/01/13 SATURDAY STUMPER","author":"Anna Stiga, edited by Stanley Newman","date":"2013-06-01","grid":"QlVORFRQQU4jTExCRUFOCk9ORU9OT05FI0xPVVZSRQpCRUVTVElORyNPU0NBUlMKQ0FTRSNTRUFNWSNTUElUClVTTyNURVhUQURTI0VWRQpURU5USCNFRUwjVkFSSUcKIyMjUkVEUyNFUkVMT05HCkFDVElWRSMjI0NMSU5HUwpST09NSUVTI0hBVEUjIyMKQkxBU0UjQURBI0VOSk9ZCk9MRCNXQVJSSU9SI0FSRQpSQVlTI05BVVJVI0FNRVMKRVBJTE9HI0lOTkFURUxZCkFTU1VSRSNERUNMQVNTRQpMRUhSRVIjU1RFQURJRVM="},{"title":"06/02/13 TRU-ISMS: Witty words from Mr. Capote","author":"S.N., edited by Stanley Newman","date":"2013-06-02","grid":"I1NSSSNORVhUI0xPT01TI0dFVFRPClNQRUQjT1ZFUiNPVU5DRSNMSUFSUwpBTExMSVRFUkFUVVJFSVNHT1NTSVAKRklMRURJTiNQSERTIyNTQVcjU0xSCkFDRURJVCNURVJJI0FUSVAjRkxPRQpSRU4jIyNEQVpFUyNSSE8jRUxFR1kKSURPTlRDQVJFV0hBVEFOWUJPRFkjCiMjI09CQU1BIyMjWVNMI01BUCMjIwpST0FOT0tFI1BPTEUjTEFDWSNSVUIKVU5ET05FI05BUEUjTklOQSNCRVRBClNDT05FI1NBWVNBQk9VVCNUT1JVUwpFVVJPI0JJVFMjUExVTSNZT0dVUlQKU0VFI1RBWEkjQVRUTiNMQUxBTk5FCiMjI1ZPVyNPT0gjIyNGRVdFUiMjIwojTUVBU0xPTkdBU0lUSVNOVFRSVUUKQ0VOVFMjTUFSI0NSVVNUIyMjT05BCk9ERFMjTUlMRSNZQU5LI1NVQk1JVApOSUwjUElHIyNFVFRFI1NUUElVU0kKTUFFU1RST09GVEhFU0VNSUNPTE9OCkFUU0VBI1NXT1JFI0lHT1IjUlVORwpORVNUUyNIRVhFUyNOT0dTI0VTUyM="},{"title":"06/03/13 LOTS OF NOTHING","author":"Gail Grabowski, edited by Stanley Newman","date":"2013-06-03","grid":"QVJPTUEjR1JJTSNZQVJECldBWEVTI1JPVEUjRVJJRQpFVkVOVCNBVVJBI1NBTEUKU0VOI0VNUFRZTkVTVEVSCiMjI1RSRUVTI1RBSSMjIwpTT0JFSVQjI0NJVFJVUyMKT0dSRVMjQUxVTSMjTkNPCkJMQU5LRVhQUkVTU0lPTgpTRUMjI01FU1MjUEhPTkUKI0RFQlJJUyMjUFJVTkVTCiMjI0xVRyNUUkVBVCMjIwpaRVJPR1JBVklUWSNFVkUKRUNPTiNBU1NOI0VNQUlMClNIT0QjVElFUyNST1NFUwpUT01FI0VUVEUjU1dFREU="},{"title":"06/04/13 A LITTLE ARITHMETIC","author":"Sally R. Stein, edited by Stanley Newman","date":"2013-06-04","grid":"UEVBUlMjSEVSQiNDQUxMClNUUkFXI09SRU8jT0JPRQpTQ0VORSNOQUlMI0xPQUYKVEhBVERPRVNOVENPVU5UCiMjI1NFTlNFIyNBTlRTWQpBQ1QjTkVUI1NPUCMjIyMKTE9PVCMjI1NUQVJFU0FUCkFVVEhPUklUWUZJR1VSRQpTUEVFREVSUyMjI0dSSU4KIyMjI0REUyNCVVMjRUFUCkVNQUlMIyNFQVJOUyMjIwpGT1JNWU5FWFROVU1CRVIKTE9CUyNVVEFII0ZJRVJZCkFMT0UjTUFDRSNGTEFSRQpUQVJUI0JMVFMjU0VVU1M="},{"title":"06/05/13 RUSH ORDER","author":"David W. Cromer, edited by Stanley Newman","date":"2013-06-05","grid":"I1NBR0UjV0lTUCNTQ0FOCklOU0VUI0lPV0EjQ0hJQwpGQVNUQ0FTVUFMI1JFTk8KRlJFVCNURVNUI0ZFQVRTCllFU0lETyMjI1BSRVAjIwojIyNSQVBJRFRSQU5TSVQKU0FXRUQjR09PRVkjSEJPCkFST0QjVElOTlkjSE9FRApTSVIjUkVWVUUjTU9UVE8KSEFTVFlSRVRSRUFUIyMjCiMjVEhFTSMjI1JPV0VSUwpSQUNFUyNUSEFJI0FRVUEKRVhBTSNRVUlDS1NUVURZCkVMU0UjVEVOVCNMRUFEUwpGRUVTI1NTVFMjT1JMWSM="},{"title":"06/06/13 LAWBREAKERS","author":"Billie Truitt, edited by Stanley Newman","date":"2013-06-06","grid":"U0NBTSNTWU5DI1RIQVdTCk5PR08jSEVBUiNBRVNPUApMT09UI0FMU08jQ0xBUkEKIyMjVEVMTEFXSE9QUEVSClNDUk9MTCMjREFNIyMjIwpPSE8jV09MRiNEQVBQTEUKV0FMTEFXQUxMQSNIT09GCklOTEFZI1NBWSNTRVRPRgpORUVSI1NUSUxMQVdBS0UKR1lSQVRFI1JFRUwjVEVDCiMjIyNIQU0jI0VTQ09SVApTUVVJUlJFTEFXQVkjIyMKT1VOQ0UjTUFNQSNOQUlMCkJJREVTI09WRVIjSURMRQpTS09TSCNTQU5EI0NPTFQ="},{"title":"06/07/13 ON THE LINE","author":"Richard Silvestri, edited by Stanley Newman","date":"2013-06-07","grid":"RkxFRCNET01FUyNIQUhBCkFVREkjRU5BQ1QjQVhJUwpOQU5PI01PQ0hBI1RFTVAKR1VBUkRPRkhPTk9SIyMjCiMjIyNJTkZPIyNORVNUUwpDT01NQVMjI0lDRURURUEKSU1FQU4jREFOQSMjTkVXCkNFTlRFUk9GR1JBVklUWQpBTEEjI0FOVEUjTklDSEUKREVDTElORSMjU09BS0VSCkFURUlOIyNBQkNEIyMjIwojIyNFTkRPRlRIRVJPQUQKWkVBTCNBR1JFRSNBQkxFCklBR08jRFJFQU0jWk9PTQpQUk9XI1NFRU1FI1pFRVM="},{"title":"06/08/13 SATURDAY STUMPER","author":"Lester Ruff, edited by Stanley Newman","date":"2013-06-08","grid":"U1dBVFRFQU0jQURBUFRTClBBTE9BTFRPI1NPSVJFRQpBVFRFTkRUTyNIRUxFTkEKREVBI1NFQU5DRVMjTU9XCkVSSUMjUklMRVMjVklORQpTWVJVUCNOSUwjTUVFU0UKIyMjUk9FI1RFQVNFUkFECkVMSVRJU1QjQkFETkVXUwpNQU5BU1NBUyNIT0UjIyMKQU5OSUUjQk9QI1NDQVJGCklET0wjRUxNRVIjS0VFTApMRVQjQ0xFQVJVUCNOQkEKRURJVE9SI0xJTk9MRVVNClJPTUVSTyNJTElLRUlLRQpTTkVBS1kjQVNORUVERUQ="},{"title":"06/09/13 NAME GAME: Explained further at 103 Across","author":"Fred Piscop, edited by Stanley Newman","date":"2013-06-09","grid":"TUlTVCNQQUxJTiMjQVRUSUMjRkRBCkFSRUEjQVJPTUEjQURIRVJFI1JJQgpMT0NLRVJST09NSFVNSURPUiNJTEwKSU5URVJDT00jI0lSSVMjTkVFRExFCkFTUyNSRVcjQk9ST04jVklTVEEjIwojIyNQT0wjT0xERVIjVElFI0NZQU4KTElURVIjI0JBRFJBUElEUyMjQUdPCkFNSUQjTVVPTiMjI0FNUyMjUFRBUwpTT0QjTk9TRURJVklERSMjR09UTUUKU0tJUE9MRVMjTElERFkjTUVTSEVTCiMjRUlERVIjU0lMTFkjREFOVEUjIwpMQURMRVMjV0hBTEUjQlJVSVNFUlMKSURPTFMjI0hJREVTQUxJVkUjRE9FCkNPTlMjI01JTCMjI0RVUEUjT0dMRQpJUkUjI0hPVExJUElEUyMjQ1JFRUQKVEVTVCNBQ0UjTk9EVUgjQ0FCIyMjCiMjU0hBTksjQUVTT1AjUEFDI1NBRApVUEhFTEQjSklWRSMjQ09TVEVMTE8KUklPI0FTU1VNRURJREVOVElUSUVTCkdFRSNNQUlORVIjTUlOQ0UjQUNSRQpFU1MjT1dORUQjI1BFVEVSI0xFVFM="},{"title":"06/10/13 MONDAY PUZZLE","author":"Gail Grabowski, edited by Stanley Newman","date":"2013-06-10","grid":"Qk9MVCNTVElSI1ZFSUxTCkVSSUUjV0FDTyNJTlBVVApTRUxMI0FIQUIjU1RPUkUKVE9URSNNT05FWU9SREVSCiMjI0NBUEUjI09SRSMjIwpNRVRBTFMjQlRVI0VBUlMKQVJFU08jUEVFTlMjTElUCk1PTlRITFlNQUdBWklORQpBRFMjQVVSQVMjVEVBU0UKU0VFUCNNRUQjQkFSUkVMCiMjI0VTUCMjVkVUTyMjIwpNT05LRVlTVUlUI1pJVEkKT05JT04jVFJPVCNFUlJTClRPTkVTI09HTEUjUkFJTApFUkFTRSNQRUFSI09OTUU="},{"title":"06/11/13 BUGGY","author":"Billie Truitt, edited by Stanley Newman","date":"2013-06-11","grid":"RE9ETyMjSFVMQSNNRVNBCkFSQUIjQklURVIjQUxQUwpNQVRFI0FESUVUI1BPT0gKUExBWUNSSUNLRVQjUE9FCiMjI01BTk5BI1JJUEVOUwpIQVZFVE8jI0JZVEUjIyMKVU5JIyNXQURFI0xFQVNUClNPQ0lBTEJVVFRFUkZMWQpLTkVMTCNMT1NFIyNSQVAKIyMjTE9SRSMjQVRIT01FCk9ISVNFRSNBQ1RJSSMjIwpOT0QjU1BFTExJTkdCRUUKVFJFRSNBWElPTSNIQUxUCkFEQU0jU1BBREUjVVJTQQpQRUxUI1RPU1MjI1BFRUw="},{"title":"06/12/13 WHERE'S THE COFFEE","author":"Fred Piscop, edited by Stanley Newman","date":"2013-06-12","grid":"Q0FNUFMjTUFQUyMjTVVTCk9DRUFOI0FSSUEjU0VOVApTSEFWSU5HTVVHI0NMSU8KI0VMRVZFTiNTRU5BVE9SCiMjIyNFVEFTIyNPUElORQpCQUdFTFMjVE9QVEVOIyMKQUNSRVMjQVJVQkEjR0lTCktFRUwjQkxBU1MjQlBPRQpFU0MjR1JBTlQjQ1JPV0UKIyNJU0xBTkQjTU9SVEFSCkFCQVRFIyNTQ0FOIyMjIwpCQU5BTkFTI09VVEJJRCMKQlJVVCNTVEFOTEVZQ1VQCkVSUlMjUE9LRSNTVEVFUgpZRU4jI1NQQVMjVEVTVFk="},{"title":"06/13/13 FASHION IQ","author":"Fred Jackson III, edited by Stanley Newman","date":"2013-06-13","grid":"TEFYI1NIRURTI1NDQU5UCkFMQSNDT0NPQSNBTElDRQpQVU4jT1JBTFMjWEVST1gKU01BUlREUkVTU0VSIyMjClVOREFURUQjI1RTS1RTSwpQQVVMIyNTVElSI1NIT08KIyMjUFRBI0JPQVIjQU5ECiMjU0hBUlBPVVRGSVQjIwpXT0UjR01BTiNBREQjIyMKT1dMUyNBV0VTIyNFQVNFCk9OTE9BTiMjRVNUQVRFUwojIyNCUklHSFRDT0xPUlMKRkFDRVQjUkVUUk8jTkVBCkVMVklTI0FGTEFUI0FOWQpaRVNUWSNTVEVNUyNMRVM="},{"title":"06/14/13 ELEVATOR MUSIC","author":"S.N., edited by Stanley Newman","date":"2013-06-14","grid":"RElTUFVURSNTV0lOR0JZCk9DRUFOSUEjV0FSSEVSTwpET1dOSU5USEVWQUxMRVkKT05TRVQjU09MRSMjVFdPCiMjI0xFUyNDTElORyMjIwpCRVQjRElTSyNORVJVREEKQVhJUyNHSVNUI1JBQkFUCkJVVFRPTlMjQU5EQk9XUwpFTExFTiNJTkZPI1NBTkUKU1RFQUxTI09USVMjVFNBCiMjI01ZTkFII1JQTSMjIwpUT08jI0FQT1AjRUVSSUUKVVBXSEVSRVdFQkVMT05HCkRFTElWRVIjUkVERElORwpFQ1NUQVNZI0tOT1NTT1M="},{"title":"06/15/13 SATURDAY STUMPER","author":"Brad Wilber, edited by Stanley Newman","date":"2013-06-15","grid":"UkVHQUxFUyMjUEVUUkFUCkFJUkJBTExTI0FTSE9SRQpHUkFTUFNBVCNTUEVBUlMKVUVZI0FFTkVBUyNXUklUCiMjQURaI0dFTkVWSUVWRQpGQVJPI1RJRFkjQUxERVIKRUxFQ1RFRVMjT0xEIyMjCldFQVRIRVIjU0hFV09MRgojIyNSVU0jTElTVEVORUQKU1BSSUcjRElETyNTRUdBClRSQU5TTEFURSNFVEMjIwpST1NBI09NRVJUQSNBTUEKRU5DSU5PI1JPT1RDUk9QClNUQVJJTiNTQVRVUkFURQpTT0xFTFkjI0RFUFVURVM="},{"title":"06/16/13 CABINET MERGERS: Taken two at a time","author":"Tony Orbach and Steve Salitan, edited by Stanley Newman","date":"2013-06-16","grid":"R0xBTSNCRUFVI0NBU1RFI1NDT0ZGCk9BVFkjTEFUSCNBU0tFRCNHT1BSTwpUUkVBU1VSWUhPVVNJTkcjVFJJT1MKQVZBTlQjTEFVRFMjUlRFIyNUT0dTClRBUk1BQyMjSEVBTFRIREVGRU5TRQojIyNBTElGRSNTTE8jIyNEQVpFIyMKU1BBUkVUSU1FIyNDT1NUQVIjRUVSClRPTiMjSU5URVJJT1JDT01NRVJDRQpBTElCSSNJU0xBTSNGT0UjI0FTT0YKUkFUQVRBVCMjRElWRVIjUEFTIyMjClRSQU5TUE9SVEFUSU9OSlVTVElDRQojIyNaQVAjQVVSQVMjI09QVEVESU4KRkVUQSMjSVNUI1RFQU1TI0lSQVRFCkFHUklDVUxUVVJFU1RBVEUjI0hFTQpUT08jQVRFQVNFIyNUQUxMU1RPUlkKIyNNSVJFIyMjQURTI01FTEVFIyMjCkxBQk9SU0VDVVJJVFkjI0VMRUNUUwpBUk9EIyNXQVMjUkFJRFMjTUlMTkUKR0VOSUUjRU5FUkdZRURVQ0FUSU9OCk9ORU5EI1JPVVNFI0xBUkQjVU5UTwpTQVNFUyNTRVBUUyNEWUVTI1BFRVI="},{"title":"06/17/13 SIX","author":"SIX , edited by Stanley Newman","date":"2013-06-17","grid":"U1RPUCNUT1RTI0FCQVRFCldBVkUjRUNITyNERUJJVApJQ0VTI1JFQUwjRkFVTFQKTU9SVEFSQU5EUEVTVExFCiMjIyNUT04jI0xFVCMjIwojQ09MT1IjQ1BBUyNBVFQKQ0FOQUwjTU9PTiNBUEFSCkhVU1RMRUFOREJVU1RMRQpJU0VFI1ZJRVMjTklFQ0UKUEVUI1RFTlMjU0NBUlMjCiMjI1NJUiMjRUVMIyMjIwpTVVBQTFlBTkRERU1BTkQKQUNFSVQjVE9HQSNPUkVPCkZMQVJFI09QRU4jU0VBTQpFQVNFRCNNRVNTI1NBVEU="},{"title":"06/18/13 RADIANCE","author":"Billie Truitt, edited by Stanley Newman","date":"2013-06-18","grid":"I1BMVVMjRVNTI0FUTEFTClBSSVNNI01QSCNSSElOTwpST01FTyNBQUEjTUlORFMKU1BBUktMSU5HV0lORVMjCiMjIyNFRUwjI0lOSyMjIwpQQVBBWUEjQU5OQSNJU00KQUJPTyNSQVJFI1JVTlRPClNISU5JTkdFWEFNUExFUwpUT05FRCNFQVRTI0RBUkUKQVJUI0VORFMjQ1JPV05TCiMjI0JBSCMjSU9VIyMjIwojQlJJTExJQU5USURFQVMKQUxJQkkjSElTI05PVE1FClBPTExTI09ERSNFTkRPVwpUV0VFVCNQRVQjREVTSyM="},{"title":"06/19/13 HAVE A SEAT","author":"Fred Piscop, edited by Stanley Newman","date":"2013-06-19","grid":"VkFMSUQjU01BUlQjR0FQCkFMSUNFI1BBVElPI1JVRQpTVE9PTFBJR0VPTiNFUkEKVElOTklFUiMjI0lTQUFDCiMjIyMjUEVDI0JFRVRMRQpUSEVTSVMjWkFJUkUjIyMKUklMRVMjQkFSVCNIQVRTCkFSTUNIQUlSR0VORVJBTApQRVNUI1RSSU8jQVJFTkEKIyMjSVBPRFMjU05FQUtZCklORk9STSNNQU8jIyMjIwpHQVJOSSMjI1NVTlNQT1QKSURPI0NPVUNIUE9UQVRPClZBQyNFTlNVRSNUQVBJTgpFTEsjWUVBUk4jRVJBU0U="},{"title":"06/20/13 IN YOUR DREAMS","author":"Lonnie Burton, edited by Stanley Newman","date":"2013-06-20","grid":"UEFORyNCVVMjUlVTU0lBCkxJQVIjQVNLI0FOVElDUwpBUlRJQ0xFSSNISUFUVVMKU0xVTUJFUlBBUlRZIyMjCk1PUkVTIyMjUkFZI0JPQgpBR0UjI0NMT1RII01BVUkKIyMjR1JPT01TI1dBTFRaCiMjU05PT1pFQUxBUk0jIwpNQUNBVyNFTkxJU1QjIyMKUExPVyNPTlNFVCMjUElOCkhFVyNBVkcjIyNBU09ORQojIyNTTEVFUFRBTEtJTkcKTk9TSEVSI0VBU1RBU0lBCkFXSElSTCNFUEEjVEVOVApQTEVOVFkjUEVQI0VER0U="},{"title":"06/21/13 HIDDEN 69 ACROSS","author":"Steve Salitan, edited by Stanley Newman","date":"2013-06-21","grid":"I0JBVEgjUlVHI0hBU1RPCkdFTklFI0JSUiNBTExPVwpJTlRFTExJR0VOVExJRkUKTkVTVEVBI0VUQSMjTVVECiMjI0FOVEUjRU5EUyMjIwojUE9DQVRFTExPSURBSE8KQ0FQIyNFTEkjU0VBTEVSClVTQUdFI1NNVSNTS0lMTApTVFJPTEwjSVNBIyNCTFkKU0FURUxMSVRFUkFESU8jCiMjI1NFQVMjRE9MRSMjIwpQRVAjI01PTiNNQU5JTEEKU1RFTExBTUNDQVJUTkVZClNUQUlEI0VBUiNNQVJORQpURUxMUyNSQVkjU0xFRCM="},{"title":"06/22/13 SATURDAY STUMPER","author":"Anna Stiga, edited by Stanley Newman","date":"2013-06-22","grid":"SU1QQUNUUyNDQVJBQ0FTCldPUlRISVQjQU1JTEFURQpBTllUSU1FI0JPTkVMRVQKTk9PTiMjQUNJTkcjSElUClRTUCNTSURJTkcjQ09ORQpJS0UjS05JVFMjRkxVVEUKVElOU0VMTFkjUElBTk9TCiMjI0FXQVkjRElHUyMjIwpCQVJMRVkjSkFMQVBFTk8KWUlFTEQjSFVNT1IjTEVECkZSQVkjR0VMQVRPI0xBWQpPSE0jUFJBWVMjI1BJVFMKUk9PTUlFUiNDQU1JU0VTCkNSVUlTRVMjVVBDTE9TRQpFTlRSQU5UI1NFVkVOVFk="},{"title":"06/23/13 RE-TAIL CHAINS: One pair per answer","author":"Gail Grabowski, edited by Stanley Newman","date":"2013-06-23","grid":"QURNSVJFI0lNQkVEIyMjTEVBUk5UClRFQVRBWCNTQUxBQU0jS0lMQVVFQQpXSVJFU0NVTFBUVVJFI0hBU0FTQVkKQUNFI1NFUEFMIyNUSEVZUkVIRVJFClJFUyNMRVRNRUJFIyNDQlMjIyMjIwojIyNSRURPIyNBRFdBUkUjU0VNSVMKTk9MT1NTI0ZVUk5JVFVSRVNUT1JFCk9SRU8jI1NPUFJBTk8jI1NBQ1JFRApXRUFLI01BUklFI09OVE9QI0hBTkcKIyMjI0lPQyMjI1NVRVJTI01FTEVFCiMjT0ZGU0hPUkVTVFJVQ1RVUkUjIwpQQVJJUyNFTFVERSMjI0FORCMjIyMKQUxBTiNJVEVNUyNTUE9SVCNPREVTClJFQ0lQRSMjUEVBSEVOUyMjSFVSTApDVUxUVVJFVlVMVFVSRSNBUk1PUlkKU1RFRVAjTEVTU09OIyNTVEFZIyMjCiMjIyMjWUVBIyNJVFNPUEVOI0dFRQpOQVRVUkVDVVJFIyNPUEFMUyNSRVgKQVRBQ09TVCNTUVVBUkVNRUFTVVJFCkRPTkFURVMjVFVSTkVSI1NDRU5JQwpBTktMRVMjIyNJTlRSQSNTS0FURVM="},{"title":"06/24/13 SILENT START","author":"Gail Grabowski, edited by Stanley Newman","date":"2013-06-24","grid":"V0lOUyNSRUxBWSNTS0lQCkFSQVQjRVhJTEUjVU5ETwpMT1NFI0NBTkVTI0RJTEwKS05BUFNBQ0tTI05PRkVFCiMjI1BVTlRTI1BPS0UjIwojU0tFRVQjI1RST1VCTEUKU0VORCMjUEFSSVMjTElUCk9SRSNTUEFSRU1FI0FNQQpVVlcjUVVJVEUjI0lET0wKUkVCT1VORCMjVElNRVMjCiMjRVJBUyNTUElOUyMjIwpBQ1RFRCNLTk9DS09GRlMKTkFUTCNSRUFTSyNNQUxUCkVWRVMjVkVSU0UjQVJFQQpXRVJFI1NQRUVEI0RFRVI="},{"title":"06/25/13 LEARNED TRIO","author":"Sally R. Stein, edited by Stanley Newman","date":"2013-06-25","grid":"U1BBVCNBQkxFI0RSQUlOCkxVU0gjQ0xPRCNSQUlTRQpBUklBI0NBR0UjRUdSRVQKVFJBSU5FRE9ORVNFWUVTCiMjIyNPREUjI0FTUyMjIwpBU1NVUkUjU1BSWSNBTFAKU1RBUlQjTUFJTiNEVUFMClRBVUdIVEFMRVNTT05UTwpSSUNFI1JVRVMjUEVUVFkKT1JFI0xFSVMjUEFTU0VTCiMjI1NFQSMjRUFSIyMjIwpFRFVDQVRFREdVRVNTRVMKU0FGRVMjQk9HUyNXQVZFClBST05FI0FMT0UjQU1FTgpORVNUUyNZRU5TI01FTkQ="},{"title":"06/26/13 PERCENTAGE BASIS","author":"Charles Slack, edited by Stanley Newman","date":"2013-06-26","grid":"T0lMUyMjT01BSEEjU1BBCldSSVRTI1ZJUlVTI09MRApOT05FVEhFTEVTUyNNQUQKI05FV1lPUksjQk9HRVlTCiMjIyNNUlMjSkFDT0IjIwpET01BSU4jU09OI1ZPV1MKRUxBVEUjVEVORCMjRElFCk5JTkUjV0FWRVMjVklMRQpJVlkjI0FYRVMjV0lFTEQKTUVURSNUSU4jQlJBU1NZCiMjSEFSRVMjRlJJIyMjIwpCRUFSRVIjRUxJVElTVCMKUkFOI0FMTFRPR0VUSEVSCkFTSyNDT09SUyNTQ09SRQpZRVMjVE9URVMjI0hFTVA="},{"title":"06/27/13 CHROMO-ANATOMY","author":"David W. Cromer, edited by Stanley Newman","date":"2013-06-27","grid":"VEVTVCNTRU1JUyNTT0RBCkRFTEkjTEFVUkEjSU1JTgpTTE9UI0FTQ09UI0xFVlkKIyNXSElURUtOVUNLTEVEClNBTEVNIyMjU1BBI0VSQQpBSEEjRlVORCMjUkFUVFkKR09ORSNGRUVMRk9SIyMjCiNZRUxMT1dCRUxMSUVEIwojIyNNSVNTVVNBI0FWSUQKUk9CT1QjI1RTUFMjSU5OCkFSRSNIQVMjIyNNQUxUQQpTSUxWRVJUT05HVUVEIyMKQ09MQSNNT1BFWSNUT0dPCkFMRVMjT05FQU0jTkVNTwpMRVNUI1JFTlRTI0FSQ0g="},{"title":"06/28/13 WOBBLY WARNING","author":"Bruce Venzke, edited by Stanley Newman","date":"2013-06-28","grid":"V0hBVCNDSEFQI1dISVBTCk5PTk8jVVNTUiNIQU5PSQpCVVRXSEVOWU9VRU5EVVAKQVJFTkEjI0VMU0UjWVJTCiMjI0lIT1AjT0REUyMjIwojQlJFQUtJTkdBTEVHSSMKSVJJUyNMRU8jI0VBUk5TCkJPWiNDQVNUTEVTI0VUQQpNQVpEQSMjSU9OI1BFUlQKI0RPTlRXQU5UWU9VVE8jCiMjI0FCQ0QjVEFMTCMjIwpBTEEjSVRPTyMjRUxGSU4KQ09NRVJVTk5JTkdUT01FCkFSTUVEI0lUQ0gjQVJJQQpJRE9MUyNTT1VMI0JFTlQ="},{"title":"06/29/13 SATURDAY STUMPER","author":"Bruce R. Sutphin, edited by Stanley Newman","date":"2013-06-29","grid":"RU1BSUxTI1NDSE1FQVJTCk1JTk5JRSNFTEVDVFJPTgpBU1RVVEUjU0FSQVNPVEEKTk9JU0UjQVNTRVQjTUFSCkFTSEUjRkxJUFMjRkFURQpUT0UjQ0xJT1MjUklTRVMKRVVST1BFQU4jT0FSIyMjClNQT0lMRVIjU1VOU1BPVAojIyNOVVQjUklOR1RPTkUKU09DS1MjREFOQ0UjU0VBCkNQQVMjV0lOQ0UjRklMTApSRU0jUElFQ0UjS0FUSUUKSU5BUElOQ0gjUEFDSU5PCk1FUkVOR1VFI0VMRVZFTgpQUk9URVNUUyNQRVRFUkk="},{"title":"06/30/13 CONJUNCTION: Starting off with wordplay","author":"David W. Cromer, edited by Stanley Newman","date":"2013-06-30","grid":"TEFQQVojTEFNUFMjQkVUQSNXQkMjCk9YSURFI09SQklUI0FYRUwjRVJPUwpDT05EVUNUVEFQRSNaRUFMI0NVUkwKS05PU1NPUyMjRU1CQVJLI1FBTkRBCkVTVCMjUk9UTyMjUkFUI0xVUkVPTgojIyNDT05GSU5FRk9SU1BFRURJTkcKQVJST1cjI0FEUkFXIyNBRFMjIyMjClRPQ09OU0VSVkVBTkRQUk9URUNUIwpNRUFMI0FUQUQjIyNBVFROI0RJRVQKIyMjI1RMQyMjUEFTVEEjI05JVFJPClNUQU5EVEhFQ09OVEVTVE9GVElNRQpMQU1BUyMjVE9EQVkjI09XTCMjIyMKT1ZFUiNTRUFMIyMjQUxPRSNCQVJECiNJTkNPTlNUQUJMRUNPTkRJVElPTgojIyMjQk9QIyNZQUxUQSMjUlVNQkEKQ09ORk9VTkRJTkdGQVRIRVJTIyMjCk9NRUxFVCNBRE8jI1NIT1cjI0dVTQpOQVZFUyNDUkVXRUwjI0xBU0NBTEEKR05BVyNOSU5BI0NPTlRFTlRDSVRZCkFJREEjQkFJTCNIQUlLVSNFWFRSQQojU0FUI0NPVFMjT05UT1AjUElTQU4="},{"title":"07/01/13 STOP SHORT","author":"Gail Grabowski, edited by Stanley Newman","date":"2013-07-01","grid":"U0FMQUQjQ09CUyNCRVNUCkVDT05PI0FMT0UjTEFURQpSQU5UTyNOSU5FI09HUkUKRlJFRVpFT1ZFUiNDTEFNCiMjIyNJU0VFIyNTS0VXUwpQUk9DRVNTI1NURVAjIyMKVkVOVVMjI0JBUlRBQlMjClRBQ1QjU09BUFkjUk9PRgojTEVUVElORyMjQVRPTEwKIyMjSE9QRSNHT0JZU0VBClNQQVJFIyNBQUFTIyMjIwpBTFRPI0VORFBST0RVQ1QKTFVMVSNET01FI1JFQ1VFCkVNQUcjQVJJQSNCRUxMRQpNRVNII01JVFQjU1BBVFM="},{"title":"07/02/13 NEW YORK, AT LAST","author":"Billie Truitt, edited by Stanley Newman","date":"2013-07-02","grid":"Q0hFRiNNQU5JQSNFQ0hPClBFQUwjVVNFUlMjTk9PSwpBTVNPI1NUUk9QI0FSRUEKU0lUVUFUSU9OQ09NRURZCiMjI05BWSMjI0FHRSMjIwpTQU5EUyNBTUEjTExBTUEKVFJFRSNFRElCTEUjV0VCCkFNRVJJQ0FOSElTVE9SWQpST0QjTk9HT09EI0VLR1MKVFJZU1QjRVJSI0ZMRUVTCiMjI0VSQSMjI0xJRSMjIwpVTktOT1dOUVVBTlRJVFkKUE9FVCNGT1VORCNIT0hPCkRPRVIjVU5JVEUjT1dFUgpPTkxZI0xFVE9OI05BTUU="},{"title":"07/03/13 GETTING BETTER","author":"Fred Piscop, edited by Stanley Newman","date":"2013-07-03","grid":"QU1BU1MjTUFEQU0jR01DCk1PTFRPI0FDVVRFI1JJTwpQT09SUklDSEFSRCNPTEQKI1NUQVRTI0VMSSNKVUtFCiMjI0lTTyMjI1VQT04jIwojQUNUI0ZBSVJNQUlERU4KUExPIyNGSU5JI1NOT1JFClJBTVBTI09SQSNTVFVOUwpJTVBFSSNMRVRTIyNUSVMKR09PREZSSURBWSNBU0UjCiMjU0FURSMjI1JBVCMjIwpJTlRMI0FNUyNVTFRSQSMKVkVFI0dSRUFUUExBSU5TCkVSUiNQVVJHRSNPQ1RFVApTT1MjU1BFRUQjVEhBV1M="},{"title":"07/04/13 GOING CONCERNS","author":"Bruce R. Sutphin, edited by Stanley Newman","date":"2013-07-04","grid":"QUdSQSNBTExBWSNBVURJClRSQU0jUk9VR0UjSVJBUQpNQUdJI0dNQVRTI1JJTVMKI0ZVTk5ZQlVTSU5FU1MjCiMjI09ZTCMjI0FJRCMjIwojVEhSRUVTQ09NUEFOWSMKQk9BIyNTVFVCI0FMT0FOCkZSSURBI0FLQSNURU5MQgpBU0tFRCNNT01TIyNQSUMKI09VVE9GUFJBQ1RJQ0UjCiMjI0VSQSMjI0VBUiMjIwojVVNTRU5URVJQUklTRSMKQ0hBVCNHQU1VVCNTT0xECkJPTkUjRUxJREUjRUFTRQpTSEVEI0RFVEVSI1NQRVc="},{"title":"07/05/13 NAME  VARIATIONS","author":"Ki Lee, edited by Stanley Newman","date":"2013-07-05","grid":"UklQUyNBRE1JVCNSRURBCkVBUk4jVEVBTU8jRVhFUwpGTEVBQ09MTEFSI0NDQ1AKIyNMSVpaSUVNQ0dVSVJFClBBVUxBIyMjU0hPUlRFTgpIVUQjUkFETyMjVFJFRVMKSURFTyNOQVJSQVRFIyMjCkxJU0JFVEhTQUxBTkRFUgojIyNTQUlMT1JTI1RVVFUKU0FWRVMjI05FT04jQ1JUCkFOSVNFRUQjIyNDQUtFUwpMSUVTTFZPTlRSQVBQIyMKT01OSSNBTUlXT1JSSUVECk1BTk8jREVOSVMjSU5UTwpFTEFOI0VERU5TI0xTQVQ="},{"title":"07/06/13 SATURDAY STUMPER","author":"S.N., edited by Stanley Newman","date":"2013-07-06","grid":"Q0FOQVBFI0FDQ09MQURFCkFCT0RFUyNUT09LQUNBQgpTT0xWRVMjRklORVRVTkUKRU1BSUwjRElOI0RFVEVSCkZJTlMjRVJST1IjTkVTVApJTlJFVFJPU1BFQ1QjIyMKTEFZI1JBTlQjR0FTQ0FOCkVUQSNVU0UjQkFNI09ERQpTRU5BVEUjWUFMRSNWQVQKIyMjVEhSRUVMTExMQU1BClNBU0gjU05BS1kjRVJBUwpFWEFMVCNDUlkjU1RJUlMKTklORUlST04jUkVUQUtFCkRBWVRSQURFI0lHRVRJVApTTE9FRVlFRCNQQVJFTlM="},{"title":"07/07/13 CELEBRITY MISCELLANY: With 108 Across in common","author":"Fred Piscop, edited by Stanley Newman","date":"2013-07-07","grid":"UFNBVCNTUElERVIjRElBTCNFTEFMCk9ITk8jV0lOT05BI09HUkUjVklWQQpUT05ZQkVOTkVUVCNKRUZGQkVaT1MKU0VBU0lERVMjI1RST1QjVEVOQU5UCiMjIyNMRUQjU09MRVMjRFVFUyMjIwpNQ0pPQlMjRkFSRUQjU1VQUE9TRUQKQUxBTU8jTUVMQlJPT0tTIyMjVEVFCk1PQ1MjQ09MQSMjI1BJVCNPUEVSQQpJTksjREFWSURNQU1FVCNTTkFQSU4KRUVMI0FNRVgjRURFTiNNQVRDSEVTCiMjQVNORVIjQ1JFU1MjQUxJS0UjIwpDQUxJQ09TI0hJUFMjU0xVTSNOQ1IKUExBVEVTI0JFVFRZV0hJVEUjS09JCkxJTkVSI1NJUyMjI1JBR0UjV0lORwpVU04jIyNFTFRPTkpPSE4jQ0lOQ0gKU1RFUEJBQ0sjTU9BVFMjUExJR0hUCiMjI0xBRFkjR0VOUkUjRVJBIyMjIwpBQk9BUkQjRkVOUyMjQVZFTUFSSUEKVE9OWUJMQUlSI1RIRVNJTVBTT05TCk9SQ0EjRURBTSNPUk5BVEUjSU1PSwpNRUVUI0RPVFMjUEVFUEVEI0ZBTlM="},{"title":"07/08/13 START OF JULY","author":"Gail Grabowski, edited by Stanley Newman","date":"2013-07-08","grid":"QkFUUyNOQVNUI01BSk9SCkFMT0UjT0JPRSNVVFVSTgpKVVNUUkVMQVgjVE9ORVMKQU1TI0VYRVJUI0lOS1MjCiMjI0hBSVIjQk9ORUQjIwojRUpFQ1QjQ09QWSNSSVAKRVhVTFQjI0xPVCNQQVNTClJBTVAjTE9PS1MjT1dMUwpJTVBTI0VORCMjU0xFRVQKRVNUI0NBVFMjU1RBUlMjCiMjSEFSU0gjU1BBUiMjIwojREVMSSNFTUFJTCNBREEKV0FHRVMjSlVOR0xFR1lNCkFaVVJFI09UVE8jUEVFUApSRU5UUyNCRUFUI0FERFM="},{"title":"07/09/13 SIGN HERE","author":"Billie Truitt, edited by Stanley Newman","date":"2013-07-09","grid":"RElTSCNBQkxFI1JBTkJZCk9OTUUjR1JBWSNBU09SRQpHTEFEI0VBU0UjRklUSU4KTUVSR0lOR1RSQUZGSUMjCkFUVEVORCMjU05MIyMjIwojIyMjQkFTRSNHRVJCSUwKQUdSRUUjTEFPUyNJT1RBCllJRUxEUklHSFRPRldBWQpFVklMI0FNRU4jUkVTVFMKU0VOU0VEI1JPUEUjIyMjCiMjIyNWSUEjI0hPQVJTRQojU0NIT09MQ1JPU1NJTkcKU0hPT0sjVE9PVCNTT0FSClBVTFNFI0FMU08jRURHRQpBTlRFRCNSQVlTI1RFU1Q="},{"title":"07/10/13 LAUNDRY LIST","author":"Fred Piscop, edited by Stanley Newman","date":"2013-07-10","grid":"U0xJUCNTUElGRiNDT0dTClBPT1IjUE9ESUEjQU5OQQpBRlRFUkFTT1JUI1NFQU4KI1RBTEVOVCNTRUFIQVdLCiMjI0lDSyMjIyNTRVQjIwojQUhNRSNNT1VUSFdBU0gKQ1JPU1MjQUxTTyNTVEVXClJPVCNTRU5EVVBTI0lWWQpPTUFSI1BFRVIjQ09NRVMKQ0FOQURBRFJZI09WRU4jCiMjRE5BIyMjI0FSRSMjIwpCRUNLSEFNI0VYRVJUUyMKSURPTCNDRU5URVJGT0xEClRFTEUjVFJJQUwjRVJJRQpFTkRTI1NFTExTI0RFTVM="},{"title":"07/11/13 FREE-FOR-ALL","author":"David W. Cromer, edited by Stanley Newman","date":"2013-07-11","grid":"U0VDVCNEUlVNI1JFUEFZCkFMT0UjSU9UQSNFWFVERQpOQU5BI1NMQU0jTUlORFMKS0lDS1RIRUhBQklUIyMjCklORSNIRVgjI0FTU0lTVApORVJWRVMjV0FZUyNORUQKIyNUQU0jVFlQTyNQVEFTCiNCSVRFVEhFQlVMTEVUIwpQRU5TI1JVVFMjT0VSIyMKRVRBI0JVU0gjUldBTkRBClBBU1NFUyMjQkVFI0VBVQojIyNISVRUSEVCUklDS1MKQ0hPSVIjQk9aTyNSSU9UCk5FSFJVI1NIT08jQU5URQpOWU1FVCNQT1NUI1NFQU4="},{"title":"07/12/13 BOOZE AND HISSES","author":"S.N., edited by Stanley Newman","date":"2013-07-12","grid":"I0JBVCNBVEVBVCNBQ1JFCk1VU0UjVEVBQ0gjQ0hFWApJT1dBI1RBU1RFI0xJTlQKUllFU0VOU0VPRkhVTU9SClRFTEVYIyMjUkJJI0VWRQpIREwjVEhJUyNJQ0VEQU0KIyMjRlJPTlRTIyNSSVRFCiNTUVVBV0tBTkRXSU5FIwpCVFVTIyNTVEFZSU4jIyMKRVJJRVBBI1NQRUQjQlVNCkRFQiNSQ0EjIyNFTElURQpTVUJCT1VSQk9OTklHSFQKSVNMQSNJR0lWRSNTVEFSCkRFRVIjVFVCRVIjWkVOTwpFTFNFI1lFU05PI1ROVCM="},{"title":"07/13/13 SATURDAY STUMPER","author":"Frank Longo, edited by Stanley Newman","date":"2013-07-13","grid":"U0xBQ0tFTkVEI0FCQUNLCkhPTEVJTk9ORSNURVRSQQpPQ0VBTkxJRkUjQUxUQVIKVEFYU0VBU09OI1BMQU5UCiMjI0lDSUVSI0NST0NLIwpQT0lOVCNNQ0NISUNLRU4KTFVORyNHQUVMSUMjUERBCkVUSCNESUsjQVZFI0xPSQpBVE8jQVZFUlNFI0hBVUwKU09NQlJFUk9TI1BFTlRTCiNMRUVLUyNCSURVUCMjIwpMVUNBUyNCT0NBUkFUT04KRU5BTUkjQUNDUkVUSVZFCkFDUkVEI0dPQUxMSU5FUwpTSEVSRSNTUFJBWUNBTlM="},{"title":"07/14/13 SPORTING CHANCE: Gear up right here","author":"Gail Grabowski, edited by Stanley Newman","date":"2013-07-14","grid":"Qk9MQSMjU0hBQ0sjUklEUyNFQUNICkFOSVRBI1RBQk9PI0FUT00jQUxPRQpTVFJFUCNBREFSTiNJU0xFI1NFTEwKI1ZBTVBJUkVCQVQjU0FMQVJZQ0FQCiMjI1BBTkVTIyNJRElHI1JVTiMjIwpHT0NPTEQjI0JJS0lOSVMjQk9NQlMKVU5PI0xJR0hUTklOR1JPRCNXQUxMCkxFU1QjQUxFVVQjIyNMT1JFI0tJQQpQQVRII05FQSNPT1BTI1RBVVRFU1QKU0xVUiNTQVBTI1BFQVQjR1JFQVNFCiMjTUVBI05FV0pFUlNFWSNPQVIjIwpJREVBTFMjRElMTCNTTkFQI1NBV04KQk9CRE9MRSNNT1NTI0RMSSNFQ0hPClNQQSNUQUxDIyMjQVRFSU4jU0tJVApFRUxTI1ZJUkdJTklBUkVFTCNFUlIKTllMT04jU09SUkVMUyMjVEFUVExFCiMjI1NSQSNQRUFMIyNTSEFQRSMjIwpET0dQQURETEUjU1VQUEVSQ0xVQiMKQVJFQSNERUFMI09OQUlSI0FMQ09BCk1FTkQjTEFORSNOSVRSTyNUT0xMUwpQT1RTI0VERFkjU1RFRUQjI0ZBRFM="},{"title":"07/15/13 HOLD IT","author":"Gail Grabowski, edited by Stanley Newman","date":"2013-07-15","grid":"I0ZFVEEjTUVTQSNBTFRPCk1PVkVEI0FHRUQjQ09PUApHUklORElOR1RPQUhBTFQKTUVMVCNORVNUI0xFTkRTCiMjI0FTS1MjTE9VRCMjIwpNRUNDQVMjR0VSTSNOT1IKQUJBTEwjU09EQSMjT0RFCkNPTUVUT0FGVUxMU1RPUApIT1AjI1BMT1AjT1BFUkEKT0tTI0xFRVIjRFJFU1NZCiMjI1BJTlMjUlVERSMjIwpTSEFSRSNUT0lMI0RBTVMKV0VDQU5IQVJETFlXQUlUCkFSTVkjR0xFRSNFQVJMWQpCRUVTI1RLT1MjVFlQRSM="},{"title":"07/16/13 FREEBIES","author":"Sally R. Stein, edited by Stanley Newman","date":"2013-07-16","grid":"QUJBU0UjQVRNUyNTVEFCCkxPVUlTI1VIVUgjVEFMRQpTT05HUyNUT0dPI1VQT04KT05USEVIT1VTRSNERUVECiMjI1RTQSMjI1NDSSMjIwojSEFTI1dBUyNJUk9ORVIKVEVQRUUjR0FVWkUjRUxJCkFMTEVYUEVOU0VTUEFJRApCTFUjVEVTVFMjVEFSVFMKU09TT09OI0FSTSNTU0UjCiMjI0JMVCMjI0FDVCMjIwpNQVNUI0FUTk9DSEFSR0UKQVJJQSNHT09EI0FCT1VUClpJVEkjT05UTyNNQUxUQQpFREVOI05FRVIjUFJFU1M="},{"title":"07/17/13 CROSSWORDS 101","author":"Lonnie Burton, edited by Stanley Newman","date":"2013-07-17","grid":"QkVHQU4jVFlQRSNIVE1MCkVWQURFI1JFRlMjQVJFQQpMRUlTVVJFQUNUSVZJVFkKVE5UI1RBTVMjI05BTUVTCiMjI0FSR08jUElFUyMjIwojT05ZT1VSQ09NUFVURVIKU0hFRU4jI0FMT1QjUkFZCkVNVFMjTUlOU0sjUklURQpNQVcjRlVERCMjUEVLRVMKSU5USEVORVdTUEFQRVIjCiMjI0FSSUEjVFJJTyMjIwpBTEJVTSMjQ0VPUyNJT1UKRklMTElOVEhFQkxBTktTClRSVUUjT1dFRCNFUk5JRQpTRUVEI1dPV1MjWUVTRVM="},{"title":"07/18/13 RANGED ALL OVER","author":"Billie Truitt, edited by Stanley Newman","date":"2013-07-18","grid":"QUNUSSNIQVRTI01VUkFMClRVUk4jT0hISSNBRklSRQpIRUlSI0xFQU4jQ09PRUQKT1VUT0ZEQU5HRVIjR0FHClNQRUFSRUQjI0NPVVJTRQojIyNEQU0jQUxBU0tBIyMKR1VUU1kjQUZBUiNFTlZZClVTRSNTRUNPTkRTI0RFRQpNT0FOI0FNT0sjQUJFVFMKIyNHRVRTRVQjSlVMIyMjCklOQVdBWSMjRklORUFSVApQQVIjVEFLRUFHQU5ERVIKQU5EUkUjT0FSUyNET1NFClNORUVSI09SQ0EjRVJJRQpTWU5DUyNLTkVXI0RFTlM="},{"title":"07/19/13 SALOON STARTERS","author":"Fred Piscop, edited by Stanley Newman","date":"2013-07-19","grid":"T0RJU1QjRkFSRSNTVEFZClRFU0xBI09NRU4jQ0FSRQpDTE9BSyNBTUlEI0FYSVMKI0lOTkVSTU9OR09MSUEjCiMjI1RJRVMjI0FCRSMjIwpTUEhJTlgjVEFNRSNJRE8KQUxBTiMjU0FMRVMjUkFGCkJBUkdBSU5CQVNFTUVOVApMWUUjVVJBTFMjI09OQ0UKRVNTI1JBR0UjU0NSRUVOCiMjI0lBTiMjUklPVCMjIwojUFVCTElDU0VSVklDRSMKTUFOUyNBTFVNI0VDQVJECkJJVEUjTk9NRSNSSU5HTwpBTk9OI1NQT1QjU0FUT04="},{"title":"07/20/13 SATURDAY STUMPER","author":"Jeffrey Harris, edited by Stanley Newman","date":"2013-07-20","grid":"QUNDRVBUQU5DRSNGQURTCkJBUkJJRURPTEwjVU5JVApBUkFCTEVBR1VFI1JPVkUKVEVOU0UjIyNFVkFTSVZFCkVXRSNTVFJVREVMI05JUAojIyMjI0hFUiNORUFURU4KQ0VMI0dBSU5TI1JBSVNFCkxJRURPV04jVEVUQU5VUwpBVFRJQyNTUEFUUyNHUFMKU0hJTU9OI0FGVCMjIyMjClNFVCNMVVNURlVMI0JCQwpNUkJPRERZIyMjT05FQUwKQVdFRCNHUkVUQUdBUkJPClRBTUUjRVVST0RJU05FWQpFWUVTI1NQRUVEQ0hFU1M="},{"title":"07/21/13 FUNNY FOLKS ? Doubly so, you'll find","author":"S.N., edited by Stanley Newman","date":"2013-07-21","grid":"U0hPT1MjQVNTTiNJQk0jSU1QQVJUCkNPTU1BI0xFVkkjTkVPI01PT0xBSApBUklBTCNBTEVDI0FOVCNQVVJJVFkKTkFUSEFOSUVMSEFXVEhPUk5FIyMjCiMjI0FETyNTVE9LRSNFTklEI01TUwpVUFMjRE9NI0VMSSNXUkVOI0JFVEEKTUVUSEFOT0wjQU5ORUhBVEhBV0FZCkFSUkFZI0xFR1MjT1JFI1NBVElOWQpTVEFUUyNBQUEjT05FTkQjTEFOQ0UKU0hZIyNVU1NJT1dBIyNSQVZBR0VTCiMjI01BUlNIQUxMTUNMVUhBTiMjIwpIRVJPSU5FIyNERUVQRU5TIyNTS1kKQU5PVVQjU1BMSVQjQU9LI0FHSUxFCkdMQU5DRSNFU1MjQVNJQSNNSVhJTgpNQVJUSEFHUkFIQU0jSVJSSVRBTlQKQUNFUyNHQUlUI01VRCNEVU4jTUVMCk5FRCNBTExTI0ZJTkVSI1NPRCMjIwojIyNKT0VMQ0hBTkRMRVJIQVJSSVMKTk9NT1JFI09BSyNTVU1PI0NPVVBFClBMRU5UWSNQSEkjRVhJVCNJTkxBVwpSRUdHQUUjRUFSI05FVFMjREVFRFM="},{"title":"07/22/13 GETAWAYS","author":"Gail Grabowski, edited by Stanley Newman","date":"2013-07-22","grid":"WUVBUlMjR0FJVCNHSVNUCkVBVFVQI1JVU0gjT0JPRQpBU09ORSNPRE9SI1NFTEwKSEVNI0NBU0lOT0hPVEVMCiMjI05JUFMjI1RFTCMjIwojU1RPTVAjUE9UUk9BU1QKQUNBUkUjU0VBTCMjQklPCkNBQklOSU5USEVXT09EUwpFTEwjI1RVVFUjSElWRVMKU1BFRURTQlkjTU9MRVMjCiMjI0xFRyMjUEFTUyMjIwpPQ0VBTlJFU09SVCNFU1MKRE9MVCNFREVOI0hBREFUCkRPU0UjQUdFRCNBR0lMRQpTTEVEI1RFTlMjVE9URU0="},{"title":"07/23/13 EASY AFTERNOONS","author":"Billie Truitt, edited by Stanley Newman","date":"2013-07-23","grid":"U0NPTEQjRUFSUyNBQkMjCkxFVkVFI0FCRVQjRFJBQgpJREVBTCNUUkFZI0RBTkUKUEVSUEVUVUFMTU9USU9OCiMjIyNUT1AjI0lST05FRApMSVNURU4jU0xFRCMjIyMKT05MWSNHTFVFI0VMQk9XClBST1BPU0VNQVJSSUFHRQpTRVdFUiNUVU5BI0ZJTEUKIyMjI0dBU1AjVkVUVEVEClNMT0dBTiMjTUVOIyMjIwpQT0NPTk9NT1VOVEFJTlMKQVVUTyNJT05TI0lOVE9XClRJRUQjTk9URSNDT0JSQQojU1RZI1RST0QjRU5FTVk="},{"title":"07/24/13 CONTRACT TRIO","author":"Fred Piscop, edited by Stanley Newman","date":"2013-07-24","grid":"VE9SVEUjQVRNUyNNVVNFCkFWT0lEI0NPT1AjQU5OQQpUQUlMR0FURVBBUlRJRVMKQUxMI0lETyMjU0VUVEVFCiMjI0hFQVJTVCNWRUVSUwpESVNBUk0jTkVXRVIjIyMKT0RPUiMjUFVSRVIjTElFCkdFTkRFUkFHUkVFTUVOVApTQVkjTVVHR1kjI0FJREEKIyMjUkVCRUwjU1BSQVlTClNFVkVSI0RFTVVSRSMjIwpUUklBR0UjI09ORSNFQ08KT05TUEVBS0lOR1RFUk1TCk1JVEUjVElSRSNUWVJPTApQRUFSI1NUQVkjWUVTTk8="},{"title":"07/25/13 SHIP SHAPE","author":"David W. Cromer, edited by Stanley Newman","date":"2013-07-25","grid":"QUJDUyNURU1QI1BFRUxTCkdBTEwjQUNBSSNJTlRFTApPUkVPI0NPQ0EjRUxVREUKI0JST09LTFlOQlJJREdFCiMjR1BBIyNTT0wjU0VFUApDUllTVEFMIyNUT1QjIyMKQUlNIyNNRVNTI1JFTUlUClNUQUNLSU5HVEhFREVDSwpIQU5PSSNTVFVCIyNET08KIyMjTkFQIyNOT1JNQU5TCkNIRUYjUk9FIyNBT0wjIwpIT1JJWk9OVEFMSE9MRCMKQU1BTkEjVEFDTyNTSUFNClJJU0VOI0FJTFMjSE9MRQpTRUVEWSNQTFVTI1VOSVQ="},{"title":"07/26/13 SECOND CHANCES","author":"Bruce Venzke, edited by Stanley Newman","date":"2013-07-26","grid":"Qk9ERSNBTFRPI1NDUkFNCkFQRVMjUkVCQSNLT0FMQQpTRVRUTEVGT1JTSUxWRVIKSVJFI0FUVE4jT05ERUNLCkNBUlVTTyNFQVJOUyMjIwojIyNTSE9XI1NUWSNMQkoKQUxHQUUjRUFTRSNDSUFPCkZJTklTSEFUQURTSE9SVApFVkFOI0VOVlkjSE9OS1MKV0VUI01BRSNTVEFSIyMjCiMjI0NPUkRTI09MRFBBTApBTEVBU1QjQVJHTyNFUkEKTUlTU1RIRUJJR01PTkVZCklNUEVMI0RFTEwjQU5ORQpEQU5EWSNUUkVFI0ZFQVI="},{"title":"07/27/13 SATURDAY STUMPER","author":"Brad Wilber, edited by Stanley Newman","date":"2013-07-27","grid":"U0hFUEFSRCMjTUFJTElOCk1FTlRJT04jUElOTkFDRQpBUkNBRElBI09DVE9CRVIKQ09PIyNMTEFNQVMjT1JVCktJUlJPWUFMI0hZQlJJRApPTkVVUCNCTFQjI0xFTkEKRkVTVEVSI0VBUk1BUksjCiMjI0dSQVZZQk9BVCMjIwojT0NFQU5JQyNCUkFDRVIKTElBUiMjUEFUI0NOT1RFCk9MRFNPRCNUSUdIVFdBRApPUkUjVEVBU0VMIyNSSU0KS0lOU0hJUCNTRUFNSUxFCkFDQ1JFVEUjVEFLRVRFQQpUSEVPUlkjI09OQUxFUlQ="},{"title":"07/28/13 CAREER CHANGE: Words from an NBA Hall of Famer","author