{"id":"newsday-2016","publication":"newsday","year":"2016","count":362,"puzzles":[{"title":"01/05/16 SHIRT STUFF","author":"Billie Truitt","date":"2016-01-05","grid":"UEFSSVMjSUNFUyNQRUVQCkFSSVNFI05PVkEjT1JFTwpMSU5FRCNCT0lMI1RVUksKTUFLRUFDT0xMQVIjUElFCiMjIyNUQVgjI01JU1RFUgpFUkFTRVIjRkFJTlQjIyMKVEFSVCNHQUlUI1NPU08jClNQRUFLT0ZGVEhFQ1VGRgojVEFDTyNSRU5PI0tJTkQKIyMjS0FZT1MjUEFTVE9SCkhBU1NMRSMjRUVMIyMjIwpBTEEjQUxCVU1TTEVFVkUKU09MRCNQRVJQI0VBVElOClRIRVkjRUFTVCNHUkFORApFQVNFI0REQVkjRVNTRVM="},{"title":"01/06/16 NO ROOM","author":"Carolyn Stewart","date":"2016-01-06","grid":"VkVEQVkjSU1BTSNTT01FCkVSSUNBI1JFTk8jUVVBRApBTlZJTCNBTlRJI1VaSVMKTE9BREVEUVVFU1RJT04jCiMjI1JVRSMjU1RJUiMjIwpBU1RPI0NJTyMjQkVBUkQKU1BFQyNPUkFDTEUjV0FSClBBQ0tFREFTVUlUQ0FTRQpJQ0gjVEVORVRTI0FSVFMKQ0VTVEEjI1NFVCNURUFTCiMjI1ZJQ0UjI0VUQyMjIwojRlVMTFNQRUVEQUhFQUQKUk9TQSNQT0xMI0xBVFRFCk9YRU4jQVhJUyNFTFRPTgpCWVJEI05ZU0UjU0xFUFQ="},{"title":"01/07/16 WHISTLEBLOWERS","author":"Matthew Sewell","date":"2016-01-07","grid":"UFJPUyNNQVpEQSNNRUwjCkpPTFQjQUxBUk0jRU1JUgpTVEVBTUxPQ09NT1RJVkUKIyNTVE9MRSNQQUxBVEVTClRBVFVNIyNUSU5FI1RPVApNQVJFI1RXSVQjI1JFTkUKQ0hBVFJPT00jU0VFREVECiMjI1RFQUtFVFRMRSMjIwpERVBFTkQjU01BTExGUlkKRVhFUyMjU1VJVCNUQUtFCkNQUiNCRUVQIyNST0JPVApBTEdFQlJBI0JMQVJFIyMKRk9PVEJBTExSRUZFUkVFClNJTE8jU0VFSU4jRUdBRAojVEFOI0VER0VEI0xFVFM="},{"title":"01/08/16 ONE OF A KIND","author":"S.N.","date":"2016-01-08","grid":"QkFTSCNQT0NPI0lOQ1VSCkFMSUEjQUFSUCNOT09TRQpCTFRTI0NIQVQjRlNUT1AKWU9VQVJFVU5JUVVFIyMjClNXQVRIIyNJTlVOREFURQpBTVQjRU5HQUdFI0lNSU4KVEVFI1NBVUwjUlNWUEVECiMjI0pVU1QjTElLRSMjIwpJTlNJU1QjQVZFTyNBRFMKQ09JTCNBVFJJU0sjQklDClVOQ0xFU0FNIyNJUklTSAojIyNFVkVSWU9ORUVMU0UKSEFJVEkjU0FLRSNERUVNCk1BTFRBI1VOSVgjT05DRQpTSEVFTiNTVEVUI1NFVFM="},{"title":"01/09/16 SATURDAY STUMPER","author":"Frank Longo","date":"2016-01-09","grid":"U0lMVCNTQUxFU1NUQUZGCkFNSUUjRVhFQ1VUQUJMRQpSQVBUI1JFQUxOVU1CRVIKSU1QUk9WI0hBTkRTRVdOCiMjTEFQSVMjVElFIyMjIwpIT1VTRUNBVCNFTkRTSU4KRUxNI0RFU1NFUlRXSU5FClJJUEUjI0hBRyMjSU5GTwpPVkVSQUJBUlJFTCNLRU4KU0VSQVBFI1NFTkFUT1JTCiMjIyNQQUQjVFJVRVIjIwpTUEhFRVJJUyNPREVTU0EKQUxVTU5JQ0xVQiNUV0lYClNPTElEU1RBVEUjSElGSQpTVEFSU0hBUEVEI0VNVFM="},{"title":"01/10/16 THE \"IN\" CROWD: Both first name and last","author":"S.N.","date":"2016-01-10","grid":"Qk9SRSNQRVRUWSNBRE9STiNXQVNICkFWRVIjSVZJRVMjTk9ORVQjRUxNTwpURVNUI0dFUkFMRElORUNIQVBMSU4KVFJFRUxJTkVTI0FNVVNFI1NUQUxLCkVMTSNBUkJTI1BST1RFU1RTI1lFUwpST0IjUE9FI0pBWVMjQ1NQQU4jIyMKQ0FMVklOVFJJTExJTiMjS0lPU0tTCkFESU9TIyNBR08jVEVSTSNMQVRJTgpLRU5UI1NBWVNPI1lPWU9TI0hBTE8KRURHRU9VVCNBS0EjI0FXRUQjQk9XCiMjI0RJTkFIV0FTSElOR1RPTiMjIwpQQU0jTFVSRSMjUEFSI0xJTU9HRVMKRElBWiNQSUVSUyNCQVRJTiNXSU5FCkFETUlUI1NMT0UjSU5BIyNQSU5UQQpTRUFUQUMjI01BUlRJTkFISU5HSVMKIyMjSVJJU0gjQkFBUyNMQUQjRUNPCkVMRCNHQVRFUE9TVCNBQlJBI1JFTgpTQVJHRSNBRkxBVCNFTkVNWUNBTVAKUVVFTlRJTlRBUkFOVElOTyNQTEVBClVSU0EjT05FTkQjRUFUSU4jTEVOUwpFQVNUI0NFREVTI0dMQVpZI1NTVFM="},{"title":"01/11/16 AT THE BANK","author":"Gail Grabowski","date":"2016-01-11","grid":"UFVNUFMjU1VCUyNTVEFZClNOT09UI1dISU0jQ0FQRQpBRERMRSNBVURJI0FNRU4KVE9FSU5HVEhFTElORSMjCiMjI1RPTyMjREVOIyMjIwpNQUxFI1RTUCNTVFVGRlMKRUdPI1NUT1VUI0lORVJUClJJR0hUT05USEVNT05FWQpDTEVBUiNTVEFHRSNDQUwKWUVTTUFOI1NUWSNQRUtFCiMjIyNJT04jI1BISSMjIwojI1BFTk5BTkRURUxMRVIKQUNJRCNGSURPI0FMSVZFCkRPVEUjQUxBTiNSQUtFRApTV0FOI1RTS1MjRFJFU1M="},{"title":"01/12/16 CREATURE FEATURE","author":"Billie Truitt","date":"2016-01-12","grid":"U0FQI0FIRUFEI0FTVElSClBJRSNaRVNUWSNUV09QTQpFTVQjQU1QTEUjSEVST1MKQ0FUQUxJTkFJU0xBTkQjClNUWUxFIyNTTkVFUiMjIwojIyNMQVRFI0dFVCNXV0kKQU1TTyNBR08jI0lTQUFDCkJBVFRJTkdQUkFDVElDRQpDTEFTUCMjVE9XI1VGT1MKU0xZI1JPQiNERUVEIyMjCiMjI1NPSUxTIyNSSURHRQojUkFUVExJTkdBUk9VTkQKTUVMRUUjTUFSQ08jR0FHClJBVEVTI1BSSUVSI1VTRQpTUE9SVCNTRU5EUyNQSEQ="},{"title":"01/13/16 BEFORE THE IPOD","author":"Fred Piscop","date":"2016-01-13","grid":"U0NBTSNDT0RBI1NUVUJTCk9ISU8jQVBFUyNURVBFRQpEVURTI01FTU8jRUFURU4KI01BVFRFUk9GUkVDT1JECiMjIyNFUkEjI0VEVSMjIwpBTktBUkEjQ0FSI1BPTFMKTk9PTkUjR0FMQVMjUkFUClRSQU5TUEFSRU5UVEFQRQpFU0wjQUxJQVMjUklOU0UKU0VBVCNBTlQjR0lOR0VSCiMjI1dPTiMjRE9DIyMjIwpWQVJJQUJMRVJBVEVDRCMKRVZFTlQjQUJJVCNSRUFMClRJTkdFI1NBTkUjSURMRQpPRERFUiNUWUtFI05FRUQ="},{"title":"01/14/16 SQUARE ROOTS","author":"Mark McClain","date":"2016-01-14","grid":"R0FEIyNTS0lEUyNBQkJBCkVQRUUjQU5TRUwjQ0xJUApMUEdBI1dFQkVSI1RBQ1QKQ0FSUk9UQU5EU1RJQ0sjCkFMRSNOT0QjIyNISUtFRApQTEVBVCNTT0FQWSNUUkkKIyMjTEFZI0JSUiNGRUVUCiNNUlNQT1RBVE9IRUFEIwpDSUFPI0RBTSNNT00jIyMKT1JEI0xBTkFJI1BBVUxBCkVST0RFIyMjU1RVI01JRAojT05JT05TS0lOUEFQRVIKQVJHTyNBTElUTyNGSUxBClJFQUQjUElMT1QjVFJPVApNRFNFI1NNT0tFIyNFV0U="},{"title":"01/15/16 WE'VE GOT THIS","author":"S.N.","date":"2016-01-15","grid":"RVNDI1VQQ0FTVCNDT0FUCkNBTCNQTEFOQVIjT01OSQpBTkEjTk9SVEhJU0xBTkQKU1RVQiMjUEVBQ0hUUkVFCkhBU0FHTyMjUk9PIyMjIwojTUVUSElTV0FURVJMT08KSkFXI0lMSUUjI1NQRUVECk9SSUcjU1BJRUwjR09ORQpISVRJVCMjR0xJQiNET1MKTkFaQVJFVEhJU1JBRUwjCiMjIyNVTk8jI1BBVkxPVgpTVE9STURPT1IjI0dJR0kKVEVMRVBBVEhJU1QjQklPCk9ORVMjTE9OR0VEI0VTTApQU1NUI0xPT1NFUyNTVEE="},{"title":"01/16/16 SATURDAY STUMPER","author":"Lester Ruff","date":"2016-01-16","grid":"VElSQU1JU1UjU1BPVEFECkFNRVJJQ0FTI0NBUE9URQpJTVBBTkVMUyNBU1RVVEUKTEVBRkVEI0NFTlQjUkFQCkZSSUFSI0pPTFQjVElDUwpJU05UI0xVTksjU1VTSEkKTkVUI0RFTlMjQ09SVEVYCiMjI1FVSUVURE9XTiMjIwpTRUdVRVMjSVJBUyNUS08KVFJBSUwjU1RBVCNBUkVBCkpBWlojUk9VVCNDTElOSwpVU0UjRFVTVCNDT0dFTlQKRFVCTElOI0lNQUxPU0VSCkVST0lDQSNPTlBBUk9MRQpTRVNURVQjTk9OU0VOU0U="},{"title":"01/17/16 BE SILENT: Sometimes you shouldn't listen","author":"Gail Grabowski","date":"2016-01-17","grid":"V0FTUCNTQ0FSUyNLQVRPI1BPVVRTCkVDQ08jTk9MSUUjSURFQSNVTlBFTgpUSFVNQkFSSURFI0RBU0gjUkVUUk8KI0VNUElSRVMjS0lOR1RVVFNUT01CCiMjI09OTEFURSNTRUVTI0hVRSMjIwpERUJVR1MjI0xJTFkjI1BSQU5DRUQKRUdPUyMjU1BJQ0UjT1JMT04jSE1PCkFSTSNXSVRIT1VUQURPVUJUI0FDUwpSRUIjQURJRVQjI1BEQVMjI0ZSRUUKU1RTI1NMRVcjV0FURVIjU1dBTEVTCiMjSEFURVMjU0FCRVIjU1BJTkUjIwpDUkVQRVMjRkxJRVIjR0FJTiNTSEUKSEVMUCMjTEFPUyMjVFJJRUQjTE9MCkFDVCNDTElNQlRIRVdBTExTI0FXTApGT0UjUkFLRVMjRVhBTVMjI01NSUkKRU5ST1VURSMjQU5PTiMjUFJPQkVTCiMjI1BFVCNEQVJOI0dMQVJFRCMjIwpTVUJUTEVTSUdOQUwjVU5JU0laRSMKQVJPU0UjSEFSRSNQT0NLRVRDT01CCkdJU1RTI09SRVMjTkFJTFMjVU5UTwpBU0NPVCNEWUVTI1NLRUVUI01FU0E="},{"title":"01/18/16 GEE I CAN'T HEAR U","author":"Gail Grabowski","date":"2016-01-18","grid":"I1BBQyNTUE9UUyNBR0VECk1FU0gjUFVSRUUjUlVMRQpBUklBI0FNQkxFI1JJU0UKR1VBUkRSQUlMI0NJVEVECiMjI0dVRVNUI0xBVkEjIwpMRUdFTkQjI1RBUEVSRUQKQU1VU0UjU1RBVEUjUEFSCk1PRSMjU1BBQ0UjI0lSQQpQVFMjUExBTlQjQ0FDVEkKU0VTU0lPTiMjV0FMS09OCiMjQVVOVCNMTEFNQSMjIwpTSUdOUyNHVUlERUJPT0sKUERBUyNQRU5ORSNBTk5FCkFMSUUjRUFHRVIjTVlNWQpSRU5UI1dSRU5TI0FYRSM="},{"title":"01/19/16 WINTRY WORDS","author":"Sally R. Stein","date":"2016-01-19","grid":"QVNQQ0EjSk9TSCNXSEVOCkNIQU9TI1VQVE8jSE9MRQpIQUxMUyNSRUFSI09VU1QKT0tFRCMjSUNZU1RBUkVTCk9ZU1RFUlMjRUVLIyMjIwojIyNVTklURUQjT0ZGRVIKV0FSUkVOI01VRCNSQVJFCkFNT0sjU05JUEUjT0RJRQpUT01FI0VFTCNUQVNTRUwKVFJBWVMjQ0VNRU5UIyMjCiMjIyNBU0sjT1JERVJFRApTTk9XWU9XTFMjI0RPTkUKQ09ORSNGRUVUI0VUVURFCkFOVEUjVEFJTCNDSVRFRApOT09LI0dSQVkjT1BFRFM="},{"title":"01/20/16 DIRECTIONALLY CORRECT","author":"Carolyn Stewart","date":"2016-01-20","grid":"U09SVCNBUFRFUiNTVEFCCk9SRU8jVEVBUlkjTFVMVQpMRUZUVEhFUFJFTUlTRVMKIyMjQVJFTkEjQkFHUyMjCkdPQkxJTlMjT1JDSEFSRApVTlRJRVMjSUtFI1RVQkEKU1RVTlMjI0JSQU4jRElNCiMjI0dPQUhFQURPRiMjIwpPQUYjTkNBQSMjVElUQU4KVEFPUyNSSU0jUkVERVlFCkNBUlBPT0wjQ09WRVRFRAojI1NJTlMjQ1JVRUwjIyMKWU9VR09UVEhBVFJJR0hUCkVVUk8jSVJBVEUjVEVBUwpTVEVUI0NBUEVSI1lFTFA="},{"title":"01/21/16 GEOMETRICAL","author":"Bill Weber","date":"2016-01-21","grid":"S09BTEEjSUNBTUUjRFVDCkVEU0VMI05PTEFOI1JSUgpORUVETEVQT0lOVCNFR08KIyMjI0dBVUwjI0VTU0VOCk5FV1BPUlQjREVCVVNTWQpBVEhFTlMjQVJBQklDIyMKT0hBUkUjR0xBUkUjSUJNCk1BVFQjU0FUSU4jRlJBVQpJTlMjU0VWRU4jTEFDS1MKIyNNQUhMRVIjV0FMTEVUCkRSWUNFTEwjU0VMTEVSUwpFVUxFUiMjSkVESSMjIyMKRVBJI01BR0lDU1FVQVJFCkRFTiNBR0VOVCNVTkRVRQpTRUUjTkVPTlMjRUlERVI="},{"title":"01/22/16 DISAPPEARING ACT","author":"Billie Truitt","date":"2016-01-22","grid":"SEVBTCNEVVJJQU4jT0JTCkFYTEUjSUZPTkxZI0JPTwpTUFJBWUJPVFRMRSNTQVQKI0xPVkVTI09SRSNTRVRICldPS0VOI1BSQVlGT1JNRQpBUkUjU0lSIyNTTElWRVIKU0VSRiNWSVNBI0lSRU5FCiMjI1JBWU9GSE9QRSMjIwpTVEVBTSNST09GI0VQUFMKTk9OQ09NIyNSRksjUk9FCkFZQ0FSQU1CQSNFVk9LRQpQT0xTI05BWSNBTklNRSMKUFRBI1lDSFJPTU9TT01FCkxBUyNUSEVOQ0UjRVRPTgpFU1AjRFVSRVNTI1NFTkQ="},{"title":"01/23/16 SATURDAY STUMPER","author":"Brad Wilber","date":"2016-01-23","grid":"U1BJQ0VSQUNLI0ZPUlRFCkhBU0FTQVlJTiNBUEVSWQpPVkVSVEhFUkUjVkVOVUUKV0VFREVSI0NFTUVOVEVECiMjI0FGQVIjU0VMRVMjIwpUQUpNQUhBTCNUQVJUQU4KT0RFT04jRE9NRVMjUlRFCldPUk0jQ0lHQVIjRElTSApOUFIjQ0hPSVIjUElLRVIKU1RZTUlFI0NMT1VTRUFVCiMjQkFOQUwjT1VTVCMjIwpDSFVUWlBBSCNUSElTQkUKUkFJVEEjTUVHQUZMT1JBCkFMTEVOI1BST0dPTEZFUgpNRVRSTyNTQUJFUlNBV1M="},{"title":"01/24/16 BE SILENT: Completely different from last week's puzzle","author":"Fred Piscop","date":"2016-01-24","grid":"QkVFUyNTUFJJRyNLQU5HQSNHQVJCCkFDVEkjQUxBTU8jSUNFVVAjT0RJRQpTSEFNRVRPWU9VI1NIQVZFREZBQ0UKU09MSUNJVFMjTEFTRVIjI0VMTUVSCiMjIyNPUlMjTkFSQ1MjSURFQSMjIwpDT1NJTkUjI0FTSUEjU01BUlRTRVQKQUNIT08jIyNTSEFNU1BBREUjSEVXCk5FT04jSUtFQSMjI0xBR1MjSEVSRQpUQUMjI1NIQUxFUFJJQ0UjSk9MSUUKSU5LUyNMQVQjUkVBRFkjTUlGRkVECiMjRE9aRU4jQ1JBVkUjR0FGRkUjIwpHQVJSRVQjQ0hPU0UjVE9PI0FTSVMKQUdBVEUjU0hPUkVMT1NFUiMjVFJZCkxBV1MjU1BBUiMjI1BFUkkjQkVBTgpMSUUjU0hVTkRBTkNFIyMjRFVFVE8KT05SRVBPUlQjUkVFRCMjRElNTUVECiMjI0pBV1MjQ09BTFMjQlVTIyMjIwpPQ0hFUiMjVEFVUEUjV0VMQ09NRVMKU0hBQ0tEUkVTUyNTSEVMTFNIT1JUCkxJTFQjQUJBVEUjVEFCTEUjTU9UTwpPUFRTI01JS0VTI0FNQkVSI1NURVc="},{"title":"01/25/16 DISCOUNT PRICING","author":"Gail  Grabowski","date":"2016-01-25","grid":"I0xBUEQjRUxFTSNBUEVEClBVTFNFI01FVEUjUk9WRQpGTE9TUyNBTlRFI1JVSU4KQ1VUVElOR09VVEVBUkxZCiMjIyNHQVMjI1dBWSMjIwpPQkxPTkcjTEFJUiNDSUEKR1JBREUjU09SVCNNT0xECkxPV0VSSU5HVEhFQk9PTQpFT05TI0RVT1MjTEFQU0UKUkRTI01PQlMjTEVTU0VOCiMjI0xPTCMjU0VDIyMjIwpSRURVQ0lOR1RPVEVBUlMKQVRPTSNaT05FI1JVUkFMClRBUlAjRURBTSNJUk9OWQpFTE1TI1NFV1MjQ09PSyM="},{"title":"01/26/16 UK-9 CORPS","author":"Sally R. Stein","date":"2016-01-26","grid":"I0NBUCNCRUFNI1NQQVMjCkNJVEUjQUxTTyNZRU5UQQpTQ09UVElTSFRFUlJJRVIKUEFEI09MRSNUUkkjTUFDCkFERFRPIyNET1JBI0FNQQpOQVNBI1NBTyMjI1NUVU4KIyMjVU5JQ0VGI0VMT1BFCiMjSVJJU0hTRVRURVIjIwpSQU5VUCNFTlRJQ0UjIyMKRU5EUyMjI09BUyNWSUVECkVUQSNQQVJUIyNSRUNVUgpTRU4jQUJFI0FHTyNFUkEKRU5HTElTSFNIRUVQRE9HClNORUVSI0FUT00jUklQUwojQVJUUyNCVVlTI09ORSM="},{"title":"01/27/16 WINDOW DRESSING","author":"Matthew Sewell","date":"2016-01-27","grid":"SkFDSyNTT0NBTCNJUEFEClVDTEEjUEFVTE8jVE9GVQpTSFVUVEVSQlVHI1NDQVQKVEVFSEVFI0VNSVNTQVJZCiMjI0xBRFMjI05PQUgjIwpSRVBFTCNUQU0jQURPUFQKQUxPRSNUT1JFVVAjTkVBCkJMSU5EU1BPVFNZU1RFTQpCRU4jUkFJU0lOI0NBTE0KSU5UUk8jVEVFI01FU1NZCiMjVEFJTCMjUlVJTiMjIwpTTEFQREFTSCNTTkFQVE8KV0lLSSNTSEFERVRSRUVTCkFQRUQjU0FWT1IjSVRBTApUT05TI09NRU5TI09TU08="},{"title":"01/28/16 ORANGE BOWL","author":"Fred Piscop","date":"2016-01-28","grid":"VEhJUkQjT0NURVQjTkFNCllBTElFI05PUkdFI09MRQpQVUxQRklDVElPTiNCVUcKT05FUyNTQVkjI1BBUk1BCiNUUk9XRUwjS09BTEEjIwojIyNQRUVMQU5EU1RJQ0sKTU9ORVQjI01FRVQjTkVBCklST04jUFJJRVMjVEVMTApTRVQjRVJBUyMjVEVSU0UKVE9VUk5FWVNFRURTIyMjCiMjUEVSUFMjVklTVEFTIwpHSVRNTyMjU0lSI1RSSVAKSURPI0JFRVRMRUpVSUNFCkxFSSNFWFBFTCNFQlNFTgpUQVQjU09BUFkjVEVFTVM="},{"title":"01/29/16 HOT STUFF","author":"Andy Ellis","date":"2016-01-29","grid":"U0NFTkUjRU9OI0FSQk9SClBBQ0VSI1NBWSNQQUVTRQpJVEhJTktUSEUjSUdMT08KUkFJTCNOQVVUI0FUTCMjCk9MRCNMQVQjI0JSQUhNQQojT05MWVJFQUxMWUdPT0QKI0dBVUwjI1pPTyMjUE9FCiMjI1ZFR0VUQUJMRSMjIwpQQVMjI09MRSMjRU1JUiMKSVNUQUJBU0NPU0FVQ0UjCkNIQVBFTCMjRkVII0VUQwojI1BPTCNTQU5FI0FGQVIKQ0VMTEkjUEpPUk9VUktFCkFERUxFI09BVCNLTkVFRApNU0RPUyNUUkUjU1RFTk8="},{"title":"01/30/16 SATURDAY STUMPER","author":"Lars G. Doubleday","date":"2016-01-30","grid":"U05BUFBFQVMjQ0RDQVNFCkxJRkVIQUNLI0FSRVRIQQpBTEZSRVNDTyNORVNUT1IKTUxJI0FURUFNI1NURVJOCiNBWEVTI1BMRUFTQU5UIwojIyNNQUxUI1NLWSNUSFkKREFTQU5JI0FISSNDSUFPCkpVUElURVJTWU1QSE9OWQpFVEFMI0xPUCNCUkFORE8KRE9DI0lPVSNDT09TIyMjCiNNRU5TV0VBUiNWRUVQIwpDQVNJTyNTTElERSNEQUQKQVRIT01FI0lNT05EVVRZCkdPT0JFUiNHRU9DQUNIRQpFTlRFUlMjTkFNRUxFU1M="},{"title":"01/31/16 REENACTMENTS: Real-people Oscar roles","author":"S.N.","date":"2016-01-31","grid":"U0lOS1MjUkFUQSNBVFRJQyNBV0xTClVTQUdFI0FCT1cjTUVBUkEjVUhPSApCRU5CUkFETEVFI0JFTEFMVUdPU0kKU0VBU1BSQVkjU1RJTksjQUNVTUVOCiMjI1BFRVIjWk9PRVkjSE1PUyMjIwpTVEVJTlMjTEVNT04jUEFJTlRQT1QKVE9MRVQjTE9SRVRUQUxZTk4jQUxFCkFYSVMjSUFHTyMjI0NFREUjU1VEUwpCSVojRU1NQUdPTERNQU4jU1BMSVQKU05BUEJFQU4jSEFSRVMjUk9VR0VTCiMjQkFCQVIjVEFQQVMjTEFVUkEjIwpHU0VWRU4jSEFSRU0jQkFTU1RVQkEKT1BURUQjSkFLRUxBTU9UVEEjR0lOCk9PSFMjV0lERSMjI0FSRUEjQlVOVApEQ0kjSEVMRU5LRUxMRVIjSVZJRVMKU0tJUEFOVFMjTkFJTFMjUE9JTlRZCiMjI0FSVFMjRkVSTlMjUkFOVCMjIwpEUkVTU1kjQUlTTEUjTk9SRUFTT04KUkFZQ0hBUkxFUyNUSE9NQVNNT1JFCk9LUkEjUk9MRkUjV0lTUCNDSVJDQQpQRUVMI0RFSVNUI09ERVMjT05UQVA="},{"title":"02/01/16 BELLY WORKOUT","author":"Gail Grabowski","date":"2016-02-01","grid":"Q0FMTSNSQURBUiNQQURTCk9SRU8jQUxJQ0UjQUJFTApMQUlOI1JPVkVEI1JPTEUKQUJTVEFJTkVEI01PVklFCiMjI0FOVEVTI1BBTEVTVApTSEFOVFkjI0NFTEVCIyMKVFVCQVMjU0FVVEUjT0lMCkVTUyMjTEFDS1MjI0FLQQpXSE8jUE9TU0UjQ1VSRVMKIyNMQVVHSCMjUEFOREFTClNLVUxMUyNBUEFSVCMjIwpOT1RJUCNBQlVOREFOQ0UKT1JFUyNDSEFSVCNNT1JFCkJFTFQjREVURVIjRVZJTApTQVlTI0VNRVJZI0RBQlM="},{"title":"02/02/16 MOIST MAMMALS","author":"Billie Truitt","date":"2016-02-02","grid":"U0FXRUQjQVJNI0pFTExZCkNSQVZFI0RFRSNBVk9JRApPSUxFRCNBQlMjTElDS1MKV0FMUlVTTVVTVEFDSEUjCiMjIyNDQVNUI09QVCMjIwpQQVJJVFkjI1dFRSNBQ1QKQUNFRCNOQVBFI05JVFJPCldIQUxFT0ZBUFJPQkxFTQpOT0RFUyNBTlRJI01BVEUKU09ZI0NBUiMjUEFTU0VTCiMjI0xBRyNCT1VUIyMjIwojU0VBTE9GQVBQUk9WQUwKQkFMU0EjQUxFI0VWT0tFCkFTU0VUI01FTiNTRVRJTgpUSEVSRSNFU1MjVFJFTkQ="},{"title":"02/03/16 A LITTLE SOMETHING","author":"Fred Piscop","date":"2016-02-03","grid":"UkFQUyMjUEJBIyNTQUdBCk9SQUwjQ09MQSNBRVNPUApCRUxBQk9SVEhFUE9JTlQKT05FVElNRSNTUE9VU0VTClRBUiNORVNTI0lMTCMjIwojIyNBU1MjVEFDTyNST1cKREVBTCNBQ0VTI0dVSURFCk9VVE9GVEhFV0FZU1BPVApXUklURSNPUEVOI0VBUlMKTk9UI1NIT0UjRElEIyMjCiMjI0FUTyNEUkFUI1JJTQpIT1RMSU5FI0VOQ0xBVkUKQVJSSVZFRE9OVEhFRE9UCkxFQVZFI0dBVEUjRklSRQpMT1BFIyNZUlMjI1RPWVM="},{"title":"02/04/16 BEAR LEFT","author":"Carolyn Stewart","date":"2016-02-04","grid":"RkFNRSNDQU5JVCNTQ1VECkxFQU4jQU1VU0UjVFVORQpBUk1ZI0NBUkxBI0FQU0UKTUFNQUNBU1NFTExJT1QjCkVUQSNIT1NFIyNJTkZFUgpERUxISSMjI0VNVCNUQU0KIyMjSU5UUlVERSNHRURTCiNQQVBBSEVNSU5HV0FZIwpTVURTI1JBUFRVUkUjIyMKUFJPI0hVTSMjI0FOR1NUCkFFUklFIyNTVEVQI0FQRQojQkFCWUZBQ0VORUxTT04KT1JCUyNVQk9BVCNBQlVUCkRFTEUjU0VOU0UjTUFTSApFREVOI1NURUVSI0FHRVM="},{"title":"02/05/16 SIGHT UNSEEN","author":"Matthew Sewell","date":"2016-02-05","grid":"QURCSVojR0VBUiNQVU1QClJBSVRBI01BTkkjT0tJRQpJTUFHSU5BUllGUklFTkQKREVTSVJFI1BPTEFOU0tJCiMjI1JFRUYjTkVTVCMjIwpXQUxMIyNJQ0UjI1NJUkUKQUxBI0JBSkEjQkFUU0FUCkZPVU5UQUlOT0ZZT1VUSApUSFJPV1MjV0lGRSNaT08KU0FBQiMjS0VOIyNQVU5TCiMjI0xFVkkjS09CRSMjIwpTVVBFUkVHTyNTT05PUkEKVEhFR1JFQVRQVU1QS0lOCkFVUkEjUExJRSNCQVJPTgpUSFVTI1NJU0kjU0xBVEU="},{"title":"02/06/16 SATURDAY STUMPER","author":"Anna Stiga","date":"2016-02-06","grid":"I0tFQkFCI0lUU0FUUkFQClBBTkFNQSNTRUxGUlVMRQpBVE9ORUQjVEVBVEFCTEUKVEhSRVNII0FOVCNDT1VQCkVMTVMjVVJOIyNFVFVERQpMRUkjU01JREdFTiNURUQKTEVUI0NPTkNFUlQjIyMjCkFOWSNBUkdPTk5FI0FQVAojIyMjTEVFUklFUiNQUk8KQklPI0FERFJFU1MjUEVQCkFCSE9SIyNFU1QjUEVDUwpSRURPI0JJQyNUT0FURUUKQ1JBWklFU1QjVVBTSURFCkFJUkVEQUxFI0JBU1RFRApSQU5TT01FRCNCTEVFRCM="},{"title":"02/07/16 HEARING THINGS: Requiring sound thinking","author":"Gail Grabowski","date":"2016-02-07","grid":"QU1BU1MjQU5OQSNGQVJFI1NUUlVUClJPR1VFI1RFQU0jQUdFUyNUUklQRQpDUlVOQ0hUSU1FI1NOQVBEUkFHT04KU05BS0VPSUwjUkFURUQjUkVDQU5UCiMjIyNERUMjUklURVMjRklTVCMjIwpDQVNURVJTI0VDT04jVEFOUyNXUE0KSE9MRFMjI1NMQVBTVElDSyNPSEhJCkVSQVMjQUNBSSMjI0NFRSNUUklPUwpBVE0jI1BPUENPTkNFUlQjSEFTVEUKVEFEQSNMUFMjREVBTFMjRkFDVE9SCiMjQU5HVVMjQ0lWSUwjRlJJTEwjIwpDQU5ORVMjQlJVSU4jSVJFI0VFTFMKT0NDVVIjWk9PTUxFTlNFUyMjU0VBCldISUxFI0VHTyMjI09BVEgjQVRUTgpFT05TI0dSVU5UV09SSyMjTklPQkUKRE9HI1RBT1MjUkFQVCNTQ0FNUEVSCiMjI1JFVlMjRUFSVEgjQUFTIyMjIwpJQ0VBWEUjVFJJTkkjSlVTVE1JU1MKQlVaWkFMRFJJTiNDUkFDS0FCT09LCkVSUk9OI1JBQ0UjQUNNRSNTQU5EWQpURUFSUyNTUEFSI0xBU1MjRVNTQVk="},{"title":"02/08/16 UNDER WRAPS","author":"Gail Grabowski","date":"2016-02-08","grid":"Qk9TQyNURVJNI1NDUlVCCkFSSUEjQUxPRSNBUkVTTwpIRVJSI1RBTVMjWU9ERUwKI1NFQ1JFVFBBU1NXT1JECiMjI0hFUkUjI0FNUyMjIwpERUNBRlMjUEFWRSNPQVQKRVJBU0UjVElNRSNBTlRJCkNPVkVSVE9QRVJBVElPTgpPREVTI1dSRU4jU1RPTkUKWUVTI0ZFRVMjU0hJTkVTCiMjI09MRSMjQkVFVCMjIwpISURERU5UUkVBU1VSRSMKQVNJREUjT0lMUyNEQVJFClRFTkVUI09TTE8jRVZJTApTRUVSUyNURUVOI1NFRU0="},{"title":"02/09/16 HOT AND COLD","author":"Billie Truitt","date":"2016-02-09","grid":"Q0hJUCMjQ0FTVCNNQURECkhBTk9JI09TSEEjQVdBWQpFTEZJTiNVSE9II05PVEUKRkxVI1ZFUllQT1BVTEFSCiMjUkVBRFMjI0VQQSMjIwojV0lORElFU1QjU0xVUlMKU0hBREVTI1BBWSNTTklQClBBVCNST0xFWEVTI0ZEQQpBTEVDI05FQSNTQ0FSRVMKUkVET1MjR1JBWUhBSVIjCiMjI0NJQSMjQk9JU0UjIwpVTkNPTlNDSU9VUyNOQkEKU09MTyNTQU5EI01FREFMClNQQU4jRVJJRSNTQUxTQQpSRVBTI1NFVFMjI1JZRVM="},{"title":"02/10/16 OFF THE TOP","author":"Charles Slack","date":"2016-02-10","grid":"UFNBTE0jQUxEQSNTV0lNClJFVlVFI1BPT0wjQ0hBUApPTUVHQSNMT0lURVJJTkcKRklSU1RSVU5ORVJVUCMjCiMjIyMjVVNTI1JJQiMjIwpCRUNBTUUjI1RFTiNEU1QKQUxPSEEjU1RBRyNDSUFPClNFQ09ORElOQ09NTUFORApJQ0tZI0lOVE8jQk9ORUQKU1RZI01TRyMjQ0FOQVJZCiMjI1BBVCNJT1UjIyMjIwojI1RISVJEU1RSSU5HRVIKU1RFQURJRVNUI01PT1JFCkVSQVMjQ0xVRSNQQVJJUwpXSVJFI1RJRVIjU0hFRVQ="},{"title":"02/11/16 THEY'VE TAKEN 4 DOWN","author":"Carolyn Stewart","date":"2016-02-11","grid":"Q0FQT04jU1BJVCNGTEFOCkFSUkFZI01BTk8jQU9ORQpCT0FUUyNPUkVPI1VOVE8KQU1ZSEVDS0VSTElORyMjCkxBU1MjU0VOVCNMQVNTTwojIyMjRElTVElMTCNISU0KQ0VTQVIjI1NBVCNCT05BClJBQ0hFTCMjI0RSQVRDSApFVEFTI0FQRSMjQVRTRUEKRUVSI0ZPUk1BTFMjIyMjCktORUFEI0FQU0UjUEFDVAojI0NIQVJMRVNEQVJOQVkKQUZSTyNFSVJFI0RJR1VQCldPT0wjQU5PTiNBTVVTRQpMRVdEI1BFUlQjTU9TRVM="},{"title":"02/12/16 YOU FIRST","author":"S.N.","date":"2016-02-12","grid":"QlJJRyNKQU1VUCNQU1NUCkxJTU8jRkxPU1MjRVRURQpVQ0JFUktFTEVZI0NPRU4KUk9VU0UjI0VTQyNBUFBUClRIRUJJR1MjI0hVTkFOIwojIyNVTk1FTUJFUlNISVAKRU9OUyNDUkVFRFMjRUVFCkNOT1RFI0FEUyNBUEFDRQpSQU4jRVNQSUVEI0VERU4KVVZQUk9URUNUSU9OIyMjCiNFUklDQSMjU0VWRVJBTApQUk9EI1RBUiMjRUxBVEUKSEFWRSNVTEFQUFJPVkVECklHRVIjVEVQRUUjUEVBVApMRU5TI0VYVFJBI0VMTU8="},{"title":"02/13/16 SATURDAY STUMPER","author":"Frank Longo","date":"2016-02-13","grid":"VEhFTEFURVNIT1cjQ1JUCk9VVE9GQlJFQVRII0hFSApHUkFOQ0FOQVJJQSNJQ0UKQUxMRSNMSU1FU1RPTkVTCiMjI1JPTEUjIyNJUkVORQpHSU5TVSMjQkVMRkFTVCMKQUdPI1NDSEVNRSNURU5UCk1FQVRUSEVSTU9NRVRFUgpFVENII0FSTUFOSSNFV0UKI0FDQUNJQVMjI0NFQVNFClRST1RIIyMjU1BBTiMjIwpIT1VTRVNOQUtFI0RBWkUKUlVOI0VDT0NPTlNVTUVSCkVOVCNTQU5UQVRFUkVTQQpFRFMjRU1BSUxBTEVSVFM="},{"title":"02/14/16 FOR VALENTINE'S DAY: AKA 29 Down","author":"S.N.","date":"2016-02-14","grid":"SURPTCNPUFRFRCNDQ0NMI1NQRU5UCkRJTk8jTk9CTEUjU0VNSSNUVURPUgpMT0NPTU9USVZFI0xPT0tTQUxJVkUKRU5FTVkjVFJJUExFI05FVFNQRUFLCiMjIyNTTEVEUyNPV04jV0lJUyMjIwpCT0xTVEVSUyNBVklBUklFUyNMUFMKVVRPUElBUyNUUkVTUEFTUyNQT09MClNUTklDSyNUT1JJI0xZRSNQQVJLQQpTQUdFUyNDQVJFU1NFUyNCT1BFRVAKRVdFUyNHQUlOU0FZUyNUSVRBTiMjClNBTCNCQUlMI1RMQyNUT05TI1pBUAojI1VUVVJOI0dFTEFUSU5TI0FDUkUKRUFTSUxZI0NSRUFNRVJZI0hBVU5UClRXSUxMI0ZMTyNST1NFI0NBUlJJRQpSQVZFI0dPT0RTT1JUI1dPTk9WRVIKRVlFI05PUkRJUVVFI0JBTERORVNTCiMjI1JJTksjTlVOI1BBUlRJIyMjIwpDQUxJQ09FUyNFREJFUkcjTkVQQUwKTE9PU0VXRUFWRSNMRU1PTkdST1ZFCk9OU0VUI1BSRVojRVZBREUjR09PTgpURUVOWSNTQVRFI0RFTlNFI09ITk8="},{"title":"02/15/16 FIRST THINGS FIRST","author":"Gail Grabowski","date":"2016-02-15","grid":"REFNUyMjR0FUT1IjQVJNCklORVBUI0FXQUtFI0xFTwpBVFNFQSNOT1RFRCNJTEwKTEVBRElOR0xBRFkjQklECiMjIyNMT1MjIyNFUElDUwpCRVNURUQjQ0hBU0UjIyMKQUNUT04jQUxPVCNUUk9UCkFIRUFET0ZPTkVTVElNRQpTT1BTI1dBREUjVEVQRUUKIyMjVElFUlMjV0lERU5TCkxBU1NPIyMjTU9OIyMjIwpBUkMjV0lOTklOR09WRVIKUFJPI0FSSUFTI0VST0RFClNBUCNOT1RNRSNSQVRFUwpFWUUjU05FRVIjI0xFTlQ="},{"title":"02/16/16 HOST QUARTET","author":"Billie Truitt","date":"2016-02-16","grid":"TUdNVCNTUEFDRSNNQURECkFMQUkjRUxWRVMjT1JFTwpNT1NUI0xFQU5TI1JFQVIKTUFUSENMQVNTI1BTQUxNCkFUU0VBIyNUT1NFRSMjIwojIyMjU0hFI1JFU0NBTEUKU0VFTVRPQkUjUk9PS0VECkFVVE8jVEJPTkUjRElORwpHUkFURUQjTk9OU0VOU0UKU09MT01PTiNXRUUjIyMjCiMjI1JJR09SIyNBUEFSVApFUkVDVCNNVVNDTEVDQVIKREVMSSNMT05FUiNTT0RBCkVESVQjQVJPTUEjVFJJTQpOT1NZI0RFTklNI1NOSVA="},{"title":"02/17/16 MAKE IT QUICK","author":"Fred Piscop","date":"2016-02-17","grid":"Q09NQVMjI0xTVSMjUkFUCk9SQVRFI1RPWVMjSlVETwpTRUNPTkRIQU5EI0lOT04KVE9TUEFSRSNDQUJGQVJFCiMjIyNUQU5LIyNBRlRFUgpUVUZGRVQjRU1FUlkjIyMKT1BBTFMjSEVBTCNMQVRFClJPTUEjQ0FQUkkjVU5JVgpPTkVTI0FSTVkjQUJPVkUKIyMjSElORFUjU1RFTk9TCk1FQ0NBIyNNT0FUIyMjIwpFUlJBTkRTI1BSRVNFVFMKU0VFUiNJTlNUQU5UVEVBCkFDRUQjUElFUyNEQVRFUwpTVEQjI1NQQSMjU1RVTlM="},{"title":"02/18/16 SURPRISE YOURSELF","author":"Matthew Sewell","date":"2016-02-18","grid":"I0xFR1MjRU1NQSNJREVBCkhZRFJBI01PQVQjUlVHUwpBUklFUyNJU05UI09LT0sKSElUQUhPTEVJTk9ORSMjCkFDSFQjTUlTVCNFWUlORwojIyNOQVNBI09BUiNUT08KQUlNRUQjI1JCSSNGT1JUCkRSQVdBUk9ZQUxGTFVTSApNQVJTI0VWRSMjUkFURVMKSU5LI0JZRSNGUk9HIyMjClRJVExFI1JFRUsjU0hBRAojI1dJTlRIRUxPVFRFUlkKSVJBUyNBRVJPI0hJTkdFClFVSVojUkFJTiNPQ0NVUgpTRU5UI1BSRVkjVUtFUyM="},{"title":"02/19/16 BALANCING ACT","author":"Charles Slack","date":"2016-02-19","grid":"U1RVQiMjU1VNUyNKRUVQCldPUk1TI0FCRUwjT1BBTApBRERPTiNDT1JPTExBUlkKWU9VQ0FOSEFWRUlUIyMjCiMjIyNQT0VUIyNQRUxFIwpBTExKVVNUI0FCSURJTkcKQkxPT1AjI0NMQUQjRkxVCkZPUlQjT1BSQUgjU1RBVApBWUUjU1RBWSMjU1BFQ1MKQkRBTFRPTiNXSU5GUkVZCiNTTFVSIyNGSU5JIyMjIwojIyNOT1RBTExBVE9OQ0UKSkFMQVBFTk9TI0NST09OCk9QRUMjTkVSTyNIQVRFRApCUkFZI1NXQU4jI0xFTlM="},{"title":"02/20/16 SATURDAY STUMPER","author":"Anna Stiga","date":"2016-02-20","grid":"I0xBVElOQVMjQ0xBU1AjCkZJTkFMSVNUI0hBVEVPTgpPTERCRVRTWSNJTlRBS0UKR0FPTCNTSUxLI0RJTkVTClNDUkVXI1NFQVMjQ0FSVAojIyNTRU1JI1pBRyNTSEUKQ0FTQUJBI01PTEUjVEFHCkJVVFdIT1NDT1VOVElORwpBREUjSVJJUyNUUkVORFMKVElFI1RJTiNSRUVMIyMjClRPTEQjU1VSRSNTTEVFSwpFQkJFRCNTSU1TI1RBWEkKUk9MTElOI1RPUFJBVEVECllPVUFSRSNFVEFJTEVSUwojS0VZRUQjU0VSUEVOVCM="},{"title":"02/21/16 GRAND-SLAMMERS: Emmy/Grammy/Oscar/Tony winners","author":"Matthew Sewell","date":"2016-02-21","grid":"U01BU0gjQUxBUyNORU1FQSNQUk9NClBJTlRPI1JJVEUjT0xPUkQjT0lMWQpBTERFUiNDUk9DI0dFVEVNI1NURU0KTUFSVklOSEFNTElTQ0gjSU1FQVNZClNORUVaRSMjU1VWIyNTVFJFQU0jIwojIyMjT1ZJRCNEQVRBI0hBTlNPTE8KUFJFRU4jTUlLRU5JQ0hPTFMjUklCCkxPR0UjVE9BTiMjTkVBUlMjR0VORQpBUE9MTE8jTFVCRSNEWUUjTEFOS1kKWUVTU0lSI0VUQVRTIyNBVEFMT1NTCiMjIyNBVURSRVlIRVBCVVJOIyMjIwpVTkhPUlNFIyNTRVJSQSNBQ1RJVkUKQk9FUlMjQ0FQI0xBSVIjWUVPTUFOCk9XTFMjRklYT04jI01SSVMjTkFOTwpBR0UjUk9CRVJUTE9QRVojU0VYRVMKVE9OU1VSRSNUSE9VI0xFQUsjIyMjCiMjSEFTU0xFIyNCVFcjI0ZJQVNDTwpIRUFMVEgjV0hPT1BJR09MREJFUkcKQU5ZQSNBU0lBTiNBU0FQI0RBUkVECklDRUQjTU9OVEUjQ0VOVCNFVFVERQpMRVNTI0VER0VTI0VSR1MjREVNT04="},{"title":"02/22/16 TWO PAIRS","author":"Gail Grabowski","date":"2016-02-22","grid":"QUJDUyNGTEFLRSNPRkZTCkNPQVQjQUlMRUQjQlJJRQpJTkZPI0lOTEVUI1NFTlQKREVFUFNMRUVQI1NFRURTCiMjI1RFRU5ZI0JPU1MjIwpDQVNIRUQjI1BST1NQRVIKQVRXQVIjQ0hFQVQjRUxJClBPRVQjTU9VTlQjUkVFRApFTkUjUk9QRVMjQk9DQ0UKUkVQVElMRSMjWUFDSFRTCiMjU0hPRSNTVElOSyMjIwpQQVdBVCNUSFJFRUZFRVQKT1BFTiNUUkFJTCNBQkxFClNFRUsjV0FERUQjQ0FTRQpUU0tTI09QRURTI0VZRVM="},{"title":"02/23/16 COMPLETENESS","author":"Billie Truitt","date":"2016-02-23","grid":"Qk9MVFMjQ0FGRSNQQVNUCklOQVdFI0FMRVgjQU5USQpOT0xJRSNOT1RJI0lUQUwKR1JBTkRUT1RBTCNESVJUCiMjIyNFRUUjI0VWSUNUUwpJVFNPREQjQkFTSU4jIyMKREFXTiNEUlVHI0FGVEVSCkVYSVQjWU9ZT1MjVVJHRQpTSUdIVCNTSUdII0xFR1MKIyMjRUFURU4jQUJMRVNUClNIT1dNRSMjQVBSIyMjIwpPQVRII0FCT1ZFSVRBTEwKVU5UTyNDQVZFI0NBTUVPCk5PRUwjVVNFUiNLTEVJTgpESVJFI1BFUlQjU0VOU0U="},{"title":"02/24/16 PARTY TIME","author":"Carolyn Stewart","date":"2016-02-24","grid":"UkVET1MjV0VEI0JBVE9OCkVMRUNUI0lSRSNFTFVERQpHSUZUT0ZHQUIjTE9CRVMKIyMjQUxBUyNBVExFQVNUCkdPTERFTiNTVEFZIyMjIwpPTlVTI0NBS0VPRlNPQVAKU0VOI1NZTkUjU0xJQ0VSClNJR01BI0FUQSNPUEVSQQpJREVBTFMjQ0hBUCNMQVkKUEFTU1RIRUhBVCNDT1RFCiMjIyNXQVJZI0VMQVRFRApESU9SQU1BI0xJT04jIyMKSU5HT1QjU09VTkRDQVJECk1PUlNFI0VSUiNHRU5JRQpTTkVFUiNTRUUjRUxUT04="},{"title":"02/25/16 UNCOMMON ENDINGS","author":"Fred Piscop","date":"2016-02-25","grid":"Qk9YRVMjU1RFTSNCQVNFCklOQUxMI05PVkEjQVZJRApOSUNLSU1JTkFKI0JPTkcKR09UI0NPUFkjT1JBTkdFCiNOT1BFVFMjRFJVRyMjIwojIyNSVUUjV0FJVEhFUkUKU0NSSVAjQkFSVCNBQklUCkxPT04jUEVUVFkjTkFQQQpFVkFDI1JBVFMjTE9ZQUwKREVNRVJJVFMjTElVIyMjCiMjI1RVTVMjQkFOSk9TIwpFTlJPQkUjRUFWRSNMVEQKVE9PTiNWT0RLQUFORE9KCkNMQU4jQU5ORSNSRUVWRQpIQURKI0xFQVIjVE9ORUQ="},{"title":"02/26/16 STRAIGHT F'S","author":"Mark McClain","date":"2016-02-26","grid":"R0hPU1QjUUFUQVIjRkhBCk9JTEVSI1VOSVRFI1JPQgpPRERMWSNJRExFUiNFU0UKRkVFVEZJUlNUI09OU0VUCiMjI1pPTkUjI1NVQ0hBUwpXQUZFUlMjTU9UVE9TIyMKRU1JUiMjVkFMVUUjVEtPClJJRyNQUkVURU5EI0FMUApFRFUjQVVOVFMjI0FSRUEKIyNSRUNJVEUjQU1TVEVMClNURVZFTiMjR0xVVCMjIwpBU0hFUyNGT1JFRlJPTlQKVUtFI09QSU5FI0ZJTkVSCk5FQSNGRU5DRSNFRFVDRQpBREQjRkFLRUQjREVTS1M="},{"title":"02/27/16 SATURDAY STUMPER","author":"Doug Peterson","date":"2016-02-27","grid":"SU5TT01OSUFDI1NQSVJFCk1FTEJPVVJORSNPUk5PVApPSElPU1RBVEUjRE9HTUEKRlJFRSNUSUUjVElBUkFTCkZVUiNCRVNTVFJVTUFOIwojIyNUSVJFI0FJTSNJTkEKQUJTT1JCI0FMUCNBTk9OClNMQU1EVU5LQ09OVEVTVApIVU5TI1RJQSNESU9ERVMKWUVUI1NUUCNGT05aIyMjCiNXQVNURVNUSU1FI0pBQgpTSEFLRVIjVUFFI0ZVTUUKQ0FOT0UjSU5TVEFMTEVSClVMTkFSI05JQ0VHT0lORwpERUFMUyNTQ09SRVBBRFM="},{"title":"02/28/16 HERE'S TWO YOU: Pairs that can precede a certain word","author":"Fred Piscop","date":"2016-02-28","grid":"QUNIRVMjQkxPVyNQQVNIQSNERU1JCkJSVU5UI0lPV0EjQVNQRVIjQVZPTgpCSUdDTE9TSU5HI1NIT1JUQlJFQUsKQUJFTCNOT1IjT0NURVQjRkFJTlRTCiMjI0FUT05FI05PRVMjQlVSTiMjIwpDTE9WRVIjI01FTlUjVEVMRUdSQU0KSEVMRU4jU1BBUkVQQVJUIyMjVUxFCkFERFMjU0tPTCMjI0RFUyNDQU5JVApOT1MjU01BTExQUklNRSMjSEVOQ0UKVE5UI0NPVCMjUkFSRSMjV0FSSUVSCiMjQVdBS0UjQ09WRU4jVEVOT04jIwpTQU5FTFkjI09XRU4jI1JJRyNHUFMKQURETEUjI0FMTExFSVNVUkUjTEFXCkJPQVRTI0VCQiMjI05FRUQjUE9SRQpFUlIjIyNCVVlESU5ORVIjU0VOU0UKUkVEQUxFUlQjSUNFUyMjQlVER0VUCiMjI0RJTk8jQVZPVyNTTEFWRSMjIwpFU1BJRUQjRURFTlMjVE9XI1NQQVQKR09PRFNVTU1FUiNET1VCTEVUSU1FCkdBTEEjU0lNUFMjQU5ORSNTQVRFUwpPUkVTI0VMQVRFI1lBS1MjUExBTlQ="},{"title":"02/29/16 IT'S LEAP DAY","author":"Gail Grabowski","date":"2016-02-29","grid":"R0FURVMjUE9TSCNTT0xPCkFXQUlUI0FOVEUjQUNJRApQRU5ORSNURUFSI0JFTkQKIyMjU1BSSU5HQlJFQUtTCiNIQVQjUk9ERSNVUk5TIwpQQUNFUlMjI1BJVFMjIyMKVU5USUUjRUFSTiMjUEFTCkJPVU5EQllDT05UUkFDVApTSVAjI0JFRVAjS0FSTUEKIyMjRElTQyMjTE9DS0VSCiNQSUVSI0hPU0UjRVNTIwpKVU1QU1RBUlRJTkcjIyMKQVJFQSNFUklFI0NPU1RTCkJFQVIjQVRPTSNBRUlPVQpTRU5UI1NTTlMjQVJTT04="},{"title":"03/01/16 UH-OH","author":"Sally R. Stein","date":"2016-03-01","grid":"UlNWUCNCT0dTI1NUUkFQCk9ISU8jRVJJRSNMT09LUwpXT1JFI0ZBUkUjQVVESVMKRFJVTVJPTExTI1NDRU5UCllFU1NJUiMjI1NISCMjIwojIyMjTkVBUlRPI1RBTEUKQlJJU0sjQ09BTCNPUEFMCkxPT04jRFVNQk8jTkVDSwpUVVRVI0lUQUwjSEVYRVMKU1RBQiNSRU5FR0UjIyMjCiMjI05PVCMjI0FSQ0hFUgpPTlRPUCNUSFVNQkhPTEUKTk9PU0UjUklQRSNJTk9OCkVBVEVOI09ET1IjREVQVApTSEVEUyNURU5TI0VZRVM="},{"title":"03/02/16 ENOUGH IS ENOUGH","author":"Billie Truitt","date":"2016-03-02","grid":"Q1BBUyNBRkxBVCNIQVNIClJJQ0gjU09VVEgjT0dMRQpVTlRPI0hFU0hFI1JPQVIKU1RPUFBFU1RFUklOR01FClRPUlNPIyMjTkFQUyMjIwojIyMjRElPUkFNQSNXT0sKQ0hBRCNWSUEjI1NQQVJFCk5PQk9EWUxJS0VTQU5BRwpCVUxHRSMjTkZMI0NFTFMKQ1JZI0JJQ1lDTEUjIyMjCiMjI09VQ0gjIyNHTEFTUwpET05UR09PTkFCT1VUSVQKVUhPSCNOSU9CRSNOT0xPCk1JTkUjSUNFRVMjR0xPVwpQT09SI0NFTExPI0VMU0U="},{"title":"03/03/16 HUMBLE ABODES","author":"Fred Piscop","date":"2016-03-03","grid":"WklOQyNNRVRTI0FDVE9SCkVEQU0jSURFQSNDUkVETwpBTFNPI05JQ0sjQ0FTRVkKTEVBTlRPVEhFTEVGVCMjCiMjIyNIUlMjI09QVCMjIwpBTFRBUlMjU0hPVCNTRUMKQ0FJTkUjSUNFUyNVUERPCkhVVFRXT1RIUkVFRk9VUgpFUkFTI05FV1MjVk9JQ0UKREFOI0ZFTUEjQUlTTEVTCiMjI1RFTiMjT1RDIyMjIwojI1NIRURMSUdIVFVQT04KR0FURUQjT1NMTyNCQU5FCkFXQVJFI1NURU0jRVNUQQpQRVRFUiNUT1JFI1JTVlA="},{"title":"03/04/16 MADE TO ORDER","author":"Andy Ellis","date":"2016-03-04","grid":"U0FSR0UjQUJBVEUjSElUCkNSRUFLI0JBTEVTI0FDRQpSQVdSRUNSVUlUUyNSRUMKQUJBQiNSQU1CTyNNQVNIClBJUk9HSSMjSU5GQU5UIwpTQUQjQU1JRSMjQVJHT1QKIyMjI01FUlYjSU5TVVJFCkhBTEZCQUtFRFNDSEVNRQpPQkVST04jTkVISSMjIyMKVFJBSUwjI1NBTUUjTUlSCiNPREVTU0EjI0FETUlSRQpBR1RTI0NMQVJFI0FNT1MKVEFJI0pPQldFTExET05FCkFUTSNLTkVFRCNBUlNPTgpERUUjTEVFRFMjTUVBTlQ="},{"title":"03/05/16 SATURDAY STUMPER","author":"Brad Wilber","date":"2016-03-05","grid":"TUFOSUZFU1QjSEFWRU5TCkVNSU5FTkNFI09DRUxPVApUQUtFVEhBVCNURUxMTUUKRU5FI0NBUkVTUyNWRUVQCkRBU0NITEUjTEFDRSMjIwojIyNSRU8jRkFVU1RJQU4KREVLRUQjQ09OQ0lFUkdFCkFDSUQjU1VSR0UjTElFUwpTSFJJTktSQVkjVFZTRVQKSE9TVENJVFkjUEhJIyMjCiMjI0xPVFMjQ1JJU1BFUgpERU1JI1RZQ09PTiNFUkEKQUxVTU5JI0FTUElSQU5UClJFTElFUyNNTUVDVVJJRQpLVkVUQ0gjU09SRUVZRVM="},{"title":"03/06/16 STATE YOUR NAME: With capital letters","author":"S.N.","date":"2016-03-06","grid":"QkFSQlMjWkVFUyNIT1VSI1NBSkFLCkVNQUlMI0FDTUUjRUxTRSNBQkFTRQpMSU5DT0xOU1RFRkZFTlMjTFVDSUUKSU5DI1dBSVQjVEFUUyNBTEFTS0FOClpPT00jUEVBQk9EWSNCTEFERVMjIwpFUlJFRCNTVFkjIyNEUkVTU0RPV04KIyMjQVVTVElOUE9XRVJTIyMjTlJBCkJMT1RDSCNDQVJCT04jI0lOQVBFVApSRUxBVEVTI1RPT0sjTU9OT1RPTkUKT05ZWCMjTUFVVkUjTE9HUk9MTCMjClNBTSNQSUVSUkUjQ0FSRElOI0xPVAojI1BSSVZBVEUjQUxCRUUjI0NPUkEKQkxJTktFUlMjRVRBVCNOT1ZJQ0VTCkxFQVNFUyMjRU5UUkVFI0hJQ0tPSwpBTkQjIyNIRUxFTkFTVUtPVkEjIyMKSE9VU0VSRURTIyMjVFJJI0FEQVBUCiMjS0VSTUlUI1BST1NPRFkjQUxPRQpBVEFMT1NTI0dBSU4jUFNBVCNEVU4KRkFLRUQjTU9OVEdPTUVSWUJVUk5TCkFMSUNFI0FOQVQjRlJBVSNTUElDRQpSRVNUUyNOT1RJI0ZJTlMjUElORVM="},{"title":"03/07/16 TRIO OF NUMBERS","author":"Gail Grabowski","date":"2016-03-07","grid":"U0FMQUQjI0NQUiNDQUxNCk9GVVNFI1NIT08jQUxPRQpMQVJLUyNQQVNTI0JBU1MKRFJFU1NUT1RIRU5JTkVTCiMjIyNFQVQjI0JBTiMjIwpUU0hJUlQjQ0hPUCNTRVQKQVBBUlQjR0xPVyNDQVJFCldBTEtTT05BTExGT1VSUwpOQ09TI1ZBU0UjQVNDT1QKWUVTI1BFVFMjTElURVJTCiMjI1NJUiMjQU9MIyMjIwpUSEVURVJSSUJMRVRXT1MKSElERSNBT05FI0RSQU1BClVSR0UjVEFJTCNBVURJUwpERUVEI0VNVCMjVEVFVEg="},{"title":"03/08/16 HYFFENATION","author":"Sally R. Stein","date":"2016-03-08","grid":"Uk9ZQUwjVEJTUCNGSVNUCkFXQVJFI0FMT0UjVU1QUwpGTFlGSVNISU5HI0xPT0sKIyMjIyNPT1BTI0ZMVUtFClRSVUZGTEVTI0dJRlRFRApSRVRBUkQjI1JFQUwjIyMKQU5UU1kjUkVBVFRFTVBUCk1FRVQjUEVBS1MjRElSRQpQRVJGT1JBVEUjQUdBSU4KIyMjT0RPUiMjVEhFTUVTClNBV1JFRCNQQVJBRElTRQpDUk9XUyNHQUxBIyMjIyMKUk9NQSNGT1JUWUZJRlRIClVTRVIjSU5UTyNJTkRJQQpCRU5EI05FU1MjQkFSTlM="},{"title":"03/09/16 SNACK TIME","author":"Clive Probert","date":"2016-03-09","grid":"SEVSQiNBQ1JFIyNCQVNTCkFSRUEjUFJPUFMjQUNIRQpXQUZUI0xBVElOI1JVSU4KIyMjVE9VR0hDT09LSUVTCiNGSUxNUyMjI1JVU1RMRQpHRU5JRSNBRE1JVCNZRFMKQU1PTkcjTkVPTiMjIyMjCkJBUkdBSU5JTkdDSElQUwojIyMjI05JQ0UjSEFOT0kKTEFTI1RXRUVUI0FOTkVYCkFUVElMQSMjI01JRFNUIwpXSElQQ1JBQ0tFUlMjIyMKTU9OQSNEUkFJTiNPQVRICkVNVFMjU0lSRVMjRkxFRQpORVNTIyNBTFZBI0ZMRVg="},{"title":"03/10/16 SPORT FISHING","author":"Billie Truitt","date":"2016-03-10","grid":"U1dBUCNBR0FQRSNCUkFEClBBUlIjU0FWRVIjQU9ORQpGSU5JU0hMSU5FI1pPTkUKU0xPU0gjUEFUI0NBVEVSCiMjI1RBUkEjQVNJQSMjIwojI0hJR0hMSUdIVFJFRUwKSUNBTlNPI0pPRVkjRElFClRJREUjI1NVTiMjUFVOUwpDQVQjTFVJUyNKVUlDRVMKSE9PS09GRlRIRVRFRSMjCiMjI0xPT1QjSUJJRCMjIwpBRERVUCNTQUQjQ09BU1QKRlJBVCNQT0xFVkFVTFRTClJBWlojQ1VUSUUjR09VUApPQkVZI1NUT05FI0hFTlM="},{"title":"03/11/16 WELCOME TO STOCKHOLM","author":"Fred Piscop","date":"2016-03-11","grid":"U1dBUFMjQ0hBUiNOQ0FBCkxBQkVMI1JPQk8jQlJVVApBWlVSRSNPUkxZI0NPREUKR0VUSU5UT0FZQU0jV0lJCiMjI1NEQUsjI0xFTk5PTgpHT1BIRVIjRElTTkVZIyMKRUFSI1JPQklOI1RSVU5LCkFSSUEjVEVOS1MjRkxBTgpSU1ZQUyNBRVNPUCNFTkUKIyNBUFBFTkQjUkVEU09YCkdFVFNBVCMjTUVUQSMjIwpBWEUjUlVOTklOR1lPTEsKRkFZRSNERUFOI09HREVOCkZMRUQjRUFTVCNBTE9ORQpFVFRVI1NUQVkjVE9SVEU="},{"title":"03/12/16 SATURDAY STUMPER","author":"Lester Ruff","date":"2016-03-12","grid":"UFJFU0lERSNTVFBFVEVSCkdPVklSQUwjUFJPVklERQpBTUlMQVRFI0xJTkVEVVAKVEFDI1NFQ1JFQ1kjSUNVCk9OVE8jU1RJTksjTUVBVApVQ09OTiNTT0QjQ0FTVEUKUkVSRUFEI1RPUFJBVEVECiMjI1NUVUIjUkFJTiMjIwpTSEFUVEVSUyNSRURDQVAKUE9CT1kjT09II1NQQUNFCkFTQVAjUElORVMjQVJDUwpSQU4jSE9MWUNPVyNBUlQKRU5EV0lTRSNLTklFVkVMClNOT09LRVIjTklUUkFURQpUQU5ORVJTI09DVEFORVM="},{"title":"03/13/16 CAPITAL MENU: With an ingredient in common","author":"Fred Piscop","date":"2016-03-13","grid":"VFJJQUwjSE9QRSNDTE9QI1RBS0VTClJBRElPI0VBUkwjSElERSNBQklERQpJQ0VEQ09GRkVFI1JFRENBQkJBR0UKTUVTU0tJVFMjQ0xPR1MjTE9PU0VOCiMjIyNFTFMjU1RPTkUjI0xPVCMjIwpDQUJFUlMjI1RPUkkjI1NPUyNDQUIKSFVSVFMjI0hBUkRDQU5EWSMjUlVFCk9ERVMjQ0hBSSMjI0JJQVMjS0VOVApNSUEjR1JPVU5EQ0hVQ0sjRlJBVFMKUE9EI1JPTEwjRVJBU0UjRkxJTVNZCiMjQ0hFV1kjRVZJVEUjUkFJU0UjIwpBRFJJQU4jU0xJTUUjUFVDRSNESU0KQ09VUlQjTVVMTEVEQ0lERVIjQ1JZCkhPTUUjU09MRSMjI09QRUQjQk9BVApPUkIjI1BPVU5EQ0FLRSMjREFSVEgKT1NTI0RBTiMjUlVTRSMjS0VZTkVTCiMjI09VUiMjUEVSS1MjUFVQIyMjIwpBSVNMRVMjQVJJRVMjTUFSSUVUVEEKQlJPSUxFRENPRCNGUklFRENMQU1TCkNBUlZFI0VMU0UjT0tSQSNUQVBFUwpTTkVFUiNGVUVMI1JPQU4jU0xBTlQ="},{"title":"03/14/16 A++","author":"Gail Grabowski","date":"2016-03-14","grid":"VEFDVCNQSEFTRSNDSE9XClVIT0gjUkVSQU4jTE9WRQpOQU1FI0VNRU5EI0FCRUwKQUJCUkVWSUFURURXT1JECiMjI0VUQSMjQURPIyMjIwpIRU0jU0xBQlMjSVRFTVMKT01FTiNFUkEjR0xPQkFMCkFDQ09VTlRTUEFZQUJMRQpSRUNFTlQjVEFNI0RFRVAKREVBTFMjR0VORVMjRFNUCiMjIyNFU0UjI1BBUiMjIwpBRERJVElPTkFMTU9ORVkKTEVBUCNEUkFNQSNBSURFCk9OVE8jRUdHT04jU1RFVwpFWUVEI0RFU0tTI1RFTlM="},{"title":"03/15/16 BRIDLE PATH","author":"Billie Truitt","date":"2016-03-15","grid":"U0xPUEUjU0hJTiNDUk9QCkNBUE9OI0xJU0EjQVVSQQpBTEVSVCNBR0VTI1JFQVIKQkFDS0lOVEhFU0FERExFCiMjIyNST0UjI0FEUyMjIwpST0xMRVIjU1BVRCNETkEKRVBFRSNURUxMI09DRUFOCkJFV0lUSFlPVUlOQUJJVApJUklTSCNFR0dTI0xJVkUKREFTI1JFRFMjU0FMVEVECiMjI0hFUiMjRlVSIyMjIwpBTExPV0VERlJFRVJFSU4KTElBUiNDT1JFI05PRFRPCkFNSVMjVFJPVCNBU0lBTgpTT1JFI1NBR1MjU0VUVE8="},{"title":"03/16/16 CHANCE TO SHINE","author":"Carolyn Stewart","date":"2016-03-16","grid":"Q1VCQSNBUklEI1NQSVRFCkFUT00jTUFORSNRVUFJTApXQVhQT0VUSUMjVVJHRVMKU0hZI0NSRVRFI0VST0RFCiMjI1NIRUQjTUJBIyMjIwpCUkFDRSNSVUJFTEJPV1MKUlVMRVJTI1NFQSNBUklBCklSQU4jQ0xBUksjUkFQUwpOQU1FI1JJRyNTQ09ORVMKR0xPU1NPVkVSI0FOR1JZCiMjIyNPREUjQVNLUyMjIwpDTE9XTiNVTklURSNCQUEKSE9QSU4jUE9MSVNIT0ZGCkFCVVNFI1RFRU4jRVpSQQpSRVNFVCNPTERFI01PT1I="},{"title":"03/17/16 NAME GAME","author":"Charles Slack","date":"2016-03-17","grid":"Q09XUyNQRVRBTCNFVEFMCkJMT0MjUkFOR0UjTUFORQpTRU5BVE9SVElNS0FJTkUKIyNEUkFXTiNMT0FOIyMjClNURUFMIyMjRU5SQUdFRApIRVJCQ0FFTiNTQVRVUk4KWUVTIyNHTFVUI1RFVFJBCiMjIyNCT0JLQU5FIyMjIwpJVEFMWSNFRUxTIyNTUEEKQVVESVRTI0RFQU5DQUlOCk5FT05BVEUjIyNBTExFWQojIyNFWElUI1BFUk9UIyMKU0lSTUlDSEFFTENBSU5FCkVSSUUjS0lMT1MjS05PWApFU1BOI1NDRU5FI1NFTlQ="},{"title":"03/18/16 ASSEMBLY LINES","author":"S.N.","date":"2016-03-18","grid":"I1RISU5FI0FUViNBQ0xVCiNSQVRUWSNNT0kjQ0xJUAojSVNUSEVSRUFTRUNPTkQKRUJBWSMjSU5ET05FU0lBClJVQiNFU0MjI1JPREVOVApJTkFMQVRIRVIjU0VSR0UKQ0FMSUNPI01CQSMjIyMjCkFMTFRIT1NFSU5GQVZPUgojIyMjI1BFTiNERUJBU0UKVFJBU0gjQURIRVJFTkNFCkhPTExPVyMjVVNOI0JBRApST0NJTkFOVEUjI0ZVUlkKSU1PVkVUT0FESk9VUk4jCkxJVkUjQ05OI0NBTUVPIwpMRUVSI0hPRyNUUkVORCM="},{"title":"03/19/16 SATURDAY STUMPER","author":"Frank Longo","date":"2016-03-19","grid":"Q1JFTUEjQ0VERSNBRkVXCkhPUElOI0hFQUwjU0FSSQpVQk9MVCNFTERFU1RTT04KQk9YS0lURVMjQ1VSVFNZClNUWU1JRVMjU1RSSVAjIwojIyNBVFRFU1QjRURJRlkKRlJFTkNIQ0xVQiNFVFJFClJPQyNIRUxJQ0VTI0NFTApBRE9TI1JPQ0tFVFNISVAKVEVNUFQjVEVBUE9UIyMjCiMjTU9SUEgjUkVDQVNUUwpBVkVOVUUjUE9SS0xPSU4KRk9SR0VUWU9VI0FLSVRBClJJQ0UjQ09STiNERUxISQpPREVTI09XRUQjRURTRUw="},{"title":"03/20/16 ELECTRIC COMPANY: For a pleasant kilowatt-hour","author":"Gail Grabowski","date":"2016-03-20","grid":"QkFUUyNMSU1BUyNTUEFUI0VUSElDCkFCSVQjQk9BU1QjRVJJRSNNT09MQQpMRU1PTkpVSUNFI1dPUkxEUE9XRVIKU1RFTk8jU05PV1MjI1NMRUVLIyMjCkFTU0VTUyNTVEFMTFMjI0NSSVNJUwojIyNTSVRTIyNSQVRUTEUjT05UQVAKQUJTI1JFQ09SREJSRUFLRVIjQUdFClJFQVAjTUFSRSMjU1BJRUQjUFlSRQpNQUxFUyNNRU5TQSMjRE9FI0FDRUQKU1RFQUtTI1NUT0xJRCNVTkdMVUVTCiMjU1BJS0UjRU1PVEUjVElMRVIjIwpTVE9PUEVEI0RFTklNUyNDT0FSU0UKVEhVRCNXSVQjI0dOQVdTI0JMRUFUCkFSVFMjRVRBVFMjI05BUFMjRU5JRApMT0wjQ1JPU1NXT1JER1JJRCNURFMKRU5FTVkjUkVQQVZFIyNZQVJEIyMjClJFVElOQSMjU1BBU01TI01JUkFHRQojIyNMSVNUUyMjTElFVE8jRVBTT04KQkFOS0NIQVJHRSNTVE9QU1NIT1JUCkJZU0VBI09USVMjVEFMRVMjSU5HRQpTTkFSTCNTQUdTI1NMSUNFI0xFRVI="},{"title":"03/21/16 OPTIONAL","author":"Gail Grabowski","date":"2016-03-21","grid":"U1BBVCNDQVNII1NQTElUCktBTEUjT0JPRSNUUkFTSApJRE9MI05BREEjUk9VVEUKI1NFTEVDVEFUUkFORE9NCiMjIyNEVUUjI0VXRSMjIwpSRVBBSVIjRElHUyNETkEKRVhFUlQjU09GQSNTVUVTClBJQ0tTT01FRkxPV0VSUwpBTEFTI0ZVUlkjVkFMVkUKWUVOI0xVR1MjTEVOU0VTCiMjI0hBUyMjTUFSIyMjIwpDSE9PU0VBUEFSVE5FUiMKUEFSSVMjUE9ORCNBVklECkFSRVNPI0VSSUUjUElQRQpTUE9UUyNTRUFSI1NMRVc="},{"title":"03/22/16 GET THE POINT","author":"Billie Truitt","date":"2016-03-22","grid":"T1NDQVIjVVNFRCNTVEFSCktPQUxBI1JJREUjUEFSRQpST0xMSU5HUElOI0FMTUEKQVRNI1NFRVNUTyNDT0VECiMjI1BFVFMjI1RSRU5EWQpUU0hJUlQjU1RFSU4jIyMKT1BFQyNFVFRFI0RFQ0FMClBBUksjREFSRVMjRUxTRQpTTUVMTCNEQU1QI0RFTlMKIyMjRVNTQVkjSUdMT09TClNPUFNVUCMjT0dMRSMjIwpDSEFQI0lET1RPTyNQVFMKUkFSRSNSSUdIVEFSUk9XCkFSRUEjQUNSRSNUSUFSQQpQRUVSI0xFRVIjU1BZT04="},{"title":"03/23/16 IT'S LAUNCH TIME","author":"Fred Piscop","date":"2016-03-23","grid":"REFNUyNDT1BTI0ZFVEFTCkVNSVQjT1ZFTiNBR0lMRQpOQU5PI01FVEEjVFJFQVQKSU5PVVRFUlNQQUNFIyMjCk1BUlRIQSMjI1RBVFRPTwojIyMjVVNBI0NPVCNJUkEKU0NSQU0jTElPTiNNRUFUClRPT1JCSVRUSEVFQVJUSApSVURFI05PU0UjTE9TRVMKQUNFI09LUyNOQ08jIyMjCldIT0FNSSMjI1NQQVJUQQojIyNNQU5PTlRIRU1PT04KU0FSQUgjUEFSQSNCVVJOCkVMSVpBI0VNSVIjRVRUVQpXSURFTiNERVBQI1JFRUw="},{"title":"03/24/16 SCALE SOUNDS","author":"Carolyn Stewart","date":"2016-03-24","grid":"RkxJUCNDUkFNUCNBQ0VECkFFUk8jSFVNT1IjTk9HTwpSQUtFU0lOVEhFRE9VR0gKIyNTVEVOTyNTVEFJTiMjCkdMTyNFT05TI1RJTkNBTgpST01BTlMjUFJJU1RJTkUKRVhFUlQjQUxPRSMjTEFXCiMjI0NPU01JQ1JBWSMjIwpBUFQjI1RFTksjTEVJR0gKTUVSQ0hBTlQjQlVSTkVSClNUQVJFRCNTQ1VNI1NUUwojI1BBUklTI0VOTlVJIyMKQVJFWU9VS0lERElOR01FCkJPWk8jTUVEQUwjVEhPUgpFREVOI1NXT1JFI09USVM="},{"title":"03/25/16 TRIPLE DECKER","author":"S.N.","date":"2016-03-25","grid":"I1ZFUlNFI0pBTSNUQVVUCiNJTUVBTiNVWkkjQVJOTwojU0lOR0UjRE9OI01FU0EKI0lOVEVSRkVST01FVEVSCkFHRSNUVkEjRVJBI0hBTQpXT05UI0FWSVMjR01BVFMKRVRDSCNUT04jUk9PIyMjCiNIRVJCRVJUSE9PVkVSIwojIyNPTEQjV0FSI0lTSVMKQ09NQk8jTU9CUyNFVE5BClNQQSNLSUEjSUNFI0VLRwpIVU5URVJHQVRIRVJFUiMKQVNJQSNBTlQjQVJPTUEjClJFQVIjUVVPI0NJVkVUIwpQU1NUI0lNUCNIRUVEUyM="},{"title":"03/26/16 SATURDAY STUMPER","author":"Brad Wilber","date":"2016-03-26","grid":"Rk9JRUdSQVMjTUlMQU5PCkFOVEVMT1BFI0FDVU1FTgpEQUlSWU1FTiNTWU1CT0wKRUlOI0NBUk9NUyNQSU5ZCkRSQUdJTiNSQU5UUyMjIwojIyNVTklUI0RPTk9SUyMKQUxGSUUjQUJPVVRGQUNFCk5BSUwjVUNPTk4jQ1pBUgpEWVNUT1BJQU4jQ09FTlMKI1NUUklDVCNBU0lBIyMjCiMjI0lEWUxMI0hBTFNFWQpNRUxEI0NZQk9SRyNQU0EKT1hZRE9MI0FQSUFSSVNUClNFUkVORSNSRU5URlJFRQpTQ0VORVMjU0xFRUtFTlM="},{"title":"03/27/16 WISE WOMEN: Reaching the same conclusions","author":"S.N.","date":"2016-03-27","grid":"R0FVR0UjTUFNTUEjQVFVQSNBQkJBCkFSR1VFI0FMSUVOI1JVTlMjQkFZUwpMSUxZTEFOR1RSWSNLQVRZUEVSUlkKU0FZUyNDTk9URSNQQVJPTEUjUk9FCiMjIyNTVElSUyNCVU5UI1VSR0VOVApBTENBUE9ORSNURVJTRSNNTUwjIyMKSEVBRElORyNDQVZFQVRTIyNFTUlUCkFUVElSRSNDQU1FTFMjUEVUTkFNRQojI0hPRSNDQU5BUlkjTk9BSCNSUE0KV0hZUyNUSFJBTEwjUkVVU0UjWUFQCkhFUiNTSElSTEVZQkFTU0VZI0xJRQpBUkkjUE9MT1MjQ0FOVEVEI0hFUkQKUkVHI1VOSVQjQUxJQ0VTI01PQSMjCkZBQkVSR0UjQU1FTElBI0JBUktBVApTVFlYIyNTQU1CQUVEI01BTkRFTEEKIyMjRVNTI0xFRVJZI1BBUkxFWUVECk1BTkNIRSNJVFJZI01BUlRZIyMjIwpBR08jQVBBVEhZI01PUlJPI0ZBWkUKTUFZV0hJVFRZI0tJVFRZS0VMTEVZCkVQRUUjQUlMUyNHTE9PTSNMRUFTRQpURVNUI1NURVQjQkVSTkUjRkFTVFM="},{"title":"03/28/16 BUSY, BUSY, BUSY","author":"Gail Grabowski","date":"2016-03-28","grid":"RkFEUyNIQVMjI1NDT05FCkJMT1QjQUNIRSNDT0RFRApJT1dBI0dSQU0jQUxPQUQKI0VOR0FHRURUT01BUlJZCiMjIyNFTFNFI1VQUyMjIwpQTEVBU0UjI1NUUyNFU1MKUkFNQk8jQkVBRCNJTkNICk9DQ1VQSUVEQ09VTlRSWQpNRUVUI01BU0sjU1RFQUwKT0RFI1NFVCMjU1RPUk1ZCiMjI1NQQSNPQ1RPIyMjIwpXT1JLSU5HVEhST1VHSCMKQVZBSUwjQVRJRSNST09NCkdBVkVMI0dFTFMjR09ORQpTTEVEUyMjUkRTI0VERU4="},{"title":"03/29/16 NOT SO SURE","author":"Billie Truitt","date":"2016-03-29","grid":"Q0xBU1MjU0xPVCNPUFVTCkxFRFRPI1BBUEEjTk9TRQpFQVZFUyNPV0VTI1RXSU4KT0ZUV09NSU5EUyNIRU5TCiMjIyNPSUwjI0VNRVJHRQpFUlJBTkQjUElMQUYjIyMKQk9PTSNTV0FOI1JFRklUCkJMQUIjVEFST1QjTk9TSApTRU1JUyNESU5PI0NPTkUKIyMjVkFORVMjUFJFVFRZCklUU0FHTyMjVklBIyMjIwpTRUFMI0lOREVDSVNJVkUKQU5URSNTT1VSI0RPUEVZCkFTSU4jRVZFUyNFTEFURQpDRU5UI1NBTEUjRE9ET1M="},{"title":"03/30/16 HANDS DOWN","author":"S.N.","date":"2016-03-30","grid":"Q0hFU1MjU1RBQlMjVEVBCkxPQVRII09XTlVQI09BVApBTkdSWSNOT1RTT0ZBU1QKSURFQSNNQVBTI09MREVOCk1BUklOQVJBI0ZMVSMjIwojIyNHUlIjSU1JU1NZT1UKQUxQSEEjUFJPRiNIRU5TCkdPQVQjUE9TU0UjV0FLRQpPUkNBI0FMT1QjV0lTUFMKR0VUUklET0YjU0FUIyMjCiMjI1JOUyNQRVRTSE9QUwpERVBPVCNUQUlMI0NVUkwKQU5TV0VSSU5HI01BTklBCk1EUyNOSU5USCNBU0NPVApFU1QjVE9BU1QjVEhFUkU="},{"title":"03/31/16 MEAN CUISINE","author":"Carolyn Stewart","date":"2016-03-31","grid":"UEFSU0UjQkVEUyNKQVpaCkFMT0VTI0VWRU4jQVJJQQpET09SUyNORU1PI0RFUFAKUlVGRkVER1JPVVNFIyMjCkVEUyNORUEjQ1RBI0FNVAojIyNTQ0FMQVIjTUFMQVkKTUFTVEVSI0xBS0VDQVJQClVOVE8jRUxJVEUjVFJJTwpTTk9XQ1JBQiNUSE9NQVMKSEFSU0gjU0lTVEVSIyMjClVORSNBUFQjT0xBI1RXTwojIyNHUkFTU0ZFREJFRUYKR0FaRSNTVEFUI1dFTkRUCkFYRUwjVE9OSSNBREFHRQpQRU5TI0VQRUUjWUVNRU4="},{"title":"04/01/16 HIDDEN TRIO","author":"Fred Piscop","date":"2016-04-01","grid":"Q0FEUkUjR09PRiNaQVBTCkFSSUVMI09NQVIjTElSQQpSQU5EQiNMSVRFI09ESU4KI0JPT09GRlRIRVNUQUdFCiMjIyNXQVMjI1BMWSMjIwpBUlJFU1QjRkxPRSNBQ1MKTEFJUiMjRkxBUkUjRE9XCklUU0FaT09PVVRUSEVSRQpCRUUjSU5CQUQjI0lQQUQKSURTI1BFU1QjTElUVExFCiMjI1NJTSMjQUlEIyMjIwpNVUNIVE9PT0JWSU9VUyMKQUJMWSNOQU1FI09VTkNFCk1FQUwjVEhBVCNNU0RPUwpBUk1ZI0hVTlMjU1RPV1M="},{"title":"04/02/16 SATURDAY STUMPER","author":"Anna Stiga","date":"2016-04-02","grid":"QlJPT0RNQVJFI0NFTExTClJFRERSQUdPTiNBVkFJTApJVkVET05FSVQjTUVDQ0EKQVNTI1BVRyNIQk8jRUVDClJPU0UjUEFEVUEjU0lOSwpTTkFSRiNQQVNUVEVOU0UKIyMjTUVTI1NFSElOVE9OCkdFVElOT04jREVCVE9SUwpPVkVORE9PUiNSSU8jIyMKTUVORUlUSEVSI0FGTEFDCkFSQ1MjSEFZRVMjRkFWQQpEWUUjWUVTI0JFTCNURUUKRk9OREEjU1FVRUFMRVJTCk9OVE9QI0xVRlRIQU5TQQpSRVNUUyNFTUZPUlNURVI="},{"title":"04/03/16 WATER LOG: As your pencil flows along","author":"Gail Grabowski","date":"2016-04-03","grid":"UElNQSNBRFMjVEFNQUxFI09CQU1BClNPQUsjU0lUI0FOSU1BTCNOQURJUgpTVFJBSVRMQUNFRE5FU1MjRVJPREUKVEFNI05FQVRPIyNVTlNFQVQjQlNBCiMjQUxFUlQjV0FEUyMjI1RXRUVUUwpFQ0xJUFNFI0VNVSNPTERTT0QjIyMKVFJBQ1QjI0JST09LTk9ESVNTRU5UClJVREUjQUNSRVMjRVNTRVgjRVZFUgpFREVOI1JBSUQjQ0FQRSMjQkxBUkUKIyMjU0NPUkUjI0FURSNNQkEjRERTClNUUkVBTU9GQ09OU0NJT1VTTkVTUwpUUkEjUEFMI0FDVCMjQ1VSU0UjIyMKT0FTSVMjI0FDSFkjSElTUyNTTE9UCklTVE8jSEFTVEUjTUFORVQjQ0FWRQpDSEFOTkVMU1VSRklORyMjT0FURVIKIyMjSU9XQU5TI0FORyNMQVdGSVJNCkNJUkNMRSMjI0JSSVQjQUxMRU4jIwpVTkUjSURVTk5PIyNFRVJJRSNUQVMKU1RFQU0jU09VTkRJTlZFU1RNRU5UClBFU0NJI01FTEVFUyNFRFQjRVNUQQpTTEVFVCNBTExTRVQjU09TI05UU0I="},{"title":"04/04/16 POSITIONAL PAIRS","author":"Gail Grabowski","date":"2016-04-04","grid":"I0RFQVIjV0lTSCNBU09GCk1PVklFI0lTVE8jRE9TRQpPVkVSSElMTEFORERBTEUKUEVOI0VOVEVSI0VVUk9TCiMjI1ZBTlMjVEJTUCMjIwojU1RJUlMjTEVFSyNXU1cKQUxPRVMjU09EQSNTRUVSCkJFVFdFRU5ZT1VBTkRNRQpCRUVTI0RFQU4jRElHSU4KQVRNI1JFQUwjREFURVMjCiMjI0NPTksjQkFHUyMjIwpIT09IQSNTVUlURSNPUkUKVU5ERVJMT0NLQU5ES0VZCk1FRFMjWVVMRSNDVVJWRQpQU1NUI0VUQVMjWUVBUyM="},{"title":"04/05/16 ALL THE BEST","author":"Billie Truitt","date":"2016-04-05","grid":"V0FUQ0gjSURMRSNHUkFNCkFDSE9PI05FT04jUklGRQpJVEVNUyNBTEFJI0VWSUwKRklORVRVTklORyNBRVJPCiMjIyNFS0UjI01JVFRFTgpUT0dHTEUjU05BRlUjIyMKSEFJUiNTSE9PI1NOSUZGCkFUTEFTI0FEUyNPQ0NVUgpUSEFOSyNSQVlTI0xPU0UKIyMjRElWRVMjVEhFTkVUCkNIQVNURSMjU0FPIyMjIwpISUxUI1NVUEVSTU9ERUwKQVJJQSNTQ0FOI0FNT1JFClRFRU4jRUxJUyNHRU5JRQpTRU5EI0xBTkUjRU5URVI="},{"title":"04/06/16 GIVE IT A GO","author":"Charles Slack","date":"2016-04-06","grid":"UkVMSUMjI0VTQyNIVUdPCklST05JQyNTUElURUZVTApCQUNLVE9TUVVBUkVPTkUKI1NIWUVTVCNST0FEIyMjCiMjIyNTVFVCIyNZRU5UQQojU1JBI1NORUVSI0RPRVMKU1BJTkUjI0FTQVAjVE5UCkFMT05HRk9SVEhFUklERQpMRVQjR0lSRCMjV09PRVIKU0VFUiNURUVOUyNFTkQjCkFOREVTIyNEQVRFIyMjIwojIyNSRUVMI1JBUkVTVCMKQVJPVU5ESU5DSVJDTEVTCkRPV05USU1FI1JFSEVBVApPREVTI1RBRCMjRE9XUlk="},{"title":"04/07/16 STICK WITH IT","author":"Mark McClain","date":"2016-04-07","grid":"RElTQ08jU0NPRkYjVklQCkJSSUFOI0NBVkVSI0FTTApMQVRURSNBQklERSNNQUEKU1FVQVJFUk9EI1RPUEFaCiMjI0xPQUYjI0FGUklDQQpSRUNPVVAjTElRVU9SIyMKQ0xPR1MjTU9TVUwjRU5ECkFJTVMjVklPTEEjQkJPWQpTU0UjVEVNUEUjUExBTkUKIyNET1JJRVMjU0FVVEVTCkxBWVNJTiMjQkFZUyMjIwpPTkNVRSNXQUlUU1RBRkYKTklMI1NUQUxLI0xFR0FMCkVNVSNUQVNURSNJUkFURQpSRUIjRVhQT1MjUFlSRVg="},{"title":"04/08/16 FLOWER POWER","author":"S.N.","date":"2016-04-08","grid":"SVJBUUkjRVBQUyNTUEFUCkRJRFVQI1JIRUEjUEFSQQpPQk9FUyNBTE9UI0lSSVMKIyNCTE9XU09ORVNOT1NFCkpPRUwjSEVYIyNUWUxFUgpMSVAjTUFSI1BHQSNFU1MKT0xEUEFMIyNBTk5PIyMjCiMjRk9YSU4jU09DS1MjIwojIyNESU5PIyNDRVNUQVMKQVdMI01HTSNQQ1MjSk9OClNIQU1VIyNOQUgjRE9MTApDWVJVU1RIRVZJUlVTIyMKRVlFUyNIT1dMI09WRVJUCk5PREUjT1JFTyNTRVBJQQpEVU9TI1VOTFYjRVRIT1M="},{"title":"04/09/16 SATURDAY STUMPER","author":"Frank Longo","date":"2016-04-09","grid":"Q0xBUCNDQU5UTyNCQVRTClJJVEUjT0NFQU4jQUNSRQpPVkFMI0JBTExFVFNIT0UKUEVDT1NCSUxMI1dJRUxECiNTT1NBIyMjI0JPTERMWQpCVVNJTkVTU05FV1MjIyMKQVBUI0dOT01JU0gjSVNFCklUTyNBTkRBTlRFI05BRwpPT0YjQkVBU1RJRSNHTE8KIyMjQ1JBU0hIRUxNRVRTCk9QSU9JRCMjIyNFT05TIwpCSU9NRSNXQVRFUkpFVFMKSkVXRUxCT1hFUyNBUklBCkVUQVQjQVJFQVMjVkFDUwpUQU5TI0hFTExPI0VMS1M="},{"title":"04/10/16 NORTHERN EXPOSURE: Explained at 115 Across","author":"S.N.","date":"2016-04-10","grid":"TEFTU0lFI0FTTUFSQSNDQUxBSVMjCklUSEFDQSNORUFURU4jT1JJRU5UUwpCRUFWRVJPTkFST0NLI05JQUdBUkEKUklMRVMjUEVUI01BTEVDQVJJQk9VCkFOVFMjTUlYQ0QjUEVLRSMjU09MRAojIyMjQklOI09SQyMjRVJPUyNYTEkKTUFQTEVMRUFWRVNBTkRUV0lHIyMjClVORUFTRSNERVNJTFUjI0xFQURFUgpTQVJJUyNBSVJTI1RPR1MjU0xPTU8KSUNBTiNUU1AjI0NBVkVBUlQjR1BPCkNPTiNTQ0hPT05FUkFUU0VBI09PRgpJTk4jQU1FU0xBTiMjU1NOI1RPUlQKQURVTFQjUkVFRiNQTEFZI1JBRElPCk5BTUVSUyMjQVRSQUlOI01BREVVUAojIyNOQVRJT05BTENPQVRPRkFSTVMKQVBUI1BVTVAjI1NFTiNIT1QjIyMjCk9PSFMjI1BBRFMjUkVTSU4jU0FDSwpMT09OT05BTEFLRSNTSEUjSElNT00KRVJSQVRJQyNDT0lOU09GQ0FOQURBClJFUFJJTlQjQ0FSRUVSI0JMQVpFUgojUkVFU0VTI0FMRUFTVCNTTElFU1Q="},{"title":"04/11/16 THROUGH THE DAY","author":"Gail Grabowski","date":"2016-04-11","grid":"QUxQUyNTUEFOIyNQRUVLClRPVVQjVFVOQVMjQUxBTgpPR1JFI0FSRU5BI0xBVEUKTU9STklOR1dBTEsjVElFCiMjI09MREUjI1NJUkVOUwojTE9TRVMjR1JBREUjIyMKSEVOIyNJU0xFI0RFSVRZCkFGVEVSTk9PTkNPRkZFRQpTVE9MRSNBV09MIyNTQVQKIyMjU1VMS1MjRVJST1IjCkhPUEVTTyMjTUFVSSMjIwpBUEUjRVZFTklOR0dPV04KQkVBVCNFTU9URSNIQUhBCklSS1MjRElORVIjVEhFWQpUQVNLIyNUT1NTI1NVTlM="},{"title":"04/12/16 OVER THE RIVER","author":"Billie Truitt","date":"2016-04-12","grid":"UEVSTSNFU1NFUyNNSVNTCklERUEjTUFVVkUjQVJJQQpTSU5LI1BSTUVOI0NPU1QKQVRURU5USU9OU1BBTiMjCiMjI0RBWSMjI0VBUiMjIwpGU1RPUCNUT1AjTk9WQVMKQUFII0VMRVZFTiNOSU5FCkNST1NTVEhBVEJSSURHRQpFQVNUI1JFTEFDRSNFRUsKVEhFUkUjRVNMI0lET0xTCiMjI0VMRiMjI09ORSMjIwojI1RBS0lOR0lUU1RPTEwKQVRPTSNMRUFTSCNBU0lBCkRJTkUjTUFQTEUjQ0xBVwpERUVSI1NURUVSI0hPUk4="},{"title":"04/13/16 I LOVE A PIANO","author":"Andy Ellis","date":"2016-04-13","grid":"SElHSCNHQUlUUyNIQUlMCkFDUkUjQU5HRUwjQUxTTwpIT0FYI1NUT1JFI0NPUFMKQU5OI0ZMT1JJREFLRVlTCiMjRFJBSU4jI0RSRSMjIwpTQVRPVVQjUFJJT1JJRVMKQURPUk4jQk9VTkQjVklQClBJVFkjQlJJTkcjVE9ETwpJTUEjU0VVU1MjV0lSRUQKREVMTU9OVEUjVEhFWVJFCiMjI0FQVCMjU0hJUlQjIwpCRU5DSFdBUk1FUiNPUkIKT0RPUiNPQ0VBTiNBV09MCk5FTU8jT0hBUkUjREVNTwpPTkVTI0RFTFRBI0RSRVc="},{"title":"04/14/16 FIVE OF A KIND","author":"Carolyn Stewart","date":"2016-04-14","grid":"Q0xBTVAjRlVNRVMjT1JFCkFTTkVSI0lQQURTI1JFTQpQQVRUSU5HRE9XTiNFQkIKU1RFQU1ZI0FSSSMjR09PCiMjIyNQRVRUSU5HWk9PUwpEVUFMIyNIRVMjUkFOVFMKSU5GQU1PVVMjU0VOIyMjClBJVFRJTkcjQUdBSU5TVAojIyNFQVQjQkVUVEVSRUQKU1BBU00jQVVSIyNSQVRTClBPVFRJTkdTT0lMIyMjIwpBTEUjI09BUyNORVRUTEUKQ0lBI1BVVFRJTkdBV0FZCkVTUyNBU0hPVCNPWElERQpTSEUjTEVBUFMjU0lURVM="},{"title":"04/15/16 SALT CONTENT","author":"Fred Piscop","date":"2016-04-15","grid":"TkFESVIjTUlMRCNDSE9QCk9QRVJBI0FTSUEjSE9CTwpDQUJBTkFDTFVCI0lXT04KQUNUI0FDUkUjSEVOTEVZCkxFU09USE8jTkFOQSMjIwojIyNOQVkjU0FORENSQUIKS0VCQUIjUkFJRCNMQU1FCkVYRUMjTE9MTFMjT05NRQpESUFMI0FMQVMjRlNUT1AKU1RSRUFLRUQjQ1VFIyMjCiMjI0FMRVgjRE9OVEFTSwpHT0ZSRUUjU0VSRiNUV0EKQVZJRCNST01BTkFDTEVGCkdBTEEjSURPTCNDSEFMSwpBTExZI0VFR1MjVEVTTEE="},{"title":"04/16/16 SATURDAY STUMPER","author":"Lester Ruff","date":"2016-04-16","grid":"R0FNRUJBTEwjU0FISUIjCk9SQVRPUklPI0lUVU5FUwpQRURBR09HWSNSQVRUTEUKQVRNI1NNRUFSRUQjSE9OClNPQUsjQVJMRU4jSEVXUwpUT1hJQyNTVFAjSEFSUE8KIyMjTEFXI1lPR0lCRUFSCkFOVE9OSU8jU0VNSURSWQpHQVJCQU5aTyNNT1QjIyMKRU1BSUwjQUZUI01BQ1JPCkxFTlQjQVdGVUwjVEhFTgpFU1MjRUxBUFNFUyNJVkUKU0FGQVJJI0VTVEVFTUVEClNLSVJUUyNBTE9FVkVSQQojRVhNRVQjS0VOS0VTRVk="},{"title":"04/17/16 MISSPELLING BEE: Of the ingestible sort","author":"Fred Piscop","date":"2016-04-17","grid":"TUFEUklEI1RPUlNPIyMjUEFTU09OCk9MRU9MRSNPUklPTiMjTU9OVEFOQQpEVUJCTEVCVUJCTEUjUkVERElXSVAKRU1UUyNKVUdTI0RJTkVEIyNOSUNFCiMjIyNQQVRII1RJREVTI0JFRU5FIwpTQUZFTFkjI1dIRUFUQ0hFWCMjIyMKQUdSRUUjTUFIRVIjI0FVTlQjTUFQCktST05BI0FNRU4jREVMRVRFI0VHTwpTQU8jU1BMQVQjU0FWRUQjTk9MQU4KIyNUUkVBVFMjUklGRSMjSVRBTElDClBPTEUjVEFTVEVFRlJFRVojVE9ORQpBVE9OQ0UjI0lHR1kjR0xPU1NZIyMKUEhPVE8jSkFNSUUjUFJVREUjRVBBClBFUCNFUk9ERVMjQ1JFRCNBTExFTgpZUlMjUlVTSCMjQ1JFVEUjVEFMT04KIyMjI0NIRUVaV0hJWiMjQkVHT05FCiNDQVJFUiNSRUhBQiNSRUVEIyMjIwpQQVJFIyNURU5PUiNNQVJTI09NTkkKU05PQkFMTFMjUklDRUtSSVNQSUVTClNFTUlUSUMjI0xPVVNFI0RJRVNFTApUUkFERUQjIyNTVEVBRCNFTkNPREU="},{"title":"04/18/16 IT'S A DATE","author":"Gail Grabowski","date":"2016-04-18","grid":"I09TTE8jU1BBTiNCUkFUClNORUVSI05PTk8jTElNRQpIRU1FTiNBTFRPI0FQRVMKSEFJUkFQUE9JTlRNRU5UCiMjIyNNQVMjI1RFRSMjIwpBUFBMRVQjQ09JTiNCRUQKTUVMT04jQUxVTSNBTE1BClBSQUNUSUNFU0VTU0lPTgpMSU5LI05FQVQjVEFTVEUKRUxLI1BTU1QjTEFQU0VTCiMjI01BUCMjQUlSIyMjIwpCVVNJTkVTU01FRVRJTkcKSVJPTiNDTFVFI0RJQ0VZCk9HTEUjVE9STiNBTEFSTQpTRUVTI1NQRUQjVEVORCM="},{"title":"04/19/16 POSSESSIVENESS","author":"Sally R. Stein","date":"2016-04-19","grid":"QU1BU1MjU0FHQSNDQUdFCkRFTEhJI0hVUlQjSEVOUwpTVEVBTSNFVEFUI0FTQVAKIyMjTUlORE9GSVRTT1dOCktPRCNMT1MjI0NPTVBTIwpFUk9ERUQjU09GQVMjIyMKTklOQSMjU09EQVMjV0VUCllPVVNIT1VMRE5USEFWRQpBTlQjT1JFT1MjI0FYRVMKIyMjU1dJU1MjUEFURU5UCiNQQVVTRSMjU0lUI1NUWQpFQVJOT05FU0tFRVAjIyMKQVlFUyNUWUtFI0FSSUFTClRVTkUjRVJJRSNTSU5DRQpTUEFUI0RFTlQjRU1DRUU="},{"title":"04/20/16 CHOCK-FULL","author":"Fred Piscop","date":"2016-04-20","grid":"U0FURSNNQU5VUCNTUEFUCk9WQUwjQUxPTkUjVEFYSQpQQUNLRURTVUlUQ0FTRVMKSElUI05FT04jVE9UUyMjClNMSU5HIyMjTUVMI1BFQQojU0NPVVIjU09EQSNPTEQKIyMjRkxBUkVTIyNBUk1TCiNTVFVGRkVEU0hJUlRTIwpTRUFOIyNTQVlJTkcjIyMKUEFMI1dSRU4jU01PUkUjCkFMTCNIVVQjIyNPTkVBTQojI1RJRUQjQUxQUyNNUkkKTE9BREVEUVVFU1RJT05TCklETEUjRVVST1MjU1RFVApURUVTI1JPQVNUI01FRFM="},{"title":"04/21/16 NOT FOR YOU","author":"Billie Truitt","date":"2016-04-21","grid":"QVNUSU4jQkxBU1QjRkFUClJFQURZI0VBUlRPI1VGTwpNRVhJQ0FOTUVBTCNKQVIKU0tJVCNMRFMjVFNISVJUCiMjI0FERCMjUEVUQSMjIwojTUVSUklFTUVMT0RJRVMKSEFMT1MjTk9TQVkjTkFNCk9QRUQjSkNSRVcjSEFSRQpMTEMjQk9BU1QjUEVOTkUKTUVUUklDTUVBU1VSRVMjCiMjI0FUT1AjI0VSRSMjIwpDQUNUVVMjVklNI1dBQ0sKT1JPI01FRElDSU5FTUVOClpJUCNFTEVOQSNBR0lMRQpZQVkjTllMT04jUE9TU0U="},{"title":"04/22/16 NECKSPERTISE","author":"Matthew Sewell","date":"2016-04-22","grid":"TUFEQVQjQ0hBUk0jSVBBCkFNT0NPI0VFUklFI05PVApMT0NITkVTU01PTlNURVIKIyNURUVNUyMjI0RIT1RJClJITyNET05BVEUjT1RJUwpPQVJTI0pBQkJFUldPQ0sKV0hPQU1JI1NBTEUjIyMjClNBV1RPI1ZDUiNBREFHRQojIyMjT0hJTyNDTElNQVgKUk9BRFJVTk5FUiNNQUdJCkVUUkUjR0VEREVTI1JBVApESEFCSSMjI1NQQUNFIyMKWUVSVExFVEhFVFVSVExFCkVSQSNMQUJFTCNET1RFUwpTU1QjU1RBWVMjSVBPRFM="},{"title":"04/23/16 SATURDAY STUMPER","author":"Brad Wilber","date":"2016-04-23","grid":"REFXTlJBSUQjUE9NQURFClJFQUNUU1RPI0FWQUxPTgpBTlRJRVRBTSNTT1JUT0YKRkVFUyNFTElPVCNHRVJFClRBUiNCUklOSyNNT1JTRQojU0NBUiNBT1JUQSNOSUIKIyNPQ0VBTiNBSVJCQUxMCkZMT1JBTCMjI1RPT1RMRQpSSUxFRFVQI1BPT0xFIyMKRVNFI0VNT1RFI05FRVQjClNUUkFEI0dSQVNTI05PTQpISVNTI01PT0NII0VETkEKTUNIQUxFI01PSUVUSUVTCkFMT0hBUyNQQVJET05NRQpORVdJU0gjU1RST05HRVI="},{"title":"04/24/16 TEASER TRIOS: All working out in the end","author":"S.N.","date":"2016-04-24","grid":"REVTREVNT05BI0FNQVNTI1dISUxFCkVNUE9XRVJFRCNSSUNLSSNIT05FWQpGT1JHRVRBQk9VVFRIQVQjSU5ESUUKQVRFI1NFVCMjTklURSNEUlNFVVNTClJJQUwjU09OTklFUyNMT1VUI0NVUApHT0RPVCNSRU5UUyNQRVdTI05FUk8KRU5TVUVEI1dFU1RQT0lOVENBREVUCiMjI1ZFRVJTIyMjSU9DI1NIWSMjIwpEQUxFI0JBTUEjU0NSQU0jSVNBQUMKRVZFUiNBQkFORE9OIyNBT0wjTFhJCkxFQVNUU0lHTklGSUNBTlRESUdJVApJUksjV0VFIyNNQUNBUVVFI0xBTkUKU1RZTEUjU1RFUFMjRFVBTCNMRUdTCiMjI09BUiNBTEwjIyNBTExPVyMjIwpCRVNUS0VQVFNFQ1JFVCNPS0FQSVMKRUxMUyNGTEVFI0hPUElTI1NJRU5BCkFMSSNKRUVSI1BFTElDQU4jVFVUVQpSSVBDT1JEI01FQUwjI1JBRyNHRU4KU1BPT0wjR1JFQVRTQUxUREVTRVJUClVTVUFMI0VDT0xFI01BUklORU9ORQpQRVRUWSNTQVdFRCNPVkVSRUFURVI="},{"title":"04/25/16 USER-FRIENDLY","author":"Gail Grabowski","date":"2016-04-25","grid":"U0hBRyNDSEFJUiNTVE9QClBBTEUjTEFETEUjRVJJRQpFRElUI0FUT0xMI1ZPTFQKQ09OU1VNRVJTQUZFVFkjCiNORVRTIyNFQVRFTiMjIwojIyNIQVZFI1lFTiNUQUIKSVNFRSNBR08jI0NISU5BClBBVFJPTk9GVEhFQVJUUwpBTFRFUiMjRklCI0xFSVMKREVFI0JBUiNQT0VUIyMjCiMjI0FJUkVEIyNERUVNIwojQ1VTVE9NRVJTVVJWRVkKTU9OSyNNT0xFUyNUQVRBCkFJREUjQVRURU4jT0RPUgpQTE9EI1NFQUxTI1BFT04="},{"title":"04/26/16 UNDERFOOT","author":"Billie Truitt","date":"2016-04-26","grid":"RUJBWSNHQUdBI0FHUkVFCk1FVEUjT1ZBTCNDUkVBTQpCTEFOS1RJTEUjQ09BU1QKRUxMI1VTREEjQ09VUlRTCkRFTFVERSNTQ09STiMjIwojIyNOT1RFI0hVRERMRUQKQ0FSRFMjU09PTiNGSURPCk9CT0UjU1BVUlQjTEVHTwpERUFSI1RJUkUjUE9TRVIKRUxNVFJFRSNTSUxPIyMjCiMjI0hPSVNUI0NBUlRFTApQSUxFT04jUkVJTiNPTEUKU1RJUlMjUkVEQ0FSUEVUClNOT1VUI1RBSUwjTklOTwpUT05HUyNFVFRFI1NDQU4="},{"title":"04/27/16 THE FOUR TOPS","author":"Fred Piscop","date":"2016-04-27","grid":"TE9TRVIjU09TTyNDQUlOCkFQUExFI0VWSUwjQUxPRQpQRUFLREVNQU5EI1BFV1MKVVJOI1JBSUwjRlJBQ0FTClBBU1NFUlMjQUxBTiMjIwojIyNVU1MjU1RBTkRQQVQKV09STVMjR0xPTSNUT1VSCklNQU0jQ1JJTUUjUkVOTwpTQVJJI09BVFMjQ0FUVFkKUFJFVEVORFMjQk9EIyMjCiMjI1RBTlMjRklSRUFSTQpJTUxBVEUjQkVFTiNWSUkKUEVFTCNDUk9XTlJPQVNUCkFNT0sjVFVORSNPTlNFVApERU5TI1NFRVIjV0VUUlk="},{"title":"04/28/16 PITCHER PERFECT","author":"Greg Johnson","date":"2016-04-28","grid":"UFJBTSNNRURTI1BMT1RTCk9BSFUjRVBJQyNMSU1JVApTUE9VVExBVkEjQU1BTkEKWUFZTUUjI0FSTVlCUkFUCiMjI1VOVE8jQ09ERSMjIwojTU9VVEhUSEVXT1JEUyMKUElQI0hPQk8jI0hFUlRaClRSRUsjVVNNQVAjREFSRQpBVFJJQSMjRVNUTyNXQUQKI0hBTkRMRVJPVUdITFkjCiMjI0dPWUEjRklMRSMjIwpXSElTUEVSUyMjRUFTRVMKRUFUSVQjV0FURVJET1dOCkJMQVpFI0FHT0cjT1JFTwpTT0xFRCNYRU5PI05UU0I="},{"title":"04/29/16 ARBOR DAY PLANTINGS","author":"S.N.","date":"2016-04-29","grid":"TklMRSNBR1JBI0NIRUVLCk9NQU4jU0VBUyNIQVJURQpLQU5ZRVdFU1QjQU1JVEUKSUNFQVhFI1BJQ0tNRVVQCkFTUyNQTFMjI09SRSMjIwojIyNTT0xBUkNIQVJHRVIKVVRURVIjVkVSQSMjT0RFClNFQVRUTEVNT05PUkFJTApNQ0MjI0FNSU4jTkVUVFkKQ0hPUElORVRVREVTIyMjCiMjI0FERCMjU1JJI0FSQgpDVUxERVNBQyNJTExTRUUKUkhPREEjU1RFRUxNSUxMClRPV0VMI0FSQ1MjTkFJTApTSEVEUyNQTE9UI09OQ0U="},{"title":"04/30/16 SATURDAY STUMPER","author":"Anna Stiga","date":"2016-04-30","grid":"TUFDQURBTSNUT1lTUlVTCkFSQUJJQ0EjQUNFVE9ORQpESUxCRVJUI0NIQUlURUEKTkVHQVRFI1RPTyNUSEFXCkVUQSMjI1dVU0EjQ0lURQpTVFJBSU5FUiMjVEhSRUUKU0FZSVRBSU5UU08jQU5ECiMjI0xFU1NFUkFQRSMjIwpTQVAjTUFaREFNSUFUQVMKVFJJT1MjI1BJRUNSVVNUCkFNRU4jU09SVCMjI0dBUApQWVJFI1RXTyNIT01CUkUKTEFPVElBTiNNRVRFT1VUCkVOR09SR0UjQVJUU0FMRQpTVElOS0VSI1JPT1NURVI="},{"title":"05/01/16 CALLING RICHARD: With a hint at 109 Across","author":"Fred Piscop","date":"2016-05-01","grid":"U09MSUQjRURTRUwjQUJVVCNIT1NUCkFNVVNFI0xPT1NFI0xJTUUjRUNITwpDQUJMRU9VVExFVCNUUkFNUExFT04KS05FRVBBRFMjI0lQT0QjUE9QQVJUCiMjIyNFS0UjSEFURVMjIyNMRU5UTwpCSURFTiMjU0FSR0UjQ1lCRVIjIyMKTE9PTSNBUFBMRU9SQ0hBUkQjVExDCk9OVVMjTEVJQSMjI0hBTEUjQkVBTQpCSUIjQk9UVExFT1BFTkVSI0FNTU8KI0NMSUVOVFMjVEhBVyMjI0NTUEFOCiMjRUxFR1kjI0hBVCMjQU5BSUwjIwpDSE9JUiMjI1BFUkkjQUxJR05FRCMKTk9WQSNNT0JJTEVPRkZJQ0UjT1JFCkJSRUQjRUxJRSMjI0xPQk8jU1dBVApDQVIjVkVHRVRBQkxFT0lMI0FMRkEKIyMjVklUQUwjQk9PQVQjI0NPU1RTCldBVkVSIyMjU0xPUFMjQUREIyMjIwpBUkVOQVMjU0VFSyMjVVNFUkJBU0UKTElUVExFT05FI0xJT05IRUFSVEVECkxBVEUjQURBTSNFVkFERSNDSVRFRApTTEVEI1JFUFMjVEVUT04jS0VOTlk="},{"title":"05/02/16 MAY I HELP","author":"Gail Grabowski","date":"2016-05-02","grid":"UFRBIyNDVVRTI09BU0VTClJVVFMjQVRPUCNWSVRBTApJTlRPI0ZBREUjRUxBVEUKTUFJRE9GSE9OT1IjUkVECkVTQ0FQRSMjVEFUVEVSUwojIyMjU0lQUyNUSUUjIyMKQUxTTyNOQVRPI01BUExFCk1BSU5URU5BTkNFQ1JFVwpBR1JFRSNTSUxMI0hZREUKIyMjUEFMI0RZRUQjIyMjClNQQU1NRUQjI0FJU0xFUwpUQVIjTUFJTElOR0xJU1QKQUxPSEEjTklDRSNJVFNZClJFTUlUI0VWRVMjTUVBTApUUkFERSNSRVNUIyNSWUU="},{"title":"05/03/16 RESIDENCE MENU","author":"Sally R. Stein","date":"2016-05-03","grid":"I0RFUyNDSEVGI0FQTFVTCkFSTVkjUk9MRSNDUkFTSApCRUFOI0VBU0UjVE9SQ0gKUkFOQ0hEUkVTU0lORyMjCkFNQSNBSUQjI0FOR0VMUwpERVRFU1QjU01VRyNTRUEKRVJFQ1QjVE9BRCNBVE9QCiMjI0hPTUVGUklFUyMjIwpXQUNPI0VSQVMjQUlTTEUKRVJSI1JBTVMjQ1JBTkVTCkJFQVRFTiMjUE9UI0VTVAojI0NPVFRBR0VDSEVFU0UKQU5LTEUjTk9OTyNUUkVFClJPTExTI1RBQ08jVEVFTQpDUkVTVCNFREVOI0VEUyM="},{"title":"05/04/16 QUINTET OF CLUES","author":"Charles Slack","date":"2016-05-04","grid":"T0xERVIjQVZJViNQQVRICk5BSVZFI01JTkkjQUNIRQpUSVJFVFJBQ0tTI0lSQU4KT0RFI09PWkUjVVNORVdTCiMjIyNST0UjTUFMVCMjIwpEUklGVFMjTElMQUNTIyMKSUFHTyNUQUlMI1RIVU1QClNJTE9TI0ROQSNTSU5BSQpDTE9USCNERU5TI1BVUkUKIyNPUEVORUQjQ0FTUEVSCiMjI1JFRUQjV09XIyMjIwpTUFJJTlQjU09GQSNGQkkKTk9PTiNIQUlSRklCRVJTCkFMT1QjRUdHUyNUT1RBTApHRVRTI1JFTlQjU1dFREU="},{"title":"05/05/16 FOR THE BOYS","author":"Billie Truitt","date":"2016-05-05","grid":"QUNIRUQjQk9XUyNZRUFIClFVSVRPI0VSSUUjQUNMVQpBUk5BWiNOSU5BI01PTFQKQkFUVEVSSU5HUkFNIyMjCkFEUyNESU5HI0NMRUFOUwojIyNQT1AjI0NIQVJMSUUKVEhJRUYjR0xBTSMjQkVFCkJBTkdGT1JPTkVTQlVDSwpPV0wjI1hPVVQjVElNRVMKTkVBVE5JSyMjQkFOIyMjCkVEV09PRCNTVFVOI01JTAojIyNGUkFOQ0lTRFJBS0UKQ0hFRiNORUFSI0FFVE5BClNBTEUjVElMRSNSQVpPUgpUWUtFI1NMRUQjRFJPV04="},{"title":"05/06/16 SHAKING THINGS UP","author":"Bruce Venzke","date":"2016-05-06","grid":"RVRTI1NBUCNJVFMjQUNTCkxBVFJPQkUjR1JJU1RMRQpJUFJFRkVSI0xBU1RET04KI1dBU1RFI05PTSNSQVRTCkxBVFRFI1BFT1BMRVdITwpBVEUjUk9PVFMjSU5ORVIKQkVHUyNQT1cjTVNHIyMjCiNST0NLVEhFQk9BVFRPIwojIyNBSVMjSVJWI0hPUEUKU0NBTEUjQUdORVcjUk9EClBFT1BMRVdITyNBVEVTVApFVFJFI01BVCNQUk9EUyMKV0VUTE9PSyNKVU1QT1VUCkVSQVNVUkUjQUxMT1dNRQpEQVMjUllOI0JMWSNOU0E="},{"title":"05/07/16 SATURDAY STUMPER","author":"Lars G. Doubleday","date":"2016-05-07","grid":"QVNIVFJBWVMjRkxBU0tTClNQSUtFTEVFI0xFRlRJRQpBVVRPTE9BTiNVTkxBQ0UKUERTI0FPUlRBI1RBTktTCiMjI09YRk9SRENPTU1BIwpTQ09UIyNOQUlMI0VVUk8KTEFDT1NURSNOQUIjU09MCkFSQ0hFUiMjI1JBRElVTQpQR0EjV0lHI01BUklBTk8KU09TQSNFTFNBIyNPTERTCiNQSUxURE9XTk1BTiMjIwpTTE9QRSNCQU5BTCNNVlAKTEFOSU5BI1RFTVBMQVRFCklOQU5FUiNBUk1IT0xFUwpERUxFVEUjVFNBQUdFTlQ="},{"title":"05/08/16 THEY'RE AT WORK: All around the office","author":"Gail Grabowski","date":"2016-05-08","grid":"Q09NRlkjU1BBVCNTT05BUiNTT0RBCkRVQkFJI0hPUkEjQVBFUlkjQVBFWApUUkFERVBBUEVSI1RJQ0tFUlRBUEUKIyMjRUxPUEVTI1dJTksjI1lFTFBTCk1BUCNEUklQI0NBTkUjQ1BBIyMjIwpBTEEjU0VSSUFMUyMjSVJPTkNIRUYKSkVSSyNTT1VTQVBIT05FUyNMQVZFCk9QVElDIyNTSVIjT05TRVQjRUxJQQpSSFlUSE1TI1NBV0ZJVCNTTUFMTFMKIyNTRUVUSEUjI0FGT09UI1VOTUVUCkFDVCNFVkVOVFBMQU5ORVJTI09SUwpQTEFUUyNTVE9SSyMjRU5TSUdOIyMKUEFQQVlBI0FSSVNFUyNTVEFSSU5HCkxVTFUjV0FJVFMjR0FCIyNMSVRFUgpFREVOI01JTEVNQVJLRVJTI05PVkEKVEVTVEJBTlMjI1lFU0xFVFMjUkVECiMjIyNPTlQjRlJFVCNJTElFI1NSUwpQTEVBUyMjRFVPUyNTVEFMTFMjIyMKTEFVTkNIUEFEUyNDQVRUTEVQRU5TCkFDUkUjTUVSR0UjT0dMRSNDVVJJTwpZRU9XI01BTkVTI1dFRUQjVFJBUFM="},{"title":"05/09/16 HINGED QUARTET","author":"Gail Grabowski","date":"2016-05-09","grid":"U0tFV1MjUEFTUyNQRUFTCklOTEFXI0FTQVAjSU5DSApQT1NTRSNESVZBI0FUVEEKU1RFUExBRERFUiNORUFSCiMjIyNUSUxFIyNXT1JTRQpQUkVDRURFI0FSQUIjIyMKU09SRVIjI1NUQUdFU0VUClNBSUQjSE9MRVkjTlVLRQpUUkVBU1VSWSMjQUNSRVMKIyMjUk9NRSNSQVNIRVNUClNQSUNZIyNQT09IIyMjIwpIQVNII0VZRUdMQVNTRVMKUlVMRSNTQVNFI01PTlRFClVTRVMjUExPVCNFTEFURQpCRVNUI05FU1MjRE9QRVM="},{"title":"05/10/16 GETAWAYS","author":"Billie Truitt","date":"2016-05-10","grid":"SElQUyNTTUVMTCNDQVJUCklET0wjVEVQRUUjVVNFUgpURUxFI0FTSUFOI1RBQ08KTUFLRVRSQUNLUyNBQlVUCkVMQVRFRCMjU0VBTkNFUwojIyMjTk9STSNTQUQjIyMKVEhJUyNNT0FUI0FSRE9SCldPUktTI01QSCNTVUVERQpPTlNFVCNQTFVTI05FRUQKIyMjRE9DI0VERU4jIyMjClNPREFQT1AjI0FSTUFEQQpMQVJEI0hJR0hUQUlMSVQKT0tFRCNPTkVBVCNUT0dPCk1FQUwjU1RBTEwjVEhJTgpPTk1FI1RPUlRFI1NBTkU="},{"title":"05/11/16 SO-SO","author":"Charles Slack","date":"2016-05-11","grid":"QkFBI0VTUyNIRUFERVIjCk9GRkVSVVAjVU1QSVJFIwpOT1RHUkVBVE5PVEJBRCMKRE9FUiMjTUFUVEVTIyMjClNUUkVTUyNVU0VTI01BTgojIyNUQVBTIyMjVEhPU0UKSFVFI01BTlVBTCNBQ0hFClVORElTVElOR1VJU0hFRApTVElSI1NQT09OUyNBTlkKS0lURVMjIyNHQUxTIyMjCllFUyNXSVNII1JFQ0lURQojIyNNRU5UQUwjI0FSRUEKI0ZBSVJUT01JRERMSU5HCiNFTEVWRU4jRklORVNTRQojV0lORVJZI0VQQSNIRVI="},{"title":"05/12/16 WEB-BASED DESIGN","author":"Clive Probert","date":"2016-05-12","grid":"TUFTS1MjQVNLUyNERUNLCkFSRU5BI1NOSVQjUkFSRQpPQ1RFVCNJT1dBI0FTQVAKIyMjV0lMRFdJTERXRVNUCkVCQiNST0UjI0xFQURTIwpHUkFUSVMjQ0xJTUIjIyMKR09USFMjTUFZTyNMQVMjCiNXSEFUV09NRU5XQU5UIwojTkVUI0lNUFMjSU5ORVIKIyMjU1BSQVkjQU5LQVJBCiNQSEFTRSMjTVBHI05OVwpXQVlXSVRIV09SRFMjIyMKT1BFUiNBVUVMI0lQQURTCkxBTkEjUExFRCNOQUdBVApGTEFQI1NVRFMjR1JPU1M="},{"title":"05/13/16 FOR THE 13TH","author":"Fred Piscop","date":"2016-05-13","grid":"RVJST0wjREFZUyNMRUFOCktPQUxBI0VQRUUjRVJHTwpDQVJEU0lORUFDSFNVSVQKT0RFI1RSRVgjI0FNUExFCiMjI0JZT0IjU1BSSVRFUwpCRVNFRU4jSEVSVFojIyMKSVZBTkEjVE9ETyMjU0JBCkxBWUVSU0lOQUJJR01BQwpFU1MjI0FNRU4jTk9VU0UKIyMjRUxST1kjU1RBR0VEClNBTkpVQU4jREFITCMjIwpBTE9FUyMjV0FHRSNBSEEKV0lUQ0hFU0lOQUNPVkVOClVOSVQjTElORCNBTE9GVApQRVRTI0lDS1kjTkVXVFM="},{"title":"05/14/16 SATURDAY STUMPER","author":"Anna Stiga","date":"2016-05-14","grid":"Q0FXRUQjUEVSSyNST0RFCkFMRVZFI0VDSElOQUNFQQpNT05FVCNST09TRVZFTFQKT05DUkVESVQjU0hFQVZFCiNHRVRSSURPRiNJTk5FUgpXVFMjI1NPVUxTIyMjIyMKSElMREEjVFJBSU5BQkxFCkVNQUlMUyMjI05PR09PRApZRVNQTEVBU0UjRE9OTkUKIyMjIyNUQVBBUyMjREVOCldBU1RFI0hPUk9MT0dFIwpBQ0NPUkQjSU1QRVJJQUwKU0hBTkdSSUxBI01FUkdFClBPUlRTSURFUiNNT0xMUwpTT1NPI1BPUksjRVNTRVM="},{"title":"05/15/16 THE WAY WE WORE: Fashion statements of the past","author":"S.N.","date":"2016-05-15","grid":"QUNDVFMjT1ZBTCNTUElUWiNIT1NQClBMVUNLI0RPUkEjQUxHQUUjT1BFUwpCT0JCWVNPQ0tTI0xFR1dBUk1FUlMKU1RBWUhFUkUjU0VUQlkjTEVFUkFUCiMjIyNPQVMjTU9WSUUjQ09QRSMjIwpDQU5ET1IjVE9FSU4jQUxUT0NMRUYKQUxFQ0sjUE9PRExFU0tJUlQjRU1VCk5FSEkjTE9BRCMjI1BJTlkjQklPUwpFUlIjVElFRFlFU0hJUlQjQkFTVEUKU1RVREVOVFMjVEhFVEEjUk9HVUVTCiMjSkFOVVMjUEFSTEUjU09SRVIjIwpTSEFWRVMjQkFJVUwjU1BPSUxFUlMKVEFDSVQjQkVMTEJPVFRPTVMjU0FDCkVMS1MjTE9ORSMjI09QVVMjVFVOQQpFVkUjUkFDQ09PTkNPQVQjSEVJR0wKUEVUUkFSQ0gjVkFVTFQjTU9MVEVECiMjI0VER0UjU0VSQlMjTkFUIyMjIwpST0FESUUjTUVSQ0kjQ09VU1RFQVUKVEFOR09TSE9FUyNDQVBSSVBBTlRTCkVUVFUjU0FUSUUjTElBTSNPTERJRQpTSElNI0VMRU5BI0VMU0EjVEVTVFM="},{"title":"05/16/16 BEAN TONES","author":"Gail Grabowski","date":"2016-05-16","grid":"U1BBUyNTVElSUyNFR0dTCkVBUkwjTkVWRVIjQVJFQQpBUklBI0FNSVNTI1NFQVMKUkVEQ0FSUEVUI1NFRVJTCiMjI0tJTFRTI1NLSU4jIwpGT1lFUlMjI1RXSU5CRUQKT1BFTlMjR0xFQU0jRVJBCkFUTCMjSk9JTlQjI1JPVApMSUwjVFVORVMjU1dFREUKU05PV0lORyMjU0VBVEVECiMjV0FMSyNTVEVFUiMjIwpKT0xJRSNCTEFDS0JFTFQKRURJVCNUUklLRSNMVUFVCldJTkUjQUlERUQjRVJJTgpTRUVEI0dFRVNFI1NPREE="},{"title":"05/17/16 ASPIRATIONAL","author":"Billie Truitt","date":"2016-05-17","grid":"Q0xBRCNLSVNTI1RBTE9OCkhVTEEjSURMRSNFTE9QRQpVTklUI05FQVQjQ0FGRVMKTUFLSU5HQVdJU0gjVE5UClBSRU5VUCMjTk9JU1kjIwojIyNHUklMTCNSRUlHTlMKUEFSI1NOT09aRSNUT09MCk9GQUdFI0RPRSNURUFTRQpNQVlPI0pFVFNLSSNMRUQKUFJPTlRPI1NUQVJUIyMjCiMjRkVBU1QjI1JFQVJNUwpBU0gjSUhBVkVBRFJFQU0KU0NPUk4jU0lMTyNUVU5FCktBUFVUI1RBTEsjQVNJQQpTVEVNUyNFTFNFI05FQVI="},{"title":"05/18/16 WW2","author":"Fred Piscop","date":"2016-05-18","grid":"U0VDVCNIRUFUI0FXQVJECkVMTEUjQVVSQSNMSU1CTwpXT09EU0NSRVcjSVRTSU4KVVBTI01JTyNORVRDT1NUClBFRVdFRSNTWU5USCMjIwojIyNIRU5OQSNTTEVJR0gKUEVUQSNEVU1QI0VTU0FZCkVYSVQjQU1QTEUjQkxJUApPUEVEUyNCUkFHI1JFTk8KTk9ST09NI0FOR0xFIyMjCiMjI0lST05TI1JBV0VTVApORUNLVElFI0NPTiNMRU8KQUxJTkUjV09STERWSUVXCkdBVE9SI1RPSUwjQVRUTgpTTEVXUyNTT0JTI0NFT1M="},{"title":"05/19/16 BAD LOCATION","author":"Bruce Venzke","date":"2016-05-19","grid":"Q1JUUyNURUFLI1JPT1NUCk9IT0gjQVhPTiNBTkdMRQpOSU5PI0tFTk8jU1RSVVQKQU5ZV0hFUkVCVVRIRVJFCk5PU0lFU1QjI01BRSMjIwojIyNOUkEjUkRBI1NMQVcKR0lTI09JTEVSI1NMSUNFCk5PVElOTVlCQUNLWUFSRApBV0FDUyNOSVRSTyNSRVMKV0FHRSNBTkQjT1BTIyMjCiMjI0hVQiMjSlVKVUJFUwpHT1NPTUVQTEFDRUVMU0UKT1dOVVAjT1VDSCNET1NFClJFVVNFI01BS0UjRUtFRApFREdFRCNQVVNTI1NFWFk="},{"title":"05/20/16 C THE WORLD","author":"S.N.","date":"2016-05-20","grid":"SEFSQVNTI0NVU1AjTURTCkVNRVJJTCNBUEVSVFVSRQpDQU1FUk9PTkNST0FUSUEKVVpJI0VTVEEjRk9HSU4jCkJFTkQjSElERSNGVU5LUwpBRElFVSNTQVJBI1BFU08KIyMjQ1NBI0NJVEUjRVRECkNPTE9NQklBQ09NT1JPUwpBVkEjQ0NDUCNNVUQjIyMKS0VQSSNTRUVSI1NFRVBTCkVSUk9SI1RWQUQjU05BUAojVE9URU0jRUdPUyNHUkUKQ1VCQUNZUFJVU0NISUxFClBSRVNVTUVEI0VBUk5FRApSTlMjVFlQRSNTTkVFWlk="},{"title":"05/21/16 SATURDAY STUMPER","author":"Frank Longo","date":"2016-05-21","grid":"Q1pBUlMjSEFTUCNQQVBBClJFTU9URUFSRUEjT05FUwpBQk9WRVdBVEVSI09UT0gKQlVTSU5FU1NNQUNISU5FCiMjI05PUyMjI0xPQiMjIwpGQU5HIyNGQUNFQ0FSRFMKSVNPI1RIRUJJR0NISUxMClNLSSNIT0xJREFZI0NJQQpURVNMQU1PREVMWCNIU1QKU1dFRVRFTkVSIyNTRVRTCiMjI0VTUCMjI1VTQyMjIwpDSE9DT0xBVEVTSEFLRVMKSEFTSCNBTUFURVVSSVNICkVMTEUjVElNT1JMRVNURQpXT09TI0VERU4jQVNTQUQ="},{"title":"05/22/16 BETWEEN THE LINES: Not quite as subtle as it sounds","author":"Mark McClain","date":"2016-05-22","grid":"QUdSRUUjI0FMUE8jRE9TRSMjRERUCkNSRUVQI0FTRUFUI0VYRVMjWUVBSApMQUNLT0ZTUElORSNCWUVTI0FMVE8KVU5EI0NSQVNTRVIjQUREI0FDSEVTCiMjI1NIT0QjI0xJTkNPTE5TSElSRQpISUdII0dBU1AjI0lMTElDSVQjIyMKRU5JQUMjI1RVU1NMRSNOSVQjQUJTCkxPQkxPTExZUElORSNQR1MjQkxFVwpQUkVFTUlFI0FNQSNHQVMjQ0lHTkEKIyMjI0FOTkkjSVJXSU4jU0xFQVpZCiMjTElLRUFST0xMSU5HU1RPTkUjIwpTVEFNRU4jS05FRUwjU09BUiMjIyMKUUFUQVIjREVFI0RMUiNMSUVTTE9XCkZMRVgjQ1VEI0xBQllSSU5USElORQpURVgjT0hNI0dBVEVBVSMjU0FUVVAKIyMjVFJJUE9MSSMjTkVTVCNXRVNUCkxJWkNMQUlCT1JORSMjUEhJTCMjIwpIT09FWSNORVcjT05HVUFSRCNWSU0KQVdPTCNPR1JFI0xFQU5DVUlTSU5FClNBTUwjQk9PUiNBUklERSNPSU5LUwpBU1MjI0lOTlMjTk9OTyMjVFJFWVM="},{"title":"05/23/16 TEAM PLAYERS","author":"Gail Grabowski","date":"2016-05-23","grid":"T0RFUyNERUxBWSNTQ09UClBFTFQjRVhJTEUjQ0xVRQpFQVNFI01BTkVTI1JVU0UKQ1JFV1NPQ0tTI0RFQlRTCiMjI0FVTlRTI01PV1MjIwpTUFVSTlMjI1NJRVNUQSMKUE9ORFMjQ0hBVFMjRVNQCkFTSVMjUk9BU1QjQkFTRQpNRVQjTElTVFMjVE9LRU4KI1NQUklOVCMjQk9PU1RTCiMjUkVFSyNTTEVFVCMjIwpDSElMRCNTUVVBRENBUlMKTEFDRSNUQVVOVCNBUkVBCkFNRU4jSU1BR0UjTUlTUwpQU1NUI1BFVEVSI1BBVEg="},{"title":"05/24/16 THE INN CROWD","author":"Billie Truitt","date":"2016-05-24","grid":"U1BBUyNVU1BTI1JVTEVTCkxPR08jU0VBVCNPU0FLQQpPUEVOI0VSSUUjQ0FNRUwKQkVEQU5EQlJFQUtGQVNUCiMjI1JBVCMjTEJTIyMjIwpBTVAjUE9MTyNTVElHTUEKQkFSRSNJT1dBI0FUTEFTCkJSSUdIVEFOREJSRUVaWQpSSURHRSNGSURPI01BREUKU0VFU0FXI1RST1QjTUFUCiMjIyNWQVQjI0tPUyMjIwpCSUdHRVJBTkRCRVRURVIKQURPUk4jUEFSQSNST0xFClJFT0lMI0FHT0cjQVJNUwpOQU5OWSNUU1BTI1BFU1Q="},{"title":"05/25/16 NAMING RIGHTS","author":"S.N.","date":"2016-05-25","grid":"U0FDSFMjVFVET1IjUkFGCkNSVUVUI0lORElFI0FMSQpSVVRIUkVOREVMTCNZT04KQUJFI1VQVE8jV0FSUkVOClBBUkFERVMjTUVUT08jIwojIyNMRUUjRElMRU1NQVMKQ09SQUwjSElMTCNTQUxUCk9ERSNTSFlORVNTI05FQQpNT05BI0lQT1MjRVBPWFkKUFJFUEFSRVMjU0FPIyMjCiMjUk9WRVMjVklCUkFOVApDT1VQRVMjREVMSSNTRUUKQUJTI1JPQkVSVFJFSUNICkxPUyNUVVJOUyNEUkFLRQpDRU8jU1RBVEUjU0VOU0U="},{"title":"05/26/16 INITIALIZATION","author":"Fred Piscop","date":"2016-05-26","grid":"QVJHTyNTUEFNI1NBTFNBClNJTEsjTEFSQSNDUkVBTQpQQVVMR0VUVFkjT0JFU0UKQ0xFQVJFUiNBRVJPQkVTCkFTUyNBVk9OI1ZFUkEjIwojIyNFWUVMSU5FUiNJUkEKU09GQVMjI0NPTiNQTEFOCk9BUlMjT1ZFUlQjUkVJRApXSEFUI0ZJVCMjQ09ZTFkKTlVOI1NUQVJXQVJTIyMjCiMjS0FMRSNZQUxFI01BVgpTQUJSSU5BI1RJRUdBTUUKUExBSUQjUk9TU1BFUk9UCkFCVVNFI0NMT1QjTElOVApUQU1FUiNIRU5TI1NBR0U="},{"title":"05/27/16 KEEP QUIET","author":"Carolyn Stewart","date":"2016-05-27","grid":"VFdFUlAjQUhFQUQjUERRClJJR09SI0NVUklFI0lPVQpFTkdMSVNISE9STiNORUEKRVNTRU5DRSNTUElERVJZCiMjIyNDQUQjI0xFQSMjIwpDSEFMRVQjU01BU0hISVQKT0FTRVMjSFVFWSNMQU5FClZJU0FTI1VQUyNCSUxMUwpFS0VTI1BMRUEjUkFWRUwKUlVTSEhPVVIjUEVTRVRBCiMjI0VFTCMjVEVBIyMjIwpTRUFTQUxUI1dBVFRMRVMKVFVYI1JVQkJJU0hIRUFQClVSTCNTVEFJTiNFUkFTRQpET0UjVEVSTlMjRFVQRUQ="},{"title":"05/28/16 SATURDAY STUMPER","author":"Doug Peterson","date":"2016-05-28","grid":"QURPUkFCTEUjQ1dQT1NUCkpPS0VCT09LI1NFQU5DRQpBTkVDRE9URSNQQVJUT04KUkVET1VCVCNET05BSFVFCiMjI1BMWSNUQVQjREVOVApGTEFZI1RSQVkjQklSRCMKSU9OI1RSSVgjQUxHT1JFCk5PVEFIQVBQWUNBTVBFUgpTS0lDQVAjUkVBTSNFTEkKI0VWQU4jREVQUCNBU1NOCklERUQjQk9QI1BJUyMjIwpESU5FRElOI1RFRFRBTEsKQU5JTUFMI0dBTExFUklBCkhPTklORyNBTExFUkdFTgpPTlNBTEUjR0xBU05PU1Q="},{"title":"05/29/16 THEME OF VARIATIONS: But with much in common","author":"S.N.","date":"2016-05-29","grid":"RkxVU0gjU0FMRSNNSVNUUyNQQVRFCkFPUlRBI1BMT1kjQURIT0MjT1JBTApMT1NJTkdGQUNFI0NMT05FI01JTEwKQU5BTEdFU0lBI0tFRVBJTkdQQUNFCiMjI0VFTiMjTEFJRCMjI1RPRSMjIwpNQVRUUkVTUyNBUk9NQVMjUk9HRVIKUExBVCNSRUFDSElOR0JBU0UjSVJBCkVMS08jT1dOUyNOSU1CTEUjQVZJRApHQUkjUFVORElUI0FURU9OI1ZJQ0kKU1lOVEhTI0FOQVQjIyNNVFNJTkFJCiMjR09BI0ZMWUlOR0FDRSNMQUcjIwpDQVBJVE9MIyMjVEFDSCNQT05DSE8KTE9MTCNSVU5BVCNTVE9XSVQjSElQCkFMQVMjQ1JJTUVBI1VSQUwjREFSRQpORUMjUEFSS0lOR1NQQUNFI1VTRUQKR1JFVEEjWUVOVEFTI0xPVURORVNTCiMjI01JQSMjI0FUVE4jI1BJRyMjIwpTQVZJTkdHUkFDRSNBTkdPUkFDQVQKT01BTiNJTkFMTCNTS0lJTkdSQUNFCk1FTlUjVEFTVEUjTEVOVCNFRVJJRQpFWEVTI0FUSE9TI09ERVMjU0VFRFM="},{"title":"05/30/16 NOW HEAR THIS","author":"Gail Grabowski","date":"2016-05-30","grid":"I05VTUIjREVBTiNNT0JTClNPTkFSI0FYTEUjSVNMRQpJTlRSTyNSRVNUI0dMVUUKVE9PVE9ORVNPV05IT1JOCiMjIyNLT0QjI09BVCMjIwpJTVRPTEQjU1BSWSNVU0EKVEVSUlkjUE9FVCNBVE9NCkNMRUFOQVNBV0hJU1RMRQpIRUVMI0NBUFMjVElFSU4KWUVTI0NJVFkjQkVBUkRTCiMjI0FORCMjT0FSIyMjIwpET0VTTlRSSU5HQUJFTEwKT1BVUyNFT05TI1RBQk9PCkNBUkUjU0FGRSNFTEJPVwpTTE9UI1RST1QjREVTSyM="},{"title":"05/31/16 CALENDAR CHOICES","author":"Sally R. Stein","date":"2016-05-31","grid":"TUVOU0EjQUxNQSNDQVRTCkJSQUlOI1JFRUwjQVJJQQpBSVNMRSNTQUxUI1JFTlQKI0NBVENIT0ZUSEVEQVkjCiMjIyNESU4jI09BUyMjIwpMQVBUT1AjUk9VVCNFUkEKQUxMT1QjRElORyNFWEVTClBMQVlFUk9GVEhFV0VFSwpTT05TI09TTE8jVkVSU0UKRVlFI0ZMRUUjVEVTVEVECiMjI0FJTCMjQUlSIyMjIwojU09OR09GVEhFWUVBUiMKUEVSSyNWQVJZI09SQklUCkhFQUwjRVJJRSNOSUVDRQpJRExFI1JFUFMjRU5ERUQ="},{"title":"06/01/16 LEGAL MATTERS","author":"Carolyn Stewart","date":"2016-06-01","grid":"Q0hJUCNSRVZTI0RFUkJZCkhFUkUjT1hFTiNFWElMRQpJUkFTI01FTlUjU1VOVVAKQ09OVFJBQ1RCUklER0UjCiMjIyNFTlMjI09SRSMjIwpBTE1PU1QjU01FRSNBQUgKQk9PS1RJVExFI0RPREdFCkFVUkEjQ0FVU0UjRElSRQpTVEFZUyNCUkFWRURFRUQKRVNMI1RPU1MjSVNTVUVTCiMjI0FSRiMjQUxBIyMjIwojQlJJRUZFTkNPVU5URVIKR09PU0UjRE9PTSNFVVJPCkVYQUxUI0lOUkUjQUJJVApMWVJFUyNURU5OI1JBQ0U="},{"title":"06/02/16 WHAT'S THE CATCH?","author":"Matthew Sewell","date":"2016-06-02","grid":"V0FMTEUjTVBBQSNKQURFCklERUFTI1lFTlMjT1RJUwpHUkFOVCNUUklQI0VMU0UKV0FWRUFXSElURUZMQUcjCkFURSMjSVNMQU5EI05VTgpNRVNTRUQjIyMjUkFUSU8KIyMjUExFQURFRCNMSVNUCiNUUkFJTkZPUkFSQUNFIwpDSEVSI1NURVJOVU0jIyMKSFVTS1MjIyMjQVRPRERTCkVNVCNQQVNTT04jI1JVRQojQlJFQUtORVdHUk9VTkQKRVdBTiNSSU1FI0FCSURFCk1BSUQjT0RJTiNDT0RFUgpVUk5TI05FU1MjWUVTRVM="},{"title":"06/03/16 SOUNDS LIKE DOUBLING","author":"S.N.","date":"2016-06-03","grid":"TVBBQSNTUEFNUyNBTEFOCldJTkQjQ0xJTUUjUk9NQQpBTUlEI0hBUkRFU1RXT04KSEFNRUxJTiNWQVFVRVJPCiMjQVJJU0VOI0ZVUiMjIwpDQUxMQVRURU5USU9OVE8KSU5GRVIjI0VZRUQjRUFVClZEQVkjVU5ERVIjTEFTVApJUlIjQVNBTiMjUElQRVIKQ09NSU5HVE9USEVGT1JFCiMjI1NJUiNUUk9XRUwjIwpIRUVMVEFQI0lOU1RJTEwKQUxSRUFEWUFURSNJVEFMClNMSVQjRUxSRVkjTUFJRApQRUNTI0JFRVJTI0VORFM="},{"title":"06/04/16 SATURDAY STUMPER","author":"Brad Wilber","date":"2016-06-04","grid":"I1NUT0tFRCNCTFVTSEVTClNUT1BQTEUjUklCTUVBVApURUFTSE9QI09OQUxBUksKQUZUIyNJT01PVEgjVE1JCk1BVVZFI1RPS0VOI0hBVApFTlJPTEwjTkZMI1BFUlQKTklOT1RDSEtBI1BBUktTCiMjI0RPRE8jUkFIUyMjIwpNQUNPTiNTQU1NWUNBSE4KRUNITyNIRVgjUExBUVVFCkFIQSNMQURFTiNBTFVNUwpOSU4jT0xEU0FXIyNBTVQKREVDQVJMTyNDQVJBTUVMCkVWRU5OT1cjSEFZQkFMRQpSRUREQVdOI09DRUFOUyM="},{"title":"06/05/16 FIT TO BE TIED: We think knot","author":"Gail Grabowski","date":"2016-06-05","grid":"U01BU0gjTUFHSSNOSVRTI0JPR0VZCkFPS0FZI0FGUk8jT05FSyNJUkFURQpTUElOU0FZQVJOI1NUUklOR0JFQU4KU0VORFNGT1IjI0VXRVIjQUxJQVMjCiMjI0JPVCMjU09MRUxZI1NFVCMjIwpTVFJBUCNCQUFCQUEjI1BUQSNCQVQKSEFJUiNDT01NT05USFJFQUQjT0xFCkFQQiNTRVNBTUUjI0VFTFMjVFdJTgpSRUIjVEVTVFkjSUxMU0VFI09BVFMKUFJPRlVTRSMjVU5DTEUjI0NBTk9FCiMjTk9EI1NDQVJGRE9XTiNBREQjIwpERUNPWSMjTFVHRVMjI09MRFNBTFQKT1ZBTCNTUEFERVIjRkFWT1IjUk9PClRFTlMjVEVSSSMjU0xVSUNFI1JPVwpFTkQjTEFDRVRIRVBVTkNII1BPU0UKU1RZI0VUUyMjSU5DSVRFI0ZFV0VSCiMjI1RBVSNBQlJPQUQjI0JSUiMjIwojSEVJU1QjRE9FUyMjU1BST1VUVVAKQ1VUVEhFQ09SRCNXSU5ET1dTQVNIClNUQUxFI09SRU8jQVJJQSNOQU1FRApJU0xFUyNCRVJOI0dBUFMjU0xFRFM="},{"title":"06/06/16 NOW YOU'RE TALKING","author":"Gail Grabowski","date":"2016-06-06","grid":"VE9BU1QjQUNSRSNTVEVQCkFSQk9SI0xPQU4jVElNRQpORUVEWSNUSU5UI1JFSU4KI1NUQVRFT0ZUSEVBUlQjCiMjIyNIUlMjI1JBVyMjIwpTTEFURVMjQUZBUiNBQ1MKVEFQQVMjUFVMTCNFVEFMCkVYUFJFU1NERUxJVkVSWQpFRUxTI1BBSUQjSEVBVkUKUFJZI1BBVFMjUE9TVEVSCiMjI1NJUiMjSU1QIyMjIwojVVRURVJOT05TRU5TRSMKSUtFQSNPQUtTI05BSVZFClJFQVIjV0lSRSNPUFRFRApBU0tTI1NMQVQjVEVFTlM="},{"title":"06/07/16 DOZENS OF THINGS","author":"Sally R. Stein","date":"2016-06-07","grid":"U1BFV1MjRlJPRyNaQVBTCk9MRElFI0xBTkUjRVhFQwpST0dFUiNFTUlUI0FMQUkKVFdFTFZFQVBPU1RMRVMjCiMjI0RFTiMjTkVXIyMjIwpOSVBTI0pPVCNURUVURVIKT09PI1NPQVJTI0FST01BClRXRU5UWUZPVVJLQVJBVApTQU1CQSNTVElFUyNUSUUKT05TQUxFI1NUTCNHRUxTCiMjIyNFU1MjI0FDRSMjIwojVEhJUlRZU0lYSE9VUlMKUVVJUCNBUkFCI0VSTklFClVTREEjVElNRSNBR0lMRQpPS0VEI0VBU1QjUEVURVI="},{"title":"06/08/16 FINAL ANALYSIS","author":"Carolyn Stewart","date":"2016-06-08","grid":"T1JBTCNHTE9CUyNMQVZBClJBUkUjUk9HRVQjSUNFRApBQ01FI0FPUlRBI0VBUlMKQ0hBUkFDVEVSU1RVRFkjCkxFRCNURUUjQUhBI0VXRQpFTEFURSNEQVkjUkFNRU4KIyMjUkFHI0JBTiNNSUxECiNDUklNSU5BTFRSSUFMIwpNQUFNI05VVCNIVUcjIyMKQVJUU1kjUkVTI1RPVEFMCk5BSCNFQVQjRURUI1dJSQojVk9DQUJVTEFSWVRFU1QKR0FMQSNJUk9OWSNFTExFCk9ORVMjREVVQ0UjRVZFUgpQU1NUI0VTVEVSI05FU1M="},{"title":"06/09/16 NO NEWS","author":"Fred Piscop","date":"2016-06-09","grid":"QUdBVEUjT0xBWSNBVEFEClJBVEVEI1JBR0UjU1VSRQpPTEJMVUVFWUVTI0NSRVcKTUVBIyNBQlMjSU1PS0FZCkFOWU1PUkUjU0tBVEUjIwojIyNBVUxETEFOR1NZTkUKREVCVVQjI0FNT1MjRE9XCk9WQUwjQUdORVcjTUFORQpORUQjT0xFRyMjTUFZT1IKR1JBTkRPTEVPUFJZIyMjCiMjUElPVVMjQkFUU0ZPUgpBTVBFUkUjVEVOIyNMSVUKVEFMQyNUV09ZRUFST0xEClRSRUUjVE9ORSNDT09FRApORVNTI0VOSUQjVEVSUlk="},{"title":"06/10/16 TWIST TIES","author":"Billie Truitt","date":"2016-06-10","grid":"R0FTWCNBSU1TI0xBU1NPCk9MQVkjTE9VVCNMSVRFUgpUSUxMI1VOVE8jQlJFV1MKSVRTRUVNU1RPTUUjSVNPClRPQU1BTiMjTFVBTk4jIwojIyMjRElBWiNTTk9CQlkKQkxFU1MjU0VQVCNURVJBCkxPU1QjT0hCT1kjU0NBUgpBTFRPI1pFUk8jVE9LRU4KSEFJUkRPI0FSTVkjIyMjCiMjTUVBTlMjI09SQUNMRQpETkEjU0VUSU5NT1RJT04KTUFUQ0gjT05DRSNPVklECkFERUxFI0lDQU4jTUlSRQpKQURFUyNDSEFUI1NMRUQ="},{"title":"06/11/16 SATURDAY STUMPER","author":"Frank Longo","date":"2016-06-11","grid":"QUxFUyNSQU5DSCNTVVBTCkNFTFQjQUlPTEkjQU5FVwpUQURBI1RSQUlUI1ZJVE8KU1BPUlRTU0hPUCNFVkVSCiNPUkZFTyMjI0FCT0FSRApBVkFJTCNTVEZSQU5DSVMKTUVEUyNPQ1VMQVIjIyMjClBST0hJQklURURCWUxBVwojIyMjUkVGVVNFI09BVEgKUEFTVEFESVNII1BVVFRZCkFSTUFOSSMjI01FRElBIwpJUklTI0VBU1RPUkFOR0UKUklMRSNOQVBFUyNNQUlMClVCRVIjQ0hBUlMjQVRSQQpQQVlTI0VTU0FZI05FTEw="},{"title":"06/12/16 SWITCHEROO: With too-for-won odds","author":"Mark McClain","date":"2016-06-12","grid":"UFVUVCNESUFORSNERUJVRyNBU09GCkFTSEUjRVJST0wjT01FR0EjQkVBVQpORUFSI0NBQ0hFQ1pFQ0hTI0FBSFMKR1JJTlNBVCMjQ0xFUksjTElUTVVTCiMjI0NPTEUjU1RPTlkjU0lORVcjIwpTQUxPTlMjUExPV1MjQklOUyNSRUIKQ0xPVFMjWUVBUk4jUFVHRVQjSUlJClJBQ0UjVEVBTSMjI0lOTiMjQUdFRApBTUEjI0JBU1NCT1JFRCNBUkNISUUKUE9MQVJJUyMjRU5BQ1QjQ0FSVE9OCiMjI1NPUlQjUExBTkUjQUNNRSMjIwpTT1NQQUQjQUhPTEQjI1RFQVNFUlMKVEhFSVJTI0ZPV0xCQVdMUyMjTE9QClBBUkUjI05PTiMjI0xFQVMjSEVBUgpBUkkjREVDT1kjVEFJTFMjSE9OREEKVEVBI0lOSVQjSkFERUQjR09MQVNUCiMjTEFORFMjWVVLT04jTElNRSMjIwpBS0lOVE8jVE9ORVIjI09CRVlJTkcKTEVTVCNXRUFLS05JR0hUUyNTQ0FSCkRFTEkjRVNURUUjTk9EVE8jRUFWRQpPUEVDI0RFQUxUI0dPTEFOI0FORVc="},{"title":"06/13/16 HIGH-MINDED","author":"Gail Grabowski","date":"2016-06-13","grid":"TUFSVCNDSElSUCNDSEFQCkFMT0UjT1VURVIjTElNRQpUQVRBI1VOQ0xFI0lLRUEKSElFUkFSQ0hZI1NQSU5TCiMjI09BVEgjI1BFT04jIwpBQkhPUlMjVFJJQU5HTEUKQ1JJTVAjU0VBVFMjUEFOClRBUlMjU1VSRlMjWUFSRApFVkUjQUxJU1QjTEVUR08KREVESUNBVEUjQ0FTSEVXCiMjSEFSUCMjQVJJQSMjIwpCTEFNRSNISUJFUk5BVEUKVEVOVCNSRUNBUCNEUlVNClVORE8jSVJBVEUjTkVTVApTT1NPI0JPTkVTI09BS1M="},{"title":"06/14/16 FLAG DAY DESSERTS","author":"Billie Truitt","date":"2016-06-14","grid":"U1dBRyNTS0lNI0lTTEVTClBFUlUjVElERSNDQUlSTwpBUklBI1lFTEwjRU5UUlkKUkVEVkVMVkVUQ0FLRSMjCiMjI0FMRSMjU0FHIyMjIwpMQVAjVVNFRCNSRUdHQUUKQUNSSUQjQ1JBRyNNRVRTCldISVRFQ0hPQ09MQVRFUwpOT05PI1JPT00jVU5USUUKU09UUlVFI1BFUk0jT05TCiMjIyNTUEEjI0FQRSMjIwojI0JMVUVCRVJSWVBJRVMKTEFZRVIjRVJJRSNDT0RBCk9OVEFQI1RJQ1MjT1dFUwpTVEVQUyNTQ09UI1RBTlM="},{"title":"06/15/16 EQUINITY","author":"Andy Ellis","date":"2016-06-15","grid":"SE9XRFkjUFNTVCMjQUNUClRBSE9FI1JVUEVFI1VaSQpUSElOUyNJTkFORSNSQU4KUFVUI09MREdSQVlNQVJFCiMjRUVSSUUjI0NPTyMjIwpBVEhBTkQjRkFJUkVTVCMKUEhPVE8jRk9SVEUjQUlSCkVSUlMjQlVMS1kjQU1NTwpTT1MjR0lMRFMjQkxVRVIKI0JFRkFMTFMjTElWRVJZCiMjI0FNTyMjU0VHQUwjIwpQT05ZRVhQUkVTUyNDU0kKUkhPI0xJRUlOI0FUT0xMCkVOVCNZQVJOUyNMVUxVUwpQT0UjI05VS0UjRVhUUkE="},{"title":"06/16/16 MALE MOVIES","author":"Fred Piscop","date":"2016-06-16","grid":"U0VBTCNTSEFQRSNCSURTCkFDUkUjSEVXRUQjVVNEQQpHT09ERkVMTEFTI0JFQUsKQU5BR1JBTSMjI09CRVlTClNPUkVBVCMjQUlEQSMjIwojIyMjVEhFTklDRUdVWVMKQ0FSQlMjQ09SSyNVUkFMClVTRVIjRE9TQVkjTUlMTwpCT05FI1VCRVIjVVBTRVQKQUZFV0dPT0RNRU4jIyMjCiMjI0VBU1QjI1NDSElTTQpXSE9STCMjI0FUTEFOVEEKSEVNSSNGT1JUSEVCT1lTCkVSSUUjQUxPTkUjTElMVApUT1RTI1RFTk9SI0FMRVM="},{"title":"06/17/16 STRIKE FOUR","author":"Carolyn Stewart","date":"2016-06-17","grid":"R1JBU1AjTElNQSNQSERTClBBU1RFI0FSQVQjSEVFUApBUEFSVCNNQUNII0FMVEEKIyNQT1NFQVFVRVNUSU9OCiMjI0xJQyMjTEFPI1hYWApERUFMVEhFQ0FSRFMjIyMKUlVOIyNPVkEjVEFJQ0hJCkFSRU5BI0VORCNTTk9PVApHT1dJTEQjREVBIyNSWUUKIyMjQkxPV09GRlNURUFNCklRUyNBR0UjI0VMUyMjIwpNQVRDSFdJVFNXSVRIIyMKU05JUCNPUkVPI0NSRUVECkVETkEjT0RFUyNFQVJMWQpUQUdTI0RPRE8jU1BPS0U="},{"title":"06/18/16 SATURDAY STUMPER","author":"Lester Ruff","date":"2016-06-18","grid":"UEFFTExBI1lVR09TTEFWCklOTkVFRCNPTk5PVElDRQpOQVRURVIjRFJPUExFVFMKU0VXI1JFREVFTVMjT1VUCkNSSUIjUFVMU0UjQUZBUgpIT05PUiNQRVQjTUNGTFkKRUJFTkVaRVIjTk9SIyMjClJFU09MRVMjUFJJT1JUTwojIyNCQU4jREVBUkJPUk4KTEVST1kjSVJBI0VBVElUCkVWQVMjUFNBTE0jVEFDSApOT1QjSUhPUEVTTyNUT0UKR0xFRVNPTUUjTklORVJTClRWRElOTkVSI0JMQUlORQpIRVJTVE9SWSNDWUdORVQ="},{"title":"06/19/16 TWO-GUY GUYS: Informal and not","author":"Fred Piscop","date":"2016-06-19","grid":"U0VMTUEjU1RVQiNKQUlMUyMjUEFXCkNST0FUI1BPS0UjVU5USUUjQ09MQQpSQVlDSEFSTEVTI1NURVZFQUxMRU4KVVNBI0VMQUwjVE9URU0jU0xFRVZFCkJFTEZBU1QjTUlNSSMjUE9NQURFIwojIyNPUk8jVE9SSUMjRkFVU1QjIyMKQVJHT1QjSk9OU1RFV0FSVCMjSEJPClJFRUQjU1VSRSMjI09XRSNCUkFJRApHSU4jI01BVFREQU1PTiMjTEVOVE8KT0RFI0RJUkUjRVRBTCNTUEFOS0VSCiMjS0xVVEUjU0NPVFMjUEFTVEEjIwpUSEVQUkVaI0tBTEUjU0xJVCNBU0gKSEVMR0EjI0JJTExZSk9FTCMjUklPClVDTEFOI0FVRiMjI0FMRVMjQk9OWQpTS1kjI0pFRkZHT1JET04jQ09OR0EKIyMjU0NBUkYjQVJJRVMjWk9PIyMjCiNQT0NPTk8jI01BVlMjVElQU1RFUgpBTEdPUkUjSVJFTkUjQVJOTyNBTEkKTEFSUllEQVZJRCNUT05ZQ1VSVElTCkxJRU4jT01FR0EjRU5EUyNUSEVTRQpZRFMjI0VTU0FZI1JFU1QjU09SRVI="},{"title":"06/20/16 HAVE A SEAT","author":"Gail Grabowski","date":"2016-06-20","grid":"U0hFRCNDQVRUWSNBUEJTCkxJVkUjQUdSRUUjVE9MTApBWUVTI1JFQUNUI1RSVUUKUEFSS0JFTkNII0RJQ0VECiMjI1dBU1RFI1JJQ0gjIwpBUkJPUlMjI0dVRVNTU08KVElFUlMjQ0hBTlQjV0VEClNPQUsjU0xPVFMjQklSRApFVEMjQVRPTkUjQklOR0UKQVNIQU1FRCMjRk9SR0VSCiMjQ0xJUCNXUklTVCMjIwpBQ0hFRCNDSFVSQ0hQRVcKU09BUiNHT0FMUyNEQVRBClNMSVQjSU5MRVQjQUxBUwpUQVJTI1NFRVJTI1lFTFA="},{"title":"06/21/16 NO AMATEURS","author":"Billie Truitt","date":"2016-06-21","grid":"WkFHUyNQT0xMI0JMRUVQCklETEUjQVJJQSNBT1JUQQpQT09MI1VTRVIjVFJJQUwKUFJPVk9MT05FQ0hFRVNFCllFTUVOIyMjRE9FIyMjIwojIyNTV0FMTE9XI0JJVFMKTEJTI0FMT0UjI0JVUlJPClBST0NSQVNUSU5BVElPTgpHT1VSRCMjSUNPTiNTVFkKQVdSWSNESU5FVFRFIyMjCiMjIyNOQUcjIyNFWENFTApQUk9QT1NFTUFSUklBR0UKU09CRVIjVEFMRSNTSUdOClNQT1JUI0lSQU4jVFJPRApURUVUSCNURVNUI1NPTlM="},{"title":"06/22/16 SMALL CHANGE","author":"Andy Ellis","date":"2016-06-22","grid":"WkFQUyNNSUxFUyNFS0VECklLRUEjQURFQUwjUkFWRQpUSU5ZI1RFQVNFI1VSSVMKSU5OI1FVQVJURVJERUNLCiMjWU9VUlMjI1BBSU5UUwpUT0FURUUjQUdFTlQjIyMKUklOU0UjVUJFUiNFREFNCkVOVCNOT1NJRVNUI0lWRQpTS0VEI1ZFVFMjQURNSVQKIyMjSVdFUkUjQ0xFRVNFClNMSUNFUiMjQlJPV04jIwpOSUNLRUxPREVPTiNPRkYKT0JPRSNPSEFSQSNFVklMCldZTk4jVU5NRVQjUEVSVQpTQVNTI0RPTlRTI0FMRVg="},{"title":"06/23/16 STUCK UP","author":"Matthew Sewell","date":"2016-06-23","grid":"QVBQUyNISVJFUiNBTFBTCkNJQU8jT0hBUkUjUE9PTApBQ0xVI0xPR0lDI1BJVFkKREFJTFlTUEVDSUFMUyMjCklSUyNVVEVTI1BSRUxBVwpBREhFUkUjI1NFQyNBSEkKIyMjQUlSRlJFU0hFTkVSClBVUlIjI0FJTCMjTUVNRQpTSE9QUElOR0xJU1QjIyMKQU5UI09NRyMjQ1VTVE9NClNPQUtVUCNKQUlMI0FDRQojI1JFVElSRUROVU1CRVIKUEFJTiNFQVRNRSNBTEFTCk9LQVkjVFJFRVMjR0VORQpEQU5BI1lBUk5TI0lUU1k="},{"title":"06/24/16 POLESTARS","author":"S.N.","date":"2016-06-24","grid":"QUZUI0FDTUUjQUlUQ0gjCkZFVyNDQVJUI1NQSVJPIwpGUkVERVJJQ0NIT1BJTiMKT1JFSURBIyNMRUQjQ09QClJBVFMjVEhBSVMjT0tSQQpEUkVTUyNBU1AjU05FRVIKU0lERVdBTEsjSVBFVEVSCiMjI01BWEZBQ1RPUiMjIwpCVUJCTEUjV0lTVEVSSUEKQUdJTEUjQkFBI1NFRU1TCkdBUEUjQkFZT1UjTEFQUwpTTkwjV0FSIyNORUVETEUKI0RBVklEQkVOR1VSSU9OCiNBTk9ERSNTRUVSI0VEVAojTkVXRVIjVE9STyNERVM="},{"title":"06/25/16 SATURDAY STUMPER","author":"Brad Wilber","date":"2016-06-25","grid":"UEFQQVNNVVJGI1JFQURTCklDRVNLQVRFUiNFWFRPTApDQU5USUxFTkEjQkVUVEEKI0lORVJUI1RJTkVURVNUCiMjI1JVRVMjTElLRVMjIwpOT1dPTkRFUiNFQVJUQUcKQVBISVMjREVOQ0gjRUxMClRJRUQjQkVMSUUjSURMRQpDTk4jRE9SSUMjU0FUT04KSEVJREVOI0NBU1RET1dOCiMjTkVXRUwjREVSTSMjIwpDT1JBTFNFQSNSQUlOWSMKQURPUkUjQVRURU5USU9OClNJTU1TI1NUQU5ESU5HTwpLTkVFUyNIT01FU1RFQUQ="},{"title":"06/26/16 MOO'S CLUES: From \"Got Milk?\" ads","author":"S.N.","date":"2016-06-26","grid":"U0NPT1QjU0xBViNHSE9TVCNBQkxFClRPUk1FI1RPUkkjUkFESUkjVkFJTApJVkFOQVRSVU1QI0FMRVhUUkVCRUsKUkVMSVNIRUQjVEVOVFMjTU9SQVNTCiMjI1ZFRVAjQ09MQVMjQk9TUyMjIwpJTlRPVE8jV09VTEQjSE9VU0VDQVQKREVBUlMjQU5EUkVBR0FTU0kjQURPClRBWUUjVklCRSMjI0FMT0UjU0xBVwpBVEwjTElTQVNJTVBTT04jU0VSR0UKR09PREFMTCMjVElSRVMjRU5WSUVECiMjUkVORUUjTUFYSVMjQ1JFRVAjIwpNQVNURVIjU0FMRU0jI0hFQVJLRU4KRUxXRVMjQU5EWVJPRERJQ0sjRU1PCk5PSVIjQVNFQSMjI0JPTFQjQk5BSQpVSEYjTVVIQU1NQURBTEkjRlVKSVMKU0FUSUFURUQjQVBBQ0UjUE9PUkxZCiMjI1RLT1MjU1RJTksjVE9SWSMjIwpBUkdVRUQjR09JTkcjUEVSTUVBVEUKSk9BTlJJVkVSUyNMSVNBS1VEUk9XCkFNSUUjQVVOVFMjRUdJUyNMVUNSRQpSQVRTI0xFQVNFI0RPU0UjQVBTRVM="},{"title":"06/27/16 AUTHORITY FIGURES","author":"Gail Grabowski","date":"2016-06-27","grid":"R1JBQ0UjUkFNUyNDSVRFClBBUEFTI0VWSUwjT1JBTApTVEVNUyNOT05PI01JTksKI0VYUEVSVFdJVE5FU1MjCiMjI1VTTyMjI0hJRCMjIwpBU1BTI01CQSNTUElHT1QKTkNPI1BFQUxTI1NBVU5BClZJUlRVT1NPUElBTklTVApJRkVBUiNTTk9SVCNMRVQKTElTUEVEI0VUQSNJVFRZCiMjI0VTRSMjI05VTiMjIwojTUFTVEVSQlVJTERFUiMKV0VTVCNQSUVTI1RFWEFTCkhFSVIjRUxTRSNSRUFSUwpPS0FZI05FVFMjQURNRU4="},{"title":"06/28/16 TRUST ME","author":"Billie Truitt","date":"2016-06-28","grid":"SEVMUCNCVUxCUyNNRU5VCklERUEjQVRFVVAjT1RJUwpUSUVSI0dBRkZFI1VDTEEKU1RSQUlHSFRGTFVTSCMjCiMjI05BWSMjI0xQUyMjIwpFUFNPTSNSQVAjUEVTVE8KU0VNSSNCRVdBUkUjSEVSClNURUFEWUJPWUZSSUVORApFVEEjUkVFS0VEI0NBU0UKU1lSSUEjTEVFI0RFRkVSCiMjI0ZJVCMjI0dBUyMjIwojI0hPTkVTVE1JU1RBS0UKQU1FTiNNT09FRCNPUklHCkNBTEwjUExFQUQjUkVETwpFRERZI1RFU1RZI01BU1M="},{"title":"06/29/16 BIG LEAGUE","author":"Fred Piscop","date":"2016-06-29","grid":"UEFSQSNBTEZBI1VCT0xUCklERVMjUk9VVCNTT05JQQpMT0NITkVTU01PTlNURVIKQU5BI09BVFMjTUFTSCMjCkZJTkVEIyMjQ0FWI0VXRQojU1RSRVcjTUFSWSNEQVkKIyMjUkFJU0lOIyNET1NFCiNXT09MTFlNQU1NT1RIIwpTT1VSIyNSRUxPQUQjIyMKQVJUI1BMVVMjRURHRVMjClBFUCNSQVAjIyNERU5UUwojI09QRU4jQVJHTyNUT0UKSk9MTFlHUkVFTkdJQU5UCkVMTElFI0FSSUEjRElFVApCQVNFRCNGT05UI0FMU08="},{"title":"06/30/16 GEO-METRICAL","author":"Andy Ellis","date":"2016-06-30","grid":"Tk9BSCMjSkFWQSNCT1BTCk9BSFUjRklGRVMjVFJBUApUUkFGQUxHQVJTUVVBUkUKIyMjRkxBR1JBTlQjQ09XClNFVFNBSUwjIyNTRUxMUwpBUkUjI0xFRUNII1ZFRSMKQUlSRUQjI0FET0JFIyMjCkJFUk1VREFUUklBTkdMRQojIyNQSEFTRSMjU1RBSU4KI0RPVCNNQU5FVCMjU0tJClNBTllPIyMjTE9BVEhFRApIUlMjRUFTVEVSTFkjIyMKQU5UQVJDVElDQ0lSQ0xFClZJQUwjVEVOVEgjT1BFTgpFVFJFI1NQQVMjI0xBT1M="},{"title":"07/01/16 AUSTRIA HUNGRY","author":"S.N.","date":"2016-07-01","grid":"RkFUQ0FUUyNTUEVBS09GCkFNUkFESU8jQ0FSRkFSRQpXSUVORVJTQ0hOSVRaRUwKTkVFRExFI0FMRUMjT0lMCiMjRk9FI0FQRVMjU09EQQpJR09SI0dSSVAjVklTQVMKTUFSI1NMSVQjQUlSIyMjClBPVEFUT0RVTVBMSU5HUwojIyNSQVcjTE9CRSNJT1UKVEhPTkcjU0FQUyNJQ09OCkhPSE8jUk9URSNBQ0sjIwpFTE0jU0lMTyNBUkVOQVMKQkxBQ0tGT1JFU1RDQUtFCkJFR1VJTEUjVEhJQU1JTgpDUkVFUEVEI0RFRVBFTkQ="},{"title":"07/02/16 SATURDAY STUMPER","author":"Matthew Sewell","date":"2016-07-02","grid":"VElDUyNDQVZFI1NUQVNICklSQU4jQUxFQyNDVVJJTwpLRU5PI1JJTkdTQUJFTEwKSU5UTyNBR0UjVFJFQVRZClNFSVpFVEhFREFZIyMjIwojI0xFWCNUUkFNI1JBUFQKUFJFRkFCI1NURVBPVkVSClJBVkVMRUQjQU5BVE9MRQpPUkVTVEVJQSNTUEFDRVgKUEVSVCNIQUxPI0VSQSMjCiMjIyNXSU5PTkFSWURFUgpNQUdMRVYjSEVNI0ZPQ0kKSU1NT0RFUkFURSNJUE9TClNNQVJUI05PT04jTElORQpDT05ETyNTRU5EI0VUT04="},{"title":"07/03/16 IN ROTATION: At various speeds","author":"S.N.","date":"2016-07-03","grid":"RVRIT1MjTUZBI1BPU1RTI1NMT1NICkJPT1NUI0FPTCNPUFRJTiNDQU5UTwpCQUxMRVJJTkEjS0VBTlUjT0NDVVIKU1RNT1JJVFojTUVSUllHT1JPVU5ECiMjIyNOQkEjQ09NQVMjI1JFTkVHRQpFTUNFRSNJRE9OT1QjQVRBUkkjIyMKVklFSVJBI1BIT05FRElBTCNDQ1RWCkVMSVMjR0FMQSMjI0ZMT1NTI0xFSQpSRUwjREVCVU5LI0FMRVMjUE9PUlMKVFJJQlVURVMjSU5CQUQjR0FSQ0lBCiMjTklURVMjQ0xFRlQjREVSRUsjIwpFREdFSU4jU0FOVEEjTk9UU09IT1QKUklGTEUjQ0FSUyNCTE9VU0UjQVBFCkFWQSNTSFJVRyMjI0lNUkUjRU5DRQpTQU5TI0FVVE9USVJFUyNUSUVESU4KIyMjUFJJWkUjRU5PVUdII05FU1RTCklTUkFFTCMjVU5BUFQjRVNUIyMjIwpCTEVOREVSQkxBREUjRVlFRVhBTVMKU09HR1kjQUVUTkEjRFJZRVJEUlVNCkVNSUxFI01FUlRaI0VHTyNOSUVDRQpOT1NFRCNBQkFTRSNMT1UjU05BS0U="},{"title":"07/04/16 JUST FOR TODAY","author":"Mark McClain","date":"2016-07-04","grid":"UEFTUyNGT0FMI1dFREdFClJVTlQjSVNTTyNPQk9FUwpFUk9PI1NMT0cjUkFHRVMKRk9VUlRIT0ZKVUxZIyMjCkFSVEVSWSMjQU5EI09SRQpCQVNTTyNDQU1QI1dIRU4KIyMjI0xFQUQjQVRPTkVECiNERUNMQVJBVElPTk9GIwpCVVNIU1IjUE9EUyMjIyMKQU5USSNOQVRPI1NQSU5TClJFRCNPRVIjI0tFUk5FTAojIyNJTkRFUEVOREVOQ0UKU1BBUlMjTklURSNGQVRFCkVFUklFI0FOVEUjSVRBVApXUkVTVCNTRUVTI1hFUlM="},{"title":"07/05/16 FOR AN AUDIENCE","author":"Gail Grabowski","date":"2016-07-05","grid":"Q0FSQVQjQ0FHRSNQQVNUCkFNVVNFI0FUQUQjVUNMQQpNRURJQSNNT0xEI1BFQVMKT05FQUNUUExBWSNQSU5UCiMjIyNIQVVMIyNQRVRUWQpQQU1QRVJTI1NQQVQjIyMKQURJT1MjI0JJUkRTRUVEClJBTVAjUElBTk8jSEFMRQpFWUVDSEFSVCMjSE9SU0UKIyMjT0FSUyNHUk9XTEVEClNDQU5TIyNEVUVUIyMjIwpDSElDI0NPTUlDT1BFUkEKUklERSNFUkFTI1ZBUE9SCkVWRVIjREFSRSNFVklDVApXRVNUI0VMS1MjTkVDS1M="},{"title":"07/06/16 MOUNTAIN ECHOES","author":"Billie Truitt","date":"2016-07-06","grid":"UEhEUyNBRERJTiNBRlJPClNPQVAjRFJBQ08jQVJJQQpUT1JFI1ZJTkVTI1JBTlQKI1BFRUtJTkdUSFJPVUdICiMjI0RJU0sjI0VPTiMjIwpJTlRJTUUjUEFEUyNTUEEKTU9PVCNPQUhVI0lGRUFSClBJUVVJTkdJTlRFUkVTVApFUlVQVCNSQVRFI0VUVFUKTEVFI0lUQUwjQVNFVkVSCiMjI1NTRSMjQ1JPVyMjIwpQRUFLSU5HVE9PU09PTiMKQVFVQSNEVU1BUyNSSEVBCkNVTFQjRVJBU0UjTElBUgpUSURFI1JVTlRTI0RPUk0="},{"title":"07/07/16 TRIED AND UNTRUE","author":"Matthew Sewell","date":"2016-07-07","grid":"U1BBUiNUSVZPI1NBUFBZCldBTkUjRUxBTiNJTExCRQpJUEFEI0FMSVQjR0xBU1MKTVlDT1VTSU5WSU5OWSMjClNSSSNQRU4jI01FRVRVUAojSU5IRVJJVFRIRVdJTkQKIyMjSU5TI1JJTyMjTUlBCkJBU0VEI0ZJWCNCRUVUUwpBQ1QjI1ZBVCNURUwjIyMKVEhFQ0FJTkVNVVRJTlkjCkhFUk9OUyMjQVJFI09PRgojI0xFR0FMTFlCTE9OREUKV0hJUkwjQUlEQSNEVUVUCldJTkNFI01FQU4jSVNMRQpFREdFUiNCVVlTI05FU1M="},{"title":"07/08/16 CONTRONYMS","author":"Andy Ellis","date":"2016-07-08","grid":"QURBTSNDTU9OI0FRQUJBClRBUEEjSElITyNEVUJBSQpPVkVSU0lHSFQjUkFCSUQKTVlSSUFEUyNTSEFMQUxBCiMjI09MRSNDT0FUSSMjIwpBU1MjRVNTTyNSRUZVU0UKRkxPU1MjSE1NTSNJTklUCkxPTEEjQ09QRVMjRVROQQpBVFROI0hPTEUjRURJQ1QKQ0hJQ0hJI0VUQVMjTEVTCiMjI1RJTUVYI0NTQSMjIwpCUkFJU0VEI0lDRURURUEKRVVST1MjVU5CRU5ESU5HClJISU5FI0NQQVMjRURJVApHUkFTUyNFUlJTI1JFRFM="},{"title":"07/09/16 SATURDAY STUMPER","author":"Frank Longo","date":"2016-07-09","grid":"QU1QI0JPQkNBVCNQU1NUCkZPUk1VTEFPTkUjQU1JRQpPTkVJREFMQUtFI05BU0EKT1RPUyNGSVRBTkRUUklNClRZUEVCIyMjIyNBTFQjIwojIyNSQURBUlNDUkVFTlMKRE9JI1JVTkFMT05HTk9XCklQTyNCQUlUSU5HI1VTQQpTQVdQQUxNRVRUTyNQRVQKQ0xBU1NTRVNTSU9OIyMjCiMjU0hPIyMjIyNET0RHRQpWSVRBTE9SR0FOI1BJVVMKQ0xBVyNWSU9MQURBVklTClJJVEUjQUNUSVZFUk9MRQpTRUVEI0xPT1RFUiNURVg="},{"title":"07/10/16 PRESIDENTS' DAY: A few months early","author":"Fred Piscop","date":"2016-07-10","grid":"R09UVEEjU09EQSNOQVJDI1NUQUZGCkFVUkFMI0FQRUQjT1JFTyNUT0lMRQpTQ09UVEFEQU1TI0JJTExNT05ST0UKUEhZU0lDQUwjI09MQVkjT05FU0VUCiMjIyNNRVQjQ09ERVMjU0xJRCMjIwojREVHQVMjU09MRVMjQklURSNSQU0KQk9MT1MjSkFNRVNUQVlMT1IjRVJBClJVTVAjSEFSTSMjI1NOTyMjRVhJVApJU08jI0lTQUFDSEFZRVMjVEVIRUUKVEVMRVRIT04jUkFWRVMjQ09SQUxTCiMjSU1FQU4jTUVSSVQjQ0hBSVIjIwpURU5BTlQjU0VQVEEjTE9JVEVSRUQKRUxDSUQjRUlMRUVORk9SRCMjSVZFCkFXT0wjI1ZFRSMjI0lTRUUjQVNJUwpDRUwjU1RFVkVOVFlMRVIjU0hPQ0sKSFNOI1BPTkUjT1JBTFMjQ0hBTlQjCiMjI0JFTlQjU1dBUFMjTU9UIyMjIwpVTlNVTkcjQUhPWSMjUEFMSVNBREUKTkVMTENBUlRFUiNKT0VKQUNLU09OCklNQUdFI0FORFMjQVVUTyNLSVRFRApUT1RFUiNQT1NFI0JSRVIjU1RJUlM="},{"title":"07/11/16 PHOTO OPS","author":"Gail Grabowski","date":"2016-07-11","grid":"QVNQUyMjU0VBTCNQT1NFCkxJT04jU1BVTUUjQVJFQQpBTFNPI1RJUkVEI1RFQVIKTk9UQllBTE9OR1NIT1QjCiMjIyNJTExTI0VUUyMjIwpTQ1JBUEUjI1BSTyNQVEEKTE9PTSNTSVNJI0lTTEVUCk9VVE9GVEhFUElDVFVSRQpTUE9LRSNPUEVOI0FNU08KSEVSI1RJUCMjU0FURUVOCiMjI1BFTiNBVklEIyMjIwojVEhJU0pPQklTQVNOQVAKQ09BTCNFRElDVCNMSU5FCk9OVE8jU0lERVMjQUNUUwpXRVNUI1RFRVMjI1RFU1Q="},{"title":"07/12/16 MIND THE GAP","author":"Billie Truitt","date":"2016-07-12","grid":"TkFTQSNDUkVFRCNQTEVECk9QQUwjSElQVE8jUklERQpOT1ZBI1VOSVRFI09NRU4KT1BFTklOR0NFUkVNT05ZCiMjI0FSSyMjI1NBUCMjIwpBTkdMRSNSRUcjU1RJTFQKTE9SRCNSRVZPS0UjTkFICkJSRUFLVEhFU0lMRU5DRQpVU0UjTkVBUkVEI1ZFRVIKTUVOU0EjQllFI1RFUlNFCiMjI0VWRSMjI09XTiMjIwpTUEFDRVRFQ0hOT0xPR1kKSEFJUiNIVUxBUyNFUklFCk9OTUUjSVJBVEUjU0VMTApQRVNUI0NPTUVUI1NPQVA="},{"title":"07/13/16 VACATION CHOICES","author":"Bruce Venzke","date":"2016-07-13","grid":"QkFHSVQjQUxQSEEjQ0FCCklST05TI0xPUkVOI0FCRQpCRUFDSFJFU09SVCNOSEwKU0FMTElFI0VORCNTT09UCiMjI0lSQU4jVEVFVEVSUwpDT1VOVFJZTE9ER0UjIyMKTE9ORSNVU0UjI0FNQVNTClVaSSNTUEVBUkVEI1dPVwpCRVRURSMjUkVYI0NPTEEKIyMjQUxQSU5FQ0hBTEVUClNUSUZGRU4jTEVBUyMjIwpBSU5UI1JQTSNFTFBBU08KRkFEI0lTTEFORFZJTExBCkVSRSNESUFORSNFQVRBVApTQVgjU0FZU08jU05PQlM="},{"title":"07/14/16 WOODWORK","author":"Andy Ellis","date":"2016-07-14","grid":"V0VMRCNEUkFCUyNMT0dPCklTRUUjRVVST1MjT05ZWApTVElDS1NISUZUI0dFUkUKUEVDQU4jUkVGI0hBU09OClNFQUxBQiNTT0xBUiMjIwojIyMjVklDIyNBTElBUyMKTElNQkVSVVAjUEVUUk9MCkVWRVIjRFJBRlQjSElGSQpTRVNBTUUjUk9PTU1BVEUKI1NBTkVSIyNSUEkjIyMjCiMjI0NBU1RTI1NOQVRDSApTVEFITCNCQUEjSVRBTE8KRVJHTyNNQVRDSE1BS0VSCkxJRVUjQUxJVE8jTEVBRApMT1NUI0JMRVNUI0VSVEU="},{"title":"07/15/16 FOUR CORNERS","author":"Mark McClain","date":"2016-07-15","grid":"UFVUVFMjRVRDI1JPU0VTCk9QRVJBI1NISCNFVkVOVApTVFJVVCNTUkkjU0VFWUEKVEFNRUQjI1VOREVSUEFSCkVLRVNPVVQjQVZFUiMjIwpSRUQjV1JJVCNJREVBTFMKIyMjSU5BQklUI1NBTU9BCk9WVU0jTElMQUMjQ0lUWQpISVJBTSNBVFRBQ0gjIyMKTUFOR0VSI1NVTU8jQUZMCiMjI0VERU4jTUlSQUNMRQpBU0FGQVZPUiMjUkVUQUcKQ0VDSUwjQkFII0FTT05HCkVNSUxFI0VWRSNMT05HRQpTSURFRCNMRVgjU1BFRUQ="},{"title":"07/16/16 SATURDAY STUMPER","author":"Anna Stiga","date":"2016-07-16","grid":"U0hFRFMjU0NSSU1NQUdFClBBWUlOI0NJT0NJT1NBTgpPTUVHQSNBUkJPUkVUVU0KT1JTI0dBUkNPTiMjQUdFCkZBTExTRkxBVCNNQU5FUwpJREVBI0NBRCNXQUJBU0gKTklGVFkjVElUQU5TIyMjCkdPVCNBU1RBSVJFI0hPRwojIyNUUlVJTkcjVEJPTkUKRVRSQURFI1JFRiNBTEFTCkpFRVBTI1NIUkVXREVTVApFRUcjI0dFWVNFUiNDUEEKQ0hBUkxPVFRFI0FQQVJUClRFTEVQQVRIWSNUSFJFRQpTRUVNU1RPTUUjSElERVM="},{"title":"07/17/16 SPELLING B: Starting just as you might expect","author":"S.N.","date":"2016-07-17","grid":"QklERVMjQUJBUiNDQVBFUyNDSE9QCkFUQVJJI0FVUkEjQURJRVUjTFVMTApCUlpFWklOU0tJI0JSVU5OSElMREUKRVlFQ0FORFkjTE9SRVMjRE9DS0VECiMjI1RCU1AjU0NSSVAjUEVSSyMjIwpSRUJPTFQjU1RBSUQjTEFWUyNCUkEKQUNBUkUjQk9VUkdFT0lTSUUjUk9ECktPUlMjUEVOTiMjI1BFRUwjQ09NTwpFTFkjQlJBR0dBRE9DSU8jRklCRVIKREVTUE9JTFMjQkVOSU4jR09SRE9OCiMjSEFaRUwjUlVOSVQjTUVSQ0kjIwpBTU5JT1MjTk9UU08jRk9OVEFOTkUKTE9JTlMjQk9ZU0VOQkVSUlkjR0VMCkJJS0UjUE9MSyMjI0VBU0UjR05BVwpVU08jQk9VVE9OTklFUkUjRUxBVEUKTVRWI0VER0UjQVVOVFMjQU1JR09TCiMjI0lOQ0gjS1VET1MjQUJFVCMjIwpJV0FOTkEjUEFHRVIjSU5FUlRHQVMKQkFUSFlTQ0FQSCNCRVRFTEdFVVNFCklOVE8jVEFST1QjSUNBTiNFUk5TVApTRU5UI1NURVdTI1RPTEQjU1lOVEg="},{"title":"07/18/16 HAVE A FLING","author":"Gail Grabowski","date":"2016-07-18","grid":"UEVFUiNQRVNUI1NURVBTCkFDTUUjQVhMRSNIT1RFTApDSElQI1NQQU4jT05UT0UKVE9URSNUT1NTQVJPVU5ECiMjI0FGUiNIRUZUIyMjIwpMQVNUTEFQIyNUQVJUQVIKQUNUI0FNRU5EIyNDT0xBClRIUk9XSU5UT0FQQU5JQwpDT1VQIyNUSEVTRSNFVkUKSE9UVFVCIyNTVEFSUkVECiMjIyNTT09OI1VTQSMjIwpQSVRDSEFURU5UI1NURVcKQURPUkUjVFJFRSNDT1JFClJPR0VSI0VWSUwjQVJBQgpTTE9XUyNSRUxZI0xFU1M="},{"title":"07/19/16 IMMACULATE","author":"Billie Truitt","date":"2016-07-19","grid":"RURBTSNGQUJMRSNEQVNICkFVUkEjT0NFQU4jT0JPRQpSRUlOI0FNQVNTI0dVTEwKU1RBSU5MRVNTI0ZTVE9QCiNPU0xPIyNUT1RBTCMjIwojIyNBTUVSIyNFWEVNUFQKQVBQI0FSQUJJQyNET09SCkNMRUFOQVNBV0hJU1RMRQpIRVJCI1NQUklOVCNIT0UKRVhQT1NFIyNOT1NIIyMjCiMjI1ZJUlVTIyNPQVRTIwpQSVBFUyNTUEFSS0xJTkcKQVNJQSNTSEFLRSNWRUFMCllFTEwjRUVSSUUjRVVSTwpTRUxMI1RSRU5EI1NQRVc="},{"title":"07/20/16 SUPERSIZE","author":"Fred Piscop","date":"2016-07-20","grid":"REVMVEEjQU1JRCNTUEVDCkVWT0tFI01FTlUjVEFSTwpORVdPUkxFQU5TI0FOT04KIyMjI0FJTlQjVElSQURFCiNRVU9URUQjIyNNRU1FUwpIVVNIRUQjQ0FOQURBIyMKT0FTSVMjTUFYSU0jQ1VQCkxJTU8jR0FWRUwjREFOQQpFTEkjQk9ORVMjU09OSUMKIyNTSEFERVMjU0VOQVRFCk1BU09OIyMjR0VOVExZIwpBUk9VU0UjQUxFUyMjIyMKWkVVUyNEQVZJRE9SVElaCkRBUkUjSUNPTiNSQUJCSQpBU0lTI1RFTlQjU1dBTVA="},{"title":"07/21/16 THREE-PART HARMONY","author":"S.N.","date":"2016-07-21","grid":"TUlTTyNWQ1JTI0pBTUJTCkVUT04jQUhPVCNVU0VVUApUQUZUI05FQVIjU0lYVFkKQUxUT0lEU01JTlRTIyMjCkxJUCNPQVQjS09TI0RPQwpTQ1JBV0wjTkVSTyNBSUQKI1NFUkEjRklUUyNVUkxTCiMjVEVOT1JUV0VOVFkjIwpHQVpBI0JPUk8jRUVMUyMKUElFI05PTk8jUkFTSEFECkFMTCNCRVQjU0VUI0FSRQojIyNCQVNTRVRIT1VORFMKTVlFWUUjRURJRSNTTklUCkRFQ09SI0FHUkEjREFORQpTTk9CUyNURVNUI0FIRU0="},{"title":"07/22/16 INDIRECT APPROACH","author":"Andy Ellis","date":"2016-07-22","grid":"SVNBQUMjU0xBUCNBSU0jCkRVTUJPI1RJTEUjU0NVRApJTlNVTSNBTUVOI1BBU08KIyMjVE9LTk9DS0FDSElQCkFQUCNST0MjI05VQU5DRQpNRUEjT1BFTkFJUiMjIyMKUEFURVMjI09GRkFNQU5TCkFDSUQjRU5UUkUjSURPTApTSE9VTERFUiMjU09BTUkKIyMjI0VVR0VOSUUjUEFUCkNISVJBQyMjT1JBI1REUwpISU1PTlRIRUJBQ0sjIyMKRURBTSNJT1dFI09OVEFQCk1FR0EjT1BFTCNXT1JMRAojU0VOI05FU1MjU1RJTFQ="},{"title":"07/23/16 SATURDAY STUMPER","author":"Brad Wilber","date":"2016-07-23","grid":"RUdHTk9HI1JPQURTSE9XClNBTE9NRSNBTlRFTE9QRQpDTE9TRVQjSUxMRkFURUQKSFVCI05BT01JI0FQSU5HCkVNVVMjVEhFVkVUI1RFRQpBUExVUyNLTkVYI0hFUkQKVEhFTldIQVQjRVRZTUEjCiMjI0JVT1kjVFJBUCMjIwojQVRPTVMjR1VUQ0hFQ0sKR05BVyNFQk9OI1RFWEFOCklUUyNCQVJSRUwjTk9MQQpKRVRMSSNFRVJJRSNUQVYKT05JT05TRVQjTEFISVJJCkVORVJHSVpFI1RSQUNUUwpTQVJET05ZWCNTUExBU0g="},{"title":"07/24/16 IN THE MAIL: And in your boxes","author":"Gail Grabowski","date":"2016-07-24","grid":"RUFTVCNUT0FTVCNDUkFORSNCRVRTClBVQ0UjQU5ESUUjTUVDQ0EjQUdSSQpJUkFOI0JDRUxMI0FESE9DR1JPVVAKQ0FSRENPVU5URVIjSVRTSE9UIyMjCiMjI1RSVUUjI0dPQUQjIyNUQVBBUwpSRUNPSUwjQUFST04jQ0VMSUJBVEUKQU1JI0JJTExXQVRURVJTT04jQ05OClNBUkEjI0FUT00jRkxJUFMjU0tJUwpQSUNBI1NXQUsjU0FNTVkjQkVBTk8KU0xVTSNJTlJFI0NST1AjRklOR0VSCiMjTElBUlMjI0NBTSMjUVVPVEUjIwpQU0FMTVMjQ0xPRCNDUlVEI09ERVMKQ09STlkjQ1JPV1MjSEVBRCNGRU1BCkxJRkUjR09BUEUjV0VFSyMjRkFDVApBUkkjTEVUVEVSUEVSRkVDVCNMRUUKQkVMUEFFU0UjRUxMSVMjSE9SU0VTClNFRVJTIyMjSURPTCMjQ0FSRSMjIwojIyNFSUxFRU4jUFJFU0VOVFRJTUUKQ0hFQ0tJVE9VVCNFQ0xBVCNPRE9SCkRFTEkjTUFOU0UjQVJJU0UjUkVBUgpTTklQI0VTU0VOI0RVUEVEI1RBVFM="},{"title":"07/25/16 CUTTING EDGES","author":"Gail Grabowski","date":"2016-07-25","grid":"U0xBQiNBQkVUI1NBTEFEClBJTkUjTE9WRSNQUklDRQpBTlRTI09YRU4jSEVBVFMKI0tJVENIRU5TSEVBUlMjCiMjIyNPQVIjI09SUyMjIwpQU0FMTSNTTEFURSNJQk0KQVRDQU1QI0FSVCNBTE9FClRPRU5BSUxTQ0lTU09SUwpTTElEI1JPVCNQSEFTRVMKWUVUI0JBU1NPI0VOVFJZCiMjI09VVCMjUlVFIyMjIwojSEVER0VDTElQUEVSUyMKUEVSSUwjTE9PUCNQQUNUCkVSQVNFI09HTEUjSVJBTgpQT1NUUyNERUVSI0NFTlQ="},{"title":"07/26/16 DUAL-ACTION FACTION","author":"Sally R. Stein","date":"2016-07-26","grid":"VEFVVCNMSVNQI1NDQU5UCk9OQ0UjT05VUyNUVU5FUgpZRUxMI1RBTlMjQUNUSUkKI1dBTEtJTkdUQUxLSU5HCiMjIyNIT0UjI0NFTyMjIwpBRkdIQU4jT0hII09BVFMKQ1JPT0sjT1JFT1MjTEVJCk1PQU5JTkdHUk9BTklORwpFU1AjU09MQVIjV0FLRU4KU1RFVyNURU4jTk9QRVRTCiMjI0FMSSMjT09GIyMjIwpIVUZGSU5HUFVGRklORyMKT1JBVEUjUk9URSNST0FSCk9HREVOI0FMREEjSVNMRQpGRUVEUyNET09SI1NFRUQ="},{"title":"07/27/16 ARTSY","author":"Fred Piscop","date":"2016-07-27","grid":"I0NIRU0jU0xJRCNISVlBCktPQUxBI1RVREUjQVJPRApGUklFRCNBTEFTI1pFVVMKQ0FSVkVBVFVSS0VZIyMjClNMWSNBR08jRVNTI0dJRwojIyNPQkVST04jUEhPTk8KU1RBTUVOI0JPUCNBVVRPClBBSU5UVEhFVE9XTlJFRApBVURJI1NBUyNNSURETEUKU1BFQVIjUkVDRVNTIyMjCk1FRCNVTkQjQUxFI0NCUwojIyNEUkFXRlJPTUFIQVQKSU9UQSNST09UI09OSUNFClFVSVojQ09URSNWRU5PTQpTSU5FI09ET1IjRVdBTiM="},{"title":"07/28/16 PRE-ROMANTIC HAMMERSTEIN","author":"S.N.","date":"2016-07-28","grid":"U1dBTVAjVFJBTVMjUkFHCldBWEVSI0hBTk5BI0VORQpJRklMT1ZFRFlPVSNBR1QKUEVOI01JTUkjI1RJTEVTCkVSR08jUEVPUExFV0lMTAojIyNXQVMjI0xFU09USE8KUE9TRVIjVVBPTiMjWUFPCkFOT0RFI1NBWSNBUlRJUwpTVEwjI0NVUlMjRkFWUkUKU0hBTkFOQSMjUEJTIyMjCldFUkVJTkxPVkUjSEVMTQpPU1RFUiMjVklMRSNMQVkKUlBJI01BS0VCRUxJRVZFCkRPTSNBRE9SRSNNT05FWQpTVEUjTkVTVFMjU05BUkU="},{"title":"07/29/16 INSIDE STORIES","author":"Carolyn Stewart","date":"2016-07-29","grid":"QUxFUEgjQVRNUyNJQ0JNClRBTElBI1JPT1QjUE9SRQpUSUxMUyNBTExBQk9BUkQKSU5FRkZBQkxFTkVTUyMjCkNFUkVBTFMjQ0RTI1RIRQojIyNSSVAjU1VCUyNMQVgKU0NSQVQjTElMWSNXSVNQClRBVUdIVEFMRVNTT05UTwpBTk5FI0hNT1MjVFJFRVMKTUlSI1BJUFMjSEFMIyMjClBUQSNJUlMjU0FOREJBRwojI0dFVFRIRVBJQ1RVUkUKTkVHT1RJQVRFI0hPUlNFCk9NRU4jRUROQSNFVVJPUwpEVURTI1NFQVIjRFJPTkU="},{"title":"07/30/16 Y SATURDAY STUMPER","author":"Anna Stiga","date":"2016-07-30","grid":"I0JMQU5DUyNSQURJQUxTCkFSQUJJQU4jVVRFTlNJTApNT05TVFJPI0JBVENBVkUKSU5EI1JPVyMjTEVBUEVECkVDT05PTVlDTEFTUyMjIwojI0xPR1MjQUlOVCNQVUcKVFJBREUjUFNTVCNTT1NPCllVS09OUE9TVEFMQ09ERQpDSEVaI0FTSVMjQVVSQVMKT1JTI0dSSU4jR0lCRSMjCiMjI1ZFUlRJQ0FMQVhJUwpFQVNJTFkjI0FMQSNDU1QKVFJFTExJUyNTUEFUVUxBCkFJUkxBTkUjVEFMS1NBVApMQUZBUkdFI0VMSVRFUyM="},{"title":"07/31/16 MUSICAL QUESTIONS: Which are five of the answers","author":"S.N.","date":"2016-07-31","grid":"Q0FCI0FQRUQjQVNTT1JUI1NJR01BCk9XTCNQTEFZI1NQT1JLUyNBTExBVApXSE9XUk9URVRIRUJPT0tPRkxPVkUKQklTSE9QIyNIQU5TIyMjREVFUkVTCk9MU0VOI0NIQU5UI1NPTEQjR1lOVApZRU9XI1NISU5UTyNQQUVMTEEjIyMKSEFNI1dIQVRLSU5ET0ZGT09MQU1JCkFHRSNSRU5PIyMjTE9TVFRPI0JPUApUT0RBWSMjI0FIU0lOIyMjVEFCT08KIyMjQ0xBUklORVQjI01BUCNTT05TCiMjV0hZRE9OVFlPVURPUklHSFQjIwpXSEVFI09XTiMjUFJFTUlFUkUjIyMKQUFOREUjIyNCQVNJTiMjI0FTUENBClNMTyNEUkVXVVAjIyNBR1JJI0xVQwpIT1dERUVQSVNUSEVPQ0VBTiNFVEMKIyMjSU5TRVJUI09BUklORyNNT1RFCkxBU1MjVEVFUyNCUklERSNNVU5JUwpPQ1RBTkUjIyNOT05PIyNUSVRBTlMKV0hFUkVET0JST0tFTkhFQVJUU0dPClBPRU1TI0RPVVNFUyNCUlVUI01JUgpIT0xTVCNFWFRFTlQjT0FUSCNTVFk="},{"title":"08/01/16 IN THE LEAD","author":"Gail Grabowski","date":"2016-08-01","grid":"U0FMQUQjQ09XUyNJQ09OCkVMSVRFI0VDSE8jTkFNRQpNQU5JQSNORUFSI1NQRVcKSU5URVJTVEFURSNQRU5TCiMjIyNPUEVOIyNNRVNTWQpTRU1JTkFSI05BUkMjIyMKUExBTkUjI1RPWVNUT1JFCkFTSVMjSU5BV0UjSU1BWQpNRU5UT1JFRCMjVk9JQ0UKIyMjUlVTVCNQUklOVEVEClNUUlVUIyNBTEVTIyMjIwpUUklNI0lORElWSURVQUwKUkFURSNDQUZFI1RBU1RFCkVERU4jRVZFUiNPUk5PVApXRVNUI0RZRVMjUkVBUFM="},{"title":"08/02/16 DAY AT THE SHORE","author":"Billie Truitt","date":"2016-08-02","grid":"Q0xVTVAjU0VMTCNTVEFCCkhBTk9JI1RSVUUjVVJHRQpFTElURSNBSU5UI05BSUwKV0FURVJXSU5HUyNHSUxMCiMjIyNST0QjI0dBTExFWQpFUkFTRVIjTU9PTEEjIyMKRE9SQSNTVEVNI0VTU0FZCklNSU4jVElSRUQjU1VSRQpURUREWSNOSU5FI0VERU4KIyMjQ0FERVQjUEFTU0FTCk1BREFNRSMjSVRTIyMjIwpBTEFTI0JFQUNIVE9XRUwKTUlUVCNUQUNPI1VOSVRFCkFCRUwjT1ZFTiNURU5UUwpTSURFI1JFRFMjRVNTRVM="},{"title":"08/03/16 NOTHING TO WEAR","author":"S.N.","date":"2016-08-03","grid":"QkFJTCNDQU1TI1NIVVNICkFMU08jTElFTiNUT05UTwpTT0xPI09OVE8jQUlERVMKU0VFSyNTVFJPTkdTVUlUCiMjI0FHRSNFVEMjVEVOUwpBVVNUUklBIyNBU1MjIyMKUFJJTUlOR0NPQVQjTEVOCkVHUkVUI1VTUyNBQklERQpTRUUjVFJBSUxCTEFaRVIKIyMjQVlFIyNPUkVHQU5PCklCSVMjQkFTI09SRyMjIwpEVVNUSkFDS0VUI0lPV0EKRU5TVUUjSEFTSCNFQVJMCkFDVVRFI0VUVEUjU0hFRApTSEVFUCNERUFSI1RVTkE="},{"title":"08/04/16 AEROPORTI","author":"Fred Piscop","date":"2016-08-04","grid":"U0xBWSNFREdBUiMjTEFHClBBTkUjR1JBUEUjQkFSUgpBTUVSSUdPVkVTUFVDQ0kKVElNI1NJTkUjI09DVEFEClVOTyNMRUUjQ0FNI0FERApMQU5ERVIjQ0hVTSNUSUUKQVJFQSMjU0xBVEUjRUFSCiMjI01BUkNPUE9MTyMjIwpQT0kjTE9PTlMjI1dBQ08KQU5OI1BPUkUjR0FMTE9OClRBUyNBVEUjUkVWI0JFRQpFVEhJQyMjUE9MSSNBUlQKTEVPTkFSRE9EQVZJTkNJCkxBQ0sjQVVESVQjRElFTQpBUksjI1lFU05PI1NBU0U="},{"title":"08/05/16 EXPLOSIVE EXTERIORS","author":"Mark McClain","date":"2016-08-05","grid":"Sk9BRCMjU0NIV0EjUENTCkFJREUjUExBWUVSI0FMSQpCTEFDS0ZPUkVTVCNUSUUKIyMjUkVDI0VOVElDSU5HCk1BVkVOI1RTQSNTSU5HRQpDSEVFVEFIIyNTVFJBWVMKTUFBIyNTRU1JVElDIyMjCiNCTEVBS0ZPUkVDQVNUIwojIyNTTUlUVEVOIyNFT1MKTEVTU0VOIyNOT1dIRVJFCkFOTkFOI1NTRSNBRVNPUApHUkFZQVJFQSNJQ0UjIyMKR0FQI0JVSUxUVE9MQVNUCkVHTyNMSU5FUlMjRVhQTwpERU4jRU5FTVkjI0RFRlQ="},{"title":"08/06/16 SATURDAY STUMPER","author":"Lars G. Doubleday","date":"2016-08-06","grid":"RElTR1JBQ0UjRU5BTU9SCkFNRVJJQ0FOI0dVSUFOQQpDTEVBVkVSUyNBUk1MRVQKSE9UVEVTVCNURFMjRURTCkFTSEVSI1NTVyNFR0dPTgojVEVSU0UjSElQI1JBWkUKIyMjI1RBQlVMQVJJWkVTCkVBUkxZUkVUSVJFTUVOVApDSE9VWFBBU1RSWSMjIyMKU09DSyNTS0kjU0tFV1MjClRZS0VTI0VORyNKRUVQUwpBTVMjRVJSI09OQUxFUlQKVEFUQU1JI1NMT1ZFTklBCklUQUxJQyNBRE1JUklORwpDRVJJU0UjREVTS1NFVFM="},{"title":"08/07/16 NOT SO FAST: We'll get moving next time","author":"Gail Grabowski","date":"2016-08-07","grid":"SElQUE8jSkVFUCNHTkFTSCNDSE9QCklTTEFNI1VOVE8jT05DVUUjSEVSTwpHTEFTU0JMT0NLI0RFRVBGUkVFWkUKSEVOUyNBSVJIRUFEIyNTVEVXUE9UCiNTVEFESVVNIyNTRVJCI1NBVCMjIwojIyNHRVRTI0xBU1NJRVMjUk9NQVMKVklDRVMjI1NPRlRTQ1JVQiNZRUxQCklETyNPRERMT1QjI0FNTUFOI0RDSQpBU1AjVElFVVAjUEVSU09OUyNJT0MKIyNQTE9WRVIjSE9MRCMjS0FSQVRFClBMRUEjRVNQUkVTU09CQVIjRVNURApFQVJCT0IjI0FSRUEjTEVBUEFUIyMKU1BGI1RPUFBMRUQjU09SVEEjVVBTCkVDTyNTTUFMTCMjUEhPT0VZI05BSApUQUlMI0JSQUlOU1RFTSMjRFVUQ0gKQVRMQVMjS05FRVBBRCNBTEFTIyMjCiMjI1lVTSNBU1dFIyNDUkFZT0xBIwpDQUxPUklFIyNBRE1JUkVSI1NJUlMKVFJBVkVMUExVRyNCTEFOS0NIRUNLClJJU0UjTEVBU0UjQVNJQSNCT0dFWQpMQUhSI1NFV0VSI1NBR1MjU1dFREU="},{"title":"08/08/16 DE-SCRIPTIVE","author":"Gail Grabowski","date":"2016-08-08","grid":"QUxBUyNSQVZFI0FEQVBUClZJQkUjRURFTiNNRVRPTwpJVEVNI0ZJTkQjQkxBUkUKREVMSUNJT1VTI0xJTktTCiMjIyNFTFNFI1BFRyMjIwpXSVNET00jI1JFREhPVFMKQU5URVMjTEFPUyNUUk9UCkxPT1AjRElUVE8jRkFURQpMSU5FI1JBTVMjQ1VURVIKU0xFTkRFUiMjU09MRU1OCiMjI0RFVyNERUVSIyMjIwpDTEVBTiNERUZFTlNJVkUKSEVSQlMjQUNJRCNJREVBCkFHSUxFI01BTEUjUE9UUwpUT05FUiNQTEVEI1NMT1Q="},{"title":"08/09/16 DOG DAY","author":"Billie Truitt","date":"2016-08-09","grid":"QVBQUyNTTkFQI0NPTUlDCk1FT1cjSE9CTyNPSEFSQQpJU0xFI09SQUwjTUlYSU4KR09MREJSSUNLI01PSVNUCkFTU0VSVCNLQVlPIyMjIwojIyMjSVNPIyNFTkNBU0UKQVJJU0UjTkFTQSNPTUlUCkRPTlRST0NLVEhFQk9BVApET1JBI0JFQVUjQVNLTUUKU1RFUkVPIyNCQVIjIyMjCiMjIyNNRVNBI1NUT1JNUwpTTUlMRSNDVVRUSFJPQVQKV0lSRVIjT0RPUiNHVVJVCkFMT05HI0xJTU8jQVRUTgpURU5TRSNET0VTI05FU1Q="},{"title":"08/10/16 INSTRUMENTAL","author":"Charles Slack","date":"2016-08-10","grid":"QUxWQSNBUkVBI1JPU1kjCkJFRVIjUk9BUiNFUklFIwpCQU5ET0ZCUk9USEVSUyMKRU5ERUQjRU5TVUUjIyMjClNUT05FUyMjRU5BQkxFRApTT1JUI0xBRCNBUk1PUlkKIyMjI1ZJUEVSI1NXT1JFCiNFTlNFTUJMRUNBU1RTIwpBVklBTiNTVEFMTCMjIyMKRklOR0VSI0FMQSNBRkFSCkNMRUFSRVIjI0RFUklERQojIyMjQURBR0UjTEFORFMKI0NPTUJPQlJFQUtGQVNUCiNQQVVMI0JJTEwjQUxPRQojVVJHRSNJTlNUI1RFTkQ="},{"title":"08/11/16 FOR SURE","author":"Carolyn Stewart","date":"2016-08-11","grid":"VEFURVIjVVRBSCNTTEFQCkVMSVRFI05BTkEjRUFSTApTUEVDSUZJQ0dSQVZJVFkKTElQI05BU0gjUExFRCMjCkFOSSNWT08jU09BUklORwpTRU5TRSNOWUxPTiNORUEKIyMjQVNTI0VPTiNBVE9QCiNDRVJUQUlOUEVSU09OIwpSQVZJI1ROVCNSQVcjIyMKRVNFI01FU0FTI0RFRU1TCkZBTkJFTFQjUFNJI05JTAojI1RFQUwjTEVJQSNBTEUKREVGSU5JVEVBUlRJQ0xFCkRSVUcjVEFOSyNPQ1R