{"id":"nysun-2005","publication":"nysun","year":"2005","count":252,"puzzles":[{"title":"Prime Interest, 1/3/05 (Monday)","author":"by Jay Leatherman / Edited by Peter Gordon (puzzleeditor@nysun.com)","date":"2005-01-03","grid":"UEFUQ0gjQU1GTSNPTERTCkVGSUxFI0JBTEkjQk9JTApSRVZFTCNVU0VTI0pPVkUKVFdPRk9SVEhFU0VFU0FXCiMjI1RJRSMjI01SVCMjIwpTVFAjU0FMI1NBRyNQQVcKVEhSRUVQRU5OWU9QRVJBCkFFT04jI0dQQSMjSURPTApGSVZFU1RBUkdFTkVSQUwKRlJPI0VFTCNTUkEjT1JTCiMjI1BFQSMjI1RJQyMjIwpTRVZFTkNPTUVFTEVWRU4KRU1JUiNIT09UI0dMSURFClhNQVMjRVpSQSNVTENFUgpZQUxFI1JFRUwjTk9FTkQ="},{"title":"Stealing Third, 1/4/05 (Tuesday)","author":"by Randall J. Hartman / Edited by Peter Gordon (puzzleeditor@nysun.com)","date":"2005-01-04","grid":"R1VFU1QjTElNRSNXQVNQCkFTVFJPI09NQU4jRUNITwpCRU5TUFJPVVRTI1RIT1IKRVJBI0hFSVNUI0VWRVJUCiMjI0JBTkUjREVMSVNUUwpBQkJPVFQjRkFWT1IjIyMKU0xBWVMjR0FNRSNHQVNQClBVTEwjQVJNT1IjSUxJRQpTRUxBI1NFRU4jU05PUkUKIyMjTk9URUQjV0FJVEVSCkNIQUdSSU4jQ09MQSMjIwpMQVJVRSNXSE9MRSNQUkUKQVNFQSNMSUVPRlJJTEVZClNUQUcjQUNSRSNOT09ORQpTQVNFI1NIRUQjT1VURUQ="},{"title":"Dinner for Two, 1/5/05 (Wednesday)","author":"by Gary Steinmehl / Edited by Peter Gordon (puzzleeditor@nysun.com)","date":"2005-01-05","grid":"I0hVVFQjTUFDI01BTUJPCkNBRFJFI0FHTyNVTklPTgpPTkFJUiNKT0hOQ0FORFkKTU9MQVJTI05PQUgjVEVYCkJJTExZQ1JZU1RBTCMjIwojIyMjU0FPI1RPQ09NRSMKQUdVQSNSQkkjI0hFSVJTCkdFTk5JRkVSRkxPV0VSUwpBTElHTiMjVE9PI0VOU0UKI1NURU5PUyNOQkEjIyMjCiMjI0xPUkVOWk9NVVNJQwpBRE8jVEFSTyNTVU5VTlUKUk9OU0lMVkVSI1NDQVRTCkNSRUFNI0VOTyNFTFZFUwpIQUxMRSNTREkjREVFUiM="},{"title":"Themeless Thursday, 1/6/05 (Thursday)","author":"by Ogden Porter / Edited by Peter Gordon (puzzleeditor@nysun.com)","date":"2005-01-06","grid":"REVBRFNFQSNERU1BTkRTCkFTQ0VORFMjT05FUk9VUwpSRUNSVUlUI0xFR1JFU1QKIyNSQUdUQUcjUk9PU1RTCk9SQU5HRVJPVUdIWSMjIwpQRUdHRUQjVFJJTU9UT1IKVVNIRVIjU0FHRVMjRVRBClNIQUQjRkFDRVMjTUFUVApFT04jU0xVUlMjVEFST1QKU1RBQ0NBVE8jVE9OU0lMCiMjI0xJTUVTTU9PVEhJRQpHWVJBVEUjU09SVElFIyMKUkVBUkVORCNERVNTRVJUCklBQ09DQ0EjQVJJRVRUQQpUSEVTSE9XI0xPRVNTRVI="},{"title":"\"You Can Say That Again!\", 1/7/05 (Friday)","author":"by Lyell Rodieck / Edited by Peter Gordon (puzzleeditor@nysun.com)","date":"2005-01-07","grid":"QU5PTiNNUEcjQ0FUTkFQClJBUkEjUkFEI1BCQU5ESgpBVkVNQVJJQSNTSFJFRFMKTVlNRU1PUllTTk9UIyMjCiMjI1JBRyMjVE9SRU9VVApSQVNTTEUjSkFXI1NVUEUKQUZUI0dSQUlMI1NUSUxUClNSSSNBU1NIQVJQI09BUgpURU5BTSNDQUdFUiNVVEEKQVNLUyNRRUQjQUVSSUVTClNIT1RHVU4jI1JBRSMjIwojIyNBU0lUVVNFRFRPQkUKUEVUSVRFI01PTlNJRVVSCkFSQVJBVCNQSEQjTklOTwpXQVhFUlMjU09TI0FMU08="},{"title":"Service for One, 1/10/05 (Monday)","author":"by Raymond Hamel / Edited by Peter Gordon (puzzleeditor@nysun.com)","date":"2005-01-10","grid":"U1RPTVAjUEVBS1MjVEFKCldBVkVSI0VMU0lFI1VURQpBVEFSSSNFQVRFTiNOQkEKWUVMTE9XS05JRkUjSUFOCiMjI09SRSMjUkVHRU5UUwpGTEFUVElSRSNSQU5HIyMKT0VSI09SQUxCI0xPRlRTCkxBTVAjRElWRUQjU09VUApLTk9MTCNESU5BSCNSQkkKIyNSSU9UI1NUUklDS0VOClRBUEVEVVAjI0JUVSMjIwpJTEwjR1JFQVNZU1BPT04KQUxBI0VSQVNFI0hPV0RZClJPVCNSRVNJTiNPTExJRQpBV0UjU1RFQUQjV0FTTlQ="},{"title":"Second Time's the Charm, 1/11/05 (Tuesday)","author":"by Sarah Keller / Edited by Peter Gordon (puzzleeditor@nysun.com)","date":"2005-01-11","grid":"UElMT1QjQlZEUyNDSEVaClNOT1JFI0xJUkEjSE9MRQpTVE9SRUxPU0VSI0VBU0UKVE9QI05BVEUjQVBFWEVTCiMjI0NBU1QjRUxJUyMjIwpTVFVSR0VPTkdFTkVSQUwKUEFUVEVSI0FHRUUjRUxPCkFSRVMjI1BDUyMjU0xFVwpOT1IjTk9BSCNBTVBFUkUKU1RPTEVQUk9QUklFVE9SCiMjI0xPUEUjTElORCMjIwpURUpBTk8jU0lTSSNNQVQKT1ZVTSNTVEFHRUJSVVNICk5JTkEjRUFDSCNVTlRJRQpFTEtTI0RVU1QjU0FUQU4="},{"title":"Read the Byline, 1/12/05 (Wednesday)","author":"by Steven Kahn and David J. Kahn / Edited by Peter Gordon (puzzleeditor@nysun.com)","date":"2005-01-12","grid":"REVNUyNHUk9HIyNBTE1BCk9WQUwjRU5EVVAjTUFJTQpKRURJI05BRElSI0FSTk8KT05FTUVHI0VESVQjR05VCiMjTElUSCNSRVNJREVJTgpUSElOQUlSIyNPTkFCRVQKSEFORyNTRVQjTkVISSMjCklSRSNUQVBJT0NBI0xQUwpTUEEjT05PUkRFUiNMQVAKIyNOWVBEI0VFTCNTRUdBCkNFRFJJQyMjU0xFTkRFUgpIRVJTQ0hFTCNNT0FCIyMKT1JPI1NBVkUjQVNQSVJFClJJR0EjS0FSQVQjUFJFUwpBTEVYI0FET1JFI0VETkEKTFlSRSMjRVlFUyNSU1RV"},{"title":"Punch Lines, 1/13/05 (Thursday)","author":"by Robert H. Wolfe / Edited by Peter Gordon (puzzleeditor@nysun.com)","date":"2005-01-13","grid":"Qk9MQSNMQUNFI1JFVFJP"},{"title":"Weekend Warrior, 1/14/05 (Friday)","author":"by Francis Heaney / Edited by Peter Gordon (puzzleeditor@nysun.com)","date":"2005-01-14","grid":"T0JKRVRTREFSVCNTQVJJCklMT1ZFUEFSSVMjT1ZFTgpMT1NFTk9USU1FI05FU1QKU0NII0RSRUFNI0dBUlRICiMjI1NPVCNERU1PVEFQRQpUQUdPTiNVTkRBTUFHRUQKQUxFUyNTRUUjTUFTRVJVCktFTiNTVFkjUkVEI0pJTQpFWEVNUFQjQU5UI0JPT1AKU1RSQUlORVJTI1NFRURTClBST1RFR0VTI0FQVCMjIwpBRVNJUiNSRVBFTCNBSUwKSUJJUyNNSU5VVEVSSUNFCk5FVFMjQkVJTk5FRURPRgpTS1lFI0FSQ1RBTkdFTlQ="},{"title":"Guys With Style, 1/17/05 (Monday)","author":"by Jeffrey Harris / Edited by Peter Gordon (puzzleeditor@nysun.com)","date":"2005-01-17","grid":"U1RBRkYjQVdFRCNBU0hFCk9SREVSI1JPTEUjU1RFTQpCVVpaQUxEUklOI1RBWEkKU0VFI0NPRUQjVEVFVEVSCiMjI1NUVU4jVElHUkVTUwpCT0JQQVRURVJTT04jIyMKVVNVQUwjI0RPVFMjQUJDClNMT1QjV1JJVFMjQVVSQQpUT1kjQkFJVCMjT0xERVIKIyMjQlVUQ0hDQVNTSURZClNDSUVOQ0UjT05UTyMjIwpOQU1BVEgjQlJFUiNBSEEKQVBQVCNGTElQV0lMU09OCktFRUwjT0lMUyNDT0FTVApFUklFI1JVTEUjSE9QRVM="},{"title":"Take Me Out, 1/18/05 (Tuesday)","author":"by Robert H. Wolfe / Edited by Peter Gordon (puzzleeditor@nysun.com)","date":"2005-01-18","grid":"QkFUUyNIRUVEI1BBUEFTCkVDUlUjSVNMRSNJQ0FSRQpUSEVDQVRTT1cjU0VUSU4KI0VYSFVNRSMjU1RPUkVTCiMjIyNHRU5UI0xPVUlTRQpQT1BHVU4jUklBTFRPIyMKSURMRVIjV0FWWSMjVEhPClBJRVRZI0lDRSNOSUdFUgpTRUEjI0lOS1MjT1JBTEIKIyNTUE9OR0UjU1BBU01TCk9DVUxBUiNUQkFSIyMjIwpBRVJBVEUjI0FUT0REUyMKU0NFTkUjQkFCWUJPT1JTCkVJREVSI09NQVIjVE9UTwpTTE9UUyNXQVJTI0VSQVM="},{"title":"Talking-Tos, 1/19/05 (Wednesday)","author":"Patrick Berry / Edited by Peter Gordon (puzzleeditor@nysun.com)","date":"2005-01-19","grid":"WEVEI0FDVCMjTUFETUFOCkVHTyNCUlVUI0VMT0lTRQpOQVpBUkVUSCNTQ1lUSEUKQURFUVVBVEUjSE9PVEVECiMjI1VQU0lERSNIVVNTWQpQSVJBVEUjRUxCT1cjIyMKU05BUkxTI1ZJT0xBVEVECkhBU1RZI0ZJWlojTk9HTwpBTlRFI0NPTEEjU1RPUk0KV0VBUlNPVVQjU0VUVEVFCiMjI1RPTlRPI1dBSVNUUwpPRkZBTCNTVUJVUkIjIyMKU09SVE9GI1BBTkNFVFRBCkNPT1RJRSNFSUdIVEVFTgpBVE1PU1QjRUxCRSNORVQKUkVNT1RFIyNTWUQjRE1a"},{"title":"Themeless Thursday, 1/20/05 (Thursday)","author":"by Nancy Kavanaugh / Edited by Peter Gordon (puzzleeditor@nysun.com)","date":"2005-01-20","grid":"UEFJUk9GRiNTRUFUVExFCkVTVE9OSUEjRVhNQVlPUgpEQVpaTEVSI1RVTUJMRVIKU1BBI0VMTSNBRE8jRVdFCiMjI0pBREUjVEVOVVJFRApQTEVBU0VETyNESVAjIyMKUk9VR0hST0FEI0FTUElDCkVDUlUjU1VTSUUjQ1VCQQpTS09BTCNURVJNUEFQRVIKIyMjUkVEI1NURUxMQVRFClFVRVNURUQjQ1JFRSMjIwpVUk4jU1JPI0hBTiNVTUEKRUdPVFJJUCNFTEFTVElDClJFQ0VJVkUjQURSSUFOQQpZU0hBUEVEI1BTWUNIRUQ="},{"title":"Family Ties, 1/21/05 (Friday)","author":"by Alan Arbesfeld / Edited by Peter Gordon (puzzleeditor@nysun.com)","date":"2005-01-21","grid":"V0FMTFMjTUFLTyNDQVNUCkFFSU9VI09ERVIjT1RUTwpHUk9VQ0hPT05TI0xBSVIKRU9OI0tFUlJZI1BVUkxTCiMjI1NFUkVOQURFTUlMTwpVU0hFUiMjIyNPUkIjIyMKWlNBWlNBUE9SQVRPUlMjCklSUiMjR1VSVVMjI09JTAojU0lCTElOR1JJVkFMUlkKIyMjQU9MIyMjI0FST1NFCkdFT1JHRVNDSUJMRSMjIwpSSUxLRSNXSE9NRSNCQUEKSUxJRSNDQUlOSU5DT0xOClBBVkUjT01OSSNDQU5FRApTVEVQI1BJU0EjRVBPWFk="},{"title":"\"Ow!\" , 1/24/05 (Monday)","author":"by Patrick Berry / Edited by Peter Gordon (puzzleeditor@nysun.com)","date":"2005-01-24","grid":"QlVMQiNTUEFSUyNaRVNUCkFTRUEjV0VMVFMjWlVOSQpIRUFEQkFOR0VSI1RSQU0KIyNERUFOTkEjI01PT1JFCkFQVSNLTkVFU0xBUFBFUgpMQVBTRSMjI1BJWCNBRFMKQVJUWSNQUkVFTUlFIyMjCiNUT05HVUVUV0lTVEVSIwojIyNDQUdJRVNUI1RNRU4KQUdFI1NFTiMjI0JVQkJBCkJBQ0tTVEFCQkVSI0FTUApBTExBWSMjQUlSSUVSIyMKU09BUiNKQVdCUkVBS0VSCkVSSUUjQURETEUjVkVHQQpERVJOI0JBWUVEI0VER1k="},{"title":"What About Bo?, 1/25/05 (Tuesday)","author":"by Kelsey Blakley / Edited by Peter Gordon (puzzleeditor@nysun.com)","date":"2005-01-25","grid":"UEFTRU8jTUFSRSNTQ09UCk9ORUFMI0FXT0wjVUhPSApTVEFSR0FaRUJPI0JPWk8KVE9OI0FNVVNFI1BBUEVSClNOT0IjRU1PI1NVUiMjIwojI0NJTk5BTU9OR1VNQk8KUFJBRE8jI0VSSU4jRUVMClJFU0VOVFMjU1BPUlRFRApPTkUjQ09JRiMjU0VSRlMKUEVZVE9OUExBQ0VCTyMjCiMjI0FNWSNBTEEjQU5UUwpESVNDUyNJR0lWRSNPVVQKSU1PSyNET0RHRVJBTUJPClZBSUwjRVdBTiNHUkVFTgpBWExFI05BWVMjU0lTU1k="},{"title":"And the Nominees Are ..., 1/26/05 (Wednesday)","author":"Roger DePont / Edited by Peter Gordon (puzzleeditor@nysun.com)","date":"2005-01-26","grid":"UkVTVCNPQUYjI01BQVMjCkFNSVMjQUxJI1NJTFZFUgpZT0RBI1RPTiNFTEFJTkUKIyNFUkEjRURTRUwjQUlSCkJPVyNDQ1ZJSSNJU1RPTwpFVEEjQVJFTlQjT0xPUkQKU1RZI0RJUkdFI05PUlNFClRPUyNFQkFOI0NERSMjIwojIyNFTVMjRVJPTyNPUkIKR0lQU1kjS1ZFTEwjU0VBCkFOSVRBI05FVklMI0NBQgpNQUNBVyNFUklDQSNBTVkKQkhUI0FERUxFI1JVUiMjCk9FVVZSRSNBV0wjR05BVApMQVJFRE8jTkVCI0xPQ0gKI1BFVFMjI0RSSiNJREVF"},{"title":"Taking Orders, 1/27/05 (Thursday)","author":"by David J. Kahn / Edited by Peter Gordon (puzzleeditor@nysun.com)","date":"2005-01-27","grid":"TEVJI1NVUEVSRyNCQVNICkFQVCNBTkdMRUUjSU5UTwpNRUFUTE9BRlBMQVRURVIKQkVMQSMjIyMjQUxUSU1BCiMjSUJFQU1TI1RBRSMjIwpST0FTVEJFRUZPTlJZRSMKSU5OI0VFUklFIyNMT0xMCkFMSVMjRElORVIjWVVMRQpMT0NPIyNOSUxFUyNOSUEKI1dFTExET05FQlVSR0VSCiMjI1ZVRSNHUkFWRUwjIwpJTVBBTEEjIyMjI0ZJQVQKSE9UQlVGRkFMT1dJTkdTCk9SQUwjRUxOSU5PI0dBUApQT1NFI1JPVFRFTiNTUlM="},{"title":"Weekend Warrior, 1/28/05 (Friday)","author":"by Byron Walden / Edited by Peter Gordon (puzzleeditor@nysun.com)","date":"2005-01-28","grid":"TEFNQVMjIyNGT1JUT1JECkFDSU5HIyNDT05GRVJFRQpHVU5JVCNUT05FRERPV04KU1BJVCNHT0xEQSMjIyMjCiNVQ0FOVFRPVUNIVEhJUwpLTk9CQklFUiNUQUhJTkkKQUNVUkEjU1NBI0dFU1RFCklUUlkjI1VQQyMjSEVIUwpTVVNBTiNQRVQjQ09NRVQKRVJFTk9XI0NBVE9MSUNBClJFU1RSSUNURURaT05FIwojIyMjI0VVUk9TI0RFTFQKUlVOUlVOUlVOI01FTkxPCkRXQVJGRUxNIyNPQ0NBTQpTRU5TT1JTIyMjQUtFUlM="},{"title":"Seven-Syllable Words, 1/31/05 (Monday)","author":"by Ogden Porter / Edited by Peter Gordon (puzzleeditor@nysun.com)","date":"2005-01-31","grid":"S0lTU09GRiNTT0RBQ0FOCkVNUE9XRVIjT1JJTk9DTwpFUElERU1JT0xPR0lTVFMKTkVUIyMjVEVUIyMjVElFCkVMRUNUUk9ESUFMWVNJUwojIyNBUkUjIyNET0UjIyMKQU1FUklDQU5JWkFUSU9OCkJPTyMjI0JVTiMjI0ROQQpDT05GSURFTlRJQUxJVFkKIyMjQUNFIyMjT1BFIyMjClBPTFlVTlNBVFVSQVRFRApFUEEjIyNVUEkjIyNFRVIKQ0FSRElPUFVMTU9OQVJZCk9SVklMTEUjTEFSQU1JRQpTVEFQTEVSI1NQRU5TRVI="},{"title":"Front Rows, 2/1/05 (Tuesday)","author":"by Patrick Berry / Edited by Peter Gordon (puzzleeditor@nysun.com)","date":"2005-02-01","grid":"V0VEI1NNT1JFUyNDQVJMCkFMSSNDT0hFUkUjT0xFTwpJRlMjUk9NQUlORUlERUEKRklUU0lOIyNDQUxMT0ZGClNOT1dQTE9XI1RBVSMjIwojI1JPVElOSUJPUFBFUlMKQUxUTyNURU5PUlMjSU9VCkZFSU5UI0REVCNFQUdMRQpBTk4jUklHT1JTI1NIRUQKUk9HQUlORVdFSUdIVCMjCiMjI1JWUyNTRUdVRUlORwpQUkVDRVBUIyNIRVJFSU4KUk9UQVRPUlRPVFMjVEtPCkVWQU4jVE9JTEVUI0hFTQpQRUxFI1NURUVEUyNTU0U="},{"title":"Dog Tags, 2/2/05 (Wednesday)","author":"by Gary Steinmehl / Edited by Peter Gordon (puzzleeditor@nysun.com)","date":"2005-02-02","grid":"UE9QUEEjTUFMRSNBRE9TCkVMU0lFI0FNRU4jQ1VCRQpERUlHTiNKT0VDT0NLRVIKIyMjUEVBI1NUT1VURVNUCkFCUkVBU1QjQ1JUI1NFQQpKRUFOU0hFUEhFUkQjIyMKQU5UIyNCRUEjI0FJREEjCiNKRVJSWVNQUklOR0VSIwojSVNFRSMjVUFSIyNPTEQKIyMjQkFSQkFSQUJPWEVSCkdBUyNMSUUjQU5PRFlORQpBVFRFTVBUUyNJTkQjIyMKTUFSS1NQSVRaI05JQ0hFCkVSSUUjRURJRSNFVEhFUgpTSVBTI0RFUk4jVFlJTkc="},{"title":"Themeless Thursday, 2/3/05 (Thursday)","author":"by Ed Early / Edited by Peter Gordon (puzzleeditor@nysun.com)","date":"2005-02-03","grid":"UFJPUFBFRCNHQVNMRVNTClJFVFJFQUQjUklQT1NURQpPQ1RPUFVTI0FMRU5DT04KU0xPVCMjIyNORUxTT05TCkFJTUVEQVQjRFJVI0JJTwpJTkFDT01BI0NPTiNBRVIKQ0VOVFJBTEJBTksjUlJTCiMjIyMjI0xJTiMjIyMjIwpOT0QjQ1JBWllFSUdIVFMKT1VSI0FBSCNPU1NVQVJZClNUQSNQSUEjTkFUSVZFUwpFRFdBUkRTIyMjI1RFU1QKSk9MTElFUyNMRVBBTlRPCk9ORUFDUkUjRUdHUk9MTApCRVJORVNFI1RPQVNURUU="},{"title":"Stud Finder, 2/4/05 (Friday)","author":"by Trip Payne / Edited by Peter Gordon (puzzleeditor@nysun.com)","date":"2005-02-04","grid":"TFVMTCNTQ0kjIyNGT1JECkFHRUUjQVJUI0hBTExFWQpXSElUVExFUyNBTU9FQkEKIyMjUElUVCNCUk9TTkFOCiNTSEFOSUEjQU1PUyMjIwojV0FTSElOR1RPTiNUUEsKU0FNU0EjI0lCTiNTQUxFCk9ZTCNUVVJCTyNWSVhFTgpVWklTI05PU1kjRVRIQU4KUkVORSNJVE8jQ1JVSVNFCiMjI0FHVCNOT0xBI0tFRApBRkZMRUNLI0NPTk5FUlkKU1JJI1JPSSNUT0RPIyMjClNFWElFU1RNQU5BTElWRQpBUlVNI1RIQU5FI1RSQU0KREVQUCMjI0NFWSNFRUxT"},{"title":"Rated XXX, 2/7/05 (Monday)","author":"by Gary Steinmehl / Edited by Peter Gordon (puzzleeditor@nysun.com)","date":"2005-02-07","grid":"I0NVU1AjQkVUI1JJR0lECkNBTkFMI1VNQSNBQ1VSQQpFUklDQSNTSVgjVkVOT00KTFVDS1lTVFJJS0UjR05QClRTRSNISVMjI0lTTEFNIwpTT0ZUT04jQ0JTI0VESVQKIyMjSFVOR0VSU1RSSUtFCkVQRUVTI0FSRSNBTk5FWApDQUxMRURTVFJJS0UjIyMKT1NMTyNBSFMjU0VSQVBICiNISVRJVCMjQU5UI0lSQQpBTVAjVEFMS1NUVVJLRVkKVklTQVMjT0FLI1JBSVNFCk9ORVBNI0FZRSNOVURFUwpXQVNURSNOT0QjU0xPVCM="},{"title":"Dealing Out, 2/8/05 (Tuesday)","author":"by Ed Early / Edited by Peter Gordon (puzzleeditor@nysun.com)","date":"2005-02-08","grid":"QUhBQiNIRVJBI0FHSUxFCkhBTEUjT1JBTCNNQVNPTgpNSURETEVBR0VTUFJFQUQKRVJBU0UjI0VYVCNSRUZTCiMjI0lWRVMjRVVSTyMjIwpJUkFESVNUUklCVVRJT04KTk9URSNUQVUjI1NFUElBClRVRSNIQVJESEFUI0FORwpFVFVERSMjRU1TI0FOS0EKUkVQRUFUQlJPQURDQVNUCiMjI0lET0wjU1BFQyMjIwpFUklDI1dBUiMjTVVMQ0gKR09WRVJOTUVOVElTU1VFCk9WQVJZI0VTQVUjRUFSTApTRU5TRSNTVFlYI1NURU0="},{"title":"C-F Oh!, 2/9/05 (Wednesday)","author":"by Steven Kahn / Edited by Peter Gordon (puzzleeditor@nysun.com)","date":"2005-02-09","grid":"U0lMTCNTQ1JBUCNNVVNTCk9CT0UjQVJFTkEjT1NMTwpGQVJHT1BBTlRTI0xFQU4KVFJFQVQjRkFTVFBBUlRZCiMjI1RPVVQjI0VSUyMjIwpCQUJPT04jQ09MT1NTQUwKRVNBI0xJVEVSIyNFTExBCkZBQkxFVEVMRVZJU0lPTgpPTkVBIyNBVExBUyNEVUQKR0FTTUFTS1MjU0hSRURTCiMjI0VJTiMjTUVURSMjIwpGQUJEUklWRVIjQUdBVEUKRUNSVSNGQVRCVVJHTEFSCkVSSUMjRklOSVMjQUxQTwpMRUVLI1NOQUdTI0VZRVM="},{"title":"Ate Is Enough, 2/10/05 (Thursday)","author":"by Randall J. Hartman / Edited by Peter Gordon (puzzleeditor@nysun.com)","date":"2005-02-10","grid":"TUVTQSNGTEFUI01FTEJB"},{"title":"Weekend Warrior, 2/11/05 (Friday)","author":"by Patrick Berry / Edited by Peter Gordon (puzzleeditor@nysun.com)","date":"2005-02-11","grid":"U1BBUlRBQ1VTI1NBQ0tTCkhPTUVBTE9ORSNJU0FBQwpBVEFHTEFOQ0UjR0VSUlkKUEFUSUVOVExZI0hBREFUCklURU1TI1JPT1NUI09PSApST1VFI1ZJU1VBTEpPS0UKT0VSI0hBVEUjVkVFUkVECiMjI0JBUkUjUEFTVCMjIwpBU1NVUkUjQ0FOUyNUSEUKU1RBTkRTRkFTVCNQQUFSCkhFTiNERVJCWSNDQVBSQQpMQVRFUiNJUlNBVURJVFMKQU1BVEkjVElUTEVST0xFClJVTk9OI09ORVBJRUNFUgpTUEFOSyNTSU1PTlNBWVM="},{"title":"The Big Apple of My Eye, 2/14/05 (Monday)","author":"by Joy M. Andrews / Edited by Peter Gordon (puzzleeditor@nysun.com)","date":"2005-02-14","grid":"VEhVTVAjQkVSUkEjRVZBCk9BU0lTI0FURUlOI05JWApUSEVLSU5HQU5ESSNURUUKRUFTRSNVU1RFRCNIT1dMCiMjI1NBRCMjR0xPT00jIwpTSU4jRklGVEVFTkxPVkUKQ0JBVFRFUlkjI1RJTEVTCkhBVkUjU09QSFMjRU9OUwpXUklUUyMjT1VUQVJHVUUKQVNHT09EQVNORVcjWUVTCiMjQU5OVUwjI1JFRCMjIwpGQVRTI1BMQVRFI09CSVQKVUZPI0hPVVNFT0ZZT1JLCkpBUiNJTkRJQSNBTEFNTwpJUlMjU1RFQU0jQkVUQVM="},{"title":"Family Values, 2/15/05 (Tuesday)","author":"by Lee Glickstein / Edited by Peter Gordon (puzzleeditor@nysun.com)","date":"2005-02-15","grid":"Q0FSR08jQVdSWSMjTEFQCkFHQUlOI1NIT08jQVVSQQpQUklNRVRIRVBVTVBLSU4KUEFMTSNBQ05FI0FSRUFTCiMjI0VUVEEjREFURSMjIwpDT0QjUkFOU09NI1NBTUUKQVJJU0UjI0NGTyNTUEVECk1BUExFTEVBRlJBS0lORwpFTFNFI0lNUCMjUklOU0UKT0JPRSNGSUVTVEEjR0FTCiMjI0tFRU4jTE9CUyMjIwpXSEVFTCNFVE9OI1VMQU4KTkVXU0tJTk1BR0FaSU5FCkJFRVQjU0NBTiNIWUVOQQpBRFMjI1JFTkUjU1FVQVQ="},{"title":"Instrumental Story, 2/16/05 (Wednesday)","author":"by Gary Steinmehl / Edited by Peter Gordon (puzzleeditor@nysun.com)","date":"2005-02-16","grid":"VElQI0FEQUdFI1dFRUtTCkVORSNQVVJSUyNPWExJUApBVFQjT0NUQUwjTEVGVFkKQkVFRiNLSU4jQUZDIyMjCkFHUkEjUEVEI0JCU0hPVApHUlVDQ0kjRk9VTCNVR0gKI0FTSUFOI0FOVEkjTlJBCiMjVEVUIyNURVNUI1RFTgpQU0kjQkFTSCMjWk9FIyMKSU9OI1VMRUUjQkVSUlkjClVGTyNST0FSI0lSSVNFUwpTQVZBR0UjQ1BSI09QQUwKIyMjQUxTI0xFRCNOT1JBClpFQlJBI0NPU01PI0lOTgpBUk1PUiNEQ0NBQiNORVQKUEFXTlMjU0tJTlMjVERT"},{"title":"Themeless Thursday, 2/17/05 (Thursday)","author":"by Patrick Berry / Edited by Peter Gordon (puzzleeditor@nysun.com)","date":"2005-02-17","grid":"Q0hPUFNPQ0tZI0FFR0lTCkhPTEVJTk9ORSNQUklDRQpBTkRBTFVTSUEjQUdSRUUKTk9JU0VTI0VHR1JPTExTCkdSRUVOI09WRVJUI0dBUwojIyMjVE9SRVJPI0JVTlQKTUVTU0NBTEwjT1JFSURBCkVTVFVBUlkjRVZBTkRFUgpTUElFTFMjVFdJVFRFUlMKTUVMRCNNT1JBTlQjIyMjCkVSRSNTQVJBTiNMQUxBUwpSQVRJT05BTCNCRUxVR0EKSU5UUk8jVEFLRVNJREVTClNUT0tFI09MSUdPQ0VORQpNT1NTWSNSQVRTTkVTVFM="},{"title":"Crossword Jukebox, 2/18/05 (Friday)","author":"by Ethan Friedman and Brendan Emmett Quigley / Edited by Peter Gordon (puzzleeditor@nysun.com)","date":"2005-02-18","grid":"TE9QRVojTU9FVCNUU0FSCkFOT0RFI0VDUlUjQUhNRQpUQVBJUiNXSElURVJPT00KSElQVE9CRVNRVUFSRSMjCkVSQSNaRUQjIyNUWVNPTgojIyNLRUcjVkNSUyNIQk8KQUxUQVIjT0NITyNGSUpJCkRPV05PTlRIRUNPUk5FUgpEVU9TI1RSSVgjUEVFVEUKRVNUI0lIT1AjV0VEIyMjClJFSUdOIyMjUEFOI0ZFRQojI01PUkVUSEFOV09SRFMKVEhFTEVUVEVSI0lNT1VUCk5FUkYjVE9XUyNEQU5DRQpURVNTI0FQU0UjRU5URVI="},{"title":"Family Half-Hour, 2/22/05 (Tuesday)","author":"by Gary Steinmehl / Edited by Peter Gordon (puzzleeditor@nysun.com)","date":"2005-02-22","grid":"QUNIRSNNSUNBIyNBSEFCClBST1ZPVVRBSCNCUkFEWQpQRVRFUk5FUk8jQUlNRUUKTE9UI0NJTkRZQURBTVMjCkVMSSMjIyNJU1AjIyMjIwpTRUUjI1NFQSNQU0FMTVMKIyMjI01BUkNJQUNMQVJLCktVV0FJVEkjQ1JBRlRTWQpHUkVHS0lOTkVBUiMjIyMKQkVUVEVTI0FUVCMjU1RBCiMjIyMjRk9SIyMjI0FJTQojQk9CQllCUk9XTiNIQUkKTUFGSUEjSkFOSE9XQVJECkJVTkNII0VUQ0VURVJBUwpBTU9TIyNURUVOI0VBU1Q="},{"title":"Underwearers, 2/23/05 (Wednesday)","author":"by Kelsey Blakley / Edited by Peter Gordon (puzzleeditor@nysun.com)","date":"2005-02-23","grid":"QURSSUZUI1BVUCNFUElDCkJPT0dJRSNPTkVPTk9ORQpFVk9MVkUjU01BUlRFTlMKREVGT0UjQVRFI0xJTUlUCiMjI09DRUxPVCNBVFNFQQpNR1QjQVNJRiNBTlkjIyMKRVJST1JTI0ZPUkQjQ0VPClJPQUxEI01JQ1JPQ0hJUApDT01FRFlBQ1QjQlNJREUKSU1QI1JBUkUjU0xJREVSCiMjI0JBTSNCQUlPI0VSQQpQU0hBVyNIT1dUT1MjIyMKVU5JVEUjQVhFI01FTExPCkRFVEhST05FI0RFVE9VUgpHQU1FU1RFUiNPUkFOR0UKRUtFUyNTU1MjRVNURUVT"},{"title":"Middle School, 2/24/05 (Thursday)","author":"by Jim Hyres / Edited by Peter Gordon (puzzleeditor@nysun.com)","date":"2005-02-24","grid":"U0hBUlAjUkVBTSNNQUlMCk5PS0lBI0VYUE8jQVVUTwpBUElORyNMRVNTI1RSRVgKR0lOR0VSSUNFQ1JFQU0jCiMjI0lCRVQjI09VUiMjIwpJUk9OT04jUEVOU0lPTlMKTklMI1lPU0VNSVRFU0FNCkFMREEjI1RBSSMjTEFHTwpXRUlTU01VTExFUiNLQVQKRVlFU0hBREUjQ1VSQVRFCiMjI0lBTiMjS09CRSMjIwojRUlHSFRQRU5OWU5BSUwKQVZPTiNSQVZFI0RPSUxZClJJVEUjQVJFQSNFSURFUgpDTEFEI1BFTkQjRVJBU0U="},{"title":"Weekend Warrior, 2/25/05 (Friday)","author":"by Byron Walden / Edited by Peter Gordon (puzzleeditor@nysun.com)","date":"2005-02-25","grid":"SElTUEFOSUMjUFJPTU9TCkFOQUdSQU1TI0xBVkFCTwpTQUxBUklBVCNBTkVNSUEKQVBUI1NBRyNDWUdORVRTCkRJQU0jREVCQVNFUyMjIwpPR1JFUyNTRU5EUyNGT1AKVVNFUklEI1NUVSNUSU5BCkJFTExCT1RUT01QQU5UUwpMWUxFI09SSSNCT1VHSFQKRUVPI0JMQU5DI1NORUVSCiMjI0JSSU5HSVQjVFJBWQpBQ1FVSVRTI05FQSNOSUMKTEFURU5UI05FRURDQVNIClNQSU5FTCNJTU1PQklMRQpPUFBPU0UjQkFTU0NMRUY="},{"title":"Rh Factor, 2/28/05 (Monday)","author":"by Ogden Porter / Edited by Peter Gordon (puzzleeditor@nysun.com)","date":"2005-02-28","grid":"RkFTVCNBTUZNI0dVRkYjCklTUFkjQkFMREVBR0xFIwpSSEFQU09EWUlOQkxVRSMKIyNSRUFEIyMjWU9ZTyMjClJIRUFQRVJMTUFOI1JBUApUT01CIyNCT0EjI1pJUFMKRVdFI1JISU5FU1RPTkVTCiMjI1pPT1MjI0hPTkVTVApDT01FVVAjI1BJTEUjIyMKUkhPREVJU0xBTkQjT0RFCkFJUlMjI1RBUCMjU0tJUwpNT0UjUkhVQkFSQlBJRVMKIyNUSEFJIyMjQUVPTiMjCiNSSFlUSE1IRVJJVEFHRQojQ0FNRU9ST0xFI09XRVMKI0FOTlMjU1RJUiNOQU1F"},{"title":"Lout, 3/1/05 (Tuesday)","author":"by Kelsey Blakley / Edited by Peter Gordon (puzzleeditor@nysun.com)","date":"2005-03-01","grid":"TUVOVVMjQ0xBRCNDQUxGCk9NQUhBI0FFUk8jVVJBTApQVVBGSUNUSU9OI1RSSU8KRVNFI0xBUyNNQVNDQVJBCiMjI0NPTiNDQVRBTFlTVApBU1NPUlRFUiNJUkEjIyMKU0VBVFMjUkVQT1NTRVNTCkhFUlIjU0lNT04jU0xBUApFUklFQ0FOQUwjRElTQ08KIyMjVk9MI1RFTEVDQVNUCkRFU09MQVRFI0lGUyMjIwpFWFBMT0RFI1RFQSNBTVAKTFhJViNCRVRCVUNLTEVTCkNPUkUjQU1PUyNURUFSUwpPTk9SI1JTVlAjT05TRVQ="},{"title":"Ups and Downs, 3/2/05 (Wednesday)","author":"by David J. Kahn / Edited by Peter Gordon (puzzleeditor@nysun.com)","date":"2005-03-02","grid":"SkFORSNXQUtFTiNBREEjCkVWSUwjQUdPR08jQlVNUApXQUxLVEhFRE9HI09OT1IKIyMjI09PTkEjI0VNQ0VFClNUTCNST0NLVEhFQkFCWQpDUkFGVFNZI09VUiNOQVMKQVVSQSMjI0pPU0lFIyMjClJFQUNIRk9SVEhFTU9PTgojIyNUT0lMUyMjI0lOR0UKUEhEI0xTRCNTUEFUVUxBCkxPT1BUSEVMT09QI1NFVApBUk5BWiMjQUxFRSMjIyMKSVJBTiNZT1lPVFJJQ0tTCk5JTEUjRFJJRVIjUVVJUAojRERTI1NBTkRZI1NFWFk="},{"title":"Themeless Thursday, 3/3/05 (Thursday)","author":"by Alan Olschwang / Edited by Peter Gordon (puzzleeditor@nysun.com)","date":"2005-03-03","grid":"V0VCQlJPV1NFUiNPTElOCk9QRVJBSE9VU0UjQ0FOQQpOT05PTlNFTlNFI0NVU1MKI1NFTUkjI1RBTE1VRElDCiMjIyNTVFJBWSNBUkVOQQpERUNLI0hBTlNPTiNSVVIKQVFVQVRJQ1MjRE9PREFECk5VUlRVUkUjRkVSTUFUQQpDQVZPUlQjVEFTU0VMRUQKRVRFI0JZV0FZUyNORVNTCkRJVFRPI0lMRUFDIyMjIwpST1RPVElMTCMjQUxBUyMKQU5JTiNTTElERVJVTEVTCk1BTlkjTElFVVRFTkFOVApBTEdBI0FTU0lTVEFOVFM="},{"title":"Symbols of Stardom, 3/4/05 (Friday)","author":"by Gary Steinmehl / Edited by Peter Gordon (puzzleeditor@nysun.com)","date":"2005-03-04","grid":"TElTQSMjRFZEI09BU0VTCkJMSU5JI0VFRSNDUkFWRQpKRVJFTVlGRVMjQ1VCRUQKIyMjV0hPT1BJQVVCRVJHCkFSQyNJUkUjI1NQQVJTRQpTSE9QUEUjTUVTQSNTT1MKSEVJUiMjTEVHRU5EIyMjCiNBTElDSUFBR1NUT05FIwojIyNNQVNPTlMjI1pFRFMKV0FEI1NBU1MjQVdFSUdICkFSRVRIQSMjUEdBI0xFRQpEQVZJRENVRklFTEQjIyMKRUZJTEUjRlJFRERJRUhHClJBVEVTI09BVCNPTkNVRQpTVE9SSyNTVFkjI0dPTkU="},{"title":"Finishing Touches, 3/7/05 (Monday)","author":"by Lee Glickstein / Edited by Peter Gordon (puzzleeditor@nysun.com)","date":"2005-03-07","grid":"U0hBV0wjRVJSUyNaRURTCldPV0lFI0xPT1QjSURPTApBUkVOQSNQQU5IQU5ETEUKTUFTT05KQVIjRVhDSVRFCiMjIyNTT1MjQUxMI0VTUApIT1dET1lPVUZFRUwjIyMKQUxJRU4jI05BTiNBTE1TCkxBTVAjQUNDUkEjVEVFTgpUWVBPI1ZBTCMjU1RFTk8KIyMjVEhFUkVTVEhFUlVCCkFSRiNVTVAjVFJZIyMjIwpTRVJFTkEjU1JJTEFOS0EKS0VZU1RST0tFI09DQ1VSCklWRVMjSVJJUyNDSEFSVApORVJPI0FSTVMjS0VBVFM="},{"title":"That's Stretching It, 3/8/05 (Tuesday)","author":"by Timothy Powell / Edited by Peter Gordon (puzzleeditor@nysun.com)","date":"2005-03-08","grid":"VkVSQiNDSElMRCNNTExFCk9SQUwjUk9NRU8jU09JTApJUk1BI0FUT05FI0RPTlMKQ0FTSEFOREtBUkFPS0UjCkVURSNUS08jIyNJU0xBTQpTQVlTTyNHUk9PTSNJUkUKIyMjQUxMI0lSUyNPS0xBCiNCQUxMQU5EQ0hFTkVZIwpEVVBFI1dJRyNBUkMjIyMKVU1QI0lOTEVUI1JFQU1TCkRBUklOIyMjSEJPI0RVRQojUk9DS0FORFJPTE9ERVgKVElWTyNCT1JBWCNBU1NUCkVERU4jQ0hPU0UjUlVMRQpORVNTI1NPUEhTI1NQSVQ="},{"title":"\"How Stupid!\", 3/9/05 (Wednesday)","author":"by Jack McInturff / Edited by Peter Gordon (puzzleeditor@nysun.com)","date":"2005-03-09","grid":"QkFSUyNTVEFHRSNNVVNICkFMT1QjVElMRVMjQU5LQQpESU1FI1VQSU5USEVBSVIKIyNBUkFCI0dSQVkjQlJBCkZVTk5ZQk9ORSNCUExVUwpFTVQjTllVIyNQUkVFTlMKREFJUyMjTkFNRUlUIyMjCiMjQ0xBTUNIT1dERVIjIwojIyNBUlJFU1QjI1NBTFQKQ1JBVkFUIyNJUkEjWUVBCkxBU0VSI1NBRkVUWVBJTgpJVFMjQVNJRiNORUVSIyMKQ0hFV1RIRUZBVCNDSVRFCkhFUk8jQUdJTEUjQ0NFRApFUlRFI0hFWEVEI0hFQUQ="},{"title":"Turning State's Evidence, 3/10/05 (Thursday)","author":"by Joe DiPietro / Edited by Peter Gordon (puzzleeditor@nysun.com)","date":"2005-03-10","grid":"UlVJWiNIQVJNUyNMQUNLCklOR0UjQVJVQkEjQUJMRQpESU9SQU1BQkFMQU5DRVIKU1RST0xMQlkjI1ZJU09SCiMjI0lJSSMjQ01PTiMjIwpPV0lOR05JTU9ZV0FHRVMKU0FMT04jU0FNTVMjSURPCkFLSU4jTE9PUFkjR1JJUApLRUEjU0FCUkUjTk9UQ0gKQU5ERUFOQUlETklHSFRTCiMjI0FKQVIjI0FYRSMjIwpFWFRSQSMjREVNT1RBUEUKRFJVTktST1lXRU5UTUFECkdBQkUjT1dORVIjRU1NWQpFWUVEI0JMRVNTI1JPU1M="},{"title":"That's a Good Point, 3/11/05 (Friday)","author":"by Ogden Porter / Edited by Peter Gordon (puzzleeditor@nysun.com)","date":"2005-03-11","grid":"T0NBTkFEQSNXQURFU0lOClBBUkFQRVQjRU5NQVNTRQpJQ0UjU05PQkJZI1JVVEgKQUlNIyMjI0FTQSNFUklFCk5BU1QjSEFMIyNBUkVOQQojIyNIRUlSTE9PTSNSRUQKIyNGT1VSQ09STkVSUyMjCkFCQSNSRVNUQ1VSRSMjIwpMQVNTTyMjQkFTI0JPQVoKQ0lURSNFTE8jIyMjTUxYCkFMTEEjTklYT05TI0FFQwpUT0FUVVJOI0xPVUlTWFYKUlVOQU1PSyNBVkVOVUVC"},{"title":"Stove Toppers, 3/14/05 (Monday)","author":"by Gary Steinmehl / Edited by Peter Gordon (puzzleeditor@nysun.com)","date":"2005-03-14","grid":"REVSTiNTT05HI01BSEFMCkFRVUEjQVJFQSNTQ0FMUApMVUdTI0lHT1IjREVMSVMKTEFSQUZMWU5OQk9ZTEUjCkFUQUxMIyMjRUxTI01OTwpTRVQjRU1NRVRUI0NBQU4KIyMjSElSRVIjI0ZPUlRFCiNBTElTVEFJUkNPT0tFIwpBQlVUUyMjQ09PTFMjIyMKQVJNUyNSRUFNRUQjSlJTCkhBTSNXT04jIyNJREVBTAojU09MRUlMTU9PTkZSWUUKUElYRUwjSU9UQSNMT0JFCkVWRU5UI1NQSVQjQU1BVApaRVNUWSNURVNII1RFTlM="},{"title":"Special K, 3/15/05 (Tuesday)","author":"by Steve Salmon / Edited by Peter Gordon (puzzleeditor@nysun.com)","date":"2005-03-15","grid":"WUFaI0tJUksjU0hBS0VTCkFYRSNOT1VOI1RVUk5VUApSSUIjSU5UTyNQRVRFUkkKRE9SQUdTI1RSQURFV0FSClNNQVNIIyNBTlQjI01JQQojIyNTVFJPUFMjS1ZFTEwKT0FLI01BV1IjVU5JWCMjCkZPTlRBSU5FI0xJTElFUwpGTElFUlMjVEVOVEFDTEUKIyNDUkVFI1RSQVAjT0xFClRJS0lTI0FZRVNJUiMjIwpBTk4jI1BPUyMjQ0FTVFMKSVNBT0FPS0kjU0tZQ0FQCldPTUFOUyNHTEVFI0FCRQpBTEVSVFMjSEVBUiNOT1cKTkVTU0lFI1RPTVMjU09T"},{"title":"Pause for Effect, 3/16/05 (Wednesday)","author":"by Seth A. Abel / Edited by Peter Gordon (puzzleeditor@nysun.com)","date":"2005-03-16","grid":"U0FTUyNTUEFTTSNDRk9TCk9OVE8jTUFOSUEjQUlXQQpIRUFETUFTVEVSI1JFRUYKT1dOI0FSVFMjUlNUTE5FCiMjI0RJTUUjV0lQRUQjIwpJTkZBTVkjUEVBUkxKQU0KTUVPV1MjVEFOR1kjVU1BCkVBUk4jQ09OREUjRkRJQwpBVEUjREVJVFkjQlVHU1kKTk9GUklMTFMjQ0FSRVNTCiMjQUlTTEUjUE9OWSMjIwpKRVRTS0kjSEFESiNFQkIKQUNIRSNTUElORE9DVE9SCkdPRVIjVElEQUwjRU5ZQQpTTFJTI1NFRU1FI0xBU1Q="},{"title":"March Madness, 3/17/05 (Thursday)","author":"by Charles E. Gersch / Edited by Peter Gordon (puzzleeditor@nysun.com)","date":"2005-03-17","grid":"U0hBUSNNQ0pPQiMjSkVUCk9BSFUjQVJPTUEjSE9QSQpTSEVBI0RBTk5ZI0FWSUQKI0FNWU5BTUVJU0FMSUNFCiMjI0xVTVBTIyNHTEFTUwpDQU1FTCMjI0NMT1dOIyMKQVdFI0xJVFRMRSNBTUZNCkxPR0UjV09NRU4jWU9SRQpGTEFZI0FMQ09UVCNPQVQKIyNMRUFTRSMjI0FVTlRTCk9ESVNUIyNQQUlSUyMjIwpCRVRITEVIRU1TVEVFTCMKRUNITyNNT1JBTCNEREFZClNLSVQjTUFJWkUjVEFLRQpFU0MjI0FYTEVTI09NRU4="},{"title":"Weekend Warrior, 3/18/05 (Friday)","author":"by Manny Nosowsky / Edited by Peter Gordon (puzzleeditor@nysun.com)","date":"2005-03-18","grid":"TEFTVFJPVyNGTEFTSEVECkFDRUhJR0gjQUlSVEFYSQpNQ05BTExZI1VOS0VNUFQKUFJFVEVFTiNMQVlBQkVUClJFQ1MjU09GVEMjTVVOSQpFVEFJTCNUUkkjVkVSU0UKWUVOVEFTI0VOTEFSR0VTCiMjIyNSQVJFR0FTIyMjIwpTTUFDS0RBQiNWRVRURUQKSEFMQVMjU0lTI1NBVURJCkFUSVQjR0hFTlQjVU5JUwpLSVRDSEVOI09VVFJBQ0UKRU5USFVTRSNPTkVJT1RBClJFTElTVFMjWklOTklBUwpTRUVUSEVTI0VTVEVMTEU="},{"title":"Spacers, 3/21/05 (Monday)","author":"by Steve Picus / Edited by Peter Gordon (puzzleeditor@nysun.com)","date":"2005-03-21","grid":"QU1QUyNLQUJPQiNDTEFXClRBUkEjQUxBTU8jUEFQQQpNT09OU0hJTkVSI0FNRVgKIyNTS0lOIyNHRU8jQVhFCkpBUEFOI1NUQVJHQVpFUgpBTEUjRVRUQSMjRFJFU1MKTUVSIyNBVU5UQkVFIyMjCiNDT01FVENMRUFOU0VSIwojIyNPRkFLSU5EIyNZQU0KRVFVQUwjI05PRUwjRVZBClNVTkJBVEhFUiNPSUxFRApDT00jVEhFIyNXT1JFIyMKT1JBTCNFQVJUSE1PVkVSClJVREUjVFJJS0UjTkVSTwpUTUVOI0FERE9OI1NMQVQ="},{"title":"Top Seeds, 3/22/05 (Tuesday)","author":"by Gary Steinmehl / Edited by Peter Gordon (puzzleeditor@nysun.com)","date":"2005-03-22","grid":"VEFDT01BIyNIQU5LRVJTCkFET05JUyMjQVJSSVZBTApQT1RFTlQjU1lDQU1PUkUKQVJUI1RPVEVNUyMjS0VXClNOT0IjUk9TQSNDQkVSUwojI05JUCNZQUtLRVIjIyMKRElUWkVTI01FQUxZQlVHClJOQSNUQVBFUlMjTklMRQpBUklBI1RPU1NFUyNSRUEKV0VMTEtFUFQjTVVSREVSCiMjI09MRFBSTyNNT0IjIwpIQVJFTSNZRUFSI1dSQVAKQURPIyNBQ0VUSUMjQUdPCklIT1BFTk9UI1NBVElSRQpUT05FTE9DIyNFTUlORU0KSUNFUklOSyMjUkVFU0VT"},{"title":"'Tain't, 3/23/05 (Wednesday)","author":"by Robert H. Wolfe / Edited by Peter Gordon (puzzleeditor@nysun.com)","date":"2005-03-23","grid":"QUJCUiNCQUdHWSNQU1NUCkNMRU8jQUdJTEUjQVFVQQpNSVNTVEhFQk9BI1NVTksKRU5URVIjRUJCI1NUQUdFClNJU1RFUiNTRUNUT1IjIwojIyNURUVNIyNSQVJFRlkKQUxGQSNTRUFBSVIjUkVBClBFUiNDT0xERkVFI09BUgpFVkUjQVJET1JTI0NPUkQKRFlTQVJUIyNPVUNIIyMjCiMjSFVEU09OI1BIQVNFUwpQRVNUUyNGQVMjSU5BTEwKUkFURSNSVU5OSU5HUklPCkVTQVUjT1NDQVIjRUdPUwpLRVJSI0JFRVBTI1NFVEg="},{"title":"Themeless Thursday, 3/24/05 (Thursday)","author":"by Adam Cohen / Edited by Peter Gordon (puzzleeditor@nysun.com)","date":"2005-03-24","grid":"UUFOVEFTIyNHUkFOQURBCkFSQVJBVCMjUkFCQkxFUwpURVJFU0EjQUlSQkFMTFMKQU5ORSNZQU1NRVIjU1VFClJBSVNBI1JBWVMjU1BJTgpJU0EjVkVSTiNUQU9JU1QKIyMjU09MSURTI01BQ0VTCiMjRElDS1ZBTkRZS0UjIwpGT1JURSNFQkVSVFMjIyMKQUxDT1RUI0VMSUEjVEVBClNFQU4jRUxBTCNOQUhVTQpDQVIjSEVBUlNUI0xFR08KSU5UUkVQSUQjQURBR0VTClNORUVSRVIjI1JPTUFOTwpNQVJTUkVEIyNUUk9QRVo="},{"title":"Scale Model, 3/25/05 (Friday)","author":"by Alan Olschwang / Edited by Peter Gordon (puzzleeditor@nysun.com)","date":"2005-03-25","grid":"Q09UUyNTVEFTSCNBRkFSCkVaUkEjVE9RVUUjRUxMRQpET09NI0RPVUJMRVJFRUQKQU5USVMjS0FTRU0jWEVTClJFU0FMRSMjI05FQVQjIwojIyNNSVhFREZBUk1JTkcKSk9CI01FVFJFI1lFTUVOCkFSRUEjQ0hVUk4jU0VSQQpCRUxMRSNBSU1BVCNST1cKU09MT0xBTkRJTkdTIyMjCiMjWUVBUyMjI0FJS01BTgpFTEYjVElBTlQjRklFUk8KVElMVEVERE9XTiNUQVJUCkFWT1cjRUlFSU8jT0RJRQpUWVBPI1NBTFRTI1dFRFM="},{"title":"Car-Rent Event, 3/28/05 (Monday)","author":"by Gary Steinmehl / Edited by Peter Gordon (puzzleeditor@nysun.com)","date":"2005-03-28","grid":"T1BUUyNDSElQI0RFTklNClhPVVQjQVVSQSNFVk9LRQpUT1BET0xMQVIjSklCRUQKQURFI05MQ1MjTUFMTCMjCklMTCNUU0UjSVJWI0VHTwpMRU9WSUkjT05CVURHRVQKIyMjSU1HQU1FIyNSQU5UCiNVU1NFTlRFUlBSSVNFIwpFVEFUIyNFTlRSRUUjIyMKUkFSQUFWSVMjRUxERVJTCkFIQSNQRU4jUFNJI1NVRQojI1NVSVQjSElTUyNDU0kKRlJPWkUjS0lMT0hFUlRaCkFUVElDI0lST04jUk9MRQpURUFTRSNNRVRFI0VXRVM="},{"title":"The Four-H Club, 3/29/05 (Tuesday)","author":"by Marjorie Richter / Edited by Peter Gordon (puzzleeditor@nysun.com)","date":"2005-03-29","grid":"QkFTU0kjQVNUUk8jVFdPCkFDVE9OI0lPV0FOI0hFTQpUSElDS0VSVEFQRSNSQU4KRU9OI0JZRVMjUEFUQUtJCkRPR1NMRUQjTE9ERVMjIwojIyNFT1MjTUFSQVRIT04KT0NURVQjSkVUVFkjQ1VFCkZBSEQjRlVNRVMjTUFTVApGTFUjTEVOT1gjUkFOVFMKU0ZHSUFOVFMjRkVaIyMjCiMjT01FR0EjQ0FWRUlOUwpHT0ZFUlMjU1VSRSNET0UKUkFXI1RISU5LRVJCRUxMCkFIQSNFVUJJRSNJUkFURQpGVVIjU0lNUFMjRUFTRVM="},{"title":"The Ol' Switcheroo, 3/30/05 (Wednesday)","author":"by Ogden Porter / Edited by Peter Gordon (puzzleeditor@nysun.com)","date":"2005-03-30","grid":"TExBTUEjUEFTVCNBR0VECkVBU0VMI09SRU8jWkVSTwpBQ0hSSVNUTUFTQ0FSTE8KUkVFTCNMQVkjQ0FMTUVSCiMjI09CSVQjSEFSRSMjIwpESVJUWVBPTE8jUEFSS1MKRVJBU0VTI0FCUyNTSE9UCkJJWiNTVU5CT1dMI0lSQQpVU0VEI1BJRSNFSVNORVIKVEhST1cjQ0xPRFNXRUFUCiMjI1JBR0UjUklQQSMjIwpBQ1RJSUkjR0FTI0JFU1MKQkxPVEZST01USEVCTFVFCkVVUk8jVFJFRSNURUxFWApMRU5TI0hFTlMjQ1JBWlk="},{"title":"The Last Goodbye, 3/31/05 (Thursday)","author":"by Paula Gamache / Edited by Peter Gordon (puzzleeditor@nysun.com)","date":"2005-03-31","grid":"QUJDI0VPTiNUSU5BIyMjClJBSCNUQkEjT1ZFUlNFRQpFUlIjSElHSFBJVENIRUQKQU5JVEEjU0FMRVMjT1JBCiMjU1VOQkFLRUQjUFJJTQpMT1RUI1NUVVYjVE9URVMKUFJJT1JJI05FUEhFVyMjCkdMQVJFRCNBTEFSI0FIQQpBWU4jU0VBTSNXT0xWRVMKIyNTSUVTVEEjTkJBRVJTClNQTEFUI01UR0UjVFJPVApDUkFNI0FDQURFTUlBIyMKUkVUI1BMQVRBI0lOREVYCkFHRU5UT1JBTkdFI0lCTQpHT1JPVU5EI1NFTiNPUkUKIyMjV0lHUyNLT1MjU09O"},{"title":"The Edge of Reason, 4/1/05 (Friday)","author":"by Eric Berlin / Edited by Peter Gordon (puzzleeditor@nysun.com)","date":"2005-04-01","grid":"T01BTUEjT1NTTyNBQ0VTCkxPR0lDI1NIT1IjQ09TVApTVEVOVCNTQVVURVJORVMKVEhFT1VURVJMSU1JVFMjCiMjI1JQSSNERUNJREUjIwpTVEwjT0xFI0RPUiNTTkEKVFJBSU5FUlMjI1NBVE9OCkFJREEjRFJFU1MjTkFESQpUS0lOUyMjQ0hFU1ROVVQKU0VFI1RBUiNFR08jVEhBCiMjU0NPTkVTI1VNUCMjIwojQVJPVU5EVEhFQkxPQ0sKQUJPVVRBQk9ZI1JBQ0hFClBMT1AjQkFORCNFVEhBTgpFRU1TI0VZRVIjUk9PRlM="},{"title":"Here Comes the Pitch, 4/4/05 (Monday)","author":"by James S. Kaplan / Edited by Peter Gordon (puzzleeditor@nysun.com)","date":"2005-04-04","grid":"Q0JTVFYjU0NBTEQjSkFSCk9QVElDI1BJWElFI0FMQQpDT09FUiNJVEVNUyNNSVoKT0VSI1RPTllTT1BSQU5PCiMjTUVBUkEjIyNPSUxFUgpFQVNUUEFMT0FMVE8jIyMKQVJPU0UjI05ZVSNUQVRBClJFRiNTQ1JFRUNII0xPRwpTQUZFI05JUCMjSVJBVEUKIyMjTEVORE1FQVRFTk9SClBPQk9YIyMjTExBTUEjIwpTVFJJUEVEQkFTUyNSQkkKQVRFI0VRVUlQI05BS0VECkxFVyNSVUVSUyNBUklFTApNUlMjVElMREUjR0VOUkU="},{"title":"Taking a Beating, 4/5/05 (Tuesday)","author":"by Stella Daily / Edited by Peter Gordon (puzzleeditor@nysun.com)","date":"2005-04-05","grid":"R0FEUyNBUVVBI0dVRVNTCklDRVQjTFVORCNBU1BJQwpHUkVBVExBU0gjTEVPTkEKTElNQk8jUkVPSUwjQ0FNCklEUyNNSVJBQ0xFV0hJUAojIyNOQVZFTCNMWUUjIyMKQ0FQSVRBTFMjIyNOQ0FBClBST1RPTlMjV0VTVEVORApBUEVSIyMjQkFMTEJPWVMKIyMjSU9DI0VTU0FZIyMjCkJMQUNLQU5EVEFOI1RBTQpSQU4jQVJPU0UjR0FVR0UKQU5OT1kjQk9CQllGTEFZClNDRU5FI0VSSUUjUklQRQpIRVhFRCNMRU5UI09QRVI="},{"title":"Quiet, Please, 4/6/05 (Wednesday)","author":"by Ben Tausig / Edited by Peter Gordon (puzzleeditor@nysun.com)","date":"2005-04-06","grid":"RUZMQVQjTkVBVCNBV0VECkJMSVNTI1VTTUMjTUlMRQpCQVNLRVRDQVNII09TSEEKU1BBI0xVTFUjT1JDSElECiMjI1NJVEUjU1RPT0QjIwpMRURUTyNJTUFDUyNPREEKSURJT1RTI0VOSEFOQ0VTClRVU0sjSEFTRUsjT1RCUwpFQ0hFTE9OUyNFQVRPVVQKUkVEI1NPTllTI0JFUkdTCiMjSVJBVEUjQUlSUyMjIwpORUdBVEUjQUxBSSNSQVcKT1JHUyNNSVhBTkRNQVNICkRJRVQjVVNFUiNHRU5JRQpTRVJBI1BPU1kjRVhJU1Q="},{"title":"One Man Out, 4/7/05 (Thursday)","author":"by John Minarcik and Craig Kasper / Edited by Peter Gordon (puzzleeditor@nysun.com)","date":"2005-04-07","grid":"SURPTlQjI0FERFMjV0hPCk5BTkNFIyNOT0VMI0VPTgpUVVNDQU4jVE9NT1JST1cKT1BUI1JVTiNST1RVTkRBCldIQVQjTkFCUyMjSEVJUgpOSUdII1NVRSNCQVJSRUQKI05FVSMjU0NBUkYjU1NTCiMjI0dJVkVBREFSTiMjIwpNSVMjTFVBVVMjI0lSUyMKSU1QQUxFI1NPRCNDRU5UClNQQU4jI0hFUkUjS05PVwpURVNUQVRFI0JCUSNBV0UKQkFTRUJBTEwjVFJPTVBFCk9DSyNFWFBPIyNTSEVFVApXSFkjTElTVCMjVE9EQVk="},{"title":"Awkward Connections, 4/8/05 (Friday)","author":"by Robert H. Wolfe / Edited by Peter Gordon (puzzleeditor@nysun.com)","date":"2005-04-08","grid":"UkVMQVRFIyNUV0EjQk9aCkFST01BUyNIRUVMQk9ORQpOSUNIRVMjVU5BTExJRUQKREVLRSNBVE0jS09BTEFTCk9QUVIjWUFQI1FUUiMjIwpNQVVTI1NVQiNVU0VTT04KIyNBVFQjI0FTSSNES05ZCkNCUyNTUEFDS0xFI1VURQpPT0gjS0lOS0lMWSNOT1QKUExFQSNDT1EjI0VMSyMjCkFUUklTSyNVTVAjQVFVQQojIyNSRVEjQUJTI1lVTkcKTVVVTVVVI1lBWSNCSURFCkFSVEVSSUFMI0NIQVJPTgpQSU5OQUNMRSNIQVJLRUQKU1NFI1RLVCMjT0RFU1NB"},{"title":"Soo Saying, 4/11/05 (Monday)","author":"by Brendan Emmett Quigley / Edited by Peter Gordon (puzzleeditor@nysun.com)","date":"2005-04-11","grid":"UkVMQVgjQ0FUTyNBQ1JFCkFMQU1PI0FTSU4jQlJFRApUSU1FWCNSVEVTI0ZPUk0KIyMjTk9UV09SVEhBU09VClNJT1VYV0FSI1JJQkJPTgpBUksjT09YI0VFTCNZVEQKV0tSUCMjI0dSQURFIyMjCiNTQVVMVFNURU1BUklFIwojIyNORUFUTyMjI1NUQVIKQU1JI0RKUyNNUEcjQ1NBClRPTVRPTSNTT1VTQ0hFRgpBQk9ZTkFNRURTVUUjIyMKUklOSyNIQUxFI0lDT05TCklMSUUjQVhFTCNUSUxFUwpTRVRTI0xJU1QjU0xFRVQ="},{"title":"Horse Sense, 4/12/05 (Tuesday)","author":"by Kelsey Blakley / Edited by Peter Gordon (puzzleeditor@nysun.com)","date":"2005-04-12","grid":"Q0hFWCNXT1JUI1NDQVJZCkxBVkEjQVZPVyNDVVJJRQpBTEVYI1RFUkkjSVBBU1MKREVMSVZFUllTVEFCTEUjCiMjI1NJUlMjVE9UTyMjIwpFVEMjRVNQTyNNSUFUQVMKTEVBRiNLRVJSI0NSSU1QCkRFUklESU5HQUNBREVNWQpFTkVSTyNUQVBBI1NUQVIKUkFXRUdHI05JTkEjT05PCiMjI1BUQVMjRFZEUyMjIwojREVMSUdIVENBVkFMUlkKUElYQVIjVVJJUyNMRUlBCk9OSUNFI0NVVEUjU0FDSwpET1RFRCNLRVlTI0FSRVM="},{"title":"English Lesson, 4/13/05 (Wednesday)","author":"by  Robert H. Wolfe/ Edited by Peter Gordon (puzzleeditor@nysun.com)","date":"2005-04-13","grid":"QUNDRURFI0JMQUgjU1RZCkxBUkRFUiNBSURBI0lXTwpHUk9XSU5HU0VBUyNHQVkKQVNQSUMjTEFHI0FNTklPCiMjI05JQ09MRSNHQUlOUwpDQUJBTkEjIyNCT1JOIyMKT1NVI0dNSU5PUiNBR0VFClNTVFMjRVJBVE8jVEJTUApJTlRPI0xBUFRPUCNVU0UKIyNFTE1TIyMjQ1JVU09FCklORElBI0JCU0hPVCMjIwpUT0REWSNFQVIjR09UVEEKQ0ZPI0JFR1lPVVJQQVJECkhFVyNFUklFI1BBSU5FRApZRU4jU0FORCNJTUFHRVM="},{"title":"Themeless Thursday, 4/14/05 (Thursday)","author":"by Ogden Porter / Edited by Peter Gordon (puzzleeditor@nysun.com)","date":"2005-04-14","grid":"V0lUQ0hZIyMjQUJPTUJTCk9ORUhPVVIjI1JBR09VVApXQVRFUkxPTyNNRURVU0EKI1NFQU0jQlJBI1pFU1RZClNUQVRFTU9UVE8jTkVTUwpUVVQjTFVUSEVSQU4jIyMKT1BFRCNNSU8jQUdBU1NJCk1PVE9SI0NEViNBU1dBTgpQUkVOVVAjT0lMI0hFTVAKIyMjQlJPTlhaT08jRU1VClNFR0EjUkFKUVVBUlRFVApPWEVZRSNQRVUjS09MTiMKRkFUTElQI1dFTExUT0RPCkFMR09SRSMjTElFT1ZFUgpTVE9SRVIjIyNUWVJFU0U="},{"title":"H&R Blocks, 4/15/05 (Friday)","author":"by Jeffrey Harris / Edited by Peter Gordon (puzzleeditor@nysun.com)","date":"2005-04-15","grid":"QlJPS0FXI0lSUyMjVFJX"},{"title":"Walking Stick Shift, 4/18/05 (Monday)","author":"by Anthony J. Salvia / Edited by Peter Gordon (puzzleeditor@nysun.com)","date":"2005-04-18","grid":"T1RUI0FERVBUI1NDQVJGClJJTyNORVZJUyNPSUxFUgpTQU0jQ0FJTkVNVVRJTlkKT1JFI0lOQ0EjT1BJQVRFCk5BU0NFTlQjQ1JVWiMjIwojIyNBTkEjSEFQUEVORUQKUE9TSVQjUlVTSCNOT1BFCkFMQU4jQ0FORVMjS0VFTgpHQUdBI0FOVFMjQkFMRVMKRVZFTklOR1MjUEVOIyMjCiMjI0RPTkUjTUlORVJBTApVTk1BREUjTEFORCNBQkEKS0VZQklTQ0FZTkUjWkFQCkVBUkVEI1VNQkVSI0VTRQpTVEFMRSNSRUVEUyNESEw="},{"title":"Mama's Boys, 4/19/05 (Tuesday)","author":"by Randall J. Hartman / Edited by Peter Gordon (puzzleeditor@nysun.com)","date":"2005-04-19","grid":"TU9ERU1TI0NJTlEjRVRTCk9NRUxFVCNBUklBI01PSQpNQU5GUkVETUFOTiNCUlIKQVJJIyNQRVAjI1RFQVNFCiMjTUFSSUxZTk1BTlNPTgojIyNOVU4jI09BU0VTIyMKU0lGVFMjR0FSWSMjSU9VCk1BUlNIQUxMTUFUSEVSUwpVTkkjI05FVFMjUk9TRVMKIyNBTkdJRSMjU1VSIyMjCk1BUkNFTE1BUkNFQVUjIwpBU1RPUiMjRkFBIyNTTE8KR05VI01BUlRZTUFSSU9OCk5FQyNBQ05FI1BMVU5HRQpBUksjTkVBUiNTSU5HRVM="},{"title":"Ease-E Does It, 4/20/05 (Wednesday)","author":"by Joe DiPietro / Edited by Peter Gordon (puzzleeditor@nysun.com)","date":"2005-04-20","grid":"UkFOI0FDSEVEI0RPUEVECkVHTyNMQUlORSNFUkFUTwpDQVZFVFRURUEjQ0FTVEUKQVRBTE9TUyMjUEFUVEVSClBFU08jQ09VR0hGRUUjIwojIyNQTEFOTkVEI1NURVcKUkFDRUlOI1JFU1QjUk9FCk9DSFJFI0JJWiNVUEVORApBUkUjVUtFUyNTVFJFU1MKREVFUiNJQ0VCTFVFIyMjCiMjUEVOTktORUUjQ0JHQgpMQVBET0cjI0FQUklPUkkKQUZMQVQjQ1VSVElTU0VBCklSRU5FI1VORElEI0NBTApDT0FUUyNCT1NOUyNTVFk="},{"title":"Set 'Em Up, 4/21/05 (Thursday)","author":"by Gary Steinmehl / Edited by Peter Gordon (puzzleeditor@nysun.com)","date":"2005-04-21","grid":"R0VNIyNOQ0FBI0xPR0lDCkVUTyMjQUxVTSNVUEVORApUQVJPI05PREUjR0VFS1MKQUxUSEVBR0lCU09OIyMjClRJRUlOIyMjQUhTI1NIRQojSU1PTERGQVNISU9ORUQKIyMjI0FPVVQjIyNUSVJFCk1BSURJTk1BTkhBVFRBTgpBUkxPIyMjTElFUyMjIyMKSkFTT05BTEVYQU5ERVIjCkFMQSNPV0UjIyNFQU1FUwojIyNTVEVWRU1BUlRJTkkKQllXQVkjRUxBTiNBR09HCkJPV0lFI1JBWkUjI1JJTQpRVUlMVCNTTEVXIyNFUkE="},{"title":"Wacky Weekend Warrior, 4/22/05 (Friday)","author":"by Trip Payne / Edited by Peter Gordon (puzzleeditor@nysun.com)","date":"2005-04-22","grid":"V09SU1RNQU1BI1BSRVVLCkFOQUdSQU1PRk9SRUxTRQpQT1NURVJJTkFMT0NLRVIKSVNQSUVTI0tSQUZUSUVSClRPUENSSUJTI0ZPT0RMWQpJTlJFI1NBVFVSTlJPQUQKI0dPVFRFTkFOSURZTEwjCiMjIyNFWElUSUNVIyMjIwojR09IQUhBVE9IRUlESSMKTElLRVdJTk9OQSNJUlRTClZDUlRBQiNPVVJCU0lERQpERUFSUklHQSNEQVJOQkMKQ0xBSU1URU5UU1RBS0VTCklMTEJFQVRVUE9IRU5SWQpNT0VFUiNJTk9ORUxPQUQ="},{"title":"Death Row Records, 4/25/05 (Monday)","author":"by Ogden Porter / Edited by Peter Gordon (puzzleeditor@nysun.com)","date":"2005-04-25","grid":"TUFSUyNGUkVUUyNBQkJSCklDRVQjRUVSSUUjTkVPTgpOQ0FBI0VESUNUI09SQlMKQ0VMTEJMT0NLVEFOR08jCkVOVEVSIyMjRUxJI0VMRgpTVFkjQURNSVJFUiNSSU8KIyMjU1dPT04jIyNNQU5YCiNKQUlMSE9VU0VST0NLIwpNQVJYIyMjU0FXSU4jIyMKT0xFI0lOREVYRUQjUFJPCkJBQSNET0UjIyNPR0xFRAojUFJJU09ORVJPRkxPVkUKWkVVUyNESVZBTiNBV0VECklOR0UjTEVFUlkjWkVSTwpQT1NFI0VTU0VYI0VERU4="},{"title":"Seeking Asylum, 4/26/05 (Tuesday)","author":"by Gary Steinmehl / Edited by Peter Gordon (puzzleeditor@nysun.com)","date":"2005-04-26","grid":"UklGRiNTUEVDUyNTT1RTCkVDUlUjRUFUTUUjQ1JPUApDSEFSTEVTVE9OI0hBUkEKIyMjTlVUU0FOREJPTFRTCiNBUEFDSEUjIyNST1JFTQpDUkFDS0VEQVNNSUxFIyMKUk9QRSMjI1RSQU0jUFNUClVTRSNSQUlTSU5TI09LUwpYRVIjQUxPRSMjI0FSRUEKIyNCQU5BTkFTRk9TVEVSClNDQU5UIyMjVEFPSVNUIwpDVUNLT09DTE9DS1MjIyMKSUxLQSNHUkFWRVlBUkRTCk9QRVIjUkFDRVIjSUhPUApOQURBI0VNSVJTI0RPWlk="},{"title":"Ix-Nay, 4/27/05 (Wednesday)","author":"by Lee Glisktein / Edited by Peter Gordon (puzzleeditor@nysun.com)","date":"2005-04-27","grid":"QUxPSEEjQUdPI01BUExFClJPTUFOI0JJWiNBTElFTgpBR0VOVCNFTE8jRE9URUQKTE9OR0lTTEFORERVU0sjCiMjI1NPVyMjRVdFIyMjIwpBUEUjQ0FTRSNJTkNBUFMKREVBVEhUQVNLI1NISVJFCk1BVEgjSEFTQVQjQU1JRQpJQ0VVUCNCRUxPV0RFU0sKVEVORE9OI1hFTkEjUk1TCiMjIyNSRUQjI0lEQSMjIwojUE9TVE9GRklDRUJPU0MKVE9SQUgjTE9UI1NBTU9BCkFMQU1PI0FDRSNJVEFMWQpST0xFUyNUSU0jTkVSRFM="},{"title":"Themeless Thursday, 4/28/05 (Thursday)","author":"by Edgar Fontaine / Edited by Peter Gordon (puzzleeditor@nysun.com)","date":"2005-04-28","grid":"TUFQUyNBSEVNI0lOQ09HCkFQRVMjTE9HTyNTT0xBUgpDQVJST1RUT1AjQU5JVEEKQUNUI1ZFVCMjQklPUFNZCldISVRFUlVTU0lBTiMjIwpTRU5PUiNCRUFTSEFNRUQKIyNFTkRTI0NSVCNOQU1FCkNBTllPVUhFQVJNRU5PVwpBQkNTI1JJRCNPQVRIIyMKQkFZT05FVEVEI1NUQVNICiMjI1BBU1NTRU5URU5DRQpFU1BSSVQjI0NPRSNEQVIKTU9SQUwjUVVBRFJJTExFCk1BSU5FI0VSTk8jVkVFUwpBUk1PUiNESVRaI0VERFk="},{"title":"Pardon My Latin, 4/29/05 (Friday)","author":"by David J. Kahn / Edited by Peter Gordon (puzzleeditor@nysun.com)","date":"2005-04-29","grid":"U0lSRU4jVEFCI0lURU1TClBSSU1PI0VMSSNOT0JFTApMT0dPTiNNT0JJTEVCQVkKSU5HI0NBUEUjQ09EIyMjCkNPRSNPTEUjSEVDI1FCUwpFUlIjTUFTU0UjT0NVTE8KUkVNQVAjVEhYI0FSSUFTCiMjT1JBI0ZPUCNQRURTIwojS1JJUyNVR08jUFBQIyMKQ0lURVMjR1VTI1JFUlVOClBSSVNNI0lOVEhFI09TVQpPS1MjRUFUI0ZBTiNRVU0KIyMjRU5EI1NBTFQjVVJCCkNBVEFUT05JQyNJSE9QRQpPVEVSSSNPTlQjQ0FURVIKT01FTlMjR0VPI0VZRVJT"},{"title":"Pasta Perfect, 5/2/05 (Monday)","author":"by Gary Steinmehl / Edited by Peter Gordon (puzzleeditor@nysun.com)","date":"2005-05-02","grid":"TUFTSCNHVUxQUyNUQUJTCkFMVE8jT1BFUkEjSU1BQwpJU0FZI1NFVkVOI0VCUk8KTUFDQVJPTklQRU5HVUlOCkVUQyNPTERTIyNJU1NVRQpSSUFMVE8jI0FDVCNITVMKU0FURSMjU1VHQVJZIyMjCiNOT09ETEVTQVJPVU5EIwojIyNORUFURVIjI0xBSUQKUEFQI0FEUyMjQ09FUkNFCkFMTE9UIyNTTEFQI1JBTgpTUEFHSEVUVElTVFJBUFMKU0FJTCNHSEVOVCNFVFJFCkFDTkUjR0FWRUwjU09JTApUQVNTI1NXRURFI1RST1k="},{"title":"Weighing In, 5/3/05 (Tuesday)","author":"by John Underwood / Edited by Peter Gordon (puzzleeditor@nysun.com)","date":"2005-05-03","grid":"TE9XIyNNQVJTSEEjVEFCCkVTQVUjSU5TVEVQI0FURQpGTFlTV0FUVEVSUyNUV0EKVE9TU0VTIyMjRE9DVE9SCiMjI1JFTUFJTlMjTE9SRApXT08jQkFOVEFNQk9PS1MKSEFJTCMjREVUQUlOIyMjCk9STEFORE8jVU5ORVJWRQojIyNURVJST1IjI1NFQVQKRkVBVEhFUkJFRFMjRE5BCkFYTEUjU0FTU0lFUiMjIwpTSEFSUFMjIyNFTEVDVFMKVEFSI0xJR0hUVEFCTEVTCkVMTSNFTkRVUkUjQVVOVApERVMjQUdSRUVEIyNFU1M="},{"title":"\"English Pronunciation Is Tough!\", 5/4/05 (Wednesday)","author":"by Jack McInturff / Edited by Peter Gordon (puzzleeditor@nysun.com)","date":"2005-05-04","grid":"QU5HU1QjQ09IQU4jRVNQCkxPQVRII0FCT1VUI1JITwpHT0xERU5CT1VHSCNZRU4KQUtBI0dBTUVTIyNFS0VECiMjI0RBWkUjRU5ERUFSUwpXSE9PUElOR0NPVUdIIyMKUk9VVCMjI09BVEgjQk9XCkFSVFMjS0lOVEUjQ0FMSQpQQU8jTUlSTyMjI09ERVMKIyNGT0xMT1dUSFJPVUdICkZBU0hJT04jSEFVTCMjIwpJQklTIyNXSUVMRCNRVUEKTkFHI0NPT0tJRURPVUdICkFTSCNCT09FUiNFVklMUwpMRVQjU09EQVMjUkFUSU8="},{"title":"Three in a Row, 5/5/05 (Thursday)","author":"by James S. Kaplan / Edited by Peter Gordon (puzzleeditor@nysun.com)","date":"2005-05-05","grid":"U0FSQUgjI09UQyNCRUxBCkVWSVRBI09ORUkjQVhFTApDQVNFV09SS0VSI0ZJWEUKVFNLI0FUSVAjUkVGTFVYClNUWU1JRSMjRFVMTEVTIwojIyNBSVIjQUlTTEUjIyMKWE1BUyNJU05UI0FNT1JF"},{"title":"Weekend Warrior, 5/6/05 (Friday)","author":"by Byron Walden / Edited by Peter Gordon (puzzleeditor@nysun.com)","date":"2005-05-06","grid":"UkFOQ0hPI0FUVEVTVEVECkFURU9VVCNUSEVQSUFOTwpGTEFVTlQjV0lERVRVUk4KRkVSTlMjTUFTI1hFTk9OCkxJRlQjVUFSI1BFU1RMRQpFU0EjVU5DI0JPRyMjIyMKT1VUT05USEVPUEVOU0VBCkZSQU5DSVNYQlVTSE1BTgpGRUxUQUxJVFRMRUxPU1QKIyMjI1JFWCNXQVMjS1RTClBST0JFRCNPQVIjUEVSSQpST1ZFRCNBTlkjRUxGSU4KSURFRUZJWEUjU1RBUlZFClpJUkNPTklBI0RPTkVFUwpFTlRIUkFMTCNJTktFUlM="},{"title":"Still Life, 5/9/05 (Monday)","author":"by Gary Steinmehl / Edited by Peter Gordon (puzzleeditor@nysun.com)","date":"2005-05-09","grid":"U1RBVFMjVEFSQSNTVEVXCkNBTk9FI1NDVU0jTUFSRQpBRE9CRSNBTU1PI0FYSVMKQkFOQU5BUkVQVUJMSUMjCiMjI0dJTCMjVVJBTCMjIwpMRU1PTkxBV1MjS0VQSSMKQVJJIyNJTE8jUkVTSU5TCk9SQU5HRUZSRUVTVEFURQpTT01FUlMjU1REIyNOT0wKI1JJQ0EjUEVBQ0hCT1dMCiMjI0tJTE8jI0FBQSMjIwojQVBQTEVDT01QVVRFUlMKQVNJQSNBT05FI0xUQ09MCkRBTEkjU05VRyNFTE9QRQpPUEVOI1RPU1MjUkVORVc="},{"title":"Pen Names, 5/10/05 (Tuesday)","author":"by Van Vandiver and Nancy Salomon / Edited by Peter Gordon (puzzleeditor@nysun.com)","date":"2005-05-10","grid":"QUNUSVYjTUFaRSNPUEVEClRIRVNFI0FMRVgjQklMRQpNSVRFUkpPSU5UI0VYSVQKIyNFRVlPUkUjI0NSRVRFCkVQQSMjV0lORUNPT0xFUgpSRVRBSUwjI0RPV04jIyMKSVRFTVMjQ0xJUCMjSURTCkNBVENITUVJRllPVUNBTgpBTEUjI0VOVlkjQVJFTkEKIyMjUFNTVCMjQlJJQkVSCkNBVVNFQVNUSVIjI1VTRQpBUk5BWiMjQVJBQklDIyMKQk9JTCNIT0tFWVBPS0VZCkFNRk0jT1hFTiNPVEVSSQpMQVlTI0dPTkUjRUFURU4="},{"title":"Refrain, 5/11/05 (Wednesday)","author":"by Lee Glickstein / Edited by Peter Gordon (puzzleeditor@nysun.com)","date":"2005-05-11","grid":"S0FaT08jRkFSTSNEUkFCCkVYRVJUI0FMT0UjQU9ORQpQTEVBQllXRUVHVVlKT0UKVEVTVCNFTkUjT1JMT05TCiMjI0VTTCMjU0hFQSMjIwpBUFAjRUxJQkVNWUJFQVUKQkFSI0FTTkVSIyNPVkVOCkNSRUFNI01BViNXUklTVApUVE9QIyNBQ0VMQSNUT0kKVklQUElFVEhST1cjQVBFCiMjI0FOVEUjI0RBQiMjIwpTRUFSQ0gjU0FHI0FSVFkKRkxFRUhJR0hTRUFISUhPClBPT0wjQ09PUCNDQU1BWQpESU5TI1NURVMjRUlFSU8="},{"title":"Themeless Thursday, 5/12/05 (Thursday)","author":"by Mark Diehl / Edited by Peter Gordon (puzzleeditor@nysun.com)","date":"2005-05-12","grid":"QUFST05TT1JLSU4jVkNSClRSQVZFTEdVSURFI0VSQQpVU01FREFMSVNUUyNTT1MKTkVBUiNQRU5UQVRFVUNICkVORFVQIyMjI0dTRVZFTgojRUFTRUQjQlVTI1JJVEUKIyMjRVJPVElDI1RPVVRTCkNJVCNLRUVCTEVSI1NJUwpBUkFCWSNBTEFOSVMjIyMKTU9QRSNBTEUjU1BBU00jCk9ORUVHRyMjIyNFQkVSVApNT05UUkVBTEVSI1JBTUEKSVJBI09OQVVUT1BJTE9UCkxFRCNTVEFURVNFTkFURQpFU0UjWlNBWlNBR0FCT1I="},{"title":"Two-Bit Humor, 5/13/05 (Friday)","author":"by Seth A. Abel / Edited by Peter Gordon (puzzleeditor@nysun.com)","date":"2005-05-13","grid":"QURPUyNDUk8jU0FURUQj"},{"title":"A Few Choice Words, 5/16/05 (Monday)","author":"by Ed Early / Edited by Peter Gordon (puzzleeditor@nysun.com)","date":"2005-05-16","grid":"Q0FQRUsjQ1BBUyNFQ1JVCkFMT05FI0hVTEEjU09VUgpQT1NTRSNBTE9UI0FNRU4KUFVUVVBPUlNIVVRVUCMjCiMjI0VDTyNFQVJOI0xCUwpBSEEjQVBFIyNBVFdJTEwKR09ERUwjVEFGVCNBTUlFCkxPVkVNRU9STEVBVkVNRQpFVkVMI0FOVEUjQkVORVQKVEVOU0VTIyNFUEEjVFlTClNTVCNZRUFII0FMSSMjIwojI1VTRUlUT1JMT1NFSVQKWkVSTyNOQVRPI05BUkNPCkFSRUEjVFJFWCNFQUdFUgpQQVJLI09JTFkjU0NPVFQ="},{"title":"Mixed Doubles, 5/17/05 (Tuesday)","author":"by James S. Kaplan / Edited by Peter Gordon (puzzleeditor@nysun.com)","date":"2005-05-17","grid":"UElUUyNMRUdPI1NDRU5UCkVDSE8jRUFSUCNDT1ZFUgpST0FSI1RSRUUjT0xJVkUKS05JVFRJTkdOT09ETEVTCiMjI09VVCMjRVNQIyMjIwpEUkFGVEJPT1JTI09QVFMKUkFNI0VFTFMjT0xESEFUCkFET1JFI0VBVCNBRE9CRQpNT1JBU1MjS0lBUyNUT0UKQU5FVyNPUkFOR0VQT09MCiMjIyNNT08jI0VSQSMjIwpUQUxLSU5PTkVTU0xPT1AKQVJJRVMjU0VMQSNBUklBCk1FQU5UI1RSSUcjVEFMTApQQVJUWSNTT1NPI0VMU0U="},{"title":"There Was an Old Lady Who Swallowed a ..., 5/18/05 (Wednesday)","author":"by Ogden Porter / Edited by Peter Gordon (puzzleeditor@nysun.com)","date":"2005-05-18","grid":"R0FHUyNPQUYjI09MRU8jCk1NTEkjRkxZQllOSUdIVApBTUVYI1NQSURFUlZFSU4KTk9ORkFUIyNBTFkjU09VCiMjTk9TI1NUWUxFI1RVVApPRkZMQUJFTCMjIyMjIyMKQklSREJSQUlOUyMjTkJDCklERSNDQVROQVBTI1RSVQpUT1kjI0RPR0NBVENIRVIKIyMjIyMjI0lSU0FVRElUCkxTRCNTUElURSNSVEUjIwpPTk8jSEFEIyNXRUlHSFQKQ09XQ09MTEVHRSNDUkFXCkhPUlNFU0VOU0UjTEVJQQojRFlBRCMjREFEI0VFTFM="},{"title":"Three From the Big Ten, 5/19/05 (Thursday)","author":"by David J. Kahn / Edited by Peter Gordon (puzzleeditor@nysun.com)","date":"2005-05-19","grid":"TUlEQVMjVEFMQyNTTFVSCkFET1JOI09MQVkjRUFTRQpST0NDTyNQSU1QRVJORUwKIyMjSE9PU0lFUkRBRERZCkFNQklUUyMjUlVHI0lUTwpST0FNI0FNUCNTSUdOT04KTUFORSNHT0FUI0VSRyMjCiNCQURHRVJDT1VSQUdFIwojI05FRSNLRVJOI1lFQVIKQkVBU1RTI1JFUCNNQVNUCklSUyNTUEEjI0VDQVJURQpHT1BIRVJOQVVHSFQjIyMKTUlMSVRBTlRTI0FURUFNCkFDSUQjV0lUUyNNRVRSTwpDQVRFI0xFQVIjUFJBVFQ="},{"title":"Weekend Warrior, 5/20/05 (Friday)","author":"by Manny Nosowsky / Edited by Peter Gordon (puzzleeditor@nysun.com)","date":"2005-05-20","grid":"VFdPQklEIyMjQlNIQVJQClJFUElORSMjSE9OT1JFUgpBUkVUSEEjRklYQVRJVkUKVkVOVEVEI0lESUcjWkVQCklOVEVSV09WRU4jRk9SQQpTVE9ORUFYRVMjRElORVIKIyMjIyNURU4jR0lKQU5FCklUVEFLRVNBTExLSU5EUwpTSEFQRVIjVE9BIyMjIyMKVE9ORVIjRklSU1RUSU1FCkhVR1MjTU9PTlNISU5FUgpBR0kjVE9STiNDT05NQU4KVEhFS0lOS1MjQVJDQU5FClNUUkFGRVMjI1NBVVRFUwpPU1NJRlkjIyNFWFBFUlQ="},{"title":"Boards Game, 5/23/05 (Monday)","author":"by Gary Steinmehl / Edited by Peter Gordon (puzzleeditor@nysun.com)","date":"2005-05-23","grid":"UEFDVCMjTEJTI0NBR0VTCkFMT0hBI09MRSNFQk9MQQpTTEVFUCNUQUNLTEVCT1gKU1VSRkVEVEhFTkVUIyMjCkFSQ0FERSMjREVCI0JSTwpURUVOI0NBUkVFUkdPQUwKIyMjI1dPUkUjI0FIQU5ECiNMSUNPUklDRVNUSUNLIwpET05ITyMjVEVURSMjIyMKVkFOSUxMQUlDRSNNSU1JCkREUyNXSUwjI1JFQUdBTgojIyNXT0xGR0FOR1BVQ0sKUE9XRVJUUklQI0dMQVJFCkFET1BUI0VHTyNTRU5PUgpURU5USCNESVAjI1NBU1M="},{"title":"Gone Fishing, 5/24/05 (Tuesday)","author":"by Lee Glickstein / Edited by Peter Gordon (puzzleeditor@nysun.com)","date":"2005-05-24","grid":"UFVCUyNHQU1FI0JBTkFMCkVQRUUjT0xFUyNJQklaQQpUT1JOI01BTUEjR0VOVVMKRU5HSU5FTU9VTlQjRVJFCiMjI09VWk8jI0JFQU1FUgpTVEFSVCMjTEVBTlRPIyMKSE9OI1NBVkFHRSNFTkRTCklOTiNPTkVNT1JFI1RFQQpQRUVSI0RSRVNTWSNIRU0KIyNNQURSQVMjI0lUU01FCkJPT1RFRSMjTUVOVSMjIwpBUFIjRklORElOR05FTU8KTkVSVkUjQUlEQSNEUklQCkdST0lOI0lNQUMjUklDRQpTQVdFRCNSRVNUI0FDRUQ="},{"title":"Off Broadway, 5/25/05 (Wednesday)","author":"by Kevan Choset / Edited by Peter Gordon (puzzleeditor@nysun.com)","date":"2005-05-25","grid":"TUdNVCNNQ0ZVWlojTVBICkFSSUEjQU1FTElFI09MRQpQSU5LI0RPVEVPTiNORUEKI01PRSNJTkEjTk9MT0FEClNBTFNBUyMjT05TRVRTIwpBQ1RUV08jQVZBI1hPVVQKUEVBSEVOI1ZBVCNJTlJFCiMjI0VEVyNFTEkjTkVFRApKRUZGI0lOTiNPUkcjIyMKQ0FMSSNTT1UjTk9UQVJZClRSRUYjQ1VFI0FET1JFUwojUkFUU09OIyNMRU5USUwKU0lQSE9OI1JBUCNNSVQjCkFOSSNVU0FVU0EjQUNNRQpTR1QjU0lHSEVSI1NMQU0KRVNTI0FOT1JBSyNTRU5U"},{"title":"Themeless Thursday, 5/26/05 (Thursday)","author":"by Victor Fleming / Edited by Peter Gordon (puzzleeditor@nysun.com)","date":"2005-05-26","grid":"RVBJU0MjVE9NSEFZREVOClNBU0hBI0FOVElOT0lTRQpQSUxFRCNTVEFORFVQVE8KT05FRElNRSMjREVHIyMjCiMjI09aQVJLUyNTT1JUQQpUVVJOI0lTQUFDI1RFUlIKSVNFRUlUI1RSVVNUU0lOCkxFR0hPUk4jQVJDSElWRQpFTkdJTkVFUiNTSEFERVMKUkVBTSNEUkFDTyNURVRTClNURVdTI0RFQVJFUiMjIwojIyNSQVMjI05ZVElNRVMKSkFTT05LSUREI0FHQVBFCklERU5USUNBTCNUSFJFRQpNQU5HQU5FU0UjU1RFRUQ="},{"title":"High-Scoring Scrabble Words, 5/27/05 (Friday)","author":"by Alan Olschwang / Edited by Peter Gordon (puzzleeditor@nysun.com)","date":"2005-05-27","grid":"Q09TVEEjQ0FOSSNGQVdOCkFOVElDI09SRUwjQVJJQQpQU1lDSE9BTkFMWVpJTkcKRUVMUyNCUkVSI09PWkVTClNURSNHSVMjR09HTyMjIwojI1NRVUVFWkFCSUxJVFkKQ09IRU4jI0VMSVMjTUlWCk9LRUQjUkVMRVQjRVBFRQpPUkUjV0FORCMjSEVBRFMKS0FUWkVOSkFNTUVSUyMjCiMjI0FMVE8jT09QI1NFVwpUQVJQUyNJQUdPI0VJUkUKT1hZUEhFTkJVVEFaT05FCkZJTkUjVkVJTCNNSU5TSwpVU0VEI0FERVMjUE9TVFM="},{"title":"Serial Numbers, 5/31/05 (Tuesday)","author":"by Kelsey Blakley / Edited by Peter Gordon (puzzleeditor@nysun.com)","date":"2005-05-31","grid":"UE9SVEFMI0xBSFIjIyMjCkVST0lDQSNPQk9FI01EUwpSRU9QRU4jRkxVWCNBSU0KVE9NIyNFQVRFUiNBTk5BCiMjU1RJTFRTI0hBTU1FUgpNQUNBREFNI1RPUE1BU1QKQVNIQ0FOI0NPVVBPTiMjClJJT1QjRUVMRVJTI01PVwpZQU8jVEhSVVNII0hBSEEKIyNMT1VJU0UjT01BTklTClVOSElOR0UjRFVTVE1PUApNT09MQUgjQ09STkVBIyMKUElVUyNXSEVBVCMjTkFNCkVTUyNTQUlEI09ORUJJVApEWUUjVFlLRSNVTkJPUk4KIyMjI1VTRVMjUkVCQkVT"},{"title":"Nowhere, 6/1/05 (Wednesday)","author":"by James S. Kaplan / Edited by Peter Gordon (puzzleeditor@nysun.com)","date":"2005-06-01","grid":"Q0hBRCNQUkVaI0NSQVpFClBPVVIjRUFWRSNNT1hJRQpBTERBI1NURVQjSURJTkcKI0VJR0hUVFJBSU5JTkcjCiMjI1NFTEwjI1JVTkdTIwpQVU4jTEVFQ0hFUyMjIyMKVUhBVUwjI1VSTiNNQVpFClBPUEdPRVNUSEVFQVNFTApTSEFII1JZRSMjR0VBUlMKIyMjI0JBUlJJRVIjUE9FCiNTVFJVVCMjU0VFTiMjIwojSEVFTE9GRk9SVFVORSMKUElYRUwjTElMSSNERUJUCkVSQVNFI09MREUjRVNBVQpSRVNFVCNQRUVSI1NUWVg="},{"title":"Baby Boomers, 6/2/05 (Thursday)","author":"by Anthony J. Salvia / Edited by Peter Gordon (puzzleeditor@nysun.com)","date":"2005-06-02","grid":"RVVSTyNFVENII1RSRUFECkFSQUIjR0VBUiNEQVdOUwpSQVRFI0dBVE8jSUNZIyM="},{"title":"Weekend Warrior, 6/3/05 (Friday)","author":"by Joe DiPietro / Edited by Peter Gordon (puzzleeditor@nysun.com)","date":"2005-06-03","grid":"QU1QVUxFI0ZMWVNQRUNLCldFTExFRCNSRUFSQVhMRQpBVE9ORUQjQUdMSVNURU4KUk9UQVJZRElBTCMjUkFUCkRPWkVTI0lMTCNUU0FSUwojIyMjQU5UI1NOSVBQRVQKQkVUQVRFU1QjSU1FTERBCkVSSU4jSFlBVFQjTkFVVApUSURJRVIjU0VUU1RZUEUKVEVBTVNVUCNOSUEjIyMjCkVDTEFUI0lTVCNZV0NBUwpSQVcjI09OVEhFV0hPTEUKT05BU1BSRUUjQ0hBUk9OCkZBVkFCRUFOI0hFTEVOUwpGTEVXU09MTyNPTkVER0U="},{"title":"Ego Trip, 6/6/05 (Monday)","author":"by Seth A. Abel / Edited by Peter Gordon (puzzleeditor@nysun.com)","date":"2005-06-06","grid":"T1BTI1JBR0VTI0xFVklTClBFUCNFQkVSVCNJTkFORQpUQUkjRk9SR0VUTUVOT1QKI05FSFJVIyNUT1AjSVJUCkhVR01FVElHSFQjT0xERQpJVEVNUyNNQU8jSURMRVIKRFNMI0hNT1MjU01FQVJTCiMjI1BJQ0tNRVVQUyMjIwpCQVNJTlMjQUdSQSNBQVMKQVBJTkcjTUlBI0xBU1RTClJBUFQjSEFORE1FRE9XTgpJQ0gjRVVSIyNBTU9DTyMKU0hPV01FU1RBVEUjSVJBClRFTkVUI0hFTEVOI0FTUApBU1NFUyNBTElTVCNMVFI="},{"title":"Fifth Amendment, 6/7/05 (Tuesday)","author":"by Timothy Powell / Edited by Peter Gordon (puzzleeditor@nysun.com)","date":"2005-06-07","grid":"UkVGUyNLSURTIyNGQVRFClVUQUgjRVJFQ1QjT0tSQQpUQUNPI05JQ0hFI1JJT1QKU1RFUk4jU09MRVZFTlRTCiMjVEVBUiNZRVRJUyMjIwpTQ09VVEVEI1BIT0VCRSMKQUlSUExBTkUjI0xFQVZFClNSSSMjREFSRVMjI1JBWQpTQ0VOVCMjQU5URUNFREUKI0FTSUFOUyNEQU1BR0VECiMjI0dMRUFNI0dJTkEjIwpWSUxFTEFHRVIjUkFJU0UKSUJBUiNQRVRJVCNTTklUClNJU0kjU0xPU0gjVEVSTgpBU1RBIyNZT0tFI0FSRUE="},{"title":"Made to Order, 6/8/05 (Wednesday)","author":"by Lee Glickstein and David Liben-Nowell / Edited by Peter Gordon (puzzleeditor@nysun.com)","date":"2005-06-08","grid":"U1lSI0FEQU1TI1JJQUxTCklPVSNUWVBFQSNFUlJPUgpHWU4jQkVSUlkjQ0FDVEkKTk9UQkFEI0NTUEFOIyMjCiMjSEFZI1BJTlVQI0FXVwpHTEVOI1RJRU9OI0lCQVIKTUVHQVRPTlMjR0lTRUxFCklOQU5FU1QjREVWSUNFUwpOQU1BVEgjVElORVRFU1QKT1BVUyNJTUhPVCNBREFTClJFVCNBQkVFUiNFUkEjIwojIyNQTEFOQiNSRVRST0QKQkVGT0cjVUxOQVIjSVRFCkFUQVJJI0RPTkRJI0FURQpNQU5OQSNPQkVTRSNOT1I="},{"title":"Themeless Thursday, 6/9/05 (Thursday)","author":"by Francis Heaney / Edited by Peter Gordon (puzzleeditor@nysun.com)","date":"2005-06-09","grid":"U1RSQVBQRURGT1JDQVNICkVNT1RJT05BTFJFU0NVRQpHRVRBTExJTkFMQVRIRVIKQU5TI0NPRyNURUQjRVRBCiMjI1NISU0jVEFTSyMjIwpORUFUQVNBUElOI0lNQUMKQUxCRVJUI0VSUyNMVUxMCk9WT0lEI01BRSNNT05ETwpNRUlOI1NFQyNBVUJSRVkKSVNMRSNFTEVWQVRJT05TCiMjI01PQVQjRU1JVCMjIwpSRVAjTkNPI0dJTiNBTUEKVVNFRENBUlNBTEVTTUFOClNUUEFVTE1JTk5FU09UQQpUSEVERUZFTlNFUkVTVFM="},{"title":"Alphabet Soup, 6/10/05 (Friday)","author":"by Gary Steinmehl / Edited by Peter Gordon (puzzleeditor@nysun.com)","date":"2005-06-10","grid":"SEJPTUIjRUFTVCNDSE9XCk9MRElFI0FMQVMjSUZTTwpKT0VCVEZTUExLI1JVSFIKT0JTI1dSRVNUI0FDSEVTCiMjI0ZFRUwjTUFMTFJBVApBTktMRVQjTUlMSUVVIyMKTE9SRU4jQklORVQjSE9QCk1BWkUjWk9ORVMjSlVORQpTSFkjQkVORFMjUEFSVFMKIyNaRUJSQVMjRFJZUk9UClRPRUxPT1AjRk9FUyMjIwpFTFdBWSNBQk9SVCNTRUUKUkVTVCNNUk1YWVpQVExLClNBS0UjT1RPRSNFTElTRQpFTklEI1BFQ1MjTFlSRVM="},{"title":"Neapolitan, 6/13/05 (Monday)","author":"by Kelsey Blakley / Edited by Peter Gordon (puzzleeditor@nysun.com)","date":"2005-06-13","grid":"TkFTQUwjU0hFQSNCT1pPCk9MSVZFI0hPUEkjQUJFTApUT1RFTVBPTEVTI01JTkQKQ0hPQ09MQVRFTEFCIyMjCkhBTiNOT0wjI0VMSUpBSAojIyNTTFkjTkVXUyNVVEEKQUVUTkEjWkVUQSNBUk9OClNUUkFXQkVSUllCTE9ORApDSE9QI1JVREUjT0dSRVMKT05PI0JPU1MjSU5BIyMjClRPUFJPVyMjT1JBI0VBVAojIyNWQU5JTExBRlVER0UKRklKSSNBQllTU0lOSUFOCklSQU4jTElSRSNESVRUTwpCRVJHI0VERU4jRVRIRVI="},{"title":"Red, White, and Blue, 6/14/05 (Tuesday)","author":"by Jim Hyres / Edited by Peter Gordon (puzzleeditor@nysun.com)","date":"2005-06-14","grid":"Q09NTyNKSUxUI09CT0VTCkFST04jVUhPSCNCRVJSQQpDRUxTI01PVkUjUkVXRUQKSE9UUEVQUEVSV0lORSMjCkVTU0VOIyNTTUVFI0xQUwojIyNDT0hOIyNBTk5MRUUKU1RTI0xFSUNBUyNUSURFCkNPTExBUk5JTEVTSEFSSwpBTUlFI1NBRERMRSNOT1MKTEVOT1JFIyNBU0FQIyMjClBJRyNBTFNPIyNUT0dBUwojI1NISUZURklOU1RBVEUKQVRIT1MjUlVMRSNFWlJBClJPT05FI0FTSVMjTkVJTApGRVRFUyNQRUVUI1RSQVk="},{"title":"Lighten Up, 6/15/05 (Wednesday)","author":"by Gary Steinmehl / Edited by Peter Gordon (puzzleeditor@nysun.com)","date":"2005-06-15","grid":"TU9ERUwjTE9XI1JFVlVFCklSRU5FI0VBUiNBR0VOVApTSURFQSNHUkFZTUFSSUEKSE9VUiNCQVNTTyNET1QjCkFMQ09IT0wjU1VCI05FVwpQRVQjQURFTEUjQUJJREUKIyMjQVJJU0UjQ0hJQ0xFCiNQSU5LTEVUVEVSREFZIwpKQU5ORVkjR0lOQVMjIyMKT0xTT04jQ09OVEkjTUFUCkJMVCNTTE8jSEVOUllJVgojTUFPI0FORE9SI0FSRVMKVEFOQkFHR0VSI0FHSUxFCkVMQ0lEI0FOTiNERUFMVApBTEVUQSNTVFMjTVNET1M="},{"title":"Fashion Statement, 6/16/05 (Thursday)","author":"by Ed Early / Edited by Peter Gordon (puzzleeditor@nysun.com)","date":"2005-06-16","grid":"I0pJQiNPUEVDI0dPQkFECkRPUkEjUlVORSNJTkFORQpJTk9SREVSVE8jQkVSR1MKTUlOTkVMTEkjQkVBVEVSCiMjTUFBUyNUUkEjREFMRQpCRUlSUkVQTEFDRUFCTEUKQkFORCMjUkVDT1BZIyMjCkNVRSNUSEUjSU5BI09MRAojIyNTSEFTVEEjI0VCQVkKT05FTVVTVEFMV0FZU0JFCk5FVkUjUE9SI09MRU8jIwpTV0VMTFMjTklMRUJMVUUKUElOVE8jRElGRkVSRU5UCkVTU0VOI0VTU0UjT1RJUwpDSE9SRSNTSE9EI1dFVCM="},{"title":"Weekend Warrior, 6/17/05 (Friday)","author":"by Manny Nosowsky / Edited by Peter Gordon (puzzleeditor@nysun.com)","date":"2005-06-17","grid":"U1BMVVJHRSNDTEFQUEVECkVMSVNJT04jUkVQVUxTRQpNQUtFUEFSI0VYT1RJQ0EKSUNFI1NUT1BTVVAjQ09EClRFTkQjU0xJVFMjQ0FSUwpJQk9PSyNMUFMjQlVUVEUKQ09XSElERVMjVEVSRVNBCiMjI09OUkVRVUVTVCMjIwpQQkFOREojVU5MRUFSTlMKUkFNT1MjUEVJI1RJRU9OCk9OT1IjU0VBVFMjTEFNQQpJREUjU0hBS0lMWSNESUsKUkVCQVRFUiNaQU1CT05JCkFBQUNFTEwjRVNDQVBFRQpRVUVFTkxZI1NIQVRURVI="},{"title":"Heave-Ho, 6/20/05 (Monday)","author":"by Gary Steinmehl / Edited by Peter Gordon (puzzleeditor@nysun.com)","date":"2005-06-20","grid":"TUFNQVMjRE9aRSNTVUlUClBMQVRBI09WRVIjT1JDQQpTTElOR0JMQURFI0FCRUwKI1NMTyNJTExTI0FQQUNFCkxUUyNMT08jI1NBVU5BUwpTQUxNQSNQSVRDSFBJUEUKRFJPUElUI05SQSMjIyMjCiMjVEhST1dQSUxMT1cjIwojIyMjI1RBVSNQVVJJU1QKQ0FTVFBBUlRZI0NPU01PClJFQ0FMTCMjT1JLI1RFTgpJUk9OWSNXQUlGI1BFQSMKU0lORyNDSFVDS0JFUlJZClRBQ08jT0lOSyNPS0lFUwpPTEVTI09QVFMjUEVBUkw="},{"title":"Auto-Mate, 6/21/05 (Tuesday)","author":"by Steve Salmon / Edited by Peter Gordon (puzzleeditor@nysun.com)","date":"2005-06-21","grid":"QUxDT0EjQVRPTSNBQ1RTCkNPQUxTI0xBVkEjU09JTApMSUxBQyNJVEFMI1BMRUEKVU5JVkVSU0FMQUNDT1JECiMjIyNUSVQjI0NPQVJTRQpKVURBSUMjTEFIUiMjIyMKRlJFTkNIUklWSUVSQSMjCktJTFQjI0FMSSMjU0xBQgojI0VTQ09SVFNFUlZJQ0UKIyMjI0FMQVMjVE9QVEVOCkFHQVNTSSMjUFJPIyMjIwpCT05ORVZJTExFRkxBVFMKQkFORSNJREVBI0VFUklFCk9QRVIjRUxBTiNSSUZMRQpURVhUI1JFRFMjU0FTRVM="},{"title":"Spooner the Crooner, 6/22/05 (Wednesday)","author":"by Timothy Powell / Edited by Peter Gordon (puzzleeditor@nysun.com)","date":"2005-06-22","grid":"QkFSQkVSIyNETVYjWklQCkVRVUlORSNJUlJJVEFURQpTVU5LRU4jQ0FUQ0hJRVIKU0FHRSNUUklCI1RFUk1TCiMjI1VQU0VUIyNPQkVTRQpTT0FQWSNWRUxDUk8jIyMKVFVSVExFI1RFQSNDUklCCkVUQ0hFUiNIT0cjS09CRQpJREVFI0FMRSNFUk9ERVMKTk9EUyNTRVcjREVGRUFUCiMjI1RIRUlSUyNBVE9NUwpUSEVSRSMjT09NUEgjIyMKUklWQUwjQU5OQSNFUklDCkFNRU5ESU5HI1pZREVDTwpDT05EVUNUUyNERUFET04KRU1UI1BFWiMjQU5ZT05F"},{"title":"Themeless Thursday, 6/23/05 (Thursday)","author":"by Ed Early / Edited by Peter Gordon (puzzleeditor@nysun.com)","date":"2005-06-23","grid":"U1REI1BMQVNUSUMjTU9NCkNSSSNMQUxPT1NII0FMSQpPVUFHQURPVUdPVSNOSVgKUkVNT05TVFJBTlQjQVZFCkNMRVRFIyMjI0VJU05FUgpIT1RPUkNPTEQjU09BUlMKRVZFTiNPQkxBU1RTIyMjCkRFUiNDTEVBVkVTI0VNUAojIyNDUkVBTUVSI0FYRVIKUFJFWFkjSEFTSVRNQURFCkZPWENVQiMjIyNPUENJVApJTVAjTk9OT05BTkVUVEUKWkVFI0NZQ0xPUEVESUFTCkVSUiNMRUFHVUVSI09UVApST1QjRVJSQU5EUyNORVM="},{"title":"Report Card, 6/27/05 (Monday)","author":"by Adam Cohen / Edited by Peter Gordon (puzzleeditor@nysun.com)","date":"2005-06-27","grid":"U1RVTiNSQU1CTyNTU1RTCkxFTk8jT05BSVIjUVVJUApBQ1VURUFOR0xFI1VMTkEKTVRTI0JSQU0jI0xBS0VTCk1PRSNCQUxBTkNFQkVBTQpFTkQjU1RTI09BUiNEUlMKUklUQSMjI0NBUk9MIyMjCiNDT1JQVVNDSFJJU1RJIwojIyNDT1JBTCMjI0RPVFMKSUNVI1BBRCNBTEUjUkFXCkRBTklFTERFRk9FI0lSRQpPUkVPUyMjTElBUiNBVEUKSU1BTiNGSUxFRk9STUFUCkRFU0kjQURFTEUjRE9TRQpPTkVBI1JBTkRSI0FTU04="},{"title":"Skippers, 6/28/05 (Tuesday)","author":"by Gary Steinmehl / Edited by Peter Gordon (puzzleeditor@nysun.com)","date":"2005-06-28","grid":"QlVNUyNTSEgjI0dFVElUCkFTQVAjUE9FI0RBUEhORQpIQVZBTkFDQVRBTUFSQU4KIyMjREVDI1ZBTiMjSVNBCkJFSkVXRUxFREVMRVZFTgpBTEUjVFNFIyMjRUxFQ1QKTE9BRCNIQVcjRE9DIyMjCk1JTklCSUtJTklWSUdJTAojIyNUT1AjR1VTI0RPTkUKRlJJVE8jIyNNU1UjQVRFCkxPQ09CT05PQk9TT0RPUgpJVEUjI05FRSNMRVYjIyMKQ1VNVUxVU1VOVURVR1VQCktOQVZFUyNGQVQjTEFNRQpBRE5BTiMjU0hFI0VTUE4="},{"title":"Tee Time, 6/29/05 (Wednesday)","author":"by Jack McInturff / Edited by Peter Gordon (puzzleeditor@nysun.com)","date":"2005-06-29","grid":"QU1JRCNCUlVUQUwjRFJKCkxFTk8jUk9UQVJZI1JPRQpQTEFZVE9PVFNJRSNBQlMKIyNMRU8jU0VUUyNBTU9TCk9SQU5HRVRSRUVTVEFURQpSQVRTT04jIyNTT1MjIyMKQVNIIyNEQU1FI0xFSUEjCiNURUFSU0ZPUkZFQVJTIwojQVJMTyNCRUFVIyNTVEUKIyMjSU5OIyMjUkVUQUlOCldBTEtTT05BTExUT1VSUwpBTE9FI0RBVEEjTkVEIyMKTk9SI1RJUkVTVEFUSU9OCkROQSNBQ0NVU0UjQVRSQQpTRVgjREVTUE9UI1BTU1Q="},{"title":"Cross-Referencing, 6/30/05 (Thursday)","author":"by Robert H. Wolfe / Edited by Peter Gordon (puzzleeditor@nysun.com)","date":"2005-06-30","grid":"RUFDSCNTRUEjUkFWSU5FCkVMT0kjU05MI09NRVJUQQ=="},{"title":"Weekend Warrior, 7/1/05 (Friday)","author":"by Karen M. Tracey / Edited by Peter Gordon (puzzleeditor@nysun.com)","date":"2005-07-01","grid":"VU5JVCNTQU1PQSNPR1JFClNPU0EjVFNBUlMjTk9FUwpGTEFLSkFDS0VUI0lGQVQKTEFLRUVSSUUjQVBPTExPCiMjI1NUUklBRSNBTlkjIwpERVBUSFMjTkFWWVlBUkQKUkFSRVIjTUVSSVQjS09PCkFSRUFPRkVYUEVSVElTRQpNRUQjVEFMQ1MjSU9UQVMKQURFUVVBVEUjVEJURVNUCiMjQ1VMI1NQUk9VVCMjIwpTVEVFTEUjVEFTVEVCVUQKSVJBUyNORUlMU0VEQUtBClpFU1QjT1NPTEUjVUlFUwpFWEVTI1NPTllTI1BPU0g="},{"title":"Short Stories, 7/5/05 (Tuesday)","author":"by Gary Steinmehl / Edited by Peter Gordon (puzzleeditor@nysun.com)","date":"2005-07-05","grid":"RUdBRFMjU0hBRyNUU0FSCk1STUVUI1RPVVIjUlVMRQpNT09MQSNBTERBI0FNRVgKQVdSSU5LTEVJTlRJTSMjCiMjIyNESUUjI0RFVEVDVAojI1NNVVQjVEFNRSNSQUUKI1RIRVBFTElDQU5CUklFClNXQVQjI09UQyMjT0FSUwpHT05FV0lUSFRIRVdJTiMKVEFUI0FOVEUjT1hFTiMjClNNWVJOQSMjRlJBIyMjIwojI1RIRURBVklOQ0lDT0QKU0hPTyNBVkVSI1RSWU1FClBBV04jWk9ORSNFTUFJTApBTk5FI0VORFMjREFOVEU="},{"title":"Roughy Language, 7/6/05 (Wednesday)","author":"by Joy M. Andrews / Edited by Peter Gordon (puzzleeditor@nysun.com)","date":"2005-07-06","grid":"UlVTSyNCT0RFRCNPUFRTCkFOVEkjQUxJVkUjUE9PSApGUkVUI0FEVklMI0lTUFkKRk9SVEhFSEFMSUJVVCMjCklMRSNJREEjI01PTU1BUwpBTE9ORyNUSUJJQSNBR08KIyMjT0hNI05BVFRFUkVECiNPSFdIQVRUSEVIQUtFIwpQUklTT05FUiNET1IjIyMKRUFUI1BBTkFNI09TVEVSCkFMTFNFVCMjT0FLI0VSRQojI0lUU0FUQU5HU0hBTUUKUElTQSNSSUNLSSNFUklLCkFSVFkjTVJNRVQjUlVORQpMRVNTI1NFRVlBI09QRUQ="},{"title":"Themeless Thursday, 7/7/05 (Thursday)","author":"by David J. Kahn / Edited by Peter Gordon (puzzleeditor@nysun.com)","date":"2005-07-07","grid":"QUdSRUVUTyNQQVRDQVNICldIT0tORVcjQVJJT1NUTwpHRU5FUkFMRUxFQ1RJT04KRU5DI0lCRUFNIyNUQVcjCkVUTyNDQVRTUEFKQU1BUwojIyNCT0cjVElMRSNJV08KI0FMTCNTQUxMSUUjTkFOCk9CSVRTI0xBTyNQTE9ZUwpMT1QjUExBTlRTI0lSUyMKQUxUI0VPTlMjVFNQIyMjCkZJTEVDQUJJTkVUI0JBTgojU0VMIyNBTkVSQSNPUkUKVEhFTEFTVEdBTkdTVEVSClNFVklMTEUjVEVFVEhFRApFUkFTRVJTI09SREVBTFM="},{"title":"\"Help!\", 7/8/05 (Friday)","author":"by Nancy Salomon / Edited by Peter Gordon (puzzleeditor@nysun.com)","date":"2005-07-08","grid":"TUVTSCNBV0UjTUlMVElFCklOQ0EjTkhMI0lHVUFOQQpTVEFSI0dFTCNHTEFORFMKRElSRVBMRUFTI09VVElFCkVUQyNFRUwjTEJPI1JBRApBTEVHUkUjSEFBUyNVTkkKTEVST0kjI0FQUiMjTUFO"},{"title":"Swearing Off, 7/11/05 (Monday)","author":"by Jim Hyres / Edited by Peter Gordon (puzzleeditor@nysun.com)","date":"2005-07-11","grid":"U1RMTyNMQVVHSCNGTEFOClVSQUwjQVJHVUUjUklNRQpCT05HI0hFTElYI0FMT0UKU1VHQVJSQVlMRU9OQVJECklOVVNFIyMjRVNQI0NBTApTQ0kjRElTQyMjQUlTTEUKVEVTVCNDT0xMQVJEIyMjCiNTSFVDS1NPWVNURVJTIwojIyNCQVlPTkVUI0RVQUwKUEFDRVIjI0VTQVUjU0xPCkFTSCNBRE8jIyNTQ0hNTwpTSE9PVEZST01USEVISVAKVE9JTCNMQVZFUiNBT05FCk9SQ0EjQVRBUkkjU1VFUgpSRUVGI1RFTEVYI0VST1M="},{"title":"The Doctor Is In, 7/12/05 (Tuesday)","author":"by Lynn Lempel / Edited by Peter Gordon (puzzleeditor@nysun.com)","date":"2005-07-12","grid":"VU1QUyNBU1BJQyNUSFVEClBBU1MjU1RBUlQjRUFTRQpEUkFXU0hVQ0tTI1BMQU4KQUlMI0hZREUjQ0xFRiMjClRBTVBBIyNEUkFQRU1BTgpFTlNVUkVEI0lOUyNPTEUKIyMjUklHT1JTIyNIT09UCiNBSVJGT1JDRURST05FIwpUSUNTIyNFQVJORVIjIyMKQURFI09ERSNTQVVTQUdFClJFRERSSU5LIyNTRU5PUgojI09SRU0jTk9ERSNHU0EKSklWRSNQSE9UT0RST1BTCkFSRUEjTE9UVE8jQUxFRQpHRVJNI0VQU09NI0dBTFM="},{"title":"Animal Cracks, 7/13/05 (Wednesday)","author":"by Jack McInturff / Edited by Peter Gordon (puzzleeditor@nysun.com)","date":"2005-07-13","grid":"TUFTQyNTVEVXUyNTQU5TCkVUVFUjQ09NRVQjT1JBTApURUFSI0FOSVNFI0FJREEKIyNSQUJCSVRUUkFOU0lUCkFTVFJPIyMjI0VJREVSUwpTSEVFUE9GRk9PTFMjIyMKUE9EI1NLSUVSIyNPQ0hPCkNST1cjU1RSSVAjU0hBTQpBTk5BIyNJTU9VVCNBR0UKIyMjTElPTklOVEhFU1VOCkRFQUxFUiMjIyNBTlRFUwpPVFRFUk5PTlNFTlNFIyMKR0FJTiNBVkFJTCNVTklUCk1JTEQjVEVTVFMjRUVSTwpBTFRBI0VSQVNFI0REQVk="},{"title":"S\u00ed Food, 7/14/05 (Thursday)","author":"by Gary Steinmehl / Edited by Peter Gordon (puzzleeditor@nysun.com)","date":"2005-07-14","grid":"SEFTVEEjQkFSTiNGTElQCkFMVEFSI0VSSUUjUkVOTwpMSUVVVCNERUZJQ0lFTlQKVE9SVElMTEFGTEFUIyMjClNURSNTRUEjIyNOT1dBWQojSE9UVEFNQUxFUyNJTEUKIyNTSVIjI01BViNCTE9XCiNIT0xZR1VBQ0FNT0xFIwpTT1VMI0lSUyMjT09GIyMKVVBOI1NBTFNBTVVTSUMjClZJREVPIyMjTFBTI05JQgojIyNCSUdFTkNISUxBREEKTk9WRUxJREVBI0VJTkVTCk9ET1IjR0lNUCNTQUNSRQpURVhUI1NUT1AjVFJFU1M="},{"title":"Weekend Warrior, 7/15/05 (Friday)","author":"by Joe DiPietro / Edited by Peter Gordon (puzzleeditor@nysun.com)","date":"2005-07-15","grid":"UkVEVEFQRSNTQ0hPTEFSCkVYT0lMRVIjUVVJVklWRQpTVFVUVEVSI1VTVElOT1YKVVJCI0VWQURFUyNOSUNFCk1FVCNSRVRJRSNQRU5BTApFTUlSI0RBWlpMRSNHRFIKREVURVIjI1pFRVMjU09ZCiMjI0ZVWlpZRElDRSMjIwpDUE8jUkFJRCMjSVJBUUkKSEFOI0FQUEVBUiNBTFVNCklERUFMI0NBS0VEI01FUgpHUklEI01PTklDQSNBTEUKR09ORUJBRCNNQVJTQUxBCkVOQ0xPU0UjQkxFQVRFRApSRUhFQVRTI09MRExBRFk="},{"title":"Laughing Matter, 7/18/05 (Monday)","author":"by Karen M. Tracey / Edited by Peter Gordon (puzzleeditor@nysun.com)","date":"2005-07-18","grid":"Tk9XI0FDVVJBI1RPUEFaCkVSQSNCT05FUyNIT1JERQpXSVQjQ0hVQ0tMRUhFQUQKQ09VUlNFUyNGRUFTVCMjCkFMU08jTkFCT0JTI1JBVwpSRUlHTiNCT1JBI1JJUEUKIyMjQUlTTEUjTkxFQVNUCiNTTklDS0VSRE9PRExFIwpTTElOS1kjV0VOQ0gjIyMKSFVHRSNMSUFNI0hPRkZBCkhSSCNNSUNST04jVFJJWAojI1RXSU5FI0NPUlNBR0UKQ0FDS0xFQkVSUlkjQ0FNCkNMQVJLI0FHQVRFI0FSRQpTQVBQWSNHT1RIUyNTT04="},{"title":"A Tasty Jam, 7/19/05 (Tuesday)","author":"by Verna Suit / Edited by Peter Gordon (puzzleeditor@nysun.com)","date":"2005-07-19","grid":"UExVTUIjTEFNQSNKQU1CCkxFUk9ZI0FUT1AjQUxPRQpPWElERSNXT1JMRFdJREUKIyMjRUJCI0xFT1YjIyMjCkpFTExZUk9MTE1PUlRPTgpBTUFURVVSIyNCUkFITUEKQlVOIyNJREVTI0FURVNUCiMjVEJPTkVXQUxLRVIjIwpTVEFMSyNSRU5PIyNFRFMKSE9OREFTIyNEVU1QU09OCkhPQUdZQ0FSTUlDSEFFTAojIyMjRVJMRSNFR08jIyMKQVJNQURJTExPI1JFUEFZClBPRVQjUEFJTiNBQklERQpUT05FI1RZQ08jV0VORFM="},{"title":"Where Ami?, 7/20/05 (Wednesday)","author":"by Doug Peterson / Edited by Peter Gordon (puzzleeditor@nysun.com)","date":"2005-07-20","grid":"QUxNQSNTTk9PUCNXQURTClZJQUwjSEVBVkUjT1JFTwpJU05UVE9PRkFSQU1JU1MKU0FYSE9STlMjU1RBRElBCiMjI09VVCMjTElPTiMjIwpNQU8jQ0FUSE9TUElUQUwKWUVOVEEjUk9PVCNaRVJPClRJVEFOI0FPSyNMRU5JTgpIT0FYI0FDQ1QjRVJBU0UKU1VQUE9SVEhPU0UjTUVSCiMjI0FHVFMjI0FSQyMjIwpBUkdZTEUjU1VHQVJQSUUKVEhSRUVNVVNLRVRFRVJTClRFQVIjSU5URUwjQUxBUwpOQUJTI1NBU1NZI0tFTk8="},{"title":"Themeless Thursday, 7/21/05 (Thursday)","author":"by Brendan Emmett Quigley / Edited by Peter Gordon (puzzleeditor@nysun.com)","date":"2005-07-21","grid":"U1RKQU1FUyMjQUdBVEVTClRSQUJFUlQjUFJFVEVYVApSRVZFTFJZI0FUTEFOVEEKQVZFIyNFWE9USUMjU0VSCkZJTE1FRCNXUkVBS0VSUwpFTklBQyNERU8jUExVTksKRE9OQ0hFQURMRSNVUFNZCiMjI0JPTk4jQ0VMVCMjIwpGTEVFI0dRTUFHQVpJTkUKTElOVFMjVUFSI0xFTk9YCklOVEhFV0FZI1RPU1NVUApQRUUjUklZQURIIyNUVkEKVEFSQkVMTCNNRUFMSUVSCk9SSUVOVEUjQVNUT0xBVApQQU5EQVMjI0pFVEJMVUU="},{"title":"Get With the Program, 7/22/05 (Friday)","author":"by Jeffrey Harris / Edited by Peter Gordon (puzzleeditor@nysun.com)","date":"2005-07-22","grid":"QklCUyNBQk9NQiNGRElDCkFCTEUjVEVQRUUjQUlERQpSRUFNI1RSVUVSI1VSQUwKQkFTSUNJTlNUSU5DVCMjCiNNRVRBTCMjI0JZRUJZRQojIyNJUkEjQ1NFQ1RJT04KQk9TQ08jQ0hBUiNTS1VBCkFMTCNNRUxPRElDI0VTQwpORUFQI01JS0UjUkVTRVQKSkFWQUpJVkUjR1VOIyMjCk9ORVRPTiMjI0FFR0lTIwojI0FTU0VNQkxZTElORVMKTEVXRCNOT0xBTiNOQURBClBFQVIjQ1JFRE8jRVdBTgpTS1lZI0VOREVSI1NFTkQ="},{"title":"Feathered Folks, 7/25/05 (Monday)","author":"by Gary Steinmehl / Edited by Peter Gordon (puzzleeditor@nysun.com)","date":"2005-07-25","grid":"U0FNU0EjU1BBVFMjUk9UClNDT1dMI0NBSVJPI09OTwpSSEVBUEVSTE1BTiNCRU4KU0VUSCNUQU0jRElDSU5HCiMjI0lIT1AjU0VDT05EUwpLQVBMQU4jTUlTU0FMIyMKQVBISUQjVE9ETyNURUFNClRPTyNKQVlMRU5PI0FOQQpPUEVDI01QQUEjSEFDS1MKIyNCT1BQRVIjVElOSEFUClRIRUNMVUIjU0hPTyMjIwpIRVNPVVQjT1dFI1RBVEUKSU5OI01BUlRJTlNIT1JUCkVDTyNFVEFUUyNHRU5PQQpGRVcjREVNT1MjVFJFWVM="},{"title":"In a Stew, 7/26/05 (Tuesday)","author":"by Adam Cohen / Edited by Peter Gordon (puzzleeditor@nysun.com)","date":"2005-07-26","grid":"UExPV1MjSkVUUyNJWk9ECkNPTUVUI1VUQUgjTkVBUgpQQU5EQSNET05FI0RVVFkKI0ZJR0hUSU5HSVJJU0gjCiMjI0VMSSMjI0tFQSMjIwpTVFMjI01BQU0jVEFNUEEKQ1JFU0NFTkRPI09SQUxCClJJQ0hBUkRNVUxMSUdBTgpVUFRPTiNSRVNJREVOQ0UKQkVTT1QjRU5ZQSMjQUVSCiMjI1RPVyMjI05PUCMjIwojV0hFUkVTVEhFQkVFRiMKRElFTSNCTFVFI0dSQUlMCkVDUlUjVE9SRSNZRVNOTwpXS1JQI1ZFTkQjTlNZTkM="},{"title":"What's It All For?, 7/27/05 (Wednesday)","author":"by David Levinson Wilk / Edited by Peter Gordon (puzzleeditor@nysun.com)","date":"2005-07-27","grid":"WkFDSyNQQVlTI0FETElCCkFMT0UjQUxPVCNCVUVOQQpQRVRFU1NBS0UjQ1JBQlMKIyMjUEVUI0VBUiNFR09TClNUUyNHT09ETUVBU1VSRQpXQUxET1JGIyNBQlNFTlQKRkxVRSMjQVBBQ0UjIyMjCiNDUllJTkdPVVRMT1VEIwojIyMjRklFTEQjI09OVVMKQVRURVNUIyNFQldISVRFCkxPVkVPUk1PTkVZI1hZWgpUT1JZI09BVCNBTEkjIyMKSUJPT0sjVEhFUkVDT1JECk1BT1JJI1RFTkQjT1JFTwpBRE1FTiNFUk9TI05FWFQ="},{"title":"Hidden Seasonal Signs, 7/28/05 (Thursday)","author":"by Timothy Powell / Edited by Peter Gordon (puzzleeditor@nysun.com)","date":"2005-07-28","grid":"U1RPUCNCUkFORCNERUxMCkxBVkEjUkVTRUUjT1JFTwpBUEVSI0FWSUFOI1RJTlQKVkVSVElHT0FUVEFDS1MjCiMjI1RBU0sjI1VGTyMjIwpCRURJTSNFWFRSQU1BWU8KQUJPTUIjI0hPRVIjTE9XClNPUkUjUk9PVFMjQkFLRQpBTkkjQklBUyMjV09NRU4KTFlDUkFCUkFTI0lET0xTCiMjI0FSQyMjSVNQWSMjIwojVFJJQkFMQU5DRVNUT1IKSk9BTiNHT1VHRSNMQVpZCk9PWkUjRUFURU4jQURaRQpCTEVEI1NOT1JFI01BWVM="},{"title":"Weekend Warrior, 7/29/05 (Friday)","author":"by Alan Olschwang / Edited by Peter Gordon (puzzleeditor@nysun.com)","date":"2005-07-29","grid":"U1BPUlRTQkFSIyNUT1NTCldBVEVSSE9MRVMjVVBUTwpFQ09UT1VSSVNUI0JFRUYKREVXI1BMQU5UQUdFTkVUCkVSTk8jVEhFUk1PI0FMQgojIyNBRFojI0FJRCNEQkEKUklBVEEjTFlJTiNET0xMCklOVEVOVElPTkFMRk9VTApHVE9TI09OVVMjTUVSRVMKSEVNI0VSRyMjVE5OIyMjClRSSSNTUVVJU0gjU1JUQQpKQVpaUVVJTlRFVCNPSFMKQUxFRSNFU1RBVEVDQVJTCkJJUkQjU1RFVkVBTExFTgpTQVNTIyNTTEVEUklERVM="},{"title":"Fire Starters, 8/1/05 (Monday)","author":"by Brendan Emmett Quigley / Edited by Peter Gordon (puzzleeditor@nysun.com)","date":"2005-08-01","grid":"I0lORkVSUyNTQU0jQkJRClNIRUxMRVlMT05HI1lPVQpIT1BJSU5ESUFOUyNXT0UKSVBBTkEjI0dQQSNNQVpFClBFTFQjQVNII1NMQVlFUgojIyNNQURBVCNUT1QjIyMKTUVESUNBUkUjRVVDTElECkVWSUNUI0dSSU4jSE9NTwpNQUNII0ZFVFQjQVNDQVAKT05FSUxMI0hBTEZUT05FCiMjI0dPTyNBTElCSSMjIwpURUpBTk8jTllFI0NETEkKT1hFTiNETkEjI1NLRUlOCkdBTCNDTEFJTUpVTVBFUgpBTEwjU0lFUlJBTEVPTkUKU1RZI0lUUyNCUlVOVFMj"},{"title":"Give It a Try, 8/2/05 (Tuesday)","author":"by Lynn Lempel / Edited by Peter Gordon (puzzleeditor@nysun.com)","date":"2005-08-02","grid":"U09OQVIjU0xPQiNTSE9XCkFST01BI1RPR08jQ09EQQpNQVZFTiNST0xMI0FMRVgKQkxBTktUQVBFU1RSWSMjCkFTSyNMQVdTI1RSWVNUUwojIyNHRU0jI1NFQSNNSVQKQUNNRSNQQUxUUllKT0VZCkxPT04jI1BFQSMjT0tJRQpGQVVYUEFTVFJZI0xFTlMKQVNTI0FCRSMjT1BUIyMjClNURVZJRSNDT0tFI1NQQQojI1BBTlRSWUZPUkdPTEQKT1ZBTCNUVVJGI01BREFNClJJREUjRUxJQSNJUkFURQpCRVNUI0RFTEwjVFlTT04="},{"title":"Words, Words, Words, 8/3/05 (Wednesday)","author":"by David J. Kahn / Edited by Peter Gordon (puzzleeditor@nysun.com)","date":"2005-08-03","grid":"QURJTiNPS1JBI0xBWUxBCk1PVkUjRE9PUlRPRE9PUgpBTEVSI0VORFBST0RVQ1QKU0NIT09MI0lTQUsjUk9ZClNFQSNTRUFOIyNNQUUjIwojI0RFQVRII0RJQUxVUCMKSEFJUlkjQVBFTk5JTkVTClVOVEFDSyNBUk5PI0RSRQpFRFUjQUxBTiNTSElFU1QKREVQT05FTlRTI0FDUkVTCiNTVEFZRUQjVEFOWUEjIwojI09STyMjRlVERCNSRksKQUNII1VDTEEjT1NQUkVZCkZSRUVTUE9LRU4jQUVSTwpUT1JURUxMSU5JI0xTQVQKU1dFREUjQVJFUyNTVExP"},{"title":"Themeless Thursday, 8/4/05 (Thursday)","author":"by Byron Walden / Edited by Peter Gordon (puzzleeditor@nysun.com)","date":"2005-08-04","grid":"Q0hFV0JBQ0NBI0NFREFSClJPWVJPR0VSUyNBTE9ORQpJTkVFREFOQVAjTUFHTkEKU0tJTiMjU1RFUCNNQ01MClRFTlNFRCNFUklDI0hBSQpPUkcjTEFORFNDQVBFUlMKIyMjREVWTyNJS05PV0lUCiNTVFJBSU4jT1NNT1NFIwpVTkhBTkRTI05PSVIjIyMKTkVXQ09MT1NTVVMjVERTClNFQSNST0xPI1RTVFJBUApFUlJTI1dVU1MjI0hJWUEKQVNUQVIjQk9PR0lFQk9ZClRBRUJPI0xPVUlTSUFORQpTVFJVTSNFTlNOQVJMRUQ="},{"title":"Oceans Eleven, 8/5/05 (Friday)","author":"by Fran and Lou Sabin / Edited by Peter Gordon (puzzleeditor@nysun.com)","date":"2005-08-05","grid":"UklQRSNUT1JTTyNRVElQCktBUkFURUJFTFQjVVRORQojIyNEQUVXT08jUklMRUQ="},{"title":"Crossing Homophones, 8/8/05 (Monday)","author":"by Alan Olschwang / Edited by Peter Gordon (puzzleeditor@nysun.com)","date":"2005-08-08","grid":"Q0hPQ0sjT1JCUyNTV0lUCk5JQ0hFI1JFSU4jUElTQQpCWUNBUiNFREdFI0VMTFMKQ09MT05FTFMjRVlFTEVUCiMjVVNFUlMjR1JBREFURQpBU1MjTEVFI05FV1MjIyMKU09JTFMjI0JVRCNUUk9ECkFMVkEjI0JVUyMjRUlORQpQT0VNI1RPWSMjTVJDVUIKIyMjQk9SRSNFTVUjRVNTClNDT1JORVIjVE9TQ0EjIwpDSE9PU0UjTVVTVEVSRUQKUkVaQSNUT0FEI0FET1JFCkFXRVMjT0RJRSNSQU5JTgpQU1NUI1BFTlMjRFJJRVM="},{"title":"Princes of Tides, 8/9/05 (Tuesday)","author":"by David Sullivan / Edited by Peter Gordon (puzzleeditor@nysun.com)","date":"2005-08-09","grid":"TUFOSUEjTUFERCNCUklUCkFMQU5TI0VDUlUjUklERQpSRURTS0VMVE9OI0FQRVgKRVJJRSNBRFZJTCNTVEFUClNUUkFXUyMjREFDSEEjIwojIyNNRVRBTCNQT0xZUFMKUEVDI0JFR0FOI05ZTE9OCklDVSNGUkVERUJCI09STwpUSFJPRSNERU1VUiNSRUIKSE9UQkVEI0RPUklDIyMjCiMjRkVURVMjI05PTEVTUwpIT0xZI0FXQUtFI0VYSVQKQUxPRSNST0JFUlRFTEVFCklHT1IjVFJFRSNPU0FHRQpMQURTI0hFTFAjU0VYRUQ="},{"title":"Take a Penny, Leave a Penny, 8/10/05 (Wednesday)","author":"by David Levinson Wilk / Edited by Peter Gordon (puzzleeditor@nysun.com)","date":"2005-08-10","grid":"U0lNIyNTQVgjUkNSVU1CClVOQSMjUE9TI0JFQVJFUgpDSEkjTEVOQSNJTk1BVEUKQ0FORE9DRU5UI1RJTEVECk9MU0VOUyNET09SUyMjIwpSRVRBRyNUT1lPVSNBTUEKIyMjUklTRVMjTU1NQk9QCkNSSU1TT04jU1BSSUVTVApPSFdFTEwjTUFIQUwjIyMKQk9PI0FUVElDI0lUQUxTCiMjI1VOSU9OI0FTT05JQQpTQ0FMRCNQT1BFSU5OT1YKUEFTQ0FMI0xPSU4jT05PCkFQSUVDRSNUT08jI1lFUgpTUEFSU0UjQVBVIyNTTFk="},{"title":"Body Language, 8/11/05 (Thursday)","author":"by Paula Gamache and Victor Fleming / Edited by Peter Gordon (puzzleeditor@nysun.com)","date":"2005-08-11","grid":"R1RPUyNBVFdBUiNDWkFSCk5FSEkjUEhPVE8jUklMRQpBQ0lEI1BPUlRPI0VUT04KV0hPRVZFUk5BTUVESVQjCiMjI0JBQSMjQ0lBTyMjIwpNQUIjQ1JBU0hFUyNTUEYKU0NBUiNPTkUjI1lBSE9PCk5FQ0tJTkdXQVNBUE9PUgpCTE9PRCMjVUtFI0JPTFQKQ0FOI1RPU1BBUkUjVFNFCiMjI0FBUlAjI0VUUyMjIwojSlVER0VPRkFOQVRPTVkKVFVOQSNMVUlHSSNPRElFClNOSVAjU1RSVVQjTE9MQQpLRVRUI0VTU0FZI0lSS1M="},{"title":"Weekend Warrior, 8/12/05 (Friday)","author":"by Byron Walden / Edited by Peter Gordon (puzzleeditor@nysun.com)","date":"2005-08-12","grid":"QkVOSkFNSVRFUyNBRkJTCkFRVUFNQVJJTkUjUE9PSApGVVpaWU5BVkVMI0VSTk8KRklaWiMjU09SVFMjRkVFCklOTEVUUyMjT1paRkVTVApORUVEQU5BUCNFRUxJRVIKIyMjI1JPTlRVUkNPVFRFClNDUkFHI05FRSNIRVNTRQpQSE9ORUZPUllPVSMjIyMKUklTRVRPI09TQ0FSTk9EClVOSVRFUlMjI1NORUVaRQpDQU4jREVOU0UjI0RSQVQKSVNCTiNTQU5EWVNIT1JFCk5FQVIjVFJBREVUQUxLUwpHQUdBI1NFUEFSQVRJU1Q="},{"title":"Parting Words, 8/15/05 (Monday)","author":"by Bill Weber / Edited by Peter Gordon (puzzleeditor@nysun.com)","date":"2005-08-15","grid":"U09MT05HIyNDSEFSVEVSCkFQT0dFRSMjSEFHRVJUWQpGRVJSRVQjU0FZT05BUkEKRU5ERUQjTUVOIyNPTUVOCiMjIyNTVFJFVENIIyMjIwpFVE5BI0FCWVNTSU5JQSMKUkVFTCNCSU8jSUtJTkdTCk1FSFRBI0dVUyNFWFRSQQpBVFJBSU4jTEVTI09XRVMKI0hVUlJZQkFDSyNOT0VTCiMjIyNTQ09UVElFIyMjIwpURUNIIyNZRVMjQlJBRFMKQVVSRVZPSVIjRk9VUkFNCkZST0xJQ1MjI09OU0FMRQpUT1dQQVRIIyNCWUVCWUU="},{"title":"Spare Change, 8/16/05 (Tuesday)","author":"by Lynn Lempel / Edited by Peter Gordon (puzzleeditor@nysun.com)","date":"2005-08-16","grid":"TUFNRSNBU1RPUiNQVUxQCklERUEjTU9PUkUjT1JFTwpET1RTI1BBUkVTQ09TVFMKQVBSRVNTS0kjVEhSQVNIClNUT1VUIyMjV09FIyMjIwojIyNQRUFSU0lOU1lSVVAKTEJKI1dIRVRTI1NJRUdFCkVMQU4jU1RFRUQjUEVMVApBVURJTyNZRVRJUyNEWUUKUkVBUFNBUFJPRklUIyMjCiMjIyNTRUUjIyNWSUFMUwpBRkZBSVIjU1BFQVJHVU4KUEFSU0VBV09SRCNBTk5BClNMT1AjVElNSUQjTkVDSwpFTE1TI0VORU1ZI0FTSEU="},{"title":"Zero G's, 8/17/05 (Wednesday)","author":"by Joy M. Andrews / Edited by Peter Gordon (puzzleeditor@nysun.com)","date":"2005-08-17","grid":"RkFUQ0FUI1NQQVIjQUxJCk9OSE9MRCNUUklPI1RBTgpQSUVDRVMjUkVERE9FUlMKIyNTQVAjTUFaRSNWQVNFCkJFQUNIQlVZIyNMQVNFUgpBUklPU09TIyNTSUxFTlQKREFOTCNQTEFUVEUjIyMjCiNTVEFNUElOUk9VTkRTIwojIyMjUkVOT0lSI09SQ0EKQkFSQkVSIyNCRVNUSUFMCkxMT1lEIyNCQVlQQU5UUwpPQklUI1NIVUwjSVJLIyMKV0lMRVJPT00jQ1JJU0NPCk9ORSNDQU1QI1ZJWklFUgpOT0QjQVJFUyNTVEVOT1M="},{"title":"Themeless Thursday, 8/18/05 (Thursday)","author":"by Robert H. Wolfe / Edited by Peter Gordon (puzzleeditor@nysun.com)","date":"2005-08-18","grid":"U1BBUkVCRUQjI0pBU09OClRBWE9OT01JQyNVTFRSQQpBTExPQ0FCTEUjU0xPQlMKVEVFVE9UQUxTI1RFTkVUCiMjIyNSRVQjVFJBR0VEWQpHSUxCRVJUUyNVRk8jIyMKTk9FTCNTTFVNQkVSRVJTCkFURVVQI0VQQSNXSUxFUwpUQUtFT1JERVJTI1NJRlQKIyMjU09ZI1NDSEFUWklTCkJFTlRMRVkjT0FUIyMjIwpBUVVBUyNBUFBST1ZBTFMKVFVUVEkjUEhPRU5JQ0lBCkhBVEVEI1NJTElDT05FUwpFTFlTRSMjWk9ORUxFU1M="},{"title":"Burning Desire, 8/19/05 (Friday)","author":"by Matt Skoczen / Edited by Peter Gordon (puzzleeditor@nysun.com)","date":"2005-08-19","grid":"R1VGRiNHT0FEI0JSQVZPCkFOSUwjSU5HQSNSRUNPTg=="},{"title":"For Pete's Sake, 8/22/05 (Monday)","author":"by Jonathan Gersch / Edited by Pete Gordon (puzzleeditor@nysun.com)","date":"2005-08-22","grid":"SlVMRVMjQ1lTVCNTRVRICkFSRU5BI0xPQ0gjUFJFWQpCSUFMWSNFVVJPI0FHRUQKIyNLSVNTRlJPTUFST1NFCiMjI1NPVCMjREFWRSMjIwpXQVJUI0FJRCNTRVJJQUwKQUxFI1pJTkVTI1JJTlNFCkZBVEhFUktOT1dTQkVTVApUUklPUyNTVEFSRSNQRUcKU01FTFRTI1NLSSNPVFRPCiMjI0xFQU4jI1NJUiMjIwpXQVRFUkZPVU5UQUlOIyMKT1ZFUiNBVFJBI01PT1JFCk1FVEUjUkVBTSNCTFVFUwpCUkVEI0lETEUjU0VORFM="},{"title":"Second to Last, 8/23/05 (Tuesday)","author":"by Joe Bower / Edited by Peter Gordon (puzzleeditor@nysun.com)","date":"2005-08-23","grid":"QklORyNGQUNFI05GTEVSCk9QQUwjRUxMQSNBTElWRQpCT1pPI1JPQVIjTUFSSUUKI0RJVkVSVVBUSEVXQUxMCiMjI0VSQSMjSEFUI1NTUwpBRFMjQVJJQSNXQVIjIyMKTFVOQVRJQ0ZJTkdFUiMjCkZPVVIjI0VJTiMjTkVBUAojI0JPT0tFUlNISUVMRFMKIyMjTlJBI0VUT04jWUVUClJBTSNFTEkjI1RHSSMjIwpFTUVSR0VOQ1lCQUtFUiMKU0lERUEjVFJFRSNOQUlGCkFTSUFOI1JPQUQjT1NMTwpXSEFNTyNPQ0hTI1dFRVA="},{"title":"Sleep On It, 8/24/05 (Wednesday)","author":"by Ed Early / Edited by Peter Gordon (puzzleeditor@nysun.com)","date":"2005-08-24","grid":"QUxDQVBQI0FQRVJUVVJFClJFRUNITyNORVZFUlBVVApOQVJDT1MjSUNFV0FURVIKT0ZGVU5USUwjIyNET1NFCiMjI1JFSUQjR0FCRSMjIwpBTEFTI1RPTU9SUk9XIyMKU09GVEcjI09SR0FOSVNNClBPTCNXSEFUWU9VI1BPRQpTUEFDRUFHRSMjTlRFU1QKIyNDQU5ET1RIRSNJUkFTCiMjI0lTSU4jRUxBTiMjIwpPRERTIyMjREFZQUZURVIKVFJJU1RBVEUjU05PT1pFClRPTU9SUk9XI0VESVRFRApPUEVOQVJNUyNFRUxFUlM="},{"title":"Making Faces, 8/25/05 (Thursday)","author":"by Gary Steinmehl / Edited by Peter Gordon (puzzleeditor@nysun.com)","date":"2005-08-25","grid":"Sk9TSCMjUk9UUyNQQVNTCklERUEjTklDSEUjQVNBUApNRVdMI09TSEVBI0xJVkU="},{"title":"Weekend Warrior, 8/26/05 (Friday)","author":"by Patrick Berry / Edited by Peter Gordon (puzzleeditor@nysun.com)","date":"2005-08-26","grid":"QUJTQ0FNI0JFTE9XUEFSCkRBUEhORSNPTkVQSUVDRQpBTk9JTlQjQlJBSU5FUkQKR0FSTkVSI0RBUkUjTEVOCkVOVE9NT0xPR1kjV0lGRQpTQVlTVU5DTEUjTklORVMKIyMjI1JPREUjRE9ER0VTCiNTV0FSTVMjTkVXRVNUIwpDVVJJQUUjTU9TSCMjIyMKQU1PUlkjR09BUEVPVkVSClBFVFMjRkFUSEVSVElNRQpBUkUjTUVNTyNSRUhFRUwKQklPTUVURVIjQU1FTlJBCkxBVVJFQVRFI0RBUk5JVApFTlRJVExFRCNPTlNBTEU="},{"title":"\"O Captain!\", 8/29/05 (Monday)","author":"by Sarah Keller / Edited by Peter Gordon (puzzleeditor@nysun.com)","date":"2005-08-29","grid":"UE9QUEEjVVNVUlkjUElUCkVNQUlMI1ZFUk5FI0VOTwpLSVJLRE9VR0xBUyNSRkQKRVRBI0VMTEUjI0lORElBCiMjS0FOR0FST09DT1VSVApTSUVTVEFTI0FDQURFTUUKR1JFVEUjI0NIQU4jIyMjClRBVEEjU1BPVVQjQVNPRgojIyMjU0VFUCMjU1BFTkQKQVNUQUlSRSNTV0VFVEVSCkJMT09EQlJPVEhFUlMjIwpBSVNMRSMjV0FJVCNGTEEKVFZTI01JRE5JR0hUUlVOCkVFRSNFTERFUiNFUkVDVApEUlMjTkVFRFMjU0VFS1M="},{"title":"Just Say Noh, 8/30/05 (Tuesday)","author":"by Robert Ward / Edited by Peter Gordon (puzzleeditor@nysun.com)","date":"2005-08-30","grid":"QVpURUMjQUxEQSNCRUxUClNFSUtPI0xBTkQjRVJJRQpIQU5HU09VVEFTSU5HTEUKRUxTI01JTUUjI0JVT1lTCiMjI0ZJTk4jU1RFTSMjIwojI1NPQ0tBQlNPUkJFUlMKWEJPWCMjI0FOVEkjSk9UCklPVSNDSEVMU0VBI0VNVQpOT1MjSElWRSMjI0lDRUQKR1JBVkVZQVJEU0lGVCMjCiMjI0VSQVMjSUFOUyMjIwpTVEFSUiMjRUVMUyNQU0kKU0FHR1lET0dTVE9SSUVTClRSVUUjSU5HRSNMSUtFTgpTUEFTI1BPT0wjRUJFUlQ="},{"title":"A Quick One-Two, 8/31/05 (Wednesday)","author":"by Joe DiPietro / Edited by Peter Gordon (puzzleeditor@nysun.com)","date":"2005-08-31","grid":"QVNBI1BTQUxNI0dMQVpFCkxBUCNBTEJFRSNZRU1FTgpJTVBBVElFTlQjTk9NQUQKQk9PS0VEI0RBRCMjRUxPCkFWSUEjI0FMTE9DQVRPUgpCQU4jUk9EIyNDT1ZFVFMKQVJUI0VMTElTI0hPUlNFCiMjI0FERElDVElPTiMjIwpST1VUUyNCRUVQUyNPSE8KQU5OSUVTIyNST1QjUklCCkdFU1RBVElPTiMjSURMRQpUSUUjI1VQTiNFRFNFTFMKSVJBVEUjQUNDTElNQVRFCk1PVEhTI1NVU0FOI0xPTApFTlNVRSNTRUlORSNTUFk="},{"title":"Themeless Thursday, 9/1/05 (Thursday)","author":"by Robert H. Wolfe / Edited by Peter Gordon (puzzleeditor@nysun.com)","date":"2005-09-01","grid":"TUVMQU5JVEVTI1pJUFVQCk9YWUdFTkFURSNFQ09OTwpQQVJBQ0hVVEUjUkVTVFMKU01BUlRFTlVQI09TU0lFCiMjIyNBUlQjU0hFS0VMUwpTT1JBUkUjIyNBU0EjIyMKRUxPSSNTTE9XV0lUVEVECldFQVJTI0JSQSNORVJWRQpOT05TVUJKRUNUI1JFRUYKIyMjRVNRIyMjQUJTRU5UClRIT1JQRVMjU05MIyMjIwpIRVJWRSNUSEVHQVpFQk8KUkFCSU4jUk9MRU1PREVMCkVQSUNTI09QRU5FTkRFRApFU1RFRSNNSVNUUkVBVFM="},{"title":"Going Too Far, 9/2/05 (Friday)","author":"by Going Too Far / Edited by Peter Gordon (puzzleeditor@nysun.com)","date":"2005-09-02","grid":"U1RSQVQjVURFTiNJTEtTCk1PRVNII1BFTkkjTEVBUApBUlRJRSNTQ0FOI0VOUkkKQ09STlJPVyNNRUdSWUFOCiMjIyNFUkUjSVRFI0FURQpNT0RFU1RMWSNJTlQjIyMKQUxJWUEjTE9ORUxJRVNUClNBTkUjQkVHRVQjREFURQpTTkFSTEVEQVQjQ0FSTEUKIyMjU0FHI1NPQ0FMTEVECkJSQSNNRU4jT0xBIyMjIwpSRVNQT05EI01FR0FUT04KRU1JTCNUSUNBI0FWRUxTCk5PRFUjTEVBTiNNT05ERQpUUkVTI0VTVFkjRVJURVI="},{"title":"Letter Drops, 9/6/05 (Tuesday)","author":"by Jack McInturff / Edited by Peter Gordon (puzzleeditor@nysun.com)","date":"2005-09-06","grid":"TElMQUMjQU1BIyNUT1NTClVTRVVQI0NPVFkjSEFIQQpNRU5UQUxOT1RFI1JIT1MKUEVTTyNNRVRBTE1PVVRICiMjI1BFTiMjQ0xBTiMjIwpFTENJRCNET0gjUkVGRVIKTUVBTFRJQ0tFVFMjQVlFCk9ITk8jTklCI1NIT1JFUwpUSVRURVIjWU1BI0xJTEkKRUdPI01FTE1BUlRJTkVaClNIUlVCI0FFUiNPVkFURQojIyNTRUVEIyNCRUUjIyMKTUVBTkRNWUdBTCNEQVNICk9LUkEjTUJVVFRFUkZMWQpMRU9WI0VVUk8jUEFSRUQKRUREWSMjR1VNI0FCT0RF"},{"title":"Measuring Up, 9/7/05 (Wednesday)","author":"by David J. Kahn / Edited by Peter Gordon (puzzleeditor@nysun.com)","date":"2005-09-07","grid":"UFJFUCNQQVBBI0FNRU5ECkFJREEjSURFUyNDQU1FTwpTVEVQU1RPVEhFQ1JPV04KQUVORUFTIyMjU0VYVEVUCiMjI1JTVCNFQkFOI0VSUwpXSURUSE9GTU9VVEgjIyMKQUdFUiNQUkFZI1NJVE9OClJPTUEjU09OSUMjVEFQRQpEUk9JRCNHQVNII1RSRUUKIyMjTEVOR1RIT0ZIQU5EClJBUCNUQVlFI09MRSMjIwpFTExJT1QjIyNTQURERU4KU1RBVFVFT0ZMSUJFUlRZCkVBVEVSI0xJT04jQ0VPUwpUUkFNUyNEUlVHI0tJTkU="},{"title":"Baseball for the Birds, 9/8/05 (Thursday)","author":"by Randolph Ross / Edited by Peter Gordon (puzzleeditor@nysun.com)","date":"2005-09-08","grid":"TE9CQlkjI0NBUFMjUFJFCkFDVVJBI1NBR0VUI1JFRApTSFJJS0VUSFJFRSNFUkcKU09ORyNNWU5BTEVBR1VFCiMjI0hPTUUjIyNMSU9OUwpBUkVUSEEjTklYRUQjIyMKU0VUT04jTk9NRSMjQkFBClRFUk5PTkFGQVNUQkFMTApBTEUjI0ZMQVgjRUVSSUUKIyMjQUZMQVQjQVJBQklDCk9NQVJSIyMjQVNJTiMjIwpCT09CWUJPTkRTI1BTQVQKR1JSI1BJR0VPTkNPQUNICllFVCNBVExBUyNBTExJRQpOU0EjTkVFUiMjTkVFRFk="},{"title":"Weekend Warrior, 9/9/05 (Friday)","author":"by Patrick Berry / Edited by Peter Gordon (puzzleeditor@nysun.com)","date":"2005-09-09","grid":"SU5BSkFNI1RISVJUSUVTCk1BRFVSQSNWQU5EQU1NRQpQUkVUQVgjR1JFQVRNRU4KVVJOI0xJUVVPUlNUT1JFClJBSUQjU1RJTFQjRVJJQwpFVE5BI0tJREQjR1JBVEEKUkVFRFBJUEUjVEVTTEEjCiMjI09BUlMjS0FSQSMjIwojQUJPUlQjQk9YRUxERVIKQ0xFUksjQkFSSSNMRU5PCkFSTk8jSElSRVMjU0NBQgpSRUlOVEVHUkFURSNFQkIKTUFHUklUVEUjQVdISUxFCkVETk9SVE9OI05FVVRFUgpMWUlORVlFUyNEUkVTU1k="},{"title":"Wheels of Fortune, 9/12/05 (Monday)","author":"by Gary Steinmehl / Edited by Peter Gordon (puzzleeditor@nysun.com)","date":"2005-09-12","grid":"RFNUIyMjTUFTUyNBU0FQClVUQUgjV0lUVFkjQk9ORQpNQVVJI0lOU0FORE9VVFMKQklORyNORUlOI09XTEVUCk9SVEhPRE9YI0FPTCMjIwojIyNQUk8jRUdHUk9MTFMKVFZDUkVXI1NFRSNGQUlMCllBSE9PI0ZBTlMjQ1VLRQpQTE9UI0pJTlgjVEhSRUUKRUlSRSNPTEQjVEhFQVNQCk9ERElUSUVTI0VFUiMjIwojIyNOVU4jRUROT1JUT04KVE9NQlMjT1ZFTiNJT05FClNORUFLWVBFVEUjRVhFQwpQRUVSI01BTk9SI1NJTksKU0FLUyNBTFNPIyMjQ0RT"},{"title":"Movie Houses, 9/13/05 (Tuesday)","author":"by Sarah Keller / Edited by Peter Gordon (puzzleeditor@nysun.com)","date":"2005-09-13","grid":"VEVFI1NUUkFZUyNBR1JBCkFOWSNPUkFUT1IjTU9PUwpVU0UjQklHQlVTSU5FU1MKTlVMTCNBQUEjI01PVEVUClRFQUFORFNZTVBBVEhZIwojI1NURVMjI1JFWCMjIyMKTkVISVMjQU1NTyNET09SCklDRVNUQVRJT05aRUJSQQpOT1NII1JFQU0jSU5TRVQKIyMjI0VUQSMjU05JVCMjCiNHTEFTU01FTkFHRVJJRQpJUk9OUyMjTEFCI0RVQlMKQklSRE9OQVdJUkUjQ0FUCkVQRUUjU1RBTEVSI1RSRQpURU5TI0FMWVNTQSNTU0U="},{"title":"A Little Something en Espa\u00f1ol, 9/14/05 (Wednesday)","author":"by Anthony J. Salvia / Edited by Pedro Gordon (puzzleeditor@nysun.com)","date":"2005-09-14","grid":"QUxMI1BFUCMjU0VYSVNUCkxJVSNBWUVTI0FWRU5VRQ=="},{"title":"Themeless Thursday, 9/15/05 (Thursday)","author":"by Joe DiPietro / Edited by Peter Gordon (puzzleeditor@nysun.com)","date":"2005-09-15","grid":"UEVOUEFMUyNDQVJDQVJFCkRSSUVEVVAjT05FT1ZFUgpUQVhSQVRFI0ZUQlJBR0cKIyMjU1BFQ0lGSUVEIyMjClJPQk9UI0lMRSNMT0dJTgpBTk9OI1BBTEVSI05JQ0UKTkVEI1JFTEFURVIjVkVYClBBWSNJU0lUQUdPI0VNVApBUkIjR09ORUJBRCNTSUQKU1RBWSNTVEFMTCNNSUxBClRIUkVXI0VTRSNHVU5LWQojIyNTSE9SRUJJUkQjIyMKQkFTU0FMRSNPTkFEQVRFCkxBVElNRVMjT1JERVJJTgpUQVBST09UI0tFWVJJTkc="},{"title":"Bee Sharp, 9/16/05 (Friday)","author":"by David J. Kahn / Edited by Peter Gordon (puzzleeditor@nysun.com)","date":"2005-09-16","grid":"RlJBUyNGUkkjI0FGVEVSClJFTlQjTEVOVCNTT1JUQQpBTlRJI0FTQ0VUSUNJU00KQ09FTiNHRUlTSEFTIyMjCkFJREVEI0FTVEkjTEFQUwpTUkkjUkFUT09OI0VQRUUKIyNMRUFOI1JVRyMjUEVVClNIVVRJTiMjVFVSQk9UUwpMSVZFTkVSIyNNRVJHRVMKVVBJIyNNRVQjTUFSRyMjClNQQVMjRVVPTllNI0lBTQpIT05FI0FUUkEjU0hBTkkKIyMjQVJSRVNUUyNFVEFMClNBTklUQVJJVU0jTFVDSQpBTElDRSNTT1JFI0VSSUUKTUlYRVMjI05FVyNOQU5V"},{"title":"Bowling for Dollars, 9/19/05 (Monday)","author":"by Deb Amlen / Edited by Peter Gordon (puzzleeditor@nysun.com)","date":"2005-09-19","grid":"R0FTVVAjQUxBUyNTS0lECkVMSVpBI1BBUEEjTEVUTwpNQVhJTSNSSVBTI09WQUwKIyMjU1BMSVRUSEVCSUxMClNUVSNBT0wjU0FQI05ZUwpQQVIjU09GQSNZT0dBIyMKQU1CSSNUT0lMI0NPUkFMClNQQVJFU09NRUNIQU5HRQpNQU5PUiNMQVRII0xPUkQKIyNTTklUI1RJRUQjTEVPCkFTUCNDT1AjVFJFI0RFTgpTVFJJS0VJVFJJQ0gjIyMKUEVBVCNURVJJI0FJU0xFCkNBV1MjQVRBRCNGUkFJTApBTExZI0dBTUUjU0VYRVM="},{"title":"By the Book, 9/20/05 (Tuesday)","author":"by Gary Steinmehl / Edited by Peter Gordon (puzzleeditor@nysun.com)","date":"2005-09-20","grid":"SVNMRSNTQ0FMRFMjQkFIClRNRU4jVEFUQU1JI09MRQpTRUdBR0VORVNJUyNTQVgKI0xJQ0UjRUFTVCNTT01FClVMU1RFUiNUT1JJQU1PUwpTQUwjS0VHIyNJQ0gjIyMKRVJBVCNJUklTI0JJTEdFClJBVElPTkFMTlVNQkVSUwpTVEVFRCNGTE9aI1NURVQKIyMjRE9DIyNXSVQjVEVFCkJBQllSVVRII1NIUklORQpPQk9FI1RIQUkjUkFOVCMKU0lYI0ZJRUxESlVER0VTCk9ERSNERUFMRVIjQUdBUgpYRVIjQVNTRVNTI1JPU0E="},{"title":"Conjunction Disjunction, 9/21/05 (Wednesday)","author":"by Jack McInturff / Edited by Peter Gordon (puzzleeditor@nysun.com)","date":"2005-09-21","grid":"QUJBVEVTI1BDQiMjWkFHClNBTEFNSSNBSEEjQ09SRQpPSUxDQU4jUkVTVEhPTUUKRkxZSU5HVFJFU1NFUyMjCiMjI1RBTEUjUk9BUiMjIwpQQ1MjVEVYVCNPUlBIQU4KRUxPUEVEI0hFTiNBT05FCkJPTEFTI0JFRVMjUFJPVwpCUkFOI1BFQUsjUkVBREUKTE9SSSNPREQjVEVSQ0VMCkVYQUNUUyNTQVJBI0VTUwojIyNUVVRTI01BU0sjIyMKIyNOT0JVVFNBQk9VVElUClNDRU5BUklPI0VOREFTSApJTlhTI0VMSSNSRVpPTkUKVE5UIyNTVEwjVFJVU1RZ"},{"title":"Quarterly Briefs, 9/22/05 (Thursday)","author":"by Lynn Lempel / Edited by Peter Gordon (puzzleeditor@nysun.com)","date":"2005-09-22","grid":"VFNBUlMjQkFKQSNDT00jCkFUU0VBI0FXRVMjT1JFTQ=="},{"title":"Weekend Warrior, 9/23/05 (Friday)","author":"by Byron Walden / Edited by Peter Gordon (puzzleeditor@nysun.com)","date":"2005-09-23","grid":"QkFLRURaSVRJI1NFUkZTCkFMQU1BSVNPTiNDTEFSTwpTVFJJTkdFTlQjSE9NRVIKS0VOVCMjRVlFUE9QUEVSCkVSQVNFUiMjUkVMRUFTRQpUU0sjS05JRVZFTCNHSU4KIyMjTEVBUk5JTiNGRUFUCkJFTUFEI0VSRSNMQVNTTwpFVkFTI1NOT1dKT0IjIyMKTElDI1JFRUxTSU4jTUFWCkxMQ09PTEojI0ZJR0FSTwpKT0FOT0ZBUkMjI0xJTk8KQU1CSVQjQ09IQUJJVEVEClJFRUNFI09ORVBPVEFUTwpTTkVFUiNCQVJSWVpJVE8="},{"title":"The Hue-Man Condition, 9/26/05 (Monday)","author":"by Gary Steinmehl / Edited by Peter Gordon (puzzleeditor@nysun.com)","date":"2005-09-26","grid":"UENQIyNBR0FSI0JMT09NCkNMVUUjVE9KTyNMQU5HRQpUT1JUSUxMQVMjVUhVUkEKI1NQQVIjRFJJVkVSU0VECkZFTExPRkYjTklCIyMjIwpBVEUjQ0FJTiNDTEFTU1kKQVNIRSNTTlVHI09QSU5FCiMjRU1CI0dSUiNPUkxPTgpFTUFJTCNFU0UjRElWIyMKREFSTEEjUkVFRiNMRVdECkRFVEVDVCNTTk9CI1JPSQojIyMjS0lNI1RFQVNIT1AKR09PREZBSVRII1RJRUQjCkFVRElPI1JPVUdITkVDSwpHUkVDTyNFTU1BI0dMVUUKQVNTRVQjREVCUyMjU1RZ"},{"title":"Verbal Disagreement, 9/27/05 (Tuesday)","author":"by Jeffrey Harris / Edited by Peter Gordon (puzzleeditor@nysun.com)","date":"2005-09-27","grid":"I1FUSVAjQUdORVcjQURFClRVUk5TI05PQkxFI0xJRApSRUFESU5HUkFJTFJPQUQKVVJEVSNBU1AjI0RJVFpZCkVZRVNQT1QjUVVJUCMjIwojIyNUT00jU1VSTkFNRVMKQU5OUkVJTktJTkcjSVdPCkxBQ1kjI09FUiMjSU1BTgpFTE8jTEFURUVWRU5JTkcKQ0FTVEFORVQjSU5OIyMjCiMjI0FSSUQjS05FRUNBUApPSEFSQSMjQklHI1JBR0UKUFVUVElOR09OVEhFRE9HCkVHTyNOT0VORCNFQVJOUwpERU0jRURFTlMjRlJFWSM="},{"title":"High-Caliber Profession, 9/28/05 (Wednesday)","author":"by Patrick Jordan / Edited by Peter Gordon (puzzleeditor@nysun.com)","date":"2005-09-28","grid":"SFVNRSNBRE9SRSNTSElQCkFMRVgjTE9SRU4jWU9XTApJTldIQVRKT0JDQU5ZT1UKR0FMSUxFTyNTQU1PQU5TCiMjI0JBUiMjI1NPTiMjIwpCRUZJUkVERVZFUllEQVkKRURJVCNEQUxFUyNNSVRBCkxVRyMjI1ZBTiMjI0NPVwpBQ0hFI01FVE9PI0dFTkUKWUVUU1RBWUVNUExPWUVECiMjI1RPRyMjI1RPVCMjIwpTVEVST0lEI1NJUk9DQ08KSFVNQU5DQU5OT05CQUxMCkVOSUQjQVRFSU4jRUdBRApEQVRBI0xFQVBTI0RFTlM="},{"title":"Themeless Thursday, 9/29/05 (Thursday)","author":"by Brendan Emmett Quigley / Edited by Peter Gordon (puzzleeditor@nysun.com)","date":"2005-09-29","grid":"U0lUT05JVCNKRVRTS0lTCkFUSExFVEUjRVhPVElDQQpORUVESEFNI1JJRERMRVMKSVJSI0lMUE9TVE8jRE9ICkJBRVIjWUVTRVMjSkFWQQpFVFNFUSNTTFkjQ0FSRVkKTEVBRFVQVE8jR09ORVJTCiMjI1pFVVMjQ1VSRSMjIwpBU0tPVVQjRE9ORURFQUwKVkhPTkUjSUVSI0RPTk5BCkVJTkUjS05BUFAjRVRBVApOQVQjTEFORFNBVCNXSE8KVVRJTElaRSNNQVJSSUVTCkVTS0lNT1MjQVZJT05JQwpRVUlaTk9TI05PWFpFTUE="},{"title":"Quadruple Doubles, 9/30/05 (Friday)","author":"by Michael Shteyman and Kyle Mahowald / Edited by Peter Gordon (puzzleeditor@nysun.com)","date":"2005-09-30","grid":"Q1NJI1NPUlQjQ0xPU0VSCkhVTiNFTUlSI1JFRFRBRwpBSUQjWEVOQSNBVkVSVFM="},{"title":"Something's Not Kosher Here, 10/3/05 (Monday)","author":"by Charles E. Gersch / Edited by Peter Gordon (puzzleeditor@nysun.com)","date":"2005-10-03","grid":"SkFNI1NPUyNHVU1EUk9QCkFEQU1BTlQjT05BREFSRQpNT05JVE9SI1dJTlNCSUcKRVJJTiMjRURJVFMjQk9HClNOQUlMTUFJTFMjVElOWQojIyNTT0FLRUQjR0VUIyMKUENQI1NURVQjREVNRUFOCkFSSUQjVFJBI0VMUEFTTwpSRUdJTUUjUkNBI1RSSU8KU1dJVkVMI1lPREEjU0FOCiMjTkFHI0FMQkVSVCMjIwpMRUFOI0NSQUJORUJVTEEKQUxQI0RSQVdMIyNBTUlEClRXT1BBSVIjRU5QTEFORQpUQUtFVEVBI1JPTExTVVAKRVlFVEVTVCNTVFkjU1NU"},{"title":"Add-Ons, 10/4/05 (Tuesday)","author":"by Sarah Keller / Edited by Peter Gordon (puzzleeditor@nysun.com)","date":"2005-10-04","grid":"TUVTT04jRVNUQSNQTFVTCkFMSUJJI1RXSU4jSU9ORQpDT05TRUNUSU9OI1NUWVgKIyMjSUNFVVAjI09UVE9JCkFCSURFRCNFT05CT09LUwpCUkFJU0VEI05BSUxTRVQKU0FHQSMjQUdFTlQjIyMjCiNZT05DSFJPTU9TT01FIwojIyMjSE9OREEjI0NPVFMKVVBBVFJFRSNORUNUQVJTClRPTkJJUkRTI0NSQVRFUgpUUklPUyMjRVRIQU4jIyMKRVRPTiNCT05CT05HVU5TClJJTkQjRVJPUyNFTFJPWQpTQVNTI0dPUlAjREVJR04="},{"title":"Fashion Statement, 10/5/05 (Wednesday)","author":"by Larry Paul / Edited by Peter Gordon (puzzleeditor@nysun.com)","date":"2005-10-05","grid":"RElTUE9TRSNNT01FTlRTCkFESEVSRVMjQVJBUEFITwpZT1VEQkVTVVJQUklTRUQKIyMjQUlNI05JSCNDQU5TCkZBSU5UI1NURUFLIyMjIwpJU05UI1RBSSNORVRIRVIKR1NBI1JJQ0VTI1RXSU5FCkhPV01VQ0gjSVRDT1NUUwpUUkFJTCNTQVJBSCNTQU8KU1RZTEVTI0xFWCNWRUlMCiMjIyNSSVBFTiNBSVNMRQpTQ0FCI05BUCNBU1MjIyMKVE9MT09LVEhJU0NIRUFQCkFWRU5VRVMjTkVPTkFURQpSRUVOVFJZI05BVFVSRUQ="},{"title":"Hamming It Up, 10/6/05 (Thursday)","author":"by Josh Strayhorn / Edited by Peter Gordon (puzzleeditor@nysun.com)","date":"2005-10-06","grid":"RUdBRCNPUFRTI1NIUlVCClBBUlIjQ0FTQSNNT1VTRQpPUkNBI0VUQUwjT1JHQU4KWFJBWUhBUlJJU09OIyMjCllFTiNPTk8jVk9URUZPUgojVEFMS0lOR0FTSFRSQVkKIyMjU0VBI09STyMjQUhBCkJJRERZI0JMWSNCQkdVTgpPTkUjI0ZMQSNNVU0jIyMKU1RFVklFVU5ERVJXQVkjCkVMTU9OVEUjUkFOI1ZJQQojIyNPTEVDT1VOVFJJRVMKSE9SREUjSE9ORSNJRExZCklESU9UI0lOS1MjT0xERQpNRU1PUyNQQVNUI1NZU1Q="},{"title":"Vwllss Crsswrd, 10/7/05 (Friday)","author":"by Frnk . Lng / Edited by Peter Gordon (puzzleeditor@nysun.com)","date":"2005-10-07","grid":"TVRMRk5EUyNTQ01QUk5HCkNNUFJTUFBMU05EUk5HUwpSQ0hTVFJMTlNUUk1OVFMKIyMjQ05UUkNUTkdUVE5TClRSU0hUUyNSRExMUiMjIwpSU1EjIyMjIyMjI0JGVFMKU1RTVEhSQ1JEU1RSR0hUCkhUVEhOTFJHSFROVEhIRApDSFJTVE1TVFJMR0hUTkcKTlROTFJTVFJOVFNTQ1ROClNQR1QjIyMjIyMjI0xOUwojIyNOTUdORCNNU0hCR1MKVFNURk5TV05NRENOIyMjClRIUFNTQkxUU1JORExTUwpNUlBXUkZMVEhOTENNVFYKU1BSVFNSRCNUUlNUQlJE"},{"title":"Sounding Out, 10/10/05 (Monday)","author":"by Ron Blocher / Edited by Peter Gordon (puzzleeditor@nysun.com)","date":"2005-10-10","grid":"TUVURVMjVElNRSNTVEFCCk9DSFJFI1VTRVIjSU9UQQpXSElTUEVSSU5HQkVMTFMKTk9SI0lDRVMjU0FWRUFTCiMjU0hBUkUjIyNTRVRTIwpBU1RBI1VOQ09SS1MjIyMKQ0hJUlIjI09CT0UjVEFJClRBTEtJTkdQSUNUVVJFUwpTSFkjVkFORSMjU0NPUk4KIyMjQVVHVVNUQSNMT09UCiNDQUxMIyMjQVNDQVAjIwpPT0RMRVMjQVJJQSNTUEEKU0hPVVRJTkdNQVRDSEVTCkhFUkQjU0FSQSNDUklTUApBTk5FI0lNQUMjSFlQT1M="},{"title":"Compound Fracture, 10/11/05 (Tuesday)","author":"by David Sullivan / Edited by Peter Gordon (puzzleeditor@nysun.com)","date":"2005-10-11","grid":"Q1pBUlMjU0xPUCNNT1BTClJPREVPI1RBUEEjSU5SRQpZT0RFTCNBVkVSI1JFRUwKIyMjRkFTVEFORExPT1NFCkVCQiNSUEkjUk9JI0ZFTgpHT09GI0VDSE8jTkFGVEEKR09BTElFI09BU0VTIyMjCiNCUkVBREFORFdBVEVSIwojIyNFTU9URSNJUk9OSUMKU0NPVFMjSERUViNOSUNFCkVBUiNBQ0UjRUVSI0RITApBTkFSTUFOREFMRUcjIyMKTkFUTyNCSUFTI0hBTkRZCkNST1AjTEFORSNBUkVOQQpFWVJFI0VOR1IjQlJFQUs="},{"title":"The Female Touch, 10/12/05 (Wednesday)","author":"by Paula Gamache / Edited by Peter Gordon (puzzleeditor@nysun.com)","date":"2005-10-12","grid":"U0xBWSNBTENPQSNBTFRJCkhPQk8jR0FMQVMjU0FBQgpBQ0xVI0VZRUZMQVNIRVMKR09FU0JPT00jI0xFVEJFCiMjI1dPTEYjVFVJVElPTgojRFJFQURGTE9DS1MjIyMKUUFUQVIjI0lTTEUjREVOCklMRVIjUEFTSEEjVE9SRQpYSVMjQkVOWiMjS0FaT08KIyMjR1JFQVRGTEFLRVMjClJFTkFVTFQjTElSRSMjIwpBSU9MSSMjVE9FTE9PUFMKTEVNT05GTEFXUyNWU09QClBJRVIjQkVSRVQjRUxMQQpIT05FI0lOVFJPI1JPT00="},{"title":"Themeless Thursday, 10/13/05 (Thursday)","author":"by Robert H. Wolfe / Edited by Peter Gordon (puzzleeditor@nysun.com)","date":"2005-10-13","grid":"SVJPTkNMQURTI0NMSU5HClNFUklBTE1PTSNIQU1FTApMQVNUU0NFTkUjSU5BV0UKRVJPU0lPTkFMI1BBR0VTCiMjIyNOT0QjVEFTVEVSUwpQSVNUT0wjIyNUSFUjIyMKQUJMRSNKVVNURk9STUVOClJFQVJNI0FLQSNUTk9URQpFWFRSQUZSSUVTI0VSQVMKIyMjRURVIyMjT0dSRVNTClFVQVZFUlMjTFVJIyMjIwpVTlNFUiNQTFVSQUxJWkUKQU1PUkUjRVVNRU5JREVTCllFTlRBI0NSRVNUTEVTUwpTVEVFTCNLRU5UU1RBVEU="},{"title":"Putting the Top in Topography, 10/14/05 (Friday)","author":"by Kevin Wald / Edited by Peter Gordon (puzzleeditor@nysun.com)","date":"2005-10-14","grid":"SkFCUyNSSVBBIyNMQUJTCkFNRU4jT01BUiNSRUZSWQpNSURPQ0VBTkZSSURHRVMKIyNCUk9OWCMjT01BSEEjCkZMVUVOVCNBTU8jI0FTQQpMRUdTI0dVTkFNT1VOVFMKWUVTI0xFTkRMI1BISVNICiMjI1NVTkNSSVNFUyMjIwpBU0NJSSNMRUNBUiNDVVAKVFdJTlNQRUFLUyNTT1pFCkVPTiMjRVNTI1NFUVVJTgojUkVJTlMjI1NJVFVQIyMKSEVBREZPUlRIRUhJTExTCkVBU0VMI0VXRVMjQkVFUApFVFRBIyNWT0xUI1NUQVk="},{"title":"Decentralized, 10/17/05 (Monday)","author":"by Gary Steinmehl / Edited by Peter Gordon (puzzleeditor@nysun.com)","date":"2005-10-17","grid":"Q0FQVCNQUk9QUyNBV0xTCkNSQVcjUkVNQVAjR0FJVApMT1BFREVWRUdBI0VUTkEKSU5BUk9XI0dPUkUjRUdHCiMjI1BMQVpBREVUT1JPUwpFUEEjQ1JPI0FNT1MjIyMKTUFMREVNRVIjRU5TTEVSClVTRVIjI1lFVCMjSU9UQQpTVFJFQUsjQ1VMREVTQUMKIyMjQU1PUiNOVUkjU0xZCkNSRU1FREVDQUNBTyMjIwpST0IjTklURSNJTlNFVFMKRUtFRCNBSURFREVDQU1QClBFUlUjS05FRUwjQVNFQQpFUlRFI1NBRExZI1JFTlQ="},{"title":"\"Oh, It Really Becomes You!\", 10/18/05 (Tuesday)","author":"by Shannon McDowell and Ben Tausig / Edited by Peter Gordon (puzzleeditor@nysun.com)","date":"2005-10-18","grid":"Q1pBUiNFTFNFI05BU0FMCkhBUkUjTk9FTCNFWFVSQgpJQ0VEI0RBTEkjV0VFUFMKQ0hBSU5PRkZPVUxTIyMjCiMjI0FJUlMjVFJFI1NUVQpNQ0RMVFMjIyNHQUlOT04KRVJBI1NFTkFURUZMT1VSCkNPUkEjI0FEQSMjTE9QRQpDT1dCT1lCT1VUUyNQRUEKQUtJTUJPIyMjV0VBU0VMClNTTiNFS0cjU0VBVCMjIwojIyNUUk9VQkxFU0hPVVQKSkVXRUwjU1VFWiNBQkxFCkFUQVJJI1RSRUUjTk9ORQpCQVNJTiNPUFRTI0RFQU4="},{"title":"Hang Five, 10/19/05 (Wednesday)","author":"by Kelsey Blakley / Edited by Peter Gordon (puzzleeditor@nysun.com)","date":"2005-10-19","grid":"QUJBU0UjI0NEUyNTUEFZCk1BTlRBI0JBUk5TVE9STQpJTkRVU1RSSUFMUEFSS0EKIyMjRFlFSU5HI0FSVCMjCkFSTVlBTlRFI0FOVElDUwpMQUdBU1NFI0pVRCNDT1AKU0VNSSMjI0NFUkVNT05ZCiMjI0RFQVRIVEFYSSMjIwpEQUlTWU1BRSMjI0RSRVcKRUREI0VPTiNMT1VTSUxZCldFSUdIUyNUT1BCVU5LTwojI09PTyNNSVJJQU0jIyMKTElUVExFR1JFRU5NRU5VClRSSUJFU01FTiNHRU5VUwpSQUNZI1FUUyMjSVJFTkU="},{"title":"First-Rate, 10/20/05 (Thursday)","author":"by Jay Leatherman / Edited by Peter Gordon (puzzleeditor@nysun.com)","date":"2005-10-20","grid":"QUFII0ZPU1NJTCNUQUkjClJOQSNJTVBBTEEjQ0lOQwpGRVRUTEUjUEVTVCNMR0EKIyMjSVRFTSNTVFJFV0VSCiMjUFJFQ0lTI0xBTUFSUg=="},{"title":"Weekend Warrior, 10/21/05 (Friday)","author":"by Frank Longo / Edited by Peter Gordon (puzzleeditor@nysun.com)","date":"2005-10-21","grid":"T0hQVUhMRUVaRSNFR0FMCkhPVVNFT0ZZRVMjTE9SSQpBTERFUlRSRUVTI01PQU4KUkVEUk9TRSMjI0RPREdFCkVEWVMjT01BSEFOI01PVAojIyNHSUYjU0lMSUNPTkUKQkVHVU4jT0FLTEVBVkVTCkFWT0lEI1VURSNQUkVTVApTRUVERUFURVIjRUxTRVMKRU5TRU5BREEjQVJSIyMjCkJCQyNUSE9NQVMjRUNSVQpBUlJBUyMjI1NJTUlMQVIKTEVBSyNQQVNBREVOQUNBCkxBWkUjT05USEVMRVZFTApTS1lZI0lORElTVFJFU1M="},{"title":"Broadway Babes, 10/24/05 (Monday)","author":"by Fred Jackson III / Edited by Peter Gordon (puzzleeditor@nysun.com)","date":"2005-10-24","grid":"SUJJWkEjQ0xBTSNFRFRWCkJBTEVTI0hPTUUjTUFSRQpNSVNTU0FJR09OI0FNSVMKU1RBVElPTiNTVUJKRUNUCiMjIyNHTEFEIyNST1NFUwpBRERPTiMjQU5HT1JBIyMKTkVSRCNDQU1BUk8jVEhFCktMRUVORVgjU0FNRVNFWApBTEEjQUxMREFZI01FUkUKIyNNSVNMRUQjI1FVQURTClNJR01BIyNFU0FVIyMjIwpBTUlCTFVFI0NMQVNTSUMKV0FSRSNNWUZBSVJMQURZClVDTEEjUFJPTSNUT05FUwpQU1NUI1NFRVAjU1dFQVQ="},{"title":"Daze Work, 10/25/05 (Tuesday)","author":"by Bonnie L. Gentry and Victor Fleming / Edited by Peter Gordon (puzzleeditor@nysun.com)","date":"2005-10-25","grid":"QVhFTCNMQVRFI0FCRkFCCkxFQUQjQUNJRCNBUlVCQQpPTlRPI09NRU4jUkFaT1IKSE9PUFNURVJBTE9OWk8jCkFOTkFMUyMjI0FORFkjIwojIyMjT0VESVBVUyNNQVYKWERPVVQjSU5SRSNCQVJFClJPQ0tTSU5HRVJQRVRFUgpBUlRFI0dFT0cjUkVIQUIKWUFPI1RPUlRPTkkjIyMjCiMjUEFSVCMjI0FTVEFSUwojU1VHRU9GUkFQTVVTSUMKQkFTUkEjUk9MTCNHSUxBCkFTU0VUI09CT0UjQURFTgpBSFlFUyNNRVRTI1RFU1Q="},{"title":"Separation H, 10/26/05 (Wednesday)","author":"by David Sullivan / Edited by Peter Gordon (puzzleeditor@nysun.com)","date":"2005-10-26","grid":"SkVSS1kjREVQT1QjRk9FCk9aT05FI0VYSUxFI0lCTQpUUkVFV0lTRU1FTiNKSU0KU0FTRSNSSUNFI0RFSVRZCiMjI0RFQUwjTkVFVCMjIwpBUk0jU1FVQVRUUlVTVFMKREVBUlMjI0dPRVNERUVQCk9CT0UjUFJJU1MjRVROQQpQQVJBU0FJTCMjQVNUT1IKVFJJTExTRUVLRVIjT1JFCiMjI01FVFMjRVBJQyMjIwpHUkFTUCNMT1ZFI0lOS1MKUkFKI1RSSVBMRVRSRUFUCklSQSNJT05JQSNJQ0lMWQpURVgjTklHRVIjVEVMRVg="},{"title":"Themeless Thursday, 10/27/05 (Thursday)","author":"by Raymond Hamel / Edited by Peter Gordon (puzzleeditor@nysun.com)","date":"2005-10-27","grid":"REVURVIjR0VFU0UjQURTCkVMRVZBVE9SQ0FSI0VSQQpCUkVFWkVBTE9ORyNHRUwKSU9VI0VYUEVMI1NXRUFUClRZUE8jVEVORVQjSEFNTQojIyNCT1NPTSNVQkFOR0kKVEFQSVIjVkVTVEEjU0lOCklMTFRBS0VZT1VUSEVSRQpUSEUjUk9SRU0jSEVBTFMKTEVOU0VTI1JFTEVFIyMjCkVESUUjU09GVFkjUE9NUApSSVRFUyNTTElERSNQSUUKT1NVI0lUU0FNSVJBQ0xFCkxPRCNSQUlTRUFTVElOSwpFTkUjU0VFS1MjVEVURVM="},{"title":"Alphabetical Ordering, 10/28/05 (Friday)","author":"by Patrick Berry / Edited by Peter Gordon (puzzleeditor@nysun.com)","date":"2005-10-28","grid":"I0FMRklFI1BBVCNMVUlT"},{"title":"Boo Movies, 10/31/05 (Monday)","author":"by Gary Steinmehl / Edited by Peter Gordon (puzzleeditor@nysun.com)","date":"2005-10-31","grid":"U0lSUyNHUkVUQSNQUkVaCklERUEjTEVUT04jUk9QRQpOQVBTI09QQVJUI0VXQU4KR0hPU1RCVVNURVJTIyMjClNPUyNPQVQjI05PVE1FIwojI1NLRUxFVE9OQ09BU1QKS05FRVMjI0FMQVMjUlRFCkVBU1kjUkFLRVMjRUtFUwpQQ1MjTU9MRSMjQVZFUlQKVEhFVkFNUElSRUJBVCMjCiNPU0FLQSMjRVJFI1ZFRwojIyNNT05TVEVSU0JBTEwKSkVFUCNMRUlMQSNBTERBCk9HTEUjQUdBSU4jU1VFWgpHT0xEI1dBU05UI0hFUkU="},{"title":"Reset the Clock, 11/1/05 (Tuesday)","author":"by Joe Bower / Edited by Peter Gordon (puzzleeditor@nysun.com)","date":"2005-11-01","grid":"U0xBTSNGTEFQI05PQkxFCklPTkEjVEVOUyNPUElVTQpOT1RJI0RFTlkjQ0VOVFMKRU1JVEZPUkFDSEFOR0UjCiMjI0FJRCMjSE9OIyMjIwpIQVZJTkdBR09PRE1JVEUKQUJFI05FSUwjRE9SU0FMCk5PVEgjI0xBUCMjVFVUVQpPUlRFR0EjWkVTVCNaRUQKSVRFTU9GREVQQVJUVVJFCiMjIyNVVEUjI0RPRSMjIwojVFVSTkFST1VORFRJTUUKR0FaRUQjQUJMRSNST0FOCk9YSURFI0lPTlMjSVRSWQpWSVNPUiNMRUFTI1NBR0E="},{"title":"Holding Sway, 11/2/05 (Wednesday)","author":"by Ed Early / Edited by Peter Gordon (puzzleeditor@nysun.com)","date":"2005-11-02","grid":"U0lERUIjU1RPUCNFTU1FCktORUVMI09JTFMjTE9DSwpJTkZMVUVOQ0VJU0xJS0UKIyMjU0VBVFMjI1BBU0VPCkRBTSNGUkEjVEFJI1RBVQpBU0FWSU5HU0FDQ09VTlQKTklLT04jI0FVVEVVUiMjCkFGRVcjTElTVFMjWklNQQojI0JFR0lOUyMjQ09aRU4KVEhFTEVTU1lPVVVTRUlUCkhBTCNTQVQjRFJUI1JOUwpBUklBUyMjUklET0YjIyMKVEhFTU9SRVlPVVZFR09UClNBVkUjRVNBVSNFVFVERQpPUkVTI0RFTlMjUkFOREQ="},{"title":"Alternate Spelling, 11/3/05 (Thursday)","author":"by Patrick Blindauer / Edited by Peter Gordon (puzzleeditor@nysun.com)","date":"2005-11-03","grid":"U0FCUkUjQ0RTI0dDTEVGCkFCT1VUI0FSSSNFTElERQpMQVRFUklTRVIjVE9LRU4KRUNPI0FOVFMjTUFWRU5TCk1JWEVETUVTU0FHRVMjIwojIyNCRUEjI1BBUiNBQ1QKRUFTRSNUWVBPI0lHTE9PCk1CQVJLRUVBVUtQVU9QUgpNVUxUSSNBVFROI0VUQVQKQVRFI0xCUyMjQUJTIyMjCiMjU1BMSVRERUNJU0lPTgpXSVNFVE8jT0FLUyNNQUUKRU5MQUkjRklSU1RSQVRFClBSSVNNI0FMTCNSQUdFRApURVBFRSNOWVMjT01FTlM="},{"title":"Weekend Warrior, 11/4/05 (Friday)","author":"by Ogden Porter / Edited by Peter Gordon (puzzleeditor@nysun.com)","date":"2005-11-04","grid":"VEFKTUFIQUwjI0dOQVdTCkVNSUxJQU5PI0JBQUJBQQpFTk1JVElFUyNVU05BVlkKTUVESUMjQ0VMTE1BVEVTCklTQSNIQUQjQUxFI0VMWQpOSUxFI0tPQ0gjVEhSRUUKR0FFTCNFVEEjSEVJU1RTCiMjI0NBTEVOREFSUyMjIwpBTkdJTkEjRFJZI1NPQ0sKUkVBREQjT1dFRCNZVUxFCkFXTCNFSU4jU05PI1RFTgpQQVBFUkJPWVMjUk9XQU4KQUdBU1NJI0FMQ0FQT05FCkhFTFBFRCNORVVURVJFRApPUlNPTiMjR1JFRU5FUlk="},{"title":"Sit for a Spell, 11/7/05 (Monday)","author":"by Brendan Emmett Quigley / Edited by Peter Gordon (puzzleeditor@nysun.com)","date":"2005-11-07","grid":"WklUI1NMRUVQIyNBSVdBCklDVSNQQVJUSSNTT05BUgpNRVIjRURJVFMjRUxGSU4KTUFHSUNTUVVBUkUjSVRPCkVYSVRTIyMjI0FNQU5BIwpSRURTI1RSQVNII1ZJU0UKIyMjQUxXRVNUI0pFVEVSClZPT0RPT0VDT05PTUlDUwpKQ1JFVyNMT0xJVEEjIyMKU09EQSNBU1RJTiNSRUFQCiNOSUxMQSMjIyNESUFOQQpBTk4jQ0hBUk1RVUFSS1MKUkVBREQjQk9BVFMjTkFUCkVMTElTI0NVVElUI0VSUgpBTFNPIyNTVEVQUyNEQVk="},{"title":"Tsar Search, 11/8/05 (Tuesday)","author":"by Timothy Powell / Edited by Peter Gordon (puzzleeditor@nysun.com)","date":"2005-11-08","grid":"R0VOVVMjWUVHRyNTV0FCCkFCQVNII0FHRUUjT0hOTwpMT1RTT1BQT1JUVU5JVFkKU05PUkVSIyNNVVRBVEVTCiMjIyMjQUlSI1BFUiMjIwpTVU5EQVlCRVRTIyNTSVIKQVBFUlkjRUJTRU4jQVJFCk5FV1lFQVIjRVRBSUxFUgpUTlQjU1BJTFQjSVZBTkEKQURTIyNFQVRTT0ZFREVOCiMjI1BBUiNERVMjIyMjIwpBUkNBRElBIyNMT09OSUUKQlVMTEVUUFJPT0ZWRVRTCkNMQU0jSVNOVCNGQVJFUwpTRVdTI0ZFQVQjU0xPTU8="},{"title":"Disneyfication, 11/9/05 (Wednesday)","author":"by Gary Steinmehl / Edited by Peter Gordon (puzzleeditor@nysun.com)","date":"2005-11-09","grid":"QVJNT1IjVEFUQSNDQVJBCkxFQU5OI0JUVVMjQUxVTQpGQU5UQVNJQUJBUlJJTk8KQURaIyNPUlIjI0NVQklDCiMjQUxBRERJTkNBU0lOTwpQQU5BTUFTI0FMU08jIyMKRUxJVEUjI0VSRSMjVEFJClBFVEVSUEFOQ09MTEFSUwpTRUEjI1JWUyMjT0FLRU4KIyMjQUx