{"id":"nysun-2002","publication":"nysun","year":"2002","count":181,"puzzles":[{"title":"Space Balls, 4/16/02 (Tuesday)","author":"by  Ogden Porter / Edited by Peter Gordon (puzzleeditor@nysun.com)","date":"2002-04-16","grid":"QVBQTEUjQ0FQI0FOR1NUClNIT0VTVE9SRSNTRUFMRQpIRVJFQ09NRVNUSEVTVU4KRVdFUyNORUFUTyMjQklECiMjIyNSRUQjI01FTkFDRQpNRVJDVVJZVklMTEFHRVIKVVRVUk4jI09ESVNUIyMjCkRBTUUjQlJVSU4jVVNFRAojIyNTVE9JQyMjQVJPTUEKT05FVE9VQ0hPRlZFTlVTCkJFTlNPTiMjUkFHIyMjIwpTR1QjI0RBWUFOI1RSVUUKRUFSVEhTSEFUVEVSSU5HClNURUFNI1NORUFLSU5UTwpTRUVQUyNPS1MjRUdHT1M="},{"title":"Say What?, 4/17/02 (Wednesday)","author":"by  Richard Silvestri / Edited by Peter Gordon (puzzleeditor@nysun.com)","date":"2002-04-17","grid":"SlVNUCNSQUJCSSNTVEVUCk9SQUwjRUxMSVMjQVdSWQpBR1JBI0NMT1RII0xPT0sKREVFWU9VT1dFI0xPT1NFCiMjI1BBUlRZI0dPT0YjIwpDQURFVFMjI01BR05BVEUKTEFJTkUjT1ZBTCNTS0lECkFSRiNSQURJQ0FMI0lORwpTT0ZBI0RPWkUjTEFOR0UKU05JQ0tFUiMjU0FOREVSCiMjQ09JTiNDTEFORyMjIwpDT1VMRCNBUkVZT1VCRUEKQUJMWSNQTEFURSNMQVJBClBJVFQjRE9OT1IjQUpBUgpTVFlFI1RFRU5TI1JBU1A="},{"title":"Themeless Thursday, 4/18/02 (Thursday)","author":"by  Randolph Ross / Edited by Peter Gordon (puzzleeditor@nysun.com)","date":"2002-04-18","grid":"RklHVVJFU0tBVEUjT09ICkFNRVJJQ0FOUElFI05ORQpTUEVFRE9NRVRFUiNQRUEKVEFHI0VMQkUjUk9OQUxECkVMQUwjT0FTVCMjSVJJUwpSQVdFR0cjI0FCQUxPTkUKIyMjQVJJI0FMRUMjTEVUCk9TVFJJQ0hGRUFUSEVSUwpOVEgjTUFJTCNUT0UjIyMKQ0FSTFlMRSMjRVJORVNUCkFHRUUjI0RBTU4jU09QSApNRU5ORU4jQ0FQRSNMRUkKRU1PI0dPVENSQUNLSU5HClJPRCNPVkVSU1RSRVRDSApBTVkjU0FSQUhIVUdIRVM="},{"title":"Puzzle of the Week, 4/19/02 (Friday)","author":"by Brendan Emmett Quigley / Edited by Peter Gordon (puzzleeditor@nysun.com)","date":"2002-04-19","grid":"I01BRVNUUkkjUkNSVU1CCkdFU0RIRUlUI09SQVRPUgpBVURJRU5DRSNMRU1BREUKSVNFRSNGRU1BTEUjSEVSCkFFUiNTT0QjQk9MTCMjIwojIyNTVFUjU0FVU0FHRVMKU0NBTEFSI0VTVCNCQUxFCkhBQklUI1NXRSNUUk1BTgpBUk9OI0FQVSNJTUVBTlQKRFJVR1RSSVAjTkJBIyMjCiMjI1NBTUUjU0FTI0NPRQpFTUkjS0FTSEFTI0ZBU1QKUEFORkVEI0VTUFJFU1NPClBBR0xJQSNXSElURVNJTgpTTUVMVFMjTkFORVRURSM="},{"title":"Name Droppin', 4/22/02 (Monday)","author":"by  Trip Payne / Edited by Peter Gordon (puzzleeditor@nysun.com)","date":"2002-04-22","grid":"R0FTI1dFQiNBTEEjU1BBCk9DVCNBUkFCSUFOI0hBVApEQVJJTkdEQVJJTiNFR08KU0NPTEQjI1JJVEUjREFNCk9JTksjTUFLRSNYTUVOIwpOQUcjRkFLSVJTI0FWSUQKIyMjQkVOSU4jSU5MSU5FClRSSUxMSU5HVFJJTExJTgpSRVNFTEwjQkFJVFMjIyMKSURMRSNBQkFDVVMjTEVBCiNDQVBOI0FSS1MjQklMTApURU4jRVJJSyMjQVJFTkEKQUREI1BBTElOR1BBTElOCk1BRSNBVkVOVUVTI09OTwpFUlIjTEVEI1RFRSNXT04="},{"title":"Mayory-Go-Round, 4/23/02 (Tuesday)","author":"by Fred Piscop / Edited by Peter Gordon (puzzleeditor@nysun.com)","date":"2002-04-23","grid":"VE9NUyMjQ0lBTyNBREFNCk9SQ0EjR0VSUlkjVkVSTwpXQUdORVJUQUlMI0VUTkEKSVRFI1RVRVMjI1NOT09UClRFRVRIRVIjQUxJR04jIwojIyNCQUxBTkNFQkVBTUUKQ1NQQU4jI0lSSVMjVE9WClJPQVIjQk9YRVMjWU9SRQpVU1MjUE9MTyMjU09SRVIKRE9USEVMSU5EU0FZIyMjCiMjVEVOT04jSU5ST0FEUwpCUkVTVCMjQVNJQSNUT1cKUlVOVCNLT0NIUEhSQVNFCkVTU08jQU5URVMjQVJFQQpURUVOI1RFU1MjI01JU1Q="},{"title":"Glass Act, 4/24/02 (Wednesday)","author":"by Eric Berlin / Edited by Peter Gordon (puzzleeditor@nysun.com)","date":"2002-04-24","grid":"QUxFQyNDQVJFI1NQQU1TClJPVEgjQVJFQSNQT0xJTwpFQ1JVI0JFQVIjSUxJQUQKU0hFVExBTkRQT05ZIyMjCiMjI1pPUkEjI1RPUFBFRApTVEFQTEUjUlNUVSNPU1UKUEVOQUxUWVNIT1QjUlRFCkxBVEgjI0FWRSMjQ09BTApBU0gjRklQUExFRkxVVEUKVEVFI0xPU1MjQ0FVU0VEClNUUkFJVCMjRk9OVCMjIwojIyNGUkFOS0VOU1RFSU4KQURNSVQjVU5ETyNFTFNFCkxPSVJFI1RFRU0jUklQUwpBU1RFUiNTRVhZI1NBWVM="},{"title":"E-Males, 4/25/02 (Thursday)","author":"by Ogden Porter / Edited by Peter Gordon (puzzleeditor@nysun.com)","date":"2002-04-25","grid":"RVNURUUjU0VUSCNQRUdTClRIRVNFI0VSU0UjRVJMRQpERVJFS0pFVEVSI0VSRVMKU0VSIyNFS0UjI0dXRU5TCiNSRUJCRVMjU1BFRURTIwojIyNFRVIjQ0xFVEUjIyMKRU1FTkQjU0VFUiNSRU5ECldFUk5FUktMRU1QRVJFUgpFREdFI1ZFRVAjUkVFVkUKIyMjVEhFV0IjRUVTIyMjCiNERVRFUlMjRVhQRU5EIwpMRUVDSCMjRVZFIyNFRUUKRUxMRSNQRVRFU0VFR0VSCkVWRVIjRU5UUiNTVEVSTgpTRVJGI05FRVQjTEVWRUU="},{"title":"Weekend Warrior, 4/26/02 (Friday)","author":"by David J. Kahn / Edited by Peter Gordon (puzzleeditor@nysun.com)","date":"2002-04-26","grid":"SE9NRVBMQVRFI1dFQkJTCk9ORVNFQVRFUiNBQk9VVApTVEFURUxJTkUjU0FCTEUKVE9MRVJBVEUjTUFOVExFClNQWVJJIyNUUklCI0FNUAojIyMjTkFHI0VESVRJT04KU0xJTkdCTEFERSNBTE9FClRPTkUjU09VU0EjVEVTUwpJVkVTI1RBS0VTU0lERVMKTEVTU0ZBVCNBVFQjIyMjCkVMUyNMSVNUIyNJTU9GRgpUSUVQSU4jQVBQTEVQSUUKVEVOU0UjQ0xFT0xBSU5FCk9TQ0FSI0RPR0tFTk5FTApTVEVUUyNJTlNFUlRFUlM="},{"title":"Street Names, 4/29/02 (Monday)","author":"by Ogden Porter / Edited by Peter Gordon (puzzleeditor@nysun.com)","date":"2002-04-29","grid":"TllDI1BJR1MjV0VUQkFSCkVBUiNBQkVMI0hPSE9ITwpBSEEjTUVOVSNJTlJPQUQKUk9TU1BBUlJPVCNPUkJTClNPU1VFTUUjUkVJTiMjIwojIyNNUlMjTEFTVEdBU1AKU0FSQSMjTUVMRUUjT0FSClBMQUNJRE9GTEFNSU5HTwpBVE0jRE9UVFkjI1dFRVAKVE9QRk9SVFkjRkJJIyMjCiMjI0VMQUwjTUVBU0xFUwpTSE9FI01FUllMU0hFRVAKTEFNQkRBI0VMSVMjQVJJCkFaQUxFQSNEQU5FI1BJVApWRU5FRVIjT1JFUyNTRVo="},{"title":"Fabulous Forties, 4/30/02 (Tuesday)","author":"by Bill Weber / Edited by Peter Gordon (puzzleeditor@nysun.com)","date":"2002-04-30","grid":"UEFMRVMjVEJBUiNUQVJUCkFCSURFI0hPUEkjRVBFRQpTRUxJRyNBQVJQI1RFQVIKU1RBVFVFVFRFUyNFU1BOCkVTQ0hFV1MjU0FHQSMjIwojIyMjU0VUSCNXSVRISVQKTUlTVCNTSFVUI0dFT0RFClVTRVJTI0FNQSNTVEFMRQpTTEVFVCNUT1RPI0VYRVMKSEFOTkFII1JFUFMjIyMjCiMjI1RSSU0jUkFUQVRBVApaRUFMI1RBVFRMRVRBTEUKQVJMTyNFQ0hPI1BPUEVTClBJRVQjQ0hFVCNJTkVSVApTRUNUI0hPRVMjTkVTVFM="},{"title":"See 38-Across, 5/1/02 (Wednesday)","author":"by Nancy Salomon / Edited by Peter Gordon (puzzleeditor@nysun.com)","date":"2002-05-01","grid":"UEVQWVMjQVRNUyNMU0FUCkNSSU1QI1JVQkUjRVRURQpQRU5DSUxHUkFERUJBTEwKIyNNQVJPT04jQVZPTiMjCkVUQSNBTlRJI1RFTkRUTwpMSVRUTEUjTkxFUiNHT1AKT05DRSNSQUdFI1NMVVJTCiNXSEFUU1RIRVBPSU5UIwpGQVZSRSNUSVJFI0VNVVMKQVJJI0hVTkcjT0ZGRVJTCkRFRVBFTiNIT1BFI0xFVAojI1dPRVMjV0FMTEVUIyMKUFJFU1NVUkVTRUxMSU5HClJFTlQjTllTRSNBU05FUgpPRERTI0dFVFMjU0VHRVI="},{"title":"Themeless Thursday, 5/2/02 (Thursday)","author":"by Raymond Hamel / Edited by Peter Gordon (puzzleeditor@nysun.com)","date":"2002-05-02","grid":"Tk9CSElMTCNTQUZBUklTCk9DRUFOSUEjUFJVREVOVApUQVJCQUJZI09OTEVBVkUKQU5USSMjU1BPSUwjUk9FCkJBUlRBQiNJS0UjVkVJTApJREEjVFJBQ1kjTUlOQ0UKVEFNQVJBQ0sjV09OREVSCiMjI0xJS0VDUkFaWSMjIwpDRENBU0UjTEFWQUxBTVAKQ1JBTksjU0VXRVIjUEVSCkxJRFMjVEVBI1NUQVBMRQpBVkUjR09OTkEjI0RSQVQKTUVOVE9SUyNST0dBSU5FClBJWkFSUk8jQ1JBTVNJTgpTTkFQUEVSI0hBWVNFRUQ="},{"title":"Ticked Off, 5/3/02 (Friday)","author":"by William I. Johnston / Edited by Peter Gordon (puzzleeditor@nysun.com)","date":"2002-05-03","grid":"Uk9BUiNGQUNFI1NQT1RDCkFOVEUjQklPUyNIQUlLVQpOQ0FBI0lSQVEjQUVTT1AKRFVMTCNNRFQjQVNTRVNTCkRFTElWRVJDTUFURSMjIwojIyNUSU5ZI0lSQSNTQUQKTUFSWUkjI0VORyMjUFJPClRIRUNJU0lOVEhFTUFJTApHRU4jI1RWUyMjUk9ZQUwKRU1PI05SQSNJU05UIyMjCiMjI0hPVU5EU1RPT1RIQwpSRVNFTlQjT0hPI1JFQVAKRVJBU0UjVU5UTyNPRUlMCkNMSVNUI05FQVAjTFVMVQpTRUxFUyNDRVJTI0FQRVM="},{"title":"Big Business, 5/6/02 (Monday)","author":"by Elizabeth C. Gorski / Edited by Peter Gordon (puzzleeditor@nysun.com)","date":"2002-05-06","grid":"VEFMQ1MjTkFCUyNBU1BTCklCRVJUI0lORUxBU1RJQwpEQVZJREFOREdPTElBVEgKQVNJUyNIRVkjTUVBTCMjCkxFTlNDQVAjRk9SI0xTRAojREVDTyNNQ0kjVE9PVFMKIyMjUkNBI09ERCNVTklUCiNDT09LSUVNT05TVEVSIwpJUklTI0RZRSNBT0wjIyMKVFVMU0EjRVRDI0ZBQ1QjClNFVyNIQUQjVUdBTkRBTgojI0VDT04jR1RFI0RSTk8KSk9MTFlHUkVFTkdJQU5UCkFMTFVTSU9OUyNFU1RFRQpNRFNFI0VCQVkjU0hFRFM="},{"title":"All Around the Town, 5/7/02 (Tuesday)","author":"by Myles Callum / Edited by Peter Gordon (puzzleeditor@nysun.com)","date":"2002-05-07","grid":"TUJBI1ZFUk5BTCNTQU1FCkNPTiNBVEhPTUUjVFdJTgpRVUVFTlNPRkVOR0xBTkQKI1RNQyMjRFVOTk8jS09TCkJST09LTFlORE9ER0VSIwpCT05OSUUjIyNOU1lOQyMKU1NFI0tBU0hBIyNQU0EjCiMjI1NJRk9SS0lEUyMjIwojTUlWIyNTSEFNVSNGTEEKI0NSRVNDIyMjQU1CTEVTCiNNQU5IQVRUQU5CRUFDSApFQVQjT05FQUwjI0VSQSMKVEhFQlJPTlhCT01CRVJTClJPTEUjUFNFVURPI1VSSQpFTllBI1lFU01FTiNQRVA="},{"title":"Tag Line, 5/8/02 (Wednesday)","author":"by Ogden Porter / Edited by Peter Gordon (puzzleeditor@nysun.com)","date":"2002-05-08","grid":"QVJDUyNTSEFRI0ZPQ1VTCkRPTUUjTFVMVSNJTkFORQpPQklFI0FSSUEjSkNSRVcKUEVOTlNZTFZBTklBIyMjClRST1RTI1NFTEEjTUJBUwpTVFJPTkcjI1VOU0VBTFMKIyMjIyNVU0VEI0VSUk9SCldXV0RTVEFURURQQURVUwpJUkFURSNMT1NFIyMjIyMKRkFSRUFTVCMjREVDT1JTCkVZRUQjSVBTTyNTQ1JBUAojIyNMSUNFTlNFUExBVEUKTVVTSUMjVEFTSyNBVFROCk9aT05FI0VSSUUjTU9MRApNSVhFRCNSRUVEI1BSRVM="},{"title":"Defying Gravity, 5/9/02 (Thursday)","author":"by Frank A. Longo / Edited by Peter Gordon (puzzleeditor@nysun.com)","date":"2002-05-09","grid":"QURESU4jRUJBWSNQU1NUCkNPTk5JRU1BQ0sjT1RUTwpUUlVOS0xJTkVTI1NIT1cKQU1PUyNJVFMjRU1JR1JFClNTUiNBQlMjUEhPTklFUgojI0dJUk8jT1VUQUdFIyMKUFJFTElNI1NQT1QjSFJTCkFDSEUjWUVBU1QjQVdFUwpSQVQjT0xFRyNHT05FWFQKIyNGT05ETEUjTlVOTiMjCkFGRkFJUlMjSUlJI0hFVwpMSU9UVEEjQU9LI05DQUEKRVJURSNXRU5UQUJPQVJECk5FRVIjUFJPQVRITEVURQpFUkdTI1VSTlMjVE9ST1M="},{"title":"Weekend Warrior, 5/10/02 (Friday)","author":"by Trip Payne / Edited by Peter Gordon (puzzleeditor@nysun.com)","date":"2002-05-10","grid":"REVNT05FU1MjQVNJTU9WCk9OQVNQUkVFI05PVkVOQQpESVNUUklDVCNTSUVHRVMKT0dMRSNLT1NIRVJTQUxUCkVNSVIjU05BSUwjI0RJTgpTQU4jVkFESU0jQ1JPTkUKIyMjQkVURUwjUkFJU0VTCkhPTUlOSUQjVkVTUEVSUwpBVkVOVUUjR0VTVEUjIyMKVkVORFMjVE9SVVMjQ0NDCklSVCMjU0FUWVIjTk9BSApTVE9NUEVET0ZGI0FNTU8KSElSRU9OI1BJQU5PQkFSCkFSRU5EVCNPTkNBTUVSQQpNRURVU0EjVEVFTklET0w="},{"title":"Fun City, 5/13/02 (Monday)","author":"by Myles Callum / Edited by Peter Gordon (puzzleeditor@nysun.com)","date":"2002-05-13","grid":"Uk9CUyNST1NTI0FNSUQjCkFSRUEjQUNDVCNESU5PIwpIRUFET0ZUSEVDTEFTUyMKU09EQVMjI01BVUkjRUFVCiMjI1RIRUdPTERCRVJHUwpNRVQjQUdPIyMjQkFURVMKUFJPTSNBUkUjQkVHIyMjCkdST1VOREVERk9STElGRQojIyNTSVMjU0FUI0VCQVkKQVRUSUMjIyNOQ0MjTU9FClRIRUNPU0JZU0hPVyMjIwpNUlQjVElFQSMjRE9aRU4KI0FMTElOVEhFRkFNSUxZCiNTRUFOI1RPR0EjRVRBUwojSFlQRSNZT0dBI05JTEU="},{"title":"\"I'm Surrounded!\", 5/14/02 (Tuesday)","author":"by Rich Norris / Edited by Peter Gordon (puzzleeditor@nysun.com)","date":"2002-05-14","grid":"Q0FUUyNGUk9HI0JBQkVMCkVWRVJDTEVBUiNJTklHTwpERU1JTU9PUkUjQ0RST00KQVJQI0xBUCNHVUFSRCMjClJURVMjVEVEI1RSRUJMRQojIyNIT1NOSU1VQkFSQUsKI1BUQVMjI01BUiMjQVdFCiNZRUhVRElNRU5VSElOIwpJTEUjI0lSRSMjRkFOUyMKVE9OSU1PUlJJU09OIyMjClNOSVBFRCNTQ0gjREVDTwojI0RFTEVEI0hBWSNJT1UKQU1PQ08jQVJJTUVZRVJTCk5PTEFOI0ZJTkVQT0lOVApESVNDUyNUT0dTI01PU1M="},{"title":"Sounding Off, 5/15/02 (Wednesday)","author":"by Mel Taub / Edited by Peter Gordon (puzzleeditor@nysun.com)","date":"2002-05-15","grid":"SEVOUyNGQURFRCNJTUFDCkFWT1cjQU1VU0UjU0lMTwpMRVZJI0NPTEVQT1JURVIKRkxBTk5FUlkjUlJBVEVECiMjI0RPVCMjUklDRSMjIwpBUFBMRSNDSEVWQUxJRVIKRE9MRVMjSElWRVMjQllFCkhPQVIjQk9SRUQjQVNJUwpPQ1QjREFSRVIjU0NFTlQKQ0hFVkVMVVJFI1BBTkdTCiMjI0VMTVMjI1NBRCMjIwpDUklTQ08jRkxBTkVSSUUKQ09MUE9SVEVVUiNNSU5ECkNVS0UjQVJVQkEjSUNFRApMRUFSI0xBREVOI0NPWlk="},{"title":"Themeless Thursday, 5/16/02 (Thursday)","author":"by Mark Diehl / Edited by Peter Gordon (puzzleeditor@nysun.com)","date":"2002-05-16","grid":"RklTSFBBU1RFI0FMT09GCklOVEFUVEVSUyNNQUlORQpEUkFHU1RSSVAjT0dMRVIKR1VOUyNJVFNZT1UjUE9SCkVTQyNTQ0FUI1VSQkFOQQpUSEVTRSMjQUNUU1VQT04KIyMjVEVOVVJFUyNSRU5UClNFU0FNRVMjUkVGRVJFRQpBTUVOI0JFRUZURUEjIyMKV0lOREJVUk4jI01VR0dTCkJSQVNJTCNBTEJBI1JBUApMQVQjR0FNQk9MI0JFVEEKQVRPTVMjQUxUSU1FVEVSCkRFUkVLI1JFU1RBUkVBUwpFU1NBWSNLUkFaWUdMVUU="},{"title":"Miner Problem, 5/17/02 (Friday)","author":"by Ogden Porter / Edited by Peter Gordon (puzzleeditor@nysun.com)","date":"2002-05-17","grid":"TEVBUERBWSNESUFNT05ECkFUSExFVEUjQUxMT1ZFUgpQTkVVTU9OT1VMVFJBTUkKU0FNU09OI1BCUyNHTE9QCiMjIyNORVRTIyNEVU8jIwpMQUdBU1NFI0NBUkVGVUwKQVRPTSMjTUFJTkUjRkxPCkNST1NDT1BJQ1NJTElDTwpLSUQjQUJPREUjI0lDRVQKU0FGQVJJUyNSRVNURVJTCiMjRU1UIyNQT1JUIyMjIwpPR0xFI0dQQSNFUlJBVEEKVk9MQ0FOT0NPTklPU0lTCklOQUhFQVAjSE9WTEFORQpERVNFUlRTI1NXRUVQRUE="},{"title":"Visibly Moved, 5/20/02 (Monday)","author":"by Harvey Estes / Edited by Peter Gordon (puzzleeditor@nysun.com)","date":"2002-05-20","grid":"QkFTSCNDVUJBTiNJTU9LCk1JS0UjT0ZBR0UjREFMSQpXUklOR1NPTkVTSEFORFMKI0VQU09NI0RFU0kjVElNCkZEUiNET1MjIyNNRUxFRQpUT09MI1NPTE9TI1JFU1QKRFVQRUQjTEFNQVJSIyMjCiNURUFSU09ORVNIQUlSIwojIyNLRVJORUwjT05UT1AKQkFCRSNPR0RFTiNUSFVSCkFMQVJNIyMjVEVDI0FHTwpUTEMjR1JBRCNXQVRDSCMKQkVBVFNPTkVTQlJFQVNUCk9HTEUjVE9NRUkjRU5JRApZRUxMI0NOT1RFI1NTVFM="},{"title":"Water, Water, Everywhere, 5/21/02 (Tuesday)","author":"by Brendan Emmett Quigley / Edited by Peter Gordon (puzzleeditor@nysun.com)","date":"2002-05-21","grid":"SEFTI0lPTklaRSNCUklFCkVMSyNUUk9QSUMjT0lOSwpTT0FLRURUT1RIRUJPTkUKT05USU1FIyNIT0xTVCMjClVTRUQjUk9QRSNTQUdFUwpUT1JTTyNWQVJZI0dVUlUKIyMjI1BFQVIjQVZFTkdFCiMjV0VUQkxBTktFVFMjIwpPREVTU0EjQlVTVCMjIyMKQ05CQyNZT0xLI1NIQUdTClRBUEFTI0ZFRVMjRUNSVQojI0FSS0lOIyNUQVJUQU4KU09HR1lCT1RUT01CT1lTCk9SRU8jRVRIQU5FI05FRQpCRVNUI1RFWE1FWCNFRFQ="},{"title":"Short Subjects, 5/22/02 (Wednesday)","author":"by David J. Kahn / Edited by Peter Gordon (puzzleeditor@nysun.com)","date":"2002-05-22","grid":"U0lOSyNCRVJSQSNFR0FECkFOT04jQVJDRUQjVFVUVQpNQURPTk5BQU5EQ0hJTEQKUFJJQ0VEIyNFTENJRCMjCkxPQ0tBI0pFV0VMQ0FTRQpFV0UjVEVBTVMjIyNOQU0KIyMjUkVESVAjV0hBQ0tTCiNTVElOR0xJS0VBQkVFIwpNT1JPU0UjUk9MTFMjIyMKQUxFIyMjTElDS1MjUFNUClNFQUxCRUFDSCNUQk9ORQojI0RFQUxUIyNUT0FNQU4KT05FTkFNRURTSU5HRVJTClBPUlQjRUxBVEUjRUxMRQpBTFNPI1JZREVSI0xPU1M="},{"title":"It Shines for All, 5/23/02 (Thursday)","author":"by Elizabeth C. Gorski / Edited by Peter Gordon (puzzleeditor@nysun.com)","date":"2002-05-23","grid":"QURBTSNUQUxFIyNTV0FNCkxBTUEjQVdPTCNCT0FUUwpBVE9NSUNBR0UjTFVLRVMKI1NLRU5UUkVBU1VSRVMjCiMjIyNDSUQjI0xJQ0lUIwpUSEVTQUxTT1JJU0VTIyMKQkVNVVNFI1JVVEgjTEFTClNMSVAjI0hBRyMjQkFSRQpQUFMjQUJFTCNJQ09OSUMKIyNTVVBFUkJPV0xTREFZCiNDQVJQUyMjUE9PIyMjIwojQVJBSVNJTklOVEhFUyMKSVJJTkEjUk9BREhPVVNFCkFURUlOI0FOVEUjT1JFTApOQVNBIyNTRUVSI0RPVFM="},{"title":"Weekend Warrior, 5/24/02 (Friday)","author":"by Manny Nosowsky / Edited by Peter Gordon (puzzleeditor@nysun.com)","date":"2002-05-24","grid":"TEFCVEVTVCNMT0dKQU1TCkFNUkFESU8jQU5OQUJFTApTUElORExFI1RTVU5BTUkKVE9UI1lBTktFRVMjVEVOCkxVVEgjU0FJTlQjUElOSwpBTExPVCNJVFQjU0FOVEUKUEVFUEhPTEUjV0FSR09ECiMjI1RFQVMjSEFUUyMjIwpMRURPRkYjRk9YSU5FU1MKSVFVSVQjSkxPI05JUEFUCk9VU1QjREVBTFQjUElUQQpOSVQjRVJTS0lORSNUSUwKSU5NQVRFUyNHT1RTT1JFClpPT0xPR1kjQVRUSU1FUwpFWFBFTlNFI05FQVJFU1Q="},{"title":"Grand Central Sta., 5/28/02 (Tuesday)","author":"by Myles Callum / Edited by Peter Gordon (puzzleeditor@nysun.com)","date":"2002-05-28","grid":"V0VCUyNHUk9TUyNJRE9MCkFDTFUjUlVQRUUjTklMRQpET1VCTEVTVEFOREFSRFMKRUxFVkFURVMjVEFTVEVTCiMjI0VWRSMjRVJJRSMjIwpTUElSQUxTVEFJUkNBU0UKUElOVFMjUE9TRVkjQUxQCkxURFMjQ09MVFMjVFJFRQpJQ0kjQ1JVRUwjR1JPUEUKVEhBSVJFU1RBVVJBTlRTCiMjI0NFREUjI1NBRCMjIwpTVFJJREUjT1BFTkVEVVAKVEhFQ09OU1RBTlRXSUZFCk9SQUwjWkFJUkUjQU1PUwpQVVJFI0FTU0VUI1JFU1Q="},{"title":"Out to Lunch, 5/29/02 (Wednesday)","author":"by Don West / Edited by Peter Gordon (puzzleeditor@nysun.com)","date":"2002-05-29","grid":"U0NBUiNCQU1CSSNTQVNTCkFPTkUjT1ZBTFMjRVJJRQpUT1RFI0xPQ0FMI1ZFR0EKIyMjRlJBTktTQUJFQU5TCkNSSVNQIyMjVEVSTiMjIwpSRUMjTUVOUyNSQVRJTkcKVVNFRCNDT01CI1NFREVSCk1BQ0FST05JQUNIRUVTRQpCTEFSRSNPTEVPI05BU0EKU0VQVEVUI0VETkEjTElUCiMjI0FWSVMjIyNZRVNFUwpCVVJHRVJBRlJJRVMjIyMKRVRPTiNBQlJBTSNTT0FQCkxBVkEjTkFBQ1AjQVJJQQpUSEVOI0FHTkVTI1lFTEw="},{"title":"Themeless Thursday, 5/30/02 (Thursday)","author":"by Holden Baker / Edited by Peter Gordon (puzzleeditor@nysun.com)","date":"2002-05-30","grid":"QVRSQSNBUFBMRSNBTU9LCkZFRVMjRE9ET1MjQ0FGRQpCQUNLVE9TUVVBUkVPTkUKI0JSQUlTRSNUVUlUSU9OCkFSRU5UIyMjIyNDQVNURQpQRUFDT0NLI0ZMSVRURUQKU0FURSNST01BSU5FIyMjCkVLRSNCT09NSU5HI1JDQQojIyNCQU5LSU5HI0NPT0wKU0VEQVRFUyNUT1BMRVNTCkNSRVRFIyMjIyNMRU5UTwpVTkNIQUlOI0lERUFURSMKQkVSTVVEQVRSSUFOR0xFCkFTRUEjRVJST1IjU0VMTApTVEVUI1NDRU5UI0VOT1M="},{"title":"Five in a Row, 5/31/02 (Friday)","author":"by Richard Silvestri / Edited by Peter Gordon (puzzleeditor@nysun.com)","date":"2002-05-31","grid":"T1RIRVIjVEFNRSNEUkFUCkZST01FI0VWRUwjQUlEQQpGSUxNTk9QQUxTI1BMT1QKU09NRU9ORSNURU1QRVJBCiMjIyNJVEVNIyNPTERFUgpIQVNCUk8jQUJPREUjIyMKSUNLWSMjU1RPUkUjR0lTCkNISUVGR0hJQkVMTElORQpLRU4jUkVFTFMjI0lCRVgKIyMjU0FMQUQjQlJFRVpZClNBVE9OIyNBTEVFIyMjIwpDTElOS0VSI0lOUEVBQ0UKQUxBTiNXT1JTVFVWVUxBCk1PUkUjQVRPWiNUSURFUwpTVEFUI05FV1QjRUxJT1Q="},{"title":"My Three Suns, 6/3/02 (Monday)","author":"by Fred Piscop / Edited by Peter Gordon (puzzleeditor@nysun.com)","date":"2002-06-03","grid":"Q1JBU1MjU05JVCMjTUlECkhBUlRFI0xFTkQjUEVTTwpFVklBTiNPV0xTI0hBTEUKV0VBUlMjV1lPI0NPUkVSCiMjI05FQSNPVkVSRUFUUwpTQUxFI0ZJUkVNQU4jIyMKQVJFQSNBUksjVU5JVEVEClRJRVIjUklORyNFWElMRQpBU0tFVyNTRUxGI0hBTU0KTkVTU0lFI1dFRSNPUkVPCiMjI1RSRVNTRVMjT0FSUwpCQVRURVJVUCNTQVAjIyMKRkxPT0QjUEFSI0lTTEFNCkxJRVUjUElQRSNTVEFHRQpBVklTI09ORVMjTEVWRVIKVEVOIyNQRVJUI0VSQVNF"},{"title":"Underground Music, 6/4/02 (Tuesday)","author":"by James P. Sharp / Edited by Peter Gordon (puzzleeditor@nysun.com)","date":"2002-06-04","grid":"SVJBTiNaQVBBVEEjTUlaCk1PTk8jRU5BTU9SI1VNQQpQRU5OU1RBVElPTiNVTVAKIyMjQUhBIyNTVEVBTVVQClRIRU1FI01UUyMjVFVORQpERU1FQU5PUiNFTlNVRUQKU0FNIyNJQ0VGTE9FIyMjCiNUQUtFVEhFQVRSQUlOIwojIyNIT1JBVElPIyNCSUMKUk9NQU5PI09STkFNRU5UCkVSSUsjI0xQUyNIQVRFUwpTRU1JUFJPIyNPQUsjIyMKRUdPI0hPV0FSREJFQUNICk5PUyNEVUVMRUQjVUxOQQpETkEjU1RSQVBTI1BFTlQ="},{"title":"That's the Ticket, 6/5/02 (Wednesday)","author":"by Alan Olschwang / Edited by Peter Gordon (puzzleeditor@nysun.com)","date":"2002-06-05","grid":"RUNITyNMT1BFUyNJU01TCkRSQVcjQUNSRVMjTkNBQQpOQVBFI1RISVJUWURBWVMKQVNII0dFUk0jI0FFUk8jCiNIQVRIU0VQVEVNQkVSIwojI1pPT1QjI0FTU1QjIyMKS0VBTlUjVEVYVCMjQUNICkFQUklMSlVORUFORFRIRQpUQUQjI09SRVMjT1VURVIKIyMjU0xBQiMjQ09BTCMjCiNTUEVFRE9GRkVOREVSIwojUVVBRCMjTEFNRSNCQUQKQlVSTUFTSEFWRSNOT1RJCkVBU0UjSEVST04jT1JTTwpFREVOI0VYRVJUI0dPT04="},{"title":"The Doctor Is In, 6/6/02 (Thursday)","author":"by Manny Nosowsky / Edited by Peter Gordon (puzzleeditor@nysun.com)","date":"2002-06-06","grid":"I0JFQUsjTUlOSSNCRUxBCiNBWExFI09ET1IjQU1FTgojQkFMTFJPT01BTkNJTkcKR1lNI1BBTCNFUVVBTFRPCk9CSVQjR0FTIyNCUklFUgpURU5BQ0UjTEFQI0RBTkEKVEFFQk8jUEFUQUtJIyMjCk9SUiNDQUxNT1dOI01QRwojIyNGQUNFVVAjT05BSVIKQ1VKTyNUQU4jU1RVQ0NPClVTRVJTIyNLQUkjTkFUTwpTQVJBTEVFI1JEQSNSVU0KUFJPR1JBTUlSRUNUT1IjCkVNTUUjUkVQTyNNSU5FIwpEWUVSI1NOT1cjRU5JRCM="},{"title":"Weekend Warrior, 6/7/02 (Friday)","author":"by Frank A. Longo / Edited by Peter Gordon (puzzleeditor@nysun.com)","date":"2002-06-07","grid":"RUFTRSNDRVJFQkVMTFVNCkFMTEEjSEVBVEVSSE9TRQpTTElUI0FMSUVOUkFDRVMKVEFNRVJTI1NSUyNTT01BCklSRU5FI0dJTiNCQVNFUwpOT00jTUFVTkFLRUEjIyMKRFVPUE9MWSNMRUFQVEFUCklOTE9WRSMjI0FOU0FSQQpBRERMSU5HI0lOVE9ORVMKIyMjT05FTElORVIjR0FNCkZMVU5HI1VORCNFUklDQQpMRU5BI01FVCNMRUFOT04KQUNUSVZFRFVUWSNURURTClRISVNJU1RSVUUjSVNFRQpURUxFUEhPTkVTI09TU0E="},{"title":"Religious Palindromes, 6/10/02 (Monday)","author":"by Norma Johnson / Edited by Peter Gordon (puzzleeditor@nysun.com)","date":"2002-06-10","grid":"Q0hBUiNBVE1TI0hBU1RFCkxFTk8jTE9PUCNPU0FLQQpVUk5TI0FGQVIjUElMT1QKTUFJU0FOVU5BU0lBTSMjClNMRUlHSCMjTkFOI0lCTQpZRFMjUkFXRUdHI0dOQVQKIyMjVEVMRVgjI05PRUxTCiNET0dFRVNFU0VFR09EIwpNSU5JUyMjQ0FNRU8jIyMKQkVFRiNDT1NNT1MjUFNUCkFETyNTSVIjI1RPTUFUTwojI1dFUEFOSUNJTkFQRVcKU0FOVEEjQVJMTyNNQVJFCkFIRUFEI1RPT04jRVlFUgpQQVJTRSNFTkRTI1RBT1M="},{"title":"Religious Anagrams, 6/11/02 (Tuesday)","author":"by Andrea Carla Michaels / Edited by Peter Gordon (puzzleeditor@nysun.com)","date":"2002-06-11","grid":"QUNFRCNBTkRPUiNBTFZBClJPVkUjRElBTkEjTEVFUgpDQkVSI09HUkVTI01BUlQKI0JSSVRORVlTUEVBUlMjCiMjI0RSSUxMIyNBTk5FIwpBTExFWVMjI09DVEEjIyMKRE9FUyMjUEVQU0lDT0xBClpPTyNTV09SRUlOI01PQgpFUElTQ09QQUwjI0JBTkUKIyMjVEFOUyMjQ0FSUkVMCiNTUEVEIyNTTU9SRSMjIwojUFJFU0JZVEVSSUFOUyMKU09JTCNST09UUyNUT0VTCk9PWkUjQURPUkUjSEVMUApTTEVEI0NBREVUI0VMTEE="},{"title":"Business Signs, 6/12/02 (Wednesday)","author":"by Todd McClary / Edited by Peter Gordon (puzzleeditor@nysun.com)","date":"2002-06-12","grid":"QkFOS1MjU0xPTU8jQU1QCklRVUlUI1RPV0lUI0pPRQpPVVRUT0xBVU5DSCNBTEUKU0FTI05JTCNTSEVBUkVSCiMjI1BJTEFGI0VMSyMjIwojQ0FMTEFHQUlOTEFERVIKQUxMT1kjI0NMRU8jUkFFCldPT0QjTElURVIjTE9SRApPTk8jVklOTyMjSEVMTE8KTEVGVE9GRklDRU9JTFkjCiMjI0VZRSNEVUxMUyMjIwpTWUxMQUJJI0ZPRSNGUk8KV09FI0dPTkVGSVNTSU9OCkFHRSNFQUdMRSNVSEFVTApZQUsjU1RBSUQjUEVUVFk="},{"title":"Themeless Thursday, 6/13/02 (Thursday)","author":"by Manny Nosowsky / Edited by Peter Gordon (puzzleeditor@nysun.com)","date":"2002-06-13","grid":"QUJSQU1TI0NIVVRaUEFICkxBVVJJRSNMT1RIQVJJTwpBRERJQ1QjQVRUQUdJUkwKI0hPU0VBI1NLRVcjTkFNCkpVTEUjTEFTRVIjQUNSRQpVTVAjV0lMRVkjU1RFTVMKRE9II0FNRVMjREVNTyMjCk9SR0FOSUMjR09FU0ZPUgojI0lCRVQjQkxPVCNUVkEKR0FVTFMjTkVVUk8jSEVNCkVNTFkjU09OR1MjVkVSQQpUT0kjR0FORyNURUFDSCMKTUVBQ1VMUEEjRVJOSUVTCkFCTk9STUFMI1BBTlRSWQpEQUlRVUlSSSNTVEFZRUQ="},{"title":"Just Following Orders, 6/14/02 (Friday)","author":"by Trip Payne / Edited by Peter Gordon (puzzleeditor@nysun.com)","date":"2002-06-14","grid":"SVdBU0lOI1BFUkkjTUFXCkRBUEhORSNTTE9UI1VTRQpJR1VBTkEjSUxTQSNTUEEKIyMjR0VUUyNFRUxTS0lOClRIRUdST0NFUllTVE9SRQpXQVhZIyNBTlkjI0FYRUQKT1JFI0VCQlMjVEFQIyMjCiNJU0FXQVNJR05USEFUIwojIyNCRUcjR0FURSNOSUwKQUxTTyMjQU5TIyNBVFJBClNBSURQRVRTVVBQTElFUwpDVVJFQUxMI1BJTEUjIyMKT0RFI05PQUgjVEFYTUFOClRFTiNBUFNFI0FURUFTRQpTUlMjTUVUUyNTT0lESUQ="},{"title":"Willie, Mickey and the Duke, 6/17/02 (Monday)","author":"by Fred Piscop / Edited by Peter Gordon (puzzleeditor@nysun.com)","date":"2002-06-17","grid":"QURPUFQjUEFEI1dJVENICkxJVFJFI0VSUiNBQ0VMQQpTRVRPTiNBTEkjUkVSQU4KI01PTlRIU09GU1BSSU5HCiMjI1RTRSMjVElMIyMjIwpSRU1PI0xTRCNCQUxCT0EKRVZBI0dMT0FUI05PVU5TCkxBWUVST0ZUSEVFQVJUSApJREFITyNURUVOUyNST0UKQ0VOU1VTI1NOTyNPT1BTCiMjIyNORVQjI0xFVCMjIwpNT1JFREVST0dBVE9SWSMKQUxJVkUjQVdFI0hPSFVNClNFREVSI0RFTiNFTEVDVApIT0VSUyNFU1QjTEVBS1M="},{"title":"Art of the State, 6/18/02 (Tuesday)","author":"by Richard Silvestri / Edited by Peter Gordon (puzzleeditor@nysun.com)","date":"2002-06-18","grid":"RVRBTCNDQVJUI0hBU1RPClZJTk8jT0JPRSNBTFRBUgpFTElPVE5FU1MjTklFQ0UKUkVTVE9OI1NMQUcjQU9MClRSRUVUT1AjQUxBUk0jIwojIyNEQVRFRCNBUklTVEEKQUJDI0xFU0lPTiNUSE9SCkNST1NTI1RBTSNNQUlORQpUQU5LI0tPTklDQSNQRUEKSU5ESUFOI0FUQVJJIyMjCiMjSU5HT1QjU1BJTk5FUgpNT00jQVRPTSNUQUNPTUEKSU5FUFQjUk9CSU5IT09ECk1ZTkFII1NMQVYjRVNUQQpFWFRSQSNPTERFI0RFRVI="},{"title":"What's the Yews?, 6/19/02 (Wednesday)","author":"by Trip Payne / Edited by Peter Gordon (puzzleeditor@nysun.com)","date":"2002-06-19","grid":"QlVTI0FNQkxFUyNBVE1TCkFTSCNQQVJPTEUjR0FJTApOT09TRUNPTkZFUkVOQ0UKQUZSTyNSVEUjI0VHR0VECkxBVElGQUgjQ0FEUkUjIwojIyNMRU0jR0FEI09SQUwKRUVHI1JFRk9STUpVSUNFClNQQVNNI0FOTiNBUE5FQQpQRVRUSU5HWkVVUyNFU1AKTkVFUiNORU8jU09EIyMjCiMjSEVMRU4jTUVOT1RUSQpBUk9TRSMjRkVSI0pPQU4KU0VVU1NGT1JESVZPUkNFCkVBU0UjT1JFSURBI01PUApBUkVTI0JSRUFTVCNFU1Q="},{"title":"The Crying Game, 6/20/02 (Thursday)","author":"by Randolph Ross / Edited by Peter Gordon (puzzleeditor@nysun.com)","date":"2002-06-20","grid":"TU9ERSNTTklQUyNFRUxTCkFSQUwjSU5UUk8jU1BBVApLSUxMRVJXQUlMI1BJU0EKRU5URVJTI0xBVkEjU0NJClBPUk5PI0hPTUVHUk9BTgpBQ0UjSUNJIyNET09ETEUKUk9ZI0NBUkFUIyNMRUFECiMjI0hBVkVBQkFXTCMjIwpBQ0xVIyNSQUlNSSNMQVkKTk9VR0FUIyNMT04jT05FCk5JR0hUSE9XTCNORVdUUwpBTkcjTUlDSCNET1RURUQKQkFBUyNSSElORVdISU5FCkVHR08jU0VUSU4jRUROQQpMRUVTI1RSRUFUI1JFQVI="},{"title":"Weekend Warrior, 6/21/02 (Friday)","author":"by Manny Nosowsky / Edited by Peter Gordon (puzzleeditor@nysun.com)","date":"2002-06-21","grid":"QUJCRVNTI1dJTERPQVRTClNMT1NIWSNBTkFJU05JTgpDVVJTRUQjU1FVRUVHRUUKUkVOQUwjU1RVRFMjRVNFCklGRlkjU0FSSVMjU0xVUgpCVVIjT1RURVIjV0FTUFMKRU5FU0NPI0xFR0FMIyMjClNLRVBUSUMjU09EQVBPUAojIyNSRUNBUCNGRURPUkEKQUZMQVQjVEVYQVMjVElTClBSQVkjUkFSRVIjVEFHUwpMT1QjSEVMUFMjU0FUSUUKT0xJVkVPWUwjQUxNT05ECk1JTklNSVpFI1RZUEVBQgpCQ09NUExFWCNNRUFTTFk="},{"title":"Revolver, 6/24/02 (Monday)","author":"by Randall J. Hartman / Edited by Peter Gordon (puzzleeditor@nysun.com)","date":"2002-06-24","grid":"Q0hBTVAjU0hPVCNTTU9HCk1FTEVFI1RBTEUjVFVORQpWSVRBTCNFTkRTI0lURU0KI1JPTExJTkdTVE9ORVMjCiMjIyNNTk8jI1RBRyMjIwpKSUxURUQjQUJVVCNQVEEKRU1BSUwjU05PQiNFUk9TCldISVJMSU5HREVSVklTSApFSVJFI05JTEUjSEVOQ0UKTFBTI09UVE8jQU9SVEFTCiMjI0FXRSMjT0REIyMjIwojU1BJTk5JTkdKRU5OWSMKUE9PTCNET09SI1NFT1VMCkVMTEUjRVRSRSNJRE9MUwpXRUVEI0RBTVMjQVNLRUQ="},{"title":"Fauna of Tennessee, 6/25/02 (Tuesday)","author":"by Harvey Estes / Edited by Peter Gordon (puzzleeditor@nysun.com)","date":"2002-06-25","grid":"REFORyNUQUNJVCNFU1RBCkFWSUQjRVJBVE8jQVdSWQpUT0dBI01BVEVZI1JFRUsKQUNIWSNCUk9NI0NMRUFSCkJBVCNLTEFOI0pVU1RTTwpBRE8jTk9UQUJJVCNCT1kKU09GVEVSI0hBTSNSSU5ECkVTVEVFI01PTklUT1IjIwojI0hBU0ZJVFMjUkFET04KRkVFTCNBTlQjRVVST1BFCkVMSSNDVVRJQ0xFI0ZFVwpFR0dTT04jTk9FUyNZUlMKRFJVSUQjQVJFQSNNT0VUCkJFQVIjVEhPUk4jTVVURQpBQ05FI0FNT0NPI0VUVEEKR09BRCNSRUZFUiNTSEFN"},{"title":"Chip Mates, 6/26/02 (Wednesday)","author":"by Jay Sullivan / Edited by Peter Gordon (puzzleeditor@nysun.com)","date":"2002-06-26","grid":"U1RFTSNEQUZUI0NPREFTClBJQ0EjQUJMRSNMVUlHSQpPRE9SI1NIRVMjQVNTRVQKVEFMS0NIT1dIT1NUUyMjClNMSVRIRVIjI1VQU0VUUwojIyNXQVIjRkFUUyNOQkEKT1NDQVIjTE9BRCNPVElTCkhPTElEQVlDSE9QUEVSUwpHTEVOI0dOVVMjUkVERFkKT1ZBI1dJTlMjR0VOIyMjCkRFUkFJTCMjQk9ZSE9PRAojI0NIRUVSTk9OU0VOU0UKQ1JVRUwjQUlERSNBQ0hFCk9DVEFEI0ZMRVgjUlVFRApXQVNQUyNURVNUI1RFQVM="},{"title":"Themeless Thursday, 6/27/02 (Thursday)","author":"by Todd McClary / Edited by Peter Gordon (puzzleeditor@nysun.com)","date":"2002-06-27","grid":"QVNTSVNUUyNTSEFNQkxFClJBVFJBQ0UjUElHSVJPTgpUSEVBVEVSRElTVFJJQ1QKREFSI1NMSUNLI1NFR0FSCkVSSU4jTEFDRVMjREFUQQpDQUxFQiNMQUxBVyNERU4KT05FQUxTI0JFVEFURVNUCiMjI1RBT1MjVElWTyMjIwpTSU1PTklaRSNORVBBTEkKVFZBI0NMRUZUI0RBUklOCktBVFojU0NSRVcjWklOQwpJTkxFVCNIRU5JRSNaRUUKVEhFU0hPV01VU1RHT09OClRPU1RBREEjVEVUQU5VUwpTRVNTSU9OI0FEVUxBVEU="},{"title":"Little Apples, 6/28/02 (Friday)","author":"by Ogden Porter / Edited by Peter Gordon (puzzleeditor@nysun.com)","date":"2002-06-28","grid":"UEVESUdSRUUjU1RJRkYjCklNSU5MT1ZFI0hPUkRFIwpQSUNLQUNBUkRBTkFSRCMKU1RFSU4jIyNPU1UjIyMjCiMjI0VDVSNJTlRSSUdVRQpDTE9TRVIjTkVBVE5FU1MKSElOVCNESUFHI0lTTEVTCklWUyNGVU5OQVJTI0ROQQpSRVBFTCNGQUxBI0pPRVkKUFJFUEFSRVMjQ1JBRlRTClNZQ0FNT1JFI1lFTiMjIwojIyMjSU5OIyMjQklHT1QKI0pPSE5OT01FTEFURUxZCiNJTklHTyNJU09UT05FUgojQk9TT1gjQUxURVJFR08="},{"title":"Common-Place Animals, 7/1/02 (Monday)","author":"by Don West / Edited by Peter Gordon (puzzleeditor@nysun.com)","date":"2002-07-01","grid":"QUZSTyNBVFJJQSNWRU5UClNMQVYjQ0hBVFMjT0xFTwpQQU5FI1JBTkNII1lBUk4KI0JJUkRJTlRIRUhBTkQjCiMjI1dFRCMjI05BRyMjIwpBUlJPVyNSVU0jREVHQVMKU1VFUiNCSVRFUyNVUlNBClNOQUtFSU5USEVHUkFTUwpFU1QjUk9TRVRUQSNESVMKU0FUSUUjRVJBI1JPVUdFClNUQU5DRSMjI1NUUkFORAojI0NBVElOVEhFSEFUIyMKTEFIUiNHT1JFTiNDSVRFCkJMRVUjSEFVTFMjTE9BTgpKRVNUI1RIRU1FI0VOSUQ="},{"title":"Ain't That Sweet?, 7/2/02 (Tuesday)","author":"by Isabella Annenberg / Edited by Peter Gordon (puzzleeditor@nysun.com)","date":"2002-07-02","grid":"TUlTVCMjQkFMRCNFQlJPCklTQUFDI0FSRUEjRUxBTgpET0xMQVJTVE9ET05VVFMKQUxBQ1JJVFkjRFJZRVIjCklEQSNJQ0UjQVlFI0pBVwpSRU0jQkFSVFMjU1BBQ0UKIyMjUE9SI1JJTyNFWUVECiMjU1RVRE1VRkZJTlMjIwpJT1RBI09BVCNGVEQjIyMKQkxFU1MjQ0hFV1MjUlNUCk1EViNPREUjREVBI0FQRQojUkVFU0UjUElHTEFUSU4KVE9TU09ORVNDT09LSUVTCkFTQVAjVEVTVCNUSVRMRQpTRVhZI1NFVFMjI05FU1M="},{"title":"Say Cheese!, 7/3/02 (Wednesday)","author":"by Peter Abide / Edited by Peter Gordon (puzzleeditor@nysun.com)","date":"2002-07-03","grid":"QkVOWiNTV0FCI1NDQUxQCkFMVE8jUEFORSNIVU1PUgpISUhPI0FDVFYjT1BJTkUKIyMjTUlDS0VZUk9PTkVZCk1TVCNDRU8jI0FGTCMjIwpNT1NURUwjUElHTEFUSU4KTUlHSFRZQ0FTRVkjQUxFCkJSQVkjI0FSUCMjRFhMVgpPRVIjSkVSUllHQVJDSUEKUEVQUkFMTFkjUk9UVU5ECiMjI0FDSyMjQ0FOI1RJQQpPRk1JQ0VBTkRNRU4jIyMKS0VBTlUjVEVSTSNFQkFZClJBS0VTI0FIT1kjWEVOQQpBUk9TRSNESU1TI1RFTks="},{"title":"Weekend Warrior, 7/5/02 (Friday)","author":"by Manny Nosowsky / Edited by Peter Gordon (puzzleeditor@nysun.com)","date":"2002-07-05","grid":"UkVGVVNFSEVBUCNTQU5HCkFWQU5UR0FSREUjSURPTApNRURJVU1TSVpFI0RPUkEKUFNTVCNPQUsjS0lMTEVECiMjI1JVTlQjQ0FQRUVTSApBREpVU1QjTE9CUyNTUEEKUEVFTEUjQ09DT0EjQ09OClBBVEUjV0FDS08jTUVORApFUlMjUElOS1kjTUFOU0UKQVJFI0FOVEUjVkVTVEVEClJFVFJJRVMjT0lMUyMjIwpUQVRFUlMjQVhFI0VMU0UKT0RJTiNBQ0NFTlRVQVRFCkJFTlQjUE9MWU5FU0lBTgpFUkdTI1NRVUVBS0VEQlk="},{"title":"So Long, Folks, 7/8/02 (Monday)","author":"by Elizabeth C. Gorski / Edited by Peter Gordon (puzzleeditor@nysun.com)","date":"2002-07-08","grid":"QkxVVE8jQVNBUCNBTERBCklPTklBI01BUkUjU0FBQgpHTElOVCNUTUVOI0lOUkUKSElUVEhFUk9BREpBQ0sjClVUQSMjQUFBIyNJTkVSVApHQVNNQVNLI1BBTSNJT1UKIyMjRURUI1pFTiNFVE9OCkFSUklWRURFUkNJUk9NQQpERUVSI05ORSNJUlIjIyMKQU5EI1JEQSNSRUFTT05TCk1FUkNJIyNJQU4jI01JVAojR09PRE5JR0hUSVJFTkUKSkFWQSNPRE9SI1BVUkVFCk9ERVMjU0VSQSNPTlRBUApCRVJUI0hBU0gjU0VBTVM="},{"title":"Twinkle, Twinkle, 7/9/02 (Tuesday)","author":"by David J. Kahn / Edited by Peter Gordon (puzzleeditor@nysun.com)","date":"2002-07-09","grid":"U0FUI01BTFRBI1NHQVRFClVSSSNVTklPTiNMT0NIUwpQT0QjU1RJTkdMSU5FVVAKRU1CRURTIyNST1RFIyMjClJBSUQjI1BBWVMjI01FUgpTU1RVRERFRCNFTFRPUk8KIyMjQ09PRVIjI09PT0xBClNTUEFOR0xFREJBTk5FUgpUSUVUTyMjTkVFREkjIyMKTEFHRVJTI0FMTFNHQU1FCkVNUyMjSURMRSMjSE1PUwojIyNBVFJBIyNTRVRPVVQKV0lMTElFU0dFTEwjVVNBCkFETUVOI0RFVklMI05FVApMT05FUyNTRUVEUyNUUkU="},{"title":"Wednesday in the Park, 7/10/02 (Wednesday)","author":"by Norma Johnson / Edited by Peter Gordon (puzzleeditor@nysun.com)","date":"2002-07-10","grid":"SU5OUyNPU0hFQSNNQU1FCkxFQUgjQVRPTEwjQUxBUwpLT0JFQlJZQU5UI0NPTEEKQU5TRUwjWFhJI1BBVFRJCiMjI05VUyMjTkVBUiMjIwojRFJBRlRQUk9TUEVDVCMKQk9BI0ZSRUUjUEFOT1VUCkFSVFMjQUlMRVkjQUJCQQpESVNPV04jSVJJUyNSQUcKI0NPTUVEWUNFTlRSQUwjCiMjI0VMU0EjI0dPTyMjIwpHUk9XTCNNQkEjVVRURVIKTk9BSCNBQUFCQVRURVJZCkFMRkEjU0hFRVIjRVJJRQpURVNUI0hBUlRFI0RJTlM="},{"title":"Themeless Thursday, 7/11/02 (Thursday)","author":"by Randolph Ross / Edited by Peter Gordon (puzzleeditor@nysun.com)","date":"2002-07-11","grid":"UE9QVVBNRU5VI1NPRkFSCklST05TSURFUyNQUkFURQpSRUNFU1NJVkUjQUFST04KQUdPIyNTVEVSI0lOQU5FClRBTlMjTU9STklOR0RFVwpJTk9VVCNSSUFMI1NBUkEKQ09TQlkjI05NRVgjWVNMCiMjI1NQVVRURVJFRCMjIwpDT0QjRVJJRSMjUkFESU8KQVBFRCNJTk5TI1NNRUxMClNVUEVSU0VERVMjRUxMRQpBTExBWSNURUFMIyNJQk0KQkVBUkQjRURXQVJEVklJCkFOTklFI1NUQUdFU0VUUwpTVEVFUiNUT1lTVE9SRVM="},{"title":"All Keyed Up, 7/12/02 (Friday)","author":"by Brendan Emmett Quigley / Edited by Peter Gordon (puzzleeditor@nysun.com)","date":"2002-07-12","grid":"QVBQTEVUI1RZQkEjVExBClNBTElWQSNFRUVFI0xJTApTTE9WQUsjU0FBUiNFQkIKIyMjSURFQUxTI0VOVFJFClBBU0RFQ0hBVCNHQUhBTgpBR08jUkVTIyNCT05FIyMKUkVDRVNTI0ROQSMjTUlUCktPT0wjVEFST1QjSE9SQQpFTE1PI0FQQVJUI0FUT00KRERFIyNHRVQjTEFUSU5BCiMjSE9ORSMjUEVJI09JTApDSEVSSSNDTEVBUkFOQ0UKSEFSREcjQUxBUk1TIyMjCk9ERSNIWVBPI1JBVEVERwpXVE8jVE9SWSNFRElUT1IKU09GI1NCSUQjREFOQ0VS"},{"title":"Following Directions, 7/15/02 (Monday)","author":"by Patrick Merrell / Edited by Peter Gordon (puzzleeditor@nysun.com)","date":"2002-07-15","grid":"VFdPQU0jU1dPUkQjRVBBCk9IQVJBI0xBREVOI0FSTQpOT1JUSERBS09UQSNTT0IKIyMjI0xJQkVSQUwjVFNFCkJBV0xFRCNOI0dBVEhFUgpGUkVFUiNERUIjQlJBIyMKTEVTVCNNT0RFTCNJTUFNCkFOVElXQVIjU1RFRVBMRQpUQUNUI1RJUkVEI1NUT1cKIyNISVAjQ09UI0JPT05FClNURUFMUyNTI1BFTk5FRApZRVMjQU5ORVRURSMjIyMKUkFUI1NPVVRIQUZSSUNBClVTRSNNVUxUSSNVSEFVTApQRVIjQVRMQVMjUE9ORFM="},{"title":"\"Eat Your Veggies!\", 7/16/02 (Tuesday)","author":"by Patrick Berry / Edited by Peter Gordon (puzzleeditor@nysun.com)","date":"2002-07-16","grid":"TUVUI1BSRUFNUCNEVVNUCkFMQSNIRVJOSUEjVVBUTwpKRUxMWUJFQU5TI0NIQVIKT0dMRVMjI0dFRSNLRUxQClJBSU4jQ0FSUk9UQ0FLRQpJTlNPRkFSQVMjUkFWRUQKTlRII0FEQU0jVE9MRURPCiMjI0JVUkIjQk9JTCMjIwpGSU5BTEUjWUFOSyNTVFAKQVZBTlQjTUFSWUFTVE9SCkNBTkRZQ09STlMjSEVSRQpBTk5BI0FERCMjR1VFU1QKRE9JTiNQVU1QS0lOUElFCkVWRU4jRUxBVEVTI0xPTgpTT1NBI1RFTkFOVCNFTkQ="},{"title":"Hyperinflation, 7/17/02 (Wednesday)","author":"by Stella Daily and Bruce Venzke / Edited by Peter Gordon (puzzleeditor@nysun.com)","date":"2002-07-17","grid":"QVBPUCNQU0FUI0VSUkVECkNBS0UjRUFTRSNNT09FRApNQVJDSE9GU0FXQlVDS1MKRVJBU1VSRSMjSE9HIyMjCiMjIyNMSVNQI0VMRUNUUwpBREFZTEFURUFORCNJT1UKTkFWRSMjI1BVQ0UjQ09OCkdSSVBFUlMjS0VOTkVMUwpFVEEjVkVJTCMjI1RSRUUKTEVUI0FDTk9URVNIT1JUCk9ERVNTQSNUSUxMIyMjIwojIyNPSUwjI0VZRVRFU1QKVFdPRE9MTEFSU1dPUlRICkFBUk9OI0FMRUUjQUdFRQpQUk9NUyNDRURFI0RPV04="},{"title":"They're All Yours, 7/18/02 (Thursday)","author":"by Cathy Millhauser / Edited by Peter Gordon (puzzleeditor@nysun.com)","date":"2002-07-18","grid":"V0laI1JJQiMjQkVHR0FSCkFORU1PTkUjVEVBUk9TRQpTVFJBTkdFI0lOVkFMSUQKSE9PU0lFUkZSSUVORCMjClVOSU9OIyNMRU4jSVNMRQpQRU5OI0VEVSMjQVRUSUMKIyMjU0FWSU9SQlJFQVRICkFNUyNDSVRST0VOI1JFTwpTVVRVUkVTRUxWRVMjIyMKS0xJTkUjI1NMWSNDQVRTClNFVEgjRVRDIyNMQVRIRQojI0NPTExJRVJNT1RIRVIKQkFIUkFJTiNBSVJIT0xFCkVZRVNIT1QjRlJFRU1BTgpERVNFUlQjI1RFTiNFV0U="},{"title":"Weekend Warrior, 7/19/02 (Friday)","author":"by Martin Ashwood-Smith / Edited by Peter Gordon (puzzleeditor@nysun.com)","date":"2002-07-19","grid":"Sk9VU1RFUlMjUkFZR1VOCkFQUExFUElFI1VOU1VSRQpCQURJTkFHRSNCRUxBSVIKU0xPRVMjIyNXT1cjQ0FECiMjI1JFUCNTQU4jUkFIUwpJUlMjQ0lURVIjU0FNIyMKQklURU9ORVNIRUFET0ZGCklDQU5OT1RURUxMQUxJRQpTT1VORFRIRVJFVFJFQVQKIyNOVVMjRVRPTlMjU1RFCkxPQ0kjRFJTI0FIQSMjIwpBQ0gjSElTIyMjQURPQkUKUkVFRkVSI1BFRUtFREFUCkdBU0JBRyNPTlJFUE9SVApFTlRJUkUjUEVBUlRSRUU="},{"title":"Recycled Cycle, 7/22/02 (Monday)","author":"by Donald L. Blocher / Edited by Peter Gordon (puzzleeditor@nysun.com)","date":"2002-07-22","grid":"QUxNUyNMRUVSUyNBQ0VEClJFRUwjQVRFVVAjTkFWRQpDT0xPUldIRUVMI0tURUwKIyMjUEFMRSNESVNBQkxFCkhBTCNWRVJBI1RPUkkjIwpPUkFURVMjUkhVQkFSQlMKT01OSSNTVFJJUEUjRFJVCkZBREVTI1dFRCNSSVNFUgpJREkjQUJBU0VTI05FQVIKVEFOR0lFU1QjTUVOQUNFCiMjR1VMTCNTTkFQI1RIWQpESUdFU1RTI0lTSVMjIyMKVUtFUyNXQVRDSENIQUlOCk1FQVQjQUdSRUUjT05DRQpQQVJTI1lFQVJTI0RZRUQ="},{"title":"Trick or Treet, 7/23/02 (Tuesday)","author":"by Harvey Estes / Edited by Peter Gordon (puzzleeditor@nysun.com)","date":"2002-07-23","grid":"VkFMSUQjV0VCQiNIQVNICkFCT0RFI0FWRVIjQUxUTwpURVNMQSNUQVRFI1NIT1IKI0JFRVRHRU5FUkFUSU9OClNFVCNIRVJTIyNMQVJHRQpUQUkjU0VXI0dBQiNURUQKRU1NRSMjSEVBRFVQIyMjCk1FRVRUSEVSTU9NRVRFUgojIyNDT0hFUkUjI0lBR08KVVBTI05ITCNXT0sjS0dCClNMRUVUIyNTQVJBI0VXRQpGRUVUT0ZTVFJFTkdUSCMKTEFTSCNBUEVEI1NBSElCCkFTVE8jTkFWRSNBR0FURQpHRU9TI0dNRU4jU0FURUQ="},{"title":"Disappearing Act, 7/24/02 (Wednesday)","author":"by Elizabeth C. Gorski / Edited by Peter Gordon (puzzleeditor@nysun.com)","date":"2002-07-24","grid":"R0lCQlMjSU5OUyNGTEFHCkFTVE9OI1pPT00jTE9ESQpQTFVUTyNPTlRPI0FWRVIKIyMjSE9XRE9ZT1VURUxMClNPTkFUQSNTRUNUI0xFUwpNTUUjU0NJI1RIRVNFIyMKRUFWRSNLT1MjI1JPVEgjCldIRU5ZT1VSVU5PVVRPRgojQVJORSMjQUdBI1BFUlUKIyNHRUFSUyNIT0cjUk5TCk1JSSNURUFMI01JU1NFUwpJTlZJU0lCTEVJTksjIyMKQUNFRCNDTEFNI0tJTE9TCk1BVUwjSEVNSSNHTElERQpJU1BZI0xTQVQjT0xERU4="},{"title":"Themeless Thursday, 7/25/02 (Thursday)","author":"by Kevin Hagen / Edited by Peter Gordon (puzzleeditor@nysun.com)","date":"2002-07-25","grid":"QUxDQVRSQVojQVNUVVRFClJJT0JSQVZPI0xFQU5FRApNRVJDVVRJTyNCQUtJTkcKU1VOI0VUQSNESU5FVFRFCiMjI1BSRVRFRU4jU0VTUwpQSVRBI0RPTEVPVVQjIyMKSVJPTldPUktTI1RPU0NBCk5BVElPTiMjI1JFQ0tPTgpLTk9DSyNNSU5JU0tJUlQKIyMjQVNDRVRJQyNJTkVaClNDQVQjTEFUQ0hPTiMjIwpURVNUQkFOI0VNVCNCSUcKQUxUQVJTI0ZPT1RTT1JFCk5JRUNFUyNJTk5FUkVBUgpEQVJLTFkjTkVEUk9SRU0="},{"title":"String Sextet, 7/26/02 (Friday)","author":"by David J. Kahn / Edited by Peter Gordon (puzzleeditor@nysun.com)","date":"2002-07-26","grid":"WE1BUyNNR00jVEVOTkVSClhNRU4jQUxJI0lOVFVORQpWRVJBI1JVVEhTQ0hSSVMKI0NPUEFDRVRJQyMjU1NFCkNVQiNCT1JTQ0hUQkVMVApBUklTRSMjIyMjSElERSMKUklDS1NDSFJPREVSIyMjCkRFU0kjU09BUFkjVEhSVQojIyNGTElHSFRTQ0hPT0wKI0tPRkkjIyMjI09TTUFOCkZJUlNUU1RSSUtFI0JTQQpBTUEjI0lST05FRE9VVCMKQ09OU09OQU5UUyNCUkVXCkVOR0lORSNERUUjT0dSRQpUT1NTRVMjT1JZI0VTU0U="},{"title":"Bob & Carol & Ted & Alice, 7/29/02 (Monday)","author":"by Ogden Porter / Edited by Peter Gordon (puzzleeditor@nysun.com)","date":"2002-07-29","grid":"U0xPVCNBU1RSTyNQRVRFCkxJUkEjU1RPT1AjT1ZBTApJTUFYI1BBUlNFI0JJTEsKUE9MSVRJQ0lBTkRPTEUjCiMjIyNJUksjI1NBWCMjIwojQVNPTkUjU1RFTSNWRUUKQUNUUkVTU0NIQU5OSU5HCkxFT0kjI0FIQSMjT1JFTwpTTFVHR0VSV0lMTElBTVMKT0FUI0FBQUEjRUFSTFkjCiMjI0FWRyMjT0VSIyMjIwojTk9WRUxJU1RXQUxLRVIKRkFERSNFVklUQSNBTFRPCkVWRVIjVEFURVIjWkVBTApaRVNUI1NORVJEI1lFTEw="},{"title":"The Puns of Summer, 7/30/02 (Tuesday)","author":"by Stella Daily and Bruce Venzke / Edited by Peter Gordon (puzzleeditor@nysun.com)","date":"2002-07-30","grid":"I01FU0EjUEFUSCNESUVUClRBWEVEI09HUkUjSU5DQQpBUkVBUyNTSE9SVFNUT1AKTU9NIyNESUFUUklCRSMjClBPUEZMSUVTIyNUQVJPVApBTlRMRVJTI1RIT1JFQVUKIyMjQUdFI0NJQSMjU1RFCiNUT1BPRlRIRU5JTlRIIwpTT1YjI1VSSSNHTUEjIyMKUFJFU0FMRSNCRUFTVExZCkZFUkFMIyNGQVJNVEVBTQojI0FCRVRURVJTIyNBQkMKRlVMTENPVU5UI0NBUFJBCklTTEUjT05DRSNPQk9FUwpCQVNTI0xFRVIjQkVUQSM="},{"title":"Verbal Exercise, 7/31/02 (Wednesday)","author":"by Todd McClary / Edited by Peter Gordon (puzzleeditor@nysun.com)","date":"2002-07-31","grid":"Q0FSQlMjUEFTVEUjQ0JTCk9IQVJBI1VUVEVSI0FMSQpWQU5JVFlQUkVTUyNKQVgKRVNURUVNI0FSVCNCVU5UCiMjIyMjQ0FQTkNSVU5DSApOQVRVUkFMIyNBSFMjIyMKQ1JBWkUjQkFTU0kjTEdBCk9GRklDRUVYVEVOU0lPTgpTU1QjQURFTEUjT09aRUQKIyMjTVBHIyNFQ1NUQVNZCkNIRUVTRUNVUkwjIyMjIwpTSU5HI1dPTiNBUEFDSEUKUFRBI0RJRERMWVNRVUFUCkFNQyNVU0VVUCNTVVRSQQpORVQjSEVYRVMjVEFTS1M="},{"title":"Shorthand, 8/01/02 (Thursday)","author":"by John Greenman / Edited by Peter Gordon (puzzleeditor@nysun.com)","date":"2002-08-01","grid":"UEZGVCNFTE1TI0RQTFVTClJJTEUjUk9PVCNBUk9NQQpFTEFMI0VDUlUjUkVHQUwKU0xZTFlDVU5OSU5HIyMjClNFU1RFVFMjI0JJT1BJQwojIyNBTEwjQkFJVCNVU0EKUkVBTExZQ09MRCNCUkFEClVSR0UjI1VTRSMjTEVBUgpUV0FTI1BST1NFUElFQ0UKSElQI0FMRVgjUEFOIyMjClNORUVaRSMjREFXRExFUwojIyNCQURMWVJVTkRPV04KQ0FST0wjU09JTCNBVklBCkFMT05FI0FHRUUjVEVOSwpMSUJZQSNUQVJUI0VER0U="},{"title":"Weekend Warrior, 8/2/02 (Friday)","author":"by Patrick Berry / Edited by Peter Gordon (puzzleeditor@nysun.com)","date":"2002-08-02","grid":"QkFDS1JFU1QjU1RBUlRTCkVUSElPUElBI1BJTkVSWQpUV0lOQk9STiNBRUdFQU4KSEFOREVESU4jQ1JFTk5BClVURSNTRUNFREUjUkFTUApORVNTIyNBUklTRSNDT1MKRVJFQ1RTI1lPVUdPVE1FCiMjI0FSQUIjTklHSCMjIwpDT05OT1RFUyNUT01NSVgKVU5PI05JVFRJIyNTSVJFClRFTlQjUkFVTkNII05PUgpMQVpVTEkjUEFMT01JTk8KQVJFTkFTI09QRVJBQk9YClNUUklDVCNSRUFTU1VSRQpTSE9DS1MjU1RSRVNTRUQ="},{"title":"We'll Take Manhattan, 8/05/02 (Monday)","author":"by Todd McClary / Edited by Peter Gordon (puzzleeditor@nysun.com)","date":"2002-08-05","grid":"Q09NTUEjU0xFRCNBRkVXCk9DQ1VSI1RPR08jUklERQpXSElTS0VZQ09DS1RBSUwKU09JTCNORU8jVEFTVEVECiMjI0lOQyMjU09CIyMjIwpBVE9NQk9NQlBST0pFQ1QKRFJVI0FERUVSI0JFTExFCkhJVFMjRU5ERUQjQlJBTgpPQVRFUyNURUFSUyNPU1MKQ0xBTUNIT1dERVJUWVBFCiMjIyNBSVIjI1dPTyMjIwpPTkNBTEwjU0NJI1lFTFAKV09PRFlBTExFTk1PVklFCkVNTUEjUkVBTCNTVElORwpERUVNI1lBTVMjR0FMRVM="},{"title":"High Fashion, 8/06/02 (Tuesday)","author":"by James Rogers / Edited by Peter Gordon (puzzleeditor@nysun.com)","date":"2002-08-06","grid":"VUJPQVRTI1NHVFMjQU5BClBMQUNFRCNBUlJBTkdFUwpCSUtJTkkjVEFJTENPQVQKT05FTkQjU0VQVCNPTlRPCldJTkdUSVBTSE9FI1lPTgojIyMjT0RFIyNOWUMjIyMKT0FUUyNPTEUjI1JPVUdFClBST1BFTExFUkJFQU5JRQpURU5BTSMjTE9VI1hJTkcKIyMjU0lTIyNNUkkjIyMjCk1BRyNSVU5XQVlNT0RFTApDUk9DI0dJQU4jU0hVTEEKSkVUQkxBQ0sjU1VCTUlUCk9OQVNQUkVFI0lST0JPVApCQVQjU1NSUyNQRVlPVEU="},{"title":"Branches of Study, 8/07/02 (Wednesday)","author":"by James P. Sharp / Edited by Peter Gordon (puzzleeditor@nysun.com)","date":"2002-08-07","grid":"Q0FTSCNPUEVEI1NUQUZGCkFTVEEjUFVSRSNIT1NFRApTSFVMI0VMSVMjT1NURVIKUE9QTEFSU0NJRU5DRSMjCkFSSSNOQUUjI0JFQVJEUwpSRURIT1QjUlVCIyNPT0gKIyMjQVJJU0VTI1dSSVRFCiNTVU1BQ0NVTUxBVURFIwpNSU5TSyNPU0NBUlMjIyMKRU5TIyNBV0UjSVNIVEFSCkdFVFNVUCMjSURBI0FURQojI0FMREVSQU5EV0lTRVIKUkFCSUQjT1NMTyNPU1NPClRJTERFI1RIQVcjTkVUUwpFTUVFUiNTRVdOI0VMU0U="},{"title":"Themeless Thursday, 8/08/02 (Thursday)","author":"by Patrick Berry / Edited by Peter Gordon (puzzleeditor@nysun.com)","date":"2002-08-08","grid":"UkVEUklCQk9OI1NUVU5TCkFRVUFWRUxWQSNBRVNPUApNVVNLRVRFRVIjTEFUVEUKUEFURVMjQVJDVFVSSUFOClNMSUQjUFRCT0FUI05CQwpVVEUjVklTSVRTI0RPTEUKUE9SVElBI0RJU0NPVkVSCiMjI0VPTlMjQ0VMTCMjIwpTS0lTTE9QRSNMQVRWSUEKV0VEUyNCQUdNRU4jSU5OCkFZRSNXQVJHT0QjU1RBRwpQTEFDQVJERUQjSkFSUkUKUElUT04jRURJVE9SSUFMCkVNRU5EI0NPTkVTVE9HQQpERVNLUyNLTkVFSE9MRVM="},{"title":"Out of the Ordinal-y, 8/09/02 (Friday)","author":"by Ogden Porter / Edited by Peter Gordon (puzzleeditor@nysun.com)","date":"2002-08-09","grid":"TU9NI0ZSRU9VU0UjREVOCkFOQSNBRVJPU09MI09ERQpJQ1UjQ0xFTU9OUyNVU0UKRFVWRVQjU1BGI0VNQkVEClNFRU0jRVRIQU4jSUxMUwojI0RJTVMjIyNBUFNFIyMKU0tFTEVUT05FQ0xPU0VUClBJQyNNQVJTQUxBI0dBUgpJTkFXRSNFVFMjQ1JBVEUKUkVEQU5UUyNUSEVPTUVOCkVSRVNUVSMjI0FCU0VOVAojIyNTT0ZURUJMT1cjIyMKWkVUQSNUQVJPVCNFVENIClpXRUkjRVZBREUjTE9ORQpaRUFMI0RFVEVSI0xZTlg="},{"title":"Following Suit, 8/12/02 (Monday)","author":"by Diane Epperson / Edited by Peter Gordon (puzzleeditor@nysun.com)","date":"2002-08-12","grid":"VEFQQVMjTEFJQyNBQkVTCklCQVJTI09SQ0EjTkFUTwpUUklUVCNORUVUI0FTT0YKTEFERSNQRUEjSEVMRU5BCkVNQlJPSUwjQ0FST0IjIwojI0FJTEVZI09SSUdBTUkKTEFDRUQjSE9VU0UjTEVHCllVS1MjREVOTklTI0xFSQpJREkjR0lBTlRTI0VEVFYKTklOI0VSUk9SI0FOSVNFCkdPU1NFVFQjWUVOVEEjIwojI1BBU1RTI0NMQUlNRUQKV0hBTEVSI0NMSSNDT01PCkFJREEjQUNMVSNGRU5DRQpGTEVEI0NSQUIjT1JERVIKVE9TUyNLT1BTI0VTU0VT"},{"title":"Three in a Row, 8/13/02 (Tuesday)","author":"by Randall J. Hartman / Edited by Peter Gordon (puzzleeditor@nysun.com)","date":"2002-08-13","grid":"SEFCSVQjQ0FSRCNXQURFCkVST0RFI0FMQUkjRUJBWQpSSU9UUyNSSU1TI1BFVEUKUkFCQVRCQVRCQVRUTEVTCiMjI0dFTyMjT1JFIyMjIwpTQUcjRFJBQiNNQVJTSEEKRVJJRSNPU0xPI1NFTk9SCk5FQVRFTlRFTlRFTk9SUwpTQU5UQSNJTkNBI1RPRE8KRVNUQVRFI0RFTlQjUEVOCiMjIyNFUlIjI1lBSyMjIwpST01BTk1BTk1BTkFHRVMKU01PRyNJREVBI0dSSVBFClZBTkUjTkFJTCNMRU5JTgpQUk9EI0VSTEUjRU5BQ1Q="},{"title":"Travel Wear, 8/14/02 (Wednesday)","author":"by Patrick Berry / Edited by Peter Gordon (puzzleeditor@nysun.com)","date":"2002-08-14","grid":"U1dBTSNDQUJBTFMjRElECklJSUkjQVJBUkFUI1JPRQpERVJOI0dFTkVWQUdPV04KRU5EVE9FTkQjI1JFUEFZCkJFUk1VREFTSE9SVFMjIwojUllBTiNTQUlMI1pFVVMKIyMjUkNBI1dFRUQjQUdFClJJU0tFRCMjI0FSRVRIQQpBUlQjU09ORyNOQVkjIyMKSkVBTiNMRUlTI01FU1MjCiMjTk9SRk9MS0pBQ0tFVApJTkRJQSMjTEVFU0hPUkUKQ0FQUklQQU5UUyNBS0lOCkVWQSNERUpFQ1QjUklGRQpTRVQjU1dBVEhTI1RFU1Q="},{"title":"Feeding an Army, 8/15/02 (Thursday)","author":"by Todd McClary / Edited by Peter Gordon (puzzleeditor@nysun.com)","date":"2002-08-15","grid":"QkFSQiNTQUFOQSNTUEVECkJMVUUjUElDT04jTk9SQQpTQU5EV0lDSEVTI0FUT1oKIyMjVElOU0VMI1NQQURFCk1PRElORSMjU1dFQVRFRApBSEVNI1NBUCNPTlRPIyMKUkFWRVMjUkhJTk8jQ0hBCkFSSVNFI0ZBQSNSQUhBTApTQUwjRVBTT00jQVNJREUKIyNFTU1BI01CQSNTUEFSClRJRElFU1QjI0JFQVNUUwpPTkVORCNSQVJFTFkjIyMKUkFHVSNXQVRFUk1FTE9OCklOR0UjRU5URVIjUk9MRQpDRVNUI1NFQUxBI1NURVc="},{"title":"Weekend Warrior, 8/16/02 (Friday)","author":"by David J. Kahn / Edited by Peter Gordon (puzzleeditor@nysun.com)","date":"2002-08-16","grid":"Q1VSRUQjRERTREVHUkVFCk9QRVJBI0FVVE9MT0FOUwpVVFVSTiNERUFOU0xJU1QKUk9ORVRURVMjS0lERElFClNQSURFUiMjVkVFI0VMTApFQVQjI0FCQkVZI0JSRUwKRFJFU1NDT0FUI1JVU1NFCiMjI1BVVFNUT0JFRCMjIwpBRlRFUiNTSEVFUERPR1MKU1RPVyNGRUVEUyMjUEVJClRIRSNESVMjI1RBTEVOVApSRVNQSU4jTUFTU0VORVQKSU5IT05PUk9GI1NBQlJFCkRST1BBTElORSNBU0FJUgpFWUVTSEFET1cjTUVSQ1M="},{"title":"Hair Apparent, 8/19/02 (Monday)","author":"by Nancy Kavanaugh / Edited by Peter Gordon (puzzleeditor@nysun.com)","date":"2002-08-19","grid":"RUdHUyNHQVpFIyNEVUNUCk1BTEkjQVJFQSNEQUZPRQpQTEFOI0xFU1QjT1pPTkUKTE9OR0RJU1RBTkNFIyMjCk9SREVBTCNTVEVUI1RBTQpZRVMjU0VBIyNIT0FSU0UKIyMjU0hPUlRDSVJDVUlUClNIT08jI0NIQSMjTUVTUwpDVVJMWVNIVUZGTEUjIyMKQUxDT1ZFIyNFT0UjQVJBCkJBQSNFQVJTI0dOQVdFUgojIyNTVFJBSUdIVEZBQ0UKU1FVQVQjWkVSTyNMSU9OClBVUkdFI0VWRVIjQVRSQQpBT05FIyNTRVdOI1RTS1M="},{"title":"Musical Echoes, 8/20/02 (Tuesday)","author":"by Ogden Porter / Edited by Peter Gordon (puzzleeditor@nysun.com)","date":"2002-08-20","grid":"VEhFVEEjVEFUQSNDSEFSCklCQVJTI0FSQUIjSEVSRQpNT1JJU1NFVFRFI0FJUlMKIyMjQllFQllFQklSRElFCkFDRSNSRU8jI0VORElWRQpTVUNLSU4jR01BTiNGQUQKS1JPTkEjR1JJTSNBTExTCiMjTk9OT05BTkVUVEUjIwpTUE9UI05BWkkjQVJJU0UKQVJNI1BFVEUjVFJBU0hZCkxBWVNVUCMjT1JCI1NIRQpUSUNLVElDS0JPT00jIyMKSVJBRSNFVVJPRE9MTEFSCkVJUkUjQ0xVRSNTTE9QRQpSRVNUI0VMS1MjSEVYRUQ="},{"title":"A Wise Thought, 8/21/02 (Wednesday)","author":"by Holden Baker / Edited by Peter Gordon (puzzleeditor@nysun.com)","date":"2002-08-21","grid":"QlJPVEgjRUxBTCNJT1RBClJPTUVPI0xFTkEjWE1FTgpJTkFMTCNNQVRTI05BTkEKRUFSTFlUT1JJU0VBTkQjCiMjI1NESSMjI09YWSMjIwpQSEQjQU5UI1BFQSNTUEEKRUFSTFlUT0JFRE1BS0VTCkRSRUkjI1RPRSMjTE9OSQpBTUFMRUhFQUxUSFlBTkQKTFNEI01VTSNTRUEjTFlFCiMjI1NJUiMjI0VSQSMjIwojV0VBTFRIWUFORERFQUQKUEVSVSNMT1VUI0hPTExZCkVSSUMjRVVSTyNBQkFURQpHRU5FI0RSSVAjVEVOT1I="},{"title":"Themeless Thursday, 8/22/02 (Thursday)","author":"by Myles Callum / Edited by Peter Gordon (puzzleeditor@nysun.com)","date":"2002-08-22","grid":"Qk9PUkFETEVZI1JFTElUCkVORE9DUklORSNPTUFOSQpURUVTSElSVFMjQUJZU00KSEFSRSNGQVNUI01BUklFCiMjI1dFVFMjRVZFUkVTVApEQURPRVMjQlJFUiNBVEUKVU5JT04jRkFERVMjREVTCkZPTkQjU0FHQVMjQ0VOVApGVU4jQUxMRVkjRkFSQ0UKRUtFI0NVTEwjSE9SU0VECkxBUkRFUlMjQk9PUiMjIwpCSURFVCNIT1JOI0FOQUcKQU1BTkEjT05JT05ET01FCkdFVElUI1JPQlJFSU5FUgpTRUVNRSNUUkVFSE9VU0U="},{"title":"No Pain, No Gain, 8/23/02 (Friday)","author":"by Harvey Estes / Edited by Peter Gordon (puzzleeditor@nysun.com)","date":"2002-08-23","grid":"Q1JJQiNLRU1QI09GQUdFClJFRE8jRUxJQSNDUklFUgpJTlRPI1lFTEwjVEFTVEUKU1RBS0lOR0RFVEFJTFMjClBBR0VCT1kjI09HTEUjIwojIyNORVQjT0hOTyNTQVQKSEFORFRFRFNJR04jRVVSClVGT1MjI0lMTCMjUEFSRQpCUkEjQ0FQSVRBTFNUQVgKU09DI0FTU04jQk9BIyMjCiMjQ09ORSMjR1JJTExFUwojQk9STkFDSFJJU1RJQU4KTUFVREUjSFVFRCNFTFNFCklOTkVSI09MRUcjUkFZRQpSRVRSWSNQQU5FI1NDQVI="},{"title":"\"Tennis, Anyone?\", 8/26/02 (Monday)","author":"by Alan Olschwang / Edited by Peter Gordon (puzzleeditor@nysun.com)","date":"2002-08-26","grid":"U0xBVkUjTVVURUQjQkFBClRJTEVTI0lOQVdFI0VMTApBVE9ORSNOSUdFUiNUSUUKTUVOVSNET1RTI0FMVEVSClBSRVNTVVJFI1NJTEVOVAojIyNXQUQjRElMTEVSIyMKUkVGSU5FI1NSTyNZTUNBCkVWSUxTI1NUT1cjVEVMTApCRUxMI0xFQU4jSE9ORVMKQU5USSNPQVQjQ0FOVE9PCiMjUkFCQkxFI0FTSCMjIwpBTEFNT1MjU0VSUEVOVFMKUEFUU1kjQk9YWSNXT1JFClNSSSNJTkFQVCNTSU9VWApFR08jU0FORVIjSVRTTUUKU09OI0hZRU5BI1NURVBT"},{"title":"Scand Do, 8/27/02 (Tuesday)","author":"by Ogden Porter / Edited by Peter Gordon (puzzleeditor@nysun.com)","date":"2002-08-27","grid":"I09QRVJBSEFUUyNSQVpFCiNOT0RFUE9TSVQjT05ZWAojU1dFRElTSE1BU1NBR0UKIyMjUkVORUUjVEFZTE9SClNFQUxFR1MjU0VMI09UVApIQVJFTSMjVklMTEFHRVMKRVJHIyNQQVNTSU9OIyMjCiNOT1JXRUdJQU5XT09EIwojIyNGSU5BR0xFIyNMRUUKQkFDS1NQSU4jI0NMQVNQCk9WQSNIVU4jQk9MSVZJQQpSSVRaRVMjTE9DQUwjIyMKREFOSVNIUEFTVFJJRVMjCkVUQVQjRVJJQ0FLQU5FIwpSRVBTI1JFRE9MRU5DRSM="},{"title":"Pseudo-Physical, 8/28/02 (Wednesday)","author":"by Bill Weber / Edited by Peter Gordon (puzzleeditor@nysun.com)","date":"2002-08-28","grid":"U0NIV0EjQkFUUyNBTEVDCkFMT09GI0FDSEUjTElMSQpIRUFSVFlCUkVBS0ZBU1QKTE9SRCNWRUVTI0FSUkFZCiMjI1BSRVMjQUNORSMjIwpTVFlMRVMjU1VNI0RBTEUKQ0hFQVQjQVRSSUEjVklBCkFSTVlSRUNSVUlUTUVOVApMRUUjWUFURVMjTEFSR0UKREVOUyNTSVAjUEFSU09OCiMjI0xJRVYjUElTQSMjIwpTT05JQyNBU0hFI1RSQVAKSEVBRFlBVE1PU1BIRVJFCkVJTkUjTEVPTiNMT05FUgpBTEFTI0VER1kjT05FQU0="},{"title":"A Thing of the Pasta, 8/29/02 (Thursday)","author":"by James S. Kaplan / Edited by Peter Gordon (puzzleeditor@nysun.com)","date":"2002-08-29","grid":"Tk9SQSNBUkVBI1NDQU1TCkVWSUwjUk9CUyNMVUNDSQpNRVRTI0NMQVAjQURVTFQKT1JaT1RIRVlTQVkjUklPCiMjIyNIRVgjI0RFVEFJTgpXT05ERVIjRklFUk8jIyMKSUNFUlMjRElBTCNQSElMClRIUkVFUEVOTkVPUEVSQQpTT0RBI0FMRVMjWkVST1MKIyMjTU9TRVMjU0lSRU5TClNBVFlSUyMjREVDIyMjIwpVWkkjTkVXWU9SS1pJVEkKUlVCTEUjT09aRSNFVkVSCkZSSUFSI0VERU4jVEFYSQpTRUFNWSNTQU5FI0FOVFM="},{"title":"Weekend Warrior, 8/30/02 (Friday)","author":"by Manny Nosowsky / Edited by Peter Gordon (puzzleeditor@nysun.com)","date":"2002-08-30","grid":"Q0FUTklQUyNPTlRPUE9GCkFDUk9CQVQjQUlSRFVDVApTVEFNSU5BI0ZMRUVDRUQKSVNMI0RFVEFJTFMjS0FJCk5PQU0jU1VEU1kjSklOWApHVUxBRyNBQUgjUk9TSU4KU1RBWVNEUlkjVEhFSEFKCiMjI0JVT1kjQk9PQiMjIwpOQU1FSVQjQlVORExFVVAKQkxBU1QjQ09NI0FPUlRBCkFUTk8jU0VOU0UjV09FUwpHT0QjUEFMRVJNTyNUTlQKQVNBUlVMRSNVUFJBSVNFCk1BVFVSRVIjU1RFTkNJTApFWEVORU1ZI0hZTU5BTFM="},{"title":"Believe Me, Not the Map, 9/03/02 (Tuesday)","author":"by Harvey Estes / Edited by Peter Gordon (puzzleeditor@nysun.com)","date":"2002-09-03","grid":"SVJBUyNBU1BTI01BUlNICk5PVEUjRFVBTCNBUkVXRQpKT0hORE9OTkUjQVRTRUEKRUtFI0VCQiNFTE0jVEFEClNJTiNMRUFOVE8jQkFSQgpURVNUIyNUT1lTI1VSU0EKIyMjUklHSFQjRURHRUlOCk5PTUFOSVNBTklTTEFORApFTkFDVFMjQklUVEUjIyMKQUNSRSNNQUlMIyNTVEFHClJFSUQjT1RURVJTI0VSUgpFT04jU1NUI0JFQSNYQ0kKQVZBSUwjSVNMRU9GTUFOClNFVFRPI0xPVUQjTEVORApUUkVBVCNBV0VTI0FYRVM="},{"title":"Saturday Night Special, 9/04/02 (Wednesday)","author":"by Jim Page / Edited by Peter Gordon (puzzleeditor@nysun.com)","date":"2002-09-04","grid":"SVRFTSNCQUhTI0RBS0FSCkRBVkUjQVFVQSNFUklDQQpPWEVOI1JVQlMjQkVUVFkKTElOREFSSUNITUFOIyMjCiMjIyNUSU5BI0VSQVNFUgpMSVNBTE9PUE5FUiNVTUEKT05FUyMjI1NBU0UjTklNCk9OVEhFREwjQkVEQlVHUwpLQVQjWUVBUiMjI0lOUkUKVVRFI0VMV09PREJMVUVTClBFUklTSCNDUklCIyMjIwojIyNDSElDT0VTQ1VFTEEKTk9LSUEjQUNMVSNGVUVMCklWSUVEI0xPU1MjT1JFTwpQQURSRSNJU0VFI1NPUlQ="},{"title":"Themeless Thursday, 9/05/02 (Thursday)","author":"by William I. Johnston / Edited by Peter Gordon (puzzleeditor@nysun.com)","date":"2002-09-05","grid":"TUlNRSNBUEVNRU4jQkJCCkFOT04jU0VOSUxFI1JVRQpNVUxUSVBST0NFU1NJTkcKQlJPV04jT0tSQSNBVFRBCkFOVElOQVRJT05BTElTVAojI09ORUwjIyNPUFVTIyMKWEFWRVJJQU5CUk9USEVSCkVTQyMjI1lPVSMjI1NOTwpTSE9QUElOR0JBR0xBRFkKIyNDQVBOIyMjRE9JVCMjCk1BS0VTQUdSRUFUR0lGVApFU1RBI0NPSUwjVEhST0UKU1RBTkRBUkRJWkFUSU9OCkFSSSNPU01PU0UjRVNURApTT0wjU1RFRkFOI1JURVM="},{"title":"Sandwich Bread, 9/06/02 (Friday)","author":"by Alan Arbesfeld / Edited by Peter Gordon (puzzleeditor@nysun.com)","date":"2002-09-06","grid":"Qk9TQ1MjRFJBQiNTQ0FCCkVBVEFUI09PTkEjUE9TWQpHUkFQRVNPREFTI0lOVEwKIyNDT1BFRCMjU0VOVFJBCkFSQyNTVEFORElOQVJPVwpSRUFQIyNESUQjR0xBU1MKTUFUVVJFI1RBVEkjIyMjCiNNT05FVEFSWVVOSVRTIwojIyMjVkVOSSNURUNITk8KTUFDQU8jS0ZDIyNZRUFICk9NQVJLSEFZWUFNI0FHTwpQRU5ORVkjI0JSRVNUIyMKUExJRSNBS1JPTkFFUk9TCkVJTlMjVElFUiNUUklPUwpURUVTI1RBTkcjWUFDSFQ="},{"title":"\"Sorry, What's That Name Again?\", 9/9/02 (Monday)","author":"by Allan E. Parrish / Edited by Peter Gordon (puzzleeditor@nysun.com)","date":"2002-09-09","grid":"U0NBTVAjUk9XUyNBSkFSClRPTkFMI0FDSEUjRElSRQpBUkdVRSNORUlMI09NRU4KTUFSSUFIQ0FSRVkjQ0FUClBMWSNTT09OI1NPREEjIwojIyNDQVJSSUUjTUVSR0UKQVNDRU5EI0FTUCNBUkFMClBMQU5URVIjQ1lDTEVSUwpFQVJTI1NBTSNUSEVZUkUKU1BZT04jRklTSEVSIyMjCiMjR1JFRyNTVE9XI0RSUwpBUFIjQ0FSUllOQVRJT04KUkVBUCNSRUVMI0JSQVZPCkNBTkUjQkVBVSNMSU5FUgpIVFRQI09ERFMjRVhFUlQ="},{"title":"Team Players, 9/10/02 (Tuesday)","author":"by Stella Daily and Bruce Venzke / Edited by Peter Gordon (puzzleeditor@nysun.com)","date":"2002-09-10","grid":"U09DS1MjQkVBVFMjQk9ZClRST09QI0VUSElDI0FXRQpMQU5DRSNIT01FUiNETkEKIyNUSEVMT05FUkFOR0VSCkhPSSNERUwjIyNXRUVEUwpZQU5LRUVET09ETEUjIyMKRFJVSUQjI0RBRFMjTUVUClJFRUQjR0VFS1MjSEVBUgpPREQjRE9MTCMjT1VUUkUKIyMjQ0lWSUxMSUJFUlRZCkVMU0FTIyMjSVRPI09IUwpKRVRQUk9QVUxTSU9OIyMKRU1VI09QQVJUI1NNT1RFCkNPTiNCRUlHRSNUSU1FUgpUTlQjRU5ERUQjU1RFRVI="},{"title":"A Meaty Question, 9/11/02 (Wednesday)","author":"by Will Knorr / Edited by Peter Gordon (puzzleeditor@nysun.com)","date":"2002-09-11","grid":"Rk9BTSNTUEFSI1NQUkFZCkFDTUUjTklMRSNUQVVQRQpSRUVMI1VOSVQjQVJJRVMKQ0FOVkVHRVRBUklBTlMjCkVORElOR1MjTFVSSyMjIwojIyNOSUwjUklHI0VUQVMKT0ZGI0dFTk9BI01FUklUCkFMQVJNI0VBVCNFVFVERQpLT1JFQSNXUkVTVCNFU1AKU1BFQyNBU1MjVFJBIyMjCiMjI0xPQUYjRlJJU0JFRQojQU5JTUFMQ1JBQ0tFUlMKQUxPTkUjQUxPVSNGQU5TClNFVkVOI1NJTlMjT0RJRQpIRUFSUyNIT1RTI1JZRVM="},{"title":"Tone Control, 9/12/02 (Thursday)","author":"by Diane Epperson / Edited by Peter Gordon (puzzleeditor@nysun.com)","date":"2002-09-12","grid":"QU1BI0FEU1BBQ0UjQ0xJClZBVCNUUkVBU09OI0xPTgpPSUwjUlVOTklOR0ZPVVQKVVRBI0FJRCMjU0VDVVJFCkNBUlQjRFVMTCNMQURFTgpISUdIQyNQSUVSI1JFRVMKI1NFRVlBI0JBSVQjRERFCiMjI05TQ0lFTkNFUyMjIwpBTkQjVEhPUiNPTlRBUCMKTEVFSiNFV0FOI1RBUlJZCkxJQkVMI0FMRVMjQkVBVQpTVEVXRUQjI1dBUiNBTFAKVEhFU0VSSU1BR0UjUklQCkFFUiNSQVJFR0FTI1VOSQpSUlMjU1RBTEVTVCNHRUU="},{"title":"Weekend Warrior, 9/13/02 (Friday)","author":"by Frank A. Longo / Edited by Peter Gordon (puzzleeditor@nysun.com)","date":"2002-09-13","grid":"RVlFVEVTVCMjU0hBS0VOClBBVEVSTk8jI0JZSk9WRQpQTEFTTUFUViNBR0FURVMKU0VUU0FHT0FMI0lST05TCiMjIyMjIyNSQVZFIyMjIwpHSU9UVE9ESUJPTkRPTkUKQU5USUVEVUNBVElPTkFMClNUT09ET05PTkVTSEVBRApDUk9TU1JFU0lTVEFOQ0UKQU9MIyMjU0VNSSMjQVBSClBTRVVETyMjQU5HU1QjIwojIyNSRURFQUwjQUNJRFMKQlVTSU5FU1NTQ0hPT0xTCkFSSUVUVEFTI0RBUk5JVApZRUxMU09VVCNDTk4jIyM="},{"title":"Automotive Duds, 9/16/02 (Monday)","author":"by Patrick Berry / Edited by Peter Gordon (puzzleeditor@nysun.com)","date":"2002-09-16","grid":"RU1NQSNJVEVNI1NDQU5TClJPRUcjQ09EQSNQWUxPTgpBTERBI0VSSU4jT1BFUkEKI0RJU1RSSUJVVE9SQ0FQCiMjVVNBIyNMQUlORSMjIwpUSU1JTkdCRUxUI1NQRVcKUk9XI0dPRVMjTUFTSEVSCk9ORSNMT0cjRElEI0lSQQpNSUxMRUQjVklDRSNMSVAKUEFMRSNCUkFLRVNIT0VTCiMjI0FHQUlOIyNUSVMjIwpDT05WRVJUSUJMRVRPUCMKQVRFSU4jVUxOQSNTUE9UClNUT05FI0FMQU4jVUhPSApUT05HUyNMQUlEI1BZTEU="},{"title":"Comedy Lineups, 9/17/02 (Tuesday)","author":"by Trip Payne / Edited by Peter Gordon (puzzleeditor@nysun.com)","date":"2002-09-17","grid":"QVdJTkcjV0lTUCNMSVNBClNBTllPI0FWRVIjT1JFUwpTQ1JVQlNIQVpFTFRBWEkKVE9FI0xFT04jTU9TRVlTCiMjI0dJTk8jUklDTyMjIwpGUklFTkRTTUFTSEZJU0gKUkVTT0QjI09ORVMjQ1BBCkVUQUwjQ0VOVFMjTk9JUgpFUkEjRk9SSyMjR0VOUkUKUk9DV0lOR1NCTE9TU09NCiMjI0lOTlMjUklPVCMjIwpTQ09OQ0UjREVBRiNFUEEKQ09BQ0hDSEVFUlNBTUVOCkFDUkUjVE9MRCNVVFVSTgpCT1NTI1NFRVMjUEVTVFM="},{"title":"New York State of Mind, 9/18/02 (Wednesday)","author":"by Randall J. Hartman / Edited by Peter Gordon (puzzleeditor@nysun.com)","date":"2002-09-18","grid":"U1VNVVAjQVJDTyNPR0xFCkFUT05FI0hPT0YjUFJPTQpNQU5JQSNTVVJGI0lBR08KI0hPVENST1NTQlVOTlkjCiMjI1NIRSNURUFTRUQjIwpBRFMjRU5EI1RTRSNTU1QKTElLRVNPTlkjRURJVE9SCklWQU4jI0FFUiMjQ0FORQpDQVRTVVAjVE9QR1VOTlkKRU5FI1BPSSNXT0UjRFlTCiMjQkxPVENII09ORSMjIwojRk9VTlRBSU5QRU5OWSMKU09BUiNBUkxPI1NURUVMCkxPUkUjR1VMTCNJUkFURQpPTERTI0VTU08jU1lSSUE="},{"title":"Themeless Thursday, 9/19/02 (Thursday)","author":"by David J. Kahn / Edited by Peter Gordon (puzzleeditor@nysun.com)","date":"2002-09-19","grid":"QVNJVFdFUkUjSFVTS0VEClZBTkhBTEVOI0VNUElSRQpPTk5PVElDRSNSQUlMQVQKSURJI1RFQU1NQVNDT1RTCkRZRUQjI0xZRSNTRU0jIwojIyNDQVJMT0FEI1NFUkIKTUlTQ1VFI0ZSRUUjVEFMCllPVVZFR09UQUZSSUVORApOVU4jTElUSCNPSUxSSUcKQVNLUyNTVEVOR0VMIyMjCiMjRk9CI0VTTyMjU1RFVwpUSEVGT1VSVE9QUyNBUkkKV09OVE9OI0FTTE9OR0FTCkFTQ0VOVCNURUFIT1VTRQpTVEVSRU8jRVNUT1BQRUQ="},{"title":"What's the Point?, 9/20/02 (Friday)","author":"by Sherry O. Blackard / Edited by Peter Gordon (puzzleeditor@nysun.com)","date":"2002-09-20","grid":"RkFMSyNBR0FTUCNTVU1VCkVMQU4jVE9NRUkjQU5BVApET1NFI0xFQVJOI1ZJVE8KVVRIRUdBUkRFTlBBVEgjCiMjI1BVU1MjI0lPTiMjIwpVU1RBUlQjU0FORFRSQVAKSElORFUjU09OR1MjVU5JCk9OVVMjVUFOREQjUExPUApMQVQjQVNTQVkjQ1JFVEUKRElTQVNURVIjQ0xPU0VECiMjI01JQSMjVE9FRCMjIwojQlJJTkdUSEVIT1VTRUQKR09BRCNJUkVORSNDQVJCCk9PUFMjTkVXRVIjRUxNTwpEUEFUI0dFU1RFI1NUQVk="},{"title":"Walkie-Talkie Words, 9/23/02 (Monday)","author":"by Ogden Porter / Edited by Peter Gordon (puzzleeditor@nysun.com)","date":"2002-09-23","grid":"VFJBQ1RPUiNQT1NUV0FSClJFU1BJUkUjT05MRUFWRQpJVEhBQ0FOI0tFWUVESU4KT1JFI1ROT1RFUyNORVNUClNPTlRBRyNJREVBUyMjIwojIyNPQ0VBTiNDUllQVFMKQUxUTyNNSUtFI1RXT0FNCkJVUlQjRUxZU0UjRUxMQQpPTlVTI05FV1RTI0VLRVMKTUFDWVMjRElFTSNOQVNICkJSRVdFRCNORUVEUyMjIwojIyNPWkFSSyNSQVlPTlMKT1JFTyNOQVlTQVkjWklQCldFU1RFR0cjQUxUT09OQQpMRVRTU0VFI0FET1JORVIKU0xBWUVSUyNCQU5HRVJT"},{"title":"A Four-Square Puzzle, 9/24/02 (Tuesday)","author":"by Richard Silvestri / Edited by Peter Gordon (puzzleeditor@nysun.com)","date":"2002-09-24","grid":"U0dUUyNBR0VEI0ZJUlNUClBFUk0jVU5ETyNBUkVOQQpVTklPTlNVSVQjU0VFSU4KUkVCT09UI1RFU1QjTFBTCiNTRVRURVIjI1BFSSMjIwojIyNIRVJBTERBTkdFTFMKQ1BVI0xFVklFUyNPQklUCkhBWkVMI0lDUyNFUkFTRQpFUElDI1NOSVBFRCNZQU0KV0FTSElOR1RPTkRDIyMjCiMjI09OTyMjVEFJTE9SIwpCQVIjVFdJRyNNRUFOSUUKQURPQkUjVElNRVNTSUdOCkpBUEFOI0VWSUwjU09ITwpBTUVORCNNRVRTI0FOVFM="},{"title":"Rockers, 9/25/02 (Wednesday)","author":"by David J. Kahn / Edited by Peter Gordon (puzzleeditor@nysun.com)","date":"2002-09-25","grid":"QkFUQ0gjV0FTUCNBTEdBCkFUUklBI0FOVEUjUEVSVApERUFOSkFHR0VSI05BSUwKR0FWRSNST0UjI0hFRERBCkVTRSNBTk5SSUNIQVJEUwpSRUxBWCMjI0RBSCNPTEUKIyMjUkVTQUxFUyNJTEVTCiNST0xMSU5HU1RPTkVTIwpTSUxPI05FQVRFTlMjIyMKRVREI0JBWSMjI0VUSElDCk5BVEFMSUVXT09EI0VTTApPRElTVCMjRUFSI0hBSEEKUk9NUCNBTkRSRVdBVFRTCkFWRUMjU0FHRSNBUkVBUwpTRVJBI1NQRUQjR0VSUlk="},{"title":"Equal Terms, 9/26/02 (Thursday)","author":"by Patrick Berry / Edited by Peter Gordon (puzzleeditor@nysun.com)","date":"2002-09-26","grid":"QUJDUyNNU0RPUyNKT0JTClRST1kjQVRPTkUjT1hFTgpIT1JOQkxPV0VSI0hJSE8KTElORU1BTiNTUEVOREVSCkVMTSNPQkVZI0lOSkVTVApURUUjQ0FERSNDT0FTVFMKRVJBUyNSRVNUT0NLIyMjCiNTTEFCI0FNQSNIRVNTIwojIyNQUkVGQUJTI1NBWVMKRklUU0lOI0FMRUMjT1JFCkFNT1VOVCNNRUNII1BJRQpTSE9DS0VEI1NFQUxBTlQKVEVOSyNCUkVBRERPVUdICkVSSUUjQkVMTEUjRkxFRQpERUVSI0VESVRTI1RPU1M="},{"title":"Weekend Warrior, 9/27/02 (Friday)","author":"by Myles Callum / Edited by Peter Gordon (puzzleeditor@nysun.com)","date":"2002-09-27","grid":"RFJTRVVTUyNIR1dFTExTCkVBVENST1cjQVJBTUFJQwpTVE9PTElFI0dFVElOVE8KS0xNI1NMRURHRVMjREVUClRJUFMjU1RJTFQjRElSVApPTkVVUCNFTkUjU0lOQUkKUEVEQUxJTkcjQkVBR0xFCiMjI1ZPTFMjRk9JTCMjIwpUVlNFVFMjSkFaWkVEVVAKUkVFTFMjVFVYI0VDT05PCkFSVFkjU0lHTUEjVElDUwpDU1QjQ09OU09MRSNET1MKVEFMTE9ORSNERVBSQVZFCk9DRUFOSUEjRVhQSVJFUwpSRURTVEFSI01JU1RFUlM="},{"title":"Don't Fail Me, 9/30/02 (Monday)","author":"by Harvey Estes / Edited by Peter Gordon (puzzleeditor@nysun.com)","date":"2002-09-30","grid":"V0VSRVdPTEYjQ0xBTVVQCkFWRU1BUklBI0NBU0lOTwpTRU5USU5FTCNTSVRTSU4KUFJPI1ZBVUxUI1RFU1RZCiMjI1NFVCNERUkjUlRFIwpFTkRVUkUjT0xESVNIIyMKTU9SRVMjRFdFTFQjRVJSCkFUT1ojSklOWEVTI01BTwpJTVAjQ0FOT0VEI1NBTkcKTEVUI09XRU5TI01FUkdFCiMjSE9ORVNUI0xPQ0tFVAojUEVOI0RPSCNFRFQjIyMKREVCVUcjTkVSVkUjRVBBCkVSQVNFUyNKT0VMR1JFWQpTSUxFTlQjT05FVE9PTkUKSUxMU0FZI0JBU1NPT05T"},{"title":"Paperbacks, 10/01/02 (Tuesday)","author":"by Elizabeth C. Gorski / Edited by Peter Gordon (puzzleeditor@nysun.com)","date":"2002-10-01","grid":"QVNQUyNUT1JTTyNCUkFOClRIUlUjT05JT04jTElORQpMQU9TI09DQ1VSI0FQVFMKQVNXSElURUFTQVNIRUVUClNUQUlSIyMjQU1DI05ORQpUQVIjSUFNQiNQSUxJTkcKIyMjRVNQSUVTIyNTTkFHCiNPTlRIRVNBTUVQQUdFIwpUSEVOIyNDUkVESVQjIyMKT0JUQUlOI0RFQU4jU1NTCllFUyNET1MjIyNUQU1QQQpTSEFLRVNMSUtFQUxFQUYKSEFMRSNIQURFUyNTQURFCk9WRU4jRVZFTlQjT1JFUwpQRVNPI1JFQVRBI1BTU1Q="},{"title":"Alien Encounters, 10/02/02 (Wednesday)","author":"by James P. Sharp / Edited by Peter Gordon (puzzleeditor@nysun.com)","date":"2002-10-02","grid":"Q0hFWiNBQkJBI0VHR09TClBFUlUjUkFVTCNQT1VDSApMSU5DI0xJRkUjSVJBVEUKI1JPQ0tFVEZFU1RJVkFMCiMjI0hFTiMjI0FIRUFEIwpDQUJJTkVURkVWRVIjIyMKQUdFTlQjQUxMT1QjTUFUCkRFTEkjRkxBSVIjRUxMQQpTRVQjQUVPTlMjQVhMRVMKIyMjQkxBTktFVENIRUNLCiNTQUFCUyMjI0FSSSMjIwpKQUNLRVRJTlRIRUJPWCMKRU5URVIjTkVISSNJREVBClNLSVJUI0NPQVQjVElOUwpUQU5ZQSNBTlRJI1NOQVA="},{"title":"Themeless Thursday, 10/03/02 (Thursday)","author":"by Ogden Porter / Edited by Peter Gordon (puzzleeditor@nysun.com)","date":"2002-10-03","grid":"UklQI1NSTyNDQUIjWUFQCkJBQSNUU0sjT1ZBI0VLRQpJTlRIRVZFUk5BQ1VMQVIKIyNUT1cjRkFOI0hBTCMjClRFRU5BR0VXRVJFV09MRgpPTEQjUk9OI0NPTCNXRUUKVE9PVFRPT1RUT09UU0lFCiMjTkJDI0tBSSNSQVQjIwpHRVRTT01FT05FU0dPQVQKQVNII1BJRSNHRUQjTkVWCkpFRVBFUlNDUkVFUEVSUwojI0JPTCNXT08jR0FMIyMKREVBREFTQURPT1JOQUlMCkFSQyNOT00jTU9FI0tPUwpZQUsjRElQI1NIRSNFTkQ="},{"title":"Value Judgment, 10/04/02 (Friday)","author":"by William I. Johnston / Edited by Peter Gordon (puzzleeditor@nysun.com)","date":"2002-10-04","grid":"R09MRiNDSElDSyNBQ1JFClVUSUwjUkFESUkjU09BUApGUkFVI09DRUFOI1BVWk8KRk9SVFVORURPRVMjTE9YCiMjI1RSRUsjI1RBV0RSWQpTRVZFTlMjUkFJU0UjIyMKVElFUlMjTk9UQ0hBTkdFCkVSSUsjQ09MVFMjUkVMWQpNRU5JVE9OTFkjUEFDRVIKIyMjQ0hMT0UjWUFOS0VFCkNVQ0tPTyMjR09MRCMjIwpBTk4jVU5NQVNLU1RIRU0KSVpPRCNJTUJVRSNFVVJPClJJVEUjQVZBSUwjQVJUUwpPUEVOI0xJU1RTI1JURVM="},{"title":"Best of the Rest, 10/7/02 (Monday)","author":"by Randall J. Hartman / Edited by Peter Gordon (puzzleeditor@nysun.com)","date":"2002-10-07","grid":"QkFKQSNFTE1PI0FERVBUCk9WQUwjTE9PTSNOSVhPTgpOT1ZBI0RBTkEjQVZBU1QKI05BTUVPRlRIRUdBTUUjCiMjI09SUiMjQUlSIyMjIwpERUIjUkFHRSNTQVRJUkUKRUxMRSNESU5PI01PTkVUCk1PVVRIT0ZUSEVTT1VUSApPUEVSQSNURU5TI0xJUkEKU0VSRU5BI1JPUEUjVE9OCiMjIyNVTUEjI1JBTSMjIwojQ09DS09GVEhFUk9DSyMKREVSRUsjVElFUyNVWklTCkVMRU5BI0VSQVMjTkFUTwpTTE9USCNSRVBPI1RSRVg="},{"title":"Queens for a Day, 10/8/02 (Tuesday)","author":"by Elizabeth C. Gorski / Edited by Peter Gordon (puzzleeditor@nysun.com)","date":"2002-10-08","grid":"U0NITU8jU1VSRiNNT0FUCkFMT0VTI0hBSUwjUlVERQpOQVRBTElFV09PRFNJREUKRElQTE9NQSNUT1JPIyMjCkVST1MjQlJTI0RPTExBUgpSRVQjUVJTVFUjUEVFVkUKIyMjRFVPI0VNUyNBVklECiNCUk9PS0VBU1RPUklBIwpQUk9OI0VTTCNFTFkjIyMKSElMVFMjU1RBTkQjVE9OCkRPT1dPUCNISUMjVklORQojIyNPTklUI1NJTUlMRVMKTEFVUllOSElMTENSRVNUCklCQVIjWkFORSNBR1JFRQpWQVJZI0FOTlMjVE9TQ0E="},{"title":"Starting Finishes, 10/9/02 (Wednesday)","author":"by Harvey Estes / Edited by Peter Gordon (puzzleeditor@nysun.com)","date":"2002-10-09","grid":"QkFTS1MjT1JDQSNNSU5JCklPTklDI1RPT04jQU1FTgpCTE9LRSNUQVJUI1RIVVMKIyNXSU5HRURWSUNUT1JZCkVCQiNURVJTRSNMRU1PTgpHTEFTU0VTI1RSSSNFTkMKR0lMTCMjI1NUQUZGIyMjCiNQTEFDRUJPRUZGRUNUIwojIyNZVUtPTiMjI0VMU0EKWUlQI1JFTyNGSUdMRUFGCkVUSE9TI0tST05FI0FSQwpTSE9XRVJDVVJUQUlOIyMKU0FURSNFQVNUI1JPU0lFCklDT04jSVNFRSNVVFVSTgpSQUdTI05FU1MjUEFQQVM="},{"title":"Squares, 10/10/02 (Thursday)","author":"by Michael Shteyman / Edited by Peter Gordon (puzzleeditor@nysun.com)","date":"2002-10-10","grid":"TUVUUk8jQ1VUUyNTV0FUCkFURVVQI0FTQVAjRUFTRQpDQUVTQVJTQ0NMWFhYSVgKIyMjRVFVSSNPQUYjRURUCk9GRiNVTk8jI1RJTERFUwpNSUxJRVUjVEVTTEEjIyMKQVhPTiNQQVVMI0VOSk9ZCkhJR0hFU1RTQVRTQ09SRQpBVFNFQSNPS0xBI0VORFMKIyMjUlNWUFMjQ0FSRUVOClBFU0VUQSMjTk9UI1NSTwpBUEUjT0xFI0FNT1MjIyMKU0VDT05EU0lOQU5IT1VSClNFVEgjRVRPTiNDT0JSQQpFU1NPI1pBTlkjRVdJTkc="},{"title":"Weekend Warrior, 10/11/02 (Friday)","author":"by Bob Peoples / Edited by Peter Gordon (puzzleeditor@nysun.com)","date":"2002-10-11","grid":"T0NURVQjRElFVENPTEFTCk5PT1NFI0lOVEhFU09VUApTVE9QUyNTUVVBUkVPTkUKQVRCQVQjQVVESVQjU1RFCkxFQU5TI1ZJRVMjUkVJRApFUkRPQ1RPUlMjUkVORUUKIyMjTE9FV0UjVkFMVUVSCk9QUyNSTlMjSkFOI1BNUwpMQVRLRVMjR0FOR1MjIyMKRFJBVFMjTVJQRUVQRVJTCkhBWVMjR0FFQSNMSU5FTgpBTkEjTUlMQU4jQU5ESUUKTk9XQVlKT1NFI05PT05FCkRJQUxUT05FUyNEVVJFUgpTQVlDSEVFU0UjU1RBUlM="},{"title":"Increased Drinking Capacity, 10/14/02 (Monday)","author":"by Ogden Porter / Edited by Peter Gordon (puzzleeditor@nysun.com)","date":"2002-10-14","grid":"UElUQSNQRVRFUkkjVFVCCklST04jRVhJTEVEI09OTwpUQUZUI1JFTkFNRSNQSVgKU1FVSVJUQ0FOI0VMQVRFCiMjI09PSFMjI1BGSVpFUgpFTEVDVCMjUEFSSVMjIyMKVEVDSCNKT0VTSVhQQUNLCkFBSCNDT1JOSUNFI1RPRQpUUk9QSFlDQVNFI0pPRFkKIyMjTE9DQUwjI09PWkVTCkVVUk9QRSMjREFMWSMjIwpYUkFZUyNQT1dERVJLRUcKQ0FCI0hBTFZFRCNJTlJFCkVMSSNPTkVJTEwjRE9MTApMU0QjUEFERExFI0VYRVM="},{"title":"Oedipus Wrecks, 10/15/02 (Tuesday)","author":"by Alan Arbesfeld / Edited by Peter Gordon (puzzleeditor@nysun.com)","date":"2002-10-15","grid":"T01JVCNOQVNII0FMSUFTCk5PTk8jRVNURSNUT1RBTApTTkFQI1dIRU5ZT1VTQVkKUEFSU0VEI0FORU1JQSMjCkVDTyNQRU5NQU4jRURJVApDT1cjSUxFI1NTUiNBREUKIyMjRVRIT1MjI0VBVEVOCk9ORVRISU5HQlVUTUVBTgpQRUFDRSMjVE9OSUMjIyMKRVJSI1RBTSNBSVIjVEFSCkNPUEUjU1RBUlZFI0FQRQojI0xBU1RFRCNFREFNRVMKWU9VUk1PVEhFUiNUQVhJCkFOR0xFI05PVVMjT0xFUwpQT1NTRSNBQ1JFI1pFU1Q="},{"title":"No Growling!, 10/16/02 (Wednesday)","author":"by Stella Daily and Bruce Venzke / Edited by Peter Gordon (puzzleeditor@nysun.com)","date":"2002-10-16","grid":"VlBTI0VSRVNUVSNBSU1TCk9BVCNTV0lQRVMjTkNBQQpETkEjRUFTRU1PTktFWVMKS0lMTCNOTkUjI0FMVE9TCkFDRVVOREVSRklSRSMjIwojIyNORUFSI0FOWSNDUEEKQlJJQU4jI1NJTiNDSEFSCkVBVENBRVNBUlNHSE9TVApUUkVZI0FQVCMjTkVXVFMKSEVNI0VSQSNTVEFSIyMjCiMjI0FTUFNBVFNUUkFXUwpCQVNJUyMjQ1VFI1lVQU4KQVBFU09GV1JBVEgjRElFCkJFTEwjQVZFUlNFI0lWRQpBWExFI1RBU1RFUiNPRVI="},{"title":"Themeless Thursday, 10/17/02 (Thursday)","author":"by David Levinson Wilk / Edited by Peter Gordon (puzzleeditor@nysun.com)","date":"2002-10-17","grid":"U0FTRSNKRUVWRVMjUENQCkNJVElaRU5LQU5FI0VSUwpBRE9MRVNDRU5DRSNSQVkKUkVQRUFUUyNFSU4jRlRDCkNSVUVMIyNGRFIjTEVDSApFU1BOI1RSTCNDSEFDSEkKIyMjI0dPQkFMTElTVElDCiNTT01FTElLRUlUSE9UIwpJTkRPTkVTSUFOUyMjIyMKR09PQkVSI0VLRyNUT0ZVCk5PTVMjQVJSIyNMSU5FTgpPUEUjQVRFI1BSSUNFUlMKUkVUI05PTkVMRUNUSVZFCkVSRSNEUkVXQUJFQURPTgpTU1IjQVNTRVRTI0NBUlQ="},{"title":"Tame Nags, 10/18/02 (Friday)","author":"by Randall J. Hartman / Edited by Peter Gordon (puzzleeditor@nysun.com)","date":"2002-10-18","grid":"TElNUCNTVFJJUCNTQVdOClVTRVIjQVJFTkEjVFJJTwpNRVRFUlBBQ0tTI0FJTlQKUEVTVE8jIyNTVE9SQUdFCiMjI1RVVE9SI0VTVCMjIwpCT05ZVEVORVQjQUJBU0gKQVJFIyNBUkNII0tBUk1BClNMQUtFI0FSQSNBUlJPWgpTT1JFUyNNVVRFIyNPUkUKT05TRVQjUElDS0RPV0VMCiMjI05FQiNUSEVJUiMjIwpCSUdERUFMIyMjU1dFREUKQVJFQSNCVUNLQ0hFUlJZCkNPUk4jRVJOSUUjTElORQpLTkVFI0xFTlRPI0xFT1M="},{"title":"Juiced-Up Play Places, 10/21/02 (Monday)","author":"by Ogden Porter / Edited by Peter Gordon (puzzleeditor@nysun.com)","date":"2002-10-21","grid":"I1NPTEFSREFZI1NIQVBFCiNTQU9QQVVMTyNBQVJPTgojVFJPUElDQU5BRklFTEQKIyMjI0VMS1MjTElUIyMjCkFJUkJBU0UjSlVSSVNUUwpLTk9MTCNEUk9ORSNOQVAKQVNUVVRFI0FOUyNDT0xBCiNUSEVPUkFOR0VCT1dMIwpMT0lTI0FNVCNSSVBQRUQKSVJSI0NTUE9UI0dFRVNFClpFQUxPVVMjT05BREFURQojIyNPUlIjRFJPUCMjIyMKTUlOVVRFTUFJRFBBUksjCklOVVNFI1NURUVMVE9FIwpBTk5FWCNUQVNTRUxFRCM="},{"title":"Under Cover, 10/22/02 (Tuesday)","author":"by Norma Johnson / Edited by Peter Gordon (puzzleeditor@nysun.com)","date":"2002-10-22","grid":"SEVSQkFMIyNOSUwjU0FUCkVMVE9STyNMSU1PI1RJRQpOT0VYSVQjT0tBWUJZTUUKIyMjRUFUSU4jQ0FSTElOCkxFQVIjT1JHUyNMSUVOUwpJTlRSQSNBSkFYI0VER1kKTE9SRU4jTk9ET0ZGIyMjCkFMSUJJUyNIQVVMRURVUApDQVBFVE9XTiNURU5VUkUKIyMjTEFST1NBI0VDTEFUClJBSUwjVFJJTSNST0xMRQpBTlRJUyNFTElTI1VTU1IKTVRIT09EI1ZTSUdOIyMjCkJFQU5QT0xFI05VVE1FRwpMVUMjSEVJUiNDUkVBU0UKRVBBI1NTVCMjRVVST1BF"},{"title":"Looks Can Be Deceiving, 10/23/02 (Wednesday)","author":"by Alan Olschwang / Edited by Peter Gordon (puzzleeditor@nysun.com)","date":"2002-10-23","grid":"U1RBUiNNQU1BI09NRU5TCkxPQkUjSVJPTiNET05PVApBVE9QI0NMT0cjQVRTRUEKWU9VQVJFT05MWVlPVU5HCiMjVElPIyNTRUUjUkVEUwpVUEZST05UI0VTU08jIyMKRkFBIyNZVUwjI0lMSUFECk9OQ0VCVVRZT1VDQU5CRQpTVEVOTyMjRVJSIyNQQkEKIyMjVEFGVCNBTFNPUkFOCkxFQVIjTEFQIyNVUkkjIwpJTU1BVFVSRUZPUkVWRVIKVEJPTkUjVE9BVCNMQVZBCkhFTkNFI0FOVEkjU1RFUApFREdFUyNSWUVTI0VFTFM="},{"title":"United Nations, 10/24/02 (Thursday)","author":"by Richard Silvestri / Edited by Peter Gordon (puzzleeditor@nysun.com)","date":"2002-10-24","grid":"QkFXTCNBTUlEI1NPTEVTCkFDUkUjTElETyNUSUFSQQpDSEFEU1BBSU4jRUxMSVMKS0VZI1RJVE8jU1BFQUtTCiMjI1BBTkFNQU5PUldBWQpERUJBVEUjI1RBTiMjIyMKQVRPTkUjTEFIUiNTTE9QCkRBSVMjQ0FST0wjQ09WRQpBTExZI0FHRVMjQVVHRVIKIyMjI0hNTyMjQUxCRVJUCkNPTkdPRVNUT05JQSMjIwpBUE9MTE8jSFVORyNTUEEKTUVUQUwjVE9HT05FUEFMClBSSVpFI0FTSFkjUkFWRQpTQU5FUiNCRVRTI0FNRVg="},{"title":"Linkletter Art, 10/25/02 (Friday)","author":"by William I. Johnston / Edited by Peter Gordon (puzzleeditor@nysun.com)","date":"2002-10-25","grid":"TVVTSUNBTFNVU0hJQkFSCkFORU1PTkUjQlJPQ0FERQpTTEFQUElOR1VUVFVSQUwKU0FUI0FUVCNSQVcjQk1JCkFDSURSQUlOT1NJTkVTUwpHRU5JRSNMI0kjUklDT0gKRURHSU5HQVRPUkVUVU5FCkQjUyNUI1dPVyNTI0UjRApFTFRPUk9ORUFNQU5VUkUKQ0FSUkUjUyNOI1JPUkVNCkVUQUdFUkVTRVBBUkFURQpBUk4jRklSI1dBUyNTQU4KU0lHTkVESU5FUE9USVNUCkVOTEFSR0UjU0VUUkFURQpERUVQTkVTU1RSQUlORUQ="},{"title":"Numbered Parts, 10/28/02 (Monday)","author":"by Robert Ward / Edited by Peter Gordon (puzzleeditor@nysun.com)","date":"2002-10-28","grid":"VU1QUyNUU0FSUyNQVEFTClNJUkUjQUxMSUUjQVJOTwpPTkVBUk1FREJBTkRJVFMKUFVUI1VQRE8jTUFSQyMjCkVUQSNCQVMjIyNHRU9ERQpORVhVUyMjU0FDI1NMSU0KIyMjRk9MREVEVVAjT1BUCiNUV09GQUNFRExJQVJTIwpBUkUjRk9PVFNURVAjIyMKQlVMQiNTTk8jI0VVUk9TCkNFTExPIyMjSEFZI09STwojI0JVRFMjRUlSRSNUQVIKVEhSRUVMRUdHRURSQUNFCkhVRVMjQUxPSEEjVVJMUwpFRERZI0JPU0NTI05ZRVQ="},{"title":"Porcine Construction, 10/29/02 (Tuesday)","author":"by Sarah Keller / Edited by Peter Gordon (puzzleeditor@nysun.com)","date":"2002-10-29","grid":"RUJCUyNNQVpEQSNCT0xUCkRFRU0jRVBFRVMjUkhFQQpJTlJJI1NQRU5UI09NRU4KVEhFTEFTVFNUUkFXIyMjCk9VVEVSIyMjU09BTkRTTwpSUlMjUlBNUyNTSFJPVUQKIyMjSE9BWEVSIyNJQ0VECiNTV0laWkxFU1RJQ0tTIwpXSElHIyNJUlZJTkUjIyMKQVVUSE9SI1NQQVQjREFCClJFU0NVRVMjIyNFTEVOQQojIyNISVRUSEVCUklDS1MKQVNFQSNFUkFTRSNNQUxJCk1BR0kjU0FMU0EjRURFTgpQT09SI1RZTEVSI1NFVFM="},{"title":"One in a Mil., 10/30/02 (Wednesday)","author":"by Brendan Emmett Quigley / Edited by Peter Gordon (puzzleeditor@nysun.com)","date":"2002-10-30","grid":"RkFUV0EjVklMRSNGUk9NCk9OQUlSI0FNRVgjUkVQTwpCQUxTQSNHSVZFI1VOSVQKIyNDUExQVU5JU0hNRU5UCiMjIyNTRUUjIyNFUEVFUwpQVlRTRUNSRVRBUlkjIyMKSE9PSEEjI1FVQUQjRENDCklUVFkjUk9VR0gjU0FSQQpMRUUjUkFWSSMjTVJNT00KIyMjTUFKQVBQTElBTkNFCkFMVEFSIyMjRlVOIyMjIwpHRU5SRUxBVElWSVRZIyMKQU1PSyNBVE9aI1ZIT05FClBBVEUjWk9ORSNBRVJPUwpFWUVEI0VNSVIjTkVFRFM="},{"title":"Nine Lives, 10/31/02 (Thursday)","author":"by Stella Daily and Bruce Venzke / Edited by Peter Gordon (puzzleeditor@nysun.com)","date":"2002-10-31","grid":"Vk9TI1NXQU0jQUJESUNFCkFDVEFMT05FI0dFSVNIQQpDSEVSSU5FVEhFR1JFQVQKRVJSRUQjV1JFTiNLRVlTCkRFTlNFIyNPUFRTIyMjIwojIyMjU1NUI0NTS0lMTFMKQ05BUCNDRVIjI0lERUFMClNPUEhJU1RJQ0VETEFEWQpVTlRJTCMjTUNWI0VQRUUKUE9TU0VTUyNIQUojIyMjCiMjIyNTUEVXIyNFTEVHWQpBUFNFI09SSUcjSk9MTEEKVk9DSU9OQUxFRFVDSU9OCkdFSFJJRyNEUk9ORVNPTgpTVEVFTEUjQ1RMRSNFTUk="},{"title":"Weekend Warrior, 11/1/02 (Friday)","author":"by Bob Peoples / Edited by Peter Gordon (puzzleeditor@nysun.com)","date":"2002-11-01","grid":"TUFHUyNMQUNFUyNBR0FTCklCRVQjQUxBTkEjTk9URQpTQVRFI1lFTlRMI1RBTEUKU0xJUCNTV09SRSNJSEFECklPTlMjUElORVMjUEVSSQpPTlRPUE9GI0FDUkVBR0UKTkVPTkFURSNUT09SREVSCiMjI09OQSMjI05PUyMjIwpTUElORVRTI1RWU1BPVFMKQ0FNRUxPVCNSRVRJTlVFCkFQUFMjQ0FST04jUkVOVApMT1VUI0hZQVRUI0FNRVMKUE9MTyNJU0lUSSNOT1NICkVTU0UjUEFTRU8jVFJJTwpMRUVTI1NURVJOI1NFTlQ="},{"title":"Race Pace, 11/4/02 (Monday)","author":"by Norma Johnson / Edited by Peter Gordon (puzzleeditor@nysun.com)","date":"2002-11-04","grid":"QVNJQSNVTkRPI0NIQUlSCklPTlMjTE9PTiNIRUxMTwpSVU5TSU5USEVGQU1JTFkKQlJBI01BTiMjUklQUyMjCkFDVFVQI09MU0VOI1RBTQpHRUVTRSNXSUxFUyNBUkkKIyMjQUxBI0JJWiNSSVRaCiNKT0dTVEhFTUVNT1JZIwpEVURFI0VFTCNSQVkjIyMKQU5EI1BJTEVEI0RBVEVTCkRFQiNBTkRSRSNDTE9VVAojI0FTU1QjI1ZJQSNPUlIKV0FMS1NPTlRJUFBZVE9FCk9MTElFI0FVVE8jRE9QRQpXSVNQUyNHRU9TI1NPQVA="},{"title":"\"Oy!\", 11/5/02 (Tuesday)","author":"by Randall J. Hartman / Edited by Peter Gordon (puzzleeditor@nysun.com)","date":"2002-11-05","grid":"U0NBTSNJRFRBRyNLRU1QCkxPQkUjUEFVTEEjTkFJTApBTUVOQ09JTkVSI09TU08KQkFMU0EjU0VBTCNDWVNUCiMjI0FTUCMjU0lMS1MjIwpTQUcjSE9JU1RDQVNUTEUKSFVMQSNQQVQjI0JPUkFYCkVEQU0jU05JUFMjRkVMVApBSURBTiMjTkVUI0ZFQVIKRk9JU1RERUdSRUUjVFdBCiMjQVNIRU4jI01BTyMjIwpBU1RBI0VER0UjUkhJTk8KU0xPQiNNSUxUT05CT0lMCkVBUkwjRVZJVEEjT05DRQpBUFNFI0RFQlVUI1lBS1M="},{"title":"Ham on Sky, 11/6/02 (Wednesday)","author":"by Monica Krausse / Edited by Peter Gordon (puzzleeditor@nysun.com)","date":"2002-11-06","grid":"Q0FXUyNBRExBSSNNQU5TCk9DSE8jUlVJTkcjQUxPVApTVEVSI0tFVklOI1hFTkEKVFVORFJBI0VNT1RJQ09OCkFQUElBTiNIQVJFTSMjIwojI0lERVMjSUxFUiNUVkEKQVZHI1NBTkcjU0lQSE9OCk1PU1MjU09ITyNTUEVMVApBV0ZVTCNET09SI1NTVFMKU0VMVkVTI05PRUwjV0FZClNMWSNBUFBUI0RBTEkjIwojIyNPUFJBSCNDTUlOVVMKRFVDVFRBUEUjUkVMRU5UClVOSVQjV0FIT08jSUZTTwpOSU5FI0xZT05TI0VMRVYKRVZFUiNTQUdFUyNTVVJF"},{"title":"Themeless Thursday, 11/7/02 (Thursday)","author":"by Mark Diehl / Edited by Peter Gordon (puzzleeditor@nysun.com)","date":"2002-11-07","grid":"TE9OQ0hBTkVZU1IjQVBSCklEQUhPUE9UQVRPI05SQQpTRU1JUkVUSVJFRCNKT0cKUFNBVFMjQUNORSNORVhUCkVTVEEjVVJLRUwjT0xJTwpSQUgjRlJJRURTSFJJTVAKIyMjQkVHRVQjI09SQ0FTCiNTVEFURVMjR0VOSUFMIwpTVE9MSSMjU09MT1MjIyMKVFJFQURTV0FURVIjQ0NTClJBVEEjSElNT00jU0hBSApBVE9NI0FOTlMjQ0xPU0UKWUVUI0lORFVFQ09VUlNFCkVHTyNMSU9ORUxUUkFJTgpET0UjTEFXTkRJU1BMQVk="},{"title":"A Worker's Lament, 11/8/02 (Friday)","author":"by Bruce Venzke and Stella Daily / Edited by Peter Gordon (puzzleeditor@nysun.com)","date":"2002-11-08","grid":"QVJJWiNBVFRBQ0sjTUFECkxBQ0UjUEFOREVSI0FSSQpNWU9VVFBVVERPVUJMRVMKU0VOU0VJIyMjI0tFQU5VCiMjIyNSQVNIRVMjVFdBUwpBVEFISU5UT0ZQUkFJU0UKUkVMQVkjQVJHVUUjIyMjCkVBU1lBUyMjI0RWT1JBSwojIyMjS0FSRU4jRVJPREUKSU1BR0lORU1ZRlJFTlpZCkdBTEEjRU5TVUVTIyMjIwpVTkxJVCMjIyNBRUdFQU4KQVRBTkFDVFVBTFJBSVNFCk5BWSNQUk9TSVQjSVJLUwpBU1MjU1RFQURZI1RFU1Q="},{"title":"Plum Loco, 11/11/02 (Monday)","author":"by Ogden Porter / Edited by Peter Gordon (puzzleeditor@nysun.com)","date":"2002-11-11","grid":"TEFTUyNBV0xTI0pVS0VTCkFSQ0gjQ0hJQyNPSEFSQQpUT1JFI0xJU0EjRVVST1MKRU1VI1BVUlBMRVBST1NFClJBQkJJIyMjQVJFQSMjIwojI05BVE8jQVdFUyNGRUQKTE9VUyNBTk5BI0NSRURPClNIUklOS0lOR1ZJT0xFVApBSVNMRSNMVVNII01JTkUKVE9FI0FCRUwjRkxFWCMjCiMjI0FSSUQjIyNZT1VUSApNQVVWRURFQ0FERSNOQkEKQVRSSUEjTE9HTyNFR09TClRPR0FTI1RJRUQjTEVOVApTUEVOVCNBTFNPI0ZSRUU="},{"title":"Season to Taste, 11/12/02 (Tuesday)","author":"by Diane Epperson / Edited by Peter Gordon (puzzleeditor@nysun.com)","date":"2002-11-12","grid":"R05BVFMjQUZSTyNBTUZNCklPTklDI1RSQVAjRklMRQpTQUdFQURWSUNFI0FMQU4KVEhFUk1PIyNJTkNST1dEClNTUiNQSU9ORUVSIyMjIwojIyNHSU5HRVJST0dFUlMKQlJJRSNHUk8jI0NVVElFClJFTEVBU0UjRVNTRU5DRQpPTkVORCMjTllFI1NBS1MKU0VTQU1FU1RSRUVUIyMjCiMjIyNBTENIRU1ZI0xQUwpBTlRPTklPIyNMRU5PUkUKTE9SRCNDVVJSWUZBVk9SCk9WSUQjSVJBTiNVU0lORwpUQU9TI1RTUFMjTEFOR0U="},{"title":"\"Amen!\", 11/13/02 (Wednesday)","author":"by Harvey Estes / Edited by Peter Gordon (puzzleeditor@nysun.com)","date":"2002-11-13","grid":"TElMWSNFU1RFUiNUQU1FCk9SRU8jUVVJVE8jU0xBRwpOT1dZT1VSRVRBTEtJTkcKRU5ET1JBI1RFUkkjQUdPCiMjI1NFVFRPI1NBTVNPTgpJVFMjTE9BI1dBUkUjIyMKVEhBVFNSSUdIVCNUUkVYCkNBQ0hFI1dFRSNOT0lSRQpISUtFI0RBUk5UT09USU4KIyMjSUNPTiNDVVAjQUtBClRFUlJPUiNCRVJSQSMjIwpPUk8jUElMTCNOT1JNQUwKWU9VQkVUWU9VUkJPT1RTCkVER0UjT1JBVEUjU0FSQQpERUVEI1NBVEVEI0VUQVQ="},{"title":"Feeling No Pain, 11/14/02 (Thursday)","author":"by Peter Abide and Lee Glickstein / Edited by Peter Gordon (puzzleeditor@nysun.com)","date":"2002-11-14","grid":"U0xPQiNDU0EjV0lHV0FNCkZBUk8jT1VSI0lOTElORQpQSUxMVEFMSyNTVEFORFMKRFJZRE9DSyNDSE9SRCMjCiMjIyNQSFlMQSNURVdFUwojQVNUSSMjQVJOTyNBTFAKI1RIRUNBVFNNRSNFU1RBCk1PQU4jTUVURVIjQUhPWQpFTkRTI1lFTExGRVZFUiMKUkVCI0FTSEUjI0FFUk8jClZST09NI0VHQURTIyMjIwojI1hGSUxFI1RSRUtLRUQKQVNJQUdPI1dFRERJTkdWCk1BTkdPUyNKQVIjUkVBRApJTkdFU1QjTU1FI0tFTlM="},{"title":"Weekend Warrior, 11/15/02 (Friday)","author":"by Frank A. Longo / Edited by Peter Gordon (puzzleeditor@nysun.com)","date":"2002-11-15","grid":"U0hPUEZPUiNPU01PTkRTCkNBUlJFUkEjSEVBUk9VVApBTEtBTElORUJBVFRFUlkKTEVBRElOR1JPTEUjTEFYCkFSTkFaIyNTWVNPUCMjIwojIyMjTlBSIyMjI0FUSVQKTUFSQ0FSRUdJU1RSQURBCkNSRUFUSVZFUEFSVE5FUgpDUlVTQURFREFHQUlOU1QKQ0FTSExFU1NTT0NJRVRZCklTRUUjIyMjU1NFIyMjIwojIyNXT1BBVCMjWUFMVEEKVVRFI1pFUk9ERUdSRUVTClJPTExPTkRFT0RPUkFOVApTSUxFTkNFI01FTElTU0EKQUxBVEVFTiNPTERTVEVS"},{"title":"Starting From Scratch, 11/18/02 (Monday)","author":"by Mark Diehl / Edited by Peter Gordon (puzzleeditor@nysun.com)","date":"2002-11-18","grid":"VVBTWSNBV09MI0FERFVQClNJVEUjU0hFQSNMT0FOUwpTUVVBVFRFUlNSSUdIVFMKUlVCU1JBVyNTVUJQTE9UCiNFU1RBIyNTT05JQSMjIwojIyNTQ09PVCNFU1RBVEUKSVRTI0VBU0VTIyNDTE9EClpJUFBZVEhFUElOSEVBRApPVkVSIyNBTElORSNTVFkKRE9XRUxTI0lOTkVSIyMjCiMjI1RFQVNFIyNEVUVUIwpBQ1JFQUdFI1BJTEdSSU0KQkxBTktFVENPVkVSQUdFCkxBUFNFI1RVTkUjQVNFQQpFTlRFUiNPRERTI1RFUk4="},{"title":"Wild and Crazy, 11/19/02 (Tuesday)","author":"by Eric Berlin / Edited by Peter Gordon (puzzleeditor@nysun.com)","date":"2002-11-19","grid":"QURBTVMjQ1NQQU4jQlVUClNVTVVQI0RFRVJFI0lOQQpIT1VTRVNJVFRFUiNHTlUKIyNMRUFII1NBTlRBRkUjClNJRVJSQVMjTEFTVE9SWQpBUlRTI0RFQlMjI1dPVkUKV0FTI01PTEUjRUxBVEVTCiMjI0JPV0ZJTkdFUiMjIwpVU0FSTVkjR09PTiNURUEKTkFUTyMjUkVTVCNTV0FQCkFMTE9GTUUjSElERU9VVAojVkFNT09TRSNTSUNTIyMKSkFSI1NURVZFTUFSVElOCkVHRyNTT1dFRCNMRUFWRQpURUUjRVJOU1QjU1RSRVc="},{"title":"Avian Sightings, 11/20/02 (Wednesday)","author":"by Sarah Keller / Edited by Peter Gordon (puzzleeditor@nysun.com)","date":"2002-11-20","grid":"RFVPUyNTUEVBUiNMQ0RTCkVOSUQjVEVSUkEjSE9SQQpFTExBI1JFR0FOI0FMT1QKSkFDS0lFUk9CSU5TT04jCkFEQSNEV0kjIyNPQVJFRApZRU5UTCNORVNUUyNBREUKIyMjS0VXI1NPTyNBRE9TCiNHTE9SSUFTV0FOU09OIwpMT0lTI0xZRSNET0gjIyMKQUxGI0VMRU5BI0hFTUFOCk9ERVRTIyMjR0VPI09SRQojU1RFUEhFTkhBV0tJTkcKU1RJUiNBUklBUyNPTkVBCkdBTVMjUklOU0UjQkVTVApUUkVFI0tFQVRTI0VTU0U="},{"title":"Themeless Thursday, 11/21/02 (Thursday)","author":"by Harvey Estes / Edited by Peter Gordon (puzzleeditor@nysun.com)","date":"2002-11-21","grid":"U0NPUEUjR09BTCNURVJQCkxBVVJBI09SU08jQVZFUgpPU0NBUiNFQ0hPI0tBTkUKQkVISU5EVEhFU0NFTkVTCiMjI1NFSVpFI0VSQVNFUwpSQVRFREcjU1lOT0QjIyMKSVNBWSNJTlRPI1dFRVBTCkZJVkVTVEFSR0VORVJBTApGQUlUSCNNQUlMI1BPTE8KIyMjSEFNRUwjVE9CT09UClNURUVMRSNTQ09VUiMjIwpUQUJMRU9GQ09OVEVOVFMKQUhTTyNXT09EI0ZBQ0VUCkJPRVIjRVRSRSNJVEFMWQpTRU5EI0RPRVMjVEhSRUU="},{"title":"Family Center, 11/22/02 (Friday)","author":"by Ogden Porter / Edited by Peter Gordon (puzzleeditor@nysun.com)","date":"2002-11-22","grid":"TVJTI01JQiNDQlMjTUFYCklPQyNTS0VERExFI0FHRQpDT1VOVEVSQUNUUyNKQVIKQU1CSSNBTk5BUyNUT1RPCkhZQVRUI0FEUyNQVVJFWAojIyNUSEVSTUVURVIjIyMKSEFDSUVOREEjSEFOR09OCklETyNQUklOQ0VTI1VGTwpDT09MSU8jREFEQUlTVFMKIyMjRUxMSVNMQU5EIyMjClFVQUlMI1ZBTCNUQVJQUwpVWklTI0JBTkRPI0hPT1QKSUJNI1JBTkRPTUhPVVNFCk5FVCNESUtCV05FI1NFRQpUS08jQUxBI05JWCNFUlI="},{"title":"Book Royalties, 11/25/02 (Monday)","author":"by Randolph Ross / Edited by Peter Gordon (puzzleeditor@nysun.com)","date":"2002-11-25","grid":"I0tGQyNLRUVORSNUSUZGClBPTE8jQU5URUQjT1NMTwpUSEVBRlJJQ0FOUVVFRU4KU0xBTE9NUyNMT1VSRUVECiMjI0JVSUxUI1JBRSMjIwojUFJJTkNFT0ZUSURFUyMKRlJPTlQjI1BPT0wjUElQCkVFS1MjTUVMT04jVEVYVApXT0UjU0FWRSMjVEhFVEEKI1BSSU5DRVNTREFJU1kjCiMjI01BSCNTUEFITiMjIwpHRU5FUklDI09QT1NTVU0KSURZTExTT0ZUSEVLSU5HClZJRUQjTU9ST04jSVJJUwpFVFRBI09QSU5FI05FVCM="},{"title":"Avian Announcements, 11/26/02 (Tuesday)","author":"by Alan Olschwang / Edited by Peter Gordon (puzzleeditor@nysun.com)","date":"2002-11-26","grid":"QUhBI0FMVU1TI1BFQUNFCkpBUiNTSVNBTCNFWFBPUwpBTEkjUEVFUElOR1RPTVMKUkVTQ0lORCNQT1MjUkVBCiMjVEFSI0NPT1QjQVRUWQpIT09URU5BTk5JRVMjIyMKT1BUIyNFUkUjRkxJRVJTCkJFTExPV1MjS0lMQVVFQQpPQ0VBTlMjRkVFIyNMREwKIyMjR09CQkxFRFlHT09LClRTUFMjT1JBTCNFRUcjIwpPV0wjRVlFI09SQVRJTkcKUVVBQ0tTQUxWRVIjWk9PClVOVElFI1RPRUlOI0VORApFR0FEUyNIT1JOUyNTT1M="},{"title":"Rated R, 11/27/02 (Wednesday)","author":"by Ogden Porter / Edited by Peter Gordon (puzzleeditor@nysun.com)","date":"2002-11-27","grid":"TUFSSUUjQVBSSUwjUkhPCkFMQVJNI1BFRFJPI0FFUgpSRUZSSUdFUkFUT1JDQVIKQ1JUI0dSUiMjI1NVRVJTCiMjI0tSSVMjQ0hFUiMjIwpTQ0FSRUQjQVJPTiNSQUcKVEFSTyMjQUZPUkUjQVJFCkFJUkNSQUZUQ0FSUklFUgpJUkEjRVJJRVMjI0FMQVIKUk9ZI1BBUlIjUFJJU1NZCiMjI0VSTEUjUkVFRCMjIwpJTlRSTyMjI0VSQSNSQVQKUkVBUlZJRVdNSVJST1JTCk1BUiNBUlJBVSNNQVJUQQpBUlAjTEVFUlMjU0hZRVI="},{"title":"Weekend Warrior, 11/29/02 (Friday)","author":"by Dave Tuller / Edited by Peter Gordon (puzzleeditor@nysun.com)","date":"2002-11-29","grid":"UExBQ0VEI0JBUkNIQVJUClJFTU9URSNPTkVMSU5FUgpFTkJMT0MjVEFCVUxBVEUKTU9MSU5BUk8jI0VMVE9OCkVSSVMjRk9YRUQjU0hPRApERU5FQiNXSVNFRCNFTEkKIyMjVVJJI05BTUUjTUVMCkRJQU1PTkRKSU1CUkFEWQpFRFQjT0JPRSNFUkEjIyMKUEVBI0tFVENII0FQUk9OCkxBTEEjREVURVIjU1VSRQpBTEFOUyMjSU5FUlRHQVMKTklOVEVORE8jTEVBUk5UCkVTVE9OSUFOI0VOUkFHRQpTVEFOREJZUyNURVNURUQ="},{"title":"Petty Rhymes, 12/2/02 (Monday)","author":"by Sarah Keller / Edited by Peter Gordon (puzzleeditor@nysun.com)","date":"2002-12-02","grid":"QU1GTSNBQ0hFUyNMSU1CCkhFUk8jUEhPTk8jSUdPUgpBVE9aI1BBTkFNI0FMVE8KI1NNQUxMVElNRUNST09LCiMjI1JZRSMjRVBBI09SRQpVTklURSNDQUxMVVMjIyMKQ0FOIyNSQUQjQUxPTlpPCkxJVFRMRUJMQUNLQk9PSwpBTExJRVMjQVlFIyNOT1IKIyMjRUFUU0lOI0FST01BCkFDVCNTUk8jI0NSTyMjIwpTSE9SVE9SREVSQ09PSyMKSU9XQSNPUkFURSNLTkVFCkRJRVQjTU9STlMjSUNFUwpFUlJTI1NXRUFUI0VFTFM="},{"title":"Off-Broadway Musicals, 12/3/02 (Tuesday)","author":"by Anne Garellick / Edited by Peter Gordon (puzzleeditor@nysun.com)","date":"2002-12-03","grid":"U0NJRkkjTUFQUyNUSEFUCkhBU09OI0VMSUEjS0VOTwpVU0VSUyNERUFGI09MR0EKVEhFTVVTSUNGQU4jTEVTCiMjI0FSRUEjI1JFVE9SVApBTktMRVQjI01JWFVQIyMKTUNJI1JVQkxFI1RST1RTCk1BU1QjUElFVFkjRkxFQQpPQVNFUyNEV0VFQiNMQUcKIyNNQUlNUyMjQVJHWUxFClNURVJOTyMjQVJJQSMjIwpIQU0jR1VZU0FORFBPTFMKQUxBTiNTT0FSI0dFTklFCkNPVEUjRVJHTyNFQVRFTgpLTkVXI0RFQU4jU1RPVVQ="},{"title":"Food Fight, 12/4/02 (Wednesday)","author":"by Monica Krausse / Edited by Peter Gordon (puzzleeditor@nysun.com)","date":"2002-12-04","grid":"TUJBUyNDQUxDI1BFREFMClBPUlRGT0xJTyNBUkVOQQpTT0NJQUxJU00jV0lMVFMKIyMjRlJVSVRQVU5DSEVTCk1PU0xFTSMjU1NTI0lETwpPQklFI0JCQyNBSFMjIyMKUkVYI0FJT0xJI09VTkNFCkFTUEFSQUdVU1NQRUFSUwpMRU1NRSNTRUxFUyNTQVMKIyMjUEFSI0RFTiNMQVZBCkFMRSNDSUEjI0RPT0xFWQpCQU1CT09TSE9PVFMjIyMKRlJBVUQjQ09ORlJFUkVTCkFHSUxFI0FMTEZPUk9ORQpCRUxMUyNQQVlTI1NFR0E="},{"title":"Themeless Thursday, 12/5/02 (Thursday)","author":"by Bob Peoples / Edited by Peter Gordon (puzzleeditor@nysun.com)","date":"2002-12-05","grid":"R09IQVlXSVJFI1RSQVBQCk9OT1JBQk9VVCNIRUxMTwpET05UTEFVR0gjRUFUVVAKRFJFU1QjI1JFRlMjRVNTCkFEUyNBVExBUkdFI1JPVApSRVREI09BVCNTQUJFTkEKRFJZQVNEVVNUI1JZREVSCiMjI1RIT1IjVVNDRyMjIwpUT1FVRSNBTExUSFVNQlMKQUNVTUVOI0FMSSNNSUxMCkJPTyNQRVNURVJTI1NFQQpBTlQjU09MRSMjS0VTRVkKU05FQUsjSVJPTk9YSURFCkNPUkdJI01PT05SSVZFUgpPUlNPTiNFTkZFVFRFUlM="},{"title":"ID Tags, 12/6/02 (Friday)","author":"by David J. Kahn / Edited by Peter Gordon (puzzleeditor@nysun.com)","date":"2002-12-06","grid":"R09CSSNBTFRPUyNFREFNCkVST1MjUEFSTUEjTE9MQQpFQkJTI0FTSUFORkxVSUQKIyNCRUFUU1RIRVJBUElECkJPWUlTSCNUQUxFIyMjIwpBRFMjVElOIyNZRU5UTCMKQURPI1JFT0lMIyNFUkEjCiNFWFBPU1RGQUNUT0lEIwojU0VFIyNBU1RPUiNQSVAKI1RSQU1QIyNFTE8jUEVJCiMjIyNWSURBI0xPV0VTVApBTUVSSUNBU0NVUElEIyMKU1BFQ0lBTEtJRCNMT0FOClNBUkEjUkVJTkUjTVVMRQpUQU9TI0RZTkVTI0FUSVQ="},{"title":"A \"S*M*A*S*H\" Hit, 12/9/02 (Monday)","author":"by Allan E. Parrish / Edited by Peter Gordon (puzzleeditor@nysun.com)","date":"2002-12-09","grid":"SkFXRUQjU1RPT1AjTEFXCkFMT05FI0NVUklPI09MRQpNSUtFRkFSUkVMTCNSQU4KIyMjI0FWT04jI0FHRU5UCkFTSEFNRUQjQ0FSRVQjIwpTUEFSRVMjU09DSUVUQUwKU09SRVMjTUlNRVMjQVBFCkVSUlMjUk9TRVMjQVNJQQpTVFkjUk9PU1QjU0VXRUQKU1lNTUVUUlkjQ0hPSUNFCiMjT1VOQ0UjQ0hBTlRFRApCQVJHRSMjR09BRCMjIyMKQUxHI1dBWU5FUk9HRVJTCklEQSNBSEVBRCNXQUdFUgpUQU4jTEFTVFMjU0xPTU8="},{"title":"NRA Members, 12/10/02 (Tuesday)","author":"by Ogden Porter / Edited by Peter Gordon (puzzleeditor@nysun.com)","date":"2002-12-10","grid":"REVBRiNBRlJJQ0EjRkFBCkFSTE8jQkxBREVTI0lMTApTSUxPI0JBWk9PS0FKT0UKSEVZVEhFUkUjI1NOSVRTCiMjI0JBU0UjVFdJTiMjIwpBU0lBTlMjVFVSTkFXQVkKUlVOVE8jVE9URSMjRUxPCk1BQ0hJTkVHVU5LRUxMWQpFVkEjI0FMQVMjSUdMT08KREVOVFVSRVMjQk9PU1RTCiMjI09OWVgjVEVTVCMjIwpFTElPVCMjV09SS1JPT00KUElTVE9MUEVURSNJUk1BCklNUCNMRUVSQVQjUEVFUApDT1kjRE9XRUxTI1NPTlM="},{"title":"Prefixation, 12/11/02 (Wednesday)","author":"by James P. Sharp / Edited by Peter Gordon (puzzleeditor@nysun.com)","date":"2002-12-11","grid":"RkFERSMjRk9QIyNBTUZNCkVYRUNTI0FMVU0jUklMRQpaRUJSQSNURVJJI0FYRUwKIyMjVU5JQ09STkJSRUFECkFEQSNSREEjI0dPQURTIwpDT05URVNUUElMT1QjIyMKSUJFQU0jI0VORSMjQ0ZDCkRJU0NPVU5URFJBQ1VMQQpTRVQjI05PUiMjTEFURVIKIyMjU1VCTElNRUdSRUVOCiNDTEFSTyMjT1dFI1JURQpQUk9GSUxFQ0xFUksjIyMKRUlSRSNUUk9UI0lOVUlUClJFTlQjU0FNRSNBSVNMRQpQUkFZIyNTT04jI1RBS0U="},{"title":"Wise Words, 12/12/02 (Thursday)","author":"by Todd McClary / Edited by Peter Gordon (puzzleeditor@nysun.com)","date":"2002-12-12","grid":"QUJCQSNERU1PUyNDQVNUCkRFQVIjUkFJVFQjQVJFQQpBTExJVEVSQVRJT05DQU4KTUlTREVBTFMjQ0hFU1RTClNFQSNBTVkjU0tJUyMjIwojIyNITVMjQ0xJTyNEVkQKQURJRVUjQlJJRSNFUklFClBST01QVExZUFJPRFVDRQpTQVdTI1JBUFMjTklHRVIKRVRBI1JFU1QjTVJUIyMjCiMjI0NPQVQjQk9BI0FIUwpTT1dIQVQjV0FSTUdMT1cKUFJFRU1JTkVOVFBST1NFCklDRVMjTklOSkEjQU5URQpUQVBTI0dBVE9SI0JFU1Q="},{"title":"Weekend Warrior, 12/13/02 (Friday)","author":"by Manny Nosowsky / Edited by Peter Gordon (puzzleeditor@nysun.com)","date":"2002-12-13","grid":"IyMjS05FRVNPQ0tTIyMjCiMjQk9PU1RFUlNIT1QjIwojV1JBUFBJTkdQQVBFUiMKVEhPTEUjT05JT04jTEVTCk9PTkEjU0xFRVQjQkVUSApNT1RTI0hBVFMjQ0FQUkEKQVBFI01VVFQjRkFUSE9NClRFU1RBVEUjR0VUU09SRQpPRElPVVMjRFJBVCNUT0wKUklTS1MjRE9FUyNWT0NFCkVUVEUjRUlMQVQjRUxLUwpEVUUjQUxMT1QjRlJFRVMKI1BSRVNTVVJFUE9JTlQjCiMjU0VOQVRFU0VBVFMjIwojIyNMT1NFU1RJTUUjIyM="},{"title":"Celebrity Hangouts, 12/16/02 (Monday)","author":"by Elizabeth C. Gorski / Edited by Peter Gordon (puzzleeditor@nysun.com)","date":"2002-12-16","grid":"R0ZMQVQjVlBTI1NBSkFLCkFMQU1PI0FMQSNDSE9SRQpTRVdFUiNHQU0jQVNIRVMKUEVOTlNUQVRJT04jTk5FCiMjI1NPWUJFQU4jUExBWQpVSEYjU0xPI01PWElFIyMKTE9VUyNFTkQjI0lOTkVSCkFNU1RFUkRBTUFWRU5VRQpOT1NFUyMjU0FDI1NPUkUKIyNCQVRPUiNJVEEjTk9EClNUVUQjWUVMTElORyMjIwpIQUQjRUxMSVNJU0xBTkQKRUxHQVIjQU1PI1dJTExBCkRJRUdPI1lPVSNFREdFRApTQVRFUyNTU1QjUkVBUlM="},{"title":"End Tables, 12/17/02 (Tuesday)","author":"by Sarah Keller / Edited by Peter Gordon (puzzleeditor@nysun.com)","date":"2002-12-17","grid":"TE9GVCNDT1JQUyNTQ0FUCk9QSUUjQUJPVVQjT0hJTwpMRUFOI05JVFRJI1JFTFkKSU5TVEFOVENPRkZFRSMjClRFQ0hOTyMjTkZMI1JBUApBRE8jRUxNTyNFQVNJTFkKIyMjU1dJTU1JTkdQT09MCkFMQUkjI0xJVCMjSVNFRQpIRUxMU0tJVENIRU4jIyMKTUFJVEFJI1NIQU0jTUFSCkVEUyNSVFMjI1NJTUlMRQojI1RSSUJPUk9CUklER0UKQ0lBTyNBRE9SRSNHTE9CCkFSSUQjR09PU0UjSEVSTwpNRVJFI1NJTU9OI1RSRUs="},{"title":"Take a Numeral, 12/18/02 (Wednesday)","author":"by Jay Sullivan / Edited by Peter Gordon (puzzleeditor@nysun.com)","date":"2002-12-18","grid":"TERPUEEjQ09NQiNNRUFMCkFSS0lOI0hBVUwjQkFCRQpQQVJUWSNPU0xPI1VUQUgKREJBVFRFUklFUyNUQVRBCiMjIyNJUkFTI1NJVFRFUgpPUFRJTUFMI0dPTkUjIyMKRFJBUEUjI1VOTUFSUkVECklPVEEjQ1BMVVMjRk9SQQpFTUlHUkFURSMjUExBTlMKIyMjTElSQSNQTEFZRE9ICkVST0lDQSNIRUFSIyMjIwpMRU5BI1ZGT1JNQVRJT04KRVBJQyNFUlJTI0RFTlNFCkNST0MjTEVOTyNPUkNBUwpUT05JI1NFRU4jWFJBWVM="},{"title":"Themeless Thursday, 12/19/02 (Thursday)","author":"by Myles Callum / Edited by Peter Gordon (puzzleeditor@nysun.com)","date":"2002-12-19","grid":"RkxVTUFESURETEUjSVRFClJPU0VTQVJFUkVEI01SUwpFTkRFQVJNRU5UUyNQT1MKVEVBSyMjQVJPU0UjUllFCiMjIyNQQVMjI0xMQkVBTgojQ1VURVgjVEhJU0lTSVQKTUVOQUNFI0hBUCNTQUtJCkNMQU1TI0RPRyNOT1JNQQpBSU5UI1NBTiNERU5JQUwKVU5DQVJJTkcjT1JTT04jCkxFSE1BTiMjREVGIyMjIwpJRE8jTkFOQ0UjI1dPTUIKRklSI1NURUVMR1VJVEFSCkZPRSNPUkFMSElTVE9SWQpFTkQjTUFSVElOU0hFRU4="},{"title":"Three in a Row, 12/20/02 (Friday)","author":"by Ogden Porter / Edited by Peter Gordon (puzzleeditor@nysun.com)","date":"2002-12-20","grid":"U09UUyNBTEJVTSNBQ0lECkFDUkUjTU9SU0UjV0FORQpUQVVUI1BSRVNTQ09SUFMKQVJNSE9MRVMjT09MQUxBCk5JUCNSRUxMRU5PI1ZBTApJTkVQVCNFSU4jI1BBQ1QKQ0FUSEVSSU5FWkpPTkVTCiMjI0FHRSMjI0VJTCMjIwpET0VTQUxMT0ZUTEtJTkcKQUNORSMjT1VSI1RBVEVSClNFQSNQUk9URUdFI1NURQpCQU1CT08jU0VFRENBU0UKT05FQVRBVElNRSNBQlVUCk9JTFMjTUlEQVMjUE9LRQpUQVNLI1NDRU5FI0VZRUQ="},{"title":"The Spirit of the Season, 12/23/02 (Monday)","author":"by Alan Olschwang / Edited by Peter Gordon (puzzleeditor@nysun.com)","date":"2002-12-23","grid":"U1BBQ0UjRkxJVCNKT0tFCk5JWE9OI0xBRFkjQU1JRApBVEVBVCNBU0FQI1ZJTEUKUEFTU0lOR1RIRUJBVE9OCiMjI1RSWSMjT0FSIyMjIwpTVFkjRUxTQSNCSU5EVVAKUFJFSyNPSUxTI05PSVNFClJVTk5JTkdUSEVHQU1VVApBQ1RPUiNIT1VSI0hFQVQKVEVBQkFHI1NUQUcjU0xZCiMjIyNRVU8jI1NFWiMjIwpLSUNLSU5HVEhFVElSRVMKSVJPTiNHTEVFI1NQQVRFCldBVkUjSEVOUyNUVVJPVwpJU0VFI09ERFMjT1BFTlM="},{"title":"Ya Gotta Believe, 12/24/02 (Tuesday)","author":"by Ogden Porter / Edited by Peter Gordon (puzzleeditor@nysun.com)","date":"2002-12-24","grid":"WE1BUyNVRk9TI0FMSUNFClJJREUjTkVNTyNSQU5BVApBTU9SI1dJTk8jRVhUUkEKWUVTVklSR0lOSUEjUkJJCiMjI0lSQU4jI01SQ09PTApHQVNDQVAjTU9QVVAjIyMKUlVMRSMjUkFSRUdBU0VTCklETyNUSEVSRUlTI0xBUApUSVBTSEVFVFMjI0JVUlIKIyMjSEVBTFMjU01VR0xZCkxBTUVOVCMjU0VBTCMjIwpFTEkjQVNBTlRBQ0xBVVMKVE9YSU4jTU9BVCNEVVNUClVOSU9OI1BFVEUjT1JFTwpQRU5OWSNTTEVEI0dBUlA="},{"title":"Boxing Day, 12/26/02 (Thursday)","author":"by David J. Kahn / Edited by Peter Gordon (puzzleeditor@nysun.com)","date":"2002-12-26","grid":"U0VXTiNBQkFTSCNCQUdTCkNMSU8jSEVMTE8jVUxMQQpISU5UI1NBTEFEI05FRUQKTUFESVNPTlNHQVJERU4jCk9OTE9XIyMjI0RFTCMjIwojI0FOQURFTVMjTUVTVEEKVEJTI01FRElDUyNVVEVTCldBU0hJTkdUT05TUEFSSwpJS0VBI1RBUlRBUiNUSVMKVEVTTEEjUkVTUE9LRSMjCiMjI0ZSTyMjIyNPQVNJUwojVElNRVNTRElTVFJJQ1QKWkVSTyNBUEFDRSNBREFZCkVMTU8jR0VORVQjVEVOTgpFTEFOI0VHQURTI0VSVEU="},{"title":"Weekend Warrior, 12/27/02 (Friday)","author":"by Patrick Berry / Edited by Peter Gordon (puzzleeditor@nysun.com)","date":"2002-12-27","grid":"RkxPV0NIQVJUI0dPRkFSCkxJUFJFQURFUiNBUk9TRQpJTlRFUkxPUEUjTUFSSVMKRURJQ1RTI0VOVEVORFJFClNBQ0tTI0JBQ09TI1BFVAojIyMjI0xJVEhFI1BJQ1QKQ0hST05JQ1MjU1BJTkFMCkxFQURJTlMjV0hJU1RMRQpVTlJPQkUjVE9PS0hPTEQKQlJFUiNBV09LRSMjIyMjCkNJRyNHUkFTUyNDT0JSQQpIRUFUTEFNUCNNQU5VQUwKQVRTRUEjUEFQQVJBWlpJCklURU1TI1VSQkFOSVpFUwpSQVNQUyNNRVNNRVJJU1Q="},{"title":"Foodies, 12/30/02 (Monday)","author":"by Sarah Keller / Edited by Peter Gordon (puzzleeditor@nysun.com)","date":"2002-12-30","grid":"UkFCQkkjU1BMSVQjUlVUCk9STE9OI1FVQUtFI0VSQQpCRUFOQ09VTlRFUiNTQVgKIyNDRUFTRSMjQVJNQU5JCkFTS1MjTEFNUCNZQUxJRQpNQVQjU09MT0VEI1JFQUQKQVJPU0UjI1RBQ0lUIyMjCiNBUFBMRVBPTElTSEVSIwojIyNBRlRFUiMjUEFORVMKRVJJQyNEUkVTU1kjVEJBClNBVEVEI0lET0wjRFJBRwpUSUNLRVQjI0RFTElBIyMKQVNII0JSRUFEV0lOTkVSClRJRSNUSVRMRSNMQUNFWQpFTlMjU1BBSU4jVEhFUkU="},{"title":"Happy New Year!, 12/31/02 (Tuesday)","author":"by Ogden Porter / Edited by Peter Gordon (puzzleeditor@nysun.com)","date":"2002-12-31","grid":"Q0xVQkNBUiNPUFQjRUxPCkFJUkxBTkUjT1JBI1lJTgpQRU5BTFRZU0hPVCNFTkUKIyMjQ1NJI0VTU0VOQ0VTClBBQ0sjQ0RJI1BSRUFNUApFWEFDVCNJTkdFI09SRU8KUkVQQVkjU0xVUiNTRU5UClVTRVVQI0NBTk9QWSMjIwojIyNMRUdFTkQjQU5OVUwKQVRBRCNBUkdPI1NFSVpFCkRPVVIjU05VRyNTUExJVApBU1RPUlMjQVNTI0hFU1MKUEhPTkVUQUcjQVBSIyMjClRJUCNGT1JFU1RISUxMUwpPQlMjRVZBI1JBSU5PVVQKUkFZI1JFQiNPTkxFQVZF"}]}