{"id":"newsday-2010","publication":"newsday","year":"2010","count":417,"puzzles":[{"title":"1/01/10 SPORTS BREAK","author":"Shirley Soloway, edited by Stanley Newman","date":"2010-01-01","grid":"Sk9JTiNJRExFI0xPUkRTClVOVE8jQ1JVWCNBQ0VJVApTUEFOI0hBU1AjSUFNU08KVEFST1QjV0hJUENSQUNLCkFSVCNPREQjUkVTSURVRQpGQUEjUk9PRkVSI05FU1MKRURTI0lPV0EjVVNBIyMjCldFU1RFUk5ESVZJU0lPTgojIyNPU1MjRU5JRCNOUkEKUklDQSNUQVNNQU4jQ0lWCk9OQURJRVQjT05FI0hFWQpCQUJZU1BMSVQjWUFXTlMKRVRBSUwjQVNJQSNET1RFClJJTlNFI1NQT1QjQVJFQQpURUFNUyNUWU5FI01NREw="},{"title":"1/02/10 SATURDAY STUMPER","author":"Anna Stiga, edited by Stanley Newman","date":"2010-01-02","grid":"U1VSUFJJU0VNRSNQRUdTClVOT1JJR0lOQUwjUkFSRQpDQU1FTE9QQVJEI0VSSU4KQ1JBVEVSI01BRSNBVE1TCkVNSVRTI1BFVFJVQ0hJTwpFRU5ZI0pVTCMjU0hFRVIKRERFI0hVTiNPSEhFTlJZCiMjI1NBTksjQkVFUiMjIwpQTEFRVUVTI09BUiNET1IKUkVSVU4jI0dFTCNIRVJPCkVBVEFUSk9FUyNDT0xEUwpTS0lUI0FMVCNCT09URUUKVEFDVCNESVNDT01GT1JUCk9HTEUjRVZJTFNQSVJJVApORUVSI1NFVElOU1RPTkU="},{"title":"01/03/10 SQUARE ROUTES: Nine well-known ways","author":"Robert H. Wolfe, edited by Stanley Newman","date":"2010-01-03","grid":"SE9TVFMjIyNCQVRIRSMjQklHV0lHCkFNT1JBTCNDRVJFQUwjT1VUUkFHRQpNQURJU09OQVZFTlVFI0FCU0FMT00KU05BRyNUT05ZI1NORVJUI01JTFQjCiMjIyNTSVJFI0JJQyNJTVBFTFMjIwojQ1VTVE9NI0JZVEhFU0VBIyNUQlMKVElOUEFOQUxMRVkjTkVBUiNDUk9QClVEREVSIyNPQVMjQ0FVTEsjSEVNSQpORUVEI1BBVEgjQlVNUCNQSE9FQkUKRVJSI1NFUFQjVE9URSNBTEVSVEVECiMjI1NVTlNFVEJPVUxFVkFSRCMjIwpBSVJMSU5FI1JBU1AjUklDRSNDTFYKU05PT1RZI0tVUlQjUklERSNNQVVJCkhJREUjTEVFRFMjVElDIyNET05ORQpPTkVTI0FMRUcjVE9CQUNDT1JPQUQKVEtPIyNOSU5FVElFUyNIQU5LRVIjCiMjREFSRVRPI0VMUyNHSVJUIyMjIwojT1JFTyNJTlNFVCNTT0xPI0FMREEKU1BJR09UUyNDSElTSE9MTVRSQUlMClJFVklTSVQjVEVOUElOI1NBSUROTwpBREVTVEUjI1ZFR0FOIyMjUEFZRUU="},{"title":"01/03/10 SQUARE ROUTES: Nine well-known ways","author":"Robert H. Wolfe, edited by Stanley Newman","date":"2010-01-03","grid":"SE9TVFMjIyNCQVRIRSMjQklHV0lHCkFNT1JBTCNDRVJFQUwjT1VUUkFHRQpNQURJU09OQVZFTlVFI0FCU0FMT00KU05BRyNUT05ZI1NORVJUI01JTFQjCiMjIyNTSVJFI0JJQyNJTVBFTFMjIwojQ1VTVE9NI0JZVEhFU0VBIyNUQlMKVElOUEFOQUxMRVkjTkVBUiNDUk9QClVEREVSIyNPQVMjQ0FVTEsjSEVNSQpORUVEI1BBVEgjQlVNUCNQSE9FQkUKRVJSI1NFUFQjVE9URSNBTEVSVEVECiMjI1NVTlNFVEJPVUxFVkFSRCMjIwpBSVJMSU5FI1JBU1AjUklDRSNDTFYKU05PT1RZI0tVUlQjUklERSNNQVVJCkhJREUjTEVFRFMjVElDIyNET05ORQpPTkVTI0FMRUcjVE9CQUNDT1JPQUQKVEtPIyNOSU5FVElFUyNIQU5LRVIjCiMjREFSRVRPI0VMUyNHSVJUIyMjIwojT1JFTyNJTlNFVCNTT0xPI0FMREEKU1BJR09UUyNDSElTSE9MTVRSQUlMClJFVklTSVQjVEVOUElOI1NBSUROTwpBREVTVEUjI1ZFR0FOIyMjUEFZRUU="},{"title":"01/04/10 VARIETY PACK","author":"Gail Grabowski, edited by Stanley Newman","date":"2010-01-04","grid":"Q0FQT04jUkFURSNUUkFNCkFTSURFI0lDT04jWVVMRQpLSU5EV0lTSEVTI1BFT04KRVNFI1lPS0UjTkVFREVECiMjI1NPTlMjSEFVTCMjIwpBQ1RPUlMjQ09SUkVDVCMKU0hJUksjUEFMRSNURUFNClNFQVQjI0FSRSMjVEFMRQpOQVJDI09SQlMjUEVTT1MKI1RBTEVOVFMjU0lSRU5TCiMjI09SRVMjV0FSUyMjIwpNQU5UUkEjSElZQSNIT1AKVUhPSCNDTEFTU1RSSVBTClRPVEUjUkFSRSNFQVZFUwpFWUVTI0VXRVIjU1BFTlQ="},{"title":"01/05/10 DECADE STARTERS","author":"Sally R. Stein , edited by Stanley Newman","date":"2010-01-05","grid":"U0FGRSNTTElNI0FEQVBUClBMRUEjVEFEQSNET1VTRQpVU0VSI09QRU4jU1VEQU4KRE9MTEFSREFZUyNCSUxMCiMjIyNXWU8jI0FQTE9NQgpHUkFERSNHT0FMSUUjIyMKUk9CT1RTI0FCQU5ET05TCkFNRU4jSEFURUQjQVJJQQpTRVRBU0lERSNTQVRJTlMKIyMjTE9ORVJTI1ZFR0FTClNBRERMRSMjQUxJIyMjIwpBR0VEI0RJU0hFU0RJUlQKVkFMVUUjU1BBTiNBUkVBCkVQSUNTI0xBUkQjVEFORwpERVNLUyNFUkFTI0FOVFM="},{"title":"01/06/10 CARDINAL PRINCIPLE","author":"Fred Piscop, edited by Stanley Newman","date":"2010-01-06","grid":"R0FGRkUjTUlFTlMjU0hZCkFMSUVOI0FMTEFII1RPRQpTVFJFVENITElNTyNFVEEKSE9TVElMRSMjI1VQUEVSCiMjIyNDT1JFI1NUQUxMUwpMQVNIRUQjTUFMQVdJIyMKQU5URVMjTElDSVQjVklNClJPQU4jVE9ORUQjR0VORQpBTk4jVklORVMjREVMVEEKIyNMRUFERU4jUkVMWU9OCkdSQU5OWSNUUkFQIyMjIwpST1VTRSMjI0FUQUxPU1MKQVBSI1NUUk9CRUxJR0hUClZFRSNTQVVESSNNQVJJQQpZU0wjQUNURUQjQVJFTlQ="},{"title":"01/07/10 FIND THE FILMS","author":"David W. Cromer , edited by Stanley Newman","date":"2010-01-07","grid":"RUxFQ1QjTkFQRVMjVEFQCkxFTVVSI0VMSVRFI0FOSQpNSVNTSU5HSU5BQ1RJT04KIyMjSE9ZQSMjI1NFUElBClBPTlkjU1RPTVAjUkVOVApFV0UjS0VFUEVSI1JJVEEKQUxJQkkjI0VOT0xBIyMjCiMjTE9TVElOU1BBQ0UjIwojIyNCU0lERSMjV0VBUlMKQlVTSCNQRVJTT04jU1VFClVOVE8jU0FTSEEjVEVOVApEUk9QUyMjI09UVE8jIyMKR09ORVdJVEhUSEVXSU5ECklMRSNBUlVCQSNBSURFRApFTFMjQkVHT1QjU1RPV1M="},{"title":"01/08/10 SILENT RUNNING","author":"Adam Cohen , edited by Stanley Newman","date":"2010-01-08","grid":"QVRBVCNNQVlPI0FQUExFCkxPVkUjQU5FVyNDQU5PRQpQVEFSTUlHQU4jTVlFWUUKSEFTS0VMTCMjUEVSVSMjCkFMVEVSI09TTE8jQU1UUwojIyNMSVYjQ0FQRVRPV04KQU1QI1RIUkVXI0dFTklFCk5PSCNQRkVOTklHI0lOQQpHT1RUQSNWRVNUUyNBU0sKU0NIVVlMRVIjU0FTIyMjClRIQVQjU0xZRSNMRU5UTwojI0xPVVQjI01FQURPV1MKUVVBUksjUFNFVURPTllNCkVTVEVFI0hFUlIjTk9MQQpERUVEUyNEQVlPI0FTQU4="},{"title":"01/09/10 SATURDAY STUMPER","author":"Jeffrey Wechsler, edited by Stanley Newman","date":"2010-01-09","grid":"U1RSQUdHTEUjVElUVEVSCkNIQU1PTklYI0lOVkFERQpSRURNQVBMRSNFRkFYRVMKQVJJQUwjI1JFQkEjSVJBClBFT04jUkFDSUFMI0VMSQpQSUUjVU5ESVNDTE9TRUQKRUdSRVNTRVMjS0lNIyMjClJPQVJTI05FVyNCSURFTgojIyNPQVMjUkVBTFRJTUUKSElUU1JFVkVSU0UjVklBCk9ORSNJTUFHRVMjUEFSVApUU0EjWklUSSMjVkVHQU4KQ09NTU9OI01BUklOQVRFCkFMVU1OQSNFRFVDQVRFUwpSRVBFQUwjTkFNRUxFU1M="},{"title":"01/10/10 SPLIT PERSONALITIES: With 137 Across in common","author":"Bruce Venzke, edited by Stanley Newman","date":"2010-01-10","grid":"QUxHI09OTyNTQ0VORVMjU09SRVNUClJPQURIT0cjQ0FTVExFI1RIT1JQRQpJTkxJTUJPI0FSQ0hJRUdPT0RXSU4KQUdFUyNJRE9MIyMjVFJFSyNUSUxUCiMjR1VORyNKRVRBR0UjUkVDQU5UUwpHT09TRUdPU1NBR0UjQkVSUlkjIyMKUkFSRUJJVCMjVE9OR0EjI0FMT05FCkVURCNSRUJTIyNHRU9SR0VHT0JFTApUSE9OIyNTS0lEIyNPTkVMI1JPTUEKQVNORVcjI0lSSVNII0RPTUUjRU9OCiMjI0VWT05ORUdPT0xBR09ORyMjIwpEU0wjQUxBTiNTVEVJTiMjRFVFVFMKT1dFRCNFVFlNIyNERUNPIyNOWUVUCkpBTkVHT09EQUxMIyNFUFBTI0ROQQpPQkFNQSMjSUxJQUQjI1RVSVRJT04KIyMjQUdBU1AjUlVCRUdPTERCRVJHCkxVR0dBR0UjU0VEQU5TI0xFT0cjIwpPU0xPI0FST08jIyNFQVNUI05PRVMKVEhFR09WRVJOQVRPUiNQQUxFUk1PClRFTlVSRSNDWUJPUkcjQUJZU01BTApBUk5FU1MjSEFSVkVZI1RTRSNFR08="},{"title":"01/10/10 SPLIT PERSONALITIES: With 137 Across in common","author":"Bruce Venzke, edited by Stanley Newman","date":"2010-01-10","grid":"QUxHI09OTyNTQ0VORVMjU09SRVNUClJPQURIT0cjQ0FTVExFI1RIT1JQRQpJTkxJTUJPI0FSQ0hJRUdPT0RXSU4KQUdFUyNJRE9MIyMjVFJFSyNUSUxUCiMjR1VORyNKRVRBR0UjUkVDQU5UUwpHT09TRUdPU1NBR0UjQkVSUlkjIyMKUkFSRUJJVCMjVE9OR0EjI0FMT05FCkVURCNSRUJTIyNHRU9SR0VHT0JFTApUSE9OIyNTS0lEIyNPTkVMI1JPTUEKQVNORVcjI0lSSVNII0RPTUUjRU9OCiMjI0VWT05ORUdPT0xBR09ORyMjIwpEU0wjQUxBTiNTVEVJTiMjRFVFVFMKT1dFRCNFVFlNIyNERUNPIyNOWUVUCkpBTkVHT09EQUxMIyNFUFBTI0ROQQpPQkFNQSMjSUxJQUQjI1RVSVRJT04KIyMjQUdBU1AjUlVCRUdPTERCRVJHCkxVR0dBR0UjU0VEQU5TI0xFT0cjIwpPU0xPI0FST08jIyNFQVNUI05PRVMKVEhFR09WRVJOQVRPUiNQQUxFUk1PClRFTlVSRSNDWUJPUkcjQUJZU01BTApBUk5FU1MjSEFSVkVZI1RTRSNFR08="},{"title":"01/11/10 WINTER FUN","author":"Billie Truitt, edited by Stanley Newman","date":"2010-01-11","grid":"R1JJUCNQQURTI0FDQ1RTCkVBU0UjQUZFVyNTSE9VVApUSUxUI1RBTEUjU0FOVEEKU0xFSUdIUklERSNJR09SCiMjI1RJUyMjRU5TTkFSRQpSSVNFUyNCT05HT1MjIyMKT09IIyNCQVIjSVNBQUMjCkJVSUxESU5HU05PV01FTgojU1BFQUsjQVRFIyNNT08KIyMjRlJJRU5EI0JPT1NUCkZBU1RFTlMjI1NBVCMjIwpBTFRPI0lDRVNLQVRJTkcKU0xBVlMjQUNUSSNBUkVBClRPVEVTI1BPRVQjV0FTUApTVEVSTiNFTE1TI0FOVFM="},{"title":"01/12/10 AGAINST ALL ODDS","author":"Gail Grabowski, edited by Stanley Newman","date":"2010-01-12","grid":"QUREUyNTRUFNI0NVUElECk1FQVQjRU5WWSNBTk9ERQpNQVJFI0VWRU4jVklPTEEKT05FV0FZT1JBTk9USEVSCiMjIyNEQVkjI09SRSMjIwpMQVNTTyMjUkFGVCNXSVQKQVNUSVIjSFVMQSNMQU5FCldIQVRFVkVSSVRUQUtFUwpORVRTI05FQVQjT1ZFUlQKU1NFI0JFTEwjI1BBTlRTCiMjI0hPQyMjQUxJIyMjIwpCWUhPT0tPUkJZQ1JPT0sKTE9PUFMjU09BUiNFREdFCk9XTEVUI0xBVEUjRklSRQpCTEVTUyNPREVTI1NFRVA="},{"title":"01/13/10 PARK IT","author":"Fred Piscop, edited by Stanley Newman","date":"2010-01-13","grid":"QUREVVAjU0NSQU0jU0xSCkJPTlpPI0NPTkdPI1RFQQpDSEFJUlBFUlNPTiNPQVQKIyMjI1RPTkUjI1RST1ZFCkNBQklORVQjRVhIQUxFRApBUkVOT1QjQUNFU1VQIyMKUEVOTlkjRElPUiNMSVJBCkVOQyMjSE9STlMjI0dJTgpEQUhMI09MRU8jVEhFRlQKIyNXQUlMRUQjQ1JFT0xFClNUQUxMRUQjU0hVTk5FRApNVVJBTCMjU1RFTSMjIyMKSUJNI1NFQVRPRlBPV0VSCkxFRSNFTE1FUiNVTklUWQpFUlIjRUxJVEUjUEVOQ0U="},{"title":"01/14/10 CHILD'S PLAY","author":"Doug Peterson, edited by Stanley Newman","date":"2010-01-14","grid":"Q0xPQUsjSkFWQSNJUktTCk9VTkNFI09MSU4jV0FJVApPQ0VBTiNZSVBTI0FORFkKUFJBQ1RJQ0VTV0lOR1MjClNFTUkjREVOI0VOVCMjIwojIyNBUFQjI1BSQVlTVE8KQU5UI0VBU0VMI1dPT0VSCkJBR0dBR0VDQVJPVVNFTApFTUlSUyNUT05FUiNBTVkKREVGRUFUUyMjQUREIyMjCiMjI0VOViNTQVAjRVRBUwojTEVUVEhJTkdTU0xJREUKTUlESSNPRE9SI1BVUElMCk9NRU4jU0xPRSNBWElPTQpQT05HI1RZUEUjTUVOU0E="},{"title":"01/15/10 EIGHT STEPS","author":"Merle Baker, edited by Stanley Newman","date":"2010-01-15","grid":"SkFGRkEjQVpURUMjREVQCk9MTEFTI0RJRUdPI1VNQQpCTEFDS0JPVFRPTSNMSVYKU1lNI0VFUklFI1BBVUxBCiMjRU1ERU4jI0FVU1RJTgpXRU5UT04jU09GVFNIT0UKREVDQUYjSUxMQkVUIyMjClNMTyMjQU1JRVMjI0hBRAojIyNBSVJJTkcjR0VPREUKQ0xPR0dJTkcjS1VEUk9XCkhPVE9ORSMjU0hBVU4jIwpBTUlHTyNPU0NBUiNQR0EKQ1BPI0JVQ0tBTkRXSU5HCkhPUyNMQVRJTiNFWFBBVApBQ0UjWUVBU1QjRFlFUlM="},{"title":"01/16/10 SATURDAY STUMPER","author":"Barry C. Silk , edited by Stanley Newman","date":"2010-01-16","grid":"QkFTU0VUI1dBU0hBQkxFCklOSEFMRSNJTlRFUlJPUgpTTk9XSU4jU1RBUlRVUFMKUVVBTlRVTVBIWVNJQ1MjClVBTCNFUkFTRVMjI0VJTwpFTFMjRUVLI01VRCNMREwKIyMjU0lERUEjUFVSRUVEClNUQUdHI1JEUyNTVUVERQpZT1VUSFMjWkVTVFkjIyMKTUlUI1RJTCNSQUojVElTClNMTyMjR09ESVZBI0FERQojU0NJRU5DRUZJQ1RJT04KQ09STk1FQUwjT0tBUElTCkFNQVJFVFRPI1JFTUFERQpQRVRFUlNFTiNTVEVOT1M="},{"title":"01/17/10 WALTZ TIME:  Tunes in three-quarter time","author":"Fred Piscop, edited by Stanley Newman","date":"2010-01-17","grid":"QVRCQVkjQVdFUyNTSE9FI0FNUExFCkFSRU5BI1BBTEwjSE9XTCNTT0xPTgpISUxJTElISUxPI0FOTklFU1NPTkcKIyMjTUVSSVQjVFlSRVMjRFVIIyMjClVOVEFNRUQjIyNPS0QjV0lSRVRBUApUT0lMRSMjU1RBRyMjVE9URSNSREEKSUJNI05PUldFR0lBTldPT0QjWURTCkNFRSMjU0hPTkUjRkxFRVIjUFRBUwpBTEkjU01JUksjQ1JFRUQjVEhPTSMKI1NOT0NPTkUjQ0hBUlQjQk9PUlMjCiMjQUxPTkUjU0xJTVMjQkVSTkUjIwojVEJJUkQjU0hPVkUjVE9NVE9NUyMKI1JPVkUjU0hBVkUjU1VaSUUjRUVMCkxVVEUjTU9PUkUjQUFST04jI01DQQpFTVQjU1VOUklTRVNVTlNFVCNCVU0KR0FMI1BTQVQjI0RBRFMjI09QRVJBCk9ORVBBSVIjU0hFIyMjREVTSVJFUwojIyNFVEEjU1RPTkUjTk9MVEUjIyMKU0NIT09MREFZUyNUSEFUU0FNT1JFCktFQU5VI0FCTEUjVE9NRSNEQUZPRQpBTElTVCNIVUVTI0FQRUQjQU5UT04="},{"title":"01/17/10 WALTZ TIME:  Tunes in three-quarter time","author":"Fred Piscop, edited by Stanley Newman","date":"2010-01-17","grid":"QVRCQVkjQVdFUyNTSE9FI0FNUExFCkFSRU5BI1BBTEwjSE9XTCNTT0xPTgpISUxJTElISUxPI0FOTklFU1NPTkcKIyMjTUVSSVQjVFlSRVMjRFVIIyMjClVOVEFNRUQjIyNPS0QjV0lSRVRBUApUT0lMRSMjU1RBRyMjVE9URSNSREEKSUJNI05PUldFR0lBTldPT0QjWURTCkNFRSMjU0hPTkUjRkxFRVIjUFRBUwpBTEkjU01JUksjQ1JFRUQjVEhPTSMKI1NOT0NPTkUjQ0hBUlQjQk9PUlMjCiMjQUxPTkUjU0xJTVMjQkVSTkUjIwojVEJJUkQjU0hPVkUjVE9NVE9NUyMKI1JPVkUjU0hBVkUjU1VaSUUjRUVMCkxVVEUjTU9PUkUjQUFST04jI01DQQpFTVQjU1VOUklTRVNVTlNFVCNCVU0KR0FMI1BTQVQjI0RBRFMjI09QRVJBCk9ORVBBSVIjU0hFIyMjREVTSVJFUwojIyNFVEEjU1RPTkUjTk9MVEUjIyMKU0NIT09MREFZUyNUSEFUU0FNT1JFCktFQU5VI0FCTEUjVE9NRSNEQUZPRQpBTElTVCNIVUVTI0FQRUQjQU5UT04="},{"title":"01/18/10 DR. KING DAY","author":"S.N., edited by Stanley Newman","date":"2010-01-18","grid":"U0xBVEUjR0FMUyNCQU5EClRBUEVEI0VESVQjQUxPRQpBTU9ORyNOQU1FI0dPTkUKQkFQVElTVE1JTklTVEVSCiMjI1NFVyMjVE9NIyMjIwpQU1QjUk9PRiNTQUlMRUQKQVVSQSNSQklTI0dST1ZFClBSRVNJREVOVFJFQUdBTgpBR0FJTiNZRUFII1NPRFMKU0VEQU5TI0RST1AjU0VFCiMjIyNFTVQjI0RJRyMjIwpIT05PUkFSWURFR1JFRVMKQU1JRCNSRUFSI0xJQlJBCkxFTkQjVEFMRSNFTUFJTApPTkVTI1NURVcjVEVORVQ="},{"title":"01/19/10 THAT'S A YES","author":"Gail Grabowski, edited by Stanley Newman","date":"2010-01-19","grid":"TEFNUCNTVEFSI1NQT1JUCkFSSUEjUEFQQSNUQUJPTwpVUk5TI0FYRVMjQVRPTEwKRE9DUyNSSUdIVEZJRUxEClNXRUVUUyMjI1VGTyMjIwojIyMjUkVQT1JUUyNTUEEKQVdHRUUjQUJVVCNQT09MCkNPUlJFQ1RBTUlTVEFLRQpFVkVTI0FUTU8jSEFSRVMKU0VXI0RSWUFSRUEjIyMjCiMjI1JFRyMjI1JIWU1FUwpUUlVFVE9GT1JNI01BTEUKU0VSVkUjQUxBSSNDUlVYClBBR0VTI1JFSU4jQUlERQpTTUVMVCNNT0xFI1NFRVM="},{"title":"01/20/10 HAPPY ENDINGS","author":"Norma Steinberg, edited by Stanley Newman","date":"2010-01-20","grid":"R0VFSyNFTUNFRSNDTURSCkFOTkUjREVBTFQjQUFSUApMQVNUSFVSUkFII1NIQU0KQUNVVEUjRVRUQSNUQUdTClNURUxMQSNTRU5JT1IjIwojIyNFTExTIyMjRFJBTUEKQVJUUyNMRVRTQkUjSkFNCkRPSCNTSU5BVFJBI0FURQpBUEUjRU5UUkVFI1dIRU4KTUVDQ0EjIyNQRVJJIyMjCiMjQVJNQU5JI0RPVFRJRQpCQVNFI01JTlQjU0hPUlQKRUxCQSNNRVRIVVNFTEFIClRFQU0jQUNSRVMjUkVORQpBQ0hZI05FT05TI1NUSVI="},{"title":"01/21/10 DIVIDE AND CONQUER","author":"Doug Peterson, edited by Stanley Newman","date":"2010-01-21","grid":"RkpPUkQjQUJCSUUjV0hPClJVUEVFI0JST05DI1JFWApPTElWRUJSQU5DSCNFUkUKTklOI1BMQU5LI09SU09OCkRPRVNTTyMjI0JFSVQjIwojIyNMSUNLRVRZU1BMSVQKQk9TT1gjRVhBTSNTSVJFCkFDVFYjUEFJR0UjSU5LUwpXSE9BI0FDTFUjQU5HU1QKTE9PS1NUSEVQQVJUIyMjCiMjRElORSMjI1NUT1BCWQpLQVVBSSNIQUlUSSNFQVUKQUxQI1BMQVNUSUNGT1JLCk9BVCNFRVJJRSNMSU5HTwpTTk8jU1RFQU0jRUJTRU4="},{"title":"01/22/10 BURIED TREASURE","author":"Richard Silvestri, edited by Stanley Newman","date":"2010-01-22","grid":"U1RBQiNGQVRTI1BMQVpBCklBR08jTE9VVCNSQVZFTgpQTEFOI0FOTkEjQUdFTlQKU0NSVUJZRUFSTFkjIyMjCiMjI1NURSMjU0xFTkRFUgpQRUEjRUREQSNPUklPTEUKRVhUUkEjQVdBWSNDTEFQCkVQSEVNRVJBTERBSExJQQpWRUVTI0xFU1MjTEVBTlMKRVJOQU5JI0hPUkEjUkVUClNUQVRVVEUjI1VNQSMjIwojIyMjTUVESUFNT05EQVkKU1FVQUIjR09SUCNHT1JFCk9VTkNFI0VUQUwjRVZJTApQQUNFUiNEQUxFI1JFQUw="},{"title":"01/23/10 SATURDAY STUMPER","author":"Merle Baker, edited by Stanley Newman","date":"2010-01-23","grid":"QVNTT1JUI1BSRUFDSEVEClNPSVJFRSNDT01QUklTRQpUVVJCQU4jVE9JTEVUVEUKT1JFSURBI1NUUkVBTUVECiNJTlRFTlQjWUFOS0VFUwpJTlNFUlRFRCNUVFkjIyMKSUdPUlMjUE9TRVkjSElTCklPTlMjRElWQVMjRlVOVApJTkcjQUlERVMjTUFOTkEKIyMjTUlHI1JIRkFDVE9SCkFCSlVSRVMjQU9SVElDIwpUUlVTVFNUTyNTQ09ORVMKUkFLRUlUSU4jU09JR05FCkFWRVJNRU5UI0lORFVDRQpQQVNTRURHTyNMSVNQRUQ="},{"title":"01/24/10 TWO'S COMPANY: Famous pairs","author":"David W. Cromer, edited by Stanley Newman","date":"2010-01-24","grid":"UklCI0FCQ0QjTEVUVVAjI1NBREQjCkVSQSNIQVJJI0FDVVJBI1NUUkVFVApCQVRNQU5BTkRST0JJTiNUUkVOQ0gKQVNIRSNLTkVBRCNBU0EjUk9TSUxZCiMjI0VUUkUjTEVJIyNNQUlMI1NBTQpCSVNUUk8jTEVSTkVSQU5ETE9FV0UKQVJDI0VMTEUjI0NSTyNURUVOIyMjCkxBVVJFTEFOREhBUkRZIyNESVNDTwpERUJVVCNXQVJZIyNTRU1JI0NVUkwKIyNBR09SQSNFTVQjI0xFVFRFUkVECkFUVCNQRU5OQU5EVEVMTEVSI0NEUwpST0FEU0lERSMjU0FMI0lNQUdFIyMKQVJORSNOQVNBIyNDTEFOI0RJQU5BClRJS0lTIyNTTUlUSEFORFdFU1NPTgojIyNHUEFTI0lOSyMjVEFPUyNFRU4KQkFSTkVTQU5ETk9CTEUjUklERExFCkFURSNBU1RPIyNTUk8jVVNOQSMjIwpTVFJJS0UjTkFHI0FCQVNFI0xBTUEKVEVBU0VTI0NVUlJJRVJBTkRJVkVTCkVOVEVSUyNPUklPTiNBR0VEI0lNUAojREVFUyMjTUFORVMjQkVEUyNET1M="},{"title":"01/24/10 TWO'S COMPANY: Famous pairs","author":"David W. Cromer, edited by Stanley Newman","date":"2010-01-24","grid":"UklCI0FCQ0QjTEVUVVAjI1NBREQjCkVSQSNIQVJJI0FDVVJBI1NUUkVFVApCQVRNQU5BTkRST0JJTiNUUkVOQ0gKQVNIRSNLTkVBRCNBU0EjUk9TSUxZCiMjI0VUUkUjTEVJIyNNQUlMI1NBTQpCSVNUUk8jTEVSTkVSQU5ETE9FV0UKQVJDI0VMTEUjI0NSTyNURUVOIyMjCkxBVVJFTEFOREhBUkRZIyNESVNDTwpERUJVVCNXQVJZIyNTRU1JI0NVUkwKIyNBR09SQSNFTVQjI0xFVFRFUkVECkFUVCNQRU5OQU5EVEVMTEVSI0NEUwpST0FEU0lERSMjU0FMI0lNQUdFIyMKQVJORSNOQVNBIyNDTEFOI0RJQU5BClRJS0lTIyNTTUlUSEFORFdFU1NPTgojIyNHUEFTI0lOSyMjVEFPUyNFRU4KQkFSTkVTQU5ETk9CTEUjUklERExFCkFURSNBU1RPIyNTUk8jVVNOQSMjIwpTVFJJS0UjTkFHI0FCQVNFI0xBTUEKVEVBU0VTI0NVUlJJRVJBTkRJVkVTCkVOVEVSUyNPUklPTiNBR0VEI0lNUAojREVFUyMjTUFORVMjQkVEUyNET1M="},{"title":"01/25/10 FUNNY BUSINESS","author":"Gail Grabowski, edited by Stanley Newman","date":"2010-01-25","grid":"QU1PSyNMSVBQWSNFQ09MClZBSU4jSURMRUQjTk9SSQpPR0xFI0JFQVJTI0FNQU4KV0lTRUNSQUNLI1NNSUxFCiMjI0xFQVNFIyNQRUMjIwpFTUNFRSMjI1JBSUxTQVQKU09MRCNBU1BFQ1QjVFdPClNSQSNPVVRFQVRTI1JPVwpBU1MjQlJBV0xTI1BJS0UKWUVTREVBUiMjI1NVUEVSCiMjQ1JZIyNTSE9PVCMjIwpQT0xPUyNTTEFQU1RJQ0sKU0xPVyNBTElWRSNFREVOClNFV1MjQklET04jUk9ERQpUT05ZI1NQRUNTI1NMRVc="},{"title":"01/26/10 GET IT TOGETHER","author":"Billie Truitt, edited by Stanley Newman","date":"2010-01-26","grid":"QkFUSFMjR09TSCNMQVNUCkFMT09QI0FSRUEjSU5UTwpST0dVRSNCRUVSI0dOQVQKQkVBUkVSQk9ORCNISUtFCiMjIyNDT1kjI0VTVEVFTQpMQU5ESE8jUEFSS0EjIyMKQUJPTyNUSEFOI0lGRUFSCk1FTlUjU0FOVEEjVUNMQQpCTE9CUyNSRUVMI1NPQUsKIyMjTElCRUwjT1JFTFNFClNQSEVSRSMjU0hFIyMjIwpQUkVLI1NVSVRBTkRUSUUKTE9BTiNJTkZPI1RJQVJBCkFOVEkjRElBTCNBTlRJQwpURVNUI0VUVEUjTEVBU0g="},{"title":"01/27/10 FRONT VIEW","author":"Norma Steinberg, edited by Stanley Newman","date":"2010-01-27","grid":"SE9NRSNBRERFUiNPUEFMCkFXRUQjTEVPTkUjTkVSTwpIRURHRUZVTkRTI1RSSVAKQU5TRUwjQ09TVCNIT1NFCiMjIyNWRUVSI09QRU5FRApMT0RHRVJTI1BST0YjIyMKQVZFUlNFI01BRVdFU1RTCk1BTUEjI0hFWSMjTkFJTApCTElTU0ZVTCNCQUNLRVIKIyMjU1VFVCNDQVJFRVJTClNUQVJWRSNSQUhNIyMjIwpIQUxPI0RST1AjT0JBTUEKSU5UTyNCRURPRlJPU0VTCk5ZRVQjQU5JVEEjTUlMSwpFQVJTI0dPTkVSI0JBVFM="},{"title":"01/28/10 GOOSE EGGS","author":"David W. Cromer, edited by Stanley Newman","date":"2010-01-28","grid":"U1RVQiNBQkJBI0dTVUlUCkxFTkEjVFJPVCNMQU5DRQpJTklUI1RBTUUjQUxJRU4KTk9USElOR0JVVE5FVCMjCkdSRUVOIyNTUEVDUyMjIwojIyNEQVNIIyNERU1VUlMKVUFXI1BFQUNFIyNBUklBClNDUkFUQ0hBTkRTTklGRgpFTUFHIyNBTUlOTyNTRUUKREVQT1JUIyNEQVRFIyMjCiMjI05FVkVSIyNUUkFNUwojI1pJUEFERUVET09EQUgKQU1BWkUjSU5UTyNET05FCkxJTkVOI1RFTlQjRVJJRQpUUllTVCNTRUFTI0RFQVI="},{"title":"01/29/10 PADDED","author":"Robert A. Doll, edited by Stanley Newman","date":"2010-01-29","grid":"TElBUiNTTk9XI0lNUEVMCkFPTkUjRUlORSNNQVJDTwpQVVRURVJDT05GVVNJT04KIyMjVVJHRSNUT1NDQUxFCkNBUlJJRSNKQVIjQU1FUgpQUkFOS0FNQVRFVVIjIyMKTEVHUyNOT1cjI0ZBU1RTClVORSNPVEIjTkNPI0NISQpTQVNTWSMjU0FPI01PRVMKIyMjUExVQ0tZQ0hBUk1TCkFCQkEjUFJZI0tJRE5FWQpQUk9SQVRBI1NBRkUjIyMKUEFJUkNPTkRJVElPTkVSClRWU0VUI0VVUk8jRklSRQpTRUVEUyNTT1NPI0ZMQVg="},{"title":"01/30/10 SATURDAY STUMPER","author":"Doug Peterson, edited by Stanley Newman","date":"2010-01-30","grid":"QkFUVEVSU0JPWCNUQ0JZCkVRVUlWQUxFTlQjV0hFTgpUVVJORURPVkVSI0VBU0UKI0FGVCMjTUVHQUhFUlRaCiMjI0lTRk9SIyNBVFRTIwpETUlOT1IjTE9JVEVSRUQKSlVOR0xFR1lNUyNERUxJCklTUyNEU0wjQU9MI1VMVApOQ09TI05FQVJNSVNTRVMKR0xVVFRPTlMjRUxMRVJZCiNFQ1VTIyNTWVJJQSMjIwpTVElOS0FST08jI0NNQSMKQ09BVCNCVVJHRVJLSU5HCkFOTkUjQVRUQUNIRURUTwpSRVREI0JBU1NPT05JU1Q="},{"title":"01/31/10 CALLING THE PIED PIPER: Rodential wordplay","author":"Merle Baker, edited by Stanley Newman","date":"2010-01-31","grid":"I0FUT0REUyNURUFTRSNTUEFUVUxBCkNJUkNVSVQjT1NURU8jUUFUQVJJUwpSUkFURURCVVRUT05TI1VOQkVORFMKRVJNQVMjI05FQUxTI0FJREEjU1NOCkRBTSMjI0hVTUJMRVBJUkFURSMjIwpJQ0VDUkVBTSMjIyNMU1RTI1RUT1AKVEVMQVZJViNQTFVSQUwjI1JPVU5ECiMjI0JFUkFURUlOT05FU0JPTk5FVApPRkZBUkUjSEFWUkUjI0NBVVNBTCMKTE9JTiMjTUVMRUUjI0NPS0UjTUlBCkVSUkFUQU9GRU5MSUdIVEVOTUVOVApHRUUjSFVOVCMjQURJRVQjI0FMRUUKI0JMQVJFRCMjU1RBTlMjU0FSVFJFCkxFQURFUk9GVEhFUkFUUEFDSyMjIwpBQU5EVyMjUkhPREVTI0VYVEVOVFMKRFJFSSNBUkVBIyMjI0dPRVNET1dOCiMjI1NBVFVSTlJBVElPTiMjI1ZJRQpFV0UjRVRURSNBR0lORyMjQVJFVEUKTE9TRVNJVCNFUlJBVElDU1RPTFRaCklOU1RPUkUjREVFUkUjSE9OQUxFRQpTVE9PUEVEI0RSRUFSI0FMT01BUiM="},{"title":"01/31/10 CALLING THE PIED PIPER: Rodential wordplay","author":"Merle Baker, edited by Stanley Newman","date":"2010-01-31","grid":"I0FUT0REUyNURUFTRSNTUEFUVUxBCkNJUkNVSVQjT1NURU8jUUFUQVJJUwpSUkFURURCVVRUT05TI1VOQkVORFMKRVJNQVMjI05FQUxTI0FJREEjU1NOCkRBTSMjI0hVTUJMRVBJUkFURSMjIwpJQ0VDUkVBTSMjIyNMU1RTI1RUT1AKVEVMQVZJViNQTFVSQUwjI1JPVU5ECiMjI0JFUkFURUlOT05FU0JPTk5FVApPRkZBUkUjSEFWUkUjI0NBVVNBTCMKTE9JTiMjTUVMRUUjI0NPS0UjTUlBCkVSUkFUQU9GRU5MSUdIVEVOTUVOVApHRUUjSFVOVCMjQURJRVQjI0FMRUUKI0JMQVJFRCMjU1RBTlMjU0FSVFJFCkxFQURFUk9GVEhFUkFUUEFDSyMjIwpBQU5EVyMjUkhPREVTI0VYVEVOVFMKRFJFSSNBUkVBIyMjI0dPRVNET1dOCiMjI1NBVFVSTlJBVElPTiMjI1ZJRQpFV0UjRVRURSNBR0lORyMjQVJFVEUKTE9TRVNJVCNFUlJBVElDU1RPTFRaCklOU1RPUkUjREVFUkUjSE9OQUxFRQpTVE9PUEVEI0RSRUFSI0FMT01BUiM="},{"title":"02/01/10 MINI TALK","author":"Gail Grabowski, edited by Stanley Newman","date":"2010-02-01","grid":"R0FXSyNEQVJUUyNTVEFCCkFDUkUjRU1BSUwjTUFURQpTVEVQI0NBR0VZI0FCTEUKUElOVFNJWkVEI0ZMT0FUCiMjIyNBREVTI05PTE9TUwpQQVRUSUVTI0FJUlMjIyMKR0xVRUQjI0VYUEVDVFMjCkFPTkUjT0FTRVMjQUhBQgojVEVOQU5UUyMjU0xBVkUKIyMjWVVMRSNTTEVFVEVECkJSQVdOWSNTRUFSIyMjIwpSSVZFVCNJVFRZQklUVFkKQUxPRSNDUkFURSNTSE9FClZFSU4jUEFSRVIjRUFSTgpFRERZI0FOVEVTI0VXRVM="},{"title":"02/02/10 GOOFING OFF","author":"Billie Truitt, edited by Stanley Newman","date":"2010-02-02","grid":"UElDS1MjUEFJUiNTTEFQClVOWklQI0FMVE8jVEFUQQpTVEFTSCNTRUFMI1JJQlMKSE9SU0VTVEFMTCNFUkFTCiMjIyNSRUVEI0NIQVNURQpUQVJHRVQjI01BQU0jIyMKQVBPUCMjU1BFTEwjT09GCkRFUEFSVFVSRUxPVU5HRQpBWEUjT1JOT1QjI05FUkQKIyMjU1VFUyMjQVJJU0VTClBFVElURSNISVJFIyMjIwpBTEFTI0ZSRU5DSExPQUYKVkFTVCNST0xFI0VBR0xFCkVUVEUjT1ZFUiNBVExBUwpERUVSI0dFTlQjVEVFTlM="},{"title":"02/03/10 ALL WET","author":"Norma Steinberg, edited by Stanley Newman","date":"2010-02-03","grid":"RU1CRVIjQU1CSSNTTEFNCk1FQVJBI1JFQU0jVElMRQpNQVlBTiNHQUxMI09NSVQKQUxMI1NPVU5EQURWSUNFCiMjRUNPTEUjI1RFRVRFUgpSRUFMTVMjV0hFRSMjIyMKQUxWQSNFTElBI1JBUElEClRJRVIjTkVTVFMjTk9TRQpFU1NBWSNTUEVDI0dPTEYKIyMjI0FDVFMjT01FTEVUClNDUkFXTCMjR1VJTFQjIwpDSEFOTkVMU1VSRiNBU1AKUklORyNST1VUI0ZBQkxFCkFOVFMjSUNFUyNFTExFTgpQT1NUI0NPWlkjREVFRFM="},{"title":"02/04/10 SOUNDALIKES","author":"Fred Piscop, edited by Stanley Newman","date":"2010-02-04","grid":"UklHT1IjUkFOVCNMSVNQCkFCSURFI09MRU8jT01OSQpCSUxJTkdVSVNUI1NQQU4KRVNURUVNUyNURVhUVVJFCiMjIyNHQVRFIyNNSUxFUwpLSVNNRVQjU0hFRVRTIyMKQVdBUkQjU0NPUk4jRURVClRPWVMjQ0hPU0UjTUJBUwpFTkcjQk9PUlMjUE9VUlMKIyNPQ0VMT1QjU0FXWUVSClNQT1JFIyNTUEVDIyMjIwpDT0RFUkVEI09ORVNUT1AKRUxCQSNCWUFORExBUkdFCk5BWVMjQkVORCNBUk9MTApUUkVFI1NTVFMjUEFZRUU="},{"title":"02/05/10 WATER SUPPLY","author":"Merle Baker, edited by Stanley Newman","date":"2010-02-05","grid":"RVNURVIjQ09EQSNDUkFXCk1BUllJI09VU1QjUkVNSQpCTFVFQk9UVExFI0FUQUQKRVNDI1NSVEEjI0FCQVRFCkRBVUIjQkFUSFRVQkdJTgojI0xFSVMjI0FSVFkjIyMKT0NFQU4jUkFESU8jRElTClNJTktUSEVCSVNNQVJDSwpPQVQjUkVBQ1QjQUxPSEEKIyMjSFVSVCMjQVRPUCMjCkdSRUFUQkFTSU4jVEFUQQpFQVJUSCMjT0NUQSNMRVMKQUpBUiNCVUNLRVRMSVNUClJBVEUjQkFLRSNNT05USApTSE9EI0xFU1MjT1hFWUU="},{"title":"02/06/10 SATURDAY STUMPER","author":"Anna Stiga, edited by Stanley Newman","date":"2010-02-06","grid":"V1dJSVZFVCNVUFRBS0VTCkhBTlNPTE8jTk9VUklTSApBU0tBV0FZI0RJR0lOVE8KQ09QQSNMT0JFI1NFTk9SCktOQUNLI1RBUkEjU0VOVApFVEQjUFNBTkRRUyNBSUwKRE9TSURPUyNPVVRUUkFZCiMjI0RVQyMjI0lQTyMjIwpTUExPVENII0FOSU1BTFMKVEFPI1lFQUhZT1UjR0FQCk9WRU4jUlVJTiNTSElFUgpPTFNPTiNHRVJFI0lUUlkKR09TT1VUSCNBQ0VUQVRFCkVWRU5CRVQjTk9UQVRFUwpEQVJFU0FZI0ROQVRFU1Q="},{"title":"02/07/10 TWO-PARTY SYSTEM: Equally split, in fact","author":"Merle Baker, edited by Stanley Newman","date":"2010-02-07","grid":"QVNJQSNWQUxPUiNBR0VEI1dJUEVSClNUQUcjQVJJU0UjTE9SSSNJTlJFRApQSUNUVVJFUE9TVENBUkQjRFVFTFMKSVBPI1JJQVMjSE9PUFMjVEVTUyMjClJFQ0VERSMjRk9SVEUjUkFNRVNFUwpJTkNMVURFTUVPVVQjU0VSQSNVS0UKTkRBSyMjQ0FSVFMjU1VHQVJGUkVFCiMjI1NFQ1RPUiMjSUFNQSNHVUVTUwpDQVQjU0hPUkVQQVRST0wjSVNQIyMKSFVSVExFI0lUQVNDQSNJR05FT1VTClVUQUgjQUNTI05USCNPQVIjRUlORQpNT0RFU1RZI0FJUkVSUyNFSVNORVIKIyNFTUkjQ0lOQ09ERU1BWU8jVFNFCkZBTUVEI0xPT1MjI1RPU1NVUCMjIwpJTkFTRUNPTkQjTEhBU0EjI0FSVFMKRE9HI01BTlMjTU9JUkVQQVRURVJOCk9OQURJTUUjV0FSUFMjI0RJU01BWQojI1pFUk8jREFSTlMjR05BVCNPSUQKVFJJRVIjTUlOSUFUVVJFUE9PRExFCk1VTlJPI09WRU4jRVZJQ1QjVkVFUgpTVEVFUiNOQURBI1JBTktTI09MRFM="},{"title":"02/07/10 TWO-PARTY SYSTEM: Equally split, in fact","author":"Merle Baker, edited by Stanley Newman","date":"2010-02-07","grid":"QVNJQSNWQUxPUiNBR0VEI1dJUEVSClNUQUcjQVJJU0UjTE9SSSNJTlJFRApQSUNUVVJFUE9TVENBUkQjRFVFTFMKSVBPI1JJQVMjSE9PUFMjVEVTUyMjClJFQ0VERSMjRk9SVEUjUkFNRVNFUwpJTkNMVURFTUVPVVQjU0VSQSNVS0UKTkRBSyMjQ0FSVFMjU1VHQVJGUkVFCiMjI1NFQ1RPUiMjSUFNQSNHVUVTUwpDQVQjU0hPUkVQQVRST0wjSVNQIyMKSFVSVExFI0lUQVNDQSNJR05FT1VTClVUQUgjQUNTI05USCNPQVIjRUlORQpNT0RFU1RZI0FJUkVSUyNFSVNORVIKIyNFTUkjQ0lOQ09ERU1BWU8jVFNFCkZBTUVEI0xPT1MjI1RPU1NVUCMjIwpJTkFTRUNPTkQjTEhBU0EjI0FSVFMKRE9HI01BTlMjTU9JUkVQQVRURVJOCk9OQURJTUUjV0FSUFMjI0RJU01BWQojI1pFUk8jREFSTlMjR05BVCNPSUQKVFJJRVIjTUlOSUFUVVJFUE9PRExFCk1VTlJPI09WRU4jRVZJQ1QjVkVFUgpTVEVFUiNOQURBI1JBTktTI09MRFM="},{"title":"02/08/10 COLLECTIBLES","author":"Gail Grabowski, edited by Stanley Newman","date":"2010-02-08","grid":"R0FCUyNDSElNUCNFTEFMCk9ET1IjSElSRUUjTk9SSQpBRE9TI09GQUdFI0VDT04KVFNLI0NPSU5BUEhSQVNFCiMjQU1BU1MjI0VBR0xFIwpTUFJJVEUjUEFSVFkjIyMKVE9PTlMjU0VOU0UjU0hFCkFMT0UjI1BPVCMjU1RVRApHRU0jVEJPTkUjQk9BUkQKIyMjUEFSVFMjQ0FMTUxZCiNIRUxMTyMjQUVTT1AjIwpDT01JQ09QRVJBUyNESUcKT05DRSNEVURFUyNTT0RBCkxFRVIjRVJBU0UjT1dFUwpEWUVTI0RFTU9TI1NOQVA="},{"title":"02/09/10 IT'S NOT FARE","author":"Sally R. Stein, edited by Stanley Newman","date":"2010-02-09","grid":"UE9TSCNDT0VEI0FUTEFTCkFSRUEjVU5ETyNWSU9MQQpUSUVSI1JFSU4jRUxCT1cKSE9UUE9UQVRPI05FU1RTClNOT09QUyMjUkFHIyMjIwojIyMjUllFUyNURUNISUUKU0FMU0EjQ09BVCNSSVNLClVTRVRIRU9MRE5PT0RMRQpESVZBI0FMVkEjVFdFRUQKU0FZWUVTI0VNSVQjIyMjCiMjIyNORVQjI1JFRFRBRwpMQVRURSNIT05PUlJPTEwKQU5HRVIjVVBPTiNBUklBClNUSU5HI01BVEUjTU9CUwpIRUZUWSNCTEVEI0FTSVM="},{"title":"02/10/10 BEATLES NUMBERS","author":"Adam Cohen, edited by Stanley Newman","date":"2010-02-10","grid":"VEJTUCNBUkxFUyNNQVpFCkhBVEgjVEFJTlQjQU1PUgpFR0FOI1RJTERBI1hFTkEKUkVWT0xVVElPTk5JTkUjCkVMRU1FTlQjI0RBTSMjIwojIyNQT0UjRVNQWSNOQkEKRVNTRVgjSURFQSNBQ0xVCldIRU5JTVNJWFRZRk9VUgpFQUNII0FUVFkjQVRTRUEKU0dUI0lFT0gjQ0xFIyMjCiMjI0VTUyMjUEVUUkVMUwojRUlHSFREQVlTQVdFRUsKTUFSWSNSSUxMUyNBUk5FClZTT1AjT0RFT04jUklERQpQRU5UI1NJRU5BI0RFTFQ="},{"title":"02/11/10 TIEUPS","author":"Fred Piscop, edited by Stanley Newman","date":"2010-02-11","grid":"UkVOTyNBTUFaRSNNSUNBCkFDRUQjRkVMT04jSU1BTQpDT1JET0ZXT09EI0RBUkUKRU5UI1JJU0UjU0NBTEVTClJPU0lFUiMjIyNBSUwjIwojIyNDT01NT05USFJFQUQKRURHRVMjT0RFT04jQVZFCkJJUkQjUFJJVlkjR1JJTgpCUkEjR0VFU0UjU0FTU1kKU0VDT05EU1RSSU5HIyMjCiMjRVJBIyMjI0JPU05JQQpTRU5BVEUjU1RJUiNJTlMKQUxPVCNST1BFU1RJVENICkFMVE8jSU5BTkUjVFJVRQpCRUVSI0NFTlRTI1RPUk4="},{"title":"02/12/10 ANIMAL HOUSE","author":"Robert A. Doll , edited by Stanley Newman","date":"2010-02-12","grid":"QU5UUyNNQUNITyNXQUNTCk5PT0sjQVJSQVkjSElITwpHTlVBRERSRVNTI09ESU4KTE9UVE8jI0RTVCNERUxJCkVTU0VOI1NPTEVNVVNJQwojIyNTVE9QI0VSSU4jIyMKQUxMIyNMRUcjI05JQ0hFCkJFQVJORUNFU1NJVElFUwpDQU1FTyMjTU9PIyNBTVAKIyMjRkFURSNBQlVUIyMjCkZPV0xIVU1PUiNTSEFSRQpPR1JFI05DUiMjU0VEQU4KQUxFQyNERUVSRlJJRU5ECkxFU1QjUkVPSUwjUkFHRQpTU1RTI0FTU0FZI1NMRUQ="},{"title":"02/13/10 SATURDAY STUMPER","author":"Barry C. Silk , edited by Stanley Newman","date":"2010-02-13","grid":"Q0hFRVNFU1RFQUsjTUFSCkxPVUNPU1RFTExPI0FQQQpFQVJUSFFVQUtFUyNURU4KQUdPI09VUlMjTkhMRVJTClJJUEEjRURFTiNFQVJUTwpTRUVOTyNZVFRFUkJJVU0KIyMjQVJNI1NXRSNSQVJFCkFUSElSU1QjVE9UQUxFRApVSUVTI0dPQiNDQUQjIyMKR1JBTkRUT1VSI1BPU1NFClJBRElPI1RSRVkjUkVFRgpBTUlOVVMjU1RFVCNERUYKVElFI0JBVFRJTkdDQUdFCklTUyNUUkFJTlRJQ0tFVApOVVQjU0lHTkFMRkxBUkU="},{"title":"02/14/10 PLAY IT AGAIN: Let us reiterate...","author":"David W. Cromer, edited by Stanley Newman","date":"2010-02-14","grid":"U1RBSUQjRkFUIyNTVU1PI0tBUFBBClRBU1RFI0xHRSNERUZFUiNBTE9VRApFWFRFTlNJT05SRUNPUkQjUklMRUQKVEVSTUlURSNUT0FUI0tFUFQjTEJTClNSTyNSQVMjSEFEI0hFQUwjU09MTwojIyNDT01JQ1NSRUNPTExFQ1RJT04KUEFQQSNPTk8jI05PUiMjQk9BIyMjCkJST1RIUyNXRURESU5HUkVEUkVTUwpTRVRUTyNBTFZBI0xFT0kjI1RZUE8KIyNTTFVHUyNFUlIjI1NTVCMjRUVOCiNUSEVSRVRVUk5PRlRIRVNDUkVXIwpDT08jI0xFUyMjQklPI1JFTEFYIyMKQU5UUyMjUkVMWSNGUklTI0VEQU1TCldFU1RFUk5SRVVOSU9OI0JPTk1PVAojIyNBVkEjI1RBVSMjQU1JI0VTUFkKSEVER0VSRUZVTkRNQU5BR0VSIyMjCkFMT0UjQUxPUCNHSU4jTEFEI1BBTgpMQU4jREVBTCNURVJJI0xJQkVSVEUKSVRBTE8jUEFOT1JBTUlDUkVWSUVXClRFVE9OI1NUSVJTI0FETyNSRU1JVApFREVOUyNFRUxZIyNMQVAjR0xFTlM="},{"title":"02/14/10 PLAY IT AGAIN: Let us reiterate...","author":"David W. Cromer, edited by Stanley Newman","date":"2010-02-14","grid":"U1RBSUQjRkFUIyNTVU1PI0tBUFBBClRBU1RFI0xHRSNERUZFUiNBTE9VRApFWFRFTlNJT05SRUNPUkQjUklMRUQKVEVSTUlURSNUT0FUI0tFUFQjTEJTClNSTyNSQVMjSEFEI0hFQUwjU09MTwojIyNDT01JQ1NSRUNPTExFQ1RJT04KUEFQQSNPTk8jI05PUiMjQk9BIyMjCkJST1RIUyNXRURESU5HUkVEUkVTUwpTRVRUTyNBTFZBI0xFT0kjI1RZUE8KIyNTTFVHUyNFUlIjI1NTVCMjRUVOCiNUSEVSRVRVUk5PRlRIRVNDUkVXIwpDT08jI0xFUyMjQklPI1JFTEFYIyMKQU5UUyMjUkVMWSNGUklTI0VEQU1TCldFU1RFUk5SRVVOSU9OI0JPTk1PVAojIyNBVkEjI1RBVSMjQU1JI0VTUFkKSEVER0VSRUZVTkRNQU5BR0VSIyMjCkFMT0UjQUxPUCNHSU4jTEFEI1BBTgpMQU4jREVBTCNURVJJI0xJQkVSVEUKSVRBTE8jUEFOT1JBTUlDUkVWSUVXClRFVE9OI1NUSVJTI0FETyNSRU1JVApFREVOUyNFRUxZIyNMQVAjR0xFTlM="},{"title":"02/15/10 STORAGE SELECTIONS","author":"Gail Grabowski , edited by Stanley Newman","date":"2010-02-15","grid":"TEFWQSNTQUJMRSNDUEFTCk9NSVQjVFJVRVIjQUxUTwpTRU5UI0FHUkVFI05BSUwKVFJFRVRSVU5LI1BBWUVFCiMjI05PVEVTI0RFTEkjIwpDQU5EWSMjI0JVU1NUT1AKQURFIyNDVVRFU1QjU0lSClJPVyNXQVNJTlRPI0FMSQpFUlMjQU1FTkRTIyNGRUUKREVCQVRFUyMjI1JFRURTCiMjVVBUTyNMQVBFTCMjIwpXSVJFUyNQT0xFVkFVTFQKSVRFTSNTQVdUTyNUUklPCk5DQUEjT0NFQU4jRUdPUwpTSFVOI0JFUlJZI0RFTlM="},{"title":"02/16/10 SEEING RED","author":"Billie Truitt, edited by Stanley Newman","date":"2010-02-16","grid":"QlJPVEgjQ0hJQyNXQVJTClJBRElPI0xPQ08jSURPTApBUkVOQSNBSEVNI0xJVkUKREVTRVJUUk9TRSNERUVECiMjIyNTRUEjI0lOQ1VSUwpNQVBMRVMjTVlOQUgjIyMKRVJJRSNUUkVFI1BFVEFMClJFRUYjU0FMQUQjUk9MRQpFQVJUSCNORVJPI1JVVFMKIyMjVEFTVEUjRFJZUk9UCkFUTU9TVCMjQUdPIyMjIwpERUFSI0FET0JFQlJJQ0sKTUVOVSNUSU1FI0JBQ09OCklUSVMjVU5JVCNFVk9LRQpUSEFUI1NFVFMjUkVORVc="},{"title":"02/17/10 MARK MY WORDS","author":"Norma Steinberg, edited by Stanley Newman","date":"2010-02-17","grid":"U0lERSNTVEFSSyNTRUNUCk9SQUwjVEFIT0UjUFJPVwpESVNLI0lSQVRFI1JJUEEKQVNII1NMQVNIUFJJQ0VTClNIT1ZFTFMjI1NBTiMjIwojI0ZJVFMjU1RBUlRMRUQKT0FTRVMjU0hBS0UjQVhFCkZMQVcjTUFJTkUjQVNJTgpNRUwjRE9MTFMjUFVUVFkKRVhURVJOQUwjR1VMUCMjCiMjI0xBVCMjU1VOREVDSwpXQUxMQlJBQ0tFVCNSVUUKSVNFRSNFTExJUyNQSVBFCkxJQVIjQUxFUlQjUk9JTApMQURZI0xJRlRTI09ERFM="},{"title":"02/18/10 SELF-DOUBT","author":"Fred Piscop , edited by Stanley Newman","date":"2010-02-18","grid":"TUFNRSNTQUxUIyMjSEFICkVMQUwjUFJPQU0jTEVOTwpTQVlGT1JTVVJFI0VMS1MKQVNTI1JJT1QjRElNUExFCiMjI0FERU4jQ0FST01FRApTSElORVIjQ09MT05ZIyMKVElNT1IjVEFLRU4jU1BBCkFMQU4jRklSRUQjTEVPTgpCT0cjQklLRVMjTUVMT04KIyNJTU9OSVQjUkFGRkxFCk1FTkFDRVMjVE9SVCMjIwpBUkVOQVMjTUlNSSNHQVMKTUVXTCNTTEVFUEFXSU5LCkFDSFkjRUVSSUUjQU5URQpTVFkjIyNURU5EI1JBSUQ="},{"title":"02/19/10 TRASH TALK","author":"Merle Baker , edited by Stanley Newman","date":"2010-02-19","grid":"UlBNUyNQUk9CI1NFUlRBCkFMQUkjTFVMVSNBVkFJTApKVU5LQk9ORFMjTEVWRUUKQU5ESE9XI1NJWlpMRVJTClNLWSNMRVMjTEVCIyMjIwojIyNCQVJORVlSVUJCTEUKQVRUQSNTQUcjT1JERUFMCkJFQURTI1BCUyNHUkFJTApFUlJBVEEjRElGI01VVEUKTElUVEVST0ZQVVBTIyMjCiMjIyNOSVgjU0VSI1JBRwpTTk9XREFZUyNMT0NBTEUKVE9SQUgjR09UT1dBU1RFCkFSRU5BI0VMT0kjR1BBUwpCQVNFTCNOT0VMI0VZUkU="},{"title":"02/20/10 SATURDAY STUMPER","author":"Adam Cohen, edited by Stanley Newman","date":"2010-02-20","grid":"RkFDRUJPT0sjQ09CQUxUCkFMQUNBUlRFI0FNQkxFUgpNQVRVUkFURSNCQUxCT0EKSU5TI1NMRVBUSU4jQU5JCk5PSVIjQlJZQU4jU0NBTgpFTlRFUiNQT1gjUk9PTVMKIyMjQUVJT1UjU0lSUkVFCkJVTExFVFBST09GVkVTVApPTkVJREEjU1RPTEkjIyMKUklUWlkjVEhPI0VOTklTClJPU0UjVFdJU1QjT09PTwpPTlMjQkVBUkNVQiNPV04KV0lMSUVSI1RPQk9HR0FOCkVaSU5FUyNPUEVOTElORQpERVBVVEUjTkVSRElFU1Q="},{"title":"02/21/10 WHITE HOUSE REacute;SUMEacute;S: Before they were prez","author":"Fred Piscop, edited by Stanley Newman","date":"2010-02-21","grid":"SVJBUyNXQUxLI0RFQURFTiNGQVJFCk5PVEkjQUxPRSNBTExVUkUjQVJJQQpDT01NVU5JVFkjQ0lBRElSRUNUT1IKIyMjSVNOVCNTRVQjQkVDT01FIyMjCkNBQkFOQSMjI0xZUkEjIyNJU0xBTQpPTUFOI0JVRkZBTE9NQVlPUiNBTEkKTUlTUyNFTlJPTCNUQVNFUlMjV1BBCklORSMjI0ZJUiMjIyNQQUMjTFNBVApDT0JTI1BPU1RNQVNURVIjTUVDQ0EKI1JBV1NJTEsjQUxJRU4jU0FTSEEjCiMjTE9XRUQjU09MRUQjUE9MTE8jIwojU0xPRVMjVFVSSU4jU0VBTElPTiMKU1RPTkUjTU9WSUVBQ1RPUiNFTEVDCk5FV1MjVElYIyMjI0hFUCMjI0RVRQpVUk4jU0VSSUZTI0RFQUxUI1NFUkEKRkVFI1BFQU5VVEZBUk1FUiNMQU9TCkZPUkNFIyMjUlVFRCMjI1lWT05ORQojIyNMQVBTQVQjQVNTI0lIT1AjIyMKSEFCRVJEQVNIRVIjT1JHQU5JWkVSCklERUEjQURIRVJFI1BPT1IjTk9SQQpQT0VUI1NFRVJFRCNIRVJEI0dPQVQ="},{"title":"02/21/10 WHITE HOUSE REacute;SUMEacute;S: Before they were prez","author":"Fred Piscop, edited by Stanley Newman","date":"2010-02-21","grid":"SVJBUyNXQUxLI0RFQURFTiNGQVJFCk5PVEkjQUxPRSNBTExVUkUjQVJJQQpDT01NVU5JVFkjQ0lBRElSRUNUT1IKIyMjSVNOVCNTRVQjQkVDT01FIyMjCkNBQkFOQSMjI0xZUkEjIyNJU0xBTQpPTUFOI0JVRkZBTE9NQVlPUiNBTEkKTUlTUyNFTlJPTCNUQVNFUlMjV1BBCklORSMjI0ZJUiMjIyNQQUMjTFNBVApDT0JTI1BPU1RNQVNURVIjTUVDQ0EKI1JBV1NJTEsjQUxJRU4jU0FTSEEjCiMjTE9XRUQjU09MRUQjUE9MTE8jIwojU0xPRVMjVFVSSU4jU0VBTElPTiMKU1RPTkUjTU9WSUVBQ1RPUiNFTEVDCk5FV1MjVElYIyMjI0hFUCMjI0RVRQpVUk4jU0VSSUZTI0RFQUxUI1NFUkEKRkVFI1BFQU5VVEZBUk1FUiNMQU9TCkZPUkNFIyMjUlVFRCMjI1lWT05ORQojIyNMQVBTQVQjQVNTI0lIT1AjIyMKSEFCRVJEQVNIRVIjT1JHQU5JWkVSCklERUEjQURIRVJFI1BPT1IjTk9SQQpQT0VUI1NFRVJFRCNIRVJEI0dPQVQ="},{"title":"02/22/10 PRESIDENTS' DAY","author":"Billie Truitt, edited by Stanley Newman","date":"2010-02-22","grid":"U0FTUyNTQUdFUyMjQ0FECktORUUjVEhFUkUjUE9ORApFVEFMI0VFUklFI0lPVEEKV0lMTElBTU1DS0lOTEVZCiMjI1RTSyMjI1NPQiMjIwpSRVBPVCNNQVAjTkFHQVQKQUFII0hBSUxFRCNMT1NFCkdST1ZFUkNMRVZFTEFORApFVFRFI1RSSVZJQSNMQUQKU0hPUkUjT05FI1JBU1BZCiMjI0FTUCMjI1ROVCMjIwpKT0hOUVVJTkNZQURBTVMKQVBFRCNUUk9PUCNBQ1JFClZFUkEjVE9UT0UjV0hJUApBTkQjI1NOSVBTI05FU1Q="},{"title":"02/23/10 TOO CLOSE","author":"Gail Grabowski , edited by Stanley Newman","date":"2010-02-23","grid":"U05BUCNBQkhPUiNBU1RJCkxPR0UjRlJPV04jU1BJTgpBVE9OI0xBV05TI0xFRUsKQklHQ1JPV0RTI0RFRURTCiMjI0lUQUxZI0NPRUQjIwpHT0JMRVQjI0NBTVBCRUQKT1dFUyMjUEFVU0UjVU5PCkFMTCNBTEVSVEVEI01BUwpERUwjTklFQ0UjI1NQQ0EKU1RQRVRFUiMjVFJVU1RZCiMjVVNFRCNCVVJFTiMjIwpURVNUUyNSVUJFTEJPV1MKSEFIQSNNQVNPTiNFR09TCkFTRVQjVFJFQUQjQUxPVApOWVNFI05FU1RTI01FRFM="},{"title":"02/24/10 BEASTLY LANGUAGE","author":"Fred Piscop, edited by Stanley Newman","date":"2010-02-24","grid":"U0FMT04jU0VNSSNaRVNUClBMQU5FI01BSU4jRVhQTwpBU1dFQUtBU0FLSVRURU4KTk9OTyNJUkUjU0NBUkNFCiMjI05BU1QjU1BZI0FTUwpBQ1RPUlMjVFdPIyMjIyMKTEFJTkUjQlJFVFQjVE9BCkFTR0VOVExFQVNBTEFNQgpTSEUjVEFVTlQjTE9DQUwKIyMjIyNQRUQjV0lOVFJZCkFQUCNMRVMjU0hBRyMjIwpHVUlERUQjTUFPI0dSSVQKQVNRVUlFVEFTQU1PVVNFClRIVUQjQ0VMUyNBTkdMRQpFWUVTI0tBVFkjWUVTRVM="},{"title":"02/25/10 AMONG FRIENDS","author":"David W. Cromer , edited by Stanley Newman","date":"2010-02-25","grid":"QVRBRCNJT1RBUyNDVUtFCkNPUkUjU0xBTlQjT0hJTwpJV09OVExFVFlPVURPV04KREVTSVJFIyNIVU4jSElTCiNERU1PI1BIT1RPTiMjIwojIyNTT1JST1cjI0FTQVAKUkVGI1BFQUwjQVBQQUxMCklMTEJFQllZT1VSU0lERQpDTEVBUlMjQ09ERSNMQUQKSEVBTCMjVE9QSUNTIyMjCiMjI0lOTEFXUyNFQVRTIwpUSFkjQk9YIyNTUFJFQUQKWU9VQ0FOQ09VTlRPTk1FClBBTE8jR1VBVkEjTk9PTgpPWEVOI1NUUkFQI0dSQVk="},{"title":"02/26/10 LAZYBONES","author":"Bruce Venzke , edited by Stanley Newman","date":"2010-02-26","grid":"QklLRSNIVFRQI0xJTU9TCkFNRVIjRE9PUiNBREFQVApUSEVPTkxZUkVBU09OVE8KSElORFUjU0VBUlMjRVNQClNQRUVEWSMjTUFPIyMjIwojIyMjR0VUVVBCRUZPUkUKQ0xPU0VTSU4jI0RPTk9SCk9JTFkjTUFKT1IjTkNBQQpXRUFOUyMjQVJCSVRFUlMKTFVOQ0hUSU1FSVMjIyMjCiMjIyNFUlIjI1NBQkxFUwpBQkMjTEVPSVYjQVlFQVIKVE9IQVZFQlJFQUtGQVNUCk9aT05FI09NU0sjQVNFQQpNT1VORCNUQVRBI1JFRFM="},{"title":"02/27/10 SATURDAY STUMPER","author":"Doug Peterson , edited by Stanley Newman","date":"2010-02-27","grid":"UE9MQVJJUyNQQVJTTklQCkFEQU1BTlQjT05FUEFHRQpSSVNPVFRPI0lOVklURUUKVE5UI1RST1RTI1VUVVJOCiMjI0NMT0RIT1BQRVIjIwpDSVRJRVMjUk5BI0RBTVAKQU1JTk8jTU9JTFMjTEVPCk1BREVGT1JUVk1PVklFUwpQR0EjRlVTVFkjQkVTVFMKWUVMUCNTT0wjVFNFVFNFCiMjQkFUVExFU0hJUCMjIwpBVEFMRSNFU1RFUyNEVUcKUk9TQU5OQSNBTFRPT05BCkNSSVRURVIjSU1FQU5JVApIT05FU1RZI05BUlJBVEU="},{"title":"02/28/10 CROSS SWORD PUZZLE: With a little something extra","author":"Doug Peterson, edited by Stanley Newman","date":"2010-02-28","grid":"U1BBTSNEQVRVTSNBTE9IQSNJRExFCkFSTkUjT1BFUkEjVEFQRVIjUkVFTApXSU5EU0hJRUxEU1dJUEVSI0FMVE8KRU1BSUwjTERTI1BPVFNEQU0jUFNJCkRFTFVJU0UjI0NVUiMjI0lEQUhPUwojIyNNQ0EjU1BBUktMSU5HU1dJTkUKVElOU0VMI09VUlMjSVJPTkVSIyMjClNOT1dTI0FGUk8jUExPRCMjWUFQUwpQQVJFI1NXQVJNV0VMQ09NRSNDVVAKI0pFTExJRVMjI0VMSSNaQUcjVFJFCkRJQUxPRyMjV1JJVEUjI0pPU1RMRQpFRlMjRU1VI0VVUiMjV0hPU1dITyMKVUZPI1dBU0hBTkRTV0VBUiNJUklTClNZTkMjI0lPTEUjQ0hFVyNTVEVOTwojIyNBUkVOT1QjSUhPUCNSRUNFU1MKTEVBRElOR1RIRVNXQVkjQkFIIyMjCkVYVEVOVCMjI1ZJQSMjUElUQ0hJTgpBUEUjRFJFU0RFTiNBSUwjRVJPREUKUElBRiNBU1dJTkdBTkRBUFJBWUVSClVSU0EjUEFJTlQjU1RPTkUjRkxBVApQRUVOI1NVTU9TI0hFTEVOI1RFU1M="},{"title":"02/28/10 CROSS SWORD PUZZLE: With a little something extra","author":"Doug Peterson, edited by Stanley Newman","date":"2010-02-28","grid":"U1BBTSNEQVRVTSNBTE9IQSNJRExFCkFSTkUjT1BFUkEjVEFQRVIjUkVFTApXSU5EU0hJRUxEU1dJUEVSI0FMVE8KRU1BSUwjTERTI1BPVFNEQU0jUFNJCkRFTFVJU0UjI0NVUiMjI0lEQUhPUwojIyNNQ0EjU1BBUktMSU5HU1dJTkUKVElOU0VMI09VUlMjSVJPTkVSIyMjClNOT1dTI0FGUk8jUExPRCMjWUFQUwpQQVJFI1NXQVJNV0VMQ09NRSNDVVAKI0pFTExJRVMjI0VMSSNaQUcjVFJFCkRJQUxPRyMjV1JJVEUjI0pPU1RMRQpFRlMjRU1VI0VVUiMjV0hPU1dITyMKVUZPI1dBU0hBTkRTV0VBUiNJUklTClNZTkMjI0lPTEUjQ0hFVyNTVEVOTwojIyNBUkVOT1QjSUhPUCNSRUNFU1MKTEVBRElOR1RIRVNXQVkjQkFIIyMjCkVYVEVOVCMjI1ZJQSMjUElUQ0hJTgpBUEUjRFJFU0RFTiNBSUwjRVJPREUKUElBRiNBU1dJTkdBTkRBUFJBWUVSClVSU0EjUEFJTlQjU1RPTkUjRkxBVApQRUVOI1NVTU9TI0hFTEVOI1RFU1M="},{"title":"03/01/10 BIKE SHOP","author":"Gail Grabowski , edited by Stanley Newman","date":"2010-03-01","grid":"U1BBVFMjUEFJRCNGQVRFCkVFUklFI09HUkUjSUNFRApDT1VOVFlTRUFUI1NIQUcKVE5UI0ZFRUQjQURIRVJFCiMjI1NFQVIjTUlOSSMjIwpDQU1QRVIjQkFMQU5DRSMKT1JFT1MjU0FZUyNHT0FMCk1JTksjI0FHTyMjR1lSTwpCQVNFI1BJRVIjRkVFTFMKI1NBV01JTEwjQ09BUlNFCiMjI0VFTFMjUFVSUiMjIwpDQUxMVE8jRE9STSNURUUKUk9JTCNUSVJFRUFTSUxZCklOVE8jRURBTSNUSEVTRQpCRUVGI0RPR1MjU0hSRUQ="},{"title":"03/02/10 FISH STORY","author":"Billie Truitt , edited by Stanley Newman","date":"2010-03-02","grid":"VEFQUyNUSEVTRSNJVEFMCkFSVU4jUkFQT04jTklORQpMSVJBI0FSSVNFI0ZFVEEKQ0FSUEFORENPTVBMQUlOCiMjI0FCUyMjI1lFQSMjIwpQQVNUQSNMSVAjQU1JU1MKSVZZI1NISU5FUyNFVEFMClBFUkNIVU5TVEVBRElMWQpFUklFI1RFRVRFUiNTU0UKU1RBTkQjU1RZI0JSSUFSCiMjI1NFQSMjI0NPTyMjIwpGTE9VTkRFUlRIUk9VR0gKUk9BUiNBV09LRSNUUklPCkFDUkUjUEVTT1MjRUdHUwpUT1NTI1RSWVNUI1JFU1Q="},{"title":"03/03/10 BEATS ME","author":"Fred Jackson III, edited by Stanley Newman","date":"2010-03-03","grid":"QUJZU1MjSE9TUyNMRUlBClRSRVZJI1NVRVQjRVhBTQpPSUxFRCNUUkVFU1RVTVAKUEVMTEVUI1NPTEUjTFNVCiMjI1RBVVQjRkxBVFRPUApXQVRFUkJVRkZBTE8jIyMKSElFI01BTkUjI1NBV0VECkVEQU0jU0FMVFMjVEhBSQpUQVJPVCMjTE9BRCNJUksKIyMjSklHU0FXUFVaWkxFCkFDUk9CQVQjU0lSRSMjIwpXSUUjRVRPTiNEQVJOSVQKRlJFRVRIUk9XI0JPT0JZClVDTEEjRU1NQSNMSU5FTgpMQVNUI1JZRVMjRU5PVEU="},{"title":"03/04/10 BETTER THAN TENS","author":"David W. Cromer , edited by Stanley Newman","date":"2010-03-04","grid":"U1RBRyNSQVZFRCNQUkVQClBVUEEjRU1JTEUjRUFDSApBQkVMI0pBQ0tMT05ET04KVEFYSSNBTklTRVMjQU5PCiMjI0xBSUQjIyNDRFJPTQpRVUVFTkxBVElGQUgjIyMKVVBUT04jI0hBSVJMSU5FCkFETyMjR0xJTlQjI0JFQQpET05BVElPTiMjSURFQVMKIyMjS0lOR0dJTExFVFRFClNQUkFUIyMjTklLRSMjIwpURUUjSElTU0FUI1BST1AKQUNFVkVOVFVSQSNTQUtFCkNBU0UjUkFNRU4jRVlSRQpLTkVFI0VTU0FZI0FTQVA="},{"title":"03/05/10 NOT SO LOUD","author":"Richard Silvestri, edited by Stanley Newman","date":"2010-03-05","grid":"TUFQI01BU1MjU0NVTFBUCklOQSNFWElUI1BPU09MRQpBQ1QjTEVOQSNJUEVDQUMKU0hSRURMRVRURVJEQVkjCk1PT1IjIyMjQUxBI1RCQQpBUk5FU1MjRU1TI1JJQVMKIyMjI0FEQUdFI0VQT0NICiNTS0FUSU5HU0hSSU5LIwpPSEFSRSNOT1RFUyMjIyMKV09MRiNHT04jU1RBR0VSCkVSQSNGUlkjIyMjQ0FURQojVEhFUkVTVEhFU0hSVUIKQUNBRElBI0hVR0UjQURFCkRVUkVTUyNBTE9UI0dFTApTVElOS1kjV0FTSCNFU1M="},{"title":"03/06/10 SATURDAY STUMPER","author":"Merle Baker , edited by Stanley Newman","date":"2010-03-06","grid":"UEFTU0VEI01BTUFDQVNTCkxFQU5FUiNBTUlDQUJMWQpVUkJBTkEjRklHVVJFT04KQ0FSUllXRUlHSFQjVFZBCktURUwjQkxPQVQjU1RFUApZRVMjR0xBU1MjQ09JTlMKIyMjS1lPVE8jVE9XTklFCk1DRU5ST0UjUkFSRUdBUwpBTExJRUQjUkFLRUQjIyMKTkVTVFMjSEFERVMjUEVXCkRBSVMjUkVQT1MjTVVOSQpBUk4jRk9SSU5TVEFOQ0UKTE9PS0FUTUUjSU9OSUFOCkFVUkVWT0lSI0NST1NTRQpTVEVXQVJUUyNLT1NIRVI="},{"title":"03/07/10 AND SO ON: Filled with hidden extras","author":"Fred Piscop, edited by Stanley Newman","date":"2010-03-07","grid":"SFVGRlMjVEFDTyNSRUJBI09NQUhBCkFTQ09UI0FNT1IjSVNBWSNDT1BFRApTRUNSRVRDT0RFI1NUUkVFVENSRUQKIyMjQ1JFRUsjI0JJQVMjTkFIIyMjCkNBQklORVQjQURFTlQjI1NOQVBUTwpPTkFCRVQjI0JVREdFVENVVCNMT1AKUE9MTCNIQVBMRVNTI0VSRSNQQUNFCklETEUjI0xJRSMjI1JFQUQjRVRPTgpFRUUjR0VUQ1JBQ0tJTkcjU0VFTUUKRFNUI0xBT1MjUkFOR1kjVE9MTEVECiMjQ0JFUlMjU0lOVVMjUEFVU0UjIwpBQ09STlMjU1dFQVQjSUxMUyNUQUMKTk9NQU4jU0tJTExFVENBS0UjQ1JVClRBUFMjUk9BTSMjI0JFTiMjVE9QUwpFUkFTI0FSVCNTQ09PVEVEI1JVRVMKVVNOI1NXRUVUQ09STiMjT1JBTkdFClBFWU9URSMjRVJBU0UjVE9BU1RFRAojIyNBQlMjV0FJTCMjU1lOVEgjIyMKUE9DS0VUQ09NQiNSQUNLRVRDTFVCCk9XTkVEI0ZSRUUjT0JPRSNMQVRLQQpQRU5ORSNPRERTI1dFVFMjRU5ERUQ="},{"title":"03/07/10 AND SO ON: Filled with hidden extras","author":"Fred Piscop, edited by Stanley Newman","date":"2010-03-07","grid":"SFVGRlMjVEFDTyNSRUJBI09NQUhBCkFTQ09UI0FNT1IjSVNBWSNDT1BFRApTRUNSRVRDT0RFI1NUUkVFVENSRUQKIyMjQ1JFRUsjI0JJQVMjTkFIIyMjCkNBQklORVQjQURFTlQjI1NOQVBUTwpPTkFCRVQjI0JVREdFVENVVCNMT1AKUE9MTCNIQVBMRVNTI0VSRSNQQUNFCklETEUjI0xJRSMjI1JFQUQjRVRPTgpFRUUjR0VUQ1JBQ0tJTkcjU0VFTUUKRFNUI0xBT1MjUkFOR1kjVE9MTEVECiMjQ0JFUlMjU0lOVVMjUEFVU0UjIwpBQ09STlMjU1dFQVQjSUxMUyNUQUMKTk9NQU4jU0tJTExFVENBS0UjQ1JVClRBUFMjUk9BTSMjI0JFTiMjVE9QUwpFUkFTI0FSVCNTQ09PVEVEI1JVRVMKVVNOI1NXRUVUQ09STiMjT1JBTkdFClBFWU9URSMjRVJBU0UjVE9BU1RFRAojIyNBQlMjV0FJTCMjU1lOVEgjIyMKUE9DS0VUQ09NQiNSQUNLRVRDTFVCCk9XTkVEI0ZSRUUjT0JPRSNMQVRLQQpQRU5ORSNPRERTI1dFVFMjRU5ERUQ="},{"title":"03/08/10 TITLEHOLDERS","author":"Gail Grabowski, edited by Stanley Newman","date":"2010-03-08","grid":"QUNSRSNORVRTI05BVFRZCkRSQVcjT0dSRSNFRVJJRQpEVUtFSVRPVVQjQVJFTkEKVVNFI05ZU0UjQlJPS0VSClBIUkFTRSMjTUFUIyMjIwojIyNWRVQjWUVTT1JOTyMKQUxURVIjU0lTSSNFQVZFCkNPVU5UT05FU0xPU1NFUwpFQ1JVI1JFTFkjSEVBUlMKI0tORUVMRUQjQUdFIyMjCiMjIyNOT1IjI1BPU1RFUgpBRkdIQU4jVEFQUyNFVkUKR1JPT00jRUFSTEhJTkVTClRFTlNFI0FDTUUjQ0FOVApTVEVFTCNUT1NTI0VNVFM="},{"title":"03/09/10 TAKE THAT BACK","author":"Sally R. Stein , edited by Stanley Newman","date":"2010-03-09","grid":"U0hVTiNFQkJTI1NBVEFOClRBVEEjQVJFQSNUV0lORQpFUkFTI1RPUk4jQU9SVEEKV0VIQVZFT05FTElLRUlUCiMjIyNJTksjI0FSRSMjIwpCUkVBRCNTTEFQUyNTQVcKTEVBTkVSI1VTRSNSQUNFCklUU1RPT1NNQUxMT05NRQpQUkVTI1BFUCNTRUFURUQKU09TI0JFQVNUI0FNQVNTCiMjI0FMSSMjSURTIyMjIwpXSFlDQU5USUdFVENBU0gKSE9PVFMjT0RFUyNPQk9FCklOR09UI1BFUksjU0xVUgpQRUFSUyNTQVNTI1RZUE8="},{"title":"03/10/10 MINGLING","author":"Fred Piscop , edited by Stanley Newman","date":"2010-03-10","grid":"U0xFRCNBTlRTI1NBVEVECkhPUEkjQ09PTCNQTEFORQpBR09HI0lORk8jRUxVREUKTUlYRURET1VCTEVTIyMjCiNOWVNFIyMjI0VEV0FSRAojIyNUS08jU0VYI0VWRVIKQVNII0VMSU9UIyNMT1dFCkJMRU5ERURGQU1JTElFUwpCRU5FIyNFQVNFTCNERFMKUkVOTyNUQVIjTklMIyMjClNUQU5DSCMjIyNFQVJTIwojIyNTSFVGRkxFRERFQ0sKSlVMSUUjQUxBUyNJQ09OCk9NRUdBI0NPTVAjRVVSTwpUQUlOVCNURUVOI1NURVc="},{"title":"03/11/10 FOUR TIRES","author":"Fred Jackson III, edited by Stanley Newman","date":"2010-03-11","grid":"U0hFRCNSRUFDSCNIRUFQClRFVEUjRUFSUFMjRUFDSApFWEhBVVNURkFOI0FSTVkKTUVBTk5FU1MjI0lETEVTClNTTiNGQUEjT0xEUyMjIwojIyNXSUxUVEhFU1RJTFQKU0hFRVQjI0FNQSNST0FSCkFPUkIjUklQRU4jT1VaTwpHTElCI0FNSSMjT05TRVQKQU1FUklDQU5GTEFHIyMjCiMjI09OWVgjSU9SI1NTVApCUkFXTiMjVFJVRUJMVUUKTE9TUyNCUkFJTkRSQUlOCk9ESUUjQk9JTkcjQUNUUwpHRUFSI0JJTEdFI1NLRUU="},{"title":"03/12/10 FARE-MINDED","author":"Doug Peterson , edited by Stanley Newman","date":"2010-03-12","grid":"QlBMVVMjS05JVCNTVEFZCkFMT0hBI0FPTkUjSEFURQpSQVRPTiNVUkdFI0FLSU4KQllUSEVTQU1FVE9LRU4jCkVUTyMjSElTI0VQT05ZTQpST1NDT0UjI0FSRSNPQkkKIyMjTE9BRkVSIyNPVElTCiNUUkFGRklDVElDS0VUIwpNQUFNIyNKT1lGVUwjIyMKU0NJI0hBSSMjTkVBVEVSCkdPTERFTiNTQU8jI1JBRQojQlJJTkdJTkdUT1BBU1MKTkVPTiNPUkFOI0xFVkVFClNMQUcjUk9QRSNBTEVVVApBTERPI0FORVcjWUVMUFM="},{"title":"03/13/10 SATURDAY STUMPER","author":"Barry C. Silk , edited by Stanley Newman","date":"2010-03-13","grid":"UElQRUNMRUFORVIjSUNVCkFMTFNUQVJHQU1FI0NFTgpHTEFTU0JMT1dFUiNBUkQKQUdUIyNSRUcjUlVOTkVSCk5PU0FMRSMjQ0FOSVRCRQojIyNRVUFSUkVMI0FXRVMKQk9TVU4jSEFSREMjQUxTCk9ORUFEI0lDSSNFRklMRQpNSU4jWUFOS1MjTk9UQVMKQk1PQyNMT1NFU1RPIyMjClNQUk9VVFMjI09JTExJVApRVUlaTUUjQUlSIyNPQ1IKVUxUI0JSQUdHQURPQ0lPCkFTQSNSRVRST1JPQ0tFVApERVMjQVJNT1JFRENBUlM="},{"title":"03/14/10 FLIPPERS: Where turnabout is in play","author":"Doug Peterson, edited by Stanley Newman","date":"2010-03-14","grid":"UEVDSyNTSE9QI1pBU1UjU0xJREVTCklWQU4jTk9CUkFJTkVSI0hFTlJZSQpURUxFVklTSU9OUkFUUyNFU1RFRU0KI1JFV0lQRSNGVEMjI0FBQSNPU0xPCkFZTiNSRURTI09PSFMjRFJBV1NJTgpWT0RLQVMjVEFOTklOR0RFQiNJRFMKSU5BTEwjVFJPWSNSQVUjREVSTiMjClNFUkkjRVdFUiNQRVJJTCNET0dNQQojIyNNSU5JQVRVUkVGTE9HI09NQU4KREVCVE9SI01JTUUjI0RSVU1TT1VUCkVSQSNUSUMjQ0FQUkEjRFlFI09OUwpNQVJJQUNISSMjQVVSQSNJTlRSQVkKSVNCTiNIQU1CVVJHRVJTTlVCIyMjClRFRVRII1NIQUxFI1RSSUcjT1NTQQojI0NPSU4jSVNUI1NISVAjU05JVFMKVEFVI1ZBTVBJUkVUQUIjT0NFTE9UCk9NRUxFVFMjTEFWQSNBRlJPI0tPSQpNT1RPI0lHTyMjT01TI1JFV09SRCMKQVJJT1NPI0JBU0tFVEJBTExQT09IClRBUFNJTiNJTkdFTklPVVMjQUJVVApPTFNFTlMjRU5UUyNST0RFI0xFVFM="},{"title":"03/14/10 FLIPPERS: Where turnabout is in play","author":"Doug Peterson, edited by Stanley Newman","date":"2010-03-14","grid":"UEVDSyNTSE9QI1pBU1UjU0xJREVTCklWQU4jTk9CUkFJTkVSI0hFTlJZSQpURUxFVklTSU9OUkFUUyNFU1RFRU0KI1JFV0lQRSNGVEMjI0FBQSNPU0xPCkFZTiNSRURTI09PSFMjRFJBV1NJTgpWT0RLQVMjVEFOTklOR0RFQiNJRFMKSU5BTEwjVFJPWSNSQVUjREVSTiMjClNFUkkjRVdFUiNQRVJJTCNET0dNQQojIyNNSU5JQVRVUkVGTE9HI09NQU4KREVCVE9SI01JTUUjI0RSVU1TT1VUCkVSQSNUSUMjQ0FQUkEjRFlFI09OUwpNQVJJQUNISSMjQVVSQSNJTlRSQVkKSVNCTiNIQU1CVVJHRVJTTlVCIyMjClRFRVRII1NIQUxFI1RSSUcjT1NTQQojI0NPSU4jSVNUI1NISVAjU05JVFMKVEFVI1ZBTVBJUkVUQUIjT0NFTE9UCk9NRUxFVFMjTEFWQSNBRlJPI0tPSQpNT1RPI0lHTyMjT01TI1JFV09SRCMKQVJJT1NPI0JBU0tFVEJBTExQT09IClRBUFNJTiNJTkdFTklPVVMjQUJVVApPTFNFTlMjRU5UUyNST0RFI0xFVFM="},{"title":"03/15/10 ON THE FARM","author":"Billie Truitt, edited by Stanley Newman","date":"2010-03-15","grid":"UE9MS0EjQU1QUyNUQUJTCk9ORUFNI0NBUlAjVUNMQQpTVEVOTyNUSUVSI1JFSU4KSE9SU0VTRU5TRSNLSU5ECiMjIyNCSUQjI0FNRU5EUwpHQVNDQU4jVE9EQVkjIyMKSURFQSNVU0VSI0VUSElDClJFRUwjU0VYRVMjUkFDRQpMRUFGWSNBVE9QI09WRU4KIyMjTUFVTFMjQVRURVNUCkFVVFVNTiMjU1NFIyMjIwpUSElTI0JVTExNQVJLRVQKVEFMQyNPSElPI0JVTkNICkhVTEwjTFVNUCNBTE9IQQpFTFNFI1RIRUUjR0VUT04="},{"title":"03/16/10 BE POLITE","author":"Gail Grabowski , edited by Stanley Newman","date":"2010-03-16","grid":"VEFNRVMjQU5FVyNTQ0FUCkFEVUxUI0NPTEEjSE9NRQpST0RFTyNJVExMI0FSSUEKIyMjQ09SRElBTEdMQVNTCkJBVFRMRSMjI09SRUxTRQpFV0UjU0FUI1NQQSMjIyMKTkFNRSNMRUVLI1NBR0FTCkRJUExPTUFUSUNQT1VDSApTVEVJTiNNQU1BI0xJVEUKIyMjI0FCUyNQQ1MjU09EClNUSUZMRSMjI1RPV0VSUwpDSVZJTFNFUlZJQ0UjIyMKUkFJTiNJREVBI0NBTk9FCkFSRUQjREVBTiNFVkFERQpQQVNTI0VORFMjUkVQRUw="},{"title":"03/17/10 CHALK TALK","author":"Fred Piscop, edited by Stanley Newman","date":"2010-03-17","grid":"WkVMSUcjREFOQSNQUkVaCkVWQURFI0lDRVMjVE9STwpUQUlMT1JTSE9QI0JPTk4KQU5ORVJJQ0UjU0tPS0lFCiMjIyNHUFMjIyNFQVNFRApKSU5YRVMjU1RVTlQjIyMKQU1FWCMjRk9BTVkjU0dUCkJJTExJQVJEU1BBUkxPUgpTTkwjU1BFQUsjI1lPUkUKIyMjU0xFRFMjQllFQllFCkNVUklFIyMjRVJFIyMjIwpaU0FaU0EjU1JJTEFOS0EKQVVESSNTQ0hPT0xST09NClJBSU4jSVBPRCNBTE9ORQpTTE9HI0ZSRUUjVE9OR1M="},{"title":"03/18/10 PHOTO FINISH","author":"David W. Cromer, edited by Stanley Newman","date":"2010-03-18","grid":"Q1pBUiNMVU5DSCNTVEFCCkJPTkEjSU5VUkUjQ0FTRQpTT0FQI01JVEVSI0FDSEUKIyMjU0hBVFRFUlBST09GClBPQk9ZI1NZTCNSRVNUUwpVUEVORFMjIyNTT0QjIyMKTEFSR0VQUklOVCMjQUxJCkVSUlMjTElCWUEjU0xJRApTVFkjI0FCTkVHQVRJVkUKIyMjQUxUIyMjRVZPS0VTCkJVTEdFI1NUQSNFVkVOVApPVkVSRVhQT1NVUkUjIyMKTFVHRSNSQU5JTiNUQUlMCkFMT0UjQVRFQVQjT1BSWQpTQVNTI1lFU05PI1BFS0U="},{"title":"03/19/10 SOUND EXCHANGE","author":"Richard Silvestri, edited by Stanley Newman","date":"2010-03-19","grid":"SkVESSNMSU1BI1JBTFBIClVTRUQjT05FTCNFTU9SWQpEQU5FI09OVE8jTEFZVVAKT1VUT0ZGQVpFI0lOQU5FCiMjIyNFQVQjI0hFQUxFRApSQVpFVEhFUk9PRiMjIyMKT1hJREVTI09XRSNURUFLCk1FVEVEI0ZVTiNCRUxMSQpBU0lOI1BFVCNPVVRMRVQKIyMjI0RBWkVPRkdSQUNFClFVSVZFUiMjUkZTIyMjIwpVTlRJTCNHQUJCWUhBWkUKSUdBVkUjRVJJRSNBVk9XClJFTElUI1JJVEEjTElORQpFUk9ERSNNQVNUI09ERVI="},{"title":"03/20/10 SATURDAY STUMPER","author":"Doug Peterson, edited by Stanley Newman","date":"2010-03-20","grid":"VElNQlVLVFUjSVRDSEVECkFWSUFUSU9OI0NIT0FURQpQRU5OQU5UUyNLQVBMQU4KI1NLSSNHQU9MI05JRlRZCiMjI1NIRUxMQUNLRUQjIwpGQVNURUQjVk9BI1NPUFMKSU1QRUkjU0VUVE8jWkFQClNXT1JEQU5EU09SQ0VSWQpUQU8jSUNBTUUjVEFOVE8KU1lOQyNEUlkjVE9TU0lOCiMjQkxBQ0tTVE9ORSMjIwpTTElFUiNTVEVQI0JVRCMKV0FMUlVTI0VQSVNPREVTCkFETElCUyNSRUNST09NUwpHQVNDQU4jWUVTSUtOT1c="},{"title":"03/21/10 MORNING TO NIGHT: A full day of fun","author":"Gail Grabowski and S.N., edited by Stanley Newman","date":"2010-03-21","grid":"SEVSRCNCSUFTI1NQWSNBTExFQVJTCk9ET1IjQk9SRSNQSUUjU0xJUFBFUgpHQU1FRVFVSVBNRU5UI1NBTE9PTlMKU01FQVIjI0FUT05FI1NVTUFDIyMjCiMjI01BU0MjI1NUQU1QTUFDSElORQpFTVUjI1RBUk8jI1BBUkVTIyNOSVAKREVDQU1QTUVOVCNQUlkjI01BUkNPCklOQVdFI09WRVJUTFkjUFJPQ0VFRApUVUxBTkUjU1RBUkUjU0VFRENBU0UKIyMjU1NOUyNXSUkjTEFSRCMjQ1RTCiMjQ0hBTVBJT05TSElQTUFUQ0gjIwpVTk8jI0VSUlMjVE9UI1NUQVIjIyMKU0VSVkVTQVMjTEFQRUwjRUJBTktTClVQUklHSFQjTUlORVJBTCNPTUFOSQpSSElOTyMjRk9HI0RBTVBNT1BQRUQKUEVEIyNBQkFTSCMjTEVHUyMjU0VFClNXQU1QTU9OU1RFUiMjQUdBUyMjIwojIyNBTElBUyNHTEFTUyMjSEVBVkUKV0FOVEFEUyNHUkFIQU1DSEFQTUFOCkVMSVRJU1QjT0FUI0xPU0UjSVBTTwpUQUxFTlRTI0RZRSNUR0lGI0FNVFM="},{"title":"03/21/10 MORNING TO NIGHT: A full day of fun","author":"Gail Grabowski and S.N., edited by Stanley Newman","date":"2010-03-21","grid":"SEVSRCNCSUFTI1NQWSNBTExFQVJTCk9ET1IjQk9SRSNQSUUjU0xJUFBFUgpHQU1FRVFVSVBNRU5UI1NBTE9PTlMKU01FQVIjI0FUT05FI1NVTUFDIyMjCiMjI01BU0MjI1NUQU1QTUFDSElORQpFTVUjI1RBUk8jI1BBUkVTIyNOSVAKREVDQU1QTUVOVCNQUlkjI01BUkNPCklOQVdFI09WRVJUTFkjUFJPQ0VFRApUVUxBTkUjU1RBUkUjU0VFRENBU0UKIyMjU1NOUyNXSUkjTEFSRCMjQ1RTCiMjQ0hBTVBJT05TSElQTUFUQ0gjIwpVTk8jI0VSUlMjVE9UI1NUQVIjIyMKU0VSVkVTQVMjTEFQRUwjRUJBTktTClVQUklHSFQjTUlORVJBTCNPTUFOSQpSSElOTyMjRk9HI0RBTVBNT1BQRUQKUEVEIyNBQkFTSCMjTEVHUyMjU0VFClNXQU1QTU9OU1RFUiMjQUdBUyMjIwojIyNBTElBUyNHTEFTUyMjSEVBVkUKV0FOVEFEUyNHUkFIQU1DSEFQTUFOCkVMSVRJU1QjT0FUI0xPU0UjSVBTTwpUQUxFTlRTI0RZRSNUR0lGI0FNVFM="},{"title":"03/22/10 SIGNS OF SPRING","author":"Billie Truitt, edited by Stanley Newman","date":"2010-03-22","grid":"RFVNUFMjU0lDSyNTSE9QCklTQUFDI0NPTEEjUElQRQpORVJWRSNBVEFOI0FSVFMKR1JFRU5HUkFTUyNSRVNUCiMjI1NJUiMjSEFWRSMjIwpDT0IjQ09BTCNTRVJNT04KT1BFRCNBUkVBI1RJQVJBClJFVFVSTklOR1JPQklOUwpQUk9TRSNBREVFI1NMT1QKU0FOVEFTI0FTSVMjU1RZCiMjI1NMT0cjI0NQQSMjIwpQU1NUI0xPTkdFUkRBWVMKRUNITyNPUEFMI0lETEVTClBPT1IjRVJJRSNHTE9BVApTVEVNI0RPTEUjU0VFUlM="},{"title":"03/23/10 MOTORLESS","author":"Gail Grabowski , edited by Stanley Newman","date":"2010-03-23","grid":"QU1BU1MjU0xPUEUjQ0JTClZBTEVUI0xJTkVOI0hBSApHUk9DRVJZQ0FSVCNVU0EKI1NFVFRFRSMjUFJFQ0lQCiMjIyNTSVJTIyNBTktMRQpGVVNJT04jQUxMTkVXIyMKQUNUT04jQVRFQVQjQVRWCkNMQU4jU1BJTlkjT0dSRQpUQUcjU1BPUlQjU05PT1QKIyNFU0NBUEUjQkxFTkRTClBBQ0VSIyNTSUxPIyMjIwpBUk9NQVMjI1NBR0dFRCMKUEVBI1dIRUVMQkFSUk9XCkVOQyNOT1JTRSNOT0lTRQpSQUgjWUVBU1QjU1dFRVQ="},{"title":"03/24/10 SLITHER","author":"Fred Piscop, edited by Stanley Newman","date":"2010-03-24","grid":"U1BPREUjQUNSRSNTVFVCCkNPVkVOI01BSUwjVFVOQQpPUEVOQUNBTk9GV09STVMKVEVOI01BWkUjI0FSSUVTCiMjI1dFUkUjQVBMRU5UWQpHSUJJTEwjVFJFRUQjIyMKSURPUyMjUE9FVFMjVERTClNMSVBQRVJZQVNBTkVFTApURUwjT0JPRVMjI0FNTU8KIyMjQkxBTkQjU0tJUElUCkJFR1VJTkUjSEFVTCMjIwpFUlVQVCMjU0lHTiNQSVAKU05BS0VJTlRIRUdSQVNTClRJUkUjTkNBQSNGQUxMUwpTRUVTI1NPUlQjVVBTRVQ="},{"title":"03/25/10 COST-CONSCIOUS","author":"Fred Jackson III, edited by Stanley Newman","date":"2010-03-25","grid":"SFlQRVIjUElBRiNBU09GCkFNT1JFI0lTTEUjVE9NRQpTQ09STiNORUFUI0RVRVQKSEFII1RBS0VTQ0hBUkdFCiMjI0FTVEkjI0hPV1NBRApQQVlBVFRFTlRJT04jIyMKSURBSE8jI09JTksjTUNTCk5BUFMjUlVJTkcjTklSTwpFTVMjRkFOUyMjU0VOT1IKIyMjVklOQ0VOVFBSSUNFClVHQU5EQSMjTEVBRiMjIwpSQVRFT0ZTUEVFRCNHUFMKQUxFQyNUQVRBI0lHTE9PCkxFQUsjRVRBUyNOT0VORApTU1RTI1JFU1QjR09OR1M="},{"title":"03/26/10 NOTHING SPECIAL","author":"Merle Baker, edited by Stanley Newman","date":"2010-03-26","grid":"QUhBI0tMVURHRSNIQVdTClNFWiNIT1ZFUlMjQVhPTgpLQVQjQVJFTkFTI1JFRUwKRVZFUllEQVlGT09EIyMjCkRFQ09ZI1NTVCNQSEFTRQojIyNPQVQjIyNTRUFOQ0UKI0NPTU1PTkZSQUNUSU9OCkhBTCMjR0NMRUYjI1RSWQpPUkRJTkFSWVNFQU1BTiMKUkVFVkVTIyMjUkJJIyMjClNUUkFNI0FNQSNTQ0FNUAojIyNOT1JNQUxTQ0hPT0wKSk9TSCNBUE9MTE8jUk5BCkFSR08jR1VSSU9OI1RFTgpNT1RFI1NQSU5FRCNBWUU="},{"title":"03/27/10 SATURDAY STUMPER","author":"Jeffrey Wechsler , edited by Stanley Newman","date":"2010-03-27","grid":"Q09QSUVEI1RBUEFTQkFSCkFWRU5HRSNSU1ZQTk9URQpNQVJPT04jQUNUVUFURVMKUExFTlRJRlVMIyNHT0FUCiMjIyNJU09NRVJTI1hUUwpGQUlSU0VYI0FFT04jIyMKVUJPQVQjU0NSQVBJUk9OClNFVEkjU1FVQUQjR0lOTwpTVEFORE9VVFMjQUhNRUQKIyMjWUVUSSNNQUxURVNFCkpBRyNDT1JSVVBUIyMjIwpVTExBIyNSQURJT1NQT1QKSk9BTkJBRVojRVNQQU5BClVORE9BQkxFI0NBRUNVTQpTRUVETEVTUyNFWENFU1M="},{"title":"03/28/10 TIME ON END: With a little something added","author":"David W. Cromer, edited by Stanley Newman","date":"2010-03-28","grid":"S0ZDI1NBTEVNIyNSVVNIVE8jQklHCklSQSNIQUlUSSNIT1RIRUFEI0FSRQpXT1JLVU5ERVJDT1ZFUkFHRSNOT04KSU1UT0xEIyMjT1dFI0VSQSNNQU5YCiMjI0xBUExBVEEjI1NXT0xMRU4jIwpPU1NBIyNBVEhMRVRFU0ZPT1RBR0UKQ0xLI1NQSVRFI1RJTiMjR0FSQkVSCkhBSUxNQVJZUEFTU0FHRSNET09ORQpPTkxPQU4jU09MIyNUT1JUUyNBUkMKQVRMQVNUIyNQSVVTI0FJUiNTVEVUCiMjI1RIRUdSRUVOTUlMRUFHRSMjIwpCQVNII05FTyNORUVEIyNOQURJUlMKRURVI1BFU1RTIyNMQVcjU0lHTkVFClJJTlNPI1RPUE9GVEhFTElORUFHRQpSRVNJU1QjI0VOVCNPREVUUyNXQVIKQVVDVElPTkJMT0NLQUdFIyNDRUxTCiMjUkVUUklBTCMjSU5FUlRJQSMjIwpNT0VTI09OVCNBT0wjIyNJTlRST1MKQVBFI09ORUhFQ0tPRkFNRVNTQUdFCkxFTiNTVFJPS0VTI0ZMQVJFI0lSRQpJRFMjVE9TU0VTIyNGSVJTVCNMRUQ="},{"title":"03/28/10 TIME ON END: With a little something added","author":"David W. Cromer, edited by Stanley Newman","date":"2010-03-28","grid":"S0ZDI1NBTEVNIyNSVVNIVE8jQklHCklSQSNIQUlUSSNIT1RIRUFEI0FSRQpXT1JLVU5ERVJDT1ZFUkFHRSNOT04KSU1UT0xEIyMjT1dFI0VSQSNNQU5YCiMjI0xBUExBVEEjI1NXT0xMRU4jIwpPU1NBIyNBVEhMRVRFU0ZPT1RBR0UKQ0xLI1NQSVRFI1RJTiMjR0FSQkVSCkhBSUxNQVJZUEFTU0FHRSNET09ORQpPTkxPQU4jU09MIyNUT1JUUyNBUkMKQVRMQVNUIyNQSVVTI0FJUiNTVEVUCiMjI1RIRUdSRUVOTUlMRUFHRSMjIwpCQVNII05FTyNORUVEIyNOQURJUlMKRURVI1BFU1RTIyNMQVcjU0lHTkVFClJJTlNPI1RPUE9GVEhFTElORUFHRQpSRVNJU1QjI0VOVCNPREVUUyNXQVIKQVVDVElPTkJMT0NLQUdFIyNDRUxTCiMjUkVUUklBTCMjSU5FUlRJQSMjIwpNT0VTI09OVCNBT0wjIyNJTlRST1MKQVBFI09ORUhFQ0tPRkFNRVNTQUdFCkxFTiNTVFJPS0VTI0ZMQVJFI0lSRQpJRFMjVE9TU0VTIyNGSVJTVCNMRUQ="},{"title":"03/29/10 SQUEEZED IN","author":"Billie Truitt, edited by Stanley Newman","date":"2010-03-29","grid":"QklURVMjREFCUyNBUk1TCk9OSUNFI0lST04jUE9VVApMQUJPUiNNRVNBI1JPTEUKVFdFTFZFUEFDSyNJVEVNClNFVCNFTEwjI0VUQyMjIwojIyNSVURFU1QjVk9JRFMKU1RSSVBFI0FJUlNUUklQCkFSVUcjUkhZTUUjSkFWQQpQVVNIRVNPTiNMT0FORVIKU0VFVE8jUE9ESVVNIyMjCiMjI1NOTyMjSVNUI1RPTwpCRVNUI1JPVUdIQ1JPV0QKT0FIVSNCQVJTI0FJREVECkFTT0YjSVRTQSNTUE9JTApSRUVGI1RIQVQjVEVTVFk="},{"title":"03/30/10 CARNIVAL QUARTET","author":"Gail Grabowski , edited by Stanley Newman","date":"2010-03-30","grid":"Q0FHRSNBTE9TVCNBUkNICkFMQVMjU0VWRVIjRklSRQpST01QI1NFRU1FI0dMVUUKVEVFI0ZFUlJJU1dIRUVMCiMjQlJBTiMjI1RPQVNUUwpBTU9VTlQjU0FMT04jIyMKRk9PTFMjUk9XRUQjVFJBCkFOVEUjI1VOTyMjTUVPVwpSQUgjUEVEQUwjTEFETEUKIyMjTE9ORVIjUkFJREVEClNOQUlMUyMjI0VERFkjIwpDT1RUT05DQU5EWSNCTFQKQUxPVCNBTExPWSNCRUFVCkxJTkUjUkFJU0UjRUFUUwpERUVSI0VOREVEI1RSRUs="},{"title":"03/31/10 POETRY SANDWICHES","author":"Robert A. Doll, edited by Stanley Newman","date":"2010-03-31","grid":"TVBHI0RPQUJMRSNGUk9HCkVBUiNBRlJBSUQjQVVSQQpEUkVTU0ZPUlNVQ0NFU1MKSUtFQSMjREVMI0FFU09QCkNBVE5BUCNTRVVTUyMjIwojIyNFR09TIyNTVElGRlMKI1RIUkVFT05USEVUUkVFCkFCWSMjI0ZJUiMjI0VUQQpNQURFSU5USEVTSEFERSMKRlJFU05PIyNTSEFNIyMjCiMjI0NBUkxBI0hZRU5BUwpTVFJBUCNJTEUjI05PUkEKU0hPUFRJTExZT1VEUk9QClRBTUUjU0xFRVBTI1RTUApTSVBTI1RFTlNFUyNIRVk="},{"title":"04/01/10 ON THE DOUBLE","author":"David W. Cromer , edited by Stanley Newman","date":"2010-04-01","grid":"RUxNIyNKQURBI0FEQVBUClZJRVMjQU1PUiNNQU5PUgpJTU1FRElBVEVGQU1JTFkKTEVPTkUjWkVBTCNTVEVNCiMjI1NMT0UjI0FURUFTRQpGTEVFVEFETUlSQUwjIyMKTEFSSUFUI09SRU8jTVJTCkFWSVMjI0VSQSMjTUFVSQpUQU4jWVVNQSNOQUlMSU4KIyMjSEFTVFlQVURESU5HClJFVEFLRSMjQUlERSMjIwpFWElUI1JFTFkjRUFWRVMKRVhQUkVTU1lPVVJTRUxGCkRPUEVZI1BMVVMjVEVNUApTTklERSNORVRTIyNST0Q="},{"title":"04/02/10 BEEKEEPERS","author":"Doug Peterson , edited by Stanley Newman","date":"2010-04-02","grid":"Q0xBU1AjQkxJUCNBV0xTCkxPU0VSI0FJREEjRFJJUApPQ0hSRSNCRUVSI1ZJVkEKR0FCQllOSU5FVElFUyMjClNMWSNTSEUjI0hPUlRPTgojIyNHT0xERU5SVUJCTEUKQkFDT04jI0NVRVMjQURTCkFUQUQjUEhPTkUjU05JVApSRU0jRVJJTiMjRkFERVMKQkFCQkxFU09GSEFZIyMjClNUT0xBRiMjT1dOI1RBTQojI0RFTElWRVJZQk9CQlkKQ0hJQSNHSUJCI0FYSUFMCk9NQVIjSEVSRSNTRVJUQQpQT05ZI1RXT1MjRU5ERVI="},{"title":"04/03/10 SATURDAY STUMPER","author":"Anna Stiga , edited by Stanley Newman","date":"2010-04-03","grid":"SU1QUkVTU0lWRSNBU1BTCkxBU0VSVE9ORVIjU1BBVApJTkFCU0VOVElBI1NJUkUKQUlMUyNQSUxMUyNOQ0FBCkRBTSNET0MjU0VDI0VMTQojIyNNU05CQyNTT0xERVIKQU1CSVRJT1VTI0dJVEdPCk5PUkEjVE9SQUgjTUVBTApFREFNUyNNRUxPTkJBTEwKQ0VTSVVNI1NUTEVPIyMjCkRSUyNCQUgjUEVXI09QUwpPTkVTI0xVUkVEI0ZSRUUKVEFSUCNBTkFUT01JQ0FMCkVSSUUjV0FLRVVQQ0FMTApTVEVXI0lORVJUR0FTRVM="},{"title":"04/04/10 WHO WROTE WHAT?: For National Poetry Month","author":"S.N. , edited by Stanley Newman","date":"2010-04-04","grid":"Q0FUVExFI1NUQVIjTUVTSCNDQVRTCklTV0VBUiNMQU1FI0FMVE8jRVJJRQpSSE9OREEjQVhFUyNESUVNI0xFTlQKI0VETkFTVFZJTkNFTlRNSUxMQVkjCiMjI0lERUEjIyNJU0VFI05JQSMjIwpUT1JTTyNSRUNBTlRTI0JPRVJXQVIKRU1PI0dFUlRSVURFU1RFSU4jQUxJCk5BQlMjUllERVIjIyNJTkQjQ0xPUApUSEVBQ1QjU0VBU1RBUiNTQ0FUSEUKSEFSVExFWSMjI1lBTEVVI0FOV0FSCiMjVElPI09HREVOTkFTSCNOQUgjIwpTT0ZBUyNOT0RUTyMjI0ZPU1NJTFMKQ1VSVEVSI1RST0RERU4jSE9UVElQCk9UT0UjRU1UIyMjT1JJT04jQU1CSQpPRFMjRURHQVJBTExBTlBPRSNBUlQKUE9UU0RBTSNFTUlUVEVSI0FSTkFaCiMjI0FUTCNPRElOIyMjQUdSQSMjIwojT0xJVkVSV0VOREVMTEhPTE1FUyMKU0tJTiNSVUxFI0VQRUUjRk9SQklEClBBTlQjVEVFTSNOSU5BI0FCT0FSRApBWUVTI1NTVFMjU0NBTiNSRURZRVM="},{"title":"04/04/10 WHO WROTE WHAT?: For National Poetry Month","author":"S.N. , edited by Stanley Newman","date":"2010-04-04","grid":"Q0FUVExFI1NUQVIjTUVTSCNDQVRTCklTV0VBUiNMQU1FI0FMVE8jRVJJRQpSSE9OREEjQVhFUyNESUVNI0xFTlQKI0VETkFTVFZJTkNFTlRNSUxMQVkjCiMjI0lERUEjIyNJU0VFI05JQSMjIwpUT1JTTyNSRUNBTlRTI0JPRVJXQVIKRU1PI0dFUlRSVURFU1RFSU4jQUxJCk5BQlMjUllERVIjIyNJTkQjQ0xPUApUSEVBQ1QjU0VBU1RBUiNTQ0FUSEUKSEFSVExFWSMjI1lBTEVVI0FOV0FSCiMjVElPI09HREVOTkFTSCNOQUgjIwpTT0ZBUyNOT0RUTyMjI0ZPU1NJTFMKQ1VSVEVSI1RST0RERU4jSE9UVElQCk9UT0UjRU1UIyMjT1JJT04jQU1CSQpPRFMjRURHQVJBTExBTlBPRSNBUlQKUE9UU0RBTSNFTUlUVEVSI0FSTkFaCiMjI0FUTCNPRElOIyMjQUdSQSMjIwojT0xJVkVSV0VOREVMTEhPTE1FUyMKU0tJTiNSVUxFI0VQRUUjRk9SQklEClBBTlQjVEVFTSNOSU5BI0FCT0FSRApBWUVTI1NTVFMjU0NBTiNSRURZRVM="},{"title":"04/05/10 SPRING FLING","author":"Gail Grabowski , edited by Stanley Newman","date":"2010-04-05","grid":"U0xBTSNUT0FEUyNDT1BTCkhJRkkjQUxMQVkjRVZJTApPQVJTI1JFQUlSI0RBVEUKVFJPVCNUT1NTQVNBTEFECiMjI0xCUyMjI0NBUiMjIwpXQVRFUiNDTE9VRCNTQVAKQUJBVEUjT0FUUyNNRU1PClRIUk9XSU5USEVUT1dFTApDT1BFI01FVEUjQUxPTkUKSFJTI1JJU0VSI01FTkRTCiMjI1NBVCMjI1NFQyMjIwpQSVRDSEFURU5UI1VTRUQKU09SRSNUQUJPTyNMSVZFClNXQU4jRUxCT1cjRURFTgpUQVBFI0RFU0tTI1NFTlQ="},{"title":"04/06/10 MATTER OF TASTE","author":"Billie Truitt , edited by Stanley Newman","date":"2010-04-06","grid":"QU1JRCNDQVBUI0VTU0FZClJFRE8jQUZBUiNSQUlTRQpNT0xUI0NMVUUjQUxUT1MKU1dFRVRUQUxLI1NURU5PCiMjIyNIVVQjI0dFWVNFUgpTQVNTRVMjTVlSUkgjIyMKU1BPT04jTUFNQSNVTklUClRPRlUjU0FVQ1kjTU9SRQpTUEFSI0xBVkEjTk9USU4KIyMjR1JJTUUjU09SRVNUClRFQVJVUCMjU0lOIyMjIwpVUkJBTiNCSVRURVJFTkQKVFJBUFMjQVNBUCNPUkVPClRPU0VBI0FMTUEjTElPTgpJUkVTVCNTRVBUI0xFTlQ="},{"title":"04/07/10 FAUNA BUSINESS","author":"Norma Steinberg , edited by Stanley Newman","date":"2010-04-07","grid":"QkJDI01FTkRTI0FQTFVTCkFJUiNBRE9STiNTRUlaRQpDUkVBVFVSRU9GSEFCSVQKQURBR0UjIyNSRUVTRSMjCkxJVEUjU09GVEVOI1JPVwpMRUUjQ09MQVMjI1RBUEUKIyMjQ0FSRVQjUk9PVEVECiNCRUFTVE9GQlVSREVOIwpSRUxJRVMjUklOR08jIyMKT1ZFTiMjSEVOTlkjUEFXCk5ZQyNTUEVFRFkjUFVSRQojI1RPVEFMIyMjTElNSVQKQU5JTUFMTUFHTkVUSVNNCkNPVkVSI0VYUE9TI0NFTwpFVkVOVCNURUFNUyNFU1A="},{"title":"04/08/10 AUSSIE WILDERNESS","author":"Fred Piscop, edited by Stanley Newman","date":"2010-04-08","grid":"UElUSCNCSU9TI1NUT1dTCkRPUkEjQVRPUCNUSUFSQQpRVUlaI1JBWkUjQVBISUQKI1NQRUNLTEVEVFJPVVQjCiMjIyNSRVkjI1JFRiMjIwpTT09ORVIjQ0hJI0ZJUkUKQVRTRUEjU0hBTFQjQ09OCldIQVRTSVRBTExBQk9VVApFRUsjRU1BSUwjTFVOR0UKRFJBRyNFUlIjVEVOU0VSCiMjI1VTQSMjUEFOIyMjIwojR1VJTk5FU1NTVE9VVCMKUEFTVEEjTU9BVCNXSE9NClNURUFLI0lETEUjTE9HRQpURVJSWSNUQU1TI1NIT1Q="},{"title":"04/09/10 TRAVEL ADVICE","author":"David W. Cromer, edited by Stanley Newman","date":"2010-04-09","grid":"SU5TVCNIQVRTI1JBR1MjCk5PQUgjSURFQSNBQ1JPIwpJRllPVURPTlQjREhBQkkKTlVOI05FUk8jQklUVEVSCktOT1dXSEVSRVlPVUFSRQojIyNSRU9TI1JBSU4jIyMKRkxPWUQjI0dPSU5HWU9VCkVFUiMjQkFUT1IjI09BUwpNSUdIVEVORCMjREFOVEUKIyMjT0lTRSNCQVdMIyMjClVQU09NRVdIRVJFRUxTRQpHRVRTSVQjWUFMRSNBUFIKQUNSSUQjWU9HSUJFUlJBCiNLQUVMI09JTFMjQVZJUwojU1BSWSNPREVTI1JBR0U="},{"title":"04/10/10 SATURDAY STUMPER","author":"Doug Peterson , edited by Stanley Newman","date":"2010-04-10","grid":"U1BSQUlOUyNGSU5FQVJUCkNPVUxETlRCRUJFVFRFUgpIVUJCTEVURUxFU0NPUEUKVVRMRVkjSEFMQVMjTkFNClNFRU4jVE9URU0jUkVQTwpTUlMjTElNRUQjV0FGRVIKIyMjUEFHQU4jTUFZT1JTCiNWT0lDRVMjUklHT1JTIwpST0xMRVIjRE9ORU4jIyMKQUxERVIjQVJNT1IjQkFTCkNBU1MjUExFQVQjUElUWQpFVEEjU0xPQU4jV0FMVFoKV0lMTElBTU1DS0lOTEVZCkFMVEVSTkFURUVORElORwpZRVNERUFSI1JBR0dFRFk="},{"title":"04/11/10 THE MARKS BROTHERS: They were all once 128 Across","author":"Fred Piscop, edited by Stanley Newman","date":"2010-04-11","grid":"UElOVE8jU0VSQiNDVVNQUyNQQVBBCkFTSUFOI0NMVUUjT05JT04jQVJFQQpDRUxMT1BIQU5FI01JTUVPR1JBUEgKS0VFTCNDT0xFVFRFIyNNT1JBTEVTCiMjI0lGU08jI1NBU0gjI1RBQiMjIwpUQU1FUiNMT1cjVFRPUFMjQkxBUyMKRVZBREVTI1ZJREVPVEFQRSNFTEkjCk1JRyNFTlNVUkUjI1NMQVQjI0xFQQpQU0kjV09PTEVOI0FQT1JUI01FU0gKIyNDUkFCQkUjVEFSTyMjQUtJTlRPCkZFTVVSI0VTQ0FMQVRPUiNFTFdBWQpFTEFURUQjI1VURVAjUE9VUkVSIyMKU0lSUyNJQ0FSRSNBUklPU08jRVZFClRTSyMjUkVCQSMjSE9OREFTI05FQwojSEVTI1RPVUNIVE9ORSNGRU5DRVIKI0FSS1MjU1RBSVIjQVNII05FSFJVCiMjI0lMSyMjT01FTiMjT1dFUyMjIwpTVU1NT05TIyNTRUFUVExFI0NBU1MKVFJBTVBPTElORSNUUkFERU1BUktTCk9HTEUjQkFHRUwjQUlERSNBRlRFUgpXRUVEI1NQT09GI0xPQU0jUkVZRVM="},{"title":"04/11/10 THE MARKS BROTHERS: They were all once 128 Across","author":"Fred Piscop, edited by Stanley Newman","date":"2010-04-11","grid":"UElOVE8jU0VSQiNDVVNQUyNQQVBBCkFTSUFOI0NMVUUjT05JT04jQVJFQQpDRUxMT1BIQU5FI01JTUVPR1JBUEgKS0VFTCNDT0xFVFRFIyNNT1JBTEVTCiMjI0lGU08jI1NBU0gjI1RBQiMjIwpUQU1FUiNMT1cjVFRPUFMjQkxBUyMKRVZBREVTI1ZJREVPVEFQRSNFTEkjCk1JRyNFTlNVUkUjI1NMQVQjI0xFQQpQU0kjV09PTEVOI0FQT1JUI01FU0gKIyNDUkFCQkUjVEFSTyMjQUtJTlRPCkZFTVVSI0VTQ0FMQVRPUiNFTFdBWQpFTEFURUQjI1VURVAjUE9VUkVSIyMKU0lSUyNJQ0FSRSNBUklPU08jRVZFClRTSyMjUkVCQSMjSE9OREFTI05FQwojSEVTI1RPVUNIVE9ORSNGRU5DRVIKI0FSS1MjU1RBSVIjQVNII05FSFJVCiMjI0lMSyMjT01FTiMjT1dFUyMjIwpTVU1NT05TIyNTRUFUVExFI0NBU1MKVFJBTVBPTElORSNUUkFERU1BUktTCk9HTEUjQkFHRUwjQUlERSNBRlRFUgpXRUVEI1NQT09GI0xPQU0jUkVZRVM="},{"title":"04/12/10 GET THE POINT","author":"Gail Grabowski, edited by Stanley Newman","date":"2010-04-12","grid":"QVRPTSNQRVNUTyNFRElUClNBTUUjQUxJRU4jU0FTRQpBWEVTI1NBVEFUI1RSRUUKUElOU0VUVEVSI1JBVEVTCiMjI0hBUkVTI1BJVEEjIwpDQU5BUlkjI01JTkVSQUwKT1ZBTCMjUFJPTkcjT1JFClNBSUwjRE9VQlQjU1VFRApUSUwjREVOVFMjI0tOSVQKU0xJREVCWSMjU0FJRE5PCiMjVEVOVCNBVk9JRCMjIwpTQURMWSNTUEVBUk1JTlQKUExPVCNTSEFSUCNBUklBCklPV0EjUFVSU0UjUk9DSwpURU5TI0FOVEVEI0tORUU="},{"title":"04/13/10 NO UNCERTAIN TERMS","author":"Sally R. Stein , edited by Stanley Newman","date":"2010-04-13","grid":"Rk9VUiNUSElTI1NDQVJFCkVBU0UjRVVSTyNIQVRFRApTSEVEI0NNT04jRVJPREUKU1VSRVRISU5HI0xFTU9OCiMjI1BBSUQjI09MRCMjIwpTVFJPS0UjUEFEUyNDUEEKQVJJU0UjU09MTyNCQUlMCkRFRklOSVRFQVJUSUNMRQpMRUZUI1JBTVMjRVRIRVIKWURTI0ZJVFMjQVBURVNUCiMjI0dBUyMjRVJJRSMjIwpUT1RFUyNGSVhFRFJBVEUKRUdSRVQjQUtJTiNFUklOCkFST1NFI01FU0EjU0VFRApNRVRFUiNFQVRTI1RBUlM="},{"title":"04/14/10 HE'S HERE AT LAST","author":"Norma Steinberg , edited by Stanley Newman","date":"2010-04-14","grid":"VEFQRUQjTklMRSNWQ1JTCkFCSE9SI09XRVMjT1JFTwpDTE9ORSNXT05LI0xPR08KS0VOI1NUQU5ESU5HUEFUCiMjRVNTQVkjI01FQVNMWQpBQkJFWVMjQVdPTCMjIyMKUlVJTiNUQURBI0xFREdFCklMTFMjRVhVUkIjVFJPWQpBTExFUyNFTFNBI0hJUkUKIyMjI1BPU1QjU0xBVkVECkFCUk9BRCMjRElBTkUjIwpHUk9VTkRDSFVDSyNSQkkKSU9VUyNKVU1QI0VTU0VOCkxPU1QjT0JPRSNSRUVMUwpFTVRTI0JBU1MjU0FEQVQ="},{"title":"04/15/10 HOW'S YOUR STEAK?","author":"Robert A. Doll, edited by Stanley Newman","date":"2010-04-15","grid":"QkVTUyMjRUZMQVQjQ1NUCkJBU0lFI0xMQU5PI09ORQpCVVJOVFNJRU5OQSNMRUUKIyMjQ0FTSEVEI1NFREFOCkFDUkUjTlVUUyNUQUNLUwpUT0FSTVMjI0xBU1NPIyMKU09XRUQjQk9JTCNZTUNBCkVMTSNTQ0FMREVEI0ZPUgpBU0FQI0ZSRUUjU1BPUlQKIyNUVURPUiMjQkxBUkVTCkNSRU1FI0FMVE8jSVRSWQpSVVJBTCNDRUFTRUQjIyMKQUxJI1RPVUdIQ09PS0lFClRFQSNBVURJTyNFRklMRQpFU0wjU1RBVEUjI0ZBTEw="},{"title":"04/16/10 RUN ACROSS","author":"Bruce Venzke , edited by Stanley Newman","date":"2010-04-16","grid":"QklMS1MjQUpBUiNCQVRIClVSSUFII1JFTE8jVFJJTwpSQU1QQU5UUklPVFdJTEQKUkVCT1pPI0tBVE8jQURBCiMjI1dBRlRTI0VSQVNFRApBSEEjTUFJI0VSUlMjIyMKTFVSSyNJUkFOI0lNQUdFCkFMT05HUkFHR0VEQU1PSwpOQURJUiNERVVYI0RPR0cKIyMjRklGRSNMSUIjU09TCkFOR0VMQSNDRkxBVCMjIwpNQVIjTFVMVSNFTEFURVMKT1ZFUlNDQVJFRFNIT1JUCk5BVEUjRVpJTyNBT1JUQQpHTEFEI1RFRU4jTUVURVI="},{"title":"04/17/10 SATURDAY STUMPER","author":"Merle Baker , edited by Stanley Newman","date":"2010-04-17","grid":"UFJPVkVSQiNVU0VMRVNTClJFQ0lURVIjTUFMQVJLWQpBR0VTQUdPI0JZTElORVIKTEFMQSNJQ0tFUyNERUxJCklMTyNUU0hJUlRTI1NUQQpOSVRUSSNVTlMjQUxUT04KRUFTWU1BUksjRlJFT04jCiMjI0xJS0VBU0hPVCMjIwojU0NFTkEjSlVBTkdSSVMKR0VPUkcjTk9CI0dPRVNUCklRUyNTUE9VU0VTI1ZBUgpCVVRUI0FMU09QI0pFREkKSU9ORVNDTyNOT05JUk9OCkxJRU5FRVMjSUNFQkVSRwpMQVJERVJTI0NIRUVTRVM="},{"title":"04/18/10 PLAY BALL: Showing team spirit","author":"David W. Cromer , edited by Stanley Newman","date":"2010-04-18","grid":"RkxFRCNMSU1OI1JBU1AjUklWQUxTCkxBRFkjSURFQSNPTkxZI0lTT0dPTgpBTkdFTFNJTlZFU1RPUiNPUlRFR0EKSUNFI09MRFNBTFQjVEFCI0FFU09QClJFU09MRSNBTEVSVCNNT1dFUiMjIwojIyNTSVNJIyNDQVJESU5BTFNTSU4KQk9BU1QjRkFRIyNFSURFUiMjQURFCklORElBTlNTVU1NRVIjI1NFUFRFVApCRUQjI0dPSE9NRSNFRUwjTE9FU1MKI0xPVFNBI0FUTVMjI05PRUxTIyMjCiMjTkFUSU9OQUxTU0VDVVJJVFkjIwojIyNST09TVCMjSVRBTCNBU1NBTSMKSU5GT1IjU0lCI0xPR09VVCMjVEFSCk1BTFRFRCMjUk9ZQUxTU09DSUVUWQpBTkEjI0VBVEVOIyNFRUUjSEFTVEUKQ1VCU1JFUE9SVEVSIyNEUkFHIyMjCiMjI1BJUEVTI09YSURFI0FST01BUwpVTkhJUCNTUEEjQURBTUFOVCNBSEEKRk9VUlBNI0FUSExFVElDU1NIT0VTCk9ORklMRSNST09UI0VMTU8jSVJBUwpTT0ZURU4jRU1UUyNTRUVNI1RJRFk="},{"title":"04/18/10 PLAY BALL: Showing team spirit","author":"David W. Cromer , edited by Stanley Newman","date":"2010-04-18","grid":"RkxFRCNMSU1OI1JBU1AjUklWQUxTCkxBRFkjSURFQSNPTkxZI0lTT0dPTgpBTkdFTFNJTlZFU1RPUiNPUlRFR0EKSUNFI09MRFNBTFQjVEFCI0FFU09QClJFU09MRSNBTEVSVCNNT1dFUiMjIwojIyNTSVNJIyNDQVJESU5BTFNTSU4KQk9BU1QjRkFRIyNFSURFUiMjQURFCklORElBTlNTVU1NRVIjI1NFUFRFVApCRUQjI0dPSE9NRSNFRUwjTE9FU1MKI0xPVFNBI0FUTVMjI05PRUxTIyMjCiMjTkFUSU9OQUxTU0VDVVJJVFkjIwojIyNST09TVCMjSVRBTCNBU1NBTSMKSU5GT1IjU0lCI0xPR09VVCMjVEFSCk1BTFRFRCMjUk9ZQUxTU09DSUVUWQpBTkEjI0VBVEVOIyNFRUUjSEFTVEUKQ1VCU1JFUE9SVEVSIyNEUkFHIyMjCiMjI1BJUEVTI09YSURFI0FST01BUwpVTkhJUCNTUEEjQURBTUFOVCNBSEEKRk9VUlBNI0FUSExFVElDU1NIT0VTCk9ORklMRSNST09UI0VMTU8jSVJBUwpTT0ZURU4jRU1UUyNTRUVNI1RJRFk="},{"title":"04/19/10 VEGGIE PLATE","author":"Billie Truitt , edited by Stanley Newman","date":"2010-04-19","grid":"UklTRSNEQUlTIyNCQVNFCkVSSUUjT05DVUUjRVZJTApDQVJST1RUT1BTI0FJTFMKQVRFI1BFRU4jQ0FORExFClBFTlBBTFMjVEFMQyMjIwojIyNFTEwjU1VQUE9TRUQKSFVNUFMjQk9ORSNVUFRPCkFOQVAjR0xVRUQjTk9URQpMSUtFI1JFUFMjT1RURVIKT1ZFUlBBU1MjSFVFIyMjCiMjI1VSTlMjR0VUUklDSApUUklQT0QjQ09FRCNOUkEKUkFTUCNQRUFTSE9PVEVSCk9HTEUjQVRTRUEjQ1JBTQpERUVSIyNDSEVXI1RPTVM="},{"title":"04/20/10 IN DISGUISE","author":"Gail Grabowski, edited by Stanley Newman","date":"2010-04-20","grid":"U0FMU0EjQUxUTyNGUkFUCk9CT0VTI0dPQUwjTElNRQpCTEFDS0JFQVJEI0lERUEKU0VOI1NBTkQjV0lQRVJTCiMjI1dJTFQjREVDTyMjIwpFUk1JTkUjQVJTRU5BTCMKQkVBTiNTUExJVCNFQ09MCkJMVUUjI1JFRiMjU09GQQpTSU5HI1NPUlRTI1dSQVAKI1RBTExFU1QjUEFJTlRTCiMjI0FJUkUjUE9ORyMjIwpSRURTRUEjUEFSVCNTVFMKRUFSUyNQQVNTVEhFSEFUCklTRUUjRUFTVCNFUk9ERQpORVdTI1NBVEUjTUFEQU0="},{"title":"04/21/10 WET QUARTET","author":"David W. Cromer, edited by Stanley Newman","date":"2010-04-21","grid":"RElFTVMjQlJBRFMjRVBBCkVSTklFI1JPU0lFI1RBWApGT1VOVEFJTlBFTiNOSUwKSU5SRSNURUEjVEFNQUxFCkxFRVJBVCMjI0VUQSMjIwpFRFMjV0VMTERSRVNTRUQKIyMjUkVOT0lSI1NDQVJFCkFNTU8jREVNT1MjT01BTgpQQU5JQyNTSUxFTlQjIyMKUE9PTEhVU1RMRVIjTVJTCiMjI0VSUyMjI0lBR1JFRQpTVFVESU8jTUFOI0FCTEUKV0FOI1NQUklOR0JSRUFLCkFMSSNURUFTRSNBQkFURQpCRVQjSU5UT1cjVE9ORVI="},{"title":"04/22/10 SPINNING TOPS","author":"Fred Piscop , edited by Stanley Newman","date":"2010-04-22","grid":"U0NSRVcjU0FDS1MjU01VClVSSUFII0lNUEVJI1RBUApQT1RTQU5EUEFOUyNPUkUKU1dFRVRJRVMjI1RJUElOCiMjIyNTUEEjU1RFQU1FRApTRVBJQVMjU1RFUk5PIyMKSVJPTlkjUEFJTlMjVElNClRBU0sjV0lMRVMjV0lERQpTU1QjRlJFRVMjQ09PTFMKIyNJU0xFVFMjQ0FOTkVTCkFOVEhPTlkjQ0FSIyMjIwpNT05FVCMjRVVST0NFTlQKQklPI1NQT1RSRU1PVkVSCkVTVCNBUklBTCNFUkFTRQpSWUUjTU9MTFkjREVOU0U="},{"title":"04/23/10 SWEET DISPOSITION","author":"Raymond Hamel , edited by Stanley Newman","date":"2010-04-23","grid":"TUFTS1MjQ0FQRSNRVUFECkFMQ09BI0FYT04jVU5UTwpTVEFSVCNQRUxUI0lDRUQKSE9ORVlSWURFUiNDTElPCiMjI0FSQUIjREFSS0VOUwpUSFkjU1RBWSNQRVMjIyMKQk9PQiNFUk9TI1BBTkRBClNVR0FSUkFZTEVPTkFSRApQUklERSNTT0FQI0RJQVoKIyMjVEFKI1NUT1AjTFlFCkRFVkVMT1AjRVhFQyMjIwpBVE9NI0NBTkRZQ0xBUksKV0hJUCNVU0FGI1RBQk9PCk5JTEUjTkVNTyNJUklTSApTQ0FSI0RPRVIjTkFUQUw="},{"title":"04/24/10 SATURDAY STUMPER","author":"Barry C. Silk , edited by Stanley Newman","date":"2010-04-24","grid":"RklMTEVSI0FSQVBBSE9TCkFSSU9TTyNQRVRVTEFOVApNT09HU1lOVEhFU0laRVIKSU5OSUUjQU5BSVMjQVBBClNFRU4jV0lFU1QjRVJPUwpIREwjV0FMU0gjTUlESVMKIyNCRUlHRVMjQ09TSU5FCiNUQU5ORUQjVEFMRU5UIwpTSFJFRFMjSFVNQU5TIyMKS0VSUlkjRUVMRVIjVVNTCllPWU8jQVhJQUwjQlJPVwpNQ00jQUxJR04jTUVBUkEKQVJPVU5EVEhFQ09STkVSClBBUkFLRUVUI1NQWUNBTQpTVEVXQVJEUyNJU0xFVFM="},{"title":"04/25/10 THEY SAID IT: In six memorable movies","author":"Merle Baker, edited by Stanley Newman","date":"2010-04-25","grid":"U09PVCNCRUlORyNSQVZFTCNJWk9EClJBUkUjRUxTSUUjQUdJTEUjTk9ORQpUSEVSRVNOT1BMQUNFTElLRUhPTUUKQVVHUkFUSU4jQUxJTkVTI05PVEVECiMjI0lUSU4jU1RBTkRTI0RTQyMjIwpIRVJFU0xPT0tJTkdBVFlPVUtJRCMKQU1PUkFMI0NPTlMjIyNPTkUjQ09CCk1JRFNUI1lFUyMjT1NPTEUjTUVTQQpTVEUjI0dPQUhFQURNQUtFTVlEQVkKIyMjU1RFUk4jR1JFRUsjI1JPVUdFCkVTUE9VU0UjQ1JFVEUjRFJJUFBFRApUSE9STiMjVFJFTlQjUEVBU0UjIyMKSEFTVEFMQVZJU1RBQkFCWSMjT0RFCkFMQVMjQVJBQlMjI0xJVCNKSUJFUwpOT0QjQVRUIyMjU0hBRyNTRU5FQ0EKI01BWVRIRUZPUkNFQkVXSVRIWU9VCiMjI09TUyNBQkhPUlMjSU1TTyMjIwpFRERJRSNBVFRJTEEjQVNQRVJTRVMKWU9VQ0FOVEhBTkRMRVRIRVRSVVRICkVaRUsjRUlFSU8jREVURVIjT1JOTwpERVRTI1RFUk5TI1NFTkRTI1JFQVA="},{"title":"04/25/10 THEY SAID IT: In six memorable movies","author":"Merle Baker, edited by Stanley Newman","date":"2010-04-25","grid":"U09PVCNCRUlORyNSQVZFTCNJWk9EClJBUkUjRUxTSUUjQUdJTEUjTk9ORQpUSEVSRVNOT1BMQUNFTElLRUhPTUUKQVVHUkFUSU4jQUxJTkVTI05PVEVECiMjI0lUSU4jU1RBTkRTI0RTQyMjIwpIRVJFU0xPT0tJTkdBVFlPVUtJRCMKQU1PUkFMI0NPTlMjIyNPTkUjQ09CCk1JRFNUI1lFUyMjT1NPTEUjTUVTQQpTVEUjI0dPQUhFQURNQUtFTVlEQVkKIyMjU1RFUk4jR1JFRUsjI1JPVUdFCkVTUE9VU0UjQ1JFVEUjRFJJUFBFRApUSE9STiMjVFJFTlQjUEVBU0UjIyMKSEFTVEFMQVZJU1RBQkFCWSMjT0RFCkFMQVMjQVJBQlMjI0xJVCNKSUJFUwpOT0QjQVRUIyMjU0hBRyNTRU5FQ0EKI01BWVRIRUZPUkNFQkVXSVRIWU9VCiMjI09TUyNBQkhPUlMjSU1TTyMjIwpFRERJRSNBVFRJTEEjQVNQRVJTRVMKWU9VQ0FOVEhBTkRMRVRIRVRSVVRICkVaRUsjRUlFSU8jREVURVIjT1JOTwpERVRTI1RFUk5TI1NFTkRTI1JFQVA="},{"title":"04/26/10 SHELL GAME","author":"Gail Grabowski , edited by Stanley Newman","date":"2010-04-26","grid":"QUNUUyNBV0FZIyNUSUxUCkNIQVQjRE9MRSNBVURJTwpEQVRBI09NRU4jV1JPTkcKQ1JBQkdSQVNTI0FUU0VBCiMjIyNJTk4jI0FJTCMjIwpTUEVMTFMjQ09OVEVNUFQKQ0FST0wjQkFJVCNESVJFCkFSQUIjUk9MTFMjT05BTgpNRVNTI0FMTFkjRVZFTlQKUFJFVEVORFMjQ0xFUktTCiMjI0VNVCMjRkxBIyMjIwpNRVRSTyNTTkFJTE1BSUwKQVBBUlQjSElERSNVTkRPClRFUEVFI09QRU4jU1RPUApIRUVEIyNQU1NUI1RJTEU="},{"title":"04/27/10 THROWAWAYS","author":"Billie Truitt, edited by Stanley Newman","date":"2010-04-27","grid":"Q0FTSCNTTElNI1dBVENICk9SRU8jQU9ORSNBTE9IQQpMRUFOI0RPVFMjU0VEQU4KVEFMS0VEVFJBU0gjT1JHCiMjIyNBTFNPI1BFQyMjIwpBU1JBUkUjI0ZJUkVNQU4KU1BFTlQjQUNSRSNOT1NFClBJQ0tPRlRIRUxJVFRFUgpFVEFMI0VNSVQjTUVURUQKUkVQRU5UUyMjUEFST0RZCiMjI1NJQyNTSEFHIyMjIwpQQlMjQ0hJTkVTRUpVTksKTEVBU0UjQklEUyNBVE9OCkVBU0VMI0VER0UjTUFHSQpEVVNUWSNURUVTI1NIT1Q="},{"title":"04/28/10 BOOK REVIEW","author":"Norma Steinberg , edited by Stanley Newman","date":"2010-04-28","grid":"Q0hFRiNTUEFUI1RXSVNUCkhPTEUjQVVSQSNZRU5UQQpJQkVUI1VTRVIjUEVSSUwKQ09WRVJDSEFSR0UjRVJFCiMjIyNFWUUjQVJBQiMjIwpDT1NUQSNTQUdBI1VUQUgKQVRUSUNTI0JPTiNST1NFCkNIQVBURVJBTkRWRVJTRQpIRUxQI05BVCNTRUFURUQKRVJMRSNESUVUI1JVU1RTCiMjI1JFSU4jQUlEIyMjIwpDQVQjSU5ERVhGSU5HRVIKQUxPTkcjUlVJTiNPTkxZClBFUkNII09SRU8jTkFTQQpTQ09PVCNQT1NUI09XRU4="},{"title":"04/29/10 MALE BONDING","author":"Fred Piscop, edited by Stanley Newman","date":"2010-04-29","grid":"TUFURVMjQlVSUiNESVNICkFWSUxBI1JIRUEjVU5UTwpKT0xMWUdPT0RGRUxMT1cKQU5UI1lFQUgjRkxZRVJTCiMjI1BFTkQjR0lOI1RLTwpERUJBU0UjQlJBSU4jIyMKQUdFUyNWSUxFI05FT05TCkRPTlRIQVZFQUNPV01BTgpBU1RSTyNJTlRPI0FJREEKIyMjWU9LRUQjUkFHVEFHCkJVVCNQRUQjRE9NRSMjIwpPVE9PTEUjTkFOQSNBU0gKV0lMREFORENSQVpZR1VZCklDRUQjTE9BTiNFQVJFRApFQVRTI1lFQVMjU01BWkU="},{"title":"04/30/10 PHONOPHOBIA?","author":"Richard Silvestri , edited by Stanley Newman","date":"2010-04-30","grid":"Sk9TSCNHQVNTWSNCSURFCkVDVE8jQUxPSEEjVU5JWApUSEVSRUlTQUhPVExJTkUKVFJFI01OT1AjI0FMVE9TCkFFUk9CRSMjUFVMUCMjIwojIyNGT1JQRU9QTEVJTiMKUEFOVFMjQVNUTyNOT0VTCkVNVSNTQU5UQU5BI05BUApQSUtFI01FRVQjWkVTVFkKI0RFTklBTFNPRkFSIyMjCiMjI0FDVFMjI0FMR09SRQpTSEFNRSMjTUlSRSNMRU4KTk9CT0RZSEFTQ0FMTEVECk9WRVIjQU1QTEUjTElWRQpXRURTI01PU0VTI0RFRUQ="},{"title":"05/01/10 SATURDAY STUMPER","author":"Anna Stiga , edited by Stanley Newman","date":"2010-05-01","grid":"UkFTQ0FMUyNCQUZGTEVTCkFUVEFCT1kjQURFTElORQpXSEVSRUlOI05PVEFCTEUKRUVMIyNTQ1JBUEUjWUFQCkdBTEFTI0hJTlRTI0FSSQpHUkFERUEjREFTI0lOR0UKU1RST05HTUVOI1VOU0VSCiMjI05PT04jVVJOUyMjIwpOT1NJUiNFQ1RPTU9SUEgKQUNFUyNHTUEjQ0VMRVJZCk1BViNIT09LUyNURU5BTQpFUkUjRUFTWUFTIyNESU4KRElOR0lMWSNCQVJCRVJBCkFOVE9OSU4jSU1QRVJJTApZQUhUWkVFI05FTUVTRVM="},{"title":"05/02/10 MAY DAY: A timely subject, sort of","author":"S.N., edited by Stanley Newman","date":"2010-05-02","grid":"QkxFU1MjSEVMR0EjTk9TRSNDQVNUClJBTFBII0FCQUxMI09PUFMjTElLRQpBTUJFUiNOQVNBTCNUSEFUU0FMSUUKU1BBQ0VPRFlTU0VZU0VSSUVTIyMjCiMjIyNXQVMjT1NHT09EI1ZBU1NBUgpBREFNU1JJQiNFUkcjI0hBVCNBTUEKVE9SRSNTTkFLRU9JTFNBTEVTTUFOCkVHUkVUIyNOSUwjI0JBTSNST09TVApBTUlTSCNSRUQjQklPUElDI1BBU1MKU0FWRU9ORVNTS0lOI1NMT1RIIyMjCkVTRSNSRUIjI0lETyMjVElFI01BQwojIyNPTklPTiNTRU5TRU9GU01FTEwKQkFUSCNOT0xFU1MjUEFOI0xBTkNFCkFNQU5BI1RFQSMjRUVSIyNBQ1RPTgpTSVJPU0JFUlRTSVRXRUxMI1JPVEMKRUdPI0tPRCMjSU5DI0RVRU5PUlRICkRPVEVPTiNHT0xERU4jTkVBIyMjIwojIyNTVUJBUlVPVVRCQUNLU1BPUlQKVE9ZU1RPUkVTI1RFQUNII0NBTk9FCkFSSUEjTkVBVCNDUkVNRSNBTFVNUwpERU5ZI1NBVFMjSEFSRVMjUkVTRVQ="},{"title":"05/02/10 MAY DAY: A timely subject, sort of","author":"S.N., edited by Stanley Newman","date":"2010-05-02","grid":"QkxFU1MjSEVMR0EjTk9TRSNDQVNUClJBTFBII0FCQUxMI09PUFMjTElLRQpBTUJFUiNOQVNBTCNUSEFUU0FMSUUKU1BBQ0VPRFlTU0VZU0VSSUVTIyMjCiMjIyNXQVMjT1NHT09EI1ZBU1NBUgpBREFNU1JJQiNFUkcjI0hBVCNBTUEKVE9SRSNTTkFLRU9JTFNBTEVTTUFOCkVHUkVUIyNOSUwjI0JBTSNST09TVApBTUlTSCNSRUQjQklPUElDI1BBU1MKU0FWRU9ORVNTS0lOI1NMT1RIIyMjCkVTRSNSRUIjI0lETyMjVElFI01BQwojIyNPTklPTiNTRU5TRU9GU01FTEwKQkFUSCNOT0xFU1MjUEFOI0xBTkNFCkFNQU5BI1RFQSMjRUVSIyNBQ1RPTgpTSVJPU0JFUlRTSVRXRUxMI1JPVEMKRUdPI0tPRCMjSU5DI0RVRU5PUlRICkRPVEVPTiNHT0xERU4jTkVBIyMjIwojIyNTVUJBUlVPVVRCQUNLU1BPUlQKVE9ZU1RPUkVTI1RFQUNII0NBTk9FCkFSSUEjTkVBVCNDUkVNRSNBTFVNUwpERU5ZI1NBVFMjSEFSRVMjUkVTRVQ="},{"title":"05/03/10 GOING GREEN","author":"Billie Truitt , edited by Stanley Newman","date":"2010-05-03","grid":"UEZDUyNBSEVNI1BBUEFTCkFMT0UjTkFQRSNMSUVUTwpOQU1FI0dSSUQjQUxBTU8KRU1FUkFMRENJVFkjSk9UCkxFVFNCRSMjQVJVQkEjIwojIyMjQ1JPQyNBUEFDSEUKUElLRVMjUE9NUCNTS0lECklURU0jU0FMRVMjVEVMRQpUQUxDI1BMQU4jU0VUT04KQUxMRUdFI1NVRVQjIyMjCiMjWUVMTFMjI01BTklBQwpUQVIjT0xJVkVCUkFOQ0gKU0xJUFMjRElBTCNTQU1FClBJUEVTI0VMU0UjQU5FVwpTVEFHWSNTRUVNI0xFU1M="},{"title":"05/04/10 NOTHING DOING","author":"Gail Grabowski, edited by Stanley Newman","date":"2010-05-04","grid":"Q09NRVQjVEFMTCNWQVNUCk9QRVJBI0lERUEjT0xFTwpNQUdJQyNNT0FUI0lUSU4KQkxBTktWRVJTRSNET1pFCiMjIyNMT1JFI1RFQVNFIwpNQVJWRUwjI1JPVEMjIyMKQUxWQSNUSE9VI1RIT1JOClBJRUNFI0FMTCNFRVJJRQpTVFJBUCNSRUVMI0NBUFMKIyMjTklDRSMjQU5LTEVUCiNDQVRDSCNTSURFIyMjIwpGT0lMI0VNUFRZV09SRFMKQUxTTyNTQUxFI0NSRUFLClNPTE8jVFJJTSNBU0FNSQpUUkVLI1NFVFMjUk9NUFM="},{"title":"05/05/10 THAT'S RICH","author":"Norma Steinberg , edited by Stanley Newman","date":"2010-05-05","grid":"UEFTVEEjQVJNUyNTTVVHClJBV0VSI05PSVIjTElTQQpPUklORyNOT1RJI0VHT1MKRk9SVFVORVRFTExFUiMjClNOTCNNQVgjI0FMUEFDQQojIyNKRVQjS0lORCNUQUIKT1JMT04jVEFOSyNMSVJBCldFQUxUSE9GTkFUSU9OUwpORVNUI0VMS1MjUkVORUUKRVNUI0xBTEEjUkVEIyMjClJFU1RFRCMjR1VTI0xFRAojI1RSRUFTVVJFVFJPVkUKUEVSVSNDT01FI0xPR0lOCklWQU4jSFlQRSNFRElDVApHQVdLI0VBU1QjU0VDVFM="},{"title":"05/06/10 LEFTOVERS","author":"David W. Cromer , edited by Stanley Newman","date":"2010-05-06","grid":"RkFCIyNUT1dFRCNGSVNICkROQSNUVVBFTE8jRU1NQQpJTk4jRVhUUkFDUkVESVQKQ0VEQVIjU0VOU0UjT0xFCiMjQUJFQVQjIyNDQU5FUwpCT05VU0NPVkVSQUdFIyMKU0VBVEFDI0lORVBUIyMjCkFEUyMjRU5BQ1QjI01BTwojIyNFU1NFTiNBRVNPUFMKIyNVTlVTRURNSU5VVEVTClRBTUVSIyMjQUxBTU8jIwpBVEwjR0FUT1IjTU9SUEgKU1BBUkVDSEFOR0UjSVJBClRBVVQjTUFSSUVMI1NPTApFUlRFI0VEU0VMIyNUV08="},{"title":"05/07/10 WAIST LINE","author":"Bruce Venzke , edited by Stanley Newman","date":"2010-05-07","grid":"QVJFUyNOQU5BI1NXSVNIClJPTEUjT0xBViNUQU5LQQpCTERHI01BTkUjQVNUSVIKI1lPVUNBTk9OTFlIT0xEClNQUkVBRCMjR0FTI0lMTApMT0FEUyNBTUVOI0lUU1kKT0xEI1RBUk8jRFNDIyMjCiNZT1VSU1RPTUFDSElOIwojIyNTT1kjU09VUiNDT00KR0FaRSNMSUVEI0FSRU5BCkFQRSNGVU4jI1NQRUNJRQpGT1JTT01BTllZRUFSUyMKRkxPT1IjUkVFSyNSRVNUCkVMSU9UI1VSR0UjTUFVSQpTT05OWSNUT0dTI1NNRUU="},{"title":"05/08/10 SATURDAY STUMPER","author":"Barry C. Silk , edited by Stanley Newman","date":"2010-05-08","grid":"UE9SVEFCTEVTI1RBQ0lUCkVMSUhVWUFMRSNFUkFTRQpUSVBPTkVJTEwjTk9SU0UKRVZFTlQjUkFJTkVET1VUClJJTkcjIyMjR0VUI1RBTwpTQVMjTUVSViNBU0NFTlQKIyMjT1hUQUlMIyNJTkNBCkhJR0hDQVJCT05TVEVFTApJTUFOIyNFRVJJTFkjIyMKQVBST05TI1NFWFkjTUFDCldFQiNFT1MjIyMjTEFTSApBUkFCRVNRVUUjU09VU0EKVElORUQjVU5TRVRUTEVTCkhBWkVMI0FUUFJFU0VOVApBTE9ORSNCT05BUEFSVEU="},{"title":"05/09/10 AT EASE: Featuring informal wordplay","author":"Fred Piscop, edited by Stanley Newman","date":"2010-05-09","grid":"U0NBTVAjU1dBVCNVU0RBIyNXSEFUCkFMTEFII01BTEUjUEVFTCNHSEFOQQpNQUlOUk9BRElFI05BTUUjRk9SVFkKU1dBWUFCTEUjI0NPTUlDQk9PS0lFCiMjIyNTT0xERVJFUiMjI1JSUyMjIwpBTkdMRUUjI0dFTFQjUE9BQ0hFUlMKTUFSRVMjQ0FSRFNIQVJQSUUjTU9DClBJRUQjU0FMRVMjI0JPQVMjU1BVUgpFVkUjR0VUSVQjU1RBUExFI09UVE8KREVOI0FDQ1QjT1BFQyMjU1RBWUVECiMjQk9HI0hPVFBJTktJRSNPUFQjIwpUSEVHQVAjI0hVTlQjTUVMVCNBU0EKUk9BUiNBUFBPU0UjU1BSRUUjTEVTCkFOTkUjTEFJUiMjVElFSU4jU0tJUApNT0kjRk9SVE5JR0hUSUUjTUFJWkUKUFJFU1VNRVMjTkVSTyMjU0FURUVOCiMjI0lTQSMjI0NSVU5DSEVEIyMjIwpLSU5HU1JPT0tJRSMjSEVSRUZPUkQKSU5BTkUjUkFOVCNSQVJFQklSRElFClNUSUVTI1NIT0UjQVJJRCNSRUlHTgpTT0xFIyNPVVRTI01FU1MjQVRFQVQ="},{"title":"05/09/10 AT EASE: Featuring informal wordplay","author":"Fred Piscop, edited by Stanley Newman","date":"2010-05-09","grid":"U0NBTVAjU1dBVCNVU0RBIyNXSEFUCkFMTEFII01BTEUjUEVFTCNHSEFOQQpNQUlOUk9BRElFI05BTUUjRk9SVFkKU1dBWUFCTEUjI0NPTUlDQk9PS0lFCiMjIyNTT0xERVJFUiMjI1JSUyMjIwpBTkdMRUUjI0dFTFQjUE9BQ0hFUlMKTUFSRVMjQ0FSRFNIQVJQSUUjTU9DClBJRUQjU0FMRVMjI0JPQVMjU1BVUgpFVkUjR0VUSVQjU1RBUExFI09UVE8KREVOI0FDQ1QjT1BFQyMjU1RBWUVECiMjQk9HI0hPVFBJTktJRSNPUFQjIwpUSEVHQVAjI0hVTlQjTUVMVCNBU0EKUk9BUiNBUFBPU0UjU1BSRUUjTEVTCkFOTkUjTEFJUiMjVElFSU4jU0tJUApNT0kjRk9SVE5JR0hUSUUjTUFJWkUKUFJFU1VNRVMjTkVSTyMjU0FURUVOCiMjI0lTQSMjI0NSVU5DSEVEIyMjIwpLSU5HU1JPT0tJRSMjSEVSRUZPUkQKSU5BTkUjUkFOVCNSQVJFQklSRElFClNUSUVTI1NIT0UjQVJJRCNSRUlHTgpTT0xFIyNPVVRTI01FU1MjQVRFQVQ="},{"title":"05/10/10 TICK-TOCK","author":"Gail Grabowski , edited by Stanley Newman","date":"2010-05-10","grid":"QVJUUyMjUkVQI1NIQVJQCkJPQVQjU09EQSNMT1NFUgpZVUxFI1BPVVQjT1VURE8KU1RPUFdBVENII0dST1NTClNFTlNPUiMjU1RBRyMjIwojIyMjUkVBUCNPTkxBTkQKQ1JPV0QjU0FNRSNBTE9FCkJBQkEjREFSRVMjU0FORQpFQ09MI09QVFMjRVNTRVMKUkVFTElOI1lBUkQjIyMjCiMjI0NMRUYjI0FJUkFDRQpBVE9MTCNPVkVOVElNRVIKU09MT1MjUkVTVCNTUEFSClBJRUNFI1RBUFMjRUxTRQpTVE9LRSNTTFkjI1NFRUQ="},{"title":"05/11/10 SIGN HERE","author":"Sally R. Stein, edited by Stanley Newman","date":"2010-05-11","grid":"Tk9UU08jQUxTTyNNQVJLCkFIRUFEI0RBTVAjT0JPRQpZSUVMRFRPTUFUVVJJVFkKU09NRSNPUkFMI0dBVEVTCiMjI1NPV04jTE9MTCMjIwpZRUFSTlMjU1RBWSNGRFIKRVhDRUwjU0NPVCNPTEVPClNUT1BZT1VSV0hJTklORwpFUlJTI0JSQU4jVEVOU0UKU0FOI1BFRVAjU0VTVEVUCiMjI0hJWUEjQ09NRSMjIwpQSUxPVCNCT0xPI0FTU1QKT05FV0FZT1JBTk9USEVSCkVUQUwjUlVCUyNMRU9ORQpUT05TI1NURVAjRVJPREU="},{"title":"05/12/10 DIG IT","author":"Fred Piscop, edited by Stanley Newman","date":"2010-05-12","grid":"UEFOREEjU09NRSNNRVNBCkFESU9TI1RSRVgjSVBPRApXQU5FUyNPR0xFI05JUFMKI01BUklBTkFUUkVOQ0gjCiMjIyNHTEVOI1RSSSMjIwpBU1NFTlRTI0ZJUkVBTlQKUE9PTCMjI1NMT0UjTElFCklSUklHQVRJT05ESVRDSApORVQjUlVFRCMjI1JBS0UKR1JBTklURSNESVZFUlNFCiMjI0FTSCNCRVRBIyMjIwojQk9UVE9NTEVTU1BJVCMKRklBVCNST0FNI1RPUkFICkxPUkUjRUxTRSNFTE9QRQpVU1NSI0RFRUQjUkVORVc="},{"title":"05/13/10 MOVING DAY","author":"S.N., edited by Stanley Newman","date":"2010-05-13","grid":"QkFSQSNMSUFSI01BREFNCkVMQUwjRUNSVSNBTElORQpEQVlMSUdIVFNBVklOR1MKSU1PVVQjI09ITSMjR0xPCk1PTkRBWUFGVEVSTk9PTgojIyNFTEVNI09SRU8jIyMKTElFIyNXSVQjI0lSS0VECklOVEhJU0RBWUFOREFHRQpQQUNFUyMjTk9SIyNOT1cKIyMjTUJBUyNSSURFIyMjClRBS0lOR1RIRURBWU9GRgpFUEEjI0lSQSMjSEVMTE8KTkFUSU9OQUxIT0xJREFZClRSSUNLI0ZFRUQjTklLRQpTVEVFRCNFWVJFI0dFRVI="},{"title":"05/14/10 WISECRACKS","author":"Robert A. Doll , edited by Stanley Newman","date":"2010-05-14","grid":"QVdISUxFI09XRVMjRUxTClNISVZFUiNCT0xUI05JUApQSUdJTkFQT0tFWSNET0UKI1RIRSMjTEVFSyNTQU5FClJFVFNJTkEjI1RJTExFRApBTEUjRElOTkVSQkVMTFkKUElTVE9MI0FNQU5BIyMjClNFVFMjI0FGVCMjWk9PTQojIyNIRUFSVCNBTEVQUE8KVEFLSU5HUEFSVFkjRVRBCkVNRVJHRSMjSU1FQU5JVApDT09UI1NBVUwjI09ETyMKQVJLI1dBRkZMRUlST05ZClRBVSNBR1JPI01SVE9BRApFTEsjUk9PUyNQRUFSTFM="},{"title":"05/15/10 SATURDAY STUMPER","author":"Robert H. Wolfe , edited by Stanley Newman","date":"2010-05-15","grid":"TUFOQUxJVkUjTElNSU5HCklTT1RPTklDI1VWVUxBRQpUSElSREFDVCNHQVNMSVQKRUFTSUVTVCNHT05FTUFEClJQSSMjVE9NRVMjUkFETwpTRUVQI0FSQ1NJTiNERU4KI0RSQVNUSUMjI09CRVNFCiMjI0lLRUEjREVMSSMjIwpQQVVMSSMjRk9HTEFNUCMKUklQI1RPV0lORyNTQVVSCk9SU08jUEFSVFMjI1JURQpQSElMQklOI1RBQ0lUVVMKSE9MREVOI1RFTEVUWVBFCkVMT0lTRSNBTEFDQVJURQpURU5FVFMjRUxERVJTT04="},{"title":"05/16/10 ELEMENTARY: But a little tricky","author":"Billie Truitt, edited by Stanley Newman","date":"2010-05-16","grid":"REVBTFMjU0NBQiMjVEFUUyNTSVRFCkFMTE9XI0NBU0UjUk9ERU8jQVJFQQpVTFRSQSNBQ0hFI0NST1NTI1VTRVIKQkVISU5EVEhFRkVDVVJUQUlOIyMjClNSTyNET1RFI0NMT1NFVCNOQUNITwojIyNQSU5FI0JBTEwjI1VQQyNPT0YKI0dPT1ZFUkxJS0VBUEJCQUxMT09OClBBUlNFIyNFREVOI0xJRU4jVVBETwpBUkVTI1NFVFMjI0NBTiNFRUwjIyMKUEFHRUFOVFMjQVNBTkRPTERMQUNFCkFHTyNMT1QjI0JBUiMjTUlBI1RSQQpXRU5URE9VQkxFUFQjSkFTTUlORVMKIyMjSEFUI1JBVCMjQVVOVCNOT0RFClRSSU8jSUZBVCNTT0xEIyNJTk9JTApSRURVQ0VPTkVTQ0ZPT1RQUklOVCMKQURPI0lSUiMjQ0FGRSNBQUFTIyMjClBPTEtBI1RBTE9OUyNHUklOI0RJRQojIyNMT09LRk9SVEhFQUdMSU5JTkcKRlJBVSNTTk9SRSNPTk1FI0FFVE5BCkVBU1QjSE9VUlMjUk9VVCNOQUtFRApXSElaI0FYTEUjI0VTVFMjU1RBUlM="},{"title":"05/16/10 ELEMENTARY: But a little tricky","author":"Billie Truitt, edited by Stanley Newman","date":"2010-05-16","grid":"REVBTFMjU0NBQiMjVEFUUyNTSVRFCkFMTE9XI0NBU0UjUk9ERU8jQVJFQQpVTFRSQSNBQ0hFI0NST1NTI1VTRVIKQkVISU5EVEhFRkVDVVJUQUlOIyMjClNSTyNET1RFI0NMT1NFVCNOQUNITwojIyNQSU5FI0JBTEwjI1VQQyNPT0YKI0dPT1ZFUkxJS0VBUEJCQUxMT09OClBBUlNFIyNFREVOI0xJRU4jVVBETwpBUkVTI1NFVFMjI0NBTiNFRUwjIyMKUEFHRUFOVFMjQVNBTkRPTERMQUNFCkFHTyNMT1QjI0JBUiMjTUlBI1RSQQpXRU5URE9VQkxFUFQjSkFTTUlORVMKIyMjSEFUI1JBVCMjQVVOVCNOT0RFClRSSU8jSUZBVCNTT0xEIyNJTk9JTApSRURVQ0VPTkVTQ0ZPT1RQUklOVCMKQURPI0lSUiMjQ0FGRSNBQUFTIyMjClBPTEtBI1RBTE9OUyNHUklOI0RJRQojIyNMT09LRk9SVEhFQUdMSU5JTkcKRlJBVSNTTk9SRSNPTk1FI0FFVE5BCkVBU1QjSE9VUlMjUk9VVCNOQUtFRApXSElaI0FYTEUjI0VTVFMjU1RBUlM="},{"title":"05/17/10 SIXTIES FASHIONS","author":"Billie Truitt, edited by Stanley Newman","date":"2010-05-17","grid":"U0FUIyNBUEVEI0FCQVRFCk9GSVQjQlJBWSNQRVJJTApOT05PI1JJU0UjUEFJTlMKR09HT0JPT1RTI0VSQVNFClNURUxMQVIjI0NBRCMjIwojIyNCVUQjU1BBUiNMQlMKQU1CRVIjU0VMTCNUSUVBCkJFTExCT1RUT01KRUFOUwpMT1VUI1BBSUQjRUFSVEgKRVdFI0ZFUk4jU0VDIyMjCiMjI1NJTiMjT05SQU1QUwpFTEFURSNNSU5JU0tJUlQKR0FMRVMjQkxJUCNFUklFCkFJTUFUI0FMT0UjU0VFUApEUkFNQSNTU05TIyNERFM="},{"title":"05/18/10 VIP VEHICLES","author":"Gail Grabowski, edited by Stanley Newman","date":"2010-05-18","grid":"QVBQTEUjVFJBUCNTVE9QCkNMQUlNI1lPR0EjVE9VUgpIRUxJQ09QVEVSI1JPU0UKWUFNI0VXRVMjVFdFTlRZCiMjI0xFTkQjU05JVCMjIwpSRUZVU0UjU1RFTkNJTCMKQVBFWCNSRVRBUiNITU9TClBFUlUjI1JBRyMjTEFORQpURUFSI1NBR0VTI0lHRVQKI1NMWU5FU1MjQVJNRVJTCiMjI1lPUkUjQ0xFTyMjIwpIQVZBTkEjUEFTUyNBQ1MKRVBJQyNQUklWQVRFSkVUCk5PU0gjRUFTRSNFVkFERQpTUEFUI1NQQVMjREFSRVI="},{"title":"05/19/10 NO LIMITS","author":"S.N., edited by Stanley Newman","date":"2010-05-19","grid":"QkFNQkkjU1BFQyNTV0FNCk9DRUFOI0NPREEjT0lMWQpCUkVBS0ZBU1RCVUZGRVQKU0VUI1NJVEUjU1BFRUNICiMjI1NBU0gjU1RPVyMjIwpUUkVOQ0hFUk1BTiNHQUIKUk9WRVMjI1lFTiNESUxMCkFTSUEjQ09ERUQjRVRURQpERUNLI1VLRSMjUFJNRU4KRVNUI1NNT1JHQVNCT1JECiMjI0ZPTEsjRUJBWSMjIwpQQUVMTEEjUE9MTCNITVMKQUxMWU9VQ0FSRVRPRUFUClNUQUIjRElORyNFTkVNWQpUT05ZI0VBU0UjUkVMQVg="},{"title":"05/20/10 HAIR APPARENT","author":"Fred Jackson III, edited by Stanley Newman","date":"2010-05-20","grid":"Q0hFRVAjVFRPUCNDQVBFCkNPREVSI1VSTFMjT1JBTApDVVJMWUZSSUVTI01JREkKUFJPI0lPTiMjI1NNQVJUCiMjTE9OR1RJTUVOT1NFRQpBRkxBVCNPTkVSVU4jIyMKUVVJVE8jI0FHT0cjQkFUClVSTlMjQkFCQVMjUE9DTwpBU1MjQkFMSSMjU0xPTU8KIyMjR0lKQU5FI0xJS0VOClNIT1JUQU5EU1dFRVQjIwpDT0xBUyMjI1RXSSNJUlMKQVRJVCNTVFJBSUdIVFVQCk5FVkUjQUJVVCNIRUxMTwpTTEVEI0RBVEUjVFdFRVQ="},{"title":"05/21/10 SHELL GAME","author":"Fred Piscop, edited by Stanley Newman","date":"2010-05-21","grid":"Uk9JTCNST0dFVCNDT0FUCk9ITk8jT1BFUkEjSFlQTwpQQVNUQVNBTEFEI0VTUE4KRVJFI1NJUlMjUFJFVFRZClJBVENIRVQjTU9PU0UjIwojIyNIRVIjSE9MTEVSRUQKU0FUSU4jUEFORUwjQlRVClBMQU4jQk9SRVMjREVOVApVU0MjSEFTVFkjVE9EQVkKUk9PTUVUVEUjRE9XIyMjCiMjU09SVFMjUlVOTkVSUwpTRVRURUUjQUlSRSNSSVAKRUxBTCNSSUZMRVJBTkdFCkxJTkUjVVJBTFMjTElPTgpMQURZI1BBUkVTI1BFUlQ="},{"title":"05/22/10 SATURDAY STUMPER","author":"Doug Peterson, edited by Stanley Newman","date":"2010-05-22","grid":"SkVUUEFDSyNQQU5HUkFNCkVURVJOQUwjT1ZFUklDRQpUSFJFRU1VU0tFVEVFUlMKRUFSUCNFVFRFI1RBTEVTClJOQSNGQVpFI0VMUyMjIwojQUZPT1QjVldCRUVUTEUKQ0xJTkcjU0VSQiNUUkVUCkFMUklHSFQjRVNUUkFEQQpNRU1PI01VT04jV0FERVMKT05BTkRPRkYjUElQRVIjCiMjI0JPUyNUSFVHI1JITwpBRE9STiNSRUlOI0NPT1AKREVQRU5ERU5UQ0xBVVNFCkFTVEFJUkUjQ0hBU1RFTgpNSVNERUVEI0hZUEhFTlM="},{"title":"05/23/10 IN ADDITION: With something extra","author":"Gail Grabowski, edited by Stanley Newman","date":"2010-05-23","grid":"TUdNVCNTVFJFUCNUUkFNUyNJRE9MCkFMT0UjV0hBTU8jTEVWRUUjR0FMRQpHRU5YI0VBVFVQI0NISU5BSU5TRVQKSU5UQUtFSVNTVUUjSURVTk5PIyMjCiMjI05FVFMjI0xBU1QjIyNBUklBUwpPQklTUE8jVE9BU1QjU1VTUEVOU0UKUEVOI0lORkFOQ1lPVVRGSVQjSElECkVBVkVTI0xVUkUjT1JFT1MjVFVUVQpEVU9TI1BPTlkjRkxBV1MjTUlNSUMKI1RJQyNMVVRFI09JTFMjUExFQVNFCiMjQ09MT1IjI0FMRSMjUkVJR04jIwpDTEVSR1kjV0FMTCNBR0lOI0FCQSMKSEFSVEUjQ0FORFkjTEVBRCNNRVdTCkVSQVMjRk9SVEUjRk9SVCNXRUlHSApTSU4jUlVOTklOR0lOTUFURSNORU8KVEFHTElORVMjVE9OR1MjUklHR0VEClNURUFMIyMjUkVCQSMjTUFSRSMjIwojIyNERUxFVEUjSU5GSUVMRFRSSVAKSU5TSURFRElTSCNDT0JSQSNNT1JFClJFQUQjQVVESU8jRVRBSUwjQVNJQQpTQUdBI1NDRU5UI1NPUlRBI0RFU0s="},{"title":"05/23/10 IN ADDITION: With something extra","author":"Gail Grabowski, edited by Stanley Newman","date":"2010-05-23","grid":"TUdNVCNTVFJFUCNUUkFNUyNJRE9MCkFMT0UjV0hBTU8jTEVWRUUjR0FMRQpHRU5YI0VBVFVQI0NISU5BSU5TRVQKSU5UQUtFSVNTVUUjSURVTk5PIyMjCiMjI05FVFMjI0xBU1QjIyNBUklBUwpPQklTUE8jVE9BU1QjU1VTUEVOU0UKUEVOI0lORkFOQ1lPVVRGSVQjSElECkVBVkVTI0xVUkUjT1JFT1MjVFVUVQpEVU9TI1BPTlkjRkxBV1MjTUlNSUMKI1RJQyNMVVRFI09JTFMjUExFQVNFCiMjQ09MT1IjI0FMRSMjUkVJR04jIwpDTEVSR1kjV0FMTCNBR0lOI0FCQSMKSEFSVEUjQ0FORFkjTEVBRCNNRVdTCkVSQVMjRk9SVEUjRk9SVCNXRUlHSApTSU4jUlVOTklOR0lOTUFURSNORU8KVEFHTElORVMjVE9OR1MjUklHR0VEClNURUFMIyMjUkVCQSMjTUFSRSMjIwojIyNERUxFVEUjSU5GSUVMRFRSSVAKSU5TSURFRElTSCNDT0JSQSNNT1JFClJFQUQjQVVESU8jRVRBSUwjQVNJQQpTQUdBI1NDRU5UI1NPUlRBI0RFU0s="},{"title":"05/24/10 YOU FIRST","author":"Gail Grabowski , edited by Stanley Newman","date":"2010-05-24","grid":"UEVBUyNBU1NFVCNUVVNLCkVER0UjUk9PVFMjQU5USQpSRUVMI0JMT0NLI0xJRVMKVU5ERVJPQVRII1BMT1dTCiMjI0NVUlJZI0tFRU4jIwpST1VURVMjI1NOQVJMQVQKQUxQIyMjSUNJRVIjQURBClZJUCNTVFJVREVMI0JVTgpFVkUjVFJJQkUjIyNFTEsKTkVSVk9VUyMjU1RJTFRTCiMjQ0FSRSNTV0VBVCMjIwpUQUxMWSNVTklUUFJJQ0UKT1JBTCNHUkFOVCNJRE9MClJJU0UjQUdSRUUjRUVMUwpFQVNZI0dFRVNFI0RBVEU="},{"title":"05/25/10 APOLOGIES","author":"Sally R. Stein , edited by Stanley Newman","date":"2010-05-25","grid":"SE9MRCNDQVBTI1NUUkFXCkFSSUEjQUxPRSNJUkFURQpSQU5UI01PTEUjTU9UT1IKUExFQVNFRk9SR0lWRU1FCiMjIyNIT1QjI09MRSMjIwpTSEFWRVMjSE9MRSNQVEEKS09SRUEjRk9XTCNURUFTCklNVEVSUklCTFlTT1JSWQpNRVNTI1VGT1MjSEFTVEUKUFJZI0FNRVMjREVURVNUCiMjI0VCQiMjQUFBIyMjIwpJVFdBU0FMTE1ZRkFVTFQKUEhBU0UjQUlNUyNUSEFJCk9BS0VOI0xFQVAjTU9URQpEV0VMVCNBTk5BI1NIRUQ="},{"title":"05/26/10 ALL-INCLUSIVE","author":"Fred Piscop, edited by Stanley Newman","date":"2010-05-26","grid":"Q1JFVEUjQVJPTUEjU0FPCkFJREFOI0lPV0FOI09VVApTVEVNVE9TVEVSTiNVR0gKU0VOU0lCTEUjS0VXUElFCiMjIyNURUUjIyNUQVRFUgpMT05FTFkjQklTVFJPIyMKQURPUkUjTUFUVEUjTkFCCk5BU0EjTUlMRVkjVFVOQQpFWUUjU0FMRU0jQkFUVFkKIyNUQUlMT1IjTEVOU0VTCkNST1dFIyMjTEFEIyMjIwpMQVRFU1QjU1lNUE9TSUEKRUdPI1RPUFRPQk9UVE9NCkZFRSNBTElFTiNTVEFURQpURFMjU0xFV1MjVE9HQVM="},{"title":"05/27/10 FAMILY FARE","author":"David W. Cromer, edited by Stanley Newman","date":"2010-05-27","grid":"QlJBVCNDSEFQUyNTTEVXClJFRE8jUk9NQU4jTEVWSQpJQ0VSI0FNSU5PI09WQUwKREVTSUdOSU5HV09NRU4jCkVEVCNMRU4jIyNXT1JTVApTRUVUTyNHRVRJTiNBVEUKIyMjQU9MI1RBRCNJR09UCiNBTExNWUNISUxEUkVOIwpGTEFLI1JJTyNFUkEjIyMKRUxTI0JFQVNUI09OS0VZClJPVENTIyMjQURPI0lSQQojVFdPQU5EQUhBTEZNRU4KVFRPUCNDQURJWiNST0NLCldFUkUjSVJBVEUjQU5URQpPRERTI1NFTUlTI05PU0U="},{"title":"05/28/10 BUILDING BLOCKS","author":"Doug Peterson, edited by Stanley Newman","date":"2010-05-28","grid":"RVBTT00jREVBUlMjREVCCk1BVVJBI1VQVE9QI0lMTApCUklDS0NIRUVTRSNFTVUKRVNUI0VMU0UjRURJVE9SCkRFU0lSRSMjQ0hVTVAjIwojIyNXT09EQ0hJUFBFUlMKSUdMT08jSUhPUCNTUEVXCk1PTyNNRUxJU1NBI1NFQQpBR1VBI1lBTEUjUVVJTFQKQ09OQ1JFVEVOT1VOIyMjCiMjR1JJUEUjI1JBSVNJTgpTSEVFTkEjSkFJTCNBQ0UKUElDI1NURUVMR1VJVEFSCkFLQSNFQ0xBVCNOT0VORApNRVIjUkhJTk8jR1VTVFk="},{"title":"05/29/10 SATURDAY STUMPER","author":"Lester Ruff , edited by Stanley Newman","date":"2010-05-29","grid":"UExPV0lORyNDT05TT1JUCkFFUk9TT0wjVVBBVFJFRQpSRURXSU5FI1NFR09WSUEKU1RJRVMjQVNII1NLSU5TCk5JTkUjR1NVSVQjRUxTRQpJREEjSVJPTk9SRSNMSVQKUEVMSUNBTiNORUFURU5TCiMjI1dFQiMjI0tHQiMjIwpOT0RPVUJUI0VLRVNPVVQKRUNPI1BBUkRORVIjT05FCldBVFQjR09ORVIjUkhFQQpTTkFSRiNKQU0jU0FMQVMKTUFSSUFOQSNJTUlUQVRFCkFEREVET04jRVRBSUxFUgpHQVNTRVJTI1NBTU9BTlM="},{"title":"05/30/10 ALL-AMERICAN: With nine of the 14","author":"Merle Baker, edited by Stanley Newman","date":"2010-05-30","grid":"U0lQI0FMU09SQU4jQUxCRUUjVU5DCkFTRSNHT09ET05FI1ZJQUxTI0xBTwpMT09LSE9NRVdBUkRBTkdFTCNUWlUKQVBQRUFTRVMjI0RFTFVHRSNDUkFOCk1PTEUjIyNTQUUjQ09YQSNIRUFSVApJREVOVElDQUxUV0lOI0dST09WRVMKIyMjU09EQSNUT0UjI0dFRVIjSVRPClNQQSNXRVNUSU5ESUFOI0RSSk9ITgpLSU4jTkFTQSMjI0NSVURFT0lMIyMKSU5DQVMjI0NBQ0hFUyNFQVJORVNUCk5PSVIjQkFUVExFUk9ZQUwjR1RPUwpLTkVFUEFEI1NBWVNOTyMjTE9STkEKIyNOQVJSQVRFUyMjI0dPVEEjQUFSCldBVFNPTiNQQVBFUlRJR0VSI1lSUwpIVU0jTUVFSyMjU1VSI0xBVkEjIyMKQVRBTE9TUyNUSEVMT05FUkFOR0VSClRPUk9TI1RIT1UjRVlFIyMjVFVORQpTUElOI1NPT05BUyMjQklHSE9STlMKSUFOI0NPTk5FQ1RJQ1VUWUFOS0VFClRSRSNIQUlLVSNBRERMSU5HI0hBVApTVFIjR1JBU1AjUkVDQU5UUyNBRFM="},{"title":"05/30/10 ALL-AMERICAN: With nine of the 14","author":"Merle Baker, edited by Stanley Newman","date":"2010-05-30","grid":"U0lQI0FMU09SQU4jQUxCRUUjVU5DCkFTRSNHT09ET05FI1ZJQUxTI0xBTwpMT09LSE9NRVdBUkRBTkdFTCNUWlUKQVBQRUFTRVMjI0RFTFVHRSNDUkFOCk1PTEUjIyNTQUUjQ09YQSNIRUFSVApJREVOVElDQUxUV0lOI0dST09WRVMKIyMjU09EQSNUT0UjI0dFRVIjSVRPClNQQSNXRVNUSU5ESUFOI0RSSk9ITgpLSU4jTkFTQSMjI0NSVURFT0lMIyMKSU5DQVMjI0NBQ0hFUyNFQVJORVNUCk5PSVIjQkFUVExFUk9ZQUwjR1RPUwpLTkVFUEFEI1NBWVNOTyMjTE9STkEKIyNOQVJSQVRFUyMjI0dPVEEjQUFSCldBVFNPTiNQQVBFUlRJR0VSI1lSUwpIVU0jTUVFSyMjU1VSI0xBVkEjIyMKQVRBTE9TUyNUSEVMT05FUkFOR0VSClRPUk9TI1RIT1UjRVlFIyMjVFVORQpTUElOI1NPT05BUyMjQklHSE9STlMKSUFOI0NPTk5FQ1RJQ1VUWUFOS0VFClRSRSNIQUlLVSNBRERMSU5HI0hBVApTVFIjR1JBU1AjUkVDQU5UUyNBRFM="},{"title":"05/31/10 TURNING COLORS","author":"Billie Truitt, edited by Stanley Newman","date":"2010-05-31","grid":"QU1GTSNSRUNBUCNDT1NUCkNPTEEjSU1BR0UjT1BUUwpFVkVSI05FVkVSI0xFQVAKU0VFSU5HUkVEI1RPTkdTCiMjI05PU1kjI1NJUiMjIwpNQUNBVyMjI1NFTkFUT1IKSUNVI0lTV0VBUiNESVZFClNIUklOS0lOR1ZJT0xFVApUT0VEI0lOREVFRCNFUlIKWU9ERUxFRCMjI1RBU1RZCiMjI0FJUiMjTEVBTiMjIwpTVEFMRSNHT0lOR0dPTEQKVEFYSSNDT1VOVCNPUkVPCkFQRVMjUE9TRVIjUkFJRApSRVNUI0FOVFNZI0FMU08="},{"title":"06/01/10 S AS IN #147;SEA#148;","author":"Gail Grabowski , edited by Stanley Newman","date":"2010-06-01","grid":"QVRPTSNTRUVEUyNBU0FQCkxBVkEjQUxMT1QjUlVMRQpFREVOI0xPVkVTI1RST1QKU0FORFBBUEVSI1NJRlRTCiMjI0FJREVTI1BPU1QjIwpQQVNURVMjI1NPT1RIRSMKQUNIRVMjU0FMT04jRVJBClNVRSMjVE9UQUwjI1dBTgpTVEwjQkVSRVQjQ0hFU1QKI0VMREVTVCMjUFJPQkVTCiMjU1dBVCNTQ09UVCMjIwpDQVRFUiNTSElQU0hBUEUKUkVFTCNDSElSUCNFTEFMCk9SQUwjREFOQ0UjQVNJUwpXT0tTI1NNRUFSI0RPTkU="},{"title":"06/02/10 HAND-Y HOBBIES","author":"Nina Rulon-Miller, edited by Stanley Newman","date":"2010-06-02","grid":"REFNI0lET0xTI0lEQUhPCkVXRSNDT05JQyNSSVBFTgpDQVJQRU5UUlkjU05BUkUKQVJDRUQjT0FUUyNPUkJTCkZFSU5UUyMjSEVJU1QjIwojIyNORUVETEVDUkFGVCMKQVNBI0FSRUEjI0FVUkFTCkdPVVAjQkJHVU4jUk9NRQpPVVRSRSMjRU1JVCNNRVQKI1BIT1RPR1JBUEhZIyMjCiMjT01BSEEjI1NFQU5DRQpXQVJQI01VVFQjRFJFQUQKRUxJVEUjR0FSREVOSU5HCkRPWkVOI0VMVURFI0dFRQpTRUVEUyNTTEVFUCNIUlM="},{"title":"06/03/10 ALL THE RAGE","author":"Bruce Venzke, edited by Stanley Newman","date":"2010-06-03","grid":"TUVMRCNTVEFSRSNaSUdTCkFRVUkjSE9TRUQjRU5ZQQpTVU5TI0FESUVVI05BUlkKVElDS0VET0ZGI1NJTE9TClNQSEVSRSMjI1BJVEEjIwojIyNUQURBI1RJR0hURU4KUE9TVFMjU01JVEgjSE1PCkVQRUUjQU5HUlkjQkVUUwpHRUUjQ1JFTUUjTUFSU0gKU05JRlRFUiNTQ0FSIyMjCiMjTk9SQSMjI0hBUkFTUwpNT0dVTCNTVEVBTUVEVVAKRUFSTiNCT09TVCNMQVJBCldIRVQjQURPUFQjRUdHUwpTVURTI05BTk5ZI0RFRU0="},{"title":"06/04/10 DROP A GRADE","author":"Fred Jackson III, edited by Stanley Newman","date":"2010-06-04","grid":"VEVSTSMjQ09DT0EjR0hJCk9SRU9TI0hBUkRHI1VBVwpEVUJSRVBPUlRFUiNFTEkKT1BFTk5FU1MjI0VQU09OClNUTCNJTkUjR09FUlMjIwojIyNET05OSU5HVE9XRVIKV0lSRVIjI1RBUk8jSEFZCkFEQU0jU1BJVEUjRkFWRQpSRVAjRkVFUyMjVk9URVMKREFTSFJFR0lTVEVSIyMjCiMjSEVFRFMjTlVOI1NBRwpTV0VERSMjTUlOSVNURVIKQVdFI0RBUkVQQUNLQUdFCktJVCNVTklURSNFRVJJRQpTSVMjUEFHRVMjI1dFU1Q="},{"title":"06/05/10 SATURDAY STUMPER","author":"Anna Stiga, edited by Stanley Newman","date":"2010-06-05","grid":"U0NSVVBMRVMjQVJNQURBCkVMRVBIQU5UI0NPQVRFRApDQVNTRVRURSNIQVJPTEQKUklQI1dFQVRIRVIjTUlSCkVSSU4jUklURVMjRklWRQpUT1RFUyNMRUkjRE9aRVMKU0xFRVRZI0RSRUFNRVJTCiMjI0RFRVAjU0FNRSMjIwpSRUNMSU5FUiNURU5USFMKRUxMRU4jREVOI1NUUkVQClRBT1MjU0FHQVMjU0VMTApJVFMjRElMQVRPUiNBTEUKVElFU0lOI1RIUk9XU09OCkxPU0lORyNUQVRUT09FRApFTlRSRUUjQU5BQ09OREE="},{"title":"06/06/10 A LITTLE ALOOF: We'll be friendlier next time","author":"Gail Grabowski, edited by Stanley Newman","date":"2010-06-06","grid":"U1RSRVAjQVJBQiNERUJTI0FDTUVTClBJQU5PI0JBTEUjRVhJVCNDT1VQRQpBQklERSNBRE9TI1BVR1MjUk9TSU4KUkVNT1RFQ09OVFJPTFMjU0VMRUNUClNUSVIjTElORSNJU1RIQVRTTyMjIwojIyNTV0UjIyNFUElTT0RFI05FQ0sKUkVTRVJWRURTRUFUI1RPVyNFTEhJCkFQUCNFU0NBUEUjI0FTUCNBU0lBTgpST0FEUyNPTkEjSURTI1RSWUhBUkQKRVhDSVRJTkcjU1BPT04jRU5FIyMjCiNZRVMjQ09MRENPTUZPUlQjRUZHIwojIyNUSUUjRVZBREUjUkVEQUxFUlQKTk9DQU5ETyNEUlMjRU1QI0VTVEVFCklST05TI1BDUyMjU0VBQUlSI0NFTgpQRUxUI1NBUiNDSElMTFlOSUdIVFMKU09BUCNPUklPTEVTIyMjQ0VFIyMjCiMjI0xJRlRFRFVQI0NMRU8jVFJBTQpTQVZBTlQjREVUQUNIRURHQVJBR0UKSFlFTkEjTU9TVCNMSU1FI1JFTUlUCkFMSUVOI1JVU0UjQU5PTiNDQUJMRQpEQU5URSNTVEFSI1BBTlMjU0xPRVM="},{"title":"06/06/10 A LITTLE ALOOF: We'll be friendlier next time","author":"Gail Grabowski, edited by Stanley Newman","date":"2010-06-06","grid":"U1RSRVAjQVJBQiNERUJTI0FDTUVTClBJQU5PI0JBTEUjRVhJVCNDT1VQRQpBQklERSNBRE9TI1BVR1MjUk9TSU4KUkVNT1RFQ09OVFJPTFMjU0VMRUNUClNUSVIjTElORSNJU1RIQVRTTyMjIwojIyNTV0UjIyNFUElTT0RFI05FQ0sKUkVTRVJWRURTRUFUI1RPVyNFTEhJCkFQUCNFU0NBUEUjI0FTUCNBU0lBTgpST0FEUyNPTkEjSURTI1RSWUhBUkQKRVhDSVRJTkcjU1BPT04jRU5FIyMjCiNZRVMjQ09MRENPTUZPUlQjRUZHIwojIyNUSUUjRVZBREUjUkVEQUxFUlQKTk9DQU5ETyNEUlMjRU1QI0VTVEVFCklST05TI1BDUyMjU0VBQUlSI0NFTgpQRUxUI1NBUiNDSElMTFlOSUdIVFMKU09BUCNPUklPTEVTIyMjQ0VFIyMjCiMjI0xJRlRFRFVQI0NMRU8jVFJBTQpTQVZBTlQjREVUQUNIRURHQVJBR0UKSFlFTkEjTU9TVCNMSU1FI1JFTUlUCkFMSUVOI1JVU0UjQU5PTiNDQUJMRQpEQU5URSNTVEFSI1BBTlMjU0xPRVM="},{"title":"06/07/10 FOOD CHECKS","author":"Gail Grabowski, edited by Stanley Newman","date":"2010-06-07","grid":"U0tJI1RBTkdTI1NBVU5BCkNBTiNBTE9PUCNUSU1JRApPUFMjRkxPT1JTQU1QTEUKUlVFI0ZVTkQjRVJBU0VTCkVUQ0hFRCMjU05JVCMjIwojI1RPVEUjQkVBTiNTUEEKQ09CUkEjQ0VOVCNTVE9QCkFLSU4jUE9JU0UjVFJFRQpSQVRTI1JBR0UjRElFVFMKRVlFI1JPU0UjTUVOUyMjCiMjI1dFUFQjI0FTS1NUTwpXQVNITUUjSElTUyNUT04KSU5QT09SVEFTVEUjRVJTClNUQUxMI1JVTEVSI1NTRQpISVJFRCNBTEVSVCNUT1Q="},{"title":"06/08/10 FORGET ABOUT IT","author":"Sally R. Stein, edited by Stanley Newman","date":"2010-06-08","grid":"U1dBTVAjQk9XTCNHSVNUCkxBTUFTI0FSRUEjQU5FVwpJQ0lMWSNCRUFUI0dBVkUKRE9OVENSWU9WRVIjQkVFCiMjI0FIQSMjRUxFR0FOVApCQU4jRVBJQyNZQVJEIyMKQUNFUyNJRE9TI0RBTVVQCldIQVRTRE9ORUlTRE9ORQpMRVRJTiNMRUVSI1NPREEKIyNBUklEI1NQQVIjRE9TCk1JU1NURVAjI1RFQSMjIwpBTkEjU1BJTExFRE1JTEsKRFVQRSNBUVVBI0VFUklFCkFTSUEjUlVCWSNFQk9OWQpNRU5VI1RFRVMjTUFORVM="},{"title":"06/09/10 CELMATES","author":"Walter Van Dam , edited by Stanley Newman","date":"2010-06-09","grid":"U0ZQRCNNQVNDI0xBVFRFCkNMVUUjUkhFQSNFUlJPUgpPQVJTI0hBUlAjRFJBTUEKVFdFRVRZQklSRCNFWUVTCiMjI1JFRCNGSVJNUyMjIwpSQVRUTEVSIyNPVVRBQ1QKT0JPRSMjT1JFT1MjU1JJCldPT0RZV09PRFBFQ0tFUgpFRFQjQUlNRUQjI0JJVEUKUkVTQUxFIyNZRUFSTkVECiMjI01FTFRTI0NJQSMjIwpTQU1FI0RPTkFMRERVQ0sKUExBTlMjRE9SQSNJTk9OCkFCSURFI0RSRUkjT0RJRQpTQUxTQSNZRUFSI1NPTEU="},{"title":"06/10/10 FLATLAND","author":"Fred Piscop, edited by Stanley Newman","date":"2010-06-10","grid":"Q0FMSSNLQUZLQSNFTUlUCk9YRU4jSU5PSUwjUE9LRQpNSU5HI01PUkVTI09WRU4KTU9OT1RPTkVWT0lDRSMjCkFNWVRBTiMjIyNDSEFUUwojIyMjUk9FI09ERSNCRUUKUlVTU08jRE9WRVJTT0xFCklOVE8jQUdORVcjQVVMRApTVEFMRUJFRVIjSE9UU1kKS0lOI0RFUyNUT0UjIyMjClNFREdFIyMjI1BBU1RPUgojI1BVTkNUVVJFRFRJUkUKVEhJUyNMQVRJTiNFQkFOCldFUFQjRVJBU0UjUEVURQpPV0VTI09USEVSI1NURVc="},{"title":"06/11/10 BEGONE","author":"Norma Steinberg, edited by Stanley Newman","date":"2010-06-11","grid":"U09SRVIjQ0FSVCNGUk9HCkNISUNPI0FTSUEjTE9CRQpBTkdVUyNOSUNLI0FMT1QKTk9II0VORFRIRVJVTEVTCiMjVEFCT08jI0ZVTiMjIwpCTUlOVVMjVFJJU1RBTiMKQUlERUQjRFJJVkUjU09VCkJMRVcjVEVBU0UjUFNJUwpBTEEjUEVBQ0UjQ0hFU1MKI0VTVFVBUlkjQk9BVEVSCiMjI0lSUyMjRklMVEgjIwpPUkRFUlBBVFJPTCNPT0gKV09PRCNPQ0hPI0VUVURFCkxVTFUjT01BTiNHRU5JRQpTVEVQI05FV1QjRU5ERUQ="},{"title":"06/12/10 SATURDAY STUMPER","author":"Doug Peterson , edited by Stanley Newman","date":"2010-06-12","grid":"QUxCVU0jSklMVCNBTVlTCk1BUkFUSE9ORVIjR09BTApCUk9XTkFMR0FFI0hPSE8KSUFNI1NBTEVTI01BRFRWCkVNSVIjU1lOVEhFU0laRQpOSU5FUiNHVVJVUyNFRU4KVEVFVEgjUkVFTCNUUkVFCiMjI1JPU0UjU0tFVyMjIwpJQUdPI1RFUkkjQUlSRUQKU01VI05BTkFTI1RSQURFCkhPVERJR0dJVFkjTFBHQQpNRVRVUCNJTkFXRSNURUQKQUJFTCNSQUlOQ0xPVURTCkVBUkwjT05FQ0FMT1JJRQpMRVNTI0VUUkUjU1BFTlQ="},{"title":"06/13/10 SEE 109 ACROSS: You can say that again","author":"David W. Cromer, edited by Stanley Newman","date":"2010-06-13","grid":"UE9JI0xPVFRPIyNUSEVCQUQjTEFECkFSQyNPUkVJREEjUkVCQVRFI0lMRQpURUUjTEVBREVEI0FMQVJNUyNBQ0UKIyNTSElNTVlTSElNTVlLT0tPQk9QCiNTS0FUIyMjU09OIyMjIyNTQUxWRQpCQUFCQUFCTEFDS1NIRUVQI1RFRU4KQU5USSNNRUFOIyNMQVBTQVQjIyMjCk5ZRVQjWUFNI0hJUEhJUEhPT1JBWQpDT1JTRVQjI01NTSMjIyNTRURBVEUKT1NTI01BSU5UT1AjQUhBIyNJREVBCiMjI1dJTldJTlNJVFVBVElPTiMjIwpBU1RJIyNPUFMjTk9OU1RPUCNGRU0KQ1JJU1RPIyMjI0dVVCMjREFHQU1BCkNBTkNBTkRBTkNFUiNXV0kjRUJPTgojIyMjUkVFTEVSIyNUSEFOI1RFVFMKUElDQSNPTExZT0xMWU9YRU5GUkVFCkFNSVNTIyMjIyNMQUMjIyNUQUdTIwpJU1RIRVJFQU5FQ0hPSU5IRVJFIyMKUlVSI1JPTExFRCNUT1NTRVMjRVdFClVSSSNGT0xERUQjSU5TRUNUI0dBTApQRUMjU1RFQURZIyNTT0NLUyNHWU0="},{"title":"06/13/10 SEE 109 ACROSS: You can say that again","author":"David W. Cromer, edited by Stanley Newman","date":"2010-06-13","grid":"UE9JI0xPVFRPIyNUSEVCQUQjTEFECkFSQyNPUkVJREEjUkVCQVRFI0lMRQpURUUjTEVBREVEI0FMQVJNUyNBQ0UKIyNTSElNTVlTSElNTVlLT0tPQk9QCiNTS0FUIyMjU09OIyMjIyNTQUxWRQpCQUFCQUFCTEFDS1NIRUVQI1RFRU4KQU5USSNNRUFOIyNMQVBTQVQjIyMjCk5ZRVQjWUFNI0hJUEhJUEhPT1JBWQpDT1JTRVQjI01NTSMjIyNTRURBVEUKT1NTI01BSU5UT1AjQUhBIyNJREVBCiMjI1dJTldJTlNJVFVBVElPTiMjIwpBU1RJIyNPUFMjTk9OU1RPUCNGRU0KQ1JJU1RPIyMjI0dVVCMjREFHQU1BCkNBTkNBTkRBTkNFUiNXV0kjRUJPTgojIyMjUkVFTEVSIyNUSEFOI1RFVFMKUElDQSNPTExZT0xMWU9YRU5GUkVFCkFNSVNTIyMjIyNMQUMjIyNUQUdTIwpJU1RIRVJFQU5FQ0hPSU5IRVJFIyMKUlVSI1JPTExFRCNUT1NTRVMjRVdFClVSSSNGT0xERUQjSU5TRUNUI0dBTApQRUMjU1RFQURZIyNTT0NLUyNHWU0="},{"title":"06/14/10 CATEGORIES","author":"Billie Truitt, edited by Stanley Newman","date":"2010-06-14","grid":"Q1JPUCNGT0FNI1dBU1BTCkxBVkEjQURFRSNJR0xPTwpPUEVSI1RPUk4jVE9PTFMKU09SVFRIUk9VR0gjQk9PCkVOVElSRSMjU1VJVCMjIwojIyMjQVJNUyNJVEhBQ0EKT0FTSVMjQUNJRCNJV0FTCktJTkRIRUFSVEVETkVTUwpFRElUI1hNQVMjUkVTRVQKREVQQVJUI01ZTVkjIyMjCiMjI0dBUkIjI0FMQVJNUwpOQUIjVkFSSUVUWVNIT1cKRUxPUEUjSVNBVCNOSU5FCkFTSUFOI0VMU0UjQU5URQpST0xMUyNGRUVEI1BPRVQ="},{"title":"06/15/10 MAIL ORDER","author":"Gail Grabowski , edited by Stanley Newman","date":"2010-06-15","grid":"QVJDSCNEQURTI1NMQU1TCkdBTEEjVU5JVCNFRVJJRQpUSUVSI1NFQ1kjUkFJU0UKU0xBQiNUV0VMVkVQQUNLCiNTVE9SRSNTRUVOIyMjIwojIyNSRURPIyNSRVBBWVMKQUdBU1AjUEFUUyNJTVVQCk1BUkUjVEVQRUUjUklMRQpQTEVBI0FOVEUjRkFERUQKU0VBTEFCIyNTVEFUIyMjCiMjIyNTTE9HI0lORVJUIwpCVUJCTEVXUkFQI1NPT1QKT0hBUkUjTEFNUCNIVUxBClNVU0lFI0VQRUUjSVRFTQpTSEVFUCNURU5EI1BFVFM="},{"title":"06/16/10 AND A ONE AND A#133;","author":"Fred Piscop , edited by Stanley Newman","date":"2010-06-16","grid":"U1dFUFQjSklGRiNMT1NTCkVBR0VSI0VSSUUjRU5ZQQpUV09HVVlTQU5EQUdJUkwKSEFTI01PU1MjU1BFQ0lFCiMjI0tBTEUjIyNPTkVBTQpSRURJTksjU0NBTEQjIyMKT1ZFUiMjRU1BSUwjV0FECkxJQ0tBTkRBUFJPTUlTRQpFTEsjREVFUkUjI0FDSEUKIyMjQ0hBTlQjQkFSS0VECkNBQ0hFIyMjSkVUUyMjIwpBQk9BUkQjQVVUTyNBVE0KRElOTkVSQU5EQU1PVklFCkVER0UjQUdPRyNJUk9OUwpURUFMI0JPTkUjQ0VOVFM="},{"title":"06/17/10 TAKE IT EASY","author":"David W. Cromer, edited by Stanley Newman","date":"2010-06-17","grid":"UE9NUCNDUklCUyNJTUFNCk9SRU8jTEVNT04jR0lMQQpQQUNJRklDSVNMQU5ERVIKRVRDI09QRU5TI0xPREdFClNFQSNZT04jI0VBUkwjIwojIyNHRU5UTEVCUkVFWkUKU0FCRVIjI0VEQU0jTUlYCkVYSVQjREFERFkjREFURQpBTEwjR09ORyMjVE9OSUMKTUVMTE9XWUVMTE9XIyMjCiMjQkFSTiMjT0VSI1BBRApBTE9ORyNQQVBBUyNMSUUKUEVBQ0VGVUxQUk9URVNUCk9HUkUjT0xERU4jQUJMRQpQT0RTI1JFQURTI0pFRVI="},{"title":"06/18/10 QUINTET","author":"Raymond Hamel , edited by Stanley Newman","date":"2010-06-18","grid":"Uk9CUyNTUEVORCNTQUxFClNMQVcjT1JUSE8jUExFQQpWSVNFI1ZJT0xBVElPTlMKUE9TRSNJT04jI0FOVFNZCiMjRVRIRVIjT1RUTyMjIwpSQVRPVVQjUEFSQUZGSU4KT1BFTlMjQ0FUTyNGSU5FCk9BUiNIT1JORVRTI0RPRQpTSVJFI0tFRU4jVU5ESUQKVFJFU1BBU1MjS05FTExTCiMjI1RPWVMjUE9TU0UjIwpBTkdFTCMjRklSI1RIRUUKQ0VMTE9QSEFORSNFRUxTCkhBVUwjQU9SVEEjR0FTUApFUEVFI1NJTU9OI0dEQVk="},{"title":"06/19/10 SATURDAY STUMPER","author":"Merle Baker , edited by Stanley Newman","date":"2010-06-19","grid":"UE9TVERPQyMjU0lOR1RPCkFOTk9ZRVIjQklQT0xBUgpMTEFORVJPI1lFQVJFTkQKVEVQSUQjQ0xBU1NNQVRFClJBUFMjQk9BU1RTI05QUgpPU0UjQlVEREhBI05FSUwKV0hBVExMSURPI1NVRFNZCiMjI1dJTEwjV0lUVCMjIwpMQUJBTiNFQ09TWVNURU0KT1VSUyNTVElGTEUjQVZJCkdSTyNHT