{"id":"newsday-1998","publication":"newsday","year":"1998","count":364,"puzzles":[{"title":"1/1/98 THE WORKS","author":"by Alex Vaughn, edited by Stanley Newman","date":"1998-01-01","grid":"Q1pBUiNTSEFOSyNBUkFCClJVREUjVEVUT04jTk9WQQpBTEVTI0VMSVNFI0RBSVMKTVVTVEFSRFRIRU5FUlZFCiMjI0FQRSMjI0JFQSMjIwpTVEFURU9GVEhFT05JT04KTEFURVgjSVJPTlMjTkNPCkFNRVMjQlJBTkQjUklUVApTUEEjSkFNSUUjU0lOQUkKSEFNTUVSQU5EUElDS0xFCiMjI0FSVCMjI09NRSMjIwpQTEFZS0VUQ0hVUEJBTEwKUklORCNOT0xBTiNPQk9FCk9ORUEjRFJVSUQjV09OVApERVdZI1NURU1TI0xVSVM="},{"title":"1/2/98 NO ONE SPECIAL","author":"by Ed Julius, edited by Stanley Newman","date":"1998-01-02","grid":"U1BBWUVEIyNTQUZBUkkjCk9STkFURSMjQUxBTUVEQQpKQUNLT0ZBTExUUkFERVMKT0lJI05FUEFMI0VTVEFTClVSRUEjUkVQT1QjU0FURQpSSU5TRSNEQVdFUyNQRVIKTkVUVEVSI1pFU1RJRVNUCiMjI0FSSVAjUlRFUyMjIwpDQVJCSU5FUyNTQUxURUQKVVRFI0VHR0VEI0tFUlJZCkJPVFMjT0dSRVMjU0VBTgpBTklMRSNZSUtFUyNBU0EKR0VORVJBTEZBQ1RPVFVNCkVSVURJVEUjI1RPUkVSTwojU0VTQU1FIyNTUEFERVM="},{"title":"1/3/98 SATURDAY STUMPER","author":"by Randall J. Hartman, edited by Stanley Newman","date":"1998-01-03","grid":"TE9QUyNTRUVOI09QVFMjCkVQRUUjVUxOQSNVUklBSApTVVJSRU5ERVIjVEVSUkEKRVNQT1VTRSNSRUNUT1JZCiMjTFVSRVIjQUxMRUxFUwpQUkVTRVRTI1RFQVIjIyMKTEFYIyMjIyNFTlNJTEVTCkVORU1JRVMjRElTVE9SVApBRERFTkRBIyMjIyNSSUEKIyMjU0lHTiNTVEFHR0VSCkJMQVNURUQjT1JTT04jIwpMQU1BSVNUI1JPU0lFU1QKT01FR0EjUkVETEVUVEVSCkJBQkVMI0FSSUwjRVRSRQojU0FTUyNQQURTI1JFRUs="},{"title":"1/4/98 AUTHOR, AUTHOR: Books and their writers that go together somehow","author":"by Alfio Micci, edited by Stanley Newman","date":"1998-01-04","grid":"I1NIRUVOI1NMVUIjSk9KTyNBUkxPClNIQUxMSSNURVRFI0FMT1AjTE9BTQpFSUxFRU5ET1ZFUiNQTEVBU0FOQ0UKVFJFI0dBSUxZI1NOQUlMI0FSREVOCiNUUkVBQ0xFI0xFT05FI1NMVUUjIwojIyNBTlIjI0NBUlRFI1NURU1NRUQKI1BBUlRPRiNMVUtFU0hBUlAjSVJSClBVTEwjU09GQVIjU0VFTk8jQ0xJTwpDUk9XI1NVRU1FIyMjRUVLI0FMRVMKQkxVRVMjUkVNQU5ERUQjRUdSRVNTCiMjI0xPU1MjRVRBSU4jQURBWSMjIwpDQVJMT1QjUFJFTkFUQUwjUFNZQ0gKQUNIRSNJU1UjIyNTSEVFUCNQRUFSCkxBT1MjUEFTSEEjVFVTQ0gjRUFUUwpMU0QjUkVYSE9MTUVTI1NJVEFSUyMKRVRBTUlORSNTTElNRSMjTEVSIyMjCiMjSEVBRCNPUEVOQSNOQVRBU0hBIwpTUE9SVCNUUklOSSNUT0dBUyNPTkUKVEVSTUFHQU5UI01BUklPTkhBU1RFCkVMU0EjSURFQSNVU0VTI0tPUkVBTgpQRUVOI05BU0wjTUlLRSNTUEVMTCM="},{"title":"1/5/98 WATER LOG","author":"by Bob Lubbers, edited by Stanley Newman","date":"1998-01-05","grid":"R0FTI0JXQU5BI0hBU1RBCkxPVCNFQVRFTiNFTlRFUgpPUlIjQ0hBTk5FTFNVUkYKU1RBQ0sjI0VJUkUjIyMjClNBSUxPUlMjRVJORVNUIwojI1RVTkVJTiNTQUxPT04KU09MI1NPUkVTIyNLVURPCkFNQU4jU0VQQUwjU05BUApMQUNFIyNOQVRBTCNEWUUKVEhFTUVTI0xVUkVSUyMjCiNBRE9OSVMjUEFQQVlBUwojIyMjQUxFUyMjQU5TRUwKQ09WRU1PTERJTkcjVFJJCkFET1JFI0xBSU5FI0VJTgpORVdFTCNTS0lFUyNNRUc="},{"title":"1/6/98 GRID PLAY","author":"by Rich Norris, edited by Stanley Newman","date":"1998-01-06","grid":"SU5MQVcjSFVNQU4jTkVXCkFCSURFI0VSQVNFI09WQQpNQURFQVBBU1NBVCNST1QKIyMjI0tBUkFUIyNQSUtFClNOSURFU1QjI0FCVVNFUgpQVVRPTlRIRUJMT0NLIyMKRURBTVMjI05PVkFLIyMjCkRFTEkjVEFOWUEjRU5JRAojIyNORUhSVSMjVFJJVEUKIyNHT1RBS0lDS09VVE9GCk1DTEVBTiMjUkVPUEVOUwpBTEFTIyNJQ0FOVCMjIyMKQ0FOI0hBRE9OVEhFUlVOCkFSQyNBTExFTiNFTElURQpXRUUjV0VFRFkjRE9NRUQ="},{"title":"1/7/98 ALLOY OOP","author":"by Fred Piscop, edited by Stanley Newman","date":"1998-01-07","grid":"QkFMRSNXQUtFUyNCTEFCCkFNSUQjSU1BR0UjUkVORQpST01FI0RJTkdFI0FOVEUKQlJPTlpFU1RBUiNTVE9QCiMjIyNFT1MjUkVBU09OUwpTS1lDQVAjIyNERFQjIyMKSElHSExFVkVMI0VBR0xFCk9OT1IjTklYRUQjQ0hJUwpQRVJPVCNERUVSU0tJTlMKIyMjTU9EIyMjQUxTQUNFCkFSVEVNSVMjVFdJIyMjIwpSRUVEI1NURUVMRFJVTVMKVVBUTyNNT1JSTyNPUEFMCkJST00jQVZBU1QjVE9KTwpBT05FI1lFU0VTI1NOQUc="},{"title":"1/8/98 PEDIATRICKS","author":"by Ann W. Masten, edited by Stanley Newman","date":"1998-01-08","grid":"QkFSQiNTQ0FSRSMjVFpFClVTRVIjTEFOQUkjQ1JVWApDQU5JI09SQVRFI1JPTkEKT1BFTlRPRSNUSU5ZVElNCiMjI0dBUCNCTE9PUCMjIwpSQVBJRCNCRUUjU1RBTEUKRUJFTiNWT0xUUyNBTUlTClNBTkcjSVRBUlQjRUJCUwpFVFRVI0FUQkFZI1NFUkEKV0VFUFkjTE9QI1NUUkFZCiMjI0JBTEVSI0JBSCMjIwpTTkVBS0lOI0hPTUVSVU4KV0VFQiNNRVRFUiNTQU5FCkFMTFkjT0NFQU4jSVNUUwpQTFkjI1NLQVRFI0FIT1Q="},{"title":"1/9/98 WHERE IT'S AT","author":"by Patrick Jordan, edited by Stanley Newman","date":"1998-01-09","grid":"U0xPUFMjUklORCNFTExBCk5PVFVQI0lERUEjTEFJTgpPVVRQRVJGT1JNI0FXRUQKIyMjI0NFTExPI0JJRkZTCkFCVVNJVkUjI01FTlUjIwpQQVNURVMjU0hPVkVMRUQKQVJFQVMjREFJTFkjQ1VFCkNNRFIjVk9URUQjT0xHQQpIQVQjT09aRVMjQkFBRUQKRU5IQU5DRUQjREVGSU5FCiMjRVJMRSMjTEVOU01FTgpFTEVHWSNTSE9SRSMjIyMKU0VYWSNPQ0VBTkZMT09SClRBSUwjRk9SRCNJT1dBTgpBTlRFI1RXT1MjVEFOS1M="},{"title":"1/10/98 SATURDAY STUMPER","author":"by Ray Hamel, edited by Stanley Newman","date":"1998-01-10","grid":"TUFSSU9MQU5aQSNCQVJECkFCRVJSQVRJT04jRUdFUgpST1lPUkJJU09OI0RPVkUKRFVOTiNFTVMjT01FTkVECklUQSNQTEVBI1RPV0lORwpTVFJJQSMjTkVBUiNTVUUKI09ET1JTI1NBVElBVEVECiMjI1dPV1MjUk9CUyMjIwpSRUxBWEVSUyNSVVRIUyMKRVZFI1lFQU4jI05PT0tTCkxPQ1VTVCNBQ0VEI0xJUApBTEFSTVMjR0xDI1BZUkUKVFVSSyNQSUdFT05IT0xFCkVUUkUjT1ZFUkxPT0tFRApSRUVMI1RFREtFTk5FRFk="},{"title":"1/11/98 SRO: Which today stands for \"Solving Room Only\"","author":"by Bob Lubbers, edited by Stanley Newman","date":"1998-01-11","grid":"I01PQSNUUkEjU0tVQSMjI0lCRUFNCiNBUk4jQUVSI1RFUk4jT0NDVUxUUwpHUkVBVFdISVRFV0FZI0ZBSVJJRVMKQUxPSEEjRUFSIyNMQUZGUyNMQVMjClJPU0VUVEEjT1RJUyNBQkFTRSMjIwojIyNJVEVSI1BJTiNIVVIjQVNTQUQKU1VNTUVSU1RPQ0sjSVNPI1NRVUlEClVOSSNEUkVJIyMjI1NUQVQjVUVMRQpTVEFSIyMjQkVSRyMjI0RSWUVSUyMKQUlNQVQjQkVET05FIyNXT08jIyMjCk5FSUdIQk9SSE9PRFBMQVlIT1VTRQojIyMjRUVSIyNTTUlMRVkjT1BURUQKI0FTU0VUUyMjI0VUT04jIyNFSVJFCkRJQUwjQUNDVCMjIyNBTFNPI0NVTQpBRExBSSNIQUkjQ0xPU0VURFJBTUEKQkVFUFMjVFJFI0hFUiNGTEVFIyMjCiMjI1NIRUJBI1JFRE8jVE9TTEVFUAojQk9UI1JFVFJPIyNORVcjU0FMVkUKTUFYSU1BTCNJTVBST1ZJU0FUSU9OCkRJRUNBU1QjVEFSTyNFTkEjRUVLIwpDT05LUyMjI0FORVcjU0dUI1NTRSM="},{"title":"1/12/98 DROPS IN THE BUCKET","author":"by Lee Weaver, edited by Stanley Newman","date":"1998-01-12","grid":"VEFMRSNTQ09PUCNFTEJFClJVRUQjSEVMTE8jTkVSTwpBUkdPI0lETEVSI0pFQU4KTUFQI0JSRUFTVFdPUktTCiMjVVNFUlMjI1JBSVNFIwpUQUxPTlMjU1dBSU4jIyMKQUxMT1QjQkVSWUwjV0lTCkRJRVQjRE9NRVMjTUlOVApTRVIjTEVOSU4jREFOQ0UKIyMjTEFDRVMjU09VR0hUCiNDT0FUSSMjU1RPSUMjIwpUSElHSE1BU1RFUiNIT1QKWUFMRSNBV0FSRSNNQUdJClBJRVIjTE9WRUQjRElFTQpFTkRTI1NMRVdTI1RSRUU="},{"title":"1/13/98 AT THE SYMPHONY","author":"by Rich Norris, edited by Stanley Newman","date":"1998-01-13","grid":"UEFTVCNCTE9UI1NIQVZFCk9HTEUjTElSQSNDSUdBUgpEUlVNU1VQQlVTSU5FU1MKU0FNUExFI1NQQSNEREUjCiMjI1RVTVMjRUxJUyMjIwpMQlMjUk9BUiNFVklDVFMKT09QUyNPVkVSI0FHUkVFClRPT1RPTkVTT1dOSE9STgpTVFJJUCNESVNII1RPUlMKQVNUUkFMI05FSUwjTllFCiMjI0ZMT1AjU1RBUiMjIwojVUFSI05BUCNFTElTSEEKU1RSSU5HU0FUVEFDSEVECkFJTUVFI1RJS0kjSElSRQpDTFlERSNBTE9FI0VOT1M="},{"title":"1/14/98 PUZZLE, ANYONE?","author":"by Fred Piscop, edited by Stanley Newman","date":"1998-01-14","grid":"RkxPIyNQSUVUQSNDQVBFClJBVkUjQU5URUQjQUJPWQpBQ0VWRU5UVVJBI1JJTEUKIyNSRU5URUQjR0FJTFkjClNORVJEI0xFVElUQkVNRQpERUFMRVIjI0hPRSNORUwKSU9UQSNST1RFI0FWRVJZCiMjI1NFUlZFVElNRSMjIwpNQUxUUyNJTUFNI1JFQUQKRU1VI1NTTiMjQVNCVVJZClJBQ0tFVEVFUiNQQUdFUwojU0lFTkEjUkVMQVRFIyMKQVNBTiNMT1ZFU1RJTktTClBFTk4jQUxJU1QjTUlLRQpUUk9ZI0dFTkVTIyNFS0U="},{"title":"1/15/98 GOING NATIVE","author":"by Bob Lubbers, edited by Stanley Newman","date":"1998-01-15","grid":"U0FHQSNDQlNUViNBR1JBCkNMRUYjTElLRUEjQ0xBUApBQkVSRE9OSUFOI1RBUEUKTUFSSU9TIyNSRVNJU1RTCiMjI0NSRUFNI1NUT1cjIwpBTEhBTUJSQSNTQU5FU1QKU0VBTiNZRU5UQVMjR1RPClNPTFMjI0FYRSMjR0lBTgpBVkkjTUVTTUVSI0xBTksKTUlHTk9OI0FOQUNPTkRBCiMjT0FTVCNOQUJPQiMjIwpJR05JVEVEIyNCT1VORFMKQk9JTCNCUlVYRUxMT0lTCklSQUUjQkVTRVQjSU1FVApTRU5EI0VHQURTI05FVFM="},{"title":"1/16/98 GRAND TOUR","author":"by Ed Julius, edited by Stanley Newman","date":"1998-01-16","grid":"SE9UTElORSNBQk9SVCMjCklDSEFCT0QjVE9SQUgjIwpUSEVXSUxEV0lMRFdFU1QKVFJBTlMjI0FNRVMjU1RICkhFUFMjTEFHRVIjQ0FSRQpFU1AjUlVCIyNPTUFIQVMKIyNBRU9MSUFOI0lSQVRFClNBTFpCVVJHQVVTVFJJQQpPUEFSVCNERUFEU0VBIyMKUkVDQVNUIyNDT1kjREFTCkJBSFMjUkVBUFMjTkVWQQpJQ0kjRUlSRSMjUkVTRVcKQ0hBTkdFT0ZTQ0VORVJZCiMjTkVBUlMjSU1NRVJTRQojI1NFTlNFI0JMSVNURVI="},{"title":"1/17/98 SATURDAY STUMPER","author":"by Frank Longo, edited by Stanley Newman","date":"1998-01-17","grid":"I0NBUlBFRCMjI0ZBWkVEClBBUk9MRUVTI0hPVEFJUgpBQ1RVQUxMWSNBTlRJR08KVEhJUlRFRU4jU1RFUkVTClRBTEtFUlMjQUJBU0VSUwpFTExFTiMjU1BFTlQjIyMKUk9FIyMjU0FORU5FU1MjClNUUkFJR0hURU5FRE9VVAojU1lSREFSWUEjIyNDUFIKIyMjTU9WRVIjI1NXSVBFCkhBU1NMRUQjRkFDSUFMUwpBTU9SQUwjQ09ST0xMQVMKUkFNQVRFI1VSU1VMSU5FClNQQUNFRCNFR09USVNUUwpIQVRFUiMjI09OU0VUUyM="},{"title":"1/18/98 \"#?@*!\": What some characters can stand for","author":"by Fred Piscop, edited by Stanley Newman","date":"1998-01-18","grid":"UkVQT1NUI1BBU1NBUyNTRVJQSUNPCk9NRVJUQSNPUlRFR0EjQURPUk5FRApUSUNUQUNUT0VQTEFZSU5HQk9BUkQKRUxLI1JFQVAjI0ZJTk4jRUJCIyMjCiMjI0FUVFUjU1BJTk9GRiMjTE9BTQpBRElFVSMjREFJUyMjI0VVVEVSUEUKTU9OT1BPTFlTQ0hBTkNFU1lNQk9MClBFTk4jTUlOU0sjVkFMTEVFIyMjIwojIyMjUkVLRVkjTEVST1kjI1NFTEwKVkVTVElHRSMjUkFSRVMjVEFUVE9PCkVNQUlMQUREUkVTU1NFUEFSQVRPUgpSSURHRVMjUlVQRUUjI0VNQU5BVEUKQVRFRSMjQkFCQVIjRkxBSUwjIyMjCiMjIyNQRVJJTFMjRkxBQ0sjVE9HQQpUT1VDSFRPTkVURUxFUEhPTkVLRVkKSVRBTElBTiMjI0ZFRUQjI0VTU0VOCk5PUkEjI0NIQU1GRVIjVEVDSCMjIwojIyNQQUgjRUxJQSMjRkxBSyNCU0EKU1VSUFJJU0VJTkNPTUlDU1RSSVBTCklOQ0VOU0UjU0VFUkVEI1RJRURVUApCQURERVNUI1RPUkVSTyNTRVZFUlM="},{"title":"1/19/98 WEATHER OR NOT","author":"by Lee Weaver, edited by Stanley Newman","date":"1998-01-19","grid":"U0hBSFMjSURPI0NMQVdTCkhPU0VBI1JBUCNMSVRSRQpBUEFSVCNBUkUjVU5USUUKV0lORElOU1RSVU1FTlQjCiMjI1NSSSMjQUxQIyMjIwpPRkYjSUNFUyNNRVRUTEUKUkFJTkNIRUNLI0RBUkVECkVSTEUjRUxFTkEjQ0FZUwpBQ0VSQiNTTk9XV0hJVEUKREVUT1VSI1RCQVIjVEVMCiMjIyNJQU4jI1JFUyMjIwojSEFJTFRPVEhFQ0hJRUYKV09VTkQjQk9BI0tFTllBCkhFREdFI0xJTCNFQVRFTgpPU0lFUiNFTEwjRFJPU1M="},{"title":"1/20/98 GOING UP","author":"by Rich Norris, edited by Stanley Newman","date":"1998-01-20","grid":"VE9QTyNHUkFDRSNIVVNICkVOT1MjTEVOT1gjT0hJTwpTTU9LRUFORE1JUlJPUlMKSEVSQUxEI1NQTEFTSEVTCiMjI1JBSUwjU0VHIyMjIwpPUFMjTE9JUyNTVEFGRlMKTUlDQSNMU1RTI0FCT0lMCklOQUJMQVpFT0ZHTE9SWQpUVVJCTyNURVJJI0VMU0UKU1BFRUNII0RFTEwjU1RSCiMjIyNBRUMjU01FRSMjIwpUT0FTVEVSUyNHQUxMT1AKSU5USEVMSU5FT0ZGSVJFCk1PVE8jRU1PVEUjSVZFUwpFUkFUI0RFQkFSI05FU1Q="},{"title":"1/21/98 HARD HITTIN'","author":"by Fred Piscop, edited by Stanley Newman","date":"1998-01-21","grid":"Q0FUIyNNQUlNI0NBUkFUCkFTSCNGT1NTRSNPTUFIQQpTSEUjSU9UQVMjUk9EQU4KSEFNTUVSSU5IQU5LIyMjCkVNQUlMIyMjWU9XI1ZJUApXRU5URE9XTiNMQU1FTlQKU0RJIyNDT09LI0xPTkdBCiMjTEFSUlVQSU5MT1UjIwpLUk9ORSNLQVRPIyNTU1QKSU5WQURFI1JFU0FERExFCk1BRSNBRFMjIyNUT0VJTgojIyNTTEFNTUlOU0FNTVkKU0xJQ0UjRUVSSUUjSU1FCkhBR0FSI0FHRU5BI0xFQQpBQk9SVCNSQVNBIyNPUlI="},{"title":"1/22/98 ISN'T IT ROMANTIC","author":"by Bob Lubbers, edited by Stanley Newman","date":"1998-01-22","grid":"I0FDQVJSSUEjU0hBUEUjClNQT1JUSU5HI1RFTExFUgpSRUNSRUFURSNSSUJBTEQKQVJPTyMjT1JFQUQjWlNBCiMjI1lBTSNJTkRJUkEjIwpPRkZPTkEjRERTI0FIQUIKQ1JJI0FESUVVI0VOT0xBCkFFRiNDRU5UUkFMI1RJUwpMT1RURSNTSEVMRiNFVkUKQU5ZQSNTRVIjTUlTTEVECiMjTlVNRVJPI0FOQSMjIwpBTEkjQUNUVVAjI0hJS0UKRElORVJPI0dPRVNBVElUCkRFVEFJTiNIT05PUkVSUwojU0hSRUQjVEhFUEFSSyM="},{"title":"1/23/98 UPS AND DOWNS","author":"by Frank Longo, edited by Stanley Newman","date":"1998-01-23","grid":"Q0xBUFMjVkVSQiNGSVNIClJFVFJPI0VDSE8jQVJDTwpFVEhJQyNFTEVWQVRPUlMKQVRPTUlDI0FTQVAjTkVUClRFTVBFUkFUVVJFI1dFRQpFUkUjVEFHI1NZUklBTlMKIyMjQ0FWRUQjIyNPUkVTCiNST0xMRVJDT0FTVEVSIwpSRVBPIyMjTElCWUEjIyMKRUxFR0lTVCNOT0IjQVJTCk1FUiNTVE9DS01BUktFVApBVkEjTEFHTyNCUkFJTlkKS0FOR0FST09TI0lOVEVSCkVOREUjVFVORSNUSUFHTwpTVElSI1NUWVgjRVNTRU4="},{"title":"1/24/98 SATURDAY STUMPER","author":"by A.J. Santora, edited by Stanley Newman","date":"1998-01-24","grid":"Qk9TQyNDTEFEIyNUQVhJCkFXT0wjSE9QSSNNT0dFTgpNRURJQ0lORVMjT1JBTlQKQU5TRUxNI1NDRU5BUklPCiMjI05FRUQjT05FI1NBVwpIRUNUQVJFI1JBWUUjIyMKQUxJRU5BVEVEI1BMQVRFClRJVExFI0VQQSNMQUJFTApIQVlFRCNSSU5HQUJFTEwKIyMjU0hPUiNDT1lPVEVTCkFHRSNPUkUjRVZFUiMjIwpTVU5CVVJOUyNFUkFTRVMKTklEVVMjVEhJUlNUSUxZCkVMVURFI0xPQU4jRVJPUwpSRUVEIyNZRU5TI0RFTlQ="},{"title":"1/25/98 VEGGIE SURPRISE: Farm-fresh wordplay","author":"by Shirley Soloway, edited by Stanley Newman","date":"1998-01-25","grid":"QkFMSyNDUklNUCNTQ0FMQSNFTFNBCk9CT0UjTEVWQVIjVFVORVMjTklUUwpMT1JFI0FEQU5PI09STk9UI0RFRVMKVFVSTklQT05FU05PU0UjRU1JR1JFClNURUVEIyMjU1BBREUjUFJFVkVOVAojIyNST1RTIyNFTVUjREFOVEUjIyMKUk9CI0xFVFRVQ0VQUkFZI0FJUkVTCk9QRUMjWUVBU1RTI0VORk9MRElORwpTRU5PUiNFTEkjI0RFQ09SI1VOSVQKQU5EUkUjUEVBU01BS0VSUyNBRERTCiMjI05PUyMjI1RBVSMjI09XTCMjIwpBQkFUI1BFUFBFUkJBQ0sjSElORVMKQkFTRSNJVklFUyMjTlJBI09TQUdFCkJSSU1TVE9ORSNTRURBVEUjVFJJUApBREFQVCNLQUxFQU1JVElFUyNDU1QKIyMjTE9WRVMjTllVIyNFUkFTIyMjClNBRkFSSVMjU1RJTEwjIyNSRUVTRQpBR0FURVMjQkVFVFNBTkRQSUVDRVMKREVMSSNPTkFJUiNJTlVSRSNNT05LCklORE8jUkVJTkUjT0dERU4jRUxTRQpFVE9OI1NPTEVEI05FRURTI0RFRVI="},{"title":"1/26/98 RIGHT DOWN YOUR ALLEY","author":"by Norma Steinberg, edited by Stanley Newman","date":"1998-01-26","grid":"U0FHRSNBQ1RVUCNDTEFXCkVHT1MjU0hJUkUjSEVTQQpNT09TI1NJTkdFI0lWQU4KSU5OI0dVVFRFUlNOSVBFClNZU1RFTVMjI0xFVCMjIwojI1RPUkUjRlJFRVpJTkcKSEFSRU0jRlJJU0sjV0FSCkFYSVMjU0xPUFMjREFNRQpJTEsjQkVBTlMjS0VTRVkKTEVFR1JBTlQjSkVGRiMjCiMjI09BRiMjUEFQWVJVUwpCQU5BTkFTUExJVCNBU0EKT01JVCNSVVJBTCNBTUlOClJFTkUjRU1PVEUjTEVORApLTkVFI1JPV0VEI0VER1k="},{"title":"1/27/98 CALLING MR. FIXIT","author":"by Lee Weaver, edited by Stanley Newman","date":"1998-01-27","grid":"R0lTVCMjRFJBVyNHQUJTCklOQ0EjRElBTkEjRVNBVQpTTkFQRFJBR09OI1RFUkkKTUVMI09JU0UjREVDQU5UCk9SQUNMRSNTTUVBUiMjIwojIyNSRURTI0FSUkFOR0UKU0FMQUQjUE9QRSNDT09UCkVMSVMjV09VTEQjS09OQQpMQVNII0FSVEUjU0lORVMKTElUSEVTVCNTUElOIyMjCiMjI0VUSFlMI0VER0lORwpBWkFMRUEjT0dSRSNPQVIKR0VSTSNCUkVBS0RBTkNFCkVSTkUjTElTUFMjTElSRQpTT09UI0VBU0UjI0lDRUQ="},{"title":"1/28/98 A LITTLE CHANGE","author":"by Fred Piscop, edited by Stanley Newman","date":"1998-01-28","grid":"Q1JFU1QjQVJURSNBTEFOCkhBUlBPI1JFQU0jU0lERQpBVklBTiNMQU1CI0tOT1cKTklDS0VMT0RFT04jT1JFCiMjI0VSQSMjI1NJVFRFUgpGQUIjU1BJVCNTVEFZIyMKQUNJRCNVTEVFI1JVUEVFClRIUkVFUEVOTllPUEVSQQpTRURBTiNET1pFI0VSR1MKIyNJTkRPI1JPTUEjU09UCkNFTlNPUiMjI0VEQSMjIwpIQUgjRklWRUFORERJTUUKSVRBTCNPQVRII0xBTkVTCk5JTkEjTElURSNFR1JFVApBTkRTI0VMQU0jREVFUkU="},{"title":"1/29/98 BIRD CALLS","author":"by Patrick Jordan, edited by Stanley Newman","date":"1998-01-29","grid":"SkFWQSNTVEVFUCNFREFNCkFCRVQjVEVMTEEjQ1VCQQpNVVJNVVJBTU9ST1VTTFkKU1RZI05BQlMjQVdBS0VTCiMjI0FMSUEjU0xFRCMjIwpBTVVTSU5HR1VZI09SQ0EKQ0FSQVQjI0xJWiNSRUFQClRVRyMjUFJBVEUjI1RJRQpPREVTI09VUiMjQkVSUkEKUkVTVCNTTkVBS0FMT09LCiMjI1JBVFMjTkVTUyMjIwpBQk9BUkQjQk9ZUyNTUEYKTUVESUNBTElNUE9TVE9SClBMQVQjVElCSUEjRVlSRQpTQVlTI0VCQkVEI0FYRUQ="},{"title":"1/30/98 SHADES OF GLORY","author":"by Ray Hamel, edited by Stanley Newman","date":"1998-01-30","grid":"V0hPTSNHRVJNI0VQT0NICkhPUEUjQUxPVSNEVUJBSQpBUkVBI05PRVMjT1pPTkUKTUFDVE9OSUdIVCNaRUVTCiMjI0hVRVMjI0FXTCMjIwojQ0hFU1RFUkNIRUVUQUgKRkxPQVQjI0hPT0QjQVZFCkxPUkQjU1BJTkUjQVhFRApPV04jQU1FTiMjQU1PUlkKRU5FUkdJWkVSQlVOTlkjCiMjI1dFVCMjRUlSRSMjIwpGRVRBI1NVTkdMQVNTRVMKTEFXTlMjU0VBTCNJVENICkFTSURFI0FNSUUjQUFSRQpUWU5BTiNGT05UI0NSVUQ="},{"title":"1/31/98 SATURDAY STUMPER","author":"by Frank Longo, edited by Stanley Newman","date":"1998-01-31","grid":"U0NBUkYjQURTI1VOU0FZCkxPTkVSI1RFTVBMQVRFUwpPUk9OTyNPVkVSVEhFUkUKQURJVFMjTUlMRVIjRk9SCk5PTkVUUyNPVFRBV0FTIwpFTlRSRU5PVVMjVkVOT00KIyMjI0RJQlMjUElQSUxPCkFTUEVDVFMjUFJPVEVTVApTSVJJVVMjUkVFTCMjIyMKU0xVUlAjU0VOU0VMRVNTCiNFUkVDVEVEI1NUQU5DRQpBTkkjQU1BTkEjTFVURUQKSUNFU0tBVEVTI0FSRU5BCkRFTlNFTkVTUyNNRVJJVApFU1RFUyNEU1QjUExPQ0U="},{"title":"2/1/98 JAMES STEWART FESTIVAL: Remembering a giant of the cinema","author":"by Bob Lubbers, edited by Stanley Newman","date":"1998-02-01","grid":"R1JBTSMjU0FMVCNBSEVBRCMjQVJGClJPU0VTI09ESUUjR0VMTEVEI05PUgpJVFNBV09OREVSRlVMTElGRSNBTlkKREVUUkFDVFMjTUlBTUkjI05FVFMjCiMjI0FSRUEjU0lEIyNFUklOR08jIwpMQUQjTUFHSUNUT1dOI0VOSUdNQVMKRUxFVkVOI0RFRSNIT0dBTlMjWUlQCk5PU0VEI1RFTiMjSVRFUlMjU09EQQpBTlRFI0NIQVQjU1RSRVcjU0FGRVIKU0VSI1NBVUxTI0hFRSNJU09CQVJTCiMjWUVNRU4jI0FFUiMjTkFIVU0jIwpBRlJJRU5EI0FHRSNESURTTyNVTkEKTUFJTkUjRUZMQVQjRU5PUyNGUk9NCkJDREUjVFJJT1MjI1RBVyNOQURJQQpFVEUjU0FCUkFTI01BSSNISVJFUlMKUk9TRVRUQSNGSVJFQ1JFRUsjUkVTCiMjQVJSQVlTIyNJU0gjUExPUCMjIwojQUdSTyMjUEFSQ1MjQk9JTE9WRVIKVEVBI0JFTExCT09LQU5EQ0FORExFCkFSSSNFTlRBSUwjSVJBRSNTQ0FMRApKT04jI0VTVEVFI1RSSVMjI0VZRVM="},{"title":"2/2/98 HOUSEHOLD HELP","author":"by Rich Norris, edited by Stanley Newman","date":"1998-02-02","grid":"TE9HSUMjQ1VNI1RFU0xBCkFSVUJBI1JOQSNJTkNBUwpNRVRFUk1BSUQjTUFSWVMKIyMjVFdPU1RFUCNCRUxBClBBUiNBU0gjUkFJTFdBWQpBR0hBU1QjSkVSS0VEIyMKVEVFVEgjUVVBS0UjUk9ECklOVE8jRlVORFMjUklQRQpPVFQjTEVBS1kjUkFWRU4KIyNCT1ZBUlkjR09GRVJTClRPVVJJU1QjQUlNI1JBRQpBTFRJI1RFQVJHQVMjIyMKTUlMRVMjUk9CSU5DT09LCkVWRU5UI0VOTyNDQVJQSQpEQVJUUyNERVIjRVJSRUQ="},{"title":"2/3/98 GET LOST!","author":"by Patrick Jordan, edited by Stanley Newman","date":"1998-02-03","grid":"QkxJTVAjQ0hFRiNBU1BTCkFVRElPI1JBVkkjUkhFQQpTUExJVExFVkVMI0dPTkcKS0VZI0hBVEUjVFJZT05FCiMjI09PWkUjU0hFTEYjIwpXQUdHTFkjQ0hJU0VMRUQKQURPUkUjUVVJRVQjWUFZCkxJRkUjVFVCRVIjQVBTRQpMRU8jUFJJRUQjQlJJRVIKU1VSRkVJVFMjQ0FNRUxTCiMjQk9MQVMjU09VUyMjIwpNRVJJVFMjSklOWCNPREUKSURPTCNTQ0FUU0lOR0VSCkxJS0UjSU9ORSNUSUxFUwpERUVEI0NPRUQjRVhFUlQ="},{"title":"2/4/98 EASY AS . . .","author":"by Randolph Ross, edited by Stanley Newman","date":"1998-02-04","grid":"RkFVTlMjSElGSVMjQ1BSCkFETUlUI0VERU1BI1JPTwpDQUJDQUxMT1dBWSNBTFMKVFJFRVRPUFMjR09CQkxFClNFUlZFUlMjQ0lWSUMjIwojIyNJTEUjUkVORUdBREUKTUFURVkjV0lERVIjS0FOCkFMQVcjVElMRUQjU0VORApBTEIjVklORVMjTUFTS1MKTUFDSElORVMjQ09MIyMjCiMjT0lOS1MjUEFMTUlTVApERUxFVEUjQUlSTElORVIKRUxMI0FSQUJDT1VOVFJZCkFNQSNHRU5FVCNTRUVUTwpOT1IjRVJBVE8jS09SQU4="},{"title":"2/5/98 ALL-STAR GAME","author":"by Sally R. Stein, edited by Stanley Newman","date":"1998-02-05","grid":"VEFTUyNKVVNUI1NDUkFQCkFCSUUjSUdMVSNIT09IQQpURVhBU0ZMQUdTWU1CT0wKQUxPSEEjSUdPUiNNRVRFCiMjI09HUkUjRk9DSSMjIwpBRkFSI0FST1cjQVRUSUMKU0FNU09OI1BBSVIjRVJBClNVUEVSQlBFUkZPUk1FUgpFTEwjRFlFUiNFTEFQU0UKU1RZTkUjR0FURSNJVFRZCiMjI0FSQUIjQUxBTiMjIwpBUEVUI0NPSUwjRE9PUlMKTU9WSUVSQVRFUlNVTklUCk9MSVZFI1JPU0UjVEFDTwpLQUxFTCNEUkVEI1NOT1c="},{"title":"2/6/98 TOM SWIFTIES","author":"by Bob Lubbers, edited by Stanley Newman","date":"1998-02-06","grid":"RkxVQiNBU0NPVFMjTFNUClJBVEEjTE9PS0FUI0lURQpJTUFERUFTUEFSRSNMRUQKIyMjQkFOI1NQQU5HTEVECkFSQk9SI0xFSSNEQUlMWQpDQUxZUFNPIyNUSFJFRVMKRU5BIyNLRUVTSEFOIyMjCiNUSElTSVNUSEVMSUZFIwojIyNUT1BTRUVEIyNPUkUKQUJZU01TIyNMQUJFTExFCkNSRU1FI0FMTCNPUkRFUgpSRVNFVFRMRSNPUkEjIyMKT05TI0lNSU1QUkVTU0VEClNURSNNQU5VRUwjRUxMRQpTU1MjRU5FUkdZI0RPTUU="},{"title":"2/7/98 SATURDAY STUMPER","author":"by Richard Silvestri, edited by Stanley Newman","date":"1998-02-07","grid":"QU1FUklDQU4jI0NBQk9UClBJWElMQVRFRCNBTEVQSApQUkVTRU5URVIjQ09WRVIKTEFURVgjQURBI09ORU5PCkVHRVIjUElTTU8jR1JFVwpTRVIjRkFOVEFJTCNBWUUKIyMjVklSRU8jTEFOR0VSCkdSQUlORUQjU0NSRUVEUwpMRVNTRU4jU0hBVkUjIyMKSUZTI1NUQU1JTkEjTVNUClNVRVQjU1RFUFMjQ09QUwpTRVJJTyNFTFMjRE9ESUUKQUxUQVIjQUxJTkVNRU5UCkRFRVJFI01FRElDSU5FUwpFRERBUyMjUkVMT0NBVEU="},{"title":"2/8/98 MIRACLES: As inspired by the book of John","author":"by Randall J. Hartman, edited by Stanley Newman","date":"1998-02-08","grid":"TEFTVCNFQk9MQSNET0dTI1NIQUxMCk9TSEEjTFVDQVMjRUNSVSNUSUJJQQpUSElDS0VSVEhBTkNIQVJET05OQVkKU0VQVEVNQkVSI0FJUlMjQU5HRVJTCiMjIyNURVNUI1JJREVTI1RJRVJTIwpBQ1RJT04jI0dJVkUjI01BRSMjIyMKQ0hJQU5USVVOREVSVEhFQlJJREdFClRPUk1FI1NQQVMjI0VBUkwjTUVSVgpIVUUjI1BFU1QjVEVNUExFI1BMRUEKIyMjREVFUkUjVFJBUCMjI1JVTEVECkNBQkVSTkVUU0FVVklHTk9OR0FURQpBUkFCUyMjI1BVQ0UjUk9EQU4jIyMKUk9TQSNCRU1VU0UjTUFURSMjWkFHCkVNSVIjT0RPUiMjU0FCVSNTQ1VMTApXQUxLSU5HT05BU1RJU1BVTUFOVEUKIyMjI0NVRSMjSUNBTiMjTk9USU9OCiNMQVZFUyNNQVJSWSNSQUNLIyMjIwpTRU5JTEUjQUNMVSNCVVJMRVNRVUUKQ0hJTkVTRUNIQUJMSVNUT1JUVVJFCk9BU0VTI1RIRU4jUE9TRVMjTEFJUgpUUkVTUyNDT0RFI1NUT0xFI09SU08="},{"title":"2/9/98 INEDIBLES","author":"by Lee Weaver, edited by Stanley Newman","date":"1998-02-09","grid":"V0VCUyNJUk1BIyNDQVJQCkFMQUkjUkVBTE0jT01PTwpSQU5HI0tBUk1BI05PVEUKRUxBTkQjUEVBSkFDS0VUCiMjTkVFRFMjI09MRSMjIwpORUFURVIjSEVST0lDUyMKRVNTI1JVTU9SI0VUSEVSClNURVcjTUlOT1IjU09UTwpURUFSUyNNRVNBUyNQVEEKI1NURU1NRUQjSEVOU09OCiMjI0NVRSMjQVNTRVQjIwpNSUxLR0xBU1MjU1dJU0gKT0RFQSNFUlVQVCNFQ0hPCk9MRUcjRUVSSUUjU0tJUApUWUtFIyNTRUNUI1RTUFM="},{"title":"2/10/98 DOWN UNDER","author":"by Rich Norris, edited by Stanley Newman","date":"1998-02-10","grid":"T1RIRVIjUlVERVIjQVRNCkNIT1NFI0lSSVNII0xJRQpIT0xMT1dWSUNUT1JJRVMKU1VFI1BPSVNFIyNBTkRTCiMjQ1JFTUUjREVBREVZRQpTQ0FOTkVSUyNCSUFTRUQKSE9SUyNOQVQjQlJSIyMjCkVORCMjI1NBVCMjI1BJUAojIyNQSVUjUk9XI0JJS0UKQ0FSSU5HI1JPQURTVEVSCkhFQVZFSE8jTElSQVMjIwpBUk5PIyNQQVNUQSNUQ1UKTEFTVERJVENIRUZGT1JUCkVUTyNBRklSRSNURVBFRQpURU0jUkFDRUQjWUVTRVM="},{"title":"2/11/98 BEASTLY FILMS","author":"by Bob Lubbers, edited by Stanley Newman","date":"1998-02-11","grid":"RVBBI0JJR09UI1NXT1JFClRBTSNPTkFJUiNQT0xBUgpDUk9DT0RJTEVEVU5ERUUKSE9SSVpPTiNORVJEUyMjCkVMSVRFIyNDRFMjRUFSUwpSRVMjI0FMQVMjT1JMT04KU0VUUyNOT1IjU09GVEVSCiMjI0NBVEJBTExPVSMjIwpSQVNIRVMjTUVBI0xFU1MKT1RURVIjU0VOVCMjTEVUCkJFQUQjQVRMIyNNQUxUQQojI0JVRU5PI09SQVRJT04KQlVMTERPR0RSVU1NT05ECkFORUVEI0lPTklBI1RFRQpTQVNTWSNFVE9OUyNUU0U="},{"title":"2/12/98 UP IN THE AIR","author":"by Frank Longo, edited by Stanley Newman","date":"1998-02-12","grid":"WkVTVCNTUEVEI1NDUkFQCkFMVE8jSUxTQSNDSFVURQpQTE9XI0dVQU0jUklQRVIKI1NQUklOR0lOR0FMRUFLCiMjI09CSSMjI09XTEVUUwpKVU1QSU5HQkVBTlMjIyMKQVJJRVMjUkFORFkjQ0FNCk1BVFMjUkFJTFMjQ09MQQpCTFQjTU9JUkEjQUlEQU4KIyMjQk9VTkRJTkdNQUlOCkZFTElQRSMjI09SQSMjIwpMRUFQSU5HTElaQVJEUyMKQUxCRUUjUklUWiNSQU5ECk1FQURTI09SRUwjT0xJTwpFUk5TVCNHQU1FI05JUFM="},{"title":"2/13/98 AUTO SUGGESTION","author":"by Patrick Jordan, edited by Stanley Newman","date":"1998-02-13","grid":"V1JBUFMjSEFORCMjUEFMClJFQ0FQI0VSSUUjVElUTwpJQU1DQUxMSU5HTVlDQVIKVFJFSyNPTEQjUk9OQUxECiMjIyNRVU8jR0VORVNFUwpESVNDVVMjRkxBSyMjIyMKRU5OVUkjQk9PUyNKT0lOCkZMQVRURVJZQkVDQVVTRQpUQVBFI1NBTEUjQUlTTEUKIyMjI0FQU0UjVElMVEVECkJFU1RJUlMjTE9OIyMjIwpFTEFJTkUjV0lHI0NMVUIKSVRHRVRTTUVOT1dIRVJFCkdPRVMjU0FWRSNQSU5HUwpFTlMjI09YRU4jTUFaRVM="},{"title":"2/14/98 SATURDAY STUMPER","author":"by Ed Julius, edited by Stanley Newman","date":"1998-02-14","grid":"I01PU0NPVyNSRUJVRkYjCkRFVk9MVkUjSUJFUklBTgpBTUVMSUFTI01PRElTVEUKUk9SRU0jI0ZFTkQjU0FXCktJU1NBQkxFI0RFRklMRQpBUkUjVEVBUlMjRE9MRVMKU1NFI0lOVVJFRCNCRVNUCiMjI0FDQ1JFRElUUyMjIwpJTEVTI0hFVEVSTyNBU1AKQ0VBU0UjTk9SR0UjUEVBCktBUkVFTSNVU0VEQ0FSUwpJUkEjWVVSVCMjQUlSRVMKRU5DTE9TRSNQRU5UQU5FClJFSElSRVMjUkVDRURFUwojREVURVNUI1NFRURFUiM="},{"title":"2/15/98 FLOOR SHOW: Featuring nine answers with something in common","author":"by Scott Marley, edited by Stanley Newman","date":"1998-02-15","grid":"SklHUyMjU0lHTiMjTEVJUyNOQUdTCkFGQVIjVFVSTklQI0VUQ0gjT0xMQQpDSFJPTU9QQVBFUiNTVEVBTU9QRU4KS0VHI0FNRU4jQ0VBU0UjTEVOU0VTCiMjQURMRVIjRkVFTCMjU0xBVCMjIwpET05PVCMjQ09TTU9QT0xJVElDQUwKT05UTyNQQUFSI1BFQVJZI1NNT0tFCk5FVVIjQVNQT1JUI1NBRkUjRU1JVApHUkFNT1BIT05FIyNTVE9XUyNFTVMKIyMjQVdBWSNDQVRTI0VYRUMjT0JJCllFTlRMIyNNRU1PUEFEIyNSVU5PTgpPUk8jRUFUQSNTUFVEI0FESU4jIyMKVU5JI1RXRVJQIyNNQUdOVU1PUFVTCkRBREEjTEFLRSNSRU1PVEUjV0VTVApJTkVSVCNQVVJFRSNBQkVUI05BREEKR0lBQ09NT1BVQ0NJTkkjI0RFQ0FZCiMjI0FUSVQjI0hBRlQjRElPREUjIwpESUFERU0jRlJPU1QjTUVOVSNQSEQKRVNLSU1PUElFI1RIRVJNT1BZTEFFCkVMSUEjU09GQSNTSU1FT04jRUFSTgpQRU5OI0FQRUQjI1NVRFMjI1NOSVQ="},{"title":"2/16/98 HANDYMAN'S SPECIAL","author":"by Rich Norris, edited by Stanley Newman","date":"1998-02-16","grid":"Q0FWRSNTQUxFUyNTSEVBCkFMQVMjUFJPWFkjRUFSUApGSUxFRk9MREVSI0FNSUUKRVZFI0ZSRUVSI0FDTUVTClNFVFRMRVMjQ0FOT0UjIwojIyNIQVMjR0lGVFdSQVAKQkVGSVQjQ0FTVEUjT0JJCkFHSU4jSE9NRVMjWVVMRQpCQVIjRFVORVMjQ09URVMKQURFUVVBQ1kjQU9LIyMjCiMjRFVOQ0UjRUxCT1dFRApERVJFSyNSQVRJTyNPVkEKRUxJQSNPTlRIRUxFVkVMCkFJTFMjSEVNRU4jUkVORQpSRUxZI09ET1JTI0FOVFM="},{"title":"2/17/98 SUPER EGOS","author":"by Patrick Jordan, edited by Stanley Newman","date":"1998-02-17","grid":"Q09URVMjU0hBTVMjREFECk9SQVRFI0NBTk9FI0lSQQpCUlVDRUJBTk5FUiNDSUkKIyMjI0RFTlNFI0lOS0VSClNPUEhJRVMjI0dBTkdMWQpRVUVVRVMjQ0hPTEVSIyMKVVRURVIjSk9VUlMjQUlSCklSRVMjS0lSQlkjRFlORQpERVIjUk9WRVMjTUlTVFMKIyNQSUVDRVMjQ0FWT1JUCkJMQU5DSCMjQkFOQU5BUwpMT1JORSNDT09QVCMjIyMKQVNLI0RJQU5BUFJJTkNFClpFRSNFRElUUyNBTU9VUgpFUlIjRE9OT1QjUEFEUkU="},{"title":"2/18/98 BUSY BEES","author":"by Bob Lubbers, edited by Stanley Newman","date":"1998-02-18","grid":"RVBJQyNTUEFDRUsjVVNICkxBUkEjTUFOSUxBI05DTwpGTEFCQkVSR0FTVCNXSE8KIyMjQVJFI0VOQU1PUkVECkFHQU5BI1BSTyNBREFNRQpDQVJBTUJBIyNTTklQRUQKRVJBIyNJTlRFTkRTIyMjCiNCTEFCQkVSTU9VVEhTIwojIyNISUxMSUVSIyNPQVQKQ0FST0xFIyNSRVNUT1JFCkFUT0xMI0hBWSNMRVRJTgpHT09EWUVBUiNFQVQjIyMKRU5TI0pBQkJFUldPQ0tZClJFVCNPUklPTlMjTklMRQpTU1MjRU5UUkVFI1NBTVM="},{"title":"2/19/98 STRINGS ATTACHED","author":"by Frank Longo, edited by Stanley Newman","date":"1998-02-19","grid":"TUFEUkFTI0FSR08jV0FHCkFURUFTRSNQRUFSI0VSQQpIQVJQU0lDSE9SRCNBTEkKIyMjVEVOTklTUkFDS0VUCkFSUCNTRU5EIyNJUkVORQpEVVJFU1MjI0lHTk9SRUQKU1RPTEUjREFOQSMjIyMjCiMjRklTSElOR1BPTEUjIwojIyMjI0FOVEUjTklYRVMKQk9BVElORyMjU1RFQUxTCkFUVElDIyNTSEFII01PVwpST0xMRVJTS0FURVMjIyMKTE9BI0NFTEVSWVNUQUxLCkVMUyNBTkVXI1JFQURFUgpZRVQjUEVXUyNTVFJBVEE="},{"title":"2/20/98 ACTING FUEL-ISH","author":"by Fred Piscop, edited by Stanley Newman","date":"1998-02-20","grid":"SE9OT1IjR0hJQSNDT0FUCkFNQU5BI1JPTlMjT1VDSApMQVRFTiNJTkNII0FUVEEKU05FQUtZUEVBVCNMSU9OCiMjIyNMRVMjI1JJUEVOIwpCUkVXRVIjQkVBTk8jIyMKUkVTT0QjUE9MWUdSQVBICklOU08jV0lTRVMjVFJFRQpHT09EU0VOU0UjTEVBUk4KIyMjU1VMS1kjQUlSQlVTCiNNRVRFUyMjQlVOIyMjIwpQQVNUI0hBWkFSREFHQVMKUlVTSCNNRUVUI0lOQU5FCklERU8jQVJOTyNFVFVERQpNRU5VI05PT04jREVMWVM="},{"title":"2/21/98 SATURDAY STUMPER","author":"by Bill Landers, edited by Stanley Newman","date":"1998-02-21","grid":"Q0FQUCNTUEFERSNFUVVJCk9SQUwjUEVMRUcjU1VOUwpMQVdBQklESU5HI1BBTEwKQUJTVElORU5UI0hFUlZFCiMjI0FET1NFI1NBUkEjIwpKSUIjRUZUI1NUUkFOR0UKSVJBUyNGUkVRVUVOVEVSCkhBTEVTI0lPVSNTVElORwpBUVVBUExBTkVTI09ORU8KRElTREFJTiNFQ08jRVNTCiMjVFJJUCNDWkFSUyMjIwpBUFJPTiNXSEVSRUlOVE8KRkxBTSNTRUFCSVNDVUlUClJPREUjRUFST0YjS05FVwpPV0VTI1BST1hZI09TU08="},{"title":"2/22/98 T SQUARES: Differences that a letter makes","author":"by Shirley Soloway, edited by Stanley Newman","date":"1998-02-22","grid":"UklTRSNHQUxBUyMjTkVSTyNUTlQjCk9SQUwjRUxFTkEjU09OQVIjUk9PTQpTSU5HSU5JTlRIRVRSQUlOI0FMVEEKRVNUQVRFIyNIQVdTI0JTQSNTVEFSClNIT1JUUyMjRVJFI0NMQU1TSEVMTAojIyNUUklHQU1BUk9MRSNFU0UjIyMKSURBI1VTRUQjI1NUQSNTTkFSRUQjCkRBTlRFI0FERVMjVFJBSVQjT0xBTgpFUk5FI1RSVU1QUk9BU1QjQUZJUkUKU0VFTlRPI1BVUkUjI0hFQURCQU5ECiMjI1RBVEEjI1lBUCMjU0hFQSMjIwpTV0VFVEVTVCMjTEFTUyNFTkNBU0UKSEVBUlMjVEFSVE1VU0VVTSNPTEFZCkVBU1QjTklNT1kjTEVBUiNVTlRJRQojUkVBREVSI0FSRSMjT0FTVCNPTEQKIyMjSURPI1RSQUNLT0ZMQU1CIyMjClZJR05FVFRFUyNMSU4jI1RPRUNBUApFTEVNI1lJTiNMQU1FIyNFU0NBUEUKUk9URSNQTEFORVRPRlRIRVRBUEVTCkFOT04jRUROQVMjTk9MQU4jTUVBVAojQU5UI1NFVEgjI09SQ0hTI0VSUlM="},{"title":"2/23/98 IN THE CARDS","author":"by Lee Weaver, edited by Stanley Newman","date":"1998-02-23","grid":"QUxNQSMjSUNFUiNXQURTCldPT0YjQlJPS0UjQVRPUApGT09UQlJJREdFI1JFTkUKVVNFI09JU0UjTU9BTkVECkxFREdFUyNTVEVSTiMjIwojIyNJUktTI0VST0RJTkcKU0tJTlMjT0xFRyNQTEVBCkFOREEjR1JBVEUjRUxBTApTRUVOI0FSQ0gjUEFTVEEKU1dBRERMRSNFUElDIyMjCiMjI1RFTExBI0VMRUNUUwpHSUdPTE8jU0hFQSNBV0UKQUdJTiNQT0tFUkZBQ0VECllPR0kjRVdFUlMjU1RBRwpFUklDI1JFRFMjI1BJS0U="},{"title":"2/24/98 BED TIME","author":"by Rich Norris, edited by Stanley Newman","date":"1998-02-24","grid":"REVDQUYjQUxFQyNUU0FSCk9MQU5EI1BVTEwjQUxJQQpPQlNFUlZBVElPTlBPU1QKUkFIIyNJUkUjU1VQUExFCiMjQkFEQVQjR0VORVNFUwpTSE9WRUwjUE9VTkQjIyMKU0FYRVMjSEVMUCMjS0VBClRIRVJJVEVPRlNQUklORwpTQVMjI0FXTlMjTElCWUEKIyMjQ0FQRVMjQ0FWSUFSClJFTEFYRUQjSkFORVQjIwpFVkVORUQjRUVSIyNaRUQKTUlERExFQUdFU1BSRUFEClVUSUwjQ0xBUCNBT1JUQQpTQU5FI0tJRFMjTUVTU1k="},{"title":"2/25/98 CELEBRITY TRIVIA","author":"by S.E. Wilkinson, edited by Stanley Newman","date":"1998-02-25","grid":"UkFKQUgjSkFLRSNCTE9CCk9CRVNFI0VXRVIjWU9LTwpBTEFJTiNST1lST0dFUlMKREVOI0JBUktTI0RPV0FICiMjSEVBUllFI1RPTiMjIwpDSEFOTkVMI0FSUkVTVFMKSEVSVkUjRUxWRVMjT09ICkVMTFkjVFdFQUsjQ1VQTwpDSU8jR09JTkcjTk9QQVIKS09XVE9XUyNBTkFMWVpFCiMjI09SUyNXUklTVFMjIwpTUEFDRSNIQUROVCNBS0EKRUxUT05KT0hOI0FETElCCkxPT00jT0JPRSNTRUVUTwpMWU1FI0JPT1IjRVNTRVg="},{"title":"2/26/98 WARREN PIECE","author":"by Patrick Jordan, edited by Stanley Newman","date":"1998-02-26","grid":"RUxTQSNIQURUTyNFV0VTClFVSVQjQUlSVVAjTEFDRQpVUkdFI1NMQVRFI0FTSEUKQUlNI1RIRUJVTk5ZSE9QCkxFQVNIRUQjI1dPTiMjIwojIyNJUlMjU1dJVkVMRUQKQU1JTk8jU0tJRCMjQVBFCkhBUkVCUkFJTkVESURFQQpFTEsjI0VLRUQjRUJTRU4KTUVTU0FHRVMjRVBBIyMjCiMjI0FMQSMjRU5UUlVTVApSQUJCSVRQVU5DSCNTQVcKT1JBTCNUT05UTyNKQU5FCk1JTkUjQVNURVIjQUdFRQpQQURTI1NIT1JFI0JFUlQ="},{"title":"2/27/98 NATIVE INTELLIGENCE","author":"by Bob Lubbers, edited by Stanley Newman","date":"1998-02-27","grid":"U0NBTEUjI1RST1QjVE9OCkVBVElOI1BJQU5PI0hVRQpHUkFOREtFTllBTiNBU1MKIyMjVE9BVCMjREVCSVRTCiNTVFkjQkVUI0FEVUIjIwpPSE8jVFVSUkVUI05SQSMKUkVOVEFMI0VNRVJHRU5UClJFR0FMI1NBVCNURUFTRQpTTkFUQ0hFRCNTRUVLRVIKI0FOVCNPV0xFVFMjRUxNCiMjQ09TVCNFREUjTVJTIwpTQ0hPT0wjI1dXSUkjIyMKVEFFI0ZJTk5JU0hMSU5FCk9SRSNBTklPTiNPTERFTgpXT0sjUkVORCMjUEVBVFM="},{"title":"2/28/98 SATURDAY STUMPER","author":"by Frank Longo, edited by Stanley Newman","date":"1998-02-28","grid":"SkFERVMjUk9MRSNJTUlOCkFCRUxMI0VNSUwjQkVCRQpJU1NVRSNEQVZJI09ORVMKQUNJRFdBU0hFRCNTT1JUCkxPUkUjVEhBTkVTI1RJRQpBTkUjRVJBUyMjSURUQUcKSURFQU1FTiNKQVJSSU5HCiMjI0JBU0sjQVJFQSMjIwpUV09CSVRTI0xJTkdPRVMKUkFWRUwjI1NBU1MjVU5PCkVSRSNTRVJBUEUjT1RUTwpFVFJFI0pBTUVTQlJPV04KVElFUiNFVE9OI0VGRklFCk9NQVIjQ0lBTyNSRUlOUwpQRVRTI1RPTlMjTU9URVQ="},{"title":"3/1/98 APT ADVERBS: Otherwise known as Tom Swifties","author":"by Mel Rosen, edited by Stanley Newman","date":"1998-03-01","grid":"QkxFVyNUT1JDSCNBUEVUIyNMRUFQClJBUkEjRU5FUk8jVkVSQSNTT0xWRQpJV1JJVEVTUE9OU09SU0pJTkdMRVMKRU5TTEFWRVMjT1BDSVQjU0FHRVNUCiMjIyNTRVQjRlJFRSMjI1RSSSMjIwpQTEVBU0VTRUxFQ1RNUkNMRUFWRVIKUkVWVUUjI01BUksjT0FSRUQjSUlJCkFOQVQjTUlNSSMjI1BJQSMjRVROQQpNWURPR0lTQUxFQVNFRE1PTkdSRUwKU0FFI0FTSSNTQUxBREUjUE9HTyMjCiMjI0FNVVNFI1ZBTCNESVRUWSMjIwojI1NBTVMjQVZFUlNFI1ZJQSNCSVQKTUlDSEFFTFNBU01BUlRBQ1RSRVNTCkFQUlMjI09FTiMjI09XTlMjRUxMQQpTU0UjTUFDTEUjQU5ESSMjTkFJQUQKSE9XUEFSSVNTVFJFRVRTQk9SRU1FCiMjI0FHRSMjI0VHT1MjRUVMIyMjIwpGQVJJTkEjT1JMT04jQU5UTEVSRUQKSUNBTlVTRVNBTFRBTkRPUkVHQU5PCk5PVkVNI1NMSU0jVElBUkEjSUdPVApTUEVEIyNQT05FI0VTU0FZI1NBU0U="},{"title":"3/2/98 BRIDAL WEAR","author":"by Rich Norris, edited by Stanley Newman","date":"1998-03-02","grid":"RkFaRSMjVEFNUCNCQUxNCk9YRU4jU0FGRVMjSVNFRQpPTERDT1VOVFJZI0tBTlQKTEVTI01BRCNFQ0xJUFNFCiMjI1NFVkUjI0hBTiMjIwpORVdBR0VNVVNJQ0lBTlMKQU5JVEEjI1BBQ0UjRE9UCkJFREUjUE9QRVMjQUxWQQpPUkUjSkFERSMjRkxJRVIKQk9SUk9XRURUUk9VQkxFCiMjI0lOTiMjSEFSTSMjIwpTVE9QR0FQI0VTQyNBUEUKQVJMTyNCTFVFUEVOQ0lMClJFRUYjTEFOTlkjQUxFUwpBU09GI0VZRUQjI1BVUkU="},{"title":"3/3/98 IN A HURRY","author":"by Fred Piscop, edited by Stanley Newman","date":"1998-03-03","grid":"Q0FSIyNTT0xEI1RBTVBTCkFET1MjVFJFRSNPUEFSVApGQVNUQlJFQUsjTUVESUEKRU5TSUxFI1JFRiNNRUVUClNPSVJFRSMjI0lSRSMjIwojIyNSQVBJRFRSQU5TSVQKQkFERVIjUk9SRU0jSURPClVTRUQjU0FURUQjU0xPQgpTRVcjUlVCRU4jU0lMTFkKSEFTVFlQVURESU5HIyMjCiMjI1dFRSMjI0NBTkFEQQpNQUxJI1JBSCNFUkFTRUQKQVJFTlQjUVVJQ0tMSU1FClJJTkdPI1VSU0EjU0FVTApFQVRFTiNBVE9QIyNOUkE="},{"title":"3/4/98 TOP-10 TUNES","author":"by George Lippold, edited by Stanley Newman","date":"1998-03-04","grid":"UkFOSSNJTVBFTCNTQ0FSCk9YRU4jTU9PTEEjVE9STwpCTEFDS01BR0lDV09NQU4KU0VUI0FVVE8jRVJSQVRBCiMjI0FOTlMjRElFTSMjIwpBSE9SU0UjUEVOTiNHQlMKTEVOREEjTU9SVCNEUk9QCkdSRUVOVEFNQk9VUklORQpFVkFOI0FSTVkjR0lOWkEKUkVNI09LSUUjQ0FORE9SCiMjI0lSRVMjQkFOSyMjIwpPREVTU0EjR0lSRCNET1cKWUVMTE9XU1VCTUFSSU5FCkxBTUUjQVRBTEUjQU5UUwpTTE9UI1lFTUVOI0ZPT1Q="},{"title":"3/5/98 DANG ME","author":"by Bob Lubbers, edited by Stanley Newman","date":"1998-03-05","grid":"QUJJRSNFU1RFI1BIT05FClJFRkxFQ1RFRCNDT1JBTApDTElGRkhBTkcjU0xBTkcKIyMjI1RPUlRFUyNJTkNBCk9OQkFTRSMjI0NPTkdFUgpTT09OI1NIRUJBTkcjIyMKQ0xBTkcjT1ZJTkUjU1RVCkFUUkVFI1JJRCNOSUNFUgpSRUQjVEFTVEUjRFJBTkcKIyMjTVVTVEFORyNBTEVFCkFDQ0VQVCMjI05PTkVUUwpTQVJBI0FSQUdPTiMjIyMKVFJFTkQjQk9PTUVSQU5HCkVMQVRFI0lOREVMSUJMRQpSQU1PTiNTRVNTI1BFRU4="},{"title":"3/6/98 NICE COMEBACK","author":"by Patrick Jordan, edited by Stanley Newman","date":"1998-03-06","grid":"QkFCQVIjQ09ERSNBQ01FCkxJRUdFI09OVVMjQk9BUwpJRFJPVkVNWURPR05VVFMKUEFORyNWRVgjVEVFUEVFCiMjIyNWRVQjUEVFUkVTUwpNT0hBSVIjS0lSSyMjIyMKQUxBTU8jQU5USSNTQVJBCklEWUVMTEZFVENIVEhFTgpMRVNTI0FMQVMjRUFTRUQKIyMjI0FDQUQjUEFST0RZCkNBQklORVQjUk9EIyMjIwpVU1VSRVIjSk9FI0NMSU8KVEhST1dBQk9PTUVSQU5HClRPUk4jVEFCUyNSQVpPUgpPVE9TI0VBU1QjU1RZTkU="},{"title":"3/7/98 SATURDAY STUMPER","author":"by Ed Julius, edited by Stanley Newman","date":"1998-03-07","grid":"I0NBR0VEIyMjU0xBUFMjCk1BTEFSSUEjUEhPTklDUwpBUkFCSUFOI1JPQURNQVAKTkFCI0NMQVJJT04jRVJBCk9NQVIjU1RFTVMjU05JVApSRU1VUyNPVkEjTUVURVMKI0xBU0FMTEUjVEVOT1IjCiMjI1RSRUVUT0FEUyMjIwojSlVMSUEjTUFOSUFDUyMKR0VORVMjTUVSI0FUSE9TCkFXQVIjREVOU0UjRUVMWQpNRVcjQk9BVE1BTiNNQUMKRUxBVElPTiNBVkFSSUNFClNFUlZFUlMjTkVNRVNFUwojUkVBUlMjIyNTRUNUUyM="},{"title":"3/8/98 FROM STEM TO STERN: A shipshape challenge","author":"by Randolph Ross, edited by Stanley Newman","date":"1998-03-08","grid":"QUxTT1BTIyNBR09HTyNTUEVBS09GCkxFQVBFUiNQUk9UT04jQUlSREFURQpMT1dFUlNUSEVCT09NI0NBUkFNSUEKQVNTTlMjT1NURSNERVNLIyNNQVNUCiMjI0xJUE8jRUxTQSNFU1BZIyMjIwpMQVJJQVRTIyNPUkxPUCNSRUNUTyMKT0RPTk5FTEwjV0FMS1RIRVBMQU5LClZJQ0UjUk9VRSMjI0xFSVMjQUtJTgpFRUsjRE9XTlRIRUhBVENII1JFTlQKQVVUUkUjI1RSQURFI1NLSVBJVCMjCiNTSE9VTEQjRURJQ1QjU1BBVEhFIwojI0VTVEVFTSNBVEhPUyMjV1lFVEgKU09CRSNTUElOVEhFV0hFRUwjSE9PClNPT1QjT1RUTyMjI1NPWVMjSEVJUgpXSEFUU1RIRVBPT1AjUkVTUEVMTFMKI1NUQVNII1JFVlVFIyNXRUxMTUVUCiMjIyNUT01FI0VUQUwjQVhFTCMjIwpMVU1QIyNBREFSI1NVRVMjQUJBU0UKQVZJQVRPUiNDTEVBUlRIRURFQ0tTClBFVFJPQ0sjVEFOTkVEI0dFTlJFUwpQQVRFTlRTI1NQQVRTIyNPUlRFR0E="},{"title":"3/9/98 A MODEST PROPOSAL","author":"by Peter Gordon, edited by Stanley Newman","date":"1998-03-09","grid":"U0NSQU0jU1BFRCNDSE9QCk9IQVJBI0hBUkkjSEFMTwpMSU5FUiNBTElFI09XRUQKRU5HQUdFTUVOVFJJTkcjCiMjIyNBWUUjI0NBUiMjIwpNQVRVUkUjUE9PSCNVTUEKT0JFU0UjV0lOSyNJTk9OClBPUFNUSEVRVUVTVElPTgpFVkVSI09QVVMjVUxUUkEKREVFI0FOVEUjVU5MRVNTCiMjI1BJRSMjQU5EIyMjIwojV0lMTFlPVU1BUlJZTUUKV0FERSNCT05BI0VJRUlPCkVMTEEjVVpJUyNTVEFJTgpCTEVEI05FVFMjU0FSSVM="},{"title":"3/10/98 THREE-RING CIRCUS","author":"by Patrick Jordan, edited by Stanley Newman","date":"1998-03-10","grid":"UEFHQU4jU1dBTiNCQVNFCkVSQVNFI0NJVEUjQU5LQQpUSUdIVFJPUEVXQUxLRVIKRUFTWSNIT0UjQ1VMTEVOCiMjIyNNRVQjQ09SU0VUIwpQQVBBWUEjVE9NQSMjIyMKRVhJU1QjS0lURSNMQVJECkVMRVBIQU5UVFJBSU5FUgpMRVNTI0JPTEEjSk9OTlkKIyMjI0FTV0UjSkFORVRTCiNNQURNRU4jVFVYIyMjIwpXQVJSRU4jU0FEI0FCQkUKSFVNQU5DQU5OT05CQUxMCkFWT1cjRVdPSyNBTEJVTQpURVJOI1NFV1MjUEVFUlM="},{"title":"3/11/98 NOT SO SMART","author":"by Fred Piscop, edited by Stanley Newman","date":"1998-03-11","grid":"Q0FTVEUjU1RFVCNDSEFQCkFMTEVOI1BPU0UjTEFOQQpURUFSUyNBREFNI09WRU4KT1hUQUlMU09VUCNEUkFUCiMjIyNMQU0jI0VUSEVSUwpNSU5DRUQjUkFESU8jIyMKT1ZFUlMjQkFTI1NQUklHCk1BTUEjI09LUyMjUE9TVApBTk9TRSNaRU4jQ0VMTE8KIyMjSEVST0QjUFVSRUVTCk5PT0RMRSMjQVRUIyMjIwpPQUhVI0JBUkJBUllBUEUKVFJBTSNFTElBI0FFR0lTClRFUk0jTElOVCNUQVJQUwpPREFZI1NBR0UjRVJBU0U="},{"title":"3/12/98 ONE TOO MANY","author":"by Chris Hulse, edited by Stanley Newman","date":"1998-03-12","grid":"RE9UUyMjUExVRyNNQUFNCk9OSVQjTUFVUkEjRVJTVApaRVJPI0FOTkFMI0FDRVMKRUxFVkVOR0FMTE9OSEFUCiMjI0VORCMjU09SVCMjIwpJRE8jQ0FUIyNQQUlSUyMKTk9XIyNUSU5BI1RNRU4jCk5JTkVURUVOV0hFRUxFUgojTkVNTyNERUxFIyNJUkUKI0dSSVRTIyNTQUQjQ0RYCiMjI05BUFMjI1RPVCMjIwpGSVZFTEVUVEVSV09SRFMKSU5PTiNBUk9NQSNQQUlMCkZESUMjUlVNTVkjQVJFQQpFWVJFI1NUQVkjI1pFU1Q="},{"title":"3/13/98 WAITING FOR A SIGN","author":"by Frank Longo, edited by Stanley Newman","date":"1998-03-13","grid":"UEVTVCNBTkFYRSNBQ0UjCkFOVEkjVVJLRUwjSE9HRwpDUkVESVRDQVJEI0FNT1IKTUFSSU5PIyNPRUQjRVRBCkFHTkVTI1RBWFJFVFVSTgpORVNTI0FSUiNTVE9QSVQKIyMjI1JCSVMjI0VMT1BFCk1BUlJJQUdFTElDRU5TRQpBTElPUyMjTkFTVCMjIyMKUkVEU0VBI0lOVCNQTFVNCkdVRVNUQk9PSyNTQU9ORQpJVEEjT09QIyNVUlNVTEEKTklCUyNERVBPU0lUSU9OClNBTEUjRVJPREUjRVNBSQojTkVXI1NBV0VEI0RBREU="},{"title":"3/14/98 SATURDAY STUMPER","author":"by Daniel R. Stark, edited by Stanley Newman","date":"1998-03-14","grid":"Q0VOVEFWTyNCSUdERUFMCk9DRUFOSUQjQVRMQU5UQQpDSEFSVEVEI05PVUdBVFMKS0lURVMjSUxLI0dBTUVTCklERVMjQVRPTkUjTk9MTwpFTlMjQ1JZV09MRiNSRUUKUkFUSEVSI1NUWUxJU1RTCiMjI0lURVIjRVNFTCMjIwpTSEFNVVNFUyNFQVNURVIKSE9EI1NUQVBMRVMjRVRFCkVNVVMjU0xPRVMjQlJBTQpSSUxFWSNJVFMjTEFSR08KUEVBTlVUUyNTRUVESUVSCkFTVE9MQVQjT05BR0VSUwpTVEVSRU9TI1JFRkVSRUU="},{"title":"3/15/98 WHAT'S FOR DESSERT?: Sweet wordplay","author":"by Shirley Soloway, edited by Stanley Newman","date":"1998-03-15","grid":"I1NBR1MjTUFJTCNSQUNFUiNFTEFOCkxPTUFOI0FTVEEjRUxBVEUjUk9MRQpBRE9CRSNUSUNLI01PUEVTI1JVREUKUEFSRkFJVFRIRUNPVVJTRSNBUEVECiMjI0VER0UjI1NBUkRJI1dBVEVSWQpTUEFTI09SREFJTlMjI1JFQkEjIyMKRUFTVEVSU1VOREFFI1BFREUjQlNDCkNSSVNQIyNFS0UjI1JVTSNFUkFUTwpURUEjT0NBTEEjUElFUEFSVElTQU4KIyMjU0NBTSMjI09GRkFSRSNTSVJFClRIRVRIUkVFTU9VU1NFS0VURUVSUwpIQUxPI1RSVUFOVCMjI0VWQU4jIyMKT05FQ0xBSVJEQVkjUkFSRVIjT0lMClJPQ0tZI0NPRSMjRUVMIyNTQUJSQQpOSVQjUklBUyNDT01QT1RFSVRJT04KIyMjRklOTiMjQVBFU1VJVCNURU5EClBBTklDUyNFQUdFUiMjRUNITyMjIwpFQk9OI1BVRERJTkdPTlRIRVJJVFoKUk9OQSNBTklMRSNJREVBI0FORElFCklET0wjTklORVMjTkFSQyNQRUFMRQpMRVNTI1NUQVJUI0dTT1MjU1lTVCM="},{"title":"3/16/98 AROUND THE ROOM","author":"by Rich Norris, edited by Stanley Newman","date":"1998-03-16","grid":"TUFSTEEjQkFSI1NLQVRFCkFYSU9NI09STyNDT1JBTApDTElNQklOR1RIRVdBTEwKSEVTI1VTRSNDQU5UQkUjCiMjI0VTTCMjI0xFTyMjIwpNT1BUSEVGTE9PUldJVEgKQVNJQSMjUklMRVkjR0VPClRBUFMjV0VFRFMjQUxNUwpFS0UjU0lFVEUjI0RPUEUKREFSS0VOU09ORVNET09SCiMjI0lBTiMjI1JFUyMjIwojUkFOU09NI0FMTCNPU1MKV0lORE9XRU5WRUxPUEVTCkFTVE9OI0xFSSNFUkVDVApSRUVGUyNURUQjUkVOVFM="},{"title":"3/17/98 HANDY","author":"by Bob Lubbers, edited by Stanley Newman","date":"1998-03-17","grid":"Uk9OI0FESVBPU0UjQUNUCkFNTyNTRUxFQ1RTI1JBRQpOT1IjU1dFQVRZUEFMTVMKRE9XU0UjU0xBTSNNRUVUCiMjRU9OIyMjI0lGT05MWQpMSUdIVEZJTkdFUlMjIyMKT0xJTyNFQ09MI0FUUklBClJJQSNUUkFWRUxTI0VSUgpERU5UUyNNQU5PI1NQQVQKIyMjQkFSRUtOVUNLTEVTCkJFRk9SRSMjIyNMSUkjIwpFQVJOI05BTkEjT1NDQVIKR1JFRU5USFVNQlMjQVJBCkFMRSNSRVNUT1JFI1RFTgpUWVMjQ1JPU1NBVCNFQVQ="},{"title":"3/18/98 GEARING UP","author":"by Patrick Jordan, edited by Stanley Newman","date":"1998-03-18","grid":"QURBUyNPREVUUyNBQ01FCkdJUkwjQ1VSSUUjVEhPUgpBUkdPI0VMSVRFI1RVQkEKTkVVVFJBTENPUk5FUiMjCkFDRVRPTkUjIyNBU0NPVAojVFJFWSNEUklWRVRIUlUKIyMjREFEI1VLRSNTRUVNCkFUTSNMSU9ORVNTI1NPUwpTSE9PI0FSSSNURUUjIyMKUEFSS1BMQUNFI0dOQVQjClNUQVRFIyMjREFORElFUwojI0xPV0JST1dDT01FRFkKQ1JJQiNMQU1BUiNPTElOCk9PWkUjQUNBUkUjU0xVRwpET0VSI0JFTkRTI1RPTUU="},{"title":"3/19/98 DOCTOR OF LETTERS","author":"by Jon Delfin, edited by Stanley Newman","date":"1998-03-19","grid":"QU5OVUwjT05UTyNTQUtFClNDT05FI1JVSFIjQ0NJVgpQQVVMRFVETEVZV0hJVEUKI0FORSNQRUxFI0VJREVSCiMjI0FMVEEjQUJFUyMjIwpDQVJESU9MT0dZI1RJREUKQU1PRUJBI0dMRU4jTlJBCk1VRERZI1NFRSNBRkxBVApFU0UjQUJMRSNTQ1JBUEUKTEVPUyNFSVNFTkhPV0VSCiMjI0NIQVAjTElPTiMjIwpTVEFSRSNQRUFUI1RBTyMKVEhSRUVDRU5UU1RBTVBTClVSR0UjQVJORSNBR0FURQpCVU9OI0RZRUQjTUVOU0E="},{"title":"3/20/98 FRUIT MIX","author":"by A.J. Santora, edited by Stanley Newman","date":"1998-03-20","grid":"QkFTSEVEI09QSUUjTU9FCklNUEVERSNXSE9BI0VSTgpDVVJSQU5UTkVXUyNESVQKRUxJI01JUiNOQVRUSUVSClBFVEUjTUlMTyNTSEFORQpTVEVBTSMjRU1PI0VUVEEKIyMjUkVHSU1FTlQjRUFUClBFUlNJTU1PTklPVVNMWQpJTkUjUkVNTkFOVFMjIyMKUEFURSNORUQjI1NFTE1BCkVNSVRTI0RFTlMjUkVFTApMT1JFTEVJI0FIQSNBTkEKSVJFI09SQU5HRU1FTlRTCk5FRSNUSVRPI0JBUlRPSwpFRFMjSEVFRCNBTkdPUkE="},{"title":"3/21/98 SATURDAY STUMPER","author":"by Raymond Hamel, edited by Stanley Newman","date":"1998-03-21","grid":"UklWRVMjU0xJUCNLRUVOCk9WT0xPI0NPREUjSEFWRQpNSUxLQ0FSVE9OI1lWRVMKUEVURVJQQVVMUlVCRU5TClNTRSNBTFBTI09ORSMjIwojIyNTVElQRSNEVVJFU1MKVEFTVEVURVNUIyMjTUFFCkFST1VTRVIjT0NDTFVERQpMRUEjIyNTT1JFTE9TRVIKQ0FSREVEI1RFTEVYIyMjCiMjI0VWRSNUQUxBI0VTQQpMRU9OQVJET0RBVklOQ0kKT1lFWiNNRU1PUkFORFVNCkVSSUUjQUxBUiNHT09ERQpCRUxMI0xFTlMjRVJOSUU="},{"title":"3/22/98 TAKING CHANCES: A number of ways to lay it on the line","author":"by Bob Lubbers, edited by Stanley Newman","date":"1998-03-22","grid":"I0FUU0VBI0hJUFMjU1RFI01SRUQjCiNHUklFRyNFTkxJU1RFRCNBRVJJRQpET1VCTEVPUk5PVEhJTkcjQ0FJTkUKT1JFTFMjQ0hFVCNSRU5FI0FERUVSClRBVEkjREVBUiNISVMjREFERSMjIwojRU9OI0VMSSNQT0UjIyNSQU1CTEUKIyMjR09GT1JCUk9LRSNTQU1BUklBCk9JTCNESVQjT09QI05FSUwjTkVBUgpXUkFTU0UjU09QI0RFTEUjQURBTVMKTkFTSCNEU0MjT0JFUk9OI1BXVCMjClNFVE9OI1RPU1NBQ09JTiNSRUhBQgojI0xPWSNBUkNBUk8jU0FNI0VFUk8KU1RBVEUjR0lSTCNSQUUjT1NQUkVZCkFSVVQjQkVBVSNTQUMjQUhBI1NBRApMSUdIVEVEI0JFVFRIRUJBTksjIyMKU1BIRVJFIyMjU0VFI0ZSSSNBTEUjCiMjI1dBUkQjU1NUI0FGQVIjTUFNRQpBRUlPVSNFU1RBI0FQRUQjQVBSRVMKU1RPUk0jUExBWVBFUkNFTlRBR0VTClNBTktBI09VVFNIT09UI0ZJTEVSIwojTEFTUyNUTVMjSU5OUyNMRUFSUyM="},{"title":"3/23/98 CAPITALISTS","author":"by Patrick Jordan, edited by Stanley Newman","date":"1998-03-23","grid":"Uk9UUyNBQ0VEI1BFU1RPCkFWT1cjQ09ORSNBVkFJTApaVU5JI1RISVMjSk9LRUQKT0xZTVBJQURVS0FLSVMjClJFQSNST04jTElNRSMjIwojIyNDT04jRVROQSNCT0EKQVNJQU4jRVdPSyNGUkFOCk1PTlRHT01FUllDTElGVApPRERTI1JPUlkjUkVFU0UKU0FZI0JBVFMjVFVYIyMjCiMjI01BTEkjU0hFI0tPUwojSkFDS1NPTlBPTExPQ0sKUE9OQ0UjTk9STSNBUkVBClRFTk9SI0FTRUEjTUVBVApTTEFZUyNMWUVTI0JBTkU="},{"title":"3/24/98 FANCY FOOTWORK","author":"by Bob Lubbers, edited by Stanley Newman","date":"1998-03-24","grid":"QVBCI09TQUdFI1NUUklQClNPTyNGSU5FUyNUT09MRQpUSUEjRlJPTlRSVU5ORVIKRVNURUUjI1RFRUQjIyMjClJFU0VOVFMjU0VEQVRFRAojI0tFREdFUiNERVJBVEUKU1JJI1NJTE9TI0RFQlRTClBVUFMjRkVNVVIjQUxBSQpVUFBFUiNTQURBVCNFU1MKUkVFVkVTI05BTUFUSCMjClNFUkVORVIjTkFUSU9OUwojIyMjREVBTCMjVEVQRUUKSlVNUEVSQ0FCTEUjUEVOCklOR0VSI0VNRUVSI0VEUwpNQU1BUyNERUVEUyNSWUU="},{"title":"3/25/98 TV TECS","author":"by Rich Norris, edited by Stanley Newman","date":"1998-03-25","grid":"Sk9FWSNTQVNTRVMjQk9aCkVHR08jRU1BSUxTI09ITwpGUkFOS0NBTk5PTiNSQU4KRkVEI05VSVQjIyNXT1JFCiMjI0JBUk5BQllKT05FUwojQ1JPQ0UjI0xFQVIjIyMKU0hPT0sjU1FVQVdLU0FUClRPQVQjVVRURVIjUk9OQQpTT1JDRVJFUlMjRk9VTkQKIyMjQVJJQSMjRUxPUEUjClRIT01BU01BR05VTSMjIwpCVU1QIyMjSVJBTiNQRUkKT1JFI0pJTVJPQ0tGT1JECk5PTiNBQ0NFUFQjRk9JRQpFTlMjR1VJU0VTI0ZMRUE="},{"title":"3/26/98 TOOL BOXES","author":"by S.E. Wilkinson, edited by Stanley Newman","date":"1998-03-26","grid":"VEFQUyMjSE9PRiNGT0xECkFNT0sjV0FMRE8jQVJJQQpQVVRJTk9SREVSI0xFQVIKRVNUI09VVFMjR0FMT1JFClJFU1RPTiMjU0VNSSMjIwojIyNJTkRPQ1RSSU5BVEUKU0FORCMjTk9SU0UjVEhFClBSQVkjI0VWRSMjRE9PUgpPQVIjTUFERUEjI09QUlkKVFlDT09OQVJNQU5EIyMjCiMjI0ZPR1kjI0RPT0RBRApDUklOR0UjQklEUyNJUkEKT0hOTyNMQUlERVlFU09OCk1FQVQjSURMRVIjU0NBVApCQVNFI0NPTEEjI1BPUkU="},{"title":"3/27/98 FORUM FILMS","author":"by Frank Longo, edited by Stanley Newman","date":"1998-03-27","grid":"UEVEQUwjSkVUUyNPQ0hTCkVUVURFI09MRU8jUExFQQpUSEVJSUpBS0VTI1RJTlkKUkFURSNPTkVTI0RPTiMjCklOU1VMSU4jI1NFTUlURQojIyMjVkVBU1lQSUVDRVMKI0FUTU8jI0FNQSNUSVBTCiNUSEVWSUlTQU1VUkFJIwpBUkVTI05FUyMjTFlORCMKWElJQU5HUllNRU4jIyMjCkxBVFZJQSMjRUxBUFNFRAojI0dFTCNFUlJTI0VJUkUKRkFJUiNYVklDQU5ETEVTCkxBUkQjRVJMRSNUUkFDSwpZQUxFI0RZRVIjSE9TVFM="},{"title":"3/28/98 SATURDAY STUMPER","author":"by Randolph Ross, edited by Stanley Newman","date":"1998-03-28","grid":"SEFSREhBVCNERUJBUkdFCkVNRVJJVEEjSU5BTkVMWQpMRVZFUkVUI1JPU0FMSUUKUFJFU0VBVCNFTEVHSVNUClNJUlMjTUVDQ0EjUkVURQpPQ0VBTiNSQVQjSEFWRVMKTkFTU0VSI1JFR0lNRU5UCiMjIyNST09UUk9UIyMjIwpQTEFUVEVSUyNCSU9UQVMKUklURVMjRElHI1RSRU5UCkVWQU4jSEVOUkkjRUxJQQpTRUNVTEFSI09SSUdBTUkKSU5BUkFHRSNDQVJBVkFOCkRFTUVURVIjRUJPTklURQpFUkFTRVJTI1JVTk9WRVI="},{"title":"3/29/98 SITCOMS IN THE NEWS: What happens when shows get together","author":"by Patrick Jordan, edited by Stanley Newman","date":"1998-03-29","grid":"SE9BUiNBR0lMRSNST01QI1JBREFSCkFOVEUjQlJPSUwjRVdFUiNPWk9ORQpMRU9TI1JPVVRFI0NMSU8jTVVMVEkKRlVMTEhPVVNFQ0hFRVJTTUFSVElOCiNQTEFZQVMjI1RFTlQjQ09ORSMjIwojIyNUSURFI01PTFQjRVJSUyNTQUQKQVNQRU4jI1lVUkkjTUFJQSNJT1RBClBBTCNHUkVFTkFDUkVTQkxPU1NPTQpJREEjI0VNQUlMI09ESUUjQ0xPTVAKTklOI0VMSSMjI0pBSUwjU0VFIyMjCkdFVFNNQVJUT05FREFZQVRBVElNRQojIyNBTVkjQVhFRCMjI0xFTiNWRVgKQVdBS0UjU0tJUyNQRUFMRSMjQURBCkJFV0lUQ0hFRFRIQVRHSVJMI05JTApCQVJTI0hBUkUjQVJOTyMjRU5BQ1QKQU5ZI1NFVFMjVVZFQSNNRVRFIyMjCiMjI1NQQVQjQU5PTiMjRUxPSVNFIwpDT0FDSFBFUkZFQ1RTVFJBTkdFUlMKQVJOSUUjUklUQSNBVFJJUCNIRVJBCk1BTk9SI0VHT1MjR0FJVFMjRVRPTgpQTEFORSNEQU5FI0VST1NFI0RPTEU="},{"title":"3/30/98 VEGETARIAN DIET","author":"by Jean Davison, edited by Stanley Newman","date":"1998-03-30","grid":"QUREUyNJTUFOI1RPU0NBCkRJUkUjQ0FSVCNPTEVPUwpTUElMTEVEVEhFQkVBTlMKI1NQTElDRSMjTUFHTkVUCiMjIyNHQUQjQ09HUyMjIwpDT1VDSFBPVEFUTyNNQVMKT05TRVQjI09ORSNDQVNLClNUVU4jVFJPVFMjT01OSQpUQVJUI0hPVCMjUExJRUQKU1BZI1BFQVNIT09URVJTCiMjI1JFSU4jSVJTIyMjIwpBU1BFTlMjI1JBU0NBTCMKVEhFUFVNUEtJTkVBVEVSClRFTk9SI1JJTkcjUk9WRQpOQVNUWSNFREdFI0VQSUM="},{"title":"3/31/98 AT THE MARKET","author":"by Rich Norris, edited by Stanley Newman","date":"1998-03-31","grid":"Q1pBUiNDSEFNUFMjU0NJCk9BVEgjT0lMRVJTI1RPTgpPUFRJT05QTEFZUyNJUlMKIyNJTk4jI0FOTyNBTlRFCiNTVE9DS0NIQVJBQ1RFUgpJT1UjRUVPIyMjTElTWlQKREFERSNBTUFTU0VEIyMjCkFQRVgjTklDSEUjSUhBRAojIyNUT1VDSEVSI0NPVkUKQUNUT1IjIyNMSUwjTUVXCldBUlJBTlRPRkZJQ0VSIwpBTElUI09BUiMjUk9NIyMKSUxLI0JPTkRTRVJWQU5UClRFRSNJTkdFQVIjRURJRQpTUlMjR0VPUkdFI1RFWFQ="},{"title":"4/1/98 STATE DEPARTMENT","author":"by Fred Piscop, edited by Stanley Newman","date":"1998-04-01","grid":"QkFKQSNTSUZUI0hJVE1FCk9MRVMjVFJPWSNPVEhFUgpTT0xJRFBST1BFTExBTlQKT05MQVkjI0xFVFNMSURFClhFUyNBUlQjQUNUIyMjIwojIyNTTkVFUiNIRUlTVFMKU1BBVCNFWEFNI0lOVEVMCkxJUVVJREFUSU9OU0FMRQpJTlVSTiNTSU5LI0VZRUQKVEVBTVVQI09ESVNUIyMjCiMjIyNOVVMjU0VBI1NBUApTQUxBREJBUiMjU0FDUkEKVEhFR0FTSE9VU0VHQU5HCkFTU0VUI0lMS0EjT1BJRQpOT1RSRSNCRUVUI0dFRVI="},{"title":"4/2/98 HOE HOE HOE","author":"by Nancy Salomon, edited by Stanley Newman","date":"1998-04-02","grid":"UFNTVCNBR0hBUyNNQU1BCkFURUUjREVBTFQjT0xFRwpXRUVEQkVTVEJFR09JTkcKI0FQU0UjVEhFUkUjR0FJCkFMSSNBU1UjRU5IQU5DRQpLRU4jVE9SRSMjUlVTRVMKQVJUUyNMRUQjU0lUIyMjCiNTT1dGQVJTT1dHT09EIwojIyNFQVIjRVZFI1NQVVIKU1BFQUsjI0xFRVMjUFRBCkhBU1RFTlMjUlRFI09DVApJUlQjSU9UQVMjV0lTSCMKUExBTlRUT0JFT05USU1FClRPVE8jSU5CRUQjU1RBUgpPUkVTI1RFQVNFI1lFTlM="},{"title":"4/3/98 GAMUTS","author":"by Rand H. Burns, edited by Stanley Newman","date":"1998-04-03","grid":"QVNDT1QjUEFJTkUjR0VMCk1PT1JFI0FTU0VSVElWRQpBTEdFUklBVE9aQU1CSUEKU0lTI0VGUkVNIyNTRUxGCiMjI0VTUyNSRU1TIyMjIwpTQUxTQSNJU1JBRUxJVEUKUE9VVCNBTlQjUkVVTkVECkFSUk9XU1RPWklQR1VOUwpTVEVQSU4jWk9PI0VSU0UKTUFTU01FRElBI0NSRUVMCiMjIyNQUk9OI1NPUyMjIwpGRUFUIyNTTkFJTCNESU0KQU5HRUxIQUlSVE9aSVRJCkNPTkNPUkRBVCNORVZFUgpFTEkjVEhPU0UjU05BUkU="},{"title":"4/4/98 SATURDAY STUMPER","author":"by Brendan Quigley, edited by Stanley Newman","date":"1998-04-04","grid":"Uk9NQU5FU1FVRSNBTE1BCklHRVRBUk9VTkQjQk9BUwpBTExFR09SSVNUI1JPVEMKTElEIyNTRVRBI0NBU1RFClNORUxMI0hFSU5aI0VPTgojR1JFQVNFI0RJQUxFQ1QKIyMjQUdIQVMjQ1JBTktTCiNNRU4jQURJTUUjSURTIwpXQU5UQUQjUEFOSUMjIyMKT0NUT1BPRCNSRVdBUk0jClJBVyNUV0FORyNPTEVPUwpLUklTUyNQRUFTIyNSREEKU09ORSNUSEVSRUFCT1VUCk9ORVIjVU5ERVJCRUxMWQpOSURFI0JFU1RTRUxMRVI="},{"title":"4/5/98 DRIVER'S ED: The language of the road","author":"by Bob Lubbers, edited by Stanley Newman","date":"1998-04-05","grid":"U09GQSMjUkFEQU1FUyMjQkFSVFMjCkVERU5TI0VOQU1FTFMjUkVNT1JBUwpDRU5URVJESVZJREVSI0FaQUxFQVMKIyNESURJIyMjRElWIyNZRUxMRVJTCiNSRUNFREVEIyNDQUEjT0xFUyMjIwpOT1IjUklERVNIT1RHVU4jI1RVTkEKQkFCRSMjQUxBSSNFUk4jI0JBS0VECkFERUxFI01BVVZFI0VERSNPUkVPUwojU05JVCMjI0RFTlZFUkJPT1QjIyMKQ0lERVIjQU1JI1RVUkVFTiMjR1NBCkFERSNFQ0NFI1RFTCNTUkFTI1VURQpQRVIjI09JTFJVQiNEU1QjQVNORVIKIyMjQlVSTlJVQkJFUiMjI0lPVEEjCkFESU9TI0dPQiNFTUFJTCNEQUhMUwpNT05URSMjU0lQI0lORE8jI0tFSVIKUEVBVCMjRkVFTEVSR0FVR0UjRU5PCiMjI1NDQVIjU0FMIyNTVEFWSU5HIwpPTkFEQVJFIyNZQVMjIyNUSU5HIyMKUE9DT05PUyNTTElQU1RSRUFNSU5HClRBUlRJU0gjUkVOQU1FUyNOQU5DRQojSEVTU0UjI0lURVJBTlQjI05FT04="},{"title":"4/6/98 WHERE'S THE ENTREE?","author":"by Rich Norris, edited by Stanley Newman","date":"1998-04-06","grid":"UkFNI1ZPTFQjQUxBTk9OCkFNTyNBUk9PI1JPVEFSWQpEVUNLU09VUCNDUkFETEUKQVNIRVMjU0FMQUREQVlTClJFQUdBTiNaRU5PIyMjIwojIyMjUlVCI0RFVkVMT1AKRUNDRSNNQVAjI0VWQURFClJPTExTQkFDS1BSSUNFUwpTTU9LRSMjU0lSI0xFU1QKVEFHU0FMRSNET0MjIyMjCiMjIyNXQVNQI1NIRUFUSApFQVNZQVNQSUUjT0xMSUUKQ1JFQVRFI0NVUE9GVEVBCkhFQUxFUiNLUklTI0VSUgpPQVRFUlMjU09OWSNSU1Q="},{"title":"4/7/98 IT'S A PUZZLE","author":"by Fred Piscop, edited by Stanley Newman","date":"1998-04-07","grid":"I1NQQVIjWUFSRCNTVU1TClBBUkVFI0VMSUUjSVRBTApBRE9STiNMSU9OI05JTkEKTUVESUFCTElUWiNDTE9QCiMjI0FNTyMjU0VMTEVSUwpIT0xMRVJFRCNMT0EjIyMKT05FIyNPUkVTI05JU0VJClBVVFRJTk9OVEhFUklUWgpFU1RFUiNTRUxBIyNBVE8KIyMjTkFNI0JPVFRPTUVEClJJUEVORVIjI0NPUyMjIwpBREFNI0RFUlNIT1dJVFoKTUlURSNJR09UI1RBSE9FCkJPUk4jQ0FORSNPTEFORApPTUlUI1NMQVcjT0REUyM="},{"title":"4/8/98 COUNTRY MUSIC","author":"by Ronnie K. Allen, edited by Stanley Newman","date":"1998-04-08","grid":"U0NBTSNPUkNBI0JBQ0tTClVSR0UjUkhPUyNJTkFORQpET1JBI0RPTlRDUllGT1IKU1BBUlRBTiNBTFQjRVRBCiMjI0dSSUVHI09ITSMjIwpGQURFSU4jUlVTU0lBTlMKSVNJTkcjUEVURSNTTUlUClNUQVQjU09OQVIjU0FHQQpUT05JI05PQUgjTUFURVIKU1BBTklBUkQjU0lNSUxFCiMjI0FOUiNBR0lMRSMjIwpBU0sjTEVUI1JFQVJFTkQKVEhFUkVTSEVJUyNJTElFClRBUk9UI0VBU1QjQ0FORQpBR05FUyNSVVRBI0FMRVM="},{"title":"4/9/98 SKIMMERS","author":"by Bob Lubbers, edited by Stanley Newman","date":"1998-04-09","grid":"TUFNRSNORVNUI1BBU1RBCklSQU4jT01BUiNJRExFUgpTTElERVJVTEUjUk9JTFMKVE9TU0VEIyNTQ0FSUCMjCiMjIyNMSVNBI0FURVNUUwpORUdMRUNUUyNTRVNURVQKRUxMRVIjRVNTRVMjUk5BCkFNSU4jUEFJTlMjVEVBSwpSSUQjU0FMU0EjR1JBQ0UKRVJFQ1RTI1RSSVJFTUVTCkRBU0hFUyNTRVRBIyMjIwojI0xPVkVTIyNJTlNFQU0KTU9PUkUjQ09BU1RMSU5FCkFTUEVOI09ESU4jT1JFUwpHVUVTUyNXRUxUI1BFV1M="},{"title":"4/10/98 AUTO MOTIVE","author":"by Patrick Jordan, edited by Stanley Newman","date":"1998-04-10","grid":"UEVBUyNCQUxEI0NBUFJBClJJTEwjQVJFQSNIVVJPTgpPVFRPI0xJQVIjVU5JVFkKV0hBVEFNQU5XQU5UUyMjClNFSVNNIyMjSVJLI1NPWQpFUlIjQVNMQU5UI0RJTUUKIyMjQVpURUMjI0FSRU5BCk1PU1RPVVRPRkFDQVJJUwpBTEFJTiMjUkFJVFQjIyMKS0VQVCNCT05BTUkjUkFUCk9PUCNBSVIjIyNOQU9NSQojI0hJU1RFRU5BR0VTT04KSEFJVEkjR1JFVyNTQVJLCk9BUkVEI09HUkUjT1JBTApUSEVNRSNOT0RTI1BZTEU="},{"title":"4/11/98 SATURDAY STUMPER","author":"by Ed Julius, edited by Stanley Newman","date":"1998-04-11","grid":"U0NBTEFSIyMjSEFQUEVOClBPTEFSSVMjU1VMVEFOQQpFTUJSQUNFI0VNUEFMRVMKRU1VI0xFUElEVVMjRU1TCkRPTUUjUk9WRVMjQlJJRQpTTkVSRCNZRU4jR09NRVIKI1NOQUlMUyNUT1JTT1MjCiMjI1NDSSMjI0hBUyMjIwojQ09NRVRTI05PU0lFUiMKUkVDVVIjVEhFI1BFUkVTCkFOVFMjUFJPVUQjUk9NQQpJVEEjR0xJVFRFUiNTT04KTElWRU9BSyNFTFVTSVZFCkVNSVJBVEUjUkVMSVZFUwpERUFSVEgjIyNERVNFUlQ="},{"title":"4/12/98 BIRD CALLS: Sounds like fun","author":"by Cathy Millhauser, edited by Stanley Newman","date":"1998-04-12","grid":"U1RSVU0jR1VMRiNBU0FTI0ZBQ0VECkFSVUJBI09ORUEjQ1VSVCNBR0FURQpIRURJRE5USEFWRUFDT08jVEFXTlkKTEVEI0hPSE8jQU5DSE9SUyNUV0FTCiMjIyNPUklPTiNUSU8jTU9DSEEjIwpUSEVRVUFDS09GREFXTiNCUkFJTlkKUkVCVVMjI1NQQSMjI0VMSU8jVE9FCkVBU0lFU1QjI0NST1dJTkdQQUlOUwpTVEVQU09VVCNUSU1JTkcjU0lOQ0UKU1NOUyNVTklTI1RTRSMjQlVMR0VTCiMjIyNTTkFQQ0FDS0xFUE9QIyMjIwpBRERFTkQjI1JBSCNET09SI0FMQlMKTUFVUkEjU0hBUklTI0VSQVNNSUFOCkFGVEVSVEhFUEVFUCMjRVhQQU5TRQpIT0MjTElBUiMjI0lGUyMjQUxHSUEKTEVIUkVSI0FST1VORFRIRUNMVUNLCiMjVEFST1QjT1JSI0FSVUxFIyMjIwpNQVdTI0xPUkFOR0UjRUJCUyNaRUUKRUxFQ1QjVEhSRUVQSUVDRUhPT1RTClNQRUFSI0hPRVIjSU9UQSNJTk5FUwpIT1RMWSNFRERZI0NVU1AjUEFFU0U="},{"title":"4/13/98 MONDAY MORNING QUARTERBACK","author":"by Fred Piscop, edited by Stanley Newman","date":"1998-04-13","grid":"TUFBTSNQQVBBI0RBSVNZClVORE8jRVZFTiNPUlRITwpTTkFQVE9BVFRFTlRJT04KSEVNI1VSTlMjUEFJTkUjCiMjI0JSSVQjQVNIRSMjIwpQQVNTRkFJTENPVVJTRVMKRVNURVMjI0VJTkUjUENUCkFUQUQjI0ZBRCMjRkxPRQpDUkkjREFJUyMjSVJBTkkKSEFORE9GRlRIRUJBVE9OCiMjI0FMVE8jT1VTVCMjIwojQkFUT1IjQU9ORSNSQUUKTEFURVJBTFRISU5LSU5HCk9VVFJFI0JSQUMjT0xFRwpBTUFTUyNTQVNFI0RFV1k="},{"title":"4/14/98 CALLING MRS. SPRAT","author":"by Lee Weaver, edited by Stanley Newman","date":"1998-04-14","grid":"QU5HRVIjQ09PUCMjQkVFCk1PT1JFI0FETUFOI1VSTgpFTEJPV0dSRUFTRSNUTlQKTkFTU0FVI0FSVElTVEUjCiMjI0VSUlMjI0FURUUjIwpNQUMjRFVFUyNTSEFSUCMKRUNITyNTUEVDI0VNQkVEClNIRUJBI0FMTCNSRUVEWQpIRVdFRCNMRUFII0RBUkUKI1NUUkFXI1NOQUcjTk9TCiMjSE9QSSMjR0lMQSMjIwojR0VOVExFUyNUQVRUT08KT0FGI09JTFBBSU5USU5HCkFHQSNSRUxBWCNDQU5FUgpLQVQjI1JBUkUjRVJBU0U="},{"title":"4/15/98 PAGE SETTINGS","author":"by Rich Norris, edited by Stanley Newman","date":"1998-04-15","grid":"Q0FTUyNPQkFEI05FU1RTCk9NQVIjQ09MQSNVTFRSQQpQQVlUSEVUQUIjQ0xBSVIKQVNTQVVMVCNTT0wjUkFHCiMjIyNNT09TI0JFQVRMRQpQUk9GSVRNQVJHSU4jIyMKU0FMQUQjI05BWSNEUlMjClNQRUMjQUxERU4jUk9PRgojVE9BI0JBQSMjTUVBUkEKIyMjRE9VQkxFSEVBREVSClRBTEVOVCNTTE9UIyMjIwpBTEkjRVNTI01PUk5JTkcKTUlNSUMjVFdPRk9PVEVSCkVWSVRBI1lPUkUjREFSRQpERVRFUiNFV0VSI1NMT1c="},{"title":"4/16/98 WORD OF MOUTH","author":"by Bob Lubbers, edited by Stanley Newman","date":"1998-04-16","grid":"TU9TRVMjT1BUI1RBUEVECkVDTEFUI0NFRSNBTU9SRQpTQVlTVU5DTEUjS0VFTkUKU1RFVCNPVVQjVEVOVEVECiMjI01BT1JJI09SRCMjIwojI1RBTEtTTk9OU0VOU0UKVFJFTkQjI0dBRyNERUFOCk9FUiNPUlIjVEFOI0FNSQpUQVJQI0VFUiMjRVJSRUQKU1BFQUtTVk9MVU1FUyMjCiMjI1BFVCNCQVJPTiMjIwpCRVJFVFMjRVJHI0VMU0UKQVZFUlQjQ1JJRVNXT0xGClJFQkVMI0FUQSNTQURBVApUUkFERSNNQVQjU0xFV1M="},{"title":"4/17/98 WOMAN OF LETTERS","author":"by Henry Hook, edited by Stanley Newman","date":"1998-04-17","grid":"SUZWQU5OQSMjV0hJVEUjClBJRVJST1QjVE9VUklTTQpBQlJFQVRII1JPTUFOQ0UKTlVCUyNXSUxZI1NOQVJMCkVMQSNIT05FU1QjI01PTwpNQUxUQSNHT1RIRVJPV04KQVNTT1JUI1NFUklPVVMjCiMjI0JMWVMjRE9HUyMjIwojU1RPT1BUTyNXSElMU1QKU0hPV1dPVUxEI1RFRVRICldBSCMjU01FUlNII1NBWQpJUkVTVCNCT0FDI0JPUlMKU1BBTklFTCNNVVNFVFRFCkhFUk9OUlkjQUxDT0hPTAojSVRCRUEjI1NQSU5PRkY="},{"title":"4/18/98 SATURDAY STUMPER","author":"by Frank Longo, edited by Stanley Newman","date":"1998-04-18","grid":"I01BTEFXSSMjU0NSQVBFCkRDQ09NSUNTI1RIRUxBVwpFTlFVSVJFUiNJT0RJTkUKTEFVTkRFUlMjTE9DS0VSCklNQUdFUlMjUkVTRUVEUwpMQVZFUyMjRkVUSUQjIyMKQVJJIyMjTEFTVE5BTUUjCkhBVkVBTkFYVE9HUklORAojU0FVU0FHRVMjIyNOQUUKIyMjTEFWRVIjI0NSSU1QCkNEVE9XRVIjU0NIRU1FUgpIRUlHSFQjVk9MQVRJTEUKRUxMSU9UI0lET0xJWkVTClNURUVMRSNDT1ZFUkVSUwpUQVJTRVMjI01FVEVSUyM="},{"title":"4/19/98 ALTERNATIVE LANGUAGE: Focusing on one letter in particular","author":"by Randolph Ross, edited by Stanley Newman","date":"1998-04-19","grid":"VE9OSVMjRkFMTCMjVE9BRCNSRURPCkFST01BI0FMT0VTI09SU08jSU5JVApQQU5BTUFDQU5BTCNNQUhBUkFKQUgKRUxFR0FOVFMjVkFDQVRFI0FUT05FClJFU0VOVFMjI0VMQVRFI1BMQVlFUgojIyNEVEgjREVTT1RPI0FSRSMjIyMKUkFII0hFTUFUT01BI1BST1NQRVJPCkFMQUJBTUFNQU4jTU9MRVMjUkFJTgpGQURFIyNMRVQjTkFNRVMjQkVUVEUKVFJBVkFJTFMjTk9SQUQjRFVDQVRTCiMjU0VOU0UjVEFUQVIjU0lORVcjIwpDTEFSRVQjQkFTSU4jVFVFU0RBWVMKTEFMQVcjU0FUQU4jVE9NIyNFWUVSCkFOQUcjU09MQVIjQ0FOQURBREFUQQpQRURFU1RBTCNBTExFWUNBVCNUSVMKIyMjI09BSyNJREVBTFMjS1RTIyMjCkZBQ0lORyNTQ0FUUyMjTU9SQUxFUwpBQkFDSSNBTEVSVFMjQ0FUQUxJTkEKQ0FSQUNBU0FNI0hBVkFOQUNBU0FTCkVUT04jUklUQSNFQ09MRSNUUkFDRQpURU5UI0FTU04jI1RXSVQjU1lTVFM="},{"title":"4/20/98 PLAYING DIRTY","author":"by Fred Piscop, edited by Stanley Newman","date":"1998-04-20","grid":"VFNFI0JBTEVTI0FGRklYCkVMTCNBTU9SRSNMQVVERQpBSU0jU0FUSUUjT1JDQVMKU1BJS0VUSEVQVU5DSCMjCkVVUkFTSUEjI05FRVNPTgpTUEFSIyNSVU1QI1NJREUKIyMjRVJBI01FQU4jQURaCiMjU0xBU0hQUklDRVMjIwpBTFQjRkxFRSNET0cjIyMKTU9PVCNFTkRPIyNHQVNQClBVUEFURSMjUk9CRVJUTwojI0NMSVBUSEVIRURHRVMKU1BPS0UjSEVMTVMjWVJTCkFTQ0lJI0VMU0lFI0xFRQpMSUtFTiNFTEVDVCNFT1M="},{"title":"4/21/98 HIGHWAY SIGNS","author":"by Bob Lubbers, edited by Stanley Newman","date":"1998-04-21","grid":"U1BFTkQjVEhJUyNUV0FTCkFSTU9SI0hBTFQjT09OQQpQSUNOSUNBUkVBI1VSQUwKSUNFI1ZFTlQjQkFSRVNUCkRFRURFRCNTQUxNSSMjIwojIyNFTEFMI0xFSVNVUkUKU1BBVCNSRU5UI1NUUkFZClRPUk9TI1NFRSNTSUdORQpBTEVVVCNTRVJCI05FVFMKVEVBUk9TRSNTRUxGIyMjCiMjI0FMQU5TI0JPT05FUwpBTlRIRU0jRVRPTiNFRFQKTE9SRSNTVEVFUEdSQURFCklERUEjT09QUyNFRVJJRQpURUVEI05FU1QjRE9TRUQ="},{"title":"4/22/98 BOND RALLY","author":"by Patrick Jordan, edited by Stanley Newman","date":"1998-04-22","grid":"VEFGVFMjQ09MRSNKQVpaClNUUklQI09SWVgjQVJFQQpBUkVOQSNNQVJPT05JTkcKUklUQUNPT0xJREdFIyMjCiNBU1RFUiMjQ1VSI0NBRAojIyNVRERFUiNTRUNVUkUKRkFSUiNFWElUI1NBUkFOClVMQU4jUkVMSUMjUklCUwpSSU1FUyNDRUxMI0xPU0UKWkVCUkFTI1NFRURZIyMjCkVOTyNCRUEjI1JPU0VTIwojIyNHTEFEWVNLTklHSFQKVEhSRUVTT01FI0FNRUVSCk5PT04jT1JDQSNUT1NFRQpUV0lUI05FQVQjRU5UUlk="},{"title":"4/23/98 FLYING OFF","author":"by Norma Steinberg, edited by Stanley Newman","date":"1998-04-23","grid":"T1NDQVIjUkFCSU4jTURTCk5PT1NFI0FST1NFI1lFVApPV0xLSU5HQ09MRSNOTkUKIyMjRUdPUyNNQUQjQVNBCkNST1dOUyMjI01JQ0hFTApSRU4jU0FMQVMjRUVMIyMKQUdFIyNMSU5UI1JFRUZTCk1BR0kjRU5ERUQjU0FSQQpTTE9PUCNLSVJJIyNHQUcKIyNPVVIjU0VOU0UjVU5FClJFRFNFQSMjI0FTUEVDVApPVVQjU1NII09SQ0EjIyMKQUJFI1NUT1JLTUFSS0VUClNJUiNFUlJPUiNQRUVWRQpURU4jRE9OTkEjRURHRUQ="},{"title":"4/24/98 SHORTENED STATES","author":"by Wayne R. Williams, edited by Stanley Newman","date":"1998-04-24","grid":"U0xBTlQjU1RPV1MjVEFUCkhPTk9SI1RIUk9XI0hSUwpBUk9TRSNPVUlKQSNFUkUKV0lORVNCVVJHT0gjSEFUCiMjIyNURVRTIyNJUk9OUwpNRVRUTEUjIyNQTEFUVEUKTUFIUkUjQ0FTVUlURSMjCkRSRUkjV0FJU1QjSUxMUwojI1RYVklMTEUjU09OSUEKUElOSU9OIyMjTUVTSEVEClJPV0VMIyNSSEVBIyMjIwpJREEjTElGRU9OVEhFTVMKTklMI0VESUVTI1RPUVVFClROVCNZRUFTVCNMT1VTRQpTRVojU0FURVMjRURJVFM="},{"title":"4/25/98 SATURDAY STUMPER","author":"by A.J. Santora, edited by Stanley Newman","date":"1998-04-25","grid":"U01JVFMjQ09NQSNIQUxPCkNBTkFMI09WSUQjQUpBWApBTkFDRSNORVJJI0JBUkUKUklDSEFSRFJPRSNJUkFOCkZBVCNaT09UU1VJVCMjIwojI0lERUFMIyMjU0FNQkEKTUNWSSNERUxFR0FUSU9OCkFMQVMjSVJFTkUjSVRJTgpSVVRITEVTU0xZI09JTFMKU0VFVE8jIyNJU0lORyMjCiMjI09VVFJBR0VEI0FSUwpTUEVXI1JFQ0hSSVNURU4KSEVSRSNFVEFUI09QSU5FCkFSSUwjTklLRSNNT1ZFUgpRVUVTI1RFRU4jU1RFRUQ="},{"title":"4/26/98 CINEMA CYNICISM: A master of insult takes aim at the movies","author":"by Bill Landers, edited by Stanley Newman","date":"1998-04-26","grid":"V0lERSNNQU1CTyNDQVJEIyNHTE9CCkFNRVgjQUxJRU4jT1JFT1MjSE9QRQpSRUFQI1RPTEVUI1JFTElDI09SQUwKU1RSSVBUSEVQSE9ORVlUSU5TRUwjCiMjI0FTRUEjI0VWRUwjI1BFVCMjIwpUSEFUUyMjT1JHQUwjU1BJRVNPTiMKUklTRSNPRkZIT0xMWVdPT0QjRkFOCkFUTVMjUklGRSMjI0FJUiMjUElLRQpQRUEjTUFERUFDSEFOR0UjI0lHRVQKIyNUV0lORVIjSE9DSyNTVFJBTkRTCiMjVEFORyMjTElNQVMjI1JFTk8jIwpCTEVOREVSI09ORUwjT05FRk9SIyMKTEFSRCMjT1NDQVJMRVZBTlQjQU5EClVOSVMjI0dPQSMjI05BU1QjS05FRQpSQU4jWU9VTExGSU5EVEhFI0lDQU4KI0lHTk9SRUQjQUNBU0UjI0lDRVJTCiMjI0VXQSMjQUNBVCMjUEVBSyMjIwojUkVBTFRJTlNFTFVOREVSTkVBVEgKVEVYVCNFTElPVCNSSUFUQSNEUkVJCk9QRUwjRFVOTkUjQU5ERVMjSUdFUgpQT1NZIyNTRUVEI0xPT1NFI05PU0U="},{"title":"4/27/98 AEROBICS CLASS","author":"by Lee Weaver, edited by Stanley Newman","date":"1998-04-27","grid":"Q0FTSCNBVFRBUiNTVEVUCkxJS0UjU0VJTkUjUE9QRQpPRElOI1NFTkRTI0VSSUMKUEVQI0hPTUVTVFJFVENICiMjT0RPUlMjI0xPREVTIwpUUlVBTlQjU0VFRFkjIyMKUkVUSUUjUFVMU0UjS0FUCkFET1MjV0VMTFMjV0lTRQpNT04jQkFOS1MjQ0FDSEUKIyMjUlVJTlMjRFVDS0VECiNDTEVGVCMjT1JFT1MjIwpMRUFQRlJPR0dFRCNUVkEKQURaRSNFQVJMUyNTQUlEClBFRU4jU0hJRVMjQU5ORQpQU1NUI1NVRFNZI09ERVM="},{"title":"4/28/98 SAY IT WITH MUSIC","author":"by Rich Norris, edited by Stanley Newman","date":"1998-04-28","grid":"TUFaRVMjUkFQVCNTSElOCkFMQU1PI0VUQ0gjVE9STwpSQU5TT01OT1RFI0FMTVMKVElFI1RFRU0jT0ZGREFZCiMjI1NIQVcjR1JBRiMjIwpURVJDRUwjSE9FRE9XTlMKQURJT1MjVEVBTSNGUkFUCkxJQVIjSEFJTFMjTElNQQpFVFRFI09VUlMjTElURVIKU0hBS0VVUFMjU0FGRVNUCiMjI0VMU0UjTUlDRSMjIwpTQ0hFTUUjU0FMSyNBR0UKSUhPUCNTSU5HTEVTQkFSClpPTkUjQURBTSNZRUxMUwpFV0VSI1RPR0EjU1dFQVQ="},{"title":"4/29/98 RIGHT AT HOLMES","author":"by Patrick Jordan, edited by Stanley Newman","date":"1998-04-29","grid":"RkFXTiNXQVNII1NOQUtFCk9ESUUjQVJFQSNFQVNFRApMSVpBI0lSQU4jQ1JJRVMKREVFUlNUQUxLRVJDQVAjClNVTiNIRVkjRVdFUyMjIwojIyNUQVIjQlJJVCNKRVQKQU1PVVIjR1JJTiNQT0xPCk1BR05JRllJTkdHTEFTUwpFWlJBI0FSQUcjTEFORVMKTkVFI0xJT04jQ09ZIyMjCiMjI0NFTFMjTUFPI0xFRAojTUVFUlNDSEFVTVBJUEUKVEVYQU4jT1VUUyNFVE9OCkFOSVNFI1BMRUEjTkVYVApDVVRFUiNFQVJMI0RSWVM="},{"title":"4/30/98 SINGING THE BLUES","author":"by Richard Silvestri, edited by Stanley Newman","date":"1998-04-30","grid":"TUFSUyNSRVNUI1BFUlNFCkVQSUMjRUxNTyNPUkVPUwpBU1RBI0RJQUwjTUFMVEEKVEVBTFRIRVJFV0FTWU9VCiMjI1BSTyNUUkFERSMjIwpTT1ZJRVQjI0FWRVJBR0UKQ0xJTksjU0FURVMjQk9YClJJTkcjTEFZRVIjUEFSSQpBVkUjRElDRUQjQkFTRUwKTUVTU0lFUiMjU0VSRU5FCiMjI1BBVElPI1ZBVCMjIwpBQ1lBTk9GVEhFVElNRVMKU0hPUk4jSVRBTCNDT0xFCkhPUlNFI0NFTFQjTEFLRQpZT0tFUyNFUlRFI0VUT04="},{"title":"5/1/98 FILLING IN WORDS","author":"by Frank Longo, edited by Stanley Newman","date":"1998-05-01","grid":"SURUQUcjTklFQ0UjSVJTClFVT1RBI0VORE9XI0JFQQpTRUFNUyNHUkFQRUxFQUYKIyMjI0hBUkVNUyNVUkdFClJBVklPTEkjIyNBTElBUwpFTUVSR0UjRUdHUExBTlQKTkFOQSMjR1JPVVAjIyMjClRISU5HU09ORVNUVUZGUwojIyMjQUxPSVMjI1RFQUsKRU5WRUxPUEUjUE9FVFJZCk5PT05FIyMjUEVQUEVSUwpBTUlDI1NBTElORSMjIyMKQkFMTE9UQk9YI1JBTUJPCkxBRSNSQUJCSSNBVkFJTApFTVMjRVJBU0UjU0VJWkU="},{"title":"5/2/98 SATURDAY STUMPER","author":"by Oliveros McLloyd, edited by Stanley Newman","date":"1998-05-02","grid":"RElFSEFSRCNUUkFDRVJTCklOR0VOVUUjUkVHQUxJQQpTVEFORElOR09WQVRJT04KSE9EI0lOU0VUI1RFQVNFCiMjI1RSRUVTI1NJUiMjIwpIT1RST0QjVFJBTlNJVCMKQVBST04jTElFR0UjREFNCkhFQUQjUElDQVMjUEVTTwpBUk0jQ1VUVVAjU0VBVE8KI0FQUEFSRUwjRlVFTEVECiMjI0FNRSNBVEFMTCMjIwpCT0lTRSNBVElMVCNSVUUKSU5TVFJVTUVOVEFMSVNUClJFTEVBU0UjR0VORVNFRQpEUkVTU0FTI0VSQVNFUlM="},{"title":"5/3/98 PRESS AGENTS: Celebrities with something in common","author":"by Patrick Jordan, edited by Stanley Newman","date":"1998-05-03","grid":"U0VSQiNIQVNBVCMjQkxBQiNSSE9TCklERUEjQVdBU0gjU0xPUEUjVVJHRQpEV0lHSFRFSVNFTkhPV0VSI1NPUlQKTElOR0VSRUQjUlVJTlMjTUlTU0VTCkVOU0lMRUQjRkVURUQjVFVOSVMjIwojIyNFTEQjV0FJVFMjS0lETkFQRUQKR1JBU1MjREFOTllUSE9NQVMjRVJBCkFVTlQjQk9SRyMjI0FSTSMjVFJPVApaRU4jSkFNRVNDQUdORVkjRElPREUKRVJBU1VSRVMjTElOREEjSEFMVEVECiMjI09ORVMjTEVST1kjVklMRSMjIwpTRUVERUQjUk9SRU0jQUlSRURBTEUKQUxEQVMjSkFDS0RFTVBTRVkjUUVECkxFU1MjI1VOSyMjI0VST1MjQlVORApFTVUjRURESUVDQU5UT1IjVE9BRFkKTUlMSVRJQVMjQU1PT04jU0FNIyMjCiMjTE9UVVMjUExBVE8jTEFNQkFEQQpTUElERVIjU0VJTkUjUE9MRUFYRVMKTEVWSSNORVdTUEFQRVJDQVJSSUVSCklSQU4jQVBBVEgjQUxJQVIjREFSRQpUVU5FI0xBWVMjI0RJTUxZI1NMRUQ="},{"title":"5/4/98 IN THE NEWS","author":"by Rich Norris, edited by Stanley Newman","date":"1998-05-04","grid":"V0FHRVMjS09DSCNTSVBTCkVNSUxZI0FSTE8jS05PVApERUZJTklURUFSVElDTEUKU1NUI0RSWSNESVNNQVlTCiMjI1NSTyMjI1pBUCMjIwojU0VDT05EU1RPUllNQU4KU1RST00jRVRPTiMjQUxFCk9SQVRFI01JWCNNQVhJUwpCVVMjI1RPTkkjQVJJRVMKU1RFRVJJTkdDT0xVTU4jCiMjI0RFUCMjI0dBVCMjIwpBVEVJTlRPI0tFWSNGQU8KUElFQ0VPRk9ORVNNSU5EClNFTlQjRUlORSNJUkFURQpFRFlTI1NURVcjQVNURVI="},{"title":"5/5/98 MESSED-UP MENU","author":"by Fred Piscop, edited by Stanley Newman","date":"1998-05-05","grid":"UEFDRUQjU0hJViNURU5UCkFGUkVFI1BJQ0EjT0xFTwpTT1VSR1JBUEVTI1VMQU4KVFVFI1JBTSMjU1VHQVJZCkFMTFNFVCNBV0FTSCMjIwojIyNQRVQjTU9MRUNVTEUKRklKSSNBRkFSI05PTkVUCk9ORUxBTkUjU1RPT0RPTgpBVEFMRSNNVVRFI0tPTkEKTE9ORVNPTUUjTUNJIyMjCiMjI0RPUEVZI1BSRUxJTQpBVEVNUE8jI1NMTyNPTkEKSEFSSSNST1RURU5FR0dTCkVWSUwjVEFJTCNFUklFUwpNSUNLI09SU08jU0FDUkU="},{"title":"5/6/98 CAESAR'S LAW","author":"by Bob Lubbers, edited by Stanley Newman","date":"1998-05-06","grid":"UklTRVIjTU9MTCNMQVJLCkVSQVNFI0FCRUUjRUxFRQpQRVJQTEVYSU5HI0dFTkUKT05BI0lMSUUjUkVBU09OClRFTlNFRCNTUEVMTCMjIwojIyNPREVTI1JFVkVMRUQKQVdPTCNSRUJBI0VYSUxFClRBVEFSI1JBWSNTUEFJTgpNSVRSRSNBR0VSI0VSQVMKU1RPUEdBUCNSRUFSIyMjCiMjI0xBU0VTI0FSVEhVUgpBTElFTlMjVEVURSNPTkUKSklOWCNBTEVYQU5EUklBCkFUVFUjSU9OQSNBRVNPUApSRU9TI0xPT00jU1RFTlM="},{"title":"5/7/98 OPEN WIDE","author":"by Mark Ryder, edited by Stanley Newman","date":"1998-05-07","grid":"I0xFRCNFTUNFRSNTQUlECk1JTEEjUk9BRFMjVVNOQQpQQUlOTEVTU0RFTlRJU1QKR1JBUEUjSEVZI0FVRElFCiMjI0FDUkVEI1NJUkVOUwpTRUVUSEUjI1lBTEUjIyMKT1BFQyNTVFJPREUjR1NBCkhJR0hTUEVFRERSSUxMUwpPQ1MjUEVOUEFMI05FQVAKIyMjQVJDTyMjRVZFTlRTCkJFQVJJVCNEQVJFUiMjIwpFTEdJTiNNRUwjQVRFQU0KUExBU1RJQ0ZJTExJTkdTClBFVEUjU0lFVkUjQURFUwpPTkVTI01JUkVTI0xTRCM="},{"title":"5/8/98 SOCIAL STUDIES","author":"by Patrick Jordan, edited by Stanley Newman","date":"1998-05-08","grid":"SkVSSyNBTEFTI0JJWkVUCkFSRUEjQkFJTCNVVElMRQpWSU5FI0pVRE8jTUFOU0UKQUNPTExFR0VHSVJMQ0FOCiMjIyNBQ0gjI1JBWSMjIwpCQVJFU1QjU09BUCNTRUEKRVJJTlMjSlVBTiNTVEFCCkJFUE9PUkFUSElTVE9SWQpPTkVTI0VDUlUjVElMTFMKUEFOI0FOS0EjQ09SRVlTCiMjI0FHRSMjUVVPIyMjIwpCVVRHUkVBVEFUREFURVMKQVRPTkUjR0FURSNIQUxPClJBUkVFI09SQUwjRVhBTQpTSE9XUyNHQVJZI01JTkU="},{"title":"5/9/98 SATURDAY STUMPER","author":"by Ed Julius, edited by Stanley Newman","date":"1998-05-09","grid":"I01JU0VSUyNNQURBTVMjCkNBQkFSRVQjSVZPUklFUwpBTEVXSUZFI1RFUkVOQ0UKQkFSTiNTUElFUyNTQVJBCk9SSSMjI1BBUiMjI1JFVApUSUFTI0JFTkVUI01FVEUKU0FOQ1RVUyNESUxBVEVECiMjI0FJUiMjI1RBVCMjIwpDT05ET1JTI1JBTUVTRVMKQVBJUyNTQVRBTiNTRVJUCkJVTiMjI0JBVCMjI0RBUgpBTEVTI0RJR0lUI1dBU0EKTkVWQURBTiNORUdBVEVECkFORU1PTkUjR1JPQ0VSUwojVEhFU0VTI1NOT09EUyM="},{"title":"5/10/98 FAMOUS LAST WORDS: Couched in various guises","author":"by Frances Burton, edited by Stanley Newman","date":"1998-05-10","grid":"QVNUQSNDQU1FTCNTTEFORyNDUkFNCkxFRVIjQVJFTkEjQUlNRUUjSE9MRQpBUkFUI1ZPVEVSI0xBTUVOVEFCTEUKU0FNRU5FU1MjQVNUUk8jRFJJRVNUCiMjI1NFUkUjI01PT1MjVEFPUyMjIwpBUFBJQU4jU0NJT04jQ09SVkVUVEUKQ0FSQVQjRE9ZRU4jI0xJTUUjVVJOCkVWRU4jTUFSQyMjU0NBTEUjU1RBVApST0QjTk9WRUwjQ0VBU0UjU1BBQ0UKQlJJR0FERSNBTEFSTVMjU0hJTkVSCiMjQ09WRVMjTUVSR0UjU1RJTksjIwpDSEFORUwjVkVOVEVSI1RPRVNIT0UKSEFNRUwjS0VOWUEjQVdBUkQjQVJBCkFHRVIjVkVSU0EjI01JTksjT01BUgpSVU4jU0xBRyMjU1BFTkQjU1BFTEwKREVUT05BVEUjU1BBTksjU0NFTkVTCiMjI1JFRFMjQkVBTiMjU1BBUiMjIwpTQUZBUkkjU0VOVEEjRkxBTUVOQ08KQU1FTkRNRU5UUyNDTEVBUiNUT09MClNPTkcjSVJBVEUjSEFMVkUjVE9SRQpFUlNFI1JBR0VEI0VTVEVSI0FOTlM="},{"title":"5/11/98 CAR SERVICE","author":"by Rich Norris, edited by Stanley Newman","date":"1998-05-11","grid":"RVBFRVMjSE9JU1QjU1NUClZPTEdBI0FORElFI1BBUgpFTEJPV0dSRUFTRSNSVUUKU0VBVCNPQVQjI1NFSU5FCiMjI1JVTlNPVVRPRkdBUwpCWUxJTkVTI1JBRlQjIyMKTE9PUFMjI0hBTEZTVU5LCklETyMjU0NBTEUjI1ZFRQpQQVNTUE9SVCMjT0NFQU4KIyMjSE9ZQSNQVEJPQVRTClZFR0VUQUJMRU9JTCMjIwpORVJEUyMjQVJGI0xNTk8KRVJBI0RSSU5LRkxVSURTCkNJViNBREFHRSNBRExBSQpLRVkjTUFORUQjUEVFS1M="},{"title":"5/12/98 CLASSIC MUSICALS","author":"by Bob Lubbers, edited by Stanley Newman","date":"1998-05-12","grid":"TEFMQSNCUkVSI0FHQVBFCk9SQU4jUk9URSNHT0xBTgpCRVNURk9PVEZPUldBUkQKRUFUI1JPTkEjVEVOU0VTCiMjI1RBS0UjU0hFUyMjIwpNQURBTUUjU1RFUyNPSFMKRU1PVEUjQkVFUiNPUkVMCkRVQkFSUllXQVNBTEFEWQpJU0lTI0FUT00jUkFOR0UKQ0VFI0FURU4jQ09OR0VSCiMjI0lUSVMjTEFVRCMjIwpQUk9OVE8jS0lTUyNMRVMKU0lOR0lOSU5USEVSQUlOClNURUVSI0NPUkUjRVpSQQpURVJSRSNFV0VTI1BFRVA="},{"title":"5/13/98 ONOMATOPOETIC","author":"by Patrick Jordan, edited by Stanley Newman","date":"1998-05-13","grid":"TU9MRCNTQUxLIyMjU1BBCkFHRUUjSURFQSNSRU5FVwpDUkFDS0RPV04jRUxBVEUKU0VSSUFMI0RFQ0FNUEVECiMjI0RFRVAjI0FOT0QjIwpMQUJFTCNBR0FSTiNSRUYKSURBUyNHUkFCTEUjQVhFClZBTiNCT09NQk9YI0dJTApFR0cjQUxMSUVTI1BPTEwKREVMI0xJRU5TI0RJTkVTCiMjQU1PSyMjU0VFUiMjIwpUSURJTkVTUyNMRUFTRVMKSVJFTkUjUE9QQVJUSVNUCk5BU1RZI0lST04jRUxTQQpBU0gjIyNORUVEI1NMT0I="},{"title":"5/14/98 MONKEY BUSINESS","author":"by Sally R. Stein, edited by Stanley Newman","date":"1998-05-14","grid":"QU5HUlkjU1BFQyNBTktBClNFUklPI01BWU8jTk9FTApDSE9DT0xBVEVDSElNUFMKSElHSCNFU1MjQ0FNRVRPCiMjI0VBQ0gjTFlSQSMjIwpLSVRTQ0gjV0FYI1RXQVMKRUNVI1RFTk9SI0FPUlRBCkJBUkJBUkFNQU5EUklMTApBUklBUyNLQVNFTSNUQVUKQkVORCNGRU4jVklMRVNUCiMjI1RJRUQjTUVURSMjIwpBV0FJVFMjU09SI0FDQ1QKTUFSTU9TRVRNQVVHSEFNCk9STUUjVU5VTSNHVUlTRQpTUFlTI1BPTlkjSEVNRU4="},{"title":"5/15/98 A+","author":"by Frank Longo, edited by Stanley Newman","date":"1998-05-15","grid":"U0NBQlMjQVJDUyNGUkFOCkFMR0FMI1NXQVAjUkFQQQpDQVJMQSNMQVJBI0FTUFMKU1dBTVBMQU5EUyNOQ0FBCiMjIyNTQU5EI01DQ0FMTApTV0FHI1NUQUcjSEFMTFMKVEFSTUFDI05BUkEjIyMjCkFSTUFEQVMjTUFSQUNBUwojIyMjQVJBQiNHU0hBUlAKQVdSQVAjUEFTVCNBTFRBCkNIQVJUQSNOQ0FSIyMjIwpUQU1BI01BREFHQVNDQVIKU1RBUiNBRkFSI0NMQVJBCkFMREEjTkFOQSNLQVJBVApTTEFUI0FUQUIjU1dBTlM="},{"title":"5/16/98 SATURDAY STUMPER","author":"by Brendan Quigley, edited by Stanley Newman","date":"1998-05-16","grid":"SkZLSlIjIyNLQUJPT00jCk9STkFURSMjRVRFUk5BTApCRUVHRUVTI1dIRUVMSUUKQkVFI1NMRUVQT04jRVRBCkFCTEUjWUFYSVMjQ0FSUgpORUVEUyNORUUjTUFWRU4KS0VST1VBQ1MjTU9QRURTCiMjI1VSR0UjU09UUyMjIwpDQVJBRkUjVEhFVElNRVMKT0RPUlMjRkFBI09aT05FCldBTEQjUE9ORFMjRVJURQpFTU8jRk9SR09PRCNTSVQKUklERU9VVCNXSEVSRVRPClNURVJJTEUjI09DRUxMSQojRVhBTFRTIyMjSU5TRVQ="},{"title":"5/17/98 BON VOYAGE PARTY: Items to be seen en route","author":"by Shirley Soloway, edited by Stanley Newman","date":"1998-05-17","grid":"QUxJVCMjRkFOUyNUQUxDI1NXQVNICkxBU0gjRE9OQVQjT0xJTyNNQVJJQQpFUEVFI0FOTklFI0FQRVIjRVZFUlQKQ1VSUkVOVEVWRU5UUyNSRUxFQVNFClNQRUVEIyMjRUxFRSNCVUxMUyMjIwojIyNUSUFSQSNFWUVDVVBTI09SRVMKSU5IT1RXQVRFUiMjSE9URSNGRUxUClNFRSNFQVZFRCMjU0FZUyMjR0xFRQpUQVIjRFlFI0FSTUFEQSNNQVJJTkEKT1RPUyMjTkFNRU9GI05FT05BVEFMCiMjI1RPVEFMI0FSQSNDQU5USSMjIwpGQVJFV0VMTCNNQVJUWVIjI05BUEEKSUNFTUVOI0FNRUxJQSNMQlMjTUVHClJVU1MjI1NUSVIjI1JBT1VMI09MRQpTVEVUI01BU1QjI0pBV0JSRUFLRVIKVEVUSCNBQ0VUQVRFI0xFVFVTIyMjCiMjI0VSSUtBI0RPRkYjIyNUU0FSUwpDT05URU5UI1NVUkZJTkdUSEVORVQKQUdBSU4jSURPTCNST0RFTyNOT1RFClBSSURFI01FTFQjRU5BVEUjVFVSTgpTRUxFUyNFTkRTI1lBS1MjI1NLWVM="},{"title":"5/18/98 MIDAS TOUCH","author":"by Ronnie K. Allen, edited by Stanley Newman","date":"1998-05-18","grid":"UklOR1MjQVZJRCNUSEFUCklESU9NI0dJTkEjSEVSTwpHT0xESUxPQ0tTI1JBSUwKIyMjI1RPTkVTI1dPUlNFCkJJR09UUlkjI0JFQVRFUgpBVE9ORUQjUklBTFRPIyMKR0FMRU4jTUVSWUwjRkFUCk9MRFMjQkFORVMjRUdHWQpOT0QjV0FJVFMjQlJPSUwKIyNJTUVMREEjR1JJTExFCkZVR0FSRCMjQk9VTkRFUgpBTkdMRSNTUElMVCMjIyMKS0lFTCNHT0xERklOR0VSCkVUUkUjQUxBRCNTRUVZQQpSRVNUI1BPTlkjSEVNRU4="},{"title":"5/19/98 CUT IT OUT","author":"by Norma Steinberg, edited by Stanley Newman","date":"1998-05-19","grid":"U0hBSCNQRVRTI0FDVFMjClBBTEUjRUxFRSNTTEVFUApFTExBI1NQQU4jUE9OVEkKQ0xJUEJPQVJEI0lTU1VFCiMjIyNFU1NPI0NSRUVQIwojSE9SQSNPT0RMRVMjIyMKVEFQSVJTI01PTyNIQUlHCkFMQURESU4jQkFMQU5DRQpERUxJI1NFQyNLQVZORVIKIyMjTkFTQ0FSI1NFRUQjCiNCQUdHWSNUT1VUIyMjIwpGQVJDRSNDSE9QU1RJQ0sKVVRVUk4jUk9NRSNPU0hBClJPQk9UI09ESU4jT01JVAojTkFQUyNXRUVEI1RZUEU="},{"title":"5/20/98 $$$$","author":"by Patrick Jordan, edited by Stanley Newman","date":"1998-05-20","grid":"UEVURSNTSEVBRiNTSEFECkFYRUQjSEVMTE8jTElORQpMSVBTTUFDS0VSI0FUVEEKRUxJI0FSS1MjVE9OU0lMClNFREFURSMjRlVOR0kjIwojIyNSRURFRklORSNOSVAKQVNTRVMjVklORSNBR1JBCkpPSE4jU09MRVMjR0xFTgpBUkVBI0VLRVMjU0VFRFMKUlRFI0VYRVJUSU9OIyMjCiMjUE9SVFMjI01VVEVMWQpWSVNITlUjU1RFUCNRVU8KQU5LQSNQRUFSTFNCVUNLClNUSVIjTFVSRUQjQkFSRQpUT05FI0VSSUtBI1NMRUQ="},{"title":"5/21/98 TONIGHT SHOW REUNION","author":"by Randolph Ross, edited by Stanley Newman","date":"1998-05-21","grid":"UkFOIyNUUkVBVCNBU1BTCkFCRUUjSEFSU0gjU1RBVApKT0hOTllDQUtFI1RFTEUKQUlSVElNRVMjQkVBVkVSClNMVVJQRUQjSEVER0UjIwojIyNFUFMjUkVMSUVET04KVklKQVkjREVBTFQjT0RPCkVSQVQjSkFJTFMjRVJPUwpHQVkjUEVOTlMjSVNFUkUKQVNXRUxMQVMjSU5UIyMjCiMjQVhFTFMjQU5URVNVUApJTExQQVkjSU5DUkVBU0UKQ09LRSNKQUNLSEFNTUVSCkJSRUwjQURFTEUjU09VUgpNRVJTI1JPU0VTIyNTUFk="},{"title":"5/22/98 THE GAME'S AFOOT","author":"by Frank Longo, edited by Stanley Newman","date":"1998-05-22","grid":"UEFUSFMjUFlNI1BBTlRTCklERUFMI0xFQSNBTEVVVApUT05HVUVBTkRHUk9PVkUKQU5EI0lSUyNFQVRFTiMjClNJVCNDVVQjVVJJI0FCRQojU09MRVBST1BSSUVUT1IKIyMjRVNUT1AjI0lWQU5BCkhBSEEjU05FTEwjSUxFUwpPV0VOUyMjUk9BU1QjIyMKTEVBVEhFUkFORExBQ0UjCkVERCNSQUUjR0lBI0FQVAojI0FTT1JUI0xFVCNWSUUKS0lDS1VQT05FU0hFRUxTClVOSElEI0xFRyNFTElPVApORUVEUyNERVMjUklOR1M="},{"title":"5/23/98 SATURDAY STUMPER","author":"by Ed Julius, edited by Stanley Newman","date":"1998-05-23","grid":"I1RBSiNFU1EjI0NJR0FSCkJFTkUjTElVIyNBTklUQQpBUEVSI0VOSUQjQkVHQU4KUkVBUiNNT1RPUklaSU5HCkJFUllMIyNFQkVOIyMjIwojIyNMT09TRUFTI1JFRUsKI1JFRURVQ0FURSNFRElFCk5PVFdJVEhTVEFORElORwpBU1RJI1NPSUxURVNUUyMKQkVFUyNIT0xFU0lOIyMjCiMjIyNCT05ZIyNOQUJPQgpSRVBFQVRFRExZI1BFUkUKQVZJQU4jUk9VRSNQTEFZCk1FTlNBIyNOSUwjRUFUUwpBTkdFTCMjRVNQI1JZRSM="},{"title":"5/24/98 SELLING POINTS: A number of tricks of the trade","author":"by Bob Lubbers, edited by Stanley Newman","date":"1998-05-24","grid":"UE9NRSNSSUdHI0VTVEUjTEFNRVNUCkFSQVMjRVpSQSNBTElEI0FNRUNIRQpQQU5UQUxPT04jUkVQUyNOQVRIQU4KQUNURUQjRE9HQU5EUE9OWVNIT1dTClNIRUxWRSNNU0cjR0VOT0FTIyMjIwojU0VMRVMjIyNBTUVSI0ZSRUNLTEUKIyMjQVJUI0VUUkUjI1NBRERFTkVECkJBTCNUQUJMRSNSSEVUVCMjRElORwpBTEFNTyNFTE0jUk9MWSMjQkVUVEUKSE9NRVJVTEUjUFlMRSNHRUwjIyMjClNVQkxJTUlOQUxBRFZFUlRJU0lORwojIyMjQVBFI1RBTlMjTUFTU0FHRUQKU1RBTEwjI1BPTkQjUklQI1RPT1JBClBBU08jI0NPTUVSI0VMRVZFI1JPWQpFUkFTQUJMRSMjRUFWRSNPUlMjIyMKQ0FQRUxMQSNTQVdTIyMjU1BBUlMjCiMjIyNET1NTQUwjVE9SI1NBVEVFTgpISURERU5QRVJTVUFERVIjQ0lOQ08KSU5MQU5EI1BUQVMjSUNFU0tBVEVSClNBSU5URSNBUkNTI1NVRFMjVEFEUwpTVElMRVMjTEVFUiNUUk9UI0VMRUU="},{"title":"5/25/98 THERMOMETRY","author":"by Lee Weaver, edited by Stanley Newman","date":"1998-05-25","grid":"Q0hBUiMjVEJBUiNBUEVSCkFBUk9OI1JBUkUjSUxTQQpTTEFURSNVU0FGI01BVFMKSE9UQ1JPU1NCVU4jWUVQCiMjIyNWQVQjI0VFUklFIwojVFdFRVQjUEFMTEVUIyMKU09BUiNIT1JOI0xBQ0tTClBFUk0jU1BVRFMjTU9BVApBRE1JVCNBTkFUI0VPTlMKIyNVTkFCTEUjRUFSTFMjCiNTUEVMTCMjT1JEIyMjIwpBSFMjQ09MREhFQVJURUQKSEFVTCNOT1JBI0dFT0RFCkVSSUUjRE9VUiNFQVRFTgpNRVRFI0VNTUEjI0xFTlQ="},{"title":"5/26/98 BACK TO SCHOOL","author":"by Rich Norris, edited by Stanley Newman","date":"1998-05-26","grid":"VFNQI0VBVkVTI1RJQkVUCkVXRSNDUkFDSyNIT1VTRQpQQVJGT1JUSEVDT1VSU0UKRU1NQSMjI09ET1IjIyMjCkVQSVRBUEgjU0FOQ1RVTQpTU1QjQk9PUiNUWVJBTlQKIyMjT1VTVEVEIyNFTElTCiNPRkZUSEVTVUJKRUNUIwpUR0lGIyNMSU5FVVAjIyMKQUxMRUdFI05FRUQjUlBTCkpFRVJJTkcjU1RPUkVVUAojIyMjVklBTCMjI0VUVEEKU0hPV0VEU09NRUNMQVNTCkhBVkVOI1BST1ZFI0tJTQpFR0FEUyNTRVBBTCNFTlM="},{"title":"5/27/98 WING DING","author":"by Bob Lubbers, edited by Stanley Newman","date":"1998-05-27","grid":"QUxBTiNMT0RJIyNBQ1JFClJPTUEjSVJPTiNTVE9PTApHT09TRU5FQ0sjSE9MRVMKT05TQUxFIyNTVEFORCMjCiMjIyNNQVNDI0lSQVRFUgpCSUNLRVJFUiNERUxVR0UKQVNIRVIjUE9SRUQjUk9OCkxPSU4jSEFXRUQjU0tJVApCQkMjTUVMQkEjUkVFU0UKT0FLSUVTI0FDUk9OWU1TCkFSRU5BUyNSSE9TIyMjIwojI05PTkVUIyNMSVRUTEUKQVRPTkUjRUFHTEVFWUVEClRSVUVSI0VMRUUjQU5ORQpFQVRTIyNORUVSI0xFQU4="},{"title":"5/28/98 TANDEM TV","author":"by Henry Hook, edited by Stanley Newman","date":"1998-05-28","grid":"Sk9HIyMjRkFJUiNNQUFNClVQQVQjT1BJTkUjRUJSTwpNQU1BU0ZBTUlMWVRJRVMKUExFWFVTIyNURUFSR0FTCiMjI0lOVEhFI1ZNSSMjIwpDT0FDVCNBTEdBI0NBVCMKT1NDQVIjUkVJTlMjSVdPCkNPTUJBVE1BU1RFUlNPTgpBTEUjUEhPTkUjU09MRUQKI0VTUyNFTk9MI1NVRU1FCiMjI0FTSSNSRVNJTiMjIwpBR0VOVE5OIyNUT0RBVEUKUk9VVEVTU09NSU5VVEVTCkFHUkEjT1RIRVIjUE9OUwpCT09TI1NIT1cjIyNaT08="},{"title":"5/29/98 RE: PAST REPASTS","author":"by Patrick Jordan, edited by Stanley Newman","date":"1998-05-29","grid":"SkFXUyNNT09SRSNGQVNUCkVWQU4jQVBSSUwjQVNUTwpET1lPVVJFQ0FMTFdIRU4KSU5OI0ZJTkFMI0VORU1ZCiMjRVJPU0UjI0lWRSMjIwpCQVNFI0FESU5ORVJXQVMKRUxCQSMjI05JS0UjQUJFClNMT1AjQVBUTFkjU1RZWApFQVIjSUNFUiMjI0xFU0UKVEhPVUdIVE9VVCNBUk1TCiMjI1BMWSMjUFJJR1MjIwpST0RFTyNBVFdBUiNQVEEKQU5ETk9UVEhBV0VET1VUCk1FQUQjU05BUkwjSlVOTwpQQVlTI1BPTkRTI1NURVA="},{"title":"5/30/98 SATURDAY STUMPER","author":"by Rand H. Burns, edited by Stanley Newman","date":"1998-05-30","grid":"QkFTIyNTQUdFUyMjUkFNCllJTiNERVRFTlRTI0VHTwpQUkVUQVBPUlRFUiNHSVMKQUxBU0tBTk1BTEFNVVRFClNJS0gjTElBTkEjQ0xBWQpTS0VJTiNBTkcjU1BBVEUKI0VSUk9SI1NMSVQjUkVECiMjI1RPVUdIRU5VUCMjIwpJU00jTkVSTyNTVE9BVCMKU1RBUlMjRVJTI1pPTkVECkhFUkIjQkVUSFMjUkFOSQpNRVhJQ0FOSEFJUkxFU1MKQUxJI0lORkFOVFJZTUVOCkVJUyNTQUxJTkVTI0lTRQpMRVQjI0xZUkFTIyNDVFk="},{"title":"5/31/98 ON THE ROAD AGAIN: Remembering a classic movie series","author":"by Henry Hook, edited by Stanley Newman","date":"1998-05-31","grid":"U1BJUk8jQURBTk8jSEFTQVQjR0FUCkhBU09OI0JFR1VOI0FSTklFI09CRQpJU0hPVCNOQU9NSSNMTEFNQSNCUkEKSU1PSyNCRU4jQk9CRk9SQVBQTEVTClNPVSNTVVIjVEVOQSMjRVRBTElBRQpNSUxMQVkjRk9SI1JDQSMjUklOS1MKIyNERUwjVE9QSUMjT1BJQVRFIyMjCiNXSEFUQ0FORk5BQ1JPU0JZI0xPVwpCT08jV0FMRE8jU1VOREFZI0xBRFkKRVVQSE9SSUEjTFVSRSMjRU5FTVlTCkZMRUVSI0FTU0FJTEFOVCNBQ09TVApBRE5BVEUjI1VQU1kjQVJFVEhVU0EKSUdPUiNDT1NTRVQjU0lFUEkjUkVOClJPVCNKVVNUQUxJVFRMRURPVFRZIwojIyNEVVNUSU4jQ1VSRUQjTkVPIyMKTFVDSUQjI1JCSSNSQUQjQ0FZVUdBCklOQU5JVFkjI1NBTkQjR0FMI0pFVQpCSU5HQ0hFUlJJRVMjSkVEI1BPTkQKQk9OI0lPTklBI0FQUk9OI1RSVUVSCkVOTyNBTFRPTiNFSUVJTyNIRVJWRQpSU1QjTEVBU1QjQVRTRUEjRVNTQVk="},{"title":"6/1/98 POET'S CORNER","author":"by S.E. Wilkinson, edited by Stanley Newman","date":"1998-06-01","grid":"TE9TUyNSQUpBI1BTSEFXCklOQ0gjQVBFWCNBSE9MRQpORUFSI1pFQUwjUllERVIKS0lCSVRaI05FU1QjR0VFCiMjI1ZPTFRTI0hPTUUjIwpTQ0hFTUVSIyNJTkFQSUUKQ09PTCNET0FMTCNQT0RTCkFMQyMjQVZBSUwjI0RPVApMT1VEI1pFU1RZI09HTEUKRVJTQVRaIyNVU0VMRVNTCiMjUEhJTCNBUEhJRCMjIwpHVE8jUEVBTCNBTlRFVVAKUkVDQVAjR0lMTCNJTkdFCklOVVJFI0VWRUwjTUlMTApQT1NFRCNERU5ZI0VESVQ="},{"title":"6/2/98 HOME SWEET HOME","author":"by Lee Weaver, edited by Stanley Newman","date":"1998-06-02","grid":"U0VXUyNQQUNFIyNZT1JFCkNMQU0jRlVSTFMjRU1JUgpPU0xPI0NMT1RII0FOVEkKV0FMS1MjRE9PUlBSSVpFCiMjRkVUQSNLTkVFTCMjIwojRkxZSU5HIyNEUk9XU1kKSUxPI1JJTEVEI1VOSVRFClRPV1MjTEVWRUwjR05BVwpDUkVFTCNOQUJPQiNEUlMKSEFSTEVNIyNUT1JTT1MjCiMjI0xFRUNII01FT1cjIwpGTE9PUlNIT1cjRE9TRVMKTFVMVSNBVUdFUiNUSEFJCkFCRVQjU1RBTEUjSE9TVApLRUdTIyNFTkRTI0VQRUU="},{"title":"6/3/98 NATIONALISM","author":"by Fred Piscop, edited by Stanley Newman","date":"1998-06-03","grid":"TUFDQVcjQ0hFVCMjQUdPCkFCQVNFI0VVUk8jQVJJRApUVVJLRVlUUk9UI05BVkUKRVNURSNFRUxTI0lETEVSCllFU0RFQVIjI0lETyMjIwojIyMjQ0hBREVWRVJFVFQKRElUVE8jI1VORUFSVEhTCklUSEUjU0VFRFMjQVJFQQpTQ0FOVEVTVCMjU05FRVIKQ0hJTkFDTE9TRVQjIyMjCiMjI1lSUyMjQ0xFQVJFUgpDUlVTVCNGT0FMI0NPTEUKUkVOTyNCVVJNQVNIQVZFCk9OSU4jQVNBUCNQT1JFUwpQRVQjI0dFTFMjRk9TU0U="},{"title":"6/4/98 TREES COMPANY","author":"by Frank Longo, edited by Stanley Newman","date":"1998-06-04","grid":"Q1JBQiNCSURFI0xVQkVECkhPU0UjSU5PTiNBVE9ORQpJRExFI1NURVIjUkFaT1IKTEVBRlNUSFJPVUdIIyMjCkxPTiNPUkUjTEdFI0JCUwojU1RPUE9SSUxMU0hPT1QKIyMjQVNTRVMjSVRBTElBCkVXT0sjI0RJRyMjVk9MVApTQU1VRUwjTk9UUkUjIyMKU1dJTU1JTkdUUlVOS1MjCkVBVCNQUk8jQUlEI09FUgojIyNCUkFOQ0hSSUNLRVkKUVVFVUUjQUxFRSNST1NBClVTRVJTI01BQU0jT01BTgpFQVJOUyNFTkRFI1dPV1M="},{"title":"6/5/98 LA-LA LEADERS","author":"by A.J. Santora, edited by Stanley Newman","date":"1998-06-05","grid":"QUhBVCMjUkFFI0RBVUJTClNFTk9SI0FUViNPUkxPUApOSVRSTyNDTEVPUEFUUkEKSURPI1NDSUVOVCNCUkFUClRJTkFTSU5BVFJBI0FYRQojIyNSSUdHUyNBU0NJIyMKUkFOSSNBQ1RII1RBU1RFCk9MRVNUUkEjQURBU1RSQQpLWU9UTyNSQVJFI0VTQVUKIyNOQU5TI0lETEVSIyMjClJBVCNJTlRSQVZFTk9VUwpJREVBI0FSSVNFUiNBUkkKVEVUUkFHT05TI0lPVEFTCkFQUk9OI0xHRSNFVkVOUwpTVEFORCNMU1QjI09ST1k="},{"title":"6/6/98 SATURDAY STUMPER","author":"by Ed Julius, edited by Stanley Newman","date":"1998-06-06","grid":"U1FVSVJUUyMjI1NUSVJTCkNVUENBS0UjUEFUSU5BRQpBRVJBVE9SI0VET01JVEUKTEVBTkVTVCNOQU1FVEFHCkFOSU4jIyMjSU1QI0lURQpSRVNPVyNWRVRTIyNBQVIKI0RFVFJPSVRFUlMjTFRTCiMjIyNBTlRPTklPIyMjIwpBQ1QjUEFJTlRCUlVTSCMKTUFIIyNTQVNTI0FQVEVECkFQRSNBUFQjIyMjU09MRQpTRU1JUFJPI0FOQVRPTEUKU01BU0hFUiNQT01BREVECkVBUkxJRVMjVFdPVE9ORQpEWUtFRCMjI1NJUkVORUQ="},{"title":"6/7/98 PERFORMANCE PEOPLE: Folk songs, films, etc.","author":"by Lois Sidway, edited by Stanley Newman","date":"1998-06-07","grid":"UkVBRCNTQ0FUI0dJQkJTI0FUSE9MCkVSTEUjUEFQQSNTTFVSUCNTSE9ORQpTQUxMWUlOT1VSQUxMRVkjSEVNRU4KRVNTI0FSSVNUTyMjTEFTSCNCRVNTCk5VVCNMRU5UI1dISVNLI1VTTyMjIwpUUkFERSNFTE0jQUxFUyNNQVlEQVkKU0VSQSNJU0VFI1JPWSNBQlVTSVZFCiMjI01FUiNTVFJPVkUjQkVUSURFUwpQUkVTVE8jI0hPTEUjU0lSRU4jIyMKQUVHRUFOI0NPTEQjR0VOVCNUQVBTCklOQUxMI0xBRFlJTlJFRCNTSFJFVwpMT05JI0hJUFMjTkVJTiNJSEVBUkEKIyMjTkVPTlMjRElBTCMjRE9CQklOClNBUkRJTkUjRkVUVExFI0RPQSMjIwpUUkFJTkVSI0xBQSNFWFBPI05FRFMKUEFVU0VTI01BTEwjU0FMI0FETUlUCiMjI1ROVCNBVFRZUyNNT01TI0JTQQpUSEVSI1lFU1QjI1VOSVRBUyNSUEkKRUVMRVIjVEhFTUFOSU5USEVNT09OClNBTFNBI0NJTkRZI0JFRVIjUklTRQpTTEFTSCNIRVNTRSNTRVJFI1NMRUQ="},{"title":"6/8/98 THIS AND THAT","author":"by Fred Piscop, edited by Stanley Newman","date":"1998-06-08","grid":"UkFNUCNCUk9PTSNMSUFSClVMRUUjQUVUTkEjQU5USQpOT1dBTkRUSEVOI0lTSVMKVEVMTEFMSUUjRE9OQVRFCiMjIyNET0UjTUFWRU4jIwpBU0hQSVQjVEFUSSNERUUKU0hJRVIjUE9SRUQjT0FUCllFR0cjQ0FOSVMjSFVHSApMQUgjVE9URU4jVElUTEUKQVJBI0FDVFMjQ1VTU0VSCiMjTkFOS0kjQ0FOIyMjIwpVUERJS0UjQVJSRVNURUUKU09MUyNZSU5BTkRZQU5HCkVDT0wjRVZPS0UjTklUQQpST1dFI0RZTkVTI0NMT0Q="},{"title":"6/9/98 AVENUES OF SUCCESS","author":"by Rich Norris, edited by Stanley Newman","date":"1998-06-09","grid":"TE9CRSNUT1BTI0FTU0VUCkFUSVQjUkFTSCNQVVJFRQpTSEFII1VSU0EjSU1BR0UKU0VTQU1FU1RSRUVUIyMjCklSRU5FIyMjREVDT0RFUwpFU1MjVEhBVyNSRVRJRVMKIyMjI09BU0lTIyNBTk5FCiNHQVNPTElORUFMTEVZIwpOQVJDIyNURU1QSSMjIyMKRUxNT1JFI0RJRU0jT1NTClRBU1RFUlMjIyNCQVRIRQojIyNGTEFNSU5HT1JPQUQKT1BFUkEjRURJRSNDT01BClJJTEVZI0xFTlQjRUxBTgpHQU1FUyNMQU9TI0RFTlM="},{"title":"6/10/98 KNOCKING AROUND","author":"by Frances Hansen, edited by Stanley Newman","date":"1998-06-10","grid":"Q0hFQVQjQ0hBUiNTTElNCkNBUFJBI0hFUkEjVFVCRQpDUklNSU5BTENIQVJHRVMKUEVDI1dBU1AjI1ZFU1RTCiMjI1dBREUjSE9FUyMjIwpNQU5BTkEjVE9XTlNISVAKQU5JTiMjQVJSQVUjQVJFCkdJVkVTQUJBRFJFVklFVwpJVEUjUFJJQ0UjI0lHTkkKQ0FOQUlMTEUjQkFTU0VUCiMjI0VOT0wjUE9MRSMjIwpBV0lTRSMjUElNQSNBQ1QKU0hPT1RTVEhFQlJFRVpFClNPQVAjU0tJVCNNT1JBTgpUQU1TI0hPTFkjU05PUlQ="},{"title":"6/11/98 GNOME MAN'S LAND","author":"by Bob Lubbers, edited by Stanley Newman","date":"1998-06-11","grid":"QVBFRCMjQ1JPUCNQUk9QClJBTlVQI0hJVkUjTEVOQQpDUkFNUyNBR0VSI0FERU4KSE9CQklURk9STUlORyMjCkVMTCMjT0VSIyNMRVJPWQpTRUVTQVdTI0FDRVRBVEUKIyMjSVRFI0FJTCMjVk9OCiMjVFJPTExCUklER0UjIwpFQ1UjI0VFRSNOQVkjIyMKVEhSRUFEUyNTVFlNSUVECkhJTkRVIyNCT08jI01SSQojI1BJWElFTEFOREJBTkQKRU1JVCNEUkFQI1JJR0lECk1BS08jRUlSRSNTVEVFTApQRUVSI0FDRUQjI0VSU0U="},{"title":"6/12/98 UNDER WRAPS","author":"by Frank A. Longo, edited by Stanley Newman","date":"1998-06-12","grid":"TUFTSCNCQVNIIyNJQklECkFQUEVBTFNUTyNPU09MRQpDSEFSR0VTQVQjTEFYRVIKSElEREVOQUdFTkRBIyMjCk9ERSMjRFlFI0FTQ09UUwojIyNJQ0kjI0lUVCNQUkUKI0xBQ09ORklERU5USUFMCkFJUkVSI09SRSNJT05JQQpCRVNUS0VQVFNFQ1JFVCMKRUdPI1NTUyMjU0tZIyMjClNFTkVDQSNFU1MjI0FMSQojIyNQUklWQVRFTElWRVMKSkVTU0UjQVRBTllUSU1FCkFMTE9XI1NVQ0NFU1NPUgpST09NIyNBUElFI0FPTkU="},{"title":"6/13/98 SATURDAY STUMPER","author":"by Raymond Hamel, edited by Stanley Newman","date":"1998-06-13","grid":"Q0FMQyNDUlVTVEFDRUFOCkxJRVUjSEVNT1JSSEFHRQpFUlRFI0FQUExJQ0FUT1IKQUxJI0JJU1NBVSNCSU5ECk5FVEhFUiMjI05PTFRFIwpTVFJFQU0jQklFUkkjIyMKSVRJTiNFTUlSI0lTQUFDCk5FRCMjTklTQU4jI0ZEUgpHUkVDTyNOT05PI0NPSE8KIyMjT1JSSU4jQkFSUkVTCiNIQVJURSMjI0xJVEVSUwpIRVNTI1NPUlJFTCNTRVcKQU5USUJPRElFUyNSQU5JCklOT0NVTEFURVMjUElDUwpHQVJBR0VTQUxFI0lERUU="},{"title":"6/14/98 FIND THE GUYS: Featuring quite a few useful articles","author":"by Fred Piscop, edited by Stanley Newman","date":"1998-06-14","grid":"RURBTVMjQkVBRCNDTEFTUCNBUFRTCkNBTk9FI0FSVU0jQU9SVEEjTUVPVwpPTlRIRUZSSVRaI0xPTUFOI1BBUkUKIyMjQU1BVENII05JUElOVEhFQlVECklGRklFUiNIT0JPI0hFUyNBUk9TRQpET09SRElFI1JPTkRPUyNBQ0UjIyMKRVJPUyNORUcjUkVBTCNQUkVTU09OCkFNVCNCQUxMSU5USEVKQUNLI1BSTwpMQVRFUiNTVVJGIyNTQVNII0NBUkIKIyNIQVlTI1RBUkFTI1NURU1BUklFClRJRVRBQ0sjU0VUQVQjRVJPREVOVApBTEJBTklBTiNFTUJBUiNTVEVUIyMKUkVJVCNBUklEIyNPQ0hTI0VUSElDCkVOTCNTVEFURU9GVEhFQVJUI0VOTwpERUxJTUlUI1ZJTEUjQVlFI0dSQUQKIyMjTkVDI01BREVVUCNTSEFST05BClNLT0FMI1BBTCNDUk9DI0FOT0RFUwpQQVNTVEhFQlVDSyNQUkVTVE8jIyMKQUxPVCNPTkVBTCNUT0VUSEVNQVJLCkRFTEUjWUFMVEEjUlVTVCNFRVJJRQpTTEVXI0FMTEVZI0lUU0EjRFJFQVI="},{"title":"6/15/98 GONE FISHIN'","author":"by Lee Weaver, edited by Stanley Newman","date":"1998-06-15","grid":"VFNBUiNCRUFUI0NFREVTCk9MR0EjUkFSRSNFTUFJTApXQVJOI0VSSUMjUklOR08KI0JBSVRBTkRTV0lUQ0gjCiMjIyNPREUjI0FTU0VUIwojQk9SREVSTElORSMjIyMKUkVSRUFEI09SRSNTVEFCClRFRU5ZI1NQQSNVVElDQQpFUkdPI0NFRSNPUkFURUQKIyMjI0RPV1NJTkdST0QjCiNTQ1JBTSMjU1RFIyMjIwojSE9PS0FORExBRERFUiMKQ0FOVE8jRVlFUiNVS0VTCkFSR09UI0FOVEkjS0VOVApUSUFSQSNQRVNPI0VERFk="},{"title":"6/16/98 REPTILIAN","author":"by Rich Norris, edited by Stanley Newman","date":"1998-06-16","grid":"UkFGVFMjU0NBTEEjV0FTCkVGTEFUI0hPUkVCI0lERQpDUk9DT0RJTEVEVU5ERUUKIyNDT1dBUkQjI1RSRVNTCkFTSyMjVEVTTEEjQVNUSQpERVNLUyMjI0FCQSNURU4KRU5UQUlMI0FNQVNTIyMjCiNUT1JUT0lTRVNIRUxMIwojIyNMRUZUUyNIRVJBTEQKT0FLI1NUQSMjI1NBTUJBCkZSQVkjU0xBVEUjI0lTSApGRVJBTCMjQ0FSRUVOIyMKU05BS0VJTlRIRUdSQVNTCkVBVCNUQUJPTyNBTFRPUwpUU0UjU05BUkUjREVFRFM="},{"title":"6/17/98 BIG FOUR","author":"by H.R. Lyle, edited by Stanley Newman","date":"1998-06-17","grid":"UElDSyNDQVJFVCNTQ09UCkVSSUUjQURPUkUjVE9NRQpTT05HQU5EREFOQ0VNQU4KT05FI0JJTEUjI09WRVJUCiMjTUFJTkUjR1JFRUQjIwpDSEFTVEUjQlJBRCNJQ0gKTFVDSUUjQkFJVFMjQUFBCk9SRVMjQ1JFTUUjU05JVApTT0wjQ0xBUkUjRklCUkUKRUtFI1JVTlMjQkFST05TCiMjQlJFRUQjQ0FMRUIjIwpTQ1JJUCMjT0FUUyNIT0UKUEFJTlRJTkdUSEVUT1dOCkFSVFMjTUVMRUUjQVBFRApSQVlFI1BFRVJTI01FU1M="},{"title":"6/18/98 STRIKE UP THE BANDS","author":"by Patrick Jordan, edited by Stanley Newman","date":"1998-06-18","grid":"UEVDSyNCQUxNIyNUU0FSCkFDUkUjQVNFQSNCVUVOTwpTSEVSRUtIQU4jRURFTlMKVE9XTklFI0RFUExPUkVTCiMjI0VSUlMjI0hPUlMjIwpUQUJMRSNIRVJPTiNVR0gKRVJBUyNTQVdJTkcjQ09PClBBUiNTVFJJUEVTI0tJTgpFQkIjQ1JPTkVTI05FTkUKRVlFI0hBTkdTI0JVUkdTCiMjUk9PRiMjVEFSQSMjIwpOQVBPTEVPTiNSQU5DSUQKQUxPSEEjQ0FORFlDQU5FClRJTEVSI0hJUkUjRUdHUwpTRUVEIyNPUkFOI1NFRUs="},{"title":"6/19/98 MIXED BREEDS","author":"by Cathy Millhauser, edited by Stanley Newman","date":"1998-06-19","grid":"R1JBWkUjT0xJTiNGQUNUCkFVUkFTI1hFTkEjSURMRQpTSE9QUElOR0NFTlRBVVIKUFJPUCNSQVNII0FOR0VSCiMjI0lHT1IjI1NQRUVEWQpGQVVOQU5ER0FNRVMjIyMKTFVOR1MjI09TVSNTSEFNCklESSNIT1NUQUdFI0VDTwpQSVRBI0JBSCMjWUFMVEEKIyMjUEVFV0VFTUVSTUFOCkFTVFJBWSMjTU9TUyMjIwpTSE9PUyNUQVBBI0VVUk8KSEFSUFlXQUxMQkFOR0VSCkVMTU8jT1JFTyNISUxEQQpTRUVTI1dBWFkjU0NJT04="},{"title":"6/20/98 SATURDAY STUMPER","author":"by Fred Piscop, edited by Stanley Newman","date":"1998-06-20","grid":"U1RBVEVWSVNJVCNIVVJUCk1JTlVURVJJQ0UjT05FUgpVTk9SREFJTkVEI1ZJTEUKVEVOTiNMRFMjI1NFVElOCiMjI1BDUyMjQVRUUkFDVAojUEhJTCNNSU5FTyNSRUwKQ09PS0UjRU5URVIjSU5PCk9UVEVSI0FOSSNBVkFTVApMQVQjTUFOSUMjQklORVQKT1RBI09CSUVTI0xPU1MjClJPTUFOQ0UjI0NFTCMjIwpJQ0FOVCMjQUFBI0FDUkUKWkFMRSNVU1VSUEFUSU9OCkVLRVMjUEhFTk9NRU5BTApSRVNUI1NFUkVOQURFUlM="},{"title":"6/21/98 FAMILY REUNION: A pleasant gathering of the clan","author":"by Daniel R. Stark, edited by Stanley Newman","date":"1998-06-21","grid":"SEFMUyMjQkVFRiNMQUNFI01JTUlDCk9ESUMjQVVUUlkjSURPTCNJTE9OQQpGQVRIRVJDSFJJU1RNQVMjR0xBTkQKIyMjTElDS1MjI0hVSVQjVFJVIyMjCkFTU0VOVFMjQ0hBUlQjQlJBTUJMWQpUQUlQRUkjUlVJTkcjRkxBTkVSSUUKQklTIyNDSEFSTEVZU0FVTlQjT05BCkFMVE8jI0lDRVQjI0FWRUMjU1RBUgpZU0VSI0VSSVMjUkVEQVRFI0lIUkUKIyNSRVVORVMjU0lHSCMjI1NURUlOCkFWTyNOT1JNQU5DT1VTSU5TI1JBRApGSUZFRCMjI01JRU4jRU1CUllPIyMKUk9NWSNURU1QVFMjQVJQQSNFUk1BCkFMRUUjRU1JTCMjQUxBRSMjU0NBUgpNSVIjVU5DTEVXSUdHSUxZIyNIVU0KRVNDQVBFRVMjQVJFQVMjQUNUSVZFClNUWVJFTkUjU1RPUkUjVU5BSURFRAojIyNPTlMjVEhFTiMjQU5HU1QjIyMKU0FMVUQjRkFJUllHT0RNT1RIRVJTCkVSQVNFI0VMTEUjQUxJRU4jRUxJRQpUQU1FRCNXSUxEI0RFTlQjI1NMQVc="},{"title":"6/22/98 JOINT VENTURE","author":"by Mark Moldowsky, edited by Stanley Newman","date":"1998-06-22","grid":"TE9TRSNTSEVBRiNTQUdTCklTTlQjVEVBU0UjVFJVRQpGTElDS09GVEhFV1JJU1QKVE9QI0FSVFMjI0hFQVRICiMjI0VMTVMjQlJJRSMjIwpIQUxTRVkjRkFJTlRFRCMKSURFQSMjQlVUVEUjTUlUClNIT1VMREVSSEFSTkVTUwpTT04jQUlTTEUjI0lOQ0EKI0NBU1RMRVMjQ0FORE9SCiMjI1BFTFQjQ0FORSMjIwpBVEhPUyMjU1VOSyNDUEEKU0hPT1RGUk9NVEhFSElQClBBUksjQVVESU8jR0FURQpTV0FZI0RFQU5TI09OWVg="},{"title":"6/23/98 IRE EDUCATION","author":"by Richard Silvestri, edited by Stanley Newman","date":"1998-06-23","grid":"QkFCQSNTQUxFI0FGVE9OCkFNQVMjRVZJTCNESUFORQpUSUNLRURPRkYjT0dERU4KT05PI0xBTkUjSU5IQUxFCk5PTkZBVCNSRUxJVCMjIwojIyNJVEVNI1ZJU0lUT1IKVEFTVEUjSURFQSNOT1ZBCkFCRVQjQU1FTkQjR1JBRgpPTEVPI0xPT1QjU01FTFQKU1lNQk9MUyNTQUxBIyMjCiMjI0VMSUFTI0JBREdFUgpTVEFURU4jQU5PTiNBWEUKQ0lMSUEjV1JPVUdIVFVQCkFMR0VSI0VHT04jQk9ERQpSRUFEWSNCRU5EI09SRUw="},{"title":"6/24/98 MEET THE BUMSTEADS","author":"by Fred Piscop, edited by Stanley Newman","date":"1998-06-24","grid":"VEFEQSNUSUtJI1JBQklECklHT1IjT0xFRyNFTEVOQQpORVdZT1JLUFVOS0JBTkQKIyNOQU0jI1RBT0lTVCMjCkFTSU5JTkUjTk9OI1NJVApNT05TVEVSU0FORFdJQ0gKUE9HIyNSQVQjI0xBVEtFCiMjI1BST1RFU1RFUiMjIwpPQ1VMTyMjQVBFIyNTT1AKRkFNT1VTQU1PU1RSRUFUCkFMUCNMRUQjVEhSRUFUUwojI1RXRUVaRSMjT0FTIyMKU1dFRVRNSVhFRERSSU5LCkFSRU5UI05JR0gjRURJRQpMWU5ERSNHVE9TI0RFS0E="},{"title":"6/25/98 RARE LETTER PAIR","author":"by A.J. Santora, edited by Stanley Newman","date":"1998-06-25","grid":"T0dMRUQjUkVNI0xBS0VSClBMQU5FI09SWSNBTElORQpRVUlaU0hPV1MjREVCVFMKUkVOTyNFTUlUI0FGSVJFCiMjIyNCTElOSVMjI1RFVApTVUlDSURFU1FVRUVaRSMKQ1JPT04jIyNVTVBTIyMjCkhJU1BBTk8jRVBJVE9NRQojIyNTVE9QIyMjQ0FSQVQKI1FVRUVORUxJWkFCRVRIClRVRyMjVVJBQ0lMIyMjIwpXSUxNQSNBTkFUI01BUkMKSUNJRVIjVEFSSVFBWklaClNIRUlLI0lUVSNFTk9MQQpURVJOUyNDRVMjRElWRVI="},{"title":"6/26/98 ALLEN'S ALLEY","author":"by Charles E. Gersch, edited by Stanley Newman","date":"1998-06-26","grid":"I1RIRVdBVEVSI1dIQVRTCk1JQUZBUlJPVyNJT05JQQpSRVNUSVZFTFkjUkFOR08KRU1QI0xBQkkjU1lSSUUjCkRFU0kjREVBVEgjREVSRQojIyNTT0FLI1JPWiNITEQKI0RTT1MjI1NJVEUjQUlECkNBSVJPI0RBQiNMT0xMWQpBTkQjTElBTSMjSURMWSMKRU5DI0VSWSNNQUdJIyMjCk5ZQUQjQVNQRU4jTkFTSAojUkVJRFMjTEFEWSNVVEEKVE9TQVkjTUFOSEFUVEFOCkFTQU5FI0lOVEVSSU9SUwpNRVJFUiNTVEFSRFVTVCM="},{"title":"6/27/98 SATURDAY STUMPER","author":"by Daniel R. Stark, edited by Stanley Newman","date":"1998-06-27","grid":"U1BBUiMjIyMjQ09CQkxFCkFVR0VSIyMjQ1VSSU9VUwpCUlVERVIjU0FMSUVOQ0UKQVJJT1NPI0FSVEVSSUFMClRJTFNJVCNQT1VOQ0VTIwpPTkVJREEjT1VTVEVSIyMKI0dSRUVURVJTIyMjIyMjCiMjQVJERU4jQUJCT1QjIwojIyMjIyNDT0xMQVRFUyMKIyNIRVNUSUEjRU5UUkVFCiNUQU5LRVJTI0FET1JFUgpDT05WSU5DRSNUQU1BUkEKT1JESU5BTFMjU05BUkVTClNJTEVOQ0UjIyNBTklTRQpUSUVEWUUjIyMjI1NBU1M="},{"title":"6/28/98 CINEMATIC SELECTIONS: A true genre piece","author":"by Bob Lubbers, edited by Stanley Newman","date":"1998-06-28","grid":"Q1JBVEVSI0FUQSMjI0JCQyNUQU1TClJPTUFOTyNMVU1QI0FSRUEjU0NBTQpFWFBMT0lUQVRJT05GSUxNI0VUUkUKU0lMT1MjRU1VI0xBQkVMRVIjSURBClRFRU4jRlJPI0VMTSNGSUxNTk9JUgojIyNTT1VSIyNHRUUjIyMjU09OIyMKUEdTI0NSQVNIQU5EQlVSTiNUQVIjClNVQ0hBUyNUQUQjI1RSRUFEI0RPVApDQVJBVCNDSUQjTU9VTlRJRSNWT08KI1RFTSMjQUNUU09OIyNBTENIRU1ZClNFV0VSI1NIT09URU1VUCNLQU5FUwpFTUJMRU1TIyNBRVJBVEUjI0lUVCMKTUFBI0JBSVRFUlMjSVRTI0ZMVVRFCklMTCNBUk5JRSMjSU5FI1NFRVJFRAojQUxTI0NJTkVNQVZFUklURSNFU1MKIyNDT04jIyMjQUJBIyNOQVRFIyMjCldIT0RVTklUI1JBTiNBTFQjREFNRQpST00jQk9NQkFTVCNBUkEjQUlNRVIKSVRFTSNTUEFHSEVUVElXRVNURVJOClRFRFMjRUVSTyNEQVRFI1NURUVMRQpFTFlTI0VMUyMjI0JVUyNQQURSRVM="},{"title":"6/29/98 MAKING UP","author":"by Rich Norris, edited by Stanley Newman","date":"1998-06-29","grid":"U1BPUlQjUExPUCNDQUxGCk5JVkVOI1JPREUjT0RPUgpPQ0VBTkxJTkVSI1JJRkUKQkFORyNJQ0VTI09ERVRTCiMjI0FURklSU1RCTFVTSApHUkFOSVRFI0FMSUUjIyMKUkFXI0VTU08jQ0VTU05BCkFUT1AjI1RWUyMjU0xPVwpCRUxPTkcjQVBQVCNBUEUKIyMjUEFSRSNBUlJJVkVECldISVBQRURDUkVBTSMjIwpIQVJFUyNXSVJFI1BFQVIKRUdBRCNCQVRPTlJPVUdFClRVVFUjQlJFVyNFUlJPTApTRUVQI0FERFMjU1RPR1k="},{"title":"6/30/98 RINGERS","author":"by Bob Lubbers, edited by Stanley Newman","date":"1998-06-30","grid":"Q0FMSUYjQUdORVMjTFNUCkFWSUxBI1NFRVJTI0FIQQpCRUxMQ0FQVEFJTiNZRVQKIyMjU1RSSUFURSNTVVJFCkFMUCNPQVIjI1NBUFBFUgpCT0FUI0JFVFMjQlVTRVMKTFVHT1NJI09JTEVSIyMjCkVURVJOQUxUUklBTkdMRQojIyNSQU5FRSNBTUVMSUEKU1RFRVIjT01OSSNEQU1TCkNPUk5FQSMjT1NBI0RBWQpBTUFUI0NMQU1PUlMjIyMKTEFTI1RIRUdPTkdTSE9XCkVURSNSRUZFUiNVVElMRQpST0QjRVNURUUjRVNTRVM="},{"title":"7/1/98 UNDER PRESSURE","author":"by Brendan Quigley, edited by Stanley Newman","date":"1998-07-01","grid":"SlVSSVNUI1JPQyNDSEFSCkFSSVNUQSNPVUkjSE9NRQpJTkRJQU5DT1JOI0VWQU4KIyMjVElHSFRTUVVFRVpFCkNIQSNETEkjIyNTQ1JFVwpORVNUTEVDUlVOQ0gjIyMKT05LRVkjI0hBSUcjTUFEClRSSVgjV0hPUkwjQk9OTwpFSU4jSk9BRCMjQVJHT04KIyMjVEVFTkFHRUNSVVNICkFGT09UIyMjTk5FI0xFTwpTVU1NRVJTUVVBU0gjIyMKU1RBVCNDT1VTQ09VU0VTClRPTkkjUEhJI1RVTEFORQpTTklUI1RPUCNTVEFZT04="},{"title":"7/2/98 HIDDEN GREEKS","author":"by Bob Carroll, edited by Stanley Newman","date":"1998-07-02","grid":"UEFMTUEjTVVTVCNIQUNLCkFURUlOI0FTVEEjT0dSRQpTTEFORyNTREFLI01PQU4KSEFOREVMVEFQRSNFR0dTCiNTVFlMRSMjTElORyMjIwojIyMjU05JUEUjQ0FOSVQKQVZJViNPUkUjVE9NQVRPClNJTkUjUkFOQ0gjRVZFTgpUT05HVUUjTk9SI1NZTVMKT0xTRU4jUEFOSUMjIyMjCiMjI1RTQVIjI0xPVFRBIwpPU0hBI0ZJTkFMUEhBU0UKQUhBQiNJWk9EI1BFQ0tTClRPSUwjUkVORSNFUklFUwpTT0xFI0VERU4jUkVUUk8="},{"title":"7/3/98 CROSSING STATE LINES","author":"by Thomas W. Schier, edited by Stanley Newman","date":"1998-07-03","grid":"REFOUyNTTFVTSCNDVVNTCkFMRUMjQ1VSSU8jQVRPUApJT1dBTUFJTkVORVZBREEKU1RZTEVUUyNHQUxBSEFECiMjT0REIyNQRU5VTFQjIwpPQVIjVVJHRSMjTElFTiMKVFNLI1NPVVJDRSNFWEFNCklORElBTkFDT0xPUkFETwpDQUVOI0FNQVRPTCNTSUMKI1BMRUEjI0xFTkQjT1JLCiMjQUROQVRFIyNJU1IjIwpCRVdJVENII1BBU1RFTFMKQUxBQkFNQU1JQ0hJR0FOCkNBUkwjRU5PQ0gjUE9VUgpLTkVFI1NLSUVEI0VORFM="},{"title":"7/4/98 SATURDAY STUMPER","author":"by Ed Julius, edited by Stanley Newman","date":"1998-07-04","grid":"I1RSSSNUU0FSI0FMT05FClNIRVAjSEVMSSNUQVBJTgpURVRFI0VQSUMjT1ZFTlMKRVJJQyNDVVRFI1BBUkVOClBBUkFTT0wjIyMjI0VUQQpTUEVDVEFDTEUjTUFURVIKIyMjI0FTSEVOI0VTVEVFCkdSRUVLVFJBR0VESUFOUwpPVU5DRSNBVklMQSMjIyMKU1RPT0QjTEVORExFQVNFClNBTCMjIyMjRU9TSU5FUwpBQkFTSCNDSEVSI0ZPUlQKTUFHT08jSE9SQSNGSVZFCkVHQU5TI0FCRUQjRU5PUwpSQVlFUyNET0RPI0xUUyM="},{"title":"7/5/98 ALL IN THE FAMILY: A certain biological family","author":"by Shirley Soloway, edited by Stanley Newman","date":"1998-07-05","grid":"VEFNIyNBUEFSVCNKSUJFUyNNQVJLCk9NQVIjTk9TSVIjRUxFTkEjRUxFRQpSQUtFI09SQVRFI1RJUkVTI1JBQkUKVEhFUElOS1BBTlRIRVIjU09DSUFMCkVTU0VOIyMjU1RBUiNBRElFVSMjIwojIyNBQVJFIyNPTk9SI1JFRFJFU1MKVEhFTElPTktJTkcjRU1JUiNZQUxVClJBRyNST0RJTiMjTURJViNTQ1JBUApBTE9XI0tJVFRZRk9ZTEUjTk9MVEUKUE9TSVRJVkUjRVJSRUQjUk9VU0VSCiMjI0xPTkUjQk9FUlMjQlVSRyMjIwpTRUFET0cjUk9NRU8jUE9TVEFHRVMKRUxFQ1QjVElHRVJXT09EUyNSVUxFCkxJUkFTI09MQU4jI1NORUVSI1JJTgpFRElUI0JBRVIjU05BR0dMRVBVU1MKU0VFU1JFRCNUQVBFIyNBTEFSIyMjCiMjI1RFTlNFI0xFR1MjIyNDRVNUQQpPQkVST04jVEhFQ0FUSU5USEVIQVQKTE9SSSNFVEhFUiNUT05FUiNORUxMCkVSSUsjVFJFQVQjRVJPREUjU0VMQQpHRU5FI1RJTExTI0RFTlNFIyNOWVM="},{"title":"7/6/98 WOODY","author":"by Norma Steinberg, edited by Stanley Newman","date":"1998-07-06","grid":"QkFMSSNGTE9XI0JSQUNFCklST04jTElNQSNMT1ZFUgpCQVJCI0FWSVMjQUJJREUKI0JFQU1XSVRIUFJJREUjCiMjI0xJRUQjI0xFTiMjIwojU1RBTkQjUEVBIyNNVUQKRUFSTlMjRFVDVCNNSU5JClNUSUNLVE9USEVGQUNUUwpUSVBFI0FMVE8jTFlSSUMKQVJFIyNLRVkjREFGT0UjCiMjI0NIRSMjUEFJTCMjIwojU1BMSU5URVJHUk9VUCMKQ09MSU4jQUxPRyNXUkFQCkFMT05HI0xJVkUjRVNTTwpMRURHRSNMRUVSI1JBU1A="},{"title":"7/7/98 GETTING THERE","author":"by Rich Norris, edited by Stanley Newman","date":"1998-07-07","grid":"QVVSQSNCQVNBTCNDQU5FCkNSQUIjTEVUTUUjT05DRQpFQVNZU1RSRUVUI01FQUwKU0xBU0gjI0lOVEhFV0FZCiMjI1NBUkFOI1NBTCMjIwpIT1QjSEVSIyMjU0lHTlMKVVBJIyNOQ08jU1RFUkVPCk1JRERMRU9GVEhFUk9BRApJTkFST1cjVEFPIyNTVEEKREVMQVkjIyNNVU0jU09TCiMjI0dBUyNNRVRBTCMjIwpMT0lTTEFORSMjTk9ERVMKSU5TVCNCRUFURU5QQVRICkZMRUUjRVJOSUUjRVJOTwpFWUVSI1JPVE9SI1NFQVQ="},{"title":"7/8/98 LIGHTS OUT","author":"by Bob Lubbers, edited by Stanley Newman","date":"1998-07-08","grid":"REVGVCNHQUxTI0FTUElOCkFFUk8jSUJFVCNSRVVTRQpCTE9XQUZVU0UjU0FMU0EKIyMjTElUVEVSUyNCTFVSCkRFRklMRSMjTkVHQVRFUwpFTEFOI0RBRCNHT0dIIyMKTEFERVMjU0FNT0EjRURBCkFURVNUI0lSQSNET1BFUwpZRVQjRUFTRUwjU1BMQVQKIyNPREVTI1NJQyNFVVJPCkFMQkVSVEEjI0xBUkdFUgpQQUxTI0FMVE9PTkEjIyMKSU5BSVIjU09VTkRUQVBTClNBQ1JFI09HUkUjT0hJTwpISUtFUyNQQVNTI1JBTkQ="},{"title":"7/9/98 DIGITAL READOUT","author":"by Mary Brindamour, edited by Stanley Newman","date":"1998-07-09","grid":"QUJDUyNFVkFOUyNTVExPClpPT1MjUElQRVQjRVdFUgpUSFJFRUlOT05FI1JPTkEKRUVLI0VMWVNFRSNFQk9OCkNBU1RSTyMjI1BPTlkjIwojIyNFSUdIVCNMRUFGRUQKTEFOQ0UjT0lMRVIjT1JFCkFOSVMjTUFOT1MjVFVORQpJTk4jRklSRVMjSElSRUQKREVFUEVSI1NFVkVOIyMjCiMjVFJFVCMjI0lNQUdFRApTTE9FI0hPQVJTRSNFTEkKTUlTVCNGSVZFQU5EVEVOCkVNSVQjVVNJTkcjRVROQQpXQVhZI0xFVkVFI0JPQVI="},{"title":"7/10/98 BOOB TUBE?","author":"by Henry Hook, edited by Stanley Newman","date":"1998-07-10","grid":"Q0FSTCMjSEFNI05FUEFMCk9MSU8jQ1VKTyNFUk9ERQpFRE1DTUFIT04jV0VMRFMKI0FTSUFOI0JBQllCT1lTCiMjIyNNQUMjI0xPVSMjIwojVFZTQkxPT1BFUlNBTkQKU0hBS08jU1BFQUsjUkVPCkxFTkkjU01FQVIjQUdFUwpJSU4jU0hJUlIjQ1JVREUKUFJBQ1RJQ0FMSk9LRVMjCiMjI0hFUiMjWUFNIyMjIwpDT1dPUktFUiNDSVNDTyMKT05FSU4jRElDS0NMQVJLCkRVTkNFI05PRFMjQVJHTwpBU1RFUiNBVEUjI1dBWVM="},{"title":"7/11/98 SATURDAY STUMPER","author":"by Brendan Quigley, edited by Stanley Newman","date":"1998-07-11","grid":"I1NBUFBPUk8jQUxJQ0lBCkhJR0hFUkVEVUNBVElPTgpBUkFJU0lOSU5USEVTVU4KV0lUUyMjI1NUT1JNIyMjClNVRSNLRVBUT04jU0xPQgpFU1NFTkNFIyMjIyNPV0UKIyMjUE9MRVMjVkFJTkVSCkxBVEVSQUxUSElOS0lORwpJTlNFUlQjUElYSUUjIyMKTVRBIyMjIyNMRVRTTElQClBFUk0jQ09ST05BI0FOTwojIyNBU09ORSMjI0FSQ1MKQVBBUlRNRU5USE9VU0VTClJBRElPRlJFRUVVUk9QRQpTTk9PUFkjU0VYVEFOVCM="},{"title":"7/12/98 BULL'S-EYE: We aim to please","author":"by Don J. Nardizzi, edited by Stanley Newman","date":"1998-07-12","grid":"IyNEUkFQRSNIQU5HUyNKQURFRCMjCiNERUFDT04jQUJFQVQjVU5JQ0VGIwpHVU5TSE9UI0xJRUdFI0xPTkdCT1cKQUxUQSNSSUZMRVJBTkdFUyNTQVJJClNDSSMjU1RFVyMjI0NBUEUjI1RBTQpQRU5EUyNZRUFTI1pJUFMjVFdFUlAKU1RFUklDI1NZTUJPTFMjVEhJUlRZCiMjI0FDQUQjU09MT1MjUEFVTCMjIwpTVE9XQVdBWSNHWU0jUEFERExFSVQKQVJJQSNTTVVUUyNTRUFOUyNJTkRPCktBTEIjI1NNVSMjI1ZJQSMjQVVMRApJREVFI0hFTUVOI0RBTkNFI01SRUQKU0VEQVRFTFkjRUdPI1NIT09URVJTCiMjI0RJQVMjQ0hBUFMjRVJMRSMjIwpBTE1PTkQjVEFSR0VUUyNXQUxSVVMKTEVBTlQjTUVOVSNESUVUI1NMQU5UClBJRyMjUEFOVCMjI0NBUlQjI0lDRQpFR0dTI0FOTklFT0FLTEVZI0dOQVIKU0hPVEdVTiNDTEFTRSNBUlJBSUdOCiNTVEVFTEUjTElGRVIjVE9VUEVFIwojI1NURUFEI0VBU1RTI1NMWUVSIyM="},{"title":"7/13/98 SPREAD IT AROUND","author":"by Lee Weaver, edited by Stanley Newman","date":"1998-07-13","grid":"R0FTUCMjTE9DTyNBSkFSCkFMUE8jQkFDT04jVEFUQQpST0FSI1VOQ1VUI09NRU4KQlVUVEVSQ1VQI09OU0VUCiMjI0xBU0VSI1RSRUUjIwpBR0hBU1QjI0NPQVJTRSMKQ1JPTlkjTUFIQUwjU0FQCk1FTkQjTU9WRUQjUElTQQpFVEUjUEFSRVIjQUxPRVMKI0FZRUFZRSMjQlJBTkRTCiMjQkFMSSNSQUlUVCMjIwpJTlVSRSNKRUxMWUZJU0gKREVOVCNSSVZBTCNPR0xFCkVUQ0gjQkxVUlMjUk9VRQpBU0hZI0lURU0jI01SRUQ="},{"title":"7/14/98 MASS MEDIA","author":"by Trip Payne, edited by Stanley Newman","date":"1998-07-14","grid":"Q0FSUCNSQVNIIyNFUkFTCkFSSUEjRUxMRU4jUkFOVApSRU5UI1NNSUxFI0VUTkEKUkFESU9DT01NRVJDSUFMCiMjI09GVVMjIyNBVE9MTApMRUEjTUVUQUxFRCMjIyMKQVRTRUEjI1NPUyNTRVRBCkRBSUxZTkVXU1BBUEVSUwpFVEFMI0JFQSMjVkFMVUUKIyMjI01BR05BVEUjWUVUClNNRUxMIyMjUEVSVCMjIwpURUxFVklTSU9OU0hPV1MKSURMRSNNQU5HTyNFVkFTCk5FRVIjQUxJRU4jU0FMVApUQVNTIyNTVEVTI0VMS1M="},{"title":"7/15/98 SHIP SHAPE","author":"by Fred Piscop, edited by Stanley Newman","date":"1998-07-15","grid":"VEFQI0FEQVBUI1NVU0FOCklNRSNET0JSTyNBVE9ORQpOT04jRUxCT1cjTkFGVEEKQ1JVSVNFUldFSUdIVCMjClRBUk9UIyNTUkEjI1NFRQpTTFlORVNTIyNOSU5FVFkKIyMjIyNTV0FQI05PTFRFClNVQk1BUklORUJBTExFUgpBUFJJTCNUQVJFIyMjIyMKUk9JTEVEIyNQRVJURVNUCklOVCMjRU5EIyNIT1JORQojI0NBUlJJRVJQSUdFT04KTUFIUkUjQ0xFQU4jQ1JPCklCRUFNI0hFTExPI1RFTgpDT1NCWSNFU1NFUyNTUlM="},{"title":"7/16/98 RHYME TIME","author":"by A.J. Santora, edited by Stanley Newman","date":"1998-07-16","grid":"Tk9MQSNNQURFI0FET1BUCkVSSU4jQUJFTCNUSVRMRQpTRU1JR0xPU1MjTE9UVVMKU0xPTU8jRElBTkFST1NTCiMjI0FCTEUjI0JTQSMjIwpTVEVMTEEjUEVBVE1PU1MKUEVSI0VTVEVSIyNBTU9LCk9SUiNUSEVCT1NTI0FMQQpPUkVPIyNDQVNURSNISVQKUkVEQ1JPU1MjQVJDQURFCiMjI1RFQSMjQVJJQSMjIwpBTEJBVFJPU1MjQUxHQUUKU0FMVk8jVE9UQUxMT1NTClRSVUVSI0lERVMjVVJJUwpJREVTVCNTQVJBI1BFU08="},{"title":"7/17/98 GO FIGURE","author":"by Patrick Jordan, edited by Stanley Newman","date":"1998-07-17","grid":"TEFPUyNXUkFUSCNSRUVGCkFDUkUjSEVOSUUjQUxBSQpXSFlBUkVDT01QVVRFUlMKU0VYI0lST05TI0tFTVBUCiMjI0FHRVIjI1ZBU0UjIwpMSUtFQklLSU5JUyNOUkEKQU5OT1kjI05JTkUjVEFEClJVSU4jSk9MTFkjVEFUSQpHSUcjU09EQSMjRUVSSUUKRVRII1RIRVlTQVZFWU9VCiMjVEhFTiMjSURFUyMjIwpNQUhBTiNBUkxFTiNNQVMKQUxPVE9GR1VFU1NXT1JLClNMT0UjVFJFTlQjSlVORQpLSURTI0NBU1RFI01FT1c="},{"title":"7/18/98 SATURDAY STUMPER","author":"by Ed Julius, edited by Stanley Newman","date":"1998-07-18","grid":"QU5BREVNIyMjQlJPR1VFCkxBQk9SRVIjU09BUElORwpCVVNURVJCUk9XTlNET0cKQVRFI1NMSU1NRUQjRVBBCkNJTkUjRVNTRVMjSE9FUgpPQ1RFVCMjIyMjR1VOTlMKUkFJU09OU0RFVFJFIyMjCkVMQSNQRVRVTElBI1dJUwojIyNESUVTRUxFTkdJTkUKQkFTSUMjIyMjI1RPU0NBCk9SSUcjQkFOQUwjU1RFVwpVUkUjUEFOQU1BUyNFTkUKR0VORUFVVFJZU0hPUlNFCkhBTkRMRVMjU1RPUklFRApUUkFERVIjIyNTVFJBRFM="},{"title":"7/19/98 THE GAME'S AFOOT: Wherein you'll hit your stride","author":"by Bob Lubbers, edited by Stanley Newman","date":"1998-07-19","grid":"QVRURVNUUyMjU0FHQSNBQlNPUkJTCkNPVU5URVIjQ09WRVMjQ1JBTkVSUwpUT05HVUVJTkNIRUVLI0NPTlNPUlQKU1RBSUQjI0FDT1JOUyMjVVRBIyMjCiMjI05FRURZIyNBQUYjI0dBTEFTIwpFU1NFTkNFI01QRyNPQVRII0VQSEEKRklMRVRPRlNPTEUjUk9PVCMjUkFIClRTQVIjI0FDUk9TUyNSVVQjTklMRQpTSU0jRVRDSEVEI0FTVFJPI0lPTEEKIyMjQUNIRSMjI0lLRUEjSE9UUk9ECiNJRlRIRVNIT0VGSVRTV0VBUklUIwpTVEVST0wjRVJBUyMjI0hFUk8jIyMKTEVEQSNBVExBUyNUT1dFTFMjUElQCkFSRVMjU0FUI1RFUlJPUiMjU0FCRQpUQVIjI1RSRVMjUElDS0VSVVBQRVIKU1RBUiNIQVJUI0lNQSNUSU5IQVRTCiNFTElIVSMjQVBDIyNNT05URSMjIwojIyNTRVIjI0JMWVRIRSMjQVJFQVMKQVJJS0FSQSNMQUNFU1RIRVBVTkNICkxBVEVSQUwjRUNMQVQjT05FTElSQQpTV0FSVEhZI1NFRVIjI0FEREVET04="},{"title":"7/20/98 GREENERY","author":"by Norma Steinberg, edited by Stanley Newman","date":"1998-07-20","grid":"SEVMUCNQRUVQIyMjREVDCkVSSUUjQUFST04jQk9USApGQU1JTFlUUkVFI1VOVE8KVFNQI09ERVMjUEFTU1VQCiMjI0JSQU4jRVRDSCMjIwpTUEVFRFkjQ0xVRUxFU1MKSEVBRFkjV0hFTiNFWElUCkFSR08jVFJVQ0UjQVVESQpHT0xGI1JFTlQjT0dERU4KU1RFUkxJTkcjVFJVRVNUCiMjI09JTFMjRFVERSMjIwpQUkVTVE8jTk9TRSNQT0kKUk9MRSNHUkFTU1JPT1RTCkFUTVMjWU9ERUwjQUtJTgpZRVMjIyNCQVNFI1JFU1Q="},{"title":"7/21/98 NATIONAL LEAGUE","author":"by Rich Norris, edited by Stanley Newman","date":"1998-07-21","grid":"VFJJTSNDUk9BSyNWSUNFClJFTkUjSE9SU0UjQU1PUgpBVFRBI0FSRVRFI1NQQVIKQ09VTlRSWVNJTkdFUlMjCkVMSVRFIyMjUkVQI09UUwpERFQjTUFMVCNEQVBQRVIKIyMjQVBQRUFMIyNSRURTCiMjVU5JT05NRU1CRVIjIwpXQU5UIyNTRU5EVVAjIyMKQUJBU0VTI1NUSVIjRklUClNVUiNTUEEjIyNURVJOUwojU1RBVEVTT05FU0NBU0UKSElGSSNBQ1RFRCNPTUlUCk9WVU0jS09SRUEjTEVTUwpHRUxTI1NUT1JNI0VTVEU="},{"title":"7/22/98 KID STUFF","author":"by Trip Payne, edited by Stanley Newman","date":"1998-07-22","grid":"QVNBUkFJTCMjUkVQQUlSCk1BRE9OTkEjRElMRU1NQQpJV0FOTkFCRUFDT1dCT1kKIyNNQUlOI1JVRSMjSUtFClNIQUxFI0NFTlNPUiMjIwpXQU5EI1BBQ1QjQkVBUyMKRU5EI1NPUlQjRkVMTEFTCkFERVBUTFkjUkVTT0xWRQpSRVZFUkUjU0FERSNUT1AKI0xFVEEjR0FHUyNPSElPCiMjI1NQQVJTRSNFTUVSWQpVU0EjI0xFUyNPREVTIyMKUk9MRVBMQVlJTkdHQU1FClNOSUdMRVQjU1RFQU1FRApBU1NPT04jI1RPU1NFUlM="},{"title":"7/23/98 SIX OF A KIND","author":"by Richard Silvestri, edited by Stanley Newman","date":"1998-07-23","grid":"QUxBUyNJQklEI1NQTEFUCkJPVVQjTk9ERSNUUkFTSApCRVRBI1RPRUQjUk9ERU8KQUJPTUJFTUFJTElCRUFNCiMjI1BBTiNTQ0FQRSMjIwpET0NFTlQjI0FWRVJURUQKRVZBREUjQ0lURVMjSEFXClBJUEUjQkFLRVIjUkFHRQpPTk8jQ0FTRUQjUkVORUUKVEVORE9OUyMjU1VQRVJCCiMjI0VOVEVSI0FCRSMjIwpPUklOR1VUVVJOWUFYSVMKVEVTVEEjVFJPRCNURVJJCklTTEFNI0VBU0UjRU5PTApTVEFMRSNTTEVEI1JBTks="},{"title":"7/24/98 IN THE AFFIRMATIVE","author":"by Frank Longo, edited by Stanley Newman","date":"1998-07-24","grid":"RUxNI0FDRVRJQyNPTUlUCk1PRSNMQU1JTkEjTkVSTwpCWUFMTE1FQU5TI0VYSVQKTE9HTyNFUkcjQU5BSVMjCkVMRUdZI1lPVUJFVENIQQpNQVJHT1QjI1RBRCNBTVAKIyMjRVJSQVRBIyNTTEFUCiNTVVJFQVNTSE9PVElOIwpHVU5TIyNTRU5BVEUjIyMKQVJDI1VTQSMjVE9XRVJTCkJFSEFQUFlUTyNTUFJBVAojRkFMU0UjT0ZGI09PWkUKTUlTVCNOT1FVRVNUSU9OCkFSVEUjRE9VU0VSI0NSTwpQRUVSI1NQRUVEUyNBU1M="},{"title":"7/25/98 SATURDAY STUMPER","author":"by Fred Piscop, edited by Stanley Newman","date":"1998-07-25","grid":"QklBRlJBTiMjRkFVQ0VUCkFOVElFVEFNI0lOVE9ORQpTVE9ORUFHRSNSRUFNRVIKVElNI0RSQUdORVQjRVJSCkVNSVQjSU5BSVIjTE9HRQpSRUNBUCNPTEQjUlVOSU4KIyMjQkFNI09SR0FOSVpFCiNUSEFXRUQjRU9DRU5FIwpTQVVTQUdFUyNCRVQjIyMKVElOQ1QjUkVMI1NUQVNICkVMS08jTUFYRVMjRVRUQQpBR0UjQkFUSVNUQSNUQVMKTUFSSU9OI1NURU5DSUxTCkVURVJORSNNQU5JQUNBTApSRURBTlQjI1RPTk5BR0U="},{"title":"7/26/98 WASHED UP: A bright and clean creation","author":"by Fred Piscop, edited by Stanley Newman","date":"1998-07-26","grid":"R0FTSCNESVNDSSNTRUdFUiNMVVNUCk9MRU8jVU5DQVMjQ0xFVkUjQU5OTwpCQUxERVJEQVNII0FDUkVTI09MSU4KQU1JI1JBSVRUI0NSSU1TT05USURFCkRPR0ZBQ0UjI0JBTkQjI05FU1RFRAojIyNBVEUjTkVSVkUjQlJBVkUjIyMKVEhFQk9MRE