{"id":"newsday-2004","publication":"newsday","year":"2004","count":365,"puzzles":[{"title":"1/01/04 COVER-UPS","author":"by Merle Baker, edited by Stanley Newman","date":"2004-01-01","grid":"UEVEQUwjUEFDRVMjUEpTCkVSQVRPI0VBUk5TI1JVVApDQU5WQVNTSEVFVCNVTkUKQVNLI0ZBQ0VUIyNBTlRFCk5FRUQjV0lERVNQUkVBRAojIyNFTVMjIyNIQU0jIyMKRUxPUEUjQVNURVJJU0tTClNFQ1VSSVRZQkxBTktFVApQRVNURVJFUlMjREFJUlkKIyMjSUxBIyMjU0VSIyMjCkNSQVpZUVVJTFQjTUFDSApBT05FIyNCT0VSUyNPUk8KUlVOI1NUT05FU1RIUk9XCkFHRSNQTEFJRCNFQVRBVApURVgjQUNUQVMjUExBVE8="},{"title":"1/02/04 CATCH ME IF YOU CAN","author":"by Fred Piscop, edited by Stanley Newman","date":"2004-01-02","grid":"SEFMRVIjSk9JTlQjR09UCkFOR0xFI09SQ0FTI1VOTwpTVEVBTUVOR0lORSNNRVcKUElTVE9MI1NFVCNNRUFOCiMjI0VEVUMjUkVGSUxMUwpQQVNTRURJTiNTT0RBIyMKQUxBI0xFVElUI1BBU1RBCkNPTUIjREVMSVMjU1RBUgpTVEVFTCNERUdBUyNJTEUKIyNMRUFII1NFTExFQ0NBCkdPTEZCQUcjUkFJTiMjIwpBVklTI1dFRSNBQ1RUV08KQklPI1JBTkRPTUVSUk9SCk9OVCNBSVJFRCNSRVVORQpORVQjTUlFTlMjU0VFS1M="},{"title":"1/03/04 SATURDAY STUMPER","author":"by Craig Kasper, edited by Stanley Newman","date":"2004-01-03","grid":"VFJBUFBJU1RTIyNJQkVUCkhBVkVJVE9VVCNHTk9NRQpJTkVTU0VOQ0UjT1JCSVQKU1RSRUFNSUNFI0JBU1RFCkJFQVQjU0FJTlRFRCMjIwpFREdBUiMjIyNFTElKQUgKIyNFU0UjTEFWQUxJRVJFCk1BSiNESUVUQVJZI0FJTQpQUk9GSVRFRVIjVVNOIyMKU1RFRVJTIyMjI1BBUkRPCiMjI1JFQUxJR04jVkVFUgpBWlRFQyNBUlJPR0FOQ0UKQlVSTlQjRElFU0VMT0lMCkJMT0dTI0FTVEVST0lEUwpBVURJIyNTSEFERVRSRUU="},{"title":"1/04/04 LADIES' DAY: Wherein we name names","author":"by Lee Weaver, edited by Stanley Newman","date":"2004-01-04","grid":"I0RPUEUjI0JPRyNLSU0jU1RJRkxFClNFUkFQRSNCT0FUSU5HI0FJUklFUgpQTEFURU4jQ0hSSVNUTUFTQ0FST0wKQUlMRVJPTiNTUkFTI1RBU0sjU1NFCiMjIyNHTE9CI0VSSVMjU0VMRiMjIwpIRUxFTkFNT05UQU5BIyNTRUVTVE8KQU5JU0UjQU5FVCNHVUxQIyNUSEVNClNURVQjI0RFQiMjI05FQSNTQ09QRQpQUklFUyNTQVVMI0RBSVNZQ0hBSU4KU0VORUNBI1NMQVRFIyNURUEjTERTCiMjI01BUlRIQVNWSU5FWUFSRCMjIwpQQVMjUkVPIyNFQUdFUiNTQ0FMQVIKSVZZTEVBR1VFUiNOQVJDI0VNT1RFClRJUk9TI0FTSyMjI1JBSCMjU0NBRApIQUlHIyNFTUlSI09UVE8jUEVBUlkKU05BSUxTIyNORVJWT1VTTkVMTElFCiMjI0NPUEUjR0xFRSNNRUlSIyMjIwpXUlkjQ0FSRSNBQ1JFI05FTUVTRVMKSEFNQlVSR0VSUEFUVFkjQ0lDRVJPCklOQ0lTRSNSRVNQSVRFI0VUSEVSUwpHSUFOVFMjT0RFI1BFVyMjU09OUyM="},{"title":"1/05/04 TIMELY SENTIMENT","author":"by S.N., edited by Stanley Newman","date":"2004-01-05","grid":"SEFMRiNCRVRBUyNFQVRTCkFSQUIjRUxJT1QjR0xPUApXRVdJU0hBTExPRllPVUEKU0FOI0tJVEUjTk9QRVRTCiMjI0xJTkUjREVOVCMjIwpBVFRFTkQjR09BRCNCVVMKQlJZQU4jU09ORyNCVVNICkhBUFBZQU5ESEVBTFRIWQpPREVTI1NPTE8jTU9URUwKUkVTI1BLV1kjRkFLRVJZCiMjI0dPRVMjRkFaRSMjIwpPU0dPT0QjSUxJRSNCT1gKVFdPVEhPVVNBTkRGT1VSClRBUlQjVU5MSVQjRVpSQQpPTkVBI1RJRVJTI05PU1k="},{"title":"1/06/04 FLAG DAY","author":"by Shirley Soloway, edited by Stanley Newman","date":"2004-01-06","grid":"Q0hFUiNKQU1CUyNXV1cjCkhBTkEjQURJRVUjSUhBRApBVklTI1JPTUFOI1NJVEUKUkVESEVSUklORyNFVFRFCiMjI0VWRU4jIyNCTEVTUwpMQVBTRUQjRVNTQVlTIyMKT01JVCMjSU5QVVQjQURTCkZJTiNDT1NUQVJTI0xFVApURFMjUlVMRVMjI0RFTEEKIyNURUVURVIjUkFJU0lOClNUUkFXIyMjQkFMTCMjIwpJUklTI0JMVUVSSUJCT04KUk9QRSNBSVNMRSNFTExFCkVWRUwjUkVTVFMjUlVFUwojRVNTI0JVUlNUI1RST1Q="},{"title":"1/07/04 ON ICE","author":"by Fred Piscop, edited by Stanley Newman","date":"2004-01-07","grid":"U1BBVFMjUExFRCNHUkVHCkFVRElPI0xBQ1kjTEFMQQpTTkFGVSNBVk9OI0FWSVMKIyMjRlJPWkVOQVNTRVRTClBMTyNCUkEjI01BU1NFWQpMSU5FQVIjU1BJTlkjIyMKQVRBTEwjVEhBVCMjVEhFCkNISUxMWVJFQ0VQVElPTgpFRVIjI0VJUkUjQVdBUkQKIyMjQURBR0UjU1BBUlNFClNQQVJFUyMjRE9FI0FFUgpDT0xEV0FSUklPUlMjIyMKT1BJRSNZRUFSI0JBREVSCk9QRU4jRURJVCNBUklTRQpQQU5UI1JPTFkjR0FQRUQ="},{"title":"1/08/04 THINK TRICE","author":"by Merle Baker, edited by Stanley Newman","date":"2004-01-08","grid":"Q0FSVVNPI0ZBTlMjQkVHCkFSSVNFTiNJTklUI0lMTApNT01FTlRPRklORVJUSUEKRU5TI1NIVVRTI01JVFpJCiMjI0dPRVRIRSMjQ0hBUgpBQlNPUkJTIyNGUkVFIyMKV0VFQiNMRU8jTEFSREVSCkVTQyNQSVRUTUFOI1VUQQpTVE9MRU4jQlVTI0FTQVAKIyNORUNLIyNTSFRFVExTCkFOREEjI0FMSUJJUyMjIwpUT1dOUyNET05VVCNTRUEKVFdJTktMSU5HTElHSFRTCklBTiNJREVFI0JBU0lOUwpDWUQjU0xVUiNTTkFQQVQ="},{"title":"1/09/04 SOMETHIN'S MISSIN'","author":"by Richard Silvestri, edited by Stanley Newman","date":"2004-01-09","grid":"QkVBSyNUT1RPI0ZBTFNFCkFYTEUjT1ZBTCNBV09LRQpTSURFI1BJQ0EjQ0FCSU4KU1RBTkRJTk9WQVRJT04jCiMjIyNBQ0UjI1RPVCMjIwpTUFJBWVMjQ0hBUiNTU1QKQVJPTUEjUE9PUiNVUFRPCkdBTUlOQ09NTUlTU0lPTgpBVEFEI0FMRUUjUEVFVkUKTEVOI1NQT1QjUlVEREVSCiMjI1NURSMjSkFSIyMjIwojQVNQSVJJTkFDVFJFU1MKRVFVQUwjQ09OSyNBUkVBClNVSVRFI09QSUUjWklORwpTQVRFUyNORVNUI1pFVEE="},{"title":"1/10/04 SATURDAY STUMPER","author":"by Daniel R. Stark, edited by Stanley Newman","date":"2004-01-10","grid":"RE9HU1RBUiNBRFZFUlNFCkVOTEFSR0UjUFJFVEVFTgpTVEFNRU5TI1BJRVJDRUQKUEFEI1NFVFRFRSNFTFNFCk9SRE8jU0FIQVJBI0lSQQpUSUVSUyNUT1IjTE9ORVIKU09SQ0VSRVIjQklQRURTCiMjI0hBVVMjRlJFRSMjIwpQT0xJVEUjUExBTk5FUlMKQU5PREUjQ1VFI1NFVkVOCkpBWSNET09NRUQjUklUQQpBUkFMI0dSQUNFUyNESUcKTU9MSUVSRSNJQ0VCRVJHCkFMTE9WRVIjTk9NSU5FRQpTTFlORVNTI0dSSVRURUQ="},{"title":"1/11/04 A PUZZLE: Separate it before you read it","author":"by Fred Piscop, edited by Stanley Newman","date":"2004-01-11","grid":"U0hBTVUjUEVBTEUjQURBTSNNQVNUCkNPVkVOI0FUQkFUI1NFUkEjQUNIRQpBTUVOREVEVEVYVCNTTklUI1NDQU4KUEVSI0VEU0VMI0FDVVRFQUNDRU5UCkFSVEVSWSMjIyMjQVJFI0hFQUxUSAojIyNBU1NBRCNJTk1FI0NBUlJFIyMKREFOVEUjTlVBTkNFI1NPUkVBUk1TCklURSNBUEFSVEZST01USElTI0FPTApTVEVNI0xMQU1BIyNZQU8jI0FUV08KQ1VSQUNBTyMjVkFQT1IjVU5CRU5UCiMjI0FMSUdIVE9OQUJSQU5DSCMjIwpTUFVNRUQjUkFSRVIjI1NQT09ORVIKUE9MUyMjTU9DIyNLSEFLSSNST0xFCkVTVCNBV0FTSElOUkVESU5LI1JJTgpDSFJPTklDUyNSRU9QRU4jTkFNRUQKIyNBTlRTWSNNRU9XI0VHR0VEIyMjCkxFU1NFRSNTQU4jIyMjI1JFRUxFRApBVk9JRERBTkdFUiNTUElFTCNFVkEKU0FORCNPTEFOI0FXQVJEV0lOTkVSCkVESUUjRk9SRSNNT1JFTCNOT1RSRQpTRUNTI0ZFRVQjU1dJUEUjR1JPU1M="},{"title":"1/12/04 DAIRY CASE","author":"by Lee Weaver, edited by Stanley Newman","date":"2004-01-12","grid":"TEFNRVIjI1NJVCNTQVJBCkFCSURFUyNFUkEjV1JFTgpNT1RJVkUjTUFOVE9NQU4KQlVUVEVSRklOR0VSRUQjCiMjIyNBVkUjIyNBRERTIwpTUElMTEVETUlMSyMjIyMKVE9ET1MjI0VWQSNUT1NTCk9SRVMjU0NSRVcjRUxMQQpQRUFTI0hPRyMjQUxJQVMKIyMjI0NIRUVTRUNMT1RICiNTRVRIIyMjRVRDIyMjIwojQ1JFQU1PRlRIRUNST1AKTk9PTlRJTUUjQURIRVJFClVORE8jQ0VFI05FRURFUgpCRUVSI0FORCMjU1RPTEU="},{"title":"1/13/04 BY THE BOOK","author":"by Gail Grabowski, edited by Stanley Newman","date":"2004-01-13","grid":"TUFOT1IjUkVVUCNHUklUCklOQVdFI0FMU08jUkFTSApMSUZFSkFDS0VUI09TTE8KRVNUI09HRUUjUEFVUEVSClNFQUJJUkQjU0lHTiMjIwojIyNPTkUjWUlFTERTVE8KI1NJWCNFREFNI09DQ1VSCkFQUklMI1JITyNXT09FUgpTQ09ORSNPT05BI1ZXUyMKS0FOR0FST08jQkVFIyMjCiMjI1RSQVAjQk9BUkRFUgpCSUtJTkkjSU9VUyNSQUUKRURJVCNTRU5BVEVQQUdFClRFTEwjSVJLUyNMT1BFRApTQU5FI05FU1QjU0VFUlM="},{"title":"1/14/04 SECRETIVE","author":"by Roslyn Stark, edited by Stanley Newman","date":"2004-01-14","grid":"SEFSUCNCUkVUI0FDTUVTCkFTRUEjUkVNTyNDT0FTVApTVEVUI09WQUwjRVZJVEEKSElERUJPVU5EI1RFTkVUCiMjIyNJREVBI0hJUkVSUwpXT1JTVCNTVE9JQ1MjIyMKRVJFQ1RTI0VMSyNUQU1TClNDQVJFVVAjREVDT1JVTQpUQVBFI01BQiNTSFJJTkUKIyMjRVJBU0VEI0VZRElFClNDRU5JQyNET1RFIyMjIwpQVUxQUyNDTE9BS1JPT00KVVRJTEUjUkFHUyNVTE5BClJFVEFSI0VNSVQjTElMWQpUUkVZUyNFUEVFI0VOWUE="},{"title":"1/15/04 BEASTLY BEGINNINGS","author":"by Fred Piscop, edited by Stanley Newman","date":"2004-01-15","grid":"U0FEQVQjRUJCUyNCQVNTClBST0xFI1NBUkEjQUxJVApZQUxUQSNTTE9UI05PTkUKI0JFQVJOQUlTRVNBVUNFCiMjIyNVRVkjIyNVTkRFUgpDQU5BUEUjRFJBTUEjIyMKT0RPUiMjQVJPTUEjTUVUCkhJUFBPQ1JBVElDT0FUSApPTkUjQk9HSUUjI1BJTkUKIyMjQkVUT04jTUlTTEFZCkVQRUVTIyMjQ09OIyMjIwpCVUxMRVRQUk9PRklORyMKU0xJVCNIRUFSI0FERUxFCkVTVEUjT0xJTiNNRVdFRApORUVEI1JFTFkjWUFURVM="},{"title":"1/16/04 TALKING POINT","author":"by Patrick Jordan, edited by Stanley Newman","date":"2004-01-16","grid":"SkFSUyNBUkFCI1NDRU5FCkVYSVQjTk9OTyNDT0xPUgpERU1PI0dVVFMjSFVNT1IKIyMjV0hFTlNIRU9QRU5TCkFTUCNPTEQjI0JPRVIjIwpSRVRJTkEjQUJFTCNHQUQKVFJFQUQjU1RBUiMjQVJSCkhFUk1PVVRISVRTT05MWQpVTk8jI05FT04jQUxURVIKUkFEI1NJUFMjU1RFUk5PCiMjQVNUTyMjQUxJI1lFVApUT0NIQU5HRUZFRVQjIyMKQVRUQVIjQVNUQSNBUVVBClNUWUxFI0JBRVojRlVSUwpTT0xFUyNTVVJFI1RBTks="},{"title":"1/17/04 SATURDAY STUMPER","author":"by Merle Baker, edited by Stanley Newman","date":"2004-01-17","grid":"I1NBUFBPUk8jUEFSQ0gjCkdBUlJJU09OI09DVUxBUgpVTklPTklaRSNMSUdBVEUKU0tBVEVTI1dPT0RSVUZGClRJTkVEI0xBRCNTQURJRQpPTkVDI0xBWUVSI1RJRVIKIyMjVEVFVE9UQUwjVUxUCkRPQVNUSEVST01BTlNETwpFQkIjU0FSQUpFVk8jIyMKTlNFQyNSQU5PTiNXSU5ECklPVEFTI0xPWSNTT1JFUgpBTFRSVUlTVCNQSU5BVEEKTEVFUkFUI0hFUkVESVRZClNUUk9WRSNFWEVHRVNFUwojRVNURVIjUkVWRVJFRCM="},{"title":"1/18/04 TWO-HUE REVIEW: An array of black and yellow","author":"by Patrick Jordan, edited by Stanley Newman","date":"2004-01-18","grid":"QkVBRCNJTkdPVCNTUEVDUyNNQVNICkFYTEUjTk9MSUUjQUVSSUUjSVJNQQpUSUdFUlNXQUxMT1dUQUlMI0FOSUwKQ0xFTUFUSVMjTE9TRVMjRkVNQUxFCkhFUiNCQVNTI0FIT1kjQ0lUSVpFTgojIyNUSUxFI0NMRUYjU0FTSCMjIyMKTVVTU0VMI0dPTERGSU5DSCNPQk9FCk9SQ0FTI0RBUyMjI1JBSCNTSFVMQQpMQUhSI1BPTElDRVRBUEUjVEFNRVMKRUxPI0ZBWkUjT01JVFMjVFVSQk9UCiMjT1NBR0UjR1JJUEUjVklEQUwjIwpERUxVWEUjT1JBTFMjRklOUyNFWUUKQUxCRUUjU01JTEVZRkFDRSNBQkVMCkxBVURTI0hFRSMjI0VSRSNEUkVBTQpFTFNFI1NVTkZMT1dFUiNSQUNFUlMKIyMjI0pFVFMjQVVFTCNIRU5TIyMjCkxFVFRVQ0UjRVRURSNST01BI0JBQQpFUVVBVEUjRlJJRUQjT1BJTklPTlMKTlVMTCNERUVSQ1JPU1NJTkdTSUdOCkRJU0sjRVNURUUjVVBFTkQjSVNMRQpTUEFOI0RFRURTI1RBTkdTI1NFRVI="},{"title":"1/19/04 SCRAM","author":"by Sally R. Stein, edited by Stanley Newman","date":"2004-01-19","grid":"QkFSUyNBVExBUyNIT0FSCkFMVU0jU0hBUlAjVVJTQQpOSU5FI1RFVFJBI05FQVIKR0VUQVdBWUNBUiNHT05FClNOT1JFIyNIWUVOQSMjIwojIyMjQkFOIyNTT1JFU1QKRkFDRSNMRUFEI01JTkVPCkxFQVZFSVRUT0JFQVZFUgpFUlJPUiNTRUxMI05ZTlkKRE9MTEFSIyNFVEEjIyMjCiMjI1VTVVJQIyNJVEVNUwpTV0FUI1NIT09GTFlQSUUKVEFYSSNIT1JORSNQT0xFCk9TTE8jRURHRVIjRVhBTQpXSEVOI0RBWUFOI1NZTlM="},{"title":"1/20/04 ON A DIET","author":"by Lee Weaver, edited by Stanley Newman","date":"2004-01-20","grid":"V0FTUFMjR0VBUiNQQVBBCklNUEVMI0VMU0EjRU5JRApUSUFSQSNNRUFOI0VHQUQKSEVSI1NMSU1QSUNLRU5TCiMjRVRIQU5FIyNPU0xPIwpTQVJJI0RJTkVSUyMjIyMKQVJJRCMjI1RBVVRFU1QjCkxJQkVSQUwjUkVBRE1JVAojQVNTVVJFRCMjI1NBTkUKIyMjI05FR0FURSNFTEFOCiNDQUtFIyNSRVNFTEwjIwpUSElOU0tJTk5FRCNUT00KUklTRSNFRElFI0lNQUdFCk9MTEEjR0VOVCNDQUxMUwpERUVEI1NBR1MjVFlLRVM="},{"title":"1/21/04 CLOSEOUTS","author":"by Fred Piscop, edited by Stanley Newman","date":"2004-01-21","grid":"UkFCSUQjV0FTUCNNRVNICkFMRU5FI0lOVE8jT0RJRQpCSUdTUEVOREVSI05BTkEKQVZBI0xFRVMjVEhFTUVUClRFTkZPTEQjQ0xBWSMjIwojIyNFUlMjVFJBV0xFUlMKTUFSTkUjVEhJTiNFTElFCkVWQUMjU0lSRUQjTkFNRQpUSVJFI1RLT0QjSURMRUQKQURBTVNSSUIjT05FIyMjCiMjI0VUQVMjU05BUkxFRApDUk9OWU4jTUFJTSNFVkEKSEFORCNHT0FMVEVOREVSCkFDTUUjRUxMQSNTQUlOVApQRUVSI1JFRUQjU1lOVEg="},{"title":"1/22/04 CLEAN LIVING","author":"by Randall J. Hartman, edited by Stanley Newman","date":"2004-01-22","grid":"U0xJTSNBREFHRSNTVEFCCkxPQ08jRklSRVMjSFVHTwpBTEVTI0dOQVRTI09CRVkKQkFUSFNIRUJBI01PVEVTCiMjI1BFQVIjTEVBU0gjIwpBU1NJR05TI0lSSyNVTVAKSElQVE8jI0FGUk8jTUFJCkVHT1MjRkxJRVMjU1BJTgpBTk4jUFJPTSMjU0NFTkUKREFHI1JFViNTQ09VUkVECiMjRVZBREUjVEFMTCMjIwpERUNBWSNTT0FQT1BFUkEKVVJBTCNMRU5UTyNUUkFNCk1JS0UjRUFURU4jT0xJTwpCRUVUI1NUT05FI1JFRFM="},{"title":"1/23/04 LEAD-FILLED FOODS","author":"by Craig Kasper, edited by Stanley Newman","date":"2004-01-23","grid":"I0xBVEgjREFEIyNTUEVEClNBQlJFI0VWRSNTV0VBUgpPTkFJUiNQRU4jVEFSUlkKUkFTUEJFUlJZSkFNIyMjClRJRSMjV0VUI0VOSUdNQQojIyNBR0VTI1dFRCNSQVAKTU9UVE8jU05BUEJFQU5TCkVSUk9SI0FFUiNBUklTRQpTT1VQQk9ORVMjQ0FORVMKT05TI0FOVCNBUktTIyMjCk5PVElDRSNBV0UjI1NUUAojIyNTSFJJTVBCSVNRVUUKQURFTEUjQk9BI0RPVUJUCk5FR0VWI0FSQyNFUklFUwpDTE9UIyNSRVQjQUJCUiM="},{"title":"1/24/04 SATURDAY STUMPER","author":"by Daniel R. Stark, edited by Stanley Newman","date":"2004-01-24","grid":"QkVBUkVSIyNBVEhJUlNUCkFOR0VMSUMjSEFVVEVVUgpHUklNTUVSI0VMRUNUUkEKR0FUI0FOT1JBSyNISUZJCkFHQUlOI05PREVTI1JFUApHRVRTI0xZRSNSVUxFUlMKRURFTFdFSVNTI01BU1NFCiMjI0FJTVMjSU1BTSMjIwpTUEFOUyNNRURJQ0lOQUwKQ0FSREVEI1ZFWCNOT0dPCkhVVCNSQUJJRCNDQU1FTwpFTElTI1BPTElTSCNJTFMKTUlTSEFQUyNTSEFXTkVFCkVOVElDRVMjSEVJUkVTUwpSRUVOVFJZIyNEUllFU1Q="},{"title":"1/25/04 BACK ENDS: 29 of them in six rows","author":"by Merle Baker, edited by Stanley Newman","date":"2004-01-25","grid":"QURDI1NPQVAjQURSSUZUI0FCQk9UClRSQSNVUkdFI1RSQUNFUiNMRUVSWQpXQVJEQkVBVFNMQVNIQklURVNMQVAKT0NURVRTIyNQQU1QQSMjQVNUVVRFClJVUkFMI1ZPVVMjI0JVQ0sjI1NJUwpTTElERUNPVVJURFJPUFJFU1RIT0UKVEFQIyNBRElOI0FVRElFI1BBSU5UCiMjI0JBU0sjI0FWRSMjV09STSMjIwpGSUVMREhBTkRGSVJFQUNIRVBBQ0sKRU1JVFMjI09VUlMjQkxVTUUjTU9FCk5PRFMjTUVUUk8jTUVMVFMjRElORQpEVUUjU0FYRVMjQUVSTyMjUkVHQU4KU1RSRVRDSFNUT1BTVFJPS0VCT05FCiMjI0RFU0kjI1VOQSMjTE9GVCMjIwpUSFJPVyNCT09aRSNBU0lOIyNMQU0KUk9PTVNQSU5CT0FSRExPR1NQQUNFCkFTUCMjT1RPUyMjT0FSUyNQVUNLUwpQSUVQQU4jI0NIRUFQIyNGT1JUQVMKUEVEQUxTSURFVVBTVEFHRVRSQUNLCkVSSUNBI1NPTk5FVCNQRVJUI1NLSQpEWU5FUyNUSEVTRVMjVE9OWSNFU1Q="},{"title":"1/26/04 BUZZ","author":"by Lee Weaver, edited by Stanley Newman","date":"2004-01-26","grid":"SUJJUyMjQ09DQSMjRlJBClJPUEVTI0FEQU1TI0xFTgpNT1NRVUlUT05FVCNZRVQKQVJPVU5EI1JFTElBQkxFCiMjI0VMTEUjU0lMTFkjIwojQUxMSUVEIyNBVE9OQ0UKSVRPI1RSSVBTI1NISUxMClRBQ08jI1RBVCMjQUdVQQpFUlVQVCNTVFJBUCNIRU4KTUlTRVJTIyNBRE9QVFMjCiMjVFJVTVAjWUVMTCMjIwpQT1RBVE9FUyNQSUFOT1MKQUlSI0hPUk5FVFNORVNUCkFMRSNTVFJBVyNIRUxMTwpSWUUjI0hZUEUjI1NMT1c="},{"title":"1/27/04 ON PARADE","author":"by Gail Grabowski, edited by Stanley Newman","date":"2004-01-27","grid":"QUJCRSNTUE9UUyNLTkVFCklPVVMjUkFSRVIjRUVMUwpEQVJLSE9SU0VTI1lBTVMKI1RSSU8jRE9UI0lTVE9PCiMjI01PT04jRUFTVCMjIwojUk9PVEJFRVJGTE9BVFMKQ09UIyNJUlYjVEVORE9OCkxVVEVTI1NJRCNTRUVUTwpBR0VOVFMjQUFBIyNMRVcKUEVSTUFORU5UV0FWRVMjCiMjI0VSTEUjQUVSTyMjIwpUT0FTVCNST0IjQUxPRSMKQVJDSCNDSUdBUkJBTkRTCk1BUkUjUkVFU0UjUkVBUApTTEVEI1RSRUVEI0VSTUE="},{"title":"1/28/04 DINNERWARE","author":"by Robert H. Wolfe, edited by Stanley Newman","date":"2004-01-28","grid":"U1dJRlQjVElSRSNCQVNFClRJQklBI0FERUUjT1JDQQpPUkFOR0VCT1dMI1NNT0cKV0VSRSNNTExFI1NOT1JFCiMjI1NISUVTVCNBSVJFUgpSVVNTRUxMIyNGTEFQIyMKT0NIRVIjQVJUSUUjTE9QCkFMQVMjRU1CRVIjQkFLRQpNQVYjU0VQSUEjVEVUUkEKIyNJR09SIyNSQVdERUFMClNZTk9EI1NQSU5BTCMjIwpNQUdOQSNDQU5UI0lTTEEKQUhNRSNTVUNUSU9OQ1VQClNPVVIjQ1JFVyNXRUFSRQpIT0dTI0lGU08jRU5URVI="},{"title":"1/29/04 MAGNETIC","author":"by Patrick Jordan, edited by Stanley Newman","date":"2004-01-29","grid":"UkFUUyNXSVRDSCNCRUxMCkVXT0sjSU5VU0UjQVFVQQpDT01JQ1NUUklQI1JVTlMKVUtFI0FFT04jI0JSQUdTClJFU0lTVCMjU0tFRVQjIwojIyNTSE9QUElOR0xJU1QKQ1JFTUUjUkFURSNTT0hPCkxPWCNXSElOSUVSI05PRwpBVFRBI09NRU4jQVRTRUEKUEhPTkVNRVNTQUdFIyMjCiMjUk9WRVIjI1NURUxMQQpDVVRJRSMjSEFIQSNFQVQKRVJJTiNQSE9UT0dSQVBICklTTlQjSlVST1IjSUZTTwpMQUdTI1NNQVpFI0RZRVM="},{"title":"1/30/04 BODY TONING","author":"by Merle Baker, edited by Stanley Newman","date":"2004-01-30","grid":"SEFVTCNBTUVCQSNPR1JFCkVSVEUjTElBUlMjRVJJTgpBR1VBI0lOU0VUI1JFTkQKUFVSUExFSEVBUlQjRUdPClNFTkRPTiMjRE9JVE5PVwojIyNBQkFCQSNTTlVCIyMKR09CWSNUVVNLI0VYQUxUCkFXTCNSRURIRUFEI0NFTwpQTFVUTyNERUVEI0FLSU4KIyNFUklTI1NOQVBTIyMjCkpVQklMRUUjI01VU1NFUwpFTEwjWUVMTE9XQkVMTFkKU1RPUCNTVEFHRSNST0FOClRST0QjVE9PTFMjVE9UTwpTQURBI09OU0VUI1NQRUQ="},{"title":"2/01/04 USE-FUL: Two at a time, to be specific","author":"by Shirley Soloway, edited by Stanley Newman","date":"2004-02-01","grid":"SElTUyNBTk5TIyNNT0NIQSNERVBUCk9UT0UjUE9PSCMjSVNBQUMjRUxJRQpTSFVUVEVSQlVHI0RVU1RSVUZGTEUKVE9TU0VEI0lURU1TI0tFRUwjSU9OCiNUQUJTIyNTVFJJUEVTIyNSQU5UUwojIyNBU1BTI0xJTEFDI0NPSUwjIyMKQUxFQyNFVFJFI0VOTyNFWENFUlBUCkxVQ0tZTlVNQkVSI0xVTkNISE9VUgpBUlIjQUREU1VQIyNFTFNBI09BVFMKU0tVTEwjIyNTSVBTI01VUk1VUlMjCiMjI0FUQU4jI0NBTiMjU1RBUyMjIwojQ1VUQVJVRyNTV0FCIyMjWUVNRU4KQ0FQRSNPRElFIyNGVUxDUkEjQVZFClNQVU5TVUdBUiNEVVRDSFVOQ0xFUwpBUFBFQVNFI0FHTyNUTUVOI0FJTlQKIyMjU0hFRCNTQVVURSNSRUVMIyMjCkJBTFNBIyNSRURCSVJEIyNXRUFSIwpFUlkjUkVQTyNTVEVOTyNGRU5DRVMKVFVSTkFST1VORCNSVUJCRVJEVUNLCkFCRVQjTk9UUkUjI1RJUkUjQVRPSQpTQVNII09MRUFOIyNTRUFUI1JFTlQ="},{"title":"2/02/04 THROUGH THE DECADES","author":"by Sally R. Stein, edited by Stanley Newman","date":"2004-02-02","grid":"U0FORSNTTFVSI0FSU09OCkFNRVgjTE9SRSNMVUNSRQpGQUJVTE9VU0ZJRlRJRVMKRUxVREUjU0FVREkjU0dUClNJTEVOVCMjR0VFI1NBTApURUEjI0hBVEVTI0RPTkUKIyMjQ0FJUk8jI1RZUk9TCiMjR0FZTklORVRJRVMjIwpEQVJJTiMjR0FJTlMjIyMKRUxBTiNFTlNVRSMjQVBSCk1BRCNCVFUjI1NQSEVSRQpFTVUjTE9HT1MjQUlSRUQKUk9BUklOR1RXRU5USUVTCklEVEFHI0VUQUwjTUFORQpURUVUSCNUT05JI0VMU0E="},{"title":"2/03/04 MAKE-BELIEVE MISSES","author":"by Lee Weaver, edited by Stanley Newman","date":"2004-02-03","grid":"UE9MTyMjRkFTVCNFR0FECkFQQVIjQ09VUEUjVE9SRQpDSU5ERVJFTExBI0VMSUUKU0VEQVRFI0RJU09SREVSCiMjI0lIQUQjVEVOTklTIwojQU1ORVNJQSNSRUFMIyMKT1VJI1JFQUxNI1NMT1NICkVEUyMjI0xFRSMjI0NFTwpSSVNFTiNTQ0FNUCNLQVQKIyNNQUlOI1NUQUxFU1QjCiNCVUdMRVMjU1BJTiMjIwpERUZMRUNUUyNMRUFWRVMKUklGRSNUSU5LRVJCRUxMCklHRVQjQUxPRVMjTElNTwpQRVRTI1JFQkEjI0VMU0U="},{"title":"2/04/04 BAKE-OFF","author":"by Fred Piscop, edited by Stanley Newman","date":"2004-02-04","grid":"Q0FTRUQjTU9BTiNTSEVECk9HTEVSI0FMVE8jTU9SRQpEQUlMWUJSRUFEI0FSSUEKQVRNI0RBWSNMRUFSTkVSClNFRVBFRCNTTEFOVCMjIwojIyNJTk9ORSNMT0NLVVAKQ0VERSNGQVJNI05PSVNFCkFMRUMjRklSRVMjT1RUTwpTTEVFVCNMQU5FI0tFQU4KSEVST0lDI1RVVFRJIyMjCiMjI0ZMQVJFI1NIRUFSUwpFTEVDVFJPI01BUiNUQUUKREFUQSNTV0VFVElFUElFCk5JQ0sjT0RPUiNGTEFTSwpBQ0hFI05ZU0UjVElSRVM="},{"title":"2/05/04 IN PIECES","author":"by Randall J. Hartman, edited by Stanley Newman","date":"2004-02-05","grid":"QU1CTEUjVEVUI0ZMT1BTCkRPTEVTI0VTRSNSRU5FRQpEUk9QVEhFQVgjSU5FUFQKTEFLRSNBVElUI0RPU0VTCkVZRVdBU0gjSVJBIyMjIwojIyMjU0hFTExFWUhBQ0sKT1BSQUgjI0xFTiNFRElFClBFRVIjRVJBU0UjUkFURQpFUklFI0RFTSMjV09NRU4KQ1VUQU5EUEFTVEUjIyMjCiMjIyNPWUwjQ0FUU1BBVwpBREFNUyNBVE9NI0NBU0UKTUFSSU8jQ0hPUEhPVVNFCkVSSUNBI0VBVCNSVUxFRApTVEVFUCNTSVMjU1RBVFM="},{"title":"2/06/04 FOUR-PIECE SET","author":"by Merle Baker, edited by Stanley Newman","date":"2004-02-06","grid":"U1RSVVQjQ0hBU00jQ0FCClNBRU5TI0JBU1JBI1VTTwpHUkFDRVBFUklPRCNURVgKVE9JTCNJUktTI0VTU0FZClNUUkVXTiMjI0JPSUwjIwojIyMjSEVBUlRPRkdPTEQKQ0hFVlkjTElPTiNNT1VFClJPTkEjVEFOWUEjQVNBUApBQkVMI0FSR08jVVNFVVAKV09SRE9GTU9VVEgjIyMjCiMjR0VOVCMjI0FGUkVTSApTRUlaRSNKT0VMI0VMT0kKQURaI0RPVUJMRVRISU5LClZJRSNHUkFJTCNSRVRJRQpFVFMjRVJORVMjQU1FTkQ="},{"title":"2/07/04 SATURDAY STUMPER","author":"by Daniel R. Stark, edited by Stanley Newman","date":"2004-02-07","grid":"UklDRUNBS0UjRURJVEVEClVOTE9PU0VEI1JFTkVHRQpUT1VTTElORyNBU1RFUk4KQVJCI0xBTkVTI1RFTkVUCiMjI1RJTkUjRU1JUkFURQpaQUlSRSNMQU1JTkEjIyMKT1NDQVJTI0JJU0VDVEVECk5FRUQjQU1VU0UjVEFLRQpFQVRFUklFUyNSRUlORUQKIyMjU0FOREVEI1BPU1NFClBBTEVUVEUjQU1JTiMjIwpFUkVDVCNTTFVFUyNFQVIKUEVBUkxTI0lOU1RBTkNFClVOUkVFTCNTVEFMTE9ORQpQQU5UUlkjQVNTRVNTRUQ="},{"title":"2/08/04 PARTY TIME: Wherein the last word is the key","author":"by Merle Baker, edited by Stanley Newman","date":"2004-02-08","grid":"QUxFUyNBR0VOREEjUkFCSSNEQVVCClJVTkUjTUlOT1JTI0FORVQjRUxNTwpBQ0RDI0FMSU5FUyNTR1RTI1NMQVAKQlJPVUdIVERPV05USEVIT1VTRSMjCiNFUlJPTCMjIyMjSEFMRSNQRU5DRQpBVFNFQSNCT1RBTklDQUxHQVJERU4KRElFIyNQVVNISUVTVCMjQU5URUVECkRBUktWSUNUT1JZIyNBQ0lEUyMjIwojIyNSSVNLRVIjI0JSVUlUIyNHTVMKU0VORUNBIyMjSUdVQU5BI1NLRUVUClRIRU1BTldIT0NBTUVUT0RJTk5FUgpMVVJFUiNPSUxFUlMjIyNBRFVMVFMKT0REIyNGUkVFRCMjR0FUSEVSIyMjCiMjI1NQQU5TIyNNRU5UQUxCTE9DSwpPTlNQRUMjI1NVTkxBTVBTIyNWRUUKTk9UT05FU0NVUE9GVEVBI0FSRU5BClNXT1JOI1RPR0EjIyMjI0FQQVJUIwojI1dBU0hJTkdUT05TQklSVEhEQVkKQVRBRCNPRk1FI01PVVJOUyNST1ZFCk1BR0kjQUxBUyNTVFJBVE8jQU5PTgpPUEVDI1JFTlQjS0VFTk9OI0hFU1M="},{"title":"2/09/04 FOWL UP","author":"by Lee Weaver, edited by Stanley Newman","date":"2004-02-09","grid":"U0FQIyNCQVJCUyNQTEFOCkVOSUQjRUxJT1QjTElNRQpFREdFI0dPT1NFQlVNUFMKI1NFR01FTlRTI0FNQVNTCiMjT1JBVEVTI1NLSSMjIwpIT05FWVMjI0NIRUVUQUgKQUNIRVMjT0JPRSNSVU5FClJFTyMjU1RBTkQjI1JURQpQQUxTI0hJREUjUE9LRUQKT05FSURBUyMjQklQRURTCiMjI0RVRCNTQ0FOVFkjIwpBQ1JFUyNTUEFSU0lUWSMKQ0hJQ0tFTk9VVCNPUkVTCk1FU0EjUE9JU0UjTk9BSApFV0VSI0FCTEVSIyNUSFk="},{"title":"2/10/04 ON TRACK","author":"by Norma Steinberg, edited by Stanley Newman","date":"2004-02-10","grid":"SFVNI1RSQVBQI0FSVElFCk9OQSNSVVNTTyNWRVJHRQpXSU5XSU5TSVRVQVRJT04KQVNUUk8jIyNBU0lERSMjClJPUlkjUEFTVEVMI0RCQQpETkEjUE9STk8jI1RPQUQKIyMjSEFTVE8jQ0FSVVNPCiNQTEFDRVlPVVJCRVRTIwpTSE9SVFMjS05BQ0sjIyMKUEVORCMjUkVJTlMjUk9ECkFXRSNTV0VSVkUjSEVSRQojI1NUQUhMIyMjQVNQSUMKU0hPV1RPQURWQU5UQUdFClJBTUlFI1RSQUNUI1NJTgpPV0VOUyNFU1RFUyNUTlQ="},{"title":"2/11/04 SEPARATIONS","author":"by Fred Piscop, edited by Stanley Newman","date":"2004-02-11","grid":"TEVIQVIjVEhBVyNIQVNICkFMSVZFI1JPREUjQUxVTQpDSVZJQyNPV0VEI1VURVMKI1NFVkVOVEVOU1BMSVQjCiMjIyNET1MjIyNMRU0jIwpSSUNIRVMjU1RSVURFTFMKQUxPRSMjUk9SRU0jVEVBCkNPTU1FUkNJQUxCUkVBSwpFU1AjUkVQTFkjI09STkUKUkVFTkFDVFMjQk9PU1RTCiMjVEFTIyMjRk9SIyMjIwojR0VORVJBVElPTkdBUCMKUElOVCNPWEVOI0VMTElTCk9OQ0UjV0VSRSNSVUxFUgpXQVlTI1NMSUQjWUVBUlM="},{"title":"2/12/04 FRONTIER DAY","author":"by Roslyn Stark, edited by Stanley Newman","date":"2004-02-12","grid":"QlJVVCNQRURBTCNCT09NClJBTkkjQVZJTEEjQUdSQQpPQklFI1JFU09EI1JFRUQKI0JPUkRFUkNPTExJRVMjCiNJTlJFIyMjRkVFVCMjIwojIyNBVURFTiMjVE9SU08KQURBI0NPUk9OQSNORUlMCkNPTVBFVElUSVZFRURHRQpFTUlSI1NDRU5FUyNPTk8KU0VEQU4jI1NFQ1RTIyMjCiMjI0xPQUQjIyNFT05TIwojRlJJTkdFQkVORUZJVCMKTkVPTiNBVE9ORSNURUFMCkVUUkUjUEVORFMjRUNITwpXQVlTI0VSTlNUI1JFTFk="},{"title":"2/13/04 MOUTHFUL","author":"by A.J. Santora, edited by Stanley Newman","date":"2004-02-13","grid":"SE9DS1MjSVJFI1JBSEFMCkFQUklMI05PUiNFTEFURQpCRUFUSU5HT05FU0dVTVMKSVJLI0RPUk0jU0VBTFMjClRBRSMjUkFJREVEIyMjIwojIyNTT1JURUQjQVNLRUQKVE9PVEhJRVNUIyNQSUxFCkhBUkVNUyMjI0JST1dTRQpBSEVNIyNUSFJPQVRJRVIKVFVMU0EjUkFJTkVTIyMjCiMjIyNCRUFST04jI0hBUwojU05BUkwjU1RFUCNBQ1QKU0xJUE9GVEhFVE9OR1VFClNBTFNBI09FUiNST1VURQpUV0VFRCNFUlMjS05FRUw="},{"title":"2/14/04 SATURDAY STUMPER","author":"by Anna Stiga, edited by Stanley Newman","date":"2004-02-14","grid":"IyNTRVdFUiNUUklURVNUCiNWSVRBTEUjUkVNSVhFUwpMSUJFUklBI0FUUEVBQ0UKT1ZFUkxBUCNJUkEjQ1JUCkJBUk5PTkUjUEFMQVRFUwpFTklBQyNERVNQRVJBVEUKU1RBTEtTI1JFUFJJU0VTCiMjIyMjVEVBU0UjIyMjIwpTUEFSVEFOUyNEQVJOSVQKQ0FTU0VUVEVTI0dPVURBClJVU1RMRVIjVE9BU1RFUgpBTEUjU01VI0FNSVNUQUQKUElSQVRFUyNURU5TRUxZCkVOVFJBTlQjVU5TRVJTIwpERVNFUlRTI0VTVEFTIyM="},{"title":"2/15/04 COVERING THE OUTFIELD: Three-word phrases with something in common","author":"by Fred Piscop, edited by Stanley Newman","date":"2004-02-15","grid":"REVQT1NFUiNDQVJPTCNCRUQjQVBUCkFWRVJBR0UjQUdBUEUjQVVST1JBRQpCRUFTVE9GQlVSREVOI0NSQVZFTlMKQVJMTyMjRkFTTyNSSUNLI0dFTkVUCiMjIyNLUkVNRSNNQU5PRk1PUkFMUwpERUNSSUVEI1dBQ1MjRElBTkUjIyMKRVhIQUxFI1NBUkEjI0RSWSNNQVJDCkZFQVJPRkZMWUlORyNMRUFQT1ZFUgpFUlRFIyNMT1NFI1VLRVMjQVRPTkUKUlRTI0NIRU0jI1BSTyMjQkxFTkRFCiMjI0hFQURPRkhPVVNFSE9MRCMjIwpMQVBFTFMjI1JPVyMjTEFXUyNJT0MKT05BTEwjT0JPRSNTSUxMIyNFUkdPCkFOQUxPR1VFI1NFTlNFT0ZTTUVMTApGQVJPI0lURSMjTElPTiNSQUlORUQKIyMjRE9OT1QjQUxQUyNTRUxMRVJTCkxBQk9ST0ZMT1ZFI0NPTUVUIyMjIwpPR0lMTCNTRVJJI0FFUk8jI1NQVVIKQ09MTEVDVCNHQUdHTEVPRkdFRVNFCkhPTFlTRUUjQVRSRUUjVFJBV0xFRApTRFMjU09QI05FRURTI0hBUk5FU1M="},{"title":"2/16/04 MEET THE PRESIDENTS","author":"by Sally R. Stein, edited by Stanley Newman","date":"2004-02-16","grid":"U0VBTSNTVEFUI1NUQUdFCkFVTlQjVEFVUyNIRUxFTgpHUk9WRVJDTEVWRUxBTkQKU09OI1JBSUQjQUxMSUVTCiMjI0dSSVQjRU5WWSMjIwpMQVJJQVQjSFlERSNBUEIKQUxFUlQjQUlEQSNFTEFMCk1JTExBUkRGSUxMTU9SRQpBVklTI09ESUUjT0lOS1MKU0VUI0xPVVMjQ0FSRVNTCiMjI0hPU1AjQVJUUyMjIwpBU1BFQ1QjQkxBSCNBSEEKVEhPTUFTSkVGRkVSU09OClRPTEVUI1VOSVQjQUlOVApOT09ORSNURUVTI1lBS1M="},{"title":"2/17/04 BRIDAL QUARTET","author":"by Lee Weaver, edited by Stanley Newman","date":"2004-02-17","grid":"REFEI0NBRCMjQURPUkUjCkVSRSNBTU9LI1JFTE9BTgpXSUxETElGRSNDTEVBVkUKIyMjT0xERkFTSElPTkVECiNBTk4jIyNORUUjIyMjIwpBVEEjI0JMVUVSSUJCT04KU1RSSVBFUyMjI0dBVUdFCkhVUkRMRUQjU1RFUklMRQpFTk9MQSMjI1NFVFRMRUQKTkVXRU5HTEFORCMjRFJZCiMjIyMjQUlSIyMjTVNTIwpCT1JST1dFRFRJTUUjIyMKVU5DT1JLI09STkFURUxZClRFTVBMRSNSQUNLI0VZRQojU1BFRUQjI01BRSNMRVQ="},{"title":"2/18/04 MULTILINGUAL","author":"by Daniel R. Stark, edited by Stanley Newman","date":"2004-02-18","grid":"QkFJVCNUSUJFUiNZT0dBClVSRFUjT0NBTEEjSU5OUwpCQUVSI1BFUlNJQU5DQVQKI0JBS0VTI1JBU1AjRVRBCiMjI0lET0wjU0VMRiMjIwojU0VTU0lPTiNEVVJJTkcKU0hBSCNMVUlTI1NFTk9SCkNVUkIjU0lHTUEjTlVERQpBVExBUyNTRUVSI0NSRVcKTkVTVExFI0xBVENIRVMjCiMjI0hPUlMjUklPVCMjIwpBVEUjVE9PTCNTUE9PRiMKRFVUQ0hUUkVBVCNBTExBCk9CT0UjSVJBTkkjU0VBTgpTQU5FI0NZTklDI1RPV04="},{"title":"2/19/04 COMMON SENSE","author":"by Robert H. Wolfe, edited by Stanley Newman","date":"2004-02-19","grid":"VElSQURFI0ZVU1MjRk9SCklTQUJFTCNBUlRFI0FETwpTTUVMTERBTkdFUiNJRE8KIyMjQVZFUyNFTlRFUlMjCiNTSVpFUlMjUk9BQ0gjIwpBTk5FIyNFU1MjI1JFUFMKTElQI0JBUlQjU1RVQVJUCklQTyNJTlRPVUNII1JFQQpTUE9UVFkjQVNIWSNJVlkKVFlSTyMjQlNBIyNHTlVTCiMjVEVNUE8jR0FSQUdFIwojTkFESVJTI0VNSVQjIyMKUEFTI0xPU0VTSUdIVE9GCk9QVCNFVkVTI1NIRUVOQQpERUUjUkVTVCNTVFJFRVQ="},{"title":"2/20/04 OH-OH","author":"by Fred Piscop, edited by Stanley Newman","date":"2004-02-20","grid":"U1VSRlMjVEVTSCNBTkRTClRSRUFUI1VDTEEjQk9PVApFR0dDQVJUT09OI0JPREUKUEVTVExFI0xBR1JBTkdFCiMjI09MRFMjTkVPI1BFRApBTkRSRVRUSSNST0FSIyMKTk9SI0RBUk5TI0ZMT1JBCk9NQU4jR09UQVQjQUZBUgpORUdFViNQRUxFRSNJQk0KIyNPVkFMI1JFUExBVEVTCkFQTyNUQVAjU0VFTSMjIwpHQU5HU1RFUiNFVkVSU08KQUxGQSNIQUlSU0FMT09OClBFTFQjRUxTQSNUSVRMRQpFRFlTI1JFRUYjRUFTRVM="},{"title":"2/21/04 SATURDAY STUMPER","author":"by Merle Baker, edited by Stanley Newman","date":"2004-02-21","grid":"QUNDRVBUUyNERUFMU1RPCklTQVRUSEVCT1RUT01PRgpPUFBPU0lURU5VTUJFUlMKTE9PTiNTSVRFRCNTRU5UCklUU1NPIyNIRUVEIyMjIwojIyMjVklTQVMjSURJT1QKTUFSVkVMQVQjQ1JJU0NPCklOVEVSTEVBR1VFUExBWQpTS0VFVFMjU1VCQ0xBU1MKVEFTU08jU0lUQVQjIyMjCiMjIyNQQU5UIyNTVEFTSApJQk1TI0NPTUVBI0lESU8KUFJBQ1RJQ0FMSk9LRVJTClNBVFVSREFZTUFUSU5FRQpFWUVURVNUI09SRVNURVM="},{"title":"2/22/04 SIGN IN, PLEASE: A new switcheroo","author":"by Randolph Ross, edited by Stanley Newman","date":"2004-02-22","grid":"UEFMT01BI0tJTE9TI0hBUkkjQVJDCk9NRUdBUyNJQ0FSRSNFREVOI1JFTApTT1dFVE8jTElCUkFPRkpVU1RJQ0UKIyNTRUVOT04jIyNTU04jUElSQVRFCkFNQVNTRVIjQkJMI0xFQSNHSU5PUwpESUcjIyNDQVBSSUNPUk5DSEVFU0UKQUtJTlMjI0ZMRUVUIyNFQVRTIyMjCk1FVE9PI1RBVVJVU0RPR1MjT0JJVAojI1RBU1RFUlMjIyNFUkdTI05BREEKQllBSEFJUiMjQUxPTkUjIyMjVElNCkxBUlMjTElURVJBUllMRU8jVFRPUApJTkkjIyMjUkFJU0UjI1NBQ0hFVFMKR05VUyNBVkVTIyMjVEFUVExFUiMjCkhJU1QjTElLRUFWSVJHTyNBUklFTAojIyNBUkVTIyNMRVJPSSMjWUVOVEEKTUlOTkVTT1RBR0VNSU5JIyMjR0FNCkFST05JI1JBRyNQQVMjUkVTVEFURQpQQVRJTkEjTkVBIyMjU0VUVEVSIyMKUElTQ0VTQU5EQ0hJUFMjQUVSSUZZCkVTRSNSSUNFI1RBQ0lUI0lOTkVFRApERVQjU0FVRCNTVEVQUyNMT1NTRVM="},{"title":"2/23/04 GO A FEW ROUNDS","author":"by Lee Weaver, edited by Stanley Newman","date":"2004-02-23","grid":"QVNIRVMjUFNTVCNTTklQClNMT1NII0FDRVMjSElWRQpUQU1QQSNSQU1QI0FTSUEKSVZFI0ZFUlJJU1dIRUVMCiMjUEFUUk9MIyNJU0lTIwpFTExTI1NURUFMUyMjIyMKUkVBUCMjI1RSRUVUT1AjClJFVElSRUUjQ09ST05FVAojUkVDSVRBTCMjI0FUVFUKIyMjI1BFUklPRCNTSEVCCiNTRVJFIyNDVVJBVEUjIwpVTkRFUlRIRVNVTiNCT0cKU09EQSNIVU5UI0tIQUtJCkVSSUMjRUxTRSNIQUxMUwpTVEVUI0VLRUQjU1BMQVQ="},{"title":"2/24/04 GROUP LIFE","author":"by Gail Grabowski, edited by Stanley Newman","date":"2004-02-24","grid":"Q0FERVQjQU5USSNDT0RBCkFMSUJJI01FQU4jSE9BWApSVUJCRVJCQU5EI0FOVEUKRU1TI0RFRVAjSVNSQUVMCiMjI0VZRVIjQkFVTSMjIwpCUkFDRUQjU0xJUFNIT0QKTElNT1MjQkVBTiNDQUdFCkFESU4jU0xJQ0sjSElSRQpTRUdPI0hPTksjUE9LRVIKVFJPTUJPTkUjQkxPVVNFCiMjI1lBUkQjRk9BTCMjIwpTTkFQQVQjRUFTWSNERVcKVEFSQSNDSVZJQ1BSSURFCkVQSUMjVVNFUiNFRVJJRQpQRUFLI1RPTlkjTk9URUQ="},{"title":"2/25/04 BANK ON IT","author":"by Randall J. Hartman, edited by Stanley Newman","date":"2004-02-25","grid":"TUVUUyNDSEFMS1MjVk9XCkVESUUjUkFCSUVTI0VMSQpTSURORVlMVU1FVCNSRU4KU1RFQUwjRVRPTiNTTU9HCiMjI1RFRCMjI0VTQUkjIwojU1RFVkVMQVdSRU5DRSMKQVRBIyNNSU1JI0FURUFNCkRBS0FSI0JBRCNTQUxWRQpBUkVOQSNSVEVTIyNMRUcKI1NJTkNMQUlSTEVXSVMjCiMjVElLSSMjI09UTyMjIwpGUkVFI1ZFQUwjQU1CSVQKTEVBI1NFUkdJT0xFT05FCkFEUyNBUkFSQVQjTkFHUwpUT1kjRFlTQVJUI1NURVQ="},{"title":"2/26/04 MISTERS","author":"by Fred Piscop, edited by Stanley Newman","date":"2004-02-26","grid":"QkFHSVQjUElMRSNPQ0hTCkFMT05FI0VSSU4jQ0hPVwpST0JFUlRUQUZUI1RFTEUKQkVTU0VSI1NFUlJBVEVECiMjI1NOSVQjUkVPI0FERQpCRURFQ0tFRCNFTUlUIyMKT1ZPI0VFUk8jI0FOS0hTCldFTlQjU0FHRVQjRklBVApFUlJFRCMjRU5JRCNOUkEKIyNJTk9OI1NDUkVXU0lOCkFSQyNMT1MjTEFDRSMjIwpCQUtFTElURSNOT1RBVEUKSVRMTCNTQU1SQVlCVVJOCkRFRU0jRVJJRSNFQVJFRApFU1NPI1NFTEwjRFJBWVM="},{"title":"2/27/04 B-PLUS","author":"by Norma Steinberg, edited by Stanley Newman","date":"2004-02-27","grid":"TUJBUyNTQUxUI1JJTkdTCkFMTEkjRVdFUiNFTUFJTApST09GI0NBTkUjU0FTU1kKI0JVVFRFUkRFTElHSFQjCiMjIyNPREQjI0VTRSMjIwpSRVNVTUUjVEhBVCNTSVQKQUxPTkUjQkVFUyNSVURFCkJPVVRJTkxFRlRGSUVMRApJUFNPI0FJTlQjQURERUQKTkVFI0FNUFMjR1JFRURZCiMjI01NRSMjTE9HIyMjIwojQkVBVURFQ09MT0dORSMKUEFSSVMjV09PRCNORVhUCkdSQVpFI0VMU0UjQVJJQQpBU1NFUyNTRUVOI1RPVE8="},{"title":"2/28/04 SATURDAY STUMPER","author":"by Daniel R. Stark, edited by Stanley Newman","date":"2004-02-28","grid":"TElCRVJBTCNTVEFQTEVECk9DQVJJTkEjSEVMT0lTRQpURU5BTlRTI09SSUVOVFMKSEFEI1NJVENPTSNUSVJFCkFHSUxFI1dBVEVSI01BUgpSRVRFI1JPTiNERUNFTlQKIyMjQVBBUlQjI0JJTkdFClNUVURJRUQjQ09VTlRFRApQQU5FTCMjQ0FSVEUjIyMKT1BFUkFTI09MRCNNQUNTCk9EQSNGSU5BTCNMQVRIRQpLQVJMI0xVWFVSWSNURUUKSU5UT05FRCNTVU5OSUVSCkVDSE9JTkcjRU5ET1JTRQpSRVNUQVRFI1NFQVdFRUQ="},{"title":"2/29/04 ALL IN THE FAMILY: A possible tip for reunion planners","author":"by Lee Weaver, edited by Stanley Newman","date":"2004-02-29","grid":"QVJBQiNPTEQjI0NBTUVMI1NQQVNNClZJTk8jTElFRiNPSEFSQSNBUkVURQpJRllPVUVWRVIjVEFMT04jTUVESUEKQUxPRVMjRVBBIyNCRVNFVCNCRUxUClRFTkRFRCNFTk9TIyMjI1dSSVNUUwpFU0UjI1JBU0NBTCNBU1NBSUwjIyMKIyMjV0FOVFRPRklORExPTkdMT1NUClBBUkFTT0wjIyNET1pJTkcjI0RPRQpTSEVJSyNBQ0hFI0dFTVMjRElET1MKVEFDVCNBU0hPUkUjIyMjRElHSVRTCiMjUkVMQVRJVkVTSlVTVFJFTlQjIwpJQkVSSUEjIyMjVEFQSVJTI09JU0UKUk9BU1QjU0lUVSNNSUNBI0ZSRUFLCk1BVCMjTUFSSU5BIyMjQ0VMRVNURQpBU0VBU0lERUNPVFRBR0VGT1IjIyMKIyMjQ0FSRVNTI1RIV0FSVCMjV0FOCkFDQ0VERSMjIyNORUFMI1NFUkFQRQpMT09UI0RBUlRTIyNJQU4jTUFSSUEKQUxJQVMjV0hFQVQjVEhFU1VNTUVSCk1JTlRTI0xFQVNFI1NBTkUjUFVDRQpPTlNFVCNTQUxTQSMjREVXI1NQRUQ="},{"title":"3/01/04 FOR A CHANGE","author":"by Lee Weaver, edited by Stanley Newman","date":"2004-03-01","grid":"Rk9BTSMjQ0hBUiMjREFCCk9QUkFII0FPTkVTI0lEQQpOSUNLRUxQTEFURSNNVUcKREVTSVJFUiNQQVJDRUxTCiMjI05PVkEjI0tBUkFUIwpCVURHSUUjUEVFUEVEIyMKQU5PI0NFTExPI0VQT0NICklETEUjU1VJTkcjRVpSQQpUT0xMUyNCRVNPVCNFRVIKIyNBTExJRUQjRElOTkVECiNQUkVFTiMjTElNTyMjIwpTQURORVNTI0FWRU5HRVMKQUdBI1BFTk5ZQVJDQURFCktFWSNTQ09SRSNTT0xBUgpJRFMjI1RCQVIjI01BTUE="},{"title":"3/02/04 FOR THE BIRDS","author":"by Bob Frank, edited by Stanley Newman","date":"2004-03-02","grid":"RkVSTiNDSEVFSyNTSVJTCklERUEjSFVST04jSVJJUwpGRUFUSEVST05FU05FU1QKRU5EI0FOVFMjRVRVREVTCiMjI0FWRVMjQVBFUyMjIwpNSVNMQVkjV1JBUCNGTEEKT05JT04jTEFJRCNERUVTClNQUkVBRE9ORVNXSU5HUwpIVUVTI09SRVMjSEVER0UKRVRTI0FXRUQjUEFUU1lTCiMjI0dVTk4jR0FMUyMjIwpBQkJPVFQjTUFSRSNMQVMKQ09NRUhPTUVUT1JPT1NUCkhPT1QjV0FERUQjQVJJQQpFVENII05PSVNZI1JFQVI="},{"title":"3/03/04 FARMER'S MARKET","author":"by Daniel R. Stark, edited by Stanley Newman","date":"2004-03-03","grid":"Q0FCUyNJRExFI1NDQU1TCkFMQUkjR1JPVyNDUkFTSApQSUxMI0xVQkUjSE9BR1kKVElMTFRPTU9SUk9XIyMjCiMjIyNFT1MjI09MREVTVApPQlNFU1MjRU5ZQSNTVEUKUkVFRFMjTUFZQ1JPUFVQCkJBTkQjUEFSRUUjRElDRQpJVFNBUExBTlQjTklFQ0UKVElPI1JVTVMjQ09ORE9TClNUUkVFVCMjR09EIyMjIwojIyNDTE9VRFNFRURJTkcKU0FNT0EjVE9VUiNSQVVMCkVYQUxUI0VSSUMjT0dMRQpURUhFRSNTQVRFI1BPTEU="},{"title":"3/04/04 PEN STATION","author":"by Fred Piscop, edited by Stanley Newman","date":"2004-03-04","grid":"UEFQQSNTQ0FCI1BBVEhPCkZMQVkjSE9VUiNBTkFJUwpGT1VOVEFJTk9GWU9VVEgKVEVMI0lTTlQjUkVEU0VBCiMjI09OVE8jU0lSRSMjIwpQSUdJTkFQT0tFI1NBS1MKSUNJTFkjI05JTiMjQk9XClRPQlkjVVBFTkQjQkFSQQpUU0UjI01UQSMjRE9TRVIKU0FTUyNCVUxMRFVSSEFNCiMjI1RFUkkjRUFSTiMjIwpTQUxBTUkjTkFOVSNQQU4KUExBWUNBVEFORE1PVVNFCkFMTElFI0FOVEUjVVJJUwpTQU9ORSNQT09SI1RFU1Q="},{"title":"3/05/04 NASHVILLE BOUND","author":"by Merle Baker, edited by Stanley Newman","date":"2004-03-05","grid":"SVZFUyNQRUFUI1JJTlNFClRBUlAjQVNUTyNFU1NFTgpFTEFMI1JBSU4jRFJBV1MKTVVTSUNDSVRZVVNBIyMjClNFRVRIRSMjU05FRVJBVAojIyNQVUxMUyNNQUxPTkUKT1NJRVIjT09aRSMjRE9FClJZTUFOQVVESVRPUklVTQpBUlAjI1NUQU4jS0VOVFMKTElFRFRPI1NDUkFNIyMjClNBTE9PTlMjI0VQSUxPRwojIyNUSEVIRVJNSVRBR0UKUFVSRUUjT0xFTyNUWVJFCkFNQkxFI0NPU1QjQUxFUwpTUElMTCNLSVRFI0xBU0U="},{"title":"3/06/04 SATURDAY STUMPER","author":"by Anna Stiga, edited by Stanley Newman","date":"2004-03-06","grid":"U1RBTkRTSU4jRURCRVJHCkNPTE9SQURPI05FQVJFUgpBVE9ORUZPUiNMQVRJTkEKUkVNT0RFTFMjQUxTVE9OCkVSQVMjQklFUkNFI1JVVApTU1IjRkVaI0VFUiNFTkUKIyMjUk9URSNBRFNQQUNFCkZJQkVSIyMjIyNIT05FUwpJTkFNRVNTI0VNSVQjIyMKU1RMI1NLSSNUSVAjR0FTCkhFTSNUSU5NQU4jTU9STwpQUklNQUwjQUdJVEFUT1IKT05FSUxMI0xFVkVMT1VUCk5FU1RMRSNUUkVBVElTRQpERVRFU1QjU0VSUkFURUQ="},{"title":"3/07/04 JOB DESCRIPTIONS: Less-than-adequate workers","author":"by Randolph Ross, edited by Stanley Newman","date":"2004-03-07","grid":"QUZURVIjQklaRVQjVFJBSU5SSURFCkdSQVZFI0FTT05FI0JBUkdBSU5FUgpIQU1BTiNTSE9ERFlTSE9FTUFLRVIKQU5BREVNIyMjRURVIyNPVEUjV1BBClNDUkVXWUhBTkRZTUFOI0FMV0VTVApURUFTI1dFUkUjI1NXQUIjWUFMRVUKIyMjI0VBUlRIWSMjT05VUyNGTEFNCkZBVUxUWVNFSVNNT0xPR0lTVCMjIwpMVVJFUiMjIyNMSVAjI0VTUCNGSUUKSVJBVEUjQ0FZI1RBQ0tZU0FJTE9SCk5PTkUjQkFCQVIjSE9PRVkjQ09EQQpDUlVNQllCQUtFUiNFREQjU0FSSVMKSEFTI0FMQSMjRFJFIyMjI1dISU5FCiMjI0NSQU5LWU9SR0FOR1JJTkRFUgpSVUhSI1dBUkUjI09ORU9VVCMjIyMKQVBBSVIjU09BUCMjREFCUyNSU1ZQCkNBUk5BTCNDUlVTVFlQSUVNQUtFUgpFVEgjWUFPIyNTSEgjIyNTQVRJUkUKQ1JBQkJZRklTSEVSTUFOI1NUUk9QCkFFUklBTElTVCNMRUFWRSNBRVROQQpSRVNPTkFURUQjTEVWRUUjSURTQVk="},{"title":"3/08/04 SIMPLE PUZZLE","author":"by Sally R. Stein, edited by Stanley Newman","date":"2004-03-08","grid":"QUJCUiNNT0RFUyNTQU5LCk1FUkUjVFVSTkEjQ0hJTgpFTEVNRU5UQVJZI1JBTkkKTkFESUEjU1RBUyNBQkVUCiMjI1RSQVAjR05BVCMjIwpBQ1QjUElFQ0VPRkNBS0UKTkVSTyNNTk8jI1RIUkVFCk5MRVJTI1RBUyNTRUdBTApBTEFDSyMjU0hII0RPTkUKTk9USElOR1RPSVQjTkVECiMjI0VNSVIjVkVJTCMjIwpGSUJTI0VBVkUjRUFHTEUKRURJVCNDSElMRFNQTEFZClJFQVIjRUFTRUQjU09NRQpOQVNBI1NNQVJUI0VXRVM="},{"title":"3/09/04 4-H CLUB","author":"by Lee Weaver, edited by Stanley Newman","date":"2004-03-09","grid":"Qk9MRCNFQVRFUiNIQU5TCkFSRUEjTkFPTUkjRVhJVApIRUFSVFRIUk9CI0FMU08KU09GVEVSI1BUUyNERUVSCiMjI1NUWU1JRSNPU1NJRQpBTEEjIyNBRFJPSVQjIyMKUE9TSEVTVCNTQUxBQU1TCkFHSEFTVCMjI0hFUkJBTApSRUVOVEVSI05VUlRVUkUKIyMjREVNVVJFIyMjVEVECkZBTFNFI1NFQU1BTiMjIwpMRUFEI0FTUyNJQ0lDTEUKT1RUTyNIRUFMVEhDTFVCCkFORVcjQUxMT1QjS0lMTwpUQVJOI0JMRVNTI1NQVU4="},{"title":"3/10/04 GETTING THERE","author":"by Fred Piscop, edited by Stanley Newman","date":"2004-03-10","grid":"TU9PTlMjRkVFRCNCQVVECkFHTEVUI0FSTE8jVVJTQQpEUklWRVRSQUlOI0JFRVIKUkVWRVJFI1NUQVJCQVNFCkVTRSNOQU0jRVRBTCMjIwojIyMjRVJPUyNPUEVSQSMKQU1JU1MjU1BBUiNKSU1JClRFTVBUI0hFTiNMRU1PTgpFU0FJI0JFRU4jQVRFU1QKI0FTTkVSI0RVVFkjIyMjCiMjI0NFRVMjTEFTI0FHVApMQVdZRVJFRCNDT09QRVIKRVhFQyNGQVVMVFBMQU5FCkVMQUwjT0xMQSNFRVJJRQpSRU5FI1hZTE8jTk9URUQ="},{"title":"3/11/04 SHOW YOUR METAL","author":"by Robert H. Wolfe, edited by Stanley Newman","date":"2004-03-11","grid":"QVJJIyNFUFNPTSMjSU5OCk5PTkUjUkVFVkUjVFJJTwpHT0xERklOR0VSI0hPTEQKRU1JR1JFI1VORVZFTiMjClJFTkVFI0FFUyNBU0hFUwojUkVSRUFEIyNTVEVBTFMKIyMjI1NMQVBBVCNTTklUCkVMTCNUSU5IT1JOI0RFUwpNRUVUI1NPSVJFRSMjIyMKSU5BUlVUIyNUV0FOR1MjClRPRE9TI1BUQSNUSVJFRAojI0ZMRVNIWSNSRUNFREUKVE9PTCNDT1BQRVJIRUFECkFET1MjQVRFSU4jRVRURQpHRVQjI05PU0VEIyNTRUU="},{"title":"3/12/04 RELATIVITY","author":"by Richard Silvestri, edited by Stanley Newman","date":"2004-03-12","grid":"VEFGVCNSRUNBUCNKQURFCk9TTE8jRVJPREUjQURBTQpTVEVQI1BSVURFI01PVEUKU0lFU1RBT1JTTFVNQkVSCiMjIyNISUxUIyNTRUVEWQpIRVNURVIjI1RIVUQjIyMKT05FQSMjSUNJRVIjREFCCkNZUFJFU1NPUlNQUlVDRQpLQVQjTEFUVEUjI0FMTVMKIyMjTEVOTyMjRUFHTEVUCkFMSUVOIyNDQUxMIyMjIwpTQU5EQUxPUlNMSVBQRVIKU05VRyNBQkFURSNSSVRBCkFDUkUjTU9WRVIjQVRPWgpERUVSI0JFRVJZI01BTkU="},{"title":"3/13/04 SATURDAY STUMPER","author":"by Daniel R. Stark, edited by Stanley Newman","date":"2004-03-13","grid":"QU1BTkRBI1VQU1RSRUFNClBBUEVSUyNNRUxWSUxMRQpQUk9TSVQjUExBU1RJQ1MKRUFTVEVSTElMWSNBRE9TClRVVCNTT1VSRVNUI0VURQpJREEjIyNSRVQjSE9TVFMKVEVUI1NLSUQjQUlEIyMjCkVSRUNURUQjUExFQVNFRAojIyNQSU4jU0VMRiNJTEUKUkVTSU4jQlVDIyMjTE9BCk9SQSNURUFCQUdTI0VORApDT1ZFI1NUT05FSEVOR0UKT0RPTUVURVIjT0lMQ0FOCkNFUlVMRUFOI0RFTEVURQpPRFlTU0VVUyNFUkFTRUQ="},{"title":"3/14/04 V-8: With a few shorter ones thrown in","author":"by Fred Piscop, edited by Stanley Newman","date":"2004-03-14","grid":"TEVPTkEjU0lNUFMjTUFTVCNDQVBOCkFDSEVTI1NOQVJFI09TSEEjQUNSTwpDSElDS0VOS0lFViNUSEVJTVBST1YKVE9PVEVSUyMjVEVUSEVSI0FSRU5BCiMjI0FSSSNLRUVORVIjQVRMQVNFUwpTVEFSI0VWSUFOI0RBQ1RZTCMjIyMKSEVTU0UjRU5HUyMjI0xPTiNDTEFQCk9QUyNEQU5HTEUjQkVFTkUjTEFORQpXRUUjT1ZVTEUjTUVSViMjUEVTVE8KTkVFI01JU08jQUlTTEUjQ1JBVkVOCiMjTkFJTCNVU1NURUVMI0hFUkUjIwpTSE9SVEEjSU5TRVQjQU1PUyNHQUwKSEVOSUUjI1NPQVIjU05PUkUjQURPCkFSVFMjQklYQlkjU1VEREVOI1NBRwpXT1ZFI0lESSMjI05JQ0UjVEFOR08KIyMjI0NMT1ZFUyNBVEFMTCNJVkVTClJPU1dFTEwjQUJCUkVWI0FFUiMjIwpBQ1RPUiNJU1JBRUwjI0lOU1RPTkUKU0VBT0ZBWk9WI0lTQUFDQVNJTU9WClRBSUwjREVNSSNHQVNQRSNFTUlMRQpBTkRZI0VERU4jRVRIRVIjU0VUT04="},{"title":"3/15/04 DAY IN COURT","author":"by Sally R. Stein, edited by Stanley Newman","date":"2004-03-15","grid":"Q0xFQVQjRVRPTiNCQUNICkhPWUxFI0xPREUjT0JPRQpPQ0VBTiNFUk9TI0JMT1cKQ0hSSVNFVkVSVCNCRVRTCiMjIyNFVkEjU0xBWSMjIwpEQU5BI0VUQSNFVVJPUEUKVVNFUiNOT1JBI1RJTEVTClNUQVRTI1JJUCNPR0xFUwpUT1RIRSNTRVJCI0dJVkUKU1BPVVRTI0xJRSNTRUVTCiMjI1JBWVMjTEVEIyMjIwpQQVBBI1NURUZGSUdSQUYKQUxMUyNUWVJPI1NPVVNBCk5PQUgjRUxNTyNDSURFUgpHRU5FI01FQUwjT05FQU0="},{"title":"3/16/04 COVER-UPS","author":"by Gail Grabowski, edited by Stanley Newman","date":"2004-03-16","grid":"VVBGT1IjRVlFUyNUUkFQClNMSUNFI01BUkUjUklDRQpEVVNUSkFDS0VUI0FOVEUKQVNII09ORVMjTEFJRElOCiMjI0NJVEUjQk9JTCMjIwpSRUxJQ1MjR09PREJZRVMKRUxBVEUjUFJPUyNMRUFQCkNPUFkjU0VJTkUjQU5USQpBUEVTI1RBTEUjQVpURUMKUEVMTE1FTEwjT0xFQVJZCiMjI0lPTlMjQUJCUiMjIwpTVFVDQ08jQlJJRSNESUUKSE9OSyNQUklNRVJDT0FUCk9MREUjQVVUTyNUQU5HTwpPRE9SI0RFRVIjQVJTT04="},{"title":"3/17/04 KNUCKLE SANDWICH","author":"by Fred Piscop, edited by Stanley Newman","date":"2004-03-17","grid":"RklOQUwjUk9BTSNFVFRBCkFHSVRBI09CSUUjTE9JUwpDT1RUT05CRUxUI1BPVFMKVFJFQVRJRVMjU0NBVEhFCiMjIyNJQlNFTiNBU0hFUwpMTEFNQVMjI0FFU09QIyMKQUFST04jVElERVMjQVVGClNJR04jUklWRVIjRVNTTwpUUlkjRklCRVIjUEVURVkKIyNMQVVERSMjRElORVJTClNFRU1FI1RSQUlUIyMjIwpVUlNVTEEjRVNDQVBJU1QKRU5PUyNGUlVJVFBVTkNICkRJQ0UjUk9OQSNBTEdBRQpFRUtTI09XRU4jVEVBUlk="},{"title":"3/18/04 MAN OF THE MONTH","author":"by Ann W. Masten, edited by Stanley Newman","date":"2004-03-18","grid":"QUNIRVMjQ0NDTCNBVE9NClZPSUxBI0hFUkEjQ0hVRwpBUlRPRiNBQ1VUI1RFUk0KU0VNUEVSRklERUxJUyMjClRSRUUjSEVMRU5BI0FGVAojIyNTVFkjIyMjUEFVTE8KRVRDI09UVEVSUyNHUkFECkpPSE5QSElMSVBTT1VTQQpFUklFI01FTU9SWSNTSFkKQ09DQVMjIyMjQVJNIyMjClRTTyNVU09QRU4jT0JJRQojI01BUkNISU5HQUxPTkcKQUhBQiNSQU5UI0xJTkRZClBPUkUjQVJURSNFTkRVUApURVhUI1BBQVIjUkVTRVQ="},{"title":"3/19/04 CENTRAL AMERICA","author":"by Bruce Key, edited by Stanley Newman","date":"2004-03-19","grid":"Qk9BUiNESUxMI01PSk9TCk9UVE8jUk9JTCNBVkVSVApPSFNVU0FOTkEjVEVSUlkKU0VFU0FXUyNORUhSVSMjClRSQUlUUyNDT1MjQVNQUwojIyNOT09JTCNRQVRBUkkKT0xFRyNVUkFMI1JFTElUClJFWCNTVEFSRUFUI0VNTwpMT0NVUyNORUFMI0NNT04KT05VU0VTI1RIRVRBIyMjCk5FU1MjT1RTI0hBTkdBUgojI0FUT05FI0NPTkRPTkUKQkFCRUwjVEhPVVNBTkRTCk9HTEVEI1JPU1MjQ0VSVApQRUVMUyNBTlRFI0VST1M="},{"title":"3/20/04 SATURDAY STUMPER","author":"by Merle Baker, edited by Stanley Newman","date":"2004-03-20","grid":"I0NBU0NBI1NBTEFEUyMjClNBQkVSUyNFQk9OSVRFIwpBUkVOT1QjQ0FJU1NPTiMKR0VUU1NJREVUUkFDS0VECkVTVEFTI0lERUUjT0lTRQpTVEVUI0NSRVMjRFVOQ0UKVE9SSUdIVFMjVElOR09ECiMjI09PUFMjVElOVCMjIwpDUk9OVVMjQk9PS0VORFMKUkVMQVAjQkFBUyNOVUlUCkFEREwjU0VMTCNIQUROTwpNVVNJQ0hBTExTSU5HRVIKI0JBWk9PS0EjSU5DSVRFCiNTV0VBVEVEI0FHRU5UUwojI1NTVEFSUyNMRURHRSM="},{"title":"3/21/04 CRABBY: A tasty seafood platter","author":"by Lee Weaver, edited by Stanley Newman","date":"2004-03-21","grid":"Q0FTSCMjU0xBU0hFUyMjU0hSRVdECk9OVE8jQURFTkFVRVIjU0hFQVRIRQpBVE9NI0ZJRERMRVJPTlRIRVJPT0YKVElORUFSI0dFVFMjU0FPIyNBTkFUCiMjRVNUQVRFUyMjIyNEQVlTIyMjIwpPTUIjT01BUiNIRVJNSVRUSFJVU0gKUEFSVE5FUiNDQVJFRVIjRFVFTk5BCkFET1JFUyNET1dTRVMjIyNUQUNPUwpMQUtFUyNEQU5BI0ZBUyNNRUxMT04KU01FRSNNVU5DSUUjI1BSQVkjRURUCiMjIyNTQU5ESElMTENSQU5FIyMjIwpLT0EjVElLRSMjTUFSSU5FI0FMQVMKT0tBWUVEI1JJRCNERUVEI1NUQUdFCkRBUkVSIyMjREVBTEVSI1NQT05HRQpBUE9HRUUjQkVFRkVEI1NUQU5ESU4KS0lOR09GQkVBU1RTI1NQRVcjR0VPCiMjIyNTVEFTIyMjI1lFQVJORVIjIwpBU0FQIyNCRU4jU1BVTiNJU1JBRUwKQkxVRVBMQVRFU1BFQ0lBTCNBTlRFCkNBUlJPVFMjQVJFQUNPREUjU1RBRwpTVEFURUQjI1BBQ0tBUkQjI0VTU08="},{"title":"3/22/04 TAKE A SEAT","author":"by Gail Grabowski, edited by Stanley Newman","date":"2004-03-22","grid":"U0FUQU4jQURNRU4jU1NUCkFTSURFI0NBSVJPI1RIWQpDSEFJUlBFUlNPTiNPQUsKIyMjRVZBI1RFRFMjT1dFClZJQ1RPUiMjUkVURUxMUwpJRE8jVVJHRSNTT1VQIyMKU1RVI1NPUkVSI1BSSVNNClRBQ1QjVElSRVMjT0dMRQpBR0hBUyNNSU1FRCNFT04KIyNQTEFUI0VTQUkjT1BTCkxPT0tGT1IjI0NPUk5FQQpBTlQjRUxJUyNPUkUjIyMKVEVBI0JFTkNIV0FSTUVSClRBVCNFREdBUiNNQVRFWQpFTE8jVE9PTlMjQU5HTEU="},{"title":"3/23/04 HMMM . . .","author":"by Sally R. Stein, edited by Stanley Newman","date":"2004-03-23","grid":"QUxQUyNTSEFXI0FHSUxFCkJPVVQjTk9TSCNTT05BUgpDT01FVE9USElOS09GSVQKU1RBUkUjUEVMRSNGT1JFCiMjI05BVE8jRUFTRSMjIwpQQ1QjTUlUVCNSRURUQUcKSEFSSSNMQVJBI0xPSVJFCkFTQU1BVFRFUk9GRkFDVApTS0lQUyNPU0xPI0ZSRVQKRVNUQVRFI1NJWkUjQURPCiMjI1RBUlAjTkVYVCMjIwpNQVVJI0dSRUcjUFJFUFMKT05TRUNPTkRUSE9VR0hUCk9ORU5EI0RJT1IjTU9ERQpORVNUUyNMRU5TI1BTU1Q="},{"title":"3/24/04 CATS","author":"by Randall J. Hartman, edited by Stanley Newman","date":"2004-03-24","grid":"UE9PSCNURUVUSCNGQU5HCkFMTFkjUkVMRUUjQUxPRQpXSUxEVFVSS0VZI1RPV04KU05BUkVTI0VORCNDSEFUCiMjI0FOVFMjU0FTSEFZUwpBQ1QjRU1JVCNZRUEjIyMKRkxBVFRFUlkjU0VOQVRFCkFVVE8jI1NJQyMjQ1VFRApSRUFNRUQjTlVNQkVSRUQKIyMjQ0FSI0dMVUUjQU1ZClNIT1JUT0YjVFlSTyMjIwpQRVJVI1BFQSNCUklETEUKQUxBSSNQRVJTSUFOUlVHCk5FVFMjRUxBVEUjS0lORwpLTkVFI0RZTEFOI1NQQVM="},{"title":"3/25/04 WELL-OFF","author":"by Bob Frank, edited by Stanley Newman","date":"2004-03-25","grid":"SVNOVCNTT0xFI0RBRkZZCkZMT1cjQUxFWCNPTExJRQpTQUxFU1NMSVAjR09BRFMKI1dPUlRIQUZPUlRVTkUjCiMjI1BFSSMjI09SRCMjIwpET1MjUE1TI1NQQSNNQUUKUkFDRSNJTlRIRUNISVBTCklTQUFDI0FBQSNLVURPUwpGSUxUSFlSSUNII1RBUkEKVFNFI0VFTCNLRUEjU1RZCiMjI0JFQSMjI0VOUyMjIwojRkxVU0hXSVRIQ0FTSCMKVFJJQkUjSVNSQUVMSVRFCkJBTUJJI0NMQVcjTUFUUwpBVEJBVCNLRVlTI0FNUFM="},{"title":"3/26/04  LATIN 101","author":"by Fred Piscop, edited by Stanley Newman","date":"2004-03-26","grid":"U0FUQ0gjRkxFRCNSQU1TClBIT05PI1JFQVIjSURFQQpBTU9OVEhPRlNVTkRBWVMKTUVUI1BBU1RZI0VER0VTCiMjI1BPUlQjI0NFTEVSWQpTRURBVEUjR1JBREUjIyMKQU1FTiMjSVJBVEUjTEFCCkFNQVNTRVNBRk9SVFVORQpCQVIjVFJFTlQjI0FYT04KIyMjRFJJRUQjREVQRU5ECkFDVElPTiMjU0FYRSMjIwpCT1JFRCNBVFRJQyNUUkEKQU1BVEVVUk1VU0lDSUFOCkJJREUjR0xFTiNTT0xUSQpBQ0VEI0hPTkcjRUxMRU4="},{"title":"3/27/04 SATURDAY STUMPER","author":"by Daniel R. Stark, edited by Stanley Newman","date":"2004-03-27","grid":"QUdHUkVTU09SI0FTUElDCkRSQUlOUElQRSNDQVJMTwpEQUlOVElFU1QjVFJPTEwKTElOS0lORyNBUlJJVkFMCkVOUyNDRUUjTElFI0VURQojIyNMRUQjQklBUyNTRUMKQUNIRUQjUEVBTFMjT0FUClBSSVgjUEVMVFMjRlVTRQpQRVMjQ1VUSUUjRkVURUQKUkFUI09QSUUjS0lEIyMjCkFNTyNNSVQjQkVOI0JZRQpJU1JBRUxJI1JFQURJRVIKU09JTFMjT1JBTkdVVEFOCkFERVBUI05PVkVMRVRURQpMQVNTTyNTQ09SRUxFU1M="},{"title":"3/28/04 THERE SHE IS . . .: Pageant winners we'd like to see","author":"by Daniel R. Stark, edited by Stanley Newman","date":"2004-03-28","grid":"TEFNQSNBUkdVUyNST0FMRCNPTUFSCkFYSVMjREFJU1kjQUxHQUUjUElYWQpWRVNUI01JU1NDT05EVUNUI0lTTEUKQUxTTyNJU1QjQVJUSUUjUklOU0VTCiMjUVVJVEUjRU1DRUUjQkFMRVIjIwpCT1VORFMjQlJPQUQjQkFDS1NFQVQKUkhPREEjRkFJUlMjQ09TVEEjUFJPCkFOVFMjTUlOQ0UjU0FHRVMjRE9JTgpUT0UjR1VOR0EjREVNT1MjTU9SU0UKIyMjRUFTRSMjQkVSRVQjTE9PVEVSCiMjI01JU1NDQUxDVUxBVElPTiMjIwpGQU1JTFkjQVhJT00jI0lPTkUjIyMKQU1JVFkjQ1JPTlkjTkFOTlkjTU9NCktJU1MjSVJBTkkjV0VTVFMjTElORQpFU1MjR05BVFMjQ0hSSVMjRElTQ1MKU0hFUklGRlMjU0hJVkEjVEVBU0VTCiMjU0FCT1QjVU5JVEUjUEVSSUwjIwpMQVRURVIjQVBBQ0UjQkFSI1NBQ0sKQUJFVCNNSVNTRk9SVFVORSNPQklFCktFRUwjQURJRVUjQUlERVMjTkVBUApFU01FI0xJRlRTI1RFU0xBI1NMT1Q="},{"title":"3/29/04 VALUABLE PEOPLE","author":"by Gail Grabowski, edited by Stanley Newman","date":"2004-03-29","grid":"UkVUQUcjRVNBSSNOQUJTCkFMSUJJI0RJR1MjRVZJTApKQURFSkFHR0VSI0lPVEEKQVRBI09NRU4jQUxMV0VUCkhFTE1FVFMjU0VFRCMjIwojIyNJU08jTVVMVElQTFkKQVNTTiNPVkFMI01BUklTCkNISU5BI0lOSyNFTU9URQpERUxJUyNUT1lTI09QRVIKQ0FMRU5EQVIjVElOIyMjCiMjI1BFRUwjU0VORE9GRgpTVVBFUkIjQUxBUyNJTE8KUExFQSNSVUJZS0VFTEVSClJFQVIjSVNMRSNDUkVFSwpZRUxMI1NFRVIjVEFSVFM="},{"title":"3/30/04 YOU DO THE MATH","author":"by Sally R. Stein, edited by Stanley Newman","date":"2004-03-30","grid":"Qk9BVFMjQ0hFUiNTV0FQCkVQQ09UI0hBUkUjUEFMTwpURUVVUCNBVklEI0VHT1MKQUREUkVTU0VFUyNBT05FCiMjIyNUSUUjI0VBUk5FRApCUkFaRU4jREVBUiMjIyMKTE9TRSNBSVJZI0VFUklFClRPVEFMSVRBUklBTklTTQpTVEFMRSNFV0VSI0RDSUkKIyMjI1RBTVMjQUJTRU5UClNUUkVTUyMjQVRFIyMjIwpNT09HI1NVTU1FUkNBTVAKQU5EWSNJU1VQI0VVQklFClNURVAjU0VMTCNUQk9ORQpIT09UI1RSRUUjU0FXSU4="},{"title":"3/31/04 LEAP DAY","author":"by Daniel R. Stark, edited by Stanley Newman","date":"2004-03-31","grid":"T0hNUyNTQUdTI0FSRSMjCkxJRU4jTFVMVSNMRU1PTgpBRlJPI0FMQU4jVFJJUEUKVklFVyNCQU5LVkFVTFRTCiMjI0JBU0lDI0VSTkVTVApBQ1RPUiNURVJOIyMjIyMKU0xPVUNII1NPVSNCRUxMClRVUk5TVVAjREVWT1RFRQpBQkVEI0JBUiNTRVhURVQKIyMjIyNDTEVPI1RTQVJTCkFHQVRIQSNTV09PUCMjIwpKT0JIT1BQSU5HI1JJQlMKQU5ERVMjT0RFUiNJQ0VUClJFVVNFI1NVUkUjTk9URQojI0xFRCNURVNTI0dOQVQ="},{"title":"4/01/04 SEIZE THE DAY","author":"by Fred Piscop, edited by Stanley Newman","date":"2004-04-01","grid":"QkFTSCNIQVJUI0NBTEVCCkVSTEUjT0RPUiNBTEFNTwpFQ09MI1NBVkUjUkFNT04KTk9XTEVUTUVTRUUjQVRFCiMjVE9NRSMjU1RFRVJFUgpUQVIjSUxMUyNBTkQjIyMKQVZBI0xFT05BIyNHRUxUClRPSUxFUlNPRlRIRVNFQQpBTk5FIyNTVVRSQSNQQVAKIyMjTkVFI1RTQVIjSVJFClNVTFRBTkEjI0RFQ08jIwpPTkEjR0VOVExFTUFOU0MKTklHRUwjVE9BRCNCQVRFCkFUT05FI0VUVFUjRUdBRApSRVNUUyNERUVQI1JFTkU="},{"title":"4/02/04 A LITTLE VACATION","author":"by Merle Baker, edited by Stanley Newman","date":"2004-04-02","grid":"U0xBRyNHUkFEUyNBUk1TClBBTEUjUkVMRVQjUE9FVApBVkVDI0FRQUJBI0VERFkKUkFDS0FORFJVSU4jQUlMCiMjI09MRCMjVFJPVU5DRQpESVIjRURHWSNTQU5EIyMKSU5PUkdBTklDI0hJUkVTCkFSQ08jREFLQVIjVEVMTApMSUtVRCNSRUxFQVNFTUUKIyNBR0VEI1NMSU0jTE9XClZFTkVFUlMjI0dJRyMjIwpBSUQjUkFOVEFORFJBVkUKTUdSUyNNQU9SSSNBWElTClBIWVMjQVJHT04jWkVUQQpTVEVOI1NMQU5HI0VMT0k="},{"title":"4/03/04 SATURDAY STUMPER","author":"by Anna Stiga, edited by Stanley Newman","date":"2004-04-03","grid":"UFJJVklMRUdFUyNTUEFSClNPTElEQVJJVFkjV0FSRQpBQk9NSU5BVEVEI0FSVFMKTkVWI09EUyMjI1NUUkVQCkRSRUFNUyNDQUxMSE9NRQpRVElQUyNDQVNVSVNUSUMKU0lURSNEQVBITkUjU1NUCiMjI1NDT1JFQ0FSRCMjIwpFTEkjQkFSQ0FSI0VTU08KREFOREVMSU9OI0RFTFRTClVORlVSTEVEI1NBTUlBTQpDT0lOUyMjI0ZVUiNQUk8KQUxFQyNBQkVMSU5DT0xOClRJTEUjUE9TSVRJT05FRApFTkRTI1RBU1RFVEVTVFM="},{"title":"4/04/04 FLY LIKE AN EAGLE: With the theme revealed at 93 Across","author":"by Patrick Jordan, edited by Stanley Newman","date":"2004-04-04","grid":"Qk9PVEgjTUVTSCNLRU5UI0VESUVTCkVOTEFJI0FSRUEjSUdPUiNMT05HQQpERUFMVCNSRUFESU5HUkFJTFJPQUQKU0FGRVRZUElOI09EUyMjRklFTkQjCiMjIyNJQUwjI1JPTyMjQk9PTSMjIwojV0VBVEhFUkRJRkZJQ1VMVElFUyMKV0lOQ0VTI0FJTSMjQkFORFMjTkFQCkFDUkVTI0FOUyNCRUVSIyMjI05JTApTQ09UI0NMSU1CSU5HVklORSNVTk8KUEFOQU1BUyNBUk9EI0VOT1JNSVRZCiMjI1RVQkEjTEFORUQjQVZJQSMjIwpBTkdFTElDQSNESUFNI0ZBQ1RPUlMKSkFSI0VORVJHWUNSSVNJUyNUUlVFCkFCRSMjIyNSVVNTI1RVWCNTSURMRQpST0MjVEFQQVMjI0ZSSSNUSU5JRVIKI0JPWVNDT1VUTUVSSVRCQURHRVMjCiMjI09BVFMjI0lWWSMjT0xFIyMjIwojWk9SUk8jI0FMRSNBUlRDQVJORVkKQ09PS0lOR1VQQU5JREVBI1JPVVRFClBPUElOI0FNRU4jREVBTiNNVUxBTgpBVFNFQSNQQVNPI0lTUFkjU0VMTFM="},{"title":"4/05/04 APRIL FORECAST","author":"by Sally R. Stein, edited by Stanley Newman","date":"2004-04-05","grid":"Q0xPU0UjQVNBUCNST0FNClBBUktBI05BU0EjQVBTRQpBU1NFUyNDQkVSI0lSSVMKU0hPV0VSSEVBRCNOQURBCiMjIyNTQU8jVE9VQ0hFUwpSRVREI0lSUyNOVEgjIyMKRVZFUiNEQVdOI0VFUklFClZFTk9NI0dFRSNTQ0VOVApTTE9QRSNFRElUI0tFTlQKIyMjU0lSI0VHTyNTTE9FCkNBQkFSRVQjSE9HIyMjIwpVVEFII1dFVEJMQU5LRVQKUkFOSSNBUFNPI1pPUlJPCkJSQU4jU0VBUiNFVklBTgpTSUxUI0hFUlMjU0FTU1k="},{"title":"4/06/04 BRIDGE WORK","author":"by Shirley Soloway, edited by Stanley Newman","date":"2004-04-06","grid":"R0xBRCNFQVJFRCNFV0VTClJBR0UjQU1BTkEjVkVOVApBVk9OI1NPTkFSI0FTVEEKTUFHSUNUUklDS1MjVFJJCiMjI0VMTSMjVEVSUklFUgojU0NSRUFNIyNTT09OIyMKQkFBI0FOT0lOVCNBRE1TCkVHUkVUI1BPRSNJRElPTQpMQURZI1RFTlRIUyNFQVUKIyNIRVJPIyNTQU5FU1QjCkNMT1NFUlMjI05PRyMjIwpBSUwjRE9OQUxEVFJVTVAKSU5EWSNOT1NFUyNFUklFCk5FRVIjVE9UT0UjU0FMRQpFUlJTI09ESVNUI1NMT1A="},{"title":"4/07/04 MIDDLE C'S","author":"by Fred Piscop, edited by Stanley Newman","date":"2004-04-07","grid":"VFJBI1BISSNCRU4jRElNClJFTiNSRVZFUlNFI0FDRQpJU1RISVNTRUFUVEFLRU4KRE9MRUQjI0xJRSNET0IjCkVMRU1FTlQjREVNT1RFRApORVJPI0FSVCNNT1JBTEUKVERTI0RSQUlOI0RFTlRFCiMjI1NVQ0NFRURFRCMjIwpUQVRBUiNUUklBTCNBTEIKVU5JVEVEI1NMWSNGUkVFCk5BVFVSQUwjTE9TRVNJVAojSEFSI05JQiMjQVRFU1QKVEVOTkVTU0VFQVZFTlVFClZJSSNMT1pFTkdFI0FSUgpBTUMjSU5UI0RFUyNMRVM="},{"title":"4/08/04 TOOT SUITE","author":"by Patrick Jordan, edited by Stanley Newman","date":"2004-04-08","grid":"TEFaRUQjSEFNUyNFRElUCkFMT05FI0VYSVQjTU9ERQpGT09UQkFMTFJFRkVSRUUKRlVNRSNMSUUjTk9STUFOCiMjI1JBR1UjU09ORyMjIwpQT0xJQ0VNQU4jREVCVFMKT1BFTkVSI0JBSkEjUkFOCktJTkcjSU1BR0UjTkFNRQpFTkQjTEFJQyNXRUFWRVIKWUVTTk8jTElGRUdVQVJECiMjI0FZRVMjQUxPVCMjIwpBRVJJQUwjQVRFI0lTTlQKRFJJTExJTlNUUlVDVE9SCkRJQ0UjVE9URSNTQVVURQpTRUVEI0VHQUQjQUxCRUU="},{"title":"4/09/04 OUT OF STEP","author":"by Richard Silvestri, edited by Stanley Newman","date":"2004-04-09","grid":"U1RFTSNMQU1CIyNCQVNLCkVSTEUjQU1JUiNTVVNISQpNT09OU1RPTkUjQUNUSU4KSURJU0xJS0VXQUxLSU5HCiMjI1dBTiNERUNBTCMjIwpTQUJFTkEjI1JPREVOVFMKQUZMQVQjU1RJUlMjT09ICkhPRVIjU1RFRU4jU0VUQQpJUkUjQ0xBTlMjRElOQVIKQkVEUk9PTSMjUEFERExFCiMjI0VMT1BFI0FSRSMjIwpJVFNTT1BFREVTVFJJQU4KVEFQSVIjRElBVEhFUk1ZCkNSQVNTI0VOQ0UjQU1FUwpIQVJUIyNEQUhMI0xBTkU="},{"title":"4/10/04 SATURDAY STUMPER","author":"by Daniel R. Stark, edited by Stanley Newman","date":"2004-04-10","grid":"VkVMVkVURUVOI01BTUFTCkZSRUVWRVJTRSNBTUlHTwpXRVNURVJORVIjVFVORVIKI1NUT05FUyNPQ1VMSVNUCiMjIyNJU1QjV09SRSMjIwpIRUxFTkEjU09NRVRJTUUKQVhJTkcjRE9MRUQjU0FHClJJQlMjREVMRlQjQkxVUgpQTFkjRkFDSUUjU1VBVkUKU0VBU09ORUQjS0lTTUVUCiMjI1BSRVAjRkVOIyMjIwpDQUdJRVNUI1JFQ0FMTCMKT1JBTFMjSVJPTkVET1VUCkFJU0xFI1ZFTkVSQUJMRQpMQVBTRSNFWFRSRU1FTFk="},{"title":"4/11/04 AT THE LIBRARY: A browser's delight","author":"by Lee Weaver, edited by Stanley Newman","date":"2004-04-11","grid":"U09CI0xBUyNEQVJUSCMjQU1PRUJBClRSSVNFQ1QjVVNFU1VQI1JFTlRFUgpSQU5JTlRPI0NIQVBURVJFTEVWRU4KRU5ERUQjUkFLRVJTI0FVTlQjIyMjCkVHSVMjQllURVMjIyNIRUFEQUNIRQpURU5UI0FCRUQjTVVTRSMjT0xJT1MKIyNHQVJCTyMjRUFUT05FU1dPUkRTClNTRSNIRUFSI1JFQUQjRFVORSMjIwpNT05FWSNST1NBI0hBU05UIyNMT1AKSUJFQU0jRFVFVFMjI0VBUlBJRUNFClRFUkNFTCNTUE9UVEVSI0FFUkFURQpISUdIUklTRSMjR1JFRVQjTkFWQUwKU1RZIyNNT0RFTCNVU05BI1BFRVZFCiMjI1NLSVAjTE9STiNFTFNBI1NFUgpXUklURVRIRUJPT0sjI0VDTEFUIyMKQU9LQVkjI1JBTksjQ1VCQSNUSEFUCkRFRVJTS0lOIyMjQ0FSRVIjVEVURQojIyMjVElMRSNNQVJJTkEjQUFST04KQkxPV09ORVNDT1ZFUiNSQU1ST0RTCkFJTElORyNUVVJFRU4jRVBJU09ERQpIRURHRVMjI1BFUktTI1JFRCNNU1M="},{"title":"4/12/04 TEAM PLAY","author":"by Lee Weaver, edited by Stanley Newman","date":"2004-04-12","grid":"UkFTUFMjU09EIyNJQ0VECkFESUVVI0VQSUMjTk9TRQpQT1JFUyNMQVZBI1NBVEUKIyMjV0FGRkxFQkFUVEVSCiNTUEVORCMjI0FCQVNFIwpEQUxFI0lUUyNOVU4jIyMKUk5BIyNDT1dDQVRDSEVSClVUSUNBI1JFTyNTRUFNWQpNT1RPUkNPQUNIIyNMSUUKIyMjTUVBI1JPSSNUT1RTCiNMQU1BUyMjI0dMT1NTIwpXQVRFUlBJVENIRVIjIyMKQU5PTiNFRElFI0RST1ZFClRBTEMjUkVORCNHSUJFUwpUSUxFIyNBVEUjRURJVFM="},{"title":"4/13/04 GRAY DAY","author":"by Gail Grabowski, edited by Stanley Newman","date":"2004-04-13","grid":"U0FTSCNTVEVUI1VSR0VECkVUVEEjVEFYSSNQT0lTRQpFVEFMI0FSRUEjQlVHTEUKU0lMVkVSU0NSRUVOIyMjCkFMSUVOIyNTQUxBREJBUgpXQU4jVFNLIyNPVFRBV0EKIyMjU0VBTkNFIyNSSU9UCiNDSEFSQ09BTEdSSUxMIwpTSFVOIyNXUkFQVVAjIyMKVElMREVTIyNOQUIjTE9BClNOQVBTSE9UIyNMRUFSTgojIyNBU0hXRURORVNEQVkKVEFNUEEjTEFSQSNUSVRPCkFCQkVZI0VSSU4jRURFTgpCRUFSUyNUWVBPI0VBU0U="},{"title":"4/14/04 NOT IN THE OPEN","author":"by Fred Piscop, edited by Stanley Newman","date":"2004-04-14","grid":"U0FSQU4jVElCSUEjSU5LCk9OSUNFI09STE9OI05PTgpVTkRFUkdST1VORCNDT0UKTElFI0RJQU5FI1JPT05FClNFUkEjQUhBQiNFREdFRAojIyNOQU4jR0VUU09OIyMKRVRIQU4jV0VSRSNSSUNPCkNISUNBR08jUkVBTFRPUgpUT0RPI0FSVFkjUEVPTlMKIyNJTlNJREUjUkVTIyMjCkNBTkRZI0dBR0UjU0FSQQpPUkdBTiNBUkxFUyNORUQKV09PI0NBTU9VRkxBR0VECkVNVSNFR0VTVCNPTElWRQpSQVQjRE9TRVMjQkxFRUQ="},{"title":"4/15/04 CALLING THE SHOTS","author":"by Patrick Jordan, edited by Stanley Newman","date":"2004-04-15","grid":"TU9TSEUjQUhNRSNTRUFNCkFaVEVDI01BUlgjQVJJQQpTTUFTSE1PVVRII0ZFU1QKU0FOI0VBUkwjSUNJQ0xFCiMjREVMTEEjQUJPUlRFRApMT0JMT0xMWVBJTkUjIyMKQU1BSU4jI0FQVFMjVFJBCk1BQ1MjVEVOVFMjR1JBQgpBUksjR1VOTiMjRUxBVEUKIyMjU0VSVklDRU1FREFMCkxBUkNFTlkjQUxCRUUjIwpFVkVSU08jTVVJUiNNQU8KV0FORSNWT0xMRVlCQUxMCklTRUUjRVJJSyNPQVJFRApTVEVOI1JFVlMjU0FLRVM="},{"title":"4/16/04 DAY AT THE MOVIES","author":"by Charles E. Gersch, edited by Stanley Newman","date":"2004-04-16","grid":"T0FURVIjI0FOREEjQ0JTClVTRURVUCNSQUlMRURBVApUSEFUVE9VQ0hPRk1JTksKUk9DI0hPUkEjTkFUIyMjCkVUSCNFTElERSMjU1FGVAojI0VTVCNTSVRVUCNVQVIKS0FSQVRFI0FUUkkjRUNVClVQU1dJTkcjRU5MSVNUUwpBUlAjTkNPUyNFTERFU1QKTElFI0dMQUNFI09BUiMjCkFMVE8jI0xBTEFXI0FDVAojIyNWQVIjUkFQVCNTT1cKTE9WRU1FT1JMRUFWRU1FCkFQRVJUVVJFI0dMT1JJQQpEQU4jU1BFRCMjS05BQ0s="},{"title":"4/17/04 SATURDAY STUMPER","author":"by Anna Stiga, edited by Stanley Newman","date":"2004-04-17","grid":"UVVJWlNIT1cjU01JVEhTCkFUTk9USU1FI0hPT1JBSApUQUxFTlRFRCNFTlRJQ0UKQUhBUyNVTkRPI1RBUElSClJBVyNVUFNFVFMjU0xFVwpJTlNVTSMjRE9QRSNBTk8KIyMjU1BBUiNPUkxBTkRPCkpVU1RJQ0UjTElQUkVBRApBUkVBUlVHI0VHQU4jIyMKV0JBI0VSQVQjI1NFR0FMCkJBU0sjQUxPTlNPI09EQQpPTk9ORSNFTllBI0lTTVMKTklORVJTI0lMTElOT0lTCkVUQUxJSSNUT0FOREZSTwpTRUxMRVIjRU5ETk9URVM="},{"title":"4/18/04 ROOM SERVICE: Eight of them for you to visit","author":"by Merle Baker, edited by Stanley Newman","date":"2004-04-18","grid":"RUxERVNUIyNDRU1FTlQjQ09FUkNFClJPQU1FUlMjQVZFTlVFI0hVU0hFRApSSVZVTEVUI0xBRFlJTldBSVRJTkcKU1RZI0VORFMjR0lBI1NBTiNBTlRFCiNFSkVDVCNNUEFBI0FJREVEI09TUwpGUk9TVCNET1VCTEVCT0lMRVIjIyMKQkVOVFMjQUxTTyNSRU4jI1JPU1NJCklERSMjRU5USFJPTkUjQ0hFQVBFTgojI1NUUkFTU0UjTkVUV09SS05FV1MKQ09MVU1OIyNSSU9TI0FMRSMjQ0VPCkFDT1JOI0FTU04jVEVYVCNRVUlMTApGVEMjI0FNTyNESU9TIyNNT1JBTEUKVEFLRUFQT1dERVIjQ0FSQU1FTCMjCkFWRU5HRVIjRVhUUkFDVFMjI0RJTgpOT1JUSCMjR1RFI0VSVEUjVEVFTlkKIyMjUkFJU0VBUlVNUFVTI1JFTElDCkJJWiNTQ0FOVCNOQVNBI0hBU0lUIwpBTkVXI0VBVCNUV0kjTElFTiNWSVAKU0FMQUREUkVTU0lORyNNSVNERUFMCkFORFJFSSNFUkFTRVIjUFJJT1JUTwpMRUFERU4jTEFSRURPIyNTVEFZRUQ="},{"title":"4/19/04 WHO WROTE IT?","author":"by Sally R. Stein, edited by Stanley Newman","date":"2004-04-19","grid":"T1BUUyNGTEFLRSNCQUJBCldPUksjTEFTRVIjQUxBTgpMT1VJU0FNQVlBTENPVFQKU0hFI0FNRU4jU09PVEhFCiMjI1NUSVIjVEVOTiMjIwpORUFURU4jQkVSRyNMQVMKQVRUQSNHQUlOI0VMRUNUCkNIQVJMT1RURUJST05URQpIQUxFWSNURVRFI09ESUUKT05FI1JBWVMjR09TU0lQCiMjI0ZJUlMjRE9NRSMjIwpTQ0FSQ0UjTEFORSNBQ0gKRVJORVNUSEVNSU5HV0FZClRPTkUjSEVOTkEjQVJJRApTUEVEI0FNQVNTI1NZTkU="},{"title":"4/20/04 TWO PAIR","author":"by Shirley Soloway, edited by Stanley Newman","date":"2004-04-20","grid":"QU1JRCNQQVAjIyNBRkFSCk1BREUjT0hBUkEjUk9TRQpJUkFOI09BU0lTI0NPSU4KU0NIT09MQk9PSyMjVEFECkhPT1RFUiMjVEFDSFMjIwojIyNFUk9ERVMjSEFURVMKT0FGUyNPREUjR0FMT1JFClBSTyNFTUVSU09OI09JTApFTE9QRVMjSVRPI0NMRUYKU09MRVIjU0VFREVSIyMjCiMjUFJPTU8jI0xJQUJMRQpQQVIjI0FMTFRPT1NPT04KSVJPTiNTQVlTTyNIT09ECk5FT04jQ1JFQUsjRVNTTwpTQUZFIyMjU1JTI1NURVc="},{"title":"4/21/04 TRIVIALITIES","author":"by Robert H. Wolfe, edited by Stanley Newman","date":"2004-04-21","grid":"REVQT1QjQUxBUk0jTU9QCkFSVUJBI0xFVkVFI0lSQQpNSU5PUkRFVEFJTCNOQVIKUEVUSVRFI0JJTiNMSUxUCiMjI1NBTVVFTCNTQVNTWQpCSVNUUk9TI1NPVVNFIyMKQUxNUyNMRUEjQkVUUkFZCkNJQSNGSVJNRVNUI0lDRQpIRUxMT1MjQURPI1NFUkEKIyNMSUdIVCNJTExVU0VTCkhBUFBZI0VTVEVFTSMjIwpFQVJTI1JFQSNUQU1BTEUKQVJJI0xJVFRMRURFVklMClJPTiNPU0hFQSNUUklMTApUTlQjV0VFRFkjT1NTSUU="},{"title":"4/22/04 NAME THAT TUNE","author":"by Bob Frank, edited by Stanley Newman","date":"2004-04-22","grid":"QkFUUyNWSUdJTCNCRUFECkFDUkUjT01FR0EjQU5OTwpUSEVDSElQTVVOS1NPTkcKQ09OUkFEIyNBQ1RTIyMjCkhPVEVMI0JBTkVTI0pGSwojIyNUSVRVTEFSI1BBUkUKSE9DI0ZST0cjI0JBQ09OClVOQ0hBSU5FRE1FTE9EWQpSRUxBWCMjQlJBQyNCT0EKVFVFUyNTVFJFQUtZIyMjClNQRiNTVFJBVyNIT0NVUwojIyNTVEFZIyNEQUdBTUEKREFOQ0VUT1RIRU1VU0lDCkFSRUEjRVVST1MjUkVBUgpORVdUI1NUQU5LI1RZS0U="},{"title":"4/23/04 SEE 48 ACROSS","author":"by Fred Piscop, edited by Stanley Newman","date":"2004-04-23","grid":"R0xPUCNBUE9TI1RBQkxBCk5PVkEjTEFNRSNPQ0VBTgpBQkVUI0lMRUQjV0VBVkUKVE9SQ0hTSU5HRVIjQ0FXCiMjI0hBVFMjRUNPTk8jIwpWQUMjU0FBQiNPUEVOVVAKQUxBI0hJREVTI0VUSE5PCkRJTksjUkVMSUMjU0lURQpJTkRJQSNTRURBTiNMSVQKU0VMRU5BI01FU0EjTEVTCiMjRVZFTlMjU0VOUyMjIwpBU1AjTUFUQ0hNQUtJTkcKQ0FJUk8jQUxPRSNJREVBCkFOTkFOI1NFV04jUE9NUwpUQVNURSNIT1NUI1NMT1A="},{"title":"4/24/04 SATURDAY STUMPER","author":"by Daniel R. Stark, edited by Stanley Newman","date":"2004-04-24","grid":"QkVEQVVCUyNXQUlUU1VQCkVURVJOQUwjQU5URU5OQQpMQUJFTExFI1NOT1JFUlMKQUdBI0lERUFURSNNRUVUCkJFU0VUI1BMRUFUI1JFRQpPUkVTI09MRCNMSUJFTFMKUkVTVEFSRUFTI0xBRFMjCiMjI0VCQlMjSVRFTSMjIwojRkVSTiNTVUdBUkJVU0gKUlVTU0VUI1BISSNPTlRPCkFMUCNST0JPVCNIT1RFTApJU0FLI0tVTkdGVSNXQUQKRE9OQVRFRCNBSVJUSU1FCkVNT1RJTkcjR1JPQU5FUgpSRUxFQVNFI1NFTkRFUlM="},{"title":"4/25/04 CRAYOLA FEAST: Tasty-sounding colors","author":"by Fred Piscop, edited by Stanley Newman","date":"2004-04-25","grid":"REVMSUxBSCNOQVNBTFMjQ1JBTkVECkVNRVJJVEEjRVlFRlVMI0hFTEVORQpWSVZJRFRBTkdFUklORSNJTkRPT1IKT1RJUyNJUkVTI0JSQUQjTUVBTiMjCiMjIyNBQ0xVI1VTRVIjTUVXI0NBVAojU0lUUyNFUklOIyMjVkFTRSNBTEUKQkFOQU5BTUFOSUEjRklHI0RBUkxBCkxPSVRFUiNMRVRIQVJHSUMjQVJVTQpFTkNBUlRBI1JFQURFI0NBVEhPREUKREVFUiNQU0FUUyNTRUFNVVMjVEVECiMjI1NIQVBFIyMjIyNWSUxFUiMjIwpDQU0jU1BBUkVEI1NQRU5EI0VMRVYKQURBUFRFUiNTVUlURSNUUklQT0xJCk5BTk8jUkFNU0hPUk5TI09ORVJVTgpFR0dFRCNHT08jQ09UVE9OQ0FORFkKUklPI0VNVVMjIyNQQUFSI1VMRUUjClNPVCNTT1MjQ0hBUyNUSU5TIyMjIwojI0FMVE8jU0hFRCNMT0dPI1RBQlMKQ09OQUlSI1dJTERTVFJBV0JFUlJZCkVOR0lORSNJTkdFQVIjTUlBTUlBTgpTVE9ORUQjVE9BUk1TI0lOU1BBQ0U="},{"title":"4/26/04 BAKED GOODS","author":"by Gail Grabowski, edited by Stanley Newman","date":"2004-04-26","grid":"UEFTVEEjQVJNUyNTSFVUCkFQTFVTI1NFTUkjTUFORQpTRUFCSVNDVUlUI0FJREEKU1NUI1NUT1AjVEVSUk9SCiMjI0JBUlQjVElMVCMjIwojREVMSVMjTUFHSUNBQ1QKU0FMQUQjQk9USCNPU0xPCklSQU4jR0xPQVQjT1BFUgpTSU5LI1JVRVMjU0tJUlQKSU5ERU1BTkQjU1RJQ0sjCiMjI1RJTlQjR0FZRSMjIwpURVRSQUQjUFVMTCNTUFkKT1JFTyNTV0VFVElFUElFCkRJQUwjT09QUyNTVEFMTApERUxMI05FU1QjSE9URUw="},{"title":"4/27/04 HOME SWEET HOME","author":"by Shirley Soloway, edited by Stanley Newman","date":"2004-04-27","grid":"QUNSRSNDQVJPTSNTQ0FCClNMQU0jQVJFTkEjTE9ORQpDQUJJTkZFVkVSI0lPTkUKQVJBUkFUIyNTQ0FNUEVSClBBVCNNQVIjI0lTRUUjIwojIyNCRU5IT0dBTiNSQUgKQ09DTyMjVVBJI0VMQVRFCkFNT1JFI01SUyNST1RPUgpQQU5FUyNCQU0jI0dFTVMKRU5EI1RFQUhPVVNFIyMjCiMjT0JFWSMjU05PI1RPRQpIT05PUkVFIyNBVUdFUlMKT0xJTiNGTEFUQlJFQURTCkxJTkUjVVNVQUwjVFJFRQpET0dTI0xFREdFI1NTUlM="},{"title":"4/28/04 THE INN CROWD","author":"by Fred Piscop, edited by Stanley Newman","date":"2004-04-28","grid":"U0FHUyNTQUxLI1BFUFVQCkVaUkEjQUdJTiNBTVVTRQpSVUVEI1JFTk8jU09SRVIKQlJFQURBTkRCVVRURVIjClNFTiNPTlQjI05ZRSMjIwojI0NBWSNTSEFSI1NPVVIKI0NBTk9FI1VOTyMjR1RPCkJBUk5VTUFOREJBSUxFWQpPUkQjI0lOSyNFREdFUyMKUEVTTyNMQVNTI0RPVCMjCiMjI1BPSSMjRUtFI0hTVAojQlVUVE9OU0FOREJPV1MKTUVSSVQjQUxTTyNBUkVBCkFESU1FI1NPT1QjU1BBUgpDRVNBUiNIRU5TI1NFVFM="},{"title":"4/29/04 PINS","author":"by Randall J. Hartman, edited by Stanley Newman","date":"2004-04-29","grid":"TE9ERSNGT0VTI0RPVEVECk9MRUcjT1JBTiNFTUlMRQpLSU5HQ09CUkEjRkFMU0UKSU5TRVJUI1NQTElOVEVSCiMjI0RBTkEjUElDIyMjIwpUQUojQk9CQllWSU5UT04KT05FUyNURUUjI1RPUlNPClJJVEUjRUxJVEUjRElBUwpBVExBUyMjTkFZI1NBS0UKSEFJUlRSSUdHRVIjTEFECiMjIyNSRUEjU1RBVCMjIwpCQVJST09NUyNFTlJBR0UKT05FQUwjU0FGRVRZTkVUClNOQUlMI0FSQVQjTUFOTgpTRUxMUyNNQVRII0VUVEE="},{"title":"4/30/04 O FOR FIVE","author":"by Richard Silvestri, edited by Stanley Newman","date":"2004-04-30","grid":"QUJVVCNTVEVXI01BTExTCkxPQ08jUFVSRSNBUklFTApFTExBI0FOT04jSVJPTlkKI09BU1RXQVNURUxBTkQjCiMjI1RBTiMjI0dFTiMjIwpDT0RFWCNDT09FUkdJUkwKQU1PUkUjT1JCUyNFUklFClJBWSNTVFJBSVRTI0lEQQpPTkVBI1JBVEUjQVNORVIKTUlOR09BU0VTI0RJQVJZCiMjI1JQSSMjI1NBVCMjIwojTU9PSU5HUElDVFVSRSMKUkVSVU4jQUxUTyNBSVJZCkNSQU5FI0xFRVIjVE9HTwpURU5EUyNMQU1FI0VUT04="},{"title":"5/01/04 SATURDAY STUMPER","author":"by S.N., edited by Stanley Newman","date":"2004-05-01","grid":"Q0FUU1BBV1MjQkVFUEVSCkhJTlRFREFUI0VYUElSRQpBRE9BTk5JRSNMRUhNQU4KQ0FURU5BVEUjQ1JFQVNFCk9ORUxJTkVSI0FUTSMjIwojIyMjIyMjRVJOSUVFTFMKTVJCSUcjRURJVE9SSUFMCkFJUlJBSUQjQk9OQU5aQQpDTEFSSU5FVFMjU0xFRVAKWUVTQU5ETk8jIyMjIyMjCiMjI0RJSSNTVFJFQU1FUgpLSVRJTkcjVEFJTEJPTkUKSUNFQUdFI0FUQUxBTlRBCldPTlRPTiNSRVRFU1RFRApJTlRFTlQjVFJBU0hFUlM="},{"title":"5/02/04 MALE CALL: Of the two- and four-legged variety","author":"by Frances Burton, edited by Stanley Newman","date":"2004-05-02","grid":"QkVBUiNBRExJQiNCQVRFUyNBRERTCkFMUE8jUElFVEEjQVRPTEwjTEVJQQpDTEVPI1JBTk9OI1RPTUZPT0xFUlkKSEFSVEZPUkQjU0hPTkUjV1JJU1RTCiMjI0JPTlkjI0hPTkUjU1BBTiMjIwpFQVNFTFMjQ0JFUlMjQUxPVCNDUlQKQU5URUQjQkxVRVMjI0xBS0UjT0VSCkdOQVIjQlJBQyMjQUJBVEUjQUJMRQpFRUcjRFJJTksjQVJJU0UjQUxCRUUKUkVGUkFJTiNCQUJFTCMjQ1VMTEVECiMjTEFSR0UjT05FQUwjU0FSRUUjIwpUUkFDRVMjI0FOVFNZI1RSQU5TSVQKUkFURVMjUEFSSVMjQ0hBVFMjVFJJCkVOSUQjU0xJREUjI0xBTUUjTU9BTgpBR08jTVVJUiMjUExVTVAjREFOVEUKVEVOI09ORVMjU0xBQlMjUFVSRUVTCiMjI0JPU1MjQVBJTiMjU1VMSyMjIwpCUk9PQ0gjRUxMRVMjQlVMTFNFWUUKUkFNU0hBQ0tMRSNJQkFSUyNNQkFTCkVSSUMjRE9HSUUjTk9SR0UjQUFSUApXRVRTI0VTU0VOI0dBVEVEI05ZTlk="},{"title":"5/03/04 STICKY","author":"by Lee Weaver, edited by Stanley Newman","date":"2004-05-03","grid":"TUVOVSNNQVRIIyNHUk9HCk9WRU4jQVNJQSNDTEFSQQpMRVNTI1BJTlNUUklQRVMKQU5URVMjI0VQRUVTIyMjClJFTEVBU0VTI05BVEFMIwojREVOVEFMIyMjU0VOT1IKIyMjIyNUQVAjU0VOVFJZClRIT1JOSU5PTkVTU0lERQpMT1RJT04jSU9OIyMjIyMKQ09PUFQjIyNFU0NPUlQjCiNGRVRFRCNTTEVFUEVSUwojIyNJREVBTCMjTEVHSVQKTkVFRExFTk9TRSNSQVZFCkFMTEVZI1RPRUQjQUxJRQpNSVNTIyNTUEFUI1NFQUw="},{"title":"5/04/04 FREE SAMPLES","author":"by Sally R. Stein, edited by Stanley Newman","date":"2004-05-04","grid":"RElBTCNMQUlEI01BS0VTCkVTU08jT0xHQSNBTElCSQpORUlMI0FUT00jUk9XQU4KU0VBTCNGT1JOT1RISU5HCiMjI0lDRVMjI1ZJQSMjIwpSQVBQRUQjT1ZFTiNBVkEKRVJST0wjU1BBUiNCTEFCCkNPTVBMSU1FTlRBUklMWQpBTUVTI1JVTlMjTEFLRVMKUEFOI0RJR1MjVFZTRVRTCiMjI1NJUyMjRVJBUyMjIwpPTlRIRUhPVVNFI1JFQUwKTEVXSVMjQVNTTiNJRExFCkRST05FI0hFRUQjTkFEQQpFRFNFTCNVUk5TI0dNQU4="},{"title":"5/05/04 POOLSIDE","author":"by Fred Piscop, edited by Stanley Newman","date":"2004-05-05","grid":"TEFNQVIjRElESSNSRUVECkFSSVNFI0VSSU4jQU5USQpWRVNUUE9DS0VUI1NUVU4KU0FUVVJOI1NUQU1QRURFCiMjI1RJRUQjU0tJI1JFRApSRVBFTlRFRCNFTE1PIyMKQVJJI1RPTEVUI0tJTkRBCk1JTkQjTk9NQVIjQUNFUwpQRUNBTiNOT1BBUiNVUEkKIyNVU0VEI1NJREVCRVRTCkdBUyNNRUwjUklQRSMjIwpFVEhJT1BJQSNTTEFURVMKQ09JTiNPRkZUSEVSQUNLCktOT1QjU0VBTSNUT1JSRQpPRU5PI0VSUlMjRU5TVUU="},{"title":"5/06/04 NIGHTY-NIGHT","author":"by Doug Peterson, edited by Stanley Newman","date":"2004-05-06","grid":"VU5USUwjT01BTiNTSEFHClNBVU5BI01BVEUjSElWRQpNSU5FRCNCTE9XI0VOT1MKQ1JBWllRVUlMVCNFRElUCiMjIyNEVUQjTE9XVElERQpSQVNQSUVTVCNOQU0jIyMKT01OSSNTTVVUI0dVU0hZClNFQUwjVEVYQVMjU0hPRQpBTkdMTyNORVNUI0lBTUEKIyMjT0REI1NUSVRDSEVTClJBR1dFRUQjRUxJIyMjIwpBTElUI1dFVEJMQU5LRVQKRElWQSNMSUVVI1JBTlRPCkFCRUwjQUNFRCNBRE9SRQpSSU5LI1BFTlMjU0FURVM="},{"title":"5/07/04 ENTRANCE EXAM","author":"by A.J. Santora, edited by Stanley Newman","date":"2004-05-07","grid":"Sk9VU1QjUEFDVCNOQVBBCkVOTlVJI0VTQUkjRU1FVQpFVEhFTCNUSFJFU0hPTEQKUEhJI0xFVCMjI0VSUk9SCiNFTkMjT1lMI0VRVUFURQpBUkdPVFMjQUNMVSNMQVkKU1VFREUjUFJPU0UjIyMjClVOREVSTE9DS0FOREtFWQojIyMjTU9TSEUjQ09OR0UKVFJBI0lTRUUjREVGT0dTClJFTEFURSNTUEEjRkJTIwpBTkdJRSMjI0FZRSNCQVIKRE9PUlNJTExTI1RPSUxFCkVJUkUjTUVBVCNPTkVBTApEUkVEI1BJU0EjTkVSRFk="},{"title":"5/08/04 SATURDAY STUMPER","author":"by Craig Kasper, edited by Stanley Newman","date":"2004-05-08","grid":"U09GQVMjQlJJQ0FCUkFDCk9WQVRFI0FFUk9EUk9NRQpZRU5UQSNJTlNJREVNQU4KQVJURSNBTFQjUklWRVRTCiNIQVNBTE9PSyNFRVJJRQpMQVNUTUlOVVRFI1RPU1MKQU5JU0UjI1RFTktTIyMjClBHQSNORUcjTEVJI1VMVAojIyNJU0FBQyMjT1JTT04KQk9BQyNUV09CQVNFSElUCkFCTEVSI0tOVUNLTEVTIwpORVdCSUUjR1JFI0VSTEUKR1JFRU5TUEFOI05BU0FMCkxPU0VTVElNRSNCUklOSwpFTlRSRUFURUQjQU5ORVM="},{"title":"5/09/04 SPACE SAVERS: A sound construction","author":"by Lee Weaver, edited by Stanley Newman","date":"2004-05-09","grid":"QUhFTSNBU0VBI0NSRVNTIyNDT01BCkRPVkUjUEFSUyNMRUFLRVIjQU5PTgpTUEVMTElOR0IjT05USU1FI0JFTkQKI0lOREVFRCNFTFNBI0RJU1RBU1RFCiMjIyNBQ0UjU0VFTSMjI09VTkNFUwpKSEFXS0VSU1RBVEUjQlVSRUFVIyMKQUVSSUUjI0xPUyNTTUVMVFMjUENUCk1BTkxZI1dFU0VSI0VEVCMjU09MTwpFVklMI1JPSSMjRVJORSNJUkVGVUwKU0VFI0dVTkcjU09ZUyNBRE9QVEVFCiMjIyNJU1RIQVRSRUFMTFlVIyMjIwpJTVBBTEVTI0RBRFMjSURMRSNTQUQKQ0FOVkFTI1NFUkUjI0dFTCNEQU1FCkFHVUUjI0FMTCNSRVJBTiNTSU1PTgpOSVQjRVNQSUVTI0xFVCMjQUVPTlMKIyNCQVRURUQjQ1NJREVDT1RUQUdFCkFMVU1OSSMjI1VQRE8jT1JPIyMjIwpSSVRVQUxMWSNMSUVVI0xBUkdPUyMKU0VUUyNUT09UTEUjQklMTElBUkRRCk9HRUUjU09SUkVMI1RPSUwjTUVBVApORVJEIyNNRUFEUyNTVUVZI0FPS1M="},{"title":"5/10/04 INSTRUMENTAL","author":"by Sally R. Stein, edited by Stanley Newman","date":"2004-05-10","grid":"Q09CUkEjUE9FVCNBRkFSCkFURVVQI1VORE8jRkxVRQpTVEFNUCNTRUVSI1JVVFMKU09VU0FQSE9ORSNJR09UCiMjIyNSQVkjI0FDQ0VTUwpIT1RURVIjUkFESUFMIyMKRU1BSUwjQ09DT0EjSE1TClJJTVMjQ09WRVIjRk9JTApPVEIjTUlNRVMjQlVSUk8KIyNPUkFUT1IjR0FSTkVUCkZSVUlUWSMjQVVHIyMjIwpFQVJOI0hVUkRZR1VSRFkKQVZJUyNBUk9PI0FTVVJFClJFTkUjTElNUCNHRUVOQQpTTEVEI0xTQVQjRVJST1I="},{"title":"5/11/04 FUN AND GAMES","author":"by Gail Grabowski, edited by Stanley Newman","date":"2004-05-11","grid":"VEFDT1MjVE9SQUgjTklQCklTQUFDI1NQSVJPI0VSQQpFVENIQVNLRVRDSCNWQU4KUkVUVVJOI1JFSE9ORSMjClNSSSMjSURBIyNIQVJQTwojIyNNUlBPVEFUT0hFQUQKI01BVUkjREVTSSMjVklFCkhBTkRCQUcjU0NSRUVOUwpPUkUjI01FU0EjRklSUyMKUElDS1VQU1RJQ0tTIyMjClNFREFOIyNBTEwjI1JJUAojI09MSVZFUiNBVFRJUkUKSkVUI1RJRERMWVdJTktTCk9XRSNFTElPVCNJTlNFVApZRVMjU0VFTVMjTkVFRFM="},{"title":"5/12/04 GLEE CLUB","author":"by Rose Baum, edited by Stanley Newman","date":"2004-05-12","grid":"RUJCUyNBVFRBUiNFUkxFCkxFQUgjRFJBUEUjUkFJTgpLRU5PI0pVTVBGT1JKT1kKI1NDVUJBI1BMVU0jQU5BCiMjI1RJQ1MjRUdBRCMjIwojU0NITEVQUyNFUkFTRVIKT0FIVSNOSUNFI1NOQVJFCk9ET1IjVEVBTVMjQ0lORQpQQUlSUyNEUklQI0VOSUQKU1RSQVRBI1BST1JBVEUjCiMjI0hBTE8jU09JUiMjIwpBUEUjSUxMUyNOT09LUyMKSFVHT05FU0VMRiNVTEFOCkVSR08jR0VOSUUjTkVNTwpNRVNII0VOREVEI0RFRVI="},{"title":"5/13/04 NO SMALL FEAT","author":"by Bob Frank, edited by Stanley Newman","date":"2004-05-13","grid":"UkVTVCNMSVZFRCNCRVRICkFMVE8jSVJFTkUjQUxPRQpCWUFORExBUkdFI0JMVUUKQVNORVIjI0JBUk5ZQVJEClRFRERJRVMjR0VPRyMjIwojIyMjUFJPU0UjVFJBREUKQ0hVTSNBUlQjTEVBR1VFCkhBUkkjU1RFRUwjTkFUTApBVVNTSUUjQVJBI0RSWVMKUExBVE8jQ0xBTVMjIyMjCiMjI0VUVEEjU0FVU0FHRQpBUFBSQUlTRSMjQkFST04KQ1JJQiNNVU1CT0pVTUJPClRPTkkjRUFNT04jTkVBTApTV0FHI1NMQU5UI0FEREE="},{"title":"5/14/04 SUBTLY STELLAR","author":"by Merle Baker, edited by Stanley Newman","date":"2004-05-14","grid":"RE9DSyNNQVRBI1NDQU1TCklOQU4jQUxFQyNIT1JBRQpTRVJBI0VJUkUjT1NTSUUKQ0FOVkFTVEFSUCNUT05ZClNMWUVTVCMjQk9OQU5aQQojIyMjQVJGUyNOT1IjIyMKT1ZFUlRPT0sjRUxJSkFIClZJREVPI1hJUyNPQ0FMQQpBTEFTS0EjVFVSTkFXQVkKIyMjVEVDI1NNVUcjIyMjCk9STUFORFkjI05FU1NJRQpMQUlSI0NBU1RBUk9VTkQKQURERUQjV0hJVCNMQUNFCk5BR0FUI1BJVEEjSVZBTgpEUkVTUyNTTk9CI0RFTlM="},{"title":"5/15/04 SATURDAY STUMPER","author":"by Daniel R. Stark, edited by Stanley Newman","date":"2004-05-15","grid":"SU5HUk9VUCNHTE9TU0VTCkNPTFVNTlMjUkVBTElTTQpFTUFOQVRFI0lOVEVOU0UKU0lDI1JPVUdFRCNEVUVMClVOSVRTI0RFRkVSI09OVApQRUFSI0hPTiNSRURVQ0UKI0VMRU1FTlRTI0hPU0VECiMjI01BTlkjQVJBTiMjIwpHQUJPUiNNT1RIQkFMTCMKQURPUkVEI01JTyNURUVNCk1FTiNTT1JFUiNCRUlHRQpCTEFCI0RFTklSTyNTVVIKTElORUFHRSNDT1NUVU1FCkVOWllNRVMjQVNTVVJFUwpTRUFTSURFI0xFQU5FU1Q="},{"title":"5/16/04 WHAT'S FOR LUNCH?: A few serving suggestions","author":"by Shirley Soloway, edited by Stanley Newman","date":"2004-05-16","grid":"I1BNUyNFUklDSCNMQVNUI0VER0VECkVMSUUjUkFESU8jQVNUTyNBUk9TRQpUVU5BU0FMQURPTldIRUFUVE9BU1QKQUdJVEFURVMjVE9ORVIjQUlTTEVTCiMjI0VOT1MjQkVTUyMjUElOUyMjIwpBV0FSRCMjVEFEQSMjR0VMUyNSQVkKVk9OI0FMSUFTI0xFR1JFRSNGSUxFCkdSSUxMRURDSEVFU0VBTkRCQUNPTgpBU1RJI0FMSUVOI0VORCMjQVNIRVMKU1RBQiNTRVRTSU4jVEVSTUlURVMjCiMjI0VXRVIjI0RPVCMjQU9ORSMjIwojU1RSRVNTRUQjU0FUSU5TI05BR1MKQ0hBSU4jI0RBUyNSQU5EUyNFUkxFCkhBTUFORFNXSVNTT05SWUVCUkVBRApFVkVOI0VMSVNTQSNHRVNTTyNUUkEKVEVEI01BSU4jI0hFTEQjI0dSRUVOCiMjI0JBTkQjI1dBUkUjU0FHQSMjIwpBU1RFUk4jQ0xBUkEjREVDRU1CRVIKUEFTVFJBTUlPTkFTRUVERURST0xMCkVMQVRFI0FOTkUjRUxMRU4jT1JCUwpEQVJFRCNIRUVEI1NLSVJUI0RFRSM="},{"title":"5/17/04 GLOVE BOXES","author":"by Lee Weaver, edited by Stanley Newman","date":"2004-05-17","grid":"RkVURUQjVVNBRiMjV1JZCklSRU5FI01PUkVTI1JPRQpGSU5HRVJQQUlOVCNJTUEKRU5USVJFI1JFQ0VTU0VTCiMjI05FVFMjU0VFS1RPIwpMQVRFI0lOQyNEUkFXIyMKSUNIIyNSQUhTI1NUQUcjClRSVUUjRVBJQ1MjRVRBTAojRU1NWSNTRVJFIyNDUEEKIyNCT09TI0ZBUiNTSEVECiNBU1RVVEUjUEFQQSMjIwpFVENFVEVSQSNQT1RBVE8KRVJSI0hBTkRERUxJVkVSCkxJRSNTS0lFUyNBUk9TRQpTQVcjI1NFTlQjUkVOVFM="},{"title":"5/18/04 FOR YOUR APPROVAL","author":"by Randall J. Hartman, edited by Stanley Newman","date":"2004-05-18","grid":"TEFTUyNTVEFMSyNEVVNUCkFMVE8jVEhST0UjSU5UTwpNQUlEI1JFUlVOI0FSRUEKT0tMQUhPTUFTT09ORVJTClRJRSNFQkFZIyNSRVNFVApUTlQjWUVOI1BFQSNUT1kKQUdUUyMjI0RFTFRBIyMjCiMjT0tUT0JFUkZFU1QjIwojIyNJQlNFTiMjI1NBR1MKU1RBI09TRSNJU0gjTElJClBBR0FOIyNBQ0hFI0tMTQpPS0VGRU5PS0VFU1dBTVAKUkVOVCNBTElDRSNBV09MClRJREUjR0VUQVQjUkFSRQpTVEFSI1NPQVBTI0RZRVI="},{"title":"5/19/04 WESTERN WORDS","author":"by Daniel R. Stark, edited by Stanley Newman","date":"2004-05-19","grid":"TEFGRlMjQUxCUyNTQU5ECklHTE9PI0dPQUwjQVZFUgpEUkFJTiNBTk5FI0RBUkUKU0FHRUFEVklDRSNESVZBCiMjIyNUT0UjI1BVTExFRApNQUNSQUUjQUZJUkUjIyMKQVJSSVMjUVVFRU5TSVpFClJFQUQjUFVSRVIjT0xBRgpDQU1FTExJQVMjUEFJTlQKIyMjSEVBVFMjUkVQQVlTClNJTEVOVCMjTUVUIyMjIwpPVkVSI09VVE9GUkFOR0UKRk9PRCNPSElPI09WQUxTCkFSTk8jTlVERSNDT01FVApSWUFOI1NIRUQjS05FRVM="},{"title":"5/20/04 SPLITTING UP","author":"by Fred Piscop, edited by Stanley Newman","date":"2004-05-20","grid":"U1BBUiNBQkJBI09BVEVSCkhBUkUjQkVFUCNJTkFORQpVUklBSEhFRVAjTEFOQ0UKVFJBREVPTiNBRlIjR0VMCiMjI0VSUiNPTExJRSMjIwojI1VNQlJFTExBR1JPVVAKQUxQI1NFTkQjI1NBTlRBClRBUFMjREVOSVMjU1RFVwpUV0VFVCMjQVZFUyNBU1MKVU5ERVJDT1ZFUkNPUCMjCiMjI0RFUkJZI1ZPTiMjIwpBTFQjU09UI0hFUkVTVE8KUVVJTlQjVU5JT05TSE9QClVOVElMI1NJVFUjRU1JVApBVE9ORSNFQVNUI0NPTFM="},{"title":"5/21/04 PACKING IT IN","author":"by Merle Baker, edited by Stanley Newman","date":"2004-05-21","grid":"U0hBTSNKQ1JFVyNBQkNTCkhPTUUjT0hBUkEjQk9PUApFUklOI1NPTklDI0FYTEUKQkFHT0ZUUklDS1MjQ09OCkFTQVJVTEUjI0lTTEFORAojIyNBUkUjUEhFTk9NIyMKSVRDSFkjQkFBUyNXRVBUClJBSCMjUVVJTFQjI1JFVgpTVUVaI1VSTlMjUkVBUFMKIyNTT0xPTlMjV0FYIyMjCkxFVE9VVCMjRElNUExFUwpMQVgjQ0FTRUlOUE9JTlQKT0dSRSNCTEFSRSNVU0dBCllFQVIjTEFTRVIjTkxFUgpEUllTI0VWRVJZI0RFTFQ="},{"title":"5/22/04 SATURDAY STUMPER","author":"by Anna Stiga, edited by Stanley Newman","date":"2004-05-22","grid":"Q1JBUFNIT09UI0JPU0NTCkxFTkFIT1JORSNVTFRSQQpBTkRST01FREEjQ0FSSUIKU0FSVFJFI1JQSSNGRVRBClNURUlOI0tBT1MjU1VFVApZQVcjI1NPRlRPTiNTUkkKIyMjQVNDT1QjTE9NRUlOCkFOVFdFUlAjSkFJQUxBSQpTRVJFTkUjTklUUk8jIyMKSEFJI0RFQk9ORSMjVEFMCkJURU4jQ1JVWCNTTE9NTwpMSVNBI0hBVCNBVEVNUE8KT0RPVVIjTlVJU0FOQ0VTCk5FVVJPI0RSS0lMREFSRQpEQVRVTSNPTkVTRUFURVI="},{"title":"5/23/04 ANTONYMY: An opposite attraction","author":"by Randolph Ross, edited by Stanley Newman","date":"2004-05-23","grid":"TUFBUyNSQUJFTEFJUyNBUkNIQUlDCkFDREMjQ0xBVklDTEUjUE9MRU5UQQpUUlVFRkFMU0VURVNUI0FWSUFURVMKU0VFTk8jU0VOVCMjVEhSRUVUSU1FCiMjI0VORCNERUxBTkVZI1JOUyMjIwpDQVBJVE9MI1JFVEFSRCNTVEVQUEUKQU1PI1NOSVQjQk9TU0VEIyNBUkFMClBPT0wjVFNBUklOQSMjUk9CTE9XRQpFQ1JVI0RBTUFHRSNJU1RMRSNDQU4KVE9SSU5PI0FJTSNPRlQjREFLT1RBCiMjSVNJVCNCU0EjVVRFI05VTk4jIwpJTkNBU0gjTEVOI1RIRSNFWEVURVIKTk9II0VBU0VEI0xJRUxPVyNFUk5FCkNMQVJJVFkjI1RBTk5FUlkjREFSRQpBSVJFIyNOQVRBTlQjRElPTiNDT1MKU0VERVJTI0NPTkNIUyNHUklTVExFCiMjI05BVCNVUEtFRVBTI0tTVSMjIwpTRUFUQkVMVFMjI0NJVEkjQVJHVUUKQUxHRUJSQSNPRkZPTkFUQU5HRU5UClRPRVJJTkcjSVJBTEVWSU4jRVJJQwpTSUVTVEFTI0xBTkRTRU5EI1NFVEg="},{"title":"5/24/04 FILL 'ER UP","author":"by Gail Grabowski, edited by Stanley Newman","date":"2004-05-24","grid":"SU5DSCNBU1BTI0FCSE9SCkJFTEEjUFVSRSNTTElERQpNQVVJI1BST00jSEFWT0MKI1JFTElFRlBJVENIRVIjCiMjI1NSQVMjI0hBUyMjIwpSRU5UQUwjU0tJTiNDUEEKT1JJT04jUkFJTiNTSE9FCk1BR05JRllJTkdHTEFTUwpBU0hFI1JBTkcjTEFTU08KTkVUI1NFTlQjQk9QRUVQCiMjI0NVRSMjU0VBUyMjIwojTUFBTkRQQUtFVFRMRSMKUFVSUlMjT01JVCNJT1RBCkFTSURFI1NFTEwjQ1JPQwpMRUFTVCNFUkxFI0tFTlQ="},{"title":"5/25/04 ABOUT TIME","author":"by Sally R. Stein, edited by Stanley Newman","date":"2004-05-25","grid":"UkFDRUQjQ0xBTiNEWUVTCkFDSE9PI0xPVVQjRUVMUwpUSElOR1NPRlRIRVBBU1QKU0VDI1BMVVRPI0dPUkVTCiMjI01BSUQjR05BVCMjIwpBQkJPVFQjQlJFRCNBTVAKQlJPTkMjQ1JBQiNBTE9FCkJJUlRIREFZUFJFU0VOVApFRElFI0lUQ0gjQUNVVEUKWUVTI0RPU0UjQlJPVEhTCiMjI1RPTkkjREVQVCMjIwpBUlNPTiNUT1dFTCNQT1cKQkFDS1RPVEhFRlVUVVJFCkJSQVkjTkVJTCNHQVpFUwpSRU5PI1RST1QjU05PT1Q="},{"title":"5/26/04 BURNING ISSUES","author":"by Robert H. Wolfe, edited by Stanley Newman","date":"2004-05-26","grid":"RUxMUyNQUk9QI1RBTUVSCk1PT1QjUkVQTyNJVEFMTwpJQkFSI0VWRU4jQkVUU1kKUk9NQU5DQU5ETEUjQ0lBCiMjI1BPT1IjU0FUQ0hFTApIQVAjVE9ORSNQQUxTIyMKRVBJQyNLSU5HI05BVEFMClJFTEFYI1NUWSNTUElSRQpTVE9STSNIRVJCI1NDT1QKIyNURUFNI1JPTEUjS09TCkZFTFRTQUQjU09CUyMjIwpBUkkjQ09STkNPQlBJUEUKTUFHTkEjRE9PTSNVU0VECkVUSEVSI1JPUEUjREFORwpET1RFRCNFS0VEI1NZTkU="},{"title":"5/27/04 RETURN TO OZ","author":"by Fred Piscop, edited by Stanley Newman","date":"2004-05-27","grid":"TEFTVCNERUMjU1BIRVJFCk9TSEEjQVZFI1RFQVNFUgpMSU9OU0RFTiNFTkRFQVIKSURPI1BPUlQjUlVFIyMjClRFVFJBI1RJR0VSU0VZRQpBU1NFUlQjI1JPWSNZRU4KIyMjUEVTRVRBIyNCUkFECiMjRE9ST1RIWUdBTEUjIwpNQUFTIyNIVVNUTEUjIyMKT0xEI0FXRSMjT0JTRVNTCkJFQVJTQVJNUyNBVFNFQQojIyNBVEwjRUNPTiNDRUwKUEVBTlVUI09ITVlQQVBBCklOQ0lURSNXV0kjQVBFRApURUVORVIjU0FUI1JFRFM="},{"title":"5/28/04 WHOA","author":"by Bob Frank, edited by Stanley Newman","date":"2004-05-28","grid":"REFCUyNDQVJURSNBR0VSCkRJUlQjSVZJRUQjTUFNRQpUUk9ZI05JQ0FEI0FMQUkKI0hPTERFVkVSWVRISU5HClBPRElVTSMjIyNBTExBTgpBTEUjUEFTVElORyNFVEUKU0VERVIjSE9TVCNTRUVECiMjI0JFTEFZVEhBVCMjIwpDUklCI09SRU8jTUFSS1MKTEVOI05BSVJPQkkjRVJBCkFDSE9PIyMjI1VTRUZVTApTVE9QUklHSFRUSEVSRSMKUE9VVCNUUkFJVCNSQUdFCkVSU0UjQ0FSTkUjSU1FVApEWUVEI0hZUEVSI0VFUk8="},{"title":"5/29/04 SATURDAY STUMPER","author":"by Daniel R. Stark, edited by Stanley Newman","date":"2004-05-29","grid":"V0hJRkZTI05FV1NDQVNUCkhBUkxPVyNJTUlUQVRPUgpFTlJBR0UjTUlOSVNUUlkKRURJVCNERUJUI1JBSURTCkRJR1MjRUxMIyMjI0xJVApMRUEjIyNFRU8jR09BRFMKRVNUQSNNQVJDSEVTIyMjClNURVBIRU4jVEVMTElORwojIyNTT0xPTU9OI09NQVIKVVBTRVQjUklCIyMjUFJPCk5PVCMjIyNTRUEjRk9SQQpTUEFURSNTRVJGI0FMQU4KVUxURVJJT1IjSU5WSVRFCk5BVVRJQ0FMI1JPT1RFUgpHUkVFTkVSWSNFR1JFU1M="},{"title":"5/30/04 PIECING IT TOGETHER: With the theme revealed at 69 Across","author":"by Fred Piscop, edited by Stanley Newman","date":"2004-05-30","grid":"TFVNRVQjRkFSIyNQQUNTI1JJU0VSCklTSUFII0FNSUQjSUNPTiNFQ09OTwpTRUNSRVRDT0RFI0VUTkEjUEVTVE8KVFJBTlNJVFMjRUFUSU5HUkVDT1JECiMjIyNBTlNPTiNSQVZJI09MQSMjIwpLSVNTVVAjWkVFUyNFVklMU1BFTEwKT01FQVJBIyNHVE9TI0VOTCMjTUlBCkJVQ0tJTkdCUk9OQ08jRk9SI0JFTgpFU1RTIyNJSUkjI0FSQ08jRUxBTkQKIyMjI09BRlMjU0FMTFkjU1RFUkVPClRISU5HU1RIQVRNQVlCRUJST0tFTgpIT1NFUlMjT05BSVIjSVRTWSMjIyMKRVBPREUjQVBBUiMjU0xBIyNFTFNBClJFTSNTSUcjVEVORE9MTEFSQklMTApFU0UjI0RSSiNTQVVMIyNST09LSUUKRk9STUFUSU9OI0RPT1IjTUFORVRTCiMjI0FSQSNTVUZJI05PQklEIyMjIwpMT1NJTkdTVFJFQUsjVEFOVEFSQVMKRVhJTEUjRUxTRSNFTkdBR0VNRU5UClRFTkVUI1JFRUwjUk9VRSNTTUlURQpTTk9SVCNBRERTIyNTVEQjVE9ORVI="},{"title":"5/31/04 IN THE CARDS","author":"by Gail Grabowski, edited by Stanley Newman","date":"2004-05-31","grid":"QkVBTSNBTUVTI1RTQVJTClVSU0EjVFlSTyNFQVRVUApUUk9KQU5XQVIjQUZURVIKVE9OI05PT1NFI0NBTkRZCkVMRUFOT1IjI09BUiMjIwojIyNMT05ET05CUklER0UKQ0FUUyMjI0hPT1QjQU1BCk9SRU8jQlJBVkUjQUxBUwpBTEUjU09BUiMjI1NFTlQKTE9ORUxZSEVBUlRTIyMjCiMjI1NJUyMjUkFJTkJPVwpSRUFDVCNTUEVOVCNVTkkKQUxMQUgjQ09UVE9OR0lOClNMT1BFI0FTSEUjQUxPRQpQRVRFUiNSRUFEI1BFTlM="},{"title":"6/01/04 THE i's HAVE IT","author":"by Randall J. Hartman, edited by Stanley Newman","date":"2004-06-01","grid":"Qk9MT1MjTU9TVCNBR1JBCkFMT05FI0FMVE8jSVJPTgpSRVNJTiNBREFNI01PQVQKRE9UQ09NTUVSQ0UjVVNFCiMjI0VSRSMjVEFMRU5UUwpBQkUjQVRPTSNUT0xEIyMKUFVQUyNSQUlOI1BBUlRTClBPSU5UT0ZOT1JFVFVSTgpUWVBFUiNTT0xPI0VMSUEKIyNIRUFUI1RPVVIjRUdHClNXQVJNRUQjI05FVyMjIwpUSU4jUEVSSU9EUElFQ0UKQUxJVCNUQVJBI0VMQk9XCkdMRUUjRU1JVCNBRE9SRQpFQVNFI1JBU0gjTEVORFM="},{"title":"6/02/04 QUIET ON THE SET","author":"by Fred Piscop, edited by Stanley Newman","date":"2004-06-02","grid":"TEVTUyNGRUFSI0FMT09GCkFUVEEjUkVCQSNDQUNUSQpUSEVCT09LT0ZMSUdIVFMKSU5URVJOIyNGRUQjU09UCk5PUyNTVE9HSUUjIyMjIwojIyNNT0lSQSNTQUxBRFMKQVJFQSNFQVNFI0xFR0lUCk1VR0ZPUlRIRUNBTUVSQQpQTEFJTiNFSVJFI0FSVFkKU0VEQVRFI05JTExZIyMjCiMjIyMjQU5HRUxBI1NBWApVUkkjRlJJIyNNSVNVU0UKTUlTU0lOR0lOQUNUSU9OClBBTEVTI0VESVQjQVROTwpTTEVFSyNMQUtFI0JFRU4="},{"title":"6/03/04 SEW WHAT","author":"by Robert H. Wolfe, edited by Stanley Newman","date":"2004-06-03","grid":"QkxPVCNIRU5JRSNPT1BTCk5JTEUjRU5FUk8jTkNBQQpFTEFOI0FSR09OI1RIUlUKR0lWRUFEQVJOI1JIRVRUCiMjI1RST1BJQyNFRVJJRQpFTEsjVE5UI0xPQU0jIyMKREVJQ0UjI0hBTU1FUkVECk5FTEwjU1BVRFMjTk9SQQpBU1RPTklTSCMjQURMSUIKIyMjU09OWSNSRUcjRU5TClBBVEVTI0NMRVJJQyMjIwpTVEFLRSNIRU1BTkRIQVcKSE9STiNDT0RFUyNSVUJFCkFOVEkjQlVHTEUjT01FTgpXRVNUI1NURVRTI01FTEQ="},{"title":"6/04/04 SWEET CINEMA","author":"by Richard Silvestri, edited by Stanley Newman","date":"2004-06-04","grid":"QUdMT1cjQUJVVCNKQURBCkdVQVZBI0RBUkUjRVRBTApFTE1FUkZVREdFI1NFTUkKU1BBTklFTCNFTU9USU9OCiMjIyNORVRTIyNQRU5ORQpET1JBR1MjQ0FURVIjIyMKT1ZBTCMjU09MQVIjUEFSClBFUklMU09GUFJBTElORQpFUkUjTE9BRlMjI1lFVEkKIyMjQ09PS0UjU1dFREVOCkRFTEFZIyNET1VSIyMjIwpBTUFOREFTI1BSRVNPUlQKTkFQQSNGT1JSRVNUR1VNClRJRUQjRUROQSNURVJTRQpFTExBI1dBU0gjU1RFRU4="},{"title":"6/05/04 SATURDAY STUMPER","author":"by S.N., edited by Stanley Newman","date":"2004-06-05","grid":"RUdPVElTVCNBVFRJUkVECk5BTkVUVEUjQkFSTk9ORQpTV0VOU09OI0RSSVNUQU4KSUtJRFlPVU5PVCNQQU1TCkdJREUjRFJBTUEjQVRPSQpORUFSI1BFVEVSRURPVVQKU1JTI0JBREVOI01FUlJZCiMjI0NPVCMjI0hJUyMjIwpTVEFSWiNERVBPVCNFU0MKQVJUT09ERVRPTyNBQ0VSClBFQVMjQVZBU1QjU1VSRQpQQU5TI01PTFRFTkxBVkEKSUNFQk9BVCNJRE9PRElUCkVMTk9SVEUjVEFEUE9MRQpSRURXT09EI1NURUVSRUQ="},{"title":"6/06/04 CREATURE FEATURE: Of the four-legged variety","author":"by A.J. Santora, edited by Stanley Newman","date":"2004-06-06","grid":"QVBUI0FDTFUjU05PT1AjIyNQT0NPCk1JQSNDSElQTVVOS1NPTkcjQUZPWApQT1BHT0VTVEhFV0VBU0VMI0FNT0kKVU5ERVJTVE9PRCMjS0lXSSNSSU5ECkxFQU4jI0VOUyNGTEFUUyMjI0NTQQpMRU5TTUFOIyNFTEkjIyNVUEJFQVQKQVJDI0lURU0jU0FMRU0jTUlSQUdFCkVTRSNTVFJPUFBZI1NFQVBMQU5FUwojIyNBREUjQk9PI0ZMQUIjTEVEIyMKQVdFU09NRSNOVUxMI1RPRSMjTUVMCkxFQVAjUExBWVNQT1NTVU0jU0VHTwpMRUcjI1RFTSNFU0FVI1RJRElOR1MKIyNFQkIjTklQUyNUSU4jTkFQIyMjCkFSUkVBUkFHRSNQRVRFTUVOI1RPQQpSQUJCSVQjT1RURVIjVElOVCNJVlMKU1RFRUxFIyMjRUxTIyNTVEVSTkVTCkVUQSMjI1NUQUxFI0FMUyMjRUlSRQpORVZBI0FIT1QjI0dSQVBFVklORVMKQURFTiNIQVJFQlJBSU5FRElERUFTClRPUk4jU1FVSVJSRUxDQUdFI1NTRQpFTlNFIyMjU05BUkwjRUtFRCNTWUQ="},{"title":"6/07/04 CRUISING","author":"by Lee Weaver, edited by Stanley Newman","date":"2004-06-07","grid":"U1RSSVAjQ0xPQ0sjU0FECk9IQVJBI1BFUk9OI1VTRQpXQVZFR09PREJZRSNSSUIKI1RFTkVUUyNTRUUjRkFUCiMjI0VBVCMjI1NQQVQjIwpPQUYjTkVUI1NUQVNIRUQKVU5PI1RSVVNUI0RFRVJFClNUQUIjU05PT1QjQVdPTApUSU1FUiNJTkxBVyNFRFQKU0NSRUFNUyNFUkUjQkVBCiMjVU5ETyMjI1RBQyMjIwpKQUIjSURBI1NBTEFNSSMKRUJCI0NVUlJFTlRDT1NUCkVFRSNBTElFTiNIQUxMRQpQRVIjTEVBRFMjWU9ERUw="},{"title":"6/08/04 HAPPY DAY","author":"by Sally R. Stein, edited by Stanley Newman","date":"2004-06-08","grid":"R05BU0gjQkFSI0VHUkVUClJPTUVPI0VUQSNFTEFURQpBU1BFTiNBTEkjUkFJVFQKREVMSUdIVEVEI0lETEVTCkVERU4jQUxBI1JFRCMjIwojIyMjTElFU1RPI0VUT04KU0lOR0VSI1RXTyNOSUxFCkNMRVJJQ1MjQVRURU5EUwpBU0lBI1VLRSNCQURHRVMKTUFMVCNUSUxURUQjIyMjCiMjI0lRUyNFRUUjSEVSQQpTTkFGVSNPVkVSSk9ZRUQKTE9VSUUjUkFQI0FOSVRBCklOVEVSI0FURSNERU5JTQpNT09EWSNMRUUjRURHRVM="},{"title":"6/09/04 HOOKUPS","author":"by Fred Piscop, edited by Stanley Newman","date":"2004-06-09","grid":"Q1VTUFMjSkVMTE8jQkFUCkFMTE9UI09SSU9OI1VOTwpTTkFQT1VUT0ZJVCNDQVIKVEFWRVJOI1NFVCNTS0lUCiMjI0RFUlIjUkVQVUxTRQpHT1RPU0VFRCNSQVJFIyMKV0hJTSNBQ0lEI0xFREdFCkVORSNBTEFNT0RFI09SRwpOT0JFTCNQRUxFI1NXSUcKIyNSQUlEI0RFU0NFTlRTCkNIRVNURVIjRElSRSMjIwpIRUFUI1ZJQSNMRU5ETUUKSU5LI1pJUFBMVVNGT1VSCkxJRSNBQ1VURSNUSU5DVApERVIjUEVQU0kjU1RBS0U="},{"title":"6/10/04 LAST THREE","author":"by Robert H. Wolfe, edited by Stanley Newman","date":"2004-06-10","grid":"T0dMRVIjU1BBUyNMRVRTCk5PT1NFI0NBTE0jQVJJQQpZRUxQUyNPTlRPI01VVFQKWFJBWVBIT1RPR1JBUEhZCiMjIyNPQVQjIyNBU1RFUgpNQVNPTlMjRkxBRyMjIyMKQVRMQVMjSE9PUCNGQUxBCllPVVJFREFSTlRPT1RJTgpBUEVTI0FOVEkjRFJJRlQKIyMjI0FORFkjR09BVEVFCkFUUEFSIyMjR0VSIyMjIwpaSUVHRkVMREZPTExJRVMKVEJBUiNNQUlMI0VBR0xFCkVJUkUjSU5HQSNTVE9MRQpDQVNFI1RFU1QjU0hSRUQ="},{"title":"6/11/04 POLITICAL GIVE-UPS","author":"by Bob Frank, edited by Stanley Newman","date":"2004-06-11","grid":"QVBTRVMjQVNII1NJUlMjCkNSRUVQI1BFQVJUUkVFIwpDT05DRURFVEhFUkFDRSMKRU1PI0NPWCNBQkVUIyMjClNQUklUWkVSIyNXRUVEUwpTVEFSUiNTSVRJTiNMRU8KIyMjS0FOI0dJTiNUTUFOCiNZSUVMRFRIRUZMT09SIwpUT0REI0FSVCNPRVIjIyMKV1dJI1NLSUVTI1RBUlRTCkFMR0FFIyNERUFESEVBVAojIyNMQUJTI0lETyNWSUkKI1NVQk1JVEFORVdCSUxMCiNBUkVBQ09ERSNOQVZFTAojR0xFTiNQT1MjU0hFRFM="},{"title":"6/12/04 SATURDAY STUMPER","author":"by Daniel R. Stark, edited by Stanley Newman","date":"2004-06-12","grid":"QUxGUkVTQ08jREFMTEFTClNBTEVTTUFOI09SSUVOVApUUkVBU1VSRSNNUk1PVE8KRVZFUiNHQVRTI0FCTkVSClJBQ0VEI1RJUFBZI0FSTQpTRUVERUQjTUlJI1RST0kKIyMjI0NBVEVSUyNJRE9MCk1BUkNPTkkjRUNPTk9NWQpPVkVOI0NFQVNFRCMjIyMKTkVPTiNFU1QjU0VBTEVECkFSQyNBRElUUyNTUEFSRQpMQUNFUyNOQVRMI1BTQVQKSUdVQU5BI0NSRVZBU1NFClNFUlZFUiNLSU5ETElFUgpBU1NFUlQjU1BPVExFU1M="},{"title":"6/13/04 EXCUSES, EXCUSES: You've heard them all before","author":"by Merle Baker, edited by Stanley Newman","date":"2004-06-13","grid":"QVBJQU4jVFJJU1RFI0FQVFMjQVRDClJBTlRPI1JPVFRFUiNTT0hPI0dBUgpNWUNPTVBVVEVSQ1JBU0hFRCNSS08KRUNPTiNPQ0hSRSNBV09MUyNURUVTClJVTSNPUEVTI0VBVE5PI0FFTkVBUwpTVEVMTEEjI0lUV0FTTlRNWVRVUk4KIyMjUEVSRk9SQ0UjIyNTRUUjUElFCklWRUdPVEFIRUFEQUNIRSNDTE9EUwpUQVRBIyNDTURSI1NITyNTSElORVMKRVJFI01FQSMjI0dIQU5BSUFOIyMjCk1ZU1BFRURPTUVURVJJU0JST0tFTgojIyNUQUtFRklWRSMjI1BTVCNJTE8KQVNQRU5TI0lMRSNTWU5FIyNFV0VTClNOT1JUI0lUU05PVE9VUlBPTElDWQpTT0wjSUxMIyMjQ0VOVEFVUlMjIyMKSVdBU01JU1FVT1RFRCMjUkVFRkVEClNUUkVFUCNVU1VBTCNPTEVTI0xJVQpUSUNTI1NUSU5UI1lQUkVTI0JVRkYKRVJBI01ZQUxBUk1ESUROVEdPT0ZGClJFUCNJTlNUI0FDQUNJQSNQVVJFRQpTU1MjSUNLWSNOQU5URVMjQVRPTEw="},{"title":"6/14/04 FLAG DAY","author":"by Sally R. Stein, edited by Stanley Newman","date":"2004-06-14","grid":"Q0FOVCNTVEVFUCNXT0xGCk9MRU8jSE9URUwjQUxBSQpEQVdOU0VBUkxZTElHSFQKQVNTI0NBU0UjTU9MQVJTCiMjI0RBUlQjQk9PUyMjIwpBQ1RPUlMjVEFVVCNWQ1IKUEhPTkUjQ09TVCNTQVJJClBST1VETFlXRUhBSUxFRApMSU5UI0FDRVMjSU5VU0UKRVNTI0ZVTEwjR1JFRVRTCiMjI0NBR0UjQ1VCUyMjIwpCTEVBQ0gjQVJJQSNQQU4KUk9DS0VUU1JFREdMQVJFCkFDSEUjRUxBVEUjQUxFWApUS09TI1JPQkVTI0JFQVQ="},{"title":"6/15/04 CUPFULS","author":"by Lee Weaver, edited by Stanley Newman","date":"2004-06-15","grid":"VE9ETyNCSURFI1JFQ0FQCkFMSVQjQVNJQSNFUk9ERQpMSVNUI1VTRVMjV0FGRVIKQ09DT0FCVVRURVIjRkVNCiMjI01VTEVTI1ZPVEVSUwpQRVRBTEVEI1JFVElFIyMKVVBFTkRTI0NBUkVTU0VEClNFQSMjI0FTSCMjI0hBWQpIRVNJVEFOVCNPUFBPU0UKIyNFVkVSVCNEUk9PUEVECkNFUkVBTCNTQUJSQSMjIwpMWFYjU09VUEtJVENIRU4KT1BJTkUjU09PVCNISUxPCkRFQ09SI01JVEUjRVJMRQpTTEVEUyNDTEFEI0RFQUw="},{"title":"6/16/04 HOLD IT","author":"by Daniel R. Stark, edited by Stanley Newman","date":"2004-06-16","grid":"U1BBUyNWQUxJRCNPUEFMCkhPUk4jQUJBU0UjWkVSTwpBTEFJI0NBQ1RJI09OVVMKV09MRlBBQ0sjVEVOQU5UCiMjI1RBTksjUElYRUwjIwpPQkpFQ1QjSVNFRSNUQUIKUE9VUlMjQlJBU1MjWU1BClRPU1MjI0FJTCMjVEJBUgpJVFQjUFJJU00jRlJPWkUKQ0hJI0xBVEgjQ09BWEVECiMjTk9PTlMjTUlOSSMjIwpBU0NPVFMjQlVORExFVVAKVVRBSCNPUkFURSNFVFJFClJVU0UjTU9ERU0jUk9TRQpBQkVEI1NPVVNBI1NOQVA="},{"title":"6/17/04 OFF THE GROUND","author":"by Doug Peterson, edited by Stanley Newman","date":"2004-06-17","grid":"TEFQU0UjQVJORSNNT1JFCkFMVU1TI0JBRVIjRURFTgpIT1BBTE9OR0NBU1NJRFkKUkVBTCNXRVNUI1BBTkRBCiMjI0xFRVIjQUNFUyMjIwojUE9DVVMjQlJPVyNTREkKTU9MQVIjU09JTCNXSEVOClNLSVBPVVRPTkFDSEVDSwpSRVZTI1JBS0UjSE9CT1MKUFJFI1RBUFMjUkVMQVkjCiMjI0RFTEwjSEVSRSMjIwpBTU9VUiNFUEVFI05FU1MKSlVNUElOR09GRlBPSU5UCkFMSUUjQlVOVCNBVFJJQQpSRVREI0FORFkjV0VFUFk="},{"title":"6/18/04 CATCH-ALL","author":"by Fred Piscop, edited by Stanley Newman","date":"2004-06-18","grid":"TU9ERVMjVVRBSCNHRVRTCkVWRVJUI05PTkUjT0xFTwpTRUNSRVRDT0RFI1VTRVIKQVJDI1JPTEwjRElSRVNUClNUQUJJTEUjU0xBTSMjIwojIyNBTEwjV0hFTkVWRVIKU0hBTEUjV0hPUyNUQVJBClRBSUwjU0VBUlMjQ0xJUApFTExFI0hBTEUjU0hFRVQKUE9TVFBPTkUjRkVFIyMjCiMjI0NVUlMjV09MRkNVQgpTQ1VMUFQjQUlSRSNBUEUKVElOQSNDQURFVENPUlBTCk9BVFMjVVRJTCNUT0xFVApXT09TI1RFTkQjU1BBUlM="},{"title":"6/19/04 SATURDAY STUMPER","author":"by Merle Baker, edited by Stanley Newman","date":"2004-06-19","grid":"SU1QT1NFUlMjQkVNSVJFCk1BTEFQUk9QI1JBSU5FRApQUkVURU5USU9VU05FU1MKQVNORVcjQU5OSUUjVlVFCkNISVMjRlJPU1QjTUlMTApUQVAjQlVZVVAjUFVUVFMKU0xPUEVTI1RFUkVTQVMjCiMjVFVORUQjQ0FSSUIjIwojR0VOVEVFTCNSRUNJRkUKRE9OVFMjTlVORVojTE9YCkVGVFMjQ0FOT0UjV0lMVApQT0kjU0FMVUQjU0FUSUUKVFJBTlFVSUxJWkFUSU9OCkhJUkFNUyNBQ0lEVEVTVApTVFlNSUUjUkVQQVNTRVM="},{"title":"6/20/04 GAMES PEOPLE PLAY: Various ways to have fun","author":"by Robert H. Wolfe, edited by Stanley Newman","date":"2004-06-20","grid":"VEFEQSNBTEJBI0hBSUxFI0ZBQ0VUCklURU0jV0FJVCNFUk5PUyNPU0FLQQpGTEFQSkFDS1MjV0FTTlQjVVRURVIKRkFSTEVZI0VUQVMjSURPI0xJQyMjClNXRUVUI0dSQUIjQVRPTkVTI0hNTwojIyMjI0JSQUtFI1JVTklOI1NXQVAKSElHSFBSSUNFVEFHI0JBRFNQT1JUCkFMTEFMT05FIyNQT1VSI1NURVJORQpESUFUT00jI0dBU1RSSUMjQURERUQKVEFSRSNBVkVSU0UjQURVTFQjIyMjCk9ERVMjVE9MRVQjQU5HTEUjU1RBUgojIyMjQkVJR0UjT1JJRUxTI1BFU08KV0FERVIjUklDT1RUQSMjU1BBUlRBCklNQVJFVCNORVNUIyNTV0VBUlNJTgpNT1JBTElTTSNDT0FUQ0hFQ0tFUlMKUENUUyNHVUFWQSNYUkFZUyMjIyMjClNPUyNURVJST1IjTEVOUyNDQVNLUwojI0FSSSNOQkMjQkVBRCNTT1BISUEKSU9XQU4jQUxBTU8jRElSVFlQT09MClRXQUlOI01FTE9OI0xVQkUjTEFTVApTTFlMWSNFU1NFTiNFTUlSI0VMS1M="},{"title":"6/21/04 OOPS!","author":"by Gail Grabowski, edited by Stanley Newman","date":"2004-06-21","grid":"U1dBUCNTUEVDSyNPV0VECkFSQ0gjTElUSEUjTklMRQpQT1RBVE9DSElQI0FTU04KU05PUkUjS0lMVCNERUVTCiNHUkFTUyNDTElOSUMjIwojIyNPVFRPI1NORUVSQVQKUE9TSCNBRE8jI1NUQUxFCkFLQSNDUkVXQ1VUI0NBTgpUUklBTCMjTk9UI1NLSVQKSEFOR0FSUyNXQUdFIyMjCiMjVElESUVEI0hBVk9DIwpGT05UI0FRVUEjUkVQT1QKQVJJQSNMVU5DSEJSRUFLClRBQ1QjVElFUlMjQVJMTwpFTEtFI09OU0VUI0xBU1M="},{"title":"6/22/04 SUMMER IS HERE","author":"by Sally R. Stein, edited by Stanley Newman","date":"2004-06-22","grid":"QUxBTiNTSEVMRiNST1NFClJPTUUjUEFUSU8jRVJBUwpDT01CI0FMVEFSI0FTSVMKU1RPUkVDTEVSSyNHT05FCiMjI0FHRVMjIyNQQU5UUwpMQVNTT1MjQVRFSU4jIyMKQU1PSyMjU1RFQUwjU0lQClNPTEFSQ0FMQ1VMQVRPUgpUU0UjQUxMQUgjI1BBVEUKIyMjRklYRVMjQ0FUTkFQClRBTE9OIyMjVE9OSSMjIwpPTUFSI0FDQ09VTlRBTlQKTk9URSNDSFVNUCNVVEFICklSSVMjUkVCRUwjRE9NRQpDRU5UI0VSQVNFI0VQRUU="},{"title":"6/23/04 GOVERNMENTAL","author":"by Fred Piscop, edited by Stanley Newman","date":"2004-06-23","grid":"RElSVFkjQU1PSyNBV09MCkFSSUVTI05FSEkjUEVLRQpMT0NBTEFORVNUSEVTSUEKRU5PUyNMSVQjQkFTVEVSCiMjI0VMQkUjVEFTIyMjIwpNQUlUQUkjSElHSFRBSUwKQUNDI1NOT09UIyNBTk5BClNUQVRFT0ZUSEVVTklPTgpTT05TIyNGTEVBUyNUSUMKRU5URVJLRVkjUkVHQUxFCiMjIyNPQVIjQVdSWSMjIwpJU09CQVIjRlJJI1BBU1QKRkVERVJBTFJFR0lTVEVSCkZMT0UjVEVFTiNEVU5ORQpZQVJOI1NURVQjU01PVEU="},{"title":"6/24/04 ALL IN PLACE","author":"by Bob Frank, edited by Stanley Newman","date":"2004-06-24","grid":"UEFTQSNTQ0FMUCNSQVNICkFMVU0jT1BUSUMjSVNBWQpUT1BCSUxMSU5HI0dBUlAKRU5SSUNPI1BFQUNIUElFClNFQSNFSVMjQU1BVCMjIwojIyNMSVNUI1JFU1RBUlQKQVNTRU5URUQjI1RIUk9XCkJFRUYjU01BQ0sjRUxPSQpCUkVUVCMjQkFOQ1JPRlQKQUJTT1JCUyNNRURFIyMjCiMjI05FQVQjUEVSI1NURQpGT1JCRUFSUyNCT1NUT04KQVJJQSNCT1RUT01MQU5EClpBUFMjQVBMQU4jQUxUTwpFTFNFI0FTT05FI1BMT1c="},{"title":"6/25/04 THE EX-FILES","author":"by Glickstein & Salomon, edited by Stanley Newman","date":"2004-06-25","grid":"UEFMTSNTVUVNRSNBVEFECkVMSUUjQVRSSUEjVElMRQpMSU5UI1RBSUxTI0lETEUKRkVERVhUSEVLSVRUWSMjCiNOQU9NSSMjRUxTI0lSQQojIyNSQUdHRURZQU5ORVgKT0hNI1NIRUIjI1JFR0FMCk1FQU4jVEVTVFMjWVVMRQpFTFNJRSMjRVJJQyNQTVMKR09TSERBUk5FWElUIyMjCkFUTSNJRkkjI1RBUk9UIwojI0VYVFJBQ1RIT1VTRVMKTUFERSNBVEVBTSNTQU5BCkVSSU4jTUFMVEEjVEtPUwpOQ0FBI0VTU0VOI1NBTkU="},{"title":"6/26/04 SATURDAY STUMPER","author":"by Daniel R. Stark, edited by Stanley Newman","date":"2004-06-26","grid":"S0VUQ0hVUCMjTUFJTEVECklTUkFFTEkjV0VMQ09NRQpTQ0FMSU5HI0lMTEVHQUwKU0FDI1JBTUJMRSNTSU5FCkVQSUNTI0VJREVSI0NBVApSRU5FI0lOSyNTRURBVEUKU0VHTUVOVEVEI1BJTEVECiMjI0VBU0UjT0JPTCMjIwpNRUFOVCNERU1JVEFTU0UKVUxTVEVSI1ZJTiNUVU5BClNFVCNSSVBFTiNTRU5PUgpUQVJBI1ZBTElTRSNST04KQU5JU0VFRCNDQVBTSVpFClJPREVOVFMjQUxJQVNFUwpEUkVBRFMjI05FQVRFU1Q="},{"title":"6/27/04 LETTER CARRIERS: From one familiar alphabet","author":"by Fred Piscop, edited by Stanley Newman","date":"2004-06-27","grid":"QVNQUyNQUklNQSNSRUFEUyNBUlRTCkdBSVQjU0lDRU0jSU5HT1QjTE9JTgpBRlRFUkhPVVJTI1BSSVpFVEFCTEUKUkVUUkVBVFMjQ1JFT0xFI0FCT0RFCiMjI05BVyMjQlJFTk5FUiNNQVRFUgpBQ1RPUiNDSE9BVEUjI1NLSU0jIyMKV09PIyNTUElDWSNEQU0jRU5JR01BCkFVRElPVEFQRSMjI0hPTUVHQU1FUwpDUkFOTlkjU0xSI01BUklOI05BU0EKU1RZTkUjIyNMT0NPI0FSRUEjTkFQCiMjI1NBTkRXSUNISVNMQU5EUyMjIwpCQVMjTEFSQSNLQVJUIyMjT0tBUEkKQUxMQSNUVU5BUyNBUksjUFJJTUVEClNUT1BTSUdOUyMjI09OVEhFVEFLRQpTQVBQSE8jQUtBI1BMRUFEIyNUT0EKIyMjTEVORCMjTUlMTEVSI1NQSUVMClNBTkVSI0FSQlVUVVMjI01BRSMjIwpBTUlUWSNTRUFTT04jRFJBR05FVFMKRklOQUxQSEFTRSNHUkVBVEFVTlRTCklDRVIjU0VERVIjRUVSSUUjTE9PTgpORVNUI1RSRVNTI0RBTk5ZI1RTUFM="},{"title":"6/28/04 KEEPING AFLOAT","author":"by Norma Steinberg, edited by Stanley Newman","date":"2004-06-28","grid":"R0lKT0UjQklCUyNJU0lUCkFSVUJBI0VUQUwjTUFORQpNSU5JUyNFQ1JVI0FNUFMKQVNLI0lOVEhFRFVHT1VUCiMjQk9ORVMjI0dSRUFUUwpTUE9OR0UjUElFUyMjIyMKTElOVCNERUFSI0FTSEVOClVORE8jU0FHQVMjUEVURQpHQVNQUyNSRU5FI09BUlMKIyMjI0FTUFMjRVJPREVTCkFDQ0VOVCMjU1RJTEwjIwpHQUxMRVlQUk9PRiNJU0EKQUJBVCNSRUlOI0xPTkVSClRBUk8jT1JDQSNFUkVDVApFTEFOI05FQVIjU09SVFM="},{"title":"6/29/04 HIT FOR THE CYCLE","author":"by Randall J. Hartman, edited by Stanley Newman","date":"2004-06-29","grid":"QkVEUyNMSU5LI0RBVEVECk9MSU8jT05DRSNFVk9LRQpBTEFOI1NDQU4jRklORVMKU0lOR0xFSEFOREVEIyMjClRFQVNFUyMjRU9OI1NBVAojIyMjRE9VQkxFRFVUQ0gKSE9SUyNVU08jI1NUQVRFClVIT0gjVEVYQVMjQUxPVApOQURJQSMjRVBBI0hFUkEKVFJJUExFQ1JPV04jIyMjClNBTiNTTE8jI01PT0lORwojIyNIT01FUlNJTVBTT04KUEFHRVIjUkVBTCNBU0lBCk9QRVJBI0NFTEwjTFVTVApMRU1PTiNFTEtTI1NFRVM="},{"title":"6/30/04 STICKING POINTS","author":"by Fred Piscop, edited by Stanley Newman","date":"2004-06-30","grid":"R1JBU1BTI0ZJVFMjU1RECkRJQUxVUCNPU0hBI1BPSQpTT1JPUklUWVBJTiNBQ1MKIyMjVkVSSVRZI1RBQ09TClBBUEVSRVIjI1NBVkVNRQpFUklOIyNFTEFMI09ORVMKUklDRVJTI0VMQUlORSMjClBBSyNBVEFWSVNUI0VQUwojI0xFR1VNRSNIT0xESVQKUFJFUCNOWUVUIyNJTEtBCkxPU0lORyMjSEFTQkVFTgpBU1BDQSNTRUVUSEUjIyMKVElFI0JST0tFTkFSUk9XClRFQSNPQk9FI09SSU9MRQpFUlIjQklOUyNTRUFURUQ="},{"title":"7/01/04 WINNING HANDS","author":"by Doug Peterson, edited by Stanley Newman","date":"2004-07-01","grid":"REFTSCNPQk9FI01DQ09ZCklOVEVSUlVQVCNPSEFSRQpUV09QQUlSU09GUEFOVFMKVEFPI1ZFVCMjQUlSIyMjCk9SREFJTiNOQU1FU0FLRQojIyNTT1QjRU1JUiNSSU0KSVNBTEwjVFdBUyNQRVRFClNUUkFJR0hUU0hPT1RFUgpMSU1OI0VST1MjUkVFRFkKQUxFI0FNRU4jQ0RTIyMjCk1FREZMSUVTI1JJWUFESAojIyNJT04jI1NVTiNNT0UKRkxVU0hJTkdNRUFET1dTCkFPUlRBI0JPT1RMQUNFUwpCTElTUyNDT0dTI0RPTEU="},{"title":"7/02/04 SHIRT STUFF","author":"by Merle Baker, edited by Stanley Newman","date":"2004-07-02","grid":"UE9TSCNEQU5URSNNQkFTCk9NTkkjT0xFQU4jQUxHQQpHQUlUI0JPQVJEI0pVQU4KT05USEVCVVRUT04jRU5ECiMjI09WSUQjI1JBU0NBTApZRVNNRU4jV0lTRVRPIyMKQUxJRU4jS0lURSNFTE1TCkxJRCNUT05FQVJNI0xFRQpVU0VSI0ZFTEwjSVNBQUMKIyNQVUZGRUQjU1RVUkRZCkJJT1RJQyMjQU1FTiMjIwpBTkMjUk9UQVRPUkNVRkYKU0FLRSNMQUJFTCNJU0xFCkVXRVIjT1JCSVQjVElBUwpMRVRTI1JPQU5TI1lBTVM="},{"title":"7/03/04 SATURDAY STUMPER","author":"by S.N., edited by Stanley Newman","date":"2004-07-03","grid":"Q09TVFVNRVMjQ1NIQVJQCkFMTElOT05FI0hPT1BFUgpSRUFTU09SVCNBTlRPTkUKTEFOQ0VMT1QjTkFQTEVTCkVOVEhSQUxMUyNUQU8jIwojIyMjIyMjRUFUSU5HSU4KQVNII1NIT1JUT05USU1FCkJVWVNPVVQjRVJBU0VSUwpDRURBUkNIRVNUUyNTRVQKU1RSSUNLRU4jIyMjIyMjCiMjT0xFI1JFU0lTVE9SUwpQUkZJUk0jTUFOVE9NQU4KTE9PTklFI0lOVE9OQVRFClVOSVRFUyNFWUVMSU5FUgpHQUxPU0gjU09MRUNJU1Q="},{"title":"7/04/04 FOR THE FOURTH: Celebrating America","author":"by Randolph Ross, edited by Stanley Newman","date":"2004-07-04","grid":"I1NUQUdTI0JJR0JFTiMjUkVGVVNFClFVQUlMUyNFUEFVTEVUI0VOQU1FTApVTktOT1dOU09MRElFUiNTSU5CQUQKSUJFVCMjQ0VERVMjI0laT0QjUlRFClJFVCNTVEFUUyMjTk9CSUQjU0VFUgpFTEVDVFJBIyNTVE9MRU4jSE9MRFMKU1RBUlJZI1VNUElSRVNDSE9PTCMjCiMjI0FJTSNOQVJFUyMjI09UVEFXQQojI1VOREVSU0lFR0UjUkFSRSNTRUMKTk9TRUUjSEFaRVMjQkVWRUwjVElNCk9OVVMjRElWRVMjQ0FMRUIjTUFSRQpMRUEjRFVORVMjUEFSRVIjU0VORFMKVElMI09ORUQjVUxUUkFTT1VORCMjCkVOU0lHTiMjI0tBRklSI0xJVCMjIwojI1VOSU9OU1RBVElPTiNTVEFNT1MKQkFTVEUjQ0xPU0VUIyNCRUVMSU5FCkFMUE8jQkFJWkUjI0xFT05TI0xBRApHRUUjRUFSUCMjSEVBUFMjI0FMTEEKRVhDRUxTI1VOQkVBVEVOU1RSRUFLCkxJVFRMRSNQT1JTQ0hFI1NJRVJSQQpTQVNTRVMjI05PU0hFUyNSRUFTSyM="},{"title":"7/05/04 THE GREEN STUFF","author":"by Sally R. Stein, edited by Stanley Newman","date":"2004-07-05","grid":"U1BBQ0UjSkFEQSNPQklTCkFMQlVNI0FUT1ojTEFTVApMSUJSQSNNT1JUI0lTQVkKS0VZTElNRVBJRSNWSUFMCiMjIyNMRVMjU0NJRU5DRQpTTkFHI0VCQiNTT0QjIyMKQ0FSUiNUT1JUI1VSR0VECkFTSUEjU05FRVIjQUxUTwpOQUFDUCNEQU5FI0JPTk4KIyMjRU9OI0ROQSNTV0FUClJPQ0tJRVMjSUNZIyMjIwpBQ1JFI1BFQVNIT09URVIKTUVBTCNIRUxQI1VCT0FUCkJBV0wjRVlFUiNUT1JSRQpPTkxZI1dBQ08jSEVFTFM="},{"title":"7/06/04 SMOOTH SAILING","author":"by Gail Grabowski, edited by Stanley Newman","date":"2004-07-06","grid":"SURUQUcjVU1QUyNFREVOCk5FUlZFI1BFQUwjQVJDTwpGTE9BVFBMQU5FI1RJUkUKRVRPI1JPQU4jRVlFRlVMClJBUFBFUlMjU1BFTlQjIwojIyNPQUtUUkVFUyNXV0kKQVdGVUwjI0hBUk0jT0FUCldBTFQjUE9FVFMjRk9OVApBRE8jTE9VVCMjQlVERFkKWUVXI1NQSVRGSVJFIyMjCiMjQ0xBU1MjSVNPTEFURQpUQUhJVEkjTUVOVSNXT04KSVJBTiNDT0FTVEdVQVJECk5FUkQjTElTVCNIQVJURQpUQVRBI0VMU0EjVFdFRUQ="},{"title":"7/07/04 ARCTIC NATIVES","author":"by Patrick Jordan, edited by Stanley Newman","date":"2004-07-07","grid":"RVRBTCNFTElTRSNBR1JBCk1JTUkjU0FEQVQjU1VFUwpTRUFMSVRXSVRIQUtJU1MKI0NSQU5FIyNSQU4jTkVFCkNMSUNLI0pFQU5FI0VBVApIQUwjU0NBTVAjTUVBVFMKSVNMRSNVTVAjUElFIyMjCiNQT0xBUkJFQVJDTFVCIwojIyNBUFQjUklPI1NOVUcKU0NFTkUjV09SRFMjSUNJCkhBWSNST0FSUyNQSUNLUwpPTkUjQ1VSIyNUT05ZUyMKV0FMUlVTTU9VU1RBQ0hFCkVERU4jVFVMU0EjUExPVwpEQVRBI1NQRUFSI1RFVEU="},{"title":"7/08/04 SOUNDALIKES","author":"by Fred Piscop, edited by Stanley Newman","date":"2004-07-08","grid":"U0hBUEUjQlJBVCNQQUlOCkxPUlJFI1JFQkEjQVROTwpJU0xFUk9ZQUxFI0xBRFMKVFNPUyNEQUxFI0VMTElFCiMjI1NFRU4jI0JBSUxFRApFV09LUyNUQUJBUkQjIyMKTklLSVRBI1NPUlQjU0tJCklMTFRISU5LQUJPVVRJVApERUEjRVJJRSNTRU5BVEUKIyMjU1RFQURTI0FEUkVNCkNVU1BJRCMjUEFSRSMjIwpBTlRJQyNWT0lEI1JIRUEKU1RBTiNBSVNMRVNFQVRTClRJUkUjREVMTCNIQUlUSQpTRVRTI0FET1MjQVRMQVM="},{"title":"7/09/04 THIEVERY","author":"by Merle Baker, edited by Stanley Newman","date":"2004-07-09","grid":"U1RVRCNSRVJVTiNTQUZFCkFSTkUjRVhJTEUjSUxJRQpET0lOQVBJTkNII0RPSk8KQVRGSVJTVCNFSURFVElDClRIWU1FI1ZFUlNVUyMjIwojIyMjU09JTFMjU1dFQVIKRVJJQyNBU1UjQUtJTUJPCkxPQ0gjUkFESUkjUElFRApBVEVBTVMjRU5EI0VSTEUKTUVESUEjU1JUQVMjIyMjCiMjI1JFTElTSCNPTExBUwpSQUlMU0FUI0VFUklFU1QKQUxJSSNET1VCTEVUQUtFCk5BSUYjRFVNQVMjRVZFTgpHUklUI1NUQUdFI1JFRE8="},{"title":"7/10/04 SATURDAY STUMPER","author":"by Daniel R. Stark, edited by Stanley Newman","date":"2004-07-10","grid":"UlVUVEVEI0FQUEVBU0VTCkVORVJHWSNGSUVSQ0VTVApBRE1JUkUjRkFMU0VUVE8KUEVQUEVSTUlOVCNTVEFSClBSRVNTI0FST1NFI0VURQpFQVIjU0hJTVMjQ1JFRUQKQUdBUiNJTlMjRlJJIyMjClJFU0VSVkUjVEFVTlRFRAojIyNQT0UjSE9UI0RFTU8KU0hPT1QjQ0FORVMjTFVHClRFRCNTTkFSSyNDQUxMUwpBUkVTI09STkFNRU5UQUwKTk9TRURJVkUjSU5OQVRFCkRJU1BPU0VTI1JFRUxFRApTQ0FUVEVSUyNBU1NFU1M="},{"title":"7/11/04 POTLUCK PICNIC: Who brought what","author":"by Lee Weaver, edited by Stanley Newman","date":"2004-07-11","grid":"QUdFTlRTIyNTSEFWRU4jI0FCQkUjCk1BTEFSSUEjVE9NQ0FUI0NIRUVQUwpNUlNCVVRURVJXT1JUSCNIT1RUSVAKT0JFU0UjVFJFRVMjIyNMQVlFVFRFCiMjIyMjTVVHUyMjREVHQVMjTFlPTgpNRURJQ08jT1NDQVJNQVlFUiNDTUQKT01JTk9VUyMjRU5TSUxFI0hBUkUjCkRVTkNBTkhJTkVTI1RPUlBFRE8jIwojIyNBVFRJUkUjIyMjUkVTVEFDS1MKUEFDUyNTUEFUSUFMI0VESVQjS0FUCkFDSCMjIyMjU09OQVIjIyMjI0VOQQpJUkUjVVJTQSNVTlNFQVRTI1RSRVkKREVGSU5JVEUjIyMjSVNBSUFIIyMjCiMjQk9CQkVSUyNCRU5BTkRKRVJSWQojVE9OSSNSQVRJT04jI0dMQU1PVVIKVEhZI0RJTlRZTU9PUkUjRVJFQ1RTCk9SQUwjU0xFRVAjI0FMQVMjIyMjIwpNT1JBTExZIyMjU0tJRVIjQ0lTQ08KQkFERElFI1JPTkFMRE1DRE9OQUxEClNURUVMUyNBUE9HRUUjU0FWT1JFRAojU0VOVCMjREVOU0VSIyNERU5JTVM="},{"title":"7/12/04 COMPARATIVELY SPEAKING","author":"by Gail Grabowski, edited by Stanley Newman","date":"2004-07-12","grid":"WkVCUkEjVE9BRFMjQ09CCkFHTEVUI0FQUk9OI0FSRQpHT09EVElNRUNIQVJMSUUKIyNDT05GRVIjI1BJTE9UCkFTSyMjSVJBTkkjQkVMTApQRUFSTCMjI0FERSNERUUKT1JEQUlOI0VWQURFIyMjCiNCRVRURVJCRUhBVkVEIwojIyNTSFJVQiNPTUVMRVQKU01MI0VEUyMjI1NORUVSClRBT1MjU0hBUkkjI1BSWQpBVFNFQSMjUkFESVNIIyMKQkVTVEZPT1RGT1JXQVJECkxZRSNBVURJVCNNQU5PUgpFU1MjUklERVMjQU5URVM="},{"title":"7/13/04 THOROUGHFARES","author":"by Lee Weaver, edited by Stanley Newman","date":"2004-07-13","grid":"I1NXSVNII0ZUQyNST09NCkdPQVRFRSNPUkFUSU9OUwpBUlJFQVIjUklDT0NIRVQKUFJJTVJPU0VQQVRIIyMjCkVFTFMjI0hJTE8jI0FIQQpTTFkjSU1BR0UjRE9MRUQKIyMjI0RPV05USEVST0FEClBFQVJMUyMjI0VJREVSUwpPTlRIRVNUUkVFVCMjIyMKTElNT1MjUkVERFkjQVNICkVEUyMjU0lURSMjQVNJQQojIyNCT1dMSU5HQUxMRVkKSU5GRVJJT1IjT1VUQUdFClNDQVZFTkdFI1NUT05FUwpST1NZI0VZRSNIT1NUUyM="},{"title":"7/14/04 HAT SHOP","author":"by Fred Piscop, edited by Stanley Newman","date":"2004-07-14","grid":"QlVHUyNQU1NUI0NBQklOCk9ISU8jQUNIRSNPSEFSQQpTVUxVI1RSSU0jV0FHRUQKQ0hBUlRUT1BQRVIjSU5FCiMjIyNPSUQjI1NJU1RFUgpPRkxBVEUjQkVTRVQjIyMKTExBTUEjU09SRSNFQkFOCkRFTU9MSVRJT05ERVJCWQpTQUJFI05FU1MjQUxJRU4KIyMjQkxBTUUjRlJFRUxZCkFTU0FJTCMjU1JJIyMjIwpWSUEjQkxBU1RJTkdDQVAKSU5URVIjUElFRCNST01FCkFHSVRBI0VaUkEjVVJJUwpORUVEUyNERU5ZI0JFU1Q="},{"title":"7/15/04 SUIT YOURSELF","author":"by Doug Peterson, edited by Stanley Newman","date":"2004-07-15","grid":"TE9CUyNTRUFPRiNTVU1QCkFCT1UjRU5EVUUjRUxJQQpESUFNT05ESklNQlJBRFkKREVDT0RFUlMjSVJBTklTCiMjIyNJQ1UjU05JUCMjIwpDTFVCU0FORFdJQ0hFUyMKUkFOQVQjI0pVTksjQVBCCk9aWlkjQ1JJTUUjVFJJTwpQRUkjQVJPTiMjRkVUQ0gKI1NQQURFQU5EQVJDSEVSCiMjI0RPREQjQVdFIyMjIwpPQ1RPUEkjU01BU0hVUFMKSEVBUlRCUkVBS0hPVEVMCk1PUkUjTElFR0UjR0FQRQpTU1RTI0VCU0VOI1NIRUQ="},{"title":"7/16/04 JUST DESSERTS","author":"by A.J. Santora, edited by Stanley Newman","date":"2004-07-16","grid":"RklERSNDQVBFRCNBQ1JFCkVST1MjQUdJTEUjU0xJTQpUT1VUI1ZFWEVTI1BBTE0KRU5HI1BJRUlOVEhFU0tZCiNTSEVMTCNFQVJBQ0hFUwpOSU5OWSMjIyNPVFQjIyMKRURVQyNBWUVBWUUjSk9FClZFVCNDUlVMTEVSI0VQQQpFU1MjUkVMSUVEI0FMUFMKIyMjQkFBIyMjI0FMTE9ZCkFEVkFOQ0VTI1NXQVlTIwpQSUVDRU9GQ0FLRSNSRUYKSEFSSyNEUk9ORSNUT0RPCklOR0UjRUVSSUUjQUxUTwpERUVEI1NNRUxUI0JMT1Q="},{"title":"7/17/04 SATURDAY STUMPER","author":"by Anna Stiga, edited by Stanley Newman","date":"2004-07-17","grid":"R09EU0VORCNQTEFTVElDCkVDVUFET1IjUk9CRVJUTwpNQVNURVJZI0VOQ0xBU1AKSU5URVIjSE9UI1NFR0FMCk5BQlMjTk9ERVMjU0VMQQpJREkjU0lMRU5UUyNESU4KU0FOVEFGRSNERUxBWUVECiMjI09VVCMjI1BBUiMjIwpGUkFOQ0lTI0NPTkNFUFQKUkVEI1lFTExJTkcjTVJJCkFMVkEjU0lFVkUjTUlFTgpQSUFOTyNNVFYjTUFUQ0gKUEFOR1JBTSNJTkVSVElBCkVOQ0xBVkUjRUFTSUVTVApTVEVFTEVSI1NQSEVSRVM="},{"title":"7/18/04 KEEP COOL: Featuring some air-conditioned clues","author":"by Fred Piscop, edited by Stanley Newman","date":"2004-07-18","grid":"TUFDRUQjU1lOQyNHT0lOIyNFQkJTClBIT05PI0FNT1IjT1JORSNTVFJBUApIQUxMT0ZGQU1FI1RBS0VJVEVBU1kKIyMjSURMRSMjV0hJVFMjTUVSR0VTCkJST1MjT1JESU5BVEUjQUxBTiMjIwpSQUZURVIjT05FUyMjVFJBREVHQVAKT0ZGI01BU1NBQ0hVU0VUVFMjRU1JCldBSUxTI0hBTksjTklYSUUjQ09JTgpTRUNZI0xPR0UjTUlEQVMjRkFSQ0UKRUxFQ1RJVkUjUEFURU4jQkFOR0VSCiMjR0VPREUjV0FMRVMjQ0FTVEUjIwpTUE9VVFMjQkFSRUQjR0VUVEFCTEUKUElTTU8jQUlERVMjVEVMRSNURUFMCkxBU1MjRU1ERU4jUEFSRSNSQU5HRQpBTkkjSU1QRVJUVVJCQUJMRSNTVVYKVE9QU09JTFMjI1BPT1IjQU5UT05FCiMjI0VER0UjVFJJUE9EQUwjT05BTgpBTFRBSVIjQ0hJTk8jI0xBSVIjIyMKUEFVTE5FV01BTiNTVFJBV0JFUlJZCkFMQkVFI1BPTkcjQUtJTSNFUklDQQpST0FSIyNBTlRTI0xPR08jVE9EQVk="},{"title":"7/19/04 CONTINENTAL BREAKFAST","author":"by Sally R. Stein, edited by Stanley Newman","date":"2004-07-19","grid":"TVVTUyNQUk9QI0JBQkVTCkFTQVAjQU9ORSNVU0FHRQpST0xFI1NUSVIjVEhST1cKU1BBTklTSE9NRUxFVCMjCkhFUkRTIyNOSUNFI0xFVApBTlkjU1VQI1RPUlBFRE8KIyMjQ1VSSU8jIyNPVFRPCiMjRlJFTkNIVE9BU1QjIwpTSE9PIyMjTU9PUkUjIyMKTEVPUEFSRCNZT1UjQVJUCk9QVCNUVVJGIyNCQUxFUgojI0JFTEdJQU5XQUZGTEUKQ0xBUkEjTkNBQSNJUk9OCkRFTElTI0tFUFQjUkVBRApJTkxFVCNTVEFUI0VERFk="},{"title":"7/20/04 SOCIAL SETTINGS","author":"by Gail Grabowski, edited by Stanley Newman","date":"2004-07-20","grid":"TUFSRVMjQ0FOT0UjSU5TCk9CRVlTI0FSRU5BI1NJVApDRU1FTlRNSVhFUiNMRUUKU1RFVyNSRVNUUyNGQUNFCiNTVEFUVVJFI0xJT05FTAojIyNTRUVBI1RJUkVEIyMKTU9DSEEjI05JQ0UjSEFNCkVBVSNDSEFOTkVMI09XRQpHUlIjQUlERSMjQVNQRU4KIyNWRVJHRSNCT05BIyMjClNMRVVUSCNHUkFEVUFMIwpORUJSI1NUT0FUI1NVRVMKQVZBI1NFQVJDSFBBUlRZCkdJTCNSQU5HRSNBR0FJTgpTTkwjQVNLRUQjTkVTVFM="},{"title":"7/21/04 PARTING WORDS","author":"by Robert H. Wolfe, edited by Stanley Newman","date":"2004-07-21","grid":"U0hBRlQjUEFDVCNQT01QCk5PVkFFI1JJTEUjRVJJRQpPUEVSQSNPRE9SI0xFTkEKQklTRUNUI0FVUkVWT0lSCiMjI1dIT0EjVEFYSSMjIwpUQU1FI0FSUCMjVFNBUlMKQUJFTCNUT0lMRVIjV0FZClRJTExXRU1FRVRBR0FJTgpBRE8jSEVBUlRII09SU08KUkVORUUjI1NPTiNERUVECiMjI0xFRVMjTklQUyMjIwpUT09ETEVPTyNDT1BQRVIKUkFURSNSVUlOI1NFQUxZCklSSVMjSVNMRSNTRU5TRQpQU1NUI0VBU1QjRURHRVM="},{"title":"7/22/04 GAMESTERS' WOES","author":"by Fred Piscop, edited by Stanley Newman","date":"2004-07-22","grid":"UFJJREUjQUJCRVMjRlVSClNPTE9TI1JFRVZFI0FOQQpTUExJVFNDUkVFTiNVU04KVEVTVEFNRU5UI1NPTEVECiMjIyNURUQjI1BBU1RSWQpMRVNTRUUjU0hPVFVQIyMKSU5DQVMjV0hPTEUjTEFNCk1PUlQjV0hBTEUjUkFWSQpBU0EjVEhFUkUjU09OSUMKIyNUQUhJVEkjVEhJRVZFCkVTQ0hFUiMjRk9FIyMjIwpCQUhBSSNCQVJOQUNMRVMKU1VQI1NMSUNFT0ZMSU1FCkVUQSNUT0xFVCNFQVRJTgpORUQjU0xFRFMjRFdFTFQ="},{"title":"7/23/04 PLAY-ON WORDS","author":"by Merle Baker, edited by Stanley Newman","date":"2004-07-23","grid":"U1RVQiNUQVBFI09BU1RTClRPUk8jSVRJTiNFUENPVApPUkFOI0VNVFMjVVNBR0UKSVNMRSNSRUNVUlZFQk9XCkNPU1RBUiNIRUFSIyMjIwojIyNPTUFOSSNCRURFQ0sKQURFUFQjQU5USSNFTE9JClRSVUlTTVMjT05SQU1QUwpNQVJDI0VUQUwjQUxPRVMKU01PS0VEI0NMT1VUIyMjCiMjIyNTRUFUI0NMQU1VUApTS0lQU0FCRUFUI0JPWk8KQ0FMTEEjSURMRSNMT0JTCkFMTE9ZI0RPSVQjT0xFUwpORVNUUyNFTkRTI1dBS0U="},{"title":"7/24/04 SATURDAY STUMPER","author":"by Daniel R. Stark, edited by Stanley Newman","date":"2004-07-24","grid":"Q0hBUklTTUEjRVJSQVRBClJFTEFUSU9OI1JFVUJFTgpFTEVDVFJPTiNBVUJVUk4KV0VSRSNTTE9HI1BFRFJPCkVOVFJZI0FZQUhTI0hBVApMQVNTT1MjRVZFI05BUEEKIyMjI0xFQURFUiNPQklUClNLVUxLRUQjSU1BR0lORQpNQU5FI0tJRE5FWSMjIyMKT0xJTyNFRU8jU0VSSUFMCk9BRiNHUlVOVCNTVU1NQQpUSE9TRSNTQVJBI1NQVVIKSEFSS0VEI1RFTExUQUxFCkVSTUlORSNFTlRBSUxFRApESVNNQUwjU1RBQ0NBVE8="},{"title":"7/25/04 BOGUS BIOPIX: Whom certain films aren't about","author":"by Robert H. Wolfe, edited by Stanley Newman","date":"2004-07-25","grid":"SkVUU09OI1NXSUZUIyNJVEUjSU1BCk9OSElSRSNDRURBUlMjU0hSSU5FUwpLRUVOQU4jQURBWUFUVEhFUkFDRVMKRVJBI0xBREQjUkVTRUUjTUlOVVRFCkRPRkYjI0lTTEUjSEVMRElOI1NTUwojI1JVUkFMI0VTVEVSI0VSR1MjIyMKQUJJTEVORSNBQUhTI1RXQSNFQ1JVClJFQ0xBSU0jUllFI1RBTEMjTU9PUwpJREEjI0dNQU4jQlJJREFMI0lNUFMKIyNOQVRIQU4jUElPTiNQRVBQSUVSCiNTUVVBVCNTVElHTUFTI1dBUk5TIwpKT1VSTkFMI0VMU0UjUFJPTE9HIyMKT0xFTyNUQVNTRUwjQkFFUiMjVEVFCkVWRVIjVFJJUyNFVEEjU0tJUE9MRQpMRU5BI0hHVCNHRU9TI1RFTExBTEwKIyMjRVBFRSNUT1BQUyNBUk9PTSMjCkJVUyNMT1NFSVQjQk9BUiMjREVOVApBTlRFVVAjQVJPQVIjUlRFUyNSQUgKVEhFR1JFQVRFU0NBUEUjUkVWSVZFCkhBTkdBUlMjU0VUU09OI1NMSUNFUwpFVE8jTEFQIyNBU1NFVCNUQU1BTEU="},{"title":"7/26/04 GOING SOLO","author":"by Gail Grabowski, edited by Stanley Newman","date":"2004-07-26","gr