{"id":"newsday-2009","publication":"newsday","year":"2009","count":365,"puzzles":[{"title":"1/01/09 NO WAY","author":"by Richard Silvestri, edited by Stanley Newman","date":"2009-01-01","grid":"Q1JBQiNMWVJBI1NLQVRFClBPU0UjTEVBUiNFTExJUwpST1RFI0JBSkEjUVVBTlQKI0ZPUkdFVEFCT1VUSVQjCiMjIyNMQVMjI1BJRSMjIwpDQVJFRU4jVFdJTiNGQUEKRVZJVEEjU0hJTiNET0dTCkRPTlRNQUtFTUVMQVVHSApBSURFI0xJTVAjQU5OSUUKUkRTI0JJVEUjU1BBREVTCiMjI0FMRSMjRkVFIyMjIwojTk9UT05ZT1VSTElGRSMKQkVMT1cjT01OSSNSQVpFCklSRU5FI1JBR0UjT0tSQQpCT09FUiNFTk9TI05FQVQ="},{"title":"1/02/09 OUT OF ORDER","author":"by Shirley Soloway, edited by Stanley Newman","date":"2009-01-02","grid":"U0hBUlAjUkFaWiNNQVNLClNBTU9BI0FMT0UjQVNIWQpUSEVESUNUSU9OQVJZSVMKU0FORVNUIyNNT0xJRVJFCiMjIyNBUkNTIyNJTlRFUgpUSEVPTkxZUExBQ0UjIyMKT1VURE8jQ0VBU0UjR0lTCk9OQ0UjU0xBTVMjUE9SSwpOVEgjVEhFUkUjU0lOQUkKIyMjV0hFUkVTVUNDRVNTClJBRElJIyNEQVNIIyMjIwpFREFTTkVSIyNTTEVER0UKQ09NRVNCRUZPUkVXT1JLCk9SRVMjQkFCRSNQQVJFRQpORVNUI1NMSUQjU05BR1M="},{"title":"1/03/09 SATURDAY STUMPER","author":"by S.N., edited by Stanley Newman","date":"2009-01-03","grid":"RE9STUFOVCNQUkVMQUNZCklIRUFSWUEjSEFCSVRVRQpTUEVDVEVSI0VOQU1PUlMKQUxMT1kjSEFORFlBTkRZClNFRU4jU0VOT1IjQkFMRQpUQUMjU1RFQU0jU0VMRVMKRVNUI0hBTFQjQ1BBIyMjClJFU09SVFMjR0FJTlNPTgojIyNORUUjVE9SVCNJVlkKRlRPUkQjQVJOQVojQkVHCkFITUUjQ0xFQVQjUEVSSQpLRUVQUVVJRVQjQ0FSTEEKRU5ST1VURSNJUkFOSUFOClJFVFJBSU4jVkVSREFOVApTVEFUSU5TI0VYUEFORFM="},{"title":"1/04/09 RAGS TO RICHES: A quote from a two-Oscar actor","author":"by Shirley Soloway, edited by Stanley Newman","date":"2009-01-04","grid":"I1RBRlQjU0NSQU0jTElBUiNBSEFCCkJBTkpPI1RIQU5FI09TTE8jREFNRQpBQ1RPTiNSSUdJRCNWU09QI0RSQUcKVEhFUkVXQVNBVElNRVdIRU4jRE5BCiMjI0RSQVBFI0FHQSNFQVRJTkdBVApTUEEjI0dJTEEjQUxPRSNPTkUjIyMKTE9OR1RPTiNNWVBBTlRTV0VSRVNPCkFTVEVSTiNST0kjR09PUCNWT1RFUgpUSElOSSMjQVJFTkEjTk9QRSNIVVQKIyMjRVBBI0dBTEEjIyNPU0hLT1NICk9NQVIjQ09VTERTSVRPTkEjRVNTTwpISUJBQ0hJIyMjQVJBTSNUQU4jIyMKR0FSI0hFTE0jQkxBUkUjI0hZQVRUCk9NQU5JI0VBUkwjTklOI1NNQVJNWQpESU1FQU5ES05PV0lGI1NQRU5DRVIKIyMjTk5FI0VTVEEjRlJFRSMjU05PCkJJUkVUVEFTI0NWUyNFQ0FTSCMjIwpBWEUjSVRXQVNIRUFEU09SVEFJTFMKU05VQiNMT0JPI09OSU9OI0FJTUFUCkVBU0UjRUtFRCNGVE9SRCNUUkFDWQpEWUVEI1NFVFMjRkFTVFMjRVlDSyM="},{"title":"1/05/09 NOT RIGHT NOW","author":"by Gail Grabowski, edited by Stanley Newman","date":"2009-01-05","grid":"QVBQTEUjU0FORCNTVEFHCkNSRUVQI09MRU8jSEFMTApIT0xESVRET1dOI0VMU0UKRU1UI1NFQVQjVEVMTE9OCiMjI1RPTlMjRUxFViMjIwpBUkNBREUjQk9JTEVSUyMKU09SQkVUI09ORSNCSUFTCk9QQUwjI1NPUyMjT0ZGUwpGRVRFI0dFTSNTVE9MRU4KI1NFQ1JFVFMjSElLRVJTCiMjI0xFVFMjUEVDUyMjIwpEUk9PUFMjV0VFSyNBTUEKUkFOVCNXQUlUUEVSU09OCkFSQ0gjRUFTVCNUQUlOVApURUVTI1RIRVkjU05BS0U="},{"title":"1/06/09 RESOLUTIONS","author":"by Sally R. Stein, edited by Stanley Newman","date":"2009-01-06","grid":"U1BBUyNTQVNII1NUUkFQCkVBU1QjVElMRSNQUklDRQpBUklBI0FSRUEjUkVORVcKTEVBUk5ORVdUSElOR1MjCiMjIyNPREQjI0VORCMjIwpBRExJQlMjU0FMVCNDQUIKQ1JBVkUjSFVMTCNIT0JPClRBS0VUSU1FVE9SRUxBWApPV0VTI0RPRE8jRVJBU0UKUk5TI0VMU0UjRlVTU0VTCiMjI0FMRSMjWUVTIyMjIwojTE9TRVNPTUVXRUlHSFQKSElHSEMjUEFMRSNPUkVPCklOTEVUI0FNUFMjV09FUwpURUVOUyNMQVNUI0FXTFM="},{"title":"1/07/09 SAVING TIME","author":"by Fred Piscop, edited by Stanley Newman","date":"2009-01-07","grid":"V09SRSNJTExTI1dBVEVSCkVMQUwjU09PVCNBUkVOQQpFTElFI1NPRkEjTElORFkKRElTQ09VTlRSQVRFIyMjClNFRVRIRSMjI0NPTExBUgojIyMjQVJNI1RJTiNJQ1UKQU1CRVIjQU1JRCNBVklTCkJBUkdBSU5CQVNFTUVOVApBR09HI05FQVIjVEFOR1kKU05PI0xURCNBU0gjIyMjCkhBTU1FUiMjI1RJRVRBQwojIyNFQ09OT01ZQ0xBU1MKQVBBUlQjQUJFTCNWU09QCkJJTkdFI1BFUlUjRVROQQpTRURFUiNFWUVTI1NFRU4="},{"title":"1/08/09 WHAT A MESS","author":"by Kevin Donovan, edited by Stanley Newman","date":"2009-01-08","grid":"U1BFQyNTVElFUyNJTVBTClRBUkEjQ09ORE8jTkVSTwpVUklTI09VVEVSI1RST0QKQ0xFQU5VUE9ORVNBQ1QjCkNPUCNJUkUjI1JJQ0hFUwpPUkFORyNFTE0jU1RBR0UKIyMjT0hPI0FBQSMjTkVUCiNEVVNURk9SUFJJTlRTIwpXT04jI0ZJRyNGUk8jIyMKSE9MU1QjTEVUI0FURVVQCk9SQVRFUyMjUkFUI0ROQQojU1dFRVBUSEVTRVJJRVMKRklGRSNBUkFCUyNFVEFTCkJMVVIjVElUTEUjRE9TRQpJTExTI0VQRUVTI09SRVM="},{"title":"1/09/09 GOOD RIDDANCE","author":"by Shirley Soloway, edited by Stanley Newman","date":"2009-01-09","grid":"Q0FQUCNURU5BTSNWU09QCkFSRUEjQUxJQkkjQUNNRQpQSVRDSEJMQUNLI0dSQVMKVEFUVE9PIyNTQUdVQVJPClNMWSNCT1NOI0RFRVAjIwojIyNDQVNUSVJPTiNCQkIKRUxERVIjQUNFUyNQT0xPCkJVUk5UI0xFUyNTSU9VWApBTE9UI0NFREUjT05LRVkKWVVQI1RIUk9XUlVHIyMjCiMjQ0FTQSNHTkFUI0FWRwpTT0xWRU5UIyNORVdCSUUKV0hPQSNDSFVDS1JPQVNUCkFOVEkjRVJST0wjT1RUTwpLT0hMI1NVSVRFI0RFQU4="},{"title":"1/10/09 SATURDAY STUMPER","author":"by Daniel R. Stark, edited by Stanley Newman","date":"2009-01-10","grid":"QkFMTEFTVCNQUkFOQ0VSCkVMRUFOT1IjUkVNT1JTRQpOSUFHQVJBI0VYRUNVVEUKSEFOUyNSSU9UI05BU0FMClVTRSNTWUxWQU4jTEFURQpSRVNFVCNTRVBJQSNERUMKI1NUQUlEI05FRURJRVNUCiMjI1NURVAjU0NVRCMjIwpESVJFQ1RPUiNFTExFUyMKQVRFI0hFTEVOI1RFTkVUClBFVFMjUklERVJTI0VHTwpQUklNTyNUT1RPI0VNTUEKTEFSQU1JRSNUT0RESUVTCkVURVJOQUwjRU1JTkVOVApERVNUSU5ZI0RZTkFTVFk="},{"title":"1/11/09 WHO'S ON THE MENU?: You'll find out shortly","author":"by Fred Piscop, edited by Stanley Newman","date":"2009-01-11","grid":"UkVERCNSQUlMUyNVUkFMI0xFV0lTCkFSSUEjRVJOSUUjTk9TRSNBTEVORQpKQUNLQ0hFRVNFI0pPSE5OWUNBS0UKQVNUT1JJQSNBRFJBVEUjT0xJVkVSCkhFQVRFUiMjI0xBTVMjR1JBREVSUwojIyNBV0VTI1JFRyMjQ0FNIyMjIyMKSUZTIyMjQ0FFU0FSU0FMQUQjQkFNCk5PTFRFI0FTSVMjRU1NQSNPUEVSQQpTUE9PUiNMVEQjQVJJRVMjRFJFREQKIyNQT1JLRVIjSU5BVCMjUk9PRkVECiNMUFMjR1JPVU5EQ0hVQ0sjVVBOIwpNQVlPUlMjI1NBUksjUkhPTkRBIyMKQU5KT1UjU1BBREUjQUJVI1VMVFJBCklDT05TI1RPR0EjR1JBTiNCWVRFUwpORUUjVFVSS0VZRlJBTksjIyNZQUsKIyMjIyNQQVkjI0xBQiNTSUxPIyMjCkNBUEVSRUQjQ0FFTiMjI1RJR0VSUwpJQ0VNQU4jRkFSQURTI1NDQUxMT1AKU1RFQUtESUFORSNQRUFDSE1FTEJBCkNVVElFI1NUQU4jQUxHQUUjUklPVApPUEVMUyNQRUxUI1NMT1RTI1NFVFM="},{"title":"1/12/09 ENVELOPE, PLEASE","author":"by Gail Grabowski, edited by Stanley Newman","date":"2009-01-12","grid":"TUFTVFMjQ1BBUyNTVEVNCkFXQUlUI0FBUlAjVElSRQpOQU1FQVBSSUNFI1JFSU4KRVlFI1JFQUwjTEVFUkVECiMjI1NMQVQjU0xPRSMjIwpSVVNUSUMjU0NFTlRFRCMKRVNUQVRFI1RBRCNTTEFQClNVRVQjI1RFTiMjTU9SRQpUUkVFI1BFQSNBREFQVFMKI1BST0dSQU0jRElSRVNUCiMjI0ZPRVMjTEFTVCMjIwpQUk9NUFQjU0FTSCNIQVQKQVVESSNaSVBUSFJPVUdICklTT04jRURJVCNBV0dFRQpORVJEI0xPTkUjR0VFU0U="},{"title":"1/13/09 HAVE A MICE DAY","author":"by Sally R. Stein, edited by Stanley Newman","date":"2009-01-13","grid":"QU1QUyNBVklEI1NUQVIjClNJTE8jQk9ERSNUVUJBUwpBTk9OI1JURVMjUFJJWkUKUElQU1FVRUFLI0VORE9XCiMjIyNVUFMjI1NURUVSUwpTUElSSVQjU1BJRUQjIyMKQ0FSQVQjQ0FSVCNUT0RPCkFMT1QjUElYSUUjQUdFRApURU5UI0lURU0jV0lSRUQKIyMjTElORVMjT0lMRVJTCkFDQ0VERSMjQU5UIyMjIwpUT1JURSNCSUdDSEVFU0UKT1BFUkEjQVNJQSNBQkVMClBFREFMI1NFTEwjQ0FOUwojU09QUyNLRUVMI0hZREU="},{"title":"1/14/09 STEP TO THE REAR","author":"by Fred Piscop, edited by Stanley Newman","date":"2009-01-14","grid":"U01JTEUjRVBFRSNUQVRFCkNBTk9OI0RBVlkjQVZJRApBUlRTREVHUkVFI1BJRUQKVEFSI0lWRVMjRFJFU1NZClNUQVJWRVMjQlJBTSMjIwojIyNPRVIjU0xPV0VEVVAKQ1JPQ1MjQ0xBUCNBVVJBClJBTksjU0xVUlMjU0VHQQpBQ01FI0hBUkUjQ1VURVIKQkVFVFNPVVAjQkFSIyMjCiMjI1NVVlMjU0VMRUNUUwpTRVRURUUjU0xBWSNIQVcKQVJJQSNMVU5BUlBIQVNFClJJTkcjRU1JVCNTQU5UQQpBTlRFI0RBVEUjT1RURVI="},{"title":"1/15/09 ANIMALISTIC","author":"by David W. Cromer, edited by Stanley Newman","date":"2009-01-15","grid":"Qk9TQyNNQVNTI1RSVU1QCkFIT1kjSVJJUyNISVJFUgpDQVJCI0xFR0FMRUFHTEUKT1JFTyNLQU4jT0JTRVNTCk5BUlJPVyMjSEFMIyMjIwojIyNHUkVBU0VNT05LRVkKQUZUI1NFVkVSI0JBTkRPCkNPSU4jREVMRVMjR09ORwpESVZPVCNSQVRUWSNCQUEKQ0xPVEhFU0hPUlNFIyMjCiMjIyNSVEUjI0FMTFVSRQpJTkFTRUMjTElEI1BST1MKTUVESUFIT1VORCNBQkNTCkFNRU5EI0hBSUwjU0FLRQpDT05LUyNNVVRFI09OWVg="},{"title":"1/16/09 NOT FOR BREAKFAST","author":"by Doug Peterson, edited by Stanley Newman","date":"2009-01-16","grid":"QUdJTiNBTVBMRVIjUEFUClRPRlUjR0FMQVhZI1VaSQpCRUVUTEVKVUlDRSNQVUcKQVJFU08jI01SSSNFSVJFCllTTCNNUEFBI1RFTExFUgojI0ZBQkVSR0VFR0cjIyMKRkFJTCNBTUVYI0FSR1VFCkNBTkFTVEEjVU5ERVJHTwpDSEVTVCNOQVJDI0NBSE4KIyMjS0VWSU5CQUNPTiMjCk9UVEFXQSNUU0FSI1VQQQpSRUlOI1JPSSMjQUZMQUMKQVhFI01JTFFVRVRPQVNUClRBVSNCRUFVVFMjT1RUTwpFU1AjQURGRUVTI0RFRVI="},{"title":"1/17/09 SATURDAY STUMPER","author":"by Merle Baker, edited by Stanley Newman","date":"2009-01-17","grid":"Uk9TRVRUQSNTQ09MREVECkFaQUxFQVMjQVRQRUFDRQpHT0xGRU5USFVTSUFTVFMKRU5WI1NUT0lDI0FESE9DClNFRVRIRSNURVNURUUjIwojIyNSSVNLUyNWRU5ERUUKU05FRVIjQVRNRSMjT01TCkNPTUVUT1RISU5LT0ZJVApMQVAjI0RPRVMjQUxGUkUKQ0hBQ0hJI1NDQUxEIyMjCiMjVE9FQ0FQI0NBU1RFUwpFVEhJQyNOT1RDSCNBUkkKQ0hJTktJTlRIRUFSTU9SCkdBWkVMTEUjVVBSQUlTRQpTVEVSRU9TI1NUSUZMRUQ="},{"title":"1/18/09 HEARD FROM THE HERD: Pasturized wordplay","author":"by Randolph Ross, edited by Stanley Newman","date":"2009-01-18","grid":"U1BBR0hFVFRJIyNSQVZFRCNSSU9UCkVSTklFRk9SRCNBSVJJRVIjT05OTwpNT09MQVJSWUFORENVUkxZI1BTQVMKUFBEI1JFU1QjQURBR0UjI0xFVFVTClJVRUQjTU9PVFJJTiNPU0NVTEFURQpFUFNPTSMjI1NBQyNBU0lBTUlOT1IKIyMjTU9PVklFU1RBUiNTUEVOVCMjCkRJTSNBTUFIIyNTQ0FSI0VORU1ZIwpBUk9PI0VOT0NII0hNT1MjI1NPVVIKTU9PQklMRVBIT05FI0JFT1IjT0xFCklORElDRVMjQVRFU1QjRU5DQVNFUwpBU1UjSVRTQSNNT09IQU1NQURBTEkKTk9TRSMjQVhMRSNOVVJTRSNFR09OCiNOT0NBTCNMT0FOIyNMVERTI0VHRwojI1BPTElTI1NMT1dNT09TSUMjIyMKU0tFTEVUT05TI0NSSSMjI1BBTE1TCkNPUk9OQURPI01PT1pBUlQjTE9FVwpPU0FHRSMjQlJBVU4jVk9PTSNVTEEKTE9OSSNNT09WSU5HVklPTEFUSU9OCkRWRFMjQ0FERU5UI01BS0VIQVNURQpTT0lUI0xUWVJTIyNJTlNUSUdBVEU="},{"title":"1/19/09 HUE DOWNS","author":"by Sally R. Stein, edited by Stanley Newman","date":"2009-01-19","grid":"QUhPWSNDQUJMRSNHTEVOClNBVkUjQUJMRVIjUkVETwpPUkFMI1JPVUdFI0VER0UKRkVMTCNBREVTI1JFR0FMCiMjI09BVEVSI01JTkVSUwpQUkFXTlMjSU1BR0UjIyMKTE9CQlkjQUJFVCNHUkFECk9WRVIjVFVCQVMjR0FURQpERUxJI0lST04jQVNJQU4KIyMjQ1NQQU4jU1RBTkRTClNQT0tFUyNQRUNBTiMjIwpDT1VSVCNTQUxFI0RST1AKQUxUTyNSQU5PTiNIT1BFCk5BREEjSU5FUFQjQUxBUwpUUk9EI09HTEVTI01FTFQ="},{"title":"1/20/09 ON THE ROOF","author":"by Gail Grabowski, edited by Stanley Newman","date":"2009-01-20","grid":"U0NBUiNBQk9ERSMjQ1BSCk9MREUjU0VBUlMjT0xFTwpMRUFGI1NJVEFUI0NBU1QKRE9NRUxJR0hUI1BBUlRTCiMjI1JJU0VTI1RBTEsjIwpERUZFQVQjI01BTkFHRVMKUkFSRVIjU0NBTEUjQVJNCklHTyMjTU9PU0UjI0JSQQpFTE0jQ0FSVFMjVkFMT1IKU0VUUkFURSMjREVTRVJUCiMjSEFSRSNBTEVSVCMjIwpQRUVWRSNGTEFUQlJPS0UKQUNIRSNBTElORSNJUkVECkNISU4jUk9CRVMjREVFRApUT1AjI1RXSVNUI0VTUFk="},{"title":"1/21/09 ON THE ROOF","author":"by Fred Piscop, edited by Stanley Newman","date":"2009-01-21","grid":"R0xJQiNDT0FUI0xPTUFOClJFTk8jQUNIWSNFTE9QRQpBTUVOI1NURVAjQURPUFQKVE9QT1RIRU1PUk5JTiMjCkFOVCNXRVQjI0FURVNUUwojIyNTRVcjQk9aTyNIT1QKU0hFQVIjR09UTyNWSVNFClBFQUtQRVJGT1JNQU5DRQpFTFNFI0ZJRkUjT05FQUwKQUxUI0FSTk8jRFVFIyMjClJPQURJRSMjU0lTI1ZJQQojI1NVTU1JVE1FRVRJTkcKR0FJTlMjU1VFUyNIT1VSCkFNQU5BI0FCTEUjRUxJRQpQSU5PVCNZQUxMI01BVEU="},{"title":"1/22/09 IN THE BALLPARK","author":"by Norma Steinberg, edited by Stanley Newman","date":"2009-01-22","grid":"QVBFI01FU0FTI0FSSUVTClRPWSNBTUlTSCNMSU5HTwpDTEVBTlVQUE9TSVRJT04KT0xMSUUjIyNXSEVBVCMjClNFRUQjQkFETUVOI0lCTQpUTlQjTk9TRUUjI0FBQUEKIyMjQ0FOT0UjU0lTVEVSCiNSRUxJRUZQSVRDSEVSIwpQSVhFTFMjRkxBS1kjIyMKT0xFTyMjQlJJTlkjREFNCkRFTSNQTEFZRUQjRElWQQojI1BMQUlOIyMjU09MQVIKSU5URU5USU9OQUxXQUxLClJFRVZFI1NMSUNFI1RPRQpBRERJUyNIRVhFRCNFTkQ="},{"title":"1/23/09 VOCALIZE","author":"by Richard Silvestri, edited by Stanley Newman","date":"2009-01-23","grid":"QVdMUyNUSEFOI0lSSVNICkdBT0wjUklQRSNOQUNITwpBWUNBUkFNQkEjVFlMRVIKU05BS0VEI1NUTE8jQURBCiNFTEVWRU4jSElORFUjIwojIyNTRVJGUyNTRUVERUQKQUNFI0FTTEFOVCNMSU1FClJPWUFMI0VUQSNQTFVNRQpJVkVTI0NSVURFUiNTQVAKREVTSVJFI1BJTEVEIyMjCiMjSEFVTlQjUkVQRUxTIwpWSUEjU1RPUCNWQUNBVEUKQU5ERVMjQVlFQVlFU0lSClNUT0xFI0RSQVQjSVNOVApUT1dJVCNZT1JFI1RPVEU="},{"title":"1/24/09 SATURDAY STUMPER","author":"by Doug Peterson, edited by Stanley Newman","date":"2009-01-24","grid":"SkVCU1RVQVJUIyNTTVVHCkFWQUxBTkNIRSNTSE9SRQpQSUxFRElUT04jSEFORFMKRUFTRVMjT0RETUFOT1VUClNOQVAjRE5BVFVSQUwjIwojIyNJU0VFI09SSU5PQ08KRElETk9UI0lCTSNBR0FSCkFCRSNQUk9URVVTI1VTRQpWRUVSI0lWUyNSSVNFVE8KRVhQSUFURSNHRU5BIyMjCiMjU1BMVVJHRUQjTFBHQQpDQVBQSVNUT0wjRklMRVQKQ0hBTEsjSU1BTExFQVJTCkVNQ0VFI01FVEVPUklURQpERUVEIyNFWklPUElOWkE="},{"title":"1/25/09 GIMME A BREAK: Nine breaks, actually","author":"by Merle Baker, edited by Stanley Newman","date":"2009-01-25","grid":"U1BJR09UI1VQT04jUE9UUyNBR1RTCkNPTUVUTyNOQU1FI0FQQVQjUFJFWQpIRUFSVE9GVEhFTUFUVEVSI1RPUk4KIyMjTU9MQVIjTk9VUkkjQVRUVU5FClBPVEFTU0lVTSMjTE9DQVRJT04jIwpBQ0FOIyNSRUNPUkRMQUJFTCNEQkwKU1RSSUNUIyNDUFUjU0xBRyNPQkVZCkNJUkNVSVRDT1VSVCMjQ09TU0VUUwpBTEUjQlJBRFlTI0hBTksjVElFVE8KTEVEUyNBUFIjI01FUkUjRkFSRkVMCiMjI0NPREVPRkhBTU1VUkFCSSMjIwpJTUJSVUUjTUVFVCMjUk9JI1NUT1AKREFSRVMjWVNFUiNCRUFUVFkjQVJBClRIRUFUUkUjI1NQRUxMQ0hFQ0tFUgpBUkFNI0VORFMjRU5WIyNTUElFTFMKR0VEI0RBVEVBTkRUSU1FIyNNSVNFCiMjRk9SREFCTEUjI1NJTVVMQVRFUwpCT1JHSUEjVEFIT0UjS0lORVIjIyMKUkFVTCNQUk9NSVNFTUFSR0FSSU5FCk9LSUUjVE9SSSNTTEVEI0VWT0tFUwpTU1RTI1NFU1MjT1NMTyNSRU5FR0U="},{"title":"1/26/09 SAVING FACE","author":"by Billie Truitt, edited by Stanley Newman","date":"2009-01-26","grid":"U0FMQUQjU09SVCNXSURFCk5FQVRPI1RIRUUjRURFTgpPUklPTiNBTkRTI0JBQkUKV09SRE9GTU9VVEgjSFVNCiMjI0RST1AjR0VPTE9HWQpBU1BTI1JFRCNETkEjIyMKQVdFI09HUkUjI09XTlRPCkhBU0FOT1NFRk9STkVXUwpTUE9UUyMjRE9OUyNPSUwKIyMjTUFEI1NVRSNVTlRPClNDSE9MQVIjUkFTUCMjIwpUT1kjRVlFQ0FUQ0hJTkcKQVJFQSNCTE9DI1JJU0VSCkZBTlMjRUFWRSNVTFRSQQpGTEFLI0RZRVMjQkxPT00="},{"title":"1/27/09 AT STEAK","author":"by Gail Grabowski, edited by Stanley Newman","date":"2009-01-27","grid":"U0hPVyNQQU5TWSNTQ0FUClRVTkEjQUxPSEEjVE9SRQpBTE9UI1NUUklQI1JVSU4KUkFSRVNUQU1QUyNFTFNFCiMjI1JFQVJTIyNDQURFVApOVVJTRSMjI0FMVU0jIyMKT0tPSyNTVE9SRVIjSE9OCk1FRElVTUFSVElMTEVSWQpFU1MjTk9MRVNTI0VSQVMKIyMjRURHRSMjI1NUT0xFClRPS1lPIyNFQVNFRCMjIwpBQ0hFI1dFTExFTk9VR0gKUkVBTCNBR0FJTiNXSEVFClRBS0UjREFURUQjTk9ORQpTTklUI0VERU5TI1NIRUQ="},{"title":"1/28/09 ALL TIED UP","author":"by Randall J. Hartman, edited by Stanley Newman","date":"2009-01-28","grid":"Qk9XI1NBTEFEUyNPTUFOCkVQQSNPTUVMRVQjTEFNRQpCRUxUU0FOREVSI0RZRVMKT1JFTyMjVEFNRSNNSU5UClBBU1RBUyMjI0FHT0cjIwojIyNPQklXQU5LRU5PQkkKQ1lEI0NBUkxPI1RFTk9SClJPT00jTUlMTFMjWU9MSwpBR05FUyNTQVRFRCNXQVMKQkFORE9OVEhFUlVOIyMjCiMjQUlEQSMjI0ZFVURBTApQQVJUI1NIT1cjI05PVkEKQVJFQSNTQVNIV0lORE9XCkRJRVQjQUxMT1dTI0dJTgpTQURFI1VUT1BJQSNFRFM="},{"title":"1/29/09 AT THE WHEEL","author":"by Shirley Soloway, edited by Stanley Newman","date":"2009-01-29","grid":"QUJDUyNVR0xJI1NDUlVCClBFTFQjUE9VVCNXT09aWQpBUklBI0FTVEEjQU5OSUUKQ1JPU1NUSEVMSU5FIyMjCkVBU0lFUiMjSURTI1BSTwojIyNTVEVFUkNMRUFST0YKQkxUI0hFUkUjRUFUT1VUCkxBSVIjI0VUQyMjTVVTRQpBVEJFU1QjQVVUTyNERU4KU0hJRlRFREdFQVJTIyMjClRFQSNSQVcjI1BDVVNFUgojIyNUQUtFRk9SQVJJREUKQkFZT1UjRUxNTyNFR0dTCkVYSVRTI0JPTk8jU01FRQpHRU5FUyNTV0lNI1RBUlQ="},{"title":"1/30/09 GETTING WARMER","author":"by David W. Cromer, edited by Stanley Newman","date":"2009-01-30","grid":"Q1NQQU4jU1RBUiNOT1NFCkVMSVRFI1BJUEUjRkxFWApMSU5FRFJJVkVTI0xJTlQKU1RLUyNFUk9ERVMjVklFCiMjU1RBVkUjI05BVElPTgpOSUwjQkVEQU5EQk9BUkQKQlJJREFMI0xBU0VSIyMjCkNBUEUjI0hPVCMjVEFSTwojIyNCQUNPTiNGVVNJT04KU1dJVENIR0VBUlMjUllFCkxBU1NJRSMjTE9FU1MjIwpJTEwjREVDQUxTI0VQRUUKQ0xBRCNST0RTVEVXQVJUCktFTk8jT0xERSNMVUNJRApTVERTI05BU1QjU1BFQ1M="},{"title":"1/31/09 SATURDAY STUMPER","author":"by Sandy Fein, edited by Stanley Newman","date":"2009-01-31","grid":"QkFNQUtPI1NUQU5EQVJECkFEQUdFUyNUT01PUlJPVwpTSFJBTksjVU5JVkVSU0UKTUVUI1RBRkZFVEEjRUVMCkFSSUEjUkVGUlkjTkFUTApURU5USCNMRVMjRk9SVEUKSURJVEFST0QjUklOU0VECiMjI0VSSU4jRklSUyMjIwpBRERTVE8jV0VCU1RFUlMKV1JPVEUjVkFSI1RPUElDCktFR1MjRkFSTVMjUElQRQpXQVMjRElMTElFUyNTRU4KQU1BUklMTE8jUkVET05FClJFR0lTVEVSI0ZFRURFUgpEUkVOQ0hFRCNTUEVFRFk="},{"title":"2/01/09 WINTER-Y: With 10 seasonally correct clues","author":"by S.N., edited by Stanley Newman","date":"2009-02-01","grid":"UEFSU0UjQ1VTUCNNQVRUI1NIT0VTCkFLSVRBI0FTSUEjRURFUiNDQVBSSQpMSUZFU0FWRVJTI01BUllNQVJUSU4KRU5GRVRURVIjU1RFTVMjQ0xPU0VTCiMjI0xFSVMjTEFJTiNFVEhFTCMjIwpBTFBFUlQjQkVHRVRTI0hBTkRPRkYKTEVFUlMjUEVURVJPVE9PTEUjRlJJCkxBVFMjU0xBQiMjI0VBU0UjU1RBRwpBVkUjU0hBS0VTUEVBUkUjVUhIVUgKSEVTU0lBTlMjUEVBTFMjSUNJRVNUCiMjRE9ER0UjTUFTVFMjU05PUkUjIwpCQVJSRVMjUEFUVEkjVEhBTktJTkcKWUVBVFMjUEFSU09OQlJPV04jU09VClJJR1MjVEhBSSMjI0VJUkUjTklLRQpET08jQ0hBUkxJRUNIQU4jRklOSVMKU1VOREFFUyNVTkxPQUQjQ09OR0FTCiMjI09SRkVPI1NMVVIjTU9SRSMjIwpDUkVPTEUjVklUQUwjU1VSTUlTRUQKSE9XRFlET09EWSNPU0xPTk9SV0FZCkFUQUxMI0JJT0wjTUVBTiNTT0FWRQpSRU5FRSNJRExFI0JBVFMjQU5URUQ="},{"title":"2/02/09 DISCARDS","author":"by Gail Grabowski, edited by Stanley Newman","date":"2009-02-02","grid":"REVBTCNFR0FEUyNTQ0FUClJVU0UjUk9CRVMjTUFYSQpBUklBI0FUT05FI0lTTEUKVE9TU0VTT1VUI0FMVEVSCiMjI0VWRU5UI1BJRVMjIwpSQVRURUQjI01BRERBU0gKQUJIT1IjQkVFUlMjU0FPCk5PUiMjU0VFTUUjI0lSUwpJRE8jSkVMTE8jQkFER0UKTkVXQk9BVCMjUFVSRUVTCiMjU0xJVCNTQ0FOVCMjIwpTVEFJTiNQQVJUU1dJVEgKTEFXTiNNRUxFRSNPUkVPCkFUQUQjUkFWRU4jUk9MTApQQVlTI1NMRVBUI0tORUU="},{"title":"2/03/09 BE PATIENT","author":"by Sally R. Stein, edited by Stanley Newman","date":"2009-02-03","grid":"U0VMRiNQUk9ORSNEQUJTCkVWSUwjTEVNT04jT0hJTwpNRVNBI0FSSVNFI05FVFMKSU5BTUlOVVRFI0NBTUVPCiMjI0lDT04jI0hBVCMjIwpTSUdOSU4jRkxBTUVOQ08KQURBR0UjUExPVyMjRUFVCkJFRk9SRVlPVUtOT1dJVApSQUYjI1RST0QjT05FTkQKRUxFVkFURUQjU1RFUkVPCiMjI0lSRSMjRVBJQyMjIwpDQU5PRSNSSUdIVEFXQVkKT1JBTCNHRU5SRSNST01FClJJUEUjRUFURVIjQVJFQQpFQVNUI0VNT1RFI1RFTlM="},{"title":"2/04/09 MAKING WAVES","author":"by Fred Piscop, edited by Stanley Newman","date":"2009-02-04","grid":"QkFCQVIjQ0xBUCNTTEVXClBMQUNFI1JPTEwjTkFQQQpMSU5FUyNBSURBI09WSUQKVVNOI1BFTk5BTlRSQUNFClNURVJJTEUjI1RPRSMjIwojI1JVVFMjVE9BTkRGUk8KUEFZRUUjTUlOSVMjTEFCCklDRUQjQkFST04jTUFaRQpFUkEjUEVURVIjQk9HRVkKU0VSUkFURUQjQlJPUyMjCiMjI0VSUiMjUE9JTlRFRApTVEFOREFSRElaRSNPTEEKVE9SVCNZT1JLI0ZJTkVSCkVER0UjQU5ORSNFUkVDVApQT09SI0xBT1MjUkVTVFM="},{"title":"2/05/09 HUE ARE YOU?","author":"by David W. Cromer, edited by Stanley Newman","date":"2009-02-05","grid":"QUJFVCNUSVRBTiNXQUZUCk5PTE8jQURPUkUjQVdSWQpUQUxLQUJMVUVTVFJFQUsKU1RFRUQjRVJBU0UjRFlFCiMjI05FRURTI0lOVCMjIwpQQVNTRVIjI1JFVElOQVMKSURPIyNMUEdBI0VWQURFClRVUk5CRUVUUkVET1ZFUgpBTFRFUiNQRUVMIyNBUEIKU1RBVFVFUyMjU01FTFRTCiMjI1NJWCNJREVBUyMjIwpBQkUjU0NBUlkjU1RPT1AKQkVHUkVFTldJVEhFTlZZCkNBR0UjU1RJTkUjRVRBTApTVFlYI1NJTkdFI01PTEU="},{"title":"2/06/09 NATIONAL ANTHEMS?","author":"by Jon Delfin, edited by Stanley Newman","date":"2009-02-06","grid":"U1RSSVAjU0tJTSNTSUZUClRJT0dBI1RJTlkjQURPUwpFU1NFTiNFU1RFI0JPT0sKV0hBVERPVEhFWUNBTEwjCiMjI0lBTiNLTkVMVCMjIwpMT0ZUI1dFRUQjRUlERVIKVVJMI1NBTFMjU0VOT1JBCkNPVU5UUlkjTVVTSUNJTgpJTk5FRUQjREFURSNLRUcKRE9HSUUjRk9OVCNFU1NFCiMjI0dMRUFOI09TVSMjIwojT1RIRVJDT1VOVFJJRVMKQ1JBQiNSQVZFI1JBTkRJCk9TTE8jT0RBWSNBSUtFTgpCT0VSI0xFTlMjUExBTks="},{"title":"2/07/09 SATURDAY STUMPER","author":"by Daniel R. Stark, edited by Stanley Newman","date":"2009-02-07","grid":"QUREU1VQVE8jUEFSTE9SClBFQUNISUVSI0VMQUlORQpBVFRFU1RFRCNSSU1NRUQKQ09JTiNBVEVBTSNQSVBFCkhVTlRTI0hBVyMjI1RJRQpFUkcjUEFFTExBI0RJRU0KIyMjRE9OUyNTSUxFTkNFCkFTVEVSTiMjI1JJTkdFRApTSE9VVEVEI0NFTlQjIyMKU0lUUyNYQU5BRFUjQ0JTCkVWQSMjI1JPWSNTVFJBUApNRUxEI1VOU0VSI1dFUkUKQlJJRUZTI0lOSVRJQVRFCkxFTlNFUyNFTkxJU1RFRApFREdJRVIjUkVFTlRFUlM="},{"title":"2/08/09 FOOD SAVERS: Keeping things fresh","author":"by Gail Grabowski, edited by Stanley Newman","date":"2009-02-08","grid":"RlJFVCNBVEFSSSNDT0FMI0FXQVJFCkxPREUjTUlNSUMjT1JTTyNOT1NFUwpPQklTI09CRVNFI1JFUFMjR1JFQVQKU09GVERSSU5LQ0FOIyNUVlNUQVJTClNUWUxFI0FTU1VSRSNGQUlUSCMjIwojIyNBQ1MjIyNCRUFIRVJPI09ET1IKSEVSQkFMQ1VSRSMjSU5UTCNORVJPCkVSRSNZRUFSTiNBQkNEI0FSRU5BUwpBTkVXI0VCQlMjRUVLUyNUVVNTTEUKUklTRSNUQkEjT1JFTyNXRURTIyMjClRFRU5TI0lOQVBJQ0tMRSNFQVJUSAojIyNUQVBFI0xFQUgjWUFQI0xPUkUKQUNDVVNFI0tBUkwjTUlMTCNUV0lOCkNBUlBFVCNJUkFTI0FOVEVTI0VFUgpFU0FJI0NBTE0jI0hJR0hBTkREUlkKREFXTiNBUE9TVExFIyMjVEVBIyMjCiMjI1NBVEVTI09PTVBBSCNFUlJFRApESVNNSVNTIyNTQUxBUllGUkVFWkUKUk9UT1IjVUZPUyNJVFNNRSNTUElOCkFXQUtFI0lETEUjTkVPTlMjVEVOVApUQVRFUiNUQURTI0VSTlNUI09MRVM="},{"title":"2/09/09 WHAT, NO BELL?","author":"by Gail Grabowski, edited by Stanley Newman","date":"2009-02-09","grid":"REFURSNCT09LUyNTS0lECkVSUlMjQU5WSUwjSU5EWQpCRUFUI1RJRVRPI0RPTEUKVEFQQVBIT05FI0RJQ0VECiMjI1RFRU5TI0JBTksjIwpTUFJFQUQjI0JBUkdBSU4KQUxBUyMjVFdJU1QjQlJPCkxBUCNTVFJJREVTI09BVApBQ1MjVFJPVFMjI0NVVEUKREVFUFJFRCMjU1RBVEVECiMjU09BSyNDTEVBTiMjIwpNT1NFWSNQT1VORENBS0UKQUJJVCNBTEVSVCNFTEFMCkRPT1IjU0VERVIjTE9MTApFRU5ZI1NBU1NZI1NFRVM="},{"title":"2/10/09 TOO MUCH TALK","author":"by Billie Truitt, edited by Stanley Newman","date":"2009-02-10","grid":"QVJNUyNQQU5TI0FDVE9SCk1BSUwjT0JPRSNQUk9CRQpBTk5BI0xBVkEjUEFHRUQKI0dJVkVJVEFMTEFXQVkjCiMjIyNBVEUjI0lMTCMjIwpBQ0NVU0UjRE9MTCNCTFQKU0hPUkUjQVVSQSNTTFVSClNJTkdMSUtFQUNBTkFSWQpFREdFI0RJTEwjR0FNRVMKVEVBI1BFTlMjRElHRVNUCiMjI1BFQSMjR0VMIyMjIwojU1BJTExUSEVCRUFOUyMKTU9SQUwjSElOVCNST09NCkFMT05FI0FGUk8jVE9ETwpSRVBPVCNUSUVSI1NOQVA="},{"title":"2/11/09 HOT STUFF","author":"by Shirley Soloway, edited by Stanley Newman","date":"2009-02-11","grid":"QUxPVCNDTEVGI1NBTUJBCk5PTk8jUk9NQSNDSEFSRApUT1RPI0VSSUMjSEFURUQKU01PS0VTQ1JFRU4jQ0FUCiMjI1RBVEEjI1JPVEhLTwpERVRFUlMjU0hBWkFNIyMKVUNPTk4jUEVBUyNHQVpFCkVSUiNTVEVBTUVEI0tJTgpMVUNZI09QVFMjRU1FTkQKIyNIRVJNRVMjR0xBUkVTCkNBU1NJRSMjU0lUUyMjIwpPUk8jRklSRUNSQUNLRVIKUkVOQUwjSVBPRCNBTlRFCkFOR0xFI01FUkUjUkVBRApMQVNUUyNTRUVSI0FXTFM="},{"title":"2/12/09 FOREWORDS","author":"by David W. Cromer, edited by Stanley Newman","date":"2009-02-12","grid":"QUJBU0UjQUxFVVQjSEFUCldBUlBTI0xPUk5FI0VTRQpMVUNJTExFQkFMTCNBUEUKU01PRyNBUk9TRSNGTElUCiMjI09BU1QjI1NDT1RDSApSVVNUTEUjQVNTVUNIIyMKT1NVI1RSQURFI1JBQ0tTCk5BQ1JFI0NPRyNBTExBSApBRlRFUiNDUkFGVCNVTk8KIyNJREVBVEUjTE9CQkVECkFWT0lEUyMjVE9SSSMjIwpSRU5EI1NQSUVSI0RFQlQKSU5DI0pFQU5TQU5EVEVFClNUVSNPUkJJVCNCRU5EUwpFU1AjRVRBVFMjQ1JBU0g="},{"title":"2/13/09 GET TO WORK","author":"by Donna S. Levin, edited by Stanley Newman","date":"2009-02-13","grid":"U1RFUCNBQ0hJUCNDVVNQCk9ITk8jTUlBTUkjQUdBUwpMVUdTI0JBTkFOQVJBTUEKI01JU1NJT05DT05UUk9MCkFCTkVSIyNBU1RBI1RBTQpVU0UjQU9MIyMjQ0hFU1MKRlVFTCNWQUxFUklFIyMjCiNQUk9KRUNUUlVOV0FZIwojIyNGT1JFU1RTI1NMT0IKTkFUVFkjIyNFVEEjSURPCkVWRSNPQVJTIyNMQVRFWApWRU5UVVJFQ0FQSVRBTCMKQURESVNBQkFCQSNPTEVHCkRPT00jQkVMTFMjTUlSRQpBTk5FI1NMRUVUI1NBU0U="},{"title":"2/14/09 SATURDAY STUMPER","author":"by Sandy Fein, edited by Stanley Newman","date":"2009-02-14","grid":"U01BTExPSiNTV0FUSEVTClBBUEVFVEUjTk9TV0VBVApSSVBJTlRPI0lNUEFTU0UKSUxMUyMjUEFQQSNTSVRFClRFRSNIRUFWRU5TI1RBUApFRFMjQUNSRVMjUEhBU0UKIyMjRlJPRE8jU0VFTklOClNPTElETFkjU0lFU1RBUwpBVklBVEUjTUlORFMjIyMKTEVOVE8jQlVMR0UjU05MCkVSRyNQSU9ORUVSI0hPRQpTVEVXI1JBSU4jI0RBTkEKTUlSQUdFUyNDQVRBTEFOCkVNSU5FTlQjRVBJVE9NRQpORUVETEVTI1NURUFNRUQ="},{"title":"2/15/09 CAN'T SIT STILL?: Then this is for you","author":"by Shirley Soloway, edited by Stanley Newman","date":"2009-02-15","grid":"QkFOREIjU1BVUiNTT0RTI0FSTkFaCkFSRUFMI0NPTkUjSFVDSyNRVUlURQpMSUJZQSNBS0lOI1VHTEkjQU5OSUUKTUFSQ0hFTEVWRU5USCNQVEJPQVRTCiMjI0FTQVAjQVdBSVQjTE9BRiMjIwpBREFNI1JFTEwjSU5BUlVUI1RTUFMKSlVNUEFMTE9WRVIjI0tORUVIT0xFCkFNSVNTIyNWRVQjQkxPQyNSRVJBTgpSQUQjRVRURSNBUkVBI0hBTU1FVFQKIyMjV0FJU1RTI0VFTFMjQkFJTEVSClBBUEEjTEVBUE9GRkFJVEgjTFlSQQpPUkVMU0UjUEFMRSNTQ0hPT0wjIyMKVElOS0VSUyNERVJOI0tVUlQjRUtFCkFTVE9SI0xZRVMjRVNQIyNPS1JBUwpTVEVGQU5JRSMjSE9QQUZSRUlHSFQKSEFMRiNFRFdJTkEjTFlMRSNET05BCiMjI0hFUkUjTk9OQ0UjT0FGUyMjIwpJTkNPTE9SI0pPR09ORVNNRU1PUlkKTkFPTUkjVVNFUyNBRERTI01FVE9PCklTTEVUI0xPU0UjVE9ORSNVTklUWQpUSEVSRSNFWFRTI0lSQVMjUlVTU08="},{"title":"2/16/09 ON THE FLOOR","author":"by Gail Grabowski, edited by Stanley Newman","date":"2009-02-16","grid":"TEFMQSNCQVRIRSNDQUJTCkFTT0YjRUxCT1cjT1JFTwpNSVRUI0dPT1NFI1dJTEwKQkFTRVJVTk5FUiNBU1RPCiMjI1JBTkdFIyNQUkVTUwpSRUNBUCMjI1NBSUQjIyMKSVRBTCNBU1NFUlQjQ1BSCkNBTExPTlRIRUNBUlBFVApFTEYjU1RFRURTI0VBU0UKIyMjRkxFVyMjI0JFU1RTClBBVElPIyNTSE9BTCMjIwpMT1JFI0dPVE9USEVNQVQKRVJBUyNBUEFSVCNESUNFCkFUSVQjVEVSU0UjSUNFUwpEQVRBI0VOVEVSI05FU1Q="},{"title":"2/17/09 FOWL MOOD","author":"by Billie Truitt, edited by Stanley Newman","date":"2009-02-17","grid":"U05PQlMjTU9TUyNHQVNICktPUkVBI09ISEkjQUxUTwpJVEFMWSNUSUVEI01PQU4KU0lMTFlHT09TRSNJTlRPCiMjIyNFQVIjI0RBTkdFUgpIQVJBU1MjVVNJTkcjIyMKQUxVTSMjSVJFU1QjU1JJCk5PU1BSSU5HQ0hJQ0tFTgpHRVQjT0NURVQjI1BFRUsKIyMjRFVFTFMjU0hBV0xTClNXRUVUUyMjU0VBIyMjIwpDSEFUI1RBTEtUVVJLRVkKUkFHRSNPQk9FI0xFQVZFCkFMRVMjUk9TRSNFTExFTgpQRVJUI01PU1QjRFlFUlM="},{"title":"2/18/09 LET'S FLY","author":"by Daniel R. Stark, edited by Stanley Newman","date":"2009-02-18","grid":"U0VBTCNESU1FI1JBQ0VECkFDSEUjRVJBUyNFUE9YWQpBUkVBI0JJVFMjQUxMSUUKQlVNU1JVU0gjRkxPQVRTCiMjI0hJR0gjUFJJTSMjIwpUT1RFTVMjV0hJWkJBTkcKQVJJU0UjR09PU0UjWElJCkNBVCMjVFJVTksjI0VORApJVEEjU0hJTkUjUE9MRUQKVEVOU1BFRUQjR0xBU1NZCiMjI0NVRkYjQkxVUiMjIwpDQVZPUlQjWk9PTUxFTlMKQUdFTlQjQUlEQSNPTEVPCkRVTkNFI1NURVQjQ0FNTwpTQVRFRCNISVNTI0tOT1Q="},{"title":"2/19/09 WHAT'S WHAT","author":"by Fred Piscop, edited by Stanley Newman","date":"2009-02-19","grid":"RElWQVMjUkFGVCNUVUdTCklSSVNII0FSRUEjQVJJQQpDQVNISVNLSU5HI0xBWlkKRVRBI05FRUQjVE9LTEFTClNFU1RFVFMjREVMSSMjIwojIyNJUlMjSEVBRFNPRkYKRk9STVMjUEFMTSNDSE9VCk9ESUUjQ0FSVFMjSE1PUwpOT1RJI1JJRFMjUkVTVFMKRFJFU1NJTkcjTUlBIyMjCiMjI01JTlQjVklQUEFTUwpBVFdPUksjTEVOTyNSQVcKTE9BTiNMRVNTSVNNT1JFCk1JTEUjRVRBVCNUSU1JRApBTExZI1NTVFMjRVJBU0U="},{"title":"2/20/09 TO BE AND TO BE","author":"by Richard Silvestri, edited by Stanley Newman","date":"2009-02-20","grid":"RURBTSNDVFJMI1JBTUJPClRBVEEjT0hJTyNPTkVBTQpBVE9aI1pJVEkjQU5HVVMKI0FNRVJJQ0FORFJFQU0jCiMjIyNJTEsjI1JFWCMjIwpOT0JPRFkjU0hBRCNTVFAKQUxPTkcjTE9PTSNUVUJBCklTUkFFTElBTkFMWVNJUwpWRUlOI0xPVkUjQVBBUlQKRU5DI0JBTkUjQkxPTkRFCiMjI1BBTSMjQkFBIyMjIwojQVJFTkFIQVJEV0FSRSMKQ1JVU1QjRVhBTSNKQVZBClVOSVRFI0FMVkEjQVZFUgpET05PUiNQRU9OI1JFTlQ="},{"title":"2/21/09 SATURDAY STUMPER","author":"by Doug Peterson, edited by Stanley Newman","date":"2009-02-21","grid":"QklTTVVUSCNQQVdFREFUCk9DRUFOSUEjSU5BUkFHRQpSSURHSUVSI0NJVElaRU4KRUxBTiNTRVNBTUVTRUVECkRZTkFNTyNUQkFSIyMjIwojIyMjSU5UUk8jV1JPVEUKRFJNT1JFQVUjU0hBUkVTCkVZRUJST1dUV0VFWkVSUwpNQVJJT04jVElNRVpPTkUKU05FRVIjTEVHQUwjIyMjCiMjIyNJVk9SI1BTQUxNUwpVQkVSTUVOU0NII0JFVEEKUE9MRUFYRSNIT0xMT1dTCkNSSU5HRVIjT1JJRU5UUwpTS0FURVJTI1BFVFJJRlk="},{"title":"2/22/09 INSETS: Presented two at a time","author":"by Fred Piscop, edited by Stanley Newman","date":"2009-02-22","grid":"U1dJRlQjTE9XUyNSSURFIyNURUFTCk9BVEVSI0FMT1QjT1JBTiNQT0xMTwpUV0lORU5HSU5FI0JBUkdBSU5CSU4KT0FTI05FT04jRU1PVEUjR0FJRVRZCiMjI0FUTVMjUExBQ0UjR0VORSMjIwpTS0lET08jRElFR08jTUVOT1JDQSMKVEVOT04jV0lORFNQUklOVCMjQVJDCkVORFMjRkVBVCMjI0VMSVMjUExJRQpBWUUjUkFJTk9SU0hJTkUjU0FWRUQKTEFYI09MR0EjQUxPTkUjQ0VSSVNFCiMjRkxVU0gjUElFUlMjQUxJRU4jIwpBVklBVEUjTUlMRVMjQUxBUyNLRUcKVEVOU0UjRUlOU1RFSU5JVU0jTEFPCklOR0UjQVROTyMjI05BR1MjU0VHQQpUT0UjI1RISU5LQUdBSU4jQ0hJTEwKI01SQk9ORVMjUklMTFMjVEhBTkVTCiMjI0FNT1IjVElEQUwjTE9VRCMjIwpJRFVOTk8jQ09OQU4jRUFSTiNQU1MKTkFQS0lOUklORyNDSU5DSU5OQVRJClNMT0VTI1VUSUwjRVJJRSNFU1NFTgpURU5EIyNNSUNFI0RBRFMjTEFTVFM="},{"title":"2/23/09 WINTER VACATION","author":"by Gail Grabowski, edited by Stanley Newman","date":"2009-02-23","grid":"U0FTSCNTVEFMRSNBR09HCk9SRU8jQVJCT1IjU09NRQpQRUVMI05PT1NFI1NOSVQKSEFOREVET1VUI0RVRVRTCiMjI1VOQVBUI0ZBQ1QjIwpQUk9QRUwjI0JBUkhPUCMKUkVGUyMjQUxJU1QjU0FQCk9BRiNQQVJFTlRTI0VZRQpERFQjRVhJVFMjI01FRVQKI1NIQURFRCMjRVJPREVTCiMjRVJBUyNUQUNPUyMjIwpDQVJPTCNSSUdIVEFXQVkKTFVBVSNDQU1FTyNJT1RBCkFSQ1MjU0NFTkUjQ1JPUApNQUtFI1RFU1RTI1NFTlM="},{"title":"2/24/09 FIFTIES FASHIONS","author":"by Billie Truitt, edited by Stanley Newman","date":"2009-02-24","grid":"R0FWRSNGRU1BI1NDQU1QCkFGQVIjUkFJTCNVTlRJRQpTT0xPI0lUTEwjSU5PTkUKUE9PRExFU0tJUlQjTklQCiNUUkVBRCMjU1VDQ0VTUwojIyMjUEVHUyNCQVIjIyMKQVNJQSNHUklQI1NFRVRPCkNBUkRJR0FOU1dFQVRFUgpUV0FJTiNNVVNFI01BTkUKIyMjT0RFI1NUQVkjIyMjCk1FQVNVUkUjI1NFQU1ZIwpPUkcjU0FERExFU0hPRVMKQ1JFU1QjR09BTCNPVkFMCkhPTk9SI0VUVEUjTElSQQpBUlRTWSNTRUVEI0RFTlQ="},{"title":"2/25/09 BOARD-GAME TURNS","author":"by Fred Piscop, edited by Stanley Newman","date":"2009-02-25","grid":"Q09OI01JTEwjI1NBTUJBCkFIQSNBUklFTCNQTElFRApSQVQjSE9OREEjUk9ORE8KRFJBV0lOR0FCTEFOSyMjClNBTEFNSSMjI0FZRSMjIwojIyNUQUNUI1ZQUyNIT1cKRlJPVEgjSURFUyNDT1ZFClJPTExJTkdPTkVTRVlFUwpFREdFI09ITk8jUExBTlQKVEVBI0JMVCNNRVJFIyMjCiMjI09MQSMjI05FUlZFUwojI1NQSU5OSU5HQVlBUk4KU0FUQU4jQVZPSUQjTEVFCkFQQVJUI1BFTk5FI1ZDUgpNRVJUWiMjU0VFUiNFVEQ="},{"title":"2/26/09 JUST IN CASE","author":"by Shirley Soloway, edited by Stanley Newman","date":"2009-02-26","grid":"SEFJRyNDSEVTUyNDT0xECkVTVEUjSFVMQ0UjT0JPRQpDSEFUVEVSQk9YI1JTVlAKSEVMTE8jVEFVVCNERUVQClRSWU9VVCMjUkVMSUMjIwojIyNTVE9JQyNUT0FSTVMKUFNTVCNGRElDI0xMQU1BCkVFTCNRVUVUWkFMI1RFTgpBVEVTVCNTRUFMI0RFU0sKS0hBS0lTI0RSSVZFIyMjCiMjWklQVVAjI1RFQVJVUApVU0VSI05MQ1MjSVJFTkUKWkVCVSNIQUNLRU5TQUNLCklSQU4jQVRMQVMjSURMRQpTQUdTI1RFWFRTI1JZRVM="},{"title":"2/27/09 BREAK IT UP","author":"by Merle Baker, edited by Stanley Newman","date":"2009-02-27","grid":"RVBPQ0hTI1JPQUQjR0FUCkNPTExJRSNFTklEI0lLRQpHUkVBVERJVklERSNOSVgKU1RPUCNHUkVUQSNBR1JBCiMjI1NIRUFSUyNDTEVBTgpKQUZGQSNORUVETEVSIyMKVU5JT05TI1NBUkkjU1NOCk5BUlJPV1MjUlVOSU5UTwpPVFMjVkFDQSNNSVNBREQKIyNURUVOQUdFI0NPUFNFCkJZQ0FSI1ZJQklTVCMjIwpBQVJQI0xFVE9OI09BVFMKU0hBI0JBTkFOQVNQTElUClJPQyNTU0dUI0lNRUxEQQpBT0sjQVRFRSNSVVNTRVQ="},{"title":"2/28/09 SATURDAY STUMPER","author":"by S.N., edited by Stanley Newman","date":"2009-02-28","grid":"U0VBUVVBS0VTI0NMQU5TCkxBU1RQTEFDRSNBRVNPUApBU0NJSUZJTEUjVU5JVEUKVFRPUCMjU0FEI1NUQVJFCkVTVCNFWUVURVNUI01FRAojIyNCTFVSI1JQSSNJREEKU1BSQVdMUyNTQUMjTkFXCkNSRURPIyMjIyNBUk9NQQpSRUYjT09II0RBTFRSRVkKQVZFI0RPRSNVUkxTIyMjCk1BUiNQT1JUUkFZI0hBUwpCTEVFRCNBSEEjI1RJTUUKTEVOVE8jTEVOQUhPUk5FCkVORE9XI0RPR0dPTkVJVApTVEFORCNTQ09PQllET08="},{"title":"3/01/09 BALONEY SANDWICHES: But not entirely edible","author":"by S.N., edited by Stanley Newman","date":"2009-03-01","grid":"TE9WRVIjQVdMUyNIRUZUI1RBVEFTCkFST01BI1RIQVRTQUxJRSNSSElORQpCQUdVRVRURUhPS1VNQkFHVUVUVEUKRkxVUyNPRVIjTklMIyMjTEVNTU9OCkVMSSNDT01FRFkjI1JBWk9SI0lORgpFQVNFTCNQVEEjQlJFV0VSI0NDSUkKI1dIRUFUVE9NRk9PTEVSWVdIRUFUCiMjI0dQTyMjI0lOVCMjT0JJRSMjIwpFTkQjU0tZQk9YI0NCUyNFUkVDVFMKREFSVCNZT1lPRUQjQVBQI0VUSElDClNPVVJET1VHSFJPVFNPVVJET1VHSApFTUJFUiNSVUUjU0hFSUxBI1NURVcKTElTQk9BI01EUyNJRExJTkcjRVJBCiMjI0xPTEwjI01JUiMjI0RVRSMjIwpCQUdFTEJBTERFUkRBU0hCQUdFTCMKRVJJUyNFVkFERVMjSEFJI1JPVkVSCkVNUyNPUkFURSMjUEFUVEVEI0lWRQpUSEVBQ1QjIyNBTEwjQ0hFI0ZMRUEKUk9MTEhPUlNFRkVBVEhFUlNST0xMCkVMTEVSI01UUkFJTklFUiNURU5FVApERUVSRSNTVUVSI0JBTEUjTEVFUlk="},{"title":"3/02/09 CRITTER CLAMOR","author":"by Gail Grabowski, edited by Stanley Newman","date":"2009-03-02","grid":"U0NJUyNBQkNTI1BPU1NFCk1BREUjQlJBVCNPQ0NVUgpBTlRFI0FBUlAjU0NBTEUKTE9BRElOR0JBWSNBUksjCkxFR0VORCMjVEVBU0UjIwojIyNEUk9WRSNTS0lDQVAKQVNQI0VORU1ZI0FPUlRBCkxBSVIjI1RJRSMjTk9FTApVTVBFRCNTVE9SWSNXRUUKTUVTU1VQI1NXRUFSIyMjCiMjUVVPVEUjI0RSQUZUUwojQ1VCI0FMTU9OREJBUksKU0VFTVMjQUVSTyNCTFVFClBMQUlOI1RBQlMjSVNFRQpBU0tUTyNFTFNFI1RFU1Q="},{"title":"3/03/09 CELEBS OF THE MONTH","author":"by Sally R. Stein, edited by Stanley Newman","date":"2009-03-03","grid":"U1BBUyNVUFRPI1NOT1JFCkxVTEwjTkVPTiNIT0tFWQpVUlNBI1RBTEMjRUVSSUUKR1JPVkVSQ0xFVkVMQU5ECiMjIyNEVUUjI0lUUyMjIwpWRUdHSUUjT1dMUyNSQVAKQUxMT1QjT1JBTCNTT0ZBCkxPVUlTQU1BWUFMQ09UVApPUEVOI0JJVFMjT0FTRVMKUkVEI1JBVEUjUEFOVFJZCiMjI0VJUyMjVEFOIyMjIwpKT0hOUEhJTElQU09VU0EKQUJJREUjVE9SRSNJTk9OCldPVkVOI0VWRVIjTElNRQpTRUVEUyNNRVNTI1NURVc="},{"title":"3/04/09 GROUP COVERAGE","author":"by Norma Steinberg, edited by Stanley Newman","date":"2009-03-04","grid":"SkFORVQjVVNNQSNUQVNLCkFSRU5BI1JFQUwjUlVMRQpWT1dFTCNHRVJNI0lSQU4KQURPI0tFRVBDT01QQU5ZCiMjVVBFTkQjI1NJRVNUQQpBTFRBUlMjRE9UUyMjIyMKTEVGVCNVTklWI0NBQklOClVOSVQjRUFHRVIjU0lERQpNT1RJRiNNSU5JI1NMT1QKIyMjI0VERU4jU01FTExTClNFVFRFUiMjTUVBVFkjIwpFTEFTVElDQkFORCNDUEEKV0lOSyNGTEFYI0FMTE9XCkVUVEUjVFVCRSNNT1VTRQpERUVEI1NFRUQjRUJCRUQ="},{"title":"3/05/09 HOME SWEET HOME","author":"by David W. Cromer, edited by Stanley Newman","date":"2009-03-05","grid":"QlVSTlQjQVJMRVMjUEFSCk9OQUlSI05BSVZFI09MRQpOT1RISU5HRkxBVCNSVEUKIyMjI1BFTFQjI0RBVEVECkVTQ0FQRUUjUExPVkVSUwpTVE9XRUQjQkxPV0VSIyMKVEFNRUQjVFJBSU4jSEFECkVMTVMjU0hJTlMjTE9OSQpSS08jU1RJTksjR09VR0UKIyNOQVRVUkUjQkFTU0VUCkNPUExBTkQjU0lTVEVSUwpSVUxFUiMjREFSSyMjIyMKVVNBI1NIT1VMREVSUEFECkVUQyNLT1JFQSNURUVOWQpUU0UjWUlFTEQjU1BJVEU="},{"title":"3/06/09 MATTER OVER MIND","author":"by Bruce Venzke, edited by Stanley Newman","date":"2009-03-06","grid":"VElGRiNCUkFTSCNCVUxLClVSQUwjRUZJTEUjQVJFQQpUT1FVSUNLTFlGT1JHRVQKVU5TRUFMIyMjI05URVNUCiMjIyNHT1AjQUJSQSMjIwpBTExZT1VSVFJPVUJMRVMKUEVBVCNET1JBR1MjRVJFCkxPUkRTI0JJQiNIQU5OQQpVTkEjRVJPVElDI1NUSVIKU0lNUExZV0VBUlNIT0VTCiMjI0hFRUwjTkFQIyMjIwpIT1BPTiMjIyNZQUhPT1MKVEhBVEFSRVRPT1RJR0hUCk1JU08jVVRVUk4jRUxNTwpMT1RTI01BWEVTI0RFRVA="},{"title":"3/07/09 SATURDAY STUMPER","author":"by Doug Peterson, edited by Stanley Newman","date":"2009-03-07","grid":"SEFUQVJJI0hPTEVDQVJECkVWRU5VUCNFTkFNT1JFRApNSUxBTk8jQ09NTUVSQ0UKTUFMVEVEUyNGRUVERVIjCkVUTyNTTkFSRlMjI1NFVApSRUZJI0FWRSNUQVJUQVIKIyMjTUVOQUNFI0xJRVRPCkxJR0hUT05PTkVTRkVFVApVTkxJVCNUVklET0wjIyMKQ1JPUFVQI0VHRyNFQ0NPCllFVyMjSEFSTUVEI0hVRAojUEVDS0VEI0FEVUxBVEUKQk9SRUlOT04jT05VU0VTClVTRURUT0JFI1VOTEVTUwpSRURFRU1FRCNUT0xEWUE="},{"title":"3/08/09 OUCH!: This won't hurt a bit","author":"by Shirley Soloway, edited by Stanley Newman","date":"2009-03-08","grid":"UEFEUyNTSEFII09NRUdBI1RCT05FCkFMT0UjS0VOTyNIT01FUiNIVU1PUgpQSU5DSElOR1BFTk5JRVMjRVlJTkcKQVNIVE9OI0xJTU8jVFNFI1NBVEVTClNUT09QI1NPU08jIyNFTkRVUCMjIwojIyNSRVNUIyNUSFVEI0lPTklaRVIKRk9HI1NUUklLRUlUUklDSCNHRVJFCk9OVVMjRUFSTCNURUVOI0FSSVNUQQpSSUFMI1RXRUVEUyNXQVJSQU5URUQKS09WQUNTIyNJT1RBI0xFTU1BIyMjCiNOQVBBI1BVTkNIQkFMTCNJUE9EIwojIyNPUkFMQiNTRUxMIyNVU09QRU4KUkFJTlBST09GI1JFRUxJTiNLQUxFClBST1RFTSNBUkNPI0NFTlQjRVJJQwpNSU5II1BVVEFTT0NLSU5JVCNUU0sKU0xFRVBJTiNTQUZFIyNFTEFOIyMjCiMjI1dPVEFOIyMjQUZBUiNCT1RDSApTVEVSTiNTSUIjVVNFUiNBTFRIRUEKVE9YSUMjS05PQ0tFRE9GRkVBUkxZCkFNSVNII0VOU1VFI09NQVIjVE9MRApHRVRUTyNEWU5FUyNOQVRPI0VCT04="},{"title":"3/09/09 HOLEY QUARTET","author":"by Gail Grabowski, edited by Stanley Newman","date":"2009-03-09","grid":"TE9XRVIjR09MRCNTUEFSCkFMQU1PI0VQRUUjQ0FORQpORVRUT05OQUdFI1JJVEUKRE9UI01BSUwjSkVFUkVECiMjI0dJQkVTI0FMRSMjIwpTTkFSRVMjI0dZTU5BU1QKUE9MQVIjU0VFUyNTSVRFCkFMT1QjI09BVCMjQUxBUwpSSUZFI09VUlMjQVZFUlQKS0VUQ0hVUCMjU1dFREVTCiMjI0hPVCNBU1RFUiMjIwpTV0VFUFMjQkFBUyNBUFQKVElSRSNXRUJCUk9XU0VSCkFTSVMjQVdPTCNNQUlORQpUSEVFI01FVEUjRVJBU0U="},{"title":"3/10/09 PARENTAL REMINDERS","author":"by Billie Truitt, edited by Stanley Newman","date":"2009-03-10","grid":"U1BBTSNTVEVNUyNEQU1QClBBUkUjT1JCSVQjRUdPUwpBU0VBI0xJQlJBI0xPVFMKU1RBTkRVUFNUUkFJR0hUCiMjI1NFVCMjSEVNIyMjIwpNTU0jV0lMVCNTQU5EQUwKT09PIyNPQVJTI1NUQUdFClRVQ0tJTllPVVJTSElSVApFVEhJQyNTT1JFIyNMRUkKU0hBRE9XI1BFU08jWUVOCiMjIyNOQU0jI0NBUCMjIwpET05UU1RBWU9VVExBVEUKQVJJQSNFUk9ERSNBSEVNClRBTkcjUklHT1IjQ09MVApBTEVTI1NFQVJTI0VZRVM="},{"title":"3/11/09 GET GOING","author":"by Randall J. Hartman, edited by Stanley Newman","date":"2009-03-11","grid":"UkVIQUIjU0hBSCNaRVJPCkFMSUJJI0hPV0UjSVJBTgpGSUZFUiNPUkxZI1BJS0UKI1NJVERPV05TVFJJS0UjCiMjIyNTQVkjI0hBVCMjIwpCVVNURVIjQkxFVyNERUMKQU5OSUUjU09BUiNCQUpBClNUQU5EQU5EREVMSVZFUgpUSVBTI0xJRUQjT05JQ0UKRUxTI09BVFMjUElHU1RZCiMjI1NBTiMjS09TIyMjIwojV0FMS0FGSU5FTElORSMKRklETyNMT05FI0FET1BUCkVEQU0jRElDRSNOT1RJTgpERU1PI0FMQVMjRUxFQ1Q="},{"title":"3/12/09 SQUARE DEALING","author":"by Fred Piscop, edited by Stanley Newman","date":"2009-03-12","grid":"I0ZBREUjTU9XRVIjUEFMClBPTEVEI0VSQVNFI0VMSQpKVVNUREVTRVJUUyNUT08KU0xPRSNSQU0jI0VBVEVOCiMjI0NPTUIjQ0VMTEkjIwojI1NUUkFJR0hUTElORSMKTUVMRUUjI1JBVFMjR1JFClVTRUQjTUFJTkUjQ1pBUgpNQUUjTUFTUyMjTU9PU0UKI1VQUklHSFRQSUFOTyMjCiMjWUFMSUUjRVNQTiMjIwpDUkVFSyMjR0VMI09UVE8KTEFZI0ZBSVJXRUFUSEVSCkFWRSNFRERJRSNIRUFSUwpNRUQjRE9PTkUjQVNUSSM="},{"title":"3/13/09 FLORA AND FAUNA","author":"by Shirley Soloway, edited by Stanley Newman","date":"2009-03-13","grid":"V0VMSyNBQkJZI0FSTU9SCkVQRUUjT1JFTyNMRU9ORQpUSUdFUkxJTFkjQU5ORVMKU0NPUEUjQ0xPRCNPS0lFCiMjI1NBQ0tTI09SSUVOVApST1NUUkEjIyNHQVJZIyMKRUlORSNUSFJPV04jUEFXClNMQVAjVEVNUE8jUk9NQQpUU0sjTEFZU1RPI0hEVFYKIyNFTE9JIyMjRFJFU1NZClNUUEFVTCNQT1NJVCMjIwpDT0xUI1NVRVojTk9UVVAKSEVBVkUjQ1JBQkdSQVNTCk1JTklTI0xPV0UjSUNFUwpPTlRBUCNBVEFEI0NPU1Q="},{"title":"3/14/09 SATURDAY STUMPER","author":"by Sandy Fein, edited by Stanley Newman","date":"2009-03-14","grid":"U1RFV0FSRCNNT05BUkNICkNBUEFQSUUjQVJBUEFITwpJTklST05TI1JFVEFQRVMKQUxMRVJHSVNUUyNDSEFUClRJTyNURVJQUyNTSEFERQpJTkdFI0RBUiNXSEVFTFMKQ0VTVEEjQllBSVIjTEVTCiMjI0VUQUwjU05VRyMjIwpJUVMjQUxFUlQjQkFTSVMKTVVFU0xJI0FSUCNHRU5FClBJWEVMI1NDT1VSI0FURQpBTlRFI1NIRUxMQUNLRUQKU1RBTkRFRSNBU1NVQUdFClRFTlRBR0UjQkFUVExFUgpPVFRPTUFOI0VSQVNFUlM="},{"title":"3/15/09 BODY BUILDING: With something else in common","author":"by Fred Piscop, edited by Stanley Newman","date":"2009-03-15","grid":"WkVUQSNTQUMjI0JBTEkjSUJFUklBCkVMQUwjQU1PUiNPTElOI01BTElCVQpORUNLT0ZUSEVXT09EUyNQUkVTRVQKT0NUQVZFI0VMQVRFI0VSRSNWRVRPCiMjI0xFQiNORVZFI0FDQURJQSMjIwpBU1BJUkVEI0VZRU9GVEhFU1RPUk0KTE9MI1NUVUIjIyNMQVMjI1NFUElBClBMQVRII1NBUyNQRVIjR0FVRElMWQpIQUlST0ZUSEVET0cjU09MRSNORUIKQVJUSUVSIyNURU4jVElSRUQjRVNFCiMjIyMjQVJNT0ZUSEVTRUEjIyMjIwpKSU0jQUNPUk4jT01TIyNTVFJJRkUKQUxBI01BVUkjRk9PVE9GVEhFQkVECkNPTkNJU0UjQ1ROI1lPTyNFVkVOUwpPTklPTiMjU09MIyMjUFJJTSNBQ0UKQkFDS09GVEhFQk9PSyNUUkFNTUVMCiMjI0VSQVNFRCNYVFJBI0VUQSMjIwpPUEVDI1RPRSNTSVRBUiNQSVBFVVAKQVVMQUlUI0hFQURPRlRIRUNMQVNTClRSQU5DRSNBTlRFI1RVQkEjRVZFUwpTRU5TRUQjTkVTUyMjUk9UI1NFUlQ="},{"title":"3/16/09 TIRE TALK","author":"by Gail Grabowski, edited by Stanley Newman","date":"2009-03-16","grid":"Q0hJTiNTTE9XUyNTVE9QClJVREUjUEFSSVMjQVJJQQpBTE9FI0VSQVNFI0JFTkQKQkFMREVBR0xFI0JFQUtTCiMjI0xVUkVTI0JJUkQjIwpTRVdFUlMjI0dFVFNXRVQKQVJFU08jU0hBREUjQUxFCklSQSMjTU9BVFMjI1RBUgpOT1IjRkFMU0UjQkVFVFMKVFJBUEVaRSMjREVDUkVFCiMjU09SRSNTVEVFTCMjIwpMRU1PTiNGTEFUUEFJTlQKQVZJRCNBTElLRSNJREVBCkNFTEwjSElERVMjUk9BTQpLTkVFI1NQRU5UI1NTVFM="},{"title":"3/17/09 GREEN MENU","author":"by Sally R. Stein, edited by Stanley Newman","date":"2009-03-17","grid":"U0xBTVMjQ0FUUyNHT1ZUClRPUElDI0FMT0UjVVNFUgpBVE9ORSNNSVRFI0FMVE8KU1RSSU5HQkVBTiNDT1NUCkhPVCNUT08jTElNQSMjIwojIyMjU09EUyNOQU1JTkcKQVNBUCNESUUjI1JPREVPClRIQUkjU0FORFMjTEVBRApNT1JTRSMjREVDI0VBVFMKU0VQVEVUI1NDT1QjIyMjCiMjI0FMT1QjUlVFI0ZMQQpDSElDI1dBVEVSTUVMT04KTEFTSCNBQkJBI1BSSU5UCkFMQUkjUk9TUyNMSU5FUwpZT1lPI0RPUEUjRU5UUlk="},{"title":"3/18/09 BY THE NUMBERS","author":"by Norma Steinberg, edited by Stanley Newman","date":"2009-03-18","grid":"TUFMVEEjSkVCI0NOT1RFCkFMRVVUI0VQQSNET1ZFUgpTUEVOVCNET1MjU01FQVIKVEhSRUVTSVhUWSNJUktTClNBWVNTTyNZRUFSTiMjIwojIyMjVE5UIyNLT0FMQVMKU0FSQSNOQUdTI1NUQVZFClRXRU5UWUZPVVJTRVZFTgpFUklDSCNUT1JJI0RBUlQKTVlERUFSIyNFTkMjIyMjCiMjI1NOQUdTI0dPTEZFUgpGSVNUI05JTkVPTkVPTkUKSU5UT1cjUk9EI0ZPUlRFClNUQVJFI0xPRyNBTkdFTApIT1JTRSNTUFkjQkVFUlM="},{"title":"3/19/09 WHAT'S BUGGING YOU?  By David W. Cromer","author":"by WHAT'S BUGGING YOU?  By David W. Cromer, edited by Stanley Newman","date":"2009-03-19","grid":"QklDI1JFTkFMI0FXQUlUCkVSUiNFTElTRSNST1VHSApWSUkjVElDS1RBQ0tUT0UKRU5DTE9TRSNCUkEjT1JFCkxBS0VSIyNCRVJORSMjIwojI0VOVElDRSNFQVJGVUwKQUxUI1NOT1JUUyNBTFNPClJVQlMjVFJFQVQjU1lOQwpBTEFJI0VOVFJFRSNCQUgKQlVUTEVSI1RFRU5TWSMjCiMjI0xJTkRBIyNHT05HUwpJQU4jRkFSI1VSQU5JVU0KRkxFQUZMSUNLRVIjR0lBCkZPT1RFI0ZJRU5EI0hETApZRU5UTCNUQVNURSNURUw="},{"title":"3/20/09 HOLD YOUR HORSES","author":"by Richard Silvestri, edited by Stanley Newman","date":"2009-03-20","grid":"TFVMVSNSQUJJRCNQTFVTCk9USVMjRU1PVEUjTEFTVApHQVZFI1RPTkFMI0FVVE8KI0hFUk9BTkRMRUFOREVSCiMjIyNXSUcjIyNORUVEWQpCQUNBTEwjU0NPT1QjIyMKQUxBUyMjU1RPT0QjRkVaCkpVTVBJTlRPVEhFRklSRQpBTVAjUkVJTlMjI0FTQU4KIyMjSE9BUlkjTkVYVFRPCkFTVE9OIyMjTEVUIyMjIwpTUE9OU09SUkVMQVRFRCMKQ0lURSNSQUlOUyNBUVVBCkFSRVMjRVJBVE8jTVVTVApQRVNUI01FTE9OI1BJS0U="},{"title":"3/21/09 SATURDAY STUMPER","author":"by Raymond Hamel, edited by Stanley Newman","date":"2009-03-21","grid":"QURBTVMjUFJFU09SVEVECldJTE1BRkxJTlRTVE9ORQpST0JFUlRPQ0xFTUVOVEUKWVJTI0FMVEUjV0lTRVNUCiMjI1VTRVMjUEFVIyMjIwpNT05ST0UjV09STUlFU1QKQVZBU1QjU0VORCNNTExFCkNBU1VBTFRJRVNPRldBUgpFVEFMI0VBUlMjQlJFTlMKU0VMQVdBUkQjQURFU1RFCiMjIyNJS0UjR0xVRSMjIwpUQUhJTkkjRE9VUiNGRVoKT1JBTkdFTUFSTUFMQURFClJBSVNFU1RIRVNUQUtFUwpJTU1PUlRBTFMjRVhFUlQ="},{"title":"3/22/09 NO \"I\" IN PUZZLE: Not in English, anyway","author":"by Merle Baker, edited by Stanley Newman","date":"2009-03-22","grid":"VEVSUkFDRSNFTEJFI0RBQlMjR01DClNXRUVUT04jWE9VVCNPREVBI09BUgpLRUVQVVBUSEVHT09EV09SSyNPTk8KIyNORUIjSE9NRVkjRVNQUkVTU09TCk9NQU4jQ1JPUCMjQUxFVEEjTkVXUwpORUNUQVJPRlRIRUdPRFMjU0VHQUwKQ0FUU0NBTlMjQU1PUyMjVEhFT1JZCkVMUyNFVkUjI0xBRyNDSEVFUlMjIwojIyNFUkUjVEhFR09BSEVBRCNTQVcKU0NSVUIjQlJBU1MjTEFSUyNGQUxBClRPVVIjWUVBU1QjVEVSU0UjVUdMWQpMT0JPI01HTVQjQkVSVEgjVFJFWVMKT0xFI1NDQVBFR09BVFMjS0VZIyMjCiMjR0xPQVRTI1JPQiMjU09OI09UUwpTVE9PUFMjI0dBWkEjU09SRVNQT1QKQVJMRVMjWU9VVkVHT1RNRVRIRVJFCk5PRFMjUEFOQVkjI1JFQkEjRVJPUwpKT0JTRUVLRVIjQVNORVIjTEVFIyMKT1BFI1RBS0VET1dOQVBFR09SVFdPClNFUiNBQ0VZI0ZSQVQjUk9QRVRPVwpFUkcjU0VSRSNUWVBFI09WRVJBV0U="},{"title":"3/23/09 SPRING SPRUCE-UP","author":"by Gail Grabowski, edited by Stanley Newman","date":"2009-03-23","grid":"QU1BIyNBUk1TI0NIQVNFClNJUFMjQkVFUCNET0NLUwpJREVBI1NBTEUjU1RSSVAKRklYVEhFTUVBTCNURU5OCiMjI0RFTiNFUkFTRSMjIwojUFJPTlRPIyNTTEFMT00KU0xBVyMjQVJJU0UjQVZBClBBSU5UVEhFVE9XTlJFRApBTkQjUk9VR0UjI09HUkUKTUVTU1VQIyNNQUdORVQjCiMjI1dFSUdII05BUCMjIwpEQVJFI0NMRUFOQlJFQUsKRVdFUlMjQUxUTyNPR0xFCkJSQVZPI1NMQVkjU0FTRQpUWVBFUyNTT0RTIyNET04="},{"title":"3/24/09 THAT'S SHOE BIZ","author":"by Sally R. Stein, edited by Stanley Newman","date":"2009-03-24","grid":"SVZFUyNUQVRBI0JPT1RTCk5FUk8jQVZPVyNFUk5JRQpUUklNI0JPT1IjQURVTFQKTEFDRURPSUxZI1ZFU1RTCiMjI1RST0QjI0hFUiMjIwpQQVRJT1MjU1RBUiNOQ08KQUxBTU8jUE9PUiNTT0FSClNPTEVQUk9QUklFVE9SUwpUVUVTI1RSVUUjTUFOR08KQURTI1dFRVAjUElHRU9OCiMjI0lSUyMjR0FURSMjIwpTSEFERSNQT0xJU0hPRkYKUEVTVFMjVVBPTiNBUklBCkVBVEFUI01FQVQjTkVTVApDTE9HUyNBTlRTI0RPVEU="},{"title":"3/25/09 PUT UP WITH IT","author":"by Fred Piscop, edited by Stanley Newman","date":"2009-03-25","grid":"TElNQVMjQUJMRVIjQkVFCkFET1JFI1BBSU5FI1JFWApCRUFSV0lUTkVTUyNPUkEKU0FORSNCRUcjSEVST0lDCiMjI1NQQVIjQlJBQ0tFVApNQVNURVIjVE9JTEFUIyMKQVNURVIjUkVJTlMjUk9XCkNIQUQjUEFSU0UjR09ORQpLRU4jREVOU0UjVFJVQ0UKIyNEUkVER0UjQUJBVEVECkhBU0FTQVkjR0xBRCMjIwpPUFRTSU4jQUxFI1VTU1IKVVJJI1NUT01BQ0hBQ0hFClNJTCNUSVJFRCNFVEFJTApFTEwjU0NFTkUjUEVOTlk="},{"title":"3/26/09 PIECEMAKERS","author":"by Bruce Venzke, edited by Stanley Newman","date":"2009-03-26","grid":"VU1QUyNBWlRFQyNTQU1FClNPT1QjU0VFTkEjVFJFWApET09SQlVTVEVSI1JPU0EKQURMSUIjVE9SRSNFREFNCiMjI0ZBQiNOT0ZVTiMjIwpPUEhFTElBIyNVUkdFTlQKQkVBI0xPR1NQTElUVEVSCkVOSUQjI1VBRSMjSEFSRQpTQUZFQ1JBQ0tFUiNJVkUKRUxBUFNFIyNFTkFCTEVTCiMjI0xJQVJTI0RJRSMjIwpKVURPI0xFTkEjU0NPVFQKQUhPWSNJQ0VCUkVBS0VSClJPVkUjWk9SQkEjTEFSQQpTSEVEI0VOVFJZI01ZTVk="},{"title":"3/27/09 METROPOLITAN DIARY","author":"by Donna S. Levin, edited by Stanley Newman","date":"2009-03-27","grid":"UE9QRVMjTUFMTCNHRUxTCk9QRVJBI09LSUUjQU5FVwpJVFRBS0VTQVZJTExBR0UKIyNBU1NOUyMjRklMTUVEClNUTCMjREFNTiNOT09ORQpBUlVCQSNERUlDRSNSRFMKU09NQUxJI0FNQklUIyMjCiNUQUxLT0ZUSEVUT1dOIwojIyNFQVRVUCNSRVRPT0wKTkFQI0xBU0lLI01FUkdFCklSQU5JI1NFRUQjI1JPRApTT0xPTkcjI1RPREFZIyMKU1VNTUVSSU5USEVDSVRZCkFTRUEjSURPTCNFUk5JRQpORVJEI0RPTUUjREVHQVM="},{"title":"3/28/09 SATURDAY STUMPER","author":"by Doug Peterson, edited by Stanley Newman","date":"2009-03-28","grid":"UExBU01BVFYjU1RSQUZFClJFTUFSUVVFI1BVQkxJQwpPVkVSVFVSTiNFWElMRVMKV0FORyNBQkRVTCNTSUxUCkFOREVTI0FJU0xFI0FEQQpSVFMjUEVOTkUjSkFORVMKIyMjUEVMRUcjREVTQ1JZCiNGT1JDRURNQVJDSEVTIwpIRVJPSUMjQUdBVEUjIyMKQUJJREUjQUNVVEUjQlJPCk1SRSNTQVlISSNEUklFUgpMVU5LI05FSUxMI0lPTEEKRUFUT1VUI05FT0xBVElOClRSRUFUUyNFUlVQVElORwpTWURORVkjU0FEU0FDS1M="},{"title":"3/29/09 LET'S SEAT: Featuring edible wordplay","author":"by Gail Grabowski, edited by Stanley Newman","date":"2009-03-29","grid":"RkxPVyNBTE9ORSNTV0FCI1dSRVNUCklPVEEjUk9CSU4jVEFSQSNBT1JUQQpTQ09STkJSRUFEI0VWSUwjU1BJRUwKVEhFTU9PUlMjU0NSRUFNQ0hFRVNFCiMjI1NUUkVFVCNBTkRTI1VSSSMjIwpXQVNURVMjI0lNUFMjI0ZJQU5DRUUKUklDTyMjQ0FDQU8jT1JJTkcjT0FSCkFEQSNDSElDS0VOU1dJTkdTI1VSTgpQRU4jUklERVMjI0lOTlMjI0FOVEkKU1NOI0lERUQjTFVSRUQjVElQVE9FCiMjRUxNRVIjVEFTRVIjUEFQRVIjIwpFRERJRVMjREFURUQjQ0FNTyNZRVMKTUFDRSMjTElDSyMjU0VXRUQjU1JPCkFSUiNQT0FDSEVEU1BFQVJTI0hPVwpMRUEjQU5ERVMjUk9PU1QjI01BREUKTElCRVJUWSMjTUFZTyMjQk9PTUVECiMjI0FUQSNBU0FQI1JBVEVEUiMjIwpTSFVTSFBVUFBJRVMjTUlTREVFRFMKQ09SRVIjU0hPRCNBUFBMRVNQSUVTCkFOR0xFI01JS0UjVkVMRFQjQVJBVApSRUVTRSNBREVOI0VQRUVTI1lFTlM="},{"title":"3/30/09 BROWN-BAGGING IT","author":"by Gail Grabowski, edited by Stanley Newman","date":"2009-03-30","grid":"I1NOQVAjWUFSRCNSQU1TCk1PT0NII0FMU08jQUJFVApBTE9IQSNDQVZFI1dBREUKUE9LRVJDSElQUyMjVElFCiMjIyNNQVQjI09IREVBUgpJTlNFQU0jQkFLRVIjIyMKUk9UUyNFVEFMI0VBVEFUCktOVUNLTEVTQU5EV0lDSApTRURBTiNMRU5PI09OQ0UKIyMjUEVFTFMjTklORVRZCkNBUkVFUiMjU09OIyMjIwpPVUkjI0FEQU1TQVBQTEUKT0REUyNTT1JFI0pVUk9SClBJRVMjRVZJTCNBTUVCQQpTT1JUI1NFQUwjTUFaRSM="},{"title":"3/31/09 TAKE IT SLOW","author":"by Billie Truitt, edited by Stanley Newman","date":"2009-03-31","grid":"U1RBSVIjU0xBVCNHQVJCClRFUlNFI1RBTEUjSURFQQpPQ0VBTiNBVE9NI1ZBTlMKV0hBVEFDUkVFUCNFUEVFCiMjIyNNQVQjI0VMQVRFRApEUkFXRVIjSEVST04jIyMKUk9NQSNEUkFUI1RJUkVTCkFCRVQjU09MQVIjTk9URQpHRU5FUyNNT0xFI0NBTkUKIyMjUkFNUFMjVEVIUkFOClBSRVNUTyMjV0lOIyMjIwpMT1ZFI0RPVEhFQ1JBV0wKQUJFRCNFUklFI0FVRElPClpJTkcjU0VOVCNTVEVQUwpBTlRFI1RPVFMjRVNTRVM="},{"title":"4/01/09 FROM HAIR ON DOWN","author":"by Norma Steinberg, edited by Stanley Newman","date":"2009-04-01","grid":"Q0hJVCNBQ0hFUyNFVEFMCkFFUk8jUFJPVkUjWU9HSQpCUk9XQkVBVEVOI0VLRVMKU09OTlkjVkVOVCNDRU5UCiMjIyNSRUVMI0ZST05UUwpUVVJOT05TI0xPT04jIyMKT05JT05TI0JBUklUT05FClNJUFMjI1JVQiMjQVZPVwpTVEVFUExFUyNFU0NBUEUKIyMjQVJJRCNUQVRUTEVTClNIQVJPTiNCQVJSIyMjIwpQT0xPI0VSUlMjQUxWSU4KTFVMVSNNT1VUSFBJRUNFCkFTQU4jRU1DRUUjUFJPVwpURU5EI05FRURZI1NBTlM="},{"title":"4/02/09 VEGAS VICTORIES","author":"by Shirley Soloway, edited by Stanley Newman","date":"2009-04-02","grid":"QUJDUyNTQUxBRCNCUkFECkxFT04jQUxPTkUjTEFJUgpBTk5BI0xBVURTI0FXUlkKU1RSSUtFSVRSSUNIIyMjCktPQUxBIyMjRUdPU1VSRgpBTkQjUE9SQ0lORSNOT1QKIyMjUVVPVEEjIyNTVFVECiNISVRUSEVKQUNLUE9UIwpNQVJZIyMjVU5EQVkjIyMKQUxBI0hPUk5JU1QjU0NJCkNPTkNFREUjIyNJTkNBTgojIyNCUkVBS1RIRUJBTksKSkFNUyNTUElSRSNBUlRJCkZMQVQjU0VSVU0jRUNPTgpLSUVWI0FSSUVTI1JFTkQ="},{"title":"4/03/09 A HOCKEY PLACE","author":"by Fred Piscop , edited by Stanley Newman","date":"2009-04-03","grid":"U1RFRVIjUEFJTlMjUE9NCktBTkdBI0VORFVQI1VQQQpJTlZPSUNFREFURSNCQVIKIyMjI05BVlkjU0NVTExTClNBTFRJTkUjIyNLTklTSApDTEFSRVQjWklQTE9DIyMKVVRURVIjTU9WSUUjRVBTCkZBVEUjTU9ORVQjU05BUApGUkkjSkFERVMjREVFUkUKIyNDT09QRUQjQ0FSTUVOClNURUlOIyMjQVJSQVlFRApIT1dMRUQjQU1PSyMjIyMKSUdPI1NFUlZJQ0VBUkVBCkZBUiNFTElPVCNOT0JFTApUU0sjU1RPTlkjU0tJTEw="},{"title":"4/04/09 SATURDAY STUMPER","author":"by Merle Baker, edited by Stanley Newman","date":"2009-04-04","grid":"U01BTExTQ0FMRSNIQUlSCkhBU0FTSE9UQVQjVVRORQpST0FEVEVTVEVEI01JUkEKRVJJIyNTVEFSUyNQVEVSCldJUkVEI05JVCNJSEFWRQojIyNTQU1FTkVTUyNHRU4KU0hBVE5FUiNTRUFXQVJECk5PQk9EWSMjI0NIQUlTRQpBVVNTSUVTI1NURUlORVIKUFNUI0ZST1dOU0FUIyMjClBFQVRZI1RIRSNERUFMUwpFTUlSI0FURUFNIyNERUkKREFORSNUSU5LRVJTREFNClVURVMjQVNDRVRJQ0lTTQpQRURTI1RIRVJBUElTVFM="},{"title":"4/05/09 SHORT SUBJECTS: How to leave things off","author":"by Doug Peterson, edited by Stanley Newman","date":"2009-04-05","grid":"Q0lBTyNBRlJPUyNCVVNUI1NUUkFQCkFOTkEjR0lBTlQjQU5LQSNPUk9OTwpET0NLV09SS0VSI0NMSVBKT0lOVFMKI1JFTFkjU0VQI0tPSSNTVU5GSVNICiMjU0VOQVQjQUtJTlRPI1NFTCMjIwpDVVRBTkREUklFRCMjVVBUUkVORCMKQVNPRiNIT0FSWSNFU1RFUyMjRUVOCkZEUiNMRVdEIyNTTElDRU9GTElGRQpFQVNURVJOI0xBTUlOQVIjVElNRVIKIyMjT1dFI1RJS0kjQ1NBI1NUQU5EClRTQVIjU0FXUEFMTUVUVE8jQU5EWQpBQ1JFUyNSSUIjRUFSUyNSSU4jIyMKTEFSVUUjQU5BTFlaRSNDTE9ZSU5HCkNST1BDSVJDTEVTIyNDQUFOI09VSQpTQVkjI1JBSU1JI0FDT1JOI0VOVFMKI0JPWUNPVFQjI1BSVU5FREFOSVNICiMjI0FMQiNZT1VTRUUjVE9OR0EjIwpWQU5QT09MI0FQVCNCT0EjVFVOUyMKQ0hPUFNUSUNLUyNIQUNLV0lMU09OClJFTkVFI0VSSUUjQUxURVIjRkVUQQpTTUFSVCNOWUVUI0dMT1JZI1NBU0g="},{"title":"4/06/09 AUTO OPTIONS","author":"by Gail Grabowski, edited by Stanley Newman","date":"2009-04-06","grid":"UEFTUyNBU1BFTiNDTEFNCkFSRUEjQ0hJTEUjSE9QRQpMSUxUI1JBTkFUI0lDRVMKTUFMRU1PREVMI0NMQVNTCiMjI0VBU0VTI0hBTEwjIwpTUEVORFMjI0NPUFlDQVQKVEVBUyMjQVJFU08jT0xFClJOUyNCUk9BREVOI0xPUApBTlkjUkFOR0UjI0dPTkUKUEVUTkFNRSMjRU1FUkdFCiMjT0FUUyNCQUNPTiMjIwpTRU1JUyNISUdIU1RZTEUKT1BBTCNST0RFTyNMT0lOCkRJS0UjQUxPTkUjRVlFRApBQ0VEI1RFTlRTI1JPRFM="},{"title":"4/07/09 TOPICAL FRUIT","author":"by Sally R. Stein, edited by Stanley Newman","date":"2009-04-07","grid":"Rk9XTCNST09NI1RBQ0lUCkFSRUEjQUNNRSNFUk9ERQpEQVJOI0JFRVMjTklORVMKU0xFRCNCQU5BTkFTRUFUCiMjI1NISU4jI09ORSMjIwpTUElDRVMjU0xJVCNSQVQKQ0FOQUwjRFVFUyNUQUxFCklOQVBQTEVQSUVPUkRFUgpGSU5FI0FMRVMjUEFJUlMKSUNFI1NUSVIjREVOT1RFCiMjI1NIRSMjT1dOUyMjIwpXRVNUT1JBTkdFI0ZBUk0KQUJIT1IjRkVMTCNPSElPClRBSU5UI1JFRUwjUk9PVApUWVBFUyNPRERTI01ZVEg="},{"title":"4/08/09 LEAP DAY","author":"by Daniel R. Stark, edited by Stanley Newman","date":"2009-04-08","grid":"VEFCUyNLQVRFI1JPTUUjCk9SQUwjRU1JVCNBV0FTSApUSU5ZI1lPS08jRkxVVEUKT0FLI1NQUklOR0ZFVkVSCiMjVklUQUUjI0FMVEVSUwpCRUFERUQjQUNNRVMjIyMKQURVTFQjU0VMRVMjSkFZClJFTFkjQ0lHQVIjQ1VCRQpUTlQjVFVMSVAjU0FNQkEKIyMjUEFSVFMjUEFNUEFTCkVRVUFMUyMjRklORVMjIwpNVVNDTEVCT1VORCNUQVAKTUlBTUkjT1ZFTiNQQVJFCkFMR0FFI1NBR0UjVFJFRQojVEVORCNDTE9EI1NUQVI="},{"title":"4/09/09 DIFFERENCES","author":"by Shirley Soloway, edited by Stanley Newman","date":"2009-04-09","grid":"QkFSQiNBSEFCI0NFU1RBCk9MRU8jTE9ORSNSRUhBQgpTT0xPI0JPV0UjRUxJVEUKQ0hBTkdFSEFORFMjRkFUClNBWCNMSUFSI0VUQVQjIwojIyNPVVRTI1NNRUxMRUQKT1JBTkcjI1RPT0RMRU9PCldJTFQjQ0xBV1MjSVNOVApOT1RBR0FJTiMjSkVTU0UKU1RFUE9ORSNSVUVTIyMjCiMjUkVFRCNTSVRFI0NVWgpBR0UjU1dJVENIUExBVEUKU0lHTUEjSEFIQSNPTlVTClNMT09QI09WRU4jU09SVApUQVNURSNQRVNUI0VFTlk="},{"title":"4/10/09 WITH EASE","author":"by Fred Piscop, edited by Stanley Newman","date":"2009-04-10","grid":"QVJJQSNHSE9TVCNBUktTCkxBU1MjUkFESU8jUkVORQpBTlRJI0FHRU5UI09ORVMKIyNIQU1CVVJHRVJNRUVUCkFIQSNPTEUjIyNFQUdMRQpTRVRURUUjTFVTSCNFU1QKUEVTTyMjRklSRUFUIyMjCiNQT1VORElOR0FCRUVUIwojIyNURUVWRUUjI1NUT1AKTlVTI0hFRUQjRE9UQ09NCk9TQ0FSIyMjU0VXI0VMUwpIRVJDVUxFQU5GRUVUIyMKSVNJVCNBVFdBUiNSRVNUClRVQkUjTUFSSUEjSVJPTgpTUEVEI1NMWUxZI0NBTlQ="},{"title":"4/11/09 SATURDAY STUMPER","author":"by Doug Peterson, edited by Stanley Newman","date":"2009-04-11","grid":"V1JJTkdTIyNSQVRDSEVUCkhPTk9SRSNMQUJPSEVNRQpJQkVSSUEjSUdOT1JFSVQKTU9aQU1CSVFVRSNPUFRTCiMjIyNNRU5VI1JPTiMjIwpDQVJQI0RST1BTSE9UUyMKSEVBUlRTT1JFI0FMQlVNCkFSTklFI0FDRSNST09TVApST1VTVCNEQVJUQUdOQU4KI1NQT1JUU0JBUiNZRU5TCiMjI05BRSNJR0VSIyMjIwpMSU1ZI0pBTkVBVVNURU4KRVNDQVBBREUjQ1JPQUtZCkNMQVJJTkVUI0xBVURFUgpIQU5EU09OIyNFTFBBU08="},{"title":"4/12/09 TOOTY-FROOTY: With the theme revealed at 126 Across","author":"by Fred Piscop, edited by Stanley Newman","date":"2009-04-12","grid":"RE9OQVQjRVJFI09UUyNPSE0jU0VBCk9IQVJBI0JPTkFJUkUjTE9BRElORwpMSVRUTEVCT1lCTFVFI0VOR0FSREUKTE9PU0VSI0tBTEIjTVVTS0VURUVSCiMjIyNTSVJTI09BVEVSI0VMQU5EIwpESU9DRVNFIyNPUk8jQURETCMjIyMKRUxMQSNBVVRPTU9CSUxFI0FDTUUjCkFJRFMjI1BPUyNORUQjTUFOSFVOVApSRVNJTiNTQVNIIyNTVEFUI0FTVE8KIyNDT09MI1NJRU5BI09OTyNUSUVSCk5PUiNXRVNURVJOU0FERExFI0NSWQpPUEFMI09XRSNCRUFSRCNMQUJTIyMKVkVUTyNORVJEIyNQT0xLI1RPVEVECkFSQ0FESUEjQ09QI1NFTiMjUk9NRQojQUhNRSNSSElOT0NFUk9TI0VSSU4KIyMjI1BFU08jT0xBIyNMQU5ERVJTCiNMQURFTiNST1JFTSNBTERBIyMjIwpWSUtJTkdIQVQjQlJFVyNJVFNBR08KQU1SQURJTyNUSEVZSEFWRUhPUk5TClRPT0xPTkcjRVJBU1VSRSNBUklBTApTU04jTkVHI1JFTiNERFQjTkVBVE8="},{"title":"4/13/09 WHERE YOU LIVE","author":"by Billie Truitt, edited by Stanley Newman","date":"2009-04-13","grid":"TU9BTiNBU1BDQSNDT1BZCk9STk8jTFVMTFMjVUNMQQpDRU5UI1RSVUVTI1JFQVIKSE9VU0VPUkdBTiNWQUlOCkFTTE9XI0VTVCNNRU5EUwojIyNIRVdOIyNXRUQjIyMKT0hJTyNBRERTSU4jU0FECkNPVFRBR0VJTkRVU1RSWQpURUUjRk9SR09UI1RZS0UKIyMjQkFOIyNXSE9BIyMjClNUQUlSI1dFVCNBR0VOVApUVU5BI0NBQklORkVWRVIKRUxLUyNBRE9SRSNNQVJFCk1JTEUjUkVORVcjT0REUwpTUEVEI1RSWVNUI01FU1M="},{"title":"4/14/09 THREE COUPLES","author":"by Gail Grabowski, edited by Stanley Newman","date":"2009-04-14","grid":"VElFUyNFTFZFUyNQT1NFClVSR0UjTkVBVE8jRVZJTApCT0dBUlRBTkRCQUNBTEwKQU5ZI0FSS1MjI0hBTExTCiMjI1NUQVkjU0NBTiMjIwpIT1RUSVAjVEhBVFNJVCMKVVJCQU4jQ09BTCMjTkVUCkdFT1JHRUFORE1BUlRIQQpTT04jI0VER0UjU0lSRU4KI1NFVFRMRVMjUkVET0VTCiMjI09VU1QjSEFWRSMjIwpBQ09STiMjU0FORSNTUEEKSEFOU0VMQU5ER1JFVEVMCkFNTU8jRUxJVEUjU0VBTApCRUVTI0dBVE9SI1NQUlk="},{"title":"4/15/09 SMOOCHY","author":"by Fred Piscop, edited by Stanley Newman","date":"2009-04-15","grid":"QURBTVMjI0JPREUjQ09QCkxBUEVMI0dPUkVTI0FCRQpHUkVHT1JZUEVDSyNOT04KQUlSI0dFTVMjTElOREVOCkVOU0lHTlMjQ0FNQVkjIwojIyNCRUUjQVJST1dLRVkKSE9TRUQjRlJFRVMjSVJFCkFMT1QjVElNRUQjSVNJTgpOSUwjVFVORUQjQ0FTRVMKR09WRVJORUQjQ0FNIyMjCiMjRVZFTlMjTE9NQkFSRApERUZBTUUjS0FORSNSSU8KSVBPI0JMVU5ERVJCVVNTClBFUiNMRVJPWSNBTEJFRQpTRVgjRURJVCMjU1RBUlM="},{"title":"4/16/09 STICKS AROUND","author":"by David W. Cromer, edited by Stanley Newman","date":"2009-04-16","grid":"UEFQQSNBQ1RTI1VTSEVSCkFNRU4jU0xJUCNQSUVUQQpOT1JUSFBPTEUjU05BUkYKRVNURUUjTkVXI0VHUkVUCiMjIyNSRUVEI1NUTCMjIwpGTEFWT1JTI0lOU0VDVFMKUkVNQURFI0FQVSNTRUFMCkFUT00jQ0FST0IjQkFLRQpUQVJQI1RJQyNCSUFTRUQKU1RFSU5FTSNSRURSRVNTCiMjI1JJRCNST0RFIyMjIwpSSVBFTiNDQUIjQVJPTUEKQURPQkUjTElPTlNDTFVCCk1PTEFSI0FTVE8jTUVURQpTTE9UUyNORVNUI1BPRVQ="},{"title":"4/17/09 CAMPAIGN TRAIL","author":"by Doug Peterson, edited by Stanley Newman","date":"2009-04-17","grid":"V09OS0EjQVBTRSNDQVJUCkVNQUlMI0xFVE8jVVRBSApCQVRUTEVCT1JOU1RBVEUKQlJPUyNQSU5BI0FVREVOCiMjI0NBUE4jR1VNUCMjIwpGSUdIVFNPTkdTI1NIQVkKT1hFWUUjI0VMU0EjQUNFCkFOVCNBTlNXRVJTI0dVTgpMQU8jTU9QRSMjS01BUlQKU1lOQyNXQVJBRE1JUkFMCiMjI0VQSUMjS0VFTCMjIwpNRUFERSNFVklMI0xPT1AKRU5HQUdFTUVOVFJJTkdTClRJRVIjREVOVCNIT1VSUwpBRERTI1VORE8jT05TRVQ="},{"title":"4/18/09 SATURDAY STUMPER","author":"by Sandy Fein, edited by Stanley Newman","date":"2009-04-18","grid":"Q0hBUlRFUiNBU0tBTkNFClJFTU9SU0UjRkVFREVSUwpFTElUSVNUI1RFTlNQT1QKQU1DI0dBSVRFUlMjQVBFClRTQVIjWUVBUlMjU0xVUgpJTUJFRCNTUFkjUVRJUFMKVkFMREVaI1NPTEFSIyMjCkVORU1JRVMjVVBUSUxUUwojIyNPQ0VBTiNTQUZBUkkKQUxJTkUjTEVFI1JFTUlYCkJPTkQjVklPTFMjU1BBVApPSUwjU0VOTkVUVCNQU0kKQVRPTklORyNDQUJPT1NFClJFVkVOVUUjVFJBTlNJVApEUkVER0VSI1NUUkVUQ0g="},{"title":"4/19/09 BACK NINE: With something to hide","author":"by Pam Klawitter , edited by Stanley Newman","date":"2009-04-19","grid":"UEFTU0UjIyNVU0FHRSMjWkVOSVRICkFSTUlORyNPTkVTSUUjTE9SRUxFSQpDUklNRUEjV1JJVFRFTklOU1RPTkUKS0lMTyNSRUxJTkVTI0FCRVQjIyMjCkVWRU5JTlRFR0VSI0JPWVMjQkxBSApSRVMjTkVBVCMjI0JBTUEjUEVBTEUKIyMjQ1RSTCNBTElFTklOVkFTSU9OClJPREVPUyNHTE9SSUEjI0FMRVJUUwpPUFVTIyNUT09LT04jQVNTRVQjIyMKTUFUVEdST0VOSU5HI1dBVFQjQVNLCkFSQyNMRUFTRSMjI1ZBTEVUI0xJVgpOVEgjVVNEQSNBTk5BS0FSRU5JTkEKIyMjREVJU1QjTU9PUkVEIyNVVEVTCkJFQVJEUyMjUEFUT0lTI0FMTE9XUwpBTk5FVFRFQkVOSU5HI0VMQUwjIyMKTElOR08jQVJFQSMjI0tMVU0jR1VTCklET1MjUVRJUCNDSEVOSU5CTEFOQwojIyMjU1VJVCNMSU9ORVNTI09SQ0EKQVNQRU5JTlNUSVRVVEUjRU5EQUxMClBPT0xJTkcjUkVFU0VTI1JFR0dBRQpFWEVNUFQjI0FEREVSIyMjV0VFRFM="},{"title":"4/20/09 EDITORIAL","author":"by Gail Grabowski, edited by Stanley Newman","date":"2009-04-20","grid":"Q0FOSVQjUEVFUiNDSE9QCkFSRVNPI0FDUkUjSFVNUwpGSVhMVU5DSEVTI0FMRVMKRUFUI1RPVE8jVEVOQU5UCiMjI1BFVFMjUE9ORyMjIwpERUNPREUjI09SREVSRUQKT1JBTCNTVE9MRSNQQUxFCk5PUkkjI09BSyMjVU5JVApPREVTI1NUUkFQI1JBVEUKUkVTSEFQRSMjUk9TVEVSCiMjI1NURU0jTk9QRSMjIwpXQVNITUUjU09NRSNMQVAKT0hJTyNET0NUT1JCSUxMCk9PWkUjRVJBUyNBTEFNTwpEWUVTI1JFTk8jU1RSQVc="},{"title":"4/21/09 THAT'S FOR SURE","author":"by Sally R. Stein, edited by Stanley Newman","date":"2009-04-21","grid":"Q1BBUyNCQUJBI01BTk9SCkFMVE8jT0xFUyNPTElWRQpTVUVSI1JPT1QjVk9DQUwKRU1JVCNERUZJTklURUxZCkRFTk9URSNGUkVFIyMjIwojIyNGVVJZIyNFU1RFRU0KVEhFI0JPTUJTIyNXT1JFCllPVUNBTkNPVU5UT05JVApQQVJBIyNBTk5PWSNTRUUKRVhPVElDIyNTQUtFIyMjCiMjIyNET1JNI0hFTE1FVApCWUFMTE1FQU5TI1BPTE8KRUVSSUUjQVJFQSNBTElUClNMSUVSI0xJQVIjU0FURQpTUEFOUyNNQVJLI09SRVM="},{"title":"4/22/09 MARKET BASKET","author":"by David W. Cromer, edited by Stanley Newman","date":"2009-04-22","grid":"UEFXI0ZFVURTI0FMSUJJClVHSCNMQVBFTCNNSUxFUwpCUk8jVVRJTElUWUJJTEwKU0FMQU1JI0lEQSNSQVRFCiMjRVZFTlQjI0JSQURTIwpMSU5FI0dBTUJMRVMjIyMKQURPUk4jUk9MRVMjSklNCk1PVFRPI1BUQSNUUkFDRQpBTEUjU0xJRVIjU0FNT0EKIyMjQkVBVExFUyNSRU5UCiNHUk9TUyMjU0lERVMjIwpMT0FOI0VFRSNUVVJCT1MKU1VNTUVSU1RPQ0sjT0xFCkFESU9TI1RBSE9FI05FVwpUQVNURSNBVE9NUyNET04="},{"title":"4/23/09 IN POSITION","author":"by Betty Keller, edited by Stanley Newman","date":"2009-04-23","grid":"Q0FDSEUjTUJBUyNQSElMCkFESE9DI0FPTkUjSElERQpMSUVET1dOT05USEVKT0IKTEVFUyNIQVQjSEVOIyMjCk1VUyNISUdIQyNST01QUwpFWEVDVVRFI0FJUk1BSUwKIyMjQUdFI0NOTiNFU1BZCiNTSVRPTlRIRUZFTkNFIwpBSURTI0VFRSNPUk8jIyMKUFJFQ0VERSNHUkFORFBBCkVTU0FZI1NDQU1TI09SUwojIyNORVQjTElFI1RXSVQKU1RBTkRVUEFORENIRUVSCkhPTEUjQk9SRSNCQUxTQQpIRUlSI1NUQVIjU0lMVFk="},{"title":"4/24/09 SAY CHEESE","author":"by Shirley Soloway, edited by Stanley Newman","date":"2009-04-24","grid":"Q0hBRkUjT0RPUiNKQU1TClJBUkVSI1NJWkUjVUhPSApBTkdFUiNMT09UI05BU0gKR09VREFNT1JOSU5HIyMjClNJRVNUQSMjRVJBI1NTVAojIyMjQVJDUyNFU1RBVEUKU0hBSCNDSEVEREFSQk9YCkFFU09QI0FNSSNMT1JDQQpGRVRBUkFUSU9OI1lBS1MKRUxJWElSI1NOQUcjIyMjClNTUiNPUkIjI1NBRERFUgojIyNCUklFTUFUVVJFTFkKUElUQSNWSUFMI0dPQkFECkRPV04jQUdSQSNFVklURQpRVUFEI0xFVFMjREVURVI="},{"title":"4/25/09 SATURDAY STUMPER","author":"by Doug Peterson, edited by Stanley Newman","date":"2009-04-25","grid":"U1RBQkxFUyNCQUhBTUFTCllFTExPV1NUT05FUEFSSwpSRVRJUkVNRU5UUEFSVFkKVVBFTkQjSU5ORVMjR0lMClBFUksjQU5ERVMjV0lGSQpZRVMjUElOT1QjUEVOSU4KIyMjQklET04jU09MQUNFCiNDVVJMRVcjTkVTVExFIwpDQU5PRUQjUkFURVMjIyMKQUxEQVMjQ1VQSUQjRFNMClRJRUQjTUFOT04jRkFMQQpGRVIjTEVOREwjVklORVMKSU5TVEFOVE1FU1NBR0VTClNURUFNTE9DT01PVElWRQpIRUFQU09OI05BUFNURVI="},{"title":"4/26/09 GOING NATIVE: Country-style wordplay","author":"by Shirley Soloway, edited by Stanley Newman","date":"2009-04-26","grid":"SEFSU0gjRkxPUkEjREFNUCNHT0FMCkFHQVBFI1JBVkVEI0FCQkEjRVJURQpOQVRBTCNPTUVHQSNSWUFOI1JFRUYKR1JFQ0lBTkFOSUdBTlMjQUxNT1NUCiMjI0VYSVQjI1NFTUlTI0NPQVNUUwpFTEJBI0RPVFMjTkVUI1NIVU4jIyMKQkVMR0lBTkVUSUNTI0RVRURBVEVTCkJJREVOIyNFRU5ZI0xFSSNJR0lWRQpTQUcjVFJBTVBTI1NFTlQjU0VEQU4KIyMjTU9PVCMjVEFQRVMjU0hSRURTCkVTU08jT01BTklNQUtFUlMjSVNFRQpTSEFSSUYjUE9MQVIjI0VUVEUjIyMKU0FUT04jRUxBTCNFTEFQU0UjUklCCkVSSUNBI0RVSCNBTUVSIyNBTU9SRQpTUEVDS0xFUyNGUkVOQ0hJTEFEQVMKIyMjQU5PTiNHQUIjU0hPRCNSRU5UCkhPQk5PQiNTRVJJRiMjTUlESSMjIwpBTEVSVFMjTEFPVElBTk9HUkFQSFkKVElWTyNURUFSI0VMTEVOI0FDVElWCkVWRUwjRVRUVSNSRVBBWSNXSEFMRQpERUxMI1JBU1AjU1RPUk0jTElTVFM="},{"title":"4/27/09 ROOMY","author":"by Gail Grabowski, edited by Stanley Newman","date":"2009-04-27","grid":"RkxBVCNST0dVRSNDSEFQCkxJTUUjQU1BU1MjRE9MRQpFVkVSI0ZBWkVTI0NMT0cKREVOTU9USEVSI0ZBREVTCiMjI0lERUFTI1NPU08jIwpMSUZURVIjIyNDTEVGVFMKRVJJRSMjRklOQUwjRkVXCkdBTCNTQ0VORVJZI0lDRQpBVE0jSEFETlQjI0FDSEUKTEVTU09OIyMjUFJJRVNUCiMjVEVFUyNTUEVBUiMjIwpHTFVFUyNTVFVEWUhBUkQKUk9EUyNPSEFSQSNPUkVPCkFSSUEjTk9WRUwjTEVGVApNRU9XI0VQRUVTI0VBU0U="},{"title":"4/28/09 TOP-NOTCH","author":"by Billie Truitt, edited by Stanley Newman","date":"2009-04-28","grid":"Q0FQUyNFTUVORCNPR1JFClJVTEUjTkVWRVIjQ1JBTQpBREFNI0RSRVNTI0NBVkUKRklORVBSSU5UI1RVTkVSClRPU1NPVVQjI1dJTERMWQojIyNUT04jR0lBTlRTIyMKQU5HRVIjQ09SSyMjTEFQClBVUlIjR0VOSUUjU0FNRQpFTkUjI09ERVMjVEFNUEEKIyNBTlNXRVIjQ0lJIyMjCk9CVEFJTiMjU0hFTExBQwpNRURJQyNTVVBFUkJPV0wKRUxBTCNBV0dFRSNPTkVBCk5JTkUjTUFMTFMjQUdFUwpTRUVEI1NUWUxFI1RTS1M="},{"title":"4/29/09 WOODWORKING","author":"by Fred Piscop, edited by Stanley Newman","date":"2009-04-29","grid":"Tk9DQUwjUExFQSNDQUxDCk9IQVJBI0VBU1QjQVRPWgpCQU5LQlJBTkNII1BJU0EKRVJFI0NPTEUjTEFUVEVSCkxFU1NPUlMjSEVSQSMjIwojIyNXQVkjUkFURklOS1MKT1BDSVQjUFVSRSNOT05PClJPT1QjV0lORVMjU1RFVwpDUk9DI0FMVU0jUExPV1MKQVRUSEVUT1AjV0hPIyMjCiMjI0JFRVQjTEFSR0VTVApWRVRPRVIjSE9SQSNMT0EKQVJFQSNCUkVBRFNUSUNLClRJRVIjRUFSTiNFVk9LRQpTRU5EI0RZRVMjU0FUT04="},{"title":"4/30/09 MEDIA MATES","author":"by Betty Keller, edited by Stanley Newman","date":"2009-04-30","grid":"QVNQUyNUU1BTI0FMVU1TCkxVUkUjVkVSQSNMRUdBTApTRUVNI0NFT1MjRkFMQ08KT1paSUVBTkRIQVJSSUVUCiMjI1NBTSMjQVRFIyMjIwpMRUkjVEVDSCNWU0lHTlMKRVROQSNST09GI0NPUk9UClRIRUxNQUFORExPVUlTRQpNQVJJTyNMRUlBI1NOSVAKRU5URVJTI1NDVUQjRFJTCiMjIyNOVVQjI0dVVCMjIwpDQUxWSU5BTkRIT0JCRVMKT0NFQU4jTE9PVCNPT1pFClNMQU5HI0VUUkUjTk9SQQpUVU5FUyNTRUFSI0VSQVM="},{"title":"5/01/09 WRAP IT UP","author":"by Doug Peterson, edited by Stanley Newman","date":"2009-05-01","grid":"U1BMQVQjUlVOQVQjR0FCCkFMQU1PI0VQT0NII09SRQpUQVBFTUVBU1VSRSNMSVYKQVRBTkVORCNORVdTREFZCk5FVFMjR1VNIyNIQU0jIwojIyMjUEFQRVJUT1dFTFMKQklHUklHI1dPVyNJRE9MCkVOUkFHRUQjVE9STkFETwpBUkFCI0lPTiNFQUdMRVQKUklCQk9OQ0FORFkjIyMjCiMjQklOIyNCQUcjTUFTUwpQUkVTRVRTI1JFSk9JQ0UKSEFEI0JPV0FOREFSUk9XCkROQSNJUkFOSSNLRUVORQpTR1QjVE9OR0EjRUxERVI="},{"title":"5/02/09 SATURDAY STUMPER","author":"by S.N., edited by Stanley Newman","date":"2009-05-02","grid":"R09JTkdQRkZUI0FQSElECkhJTUFMQVlBUyNOT09ORQpFTEVWQVRJTkcjVFJPVFMKVFJBSU5TI0pBWlpFRFVQClRVTkVEI0hFUk8jI0lJSQpPQklTI0hPVFBPQ0tFVFMKU1NUI0hVR1MjI0hFU1NFCiMjI0dVTVMjQ0hFVyMjIwpCUklORyMjUk9VWCNQRUMKTUVOVU9QVElPTiNGSUxBCk9UUyMjU0VDVCNTSVJFTgpWSVRBTUlOQSNQSVJBQ1kKSVRBTE8jRFJERU1FTlRPCkVMVE9OI0VETUNNQUhPTgpTRUVUTyNST0NLU1RBUlM="},{"title":"5/03/09 WHO'S WHOSE: Exploring possessiveness","author":"by Fred Piscop , edited by Stanley Newman","date":"2009-05-03","grid":"R0lWRVIjUFJJRyMjRVJJQyNCQUVaCkFHSUxFI0lPVEEjQVJFTk8jQUxEQQpCT0JTQklHQk9ZI0JSSUFOU1NPTkcKU1RFRVJBR0UjTE9CRUQjVklTVEFTCiMjIyNBTVkjQ09QRUQjREVDTyMjIwpDQVBPTlMjQ0FSUlkjRk9SI1NXQVQKVVBFTkQjI0FORFlTR0FORyMjQVJJCk1BVEUjU0VOVCMjI0FMT0UjRFlFRApJQ0UjI0NSQUlHU0xJU1QjUEVOTkUKTkVTVCNPSUwjQVRPTkUjSEFCRUFTCiMjRElKT04jU1RPUFMjTEVXSVMjIwpTT1JCRVQjQk9PTkUjTEVJI1RXQVMKVFJBSVQjSkVSUllTS0lEUyMjT1JFClJBR0EjU09MTyMjI05BU1QjR1JPVwpJTU8jI01FTFNESU5FUiMjUFVMU0UKUEFOVCNBWUUjRVBFRVMjV09OREVSCiMjI09VUlMjU0NPV0wjSE9QIyMjIwpIRUFSU1QjR09BRFMjQ09OVEVTVFMKQVJOSUVTQVJNWSNNT0VTVEFWRVJOClJJREUjRURBTVMjQUJMRSNSRUdJQQpNRVNTI1RPTUUjI0dJTEQjVFJBTVA="},{"title":"5/04/09 JOIN IN","author":"by Gail Grabowski, edited by Stanley Newman","date":"2009-05-04","grid":"TEFTUyNHQUdBI1BBU1RBCkFSRUEjSURPUyNFVEhJQwpCSU9MI05FQVQjQ0xPTkUKU0FVU0FHRUxJTksjUkVECiNTTEFTSCMjUk9BU1QjIwojIyNTVEFCUyNTVEFGRlMKT05TI0VNQUlMIyNGVUVMClJPVE9SI0FHRSNQRVNUTwpFQVJMIyNTSEFXTCNFQVQKU0hJRUxEI1NQSUVTIyMjCiMjTk9PTkUjI0dBVUdFIwpNUEcjU0FWSU5HU0JPTkQKQVVUT1MjSURPTCNMQVRFClNMSURFI0NMVUUjRVBFRQpTTEVEUyNURU5EI1RFUk0="},{"title":"5/05/09 EMBARKATION","author":"by Rita S. Cruz, edited by Stanley Newman","date":"2009-05-05","grid":"U0hPVVQjVEhJUyNDQVJEClRVTFNBI0VBU1kjT0JPRQpBTEFTS0FOTUFMQU1VVEUKUkFZI0VYRVMjTElGVEVECiMjI0NISVQjTUFSWSMjIwpCQUJJRVMjVEFCUyNBU0gKRVJPREUjQ0VMTCNBQkxFCkFJUkVEQUxFVEVSUklFUgpVU0VSI05FVFMjQUlERUQKVEVEI1VUQUgjR1JFRVRTCiMjI1dSRU4jTEVJUyMjIwpFTlNJR04jTUVBVCNFVEEKR09MREVOUkVUUklFVkVSCkdOQVQjQVVUTyNFVkVOVApTT1BII1NFRU4jU0VORFM="},{"title":"5/06/09 ALT ENERGY","author":"by Fred Piscop, edited by Stanley Newman","date":"2009-05-06","grid":"U0FHUyNTSUxPI1BBVEVTCkxVUkUjSU5PTiNBQk9SVApPRElFI01BS08jU1VOTkkKV0lORFNQUklOVFMjQUlSCiMjI1lBTFUjRE9PRExFUwpTQU0jQkVUI0FUTk8jIyMKRVFVQUwjI0FHRSNMQVJBCk5VQ0xFQVJGQU1JTElFUwpEQUhMI0xFVCMjTVlOQUgKIyMjSUJJUyNISVAjVFJZCkVORE5PVEUjT05FUyMjIwpYRVIjU09MQVJGTEFSRVMKUFJPUFMjTFVURSNMQVpFCkFET1JFI0VST1MjT0dSRQpUWVBFUyNSQU5UI05FQVI="},{"title":"5/07/09 SPORTSFEATHERS","author":"by Sandy Fein, edited by Stanley Newman","date":"2009-05-07","grid":"TEVHUyNURUVNUyNQUkVaCkFRVUEjSFVNQU4jUklERQpNVUxMI0VSSUNBI0FQRUQKQkFMVElNT1JFUkFWRU5TClNMWSNOQVAjI0xBRCMjIwojIyNBVExBTlRBSEFXS1MKR09BV09MI09BVFMjSElFCkFYTEUjI0FNUCMjWUVMTApMRUQjQVNJQSNTT1JUT0YKQU5BSEVJTURVQ0tTIyMjCiMjI0JPWCMjUEhJI01CQQpUT1JPTlRPQkxVRUpBWVMKQURBTSNJU0xBTSNBTlRTCkxJTUIjRUxBVEUjS05FRQpMRVNTI1NPQkVSI0VBU1Q="},{"title":"5/08/09 INSTRUMENTAL","author":"by Shirley Soloway, edited by Stanley Newman","date":"2009-05-08","grid":"TFBHQSNNT0xEUyNHREFZCk9JTFMjSURJT1QjT1JFTwpGTFVURURFREdFI1RVUk4KQUxDT1RUIyNHUklNTSMjClRTSyNORUVEI0VYRU1QVAojIyNIQVJQRURPTiNFVVIKQUNIRSNNSUNFI0FERExFCkNMT0FLI0xJViNZT1VTRQpUQVJEWSNPTUlUI1NQRUQKVVJOI09SR0FOSVpFIyMjClBFU0VUQSNMRU5PI05CQQojI0lST05TIyNLTkVFTFMKTUVOVSNGSURETEVBV0FZClBMT1AjT0xESUUjUkFaRQpISU5UI1JPU0VTI1NURVQ="},{"title":"5/09/09 SATURDAY STUMPER","author":"by Doug Peterson, edited by Stanley Newman","date":"2009-05-09","grid":"SEFSREhBTkRFRCNNRURTCkFMQU1PR09SRE8jRVJJQwpGT1paSUVCRUFSI0RPTU8KVEhFIyMjTElNRVdBVEVSClNBRERFTkVEIyNLTElORQojIyNFTEwjRUJCUyNDT1AKRE9VQkxFUExBWSNTSVZBCklOU1RFQUQjUkVTSVpFRApOQUhTI1NBTFRCQUdFTFMKSVZFI0lUU08jWUlOIyMjCk5FUkRTIyNSRUVMU09GRgpHUkVBVEFQRVMjIyNMRUEKQ0FEWSNTQUxTQU1VU0lDCkFHSU4jUFJFRU1JTkVOVApSRU5FI1NLSU5GTElOVFM="},{"title":"5/10/09 SOUND THINKING: Listen and learn","author":"by Doug Peterson, edited by Stanley Newman","date":"2009-05-10","grid":"TUFHTUEjQVJFQVMjTUlTUyNFU1BZCkFHTlVTI0xPUlJFI0FSSUEjTE9SRQpDUkFTSEhFTE1FVCNKT05HI0lIT1AKSEFXSyNPU0xJTiNCQU5HVVBKT0JTCiMjI0VTUyNPTkFJUiNPSEFSQSMjIwpQT1BUSEVRVUVTVElPTiNSRUhBQlMKU01BI0FSVVQjI1RBUiNTT1kjQkFBCkhBR0FSI0FTQVAjUkFDSyNPSkFZUwpBTkFUT01ZI0JMQVNURlVSTkFDRVMKV0lOT05BI01FQUQjRUxMRSNDSUQjCiMjI01BUkxPI05PRCNBTEVDSyMjIwojVEFJI0RPVFMjQlJBVCNWT0lERUQKQlVaWkxJR0hUWUVBUiNERU5FVVZFCkVTVEVFI0lTRUUjV0lGSSNDT01JTgpFS0UjTlVOI05SQSMjT09aRSNCQVMKRlNDT1RUI0JPT01NSUNST1BIT05FCiMjI1NJVEFSI1VUSUNBI1JURSMjIwpSVU1CTEVTRUFUI0RFQ09SI0FNT0sKT1JFTyNST05TI0NSQUNLT0ZEQVdOCklHT1IjRU5EUyNQSVhJRSNET1lMRQpTRVdOI0RFQU4jQUJFQUQjQU5JU0U="},{"title":"5/11/09 DISCOUNT DAY","author":"by Sally R. Stein, edited by Stanley Newman","date":"2009-05-11","grid":"QUxBUyNSQUZUUyNDVVBTCk1FTFQjRUZMQVQjQVNJQQpNQU1BI1BST01PI0RFTlMKT0tBWSNMT1dFUkJFUlRICiMjI0VSQVMjI01BVCMjIwpIRUxET04jQUNJRCNFTVQKSU5FUFQjSVNMRSNBTUVSClJFRFVDRURUT1JVQkJMRQpFTUlUI1NFRUQjUFJFRU4KU1lOI1NUQVIjR09BREVECiMjI0RPRSMjU1VOUyMjIwpPTlNBTEVEQVRFI0lUQ0gKUE9VUiNNQVhJUyNPSElPClVOSVQjRUxFQ1QjTkFUTwpTRVRTI0RFU0tTI1NURVA="},{"title":"5/12/09 PLEASE ATTEND","author":"by Gail Grabowski, edited by Stanley Newman","date":"2009-05-12","grid":"RU5EUyNIT09UUyNDQVJTClBPT0wjSU5ESUEjQVBPUApJTlJFI1BFT05ZI1NQQVIKQ09NRUFQQVJUI0ZJRVJZCiMjI1BST01TI1RVTkEjIwpTUFJFRSMjI1RFTk9SUyMKUElFUiNGRUFSRUQjV0VUCkFMUCNQSUVQQU5TI0lOQQpNT08jQUxMRVlTI0FTU04KI1RST0xMUyMjI1NMRUVLCiMjVFJFWSNTUEVFRCMjIwpPU0NBUiNTSE9XTUVIT1cKU1BBVCNQSEFTRSNOQVBFCkxVUkUjQ09WRVIjVElFRApPRERTI1NFRURTI0VSUlM="},{"title":"5/13/09 WE'RE ENTITLED","author":"by Norma Steinberg, edited by Stanley Newman","date":"2009-05-13","grid":"SEVST0QjQkFORCNCTE9UCkVWQURFI0VMSUUjQk9YWQpMRU1PTiNHQVBTI1FVSVAKTVJTUk9CSU5TT04jSURPCiMjIyNURU4jI1RPU1NFUwpWRVNTRUwjU05PUlQjIyMKQUxPVCNMT0NPI1RFQVNFCk1BREFNRUJVVFRFUkZMWQpQTEFUTyNPTElPI0VSSUUKIyMjRURTRUwjU1RPT1BTClNVRERFTiMjSUNFIyMjIwpVU08jTUlTU01BTk5FUlMKTUFaRSNGTEFCI0RJVk9UCkFHRVMjRkFLRSNFTEFURQpDRU5UI1NQRUQjUkVORVc="},{"title":"5/14/09 PAY UP","author":"by David W. Cromer, edited by Stanley Newman","date":"2009-05-14","grid":"Qk9ORVMjQUpBUiNGT0FNCkJVSUxUI0xPR08jSVNUTwpCSUxMT0ZGQVJFI1NDT1cKIyMjI0tFQU5FI1NIQU5FClNMQVRFUyMjRU5URVJFRApNQU1BI1RFTkRCQVIjIyMKRVJJSyNTRUEjQUxQSEFTCkFHTkVTI0tJQSNLUk9OQQpST09TVFMjVklFI0lQT1MKIyMjQ1JBVEVSUyNDRURFClBJRUhPTEUjI1NVRURFUwpPTlRBUCNOQVBFUyMjIyMKU1RBUiNFVUdFTkVMRVZZClRXSUcjQVJJQSNSQUNFUgpTT0xFI1RFTlQjU1BPVFM="},{"title":"5/15/09 WAITER'S LAMENT","author":"by Doug Peterson, edited by Stanley Newman","date":"2009-05-15","grid":"QVVESSNCT01CUyNTSElQCkRSRUQjQVBJTEUjTklLRQpESVJFI0xFREVSSE9TRU4KSUFNQUJFTElFVkVSIyMjClNIQU1VIyMjRE9OS0VZUwojIyNFTU1BUyMjTkVNRUEKIyNJTlBVTkNUVUFMSVRZCkFXTCMjU1RPT0wjI1RJUwpUSE9VR0hJVE1BS0VTIyMKVEVTTEEjI1RFTkFNIyMjClNURUxMQVIjIyNUSUxFUwojIyNNRVZFUllMT05FTFkKQkFOQU5BQk9BVCNFVklMCk9WRU4jU0FUWVIjTkVBUApZQVdOI1RSRVNTI1RFU0g="},{"title":"5/16/09 SATURDAY STUMPER","author":"by Sandy Fein, edited by Stanley Newman","date":"2009-05-16","grid":"Q0hBUFRFUlMjU1dFRVRTClJFVFVSTkVFI09JTE1FTgpBUk1CQU5EUyNBTktBUkEKRE9DI01VU1RBUkQjSU1QCkxJQVIjSVRFTVMjRkxJUApFTlJPTCNBVFQjQ1JFVEUKUkVET1VCVFMjR1JBREVBCiMjI1NMT0UjTUlFTiMjIwpTVUJUTFkjUEFOQUNFQVMKVFJFRVMjUEVaI01JTlNLCkFHQVIjRElOQUgjU0lTSQpCRVQjR1JBTlRFRSNHVU4KSURPVE9PI0FMQUJBTUFOCkxPVUlFUyNNQVJSSUFHRQpFTlRFUlMjRU5ET1JTRUQ="},{"title":"5/17/09 APPLIED ANATOMY: Featuring body language","author":"by David W. Cromer, edited by Stanley Newman","date":"2009-05-17","grid":"U1BZI0ZMQU1TIyNNT1AjQ0hVQkJZCkFSTSNPT01QSCNCT0RFI0hBTkRMRQpORUNLT0ZUSEVXT09EUyNBTERSSU4KU1BBUlRBIyMjUlVOU09GRiNVTVBTCiMjI0lUVCNTVEFHUyMjUkVBTCMjIwpTTEFTSCMjVEFDSCNVU0UjQ0FNRUwKUEFTU0UjQkFDS1RPVEhFRlVUVVJFCkFNUCNCRUFSIyMjVkVFI0FSRVRPTwpET0lMSUVTI0RJVkUjUkVDQVNUUyMKRU5ST0xMI1NPTkFSI01BRSMjIyMjClNURUFMI01VU0NMRUNBUiNLQVRJRQojIyMjI1RPTiNMRUFSTiNUSVRBTlMKI1NIQURPV1MjSVRUWSNNT0RFTFRTClNFRURFUiNFUk4jIyNBREVOI0xFQQpIRUFERk9SVEhFSElMTFMjRU1PUlkKQVNUUk8jRVNPI0FSRUEjI1lBV05TCiMjI0VHQUQjI1NMRURTI0FCQyMjIwpPSE1TI1RPVUNIRVMjIyNHRUFSVVAKTU9VU1NFI0NIRVNUT0ZEUkFXRVJTCkFMVEVSUyNMSUxUI1BSRUVOI0JBQQpSRUVESVQjQVRGIyNUT05FUyNBTFQ="},{"title":"5/18/09 ELEVATIONS","author":"by Gail Grabowski, edited by Stanley Newman","date":"2009-05-18","grid":"Q0FSUyMjU1BBUyNTVElSCk9SRU9TI0hVTEEjVElSRQpMQURMRSNPTUVOI0FMQVMKQUJPVkVCT0FSRCNHRU5UCiMjI0VUQSNTVEFWRSMjIwpURFMjT0xEIyNMT1NFUlMKUkVBTCNTT09OI0xFVkVFClVQRk9SQUdSRUFUVElNRQpTVEVWRSNTRUFMI1NMSUQKVEhSRUFEIyNUTEMjU1RZCiMjI1NQUklHI0FIQSMjIwpUQUxFI09WRVJIQVVMRUQKQVJFQSNOT05FI09SQVRFCkxJTlQjRVJJRSNTQU5UQQpMQURTI0RZRUQjI1NFRVI="},{"title":"5/19/09 WHAT'S YOUR SIGN","author":"by Billie Truitt, edited by Stanley Newman","date":"2009-05-19","grid":"QUJDUyMjU1dBUCNBUkFCCkxFQU5TI1dBREUjUE9OWQpNQU5JQSNBUklBI1BVTlQKU1RPUFBBWU1FTlQjVE9FCiMjUEVTVCMjVFVSS0VZUwpBTUVSI0FSQyNURU4jIyMKU0lOI1NOT09QI01PQ0hBCk9ORVdBWU9SQU5PVEhFUgpGSVJFRCNURU5PUiNSQU0KIyMjRERUI1NFVCNDT1BZCkJPQlNMRUQjI1NQQU4jIwpFUlIjRVhJVFBPTExJTkcKQUJVVCNBSkFSI0VNQ0VFClJJTkQjTk9URSNBTExPVApBVFRTI1NOQVAjI1lFTlM="},{"title":"5/20/09 GRAB BAG","author":"by Norma Steinberg, edited by Stanley Newman","date":"2009-05-20","grid":"SEFTSCNBU1NFVCNTTEFQCkFMVE8jU0FVVEUjSEVJUgpTVEVQI0NSRVRFI01BREUKVEVBI1NFSVpFVEhFREFZCk9STEVBTlMjI0lNQSMjIwojI1RXSVQjSU1NT1JUQUwKQUNIRUQjRlJJRVMjQVdFCkhBSVIjR0xPU1MjVEtPUwpFUlIjTk9VTlMjRlVFTFMKTUFETU9ORVkjUEFSQSMjCiMjI0NBRCMjSEFDS1NBVwpQSU5DSE9GU0FMVCNUSUUKQVJFQSNMSVNaVCNCQUxFClNJU0kjQUZURVIjT05FSwpBU1NOI1NJU1NZI0FERFM="},{"title":"5/21/09 ABOUT TIME","author":"by Shirley Soloway, edited by Stanley Newman","date":"2009-05-21","grid":"RVBJQyNNQ0pPQiNBU0lTCkxPREUjT1pPTkUjTkVTVApCRUVOI1BBU1RBI05DQUEKQU1BVEVVUkhPVVIjT0FLCiMjI1JBUFMjI0ZSQU5DRQpPU0NBUlMjQ0xPU0VEIyMKRE9BTEwjQ0hBUiNDSEFTCkVMTCNTQ1JJUFRTI0FVSwpTT0xEI0hBTVMjSElOREkKIyNJTlRJTUUjUFVORElUCkRFVEFJTCMjU0lOUyMjIwpFVkEjTUlOVVRFU1RFQUsKQklEUyNESU5FUiNPQk9FClVUQUgjT0xERVIjUkFORwpHQVlFI0dFT0RFI0VZRVM="},{"title":"5/22/09 MIND THEM","author":"by Fred Piscop, edited by Stanley Newman","date":"2009-05-22","grid":"UkVQI0JSQVpFI1NMQUlOCkVQQSNST1ZFUiNUQUJMRQpQT1JDVVBJTkVRVUlMTFMKRVhFUlRFRCMjVU5MRVNTCkxZUkEjIyNHUkFUQSMjIwojIyNCT1cjTEFEI0FKQVIKU0hFI0NPTkFOI0NMSU5FClBBVENIV09SS1FVSUxUUwpBU1RSTyNSRVNFVCNMSVQKVEhBSSNBTUEjREVMIyMjCiMjI1RSVVNUIyMjQVJJRApTRU5JT1IjI1NFQUxBTkUKUFJPUVVBUlRFUkJBQ0tTCklNT1VUI0FXQVJFI0VFSwpUQUtFUyNXT1JTVCNEUlM="},{"title":"5/23/09 SATURDAY STUMPER","author":"by Merle Baker, edited by Stanley Newman","date":"2009-05-23","grid":"TE9HRSNBTEZBI0FWRVJTCk9WRU4jUk9BTSNCSUpPVQpQVVRUSEVTUVVFRVpFT04KRU1JUkFURVMjU1RJQ0tZCiMjTkVWRVIjT0NURVQjIwpTSVRBUlMjQVBIT1JJU1QKQ05PVEUjR1JFRVIjT1BFClJBSFMjQ0FORFcjU05BUApVTk8jTU9MRVMjUk9DSEUKQkVUUkFZQUwjUkVDQU5FCiMjV0FHRVMjVFVMSVAjIwpFTEFURVMjUE9OSUVTVVAKTk9USU5USEVQSUNUVVJFCklMRUZUI0FLSU4jQUxTTwpEQVJZQSNQRUNTI0xFQU4="},{"title":"5/24/09 ON LOCATION: A day at the movie","author":"by Shirley Soloway, edited by Stanley Newman","date":"2009-05-24","grid":"QlJJTSNTSUFNI0xBVURTI09TQ0FSCkFJREEjSU5GTyNPUFJBSCNDSE9TRQpTQ0VORU9GVEhFQ1JJTUUjVE9SVFMKU0VBQkxVRSNTUkEjQ0FSRCNURVJJCiMjI0FMQVJNI0lUQ0gjUElHSVJPTgpWSVJHSU5JQVJFRUwjTUFSSU4jIyMKRUxJU0UjT0RFI0RBVEEjRU5UUkFQCkVJTiMjQ1JFRVAjTk9OUEMjSEFMRQpSRUdHSUUjSURPTCNET0lUI0VWRU4KIyMjRVJOU1QjTEFCT1JFUiNERVJOCldBTlRTVE8jU0tJRVMjVE9UQVNURQpPTUlUI0VOU05BUkwjTEFVRVIjIyMKUEFUSCNSSVBBI1NMT0UjVEFLRVRPCkFOVEUjTEFSR0UjU1BBREUjI1NJUApUQUlQRUkjQVNBUCNJREUjQUZURVIKIyMjSVhOQVkjU0FNRU9MRFNUT1JZClNQRUNURVIjR1lSTyNOT1JBRCMjIwpMRU5UI1NNRUUjVE9PI1JFTU9SU0UKVU5EVUUjQUNUSU5HUFJFU0lERU5UClNDT1JOI05PT05FI0VUQVMjR0FJVApIRVdFRCNJTk5FUiNERU5ZI0VSVEU="},{"title":"5/25/09 LOOKING AFTER","author":"by Gail Grabowski, edited by Stanley Newman","date":"2009-05-25","grid":"U0FHQSNBQ0hFRCNOQVNBClBMVVMjVEhFTUUjT1dFRApVVEFII1RVTElQI1NBTkQKTk9SI1RFTkRUT1dBUkRTCiMjRFJJTksjI1NBTEVTIwpTVFJBTkQjUFJJTlQjIyMKVE9BU1QjUk9VVEUjV0FOCkFUSVAjI0VTUyMjUEFSRQpHRUwjQVNTRVQjUkFUSU8KIyMjT01JVFMjVElOQ0FOCiNGSUxFRCMjVEVOVEgjIwpNSU5EUkVBRElORyNCRUUKQU5URSNCTEVORCNTQUdTClBBUlMjQURBR0UjU05BUApTTE9UI1JBUkVSI0VERFk="},{"title":"5/26/09 FASHION STATEMENTS","author":"by Sally R. Stein, edited by Stanley Newman","date":"2009-05-26","grid":"VVNIRVIjUFVUUyNDTEVGClNUT1ZFI09ISU8jTElWRQpFQVNFRCNXT1JOI0FNSUQKRFJFU1NSRUhFQVJTQUxTCiMjIyNFQVIjI1RBUCMjIwpUSFJFQUQjUExBTiNBTUEKUkFJRCNJU0VFI1VSQkFOCkFEREFDT0FUT0ZQQUlOVApJVEVNUyNHRU5MI0lETEUKTk9SI1BFRVIjQUxMRVlTCiMjI1ZBTiMjU1BBIyMjIwpMT1NJTkdPTkVTU0hJUlQKQUJJVCNJREVBI1RFTk9SCkNPTEEjTk9FTCNFUk9ERQpZRUxMI0VSUlMjREVOU0U="},{"title":"5/27/09 HAPPY HAUNTING","author":"by Daniel R. Stark, edited by Stanley Newman","date":"2009-05-27","grid":"TkVBUCNST0FDSCNBV0VTCkJBVEgjRUFHTEUjTU9QRQpBUkVBI0ZSRUVTUElSSVQKI0xFTkRMI1JBVEEjTUNTCiMjI1RFRU0jVElORyMjIwojQlJPTkNPUyNBR0hBU1QKR0xVTSNUUkFQI1NPRlRZCkVPTlMjU0VYRVMjU09BSwpNT1RIUyNTRVJBI1RVQkUKU1BPSUxTI1NDUkFXTFMjCiMjI1BFTFQjSEFJUiMjIwpTQU8jUE9FTSNDUklFRCMKTklHSFRTSEFERSNUQVVUCklETEUjSEVMRU4jRVZFTgpQRUVQI1lFQVJTI1JFU1Q="},{"title":"5/28/09 BEDDY BUYS","author":"by David W. Cromer, edited by Stanley Newman","date":"2009-05-28","grid":"TUVOVSNQSEFTRSNIT1BJCkFDRVMjT0lMRVIjT01FTgpUSFJPV0lOT05FU0hBTkQKSE9EI0FOVEVEI0NPTkRPCiMjI0VSVEUjI0RPSCMjIwojU1BSRUFEVEhFV09SRCMKVEhFSVNUI1JFRUwjRVVSCklSQU4jI0dVWSMjQUxUTwpDVVIjU1VFUyNTVFJJQ1QKI0JMQU5LRVRTVElUQ0gjCiMjI0JFRSMjSFVHUyMjIwpBQkFTRSNJUkFURSNTT1AKQ09WRVJPTkVTVFJBQ0tTCklST04jU1RBVEUjRE9SQQpERU5UI1NPTEFSI1NXQVQ="},{"title":"5/29/09 AFTER-SCHOOL SPECIAL","author":"by Kevin Donovan, edited by Stanley Newman","date":"2009-05-29","grid":"UkFXIyNTTEFWUyNBUk1TCkVHT1MjTUFSSUUjU09BUApCRUxMUEVQUEVSI1RPR0EKVU5GVVJMUyMjVkVSTUlOClNURVJJTEUjTElMQUMjIwojIyNST1kjU09DQUxMRUQKQ1lCRVIjTUFWRU4jRVJBCkhPT0QjQk9YRVMjQlJJTQpJUkEjSFlQRVIjQ0FLRVMKUEVSSlVSRVMjQ1JZIyMjCiMjREVMSVMjV0FJTEVSUwpSQUdUQUcjI0FSU0VOQUwKQUxBUyNIT1VTRVBBUlRZClRJTUUjVE9SVFMjRk9JTApTVEVUI1NPTEVTIyNMT1k="},{"title":"5/30/09 SATURDAY STUMPER","author":"by Doug Peterson, edited by Stanley Newman","date":"2009-05-30","grid":"U05PV0pPQiNPQ1RBVklBCkNPUlNBR0UjQkFJTElORwpUSEVXSUxEV0lMRFdFU1QKVk9MI0xJU0EjWUVBU1RTCiMjI0lCTiNUT1BTWSMjIwpPVVRSSUdHRVJTI1NJVFMKRkxPT1IjQVJUT08jTVJJCk9ORU5EI09MRSNGUkFJTApMQUkjU0VMSUcjRlVHQUwKREVOUyNNRUxBTkNIT0xZCiMjI0NBUFJJI0VBUiMjIwpTVE9PR0UjRURBTSNJUkEKQVdLV0FSRFNJTEVOQ0VTClJFQUxUT1IjR09SSUVTVApHRVlTRVJTI1NOQVBTVE8="},{"title":"5/31/09 WORLDWIDE: Think globally","author":"by Gail Grabowski, edited by Stanley Newman","date":"2009-05-31","grid":"U0xFRCNFQVJTI1NBTUJBI0JSQVdMCktJTE8jU0xBVyNPVkFMUyNSRUxBWQpJUkFOI1RPR0EjUkVNQVQjQUJPREUKUEFOQU1BSEFUI0JSQVpJTE5VVCMjCiMjI1RBVEEjVFNFVFNFI0FDVCMjIwpET0NJTEUjU0VDVFMjI1VTSCNUSVMKSU1IT1QjUk9BUiMjVE9OUyMjVU1QCkdBSU4jQkVSTVVEQU9OSU9OI1JCSQpJTk4jTE9TVCNCT05ORVQjT0FLRU4KVElBTUFSSUEjI09LT0sjU1BFRURZCiMjQ0FCSU4jU1RSQVcjRklFUlkjIwpXRUxMRVMjQ0hVTSMjU0FEVE9TQVkKQVRPTEwjQkFBQkFBI1BJRVMjSEJPCkdVUyNTQ09UTEFORFlBUkQjVE9BRApPREUjI09CT0UjI0RPVFMjR09PU0UKTkVUI1JNUyMjQVBMVVMjSE9TVEVMCiMjI0dVTSNUVVJFRU4jUEFOUyMjIwojI0NVQkFMSUJSRSNHVUlORUFQSUcKQURMSUIjSU5PSUwjVVJOUyNXQURFClBBVVNFI0FHQVZFI05BVE8jQVJFQQpFQkJFRCNNRVRFUiNTTEFNI1lFQVI="},{"title":"6/01/09 TRUE COLORS","author":"by Billie Truitt, edited by Stanley Newman","date":"2009-06-01","grid":"U1VCUyNBUEVEI1JPT1NUCktORVcjUk9BUiNBVURJTwpJREVBI1JPU0UjVFJPTEwKUFVSUExFSEVBUlQjUk9ECiNFU1NFUyMjTU9MVCMjIwojIyMjQVRJVCNCRVJBVEUKQU1JU1MjT0hISSNJTEFZClJFRFdISVRFQU5EQkxVRQpUQUxFI0hBSVIjUkVTVFMKU0xFRVZFI1JFRE8jIyMjCiMjI1BFQVIjI0VWSUxTIwpCQUQjR1JFRU5CRVJFVFMKQVJPTUEjQVJFQSNPVkFMClRJRU9OI0xJU1QjTkVSTwpIQVJQUyNNRVRFI1NMRVc="},{"title":"6/02/09 GOLF GEAR","author":"by Gail Grabowski, edited by Stanley Newman","date":"2009-06-02","grid":"UkFLRSNDQUxMI0ZBQ1RTCk9MRVMjT0JPRSNBTExPVApCQUdQSVBFUlMjVE9VVFMKRVNTI0NJVEVTI0NPQlMjCiMjI1RPRVMjVFJBUFMjIwpDQUJJTlMjQ0hBVCNUVlMKT1ZBTFMjI1JBRyNQRUFUCkNPTFQjU1RPTkUjTEFMQQpPSUxTI1BFVyMjQkFLRVIKQURPI0hBTkQjSEVJU1RTCiMjRlJPTlQjU0FMVCMjIwojQUZBUiNBUkVTTyNIVFMKQ0hJTlMjQ0FSVFdIRUVMCkVFUklFI0xJVkUjQVJFQQpPTUVOUyNFREVOI1RFTlQ="},{"title":"6/03/09 DOGGING IT","author":"by Fred Piscop, edited by Stanley Newman","date":"2009-06-03","grid":"Uk9UT1IjU0xBQiNTUEFSCklOQU5FI0FVUkEjSEFSRQpUWVBFU0VUVEVSI0FMTUEKQVhFI1RSVUUjVElESUVECiMjI1dBUlAjU0VDT05EUwpDQVJFVFMjU0hSRVcjIyMKQUJVU0UjRk9JRSNCT0NBClBFU1QjQ0xVRUQjT1ZBTApTVEVQI09PUFMjRVhFUlQKIyMjT0xPR1kjU1RFUkVPCkFDVElPTlMjQk9IUiMjIwpGUk9OVFMjU0VSQSNBRFMKVEVOVCNLSVRURU5DSE9XCkVER0UjSVJJUyNPUEVSQQpST0FSI05BUlkjTE9NQU4="},{"title":"6/04/09 THE FIX IS IN","author":"by Doug Peterson, edited by Stanley Newman","date":"2009-06-04","grid":"Q0hBU00jS05BQ0sjRkJJCkFPUlRBI1JJU0VOI1JBRwpTV0VFVFBJQ0tMRSNPSk8KVElOVCNFU0UjI0FUV0FSClNFQVNBTFQjQURET04jIwojIyNPRkZJQ0VSU01FU1MKTUFSTkUjI09STyNFREVOCk9MRSNXRVRNT1BTI09OTwpPRERTI1BPRSMjQ0FORFcKUkFTUEJFUlJZSkFNIyMjCiMjUVVJRVQjT1VUQUdFUwpCUlVOTyMjU1JBI1NBUkEKWUVBI1BBUktJTkdTUE9UClRBUiNJT05JQyNORUVEWQpFUkUjQ0xBTksjVURERVI="},{"title":"6/05/09 ENOUGH ABOUT ME","author":"by Sandy Fein, edited by Stanley Newman","date":"2009-06-05","grid":"REVCUkEjSVBPRCNFRE5BCkVOUk9MI1NJWkUjR1JFVwpDSE9ORyNMRUFQI0dPV04KUkFORE9NRVJST1IjUEhJCkVOQ09SRSMjS1RPU0xJTgpFQ08jRVRUQSNTVVBFUkcKREVTSyNFQVJQI1NJVEVTCiMjI1dPUk1FQVRFTiMjIwpSRUhBQiNQQUNFI1NJUlMKQU5FTUlBI1NUQVIjTEVUCkZUTEVFTkojI1NFQUxVUApGUk8jU1RFQU1FTkdJTkUKTEVJUyNJTFNBI1RBQ0lUCkVBU0UjQ0xPWSNFVklURQpTVEVXI1NPRkEjREVURVI="},{"title":"6/06/09 SATURDAY STUMPER","author":"by S.N., edited by Stanley Newman","date":"2009-06-06","grid":"S0lOREFTT1JUQSNBU0FQCkVORVJHWUJBUlMjQU5OTwpFRFdBUkRWSUlJI1JPSUwKTElCWUEjRUxCQSNQT1NUCkVHSVMjRlJJRU5EI1BFUgpET0UjQk9TTlMjQUxJVE8KIyMjR1JJRUcjU0hJTlRPCkRSU0VVU1MjSEFMT0dFTgpSRUNBTlQjU0FUSU4jIyMKT1BBUlQjQVRSSUEjS0dCClBBTCNTVFJPREUjU0VSQQpTSURFI1VSSVMjQ1VSRVIKQVJJQSNSSUNFRkFSTUVSCkZFTlMjT1ZBTE9GRklDRQpFREdZI1dFTExSRVNURUQ="},{"title":"6/07/09 LET'S TALK: Various ways to speak","author":"by David W. Cromer, edited by Stanley Newman","date":"2009-06-07","grid":"TUFNTUFMI1dBTkQjQllURSNBTE1TCkFWSUFURSNPTElPI0FFT04jRFVBTApDT05WRVJTRUFMTFNUQVJTI0RSTk8KRVdFI0FOVFMjI0xJVEhFI0ZMRUVUCiMjI0FTRUEjUEhPTkUjI0hPRSMjIwpTSEFWRVJTI1JFUE9SVEZPUkRVVFkKUEVQRSMjSUNPTiMjU0FCUkEjTlJBCkVYUFJFU1NMQU5FUyNSSU5HVEFJTApORVRUTEUjQU1BTkFTIyNTRVJHRUkKVERTI0hBUk0jI0RSSUJTIyNBSURFCiMjI0FJUkZPUkNFQUNBREVNWSMjIwpEQVRBIyNEUkVBRCMjVElNRSNEQVIKQUxBUk1TIyNBTUlEU1QjSU1IRVJFCkNPTVBPVEVTI1NUQVRFVFJPT1BFUgpIVUUjREFURUQjI01PTk8jI1JPTkEKQUREUkVTU1dJTkRPVyNUUklTVEFOCiMjI0FTSCMjQ09JTlMjQVJNWSMjIwpHSUFOVCNBU0tJTiMjQ0xBUCNSSE8KTEFSSyNVVFRFUkRFVkFTVEFUSU9OCk9HTEUjU09PTiNJUk9OI0VMQVBTRQpXT09EI0FNUFMjTkVYVCNEQUlTRVM="},{"title":"6/08/09 WEDDING DAY","author":"by Sally R. Stein, edited by Stanley Newman","date":"2009-06-08","grid":"UEFUUyNMQVNUI01BSVpFCkFMSVQjT05DRSNBVFJJQQpUT1RPI0FUQU4jREVBTlMKQ0hBUiNGSVJTVERBTkNFCkhBTktJRSMjI0hFTSMjIwojIyMjRFJBR1NJTiNSVU0KVEVBU0UjUlVMRSNIQVJFCkVYQ0hBTkdFT0ZSSU5HUwpTUFJZI09VU1QjRURHRVMKVE9FI1NURVRTT04jIyMjCiMjI1RJRSMjI01PVkVSUwpUSUVSRURDQUtFI0FSRUEKQk9YRVMjT1JBTCNQT1BTClNXRUFUI0RJTkUjT0RFUwpQQVNUQSNFQVNUI1JFTFk="},{"title":"6/09/09 THE FINE PRINT","author":"by Gail Grabowski, edited by Stanley Newman","date":"2009-06-09","grid":"Qk9ORCNTQ09UUyNJU0VFCk9CRVkjSE9TRVMjTkNBQQpMT0FOI0VNQ0VFI1NIVVQKREVUQUlMTUFOI1RPTyMjCiMjI01PTEFSI1BJTE9UIwpMRU1PTlMjI0ZPUkVMRUcKRVJBUyMjQ0hJTEUjVEFSClRSSSNTUE9JTEVEI0VQQQpCSU4jVE9SVEUjI1BST1AKRU5DTE9TRSMjV0FSTVRICiNHTEFSRSNSQUlTRSMjIwojI0FOWSNDQVRDSEZJUkUKU1BVRCNTQVlPSyNFREVOCkVBU0UjUFJPTkUjUkVBRApBV0VEI0FCTkVSI1NBUFM="},{"title":"6/10/09 BY AND LARGE","author":"by Daniel R. Stark, edited by Stanley Newman","date":"2009-06-10","grid":"QUxPRSNGT1AjI05FV0VSCkxJTUEjQVNJQSNFTU9URQpJVkVTI1RBTEwjU0NSQVAKQklHVElDS0VUSVRFTSMjCklEQSNCQUEjRVBFRSMjIwojIyNLSVQjRlJPRyNQR0EKTU9USFMjI1JFREdJQU5UCkFVUkEjQUNJRFMjQ0xBTQpHUkFORFBSRSMjSE9TVFMKSVNNI0VSQVMjVEVOIyMjCiMjI0FNSUQjQU9MI1pBUAojI1dPT0xMWU1BTU1PVEgKQVBBUlQjRVZFUyNPUkVPCkRBTlRFI0RFQlQjQlJBTgpEUkVBRCMjU0FZI1NPTUU="},{"title":"6/11/09 ACCUSATORY","author":"by Fred Piscop, edited by Stanley Newman","date":"2009-06-11","grid":"SkFJTFMjU1RFVyNKRVRTCkFCT1VUI0FSRUEjT1JBTgpLRVdHQVJERU5TI0hJSE8KRVRBI1RJTEUjQ0FOVE9SCiMjI1FVQVkjTUFSUVVFRQpTQU1VRUwjSlVMRVAjIyMKT0JJRVMjSklMTCNVUkxTCk1FTlUjSk9MTFkjQkVFUApFTEVFI0FOVFMjU0xJRVIKIyMjSkFQRVMjU0xJTktZClRSQVVNQVMjRVBJQyMjIwpIRVJNQU4jU1dBUCNBUksKQVRPUCNFTlRFUk9OQ1VFCldJU0UjU0VBTCNOT1JTRQpTRUVSI0VBUkwjU1RFRVA="},{"title":"6/12/09 MAE DAY","author":"by Bruce Venzke, edited by Stanley Newman","date":"2009-06-12","grid":"QVBQUyNUQUVCTyNGQVpFCkFMT0UjUlVSQUwjQVhFUwpIRVNUSEVLSU5EI1JJQlMKU0FZU08jI0NBUCNHT1JFCiMjIyNPRk1BTkFXT01BTgpBUlRJQ0xFI0FMRSMjIyMKRk9SU0hBTUUjI0JVVENICkFNSUUjV09VTEQjU0hPTwpSQUdFUyMjUkFJTENBUlMKIyMjI0FHRSNIT0FHSUVTCkhBVkVUT01BUlJZIyMjIwpBUklBI1NVTiMjRUxJWkEKUklPVCNUT0dFVFJJRE9GCkRFTEkjQUlMRUQjTU9PUgpDTEFOI0dMRU5TI0VMTU8="},{"title":"6/13/09 SATURDAY STUMPER","author":"by Doug Peterson, edited by Stanley Newman","date":"2009-06-13","grid":"QlVTRkFSRSNQSVRBUEFUCklOSFVNQU4jQU1JQkxVRQpSRUlOU0lOI1NBTkJPUk4KREFOI09OVVMjR05BV0VECklTTlQjV0lNU0VZI0lWRQpFRVlPUkUjQUhTI0lOT04KIyMjWUVBUkxZI0FOVElDCkNJTkRFUkVMTEFTVE9SWQpBRElPUyNTVFlNSUUjIyMKTEFORyNERUEjQkFSREVNCklSRSNDVVRMRVIjTkFOTwpCRVdBUkUjS05PQiNZRVIKRVlFQkFMTCNJU0FET1JBClJPU0lORUQjQUlSSU5HUwpTVVRURVJTI0NBUktFWVM="},{"title":"6/14/09 ARGON: Sounds elementary, but it's not","author":"by Shirley Soloway, edited by Stanley Newman","date":"2009-06-14","grid":"REVFTVMjSkFTT04jQ1VCQSNGQVNUCkVDTEFUI1VUVVJOI09QRUQjVVNFUgpTVEFSUiNTVFJBVyNST0FEI0xJRVUKSU9OQ1VSVEFJTiNCQU5LUyNMQVRFCiMjI09OVVMjIyNQQUwjU0lTRU5PUgpDSEFOR0VPRkhFQVQjQk9ORVIjIyMKSE9QSSMjI0xFQUQjSFVQI0FCVVRTCkFSRSNIVU1FUlVTI09SRSNUVU5JQwpUQVNNQU5JQSMjI0tPTE4jQVNUUk8KIyMjQU1JTiNBTkdPUkEjQUNISUVSCk9EQVkjVElHR0VSSEFQUFkjTUVERQpSRUNPUFkjTkVBUkxZI0xFSUEjIyMKQVRIT0wjTE9TVCMjI0JFQVROSUtTCkxPT0ZBI0FNSSNBTExFQVJTI0RJVApCT09OUyNSRVgjR0FJVCMjI0RJTkEKIyMjRU1BR1MjSE9TRUFOREJVR0dZClNQWVdBUkUjUklHIyMjT0lMUyMjIwpQUkVZI0FQTFVTI1NIT0VQQVRST0wKTElNTyNCSUVOI0JST05YI0lNQUdFCklDRVIjSU5GTyNNQVJUSSNOT1RSRQpURU5LI0FUVE4jSVNOT1QjRVBFRVM="},{"title":"6/15/09 STORMY WEATHER","author":"by Billie Truitt, edited by Stanley Newman","date":"2009-06-15","grid":"U0xBWSNBU0VDI0JBUkRTClRBQ08jTEFWQSNVQk9BVApSU1RVI1RXSU4jTE9UVEEKQVNVI0hBSUxJTkdBQ0FCClBPUENPUk4jSE9FUiMjIwojIyNPUFMjSEVTI0RBTVMKQU5HTE8jI0FMSVQjVklBCldJTkRGQUxMUFJPRklUUwpBTEEjRkxJVCMjV0lEVEgKWUVXUyNJRlMjVkFOIyMjCiMjI0VBVkUjVkVSRElDVApUSFVOREVSQklSRCNEVU8KUlVOVE8jQUlEUyNQRVJLCkFTVElSI0ZMRUUjRUFTRQpQSE9ORSNUS09TI0dMRU4="},{"title":"6/16/09 ROMANTIC","author":"by Gail Grabowski, edited by Stanley Newman","date":"2009-06-16","grid":"QVNQUyNTUEFSRSNTTE9QClJPTEwjVElERVMjQVVSQQpDTFVFI1JPT1NUI0lDQU4KSE9NRUNPVVJUI0FOS0xFCiMjI1BVTFNFI0RVVFkjIwojU1RFRUwjI0xFTlNDQVAKU1RBUlMjU1BFTlQjSE1PCkVSUiMjQ09BU1QjI0FQVApUVUcjQ09MVFMjR0lSTFMKU1RFUE9ORSMjTEVUTUUjCiMjVE9SRSNTUEFOUyMjIwpMQURMRSNIQVJEVE9TRUUKT1ZBTCNTT0xJRCNQQVJFClNJVEUjQUJPREUjRVRBTApFREVOI1RPTkVSI05FU1M="},{"title":"6/17/09 HOLD THE PHONE","author":"by Fred Piscop, edited by Stanley Newman","date":"2009-06-17","grid":"VElOVCNQSEFTRSMjTklNCklDRVIjRUFTRUwjREFEQQpWT0xVTUVESUFMI09QRU4KT05MRUFWRSNNQVJZS0FZCiMjIyNORVNTIyNBTEkjIwpTQUxURUQjSEVBVkVOTFkKVFJBSVQjTU9YSUUjUklPClJVVFMjTU9XRVIjQklORApBQkUjVEFMRVMjSElOR0UKUEFTU09WRVIjR09PR09MCiMjVEhVIyNTTEFZIyMjIwpSRUJBVEVTI0FMTFVSRVMKQUxVTSNDQVRUTEVDQUxMClNJWkUjT1JBVEUjTElNQQpQRVojI05JWEVEI0FMT1Q="},{"title":"6/18/09 DIRECTIONAL","author":"by David W. Cromer, edited by Stanley Newman","date":"2009-06-18","grid":"U0xBViNBUk1BREEjUklHCkNPTEEjU0hBVkVOI0lETwpVUEFORENPTUlORyNHRUwKREVTSVJFI0JBU0UjSEFECiMjI0xFTk5PTiNMRVQjIwpDT0xMQVRFIyNDQVZPUlQKQUhFQUQjV0FTUCNBRkVXClJBRiMjQ0VEQVIjI1dFRQpFUlRFI0JSQVkjRVJBU0UKREVCVVRTIyNBUlJBWUVECiMjRVJSI0FUSEVOUyMjIwpNUEgjQVBTTyNQSUNLRVQKQUxJI0RPV05UT0VBUlRIClBFTiNFTEFURVMjTE9ORQpTQUQjREVOT1RFI1NDQU0="},{"title":"6/19/09 NICKNAMES","author":"by Doug Peterson, edited by Stanley Newman","date":"2009-06-19","grid":"S0FURSNBUExVUyNDTE9HCklNQVgjQlJBU0gjTElNQQpUSVBQRUNBTk9FI0VMRVYKIyNQRVJTSUEjI09GQUdFCkFLRUxBI1NJTEVOVENBTApGQUQjVElFI0lOQyMjIyMKVFJPRE9OI0FMTEVZT09QCkVNVVMjRFVCWUEjQU5OQQpSQVRUTEVSUyNDRU5URVIKIyMjI0lOUyNNRU4jSEFUCkhPTkVTVEFCRSNJVEVNUwpFWEVSVCMjQVRUQUlOIyMKUklHQSNPTERISUNLT1JZCk9ERVMjV0FHT04jSVNFRQpORVZFI1NXRURFI1NFQ1Q="},{"title":"6/20/09 SATURDAY STUMPER","author":"by Sandy Fein, edited by Stanley Newman","date":"2009-06-20","grid":"U1BIRVJFUyNGUkVJR0hUClBJQU5JU1QjT1VURFJFVwpSVVNUTEVSI1NFQUxBTkUKRVNURUUjSU5TIyNFWVJFCkFWRVIjU0tJSU5HI0xJWgpESU4jRFdFTExFUiNBREUKU0lTU0lFUyNTV0FHR0VSCiMjI0VWQSMjI0JUVSMjIwpSQVBUT1JTI1JFSVNTVUUKQVZFI1RJTFRFUlMjUFBTCk5BTiNTTk9PVFkjSE9TVApBUkFCIyNWTUkjU0FOVEEKTUlMRUFHRSNSQUlMU0FUCk9DVEFHT04jRVhQTE9SRQpLRVlOT1RFI0RFU0VSVFM="},{"title":"6/21/09 SMALL PARTS: Speaking body language","author":"by Randolph Ross, edited by Stanley Newman","date":"2009-06-21","grid":"RVRURSNTTEFQI0FSTUFEQSNJTEVSCkRJT1IjTkFQQSNTQUxNQU4jVEVBUgpFVkVSI0xJUFNNQUNLSU5HI1NHVFMKTk9UT0sjUkVUQVBFIyNBU0NBUCMjCiMjQVJPTyNOT04jI01PTlRBR1VFIwpQRVAjSkFXRFJPUFBJTkcjRklMTEEKRVhQSUFURVMjI0VBU0UjSEVGTElOClNUSU5LRVIjI0VBUlNQTElUVElORwpDT05UI1JFV09SS1MjTElURSNOT0wKSUxHV1UjI0hVVFMjVEVOT1IjR1JFCiMjI09OQURBVEUjQkVBVE5JSyMjIwpSRUcjRElFVFMjSEVOUyMjQUFIRUQKRUFVI0VNVVMjSEFSREVOUyNQSUxFCkFSTVdSRVNUTElORyMjT0NUVVBMRQpJTkNJVEUjSEFMTyMjQVdFQVRIRVIKTUVIVEEjUklCVElDS0xJTkcjVU5FCiNSRUNLTEVTUyMjSE9MI1RPTkcjIwojI1dIRUVMIyNXQUlTVFMjTkFHQVQKV1dJSSNFWUVDQVRDSElORyNESU5LCldZTk4jRE9DRU5UI0VNSVQjSU5UTwpGT0dHI1NOT09UWSNSRVBPI0FHRVM="},{"title":"6/22/09 STRANDED","author":"by Gail Grabowski, edited by Stanley Newman","date":"2009-06-22","grid":"R0FTUCNTQUJFUiNTVElSCkFMT0UjVFJFQVQjVEhSVQpCT0FUI0FCQVNFI1BST00KU1RSSU5HT1VUI1RFRU5TCiMjI1RJRVJTI0RBVEEjIwpUT1dFTFMjI0NPTUVEWSMKT0RFUyMjU0hPTkUjQklECkdPQiNERUNBREVTI0FQRQpBUkMjRUxBVEUjI1dSRU4KI1NBR0VTVCMjUFJJRVNUCiMjU0lERSNQUk9EUyMjIwpQSVRBUyNIQUlSU0hJUlQKQVNJTiNNT1VOVCNGUkVFClJFTlQjUE9TU0UjVU1QUwpLRUdTI1NURUVSI0xBU1Q="},{"title":"6/23/09 53 ACROSS-FRIENDLY","author":"by Sally R. Stein, edited by Stanley Newman","date":"2009-06-23","grid":"QlJBQyNORVNUI1dBVENICkxVTFUjT05UTyNBTE9IQQpPRE9SI0lTQVkjTE9GQVQKQkVFUiNTVUJDVUxUVVJFCiMjI0lTRUUjSFJTIyMjIwpUUkFDRVMjQkVHI1RPQUQKUkVCVVQjUlVTRSNVU1NSCk9WQUwjQk9MVFMjTUFLRQpUVVRVI0VCQlMjRFVLRVMKU0VFTSNHSVMjQllMQVdTCiMjIyNURU4jRElFVCMjIwpVTlRSVVRIRlVMI1VTRVIKRk9ZRVIjT0lOSyNPQVJTCk9BS0VOI09OQ0UjVU5JVgpTSEVEUyNERUVEI1NFRVA="},{"title":"6/24/09 FIENDISH","author":"by Fred Piscop, edited by Stanley Newman","date":"2009-06-24","grid":"RVRDSCNUQU1FUyNNQUpBCkJFTEEjRURJVEgjT1dFUwpCUlVURUZPUkNFI05BU1QKRVJFI0JMVUUjQVNTSVNJCkRBU0JPT1QjIyNPVFRFUgojIyNFT04jQ0xBUkUjIyMKQlJFQUsjUFJBWUVSUlVHCkJBVFMjRlJPWkUjTVVTRQpTVEFURUxJTkUjSkFORVQKIyMjT0xPR1kjUkVTIyMjClBST0ZTIyMjQ09XSEFORApSSVBQRUQjVk9URSNXT0UKT1ZFUiNBTklNQUxGQVJNCldFUkUjTUlTRVIjT1JTTwpTVEFZI1NMQVRZI1BFRU4="},{"title":"6/25/09 GOSSIPY","author":"by Betty Keller, edited by Stanley Newman","date":"2009-06-25","grid":"SEVGVCNBUFBTI0ZMRVNICkFMTFkjQkVBVSNTRVJVTQpTT0FLI0NSSUIjVEVBTVMKU1BSRUFEU1JVTU9SUyMjCkxFRSNMRUkjUkVQI0FQVApFRERJRSNBQkJSUyNCRUUKIyMjT1JCI0lJSSNGTEFOCiNUSVRUTEVUQVRUTEVTIwpQSUNBI0VTVCNTUkkjIyMKSVJBI1RBVEVSI0FQUExFClBFTiNBQ0UjRVRDI09BUwojI0RJU0hFU1RIRURJUlQKTU9PTlMjTU9PUiNBU0lBCk9OSUNFI0VZUkUjVE9BVApNRVRBTCNEQVRFI0FOVEU="},{"title":"6/26/09 THE HUMAN ANIMAL","author":"by Shirley Soloway, edited by Stanley Newman","date":"2009-06-26","grid":"U1BSRUUjQ0hBTEsjV1dXClRST1ZFI1JPREVPI09PSApFQUdFUkJFQVZFUiNST0UKQURFTiNSRVgjUkFOS0xFCk1PUkVBVSMjQ0FOT0UjIwojIyNESU5HQkFUI1RSQVAKT0xEI1NURVJOI0FNQkxFClJVRUhMI1RJQSNURUVNUwpCQVNJRSNNQVJDSCNFQVQKU1VFVCNTQU5ESE9HIyMjCiMjUklHSUQjI1VTQUdFUwpSQVRUQU4jQ1BSI1JPTUEKQUlSI1NJVFRJTkdEVUNLClBEQSNVU1VSUCNNRUxFRQpTRVQjUEVFTFMjQU5ERVM="},{"title":"6/27/09 SATURDAY STUMPER","author":"by Doug Peterson, edited by Stanley Newman","date":"2009-06-27","grid":"Rk9PVEJBVEgjQVJJU1RBCklOQUhVUlJZI1JBTVBFRApMRVRFUlJJUCNESU5FUk8KQUJFTCMjQ09NRURPV05TCiNDUklTQ08jSU5TVCMjIwojIyNPUFVMRU5UI0lDQk0KSU5VTklTT04jI0lOTEFZCk1PVklFUFJPSkVDVE9SUwpQRUVOUyMjTE9PS0VEQVQKU0xBVyNQTEFOTkVSIyMjCiMjI0lTRUUjQVNTRVJUIwpDSEFOQ0VESVQjI1NISUEKSEFMVEVSI1NIT09USU5HCkVVR0VORSNMQVdSRU5DRQpGTEFSRUQjQU5FQ0RPVEU="},{"title":"6/28/09 BACK AND FORTH: Some alternate spellings","author":"by Fred Piscop, edited by Stanley Newman","date":"2009-06-28","grid":"TVVMRSNDUkFNUCNQQVRIIyNCRUxBCkFUSVQjUlVMRVIjQVJJQSNDWU5JQwpHQVJBR0VTQUxFI1BJR0lOQVBPS0UKU0hBTExPVFMjI1RSRUUjRVJBU0VECiMjIyNFTFMjUEFSSVMjQlVUUyMjIwpVUkJBTkUjQkFUSUsjU09SRVNQT1QKUEVBUlMjUEFOQU1BQ0FOQUwjT05FClBFUlQjQkFCRSMjI0FCRUwjRUxJUwpFVkUjUFVUQUxJRE9OSVQjRU5BQ1QKREVNI1VTRVIjQ09IRU4jUEFEUkVTCiMjSU5URVIjTUFNQVMjQkFTU0kjIwpOT05FVFMjQ1VSRVIjTUVSRSNDQVQKQU1JVFkjUk9TRVNBUkVSRUQjRURVClRBTVMjVklESSMjI1VURVMjRUNPTgpUSFUjRklMRUNBQklORVQjR0xBUkUKWUFNTUVSRUQjUEFWRVIjR1VMUEVECiMjI0FNSUQjU1BJRVMjQkFNIyMjIwpBTU9SQUwjQ0FMTCMjQUxVTUlOVU0KTU9CSUxFSE9NRSNDT01JQ09QRVJBClBST1NFI0FMT1QjT09NUEgjT01JVApTVEVUIyNZRUFTI1RIT1NFI0RPU0U="},{"title":"6/29/09 WRIST WATCH","author":"by Billie Truitt, edited by Stanley Newman","date":"2009-06-29","grid":"QVRCQVQjU0NBUiNGSUJTClNBVURJI1RPUkUjSURFQQpBVExBUyNVTklUI05PU1kKUEFMTVNVTkRBWSNHTEVOCiMjIyNVUFRPI1BSRVNUTwpDQVNIRVMjI1BFQVIjIyMKT1NIQSNFUklFI0dGTEFUClJFSU4jVE9ORVIjT0FUSApQQU5EQSNBQ1JFI09ORUEKIyMjQUNBRCMjSElEREVOClNQQVJFUyNNT0FOIyMjIwpBTFNPI1RIVU1CQVJJREUKVFVUVSNST1NFI0pBQ09CCklNSU4jQU1FTiNBUkVOQQpORVJEI0xFU1MjTUVTU1k="},{"title":"6/30/09 JOB SEARCH","author":"by Gail Grabowski, edited by Stanley Newman","date":"2009-06-30","grid":"V0FORSNTUFJFRSNJREVBCkFOT1gjTkVFRFMjU0VBTApTVEVQI0FSRUFTI1JBVFMKUElMT1RGSUxNI0NBTlNPCiMjI1NPVUxTI1BPRU0jIwpFTUNFRVMjI0JFRExBTSMKV09PRCMjU1RBTEUjUkVQCkVQQSNUQUxFTlRTI1RBUgpTRUMjV09PRUQjI1JJVEUKI1NIUklORSMjVEVFTlNZCiMjSE9TRSNDQVdFRCMjIwpTQ09PVCNNT0RFTEhPTUUKSU9VUyNESVZBTiNFR0FECkxBU1QjSU5FUFQjQVJJRApPTEVTI01JU1RZI0RFTlk="},{"title":"7/01/09 CONTRASTS","author":"by Shirley Soloway, edited by Stanley Newman","date":"2009-07-01","grid":"TElNQiNDVVNQI0VUSElDClNUQVIjT05DRSNBVkFTVApBQ0xVI0NMQU4jUkFSRVIKVEhJTlNLSU5ORUQjREVMCiMjI0NPQVQjI0RSQUIjIwpVUFNIT1QjVkVTVVZJVVMKUFJPI05PU0lSI01JVFRZClBVRkYjT1BDSVQjU1RJUgpFTlRFUiNBSEVBRCNFQ1UKUkVTVEVBU1kjS0lETkFQCiMjUEVOUyMjU0VSQiMjIwpDT08jVEhJQ0tIRUFERUQKQU5LTEUjT0hJTyNDT0RFClNURUVSI1dBUk0jS05FRQpUT05HUyNBTlRFI1NFTkQ="},{"title":"7/02/09 COMING APART","author":"by David W. Cromer, edited by Stanley Newman","date":"2009-07-02","grid":"QkFUI0ZFVElEI1RST1ZFCkFETyNBTUlOTyNSRVBFTApST1QjTE9UVE8jQU1FTlMKQlJFQUtUSEVSRUNPUkQjClNFTUkjRUVMI1ZFVCMjIwojIyNEQURTI0JBU0VISVQKQU1CRVIjI1NBRCMjRVJFCkJVUlNUQVRUSEVTRUFNUwpVU0UjI01BWSMjQUxMQUgKVEVSUkFJTiNMQU5FIyMjCiMjI0FDUyNTQVQjQ09MQQojUE9QVEhFUVVFU1RJT04KSEFEVE8jUlVSQUwjTE9UCk9OSU9OI1JBSVNFI0VTRQpHRU5SRSNTVEVFRCNSRUQ="},{"title":"7/03/09 SOIL SAMPLES","author":"by Doug Peterson, edited by Stanley Newman","date":"2009-07-03","grid":"VFJBV0wjRElOVCNHUkFCClNVU0hJI09ESUUjTFVLRQpQRVRJVCNXSUZFI0FCSVQKI0RJU0hJTkdUSEVESVJUCiMjI0tFUFQjWUVBI0tBWQpBUkZTI09SUyNFVEFTIyMKQkFSI0FERVBUI0VNQ0VFCkJSRUFLU05FV0dST1VORApSQU5ESSNEQUlMWSNCWUUKIyNDT01CI1JOQSNURUFSCkFTSCNCRUEjUFJFViMjIwpTQUxUT0ZUSEVFQVJUSCMKUExPWSNBUklBI1JPWUFMCklTQUsjTElOSyNMT1JORQpDQUZFI0xBRFMjU01PS0U="},{"title":"7/04/09 SATURDAY STUMPER","author":"by Anna Stiga, edited by Stanley Newman","date":"2009-07-04","grid":"QUxGI05FQUwjQ0hBQ0hBCkJPUkVJTlRPI0hBSUxFWQpJUkFMRVZJTiNJR05PUkUKRFJNTEtJTkdKUiNUVUJBCkVZRSNSQUdUT1BTI0RBWQojIyNKT0JMT1QjQU1CTEUKSkFEQSNMRU5TI0ZJQVRTClVOQUJMRSMjI1NFTlNFSQpEQVJCWSNPRElFI1RFQVIKR1NUQVIjRFVOQ0VTIyMjCkVUQSNFSkVDVEVEI0FCQwpKQUdTI0FTS0VEQUZURVIKVVNOQVZZI1BSRU1JRVJFCkRJQUxJTiNJTlJFUlVOUwpZQU5LRUUjTkVTUyNQRVQ="},{"title":"7/05/09 FULL-LENGTH IDIOMS: With something in common","author":"by Shirley Soloway, edited by Stanley Newman","date":"2009-07-05","grid":"SEFMT1MjUlVHUyNJTk5TI0dSQUZUCkFMT05FI0JSQUUjTkVBVCNMVU5BUgpIQUlSUkFJU0lOR0VYUEVSSUVOQ0UKQU5OVUFMI0FOREkjVEFMT04jRUVLCiMjI1NQSVQjT0FSUyMjTU9ERSMjIwpJTlRIRVRXSU5LTElOR09GQU5FWUUKU09XIyNPRUQjI1NNRUUjIyNBVkVSCklWSUVTI0VMSVMjQkFMTSNPTUVHQQpUVUdBVE9ORVNIRUFSVFNUUklOR1MKSVNTVUVSI1NMQVYjIyNHSEkjVFNFCiMjI1hUUkEjRU1JVFMjUklPUyMjIwpTU1MjU0lYIyMjVEFLRSNHTE9SSUEKUFVUU09ORVNIRUFESU5USEVTQU5EClJFUElOI0xFT1gjQVRUWSNTQU5UQQpJREFTIyMjR1JJUyMjRVBJIyNUV1AKR0VUU09GRk9OVEhFV1JPTkdGT09UCiMjI1lBTEUjI1NBTkUjU0NBUiMjIwpCQlMjRkFSRUQjV1JFTiNBTEVSVFMKTE9PS0lOR0RPV05PTkVTTk9TRUFUCk9BU0lTI0lOR0UjT1NJUyNTTkFSRQpCUk9USCNFQVNUI1RZTkUjSE9MU1Q="},{"title":"7/06/09 MORE MONEY","author":"by Gail Grabowski, edited by Stanley Newman","date":"2009-07-06","grid":"QVRMQVMjSEVBUiNSQVBUClNISVJLI09HTEUjQUJMRQpQUkVNSVVNR0FTI0lSQU4KU1VOI1BSRVMjRVNTQVlTCiMjI1RPTlMjR0xFRSMjIwpTUE9JTFMjUEFMQUNFUyMKQ09VUEUjU0FNRSNBTlRTCkFTVE8jUkFDRVIjVFJFSwpURUVOI0VXRVMjQVRPTkUKI0RSRUFNRUQjUElMTE9XCiMjI1NMRUQjU0lSRSMjIwpBTlRIRU0jU0hFRCNUT0UKVEFSQSNCT05VU1JPVU5ECkFNRU4jRVhJVCNPVU5DRQpERUVEI1JPVFMjUFJFRU4="},{"title":"7/07/09 LOOK SHARP","author":"by Billie Truitt, edited by Stanley Newman","date":"2009-07-07","grid":"QUJDUyNUQUxMI1NQRUFSCkNPVVAjQUxNQSNQRU5OWQpUT1RFI1RJTlQjSEFTVEUKU1RJTEVUVE9IRUVMIyMjCiNIRUxMTyMjRUFSI0NBUAojIyMjRE9PTSNSRUZJTEUKQVdBS0UjQk9BVCNBUlRTClNBQkVSVE9PVEhFRENBVApBR09HI0hFUkUjWUVBUlMKTU9VU1NFI1NFTUkjIyMjCklOVCNQVEEjI1VOQ0xFIwojIyNCTEFERU9GR1JBU1MKVElBUkEjSFVGRiNPUlNPCkFSSUFTI09SQUwjT1ZBTApCRVJUSCNDT05FI0tBWU8="},{"title":"7/08/09 TASTER'S CHOICE","author":"by Fred Piscop, edited by Stanley Newman","date":"2009-07-08","grid":"U0NSRVcjQUNFRCNNQVNTCk9IQVJBI1JPVkUjRUxBTApTT1VSR1JBUEVTI1NPTEUKT1dMI0dBUlkjRUxBVEVECiMjI09MR0EjQ1JBQiMjIwojI1NXRUVUTk9USElOR1MKSEVXRUQjI09WRVIjT09ICkFMRVMjVElMRUQjUE9SRQpOSUwjVFVOQSMjVE9ORUQKU0FMVFlMQU5HVUFHRSMjCiMjI0VSSU4jT1JTTyMjIwpTVFJFRVAjU0FHRSNGRUUKVEFVVCNCSVRURVJDT0xECkVMU0UjRVJJRSNFUkFTRQpQRUVSI0RBUkUjRFlMQU4="},{"title":"7/09/09 SOUNDALIKES","author":"by Shirley Soloway, edited by Stanley Newman","date":"2009-07-09","grid":"QkxPQiNCTEFCI01PU0VTCkxFTkEjQVVUTyNST1VURQpPTUFSI0xBSVIjSE9HQU4KQ0FJTkVNVVRJTlkjQUxUClNZUlVQIyMjU0VERVIjIwojIyNNSUxFUiNTRUFDT1cKT0RFI0NBVkVUVCNUQVRBClBFUlAjU0VHVUUjU05JVApFTElTI0NMSU5HUyNFU1QKQ0lDQURBI1NBR0FTIyMjCiMjQVRPTEwjIyNORUFSUwpBU0sjQ0FJTkFOREFCRUwKQkxBTksjU09MTyNTT01FCkNBTk9FI1pJT04jT1ZJRApTUEVOVCNUUkVFI05FVFM="},{"title":"7/10/09 ARTY","author":"by Norma Steinberg, edited by Stanley Newman","date":"2009-07-10","grid":"UlVNQkEjU1RJUiNFTE1PCkFTSUFOI0hPU0UjVk9JRApWRVJESSNBTk5BI0VVUk8KSURPI01PTkVUTEVOREVSCiMjSU5BTkUjI0lUUyMjIwpERU1PVEUjUkVTVE9SRSMKRVJBU0UjTUFUVEUjT0FSClNJR0gjQ0VOVFMjRURHRQpJQ0UjUE9MS0EjU01JTEUKI0FTU0VSVFMjT1BJTkVECiMjI0VSUiMjUkhFVFQjIwpCUkFRVUVPQkFNQSNSSUQKT0FIVSNDSEFUI1JFQURZCkFDTUUjVElMRSNFTUNFRQpSRUVMI1NPTEQjRFVLRVM="},{"title":"7/11/09 SATURDAY STUMPER","author":"by Sandy Fein, edited by Stanley Newman","date":"2009-07-11","grid":"UFJPRkVTUyNBVEFMT1NTCkxJQkVSSUEjTklHRVJJQQpBVkVOR0VSI0FNRU5JVFkKQ0FZI1NOT09QRUQjTklNCkFMSVQjQU5ORVgjTU9OQQpURU5PRiNHVVMjVEFDT1MKRURHRVJTI1NUQVRJT05TCiMjI05PT04jU1BPVCMjIwpWQUxBTkNFUyNVUFJPQVIKSVFVSVQjV0FSI1NFTE1BClBVTEwjVEFTRVIjREVOVApQQUwjTUFSU0hBTCNNRUEKQVZBUklDRSNBVEFWSVNUClNJQkVSSUEjU0lMRVNJQQpTVFlMRVRTI0hPT1RTQVQ="},{"title":"7/12/09 JUST FOR LAUGHS: As seen in nine clues","author":"by Fred Piscop, edited by Stanley Newman","date":"2009-07-12","grid":"Q0VTVEEjRE9NRUQjQUxCQSNDTEFQCkFMQVJNI0VNSUxFI1NFQUwjT0FSUwpUSU5ZQlVCQkxFUyNZRUxMT1dTRUEKI0FTU0lTVCMjQ0lURSNJUkVQRUFUCiMjI1RFRVNIT1QjRVRBI0lSRSMjIwpBU0NFTkQjQUNSSUQjUkVTI0FTUFMKQ0hBUlQjRlJFT04jQUdORVMjRUxPClRBQiMjQ09MQSNESVZPVCNDQVZJTApBUkNTI09YRU4jSVJJU0gjQUxFTkUKU0VBTSNTSFkjTUZBUyNVUExJTktTCiMjTElUTVVTI0FGVCNJU0xBTkQjIwpCQUxMT09OI1NLRUUjTklBI0VXRVMKT0JPRVMjVEFQSVIjRVZBTiNTQUZFCkRPV1NFI0lOQU5FI0xFU1MjI1JJRApFVkEjRVJOU1QjTlRFU1QjUklGTEUKU09ZQSNBR0UjU1RJTlQjVEVSU0VSCiMjI05BVCNMRU8jQ0FTQ0FERSMjIwpBSVJTSElQI1NXQUsjI09SQUNMRSMKQ1JPV1NORVNUI1NFTkRQQUNLSU5HCkxBVEUjR0FQRSNUUkFERSNUT05UTwpVU1NSI1NUQVIjQVNIRVMjU05PUlQ="},{"title":"7/13/09 SUMMER FORECAST","author":"by Gail Grabowski, edited by Stanley Newman","date":"2009-07-13","grid":"UkFDRUQjQ1JBQiNDSE9QCkFTT05FI1JFRE8jTE9HTwpNSUxERkxBVk9SI0VVUk8KUEFEI0xPVFMjREVBUkVSCiMjI1dBTkUjU0VFUiMjIwpMT0NBVEUjU1RSRVRDSCMKQURPUkUjU1BBUyNIT0VSCk5PUk0jI0hFTSMjRVBFRQpEUkFXI1NFRVAjRFdFTEwKI1NMRUVURUQjR1JBU1NZCiMjI0xFQVAjUFJFWSMjIwpTVElDS1kjU1VFUyNIQUgKSE9CTyNTVU5OWVNNSUxFCklURU0jT0tPSyNFUlJPUgpOT1RFI05FV1MjRElFVFM="},{"title":"7/14/09 HOLD IT","author":"by Sally R. Stein, edited by Stanley Newman","date":"2009-07-14","grid":"QkFUQ0gjU1BFVyNCT1NDCk9NQUhBI1RBTUUjVVBUTwpCT1hVUCNBUklEI0RFRU0KU0tJTVAjR0VUU0FHUklQCiMjIyNFTFNFIyNMRUFOIwpET01JTk8jI0NFT1MjIyMKRUdBRCNXRUFMVEgjSU9OCkZMWU9GRlRIRUhBTkRMRQpZRVMjUkFUU09OI0FMRVgKIyMjTUFURSMjSU5HRVNUCiNIQVJNIyNQQUNFIyMjIwpUT1RIRUhJTFQjUEFTVEEKT05MWSNBUkFCI0hVTUFOClJFQUQjSElZQSNFUlVQVApOWVNFI0FTU1QjV0FHRVM="},{"title":"7/15/09 OFF YOUR FEET","author":"by Norma Steinberg, edited by Stanley Newman","date":"2009-07-15","grid":"QVNQUyNTTEFQI0NBUEVSClNPT1QjUE9SRSNBUk9TRQpBTk5BI09OQ0UjTVRXVEYKUEFDS0lOR1NMSVAjRUVFCiNSRUVEUyMjU1RJUlJFUgojIyNTTE9CUyNTTklUIyMKSkFCI0VSUk9MI0dPUkdFCkFSRUEjU0FSQUgjVElFUgpZRUxMUyNTVFJJUCNQRUEKIyNMQVBTI1NBR0VTIyMjCkxBWVNPVVQjI0hFQVRTIwpFTEYjVVJCQU5TUFJBV0wKRklMRVMjSUxJRSNPSElPClRCT05FI1JPTkEjTk9OTwpZSVBFUyNERUVTI0dFRUs="},{"title":"7/16/09 ON THE BEACH","author":"by David W. Cromer, edited by Stanley Newman","date":"2009-07-16","grid":"VFJJIyNTUEVXI0xBU1NPCkhPTksjT0FUSCNTTk9PUApXQVZFT0ZUSEVGVVRVUkUKQU1BTkRBI0lSQSMjUkVEClJFRFlFI0lDRUNBUCMjIwpUUkVBU09OIyNUSUVEVVAKIyMjIyNPS1JBI1JFRUtTClNVUkZUSEVJTlRFUk5FVApFTU9SWSNET1RFIyMjIyMKQ0FCQU5BIyNFWFBFQ1RTCiMjI1RFU1RFRCNBTExJTgpUT04jI0hBTCNNSUxBTk8KQlJFQUtFUk9ORU5JTkVSCkFFUklFI09QVVMjU0NBVApST09NWSNURU5TIyNZUlM="},{"title":"7/17/09 ON THE DOUBLE","author":"by Richard Silvestri, edited by Stanley Newman","date":"2009-07-17","grid":"UElDQSNDSEVSI1NDQU1QClNUQUIjSFlERSNNQU5PUgpBQ1JPI0FNSUQjQVJUT08KVEhFUkVJTlRIRVJFSU4jCiMjI1RJUyNTQUxUUyMjIwpTQVRJUkUjI05JTFNTT04KQUxJVkUjUlVERFkjSEJPCkxBTUUjVEVQRUUjSEVFTApFTU8jTElWSUQjV0FJU1QKTU9OVEFHRSMjWUFOS0VFCiMjI0VZRVJTI0FORCMjIwojVEhFT1JFTVRIRU9SRU0KS0VBTlUjTkVSTyNWSUxFCklOTEVUI0NMRU8jRVRBTApET09SUyNFTEtTI1JFTlQ="},{"title":"7/18/09 SATURDAY STUMPER","author":"by Doug Peterson, edited by Stanley Newman","date":"2009-07-18","grid":"UElMRSNQRVJVI0FTS01FCkFOSVRBTE9PUyNTVE9JQwpXSE9PUEVFQ1VTSElPTlMKUEVOTkVEI0tBQSNGTElUCkFSSVNFI0ZFTEwjRkFWQQpXSVojUEFSVCNaQU5JRVMKU1RFTSNGSUpJI1JFRFJZCiMjI0NPTERTTkFQUyMjIwpTUEFNUyNBUVVBI1NBQ1MKVE9SQUhTI1VTQUYjQkFNCk9MSU4jQUJJRSNBV0FSRQpDRUVTI0FSUiNTQ0FMSUEKS0FUSUVCQVJUSEVET09SCkVYVE9MI0RFQ0FERU5DRQpERUFOUyNTTFVHI1JFQUQ="},{"title":"7/19/09 FOR STARTERS: An introductory offer","author":"by Doug Peterson, edited by Stanley Newman","date":"2009-07-19","grid":"TEFQRCNCVUNPI1ZBUElEI1RJUFBJCkFHUkEjRFJJQiNJUkFOSSNBQk9SVApJTklUSUFMUkVBQ1RJT04jUEVLRVMKUkVNRURZI0NMVUVTI1JFTEFYRUQjClNXQUxFI0dBSU4jIyNCSUFTI01JUwojI1JJU0VSI1NUQVJUSU5HQkxPQ0sKR0xZTiNUQUNLI0JFUlQjI0FJTlRJCkxBQ0VJTlRPI0FPTkUjQUNSRSMjIwpPU08jTUFJREVOVk9ZQUdFI0RJS0UKI1NMSVAjU0NFTkUjI0NBTFpPTkVTClJPT01FRCNBS0EjUEhJI1NFV0FHRQpLRVJQTFVOSyMjU1VFREUjU05VRyMKT1NTTyNPUEVOSU5HTklHSFQjR0VMCiMjI1VTU1IjRUdPUyNUUkVBU1VSRQpTUEVOVCMjU0hPTyNEWUVSI1VSU0EKTEVBRE9GRkhJVFRFUiNTQU1TQSMjCk9BUiNDT0xBIyMjTU9TUyNBUExVUwojQ0hPS0VVUCNQQUlOVCNUUkVCTEUKS0hBS0kjRklSU1RMSUVVVEVOQU5UCkVFUklFI0ZST1NUI05BTk8jU0xBVApBU1RFUiNTT09UWSNHTE9QI0VMU0U="},{"title":"7/20/09 WELL-TO-DO","author":"by Gail Grabowski, edited by Stanley Newman","date":"2009-07-20","grid":"UEFDVCNTQ0FMRCNQQVNTCkVDSE8jVEFCT08jQUxPVApBVElUI0VSQVNFI1NPTE8KUklDSEZFQVNUI1NURUVQCiMjI0VBUlRII01PTyMjIwpSQUNFUiMjI1RFUlJBQ0UKSVJPTiMjU0NPT1QjQlJSCkxPQURFRFRIRVdBU0hFUgpFU1QjTE9VSVMjI0NPUEUKU0VTU0lPTiMjI1NIUkVECiMjI0FUTSNTUEFDRSMjIwpBVE9ORSNGTFVTSERPT1IKU0VORCNBTEVSVCNVUERPClBBQ0UjVEVQRUUjTEFEUwpTTEVEI1RBVEVSI0VMU0U="},{"title":"7/21/09 SEIZE THE DAY","author":"by Billie Truitt, edited by Stanley Newman","date":"2009-07-21","grid":"RFVFVFMjU0FTUyNDQU1QCklTWUVUI1BMRUEjQUxPRQpTTUVBUiNBTUVOI1JPVVQKQ0FSUk9UQ0FLRSNCVU5UCiMjIyNEVUUjI1NIT0REWQpUUkFDRVIjU0FUSU4jIyMKSFVSTCNGTEVXI1NDQURTCkFTSUEjU09MRVMjT1ZBTApURUFTRSNBTFNPI1BJVEEKIyMjU0VSRlMjQU5ZREFZCkNJUkNMRSMjRU1VIyMjIwpJRE9MI0NSRURJVENBUkQKTkFUTyNLSU5HI01PVklFCkNIT1cjT0xERSNFUk9ERQpIT1JOI05FU1MjR0VORVM="},{"title":"7/22/09 MEET THE BUNKERS","author":"by Fred Piscop, edited by Stanley Newman","date":"2009-07-22","grid":"RlJFRSNCT0NBI1JBVkVECkxJUkEjT1JBTiNPUkFURQpFRElUSEhFQUQjU01JVEUKREVOI0FFT04jREVBTEVSCiMjI0FUTSMjI0lBTiMjIwojQVJDSElFTUFOTklORyMKQkxBSCNBUkFHT04jRUVMClJPVkVEI0lOTiNFTEFURQpPTkUjRU1DRUVEI0FUT00KI0dMT1JJQVNXQU5TT04jCiMjI0NBUiMjI0dBUyMjIwpIQVRUSUUjUlVHUyNBTEEKSURFQUwjTUlLRVRZU09OClJFRVZFI0lDRVIjU0hPVApFTkRFRCNURVNTI0xFVFM="},{"title":"7/23/09 LADIES' IDEALS","author":"by Shirley Soloway, edited by Stanley Newman","date":"2009-07-23","grid":"QUNDVCNMRVdJUyNPUkJTCkNIQVIjRUxJREUjTEVBUApSSVRBU1NJVEFSI0VOWUEKRVBPQ0hTI1NIQVcjRU9TCiMjI1RJRkYjT1BPU1NVTQpJREUjRUFSUCNIRVdTIyMKVEVSSVNUSVJFUyNBTkFUCkNMSU5UI0FJUiNQUkVHTwpISU5UI0VSTUFTU01FQVIKIyNTRUFSI0VTUFkjUlJTCkZFUlJBUkkjRUFDSCMjIwpBTEkjSEFSSyNTSEVJS1MKV0lORCNUSU5BU1NBVElOCk5PU0UjSU5JTksjREFMSQpTVEVXI0NBVFRZI1NMT1Q="},{"title":"7/24/09 EVENING UPDATE","author":"by Bruce Venzke, edited by Stanley Newman","date":"2009-07-24","grid":"TUFSU0gjUE9FTSNDT1dTCkVMT1BFI0FGUk8jQUNIRQpORVdMWUlOVFJPRFVDRUQKREVTSSNPREUjU0VDVVJFCiMjI1RFTkFOVCNTVVJFUgpBU1NFVFMjI0FTS1MjIyMKQkxVTlQjQkFSSyMjWU9VCkNPUkRVUk9ZUElMTE9XUwpTUEYjI0FHRVMjU0lERUQKIyMjTUVOVSMjSEFWQU5BCkFQTFVTI1NUUEVURSMjIwpDUklTUFkjUkVMI1dJTlMKTUFLSU5HSEVBRExJTkVTCkVERU4jT01BUiNPUkdBTgpTT05HI1JPVFMjUEVFUFM="},{"title":"7/25/09 SATURDAY STUMPER","author":"by Adam Cohen, edited by Stanley Newman","date":"2009-07-25","grid":"SkFNQkFMQVlBI0ZSQVVTCkFTSUFNSU5PUiNUT05ORQpQTEFZRURPVVQjTEFUSEUKRUFUUyMjI1JFTUVESUVECkROQSNSQVZFTE9FI1RFTAojIyNQQVBPT1NFI0pPREkKQVNTQVNTSU4jI0JPWElOClNMVVJQRUQjU0FJTElORwpQQUxFWSMjRUFSUklOR1MKRU1UUyNPQlRSVURFIyMjClJEQSNDUkFWQVRTI0JBRApTQU5QRURSTyMjI0dMVUUKSU5BTEwjQUlSQ0FOQURBCk9DVEVUI0NMRUFSQVNJTApORUVEUyNLQU5ZRVdFU1Q="},{"title":"7/26/09 SOUNDS LIKE SNAKES: To be found Across","author":"by David W. Cromer, edited by Stanley Newman","date":"2009-07-26","grid":"Q0FMVkVTIyNDT0FUUyNQQVQjRkxVCk9SSUVOVCNCT09URUUjRURVI09VVApCQVNTU0FYT1BIT05FI1BJTkhPTEUKU0xBVCNTRUEjI1pFU1QjRElBTFVQCiMjIyNGSVJUSFMjVEFSTUFDUyMjIwpDT01QQVNTU0FXI1NXSVNTU1RFQUsKQUxPVUQjIyNSQUgjU0FEIyMjRElFCkdMQVNTU0xJUFBFUiNET1d