{"id":"newsday-2017","publication":"newsday","year":"2017","count":365,"puzzles":[{"title":"01/01/17 SOMETHING FOR YOU: Seven somethings, to be precise","author":"Fred Piscop","date":"2017-01-01","grid":"RElSRSNQT0xFRCNHQVVMI0FSVUJBCklHT1IjQUJJREUjTFVCRSNMT1NFUgpDVUxUVVJFVlVMVFVSRVMjRFVDQVQKVEFMRU5UUyMjI0hFQVIjTUVURVJTClVOTyNQSUUjVFJJQUwjUEFSRU4jIwpNQU5TRSMjQVJJRUwjVE9ZUyNTQVkKIyMjVU5TQ1JVUFVMT1VTIyNNVUxFCkZPUFMjQ0FHRVMjI0FWRSNDRVNUQQpVSFVII0FNT1IjU09TQUQjTEFCT1IKRU5USVRMRSMjUEFORUwjVFVUVSMjCkxPVSNFUExVUklCVVNVTlVNI1JBUAojI1BUQVMjUk9MRVMjI0FQUExFVFMKRk9ZRVIjUkFSRVIjSEFWRSNPQVRTCklET0xTI09ORSMjTU9SQUwjUlVOVApGT1VMIyNDVU1VTFVTQ0xPVUQjIyMKRVJSI0FSS1MjTk9TRVMjI0hZRU5BCiMjREVMQVkjS0lDS1MjQVBVI05PVgpTTlVHTFkjVEFUQSMjI0JBUklTVEEKVE9LWU8jQ1JVRUxBTkRVTlVTVUFMCklORVBUI1BFQVIjTU9OVEUjTEVUTwpSRVNUUyNBWElTI0FNQVNTI0VERU4="},{"title":"01/02/17 JUST SAY UH-UH","author":"Gail Grabowski","date":"2017-01-02","grid":"REVBTiNTTFVHI1NDQVJFCkVYUE8jUElORSNUT1dFTApDVVJCI0VNSVQjUExFQVMKT0RJRSNOT1RJQ0VBQkxFCllFTExFRCNTVEFUIyMjIwojIyNQQVNTIyNTRU5BVEUKQ0hBUlQjUElQRSNPR1JFCk1JTkkjVFVORVMjVkVBTApPRk9aI0lSS1MjV0FTUFMKTklORUFNIyNUSUVTIyMjCiMjIyNMRVNTI05FQ1RBUgpOT1NFQVJPVU5EI09SU08KQVJFQVMjTklDRSNUQUNPClJFQVNLI0FUT04jSU1PSwpDT1RUQSNSRVNUI0FQVFM="},{"title":"01/03/17 HIGH POINTS","author":"Billie Truitt","date":"2017-01-03","grid":"U1dPT04jU0xFVyNQRVdTClBJQU5PI1lFQUgjQUNIRQpBTlRFUyNSQVJFI1RIRUUKTURTI1RSSVBMRUNST1dOCiMjI0FSRUEjI1pPTyMjIwojQkFTSUwjRFdFTExPTiMKRkFNSUxZQ1JFU1QjQk9CCklOTlMjI0FZRSMjT0FIVQpFR08jV09STERTVU1NSVQKI1NURUVQTFkjQVRFQVQjCiMjI01BUCMjSVJPTiMjIwpHRU5FUk9VU1RJUCNCU0EKT0RPUiNTUENBI0lTQUxMCkFHT0cjRVRBTCNBUFJJTApUWUtFI1NPTlkjTkFTVFk="},{"title":"01/04/17 OUT OF SEASON","author":"Mark McClain","date":"2017-01-04","grid":"V0lMRCNBU0tFRCNMSU1BCkFNSUUjUkVFTFMjT0RFUwpHQVNQI01BWUZMT1dFUlMKRVhQTyNJUlMjI0RSQUlOCiMjI1NQRUMjT0JPSVNUIwpBUFJJTFNIT1dFUlMjIyMKUk9VVEUjI1BJRSNLQUxFCkVMSSNBQ1RSRVNTI0NJQQpBT05FI0FBQSMjVVNIRVIKIyMjTUFSQ0hNQURORVNTCiNBTUlEU1QjQUxTTyMjIwpBTUFOQSMjSURJI09WRU4KSlVORUJSSURFUyNQRVJVCkFTSU4jVU5MSVQjRVJJTgpSRUNUI0JFRVRTI0RZRVM="},{"title":"01/05/17 TIME FOR A CHANGE","author":"Carolyn Stewart","date":"2017-01-05","grid":"QU5URSNTVEVUUyNHT09EClJPQVIjV0lHSFQjVU5ETwpPSElPI0FOR0VSI0lDT04KTUlORE9ORVNNQU5ORVJTCkFUVEVORCMjRVBFRSMjIwojIyMjVElNSUQjVkFORSMKQ0hBUCNWQU4jREVQQVJUCkNPVVJTRU9GRkVSSU5HUwpTV0VFVFMjRUVMI0dPT1AKI0VMTU8jQ1JFRVAjIyMjCiMjI0lOQ0gjI1RPQVNUUwpUSVJFWU9VUlNFTEZPVVQKVVNFUiNXUkVBSyNUQVhJCkdFTkUjRVJBU0UjRVZFTgpTRVRTI0RPUEVZI1JFU1Q="},{"title":"01/06/17 FOOD COURT","author":"S.N.","date":"2017-01-06","grid":"I1BPVyNTSUxMI0dPT0ZTClJBVkUjSUxJRSNBUFJJTApBUkVBI0dMRUUjWkVTVFkKV0FSUkVOQlVSR0VSIyMjCkVEUyNWRUUjI0FCQVRFUwpHRVRTSVQjTkVNTyNFUkEKR1NVSVQjU09NRSNIQVJQCiMjRlJBTktGVVJURVIjIwpSRUZTI0FJTFMjT01JVFMKQVlFI0lTUFkjU1BJTkVUCk1FRElOQSMjSUlJI0dOUAojIyNTQUxNT05QQ0hBU0UKU0hBTFQjQ0hBUCNUV0lUCklNUEVJI0FOTkUjTUFMRQpOT1JTRSNUT0VEI0xZRSM="},{"title":"01/07/17 SATURDAY STUMPER","author":"Frank Longo","date":"2017-01-07","grid":"Q0FGRiNTQU1CQSNCQUtFCkxVTFUjT0JJRVMjUkVJTgpBTEFTI0RVU1RTVE9STVMKQ0FHRU1BVENII0FMT05FCktJT1dBIyMjI0VESVNPTgpTVE5JQ0hPTEFTI05PVkEKIyMjVFJBVk9MVEEjTEFECkFOQ0hPUkFHRUFMQVNLQQpMRUUjU1BST1VURUQjIyMKU09MRCNPWVNURVJCQVJTCk9OTE9BTiMjIyNUVVRFRQpSQU1PUyNKQU1FU0RFQU4KQVRBTUlOSU1VTSNHQUxTCk5BVEUjT1ZFUlQjRVNNRQpTTEVEI1RFTktTI1RFU1M="},{"title":"01/08/17 A CENTURY AGO: What happened in 1917","author":"S.N.","date":"2017-01-08","grid":"U0NSQVAjSVRBTCNNT09EUyNBQkVUCkFMT05FI05BUEEjQU5OVUwjR0FSUgpMSU9OU0NMVUJTI05JQ0hPTEFTSUkKVE9NQVRPRVMjU0xJQ0UjV0VTU0VYCiMjIyNMSVQjSE9ZTEUjRkVFUyMjIwpTQVRFRU4jI0FFUk8jRElTQ0lQTEUKUE9FVFMjQU5EUkVXV1lFVEgjQUFBCkFSQ1MjRVJJTiMjI0VMRiMjQU5UUwpOVEgjU0FJTlRUSE9NQVMjTEVDSEUKU0FOTUFURU8jT0FLRU4jQ0FTSEVTCiMjSU9UQVMjT05TRVQjUkFESU8jIwpTRUNSRVQjQUJFQU0jREVTRVJWRUQKQ1JPU1MjUFVFUlRPUklDQU4jSURPClJJTEUjI0FEUyMjI09OVVMjRUxTRQpFQ08jRURESUVDQU5UT1IjQU9MRVIKV0FSUklPUlMjT1RPSCMjRklOQUxTCiMjI1JFTkUjQ1JPV1MjTk9SIyMjIwpBVUZBSVQjU1VPTUkjRE9PUkpBTUIKSlJSVE9MS0lFTiNTVEFOTEFVUkVMCkFHRUUjRUVSSUUjRVVSTyNJTkVSVApSRUVEI1RBSU5UI0VYRVMjRE9TRVM="},{"title":"01/09/17 BITS OF AN HOUR","author":"Sandy Fein","date":"2017-01-09","grid":"SEFUUyNBV0FLRSNFTUlUCkFMT0UjTEFCRUwjTElORQpSQVJFI0JJTExTI0FOT04KTUlOVEpVTEVQI1NQRU5ECiMjI0hFTVMjI0JBU1NFUwpBRE1JVFMjT01FTEVUIyMKUlVJTlMjQUJBVEUjUk9CCktPTkcjU1RFUFMjUk9ERQpTU0UjT0tBWVMjTEVORFMKIyNSQVBJRFMjTklDRVNUCklOQVJVVCMjU0FSSSMjIwpET0xFUyNNSU5JQVRVUkUKVE9PTiNDQU5BTCNBSE9ZCkFTSUEjQUxJS0UjTE9CRQpHRUxTI01FVEVEI1NIRUQ="},{"title":"01/10/17 FROM THE NECK UP","author":"Sally R. Stein","date":"2017-01-10","grid":"QUJBVEUjVFJBQ0UjRVRDClNPTEFSI1dPTUFOI1lFQQpIQUlSUkFJU0lORyNFTkQKIyMjVEFOR1kjIyNCQ0RFCklTTEFORFMjTUlERUFTVApEQUlOVFkjTEFSSUFUIyMKVFNQUyMjVEVYQU4jQ1BBCkFTUyNIRUFESU5HI0hPVApHWU0jRUxMSVMjI1BJUFMKIyNBSVJNRU4jQkVSTklFClNVQ0NFU1MjQk9MT0dOQQpJTktZIyMjRVVST1MjIyMKWENJI0pBV0RST1BQSU5HClBBTiNBR0FJTiNFRVJJRQpNUEcjUkVTVFMjRFJBUEU="},{"title":"01/11/17 AT THE U.N.","author":"Charles Slack","date":"2017-01-11","grid":"UFNUI0JPQkNBVCNEUk9QCkFURSNBVkVSU0UjSU9XQQpHRU5FUkFMQVNTRU1CTFkKT1dOUyNMQUJFTFMjIyMjCkRFSUNFIyMjVEFUVExFRApBRFMjUk9BRCMjQVJJU0UKIyMjQklHQkFORyNFU1BOCiMjU0VDUkVUQVJJQVQjIwpBQkxFI0VMRU1FTlQjIyMKU09BUFkjI1NFV04jUEVQCkhPVFNFQVQjIyNTQ0VORQojIyMjQU1JRFNUI0FOVEUKU0VDVVJJVFlDT1VOQ0lMCklSQVMjU0hFQVJTI0lSRQpQQVJFI1NFUk1PTiNMRUQ="},{"title":"01/12/17 ET TU","author":"Fred Piscop","date":"2017-01-12","grid":"QkFMU0EjU09MRSNWSUVECkFMT1VEI0NIRVgjT05UTwpNQUNSTyNBTk5BI0lUQ0gKQVNLSU5HVE9PTVVDSCMjCiMjI05JUFMjIyNMRUVEUwpFTFBBU08jS0VOVCNDRUwKVEVBTSMjSlVST1IjQUNFCkFHUkVFVE9ESVNBR1JFRQpJUksjWEVOT04jI0VESVQKTEVJI1BFR1MjQkxBU1RTClNFTk9SIyMjU09VUiMjIwojI0dPT0RZVFdPU0hPRVMKSEVMTSNFVVJPI1RFTVBFCkFUT1AjQkxVUiNSQU5JTgpNQVRII1RFRU4jRURJQ1Q="},{"title":"01/13/17 LOCKED OUT","author":"Carolyn Stewart","date":"2017-01-13","grid":"SElUQ0gjQVRNUyNUSEVPCkFSRUFTI0xFQUsjSE9STgpJV0FOTkFCRUxJS0VZT1UKS0lMTyNMQU1FI0FNQVNTClVOU0VBTCMjU0laRSMjIwojIyMjUEFQQSNOQVBPTEkKSk9DS0VZRUQjU05BS0VTCkFERU4jI1dPRSMjUklWRQpWRU5FRVIjQkxBQ0tFWUUKQVNURVJTI09TTE8jIyMjCiMjI1BFQVIjI0FNQU5EQQpMSUxBQyNIQUlSI1NJUlMKSUNBTlRGSU5ETVlLRVlTCk1PU1QjSU5UTyNFTUNFRQpBTlRTI0JPSUwjU0VFUlM="},{"title":"01/14/17 SATURDAY STUMPER","author":"Lars G. Doubleday","date":"2017-01-14","grid":"SE9UVE9QSUMjUkFLSVNICk9ET05ORUxMI0FMTERBWQpXSVNURVJJQSNXRUVMQUQKRVNDI1NUVU1QUyNQWVJFClNUQURJVU0jUklGVCMjIwojIyNPRVIjRk9MTE9XTUUKQUJFTCNCQVVNS1VDSEVOCkJFTExTI1BFUCNCUklOWQpCTEFDS0JFTFRTI0FHVUEKUkFMTElFUlMjV0JDIyMjCiMjI09QRUMjUE9MWU1FUgpJQkVUI0ZVVFVSQSNPUkUKTU9USFJBI09QRU5QTEFOClVOUkVBTCNTUElDSUVTVApTRUVTVE8jU1lOQVBTRVM="},{"title":"01/15/17 GEOGRAPHICALS: Of five syllables","author":"Debra Hickok","date":"2017-01-15","grid":"RUZMQVQjVU1QUyNTQU1PQSNNT0hTCk1PT0NII05PU0gjUElPVVMjQ1JPVwpNQVVSSVRBTklBI0FERElTQUJBQkEKQUxURVJFR08jUkFURVMjQU5BTE9HCiMjIyNTQ0kjQVBMVVMjTVVOSSMjIwpTQUJPVFMjS05FRUwjU09MT05HQVMKQ0xVTlkjVkFUSUNBTkNJVFkjVVNICk9UUk8jSE9QSSMjI09BUlMjS0FUTwpPQUsjVEVHVUNJR0FMUEEjU0FESUUKUFJJTUVDVVQjTUFUVEUjTElaQVJECiMjTklDSEUjVEVSU0UjRkVSQUwjIwpTV0FUSEUjTUVBREUjQ09WRU5BTlQKTE9GVFMjTUlOTkVBUE9MSVMjSkVXCk9LQVkjREFOQSMjI0xVSVMjV0FWRQpXRVMjS0lMSU1BTkpBUk8jSElSRUUKU05PQ09ORVMjVEFVTlQjSEFaQVJECiMjI0FSRVMjSEFTTlQjQkVOIyMjIwpBUkFSQVQjU0FMVEkjSUxMR0VUSVQKU0FOQU5UT05JTyNQQVJBTUFSSUJPCklTTlQjRVZJTFMjRUxBTiNSSURFUgpBUEVTI1NBVEVTI1JJTksjU0VFVE8="},{"title":"01/16/17 LOOK UP","author":"Gail Grabowski","date":"2017-01-16","grid":"VE9QUyNWRVJTRSNSU1ZQCkFSRUEjSU5BSVIjRVRBTApMQVNUI0VESVRTI0NBU0UKQ0xPVUROSU5FI1RJUkVECiMjI1JBTlRTI1NJUFMjIwpBUk1BREEjI0RFTEVURVMKQk9PVFMjVEFVTlQjUkFXCk9CT0UjQk9SRUQjTVVTRQpESU4jQkFOS1MjUEFDRUQKRU5TTkFSRSMjUkFOS0xFCiMjSE9STiNGSUVMRCMjIwpQUklDRSNTVU5GTE9XRVIKUkVOTyNSSU5TRSNMSVZFCk9ERVMjT0RERVIjSURFQQpQT1JUI1RFU1RTI05FUkQ="},{"title":"01/17/17 FOOD COLORING","author":"Sally R. Stein","date":"2017-01-17","grid":"Q0hBVCNZQVBTI0FCQVNICk1JQ0UjQUZSTyNEQU5DRQpPVkVOI0NMT1AjT0NFQU4KTkVTUyNIQVNIQlJPV05TCiMjI1BVVFQjI1lFTiMjIwpERUZFUlMjUkVGUyNCRUQKQVJJRVMjR0FHQSNBQkxFCk1BTkRBUklOT1JBTkdFUwpVU0VTI0FMQVMjU1RVQ0sKUEVSI0JSQVQjR0lBTlRTCiMjI1NVRSMjU09BUiMjIwpTT1VQR1JFRU5TI0NMSVAKUFVQSUwjVFJBUCNUVU5BCk9aT05FI0RJUkUjSVJPTgpUT05FUyNTRUxMI0NFTlQ="},{"title":"01/18/17 I'LL DO THAT","author":"Billie Truitt","date":"2017-01-18","grid":"QUxEQSNUT1JURSNMSU1CCkxJQU0jQVJJRVMjSURFQQpBTU1PI0JBU0VTI0dPQVQKTk9QUk9CTEVNQVRBTEwjCiMjI0FOWSMjI1lBTSMjIwpTQUJMRSNBUEIjTkVXQVQKQU1BI0FMTElFUyNOT0lSCkpVU1RMRUFWRUlUVE9NRQpBU1RPI0dST1RUTyNFRUsKS0VFUFMjTVRTI1dPUkRTCiMjI1NBTSMjI1lFUyMjIwojSEFQUFlUT0hFTFBZT1UKUk9NRSNOT0JFTCNSSVBTCklTRUUjQVRPTEwjRVBFRQpCRU5EI0hFRURTI1lFTlM="},{"title":"01/19/17 TWO ON THE ISLE","author":"S.N.","date":"2017-01-19","grid":"Q0FDVEkjRkxFQVMjRURUCkFTSEVOI1JPQUNII1NBWQpTVEFORCNBUlJBWSNUSUwKSEFJVElBTkQjREVGVVNFCkJJTiNBUkMjVEVSUkFJTgpBUkVBI1RFTkFNI09SRU8KUkVESUQjI0FYSVMjWVNMCiMjI0RPTUlOSUNBTiMjIwpBRlQjQ09STiMjR1VJREUKVklBTCNMQVlFUiNUUkVYCk9SSU9MRVMjSkFCI0VWQQpDRUxUSUMjUkVQVUJMSUMKQVJFI01VU0lDI1JFQUNUCkRFTiNCTEFTVCNQQU5FTApPREQjU0VYRVMjU1VEU1k="},{"title":"01/20/17 MERELY TEASING","author":"Mark McClain","date":"2017-01-20","grid":"QUxBUk0jI0FHTyNBTlRFCk5PRkVFI1NFUkYjQkVBTgpHVUVTUyNBU09GI0VYSVQKI1RXSVNUVE9QQk9UVExFCiMjI05BQiNQRUVOI1RPUgpNR00jR0FTIyNBQ1RPUlMKVEVFVEVSVE9UVEVSIyMjClZFR0EjI0FSSyMjT0RFUwojIyNUQVRUT09BUlRJU1QKSlVORUFVIyNTVUUjU1BZClVQSSNBUkNII0REUyMjIwpUSEFUU1RIRVRJQ0tFVCMKVEVDSCNMSUFSI0FJREVTCkVSSUUjRU5WWSNSRU5FRQpERU5ZI1NBWSMjRFJBTUE="},{"title":"01/21/17 SATURDAY STUMPER","author":"Matthew Sewell","date":"2017-01-21","grid":"TElGVFNBSEFORCNUSFVEClBST1NFQ1VUT1IjUlVORQpHSUdFQ09OT01ZI1lNQ0EKQVNTI1RSQU1TI0FUQUxMCiMjI0JPTk4jI0NMT05FUwpSSURFUlMjU1RMVUtFIyMKT01FTlMjTk9DQU1FUkFTClRBTEMjREVSQlkjRVJJRQpJTVRISVJTVFkjU1BPREUKIyNBV05VVFMjVE9VUkVECkRFRkFORyMjQ09NUCMjIwpBTE9SUyNQUklNRSNETkEKVEVSTSNET09SVE9ET09SCkVDQ0UjQVNUUk9OT01JQwpTVEVSI0RFQ0lNRVRFUlM="},{"title":"01/22/17 FILLING YOUR HOME: With various furnishings","author":"Gail Grabowski","date":"2017-01-22","grid":"QVNUSSNCT0xUUyNTVFVOVCNFWlJBClBFQVIjQUZPT1QjRUVSSUUjTUVBRApCRURPRlJPU0VTI0NSSUJTSEVFVFMKU1BBTklFTFMjI0VMTVMjVEVSU0UjCiMjI0JPTEQjRFBMVVMjQUNBSSMjIwpBTEJBTlkjSEVST0QjU05BUkxTQVQKTEFVUkEjQ0FCSU5FVFBPU1QjVFNBCkxUUlMjQ0hSSVMjI0FJREUjTk9PSwpBVEUjQ0hFU1RNVVNDTEUjQk9PTkUKSEVBVFJBU0gjI05FSUwjTUlETEVSCiMjVVNFUlMjQkVTRVQjSEFEVVAjIwpQRUNLRUQjQ09MRSMjV0FHRUhJS0UKQUNIRUQjQ0hBSVJQRVJTT04jR05VClZPSUQjTU9PUyMjQUxJVE8jVEVBUgpFTkUjVkFOSVRZUExBVEUjUFJPVk8KU09GVEVORVIjRUxJVEUjUExBTkVTCiMjI0VUQVMjTUFJTkUjUkVBTSMjIwojTUVMVFMjQk9SRSMjU0VBU0NBUEUKVEFCTEVTUE9PTiNCRU5DSE1BUktTCkFUT00jQUJBU0UjT1JBVEUjUklHUwpHRU5FI1NBVEVEI1dBR09OI1NBU0U="},{"title":"01/23/17 UP OR DOWN","author":"Gail Grabowski","date":"2017-01-23","grid":"RElSVCNHQUlUUyNNRUxUCk9ET1IjT1NDQVIjSVNFRQpTT0RBI1NDQU1TI1NDQU4KRUxFVkFUT1JTI1NIQUZUCiMjI0VMQVRFI0NPQUwjIwpHQVNMT0cjI0NPTVBBU1MKT0NURVQjQkxBWkUjVEFQCldFRUQjTEVFUlkjQk9SRQpOSVAjTUVFVFMjU0VSR0UKU1RMT1VJUyMjQ0VBU0VECiMjQVJUUyNBQkxFUiMjIwpPTERJRSNTVEFJUkNBU0UKV0FERSNNT09TRSNVQ0xBCkVWRU4jUlVOSU4jQlJBVApEQVJUI1NQRU5UI1NFVFM="},{"title":"01/24/17 HERE'S THE SCOOP","author":"Billie Truitt","date":"2017-01-24","grid":"IyNTSVIjRUxTRSNDUkFCCk9GQUdFI1JBUFMjRE9ETwpUT05FUyNVS0VTI1NDQU0KQlVUVEVSUEVDQU4jS0dCCiNSQUlMQVQjI1lFU1lFUwojIyNUTEMjTVVTVEVSIyMKU0FQI1NFREFOI1NMT1BFCkVNSVQjU0VORFMjRkFJUgpBU1NPQyNCTE9UUyNETkEKIyNUT0FTVFkjRVBBIyMjClRIQVRMTCMjVkVSU0VTIwpSRUMjRlVER0VSSVBQTEUKT0FIVSNNSUxFI05JQ0VSClRSSU0jUFJFUCNHUk9XUwpTVE9QI1NFRVMjU0VUIyM="},{"title":"01/25/17 LANDS O'LAKES","author":"Mark McClain","date":"2017-01-25","grid":"TEFUUyNNQVNTI0ZFTE9OCk9TSEEjRUxMRSNPTElWRQpDSEFNUExBSU4jUklTRVMKSEVJU1QjI01PQlMjQU5UCiMjI09VU1QjUk9BTSMjIwpXSU5OSVBFU0FVS0VFIyMKSURPIyNSQU0jTkVBUkJZClRFVEUjSUxJQUQjVElOQQpTQUlHT04jVFNBIyNDQVcKIyNQT05UQ0hBUlRSQUlOCiMjI1NFRVIjUFlSRSMjIwpTSEgjRFJVQiMjVVNBR0UKQ0FJUk8jTU9PU0VIRUFECkFMTE9XI0JBTEUjT1JJRwpNRUxPTiNTVEVXI1RPTkU="},{"title":"01/26/17 HOW OFTEN?","author":"Fred Piscop","date":"2017-01-26","grid":"QU5HU1QjU0NBTSNNQVJTClJPVVRFI1BBUkEjQUxPRQpFTExFTiNBTEVYI1RPR0EKI0FMV0FZU0ZBSVRIRlVMCiMjIyNOQU0jIyNSSVRFUwpSRUFMVFkjQVRMQVMjIyMKT0dSRSMjU1BPT0wjRVZFClNPTUVUSU1FU0NBTExFRApBU1MjT0RPUlMjI0FNSUQKIyMjU1RBR1kjTEVNT05ZClNQQUNFIyMjQkFSIyMjIwpORVZFUkhFQVJET0ZJVCMKSVJPTiNBVVRPI0RJVk9UCkRPSVQjVFJPVCNFTEFURQpFTkRTI1NPUEgjREVOU0U="},{"title":"01/27/17 ULTIMATE MALES","author":"S.N.","date":"2017-01-27","grid":"TFVBVSNBU0FQI0xJTUJTClVTU1IjU0FWRSNBV0FSRQpNQVRDSElOR09UVE9NQU4KQlJBSE1BUyNSVlMjTUlOCkFNTklPI0tSSVMjUEFORQpSWUFOI0FSRUEjVEVNUFQKIyMjI1RSSUcjTEFSSUFUCiNNQUdJQ1RBTElTTUFOIwpCT1NVTlMjTEVFSyMjIyMKQU5UU1kjV0lUUyNUUk9ECkhPT1QjQkVBRCNBU09ORQpBTEwjTkVBI09VUlRPV04KTUlERExFTE9XR0VSTUFOCkFUVElDI1RPTkcjQUlSWQpTSE9QUyNIT1NTI1BFRFM="},{"title":"01/28/17 SATURDAY STUMPER","author":"Brad Wilber","date":"2017-01-28","grid":"U1VQRVIjIyNHQVJORVRTClRSRVhFUyNDT0xPU1NBTApBU0NFTlQjVU5JQ1lDTEUKR1VUQ09VUlNFI1NOQUtFCkVMSSMjQklQT0QjQ0xPUApSQU5EQiNMSU5FRCNBVkUKIyMjVVJHRUQjRkFTVEVSCiNPTEVBUlkjUk9TSUVSIwpSSUFMVE8jU0lHSFQjIyMKRUxLI1NXRUVQI0lTVVpVCkFCRVMjTFVSRVMjI1NPTgpMQVBBVCNSRU5BU0NFTlQKSVJPTkVET04jTUFJVEFJClpPRVRST1BFI0VTVEFURQpFTlRFTlRFIyMjSEVYRUQ="},{"title":"01/29/17 FOR YOU, NO CHARGE: With something small in common","author":"S.N.","date":"2017-01-29","grid":"R09SRVMjU0xVUiNGTEFTSCNBWlVSCkFMQU1PI0hBUkUjTElCUkEjRE9SQQpaQUJBR0xJT05FI09OSU9OUklOR1MKQVZFTkdFUlMjQkVSRVQjR09ERUVQCiMjI0FJTlQjVE9YSU4jU0VHQSMjIwpHUkFURUQjSk9LRUQjQVBSRVNNT0kKUkVGRVIjUkFQU0NBTExJT04jSURPCkFDSUQjVkFNUCMjI0VERU4jU0xJVApNQUMjUEFSSVNISU9ORVIjQkFMU0EKU1BJS0VMRUUjT1JSSU4jSEFCSVRTCiMjT05BSVIjQVBJQU4jUkFUSU8jIwpBUk5PTEQjV1JJU1QjQ0FZRU5ORVMKTU9BVFMjTElPTkhFQVJURUQjQVNICkJVRFMjRkVOUyMjI1dPRVMjQ0lURQpFR08jVFJBREVVTklPTlMjRkFSRUQKUkVTVEVBU1kjUEVTS1kjVElNRVJTCiMjI1dBR0UjUFJBVEUjRVlSRSMjIwpTQ0hJU00jS0VJVEgjRVhQRU5TRVMKUElPTkVFUklORyNNQVJJT05FVFRFClJBTkcjTk9UQ0gjVVJJUyNaQUlSRQpZT0tFI1RXRUVUI1NFQ1QjRVJSRUQ="},{"title":"01/30/17 BOWL GAME","author":"Sandy Fein","date":"2017-01-30","grid":"QUNFUyNDRUFTRSNFU1BOCkxPVkUjSVFVSVQjU1RBWQpNQUlMI1JVTlRTI0NSVFMKQUxMRVlDQVRTI1BPSVNFCiMjI0NFTExTI1dPUksjIwpORVNUTEUjI01JVFRFTlMKRVhQRUwjQlJBR1MjR09QClBJTEUjQkVBVFMjSE9CTwpBTEkjSEVMUFMjQ0VMTE8KTEVUU0VBVCMjQlVSREVOCiMjSE9STiNBTElCSSMjIwpQTEFOQiNTUEFSRVRJTUUKUkFJTiNCVVJTVCNBREFNCk9HUkUjQU1JU0gjR0VSTQpQU1NUI1NPTE9TI0VBU1k="},{"title":"01/31/17 EMPLOYER TRIO","author":"Billie Truitt","date":"2017-01-31","grid":"QkFTSyNTTElQI1NFQUxTCkFDVEkjSE9NRSNVUkJBTgpUSElOI0lOT1IjQkFMU0EKSE9MRElOR0ZJUk0jRVNQClNPTEFDRSNGTFVJRCMjIwojIyMjT1JCIyNTVElGTEUKQVdNQU4jVVJHRSNBUklBClRIQVRTTVlCVVNJTkVTUwpNQVNUI0FTSVMjTkFUVFkKRVRDRVRDIyNISVMjIyMjCiMjI05FQVRPI0ZVU1NFRApBUFAjVFdPU0NPTVBBTlkKVE9PVEgjU0NBTiNBTlRFCk9MRElFI0VBUkwjREVFUgpQT1NFUiNBUlRZI0VSUlM="},{"title":"02/01/17 PEANUTS","author":"Charles Schulz Slack","date":"2017-02-01","grid":"U0hFIyNFTUNFRSNVU0FGCkhPTiMjR1VBVkEjUE9MTApBTEEjUE9DS0VUTU9ORVkKUkVCRUwjSEVSRUlOIyMjClBVTFNBUiNTWU5DI1pFTgpTUEVDVEVSIyMjRVJPREUKIyMjI1RBSVBFSSNCT0dTCk5JQ0tFTFNBTkRESU1FUwpBTE9FI01FRERMRSMjIyMKU0xVR1MjIyNTRU1JTkFSCkFTUCNBTlRJI0RBS09UQQojIyNVTklPTlMjTkVTVFMKQ0hJQ0tFTkZFRUQjSElQClBBSUwjQ0FSTlkjI09SRQpBU0lBI0VMQVRFIyNXRUQ="},{"title":"02/02/17 IN TIERS","author":"Fred Piscop","date":"2017-02-02","grid":"U0lNQkEjS0FURSNLTkVXCkFSSUFMI0lETEUjQU9ORQpNQVJLRURERUNLI1JJVEUKU05FRVJFRCMjI0JBU0VECiMjIyNUV09TI1ZPVEVSUwpPU1BSRVkjQ1JFV0VMIyMKQUlSRUQjR0FJVFMjRVZFClRSSVgjQ09NQk8jVFZBRApISUMjU09VUFMjTk9FTkQKIyNFU0NBUEUjVEVUTEVZCklORkxVWCNST09NIyMjIwpTT0xJRCMjI0dVRVNTRUQKQVJPTiNTSE9SVFNUT1JZCkFNT0sjTE9XRSNFRVJJRQpDQVJZI1lFTlMjU1BFRUQ="},{"title":"02/03/17 PARENTAL ADVISORY","author":"S.N.","date":"2017-02-03","grid":"I0ZBQSNCUExVUyNOQ0FBCktBTlQjWU9VTlQjT09QUwpISUtFI1pFTkRBI1BSRUsKQUxMVU5BVFRFTkRFRCMjCktFRVBJTiMjUktPI0VBUgpJRFMjTVRHRSMjV0FMTEUKIyMjQ0hJTERSRU5XSUxMCk1XQUgjTkVHRVYjRUFTWQpCRUdJVkVOQUJBU1MjIyMKQUxPTkUjI1JBQ0sjU1RQClNMTyNBT0wjI1VJTlRBUwojI0RSVU1BTkRBUFVQUFkKQUJCQSNBQk9VVCNSRVBPCldJSUcjSE9SREUjU1RFUApMT1RTI0FSTUVEI0VFUiM="},{"title":"02/04/17 SATURDAY STUMPER","author":"Anna Stiga","date":"2017-02-04","grid":"U1BBTUFMT1QjSU5CUkVECkNBTElHVUxBI0JJTE9YSQpPUkFMRVhBTSNTVElMVFMKRlRDI1NVViNCRUVUTEVTCkZJQVQjUklTRU4jWk9ORQpTQVJBI1lJUFMjS0VOVFMKQUxUVEFCI0xFVE9OIyMjClRTRSNDT0RPVFVLI01TVAojIyNGSVhJVCNOT05PTk8KQlJBSUQjTkNBQSNQTE9XClJBR0UjSE9IVU0jUkVCQQpBVkVOR0VTI0dFVCNDQVcKWklOTklBI0hVTEFIVUxBCklOREVCVCNBU1RSQUxMWQpMRUFTRVMjSVRTQU1FU1M="},{"title":"02/05/17 FEATHER OR NOT: Try to wing it","author":"Gail Grabowski","date":"2017-02-05","grid":"QVJBQiNPUFRJQyNNRUFUI1BBUktBCldPUkUjQUVUTkEjVUNMQSNHUkVFRApFQUdMRVNDT1VUI0RPVkVUQUlMRUQKU05PT1QjU1BJRUwjI0FCVVRTT04jCiMjI05ITCNTVFJPUFMjT0JPRSMjIwpCVUdHSUVTIyNUT09USCMjVU5DTEUKSVJSI0NSQU5FT1BFUkFUT1IjSEVYCkxBT1MjT0RPUiMjTVVTRUQjVklUQQpHTFVNTFkjSElMTCNUSEFJI0lDQk0KRVNTQVkjI09DRUFOIyNSRVZPS0VTCiMjRUxMI1NXQU5TT05HUyNBTEUjIwpPTkFMRVJUIyNTRVZFUiMjTUVOU0EKQ1VCQSNPQUZTI1JBVkUjT1BURk9SClRST0QjTUlMRVMjI0lUQUwjU0VBTQpBU1UjQ0FOQVJZSVNMQU5EUyNFVkUKREVURVIjI1dJTkRZIyNERUNJREVECiMjI1JBUkUjRkVJTlRTI1JPRCMjIwojU1BBVFVMQSMjREFSRUQjUkFOQ0gKR09PU0VCVU1QUyNQSUdFT05IT0xFCk9JTEVSI0RFQVIjU1BFTEwjT1BBTApQTE9EUyNFTkRTI0VFUklFI1NFTkQ="},{"title":"02/06/17 MONDAY EXERCISE","author":"Gail Grabowski","date":"2017-02-06","grid":"VFdBUyNGUk9NI1dBR0VSCk5PUEUjUkFHRSNFTFVERQpUUkVFI0FJTFMjQk9SRVMKI0VYUEVOU0VBQ0NPVU5UCiMjIyNBQ0UjI09BRiMjIwpCTE9VU0UjQ0xBTSNHT08KUkFOR1kjT1JFUyMjUlVUCkVYQ0hBTkdFU1RVREVOVApXRUQjI0VSQVMjUEVBQ0UKU1JTI1RFRU0jUEVXVEVSCiMjI1NPRCMjUEFOIyMjIwpFWFBJUkFUSU9OREFURSMKQVJFTlQjUk9MRSNDT1JOClNBUkdFI0FXT0wjVFJJTwpUWVBFUyNQQVNTI1NFRUQ="},{"title":"02/07/17 CONNECT FOUR","author":"Billie Truitt","date":"2017-02-07","grid":"Q0FSQVQjRFJFU1MjQkFBCkFNQkxFI0lPVEFTI1VSTgpSQUlMUk9BRFRJRSNSSUcKIyMjI01PUlNFTCNBR0VTCkdPU1NJUFkjI0JBUkVTVApBV0FJVFMjU0hPV0VSIyMKRkxVVEUjU1RFQUwjSklHCkZFU1MjU0hPUlQjVE9ETwpFVEEjR0VBUlMjR1VJTEQKIyNHUkVFRFkjQlVSTkVSClNURUFNUyMjUkVFTlRSWQpXSUxZI1RPV0VSUyMjIyMKQU1JI1NBVklOR1NCT05ECk1FTiNLUkFGVCNTQVVDRQpJUksjSVNMRVMjT05JT04="},{"title":"02/08/17 NOTHING SPECIAL","author":"Charles Slack","date":"2017-02-08","grid":"QUxPRSNDQlMjI0JPUklTCkpVTVAjQU9MI0hBVkFOQQpBTEFDQVJURSNFTEFURUQKUlVOT0ZUSEVNSUxMIyMjCiNTSVRFIyNQVVJSI01EUwojIyMjV0FERUQjT1BFUkEKRVZFUiNCQVIjTk9SVE9OClNBTUVPTEQjU0FNRU9MRApTTElQQlkjR0VUI1BPTFMKQVVUT1MjRkxBU0sjIyMjCllFUyNPS1JBIyNFTElTIwojIyNQTEFJTlZBTklMTEEKQklMTEVUI0NPTE9OSUFMCkFWSUFURSNFTEwjR0FURQpNWUVZRSMjU1RZI09ERVM="},{"title":"02/09/17 WARNINGS","author":"Greg Johnson","date":"2017-02-09","grid":"TUVMRCMjREFEQSNKUEVHCkFMSUFTI0lST04jQUxBSQpUQUxLVE9TVFJBTkdFUlMKRU5UQUlMI1NJTE8jQVBUCiMjI1JFRFMjU09OR1MjIwpTQUwjU0hJTSNHRU5FVkEKVVpJUyNBR1VBI1dBR0VTClJVTldJVEhTQ0lTU09SUwpGUkVPTiNURVJNI0hPU0UKU0VVUkFUI1NJUFMjTkVUCiMjUEVSSUwjREFOTCMjIwpVU0MjT01JVCNMSU9UVEEKUExBWVdJVEhNQVRDSEVTCkRJUkUjTkVSTyNTVU9NSQpPRERTI0dSVUIjI1NVUFM="},{"title":"02/10/17 THE HOLE THING","author":"S.N.","date":"2017-02-10","grid":"TUVNUEhJUyNKQUxJU0NPCkFNRVJJQ0EjQUxJU1RFUgpUSU5ZVElNI0JJR1NBTEUKSFJTIyNDQlMjI0hVUkxTCiMjU1RBTEFDVElURVMjIwpOT1RJQ0UjT0FLUyMjIyMKRU1PVEUjTUxMRSNTVEVQCkNBUkxTQkFEQ0FWRVJOUwpLTkVFI0lSSVMjT1JFT1MKIyMjI1ZFSU4jRElWRVNUCiMjU1RBTEFHTUlURVMjIwpKQVBBTiMjU09WIyNUVUIKQVJBQklBTiNESVNQVVRFClJJU09UVE8jRU5JR01BUwpTQU1PWUVEI1NFUkFQSFM="},{"title":"02/11/17 SATURDAY STUMPER","author":"Frank Longo","date":"2017-02-11","grid":"SE9XTCNTSUVSUkFDTFVCCkFSRUEjQUNUSU9OTElORQpTRUFTI0hFQURTVEFSVFMKUE9SVENJVElFUyNXQUlUCiMjI0xBQkVMUyNBU1NFUwpMQU1BUiNBRU9OUyMjIyMKT0RPVUxTI0RVQ0tGQUNFCkJFRUdFRVMjVE9GVURPRwpFTlRIQUxQWSNTT01BVEEKIyMjI1NMVUVEI1JBTUVOClRFUlNFI01BSUxJTiMjIwpBTE9FI0NBUlJPVENBS0UKQkxVRUJPTk5FVCNIVUVZCkxJVE1VU1RFU1QjVVJHRQpBU1NFTlRFRFRPI1NBU1M="},{"title":"02/12/17 COIN COLLECTION: Who originated certain words","author":"Fred Piscop","date":"2017-02-12","grid":"TU9QRSNXSVBFRCNTQUtTI1VSQUxTCkFLSU4jQU5JU0UjVFVOQSNQQVRJTwpUUlVUSElORVNTI0FUT01JQ0JPTUIKSEFTSE9WRVIjI1BST1RFTSNJUE9TCiMjI1VTRVIjQ09PS1MjI0xURCMjIwpBQkFTRUQjQ1VSU0UjTEFJUiNEUlMKQk9SRUQjSkFCQkVSV09DS1kjT0FUCkJJQ1MjQ09ERSMjI0lTRUUjVFVUVQpBU0gjI0hBUkRCT0lMRUQjUk9CSU4KI0VWSUxPTkUjTE9ORVIjQ0FSTE9TCiMjSUNFSU4jTUFaRVMjUk9VU0UjIwpFQ0xBSVIjV0lSRVIjTUVSTE9UUyMKQkVMTFMjUEVERVNUUklBTiMjSEVTClNFQUwjS0lORyMjI09OTFkjTElOSwpFTEkjUEFOREVNT05JVU0jUklOU0UKTk9OI1BSRVkjSURPTFMjVEFOS0VECiMjI0FEQSMjUkFJRFMjQk9aTyMjIwpBTEFTI1RBTEVTRSMjU0FMRVRBR1MKTkFSQ0lTU0lTTSNTQ0FSRURZQ0FUClRXRUFLI0FWSUEjT0FSRUQjUElUQQpTTkFQRSNQRU5TI1BSQURPI0VERU4="},{"title":"02/13/17 TOOL BOX","author":"Gail Grabowski","date":"2017-02-13","grid":"Q0FTRSNDRUFTRSNDSE9QCkFQRVgjQVNIRU4jSEFIQQpSQU1QI1NURUVEI0FNSUQKRFJJTExURUFNI0xJTU9TCiMjI09JTEVEI0xPU0UjIwpBREZSRUUjI1NVUEVSQiMKQ1JJRUQjU1RBUlMjSEVNCkhPTEQjRkxBTUUjQk9SRQpFVkUjR1VJREUjTkFNRVMKI0VGRk9SVCMjQ0FERVRTCiMjT1JFUyNTQVlUTyMjIwpQT0xPUyNTQVdDT01JTkcKT0REUyNUT1RBTCNFVEFMClBPRVQjQUxJS0UjTkFQQQpFUlJTI0JPTkVTI1NMRUQ="},{"title":"02/14/17 YOU FIRST","author":"Billie Truitt","date":"2017-02-14","grid":"QVRMQVMjU1BBUyNQVVJSCkJVSUxUI0xVU0gjQVNJQQpTTkVFUiNBTFNPI1NFQ1QKI0VVQ0FMWVBUVVNUUkVFCiMjIyNHQVMjI0xJRSMjIwpTVElOR1MjQklEUyNCVVQKTE9DQUwjUE9MRSNBT05FClVOSVZFUlNBTFJFTU9URQpSRUxZI0lTVFMjTEVUSU4KUFJZI1NHVFMjU0VOU0VTCiMjI0hVSCMjQUtDIyMjIwpZVUtPTlRFUlJJVE9SWSMKT1BFUiNPVkVSI0lESU9NCkdPRVMjRklETyNOT1RSRQpBTk5FI0ZMT1cjR1JFRU4="},{"title":"02/15/17 WE'RE STUFFED","author":"Carolyn Stewart","date":"2017-02-15","grid":"UEFTVEEjVEFNUEEjQVRNCkVRVUFMI0FDT1JOI0lSQQpUVVJLRVlTSE9PVCNNQU4KU0FGRSNVS0UjU0xFRVBZCiMjI0FSTVMjU1BFRURTIwpNQVJDTyMjU1RFUk4jIyMKQUxJQVMjTkFSQyMjVEhFCkNBQkJBR0VQQVRDSEtJRApFU1MjI0VTUFkjTUFPUkkKIyMjUFVUVFkjI09OU0VUCiNTTEFOVFMjU0VORCMjIwpTSElMT0gjQUhBI01BTUEKSElUI1BFUFBFUkdBTUVTCk9ORSNFUkFTRSNFRElUSApQRVIjTkVXRVIjTUVTU1k="},{"title":"02/16/17 KNOBBY","author":"Fred Piscop","date":"2017-02-16","grid":"QlRPQiNDQVJPQiNKUEVHCkxBTkUjQVJPU0UjT0lMWQpBVFROI1BST0xFI0NMQU0KSEFWRUFMT1RPRlBVTEwjCiMjIyNMRVcjI1NJTiMjIwpISU5UQVQjQ1NUVURFTlQKSURJT00jREFWRSMjTE9PClRBS0VPTkFORVdUV0lTVApDSEUjI09NQU4jSU5ESUUKSE9TUElUQUwjU0VXRVJTCiMjI0VSQSMjU1RVIyMjIwojTEVBS1RPVEhFUFJFU1MKTUFSQyNBRE9SRSNBTE9UClBJVEgjTElORVIjQ0FSWQpHUkVZI0xFRURTI0tORVg="},{"title":"02/17/17 FISH-FINDER","author":"Clive Probert","date":"2017-02-17","grid":"R0FTUCNDSElQI0VESUNUCkVETkEjUklERSNNRU5TQQpORUFQI0FHRVIjQkFTSU4KVVBQRVJDSEFNQkVSIyMjClNURVJFT1MjRUFSTUFSSwojIyNDQVcjVEFHI0VMQU4KQU5HVVMjTU9USUYjSUNFCkNPUlBPUkFURVRSQVZFTApJVEUjTkFLRUQjQUxFUlQKRElFVCNORUQjQUNUIyMjClNUUkFORFMjUFJBSVNFUwojIyNMQUJBU1NJU1RBTlQKQkFOQ08jQk9BUyNVTlRPCkFMQlVNI0VMTEUjREVFUApNSUFNSSNUT01TI0VSUlM="},{"title":"02/18/17 SATURDAY STUMPER","author":"Lester Ruff","date":"2017-02-18","grid":"SVRTQUJMQVNUI1NMQVNICk5FQVJFQVJUSCNUT05UTwpNWE1JU1NJTEUjSU5UT1cKQVRCRVNUIyNNQVJHSU5TClRFQVMjI0JMT0JTI0dFVApFRFMjRkxVSURTI1lFQUgKIyMjQUxFUlRTI0pFTkdBCk1BQ0JPT0sjUVVPTlNFVApBRE9CRSNJVFVORVMjIyMKTE9ERSNVTkVBU1kjQ1BBCklSRSNCUkFORCMjUEFMUwpHQU5EQUxGIyNBQ0VTSVQKTkJBRVIjQUxBQkFTVEVSCkVMTUVSI1NJTEVOVEVSQQpERUVSRSNPVVRET09SU1k="},{"title":"02/19/17 FIRST AND LAST: Presidentially speaking","author":"Mark McClain","date":"2017-02-19","grid":"Uk9UQyNPUkJTI0lNQUMjU01FTExTCk9NT08jV0lSWSNTT1RPI1RPUkVBVApNQVJUSU5WQU5CVVJFTiNTVFJBVEEKQU5USUMjRVZFUiNPQUZTI0hBRElUCiMjI0xFRFRPI1lFU01BQU0jVE9ORQpSRVBMSUVTI0pBTUVTQlVDSEFOQU4KSU5VSVRTI01FTlUjIyNUQVUjIyMjCk9SU08jI1BVVFQjS0FMRSNNQVVMUwpKT0hOQURBTVMjSkFNRVNNT05ST0UKQU5ZI1BPTFMjRE9aRU4jT1JBTkdFCiMjIyNQUkUjTklLT04jQVJJIyMjIwpERU5BTEkjQ0FNRU8jUFNBUyNDU0EKSklNTVlDQVJURVIjSk9ITlRZTEVSClNOSUZGI1ZJRVMjU09OWSMjRUFSTAojIyMjT0RPIyMjQUNJRCNQT0xJVEUKV09PRFJPV1dJTFNPTiNQRVJMTUFOCkFDTUUjTUVBTkVTVCNUQU5HTyMjIwpMRUVSUyNEUkFHI0NIRVIjQVdHRUUKS0FSQVRFI0FCUkFIQU1MSU5DT0xOClVOVElFUyNDT0VOI1VQT04jQVJJRApQU0FMTVMjRVhFRCNMT1JEI0JFU1M="},{"title":"02/20/17 WEATHER REPORT","author":"Sally R. Stein","date":"2017-02-20","grid":"TU9MRFMjTUFNQSNKQVpaCk9QRVJBI0lET0wjRVJJRQpCRUdBTiNOT1ZBI0xFR1MKU05PV0dMT0JFUyNMQVNUCiMjIyNUT1JFI0tFWSMjIwojQ0FQT1RFI1NBUCNDUEEKRUxTRSNUUkFQI0lTTEVTClRBS0VTQVJBSU5DSEVDSwpBUkVOQSNPSE5PI09BS1MKTEFXI0dSUiNBVEhFTlMjCiMjI0VBVSNBUklBIyMjIwpTVEFHI1NFQ09ORFdJTkQKQVJNWSNUVVRVI0FSRE9SCkxJTVAjSVJPTiNHRUVOQQpUT09UI0NPUkQjT05TRVQ="},{"title":"02/21/17 FIX IT","author":"Sandy Fein","date":"2017-02-21","grid":"I1NMVVIjR0hXQiNPU0xPClNFRVRPI0VBUkwjVVBPTgpNSURBUyNBUklBI1RVTkUKT05USEVGUklUWiNPREVTCkdFTyNUQUIjU0VMRiMjIwojIyNCT1pPIyNTT09ORVIKU09BUiNFWEFNI0JSQVZPCkFMTE9UI0VXRSNFRFNFTApHRUNLTyNTRUFSI0VBU0UKQVNTRVRTIyNORUVSIyMjCiMjI05PRVMjU1BBI0RPTwpTSEFEI05PVFdPUktJTkcKVE9STyNTTE9FI05BVkVMCkFORVcjRVZJTCNJTkFORQpCRUFOI0RFTEwjVEVORCM="},{"title":"02/22/17 JOHN'S FAMILY","author":"Fred Piscop","date":"2017-02-22","grid":"R1JBVEUjUkVFRCMjSEVZClJPTEVYI0FMVE8jSkFORQpJVkFOUEFWTE9WI1VTVEEKUEVOU0lWRSNORUdBVEVTCiMjIyNST1NTIyNJTkVSVApMRVNTRU4jQ1JJU1AjIyMKQVJJRVMjUEFJTiNFTkRTCk1JUkEjU0VMTFMjUk9PSwpCRUVOI0hPUEUjTE9VU0UKIyMjQUxPTkUjUEFOTkVECk1BU1NFIyNMSUFSIyMjIwpFTElUSVNUI05JR0VSSUEKTUFMSSNJQU5GTEVNSU5HCk9NQU4jUFVSRSNTTU9SRQpTT1MjI1NUQVIjVEFURVI="},{"title":"02/23/17 REFUSALS","author":"Billie Truitt","date":"2017-02-23","grid":"QVVSQVMjQU1PSyNXQVZFCkNISUxJI0RBTEkjRVhBTQpDVVRJRSNEUkFNI0JMVFMKVEhBVFNOT1RGT1JNRSMjCiMjIyNURU4jI05PRCMjIwpHVUZGQVcjRUdPUyNKTE8KQVJJQSNET0RPI0lCRUFNCkZJTkRTT01FT05FRUxTRQpGRUFTVCNJTkZPI0dMRU4KRUxMI0FDVFMjVklTT1JTCiMjI0FTSCMjTUVOIyMjIwojI0lUSElOS0lMTFBBU1MKTUFMTCNOQUlMI0FPUlRBClVDTEEjT1BFTiNXUkVBSwpNRVNTI1NBVkUjU0tBVEU="},{"title":"02/24/17 DOUBLE-ENDERS","author":"S.N.","date":"2017-02-24","grid":"QUxQRVJUI0ZSRUVNQU4jCk5BSUxFRCNSRUFMQUxFIwpUVUxJUFMjQUJSSURHRVMKSUdMT08jS05PVCMjRURVClRIQVQjQlVaWkFMRFJJTgpIQVIjUE9SI09CT0UjIyMKRUJCI1JTVFUjI0RBQ0NBCkZMT1JFTlpaSUVHRkVMRApURVhBTiMjSVNMRSNOT1YKIyMjQ1VSTCNVU1MjVFNFCk1JS0VQSUFaWkEjUEVFUgpJTk4jI0xVQVUjQkFSS1MKQUJBU0hJTkcjUEFOSU5JCiNBVklBTkNBI0VMSUNJVAojREVMSUdIVCNOSUNFVFk="},{"title":"02/25/17 SATURDAY STUMPER","author":"Brad Wilber","date":"2017-02-25","grid":"QVBQTEUjI1BBU1RVUkVECkNBUk9MUyNFTVBBTkFEQQpUUk9JS0EjUk9BRFNJR04KQVNTTiNGQUlSUyNFVEFTCkxJQyNKRU5HQSNTVEFSSwpPTUVHQSNHRUxFRSMjIyMKTk9OSVNTVUUjVkVHQVMjCkVOSUdNQVMjUElSQU5IQQojWUFTSVIjQ0VMRVNUQVMKIyMjI05JVkVOI1NIRU1QCkJTSURFI0lOQ0FTI1JCSQpBSE1FI0hPU0VTI1BPT1IKU0FPUEFVTE8jQ1JFT0xFCklORk9STUVSI0hFUk1JVApMRUZUSVNUUyMjRElTQ08="},{"title":"02/26/17 ZOO STORIES: And people involved with them","author":"S.N.","date":"2017-02-26","grid":"RkxBUFMjUEFSUiNDUkVFUCNJQ0VTCklPTklBI0VTVE8jVUhVUkEjTUFZTwpESUFORk9TU0VZI1RFUlJZSk9ORVMKT05USEVET1QjQUxJVE8jV09OVERPCiMjI09CSVMjQ0xJTlQjTUFMSSMjIwpBTkdMRUUjUEFXQVQjQkVMSVRUTEUKQ0FSRVQjUEVURVJPVE9PTEUjQ0FNCk1PT1MjRkFDVCMjI1JPV1MjQ0hJQwpFTVUjQVJSQVlTI0hBVFMjQ0xBUkUKU0lDSUxJQU4jUEVBQ0gjQ1JVSVNFCiMjSE9MRFMjU09SUlkjR1JFRUsjIwpTQ09USUEjSUxJQUQjQkxPU1NPTVMKSFVNQU4jT1JBTCNDQVJFU1MjVkFUCkFMQVMjR09PTiMjI0JJQVMjSVNMRQpOUFIjSk9ITkdSSVNIQU0jQU5LTEUKVEFYUkFURVMjT05JT04jU1RBWUVECiMjI0FXRUQjUE9TRVIjU1dBUCMjIwpHUkFERUEjR0lTVFMjU0FJTElOR1MKREFWSURNQU1FVCNUQVRVTU9ORUFMCkFWSVMjR1JBQ0UjQUtJTiNTQ0FMRQpZRUFII09UVEVSI1NBUkEjU0hSRUQ="},{"title":"02/27/17 FELLOWS AT FIRST","author":"Sandy Fein","date":"2017-02-27","grid":"QUxFUyNQQUNUUyNJTVBTClRJREUjQUNIT08jTkFJTApPTUVOI1NUT05ZI09OVE8KTUFOREFUT1JZI0NSVVNUCiMjI1NUQVJFI0pPQlMjIwpMSU1JVFMjI0NVVElDTEUKSVJBTkkjU1BBUyNUUklNCkZBTiNDQVRFUlRPI0lWRQpFVEFTI0xBTkQjUElQRVIKUkVHVUxBUiMjU0VOVFJZCiMjRVJBUyNQRUFSUyMjIwpDQU1QUyNNQU5IQVRUQU4KQVJFQSNQSU5UQSNPQUhVCkZJTlMjVU5ERVIjQ01PTgpFQVRTI1RJQVJBI0tFWVM="},{"title":"02/28/17 FOUR-STAR QUARTET","author":"Billie Truitt","date":"2017-02-28","grid":"TU9ERU0jUExPVCNTSEFXCkFXQVJFI1JBU0gjRUFTRQpSRU1BUktBQkxFI05JQ0UKIyMjI01JRCNPTkVTVE9QCkVHR1NBTEFEIyNXQUlUUwpEUk9QSVQjQVNTRVQjIyMKR0FURUQjV1JBUCNJVEJFCkVQSUMjU0lMTFkjT1JBTApERU5UI0tOSVQjQU5JU0UKIyMjQUxJRU4jQVJBQklDCkJSQUNFIyNHRU5UTEVTVApSRUZVRUxTI1VOSSMjIyMKRVZJTCNJTVBSRVNTSVZFCkFVUkEjVE9STyNBUFJJTApERUVSI0VHT1MjTkFTQUw="},{"title":"03/01/17 CARVING BOARD","author":"Carolyn Stewart","date":"2017-03-01","grid":"RE9TRSNNQU5FI0FDQ1JBClJVTEUjT0RPUiNEQU1VUApJQ0VMQU5ERVIjQVRPTkUKUEhEI1dFTExTI0dFTlRTCiMjI1BBVEUjI1NJUiMjIwpDQVBSSSNTT0FQT1BFUkEKQUxMT1RTI01CQSNJTUFNCktJQVMjSURFQVMjTEFORQpFU1RBI05BRyNNQUxJR04KU1RPTkVDUkFCI0JBTEVECiMjI0RZRSMjQUNFUiMjIwpTUEFDRSNTUFJBVCNHQVMKQ0FST0wjV09PRFNUT0NLCkFMSU5FI0FOTkUjU0FSSQpCRUFTVCNURVNUI1BMRUQ="},{"title":"03/02/17 ON THE JOB","author":"Fred Piscop","date":"2017-03-02","grid":"QVNPRiNWSUNJI1NDUkFNCk5PUkkjT05VUyNBTEFNTwpOT0VMI1lBUk4jUkFNUFMKI1RPSUxBTkRUUk9VQkxFCiMjI1BBR0UjI1VORE9FUwpDRVJJU0UjUklER0UjIyMKQVRPTkUjV09SRSMjRE9TCkxBQk9SREVQQVJUTUVOVApGTE8jI1lWRVMjUklDQ0kKIyMjSVNMRVMjUFVDS0VSClNQQVJUQSMjUEVFSyMjIwpXT1JLSU5QUk9HUkVTUyMKRUxHSU4jSE9ORyNZT0tPCkFMT05HI0RPWkUjRFJFVwpUT05HUyNTS0lEI1NFV04="},{"title":"03/03/17 MONKEY IN THE MIDDLE","author":"S.N.","date":"2017-03-03","grid":"I01QQUEjQVNDT1QjQlJSClNBTEVTI0JMVU1FI0lPVQpUSEVSQVBFVVRJQyNMQUQKREFEI1BFVFNJVCNUT0RECkVSR1MjQVNIRSNST1hJRQpOQUlMUyMjI1BSRU1JRVIKSU5OQVRFI1ZJT0xBIyMjClNJR05FREFQRVRJVElPTgojIyNURUVNUyNTQ09OQ0UKRUNISUROQSMjI1NFUlRBCk1PQU5TI1pFQUwjU0VBVApCT1JHI0xFTU1PTiNBR0UKRUxMI01FRElBUEVSU09OCkRJRSNQSUxMUyNNT09OUwpTVFkjSEFZRVMjT1dOUyM="},{"title":"03/04/17 SATURDAY STUMPER","author":"Matthew Sewell","date":"2017-03-04","grid":"SU5USEVXRUVEUyNXSFlTClBBUkFQSFJBU0UjSE9FUwpPUEVOU09VUkNFI0FMQU4KREFTI1RPUFMjU0FUWVJTCiMjI1dFUFQjR1NVSVRTIwpTVVNISSMjR0FURUZPTEQKSU5URU5USU9OQUwjTEFBCkdEQVkjQURERVIjWUVUSQpNRVIjQUNFT0ZTUEFERVMKQVJDSFBPRVQjI0VNT1JZCiNDSEVTVFMjU0hFUyMjIwpDT0lORVIjU0NPVyNBV0UKT1ZFTiNVTlRBTEVOVEVECk1FU0EjQ1JBRExFU09ORwpBUlRTI0tBTlNBU0NJVFk="},{"title":"03/05/17 THINK TUBULAR: Or cylindrical, if you prefer","author":"Gail Grabowski","date":"2017-03-05","grid":"SEFMVFMjTEFNUCNCQVNFUyNFTFNFCkFMQ09BI09NT08jVU5DTEUjVklMQQpST0RTVEVXQVJUI1NOQUtFUklWRVIKREVTQ0VORCNTQUNIRVQjU0FURUVOCiMjI0FTVE8jRVNTRVgjREFNQVNLUwpBTVMjI0VTVCNIQUwjV0lMRSMjIyMKUElQRURSRUFNIyMjQ0hBTEtVUFRPClBMVVNFUyNDT0cjTUFJTCNJU0xBTQpTRU5TRSMjSEFSVkVTVCNVTkVBU0UKIyMjQVJBQiNORU9OI0VSUiMjWkVOClBPU1kjTE9PU0VDQU5OT04jQkFSUwpFUEEjI0VBUiNUQUNPI09TTE8jIyMKVEVOTklTI0VZRUxFVFMjI0VYVFJBCkFSREVOI0NDRUQjRElQI1NBVVJPTgpMQVNUU1RSQVcjIyNOT1JUSFBPTEUKIyMjI1RJRVIjSEVNI1RBUiMjREVXClBFUEJBTkQjUE9UT0sjVEFQQSMjIwpBTk9JTlQjTFVOQUNZI0VUQUdFUkUKQ09VTlRZQ09SSyNIT0xESU5HUEVOCkVUVEUjUEFVU0UjQVRPUCNFSUVJTwpSRVNUI0VOREVEI1NPTkcjU0VFRFM="},{"title":"03/06/17 BEGINNING OF MARCH","author":"Sandy Fein","date":"2017-03-06","grid":"QUxFUyNCT1NDUyNBTVBTCkhBVkUjVUhBVUwjUkFSRQpFVkVOI05BVFRZI0VSSUMKTUFSRElHUkFTI0hBU05UCiMjI09DRUFOI1NUUlVUUwpBVE1GRUUjI0dBU1VQIyMKTE9BRlMjRk9FUyNHSVJMCkVSUiMjUE9MTFMjI0FBQQpDTkJDI0FHRVMjSFVMS1MKIyNMQVNUUyMjRlVTU0VTClNQRUNLUyNTQ0FMRSMjIwpXQUNLWSNNQVJNQUxBREUKSVRBTCNIQU5PSSNFQkFZCk5JS0UjSURFQUwjU0lERQpHT0VTI1BFUktZI1NUQVI="},{"title":"03/07/17 CRUISING","author":"Billie Truitt","date":"2017-03-07","grid":"I0VNVFMjQUNUUyNMT05HClNURUFMI0NIQUkjVUJFUgpTVU5CQVRISU5HI05PV0kKVERTI1BFRVAjTklDRVNUClNFQVNPTlMjI0FTSCMjIwojIyNJTk4jQ0VMSUJBVEUKUkFORyNJS0VBI1RVQkVTCk9VQ0gjU05BUkwjRkxBUApUUk9UUyNJU0xFI0ZFUk4KQ0FTU0VUVEUjQUdFIyMjCiMjI0VBUiMjT05FVEVSTQpMT1NFVE8jUFVUVCNYSUkKQVNUSSNQT1JUT0ZDQUxMClNIVU4jSE9FRCNBSUxFRApIQU5HI1lPWU8jUkFUUyM="},{"title":"03/08/17 YOU CAN DO IT","author":"Charles Slack","date":"2017-03-08","grid":"SVJTI1BFUlBTI1NIT0VTClNFQSNTVEFSVCNWRVJTRQpPV0wjQUNUT1IjRVJBU0UKQklURVRIRUJVTExFVCMjCkFSRUEjIyNFTUlUI09ERApSRURUQVBFIyNERUFSRVIKIyMjI1NJUkVTIyNMSUVVCldFQVRIRVJUSEVTVE9STQpJU0xFIyNTQ0FSUyMjIyMKU1BMRUVOIyNNQU5BR0VECkVZRSNET1RTIyMjTUFERQojI0dSSU5BTkRCRUFSSVQKQUJPVVQjQ0FST0wjTkJBCk5PUlNFI0lST05TI0VMSQpUT1lFRCNURVBFRSNURU4="},{"title":"03/09/17 SPRING FORWARD","author":"Carolyn Stewart","date":"2017-03-09","grid":"Qk9BVCNUQU1QI1VTQUdFClVORE8jQVZFUiNORVBBTApSSURFI0NJQU8jV0VFUFMKR09MRFNUQU5EQVJEIyMjClNORUFLSU4jI1NBU1NFUwojIyNOWUMjRFJJUCNURUwKQk9DQ0UjTEVBRFNUT1JZCkFDUkUjU0VJTkUjQU1JRQpORUVEU1RFU1QjVklQRVIKSkFXI1BFUlQjVElMIyMjCk9OU0FMRSMjU0FCQkFUSAojIyNGT1JEU1RIRUFUUkUKQVBBUlQjQUNBSSNDUlVECkhBVk9DI1RBUlQjS0lORwpTVEFTSCNBTlRJI1NBS0U="},{"title":"03/10/17 THE SONG IS YOU","author":"S.N.","date":"2017-03-10","grid":"U1RSQU5EI0dXQiNNT1dOCk5BU1NBVSNFRUUjQVNBWQpJUlZJTkdCRVJMSU5IQVMKUE9QRk9VTCNOT1BMQUNFCiMjIyMjUEFUSFdBWSMjIwpGTEFNRSNDSEUjIyNDQVcKSkVST01FS0VSTiNQSVRBCk9ORUNVUCMjI1lFQVJMWQpSSU5LI0lOQU1FUklDQU4KRE5BIyMjSURBI0VSQVNFCiMjI0xBU0NBTEEjIyMjIwpNVVNJQ0hFI1RBWEJBU0UKSVNBTUVSSUNBTk1VU0lDClNFUkIjVVNTI0RFTklSTwpUUklPI0dISSNFTlRBSUw="},{"title":"03/11/17 SATURDAY STUMPER","author":"Frank Longo","date":"2017-03-11","grid":"TUVTT04jVElMVCNTQUdBCkFSRU5BI0FLSU4jQUxFUwpEQVRFUyNMRUZUQkxBTksKQVRUQUNLQ0FUI1JFU1RTCk1PT0xBSCMjI0RBUyMjIwojIyMjUkFNQkxJTlJPU0UKWU9VUiNNSUxFU0RBVklTCkFDVElWRUNPTVBPTkVOVApXSEVOSU5ST01FI0tORUUKTE9TU0xFQURFUlMjIyMjCiMjI0VMSSMjI1NIT1VUUwpMSEFTQSNNQUtFVVBLSVQKUEVDT1NCSUxMI0NSQVRFCkdSQUYjRkxPRSNLQVNISQpBU0lGI0ZMRUUjU0hFRU4="},{"title":"03/12/17 PALO ALTO PAIR: Bill and Dave, who made it big","author":"Mark McClain","date":"2017-03-12","grid":"I1BGQyNET0dHI1JFRkkjREFOQ0VSClNMT0UjVVJEVSNFVkFOI0VTVEFURQpIT0xESU5HUEFUVEVSTiNDU0hBUlAKQURERU5EQSNDUkFORSNTUkkjTkVPCk1TUyNGRU5TI1VSTCNESUVHTyMjIwojIyNSVUUjSEFSRFlQRVJFTk5JQUwKQUlEQU4jVEFDT1MjQUxFI1NFUkdFClNUQUIjUFVQVSMjU0NBTlQjQ09STgpIQU1CVVJHRVJQQVRUWSNVUkFOSUEKRUxOSU5PUyNBUklBI0VSUk9SIyMjCk5PUyNGUkFVI1lEUyNESU5HI1NHVAojIyNGSUFUUyNORUlOI1BJRUhPTEUKTE9WRVRUI0hBTkRTT01FUFJPRklUCkFQT0QjQURFTEUjI1RFTlMjTUlORQpUUklPUyNBUkUjQ0FSVFMjS0VBVFMKSFlEUkFVTElDUE9XRVIjQU5ZIyMjCiMjI0FTUEVOI0FIQSNPUlNPI1NQQQpBV0wjSFJTI0ZSRVJFI0FJUkFDRVMKTUFJVEFJI0hPTElEQVlQQVJUSUVTCkFSUkFZUyNTVEFSI1ZFSU4jTU9STgpTUEFSU0UjVE9ZUyNFTkRTI09OUyM="},{"title":"03/13/17 BE FIRST","author":"Gail Grabowski","date":"2017-03-13","grid":"Q09JRlMjQklURSNJQkVUCkFET1JFI0FSRUEjUkVOTwpCRVdJVENISU5HI1NXQVQKI1NBTlRBI1NPTEUjSUNFCiMjI0dFTFMjUkVWT0xUUwpTSUJFUklBIyNTRU5EIyMKQVBFIyNDTEFQI05JRUNFCkdBTEEjT1RIRVIjVFJBTQpFRElDVCNTQVNFIyNFTE0KIyNFTUlUIyNURVBJRExZCkxJVkVOVVAjU0xBTSMjIwpFVkUjVFJFRSNJTkFQVCMKR09EUyNCRUdJTkFHQUlOCkFSSUEjQVZPTiNNRVRSTwpMWU5YI05FU1QjQVNTRVQ="},{"title":"03/14/17 HAM AND EGGS","author":"Sally R. Stein","date":"2017-03-14","grid":"TUFDRSNHQVBTI0dBVE9SCkVXQU4jQVZPVyNPQkFNQQpNQVJDI0xJU0EjVEVYQU4KT1JFTyNPVkVSQUNUSU5HClNFVFVQUyMjTVBIIyMjIwojIyNSRUhBQiNQQVVTRUQKUkVSQU4jUkFUUyNOT1BFCkJMT0dTI0VSUiNBR1JFRQpJU0xFI0NBR0UjQ1JFRVAKU0VFU1RPI0VYVFJBIyMjCiMjIyNBTVAjI1JFQ0VTUwpTSUxMWVBVVFRZI0VSSUUKSURFQUwjVE9STyNGQVJFClRPTlRPI0lOT04jVVNFRApFTERFUiNOSVRFI0xFTlM="},{"title":"03/15/17 DOUBLE ECHOES","author":"Billie Truitt","date":"2017-03-15","grid":"U09DSyNNQUdTI0tBUlRTClRIQU4jQVJJQSNJREFITwpBTU1PI0tBUkwjQ0FOQUwKQllFQllFQkxBQ0tCSVJECiMjI1NBRCMjREFNIyMjIwpNTUUjSE9TVCNURUFTRVIKUkFUSU8jVEVYVCNHSUxBCkJZSE9PS09SQllDUk9PSwpJQkVUI0lQU08jTE9VUEUKR0VSQUxEI0VYUE8jWEVTCiMjIyNBREQjI09VVCMjIwpUT0JVWU9STk9UVE9CVVkKQVJPU0UjTU9TVCNUQU1FClJBUkVSI09HTEUjRVNQTgpTTEVEUyNNT09SI01FU1M="},{"title":"03/16/17 BREADLESS SPREADS","author":"Greg Johnson","date":"2017-03-16","grid":"V0hPTSNUT0FTVCNMT0xMCkVBVkUjUkFOQ0gjT0hJTwpTSEVBQlVUVEVSI09ORVMKVEFSVEFOI1NORUFLT1VUCiMjU1lOQ1MjVEFHUyMjIwpEU1QjR0FMUyNEQUhMSUEKRVRBVCNURUFTI1BBSU5UCk5BVFVSRVBSRVNFUlZFUwpJUkVORSNUSU5BI1BFUkUKTUVEQUxTI1NPTE8jSVRBCiMjI1NJTlMjUkVJR04jIwpDT0NBQ09MQSNTTFVNUFMKQUJFTCNDT1VOVFlNQVlPClNPREEjQVRSSUEjQklSRApIRUVEI1RIQU5YI09ERVM="},{"title":"03/17/17 DOUBLE-SWITCH","author":"S.N.","date":"2017-03-17","grid":"QlVERFkjQUJDUyNPSE5PCk9TQUtBI0RVTFkjTEVBTgpQRU5OWSNEUk9aI0RBTUEKRUREWSNCVUdHWVJJREVTCkVURSNDQVAjI0dVRVNUUwpQT1JPVVMjR0FZRSNIQUkKIyMjUFJJTUFMIyNCT0dTCiMjQlVMTFlQVUxQSVQjIwpXQVJTIyNNRU1PSVIjIyMKRUNPI1BBWVMjUkVEU0VBCkJPV0VSUyMjU0VUI0hSUwpCVU5OWVNVSVRTI0dJU0gKSVBBRCNBTk5BI1JVUkFMCkVMTEUjSURPTCNJUkFURQpSRUVEI0xPTkUjQlVaWlk="},{"title":"03/18/17 SATURDAY STUMPER","author":"Dan Addams IV","date":"2017-03-18","grid":"TEFTVExFRyNUSEVUQUxLCkVMQ0hBUE8jQUVST1NPTApJTUhZUEVEI0tBUkFDSEkKU0FNI1NFRURFRCNTSUFNCiNSQUQjU0VVU1MjVElOVApBVExBUyNQQVRUSSMjIyMKQ0lUUlVTI0xFQU5NRUFUCkVOWllNRVMjQU5OQVNVSQpTT1lMQVRURSNERU5PVEUKIyMjI0NIQU5UI1JPVE9SClNBU0gjUllERVIjUkVQIwpPQk9FI09IU05BUCNSSVAKRk9MSUFHRSNUTU9CSUxFCkFWRU5HRVIjSEVMSUNPTgpSRURaT05FI1NOT0NBVFM="},{"title":"03/19/17 PLAY TIME: Members of the Toy Hall of Fame","author":"Fred Piscop","date":"2017-03-19","grid":"TEFTU08jTEFGRiNDSE9QI01JVEVTCklTVE9PI09SRU8jT0FSUyNJTkFMTApWSUVXTUFTVEVSI1JVQklLU0NVQkUKRUFUI1BFVCNMRUFSTlMjRUxBVEVECiMjIyNBUkkjI1NQQVQjQ1lBTiMjIwpHQUwjSE9UV0hFRUxTI05VQiNFQkIKQUxJIyMjI0hFRURTI1JPUEUjVEVMClpJTiNTVEVFUiMjI0pFVCNMWUNSQQpFVEMjRUFTWUJBS0VPVkVOI0FIRU0KUk9PVFJPVCMjQk9YRVMjT1JOQVRFCiMjTElWSUQjTU9SRUwjR0xFTlMjIwpDQU5ORVMjU09SRVIjI01PTklLRVIKT0dMRSNNUlBPVEFUT0hFQUQjRVJFCkNST1NTI09BVCMjI0hBTkRTI1RBTQpLRUcjSVBPUyNOQU9NSSMjIyNDU0kKWUVTI0RJUyNDQU5EWUxBTkQjSEVYCiMjI0NFTlQjSU5EWSMjUEFSIyMjIwpHT1BBU1QjT0RFU1NBI1BSTyNTT0wKRVJFQ1RPUlNFVCNTSUxMWVBVVFRZCkxBVEhFI01BUlQjRVJJRSNJTkFJUgpTTEVFUCNOWVNFI1lFTlMjTk9SU0U="},{"title":"03/20/17 IN PROPER PLACE","author":"Sandy Fein","date":"2017-03-20","grid":"TUFOUyNHTkFTSCNBUkFCCkFMT1QjTE9UVE8jR0lMQQpESU5PI0lHTE9PI0VHT1MKQUJPVkVCT0FSRCNTSEVTCk1JU0VSIyNTS0lIQVQjIwojIyNTQVlTIyNFQUdMRVQKQUxMI1NFRUtTI1NPQVBZCkxFRSMjU1RFSU4jI05JUApVTkZJVCNTWVJVUCNFQ08KTU9UVE9TIyNTTklUIyMjCiMjRlNUT1BTIyNFUkFTRQpGT0lMI0JFTE9XREVDS1MKSUtFQSNFTkVNWSNBVElUClNBTFQjSU5ESUUjVElSRQpIWURFI1RFU1RTI1NJVEU="},{"title":"03/21/17 START OF SPRING","author":"Billie Truitt","date":"2017-03-21","grid":"Q1VQUyNBQ1RTI1NDQU1QCk9TTE8jVEhBTiNIT05PUgpTRUVOI1RVTkEjQU1UT08KVFJBSU5JTkdHQU1FUyMjCiMjI05JQ0sjI1ZFVCMjIwpTQ0FMUFMjVVNBI1NTTlMKQUxJQVMjSU5OSUUjQ0lBCkZPUldBUkRGQUxMQkFDSwpFVkUjVFVMSVAjTUVMRUUKUkVEUyNNRVQjUklERVJTCiMjI1RBQiMjSEVSUyMjIwojI0JSRUFLVkFDQVRJT04KQ0hBT1MjTk9TRSNFREdFCkNBTkRPI0VUQVMjQUJMRQpTVEVFUCNXRVRTI0RFRUQ="},{"title":"03/22/17 TEN OF A KIND","author":"S.N.","date":"2017-03-22","grid":"QkJRI0NSQVNII0tJTE9TCkVBVSNMRURUTyNFUVVBTApBTEkjQURNQU4jUlVOVE8KU0VUI1dISVRFS05JR0hUClRTRUxJT1QjI05FVCMjIwojI1JVTlQjRkVFTCNTT0IKQVBJTkcjU0lURSNBTFNPCkZPR0cjVE9HQVMjQklMTApBQ0hFI09PSFMjTVlHT0QKUk9UI01BVFQjU0FTSCMjCiMjI09SUyMjRVBJU1RMRQpCUklHSFRMSUdIVCNCQUEKUkVBRFkjQU5HRVIjSURTCkVER0VEI1NUT1JFI1RFRQpET09ORSNUT05FRCNFTkQ="},{"title":"03/23/17 WAY OFF","author":"Fred Piscop","date":"2017-03-23","grid":"UkFQVCNHT0xEIyNGSVNICkVTQVUjRUNPTiNTSVRLQQpESVNUQU5UR0FMQVhJRVMKREFTI1BST1MjT0JFU0UjCklHTyNSRVAjUk9FI05CQQpUT05UTyNJREVTIyNUQU4KIyMjT1BTI0lERUEjU0xZCiNSRU1PVEVDT05UUk9MIwpNQVYjU0lMVCNTQVkjIyMKUEdBIyNDTEFEI1NFRVBTClNUUCNBS0EjQUZUI05BVAojUkVBQ1QjT1NMTyNUV0EKRkFSRlJPTVRIRVBPSU5UCkFET1JFI1VURVMjRlJFRQpYRU5PIyNHT1NII0ZFRUQ="},{"title":"03/24/17 PET SOUNDS","author":"Matthew Sewell","date":"2017-03-24","grid":"VFVCQSNTRU1JUyNLT05BClNIQUQjS0VFTkUjQVdPTApLVUJMQUlLSEFOI1JJT1QKU0hFSUxBIyNMSUNFTlNFCiMjI0JBUkNBTE9VTkdFUgpTQU1TTkVBRCNSQkkjIyMKT1hPIyNBTU9TI0VOQUNUCkRJU1BPU0UjSEFEQUNPVwpBU0hFTiNMSUVVIyNETkEKIyMjUkVBI1JBVFJBQ0VTClBFUlNPTkFMRk9VTCMjIwpBTU9VTlRTIyNNSUxERVcKTk9WQSNISVNQQU5JT0xBCkRKRUQjRURJQ1QjRVRTWQpBSURFI01FTlNBI1NFQVM="},{"title":"03/25/17 SATURDAY STUMPER","author":"Brad Wilber","date":"2017-03-25","grid":"QkFTSUxJQ0FTI0RFQ0NBCk9CQU1BQ0FSRSNSRUhBQgpOQVBBV0lORVMjQVJFTlMKVUNPTk4jTkFUI1dPRVRPClNJUiMjQ09XRVJTI1NPTAojIyNFTUFOQVRFI01FTlUKUFVORElUUlkjVklPTEVUCkFTQUdSQVkjUEVOUk9TRQpHQU1FT04jVklMTEFHRVMKTElFRCNJQ0VUUkFZIyMjCklOUyNGQVVMVFkjI05USApBQkFURSNUT1kjU1RPUkUKQ09LRVMjRVVQSFJBVEVTCkNMRUFUI1NUQVJUVVJOUwpJVFNNRSNURVRFQVRFVEU="},{"title":"03/26/17 PERIODIC TABLE SPELLING: As in \"Cr + Os + Se + S\"","author":"S.N.","date":"2017-03-26","grid":"R09SR0UjQk9BUiNMQVBTRSNDQUxGCkFET1JOI1JVU0UjSU1FQU4jSUxJRQpXSVNFQ1JBQ0tTI05BTk9TRUNPTkQKS05FRUhJR0gjUEVFTlMjSFlBVFRTCiMjI1RBT1MjU0VMTUEjQ1JFRCMjIwpBU0NFTlQjVU5DTEUjUFJPUkFURUQKQ0hBUlQjUFJFVEVOVElPVVMjSFVSCklPVVMjTE9HRSMjI0FQT0QjUlVCWQpEQ0wjU0FVRVJCUkFURU4jR0VOSUUKU0tJUEFOVFMjUk9MRVMjQ1JVREVSCiMjRk9MS1MjTk9TSVIjQk9JU0UjIwpWQUxMRVkjSElUSVQjQ09NTUVSQ0UKQVdPTFMjVEVDSE5PUEhPQkUjQ09QCkxBV1MjTEVBSCMjI1JVVFMjQ0xVRQpFU0UjU0lMVkVSU01JVEgjQ0xBUkUKVEhSRUVQTFkjRUxJREUjQ09PUFRTCiMjI0FWSVMjU1RPTkUjQk9BUyMjIwpBUklTRU4jQ0FSRUQjWUVMTEVEQVQKQ1lCRVJTUEFDRSNTVEFHRUNPQUNICk1BSUwjS0FGS0EjRUlSRSNBTk5FRQpFTkRTI0lERVNUI1RFTlQjUkVFRFk="},{"title":"03/27/17 TODAY'S DATE","author":"Gail Grabowski","date":"2017-03-27","grid":"VE9TUyNTVEFURSNTV0FQCkFSRUEjSElERVMjQVJJQQpMRUFQI09CT0VTI0hJTEwKQ09NUFVURVJTI1BBU1NFCiMjI0lSQVRFI1NPUlQjIwpBU1NFTlQjI1NUUkFXUyMKQ0xBU1MjU1BFQUsjQUxBClRJTFQjQ0FHRVkjUFRBUwpJQ0UjU0FMQUQjQ0FDVEkKI0VTQ09SVCMjQ0FDSEVTCiMjU0hPRSNTVE9SSyMjIwpGSUxFVCNORVdTUEFQRVIKT0RJRSNDT1ZFVCNHQVZFClJFUFMjT05FQUwjRVJJRQpFQVNFI1BFUktZI1NFTEw="},{"title":"03/28/17 EASY PICKINGS","author":"Billie Truitt","date":"2017-03-28","grid":"QUJDREUjU0lERSNCWUVTClJFQUlSI1RPSUwjUlVMRQpUQVNURSNJVExMI0lLRUEKU1VFWkNBTkFMI0lET05UCiMjIyNUQUdTI0FSRU5BUwpBQ1RSRVNTI0FUT1ojIyMKQ0FSRUQjI1BJQU5JU1RTCkVWRU4jV0lFTEQjTE9VVApTRUVETElORyMjR0xPQkUKIyMjRUFSTiNOT0xBVEVSClNDVVpaWSNUSU5BIyMjIwpIQUxWRSNWRU5FWlVFTEEKSVRUTyNHRU5FI0lOUFVUClBFUlUjUEVBVCNFRElDVApTUkFTI0FSTVkjUk9DS1k="},{"title":"03/29/17 WHAT'S FOR LUNCH?","author":"Fred Piscop","date":"2017-03-29","grid":"SEFIQSNHRU5PQSNTSElQCk9QRU4jQUxFVVQjUEFORQpQRUFOVVRGQVJNI0FMVE8KRVhQT1NFIyMjQ09DT09OCiMjI1lFQVMjTEFURSMjIwpIQVMjQlVUVEVSQ1JFQU0KQVJUU1kjUk9BRCNBVURJCklERUEjU0FORFMjQ1JBRwpGRUVMI01JR1MjS0VPR0gKQU5EVEhFTlNPTUUjU0VUCiMjI01CQVMjTkFCUyMjIwpKVU5JT1IjIyNHQU5HVVAKSUNPTiNKRUxMWUJFQU5TCkZMVUUjT01FR0EjQUlEUwpGQU5TI0JPWEVSI0tOT1Q="},{"title":"03/30/17 COAT CHECK","author":"Carolyn Stewart","date":"2017-03-30","grid":"V0VQVCNFQ0hPI1dBRkVSCkVVUk8jRFJVQiNBTE9ORQpBUk9EI0lBR08jR09SRFkKTEVUT0ZGVEhFSE9PSyMjClRLTyNSWUUjI1VORk9MRApIQU5PSSMjT0hNUyNWSUEKIyMjUEFOQUNFQSNNRVRTCiMjU1RSQVBIQU5HRVIjIwpUQU9TI1RFRVBFRVMjIyMKQUxMI1BVUlIjI1RBUEVEClBBU1RPUiMjQk9PI0FMSQojI1RBS0VORE9XTkFQRUcKRUxJVEUjSVJPTiNOQVZFClJBQ0VSI1BJTkUjRVlFUwpFV0VSUyNTUEVEI1dBTlQ="},{"title":"03/31/17 OUTSIDE CHANCE","author":"Greg Johnson","date":"2017-03-31","grid":"UE9VUiNTUFJJRyNNRVJDClVQVE8jVEVBTU8jSURFQQpQRUFTI1JFTkFMI05FQVIKI0NIQU1PTklYRlJBTkNFCiMjI05VQiMjI0ZJUlNUUwpDSEFOR0VPRlBBQ0UjIyMKUk9CRVMjUExBTkVUT0lECk9SRSMjU1RBWVMjI01NSQpDQVRFQ0hJU00jSU1FQU4KIyMjQ0hJQ0tFTkRBTkNFCk9VVExJRSMjI09MRCMjIwpDSEFJTkxJTktGRU5DRSMKSEFSUCNET1lMRSNFQVZFClJVVFMjRU5TVUUjU1BFVwpFTFNFI0RFRU1TI1NPUkU="},{"title":"04/01/17 SATURDAY STUMPER","author":"Lester Ruff","date":"2017-04-01","grid":"RU1QQVRII1NUUkVTU0VECkJPT0JPTyNNT1VOVElEQQpTVEVSTk8jQVBFUklUSUYKRVRUQSNQQVJUI09OU0VUCk5PU01BTExUSElORyMjIwojIyMjQ0FWRUFUIyNCT1QKV0hFQVQjQVJUQ09MT05ZCkhBVUxJTiMjI0hVU0hVUApBUlJJVkVTQVQjTlVSU0UKVEtPIyNJTlNZTkMjIyMjCiMjI01BTklTQ0hFV0lUWgpPQVNFUyNWSU9MI0lET0wKQVBQUklTRVMjRUxOSU5PCkZPVUNBVUxUI1JFQ09BVApTUFJZTkVTUyNTRUVNTFk="},{"title":"04/02/17 END OF MESSAGE: Specifically, 115 Across","author":"Gail Grabowski","date":"2017-04-02","grid":"QUNSRSNTQUxFUyNNU0RPUyNIQUxPClRPT0wjT1BFUkEjT01BSEEjQUNJRApQUk9WRVJCSUFMI0JBRE1PVVRIRUQKQUZGRUNUUyMjI1BJTEVTI05FRURTClJVU1NPIyNBU1dFTEwjI0lEUyMjIwojIyMjTkFJTEhPTEUjTklDRSNGQUEKQk9VVE9OTklFUkUjU09WRVJFSUdOCk9ITk8jR0FURVMjQlVPWVMjR0xFTgpMQVRURVMjI1JFU0VORCNJU09MREUKT1JJRU5UQUwjI1RBTkxJTkUjIyMjClNBTFNBI0NPVVRVUklFUiNSQVNUQQojIyMjQ0xFQU5FRCMjU0tJVFRMRVMKRkFKSVRBI0RJU1NFUyMjVEFMRU5UCkFNRU4jUkhFVFQjTUNSQUUjQVBTRQpESVNDT1ZFUlkjU0NPVVRNQVNURVIKRURUI1BBTlMjU1RFUk5FU1QjIyMjCiMjI1ZJRSMjUVVFRU5TIyNUSEVTRQpTQVRJTiNTTFVSUCMjI0lERUFNQU4KQ0xPVkVSTEVBRiNPVkVSQU5ET1VUCkFTVEkjSE9PS0UjQUlNQVQjRVRURQpNT09EI09XTkVEI0ZBVU5BI1NFRVI="},{"title":"04/03/17 SPRING PLANTINGS","author":"Gail Grabowski","date":"2017-04-03","grid":"QVNLUyNET1JBI0FDT1JOClNIT1QjVUtFUyNSQURJTwpIQVJFI0ZMQVAjR1JPU1MKRVZFUiNGQU1JTFlUUkVFClNFQU5DRSNTRUFMIyMjIwojIyMjT0xEIyNURUFCQUcKQVNUSVIjUkVTVCNDT0xBClNOQUtFSU5USEVHUkFTUwpQSVBFI1NPU08jQUVTT1AKU1RFQUxTIyNQQUwjIyMjCiMjIyNPVVRTI0JBQUJBQQpHRU9SR0VCVVNII0JBTkcKUEFSRVMjT1JUTyNFVFRFCkFSRU5PI05FQVIjVEhJTgpTUE9PTiNFUlJTI1NFQ1Q="},{"title":"04/04/17 QUADRUPLE QUARTET","author":"Billie Truitt","date":"2017-04-04","grid":"QUxJQ0UjR0xJQiNBRkFSClNJTkFJI0xPU0UjTU9SRQpJTU9GRiNJRExFI09SRVMKRk9SRUZJTkdFUiNFTUlUCiMjIyNFVFRFI0NBQklOUwpCQUZGTEUjI1NBTEFEIyMKQUxPRSNNQVNPTlMjQVBFCkNVUkVEI0NFTyNPSEJPWQpITU0jT0NUQU5FI0VMU0UKIyNVU0VSUyMjVEhSRUVTClNBTEFSWSNUQUNPIyMjIwpBV0FZI0ZPUlRIUklHSFQKVE9UUyNPUkFMI1NUQUlSClVLRVMjVVNNQSNFQUdMRQpQRVNPI0xPUFMjU0xBVEU="},{"title":"04/05/17 TO THE RESCUE","author":"Charles Slack","date":"2017-04-05","grid":"VEFOI1NIQUZUI1VQRU5ECk9SRSNISVJFUiNTQVhPTgpOT1YjQUZJUkUjQUNVUkEKR1VBUkRJQU5BTkdFTCMjClVORFVFIyMjVE9FI1RJRQpFREFNI1dPUlNUI0JBTksKIyMjI0RBTkEjTlVBTkNFCiMjV0hJVEVLTklHSFQjIwpQRVJVU0UjRUFDSCMjIyMKQVJBQiNSSURHRSNSRVNUClRFTiNERU4jIyNBQkFURQojI0dPT0RTQU1BUklUQU4KQVBMVVMjRUxBVEUjRVRBClJFRVNFI0NPQ09BI1JVTgpDQVJUUyNURUVNUyNZRVQ="},{"title":"04/06/17 FIX IT . . .","author":"Greg Johnson","date":"2017-04-06","grid":"TUFTQyNSQUJBVCNBTUZNCkFMTUEjQUxPSEEjTEVJQQpMT09TRUZMT09SQk9BUkQKTEVHQUwjQU1ZI0VOREVECiMjI05BVlkjI0JPWiMjIwpMQUtPVEEjU0VBRk9BTSMKVU5FVkVOU0hFTEYjQk9BCklERUEjUExBTkUjU0FXTgpTVU4jTEVBS1lGQVVDRVQKI1BFTkFMVFkjVU1QSVJFCiMjI0FQVCMjRkxJUCMjIwpNVU1QUyNPQVIjU0xFRUsKQlJPS0VORE9PUkhJTkdFCkFHUkkjQk9OWk8jRURHWQpTRUVOI0NSRUVEI1JPU1M="},{"title":"04/07/17 SEE 35 ACROSS","author":"S.N.","date":"2017-04-07","grid":"RUFTWSNTSUxJQ0EjSEVSCk1VVEUjQUNPUk5TI0FWRQpQUk9QQU5FVEFOSyNCRUcKQU9LI1NFQVQjI09IQVJBClRSRVNTI0dBU0JVUk5FUgpIQURUSU1FI0hPVEhFQUQKIyMjQVNBI1NPUyMjUkRTCiNBUFJJTEZVRUxTREFZIwpORUUjI0xJRSNFQVIjIyMKRVNDQVBFRCNTWU5BUFNFCldPT0RTVE9WRSNEV0VMTApTUFJBWSMjRUxMRSNDQUQKSUlJI0NPQUxGVVJOQUNFCkVBTiNIRUxESU4jSU5LUwpTTk8jRURJVEVEI1BTU1Q="},{"title":"04/08/17 SATURDAY STUMPER","author":"Matthew Sewell","date":"2017-04-08","grid":"SVNUSEFUQVlFUyNERUxMClNURUFNSVJPTlMjT0RJRQpQT0VEQU1FUk9OI05JS0UKU1dNI1pJTkVTI09UVEVSCiMjI0tPTkEjI1dBR09OUwpBQ0hJTkcjR0FJVEVSIyMKQ1JPU1MjVFVSTlNUSUxFClRBTVMjVEhBSVMjQ0FVTApTV0VBUldPUkQjR1VMQ0gKIyNBQk9BUkQjSkVUU0tJCkFOVElDUyMjU0lORSMjIwpTSUxMUyNHUklOVCNGT0IKQUNBSSNCUkFOR0VMSU5BCk5FU1QjUklOR0xFQURFUgpBUlRZI09OVEhFTE9PU0U="},{"title":"04/09/17 WRITE HONORABLES: With a distinction in common","author":"Fred Piscop","date":"2017-04-09","grid":"T1JBTiNIRU1FTiNBU1NBRCNQSVBTCkRBUkUjQU1PUkUjU1RPTEUjT1NMTwpPQ1RBVklPUEFaI1NBVUxCRUxMT1cKUkVTVEFSVFMjI1BBTlMjI0RFRURTCiMjI0VMU0UjU1BBWSNBU1BJQyMjIwpTUEFSRSMjRlVSSUVTI1BJVEFQQVQKSEFMI1RPTklNT1JSSVNPTiNUQUNPCk9SQiMjTk9STSMjI0dBVEVEI0JSQQpVS0UjVEhPTUFTTUFOTiMjT0dMRVMKVEFSI0hBTlMjQ0lURVMjUkVQT1NUCiMjVEhJTiMjS0hMT0UjI0FTU04jIwpBU0NFTkQjSkVXRUwjQU1TTyNFTVMKU0xBTkcjI1BFQVJMU0JVQ0sjUk9XClBPTSNTSEVFTiMjI0FOTkEjI1VURQpFTVVTI0VVR0VORU9ORUlMTCNERUwKTk9TVUdBUiNSQVRFRFIjI0VNQUxMCiMjI1JPVE9SI01BUlkjT0tJRSMjIwpSQVZFTiMjQUJFUyMjU1BBQ0VNQU4KQUxJQ0VNVU5STyNMSVRFUkFUVVJFCk1PTkEjT1BUSU4jQUNVUkEjVVNFUwpQRU9OI0NOT1RFI1NFREFOI1BFQVM="},{"title":"04/10/17 GLASS STATION","author":"Gail Grabowski","date":"2017-04-10","grid":"UFVSUlMjQkFUUyNXQVJTCklTQUFDI0FCRVQjSURPTApORVJWRSNST0FSI05PVkEKR1JFRU5IT1VTRSNEUkVXCiMjIyNURU5UI0VBU0VEIwpCUk9XU0UjI0lUQ0gjIyMKQVVESSNERUFOI1RJQVJBCklTT04jU05JVFMjRUxJUwpUSFJFVyNEUk9QI0xPQlMKIyMjQkFSUyMjRUxERVNUCiNBQk9ERSNNQU5FIyMjIwpUUk9UI0NIQU5ERUxJRVIKSFVSVCNFQVNUI1dPUkRZCkFCRUwjU0hPRSNBREFHRQpXQURFI1NBTkQjWUVTRVM="},{"title":"04/11/17 NO MORE ROOM","author":"Billie Truitt","date":"2017-04-11","grid":"Q0hBUlMjR1JJVCNHT1RPCkhJUkVFI1JVU0gjQVJJRApBTkdFTCNBTlRFI1NFTkQKU1RVRkZFRFRPTUFUT0VTCkVTRSNNTUUjI0VSQSMjIwojIyNKQUJCRVIjRVhBQ1QKUFNFVURPI0xPVCMjQk9PCkZJTExFRFdJVEhQUklERQpDRFMjI1lFVCNSVVRURUQKU0VFTUUjQkVHT05FIyMjCiMjI0FLQSMjUkVDI1BTQQpMT0FERURRVUVTVElPTlMKQUJCUiNPVVNUI1VOUE9UCkNPTEEjUklERSNBRklSRQpLRVlTI0VUQUwjTE9ORVI="},{"title":"04/12/17 GEOMETRIC SERIES","author":"Fred Piscop","date":"2017-04-12","grid":"TkFTQUwjUllFUyNHQVRFCkFMT05FI0VBVkUjSVJPTgpQT0lOVFRBS0VOI1JFTkQKQVRMQVNFUyNSRVBMQVlTCiMjIyMjUE9NI0dBUyMjIwpSRUYjTElORURBTkNJTkcKRU1PVEVEI1RJTCNPUkVPCkNBTkVTI0VSRSNTVUFWRQpBSURFI0FMSSNISVRURVIKUExBTkVUSUNLRVQjRVJTCiMjI0FMVCNTSVIjIyMjIwpIQUdHTEVTI1RPU1RBREEKQUNSRSNTT0xJRENPTE9SCkNIQVIjVE9PTiNBR0VOVApLRVlTI1NOVUcjVEFTVFk="},{"title":"04/13/17 GAME TRIO","author":"Greg Johnson","date":"2017-04-13","grid":"QUxJVCNDTEVBTiNFUlJTCkNPTk4jSEVOTkEjTUVFVApFQ1RPI0VWQU5TI0lGU08KI0FSVElGSUNJQUxST0NLCkJMVUVTIyNURUxMI1JVRQpPTEQjSEFTIyMjQUlNRUQKR0FFTCNNVVNFVU1TIyMjCiNXUkFQUElOR1BBUEVSIwojIyNURVNUTEFCI1NUT1AKUFVHRVQjIyNEWUUjSEFKCk9OTyNJTUFNIyNTSEVEUwpTQUZFVFlTQ0lTU09SUyMKVEJBUiNCT1JORSNXRUlOCkFMU08jQU5JU0UjTEFERQpMRVRTI0RFQlRTI1NMRUQ="},{"title":"04/14/17 ONE MAN SHOW","author":"S.N.","date":"2017-04-14","grid":"QUdBU1NJI1JFRFNIT0VTCkJVUklFRCNEUkVBTVNVUApMSU9ORUxCQVJSWU1PUkUKQURNI1BFUiNBQlMjTE9XClpFQUwjRFVTVFkjUEVQRQpFU1NFWCNORUEjSE9NRVIKIyMjR1JFRU4jU0VQSUFTCiNIT1JBVElPTkVMU09OIwpDT1BBWVMjUlVOSVQjIyMKQU1FTlMjV0FSI1hBQ1RPCk1FTkQjRk9TU0UjUk9CUwpQU0EjSkxPI0VWQSNZT00KSEFSVkVZRklSRVNUT05FCk9MRUFTVEVSI05FQVRFTgpSRUFMVE9SUyNUQU1FU1Q="},{"title":"04/15/17 SATURDAY STUMPER","author":"Brad Wilber","date":"2017-04-15","grid":"UEFQQUJFQVIjTU9TU0FECkFMQU5BTERBI0FMVElNQQpOT1ZFTElTVCNERUFERU4KVEhFTUUjI0NTQSNHRU5MClNBUkkjSElIQVRTI0pJQgojIyNDSEFORUwjUExVVE8KREVPI09WQVRFI1JBRElPCkVRVUlORVMjU01JREdFTgpDVVRJRSNMQVRJTiNFU0UKS0lXSVMjVUJBTkdJIyMjCkNQQSNUSk1BWFgjTE9BTQpIT0xFI1VQTiMjRUxJWkEKQUlLTUFOI0RFRkFVTFRTCklTRVVMVCNPVkVSU0VFUwpSRURTRUEjTkVaUEVSQ0U="},{"title":"04/16/17 CURMUDGEONLY QUOTES: From Bierce's \"Devil's Dictionary\"","author":"S.N.","date":"2017-04-16","grid":"UEFUQ0gjQUxQTyNSVVNTTyNUUkFQCkVNSUxZI0xBUksjT05MT1cjSElLRQpDVVBJRCNPTUFSI0JPSVRFI0lOQ0EKQVNQRUVDSEJZQU5PUFBPTkVOVCMjCk5FSU4jTEFERSNFVEVTIyNTS0lQUwojIyNUQUkjQURKT0lOI0FOVE9OSUEKUFJFRU1QVCMjT05DRVRPT09GVEVOCkxBRExFI0FCRUwjI0RBTlMjI0lDRQpFREdFUyNCRVJUSFMjR0VJVEhORVIKQkFBIyNST0FOI0lJSSMjRUVFIyMjCkVSUk9ORU9VU0FQUFJBSVNFTUVOVAojIyNQVUIjI1RTUCNJU05UIyNSSUIKQUxJU1RFUlMjSE9CTk9CI0FNQU5BClNBTiMjQ0hBTyMjUkFLRSNSSVNFUgpJTkJBRENPTVBBTlkjI0RBTkNFUlMKQVpBTEVBUyNUUkFOQ0UjRk9SIyMjCk1BTExFIyNNSU5JI1JVU0UjT1JCUwojI0FDUklUSUNPRk9VUk9XTldPUksKQU5OQSNCQVNJTCNMSU9OI0VBU1lBCkNDQ1AjSU1TQUQjRVNQWSNFVklDVApUT0VTI0RFQU5TI1NFRVMjUkVORUU="},{"title":"04/17/17 TREE TREATS","author":"Gail Grabowski","date":"2017-04-17","grid":"U1RBRkYjU1RFUCNDUkFCCkhPVEVMI1RPVEUjSEVNSQpBR0lMRSNBVVRPI0VWRU4KTUFQTEVTWVJVUCNSVU5HCiMjIyNDT1MjI0xBUkVETwojU0FGRVIjQ0hFV1kjIyMKQU5USSNUUlVFI09DVEVUClNJTkdTI0FQUiNMT09NUwpTVE9ORSNWSVNBI0xBTVAKIyMjRUFTRUQjUkVBRFkjClNIT1dNRSMjU0lOIyMjIwpISUxUI0FWT0NBRE9ESVAKVVBETyNMT0JFI0VSQVNFClNQSU4jQVRPTiNBU1lFVApIT0VTI0JFRVQjUk9TRVM="},{"title":"04/18/17 BY THE BOOK","author":"Billie Truitt","date":"2017-04-18","grid":"UE9JU0UjVkFQT1IjU0FNClNVU0FOI0VMRU5BI0VNVQpUSVRMRVNFQVJDSCNORVQKIyMjQU1JU1MjVVJCQU5FCklESURJVCMjSEVBUlQjIwpTRU5TRSNTUEEjSEVFRFMKTENEI1NMRUVWRSNBUE9QCkFSRUEjQVRTRUEjREFaRQpORVhUI0hPVFRVQiNHRUUKREVGT0cjVVNPI0FNRU5ECiMjSU5FUFQjI0NMQVNTWQpUSU5FQVIjSU1QTFkjIyMKSE9HI1JVTkZPUkNPVkVSCkFXRSNVTkhJUCNBUklTRQpXQVIjUEVMVFMjUFNBTE0="},{"title":"04/19/17 ORATORICALS","author":"Charles Slack","date":"2017-04-19","grid":"I1JJQiNMQUQjQVJNQURBCiNFTVVMQVRFI1NJRUdFUwojRkFSRVdFTExTUEVFQ0gKU0lHTk9OIyNFQVNUIyMjCkFMRVMjI1dIRVkjI0FDVApZRVMjQU1PVVIjQVRTRUEKIyMjQUxBUk0jU1BPSUxTCkhBTEZUSU1FUEVQVEFMSwpBTU9SQUwjUkVFTFMjIyMKUklHT1IjTFVDS1kjVE9FCk1EUyMjVFVTSyMjQ0VERQojIyNHUkFCIyNJU1JBRUwKS0VZTk9URUFERFJFU1MjCkdSRUFTRSNWQUxJU0VTIwpCQU5URVIjRVlFI1RSQSM="},{"title":"04/20/17 IN THE BALLPARK","author":"Fred Piscop","date":"2017-04-20","grid":"Uk9NQU4jREFDSEEjU1BBCkVNSUxFI0VTU0VOI0xBUApNQUxMV0FMS0lORyNBUkUKI1JFU0FMRVMjI1VQUEVECiMjIyNHQVQjRUxMQSMjIwojI1NDRU5FU1RFQUxJTkcKQUJIT1IjI0hBSVIjQ0VPClNMT1cjU0NBTEEjUElUQQpDVVIjQ09PUCMjRFVOU1QKSEVOUllGSUVMRElORyMjCiMjI09QQUwjQUlSIyMjIwpKRVRFUiMjQVJSRVNUUyMKRVZBI0VZRUNBVENISU5HCkZJUiNTQUxFTSNUVUxJUApGTE8jU0tJRFMjVkVFUFM="},{"title":"04/21/17 DON'T GO THERE","author":"Greg Johnson","date":"2017-04-21","grid":"SkFERSNBVEJBVFMjR0FQCkFYRUwjRFJJVkVMI09SRQpCRUxBI0pVREdFQUJPT0sKIyNJTkJVRCMjI1ZFTlVFClNBTSNVUkdFTlQjSElTUwpQTEVBU0VFVkVSWU9ORSMKQUxBSSMjI0FTSUFOIyMjCk1ZVFJFQVQjU09NRVdBWQojIyNGRVRFUyMjI1NPTEUKI1RFTExNRVdIQVRUT0RPClNJREUjU05FRVpFI0xBVwpBRERFUiMjI0xPQURTIyMKQllJVFNDT1ZFUiNPT1BTClJVRSNWSVNJTkUjRUNITwpFUFMjUEFTU0VTI1NLSVM="},{"title":"04/22/17 SATURDAY STUMPER","author":"Frank Longo","date":"2017-04-22","grid":"TElTUCNKT0JTSEFSSU5HCk9SRU8jSVJBUUlESU5BUgpPUkFMI0dFVFVQQU5ER08KU0lSRU5TI0hJUCNHSUdTCkVHTyNIQUgjQk9ESUNFUwpOQVZBTFdBUiMjSU5UUk8KVVRFUyNJR1VBTkEjIyMjClBFUlNPTkFMQkVMSUVGUwojIyMjQUdSRUVTI1NMSU0KR0hPU1QjI1NUVEVSRVNBClJBTUNISVAjU0JBI1ZIUwpBVkVPI0RBUyNPUkJBQ0gKVEVSUklFUk1JWCNVVEFICklOVEVSU1RJQ0UjTE9LSQpTVEFSU1RBVFVTI0JSRVQ="},{"title":"04/23/17 THE SOONER YOU KNOW: Oklahoma-born notables","author":"Mark McClain","date":"2017-04-23","grid":"I0FQVSNVVEFIIyNMRUFII0hFTUlOCkJSQU4jTUVSRSNTRUxNQSNPUEVSQQpST05IT1dBUkQjVE9NTVlGUkFOS1MKT05UQVAjTEVHR08jU09MSUQjVVNBCiMjI05SQSNTRUFMI1ROT1RFUyMjIwpXT09EWUdVVEhSSUUjSUZTI0NBVkUKSU5OUyNBUlNPTiNBSEFUI01PVkVECk5FRSNGSUIjR0VOUkUjI1ZFVE9FUwpDQU5USU5BUyNSRUJBTUNFTlRJUkUKRUxERVIjTkFCI1ZVTENBTiMjRFNMCiMjI1JFRklORVIjRFVBTElTTSMjIwpJVlMjI0FTVFJPUyNQVFMjSElUTUUKTUlDS0VZTUFOVExFI1NUQUlSV0FZCkFURVJSRSMjSVRPVVQjQUlNI0lDRQpNQU5JQSNUUkVFI0NPUFRTI0FHUk8KU0VUUyNNQUUjUkFMUEhFTExJU09OCiMjI1BST05HUyNMSU1BI0VFUiMjIwpFUEkjRUFUSVQjSURBUkUjSVBPRFMKR0FSVEhCUk9PS1MjU0FNV0FMVE9OCkFMT0hBI1VOTElUI1RPTUUjQVRNTwpERU5FQiNNU0VEIyNTSEFEI1lPTyM="},{"title":"04/24/17 TAKE YOUR TIME","author":"Sandy Fein","date":"2017-04-24","grid":"QkVFUlMjQkFMTCNMQUNLCkxBUEVMI0FSSUEjQUxBTgpBU0lERSNURUVOI1NPTUUKU0VDT05ESEFORCNUSEVFClREUyNET0VTIyNTTUFMTAojIyNERU5TI0NDQ0kjIyMKSU1QQVJUI1RSQUlORUVTCk5BUlkjTEFJVFkjVVRBSApBRE9QVElPTiNFU1RBVEUKIyMjTEVFSyNBTlRFIyMjClJFTEFYIyNBTk5BI0ZDQwpJUkFOI0RJTk5FUkhPVVIKVE9STiNVU0RBI1RPUlRFCkVER0UjQ1RSTCNMQUNFUwpTRUVSI1RPRVMjRVhFUlQ="},{"title":"04/25/17 CAPITAL MENU","author":"Sally R. Stein","date":"2017-04-25","grid":"I0hCTyNDQVNLI0NBUkdPCkxJRVUjQVJUSSNPUklPTgpBVElUI1RBSUwjTEVHQUwKTE9ORE9OQlJPSUwjU1RZCkFOR09SQSMjU0NBTSMjIwojIyMjQVBBUiNFUkFTRVIKSURFQUwjTFVBVSNDT1RFCkJSVVNTRUxTU1BST1VUUwpFQVJQI0FZRVMjSU5MRVQKVFdPQ0FSI1NUT1AjIyMjCiMjI0FDVFMjI05FU1RMRQpDT1QjQ0hJQ0tFTktJRVYKQUJPVkUjVE9FRCNFREdFClJPUEVTI0FSRUEjV0FHUwpURVNUUyNSRUxZI1NMWSM="},{"title":"04/26/17 DOUBLE NEGATIVES","author":"Charles Slack","date":"2017-04-26","grid":"QkVFI1NDQU1QI0FCQVRFClJOUyNQQUxFUiNNQU5JQQpBQ1QjQUxBTU8jT0xERVIKTk9IQVJNTk9GT1VMIyMjCkNSRVRFIyMjI0ZSWVBBTgpIRVJFI0FETUlUI0hFUkEKIyMjI0JSSUFSI0ZPQU1ZCiNOT0dVVFNOT0dMT1JZIwpGQUlSWSNDT05FWSMjIyMKRElOTyNOT1JTRSNKRUVSCkFMS0FMSSMjIyNDT05ETwojIyNOT1BBSU5OT0dBSU4KUkFESU8jU05PT1AjTUJBCk9NRU5TI0FUT05FI0VMTApCSU5HRSNQT0tFRCNMRUQ="},{"title":"04/27/17 SCREWDRIVER SAYING","author":"Billie Truitt","date":"2017-04-27","grid":"U1BZI0JBVEhPUyNJQ0JNCkhFTSNFUVVBVEUjVEFMRQpBUkMjUklHSFRBTlNXRVIKUVVBS0UjI05PTklTU1VFCiMjI0FGQVIjI0NGTyMjIwpUSUdIVEJVREdFVCNBU0gKQUNMVSNJTk9SI1lBTFRBCkxJT04jVE9OQUwjTElBUgpLRUJBQiNGT1BTI0lCSUQKWVJTI0xFRlRIQU5HSU5HCiMjI01BQyMjU1RVTiMjIwpJTkNJU09SUyMjQVNDT1QKTE9PU0VDQU5OT04jQVBFClNFQVQjQVJBQklDI1BBUgpBTExZI1JFR0FMRSNFTE0="},{"title":"04/28/17 IN THE END","author":"S.N.","date":"2017-04-28","grid":"I1NBVkFHRSNQUFYjTUNJClBBTEFUQUwjSUlJSk9ITgpPVVRTT0xEI1NUREVOSVMKU0NIRU1FT0ZUSElOR1MjClNFRSMjI1JJTyMjI09FRApFUkFTI0RBUk5TI0tPTEEKIyMjRVRVREUjTE9PU0VOCk1JRERMRU9GTk9XSEVSRQpPTkVBQ1QjTElCRUwjIyMKT1ZFTiNTV0lHUyNTVU1TClRPUCMjI0hFSCMjI05PVwojSU5URVJFU1RPRlRJTUUKTUNFTlJPRSNDUkVBU0VECkJFU1RJQUwjQUNFVE9ORQpBU1MjRVJTI1BBVEVOVCM="},{"title":"04/29/17 SATURDAY STUMPER","author":"Lars G. Doubleday","date":"2017-04-29","grid":"UkFTQ0FMI1JVTVBVU0VTCkNSRUFTRVJFU0lTVEFOVApDQVBUSVZFQVVESUVOQ0UKT01BSEEjQlJBRyMjTUFXCkxJTFkjV0VMTEVTI0FTUApBU1MjVElLSVMjUEFUSU8KIyMjRFVDQVQjU0lMRU5UCkpPTUFSQ0gjVU5DTE9HUwpJVkFOS0EjU1RJRVMjIyMKR0VFU0UjUkVFRFMjTUFCClNSUyNZVk9OTkUjV0FWRQpBQ1QjI0lET1MjQU9MRVIKV09STERTRVJJRVNSSU5HCkVNT1RJT05BTFJFU0NVRQpERVNTRVJUUyNTQVRFRU4="},{"title":"04/30/17 CHARACTER BUILDING: Novel characters, to be precise","author":"S.N.","date":"2017-04-30","grid":"TUFHSUMjT1BBTCNBQkJSUyNQT0RTCk9QSU5FI0dJR0EjRE9VQlQjQVVSQQpXT0xGTEFSU0VOI0RPUklBTkdSQVkKU1BMSVRQRUEjR1JVTlQjUk9PU1RTCiMjI05JUFMjQ0xBUFMjQlJFRCMjIwpJTkRJQ1QjR1VFU1QjU1JJTEFOS0EKQ09PVFMjTUFSWVBPUFBJTlMjT0VECkJPUkUjU09CUyMjI0hBTkcjQ1JBTQpNTk8jUEhJTEVBU0ZPR0cjRElBTkEKU0VUTE9PU0UjWUVTTk8jQ0FOQ1VOCiMjSEFVTlQjTUVBVFkjQ0FUQ0gjIwpQUllOTkUjVEVBTU8jU1VSRUhBTkQKUkFHRUQjSEFSUllQT1RURVIjUklPCklSQVMjUEVSSSMjI1dFRUQjQ0xPRApNRUwjUkhFVFRCVVRMRVIjVEFFQk8KUFJFQ09PTFMjRVJSRUQjVkVSU0VTCiMjI09XTlMjTkFHQVQjTUVBTiMjIwpFTkNPREUjSE9ORUQjQ09SUklET1IKQkVDS1lTSEFSUCNFTU1BQk9WQVJZCkJJTEUjSUFNU08jUk9PVCNGQVJDRQpTTElEI05ZTUVUI1NPTlMjRkxFQVM="},{"title":"05/01/17 FILM VIPS","author":"Sandy Fein","date":"2017-05-01","grid":"QlVJTFQjQ0FNUCNCRVRTCk9QUkFII0FSSUEjUkFSRQpTVEFURSNQSU5TI0FSRUEKQ09TVFVNRURFU0lHTkVSCiMjI0VTRSMjREVOIyMjIwpVU0gjQUxTTyNTVVJFU1QKTkNBQSNPSUxTI1NJTkNFCkNBU1RJTkdESVJFQ1RPUgpBTFRPUyNIRVJFI0hFTE0KUEVPUExFI1JFRlMjUkRTCiMjIyNBTEUjI0VUUyMjIwpDSU5FTUFUT0dSQVBIRVIKT1JFTyNUVU5FI0NSSU1FCk1PUk4jRURFTiNLRVZJTgpFTkRTI1NFQVQjU0VFVE8="},{"title":"05/02/17 PRIME RHYME TIME","author":"Sally R. Stein","date":"2017-05-02","grid":"U01BU0gjQUJMRSNBTUVOClRBTVBBI0RJRVQjTUFMRQpVTklPTiNNQVNDI1BVTUEKQkVTVERSRVNTRURMSVNUCiMjIyNJQU4jI1RPRSMjIwpQRUxMRVQjRlJFVCNDVlMKQVJFQVMjVE9VUiNBTE9FCldFR09UQUdSRUFUUkFURQpOQ09TI0RJR1MjQUlNRUQKU1RTI0NBRkUjQ0xBU1NZCiMjI0FTUCMjUElFIyMjIwpGSU5FSVRBTElBTldJTkUKSURPUyNFU1BOI1RPVEVNClRPVE8jUkFHRSNFVkVSVApTTElQI1NQQVMjREVNT1M="},{"title":"05/03/17 PICK FOUR","author":"Carolyn Stewart","date":"2017-05-03","grid":"Rk9QUyNBU1NBTSNVTVBTCkVSSUMjVEVSUkEjVEFSQQpSRVBPUlRDQVJEI0FYRVMKTk9TV0VBVCNJRENISVBTCiMjI1NBQyNBVkVSIyMjIwpBUlQjUEhPTkVOVU1CRVIKRUFSUyNFUkEjI01PVVNFCklOVUlUI09ITSNCT0lTRQpPVVRSRSMjRVNDI1NMQVYKVVBISUxMRklHSFQjRFlFCiMjIyNMT0FNI0VBVCMjIwpMVU1QU1VNI0NFUkVBTFMKT05VUyNQSVRBUE9DS0VUClNJVFMjRUxBVEUjSElWRQpTVEVUI1NZTk9EI1NOSVA="},{"title":"05/04/17 AT YOUR SERVICE","author":"Mark McClain","date":"2017-05-04","grid":"WkFHI01DQ09ZI1lFQVJTCkFTVSNQQVJLQSNFWFBFTApQSVRDSEZPUksjTEFTU08KU0FTSCNUU0EjQUxDT1RUCiMjI0lXQVMjU1BPVCMjIwpDQUxMSU4jU0VBV0FSRFMKQURVTFQjI1BFQ0sjT1JFCkRJTSNIT0JPS0VOI0JPQQpFRUUjRUxPSSMjSURJT00KVFVOQVJPTEwjSUZPTkxZCiMjI1VTR0EjU1RFVyMjIwpLR0JTUFkjSEFTI0VWRVIKQVJFU08jTkFNRVBMQVRFClJBVElPI0FJT0xJI05BUApBU0hFTiNHUkFGVCNTTE8="},{"title":"05/05/17 WHERE'S A MORAY?","author":"Fred Piscop","date":"2017-05-05","grid":"UkFDWSNEQUZGWSNUQUJVCk9VWk8jVUJFUlMjT1JBTgpCUkFHI0ZSRUVMSVZJTkcKQkFSSSNGQVNUI1pFU1RBCiMjI0JMRUQjI1BPU0VVUgpUSFJFRUxFR0dFRCMjIyMKTU9PUkUjI1JPQVNUUElHCkFNT1IjUFJJT1IjSE9ORQpOT1RBUEVFUCMjSkVOR0EKIyMjI0VTVEVFTEFVREVSCkFSQ0FSTyMjRFVCUyMjIwpTQVVESSNHQUlUI01PSk8KS05FRUxFTkdUSCNJSE9QClVUSUwjREFGT0UjTklOQQpQT05FI1NUQVJSI1RPSUw="},{"title":"05/06/17 SATURDAY STUMPER","author":"Lester Ruff","date":"2017-05-06","grid":"QU1QTElGSUVSI0xPVkVTCk1BUklORVJJSSNPVkVSVApCUklTS05FU1MjQkVSUkEKUkFOVEVEIyNFVEVSTkFMCk9UVEVSI0FGUk8jSEFOSwpTSE9FI0dSUiNZSUVMRFMKSU9VI1NBUkFUT0dBIyMjCkFOVE9OSU9HVVRFUlJFUwojIyNaQU5aSUJBUiNFVkUKU1RST1BTI0xFUyNFREFNClBFRU4jT1JFUyNQTEFORQpMQVZJR05FIyNTQVVURVMKSUJJWkEjQUJTVVJESVNUCkNPVkVUI0NSRUVERU5DRQpFWEVSVCNUQVhET0RHRVI="},{"title":"05/07/17 MAY DAY: A few days late","author":"S.N.","date":"2017-05-07","grid":"TUVUQSNTQVBTI1BBTklDI1NBQUJTCk9WSUQjQ0xFTyNBTUFOQSNPTlRBUApXSU5EU0hJRUxEV0lQRVIjV0FMRE8KU0xBTE9NI1BFT05TIyNSQU4jQUNUCiMjI0VZRVRFU1RTI1BST0IjI05ITApWSUEjTUFJRCMjI0ZSSUxMUyNURUUKSU5TUElSRSNISUVST0dMWVBISUNTCkVBU0VMUyNGQU5ORUQjIyNSSVNLUwpUSEFOSyNTSU5CQUQjSEFMQVMjIyMKTk9VTiNUQU5ERU0jU09ET0kjU0FECkFMTCNQSElMQURFTFBISUFOI0FDRQpNRVQjUk9MRVgjTEVBTk9OI1NUQU4KIyMjTU9VU1kjUExBQ0VTI1NDQURTCkFEQVBUIyMjQkVFUEVSI0dPQVRFRQpCQUNIRUxPUlBBUlRZI0NVU1RPTVMKQllFI01FTlRPUiMjI0xVTFUjUEVUCkFUVCMjRVBFRSNQQVJBQkxFUyMjIwpFUkEjQUtBIyNSRVNFVCNJTVBJU0gKQkFUT04jUFVTSFRIRUVOVkVMT1BFCkFERVBUI0VTVEVFI0tORUUjSVRBTApORVNUUyNSQURBUiNTVEFSI1RBUlA="},{"title":"05/08/17 ILLUMINATING","author":"Gail Grabowski","date":"2017-05-08","grid":"I01JTCNCSUxMUyNBQ01FCkFJREUjQURJT1MjVEhJTgpQTEVBI1dFQVZFI0hBTkQKUk9BREZMQVJFI0JFTkRTCiMjI0ZFRUxTI1NBTkQjIwpBRkZPUkQjI1BBU1NFUyMKTUVMT04jSEFJTFMjTEFXCkZFQVQjQlVSTlQjRElWQQpNRFMjREFOQ0UjQlJFRUQKI1NIUklOSyMjQ09BUlNFCiMjTEVORCNBTExPVyMjIwpTTElERSNGTE9PUkxBTVAKVEFHUyNNQUlEUyNPUkVPCkFDSEUjQURBR0UjVEVOVApCRVRBI1JFU0VUI1NBRCM="},{"title":"05/09/17 IVY LEAGUE","author":"Sally R. Stein","date":"2017-05-09","grid":"Uk9BRCNUSEVNI1JFU0VUCkFCTEUjRVVSTyNFWFRSQQpQQVVMI0FNSVMjU0lSRU4KSU1NSUdSQU5UVklTQSMjCkRBUyNSVU4jI09OVElNRQojIyNUQVAjQUxMI1NOQVAKSE9QSU4jT0xJVkUjU0lDCklOQUNUSVZFVk9MQ0FOTwpQSU4jU05BUkUjT0NURVQKUE9FVCNBTFQjTFBTIyMjCk9OTE9BTiMjQkVFI0VHTwojI0lSUkVHVUxBUlZFUkIKUEVTVE8jQVBFUyNPUkVPCkJZVEVTI1pPTkUjTElURQpKRVNTRSNFTkRTI1RFQVM="},{"title":"05/10/17 FIGHTING WORDS","author":"Billie Truitt","date":"2017-05-10","grid":"U0xJUFMjREVMSSNBU1BTCldJTkFUI0lWQU4jTkNBQQpBTU9SRSNTRU5EI0dSSU4KQkFUVExFQ1JFRUsjQU5ECiMjI0lMTFMjI0VSVVBUUwpBRVJJQUwjTlVESVNNIyMKRkxVI1JFRE9TI1NQRUNTCkFNTU8jTkFERVIjU1RBVApST0JPVCNUVVJPVyNBTEEKIyNMT09GQUgjV0hPTExZClRIRUhVQiMjSk9JTiMjIwpSRVMjUklPVE9GQ09MT1IKQUxFQyNNQVJFI0hBSUtVCkNMQVAjQUhPWSNJVFNPTgpUT1RPI05VVFMjU0hBS0U="},{"title":"05/11/17 CROSSING SLOGANS","author":"Charles Slack","date":"2017-05-11","grid":"U1BBI0tQSCNSSUIjU0hFCktJRCNBUkUjRUxFQ1RPUgpJVFNUSEVSRUFMVEhJTkcKIyMjVU5MRVNTI0NVUkVTClNQVU4jTE9UUyNIUlMjIwpUSUxERSNGRVVEQUwjIyMKRVhUUkFTI0VSSUMjQ0JTClBJUkFURVMjRVJBU1VSRQpTRUEjSkFQRSNFTlRSRUUKIyMjQlVUTEVSI1RSSUFECiMjU09TI0FSRVMjT0FLUwpTQ09PVCNTSVBQRUQjIyMKQ0FOWU9VSEVBUk1FTk9XCkFOREFOVEUjWUFNI0ZSWQpURUUjRUVTI1NUWSNMRUU="},{"title":"05/12/17 CARRY THAT WEIGHT","author":"Clive Probert","date":"2017-05-12","grid":"UkFURSNJREFITyNFTVRTCklCSVMjR09ERUwjVVRBSApDT01QT1VOREVEI1JPTEUKT0RFI0hBTlMjRFdFTExTCkhFUk9JTkUjS09PS1kjIwojIyNMT0FESU5HUkFNUFMKVEFQRSMjI0RFU0sjUEVBCkFSSVNFI05BVyNTUFVSUwpUT08jUk9BUiMjI1VTUFMKQU5OT1VOQ0VNRU5UIyMjCiMjRVhQRUwjRVhPVElDUwpDTEVGVFMjU1dJRyNOSVAKQUVSTyNUSUtJTE9VTkdFClNURVIjT1BJTkUjR0VORQpUT0REI1BBTkdTI0dSQUQ="},{"title":"05/13/17 SATURDAY STUMPER","author":"Matthew Sewell","date":"2017-05-13","grid":"VEFTVEVUSElTI1JBU1BTCkVYUEVESUVOVCNPTkVPTgpTVE9SSU5HVVAjU09DS08KTE9VUEUjSVRFI0VOVEVSCkFOVFMjUFJFVFRZI0lSSwojIyMjUk9BUkVSI0xPR0UKQkFUVEVSI09SSUdJTkFMCkFUSEVJU00jU1BBUkVNRQpTUEVFRENPUCNMRUFERUQKRVJBUyNIT1JNRUwjIyMjClJFUCNSRUxPQUQjR1JFRwpBU09MTyNBQk8jQUxFVkUKVEVMRVgjVEVSTUxJTUlUCkVOTEFJI1RSSUFMREFURQpTVE9LRSNFU1NBWUVYQU0="},{"title":"05/14/17 COMPONENT PARTS: Of what, you'll soon figure out","author":"Gail Grabowski","date":"2017-05-14","grid":"QUJDUyNTT0lMI1NISVBTI1NDVUJBCkpPTFQjSU5GTyNLT1JFQSNUQVBFRApBWlVSI1BJU0EjSVBBU1MjT1BURUQKUk9CSU5IT09EI0hJVFRIRVJPT0YjCiMjI05PT04jI01BTkVTI1ZFVCMjIwpDQVBHVU4jTE9PVCMjI1RJUkVTT0YKRUxMRU4jREVFRCNBQkJPVCMjSFJFCkRPVVIjRkVOREVSR1VJVEFSI0VFUgpFTkcjUklGVCNNQVJJTkUjRVJST1IKU0VBI0FURU9OI01FTEQjQ0xVTVNZCiMjTkFESVIjVU1QRUQjU0hFQkEjIwpBTERSSU4jTUFZQSNTQUxPTiNOUkEKSElQVE8jRE9OVEdPI01BUlQjVEFCCkVOTCNTRUFSQ0hFTkdJTkUjTEFWQQpBREEjI0xJTkVTI0VBU1QjRElORVMKREFZU1BBUyMjI05BQlMjVEFDS0xFCiMjI09VVCNTRUdBTCMjSEVSTyMjIwojQlVNUEVSQ1JPUCNUUkVFVFJVTksKTEFOQUkjQ0FST0wjUkVOVCNJUkFOCkRSSUxMI0FST1NFI09OQ0UjQ0FHRQpMRVZJUyNTRUxFUyNERUVSI0VMU0U="},{"title":"05/15/17 KEEP IT CLEAN","author":"Gail Grabowski","date":"2017-05-15","grid":"U0xBUCNUSFJPVyNJU0xFCkVVUk8jSEVJREkjU0NBTQpFQVRTI1JBVE9OI1dSSVQKRFVTVENPVkVSI0ZFVURTCiMjI1BMQVlTI1NMQUIjIwpTQVdPVVQjI0xFQVJORVIKUExBTkUjRkFJTlQjVUZPCkVMU0UjVElSRUQjR1JJUApOQUgjT0lOS1MjQUlTTEUKVEhBTktFRCMjQUdSRUVTCiMjU0VFUiNDQU1FTCMjIwpBQ0hFRCNQT0xJU0hPRkYKQ0xPRCNSQUJJRCNPR0xFClRPUkUjQUNSRVMjT1JFUwpTUEVEI01FQU5UI0RFRVM="},{"title":"05/16/17 SWEET TALK","author":"Billie Truitt","date":"2017-05-16","grid":"TUFNQVMjT1NIQSNTRUNUCkFET1JFI0hPT1QjUEFSQQpSQU5BVCNCTE9UI0FTQVAKU01BUlRDT09LSUUjRVZFCiMjI0FMTFkjI1JFRUxFRApIT1RURUEjU0hFTEwjIyMKVUZPI0lOQU5FIyNTTEFWCkVBVElOR0hVTUJMRVBJRQpTTk9CIyNBR0lMRSNHUlIKIyMjTUFTVFMjVU5FQVNZCkZJQVNDTyMjQVNJTiMjIwpFR0cjVEFLRVRIRUNBS0UKQUxBUyNSSVBFI05PQkVMClNPSUwjRVdFUyNDUkVFSwpUT05ZI0RJRVQjWUVMUFM="},{"title":"05/17/17 GET OVER IT","author":"Carolyn Stewart","date":"2017-05-17","grid":"VVJCQU4jTUVPVyNTUE9UCkNBSVJPI0FMREEjTE9TRQpMSU5FQkFDS0VSI0lTTEUKQUREI0lWRVMjU0FNU09OCiMjI0xHRSMjVEhSRUUjIwpUT1BPR1JBUEhJQyNTSEUKT01BTkkjVFJJUCMjU0FMClJBTkdFI0VFUiNUV0lORQpBSEEjI0dPRVMjSEFWT0MKSEFNI0NPVU5URVJGRUlUCiMjQURVTFQjI0xPVCMjIwpFQ0hPRUQjVElMVCNISUQKU0VBTiNNT09OU1RSVUNLCkFMVE8jQVJPTiNMT0dPTgpVU1NSI05FVFMjRUJPTlk="},{"title":"05/18/17 GET WISE","author":"Fred Piscop","date":"2017-05-18","grid":"QUxMSU4jVVNFRCNQT1BTClRFQVNFI1JVTEUjRUJSTwpCWVlPVVJTRUxGI1RPT04KQVRPI1RBVVQjUkFSRUZZClRFTkRSSUwjVEFDTyMjIwojIyNDQU5BUllZRUxMT1cKQU5WSUwjI09SRVMjSURBCkNPQVgjR09NQUQjQUxFWApEQU4jVFVORSMjQU5UU1kKQ0hFUlJZWU9HVVJUIyMjCiMjI0hPQVgjQUdSSVBQQQpCT0xFWU4jRUxMQSNMQVQKQVhFUyNFQVJMWVlFQVJTCk1FTlUjU0hPRSNFTElURQpBTkRTI0VBU1kjRElEWUE="},{"title":"05/19/17 NAME CHANGES","author":"S.N.","date":"2017-05-19","grid":"U0NBTFAjT0xMQSNKT0xUCkFMQ09BI0RPT1IjVVRBSApIT1RPTiNEQU5NQVJJTk8KSVNJUyNCTERHI1dJU0VSCkJFVkVSTFlTSUxMUyMjIwojIyNORVQjI1RBU1RFSVQKT05DVUUjQ09VUCMjQVNBClBFT1BMRUFORFBMQUNFUwpUT00jI0xVVEUjQUNIRVMKU05PT1pFUyMjQVNIIyMjCiMjI0JFVkVSTFlISUxMUwpVQk9BVCNSVUlOI0xPT1AKU0FOTUFSSU5PI0VMVURFCkFSRUEjTUVBTiNSRUlHTgpGRVNTI1NTVFMjQVNTRVQ="},{"title":"05/20/17 SATURDAY STUMPER","author":"Frank Longo","date":"2017-05-20","grid":"T1JCRUQjRkxPUiNTVEFUCkZPUlRFI0JBTkEjRUFDSApBTE9IQSNJUEFEI0FMVEkKR0VORVJBTEFWSUFUSU9OCkVYQ0xBTUFUSU9OTUFSSwojIyMjQklCI1NFVEkjIyMKVEhST0IjI01JUiNMSU1BClJFQURZRk9SVEFLRU9GRgpJTkhEI0FSVCMjVVNVQUwKIyMjRk9ORCNQRVcjIyMjClNISUVMREVEQUdBSU5TVApOVUNMRUFSRU5HSU5FRVIKT1JBTCNOT0xFI1RVTExZCkJPUk8jQ1VMTCNJU0xFUwpTS0VXI0VUQVMjU0VFU1Q="},{"title":"05/21/17 RURALITY: Getting back to the land","author":"Mark McClain","date":"2017-05-21","grid":"T1NMTyNDUk9DI0lCTVMjTEVBUEFUCkNMSVAjQVVUTyNOT0FII0VMTklOTwpIT01FT05USEVSQU5HRSNTSU5HVE8KRU1FTkQjSEVYQSNBTUFTI1hFU0lOClJPREVPIyNSSU5HI0FGTENJTyMjIwojIyNEUkFUI1NDQVIjI0VBUkZMQVAKSkFCI0ZBUk1UT01BUktFVCNBRVJPCklMTCNSSEVPI1JFVkFNUCNBVkFOVApMT1VQRSNTT1AjI0lNUyNTTk9SRVMKVEhFUkUjU0xBQlRPUCNTSUdOIyMjClNBUkEjTUVBRE9XTEFSS1MjTE9TUwojIyNJWk9EI1RSQUlORUUjTkVBVE8KRkFCUklDI1BIRCMjVFNQI0VBU0VMCkVRVUlQI1NFQUVFTCNPVFRPI0VBVApTVVJFI1BMQUlOU0lORElBTiNTS0kKVEFHU0FMRSMjU0FNRSNDUkFCIyMjCiMjI0NPWUVTVCNVUENTIyNUT0FTVApTVEFITCNUQVJQI0lUSVMjQUxUQVIKSEFMT0VEI0ZJRUxEQVJUSUxMRVJZCkFDVE9SUyNFTFNFI1JFQUQjSUFHTwpXSElMU1QjU0xPVCNTU05TI1hNRU4="},{"title":"05/22/17 TAVERN TALK","author":"Sandy Fein","date":"2017-05-22","grid":"I1NBR0UjQk9DQSNCQVJTCkRJVkFOI0lSQVMjQVJJQQpJTkVSVCNSRUxZI1JFRFMKQkFSQklFRE9MTCNCQVNTClNJVCNSUlMjU1VSRSMjIwojIyNCRUlORyNNT1JTRUwKSEFIQSNORVJEI1NQQURFCkFQQVJUI1NFRSNZT0tFUwpWRVJHRSNURUFNI0xFTlMKRVhQQU5EI0tOSUZFIyMjCiMjI0lURVMjU05PI0tPUwpURUVOI0JBUkxFWVNPVVAKQVJBQiNBTEFJI0VMQVRFClNJU0kjVFNQUyNSSUxFRApLRUVOI0VBU1QjU1RBUiM="},{"title":"05/23/17 GENEROUS","author":"Billie Truitt","date":"2017-05-23","grid":"RkxJTlQjQ1JBTSNBSkFSCkxVTkFSI0FVVE8jTFVCRQpBUk9NQSNCTFRTI1RSQVAKQkVORVZPTEVOVCNST1NFCiMjIyNFUkUjI0xBVVJFTApPUkFDTEUjU0FZSEkjIyMKUklDSCNPUEFMI0FTU1RTCkFMTUEjU0FMU0EjVE9JTApMRUVSWSNQT09MI0lTTEUKIyMjSU9XQU4jR09DT0VEClNUQVRVRSMjQ0FOIyMjIwpUT0dBI0JJR0hFQVJURUQKQURBQiNDT0xBI1RFQVJZClJBSUwjQVRPUCNJTk5JRQpTWU5FI01BUFMjUE9LRUQ="},{"title":"05/24/17 SHORT LIST","author":"Fred Piscop","date":"2017-05-24","grid":"UE9TRSNTVE9SRSNCQUxECkVWSUwjTkVQQUwjT0RPUgpQRVJNI09QRU5TI1RPUkUKI1JFU1RSSUNURURBUkVBCiMjIyNXRUQjIyNPTkVORApTVVBQRUQjUEFUVFkjIyMKQU5JU0UjUE9MTyMjQUxJCkZJTklURVJFU09VUkNFUwpFVFMjI1RPVE8jTk9SU0UKIyMjQU1BU1MjQ0xFRVNFCkZMT1JBIyMjQVJFIyMjIwpMSU1JVEVERURJVElPTiMKQUxFUyNXQUdFUyNPVkVOClBBR0UjRUxPUEUjTkFNRQpTQ0FOI1JFU1RTI1NMT1c="},{"title":"05/25/17 ON THE LEVEL","author":"Carolyn Stewart","date":"2017-05-25","grid":"U1RBRyNQSEFTRSNGTEFHClRJTUUjUk9CSU4jSU9XQQpBVE9NI09NRUdBI0VSUlMKRkxVU0hXSVRITU9ORVkjCkZFUlRJTEUjI0VORCMjIwojIyNPTkUjI0ZMVSNNSUwKRVZFTlRSQURFI1NIQURFCk1JVEUjU0xBTVMjRUxMUwpNRU5TQSNGTEFUU0FMRVMKQURBI05FQSMjSVREIyMjCiMjI0NOTiMjQUxBQkFNQQojU01PT1RIT1BFUkFUT1IKVEhBSSNSRU1JVCNORVdUCkVBUkwjQVJFTlQjRFVFUwpBR0VTI1BPTkdPI1NQUlk="},{"title":"05/26/17 WINNING LETTERS","author":"Mark McClain","date":"2017-05-26","grid":"I05BU0EjI1BPVCNJQ0VTCkhBRE5UI0dST1cjTU9OSwpBVFNFQSNMT0RJI0FOVEkKU1VQRVJCT1dMWFhYSUkjCkJSQVpJTCMjRVRBI0ZDQwpSQUNFI0FMUFMjQ0hFRVIKT0xFIyNOSUwjU1RVUkRZCiMjI1RJQ1RBQ1RPRSMjIwpTV09SRFMjTk9SIyNNRUEKU09OSUEjTUFHSSNNRU1FCkVCQiNIQVQjI0RFQUxJTgojQk9PT0ZGVEhFU1RBR0UKQ0xBVyNMVVJFI1NVTlJBCkZFUk4jQUpBUiNBUklFUwpPRERTI1RJTSMjWUVBUyM="},{"title":"05/27/17 SATURDAY STUMPER","author":"Andrew Bell Lewis","date":"2017-05-27","grid":"R09MRkJBR1MjTUFSR0lOCk9QRVJBSEFUI0dSRUVDRQpEQVRBTVVMRSNNRUVUQVQKU0xVTSNNTExFI0FTQU5BCiNTUEVEI1VMTkEjRU5EUwojIyNKRU9QQVJEWSNJUlMKTEVET0ZGI1JPREUjREVFCkVNT0JBTkQjTk9TV0VBVApOSVQjQ09SSyNJQkVBTVMKU0dUI0VUT05CTFVFIyMjCkZST0cjRVBFRSNUSFJVIwpMQURFRCNTRU5UI09VQ0gKQVRPTkFMI0NIQVNVQkxFClJFVElOQSNBVVNUUklBTgpFRFNFTFMjUFJFU1NPTlM="},{"title":"05/28/17 HORSE PLAYERS: In equine films","author":"Fred Piscop","date":"2017-05-28","grid":"TUVUQUwjU1dFQVQjTUFTQyNTSVRFClBSQURPI1RPUlRFI0FMVEEjSURPTApHUk9VQ0hPTUFSWCNST1lST0dFUlMKIyMjTE9JUkUjQVRCQVQjT1JOQVRFCiNQVEEjREVOI05FQVQjUlVFUyMjIwpTT09USEVEI0VERFkjTElTU09NRSMKQUxCRUUjI09OTyMjUk9WRSNOSU5BCklLRSNST0REWU1DRE9XQUxMI0NUTgpMQVlTI0RBREEjUkVCRUwjSVJLRUQKIyNNSU5JTVMjSE9OT1IjU0tJRVJTCiMjQVJJU0UjQk9PU1QjUkVFRFkjIwpSRUdFTlQjQ0xJTkUjUkVEREVSIyMKRVhVREUjRVJBU0UjQUlERSNST0NLCkVQSSNST0JFUlRSRURGT1JEI09STwpGT1JFI1BPU0UjI1ZFVCMjQVNORVIKI1NFUlBFTlQjV0hFTiNTVFlMRVRTCiMjI01BTlkjRElPUiNIQUgjRVlFIwpPUkJJVFMjS0lUVFkjQVdBUkUjIyMKRElBTkVMQU5FI0VNSUxZV0FUU09OCk9HTEUjT01JVCNMQURMRSNLRUFORQpSQU1TI1RBVFMjU05FRVIjRURHRUQ="},{"title":"05/29/17 ANSWER THE DOORBELL","author":"Sandy Fein","date":"2017-05-29","grid":"I1NJUlMjTUVURSNGTEFXCkJJU09OI09ET1IjTEFDRQpJR0xPTyNQRVJVI0VWRVIKT05FTU9NRU5UUExFQVNFCiMjI1NQQSMjRVRBIyMjIwpCTFQjU0tJRVMjTkVTVFMKWUVXUyNFUkEjQUNUSUlJCldBSVRKVVNUQVNFQ09ORApBU0xFRVAjSU5DI0hVR0UKWUVMUFMjRU5URVIjWEVECiMjIyNTQUQjI05FVCMjIwpJTExCRVJJR0hUVEhFUkUKRE9PUiNPU0xPI0lSQVRFCk9CT0UjU09BUCNOT1ZFTApMRU5EI0VORFMjQVdFUyM="},{"title":"05/30/17 IN PART","author":"Billie Truitt","date":"2017-05-30","grid":"TUFQUyNTUEFUI1NDUkFNCkVSSUUjTFVSRSNRVUVVRQpTSUxMI0lTRUUjVVRVUk4KSEFMRkFDSEFOQ0UjU0FPCiMjI0lOS1kjI0xBVEVTVApQUkVFTiMjU01PS0UjIyMKQU9LI0lEQUhPUyNBU0lBClBJRUNFT0ZPTkVTTUlORApBTFNPI1dSRUFUSCNST0QKIyMjT1JFT1MjI0VWRU5TCkNIQVBFTCMjVEhBSSMjIwpSVU0jU0xJQ0VPRkxJRkUKQVJFU08jVEhBTiNFREFNClRPTkVSI05PU0UjU0VOVApFTkRBVCNPV0VTI1RBR1M="},{"title":"05/31/17 LEND A HAND","author":"Charles Slack","date":"2017-05-31","grid":"UFNUI1RBTkdPI0JPV0VECkhPTyNBTE9PRiNVTklUWQpSVU5JTlRFUkZFUkVOQ0UKQVJJQSMjU0VFUlMjIyMjClNDRU5JQyMjUkFUUkFDRQpFRVIjUEFQQSMjU0VNSVMKIyMjTU9ST0NDTyNNRUFMCiMjUklERVNIT1RHVU4jIwpCUkFEI1NFRVRIRVMjIyMKQUJZU1MjI1NFRU4jQVlFCkRJU1RVUkIjI1JFQU1FUgojIyMjQk9VVFMjI0NPTEEKR1JFQVNFVEhFV0hFRUxTCkVFUklFI1RFUEVFI0JFRQpFWEVSVCNFTlRFUiNBREQ="},{"title":"06/01/17 RIVER CAPITALS","author":"Mark McClain","date":"2017-06-01","grid":"UklUQSNDUklFRCNJTkNICkVESUUjQk9PWkUjTUFMSQpIQVJSSVNCVVJHI1BTQVQKQUhFQVAjRVNBVSNPSE1TCkJPU1RPTiMjI01BUlYjIwojIyNFRElDVFMjU1RJTkcKQk9TUyNUUkVBVFMjTEVPCkFIQSNUUkVOVE9OI0xPQQpDSEkjR09FU0FUI1NFTlQKSElOREkjREVOVURFIyMjCiMjVFVGVCMjI1BJRVJSRQpBUFBTI0FQRUQjT05FQUwKTU9BVCNCQVRPTlJPVUdFCkZMVUUjTElORU4jVVNPQwpNT0xEI0VSQVNFI1RFTlQ="},{"title":"06/02/17 THERE'S MORE INSIDE","author":"Fred Piscop","date":"2017-06-02","grid":"QVVSQVMjVE9XUyNTQUZFCkVMQVRFI0lLRUEjQ0xPRwpTVFJFRVRDUkVEI1JBTkcKT1JFUyNVVEFII01VU1RZClBBU1RJTkEjT0RJTiMjIwojIyMjUkFDUVVFVENMVUIKT1JFT1MjI1VSRVRIQU5FCkxPREkjQ0hBU00jRU5EUwpFVklMRE9FUiMjTVNET1MKR0VUQ1JBQ0tJTkcjIyMjCiMjI0hVTEsjTk9NSU5BTApTQ1JBTSNMRVRTI05PTkUKUExBTiNTRUNSRVRDT0RFClJJTkcjQVJPTyNCVVNFRApZT0tFI1NTTlMjRFJFU1M="},{"title":"06/03/17 SATURDAY STUMPER","author":"Anna Stiga","date":"2017-06-03","grid":"Tk9ISVRTI0FWQVJJQ0UjCkFQT0dFRSNTSURFV0FMTApTVE9MRU4jUFJPRk9STUEKQVNUT1VORCNVTkkjRUVHCiMjI09QRVJBU0lOR0VSUwpBVFQjI1RFTiNTRUFSUyMKU0FSQSNUQURBI1JJR0dTCklUQUxPI01PQiNTVE9MSQpTRURBTiNUUk9EI1NBVUwKI01FUkNJI1JBTlQjTEVPCkNPTU1FTlRBUklBVCMjIwpPREUjTUFSI0RFTU9URUQKUkVEUk9CSU4jUEFOQU1BClBSSU9SSVRZI0VMSVhJUgojTkFORVRURSNSRUNJVEU="},{"title":"06/04/17 AGKNOWLEDGMENTS: Showing subtle team spirit","author":"Mark McClain","date":"2017-06-04","grid":"Q0FESVojSlVER0UjU1BVRCNUQU1FCkFMSUNFI09HUkVTI1RPTkUjQVRPUApMQVNFUiNTTElNRSNBUklBI01PVE8KTUlDUk9DSElQUyMjTUVUUk9QTEVYCiMjIyNHTFVFUyNUSElTIyNSQUxMWQpNSU5JI0VBUiNDT0lOI1BBRCMjIyMKQUdFTkRBIyNTQUxTQSNPUEVOQkFSCk1PQ0tJTkdCSVJEIyNBTUFSSUxMTwpBUksjR0VOT01FI0VMREVSI01PT1MKIyMjRklSTVVQI0VHQUQjI1RCT05FClNQUklUI0FSTElOR1RPTiNBTFBFUwpDUklCUyMjQkVORCNFTkVSR1kjIyMKUk9WRSNTQ09STiNVTlRJRVMjT0xECkFNRVJJQ0FOIyNNQ0NPTkFVR0hFWQpQT1RTREFNI0RBSUxZIyNTUE9OR0UKIyMjI0FSRSNFTExBI0JJTyNET09SCkxBVUdIIyNBU0lTI0RPTk5FIyMjIwpBU1RST0RPTUUjI1RFWEFTQUFORE0KVVNUQSNPRE9SI1NJTkVXI0dSQURFCkRFRVAjTElOVCNVTFRSQSNMRVRBVApFVFJFI0xFR1MjTUVTU1kjRUFTWUE="},{"title":"06/05/17 CLOSE TO HOME","author":"Gail Grabowski","date":"2017-06-05","grid":"V09WRSNXQVNBVCNTUEVXCkFSSUEjQUxPTkUjSEVSRQpMRUVSI1RPUlRFI0hBUkUKVE9XTk1FRVRJTkcjQ09ECiMjIyNPUlMjI0FMVEVSUwpTQUZFVFkjUklHT1IjIyMKT0hBUkUjUkFDRSNBTUlTCkxPQ0FMR09WRVJOTUVOVApEWUVTI09ERVMjT1BUSU4KIyMjRVNTRVMjQVNTRVRTCkdSQURFUyMjT1JFIyMjIwpST0QjQ0lWSUNDRU5URVIKQUdPRyNQQVRDSCNFQVNFClNVUkUjRU5TVUUjQU1QUwpTRUVNI0RFQVJTI1RFTlQ="},{"title":"06/06/17 FUN, FUN, FUN","author":"Sally R. Stein","date":"2017-06-06","grid":"I0xBTUUjU0NPVCNTV0FNClJJVkFMI0FMU08jV0lERQpBTUlHTyNHT0xEI0FGQVIKSEFWSU5HQUdPT0RUSU1FCiMjIyNHVVMjI0xPUyMjIwpISU5UQVQjVFdJRyNWRVQKQURJRVQjU0VBUyNERUxJCldFTExFTlRFUlRBSU5FRApLQUxFI0FVTlQjVFJVQ0UKU0xZI1BVTlkjQ0hFU1RTCiMjI0NBVCMjUEFMIyMjIwpFTkpPWUlOR09ORVNFTEYKTE9VRCNDT09LI1RBQk9PCk1BTkUjQU5ORSNJTkJPWApTSEVEI0xFR1MjQ0VTVCM="},{"title":"06/07/17 ODORLESS","author":"Mark McClain","date":"2017-06-07","grid":"QVBFUyMjSURTI0NBU1RFCldBWFkjRFJBVCNBTE9IQQpBTEFOI09LTEEjU0FGRVIKU0VDT05EU0lHSFQjVFNQCkhPVERPRyMjU0FMVVRFIwojIyMjU0VBVCNaRVJPIyMKUkVQQVkjUklDRSNCVU1QCkFMT1QjU01FTEwjQUNMVQpUS09TI0VTVEEjVU5ISVAKIyNSRUFQI09QVVMjIyMjCiNJVEFMSUMjI1NNSURHRQpQVEEjRkFJUkhFQVJJTkcKUklTRVIjUk9BUiNBSkFSCkVTVEVFI0NBUlMjTk9URQpZSUVMRCNBTVAjI0lOU1Q="},{"title":"06/08/17 HOLD 'EM","author":"Billie Truitt","date":"2017-06-08","grid":"TUFSSyMjU0NPVCNDT1JECkVYVVJCI1RJS0kjQUxPRQpMRVJPSSNQUk9NI01BVEUKQkxBQ0tKQUNLUExBWUVSCkFTTCNJT1RBI0FJUiMjIwojIyNBTkkjI1VOTU9WRUQKU0FJTElOR1NISVAjRVJBCldJREUjI1JPTiMjUFNJUwpBRE8jQU5BTE9HV0FUQ0gKQkFMT05FWSMjQUlMIyMjCiMjI1JBVyNGVVNTI0FBQQpUSElOR1NXSVRISEFORFMKWUlQRSNCQVJUI0VOSk9ZClJFQVIjT05NRSNTTk9SRQpFRERZI1lFQVIjI0FVTlQ="},{"title":"06/09/17 BETWEEN THE SEAS","author":"S.N.","date":"2017-06-09","grid":"TEFDRURVUCMjSEFDS0VSCkVQSURFTUlDI0lOSEFMRQpSRU5VTUJFUiNTVE9QVVAKT1JFQ0FSI1lFUyNDT0RFCklTTSNSQU1QUyNWT1dFTAojI0FDSyNBVFRBQ0gjIyMKSU5UTyNCSU8jR1JPQ0VSClJFSU4jQU5HTEUjTE9HTwpTT0NDRVIjUklEI0lQT0QKIyMjRVZFTkFTI1JDQSMjClNIQU5FI0FQUExFI0NPTApXQVRUI01QSCNBVEhFTkEKQVpBUklBI0lNSVRBVEVECkJFUklORyNDT0xPTklBTApTTElDS1MjI01BTkFDTEU="},{"title":"06/10/17 SATURDAY STUMPER","author":"Frank Longo","date":"2017-06-10","grid":"U0FMRVNURUFNI0hBREFUCk9OQVZFUkFHRSNBRE9SRQpVTlJFVklTRUQjUkFWRUQKUkVEUklWRVIjQVBQRU5ECiMjIyNMRVRTSlVTVFNBWQpTVEVBTFRII1VETyMjIyMKSE9SREUjRUxMRU5QQUdFCkFSSVojU1BBSU4jQUdVQQpIT05FU1RBQkUjQVJSQVMKIyMjI01SSSNMQVNUQUNUCkNVUlRBSU5ST0RTIyMjIwpBU0hBUlAjSU5EVUNJTkcKR1VJTFQjTUFERU1PTkVZCkVSTklFI0FUT05FU0ZPUgpTUEVBUiNTQU5EU1RPTkU="},{"title":"06/11/17 TIME FOR A CHANGE: Ten of them, to be precise","author":"S.N.","date":"2017-06-11","grid":"QUdORVcjR05BVyNTVUdBUiNPS09LClBST1ZFI0VMU0UjVUhVUkEjR09SRQpUSVJFVFJBQ0tTI05BTUVDQUxMRVIKU1RBUldBUlMjVE9SVVMjQ01JTk9SCiMjI1lBUFMjREVWSUwjQk9PTiMjIwpDQVZPUlQjTElORVMjRUxPTkdBVEUKQUxPTkUjTUlORFJFQURJTkcjRFJTClRPVEUjQkFCRSMjI01FTlMjUERBUwpDSEUjSEFJUlJBSVNJTkcjTUFSSUUKSEFDSUVOREEjRlJFVFMjQkVSRVRTCiMjT1BFRFMjUExJTlkjSkVURVMjIwpTUVVBRFMjQlJBU1MjR1VFUk5TRVkKSEFORFMjQ0xPVEhFU0xJTkUjQlJPCkFOVFMjUlVJTiMjI1BVQ0UjQ09PSwpEREUjSk9CU0VDVVJJVFkjRElPREUKRUFSTE9CRVMjT1BFTlMjU05BS0VTCiMjI0VMSVMjQ05PVEUjU0FBQiMjIwpNQ0NBSU4jREFOTlkjVU5TVEFCTEUKT0lMUkVTRVJWRSNQQUNFU0VUVEVSCk1BSU4jT05BSVIjRUxMRSNTVFVOVApTT1BTI05FV0xZI1NQQVIjVEFTVEU="},{"title":"06/12/17 USEFUL TWOSOMES","author":"Gail Grabowski","date":"2017-06-12","grid":"Q09UIyNTUFJFRSNTSE9UClJBR1MjVFJJRVMjTEVOTwpPSElPI0FJU0xFI0VMTVMKQ1VGRkxJTktTI1BJUEVTCiMjI1RBUlRTI0xBRyMjIwpQT1BFUyMjI01JU0hBUFMKT1VSUyNUQVBJTlMjTEVBCktOSVRUSU5HTkVFRExFUwpFQ08jT0JUQUlOI0VPTlMKREVSSURFUyMjI1BBVFNZCiMjI1JBVCNUT1dFTCMjIwpERUNPWSNXQVRFUlNLSVMKSUNPTiNTQU5UQSNUSVJFClNIT0UjVElHRVIjT0RJRQpIT0xEI1NUT1JZIyNTU04="},{"title":"06/13/17 NOT ON OUR SIDE","author":"Billie Truitt","date":"2017-06-13","grid":"TUFTVFMjSUNPTiNMT0NLCkFMTEFUI05PTkUjSVZBTgpTVEFSUiNEQVRBI0RFTU8KQ09NUEVUSVRPUlMjTkVXCiMjIyNFUkEjI1RVQ1NPTgpQT1RBVE8jU1BPSUwjIyMKVVNFRCNPRE9SI05PUlNFClRIRU9QUE9TSU5HVEVBTQpUQU1QQSNNQU1BI0hBTFQKIyMjVFJJRUQjQ1JFUEVTCkZMQVNLUyMjQUhBIyMjIwpJTEwjQU5UQUdPTklTVFMKQkFCRSNUT05FI1NPQVJFCkVNVVMjSVJPTiNPV0xFVApSQU1QI1RFTlQjTUFURVM="},{"title":"06/14/17 REALLY LOUD","author":"Fred Piscop","date":"2017-06-14","grid":"TElNQk8jQlJBU1MjSkFCCk9SSU9OI1JFQ1VUI0FSRQpTQU5EQkxBU1RFUiNDSUEKRU5URVJFRCNTVElOS0VSCiMjIyNFTllBIyNLT0hMUwpVTlNFQVQjUEVTRVRBIyMKTUlOU0sjU1BBVFMjTVJJClBMT1AjRklFUlkjT01FTgpTRVcjUEVUQUwjQ1JFRUQKIyNNT0lORVMjUE9PUkxZCkFDT1JOIyNFREVOIyMjIwpTVUJTRVRTI0FUVEFDSEUKU1JJI1RIVU5ERVJDTEFQCkVTTCNBUk1FRCNPSEFSRQpURUUjUlVTVFkjTEVNTUU="},{"title":"06/15/17 ESSAY TEST","author":"Greg Johnson","date":"2017-06-15","grid":"QUJFTCNIVFRQI0ZBVUxUClNPTlkjQUVSTyNPSEdFRQpTWURORVlBVVNUUkFMSUEKQUxPTkcjI0VUQVMjWUFLCk1FVyNSSU0jRVRBTCMjIwojIyNTRVdBUkRBTEFTS0EKSVNJVFRJTUUjI0VUSElDClNJTkUjTkFJTFMjSU9UQQpJRFRBRyMjTk9XT05ERVIKU0VMTUFBTEFCQU1BIyMjCiMjI1lNQ0EjRVlFI0hFWQpJUksjRUxCQSMjTkFJVkUKU0FMWkJVUkdBVVNUUklBCkVJRUlPI0FVS1MjVkVUUwpFTEVHWSNUQUNPI1NFQVQ="},{"title":"06/16/17 VOWEL PLAY","author":"S.N.","date":"2017-06-16","grid":"QVBCI1VTQUJMRSNZT0dBCkJUVSNIT01JRVIjQVBFUwpDQUxDVUxBVE9SI0xFVFMKIyNMT0hBTiMjI0hJTkRVCkFLSU4jQ0FSQlVSRVRPUgpNSVNDVUUjRU9OUyNPV0UKQVRIT1MjTURYSSNURU5ECiMjI0NBUEFDSVRPUiMjIwpTT1JUI0FOT04jQ1VCRVMKQUNFI09MR0EjQVREVVNLCk5FVVJPTU9UT1IjRVNQWQpUQUJPTyMjI0FSRUFTIyMKQU5FVyNQUk9TRUNVVE9SCkZJTkQjUFVOSVNII09SRQpFQVNZI1NFRVNUTyNQT1A="},{"title":"06/17/17 SATURDAY STUMPER","author":"Matthew Sewell","date":"2017-06-17","grid":"TUFZQkVMQVRFUiNBRERTCkFSRVlPVURPTkUjTEFJVApIRUFEU1RBTkRTI0lSTUEKQU5URSNFTVMjVFVOTkVMCkxBU1NPI1NVQiNTRUlORQojIyNJU1AjUklURSNUT04KQkFOR0xBREVTSCMjQVZFCk9ORU5PVEUjT1JBQ0xFUwpYVEMjI1NUT05FV0FMTFMKU0lUI01ZT0IjRUVMIyMjClBMQU1FI1hFRCNTQUhJQgpSQVJJTkcjTEFUI0JBUkEKSUJJUyNJTUlOSEVBVkVOCk5PTlMjUE9TVEFMWk9ORQpHUkVZI1BPS0VSRkFDRVM="},{"title":"06/18/17 FOR FATHER'S DAY: Featuring phrases in one family","author":"Gail Grabowski","date":"2017-06-18","grid":"Q0xBUkEjSE9TVCNNQUxFUyNUSEFXClJPU0VTI0lHRVIjRUNPTk8jSE9TRQpFVklDVCNQTEVBI0FDVVJBI1JPSUwKUEVBS09GUEVSRkVDVElPTiNPUEFMCkVSR08jUk9EI0ZMVSNFTkRPVyMjIwojU09OSUEjI0RJTUxZIyNTV09PUFMKIyMjI1BVQkxJQ09QSU5JT05QT0xMClNBTUJBI0lPTiMjQVBFUyNTRVBJQQpBV0FSRCNPQkVZUyNFVEEjVU5TRVQKTU9SQVNTI0JSQUNFIyNBUFAjIyMjCkVMS1MjUEFZT05FUFJJQ0UjU1dBUAojIyMjUkFUIyNLTkVFTCNBTFBBQ0EKQUZJUkUjVE9QI1RFVE9OI0FVR0VSCkxJTkVEI0lSQU4jI0FTUCNUUkVTUwpQQUNJRklDT0NFQU5QRVJDSCMjIyMKU1RBVElDIyNFRVJJRSMjSEVBUlMjCiMjI0VORU1ZI0ROQyNTRUEjVEVBUwpDWkFSI1BFT1BMRU9WRVJQUk9GSVQKUk9NQSNPTERJRSNMSVJBI0FNSUdPCkFMT1QjUEVFTFMjQVNJUyNNSU5PUgpCQUtFI1NFTExTI1NBRkUjU0NFTkU="},{"title":"06/19/17 FAMILY STYLE","author":"Sandy Fein","date":"2017-06-19","grid":"VElBUkEjU0xBTSNTSE9UCkdPQkFEI1BJVEEjT09aRQpJV0lTSCNBTU9LI1VQT04KRkFUSEVSVElNRSNMRU5ECiMjIyNSRVNUI01BU1NFUwpQUk9CRVMjI0RFTEkjIyMKU0VNSSNFTU1ZI0lTTEFNClNBTkcjVElCRVQjVEFDTwpUUklCRSNOQVNBI0VDSE8KIyMjUkVBRCMjU1BSRUVTCkNBVk9SVCNTSVRFIyMjIwpTTElUI01PVEhFUkxPREUKUE9TSCNPUkVPI0tBUE9XCkFOVEUjU0VFUCNVTlRJRQpORUFSI1RTUFMjUEVTVFM="},{"title":"06/20/17 THE MAIN THING","author":"Billie Truitt","date":"2017-06-20","grid":"TUVNT1MjU09TTyNTTE9QCkFQQVJUI1dISVAjUE9LRQpSSVNFUiNFQVNFI0xPUkUKU0NIT09MUFJJTkNJUEFMCiMjIyNOSVRFI0FQVCMjIwpTTVVER0UjI0lSQSNEQVMKQ0FOT0UjREFSRSNBVVJBClVOREVSTE9DS0FOREtFWQpCTFVSI0lERVMjRURFTlMKQVlFI0hNTyMjUEFTU1RPCiMjI1NVQiNIRUFSIyMjIwpQU1lDSE9MT0dZTUFKT1IKQUxPRSNCT09SI0lNQUdFClBBV04jQU5URSNTTUlMRQpBQkxFI1JFU1QjU09MRUQ="},{"title":"06/21/17 WORKWEAR","author":"Fred Piscop","date":"2017-06-21","grid":"Q0FQRVIjQklORCNBQ01FCkFHUkVFI09SRU8jUE9PUgpCT09LSkFDS0VUI1BVUlIKIyMjI0VTQyNERUZFTlNFClJFUkFDS0VEIyNBTlRFRApFWEFDVFMjVVBTSURFIyMKU1BJRVMjQ0xFQVIjUkFNClRPTEQjUE9MTFkjQVNJQQpTU1IjVkFMRVQjVFJVU1QKIyNPUEVSQVMjRlVUSUxFCkFQQVJUIyNUSElSU1RFRApNQURJU09OI0FOTiMjIyMKQVNUTyNOT05VTklGT1JNClNUSVIjQ09PTCNQSUxFRApTRUVTI0VORFMjU1RFUFM="},{"title":"06/22/17 SWARM","author":"S.N.","date":"2017-06-22","grid":"I1VWQiNCSUJCI0JJQkkjCkNSRUUjQURFRSNSQUxQSApBQlJBI1JPQU4jQU1BU1MKUEFCU1RCTFVFUklCQk9OCk9OU1RBUiMjI0VOUyMjIwojIyMjQkFBI0JMWSNHV0IKQUJGQUIjQkFMSSNCTEVVCkJZRUJZRUJMQUNLQklSRApCT05FI0NPQlMjRUJCRUQKQUJTI0JPVCNUQkEjIyMjCiMjI0JVTiMjI09OQUJFVApCVVJTVE9ORVNCVUJCTEUKSUNFSVQjQVJBQiNCQVJOCkJMQURFI0NPQUwjQUxPVAojQUxFUyNMT0JFI1NMWSM="},{"title":"06/23/17 FILL-IN WORK","author":"Greg Johnson","date":"2017-06-23","grid":"SU1BQ1MjU0VHQSNSSUNLCkRFTEhJI1RCQVIjQUFBQQpFU1NFTiNZQlNPQU5HUlkKU0hPRUJPWCNIQU5TT0xPCiMjI1JBSCNBT1JUQSMjIwpSVUtJRERJTkcjTUNKT0IKT0hJTyNFUkEjVEFLRU1FCk9VUiNGQVNISU9OI05BRwpUUk9ZRVIjRU5EI0FOTkEKU0FWT1IjSUlDQVBUQUlOCiMjI0dSSU1NI1RPRSMjIwpKQU1BSUNBI05FVElaRU4KT0dJTVNPUlJZI0FUT05FCkxBUkEjTkVORSNUVU5JUwpUUk9UI1NUQVQjT1BFRFM="},{"title":"06/24/17 SATURDAY STUMPER","author":"Brad Wilber","date":"2017-06-24","grid":"QkVCT1BQRVIjUEFXSU5HCkFNQVJJTExPI0lNT0tBWQpCQVNTVFVCQSNMSU5FQVIKS0lBI1NNQVJUUyNEQU5FCkFMTERBWSNTSU5HRSMjIwojIyNPV0VEI01FTFJPU0UKQUNMVSNXRUJCUk9XU0VSCkNMVUJTI0NVUiNQT0xBUgpOT0JMRUdBU0VTI01PTVMKRVlFRVhBTSNTT0JBIyMjCiMjI1NZTFBII01BTk5FUgpMU0FUI0FTSURFUyNBRE8KVEhSRVNII0hPT0tFRFVQCllBTUFIQSNBTk5FUklDRQpSSFlNRUQjVEVFVEVSRUQ="},{"title":"06/25/17 AFTER FIVE: No, not six","author":"Fred Piscop","date":"2017-06-25","grid":"TkVTVCNUQVJQI0JBQkFSI0NBUk9CCkFDSEUjT0JPRSNBTElDRSNPQkFNQQpQT1VORE5PVEUjU1RBUkdFTkVSQUwKQU5UU0lFUiNMRVMjU0VBTFMjRU5ECiMjI1BFUlQjI1VNQSNTTk9VVCMjIwpJTlNFVFMjU0VSRU5BIyNQTE9ZUyMKTUlURVMjU0VDT05EUlVMRSNXQUxUCkhFUkQjUE9SVCMjI0NSRUQjQlJJTwpJQ0kjREFZRk9SRUNBU1QjVE9ERFkKUEVOI09OVVMjSVZBTkEjR1JBUEVTCiMjR0xJVFojU0NFTkUjUk9VVEUjIwpDQUJJTlMjU1BFTkQjVkFUUyNOQ1IKT1JBTkcjVEhJUlRZRUlHSFQjQUxBCk1JTkUjR0xVVCMjI1ZFRVMjRkxBUApCQUpBI09DTE9DS05FV1MjUEVUUkkKI1NPUkVOIyNOSU5FUlMjUFJBWUVECiMjI1RSRVNTI0RFTSMjUEFJUiMjIwpFVEMjTk9PS1MjU09OI0VEQVNORVIKR09MREVOUklOR1MjQUxBUk1GSVJFCkdMVUVTI1RSSVBFI05PU0UjT1RJUwpTTEVFVCNTVFBBVCNBWEVTI1JFTlQ="},{"title":"06/26/17 FINISH FIRST","author":"Sandy Fein","date":"2017-06-26","grid":"U05BUFMjU0lMVCNBV0xTCkhPVkVMI0FNSUQjVklBTApBVE9ORSNKQU1TI0lOVE8KV0lOTkVCQUdPI1lBQ0hUCiMjI0FQT0tFI0JBVEhFUwpMQVdNRU4jI1BVUkVFIyMKSUNJRVIjQURPUk4jU09XClNJTiMjQUNPUk4jI1RJRQpBREQjVFdFRVQjQUdFTlQKIyNPUkVPUyMjQ0xFUktTCk9IV0VMTCNGQVVMVCMjIwpQQVBBTCNXSU5URVJJWkUKRVJBUyNHRU5UI0dFTk9BClJFTk8jT1JFUyNFQVJOUwpBTUVOI1ZFUlkjU0xFRVQ="},{"title":"06/27/17 SOCIAL NETWORK","author":"Billie Truitt","date":"2017-06-27","grid":"U0FSSSNTVEFJUiNIT0dTCkhFRUQjUEFTVEEjRVVSTwpPUkFMI0FMSUFTI0FTQVAKUE9MSVRJQ0FMUEFSVFkjCiMjI0tJTiMjI1NQWSMjIwpCTFVFUyNEREUjSEVBUFMKUkFOVCNGUlVUVEkjUklPCkFVVE9HUkFQSEVEQkFMTApUUkkjUk9QRUlOI09CT0UKU0FMU0EjRVNDI0NPU1RTCiMjI0hJUyMjI0pBTSMjIwojUEhPTkVSRUNFUFRJT04KU09BUiNOT1ZFTCNPS1JBClBPUlQjU01FTEwjV0VFUApBTFBTI0VBUkxZI05BU0E="},{"title":"06/28/17 OUTTA HERE","author":"Charles Slack","date":"2017-06-28","grid":"VEhPUiNHQUJCWSNBRlJPCkxVUkUjVU5JVEUjQ0xPUApDSEVDS0VET1VUI01FU0EKIyMjUklTRVMjI0pFV0VMCiMjVEVOVFMjQkxBU1QjIwpDTE9BS1MjREVFRCNIRVcKQUxPVCMjQ0VBU0UjRVZBClJBS0UjVEFMS1MjSUNFRApBTUEjVklTQVMjI05PTkUKVEFQI0lOS1kjQVNDT1RTCiMjT0JFWVMjQ1JFRVAjIwpCQVdMUyMjRUFURU4jIyMKVVNEQSNKVU1QRURTSElQCkxJRUQjQUZURVIjRVVSTwpCQVJFI0JPU1NZI0RFRVA="},{"title":"06/29/17 STATELY DIGS","author":"Fred Piscop","date":"2017-06-29","grid":"R0FTUCNDQUJTI0FNQVNTCkFSSUEjT1NMTyNMVUNDSQpTQ09XI1ZJQUwjSU5SRUQKSEFVTlRFRE1BTlNJT04jCk9OQSNXWUUjUkVUI1NFVwpHRU5JRSNTSU1JI1NUT1cKIyMjTUFDI0NBTSNNSU5JCiNUT1BLQVBJUEFMQUNFIwpQQUxMI01PRSNOSEwjIyMKVElEWSNBV1JZI0FMQU1PCkFMTCNBUkUjRVNTI1NPUAojQkFMTU9SQUxDQVNUTEUKR09UVVAjTklMRSNPUkFOCkFOSVRBI0FERU4jREFSVApHRU5FUyNQRU5UI0FMU08="},{"title":"06/30/17 KITCHEN SPACE-SAVERS","author":"S.N.","date":"2017-06-30","grid":"QVNDRU5ERUQjQ0FNQVJPClRIRU1BSU5FI09ERUxFVApCT0xPR05BU0FORFdJQ0gKRVdFI1NFQyNMU1UjR1JFClNFUkIjU1RBVCNQQU5FTApUUllPTiNTTklQI1ZJQUwKIyMjQ0lJI0FNQSNJTlRPCiNWSUVOTkFTQVVTQUdFIwpUQUxMI1RTQSNMSVQjIyMKSVRMTCNMSVpBI1RPREFZCktJV0lTI0FJTFMjUk9MRQpJQ0kjQU5OI0xFTiNXS1MKQkFOQU5BU0FORENSRUFNCkFORFJFUyNERUdBVUxMRQpST1NUUkEjU1dFQVJTSU4="},{"title":"07/01/17 SATURDAY STUMPER","author":"Lester Ruff","date":"2017-07-01","grid":"U1RBUlIjTUJBUyNTVEVNClBPTElPI0NPQ0EjVEhBSQpBVVRPRElEQUNUI1JPU0UKU1RBVEVNT1RUTyNBTUVOCiMjIyNVUE4jU1VSUEFTUwpUSEVTUElBTiNUQVBTIyMKR09BVCNTTEFUI1RFTVBUCklUUlkjSEREVkQjRE9URQpGRUxMUyNTQVJBI0lSQU4KIyNXRUVLI0xBWklORVNTClNMQUJUT1AjVElOIyMjIwpUQVJPI0tFVklOSkFNRVMKRVVSTyNPUkFOR0VTT0RBClBSRUsjTUlORyNTSU5HUwpTQU5TI09MRVMjVEFLRVM="},{"title":"07/02/17 TAKE FIVE: Getting them all in","author":"S.N.","date":"2017-07-02","grid":"UkVFRlMjRklETyNMT1VTRSNPRE9SCkVYQUxUI0FSSUQjQU5USUMjSE9QRQpCSVZPVUFDS0VEI1NFQUJPUkdJVU0KU1RFQURJRVMjTUlDQUgjVE9PVFNZCiMjI1RFTlQjTEVHQUwjU09VUyMjIwpBU0NFTlQjUEFORUwjU09VVEhQQVcKQ0hBUlQjUE9SVFJBSVRVUkUjUkNBCklPVVMjTUVSViMjI1BJTlMjR0VUUwpET0wjTVVTVEFDSElPRUQjTElDSVQKU0tJTUFTS1MjUkFORFMjTU9KQVZFCiMjRk9MRVkjREVHQVMjQUVJT1UjIwpJTUxBVEUjU1VEQU4jT1BFUkVUVEEKU0NPVFMjU1VCT1JESU5BVEUjSU9DCkJNV1MjU0VDWSMjI0xFU1MjTk9BSApVTEUjSU5UUkFWRU5PVVMjU0VOU0UKVFZSRU1PVEUjQUxPT1AjQkxBU1RTCiMjI0FTV0UjQUxMT0sjRFJPUCMjIwpBU0hSQU0jQUxJRU4jRlJJVFRBVEEKQk9VTkRBUklFUyNEVU9ERUNJTUFMCkNBR0UjU0VSVkUjQU1PUiNBRE9SRQpTUEVEI1NBU0VTI1lBTEUjUkVTVFM="},{"title":"07/03/17 SUPPORTING TRIO","author":"Gail Grabowski","date":"2017-07-03","grid":"U1BBUyNTVEFMRSNSQUlECkFSQ0gjTEVNT04jRUxTRQpTSVRFI0FOSVNFI0NPTEEKRU1JTFlQT1NUI0hPVEVMCiMjI1RFQVJTI0RJTSMjIwpCQVNFU1QjI0xJUEJBTE0KT1ZFUiMjQ0xBU1AjTUFJCk5FV1NQQVBFUkNPTFVNTgpFUkUjU1RBSUQjI0lTRUUKU1RSRUFNUyMjQkFMRVJTCiMjI0VMUyNEQUlTWSMjIwpBTEFSTSNOT1JUSFBPTEUKU0VNSSNMRUdJVCNBUkVBClRBTUUjUE9JU0UjREVBUgpPRE9SI1NORUVSI1NPTlM="},{"title":"07/04/17 FAIR PLAY","author":"Sally R. Stein","date":"2017-07-04","grid":"IyNHQVAjVkNSUyNCVVMjClBBUkVFI09SRU8jT1BUIwpBQ09STiNOQUlMI1dIQVQKU0hPT1RJTkdHQUxMRVJZClRFTSNBQ0UjTkNPI0FMUApFU1MjR0lHI1NFVCNWSUUKIyMjQk9OVVMjIyNQQVRTCiMjUklOR1RIRUJFTEwjIwpBUEVEIyMjRU5FTVkjIyMKRE9DI0FTUyNUTEMjUE9QCkFQUiNCQVQjSE9FI0lPVQpHVUVTU1lPVVJXRUlHSFQKRUxBTCNTUENBI0lTTEVUCiNBVEUjTlVMTCNORUVEWQojUkVEI09QQUwjR0VUIyM="},{"title":"07/05/17 GET A RAISE","author":"Carolyn Stewart","date":"2017-07-05","grid":"U0xBVyMjQ0FQUyNCQUNIClBPTE9TI0FMRUMjQU5ORQpJR0xPTyNUT05FI0xZTlgKUk9PRkFOVEVOTkFTIyMjCkVOVCNQQUwjI1RIQVRJUwojIyNPQlNFU1MjQU1BTkEKQVNUUk9TI0hVVCMjQ0FMCkJBUkVYQU1JTkFUSU9OUwpBTEkjI1VSTiNSRURTRUEKQ09CUkEjU0VSSUVTIyMjCktORUVMUyMjQUZUI0ZEQQojIyNGTEFHT0ZGSUNFUlMKQkVBVSNMT1NUI01BVEVTCkFSVFMjQUJMRSNFUkFTRQpOQU1FI0RJT1IjI1BTU1Q="},{"title":"07/06/17 SOUND STARTERS","author":"Billie Truitt","date":"2017-07-06","grid":"RkFDRSNOT0RTI0JSQURZCk9NQU4jT1JBTCNSQVRJTwpSSU5HI01FTlUjQU1PTkcKQU5EUkVBR0FTU0kjTUVBCllPWU9NQSMjSElMTCMjIwojIyNTSU1CQSNHTEFOQ0UKQkxBU1QjT05USEVCQUxMCkVBVCMjSU5HT1QjI1NJTQpFTlRSRU5PVVMjQ0xBUFMKVEVOQU5UI1NIQUxFIyMjCiMjI0VDUlUjI05PVElDRQpTUFkjSE9OT1JTWVNURU0KS09BTEEjQ0xBVyNTQUFCCklSV0lOI0xBQ0UjRUxTRQpURU5FVCNFVkVSI0VZRUQ="},{"title":"07/07/17 ON UMPIRING","author":"S.N.","date":"2017-07-07","grid":"QU1JRCNTQ1JVQiNOSVRTClNFUkEjSEFJUlkjRUNSVQpTVEFORElOR0JFVFdFRU4KVEFRVUVSSUFTI0VBU0VTCiMjI0JFRVQjI1BFRyMjIwpET1pFIyMjVFdPU0VWRU4KQVhFI0NBUldBU0gjRVZFCkZJQiNBVEVJTlRPI05FQQpGRFIjTE9OR0VTVCNUTlQKWUVBUk9MRFMjIyNXSVRICiMjI1VSTCMjQUNBSSMjIwpCQU1CSSNBRVJMSU5HVVMKT05FSUNFQ1JFQU1DT05FCkRPTkUjRUxJQVMjRVRURQpFTkRTI0dVRVNTI1NIT1A="},{"title":"07/08/17 SATURDAY STUMPER","author":"Frank Longo","date":"2017-07-08","grid":"U0NPT1QjU0FGRSNTQ1VECkNISU5PI0VWSUwjUE9NRQpIQUxFWSNDT0dTI0NPQkIKTUlMREVXI1dISVRBS0VSCklURSNEQUwjVEVFI1RSSQpERUFSI0hJS0UjQ05PVEUKVEFLRU9XTkVSU0hJUE9GCiMjI1NQQUNFSlVOSyMjIwpURUxFUEhPTkVCT09USFMKQUxJVE8jTEVUUyNORU9OCkdMTyNTQU4jU0VFI1JURQpUSU5TRUxMWSNBQlJBREUKRVBFRSNDT09MI0JBQkFSCkFTU1QjT0dSRSNFVklURQpNRVNII0FTS1MjREVURVI="},{"title":"07/09/17 MONEY MATTERS: To spend some time with","author":"Gail Grabowski","date":"2017-07-09","grid":"U1RBVFMjRkFDRVMjQ1BBUyNBQ0VECkxBVEhFI09IQVJFI1pJTkMjTE9SRQpFWFRSQUNSRURJVCNBU1RPI09ERVMKRElOTyNUQU1FU1QjUkFJTkNIRUNLCiMjI0JPUkcjVEFMQyMjI0NPQVNUIwpBVEYjQ0xFRiMjRU5EVVNFUiMjIyMKTE9VU0UjUklWRVJCQU5LI05PVFNPClZFU1BBI1NMSU0jQ0lURSNFTUFJTApBU1NFTlQjQUdFUyNTSVAjQVNLRUQKIyNCRVNFVCNJTktTI0VUQVMjRU5FClNDVUQjQ09BTERFUE9TSVQjU0NBTgpDVUQjQVNQUyNTRUFSI0NPTkNIIyMKT1JHQU4jS0lBI1RSSU8jTU9SQVlTCkxJRVRPI05BQlMjVE9VUiNORVJWRQpERVRFUiNPTkJBTEFOQ0UjQVdHRUUKIyMjI0FSVFNBTEUjI0hBUk0jRVNQCiNMQVRLRSMjI1RBUEEjU1VFVCMjIwpKQU1FU0JPTkQjUEFSSVNII0lSSVMKVU1QUyNFQkFZI1NVTU1FUlNUT0NLCk1FTFQjTE9QRSNBTE9FUyNBTExPWQpQUkVTI1NFRUQjVEFSVFMjVEVFTlk="},{"title":"07/10/17 WHERE'S HOMER","author":"Gail Grabowski","date":"2017-07-10","grid":"QU5HU1QjVEVBUiNOSVRFClRPUlRFI0FYTEUjQVJBQgpUUklBTCNCRUVUI0dBTEEKU0lOR0xFT0NDVVBBTkNZCiMjIyNTTk8jI1JBVCMjIwpTQUxTQVMjVEVOVCNIRVkKQVZBSUwjUEVTVCMjRVZFCkRPVUJMRUVYUE9TVVJFUwpMSUQjI1hSQVkjQVNPTkUKWURTI0FUTVMjQkxBU1RTCiMjI0FJUiMjUElFIyMjIwpUUklQTEVXT1JEU0NPUkUKQVVSQSNNQVhJI01PV0VSClJFQVIjRVZFTiNBUkVOQQpQU1NUI1NFTlQjTkVTVFM="},{"title":"07/11/17 FEATHERY SIMILES","author":"Billie Truitt","date":"2017-07-11","grid":"QkxUUyNQVVNII1BBU1RBClJPVVQjQUNIRSNVVFVSTgpPR0xFI1NMVVIjQkVSRVQKV0lTRUFTQU5PV0wjRkVFClNDQVJDRSMjTkFJTCMjIwojIyMjVFJJTyNTQ0FOVFkKQVBQTEUjRlJFVCNOQ0FBClBST1VEQVNBUEVBQ09DSwpQT09MI05PVEkjUkVTVFMKU1BSVU5HI0VDSE8jIyMjCiMjI1NJTEwjI0FNSUdPUwpPRlQjTUVFS0FTQURPVkUKUExBTkIjVEVOVCNJVEVNClRJREFMI0dFTkUjT01OSQpTVEFHRSNPUEVOI01FU1M="},{"title":"07/12/17 CHOICE WORDS","author":"Fred Piscop","date":"2017-07-12","grid":"U0FMVCNSQU1QI0ZMQVNICk9ISU8jRUxJQSNSVU5UTwpXQVRUI0xBU1QjQUNUVVAKI0JFRUZPUkNISUNLRU4jCiMjIyNSQU0jI05BWSMjIwpNQURSSUQjQkFUUyNTUEEKRU1BSUwjU09VUiNUSE9VCkRPVUJMRU9STk9USElORwpBUkJTI0xJTlQjSEVOQ0UKTEVTI1BJTEUjVkVORUVSCiMjI0NBVCMjUFVUIyMjIwojU09PTkVST1JMQVRFUiMKV0hBUkYjT1BFQyNJUkFOClBPS0VSI01FR0EjRklWRQpNRVNTWSNBTk9OI0ZFRUQ="},{"title":"07/13/17 HIT THE BRICKS","author":"Carolyn Stewart","date":"2017-07-13","grid":"TUlTQyNQUklTTSNQVEFTCkFDSEUjRUVSSUUjSEFURQpHT09EQVNHT0xEI0lQT0QKSU5ERUJUI05PRCNMSU5FCiMjIyNMRUkjI0xPQU5FUgpSVUJCRVJDRU1FTlQjIyMKRVNBVSNTSVRFI0tFRU5FClNFTExTI0NBUiNQTEFDRQpUUklMTCNMSUxPI0lSQU4KIyMjTU9ERUxJTkdDTEFZCk9UVEFXQSMjTkVPIyMjIwpSRUFSI0lORSNBU1RSQVkKQkFMSyNTQVlTQ0hFRVNFCklTRUUjRVJST1IjTkFJTApURVNUI1NDRU5FI1NMQVA="},{"title":"07/14/17 FACE-CARD TRIOS","author":"Mark McClain","date":"2017-07-14","grid":"U1RVI0RSQUZUI1NFT1VMCkNPTiNST0RFTyNLQVVBSQpST0NLRVRKU1FVSVJSRUwKSURMRSMjI1NVQ0gjIyMjClBMQVlFUlMjRUxBU1RJQwpURUQjWE9VVCNBVFRJQ0EKIyMjTElMSUVTIyNBTUVOCiNRVUlURVRIRUpPS0VSIwpDVVJCIyNTRU5BVEUjIyMKTUlTRVJTI0VESVQjU1NFCkFaQUxFQVMjU0xPU0hFRAojIyMjVFJFUyMjI01BUlMKVE9PUVVJQ0tUT0pVREdFCk5PV09OI1RJQVJBI0VFTApUSEVNRSNTTkVFUiNTSVM="},{"title":"07/15/17 SATURDAY STUMPER","author":"Dan Addams IV","date":"2017-07-15","grid":"VEFQI01FU0gjI05PU0lSClNSSVJBQ0hBI0JSQUlTRQpUUlVFVEhBVCNSQUZURUQKUklTRVRPRkFNRSNTVUVECkFWSUQjI1RSRUFEI0FZRQpQQUlTQU4jSU5LWSNUT0UKU0xJVEhFUiNEQU5TRVVSCiMjI09OVE8jRUxBTiMjIwpDQUxQT0xZI0RFTU9DRFMKQVJFI0xFQVIjR09CTEVUCk1DQSNEQUxFUyMjQk9OTwpBTFBTI1NFTklPUklUSVMKUkFET01FI0VOREFTSEVTCk9NQUhBUyNXQUlUSEVSRQpTUFlPTiMjU0lORSNEU0w="},{"title":"07/16/17 NURSERY NEWS: Page One headlines","author":"Greg Johnson","date":"2017-07-16","grid":"TEFJQyNDT0dTI0FSTVBJVCNJSE9QCkFHUkEjUEhBVCNPVkVSRE8jVE9HTwpCQUFCQUFCTEFDS1NIRUVQI1NPTEQKT1BUSU4jT0FUSCMjIyNTVFJPS0VTClJFRU5UUlkjI0FORFJFI0VFTiMjIwojIyNTRUEjVEhSRUVCTElORE1JQ0UKUFRBIyNDQVJFI1NOSUZGI0RFTU9TCkhVTVBUWURVTVBUWSMjVFZZI1BCUwpJTkZSQSNNRVNBIyNUQUhPRSNFUkEKTEFNQVJSIyMjVU5NT1ZFRCNDTEFZCiMjI1dFRVdJTExJRVdJTktJRSMjIwpTQ0FOI0NPUExBTkQjIyNBTExGT1IKQUxJI1NVTUFDIyNJU05UI1NFUlRBCk5FTyNPUkIjI1JPQ0tBQllFQkFCWQpBRkxBQyNBRElFVSNFU0FVIyNVU1MKQVRJU0tFVEFUQVNLRVQjTURTIyMjCiMjI0NFTCNERUxUQSMjQkFSVEFCUwpMT1ZFVEFQIyMjI1lFQVIjQVBQTEUKT1BFTiNQRUFTRVBPUlJJREdFSE9UClJBSUQjU1RSSURFI1JJTkQjVElLSQpFTExTI0VBVFNVUCNTQVlTI0VERU4="},{"title":"07/17/17 FAKE ADVERBS","author":"Gail Grabowski","date":"2017-07-17","grid":"TUVTQSNBQ0VTI0lOVE9XCk9QQUwjVEhBVyNTRUlORQpNSVNTI0RPUkEjV0lOQ0UKU0NIT0xBUkxZI0VHR0VECiMjIyNFV0VTI05BSCMjIwpHQVJERU4jI0dBUkJBR0UKQVNBSVIjU0xBUCNPUk9OClNLSVMjU1BFV1MjUklPVApQRVNPI1RFQUsjQkxBU0UKU1dFUlZFRCMjR0VZU0VSCiMjI0RFVyNOQ0FBIyMjIwpBTUJFUiNMRUlTVVJFTFkKTkVBUlMjT0FUSCNBUkVBClRBQkxFI0FURUUjUElOSwpTVEFZUyNOT0RTI1NFVFM="},{"title":"07/18/17 HOW ARE YOU?","author":"Billie Truitt","date":"2017-07-18","grid":"REVOVCNTVFBBVCNTT0ZBCkVSSUUjTE9PU0UjRVZFUgpMSU5FI0lERUFTI1JFRUsKSUNBTlRDT01QTEFJTiMjCiMjI0lWRSMjI0FXRSMjIwpGRVVEUyNCQUQjQVNTRVQKQUxTTyNOT0xVQ0sjQUxBCkNPVUxETlRCRUJFVFRFUgpFUEEjUkVDVVRTI1JVTlQKREVMVEEjSE1PI1BBUEFTCiMjI0hJTSMjI0xBRCMjIwojI0ZJTkVIT1dBUkVZT1UKUEFJUiNUQVhJUyNPT1BTCk9ERFMjRVZFTlQjRlJFRQpUT09UI1NFTkRTI0ZFTlM="},{"title":"07/19/17 CALENDAR COUNT","author":"S.N.","date":"2017-07-19","grid":"I1BST0QjWkFQUyNFT04jCkFMT05FI0VQRUUjRFVPIwpKVUxZTklORVRFRU5USCMKQU1FWCNOSVgjI1dBU0kjClJFWCNPRlQjR0VFI0lUQQojIyNUV09IVU5EUkVEVEgKI1BFT04jI05BRyNURUVTCiNSQU4jVE9JVFkjSE9SIwpQT1NUI09DVCMjUkVGUyMKREFZT0ZUSEVZRUFSIyMjClRDTSNJU08jT0FUI1BBVwojVE9BRCMjRlVSI1dFUkUKI0lOTk9OTEVBUFlFQVJTCiNWRVQjUEVFTCNFUENPVAojRVlFI1JPTEwjU1RFVyM="},{"title":"07/20/17 GOT MILK","author":"Carolyn Stewart","date":"2017-07-20","grid":"R1JBTSNIQVNPTiNCRVNUCkxBVkEjQUxPTkUjQVVUTwpJR0VSI1NBTUJBI0JSQUQKQlVDS0VUU0VBVCNZT1lPCiMjI0VWRSNISUhPUyMjIwpBT1JUQSNQT0wjVklTVEEKR0xBU1NKQVcjUkVUVVJOCkFERCNJT04jQ0FSI05BRwpURUFQT1QjSlVHQkFORFMKRU5ST04jUFVQI0FTWUVUCiMjI1RTQVJTI1NLSSMjIwpISUZJI0JPVFRMRU5FQ0sKT1JFTyNFTk5VSSNJVkFOCk5PVU4jQVRPTkUjTklMRQpFTkRTI01PV0VSI0VMTEU="},{"title":"07/21/17 SIX-PACK ABS","author":"Mark McClain","date":"2017-07-21","grid":"U0FDSyNFUFNPTSNBTVBTCkNMQU4jQ1JBTkUjV0FMTApSSUNFI0NBUEVSI0xVQVUKVVRURVJMWSNNSVNTSU5HCkJPSVNFI1NPT1RIIyMjIwojIyMjU0lUQVIjUlVTVFMKRElETlRWT1RFI0lTTEVUClVORUFTWSMjI0FOR09SQQpTVFJVVCNTTkVBS0FXQVkKVE9OVE8jVFVMU0EjIyMjCiMjIyNQUlVORSNHUkFQRQpTT0FLU1VQI0NMRUFSRUQKSU1JTiNNT0xUTyNORVNTCk1JUk8jQlJFRUQjT05DRQpTVFlYI0FTSURFI05BSUw="},{"title":"07/22/17 SATURDAY STUMPER","author":"Lester Ruff","date":"2017-07-22","grid":"QVNQSVJBVEVTI0NCU1RWClNQQURFV09SSyNBUlVCQQpDQU5BREFEUlkjTEFNSVQKRVJBI1BSTyNTUFkjQUxJClRFQ0hJRSNRVUlYT1RJQwpJTUVBTiNUVVJLI1VSU0EKQ0VBU0UjUklGRSNSQUlOCiMjIyNTTElWRVJTIyMjIwpUU0tTI0VWRVIjQUNDVFMKSEVMUCNBSVJTI1dIT09QCkVRVUFMUEFZI1NISU5UTwpCVVQjT1RCI1dITyNDQU4KT09aRUQjVU5IQVJORVNTClNJRVZFI0ZFRUxTVVBUTwpTQVNFUyNGQU5MRVRURVI="},{"title":"07/23/17 COUNTRY CLUB: With something in common","author":"Fred Piscop","date":"2017-07-23","grid":"V09SU1QjUFJFUCNTQUxUI1JBVEVECk9NQUhBI0FVUkEjQUxPRSNJUkFURQpLQVpBS0hTVEFOI0xVWEVNQk9VUkcKI1JFSEVBVCMjI0FETSMjQUJVU0UjCiMjIyNUUkFZI0NMQVNTI05PUyMjIwpMRUFLRUQjRVNTRU4jT05FTkVTUyMKRUxGSU4jVkFUSUNBTkNJVFkjV0FTCk1JR1MjQUlSRSMjI09JTFMjUklURQpNT0hTI1NBTk1BUklOTyMjT1VUSUUKRVRBI1RJTlMjU0FERSNDSVRJWkVOCiMjTk9SQUQjU1BJTFQjQUxJTkUjIwpDTElQT05TI1dJU0UjSVNJUyNSRVYKSEFTVFkjI01BQ0VET05JQSNFTExFCkFSVFMjU0NBTSMjI01FTkQjUkFJRApUVkEjQlVSS0lOQUZBU08jR0lOWkEKI0FOVE9OSU8jT1BFTlMjTU9OREFZCiMjI0hVVCNTRVZFTiNFV0FOIyMjIwojQ0hPUkUjI1JFRCMjI0VMREVTVCMKQVpFUkJBSUpBTiNMQU5ETE9DS0VECkhBUlBPI1JPU0EjQUdPRyNMT0lSRQpBUkRFTiNBWUVTI0dFTkUjQU5OSUU="},{"title":"07/24/17 DRIVE TIME","author":"Sandy Fein","date":"2017-07-24","grid":"Q1BPUyNTQ0FMRSNBQ0VEClJBUFQjRUxMSVMjUkFURQpPUkVPI1RBTEVTI0NSQU0KQ0FSTkFUSU9OI1BBQkxPCiMjI0VORU1ZI0pVRE8jIwpWQUNBVEUjI1BBUkVOUyMKQURBR0UjQ1JJTUUjQVRFClRJUkUjQ09JTlMjU1RFTQpTT0QjQ0FOT0UjU1RFQU0KI1NJVFVQUyMjSEFSRExZCiMjT0FUUyNTVEFLRSMjIwpQT0xMUyNDQVJQRU5URVIKU0hPTyNQQVlVUCNHT1JFClNJR04jVFJBQ0UjVFJJUApUT1lTI0FTSEVOI0hPRVM="},{"title":"07/25/17 THINK AGAIN","author":"Sally R. Stein","date":"2017-07-25","grid":"Q0xPRFMjU0xFRCNBTEVTClBVUElMI0NFREUjQkVSVApBUkVOQSNPVkFMI1NBTkUKU0VDT05EVElNRSNFUklFCiMjI1NUVSMjU1RVTk5FRApCQVIjU0VFUCNFU1QjIyMKQUxBUyNUQUlMI0VFUklFCkJBQ0tUT1NRVUFSRU9ORQpFSUVJTyNZVUxFI1NPSUwKIyMjUlVUI0VMU0UjTVRTCkVNUEVST1IjI09DVCMjIwpMQU9TI01PUkVQTEVBU0UKRVhQTyNBREFNI0FTU0VUCk5FRVIjVEVTVCNJTElBRApBU1NUI09PSFMjUkFGVFM="},{"title":"07/26/17 TROOP GROUP","author":"Charles Slack","date":"2017-07-26","grid":"RElBTFMjUFNJI1JFVElFCklNQlVFI0FOVCNFVklDVApTUEFTTSNORUNLTEFDRVMKUFVTSElOR0FIRUFEIyMjCkVSRSMjQVNLI0VZRUxFVApMRURHRVMjI0xQUyNBVkUKIyMjTkVBUlRPIyNBUkVBCiMjRkFMTElOR0JBQ0sjIwpXQUlUIyNTVE9PR0UjIyMKQUxMI1NTRSMjUkVTVUxUClNBTVVFTCNJUE8jI1RPRQojIyNTVEFORElOR0RPV04KRUlHSFRCQUxMI1JPUEVTCktORUVMI1NFRSNBTklTRQpHRUVTRSNBRFMjTUVBVFM="},{"title":"07/27/17 SHADES OF MEANING","author":"Fred Piscop","date":"2017-07-27","grid":"UEFTVEEjQkFOVFUjQUJDCk9DVEFMI0FWSUFOI1FVTwpQVVJQTEVIRUFSVCNVUkwKSVRBU0NBIyMjI0lNQUdFCk5FVyNBUkYjU1BFQVIjIwojIyMjUExVTVBVRERJTkcKU0xFRFMjVElFUiNSQUlOCkhJTE8jT1VURVIjQU5OQQpVU0VSI0RSRUQjQVNTRVQKTEFWRU5ERVJPSUwjIyMjCiMjQU1BU1MjU0FMI0NVUgpQRVRJVCMjIyNHRU1JTkkKQUxJI0lORElHT0dJUkxTCklNTyNWSU9MQSNFRVJJRQpET04jRVhDRUwjU05JVFM="},{"title":"07/28/17 IT'S A DATE","author":"S.N.","date":"2017-07-28","grid":"I1RTT1MjSElQI0dFVEdPCkNIRUNLI09SRSNVTklPTgpBSU1ISUdIRVIjU1RBR0UKVFJJTyNSVU4jVEhFUk9OCk9EUyNUSU1FU0hFUkFMRAojSE9HQU4jI09FUiMjIyMKQkFMRUQjRVJBUyNPUkJTCkFOSU1BTFNVUEVSSEVSTwpBRERTI0lUUlkjVU5USUwKIyMjI0FHRSMjU05PUlQjCkNIQUlNSEVSWk9HI09UQwpIRVhOVVQjQU9MI0FDTFUKRUxJQVMjSU1XSVRISEVSCkFMT05FI0ZCSSNBTUlTUwpUT01FUyNDT0UjU0VDVCM="},{"title":"07/29/17 SATURDAY STUMPER","author":"Lars G. Doubleday","date":"2017-07-29","grid":"QVNQRU5TI0FRVUFDQURFCkVUSEFORSNUVVJCT1RBWApST09URUQjRklMRU5BTUUKSU9OUyNHQUlOUyNDUk9DCkFQRSNQRURSTyNTSElOIwpMRUNBUiNJU0FBQyMjIyMKSURBUkVOT1QjQVJBTUlTClNUUklQRVMjT1JFR0FOTwpUT0RETEUjU1VQRVJTUFkKIyMjI0FERVBUI05BVEFMCiNCRVJOI0NFREVTI0VUQQpIQUxPI1BITE9YI0dSSVQKVEhBTktZT1UjVEVBU0VUCk1BTkRPTElOI1JFWk9ORQpMSURPREVDSyNBR0VOVFM="},{"title":"07/30/17 TRASH TALK: In the ballpark","author":"S.N.","date":"2017-07-30","grid":"I0RFTVVSIyNUQU1QQSNORVZBREFOCkNBU0lOTyNNQVJJQUgjSVJPTk9SRQpBWlRFQ1MjUExBU1RJQ0JPVFRMRVMKUEVBTlVUU0hFTExTI09MREUjRVNTCiMjIyNURVQjI1NBWSNMRUVEUyMjIwpUQVBTI1JJUExFWSNET1QjI0FUTVMKRVNBVSMjR09ZQSNST04jTUlOSU9OCkVTUE4jRU1NRSNQSUcjUEFOI0NQQQpORUVEQVNBUCNSQU5TSE9SVCNLRUcKU1RSSUNUIyNCQVJLRUVQI09CRVlTCiMjUEFSI0ZPT0RUUkFZUyNUQVQjIwpHQUxMTyNBTlRJV0FSIyNEQVlTUEEKRVJBI0JBU0VDT0FUI0FEVUxBVEVEClRPVCNBR1QjSEFZI0ZMRUUjUlVFRApVU0VEVE8jTEVEI0lBTUIjI0VCUk8KUEVTTyMjT0FTI0VSUkFUQSNBU1NOCiMjI0NQTFVTI0FMRSMjT1VUIyMjIwpTSEUjUk9URSNQT1BDT1JOQk9YRVMKSE9URE9HV1JBUFBFUlMjVE9MRURPCk9MRFVWQUkjUExFQVRTI0VORVJHWQpERVNDRU5UI0JFU1RTIyNNRVNTWSM="},{"title":"07/31/17 FUN AT THE SHORE","author":"Sandy Fein","date":"2017-07-31","grid":"TEFORCNSQUJCSSNTV0FNCklDRVIjRUxMRU4jVEFMRQpQTEVBI0RJQU5BI0FUSVQKU1VSRkJPQVJEI1NURVZFCiMjI1RFTlNFI1NPVVJFRApVUFNJREUjI1JFTkVXIyMKQ0xBTlMjRElFVCMjSUdPCkxPTkcjSEFORFMjU05PVwpBREQjI0lSS1MjTEVHQUwKIyNCUklORSMjUk9BU1RTCkZMVUVOVCNFUkVDVCMjIwpMQUNFUyNCRUFDSEJBTEwKQVNLUyNNQVJHRSNFUklFCklTRUUjUFJJRUQjTElFUwpST1RTI0dFRVNFI1RBTlM="},{"title":"08/01/17 HEAT WAVE","author":"Billie Truitt","date":"2017-08-01","grid":"QUJBVEUjSURMRSNTQVNTClRFWEFOI0NPSUwjTUlMRQpNQUxUQSNJREVBI09NSVQKU1RFQU1JTkdVUCNLRVBUCiMjIyNFREdFI1NBSURTTwpSQU1CTEUjI0ZFUk4jIyMKT1JFTyNTUEFSI0VHUkVUCkJBU0lTI0lETyNBR0lMRQpUQkFMTCNUT0dPI1VQSU4KIyMjSU9UQSMjSE9ORVNUCkNSSU5HRSNPQUhVIyMjIwpIQU5HI0ZMQU1JTkdPVVQKQURBTSNMSVNBI0NVUlNFCk5JTkEjT05FUyNFU1NFUwpUT0VEI05FU1MjU0hPUlQ="},{"title":"08/02/17 NOTHING IS EASY","author":"Fred Piscop","date":"2017-08-02","grid":"QUlMUyNBRVROQSNBRlJPCklERUEjQ0xFQVIjRFJJUApESUZGSUNVTFRDSE9JQ0UKRU5URVJFRCNTSE9SVEVECkRBWSNPREUjIyNNRVQjIwojIyNPTkUjTU9MRSNBTUkKU1RBUiMjUlVQRUUjVElOClRPVUdITlVUVE9DUkFDSwpBUlQjQVJJRVMjI1VTRVMKQklPI1NBTlMjQkJTIyMjCiMjUEJTIyMjSVJFI1BBUgpUUkFJTEVEI05JQUdBUkEKSEFSREVBUk5FRE1PTkVZCkVUVEUjU05PUkUjRElOTwpNRVNTI1RPUlRTI1NDQU4="},{"title":"08/03/17 CAMPY CRIES","author":"Clive Probert","date":"2017-08-03","grid":"TElNQSNNQVJFI1NUUkFECkVUQUwjSUJFWCNUT0VSUgpPU0xPI1NTR1QjUFJBVEUKUE9XRVJIT1VTRSNFTElTCkFWQSNFQVJMI0xZUklDUwpSRVJBTiNCQU1CT09aTEUKRFJFQURTI1JPT0sjRUVSCiMjI1NFQ1QjT1dPVyMjIwpBTUMjUkFSRSNTSEVSUEEKQk9PTUVSQU5HI0FUT0xMCkFSTUFEQSNTSUFNI1NBQwpTQU1TI0JBTkdMQURFU0gKSVZJRVMjU0FHTyNFVFRFCk5JVFJPI0FSTE8jU1RFTQpHQVNTWSNQRUVQI0NBUlk="},{"title":"08/04/17 CROSS-COUNTRY","author":"S.N.","date":"2017-08-04","grid":"I1NDQUxQIyNTVEFSRVMjClNDQUxBUiNNQVJDRUFVIwpQRUxPU0kjSUdVRVNTU08KVU5JVEVTI0RFRSNFVFRVClJFRiNST0FEUyNPQ0VBTgpUUk9UI05JTCNDSVRSSUMKU1lSSUEjU0VPVUwjTk5FCiMjTkVERkxBTkRFUlMjIwpDU0kjREVFTVMjRFVFVFMKTEVBUElOI0VFUiNCQVJFCklOQ0FOI0FSVElFI0JBTgpNT09SI1dXSSNQQVRPSVMKQlJBSU5JQUMjRVRIQU5FCiNBU1RPUklBI05FQVJFRAojU1RZTEVUIyNTTklERSM="},{"title":"08/05/17 SATURDAY STUMPER","author":"Brad Wilber","date":"2017-08-05","grid":"RUZGSUNBQ1kjQVRFQVNFClNMSURBQkxFI1RIRVpBWApDT0xPTklFUyNURU5BTlQKQVRNUyNEQUlMRVkjTEVPClBJTiNTRU5USU4jQkVMTApJTE9TVCNTSUxUI0xBWVMKU0xJQ0VEI1NMSUdPIyMjClRBUkhFRUwjRVZFTkJFVAojIyNFRFNFTCNFTkRFQVIKU0xJTSNVVEFII1RFVFJBCkhBTkEjRU1CRURTI0FMUApBQ1QjU1RFUk5PI1NXT1AKTVVVTVVVI0FCVURIQUJJClVOSUNFRCNUSUxFQVZFUwpTQVRJUkUjU1RBSURFU1Q="},{"title":"08/06/17 CALLING LEO: Explained at 114 Across","author":"Mark McClain","date":"2017-08-06","grid":"QU9SVEEjRU5TVUUjU1VSRiNVU01DClNISUFTI0dPTk5BI0VQRUUjTkFJUgpXQUxLSU5HVE9VUiNERUxBI0ZVTUUKQVJMRU5FI0lCTSNTQU5FUiNVTklUCk5BU0EjQVBQUyNQRU5OQU5UUkFDRQojIyNCVVJSUyNUSU8jI1JPSUwjIyMKVFJBSU5FRSNBUkdVTUVOVFMjVEFHCldBTFRFUkNIUllTTEVSIyMjWkFORQpJU0xFIyNPQVRIIyNURVNTI09UVE8KVEhZI1RIT1IjQUlNRSNUT0VOQUlMCiMjI1BFQUtQRVJGT1JNQU5DRSMjIwpTUVVFRVpFI0FESU4jT1JTTyNUU1AKT1VTVCNFRElUIyNUUkFQIyNEQU1BCkxJRVMjIyNXQVJSQU5UT0ZGSUNFUgpPWlMjREVNT1RJT05TI1dPT1NURVIKIyMjU0lTSSMjR1BBI01FTEJBIyMjClBFQUNPQ0tCTFVFI0JJUkQjUEVXUwpPVkVSI0FIRUFQI0ZVUiNFU1BSSVQKS0FURSNQQVJEI1dBUkFORFBFQUNFCkVETkEjRUlSRSNCSU5HTyNDQVNDQQpSRUFNI0VMQU4jQUxURVIjQVJFQUw="},{"title":"08/07/17 WAIT HERE","author":"Gail Grabowski","date":"2017-08-07","grid":"VFJPVCNTQ0FSI1NUUk9QCk5BU0EjUE9TRSNFUk9ERQpUSUxMI1JVSU4jRUFUSU4KI0RPQ1RPUlNPRkZJQ0UjCiMjIyNIVVQjI09JTCMjIwpDVVRTSVQjUEFSVCNPRkYKQVNIRU4jQlVSRyNHVVJVCkNIRUNLT1VUQ09VTlRFUgpURVNUI0NPVFMjQkFHRUwKSVJFI0JBWVMjTU9UT1JTCiMjI0FPTCMjU0VBIyMjIwojU1VCV0FZU1RBVElPTiMKQ0FOQUwjSVBBRCNTUEVXCkFOSVNFI1BPTE8jTEFURQpERVRFUiNTVEVXI0VMU0U="},{"title":"08/08/17 ON HAND","author":"Billie Truitt","date":"2017-08-08","grid":"SU5MRVQjU0xBTSNQQVNUCk5FSUdII0lPV0EjQUZBUgpGSU5HRVJGT09EI0xPTkUKT0xFI