{"id":"newsday-2012","publication":"newsday","year":"2012","count":457,"puzzles":[{"title":"01/01/12 ONE CENTURY AGO: Happenings of 1912","author":"S.N., edited by Stanley Newman","date":"2012-01-01","grid":"UkFXTFMjVElOWSNQSVBTI0FSREVOCkVMSU9UI1lXQ0EjQUFBQSNORUlMTApGRU5XQVlQQVJLI1JNU1RJVEFOSUMKIyMjQlJBRVMjS05PQlMjTk9MT1NTClRBS0VUV08jVklPTFMjU0xJTSMjIwpJREVBTFMjQVJOSUUjVVBPTiNXUE0KVFJZTUUjUFJPR1JFU1NJVkUjT1VJCkhJU1MjTkFUTyMjI1dBS0UjTU9STgpFQVQjTUlOSU1VTVdBR0UjV0FERUQKU05PQ09ORSMjQk9STkUjV0hZWUVTCiMjTk9VTlMjU09MT1MjRVlJTkcjIwpHT0VBU1kjU0hBTFQjI1RBQ1RVQUwKQU5LTEUjRk9SVFlFSUdIVEgjVEJBCkJJT1MjRkFSRSMjI01PQVQjQ0hBVApMT1AjUElMVERPV05NQU4jVE9SVEUKRU5TI0xFU1MjQUhFQUQjU0VSSUVTCiMjI0NBU0UjQ1JPV0QjRlVMTEVTVApBQ1FVSVQjQk9TU0EjVEVQRUUjIyMKSk9VUk5BTElTTSNHSVJMU0NPVVRTCkFSSVNFI0FMTUEjRVZJTCNPTlNFVApSQVpFUiNQRU9OI1JFUFMjTUVBTlk="},{"title":"01/01/12 ONE CENTURY AGO: Happenings of 1912","author":"S.N., edited by Stanley Newman","date":"2012-01-01","grid":"UkFXTFMjVElOWSNQSVBTI0FSREVOCkVMSU9UI1lXQ0EjQUFBQSNORUlMTApGRU5XQVlQQVJLI1JNU1RJVEFOSUMKIyMjQlJBRVMjS05PQlMjTk9MT1NTClRBS0VUV08jVklPTFMjU0xJTSMjIwpJREVBTFMjQVJOSUUjVVBPTiNXUE0KVFJZTUUjUFJPR1JFU1NJVkUjT1VJCkhJU1MjTkFUTyMjI1dBS0UjTU9STgpFQVQjTUlOSU1VTVdBR0UjV0FERUQKU05PQ09ORSMjQk9STkUjV0hZWUVTCiMjTk9VTlMjU09MT1MjRVlJTkcjIwpHT0VBU1kjU0hBTFQjI1RBQ1RVQUwKQU5LTEUjRk9SVFlFSUdIVEgjVEJBCkJJT1MjRkFSRSMjI01PQVQjQ0hBVApMT1AjUElMVERPV05NQU4jVE9SVEUKRU5TI0xFU1MjQUhFQUQjU0VSSUVTCiMjI0NBU0UjQ1JPV0QjRlVMTEVTVApBQ1FVSVQjQk9TU0EjVEVQRUUjIyMKSk9VUk5BTElTTSNHSVJMU0NPVVRTCkFSSVNFI0FMTUEjRVZJTCNPTlNFVApSQVpFUiNQRU9OI1JFUFMjTUVBTlk="},{"title":"01/02/12 TENDER-HEARTED","author":"Gail Grabowski, edited by Stanley Newman","date":"2012-01-02","grid":"Q09ORSNBVExBUyNBUkNTCkFSSUEjTk9PU0UjQk9SRQpTRUNUI1NZUklBI0FNRU4KSE9FI1NXRUVUUE9UQVRPCiMjR0FQRUQjI09QRU5FUgpUV09DQVIjRk9SVFMjIyMKQVJJRVMjR0FJVFMjTE9XClBFTlMjI09XTiMjTk9WQQpFTkcjVEhBTksjV0FWRUQKIyMjSEFJTFMjU0FUSVJFCkFQUEFMTCMjU1BZT04jIwpXQVJNQ0xPVEhFUyNHQVAKQVRJUCNUSE9STiNBQ1JFClJJQ0UjT05SRUQjU1VFUwpET0VSI1BPTkRTI1NQQVQ="},{"title":"01/02/12 TENDER-HEARTED","author":"Gail Grabowski, edited by Stanley Newman","date":"2012-01-02","grid":"Q09ORSNBVExBUyNBUkNTCkFSSUEjTk9PU0UjQk9SRQpTRUNUI1NZUklBI0FNRU4KSE9FI1NXRUVUUE9UQVRPCiMjR0FQRUQjI09QRU5FUgpUV09DQVIjRk9SVFMjIyMKQVJJRVMjR0FJVFMjTE9XClBFTlMjI09XTiMjTk9WQQpFTkcjVEhBTksjV0FWRUQKIyMjSEFJTFMjU0FUSVJFCkFQUEFMTCMjU1BZT04jIwpXQVJNQ0xPVEhFUyNHQVAKQVRJUCNUSE9STiNBQ1JFClJJQ0UjT05SRUQjU1VFUwpET0VSI1BPTkRTI1NQQVQ="},{"title":"01/03/12 GET IN SHAPE","author":"Billie Truitt, edited by Stanley Newman","date":"2012-01-03","grid":"Qk9XUyNGUk9TVCNST09NCkFSRUEjTEVWRVIjRVVSTwpSRUxZI09GQU5ZI0dSRVcKQk9EWUJVSUxESU5HIyMjCiMjI0VBUiMjI1RFQVVSTgpDUkVTVCNSQVQjVkVOVUUKSFVOVCNCRVJBVEUjV1NXCkFFUk9CSUNFWEVSQ0lTRQpDRk8jWU9VU0VFI0FTSVMKSFVMTFMjUk9EI0NMRUFUCkFMTElFUyMjI1NVRSMjIwojIyNDQUxJU1RIRU5JQ1MKTUFTSCNBTk5PWSNET0xFClBJS0UjU0tBVEUjQVRJUApHUklOI0hZUEVSI1JBUFQ="},{"title":"01/03/12 GET IN SHAPE","author":"Billie Truitt, edited by Stanley Newman","date":"2012-01-03","grid":"Qk9XUyNGUk9TVCNST09NCkFSRUEjTEVWRVIjRVVSTwpSRUxZI09GQU5ZI0dSRVcKQk9EWUJVSUxESU5HIyMjCiMjI0VBUiMjI1RFQVVSTgpDUkVTVCNSQVQjVkVOVUUKSFVOVCNCRVJBVEUjV1NXCkFFUk9CSUNFWEVSQ0lTRQpDRk8jWU9VU0VFI0FTSVMKSFVMTFMjUk9EI0NMRUFUCkFMTElFUyMjI1NVRSMjIwojIyNDQUxJU1RIRU5JQ1MKTUFTSCNBTk5PWSNET0xFClBJS0UjU0tBVEUjQVRJUApHUklOI0hZUEVSI1JBUFQ="},{"title":"01/04/12 START OF THE YEAR","author":"S.N., edited by Stanley Newman","date":"2012-01-04","grid":"QUhBQiNUSE9VI0FDSURTCk5BREEjRUFSTiNSQURJTwpUUk9KQU5XQVIjVFJJTVMKRVJSQU5EI0xJTElFUyMjCkRZRSNURUEjUEJTI0FGTAojIyNKSU5HTEVKQU5HTEUKVEFSQSNDVUUjI05PUkFECklDRUQjWUFOS1MjVEVSSQpBVFNFQSMjSU5LI1NFRU4KUklPREVKQU5FSVJPIyMjCkFJUiNSQU0jRU5FI1NBVwojI1RPT0JBRCNMRU1PTlkKRVZJTFMjSkFORUZPTkRBCkxJTkdPI09ERVMjRElFVApMRUdBTCNSQVRTI0VBU1Q="},{"title":"01/04/12 START OF THE YEAR","author":"S.N., edited by Stanley Newman","date":"2012-01-04","grid":"QUhBQiNUSE9VI0FDSURTCk5BREEjRUFSTiNSQURJTwpUUk9KQU5XQVIjVFJJTVMKRVJSQU5EI0xJTElFUyMjCkRZRSNURUEjUEJTI0FGTAojIyNKSU5HTEVKQU5HTEUKVEFSQSNDVUUjI05PUkFECklDRUQjWUFOS1MjVEVSSQpBVFNFQSMjSU5LI1NFRU4KUklPREVKQU5FSVJPIyMjCkFJUiNSQU0jRU5FI1NBVwojI1RPT0JBRCNMRU1PTlkKRVZJTFMjSkFORUZPTkRBCkxJTkdPI09ERVMjRElFVApMRUdBTCNSQVRTI0VBU1Q="},{"title":"01/05/12 HERE'S THE PITCH","author":"David W. Cromer, edited by Stanley Newman","date":"2012-01-05","grid":"U05BUCNQQU5HUyNTSUZUCkNPTEUjRUNPTEUjS05PQgpSSVBTI1NUUlVNI0FUTVMKQURIT0NDT01NSVRURUUjClBFQSNBSVIjIyNWRVJORQpTQVNFUyMjS1JJUyNJVFMKIyMjU0lTRU5PUiNKT1NFCiMjU1BPVFJFTU9WRVIjIwpHUkVZI0lNRUFOSVQjIyMKTkVUI0dSQVMjI1JFU1RTClBBTEVZIyMjUEdBI05JUAojQ09NTUVSQ0lBTENPREUKQVRPUCNNT1VOVCNIT1lBCk1PU1QjTUFUVEUjQVpVUgpQUkVZI0FSRUFTI1BFUFM="},{"title":"01/05/12 HERE'S THE PITCH","author":"David W. Cromer, edited by Stanley Newman","date":"2012-01-05","grid":"U05BUCNQQU5HUyNTSUZUCkNPTEUjRUNPTEUjS05PQgpSSVBTI1NUUlVNI0FUTVMKQURIT0NDT01NSVRURUUjClBFQSNBSVIjIyNWRVJORQpTQVNFUyMjS1JJUyNJVFMKIyMjU0lTRU5PUiNKT1NFCiMjU1BPVFJFTU9WRVIjIwpHUkVZI0lNRUFOSVQjIyMKTkVUI0dSQVMjI1JFU1RTClBBTEVZIyMjUEdBI05JUAojQ09NTUVSQ0lBTENPREUKQVRPUCNNT1VOVCNIT1lBCk1PU1QjTUFUVEUjQVpVUgpQUkVZI0FSRUFTI1BFUFM="},{"title":"01/06/12 FORTISSIMO","author":"Richard Silvestri, edited by Stanley Newman","date":"2012-01-06","grid":"I1NIQUdTI0VCQVkjVkVFCkJPSUxVUCNWT0NFI0lBTgpSQVlPRkZMSUdIVCNFUlIKU1BPT0YjSUxBWSNJTkZPCiMjI0ZBU1RFUiNBTk5VTApBRlQjV09SU1RPRkZBTEwKQk9PTiNSRVQjTlJBIyMjCkVYUEVDVFMjU1RPQ0tVUAojIyNXSE8jTU9JI1RBS0UKQ09BVE9GRkFSTVMjWUVXCk9IQk9ZI0xMQkVBTiMjIwpJTUlOI0dBTEUjQ09BQ0gKRkFUI0NPVVJUT0ZGTEFXCkVHTyNEQVRBI09MRUFSWQpERUYjU0xBVCNIWUVOQSM="},{"title":"01/06/12 FORTISSIMO","author":"Richard Silvestri, edited by Stanley Newman","date":"2012-01-06","grid":"I1NIQUdTI0VCQVkjVkVFCkJPSUxVUCNWT0NFI0lBTgpSQVlPRkZMSUdIVCNFUlIKU1BPT0YjSUxBWSNJTkZPCiMjI0ZBU1RFUiNBTk5VTApBRlQjV09SU1RPRkZBTEwKQk9PTiNSRVQjTlJBIyMjCkVYUEVDVFMjU1RPQ0tVUAojIyNXSE8jTU9JI1RBS0UKQ09BVE9GRkFSTVMjWUVXCk9IQk9ZI0xMQkVBTiMjIwpJTUlOI0dBTEUjQ09BQ0gKRkFUI0NPVVJUT0ZGTEFXCkVHTyNEQVRBI09MRUFSWQpERUYjU0xBVCNIWUVOQSM="},{"title":"01/07/12 SATURDAY STUMPER","author":"Doug Peterson, edited by Stanley Newman","date":"2012-01-07","grid":"QklHR1VMUCNQQUNLUkFUCk9DRUFOSUEjQ1JBWU9MQQpXSU5TTEVUI1NUQ1JPSVgKTENEI1ZBSUwjU0hBU1RBCkVMRU0jQk9PR0lFI1RBQgpERVJJREUjU0FFI1RJTEwKIyMjRlVER0VCUk9XTklFCiNUVUZUI09ITyNWRUdBIwpDQVNFWVNURU5HRUwjIyMKT0tFRCNFVEEjSU5WRVNUCk1FUiNTTkFSTFMjRUxMRQpQQU5DSE8jVE9FUyNNRU4KT05BTEFSSyNHTE9SSUVTClNBTVVSQUkjRUxOT1JURQpFUEVFSVNUI1NFR1dBWVM="},{"title":"01/07/12 SATURDAY STUMPER","author":"Doug Peterson, edited by Stanley Newman","date":"2012-01-07","grid":"QklHR1VMUCNQQUNLUkFUCk9DRUFOSUEjQ1JBWU9MQQpXSU5TTEVUI1NUQ1JPSVgKTENEI1ZBSUwjU0hBU1RBCkVMRU0jQk9PR0lFI1RBQgpERVJJREUjU0FFI1RJTEwKIyMjRlVER0VCUk9XTklFCiNUVUZUI09ITyNWRUdBIwpDQVNFWVNURU5HRUwjIyMKT0tFRCNFVEEjSU5WRVNUCk1FUiNTTkFSTFMjRUxMRQpQQU5DSE8jVE9FUyNNRU4KT05BTEFSSyNHTE9SSUVTClNBTVVSQUkjRUxOT1JURQpFUEVFSVNUI1NFR1dBWVM="},{"title":"01/08/12 PACKING 'EM IN: With a little something extra","author":"Bruce Venzke, edited by Stanley Newman","date":"2012-01-08","grid":"UE9TSCNCT0FTVCNMRUFQUyNTUEFOCkVST08jQU5HTE8jRVZJVEEjQUxTTwpMRUFSI0xJRVVUI1ZJUkFMI0xBUFMKRk9STUFTT05HI1RFQU1TRVJWSUNFCiMjI0VMQU5EI0hZRU5BIyNJT1RBUwpCRUFMRSMjVVRFUCMjSVJPTlMjIyMKRVNMI1BST01XUkVTVExJTkcjQkVBClZBVUdIQU4jQURERVIjTVVUVEVSUwpZVU1BI0RBTlMjSU1VUyNTT1JFQVQKIyMjU1RBTEUjI05JQ0hFI05JVFRJClBBTE1BUk9VTkQjU0tJTUxFU1NPTgpBSEVBUCNHUkVFUiMjRkVBU1QjIyMKVEVOU0VEI09UVE8jQVRSWSNBQUhTClJBWUtST0MjV0VTRVIjR09JTkdJTgpJREEjU1BBTVRSRUFUTUVOVCNSUEkKIyMjTE9FV0UjI1JVU0UjI0FHQVNQCkNISUVGIyNST0xFWCNUT09MRSMjIwpGQVJNRkVUQ0hFRCNTRUFNTEVWRUwKTElBTSNCRUlHRSNTUE9LRSNaRVRBCkFMVE8jQlJFRUQjS0FSRU4jRVJSUwpURUVOI1NBU0VTI0FTU05TI1JZRVM="},{"title":"01/08/12 PACKING 'EM IN: With a little something extra","author":"Bruce Venzke, edited by Stanley Newman","date":"2012-01-08","grid":"UE9TSCNCT0FTVCNMRUFQUyNTUEFOCkVST08jQU5HTE8jRVZJVEEjQUxTTwpMRUFSI0xJRVVUI1ZJUkFMI0xBUFMKRk9STUFTT05HI1RFQU1TRVJWSUNFCiMjI0VMQU5EI0hZRU5BIyNJT1RBUwpCRUFMRSMjVVRFUCMjSVJPTlMjIyMKRVNMI1BST01XUkVTVExJTkcjQkVBClZBVUdIQU4jQURERVIjTVVUVEVSUwpZVU1BI0RBTlMjSU1VUyNTT1JFQVQKIyMjU1RBTEUjI05JQ0hFI05JVFRJClBBTE1BUk9VTkQjU0tJTUxFU1NPTgpBSEVBUCNHUkVFUiMjRkVBU1QjIyMKVEVOU0VEI09UVE8jQVRSWSNBQUhTClJBWUtST0MjV0VTRVIjR09JTkdJTgpJREEjU1BBTVRSRUFUTUVOVCNSUEkKIyMjTE9FV0UjI1JVU0UjI0FHQVNQCkNISUVGIyNST0xFWCNUT09MRSMjIwpGQVJNRkVUQ0hFRCNTRUFNTEVWRUwKTElBTSNCRUlHRSNTUE9LRSNaRVRBCkFMVE8jQlJFRUQjS0FSRU4jRVJSUwpURUVOI1NBU0VTI0FTU05TI1JZRVM="},{"title":"01/09/12 SIT TIGHT","author":"Gail Grabowski, edited by Stanley Newman","date":"2012-01-09","grid":"SlVETyNTVEFURSNCUkVXCklQT0QjWU9VT0sjUk9WRQpMT05FI1JBTkdFI0FURUUKVE5UI0pVU1RBU0VDT05ECiMjTEVBUFQjI09WRVJUIwpTVEVBRFkjQ0xVRVMjIyMKRVJBU0UjVFJPVFMjQkVUCkVBVkUjI1JBTiMjUkVETwpSWUUjU1RJTkcjSE9QSU4KIyMjVEFIT0UjUkVMQVRFCiNTSElORSMjREVBTFQjIwpTVElDS0FST1VORCNJTVAKVEFOSyNCVVJOVCNHRUFSClVSR0UjQ0xPTkUjQU5URQpCRUVUI1NFTk9SI1NURVA="},{"title":"01/09/12 SIT TIGHT","author":"Gail Grabowski, edited by Stanley Newman","date":"2012-01-09","grid":"SlVETyNTVEFURSNCUkVXCklQT0QjWU9VT0sjUk9WRQpMT05FI1JBTkdFI0FURUUKVE5UI0pVU1RBU0VDT05ECiMjTEVBUFQjI09WRVJUIwpTVEVBRFkjQ0xVRVMjIyMKRVJBU0UjVFJPVFMjQkVUCkVBVkUjI1JBTiMjUkVETwpSWUUjU1RJTkcjSE9QSU4KIyMjVEFIT0UjUkVMQVRFCiNTSElORSMjREVBTFQjIwpTVElDS0FST1VORCNJTVAKVEFOSyNCVVJOVCNHRUFSClVSR0UjQ0xPTkUjQU5URQpCRUVUI1NFTk9SI1NURVA="},{"title":"01/10/12 LET'S PLAY CATCH","author":"Sally R. Stein, edited by Stanley Newman","date":"2012-01-10","grid":"QVVUT1MjU1RBUiNHTkFXClNIT1ZFI0hBTE8jUkFTSApQVVJFRSNBTU1PI0FTSUEKU0hPUlRCUkVBSyNWQVNUCiMjIyNISVAjI0lWWSMjIwpTUEFDRVMjQlJFQVRIRVMKVE9UTyNPQk9FI1RST1ZFCkFCRVQjTkVXRVIjQVJFQQpST1VURSNBSURFI0lTTlQKRVhQT1NVUkUjVEVORVRTCiMjI05QUiMjU0lSIyMjIwpDT01CI0JJVFRFUkNPTEQKQVJJQSNBQ1JFI0FVRElPClNFTEwjTkVBUiNUUklBTApUT0xMI0VTUE4jQUxFUlQ="},{"title":"01/10/12 LET'S PLAY CATCH","author":"Sally R. Stein, edited by Stanley Newman","date":"2012-01-10","grid":"QVVUT1MjU1RBUiNHTkFXClNIT1ZFI0hBTE8jUkFTSApQVVJFRSNBTU1PI0FTSUEKU0hPUlRCUkVBSyNWQVNUCiMjIyNISVAjI0lWWSMjIwpTUEFDRVMjQlJFQVRIRVMKVE9UTyNPQk9FI1RST1ZFCkFCRVQjTkVXRVIjQVJFQQpST1VURSNBSURFI0lTTlQKRVhQT1NVUkUjVEVORVRTCiMjI05QUiMjU0lSIyMjIwpDT01CI0JJVFRFUkNPTEQKQVJJQSNBQ1JFI0FVRElPClNFTEwjTkVBUiNUUklBTApUT0xMI0VTUE4jQUxFUlQ="},{"title":"01/11/12 WE'RE ALL EVEN","author":"Robert H. Wolfe, edited by Stanley Newman","date":"2012-01-11","grid":"QUpBUiNXSEFUI0NIT1BTCkNBUEUjV0VSRSNIT0NISQpUV09QT0lOVFMjRUFUT04KIyNMRVdJUyNUQVhSQVRFCk1JTEFOIyNERUMjU05PVwpJRE9MI0ZPVVJRVUVFTlMKTEVJI09SQUwjVVBOIyMjCkxBWCNNSVNMQUlEI1NFVwojIyNBTkQjQUxUTyNBU0gKU0lYRklHVVJFUyNUWVBFClVTQUYjRVREIyNQRU9OWQpCT05JRVNUI09DRUFOIyMKRkxBWFkjRUlHSFRCQVJTCk9EREVSI1JPTEUjQVJJQQpSRVVTRSNTVUVaI0dBTVk="},{"title":"01/11/12 WE'RE ALL EVEN","author":"Robert H. Wolfe, edited by Stanley Newman","date":"2012-01-11","grid":"QUpBUiNXSEFUI0NIT1BTCkNBUEUjV0VSRSNIT0NISQpUV09QT0lOVFMjRUFUT04KIyNMRVdJUyNUQVhSQVRFCk1JTEFOIyNERUMjU05PVwpJRE9MI0ZPVVJRVUVFTlMKTEVJI09SQUwjVVBOIyMjCkxBWCNNSVNMQUlEI1NFVwojIyNBTkQjQUxUTyNBU0gKU0lYRklHVVJFUyNUWVBFClVTQUYjRVREIyNQRU9OWQpCT05JRVNUI09DRUFOIyMKRkxBWFkjRUlHSFRCQVJTCk9EREVSI1JPTEUjQVJJQQpSRVVTRSNTVUVaI0dBTVk="},{"title":"01/12/12 LOTS OF ROOM","author":"David W. Cromer, edited by Stanley Newman","date":"2012-01-12","grid":"V0VCIyNFQkVSVCNBQVJQCklDT04jTUFSRVMjQ0xJTwpTSE9PI0JMQU5LQ0hFQ0sKQ09STkNPQlMjI0hJUkVFCiMjI1NPU08jQ09VTlRSWQpDTEVBUlNBSUxJTkcjIyMKTEFETEUjI1RBTksjVVZBClVSR0UjU1BBTksjQVNJTgpCQVkjQVVFTCMjRUxFQ1QKIyMjRU1QVFlDQUxPUklFClBSSVZBVEUjTFVTSCMjIwpSSURFUyMjUEFHRUFOVFMKT1BFTlNFU0FNRSNPQUhVCk1VU1QjRVJST1IjRVBJQwpPUFRTI0xJQVJTIyNBU0g="},{"title":"01/12/12 LOTS OF ROOM","author":"David W. Cromer, edited by Stanley Newman","date":"2012-01-12","grid":"V0VCIyNFQkVSVCNBQVJQCklDT04jTUFSRVMjQ0xJTwpTSE9PI0JMQU5LQ0hFQ0sKQ09STkNPQlMjI0hJUkVFCiMjI1NPU08jQ09VTlRSWQpDTEVBUlNBSUxJTkcjIyMKTEFETEUjI1RBTksjVVZBClVSR0UjU1BBTksjQVNJTgpCQVkjQVVFTCMjRUxFQ1QKIyMjRU1QVFlDQUxPUklFClBSSVZBVEUjTFVTSCMjIwpSSURFUyMjUEFHRUFOVFMKT1BFTlNFU0FNRSNPQUhVCk1VU1QjRVJST1IjRVBJQwpPUFRTI0xJQVJTIyNBU0g="},{"title":"01/13/12 LESS FILLING","author":"Fred Piscop, edited by Stanley Newman","date":"2012-01-13","grid":"VVNPRkEjQVRPUCNST01QClJPTUFOI0xBTUEjSUdPUgpOSU5OWSNPWEVOI0NMVUUKI0xJR0hUTklOR0NIRVNTCiMjIyNPV0UjIyNBSURFUwpDVUNLT08jU1BBQ0UjIyMKT1NMTyMjQk9PU1QjTUFQCkxFSVNVUkVCVVNJTkVTUwpFU1AjUEVURVIjI0lSSVMKIyMjT1NDQVIjR0FQRUFUCkFQUExFIyMjWkVOIyMjIwpMRUFEVEhFV0lUTkVTUyMKTEFORSNEUk9QI0FYSU9NCkFDVFMjVElLSSNMSUxBQwpORVNUI1ZFU1QjU1RPUFM="},{"title":"01/13/12 LESS FILLING","author":"Fred Piscop, edited by Stanley Newman","date":"2012-01-13","grid":"VVNPRkEjQVRPUCNST01QClJPTUFOI0xBTUEjSUdPUgpOSU5OWSNPWEVOI0NMVUUKI0xJR0hUTklOR0NIRVNTCiMjIyNPV0UjIyNBSURFUwpDVUNLT08jU1BBQ0UjIyMKT1NMTyMjQk9PU1QjTUFQCkxFSVNVUkVCVVNJTkVTUwpFU1AjUEVURVIjI0lSSVMKIyMjT1NDQVIjR0FQRUFUCkFQUExFIyMjWkVOIyMjIwpMRUFEVEhFV0lUTkVTUyMKTEFORSNEUk9QI0FYSU9NCkFDVFMjVElLSSNMSUxBQwpORVNUI1ZFU1QjU1RPUFM="},{"title":"01/14/12 SATURDAY STUMPER","author":"Lester Ruff, edited by Stanley Newman","date":"2012-01-14","grid":"QVRMRU5HVEgjTUFEUklECk1BVU5BTE9BI0VVQ0hSRQpCSVJEU09ORyNSRUNFU1MKVVBJI0FCSUdBSUwjVEFQClNFTlQjU1RBUlQjWU9HSQpISUdIUyNFUkUjQ0FSRVMKIyMjVU1QI0RBVEVMSU5FCkVNUFJFU1MjU0VMRUNUUwpNRUxCTEFOQyNFRUwjIyMKU1RFRUwjT0hNI0JBTUJJClBFQVIjVFJFQUQjV0FSTQpBRFMjQ0hFRVJJTyNOQVAKQ09VR0FSI1RJUkFNSVNVCkVVUk9QRSNPTlRIRUFJUgpTVEVQUEUjU0FZVU5DTEU="},{"title":"01/14/12 SATURDAY STUMPER","author":"Lester Ruff, edited by Stanley Newman","date":"2012-01-14","grid":"QVRMRU5HVEgjTUFEUklECk1BVU5BTE9BI0VVQ0hSRQpCSVJEU09ORyNSRUNFU1MKVVBJI0FCSUdBSUwjVEFQClNFTlQjU1RBUlQjWU9HSQpISUdIUyNFUkUjQ0FSRVMKIyMjVU1QI0RBVEVMSU5FCkVNUFJFU1MjU0VMRUNUUwpNRUxCTEFOQyNFRUwjIyMKU1RFRUwjT0hNI0JBTUJJClBFQVIjVFJFQUQjV0FSTQpBRFMjQ0hFRVJJTyNOQVAKQ09VR0FSI1RJUkFNSVNVCkVVUk9QRSNPTlRIRUFJUgpTVEVQUEUjU0FZVU5DTEU="},{"title":"01/15/12 WHAT HAPPENS IN VEGAS?: All sorts of things","author":"David W. Cromer, edited by Stanley Newman","date":"2012-01-15","grid":"TFBTI0NMQVkjI0FQUFQjUkVET0VTCkVBVSNIT1BVUCNDT0xFI0FTSUFHTwpBTk5VQUxFTEVDVFJPTklDU1NIT1cKUEVOQ0lMUyNSQU4jV0FTSCNDVVNTClNMSU1TIyNOSUtPTiNORUVSIyMjIwojIyNKRVJSWUxFV0lTVEVMRVRIT04KTU9QI1NFRU1TIyNDQ1MjI0NBSVJPCk9MRU8jSVRFIyNGSEEjV0lUTEVTUwpQRU5OQU5EVEVMTEVSTUFHSUMjIyMKRUFTVFMjIyNDSUEjI0JSTyMjTkFXCkRSSVZFVEhST1VHSE1BVFJJTU9OWQpTWU4jI0lJSSMjREVPIyMjU0lOR1MKIyMjQUxMWU9VQ0FORUFUQlVGRkVUClBJQ0NPTE8jR0FZIyNQSUUjRkFMQQpBTE9IQSMjQ0xJIyNSQUNFUyNUQU4KU0xPVE1BQ0hJTkVKQUNLUE9UIyMjCiMjIyNZVUxFI0VOT1RFIyNTSElSRQpTTEFQI1RJTUUjQUxJI0JJUEVEQUwKVEVYQVNIT0xERU1UT1VSTkFNRU5UCkVWRU5TTyNBR1JPI1NQRU5EI0FETwpNSVNURVIjQkVBUiMjU0FTUyNTSU4="},{"title":"01/15/12 WHAT HAPPENS IN VEGAS?: All sorts of things","author":"David W. Cromer, edited by Stanley Newman","date":"2012-01-15","grid":"TFBTI0NMQVkjI0FQUFQjUkVET0VTCkVBVSNIT1BVUCNDT0xFI0FTSUFHTwpBTk5VQUxFTEVDVFJPTklDU1NIT1cKUEVOQ0lMUyNSQU4jV0FTSCNDVVNTClNMSU1TIyNOSUtPTiNORUVSIyMjIwojIyNKRVJSWUxFV0lTVEVMRVRIT04KTU9QI1NFRU1TIyNDQ1MjI0NBSVJPCk9MRU8jSVRFIyNGSEEjV0lUTEVTUwpQRU5OQU5EVEVMTEVSTUFHSUMjIyMKRUFTVFMjIyNDSUEjI0JSTyMjTkFXCkRSSVZFVEhST1VHSE1BVFJJTU9OWQpTWU4jI0lJSSMjREVPIyMjU0lOR1MKIyMjQUxMWU9VQ0FORUFUQlVGRkVUClBJQ0NPTE8jR0FZIyNQSUUjRkFMQQpBTE9IQSMjQ0xJIyNSQUNFUyNUQU4KU0xPVE1BQ0hJTkVKQUNLUE9UIyMjCiMjIyNZVUxFI0VOT1RFIyNTSElSRQpTTEFQI1RJTUUjQUxJI0JJUEVEQUwKVEVYQVNIT0xERU1UT1VSTkFNRU5UCkVWRU5TTyNBR1JPI1NQRU5EI0FETwpNSVNURVIjQkVBUiMjU0FTUyNTSU4="},{"title":"01/16/12 WALK TO WORK","author":"Gail Grabowski, edited by Stanley Newman","date":"2012-01-16","grid":"U0xBTSNBTVBTI1NDT1BFClRVQkUjU0FMRSNUQVBJTgpPUkFMI1RSRUUjQU1FTkQKTEVUVEVSQ0FSUklFUiMjCkVTRSNBQUgjI0FSUkFZUwojIyNEUlkjUkJJI0FTQVAKI0FMT1QjTElFUyMjVFJBCkZMSUdIVEFUVEVOREFOVApPQUsjI1dPRVMjT1VSUyMKQU1FUyNFU1MjTU9PIyMjCkxPSVRFUiMjU09TI1NQQQojI0NBUlBFVENMRUFORVIKT0hBUkEjQlJBVCNORUFSClBBUlRTI0JBTEUjVEFDTwpUSEVTRSNTUEVEI1NLRVc="},{"title":"01/16/12 WALK TO WORK","author":"Gail Grabowski, edited by Stanley Newman","date":"2012-01-16","grid":"U0xBTSNBTVBTI1NDT1BFClRVQkUjU0FMRSNUQVBJTgpPUkFMI1RSRUUjQU1FTkQKTEVUVEVSQ0FSUklFUiMjCkVTRSNBQUgjI0FSUkFZUwojIyNEUlkjUkJJI0FTQVAKI0FMT1QjTElFUyMjVFJBCkZMSUdIVEFUVEVOREFOVApPQUsjI1dPRVMjT1VSUyMKQU1FUyNFU1MjTU9PIyMjCkxPSVRFUiMjU09TI1NQQQojI0NBUlBFVENMRUFORVIKT0hBUkEjQlJBVCNORUFSClBBUlRTI0JBTEUjVEFDTwpUSEVTRSNTUEVEI1NLRVc="},{"title":"01/17/12 SNOW REMOVAL","author":"Sally R. Stein, edited by Stanley Newman","date":"2012-01-17","grid":"SE9PUFMjU0xVUiNUQUJTCk1BTkVUI0NBU0UjRVVSTwpPVFRFUiNPVkVSI1NUQVIKU0hPVkVMV0FSRSNUT1RFCiMjI0VTRSMjU0FORCMjIwpFU1QjU0FTUyNET1JFTUkKQUxPRSNTT0xEI05JWE9OClNVTlNFVEJPVUxFVkFSRApFUkVDVCNTT1NPI0VMU0UKU1BSQVRTI1BUQVMjVEVYCiMjI1BFVFMjI0RBQiMjIwpTQUdBI1BMT1dTSEFSRVMKUFJPRCNFQVZFI0FCT0RFCkFJREUjVFZBRCNSQVZFTgpNQVNTI0VFTFMjQVJFTlQ="},{"title":"01/17/12 SNOW REMOVAL","author":"Sally R. Stein, edited by Stanley Newman","date":"2012-01-17","grid":"SE9PUFMjU0xVUiNUQUJTCk1BTkVUI0NBU0UjRVVSTwpPVFRFUiNPVkVSI1NUQVIKU0hPVkVMV0FSRSNUT1RFCiMjI0VTRSMjU0FORCMjIwpFU1QjU0FTUyNET1JFTUkKQUxPRSNTT0xEI05JWE9OClNVTlNFVEJPVUxFVkFSRApFUkVDVCNTT1NPI0VMU0UKU1BSQVRTI1BUQVMjVEVYCiMjI1BFVFMjI0RBQiMjIwpTQUdBI1BMT1dTSEFSRVMKUFJPRCNFQVZFI0FCT0RFCkFJREUjVFZBRCNSQVZFTgpNQVNTI0VFTFMjQVJFTlQ="},{"title":"01/18/12 TIGHT TRAIL","author":"Billie Truitt, edited by Stanley Newman","date":"2012-01-18","grid":"RUxCT1cjSEFUUyNCVkRTClRPUkFII0lDT04jUkFSRQpBTklUQSNUQUxMI0lST04KTElHSFRSQUlMI0VHWVBUCiMjIyNMRVMjU0hBSCMjIwpTTE9XTEFORSNPVFRBV0EKV0lUSCNMQVgjV0VUQkFSCkFUVElDI0dBTCNOQUlWRQpUSEVUQUIjTU9CI0lERUEKU0VSRU5FI1NQT1RMRVNTCiMjI1dPRVMjU09XIyMjIwpDQUNIRSNXUklURU1BSUwKSFVMQSNSRUFEI1JJTlNFCk9SQUwjRUFWRSNQUkVFTgpQQU5FI0ZSRUQjU0VXRUQ="},{"title":"01/18/12 TIGHT TRAIL","author":"Billie Truitt, edited by Stanley Newman","date":"2012-01-18","grid":"RUxCT1cjSEFUUyNCVkRTClRPUkFII0lDT04jUkFSRQpBTklUQSNUQUxMI0lST04KTElHSFRSQUlMI0VHWVBUCiMjIyNMRVMjU0hBSCMjIwpTTE9XTEFORSNPVFRBV0EKV0lUSCNMQVgjV0VUQkFSCkFUVElDI0dBTCNOQUlWRQpUSEVUQUIjTU9CI0lERUEKU0VSRU5FI1NQT1RMRVNTCiMjI1dPRVMjU09XIyMjIwpDQUNIRSNXUklURU1BSUwKSFVMQSNSRUFEI1JJTlNFCk9SQUwjRUFWRSNQUkVFTgpQQU5FI0ZSRUQjU0VXRUQ="},{"title":"01/19/12 REST ASSURED","author":"Fred Piscop, edited by Stanley Newman","date":"2012-01-19","grid":"T09IUyMjU1BBUyNTTE9FClNUT09QI1BFQ0sjSEVBVApISVBQT0NSQVRJQ09BVEgKQVNJU0VFSVQjI0xFVkVFCiMjIyNUT04jUEhJI0VSUgpGSUFUIyNHUk9BTiMjIyMKQVNDT1RTI0VNSVQjUkFQCkNBTVBBSUdOUFJPTUlTRQpFWUUjR1JBRCNTTkFQVE8KIyMjI1NFTlNFIyNSRUlOClBHQSNBTkcjWEVTIyMjIwpSRUdBTCMjU0hFRVBJU0gKT05FWUVBUldBUlJBTlRZCk5PTkUjQk9JTCNCUk9BRApFQVRTI0VER0UjI0FOVEU="},{"title":"01/19/12 REST ASSURED","author":"Fred Piscop, edited by Stanley Newman","date":"2012-01-19","grid":"T09IUyMjU1BBUyNTTE9FClNUT09QI1BFQ0sjSEVBVApISVBQT0NSQVRJQ09BVEgKQVNJU0VFSVQjI0xFVkVFCiMjIyNUT04jUEhJI0VSUgpGSUFUIyNHUk9BTiMjIyMKQVNDT1RTI0VNSVQjUkFQCkNBTVBBSUdOUFJPTUlTRQpFWUUjR1JBRCNTTkFQVE8KIyMjI1NFTlNFIyNSRUlOClBHQSNBTkcjWEVTIyMjIwpSRUdBTCMjU0hFRVBJU0gKT05FWUVBUldBUlJBTlRZCk5PTkUjQk9JTCNCUk9BRApFQVRTI0VER0UjI0FOVEU="},{"title":"01/20/12 MACROECONOMIC","author":"Bruce Venzke, edited by Stanley Newman","date":"2012-01-20","grid":"U1RBR1MjV0hJVCNPU0hBCk9IR0VFI0FJREEjTk9FTApOT1JURSNLTk9YI0tVTkcKR1JPU1NORUdMSUdFTkNFCiMjI0FUT05FIyNSWURFUgpGT1JHT1QjI0lHTyMjIyMKQVBBUiMjQkFETU9VVEhTCk5BVElPTkFMTEFNUE9PTgpTTEFQSEFQUFkjI1RVTkEKIyMjI0lUVCMjR0VIUklHCkFDSE9PIyNUUklLRSMjIwpQUk9EVUNUUkVTRUFSQ0gKUkVOTyNIQUlHI09OT05FCk9QRVIjT0tMQSNVVFRFUgpORVNTI1lFTEwjVEVTVFM="},{"title":"01/20/12 MACROECONOMIC","author":"Bruce Venzke, edited by Stanley Newman","date":"2012-01-20","grid":"U1RBR1MjV0hJVCNPU0hBCk9IR0VFI0FJREEjTk9FTApOT1JURSNLTk9YI0tVTkcKR1JPU1NORUdMSUdFTkNFCiMjI0FUT05FIyNSWURFUgpGT1JHT1QjI0lHTyMjIyMKQVBBUiMjQkFETU9VVEhTCk5BVElPTkFMTEFNUE9PTgpTTEFQSEFQUFkjI1RVTkEKIyMjI0lUVCMjR0VIUklHCkFDSE9PIyNUUklLRSMjIwpQUk9EVUNUUkVTRUFSQ0gKUkVOTyNIQUlHI09OT05FCk9QRVIjT0tMQSNVVFRFUgpORVNTI1lFTEwjVEVTVFM="},{"title":"01/21/12 SATURDAY STUMPER","author":"Brad Wilber, edited by Stanley Newman","date":"2012-01-21","grid":"VEhFRUFHTEUjQURIRVJFCkJPUk5GUkVFI0ZSQVNFUgpPTkFCUkVBSyNGT05UQUwKTkVUTE9TUyNDQU5ESURFCkRST09QIyNTSElJU00jIwojIyNDT1VOVEVSU1BBQ0UKQklHI1BST0FNI0hBVEhBCk9NT08jTk9USVQjTkVBUgpTSEFMVCNET1NFRCNTSVAKQ09QWVJJR0hUTEFXIyMjCiMjRU1JTkVNIyNUQVNLUwpSRU9QRU5TI0NIQVRURUwKQURWSVNFI1BIQVNFT05FCklERUFURSNQT1dFUkFERQpEQVJORUQjRE9OVFNUT1A="},{"title":"01/21/12 SATURDAY STUMPER","author":"Brad Wilber, edited by Stanley Newman","date":"2012-01-21","grid":"VEhFRUFHTEUjQURIRVJFCkJPUk5GUkVFI0ZSQVNFUgpPTkFCUkVBSyNGT05UQUwKTkVUTE9TUyNDQU5ESURFCkRST09QIyNTSElJU00jIwojIyNDT1VOVEVSU1BBQ0UKQklHI1BST0FNI0hBVEhBCk9NT08jTk9USVQjTkVBUgpTSEFMVCNET1NFRCNTSVAKQ09QWVJJR0hUTEFXIyMjCiMjRU1JTkVNIyNUQVNLUwpSRU9QRU5TI0NIQVRURUwKQURWSVNFI1BIQVNFT05FCklERUFURSNQT1dFUkFERQpEQVJORUQjRE9OVFNUT1A="},{"title":"01/22/12 NOBLE THOUGHTS: With lots of titles","author":"Gail Grabowski, edited by Stanley Newman","date":"2012-01-22","grid":"QURBUFQjUkFURUQjU0VHTyNGRVNTCkNPUkVBI0VCT05ZI0VUT04jVUNMQQpFTExFUllRVUVFTiNEVUtFSVRPVVQKU1RPUk1PVVQjUkFNQURBI1RJTkdFCiMjIyNBUkUjIyNNQVRFUk5BTCMjIwpQUklOQ0VTU1BIT05FI1RBTEVOVFMKT0hOTyMjVEFMRVMjI0VTUFkjRUVOClNZU1RFTSNMRUEjQlJSIyMjRFJOTwpFTVUjQ0FTVUFMI0xPUkRJVE9WRVIKUkVNI09OSVQjI1JVQiNBVEhMRVRFCiMjI0VMSVRFI0NBUiNDUlVFTCMjIwpUUkFMQUxBI0dFTSMjQU5OTyNSRVAKRUFSTFdBUlJFTiNQVVJTRVIjQU1BClBMSUUjIyNORVQjQVBFI1NZUklBTgpFTFMjT1BUUyMjT05UT1AjI0FNSUUKRVlFQlJPVyNLSU5HT0ZUSEVISUxMCiMjI09CU09MRVRFIyMjQkFOIyMjIwpJVElTSSNMRU5USUwjUE9TVFBBSUQKRklSU1RMQURZI0RJQU5BUFJJTkNFCkZMT0UjSU5HQSNBTExPVCNBTFRPUwpZRU5TI1BFRU4jU1RFTVMjUExJTks="},{"title":"01/22/12 NOBLE THOUGHTS: With lots of titles","author":"Gail Grabowski, edited by Stanley Newman","date":"2012-01-22","grid":"QURBUFQjUkFURUQjU0VHTyNGRVNTCkNPUkVBI0VCT05ZI0VUT04jVUNMQQpFTExFUllRVUVFTiNEVUtFSVRPVVQKU1RPUk1PVVQjUkFNQURBI1RJTkdFCiMjIyNBUkUjIyNNQVRFUk5BTCMjIwpQUklOQ0VTU1BIT05FI1RBTEVOVFMKT0hOTyMjVEFMRVMjI0VTUFkjRUVOClNZU1RFTSNMRUEjQlJSIyMjRFJOTwpFTVUjQ0FTVUFMI0xPUkRJVE9WRVIKUkVNI09OSVQjI1JVQiNBVEhMRVRFCiMjI0VMSVRFI0NBUiNDUlVFTCMjIwpUUkFMQUxBI0dFTSMjQU5OTyNSRVAKRUFSTFdBUlJFTiNQVVJTRVIjQU1BClBMSUUjIyNORVQjQVBFI1NZUklBTgpFTFMjT1BUUyMjT05UT1AjI0FNSUUKRVlFQlJPVyNLSU5HT0ZUSEVISUxMCiMjI09CU09MRVRFIyMjQkFOIyMjIwpJVElTSSNMRU5USUwjUE9TVFBBSUQKRklSU1RMQURZI0RJQU5BUFJJTkNFCkZMT0UjSU5HQSNBTExPVCNBTFRPUwpZRU5TI1BFRU4jU1RFTVMjUExJTks="},{"title":"01/23/12 ON THE KEYBOARD","author":"Gail Grabowski, edited by Stanley Newman","date":"2012-01-23","grid":"U05BUCNEUkFGVCMjV0VFCk9BSFUjRUFSTFMjV0lMTApBUE9QI1NORUFLI1JURVMKUEFZVEhFVEFCI1RFSEVFCiMjI0VVUk9TI05PTk8jIwpTT05ORVQjI0NPTlNVTFQKT05JVCMjVEVBU0UjVEFJCkRJRyNDQVVMS0VEI0VORwpPT0gjUklOU0UjI09OQ0UKSU5UUlVERSMjU0VOREVSCiMjU0lERSNTQVRBVCMjIwpUQUhPRSNNT1RPUkhPTUUKT01JVCNTSVJFTiNFWEFNClJFRlMjVU5USUUjR0VOVApUTlQjI0JFQU5TI09ORVM="},{"title":"01/23/12 ON THE KEYBOARD","author":"Gail Grabowski, edited by Stanley Newman","date":"2012-01-23","grid":"U05BUCNEUkFGVCMjV0VFCk9BSFUjRUFSTFMjV0lMTApBUE9QI1NORUFLI1JURVMKUEFZVEhFVEFCI1RFSEVFCiMjI0VVUk9TI05PTk8jIwpTT05ORVQjI0NPTlNVTFQKT05JVCMjVEVBU0UjVEFJCkRJRyNDQVVMS0VEI0VORwpPT0gjUklOU0UjI09OQ0UKSU5UUlVERSMjU0VOREVSCiMjU0lERSNTQVRBVCMjIwpUQUhPRSNNT1RPUkhPTUUKT01JVCNTSVJFTiNFWEFNClJFRlMjVU5USUUjR0VOVApUTlQjI0JFQU5TI09ORVM="},{"title":"01/24/12 CAMPING TRIP","author":"Billie Truitt, edited by Stanley Newman","date":"2012-01-24","grid":"RU5BQ1QjQ0xBUCMjRkNDCk1JQ1JPI05PQkxFI0lPVQpTTEVFUElOR0JBRyNSVUIKIyMjU09OI09SU08jU1BBClJBUFRVUkUjI01JVFRFTgpBRE8jVE9MTCNBU0lBIyMKTUlDRSNBQklUI1RSSUFEClBFS0UjRE9NRVMjRURHRQpTVUVSUyNXRVBUI1NLSVMKIyNUSU1FI1NJUlMjSUxLCkxJS0VJVCMjRE9OQVRFUwpBTk4jVEhBVyNOT0QjIyMKVU5JI0hJS0lOR0JPT1RTClJFRiNTQ0lGSSNCUklBUgpBUkUjI1NOSVAjWUVMUFM="},{"title":"01/24/12 CAMPING TRIP","author":"Billie Truitt, edited by Stanley Newman","date":"2012-01-24","grid":"RU5BQ1QjQ0xBUCMjRkNDCk1JQ1JPI05PQkxFI0lPVQpTTEVFUElOR0JBRyNSVUIKIyMjU09OI09SU08jU1BBClJBUFRVUkUjI01JVFRFTgpBRE8jVE9MTCNBU0lBIyMKTUlDRSNBQklUI1RSSUFEClBFS0UjRE9NRVMjRURHRQpTVUVSUyNXRVBUI1NLSVMKIyNUSU1FI1NJUlMjSUxLCkxJS0VJVCMjRE9OQVRFUwpBTk4jVEhBVyNOT0QjIyMKVU5JI0hJS0lOR0JPT1RTClJFRiNTQ0lGSSNCUklBUgpBUkUjI1NOSVAjWUVMUFM="},{"title":"01/25/12 WATCH IT","author":"Norma Steinberg, edited by Stanley Newman","date":"2012-01-25","grid":"QUNIRUQjU1RBUiNDQVRTClBJQU5PI1RPQkUjQVJJQQpQQU5EQSNBTEVDI0xJRVMKU09EI0JBTkRMRUFERVJTCiMjU09MSUQjI0RSRVNTWQpCQURHRVIjVEhFSVIjIyMKQVdPTCNTSFJFRFMjRklHCkpBV0VEI0FJTSNFVkFERQpBWU4jUkFSRVNUI0VDT0wKIyMjUk9TRVMjSE9URUxTCkFTU0VOVCMjVEVOT0YjIwpOVU1CRVJTR0FNRSNBU1AKSVNFRSNJQ09OI0RFQ09SClRBTEwjREFORyNBU1RSTwpBTlRTI0VSR08jWUVTRVM="},{"title":"01/25/12 WATCH IT","author":"Norma Steinberg, edited by Stanley Newman","date":"2012-01-25","grid":"QUNIRUQjU1RBUiNDQVRTClBJQU5PI1RPQkUjQVJJQQpQQU5EQSNBTEVDI0xJRVMKU09EI0JBTkRMRUFERVJTCiMjU09MSUQjI0RSRVNTWQpCQURHRVIjVEhFSVIjIyMKQVdPTCNTSFJFRFMjRklHCkpBV0VEI0FJTSNFVkFERQpBWU4jUkFSRVNUI0VDT0wKIyMjUk9TRVMjSE9URUxTCkFTU0VOVCMjVEVOT0YjIwpOVU1CRVJTR0FNRSNBU1AKSVNFRSNJQ09OI0RFQ09SClRBTEwjREFORyNBU1RSTwpBTlRTI0VSR08jWUVTRVM="},{"title":"01/26/12 AT THE OFFICE","author":"Bruce Venzke, edited by Stanley Newman","date":"2012-01-26","grid":"QUFBUyNQQUlEI0tBUkFUCk1MTEUjUkVOTyNFTElURQpGSUxFVklSVVMjVkVHQU4KTUFUUklYI1NFQUwjSVJFCiMjSEVTI0RFU0tBVURJVApFUlVESVRFIyNBUkYjIyMKQ09NI09JTEVEIyNPU0xPCkNBQklORVRNSU5JU1RFUgpPUlNPIyNTVVJGUyNSRUIKIyMjV1NKIyNHTE9XRVJTClNBRkVIT1VTRSNCQUEjIwpPVVIjQU5OTyNXQUxLT04KQ1JJU1AjQ0hBSVJMSUZUCktBVElFI0xPQlMjRUVMUwpPTE9SRCNFVENII0RSQUI="},{"title":"01/26/12 AT THE OFFICE","author":"Bruce Venzke, edited by Stanley Newman","date":"2012-01-26","grid":"QUFBUyNQQUlEI0tBUkFUCk1MTEUjUkVOTyNFTElURQpGSUxFVklSVVMjVkVHQU4KTUFUUklYI1NFQUwjSVJFCiMjSEVTI0RFU0tBVURJVApFUlVESVRFIyNBUkYjIyMKQ09NI09JTEVEIyNPU0xPCkNBQklORVRNSU5JU1RFUgpPUlNPIyNTVVJGUyNSRUIKIyMjV1NKIyNHTE9XRVJTClNBRkVIT1VTRSNCQUEjIwpPVVIjQU5OTyNXQUxLT04KQ1JJU1AjQ0hBSVJMSUZUCktBVElFI0xPQlMjRUVMUwpPTE9SRCNFVENII0RSQUI="},{"title":"01/27/12 MISSING LINKS","author":"S.N., edited by Stanley Newman","date":"2012-01-27","grid":"QVJBQiNNSURTVCNFVE5BCkJFTEEjQURJRVUjWEJPWApFTEVDI1JJU0VSI0VBU0UKTE9DS1NUT0NLQkFSUkVMCiMjI1NXSU0jI09QVCMjIwpBU0hQQU4jVU5KVVNUTFkKQ0xBSU0jT05DRSMjQkVFClJBSU5JTkdDQVRTRE9HUwpFU1QjI0FMTEEjTEVOSU4KU0hJVkFSRUUjVElFRFRPCiMjI0VSUiMjS0VFUCMjIwpGVUxMRkFJVEhDUkVESVQKRVBJQyNUT1JBSCNOT0FICk1PT1IjRU5PS0kjRURHRQpBTk5PI1NBVElFI0RPT00="},{"title":"01/27/12 MISSING LINKS","author":"S.N., edited by Stanley Newman","date":"2012-01-27","grid":"QVJBQiNNSURTVCNFVE5BCkJFTEEjQURJRVUjWEJPWApFTEVDI1JJU0VSI0VBU0UKTE9DS1NUT0NLQkFSUkVMCiMjI1NXSU0jI09QVCMjIwpBU0hQQU4jVU5KVVNUTFkKQ0xBSU0jT05DRSMjQkVFClJBSU5JTkdDQVRTRE9HUwpFU1QjI0FMTEEjTEVOSU4KU0hJVkFSRUUjVElFRFRPCiMjI0VSUiMjS0VFUCMjIwpGVUxMRkFJVEhDUkVESVQKRVBJQyNUT1JBSCNOT0FICk1PT1IjRU5PS0kjRURHRQpBTk5PI1NBVElFI0RPT00="},{"title":"01/28/12 SATURDAY STUMPER","author":"Lars G. Doubleday, edited by Stanley Newman","date":"2012-01-28","grid":"R0lMVEVER0VEI05BQUNQCk9OSU1QVUxTRSNFWFRPTApUQUtFQUJBVEgjQUVUTkEKV1JFTiNJREVBTCNEQUZUCkVPUyNQT0UjVklOI0dSRQpUV08jR1VZI0VaRUtJRUwKIyMjQkFTRSNOQVZBUlJFClNIRUFUSCMjI01BTExFVApUQVBST09NI1JJREUjIyMKVFJJQlVORSNBTkEjVFZTCkhETCNST0QjQ05OI0hVSApPQk9FI1JJQ0hFI01PTEUKTUFHSUMjQ09BTEJBUkdFCkFDVVJBI09NRUxFVFBBTgpTS0VFVCNTUExJVFRFUlM="},{"title":"01/28/12 SATURDAY STUMPER","author":"Lars G. Doubleday, edited by Stanley Newman","date":"2012-01-28","grid":"R0lMVEVER0VEI05BQUNQCk9OSU1QVUxTRSNFWFRPTApUQUtFQUJBVEgjQUVUTkEKV1JFTiNJREVBTCNEQUZUCkVPUyNQT0UjVklOI0dSRQpUV08jR1VZI0VaRUtJRUwKIyMjQkFTRSNOQVZBUlJFClNIRUFUSCMjI01BTExFVApUQVBST09NI1JJREUjIyMKVFJJQlVORSNBTkEjVFZTCkhETCNST0QjQ05OI0hVSApPQk9FI1JJQ0hFI01PTEUKTUFHSUMjQ09BTEJBUkdFCkFDVVJBI09NRUxFVFBBTgpTS0VFVCNTUExJVFRFUlM="},{"title":"01/29/12 WATCH THIS SPACE: With some words from our sponsor","author":"Fred Piscop, edited by Stanley Newman","date":"2012-01-29","grid":"UkVGRVIjSEFMTCNNQUNITyNGRUxUCk9YSURFI0FMT0UjSU5MQVcjRVZFUgpXSU5HQURESU5HI1NUT05FQURBR0UKU1RFRVBFTiNHT0xGRUQjU0xFREdFCiMjI1dFTFRZIyNQRUQjIyNQUkVZUwpHT0dJUkwjSU1BR0UjSkVTU0UjIyMKQVZJUyNTVEVBTUFEVkVOVCNSSURFCkdBWkVEI0VMSVMjI0lUU09OI1JFRwpBTEEjUkFOREQjRkFEUyNQQUNJTkcKIyMjRkVSTiMjSEFCRUFTI1RBU1RFCkFETUlTU0lPTkFDQ09NUExJU0hFRApDT09MUyNTQ09SRVMjI1JPT0sjIyMKSFVSTEVSI1RJRUQjQVZJQU4jSEFJCkVTRSNTT0RBUyMjUExJRSNTTFVORwpERUxJI0FEVkVSU0VGT1JNI0FMVE8KIyMjTlVSU0UjQVVSQUwjQUxUQUlSClBTQVRTIyMjU05MIyNBTk5JRSMjIwpJQUdSRUUjSU5GVVNFI09ORVNURVAKU1VOQURWSVNPUiNPVkVSQURIRVJFCkFDRUQjSUxMQkUjTEVUUyNUT1JURQpOWVNFI0xFQVNFI09OQ0UjT1dORVI="},{"title":"01/29/12 WATCH THIS SPACE: With some words from our sponsor","author":"Fred Piscop, edited by Stanley Newman","date":"2012-01-29","grid":"UkVGRVIjSEFMTCNNQUNITyNGRUxUCk9YSURFI0FMT0UjSU5MQVcjRVZFUgpXSU5HQURESU5HI1NUT05FQURBR0UKU1RFRVBFTiNHT0xGRUQjU0xFREdFCiMjI1dFTFRZIyNQRUQjIyNQUkVZUwpHT0dJUkwjSU1BR0UjSkVTU0UjIyMKQVZJUyNTVEVBTUFEVkVOVCNSSURFCkdBWkVEI0VMSVMjI0lUU09OI1JFRwpBTEEjUkFOREQjRkFEUyNQQUNJTkcKIyMjRkVSTiMjSEFCRUFTI1RBU1RFCkFETUlTU0lPTkFDQ09NUExJU0hFRApDT09MUyNTQ09SRVMjI1JPT0sjIyMKSFVSTEVSI1RJRUQjQVZJQU4jSEFJCkVTRSNTT0RBUyMjUExJRSNTTFVORwpERUxJI0FEVkVSU0VGT1JNI0FMVE8KIyMjTlVSU0UjQVVSQUwjQUxUQUlSClBTQVRTIyMjU05MIyNBTk5JRSMjIwpJQUdSRUUjSU5GVVNFI09ORVNURVAKU1VOQURWSVNPUiNPVkVSQURIRVJFCkFDRUQjSUxMQkUjTEVUUyNUT1JURQpOWVNFI0xFQVNFI09OQ0UjT1dORVI="},{"title":"01/30/12 SUITABLE","author":"Billie Truitt, edited by Stanley Newman","date":"2012-01-30","grid":"T0RPUiMjUkJJI1BVQ0tTCk1JQ0UjU0VBTiNBRkxBVApBQ0VEI1RFTlQjWU9VUkUKSEVBUlRPRkdPTEQjQkxUCkFTTkVBUiMjV0VJR0gjIwojIyNXUkVBSyNEUllPRkYKVVBTI1RVVE9SI1RSVUVSClNJUFMjUEFSSVMjT1NMTwpTTkFQUyNERU5JTSNFTE0KUkFESUFMI0FETElCIyMjCiMjRU5ERVIjI0VMQVBTRQpTQVcjRElBTU9ORFJJTkcKVFJPTEwjVEFMQyNURUFSCkVFUklFI1RSRUUjQUNSRQpNQUtFUyNZRVMjI0JFRVQ="},{"title":"01/30/12 SUITABLE","author":"Billie Truitt, edited by Stanley Newman","date":"2012-01-30","grid":"T0RPUiMjUkJJI1BVQ0tTCk1JQ0UjU0VBTiNBRkxBVApBQ0VEI1RFTlQjWU9VUkUKSEVBUlRPRkdPTEQjQkxUCkFTTkVBUiMjV0VJR0gjIwojIyNXUkVBSyNEUllPRkYKVVBTI1RVVE9SI1RSVUVSClNJUFMjUEFSSVMjT1NMTwpTTkFQUyNERU5JTSNFTE0KUkFESUFMI0FETElCIyMjCiMjRU5ERVIjI0VMQVBTRQpTQVcjRElBTU9ORFJJTkcKVFJPTEwjVEFMQyNURUFSCkVFUklFI1RSRUUjQUNSRQpNQUtFUyNZRVMjI0JFRVQ="},{"title":"01/31/12 REALLY RELAXING","author":"Gail Grabowski, edited by Stanley Newman","date":"2012-01-31","grid":"VE9UQUwjUklTSyNSSUdTCk9IQVJFI0FOVEkjSURPTApVTlRJRSNOT1VOI0ZFVEUKUk9BRFJBQ0lORyNMQUlECiMjIyNBV09MIyNQRVNUUwpTTUFSVEVSI0RPT1IjIyMKVFVUVSMjI1RBS0VBQk9XCkFUT00jUExBWVMjTk9ORQpCRUVQQkVFUCMjI0dBTUUKIyMjUlVORyNDQVRFUkVECk9OSU9OIyNFUklFIyMjIwpNQU1BI1JBVkVSRVZJRVcKSUNFUyNBUkVBI1NBTlRBClRIQVQjU0lOSyNVTklUWQpTT05TI0hBVFMjUEVURVM="},{"title":"01/31/12 REALLY RELAXING","author":"Gail Grabowski, edited by Stanley Newman","date":"2012-01-31","grid":"VE9UQUwjUklTSyNSSUdTCk9IQVJFI0FOVEkjSURPTApVTlRJRSNOT1VOI0ZFVEUKUk9BRFJBQ0lORyNMQUlECiMjIyNBV09MIyNQRVNUUwpTTUFSVEVSI0RPT1IjIyMKVFVUVSMjI1RBS0VBQk9XCkFUT00jUExBWVMjTk9ORQpCRUVQQkVFUCMjI0dBTUUKIyMjUlVORyNDQVRFUkVECk9OSU9OIyNFUklFIyMjIwpNQU1BI1JBVkVSRVZJRVcKSUNFUyNBUkVBI1NBTlRBClRIQVQjU0lOSyNVTklUWQpTT05TI0hBVFMjUEVURVM="},{"title":"02/01/12 INSTRUMENTAL","author":"Fred Piscop, edited by Stanley Newman","date":"2012-02-01","grid":"RURJVCNBR0VEI0NBREdFCkpFVEUjRE9ETyNPUkFMUwpFTFNFI1JVRVMjQUdSRUUKQ0hBTVBBR05FRkxVVEUjClRJUyNBVEUjI1VTRSMjIwojI0VSSUUjRE9OI1NFUkYKQVJDRUQjTEFVR0gjR09PCkJFUk1VREFUUklBTkdMRQpJTkUjUElORVMjVkFORVMKVE9UUyNURFMjUkVQTyMjCiMjI1BBQyMjUEVUI09GVAojRkxJR0hUUkVDT1JERVIKR1JBREUjSEFSRSNPTEFZCk1BVkVOI0FWT04jTUVUUwpTVEFSVCNXRU5UI1BTU1Q="},{"title":"02/01/12 INSTRUMENTAL","author":"Fred Piscop, edited by Stanley Newman","date":"2012-02-01","grid":"RURJVCNBR0VEI0NBREdFCkpFVEUjRE9ETyNPUkFMUwpFTFNFI1JVRVMjQUdSRUUKQ0hBTVBBR05FRkxVVEUjClRJUyNBVEUjI1VTRSMjIwojI0VSSUUjRE9OI1NFUkYKQVJDRUQjTEFVR0gjR09PCkJFUk1VREFUUklBTkdMRQpJTkUjUElORVMjVkFORVMKVE9UUyNURFMjUkVQTyMjCiMjI1BBQyMjUEVUI09GVAojRkxJR0hUUkVDT1JERVIKR1JBREUjSEFSRSNPTEFZCk1BVkVOI0FWT04jTUVUUwpTVEFSVCNXRU5UI1BTU1Q="},{"title":"02/02/12 HAIR APPARENT","author":"S.N., edited by Stanley Newman","date":"2012-02-02","grid":"UkFUUyNQVEFTI0dOQVQjCkVaUkEjTE9VVCNST1BFIwpIQUlMI0FMREEjQU5URSMKQUxCRVJURUlOU1RFSU4jClNFQSNPRUQjRkVFI1RBVQpIQUxFWSNPRE9SI01VR1MKIyMjR0FCI09SQiNJREVBCiNQSFlMTElTRElMTEVSIwpEUklQI09ORSNBVUsjIyMKSkVUVCNXQVNQI0NZQkVSClNPUyNQVVAjUkJJI0VSQQojV0hPT1BJR09MREJFUkcKI05PRFMjTk9NRSNFVEFUCiNFTUlUI0NBUEUjQUxUTwojREVOUyNIVFRQI1JFQVA="},{"title":"02/02/12 HAIR APPARENT","author":"S.N., edited by Stanley Newman","date":"2012-02-02","grid":"UkFUUyNQVEFTI0dOQVQjCkVaUkEjTE9VVCNST1BFIwpIQUlMI0FMREEjQU5URSMKQUxCRVJURUlOU1RFSU4jClNFQSNPRUQjRkVFI1RBVQpIQUxFWSNPRE9SI01VR1MKIyMjR0FCI09SQiNJREVBCiNQSFlMTElTRElMTEVSIwpEUklQI09ORSNBVUsjIyMKSkVUVCNXQVNQI0NZQkVSClNPUyNQVVAjUkJJI0VSQQojV0hPT1BJR09MREJFUkcKI05PRFMjTk9NRSNFVEFUCiNFTUlUI0NBUEUjQUxUTwojREVOUyNIVFRQI1JFQVA="},{"title":"02/03/12 CRACKPOTS","author":"Randall J. Hartman, edited by Stanley Newman","date":"2012-02-03","grid":"VEFMSyNNSUFNSSNBREFNCklST04jQUxWSU4jUElTQQpQT1dFUlBMQU5UI0VTUE4KSU1QRUkjI0lDRVMjR0VFCk5BSCNQT0xMRU5DT1VOVAojIyNQQU5FIyNUT05TIyMKR09FUiNMQUlDI1BFVEVSClBPTElDWVNUQVRFTUVOVApTSEFNVSNIQVJJI0FERFMKIyNCRVJUIyNQRUVOIyMjClBPT0RMRVNLSVJUI1NQQQpFQVIjWU1DQSMjT1VURVIKRVJBUyNQT1BDT05DRVJUClZFVE8jVE9QVVAjTEVJUwpFREVOI1NUQVJUI0FMTFk="},{"title":"02/03/12 CRACKPOTS","author":"Randall J. Hartman, edited by Stanley Newman","date":"2012-02-03","grid":"VEFMSyNNSUFNSSNBREFNCklST04jQUxWSU4jUElTQQpQT1dFUlBMQU5UI0VTUE4KSU1QRUkjI0lDRVMjR0VFCk5BSCNQT0xMRU5DT1VOVAojIyNQQU5FIyNUT05TIyMKR09FUiNMQUlDI1BFVEVSClBPTElDWVNUQVRFTUVOVApTSEFNVSNIQVJJI0FERFMKIyNCRVJUIyNQRUVOIyMjClBPT0RMRVNLSVJUI1NQQQpFQVIjWU1DQSMjT1VURVIKRVJBUyNQT1BDT05DRVJUClZFVE8jVE9QVVAjTEVJUwpFREVOI1NUQVJUI0FMTFk="},{"title":"02/04/12 SATURDAY STUMPER","author":"Anna Stiga, edited by Stanley Newman","date":"2012-02-04","grid":"TUFTVFMjQUNJRFRFU1RTCkFUVElDI1JPR0VSVEhBVApHT1VEQSNNSU5ORUhBSEEKSU5ORVJTT0xFI1hFRElOCkNBVFMjT1JFT1MjUkVORApBQkMjVEhFRFVLRSNESVMKQ0xBU0hFRCNTRUxMIyMjClRFUktFTCMjI1RXQU5HUwojIyNZSVBTI0FDRURPVVQKSVBPI1JNT05USFMjVE5UCk5MUkIjRU1PVEUjQ0FHRQpHQVBFUyNFTkVSR1lCQVIKRVRIQU5DT0VOI0FCT0RFClNUQVRJT05FRCNMRVZJUwpURU5TUEVFRFMjQVJFTkE="},{"title":"02/04/12 SATURDAY STUMPER","author":"Anna Stiga, edited by Stanley Newman","date":"2012-02-04","grid":"TUFTVFMjQUNJRFRFU1RTCkFUVElDI1JPR0VSVEhBVApHT1VEQSNNSU5ORUhBSEEKSU5ORVJTT0xFI1hFRElOCkNBVFMjT1JFT1MjUkVORApBQkMjVEhFRFVLRSNESVMKQ0xBU0hFRCNTRUxMIyMjClRFUktFTCMjI1RXQU5HUwojIyNZSVBTI0FDRURPVVQKSVBPI1JNT05USFMjVE5UCk5MUkIjRU1PVEUjQ0FHRQpHQVBFUyNFTkVSR1lCQVIKRVRIQU5DT0VOI0FCT0RFClNUQVRJT05FRCNMRVZJUwpURU5TUEVFRFMjQVJFTkE="},{"title":"02/05/12 SEE FOOD: From the sea, and not","author":"S.N., edited by Stanley Newman","date":"2012-02-05","grid":"RkVMVCNERU1PI01BVkVOI1BJRVRBCk9CT0UjRVRBTCNBS0lUQSNBTlRPTgpDUlVNQkNBS0UjQ1JFQU1FRENPUk4KSE9UUExBVEUjU0hPV1MjVVJBTklBCiMjI0VFTFMjQU1FTiMjQVJPTiMjIwpMWUNSQSMjQUxPVCNPUkdBTiNDSEUKQU9MI0NPVFRBR0VDSEVFU0UjUklEClBHQSNIQVNIIyNTT01BTEkjQ0FUUwpTQU1FI1JFRVNFI1RZUEVBI0FDTUUKRVNTQVlTI05PVE1FIyNTTk9SS0VMCiMjQ1JUI0NBU0hDUk9QUyNIUkUjIwpNQUFORFBBIyNBWElBTCNBTUlEU1QKRUxTRSNVTlBJTiNFVEFJTCNFQ0hPCk5PSVIjU05BUE9OIyNOQ0FBI1JVQgpTVU4jQ0hPQ09MQVRFQ0hJUCNBTEUKQURPI1JFTlRTI1lPTEsjI0FUQkFZCiMjI0dBRFMjI0FTSUYjQkFDSCMjIwpBUlJPWU8jVklEQUwjVEFSSEVFTFMKQ09UVE9OQ0FORFkjQ0VOVEVSQ1VUCkNMRUFOI0NOT1RFI1BFQVMjTU9SRQpURVNUUyNTRU5PUiNPTkxZI1NMRVc="},{"title":"02/05/12 SEE FOOD: From the sea, and not","author":"S.N., edited by Stanley Newman","date":"2012-02-05","grid":"RkVMVCNERU1PI01BVkVOI1BJRVRBCk9CT0UjRVRBTCNBS0lUQSNBTlRPTgpDUlVNQkNBS0UjQ1JFQU1FRENPUk4KSE9UUExBVEUjU0hPV1MjVVJBTklBCiMjI0VFTFMjQU1FTiMjQVJPTiMjIwpMWUNSQSMjQUxPVCNPUkdBTiNDSEUKQU9MI0NPVFRBR0VDSEVFU0UjUklEClBHQSNIQVNIIyNTT01BTEkjQ0FUUwpTQU1FI1JFRVNFI1RZUEVBI0FDTUUKRVNTQVlTI05PVE1FIyNTTk9SS0VMCiMjQ1JUI0NBU0hDUk9QUyNIUkUjIwpNQUFORFBBIyNBWElBTCNBTUlEU1QKRUxTRSNVTlBJTiNFVEFJTCNFQ0hPCk5PSVIjU05BUE9OIyNOQ0FBI1JVQgpTVU4jQ0hPQ09MQVRFQ0hJUCNBTEUKQURPI1JFTlRTI1lPTEsjI0FUQkFZCiMjI0dBRFMjI0FTSUYjQkFDSCMjIwpBUlJPWU8jVklEQUwjVEFSSEVFTFMKQ09UVE9OQ0FORFkjQ0VOVEVSQ1VUCkNMRUFOI0NOT1RFI1BFQVMjTU9SRQpURVNUUyNTRU5PUiNPTkxZI1NMRVc="},{"title":"02/06/12 HOW TO GET THERE","author":"Gail Grabowski, edited by Stanley Newman","date":"2012-02-06","grid":"Q0lURVMjQVBFUyNXSU5HCkFMT05FI0xJU1AjQVNJQQpGTFlTV0FUVEVSI0xFTlMKRVNTI1NXQVkjVVBLRUVQCiMjI1JPQVIjTkNBQSMjIwpTSFJVTksjI1lFTExTQVQKTE9JTiNFVEFMI1NMSUNFClVORE8jTk9OT1MjT1JFUwpST0dVRSNXQU5UI1ZFTlQKUFJFVEFQRSMjUExFTlRZCiMjI09WQUwjREVFUiMjIwpDSEFGRUQjUElUQSNNQUEKUkFORyNEUklWRVNIQUZUCkFSRUEjTEFORSNFQVRBVApCTVdTI0VZRVMjU1RFUk4="},{"title":"02/06/12 HOW TO GET THERE","author":"Gail Grabowski, edited by Stanley Newman","date":"2012-02-06","grid":"Q0lURVMjQVBFUyNXSU5HCkFMT05FI0xJU1AjQVNJQQpGTFlTV0FUVEVSI0xFTlMKRVNTI1NXQVkjVVBLRUVQCiMjI1JPQVIjTkNBQSMjIwpTSFJVTksjI1lFTExTQVQKTE9JTiNFVEFMI1NMSUNFClVORE8jTk9OT1MjT1JFUwpST0dVRSNXQU5UI1ZFTlQKUFJFVEFQRSMjUExFTlRZCiMjI09WQUwjREVFUiMjIwpDSEFGRUQjUElUQSNNQUEKUkFORyNEUklWRVNIQUZUCkFSRUEjTEFORSNFQVRBVApCTVdTI0VZRVMjU1RFUk4="},{"title":"02/07/12 WHY SO SORE?","author":"Sally R. Stein, edited by Stanley Newman","date":"2012-02-07","grid":"T05FUyNNRVNBIyNTV0FCCkRPTEUjRVhBTVMjT0hJTwpJRE9MI05JWE9OI1BPUlQKU1VQRVJTVE9SRSNIQVNIClRIRVNJUyNORUFUTyMjIwojIyMjUEhEIyNLSU1PTk8KTUlTUyNPUkVTI05PTUFECkFOVEkjUEVSSUwjUklORApTVEFORCNXQU5FI0VUQVMKVE9ZR1VOIyNHQVMjIyMjCiMjI0FCT0RFI1JPU1RFUgpHQVNQI1NFVkVOU0NPUkUKT0hOTyNJTkFXRSNBTk9OClNPQVIjUklERVIjTUFERQpIWVBFIyNNRVNTI1NMRVc="},{"title":"02/07/12 WHY SO SORE?","author":"Sally R. Stein, edited by Stanley Newman","date":"2012-02-07","grid":"T05FUyNNRVNBIyNTV0FCCkRPTEUjRVhBTVMjT0hJTwpJRE9MI05JWE9OI1BPUlQKU1VQRVJTVE9SRSNIQVNIClRIRVNJUyNORUFUTyMjIwojIyMjUEhEIyNLSU1PTk8KTUlTUyNPUkVTI05PTUFECkFOVEkjUEVSSUwjUklORApTVEFORCNXQU5FI0VUQVMKVE9ZR1VOIyNHQVMjIyMjCiMjI0FCT0RFI1JPU1RFUgpHQVNQI1NFVkVOU0NPUkUKT0hOTyNJTkFXRSNBTk9OClNPQVIjUklERVIjTUFERQpIWVBFIyNNRVNTI1NMRVc="},{"title":"02/08/12 RECYCLING DAY","author":"Billie Truitt, edited by Stanley Newman","date":"2012-02-08","grid":"U0hJTSNHSVNUI1NJQ0VNCkNBVE8jT01BUiNVU0FHRQpBUklEI1RBQ08jUEVST1QKUkVTRUFSQ0hQQVBFUiMjCiNNSUxMSSNTSUxMI0VUQwojIyNUSURZI0NMRUFORVIKU0tJI0JPQVQjIyNJVE5PCk1BR05JRllJTkdHTEFTUwpPUFVTIyMjUE9PUiNMRVMKQ1VFQ0FSRCNXRUVEIyMjCktUUyNJT1VTI1NFRURZIwojI1NQUklOS0xJTkdDQU4KREVOSU0jRElPTiNSRU5PCkVWT0tFI0VMTU8jRUxLUwpFQVRFTiNFTEFOI0VMU0U="},{"title":"02/08/12 RECYCLING DAY","author":"Billie Truitt, edited by Stanley Newman","date":"2012-02-08","grid":"U0hJTSNHSVNUI1NJQ0VNCkNBVE8jT01BUiNVU0FHRQpBUklEI1RBQ08jUEVST1QKUkVTRUFSQ0hQQVBFUiMjCiNNSUxMSSNTSUxMI0VUQwojIyNUSURZI0NMRUFORVIKU0tJI0JPQVQjIyNJVE5PCk1BR05JRllJTkdHTEFTUwpPUFVTIyMjUE9PUiNMRVMKQ1VFQ0FSRCNXRUVEIyMjCktUUyNJT1VTI1NFRURZIwojI1NQUklOS0xJTkdDQU4KREVOSU0jRElPTiNSRU5PCkVWT0tFI0VMTU8jRUxLUwpFQVRFTiNFTEFOI0VMU0U="},{"title":"02/09/12 AUDUBON SOCIETY","author":"David W. Cromer, edited by Stanley Newman","date":"2012-02-09","grid":"RUFSVEgjI0hVUlQjUkFNCkFMT0hBI01PUEVSI09ERQpSQVZFTlNZTU9ORSNCQVQKTElFTiNFTUlORU0jSVBPCiMjI1JFRFlFI0dPSU5UTwpEQU1BR0UjI0ZFUkFMIyMKSVJBI09SQ0hJRCNHRUVLClBFUk1TI0FPTCNTT0FWRQpTQVRFI0dSRUFTRSNDQU4KIyNJTlBVVCMjVEVDSE5PClRBTkRFTSNTQ09SRSMjIwpFQVIjQVNIVE9OI0xBTUEKTVJJI1JIRUFQRVJMTUFOClBPVCNMT1JORSNDQUlSTwpUTlQjU0VFRCMjQVJERU4="},{"title":"02/09/12 AUDUBON SOCIETY","author":"David W. Cromer, edited by Stanley Newman","date":"2012-02-09","grid":"RUFSVEgjI0hVUlQjUkFNCkFMT0hBI01PUEVSI09ERQpSQVZFTlNZTU9ORSNCQVQKTElFTiNFTUlORU0jSVBPCiMjI1JFRFlFI0dPSU5UTwpEQU1BR0UjI0ZFUkFMIyMKSVJBI09SQ0hJRCNHRUVLClBFUk1TI0FPTCNTT0FWRQpTQVRFI0dSRUFTRSNDQU4KIyNJTlBVVCMjVEVDSE5PClRBTkRFTSNTQ09SRSMjIwpFQVIjQVNIVE9OI0xBTUEKTVJJI1JIRUFQRVJMTUFOClBPVCNMT1JORSNDQUlSTwpUTlQjU0VFRCMjQVJERU4="},{"title":"02/10/12 THEY'RE NO GOOD","author":"Richard Silvestri, edited by Stanley Newman","date":"2012-02-10","grid":"U0xBTSNTTE9CI0ZBUkVTCkFVVE8jUE9SRSNBVE9MTApTTE9XI0lERUEjTEVBS1kKU1VOTklOR01VU0xJTVMjCiMjIyNSWUUjI1BFTiMjIwpBVUdVUiNEUkFJTiNDT00KU1RFUkVPI0lSSyNBUkdPClBST05HQkFTS0VUQkFMTApDQURTI0VXRSNERUxWRUQKQVBFI1RSRU5UI05FRURZCiMjI1NITyMjQVNTIyMjIwojUVVFRU5PRlNIRUJBTkcKVFVORVIjUElUQSNPSElPCkJJVFRFI0VWRVIjWkVOTwpTVE9PRCNORVJEI09NRU4="},{"title":"02/10/12 THEY'RE NO GOOD","author":"Richard Silvestri, edited by Stanley Newman","date":"2012-02-10","grid":"U0xBTSNTTE9CI0ZBUkVTCkFVVE8jUE9SRSNBVE9MTApTTE9XI0lERUEjTEVBS1kKU1VOTklOR01VU0xJTVMjCiMjIyNSWUUjI1BFTiMjIwpBVUdVUiNEUkFJTiNDT00KU1RFUkVPI0lSSyNBUkdPClBST05HQkFTS0VUQkFMTApDQURTI0VXRSNERUxWRUQKQVBFI1RSRU5UI05FRURZCiMjI1NITyMjQVNTIyMjIwojUVVFRU5PRlNIRUJBTkcKVFVORVIjUElUQSNPSElPCkJJVFRFI0VWRVIjWkVOTwpTVE9PRCNORVJEI09NRU4="},{"title":"02/11/12 SATURDAY STUMPER","author":"Doug Peterson, edited by Stanley Newman","date":"2012-02-11","grid":"RURJVElORyNPUklHQU1JClJPTUFOSUEjQ09OSUNBTApST09NS0VZI0hPR0JBQ0sKT05VUyNDTEVPI09CSUVTCkxFVCNaRUVTI0JPUyMjIwojU0FMRVMjUFJPRCNDQ0wKQUJIT1IjR0xBU1NXQVJFCkhVRVZPU1JBTkNIRVJPUwpBUlJFU1RJTkcjQU5HU1QKQllFI1VMTkEjVVBET1MjCiMjI0lNTyNESU5FI0hFVApBV0lORyNGRU1BI0xPREUKVE9PTEFURSNBQlNBTE9NCkFSVEVNSVMjQ0xPVURVUApETkFURVNUI1NFTkRTVE8="},{"title":"02/11/12 SATURDAY STUMPER","author":"Doug Peterson, edited by Stanley Newman","date":"2012-02-11","grid":"RURJVElORyNPUklHQU1JClJPTUFOSUEjQ09OSUNBTApST09NS0VZI0hPR0JBQ0sKT05VUyNDTEVPI09CSUVTCkxFVCNaRUVTI0JPUyMjIwojU0FMRVMjUFJPRCNDQ0wKQUJIT1IjR0xBU1NXQVJFCkhVRVZPU1JBTkNIRVJPUwpBUlJFU1RJTkcjQU5HU1QKQllFI1VMTkEjVVBET1MjCiMjI0lNTyNESU5FI0hFVApBV0lORyNGRU1BI0xPREUKVE9PTEFURSNBQlNBTE9NCkFSVEVNSVMjQ0xPVURVUApETkFURVNUI1NFTkRTVE8="},{"title":"02/12/12 PLACES TO PLAY: Across the sports spectrum","author":"Gail Grabowski, edited by Stanley Newman","date":"2012-02-12","grid":"QVBQUyNIT09QI0dBUkJPI0dBTUVTCk1PTEUjT1JTTyNBVEVVUCNBREFHRQpGTEFUI1RJTEwjQk9PTkUjU1VSR0UKTU9UT1JQT09MI0JMSU5EQUxMRVkjCiMjI05PT04jI0tFTExZI0NPVCMjIwpTQU5FU1QjU1RJUlMjI1dJRyNXQVMKQU1FTlMjU1BJTiMjQ0xBRCMjRUxJCkxBSUQjQ0hBTkdFQ09VUlNFI0RJRwpFTkwjU0hBRCNTTk9PVFMjTEFERU4KTUFERVRJTUUjI1RBUEUjQkFTSU5TCiMjSUNPTlMjU1RJTFQjR0VUSU4jIwpBTEFSTVMjREFSVCMjU0VBRUFHTEUKREFNVVAjT09MQUxBI09OVVMjUkVWCkRVTyNTVVBSRU1FQ09VUlQjSElWRQpFUk4jI1NVTVMjI1RVTkUjRklORVIKREFEI0JVUyMjU1dPUkQjV0lHR0xZCiMjI0JBUiNTVEFJTiMjQ0FTSCMjIwojU0FMTFlGSUVMRCNGQVNUVFJBQ0sKTE9DQUwjQUxFVVQjQUxQRSNJUkFOClBVUlNFI01PTlRII1JPQVIjU0lSRQpTTEVFVCNFU1NFUyNFRU5ZI0tBVEU="},{"title":"02/12/12 PLACES TO PLAY: Across the sports spectrum","author":"Gail Grabowski, edited by Stanley Newman","date":"2012-02-12","grid":"QVBQUyNIT09QI0dBUkJPI0dBTUVTCk1PTEUjT1JTTyNBVEVVUCNBREFHRQpGTEFUI1RJTEwjQk9PTkUjU1VSR0UKTU9UT1JQT09MI0JMSU5EQUxMRVkjCiMjI05PT04jI0tFTExZI0NPVCMjIwpTQU5FU1QjU1RJUlMjI1dJRyNXQVMKQU1FTlMjU1BJTiMjQ0xBRCMjRUxJCkxBSUQjQ0hBTkdFQ09VUlNFI0RJRwpFTkwjU0hBRCNTTk9PVFMjTEFERU4KTUFERVRJTUUjI1RBUEUjQkFTSU5TCiMjSUNPTlMjU1RJTFQjR0VUSU4jIwpBTEFSTVMjREFSVCMjU0VBRUFHTEUKREFNVVAjT09MQUxBI09OVVMjUkVWCkRVTyNTVVBSRU1FQ09VUlQjSElWRQpFUk4jI1NVTVMjI1RVTkUjRklORVIKREFEI0JVUyMjU1dPUkQjV0lHR0xZCiMjI0JBUiNTVEFJTiMjQ0FTSCMjIwojU0FMTFlGSUVMRCNGQVNUVFJBQ0sKTE9DQUwjQUxFVVQjQUxQRSNJUkFOClBVUlNFI01PTlRII1JPQVIjU0lSRQpTTEVFVCNFU1NFUyNFRU5ZI0tBVEU="},{"title":"02/13/12 IT'S YOU AND ME","author":"Gail Grabowski, edited by Stanley Newman","date":"2012-02-13","grid":"U1RBRyNTV0lTUyNTUEFTCkNBUkUjVEVNUEUjVE9HQQpBQkVUI0FMT0FOI0FQRVMKQk9OVVNST1VORCNURU5TClNPQVBJRVNUIyNEVVNUWQojIyMjRFNUI0FXRVMjIyMKUEVBQ0UjI1RSQU5RVUlMCkFOVEkjUFVOVFMjVU5ETwpMRUVSSUVTVCMjUk9PU1QKIyMjQ09ORSNTVFkjIyMjClJFUlVOIyNUSFJFQVRFTgpBTEVTI0NIT1JVU0xJTkUKQ09MQSNQQVBBUyNPQVRTCkVQSUMjQUhJTlQjRlJFVApTRUNUI1NBQ0tTI1RBUlM="},{"title":"02/13/12 IT'S YOU AND ME","author":"Gail Grabowski, edited by Stanley Newman","date":"2012-02-13","grid":"U1RBRyNTV0lTUyNTUEFTCkNBUkUjVEVNUEUjVE9HQQpBQkVUI0FMT0FOI0FQRVMKQk9OVVNST1VORCNURU5TClNPQVBJRVNUIyNEVVNUWQojIyMjRFNUI0FXRVMjIyMKUEVBQ0UjI1RSQU5RVUlMCkFOVEkjUFVOVFMjVU5ETwpMRUVSSUVTVCMjUk9PU1QKIyMjQ09ORSNTVFkjIyMjClJFUlVOIyNUSFJFQVRFTgpBTEVTI0NIT1JVU0xJTkUKQ09MQSNQQVBBUyNPQVRTCkVQSUMjQUhJTlQjRlJFVApTRUNUI1NBQ0tTI1RBUlM="},{"title":"02/14/12 AT THE RACES","author":"Billie Truitt, edited by Stanley Newman","date":"2012-02-14","grid":"U0hBRFkjU09TQUQjR0FTCk5JVFJPI1VOVElFI09MRQpBTE9VRCNTVElMVCNMSUUKUE9NTUVMSE9SU0UjREFECiMjIyNMRUkjIyNDSEVTUwpTT0RERUQjRkFTVEVOIyMKUFJJT1IjTElNTyNBR0VTClJFU1QjTEFUSU4jUkFWRQpZT0tFI0FWSUQjQVRURU4KIyNKT1JEQU4jSU5TRVJUClNUT05FIyMjQk9PIyMjIwpUSUMjQkVBVEVOVFJBQ0sKT0FLI0FSU09OI0hPUElOCk9SRSNUQUlOVCNFTElURQpQQVkjRVNTRVMjUkVORVc="},{"title":"02/14/12 AT THE RACES","author":"Billie Truitt, edited by Stanley Newman","date":"2012-02-14","grid":"U0hBRFkjU09TQUQjR0FTCk5JVFJPI1VOVElFI09MRQpBTE9VRCNTVElMVCNMSUUKUE9NTUVMSE9SU0UjREFECiMjIyNMRUkjIyNDSEVTUwpTT0RERUQjRkFTVEVOIyMKUFJJT1IjTElNTyNBR0VTClJFU1QjTEFUSU4jUkFWRQpZT0tFI0FWSUQjQVRURU4KIyNKT1JEQU4jSU5TRVJUClNUT05FIyMjQk9PIyMjIwpUSUMjQkVBVEVOVFJBQ0sKT0FLI0FSU09OI0hPUElOCk9SRSNUQUlOVCNFTElURQpQQVkjRVNTRVMjUkVORVc="},{"title":"02/15/12 PIECE OF WORK","author":"Norma Steinberg, edited by Stanley Newman","date":"2012-02-15","grid":"UElLRVIjSVBBRCNGRVVEClNUQUxFI05JTkEjT01OSQpBQ1RJVkVEVVRZI09JTFMKVEhZI0VYRVMjR0FMTElDCiMjI1RSSVgjQkFTU0VUUwpTUVVBVFMjVEVNUEUjIyMKVFVSSyNUSE9TRSNSQklTCkFJREUjI0FMVCMjUk9ERQpCVFVTI0dVRVNTI0FORVcKIyMjVEFVTlQjUEFOREFTCkFDUk9CQVQjRlVORCMjIwpORVVURVIjQlVSVCNBTUEKTkFQQSNET0VTVEhFSk9CClVTRVMjRVJBUyNFVkFERQpMRUVLI0RFTlkjTUFYRUQ="},{"title":"02/15/12 PIECE OF WORK","author":"Norma Steinberg, edited by Stanley Newman","date":"2012-02-15","grid":"UElLRVIjSVBBRCNGRVVEClNUQUxFI05JTkEjT01OSQpBQ1RJVkVEVVRZI09JTFMKVEhZI0VYRVMjR0FMTElDCiMjI1RSSVgjQkFTU0VUUwpTUVVBVFMjVEVNUEUjIyMKVFVSSyNUSE9TRSNSQklTCkFJREUjI0FMVCMjUk9ERQpCVFVTI0dVRVNTI0FORVcKIyMjVEFVTlQjUEFOREFTCkFDUk9CQVQjRlVORCMjIwpORVVURVIjQlVSVCNBTUEKTkFQQSNET0VTVEhFSk9CClVTRVMjRVJBUyNFVkFERQpMRUVLI0RFTlkjTUFYRUQ="},{"title":"02/16/12 EXTRA ALLOWANCE","author":"Fred Piscop, edited by Stanley Newman","date":"2012-02-16","grid":"TE9FV1MjTEFNQiNNQUdJCk9QVElOI0FMT0UjT05FSwpHRUNLTyNCQUpBI09HTEUKI0NISUNLRU5PVVRMRVQjCiMjIyNBT0wjIyNIQUwjIwpDQVJBVFMjS0FORSNGT0IKQUdFUyMjU09XRUQjQVBFClBJQ0tVUFRIRVRBQkxFVApFTEkjQ09VTEQjI09MRFMKUkVQI09XTlMjR1JBU1NZCiMjUk9OIyMjU1BBIyMjIwojQ09VTlRSWUhBTUxFVCMKQVJDUyNIT1VSI1JJRE9GCk1FQVQjQUJMRSNPTUVHQQpBV0xTI1dFRUsjRE9OT1I="},{"title":"02/16/12 EXTRA ALLOWANCE","author":"Fred Piscop, edited by Stanley Newman","date":"2012-02-16","grid":"TE9FV1MjTEFNQiNNQUdJCk9QVElOI0FMT0UjT05FSwpHRUNLTyNCQUpBI09HTEUKI0NISUNLRU5PVVRMRVQjCiMjIyNBT0wjIyNIQUwjIwpDQVJBVFMjS0FORSNGT0IKQUdFUyMjU09XRUQjQVBFClBJQ0tVUFRIRVRBQkxFVApFTEkjQ09VTEQjI09MRFMKUkVQI09XTlMjR1JBU1NZCiMjUk9OIyMjU1BBIyMjIwojQ09VTlRSWUhBTUxFVCMKQVJDUyNIT1VSI1JJRE9GCk1FQVQjQUJMRSNPTUVHQQpBV0xTI1dFRUsjRE9OT1I="},{"title":"02/17/12 WHERE'S THE 58 DOWN?","author":"Bruce Venzke, edited by Stanley Newman","date":"2012-02-17","grid":"R0lHUyNPV05TI0ZFVEFMClVUQUgjU0hFUyNVTkFHSQpMT1JFI0JPWFRVUlRMRVMKRk9SRUZPT1QjRk9SRVNUCiMjI1NMUiMjRE9SQSMjIwpKVUdIQU5ETEVTI0NIQVAKSVNSI1hFUk9YI1NUQVJFCkxFQVZFI0FOVCNNRVJJVApUSVRBTiNNRUVTRSNQRUEKU1RBTiNCQVJSRUxST0xMCiMjI1pPT1MjI1BUQSMjIwpBTUJFUlMjQ0FUU01FT1cKQk9UVExFTk9TRSNKVURJCkJMVVRPI0ZMQVQjRVJJTgpSRVNJTiNMQVBTI1RPTkU="},{"title":"02/17/12 WHERE'S THE 58 DOWN?","author":"Bruce Venzke, edited by Stanley Newman","date":"2012-02-17","grid":"R0lHUyNPV05TI0ZFVEFMClVUQUgjU0hFUyNVTkFHSQpMT1JFI0JPWFRVUlRMRVMKRk9SRUZPT1QjRk9SRVNUCiMjI1NMUiMjRE9SQSMjIwpKVUdIQU5ETEVTI0NIQVAKSVNSI1hFUk9YI1NUQVJFCkxFQVZFI0FOVCNNRVJJVApUSVRBTiNNRUVTRSNQRUEKU1RBTiNCQVJSRUxST0xMCiMjI1pPT1MjI1BUQSMjIwpBTUJFUlMjQ0FUU01FT1cKQk9UVExFTk9TRSNKVURJCkJMVVRPI0ZMQVQjRVJJTgpSRVNJTiNMQVBTI1RPTkU="},{"title":"02/18/12 SATURDAY STUMPER","author":"Lester Ruff, edited by Stanley Newman","date":"2012-02-18","grid":"T0ZGRVJFRCNDQVNUT0ZGClJJT0xPQk8jT0NFQU5JQQpFUk9TSU9OI1NUQVBMRVIKR0VMI0xPT1NFU1QjRUxNCkFCRVQjS1JPQyNTSEFERQpOT1JBRCNTV0FQI09WRVIKT1hZR0VOI1NOQVJMRVJTCiMjI1NOQUcjVElFUyMjIwpTVFJBWURPRyNSRVRBUkQKSEVBTCNBTEFTI0xFVkVFCklOVEVMI0ZMQVAjUk9DSwpQU0kjQVBQQUxMUyNDT0wKUElORVRBUiNNQU5DQVZFCkVMR1JFQ08jT05PUkRFUgpERVNFUlRTI05FV1lPUks="},{"title":"02/18/12 SATURDAY STUMPER","author":"Lester Ruff, edited by Stanley Newman","date":"2012-02-18","grid":"T0ZGRVJFRCNDQVNUT0ZGClJJT0xPQk8jT0NFQU5JQQpFUk9TSU9OI1NUQVBMRVIKR0VMI0xPT1NFU1QjRUxNCkFCRVQjS1JPQyNTSEFERQpOT1JBRCNTV0FQI09WRVIKT1hZR0VOI1NOQVJMRVJTCiMjI1NOQUcjVElFUyMjIwpTVFJBWURPRyNSRVRBUkQKSEVBTCNBTEFTI0xFVkVFCklOVEVMI0ZMQVAjUk9DSwpQU0kjQVBQQUxMUyNDT0wKUElORVRBUiNNQU5DQVZFCkVMR1JFQ08jT05PUkRFUgpERVNFUlRTI05FV1lPUks="},{"title":"02/19/12 FORESIGHT: Making a round trip","author":"David W. Cromer, edited by Stanley Newman","date":"2012-02-19","grid":"Q0FTUEFSIyMjTUVBTCNQUk9TQUlDCkFUVElMQSNFVklOQ0UjQUFNSUxORQpXQVJORUQjQkVMTEVPRlRIRUJBTEwKRVJJRSNBVE9ORSMjU1RFUk4jTUFMCkRJTk5FUkNPVVJTRSNETkEjV09XUwojI0dVWSNVS0UjT1dFI1RIQUkjIyMKTUlUVEVOIyNTQU1FQVMjI1NMRUVUClBBUiNTQUNLI1NFUlZJQ0VDTFVCUwpBTUlFI1BPRU1TI1NFTkFURSNSQVAKQUJPVkUjUkVORUUjIyNCQVRCT1lTCiMjI0lDQU5OT1RURUxMQUxJRSMjIwpJRFlMTElDIyMjQVZJQU4jQ0FNVVMKUkFNI0FST01BUyNFQ0xBVCNOQVNBCkFSQ0hJRUJVTktFUiNBU0FQI1JNUwpTVEFJUiMjU1RJTlRTIyNNVU5JQ0gKIyMjU1NUUyNTUFkjVU1BI0xBTyMjCk1BVFMjT1VUI1NBVVNBR0VMSU5LUwpUV08jQ09DT0EjI1BITk9NI0xFTkEKV0FUQ0hUSEVCSVJESUUjQkFUVEVOClRSQUxBTEEjRU1CT1NTI0VESVRFRApGRUxJTkVTI0RBSVMjIyNSRVBFTFM="},{"title":"02/19/12 FORESIGHT: Making a round trip","author":"David W. Cromer, edited by Stanley Newman","date":"2012-02-19","grid":"Q0FTUEFSIyMjTUVBTCNQUk9TQUlDCkFUVElMQSNFVklOQ0UjQUFNSUxORQpXQVJORUQjQkVMTEVPRlRIRUJBTEwKRVJJRSNBVE9ORSMjU1RFUk4jTUFMCkRJTk5FUkNPVVJTRSNETkEjV09XUwojI0dVWSNVS0UjT1dFI1RIQUkjIyMKTUlUVEVOIyNTQU1FQVMjI1NMRUVUClBBUiNTQUNLI1NFUlZJQ0VDTFVCUwpBTUlFI1BPRU1TI1NFTkFURSNSQVAKQUJPVkUjUkVORUUjIyNCQVRCT1lTCiMjI0lDQU5OT1RURUxMQUxJRSMjIwpJRFlMTElDIyMjQVZJQU4jQ0FNVVMKUkFNI0FST01BUyNFQ0xBVCNOQVNBCkFSQ0hJRUJVTktFUiNBU0FQI1JNUwpTVEFJUiMjU1RJTlRTIyNNVU5JQ0gKIyMjU1NUUyNTUFkjVU1BI0xBTyMjCk1BVFMjT1VUI1NBVVNBR0VMSU5LUwpUV08jQ09DT0EjI1BITk9NI0xFTkEKV0FUQ0hUSEVCSVJESUUjQkFUVEVOClRSQUxBTEEjRU1CT1NTI0VESVRFRApGRUxJTkVTI0RBSVMjIyNSRVBFTFM="},{"title":"02/20/12 OPPOSITE CHOICES","author":"Gail Grabowski, edited by Stanley Newman","date":"2012-02-20","grid":"U1RFTk8jU1dBUCNTQUdBCkxPRkFUI1ZBU0UjSVJBUwpBRE9QVCNFRElUI05FVFMKTU9SRU9STEVTUyNLTkVFCiMjIyNNQVRTIyNUT0FTVApQUkVHQU1FI1RJRVIjIyMKU0lUSU4jI1NJREVTVEVQClNMQVYjU0VFUFMjV0FWRQpURUxFVklTRSMjTElNRVMKIyMjT0FSUyNFTEVNRU5UClNNQVJUIyNGUkVFIyMjIwpXRVNUI0JPT01PUkJVU1QKQVRUQSNNQVlJI1NPUlRBClRSRUsjV0hFTiNBTkdFUgpTT1JFI1NVUkUjVEVFTVM="},{"title":"02/20/12 OPPOSITE CHOICES","author":"Gail Grabowski, edited by Stanley Newman","date":"2012-02-20","grid":"U1RFTk8jU1dBUCNTQUdBCkxPRkFUI1ZBU0UjSVJBUwpBRE9QVCNFRElUI05FVFMKTU9SRU9STEVTUyNLTkVFCiMjIyNNQVRTIyNUT0FTVApQUkVHQU1FI1RJRVIjIyMKU0lUSU4jI1NJREVTVEVQClNMQVYjU0VFUFMjV0FWRQpURUxFVklTRSMjTElNRVMKIyMjT0FSUyNFTEVNRU5UClNNQVJUIyNGUkVFIyMjIwpXRVNUI0JPT01PUkJVU1QKQVRUQSNNQVlJI1NPUlRBClRSRUsjV0hFTiNBTkdFUgpTT1JFI1NVUkUjVEVFTVM="},{"title":"02/21/12 VIOLET BOUQUET","author":"Billie Truitt, edited by Stanley Newman","date":"2012-02-21","grid":"U1VJVCNFQ09MI0NBU1RTCk9OQ0UjTE9ERSNPUEVSQQpBREFNI1NNT0cjTUVMT04KUFVSUExFUFJPU0UjTFREClNFRVRPIyMjU0hJTiMjIwojIyNTVFJBUCNPTkVXQVkKQVBQI1RFTExFUiNPSE5PClBMVU1PUFBPUlRVTklUWQpURUxFI0xPREdFUyNSSU8KU0FMQU1JI1NPTkFSIyMjCiMjI05JQ0UjIyNHRVRBQgpBR08jTEFWRU5ERVJPSUwKQk9SRUQjQUJPTyNVU0RBCkNBTkFMI0RBVEUjTkVFRApTVE9SWSNFWUVTI1NBU0U="},{"title":"02/21/12 VIOLET BOUQUET","author":"Billie Truitt, edited by Stanley Newman","date":"2012-02-21","grid":"U1VJVCNFQ09MI0NBU1RTCk9OQ0UjTE9ERSNPUEVSQQpBREFNI1NNT0cjTUVMT04KUFVSUExFUFJPU0UjTFREClNFRVRPIyMjU0hJTiMjIwojIyNTVFJBUCNPTkVXQVkKQVBQI1RFTExFUiNPSE5PClBMVU1PUFBPUlRVTklUWQpURUxFI0xPREdFUyNSSU8KU0FMQU1JI1NPTkFSIyMjCiMjI05JQ0UjIyNHRVRBQgpBR08jTEFWRU5ERVJPSUwKQk9SRUQjQUJPTyNVU0RBCkNBTkFMI0RBVEUjTkVFRApTVE9SWSNFWUVTI1NBU0U="},{"title":"02/22/12 SMOOTH IT OUT","author":"Fred Piscop, edited by Stanley Newman","date":"2012-02-22","grid":"RE9NRSNCT1NTI1BMQU5UCkFWSUQjQU5USSNST1ZFUgpCQU5FI0JFQUsjRU1PUlkKI0xJTkVJTlRIRVNBTkQjCiMjIyNYRUQjI0JFTiMjIwpQQUlOVFMjREVCVCNQVEEKQURERVIjRlJFRSNCT0lMClRIRVNBTUVPTERHUklORApDT0FUI0lMTFMjUkFOR0UKSENMI0ZBTEwjT1VTVEVSCiMjI1NBTSMjQVBFIyMjIwojSU5DTElORURQTEFORSMKU05PT1QjT1JFTyNNRVJFCkFUT05FI1JJUFMjSVJJUwpQT0tFUiNNRVRFI0RPTlQ="},{"title":"02/22/12 SMOOTH IT OUT","author":"Fred Piscop, edited by Stanley Newman","date":"2012-02-22","grid":"RE9NRSNCT1NTI1BMQU5UCkFWSUQjQU5USSNST1ZFUgpCQU5FI0JFQUsjRU1PUlkKI0xJTkVJTlRIRVNBTkQjCiMjIyNYRUQjI0JFTiMjIwpQQUlOVFMjREVCVCNQVEEKQURERVIjRlJFRSNCT0lMClRIRVNBTUVPTERHUklORApDT0FUI0lMTFMjUkFOR0UKSENMI0ZBTEwjT1VTVEVSCiMjI1NBTSMjQVBFIyMjIwojSU5DTElORURQTEFORSMKU05PT1QjT1JFTyNNRVJFCkFUT05FI1JJUFMjSVJJUwpQT0tFUiNNRVRFI0RPTlQ="},{"title":"02/23/12 TAKE TWO","author":"David W. Cromer, edited by Stanley Newman","date":"2012-02-23","grid":"QUNUI0FHSUxFIyNPTUlUCkhPVyNEUk9PTFMjUE9NRQpFTEkjRE9VQkxFSEVMSVgKTUFOVFJBUyNFTUlORU5UCiMjQ09FTiNHUklORCMjIwpBRElPUyNQQVkjR0FCT04KTkVUI1NUSVIjUkVUSU5BCkdMSUIjS0VBTlUjRU5JRApFVkVSU08jR09ORyNBQ0UKUkVTSU4jTkVXI1JBUkVSCiMjI1RPV0VEI0hPTFkjIwpGTFlUUkFQI01BVElTU0UKRFVBTEVYSEFVU1QjVE9ZCklTTEUjWUVMTFRPI0FSRQpDSEVSIyNXQUxFUyNSRUQ="},{"title":"02/23/12 TAKE TWO","author":"David W. Cromer, edited by Stanley Newman","date":"2012-02-23","grid":"QUNUI0FHSUxFIyNPTUlUCkhPVyNEUk9PTFMjUE9NRQpFTEkjRE9VQkxFSEVMSVgKTUFOVFJBUyNFTUlORU5UCiMjQ09FTiNHUklORCMjIwpBRElPUyNQQVkjR0FCT04KTkVUI1NUSVIjUkVUSU5BCkdMSUIjS0VBTlUjRU5JRApFVkVSU08jR09ORyNBQ0UKUkVTSU4jTkVXI1JBUkVSCiMjI1RPV0VEI0hPTFkjIwpGTFlUUkFQI01BVElTU0UKRFVBTEVYSEFVU1QjVE9ZCklTTEUjWUVMTFRPI0FSRQpDSEVSIyNXQUxFUyNSRUQ="},{"title":"02/24/12 SHOPPING SLIGHTS","author":"S.N., edited by Stanley Newman","date":"2012-02-24","grid":"UklTRSNUQlNQI1NNSUxFCkFTSUEjQVJJQSNUVU5FUwpCQVRTI0JPTEwjQUVTT1AKQkFCWUJMT09NRVJTIyMjCklDWSNFRUsjRUFSTE9CRQojIyNQRFQjRERTI0lQT0QKQVdHRUUjQk9PRUQjVEFJClNIRVJXT09ERkxPUklTVApQQVQjU1BPT0YjR0VOVFMKRU1JVCNDQlMjQVRNIyMjCk5PVEFCSVQjUFRBI0NJQQojIyNOQVRVUkFMR0xBU1MKRFVDS1MjQkVUQSNJRExZCklNUEVJI0VBVFMjRlJFRQpTUEFSUyNTTElUI1RFU1Q="},{"title":"02/24/12 SHOPPING SLIGHTS","author":"S.N., edited by Stanley Newman","date":"2012-02-24","grid":"UklTRSNUQlNQI1NNSUxFCkFTSUEjQVJJQSNUVU5FUwpCQVRTI0JPTEwjQUVTT1AKQkFCWUJMT09NRVJTIyMjCklDWSNFRUsjRUFSTE9CRQojIyNQRFQjRERTI0lQT0QKQVdHRUUjQk9PRUQjVEFJClNIRVJXT09ERkxPUklTVApQQVQjU1BPT0YjR0VOVFMKRU1JVCNDQlMjQVRNIyMjCk5PVEFCSVQjUFRBI0NJQQojIyNOQVRVUkFMR0xBU1MKRFVDS1MjQkVUQSNJRExZCklNUEVJI0VBVFMjRlJFRQpTUEFSUyNTTElUI1RFU1Q="},{"title":"02/25/12 SATURDAY STUMPER","author":"Brad Wilber, edited by Stanley Newman","date":"2012-02-25","grid":"V0hFTEtTI0FTV0VMTEFTCkhPR0FOUyNORUFSRUFTVApBTkdMRVIjR0FSREVOSUEKVE9UQUwjUk9UVEVSREFNCkFMSSNUSEFMRVMjI0VHTwpIVU1TI0VHQUQjTVNET1MKQUxFVVRJQU4jRElBIyMjCk1VUk1VUlMjSE9STkVUUwojIyNBQlMjTU9ORVlQSVQKQ0lSQ0UjVkVUTyNPSE5PCkFCVSMjU0lORVdTI0VTUApTRU1JUlVSQUwjQ0FNRUwKQlJPTUlESUMjUE9NRUxPCkFJUkVEQUxFI1RXSVJMUwpIQVNURU5FRCNBU1NBWVM="},{"title":"02/25/12 SATURDAY STUMPER","author":"Brad Wilber, edited by Stanley Newman","date":"2012-02-25","grid":"V0hFTEtTI0FTV0VMTEFTCkhPR0FOUyNORUFSRUFTVApBTkdMRVIjR0FSREVOSUEKVE9UQUwjUk9UVEVSREFNCkFMSSNUSEFMRVMjI0VHTwpIVU1TI0VHQUQjTVNET1MKQUxFVVRJQU4jRElBIyMjCk1VUk1VUlMjSE9STkVUUwojIyNBQlMjTU9ORVlQSVQKQ0lSQ0UjVkVUTyNPSE5PCkFCVSMjU0lORVdTI0VTUApTRU1JUlVSQUwjQ0FNRUwKQlJPTUlESUMjUE9NRUxPCkFJUkVEQUxFI1RXSVJMUwpIQVNURU5FRCNBU1NBWVM="},{"title":"02/26/12 TAKING THE CAKE: In various apt ways","author":"Fred Piscop, edited by Stanley Newman","date":"2012-02-26","grid":"R1BBIyNNSUxBTiNDTEFQI1NDRU5FClVSTlMjSURBSE8jUkFTSCNXQUdFRApMSUtFRFRPSEFOR1VQU0lERURPV04KUEFMTEVUUyMjI1JFU1QjT0RFU1NBClNNRUxMIyMjU1dBTEUjQlJJVCMjIwojIyNTVFAjU0VFUCMjTE9JUyNCQUgKSVRTI0FDVEVEVEhFQklHQ0hFRVNFCkNBUFMjU0hBR1MjWElORyMjTkFJTApJQkVUIyNBQkUjTVVURVMjU0NSQU0KTk9ORSNPTkUjTUFSUyMjVElMIyMjCkdPVFBJQ0tFRFVQQllUSEVQT1VORAojIyNTQVQjI0VMTFMjSEVYI1NUSVIKQ0FOT04jQUxGSUUjUkVNIyNFVFRVClVQT04jI0xFQVMjQVVESVMjREVFTQpUT1NTRURJTlRIRVNQT05HRSNSUlMKU1BZI1BFU1QjI1ZJRVcjVEFTIyMjCiMjI0FJTlQjQkxBU0UjIyNTVFJBUApTUFVSVFMjTUFJRCMjI1BFRVJBR0UKV0FTVEhFRkFSTUVSU1RPUExBWUVSCkFOTklFI0VER0UjT0hBUkUjV09OVApCRUFTVCNaRUVTI1dISVRFIyNOVEg="},{"title":"02/26/12 TAKING THE CAKE: In various apt ways","author":"Fred Piscop, edited by Stanley Newman","date":"2012-02-26","grid":"R1BBIyNNSUxBTiNDTEFQI1NDRU5FClVSTlMjSURBSE8jUkFTSCNXQUdFRApMSUtFRFRPSEFOR1VQU0lERURPV04KUEFMTEVUUyMjI1JFU1QjT0RFU1NBClNNRUxMIyMjU1dBTEUjQlJJVCMjIwojIyNTVFAjU0VFUCMjTE9JUyNCQUgKSVRTI0FDVEVEVEhFQklHQ0hFRVNFCkNBUFMjU0hBR1MjWElORyMjTkFJTApJQkVUIyNBQkUjTVVURVMjU0NSQU0KTk9ORSNPTkUjTUFSUyMjVElMIyMjCkdPVFBJQ0tFRFVQQllUSEVQT1VORAojIyNTQVQjI0VMTFMjSEVYI1NUSVIKQ0FOT04jQUxGSUUjUkVNIyNFVFRVClVQT04jI0xFQVMjQVVESVMjREVFTQpUT1NTRURJTlRIRVNQT05HRSNSUlMKU1BZI1BFU1QjI1ZJRVcjVEFTIyMjCiMjI0FJTlQjQkxBU0UjIyNTVFJBUApTUFVSVFMjTUFJRCMjI1BFRVJBR0UKV0FTVEhFRkFSTUVSU1RPUExBWUVSCkFOTklFI0VER0UjT0hBUkUjV09OVApCRUFTVCNaRUVTI1dISVRFIyNOVEg="},{"title":"02/27/12 GO FISH","author":"Billie Truitt, edited by Stanley Newman","date":"2012-02-27","grid":"QlJBQ0UjRU1JVCNHQU1FClJFTEFYI05BU0EjRURFTgpBTklTRSNGSUxNI1RJREUKVE9URU1QT0xFI0FURUFNCiMjIyNQQVIjVElHSFRMWQpTT0xTVElDRSNGRUUjIyMKVEhPVSNSRVYjSU5IQUxGCkFOR1JZI0RJTSNUT05FUgpHT09GVVAjQ0FEI09ORUEKIyMjVEtPI1RSSUNLRVJZCkJJU0hPUFMjSVNPIyMjIwpBU0hFTiNQVU5DSExJTkUKTE9BTiNUSU5FI09VVEVSCkxVUkUjU1RJUiNTS0lFUgpTVEVUI1BFVFMjVEVORFM="},{"title":"02/27/12 GO FISH","author":"Billie Truitt, edited by Stanley Newman","date":"2012-02-27","grid":"QlJBQ0UjRU1JVCNHQU1FClJFTEFYI05BU0EjRURFTgpBTklTRSNGSUxNI1RJREUKVE9URU1QT0xFI0FURUFNCiMjIyNQQVIjVElHSFRMWQpTT0xTVElDRSNGRUUjIyMKVEhPVSNSRVYjSU5IQUxGCkFOR1JZI0RJTSNUT05FUgpHT09GVVAjQ0FEI09ORUEKIyMjVEtPI1RSSUNLRVJZCkJJU0hPUFMjSVNPIyMjIwpBU0hFTiNQVU5DSExJTkUKTE9BTiNUSU5FI09VVEVSCkxVUkUjU1RJUiNTS0lFUgpTVEVUI1BFVFMjVEVORFM="},{"title":"02/28/12 OXTAIL STEW","author":"Gail Grabowski, edited by Stanley Newman","date":"2012-02-28","grid":"TEFXTlMjSkFNUyNOQUlMCkFSSU9UI0FMT0UjT05DRQpNRU5TQSNQT09MI0VZRUQKQkFHRUxTQU5ETE9YIyMjCiMjIyNMQU5FUyNWSUNFIwpMQVRFU1QjIyNMRVRPRkYKQURPUyMjVEFQRVIjVUZPCkNISUNBR09XSElURVNPWApFRUwjVFVORUQjI1dJUkUKRFJFU1NZIyMjQUdFTlRTCiNFUklFI0NBQkxFIyMjIwojIyNDQVJEQk9BUkRCT1gKQUNUSSNJUk9OI01PTEFSCkRVRUwjTE9VRCNBTkVSQQpTVEFZI0VNVFMjTkVXU1k="},{"title":"02/28/12 OXTAIL STEW","author":"Gail Grabowski, edited by Stanley Newman","date":"2012-02-28","grid":"TEFXTlMjSkFNUyNOQUlMCkFSSU9UI0FMT0UjT05DRQpNRU5TQSNQT09MI0VZRUQKQkFHRUxTQU5ETE9YIyMjCiMjIyNMQU5FUyNWSUNFIwpMQVRFU1QjIyNMRVRPRkYKQURPUyMjVEFQRVIjVUZPCkNISUNBR09XSElURVNPWApFRUwjVFVORUQjI1dJUkUKRFJFU1NZIyMjQUdFTlRTCiNFUklFI0NBQkxFIyMjIwojIyNDQVJEQk9BUkRCT1gKQUNUSSNJUk9OI01PTEFSCkRVRUwjTE9VRCNBTkVSQQpTVEFZI0VNVFMjTkVXU1k="},{"title":"02/29/12 ACTIVE ANATOMY","author":"Charles Slack, edited by Stanley Newman","date":"2012-02-29","grid":"QUxNUyNTSUxPUyNFQVJOCkNPQVQjUElFQ0UjQVdBWQpIQUlSUkFJU0VSI1JPVEMKRU5ERUFSI1NBVkFCTEUjCiMjI1BJVEEjTklMRSMjIwpBQlMjREFSRSNDSU5ERVIKTk9URVMjRFVERSNERUxJCkdSQVkjU09MRVMjRVZFTgpMQU1FI1BSRVAjUFJJR1MKRVhQT1NFI1JPU0UjTFlFCiMjI1BJQ0EjVEVBUyMjIwojT05FVElNRSNBUk1BREEKVEhJTiNNSU5EQkxPV0VSCkxPTkUjRU5EVUUjVEVFTQpDSEVSI05PU0VEI0VERFk="},{"title":"02/29/12 ACTIVE ANATOMY","author":"Charles Slack, edited by Stanley Newman","date":"2012-02-29","grid":"QUxNUyNTSUxPUyNFQVJOCkNPQVQjUElFQ0UjQVdBWQpIQUlSUkFJU0VSI1JPVEMKRU5ERUFSI1NBVkFCTEUjCiMjI1BJVEEjTklMRSMjIwpBQlMjREFSRSNDSU5ERVIKTk9URVMjRFVERSNERUxJCkdSQVkjU09MRVMjRVZFTgpMQU1FI1BSRVAjUFJJR1MKRVhQT1NFI1JPU0UjTFlFCiMjI1BJQ0EjVEVBUyMjIwojT05FVElNRSNBUk1BREEKVEhJTiNNSU5EQkxPV0VSCkxPTkUjRU5EVUUjVEVFTQpDSEVSI05PU0VEI0VERFk="},{"title":"03/01/12 FIVE TO TEN","author":"Fred Piscop, edited by Stanley Newman","date":"2012-03-01","grid":"TEFTVFMjU0xFVyNTUEFNCkFMTEFII0tBWU8jUEFSQQpTUEFURSNFVkVSI0FTSU4KIyNWQUxVRUFEREVEVEFYCiMjIyNWRVQjIyNQRUEjIwpIQUxTRVkjVVJJUyNTSVQKQUxJRSMjQU1JR08jQVJFClZJVEFNSU5CQ09NUExFWApPQ1QjQURPUkUjI1JBTlQKQ0VMI05BTkEjQUJPREVTCiMjRUFUIyMjQ1NBIyMjIwpWRVJOQUxFUVVJTk9YIyMKQUxPVCNJQ1VTI0FSRUFTCkxBQ0UjU0hJUCNORVJWRQpFTEtTI1BPVFMjQVNTRVQ="},{"title":"03/01/12 FIVE TO TEN","author":"Fred Piscop, edited by Stanley Newman","date":"2012-03-01","grid":"TEFTVFMjU0xFVyNTUEFNCkFMTEFII0tBWU8jUEFSQQpTUEFURSNFVkVSI0FTSU4KIyNWQUxVRUFEREVEVEFYCiMjIyNWRVQjIyNQRUEjIwpIQUxTRVkjVVJJUyNTSVQKQUxJRSMjQU1JR08jQVJFClZJVEFNSU5CQ09NUExFWApPQ1QjQURPUkUjI1JBTlQKQ0VMI05BTkEjQUJPREVTCiMjRUFUIyMjQ1NBIyMjIwpWRVJOQUxFUVVJTk9YIyMKQUxPVCNJQ1VTI0FSRUFTCkxBQ0UjU0hJUCNORVJWRQpFTEtTI1BPVFMjQVNTRVQ="},{"title":"03/02/12 T FORMATION","author":"Richard Silvestri, edited by Stanley Newman","date":"2012-03-02","grid":"UEFSSyNSVU1TI1NDRU5FCkFSSUEjSVNFRSNMVVhPUgpQSUNUQVBBUlQjQU1FQkEKQURIRVJFIyNTQVRJUkVTCiMjIyNLTklUI0dFTlRMRQpBUVVBI1NOQVBFIyMjIyMKQ1VSTFMjU0xVTkcjUEFMCk1JU1RPUFBPUlRVTklUWQpFVEEjQkxPTkQjTUFTT04KIyMjIyNBVEVVUCNNQU5YCkFQUExFVCNERUVEIyMjIwpDUkVBU0VTIyNTQVZBR0UKUklOR1MjUEFTVEJBTExTCkVNQ0VFI0lET0wjU1RFUApTRUVSUyNOT1NFI1RPTlk="},{"title":"03/02/12 T FORMATION","author":"Richard Silvestri, edited by Stanley Newman","date":"2012-03-02","grid":"UEFSSyNSVU1TI1NDRU5FCkFSSUEjSVNFRSNMVVhPUgpQSUNUQVBBUlQjQU1FQkEKQURIRVJFIyNTQVRJUkVTCiMjIyNLTklUI0dFTlRMRQpBUVVBI1NOQVBFIyMjIyMKQ1VSTFMjU0xVTkcjUEFMCk1JU1RPUFBPUlRVTklUWQpFVEEjQkxPTkQjTUFTT04KIyMjIyNBVEVVUCNNQU5YCkFQUExFVCNERUVEIyMjIwpDUkVBU0VTIyNTQVZBR0UKUklOR1MjUEFTVEJBTExTCkVNQ0VFI0lET0wjU1RFUApTRUVSUyNOT1NFI1RPTlk="},{"title":"03/03/12 SATURDAY STUMPER","author":"S.N., edited by Stanley Newman","date":"2012-03-03","grid":"I1NFTUlDTEFTU0lDQUwjCiNQQUlOQVVDSE9DT0xBVApDT1JORURCRUVGT05SWUUKUlVOI1ZFRSNOQU4jRUVOClVTRU5FVCNKQVIjUEFUUwpEQVJFUiNHRU4jQUREVE8KRUxTQSNDQVJEUExBWUVSCiMjIyNGVVJJT1VTIyMjIwpTQ0FSRURZQ0FUI01PVEgKQ09MT1IjU0hII1JPQ0hFCkVMRU0jQklPI1NFV0FSRApORVcjWUVOI0lOTiNSSUcKSU1JVEFUSU9OT0ZMSUZFCkNBRkVSRVNUQVVSQU5UIwojTkVFRExFU1NUT1NBWSM="},{"title":"03/03/12 SATURDAY STUMPER","author":"S.N., edited by Stanley Newman","date":"2012-03-03","grid":"I1NFTUlDTEFTU0lDQUwjCiNQQUlOQVVDSE9DT0xBVApDT1JORURCRUVGT05SWUUKUlVOI1ZFRSNOQU4jRUVOClVTRU5FVCNKQVIjUEFUUwpEQVJFUiNHRU4jQUREVE8KRUxTQSNDQVJEUExBWUVSCiMjIyNGVVJJT1VTIyMjIwpTQ0FSRURZQ0FUI01PVEgKQ09MT1IjU0hII1JPQ0hFCkVMRU0jQklPI1NFV0FSRApORVcjWUVOI0lOTiNSSUcKSU1JVEFUSU9OT0ZMSUZFCkNBRkVSRVNUQVVSQU5UIwojTkVFRExFU1NUT1NBWSM="},{"title":"03/04/12 BATTERY PACK: Portably powered","author":"Gail Grabowski, edited by Stanley Newman","date":"2012-03-04","grid":"U1RBWSNDSEVXI0lEVEFHI1JFQlVTClBBTkUjUk9QRSNOT09TRSNFWEVSVApBUlRTI0FSSUEjQU5XQVIjU0NBTlMKUkFaT1JCQUNLI0ZBTkxFVFRFUiMjCiMjI1JVQlMjTEFPVFNFI0lFUiMjIwpTWURORVkjRElSR0UjI09MRFBST1MKQ0FSTyMjTFVOQSMjREVCVCNUQUtFCkFISSNCTEFDS0JFUlJZSkFNI0RJTgpMT0wjTEVOVCNTQVRJUkUjQVJJRVMKUE9MTFVURVMjI1RFTkVUI0xPT1NFCiMjTU9FUyMjQlJJU0sjI0VMQkEjIwpFVEFJTCNPUkxPTiMjUFJJQ0VDQVAKQk9TU0EjQ09BU1RTI0VVUk8jVFJBCkJJVCNXQVRDSFlPVVJTVEVQI0lJSQpFTEVWI0JBU1MjI0NFT1MjI09WRVIKREVSSURFRCMjVEFSVFMjUEFORUxTCiMjI0NBVCNCRUVNRVIjU09MRSMjIwojI01PVVNFVFJBUCNBVVRPUElMT1QKQ1JVTUIjTEVBU0UjQ0hFUiNORVJPClBBU1RFI0xBVEVSI1RVTkEjQ0lBTwpBTlRFRCNTTU9SRSNTSE9UI0hBTEw="},{"title":"03/04/12 BATTERY PACK: Portably powered","author":"Gail Grabowski, edited by Stanley Newman","date":"2012-03-04","grid":"U1RBWSNDSEVXI0lEVEFHI1JFQlVTClBBTkUjUk9QRSNOT09TRSNFWEVSVApBUlRTI0FSSUEjQU5XQVIjU0NBTlMKUkFaT1JCQUNLI0ZBTkxFVFRFUiMjCiMjI1JVQlMjTEFPVFNFI0lFUiMjIwpTWURORVkjRElSR0UjI09MRFBST1MKQ0FSTyMjTFVOQSMjREVCVCNUQUtFCkFISSNCTEFDS0JFUlJZSkFNI0RJTgpMT0wjTEVOVCNTQVRJUkUjQVJJRVMKUE9MTFVURVMjI1RFTkVUI0xPT1NFCiMjTU9FUyMjQlJJU0sjI0VMQkEjIwpFVEFJTCNPUkxPTiMjUFJJQ0VDQVAKQk9TU0EjQ09BU1RTI0VVUk8jVFJBCkJJVCNXQVRDSFlPVVJTVEVQI0lJSQpFTEVWI0JBU1MjI0NFT1MjI09WRVIKREVSSURFRCMjVEFSVFMjUEFORUxTCiMjI0NBVCNCRUVNRVIjU09MRSMjIwojI01PVVNFVFJBUCNBVVRPUElMT1QKQ1JVTUIjTEVBU0UjQ0hFUiNORVJPClBBU1RFI0xBVEVSI1RVTkEjQ0lBTwpBTlRFRCNTTU9SRSNTSE9UI0hBTEw="},{"title":"03/05/12 WHAT'S IN STORE?","author":"Gail Grabowski, edited by Stanley Newman","date":"2012-03-05","grid":"VEFCUyNBQkVUUyNCQVJTCkFSRUEjQkVSRVQjVVBPTgpMSUVOI1JBSVNFI1NBR0UKQ0FSRENPVU5URVIjUlVFCiMjIyNIQVMjI1JPU1RFUgojR1JFRUQjQ0hJREUjIyMKQUxJVkUjQk9PTiNBU0hZCkZFREVSQUxSRUdJU1RFUgpURUVOI0NVUFMjUk9BUlMKIyMjU1RJRVMjRE9OVFMjCkJZV09SRCMjU0FOIyMjIwpBQUgjSVJFU1RNWUNBU0UKQ0xJUCNBQ1RBUyNPVkVOCktJVEUjSUhBVkUjTE9BRApTRUVQI05PQkVMI0FXTFM="},{"title":"03/05/12 WHAT'S IN STORE?","author":"Gail Grabowski, edited by Stanley Newman","date":"2012-03-05","grid":"VEFCUyNBQkVUUyNCQVJTCkFSRUEjQkVSRVQjVVBPTgpMSUVOI1JBSVNFI1NBR0UKQ0FSRENPVU5URVIjUlVFCiMjIyNIQVMjI1JPU1RFUgojR1JFRUQjQ0hJREUjIyMKQUxJVkUjQk9PTiNBU0hZCkZFREVSQUxSRUdJU1RFUgpURUVOI0NVUFMjUk9BUlMKIyMjU1RJRVMjRE9OVFMjCkJZV09SRCMjU0FOIyMjIwpBQUgjSVJFU1RNWUNBU0UKQ0xJUCNBQ1RBUyNPVkVOCktJVEUjSUhBVkUjTE9BRApTRUVQI05PQkVMI0FXTFM="},{"title":"03/06/12 TAKE IT FROM ME","author":"Sally R. Stein, edited by Stanley Newman","date":"2012-03-06","grid":"I1NJU0kjR0FaQSNTVEFCCkJJREVOI09XRVMjVEFNRQpCTEVORCNPQVJTI09YRU4KTE9BRE9GRllPVVJNSU5ECiMjIyNPUlMjI01BUCMjIwpDQVNUUk8jQUNFRCNCQUcKQVJUWSNXQVNII0lUQUxZCkxPT0tJTlRIRU1JUlJPUgpJU0xFUyNNRU1PI0lORk8KRkVFI0xBU1MjUk9PU1RTCiMjI1RBUiMjVVNOIyMjIwpGSVZFTUlOVVRFQlJFQUsKQVNJUyNTT1JUI0FFVE5BCk5FU1QjRURHRSNTQVRPTgpTRUFTI1NFRVIjRURFTiM="},{"title":"03/06/12 TAKE IT FROM ME","author":"Sally R. Stein, edited by Stanley Newman","date":"2012-03-06","grid":"I1NJU0kjR0FaQSNTVEFCCkJJREVOI09XRVMjVEFNRQpCTEVORCNPQVJTI09YRU4KTE9BRE9GRllPVVJNSU5ECiMjIyNPUlMjI01BUCMjIwpDQVNUUk8jQUNFRCNCQUcKQVJUWSNXQVNII0lUQUxZCkxPT0tJTlRIRU1JUlJPUgpJU0xFUyNNRU1PI0lORk8KRkVFI0xBU1MjUk9PU1RTCiMjI1RBUiMjVVNOIyMjIwpGSVZFTUlOVVRFQlJFQUsKQVNJUyNTT1JUI0FFVE5BCk5FU1QjRURHRSNTQVRPTgpTRUFTI1NFRVIjRURFTiM="},{"title":"03/07/12 HERE'S THE LOWDOWN","author":"David W. Cromer, edited by Stanley Newman","date":"2012-03-07","grid":"I1ZFRSNGQURTI1JFQURZClNJTksjQVJJQSNVTlRJRQpQT1JFI1JFQUwjU1RFTVMKRkxPT1JNQU5BR0VSIyMjClNBTFVLSSNBRE8jQVNTVAojIyNUT05JIyNXQU5UVE8KQkVHIyNHUk9VTkRDUkVXCkFMVU1TI0FPSyNTRUlORQpCQVNFUlVOTkVSIyNQT0QKQVRUQUlOIyNTSVpFIyMjClJFU1QjSVFTI0RPTkFMRAojIyNCT1RUT01ET0xMQVIKU0FZQUgjSURPTCNJT1RBClBTQUxNI1BPU0UjU05JVApBUFBMWSNTSVRTI1RFTiM="},{"title":"03/07/12 HERE'S THE LOWDOWN","author":"David W. Cromer, edited by Stanley Newman","date":"2012-03-07","grid":"I1ZFRSNGQURTI1JFQURZClNJTksjQVJJQSNVTlRJRQpQT1JFI1JFQUwjU1RFTVMKRkxPT1JNQU5BR0VSIyMjClNBTFVLSSNBRE8jQVNTVAojIyNUT05JIyNXQU5UVE8KQkVHIyNHUk9VTkRDUkVXCkFMVU1TI0FPSyNTRUlORQpCQVNFUlVOTkVSIyNQT0QKQVRUQUlOIyNTSVpFIyMjClJFU1QjSVFTI0RPTkFMRAojIyNCT1RUT01ET0xMQVIKU0FZQUgjSURPTCNJT1RBClBTQUxNI1BPU0UjU05JVApBUFBMWSNTSVRTI1RFTiM="},{"title":"03/08/12 DAYLIGHT SAVING","author":"Billie Truitt, edited by Stanley Newman","date":"2012-03-08","grid":"SUNII01BU0FEQSNHRU1TCkFBQSNJU09NRVIjTUFZSQpNUkkjU1BSSU5HV0FURVIKQkVSWUwjRU5TVUUjQVlFCiMjREVFUCMjI0VMQVRFUwpGT1JXQVJETUFSQ0gjIyMKQU1ZI0RPV0VMI0hFRUxTClRJRVIjRkVSQUwjTVBBQQpTVFJJUCNMSU1JVCNJTksKIyMjRkFMTFRPUElFQ0VTCkFSTEVORSMjI1NOQVAjIwpUT1kjSU5ESUEjVFJPT1AKQkFDS0NPVU5UUlkjRUdPCkFDUkUjUkVDT1VQI01SUwpUSEFOI0VMQVBTRSNTRUU="},{"title":"03/08/12 DAYLIGHT SAVING","author":"Billie Truitt, edited by Stanley Newman","date":"2012-03-08","grid":"SUNII01BU0FEQSNHRU1TCkFBQSNJU09NRVIjTUFZSQpNUkkjU1BSSU5HV0FURVIKQkVSWUwjRU5TVUUjQVlFCiMjREVFUCMjI0VMQVRFUwpGT1JXQVJETUFSQ0gjIyMKQU1ZI0RPV0VMI0hFRUxTClRJRVIjRkVSQUwjTVBBQQpTVFJJUCNMSU1JVCNJTksKIyMjRkFMTFRPUElFQ0VTCkFSTEVORSMjI1NOQVAjIwpUT1kjSU5ESUEjVFJPT1AKQkFDS0NPVU5UUlkjRUdPCkFDUkUjUkVDT1VQI01SUwpUSEFOI0VMQVBTRSNTRUU="},{"title":"03/09/12 VISIONARY MUSIC","author":"Richard Silvestri, edited by Stanley Newman","date":"2012-03-09","grid":"SEFEI0tST0MjQkFUU0lOCk9ORSNIQUhBI0lQSE9ORQpCT1AjQVJNUyNHUk9VTkQKQlJPV05FWUVER0lSTCMjCkVBU0UjIyMjRUVMI0ZCSQpTS0VUQ0gjSEFSI05PVU4KIyMjI1JVUkFMI0VCT09LCiNHUkVFTkVZRURMQURZIwpHT1VSRCNERVJFSyMjIyMKSU9UQSNBT0sjQk9HR0xFClNQQSNCU0EjIyMjQVJFQQojI0JMQUNLRVlFRFBFQVMKUFJBSVNFI01FTEQjQU5UClJFR0FJTiNNQU1BI1NFRQpTQ0FSRUQjQUhPWSNFUlI="},{"title":"03/09/12 VISIONARY MUSIC","author":"Richard Silvestri, edited by Stanley Newman","date":"2012-03-09","grid":"SEFEI0tST0MjQkFUU0lOCk9ORSNIQUhBI0lQSE9ORQpCT1AjQVJNUyNHUk9VTkQKQlJPV05FWUVER0lSTCMjCkVBU0UjIyMjRUVMI0ZCSQpTS0VUQ0gjSEFSI05PVU4KIyMjI1JVUkFMI0VCT09LCiNHUkVFTkVZRURMQURZIwpHT1VSRCNERVJFSyMjIyMKSU9UQSNBT0sjQk9HR0xFClNQQSNCU0EjIyMjQVJFQQojI0JMQUNLRVlFRFBFQVMKUFJBSVNFI01FTEQjQU5UClJFR0FJTiNNQU1BI1NFRQpTQ0FSRUQjQUhPWSNFUlI="},{"title":"03/10/12 SATURDAY STUMPER","author":"Brad Wilber, edited by Stanley Newman","date":"2012-03-10","grid":"SFVHT0JPU1MjI01JTUVECkFOSVNFVEVBI1RPQkFHTwpTVEFHRVNFVCNPUkVHT04KUElOT1QjUEVOTlNUQVRFClNFTk9SQVMjRUtFI1pJVAojU0lERVMjUVVBTE1JU0gKIyMjI0RFTVVSI1NBTlRBCk1BTkUjQVJSQVkjUEVTVApBTUFTUyNNQUxFUyMjIyMKR0lWRVVQT04jQVBBUlQjCklDWSNDT1QjR1JJTUlFUgpDQVBBQ0lPVVMjS0VBTkUKQUJJREVTI1NURUVMVE9FCkNMRUVTRSNNQVJUSUFOUwpURVJOUyMjQ1JFVkFTU0U="},{"title":"03/10/12 SATURDAY STUMPER","author":"Brad Wilber, edited by Stanley Newman","date":"2012-03-10","grid":"SFVHT0JPU1MjI01JTUVECkFOSVNFVEVBI1RPQkFHTwpTVEFHRVNFVCNPUkVHT04KUElOT1QjUEVOTlNUQVRFClNFTk9SQVMjRUtFI1pJVAojU0lERVMjUVVBTE1JU0gKIyMjI0RFTVVSI1NBTlRBCk1BTkUjQVJSQVkjUEVTVApBTUFTUyNNQUxFUyMjIyMKR0lWRVVQT04jQVBBUlQjCklDWSNDT1QjR1JJTUlFUgpDQVBBQ0lPVVMjS0VBTkUKQUJJREVTI1NURUVMVE9FCkNMRUVTRSNNQVJUSUFOUwpURVJOUyMjQ1JFVkFTU0U="},{"title":"03/11/12 YACKETY-YAK: We'll be terser next time","author":"Norma Steinberg, edited by Stanley Newman","date":"2012-03-11","grid":"U0NBUkUjTEFQUyNBTFRPI0ZBQ0VUClBJTEVTI0lTTEUjRElFVCNBR0lMRQpBREFNUyNTUEVBS09GVEhFREVWSUwKUkVOTyNDQVNBQkEjVFJFWEVTIyMjClRSSVZJQSMjU0FSQSNBUkVTI0dFTApBU1NFUlRPTkVTRUxGI1NDT1VSR0UKIyMjI01PTkEjU05PT1AjI1VTQUdFCkJPU1NBTk9WQSMjVEFMS0lUT1ZFUgpFRElUIyMjQUNNRSNNVUlSIyNZRFMKVElNRVdJTExURUxMI1NUQVNIIyMjCkVOU1BBQ0UjU09MT1MjRVRBSUxFUgojIyNTSEVBUiNXRUxMSURFQ0xBUkUKTUdNIyNJTk9OI1NMQVYjIyNUV0lOCllPVURPTlRTQVkjI1BPU1NFU1NFRApFUlJPUiMjU1BFQ1MjUkFQVCMjIyMKWUVBUk5FRCNTVEFURVlPVVJOQU1FCkVTTCNBTUVTI0lOUkUjI1JFQU1FRAojIyNJTU1VTkUjQUVSSUVTI1RBTkcKVk9JQ0VBQ09NUExBSU5UI0pVTlRBCkhBRE9OI0VSSUMjTUVJTiNBUkRPUgpGUk9OVCNTRVRTI1NSVEEjWUVBUlM="},{"title":"03/11/12 YACKETY-YAK: We'll be terser next time","author":"Norma Steinberg, edited by Stanley Newman","date":"2012-03-11","grid":"U0NBUkUjTEFQUyNBTFRPI0ZBQ0VUClBJTEVTI0lTTEUjRElFVCNBR0lMRQpBREFNUyNTUEVBS09GVEhFREVWSUwKUkVOTyNDQVNBQkEjVFJFWEVTIyMjClRSSVZJQSMjU0FSQSNBUkVTI0dFTApBU1NFUlRPTkVTRUxGI1NDT1VSR0UKIyMjI01PTkEjU05PT1AjI1VTQUdFCkJPU1NBTk9WQSMjVEFMS0lUT1ZFUgpFRElUIyMjQUNNRSNNVUlSIyNZRFMKVElNRVdJTExURUxMI1NUQVNIIyMjCkVOU1BBQ0UjU09MT1MjRVRBSUxFUgojIyNTSEVBUiNXRUxMSURFQ0xBUkUKTUdNIyNJTk9OI1NMQVYjIyNUV0lOCllPVURPTlRTQVkjI1BPU1NFU1NFRApFUlJPUiMjU1BFQ1MjUkFQVCMjIyMKWUVBUk5FRCNTVEFURVlPVVJOQU1FCkVTTCNBTUVTI0lOUkUjI1JFQU1FRAojIyNJTU1VTkUjQUVSSUVTI1RBTkcKVk9JQ0VBQ09NUExBSU5UI0pVTlRBCkhBRE9OI0VSSUMjTUVJTiNBUkRPUgpGUk9OVCNTRVRTI1NSVEEjWUVBUlM="},{"title":"03/12/12 KNOT NOW","author":"Billie Truitt, edited by Stanley Newman","date":"2012-03-12","grid":"UklQUyNTSEFHI1NMQVRTCk9SRU8jQ0VMTCNBRVNPUApXQVJOI0hBTEUjVklTVEEKU1FVQVJFREFOQ0UjRUFSCiMjI1JVTU1ZI1JVU1RMRQpBU1AjTkVBI09VU1QjIyMKTEVBU1QjU0FQUyNBQUFTClNMSVBPRlRIRVRPTkdVRQpPRk5PI0xFQU4jQURPUkUKIyMjT0RPUiNNRFMjR0FQCkNVQ0tPTyNTSVJFUyMjIwpBU0gjR1JBTk5ZU01JVEgKQ1VJTkcjVElERSNBU0lBCkhBTk9JI09QRVIjU0VFTQpFTEFURSNNRURTI0hFUlM="},{"title":"03/12/12 KNOT NOW","author":"Billie Truitt, edited by Stanley Newman","date":"2012-03-12","grid":"UklQUyNTSEFHI1NMQVRTCk9SRU8jQ0VMTCNBRVNPUApXQVJOI0hBTEUjVklTVEEKU1FVQVJFREFOQ0UjRUFSCiMjI1JVTU1ZI1JVU1RMRQpBU1AjTkVBI09VU1QjIyMKTEVBU1QjU0FQUyNBQUFTClNMSVBPRlRIRVRPTkdVRQpPRk5PI0xFQU4jQURPUkUKIyMjT0RPUiNNRFMjR0FQCkNVQ0tPTyNTSVJFUyMjIwpBU0gjR1JBTk5ZU01JVEgKQ1VJTkcjVElERSNBU0lBCkhBTk9JI09QRVIjU0VFTQpFTEFURSNNRURTI0hFUlM="},{"title":"03/13/12 WHATEVER","author":"Gail Grabowski, edited by Stanley Newman","date":"2012-03-13","grid":"QVBQTEUjREFOTCNIQU1TCkNMRUFOI0FST08jRVJJRQpUT05JQyNCQVJOI01FTFQKSVRTTk9UQUJJR0RFQUwjCiMjIyNSQVQjI1RJTiMjIwpQSVRURUQjRE9FUiNUV08KSVJBUyMjSEVBUlQjQkFSCk5PU0tJTk9GRk1ZTk9TRQpUTlQjQ0FQRVMjI0lOVE8KQVlFI0VNRVIjVEVQRUVTCiMjI1BJRSMjRUVMIyMjIwojSURPTlRHSVZFQUhPT1QKT0RFUyNBTE9FI1BBUktBCkxFTlMjR09XTiNTSEVBUgpEQVRFI1NXQVQjRUFTWUE="},{"title":"03/13/12 WHATEVER","author":"Gail Grabowski, edited by Stanley Newman","date":"2012-03-13","grid":"QVBQTEUjREFOTCNIQU1TCkNMRUFOI0FST08jRVJJRQpUT05JQyNCQVJOI01FTFQKSVRTTk9UQUJJR0RFQUwjCiMjIyNSQVQjI1RJTiMjIwpQSVRURUQjRE9FUiNUV08KSVJBUyMjSEVBUlQjQkFSCk5PU0tJTk9GRk1ZTk9TRQpUTlQjQ0FQRVMjI0lOVE8KQVlFI0VNRVIjVEVQRUVTCiMjI1BJRSMjRUVMIyMjIwojSURPTlRHSVZFQUhPT1QKT0RFUyNBTE9FI1BBUktBCkxFTlMjR09XTiNTSEVBUgpEQVRFI1NXQVQjRUFTWUE="},{"title":"03/14/12 FOR A SONG","author":"Fred Piscop, edited by Stanley Newman","date":"2012-03-14","grid":"QUNUQVMjU1RST1AjQ0FCClJPWUNFI1BBSU5FI0hCTwpUQUtFQU5VTUJFUiNFQVIKU0xFRERFUlMjI0ZPU1NFCiMjIyNPUlMjU1BFTlNFUgpUT0JBR08jR0VMQ0FQIyMKSVBBU1MjU0FEQVQjSVJBClJBQ0sjTUFURVkjU0VFRApFTEsjRElWRVIjTklDQUQKIyNTRUVSRUQjUE9TRVJTCkJBVFNGT1IjV0lUIyMjIwpBR1JFRSMjTElOVFRSQVAKS0lBI0NMRUFSVEhFQUlSCkVMSSNURVJTRSNBTElORQpERU4jU1RBVFMjVEVOVFM="},{"title":"03/14/12 FOR A SONG","author":"Fred Piscop, edited by Stanley Newman","date":"2012-03-14","grid":"QUNUQVMjU1RST1AjQ0FCClJPWUNFI1BBSU5FI0hCTwpUQUtFQU5VTUJFUiNFQVIKU0xFRERFUlMjI0ZPU1NFCiMjIyNPUlMjU1BFTlNFUgpUT0JBR08jR0VMQ0FQIyMKSVBBU1MjU0FEQVQjSVJBClJBQ0sjTUFURVkjU0VFRApFTEsjRElWRVIjTklDQUQKIyNTRUVSRUQjUE9TRVJTCkJBVFNGT1IjV0lUIyMjIwpBR1JFRSMjTElOVFRSQVAKS0lBI0NMRUFSVEhFQUlSCkVMSSNURVJTRSNBTElORQpERU4jU1RBVFMjVEVOVFM="},{"title":"03/15/12 DO TELL","author":"Norma Steinberg, edited by Stanley Newman","date":"2012-03-15","grid":"QkFMTCNUQUNUI0NTUEFOCkFSRUEjT1NMTyNISVBQTwpTRVRTI0xPT04jT0dERU4KS05JVFRJTkdZQVJOIyMjClNBTlRBRkUjI1pFQUxPVAojIyNJUkUjQUZUI0xJWkEKU0NBTVAjU1RJRVMjTk9SClRBS0VJTlRPQUNDT1VOVApBUFIjVEFJTlQjQVBTRVMKSVJPTiNPUkUjQ1BBIyMjCk5JTkVQTSMjQkVFUk1BVAojIyNBTElLRUxZU1RPUlkKT0hBUkEjTkVJTCNJU01TCkRFUkJZI0VMTU8jU0hPTwpFTU1ZUyNFU1BOI1RFUk4="},{"title":"03/15/12 DO TELL","author":"Norma Steinberg, edited by Stanley Newman","date":"2012-03-15","grid":"QkFMTCNUQUNUI0NTUEFOCkFSRUEjT1NMTyNISVBQTwpTRVRTI0xPT04jT0dERU4KS05JVFRJTkdZQVJOIyMjClNBTlRBRkUjI1pFQUxPVAojIyNJUkUjQUZUI0xJWkEKU0NBTVAjU1RJRVMjTk9SClRBS0VJTlRPQUNDT1VOVApBUFIjVEFJTlQjQVBTRVMKSVJPTiNPUkUjQ1BBIyMjCk5JTkVQTSMjQkVFUk1BVAojIyNBTElLRUxZU1RPUlkKT0hBUkEjTkVJTCNJU01TCkRFUkJZI0VMTU8jU0hPTwpFTU1ZUyNFU1BOI1RFUk4="},{"title":"03/16/12 VOWEL PLAY","author":"Bruce Venzke, edited by Stanley Newman","date":"2012-03-16","grid":"SEFCTEEjTlRTQiNUVkFECk9ORUFUI09XSUUjVVNTUgpCQUxMT0ZGSVJFI1JJU0UKI0dMQVpJRVIjI0JPWEVTCkZSWSMjQkVMTFRPV0VSUwpMQVJBTVMjI0VFTCNTVFkKQU1VU0UjTUFUUk9OIyMjCiMjQklMTENIQU5HRVIjIwojIyNTTElHSFQjTklFQ0UKQVRFI09SRSMjU0FMTU9OCkJPTExXRUVWSUwjI0FORApBTElBUyMjT05BTEVSVCMKVEVYVCNCVUxMTUFSS0VUCkVESVQjTEFWQSNTVEVOTwpTT1JFI1lFT1cjVEVERFk="},{"title":"03/16/12 VOWEL PLAY","author":"Bruce Venzke, edited by Stanley Newman","date":"2012-03-16","grid":"SEFCTEEjTlRTQiNUVkFECk9ORUFUI09XSUUjVVNTUgpCQUxMT0ZGSVJFI1JJU0UKI0dMQVpJRVIjI0JPWEVTCkZSWSMjQkVMTFRPV0VSUwpMQVJBTVMjI0VFTCNTVFkKQU1VU0UjTUFUUk9OIyMjCiMjQklMTENIQU5HRVIjIwojIyNTTElHSFQjTklFQ0UKQVRFI09SRSMjU0FMTU9OCkJPTExXRUVWSUwjI0FORApBTElBUyMjT05BTEVSVCMKVEVYVCNCVUxMTUFSS0VUCkVESVQjTEFWQSNTVEVOTwpTT1JFI1lFT1cjVEVERFk="},{"title":"03/17/12 SATURDAY STUMPER","author":"Byron Walden, edited by Stanley Newman","date":"2012-03-17","grid":"UElQUyNCVURHRVRIQVdLCklOUkUjVU5JT05MQUJFTApDQUVOI1NBTlRBQ0xBUkEKQVNMQU4jTUVMQyNGTEVYClNUQVRFQVVESVQjSE9CTwpTSVRFVklTSVQjQ09OQU4KT1JFI0FERU4jTU9QRURTCiMjI09ERUQjVklDRSMjIwpQTEFaQVMjTEFOSyNDSEkKUkFNT04jQkVOR1VSSU9OCkVWRU4jQkFHR1lQQU5UUwpQRVJJI0FUSUUjU01FTFQKUFJJWkVUQUJMRSNBTUlFCkVOQ0VQSEFMSUMjREFOQQpERUFESE9ORVNUI0FYRUQ="},{"title":"03/17/12 SATURDAY STUMPER","author":"Byron Walden, edited by Stanley Newman","date":"2012-03-17","grid":"UElQUyNCVURHRVRIQVdLCklOUkUjVU5JT05MQUJFTApDQUVOI1NBTlRBQ0xBUkEKQVNMQU4jTUVMQyNGTEVYClNUQVRFQVVESVQjSE9CTwpTSVRFVklTSVQjQ09OQU4KT1JFI0FERU4jTU9QRURTCiMjI09ERUQjVklDRSMjIwpQTEFaQVMjTEFOSyNDSEkKUkFNT04jQkVOR1VSSU9OCkVWRU4jQkFHR1lQQU5UUwpQRVJJI0FUSUUjU01FTFQKUFJJWkVUQUJMRSNBTUlFCkVOQ0VQSEFMSUMjREFOQQpERUFESE9ORVNUI0FYRUQ="},{"title":"03/18/12 INTERSECTIONS: Where streets meet","author":"Fred Piscop, edited by Stanley Newman","date":"2012-03-18","grid":"U0FCUkEjQkVFRlMjT1JDQSMjQUxJCk9SRU9TI1lBTElFI1BFT04jU0hFRApGSVJTVFNUUklORyNDQVNUU1RFRUwKVEFHU0FMRVMjI01BSUwjQVBJQVJZCiMjIyNJUlMjU0NFTlQjI0NBTkRZIwpBTldBUiMjUExBTlQjU0FJTlQjIyMKRk9SR0VTI0xBU1RTVEFORCMjR1BTCkFTSUEjRURBVEUjI09MRCNUQUhPRQpSRVNUI05PTkUjUElOS1kjV0hPUkwKIyNURVNURUUjU0VNSSMjV0VBU0VMCkJBUyNDT1NUU1RSVUNUVVJFI1REUwpPUFRJT04jI0hFRVAjSUNJTkdTIyMKU1BSQVQjU0hPV1MjREVMRSNJVEVNClNMQU5UI1RVRSMjQVVSQVMjVE9SRQpZRVAjI0dVRVNUU1RBUiNUSUdSSVMKIyMjSE9STlMjQUtFTEEjI05PWUVTCiNDUk9XRSMjU0xJTVMjQk9TIyMjIwpPUklPTEUjQk9MTCMjQkFOSVNURVIKRFVTVFNUT1JNI0xBVEVTVFNUWUxFCk9ERVMjRVhBTSNFTElURSNURVJTRQpSRVMjI0RZTkUjVEVYQVMjU1BFRUQ="},{"title":"03/18/12 INTERSECTIONS: Where streets meet","author":"Fred Piscop, edited by Stanley Newman","date":"2012-03-18","grid":"U0FCUkEjQkVFRlMjT1JDQSMjQUxJCk9SRU9TI1lBTElFI1BFT04jU0hFRApGSVJTVFNUUklORyNDQVNUU1RFRUwKVEFHU0FMRVMjI01BSUwjQVBJQVJZCiMjIyNJUlMjU0NFTlQjI0NBTkRZIwpBTldBUiMjUExBTlQjU0FJTlQjIyMKRk9SR0VTI0xBU1RTVEFORCMjR1BTCkFTSUEjRURBVEUjI09MRCNUQUhPRQpSRVNUI05PTkUjUElOS1kjV0hPUkwKIyNURVNURUUjU0VNSSMjV0VBU0VMCkJBUyNDT1NUU1RSVUNUVVJFI1REUwpPUFRJT04jI0hFRVAjSUNJTkdTIyMKU1BSQVQjU0hPV1MjREVMRSNJVEVNClNMQU5UI1RVRSMjQVVSQVMjVE9SRQpZRVAjI0dVRVNUU1RBUiNUSUdSSVMKIyMjSE9STlMjQUtFTEEjI05PWUVTCiNDUk9XRSMjU0xJTVMjQk9TIyMjIwpPUklPTEUjQk9MTCMjQkFOSVNURVIKRFVTVFNUT1JNI0xBVEVTVFNUWUxFCk9ERVMjRVhBTSNFTElURSNURVJTRQpSRVMjI0RZTkUjVEVYQVMjU1BFRUQ="},{"title":"03/19/12 COURTESY COUNTS","author":"Gail Grabowski, edited by Stanley Newman","date":"2012-03-19","grid":"SEFMVCNDTEFQI0JBU0lTCkVSSUUjUk9MRSNBTEFNTwpBQ01FI0VBU0UjVFVSSU4KVEhBTktTRk9SQ09NSU5HCiMjIyNJVEUjI1VOUyMjIwpTVEFORCNSVU5UUyNTU1cKQUlMRUQjI1BPRSNTT0xPCldFTENPTUVTVFJBTkdFUgpUT09LI09SRSMjUkFHRVMKT05UI0hVUlRTI0VHWVBUCiMjI0dBUyMjT1dOIyMjIwpQTEVBU0VIQVZFQVNFQVQKU09SVFMjQVJJQSNLQUxFClNQSUVMI0xFRVIjSUNPTgpURU5TRSNPQVRTI1NIRUQ="},{"title":"03/19/12 COURTESY COUNTS","author":"Gail Grabowski, edited by Stanley Newman","date":"2012-03-19","grid":"SEFMVCNDTEFQI0JBU0lTCkVSSUUjUk9MRSNBTEFNTwpBQ01FI0VBU0UjVFVSSU4KVEhBTktTRk9SQ09NSU5HCiMjIyNJVEUjI1VOUyMjIwpTVEFORCNSVU5UUyNTU1cKQUlMRUQjI1BPRSNTT0xPCldFTENPTUVTVFJBTkdFUgpUT09LI09SRSMjUkFHRVMKT05UI0hVUlRTI0VHWVBUCiMjI0dBUyMjT1dOIyMjIwpQTEVBU0VIQVZFQVNFQVQKU09SVFMjQVJJQSNLQUxFClNQSUVMI0xFRVIjSUNPTgpURU5TRSNPQVRTI1NIRUQ="},{"title":"03/20/12 1980s FADS","author":"Billie Truitt, edited by Stanley Newman","date":"2012-03-20","grid":"QkFER0UjQ1JPUCNPV05TCkFDUkVTI1JJREUjVUhPSApXSEFUUyNBTE9UI1RPUk8KTEVHV0FSTUVSUyNSQU1QCiMjI0VZRSMjU0lERSMjIwpTUEFUI0JPVyNUSUFSQVMKQUlNI1JBUElEI1NDQUxFCkNBQkJBR0VQQVRDSEtJRApLTkVBRCNSRVRSTyNFVkUKU09SRElEI1NFQSNVU0VSCiMjI0xPVUQjI0NBTiMjIwpTT0ZBI1JVQklLU0NVQkUKT1ZFTiNFRUxTI1RVTkVSCkRFRUQjU1RVTiNPUkRFUgpBUlRTI1NPUlQjUExPVFM="},{"title":"03/20/12 1980s FADS","author":"Billie Truitt, edited by Stanley Newman","date":"2012-03-20","grid":"QkFER0UjQ1JPUCNPV05TCkFDUkVTI1JJREUjVUhPSApXSEFUUyNBTE9UI1RPUk8KTEVHV0FSTUVSUyNSQU1QCiMjI0VZRSMjU0lERSMjIwpTUEFUI0JPVyNUSUFSQVMKQUlNI1JBUElEI1NDQUxFCkNBQkJBR0VQQVRDSEtJRApLTkVBRCNSRVRSTyNFVkUKU09SRElEI1NFQSNVU0VSCiMjI0xPVUQjI0NBTiMjIwpTT0ZBI1JVQklLU0NVQkUKT1ZFTiNFRUxTI1RVTkVSCkRFRUQjU1RVTiNPUkRFUgpBUlRTI1NPUlQjUExPVFM="},{"title":"03/21/12 PAY UP","author":"Fred Piscop, edited by Stanley Newman","date":"2012-03-21","grid":"QkFSRVIjRkxFVyNQQVJUCkFDVVRFI0xBU0gjSVNFRQpDSEVDS09VVENPVU5URVIKSEVTI0VCQlMjU1BJRUxTCiMjI0RZRVMjIyNXT1JTRQpBUkdPU1kjU0FSQU4jIyMKTEVBTiMjQkFMRVIjQk9BCkZBUkVXRUxMQUREUkVTUwpBTFAjSEFVTFMjI0VFTFMKIyMjU09SUlkjUlVOU09OCkdFQ0tPIyMjUE9ORCMjIwpFTEZJU0gjQVJUUyNPTEQKVE9MTEhPVVNFQ09PS0lFCk9QQUwjUFJJWCNMVVJFUwpORVRTI1NMQVkjRFJBTks="},{"title":"03/21/12 PAY UP","author":"Fred Piscop, edited by Stanley Newman","date":"2012-03-21","grid":"QkFSRVIjRkxFVyNQQVJUCkFDVVRFI0xBU0gjSVNFRQpDSEVDS09VVENPVU5URVIKSEVTI0VCQlMjU1BJRUxTCiMjI0RZRVMjIyNXT1JTRQpBUkdPU1kjU0FSQU4jIyMKTEVBTiMjQkFMRVIjQk9BCkZBUkVXRUxMQUREUkVTUwpBTFAjSEFVTFMjI0VFTFMKIyMjU09SUlkjUlVOU09OCkdFQ0tPIyMjUE9ORCMjIwpFTEZJU0gjQVJUUyNPTEQKVE9MTEhPVVNFQ09PS0lFCk9QQUwjUFJJWCNMVVJFUwpORVRTI1NMQVkjRFJBTks="},{"title":"03/22/12 SWAP SHOP","author":"David W. Cromer, edited by Stanley Newman","date":"2012-03-22","grid":"Q1JBTkUjRUxJUyNTUEFTClJPTEVYI1ZJU0EjTkFTSApUV0lYVCNBTUVOI0FUVEEKIyMjVFJBREVFRElUSU9OClJFU1RBVEUjI0VTQ09SVApPUFBPU0UjTk9EVUgjIyMKR09PIyNJRU9II1pFUk9TCkVYQ0hBTkdFU1RVREVOVApUWUtFUyNHTE9XIyNMU1UKIyMjQVBBU1MjRVNQSUVECkVTUFJJVCMjU0VMRUNUUwpTV0lUQ0hISVRURVIjIyMKVE9OSSNSSURFI0lTQUFDCkVSVEUjT1ZFUiNHSU1NRQpSRUFSI1dFQU4jSEFTVE8="},{"title":"03/22/12 SWAP SHOP","author":"David W. Cromer, edited by Stanley Newman","date":"2012-03-22","grid":"Q1JBTkUjRUxJUyNTUEFTClJPTEVYI1ZJU0EjTkFTSApUV0lYVCNBTUVOI0FUVEEKIyMjVFJBREVFRElUSU9OClJFU1RBVEUjI0VTQ09SVApPUFBPU0UjTk9EVUgjIyMKR09PIyNJRU9II1pFUk9TCkVYQ0hBTkdFU1RVREVOVApUWUtFUyNHTE9XIyNMU1UKIyMjQVBBU1MjRVNQSUVECkVTUFJJVCMjU0VMRUNUUwpTV0lUQ0hISVRURVIjIyMKVE9OSSNSSURFI0lTQUFDCkVSVEUjT1ZFUiNHSU1NRQpSRUFSI1dFQU4jSEFTVE8="},{"title":"03/23/12 MUSCLING IN","author":"Doug Peterson, edited by Stanley Newman","date":"2012-03-23","grid":"U0xVUiNCT0NBI1NQWU9OCkxPVkUjTElOWiNUUlVNUApBR1VBI0FMQkEjTU9MQVIKV0FMTEFCWUNMRUFWRVIjClNOQUlMIyMjRUJSTyMjIwojIyNTVEVQQkFCWVNURVAKVEFKTUFIQUwjI1NUT0xFCk9OTyMjU05BUkYjI05CQwpFVEhFTCMjREFZQlJFQUsKU0lOR0FCTEVGSUxFIyMjCiMjI09CT0UjIyNBTUlTUwojRVhUUkFCQVNFSEFCSVQKTUFMSUEjUklUWiNUSVRPCkdSSVNUI09ET1IjQ1pBUgpTTElUUyNOQVBBI0hBUk0="},{"title":"03/23/12 MUSCLING IN","author":"Doug Peterson, edited by Stanley Newman","date":"2012-03-23","grid":"U0xVUiNCT0NBI1NQWU9OCkxPVkUjTElOWiNUUlVNUApBR1VBI0FMQkEjTU9MQVIKV0FMTEFCWUNMRUFWRVIjClNOQUlMIyMjRUJSTyMjIwojIyNTVEVQQkFCWVNURVAKVEFKTUFIQUwjI1NUT0xFCk9OTyMjU05BUkYjI05CQwpFVEhFTCMjREFZQlJFQUsKU0lOR0FCTEVGSUxFIyMjCiMjI09CT0UjIyNBTUlTUwojRVhUUkFCQVNFSEFCSVQKTUFMSUEjUklUWiNUSVRPCkdSSVNUI09ET1IjQ1pBUgpTTElUUyNOQVBBI0hBUk0="},{"title":"03/24/12 SATURDAY STUMPER","author":"Lars G. Doubleday, edited by Stanley Newman","date":"2012-03-24","grid":"Q0hBUklTTUEjQ0FTUEFSClNFTEVDVE9SI09GTEFURQpDQVJWRU9VVCNGT1VSQU0KQVZFI1NJVCNTRlVNQVRPCkxFQU4jQ0hBUEVMI0RJVgpFTkRPVyNTTE9FI01FTUUKI1NZUklBI0xPUFNJREVECiMjI1dJTkRCTE9XTiMjIwpESVNBU1RFUiNUQUVCTyMKT05MWSNJTUFDI0dSSU5ECkFWQSNFUE9OWU0jU1RBUgpESVNIUEFOI1JPRSNQREEKRVRISUNTI0ZBVVhOQUlGCkFSRU5PVCNJTlNFQ1JFVApMT1NUVE8jQk9ZQ09UVFM="},{"title":"03/24/12 SATURDAY STUMPER","author":"Lars G. Doubleday, edited by Stanley Newman","date":"2012-03-24","grid":"Q0hBUklTTUEjQ0FTUEFSClNFTEVDVE9SI09GTEFURQpDQVJWRU9VVCNGT1VSQU0KQVZFI1NJVCNTRlVNQVRPCkxFQU4jQ0hBUEVMI0RJVgpFTkRPVyNTTE9FI01FTUUKI1NZUklBI0xPUFNJREVECiMjI1dJTkRCTE9XTiMjIwpESVNBU1RFUiNUQUVCTyMKT05MWSNJTUFDI0dSSU5ECkFWQSNFUE9OWU0jU1RBUgpESVNIUEFOI1JPRSNQREEKRVRISUNTI0ZBVVhOQUlGCkFSRU5PVCNJTlNFQ1JFVApMT1NUVE8jQk9ZQ09UVFM="},{"title":"03/25/12 NOT ON THE PLATE: It's un-fare","author":"David W. Cromer, edited by Stanley Newman","date":"2012-03-25","grid":"QVBQTEVUI1NDSFdBUyMjUFVGRiMjCk1BTEFHQSNQSE9FQkVTI0NMRUFSUwpQUklNT1JESUFMU09VUCNUWURCT0wKU1RFUCNQQU5LWSNEUkFCI1NVRURFCiMjIyNTQVZFUiNQRUFSTCNTUFJFRQpDT1VDSFBPVEFUTyNURUFTRSNHT1QKSU5TVVJFUyMjUkVEIyNJU1NVRSMjClNFQUxFUiNGQkkjV1VSU1QjTkVNTwpDQUdFRCNIVU1CTEVQSUUjTklHRVIKT0xFIyNNQU5YI0FFUk8jR09PR0xFCiMjI1RSQVkjQkFNQkkjVFVSTiMjIwpIQVRCT1gjU0lSRSNHUkFZIyNNRVQKQVJST1cjUE9LRVJDSElQI1RIRU1FClNDQU4jTEFERU4jQVRNI1BPVVJPTgojI0ZFTE9OIyNBSU0jI0JVUlJJVE8KT0FGI0VYRVJUI0NPQ09BQlVUVEVSCkFTSUFOI0xFRVJZI0hBTkdTIyMjIwpTT0NLUyNTQU5FI0xPVFRBI05BQ0wKSU5KRUNUI1BFVFJPTEVVTUpFTExZClNFQUxBQiNTVFJFV0VSI0VBU0VJTgojI01BUFMjI1NPWEVSUyNTSVRTT04="},{"title":"03/25/12 NOT ON THE PLATE: It's un-fare","author":"David W. Cromer, edited by Stanley Newman","date":"2012-03-25","grid":"QVBQTEVUI1NDSFdBUyMjUFVGRiMjCk1BTEFHQSNQSE9FQkVTI0NMRUFSUwpQUklNT1JESUFMU09VUCNUWURCT0wKU1RFUCNQQU5LWSNEUkFCI1NVRURFCiMjIyNTQVZFUiNQRUFSTCNTUFJFRQpDT1VDSFBPVEFUTyNURUFTRSNHT1QKSU5TVVJFUyMjUkVEIyNJU1NVRSMjClNFQUxFUiNGQkkjV1VSU1QjTkVNTwpDQUdFRCNIVU1CTEVQSUUjTklHRVIKT0xFIyNNQU5YI0FFUk8jR09PR0xFCiMjI1RSQVkjQkFNQkkjVFVSTiMjIwpIQVRCT1gjU0lSRSNHUkFZIyNNRVQKQVJST1cjUE9LRVJDSElQI1RIRU1FClNDQU4jTEFERU4jQVRNI1BPVVJPTgojI0ZFTE9OIyNBSU0jI0JVUlJJVE8KT0FGI0VYRVJUI0NPQ09BQlVUVEVSCkFTSUFOI0xFRVJZI0hBTkdTIyMjIwpTT0NLUyNTQU5FI0xPVFRBI05BQ0wKSU5KRUNUI1BFVFJPTEVVTUpFTExZClNFQUxBQiNTVFJFV0VSI0VBU0VJTgojI01BUFMjI1NPWEVSUyNTSVRTT04="},{"title":"03/26/12 FINISHING FIRST","author":"Gail Grabowski, edited by Stanley Newman","date":"2012-03-26","grid":"U1BJTiNTTkFQI1RJREFMCkNPREUjQUlSRSNBR09HTwpVS0VTI1NDQVIjQ1VSRVMKQkVBVFRIRUJVU0hFUyMjCkFEUyNFQVIjI0VTU0FZUwojIyNIRVkjUFJFI1NMT0UKQUxBTU8jV1JJVEUjRlVSClRPUE9GVEhFTU9STklORwpFVVIjRlJJRVMjUkFOR0UKQVNJUyNVUk4jUk9CIyMjClRFTExPTiMjU0lSI01PUAojI0xJQ0tJTlRPU0hBUEUKQUJPVkUjUk9PVCNBQ0VTCkhBVkVBI0lTTEUjTUFSSwpTVEVSTiNTRUVEI1NXQVk="},{"title":"03/26/12 FINISHING FIRST","author":"Gail Grabowski, edited by Stanley Newman","date":"2012-03-26","grid":"U1BJTiNTTkFQI1RJREFMCkNPREUjQUlSRSNBR09HTwpVS0VTI1NDQVIjQ1VSRVMKQkVBVFRIRUJVU0hFUyMjCkFEUyNFQVIjI0VTU0FZUwojIyNIRVkjUFJFI1NMT0UKQUxBTU8jV1JJVEUjRlVSClRPUE9GVEhFTU9STklORwpFVVIjRlJJRVMjUkFOR0UKQVNJUyNVUk4jUk9CIyMjClRFTExPTiMjU0lSI01PUAojI0xJQ0tJTlRPU0hBUEUKQUJPVkUjUk9PVCNBQ0VTCkhBVkVBI0lTTEUjTUFSSwpTVEVSTiNTRUVEI1NXQVk="},{"title":"03/27/12 GET A GRIP","author":"Billie Truitt, edited by Stanley Newman","date":"2012-03-27","grid":"QlVEUyNJU0lUI0JFQU1TCk9SRU8jUlVTSCNBUExFQQpPU0xPI0FCTEUjUkFJTlkKTUFJTlNRVUVFWkUjQlNBCiMjIyNBSVIjI0lTQUlBSApIQUlLVSNCTFVOVFMjIyMKVVBTSURFI0VHRyNTVEFUCkZFRUxJTkdUSEVQSU5DSApGUkVUI0RVQiNSRVNVTUUKIyMjRUFTVEVSI0FUVEVOClNURVJOTyMjRUFSIyMjIwpIRVgjSU5USEVDTFVUQ0gKQVhJT00jSElMVCNTSE9PCkNBTExBI0VSSUUjRUFSTApLTkVFTCNNRU5EI1JJTkQ="},{"title":"03/27/12 GET A GRIP","author":"Billie Truitt, edited by Stanley Newman","date":"2012-03-27","grid":"QlVEUyNJU0lUI0JFQU1TCk9SRU8jUlVTSCNBUExFQQpPU0xPI0FCTEUjUkFJTlkKTUFJTlNRVUVFWkUjQlNBCiMjIyNBSVIjI0lTQUlBSApIQUlLVSNCTFVOVFMjIyMKVVBTSURFI0VHRyNTVEFUCkZFRUxJTkdUSEVQSU5DSApGUkVUI0RVQiNSRVNVTUUKIyMjRUFTVEVSI0FUVEVOClNURVJOTyMjRUFSIyMjIwpIRVgjSU5USEVDTFVUQ0gKQVhJT00jSElMVCNTSE9PCkNBTExBI0VSSUUjRUFSTApLTkVFTCNNRU5EI1JJTkQ="},{"title":"03/28/12 TENNIS ENDERS","author":"Fred Piscop, edited by Stanley Newman","date":"2012-03-28","grid":"U0laRSNURVJNIyNGRUFUCldPT0wjT0RJVU0jT0xERQpBV09MI0ZBQ1RTI1JJREUKTkFNRU9GVEhFR0FNRSMjCiMjIyNGRUUjIyNORVdBVAojU1RBVEUjU1BJVCNJQ0UKU1BVTUUjU0NBTiNQRUNTClBFTkFORFBFTkNJTFNFVApJV0lOI0FVTlQjREVFRFMKVEVOI1RZUkUjU0lETEUjCkVER0FSIyMjVE9PIyMjIwojI0ZSSUNUSU9OTUFUQ0gKVFJPVCNQRU5UQSNTSE9PCkFJUlMjT0NURVQjUEFQQQpQT0tZIyNIT1JBI1NUWVg="},{"title":"03/28/12 TENNIS ENDERS","author":"Fred Piscop, edited by Stanley Newman","date":"2012-03-28","grid":"U0laRSNURVJNIyNGRUFUCldPT0wjT0RJVU0jT0xERQpBV09MI0ZBQ1RTI1JJREUKTkFNRU9GVEhFR0FNRSMjCiMjIyNGRUUjIyNORVdBVAojU1RBVEUjU1BJVCNJQ0UKU1BVTUUjU0NBTiNQRUNTClBFTkFORFBFTkNJTFNFVApJV0lOI0FVTlQjREVFRFMKVEVOI1RZUkUjU0lETEUjCkVER0FSIyMjVE9PIyMjIwojI0ZSSUNUSU9OTUFUQ0gKVFJPVCNQRU5UQSNTSE9PCkFJUlMjT0NURVQjUEFQQQpQT0tZIyNIT1JBI1NUWVg="},{"title":"03/29/12 CLEANUP CREW","author":"Betty Keller, edited by Stanley Newman","date":"2012-03-29","grid":"TUFQI0FNQVNTI0dSSUVGCk9ERSNNQUNITyNMVU5BUgpTV0VFUFRIRUNPVU5UUlkKQ0FSRVNTIyNDUkVURSMjCk9SQUwjI0JSRUVEI1JJTQpXRVQjQk9PRVJTI1RBUlAKIyMjUExBWkEjI1NPQ0tTCiNEVVNURk9SUFJJTlRTIwpNSU5JUyMjU0VBTFMjIyMKQVZJUyNCSFVUVE8jQ0FQClJFQyNCRUVQUyMjQ0FMTAojI09IQVJFIyNSVUJCTEUKU0NSVUJUSEVNSVNTSU9OCk9VTkNFI0FQQUNFI05VVApERVNLUyNXQVhFRCNTVFk="},{"title":"03/29/12 CLEANUP CREW","author":"Betty Keller, edited by Stanley Newman","date":"2012-03-29","grid":"TUFQI0FNQVNTI0dSSUVGCk9ERSNNQUNITyNMVU5BUgpTV0VFUFRIRUNPVU5UUlkKQ0FSRVNTIyNDUkVURSMjCk9SQUwjI0JSRUVEI1JJTQpXRVQjQk9PRVJTI1RBUlAKIyMjUExBWkEjI1NPQ0tTCiNEVVNURk9SUFJJTlRTIwpNSU5JUyMjU0VBTFMjIyMKQVZJUyNCSFVUVE8jQ0FQClJFQyNCRUVQUyMjQ0FMTAojI09IQVJFIyNSVUJCTEUKU0NSVUJUSEVNSVNTSU9OCk9VTkNFI0FQQUNFI05VVApERVNLUyNXQVhFRCNTVFk="},{"title":"03/30/12 HOVERERS","author":"Clive Probert, edited by Stanley Newman","date":"2012-03-30","grid":"U09CQUQjR05BVyNQQUxNCkNSRU1FI0lPVEEjQUxPRQpBQ1JFUyNMSUJSQVJJQU4KTUFHTEVWVFJBSU4jRU1VCiMjI0lSRSMjVEVUT04jIwpCRUhBVklORyNSRUFDVFMKVU5FI0VORVJPI1NUUklQClJVTEUjU1dJTVMjSEFMTwpCUklBUiNURU5UUyNGRFIKU0VDUkVUI0ZJUlNUVEVFCiMjT1BFUkEjI0FISCMjIwpTVFAjRlVTU1lXQUlURVIKQ0lUWVNDQVBFI1BFUlNFCkFSRUEjRURFTiNFVklBTgpURVJNI1NBV1MjREVCVVQ="},{"title":"03/30/12 HOVERERS","author":"Clive Probert, edited by Stanley Newman","date":"2012-03-30","grid":"U09CQUQjR05BVyNQQUxNCkNSRU1FI0lPVEEjQUxPRQpBQ1JFUyNMSUJSQVJJQU4KTUFHTEVWVFJBSU4jRU1VCiMjI0lSRSMjVEVUT04jIwpCRUhBVklORyNSRUFDVFMKVU5FI0VORVJPI1NUUklQClJVTEUjU1dJTVMjSEFMTwpCUklBUiNURU5UUyNGRFIKU0VDUkVUI0ZJUlNUVEVFCiMjT1BFUkEjI0FISCMjIwpTVFAjRlVTU1lXQUlURVIKQ0lUWVNDQVBFI1BFUlNFCkFSRUEjRURFTiNFVklBTgpURVJNI1NBV1MjREVCVVQ="},{"title":"03/31/12 SATURDAY STUMPER","author":"Lester Ruff, edited by Stanley Newman","date":"2012-03-31","grid":"VE9TVEFSVCNDQVBJVEFMClVQVE9QQVIjQUxMRE9ORQpSRVBMRVRFI1JFRUxFQ1QKRlJFRVMjQlJSI0RFTEhJCldBVFQjRkxVSUQjU09PVApBVEUjV0lFTkVSUyNPUkIKUkVSRUFEUyNTWU5BUFNFCiMjI0FORCMjI0xPVCMjIwpTVEFSVExFI0hBUlZBUkQKUEVJI1NFUlBFTlQjQkVFCkVBUkwjRFJFQUQjTklUUwpFVEhFUiNBUFIjQkFHSVQKRElFRE9XTiNTVEVGQU5JCkVNQUlMRUQjT1JBVElPTgpSRURORVNTI0ZJTkFMTFk="},{"title":"03/31/12 SATURDAY STUMPER","author":"Lester Ruff, edited by Stanley Newman","date":"2012-03-31","grid":"VE9TVEFSVCNDQVBJVEFMClVQVE9QQVIjQUxMRE9ORQpSRVBMRVRFI1JFRUxFQ1QKRlJFRVMjQlJSI0RFTEhJCldBVFQjRkxVSUQjU09PVApBVEUjV0lFTkVSUyNPUkIKUkVSRUFEUyNTWU5BUFNFCiMjI0FORCMjI0xPVCMjIwpTVEFSVExFI0hBUlZBUkQKUEVJI1NFUlBFTlQjQkVFCkVBUkwjRFJFQUQjTklUUwpFVEhFUiNBUFIjQkFHSVQKRElFRE9XTiNTVEVGQU5JCkVNQUlMRUQjT1JBVElPTgpSRURORVNTI0ZJTkFMTFk="},{"title":"04/01/12 AFTER AND BEFORE: A symmetric switcheroo","author":"S.N., edited by Stanley Newman","date":"2012-04-01","grid":"VEFFQk8jQUJFVCNPU0xPI1RJTlRTClVSQkFOI0hZUE8jU0xPUCNJTkFXRQpCRUFUVEhFUkFQI0hJVFRIRVNQT1QKU0FZI1JPQUQjU0lLRVMjSUdVRVNTCiMjI0xBTkQjRE9OT1IjQUpBUiMjIwpBVFRBQ0sjV0VJU1MjRU5BTUVMRUQKQlJPT0sjUk9MTFRIRURJQ0UjSVJFCkFZRVMjU1VSRiMjI01BU0sjR05BVApTT1MjUEFTU1RIRVRJTUUjTUVFU0UKRU5UUllGRUUjQVhFTFMjRkFUVEVSCiMjSEFSRVMjQ0xJTkUjU0FSQUgjIwpDTEVWRVIjSE9MU1QjU0hVVFRFUlMKUk9MRVgjVElNRVRIRVBBU1MjVEFQCkFWSUQjS0FORSMjI0NFTFQjSE9ORQpaRU4jRElDRVRIRVJPTEwjU0lFR0UKRVlFU09SRVMjQVRBTEwjUEhZU0VECiMjI0VSU1QjQlVUVEUjSE9ZQSMjIwpCQUxUSUMjVEVORVQjQk9PTiNITVMKU1BPVFRIRUhJVCNSQVBUSEVCRUFUCk1FTkxPI0NBR0UjQUxPRSNTRUlaRQpUUkVFUyNPV0VEI1BFRUwjU1RSRVc="},{"title":"04/02/12 GET WET","author":"Gail Grabowski, edited by Stanley Newman","date":"2012-04-02","grid":"T1JCSVQjSFVMQVMjUkFQCkhBUlNII0FOSVNFI0VDTwpTSE9XRVJXSVRIR0lGVFMKIyMjRU5FIyNURUFST1NFClNUUkFJR0hURU4jQUxBUwpUSUVSIyNPQVIjQU5EUyMKWUVOIyNTT1MjQUxJIyMjCiNTT0FLVVBTT01FU1VOIwojIyNUT1AjRU1TIyNQRVQKI0FSVFMjRUxJIyNMT0FECkZMRUEjUEFTVEVWRU5UUwpBUEFDSEVTIyNQRUEjIyMKV0FTSE9ORVNIQU5EU09GCk5DTyNVTkxJVCNUT1BBUgpTQU4jUkVTVFMjU05BS1k="},{"title":"04/03/12 HANDLE WITH CARE","author":"Billie Truitt, edited by Stanley Newman","date":"2012-04-03","grid":"TFBHQSNFTUlUUyNNQUxFCkFMT1QjUEFUSU8jT0RPUgpNRUFMI0lST05ZI1RPR0EKQkFMQU5DSU5HQUNUIyMjCiMjI05BU0EjIyNIT1VSUwpFTVBUWSMjQVNUSSNQRVAKTk9SSSNCSURTT04jU0hFClRSSUNLWVNJVFVBVElPTgpSQU0jQVRURVNUI0lERUQKQUxFI1pFU1QjI05FRURTClBFU1RPIyMjVEFCUyMjIwojIyNIT1VTRU9GQ0FSRFMKTUFURSNTVEFSVCNCQUlMCkFHRVMjUEFTVEUjT0tSQQpET05FI1NURUVSI1dFRVA="},{"title":"04/04/12 CONCLUSIONS","author":"Fred Piscop, edited by Stanley Newman","date":"2012-04-04","grid":"VEFJTFMjTE9QRVMjRUdHCkFYTUVOI0VSSVNBI05SQQpDTE9TSU5HQkVMTCNERUwKVEVOVFBFRyMjI0lNUEVMCiMjIyNQUk9QI0hFQVJUUwpHT0xGRUQjSURVTk5PIyMKQVdBSVQjU1RVTlQjRFVEClpFU1QjVEFDRVQjVFVUVQpBTlQjU0hJUlQjUEVDQU4KIyNTVEVFTEUjTE9BVEhFCkNSVVNUWSNXQUlMIyMjIwpISVBQTyMjI0JSRUFUSEUKSVNQI0ZJTkFMQU5TV0VSCkxFRSNGUk9NRSNUSUFSQQpFUlIjU0FUWVIjQVNTRVM="},{"title":"04/05/12 ON THE ROCKS","author":"Bruce Venzke, edited by Stanley Newman","date":"2012-04-05","grid":"Sk9MVCNBQ1JPU1MjUEFNCk9ISU8jTEFCUkFUI0VMSQpFTUVSQUxESVNMRSNBTEUKIyMjUExJRVMjRVBIUk9OClNVUkVCRVQjIyNQRUxUUwpFVFVERVMjVFlQRUFCIyMKVEFCT1IjQVJFQSNUQVBTClRIWSNUSUpVQU5BI1JBTQpPTlRPI0NBU0gjVkFMTEkKIyNVUE5FWFQjU09CRUlUClRIRVJFIyMjRlRXQVlORQpZRVNZRVMjQVJJRVMjIyMKUEFEI0RJQU1PTkRIRUFECk9SQSNMQVRFTlQjRVJJRQpTVFkjRU1FTkRTI0RBTUU="},{"title":"04/06/12 HEY YOU","author":"Lonnie Burton, edited by Stanley Newman","date":"2012-04-06","grid":"QkFJVCNSQU5HI0lOQkFECklOUkUjT0hJTyNOT0VORApHT09OI0dFTlQjR1JJRFMKR0lOTklFTUFFI09NUyMjCklOU0VDVCMjQUNUQUJMRQpTVE9SRSNJU01TI1JPQU0KSFNOI0RVTksjUFNBTE1TCiMjI0RBTk5ZS0FZRSMjIwpZT1lPTUEjUE9ORCNVTVAKRE9PUiNHT0VTI05FUEFMClNPTElDSVQjI0NFU1NOQQojI0FTSCNIRU5SWUNMQVkKRk9OREEjRUxJRSNIT0dTClJBREFSI1JBQ0UjRVBFRQpPS0FZUyNTTEVEI1dFU1Q="},{"title":"04/07/12 SATURDAY STUMPER","author":"Lester Ruff, edited by Stanley Newman","date":"2012-04-07","grid":"U0FNUExFUiNTQVZBQkxFCkVWSUxPTkUjRURJVElPTgpURU5VUkVEI1JFTlRPVVQKUFJJTUUjREFJTFkjRFZSCkxBVkVOREVST0lMI09SRQpBR0UjI09OQ1VFI1NNRUUKTkVSVk9VUyNTQ1JFRURTCiMjI0VCQiMjI09VUiMjIwpUQUNUSUxFI1NBTUJBRUQKRVJBUyNFWElUUyMjRFZJCkFNUCNTRUNSRVRDT0RFUwpQT0UjUEFVU0UjQVJFTkEKT0lMUklHUyNQQVJBREVSClRSRUFDTEUjRVhPVElTTQpTRVRURUVTI1JFTEVOVFM="},{"title":"04/08/12 SPOTS FOR SPORTS: Just take a letter","author":"Gail Grabowski, edited by Stanley Newman","date":"2012-04-08","grid":"UkVCVVQjQ0FSTCNBU1BJQyNCRUFOCkFNVVNFI0FTSUEjU0xBU0gjVVNOQQpNVVNDTEVDQU1QI0ZJU0hJTkdUSVAKIyMjI0xFQVAjQk9PVFMjUElMQVRFCk9GRldFR08jREVBUlMjQU1PRUJBIwpQUklPUlMjUEVMVCMjQ0xVQlMjIyMKRUFTRVMjQ0FSVCNFTEFJTkUjR0FCClJVVFMjUkFSRSNBTk9SQUsjV0VSRQpBRE8jR0VFS0dPRERFU1MjUEFORUwKIyNGQVJJTkEjRkFOUyMjSUxMSU5JCkNBRlRBTiNTRUFNT1NTI1NBTFVURQpCTEVFRFMjI0FNQVQjWUFMSUVTIyMKU0lOVVMjQlVTSU5FU1NDQUQjQVNBClRCU1AjUkVQRU5UI0lURU0jUlRFUwpWSUUjR09UT0xEI0FMRVMjTEVXSVMKIyMjU1VEQU4jI0FUT00jQ0FQT05FCiNTUElORVMjQkFTSVMjU1RST0tFUwpBTEFTS0EjQ09SUFMjTUFSQyMjIyMKUEVUVFlXT01BTiNTUE9JTEVEQkFUClBFVEUjQVJPU0UjVVJBTCNOT0JJRApTVElSI1lFTlRMI0VPTlMjWUVMTFM="},{"title":"04/09/12 GARDEN SHOPPING","author":"Gail Grabowski, edited by Stanley Newman","date":"2012-04-09","grid":"U1BPVCNCTEFCI0hJTlRTClBVUkUjRVVSTyNBTE9IQQpFUklFI0FMQVMjQkxFRVAKTkVPTkJVTEJTI0lTTEVTClRFTlNFIyNTRUNUIyMjIwojIyMjRFJTI1NBVVNBR0UKQVJFQSNBS0EjTUFOVEVMClBBQ0tBR0lOR1BMQU5UUwpUU0hJUlQjVE9FI1BPU0UKU1BPTlNPUiNPREUjIyMjCiMjIyNFUElDIyNBT1JUQQpQUkVFTiNTSE9FVFJFRVMKTEVBREEjS0lORyNBTE1TCkVBU0VMI0VMTU8jVEFQRQpBTUVOUyNERUVTI0VZRVM="},{"title":"04/10/12 SEW WHAT?","author":"Sally R. Stein, edited by Stanley Newman","date":"2012-04-10","grid":"VFJBWSMjU0FUUyNPTUVOCkhJUkUjTk9CRUwjUk9ERQpBU0lBI09OSUNFI0dBSVQKV0VBUklOR1RIRVBBTlRTCiMjIyNURFMjI1ZBTiMjIwpQRVBQRVIjVElFUiNOQkEKQUxBSSNJUE9EI1RIQUlTClBVTExVUE9ORVNTT0NLUwpBRE1FTiNSRUFQI1dIRUUKTEVTI0lSS1MjQVNTT1JUCiMjI1pPTyMjRlJPIyMjIwpMT1NJTkdPTkVTU0hJUlQKRVNQTiNFUk9ERSNPRE9SCkZMQUcjVEVOT1IjUE9MTwpUT05ZI1NPT04jI1NMRUQ="},{"title":"04/11/12 NOT QUITE WHITE","author":"Fred Piscop, edited by Stanley Newman","date":"2012-04-11","grid":"TElTUFMjU1BPUkUjQkFUCkFESUVVI1BBUktBI09ORQpQRUFSTEhBUkJPUiNOT04KU0FNUExFUiMjI1RSRU5ECiMjIyNJUktTI1dISVQjIwpTTElDRUQjSEVSRUdPRVMKSElWRVMjTEVWSU4jUEFXCk9CT0UjQkVSRVQjTUlTTwpFUlIjRFJBQlMjUkFDRVIKREFZVFJBREUjREVDS0xFCiMjVE9VVCNUSVJFIyMjIwpHUk9PTSMjI1NFTlRPRkYKUkFXI01JTEtZV0FZQkFSCklLRSNFUkFTRSNDUkVURQpQRVIjUkVCVVQjVE9ZRUQ="},{"title":"04/12/12 SHORT DISTANCE","author":"Charles Slack, edited by Stanley Newman","date":"2012-04-12","grid":"QUJMRSNGVVJTI01BTUJPCkxPT00jQVNJQSNFTUFJTApQUk9NI01JTlQjU0FVTkEKSE9QQUxPTkdDQVNTSURZCkFOWSNMVUcjSFVFUyMjIwojIyNIQVMjQkVHUyNNQVkKI1NMSU0jRE9MRSNTQU1FClNLSVBBR0VORVJBVElPTgpQRU5TI1VTRUQjTUVOUyMKQVdFI1BJUFMjVklNIyMjCiMjI1NJTE8jR0FTI0dPVApKVU1QQVRUSEVDSEFOQ0UKQU5JT04jSU9UQSNUT1RFCk1JQ1JPI1NIVVQjT01FTgpTVEFUUyNNT1BFI01FVFM="},{"title":"04/13/12 SWITCHING SIDES","author":"Richard Silvestri, edited by Stanley Newman","date":"2012-04-13","grid":"SEFMRiNPVFMjI1JJREdFCkFMQUkjRFJBTSNFTkpPWQpOT0lSI0VJTkUjUEFTVEUKR0VSTUFOTUFOR0VSIyMjCiMjI05BU1NBVVNBVU5BUwpBREhFUkUjIyNVTFRJTUEKTE9VU0UjQkFTSVMjQ1VUCk9SR1MjRE9HSVQjU09MSQpNRUcjRFJPT1AjRUVMRVIKQU1FTElBIyMjT0xFQVRFClJJRElOR0lOR1JJRCMjIwojIyNWRVNTRUxTRUxWRVMKSEFCSVQjTUFVSSNFSVJFCkFHRU5UI0VUT04jU0FHRQpIRURHRSMjT05PI1NMT1A="},{"title":"04/14/12 SATURDAY STUMPER","author":"Anna Stiga, edited by Stanley Newman","date":"2012-04-14","grid":"VEVNUCNGT0FNI0VUQUlMCkFRVUFWRUxWQSNCVURHRQpKVVRMQU5ERVIjQVhJTkcKTUlUI01ESSNKQU5FRE9FCkFQRSNQSVNUT0wjREFSTgpIQVJFIyNIQVJETk9TRUQKQUdFTlRKI1BBUkEjIyMjCkxFREVSRVIjTUlNT1NBUwojIyMjQVRPUCNORVdFU1QKQUJTU1lTVEVNIyNOQVNBCk1JTEUjS1VSQUxUI1NVUgpBTEFERElOI1JPTyNDQUwKWk9ORUQjREVDT1VQQUdFCkVYVFJBI0FET1BUQVBFVApTSVNTWSNTVVNTI1JFRFM="},{"title":"04/15/12 CASH CACHE: With a hint at 126 Across","author":"Bruce Venzke, edited by Stanley Newman","date":"2012-04-15","grid":"RE9VRyNBQ0hFI1FUSVAjR0VUU1RPCklQU08jU05BUCNWSU5FI1JFQVBFRApTQU5GUkFOQ0lTQ0FOUyNBTEdPUkUKQ0xBSVIjI0lDRSMjI1RBUCNTVFJPCiMjI0dSRVRFI0NPTU1PREUjQVRFTgpNRU5VI01PTkdPTElBI09TT0xFIyMKRVhUUkFPUkRJTkFSWSNCT1JFRE9NClJFSEVBVCNBTkQjIyNDRURFI0hJRQojIyMjSEVSIyNTT0xBUiNBTEtZTFMKU1ROUyNTRUFMI1ZBTElEI1NFRVJTClRJRU9OI0VYUE9VTkRFRCNFUk5JRQpBUlVCQSNGSU5BTCNBREFNI05BR1MKVEFSU1VTI0FTU0VUIyNZT04jIyMjClVOTyNTSEVMIyMjT0VEI1NDSE5PWgpFQVNURVJOI01PRFVTT1BFUkFOREkKIyNVSEFVTCNGQUlSUExBWSNXRUVQCkNBUlIjQkFDQVJESSNJTlNFVCMjIwpMRUdPI0xJVSMjI1NTVCMjTEhBU0EKQVRFQVNFI1NIT1dNRVRIRU1PTkVZCkNOT1RFUyNQVVJFI0FMT1QjUllORQpLQU5TQVMjU0hFRCNNRUdBI05BVFM="},{"title":"04/16/12 BIO-METALLIC","author":"Gail Grabowski, edited by Stanley Newman","date":"2012-04-16","grid":"I1RBR1MjRUJCUyNBU1BTCk5PQkxFI0FMT1QjTU9BVApBVEVBVCNST0RFI0VMU0UKR09MREZJTkdFUiNOSVRFCiMjIyNFUlMjI05PRERFRApTVE9ORVMjVEVFTlMjIyMKUE9SRSMjTEVBU1QjR0FTCkNBU1RJUk9OU1RPTUFDSApBRE8jV0FTQVQjI0FMVE8KIyMjU0lDRU0jQVJSRVNUCkRFRklORSMjQUxBIyMjIwpFRUxTI0NPUFBFUkhFQUQKQlJBVCNBQlVUI0VBR0xFClRJUkUjUk9NRSNTTE9QRQpTRUVSI1NFQVIjVE9TUyM="},{"title":"04/17/12 AFTER TAXES","author":"Sally R. Stein, edited by Stanley Newman","date":"2012-04-17","grid":"Sk9MVCNLSVRFI1NMQU5UCk9ISU8jSURPTCNQRUtPRQpTTkFQI1RBUlMjRURJVFMKSE9SU0VTSE9FTUFHTkVUCiMjIyNOQ09TI0FSRSMjIwpKU0JBQ0gjI01EUyNNR00KVU5JVFkjT0RJRSNQRVJVCk1FRElDSU5FQ0FCSU5FVApCRUVUI0dMRUUjVVBTRVQKT1JTI1NMWSMjQ1JFQUtTCiMjI0NPTyNST0FSIyMjIwpCRUVJTk9ORVNCT05ORVQKVVRVUk4jT1ZBTCNBVVJBCkZBUkNFI0RVS0UjU0xJUApGTE9BVCNTUEFTI0FMRVM="},{"title":"04/18/12 ASSET MANAGEMENT","author":"Billie Truitt, edited by Stanley Newman","date":"2012-04-18","grid":"U0NBTFAjSURFQSNNQU1BCkFMR0FFI01VVFQjT1BBTApDVVJCQVBQRUFMI0NFREUKS05FRSNJUlMjQVJLIyMjCiNHRUxBVE8jS1JBVElPTgojIyMjU0FWSU5HR1JBQ0UKQ0FSQVRTI1ZJRSNJTEVTCkFSRU5PI09BVCNXQVNBVApST1BFI0FOTiNTQUxPTlMKQkxBQ0tCRUFVVFkjIyMjCk9MRERBWVMjR09TT0ZUIwojIyNPTlMjQUxJI1RFQU0KQ0FTVCNNQUdJQ0NIQVJNCkFMT0UjQUNSRSNQRVNUWQpQQVdTI0xFQVIjQVJUU1k="},{"title":"04/19/12 NOUNSENSE","author":"S.N., edited by Stanley Newman","date":"2012-04-19","grid":"RFJBQ0hNQVMjUE9TU1VNClJFUFJJRVZFI09QUE9TRQpJTVBPUlRBTlRQRVJTT04KUE9JU0UjI0RFRVJFIyMjClBUQVMjQk9TU1kjRUJCUwpZRU4jSEFEI1RFQSNBTEkKIyMjQ0FOT0UjI01BSk9SCkFMTE9WRVJUSEVQTEFDRQpQSUFOTyMjREVBTFQjIyMKRU1UI0NDUyNBUkUjUkFHClNQRUMjT1BBTFMjU0VSQQojIyNSRUhBQiMjTUFURVIKQU5EQU5PVEhFUlRISU5HCk1PVU5EUyNPUklHSU5BTApBVEJFU1QjUkFURUJBU0U="},{"title":"04/20/12 MISSING INACTION","author":"Lonnie Burton, edited by Stanley Newman","date":"2012-04-20","grid":"RkxBR1MjVkVTVFMjR01DCkJJQkxFI0hJVElUI0xPTwpJVFNFRU1TU09NRUJPRFkKIyMjQVJFIyNSRVRJUkVFCklDT04jTElBTSNTT0lMUwpGTFVTSCNDVVNQI05BU1QKU0VaI1VTRVMjQUREIyMjCiNGT1JHT1RUT1dSSVRFIwojIyNFRU4jUlVTRSNJVkUKQ0FQUyNTVElSI1dBREVTCkFMT1VEI1JBU1AjTUVSRQpTVElNVUxJIyNJTkIjIyMKVEhSRUVPRlRIRUNMVUVTCkxFTyNUVUxTQSNBSVNMRQpFQVQjU1RFUFMjQU5OSUU="},{"title":"04/21/12 SATURDAY STUMPER","author":"Brad Wilber, edited by Stanley Newman","date":"2012-04-21","grid":"T0lMUklHUyMjI1BFU1RPClBMQVlUQVBTI01PREVSTgpUT0JFU1VSRSNVTlRSVUUKSVZFUyNaSUdHRUQjUERBCkNFTCNCWVRVUk5TI0VFQwpTTEVFVCNaRVVTI0dOQVQKI0FEWkVTI0RFVFJJVFVTCiMjI0lBTUIjTEVBUiMjIwpKT0FOTUlSTyNSSVRFUyMKQVhMRSNET1JQI1NIUlVHCktPSSNBR09OSVpFI01NTApBTkUjRkVNQUxFI1BJQU8KUklOR0lOI1RJTlBBTlRTClRBVEVSUyNFTkRPV0VSUwpBTk9ERSMjI0dBSU5TQVk="},{"title":"04/22/12 EMPTY WORDS: At last, for a change","author":"Norma Steinberg, edited by Stanley Newman","date":"2012-04-22","grid":"V0VEUyMjRkFVTkEjRkRJQyNUSElOCkVSSUMjU0lNUEVSI0VVUk8jUk9WRQpCUk9PTUNMT1NFVCNURVJNTElNSVQKQkVEUk9PTVMjREZMQVQjUE9OSUVTCiNERVBPVFMjU0xPRVMjRkxVS0VTIwojIyNJRFMjT1BFUkEjU1VFREUjIyMKVEhFVVMjU1RPUk1GUk9OVCNUQlNQCkVFTFMjVklUTyMjI0FOREVTI09XRQpBUk0jRkVMT05TI1dJR1MjVElUQU4KS0VTVFJFTCMjSVJPTlMjTVVTVE5UCiMjVFJBUFMjQ1JPTlkjTUVOTE8jIwpDQVJPTVMjQ0hFRUsjI0FUVEVNUFQKT1hFWUUjR0xBRCNTTElNRVMjT09PClBPRSNTQUxFUyMjI1VCRVIjQlVSTgpFTlRSI1RFQU1TUElSSVQjU0FURVMKIyMjQVNUQVIjSE9ORUQjQklUIyMjCiNCRURMQU0jVk9MVFMjUk9ESEFNIwpNQU5JQUMjUE9XRVIjU0hPRVRSRUUKU1RFQU1IRUFUI0NVU1RPTUJVSUxUCkdJUkwjRUxTRSNBVEhFTlMjQkFCQQpUS09TI0RJT1IjVEhZTUUjI1NMQVQ="},{"title":"04/23/12 ZIPPY","author":"Billie Truitt, edited by Stanley Newman","date":"2012-04-23","grid":"U09SVCNQUklDRSNTUEFNCkVWRVIjUkVCT1gjUElUQQpMQUxBI09WRVJUI0FUT00KRkxZSU5HU1RBUlQjQ1BBCiMjI1RBUiMjTEFVR0gjIwpUU1UjQkFMRSNTVFJBUFMKSElOVCNNSU5UI1RPVEFMCkVYUFJFU1NERUxJVkVSWQpTVFJJUCNUSUxFI0VOQ0wKRVlFTEVUI1RFQU0jVEhZCiMjUExFQUQjI1BBRCMjIwpBSEEjU1BFRURZVFJJQUwKRk9SVCNPTERJRSNFREdFCkFORVcjVVRJQ0EjU0VFTgpSRURPI1RBVEVSI1NBU1M="},{"title":"04/24/12 PASS THE PUCK","author":"Gail Grabowski, edited by Stanley Newman","date":"2012-04-24","grid":"VEFCUyNGTFVURSNPUEVDCkFMT1QjUklDRVMjTk9WQQpMT1JFI0lOTEVUI1RSRUsKQ0hFQVBTS0FURSNIRVJFCiNBRExJQiMjSEVNSSMjIwojIyMjR0VUUyNNQU5HT1MKTUVEUyNFQUNII1NJTkdFCk9DRUFOI0NPTyNTQ0FMRQpDSEFGRSNUT1dOI0VXRVIKU09SRUFUI1BMT1cjIyMjCiMjI1RST1QjI1dBU1BTIwpBUk1ZI01BVENIU1RJQ0sKU09PTiNBTVVMRSNBTEFOCkFMT0UjVEVOT1IjWU9SRQpQRVNUI09SQVRFI1NURVc="},{"title":"04/25/12 OUTTA SIGHT","author":"Norma Steinberg, edited by Stanley Newman","date":"2012-04-25","grid":"UExVTSNPU0xPI01BTUVUClJVU0UjU1RJUiNBTElLRQpPTlVTI0NBU0EjUklTRU4KRkFSQVdBWVBMQUNFUyMjCklDRSNJUkEjI1JVTk9VVApUWVJPTCNUV0lHUyNVTk8KIyMjQU1JI0lWWSNFUklOCkRJU1RBTlRSRUxBVElWRQpST1RII1RFRSNFUlIjIyMKSVRBI0NPTERTI0RFQUxUClBBUlJPVCMjRVJFI1JPTwojI1JFTU9URUNPTlRST0wKQ0xJVkUjQVVUTyNIT1NFCkRPTlVUI0ZST00jRVlFRApTQUdFUyNUT1JZI05PTk8="},{"title":"04/26/12 GREAT STRIDES","author":"Charles Slack, edited by Stanley Newman","date":"2012-04-26","grid":"SEVJUiNEQUxJI1NXT1JFCk9HUkUjRURFTiNIQURFUwpQT0l