{"id":"usatoday-1999","publication":"usatoday","year":"1999","count":250,"puzzles":[{"title":"USA Today 01/04/99 \"HOT STUFF\"","author":"By Charles Preston","date":"1999-01-04","grid":"R09BVFMjQVJBQiNTUEFOClJFTElDI0dPUkUjSE9QRQpFUkFUTyNSQUdFI0VNSUwKIyNDQUxHQVJZRkxBTUVTCkJMQU5EQSMjTFlFI0VDTwpFQVIjU0xBS0UjQVJMRU4KRVRUQSNPUkUjT05PIyMjClRIRUZJUkVORVhUVElNRQojIyNBVEUjWUVUI1NOQVAKQVdBUkUjTUFDQVUjRklFCk1BRCNNQkUjI0lOU0lERQpCVVJOU0FOREFMTEVOIyMKVVNJQSNJREVTI0VESVRIClNBQVIjWkVTVCNTQVRJRQpIVU5LI0VMSUEjU05FRVI="},{"title":"USA Today 01/05/99 \"TWO BITS\"","author":"By Charles Preston","date":"1999-01-05","grid":"Q0FQTyNNQ0NDI0JBUkVECk9NQU4jQUxBUiNBREVMRQpOSVBTI1RFUkkjUk9CRVMKQUdFI1FVQVJURVJCQUNLCk5PUiNVUk4jRVJJRSMjIwojI1RIRUUjQVJOTyNNUlMKQUNSRVMjQVhJUyNCQUFMClFVQVJURVJUT1RXRUxWRQpVUklTI0VCT04jUkFDRUQKQUxMI0VSSU4jUkVOTyMjCiMjI0lOSVQjQkVBI05BUApRVUFSVEVSREVDSyNUUkEKVVNIRVIjQVJJRSNIRUVMCklOT05FI0dBR1MjQU5ORQpQQVlFRSNFV0VTI1NUQVI="},{"title":"USA Today 01/06/99 \"ASSORTED SIZES\"","author":"By Charles Preston","date":"1999-01-06","grid":"QU1FTlMjVEFMQyNTTEFNCkJBR0VMI09MSU8jTElETwpCSUdCQURXT0xGI0lNQU4KQURTI1RJTlQjRkVNQUxFCiMjI1BFTlMjREVNUFNFWQpSRUNFREUjRkVSTUkjIyMKQUNSRSNST0xFI0FDSE9PClNIT1cjU0NBUkUjS0lOSwpQT1dFUiNUSUVSI0lERUEKIyMjRUlERVIjT1JORVJZClNDQVJMRVQjQURFUyMjIwpQQU1FTEEjQU5FVyNHQVAKT0JPRSNGQVRTRE9NSU5PCk9JTFMjRUxNTyNST0FOUwpLTkVFI05FT04jRE9ORUU="},{"title":"USA Today 01/07/99 \"TV HISTORY\"","author":"By Charles Preston","date":"1999-01-07","grid":"TUFDI1RPTkFMI0ZJTEVUCklETyNBUkVOQSNJTklHTwpEQU0jSEFXQUlJRklWRU8KSU1QUklOVCMjREVURVNUCiMjQUlUIyNUU0UjSU5UIwpDQU5ESURDQU1FUkEjIyMKT0JJRSNMQUxPI0VMQk9XCkVMTyNHSVZFT0ZGI0FQRQpERU5TRSNJTlRPI0JSVVQKIyMjTUVFVFRIRVBSRVNTCiNPTEEjRFlTIyNPQUYjIwpTQ09SSUEjI1JFTEVBU0UKV0hBVFNNWUxJTkUjQ0FECkFSVElFI1JFQVRBI0VHRwpURUhFRSNTSUxFWCNEQVk="},{"title":"USA Today 01/08/99 \"ANCHORS AWEIGH\"","author":"By Charles Preston","date":"1999-01-08","grid":"TEVUIyNTTEFTSCNQRUVSCkVMSUEjVEVTVEEjT0dSRQpNRU1CRVJTSElQI0VHSVMKQVZFUlNFI0VSU1QjU0VUCk5FWFVTRVMjI0JPU0gjIwojIyNQQVBFUkNVVFRFUiMKVEVTVFkjQ0hBUiNTTElQCkFNSSNTQVJPTkdTI0xPVApXSURFI0xFTk8jQ09TVEEKI0xFR0FMVEVOREVSIyMjCiMjTE9CTyMjU0FOREFMUwpPQkkjQVRMRSNUSUVQSU4KUEFOVCNUSVBQRUNBTk9FCkFORVcjRU1FRVIjTEVOQQpIRVJPI0RFRVBTIyNBU0s="},{"title":"USA Today 01/11/99 \"M-PHASIS\"","author":"By Charles Preston","date":"1999-01-11","grid":"U0FBQiNGQUhEI1RPUVVFCkVSTEUjRUxFRSNFVkVSUwpMRUFOI1JPQVIjQklERVQKTUFSR0FSRVRNRUFEIyMjCkFTTUFSQSNIQUxMI0FTUAojIyNMQVJTIyNBREFHSU8KSkFNI01JVENITUlMTEVSCkFNT1MjI0FBQSMjTE9WRQpNQVJLTUNHV0lSRSNXRVMKSVNBSUFIIyNHQVJQIyMjCkVTTCNORVNUI1lJRUxEUwojIyNNQVJMRUVNQVRMSU4KU0VMSUcjQVJMTyNSQVZFCkdSQVpFI0JSQU4jT01BUgpUQVhFUyNTRU5EI0xBTkQ="},{"title":"USA Today 01/12/99 \"MARITAL\"","author":"By Charles Preston","date":"1999-01-12","grid":"U1BBUiNTQ0FMQSNBTE1TCkFSR08jTEFHRVIjTk9BSApQT0VNI0VSQVNFI0RVVFkKI01SQU5ETVJTTk9SVEgjCiMjI05PU0UjI0FXRSMjIwpFUklDSCNOQkEjTkFDUkUKQUVORUlEI0FSSSMjSEFHCkdIT1NUQU5ETVJTTVVJUgpMQU4jI0JBRyNTUEFSU0UKRUJFUlQjR0VMI0lTTEVUCiMjI0VORSMjQUVSTyMjIwojTUVBTkRNUlNKT05FUyMKUEFTUyNHVUlTRSNJVkVTCkFMU08jQVNQSUMjVElMRQpORU9OI1JFU0VUI0VMTEE="},{"title":"USA Today 01/13/99 \"CHILD'S PLAY\"","author":"By Charles Preston","date":"1999-01-13","grid":"U1RPUCNHQVBFRCNNRUxTClRBTUUjQUdBVEUjVU5JVApVTE5BI0xPVFRBI0VERFkKU0NJU1NPUkhBTkRTIyMjCiMjIyNFUkEjIyNBTFVNUwpNQVJJTkUjQ0xBUklORVQKT1BFTlMjT1JBRCMjSU5BClJPQ0tFVEdJQlJBTFRBUgpBR08jI0FMRVMjUElFQ0UKU0VSUkFURUQjU1RFUkVTClNFREVSIyMjU0FUIyMjIwojIyNQQVBFUlBST0ZJVFMKR0FMRSNFWEVSVCNPVE9FClBMQU4jUkFEQVIjWU9EQQpBSU5UI0VNT1RFI1RST1Q="},{"title":"USA Today 01/14/99 \"UNDER COVER\"","author":"By Charles Preston","date":"1999-01-14","grid":"U1BFRCNTVURTI1JJR0lEClRSVUUjVE5VVCNBREFURQpBQVJFI0VSTUEjVklSQUwKVFdPU0xFRVBZUEVPUExFCkVORCNBRFMjU0FMVCMjIwojI09MRCNUQVBTI1NPRlQKVkFMSUQjI1JVQ0sjUFJZCkFTTEVFUElOVEhFREVFUApSSUEjUkFOSSMjUElOVE8KWUFSRCNVVEVTI0xFTSMjCiMjI1JVTEUjSUNFI0lSQQpTTEVFUElOR1BBUlRORVIKV0lMREUjRElQUyNPREVTCkFMSUdOI0VMRUUjUEVTTwpCQVNFRCNEQURTI0VERU4="},{"title":"USA Today 01/15/99 \"DAYTIME DRAMAS\"","author":"By Charles Preston","date":"1999-01-15","grid":"QVNTIyNSRUdBTCMjT1NBCklOVE8jRU5FTVkjQVJBQgpNT09OI1JBTkVFI0xBVEUKRVJJRSNVVEVTI0FMTE9UClJFQ0xJTkVSI0FSTSMjIwojIyNJRlMjQUxMRVlDQVQKQkVFRlkjUExFQSNDQVJFClJBUkUjTEVIQVIjSElORApBU0lUI0FST0QjVElORVMKREVDT1JPVVMjUEFMIyMjCiMjI0xBUyNQUk9VREVTVApSQVBJRCNMSUFUI1JBVEUKQVZJViNMT1RURSNFVkVSCkNJVEUjQUdBSU4jTkVFUgpFREEjI0hFTE9UIyNTTFk="},{"title":"USA Today 01/18/99 \"MERLIN'S PROTEGES\"","author":"By Charles Preston","date":"1999-01-18","grid":"QkFSI0FCRUFNI0JBU0tTCkVMSSNDQUxWRSNFUk5JRQpBUFBBUkVMRUQjRUxBVEUKVEhFV0laQVJET0ZPWiMjCkxBTkVEIyMjTEFTI1pBUApFU1MjI01BSEVSI1BJQ0EKIyMjU0FCTEUjI09SRUFECiNQSU5CQUxMV0laQVJEIwpNQU5JQSMjUEFUU1kjIyMKRUFSUCNGQVNUUyMjQ0FSCkFSRSNXRUIjIyNFVEFQRQojI1RIRVdJWkFSRE9GSUQKRVFVQUwjREVMRUdBVEVTCkxVUklEI0VBR0xFI0FDRQpMT05HUyNTTEFZUyNORUE="},{"title":"USA Today 01/19/99 \"CONFLICT\"","author":"By Charles Preston","date":"1999-01-19","grid":"TElNUCMjRE9PUlMjRklCCkFSQVIjQVVLTEVUI0lTTwpXQVJBTkRQRUFDRSNHU0EKU0VSSUFMTFkjQVJUSFVSCiMjI1NNRUUjR0xPQVRFRApTUFJJRVIjI0FMSUJJIyMKTE9JTlMjTUFURUQjVEFHCkFHT0cjQk9ORUQjV09SRQpNT1QjU0VORFMjVEFVTlQKIyNTUVVBVCMjTU9OVEVaClJFUVVJVEUjTUlORCMjIwpFUVVBVEUjU0FMSUVOQ0UKU1VBI0JBVFRMRUNSRUVLClRBRCNBU0hJRVIjRVJMRQpFTFMjR0VFUlMjI0RJVFM="},{"title":"USA Today 01/20/99 \"OUTLANDISH TIMES\"","author":"By Charles Preston","date":"1999-01-20","grid":"I0FSS0lFI0RJT1IjVEFHClNMT0FORSNPTkRFI0lEQQpIT1VSR0xBU1NFUyNNSUcKT05FQSMjQkVUVEUjRVRBClJFU1RPUkUjQVNDQVAjIwojIyNFUElMT0cjVFJJUFMKUEFTU0FUI0xFVCNNRVJFCkFOVCNIQU5EU1VQI0NBUgpJTk9OI1NPVCNUT0JFTUUKREVQT1QjTk9EVUxFIyMjCiMjV0hJR1MjQVNTQUdBSQpURUEjUExFQVMjI1RPTEwKQUxUI1BVTkNIQUNMT0NLClRJQyNMRVNUI0FSRU5BUwpBU0gjRVJFSSNTVVNBTiM="},{"title":"USA Today 01/21/99 \"ANATOMY OF A FALL\"","author":"By Charles Preston","date":"1999-01-21","grid":"R0VPI1NFTE1BI0ZMSUVSCkFSTSNBRElPUyNBT1JUQQpMRUFWRUlOVEhFTFVSQ0gKQUNIRSNURUUjTEFEIyMjClNUQUdHRVJMRUUjRVJTVAojIyNHT0QjI0FWQVJJQ0UKQkFTSUUjU0FWRUQjUEFOCk9DVEVUI1BJRSNBVkVSVApNVEEjSEVJUlMjR0VORVMKQklHREVBTCMjU0lMIyMjClNORUUjU0xJUENPVkVSUwojIyNDSEUjUklBI0VSQVQKU0NIT09MRklFTERUUklQCkJVT1lTI0FTVEFSI09OQQpBQllTUyNTSEFSSyNSU1Q="},{"title":"USA Today 01/22/99 \"TEAM PLAYERS\"","author":"By Charles Preston","date":"1999-01-22","grid":"QVJNUyNPU0NBUiNUTUFOCkNJQU8jUkhPTkUjSElSRQpSQVpPUkJBQ0tTI0VETkEKRUxFTkEjWUFMRSNBU09SCiMjI0VORCMjRUFSVEgjIwpXQVJSSU9SUyNMVVJJTkcKQUdFUyNJT1RBI05FUEFMCkZBRCNJTlNPTEVTI01JQQpUSVJFRCNTSUxUI1JFVlMKU05BUkVEI0NZQ0xPTkVTCiMjSU5FUlQjI0hPQyMjIwpNQURFI0FJREEjVUtBU0UKQVJFUyNQUkVTSURFTlRTClNFUlQjRU9TSU4jVFlFUwpUQVNTI1NMSU5LI1NBTkU="},{"title":"USA Today 01/25/99 \"STYLISH\"","author":"By Charles Preston","date":"1999-01-25","grid":"U0xBUFMjR1VTVCNBU1RBClRJQkVUI0FOVEUjUEFSUwpESUNLRU5TSUFOI0VWQVMKIyMjT1JFI1RST1QjT05FClJFU0VOVFMjVFJPUElDUwpBUkkjQVRMSSNTTkFSRVMKRE9HUyNMQU1CI0VMRiMjCiNTSEFLRVNQRUFSRUFOIwojI1RJTiNIRVJSI0RJRVQKUFJVTkVTI0xFTlMjUkVEClJFTlRBTFMjVElMTEVSUwpJVFMjREFOQSNDSUEjIyMKTUlFTiNLQUZLQUVTUVVFCkFSRUEjRUlSRSNTRVVTUwpMRU5UI1NMT0cjVFJPT1A="},{"title":"USA Today 01/26/99 \"DO YOUR DUTY\"","author":"By Charles Preston","date":"1999-01-26","grid":"U1BSQVQjQ0FQI0FETElCCk9ST05PI09MRSNUSUFSQQpSSU5HTyNMRVQjSEFXRUQKQkFET0ZGSUNJQUxTIyMjCiNNT1JBTFMjVFJFI0VBVAojIyNBUkVFTEVDVEVEQlkKT1JBIyNEVU8jU0VORFVQClNBRkUjI01FTCMjU0lURQpBRE9OSVMjV0FSIyNFU1MKR09PRENJVElaRU5TIyMjCkVOVCNFTEkjSURFQUxTIwojIyNXSE9ET05PVFZPVEUKUEFTRU8jSUxFI1RBUkVTClVEQUxMI0VMUyNFR1JFVApCRUxMRSNEQVMjREVFUkU="},{"title":"USA Today 01/27/99 \"FAMOUS FIRSTS\"","author":"By Charles Preston","date":"1999-01-27","grid":"TUVUUyNCT0NBI0JSQVdMCkFMRUUjSVJBUSNSQU1JRQpBT05FI0FUVFUjT0RFVFMKTUlOTkVTT1RBVFdJTlMjCiMjIyNMRU4jI09OTyMjIwpBTkdFTFMjQkFZUyNTU0UKTE9JUkUjSE9CTyNBTEFTClRPUk9OVE9CTFVFSkFZUwpFTkRTI1JPQkUjTUFOU0UKUkVTI0RFRlkjU0VYVE9OCiMjI0xVViMjQUNFIyMjIwojRkxPUklEQU1BUkxJTlMKV0FJVEUjT1JBTCNBUkVBCk9VU1RTI0dBWkUjSEFSSwpFWFBPUyNTTEVEI1JFRFM="},{"title":"USA Today 01/28/99 \"HOME FOLKS\"","author":"By Charles Preston","date":"1999-01-28","grid":"RURHRSNBUFNPI0NMT1ZFCk1FQUwjR0FJTCNIRVJFUwpNQUxMI0FUVEEjQVdBUkUKQUxMSU5USEVGQU1JTFkjCiMjI1NPSE8jI0xQUyMjIwpCU0EjUkFTQ0FMUyNERUYKQUNSRVMjI0FSQSNBUk5PClNVTU1FUklOVEhFQ0lUWQpBQkVUI0FOQSMjTEVWRUUKTEFEI0FCQUxPTkUjRVJSCiMjI0hVQiMjVEVOUyMjIwojVE9ZU0lOVEhFQVRUSUMKVElCRVQjVVNFRCNSSURFCkFMT05FI0tBUkwjQU1FTgpHTEVBTiNFUlNFI1BFU1Q="},{"title":"USA Today 01/29/99 \"HERE'S JOHN\"","author":"By Charles Preston","date":"1999-01-29","grid":"I0RBSVMjRUNVI1RST1BFClJFVU5FI01SUyNIQUxFWQpBQ1RPTiNDT04jRURJTEUKSk9ITkRPRVdBUlJBTlRTCkFETyMjV0VEI09BUiMjIwpIRVJNQU5TI01PVCNDQVAKIyNTQUMjI1JBTVBBUlRTCkpPSE5RVUlOQ1lBREFNUwpBTUlOVVNFUyMjQ1VCIyMKUkVQI0FVUyNUQUtFQUxMCiMjI0FJUiNTT1MjI1BMVQpKT0hOTllPTlRIRVNQT1QKQVdBSVQjVkFUI0FMTFlFCkRFTlNFI1VLRSNDT0VEUwpFTkRFRCNNRVIjSEVTUyM="},{"title":"USA Today 02/01/99 \"ANIMAL HUES\"","author":"By Charles Preston","date":"1999-02-01","grid":"Q0FQUyNSU1ZQI0FHTEVUClVDTEEjQU1JRSNEUklWRQpCUk9XTkRFRVIjT0FURVIKU0VXI09JTCNNQVJZQU5OCiMjI1dSQVRII1JFUCMjIwpMRVRIQUwjT1BFUkFUT1IKQVZPSUQjR0xFTiNOSUNFCkdBTlQjQ09TVEEjVEFUQQpFRElFI0xBVEUjU0hSRUQKUkVDUkVBVEUjQ0hFQVRTCiMjI0FMUyNSVUxFUiMjIwpMQU1CQVNUI05PUiNBU0EKQUxJQkkjU0lMVkVSRk9YClNURUlOI0FSSUUjT1JBTApUQVNURSNSQVRTI1lPS0U="},{"title":"USA Today 02/02/99 \"SCIURIDS\"","author":"By Charles Preston","date":"1999-02-02","grid":"U0VBUyNBU1NFI0FSQ0VECklOU1RJTkNUUyNSRUhJRApHUk9VTkRIT0cjR0FJTlMKTk9OI0dSRUcjUk9NUFMjCklCSVMjT1JJQklTI01UUwpORUFUTyNaRVVTI1NVRVkKIyMjQU1NTyNNRUxBTklOCklOU1lOQyMjI1JPQ0tORQpURVFVSUxBI1RTQVIjIyMKU09VUCNFRERZI05BTUJZCkFMSSNNQUxJQ0UjTEFSQQojSVJXSU4jRE9NTyNOQU4KU1RSQUQjV09PRENIVUNLCkNIRUxBI1BFTkVUUkFURQpJU0xFUyNBU1NOI0VMU0U="},{"title":"USA Today 02/03/99 \"GETTING THE BLUES\"","author":"By Charles Preston","date":"1999-02-03","grid":"I0JJQ0FSQiNHQUcjU0lHCkJFTkJMVUUjT0FSI1BSRQpPTkNFSU5BQkxVRU1PT04KQURBUiNHUkFEI1RFUk5FClJFUyMjI0VMRiNBUkFCUwpEUkVBTUVSI0lUUyNETEkKIyMjR0FMI0FTSCNQSVVTCiNCTFVFSU5USEVGQUNFIwpQTEVBI1pFRSNJT04jIyMKSFVOI0JBUyNQUkVTVU1FClJFSU5FI1RSQSMjI1JVUgpBTEVBRCNFQVNUI0VTU0EKU0lOR0lOR1RIRUJMVUVTCkVOQyNNRUcjQU1JQkxVRQpERUUjU09TI1NBTEFBTSM="},{"title":"USA Today 02/04/99 \"AT THE LANES\"","author":"By Charles Preston","date":"1999-02-04","grid":"SU5HQSNUT1RFTSNET0ZGCk5PSVIjQVJPTUEjT1BBTApST0xMSU5HUElOI0xFTkEKQURNRU4jU1BMSVRFTkRTCkdMQU5EUyNTWU5FI0JBSApTRU4jRVBBIyMjTk9PTkUKIyMjRkVFTEVSIyNET0NTCiNXSUxEQ0FUU1RSSUtFIwpHT05FIyNTRVRTT04jIyMKUk9TRVMjIyNVUFMjV0NTCkVEVCNUQUZUI1NUUkVFVApTUEFSRVRJUkUjUklBVEEKSElMTyNCTElOREFMTEVZCkFMTFMjQUNUT1IjRVRSRQpNRVNTI1RIRVNFI1NIQUQ="},{"title":"USA Today 02/05/99 \"FINANCIAL MATTERS\"","author":"By Charles Preston","date":"1999-02-05","grid":"QkVSUkEjQlJPVyNBQ01FCklMSUFMI0FVUkEjU0hFRApCTEFOS0NIRUNLI1RJTkUKIyMjI0VPUyMjRURJQ1RTCiNTUEFOUyNDQUZFI0tPUwpGT1JHRVQjRUxVTCNFUkEKQURFTiNTSU1PTEVPTiMjClJBVEVMI1JFRiNTVUZJUwojI1RXT0NFTlRTI05FTkUKQ1JZI0NBTlQjQVNDRU5UCkhJUCNBTEVTI05FRURTIwpPVkVSTFkjI0RFRSMjIyMKS0VOTyNQQVBFUk1PTkVZCkVSTlMjU0xPVyNFVk9LRQpTQVlTI09CRVkjREFXRVM="},{"title":"USA Today 02/08/99 \"TREE'S A CROWD\"","author":"By Charles Preston","date":"1999-02-08","grid":"VEVUUkEjTEVOQSNQQURTCkFSSUVTI0hBRVMjQUxBSQpCRUVDSENBU1NJRFlBTkQKIyMjI09BU0VTI09OSUNFClNQRUNUUkFMI0NMT05FRApDRUxMIyMjI1NSTyMjIyMKQVJFQSNCVVRURVIjU01BCkRPR1dPT0RCVU1TVEVBRApTVFkjU0xPQU5FI09WSUQKIyMjI0hFUyMjIyNMRU5PCk5FQVRBUyNDSElMRFJFTgpJTlRPVyNBUklTRSMjIyMKUE9QTEFSTUVDSEFOSUNTCkFMQUUjUklTSyNQVVJFRQpUQVJTI1NFVFMjU1RFRUQ="},{"title":"USA Today 02/09/99 \"GO UP AND DOWN\"","author":"By Charles Preston","date":"1999-02-09","grid":"TUFMSSNBS0lOI0JPQlVQCk9QRU4jQ0lUWSNSVUlOUwpMRUFII0lCSVMjRVRURVMKRVhQQU5ET05FU0NIRVNUCiMjI0xPSVMjI0NIVSMjIwpTVFJFVENIVEhFVFJVVEgKSE9VUkkjI0lPTiNMSVJBCk9STSNUQUJMRUFVI05PUwpUQU9TI05PRCMjUFVUT04KU0hSSU5LUkVTSVNUQU5UCiMjI05JTCMjQVJFQSMjIwpSRURVQ0VUT05PVEhJTkcKQURPU0UjT0xJTiNBVkVSCllFTUVOI01FVEUjTkFWRQpFUk9TRSNCT1lEI1NOQUc="},{"title":"USA Today 02/10/99 \"SOUNDS LIKE FAREWELL\"","author":"By Charles Preston","date":"1999-02-10","grid":"TU9PTEEjQk9OR08jQVRFCklPV0FOI0FST09NI05PTgpMT05HR09PREJZRSNHQU0KIyMjI0xBQiNTQU5KT1NFClZBUklFVEFMIyMjQVJUUwpFTUlUIyNCSVJDSEJBWUgKUk9DT0NPI1BFQVUjIyMjCkJZSE9PS09SQllDUk9PSwojIyMjTElSRSNTS0lOTlkKQklMQVRFUkFMIyNORUlMCkFHSU4jIyNERUxFR0FURQpTTk9DT05FI0dJRyMjIyMKS0lOI0JVWUFNRVJJQ0FOCkVURSNPTUVHQSNFVFVERQpURUwjRUJTRU4jVE9QQVo="},{"title":"USA Today 02/11/99 \"LUCKY STREAK\"","author":"By Charles Preston","date":"1999-02-11","grid":"QlNBIyNUSURBTCMjTk9EClJVVEgjQU1PTEUjQkFORQpBTU9JI1BBVUxBI1JJQ0UKVE9NVEhVTUIjUkVFRkVSCiMjI1RPUCNMSU5EQSMjIwpFSUdIVCNCRU4jU0tBVEUKQUNSRSNXT09EUyNTSEFNCkdISUojRUdSRVQjVEVORApST01BI0JPTk5ZI0hBVEUKRVJFQ1QjVE9UI0xFRE9OCiMjI0tBUkFUI0dBQiMjIwpQRU9QTEUjSEVBREFDSEUKQVVUTyNBTElTVCNOT09OClRST1QjQ0FOVE8jS0FMSQpIT0UjI1RJR0VSIyNURUQ="},{"title":"USA Today 02/12/99 \"* STUDDED\"","author":"By Charles Preston","date":"1999-02-12","grid":"RE9HUyNQSERTIyNBU1RFCkVMTU8jTElBUiNSRVNPVwpCRUVGI0FOWUEjSVJBVEUKU0FOREFORFNTI1BJUEVTCiMjI0FXRVMjI1NFRVAjIwpTQUxWT1MjU01BTiNIQVQKQUJPSUwjU1RJUlMjSUxPCkxBTkQjU1VMTEEjU1JFRApJQ0UjU1RSRUsjUFRFUk8KQ09TI0xFRVMjSEVJU1RTCiMjU0hJTiMjU0VFTiMjIwpBRlRPTiNTU1BBTkdMRUQKU0xBTkcjRU5JRCNHVVJVCk9BVEVTI1RFTFMjVVJHRQpSVEVTIyNTRVRUI05FT1M="},{"title":"USA Today 02/15/99 \"HAIL THE PRESIDENTS\"","author":"By Charles Preston","date":"1999-02-15","grid":"VFlMRVIjUEFJTCNKRVJLClJFQVRBI0FOVEkjRUxFRQpXQVNISU5HVE9OI0ZJTEUKIyMjRURJRVMjQ0FGVEFOCiNQQVJTRUQjI09ORUVZRQpPUkIjI0NPQiNMQVIjIyMKRE9PUiNFV0UjTklTU0FOCkVOUk9MI05BQiNTT0FQWQpSRVRPT0sjQ0FSI05PVEUKIyMjU0lFI0hSRSMjTkVTCkFTVEVSTiMjT1BFTkVSIwpTSEFWRU4jQU5JVEEjIyMKU09NRSNFSVNFTkhPV0VSCkVWRUwjRFJBVCNBTUFUSQpURVNUI1lBUFMjTklYT04="},{"title":"USA Today 02/16/99 \"ON THE WING\"","author":"By Charles Preston","date":"1999-02-16","grid":"TkFCT0IjUkVIRU0jTkFCCkVMSVRFI0FMT05FI0FCWQpGT1JUSEVCSVJEUyNESVIKRkVEI09SQiNTRUFCSVJECiMjQkFMVElDI0FCSVJEUwpTVFJJREUjQVVWSU4jIyMKT1JBTEUjQVROTyNERUFMCkRFSSNSRURCSVJEI0FMSQpTRU5EI1NVSVQjUkFSQUUKIyMjQVBURVIjRkFMTElOCkJJUkRJRSNET1VCTFkjIwpJREVBTExZI0ZFTiNCRUEKVElBI0FMSVRUTEVCSVJEClRPVCNURVBFRSNTWVJJQQpZTUEjRVNTRU4jU0VERVI="},{"title":"USA Today 02/17/99 \"MUSICAL ROYALTY\"","author":"By Charles Preston","date":"1999-02-17","grid":"Q0FOQSNBQ1RTI1VUVEVSCkVUQUwjVEhFTyNQUlVORQpST0lMI09BSFUjS0FCT0IKRUxWSVNQUkVTTEVZIyMjClNMRUVUI0JFRUJFI0FCRQojIyNET09SIyNTUElMTFMKRUZUI01PT0VEIyNCT0FTCkpPSE5QSElMSVBTT1VTQQpFTElFIyNMSVNMRSNERVkKQ0lOREVSIyNFWUVTIyMjClRPRSNSSVNFTiNURUFSUwojIyNCRU5OWUdPT0RNQU4KTUFHSUMjQURBTSNBQkJBCkFQQVJUI1JJR0EjVEVBSwpXRUxEUyNMRUVSI0VSVEU="},{"title":"USA Today 02/18/99 \"SAY 'CHEESE'\"","author":"By Charles Preston","date":"1999-02-18","grid":"SEVSRSNDQUJMRSNJR09SCkFYSVMjQUxMQVkjTk9ORQpNQVNDQVJQT05FI0VSSU4KU01FQVIjU09EI0VSR09UCiMjI1BBUiNNRUdBVE9OUwpDQU1FTE9UI0RJR0lOIyMKUExPRCNCQVkjR0xBWkUjCkFEWiNBQlJJREdFI09OQQojT1pPTkUjUEFMI0dMSUIKIyNBVkVSUyNERUdSQURFCkNBUkVTU0VTI1NVRSMjIwpBTEVSVCNDSEEjU05JUEUKTUFMRSNORVVGQ0hBVEVMClVDTEEjQURMQUkjREVFTQpTS0FUI1BFQVJMI0FNUFM="},{"title":"USA Today 02/19/99 \"WRITING IMPLEMENTS\"","author":"By Charles Preston","date":"1999-02-19","grid":"UEFBUiMjTUFHSSNBRkFSCkFCTkVSI0FMQU4jUEVSSQpQRU5QVVNIRVJTI09BVFMKQVRFQVNFI0NST1NTVElFCiMjI0NIRVcjI0xBVEhFUgpDT0NLQURFUyNFTExFIyMKSFJII1RFQU1TI1RFUlJBCkFEQU0jRFJFQU0jU0NPVwpST0xFTyNZQVdFRCNVU0UKIyNLQVBQI1JFU0VOVEVEClNFVFRFRSMjUkFLRSMjIwpUUkFJTkVSUyNCQVRUTEUKUk9MRSNQRU5DSUxUSElOCkFTS1MjRURJRSNCTEFORApXRVNUI1JPUEUjI0VXRVM="},{"title":"USA Today 02/22/99 \"AGING PROCESS\"","author":"By Charles Preston","date":"1999-02-22","grid":"REFVQlMjVEVNUEUjT1JPCkVSUk9MI1VQVE9OI0xFVgpCQUJZT05CT0FSRCNJQ0UKSVJBI1BBSVgjI1NFVkVSClRBTksjU05JRkYjTEVJUwojVEVFTkFHRVJJTkxPVkUKIyMjUE9MI0RPUlkjWUVBClBFUlRIIyMjIyNNT0xEUwpJTEUjSUdPUiNCRVQjIyMKQURVTFRFRFVDQVRJT04jCk5PTkUjTUVOVVMjU0xJUApPUklORyMjQVJJQSNJQ1UKQkFUI09MRE1BTlJJVkVSCkFERSNET05PUiNFTElTRQpST0QjU1RBS0UjU0tBVEU="},{"title":"USA Today 02/23/99 \"GRAMMY WINNERS\"","author":"By Charles Preston","date":"1999-02-23","grid":"R1JBVEEjU0FNT1MjQVNICk5PTUFOI0FMRUNLI1JBWQpVUFVQQU5EQVdBWSNBSUQKU0VSRU5BREUjI0xBTkNFCiMjI1NJVEEjTEVBTiMjIwpDT1NUQSNNT09OUklWRVIKTElBUlMjI05PT0sjQVZBCkFMTFkjQkFJVFMjVFJFSwpORVQjUkVETyMjU0hJTkUKR1JBQ0VMQU5EI0NSQVNTCiMjI0FCTFkjRUxPSSMjIwpORUhSVSMjU01PVUxERVIKQUdBI0ZPUllPVVJMT1ZFClBJTiNGTFlOTiNHRU5FVApBU0sjU0VFRFMjRVJBU0U="},{"title":"USA Today 02/24/99 \"CAPITAL PUNS\"","author":"By Charles Preston","date":"1999-02-24","grid":"UklDRSNTTEFCUyNDQUJTCkFNT0sjUE9TRVMjQUdSQQpKVU5FQVVXSEFUSU1FQU4KQVNTI0JSRUVEI05VREdFCiMjSVZFUyMjI1REUyMjIwpTQURBVCNDVVJJRSNEQU4KQVdFUyNNT0RFUk4jSVdPCkhBUlRGT1JETUVUT1NBWQpJS0UjQURJRVVTI0FDUkUKQkVEI1RFQVJTI0lTTEVTCiMjI09ITSMjI0FOVEEjIwpEUkFDTyNHSUFOVCNJQ0UKUklDSE1PTkRQT09STUFOCkVTVEUjUEFMRUQjTkVNTwpXRUlSI1NXRURFI0FSRVM="},{"title":"USA Today 02/25/99 \"SUPER SLEUTHS\"","author":"By Charles Preston","date":"1999-02-25","grid":"U0hBTSMjVFJJI1NDT1BFClBBQ0VEI1JJRCNDQUJJTgpBU1RSTyNBR0UjQVBJTkcKU1RFVkVNQ0dBUlJFVFQjCk1BRCNTVUUjI09MRCMjIwojIyNCSUcjV0FERSNZRVMKUkVNSU5HVE9OU1RFRUxFCkFWSUQjI0VMSSMjQ0FTRQpKRVNTSUNBRkxFVENIRVIKQVJUI1RBTUUjVEhFIyMjCiMjI1RFTCMjQUNSI0FCRQojU0hFUkxPQ0tIT0xNRVMKTEFVUkEjUE9JI1dJUEVTCkFHRU5UI0FQVCNOT0xURQpQQVNTRSNMRUEjI05FU1M="},{"title":"USA Today 02/26/99 \". . FOR YOUR THOUGHTS\"","author":"By Charles Preston","date":"1999-02-26","grid":"UkFJRCNOQVBFUyNDQVVSCkFDSEUjRVJPREUjRUJSTwpTQ09GQVdPTUFOI1JJR0EKQVNQI1JBTVAjU09GVEVSCiMjI1ZFR0EjS0lSSSMjIwojU0hJTkUjTElCUkVUVE8KU0hBTkEjU0VMTCNMQVJLCk5BU0MjQ09OVEUjRElBTApPTEFWI0FMSVMjTUVOU0EKQkVUQVRST04jR0FSVEgjCiMjI05JUFMjTUlTUyMjIwpCRUFHTEUjS0FMRSNORU8KQVJOTyNURU5QRVJDRVJTClJJTkcjRU5PTEEjT1JBTApURVNII0RPVEVEI1NPU08="},{"title":"USA Today 03/01/99 \"GROWING PAINS\"","author":"By Charles Preston","date":"1999-03-01","grid":"V0FOVCNQQUNBUyNPQklUCkFEQVIjQUJPUlQjRkFERQpHQVpFI1BJTkFSI0ZST0UKU0tJTk5FREtORUUjS0xNCiMjI0RBUkVTI0FSU0UjIwojI1NZTkMjI0FNRU5ERUQKQlVUIyNVUElOIyNBU1RJCk9WVU0jVEhST0IjR0hFRQpSRUJBIyNJU05PIyNJU1QKR0FCUklFTCMjWElBTiMjCiMjRUxBTCNUUkVOVCMjIwpGQUQjTUFTSEVEVEhVTUIKQVJUUyNQSE9ORSNFTk9MClpPT00jU0FOVEEjTklLRQpFV0VTI0VER0FSI1NUT1c="},{"title":"USA Today 03/02/99 \"CONNECTIONS\"","author":"By Charles Preston","date":"1999-03-02","grid":"TE9DTyNBU0lTI1dBVEVSCkFSQUIjUkFSRSNPTElWRQpNRVJFI0VEQU0jUkVMRUUKQk9EWUFORFNPVUwjRU5ECiMjIyNNQUwjTFREUyMjIwpCQUxTQSNFRElUI1RSQVAKRUxBUFNFI09ORSNSRU5PCkxPVkVBTkRNQVJSSUFHRQpDSElOI0RJRSNTRVBURVQKSEFORCNPU1NBI01FQVJTCiMjI1NPUlQjTkVBIyMjIwpBUksjV0FSQU5EUEVBQ0UKTElORU4jRVJJRSNCVUxMClNUT1ZFI1NFRU4jQlJJTQpPVFRFUiNTQVNTI1NBUFM="},{"title":"USA Today 03/03/99 \"HOT STUFF\"","author":"By Charles Preston","date":"1999-03-03","grid":"Sk9HUyNCQVJUI09GRkVSCkVMSUUjT0xFTyNDSVJSSQpGSVJFV0FURVIjQVJPT00KRk9MSU8jQUxURVJFR09TCiMjI05PUiMjRUxJUyMjIwpIQU5HRklSRSNTTklUQ0gKT05PI1NQQVRTI0FET1JFClNFTEYjRVRIQU4jRVJJTgpFTlRJQSNTSVJFUyNTRUMKU1RFUkVPI0NBTVBGSVJFCiMjI0VSQVMjI09JTCMjIwpDT01CQVRJVkUjS09BTEEKVUJPQVQjRklSRUVBVEVSClNJRExFI1RPR0EjVE9ORQpQRUVMUyNTTE9UI1NQQVM="},{"title":"USA Today 03/04/99 \"ON THE ROAD\"","author":"By Charles Preston","date":"1999-03-04","grid":"REVDTyMjTE9QUyNQT05UCkFMT1QjQ0FQRVIjT0hJTwpWQU5DT1VWRVJJU0xBTkQKRUxGI0NSQUNLI1dJUkVECiMjRVNURSMjI0VBVEVSWQpCVVNURVJDUkFCQkUjIyMKT05TRVQjTE9DT1MjUk9CCkFUT1AjU0lNT04jTU9QRQpUT1IjSE9NRVIjQ09WRVIKIyMjQ0FSQk9OREFUSU5HClJFUEFTVCMjI0lST04jIwpBTEVSVCNFTkFDVCNHQVAKSkVFUEVSU0NSRUVQRVJTCkFOTkUjT1BBTFMjQVlFUwpIQVNUI05ZUk8jI01FQVQ="},{"title":"USA Today 03/05/99 \"A TOUCH OF GOLD\"","author":"By Charles Preston","date":"1999-03-05","grid":"I0hBQUcjTFNUI01BTEUjCkpFTExPI0VQQSNPWElERQpFQVNFTCNHRU5UTEVNRU4KQ0xPVURDVUNLT09MQU5ECiMjI1RFTVBUI09UUyMjIwpCRUdJTlMjUk9UTyNCQVMKQU5FQVIjU0VST1YjQVJUClNPT05FU1QjTk9DQU5ETwpFTEkjVEhBTkUjT05UT1AKU0FEI1JFQkEjT0NDVVJTCiMjI0lJSSNUUklLRSMjIwpSVU1QRUxTVElMVFNLSU4KQ0xFQVZBR0VTI0FUQVJJClRFUk5FI1RSRSNJT1RBUwojU0VBUiNTU04jTFJPTiM="},{"title":"USA Today 03/08/99 \"SUBTITLES\"","author":"By Charles Preston","date":"1999-03-08","grid":"QkVEUyNDQVJPTSNHQUxMCkFSSUEjQUJPREUjRUxJRQpKQVNPTkxJVkVTI05FT04KQVNII09MREUjUVVFRU5TCiMjI01PVUUjQlVSUiMjIwojQkxFU1MjQ09JTkFHRVMKQUxPTkUjV0hJVCNUQUxJCkxPUkkjTEVBU0UjSVZBTgpNT1JOI0FJUkUjRk9PVEUKQU1FVEhZU1QjTU9OVEUjCiMjI0lSRVMjQ0FZUyMjIwpGT1JHRVQjTU9LRSNTUEEKVVRBSCNUSEVIRVJFVElDCkRPTlQjRUFTRUQjTklORQpERUFTI1NQQU5PI0RSRUQ="},{"title":"USA Today 03/09/99 \"PICKING UP SPEED\"","author":"By Charles Preston","date":"1999-03-09","grid":"Q0FLRVMjQUhPTUUjV09FCkJMSU1QI05BU0FMI0FOTgpTSVRUSU5HRFVDSyNMU1QKIyMjI05BSUwjI0hJS0VSClNUUkFOR0UjUkVBTElUWQpIT1VTRVMjQkFSUkVOIyMKT1dORVIjVEFDSVQjR0JTClZFTkEjU0lERVMjQUZFVwpFTEkjREVURVIjU01JVEUKIyNORVdNQU4jU0hBU1RBCklOR1JBSU4jQkxVU0hFUgpTT0JFUiMjVE9VVCMjIyMKTElFI0ZMWUlOR1RJR0VSCkFTQSNFVkFERSNFRElOQQpNRVIjRElORVIjUkFORFk="},{"title":"USA Today 03/10/99 \"TRANSPORT\"","author":"By Charles Preston","date":"1999-03-10","grid":"RVZBTiNIQU1TI0NBUFJBCkxBTE8jQU5BVCNBR0xPVwpBVVRPI0lHR1kjUkVBREUKUExBTkVHRU9NRVRSWSMjClNUUkVQI0xPSVJFI0JBRwpFU1MjU0RJI0VOREdBTUUKIyMjUE9VQ0gjIyNFTE9OClNURUFNQk9BVFdJTExJRQpFQVNUIyMjVEVFTlMjIyMKUklDSEFSRCNORUwjTEVUCkZMQSNHVUVTVCNFVFVERQojI1BPTlRDSEFSVFJBSU4KRFJBTUEjT1JDQSNPTlRPClNBREFUI0RFTEkjT0RPUgpUSEVSRSNFREVOI1BBUlM="},{"title":"USA Today 03/11/99 \"DICKENSIA\"","author":"By Charles Preston","date":"1999-03-11","grid":"TEVEQSNUSEUjI0lNRVRBCk9YRU4jRUFSUCNGT0xJQwpXSUxLSU5TTUlDQVdCRVIKU1RFQUQjU0FHRSNHQVJFCiMjIyNBT0wjU0FJTCMjIwojU0VUSFBFQ0tTTklGRiMKUk9ERU9TI0xJRU4jQU9LClVOSVQjI0ZBTiMjUFVSRQpCSVQjQUJMWSNCT1VOVFkKI0NIQVJMRVNEQVJOQVkjCiMjI0dBSU4jT0REIyMjIwpIT1BFI1RTQVIjRU5ET1cKRUJFTkVaRVJTQ1JPT0dFClJPTkRPI0RJRVUjV09SRQpTRURBTiMjQVRFI0lSRUQ="},{"title":"USA Today 03/15/99 \"SUPERLATIVES\"","author":"By Charles Preston","date":"1999-03-15","grid":"QlJFUiNTVEVXI01PT0xBClJFRE8jQ09DTyNBUFJPTgpPUEVOI0FGUk8jTEVFUlkKV09OREVSRlVMV09STEQjCiMjI09OQ0UjI0lOQSMjIwpUU0UjTEVFVElERSNDU1QKSU5ESUEjI0FDRSNTSE9FCk1BR05JRklDRU5UTUlMRQpJUkFOI1JCSSMjSFVNQU4KREVSI1RPT1RTSUUjUFJZCiMjI1NVTSMjVVNNQyMjIwojSU5DUkVESUJMRUhVTEsKU05PT1QjQU5EQSNBU0lOCkFOTlVMI1NUVU4jUkVORQpERUVSRSNIT0VEI1RSRUU="},{"title":"USA Today 03/16/99 \"JACK OF ALL TRADES\"","author":"By Charles Preston","date":"1999-03-16","grid":"QUNNRSNTQVVDRSNTUEFUClVSQUwjSElMREEjSEVSTwpKQUNLSEFNTUVSI0FSSUQKVU5IT09LUyMjI1NRVUFEClNFSSNMRUFORVNUIyMjIwojIyNNT05URVJFWUpBQ0sKSEFESU4jI1BJRyNBTU9JCkFTSU4jRkFUU08jUEVBVApKRVNTI0VNVSMjREFOVEUKSkFDS09MQU5URVJOIyMjCiMjIyNVVFRFUkxZI0JFRApHRVRJVCMjI0lERUFMTFkKQUdFRCNCVU1QRVJKQUNLClpPTkUjT1BBTFMjQVJJRQpFU1RBI0FTWUVUI1JFRFM="},{"title":"USA Today 03/17/99 \"LOTS O' THE IRISH\"","author":"By Charles Preston","date":"1999-03-17","grid":"Q09SUCNTU1IjT1RPT0xFCk9IRVJMSUhZI0RBUk5FRApNQVJPT05FRCNBUElFQ0UKQlJVTlQjI0VMWSNHQUlOClNFTlQjR0FMQSNNSUxEIwojIyNPU1VMTElWQU4jIyMKQ1BBI1ROVCNSRVBBSU5UCkNBTVBVUyMjI1NPTFZFRApTQ0FSRkVEI1NUVSNZRVMKIyMjT0ZMQUhFUlRZIyMjCiNST01TI1ZJTlkjRVJTVApORUhJI0JFRyMjSEFVVEUKQUJBU0VSI0hJQkVSTklBClRFUkVTQSNPRE9OTkVMTApPQ0FTRVkjTk9XI1NTVFM="},{"title":"USA Today 03/18/99 \"CARNIVORES\"","author":"By Charles Preston","date":"1999-03-18","grid":"Q09NQiNTVEVNI0dJVkVTCk9SQUwjTkFWWSNVUklBSApGSVJFI09CSVQjTkFDUkUKRk9YTkVXU0NIQU5ORUwjCkVMSURFIyNUSUMjI1JPVApSRVMjUkVCRUNDQUxPQk8KU1NUUyNMQUQjI0xBWUVSCiMjI0FNSUQjUE9FTSMjIwpTV0VERSMjRk9SI1BPT0gKVElHRVJMSUxJRVMjTlJBCkVORyMjRU5BIyNBRVNJUgojVEhFUElOS1BBTlRIRVIKUEVFTEUjQUlSWSNIT05JCkVSQVNFI1RFQUwjRVJURQpSWURFUiNFUk1BI0xFU1Q="},{"title":"USA Today 03/19/99 \"VEGGIES\"","author":"By Charles Preston","date":"1999-03-19","grid":"U0NBTSNDT1BBI0lSRU5FCkVMQkEjQ0FMTSNOT05FVApQRUFKQUNLRVQjR0VOUkUKVEFCT1IjU0FSR0UjQURTCkFSQVJBVCMjQU9ORSMjIwojIyMjQkVBTkNPVU5URVIKQUJDUyNFTEkjREVOT1RFCkxPVVQjTkFOQ1kjSU5SSQpFUlJBVEEjVEhFI1NFRU4KQ0FCQkFHRUhFQUQjIyMjCiMjI1NQRUQjI1JFTUFORApEUkUjRVJVUFQjTUFDQU8KUkFEQVIjQ0FSUk9UVE9QCkVNSUxFI0VSSUMjVE9NRQpXSUVMRCNTVE9BI0VSSVM="},{"title":"USA Today 03/22/99 \"GOVERNMENT SEATS\"","author":"By Charles Preston","date":"1999-03-22","grid":"TEFNQiNSQVRJTyNET0RPCkFHQVIjQVJST1cjT1JBTApZT1JFI1BSQVRFI01FUkUKI0dSQUNJRU1BTlNJT04jCiMjI0RBRFMjI1NVTiMjIwpDUkFCUyNUT1cjQk9BUkQKUkVNT1RFI1BBTCMjQklPCkFMRVhBTkRFUlBBTEFDRQpNRU4jI0VBUiNTTUlURVMKUEVEQUwjTUFSI0lORVJUCiMjI05FRSMjQUxTTyMjIwojV0lORFNPUkNBU1RMRSMKTUVOVSNTVE9JQyNZRUxQCk9SQ0EjQVRPTkUjUFNBVApNRUFMI1lPS0VTI0VUTkE="},{"title":"USA Today 03/23/99 \"NAME GAME\"","author":"By Charles Preston","date":"1999-03-23","grid":"V0lTSCNSVVNFI0FSR0FMCkVDSE8jRU5JRCNCRVJORQpHT09ERkFJVEgjT0RFVFMKT05FI0FMVE8jTE9TRUlUCiMjI0lOVEVOU0UjRU5DIwpCUkFORFkjI0lPVEEjIyMKT1VJREEjTUFOSUEjQUhBClNIUklOS0lOR1ZJT0xFVApDUlkjR1JBVEUjTE9JUkUKIyMjRE9PTSMjUExJRVJTCiNNT0UjTklCQkxFRCMjIwpQT0xJVEUjUklBUyNVUEEKQUxJQ0UjTEFaWVNVU0FOClJBVkVOI1VWRUEjTEVOTwpDUkVTVCNWRVRTI0VERU4="},{"title":"USA Today 03/24/99 \"GO FOR IT\"","author":"By Charles Preston","date":"1999-03-24","grid":"SEFHR0lTI0dBR09SREVSCkFSTU9OSyNBVkVNQVJJQQpSRUFMTFkjTU9OSVRPUlkKUEFOREEjIyNXRVQjR0VPCiMjI0VOUk9CRVIjR1VOTgpHUkFORE9QRVJBI1JFRVMKUE9ST1NJVFkjTEVFIyMjCkFOS0xFIyMjIyNZRUxQUwojIyNEQUgjUFlSRU5FRVMKUkFHSSNHUk9VTkRPVVRTCkVMSUUjV09SS1NPTiMjIwpEQkEjSEVNIyMjQ0lOQ0gKVEFOVEFMVVMjRVRPSUxFCkFOTlVBTExZI01PTkRBWQpHT0lOR1NPTiNVUlNJRFM="},{"title":"USA Today 03/25/99 \"RESIDENCES\"","author":"By Charles Preston","date":"1999-03-25","grid":"U0hBTSNSRU1BTiNMSU1BCkhPTEUjT1ZJTkUjT01JVApPUEFMI0JJUkRTI0NBR0UKV0lTVEZVTFZJU1RBIyMjCiMjIyNFU1MjIyNJTElLRQpERVBBUlQjQkVTU0VNRVIKQUxBUk0jT0lMWSMjUEVOCk1PQ0tJTkdCSVJETEFORQpBUEUjI09MTEEjV0FMRVMKR0VSTUZSRUUjREVTRVJUCkVEU0VMIyMjR0FMIyMjIwojIyNIT1VTRVJTVFJFRVQKTElMVCNTQVJBSCNBQ1JFCklERUEjRUxJVEUjU0hJTgpET0dTI1NURUVSI1BPTkQ="},{"title":"USA Today 03/26/99 \"SOUNDS FISHY\"","author":"By Charles Preston","date":"1999-03-26","grid":"S09EQUsjQUxFQyNTQ0FSCk9CRVNFI0RFTU8jSUFHTwpTT0xFUExBVEVTI1hSQVkKI0VMQVRFI1RFVEUjUFRBCiMjIyNVTk8jUkFQSEFFTApUVVJOUElLRSNSSU9UIyMKQUxBSSNOQVlTI0NPSEFOCkxBWUVSI1BJRSNTUElSRQpFTk9DSCNJTkdFI0xBSVIKIyNGRUVUI0dBUkJBTlpPClBVTFNBUlMjTEFSIyMjIwpBTkkjU0VUQSNUT0FTVCMKU0lHTiNCQVNTT09OSVNUClRBSFIjRUxJQSNERUxBWQpFVFRBI0tFTlQjU1dPUkU="},{"title":"USA Today 03/29/99 \"HOW SWEET IT IS!\"","author":"By Charles Preston","date":"1999-03-29","grid":"QU5TQSNNQVNTI0hFTUFOCk1PV04jQVJMTyNBUklTRQpBVEVOI0RJQUwjTklHSFQKU1dFRVRSRVZFTkdFIyMjClNPVCNPSUwjTU9VU1NFUwojI1BPTkQjU05JUCNXQU4KR0xPVkUjREFJUyNCRVRBCkxBVEUjU0FMVFkjTEVFSwpBTEFOI1BSRVkjQVVUUlkKU0FUI09SRVMjUExFRCMjClNXT09ORUQjQVJFI1JFQQojIyNTV0VFVFNJWFRFRU4KRVJJQ0EjVkVUUyNIQVJJClRBVEFSI0lSSVMjQU1JUwpDSE9SRCNMT1JZI0lTRUU="},{"title":"USA Today 03/30/99 \"IMPROVEMENT\"","author":"By Charles Preston","date":"1999-03-30","grid":"Q0xPRCNTTE9FIyNGSU5TCkhPU0UjTElOTiNSQU5FRQpJQ0FOI0FHRVIjT1VUUkUKVEFLSU5HQUdPT0RMT09LCkFMQU1PI01BTExFVCMjIwojIyMjVFJFI0xFTyNNRUwKT1NMTyNBTkEjI1VUSUxFClRIT1VHSFRCRVRURVJPRgpURVJSQSMjQURPI0RFTlQKT0REI0xBUyNFUkUjIyMjCiMjI0FMTFRFTiNEUkFNUwpET1RIRUJFU1RZT1VDQU4KQUJIT1IjRVRBUyNOT05PCkRPSUxZI1BFVEUjVFJJTwpTRU5EIyNTRUVSI1NOQVA="},{"title":"USA Today 03/31/99 \"OFF COLOR\"","author":"By Charles Preston","date":"1999-03-31","grid":"UEFTVEUjQU5UUyNGSVJFCkFOVElTI1lPUkUjSURPTApXWUFUVCNBVkVSI1ZFQUwKIyNUSEVLSEFLSVlFQVJTCiNRVUVFTiMjU0VFIyMjIwpDVVQjTU9CUyNTQURJU1QKSElFUyNDT05FI1RFTVBPCkFDTE9DS1dPUktTRVBJQQpPSEFSQSNMT0dFI1BSRVMKU0VXRVJTI1BPTFMjT1JUCiMjIyNBVEUjI1NUT1BTIwpOWVBEVFVSUVVPSVNFIyMKQVVSQSNQT1VSI0dJUkxTClNMSU0jT0RJTiNNRUxFRQpIRU1TI1JFUFMjQVJZQU4="},{"title":"USA Today 04/01/99 \"BE SEATED\"","author":"By Charles Preston","date":"1999-04-01","grid":"VEVNUFMjU05BUFMjUkFICkFQQVJUI1RPUklDI09MQQpDSEFJUldBUk1FUiNDQUQKIyMjU0FJTiMjI0FTS0lOClZFU1RJTkcjUEFUSUVOVApFTlRJVFkjTUVSQ0VSIyMKR09PTlMjV0lOQ0gjUEVOCkFMT0UjQkVOQ0gjTEFMTwpTQUwjT1JBVEUjQk9OT1MKIyNQSU5FUlkjUkVORUdFClNMSVZFUlMjTU9ERUxFRApNQUdPTyMjI0FNUFMjIyMKRU5FI0NPVUNIUE9UQVRPCkFaTyNBU1RPUiNTQVZFUgpSQU4jVEhBTkUjVFJBQ0s="},{"title":"USA Today 04/02/99 \"IMAGINARY PLACES\"","author":"By Charles Preston","date":"1999-04-02","grid":"VEFQRSNTVVBFUlMjU0lCCklERUUjSU5BUlVUI0hBTApFTUVSQUxEQ0lUWSNBTU8KU0lUSU4jRVROQSNDTkJDCiNURUVURVIjIyNIT0cjIwojIyNTSUxBUyNDT1VSU0UKUlVOVCNBR0UjUk9QSUVSCkVURSNTVEVQU1VQI0xFQQpERVZJQ0UjQU1JI1NBUFMKT1BFUkFTI0xVU1RZIyMjCiMjUkFOIyMjR0VPUkdFIwpLSUxOI0JPT0cjTElPTlMKQVNBI01JRERMRUVBUlRIClRFTiNCT0RJRVMjTkVSTwpaRUQjQVNTRVJUI1NORUU="},{"title":"USA Today 04/05/99 \"GET ON WITH IT\"","author":"By Charles Preston","date":"1999-04-05","grid":"QkFCRSNCUkFNI1BJTlRPCklURUEjUkFTRSNBRE9SRQpMSUFSI09NQU4jTkFESVIKI1BVTExOT1BVTkNIRVMjCiMjI0hBVFMjI09ITyMjIwpPTlRJTUUjU09ITyNCRUQKUkVJTkEjQ0lBTyNUQU1FCk1BS0VTSE9SVFdPUktPRgpFUklTI1lWRVMjUEVFVEUKUkFTI0VERU4jVFJBREVSCiMjI1NJUiMjR09BVCMjIwojQ1VUVE9USEVDSEFTRSMKQUxMQUgjSE9TUyNCQVJECkxFQVZFI0FOVEkjTElNTwpMT05FUiNURUVOI0VMQU4="},{"title":"USA Today 04/06/99 \"WHAT'S COOKIN'?\"","author":"By Charles Preston","date":"1999-04-06","grid":"SkFDT0IjU0VSQiNTTkFQCkVDT0xFI0FMRUUjTklDRQpTSE9FUiNCRU5EI0lOVE8KVFNLI1NJTFZFUlNQT09OCiMjSUxFREUjI09IRU5SWQpTVEVFUlMjVk9DRSMjIyMKS09KQUsjRk9SS0xJRlRTCkFGQVIjI09JTCMjQ1JFRQpUVVJOVEFCTEUjUEFZRUUKIyMjI0VMU0UjUkVNSU5ECkFTU0lTVCMjU09SRU4jIwpLSVRDSEVOU0lOSyNHU0EKSURFRSNST0FEI1NBUE9SClRFQVIjRVZJTCNVTkFQVApBU0tTI0RBTEUjUEFOU1k="},{"title":"USA Today 04/07/99 \"TIME TRIAL\"","author":"By Charles Preston","date":"1999-04-07","grid":"QlJBR0EjV0FTUCNDQVBUCkFESU9TI0FQRVIjQUdFRQpHQVJCUyNMSUVVI1JPQU4KIyMjQkFOS0VSU0hPVVJTClNBTkxVSVMjI1NVQlRMRQpBRklFTEQjU1BJTiNJU1IKTUlOVVRFU1RFQUsjIyMjClNURVAjI0FBUiMjQVJJQQojIyMjU1BMSVRTRUNPTkQKQVZBI0NVRUQjRVhDVVNFCkJPQkNBVCMjSU1BUkVUUwpJVFNBQk9VVFRJTUUjIyMKREVFUCNVTlVNI0lERVNUCkVSTkUjVElOQSNOSVhFRApTU1RTI1NUQVkjRVRUQVM="},{"title":"USA Today 04/08/99 \"EMBARKING DOGS\"","author":"By Charles Preston","date":"1999-04-08","grid":"WUVBI0JBQSMjRVRDUyMjCkVOR0xJU0hGT1hIT1VORApTQ09UVElTSFRFUlJJRVIKIyMjU0VBI0FJUkUjVFdBCkNBUCNSTlMjU1RBVEVMWQpVU0UjU1BJTiMjRE9SWSMKUk9BUiNBR0UjTEVJIyMjCiNGUkVOQ0hQT09ETEVTIwojIyNSQVQjQURWI0VaSU8KI0FCVUcjI0xJRVMjUk5BCkdSQU5BREEjRUFVI0FFUgpBTkQjU09TTyNQQ1QjIyMKR0VSTUFOU0hFUEhFUkRTCkFMQVNLQU5NQUxBTVVURQojI1BTSVMjI1JFUyNFU0U="},{"title":"USA Today 04/09/99 \"VINTAGE TV\"","author":"By Charles Preston","date":"1999-04-09","grid":"UkFORyNBREFNUyNHT0JJCkFQQVIjR0FMT1AjT1BFTgpGSVJFU0lERVRIRUFUUkUKI0FERVBUI1NURUFESUVSCiMjI05FQVAjT1JSI0NBVApEWU5BU1RZIyNFTEYjIyMKQVZFQyNFTElBI1NBTEFEClRFQVIjREVMTEEjTUlMRQpFU1RFUyNTRUFOI0lERVMKIyMjU0FQIyNNQVRMT0NLClBBUyNNVUQjT0JFWSMjIwpBUFBFQVJFRCNBVFRBUiMKVEhFUFJJQ0VJU1JJR0hUClRJTEUjU09MVkUjRVJPUwpJRExFI1RSRVlTI1NBU0U="},{"title":"USA Today 04/12/99 \"DOMICILES\"","author":"By Charles Preston","date":"1999-04-12","grid":"I1BVQ0UjU1RBUiMjQ0xVCkNBTk9OI09ITk8jI1JFUwpFVklUQSNMRU5PI0NBVkUKTEVUVCNTT0hPI1dBVEVSCiMjI0FNSU5PI05PQkVMUwpNQU5HRVIjVU1FS0kjIyMKQUxJRU4jT1NBUiNOQVRPClJPVEMjU05FQUQjSU5PTgpURVNII0FUT00jRU5BVEUKIyMjRU5ET0YjQkVUVEVSCkFNUEVSRSNNVUxDSCMjIwpSQUlTQSNESU5UI0VTQUkKRFVLRSNTQVJJI0FTVE9SCk9MRSMjUElUVCNTS0lOUwpSRUQjI0FTSFkjUFlSRSM="},{"title":"USA Today 04/13/99 \"TEAMING UP\"","author":"By Charles Preston","date":"1999-04-13","grid":"REVBTFQjVU1QUyNSQVNICkFMTEFII05FQVQjRVJMRQpET0RHRVJTQkxVRUpBWVMKQU5PI0FPTkUjI0xPQkVTCiMjI0VUTkEjU0VNSSMjIwpQQURSRVNQSElMU0NVQlMKQURBTkEjI0lNQSNFU0FVClRFTSNNQVJMSU5TI0FSRQpTTE9FI0xPVSMjV0FHRVIKWUFOS0VFU01BUklORVJTCiMjI0lERUUjTEFORCMjIwpCUklORyMjVElORyNIT0UKUkFOR0VSU1JFRFNNRVRTCkFKT0IjQk9PTiNBQVJPTgpNQU5ZI0lOTlMjVEhPU0U="},{"title":"USA Today 04/14/99 \"BEN THERE, DUN THAT\"","author":"By Charles Preston","date":"1999-04-14","grid":"QVJBRCNDQVJFI0JVU0VECk1VR1UjT1JFTCNJTlVSRQpFREVOI09JTFMjR0VOSUUKQkVOQ0hMRVkjU1dBR0VECkFSVEVNSVMjREFJUyMjIwojIyNDT1QjRFVOR0VPTlMKU0lMQVMjQ09QRVMjQkVFCkNMSVAjQUxHRVIjQk9MVApBSU0jQVZPSUQjRkVFTFMKQkVORURJQ1QjQVJOIyMjCiMjI0ZPTEsjVFJPSkFOUwpCSUFGUkEjRFVOR0FSRUUKUk9NQU4jWk9ORSNNT1ZFCk9OSUNFI0lSSVMjSVNVUApXQURFRCNQQVNTI05FU1M="},{"title":"USA Today 04/15/99 \"MISSING LINKS\"","author":"By Charles Preston","date":"1999-04-15","grid":"VEFCUyNFTU1BIyNTVEVXCkFTSUEjWE1BUyNDSE9SRQpMRVRUI1BJQ0tDSE9PU0UKQ0FTRSNMSUUjSEFXS0VECiMjUEVTTyMjI09SVCMjIwojRklORURBTkRZI0VCT04KSUxFI1RFTElBI1BMQU5FCk5BQ0hPI0xFTiNBTEdFUgpDUkVPTiNBQ1RJTiNCQUQKTEVTVCNXSEVFTERFQUwjCiMjI0hPSSMjI0xBTkcjIwpQQVZFUlMjRklCI0FHQVIKVFJJQUxFUlJPUiNNQU1FCkFHQVZFI0ZBVEUjRUdJUwpIT0xZIyNEWUFEI0xFTlQ="},{"title":"USA Today 04/16/99 \"NUDNIKS\"","author":"By Charles Preston","date":"1999-04-16","grid":"I0JBUkkjQ0FQRSNTRUxBCklPTkFTI0FOT04jVUJFUgpGTElCQkVSVElHSUJCRVQKRUxMSU9UVFMjI1NBU1NZCiMjI0RSVSMjVEFVVCMjIwpTUUQjTklOQ09NUE9PUFMKVFVFUyMjSUFNQSNNQVJUClJBTUEjUkVDVFMjSVJBRQpBU09GI0FDVE8jI0NFREUKV0lTRU5IRUlNRVIjRE9OCiMjI1RFU1MjI0xFRCMjIwpUT05ZQSMjQVNTQVVMVFMKV0hJUFBFUlNOQVBQRVJTCklOUkkjU0FUTyNFTElBUwpHT09OI1NUQUIjUkVBTSM="},{"title":"USA Today 04/19/99 \"BODY BUILDERS\"","author":"By Charles Preston","date":"1999-04-19","grid":"Qk9NQiNXQVJNI0ZFRUxTCkVWSUwjSURFQSNBTExBSApORU1PI0xPREkjQ0FVU0UKRVJJQyNJUk9OSEFOREVECiMjI0tFRU4jRkFEI0VSUwpCT1RIRVIjQlJJRUYjIyMKQVJJRUwjR0VBUiNFREVOCkdBTEFTI1JBTSNIRUFWRQpTTEVEI0JBU0UjT1RURVIKIyMjU0NFTlQjQUJPQVJECkZSQSNMQUQjQVNPRiMjIwpSVUJCRVJORUNLI0NST1AKT1BFUkEjRVRSRSNMT1ZFClNFVEFUI1NUSVIjQVNFQQpURVNUUyNTVURTI1lFTlM="},{"title":"USA Today 04/20/99 \"INTERNATIONAL\"","author":"By Charles Preston","date":"1999-04-20","grid":"U0VBUyNEQURBI05BU0FMClVDTEEjRVRBTCNFTElURQpFUkFMI1RPUk8jQUxMT1QKUlVTU0lBTlRFQVJPT00jCiMjI0FTSUEjI0RFVyMjIwpNQVQjQUxMU1RBUiNUT1AKQUxPSEEjI0NPUCNERVNJCk1FWElDQU5IQVREQU5DRQpJUklTI01PTSMjV0hFQVQKRVRDI0NBUk9VU0UjVFJZCiMjI0VBVCMjTUVMVCMjIwojRU5HTElTSFBBVElFTlQKU1RPUk0jVEFJTCNQTEFZClNURUVMI0VJUkUjU0xJUApTQUxUWSNNUkVEI1lBTEU="},{"title":"USA Today 04/21/99 \"CBers\"","author":"By Charles Preston","date":"1999-04-21","grid":"TEVXREVSIyNCS1MjRklSCkFTSE9SRSNGT0lFI0lDRQpDTFlERUJBUlJPVyNOSVAKIyNJSUkjVEFJUyNLRUVMCiNTU0UjQ0hVQ0tCRVJSWQpQVVQjVEFMIyNTTFkjIyMKQVNII0FSRUFTI0FURVNUCkNIQVJMT1RURUJST05URQpUSVRIRSNFTFNJRSNDT04KIyMjSU5BIyNURFMjSElTCkNPVU5UQkFTSUUjTUFDIwpSVURFI0VSSU4jUEVOIyMKRU5EI0NMQVJBQkFSVE9OCkFDRSNCRUJFI0FDQ0VERQpNRVIjU1NTIyNORUVERUQ="},{"title":"USA Today 04/22/99 \"TIME FOR CHANGE\"","author":"By Charles Preston","date":"1999-04-22","grid":"UEFTVElMI1NNRVcjRU5TCklOSEFMRSNISUxPI0xPVApBRElNRUFET1pFTiNQRVIKIyNJU1QjT09aRSNMQVRFCkFDVCMjQVJJRSMjQVNJQQpSRUFQI1BFTk5ZU1RPQ0sKSUxLQSNQRUcjT1JFIyMjCiNMRVNTRU4jVElBUkFTIwojIyNTRUEjU0FDI0FDSEUKTklDS0VMQkFDSyNMRUFSCkFTSEUjI0VST1MjI1JZRQpCUkFZI1BST00jU1VCIyMKT0FUI0NPSU5BUEhSQVNFCkJFVCNQT05HI0JFQVRJVApTTFkjT1JHUyNBTExFTlM="},{"title":"USA Today 04/23/99 \"PLAYING AROUND\"","author":"By Charles Preston","date":"1999-04-23","grid":"U01PVEUjVkNSI0FMRkEjCkFBUk9OI09MQSNMQUlSUwpHUkFORFNMQU0jU0NFTkUKQUNDVCNFTElTRSNPTElOCk5PSElUVEVSI0ZFTkRFRAojIyNOT1NZI0NSQUlHIyMKT1NIRUEjI1RJRVNDT1JFCk1BTyNTS1lET01FI0FFUgpBTExTVEFSUyMjRlVMTFkKIyNFWUVSUyNTUFVOIyMjCkdSSU5ETCNCVUxMU0VZRQpSRU5PI1NDQVBFI0FMRUEKSVJPTlMjRFJFQU1URUFNClRBTllBI0VSUiNURU5TRQojTkVNTyNGRUIjQURJVFM="},{"title":"USA Today 04/26/99 \"LES GIRLS\"","author":"By Charles Preston","date":"1999-04-26","grid":"UEVMVCNCRUxBI1NURUFNClVUQUgjSVRFTSNBRVROQQpST1VFI1RIRUZBVExBRFkKQU5EQU5URSNNREkjR0VPCiMjI1ZFRVIjI1VOTEVTUwpHRU5PQU4jVFVMU0EjIyMKQUdFTlQjQkVSVCNEUkFCCkdJUkwjSkFNRVMjWUVBUgpBU0lBI0VTUFkjQUZJUkUKIyMjRE9OSE8jU1BJTkVUCkNBTllPTiMjT1dFTiMjIwpBU0kjTEVBI0xBUkdFU1MKTVlGQUlSTEFEWSNFWElUClBFVElUI0JBRVojUkFaRQpTVFlMRSNTVVJFI1NNRVc="},{"title":"USA Today 04/27/99 \"OVERVIEW\"","author":"By Charles Preston","date":"1999-04-27","grid":"VklNIyNST0NTI0FUUklBCklSRSMjRVJBVCNDUkFOSwpOQU4jRVZFUllUSElOR0kKRVFVQVRFI09SQSNMSUVOCiMjI01BUiNUT05UTyMjIwpTSEFZI1RISU5LQUJPVVQKT0VSI0hFRUQjI1BFTk5JClJBTVJPRFMjVFJBREVJTgpHUkVFTiMjRE9FUyNVVEUKT05USEVFQVJUSCNBUEVTCiMjI0FEQUdFI09JTCMjIwpMRUFTI1NFQSNVTklRVUUKSVNXSEFUSU1JU1MjVVJOClNURUVOI1NFUkUjI0FHTwpURUREWSNUUkVTIyNERVM="},{"title":"USA Today 04/28/99 \"ARBOR DAY\"","author":"By Charles Preston","date":"1999-04-28","grid":"QUJBU0UjI1JJQ0gjREFNClJBRkVSI1BBU0hBI0VHTwpNQVJMQU1BUExFUyNSSU8KU0xPRSNBTFRFUiNFRUxTCiMjI05PRCMjI1lBTktFRQpCUklBTkRFUEFMTUEjIyMKUklHI1NPUkVSI0FDVE9SCkFUT1AjR1JBTVMjVE9HTwpURVJSQSNPTEVPUyNPTEQKIyMjQVNITEVZV0lMS0VTCkxPQVRIRSMjI0VDVSMjIwpPTUlUI1JFQUNUI1JBU1AKR0VNI0FOTklFT0FLTEVZCkFHRSNTSURMRSNNRVRBTApOQUUjUEFTUyMjUFJPTkU="},{"title":"USA Today 04/29/99 \"FORE TO AFT\"","author":"By Charles Preston","date":"1999-04-29","grid":"QkFUUyNTQ0FHUyNDQVBFCkFNQUgjTElNSVQjQU1PUgpGT1JBI09MSVZBI05BTkEKRlJPTlRQQUdFU1RPUlkjCkxBVEVSI05PTUlORUUjIwpFTFMjT1JUI0VTVCNURUQKIyMjQ0xBUkUjIyNBVFRVCk1JRERMRU9GVEhFUk9BRApPRElFIyMjVFJVTVAjIyMKRE9DI0VDTyNVVEUjUlVCCiMjVEFMRU5UUyNFTElTRQojQkFDS1NFQVREUklWRVIKQk9USCNUSU1FUiNNRURFCk9CT0UjQURNRU4jQlJVVApXT1JEI1NBWVNPI1NBUFM="},{"title":"USA Today 05/03/99 \"MUSICAL TRAVEL MODES\"","author":"By Charles Preston","date":"1999-05-03","grid":"TUVBUkEjUk9CVCNBU1RJCkVDTEFUI0FSTE8jU09SVApDSEFUVEFOT09HQUNIT08KSE9OI09ORSNPU1NFT1VTCiMjI0ZSSUVORCNJTlNUIwpDTEVBTlMjRUxBTkQjIyMKQUVSSUUjQkVFUiMjU0VUCk1FUlJZT0xEU01PQklMRQpFU1MjI0FJTFMjVEVBU0UKIyMjQk9STkUjU0hBTUFOCiNUSEFJI0RSQVBFUiMjIwpDSEFTU0lTI1NBTCNSRVMKSE9SU0VPUEVOU0xFSUdICk9SVE8jVE9ORSNPU0FHRQpPU0VTI0FUT1IjU0FMU0E="},{"title":"USA Today 05/04/99 \"LAST LAUGHS\"","author":"By Charles Preston","date":"1999-05-04","grid":"TEFCI1BFS0UjTVVQUEVUCkVSUiNJQ0FOI0lOUk9BRApOQ08jVEhSRUVDSEVFUlMKVEFLRVNPTiNNQUlEIyMjCklORVJUI0FQQiNQQU1QQQpMRU5UTyNLRVJOI1RPT0wKIyNXRVBUI0FZRSNFTk9MClBISSNTSVRDT01TI1NIWQpMRU5TI0xBTyNPVVNUIyMKVVJHRSNUSEFOI1JFRUZTCk1FU0FTI0lUQSNNQVJSWQojIyNUQUZUI1JBSU5NQU4KSlVTVEZSSUVORFMjQVBUCkFaQUxFQSNCSURFI1NQQQpXSU5FUlkjQkFTUyNIRVg="},{"title":"USA Today 05/05/99 \"SUPERLATIVES\"","author":"By Charles Preston","date":"1999-05-05","grid":"TUFVTFMjQUxFRiNJQklECkFTU0VUI0dJR0kjTklORQpUSEVHUkVBVEdSRVRaS1kKVEVSU0VSIyNTRU1FIyMjCiMjIyNXT1JUI0JJTkdFUwojI1dPTkRFUkZVTFRPV04KQVJFQSNFTUVSR0UjUkVPCkxBUksjI0lGQSMjU0lMTwpPREUjV0lOT05BI01FTFQKRkFOVEFTVElDRk9VUiMjClRST1VHSCNMRU9TIyMjIwojIyNSRU1PIyNPSUxJRVIKVEhFR1JBTkRPTEVPUFJZCkhBUkkjRUNSVSNST1NJTgpFR0FEI0xFU1QjU1RPTkU="},{"title":"USA Today 05/06/99 \"ON THE TOWN\"","author":"By Charles Preston","date":"1999-05-06","grid":"U0FHUyNBUEhJUyNQQVNPClRST1QjUEVBTEUjQVZPTgpBTEZBI0FSTklFI1BJTEwKQk9PVCNTVUdBUkRBRERZCiMjUlVFUyMjI1NJQiMjIwpFQkJFRCNNQUQjTUVEQUwKQVJSI0lNQUdFUyNBT05FCkdPT0RUSU1FQ0hBUkxJRQpMSUtFI0JBTktFUiNMT0QKRUxFQ1QjU1RTI0NMQU5TCiMjI0lBTiMjI0NIRVIjIwpCSUdTUEVOREVSI0FCRUwKQVRPSSNWSU9MQSNQSU5FCk1FUlYjRUxMRU4jVUxOQQpTTUVFI1JFRVZFI1BMQU4="},{"title":"USA Today 05/07/99 \"``M\" IS FOR...\"","author":"By Charles Preston","date":"1999-05-07","grid":"U0NBUkUjTUFTU0UjQ0FCCkFMTEFZI0FHQUlOI09SRQpNT1RIRVJHT09TRSNNRU4KRUdPI0xVRyMjIyNTUEFUCiMjI0ZFVElEI0FVRUwjIwojI01PVEhFUk9GUEVBUkwKSE9PUFMjI0FMQUNSSVRZCkFMSSMjU0FXRVIjI05FRQpSRVNUTEVTUyMjQ1JFU1MKTU9USEVSSFVCQkFSRCMjCiMjVVJHRSNQT09MUyMjIwpQRVJVIyMjI1BFSSNMRUkKQVJJI01PVEhFUkJPQVJECkxJWiNFRVJJRSNFRERJRQpMRUUjVFJVTVAjUkVFS1M="},{"title":"USA Today 05/10/99 \"NUMBERS GAME\"","author":"By Charles Preston","date":"1999-05-10","grid":"TUVMQkEjWUFNUyNCQVJCCklESU9UI0FMQUkjQVJJQQpGSUZUSFdIRUVMI0xFU1MKRkVFI0xBTyMjS1JPTkVSCiMjI1NFQ09OREJBTkFOQQpMRUdBVE8jRVJPREUjIyMKQURBR0UjRkxBVyNZRVRJCkdFTCMjRUxMSVMjI1JBVwpTTkFHI05BSUwjQVFBQkEKIyMjT1VUUkUjQlJVVFVTCkZPVVJUSEVTVEFURSMjIwpMQU5EQVUjI0lDSSNBSUwKT1RUTyNTSVhUSFNFTlNFClJFSU4jRVZJTCNUUklOSQpBUkVTI0RBVkUjU0FMVFM="},{"title":"USA Today 05/11/99 \"MERRY MONTH OF MAY\"","author":"By Charles Preston","date":"1999-05-11","grid":"Q0hBUlQjU1RBQiNGSVNICkxJVkVSI1dBTEwjSURMRQpBUk9NQSNBTE1BI0xFQVIKWUVOI0NJTkNPREVNQVlPCiMjI01FTkQjU0VYIyMjIwpDRURFI1NJTFQjQVNQSUMKQVJPTiNBVkEjRUxNSVJBClBSRUFLTkVTU1NUQUtFUwpST1NDT0UjU1RQI1JFTlQKQVJURUwjU09SQSNUUkVFCiMjIyNBTFAjQU5EUyMjIwpNRU1PUklBTERBWSNTUEEKQVJJQSNGUkVEI0xJUElEClNJTksjRVRBTCNBQ1VURQpLRURTI1JBS0UjTlVSU0U="},{"title":"USA Today 05/12/99 \"``DUCK\"\"","author":"By Charles Preston","date":"1999-05-12","grid":"TUlTQyMjI1ZBTiMjTEFQCkVUVUlTI1NFR09TI0VSUgpET05BTERUUlVNUCNTTUEKIyNMT1VJRUFOREVSU09OCkZSQSNSUE0jI0VDSE9JQwpJQU1CIyNTVFUjVE9SUkUKUkVQQVNUI0FTVFIjU0VSCiMjI0hVRVlMRVdJUyMjIwpET1MjU0VFSyNBTkNIT1IKQUNUVVAjVFlTIyNJT05BClBBUlNFUiMjT0hNI0xFRwpQUklOQ0VTU0RBSVNZIyMKTElQI1RIT01BU0RFV0VZCkVORSNTQUxFUyNJTkFORQpEQUQjI0JFRSMjI0RST1A="},{"title":"USA Today 05/13/99 \"VISA EUPHORIA\"","author":"By Charles Preston","date":"1999-05-13","grid":"TEFTUyNSRUFNUyMjT1JFCkVDSE8jRUxHQVIjQU1JRApUSE9VR0hPVVRPRkNBU0gKSEVOI1JBTkVFI0xBUkVTCkVERU1BUyMjI09BUiMjIwojIyNJU0hPUEFUV0lMTCMKU1RBTVAjTkFaSVMjRUFVClBJTkUjUkVTVFMjUEVTVApBTkkjU1VJVEUjQ0FTVEUKI0FMSVRUTEVDQVJEIyMjCiMjI0RJUyMjI1JBU0hBRApTUE9PRiNSRUFDVCNBTEUKV0lMTEZPT1RUSEVCSUxMCklMTFMjQU1PTEUjSVRFQQpURUEjI1NBTkVSI1RJTlk="},{"title":"USA Today 05/14/99 \"ALOFT\"","author":"By Charles Preston","date":"1999-05-14","grid":"UkVFRiNSQUZUUyNGTEVBCk9WQUwjQVJMRVMjTE9MTApDRVRFI1RPWUVSI1lBTEUKS05FVyNTQUlEI09PTkEjCiNUUklDT1JOI0VMRiMjIwojIyNOVU4jR09MREZJU0gKQ1JFVEUjQUREQSNUUklPCkhBVEgjQUxPSU4jSE9QUwpJUkFFI1NBV04jVEVOU0UKQ0FMRlNLSU4jUEFIIyMjCiMjI0FMUyNUQVJUQU5TIwojUkFDWSNIT1JBI05BVFMKTE9CRSNUQVJPVCNEVklJCk9MRU8jRUxJU0UjTEVOVApTRUxGI0FMT0VTI0VTVEU="},{"title":"USA Today 05/17/99 \"COMMON CAUSES?\"","author":"By Charles Preston","date":"1999-05-17","grid":"QkxUIyNBS0lNI0RJU0tTCkxBUkQjTElTUCNJQ0VOSQpBTU9JI1VUQUgjU0lUSU4KTklURSNNRUEjUEFMQVRFCkNBU0hBTkRDQVJSWSMjIwojIyNBUkkjI1ZJTSNKT0UKU1dPUk4jR0xPTSNQSUxMCldJTERFQU5EV09PTExFWQpJTExTI0xBU1MjREVMT1MKVEVBI0RJUyMjQUlUIyMjCiMjI0ZJU0hBTkRDSElQUwpSRVNVTFQjWk9PI09NRU4KQVpVU0EjQVRPTiNSQVJBCkdSRUVUI1ZFTkkjQUdPRwpTQVJFRSNBQ0VTIyNFTlM="},{"title":"USA Today 05/18/99 \"SAD BUT TRUE\"","author":"By Charles Preston","date":"1999-05-18","grid":"U0hBREUjUExVTSMjSFRTClNBVk9SI1JFTU8jTEFJVApUSEVXQVJPTlBPVkVSVFkKI0FSTiNPVVQjI0VERElFCiMjI1BMVVMjU0lUVSMjIwpIQVNMT1NUSVRTU1BFTEwKT0xFQVRFI05FVCMjTEFJCkZMQVlTI0NVUCNHVUVTVApGQU0jI0ZPUiNGQU5ORVIKQU5ZT05FT05XRUxGQVJFCiMjI1JFTlQjQVJBTCMjIwpTSEVBRiMjRklSI0FOSSMKV09OVEZBUkVUT09XRUxMCkFMT0UjQ1VURSNWRVJTRQpHRUwjI1RFQVIjQUREQVg="},{"title":"USA Today 05/19/99 \"NAME GAME\"","author":"By Charles Preston","date":"1999-05-19","grid":"VE9SUyNNQUxFI0NFQlUjClVUQUgjRUxBTiNBTUFOIwpGUklFTkRMWU5BQk9SUyMKVEFMS0lFI01FTFMjUlVCCiMjUkVQI0JFQU0jRUlORQpDT09MI0xPTkRPTkZPR0cKQUxBI0RPRyNTTkFHIyMjCldFRERFRCMjI0VUSEFORQojIyNPTEVHI1BSTyNQSUUKV0hJVEVTQUxFUyNDRUxMCkhJREUjVElFUiNIVVIjIwpPU0UjSEFOQSNUT1JURVMKI1dBVEVSU1JPU0VCVVNICiNBVFJJI0FOTkEjRVJNQQojWUVBUiNZU0VSI0RFRUQ="},{"title":"USA Today 05/20/99 \"TOE THE MARK\"","author":"By Charles Preston","date":"1999-05-20","grid":"QkFTSCNCQU1BI0FIRUFECkFHSEEjQU1FUyNNT0xUTwpUUk9JI1JPREUjUE9LRVIKSEVBUlRCUkVBS0VSIyMjClNFTExFUiMjI09SQU5HRQojIyNJTkFTI1RPRUhPTEQKU0xBTlQjQ09PS1MjU0FHCldJREUjRE9XTlkjSElERQpFVEEjTUlMTkUjREFSRUQKQVJNQkFORCNEQVJOIyMjClJFU0lERSMjI1JFREFDVAojIyNTSURFU1BMSVRURVIKQUJFVFMjVk9MRSNPUkxFCk1FVFJPI0VMQU4jT0lMUwpCQUNPTiNOT05FI0xBU1M="},{"title":"USA Today 05/21/99 \"STRING ALONG\"","author":"By Charles Preston","date":"1999-05-21","grid":"UEVSI0VUSEFOI1JBREFSCk9SRSNFUk9ERSNFUklDQQpTSURFTElORUJBQ0tFUlMKRU5PTCNMRU5PUkUjVEVFCiMjI0xFTyMjI0FERCMjIwojRkxBVEJVU0hMRUFHVUUKTEFJI0hFTkNFI1NOQVJLCkVMTFMjRElBTFMjRUxCRQpBTExPVCNUUk9QRSNMQUQKRkFJUldBWVNUQVRJT04jCiMjI1RJUCMjI1ZBTiMjIwpBTUEjUk9NQU5JI0dBUEUKQ0lWSUxERUZFTlNFTUFOClRSSUNFI0xBUkVTI0VMSQpTRURFUiNUUkFERSNORUQ="},{"title":"USA Today 05/24/99 \"MIND SET\"","author":"By Charles Preston","date":"1999-05-24","grid":"R0VOVVMjQUNEQyNCUkFOCkVMT1BFI1RIRUEjQUlSRQpMRUFSTiNIRU5TI0lOQ0EKU0NIT09MT0ZUSE9VR0hUCiMjI09SRU0jI0ZVTEwjIwpBQlVUI0RFU0FMVCNFU0MKTElORUQjI1BMT1cjQUhBCkdPRERFU1NPRldJU0RPTQpBVEUjU1VFRCMjVEhFUkUKRUFSI09STkVSWSNBUk5PCiMjQllURSMjSEFVTCMjIwpUUkVFT0ZLTk9XTEVER0UKSEFMVCNJSEFEI05PSVJFClVHTEkjUkFURSNBSUtFTgpHVVlTI0VOT1MjRUxFR1k="},{"title":"USA Today 05/25/99 \"LATIN LEGACIES\"","author":"By Charles Preston","date":"1999-05-25","grid":"VElERVMjQVRUVSNDQVJFCkFHRU5UI1BPT0wjT05VUwpOT05DT01QT1NNRU5USVMKQVJUI0tJTFRTI1NDRU5FCiMjI1JFTFkjI1NUVUIjIwpTQVRJUkUjQUxURVJFR08KQU1FTlMjRlJFRVMjTEVECkxPUkQjQ0xFQVQjUExPRApFUlIjR09PTlMjQ1JVREUKTUVBQ1VMUEEjS1JBTUVSCiMjRkFTVCMjU0hJTSMjIwpTUElSVCNQRUNBTiNWSU0KUEVSU09OQU5PTkdSQVRBCkVMTU8jQVZPVyNFQVNFUwpTVEFOI0JFTEwjU1RFQUs="},{"title":"USA Today 05/26/99 \"HAPPY DAYS\"","author":"By Charles Preston","date":"1999-05-26","grid":"RUxCQSNTTEFUUyNTUElUCkxVQVUjUElYSUUjRUxTRQpMSU5UI0FOSVRBI1JBSU4KQVNHT09EQVNJVEdFVFMjCiMjI0dSRUcjI1NJTiMjIwpBTExZTCNFQVIjR0VTU08KTkVVUk9OI0NBQiMjSE9ECk9OVE9QT0ZUSEVXT1JMRApESUUjI0JPTyNUSElFVkUKRU5ET1cjRVJHI0VMREVSCiMjI01FVCMjTE9BRiMjIwojVEhFQkVTVE9GVElNRVMKUEFVTCNBTEVSVCNFQUNIClVSR0UjQ1VSSUUjTFlSQQpQT0VUI0hFTUFOI0RPVUc="},{"title":"USA Today 05/27/99 \"PEOPLE BY THE NUMBERS\"","author":"By Charles Preston","date":"1999-05-27","grid":"QUxJQkkjI0NPUyNTQ0FSCktPUkFOIyNSQVUjSEVSTwpBR0VOVCNST1RDI1VOVE8KIyMjSk9TRVBIQ09UVEVOCkFQU08jT0FTI0VOU0lMRQpMRVQjT0lMIyNTU0QjIyMKRlJFREZMSU5UU1RPTkUjCkFDRU9GI1NBVyNBV0FSRAojRVJORVNUQk9SR05JTkUKIyMjQVJFIyNMRUUjTEVNCk9CSVRFUiNCRU4jRVNTTwpEQVZJREJBTEZPVVIjIyMKSVNBTyNJTklUI1JFTUlUClNJTk4jQVRNIyNTQ0FMRQpURUFTI05BUCMjQVRPTEw="},{"title":"USA Today 05/28/99 \"MEMORIAL DAY\"","author":"By Charles Preston","date":"1999-05-28","grid":"QUxBUyNIT1NTIyNEQURFCkxBUkEjSVRFTVMjSUxJQQpGTEFCI1RSRUFUI1NUQVIKI0FCUkFIQU1MSU5DT0xOCiMjI0FDRSNFTExBIyMjIwpOQVAjVFJZI1NUT1JNRUQKQUdFRSNURUEjI01FQVJBCkxBU1RNT05EQVlJTk1BWQpESVRUTyMjT1JFI1RBVEEKSU5TVUxBUiNUQVAjU09OCiMjIyNBTUVTI1JPRSMjIwpGRURFUkFMSE9MSURBWSMKUllBTiNTRUVOTyNHUkFZCkFSSUQjU1RFRU4jQUlSRQpURVNTIyNTVEFHI1JBTlQ="},{"title":"USA Today 06/01/99 \"PETTY CASH\"","author":"By Charles Preston","date":"1999-06-01","grid":"TUlEI0NPTUFTIyNBWExFCklESSNBQk9SVCMjVUxBTgpEQU0jRklWRUFORERJTUUKU0hFQUYjRVNUVUFSSUVTClRPQVRFRSNUVUxMRSMjIwojI0RPSVQjIyNMRVlERU4KI0NBTk5FUklFUyMjSUNVClJBTkVFI09QRSNSQU1PTgpBUkMjI0RJTUVOT1ZFTCMKRkxFU0hZIyMjQVNJQSMjCiMjI1RFTEVPI0dJTERFRApFU01FUkFMREEjTkFPTUkKU1RPUE9OQURJTUUjWkVOCkNPT1AjI05FTkVTI0VFSwpTQURFIyNEUlVHUyNOUkE="},{"title":"USA Today 06/02/99 \"COPPERS\"","author":"By Charles Preston","date":"1999-06-02","grid":"UkFLRSNSQVBJRCNTUEFTCkFWRVIjRUxFTkEjVEVOVApIRU5OWVBFTk5ZI0VOTkEKIyMjU0VBUlMjREFSTkVSCkFMUCNNSVQjQlJJTlkjIwpQRUVMRVIjSElFTUFMIyMKUkFOT04jUElUQVMjT0ZGCklTTlQjUk9SRU0jTUFVSQpMRVkjSEVSRVMjU0FGRVIKIyNXRUFWRVIjU1RFRUxTCiMjRUxMQVMjUEFSI1JTVApJQklERU0jQkFDT04jIyMKTE9HRSNQSU5DSFBFTk5ZClNFSFIjRUxBVEUjQVJORQpBUlRTI0RFSVNUI1JBRVM="},{"title":"USA Today 06/03/99 \"JUDGMENTAL\"","author":"By Charles Preston","date":"1999-06-03","grid":"I0lTSFRBUiNTSEFLRVIjCiNTVEVSTkUjQ0FQT05FIwojTUlYRURGRUVMSU5HUyMKIyNMQUsjI0FOT04jQUFSCkJSRUQjQ0FSRVMjT0dMRQpMT1QjQklUIyMjQkxFRUQKT0FUI0VWT0UjTEFEIyMjCldST05HSU1QUkVTU0lPTgojIyNPSUwjSU9UQSNDUk8KSEVNRU4jIyNUSUwjRUVSCkVUQUwjQUdBSU4jRUJPTgpOT1IjS05PVyMjQUxFIyMKI0lSUkVHVUxBUlZFUkIjCiNMRUFORUQjQVZFTkdFIwojRURFU1NBI0FTU0lTVCM="},{"title":"USA Today 06/04/99 \"FORMULA\"","author":"By Charles Preston","date":"1999-06-04","grid":"UlVOSU4jSU1QUyNHRVNUCkFSRUNBI05PUkEjQUxBUgpGRVdFUiNUSUVSI0JBQkUKIyNTVUNDRVNTSVNPTkxZCkhBUlAjT1JUUyNDUkVFUwpFR08jUEFOIyNCQUlUUyMKV0hPI0FTRUEjSVJBIyMjCiNBTUFUVEVST0ZMVUNLIwojIyNQVEEjRVZPRSNBSVIKI0xBUEVMIyNBQ1QjUkVPCkxJTkVSI0FMVEEjQkVWWQpBU0tBTllGQUlMVVJFIyMKU1RBUiNPVFRPI1JJTkdPClNFUkUjUkVJTiNJREVBTApPUkFEI0VSTlMjU0VER0U="},{"title":"USA Today 06/07/99 \"TOPMOST\"","author":"By Charles Preston","date":"1999-06-07","grid":"WklOQyNQUklNI0xJVFVQCklTQVIjUk9TRSNFRElOQQpUSVBPTkVJTEwjVElQSU4KSU5BU0VDI0FESVQjUE9FCiMjI1NBSVMjU1RJUEVORApBTlRFTE9QRSNPTkVSIyMKU09JI1NVRURFI0dPR09MCkNPUEEjU0FHQVMjTk9MQQpJTlBVVCNSRVNFVCNSQU0KIyNFRElUI1JFUFJJRVZFClJFQ0lQRVMjU1RPVyMjIwpFVkEjU0VBTSNVUEVORFMKU0VOQVQjVElQUEVSQVJZClROT1RFI0lET0wjRU5JRApTVEVFUiNOSVRFI0FTUFM="},{"title":"USA Today 06/08/99 \"WHO'S THE BOSS?\"","author":"By Charles Preston","date":"1999-06-08","grid":"SlVOVEEjQUpBUiNQRVNUCk9ORVVQI1RPR0EjSUdPUgpLSU5HT0ZUSEVKVU5HTEUKRVRFI0xJRU4jI1JJU0VTCiMjI0FMRVMjSE9CTyMjIwpMT1JET0ZUSEVEQU5DRSMKRVBFRVMjI0VSSU4jSEFTCkFSRVMjQUZJUkUjSElSRQpEQVMjQVhJUyMjU0VOTkEKI0hFQURPRlRIRUNMQVNTCiMjI0JPTkUjRUFSUCMjIwpBU1RJUiMjRUNDRSNNQUUKTEVBREVST0ZUSEVQQUNLCkFSVEUjQU5USSNDUklNRQpORUVEI01BU0MjSE9MRUQ="},{"title":"USA Today 06/09/99 \"DOUBLES\"","author":"By Charles Preston","date":"1999-06-09","grid":"TE9OR1MjQUJDUyNQT1JLCklWT1JZI0NPT0sjQVZPTgpNRVRFUyNIT01FUExBVEUKQlJFQVRIRSNFV0UjTEVFCiMjI1NFRSNTVEVXUyMjIwpQTEFZTUFURSNSRVBBTkUKQUlNUyNWSVZBI0VBR0VSClNUT1AjRU5FTVkjTkVBUgpIRVJPUyNBUkVBI0lOVE8KQVJFT0xBI0FOQ0VTVE9SCiMjI05BVEFMI0hSSCMjIwpBREEjQ09HI1NUQUZGRUQKSkFDS0tOSUZFI1NPSUxZCkFOVEUjQUxFRSNFUk5JRQpST1NZI0xFV0QjU0tJRVI="},{"title":"USA Today 06/10/99 \"A BEVY OF SLEUTHS\"","author":"By Charles Preston","date":"1999-06-10","grid":"R0lTVCNDTEVPIyNOQVBBCklERUEjUklBTlQjT01BUgpMT1JEV0lNU0VZI1NPTEUKQUxCI09CRVkjUkFJU0VTCiMjI1dFQiMjI0FORVcjIwpDT01BUyNBTEFOR1JBTlQKQVJJRCMjTUVMVFMjTEVFCkRPU0VTI0FWQSNUQUtFTgpFTlMjVVNIRVIjI0JFRFMKVE9NUklQTEVZI1BVUlNFCiMjQVVUTyMjI09BVCMjIwpXT1JTRU4jRUFUUyNBUksKQUxQUyNHRVJWQVNFRkVOClJJTEUjRVNTRU4jQkFORQpQT0VUIyNQRVJJI0JST1c="},{"title":"USA Today 06/11/99 \"LIKE A MELODY\"","author":"By Charles Preston","date":"1999-06-11","grid":"QkFORyNFTUlUI1dIT0xFCkFCT1UjTk9OTyNIT0lTVApTT0xJI0pPS0UjWUFMVEEKU09MREZPUkFTT05HIyMjCiMjI0VMSVMjI1JPWUFMUwpGRUxMSU4jQ0hBVCNSQVAKQVRFSU4jRFJBVCNTT0lSCkNIQU5HRURPTkVTVFVORQpUQUtFI1NBSUQjQVJOSUUKT05FI1NUWVgjQlJJREVTClJFREVZRSMjVEVBSyMjIwojIyNDTEVBUlNUSEVBSVIKU0NBTFAjU09BUiNTSU5FCk9QUkFII0FUUkEjVVJHRQpQQUNUUyNQT1NZI1BFRUs="},{"title":"USA Today 06/14/99 \"FANCY FEMMES\"","author":"By Charles Preston","date":"1999-06-14","grid":"U0hFQkEjTElEUyNTUEFUCkxFVkVMI0lST04jQ0FWRQpBUkVOQSNQQVJFI0FHRVMKV09OI01JU1NNQU5ORVJTCiMjI0JPU0MjSURPIyMjIwpNQUNFI1JPU0UjTEVOT1MKQVBFUiNBTUEjU1RSQUlUCk1BREFNRUJVVFRFUkZMWQpBQ0VUQUwjTEVFI0FURU4KU0VERVIjU1RBUiNUQVJFCiMjIyNMQVAjTUVTQSMjIwpNUlNST0JJTlNPTiNTQVQKUkVOTyNPTklUI0FQUExFCkVEQU0jUkVORSNSQUlTRQpET1BFI1RTQVIjRUxUT04="},{"title":"USA Today 06/15/99 \"SPIFFING UP\"","author":"By Charles Preston","date":"1999-06-15","grid":"QVJDUyNTTEFNUyNHQUxBClNPVVIjQ1VSSUUjQUxPVApIQVJJI0FHRU5BI0xPT00KRVJSI0NMRUFOU1dFRVBTCiMjWUFSRFMjI0hFTiMjIwpERUZJRVMjUFJPQkFCTFkKRVZBREUjUEFJUlMjUk9FCk5PVkEjRk9SR0UjQ1VUUwpUS08jVElMVFMjV0FTVEUKU0VSSUFMTFkjU0FTSEVTCiMjI1ROVCMjU1BSRUUjIwpXSElTS0VEQVdBWSNET0UKUlVCRSNSQURBUiNCT01CCklUQUwjRVZFTlMjQUZBUgpUVVJGI0RFTlNFI0FGUk8="},{"title":"USA Today 06/16/99 \"ALIAS SMITH AND . . .\"","author":"By Charles Preston","date":"1999-06-16","grid":"UEVQRSNMSVNQI1RFTVBTCkFYRUwjQU5JTCNBR0lMRQpDQVJPTFlOVE9NTVlMRUUKRU1VI0FNRVMjQVBQRUFSCiMjI1NUQVIjRlJFVCMjIwpCSVRURU4jRkFJUiNDRFMKSURFQUwjVkVJTiNQT0VUCkpFUlJZUEFVTEFCT0JCWQpPQVNUI09MRFMjUlVSQUwKVVNFI1RPRVMjSEFSQVJFCiMjI0FJUlMjREFJUyMjIwpUUkVCTEUjTUlORCNTT1cKTU9USEVSSkFDS1NQSUtFCkFTVE9SI0FOVEUjRVpSQQpORUFSUyNCRUFSI0dFQVI="},{"title":"USA Today 06/17/99 \"ILL IS IN\"","author":"By Charles Preston","date":"1999-06-17","grid":"QlJBUyNDUkFHI0NBUFJBCkxVTlQjSEFMTCNBTkFJUwpBQk9ZI09SRU8jTllNUEgKTUlMTElTRUNPTkQjVEVZCkVORFVSRSMjTVVMVEkjIwojIyNTRVRPTiNERUFMSU4KSkFXI05PVk9URSNJTFNBCkVYSUxFI0VSQSNTTElFUgpERUxJI0lOQVJPVyNTRUMKSURMRVNUI1NBUkFTIyMjCiMjSU5PTkUjI09NRUxFVApBQlMjRE9CSUVHSUxMSVMKVE9URUQjT05DRSNEQURBCk9aT05FI0FOT04jT01FUgpaT05FRCNUT05ZI01BUlM="},{"title":"USA Today 06/18/99 \"MAN OF THE HOUSE\"","author":"By Charles Preston","date":"1999-06-18","grid":"RE9XU0UjI1NPVyNTV0FHCkFWQUlMI1NMT0UjVElFUgpEQUREWVNIT01FI0VMU0UKQUxFRSNLRU1QIyNQTE9UCiMjI0RDSSNPSE1ZUEFQQQpJTkRJQU5BIyNFRUUjIyMKRkVBU1QjU09MT1MjSEVFCkZBVEhFUktOT1dTQkVTVApZUlMjUkVTVFMjSVJBVEUKIyMjTUVOIyNTRVJBUEVTCk1BSk9SREFEI0RFTiMjIwpBTE9UIyNMSU1FI0RPTUUKTElLRSNPTE1BTlJJVkVSCkVWRUwjV0VFUCNVU0VSUwpTRVJTI0VOUyMjVEhSRUU="},{"title":"USA Today 06/21/99 \"ON THE MOVE\"","author":"By Charles Preston","date":"1999-06-21","grid":"RURHRSNTTEFUUyNCQVNLCkNPQVQjVFVOSUMjQU1JRQpIT1BBTE9OR0NBU1NJRFkKT1JFI0lOR0UjVFVSVExFCiMjI1NORUVSUyNSQVlFRApGQVRORVNTI0hPRSMjIyMKQU5XQVIjI1NBVyNTTEFHClNLSVBTVE9USEVDSEFTRQpUQU5TI0lWWSMjTEFUSU4KIyMjI0xFQSNBREVMSU5FCk1FVFJPI0xBVEVOVCMjIwpBWElPTVMjQ0hJQyNBU0sKSlVNUEFUVEhFQ0hBTkNFCk9ESUUjSVJFTkUjU05BRwpSRURTI1JBREFSI0hBTlM="},{"title":"USA Today 06/22/99 \"WORDS IN WORDS\"","author":"By Charles Preston","date":"1999-06-22","grid":"RkFDSUUjVk9XIyNTQ0FUCkFUQUxMI0FQRVMjSEFMRQpOSVNFSSNHRU5FI0FMRUUKU1RVI0NPVU5URVJTSUdOCiMjQVJJU0UjI0tJVCMjIwpBTExPVFMjQ1JFVkFTU0UKRE9URVMjTU9PUkUjRUNUCklSSVMjQk9PVFMjU0NPVApFRUUjSEFURVMjQ0FSUkUKVU5TRUFURUQjQUxJRU5TCiMjI01MSSMjU1RJTlQjIwpQUk9QT1NJVElPTiNJRVIKU0FSSSNUUk9EI0dPT0RZClNUQVIjQU9ORSNFUk5JRQpUQUxFIyNORUQjUkVTVFM="},{"title":"USA Today 06/23/99 \"PHYSICALLY SPEAKING\"","author":"By Charles Preston","date":"1999-06-23","grid":"SEFIQSNJUkFERSNPVkFMCkFMQU4jREFSSU4jQ09ORQpUT05HVUVUSUVEI0FJVFMKI0VESVQjU0FUSU4jTEVUCiMjU0VFUyNERVZJU0VTIwpIT0QjU0tJTkRFRVAjIyMKSUxPIyNFVkUjI0NBRkVTCkdFV0dBV1MjRklFU09MRQpIT05BTiMjREFSIyNPTEUKIyMjV0lERUVZRUQjVEFQCiNCQVBUSVNNI0RJTEwjIwpDQUwjQVRTRUEjUk9PSyMKT0JPRSNIRUFEU1RST05HCkRFRlQjRU5OVUkjQVNJQQpBTFRPI1JFU0VUI05FVFM="},{"title":"USA Today 06/24/99 \"FAUNA\"","author":"By Charles Preston","date":"1999-06-24","grid":"TUVTSCNFR0dBUiMjRkFECkFSRUEjTkFJVkUjU0lURQpDUkFCQVBQTEVTI0FTVEEKRVNURUxMRSMjQVJUSFVSCiMjI0FNQSNCQUxFUlMjIwpTQU1TT04jQUNFVEFURVMKSURPI1NFUFRJIyNQSUxMClJVTiNUU0UjRERTI0NTQQpFTEtTIyNBUlNPTiNLSVQKU1RFRVBFU1QjTUFTU0VZCiMjWUVTU0VTI0lSQSMjIwpTVUJNSVQjI09ORVlFQVIKT1JBTCNIT1JTRVNFTlNFCk1BUlkjRVJBU0UjUk9UQQpFTFMjI1JBREFSI1NXSU0="},{"title":"USA Today 06/25/99 \"DEAL ME IN\"","author":"By Charles Preston","date":"1999-06-25","grid":"Q0hBUyNFQ09MRSNTVEVQCkxBQ0sjQ0hBSVIjQ0FUTwpBUlRJQ0hPS0VIRUFSVFMKU01PVEhFUlMjQUxMT1VUClNTUiNBTEUjQlJJRSMjIwojIyNTUk8jRkFEUyNPTEQKQ09UVE9OR0lOI0VFUklFCkFSSUEjU0lORVMjTUVBTgpQQU5HUyNGSVNIU1RPUlkKT0xFI1RPVFMjT1RTIyMjCiMjI1NJVFMjQVdFI0FHRQpBQlNFTlQjQVNDUklCRUQKQlJJREdFRklOQU5DSU5HCkJFVEEjUklERVMjRURJRQpBREVOI1NURVJFI1NFRVM="},{"title":"USA Today 06/28/99 \"BON APPETIT\"","author":"By Charles Preston","date":"1999-06-28","grid":"R1JBQiNFVklDVCNMQUNLCkxFTk8jTUVUUk8jQUJSQQpFQVRZT1VSSEVBUlRPVVQKRVJJQ0EjQkVBI0VUVURFCiMjI09TVCMjVE9OSSMjIwojTEVUVEhFTUVBVENBS0UKVE9NVCNFUkkjS0VFUEVSCk9UQiMjUkVOQUwjI0FZTgpBVE9OQ0UjRUxBI0NJRVMKRE9HRUFURE9HV09STEQjCiMjI1BST0EjI05BWSMjIwpIQVNUTyNUSVMjVFdFRU4KSUNPVUxERUFUQUhPUlNFClRFTk4jQVJNRUQjTElBUgpFREdFI1RTQVJTI0ZFVUQ="},{"title":"USA Today 06/29/99 \"DROP FRONT (AND BACK, TOO)\"","author":"By Charles Preston","date":"1999-06-29","grid":"Qk9SSVMjU0hBRyNNQUxFCkVST0RFI1RPUk4jQVJBTApMRU1PTkRFV0dVTU1BSUwKI01FTCNFUkUjI1VNQlJBCiMjI0lSQU4jVEFSQSMjIwpPRkZaT05FS0lDS0xFQUYKQUxMRU4jI0FSVFkjTkJBClRBT1MjTUVSRVMjR09PRApFUlIjU0FOQSMjQkVSTkUKU0VBVENMT1RISEFNTUVSCiMjI1JBSUwjT0FSUyMjIwpFU1RFUiMjTk5XI1RSQSMKUkFJTlBJR0VPTkNPVUdICklSRUQjTkVBUiNJTkRJQQpDQVJZI1NFVFMjVEVFTlk="},{"title":"USA Today 06/30/99 \"WE GET LETTERS\"","author":"By Charles Preston","date":"1999-06-30","grid":"QUhBI0FQVCNFTU8jVEFKClJPVCNDQVJBVkFOI0VOQQpDQVRDSFNPTUVaUyNOTlcKQVhFTCNTVEFORElOR09TClJFTkFNRSMjI0FUT1IjIwpPRERORVNTRVMjRVRBUEUKIyMjI01PVVNFIyNJTkRPCk1JTkRPTkVTUFNBTkRRUwpBVEVFIyNERVRFUiMjIyMKRE9HTUEjRU5BTUVMSU5HCiMjTElTUCMjI0VESVRPUgpUSEVUSFJFRUJTI0RVUkEKUk9DI01PREVMVEZPUkRTCkVNVCNBVEVMSUVSI0JJUwpLT1MjTk9OI1BSWSNJQ1k="},{"title":"USA Today 07/01/99 \"MAKE A FIST\"","author":"By Charles Preston","date":"1999-07-01","grid":"QkFOQyNBTFRBUiNBQkNECkVWRVIjVklPTEEjUkFMRQpMQURZRklOR0VSI0NST1cKIyMjU0FMRVMjQVRIRU5BCk1BUlRJQU4jIyNCQUtFUgpVU1VBTCNTVVNUQUlOIyMKRklMTEVEI1BSTyNDVVJCClRBRSNEUk9QT1VUI0NVRQpJTk9OI0FERSNUSU5LTEUKIyNGRVRURVJTI1BBTEVSClJBVFNPIyMjTVVTVEVSUwpJU0hUQVIjUlVOSUMjIyMKUEFVTCNGT1VSSU5IQU5ECk9OTUUjRFJJRlQjRUxPSQpOQUJTI1NFTlNFI1pJTkc="},{"title":"USA Today 07/02/99 \"THOUGHT FOR THE 4TH\"","author":"By Charles Preston","date":"1999-07-02","grid":"U09BUiNDQUpVTiNMSU1CCkFDUkUjQUxFTkUjRUNSVQpUSEVDRU1FTlRPRlRISVMKQVJORVNTI05JTkVTIyMjCk5FQVBTI0VZRSNUSUdFUgojIyNURU5OIyNHRU5FUkEKVU5JT05JU1RIRSMjU0FQClBPT1IjQ1VSRVMjQVNUSQpQT1cjI0hFQVJUQkxPT0QKRU5BQkxFIyNURUFLIyMjClJFTkVFI0xJWiNLQVJBVAojIyNBU1RPUiNSRUxBVEUKT0ZFVkVSWUFNRVJJQ0FOCkZPUkUjRUFUT04jTkVSRApGRUFSI0VMRUNUI0VSSVM="},{"title":"USA Today 07/06/99 \"FILM TECHNIQUE\"","author":"By Charles Preston","date":"1999-07-06","grid":"RkFERUlOI01BVUwjT0NUCklORVNTRSNBTk5PI1BMTwpSSVBQTEUjU0tJTkRFRVAKRUxJI0VEVUNBVElPTkFMCkRJQ1QjU1RBIyNTQ0FSRQpPTlRBUCNPUkVPI1RJRVMKR0VTU08jUEFTU1dPUkRTCiMjI1RFUkkjU09BUiMjIwpUUkVFU0NBUEUjQ0FGRVMKSEVFTCNBTk9OI1NUQU1QCk9HUkVTIyNPQ1MjRURJRQpSQUlTSU5CUkVBRCNFUkUKUFJFU1NVUkUjUkVMT0FECkVEUyNBREVTI0lNUFVURQpTU1QjTEVUVCNTSVNURVI="},{"title":"USA Today 07/07/99 \"EMULATE\"","author":"By Charles Preston","date":"1999-07-07","grid":"TElNQiNWSVNUQSNJU1VQCkFTSUEjQU5OQVMjTklOQQpDQVJCT05DT1BZI1NNT0cKU1RFRUxFI0JFRUhPVVNFCiMjI1JFU1QjI1RPTEwjIwpLVURVUyNZRFMjTUVBTFMKQUJVVCNGUklMTFkjVEFQClNPUEgjUkFURVMjU0lERQpIQUwjV0FOVEVEI0tPTEEKQVRJREUjVE9QI01JTkVSCiMjQ0VMTCMjU0NBVCMjIwpGTEFUVE9QUyNMQVRJTk8KTFVURSNGQUNTSU1JTEVTCkFYRVMjVFJBSU4jU0lMTApXRVNUI1lFTlRFI0hBTE8="},{"title":"USA Today 07/08/99 \"C SQUARED\"","author":"By Charles Preston","date":"1999-07-08","grid":"TE9DTyNUSEVNI1BBUlNFCklSQU4jWU9HQSNBTE9IQQpMT1JFI1JJR0cjUklMRVMKQU5TI0NBU1NJVVNDTEFZCkNPT0xBTlQjI05FRSMjIwojI05FU1QjT0RJQyNDQVAKQVNDT1QjQlJBVCNBUklBCkNISU5FU0VDSEVDS0VSUwpUT1RFI1RFQUwjUklERVMKU1BZI1JJUFMjWklUSSMjCiMjI1NPTiMjREVCQVRFRApDSElDQUdPQ1VCUyNDUk8KSEFSRU0jRE9FUiNDQVJMCkFMT05FI09MTEEjT1JFTApUT05FUiNST1NTI0VERFk="},{"title":"USA Today 07/09/99 \"DOUBLE VISION\"","author":"By Charles Preston","date":"1999-07-09","grid":"U1RBUiNTVEFUI1RIRURBCldPVkUjQVJMTyNST1ZFUgpBUkFQI1lPU1QjSUxJQUQKQklMTFNTUE9PTkJJTEwjCiMjI0FUT0kjI0FVRSMjIwojUklDS1NDQVJEVFJJQ0sKRkFDRVMjI1NPSUUjRlJJCkFTSVMjUEVURVIjRkVBVApSVEUjQVVFUiMjQUxBTlMKTUFSS1NUUkFERU1BUksjCiMjI0lBVCMjRVNPUCMjIwojSkFDS1NCTEFDS0pBQ0sKVE9TS0kjQVVSQSNBUk9OCkVBVElUI1NLSVAjQ0lORQpPTk9ORSNFRUVFI0tBTkU="},{"title":"USA Today 07/12/99 \"IT'S ELEMENTARY\"","author":"By Charles Preston","date":"1999-07-12","grid":"REFNRSNET01PI0JBTkpPCkFXRUQjRVZFUiNPUklPTgpWQUxFI01FTkQjUkVORUUKSVJPTkNVUlRBSU4jRUxTClNFTklPUiNISU5FUyMjIwojIyNDQVJCT05DT1BJRVMKT0xEI1NFQUwjIyNDT0xBClBPVUxUUlkjQVNTQVVMVApVQ0xBIyMjVFlMTyNTRUUKU0lMVkVSTElOSU5HIyMjCiMjI0FMQlVNI01JQVNNQQpIQUcjVElOUEFOQUxMRVkKQUxBTU8jREFWRSNMT1VSClJBWk9SI0VOT1MjSVBTRQpQSUFOTyNOT1dTI0NFRVM="},{"title":"USA Today 07/13/99 \"ALLITERATION\"","author":"By Charles Preston","date":"1999-07-13","grid":"U0VMRiNOT01FI1NIT1JUClRSRUUjT01FTiNIT1ZFUgpST01FI0hBTkQjQU1JTk8KQURPI1RPTklPI1JFRERZClBFTk5ZUElOQ0hFUiMjIwojIyNBUEUjI1JJRCNBUFQKI1JPUEUjU0tJTiNUUklPClBFUFBFUk1JTlRQQVRUWQpPQkVZI0lPTkUjTElTQSMKREFOI01PTyMjU0VOIyMjCiMjI1BJVFRFUlBBVFRFUgpDT0xBUyNIRUFMUyNBVkUKQVZBU1QjRVJNQSNFTEFOCkJFVFRFI1NJUFMjTElOVApTTkVFUiNURVNII01BU1M="},{"title":"USA Today 07/14/99 \"FOWL PLAY\"","author":"By Charles Preston","date":"1999-07-14","grid":"R0FMQVMjUEVFUiNBQ0lECkFNRU5UI0VSU0UjVFJPRApQSUdFT05UT0VEI09PTkEKRU5FI1JPRVMjUlVOV0FZClNPUlJJRVIjTE9TRVMjIwojIyNFRUwjRkVWRVJGRVcKSElERVMjR0lWRVMjRVJFCkFTT0YjUEFMRVIjTEVJQQpSRVYjRFJJRVIjUEFURVIKUFJFVklPVVMjQ1JJIyMjCiMjVEFSVFMjUExPRERFRApUUkFMRUUjUE9VRiNJREEKUkFJTCNHT09TRUZMRVNICkVSTEUjRUFTVCNFQVNFTApFQVNZI0VLRVMjUkVFTFM="},{"title":"USA Today 07/15/99 \"LUCENT\"","author":"By Charles Preston","date":"1999-07-15","grid":"QVJHTyNERUZFUiNBQkNTCkNPTEEjRVhJTEUjTk9BSApIT1VSR0xBU1NGSUdVUkUKRUtFI01FTFQjI0NJVEVECiMjI1dBVFQjQVNIRSMjIwpBUkNBTkUjQVNUSSNTRVQKUkVBUiMjR1JPQU4jSE9FCk1BR05JRllJTkdHTEFTUwpPREUjTk9SU0UjI09NSVQKUkVEI1RSVUUjQkJHVU5TCiMjI0pFVFMjTUVSRSMjIwpPRkZFUiMjU0VNSSNNUlMKR0xBU1NCT1RUT01CT0FUCkxBRFMjT1BFUkEjQUxHQQpFUEVFI1hFTk9OI0RFRVI="},{"title":"USA Today 07/16/99 \"???\"","author":"By Charles Preston","date":"1999-07-16","grid":"UkFJU0EjSkFERUQjTUFDCkFERFVQI0FSRU5BI0FDRQpZT09GT0xMT1dFUiNHT0QKIyMjI0xFT1MjIyNQT1JFCiNKT1VMRVBFUlNFQ09ORApTRU5TT1JZI0VFTFMjIyMKRVJJRSMjI05BTUUjTVJTCkVST0RFQllGUklDVElPTgpTWU4jUEVFTCMjI0FOT0EKIyMjUklUQSNTQ09SSU5HCk1BTEVDSFJPTU9TT01FIwpBTEVYIyMjRkFMQSMjIyMKUkVWI1NVRkZSQUdFVFRFCklSRSNJTkxFVCNFVkVSWQpBVEUjUE9VUlMjU0FESUU="},{"title":"USA Today 07/19/99 \"SWEET STUFF\"","author":"By Charles Preston","date":"1999-07-19","grid":"WkVBTCNTUEFUUyNPUEVDCkFMRE8jVEFST1QjTFVMTApQSUVUUkFZTk9SI0VERE8KIyMjI0FOTkUjQUJPREVTCkFTVFJJREUjQklUI0lSRQpNT1JBU1MjUkVUVVJOIyMKSU5BTkUjS0FMRSNBR0hBClJJRlQjTElWRU4jQ0hJUApTQUZFI0lURU0jTUlFTlMKIyNJUk9ORUQjTUFOQUdFClBBQyNST0QjU0VDRURFUwpBQkpFQ1QjS09MQSMjIyMKU0xBTSNZRUxMT1dDQUtFClNFTUkjUExFQUQjT1hFTgpFUlNUI0VNRVJZI0JFTkQ="},{"title":"USA Today 07/20/99 \"MAKE GOOD USE OF WHAT YOU KNOW\"","author":"By Charles Preston","date":"1999-07-20","grid":"VEVQSUQjI0xBSUMjTUFJClNFUk9VUyNFTEJBI0FMVApLTk9XTEVER0VJUyNMQVMKIyNCQUxFUiMjREVGQU1FCk9STyMjTUFTUyNSQVRFTApQT1dFUiNCVVRPTkxZSUYKVE9MTEVEI0tBVCNMQU4jCiMjI0FNQU5LTk9XUyMjIwojQ0VTI1RJTyNTSVRTVVAKV0hBVEZBQ1RTI05PVFRPCkFFUklFI0tIQU4jI0VFTApGRU5ORUwjI0xBTUFSIyMKVFJFI0JPVEhFUkFCT1VUCkVFUiNMT1dFI0FMQklOTwpERFMjRVRPTiMjTEFERU4="},{"title":"USA Today 07/21/99 \"SPORTY FILMS\"","author":"By Charles Preston","date":"1999-07-21","grid":"U0xJTSNTTEVFVCNJU0xFCkxJTUEjVEVUUkEjREVBTgpBTUFUI0FOVElDI0FNSUQKTUlHSFRZRFVDS1MjSVJTClNURUVSUyMjQUxPRlQjIwojIyNSSUFUQSNFTlJPT1QKRUJCUyNJT05BI0dPVUdFCkNVTCNHTEFTU0VTI0dFRQpDUlVFTCNERUVTI1RIRU0KRVlFTEVUI0xBQ0VSIyMjCiMjQ0xBUkUjI0FURUFTRQpBU0gjTUFKT1JMRUFHVUUKQ09JTCNDRUxJQSNESUxMClJJUEUjRUNMQVQjRUxMRQpFTFNFI1NUQUxFI1JFQVI="},{"title":"USA Today 07/22/99 \"PEN PALS\"","author":"By Charles Preston","date":"1999-07-22","grid":"REVNT1MjQVJBQiNSQVBTCkFMRVJUI1ZJVEEjT1RJQwpTTElFUiNPUFRTI0JPRVIKSEVSTUFOV09VSyNJTlRPCiMjIyNUT1NTI0VOTkVBRApJU09CQVIjVE9URU0jIyMKUkFMRSNTRUVNI1NPQUtTCkFCRVRURUQjQVNUT1JJQQpRVU9USCNFRVJPI1JJTkQKIyMjWUVBUk4jRFJFREdFCkFNVVNFRCNBTEFFIyMjIwpQQUxNI0pBTUVTSk9ZQ0UKQVJUSSNVVkVBI0VCRVJUCkNBUlQjUkVMUyNDT05BTgpFVEFII0VTU0UjVEVTVEE="},{"title":"USA Today 07/23/99 \"THE USA - A TO Z\"","author":"By Charles Preston","date":"1999-07-23","grid":"QURBTSNBTUFaRSNPTllYCkRFSkEjQk9ORVIjTk9TRQpERUFOI0VOTlVJI0VWRVMKI1BSSVZBVEVTRUNUT1IjCiMjI1RBTUUjI0NPVyMjIwpBUkdPVCMjU0xBTE9NRUQKU0VSQiNERUxBTk8jQVJFClRIRUFNRVJJQ0FORkxBRwpSQUUjRU5BTUVMI0xJU0EKQU5USURPVEUjI1JBQ0VTCiMjI05BTSMjV0VFSyMjIwojUFVCTElDU0VSVklDRSMKRkVMTCNOT0xBTiNFUklRCkVTQVUjQUxJVkUjU1VSRQpaT05FI0xBREVTI1RFRUQ="},{"title":"USA Today 07/26/99 \"POCKET CHANGE\"","author":"By Charles Preston","date":"1999-07-26","grid":"U1RFUCNDT0xEI0JMQUlSCkhFUkEjT0xFTyNZQU5OSQpVUklDI0xJTlQjQU1JR08KTklDS0VMT0RFT04jU0VUCiMjI0VTRSMjI1JPVkVSUwpRVUFSVEVSSE9SU0UjIyMKVVJOIyNOT1VOI0VHUkVUCklHT1IjI01SVCMjQUlSUwpURU5PUiNBUk9XIyNDSUEKIyMjUEVOTllQSU5DSEVSClJFQ0VERSMjI1pPTyMjIwpPUk8jQURJTUVBRE9aRU4KQk9SSUMjQ0FSUiNMVVJFCklESU9UI0VOSUQjRUxMRQpORU9OUyNERU5TI1JVRUQ="},{"title":"USA Today 07/27/99 \"POINT-BLANK\"","author":"By Charles Preston","date":"1999-07-27","grid":"QVNIRVMjQU1QUyNKSU1TClNXQU1QI1JBUkUjQVJJRQpLQVJNQSNJTk9OI0NBTlQKU1BFQVJIRUFEUyNLTklUCiMjIyNTSUxUI0VTS0lNTwpIRURHRUQjRVNTRU4jIyMKQVZFUiNFVkVMI01JQU1JClJFTEVBU0UjVU5JRklFRApQUkVFTiNUUkVZI0VESUUKIyMjTk9SU0UjTE9TRVJTCkFSQ0FORSNVUE9OIyMjIwpMQUhSI1BJTkVORUVETEUKRE9VUiNFUklFI0RSRUFECkFVVE8jQU1PUiNBTEVORQpTTEVXI1RBTlMjWUVNRU4="},{"title":"USA Today 07/28/99 \"THAT MAKES CENTS\"","author":"By Charles Preston","date":"1999-07-28","grid":"U1BBUyNURUFNUyNTQUxFCkxVU0gjQUxMQUgjVFdJTgpBUklBI0JMQVpFI1JPQkUKUEVOTllMQU5FI0pPS0VSCiMjI0dFRSMjI1RVUEVMTwpPTUFIQSNFQVNFTFMjIyMKTU9OQSNTVFJPREUjQVNICklORElBTkhFQURQRU5OWQpUT1kjUE9FVFJZI1NOSVAKIyMjU1BPUkVTI1NQQVRFClJFU1VMVCMjI0FJUiMjIwpJUk9OWSNXSUxMUEVOTlkKUEFSUyNCQUdFTCNTRUVTCkVTVEUjQUxPTkUjU0VSRQpORVNUI1JFUkFOI09ET1I="},{"title":"USA Today 07/29/99 \"KIDS' GAME\"","author":"By Charles Preston","date":"1999-07-29","grid":"SE9DSyNEQURTI0NST1BTClVUQUgjSUxJQSNIVVJPSwpST1RBI0FURU0jQU5HUlkKUk9DS0NMSU1CSU5HIyMjCkFMSElSVCMjQVJDI1dBUwpIRVkjRU9OUyNSRUpFQ1QKIyMjVkVORUVSIyNPTkVTCiMjUEFQRVJXRUlHSFQjIwpCRUVTIyNEVU5DQU4jIyMKTVlTRUxGI1BFRUwjU1BBCldFVCNPUkEjI0NBU0hJTgojIyNTQ0lTU09SU0tJQ0sKS0FZQUsjS0FORSNFTEFMCklOQU5FI0VNTUEjV09SRQpUQUtFUiNERUVNI1NIT1Q="},{"title":"USA Today 08/02/99 \"IN OTHER WORDS\"","author":"By Charles Preston","date":"1999-08-02","grid":"UFNTVCNMQVNTI0pBV0VECkFOTkUjRVhJVCNBR09SQQpUT09UT05FU09XTkhPUk4KVE9SUklEIyNBSEVBRCMjCklERUFMI0NBVE8jI1NIRQpFU1MjI1RBTVMjSE9NRVIKIyMjRURFTUEjVE9ORVJTCiNGSURETEVTQVJPVU5EIwpERU5JQUwjU0xFRFMjIyMKTkFTVFkjUEVBSyMjREFNCkFURSMjR09EUyNDUklNRQojI0NPVU5UIyNVUkFOVVMKRFJVTVNVUEJVU0lORVNTClJBUkVFI0lPTlMjQ1JFRQpTUEVORCNFV0VSI0hPU1M="},{"title":"USA Today 08/03/99 \"POSTURES\"","author":"By Charles Preston","date":"1999-08-03","grid":"QkFORCNTVEFSUyNEQU1QCkFMQUkjUEFHQU4jRUxJQQpHQVNQI0FST1NFI0ZBU1QKI1dBTEtJTkdQQVBFUlMjCiMjI09ITk8jI0tFTiMjIwpTRUxNQSNXRUQjQURFTEUKQ0xPQUtTI05PVCMjVklBCklNU1RJTExTVEFORElORwpGT0UjI1lPVSNST09URVIKSVNTVUUjUEVJI0lOQU5FCiMjI05BTSMjTUVTQSMjIwojU0lUVElOR1BSRVRUWSMKQUxTTyNTQVJBTiNJT1dBCkRPTEwjRVZJTFMjT05DRQpTRUVEI1JFTUVUI05FQVI="},{"title":"USA Today 08/04/99 \"FILMDOM\"","author":"By Charles Preston","date":"1999-08-04","grid":"RkVURSNBQ0xVI1NQT0RFCkFWRVIjQ0hPUCNFTEdFUgpMRUFTI0NPQ08jQVVSQUUKQUxMVEhFS0lOR1NNRU4jCiMjIyNPREUjI09PUCMjIwpBTExPVkVSVE9XTiNJUlMKTkVFREVEI0hBTiMjTkVUCk5BVkFMI1NJUiNCT0lTRQpFVkUjI1BPRSNCQURHRVIKU0VFI0FMTEZBTExET1dOCiMjI0FCQSMjR1VTIyMjIwojQUxMSU5USEVGQU1JTFkKRkxPT0QjSE9PRiNBTElBCkFUT05FI0VSTEUjVFNBUgpUT1RFRCNNQUREI0hBUkQ="},{"title":"USA Today 08/05/99 \"TV TRIVIA\"","author":"By Charles Preston","date":"1999-08-05","grid":"R0FMT1AjRlJJIyNUQU5HCkFET1JFI1JJR0cjQUxFRQpNQU5PUiNPTU9PI0NPQVQKRVJHI1NVR0FSQkFLRVJTCiMjQkxJUFMjI0xJTCMjIwpBQ1JPU1MjQ0hJTUVSQVMKQk9BU1QjTE9PTlMjSU5UCkFSTkUjUEFSRVMjT0NUTwpTT0MjVElOQVMjQVJLSU4KRVRIRVJFQUwjRFJFU1NZCiMjI1NVUiMjQUVTT1AjIwpIT09URVJWSUxMRSNMU1QKQUlERSNFSVJFI05FQUxFClVTRVIjU09BUiNBUkNFRApMRVNTIyNMRVQjTEVFRFM="},{"title":"USA Today 08/06/99 \"SADDLE UP\"","author":"By Charles Preston","date":"1999-08-06","grid":"TEFQIyNBTUFUSSNPVFRPCkFDSUQjVElUQU4jUFJPQQpCVUNFUEhBTFVTI1RBUlMKQVRPTkFMI0VSSVMjVkVUCk5FVFRMRSNTSUdORUUjIwojIyNTRVRBI0NIQVJMSUUKRE9SIyNFTkQjVFJJTExTCklNT0xBI1lFVCNMRUVLUwpSRVNPTEQjTklTIyNSQUUKVFJJR0dFUiNDSElQIyMjCiMjTkVFREVEI0FSUkVTVApBTUEjUlVHQSNQT09SRVIKU0lORyNDSU5DSU5OQVRJCkFSVFkjRU5ET1IjRVRPTgpQT0VNI1NBWVNPIyNPTkU="},{"title":"USA Today 08/09/99 \"WORD PLAY\"","author":"By Charles Preston","date":"1999-08-09","grid":"U1BBVCNTVE9QI0xBTkFJCkxVU0gjRUFSUyNBRE9STgpBUlRFI0NST1NTV09SRFMKUExBVE9PTiNURVkjR0VFCiMjI09XTlMjI1JFTEVOVApTVEFSRUQjRU5FUk8jIyMKUEFSVFMjSUNPTiNUQVBFCkFMVE8jR1JPVkUjU0xPVwpERVNJI0xPTEEjQk9JU0UKIyMjU0VJTkUjQ09GRkVSClBBUkVOVCMjU0FORCMjIwpBQkEjQUNFI1RST09QRVIKQ09DT0NIQU5FTCNVTE5BCkVWRVJUI1NJTk8jR0FJVApTRVJCUyNFTk9TI0hZREU="},{"title":"USA Today 08/10/99 \"COUPLETS\"","author":"By Charles Preston","date":"1999-08-10","grid":"SEVMUFMjQVNBUCNBV09MClVNSUFLI01BUkwjQkFCRQpGSUZUWUZJRlRZI0JMT1QKRkxFQSNPREFZI01PTEVTCiMjI0dBUEVSI1JJVEEjIwpOQUJPQiNTSU5VUyNXT04KSU5BTkVSI1NVTlNIQURFCk1JRElST04jQkVIT0xEUwpCTEVBUklFUiNTQU1MRVQKWUVOI0FMT09GI1BFQVJTCiMjQkVOUyNTQUZFUyMjIwpTVEFSVCNIQUlMI1RPT0wKSFlERSNLRUxMWUtFTExZCk9QRUMjRVJJRSNFQUdFUgpXRU5UI05FRUQjQURBR0U="},{"title":"USA Today 08/11/99 \"TAKE CARE OF NUMBER ONE\"","author":"By Charles Preston","date":"1999-08-11","grid":"Uk9NI1RFRVMjTEVTVEVSCkFNTyNIT1JBI09WRVJETwpOQVRJT05BTCNCRUxVR0EKVEhFQ1VTVE9NRVIjRUVSClNBVEVTIyNPVVNUUyMjIwojIyNTQVJPTkcjI0xJQVIKUElBI05BUFMjU0NBUkNFCklTSlVER0UjSlVSWUFORApFTEFQU0UjQ0FSTyNORUQKU0VSVCMjVEFNRVNUIyMjCiMjI09NQVJTIyNTT1VTQQpBUkEjRVhFQ1VUSU9ORVIKR0FMT1JFI0FQRU5OSU5FCkFTU0FJTCNET05HI1RPTgpTUE9SVFMjRU5EUyNFUkE="},{"title":"USA Today 08/12/99 \"COMPUTERAMA\"","author":"By Charles Preston","date":"1999-08-12","grid":"SU1QUyNQQVNUQSNBSEFCClRBVVQjQVNQSUMjRElWRQpDWUJFUlNQQUNFQ0FERVQKSE9TUElDRVMjI09QRVJBCiMjIyNQQU4jU1BBVCMjIwpIVU1NRUwjVkVFUiNGSUcKQVNFQSMjVE9VUlMjRVJBCldIQVRBVFdJU1RFRFdFQgpLRU4jTkVJTFMjI1JFTk8KRVJTI0dBR0EjVVNVUkVSCiMjI0VMS1MjQU5UIyMjIwpXQUlWRSMjVU5TRVRUTEUKSU5URVJORVRORVdCSUVTClNURU4jT05BSVIjQVRPUApIRU1TI0FTSEVTI1JPU1k="},{"title":"USA Today 08/13/99 \"MOVING ON\"","author":"By Charles Preston","date":"1999-08-13","grid":"RE9OVCNTVEFSRSMjREFCCk9CSUUjSE9OT1IjQ1JVRQpMT05FI0FOSVRBI0hVUlQKTEVBVklOR0xBU1ZFR0FTCiMjI0VTRSMjI0VFSyMjIwpQQU5FTCNNQUgjVEhFU0UKSUJPI0FNT1JBTCNPVkFMCkxPVkVNRU9STEVBVkVNRQpFVkVOI0dSQVZFTiNOQkMKREVMTEEjRVlFI0dFVEFUCiMjI0lMTCMjI0VMTCMjIwpMRUFWRUlUVE9CRUFWRVIKQUNIRSNTRUFOUyNQT0xPCldIRU4jTEFOQ0UjU0lMTwpOT00jI0VTU0VOI0VEQU0="},{"title":"USA Today 08/16/99 \"FOR THE BIRDS\"","author":"By Charles Preston","date":"1999-08-16","grid":"QVNTQUQjIyMjI1BBUkFTClJFQ0xVU0UjRVNUSEVURQpNRUFET1dMQVJLTEVNT04KRVNUQSNBU0NJSSNNT01TCkRBTSMjR0FURUQjI1ZJRQojV0FLRVMjIyNEQVdFUyMKIyNOQVAjTU9UT1JJU1QjCiMjI1JPQklOSE9PRCMjIwojUExBQ0FURVMjU0VUIyMKI09BVEhTIyMjU0VOT1IjCkdBQiMjS0FSQU4jI1JFVApFQ09OI0VMSVNFI0FFUk8KQ0hSSVNUT1BIRVJXUkVOCktFRU5FU1QjRVJFTE9ORwpPUkRFUiMjIyMjQVNTVFM="},{"title":"USA Today 08/17/99 \"SAY CHEESE\"","author":"By Charles Preston","date":"1999-08-17","grid":"TkFEQSNTTklERSNCVVpaCkFTSVMjUVVPSU4jRVJJRQpTSE9UR1VOV0VERElOR1MKVEVSRVNBI0FHRUUjU1NUCiMjI1JBRFMjT0FSUyMjIwpBRU9OI0NPUyNSSUFMVE8KU0RTI0NBTlRPI0RSSUVTClBJQ1RVUkVPRkhFQUxUSApJTkFJUiNTQUZFUiNBUkUKQ0FSRVNTI1RFRCNOQ0FBCiMjI1JPVEMjUk9NQSMjIwpPS1MjUk9PVCNORUdBVEUKU05BUFlPVVJGSU5HRVJTClNPU08jUFJJRVMjRVJBVApBWEVEI1NUT1JNI1JPUEU="},{"title":"USA Today 08/18/99 \"CHINA SYNDROME\"","author":"By Charles Preston","date":"1999-08-18","grid":"UkFaWiNTQU5TIyNTVU1TCklMSUUjQUJPVSNCQU5BTApTVVBFUkJPV0wjSU5GUkEKRU1TI09JTCNMSUxUSU5HCiMjI1ZBTklUWVBMQVRFUwpDT05DUkVURSNBU1MjIyMKT0RPUlMjSU1QUyMjU0lCCkxFT1MjSE9QSVMjTElSQQpBU0sjI09ORVIjREVHQVMKIyMjTVVEI1JPU0VBTk5FCkZMWUlOR1NBVUNFUiMjIwpPVkVSU0VBI0VBUiNBUlMKTElUUkUjQlVUVEVSQ1VQCktJU0VSI09BVEgjRVJJQwpTSU9OIyNUUkVFI1hFTkE="},{"title":"USA Today 08/19/99 \"SPORTS HEADLINES\"","author":"By Charles Preston","date":"1999-08-19","grid":"U0VMTCNBUVVBI0NIQUxLCkVaSU8jTlVNQiNSQU1JRQpDUkVXU1RPUFNNVVRJTlkKVEFOI1BJVFMjRVhFUlRTCiMjI0RJQ0UjT0RFUyMjIwpUQVBFUlMjVEhJUyNTTVUKT01BTkkjU0VBTiNTQ0FOCk5FVFNUUkFQUkFQVE9SUwpBQklFI09CSUUjQVJUSUUKTEFPI0NVUkQjQ1JBVEVSCiMjI0RBVEEjTEFDWSMjIwpBQ0NFREUjSkFORSNKQVIKRkxBTUVTQlVSTkxFQUZTCkFVRElUI1VSR0UjTUlSVgpSRVNUUyNEWUVEI1NMT1A="},{"title":"USA Today 08/20/99 \"LUNCH HOUR\"","author":"By Charles Preston","date":"1999-08-20","grid":"R0FSVEgjSUNCTSNTRVJBCkFNT1JFI1NIRUEjSUxFWApSVUJZRlJVSVRKVU5HTEUKUFJFU1RPI1NURVAjQUlMCiMjI1RFU0wjRVNDT1JUUwpCQVIjREVFRCNUQU0jIyMKQUxFQyNTT1VQWVNBTEVTCk5BQk9CI05FRSNUSElDSwpDUkFaWVNBTEFEI0FTSEUKIyMjRVZFI1NDT1cjVE9XClBBTk5JRVIjRVJBUyMjIwpFUEEjRU1JVCNNSUNLRVkKU0FORFdJQ0hJU0xBTkRTCk9SQ0EjTkVBVCNFTE9HRQpTVEVNI0dSSVQjREVURVI="},{"title":"USA Today 08/23/99 \"MAJOR LEAGUE SOCCER\"","author":"By Charles Preston","date":"1999-08-23","grid":"UEVBIyNBRkFSIyNJQ0VECk9QVVMjTk9QRSNTTkFLRQpUSVRPI0RSRUQjVEFORVkKI0NPTE9SQURPUkFQSURTCiMjI09SRSMjI1VSSVMjIwojQ0hJQ0FHT0ZJUkUjIyMKQVpVU0EjT1JDWlkjSU1BCkRBUlQjI0xJTCMjQU5PTgpBUlQjUExFQkUjQVNUT04KIyMjTUlBTUlGVVNJT04jCiMjQkFMTSMjI05JTiMjIwpUQU1QQUJBWU1VVElOWSMKQURPTEYjV09FUyNORUFQCkxVQ0VTI09LSUUjRUxMRQpMRVNTIyNMRU5EIyNMRVc="},{"title":"USA Today 08/24/99 \"IN TUNE\"","author":"By Charles Preston","date":"1999-08-24","grid":"TUFTVCNBR0VTI0FTQ09UCkFSRUEjU0FMVCNTSEFQRQpNT1RII1RSSU8jSElSRUQKQVdIT0xFTkVXV09STEQjCiMjI0VZUkUjI0lSSyMjIwpQRUEjSU5UUlVERSNBS0MKQUxMRU4jI0VTRSNVTE5BClNXSU5HSU5HT05BU1RBUgpTQUtFI1JFQSMjUkVFVkUKRVlFI0RJQUxFQ1QjUkVECiMjI1NJUyMjTUFJRCMjIwojTEVUVEhFUklWRVJSVU4KSk9OQUgjQkFMRSNZT1JFCkFET1JFI0FSSUEjRUxJUwpNSVNFUiNORUFUI1JFU1Q="},{"title":"USA Today 08/25/99 \"FILLS THE BILL\"","author":"By Charles Preston","date":"1999-08-25","grid":"QkVBTVMjU0NPVCNERUFOCk9SQklUI0tBWUUjSU5UTwpXSUxMWU5JTExZI1NOT0IKU0tZRSNBTVkjI0JPVUxFCiMjI1dISVBQT09SV0lMTApFU1BJQUwjU1VEQU4jIyMKU0FVREkjSE9TRVMjQkFBCkFTUEVSU0UjVFJJQ0VQUwpVU0EjQ0xJUFMjTEhBU0EKIyMjU1VFREUjUElBTk9TClNXRUVUV0lMTElBTSMjIwpIQUxBUyMjSUFOI1BBSU4KQVhJUyNST0NLQUJJTExZClZFVE8jSVJBRSNST0xMRQpFREVOI1BBTlMjT05TRVQ="},{"title":"USA Today 08/26/99 \"NICKNAMES\"","author":"By Charles Preston","date":"1999-08-26","grid":"UkVBUiNBTFNBQiNBQ05FCk9HUkUjTE9JUkUjR1JBWQpDT01NT0RPUkVTI1JJUEUKIyMjQUJBUyMjVEVFTUVECiNBR0lPIyNBRE9SRVMjIwpUUk9MTFMjRE9XTlRPV04KT0lMI0VMTEFTIyNPTkVBClJPRCNST09NRVJTI1RBTQpBU0VBIyNTQURBVCNJVkUKSEVOQ0hNRU4jUEFEREVECiMjQlJFQVNUIyNCRUVSIwpQUkVZRVIjI0xPQUYjIyMKUkVBTCNWT0xVTlRFRVJTCklOUkkjRVZFUlkjTkFJTApNSVNDI0xBVEVYI0RSQVk="},{"title":"USA Today 08/27/99 \"CLICHE\"","author":"By Charles Preston","date":"1999-08-27","grid":"RVNTRVMjSFNUI0FGTEFUClZJTklDI0FIUyNST0FDSApJTUFHTyNJUkEjQlVSTUEKTElHSFRBRklSRVVOREVSCiMjI1RFWEFOI09DVCMjIwojSVNFUkUjS0lOS0FKT1UKQVJORSNMT0lEI0xJRVVTCk1JRU5TI01OTyNFTkFURQpJTkFXRSNPR0xFI09ORVIKU0FLSEFST1YjUkFGRVIjCiMjI0VTQSNJQ0lMWSMjIwpHSVZFVEhFT05DRU9WRVIKQVZJTEEjRkxPI0dVSUxFCk5BREVSI1RFVCNBVExBUwpHTkFSUyNTVEUjUkhFVFQ="},{"title":"USA Today 08/30/99 \"FOUL BALLS\"","author":"By Charles Preston","date":"1999-08-30","grid":"T0REUyNBVklMQSNIQVNICkFSQVQjTElNSVQjWVVMRQpST1lBTEZMVVNII1BST00KRVZJVEEjRVNURSNOQUJTCkRFTklSTyMjT05UTyMjIwojIyNDQVJESU5BTFNJTlMKR0JTI1NFRU4jI0NJVklMCkFVVE8jTEVUVFMjU0FORQpHUkFGVCMjUkVBTCNOT0QKQVJURlVMRE9ER0VSIyMjCiMjI1NUSVIjI1NOQVJFUwpUQVhJI0JPT00jSVNPTEEKQUJFRCNJTkRJQU5DTFVCClJFTkUjREVFTVMjQUxURQpBTEFTI09TU0lFI0xFRVI="},{"title":"USA Today 08/31/99 \"PAIRS\"","author":"By Charles Preston","date":"1999-08-31","grid":"TU9TVCNBREFNI01BVEVTCkFWRVIjVFVCQSNBUklFUwpNRU5VI09ORVIjTklFTFMKQVJUU0FORExFVFRFUlMjCiMjI1RSRUUjI0FJTCMjIwpQQVQjVFJFTExJUyNIQVQKQUxJQkkjI0VPTiNMT1JFClNUQVJTQU5EU1RSSVBFUwpUQVJBI1JVRyMjRVZFTlQKQVJBI0JFTkVBVEgjU1RZCiMjI1NBTiMjQk9BVCMjIwojQ09QU0FORFJPQkJFUlMKTEFQSVMjT1JBTCNPVkFMCklSRU5FI1JVREUjTkFTQQpURU5FVCNBR0VEI0VTUFk="},{"title":"USA Today 09/01/99 \"ON THE FLY\"","author":"By Charles Preston","date":"1999-09-01","grid":"VE9SQ0gjUk9QRSNDTElQCk9QRVJBI0FWT04jQUlEQQpNQURBTUVCVVRURVJGTFkKQkxPQiNSSU0jUkFORUVTCiMjIyNDSUQjQkVUQSMjIwpNVVNDTEUjRU9OI0NBQlMKVU5USUUjU1RPQ0sjUkFXCkZMWU9GRlRIRUhBTkRMRQpGSU4jVFJFQUQjUkVFU0UKU1RFUCNFUk4jQ0FUTkFQCiMjI09NRU4jSU9OIyMjIwpSRUFQRUQjT05PI0FMR0EKSVRTQUxPTkdGTFlCQUxMCk5PSVIjTUVSRSNEVU5FUwpHTkFUI1NFRVIjU1RFTk8="},{"title":"USA Today 09/02/99 \"CLICHES\"","author":"By Charles Preston","date":"1999-09-02","grid":"TU9UT1IjSEFMRSNJVEVNCkVMT1BFI0VCQU4jTk9MTwpNQVJBVCNMQUlEI1RXSU4KT05USEVGRU5DRSNIRUFUCiMjIyNMRU5EI0FWRVJTRQpET0NJTEUjT0FSRUQjIyMKQVNJTiNMQU5BI1RVQkJZCk5FQVRFU1QjUk9PTUVSUwpBTE9IQSNPUkVTI1BMSUUKIyMjRVRZTUEjU0lTVEVSCkNPVVJTRSNUUklPIyMjIwpPUkVPI09OVEhFV0FHT04KTFVMVSNNSUxFI0FCSURFCk9SRUcjQUxFQSNORVZFUgpST1NII05FU1MjU1RFQUQ="},{"title":"USA Today 09/03/99 \"GET TO WORK\"","author":"By Duane Dunlap","date":"1999-09-03","grid":"UEFSVCNBU1RFUiNPVFRPCkFMSUEjTEFSUlkjUFJJRwpQSUNLRVRMSU5FI1RBTEwKQVRIRU5FVU0jQlJJRExFCiMjI0hVUlQjQlJJQ0UjIwpNQUpPUlMjVFJFQVNVUkUKQU5JTUUjVFJJQUwjTklBCkxJTUUjR1JJTkQjU0lBTQpUT00jQkxBS0UjU1RPTkUKQU5ZUExBQ0UjQ0hBTlRTCiMjSE9VU0UjQ0hJTiMjIwpCTE9LRVMjVEFJTEdBVEUKTElGRSNKT0hOTExFV0lTCklGRlkjQVJJRUwjVEVFUwpQVEFTI1dFTkRZI1pFUk8="},{"title":"USA Today 09/07/99 \"STATEHOOD\"","author":"By Charles Preston","date":"1999-09-07","grid":"VkVSVkUjQUdFUyNDQUdFCkVNQUlMI0xFVkkjQVZPVwpTTUlSSyNDT0FTVExJTkUKVEFORyNCQVJOI0VJREVSCiMjI0lTSU5HI0VMRiMjIwpTVEFOQ0UjSVNNI09XTlMKV0lMSUVSI0FMVU1ST09UCk9SR0FOI0JPWSNBTk9MRQpSRUFDVElPTiNTVElGTEUKRURFUiNMQU0jQ0VBU0VECiMjI0VFSyNZT1VSUyMjIwpTT0xFUyNBTUlEI1VGT1MKV0hJUFBFUklOI0JJTEdFCkFJREUjUklOSyNBVE9MTApCT09SI0FERFMjTkVXRUw="},{"title":"USA Today 09/08/99 \"POSITIONING\"","author":"By Charles Preston","date":"1999-09-08","grid":"SVNBSyNMTEFNQSNDUkFXCkxPUkkjQVVHRVIjSEFWRQpMSUVET1dOT05USEVKT0IKU0xBU0gjQVJTI0VWQU5TCiMjI1RJQVJBI1BMWSMjIwpQRVFVT0QjI0lSRSNCRUcKT0xBRiNERUFDT04jRUVMClNJVEZPUlRIRUNBTUVSQQpFVEEjUkVDQVNUI0FDSUQKU0VSI0FTSCMjT1VDSEVTCiMjI1NUUyNMQVJDSCMjIwpURVBFRSNTRVQjTEVER0UKU1RBTkRJTkdPVkFUSU9OCkFOVFMjRFVBTkUjRVJHTwpSQVNFI0FHTEVUI1NUT1c="},{"title":"USA Today 09/09/99 \"MAKE MY DAY\"","author":"By Charles Preston","date":"1999-09-09","grid":"S1VMQUsjU0FQUyNUUkFNCklOQU5FI0NJQU8jSE9ORQpESVJUWUhBUlJZI0VBVFMKU1RBI05BVkVMI0FHTkVTCiMjI0JPTkUjRU1CQVNTWQpTUEFSVEFOUyNBQlUjIyMKQ0FOT0UjR1VBUkFOVE9SClVMQU4jVkVSU0UjVEhBSQpESVNDTE9TRVMjR0xFU1MKIyMjT1VUI1JFQ1JFQVRFCkhPQkJJRVMjU0hVVCMjIwpBTkFJUyNFQVNFRCNFUEEKRElMTCNVTkZPUkdJVkVOCkpPRUwjU09BUiNFTUVORApJTkRZI0VSUlMjU1BSQVk="},{"title":"USA Today 09/10/99 \"ON THE MOVE\"","author":"By Charles Preston","date":"1999-09-10","grid":"TUVUIyNTRVRTI0NPUk9UCkFYT04jQ1JFVyNBUkVOQQpTUEFUI0FSRUEjTk9CRUwKSElUSEVSQU5EWU9OIyMjCkVSRSNTRU4jREVQT1NJVApSRUVGUyNURUxMWSNVUkUKIyMjTEVFI1JFTCNDTEFOCkFST1VOREFOREFST1VORApTT1JFI0VMUyNUVU4jIyMKQVRFI0VOQVRFI05FUEFMClBPTEFSSVMjTEVPI0FTQQojIyNCQUNLQU5ERk9SVEgKUEFSSVMjQUJJRyNBQ1JPCkVYVURFI05FTkUjUkVBUgpQRVRFUiNTUk9TIyNMWUU="},{"title":"USA Today 09/13/99 \"BODY LANGUAGE\"","author":"By Charles Preston","date":"1999-09-13","grid":"TUFMTFMjQkVTUyNTRVJCCkFERUVSI0FMT1UjUExFQQpKQVdTT0ZMSUZFI0lNQVMKT1JFTyNFQVNUI0dST1BFClJFU1RFUiMjIyNBSVIjIwojIyNIQU5EU09GU1RPTkUKQkVTT1QjV09SRSNTUEVXCkFSQyNTRUFCSVJEI0VWRQpTSVJFI0JSSUUjT0FSRVIKSEVBUlRPRkdMQVNTIyMjCiMjUEVBIyMjI1JFUEVBVApTQ0hNTyNQSElMI0VORE8KRVJFSSNGRUVUT0ZDTEFZCk5FQVQjSEFSRSNBVEFMRQpET1BFI0FUT00jT1NJRVI="},{"title":"USA Today 09/14/99 \"COINED PHRASES\"","author":"By Charles Preston","date":"1999-09-14","grid":"WUFXTCNTSE9PI0JFTkNICkFMQUkjSEFSUCNFWElMRQpQRU5OWUFOVEUjUkVDVVIKIyMjR0lMRCNDSEVDS0VEClNFUVVFTCMjI0VUUkUjIwpVU1VBTCNTQVJBI0FMQlMKTVRBI0RJTk5FUiNUT1JFCk1BUkMjTUFORVMjRURFTgpPVFRPI1BSRVNUTyNFRVMKTkVFRCNFTFNFI0ZST1pFCiMjUkVDRCMjI1NUT05FUwpQRUJCTEVEI1NQRUMjIyMKSVRBTE8jRElNRU5PVkVMClVOQ1VUI0FSRUEjQ09WRQpTQUtFUyNZU0VSI09YRU4="},{"title":"USA Today 09/15/99 \"KINGDOMS\"","author":"By Charles Preston","date":"1999-09-15","grid":"QVNTQUkjQkFNUyNCTEVEClNURVJOI0VYSVQjTFVYRQpIWVBFRCNMSVNBI09SQ0EKIyNBTklNQUxDUkFDS0VSCkdBUkFHRSMjVVJOI0VFTApFVkEjT1JBVEUjVE9ERFkKUklUQSNJREEjQ0VOIyMjCiNWRUdFVEFCTEVEWUVTIwojIyNFVFMjQkFMI1hNQVMKRlJFU0gjQ1lDTEUjRUxJCkVBUiNFR08jI0FMRVJUUwpNSU5FUkFMU1BSSU5HIyMKQURFUyNCTFVSI1NUSU5HCkxFU1QjTEFNRSNIRU5DRQpFUlRFI0VST1MjQVJHT1Q="},{"title":"USA Today 09/16/99 \"CHOICES\"","author":"By Charles Preston","date":"1999-09-16","grid":"UkVBRCNTRVJWRSNHUklOCkFSTk8jRVJCSUwjUklWRQpKT1lPUkdSSUVGI09TQVIKI1NBUkVFIyNESVNURU5ECiMjI0RFUkJZI05BVE8jIwpERU5JUyNSRUMjTE9SQ0EKRVZPRSNUSVNBTkUjRkFUCkJPVyNGRURPUkFTI0FMTApUS08jUkVHUkVUI09MTEEKU0VSR0UjRU5FI0hVTEFTCiMjTk9FTCNPTlNFVCMjIwpBR0VOREFTIyNDUk9TUyMKTkFWRSNQRUFDRU9SV0FSCkVZRVIjU0FMT04jSUFHTwpUQVJTI0VMSU9UI05ZRVQ="},{"title":"USA Today 09/17/99 \"SEEING DAGGERS\"","author":"By Charles Preston","date":"1999-09-17","grid":"Q0FMTSNTVE9TUyNUSUVSCk9MRU8jTk9SVEUjSURMRQpEQUdXT09EQlVNU1RFQUQKRVNTI05PRFMjSVNMQU5ECiMjI05FVFMjQU5URSMjIwpEVUJPSVMjQ1BBUyNBUEUKT1JFQUQjQUxBUiNFQk9OCkRBR0hBTU1BUlNLSk9MRApPTlVTI09CSVQjRUVSSUUKU09OI1NURU0jU0VDVE9SCiMjI0JPSFIjQ0FQVCMjIwpPUklPTEUjVFVUVSNBU1AKREFHVUVSUk9UWVBJU1RTCklST04jRUFHRVIjQklBUwpORVJEI0RFQVJTI01BUlQ="},{"title":"USA Today 09/20/99 \"DT's\"","author":"By Charles Preston","date":"1999-09-20","grid":"U0FNRSNBTU9TI1NBREFUCk9MSU4jTEFTVCNQUlVERQpMT1JEI0lTTEUjQUNUT04KREVWSUxTVE9XRVIjQ1JPCiMjI1ZBVCMjU0xJVEhFUgpGRURFUkFURSNTTklUIyMKSVRPI0RJQUxTI0dFUk1TClNUVUIjUklERVIjUkVBUApUVUJFUyNMRVZFTCNBTEEKIyNMRVRUI1JFR0lTVEVSCkNBRVNVUkEjI0FBQSMjIwpBTlQjRElSVFlUUklDS1MKU1RJTEUjR09BVCNMT05FClRJTU9OI1VMTkEjT1JFTApTQ0VOVCNFTEtTI1JFRUw="},{"title":"USA Today 09/21/99 \"EGO TRIP\"","author":"By Charles Preston","date":"1999-09-21","grid":"QkFTSCNTT0ZBUiNQSElaCkFDVEkjUFJVTkUjUk9URQpUSEVHTEFERVlFI0lNQU4KI0VUSEFOT0wjTEFWRVMjCiMjIyNTRFMjTUVTQSMjIwpTQ0FUVFkjQkFEU1RBUlQKT0FUSFMjTUlOSSNFREVSClRSRUUjUEFURU4jRURHRQpUT1NII1JVVFMjRFlMQU4KT0JUVVNFTFkjR1JFRU5TCiMjI05FU1MjRFVPIyMjIwojQUdHUk8jRklMTFNVUCMKQUxBUiNBR0lSTExJS0VJClRJTlkjS0VER0UjRkVSTgpNQUdJI1NURUVEI1RTUFM="},{"title":"USA Today 09/22/99 \"AROUND THE WORLD\"","author":"By Charles Preston","date":"1999-09-22","grid":"QVBBUiNTTk9CI1JPQ0tTCkNMVUUjRUlSRSNPU0hFQQpSVVNTSUFORFJFU1NJTkcKRVNURUxMRSNFVkEjTk9TCiMjUk5TIyNGQUVSSUUjIwpXSEFUI1NQQSNSSU5TRVMKRUVMUyNNQVNUI0FORU5UCkVMSSNDVVNISU9OI0xBWQpQTEFUTyNUSUVEI1RBVEUKU09OQU5UI09SRSNPTkVTCiMjQ09DT09OIyNBTlQjIwpFRVIjRUdPI0JVUk5FUlMKU1BBTklTSE1BQ0tFUkVMClBFV0lUI0VBUkwjQU5USQpZRUxQUyNET05BI1VTRUQ="},{"title":"USA Today 09/23/99 \"ON THE JOB\"","author":"By Charles Preston","date":"1999-09-23","grid":"U0hFUyNBQkJBI0VOREVSClRFTVAjUFJPTSNTRUFUTwpPTElPI1BJTkUjVFdJTlMKUE9MSUNFTUFOI0VTU0FZClNURUxMQSMjRFJFVyMjIwojIyMjT1JBTCNFTU9URVIKREFERFkjTUVTQSNNT1ZFCkVSSUUjVElHRVIjQVJFUwpMSVNUI0VESVQjU05PUlQKQURIRVJFI1RIRUUjIyMjCiMjI0NPTU8jI1NNQVJUUwpCT09UUyNQSFlTSUNJQU4KT1JCSVQjUk9TRSNUQVJPCk5BSVZFI0FNRU4jT1RUTwpFTlRFUiNIRVJFI1JBU1A="},{"title":"USA Today 09/24/99 \"T.G.I.F.\"","author":"By Charles Preston","date":"1999-09-24","grid":"QVRPUCNSQVcjI0FSSUFTCk1PUEUjRVJPUyNaSUxDSApBR0VFI0ZBTUUjQUxMRVkKSkFDS1dFQkJST0xFIyMjCiMjI0VBUiNTQUJFI0FMVApTUEFSS0VEIyNKQUdVQVIKVE9NI0VFUklFIyNBUlRZClJPQklOU09OQ1JVU09FUwpFUkxFIyNQQVJFUiNSU1QKU0VFUkVEIyNVUEJFQVRTClNSUyNWT1dTI0xBRCMjIwojIyNSSUdIVEhBTkRNQU4KTUVESUMjRVJJQyNJT05BCkVWRU5UI1lBTEUjRVZFUgpMRUVLUyMjUE9EI0RFV1k="},{"title":"USA Today 09/27/99 \"SNOOPS\"","author":"By Charles Preston","date":"1999-09-27","grid":"QUJDUyNSQVNQI0NPUEVTCk5FTEwjRVNURSNBTk9ERQpUUkVZI0RJQUwjRElPREUKSVJBI0NIQVJMSUVDSEFOCkNBUlRPT04jI1NURVAjIwojIyNFQVQjTE9TUyNPREUKQVBBUlQjTUVOVSNTT1VSCkpFU1NJQ0FGTEVUQ0hFUgpBUlRFI0FSVFkjUkVTVFMKUlVSI0NSQVkjU1lOIyMjCiMjT1NBUiMjUEhPRU5JWApFTExFUllRVUVFTiNPUlIKTEVPTkUjVVJTQSNBU0VBCkFOR1NUI0lHT1IjVElOWQpOT1lFUyNURVNTI0FSRVM="},{"title":"USA Today 09/28/99 \"ANIMAL ANTICS\"","author":"By Charles Preston","date":"1999-09-28","grid":"RVBBI0NMQVcjRE9OQVRFCk5FVCNPT0xBI0VNT1RFRApDT1dTTElQUyNSRVRBUkQKT1JJU09OIyNOSU5BIyMjClJJU0VSI1dPT0RTVE9DSwpFQVQjQVBBQ0hFI09QSUUKIyMjI0RJTlQjI0JSQURZCiMjU1RBTkRPRkZJU0gjIwpCQUNPTiMjQkFJTCMjIyMKUk9VVCNTSUVOTkEjVEVDCk9MRFRJTUVSUyNURUFSQQojIyNFVkVSIyNMRU5OT04KQ09SUkFMI0JFQVJTS0lOCk9SSUVOVCNPUkNBI0VDTwpQQU5EQVMjT1JFTCNSQVQ="},{"title":"USA Today 09/29/99 \"NO-TION?\"","author":"By Charles Preston","date":"1999-09-29","grid":"QUNSRSNTVEVSRSNTTEFXCkxBSUMjQVJMRVMjVkVSQQpBTk9VTkNFT0ZQUkVWRU4KU0FUI0lSQU4jI0lMSUFECiMjI1NMRUQjUkFQVCMjIwpKT1NIRUQjU1VQUkVNRVMKQVJJQSMjQVBORUEjQU5UCkNPTkRJRURSRVNQT05TRQpPTkUjTUlEQVMjI1JPVUUKQk9XU1BSSVQjU1BBUkVECiMjI0hVRVMjTUFVTCMjIwpPTlNFVCMjQ09OUyNTQU0KUkVDUkVBQUxWRUhJQ0xFCkNMQVAjQkxVRVMjUkFJTApBTE1BI0FMRVJUI0VSQVQ="},{"title":"USA Today 10/01/99 \"NOTABLE LOCATIONS\"","author":"By Charles Preston","date":"1999-10-01","grid":"Q0FMTSNPQklTI1NBVkVTCk9CT0UjSElOVCNVTklURQpNRVJDI0FMRkEjR0VUQVQKRUxJSFVST09UQ0FOQUwjCiMjI0FQRVgjI0FSVCMjIwpDSEFOUyNJVk9SWSNFREgKQUVSSUVTI0lXTyNBUklBCktJUlNUSUVBTExFWVdBWQpFREFNI1RBTiNFTEFJTkUKRElTI1NUVURTI0VUTkFTCiMjI0FDRSMjVEFDTyMjIwojSE9XQVJERkFTVExBTkUKRElWQU4jSU9OUyNMSUVTCkFMRVJUI0dBWkEjQURBTQpIT05FWSNTTEFZI0hBVEU="},{"title":"USA Today 10/04/99 \"SMALL CHANGE\"","author":"By Charles Preston","date":"1999-10-04","grid":"VEFMQyNTV09PUCNET01FCkFST08jSEFMVkUjT1ZFUgpCT1JOI0VMTEVOI01VVEUKI05JQ0tFTEFORERJTUUjCiMjI1JBUkUjI1NPTiMjIwpSSVZFVCNUSVAjVE9TQ0EKQUNFVElDI05VTiMjSFVNClRIUkVFUEVOTllPUEVSQQpFT04jI0FHRSNDQVJFU1MKRFJFU1MjT1JSI1NJVEVTCiMjI0hJUyMjRUxJUyMjIwojUVVBUlRFUk1BU1RFUiMKRlVOSyNBRElPUyNJVkVTClJJVEUjR0VTVEUjTklERQpPRE9SI1NORUVSI0VMU0U="},{"title":"USA Today 10/05/99 \"LUNAR TRICKS\"","author":"By Charles Preston","date":"1999-10-05","grid":"QkVETEFNI0tJVCNHUk9HCkFSSU9TTyNBQ0UjUkVCQQpSQU5DSE8jVEVOI0lWRVMKIyMjSE9ORVlNT09ORVJTCklEQSNUUklERU5UI1JPRQpNSUxLI0FHSU4jVFJFTlQKVU5NQVNLRUQjTUFJIyMjClNUQVJURVIjQ09XQVJEUwojIyNFUlIjQ1JPQVRJQU4KUElBTk8jRkFVTiNBTk5PCk9SVCNMT0lURVJTI0tFVwpNT09OTElHSFRJTkcjIyMKQU5OQSNMQU8jVklPTEVUCkRFRVIjRVJEI0VEV0lOQQpFRERZI0RPRSNSRU5ERVI="},{"title":"USA Today 10/07/99 \"PATRIOTIC PURSUIT\"","author":"By Charles Preston","date":"1999-10-07","grid":"UkFURSNTUE9UUyNIQVNQCkFMRVgjT0xESUUjSU5UTwpORVNUI05BT01JI0ZPQUwKREVUUk9JVFJFRFdJTkdTCiMjI0FSTiMjUkVPIyMjIwpBSFMjQUxBUyNMT0NBVEUKUkFNUyNBU1BTI0RPTEVTCkdSRUFUV0hJVEVTSEFSSwpPU0FHRSNFUklOI09JU0UKU0hSQU5LI0VSR1MjTkVSCiMjIyNPTlQjI0lPTiMjIwpCTFVFUklCQk9OUEFORUwKWU9HQSNGT1JHRSNCQURFCkVMTFMjRU5VUkUjT01FTgpTTElUI0RFVEVSI0JFTkQ="},{"title":"USA Today 10/08/99 \"KNOCK KNOCK\"","author":"By Charles Preston","date":"1999-10-08","grid":"QURBTSNTVFJBTSNTQ09XClJBVEEjQUhPUkEjQUxWQQpLTk9DS1JVTU1ZI1RPQUQKI0FQSElEUyMjT1JBQ0xFCiMjI09CSSMjVFJVTksjIwpCQUJTT04jUEFTVElNRVMKSUxMI1NJU0lTIyNDQUxJCk9UTyNIQVVOVEVEI0tJUgpURUNIIyNTRUVNRSNFVEUKQVJLQU5TQVMjQklHUkVECiMjUFJFRU4jI0FHUiMjIwpFQ0FSVEUjI0FSTkVTUyMKVE9SSSNTVE9DS1NUSUxMCkFMVEUjQVdBUkUjRUxJRQpMQVlTI1dJUkVEI0xPUEU="},{"title":"USA Today 10/11/99 \"SOMETHING FISHY\"","author":"By Charles Preston","date":"1999-10-11","grid":"QkVFUCNCVUxCQSNEQUJTClVSR0UjT05FQUwjSU5SRQpSSUdBI0FEQU5PI1NUSVIKU0NBTEVTT0ZKVVNUSUNFClRIUkVXIyMjT0RFUiMjIwojIyNESVBTIyMjQ0lSQ0EKSUxLI05FQVRFUiNDQUxMClRBSUxHQVRFUEFSVElFUwpFTExFI1JFVElSRSNMT08KTU9OR08jIyNDQUxJIyMjCiMjI0dBU1AjIyNJTlRIRQpGSU5JU0hJTkdTQ0hPT0wKQU1JTiNBTklMRSNBR1JBCkxBTkcjUkVQRUwjTEFTVApBTUVTI0VEU0VMI0VTVEU="},{"title":"USA Today 10/12/99 \"SOUND FAMILIAR?\"","author":"By Charles Preston","date":"1999-10-12","grid":"UEVQUyNSQVNII0FSRyMjCklUQUwjRVNURSNDQVJCIwpUSFJPVUdIRUFDSFlFQVIKIyNBQkxFI1BSTyNTRVJBCkxJRCNOTlcjTk9NI0tJUApJREVCQVRFUE9MSVRJQ1MKU0VSRSNTRUUjU0xPIyMjClRBU1RFI0RBQiNTS0VFVAojIyNFUlMjUk9FI0FMVE8KQlVUTElLRUxBU1RZRUFSCkFURSNOSUwjU1RZI0FMRQpMSVNBI0VFUiNBUk9OIyMKSUxMRk9SR0VUVE9WT1RFCiNFQVJQI0lERUUjRVJBUwojI1NPUyNUT05TI1JTVlA="},{"title":"USA Today 10/13/99 \"WHO'S ARRY?\"","author":"By Charles Preston","date":"1999-10-13","grid":"QURBQiNBTElNUCNSQVRBCkRJVkEjVE9SQUgjRVhBTQpPVkVSI09NQU5JI0RFV1kKQkFSUllNQU5JTE9XIyMjCkVOVElBI05JQSNOSVRJRAojIyNFTE0jIyNURU5BQ0UKQkZTI0xBUlJZSEFHTUFOCkFSQUIjQ0VBU0UjU0VNSQpIQVJSWUhBTUxJTiNSRU0KQVVESU9TIyMjUk9XIyMjCklTSU5HI0FUQSNOSVRSTwojIyNHQVJSWVRSVURFQVUKSkFNUyNBTExJRSNFWElUCkFCT1UjU0VFTUUjTEFTRQpXRUVQI0FTUkVEI1lTRVI="},{"title":"USA Today 10/14/99 \"IT'S YOUR NICKEL\"","author":"By Charles Preston","date":"1999-10-14","grid":"TUFJTVMjVEFNQSNSQUZUCkVORFVFI0FWT04jQUxBVwpBREVMRSNCRVJOI05PUkEKRElBTE1GT1JNVVJERVIjCiMjI0VTQVUjT0xFTyMjIwpNQVJUI0dSSU4jQ0xBTVAKQUxFI01JRU4jI0FQUEFMClRJTkNBTlRFTEVQSE9ORQpUQVRBUiMjUk9OUyNSSUEKRVJFQ1QjU1RBUiNTVEFUCiMjI0tFTk8jRE9TRSMjIwojQ0FMTElOR0FMTENBUlMKTElMSSNHQVJCI0FSTklFCkFOT04jRVRBTCNCRVRURQpZRUdHI1JBWUUjU1RJRVM="},{"title":"USA Today 10/15/99 \"PREPOSITIONALLY SPEAKING\"","author":"By Charles Preston","date":"1999-10-15","grid":"QUxMIyNTVEFHIyNST0JCCkRPT00jQUlSRUQjRUxJQQpPVVRPRkNPTU1JU1NJT04KI0RJTkFSIyMjT1RJT1NFCiMjI0lDRVIjQUNBRCMjIwojQkVTSURFT05FU0VMRiMKUExBVEUjVFJBU0gjT0xFClJVR1MjU0FCUkUjU0NBUgpPUlIjQk9SSUMjU1BBUkUKI0JFWU9ORFRIRVBBTEUjCiMjI0FXTFMjWUFSRCMjIwpZQU5LRUUjIyNTSUVHRSMKQUdBSU5TVFRIRUdSQUlOCldISU0jU0VPVUwjU1VSRQpTQUxBIyNBUkVTIyNMRUQ="},{"title":"USA Today 10/18/99 \"YOU SAY POTATO\"","author":"By Charles Preston","date":"1999-10-18","grid":"U0VDI01BTElDRSNURU1QCk9BUiNBTVVTRVMjT0RFUgpQVEEjVklDSFlTU09JU0UKSEFTSEVEIyNMRVQjVFNFCklCU0VOI1pPTyNBU0lBTgpTTEVXI1BJUk4jVElOR0UKTUVSI1NPTkcjU0lOR0VECiMjI0NPTENBTk5PTiMjIwpTQUxPTUUjTk9VTiNNUFMKT1BFUkEjQklORyNGSVJFClVQU0VUI0lDRSNPTERJRQpGQVMjSVNBIyNCUk9XTlMKRlJFTkNIRlJJRVMjRVRBCkxFRVIjQVJFT0xBI1NFVwpFTFNBI0RBSU5UWSNURFM="},{"title":"USA Today 10/19/99 \"RISKY RESTAURANT SIGN\"","author":"By Charles Preston","date":"1999-10-19","grid":"UkFNUCNFTEJBIyNUV0FZCkFTRUEjUEFBUiNQUk9ORQpJQ0FOI0FQU0UjTEVPTkEKRE9OVEpVU1RTVEFORCMjClNUWSNPTEUjI0FORFJFQQojIyNCRUUjUE9SVCNJTEwKUklWRSNUSEVSRUFOREJFCkVORVJPI0lLRSNSSUdPUgpIVU5HUllDT01FI05FV1QKQVJUI0xBS0UjTU9FIyMjCkJFUkdFUiMjVElBI0VSUwojI0lOQU5ER0VURkVEVVAKSU5DQU4jUkFOVCNSVU5FCkNFTFRTI0FMT0UjSUNPTgpFVEVTIyNURU5EI0NFTlQ="},{"title":"USA Today 10/20/99 \"PUN TIME\"","author":"By Charles Preston","date":"1999-10-20","grid":"U0VBUyNERVBUI1RTQURFCkFSTVMjRUxJQSNSVVNFUwpXQUlTVExBTkQjQUNIRVMKRVNTI1JBVCNTSU5DRVJFCkRFU1RJTkVEI05DTyMjIwojIyNJVE8jSU5URVJOQUwKQUdMRUUjQ1JFRSNQT0xPCkJSRVIjU0hFQVIjVVNNQQpSRU9TI1RBQ1QjU05FQUQKSUdOT1JBTlQjU0FDIyMjCiMjI0ZBVCNTTUlUSEVSUwpNQVJSSUVTI0lSRSNNQUkKQVJFQVMjUFVSUlNVSVRTClNUQUdFI0FTRUEjUExFQQpDRURFRCNNRVNII1NFTEw="},{"title":"USA Today 10/21/99 \"ASPIRANT NAMES\"","author":"By Charles Preston","date":"1999-10-21","grid":"TkFSRCNDVVJCI0JSQVQjCk9CT0UjQVBBTCNBVVJBIwpIVU1CRVJUSFVNQkVSVCMKI1RBVFRFUiNSQVkjT1RBCiMjIyNDTEVBUlMjQVdPTApBUkMjSEVOUllIVURTT04KQlVPWSNTRFMjI1JFTSMjCkFHTEVUUyMjI0VOTElTVAojI09BUiMjUkVQI0VUVUkKSEFSUllIQU1MSU4jSEVOCk9OQU4jRU5DT0RFIyMjIwpPQ1QjTUFJI0NFQVNFRCMKI0hVQkVSVEhVTVBIUkVZCiNPUkFMI1JPVEkjT0dMRQojUkFOVCNBTEVDI1BPRVQ="},{"title":"USA Today 10/22/99 \"ON THE TOWN\"","author":"By Charles Preston","date":"1999-10-22","grid":"QUxGQSNQUk9EI1NIUkVXCkRJTEwjUkVETyNRVU9UQQpBU0FQI0FORVcjVU5JVFkKTUFOSEFUVEFOI0FUTEFTCiMjI0FNRVMjVElSRSMjIwpHQUJCRUQjR09WRVJOT1IKQUxMRU4jI0FXRVMjT05PCkZMQVQjU1BJTlMjQkxJUApGRVojREVSTiMjQlJBQ0UKRVlFSE9MRVMjU09PTkVSCiMjI0lETEUjU0hPTyMjIwpDTElORyNOT1BBUktJTkcKSEFTVEUjRU1JUiNMVklJCkFETEVSI1JJQ08jWUVMTApERUVEUyNTVEVOI05ZRVQ="},{"title":"USA Today 10/25/99 \"TOM CRUISE REJECTS\"","author":"By Charles Preston","date":"1999-10-25","grid":"TUVSViNLQUxCI1BBU1RBCkFMRUUjQUdFRSNPSUxFRApJQkVYI05BTkEjT1JBVEUKI0FGRVdHUk9VQ0hZTUVOCiMjI1NFQSMjVEFCIyMjIwpSQUQjVFJBUCNNQU5USVMKQUxJVCNPTlVTI0hBVU5UCk1JU1NJT05QT1NTSUJMRQpQRUNBTiNBSURFI0xFQVIKU05PUlRTI0xBUkQjUllFCiMjIyNSVUUjI0JPWiMjIwpSSVNRVUVCVVNJTkVTUyMKQUxPVUQjU1JUQSNCRUVGCkJFTElFI0VHQU4jUkVFTApFWElUUyNORVRTI0FORFk="},{"title":"USA Today 10/26/99 \"HANDSOME\"","author":"By Charles Preston","date":"1999-10-26","grid":"TkFQRSNHTE9TUyNDT1BZCkVMQU4jQVVESVQjT0xFTwpXSUxEI1JBSU5ZI0JMRVcKVEFNI0tOVUNLTEVCQUxMCiMjU0lORVMjI0lMTCMjIwpQT1VURVIjQ0FTU0VUVEUKRVJOSUUjTUFUVEUjSEVNCk5PRFMjV0FOVFMjRFVQRQpBTkEjU0FTU1kjSEVNRU4KTE9ZQUxJU1QjU1VCQkVECiMjI1JPVCMjVEFSU0kjIwpGSU5HRVJQQUlOVCNOSUIKQURBWSNFTElERSNFRERBClRPSUwjU09EQVMjS0VFTApFTExFI1NQRUxUI0VYQU0="},{"title":"USA Today 10/27/99 \"TWO TIMER\"","author":"By Charles Preston","date":"1999-10-27","grid":"QVJET1IjUFNBTE0jUFJPCkdVSUxFI0FQTkVBI09BUgpFTFNJRSNUT05FUiNUSUUKU0VDT05EU1RPUllNQU4jCiMjIyNGUlkjIyNTRVQjIwpCVVNCT1kjV09PI0xPU1QKVVNIRVIjU0FVREkjQ1BBCkRVQUxDSVRJWkVOU0hJUApHQUwjRVJBVE8jU1VJVEUKRUxMQSNFUkUjQlVNUEVSCiMjT0xFIyMjQ0FMIyMjIwojVFdJQ0VUT0xEVEFMRVMKTEVJI0xMQU1BI0VMVURFCklBTiNBU0tFVyNSQU5HRQpFUkcjVEVFTlMjU05FRVI="},{"title":"USA Today 10/28/99 \"UNDER CONSTRUCTION\"","author":"By Charles Preston","date":"1999-10-28","grid":"QlJPS0UjQkFHUyNBUkxPClJBTUlTI0VMQUwjREVBTgpBVkVSVCNOT0xPI01JQ0UKV0FMS0VEVEhFUExBTksjCkxHRSMjQVNBI1BBTkRFUgpTRVRTQVQjI1NZTSNFWUUKIyMjUExFQVNFIyNGRVNTCiMjQk9BUkRNRU1CRVIjIwpBQlVUIyNEQU5JRUwjIyMKTE9UI0FSUyMjTEVUVVBTClBPVFBJRSNZQUsjI05FVAojQkVBTU1FVVBTQ09UVFkKUE9SVCNBUk1TI0FCT0lMClJPVVQjUklNRSNOT0xURQpFU1BZI0tFWVMjU0VERVI="},{"title":"USA Today 10/29/99 \"ENJOYING HALLOWEEN\"","author":"By Charles Preston","date":"1999-10-29","grid":"U0hFTEYjQVJDUyNSQU1QClBFVEVSI0ZFQVQjRUxJTwpFUkFTRSNSQVZFI1RJTEUKQ09TVFVNRVBBUlRJRVMjCiMjIyNET1MjTEVBUk4jIwpBQ1RTI1RIQUkjUkVBREUKRk9SRVNUI1NFQ1QjVEFEClRSSUNLT1JUUkVBVElORwpFTkEjWVNFUiNTTk9PWkUKUlVOSUMjU09SRSNHTkFSCiMjR05BU0gjRU5PIyMjIwojUFVNUEtJTkNBUlZJTkcKSEFMTyNBTk9BI0JBVE9SCkFMQVMjVEVEUyNJUkVOQQpUT1JUI0VESVQjVEFSRVM="},{"title":"USA Today 11/01/99 \"SOBRIQUETS\"","author":"By Charles Preston","date":"1999-11-01","grid":"QkFMTCNUSVJFI0FUTEFTCk9SQUwjQUNJRCNQUk9NTwpNRU1PI01FVEUjUFVHRVQKQkFCWUZBQ0VORUxTT04jCiMjI0RFTEEjI1BFVCMjIwpNQ0kjUkVQUkVTUyNBQ0MKQVJET1IjI0VMTyNPTExBCkpFTExZUk9MTE1PUlRPTgpPUEVEI09OQSMjRkVBU1QKUkVEI0FCRVlBTlQjUkVPCiMjI0FETyMjR09FUyMjIwojTklHSFRUUkFJTkxBTkUKTElTTEUjUkFUUyNJUk9OCklOTkVSI0FDSEUjQ0FSRApCRVRURSNQRUFTI0VMTVM="},{"title":"USA Today 11/02/99 \"HOW TO LOSE ELECTIONS\"","author":"By Charles Preston","date":"1999-11-02","grid":"TUlNSUMjTFNUUyNDQVJMCkFOSVRBI0VUQUgjT0dFRQpJR05PUkVBTExJU1NVRVMKTEVUI0FSTk8jVklUQUxTCiMjI1NDQVQjI0VUTyMjIwpLRUVQQUxPV1BST0ZJTEUKRUxWRVMjI0FURU4jTkVZClJJSVMjSU5HT0QjUkFNSQpST1QjSU5FRSMjU0FSQU4KU1RBTkRGT1JOT1RISU5HCiMjI0FMRSMjQUJFUyMjIwpDUkVQRVMjU0NPVCNDQUIKWUlFTERUT1BSRVNTVVJFCkFUTEUjRVJJRSNPVVNFTApORVNTI0RFTlMjTkVQQUw="},{"title":"USA Today 11/03/99 \"POTPOURRI\"","author":"By Charles Preston","date":"1999-11-03","grid":"UEFNUEEjRkxPVElMTEFTCk9DRUFOI1JFUFVESUFURQpTVEFJRCNBSVNMRVNFQVQKVElOTklUVVMjU1NUIyMjCiMjU0VFUiNVUEFUI1dQQQpBTVQjI0FDUkUjI01FQUwKU0VSVklDRUVOVFJBTkNFCkNSRUFURVNBTU9OU1RFUgpFTEVDVFJJQ0FMU0hPUlQKTk9UQSMjVVRORSMjVVNTCkRUUyNNTU1JI0RBRlQjIwojIyNaT08jVklPTElTVFMKQU5BRVJPQklDI0FGSVJFClNVUlJPR0FURSNNRURJQQpTSU1PTlNBWVMjT0RFT04="},{"title":"USA Today 11/04/99 \"EXCLAMATIONS!\"","author":"By Charles Preston","date":"1999-11-04","grid":"U0VFRCNST0xMI09NRU5TCkhVTUUjRVJJRSNOT0NBTApPUkJTI1NJTVMjVE5PVEUKR09PI1NUT1BUSEFUTk9XClVQU0lMT04jI09SRSMjIwpOQVNDQVIjTUFMSSNVTk8KIyMjSVZFR09UWU9VTk9XCkVUVEUjI09VSSMjUkVJTgpIT1dSRVZPTFRJTkcjIyMKU05PI0xJRlQjVE9FRElOCiMjI1RFTiMjUkVUUkFDRQpIRVlPVkVSSEVSRSNSSVAKT1BFUkEjQ09QQSNJTkNICkxFVElUI0FQRVQjRklMRQpERUlDRSNGSU5FI1NURVc="},{"title":"USA Today 11/05/99 \"FIXIT\"","author":"By Charles Preston","date":"1999-11-05","grid":"VFJPRCNBU1RSTyNESE9XCk5PU0UjTUFSSU8jUkFDRQpOQUlMUE9MSVNII0FDVEkKI0xFVkkjRVRFI1RZS0VTCiNEUklMTFNFUkdFQU5UUwojIyNORUFUIyNFREdFIyMKRlJPRyNCQURHRSNFWUVTClJFViMjI0xPVSMjI0VMSQpBTEVDI1NLRUlOI09ET1IKIyNST01QIyNOT1VOIyMjClRVUk5PRlRIRVNDUkVXIwpFVklUQSNSSVYjTEFNRSMKTlVERSNNSUtFSEFNTUVSCk9MRVMjT1BFUkEjUEVETwpOQVNUI0NFREVEI1NUWUU="},{"title":"USA Today 11/08/99 \"COMBINATIONS\"","author":"By Charles Preston","date":"1999-11-08","grid":"QUxBUyNGQUxETyNESVJFCk1FTU8jQUxJRU4jRVZFTgpPVkVOI1NMT1BFI1RZUEUKS0lOR1NUT05UUklPIyMjCiMjIyNORVcjIyNEVUNBVApIQVJMQU4jUEFOT1JBTUEKQUxPT0YjVE9STyMjUlBNCk1DTEFVR0hMSU5HUk9VUApQT0wjI0xFQUQjUk9MTEUKRVZJTERPRVIjVkVORUVSClJFTkVFIyMjQkFCIyMjIwojIyNHQVNIT1VTRUdBTkcKTUVOVSNQQU5UUyNJRE9MCk9WVU0jRVZJVEEjRklWRQpEQVRFI0RFVEVSI1RNQU4="},{"title":"USA Today 11/09/99 \"MUSICAL MENAGE\"","author":"By Charles Preston","date":"1999-11-09","grid":"QU1JU0gjVEVYI0NBU1RTCkNPTkNPVVJTRSNBTExJTgpUSFJPV05BVFJPTUJPTkUKU0xFVyNSVUUjUEVTVEVSCiMjIyNUT00jU1RVI1NBRApET0dHWUJBR1BJUEUjIyMKRVVST1BFI1JPQyNYSU5HCkFTSURFI1RVVCNUVVRPUgpERU1PI01PTSNTQU1FREkKIyMjVFJVTVBFVE5BTUVTClNBTSNPUkIjWUFLIyMjIwpBVkVTVEEjSEVMI09TTE8KUElDQ09MT09GTElUVEVSCk9TQ0FSI0ZSVVNUUkFURQpST0FNUyNUQUwjU09SVFM="},{"title":"USA Today 11/10/99 \"METALLIC FILM\"","author":"By Charles Preston","date":"1999-11-10","grid":"I0dBU1RSSUMjQ09NQlMjCiNFU1RSQURBI09QT1JUTwojVEhFSVJPTkNVUlRBSU4KIyMjQUJFTCNBTlkjU0VDCkRBTktFIyNQSVQjRVNTRQpBVklTI01JRU4jVEFCIyMKREVDI1NBQVIjQ0FST0xFCkFSSyNUSU5TVEFSI1RJTApTVEVQT04jT0FTVCNUUkkKIyNMQVAjQU5URSNTTEFUCkVST1MjRU5BIyNNRUVTRQpST0QjRUxLI0FQRVIjIyMKU1RFRUxNQUdOT0xJQVMjClRPT1RMRSNBTk5FQUxTIwojU05FRVIjTU9TRUxMRSM="},{"title":"USA Today 11/11/99 \"A HARD PLACE\"","author":"By Charles Preston","date":"1999-11-11","grid":"VEFST1QjUkFNI0JPUkFICk9QRU5IT1VTRSNPUkFURQpOT1NUT05FVU5UVVJORUQKIyMjSFVFI0JBSUwjR0FHCkRVTkUjVEFTVEVEI0VTRQpJVkVSU09OIyMjRVJSRUQKREVTT1RPUyNQSVJPIyMjCiNBTkNPTkEjQU5EQ1JZIwojIyNLTkVFI1NIQUtJRVIKQVJJU0UjIyNIQU1CT05FClZFVCNDT05GQUIjT1NTTwpPVkEjSEFJTCNJU1QjIyMKV0lMTUFGTElOVFNUT05FCkVMSU9UI0VQSVNUT0xFUgpERUFOUyNTQVgjU01BWkU="},{"title":"USA Today 11/12/99 \"MENU TYPOS\"","author":"By Charles Preston","date":"1999-11-12","grid":"QVdBU0gjRkFDVCMjTEFQClNFVEFFI0lETEVTI0lSQQpQRUVLSU5HRFVDSyNWT1cKI0RFRVJFI0xFSEkjRVNFCiMjI1NFRVBFRCNFQVJFRApTRUMjU1JBIyNHUk9XIyMKQUNIRVMjREFTSSNST01FCkNISVAjRFVTVFMjVFJBWQpTT0xPI1JBS0UjQ0FTVEUKIyNFQ0NFIyNBTUEjVEVEClBBU0hBI01PREVSTiMjIwpVQ0EjQVJPVyNNSUFPVyMKU09VI01BSU5MT0JTVEVSCkFSQyNBR1JFRSNFQVRFTgpOTkUjI1NFUkUjU0xPUFM="},{"title":"USA Today 11/15/99 \"BABES\"","author":"By Charles Preston","date":"1999-11-15","grid":"QUxFQyNBVFJJUCNFR0FECkxBTE8jU0hBTkUjQU9ORQpVTlNVU1BFQ1RJTkdPTkUKSURFTlRJRlkjI09MREVSCiMjI1RBUlQjTEFORSMjIwpERUxFVEUjU09NRSNEQVIKT1RJUyMjI0NPTU8jT1dFClRIRVNVTFRBTk9GU1dBVApFRU4jUExVTSMjI0FTS0EKUkxTI1RCU1AjQVNMRUVQCiMjI1RBU0sjSURFRSMjIwpTVEVBSyMjSU5WQVNJVkUKUElHTEVUT0ZGSUxNRE9NCkFNT0sjSU5ORVMjQUxMSQpURVNTI01PSVJFI05ZRVQ="},{"title":"USA Today 11/16/99 \"ALL IN THE FAMILY\"","author":"By Charles Preston","date":"1999-11-16","grid":"RUxNI0hFQVJUUyNBTE1TClZJQSNBTExVUkUjUklPVApFTkQjU0lTVEVSS0VOTlkKUkVIQUIjT1NLQVIjREVMCiMjQVNFQSMjI1BJUkFURQpNT1RIRVJURVJFU0EjIyMKRU1UI05BUkRPI1NJVEFSCk5FRUQjTk9JU0UjRFJOTwpVTlJFRiNVVElDQSNPREQKIyMjQlJPVEhFUkxPVUlFCklOU1RFUCMjI1VNUFMjIwpORUUjUkVBQ1QjT0FTSVMKRkFUSEVSQlJPV04jRVJBCkVUVEEjQUJBVEVEI0FJTApST09NI1NBQk9UUyNVU0U="},{"title":"USA Today 11/17/99 \"``A\" LIST\"","author":"By Charles Preston","date":"1999-11-17","grid":"QkFMSSNRQVRBUiNRVU9ECkVYQU0jVUtBU0UjVVJEVQpURU1QI09STklTI0FHT04KQVNCRVNUT1MjT1dORVJTCiMjI0xPSU4jU0xBVCMjIwpIQVNTTEUjQVBFUklUSUYKQVBUI0lORkVSI1NDT05FCklSQVEjVEFSSVEjT1JDQQpGT1JVTSNTSVRVUCNUVVQKQU5USURPVEUjRUlERVJTCiMjI1NJTlMjVU5UTyMjIwpTSEVMVkUjQU5DSE9SRVQKTUFMSSNNVUxDSCNEQURPCk9MQU4jQU5JTEUjQUpBUgpHT05HI05JVEVSI0RBTUU="},{"title":"USA Today 11/18/99 \"POSITIONING\"","author":"By Charles Preston","date":"1999-11-18","grid":"TEFEUyNKQVZBI0FUVElDCkFMRUUjQUxBUiNUQUhPRQpJU0VFI0xPTkUjVFJBV0wKVE9QUFJPRkVTU0lPTkFMCiMjIyNPVVRTI09UVCMjIwpBTExBTlMjI1lPVSNTUEEKREVBTCNJTElFI0RFTEVECk1JRERMRU9GVEhFUk9BRApJR0xPTyNBU0lBI0lTTEUKVEhFI0JBRCMjSVRDSEVECiMjI0FTUCNTQVJJIyMjIwpTSU5LVE9USEVCT1RUT00KQU1PUkUjUkFSQSNPSElPCkdBVE9SI0VSSU4jV0VMTApBTUVOUyNTUEVEI05FU1Q="},{"title":"USA Today 11/19/99 \"DETECTIVE DEPICTORS\"","author":"By Charles Preston","date":"1999-11-19","grid":"V0FSUyNPSEFSQSNBQkVUCklERUEjV0FERVMjTEFNRQpUT01TRUxMRUNLI0FSQlMKQ1JVRUwjIyNUSUUjVE9UCkhFUyNTSEFST05HTEVTUwojIyNERVVDRSNHT09OUyMKT0RJRSNMRVNUI1NJREVCClJPTEwjQVJUSUUjVEVSSQpPR0xFRCNCT1JOI0VSU1QKI0VBVE9OI0NFREFSIyMjCktBVEVKQUNLU09OI1NUQQpBVEUjT1JSIyMjVE9QSUMKUkRBUyNST0dFUlNNSVRICk1PU1QjT05JT04jSVJBRQpBR0VEI1dFQU5TI1RFTlM="},{"title":"USA Today 11/22/99 \"SENSITIVE\"","author":"By Charles Preston","date":"1999-11-22","grid":"SE9PUCNNRUFERSNDSElUCkFNVVIjT1JCSVQjT0lOSwpUT1RPI1RPVUNIQU5ER08KU09PVEhFUyNURVNURUVTCiMjRkVBVCNUVUxMRSMjIwpCQVRDSCNFT00jRVhUUkEKQUxPVCNUQVUjREVUT1VSCkxPVSNUT1VDSFVQI1VORQpTRUNUT1IjSFVCI0FDVEEKQVNIRU4jQ09HI0VUSE9TCiMjI1JFTUFOI0FOVFMjIwpTVElSUlVQI1NQT1VURUQKTUlEQVNUT1VDSCNOT0dPCkVMRUMjRU5OVUkjRU5HUgpFTFNFI1NFQVRTI0RFU0s="},{"title":"USA Today 11/23/99 \"NAME PROPS\"","author":"By Charles Preston","date":"1999-11-23","grid":"UEFII0dBRUxTI09IQVJFCklSQSNBR1JFRSNMQU1CUwpMQVpZU1VTQU4jSU5VSVQKQUJFRSNFRUsjU09EUyMjCkZJTExTIyNBVEUjTUVBVAojQVNQQVJBR1VTI0lETEUKIyMjI1ZPVEVSUyNLTEVFClJFVFJFQVQjQklHRVlFUwpJU0FPI1NJTUlMRSMjIyMKRkFOUyNUUkFERU1BUksjCkZVWkUjRUVSIyNTQ0FNUwojI0FNT1IjSVJFI0VHQUwKQkFOQUwjU1RFVkVET1JFCkFGSVJFI1BBUEVSI1VURQpTVEFZUyNBTE9ORSNUU1A="},{"title":"USA Today 11/24/99 \"GIVING THANKS\"","author":"By Charles Preston","date":"1999-11-24","grid":"U1RBTVAjTUFTSyNCTUdTClBPTEFSI0FURUUjRVROQQpBQkVMSU5DT0xOI0ZSQVMKUkVTSVpFI1BMWU1PVVRICiMjIyNFU1QjI0FJUlMjIwpMT1ZFRCNIQU0jUkVIQUIKQUxPRSNNQVRVUkUjTVRBCldJTExJQU1CUkFERk9SRApPVkEjRFJFQU1UI0FSSUEKRkVUQUwjU1RVI0dSRUFUCiMjSU5FWiMjUkFFIyMjIwpQSUxHUklNUyNTTkVFUlMKUk9JTCNQVU1QS0lOUElFCkFOVEUjUExFQSNVTklPTgpNQVlTI09MRVMjU0VDVFM="},{"title":"USA Today 11/26/99 \"WHAT'S THE RUSH?\"","author":"By Charles Preston","date":"1999-11-26","grid":"U0FHRSNEQUNDQSNST1NTCkVTRUwjRUNMQVQjRUxJTwpST1RBI1NURVBMSVZFTFkKQlJBTkRPI0ZFQVIjR09BCiMjTUVFVCMjI05FVCMjIwojSE9URk9PVElUI09HRUUKVEFWIyMjWlVOSSNGT1JBCkFWRVMjQkFMS1MjVUZPUwpNRU9XI0VSTEUjIyNVU0UKRU5OQSNTS0VEQURETEUjCiMjI1BVUCMjI05BSUwjIwpQVEEjUk9CRSNPWVNURVIKUlVOTElLRU1BRCNDSVBPCk9UVE8jRUxJVEUjT0xFTwpEVVNUI05BUkVTI1NURU0="},{"title":"USA Today 11/29/99 \"FIVE ON THE DIAL\"","author":"By Charles Preston","date":"1999-11-29","grid":"RFVDVCNNQVVMI1JBR0VECkVDUlUjQUNSRSNBVFJJQQpCTFVFQ1JFU1RFREJJUkQKVEFYI0FHUkEjTElBTkVTCiMjI1NOT0IjUEFTVCMjIwpQRUFOVVQjTUFUSCNBRkMKRU5JQUMjRE9TRSNBUkxPClNUUklLRU9VVFNZTUJPTApLRUVMI1NORUUjQUJPVVQKWVJTI1RLT1MjU0tJUlRTCiMjI0ZSSVQjQ0hJVCMjIwpTSU1PT00jV0FSTSNKT1QKT0xEQ0xPVEhNRUFTVVJFClJJVkFMI1ZJRVcjUkFaRQpUQUlMUyNBUE9EI0FOT04="},{"title":"USA Today 11/30/99 \"ACADEMIA\"","author":"By Charles Preston","date":"1999-11-30","grid":"U0hBRCNBRkFSI09UQVJVClRBWEkjU09MTyNDQURFUwpVVEVQI0xJRVMjQVhJTEUKIyMjU1BFRUNIV1JJVEVSCk9OQVRFRSMjI1JJTlNFUwpUT1JJU1BFTExJTkcjIyMKVFJBQ1QjVEFJTkEjREFUCk9NU0sjU1VJTkcjU0lOTwpTQUgjQU5EUkUjV0lERU4KIyMjU1BFRURSRUFESU5HCkFTUElSRSMjI0FHRU5EQQpDSEVNSVNUUllTRVQjIyMKVE9QSUMjUk9PVCNSQUdBCk9WT0xPI0FMRE8jSUJFVApSRVNFVCNNRUFOI1BFTEU="},{"title":"USA Today 12/01/99 \"ALPHABET GROUP\"","author":"By Charles Preston","date":"1999-12-01","grid":"REFGVCNKQUJTI1NDT09UCk9ET1IjQUdVRSNMQVVERQpaRVJPI0NBUlRIT1JTRVMKRUxFViNLSU4jVVBQRVJTClNBWEVTI05JVFJFIyMjIwojI0FTSUYjTklMI1RJTEwKVVNNI0xBUkdFI0lORElBClBPUFNUSEVRVUVTVElPTgpUQUxMWSNTVVBSQSNPTkUKT0tFWSNGRUUjUkFGVCMjCiMjIyNCRVRTWSNDQUJJTgpBQ1RGT1IjVEFCI0xPVkUKUVVBUkFOVElORSNMQUlDClVSR0VTI1dPS0UjVFJFSwpBU1NFVCNJTlNUI09ERFM="},{"title":"USA Today 12/02/99 \"DUOS\"","author":"By Charles Preston","date":"1999-12-02","grid":"TUlTUyNJTExTI0hBVkVOCkVUT04jTUVBTCNPTElWRQpTRUxBI1BBUkEjUkVORVcKU01PS0VBTkRNSVJST1JTCiMjI0VYSVQjI05PVCMjIwpFTFMjVFJPVFRFUiNBUEUKTElORVIjI09BUiNBTUlTCk1FQVRBTkRQT1RBVE9FUwpPR1JFI1lFUyMjU0FOVEEKU0VFI1BMQVlFUlMjR0FZCiMjI0VMTyMjTUVFVCMjIwpGVVNTQU5ERkVBVEhFUlMKQUxJU1QjRUFSUyNPUkFMCklOU0VUI0VSR08jUklUQQpSQUlTRSNQRUVOI05FU1Q="},{"title":"USA Today 12/03/99 \"'TIS THE SEASON\"","author":"By Charles Preston","date":"1999-12-03","grid":"Qk9BUyMjSEFSTSNIRVJBCkxBTkVEI0FMT0UjQUxFWApPVFRFUiNTQURFI1JJREUKV0hJVEVDSFJJU1RNQVMjCiMjI09BUiMjTkVSTyMjIwpQQVMjTUVTSCMjQU5OTyMKQUxUIyNEQUlTI0RJQU5BClBFQUNFT05USEVFQVJUSApBUlJPVyNET09SIyNDT08KI1RFUkkjI05PUk0jU1BZCiMjI09OVVMjI09BVCMjIwojSklOR0xFQkVMTFJPQ0sKR0FMQSNUUk9ZI1RFVE9OCkVWRVIjUlVMRSNTQVRJRQpMQURZI0FNT1MjI1RPTkU="},{"title":"USA Today 12/06/99 \"THOUGHT FOR TODAY\"","author":"By Charles Preston","date":"1999-12-06","grid":"U1RBTkQjUkFOSSNBUkFNCkNPTkVZI0VNSVIjV0FORQpBRE9STiNHSU5PI0ZJR1MKTU9OREFZSVNBTiNVU0VTCiMjIyNNRU5TI0NFTEVSWQpBTFRPT05BI0ZMQVcjIyMKTU9PTlMjI0JFQVJBQkxFCk9HUkUjU1BFTkQjWUVBUgpSRUlTU1VFRCMjU1RFTk8KIyMjRVJNQSNERU5PVEVTCkNSQVZBVCNST01BIyMjIwpSQVJFI09GWU9VUkxJRkUKT0RJTiNUT0REI0xBVElOCldJTFQjQVJFQSNFVkVOVApESVNII0xBUkQjREFNRVM="},{"title":"USA Today 12/07/99 \"UPRISINGS\"","author":"By Charles Preston","date":"1999-12-07","grid":"R0FGRlMjTEFWQSNQTEVBClJFTElDI0FSSUQjTE9SRApBUkVOQSNDQVBFI0FDSUQKQk9YRVJSRUJFTExJT04jCiMjI0RFRVIjUkVJTiMjIwpOT00jU0xBTVMjU1RBUkUKT0hJTyNBVEUjR0xJREVTClRBWFBBWUVSU1JFVk9MVApFUlVQVFMjR09BI0VSSUUKREVQT1QjREVMSEkjRVRTCiMjI05JTkUjVkFOUyMjIwojVEhFQ0FJTkVNVVRJTlkKU0VFTiNJQ09OI1JPREVPClBFUlQjVkVOVCNFTUVFUgpBTUVTI0VST1MjU1BBREU="},{"title":"USA Today 12/08/99 \"FOREIGN CURRENCY\"","author":"By Charles Preston","date":"1999-12-08","grid":"UkFKQSNERVNLI0VEVUNFCk9NQU4jRUxPSSNOT1BBUgpDQVJESU5BTE1DR1dJUkU